query	query_seqname	query_start	target_seqname	target_start	target
KLKLDTLKKLGD	sp|P17372|C9L_VACCW	141	sp|Q96MT7|CFA44_HUMAN Cilia- and flagella-associated protein 44 OS=Homo sapiens OX=9606 GN=CFAP44 PE=1 SV=2	1391	KLKLDTQMKLSD
KLKLDTLKKLGD	sp|P17372|C9L_VACCW	141	tr|H0Y896|H0Y896_HUMAN Cilia- and flagella-associated protein 44 (Fragment) OS=Homo sapiens OX=9606 GN=CFAP44 PE=1 SV=1	12	KLKLDTQMKLSD
IMDINLSPKNFE	sp|P68438|RAP94_VACCW	19	sp|Q7L4P6|BEND5_HUMAN BEN domain-containing protein 5 OS=Homo sapiens OX=9606 GN=BEND5 PE=1 SV=1	401	IMDINKSCKNEE
VQSEYEEELKKD	sp|Q80HT9|KTHY_VACCW	171	tr|F5H039|F5H039_HUMAN Molybdopterin molybdenumtransferase OS=Homo sapiens OX=9606 GN=GPHN PE=1 SV=1	223	VQCEEEEEEKKD
VQSEYEEELKKD	sp|Q80HT9|KTHY_VACCW	171	tr|H0YJ30|H0YJ30_HUMAN Molybdopterin molybdenumtransferase (Fragment) OS=Homo sapiens OX=9606 GN=GPHN PE=1 SV=1	143	VQCEEEEEEKKD
VQSEYEEELKKD	sp|Q80HT9|KTHY_VACCW	171	sp|Q9NQX3|GEPH_HUMAN Gephyrin OS=Homo sapiens OX=9606 GN=GPHN PE=1 SV=1	210	VQCEEEEEEKKD
VQSEYEEELKKD	sp|Q80HT9|KTHY_VACCW	171	tr|G3V582|G3V582_HUMAN Molybdopterin molybdenumtransferase OS=Homo sapiens OX=9606 GN=GPHN PE=1 SV=1	192	VQCEEEEEEKKD
NGKLVRKLKDKL	sp|P07392|RP147_VACCW	112	sp|Q495M9|USH1G_HUMAN Usher syndrome type-1G protein OS=Homo sapiens OX=9606 GN=USH1G PE=1 SV=1	128	NPKLVGKLKDKA
INQILDEEFLNI	sp|P06440|P4B_VACCW	49	sp|Q8TAT5|NEIL3_HUMAN Endonuclease 8-like 3 OS=Homo sapiens OX=9606 GN=NEIL3 PE=1 SV=3	408	QNQILDEEFQNS
GKLFAKSRRLAE	sp|P26670|3BHS_VACCW	144	tr|A0A0C4DFM2|A0A0C4DFM2_HUMAN HCG1643764, isoform CRA_b OS=Homo sapiens OX=9606 GN=ZNF574 PE=1 SV=1	890	GKAFAISMRLAE
GKLFAKSRRLAE	sp|P26670|3BHS_VACCW	144	sp|Q6ZN55|ZN574_HUMAN Zinc finger protein 574 OS=Homo sapiens OX=9606 GN=ZNF574 PE=1 SV=2	800	GKAFAISMRLAE
PVQKTSSEFSEQ	sp|P68617|A33_VACCW	158	sp|Q6KC79|NIPBL_HUMAN Nipped-B-like protein OS=Homo sapiens OX=9606 GN=NIPBL PE=1 SV=2	2727	VVQKTSSGFSVQ
GNILIYQFPDAT	sp|Q01221|B17_VACCW	185	sp|Q9UQP3|TENN_HUMAN Tenascin-N OS=Homo sapiens OX=9606 GN=TNN PE=1 SV=2	1002	GYILTYQFPDGT
GNILIYQFPDAT	sp|Q01221|B17_VACCW	185	tr|A0A087WXT0|A0A087WXT0_HUMAN Tenascin-N OS=Homo sapiens OX=9606 GN=TNN PE=1 SV=1	825	GYILTYQFPDGT
GNILIYQFPDAT	sp|Q01221|B17_VACCW	185	tr|A0A087WXC4|A0A087WXC4_HUMAN Tenascin-N OS=Homo sapiens OX=9606 GN=TNN PE=1 SV=1	825	GYILTYQFPDGT
SARLVFNSVDIN	sp|P68440|D13_VACCW	504	sp|Q8WZ42|TITIN_HUMAN Titin OS=Homo sapiens OX=9606 GN=TTN PE=1 SV=4	8942	VATLVFNQVDIN
SARLVFNSVDIN	sp|P68440|D13_VACCW	504	tr|A0A0A0MTS7|A0A0A0MTS7_HUMAN Titin OS=Homo sapiens OX=9606 GN=TTN PE=1 SV=1	9259	VATLVFNQVDIN
LPGSLLMYATYL	sp|P12924|I5_VACCW	61	sp|P0DP91|ERPG3_HUMAN Chimeric ERCC6-PGBD3 protein OS=Homo sapiens OX=9606 GN=ERCC6 PE=1 SV=1	521	LPGSLLHTAAYL
LPGSLLMYATYL	sp|P12924|I5_VACCW	61	sp|Q8N328|PGBD3_HUMAN PiggyBac transposable element-derived protein 3 OS=Homo sapiens OX=9606 GN=PGBD3 PE=1 SV=3	53	LPGSLLHTAAYL
STGVVFGEDMVS	sp|P04308|ETF1_VACCW	310	sp|Q8TDV2|GP148_HUMAN Probable G-protein coupled receptor 148 OS=Homo sapiens OX=9606 GN=GPR148 PE=1 SV=2	275	STGVVFSLDMVL
EFLSEKDDKFIL	sp|P16272|DNLI_VACCW	29	tr|A0A6Q8PGM4|A0A6Q8PGM4_HUMAN UDP-glucuronic acid decarboxylase 1 (Fragment) OS=Homo sapiens OX=9606 GN=UXS1 PE=1 SV=1	26	KFLSEKDRKRIL
EFLSEKDDKFIL	sp|P16272|DNLI_VACCW	29	tr|C9JW33|C9JW33_HUMAN UDP-glucuronic acid decarboxylase 1 (Fragment) OS=Homo sapiens OX=9606 GN=UXS1 PE=1 SV=1	24	KFLSEKDRKRIL
EFLSEKDDKFIL	sp|P16272|DNLI_VACCW	29	sp|Q8NBZ7|UXS1_HUMAN UDP-glucuronic acid decarboxylase 1 OS=Homo sapiens OX=9606 GN=UXS1 PE=1 SV=1	81	KFLSEKDRKRIL
EKDADFNTLLDD	sp|Q89121|VPK2_VACCW	386	tr|Q5TCH6|Q5TCH6_HUMAN Meiotic recombination protein SPO11 (Fragment) OS=Homo sapiens OX=9606 GN=SPO11 PE=3 SV=2	200	EKDATFQRLLDD
EKDADFNTLLDD	sp|Q89121|VPK2_VACCW	386	tr|Q5TCH7|Q5TCH7_HUMAN Meiotic recombination protein SPO11 OS=Homo sapiens OX=9606 GN=SPO11 PE=3 SV=1	182	EKDATFQRLLDD
EKDADFNTLLDD	sp|Q89121|VPK2_VACCW	386	sp|Q9Y5K1|SPO11_HUMAN Meiotic recombination protein SPO11 OS=Homo sapiens OX=9606 GN=SPO11 PE=1 SV=1	224	EKDATFQRLLDD
EKDADFNTLLDD	sp|Q89121|VPK2_VACCW	386	tr|H0YCK9|H0YCK9_HUMAN Meiotic recombination protein SPO11 (Fragment) OS=Homo sapiens OX=9606 GN=SPO11 PE=4 SV=1	54	EKDATFQRLLDD
GMHSGMSGGVHS	sp|P17356|V018_VACCW	44	tr|K7EQQ3|K7EQQ3_HUMAN Keratin, type I cytoskeletal 9 OS=Homo sapiens OX=9606 GN=KRT9 PE=1 SV=1	307	GGHSGGSGGGHS
GMHSGMSGGVHS	sp|P17356|V018_VACCW	44	sp|P35527|K1C9_HUMAN Keratin, type I cytoskeletal 9 OS=Homo sapiens OX=9606 GN=KRT9 PE=1 SV=3	540	GGHSGGSGGGHS
LMFLIIIYLFPS	sp|P21606|E5_VACCW	135	tr|H3BS91|H3BS91_HUMAN ADP-ribosylation factor-like protein 6-interacting protein 1 OS=Homo sapiens OX=9606 GN=ARL6IP1 PE=4 SV=1	54	LVFLIIYYLDPS
LMFLIIIYLFPS	sp|P21606|E5_VACCW	135	tr|H3BN98|H3BN98_HUMAN 40S ribosomal protein S15a (Fragment) OS=Homo sapiens OX=9606 PE=3 SV=2	54	LVFLIIYYLDPS
LMFLIIIYLFPS	sp|P21606|E5_VACCW	135	sp|Q15041|AR6P1_HUMAN ADP-ribosylation factor-like protein 6-interacting protein 1 OS=Homo sapiens OX=9606 GN=ARL6IP1 PE=1 SV=2	54	LVFLIIYYLDPS
LSQAIIKQYYKR	sp|Q80HX0|G5_VACCW	271	sp|Q9NQS7|INCE_HUMAN Inner centromere protein OS=Homo sapiens OX=9606 GN=INCENP PE=1 SV=3	851	LSQAIIHQYYHP
KIKEKSFAKLKR	sp|P68710|A20_VACCW	257	sp|Q06190|P2R3A_HUMAN Serine/threonine-protein phosphatase 2A regulatory subunit B'' subunit alpha OS=Homo sapiens OX=9606 GN=PPP2R3A PE=1 SV=1	123	KIKEFSFEKLKN
KIKEKSFAKLKR	sp|P68710|A20_VACCW	257	tr|J3KPI1|J3KPI1_HUMAN Selenocysteine insertion sequence-binding protein 2-like (Fragment) OS=Homo sapiens OX=9606 GN=SECISBP2L PE=1 SV=8	322	KGKEKEIAKLKR
KIKEKSFAKLKR	sp|P68710|A20_VACCW	257	sp|Q93073|SBP2L_HUMAN Selenocysteine insertion sequence-binding protein 2-like OS=Homo sapiens OX=9606 GN=SECISBP2L PE=1 SV=3	560	KGKEKEIAKLKR
NSERPVSLTLNG	sp|P18377|K4_VACCW	186	sp|Q9UMF0|ICAM5_HUMAN Intercellular adhesion molecule 5 OS=Homo sapiens OX=9606 GN=ICAM5 PE=1 SV=3	242	GSERPVSCTLDG
SLARTLYTKSLA	sp|P24768|KBTB1_VACCW	215	sp|Q96NM4|TOX2_HUMAN TOX high mobility group box family member 2 OS=Homo sapiens OX=9606 GN=TOX2 PE=1 SV=2	354	SLARTLGSKSLL
EIRVLYSNVDTT	sp|P68438|RAP94_VACCW	54	sp|O15117|FYB1_HUMAN FYN-binding protein 1 OS=Homo sapiens OX=9606 GN=FYB1 PE=1 SV=2	704	EIRVLYSTKVTT
LKFTIFISWVEP	sp|P07392|RP147_VACCW	1067	sp|Q9NYR8|RDH8_HUMAN Retinol dehydrogenase 8 OS=Homo sapiens OX=9606 GN=RDH8 PE=1 SV=1	174	LQFNIFISLVEP
LKFTIFISWVEP	sp|P07392|RP147_VACCW	1067	tr|K7ELF7|K7ELF7_HUMAN Retinol dehydrogenase OS=Homo sapiens OX=9606 GN=RDH8 PE=1 SV=1	194	LQFNIFISLVEP
KRDLSRDRSRLL	sp|Q80HU9|ATI4_VACCW	130	tr|A0A3B3IRV6|A0A3B3IRV6_HUMAN Tight junction protein ZO-2 (Fragment) OS=Homo sapiens OX=9606 GN=TJP2 PE=1 SV=1	165	ERDLSRDRSRGR
KRDLSRDRSRLL	sp|Q80HU9|ATI4_VACCW	130	tr|A0A3B3ISZ5|A0A3B3ISZ5_HUMAN Tight junction protein ZO-2 OS=Homo sapiens OX=9606 GN=TJP2 PE=1 SV=1	188	ERDLSRDRSRGR
KRDLSRDRSRLL	sp|Q80HU9|ATI4_VACCW	130	tr|A0A3B3ISF1|A0A3B3ISF1_HUMAN Tight junction protein ZO-2 OS=Homo sapiens OX=9606 GN=TJP2 PE=1 SV=1	188	ERDLSRDRSRGR
KRDLSRDRSRLL	sp|Q80HU9|ATI4_VACCW	130	tr|A0A3B3IU51|A0A3B3IU51_HUMAN Tight junction protein ZO-2 OS=Homo sapiens OX=9606 GN=TJP2 PE=1 SV=1	192	ERDLSRDRSRGR
KRDLSRDRSRLL	sp|Q80HU9|ATI4_VACCW	130	tr|A0A3B3IRI3|A0A3B3IRI3_HUMAN Tight junction protein ZO-2 OS=Homo sapiens OX=9606 GN=TJP2 PE=1 SV=1	165	ERDLSRDRSRGR
KRDLSRDRSRLL	sp|Q80HU9|ATI4_VACCW	130	tr|A0A1B0GTW1|A0A1B0GTW1_HUMAN Tight junction protein ZO-2 OS=Homo sapiens OX=9606 GN=TJP2 PE=1 SV=1	247	ERDLSRDRSRGR
KRDLSRDRSRLL	sp|Q80HU9|ATI4_VACCW	130	sp|Q9UDY2|ZO2_HUMAN Tight junction protein ZO-2 OS=Homo sapiens OX=9606 GN=TJP2 PE=1 SV=2	188	ERDLSRDRSRGR
KRDLSRDRSRLL	sp|Q80HU9|ATI4_VACCW	130	tr|A0A3B3ITE1|A0A3B3ITE1_HUMAN Tight junction protein ZO-2 (Fragment) OS=Homo sapiens OX=9606 GN=TJP2 PE=1 SV=1	189	ERDLSRDRSRGR
KRDLSRDRSRLL	sp|Q80HU9|ATI4_VACCW	130	tr|A0A2R8YDH4|A0A2R8YDH4_HUMAN Uncharacterized protein OS=Homo sapiens OX=9606 PE=1 SV=1	317	ERDLSRDRSRGR
LCPKHKKSLEIS	sp|P04305|D5_VACCW	384	sp|Q0VDD8|DYH14_HUMAN Dynein heavy chain 14, axonemal OS=Homo sapiens OX=9606 GN=DNAH14 PE=2 SV=3	589	LLPKAKKSKEIS
LLRVRRKFAVGV	sp|P07614|L3_VACCW	266	sp|Q8N9V2|TRIML_HUMAN Probable E3 ubiquitin-protein ligase TRIML1 OS=Homo sapiens OX=9606 GN=TRIML1 PE=2 SV=1	145	LLRVRRKEAQAV
SSSIFSRKSLTI	sp|Q76ZP7|RP132_VACCW	917	sp|Q8IW70|T151B_HUMAN Transmembrane protein 151B OS=Homo sapiens OX=9606 GN=TMEM151B PE=2 SV=2	442	SSSIFSRSALSI
GGGGVWGGGSSS	sp|P17356|V018_VACCW	32	sp|Q8IXZ3|SP8_HUMAN Transcription factor Sp8 OS=Homo sapiens OX=9606 GN=SP8 PE=1 SV=3	139	GGGGGGGGGSSA
GGGGVWGGGSSS	sp|P17356|V018_VACCW	32	sp|P31277|HXD11_HUMAN Homeobox protein Hox-D11 OS=Homo sapiens OX=9606 GN=HOXD11 PE=3 SV=3	79	GGGGSAGGGSSG
GGGGVWGGGSSS	sp|P17356|V018_VACCW	32	sp|P23490|LORI_HUMAN Loricrin OS=Homo sapiens OX=9606 GN=LORICRIN PE=1 SV=2	267	GGGSVCGGGSSG
GGGGVWGGGSSS	sp|P17356|V018_VACCW	32	sp|Q5VUJ6|LRCH2_HUMAN Leucine-rich repeat and calponin homology domain-containing protein 2 OS=Homo sapiens OX=9606 GN=LRCH2 PE=1 SV=2	12	GGGGCGGGGSSG
GGGGVWGGGSSS	sp|P17356|V018_VACCW	32	sp|Q9BZ72|PITM2_HUMAN Membrane-associated phosphatidylinositol transfer protein 2 OS=Homo sapiens OX=9606 GN=PITPNM2 PE=1 SV=1	614	GGGGGGGGGSSG
GGGGVWGGGSSS	sp|P17356|V018_VACCW	32	sp|Q12906|ILF3_HUMAN Interleukin enhancer-binding factor 3 OS=Homo sapiens OX=9606 GN=ILF3 PE=1 SV=3	701	GGGGGGGGGSSG
GGGGVWGGGSSS	sp|P17356|V018_VACCW	32	tr|A0A1B0GVI3|A0A1B0GVI3_HUMAN Keratin, type I cytoskeletal 10 (Fragment) OS=Homo sapiens OX=9606 GN=KRT10 PE=1 SV=1	20	GGGGGYGGGSSG
GGGGVWGGGSSS	sp|P17356|V018_VACCW	32	sp|P13645|K1C10_HUMAN Keratin, type I cytoskeletal 10 OS=Homo sapiens OX=9606 GN=KRT10 PE=1 SV=6	537	GGGGGYGGGSSG
GGGGVWGGGSSS	sp|P17356|V018_VACCW	32	sp|Q92908|GATA6_HUMAN Transcription factor GATA-6 OS=Homo sapiens OX=9606 GN=GATA6 PE=1 SV=2	289	GAGGVSGGGSSL
GGGGVWGGGSSS	sp|P17356|V018_VACCW	32	sp|P09651|ROA1_HUMAN Heterogeneous nuclear ribonucleoprotein A1 OS=Homo sapiens OX=9606 GN=HNRNPA1 PE=1 SV=5	293	GGGGGFGGGSGS
GGGGVWGGGSSS	sp|P17356|V018_VACCW	32	sp|Q9ULM3|YETS2_HUMAN YEATS domain-containing protein 2 OS=Homo sapiens OX=9606 GN=YEATS2 PE=1 SV=2	806	GGGGGGGGGSGS
GGGGVWGGGSSS	sp|P17356|V018_VACCW	32	sp|P22670|RFX1_HUMAN MHC class II regulatory factor RFX1 OS=Homo sapiens OX=9606 GN=RFX1 PE=1 SV=2	391	GGGGGGGGGSGS
GGGGVWGGGSSS	sp|P17356|V018_VACCW	32	sp|P18146|EGR1_HUMAN Early growth response protein 1 OS=Homo sapiens OX=9606 GN=EGR1 PE=1 SV=1	68	GGGGGGGGGSNS
GGGGVWGGGSSS	sp|P17356|V018_VACCW	32	sp|Q8IV03|LUR1L_HUMAN Leucine rich adaptor protein 1-like OS=Homo sapiens OX=9606 GN=LURAP1L PE=1 SV=2	50	GGGGGGGGGCSS
GGGGVWGGGSSS	sp|P17356|V018_VACCW	32	sp|Q8NHW3|MAFA_HUMAN Transcription factor MafA OS=Homo sapiens OX=9606 GN=MAFA PE=1 SV=2	77	GGGGAGGGGGSS
GGGGVWGGGSSS	sp|P17356|V018_VACCW	32	sp|Q15672|TWST1_HUMAN Twist-related protein 1 OS=Homo sapiens OX=9606 GN=TWIST1 PE=1 SV=1	83	GGGGAGGGGGSS
GGGGVWGGGSSS	sp|P17356|V018_VACCW	32	tr|H7BY00|H7BY00_HUMAN Twist-related protein 1 (Fragment) OS=Homo sapiens OX=9606 GN=TWIST1 PE=1 SV=1	16	GGGGAGGGGGSS
GGGGVWGGGSSS	sp|P17356|V018_VACCW	32	sp|Q8IXZ3|SP8_HUMAN Transcription factor Sp8 OS=Homo sapiens OX=9606 GN=SP8 PE=1 SV=3	138	GGGGGGGGGGSS
GGGGVWGGGSSS	sp|P17356|V018_VACCW	32	sp|Q9BZ72|PITM2_HUMAN Membrane-associated phosphatidylinositol transfer protein 2 OS=Homo sapiens OX=9606 GN=PITPNM2 PE=1 SV=1	613	GGGGGGGGGGSS
GGGGVWGGGSSS	sp|P17356|V018_VACCW	32	sp|Q9HCS4|TF7L1_HUMAN Transcription factor 7-like 1 OS=Homo sapiens OX=9606 GN=TCF7L1 PE=2 SV=1	11	GGGGSGGGGGSS
GGGGVWGGGSSS	sp|P17356|V018_VACCW	32	sp|Q9UI36|DACH1_HUMAN Dachshund homolog 1 OS=Homo sapiens OX=9606 GN=DACH1 PE=1 SV=4	78	GGGGSGGGGGSS
GGGGVWGGGSSS	sp|P17356|V018_VACCW	32	tr|A0A0G2JNJ7|A0A0G2JNJ7_HUMAN CCR4-NOT transcription complex subunit 3 (Fragment) OS=Homo sapiens OX=9606 GN=CNOT3 PE=1 SV=1	320	GGGGGSGGGGSS
GGGGVWGGGSSS	sp|P17356|V018_VACCW	32	tr|H7C148|H7C148_HUMAN CCR4-NOT transcription complex subunit 3 (Fragment) OS=Homo sapiens OX=9606 GN=CNOT3 PE=1 SV=2	399	GGGGGSGGGGSS
GGGGVWGGGSSS	sp|P17356|V018_VACCW	32	sp|O75175|CNOT3_HUMAN CCR4-NOT transcription complex subunit 3 OS=Homo sapiens OX=9606 GN=CNOT3 PE=1 SV=1	398	GGGGGSGGGGSS
GGGGVWGGGSSS	sp|P17356|V018_VACCW	32	tr|H7C3F5|H7C3F5_HUMAN CCR4-NOT transcription complex subunit 3 OS=Homo sapiens OX=9606 GN=CNOT3 PE=1 SV=2	217	GGGGGSGGGGSS
GGGGVWGGGSSS	sp|P17356|V018_VACCW	32	tr|A0A2H2FJL5|A0A2H2FJL5_HUMAN CCR4-NOT transcription complex subunit 3 OS=Homo sapiens OX=9606 GN=CNOT3 PE=1 SV=1	217	GGGGGSGGGGSS
GGGGVWGGGSSS	sp|P17356|V018_VACCW	32	tr|B7Z6J7|B7Z6J7_HUMAN CCR4-NOT transcription complex subunit 3 OS=Homo sapiens OX=9606 GN=CNOT3 PE=1 SV=1	398	GGGGGSGGGGSS
GGGGVWGGGSSS	sp|P17356|V018_VACCW	32	sp|Q9BZ72|PITM2_HUMAN Membrane-associated phosphatidylinositol transfer protein 2 OS=Homo sapiens OX=9606 GN=PITPNM2 PE=1 SV=1	619	GGGGSSGGGGSS
GGGGVWGGGSSS	sp|P17356|V018_VACCW	32	sp|Q12837|PO4F2_HUMAN POU domain, class 4, transcription factor 2 OS=Homo sapiens OX=9606 GN=POU4F2 PE=1 SV=2	60	GGGGGGGGGRSS
GGGGVWGGGSSS	sp|P17356|V018_VACCW	32	sp|Q8IV03|LUR1L_HUMAN Leucine rich adaptor protein 1-like OS=Homo sapiens OX=9606 GN=LURAP1L PE=1 SV=2	51	GGGGGGGGCSSS
GGGGVWGGGSSS	sp|P17356|V018_VACCW	32	sp|Q15672|TWST1_HUMAN Twist-related protein 1 OS=Homo sapiens OX=9606 GN=TWIST1 PE=1 SV=1	84	GGGAGGGGGSSS
GGGGVWGGGSSS	sp|P17356|V018_VACCW	32	tr|H7BY00|H7BY00_HUMAN Twist-related protein 1 (Fragment) OS=Homo sapiens OX=9606 GN=TWIST1 PE=1 SV=1	17	GGGAGGGGGSSS
GGGGVWGGGSSS	sp|P17356|V018_VACCW	32	sp|Q9HCJ5|ZSWM6_HUMAN Zinc finger SWIM domain-containing protein 6 OS=Homo sapiens OX=9606 GN=ZSWIM6 PE=2 SV=2	146	GAGGGGGGGSSS
GGGGVWGGGSSS	sp|P17356|V018_VACCW	32	sp|Q8NFJ8|BHE22_HUMAN Class E basic helix-loop-helix protein 22 OS=Homo sapiens OX=9606 GN=BHLHE22 PE=2 SV=1	199	GLGGGGGGGSSS
GGGGVWGGGSSS	sp|P17356|V018_VACCW	32	tr|G3V1X1|G3V1X1_HUMAN Proline/serine-rich coiled-coil 2, isoform CRA_a OS=Homo sapiens OX=9606 GN=ZFC3H1 PE=1 SV=1	63	GGGSGGGGGSSS
GGGGVWGGGSSS	sp|P17356|V018_VACCW	32	sp|O60293|ZC3H1_HUMAN Zinc finger C3H1 domain-containing protein OS=Homo sapiens OX=9606 GN=ZFC3H1 PE=1 SV=3	63	GGGSGGGGGSSS
GGGGVWGGGSSS	sp|P17356|V018_VACCW	32	tr|A0A0G2JNJ7|A0A0G2JNJ7_HUMAN CCR4-NOT transcription complex subunit 3 (Fragment) OS=Homo sapiens OX=9606 GN=CNOT3 PE=1 SV=1	321	GGGGSGGGGSSS
GGGGVWGGGSSS	sp|P17356|V018_VACCW	32	tr|H7C148|H7C148_HUMAN CCR4-NOT transcription complex subunit 3 (Fragment) OS=Homo sapiens OX=9606 GN=CNOT3 PE=1 SV=2	400	GGGGSGGGGSSS
GGGGVWGGGSSS	sp|P17356|V018_VACCW	32	sp|O75175|CNOT3_HUMAN CCR4-NOT transcription complex subunit 3 OS=Homo sapiens OX=9606 GN=CNOT3 PE=1 SV=1	399	GGGGSGGGGSSS
GGGGVWGGGSSS	sp|P17356|V018_VACCW	32	tr|H7C3F5|H7C3F5_HUMAN CCR4-NOT transcription complex subunit 3 OS=Homo sapiens OX=9606 GN=CNOT3 PE=1 SV=2	218	GGGGSGGGGSSS
GGGGVWGGGSSS	sp|P17356|V018_VACCW	32	tr|A0A2H2FJL5|A0A2H2FJL5_HUMAN CCR4-NOT transcription complex subunit 3 OS=Homo sapiens OX=9606 GN=CNOT3 PE=1 SV=1	218	GGGGSGGGGSSS
GGGGVWGGGSSS	sp|P17356|V018_VACCW	32	tr|B7Z6J7|B7Z6J7_HUMAN CCR4-NOT transcription complex subunit 3 OS=Homo sapiens OX=9606 GN=CNOT3 PE=1 SV=1	399	GGGGSGGGGSSS
GGGGVWGGGSSS	sp|P17356|V018_VACCW	32	sp|P35908|K22E_HUMAN Keratin, type II cytoskeletal 2 epidermal OS=Homo sapiens OX=9606 GN=KRT2 PE=1 SV=2	610	GGYGSGGGGSSS
GGGGVWGGGSSS	sp|P17356|V018_VACCW	32	tr|A0A087WYA1|A0A087WYA1_HUMAN Unconventional myosin-XV OS=Homo sapiens OX=9606 GN=MYO15A PE=1 SV=1	2417	KGGGQPGGGSSS
GGGGVWGGGSSS	sp|P17356|V018_VACCW	32	sp|Q9UKN7|MYO15_HUMAN Unconventional myosin-XV OS=Homo sapiens OX=9606 GN=MYO15A PE=1 SV=2	2417	KGGGQPGGGSSS
GGGGVWGGGSSS	sp|P17356|V018_VACCW	32	tr|A0A1B0GVI3|A0A1B0GVI3_HUMAN Keratin, type I cytoskeletal 10 (Fragment) OS=Homo sapiens OX=9606 GN=KRT10 PE=1 SV=1	25	YGGGSSGGGSSS
GGGGVWGGGSSS	sp|P17356|V018_VACCW	32	sp|P13645|K1C10_HUMAN Keratin, type I cytoskeletal 10 OS=Homo sapiens OX=9606 GN=KRT10 PE=1 SV=6	542	YGGGSSGGGSSS
GGGGVWGGGSSS	sp|P17356|V018_VACCW	32	tr|A0A0J9YW81|A0A0J9YW81_HUMAN Small conductance calcium-activated potassium channel protein 2 (Fragment) OS=Homo sapiens OX=9606 GN=KCNN2 PE=1 SV=2	107	GGGGGSGHGSSS
GGGGVWGGGSSS	sp|P17356|V018_VACCW	32	sp|Q9H2S1|KCNN2_HUMAN Small conductance calcium-activated potassium channel protein 2 OS=Homo sapiens OX=9606 GN=KCNN2 PE=1 SV=2	94	GGGGGSGHGSSS
GGGGVWGGGSSS	sp|P17356|V018_VACCW	32	tr|A0A3F2YNY5|A0A3F2YNY5_HUMAN Small conductance calcium-activated potassium channel protein 2 OS=Homo sapiens OX=9606 GN=KCNN2 PE=1 SV=1	372	GGGGGSGHGSSS
GGGGVWGGGSSS	sp|P17356|V018_VACCW	32	tr|A0A669KBH3|A0A669KBH3_HUMAN Small conductance calcium-activated potassium channel protein 2 OS=Homo sapiens OX=9606 GN=KCNN2 PE=1 SV=1	306	GGGGGSGHGSSS
GGGGVWGGGSSS	sp|P17356|V018_VACCW	32	sp|Q96CX2|KCD12_HUMAN BTB/POZ domain-containing protein KCTD12 OS=Homo sapiens OX=9606 GN=KCTD12 PE=1 SV=1	13	GGGGGGGSGSSS
GGGGVWGGGSSS	sp|P17356|V018_VACCW	32	sp|Q12837|PO4F2_HUMAN POU domain, class 4, transcription factor 2 OS=Homo sapiens OX=9606 GN=POU4F2 PE=1 SV=2	61	GGGGGGGGRSSS
GGGGVWGGGSSS	sp|P17356|V018_VACCW	32	tr|H0YLQ3|H0YLQ3_HUMAN Ankyrin repeat domain-containing protein 17 (Fragment) OS=Homo sapiens OX=9606 GN=ANKRD17 PE=1 SV=1	102	GGGGGGGGGTSS
GGGGVWGGGSSS	sp|P17356|V018_VACCW	32	sp|O75179|ANR17_HUMAN Ankyrin repeat domain-containing protein 17 OS=Homo sapiens OX=9606 GN=ANKRD17 PE=1 SV=3	102	GGGGGGGGGTSS
GGGGVWGGGSSS	sp|P17356|V018_VACCW	32	tr|A0A1W2PQ15|A0A1W2PQ15_HUMAN Ankyrin repeat domain-containing protein 17 OS=Homo sapiens OX=9606 GN=ANKRD17 PE=1 SV=1	102	GGGGGGGGGTSS
GGGGVWGGGSSS	sp|P17356|V018_VACCW	32	sp|Q96F45|ZN503_HUMAN Zinc finger protein 503 OS=Homo sapiens OX=9606 GN=ZNF503 PE=1 SV=1	196	GGGGGGGGGVSS
GGGGVWGGGSSS	sp|P17356|V018_VACCW	32	sp|Q9HCJ5|ZSWM6_HUMAN Zinc finger SWIM domain-containing protein 6 OS=Homo sapiens OX=9606 GN=ZSWIM6 PE=2 SV=2	29	GGGGGAGGGYSS
HERDLCDVVITS	sp|Q01219|A51_VACCW	116	sp|Q8IZU8|DSEL_HUMAN Dermatan-sulfate epimerase-like protein OS=Homo sapiens OX=9606 GN=DSEL PE=2 SV=2	848	HHMDLPDVVITS
KHRVLEEAGADL	sp|P24361|F9_VACCW	82	tr|K7EQH6|K7EQH6_HUMAN Keratin, type I cytoskeletal 13 (Fragment) OS=Homo sapiens OX=9606 GN=KRT13 PE=1 SV=1	121	KVRALEEANADL
KHRVLEEAGADL	sp|P24361|F9_VACCW	82	sp|P19012|K1C15_HUMAN Keratin, type I cytoskeletal 15 OS=Homo sapiens OX=9606 GN=KRT15 PE=1 SV=3	122	KVRALEEANADL
KHRVLEEAGADL	sp|P24361|F9_VACCW	82	tr|K7EMD9|K7EMD9_HUMAN Keratin, type I cytoskeletal 13 (Fragment) OS=Homo sapiens OX=9606 GN=KRT13 PE=1 SV=1	14	KVRALEEANADL
KHRVLEEAGADL	sp|P24361|F9_VACCW	82	tr|K7ERE3|K7ERE3_HUMAN Keratin, type I cytoskeletal 13 OS=Homo sapiens OX=9606 GN=KRT13 PE=1 SV=1	121	KVRALEEANADL
KHRVLEEAGADL	sp|P24361|F9_VACCW	82	sp|P13646|K1C13_HUMAN Keratin, type I cytoskeletal 13 OS=Homo sapiens OX=9606 GN=KRT13 PE=1 SV=4	121	KVRALEEANADL
KHRVLEEAGADL	sp|P24361|F9_VACCW	82	sp|P02533|K1C14_HUMAN Keratin, type I cytoskeletal 14 OS=Homo sapiens OX=9606 GN=KRT14 PE=1 SV=4	132	KVRALEEANADL
KHRVLEEAGADL	sp|P24361|F9_VACCW	82	sp|P08779|K1C16_HUMAN Keratin, type I cytoskeletal 16 OS=Homo sapiens OX=9606 GN=KRT16 PE=1 SV=4	134	KVRALEEANADL
LDVITLASLKSR	sp|P04298|MCEL_VACCW	143	sp|Q96E22|NGBR_HUMAN Dehydrodolichyl diphosphate synthase complex subunit NUS1 OS=Homo sapiens OX=9606 GN=NUS1 PE=1 SV=1	221	LDVDTLASLLSS
PFVPSFNIEVRL	sp|P07617|MCE_VACCW	199	sp|O43164|PJA2_HUMAN E3 ubiquitin-protein ligase Praja-2 OS=Homo sapiens OX=9606 GN=PJA2 PE=1 SV=4	217	PPVPSFNCEVRD
NEEFLGTSYKCK	sp|P25213|B18_VACCW	323	sp|Q63HK5|TSH3_HUMAN Teashirt homolog 3 OS=Homo sapiens OX=9606 GN=TSHZ3 PE=1 SV=2	1033	PEEDLGTSYQCK
ETYRRDLEQLKK	sp|Q80HU9|ATI4_VACCW	187	sp|Q7Z7B0|FLIP1_HUMAN Filamin-A-interacting protein 1 OS=Homo sapiens OX=9606 GN=FILIP1 PE=1 SV=1	160	ETYRRMLEQLLL
ETYRRDLEQLKK	sp|Q80HU9|ATI4_VACCW	187	tr|A0A075B6G6|A0A075B6G6_HUMAN Filamin A interacting protein 1, isoform CRA_c OS=Homo sapiens OX=9606 GN=FILIP1 PE=1 SV=1	61	ETYRRMLEQLLL
ISDTIEGSSISV	sp|Q805H7|C23L_VACCW	105	sp|Q9C0F0|ASXL3_HUMAN Putative Polycomb group protein ASXL3 OS=Homo sapiens OX=9606 GN=ASXL3 PE=2 SV=3	1305	ISATTEGSSISS
IPKSLYLISIPT	sp|P18377|K4_VACCW	198	tr|C9JG08|C9JG08_HUMAN Uncharacterized protein C2orf16 OS=Homo sapiens OX=9606 GN=C2orf16 PE=1 SV=2	3547	IPKSANLISIPI
IPKSLYLISIPT	sp|P18377|K4_VACCW	198	sp|Q68DN1|CB016_HUMAN Uncharacterized protein C2orf16 OS=Homo sapiens OX=9606 GN=C2orf16 PE=2 SV=3	143	IPKSANLISIPI
KVVLNFAMEIQT	sp|P68438|RAP94_VACCW	434	tr|A0A0U1RQK4|A0A0U1RQK4_HUMAN [Protein ADP-ribosylarginine] hydrolase-like protein 1 OS=Homo sapiens OX=9606 GN=ADPRHL1 PE=1 SV=1	1405	KVVLNPAKEPQT
SIIPRNLINLDY	sp|P04308|ETF1_VACCW	18	sp|Q9BX97|PLVAP_HUMAN Plasmalemma vesicle-associated protein OS=Homo sapiens OX=9606 GN=PLVAP PE=1 SV=1	244	SIIPRSLDNLGY
VALTGGTGAGKS	sp|P12927|NPH2_VACCW	181	sp|Q9UG63|ABCF2_HUMAN ATP-binding cassette sub-family F member 2 OS=Homo sapiens OX=9606 GN=ABCF2 PE=1 SV=2	426	VALVGPNGAGKS
VALTGGTGAGKS	sp|P12927|NPH2_VACCW	181	sp|Q68CJ6|SLIP_HUMAN Nuclear GTPase SLIP-GC OS=Homo sapiens OX=9606 GN=NUGGC PE=2 SV=3	103	IALFGSTGAGKS
PANQLLITFCLI	sp|P68593|A17_VACCW	92	sp|Q14833|GRM4_HUMAN Metabotropic glutamate receptor 4 OS=Homo sapiens OX=9606 GN=GRM4 PE=2 SV=1	696	PASQLAITFSLI
PANQLLITFCLI	sp|P68593|A17_VACCW	92	tr|B7ZLU9|B7ZLU9_HUMAN Metabotropic glutamate receptor 4 OS=Homo sapiens OX=9606 GN=GRM4 PE=1 SV=1	649	PASQLAITFSLI
PANQLLITFCLI	sp|P68593|A17_VACCW	92	tr|A0A0A0MT06|A0A0A0MT06_HUMAN Metabotropic glutamate receptor 8 OS=Homo sapiens OX=9606 GN=GRM8 PE=1 SV=1	200	PASQLVITFSLI
PANQLLITFCLI	sp|P68593|A17_VACCW	92	sp|O00222|GRM8_HUMAN Metabotropic glutamate receptor 8 OS=Homo sapiens OX=9606 GN=GRM8 PE=1 SV=2	692	PASQLVITFSLI
YGSLRRKDRLPQ	sp|P12923|I3_VACCW	118	sp|Q7L0X0|TRIL_HUMAN TLR4 interactor with leucine rich repeats OS=Homo sapiens OX=9606 GN=TRIL PE=1 SV=2	796	GGSLRREDRLLQ
IVSIPKAIFKPV	sp|P07610|VLTF2_VACCW	11	tr|A0A3B3IS53|A0A3B3IS53_HUMAN Histone acetyltransferase (Fragment) OS=Homo sapiens OX=9606 GN=KAT6A PE=1 SV=1	1192	IVSIPKAGRKPK
IVSIPKAIFKPV	sp|P07610|VLTF2_VACCW	11	tr|A0A3B3ITI3|A0A3B3ITI3_HUMAN Histone acetyltransferase (Fragment) OS=Homo sapiens OX=9606 GN=KAT6A PE=1 SV=1	753	IVSIPKAGRKPK
IVSIPKAIFKPV	sp|P07610|VLTF2_VACCW	11	tr|A0A3F2YNX6|A0A3F2YNX6_HUMAN Histone acetyltransferase OS=Homo sapiens OX=9606 GN=KAT6A PE=1 SV=1	1194	IVSIPKAGRKPK
IVSIPKAIFKPV	sp|P07610|VLTF2_VACCW	11	sp|Q92794|KAT6A_HUMAN Histone acetyltransferase KAT6A OS=Homo sapiens OX=9606 GN=KAT6A PE=1 SV=2	1192	IVSIPKAGRKPK
SNTSKSLELNSF	sp|P18377|K4_VACCW	36	tr|C4B7M2|C4B7M2_HUMAN Spatacsin OS=Homo sapiens OX=9606 GN=SPG11 PE=1 SV=1	1849	LNTSKYLELNSL
SNTSKSLELNSF	sp|P18377|K4_VACCW	36	sp|Q96JI7|SPTCS_HUMAN Spatacsin OS=Homo sapiens OX=9606 GN=SPG11 PE=1 SV=3	1849	LNTSKYLELNSL
SNTSKSLELNSF	sp|P18377|K4_VACCW	36	tr|H0YLK7|H0YLK7_HUMAN Spatacsin (Fragment) OS=Homo sapiens OX=9606 GN=SPG11 PE=1 SV=1	132	LNTSKYLELNSL
EEKNGTTSYSDT	sp|Q01227|B5_VACCW	111	sp|Q9BSC4|NOL10_HUMAN Nucleolar protein 10 OS=Homo sapiens OX=9606 GN=NOL10 PE=1 SV=1	625	EAKNGTLSVSDT
NTSKSLELNSFW	sp|P18377|K4_VACCW	37	tr|C4B7M2|C4B7M2_HUMAN Spatacsin OS=Homo sapiens OX=9606 GN=SPG11 PE=1 SV=1	1850	NTSKYLELNSLP
NTSKSLELNSFW	sp|P18377|K4_VACCW	37	sp|Q96JI7|SPTCS_HUMAN Spatacsin OS=Homo sapiens OX=9606 GN=SPG11 PE=1 SV=3	1850	NTSKYLELNSLP
NTSKSLELNSFW	sp|P18377|K4_VACCW	37	tr|H0YLK7|H0YLK7_HUMAN Spatacsin (Fragment) OS=Homo sapiens OX=9606 GN=SPG11 PE=1 SV=1	133	NTSKYLELNSLP
VDILSFRACEKV	sp|P24759|ATI_VACCW	220	sp|Q9Y623|MYH4_HUMAN Myosin-4 OS=Homo sapiens OX=9606 GN=MYH4 PE=2 SV=2	339	VDILGFTADEKV
LLSGFGIDLTLS	sp|Q80HY2|M2_VACCW	70	sp|Q7RTY0|MOT13_HUMAN Monocarboxylate transporter 13 OS=Homo sapiens OX=9606 GN=SLC16A13 PE=1 SV=1	381	LLSGSGILLTLP
ACEKVAKTGDIR	sp|P24759|ATI_VACCW	227	sp|P31153|METK2_HUMAN S-adenosylmethionine synthase isoform type-2 OS=Homo sapiens OX=9606 GN=MAT2A PE=1 SV=1	55	ACETVAKTGMIL
TVDDVDSYATQL	sp|P16272|DNLI_VACCW	107	tr|A0A6Q8PFA6|A0A6Q8PFA6_HUMAN Kinesin-like protein OS=Homo sapiens OX=9606 GN=KIF2A PE=1 SV=1	633	VDYDVDSYATQL
TVDDVDSYATQL	sp|P16272|DNLI_VACCW	107	sp|O00139|KIF2A_HUMAN Kinesin-like protein KIF2A OS=Homo sapiens OX=9606 GN=KIF2A PE=1 SV=3	652	VDYDVDSYATQL
TVDDVDSYATQL	sp|P16272|DNLI_VACCW	107	tr|A0A6Q8PGH7|A0A6Q8PGH7_HUMAN Kinesin-like protein (Fragment) OS=Homo sapiens OX=9606 GN=KIF2A PE=1 SV=1	631	VDYDVDSYATQL
TVDDVDSYATQL	sp|P16272|DNLI_VACCW	107	tr|A0A6Q8PH57|A0A6Q8PH57_HUMAN Kinesin-like protein OS=Homo sapiens OX=9606 GN=KIF2A PE=1 SV=1	671	VDYDVDSYATQL
TVDDVDSYATQL	sp|P16272|DNLI_VACCW	107	tr|A0A6Q8PG37|A0A6Q8PG37_HUMAN Kinesin-like protein OS=Homo sapiens OX=9606 GN=KIF2A PE=1 SV=1	663	VDYDVDSYATQL
TVDDVDSYATQL	sp|P16272|DNLI_VACCW	107	tr|A0A6Q8PGG1|A0A6Q8PGG1_HUMAN Kinesin-like protein KIF2A OS=Homo sapiens OX=9606 GN=KIF2A PE=1 SV=1	536	VDYDVDSYATQL
NSLEDAKKLILL	sp|P17361|N1_VACCW	64	sp|Q9H993|ARMT1_HUMAN Damage-control phosphatase ARMT1 OS=Homo sapiens OX=9606 GN=ARMT1 PE=1 SV=1	212	NSLEDLKPFILL
NSLEDAKKLILL	sp|P17361|N1_VACCW	64	tr|F5GZY1|F5GZY1_HUMAN Sugar phosphate phosphatase OS=Homo sapiens OX=9606 GN=ARMT1 PE=1 SV=1	93	NSLEDLKPFILL
IEGASAPLLLKD	sp|P68438|RAP94_VACCW	217	sp|P49137|MAPK2_HUMAN MAP kinase-activated protein kinase 2 OS=Homo sapiens OX=9606 GN=MAPKAPK2 PE=1 SV=1	375	IEDASNPLLLKR
DEATEYDDDEDD	sp|P68611|RP19_VACCW	13	sp|P19338|NUCL_HUMAN Nucleolin OS=Homo sapiens OX=9606 GN=NCL PE=1 SV=3	250	DEDDEDDDDEDD
DYIKDYLPKIYR	sp|P16272|DNLI_VACCW	262	sp|Q96LM5|CD045_HUMAN Uncharacterized protein C4orf45 OS=Homo sapiens OX=9606 GN=C4orf45 PE=1 SV=3	24	DYIKDYLPKIHQ
NSARYLDNGGNK	sp|P12848|RIR1_VACCW	281	tr|H0YCY7|H0YCY7_HUMAN Ribonucleoside-diphosphate reductase (Fragment) OS=Homo sapiens OX=9606 GN=RRM1 PE=1 SV=1	94	NTARYVDQGGNK
NSARYLDNGGNK	sp|P12848|RIR1_VACCW	281	sp|P23921|RIR1_HUMAN Ribonucleoside-diphosphate reductase large subunit OS=Homo sapiens OX=9606 GN=RRM1 PE=1 SV=1	281	NTARYVDQGGNK
NSARYLDNGGNK	sp|P12848|RIR1_VACCW	281	tr|E9PL69|E9PL69_HUMAN Ribonucleoside-diphosphate reductase large subunit OS=Homo sapiens OX=9606 GN=RRM1 PE=1 SV=1	59	NTARYVDQGGNK
NSARYLDNGGNK	sp|P12848|RIR1_VACCW	281	tr|E9PP77|E9PP77_HUMAN Ribonucleoside-diphosphate reductase large subunit OS=Homo sapiens OX=9606 GN=RRM1 PE=1 SV=1	59	NTARYVDQGGNK
