query	query_seqname	query_start	target_seqname	target_start	target
TDLREQALRFMP	sp|Q81862|POLN_HEVCH	1325	sp|Q13751|LAMB3_HUMAN Laminin subunit beta-3 OS=Homo sapiens OX=9606 GN=LAMB3 PE=1 SV=1	590	ADLREQALRFGR
KVYAALRIPPEL	sp|Q81862|POLN_HEVCH	185	sp|Q96BI3|APH1A_HUMAN Gamma-secretase subunit APH-1A OS=Homo sapiens OX=9606 GN=APH1A PE=1 SV=1	254	MVYSALRIPPED
AAAQGLSGVLAS	sp|Q81870|ORF3_HEVCH	43	sp|O15119|TBX3_HUMAN T-box transcription factor TBX3 OS=Homo sapiens OX=9606 GN=TBX3 PE=1 SV=4	565	AAAQGLSGASAA
PAAPAPPPGSPQ	sp|Q81871|CAPSD_HEVCH	15	sp|Q5U5X8|F222A_HUMAN Protein FAM222A OS=Homo sapiens OX=9606 GN=FAM222A PE=2 SV=1	163	PEAPAPPPGLPA
PAAPAPPPGSPQ	sp|Q81871|CAPSD_HEVCH	15	sp|Q76G19|PDZD4_HUMAN PDZ domain-containing protein 4 OS=Homo sapiens OX=9606 GN=PDZD4 PE=1 SV=1	514	PAKAAPPPGSPA
PAAPAPPPGSPQ	sp|Q81871|CAPSD_HEVCH	15	tr|Q17RL8|Q17RL8_HUMAN HCG2004980, isoform CRA_e OS=Homo sapiens OX=9606 GN=PDZD4 PE=1 SV=1	520	PAKAAPPPGSPA
PAAPAPPPGSPQ	sp|Q81871|CAPSD_HEVCH	15	sp|Q96N03|VTM2L_HUMAN V-set and transmembrane domain-containing protein 2-like protein OS=Homo sapiens OX=9606 GN=VSTM2L PE=1 SV=1	178	PAAPAPPPPKPG
PAAPAPPPGSPQ	sp|Q81871|CAPSD_HEVCH	15	sp|Q86Y01|DTX1_HUMAN E3 ubiquitin-protein ligase DTX1 OS=Homo sapiens OX=9606 GN=DTX1 PE=1 SV=1	266	PAEPAPPPGAPP
PAAPAPPPGSPQ	sp|Q81871|CAPSD_HEVCH	15	sp|O14841|OPLA_HUMAN 5-oxoprolinase OS=Homo sapiens OX=9606 GN=OPLAH PE=1 SV=3	1256	PEDPAPPPGSPP
PAAPAPPPGSPQ	sp|Q81871|CAPSD_HEVCH	15	sp|Q9UPX8|SHAN2_HUMAN SH3 and multiple ankyrin repeat domains protein 2 OS=Homo sapiens OX=9606 GN=SHANK2 PE=1 SV=3	1200	PPAPPPPPGSAQ
PAAPAPPPGSPQ	sp|Q81871|CAPSD_HEVCH	15	tr|A6NHU9|A6NHU9_HUMAN SH3 and multiple ankyrin repeat domains protein 2 OS=Homo sapiens OX=9606 GN=SHANK2 PE=1 SV=5	991	PPAPPPPPGSAQ
PAAPAPPPGSPQ	sp|Q81871|CAPSD_HEVCH	15	tr|E7EUA2|E7EUA2_HUMAN SH3 and multiple ankyrin repeat domains protein 2 OS=Homo sapiens OX=9606 GN=SHANK2 PE=1 SV=1	983	PPAPPPPPGSAQ
PAAPAPPPGSPQ	sp|Q81871|CAPSD_HEVCH	15	tr|H7C1X5|H7C1X5_HUMAN SH3 and multiple ankyrin repeat domains protein 2 (Fragment) OS=Homo sapiens OX=9606 GN=SHANK2 PE=1 SV=1	858	PPAPPPPPGSAQ
PAAPAPPPGSPQ	sp|Q81871|CAPSD_HEVCH	15	tr|A0A0A0MSQ6|A0A0A0MSQ6_HUMAN SH3 and multiple ankyrin repeat domains protein 2 OS=Homo sapiens OX=9606 GN=SHANK2 PE=1 SV=1	991	PPAPPPPPGSAQ
PAAPAPPPGSPQ	sp|Q81871|CAPSD_HEVCH	15	tr|A0A590UJ45|A0A590UJ45_HUMAN SH3 and multiple ankyrin repeat domains protein 2 OS=Homo sapiens OX=9606 GN=SHANK2 PE=1 SV=1	1009	PPAPPPPPGSAQ
PAAPAPPPGSPQ	sp|Q81871|CAPSD_HEVCH	15	tr|A0A590UJF3|A0A590UJF3_HUMAN SH3 and multiple ankyrin repeat domains protein 2 (Fragment) OS=Homo sapiens OX=9606 GN=SHANK2 PE=1 SV=1	722	PPAPPPPPGSAQ
PAAPAPPPGSPQ	sp|Q81871|CAPSD_HEVCH	15	sp|Q16760|DGKD_HUMAN Diacylglycerol kinase delta OS=Homo sapiens OX=9606 GN=DGKD PE=1 SV=4	3	AAAGAPPPGPPQ
PAAPAPPPGSPQ	sp|Q81871|CAPSD_HEVCH	15	tr|C9JY42|C9JY42_HUMAN Diacylglycerol kinase delta (Fragment) OS=Homo sapiens OX=9606 GN=DGKD PE=1 SV=1	3	AAAGAPPPGPPQ
PAAPAPPPGSPQ	sp|Q81871|CAPSD_HEVCH	15	sp|Q9UPR6|ZFR2_HUMAN Zinc finger RNA-binding protein 2 OS=Homo sapiens OX=9606 GN=ZFR2 PE=2 SV=3	220	PAQPPPPPGPPQ
PAAPAPPPGSPQ	sp|Q81871|CAPSD_HEVCH	15	sp|Q96RY5|CRML_HUMAN Protein cramped-like OS=Homo sapiens OX=9606 GN=CRAMP1 PE=1 SV=3	66	PQAPSPPQGSPQ
PAAPAPPPGSPQ	sp|Q81871|CAPSD_HEVCH	15	sp|Q68BL8|OLM2B_HUMAN Olfactomedin-like protein 2B OS=Homo sapiens OX=9606 GN=OLFML2B PE=2 SV=2	429	PAAPAPPAVSPR
PAAPAPPPGSPQ	sp|Q81871|CAPSD_HEVCH	15	tr|F2Z3N3|F2Z3N3_HUMAN Olfactomedin-like protein 2B OS=Homo sapiens OX=9606 GN=OLFML2B PE=1 SV=1	430	PAAPAPPAVSPR
PAAPAPPPGSPQ	sp|Q81871|CAPSD_HEVCH	15	sp|Q9BWW7|SCRT1_HUMAN Transcriptional repressor scratch 1 OS=Homo sapiens OX=9606 GN=SCRT1 PE=1 SV=1	335	PAAPAPPQLSPV
TKVYAALRIPPE	sp|Q81862|POLN_HEVCH	184	sp|Q96BI3|APH1A_HUMAN Gamma-secretase subunit APH-1A OS=Homo sapiens OX=9606 GN=APH1A PE=1 SV=1	253	VMVYSALRIPPE
PLPPPLPEPSPT	sp|Q81862|POLN_HEVCH	739	sp|Q9Y3S1|WNK2_HUMAN Serine/threonine-protein kinase WNK2 OS=Homo sapiens OX=9606 GN=WNK2 PE=1 SV=4	1511	PLPPPAPEPSPH
PLPPPLPEPSPT	sp|Q81862|POLN_HEVCH	739	tr|F8W9F9|F8W9F9_HUMAN Non-specific serine/threonine protein kinase OS=Homo sapiens OX=9606 GN=WNK2 PE=1 SV=1	1474	PLPPPAPEPSPH
PLPPPLPEPSPT	sp|Q81862|POLN_HEVCH	739	tr|H0Y493|H0Y493_HUMAN Serine/threonine-protein kinase WNK2 (Fragment) OS=Homo sapiens OX=9606 GN=WNK2 PE=1 SV=1	271	PLPPPAPEPSPH
PLPPPLPEPSPT	sp|Q81862|POLN_HEVCH	739	tr|H0Y7T5|H0Y7T5_HUMAN Non-specific serine/threonine protein kinase (Fragment) OS=Homo sapiens OX=9606 GN=WNK2 PE=1 SV=1	1470	PLPPPAPEPSPH
PLPPPLPEPSPT	sp|Q81862|POLN_HEVCH	739	tr|H0Y7R3|H0Y7R3_HUMAN Non-specific serine/threonine protein kinase (Fragment) OS=Homo sapiens OX=9606 GN=WNK2 PE=1 SV=1	1078	PLPPPAPEPSPH
PLPPPLPEPSPT	sp|Q81862|POLN_HEVCH	739	sp|A6NGB9|WIPF3_HUMAN WAS/WASL-interacting protein family member 3 OS=Homo sapiens OX=9606 GN=WIPF3 PE=1 SV=4	185	PLPPPLPSSSPI
PLPPPLPEPSPT	sp|Q81862|POLN_HEVCH	739	tr|A0A0A0MSG0|A0A0A0MSG0_HUMAN WAS/WASL-interacting protein family member 3 OS=Homo sapiens OX=9606 GN=WIPF3 PE=1 SV=1	185	PLPPPLPSSSPI
PLPPPLPEPSPT	sp|Q81862|POLN_HEVCH	739	sp|Q9H3P7|GCP60_HUMAN Golgi resident protein GCP60 OS=Homo sapiens OX=9606 GN=ACBD3 PE=1 SV=4	34	LLPPPLPPPSPP
PLPPPLPEPSPT	sp|Q81862|POLN_HEVCH	739	tr|I3L2J3|I3L2J3_HUMAN Transmembrane protein 88 OS=Homo sapiens OX=9606 GN=TMEM88 PE=1 SV=1	80	ALPPPLPERSPS
PLPPPLPEPSPT	sp|Q81862|POLN_HEVCH	739	tr|F5H1F6|F5H1F6_HUMAN Vacuolar protein sorting-associated protein 37B (Fragment) OS=Homo sapiens OX=9606 GN=VPS37B PE=1 SV=1	173	PLPPRLPELAPT
PLPPPLPEPSPT	sp|Q81862|POLN_HEVCH	739	tr|F5H4M0|F5H4M0_HUMAN Vacuolar protein sorting-associated protein 37B (Fragment) OS=Homo sapiens OX=9606 GN=VPS37B PE=1 SV=1	173	PLPPRLPELAPT
PLPPPLPEPSPT	sp|Q81862|POLN_HEVCH	739	sp|Q9H9H4|VP37B_HUMAN Vacuolar protein sorting-associated protein 37B OS=Homo sapiens OX=9606 GN=VPS37B PE=1 SV=1	175	PLPPRLPELAPT
PLPPPLPEPSPT	sp|Q81862|POLN_HEVCH	739	sp|P10323|ACRO_HUMAN Acrosin OS=Homo sapiens OX=9606 GN=ACR PE=1 SV=4	360	PLPPPPPPPPPT
PLPPPLPEPSPT	sp|Q81862|POLN_HEVCH	739	sp|Q14957|NMDE3_HUMAN Glutamate receptor ionotropic, NMDA 2C OS=Homo sapiens OX=9606 GN=GRIN2C PE=1 SV=3	947	PTPDPPPEPSPT
PLPPPLPEPSPT	sp|Q81862|POLN_HEVCH	739	tr|C9JHW1|C9JHW1_HUMAN GRB10-interacting GYF protein 2 (Fragment) OS=Homo sapiens OX=9606 GN=GIGYF2 PE=1 SV=1	393	ILPPPVPNPSPT
PLPPPLPEPSPT	sp|Q81862|POLN_HEVCH	739	tr|E7ESB6|E7ESB6_HUMAN GRB10-interacting GYF protein 2 (Fragment) OS=Homo sapiens OX=9606 GN=GIGYF2 PE=1 SV=1	444	ILPPPVPNPSPT
PLPPPLPEPSPT	sp|Q81862|POLN_HEVCH	739	tr|I1E4Y6|I1E4Y6_HUMAN GRB10-interacting GYF protein 2 OS=Homo sapiens OX=9606 GN=GIGYF2 PE=1 SV=1	472	ILPPPVPNPSPT
PLPPPLPEPSPT	sp|Q81862|POLN_HEVCH	739	sp|Q6Y7W6|GGYF2_HUMAN GRB10-interacting GYF protein 2 OS=Homo sapiens OX=9606 GN=GIGYF2 PE=1 SV=1	450	ILPPPVPNPSPT
SLTFVANLMGAE	sp|Q81862|POLN_HEVCH	607	sp|Q92547|TOPB1_HUMAN DNA topoisomerase 2-binding protein 1 OS=Homo sapiens OX=9606 GN=TOPBP1 PE=1 SV=3	663	SLTFLANLLGAS
SLTFVANLMGAE	sp|Q81862|POLN_HEVCH	607	tr|A0A2R8YD63|A0A2R8YD63_HUMAN DNA topoisomerase 2-binding protein 1 OS=Homo sapiens OX=9606 GN=TOPBP1 PE=1 SV=1	658	SLTFLANLLGAS
QVLRKCWLRPAG	sp|Q81862|POLN_HEVCH	101	tr|E9PQ06|E9PQ06_HUMAN Short-chain dehydrogenase/reductase family 42E member 1 (Fragment) OS=Homo sapiens OX=9606 GN=SDR42E1 PE=3 SV=1	173	GVLRTCALRPAG
QVLRKCWLRPAG	sp|Q81862|POLN_HEVCH	101	sp|Q8WUS8|D42E1_HUMAN Short-chain dehydrogenase/reductase family 42E member 1 OS=Homo sapiens OX=9606 GN=SDR42E1 PE=2 SV=2	176	GVLRTCALRPAG
LATLTPLAPLPP	sp|Q81862|POLN_HEVCH	731	sp|O95948|ONEC2_HUMAN One cut domain family member 2 OS=Homo sapiens OX=9606 GN=ONECUT2 PE=2 SV=2	148	YTTLTPLQPLPP
LATLTPLAPLPP	sp|Q81862|POLN_HEVCH	731	sp|Q9UBC0|HNF6_HUMAN Hepatocyte nuclear factor 6 OS=Homo sapiens OX=9606 GN=ONECUT1 PE=2 SV=1	103	YTTLTPLQPLPP
MALYAPAAPAPP	sp|Q81871|CAPSD_HEVCH	10	tr|H7C469|H7C469_HUMAN Peptidase A1 domain-containing protein (Fragment) OS=Homo sapiens OX=9606 PE=1 SV=7	265	PALQAPAAPAPE
MALYAPAAPAPP	sp|Q81871|CAPSD_HEVCH	10	tr|A0A1B0GU03|A0A1B0GU03_HUMAN Peptidase A1 domain-containing protein OS=Homo sapiens OX=9606 PE=1 SV=1	410	PALQAPAAPAPE
MALYAPAAPAPP	sp|Q81871|CAPSD_HEVCH	10	sp|A6NMD0|IFM10_HUMAN Interferon-induced transmembrane protein 10 OS=Homo sapiens OX=9606 GN=IFITM10 PE=2 SV=1	81	PALQAPAAPAPE
MALYAPAAPAPP	sp|Q81871|CAPSD_HEVCH	10	tr|A0A1B0GU92|A0A1B0GU92_HUMAN Peptidase A1 domain-containing protein OS=Homo sapiens OX=9606 PE=1 SV=1	410	PALQAPAAPAPE
MALYAPAAPAPP	sp|Q81871|CAPSD_HEVCH	10	sp|P35713|SOX18_HUMAN Transcription factor SOX-18 OS=Homo sapiens OX=9606 GN=SOX18 PE=1 SV=2	40	AALAAPAAPASP
VSDWVRRVSTLL	sp|Q81862|POLN_HEVCH	1628	tr|I3L072|I3L072_HUMAN Uncharacterized protein C17orf80 OS=Homo sapiens OX=9606 GN=C17orf80 PE=1 SV=1	235	VSDGVKRVRTLL
VSDWVRRVSTLL	sp|Q81862|POLN_HEVCH	1628	sp|Q9BSJ5|CQ080_HUMAN Uncharacterized protein C17orf80 OS=Homo sapiens OX=9606 GN=C17orf80 PE=1 SV=2	235	VSDGVKRVRTLL
RGEPAPGLQARA	sp|Q81862|POLN_HEVCH	756	sp|Q16799|RTN1_HUMAN Reticulon-1 OS=Homo sapiens OX=9606 GN=RTN1 PE=1 SV=1	44	AGEPSPGLGARA
LTPLAPLPPPLP	sp|Q81862|POLN_HEVCH	734	sp|Q8N398|VW5B2_HUMAN von Willebrand factor A domain-containing protein 5B2 OS=Homo sapiens OX=9606 GN=VWA5B2 PE=2 SV=3	156	LTPLAPPGPPGP
LTPLAPLPPPLP	sp|Q81862|POLN_HEVCH	734	sp|Q9P0X4|CAC1I_HUMAN Voltage-dependent T-type calcium channel subunit alpha-1I OS=Homo sapiens OX=9606 GN=CACNA1I PE=1 SV=1	2198	LGPLAPPPQPLP
LTPLAPLPPPLP	sp|Q81862|POLN_HEVCH	734	sp|P84550|SKOR1_HUMAN SKI family transcriptional corepressor 1 OS=Homo sapiens OX=9606 GN=SKOR1 PE=1 SV=1	572	PPPLAPLPPPPP
LTPLAPLPPPLP	sp|Q81862|POLN_HEVCH	734	tr|G3V3E1|G3V3E1_HUMAN SKI family transcriptional corepressor 1 OS=Homo sapiens OX=9606 GN=SKOR1 PE=3 SV=1	533	PPPLAPLPPPPP
LTPLAPLPPPLP	sp|Q81862|POLN_HEVCH	734	tr|G3V5H7|G3V5H7_HUMAN SKI family transcriptional corepressor 1 OS=Homo sapiens OX=9606 GN=SKOR1 PE=3 SV=1	544	PPPLAPLPPPPP
LTPLAPLPPPLP	sp|Q81862|POLN_HEVCH	734	sp|Q6ZMT1|STAC2_HUMAN SH3 and cysteine-rich domain-containing protein 2 OS=Homo sapiens OX=9606 GN=STAC2 PE=1 SV=1	68	LTPPTPLPPPSP
ATLTPLAPLPPP	sp|Q81862|POLN_HEVCH	732	sp|O95948|ONEC2_HUMAN One cut domain family member 2 OS=Homo sapiens OX=9606 GN=ONECUT2 PE=2 SV=2	149	TTLTPLQPLPPI
ATLTPLAPLPPP	sp|Q81862|POLN_HEVCH	732	sp|Q9UBC0|HNF6_HUMAN Hepatocyte nuclear factor 6 OS=Homo sapiens OX=9606 GN=ONECUT1 PE=2 SV=1	104	TTLTPLQPLPPI
ATLTPLAPLPPP	sp|Q81862|POLN_HEVCH	732	sp|P84550|SKOR1_HUMAN SKI family transcriptional corepressor 1 OS=Homo sapiens OX=9606 GN=SKOR1 PE=1 SV=1	570	ALPPPLAPLPPP
ATLTPLAPLPPP	sp|Q81862|POLN_HEVCH	732	tr|G3V3E1|G3V3E1_HUMAN SKI family transcriptional corepressor 1 OS=Homo sapiens OX=9606 GN=SKOR1 PE=3 SV=1	531	ALPPPLAPLPPP
ATLTPLAPLPPP	sp|Q81862|POLN_HEVCH	732	tr|G3V5H7|G3V5H7_HUMAN SKI family transcriptional corepressor 1 OS=Homo sapiens OX=9606 GN=SKOR1 PE=3 SV=1	542	ALPPPLAPLPPP
PTDLLSSAGGSV	sp|Q81871|CAPSD_HEVCH	384	tr|A0A6Q8PF92|A0A6Q8PF92_HUMAN Peripheral myelin protein 22 OS=Homo sapiens OX=9606 GN=PMP22 PE=1 SV=1	58	PNDLLSSTGFSV
LPPPLPEPSPTP	sp|Q81862|POLN_HEVCH	740	sp|Q9H3P7|GCP60_HUMAN Golgi resident protein GCP60 OS=Homo sapiens OX=9606 GN=ACBD3 PE=1 SV=4	35	LPPPLPPPSPPG
LPPPLPEPSPTP	sp|Q81862|POLN_HEVCH	740	tr|I3L2J3|I3L2J3_HUMAN Transmembrane protein 88 OS=Homo sapiens OX=9606 GN=TMEM88 PE=1 SV=1	81	LPPPLPERSPSI
LPPPLPEPSPTP	sp|Q81862|POLN_HEVCH	740	tr|C9JHW1|C9JHW1_HUMAN GRB10-interacting GYF protein 2 (Fragment) OS=Homo sapiens OX=9606 GN=GIGYF2 PE=1 SV=1	394	LPPPVPNPSPTL
LPPPLPEPSPTP	sp|Q81862|POLN_HEVCH	740	tr|E7ESB6|E7ESB6_HUMAN GRB10-interacting GYF protein 2 (Fragment) OS=Homo sapiens OX=9606 GN=GIGYF2 PE=1 SV=1	445	LPPPVPNPSPTL
LPPPLPEPSPTP	sp|Q81862|POLN_HEVCH	740	tr|I1E4Y6|I1E4Y6_HUMAN GRB10-interacting GYF protein 2 OS=Homo sapiens OX=9606 GN=GIGYF2 PE=1 SV=1	473	LPPPVPNPSPTL
LPPPLPEPSPTP	sp|Q81862|POLN_HEVCH	740	sp|Q6Y7W6|GGYF2_HUMAN GRB10-interacting GYF protein 2 OS=Homo sapiens OX=9606 GN=GIGYF2 PE=1 SV=1	451	LPPPVPNPSPTL
LPPPLPEPSPTP	sp|Q81862|POLN_HEVCH	740	sp|Q86VE0|MYPOP_HUMAN Myb-related transcription factor, partner of profilin OS=Homo sapiens OX=9606 GN=MYPOP PE=1 SV=2	306	LPPPLPPPPPPP
LPPPLPEPSPTP	sp|Q81862|POLN_HEVCH	740	sp|P10323|ACRO_HUMAN Acrosin OS=Homo sapiens OX=9606 GN=ACR PE=1 SV=4	361	LPPPPPPPPPTP
LPPPLPEPSPTP	sp|Q81862|POLN_HEVCH	740	sp|Q9Y3S1|WNK2_HUMAN Serine/threonine-protein kinase WNK2 OS=Homo sapiens OX=9606 GN=WNK2 PE=1 SV=4	1512	LPPPAPEPSPHS
LPPPLPEPSPTP	sp|Q81862|POLN_HEVCH	740	tr|F8W9F9|F8W9F9_HUMAN Non-specific serine/threonine protein kinase OS=Homo sapiens OX=9606 GN=WNK2 PE=1 SV=1	1475	LPPPAPEPSPHS
LPPPLPEPSPTP	sp|Q81862|POLN_HEVCH	740	tr|H0Y493|H0Y493_HUMAN Serine/threonine-protein kinase WNK2 (Fragment) OS=Homo sapiens OX=9606 GN=WNK2 PE=1 SV=1	272	LPPPAPEPSPHS
LPPPLPEPSPTP	sp|Q81862|POLN_HEVCH	740	tr|H0Y7T5|H0Y7T5_HUMAN Non-specific serine/threonine protein kinase (Fragment) OS=Homo sapiens OX=9606 GN=WNK2 PE=1 SV=1	1471	LPPPAPEPSPHS
LPPPLPEPSPTP	sp|Q81862|POLN_HEVCH	740	tr|H0Y7R3|H0Y7R3_HUMAN Non-specific serine/threonine protein kinase (Fragment) OS=Homo sapiens OX=9606 GN=WNK2 PE=1 SV=1	1079	LPPPAPEPSPHS
LAPLPPPLPEPS	sp|Q81862|POLN_HEVCH	737	tr|F5H1F6|F5H1F6_HUMAN Vacuolar protein sorting-associated protein 37B (Fragment) OS=Homo sapiens OX=9606 GN=VPS37B PE=1 SV=1	171	LAPLPPRLPELA
LAPLPPPLPEPS	sp|Q81862|POLN_HEVCH	737	tr|F5H4M0|F5H4M0_HUMAN Vacuolar protein sorting-associated protein 37B (Fragment) OS=Homo sapiens OX=9606 GN=VPS37B PE=1 SV=1	171	LAPLPPRLPELA
LAPLPPPLPEPS	sp|Q81862|POLN_HEVCH	737	sp|Q9H9H4|VP37B_HUMAN Vacuolar protein sorting-associated protein 37B OS=Homo sapiens OX=9606 GN=VPS37B PE=1 SV=1	173	LAPLPPRLPELA
LAPLPPPLPEPS	sp|Q81862|POLN_HEVCH	737	sp|P84550|SKOR1_HUMAN SKI family transcriptional corepressor 1 OS=Homo sapiens OX=9606 GN=SKOR1 PE=1 SV=1	575	LAPLPPPPPPPA
LAPLPPPLPEPS	sp|Q81862|POLN_HEVCH	737	tr|G3V3E1|G3V3E1_HUMAN SKI family transcriptional corepressor 1 OS=Homo sapiens OX=9606 GN=SKOR1 PE=3 SV=1	536	LAPLPPPPPPPA
LAPLPPPLPEPS	sp|Q81862|POLN_HEVCH	737	tr|G3V5H7|G3V5H7_HUMAN SKI family transcriptional corepressor 1 OS=Homo sapiens OX=9606 GN=SKOR1 PE=3 SV=1	547	LAPLPPPPPPPA
LAPLPPPLPEPS	sp|Q81862|POLN_HEVCH	737	sp|P51608|MECP2_HUMAN Methyl-CpG-binding protein 2 OS=Homo sapiens OX=9606 GN=MECP2 PE=1 SV=1	383	LPPLPPPPPEPE
LAPLPPPLPEPS	sp|Q81862|POLN_HEVCH	737	sp|Q9Y3S1|WNK2_HUMAN Serine/threonine-protein kinase WNK2 OS=Homo sapiens OX=9606 GN=WNK2 PE=1 SV=4	1509	REPLPPPAPEPS
LAPLPPPLPEPS	sp|Q81862|POLN_HEVCH	737	tr|F8W9F9|F8W9F9_HUMAN Non-specific serine/threonine protein kinase OS=Homo sapiens OX=9606 GN=WNK2 PE=1 SV=1	1472	REPLPPPAPEPS
LAPLPPPLPEPS	sp|Q81862|POLN_HEVCH	737	tr|H0Y493|H0Y493_HUMAN Serine/threonine-protein kinase WNK2 (Fragment) OS=Homo sapiens OX=9606 GN=WNK2 PE=1 SV=1	269	REPLPPPAPEPS
LAPLPPPLPEPS	sp|Q81862|POLN_HEVCH	737	tr|H0Y7T5|H0Y7T5_HUMAN Non-specific serine/threonine protein kinase (Fragment) OS=Homo sapiens OX=9606 GN=WNK2 PE=1 SV=1	1468	REPLPPPAPEPS
LAPLPPPLPEPS	sp|Q81862|POLN_HEVCH	737	tr|H0Y7R3|H0Y7R3_HUMAN Non-specific serine/threonine protein kinase (Fragment) OS=Homo sapiens OX=9606 GN=WNK2 PE=1 SV=1	1076	REPLPPPAPEPS
LSPSPNPPVSPL	sp|Q81870|ORF3_HEVCH	62	tr|H0YJW0|H0YJW0_HUMAN WD repeat-containing protein 25 (Fragment) OS=Homo sapiens OX=9606 GN=WDR25 PE=1 SV=1	90	LSPSPKPPGSPG
LSPSPNPPVSPL	sp|Q81870|ORF3_HEVCH	62	sp|Q13029|PRDM2_HUMAN PR domain zinc finger protein 2 OS=Homo sapiens OX=9606 GN=PRDM2 PE=1 SV=3	1029	PSPSPIPPVEPL
GEPAPGLQARAP	sp|Q81862|POLN_HEVCH	757	sp|Q16799|RTN1_HUMAN Reticulon-1 OS=Homo sapiens OX=9606 GN=RTN1 PE=1 SV=1	45	GEPSPGLGARAR
PAAAQGLSGVLA	sp|Q81870|ORF3_HEVCH	42	sp|O15119|TBX3_HUMAN T-box transcription factor TBX3 OS=Homo sapiens OX=9606 GN=TBX3 PE=1 SV=4	564	AAAAQGLSGASA
LTTALESAIVAV	sp|Q81862|POLN_HEVCH	12	tr|A0A669KB10|A0A669KB10_HUMAN Golgi-specific brefeldin A-resistance guanine nucleotide exchange factor 1 OS=Homo sapiens OX=9606 GN=GBF1 PE=1 SV=1	459	LTVALESAPVAQ
LTTALESAIVAV	sp|Q81862|POLN_HEVCH	12	sp|Q92538|GBF1_HUMAN Golgi-specific brefeldin A-resistance guanine nucleotide exchange factor 1 OS=Homo sapiens OX=9606 GN=GBF1 PE=1 SV=2	434	LTVALESAPVAQ
LTTALESAIVAV	sp|Q81862|POLN_HEVCH	12	tr|A0A669KBG8|A0A669KBG8_HUMAN Golgi-specific brefeldin A-resistance guanine nucleotide exchange factor 1 OS=Homo sapiens OX=9606 GN=GBF1 PE=1 SV=1	467	LTVALESAPVAQ
PLGLSRPSVPPV	sp|Q81870|ORF3_HEVCH	90	sp|Q9BX84|TRPM6_HUMAN Transient receptor potential cation channel subfamily M member 6 OS=Homo sapiens OX=9606 GN=TRPM6 PE=1 SV=2	1361	VLPLSRPSVPDV
LVAAALGCGLRA	sp|Q81862|POLN_HEVCH	1566	sp|Q8TER0|SNED1_HUMAN Sushi, nidogen and EGF-like domain-containing protein 1 OS=Homo sapiens OX=9606 GN=SNED1 PE=2 SV=2	10	LVAAALGLGARG
SRTDLREQALRF	sp|Q81862|POLN_HEVCH	1323	sp|Q13751|LAMB3_HUMAN Laminin subunit beta-3 OS=Homo sapiens OX=9606 GN=LAMB3 PE=1 SV=1	588	YDADLREQALRF
QSLDAELLLVPN	sp|Q81862|POLN_HEVCH	986	sp|Q6IQ22|RAB12_HUMAN Ras-related protein Rab-12 OS=Homo sapiens OX=9606 GN=RAB12 PE=1 SV=3	144	ASEDAELLLVGN
QSLDAELLLVPN	sp|Q81862|POLN_HEVCH	986	tr|A0A3B3ITT1|A0A3B3ITT1_HUMAN Ras-related protein Rab-12 OS=Homo sapiens OX=9606 GN=RAB12 PE=1 SV=1	240	ASEDAELLLVGN
AAPAPPPGSPQG	sp|Q81871|CAPSD_HEVCH	16	sp|Q16760|DGKD_HUMAN Diacylglycerol kinase delta OS=Homo sapiens OX=9606 GN=DGKD PE=1 SV=4	4	AAGAPPPGPPQP
AAPAPPPGSPQG	sp|Q81871|CAPSD_HEVCH	16	tr|C9JY42|C9JY42_HUMAN Diacylglycerol kinase delta (Fragment) OS=Homo sapiens OX=9606 GN=DGKD PE=1 SV=1	4	AAGAPPPGPPQP
TLTPLAPLPPPL	sp|Q81862|POLN_HEVCH	733	sp|O95948|ONEC2_HUMAN One cut domain family member 2 OS=Homo sapiens OX=9606 GN=ONECUT2 PE=2 SV=2	150	TLTPLQPLPPIS
TLTPLAPLPPPL	sp|Q81862|POLN_HEVCH	733	sp|Q9UBC0|HNF6_HUMAN Hepatocyte nuclear factor 6 OS=Homo sapiens OX=9606 GN=ONECUT1 PE=2 SV=1	105	TLTPLQPLPPIS
LREQALRFMPLA	sp|Q81862|POLN_HEVCH	1327	sp|Q13751|LAMB3_HUMAN Laminin subunit beta-3 OS=Homo sapiens OX=9606 GN=LAMB3 PE=1 SV=1	592	LREQALRFGRLR
APAAPAPPPGSP	sp|Q81871|CAPSD_HEVCH	14	sp|Q96C90|PP14B_HUMAN Protein phosphatase 1 regulatory subunit 14B OS=Homo sapiens OX=9606 GN=PPP1R14B PE=1 SV=3	11	ALAAPAPGPGSG
APAAPAPPPGSP	sp|Q81871|CAPSD_HEVCH	14	sp|Q9NP08|HMX1_HUMAN Homeobox protein HMX1 OS=Homo sapiens OX=9606 GN=HMX1 PE=2 SV=2	307	APAAPAPPPPLL
APAAPAPPPGSP	sp|Q81871|CAPSD_HEVCH	14	sp|Q86Y01|DTX1_HUMAN E3 ubiquitin-protein ligase DTX1 OS=Homo sapiens OX=9606 GN=DTX1 PE=1 SV=1	265	GPAEPAPPPGAP
APAAPAPPPGSP	sp|Q81871|CAPSD_HEVCH	14	tr|A0A0G2JNN7|A0A0G2JNN7_HUMAN Thyroid peroxidase OS=Homo sapiens OX=9606 GN=TPO PE=1 SV=1	371	APAACAPEPGIP
APAAPAPPPGSP	sp|Q81871|CAPSD_HEVCH	14	tr|A0A0G2JR79|A0A0G2JR79_HUMAN Thyroid peroxidase (Fragment) OS=Homo sapiens OX=9606 GN=TPO PE=1 SV=1	300	APAACAPEPGIP
APAAPAPPPGSP	sp|Q81871|CAPSD_HEVCH	14	tr|H0Y6H4|H0Y6H4_HUMAN Thyroid peroxidase (Fragment) OS=Homo sapiens OX=9606 GN=TPO PE=1 SV=1	300	APAACAPEPGIP
APAAPAPPPGSP	sp|Q81871|CAPSD_HEVCH	14	tr|A0A0G2JRZ1|A0A0G2JRZ1_HUMAN Thyroid peroxidase (Fragment) OS=Homo sapiens OX=9606 GN=TPO PE=1 SV=1	371	APAACAPEPGIP
APAAPAPPPGSP	sp|Q81871|CAPSD_HEVCH	14	sp|P07202|PERT_HUMAN Thyroid peroxidase OS=Homo sapiens OX=9606 GN=TPO PE=1 SV=4	371	APAACAPEPGIP
APAAPAPPPGSP	sp|Q81871|CAPSD_HEVCH	14	tr|A0A0G2JP53|A0A0G2JP53_HUMAN Thyroid peroxidase OS=Homo sapiens OX=9606 GN=TPO PE=1 SV=1	371	APAACAPEPGIP
APAAPAPPPGSP	sp|Q81871|CAPSD_HEVCH	14	tr|A0A0G2JR31|A0A0G2JR31_HUMAN Thyroid peroxidase (Fragment) OS=Homo sapiens OX=9606 GN=TPO PE=1 SV=1	371	APAACAPEPGIP
APAAPAPPPGSP	sp|Q81871|CAPSD_HEVCH	14	sp|Q96N03|VTM2L_HUMAN V-set and transmembrane domain-containing protein 2-like protein OS=Homo sapiens OX=9606 GN=VSTM2L PE=1 SV=1	177	PPAAPAPPPPKP
APAAPAPPPGSP	sp|Q81871|CAPSD_HEVCH	14	sp|Q5U5X8|F222A_HUMAN Protein FAM222A OS=Homo sapiens OX=9606 GN=FAM222A PE=2 SV=1	162	PPEAPAPPPGLP
APAAPAPPPGSP	sp|Q81871|CAPSD_HEVCH	14	sp|Q16760|DGKD_HUMAN Diacylglycerol kinase delta OS=Homo sapiens OX=9606 GN=DGKD PE=1 SV=4	2	AAAAGAPPPGPP
APAAPAPPPGSP	sp|Q81871|CAPSD_HEVCH	14	tr|C9JY42|C9JY42_HUMAN Diacylglycerol kinase delta (Fragment) OS=Homo sapiens OX=9606 GN=DGKD PE=1 SV=1	2	AAAAGAPPPGPP
APAAPAPPPGSP	sp|Q81871|CAPSD_HEVCH	14	sp|P85037|FOXK1_HUMAN Forkhead box protein K1 OS=Homo sapiens OX=9606 GN=FOXK1 PE=1 SV=1	42	APAQPQPPPGPP
APAAPAPPPGSP	sp|Q81871|CAPSD_HEVCH	14	sp|Q7Z6J2|GRASP_HUMAN Protein TAMALIN OS=Homo sapiens OX=9606 GN=TAMALIN PE=1 SV=1	31	APAAPVPTPGPP
APAAPAPPPGSP	sp|Q81871|CAPSD_HEVCH	14	sp|Q5VSG8|MANEL_HUMAN Glycoprotein endo-alpha-1,2-mannosidase-like protein OS=Homo sapiens OX=9606 GN=MANEAL PE=2 SV=1	61	APAAPAAPPPPP
APAAPAPPPGSP	sp|Q81871|CAPSD_HEVCH	14	sp|Q5VSG8|MANEL_HUMAN Glycoprotein endo-alpha-1,2-mannosidase-like protein OS=Homo sapiens OX=9606 GN=MANEAL PE=2 SV=1	64	APAAPPPPPPPP
APAAPAPPPGSP	sp|Q81871|CAPSD_HEVCH	14	sp|Q02779|M3K10_HUMAN Mitogen-activated protein kinase kinase kinase 10 OS=Homo sapiens OX=9606 GN=MAP3K10 PE=1 SV=3	770	APAAPSPPPSPP
APAAPAPPPGSP	sp|Q81871|CAPSD_HEVCH	14	sp|Q76G19|PDZD4_HUMAN PDZ domain-containing protein 4 OS=Homo sapiens OX=9606 GN=PDZD4 PE=1 SV=1	513	TPAKAAPPPGSP
APAAPAPPPGSP	sp|Q81871|CAPSD_HEVCH	14	tr|Q17RL8|Q17RL8_HUMAN HCG2004980, isoform CRA_e OS=Homo sapiens OX=9606 GN=PDZD4 PE=1 SV=1	519	TPAKAAPPPGSP
APAAPAPPPGSP	sp|Q81871|CAPSD_HEVCH	14	sp|O14841|OPLA_HUMAN 5-oxoprolinase OS=Homo sapiens OX=9606 GN=OPLAH PE=1 SV=3	1255	DPEDPAPPPGSP
APAAPAPPPGSP	sp|Q81871|CAPSD_HEVCH	14	sp|Q96RY5|CRML_HUMAN Protein cramped-like OS=Homo sapiens OX=9606 GN=CRAMP1 PE=1 SV=3	65	APQAPSPPQGSP
APAAPAPPPGSP	sp|Q81871|CAPSD_HEVCH	14	sp|Q9BWW7|SCRT1_HUMAN Transcriptional repressor scratch 1 OS=Homo sapiens OX=9606 GN=SCRT1 PE=1 SV=1	334	GPAAPAPPQLSP
APAAPAPPPGSP	sp|Q81871|CAPSD_HEVCH	14	sp|Q68BL8|OLM2B_HUMAN Olfactomedin-like protein 2B OS=Homo sapiens OX=9606 GN=OLFML2B PE=2 SV=2	428	QPAAPAPPAVSP
APAAPAPPPGSP	sp|Q81871|CAPSD_HEVCH	14	tr|F2Z3N3|F2Z3N3_HUMAN Olfactomedin-like protein 2B OS=Homo sapiens OX=9606 GN=OLFML2B PE=1 SV=1	429	QPAAPAPPAVSP
RAVLDDAPTVPP	sp|Q81862|POLN_HEVCH	1025	sp|Q86UU0|BCL9L_HUMAN B-cell CLL/lymphoma 9-like protein OS=Homo sapiens OX=9606 GN=BCL9L PE=1 SV=1	273	RAKLDQAPKVPP
RAVLDDAPTVPP	sp|Q81862|POLN_HEVCH	1025	tr|A0A087WZX0|A0A087WZX0_HUMAN B-cell CLL/lymphoma 9-like protein OS=Homo sapiens OX=9606 GN=BCL9L PE=1 SV=1	236	RAKLDQAPKVPP
PADTGVVAYSLR	sp|Q81862|POLN_HEVCH	156	sp|Q9H1E5|TMX4_HUMAN Thioredoxin-related transmembrane protein 4 OS=Homo sapiens OX=9606 GN=TMX4 PE=1 SV=1	327	PADTEVVEDSLR
PGLVHQLLGALT	sp|Q81862|POLN_HEVCH	1654	sp|Q86U38|NOP9_HUMAN Nucleolar protein 9 OS=Homo sapiens OX=9606 GN=NOP9 PE=1 SV=1	499	PGLVLRSLGALT
PGLVHQLLGALT	sp|Q81862|POLN_HEVCH	1654	tr|A0A3B3ISH6|A0A3B3ISH6_HUMAN Nucleolar protein 9 (Fragment) OS=Homo sapiens OX=9606 GN=NOP9 PE=1 SV=1	327	PGLVLRSLGALT
RIPPELAAPPGQ	sp|Q81862|POLN_HEVCH	191	sp|Q9H6K5|PRR36_HUMAN Proline-rich protein 36 OS=Homo sapiens OX=9606 GN=PRR36 PE=1 SV=2	978	RVPPLLAAPPLQ
DVLTSPASPEAG	sp|Q81862|POLN_HEVCH	709	tr|X6R3U4|X6R3U4_HUMAN Pleckstrin homology domain-containing family H member 3 OS=Homo sapiens OX=9606 GN=PLEKHH3 PE=1 SV=1	467	DVLTSLAAEEAG
DVLTSPASPEAG	sp|Q81862|POLN_HEVCH	709	sp|Q9BQQ3|GORS1_HUMAN Golgi reassembly-stacking protein 1 OS=Homo sapiens OX=9606 GN=GORASP1 PE=1 SV=3	390	DSLTSAASPEDG
DVLTSPASPEAG	sp|Q81862|POLN_HEVCH	709	tr|B4E1H8|B4E1H8_HUMAN Golgi reassembly-stacking protein 1 OS=Homo sapiens OX=9606 GN=GORASP1 PE=1 SV=1	295	DSLTSAASPEDG
DVLTSPASPEAG	sp|Q81862|POLN_HEVCH	709	tr|B3KPY8|B3KPY8_HUMAN Golgi reassembly stacking protein 1, 65kDa, isoform CRA_f OS=Homo sapiens OX=9606 GN=GORASP1 PE=1 SV=1	235	DSLTSAASPEDG
SLDAELLLVPNR	sp|Q81862|POLN_HEVCH	987	sp|Q6IQ22|RAB12_HUMAN Ras-related protein Rab-12 OS=Homo sapiens OX=9606 GN=RAB12 PE=1 SV=3	145	SEDAELLLVGNK
SLDAELLLVPNR	sp|Q81862|POLN_HEVCH	987	tr|A0A3B3ITT1|A0A3B3ITT1_HUMAN Ras-related protein Rab-12 OS=Homo sapiens OX=9606 GN=RAB12 PE=1 SV=1	241	SEDAELLLVGNK
APLPPPLPEPSP	sp|Q81862|POLN_HEVCH	738	tr|F5H1F6|F5H1F6_HUMAN Vacuolar protein sorting-associated protein 37B (Fragment) OS=Homo sapiens OX=9606 GN=VPS37B PE=1 SV=1	172	APLPPRLPELAP
APLPPPLPEPSP	sp|Q81862|POLN_HEVCH	738	tr|F5H4M0|F5H4M0_HUMAN Vacuolar protein sorting-associated protein 37B (Fragment) OS=Homo sapiens OX=9606 GN=VPS37B PE=1 SV=1	172	APLPPRLPELAP
APLPPPLPEPSP	sp|Q81862|POLN_HEVCH	738	sp|Q9H9H4|VP37B_HUMAN Vacuolar protein sorting-associated protein 37B OS=Homo sapiens OX=9606 GN=VPS37B PE=1 SV=1	174	APLPPRLPELAP
APLPPPLPEPSP	sp|Q81862|POLN_HEVCH	738	sp|Q5T953|IER5L_HUMAN Immediate early response gene 5-like protein OS=Homo sapiens OX=9606 GN=IER5L PE=2 SV=1	183	APLPLPLPPPAP
APLPPPLPEPSP	sp|Q81862|POLN_HEVCH	738	sp|Q9Y3S1|WNK2_HUMAN Serine/threonine-protein kinase WNK2 OS=Homo sapiens OX=9606 GN=WNK2 PE=1 SV=4	1510	EPLPPPAPEPSP
APLPPPLPEPSP	sp|Q81862|POLN_HEVCH	738	tr|F8W9F9|F8W9F9_HUMAN Non-specific serine/threonine protein kinase OS=Homo sapiens OX=9606 GN=WNK2 PE=1 SV=1	1473	EPLPPPAPEPSP
APLPPPLPEPSP	sp|Q81862|POLN_HEVCH	738	tr|H0Y493|H0Y493_HUMAN Serine/threonine-protein kinase WNK2 (Fragment) OS=Homo sapiens OX=9606 GN=WNK2 PE=1 SV=1	270	EPLPPPAPEPSP
APLPPPLPEPSP	sp|Q81862|POLN_HEVCH	738	tr|H0Y7T5|H0Y7T5_HUMAN Non-specific serine/threonine protein kinase (Fragment) OS=Homo sapiens OX=9606 GN=WNK2 PE=1 SV=1	1469	EPLPPPAPEPSP
APLPPPLPEPSP	sp|Q81862|POLN_HEVCH	738	tr|H0Y7R3|H0Y7R3_HUMAN Non-specific serine/threonine protein kinase (Fragment) OS=Homo sapiens OX=9606 GN=WNK2 PE=1 SV=1	1077	EPLPPPAPEPSP
APLPPPLPEPSP	sp|Q81862|POLN_HEVCH	738	sp|Q9H3P7|GCP60_HUMAN Golgi resident protein GCP60 OS=Homo sapiens OX=9606 GN=ACBD3 PE=1 SV=4	33	PLLPPPLPPPSP
APLPPPLPEPSP	sp|Q81862|POLN_HEVCH	738	tr|I3L2J3|I3L2J3_HUMAN Transmembrane protein 88 OS=Homo sapiens OX=9606 GN=TMEM88 PE=1 SV=1	79	PALPPPLPERSP
APLPPPLPEPSP	sp|Q81862|POLN_HEVCH	738	sp|A6NGB9|WIPF3_HUMAN WAS/WASL-interacting protein family member 3 OS=Homo sapiens OX=9606 GN=WIPF3 PE=1 SV=4	184	PPLPPPLPSSSP
APLPPPLPEPSP	sp|Q81862|POLN_HEVCH	738	tr|A0A0A0MSG0|A0A0A0MSG0_HUMAN WAS/WASL-interacting protein family member 3 OS=Homo sapiens OX=9606 GN=WIPF3 PE=1 SV=1	184	PPLPPPLPSSSP
