query	query_seqname	query_start	target_seqname	target_start	target
LSYISNYSETLE	sp|Q91E96|VP2_ROTHC	612	sp|Q86YT6|MIB1_HUMAN E3 ubiquitin-protein ligase MIB1 OS=Homo sapiens OX=9606 GN=MIB1 PE=1 SV=1	806	PSMISNDSETLE
KTCVGQLCGGQS	sp|Q9PY93|NSP2_ROTHC	267	tr|Q5SY21|Q5SY21_HUMAN Telomere zinc finger-associated protein (Fragment) OS=Homo sapiens OX=9606 GN=ZBTB48 PE=1 SV=1	117	KTSVGQAAGGQS
KTCVGQLCGGQS	sp|Q9PY93|NSP2_ROTHC	267	tr|Q5SY20|Q5SY20_HUMAN Telomere zinc finger-associated protein (Fragment) OS=Homo sapiens OX=9606 GN=ZBTB48 PE=1 SV=1	117	KTSVGQAAGGQS
KTCVGQLCGGQS	sp|Q9PY93|NSP2_ROTHC	267	sp|P10074|TZAP_HUMAN Telomere zinc finger-associated protein OS=Homo sapiens OX=9606 GN=ZBTB48 PE=1 SV=2	117	KTSVGQAAGGQS
WEKESVVNGNEY	sp|Q82041|VP3_ROTHC	161	tr|F5H088|F5H088_HUMAN Glycosyltransferase 1 domain-containing protein 1 OS=Homo sapiens OX=9606 GN=GLT1D1 PE=1 SV=1	313	LEKEIVVNGREY
WEKESVVNGNEY	sp|Q82041|VP3_ROTHC	161	sp|Q96MS3|GL1D1_HUMAN Glycosyltransferase 1 domain-containing protein 1 OS=Homo sapiens OX=9606 GN=GLT1D1 PE=2 SV=2	308	LEKEIVVNGREY
KESVVNGNEYRR	sp|Q82041|VP3_ROTHC	163	tr|F5H088|F5H088_HUMAN Glycosyltransferase 1 domain-containing protein 1 OS=Homo sapiens OX=9606 GN=GLT1D1 PE=1 SV=1	315	KEIVVNGREYVR
KESVVNGNEYRR	sp|Q82041|VP3_ROTHC	163	sp|Q96MS3|GL1D1_HUMAN Glycosyltransferase 1 domain-containing protein 1 OS=Homo sapiens OX=9606 GN=GLT1D1 PE=2 SV=2	310	KEIVVNGREYVR
LYDLPRIPPESA	sp|Q91E96|VP2_ROTHC	655	sp|Q9NWQ8|PHAG1_HUMAN Phosphoprotein associated with glycosphingolipid-enriched microdomains 1 OS=Homo sapiens OX=9606 GN=PAG1 PE=1 SV=2	130	SRELPRIPPESA
PITLLSGNYNMD	sp|P69481|VP6_ROTHC	251	tr|F5GXC5|F5GXC5_HUMAN T-cell immunomodulatory protein OS=Homo sapiens OX=9606 GN=ITFG1 PE=1 SV=1	218	PITLHIGDYNMD
PITLLSGNYNMD	sp|P69481|VP6_ROTHC	251	sp|Q8TB96|TIP_HUMAN T-cell immunomodulatory protein OS=Homo sapiens OX=9606 GN=ITFG1 PE=1 SV=1	331	PITLHIGDYNMD
DTPVFEFKTPLM	sp|P69481|VP6_ROTHC	146	tr|A0A6Q8PFG9|A0A6Q8PFG9_HUMAN Histidine--tRNA ligase, cytoplasmic OS=Homo sapiens OX=9606 GN=HARS1 PE=1 SV=1	93	DTPVFELKETLM
DTPVFEFKTPLM	sp|P69481|VP6_ROTHC	146	tr|A0A6Q8PFN6|A0A6Q8PFN6_HUMAN Histidine--tRNA ligase, cytoplasmic OS=Homo sapiens OX=9606 GN=HARS1 PE=1 SV=1	93	DTPVFELKETLM
DTPVFEFKTPLM	sp|P69481|VP6_ROTHC	146	tr|A0A6Q8PFF2|A0A6Q8PFF2_HUMAN Histidine--tRNA ligase, cytoplasmic OS=Homo sapiens OX=9606 GN=HARS1 PE=1 SV=1	93	DTPVFELKETLM
DTPVFEFKTPLM	sp|P69481|VP6_ROTHC	146	sp|P12081|HARS1_HUMAN Histidine--tRNA ligase, cytoplasmic OS=Homo sapiens OX=9606 GN=HARS1 PE=1 SV=2	93	DTPVFELKETLM
DTPVFEFKTPLM	sp|P69481|VP6_ROTHC	146	tr|E7ETE2|E7ETE2_HUMAN Histidine--tRNA ligase, cytoplasmic OS=Homo sapiens OX=9606 GN=HARS1 PE=1 SV=2	93	DTPVFELKETLM
DTPVFEFKTPLM	sp|P69481|VP6_ROTHC	146	tr|A0A6Q8PF47|A0A6Q8PF47_HUMAN Histidine--tRNA ligase, cytoplasmic OS=Homo sapiens OX=9606 GN=HARS1 PE=1 SV=1	93	DTPVFELKETLM
DTPVFEFKTPLM	sp|P69481|VP6_ROTHC	146	tr|A0A6Q8PHA5|A0A6Q8PHA5_HUMAN Histidine--tRNA ligase, cytoplasmic OS=Homo sapiens OX=9606 GN=HARS1 PE=1 SV=1	93	DTPVFELKETLM
YDLPRIPPESAY	sp|Q91E96|VP2_ROTHC	656	sp|Q9NWQ8|PHAG1_HUMAN Phosphoprotein associated with glycosphingolipid-enriched microdomains 1 OS=Homo sapiens OX=9606 GN=PAG1 PE=1 SV=2	131	RELPRIPPESAV
VLEKKHENYNLV	sp|Q91E95|RDRP_ROTHC	846	tr|D6RJB7|D6RJB7_HUMAN Ankyrin repeat domain-containing protein 31 OS=Homo sapiens OX=9606 GN=ANKRD31 PE=4 SV=2	866	VLYKSHENSNLV
VLEKKHENYNLV	sp|Q91E95|RDRP_ROTHC	846	sp|Q8N7Z5|ANR31_HUMAN Ankyrin repeat domain-containing protein 31 OS=Homo sapiens OX=9606 GN=ANKRD31 PE=2 SV=2	866	VLYKSHENSNLV
GFYLNTGDLQNR	sp|Q82040|VP4_ROTHC	447	tr|C9J6Y5|C9J6Y5_HUMAN Ubinuclein-2 (Fragment) OS=Homo sapiens OX=9606 GN=UBN2 PE=1 SV=1	59	GFYINTGTLQFR
GFYLNTGDLQNR	sp|Q82040|VP4_ROTHC	447	tr|H7C4P8|H7C4P8_HUMAN Ubinuclein-2 (Fragment) OS=Homo sapiens OX=9606 GN=UBN2 PE=1 SV=1	5	GFYINTGTLQFR
GFYLNTGDLQNR	sp|Q82040|VP4_ROTHC	447	sp|Q6ZU65|UBN2_HUMAN Ubinuclein-2 OS=Homo sapiens OX=9606 GN=UBN2 PE=1 SV=2	236	GFYINTGTLQFR
LPYKILYYDKGI	sp|Q82041|VP3_ROTHC	124	sp|Q96RL7|VP13A_HUMAN Vacuolar protein sorting-associated protein 13A OS=Homo sapiens OX=9606 GN=VPS13A PE=1 SV=2	2117	LPYKIAYYIEGI
SDLPSVISFLSN	sp|Q82040|VP4_ROTHC	715	tr|E7ETB9|E7ETB9_HUMAN Dystonin (Fragment) OS=Homo sapiens OX=9606 GN=DST PE=1 SV=1	669	SDLPSVESHLEN
SDLPSVISFLSN	sp|Q82040|VP4_ROTHC	715	tr|A0A494C1D7|A0A494C1D7_HUMAN Dystonin (Fragment) OS=Homo sapiens OX=9606 GN=DST PE=1 SV=1	745	SDLPSVESHLEN
SDLPSVISFLSN	sp|Q82040|VP4_ROTHC	715	tr|F6QMI7|F6QMI7_HUMAN Dystonin OS=Homo sapiens OX=9606 GN=DST PE=1 SV=2	669	SDLPSVESHLEN
SDLPSVISFLSN	sp|Q82040|VP4_ROTHC	715	tr|E9PHM6|E9PHM6_HUMAN Dystonin OS=Homo sapiens OX=9606 GN=DST PE=1 SV=3	629	SDLPSVESHLEN
SDLPSVISFLSN	sp|Q82040|VP4_ROTHC	715	sp|Q03001|DYST_HUMAN Dystonin OS=Homo sapiens OX=9606 GN=DST PE=1 SV=4	629	SDLPSVESHLEN
SDLPSVISFLSN	sp|Q82040|VP4_ROTHC	715	tr|F8W9J4|F8W9J4_HUMAN Dystonin OS=Homo sapiens OX=9606 GN=DST PE=1 SV=1	629	SDLPSVESHLEN
SDLPSVISFLSN	sp|Q82040|VP4_ROTHC	715	tr|Q6P0N6|Q6P0N6_HUMAN DST protein OS=Homo sapiens OX=9606 GN=DST PE=1 SV=1	303	SDLPSVESHLEN
AVSDILRGGGYG	sp|Q82040|VP4_ROTHC	287	sp|Q96L96|ALPK3_HUMAN Alpha-protein kinase 3 OS=Homo sapiens OX=9606 GN=ALPK3 PE=2 SV=2	1608	LVSEELRGGGYG
SDMTYFYNIPIG	sp|Q82040|VP4_ROTHC	393	tr|E7ETH1|E7ETH1_HUMAN Potassium voltage-gated channel subfamily C member 3 OS=Homo sapiens OX=9606 GN=KCNC3 PE=1 SV=1	482	SNHTYFKNIPIG
SDMTYFYNIPIG	sp|Q82040|VP4_ROTHC	393	sp|Q14003|KCNC3_HUMAN Potassium voltage-gated channel subfamily C member 3 OS=Homo sapiens OX=9606 GN=KCNC3 PE=1 SV=3	482	SNHTYFKNIPIG
SDMTYFYNIPIG	sp|Q82040|VP4_ROTHC	393	tr|A0A590UJ62|A0A590UJ62_HUMAN Potassium voltage-gated channel subfamily C member 3 OS=Homo sapiens OX=9606 GN=KCNC3 PE=1 SV=1	482	SNHTYFKNIPIG
SEVLDAEKSLKE	sp|Q91E96|VP2_ROTHC	341	sp|Q9ULD9|ZN608_HUMAN Zinc finger protein 608 OS=Homo sapiens OX=9606 GN=ZNF608 PE=1 SV=4	1257	SEELDREKKLKE
NSCSWSSNILII	sp|Q9PY95|NSP3_ROTHC	198	sp|Q14511|CASL_HUMAN Enhancer of filamentation 1 OS=Homo sapiens OX=9606 GN=NEDD9 PE=1 SV=1	507	NECSWSLNILAI
NSCSWSSNILII	sp|Q9PY95|NSP3_ROTHC	198	tr|A0A087WUD2|A0A087WUD2_HUMAN Enhancer of filamentation 1 OS=Homo sapiens OX=9606 GN=NEDD9 PE=1 SV=1	358	NECSWSLNILAI
DLPRIPPESAYK	sp|Q91E96|VP2_ROTHC	657	sp|Q9NWQ8|PHAG1_HUMAN Phosphoprotein associated with glycosphingolipid-enriched microdomains 1 OS=Homo sapiens OX=9606 GN=PAG1 PE=1 SV=2	132	ELPRIPPESAVD
HAIKKIKSLSRT	sp|Q91E95|RDRP_ROTHC	545	sp|Q02224|CENPE_HUMAN Centromere-associated protein E OS=Homo sapiens OX=9606 GN=CENPE PE=1 SV=2	1107	HAIKKEGELSRT
HAIKKIKSLSRT	sp|Q91E95|RDRP_ROTHC	545	tr|A0A087X0P0|A0A087X0P0_HUMAN Centromere-associated protein E OS=Homo sapiens OX=9606 GN=CENPE PE=1 SV=1	1107	HAIKKEGELSRT
ISNLVGNPLKAY	sp|Q9PY95|NSP3_ROTHC	209	sp|Q6ZW61|BBS12_HUMAN Bardet-Biedl syndrome 12 protein OS=Homo sapiens OX=9606 GN=BBS12 PE=1 SV=2	186	ISNLSGRPLKSY
VVYQDAFRYIRQ	sp|Q91E96|VP2_ROTHC	853	sp|Q9Y3T9|NOC2L_HUMAN Nucleolar complex protein 2 homolog OS=Homo sapiens OX=9606 GN=NOC2L PE=1 SV=4	372	VAYQHAFLYIRQ
KLKSHIIDSAIR	sp|Q91E95|RDRP_ROTHC	793	sp|Q14DG7|T132B_HUMAN Transmembrane protein 132B OS=Homo sapiens OX=9606 GN=TMEM132B PE=2 SV=2	119	KLKSHILDSSIY
RMLFFPLSKRLV	sp|Q9PY93|NSP2_ROTHC	16	tr|D6RA65|D6RA65_HUMAN SH3 domain and tetratricopeptide repeat-containing protein 2 OS=Homo sapiens OX=9606 GN=SH3TC2 PE=1 SV=1	89	RMLFKDLSARLV
RMLFFPLSKRLV	sp|Q9PY93|NSP2_ROTHC	16	tr|A0A6Q8PFZ4|A0A6Q8PFZ4_HUMAN SH3 domain and tetratricopeptide repeat-containing protein 2 OS=Homo sapiens OX=9606 GN=SH3TC2 PE=1 SV=1	89	RMLFKDLSARLV
RMLFFPLSKRLV	sp|Q9PY93|NSP2_ROTHC	16	sp|Q8TF17|S3TC2_HUMAN SH3 domain and tetratricopeptide repeat-containing protein 2 OS=Homo sapiens OX=9606 GN=SH3TC2 PE=2 SV=2	89	RMLFKDLSARLV
RMLFFPLSKRLV	sp|Q9PY93|NSP2_ROTHC	16	tr|E9PDF1|E9PDF1_HUMAN SH3 domain and tetratricopeptide repeat-containing protein 2 OS=Homo sapiens OX=9606 GN=SH3TC2 PE=1 SV=1	89	RMLFKDLSARLV
LLSATIRASKSE	sp|Q91E95|RDRP_ROTHC	1053	sp|P52306|GDS1_HUMAN Rap1 GTPase-GDP dissociation stimulator 1 OS=Homo sapiens OX=9606 GN=RAP1GDS1 PE=1 SV=3	469	LLSALIRHSKSK
DGNSCSWSSNIL	sp|Q9PY95|NSP3_ROTHC	196	sp|Q14511|CASL_HUMAN Enhancer of filamentation 1 OS=Homo sapiens OX=9606 GN=NEDD9 PE=1 SV=1	505	DLNECSWSLNIL
DGNSCSWSSNIL	sp|Q9PY95|NSP3_ROTHC	196	tr|A0A087WUD2|A0A087WUD2_HUMAN Enhancer of filamentation 1 OS=Homo sapiens OX=9606 GN=NEDD9 PE=1 SV=1	356	DLNECSWSLNIL
TNYDSSANPITS	sp|Q89865|VP7_ROTHC	272	tr|H7C1L2|H7C1L2_HUMAN Splicing factor 3A subunit 1 (Fragment) OS=Homo sapiens OX=9606 GN=SF3A1 PE=1 SV=1	215	TNIPSSAPPITS
TNYDSSANPITS	sp|Q89865|VP7_ROTHC	272	sp|Q15459|SF3A1_HUMAN Splicing factor 3A subunit 1 OS=Homo sapiens OX=9606 GN=SF3A1 PE=1 SV=1	564	TNIPSSAPPITS
EKESVVNGNEYR	sp|Q82041|VP3_ROTHC	162	tr|F5H088|F5H088_HUMAN Glycosyltransferase 1 domain-containing protein 1 OS=Homo sapiens OX=9606 GN=GLT1D1 PE=1 SV=1	314	EKEIVVNGREYV
EKESVVNGNEYR	sp|Q82041|VP3_ROTHC	162	sp|Q96MS3|GL1D1_HUMAN Glycosyltransferase 1 domain-containing protein 1 OS=Homo sapiens OX=9606 GN=GLT1D1 PE=2 SV=2	309	EKEIVVNGREYV
SKSEFKKSRNES	sp|Q82055|NSP4_ROTHC	125	sp|Q96N64|PWP2A_HUMAN PWWP domain-containing protein 2A OS=Homo sapiens OX=9606 GN=PWWP2A PE=1 SV=2	346	SKYEDKKRRNES
LKLKLINKCADH	sp|Q91E95|RDRP_ROTHC	1039	tr|U3KQT9|U3KQT9_HUMAN YLP motif-containing protein 1 (Fragment) OS=Homo sapiens OX=9606 GN=YLPM1 PE=1 SV=1	7	RKLKEINKMADH
LKLKLINKCADH	sp|Q91E95|RDRP_ROTHC	1039	sp|P49750|YLPM1_HUMAN YLP motif-containing protein 1 OS=Homo sapiens OX=9606 GN=YLPM1 PE=1 SV=4	1975	RKLKEINKMADH
LKLKLINKCADH	sp|Q91E95|RDRP_ROTHC	1039	tr|F8VU51|F8VU51_HUMAN YLP motif-containing protein 1 OS=Homo sapiens OX=9606 GN=YLPM1 PE=1 SV=1	1269	RKLKEINKMADH
LKLKLINKCADH	sp|Q91E95|RDRP_ROTHC	1039	tr|H0YIQ2|H0YIQ2_HUMAN YLP motif-containing protein 1 (Fragment) OS=Homo sapiens OX=9606 GN=YLPM1 PE=1 SV=1	1528	RKLKEINKMADH
LKLKLINKCADH	sp|Q91E95|RDRP_ROTHC	1039	tr|H0YI23|H0YI23_HUMAN YLP motif-containing protein 1 (Fragment) OS=Homo sapiens OX=9606 GN=YLPM1 PE=1 SV=1	384	RKLKEINKMADH
LLEVILLFRLNL	sp|Q91E96|VP2_ROTHC	626	sp|A0A286YFK9|SIM38_HUMAN Small integral membrane protein 38 OS=Homo sapiens OX=9606 GN=SMIM38 PE=3 SV=1	17	LLVVILLARLIL
LIISNLVGNPLK	sp|Q9PY95|NSP3_ROTHC	207	sp|Q6ZW61|BBS12_HUMAN Bardet-Biedl syndrome 12 protein OS=Homo sapiens OX=9606 GN=BBS12 PE=1 SV=2	184	LTISNLSGRPLK
GPEVILTVNEFL	sp|Q9PY95|NSP3_ROTHC	333	sp|Q96QT4|TRPM7_HUMAN Transient receptor potential cation channel subfamily M member 7 OS=Homo sapiens OX=9606 GN=TRPM7 PE=1 SV=1	293	GPNVILTVLEYL
GPEVILTVNEFL	sp|Q9PY95|NSP3_ROTHC	333	tr|H0YLN8|H0YLN8_HUMAN Non-specific serine/threonine protein kinase OS=Homo sapiens OX=9606 GN=TRPM7 PE=1 SV=1	293	GPNVILTVLEYL
ATAASQRQMTLL	sp|Q91E96|VP2_ROTHC	537	tr|M0R2L8|M0R2L8_HUMAN Izumo sperm-egg fusion protein 2 (Fragment) OS=Homo sapiens OX=9606 GN=IZUMO2 PE=1 SV=1	218	ATAASQVQAILL
LIISMSNLQSGA	sp|Q91E95|RDRP_ROTHC	399	sp|P0DSN7|KVD37_HUMAN Probable non-functional immunoglobulinn kappa variable 1D-37 OS=Homo sapiens OX=9606 GN=IGKV1D-37 PE=1 SV=1	69	LIYSASNLQSGV
LIISMSNLQSGA	sp|Q91E95|RDRP_ROTHC	399	sp|A0A075B6S9|KV137_HUMAN Probable non-functional immunoglobulinn kappa variable 1-37 OS=Homo sapiens OX=9606 GN=IGKV1-37 PE=1 SV=7	69	LIYSASNLQSGV
SSANPITSGTSS	sp|Q89865|VP7_ROTHC	276	tr|H0Y8A2|H0Y8A2_HUMAN Ataxin-7-like protein 1 (Fragment) OS=Homo sapiens OX=9606 GN=ATXN7L1 PE=1 SV=1	2	SSANSISSSTSS
SSANPITSGTSS	sp|Q89865|VP7_ROTHC	276	sp|Q9ULK2|AT7L1_HUMAN Ataxin-7-like protein 1 OS=Homo sapiens OX=9606 GN=ATXN7L1 PE=1 SV=3	403	SSANSISSSTSS
SSANPITSGTSS	sp|Q89865|VP7_ROTHC	276	tr|C9K0V9|C9K0V9_HUMAN Ataxin-7-like protein 1 (Fragment) OS=Homo sapiens OX=9606 GN=ATXN7L1 PE=1 SV=1	279	SSANSISSSTSS
EQLYESRQRLEY	sp|Q91E96|VP2_ROTHC	319	tr|E9PJF6|E9PJF6_HUMAN AMP deaminase 2 (Fragment) OS=Homo sapiens OX=9606 GN=AMPD2 PE=1 SV=1	73	EQLEERRQRLER
EQLYESRQRLEY	sp|Q91E96|VP2_ROTHC	319	tr|E9PIJ1|E9PIJ1_HUMAN AMP deaminase 2 (Fragment) OS=Homo sapiens OX=9606 GN=AMPD2 PE=1 SV=1	36	EQLEERRQRLER
EQLYESRQRLEY	sp|Q91E96|VP2_ROTHC	319	tr|A0A590UK85|A0A590UK85_HUMAN AMP deaminase 2 OS=Homo sapiens OX=9606 GN=AMPD2 PE=1 SV=1	36	EQLEERRQRLER
EQLYESRQRLEY	sp|Q91E96|VP2_ROTHC	319	tr|A0A590UJY6|A0A590UJY6_HUMAN AMP deaminase 2 OS=Homo sapiens OX=9606 GN=AMPD2 PE=1 SV=1	79	EQLEERRQRLER
EQLYESRQRLEY	sp|Q91E96|VP2_ROTHC	319	sp|Q01433|AMPD2_HUMAN AMP deaminase 2 OS=Homo sapiens OX=9606 GN=AMPD2 PE=1 SV=2	154	EQLEERRQRLER
EQLYESRQRLEY	sp|Q91E96|VP2_ROTHC	319	tr|A0A5F9UK94|A0A5F9UK94_HUMAN AMP deaminase OS=Homo sapiens OX=9606 GN=AMPD2 PE=1 SV=1	100	EQLEERRQRLER
EQLYESRQRLEY	sp|Q91E96|VP2_ROTHC	319	tr|H0Y360|H0Y360_HUMAN AMP deaminase OS=Homo sapiens OX=9606 GN=AMPD2 PE=1 SV=2	100	EQLEERRQRLER
VSDILRGGGYGF	sp|Q82040|VP4_ROTHC	288	sp|Q96L96|ALPK3_HUMAN Alpha-protein kinase 3 OS=Homo sapiens OX=9606 GN=ALPK3 PE=2 SV=2	1609	VSEELRGGGYGC
TLIISMSNLQSG	sp|Q91E95|RDRP_ROTHC	398	sp|P0DSN7|KVD37_HUMAN Probable non-functional immunoglobulinn kappa variable 1D-37 OS=Homo sapiens OX=9606 GN=IGKV1D-37 PE=1 SV=1	68	LLIYSASNLQSG
TLIISMSNLQSG	sp|Q91E95|RDRP_ROTHC	398	sp|A0A075B6S9|KV137_HUMAN Probable non-functional immunoglobulinn kappa variable 1-37 OS=Homo sapiens OX=9606 GN=IGKV1-37 PE=1 SV=7	68	LLIYSASNLQSG
NVRDKLYGGTLP	sp|Q82040|VP4_ROTHC	332	sp|Q8WTX9|ZDHC1_HUMAN Palmitoyltransferase ZDHHC1 OS=Homo sapiens OX=9606 GN=ZDHHC1 PE=1 SV=1	109	NVRDKSYAGPLP
NVRDKLYGGTLP	sp|Q82040|VP4_ROTHC	332	tr|I3L202|I3L202_HUMAN Palmitoyltransferase OS=Homo sapiens OX=9606 GN=ZDHHC1 PE=1 SV=2	109	NVRDKSYAGPLP
VPPVDLKSPLPI	sp|Q91E95|RDRP_ROTHC	443	sp|Q9Y534|CSDC2_HUMAN Cold shock domain-containing protein C2 OS=Homo sapiens OX=9606 GN=CSDC2 PE=1 SV=1	40	VPPRDLPSPLPT
VPPVDLKSPLPI	sp|Q91E95|RDRP_ROTHC	443	tr|H7C4E7|H7C4E7_HUMAN Cold shock domain-containing protein C2 (Fragment) OS=Homo sapiens OX=9606 GN=CSDC2 PE=1 SV=1	23	VPPRDLPSPLPT
CNQDIEMKKNVI	sp|Q00682|NSP5_ROTHC	60	sp|Q9UPS8|ANR26_HUMAN Ankyrin repeat domain-containing protein 26 OS=Homo sapiens OX=9606 GN=ANKRD26 PE=1 SV=4	1344	CNLDQEMKKNVE
CNQDIEMKKNVI	sp|Q00682|NSP5_ROTHC	60	tr|E7ESJ3|E7ESJ3_HUMAN Ankyrin repeat domain-containing protein 26 OS=Homo sapiens OX=9606 GN=ANKRD26 PE=1 SV=2	1343	CNLDQEMKKNVE
CNQDIEMKKNVI	sp|Q00682|NSP5_ROTHC	60	tr|A0A6Q8PG48|A0A6Q8PG48_HUMAN Ankyrin repeat domain-containing protein 26 (Fragment) OS=Homo sapiens OX=9606 GN=ANKRD26 PE=1 SV=1	150	CNLDQEMKKNVE
SYSDANSVVLMT	sp|Q82040|VP4_ROTHC	601	sp|Q9Y3N9|OR2W1_HUMAN Olfactory receptor 2W1 OS=Homo sapiens OX=9606 GN=OR2W1 PE=2 SV=1	150	SISLANSVVLCT
MEINYHAVDSRK	sp|Q82041|VP3_ROTHC	370	sp|Q9UQD0|SCN8A_HUMAN Sodium channel protein type 8 subunit alpha OS=Homo sapiens OX=9606 GN=SCN8A PE=1 SV=1	1416	MDIMYAAVDSRK
MEINYHAVDSRK	sp|Q82041|VP3_ROTHC	370	tr|A0A590UK43|A0A590UK43_HUMAN Sodium channel protein OS=Homo sapiens OX=9606 GN=SCN8A PE=1 SV=1	1375	MDIMYAAVDSRK
VSNQLKEIAASV	sp|Q82040|VP4_ROTHC	549	sp|Q9NZJ4|SACS_HUMAN Sacsin OS=Homo sapiens OX=9606 GN=SACS PE=1 SV=2	2293	VINQLKEVAKSV
QCNQDIEMKKNV	sp|Q00682|NSP5_ROTHC	59	sp|Q9UPS8|ANR26_HUMAN Ankyrin repeat domain-containing protein 26 OS=Homo sapiens OX=9606 GN=ANKRD26 PE=1 SV=4	1343	ECNLDQEMKKNV
QCNQDIEMKKNV	sp|Q00682|NSP5_ROTHC	59	tr|E7ESJ3|E7ESJ3_HUMAN Ankyrin repeat domain-containing protein 26 OS=Homo sapiens OX=9606 GN=ANKRD26 PE=1 SV=2	1342	ECNLDQEMKKNV
QCNQDIEMKKNV	sp|Q00682|NSP5_ROTHC	59	tr|A0A6Q8PG48|A0A6Q8PG48_HUMAN Ankyrin repeat domain-containing protein 26 (Fragment) OS=Homo sapiens OX=9606 GN=ANKRD26 PE=1 SV=1	149	ECNLDQEMKKNV
ESQAITQEIYKE	sp|Q91E95|RDRP_ROTHC	119	tr|A0A087WTJ2|A0A087WTJ2_HUMAN GIMAP1-GIMAP5 readthrough OS=Homo sapiens OX=9606 GN=GIMAP1-GIMAP5 PE=1 SV=1	292	ESQADTQELYKN
ESQAITQEIYKE	sp|Q91E95|RDRP_ROTHC	119	sp|Q96F15|GIMA5_HUMAN GTPase IMAP family member 5 OS=Homo sapiens OX=9606 GN=GIMAP5 PE=1 SV=1	88	ESQADTQELYKN
DLLSATIRASKS	sp|Q91E95|RDRP_ROTHC	1052	sp|P52306|GDS1_HUMAN Rap1 GTPase-GDP dissociation stimulator 1 OS=Homo sapiens OX=9606 GN=RAP1GDS1 PE=1 SV=3	468	RLLSALIRHSKS
KAAINKFKRDLD	sp|Q9PY94|NSP1_ROTHC	332	sp|Q15054|DPOD3_HUMAN DNA polymerase delta subunit 3 OS=Homo sapiens OX=9606 GN=POLD3 PE=1 SV=2	241	KAAMNKFKVNLD
IKLKSHIIDSAI	sp|Q91E95|RDRP_ROTHC	792	sp|Q14DG7|T132B_HUMAN Transmembrane protein 132B OS=Homo sapiens OX=9606 GN=TMEM132B PE=2 SV=2	118	WKLKSHILDSSI
SANPITSGTSSR	sp|Q89865|VP7_ROTHC	277	tr|F5H858|F5H858_HUMAN Phosphatase and actin regulator (Fragment) OS=Homo sapiens OX=9606 GN=PHACTR2 PE=1 SV=1	110	SASPSTSSTSSR
SANPITSGTSSR	sp|Q89865|VP7_ROTHC	277	tr|F6TH74|F6TH74_HUMAN Phosphatase and actin regulator (Fragment) OS=Homo sapiens OX=9606 GN=PHACTR2 PE=1 SV=1	113	SASPSTSSTSSR
SANPITSGTSSR	sp|Q89865|VP7_ROTHC	277	tr|J3KP75|J3KP75_HUMAN Phosphatase and actin regulator OS=Homo sapiens OX=9606 GN=PHACTR2 PE=1 SV=1	223	SASPSTSSTSSR
SANPITSGTSSR	sp|Q89865|VP7_ROTHC	277	sp|O75167|PHAR2_HUMAN Phosphatase and actin regulator 2 OS=Homo sapiens OX=9606 GN=PHACTR2 PE=1 SV=2	235	SASPSTSSTSSR
YESQAITQEIYK	sp|Q91E95|RDRP_ROTHC	118	tr|A0A087WTJ2|A0A087WTJ2_HUMAN GIMAP1-GIMAP5 readthrough OS=Homo sapiens OX=9606 GN=GIMAP1-GIMAP5 PE=1 SV=1	291	FESQADTQELYK
YESQAITQEIYK	sp|Q91E95|RDRP_ROTHC	118	sp|Q96F15|GIMA5_HUMAN GTPase IMAP family member 5 OS=Homo sapiens OX=9606 GN=GIMAP5 PE=1 SV=1	87	FESQADTQELYK
INYHAVDSRKVD	sp|Q82041|VP3_ROTHC	372	sp|Q9UQD0|SCN8A_HUMAN Sodium channel protein type 8 subunit alpha OS=Homo sapiens OX=9606 GN=SCN8A PE=1 SV=1	1418	IMYAAVDSRKPD
INYHAVDSRKVD	sp|Q82041|VP3_ROTHC	372	tr|A0A590UK43|A0A590UK43_HUMAN Sodium channel protein OS=Homo sapiens OX=9606 GN=SCN8A PE=1 SV=1	1377	IMYAAVDSRKPD
YEQLYESRQRLE	sp|Q91E96|VP2_ROTHC	318	tr|E9PJF6|E9PJF6_HUMAN AMP deaminase 2 (Fragment) OS=Homo sapiens OX=9606 GN=AMPD2 PE=1 SV=1	72	IEQLEERRQRLE
YEQLYESRQRLE	sp|Q91E96|VP2_ROTHC	318	tr|E9PIJ1|E9PIJ1_HUMAN AMP deaminase 2 (Fragment) OS=Homo sapiens OX=9606 GN=AMPD2 PE=1 SV=1	35	IEQLEERRQRLE
YEQLYESRQRLE	sp|Q91E96|VP2_ROTHC	318	tr|A0A590UK85|A0A590UK85_HUMAN AMP deaminase 2 OS=Homo sapiens OX=9606 GN=AMPD2 PE=1 SV=1	35	IEQLEERRQRLE
YEQLYESRQRLE	sp|Q91E96|VP2_ROTHC	318	tr|A0A590UJY6|A0A590UJY6_HUMAN AMP deaminase 2 OS=Homo sapiens OX=9606 GN=AMPD2 PE=1 SV=1	78	IEQLEERRQRLE
YEQLYESRQRLE	sp|Q91E96|VP2_ROTHC	318	sp|Q01433|AMPD2_HUMAN AMP deaminase 2 OS=Homo sapiens OX=9606 GN=AMPD2 PE=1 SV=2	153	IEQLEERRQRLE
YEQLYESRQRLE	sp|Q91E96|VP2_ROTHC	318	tr|A0A5F9UK94|A0A5F9UK94_HUMAN AMP deaminase OS=Homo sapiens OX=9606 GN=AMPD2 PE=1 SV=1	99	IEQLEERRQRLE
YEQLYESRQRLE	sp|Q91E96|VP2_ROTHC	318	tr|H0Y360|H0Y360_HUMAN AMP deaminase OS=Homo sapiens OX=9606 GN=AMPD2 PE=1 SV=2	99	IEQLEERRQRLE
TAIAGSNGPGKS	sp|Q89865|VP7_ROTHC	83	tr|E5RFN6|E5RFN6_HUMAN ATP-binding cassette sub-family A member 10 OS=Homo sapiens OX=9606 GN=ABCA10 PE=1 SV=1	423	TAILGHNGAGKS
TAIAGSNGPGKS	sp|Q89865|VP7_ROTHC	83	sp|Q8WWZ4|ABCAA_HUMAN ATP-binding cassette sub-family A member 10 OS=Homo sapiens OX=9606 GN=ABCA10 PE=2 SV=3	423	TAILGHNGAGKS
TAIAGSNGPGKS	sp|Q89865|VP7_ROTHC	83	sp|Q14683|SMC1A_HUMAN Structural maintenance of chromosomes protein 1A OS=Homo sapiens OX=9606 GN=SMC1A PE=1 SV=2	28	TAIIGPNGSGKS
FSVASYDSKDIE	sp|Q82041|VP3_ROTHC	309	sp|Q8NCM8|DYHC2_HUMAN Cytoplasmic dynein 2 heavy chain 1 OS=Homo sapiens OX=9606 GN=DYNC2H1 PE=1 SV=4	1114	FSLASSISKDIE
FSVASYDSKDIE	sp|Q82041|VP3_ROTHC	309	tr|A0A3B3ISP9|A0A3B3ISP9_HUMAN Cytoplasmic dynein 2 heavy chain 1 OS=Homo sapiens OX=9606 GN=DYNC2H1 PE=1 SV=1	1120	FSLASSISKDIE
EVPPVDLKSPLP	sp|Q91E95|RDRP_ROTHC	442	sp|Q9Y534|CSDC2_HUMAN Cold shock domain-containing protein C2 OS=Homo sapiens OX=9606 GN=CSDC2 PE=1 SV=1	39	GVPPRDLPSPLP
EVPPVDLKSPLP	sp|Q91E95|RDRP_ROTHC	442	tr|H7C4E7|H7C4E7_HUMAN Cold shock domain-containing protein C2 (Fragment) OS=Homo sapiens OX=9606 GN=CSDC2 PE=1 SV=1	22	GVPPRDLPSPLP
TSDLVSGHAANI	sp|Q91E96|VP2_ROTHC	498	sp|Q2NL67|PARP6_HUMAN Protein mono-ADP-ribosyltransferase PARP6 OS=Homo sapiens OX=9606 GN=PARP6 PE=1 SV=1	249	TSPLVSGHCKNI
TSDLVSGHAANI	sp|Q91E96|VP2_ROTHC	498	tr|H3BRR4|H3BRR4_HUMAN Poly (ADP-ribose) polymerase family, member 6, isoform CRA_b OS=Homo sapiens OX=9606 GN=PARP6 PE=4 SV=1	249	TSPLVSGHCKNI
TSDLVSGHAANI	sp|Q91E96|VP2_ROTHC	498	tr|F5H3B4|F5H3B4_HUMAN Poly [ADP-ribose] polymerase (Fragment) OS=Homo sapiens OX=9606 GN=PARP6 PE=4 SV=2	249	TSPLVSGHCKNI
TSDLVSGHAANI	sp|Q91E96|VP2_ROTHC	498	tr|A0A087X1Y8|A0A087X1Y8_HUMAN Protein mono-ADP-ribosyltransferase PARP6 OS=Homo sapiens OX=9606 GN=PARP6 PE=4 SV=1	249	TSPLVSGHCKNI
LKDRGKNNSVLI	sp|Q9PY95|NSP3_ROTHC	123	tr|B1AKP2|B1AKP2_HUMAN Tetraspanin (Fragment) OS=Homo sapiens OX=9606 GN=TSPAN2 PE=1 SV=1	126	LKDRGKGNGTLI
LKDRGKNNSVLI	sp|Q9PY95|NSP3_ROTHC	123	sp|O60636|TSN2_HUMAN Tetraspanin-2 OS=Homo sapiens OX=9606 GN=TSPAN2 PE=1 SV=2	132	LKDRGKGNGTLI
LKDRGKNNSVLI	sp|Q9PY95|NSP3_ROTHC	123	tr|B1AKP1|B1AKP1_HUMAN Tetraspanin OS=Homo sapiens OX=9606 GN=TSPAN2 PE=1 SV=1	107	LKDRGKGNGTLI
LGNAVSSRTLIV	sp|Q91E96|VP2_ROTHC	387	sp|Q86VF2|IGFN1_HUMAN Immunoglobulin-like and fibronectin type III domain-containing protein 1 OS=Homo sapiens OX=9606 GN=IGFN1 PE=1 SV=2	1235	LGQAVSTATLIV
DIRIMASNAGLK	sp|Q9PY95|NSP3_ROTHC	99	sp|Q09328|MGT5A_HUMAN Alpha-1,6-mannosylglycoprotein 6-beta-N-acetylglucosaminyltransferase A OS=Homo sapiens OX=9606 GN=MGAT5 PE=1 SV=1	314	DIRISASLAELK
KLKLINKCADHG	sp|Q91E95|RDRP_ROTHC	1040	tr|U3KQT9|U3KQT9_HUMAN YLP motif-containing protein 1 (Fragment) OS=Homo sapiens OX=9606 GN=YLPM1 PE=1 SV=1	8	KLKEINKMADHW
KLKLINKCADHG	sp|Q91E95|RDRP_ROTHC	1040	sp|P49750|YLPM1_HUMAN YLP motif-containing protein 1 OS=Homo sapiens OX=9606 GN=YLPM1 PE=1 SV=4	1976	KLKEINKMADHW
KLKLINKCADHG	sp|Q91E95|RDRP_ROTHC	1040	tr|F8VU51|F8VU51_HUMAN YLP motif-containing protein 1 OS=Homo sapiens OX=9606 GN=YLPM1 PE=1 SV=1	1270	KLKEINKMADHW
KLKLINKCADHG	sp|Q91E95|RDRP_ROTHC	1040	tr|H0YIQ2|H0YIQ2_HUMAN YLP motif-containing protein 1 (Fragment) OS=Homo sapiens OX=9606 GN=YLPM1 PE=1 SV=1	1529	KLKEINKMADHW
KLKLINKCADHG	sp|Q91E95|RDRP_ROTHC	1040	tr|H0YI23|H0YI23_HUMAN YLP motif-containing protein 1 (Fragment) OS=Homo sapiens OX=9606 GN=YLPM1 PE=1 SV=1	385	KLKEINKMADHW
SYISNYSETLEN	sp|Q91E96|VP2_ROTHC	613	sp|Q86YT6|MIB1_HUMAN E3 ubiquitin-protein ligase MIB1 OS=Homo sapiens OX=9606 GN=MIB1 PE=1 SV=1	807	SMISNDSETLEE
LPRIPPESAYKI	sp|Q91E96|VP2_ROTHC	658	sp|Q9NWQ8|PHAG1_HUMAN Phosphoprotein associated with glycosphingolipid-enriched microdomains 1 OS=Homo sapiens OX=9606 GN=PAG1 PE=1 SV=2	133	LPRIPPESAVDT
