query	query_seqname	query_start	target_seqname	target_start	target
LNLAIADLKPLL	tr|A9LXW2|A9LXW2_BUNSH	1340	tr|G3V244|G3V244_HUMAN Leukotriene B4 receptor 1 (Fragment) OS=Homo sapiens OX=9606 GN=LTB4R PE=4 SV=1	58	LNLALADLAVLL
LNLAIADLKPLL	tr|A9LXW2|A9LXW2_BUNSH	1340	sp|Q15722|LT4R1_HUMAN Leukotriene B4 receptor 1 OS=Homo sapiens OX=9606 GN=LTB4R PE=1 SV=2	58	LNLALADLAVLL
LNLAIADLKPLL	tr|A9LXW2|A9LXW2_BUNSH	1340	sp|P47211|GALR1_HUMAN Galanin receptor type 1 OS=Homo sapiens OX=9606 GN=GALR1 PE=1 SV=3	75	LNLSIADLAYLL
LNLAIADLKPLL	tr|A9LXW2|A9LXW2_BUNSH	1340	tr|A0A140T9K6|A0A140T9K6_HUMAN Atypical chemokine receptor 3 (Fragment) OS=Homo sapiens OX=9606 GN=ACKR3 PE=1 SV=2	84	LNLAIADLWVVL
LNLAIADLKPLL	tr|A9LXW2|A9LXW2_BUNSH	1340	sp|P25106|ACKR3_HUMAN Atypical chemokine receptor 3 OS=Homo sapiens OX=9606 GN=ACKR3 PE=1 SV=3	84	LNLAIADLWVVL
LNLAIADLKPLL	tr|A9LXW2|A9LXW2_BUNSH	1340	sp|P51686|CCR9_HUMAN C-C chemokine receptor type 9 OS=Homo sapiens OX=9606 GN=CCR9 PE=1 SV=2	88	LNLAIADLLFLV
VILLIVYIILPV	tr|A9LXW2|A9LXW2_BUNSH	1408	sp|Q7Z3D4|LYSM3_HUMAN LysM and putative peptidoglycan-binding domain-containing protein 3 OS=Homo sapiens OX=9606 GN=LYSMD3 PE=1 SV=2	223	VIMLIVGIITPV
FKELIKELMSLV	tr|A8WA74|A8WA74_BUNSH	1163	sp|Q86VP3|PACS2_HUMAN Phosphofurin acidic cluster sorting protein 2 OS=Homo sapiens OX=9606 GN=PACS2 PE=1 SV=3	52	FKELEKELISVV
FKELIKELMSLV	tr|A8WA74|A8WA74_BUNSH	1163	tr|F8VW41|F8VW41_HUMAN Phosphofurin acidic cluster sorting protein 2 OS=Homo sapiens OX=9606 GN=PACS2 PE=1 SV=1	52	FKELEKELISVV
LYSSEAITQLTT	tr|A8WA74|A8WA74_BUNSH	1119	tr|E7EPM4|E7EPM4_HUMAN Mucin-17 OS=Homo sapiens OX=9606 GN=MUC17 PE=1 SV=1	228	VASSEAITLLTT
LYSSEAITQLTT	tr|A8WA74|A8WA74_BUNSH	1119	sp|Q685J3|MUC17_HUMAN Mucin-17 OS=Homo sapiens OX=9606 GN=MUC17 PE=1 SV=2	228	VASSEAITLLTT
TSAAQPLADNTG	tr|A9YU75|A9YU75_BUNSH	121	sp|P34910|EVI2B_HUMAN Protein EVI2B OS=Homo sapiens OX=9606 GN=EVI2B PE=1 SV=2	96	TSAGQPLAYNTK
SLEGSDSADGAE	tr|A9LXW2|A9LXW2_BUNSH	966	sp|Q08499|PDE4D_HUMAN cAMP-specific 3',5'-cyclic phosphodiesterase 4D OS=Homo sapiens OX=9606 GN=PDE4D PE=1 SV=2	14	SGEGSDSAGGAT
QSLGAESGSLFF	tr|A8WA74|A8WA74_BUNSH	1345	sp|Q86V15|CASZ1_HUMAN Zinc finger protein castor homolog 1 OS=Homo sapiens OX=9606 GN=CASZ1 PE=1 SV=4	1620	LSLGAEPGSLLF
