query	query_seqname	query_start	target_seqname	target_start	target
TRLVETLLVVLY	sp|P0C6U2|R1A_CVH22	3689	sp|Q7Z434|MAVS_HUMAN Mitochondrial antiviral-signaling protein OS=Homo sapiens OX=9606 GN=MAVS PE=1 SV=2	524	GVLVVTLLVVLY
TVVTKETNPLVY	sp|P0C6U2|R1A_CVH22	2422	sp|Q8NGX3|O10T2_HUMAN Olfactory receptor 10T2 OS=Homo sapiens OX=9606 GN=OR10T2 PE=3 SV=1	279	TVVTPLLNPLVY
LQTGLGTLDIDY	sp|P15423|SPIKE_CVH22	701	tr|E9PJY4|E9PJY4_HUMAN Puromycin-sensitive aminopeptidase (Fragment) OS=Homo sapiens OX=9606 GN=NPEPPS PE=1 SV=2	108	LQTGTGTLKIDF
LQTGLGTLDIDY	sp|P15423|SPIKE_CVH22	701	tr|E9PP11|E9PP11_HUMAN Puromycin-sensitive aminopeptidase (Fragment) OS=Homo sapiens OX=9606 GN=NPEPPS PE=1 SV=1	124	LQTGTGTLKIDF
LQTGLGTLDIDY	sp|P15423|SPIKE_CVH22	701	sp|P55786|PSA_HUMAN Puromycin-sensitive aminopeptidase OS=Homo sapiens OX=9606 GN=NPEPPS PE=1 SV=2	137	LQTGTGTLKIDF
LQTGLGTLDIDY	sp|P15423|SPIKE_CVH22	701	tr|E9PLK3|E9PLK3_HUMAN Aminopeptidase OS=Homo sapiens OX=9606 GN=NPEPPS PE=1 SV=1	133	LQTGTGTLKIDF
LQTGLGTLDIDY	sp|P15423|SPIKE_CVH22	701	sp|A6NEC2|PSAL_HUMAN Puromycin-sensitive aminopeptidase-like protein OS=Homo sapiens OX=9606 GN=NPEPPSL1 PE=2 SV=3	137	LQTGTGTLKIDF
LQTGLGTLDIDY	sp|P15423|SPIKE_CVH22	701	tr|E9PPD4|E9PPD4_HUMAN Puromycin-sensitive aminopeptidase OS=Homo sapiens OX=9606 GN=NPEPPS PE=1 SV=1	137	LQTGTGTLKIDF
AYLNVAALALLG	sp|P19739|NS4A_CVH22	93	tr|C9J3K6|C9J3K6_HUMAN Protein tweety homolog (Fragment) OS=Homo sapiens OX=9606 GN=TTYH1 PE=3 SV=1	39	ALLLVAALAGLG
AYLNVAALALLG	sp|P19739|NS4A_CVH22	93	tr|E7ET67|E7ET67_HUMAN Protein tweety homolog (Fragment) OS=Homo sapiens OX=9606 GN=TTYH1 PE=1 SV=1	92	ALLLVAALAGLG
AYLNVAALALLG	sp|P19739|NS4A_CVH22	93	sp|Q9H313|TTYH1_HUMAN Protein tweety homolog 1 OS=Homo sapiens OX=9606 GN=TTYH1 PE=1 SV=1	43	ALLLVAALAGLG
AYLNVAALALLG	sp|P19739|NS4A_CVH22	93	tr|F8WBE6|F8WBE6_HUMAN Protein tweety homolog OS=Homo sapiens OX=9606 GN=TTYH1 PE=1 SV=1	43	ALLLVAALAGLG
DAIVKVFNSVTS	sp|P0C6U2|R1A_CVH22	1369	sp|Q9HCI6|K1586_HUMAN E3 SUMO-protein ligase KIAA1586 OS=Homo sapiens OX=9606 GN=KIAA1586 PE=1 SV=2	244	DATVKVFNTVYS
DAIVKVFNSVTS	sp|P0C6U2|R1A_CVH22	1369	tr|F5H2N6|F5H2N6_HUMAN E3 SUMO-protein ligase KIAA1586 OS=Homo sapiens OX=9606 GN=KIAA1586 PE=1 SV=1	217	DATVKVFNTVYS
LIFHILLVFVYV	sp|P19739|NS4A_CVH22	72	sp|Q8IXM6|NRM_HUMAN Nurim OS=Homo sapiens OX=9606 GN=NRM PE=1 SV=1	151	LIFSILLVFDYA
LIFHILLVFVYV	sp|P19739|NS4A_CVH22	72	tr|H0Y6T6|H0Y6T6_HUMAN Nuclear envelope membrane protein (Fragment) OS=Homo sapiens OX=9606 GN=NRM PE=1 SV=1	151	LIFSILLVFDYA
LVETLLVVLYKE	sp|P0C6U2|R1A_CVH22	3691	sp|Q7Z434|MAVS_HUMAN Mitochondrial antiviral-signaling protein OS=Homo sapiens OX=9606 GN=MAVS PE=1 SV=2	526	LVVTLLVVLYRR
SFYCLEHKPRLQ	sp|P0C6X1|R1AB_CVH22	5064	sp|Q13085|ACACA_HUMAN Acetyl-CoA carboxylase 1 OS=Homo sapiens OX=9606 GN=ACACA PE=1 SV=2	432	SFYFLELNPRLQ
LWAAPNALLAVL	sp|P0C6X1|R1AB_CVH22	3333	sp|Q5T3U5|MRP7_HUMAN ATP-binding cassette sub-family C member 10 OS=Homo sapiens OX=9606 GN=ABCC10 PE=1 SV=1	34	LSALPHALLAVL
LWAAPNALLAVL	sp|P0C6X1|R1AB_CVH22	3333	sp|O15303|GRM6_HUMAN Metabotropic glutamate receptor 6 OS=Homo sapiens OX=9606 GN=GRM6 PE=1 SV=2	584	PWAAPPLLLAVL
HLVSLTVVTKET	sp|P0C6U2|R1A_CVH22	2417	sp|Q9BQS7|HEPH_HUMAN Hephaestin OS=Homo sapiens OX=9606 GN=HEPH PE=1 SV=3	1068	HLSPLTVITKET
HLVSLTVVTKET	sp|P0C6U2|R1A_CVH22	2417	tr|E7ES21|E7ES21_HUMAN Hephaestin OS=Homo sapiens OX=9606 GN=HEPH PE=1 SV=1	879	HLSPLTVITKET
HLVSLTVVTKET	sp|P0C6U2|R1A_CVH22	2417	tr|A0A0C4DG76|A0A0C4DG76_HUMAN Hephaestin OS=Homo sapiens OX=9606 GN=HEPH PE=1 SV=1	1071	HLSPLTVITKET
YVQEKVSDFTAE	sp|P0C6U2|R1A_CVH22	622	sp|Q5T0W9|FA83B_HUMAN Protein FAM83B OS=Homo sapiens OX=9606 GN=FAM83B PE=1 SV=1	47	LVQERVSDFLAE
GGTLQALLSLPE	sp|P0C6X1|R1AB_CVH22	445	sp|Q15569|TESK1_HUMAN Dual specificity testis-specific protein kinase 1 OS=Homo sapiens OX=9606 GN=TESK1 PE=1 SV=2	134	GGTLEQLLSSPE
TLAVTLQASGVV	sp|P0C6X1|R1AB_CVH22	1058	sp|Q9NZH0|GPC5B_HUMAN G-protein coupled receptor family C group 5 member B OS=Homo sapiens OX=9606 GN=GPRC5B PE=2 SV=2	271	TLAITLAASGWV
FLANVSDTSALN	sp|P0C6U2|R1A_CVH22	2460	tr|A0A3B3ITG9|A0A3B3ITG9_HUMAN Double-stranded RNA-specific adenosine deaminase (Fragment) OS=Homo sapiens OX=9606 GN=ADAR PE=1 SV=1	11	YLFNVSDSSALN
FLANVSDTSALN	sp|P0C6U2|R1A_CVH22	2460	tr|A0A3B3ISX1|A0A3B3ISX1_HUMAN Double-stranded RNA-specific adenosine deaminase (Fragment) OS=Homo sapiens OX=9606 GN=ADAR PE=1 SV=1	225	YLFNVSDSSALN
FLANVSDTSALN	sp|P0C6U2|R1A_CVH22	2460	sp|P55265|DSRAD_HUMAN Double-stranded RNA-specific adenosine deaminase OS=Homo sapiens OX=9606 GN=ADAR PE=1 SV=4	306	YLFNVSDSSALN
FLANVSDTSALN	sp|P0C6U2|R1A_CVH22	2460	tr|A0A3B3IRQ9|A0A3B3IRQ9_HUMAN Double-stranded RNA-specific adenosine deaminase (Fragment) OS=Homo sapiens OX=9606 GN=ADAR PE=1 SV=1	283	YLFNVSDSSALN
TNTNFLLLRLAG	sp|P0C6X1|R1AB_CVH22	5512	sp|O14804|TAAR5_HUMAN Trace amine-associated receptor 5 OS=Homo sapiens OX=9606 GN=TAAR5 PE=2 SV=2	67	TPTNFLLLSLAL
HFLVSDASLNLE	sp|P0C6U2|R1A_CVH22	1764	tr|I3L412|I3L412_HUMAN Beta-arrestin-2 (Fragment) OS=Homo sapiens OX=9606 GN=ARRB2 PE=1 SV=1	179	HFLMSDRSLHLE
HFLVSDASLNLE	sp|P0C6U2|R1A_CVH22	1764	tr|K7ENA6|K7ENA6_HUMAN Beta-arrestin-2 OS=Homo sapiens OX=9606 GN=ARRB2 PE=1 SV=1	190	HFLMSDRSLHLE
HFLVSDASLNLE	sp|P0C6U2|R1A_CVH22	1764	sp|P32121|ARRB2_HUMAN Beta-arrestin-2 OS=Homo sapiens OX=9606 GN=ARRB2 PE=1 SV=2	190	HFLMSDRSLHLE
NLQVVFGTMGVC	sp|P0C6U2|R1A_CVH22	2601	sp|Q9HAK2|COE2_HUMAN Transcription factor COE2 OS=Homo sapiens OX=9606 GN=EBF2 PE=1 SV=4	281	GLQVVFGTMLVW
NLQVVFGTMGVC	sp|P0C6U2|R1A_CVH22	2601	tr|B7Z934|B7Z934_HUMAN Transcription factor COE2 OS=Homo sapiens OX=9606 GN=EBF2 PE=1 SV=1	133	GLQVVFGTMLVW
NLQVVFGTMGVC	sp|P0C6U2|R1A_CVH22	2601	sp|Q9H4W6|COE3_HUMAN Transcription factor COE3 OS=Homo sapiens OX=9606 GN=EBF3 PE=1 SV=2	291	GLQVVFGTMLVW
NLQVVFGTMGVC	sp|P0C6U2|R1A_CVH22	2601	tr|H0Y3W9|H0Y3W9_HUMAN Transcription factor COE3 OS=Homo sapiens OX=9606 GN=EBF3 PE=1 SV=2	291	GLQVVFGTMLVW
KLLMNMAAKCLA	sp|P0C6X1|R1AB_CVH22	4242	tr|H0YMK4|H0YMK4_HUMAN Protein Lines homolog 1 (Fragment) OS=Homo sapiens OX=9606 GN=LINS1 PE=1 SV=1	142	KLLSHMAAQCLA
KLLMNMAAKCLA	sp|P0C6X1|R1AB_CVH22	4242	tr|H0YKU3|H0YKU3_HUMAN Protein Lines homolog 1 (Fragment) OS=Homo sapiens OX=9606 GN=LINS1 PE=1 SV=1	142	KLLSHMAAQCLA
KLLMNMAAKCLA	sp|P0C6X1|R1AB_CVH22	4242	tr|H3BNS6|H3BNS6_HUMAN Protein Lines homolog 1 (Fragment) OS=Homo sapiens OX=9606 GN=LINS1 PE=4 SV=1	61	KLLSHMAAQCLA
KLLMNMAAKCLA	sp|P0C6X1|R1AB_CVH22	4242	tr|H3BNM9|H3BNM9_HUMAN Protein Lines homolog 1 OS=Homo sapiens OX=9606 GN=LINS1 PE=1 SV=1	23	KLLSHMAAQCLA
KLLMNMAAKCLA	sp|P0C6X1|R1AB_CVH22	4242	sp|Q8NG48|LINES_HUMAN Protein Lines homolog 1 OS=Homo sapiens OX=9606 GN=LINS1 PE=2 SV=2	142	KLLSHMAAQCLA
SVKDVNLTQERN	sp|P0C6X1|R1AB_CVH22	1613	sp|O95487|SC24B_HUMAN Protein transport protein Sec24B OS=Homo sapiens OX=9606 GN=SEC24B PE=1 SV=2	521	SLRPVNLTQERN
GGNAYASNKAYK	sp|P0C6X1|R1AB_CVH22	6001	sp|Q99959|PKP2_HUMAN Plakophilin-2 OS=Homo sapiens OX=9606 GN=PKP2 PE=1 SV=2	827	AGDAYASNKASK
HGVKCAVSEARF	sp|P0C6X1|R1AB_CVH22	5927	tr|C9J1N1|C9J1N1_HUMAN N-chimaerin (Fragment) OS=Homo sapiens OX=9606 GN=CHN1 PE=1 SV=9	180	QGVKCAVLEARK
HGVKCAVSEARF	sp|P0C6X1|R1AB_CVH22	5927	tr|F8W6K2|F8W6K2_HUMAN N-chimaerin (Fragment) OS=Homo sapiens OX=9606 GN=CHN1 PE=1 SV=2	7	QGVKCAVLEARK
HGVKCAVSEARF	sp|P0C6X1|R1AB_CVH22	5927	tr|A0A494C1M7|A0A494C1M7_HUMAN N-chimaerin OS=Homo sapiens OX=9606 GN=CHN1 PE=1 SV=1	107	QGVKCAVLEARK
QVVFGTMGVCYE	sp|P0C6U2|R1A_CVH22	2603	sp|Q9HAK2|COE2_HUMAN Transcription factor COE2 OS=Homo sapiens OX=9606 GN=EBF2 PE=1 SV=4	283	QVVFGTMLVWSE
QVVFGTMGVCYE	sp|P0C6U2|R1A_CVH22	2603	tr|B7Z934|B7Z934_HUMAN Transcription factor COE2 OS=Homo sapiens OX=9606 GN=EBF2 PE=1 SV=1	135	QVVFGTMLVWSE
QVVFGTMGVCYE	sp|P0C6U2|R1A_CVH22	2603	sp|Q9H4W6|COE3_HUMAN Transcription factor COE3 OS=Homo sapiens OX=9606 GN=EBF3 PE=1 SV=2	293	QVVFGTMLVWSE
QVVFGTMGVCYE	sp|P0C6U2|R1A_CVH22	2603	tr|H0Y3W9|H0Y3W9_HUMAN Transcription factor COE3 OS=Homo sapiens OX=9606 GN=EBF3 PE=1 SV=2	293	QVVFGTMLVWSE
KVIGKHLKKDGD	sp|P0C6U2|R1A_CVH22	934	sp|O60437|PEPL_HUMAN Periplakin OS=Homo sapiens OX=9606 GN=PPL PE=1 SV=4	176	KAIGPHLAKDGD
KVIGKHLKKDGD	sp|P0C6U2|R1A_CVH22	934	tr|K7EKI8|K7EKI8_HUMAN Periplakin OS=Homo sapiens OX=9606 GN=PPL PE=1 SV=1	176	KAIGPHLAKDGD
KTVSVFYTTVIC	sp|P0C6U2|R1A_CVH22	2299	sp|Q8NGM9|OR8D4_HUMAN Olfactory receptor 8D4 OS=Homo sapiens OX=9606 GN=OR8D4 PE=2 SV=1	272	KVSSVFYTTVIL
KTVSVFYTTVIC	sp|P0C6U2|R1A_CVH22	2299	sp|Q8NGP6|OR5M8_HUMAN Olfactory receptor 5M8 OS=Homo sapiens OX=9606 GN=OR5M8 PE=2 SV=1	271	KMVAVFYTTVIP
KTVSVFYTTVIC	sp|P0C6U2|R1A_CVH22	2299	sp|Q8NGP3|OR5M9_HUMAN Olfactory receptor 5M9 OS=Homo sapiens OX=9606 GN=OR5M9 PE=3 SV=1	270	KMVAVFYTTVIP
KTVSVFYTTVIC	sp|P0C6U2|R1A_CVH22	2299	tr|A0A286YEX6|A0A286YEX6_HUMAN G_PROTEIN_RECEP_F1_2 domain-containing protein OS=Homo sapiens OX=9606 PE=4 SV=1	375	KMVAVFYTTVIP
KTVSVFYTTVIC	sp|P0C6U2|R1A_CVH22	2299	sp|Q8NGP4|OR5M3_HUMAN Olfactory receptor 5M3 OS=Homo sapiens OX=9606 GN=OR5M3 PE=2 SV=2	270	KMVAVFYTTVIP
KTVSVFYTTVIC	sp|P0C6U2|R1A_CVH22	2299	sp|Q8WZ84|OR8D1_HUMAN Olfactory receptor 8D1 OS=Homo sapiens OX=9606 GN=OR8D1 PE=2 SV=1	272	KVSSVFYTTVIP
KTVSVFYTTVIC	sp|P0C6U2|R1A_CVH22	2299	sp|Q8NGQ6|OR9I1_HUMAN Olfactory receptor 9I1 OS=Homo sapiens OX=9606 GN=OR9I1 PE=3 SV=1	272	KVVSVFYTVVIP
KTVSVFYTTVIC	sp|P0C6U2|R1A_CVH22	2299	sp|Q8WZ94|OR5P3_HUMAN Olfactory receptor 5P3 OS=Homo sapiens OX=9606 GN=OR5P3 PE=2 SV=1	272	KVVSVFYTVVIP
TSLYDCIVDSCS	sp|P0C6X1|R1AB_CVH22	470	tr|H0YFS3|H0YFS3_HUMAN M-phase phosphoprotein 9 (Fragment) OS=Homo sapiens OX=9606 GN=MPHOSPH9 PE=1 SV=9	40	TSQPDCNVDSCS
TSLYDCIVDSCS	sp|P0C6X1|R1AB_CVH22	470	sp|Q99550|MPP9_HUMAN M-phase phosphoprotein 9 OS=Homo sapiens OX=9606 GN=MPHOSPH9 PE=1 SV=4	183	TSQPDCNVDSCS
TSLYDCIVDSCS	sp|P0C6X1|R1AB_CVH22	470	tr|A0A0A0MTP3|A0A0A0MTP3_HUMAN M-phase phosphoprotein 9 OS=Homo sapiens OX=9606 GN=MPHOSPH9 PE=1 SV=1	153	TSQPDCNVDSCS
TSLYDCIVDSCS	sp|P0C6X1|R1AB_CVH22	470	tr|J3KNE4|J3KNE4_HUMAN M-phase phosphoprotein 9 (Fragment) OS=Homo sapiens OX=9606 GN=MPHOSPH9 PE=1 SV=2	51	TSQPDCNVDSCS
LLIIIGGTVTLA	sp|P0C6U2|R1A_CVH22	440	sp|Q9GZM6|OR8D2_HUMAN Olfactory receptor 8D2 OS=Homo sapiens OX=9606 GN=OR8D2 PE=2 SV=1	198	LLFIIGGVNTLA
SPYAILAALALY	sp|P0C6U2|R1A_CVH22	2077	sp|P24864|CCNE1_HUMAN G1/S-specific cyclin-E1 OS=Homo sapiens OX=9606 GN=CCNE1 PE=1 SV=2	294	FPYGILAASALY
SPYAILAALALY	sp|P0C6U2|R1A_CVH22	2077	tr|I3L413|I3L413_HUMAN G1/S-specific cyclin-E1 (Fragment) OS=Homo sapiens OX=9606 GN=CCNE1 PE=1 SV=1	167	FPYGILAASALY
SPYAILAALALY	sp|P0C6U2|R1A_CVH22	2077	tr|C9J2U0|C9J2U0_HUMAN Cyclin E variant ex7del OS=Homo sapiens OX=9606 GN=CCNE1 PE=1 SV=3	234	FPYGILAASALY
LFVSWTEGEGLS	sp|P15423|SPIKE_CVH22	415	tr|C9JUG3|C9JUG3_HUMAN Protein phosphatase Slingshot homolog 3 OS=Homo sapiens OX=9606 GN=SSH3 PE=1 SV=1	129	LVVSTREGEGLS
LFVSWTEGEGLS	sp|P15423|SPIKE_CVH22	415	sp|Q8TE77|SSH3_HUMAN Protein phosphatase Slingshot homolog 3 OS=Homo sapiens OX=9606 GN=SSH3 PE=1 SV=2	129	LVVSTREGEGLS
LFVSWTEGEGLS	sp|P15423|SPIKE_CVH22	415	tr|A0A087WWG1|A0A087WWG1_HUMAN Protein phosphatase Slingshot homolog 3 (Fragment) OS=Homo sapiens OX=9606 GN=SSH3 PE=1 SV=1	106	LVVSTREGEGLS
LRQLEFTAQYPV	sp|P0C6X1|R1AB_CVH22	5878	sp|O75127|PTCD1_HUMAN Pentatricopeptide repeat-containing protein 1, mitochondrial OS=Homo sapiens OX=9606 GN=PTCD1 PE=1 SV=2	625	IRQLEFAAQYPP
LRQLEFTAQYPV	sp|P0C6X1|R1AB_CVH22	5878	tr|G3V325|G3V325_HUMAN ATP5MF-PTCD1 readthrough OS=Homo sapiens OX=9606 GN=ATP5MF-PTCD1 PE=4 SV=1	674	IRQLEFAAQYPP
GGYDNLVRNVLA	sp|P0C6X1|R1AB_CVH22	4659	sp|Q9UBF2|COPG2_HUMAN Coatomer subunit gamma-2 OS=Homo sapiens OX=9606 GN=COPG2 PE=1 SV=1	833	GGYDLLVRSRLA
IECKKLVGVNIN	sp|P0C6X1|R1AB_CVH22	2355	sp|A9Z1Z3|FR1L4_HUMAN Fer-1-like protein 4 OS=Homo sapiens OX=9606 GN=FER1L4 PE=2 SV=1	33	LEAQKLVGVNIN
ARIFLVESLKLK	sp|P0C6X1|R1AB_CVH22	5125	sp|Q8IU54|IFNL1_HUMAN Interferon lambda-1 OS=Homo sapiens OX=9606 GN=IFNL1 PE=1 SV=1	53	ARDALEESLKLK
FLRQLEFTAQYP	sp|P0C6X1|R1AB_CVH22	5877	sp|O75127|PTCD1_HUMAN Pentatricopeptide repeat-containing protein 1, mitochondrial OS=Homo sapiens OX=9606 GN=PTCD1 PE=1 SV=2	624	VIRQLEFAAQYP
FLRQLEFTAQYP	sp|P0C6X1|R1AB_CVH22	5877	tr|G3V325|G3V325_HUMAN ATP5MF-PTCD1 readthrough OS=Homo sapiens OX=9606 GN=ATP5MF-PTCD1 PE=4 SV=1	673	VIRQLEFAAQYP
QVKHLVSLVRMD	sp|P0C6U2|R1A_CVH22	3666	tr|A0A669KAR0|A0A669KAR0_HUMAN Sodium channel protein type 2 subunit alpha (Fragment) OS=Homo sapiens OX=9606 GN=SCN2A PE=1 SV=1	31	KVKHLVNLVVMD
QVKHLVSLVRMD	sp|P0C6U2|R1A_CVH22	3666	sp|Q99250|SCN2A_HUMAN Sodium channel protein type 2 subunit alpha OS=Homo sapiens OX=9606 GN=SCN2A PE=1 SV=3	747	KVKHLVNLVVMD
QVKHLVSLVRMD	sp|P0C6U2|R1A_CVH22	3666	tr|A0A1B0GWA6|A0A1B0GWA6_HUMAN Sodium channel protein OS=Homo sapiens OX=9606 GN=SCN2A PE=1 SV=1	615	KVKHLVNLVVMD
DLLSSILGAPTT	sp|P0C6U2|R1A_CVH22	2579	sp|Q9NU02|ANKE1_HUMAN Ankyrin repeat and EF-hand domain-containing protein 1 OS=Homo sapiens OX=9606 GN=ANKEF1 PE=1 SV=2	679	ELLSSIYGVPTT
VELLDSDLLARP	sp|P0C6U2|R1A_CVH22	636	tr|A0A075B780|A0A075B780_HUMAN Transportin-2 OS=Homo sapiens OX=9606 GN=TNPO2 PE=1 SV=1	158	SELLDSDALNRP
VELLDSDLLARP	sp|P0C6U2|R1A_CVH22	636	sp|O14787|TNPO2_HUMAN Transportin-2 OS=Homo sapiens OX=9606 GN=TNPO2 PE=1 SV=3	158	SELLDSDALNRP
LSSILGAPTTAY	sp|P0C6U2|R1A_CVH22	2581	tr|A0A6Q8PFM0|A0A6Q8PFM0_HUMAN Serine/threonine-protein kinase WNK1 (Fragment) OS=Homo sapiens OX=9606 GN=WNK1 PE=1 SV=1	489	LSSIAGVPTTAA
LSSILGAPTTAY	sp|P0C6U2|R1A_CVH22	2581	sp|Q9H4A3|WNK1_HUMAN Serine/threonine-protein kinase WNK1 OS=Homo sapiens OX=9606 GN=WNK1 PE=1 SV=2	1340	LSSIAGVPTTAA
LSSILGAPTTAY	sp|P0C6U2|R1A_CVH22	2581	tr|F5GWT4|F5GWT4_HUMAN Non-specific serine/threonine protein kinase OS=Homo sapiens OX=9606 GN=WNK1 PE=1 SV=1	1093	LSSIAGVPTTAA
PVSTLKPRPILN	sp|P0C6U2|R1A_CVH22	1902	sp|Q9Y2D9|ZN652_HUMAN Zinc finger protein 652 OS=Homo sapiens OX=9606 GN=ZNF652 PE=1 SV=3	534	PVSTLPPRPIPH
PVSTLKPRPILN	sp|P0C6U2|R1A_CVH22	1902	tr|D6RF85|D6RF85_HUMAN Zinc finger protein 652 OS=Homo sapiens OX=9606 GN=ZNF652 PE=1 SV=1	354	PVSTLPPRPIPH
AHLGVHLVSLTV	sp|P0C6U2|R1A_CVH22	2412	tr|Q5H8Y1|Q5H8Y1_HUMAN Tyrosine-protein kinase receptor OS=Homo sapiens OX=9606 GN=ROS1 PE=1 SV=1	1373	AMLGKTLVSLTV
LANVIHTGAVPI	sp|P0C6X1|R1AB_CVH22	3735	tr|H0YJZ7|H0YJZ7_HUMAN Integral membrane protein GPR137C (Fragment) OS=Homo sapiens OX=9606 GN=GPR137C PE=4 SV=1	56	LAEVLQTGAVPI
RVMESEVMNTAQ	sp|P0C6U2|R1A_CVH22	2314	sp|Q8N3D4|EH1L1_HUMAN EH domain-binding protein 1-like protein 1 OS=Homo sapiens OX=9606 GN=EHBP1L1 PE=1 SV=2	616	RVLESEVAGTAQ
IIKKYIHRTQTF	sp|P0C6X1|R1AB_CVH22	5491	sp|Q16617|NKG7_HUMAN Protein NKG7 OS=Homo sapiens OX=9606 GN=NKG7 PE=1 SV=1	50	IISGYIHVTQTF
TAQYPVLLSDTA	sp|P0C6X1|R1AB_CVH22	5884	sp|Q969Y2|GTPB3_HUMAN tRNA modification GTPase GTPBP3, mitochondrial OS=Homo sapiens OX=9606 GN=GTPBP3 PE=1 SV=2	294	LAGFPVLLSDTA
VGGTLQALLSLP	sp|P0C6X1|R1AB_CVH22	444	sp|Q5VUJ6|LRCH2_HUMAN Leucine-rich repeat and calponin homology domain-containing protein 2 OS=Homo sapiens OX=9606 GN=LRCH2 PE=1 SV=2	744	VGVTVQALLELP
IILSYIEILVNL	sp|P15423|SPIKE_CVH22	233	tr|Q3SAH0|Q3SAH0_HUMAN G-protein-coupled receptor 34 splice variant OS=Homo sapiens OX=9606 GN=GPR34 PE=1 SV=1	187	IILSYIKIGKNL
IILSYIEILVNL	sp|P15423|SPIKE_CVH22	233	sp|Q9UPC5|GPR34_HUMAN Probable G-protein coupled receptor 34 OS=Homo sapiens OX=9606 GN=GPR34 PE=2 SV=2	234	IILSYIKIGKNL
IIGGTVTLAATL	sp|P0C6U2|R1A_CVH22	443	sp|Q9GZM6|OR8D2_HUMAN Olfactory receptor 8D2 OS=Homo sapiens OX=9606 GN=OR8D2 PE=2 SV=1	201	IIGGVNTLATTL
KQADFDWVTKGQ	sp|P0C6X1|R1AB_CVH22	5951	sp|Q86VP1|TAXB1_HUMAN Tax1-binding protein 1 OS=Homo sapiens OX=9606 GN=TAX1BP1 PE=1 SV=2	512	AEADFDIVTKGQ
KQADFDWVTKGQ	sp|P0C6X1|R1AB_CVH22	5951	tr|H7C3L5|H7C3L5_HUMAN Tax1-binding protein 1 (Fragment) OS=Homo sapiens OX=9606 GN=TAX1BP1 PE=1 SV=1	67	AEADFDIVTKGQ
KQADFDWVTKGQ	sp|P0C6X1|R1AB_CVH22	5951	tr|B8ZZD4|B8ZZD4_HUMAN Tax1-binding protein 1 OS=Homo sapiens OX=9606 GN=TAX1BP1 PE=1 SV=1	512	AEADFDIVTKGQ
NDVLTFMSEPSV	sp|P0C6X1|R1AB_CVH22	4432	sp|O75691|UTP20_HUMAN Small subunit processome component 20 homolog OS=Homo sapiens OX=9606 GN=UTP20 PE=1 SV=3	591	NLVLTFPLEPSV
IFDKPWAVVKDL	sp|P0C6X1|R1AB_CVH22	791	sp|P35249|RFC4_HUMAN Replication factor C subunit 4 OS=Homo sapiens OX=9606 GN=RFC4 PE=1 SV=2	285	SFDKLEAVVKDL
IFDKPWAVVKDL	sp|P0C6X1|R1AB_CVH22	791	tr|H7C1P0|H7C1P0_HUMAN Replication factor C subunit 4 (Fragment) OS=Homo sapiens OX=9606 GN=RFC4 PE=1 SV=1	60	SFDKLEAVVKDL
FNLQVVFGTMGV	sp|P0C6U2|R1A_CVH22	2600	sp|Q9HAK2|COE2_HUMAN Transcription factor COE2 OS=Homo sapiens OX=9606 GN=EBF2 PE=1 SV=4	280	DGLQVVFGTMLV
FNLQVVFGTMGV	sp|P0C6U2|R1A_CVH22	2600	tr|B7Z934|B7Z934_HUMAN Transcription factor COE2 OS=Homo sapiens OX=9606 GN=EBF2 PE=1 SV=1	132	DGLQVVFGTMLV
FNLQVVFGTMGV	sp|P0C6U2|R1A_CVH22	2600	sp|Q9H4W6|COE3_HUMAN Transcription factor COE3 OS=Homo sapiens OX=9606 GN=EBF3 PE=1 SV=2	290	DGLQVVFGTMLV
FNLQVVFGTMGV	sp|P0C6U2|R1A_CVH22	2600	tr|H0Y3W9|H0Y3W9_HUMAN Transcription factor COE3 OS=Homo sapiens OX=9606 GN=EBF3 PE=1 SV=2	290	DGLQVVFGTMLV
VVLGKLLMNMAA	sp|P0C6X1|R1AB_CVH22	4238	sp|P30279|CCND2_HUMAN G1/S-specific cyclin-D2 OS=Homo sapiens OX=9606 GN=CCND2 PE=1 SV=1	142	VVLGKLKWNLAA
VVLGKLLMNMAA	sp|P0C6X1|R1AB_CVH22	4238	tr|A0A6Q8PFP0|A0A6Q8PFP0_HUMAN Cyclin N-terminal domain-containing protein OS=Homo sapiens OX=9606 PE=3 SV=1	142	VVLGKLKWNLAA
VVLGKLLMNMAA	sp|P0C6X1|R1AB_CVH22	4238	tr|A0A3B3IT44|A0A3B3IT44_HUMAN Cyclin N-terminal domain-containing protein OS=Homo sapiens OX=9606 PE=3 SV=1	142	VVLGKLKWNLAA
VVLGKLLMNMAA	sp|P0C6X1|R1AB_CVH22	4238	tr|A0A6Q8PGZ3|A0A6Q8PGZ3_HUMAN G1/S-specific cyclin-D2 OS=Homo sapiens OX=9606 GN=CCND2 PE=1 SV=1	142	VVLGKLKWNLAA
GTSLPLSLGYNS	sp|P0C6X1|R1AB_CVH22	5694	tr|H7C2T8|H7C2T8_HUMAN Ubiquitin-associated protein 2-like (Fragment) OS=Homo sapiens OX=9606 GN=UBAP2L PE=1 SV=1	90	GSSLGLSLGSNS
GTSLPLSLGYNS	sp|P0C6X1|R1AB_CVH22	5694	tr|F8W726|F8W726_HUMAN Ubiquitin-associated protein 2-like OS=Homo sapiens OX=9606 GN=UBAP2L PE=1 SV=2	770	GSSLGLSLGSNS
GTSLPLSLGYNS	sp|P0C6X1|R1AB_CVH22	5694	tr|H0Y5H6|H0Y5H6_HUMAN Ubiquitin-associated protein 2-like (Fragment) OS=Homo sapiens OX=9606 GN=UBAP2L PE=1 SV=1	38	GSSLGLSLGSNS
GTSLPLSLGYNS	sp|P0C6X1|R1AB_CVH22	5694	sp|Q14157|UBP2L_HUMAN Ubiquitin-associated protein 2-like OS=Homo sapiens OX=9606 GN=UBAP2L PE=1 SV=2	759	GSSLGLSLGSNS
RNTTPLQQSTSV	sp|P15130|NCAP_CVH22	215	sp|A8MV24|CQ098_HUMAN Uncharacterized protein C17orf98 OS=Homo sapiens OX=9606 GN=C17orf98 PE=4 SV=1	133	RNTPALRQSTSV
LVKNVKVTNGEI	sp|P0C6X1|R1AB_CVH22	418	sp|Q86YT9|JAML_HUMAN Junctional adhesion molecule-like OS=Homo sapiens OX=9606 GN=JAML PE=1 SV=1	311	LVKNTKKTNPEI
LVKNVKVTNGEI	sp|P0C6X1|R1AB_CVH22	418	tr|E9PR26|E9PR26_HUMAN Junctional adhesion molecule-like OS=Homo sapiens OX=9606 GN=JAML PE=1 SV=1	300	LVKNTKKTNPEI
LVKNVKVTNGEI	sp|P0C6X1|R1AB_CVH22	418	tr|E9PKK2|E9PKK2_HUMAN Junctional adhesion molecule-like OS=Homo sapiens OX=9606 GN=JAML PE=1 SV=1	272	LVKNTKKTNPEI
VFTPFLVDLNTF	sp|P0C6X1|R1AB_CVH22	5827	tr|I3L4X2|I3L4X2_HUMAN Multidrug resistance-associated protein 1 (Fragment) OS=Homo sapiens OX=9606 GN=ABCC1 PE=1 SV=1	453	VCTPFLVALCTF
VFTPFLVDLNTF	sp|P0C6X1|R1AB_CVH22	5827	tr|A0A0A0MS99|A0A0A0MS99_HUMAN Multidrug resistance-associated protein 1 OS=Homo sapiens OX=9606 GN=ABCC1 PE=1 SV=1	228	VCTPFLVALCTF
VFTPFLVDLNTF	sp|P0C6X1|R1AB_CVH22	5827	sp|P33527|MRP1_HUMAN Multidrug resistance-associated protein 1 OS=Homo sapiens OX=9606 GN=ABCC1 PE=1 SV=3	554	VCTPFLVALCTF
VQEKVSDFTAEY	sp|P0C6U2|R1A_CVH22	623	sp|Q5T0W9|FA83B_HUMAN Protein FAM83B OS=Homo sapiens OX=9606 GN=FAM83B PE=1 SV=1	48	VQERVSDFLAEE
MSAPAGSSDPLK	sp|P0C6X1|R1AB_CVH22	4030	sp|O95487|SC24B_HUMAN Protein transport protein Sec24B OS=Homo sapiens OX=9606 GN=SEC24B PE=1 SV=2	1	MSAPAGSSHPAA
QSTSVKSLARST	sp|P15130|NCAP_CVH22	222	sp|Q9BVJ6|UT14A_HUMAN U3 small nucleolar RNA-associated protein 14 homolog A OS=Homo sapiens OX=9606 GN=UTP14A PE=1 SV=1	568	QSPSVKSLAVPT
VTRIGVLKLEDF	sp|P0C6X1|R1AB_CVH22	6368	sp|P50750|CDK9_HUMAN Cyclin-dependent kinase 9 OS=Homo sapiens OX=9606 GN=CDK9 PE=1 SV=3	157	ITRDGVLKLADF
ARVEATLSPVKS	sp|P0C6U2|R1A_CVH22	1245	sp|O60522|TDRD6_HUMAN Tudor domain-containing protein 6 OS=Homo sapiens OX=9606 GN=TDRD6 PE=2 SV=2	1270	ARVEATLSERKI
VKHLVSLVRMDF	sp|P0C6U2|R1A_CVH22	3667	tr|A0A669KAR0|A0A669KAR0_HUMAN Sodium channel protein type 2 subunit alpha (Fragment) OS=Homo sapiens OX=9606 GN=SCN2A PE=1 SV=1	32	VKHLVNLVVMDP
VKHLVSLVRMDF	sp|P0C6U2|R1A_CVH22	3667	sp|Q99250|SCN2A_HUMAN Sodium channel protein type 2 subunit alpha OS=Homo sapiens OX=9606 GN=SCN2A PE=1 SV=3	748	VKHLVNLVVMDP
VKHLVSLVRMDF	sp|P0C6U2|R1A_CVH22	3667	tr|A0A1B0GWA6|A0A1B0GWA6_HUMAN Sodium channel protein OS=Homo sapiens OX=9606 GN=SCN2A PE=1 SV=1	616	VKHLVNLVVMDP
QADFDWVTKGQL	sp|P0C6X1|R1AB_CVH22	5952	sp|Q86VP1|TAXB1_HUMAN Tax1-binding protein 1 OS=Homo sapiens OX=9606 GN=TAX1BP1 PE=1 SV=2	513	EADFDIVTKGQV
QADFDWVTKGQL	sp|P0C6X1|R1AB_CVH22	5952	tr|H7C3L5|H7C3L5_HUMAN Tax1-binding protein 1 (Fragment) OS=Homo sapiens OX=9606 GN=TAX1BP1 PE=1 SV=1	68	EADFDIVTKGQV
QADFDWVTKGQL	sp|P0C6X1|R1AB_CVH22	5952	tr|B8ZZD4|B8ZZD4_HUMAN Tax1-binding protein 1 OS=Homo sapiens OX=9606 GN=TAX1BP1 PE=1 SV=1	513	EADFDIVTKGQV
EQENLVSTVVNT	sp|P0C6U2|R1A_CVH22	3623	tr|A6PVN6|A6PVN6_HUMAN Serine/threonine-protein phosphatase 2A activator (Fragment) OS=Homo sapiens OX=9606 GN=PTPA PE=1 SV=1	138	EAENLVATVVPT
EQENLVSTVVNT	sp|P0C6U2|R1A_CVH22	3623	tr|A6PVN8|A6PVN8_HUMAN Serine/threonine-protein phosphatase 2A activator (Fragment) OS=Homo sapiens OX=9606 GN=PTPA PE=1 SV=1	80	EAENLVATVVPT
EQENLVSTVVNT	sp|P0C6U2|R1A_CVH22	3623	tr|C9IZ76|C9IZ76_HUMAN Serine/threonine-protein phosphatase 2A activator (Fragment) OS=Homo sapiens OX=9606 GN=PTPA PE=1 SV=1	78	EAENLVATVVPT
EQENLVSTVVNT	sp|P0C6U2|R1A_CVH22	3623	tr|Q5T949|Q5T949_HUMAN Serine/threonine-protein phosphatase 2A activator (Fragment) OS=Homo sapiens OX=9606 GN=PTPA PE=1 SV=1	150	EAENLVATVVPT
EQENLVSTVVNT	sp|P0C6U2|R1A_CVH22	3623	tr|Q5T948|Q5T948_HUMAN Serine/threonine-protein phosphatase 2A activator (Fragment) OS=Homo sapiens OX=9606 GN=PTPA PE=1 SV=8	150	EAENLVATVVPT
EQENLVSTVVNT	sp|P0C6U2|R1A_CVH22	3623	tr|A6PVN9|A6PVN9_HUMAN Serine/threonine-protein phosphatase 2A activator (Fragment) OS=Homo sapiens OX=9606 GN=PTPA PE=1 SV=1	80	EAENLVATVVPT
EQENLVSTVVNT	sp|P0C6U2|R1A_CVH22	3623	tr|F6WIT2|F6WIT2_HUMAN Serine/threonine-protein phosphatase 2A activator OS=Homo sapiens OX=9606 GN=PTPA PE=1 SV=1	80	EAENLVATVVPT
EQENLVSTVVNT	sp|P0C6U2|R1A_CVH22	3623	sp|Q15257|PTPA_HUMAN Serine/threonine-protein phosphatase 2A activator OS=Homo sapiens OX=9606 GN=PTPA PE=1 SV=3	150	EAENLVATVVPT
EQENLVSTVVNT	sp|P0C6U2|R1A_CVH22	3623	tr|A6PVN5|A6PVN5_HUMAN Serine/threonine-protein phosphatase 2A activator OS=Homo sapiens OX=9606 GN=PTPA PE=1 SV=1	121	EAENLVATVVPT
LTVTRADNPKID	sp|P0C6U2|R1A_CVH22	1436	sp|Q96B97|SH3K1_HUMAN SH3 domain-containing kinase-binding protein 1 OS=Homo sapiens OX=9606 GN=SH3KBP1 PE=1 SV=2	429	LTHTRGDSPKID
LTVTRADNPKID	sp|P0C6U2|R1A_CVH22	1436	tr|Q5JPT2|Q5JPT2_HUMAN SH3 domain-containing kinase-binding protein 1 (Fragment) OS=Homo sapiens OX=9606 GN=SH3KBP1 PE=1 SV=1	409	LTHTRGDSPKID
AQAPRDKPRAGR	sp|P15130|NCAP_CVH22	325	sp|Q8NHY6|ZFP28_HUMAN Zinc finger protein 28 homolog OS=Homo sapiens OX=9606 GN=ZFP28 PE=1 SV=1	18	RGAPRTKPRAGR
KDLLCKLENKTE	sp|P0C6X1|R1AB_CVH22	800	tr|J3KT07|J3KT07_HUMAN Zinc finger protein 521 (Fragment) OS=Homo sapiens OX=9606 GN=ZNF521 PE=4 SV=1	13	KDPNCKLEDKTE
KDLLCKLENKTE	sp|P0C6X1|R1AB_CVH22	800	tr|J3QRW6|J3QRW6_HUMAN Zinc finger protein 521 (Fragment) OS=Homo sapiens OX=9606 GN=ZNF521 PE=1 SV=1	13	KDPNCKLEDKTE
KDLLCKLENKTE	sp|P0C6X1|R1AB_CVH22	800	tr|J3KSZ4|J3KSZ4_HUMAN Zinc finger protein 521 (Fragment) OS=Homo sapiens OX=9606 GN=ZNF521 PE=1 SV=1	13	KDPNCKLEDKTE
KDLLCKLENKTE	sp|P0C6X1|R1AB_CVH22	800	tr|H7BYU6|H7BYU6_HUMAN Zinc finger protein 521 OS=Homo sapiens OX=9606 GN=ZNF521 PE=1 SV=2	13	KDPNCKLEDKTE
KDLLCKLENKTE	sp|P0C6X1|R1AB_CVH22	800	sp|Q96K83|ZN521_HUMAN Zinc finger protein 521 OS=Homo sapiens OX=9606 GN=ZNF521 PE=1 SV=1	13	KDPNCKLEDKTE
HVLQGLLFSVFQ	sp|P0C6U2|R1A_CVH22	1845	sp|Q96KK4|O10C1_HUMAN Olfactory receptor 10C1 OS=Homo sapiens OX=9606 GN=OR10C1 PE=2 SV=3	20	ADLQGLLFSVFL
HVLQGLLFSVFQ	sp|P0C6U2|R1A_CVH22	1845	tr|A0A087WY02|A0A087WY02_HUMAN Olfactory receptor OS=Homo sapiens OX=9606 GN=OR10C1 PE=3 SV=1	22	ADLQGLLFSVFL
HVLQGLLFSVFQ	sp|P0C6U2|R1A_CVH22	1845	tr|A0A0G2JL13|A0A0G2JL13_HUMAN Olfactory receptor OS=Homo sapiens OX=9606 GN=OR10C1 PE=3 SV=1	22	ADLQGLLFSVFL
HVLQGLLFSVFQ	sp|P0C6U2|R1A_CVH22	1845	tr|Q6IFQ5|Q6IFQ5_HUMAN Olfactory receptor OS=Homo sapiens OX=9606 GN=OR10C1 PE=3 SV=1	20	ADLQGLLFSVFL
HVLQGLLFSVFQ	sp|P0C6U2|R1A_CVH22	1845	tr|A0A140TA55|A0A140TA55_HUMAN Olfactory receptor OS=Homo sapiens OX=9606 GN=OR10C1 PE=3 SV=1	22	ADLQGLLFSVFL
HVLQGLLFSVFQ	sp|P0C6U2|R1A_CVH22	1845	tr|A0A140T9J0|A0A140T9J0_HUMAN Olfactory receptor OS=Homo sapiens OX=9606 GN=OR10C1 PE=3 SV=1	20	ADLQGLLFSVFL
APRDKPRAGRYV	sp|P15130|NCAP_CVH22	327	sp|Q8NHY6|ZFP28_HUMAN Zinc finger protein 28 homolog OS=Homo sapiens OX=9606 GN=ZFP28 PE=1 SV=1	20	APRTKPRAGRGP
LVTAPLYRRKSF	sp|P15423|SPIKE_CVH22	290	tr|F8VWT6|F8VWT6_HUMAN FYVE, RhoGEF and PH domain-containing protein 6 OS=Homo sapiens OX=9606 GN=FGD6 PE=4 SV=1	19	LVTFPLMRRKSS
ANLTVVVFLFAI	sp|P0C6X1|R1AB_CVH22	3164	tr|B7Z1G8|B7Z1G8_HUMAN Surfeit locus protein 4 OS=Homo sapiens OX=9606 GN=SURF4 PE=1 SV=1	161	AALTLVVWLFAI
ANLTVVVFLFAI	sp|P0C6X1|R1AB_CVH22	3164	sp|O15260|SURF4_HUMAN Surfeit locus protein 4 OS=Homo sapiens OX=9606 GN=SURF4 PE=1 SV=3	204	AALTLVVWLFAI
KFTLSYDESLKH	sp|P15423|SPIKE_CVH22	118	sp|P04114|APOB_HUMAN Apolipoprotein B-100 OS=Homo sapiens OX=9606 GN=APOB PE=1 SV=2	1417	TFTLSYDGSLRH
SLDNLALFISEK	sp|P0C6X1|R1AB_CVH22	615	sp|Q7Z402|TMC7_HUMAN Transmembrane channel-like protein 7 OS=Homo sapiens OX=9606 GN=TMC7 PE=1 SV=1	89	SLRNYALNISEK
SLDNLALFISEK	sp|P0C6X1|R1AB_CVH22	615	tr|H3BNW8|H3BNW8_HUMAN Transmembrane channel-like protein OS=Homo sapiens OX=9606 GN=TMC7 PE=1 SV=1	89	SLRNYALNISEK
VVGISDLLSSIL	sp|P0C6U2|R1A_CVH22	2574	tr|M0QYC9|M0QYC9_HUMAN TBC1 domain family member 17 (Fragment) OS=Homo sapiens OX=9606 GN=TBC1D17 PE=1 SV=1	196	VQGMSDLLSPIL
