query	query_seqname	query_start	target_seqname	target_start	target
SLSATKKLFSGK	sp|P0C760|L_PUUMS	1697	sp|Q96RR4|KKCC2_HUMAN Calcium/calmodulin-dependent protein kinase kinase 2 OS=Homo sapiens OX=9606 GN=CAMKK2 PE=1 SV=2	358	SLSETRKIFSGK
SLSATKKLFSGK	sp|P0C760|L_PUUMS	1697	tr|F5GZ00|F5GZ00_HUMAN Calcium/calmodulin-dependent protein kinase kinase 2 OS=Homo sapiens OX=9606 GN=CAMKK2 PE=1 SV=1	145	SLSETRKIFSGK
GCQPPDCPGIGT	sp|P27312|GP_PUUMS	774	sp|Q9UK23|NAGPA_HUMAN N-acetylglucosamine-1-phosphodiester alpha-N-acetylglucosaminidase OS=Homo sapiens OX=9606 GN=NAGPA PE=1 SV=2	328	RCQPPDCHGHGT
AEENEEEDELQT	sp|P0C760|L_PUUMS	1973	sp|Q9NQL2|RRAGD_HUMAN Ras-related GTP-binding protein D OS=Homo sapiens OX=9606 GN=RRAGD PE=1 SV=1	16	AEEEEEEDELVG
VPTLSALIIKVL	sp|P27312|GP_PUUMS	508	sp|P30050|RL12_HUMAN 60S ribosomal protein L12 OS=Homo sapiens OX=9606 GN=RPL12 PE=1 SV=1	74	VPSASALIIKAL
FLVLVIVIAILV	sp|P27312|GP_PUUMS	1115	sp|Q9P2C4|TM181_HUMAN Transmembrane protein 181 OS=Homo sapiens OX=9606 GN=TMEM181 PE=1 SV=2	501	FVVLVISIAILY
QALEGLCFNPLR	sp|P27312|GP_PUUMS	187	tr|A0A2U3TZL9|A0A2U3TZL9_HUMAN Nicastrin OS=Homo sapiens OX=9606 GN=NCSTN PE=4 SV=1	33	MALHGLCNNPLR
TAEENEEEDELQ	sp|P0C760|L_PUUMS	1972	sp|Q9NQL2|RRAGD_HUMAN Ras-related GTP-binding protein D OS=Homo sapiens OX=9606 GN=RRAGD PE=1 SV=1	15	DAEEEEEEDELV
ASTSAIDFAEVD	sp|P27312|GP_PUUMS	943	tr|E7EVY0|E7EVY0_HUMAN Mitochondrial inner membrane protein OXA1L OS=Homo sapiens OX=9606 GN=OXA1L PE=1 SV=1	64	LSTSAISFAEVQ
ASTSAIDFAEVD	sp|P27312|GP_PUUMS	943	tr|A0A087X0L7|A0A087X0L7_HUMAN Mitochondrial inner membrane protein OXA1L OS=Homo sapiens OX=9606 GN=OXA1L PE=1 SV=1	64	LSTSAISFAEVQ
ASTSAIDFAEVD	sp|P27312|GP_PUUMS	943	sp|Q15070|OXA1L_HUMAN Mitochondrial inner membrane protein OXA1L OS=Homo sapiens OX=9606 GN=OXA1L PE=1 SV=3	64	LSTSAISFAEVQ
ASTSAIDFAEVD	sp|P27312|GP_PUUMS	943	tr|J3KNA0|J3KNA0_HUMAN Mitochondrial inner membrane protein OXA1L OS=Homo sapiens OX=9606 GN=OXA1L PE=1 SV=1	124	LSTSAISFAEVQ
VIKSIFIYKFLV	sp|P0C760|L_PUUMS	600	sp|P56696|KCNQ4_HUMAN Potassium voltage-gated channel subfamily KQT member 4 OS=Homo sapiens OX=9606 GN=KCNQ4 PE=1 SV=2	533	VIRSIRILKFLV
VIKSIFIYKFLV	sp|P0C760|L_PUUMS	600	tr|H0Y6N7|H0Y6N7_HUMAN Potassium voltage-gated channel subfamily KQT member 4 (Fragment) OS=Homo sapiens OX=9606 GN=KCNQ4 PE=4 SV=1	394	VIRSIRILKFLV
KEVGLELSNPSL	sp|P0C760|L_PUUMS	1544	tr|A0A6Q8PFP7|A0A6Q8PFP7_HUMAN Periaxin (Fragment) OS=Homo sapiens OX=9606 GN=PRX PE=1 SV=1	65	KLVGLFLSTPSL
LELSNPSLIKHL	sp|P0C760|L_PUUMS	1548	sp|Q9NRL2|BAZ1A_HUMAN Bromodomain adjacent to zinc finger domain protein 1A OS=Homo sapiens OX=9606 GN=BAZ1A PE=1 SV=2	589	LRLSNPSLVKKL
LELSNPSLIKHL	sp|P0C760|L_PUUMS	1548	tr|A0A087WWN7|A0A087WWN7_HUMAN Bromodomain adjacent to zinc finger domain protein 1A (Fragment) OS=Homo sapiens OX=9606 GN=BAZ1A PE=1 SV=1	45	LRLSNPSLVKKL
GAGTGAAVGSLE	sp|P27312|GP_PUUMS	39	sp|Q9UF11|PKHB1_HUMAN Pleckstrin homology domain-containing family B member 1 OS=Homo sapiens OX=9606 GN=PLEKHB1 PE=1 SV=1	226	GAATGAALGSLM
GAGTGAAVGSLE	sp|P27312|GP_PUUMS	39	tr|F5GYU9|F5GYU9_HUMAN Pleckstrin homology domain-containing family B member 1 OS=Homo sapiens OX=9606 GN=PLEKHB1 PE=1 SV=1	121	GAATGAALGSLM
VDSAGEVQDDLV	sp|P0C760|L_PUUMS	1027	sp|Q9UIF9|BAZ2A_HUMAN Bromodomain adjacent to zinc finger domain protein 2A OS=Homo sapiens OX=9606 GN=BAZ2A PE=1 SV=4	890	GDSLGEVQDLLV
VDSAGEVQDDLV	sp|P0C760|L_PUUMS	1027	tr|F8VU39|F8VU39_HUMAN Bromodomain adjacent to zinc finger domain protein 2A OS=Homo sapiens OX=9606 GN=BAZ2A PE=1 SV=1	888	GDSLGEVQDLLV
VDSAGEVQDDLV	sp|P0C760|L_PUUMS	1027	tr|J3KPG5|J3KPG5_HUMAN Bromodomain adjacent to zinc finger domain protein 2A OS=Homo sapiens OX=9606 GN=BAZ2A PE=1 SV=1	860	GDSLGEVQDLLV
VDSAGEVQDDLV	sp|P0C760|L_PUUMS	1027	tr|H7BXK5|H7BXK5_HUMAN Bromodomain adjacent to zinc finger domain protein 2B (Fragment) OS=Homo sapiens OX=9606 GN=BAZ2B PE=1 SV=1	190	GDSMGEVQDLLV
VDSAGEVQDDLV	sp|P0C760|L_PUUMS	1027	sp|Q9UIF8|BAZ2B_HUMAN Bromodomain adjacent to zinc finger domain protein 2B OS=Homo sapiens OX=9606 GN=BAZ2B PE=1 SV=3	1129	GDSMGEVQDLLV
ERLFTPLSLAVA	sp|P0C760|L_PUUMS	2055	sp|Q9NQR7|CC177_HUMAN Coiled-coil domain-containing protein 177 OS=Homo sapiens OX=9606 GN=CCDC177 PE=2 SV=3	161	RRLFTPLSPAAA
NRKETLLGLDLQ	sp|I4EPA3|NSS_PUUMS	77	tr|C9JA62|C9JA62_HUMAN All-trans retinoic acid-induced differentiation factor (Fragment) OS=Homo sapiens OX=9606 GN=ATRAID PE=1 SV=1	9	NQKGTILGLDLQ
NRKETLLGLDLQ	sp|I4EPA3|NSS_PUUMS	77	sp|Q6UW56|ARAID_HUMAN All-trans retinoic acid-induced differentiation factor OS=Homo sapiens OX=9606 GN=ATRAID PE=1 SV=2	67	NQKGTILGLDLQ
RDVVPGDTSLLE	sp|P0C760|L_PUUMS	12	sp|Q8WZ42|TITIN_HUMAN Titin OS=Homo sapiens OX=9606 GN=TTN PE=1 SV=4	1060	RDVVMTDTSLTE
RDVVPGDTSLLE	sp|P0C760|L_PUUMS	12	tr|A0A0A0MTS7|A0A0A0MTS7_HUMAN Titin OS=Homo sapiens OX=9606 GN=TTN PE=1 SV=1	1060	RDVVMTDTSLTE
RDVVPGDTSLLE	sp|P0C760|L_PUUMS	12	tr|A0A0A0MRA3|A0A0A0MRA3_HUMAN Titin OS=Homo sapiens OX=9606 GN=TTN PE=1 SV=1	1014	RDVVMTDTSLTE
PGDTSLLECLEA	sp|P0C760|L_PUUMS	16	sp|Q68DK2|ZFY26_HUMAN Zinc finger FYVE domain-containing protein 26 OS=Homo sapiens OX=9606 GN=ZFYVE26 PE=1 SV=3	2439	DGDTILLNCLEA
PGDTSLLECLEA	sp|P0C760|L_PUUMS	16	tr|A0A2H2FF08|A0A2H2FF08_HUMAN Zinc finger FYVE domain-containing protein 26 OS=Homo sapiens OX=9606 GN=ZFYVE26 PE=1 SV=1	285	DGDTILLNCLEA
DSAGEVQDDLVD	sp|P0C760|L_PUUMS	1028	sp|Q9UIF9|BAZ2A_HUMAN Bromodomain adjacent to zinc finger domain protein 2A OS=Homo sapiens OX=9606 GN=BAZ2A PE=1 SV=4	891	DSLGEVQDLLVR
DSAGEVQDDLVD	sp|P0C760|L_PUUMS	1028	tr|F8VU39|F8VU39_HUMAN Bromodomain adjacent to zinc finger domain protein 2A OS=Homo sapiens OX=9606 GN=BAZ2A PE=1 SV=1	889	DSLGEVQDLLVR
DSAGEVQDDLVD	sp|P0C760|L_PUUMS	1028	tr|J3KPG5|J3KPG5_HUMAN Bromodomain adjacent to zinc finger domain protein 2A OS=Homo sapiens OX=9606 GN=BAZ2A PE=1 SV=1	861	DSLGEVQDLLVR
DSAGEVQDDLVD	sp|P0C760|L_PUUMS	1028	tr|H7BXK5|H7BXK5_HUMAN Bromodomain adjacent to zinc finger domain protein 2B (Fragment) OS=Homo sapiens OX=9606 GN=BAZ2B PE=1 SV=1	191	DSMGEVQDLLVR
DSAGEVQDDLVD	sp|P0C760|L_PUUMS	1028	sp|Q9UIF8|BAZ2B_HUMAN Bromodomain adjacent to zinc finger domain protein 2B OS=Homo sapiens OX=9606 GN=BAZ2B PE=1 SV=3	1130	DSMGEVQDLLVR
LVLVIVIAILVL	sp|P27312|GP_PUUMS	1116	sp|Q9P2C4|TM181_HUMAN Transmembrane protein 181 OS=Homo sapiens OX=9606 GN=TMEM181 PE=1 SV=2	502	VVLVISIAILYL
RASTSAIDFAEV	sp|P27312|GP_PUUMS	942	tr|E7EVY0|E7EVY0_HUMAN Mitochondrial inner membrane protein OXA1L OS=Homo sapiens OX=9606 GN=OXA1L PE=1 SV=1	63	SLSTSAISFAEV
RASTSAIDFAEV	sp|P27312|GP_PUUMS	942	tr|A0A087X0L7|A0A087X0L7_HUMAN Mitochondrial inner membrane protein OXA1L OS=Homo sapiens OX=9606 GN=OXA1L PE=1 SV=1	63	SLSTSAISFAEV
RASTSAIDFAEV	sp|P27312|GP_PUUMS	942	sp|Q15070|OXA1L_HUMAN Mitochondrial inner membrane protein OXA1L OS=Homo sapiens OX=9606 GN=OXA1L PE=1 SV=3	63	SLSTSAISFAEV
RASTSAIDFAEV	sp|P27312|GP_PUUMS	942	tr|J3KNA0|J3KNA0_HUMAN Mitochondrial inner membrane protein OXA1L OS=Homo sapiens OX=9606 GN=OXA1L PE=1 SV=1	123	SLSTSAISFAEV
GELIDSNSLSSS	sp|P27312|GP_PUUMS	91	sp|Q9H8E8|CSR2B_HUMAN Cysteine-rich protein 2-binding protein OS=Homo sapiens OX=9606 GN=KAT14 PE=1 SV=3	307	GEVIDFSSLSSS
GELIDSNSLSSS	sp|P27312|GP_PUUMS	91	tr|A0A075B6H4|A0A075B6H4_HUMAN Cysteine-rich protein 2-binding protein OS=Homo sapiens OX=9606 GN=KAT14 PE=1 SV=1	306	GEVIDFSSLSSS
VLVIVIAILVLS	sp|P27312|GP_PUUMS	1117	sp|Q9P2C4|TM181_HUMAN Transmembrane protein 181 OS=Homo sapiens OX=9606 GN=TMEM181 PE=1 SV=2	503	VLVISIAILYLR
KQYCATGQALEG	sp|P27312|GP_PUUMS	180	tr|A0A087X1R4|A0A087X1R4_HUMAN Female-lethal(2)D homolog OS=Homo sapiens OX=9606 GN=WTAP PE=1 SV=1	31	KQYEAYVQALEG
KQYCATGQALEG	sp|P27312|GP_PUUMS	180	sp|Q15007|FL2D_HUMAN Pre-mRNA-splicing regulator WTAP OS=Homo sapiens OX=9606 GN=WTAP PE=1 SV=2	31	KQYEAYVQALEG
KNLEVLTRALFL	sp|P27312|GP_PUUMS	275	sp|Q14914|PTGR1_HUMAN Prostaglandin reductase 1 OS=Homo sapiens OX=9606 GN=PTGR1 PE=1 SV=2	33	KNGEVLLEALFL
KNLEVLTRALFL	sp|P27312|GP_PUUMS	275	tr|F2Z3J9|F2Z3J9_HUMAN 15-oxoprostaglandin 13-reductase OS=Homo sapiens OX=9606 GN=PTGR1 PE=1 SV=3	33	KNGEVLLEALFL
KNLEVLTRALFL	sp|P27312|GP_PUUMS	275	tr|F6XGT7|F6XGT7_HUMAN 15-oxoprostaglandin 13-reductase OS=Homo sapiens OX=9606 GN=PTGR1 PE=1 SV=1	33	KNGEVLLEALFL
KNLEVLTRALFL	sp|P27312|GP_PUUMS	275	tr|Q5JVP2|Q5JVP2_HUMAN 15-oxoprostaglandin 13-reductase (Fragment) OS=Homo sapiens OX=9606 GN=PTGR1 PE=1 SV=1	33	KNGEVLLEALFL
EQIRYLLPLLNS	sp|P0C760|L_PUUMS	624	sp|Q06710|PAX8_HUMAN Paired box protein Pax-8 OS=Homo sapiens OX=9606 GN=PAX8 PE=1 SV=2	258	EQGLYPLPLLNS
EQIRYLLPLLNS	sp|P0C760|L_PUUMS	624	tr|H0YJD1|H0YJD1_HUMAN Paired box protein Pax-8 (Fragment) OS=Homo sapiens OX=9606 GN=PAX8 PE=1 SV=1	44	EQGLYPLPLLNS
RPHMVKTFSAHD	sp|P0C760|L_PUUMS	1483	sp|Q96JQ0|PCD16_HUMAN Protocadherin-16 OS=Homo sapiens OX=9606 GN=DCHS1 PE=1 SV=1	1284	RPHYVLTLSAHD
ALEGLCFNPLRS	sp|P27312|GP_PUUMS	188	tr|A0A2U3TZL9|A0A2U3TZL9_HUMAN Nicastrin OS=Homo sapiens OX=9606 GN=NCSTN PE=4 SV=1	34	ALHGLCNNPLRH
LCALGSAQKFTP	sp|P27312|GP_PUUMS	841	sp|Q9H6A9|PCX3_HUMAN Pecanex-like protein 3 OS=Homo sapiens OX=9606 GN=PCNX3 PE=1 SV=2	872	LDALGSAQPFPP
EENEEEDELQTL	sp|P0C760|L_PUUMS	1974	sp|Q9NQL2|RRAGD_HUMAN Ras-related GTP-binding protein D OS=Homo sapiens OX=9606 GN=RRAGD PE=1 SV=1	17	EEEEEEDELVGL
EENEEEDELQTL	sp|P0C760|L_PUUMS	1974	sp|P78318|IGBP1_HUMAN Immunoglobulin-binding protein 1 OS=Homo sapiens OX=9606 GN=IGBP1 PE=1 SV=1	304	EEKEEEDDEQTL
SLILESTIFCSD	sp|P0C760|L_PUUMS	777	sp|P15529|MCP_HUMAN Membrane cofactor protein OS=Homo sapiens OX=9606 GN=CD46 PE=1 SV=3	201	SLIGESTIYCGD
RLFTPLSLAVAN	sp|P0C760|L_PUUMS	2056	sp|Q9NQR7|CC177_HUMAN Coiled-coil domain-containing protein 177 OS=Homo sapiens OX=9606 GN=CCDC177 PE=2 SV=3	162	RLFTPLSPAAAA
STSAIDFAEVDT	sp|P27312|GP_PUUMS	944	tr|E7EVY0|E7EVY0_HUMAN Mitochondrial inner membrane protein OXA1L OS=Homo sapiens OX=9606 GN=OXA1L PE=1 SV=1	65	STSAISFAEVQV
STSAIDFAEVDT	sp|P27312|GP_PUUMS	944	tr|A0A087X0L7|A0A087X0L7_HUMAN Mitochondrial inner membrane protein OXA1L OS=Homo sapiens OX=9606 GN=OXA1L PE=1 SV=1	65	STSAISFAEVQV
STSAIDFAEVDT	sp|P27312|GP_PUUMS	944	sp|Q15070|OXA1L_HUMAN Mitochondrial inner membrane protein OXA1L OS=Homo sapiens OX=9606 GN=OXA1L PE=1 SV=3	65	STSAISFAEVQV
STSAIDFAEVDT	sp|P27312|GP_PUUMS	944	tr|J3KNA0|J3KNA0_HUMAN Mitochondrial inner membrane protein OXA1L OS=Homo sapiens OX=9606 GN=OXA1L PE=1 SV=1	125	STSAISFAEVQV
LNGFRVLISLED	sp|P0C760|L_PUUMS	1838	sp|Q9Y3R5|DOP2_HUMAN Protein dopey-2 OS=Homo sapiens OX=9606 GN=DOP1B PE=1 SV=5	361	LKPFRVLISLLD
KLAVEELSREVA	sp|P0C760|L_PUUMS	1764	tr|C9JYL7|C9JYL7_HUMAN Nck-associated protein 5 (Fragment) OS=Homo sapiens OX=9606 GN=NCKAP5 PE=1 SV=1	50	KLAVARLQREVA
KLAVEELSREVA	sp|P0C760|L_PUUMS	1764	sp|O14513|NCKP5_HUMAN Nck-associated protein 5 OS=Homo sapiens OX=9606 GN=NCKAP5 PE=1 SV=2	50	KLAVARLQREVA
KLAVEELSREVA	sp|P0C760|L_PUUMS	1764	tr|A0A0A0MS79|A0A0A0MS79_HUMAN Nck-associated protein 5 OS=Homo sapiens OX=9606 GN=NCKAP5 PE=1 SV=1	50	KLAVARLQREVA
KLAVEELSREVA	sp|P0C760|L_PUUMS	1764	tr|A0A0A0MSE4|A0A0A0MSE4_HUMAN Nck-associated protein 5 OS=Homo sapiens OX=9606 GN=NCKAP5 PE=1 SV=1	50	KLAVARLQREVA
KLAVEELSREVA	sp|P0C760|L_PUUMS	1764	tr|H7C187|H7C187_HUMAN Nck-associated protein 5 (Fragment) OS=Homo sapiens OX=9606 GN=NCKAP5 PE=1 SV=1	46	KLAVARLQREVA
EALRALNVYGKR	sp|P0C760|L_PUUMS	1606	sp|A6NDG6|PGP_HUMAN Glycerol-3-phosphate phosphatase OS=Homo sapiens OX=9606 GN=PGP PE=1 SV=1	51	EALRALRARGKR
SFLVLVIVIAIL	sp|P27312|GP_PUUMS	1114	sp|Q9P2C4|TM181_HUMAN Transmembrane protein 181 OS=Homo sapiens OX=9606 GN=TMEM181 PE=1 SV=2	500	TFVVLVISIAIL
YKLSAKSRLRVC	sp|P0C760|L_PUUMS	1406	sp|Q8TER0|SNED1_HUMAN Sushi, nidogen and EGF-like domain-containing protein 1 OS=Homo sapiens OX=9606 GN=SNED1 PE=2 SV=2	728	YSLSAPSRIRVC
SLVSDSYDSKVI	sp|P0C760|L_PUUMS	306	tr|C9JFV4|C9JFV4_HUMAN Modulator of non-genomic activity of estrogen receptor OS=Homo sapiens OX=9606 GN=PELP1 PE=1 SV=2	829	SLESDSDDSVVI
SLVSDSYDSKVI	sp|P0C760|L_PUUMS	306	sp|Q8IZL8|PELP1_HUMAN Proline-, glutamic acid- and leucine-rich protein 1 OS=Homo sapiens OX=9606 GN=PELP1 PE=1 SV=2	779	SLESDSDDSVVI
SLVSDSYDSKVI	sp|P0C760|L_PUUMS	306	tr|E7EV54|E7EV54_HUMAN Modulator of non-genomic activity of estrogen receptor OS=Homo sapiens OX=9606 GN=PELP1 PE=1 SV=1	632	SLESDSDDSVVI
STTVRIEELQPG	sp|P27313|NCAP_PUUMS	185	tr|M0R009|M0R009_HUMAN Alpha-1B-glycoprotein (Fragment) OS=Homo sapiens OX=9606 GN=A1BG PE=1 SV=8	150	SATVTIEELGPG
MTAEENEEEDEL	sp|P0C760|L_PUUMS	1971	sp|Q9NQL2|RRAGD_HUMAN Ras-related GTP-binding protein D OS=Homo sapiens OX=9606 GN=RRAGD PE=1 SV=1	14	DDAEEEEEEDEL
VGAGTGAAVGSL	sp|P27312|GP_PUUMS	38	sp|Q9UF11|PKHB1_HUMAN Pleckstrin homology domain-containing family B member 1 OS=Homo sapiens OX=9606 GN=PLEKHB1 PE=1 SV=1	225	AGAATGAALGSL
VGAGTGAAVGSL	sp|P27312|GP_PUUMS	38	tr|F5GYU9|F5GYU9_HUMAN Pleckstrin homology domain-containing family B member 1 OS=Homo sapiens OX=9606 GN=PLEKHB1 PE=1 SV=1	120	AGAATGAALGSL
QALTPIIGAVGF	sp|P27313|NCAP_PUUMS	214	tr|V9P921|V9P921_HUMAN Interferon regulatory factor 1 OS=Homo sapiens OX=9606 GN=IRF1 PE=1 SV=1	177	QALTPALGAVGV
LHFIIWEQRNLE	sp|P0C760|L_PUUMS	1650	tr|H7C1B5|H7C1B5_HUMAN Galactose mutarotase (Fragment) OS=Homo sapiens OX=9606 GN=GALM PE=1 SV=1	201	QHGIIWRQRNLE
KGSGALPAKADV	sp|P27312|GP_PUUMS	672	sp|Q14D33|RTP5_HUMAN Receptor-transporting protein 5 OS=Homo sapiens OX=9606 GN=RTP5 PE=1 SV=2	418	KGSLALPFPADV
TTPVCSYEGSNL	sp|P27312|GP_PUUMS	909	tr|E7EPM4|E7EPM4_HUMAN Mucin-17 OS=Homo sapiens OX=9606 GN=MUC17 PE=1 SV=1	461	TTPVASSEASNL
TTPVCSYEGSNL	sp|P27312|GP_PUUMS	909	sp|Q685J3|MUC17_HUMAN Mucin-17 OS=Homo sapiens OX=9606 GN=MUC17 PE=1 SV=2	461	TTPVASSEASNL
GDTSLLECLEAL	sp|P0C760|L_PUUMS	17	sp|Q68DK2|ZFY26_HUMAN Zinc finger FYVE domain-containing protein 26 OS=Homo sapiens OX=9606 GN=ZFYVE26 PE=1 SV=3	2440	GDTILLNCLEAF
GDTSLLECLEAL	sp|P0C760|L_PUUMS	17	tr|A0A2H2FF08|A0A2H2FF08_HUMAN Zinc finger FYVE domain-containing protein 26 OS=Homo sapiens OX=9606 GN=ZFYVE26 PE=1 SV=1	286	GDTILLNCLEAF
LLLLSPQQAVSA	sp|P0C760|L_PUUMS	1933	sp|P02760|AMBP_HUMAN Protein AMBP OS=Homo sapiens OX=9606 GN=AMBP PE=1 SV=1	8	LLLLSACLAVSA
LLLLSPQQAVSA	sp|P0C760|L_PUUMS	1933	tr|S4R3Y4|S4R3Y4_HUMAN Protein AMBP OS=Homo sapiens OX=9606 GN=AMBP PE=1 SV=1	8	LLLLSACLAVSA
RQALTPIIGAVG	sp|P27313|NCAP_PUUMS	213	tr|V9P921|V9P921_HUMAN Interferon regulatory factor 1 OS=Homo sapiens OX=9606 GN=IRF1 PE=1 SV=1	176	EQALTPALGAVG
SAKSRLRVCKIG	sp|P0C760|L_PUUMS	1409	tr|A0A0A0MTQ9|A0A0A0MTQ9_HUMAN Transient receptor potential cation channel subfamily M member 1 (Fragment) OS=Homo sapiens OX=9606 GN=TRPM1 PE=1 SV=1	85	SSKSRGRVCAIG
SAKSRLRVCKIG	sp|P0C760|L_PUUMS	1409	tr|A0A0A0MTR0|A0A0A0MTR0_HUMAN Transient receptor potential cation channel subfamily M member 1 (Fragment) OS=Homo sapiens OX=9606 GN=TRPM1 PE=4 SV=1	85	SSKSRGRVCAIG
SAKSRLRVCKIG	sp|P0C760|L_PUUMS	1409	tr|H0YKU7|H0YKU7_HUMAN Transient receptor potential cation channel subfamily M member 1 (Fragment) OS=Homo sapiens OX=9606 GN=TRPM1 PE=1 SV=1	156	SSKSRGRVCAIG
SAKSRLRVCKIG	sp|P0C760|L_PUUMS	1409	tr|A0A0G2JN34|A0A0G2JN34_HUMAN Transient receptor potential cation channel subfamily M member 1 OS=Homo sapiens OX=9606 GN=TRPM1 PE=1 SV=1	195	SSKSRGRVCAIG
SAKSRLRVCKIG	sp|P0C760|L_PUUMS	1409	tr|A0A0G2JMR4|A0A0G2JMR4_HUMAN Transient receptor potential cation channel subfamily M member 1 OS=Homo sapiens OX=9606 GN=TRPM1 PE=1 SV=1	178	SSKSRGRVCAIG
SAKSRLRVCKIG	sp|P0C760|L_PUUMS	1409	tr|A0A0G2JMJ5|A0A0G2JMJ5_HUMAN Transient receptor potential cation channel subfamily M member 1 OS=Homo sapiens OX=9606 GN=TRPM1 PE=1 SV=1	156	SSKSRGRVCAIG
SAKSRLRVCKIG	sp|P0C760|L_PUUMS	1409	sp|Q7Z4N2|TRPM1_HUMAN Transient receptor potential cation channel subfamily M member 1 OS=Homo sapiens OX=9606 GN=TRPM1 PE=1 SV=2	156	SSKSRGRVCAIG
SAKSRLRVCKIG	sp|P0C760|L_PUUMS	1409	tr|A0A0G2JPN6|A0A0G2JPN6_HUMAN Transient receptor potential cation channel subfamily M member 1 OS=Homo sapiens OX=9606 GN=TRPM1 PE=1 SV=1	156	SSKSRGRVCAIG
QAIEFCHQYIGS	sp|P0C760|L_PUUMS	242	sp|P35228|NOS2_HUMAN Nitric oxide synthase, inducible OS=Homo sapiens OX=9606 GN=NOS2 PE=1 SV=2	142	QAIEFVNQYYGS
QAIEFCHQYIGS	sp|P0C760|L_PUUMS	242	tr|A0A2R8YDS4|A0A2R8YDS4_HUMAN Nitric oxide synthase OS=Homo sapiens OX=9606 GN=NOS2 PE=1 SV=1	141	QAIEFVNQYYGS
YCATGQALEGLC	sp|P27312|GP_PUUMS	182	sp|P14061|DHB1_HUMAN 17-beta-hydroxysteroid dehydrogenase type 1 OS=Homo sapiens OX=9606 GN=HSD17B1 PE=1 SV=3	156	YCASKFALEGLC
YCATGQALEGLC	sp|P27312|GP_PUUMS	182	tr|A0A0A0MQS7|A0A0A0MQS7_HUMAN Estradiol 17-beta-dehydrogenase OS=Homo sapiens OX=9606 GN=HSD17B1 PE=1 SV=1	156	YCASKFALEGLC
MSRRYQFNVRQI	sp|P0C760|L_PUUMS	2070	tr|A0A087X1H8|A0A087X1H8_HUMAN Zinc finger protein ZFPM1 OS=Homo sapiens OX=9606 GN=ZFPM1 PE=1 SV=1	1	MSRRKQSNPRQI
MSRRYQFNVRQI	sp|P0C760|L_PUUMS	2070	tr|A0A087WZP1|A0A087WZP1_HUMAN Zinc finger protein ZFPM1 OS=Homo sapiens OX=9606 GN=ZFPM1 PE=1 SV=1	1	MSRRKQSNPRQI
MSRRYQFNVRQI	sp|P0C760|L_PUUMS	2070	tr|A0A087WWQ0|A0A087WWQ0_HUMAN Zinc finger protein ZFPM1 OS=Homo sapiens OX=9606 GN=ZFPM1 PE=1 SV=1	1	MSRRKQSNPRQI
MSRRYQFNVRQI	sp|P0C760|L_PUUMS	2070	sp|Q8IX07|FOG1_HUMAN Zinc finger protein ZFPM1 OS=Homo sapiens OX=9606 GN=ZFPM1 PE=1 SV=2	1	MSRRKQSNPRQI
DRFRLGDDLDPD	sp|P27313|NCAP_PUUMS	398	sp|Q05D32|CTSL2_HUMAN CTD small phosphatase-like protein 2 OS=Homo sapiens OX=9606 GN=CTDSPL2 PE=1 SV=2	455	DRFRLHDLLPPD
VKLDHSAAPAPL	sp|P0C760|L_PUUMS	1254	sp|Q9Y572|RIPK3_HUMAN Receptor-interacting serine/threonine-protein kinase 3 OS=Homo sapiens OX=9606 GN=RIPK3 PE=1 SV=2	4	VKLWPSGAPAPL
TLAWLGPLQTGG	sp|P27312|GP_PUUMS	855	tr|A0A0A0MRA3|A0A0A0MRA3_HUMAN Titin OS=Homo sapiens OX=9606 GN=TTN PE=1 SV=1	16350	TLAWKPPLQDGG
TLAWLGPLQTGG	sp|P27312|GP_PUUMS	855	tr|A0A0A0MTS7|A0A0A0MTS7_HUMAN Titin OS=Homo sapiens OX=9606 GN=TTN PE=1 SV=1	25223	TLAWKPPLQDGG
TLAWLGPLQTGG	sp|P27312|GP_PUUMS	855	sp|Q8WZ42|TITIN_HUMAN Titin OS=Homo sapiens OX=9606 GN=TTN PE=1 SV=4	23582	TLAWKPPLQDGG
TLAWLGPLQTGG	sp|P27312|GP_PUUMS	855	tr|A0A0A0MRA3|A0A0A0MRA3_HUMAN Titin OS=Homo sapiens OX=9606 GN=TTN PE=1 SV=1	12511	TLAWLPPLRDGG
TLAWLGPLQTGG	sp|P27312|GP_PUUMS	855	tr|A0A0A0MTS7|A0A0A0MTS7_HUMAN Titin OS=Homo sapiens OX=9606 GN=TTN PE=1 SV=1	21384	TLAWLPPLRDGG
TLAWLGPLQTGG	sp|P27312|GP_PUUMS	855	sp|Q8WZ42|TITIN_HUMAN Titin OS=Homo sapiens OX=9606 GN=TTN PE=1 SV=4	19743	TLAWLPPLRDGG
TMTAEENEEEDE	sp|P0C760|L_PUUMS	1970	tr|M0R0R9|M0R0R9_HUMAN Transcription initiation factor IIF subunit alpha (Fragment) OS=Homo sapiens OX=9606 GN=GTF2F1 PE=1 SV=1	214	TLTAEEAEEEWE
TMTAEENEEEDE	sp|P0C760|L_PUUMS	1970	sp|P35269|T2FA_HUMAN General transcription factor IIF subunit 1 OS=Homo sapiens OX=9606 GN=GTF2F1 PE=1 SV=2	154	TLTAEEAEEEWE
DDLDPDMKGVIS	sp|P27313|NCAP_PUUMS	404	sp|Q8TEV9|SMCR8_HUMAN Guanine nucleotide exchange protein SMCR8 OS=Homo sapiens OX=9606 GN=SMCR8 PE=1 SV=2	456	DYLDMDMKGSIS
LLTKQVVLGNCI	sp|P27312|GP_PUUMS	452	tr|H3BPE1|H3BPE1_HUMAN Microtubule-actin cross-linking factor 1, isoforms 1/2/3/5 OS=Homo sapiens OX=9606 GN=MACF1 PE=1 SV=1	2497	LLTKQVVDGGII
LLTKQVVLGNCI	sp|P27312|GP_PUUMS	452	tr|H3BQK9|H3BQK9_HUMAN Microtubule-actin cross-linking factor 1, isoforms 1/2/3/5 OS=Homo sapiens OX=9606 GN=MACF1 PE=1 SV=1	2534	LLTKQVVDGGII
LLTKQVVLGNCI	sp|P27312|GP_PUUMS	452	sp|Q9UPN3|MACF1_HUMAN Microtubule-actin cross-linking factor 1, isoforms 1/2/3/5 OS=Homo sapiens OX=9606 GN=MACF1 PE=1 SV=4	2502	LLTKQVVDGGII
CQPPDCPGIGTG	sp|P27312|GP_PUUMS	775	sp|Q9UK23|NAGPA_HUMAN N-acetylglucosamine-1-phosphodiester alpha-N-acetylglucosaminidase OS=Homo sapiens OX=9606 GN=NAGPA PE=1 SV=2	329	CQPPDCHGHGTC
HFIIWEQRNLES	sp|P0C760|L_PUUMS	1651	tr|H7C1B5|H7C1B5_HUMAN Galactose mutarotase (Fragment) OS=Homo sapiens OX=9606 GN=GALM PE=1 SV=1	202	HGIIWRQRNLED
