query	query_seqname	query_start	target_seqname	target_start	target
DDDDDIDCDDDE	tr|Q6UZF1|Q6UZF1_SARS	931	sp|Q969K3|RNF34_HUMAN E3 ubiquitin-protein ligase RNF34 OS=Homo sapiens OX=9606 GN=RNF34 PE=1 SV=1	224	DDDDDDEDDDDE
DDDDDIDCDDDE	tr|Q6UZF1|Q6UZF1_SARS	931	sp|Q86V15|CASZ1_HUMAN Zinc finger protein castor homolog 1 OS=Homo sapiens OX=9606 GN=CASZ1 PE=1 SV=4	1697	DDEDDDDEDDDE
DDDDDIDCDDDE	tr|Q6UZF1|Q6UZF1_SARS	931	tr|E5RI98|E5RI98_HUMAN Nucleophosmin (Fragment) OS=Homo sapiens OX=9606 GN=NPM1 PE=1 SV=1	99	DDDDDDEEDDDE
DDDDDIDCDDDE	tr|Q6UZF1|Q6UZF1_SARS	931	sp|P06748|NPM_HUMAN Nucleophosmin OS=Homo sapiens OX=9606 GN=NPM1 PE=1 SV=2	163	DDDDDDEEDDDE
DDDDDIDCDDDE	tr|Q6UZF1|Q6UZF1_SARS	931	sp|Q6PL18|ATAD2_HUMAN ATPase family AAA domain-containing protein 2 OS=Homo sapiens OX=9606 GN=ATAD2 PE=1 SV=1	270	DDDDDDDDEDDE
DDDDDIDCDDDE	tr|Q6UZF1|Q6UZF1_SARS	931	sp|A1YPR0|ZBT7C_HUMAN Zinc finger and BTB domain-containing protein 7C OS=Homo sapiens OX=9606 GN=ZBTB7C PE=2 SV=1	141	DDDDDEDDDDEE
DDDDDIDCDDDE	tr|Q6UZF1|Q6UZF1_SARS	931	tr|H7BYJ1|H7BYJ1_HUMAN E3 ubiquitin-protein ligase RNF34 OS=Homo sapiens OX=9606 GN=RNF34 PE=1 SV=1	225	DDDDDEDDDDEE
DDDDDIDCDDDE	tr|Q6UZF1|Q6UZF1_SARS	931	tr|A0A087WTM5|A0A087WTM5_HUMAN E3 ubiquitin-protein ligase RNF34 OS=Homo sapiens OX=9606 GN=RNF34 PE=1 SV=1	33	DDDDDEDDDDEE
DDDDDIDCDDDE	tr|Q6UZF1|Q6UZF1_SARS	931	sp|Q969K3|RNF34_HUMAN E3 ubiquitin-protein ligase RNF34 OS=Homo sapiens OX=9606 GN=RNF34 PE=1 SV=1	225	DDDDDEDDDDEE
DDDDDIDCDDDE	tr|Q6UZF1|Q6UZF1_SARS	931	sp|Q15910|EZH2_HUMAN Histone-lysine N-methyltransferase EZH2 OS=Homo sapiens OX=9606 GN=EZH2 PE=1 SV=2	183	DDDDDDDGDDPE
DDDDDIDCDDDE	tr|Q6UZF1|Q6UZF1_SARS	931	tr|G3XAL2|G3XAL2_HUMAN Enhancer of zeste homolog 2 (Drosophila), isoform CRA_b OS=Homo sapiens OX=9606 GN=EZH2 PE=1 SV=1	183	DDDDDDDGDDPE
DDDDDIDCDDDE	tr|Q6UZF1|Q6UZF1_SARS	931	sp|O94763|RMP_HUMAN Unconventional prefoldin RPB5 interactor 1 OS=Homo sapiens OX=9606 GN=URI1 PE=1 SV=3	301	DDDDDDDDDDDN
DDDDDIDCDDDE	tr|Q6UZF1|Q6UZF1_SARS	931	tr|I3L280|I3L280_HUMAN Unconventional prefoldin RPB5 interactor 1 (Fragment) OS=Homo sapiens OX=9606 GN=URI1 PE=1 SV=1	48	DDDDDDDDDDDN
DDDDDIDCDDDE	tr|Q6UZF1|Q6UZF1_SARS	931	tr|M0QZ43|M0QZ43_HUMAN Sarcoplasmic reticulum histidine-rich calcium-binding protein OS=Homo sapiens OX=9606 GN=HRC PE=1 SV=1	251	DDDDDDDDDDDV
DDDDDIDCDDDE	tr|Q6UZF1|Q6UZF1_SARS	931	sp|P23327|SRCH_HUMAN Sarcoplasmic reticulum histidine-rich calcium-binding protein OS=Homo sapiens OX=9606 GN=HRC PE=1 SV=1	251	DDDDDDDDDDDV
DDDDDIDCDDDE	tr|Q6UZF1|Q6UZF1_SARS	931	sp|Q16594|TAF9_HUMAN Transcription initiation factor TFIID subunit 9 OS=Homo sapiens OX=9606 GN=TAF9 PE=1 SV=1	250	DDDDDDDDDDDY
NVVAITGNASLG	tr|Q6UZF0|Q6UZF0_SARS	856	sp|P20333|TNR1B_HUMAN Tumor necrosis factor receptor superfamily member 1B OS=Homo sapiens OX=9606 GN=TNFRSF1B PE=1 SV=3	186	NVVAIPGNASMD
MDLLQKTVPELQ	tr|Q6UZF1|Q6UZF1_SARS	552	sp|Q6ZP65|BICL1_HUMAN BICD family-like cargo adapter 1 OS=Homo sapiens OX=9606 GN=BICDL1 PE=2 SV=2	276	NDLLQGTVEELQ
IEEKCLVKCLSF	tr|Q6UZF1|Q6UZF1_SARS	4671	tr|R4GMW1|R4GMW1_HUMAN Vacuolar protein sorting-associated protein 13D (Fragment) OS=Homo sapiens OX=9606 GN=VPS13D PE=1 SV=1	20	IEEKLLLKLLSF
IEEKCLVKCLSF	tr|Q6UZF1|Q6UZF1_SARS	4671	tr|H3BLS7|H3BLS7_HUMAN Vacuolar protein sorting-associated protein 13D (Fragment) OS=Homo sapiens OX=9606 GN=VPS13D PE=1 SV=1	2763	IEEKLLLKLLSF
IEEKCLVKCLSF	tr|Q6UZF1|Q6UZF1_SARS	4671	sp|Q5THJ4|VP13D_HUMAN Vacuolar protein sorting-associated protein 13D OS=Homo sapiens OX=9606 GN=VPS13D PE=1 SV=2	3941	IEEKLLLKLLSF
IEEKCLVKCLSF	tr|Q6UZF1|Q6UZF1_SARS	4671	tr|A0A2R8Y876|A0A2R8Y876_HUMAN Vacuolar protein sorting-associated protein 13D (Fragment) OS=Homo sapiens OX=9606 GN=VPS13D PE=1 SV=1	205	IEEKLLLKLLSF
DLSLPYGVTRDG	tr|Q6UZE8|Q6UZE8_SARS	119	tr|A0A590UJM0|A0A590UJM0_HUMAN Sodium channel protein OS=Homo sapiens OX=9606 GN=SCN10A PE=3 SV=1	522	DISLPEGVTDDG
DLSLPYGVTRDG	tr|Q6UZE8|Q6UZE8_SARS	119	tr|A0A2R8Y6J6|A0A2R8Y6J6_HUMAN Sodium channel protein OS=Homo sapiens OX=9606 GN=SCN10A PE=1 SV=1	513	DISLPEGVTDDG
DLSLPYGVTRDG	tr|Q6UZE8|Q6UZE8_SARS	119	tr|A0A2R8Y7H0|A0A2R8Y7H0_HUMAN Sodium channel protein OS=Homo sapiens OX=9606 GN=SCN10A PE=1 SV=1	513	DISLPEGVTDDG
DLSLPYGVTRDG	tr|Q6UZE8|Q6UZE8_SARS	119	sp|Q9Y5Y9|SCNAA_HUMAN Sodium channel protein type 10 subunit alpha OS=Homo sapiens OX=9606 GN=SCN10A PE=1 SV=2	513	DISLPEGVTDDG
TAQMLGAKLRSL	tr|Q6UZF1|Q6UZF1_SARS	692	sp|O00482|NR5A2_HUMAN Nuclear receptor subfamily 5 group A member 2 OS=Homo sapiens OX=9606 GN=NR5A2 PE=1 SV=2	430	HAQELVAKLRSL
PQDLPNLKEEVA	tr|Q6UZF1|Q6UZF1_SARS	1333	sp|Q96K80|ZC3HA_HUMAN Zinc finger CCCH domain-containing protein 10 OS=Homo sapiens OX=9606 GN=ZC3H10 PE=1 SV=1	127	PADLPNGKEEVP
PPGTGKTHFAVG	tr|Q6UZF1|Q6UZF1_SARS	5584	tr|A0A5K1VW56|A0A5K1VW56_HUMAN ATPase family AAA domain-containing protein 3B OS=Homo sapiens OX=9606 GN=ATAD3B PE=1 SV=1	247	PPGTGKTLFAKK
PPGTGKTHFAVG	tr|Q6UZF1|Q6UZF1_SARS	5584	sp|Q5T9A4|ATD3B_HUMAN ATPase family AAA domain-containing protein 3B OS=Homo sapiens OX=9606 GN=ATAD3B PE=1 SV=1	353	PPGTGKTLFAKK
PPGTGKTHFAVG	tr|Q6UZF1|Q6UZF1_SARS	5584	sp|Q5T2N8|ATD3C_HUMAN ATPase family AAA domain-containing protein 3C OS=Homo sapiens OX=9606 GN=ATAD3C PE=2 SV=2	178	PPGTGKTLFAKK
PPGTGKTHFAVG	tr|Q6UZF1|Q6UZF1_SARS	5584	sp|Q9NVI7|ATD3A_HUMAN ATPase family AAA domain-containing protein 3A OS=Homo sapiens OX=9606 GN=ATAD3A PE=1 SV=2	401	PPGTGKTLFAKK
PPGTGKTHFAVG	tr|Q6UZF1|Q6UZF1_SARS	5584	sp|O60306|AQR_HUMAN RNA helicase aquarius OS=Homo sapiens OX=9606 GN=AQR PE=1 SV=4	824	PPGTGKTDVAVQ
DDDIDCDDDEID	tr|Q6UZF1|Q6UZF1_SARS	933	sp|Q6PL18|ATAD2_HUMAN ATPase family AAA domain-containing protein 2 OS=Homo sapiens OX=9606 GN=ATAD2 PE=1 SV=1	269	DDDDDDDDDEDD
DDDIDCDDDEID	tr|Q6UZF1|Q6UZF1_SARS	933	sp|O94763|RMP_HUMAN Unconventional prefoldin RPB5 interactor 1 OS=Homo sapiens OX=9606 GN=URI1 PE=1 SV=3	303	DDDDDDDDDNID
DDDIDCDDDEID	tr|Q6UZF1|Q6UZF1_SARS	933	tr|I3L280|I3L280_HUMAN Unconventional prefoldin RPB5 interactor 1 (Fragment) OS=Homo sapiens OX=9606 GN=URI1 PE=1 SV=1	50	DDDDDDDDDNID
RKGLKLVRKPAL	tr|Q6UZF1|Q6UZF1_SARS	1957	sp|P11717|MPRI_HUMAN Cation-independent mannose-6-phosphate receptor OS=Homo sapiens OX=9606 GN=IGF2R PE=1 SV=3	249	RDGLKLVRKDRL
TKSLIFDSVFSC	tr|Q6UZF0|Q6UZF0_SARS	148	sp|Q9Y512|SAM50_HUMAN Sorting and assembly machinery component 50 homolog OS=Homo sapiens OX=9606 GN=SAMM50 PE=1 SV=3	305	NKQLIFDSVFSA
VSQAIQRPSLGL	tr|Q6UZF1|Q6UZF1_SARS	5785	sp|Q9P1W3|CSC1_HUMAN Calcium permeable stress-gated cation channel 1 OS=Homo sapiens OX=9606 GN=TMEM63C PE=2 SV=1	657	VSQAIFAPLLGL
TVTESAKKTIRS	tr|Q6UZF1|Q6UZF1_SARS	2697	sp|O00300|TR11B_HUMAN Tumor necrosis factor receptor superfamily member 11B OS=Homo sapiens OX=9606 GN=TNFRSF11B PE=1 SV=3	360	TVTQSLKKTIRF
QDNASTSTNLLG	tr|Q6UZF0|Q6UZF0_SARS	917	tr|B4DHA8|B4DHA8_HUMAN CUGBP Elav-like family member 4 OS=Homo sapiens OX=9606 GN=CELF4 PE=1 SV=1	13	ADNASLSTNGLG
QDNASTSTNLLG	tr|Q6UZF0|Q6UZF0_SARS	917	tr|A0A0C4DGR1|A0A0C4DGR1_HUMAN CUGBP Elav-like family member 4 (Fragment) OS=Homo sapiens OX=9606 GN=CELF4 PE=1 SV=1	13	ADNASLSTNGLG
QDNASTSTNLLG	tr|Q6UZF0|Q6UZF0_SARS	917	tr|M0QY66|M0QY66_HUMAN CUGBP Elav-like family member 4 OS=Homo sapiens OX=9606 GN=CELF4 PE=1 SV=1	13	ADNASLSTNGLG
QDNASTSTNLLG	tr|Q6UZF0|Q6UZF0_SARS	917	sp|Q9BZC1|CELF4_HUMAN CUGBP Elav-like family member 4 OS=Homo sapiens OX=9606 GN=CELF4 PE=1 SV=1	13	ADNASLSTNGLG
STSFTAYFFIFE	tr|Q6UZF1|Q6UZF1_SARS	3574	tr|A0A1W2PRY2|A0A1W2PRY2_HUMAN Potassium voltage-gated channel subfamily A member 2 OS=Homo sapiens OX=9606 GN=KCNA2 PE=1 SV=1	21	STSFTDPFFIVE
STSFTAYFFIFE	tr|Q6UZF1|Q6UZF1_SARS	3574	sp|P16389|KCNA2_HUMAN Potassium voltage-gated channel subfamily A member 2 OS=Homo sapiens OX=9606 GN=KCNA2 PE=1 SV=2	215	STSFTDPFFIVE
STSFTAYFFIFE	tr|Q6UZF1|Q6UZF1_SARS	3574	tr|A0A1W2PPN8|A0A1W2PPN8_HUMAN Potassium voltage-gated channel subfamily A member 2 OS=Homo sapiens OX=9606 GN=KCNA2 PE=1 SV=1	93	STSFTDPFFIVE
ETAKEPVVTNLE	tr|Q6UZF1|Q6UZF1_SARS	4361	tr|G3V587|G3V587_HUMAN Unconventional myosin-Ia (Fragment) OS=Homo sapiens OX=9606 GN=MYO1A PE=1 SV=8	19	ETAKEKVVTALN
ETAKEPVVTNLE	tr|Q6UZF1|Q6UZF1_SARS	4361	tr|G3V342|G3V342_HUMAN Unconventional myosin-Ia OS=Homo sapiens OX=9606 GN=MYO1A PE=1 SV=1	161	ETAKEKVVTALN
ETAKEPVVTNLE	tr|Q6UZF1|Q6UZF1_SARS	4361	sp|Q9UBC5|MYO1A_HUMAN Unconventional myosin-Ia OS=Homo sapiens OX=9606 GN=MYO1A PE=1 SV=1	323	ETAKEKVVTALN
NITGPPGTGKTH	tr|Q6UZF1|Q6UZF1_SARS	5580	sp|Q9BYK8|HELZ2_HUMAN Helicase with zinc finger domain 2 OS=Homo sapiens OX=9606 GN=HELZ2 PE=1 SV=6	2171	VIQGPPGTGKTI
NITGPPGTGKTH	tr|Q6UZF1|Q6UZF1_SARS	5580	sp|Q9Y4W6|AFG32_HUMAN AFG3-like protein 2 OS=Homo sapiens OX=9606 GN=AFG3L2 PE=1 SV=2	345	ILTGPPGTGKTL
NITGPPGTGKTH	tr|Q6UZF1|Q6UZF1_SARS	5580	tr|C9J5S9|C9J5S9_HUMAN DNA repair protein RAD51 homolog 2 (Fragment) OS=Homo sapiens OX=9606 GN=RAD51B PE=1 SV=1	105	EITGPPGCGKTQ
NITGPPGTGKTH	tr|Q6UZF1|Q6UZF1_SARS	5580	sp|O15315|RA51B_HUMAN DNA repair protein RAD51 homolog 2 OS=Homo sapiens OX=9606 GN=RAD51B PE=1 SV=2	105	EITGPPGCGKTQ
NITGPPGTGKTH	tr|Q6UZF1|Q6UZF1_SARS	5580	tr|C9JYJ0|C9JYJ0_HUMAN DNA repair protein RAD51 homolog 2 OS=Homo sapiens OX=9606 GN=RAD51B PE=1 SV=1	105	EITGPPGCGKTQ
NITGPPGTGKTH	tr|Q6UZF1|Q6UZF1_SARS	5580	tr|A0A0A0MS18|A0A0A0MS18_HUMAN DNA repair protein RAD51 homolog 2 OS=Homo sapiens OX=9606 GN=RAD51B PE=1 SV=1	105	EITGPPGCGKTQ
NITGPPGTGKTH	tr|Q6UZF1|Q6UZF1_SARS	5580	tr|D6RAW6|D6RAW6_HUMAN Cell cycle checkpoint protein RAD17 (Fragment) OS=Homo sapiens OX=9606 GN=RAD17 PE=1 SV=1	123	LITGPPGCGKTT
NITGPPGTGKTH	tr|Q6UZF1|Q6UZF1_SARS	5580	sp|O75943|RAD17_HUMAN Cell cycle checkpoint protein RAD17 OS=Homo sapiens OX=9606 GN=RAD17 PE=1 SV=2	134	LITGPPGCGKTT
NITGPPGTGKTH	tr|Q6UZF1|Q6UZF1_SARS	5580	tr|A0A0G2JPT5|A0A0G2JPT5_HUMAN Cell cycle checkpoint protein RAD17 OS=Homo sapiens OX=9606 GN=RAD17 PE=1 SV=1	134	LITGPPGCGKTT
NITGPPGTGKTH	tr|Q6UZF1|Q6UZF1_SARS	5580	tr|A0A0G2JP78|A0A0G2JP78_HUMAN Cell cycle checkpoint protein RAD17 OS=Homo sapiens OX=9606 GN=RAD17 PE=1 SV=1	37	LITGPPGCGKTT
NITGPPGTGKTH	tr|Q6UZF1|Q6UZF1_SARS	5580	sp|P35250|RFC2_HUMAN Replication factor C subunit 2 OS=Homo sapiens OX=9606 GN=RFC2 PE=1 SV=3	73	IIAGPPGTGKTT
NITGPPGTGKTH	tr|Q6UZF1|Q6UZF1_SARS	5580	tr|F5GX64|F5GX64_HUMAN DNA-binding protein SMUBP-2 (Fragment) OS=Homo sapiens OX=9606 GN=IGHMBP2 PE=1 SV=2	199	IIHGPPGTGKTT
NITGPPGTGKTH	tr|Q6UZF1|Q6UZF1_SARS	5580	tr|A0A6Q8PFP3|A0A6Q8PFP3_HUMAN DNA-binding protein SMUBP-2 (Fragment) OS=Homo sapiens OX=9606 GN=IGHMBP2 PE=1 SV=1	199	IIHGPPGTGKTT
NITGPPGTGKTH	tr|Q6UZF1|Q6UZF1_SARS	5580	tr|A0A6Q8PGT6|A0A6Q8PGT6_HUMAN DNA-binding protein SMUBP-2 OS=Homo sapiens OX=9606 GN=IGHMBP2 PE=1 SV=1	211	IIHGPPGTGKTT
NITGPPGTGKTH	tr|Q6UZF1|Q6UZF1_SARS	5580	sp|P38935|SMBP2_HUMAN DNA-binding protein SMUBP-2 OS=Homo sapiens OX=9606 GN=IGHMBP2 PE=1 SV=3	211	IIHGPPGTGKTT
NITGPPGTGKTH	tr|Q6UZF1|Q6UZF1_SARS	5580	tr|A0A6Q8PGX2|A0A6Q8PGX2_HUMAN DNA-binding protein SMUBP-2 OS=Homo sapiens OX=9606 GN=IGHMBP2 PE=1 SV=1	211	IIHGPPGTGKTT
NITGPPGTGKTH	tr|Q6UZF1|Q6UZF1_SARS	5580	tr|Q5JR04|Q5JR04_HUMAN RNA helicase OS=Homo sapiens OX=9606 GN=MOV10 PE=1 SV=1	465	IIFGPPGTGKTV
NITGPPGTGKTH	tr|Q6UZF1|Q6UZF1_SARS	5580	sp|Q9HCE1|MOV10_HUMAN Helicase MOV-10 OS=Homo sapiens OX=9606 GN=MOV10 PE=1 SV=2	521	IIFGPPGTGKTV
NITGPPGTGKTH	tr|Q6UZF1|Q6UZF1_SARS	5580	sp|Q92900|RENT1_HUMAN Regulator of nonsense transcripts 1 OS=Homo sapiens OX=9606 GN=UPF1 PE=1 SV=2	500	LIQGPPGTGKTV
NITGPPGTGKTH	tr|Q6UZF1|Q6UZF1_SARS	5580	tr|Q5JXR5|Q5JXR5_HUMAN NFX1-type zinc finger-containing protein 1 (Fragment) OS=Homo sapiens OX=9606 GN=ZNFX1 PE=1 SV=1	616	IIQGPPGTGKTY
NITGPPGTGKTH	tr|Q6UZF1|Q6UZF1_SARS	5580	tr|Q5JXR6|Q5JXR6_HUMAN NFX1-type zinc finger-containing protein 1 OS=Homo sapiens OX=9606 GN=ZNFX1 PE=1 SV=1	616	IIQGPPGTGKTY
NITGPPGTGKTH	tr|Q6UZF1|Q6UZF1_SARS	5580	sp|Q9P2E3|ZNFX1_HUMAN NFX1-type zinc finger-containing protein 1 OS=Homo sapiens OX=9606 GN=ZNFX1 PE=2 SV=2	616	IIQGPPGTGKTY
NITGPPGTGKTH	tr|Q6UZF1|Q6UZF1_SARS	5580	tr|Q5JXR7|Q5JXR7_HUMAN NFX1-type zinc finger-containing protein 1 (Fragment) OS=Homo sapiens OX=9606 GN=ZNFX1 PE=1 SV=1	420	IIQGPPGTGKTY
SHGVTLILGNNK	tr|Q6UZF1|Q6UZF1_SARS	4951	sp|Q8IW52|SLIK4_HUMAN SLIT and NTRK-like protein 4 OS=Homo sapiens OX=9606 GN=SLITRK4 PE=1 SV=1	83	SHAVSLHLGNNK
SHGVTLILGNNK	tr|Q6UZF1|Q6UZF1_SARS	4951	sp|Q9NYW3|TA2R7_HUMAN Taste receptor type 2 member 7 OS=Homo sapiens OX=9606 GN=TAS2R7 PE=1 SV=1	280	SHSFILILGNNK
GEKIKNQVARTA	tr|Q6UZF1|Q6UZF1_SARS	4548	sp|Q14088|RB33A_HUMAN Ras-related protein Rab-33A OS=Homo sapiens OX=9606 GN=RAB33A PE=1 SV=2	82	GEKIKVQVWDTA
KLCGATLLKITP	tr|Q6UZF1|Q6UZF1_SARS	4379	tr|E9PI91|E9PI91_HUMAN E3 ubiquitin-protein ligase pellino homolog 3 (Fragment) OS=Homo sapiens OX=9606 GN=PELI3 PE=1 SV=1	188	DLCGATLLWRTP
KLCGATLLKITP	tr|Q6UZF1|Q6UZF1_SARS	4379	sp|Q8N2H9|PELI3_HUMAN E3 ubiquitin-protein ligase pellino homolog 3 OS=Homo sapiens OX=9606 GN=PELI3 PE=1 SV=2	295	DLCGATLLWRTP
TGPPGTGKTHFA	tr|Q6UZF1|Q6UZF1_SARS	5582	sp|P35998|PRS7_HUMAN 26S proteasome regulatory subunit 7 OS=Homo sapiens OX=9606 GN=PSMC2 PE=1 SV=3	215	FGPPGTGKTLCA
TGPPGTGKTHFA	tr|Q6UZF1|Q6UZF1_SARS	5582	tr|A0A5K1VW56|A0A5K1VW56_HUMAN ATPase family AAA domain-containing protein 3B OS=Homo sapiens OX=9606 GN=ATAD3B PE=1 SV=1	245	YGPPGTGKTLFA
TGPPGTGKTHFA	tr|Q6UZF1|Q6UZF1_SARS	5582	sp|Q5T9A4|ATD3B_HUMAN ATPase family AAA domain-containing protein 3B OS=Homo sapiens OX=9606 GN=ATAD3B PE=1 SV=1	351	YGPPGTGKTLFA
TGPPGTGKTHFA	tr|Q6UZF1|Q6UZF1_SARS	5582	sp|Q5T2N8|ATD3C_HUMAN ATPase family AAA domain-containing protein 3C OS=Homo sapiens OX=9606 GN=ATAD3C PE=2 SV=2	176	YGPPGTGKTLFA
TGPPGTGKTHFA	tr|Q6UZF1|Q6UZF1_SARS	5582	sp|Q9NVI7|ATD3A_HUMAN ATPase family AAA domain-containing protein 3A OS=Homo sapiens OX=9606 GN=ATAD3A PE=1 SV=2	399	YGPPGTGKTLFA
TGPPGTGKTHFA	tr|Q6UZF1|Q6UZF1_SARS	5582	sp|P55072|TERA_HUMAN Transitional endoplasmic reticulum ATPase OS=Homo sapiens OX=9606 GN=VCP PE=1 SV=4	244	YGPPGTGKTLIA
TGPPGTGKTHFA	tr|Q6UZF1|Q6UZF1_SARS	5582	tr|A0A6Q8PGU6|A0A6Q8PGU6_HUMAN Vesicle-fusing ATPase OS=Homo sapiens OX=9606 GN=SPATA5 PE=1 SV=1	392	YGPPGTGKTMIA
TGPPGTGKTHFA	tr|Q6UZF1|Q6UZF1_SARS	5582	sp|Q8NB90|AFG2H_HUMAN ATPase family protein 2 homolog OS=Homo sapiens OX=9606 GN=SPATA5 PE=1 SV=3	393	YGPPGTGKTMIA
TGPPGTGKTHFA	tr|Q6UZF1|Q6UZF1_SARS	5582	sp|Q9Y265|RUVB1_HUMAN RuvB-like 1 OS=Homo sapiens OX=9606 GN=RUVBL1 PE=1 SV=1	69	AGPPGTGKTALA
TGPPGTGKTHFA	tr|Q6UZF1|Q6UZF1_SARS	5582	tr|E7ETR0|E7ETR0_HUMAN RuvB-like helicase OS=Homo sapiens OX=9606 GN=RUVBL1 PE=1 SV=1	9	AGPPGTGKTALA
TGPPGTGKTHFA	tr|Q6UZF1|Q6UZF1_SARS	5582	sp|Q13608|PEX6_HUMAN Peroxisome assembly factor 2 OS=Homo sapiens OX=9606 GN=PEX6 PE=1 SV=2	743	HGPPGTGKTLLA
TGPPGTGKTHFA	tr|Q6UZF1|Q6UZF1_SARS	5582	sp|Q9Y4W6|AFG32_HUMAN AFG3-like protein 2 OS=Homo sapiens OX=9606 GN=AFG3L2 PE=1 SV=2	347	TGPPGTGKTLLA
TGPPGTGKTHFA	tr|Q6UZF1|Q6UZF1_SARS	5582	tr|B7ZBC8|B7ZBC8_HUMAN Katanin p60 ATPase-containing subunit A1 (Fragment) OS=Homo sapiens OX=9606 GN=KATNA1 PE=1 SV=1	248	VGPPGTGKTLLA
TGPPGTGKTHFA	tr|Q6UZF1|Q6UZF1_SARS	5582	sp|O75449|KTNA1_HUMAN Katanin p60 ATPase-containing subunit A1 OS=Homo sapiens OX=9606 GN=KATNA1 PE=1 SV=1	248	VGPPGTGKTLLA
TGPPGTGKTHFA	tr|Q6UZF1|Q6UZF1_SARS	5582	tr|R4GNA5|R4GNA5_HUMAN ATP-dependent zinc metalloprotease YME1L1 (Fragment) OS=Homo sapiens OX=9606 GN=YME1L1 PE=1 SV=1	197	VGPPGTGKTLLA
TGPPGTGKTHFA	tr|Q6UZF1|Q6UZF1_SARS	5582	sp|Q96TA2|YMEL1_HUMAN ATP-dependent zinc metalloprotease YME1L1 OS=Homo sapiens OX=9606 GN=YME1L1 PE=1 SV=2	378	VGPPGTGKTLLA
TGPPGTGKTHFA	tr|Q6UZF1|Q6UZF1_SARS	5582	tr|Q96I63|Q96I63_HUMAN ATP-dependent zinc metalloprotease YME1L1 OS=Homo sapiens OX=9606 GN=YME1L1 PE=1 SV=1	378	VGPPGTGKTLLA
TGPPGTGKTHFA	tr|Q6UZF1|Q6UZF1_SARS	5582	sp|O43933|PEX1_HUMAN Peroxisome biogenesis factor 1 OS=Homo sapiens OX=9606 GN=PEX1 PE=1 SV=1	880	YGPPGTGKTLLA
TGPPGTGKTHFA	tr|Q6UZF1|Q6UZF1_SARS	5582	tr|A0A0C4DG33|A0A0C4DG33_HUMAN Peroxin-1 OS=Homo sapiens OX=9606 GN=PEX1 PE=1 SV=1	823	YGPPGTGKTLLA
TGPPGTGKTHFA	tr|Q6UZF1|Q6UZF1_SARS	5582	tr|G3V4X1|G3V4X1_HUMAN 26S proteasome regulatory subunit 4 (Fragment) OS=Homo sapiens OX=9606 GN=PSMC1 PE=1 SV=1	62	YGPPGTGKTLLA
TGPPGTGKTHFA	tr|Q6UZF1|Q6UZF1_SARS	5582	sp|P62191|PRS4_HUMAN 26S proteasome regulatory subunit 4 OS=Homo sapiens OX=9606 GN=PSMC1 PE=1 SV=1	225	YGPPGTGKTLLA
TGPPGTGKTHFA	tr|Q6UZF1|Q6UZF1_SARS	5582	tr|K7EM02|K7EM02_HUMAN Katanin p60 ATPase-containing subunit A-like 2 (Fragment) OS=Homo sapiens OX=9606 GN=KATNAL2 PE=1 SV=1	17	YGPPGTGKTLLA
TGPPGTGKTHFA	tr|Q6UZF1|Q6UZF1_SARS	5582	sp|Q8IYT4|KATL2_HUMAN Katanin p60 ATPase-containing subunit A-like 2 OS=Homo sapiens OX=9606 GN=KATNAL2 PE=1 SV=3	293	YGPPGTGKTLLA
TGPPGTGKTHFA	tr|Q6UZF1|Q6UZF1_SARS	5582	tr|K7EIJ8|K7EIJ8_HUMAN Katanin p60 ATPase-containing subunit A-like 2 (Fragment) OS=Homo sapiens OX=9606 GN=KATNAL2 PE=1 SV=1	150	YGPPGTGKTLLA
TGPPGTGKTHFA	tr|Q6UZF1|Q6UZF1_SARS	5582	tr|E9PMD8|E9PMD8_HUMAN 26S proteasome regulatory subunit 6A (Fragment) OS=Homo sapiens OX=9606 GN=PSMC3 PE=1 SV=9	233	YGPPGTGKTLLA
TGPPGTGKTHFA	tr|Q6UZF1|Q6UZF1_SARS	5582	tr|E9PN50|E9PN50_HUMAN 26S proteasome regulatory subunit 6A (Fragment) OS=Homo sapiens OX=9606 GN=PSMC3 PE=1 SV=9	189	YGPPGTGKTLLA
TGPPGTGKTHFA	tr|Q6UZF1|Q6UZF1_SARS	5582	tr|E9PKD5|E9PKD5_HUMAN 26S proteasome regulatory subunit 6A (Fragment) OS=Homo sapiens OX=9606 GN=PSMC3 PE=1 SV=2	187	YGPPGTGKTLLA
TGPPGTGKTHFA	tr|Q6UZF1|Q6UZF1_SARS	5582	tr|R4GNH3|R4GNH3_HUMAN 26S proteasome regulatory subunit 6A OS=Homo sapiens OX=9606 GN=PSMC3 PE=1 SV=1	210	YGPPGTGKTLLA
TGPPGTGKTHFA	tr|Q6UZF1|Q6UZF1_SARS	5582	sp|P17980|PRS6A_HUMAN 26S proteasome regulatory subunit 6A OS=Homo sapiens OX=9606 GN=PSMC3 PE=1 SV=3	226	YGPPGTGKTLLA
TGPPGTGKTHFA	tr|Q6UZF1|Q6UZF1_SARS	5582	tr|E9PM69|E9PM69_HUMAN 26S proteasome regulatory subunit 6A OS=Homo sapiens OX=9606 GN=PSMC3 PE=1 SV=1	184	YGPPGTGKTLLA
TGPPGTGKTHFA	tr|Q6UZF1|Q6UZF1_SARS	5582	tr|J3QRW1|J3QRW1_HUMAN 26S proteasome regulatory subunit 8 (Fragment) OS=Homo sapiens OX=9606 GN=PSMC5 PE=1 SV=1	112	YGPPGTGKTLLA
TGPPGTGKTHFA	tr|Q6UZF1|Q6UZF1_SARS	5582	tr|J3QLH6|J3QLH6_HUMAN 26S proteasome regulatory subunit 8 (Fragment) OS=Homo sapiens OX=9606 GN=PSMC5 PE=1 SV=1	181	YGPPGTGKTLLA
TGPPGTGKTHFA	tr|Q6UZF1|Q6UZF1_SARS	5582	tr|J3QRR3|J3QRR3_HUMAN 26S proteasome regulatory subunit 8 (Fragment) OS=Homo sapiens OX=9606 GN=PSMC5 PE=1 SV=1	44	YGPPGTGKTLLA
TGPPGTGKTHFA	tr|Q6UZF1|Q6UZF1_SARS	5582	tr|J3KRP2|J3KRP2_HUMAN 26S proteasome regulatory subunit 8 (Fragment) OS=Homo sapiens OX=9606 GN=PSMC5 PE=1 SV=1	181	YGPPGTGKTLLA
TGPPGTGKTHFA	tr|Q6UZF1|Q6UZF1_SARS	5582	tr|J3QSA9|J3QSA9_HUMAN 26S proteasome regulatory subunit 8 (Fragment) OS=Homo sapiens OX=9606 GN=PSMC5 PE=1 SV=1	181	YGPPGTGKTLLA
TGPPGTGKTHFA	tr|Q6UZF1|Q6UZF1_SARS	5582	tr|J3QQM1|J3QQM1_HUMAN 26S proteasome regulatory subunit 8 (Fragment) OS=Homo sapiens OX=9606 GN=PSMC5 PE=1 SV=1	170	YGPPGTGKTLLA
TGPPGTGKTHFA	tr|Q6UZF1|Q6UZF1_SARS	5582	sp|P62195|PRS8_HUMAN 26S proteasome regulatory subunit 8 OS=Homo sapiens OX=9606 GN=PSMC5 PE=1 SV=1	189	YGPPGTGKTLLA
TGPPGTGKTHFA	tr|Q6UZF1|Q6UZF1_SARS	5582	tr|H0YJS8|H0YJS8_HUMAN 26S proteasome regulatory subunit 10B (Fragment) OS=Homo sapiens OX=9606 GN=PSMC6 PE=1 SV=2	133	YGPPGTGKTLLA
TGPPGTGKTHFA	tr|Q6UZF1|Q6UZF1_SARS	5582	tr|H0YJC0|H0YJC0_HUMAN 26S proteasome regulatory subunit 10B (Fragment) OS=Homo sapiens OX=9606 GN=PSMC6 PE=1 SV=1	173	YGPPGTGKTLLA
TGPPGTGKTHFA	tr|Q6UZF1|Q6UZF1_SARS	5582	tr|A0A087X2I1|A0A087X2I1_HUMAN 26S proteasome regulatory subunit 10B OS=Homo sapiens OX=9606 GN=PSMC6 PE=1 SV=1	187	YGPPGTGKTLLA
TGPPGTGKTHFA	tr|Q6UZF1|Q6UZF1_SARS	5582	sp|P62333|PRS10_HUMAN 26S proteasome regulatory subunit 10B OS=Homo sapiens OX=9606 GN=PSMC6 PE=1 SV=1	173	YGPPGTGKTLLA
TGPPGTGKTHFA	tr|Q6UZF1|Q6UZF1_SARS	5582	sp|Q9BW62|KATL1_HUMAN Katanin p60 ATPase-containing subunit A-like 1 OS=Homo sapiens OX=9606 GN=KATNAL1 PE=1 SV=1	247	VGPPGTGKTMLA
TGPPGTGKTHFA	tr|Q6UZF1|Q6UZF1_SARS	5582	sp|O60306|AQR_HUMAN RNA helicase aquarius OS=Homo sapiens OX=9606 GN=AQR PE=1 SV=4	822	VGPPGTGKTDVA
TGPPGTGKTHFA	tr|Q6UZF1|Q6UZF1_SARS	5582	sp|Q9ULI0|ATD2B_HUMAN ATPase family AAA domain-containing protein 2B OS=Homo sapiens OX=9606 GN=ATAD2B PE=1 SV=3	440	YGPPGTGKTLVA
TGPPGTGKTHFA	tr|Q6UZF1|Q6UZF1_SARS	5582	sp|Q6PL18|ATAD2_HUMAN ATPase family AAA domain-containing protein 2 OS=Homo sapiens OX=9606 GN=ATAD2 PE=1 SV=1	466	YGPPGTGKTLVA
TGPPGTGKTHFA	tr|Q6UZF1|Q6UZF1_SARS	5582	tr|C9J5S9|C9J5S9_HUMAN DNA repair protein RAD51 homolog 2 (Fragment) OS=Homo sapiens OX=9606 GN=RAD51B PE=1 SV=1	107	TGPPGCGKTQFC
TGPPGTGKTHFA	tr|Q6UZF1|Q6UZF1_SARS	5582	sp|O15315|RA51B_HUMAN DNA repair protein RAD51 homolog 2 OS=Homo sapiens OX=9606 GN=RAD51B PE=1 SV=2	107	TGPPGCGKTQFC
TGPPGTGKTHFA	tr|Q6UZF1|Q6UZF1_SARS	5582	tr|C9JYJ0|C9JYJ0_HUMAN DNA repair protein RAD51 homolog 2 OS=Homo sapiens OX=9606 GN=RAD51B PE=1 SV=1	107	TGPPGCGKTQFC
TGPPGTGKTHFA	tr|Q6UZF1|Q6UZF1_SARS	5582	tr|A0A0A0MS18|A0A0A0MS18_HUMAN DNA repair protein RAD51 homolog 2 OS=Homo sapiens OX=9606 GN=RAD51B PE=1 SV=1	107	TGPPGCGKTQFC
ELPGLPKDISYK	tr|Q6UZF1|Q6UZF1_SARS	5943	tr|A0A5F9ZI01|A0A5F9ZI01_HUMAN Tyrosine-protein kinase JAK1 (Fragment) OS=Homo sapiens OX=9606 GN=JAK1 PE=1 SV=1	207	QLPELPKDISYK
ELPGLPKDISYK	tr|Q6UZF1|Q6UZF1_SARS	5943	tr|A0A5F9ZI39|A0A5F9ZI39_HUMAN Tyrosine-protein kinase OS=Homo sapiens OX=9606 GN=JAK1 PE=1 SV=1	207	QLPELPKDISYK
ELPGLPKDISYK	tr|Q6UZF1|Q6UZF1_SARS	5943	sp|P23458|JAK1_HUMAN Tyrosine-protein kinase JAK1 OS=Homo sapiens OX=9606 GN=JAK1 PE=1 SV=2	207	QLPELPKDISYK
ELPGLPKDISYK	tr|Q6UZF1|Q6UZF1_SARS	5943	tr|A0A5F9ZH32|A0A5F9ZH32_HUMAN Tyrosine-protein kinase OS=Homo sapiens OX=9606 GN=JAK1 PE=1 SV=1	207	QLPELPKDISYK
DIVLFVGTVNYE	tr|Q6UZF1|Q6UZF1_SARS	1743	sp|Q96J65|MRP9_HUMAN ATP-binding cassette sub-family C member 12 OS=Homo sapiens OX=9606 GN=ABCC12 PE=1 SV=2	1203	DPVLFVGTVRYN
SKGTVGGLKAAI	tr|Q6UZF1|Q6UZF1_SARS	6670	sp|Q5VTL7|FNDC7_HUMAN Fibronectin type III domain-containing protein 7 OS=Homo sapiens OX=9606 GN=FNDC7 PE=2 SV=3	76	SPGTVTGLKAAT
LCGATLLKITPC	tr|Q6UZF1|Q6UZF1_SARS	4380	tr|E9PI91|E9PI91_HUMAN E3 ubiquitin-protein ligase pellino homolog 3 (Fragment) OS=Homo sapiens OX=9606 GN=PELI3 PE=1 SV=1	189	LCGATLLWRTPA
LCGATLLKITPC	tr|Q6UZF1|Q6UZF1_SARS	4380	sp|Q8N2H9|PELI3_HUMAN E3 ubiquitin-protein ligase pellino homolog 3 OS=Homo sapiens OX=9606 GN=PELI3 PE=1 SV=2	296	LCGATLLWRTPA
NVLLLLFLSGGL	tr|Q6UZF1|Q6UZF1_SARS	594	sp|P24043|LAMA2_HUMAN Laminin subunit alpha-2 OS=Homo sapiens OX=9606 GN=LAMA2 PE=1 SV=4	6	GVLLLLLLSGGL
NVLLLLFLSGGL	tr|Q6UZF1|Q6UZF1_SARS	594	tr|A0A087WYF1|A0A087WYF1_HUMAN Laminin subunit alpha-2 OS=Homo sapiens OX=9606 GN=LAMA2 PE=1 SV=1	6	GVLLLLLLSGGL
NVLLLLFLSGGL	tr|Q6UZF1|Q6UZF1_SARS	594	tr|A0A087WX80|A0A087WX80_HUMAN Laminin subunit alpha-2 OS=Homo sapiens OX=9606 GN=LAMA2 PE=1 SV=1	6	GVLLLLLLSGGL
GFVLGAVVIVVL	tr|Q6UZF0|Q6UZF0_SARS	1201	sp|Q8IVY1|CA210_HUMAN Type III endosome membrane protein TEMP OS=Homo sapiens OX=9606 GN=C1orf210 PE=3 SV=1	36	GFVLGAVVLSLL
RDIGYLVPGLPG	tr|Q6UZF1|Q6UZF1_SARS	2837	sp|Q86V42|F124A_HUMAN Protein FAM124A OS=Homo sapiens OX=9606 GN=FAM124A PE=1 SV=1	244	RDIGELVPLLPN
VPPALTEDLVIL	tr|Q6UZF0|Q6UZF0_SARS	843	tr|B7ZM68|B7ZM68_HUMAN FGD5 protein OS=Homo sapiens OX=9606 GN=FGD5 PE=1 SV=1	1109	VPSALTEDKVAL
CELLKDMGLVGL	tr|Q6UZF1|Q6UZF1_SARS	4562	sp|P41226|UBA7_HUMAN Ubiquitin-like modifier-activating enzyme 7 OS=Homo sapiens OX=9606 GN=UBA7 PE=1 SV=2	445	CELLKVFALVGL
QGLQAVILPNGF	tr|Q6UZF1|Q6UZF1_SARS	6015	sp|Q96GQ5|RUSF1_HUMAN RUS family member 1 OS=Homo sapiens OX=9606 GN=RUSF1 PE=1 SV=2	71	SGLQAVFLPQGF
QGLQAVILPNGF	tr|Q6UZF1|Q6UZF1_SARS	6015	tr|H3BSM7|H3BSM7_HUMAN RUS family member 1 OS=Homo sapiens OX=9606 GN=RUSF1 PE=1 SV=1	71	SGLQAVFLPQGF
QGLQAVILPNGF	tr|Q6UZF1|Q6UZF1_SARS	6015	tr|H3BTA0|H3BTA0_HUMAN RUS family member 1 OS=Homo sapiens OX=9606 GN=RUSF1 PE=1 SV=1	71	SGLQAVFLPQGF
QGLQAVILPNGF	tr|Q6UZF1|Q6UZF1_SARS	6015	tr|H3BS97|H3BS97_HUMAN RUS family member 1 OS=Homo sapiens OX=9606 GN=RUSF1 PE=1 SV=1	71	SGLQAVFLPQGF
APQDLPNLKEEV	tr|Q6UZF1|Q6UZF1_SARS	1332	sp|Q96K80|ZC3HA_HUMAN Zinc finger CCCH domain-containing protein 10 OS=Homo sapiens OX=9606 GN=ZC3H10 PE=1 SV=1	126	SPADLPNGKEEV
DDLITDLRERLK	tr|Q6UZF1|Q6UZF1_SARS	36	sp|Q9Y6X5|ENPP4_HUMAN Bis(5'-adenosyl)-triphosphatase ENPP4 OS=Homo sapiens OX=9606 GN=ENPP4 PE=1 SV=3	211	DDLIGDLVQRLK
PEEDDDDDIDCD	tr|Q6UZF1|Q6UZF1_SARS	928	tr|M0QZ43|M0QZ43_HUMAN Sarcoplasmic reticulum histidine-rich calcium-binding protein OS=Homo sapiens OX=9606 GN=HRC PE=1 SV=1	243	HEEDDDDDDDDD
PEEDDDDDIDCD	tr|Q6UZF1|Q6UZF1_SARS	928	sp|P23327|SRCH_HUMAN Sarcoplasmic reticulum histidine-rich calcium-binding protein OS=Homo sapiens OX=9606 GN=HRC PE=1 SV=1	243	HEEDDDDDDDDD
SHGAGGKNFGLE	tr|Q6UZF1|Q6UZF1_SARS	128	tr|A0A6Q8PH68|A0A6Q8PH68_HUMAN Transcription factor 20 (Fragment) OS=Homo sapiens OX=9606 GN=TCF20 PE=1 SV=1	430	SHAAGFKGFGLE
SHGAGGKNFGLE	tr|Q6UZF1|Q6UZF1_SARS	128	sp|Q9UGU0|TCF20_HUMAN Transcription factor 20 OS=Homo sapiens OX=9606 GN=TCF20 PE=1 SV=3	430	SHAAGFKGFGLE
GFLKATESLLLR	tr|Q6UZF1|Q6UZF1_SARS	1008	tr|C9IYE1|C9IYE1_HUMAN Calcium-dependent secretion activator 2 OS=Homo sapiens OX=9606 GN=CADPS2 PE=1 SV=1	774	GALKATLSLLER
GFLKATESLLLR	tr|Q6UZF1|Q6UZF1_SARS	1008	tr|H7BYR4|H7BYR4_HUMAN Calcium-dependent secretion activator 2 (Fragment) OS=Homo sapiens OX=9606 GN=CADPS2 PE=1 SV=1	419	GALKATLSLLER
GFLKATESLLLR	tr|Q6UZF1|Q6UZF1_SARS	1008	sp|Q86UW7|CAPS2_HUMAN Calcium-dependent secretion activator 2 OS=Homo sapiens OX=9606 GN=CADPS2 PE=1 SV=2	773	GALKATLSLLER
GFLKATESLLLR	tr|Q6UZF1|Q6UZF1_SARS	1008	tr|A0A087X1P3|A0A087X1P3_HUMAN Calcium-dependent secretion activator 2 OS=Homo sapiens OX=9606 GN=CADPS2 PE=1 SV=1	774	GALKATLSLLER
GFLKATESLLLR	tr|Q6UZF1|Q6UZF1_SARS	1008	tr|F8W8P5|F8W8P5_HUMAN Calcium-dependent secretion activator 2 OS=Homo sapiens OX=9606 GN=CADPS2 PE=1 SV=2	667	GALKATLSLLER
GFLKATESLLLR	tr|Q6UZF1|Q6UZF1_SARS	1008	tr|H7C4P2|H7C4P2_HUMAN Calcium-dependent secretion activator 1 (Fragment) OS=Homo sapiens OX=9606 GN=CADPS PE=1 SV=1	206	GALKATLSLLER
GFLKATESLLLR	tr|Q6UZF1|Q6UZF1_SARS	1008	tr|H7C4T6|H7C4T6_HUMAN Calcium-dependent secretion activator 1 (Fragment) OS=Homo sapiens OX=9606 GN=CADPS PE=1 SV=1	115	GALKATLSLLER
