query	query_seqname	query_start	target_seqname	target_start	target
YHYETQCLCTEL	sp|O36635|L_HRSVB	708	sp|Q9BU23|LMF2_HUMAN Lipase maturation factor 2 OS=Homo sapiens OX=9606 GN=LMF2 PE=1 SV=2	202	YHYETQCLPTPA
FMLPRRNDRETL	sp|O36635|L_HRSVB	2036	tr|K7EKY8|K7EKY8_HUMAN Zinc finger protein 627 OS=Homo sapiens OX=9606 GN=ZNF627 PE=1 SV=1	56	FKIPRRNIRETL
TEPNTTTTSTTT	sp|O36633|GLYC_HRSVB	284	sp|Q9HCJ0|TNR6C_HUMAN Trinucleotide repeat-containing gene 6C protein OS=Homo sapiens OX=9606 GN=TNRC6C PE=1 SV=3	756	TTTNTTTTTTTT
TEPNTTTTSTTT	sp|O36633|GLYC_HRSVB	284	tr|A0A1B0GU24|A0A1B0GU24_HUMAN Trinucleotide repeat-containing gene 6C protein OS=Homo sapiens OX=9606 GN=TNRC6C PE=1 SV=1	966	TTTNTTTTTTTT
ESFETSDEDSSY	sp|O42062|PHOSP_HRSVB	107	tr|E9PM87|E9PM87_HUMAN Tyrosine-protein phosphatase non-receptor type 22 OS=Homo sapiens OX=9606 GN=PTPN22 PE=1 SV=1	73	LSLITSDEDSSY
ESFETSDEDSSY	sp|O42062|PHOSP_HRSVB	107	tr|A0A0A0MTD9|A0A0A0MTD9_HUMAN Tyrosine-protein phosphatase non-receptor type 22 OS=Homo sapiens OX=9606 GN=PTPN22 PE=1 SV=1	73	LSLITSDEDSSY
ESFETSDEDSSY	sp|O42062|PHOSP_HRSVB	107	tr|F5H2S8|F5H2S8_HUMAN Tyrosine-protein phosphatase non-receptor type 22 OS=Homo sapiens OX=9606 GN=PTPN22 PE=1 SV=2	73	LSLITSDEDSSY
ESFETSDEDSSY	sp|O42062|PHOSP_HRSVB	107	sp|Q9Y2R2|PTN22_HUMAN Tyrosine-protein phosphatase non-receptor type 22 OS=Homo sapiens OX=9606 GN=PTPN22 PE=1 SV=2	73	LSLITSDEDSSY
ESFETSDEDSSY	sp|O42062|PHOSP_HRSVB	107	tr|A0A0B4J1S7|A0A0B4J1S7_HUMAN Tyrosine-protein phosphatase non-receptor type 22 OS=Homo sapiens OX=9606 GN=PTPN22 PE=1 SV=1	73	LSLITSDEDSSY
ESFETSDEDSSY	sp|O42062|PHOSP_HRSVB	107	tr|E9PMT0|E9PMT0_HUMAN Tyrosine-protein phosphatase non-receptor type 22 OS=Homo sapiens OX=9606 GN=PTPN22 PE=1 SV=1	73	LSLITSDEDSSY
ESFETSDEDSSY	sp|O42062|PHOSP_HRSVB	107	tr|A0A0A0MTE6|A0A0A0MTE6_HUMAN Tyrosine-protein phosphatase non-receptor type 22 OS=Homo sapiens OX=9606 GN=PTPN22 PE=1 SV=1	73	LSLITSDEDSSY
PNTTTTSTTTSN	sp|O36633|GLYC_HRSVB	286	sp|Q9HCJ0|TNR6C_HUMAN Trinucleotide repeat-containing gene 6C protein OS=Homo sapiens OX=9606 GN=TNRC6C PE=1 SV=3	759	NTTTTTTTTTSN
PNTTTTSTTTSN	sp|O36633|GLYC_HRSVB	286	tr|A0A1B0GU24|A0A1B0GU24_HUMAN Trinucleotide repeat-containing gene 6C protein OS=Homo sapiens OX=9606 GN=TNRC6C PE=1 SV=1	969	NTTTTTTTTTSN
TTTTSTTTSNKV	sp|O36633|GLYC_HRSVB	288	sp|Q9HCJ0|TNR6C_HUMAN Trinucleotide repeat-containing gene 6C protein OS=Homo sapiens OX=9606 GN=TNRC6C PE=1 SV=3	761	TTTTTTTTSNTT
TTTTSTTTSNKV	sp|O36633|GLYC_HRSVB	288	tr|A0A1B0GU24|A0A1B0GU24_HUMAN Trinucleotide repeat-containing gene 6C protein OS=Homo sapiens OX=9606 GN=TNRC6C PE=1 SV=1	971	TTTTTTTTSNTT
TTTTSTTTSNKV	sp|O36633|GLYC_HRSVB	288	sp|Q12955|ANK3_HUMAN Ankyrin-3 OS=Homo sapiens OX=9606 GN=ANK3 PE=1 SV=3	3971	TTTTTTTTSCTV
KLLITFIELIKL	sp|O36635|L_HRSVB	1637	sp|A5YKK6|CNOT1_HUMAN CCR4-NOT transcription complex subunit 1 OS=Homo sapiens OX=9606 GN=CNOT1 PE=1 SV=2	2321	GLLITFIELIKN
IVVLPKVTDLKL	sp|O36635|L_HRSVB	1410	tr|A0A0G2JL76|A0A0G2JL76_HUMAN Choline transporter-like protein 4 OS=Homo sapiens OX=9606 GN=SLC44A4 PE=1 SV=1	512	VVVLDKVTDLLL
IVVLPKVTDLKL	sp|O36635|L_HRSVB	1410	sp|Q53GD3|CTL4_HUMAN Choline transporter-like protein 4 OS=Homo sapiens OX=9606 GN=SLC44A4 PE=1 SV=2	588	VVVLDKVTDLLL
ILSGSHSISQVL	sp|O36635|L_HRSVB	1140	sp|P28331|NDUS1_HUMAN NADH-ubiquinone oxidoreductase 75 kDa subunit, mitochondrial OS=Homo sapiens OX=9606 GN=NDUFS1 PE=1 SV=3	455	IASGSHPFSQVL
ILSGSHSISQVL	sp|O36635|L_HRSVB	1140	tr|B4DJ81|B4DJ81_HUMAN NADH-ubiquinone oxidoreductase 75 kDa subunit, mitochondrial OS=Homo sapiens OX=9606 GN=NDUFS1 PE=1 SV=1	339	IASGSHPFSQVL
NVKGKFLNNKEP	sp|O42062|PHOSP_HRSVB	23	sp|Q5JUK9|PAGE3_HUMAN P antigen family member 3 OS=Homo sapiens OX=9606 GN=PAGE3 PE=1 SV=1	89	NVKGEFLPNLEP
TQALAGQVAGLG	sp|O42053|NCAP_HRSVB	321	tr|G3V4Q5|G3V4Q5_HUMAN Leukotriene B4 receptor 1 (Fragment) OS=Homo sapiens OX=9606 GN=LTB4R PE=1 SV=1	146	GRALAGQAAGLG
TQALAGQVAGLG	sp|O42053|NCAP_HRSVB	321	sp|Q15722|LT4R1_HUMAN Leukotriene B4 receptor 1 OS=Homo sapiens OX=9606 GN=LTB4R PE=1 SV=2	246	GRALAGQAAGLG
LDAVKNSISPRD	sp|O42053|NCAP_HRSVB	375	tr|H3BT27|H3BT27_HUMAN S phase cyclin A-associated protein in the endoplasmic reticulum (Fragment) OS=Homo sapiens OX=9606 GN=SCAPER PE=1 SV=1	90	LDDVKNSGSIRD
LDAVKNSISPRD	sp|O42053|NCAP_HRSVB	375	sp|Q9BY12|SCAPE_HUMAN S phase cyclin A-associated protein in the endoplasmic reticulum OS=Homo sapiens OX=9606 GN=SCAPER PE=1 SV=2	351	LDDVKNSGSIRD
LDAVKNSISPRD	sp|O42053|NCAP_HRSVB	375	tr|H3BPM0|H3BPM0_HUMAN S phase cyclin A-associated protein in the endoplasmic reticulum (Fragment) OS=Homo sapiens OX=9606 GN=SCAPER PE=1 SV=1	351	LDDVKNSGSIRD
LDAVKNSISPRD	sp|O42053|NCAP_HRSVB	375	tr|H3BS25|H3BS25_HUMAN S phase cyclin A-associated protein in the endoplasmic reticulum (Fragment) OS=Homo sapiens OX=9606 GN=SCAPER PE=1 SV=1	351	LDDVKNSGSIRD
HLSLKRMTLTNS	sp|O36635|L_HRSVB	58	sp|Q9BYI3|HYCCI_HUMAN Hyccin OS=Homo sapiens OX=9606 GN=FAM126A PE=1 SV=2	420	LLSLKRLTLTTS
KCITGHKCKYSH	sp|O42050|M21_HRSVB	14	sp|Q5HYM0|ZC12B_HUMAN Probable ribonuclease ZC3H12B OS=Homo sapiens OX=9606 GN=ZC3H12B PE=1 SV=3	366	KCTYGHKCKYYH
KCITGHKCKYSH	sp|O42050|M21_HRSVB	14	sp|Q9C0D7|ZC12C_HUMAN Probable ribonuclease ZC3H12C OS=Homo sapiens OX=9606 GN=ZC3H12C PE=1 SV=2	421	KCTYGHKCKYYH
KCITGHKCKYSH	sp|O42050|M21_HRSVB	14	tr|E9PP00|E9PP00_HUMAN Probable ribonuclease ZC3H12C OS=Homo sapiens OX=9606 GN=ZC3H12C PE=1 SV=1	390	KCTYGHKCKYYH
TYETLQKAIVAS	sp|O36633|GLYC_HRSVB	16	tr|H7BXG9|H7BXG9_HUMAN Protein EFR3 homolog B (Fragment) OS=Homo sapiens OX=9606 GN=EFR3B PE=1 SV=1	557	TYETLKKAIVDS
TYETLQKAIVAS	sp|O36633|GLYC_HRSVB	16	sp|Q9Y2G0|EFR3B_HUMAN Protein EFR3 homolog B OS=Homo sapiens OX=9606 GN=EFR3B PE=1 SV=2	722	TYETLKKAIVDS
TYETLQKAIVAS	sp|O36633|GLYC_HRSVB	16	tr|E7ESK9|E7ESK9_HUMAN Protein EFR3 homolog B OS=Homo sapiens OX=9606 GN=EFR3B PE=1 SV=1	687	TYETLKKAIVDS
ALAGQVAGLGLA	sp|O42053|NCAP_HRSVB	323	tr|G3V4Q5|G3V4Q5_HUMAN Leukotriene B4 receptor 1 (Fragment) OS=Homo sapiens OX=9606 GN=LTB4R PE=1 SV=1	148	ALAGQAAGLGLV
ALAGQVAGLGLA	sp|O42053|NCAP_HRSVB	323	sp|Q15722|LT4R1_HUMAN Leukotriene B4 receptor 1 OS=Homo sapiens OX=9606 GN=LTB4R PE=1 SV=2	248	ALAGQAAGLGLV
EMAKVYLEQLKE	sp|O42053|NCAP_HRSVB	348	tr|E7ESJ7|E7ESJ7_HUMAN Protein FAM114A2 OS=Homo sapiens OX=9606 GN=FAM114A2 PE=1 SV=1	207	ETLKVELEQLKE
EMAKVYLEQLKE	sp|O42053|NCAP_HRSVB	348	sp|Q9NRY5|F1142_HUMAN Protein FAM114A2 OS=Homo sapiens OX=9606 GN=FAM114A2 PE=1 SV=4	277	ETLKVELEQLKE
LSRQLKALSSEL	sp|O36635|L_HRSVB	1687	sp|O43889|CREB3_HUMAN Cyclic AMP-responsive element-binding protein 3 OS=Homo sapiens OX=9606 GN=CREB3 PE=1 SV=2	262	LSRQLRALPSED
STTVSSTPNTKT	sp|O36633|GLYC_HRSVB	113	tr|Q5VWV2|Q5VWV2_HUMAN Partitioning defective 3 homolog OS=Homo sapiens OX=9606 GN=PARD3 PE=1 SV=1	400	STTVSSGYNTKK
STTVSSTPNTKT	sp|O36633|GLYC_HRSVB	113	tr|F5GZI3|F5GZI3_HUMAN Partitioning defective 3 homolog OS=Homo sapiens OX=9606 GN=PARD3 PE=1 SV=1	174	STTVSSGYNTKK
STTVSSTPNTKT	sp|O36633|GLYC_HRSVB	113	sp|Q8TEW0|PARD3_HUMAN Partitioning defective 3 homolog OS=Homo sapiens OX=9606 GN=PARD3 PE=1 SV=2	444	STTVSSGYNTKK
STTVSSTPNTKT	sp|O36633|GLYC_HRSVB	113	tr|Q5VWU8|Q5VWU8_HUMAN Partitioning defective 3 homolog OS=Homo sapiens OX=9606 GN=PARD3 PE=1 SV=1	444	STTVSSGYNTKK
STEVITILSDIP	sp|O36634|FUS_HRSVB	254	sp|Q8WXI7|MUC16_HUMAN Mucin-16 OS=Homo sapiens OX=9606 GN=MUC16 PE=1 SV=3	9058	STEVITRLSTSP
LSGILDLDRSDE	sp|O42050|M21_HRSVB	60	sp|Q96B97|SH3K1_HUMAN SH3 domain-containing kinase-binding protein 1 OS=Homo sapiens OX=9606 GN=SH3KBP1 PE=1 SV=2	446	LSGILDKDLSDR
LSGILDLDRSDE	sp|O42050|M21_HRSVB	60	tr|Q5JPT2|Q5JPT2_HUMAN SH3 domain-containing kinase-binding protein 1 (Fragment) OS=Homo sapiens OX=9606 GN=SH3KBP1 PE=1 SV=1	426	LSGILDKDLSDR
KSTTVSSTPNTK	sp|O36633|GLYC_HRSVB	112	tr|Q5VWV2|Q5VWV2_HUMAN Partitioning defective 3 homolog OS=Homo sapiens OX=9606 GN=PARD3 PE=1 SV=1	399	FSTTVSSGYNTK
KSTTVSSTPNTK	sp|O36633|GLYC_HRSVB	112	tr|F5GZI3|F5GZI3_HUMAN Partitioning defective 3 homolog OS=Homo sapiens OX=9606 GN=PARD3 PE=1 SV=1	173	FSTTVSSGYNTK
KSTTVSSTPNTK	sp|O36633|GLYC_HRSVB	112	sp|Q8TEW0|PARD3_HUMAN Partitioning defective 3 homolog OS=Homo sapiens OX=9606 GN=PARD3 PE=1 SV=2	443	FSTTVSSGYNTK
KSTTVSSTPNTK	sp|O36633|GLYC_HRSVB	112	tr|Q5VWU8|Q5VWU8_HUMAN Partitioning defective 3 homolog OS=Homo sapiens OX=9606 GN=PARD3 PE=1 SV=1	443	FSTTVSSGYNTK
SRVSELIHHQLN	sp|O36635|L_HRSVB	1163	tr|K7EKF5|K7EKF5_HUMAN HEAT repeat-containing protein 6 (Fragment) OS=Homo sapiens OX=9606 GN=HEATR6 PE=1 SV=1	5	SKVSQLIHHLLN
SRVSELIHHQLN	sp|O36635|L_HRSVB	1163	tr|K7EKW7|K7EKW7_HUMAN HEAT repeat-containing protein 6 OS=Homo sapiens OX=9606 GN=HEATR6 PE=1 SV=1	95	SKVSQLIHHLLN
SRVSELIHHQLN	sp|O36635|L_HRSVB	1163	tr|K7ESP5|K7ESP5_HUMAN HEAT repeat-containing protein 6 (Fragment) OS=Homo sapiens OX=9606 GN=HEATR6 PE=1 SV=1	95	SKVSQLIHHLLN
SRVSELIHHQLN	sp|O36635|L_HRSVB	1163	tr|K7ELR8|K7ELR8_HUMAN HEAT repeat-containing protein 6 OS=Homo sapiens OX=9606 GN=HEATR6 PE=1 SV=1	95	SKVSQLIHHLLN
SRVSELIHHQLN	sp|O36635|L_HRSVB	1163	tr|K7EIX2|K7EIX2_HUMAN HEAT repeat-containing protein 6 OS=Homo sapiens OX=9606 GN=HEATR6 PE=1 SV=1	95	SKVSQLIHHLLN
SRVSELIHHQLN	sp|O36635|L_HRSVB	1163	sp|Q6AI08|HEAT6_HUMAN HEAT repeat-containing protein 6 OS=Homo sapiens OX=9606 GN=HEATR6 PE=1 SV=1	95	SKVSQLIHHLLN
SRVSELIHHQLN	sp|O36635|L_HRSVB	1163	tr|K7EK31|K7EK31_HUMAN HEAT repeat-containing protein 6 (Fragment) OS=Homo sapiens OX=9606 GN=HEATR6 PE=1 SV=1	95	SKVSQLIHHLLN
LSSHLAKNGNQL	sp|O36635|L_HRSVB	1461	tr|I3L139|I3L139_HUMAN Protein-ribulosamine 3-kinase OS=Homo sapiens OX=9606 GN=FN3KRP PE=1 SV=1	96	LSSHAAKLGAQL
LSSHLAKNGNQL	sp|O36635|L_HRSVB	1461	tr|I3L2G3|I3L2G3_HUMAN Protein-ribulosamine 3-kinase (Fragment) OS=Homo sapiens OX=9606 GN=FN3KRP PE=1 SV=1	46	LSSHAAKLGAQL
LSSHLAKNGNQL	sp|O36635|L_HRSVB	1461	sp|Q9HA64|KT3K_HUMAN Ketosamine-3-kinase OS=Homo sapiens OX=9606 GN=FN3KRP PE=1 SV=2	96	LSSHAAKLGAQL
DRTYETLQKAIV	sp|O36633|GLYC_HRSVB	14	tr|H7BXG9|H7BXG9_HUMAN Protein EFR3 homolog B (Fragment) OS=Homo sapiens OX=9606 GN=EFR3B PE=1 SV=1	555	EITYETLKKAIV
DRTYETLQKAIV	sp|O36633|GLYC_HRSVB	14	sp|Q9Y2G0|EFR3B_HUMAN Protein EFR3 homolog B OS=Homo sapiens OX=9606 GN=EFR3B PE=1 SV=2	720	EITYETLKKAIV
DRTYETLQKAIV	sp|O36633|GLYC_HRSVB	14	tr|E7ESK9|E7ESK9_HUMAN Protein EFR3 homolog B OS=Homo sapiens OX=9606 GN=EFR3B PE=1 SV=1	685	EITYETLKKAIV
SSSRSNSVIKTQ	sp|O36635|L_HRSVB	1795	sp|Q5VZB9|DMRTA_HUMAN Doublesex- and mab-3-related transcription factor A1 OS=Homo sapiens OX=9606 GN=DMRTA1 PE=1 SV=1	250	SSSRSNGVIGKQ
TTPLKSTTVSST	sp|O36633|GLYC_HRSVB	108	tr|E7EPM4|E7EPM4_HUMAN Mucin-17 OS=Homo sapiens OX=9606 GN=MUC17 PE=1 SV=1	982	TTPLTSTPVSHT
TTPLKSTTVSST	sp|O36633|GLYC_HRSVB	108	sp|Q685J3|MUC17_HUMAN Mucin-17 OS=Homo sapiens OX=9606 GN=MUC17 PE=1 SV=2	982	TTPLTSTPVSHT
VVVLVVIVLSII	sp|O36634|FUS_HRSVB	531	tr|F6RH32|F6RH32_HUMAN Voltage-dependent N-type calcium channel subunit alpha OS=Homo sapiens OX=9606 GN=CACNA1B PE=1 SV=1	1155	VVILVVIALSSI
VVVLVVIVLSII	sp|O36634|FUS_HRSVB	531	sp|Q00975|CAC1B_HUMAN Voltage-dependent N-type calcium channel subunit alpha-1B OS=Homo sapiens OX=9606 GN=CACNA1B PE=1 SV=1	1154	VVILVVIALSSI
VVVLVVIVLSII	sp|O36634|FUS_HRSVB	531	tr|B1AQK6|B1AQK6_HUMAN Voltage-dependent N-type calcium channel subunit alpha OS=Homo sapiens OX=9606 GN=CACNA1B PE=1 SV=1	1154	VVILVVIALSSI
VVVLVVIVLSII	sp|O36634|FUS_HRSVB	531	tr|B1AQK7|B1AQK7_HUMAN Voltage-dependent N-type calcium channel subunit alpha OS=Homo sapiens OX=9606 GN=CACNA1B PE=1 SV=1	1155	VVILVVIALSSI
VVVLVVIVLSII	sp|O36634|FUS_HRSVB	531	tr|E9PDR3|E9PDR3_HUMAN Voltage-dependent N-type calcium channel subunit alpha OS=Homo sapiens OX=9606 GN=CACNA1B PE=1 SV=3	1154	VVILVVIALSSI
WLIGLAGLIDNY	sp|O42050|M21_HRSVB	72	tr|A0A669KB03|A0A669KB03_HUMAN DNA mismatch repair protein Mlh1 OS=Homo sapiens OX=9606 GN=MLH1 PE=1 SV=1	391	NLIGLPLLIDNY
WLIGLAGLIDNY	sp|O42050|M21_HRSVB	72	sp|P40692|MLH1_HUMAN DNA mismatch repair protein Mlh1 OS=Homo sapiens OX=9606 GN=MLH1 PE=1 SV=1	635	NLIGLPLLIDNY
WLIGLAGLIDNY	sp|O42050|M21_HRSVB	72	tr|A0A669KAW3|A0A669KAW3_HUMAN DNA mismatch repair protein Mlh1 (Fragment) OS=Homo sapiens OX=9606 GN=MLH1 PE=1 SV=1	565	NLIGLPLLIDNY
INRSINKSGAYY	sp|O36635|L_HRSVB	869	sp|Q9BWV7|TTLL2_HUMAN Probable tubulin polyglutamylase TTLL2 OS=Homo sapiens OX=9606 GN=TTLL2 PE=2 SV=3	298	TNSSINKSGASY
INRSINKSGAYY	sp|O36635|L_HRSVB	869	tr|A0A3B3IRU1|A0A3B3IRU1_HUMAN Probable tubulin polyglutamylase TTLL2 OS=Homo sapiens OX=9606 GN=TTLL2 PE=1 SV=1	225	TNSSINKSGASY
AGQVAGLGLAGE	sp|O42053|NCAP_HRSVB	325	tr|G3V4Q5|G3V4Q5_HUMAN Leukotriene B4 receptor 1 (Fragment) OS=Homo sapiens OX=9606 GN=LTB4R PE=1 SV=1	150	AGQAAGLGLVGK
AGQVAGLGLAGE	sp|O42053|NCAP_HRSVB	325	sp|Q15722|LT4R1_HUMAN Leukotriene B4 receptor 1 OS=Homo sapiens OX=9606 GN=LTB4R PE=1 SV=2	250	AGQAAGLGLVGK
RLKLLITFIELI	sp|O36635|L_HRSVB	1635	sp|A5YKK6|CNOT1_HUMAN CCR4-NOT transcription complex subunit 1 OS=Homo sapiens OX=9606 GN=CNOT1 PE=1 SV=2	2319	PWGLLITFIELI
PIITGSSVNAYL	sp|O36635|L_HRSVB	3	sp|Q13349|ITAD_HUMAN Integrin alpha-D OS=Homo sapiens OX=9606 GN=ITGAD PE=1 SV=2	1102	PIIMGSSVGALL
DEDSSYSFEEAS	sp|O42062|PHOSP_HRSVB	113	sp|Q9NZZ3|CHMP5_HUMAN Charged multivesicular body protein 5 OS=Homo sapiens OX=9606 GN=CHMP5 PE=1 SV=1	177	DEDSSYLDEAAS
LSLKRMTLTNSI	sp|O36635|L_HRSVB	59	sp|Q9BYI3|HYCCI_HUMAN Hyccin OS=Homo sapiens OX=9606 GN=FAM126A PE=1 SV=2	421	LSLKRLTLTTSQ
IEHLSLKRMTLT	sp|O36635|L_HRSVB	56	sp|Q9BYI3|HYCCI_HUMAN Hyccin OS=Homo sapiens OX=9606 GN=FAM126A PE=1 SV=2	418	LELLSLKRLTLT
LLKMRINTIYDS	sp|O42083|NS1_HRSVB	8	sp|O95393|BMP10_HUMAN Bone morphogenetic protein 10 OS=Homo sapiens OX=9606 GN=BMP10 PE=1 SV=1	299	LLQMRSNIIYDS
LSNKNNHFSESF	sp|O36635|L_HRSVB	677	tr|A0A0C4DFR0|A0A0C4DFR0_HUMAN Dynein heavy chain 11, axonemal OS=Homo sapiens OX=9606 GN=DNAH11 PE=1 SV=1	171	LSNKNNHKSWSC
LSNKNNHFSESF	sp|O36635|L_HRSVB	677	tr|A0A087WYC6|A0A087WYC6_HUMAN Dynein heavy chain 11, axonemal OS=Homo sapiens OX=9606 GN=DNAH11 PE=1 SV=1	171	LSNKNNHKSWSC
LSNKNNHFSESF	sp|O36635|L_HRSVB	677	sp|Q96DT5|DYH11_HUMAN Dynein heavy chain 11, axonemal OS=Homo sapiens OX=9606 GN=DNAH11 PE=1 SV=4	171	LSNKNNHKSWSC
KVLNDKFGEEEL	sp|O36635|L_HRSVB	1370	sp|P55289|CAD12_HUMAN Cadherin-12 OS=Homo sapiens OX=9606 GN=CDH12 PE=2 SV=2	776	KVLADMFGEEES
NRSINKSGAYYP	sp|O36635|L_HRSVB	870	sp|Q9BWV7|TTLL2_HUMAN Probable tubulin polyglutamylase TTLL2 OS=Homo sapiens OX=9606 GN=TTLL2 PE=2 SV=3	299	NSSINKSGASYE
NRSINKSGAYYP	sp|O36635|L_HRSVB	870	tr|A0A3B3IRU1|A0A3B3IRU1_HUMAN Probable tubulin polyglutamylase TTLL2 OS=Homo sapiens OX=9606 GN=TTLL2 PE=1 SV=1	226	NSSINKSGASYE
NTTTTSTTTSNK	sp|O36633|GLYC_HRSVB	287	sp|Q9HCJ0|TNR6C_HUMAN Trinucleotide repeat-containing gene 6C protein OS=Homo sapiens OX=9606 GN=TNRC6C PE=1 SV=3	760	TTTTTTTTTSNT
NTTTTSTTTSNK	sp|O36633|GLYC_HRSVB	287	tr|A0A1B0GU24|A0A1B0GU24_HUMAN Trinucleotide repeat-containing gene 6C protein OS=Homo sapiens OX=9606 GN=TNRC6C PE=1 SV=1	970	TTTTTTTTTSNT
IIAVILLFLITI	sp|O36633|GLYC_HRSVB	54	sp|Q7Z5P4|DHB13_HUMAN 17-beta-hydroxysteroid dehydrogenase 13 OS=Homo sapiens OX=9606 GN=HSD17B13 PE=1 SV=1	3	IILEILLLLITI
ITSPRGPTLKAS	sp|O42049|MATRX_HRSVB	62	sp|O14981|BTAF1_HUMAN TATA-binding protein-associated factor 172 OS=Homo sapiens OX=9606 GN=BTAF1 PE=1 SV=2	983	ITSRRGPTPKAV
ITSPRGPTLKAS	sp|O42049|MATRX_HRSVB	62	tr|A0A0A0MTH9|A0A0A0MTH9_HUMAN TATA-binding protein-associated factor 172 OS=Homo sapiens OX=9606 GN=BTAF1 PE=1 SV=1	983	ITSRRGPTPKAV
ISLLRQYLCLGS	sp|O36635|L_HRSVB	1987	tr|H0YNQ5|H0YNQ5_HUMAN Transcription factor 12 (Fragment) OS=Homo sapiens OX=9606 GN=TCF12 PE=1 SV=1	131	SSLLRQDLGLGS
ISLLRQYLCLGS	sp|O36635|L_HRSVB	1987	tr|B4DGI9|B4DGI9_HUMAN Transcription factor 12 (Fragment) OS=Homo sapiens OX=9606 GN=TCF12 PE=1 SV=1	127	SSLLRQDLGLGS
ISLLRQYLCLGS	sp|O36635|L_HRSVB	1987	sp|Q99081|HTF4_HUMAN Transcription factor 12 OS=Homo sapiens OX=9606 GN=TCF12 PE=1 SV=1	131	SSLLRQDLGLGS
QVSNVSLPSDLS	sp|O36634|FUS_HRSVB	369	sp|P51816|AFF2_HUMAN AF4/FMR2 family member 2 OS=Homo sapiens OX=9606 GN=AFF2 PE=1 SV=4	344	QTSEVSLPSDPS
SSTQKGGSRLEG	sp|O42053|NCAP_HRSVB	230	tr|E9PIF2|E9PIF2_HUMAN RNA helicase OS=Homo sapiens OX=9606 GN=DDX10 PE=1 SV=1	557	SILQKGGKRLEG
SSTQKGGSRLEG	sp|O42053|NCAP_HRSVB	230	sp|Q13206|DDX10_HUMAN Probable ATP-dependent RNA helicase DDX10 OS=Homo sapiens OX=9606 GN=DDX10 PE=1 SV=2	557	SILQKGGKRLEG
SSTQKGGSRLEG	sp|O42053|NCAP_HRSVB	230	tr|A0A3B3ISR7|A0A3B3ISR7_HUMAN RNA helicase OS=Homo sapiens OX=9606 GN=DDX10 PE=1 SV=1	557	SILQKGGKRLEG
LAGQVAGLGLAG	sp|O42053|NCAP_HRSVB	324	tr|G3V4Q5|G3V4Q5_HUMAN Leukotriene B4 receptor 1 (Fragment) OS=Homo sapiens OX=9606 GN=LTB4R PE=1 SV=1	149	LAGQAAGLGLVG
LAGQVAGLGLAG	sp|O42053|NCAP_HRSVB	324	sp|Q15722|LT4R1_HUMAN Leukotriene B4 receptor 1 OS=Homo sapiens OX=9606 GN=LTB4R PE=1 SV=2	249	LAGQAAGLGLVG
LKSVILLNMGPS	sp|O42062|PHOSP_HRSVB	149	tr|H0Y4W6|H0Y4W6_HUMAN Estrogen receptor OS=Homo sapiens OX=9606 GN=ESR1 PE=1 SV=2	275	LKSIILLNSGIS
NMYHYETQCLCT	sp|O36635|L_HRSVB	706	sp|Q9BU23|LMF2_HUMAN Lipase maturation factor 2 OS=Homo sapiens OX=9606 GN=LMF2 PE=1 SV=2	200	LTYHYETQCLPT
KISLEYMIKDLK	sp|O36635|L_HRSVB	1831	sp|Q0VF96|CGNL1_HUMAN Cingulin-like protein 1 OS=Homo sapiens OX=9606 GN=CGNL1 PE=1 SV=2	1119	KISLERQNKDLK
KISLEYMIKDLK	sp|O36635|L_HRSVB	1831	sp|Q9P2M7|CING_HUMAN Cingulin OS=Homo sapiens OX=9606 GN=CGN PE=1 SV=2	1014	KISLERQNKDLK
EHLSLKRMTLTN	sp|O36635|L_HRSVB	57	sp|Q9BYI3|HYCCI_HUMAN Hyccin OS=Homo sapiens OX=9606 GN=FAM126A PE=1 SV=2	419	ELLSLKRLTLTT
NLFFLNKIEGKS	sp|O36634|FUS_HRSVB	455	sp|P04114|APOB_HUMAN Apolipoprotein B-100 OS=Homo sapiens OX=9606 GN=APOB PE=1 SV=2	2843	MLFFGNAIEGKS
LEADLSKETPVS	sp|O42062|PHOSP_HRSVB	46	sp|P23470|PTPRG_HUMAN Receptor-type tyrosine-protein phosphatase gamma OS=Homo sapiens OX=9606 GN=PTPRG PE=1 SV=4	1117	LEAILGKETEVS
SYITWKELQLSK	sp|O36635|L_HRSVB	268	sp|Q9NTN3|S35D1_HUMAN UDP-glucuronic acid/UDP-N-acetylgalactosamine transporter OS=Homo sapiens OX=9606 GN=SLC35D1 PE=2 SV=1	328	SYITFTEEQLSK
PTAKPSTRPTTK	sp|O36633|GLYC_HRSVB	198	tr|H0YAK9|H0YAK9_HUMAN Nephronectin (Fragment) OS=Homo sapiens OX=9606 GN=NPNT PE=1 SV=1	287	PTSKPTTRPTPK
PTAKPSTRPTTK	sp|O36633|GLYC_HRSVB	198	tr|D6RH31|D6RH31_HUMAN Nephronectin (Fragment) OS=Homo sapiens OX=9606 GN=NPNT PE=1 SV=1	357	PTSKPTTRPTPK
PTAKPSTRPTTK	sp|O36633|GLYC_HRSVB	198	sp|Q6UXI9|NPNT_HUMAN Nephronectin OS=Homo sapiens OX=9606 GN=NPNT PE=2 SV=3	310	PTSKPTTRPTPK
NCILFIGDGLGQ	sp|O36635|L_HRSVB	1847	sp|P09923|PPBI_HUMAN Intestinal-type alkaline phosphatase OS=Homo sapiens OX=9606 GN=ALPI PE=1 SV=2	54	NLILFLGDGLGV
LQLSKVSVCLAS	sp|O36635|L_HRSVB	275	tr|C9J590|C9J590_HUMAN Replication initiator 1 OS=Homo sapiens OX=9606 GN=REPIN1 PE=4 SV=2	51	LQGSSVSVCPAS
RTYETLQKAIVA	sp|O36633|GLYC_HRSVB	15	tr|H7BXG9|H7BXG9_HUMAN Protein EFR3 homolog B (Fragment) OS=Homo sapiens OX=9606 GN=EFR3B PE=1 SV=1	556	ITYETLKKAIVD
RTYETLQKAIVA	sp|O36633|GLYC_HRSVB	15	sp|Q9Y2G0|EFR3B_HUMAN Protein EFR3 homolog B OS=Homo sapiens OX=9606 GN=EFR3B PE=1 SV=2	721	ITYETLKKAIVD
RTYETLQKAIVA	sp|O36633|GLYC_HRSVB	15	tr|E7ESK9|E7ESK9_HUMAN Protein EFR3 homolog B OS=Homo sapiens OX=9606 GN=EFR3B PE=1 SV=1	686	ITYETLKKAIVD
SDEDSSYSFEEA	sp|O42062|PHOSP_HRSVB	112	sp|Q03111|ENL_HUMAN Protein ENL OS=Homo sapiens OX=9606 GN=MLLT1 PE=1 SV=2	414	SDEDDSSSGEEA
VNATFLRRINLN	sp|O36635|L_HRSVB	1332	sp|O60938|KERA_HUMAN Keratocan OS=Homo sapiens OX=9606 GN=KERA PE=1 SV=1	92	ENATQLRWINLN
VVLPKVTDLKLI	sp|O36635|L_HRSVB	1411	tr|A0A0G2JL76|A0A0G2JL76_HUMAN Choline transporter-like protein 4 OS=Homo sapiens OX=9606 GN=SLC44A4 PE=1 SV=1	513	VVLDKVTDLLLF
VVLPKVTDLKLI	sp|O36635|L_HRSVB	1411	sp|Q53GD3|CTL4_HUMAN Choline transporter-like protein 4 OS=Homo sapiens OX=9606 GN=SLC44A4 PE=1 SV=2	589	VVLDKVTDLLLF
IVSIPTTYIVSA	sp|O42049|MATRX_HRSVB	81	tr|H7C1I7|H7C1I7_HUMAN Zinc finger MYM-type protein 4 (Fragment) OS=Homo sapiens OX=9606 GN=ZMYM4 PE=1 SV=1	294	IVSIPTGSTVSA
IVSIPTTYIVSA	sp|O42049|MATRX_HRSVB	81	sp|Q5VZL5|ZMYM4_HUMAN Zinc finger MYM-type protein 4 OS=Homo sapiens OX=9606 GN=ZMYM4 PE=1 SV=1	634	IVSIPTGSTVSA
SLLRQYLCLGSK	sp|O36635|L_HRSVB	1988	tr|H0YNQ5|H0YNQ5_HUMAN Transcription factor 12 (Fragment) OS=Homo sapiens OX=9606 GN=TCF12 PE=1 SV=1	132	SLLRQDLGLGSP
SLLRQYLCLGSK	sp|O36635|L_HRSVB	1988	tr|B4DGI9|B4DGI9_HUMAN Transcription factor 12 (Fragment) OS=Homo sapiens OX=9606 GN=TCF12 PE=1 SV=1	128	SLLRQDLGLGSP
SLLRQYLCLGSK	sp|O36635|L_HRSVB	1988	sp|Q99081|HTF4_HUMAN Transcription factor 12 OS=Homo sapiens OX=9606 GN=TCF12 PE=1 SV=1	132	SLLRQDLGLGSP
TPLKSTTVSSTP	sp|O36633|GLYC_HRSVB	109	tr|E7EPM4|E7EPM4_HUMAN Mucin-17 OS=Homo sapiens OX=9606 GN=MUC17 PE=1 SV=1	1455	TPLKSIPVSNTP
TPLKSTTVSSTP	sp|O36633|GLYC_HRSVB	109	sp|Q685J3|MUC17_HUMAN Mucin-17 OS=Homo sapiens OX=9606 GN=MUC17 PE=1 SV=2	1455	TPLKSIPVSNTP
PITLPLYKNNSY	sp|O36635|L_HRSVB	1350	sp|Q06432|CCG1_HUMAN Voltage-dependent calcium channel gamma-1 subunit OS=Homo sapiens OX=9606 GN=CACNG1 PE=1 SV=1	71	PITLPGEKNCSY
LQKVYLDNRLLK	sp|O36635|L_HRSVB	1578	tr|F5H2B9|F5H2B9_HUMAN Uveal autoantigen with coiled-coil domains and ankyrin repeats OS=Homo sapiens OX=9606 GN=UACA PE=1 SV=1	610	IEKVYLDNKLLK
LQKVYLDNRLLK	sp|O36635|L_HRSVB	1578	tr|H0YNH8|H0YNH8_HUMAN Uveal autoantigen with coiled-coil domains and ankyrin repeats OS=Homo sapiens OX=9606 GN=UACA PE=1 SV=1	704	IEKVYLDNKLLK
LQKVYLDNRLLK	sp|O36635|L_HRSVB	1578	sp|Q9BZF9|UACA_HUMAN Uveal autoantigen with coiled-coil domains and ankyrin repeats OS=Homo sapiens OX=9606 GN=UACA PE=1 SV=2	719	IEKVYLDNKLLK
TPSKKPNLQQNE	sp|O36633|GLYC_HRSVB	230	tr|C9IZ04|C9IZ04_HUMAN Serine/threonine-protein phosphatase 4 regulatory subunit 2 (Fragment) OS=Homo sapiens OX=9606 GN=PPP4R2 PE=1 SV=1	172	TDSKEANLQQNE
TPSKKPNLQQNE	sp|O36633|GLYC_HRSVB	230	sp|Q9NY27|PP4R2_HUMAN Serine/threonine-protein phosphatase 4 regulatory subunit 2 OS=Homo sapiens OX=9606 GN=PPP4R2 PE=1 SV=3	197	TDSKEANLQQNE
TPSKKPNLQQNE	sp|O36633|GLYC_HRSVB	230	tr|H7C559|H7C559_HUMAN Serine/threonine-protein phosphatase 4 regulatory subunit 2 (Fragment) OS=Homo sapiens OX=9606 GN=PPP4R2 PE=1 SV=1	29	TDSKEANLQQNE
MYHYETQCLCTE	sp|O36635|L_HRSVB	707	sp|Q9BU23|LMF2_HUMAN Lipase maturation factor 2 OS=Homo sapiens OX=9606 GN=LMF2 PE=1 SV=2	201	TYHYETQCLPTP
YETLQKAIVAST	sp|O36633|GLYC_HRSVB	17	tr|H7BXG9|H7BXG9_HUMAN Protein EFR3 homolog B (Fragment) OS=Homo sapiens OX=9606 GN=EFR3B PE=1 SV=1	558	YETLKKAIVDSV
YETLQKAIVAST	sp|O36633|GLYC_HRSVB	17	sp|Q9Y2G0|EFR3B_HUMAN Protein EFR3 homolog B OS=Homo sapiens OX=9606 GN=EFR3B PE=1 SV=2	723	YETLKKAIVDSV
YETLQKAIVAST	sp|O36633|GLYC_HRSVB	17	tr|E7ESK9|E7ESK9_HUMAN Protein EFR3 homolog B OS=Homo sapiens OX=9606 GN=EFR3B PE=1 SV=1	688	YETLKKAIVDSV
SITSPRGPTLKA	sp|O42049|MATRX_HRSVB	61	sp|O14981|BTAF1_HUMAN TATA-binding protein-associated factor 172 OS=Homo sapiens OX=9606 GN=BTAF1 PE=1 SV=2	982	AITSRRGPTPKA
SITSPRGPTLKA	sp|O42049|MATRX_HRSVB	61	tr|A0A0A0MTH9|A0A0A0MTH9_HUMAN TATA-binding protein-associated factor 172 OS=Homo sapiens OX=9606 GN=BTAF1 PE=1 SV=1	982	AITSRRGPTPKA
LINLENMSLSEL	sp|O36635|L_HRSVB	1191	tr|H7C0N3|H7C0N3_HUMAN Cortactin-binding protein 2 (Fragment) OS=Homo sapiens OX=9606 GN=CTTNBP2 PE=1 SV=1	182	LENLEKSSLSEL
LINLENMSLSEL	sp|O36635|L_HRSVB	1191	tr|H0Y448|H0Y448_HUMAN Cortactin-binding protein 2 (Fragment) OS=Homo sapiens OX=9606 GN=CTTNBP2 PE=1 SV=1	685	LENLEKSSLSEL
LINLENMSLSEL	sp|O36635|L_HRSVB	1191	sp|Q8WZ74|CTTB2_HUMAN Cortactin-binding protein 2 OS=Homo sapiens OX=9606 GN=CTTNBP2 PE=1 SV=1	1197	LENLEKSSLSEL
QALAGQVAGLGL	sp|O42053|NCAP_HRSVB	322	tr|G3V4Q5|G3V4Q5_HUMAN Leukotriene B4 receptor 1 (Fragment) OS=Homo sapiens OX=9606 GN=LTB4R PE=1 SV=1	147	RALAGQAAGLGL
QALAGQVAGLGL	sp|O42053|NCAP_HRSVB	322	sp|Q15722|LT4R1_HUMAN Leukotriene B4 receptor 1 OS=Homo sapiens OX=9606 GN=LTB4R PE=1 SV=2	247	RALAGQAAGLGL
LITFIELIKLGV	sp|O36635|L_HRSVB	1639	sp|A5YKK6|CNOT1_HUMAN CCR4-NOT transcription complex subunit 1 OS=Homo sapiens OX=9606 GN=CNOT1 PE=1 SV=2	2323	LITFIELIKNPA
STTKTPNTTTPL	sp|O36633|GLYC_HRSVB	100	sp|Q9HC84|MUC5B_HUMAN Mucin-5B OS=Homo sapiens OX=9606 GN=MUC5B PE=1 SV=3	4620	STTTTPTTTTPT
LSTTKTPNTTTP	sp|O36633|GLYC_HRSVB	99	sp|Q9HC84|MUC5B_HUMAN Mucin-5B OS=Homo sapiens OX=9606 GN=MUC5B PE=1 SV=3	4619	ISTTTTPTTTTP
SELSGILDLDRS	sp|O42050|M21_HRSVB	58	sp|Q96B97|SH3K1_HUMAN SH3 domain-containing kinase-binding protein 1 OS=Homo sapiens OX=9606 GN=SH3KBP1 PE=1 SV=2	444	SSLSGILDKDLS
SELSGILDLDRS	sp|O42050|M21_HRSVB	58	tr|Q5JPT2|Q5JPT2_HUMAN SH3 domain-containing kinase-binding protein 1 (Fragment) OS=Homo sapiens OX=9606 GN=SH3KBP1 PE=1 SV=1	424	SSLSGILDKDLS
EASEQSSDTLSA	sp|O42062|PHOSP_HRSVB	122	tr|H7C1I9|H7C1I9_HUMAN Microtubule-associated serine/threonine-protein kinase 4 (Fragment) OS=Homo sapiens OX=9606 GN=MAST4 PE=1 SV=1	1531	EASAASSDTSSA
EASEQSSDTLSA	sp|O42062|PHOSP_HRSVB	122	sp|O15021|MAST4_HUMAN Microtubule-associated serine/threonine-protein kinase 4 OS=Homo sapiens OX=9606 GN=MAST4 PE=1 SV=4	2474	EASAASSDTSSA
LIGLAGLIDNYV	sp|O42050|M21_HRSVB	73	tr|A0A669KB03|A0A669KB03_HUMAN DNA mismatch repair protein Mlh1 OS=Homo sapiens OX=9606 GN=MLH1 PE=1 SV=1	392	LIGLPLLIDNYV
LIGLAGLIDNYV	sp|O42050|M21_HRSVB	73	sp|P40692|MLH1_HUMAN DNA mismatch repair protein Mlh1 OS=Homo sapiens OX=9606 GN=MLH1 PE=1 SV=1	636	LIGLPLLIDNYV
LIGLAGLIDNYV	sp|O42050|M21_HRSVB	73	tr|A0A669KAW3|A0A669KAW3_HUMAN DNA mismatch repair protein Mlh1 (Fragment) OS=Homo sapiens OX=9606 GN=MLH1 PE=1 SV=1	566	LIGLPLLIDNYV
AAGALKSVILLN	sp|O42062|PHOSP_HRSVB	145	sp|Q9BUN1|MENT_HUMAN Protein MENT OS=Homo sapiens OX=9606 GN=MENT PE=1 SV=1	4	AAGALLWVLLLN
LLITFIELIKLG	sp|O36635|L_HRSVB	1638	sp|A5YKK6|CNOT1_HUMAN CCR4-NOT transcription complex subunit 1 OS=Homo sapiens OX=9606 GN=CNOT1 PE=1 SV=2	2322	LLITFIELIKNP
SANIILKSITSP	sp|O42049|MATRX_HRSVB	54	tr|A0A0A0MRJ3|A0A0A0MRJ3_HUMAN Neuron navigator 1 OS=Homo sapiens OX=9606 GN=NAV1 PE=1 SV=1	763	SDNISLKSIGSP
SANIILKSITSP	sp|O42049|MATRX_HRSVB	54	sp|Q8NEY1|NAV1_HUMAN Neuron navigator 1 OS=Homo sapiens OX=9606 GN=NAV1 PE=1 SV=2	750	SDNISLKSIGSP
SANIILKSITSP	sp|O42049|MATRX_HRSVB	54	tr|H0Y6F6|H0Y6F6_HUMAN Neuron navigator 1 (Fragment) OS=Homo sapiens OX=9606 GN=NAV1 PE=1 SV=1	308	SDNISLKSIGSP
