query	query_seqname	query_start	target_seqname	target_start	target
LPLGLSRPSVPP	sp|Q81870|ORF3_HEVCH	89	tr|H3BLT9|H3BLT9_HUMAN NLR family CARD domain-containing protein 3 OS=Homo sapiens OX=9606 GN=NLRC3 PE=1 SV=2	174	LFLPLSRVSVPP
LPLGLSRPSVPP	sp|Q81870|ORF3_HEVCH	89	sp|Q7RTR2|NLRC3_HUMAN NLR family CARD domain-containing protein 3 OS=Homo sapiens OX=9606 GN=NLRC3 PE=1 SV=2	127	LFLPLSRVSVPP
PQEVQSCDQLAQ	sp|Q81862|POLN_HEVCH	1274	sp|P53634|CATC_HUMAN Dipeptidyl peptidase 1 OS=Homo sapiens OX=9606 GN=CTSC PE=1 SV=2	285	PQEVVSCSQYAQ
TPLAPLPPPLPE	sp|Q81862|POLN_HEVCH	735	tr|F5H1F6|F5H1F6_HUMAN Vacuolar protein sorting-associated protein 37B (Fragment) OS=Homo sapiens OX=9606 GN=VPS37B PE=1 SV=1	169	QALAPLPPRLPE
TPLAPLPPPLPE	sp|Q81862|POLN_HEVCH	735	tr|F5H4M0|F5H4M0_HUMAN Vacuolar protein sorting-associated protein 37B (Fragment) OS=Homo sapiens OX=9606 GN=VPS37B PE=1 SV=1	169	QALAPLPPRLPE
TPLAPLPPPLPE	sp|Q81862|POLN_HEVCH	735	sp|Q9H9H4|VP37B_HUMAN Vacuolar protein sorting-associated protein 37B OS=Homo sapiens OX=9606 GN=VPS37B PE=1 SV=1	171	QALAPLPPRLPE
TPLAPLPPPLPE	sp|Q81862|POLN_HEVCH	735	sp|P84550|SKOR1_HUMAN SKI family transcriptional corepressor 1 OS=Homo sapiens OX=9606 GN=SKOR1 PE=1 SV=1	573	PPLAPLPPPPPP
TPLAPLPPPLPE	sp|Q81862|POLN_HEVCH	735	tr|G3V3E1|G3V3E1_HUMAN SKI family transcriptional corepressor 1 OS=Homo sapiens OX=9606 GN=SKOR1 PE=3 SV=1	534	PPLAPLPPPPPP
TPLAPLPPPLPE	sp|Q81862|POLN_HEVCH	735	tr|G3V5H7|G3V5H7_HUMAN SKI family transcriptional corepressor 1 OS=Homo sapiens OX=9606 GN=SKOR1 PE=3 SV=1	545	PPLAPLPPPPPP
PEPQPTPFAPFP	sp|Q81862|POLN_HEVCH	271	tr|X6RAY8|X6RAY8_HUMAN 39S ribosomal protein L4, mitochondrial OS=Homo sapiens OX=9606 GN=MRPL4 PE=1 SV=1	258	PVPQPTPLAGFP
LYAPAAPAPPPG	sp|Q81871|CAPSD_HEVCH	12	sp|Q9NP08|HMX1_HUMAN Homeobox protein HMX1 OS=Homo sapiens OX=9606 GN=HMX1 PE=2 SV=2	305	PLAPAAPAPPPP
LYAPAAPAPPPG	sp|Q81871|CAPSD_HEVCH	12	tr|H7C469|H7C469_HUMAN Peptidase A1 domain-containing protein (Fragment) OS=Homo sapiens OX=9606 PE=1 SV=7	267	LQAPAAPAPEPS
LYAPAAPAPPPG	sp|Q81871|CAPSD_HEVCH	12	tr|A0A1B0GU03|A0A1B0GU03_HUMAN Peptidase A1 domain-containing protein OS=Homo sapiens OX=9606 PE=1 SV=1	412	LQAPAAPAPEPS
LYAPAAPAPPPG	sp|Q81871|CAPSD_HEVCH	12	sp|A6NMD0|IFM10_HUMAN Interferon-induced transmembrane protein 10 OS=Homo sapiens OX=9606 GN=IFITM10 PE=2 SV=1	83	LQAPAAPAPEPS
LYAPAAPAPPPG	sp|Q81871|CAPSD_HEVCH	12	tr|A0A1B0GU92|A0A1B0GU92_HUMAN Peptidase A1 domain-containing protein OS=Homo sapiens OX=9606 PE=1 SV=1	412	LQAPAAPAPEPS
LYAPAAPAPPPG	sp|Q81871|CAPSD_HEVCH	12	sp|P35713|SOX18_HUMAN Transcription factor SOX-18 OS=Homo sapiens OX=9606 GN=SOX18 PE=1 SV=2	42	LAAPAAPASPPS
RLALPEFHVERT	sp|Q81862|POLN_HEVCH	852	tr|D6RAX3|D6RAX3_HUMAN Protocadherin-1 OS=Homo sapiens OX=9606 GN=PCDH1 PE=1 SV=1	349	PLALPEDHYERT
VASTVVASAVVA	sp|Q81862|POLN_HEVCH	23	sp|P98088|MUC5A_HUMAN Mucin-5AC OS=Homo sapiens OX=9606 GN=MUC5AC PE=1 SV=4	4760	VASTSVASSSVA
KSRAWSASRTDL	sp|Q81862|POLN_HEVCH	1316	tr|H0YJK1|H0YJK1_HUMAN Kinesin light chain 1 (Fragment) OS=Homo sapiens OX=9606 GN=KLC1 PE=1 SV=1	31	DSRALSASHTDL
KSRAWSASRTDL	sp|Q81862|POLN_HEVCH	1316	tr|H0YG16|H0YG16_HUMAN Kinesin light chain 1 (Fragment) OS=Homo sapiens OX=9606 GN=KLC1 PE=1 SV=1	255	DSRALSASHTDL
AMALYAPAAPAP	sp|Q81871|CAPSD_HEVCH	9	sp|Q9UEW8|STK39_HUMAN STE20/SPS1-related proline-alanine-rich protein kinase OS=Homo sapiens OX=9606 GN=STK39 PE=1 SV=3	34	APAPAAPAAPAP
AMALYAPAAPAP	sp|Q81871|CAPSD_HEVCH	9	tr|H7C469|H7C469_HUMAN Peptidase A1 domain-containing protein (Fragment) OS=Homo sapiens OX=9606 PE=1 SV=7	264	PPALQAPAAPAP
AMALYAPAAPAP	sp|Q81871|CAPSD_HEVCH	9	tr|A0A1B0GU03|A0A1B0GU03_HUMAN Peptidase A1 domain-containing protein OS=Homo sapiens OX=9606 PE=1 SV=1	409	PPALQAPAAPAP
AMALYAPAAPAP	sp|Q81871|CAPSD_HEVCH	9	sp|A6NMD0|IFM10_HUMAN Interferon-induced transmembrane protein 10 OS=Homo sapiens OX=9606 GN=IFITM10 PE=2 SV=1	80	PPALQAPAAPAP
AMALYAPAAPAP	sp|Q81871|CAPSD_HEVCH	9	tr|A0A1B0GU92|A0A1B0GU92_HUMAN Peptidase A1 domain-containing protein OS=Homo sapiens OX=9606 PE=1 SV=1	409	PPALQAPAAPAP
EGWQASDAVASA	sp|Q81862|POLN_HEVCH	360	tr|J3QSZ5|J3QSZ5_HUMAN Protein SON OS=Homo sapiens OX=9606 GN=SON PE=1 SV=1	42	EGNQAGDAAASA
EGWQASDAVASA	sp|Q81862|POLN_HEVCH	360	sp|P18583|SON_HUMAN Protein SON OS=Homo sapiens OX=9606 GN=SON PE=1 SV=4	42	EGNQAGDAAASA
VLPEPQPTPFAP	sp|Q81862|POLN_HEVCH	269	tr|H7C457|H7C457_HUMAN Collagen alpha-1(XVIII) chain (Fragment) OS=Homo sapiens OX=9606 GN=COL18A1 PE=1 SV=1	112	RLPEPQPYPGAP
VLPEPQPTPFAP	sp|Q81862|POLN_HEVCH	269	tr|H7BXV5|H7BXV5_HUMAN Collagen alpha-1(XVIII) chain (Fragment) OS=Homo sapiens OX=9606 GN=COL18A1 PE=1 SV=1	475	RLPEPQPYPGAP
VLPEPQPTPFAP	sp|Q81862|POLN_HEVCH	269	sp|P39060|COIA1_HUMAN Collagen alpha-1(XVIII) chain OS=Homo sapiens OX=9606 GN=COL18A1 PE=1 SV=5	1542	RLPEPQPYPGAP
VLPEPQPTPFAP	sp|Q81862|POLN_HEVCH	269	tr|F5GWZ9|F5GWZ9_HUMAN Protein Atg16l2 OS=Homo sapiens OX=9606 GN=ATG16L2 PE=1 SV=1	121	HLPEPQPRPTAP
FLSPSPNPPVSP	sp|Q81870|ORF3_HEVCH	61	tr|H0YJW0|H0YJW0_HUMAN WD repeat-containing protein 25 (Fragment) OS=Homo sapiens OX=9606 GN=WDR25 PE=1 SV=1	89	MLSPSPKPPGSP
RTDLREQALRFM	sp|Q81862|POLN_HEVCH	1324	sp|Q13751|LAMB3_HUMAN Laminin subunit beta-3 OS=Homo sapiens OX=9606 GN=LAMB3 PE=1 SV=1	589	DADLREQALRFG
TNNIAMGPFSLT	sp|Q81862|POLN_HEVCH	598	sp|P0DN82|O12D1_HUMAN Olfactory receptor 12D1 OS=Homo sapiens OX=9606 GN=OR12D1 PE=3 SV=1	195	TGTIAMGPFFLT
TNNIAMGPFSLT	sp|Q81862|POLN_HEVCH	598	tr|A0A140T9F1|A0A140T9F1_HUMAN Olfactory receptor OS=Homo sapiens OX=9606 GN=OR12D2 PE=3 SV=1	201	TGTIAMGPFFLT
TNNIAMGPFSLT	sp|Q81862|POLN_HEVCH	598	tr|A0A140T931|A0A140T931_HUMAN Olfactory receptor OS=Homo sapiens OX=9606 GN=OR12D2 PE=3 SV=1	201	TGTIAMGPFFLT
TNNIAMGPFSLT	sp|Q81862|POLN_HEVCH	598	sp|P58182|O12D2_HUMAN Olfactory receptor 12D2 OS=Homo sapiens OX=9606 GN=OR12D2 PE=2 SV=2	201	TGTIAMGPFFLT
VLRKCWLRPAGK	sp|Q81862|POLN_HEVCH	102	tr|E9PQ06|E9PQ06_HUMAN Short-chain dehydrogenase/reductase family 42E member 1 (Fragment) OS=Homo sapiens OX=9606 GN=SDR42E1 PE=3 SV=1	174	VLRTCALRPAGI
VLRKCWLRPAGK	sp|Q81862|POLN_HEVCH	102	sp|Q8WUS8|D42E1_HUMAN Short-chain dehydrogenase/reductase family 42E member 1 OS=Homo sapiens OX=9606 GN=SDR42E1 PE=2 SV=2	177	VLRTCALRPAGI
RPVLPTLAGGYV	sp|Q81871|CAPSD_HEVCH	195	sp|Q8WVN8|UB2Q2_HUMAN Ubiquitin-conjugating enzyme E2 Q2 OS=Homo sapiens OX=9606 GN=UBE2Q2 PE=1 SV=1	286	RVVLPVLSGGYV
GLVAAALGCGLR	sp|Q81862|POLN_HEVCH	1565	sp|Q13219|PAPP1_HUMAN Pappalysin-1 OS=Homo sapiens OX=9606 GN=PAPPA PE=1 SV=3	11	GLLSAALGCGLA
GLVAAALGCGLR	sp|Q81862|POLN_HEVCH	1565	sp|Q8TER0|SNED1_HUMAN Sushi, nidogen and EGF-like domain-containing protein 1 OS=Homo sapiens OX=9606 GN=SNED1 PE=2 SV=2	9	LLVAAALGLGAR
RRGATKVYAALR	sp|Q81862|POLN_HEVCH	180	sp|P54760|EPHB4_HUMAN Ephrin type-B receptor 4 OS=Homo sapiens OX=9606 GN=EPHB4 PE=1 SV=2	80	RRGAVHVYATLR
RRGATKVYAALR	sp|Q81862|POLN_HEVCH	180	tr|Q96L35|Q96L35_HUMAN Receptor protein-tyrosine kinase OS=Homo sapiens OX=9606 GN=EPHB4 PE=1 SV=1	80	RRGAVHVYATLR
HMLVIKLQRLLT	sp|Q81862|POLN_HEVCH	1037	sp|Q9Y5P3|RAI2_HUMAN Retinoic acid-induced protein 2 OS=Homo sapiens OX=9606 GN=RAI2 PE=1 SV=2	514	HMLPIKKQRLAT
DLREQALRFMPL	sp|Q81862|POLN_HEVCH	1326	sp|Q13751|LAMB3_HUMAN Laminin subunit beta-3 OS=Homo sapiens OX=9606 GN=LAMB3 PE=1 SV=1	591	DLREQALRFGRL
FSLTFVANLMGA	sp|Q81862|POLN_HEVCH	606	sp|Q92547|TOPB1_HUMAN DNA topoisomerase 2-binding protein 1 OS=Homo sapiens OX=9606 GN=TOPBP1 PE=1 SV=3	662	ESLTFLANLLGA
FSLTFVANLMGA	sp|Q81862|POLN_HEVCH	606	tr|A0A2R8YD63|A0A2R8YD63_HUMAN DNA topoisomerase 2-binding protein 1 OS=Homo sapiens OX=9606 GN=TOPBP1 PE=1 SV=1	657	ESLTFLANLLGA
ALYAPAAPAPPP	sp|Q81871|CAPSD_HEVCH	11	sp|Q9UEW8|STK39_HUMAN STE20/SPS1-related proline-alanine-rich protein kinase OS=Homo sapiens OX=9606 GN=STK39 PE=1 SV=3	36	APAAPAAPAPAP
ALYAPAAPAPPP	sp|Q81871|CAPSD_HEVCH	11	tr|A0A140TA70|A0A140TA70_HUMAN Sal-like protein 3 OS=Homo sapiens OX=9606 GN=SALL3 PE=1 SV=1	316	AAPAPAAPAPAP
ALYAPAAPAPPP	sp|Q81871|CAPSD_HEVCH	11	tr|A0A140TA74|A0A140TA74_HUMAN Sal-like protein 3 (Fragment) OS=Homo sapiens OX=9606 GN=SALL3 PE=1 SV=1	312	AAPAPAAPAPAP
ALYAPAAPAPPP	sp|Q81871|CAPSD_HEVCH	11	sp|Q9BXA9|SALL3_HUMAN Sal-like protein 3 OS=Homo sapiens OX=9606 GN=SALL3 PE=1 SV=2	316	AAPAPAAPAPAP
ALYAPAAPAPPP	sp|Q81871|CAPSD_HEVCH	11	tr|H7C469|H7C469_HUMAN Peptidase A1 domain-containing protein (Fragment) OS=Homo sapiens OX=9606 PE=1 SV=7	266	ALQAPAAPAPEP
ALYAPAAPAPPP	sp|Q81871|CAPSD_HEVCH	11	tr|A0A1B0GU03|A0A1B0GU03_HUMAN Peptidase A1 domain-containing protein OS=Homo sapiens OX=9606 PE=1 SV=1	411	ALQAPAAPAPEP
ALYAPAAPAPPP	sp|Q81871|CAPSD_HEVCH	11	sp|A6NMD0|IFM10_HUMAN Interferon-induced transmembrane protein 10 OS=Homo sapiens OX=9606 GN=IFITM10 PE=2 SV=1	82	ALQAPAAPAPEP
ALYAPAAPAPPP	sp|Q81871|CAPSD_HEVCH	11	tr|A0A1B0GU92|A0A1B0GU92_HUMAN Peptidase A1 domain-containing protein OS=Homo sapiens OX=9606 PE=1 SV=1	411	ALQAPAAPAPEP
ALYAPAAPAPPP	sp|Q81871|CAPSD_HEVCH	11	sp|Q5VSG8|MANEL_HUMAN Glycoprotein endo-alpha-1,2-mannosidase-like protein OS=Homo sapiens OX=9606 GN=MANEAL PE=2 SV=1	58	AARAPAAPAAPP
ALYAPAAPAPPP	sp|Q81871|CAPSD_HEVCH	11	sp|Q9NP08|HMX1_HUMAN Homeobox protein HMX1 OS=Homo sapiens OX=9606 GN=HMX1 PE=2 SV=2	304	FPLAPAAPAPPP
ALYAPAAPAPPP	sp|Q81871|CAPSD_HEVCH	11	sp|Q5VSG8|MANEL_HUMAN Glycoprotein endo-alpha-1,2-mannosidase-like protein OS=Homo sapiens OX=9606 GN=MANEAL PE=2 SV=1	61	APAAPAAPPPPP
ALYAPAAPAPPP	sp|Q81871|CAPSD_HEVCH	11	sp|Q3C1V1|CK091_HUMAN Uncharacterized protein C11orf91 OS=Homo sapiens OX=9606 GN=C11orf91 PE=2 SV=2	68	ALPAPAPPPPPP
ALYAPAAPAPPP	sp|Q81871|CAPSD_HEVCH	11	sp|P35713|SOX18_HUMAN Transcription factor SOX-18 OS=Homo sapiens OX=9606 GN=SOX18 PE=1 SV=2	41	ALAAPAAPASPP
LSGVLASPTSSP	sp|Q81870|ORF3_HEVCH	48	tr|H0Y5V5|H0Y5V5_HUMAN Serine/threonine-protein kinase N2 (Fragment) OS=Homo sapiens OX=9606 GN=PKN2 PE=1 SV=1	78	LSLVAASPTLSP
LSGVLASPTSSP	sp|Q81870|ORF3_HEVCH	48	tr|B1AL79|B1AL79_HUMAN Protein kinase C OS=Homo sapiens OX=9606 GN=PKN2 PE=1 SV=1	296	LSLVAASPTLSP
LSGVLASPTSSP	sp|Q81870|ORF3_HEVCH	48	sp|Q16513|PKN2_HUMAN Serine/threonine-protein kinase N2 OS=Homo sapiens OX=9606 GN=PKN2 PE=1 SV=1	296	LSLVAASPTLSP
LSGVLASPTSSP	sp|Q81870|ORF3_HEVCH	48	tr|A0A590UJ53|A0A590UJ53_HUMAN KAT8 regulatory NSL complex subunit 3 OS=Homo sapiens OX=9606 GN=KANSL3 PE=1 SV=1	530	LSSVSSSPTSSP
LSGVLASPTSSP	sp|Q81870|ORF3_HEVCH	48	sp|Q9P2N6|KANL3_HUMAN KAT8 regulatory NSL complex subunit 3 OS=Homo sapiens OX=9606 GN=KANSL3 PE=1 SV=2	530	LSSVSSSPTSSP
LSGVLASPTSSP	sp|Q81870|ORF3_HEVCH	48	sp|Q14684|RRP1B_HUMAN Ribosomal RNA processing protein 1 homolog B OS=Homo sapiens OX=9606 GN=RRP1B PE=1 SV=3	722	LHGVLKTPTSSP
ASQSTKLARTIF	sp|Q81862|POLN_HEVCH	1103	tr|F8WE32|F8WE32_HUMAN TATA box-binding protein-associated factor 1B OS=Homo sapiens OX=9606 GN=TAF1B PE=1 SV=1	181	ASQSGLLKRTIF
DVIIEKGTDGTL	sp|Q81862|POLN_HEVCH	1353	tr|A0A3B3ITV0|A0A3B3ITV0_HUMAN Acylglycerol kinase, mitochondrial (Fragment) OS=Homo sapiens OX=9606 GN=AGK PE=1 SV=1	25	DVIIVAGGDGTL
DVIIEKGTDGTL	sp|Q81862|POLN_HEVCH	1353	tr|A0A3B3ISZ0|A0A3B3ISZ0_HUMAN Acylglycerol kinase, mitochondrial OS=Homo sapiens OX=9606 GN=AGK PE=1 SV=1	117	DVIIVAGGDGTL
DVIIEKGTDGTL	sp|Q81862|POLN_HEVCH	1353	tr|A0A3B3ITD0|A0A3B3ITD0_HUMAN Acylglycerol kinase, mitochondrial OS=Homo sapiens OX=9606 GN=AGK PE=1 SV=1	113	DVIIVAGGDGTL
DVIIEKGTDGTL	sp|Q81862|POLN_HEVCH	1353	tr|E9PC15|E9PC15_HUMAN Acylglycerol kinase, mitochondrial OS=Homo sapiens OX=9606 GN=AGK PE=1 SV=1	89	DVIIVAGGDGTL
DVIIEKGTDGTL	sp|Q81862|POLN_HEVCH	1353	tr|A0A3B3ISY9|A0A3B3ISY9_HUMAN Acylglycerol kinase, mitochondrial OS=Homo sapiens OX=9606 GN=AGK PE=1 SV=1	25	DVIIVAGGDGTL
DVIIEKGTDGTL	sp|Q81862|POLN_HEVCH	1353	sp|Q53H12|AGK_HUMAN Acylglycerol kinase, mitochondrial OS=Homo sapiens OX=9606 GN=AGK PE=1 SV=2	117	DVIIVAGGDGTL
DVIIEKGTDGTL	sp|Q81862|POLN_HEVCH	1353	tr|E9PG39|E9PG39_HUMAN Acylglycerol kinase, mitochondrial OS=Homo sapiens OX=9606 GN=AGK PE=1 SV=1	114	DVIIVAGGDGTL
DVIIEKGTDGTL	sp|Q81862|POLN_HEVCH	1353	tr|A0A3B3IUC9|A0A3B3IUC9_HUMAN Acylglycerol kinase, mitochondrial OS=Homo sapiens OX=9606 GN=AGK PE=1 SV=1	25	DVIIVAGGDGTL
DVIIEKGTDGTL	sp|Q81862|POLN_HEVCH	1353	tr|A0A3B3ITX7|A0A3B3ITX7_HUMAN Acylglycerol kinase, mitochondrial OS=Homo sapiens OX=9606 GN=AGK PE=1 SV=1	117	DVIIVAGGDGTL
DVIIEKGTDGTL	sp|Q81862|POLN_HEVCH	1353	tr|A0A3B3IS09|A0A3B3IS09_HUMAN Acylglycerol kinase, mitochondrial OS=Homo sapiens OX=9606 GN=AGK PE=1 SV=1	117	DVIIVAGGDGTL
DFKQNPGLVAAA	sp|Q81862|POLN_HEVCH	1559	sp|Q12778|FOXO1_HUMAN Forkhead box protein O1 OS=Homo sapiens OX=9606 GN=FOXO1 PE=1 SV=2	82	DFPQAPGSVAAA
YRRHSGDPGTIA	sp|Q81862|POLN_HEVCH	1513	sp|P12643|BMP2_HUMAN Bone morphogenetic protein 2 OS=Homo sapiens OX=9606 GN=BMP2 PE=1 SV=1	83	YRRHSGQPGSPA
LALPEFHVERTP	sp|Q81862|POLN_HEVCH	853	tr|D6RAX3|D6RAX3_HUMAN Protocadherin-1 OS=Homo sapiens OX=9606 GN=PCDH1 PE=1 SV=1	350	LALPEDHYERTT
AAMALYAPAAPA	sp|Q81871|CAPSD_HEVCH	8	sp|Q8NHG8|ZNRF2_HUMAN E3 ubiquitin-protein ligase ZNRF2 OS=Homo sapiens OX=9606 GN=ZNRF2 PE=1 SV=1	65	AAAAAAAPAAPA
AAMALYAPAAPA	sp|Q81871|CAPSD_HEVCH	8	sp|Q9UEW8|STK39_HUMAN STE20/SPS1-related proline-alanine-rich protein kinase OS=Homo sapiens OX=9606 GN=STK39 PE=1 SV=3	33	AAPAPAAPAAPA
AAMALYAPAAPA	sp|Q81871|CAPSD_HEVCH	8	sp|Q9UEW8|STK39_HUMAN STE20/SPS1-related proline-alanine-rich protein kinase OS=Homo sapiens OX=9606 GN=STK39 PE=1 SV=3	30	AATAAPAPAAPA
PLAPLPPPLPEP	sp|Q81862|POLN_HEVCH	736	tr|F5H1F6|F5H1F6_HUMAN Vacuolar protein sorting-associated protein 37B (Fragment) OS=Homo sapiens OX=9606 GN=VPS37B PE=1 SV=1	170	ALAPLPPRLPEL
PLAPLPPPLPEP	sp|Q81862|POLN_HEVCH	736	tr|F5H4M0|F5H4M0_HUMAN Vacuolar protein sorting-associated protein 37B (Fragment) OS=Homo sapiens OX=9606 GN=VPS37B PE=1 SV=1	170	ALAPLPPRLPEL
PLAPLPPPLPEP	sp|Q81862|POLN_HEVCH	736	sp|Q9H9H4|VP37B_HUMAN Vacuolar protein sorting-associated protein 37B OS=Homo sapiens OX=9606 GN=VPS37B PE=1 SV=1	172	ALAPLPPRLPEL
PLAPLPPPLPEP	sp|Q81862|POLN_HEVCH	736	sp|Q9Y3S1|WNK2_HUMAN Serine/threonine-protein kinase WNK2 OS=Homo sapiens OX=9606 GN=WNK2 PE=1 SV=4	1508	PREPLPPPAPEP
PLAPLPPPLPEP	sp|Q81862|POLN_HEVCH	736	tr|F8W9F9|F8W9F9_HUMAN Non-specific serine/threonine protein kinase OS=Homo sapiens OX=9606 GN=WNK2 PE=1 SV=1	1471	PREPLPPPAPEP
PLAPLPPPLPEP	sp|Q81862|POLN_HEVCH	736	tr|H0Y493|H0Y493_HUMAN Serine/threonine-protein kinase WNK2 (Fragment) OS=Homo sapiens OX=9606 GN=WNK2 PE=1 SV=1	268	PREPLPPPAPEP
PLAPLPPPLPEP	sp|Q81862|POLN_HEVCH	736	tr|H0Y7T5|H0Y7T5_HUMAN Non-specific serine/threonine protein kinase (Fragment) OS=Homo sapiens OX=9606 GN=WNK2 PE=1 SV=1	1467	PREPLPPPAPEP
PLAPLPPPLPEP	sp|Q81862|POLN_HEVCH	736	tr|H0Y7R3|H0Y7R3_HUMAN Non-specific serine/threonine protein kinase (Fragment) OS=Homo sapiens OX=9606 GN=WNK2 PE=1 SV=1	1075	PREPLPPPAPEP
PLAPLPPPLPEP	sp|Q81862|POLN_HEVCH	736	sp|Q9NSA1|FGF21_HUMAN Fibroblast growth factor 21 OS=Homo sapiens OX=9606 GN=FGF21 PE=1 SV=1	166	PLPGLPPALPEP
PLAPLPPPLPEP	sp|Q81862|POLN_HEVCH	736	sp|P51608|MECP2_HUMAN Methyl-CpG-binding protein 2 OS=Homo sapiens OX=9606 GN=MECP2 PE=1 SV=1	382	LLPPLPPPPPEP
PLAPLPPPLPEP	sp|Q81862|POLN_HEVCH	736	sp|P84550|SKOR1_HUMAN SKI family transcriptional corepressor 1 OS=Homo sapiens OX=9606 GN=SKOR1 PE=1 SV=1	574	PLAPLPPPPPPP
PLAPLPPPLPEP	sp|Q81862|POLN_HEVCH	736	tr|G3V3E1|G3V3E1_HUMAN SKI family transcriptional corepressor 1 OS=Homo sapiens OX=9606 GN=SKOR1 PE=3 SV=1	535	PLAPLPPPPPPP
PLAPLPPPLPEP	sp|Q81862|POLN_HEVCH	736	tr|G3V5H7|G3V5H7_HUMAN SKI family transcriptional corepressor 1 OS=Homo sapiens OX=9606 GN=SKOR1 PE=3 SV=1	546	PLAPLPPPPPPP
PLAPLPPPLPEP	sp|Q81862|POLN_HEVCH	736	tr|A0A3B3ISX8|A0A3B3ISX8_HUMAN Palladin (Fragment) OS=Homo sapiens OX=9606 GN=PALLD PE=1 SV=1	280	PLPPPPPPLPSP
PLAPLPPPLPEP	sp|Q81862|POLN_HEVCH	736	sp|Q8WX93|PALLD_HUMAN Palladin OS=Homo sapiens OX=9606 GN=PALLD PE=1 SV=3	820	PLPPPPPPLPSP
SLEGRPLNSSTS	sp|Q81871|CAPSD_HEVCH	520	sp|Q9ULT6|ZNRF3_HUMAN E3 ubiquitin-protein ligase ZNRF3 OS=Homo sapiens OX=9606 GN=ZNRF3 PE=1 SV=3	672	SLEHRGPNSSTS
IYGPGGTPSIFP	sp|Q81862|POLN_HEVCH	292	sp|Q9Y3I1|FBX7_HUMAN F-box only protein 7 OS=Homo sapiens OX=9606 GN=FBXO7 PE=1 SV=1	465	IPGPGETPSQFP
YAPAAPAPPPGS	sp|Q81871|CAPSD_HEVCH	13	sp|Q9NP08|HMX1_HUMAN Homeobox protein HMX1 OS=Homo sapiens OX=9606 GN=HMX1 PE=2 SV=2	306	LAPAAPAPPPPL
YAPAAPAPPPGS	sp|Q81871|CAPSD_HEVCH	13	sp|Q96C90|PP14B_HUMAN Protein phosphatase 1 regulatory subunit 14B OS=Homo sapiens OX=9606 GN=PPP1R14B PE=1 SV=3	10	AALAAPAPGPGS
LPEPQPTPFAPF	sp|Q81862|POLN_HEVCH	270	tr|F5GWZ9|F5GWZ9_HUMAN Protein Atg16l2 OS=Homo sapiens OX=9606 GN=ATG16L2 PE=1 SV=1	122	LPEPQPRPTAPA
LPEPQPTPFAPF	sp|Q81862|POLN_HEVCH	270	tr|H7C457|H7C457_HUMAN Collagen alpha-1(XVIII) chain (Fragment) OS=Homo sapiens OX=9606 GN=COL18A1 PE=1 SV=1	113	LPEPQPYPGAPH
LPEPQPTPFAPF	sp|Q81862|POLN_HEVCH	270	tr|H7BXV5|H7BXV5_HUMAN Collagen alpha-1(XVIII) chain (Fragment) OS=Homo sapiens OX=9606 GN=COL18A1 PE=1 SV=1	476	LPEPQPYPGAPH
LPEPQPTPFAPF	sp|Q81862|POLN_HEVCH	270	sp|P39060|COIA1_HUMAN Collagen alpha-1(XVIII) chain OS=Homo sapiens OX=9606 GN=COL18A1 PE=1 SV=5	1543	LPEPQPYPGAPH
SPSPNPPVSPLR	sp|Q81870|ORF3_HEVCH	63	sp|Q13029|PRDM2_HUMAN PR domain zinc finger protein 2 OS=Homo sapiens OX=9606 GN=PRDM2 PE=1 SV=3	1030	SPSPIPPVEPLM
LGLSRPSVPPVP	sp|Q81870|ORF3_HEVCH	91	sp|Q9BX84|TRPM6_HUMAN Transient receptor potential cation channel subfamily M member 6 OS=Homo sapiens OX=9606 GN=TRPM6 PE=1 SV=2	1362	LPLSRPSVPDVL
GDTRILASDYEN	sp|Q81871|CAPSD_HEVCH	434	sp|Q96RV3|PCX1_HUMAN Pecanex-like protein 1 OS=Homo sapiens OX=9606 GN=PCNX1 PE=1 SV=2	1583	GDCFILASDYLN
AAAMALYAPAAP	sp|Q81871|CAPSD_HEVCH	7	sp|Q8NHG8|ZNRF2_HUMAN E3 ubiquitin-protein ligase ZNRF2 OS=Homo sapiens OX=9606 GN=ZNRF2 PE=1 SV=1	67	AAAAAPAAPAAP
AAAMALYAPAAP	sp|Q81871|CAPSD_HEVCH	7	sp|Q9UEW8|STK39_HUMAN STE20/SPS1-related proline-alanine-rich protein kinase OS=Homo sapiens OX=9606 GN=STK39 PE=1 SV=3	29	AAATAAPAPAAP
PGLVAAALGCGL	sp|Q81862|POLN_HEVCH	1564	sp|Q13219|PAPP1_HUMAN Pappalysin-1 OS=Homo sapiens OX=9606 GN=PAPPA PE=1 SV=3	10	LGLLSAALGCGL
GLTTALESAIVA	sp|Q81862|POLN_HEVCH	11	tr|A0A669KB10|A0A669KB10_HUMAN Golgi-specific brefeldin A-resistance guanine nucleotide exchange factor 1 OS=Homo sapiens OX=9606 GN=GBF1 PE=1 SV=1	458	LLTVALESAPVA
GLTTALESAIVA	sp|Q81862|POLN_HEVCH	11	sp|Q92538|GBF1_HUMAN Golgi-specific brefeldin A-resistance guanine nucleotide exchange factor 1 OS=Homo sapiens OX=9606 GN=GBF1 PE=1 SV=2	433	LLTVALESAPVA
GLTTALESAIVA	sp|Q81862|POLN_HEVCH	11	tr|A0A669KBG8|A0A669KBG8_HUMAN Golgi-specific brefeldin A-resistance guanine nucleotide exchange factor 1 OS=Homo sapiens OX=9606 GN=GBF1 PE=1 SV=1	466	LLTVALESAPVA
SRAWSASRTDLR	sp|Q81862|POLN_HEVCH	1317	tr|H0YJK1|H0YJK1_HUMAN Kinesin light chain 1 (Fragment) OS=Homo sapiens OX=9606 GN=KLC1 PE=1 SV=1	32	SRALSASHTDLA
SRAWSASRTDLR	sp|Q81862|POLN_HEVCH	1317	tr|H0YG16|H0YG16_HUMAN Kinesin light chain 1 (Fragment) OS=Homo sapiens OX=9606 GN=KLC1 PE=1 SV=1	256	SRALSASHTDLA
GLSGVLASPTSS	sp|Q81870|ORF3_HEVCH	47	sp|Q6UWX4|HIPL2_HUMAN HHIP-like protein 2 OS=Homo sapiens OX=9606 GN=HHIPL2 PE=1 SV=1	664	GSSKKLASPTSS
LYCRARNGRCAE	sp|Q81862|POLN_HEVCH	77	sp|Q6JVE9|LCN8_HUMAN Epididymal-specific lipocalin-8 OS=Homo sapiens OX=9606 GN=LCN8 PE=2 SV=1	157	LYLAARPGRCAE
TARTFARNSKVS	sp|Q81862|POLN_HEVCH	235	sp|Q460N3|PAR15_HUMAN Protein mono-ADP-ribosyltransferase PARP15 OS=Homo sapiens OX=9606 GN=PARP15 PE=1 SV=2	325	TARTFNRKSGVS
TARTFARNSKVS	sp|Q81862|POLN_HEVCH	235	tr|C9J7L3|C9J7L3_HUMAN Poly [ADP-ribose] polymerase OS=Homo sapiens OX=9606 GN=PARP15 PE=1 SV=2	199	TARTFNRKSGVS
TARTFARNSKVS	sp|Q81862|POLN_HEVCH	235	tr|B7ZL48|B7ZL48_HUMAN Poly [ADP-ribose] polymerase OS=Homo sapiens OX=9606 GN=PARP15 PE=1 SV=1	91	TARTFNRKSGVS
ARAASPGTVSLR	sp|Q81862|POLN_HEVCH	1130	tr|J3QLM1|J3QLM1_HUMAN StAR-related lipid transfer protein 3 OS=Homo sapiens OX=9606 GN=STARD3 PE=1 SV=1	392	ARAACPGTSSTR
