query	query_seqname	query_start	target_seqname	target_start	target
LTGLGTLLSAGL	tr|B0G0W4|B0G0W4_9POLY	90	tr|A0A0A0MSC0|A0A0A0MSC0_HUMAN Potassium voltage-gated channel subfamily KQT member 5 OS=Homo sapiens OX=9606 GN=KCNQ5 PE=1 SV=1	320	LTWLGRLLSAGF
GGNKSSLSSLSS	tr|B6DVW7|B6DVW7_9POLY	282	sp|A6NK53|ZN233_HUMAN Zinc finger protein 233 OS=Homo sapiens OX=9606 GN=ZNF233 PE=2 SV=3	656	GFSKSSLSSDSS
PTGNSIPKSSSR	tr|B6DVW7|B6DVW7_9POLY	193	tr|U3KPY3|U3KPY3_HUMAN Single-stranded DNA-binding protein 4 (Fragment) OS=Homo sapiens OX=9606 GN=SSBP4 PE=1 SV=2	17	PSGNSIPYSSSS
PTGNSIPKSSSR	tr|B6DVW7|B6DVW7_9POLY	193	sp|Q9BWG4|SSBP4_HUMAN Single-stranded DNA-binding protein 4 OS=Homo sapiens OX=9606 GN=SSBP4 PE=1 SV=1	246	PSGNSIPYSSSS
ISNTLVSALVSS	tr|B0G0W4|B0G0W4_9POLY	162	sp|Q9H195|MUC3B_HUMAN Mucin-3B (Fragments) OS=Homo sapiens OX=9606 GN=MUC3B PE=2 SV=2	87	ISETLLSSLVSS
ETGLGPLCRGEG	tr|B0G0W3|B0G0W3_9POLY	270	sp|Q6UXC1|AEGP_HUMAN Apical endosomal glycoprotein OS=Homo sapiens OX=9606 GN=MAMDC4 PE=2 SV=2	274	ETGLGPWNRSEG
