query	query_seqname	query_start	target_seqname	target_start	target
ASASTSGSGSAS	sp|P21401|GP_RVFVZ	1050	tr|A0A0C4DG88|A0A0C4DG88_HUMAN POU domain protein (Fragment) OS=Homo sapiens OX=9606 GN=POU2F1 PE=1 SV=1	438	ASASTSEASSAS
ASASTSGSGSAS	sp|P21401|GP_RVFVZ	1050	sp|O14646|CHD1_HUMAN Chromodomain-helicase-DNA-binding protein 1 OS=Homo sapiens OX=9606 GN=CHD1 PE=1 SV=2	25	GSASGSGSGSSS
ASASTSGSGSAS	sp|P21401|GP_RVFVZ	1050	sp|Q8N8G2|VGLL2_HUMAN Transcription cofactor vestigial-like protein 2 OS=Homo sapiens OX=9606 GN=VGLL2 PE=1 SV=1	43	ASPSSSGSGSSS
ASASTSGSGSAS	sp|P21401|GP_RVFVZ	1050	sp|Q2KHT3|CL16A_HUMAN Protein CLEC16A OS=Homo sapiens OX=9606 GN=CLEC16A PE=1 SV=2	904	ASGSPSGSGSTS
ASASTSGSGSAS	sp|P21401|GP_RVFVZ	1050	tr|H7BXG1|H7BXG1_HUMAN Protein CLEC16A (Fragment) OS=Homo sapiens OX=9606 GN=CLEC16A PE=1 SV=1	96	ASGSPSGSGSTS
