query	query_seqname	query_start	target_seqname	target_start	target
DVDSYATQLNNA	sp|P16272|DNLI_VACCW	110	tr|A0A6Q8PGH7|A0A6Q8PGH7_HUMAN Kinesin-like protein (Fragment) OS=Homo sapiens OX=9606 GN=KIF2A PE=1 SV=1	634	DVDSYATQLEAI
DVDSYATQLNNA	sp|P16272|DNLI_VACCW	110	tr|A0A6Q8PH57|A0A6Q8PH57_HUMAN Kinesin-like protein OS=Homo sapiens OX=9606 GN=KIF2A PE=1 SV=1	674	DVDSYATQLEAI
DVDSYATQLNNA	sp|P16272|DNLI_VACCW	110	tr|A0A6Q8PG37|A0A6Q8PG37_HUMAN Kinesin-like protein OS=Homo sapiens OX=9606 GN=KIF2A PE=1 SV=1	666	DVDSYATQLEAI
DVDSYATQLNNA	sp|P16272|DNLI_VACCW	110	tr|A0A6Q8PGG1|A0A6Q8PGG1_HUMAN Kinesin-like protein KIF2A OS=Homo sapiens OX=9606 GN=KIF2A PE=1 SV=1	539	DVDSYATQLEAI
RSSSTASNNNES	sp|Q85320|A9_VACCW	75	tr|J3QRS9|J3QRS9_HUMAN BUB3-interacting and GLEBS motif-containing protein ZNF207 OS=Homo sapiens OX=9606 GN=ZNF207 PE=1 SV=1	282	TSSSTASSNSES
RSSSTASNNNES	sp|Q85320|A9_VACCW	75	tr|J3KS31|J3KS31_HUMAN BUB3-interacting and GLEBS motif-containing protein ZNF207 (Fragment) OS=Homo sapiens OX=9606 GN=ZNF207 PE=1 SV=1	129	TSSSTASSNSES
RSSSTASNNNES	sp|Q85320|A9_VACCW	75	sp|O43670|ZN207_HUMAN BUB3-interacting and GLEBS motif-containing protein ZNF207 OS=Homo sapiens OX=9606 GN=ZNF207 PE=1 SV=1	266	TSSSTASSNSES
RSSSTASNNNES	sp|Q85320|A9_VACCW	75	tr|X6R4W8|X6R4W8_HUMAN BUB3-interacting and GLEBS motif-containing protein ZNF207 OS=Homo sapiens OX=9606 GN=ZNF207 PE=1 SV=1	285	TSSSTASSNSES
REMISNTSKSLE	sp|P18377|K4_VACCW	32	tr|A0A3B3IRK4|A0A3B3IRK4_HUMAN Myelin transcription factor 1-like protein (Fragment) OS=Homo sapiens OX=9606 GN=MYT1L PE=1 SV=1	223	SEMNSNTSNSLE
REMISNTSKSLE	sp|P18377|K4_VACCW	32	tr|A0A3B3IU66|A0A3B3IU66_HUMAN Myelin transcription factor 1-like protein OS=Homo sapiens OX=9606 GN=MYT1L PE=1 SV=1	223	SEMNSNTSNSLE
REMISNTSKSLE	sp|P18377|K4_VACCW	32	tr|A0A3B3IRX5|A0A3B3IRX5_HUMAN Myelin transcription factor 1-like protein OS=Homo sapiens OX=9606 GN=MYT1L PE=1 SV=1	223	SEMNSNTSNSLE
REMISNTSKSLE	sp|P18377|K4_VACCW	32	tr|A0A3B3IS14|A0A3B3IS14_HUMAN Myelin transcription factor 1-like protein OS=Homo sapiens OX=9606 GN=MYT1L PE=1 SV=1	223	SEMNSNTSNSLE
REMISNTSKSLE	sp|P18377|K4_VACCW	32	tr|A0A3B3IS61|A0A3B3IS61_HUMAN Myelin transcription factor 1-like protein OS=Homo sapiens OX=9606 GN=MYT1L PE=1 SV=1	223	SEMNSNTSNSLE
REMISNTSKSLE	sp|P18377|K4_VACCW	32	tr|A0A3B3IRM3|A0A3B3IRM3_HUMAN Myelin transcription factor 1-like protein OS=Homo sapiens OX=9606 GN=MYT1L PE=1 SV=1	223	SEMNSNTSNSLE
REMISNTSKSLE	sp|P18377|K4_VACCW	32	tr|A0A3B3ISN1|A0A3B3ISN1_HUMAN Myelin transcription factor 1-like protein (Fragment) OS=Homo sapiens OX=9606 GN=MYT1L PE=1 SV=1	223	SEMNSNTSNSLE
REMISNTSKSLE	sp|P18377|K4_VACCW	32	tr|A0A2R8YF72|A0A2R8YF72_HUMAN Myelin transcription factor 1-like protein OS=Homo sapiens OX=9606 GN=MYT1L PE=1 SV=1	223	SEMNSNTSNSLE
REMISNTSKSLE	sp|P18377|K4_VACCW	32	tr|A0A3B3ISP2|A0A3B3ISP2_HUMAN Myelin transcription factor 1-like protein (Fragment) OS=Homo sapiens OX=9606 GN=MYT1L PE=1 SV=1	55	SEMNSNTSNSLE
REMISNTSKSLE	sp|P18377|K4_VACCW	32	sp|Q9UL68|MYT1L_HUMAN Myelin transcription factor 1-like protein OS=Homo sapiens OX=9606 GN=MYT1L PE=2 SV=3	223	SEMNSNTSNSLE
REMISNTSKSLE	sp|P18377|K4_VACCW	32	tr|A0A3B3ITJ8|A0A3B3ITJ8_HUMAN Myelin transcription factor 1-like protein OS=Homo sapiens OX=9606 GN=MYT1L PE=1 SV=1	222	SEMNSNTSNSLE
REMISNTSKSLE	sp|P18377|K4_VACCW	32	tr|A0A3B3IRT9|A0A3B3IRT9_HUMAN Myelin transcription factor 1-like protein OS=Homo sapiens OX=9606 GN=MYT1L PE=1 SV=1	202	SEMNSNTSNSLE
REMISNTSKSLE	sp|P18377|K4_VACCW	32	tr|A0A3B3ISW5|A0A3B3ISW5_HUMAN Myelin transcription factor 1-like protein OS=Homo sapiens OX=9606 GN=MYT1L PE=1 SV=1	223	SEMNSNTSNSLE
LGLCICLLDIFK	sp|Q01220|A52_VACCW	138	tr|E7ERZ2|E7ERZ2_HUMAN DNA-directed RNA polymerase III subunit RPC8 OS=Homo sapiens OX=9606 GN=POLR3H PE=1 SV=1	42	VGLCICLFDITK
LGLCICLLDIFK	sp|Q01220|A52_VACCW	138	tr|F8WDV1|F8WDV1_HUMAN DNA-directed RNA polymerase III subunit RPC8 OS=Homo sapiens OX=9606 GN=POLR3H PE=1 SV=1	42	VGLCICLFDITK
LGLCICLLDIFK	sp|Q01220|A52_VACCW	138	sp|Q9Y535|RPC8_HUMAN DNA-directed RNA polymerase III subunit RPC8 OS=Homo sapiens OX=9606 GN=POLR3H PE=1 SV=1	42	VGLCICLFDITK
ILETTSDVENIS	sp|P68619|A36_VACCW	70	sp|Q86VD1|MORC1_HUMAN MORC family CW-type zinc finger protein 1 OS=Homo sapiens OX=9606 GN=MORC1 PE=2 SV=2	625	IEETDSDVEYIS
TLSRELIDYLYY	sp|P68438|RAP94_VACCW	754	sp|Q9Y3C1|NOP16_HUMAN Nucleolar protein 16 OS=Homo sapiens OX=9606 GN=NOP16 PE=1 SV=2	110	TLSRDLIDYVRY
TLSRELIDYLYY	sp|P68438|RAP94_VACCW	754	tr|A0A087X2G6|A0A087X2G6_HUMAN Nucleolar protein 16 OS=Homo sapiens OX=9606 GN=NOP16 PE=1 SV=1	110	TLSRDLIDYVRY
TLSRELIDYLYY	sp|P68438|RAP94_VACCW	754	tr|A0A0C4DGU5|A0A0C4DGU5_HUMAN Nucleolar protein 16 OS=Homo sapiens OX=9606 GN=NOP16 PE=1 SV=1	110	TLSRDLIDYVRY
TLSRELIDYLYY	sp|P68438|RAP94_VACCW	754	tr|D6RIC3|D6RIC3_HUMAN Nucleolar protein 16 OS=Homo sapiens OX=9606 GN=NOP16 PE=1 SV=1	110	TLSRDLIDYVRY
TLEPGYYLYIPI	sp|P68710|A20_VACCW	70	tr|H3BU60|H3BU60_HUMAN Pyruvate dehydrogenase phosphatase regulatory subunit, mitochondrial (Fragment) OS=Homo sapiens OX=9606 GN=PDPR PE=1 SV=1	30	TGEPGFMLYIPI
TLEPGYYLYIPI	sp|P68710|A20_VACCW	70	tr|H3BV59|H3BV59_HUMAN Pyruvate dehydrogenase phosphatase regulatory subunit, mitochondrial (Fragment) OS=Homo sapiens OX=9606 GN=PDPR PE=1 SV=1	30	TGEPGFMLYIPI
TLEPGYYLYIPI	sp|P68710|A20_VACCW	70	tr|H3BUH3|H3BUH3_HUMAN Pyruvate dehydrogenase phosphatase regulatory subunit, mitochondrial (Fragment) OS=Homo sapiens OX=9606 GN=PDPR PE=1 SV=1	55	TGEPGFMLYIPI
TLEPGYYLYIPI	sp|P68710|A20_VACCW	70	sp|Q8NCN5|PDPR_HUMAN Pyruvate dehydrogenase phosphatase regulatory subunit, mitochondrial OS=Homo sapiens OX=9606 GN=PDPR PE=1 SV=2	672	TGEPGFMLYIPI
TLEPGYYLYIPI	sp|P68710|A20_VACCW	70	tr|A8MT40|A8MT40_HUMAN Pyruvate dehydrogenase phosphatase regulatory subunit, mitochondrial OS=Homo sapiens OX=9606 GN=PDPR PE=1 SV=2	572	TGEPGFMLYIPI
TLEPGYYLYIPI	sp|P68710|A20_VACCW	70	tr|B7ZAR9|B7ZAR9_HUMAN Pyruvate dehydrogenase phosphatase regulatory subunit, mitochondrial OS=Homo sapiens OX=9606 GN=PDPR PE=1 SV=1	30	TGEPGFMLYIPI
EYQMELEKEKAK	sp|Q80HV0|ATI2_VACCW	63	tr|H7BYL6|H7BYL6_HUMAN A-kinase anchor protein 9 (Fragment) OS=Homo sapiens OX=9606 GN=AKAP9 PE=1 SV=1	1065	ELQWALEKEKAK
EYQMELEKEKAK	sp|Q80HV0|ATI2_VACCW	63	sp|Q99996|AKAP9_HUMAN A-kinase anchor protein 9 OS=Homo sapiens OX=9606 GN=AKAP9 PE=1 SV=4	3219	ELQWALEKEKAK
EYQMELEKEKAK	sp|Q80HV0|ATI2_VACCW	63	tr|A0A0A0MRF6|A0A0A0MRF6_HUMAN A-kinase anchor protein 9 OS=Homo sapiens OX=9606 GN=AKAP9 PE=1 SV=1	3222	ELQWALEKEKAK
SSCSPGNNYRPD	sp|P68638|VCP_VACCW	246	tr|H0YLC5|H0YLC5_HUMAN POU domain, class 2, transcription factor 3 (Fragment) OS=Homo sapiens OX=9606 GN=POU2F3 PE=4 SV=9	118	SSCSPGNNSRPS
SSCSPGNNYRPD	sp|P68638|VCP_VACCW	246	sp|Q9UKI9|PO2F3_HUMAN POU domain, class 2, transcription factor 3 OS=Homo sapiens OX=9606 GN=POU2F3 PE=2 SV=3	381	SSCSPGNNSRPS
NLLSQAIIKQYY	sp|Q80HX0|G5_VACCW	269	sp|Q9NQS7|INCE_HUMAN Inner centromere protein OS=Homo sapiens OX=9606 GN=INCENP PE=1 SV=3	849	TPLSQAIIHQYY
TNQTVNEIDLLK	sp|P17366|P28_VACCW	145	sp|O75351|VPS4B_HUMAN Vacuolar protein sorting-associated protein 4B OS=Homo sapiens OX=9606 GN=VPS4B PE=1 SV=2	421	TKPTVNEHDLLK
NLDLLRVRRKFA	sp|P07614|L3_VACCW	263	sp|Q8N9V2|TRIML_HUMAN Probable E3 ubiquitin-protein ligase TRIML1 OS=Homo sapiens OX=9606 GN=TRIML1 PE=2 SV=1	142	ILNLLRVRRKEA
EEVSLPEDDYII	sp|P24357|F3_VACCW	175	sp|Q86X55|CARM1_HUMAN Histone-arginine methyltransferase CARM1 OS=Homo sapiens OX=9606 GN=CARM1 PE=1 SV=3	243	EEVSLPEQVDII
EEVSLPEDDYII	sp|P24357|F3_VACCW	175	tr|K7EQA8|K7EQA8_HUMAN Coactivator-associated arginine methyltransferase 1 (Fragment) OS=Homo sapiens OX=9606 GN=CARM1 PE=1 SV=1	202	EEVSLPEQVDII
LAKALGTLNITL	sp|P18380|K5_VACCW	52	tr|H3BMN1|H3BMN1_HUMAN Arginine/serine-rich protein 1 (Fragment) OS=Homo sapiens OX=9606 GN=RSRP1 PE=1 SV=1	44	AAKALGTTNIDL
LAKALGTLNITL	sp|P18380|K5_VACCW	52	sp|Q9BUV0|RSRP1_HUMAN Arginine/serine-rich protein 1 OS=Homo sapiens OX=9606 GN=RSRP1 PE=1 SV=2	186	AAKALGTTNIDL
LAKALGTLNITL	sp|P18380|K5_VACCW	52	tr|H3BP33|H3BP33_HUMAN Arginine/serine-rich protein 1 (Fragment) OS=Homo sapiens OX=9606 GN=RSRP1 PE=1 SV=1	79	AAKALGTTNIDL
LAKALGTLNITL	sp|P18380|K5_VACCW	52	tr|H3BTJ0|H3BTJ0_HUMAN Arginine/serine-rich protein 1 OS=Homo sapiens OX=9606 GN=RSRP1 PE=1 SV=1	186	AAKALGTTNIDL
NAMNSLRQSNKL	sp|P68615|A32_VACCW	188	tr|J3QSX3|J3QSX3_HUMAN Kelch-like protein 12 (Fragment) OS=Homo sapiens OX=9606 GN=KLHL12 PE=1 SV=1	59	NSMNSLRKSNTL
NAMNSLRQSNKL	sp|P68615|A32_VACCW	188	sp|Q53G59|KLH12_HUMAN Kelch-like protein 12 OS=Homo sapiens OX=9606 GN=KLHL12 PE=1 SV=2	21	NSMNSLRKSNTL
TVKDLAVSYKEK	sp|P29192|A6_VACCW	355	sp|Q76KP1|B4GN4_HUMAN N-acetyl-beta-glucosaminyl-glycoprotein 4-beta-N-acetylgalactosaminyltransferase 1 OS=Homo sapiens OX=9606 GN=B4GALNT4 PE=1 SV=1	152	TVKKLAVSPKWK
SARYLDNGGNKR	sp|P12848|RIR1_VACCW	282	tr|H0YCY7|H0YCY7_HUMAN Ribonucleoside-diphosphate reductase (Fragment) OS=Homo sapiens OX=9606 GN=RRM1 PE=1 SV=1	95	TARYVDQGGNKR
SARYLDNGGNKR	sp|P12848|RIR1_VACCW	282	sp|P23921|RIR1_HUMAN Ribonucleoside-diphosphate reductase large subunit OS=Homo sapiens OX=9606 GN=RRM1 PE=1 SV=1	282	TARYVDQGGNKR
SARYLDNGGNKR	sp|P12848|RIR1_VACCW	282	tr|E9PL69|E9PL69_HUMAN Ribonucleoside-diphosphate reductase large subunit OS=Homo sapiens OX=9606 GN=RRM1 PE=1 SV=1	60	TARYVDQGGNKR
FFIVLRIVLSIM	sp|Q85320|A9_VACCW	45	sp|Q9UBU6|FA8A1_HUMAN Protein FAM8A1 OS=Homo sapiens OX=9606 GN=FAM8A1 PE=1 SV=1	261	FFIKATIVLSIM
CRSYVSKTVLKD	sp|P05807|NTP1_VACCW	143	tr|A0A5F9ZI66|A0A5F9ZI66_HUMAN Acetyl-CoA acetyltransferase, mitochondrial OS=Homo sapiens OX=9606 GN=ACAT1 PE=1 SV=1	30	ERSYVSKPTLKD
VWIRHTNGFTIQ	sp|Q805M1|C20L_VACCW	50	tr|R4GNB1|R4GNB1_HUMAN Beta-alanine-activating enzyme OS=Homo sapiens OX=9606 GN=AASDH PE=1 SV=2	231	VEVRDTNGFTIQ
VWIRHTNGFTIQ	sp|Q805M1|C20L_VACCW	50	sp|Q4L235|ACSF4_HUMAN Beta-alanine-activating enzyme OS=Homo sapiens OX=9606 GN=AASDH PE=1 SV=3	384	VEVRDTNGFTIQ
ISDSIESGMQVV	sp|Q80HT9|KTHY_VACCW	79	sp|Q9NU39|FX4L1_HUMAN Forkhead box protein D4-like 1 OS=Homo sapiens OX=9606 GN=FOXD4L1 PE=1 SV=1	322	ISFSIESIMQGV
NEYVAHKTEIIK	sp|P04298|MCEL_VACCW	762	tr|A0A0U1RQK2|A0A0U1RQK2_HUMAN Casein kinase I isoform gamma-1 (Fragment) OS=Homo sapiens OX=9606 GN=CSNK1G1 PE=1 SV=1	67	NEYVAIKLEPIK
NEYVAHKTEIIK	sp|P04298|MCEL_VACCW	762	tr|A0A0U1RR14|A0A0U1RR14_HUMAN Casein kinase I isoform gamma-1 (Fragment) OS=Homo sapiens OX=9606 GN=CSNK1G1 PE=1 SV=1	67	NEYVAIKLEPIK
NEYVAHKTEIIK	sp|P04298|MCEL_VACCW	762	tr|A0A0U1RQY7|A0A0U1RQY7_HUMAN Non-specific serine/threonine protein kinase OS=Homo sapiens OX=9606 GN=CSNK1G1 PE=1 SV=1	67	NEYVAIKLEPIK
NEYVAHKTEIIK	sp|P04298|MCEL_VACCW	762	tr|U3KQB3|U3KQB3_HUMAN Non-specific serine/threonine protein kinase OS=Homo sapiens OX=9606 GN=CSNK1G1 PE=1 SV=1	67	NEYVAIKLEPIK
NEYVAHKTEIIK	sp|P04298|MCEL_VACCW	762	tr|U3KQA5|U3KQA5_HUMAN Non-specific serine/threonine protein kinase OS=Homo sapiens OX=9606 GN=CSNK1G1 PE=1 SV=2	67	NEYVAIKLEPIK
NEYVAHKTEIIK	sp|P04298|MCEL_VACCW	762	sp|Q9HCP0|KC1G1_HUMAN Casein kinase I isoform gamma-1 OS=Homo sapiens OX=9606 GN=CSNK1G1 PE=1 SV=1	67	NEYVAIKLEPIK
NEYVAHKTEIIK	sp|P04298|MCEL_VACCW	762	tr|Q8IXA3|Q8IXA3_HUMAN Non-specific serine/threonine protein kinase OS=Homo sapiens OX=9606 GN=CSNK1G1 PE=1 SV=2	67	NEYVAIKLEPIK
NEYVAHKTEIIK	sp|P04298|MCEL_VACCW	762	tr|A0A0U1RQT7|A0A0U1RQT7_HUMAN Non-specific serine/threonine protein kinase OS=Homo sapiens OX=9606 GN=CSNK1G1 PE=1 SV=1	67	NEYVAIKLEPIK
NEYVAHKTEIIK	sp|P04298|MCEL_VACCW	762	sp|P78368|KC1G2_HUMAN Casein kinase I isoform gamma-2 OS=Homo sapiens OX=9606 GN=CSNK1G2 PE=1 SV=1	69	NEYVAIKLEPIK
NKLPISKLKGVE	sp|P04298|MCEL_VACCW	78	sp|Q9NY47|CA2D2_HUMAN Voltage-dependent calcium channel subunit alpha-2/delta-2 OS=Homo sapiens OX=9606 GN=CACNA2D2 PE=1 SV=2	660	VKLPISKLKDFE
NKLPISKLKGVE	sp|P04298|MCEL_VACCW	78	tr|C9JVC9|C9JVC9_HUMAN Voltage-dependent calcium channel subunit alpha-2/delta-2 OS=Homo sapiens OX=9606 GN=CACNA2D2 PE=1 SV=1	660	VKLPISKLKDFE
IIVRKGEDINKI	sp|Q01219|A51_VACCW	11	tr|M0QXW7|M0QXW7_HUMAN Far upstream element-binding protein 2 (Fragment) OS=Homo sapiens OX=9606 GN=KHSRP PE=1 SV=1	15	IIGRGGEQINKI
IIVRKGEDINKI	sp|Q01219|A51_VACCW	11	tr|M0QYH3|M0QYH3_HUMAN Far upstream element-binding protein 2 (Fragment) OS=Homo sapiens OX=9606 GN=KHSRP PE=1 SV=1	15	IIGRGGEQINKI
IIVRKGEDINKI	sp|Q01219|A51_VACCW	11	tr|A0A087WTP3|A0A087WTP3_HUMAN Far upstream element-binding protein 2 OS=Homo sapiens OX=9606 GN=KHSRP PE=1 SV=1	159	IIGRGGEQINKI
IIVRKGEDINKI	sp|Q01219|A51_VACCW	11	sp|Q92945|FUBP2_HUMAN Far upstream element-binding protein 2 OS=Homo sapiens OX=9606 GN=KHSRP PE=1 SV=4	159	IIGRGGEQINKI
GKIVYFTIPVPY	sp|P17368|C1_VACCW	171	sp|P48029|SC6A8_HUMAN Sodium- and chloride-dependent creatine transporter 1 OS=Homo sapiens OX=9606 GN=SLC6A8 PE=1 SV=1	258	GKIVYFTATFPY
KKTKTVKHVGIL	sp|P16913|B1_VACCW	70	tr|E7EQI1|E7EQI1_HUMAN Phosphatidylcholine translocator ABCB4 (Fragment) OS=Homo sapiens OX=9606 GN=ABCB4 PE=1 SV=1	32	KKTKTVKMIGVL
KKTKTVKHVGIL	sp|P16913|B1_VACCW	70	sp|P21439|MDR3_HUMAN Phosphatidylcholine translocator ABCB4 OS=Homo sapiens OX=9606 GN=ABCB4 PE=1 SV=2	32	KKTKTVKMIGVL
KKTKTVKHVGIL	sp|P16913|B1_VACCW	70	tr|A0A2R8Y8A1|A0A2R8Y8A1_HUMAN Phosphatidylcholine translocator ABCB4 (Fragment) OS=Homo sapiens OX=9606 GN=ABCB4 PE=1 SV=1	13	KKTKTVKMIGVL
KKTKTVKHVGIL	sp|P16913|B1_VACCW	70	tr|A0A2R8Y291|A0A2R8Y291_HUMAN Phosphatidylcholine translocator ABCB4 OS=Homo sapiens OX=9606 GN=ABCB4 PE=1 SV=1	32	KKTKTVKMIGVL
QATSKLLEGTNI	sp|P05807|NTP1_VACCW	570	tr|F8WCE2|F8WCE2_HUMAN Protein shisa-5 OS=Homo sapiens OX=9606 GN=SHISA5 PE=4 SV=1	39	QAGLKLLEGTDI
TSPRASYSRDSS	sp|P18380|K5_VACCW	117	sp|Q4ADV7|RIC1_HUMAN Guanine nucleotide exchange factor subunit RIC1 OS=Homo sapiens OX=9606 GN=RIC1 PE=1 SV=2	1370	TSPRAEESRGSS
TSPRASYSRDSS	sp|P18380|K5_VACCW	117	tr|H0YFN7|H0YFN7_HUMAN Protein RIC1 homolog (Fragment) OS=Homo sapiens OX=9606 GN=RIC1 PE=1 SV=1	1262	TSPRAEESRGSS
MHSGMSGGVHSG	sp|P17356|V018_VACCW	45	tr|K7EQQ3|K7EQQ3_HUMAN Keratin, type I cytoskeletal 9 OS=Homo sapiens OX=9606 GN=KRT9 PE=1 SV=1	308	GHSGGSGGGHSG
MHSGMSGGVHSG	sp|P17356|V018_VACCW	45	sp|P35527|K1C9_HUMAN Keratin, type I cytoskeletal 9 OS=Homo sapiens OX=9606 GN=KRT9 PE=1 SV=3	541	GHSGGSGGGHSG
DLLDLVNILSEL	sp|P68707|F14_VACCW	36	sp|Q9NR09|BIRC6_HUMAN Baculoviral IAP repeat-containing protein 6 OS=Homo sapiens OX=9606 GN=BIRC6 PE=1 SV=2	2921	DLLKLVNILVQL
DLLDLVNILSEL	sp|P68707|F14_VACCW	36	tr|A0A3B3IUB9|A0A3B3IUB9_HUMAN Baculoviral IAP repeat-containing protein 6 (Fragment) OS=Homo sapiens OX=9606 GN=BIRC6 PE=1 SV=1	2850	DLLKLVNILVQL
SSSTASNNNESN	sp|Q85320|A9_VACCW	76	tr|J3QRS9|J3QRS9_HUMAN BUB3-interacting and GLEBS motif-containing protein ZNF207 OS=Homo sapiens OX=9606 GN=ZNF207 PE=1 SV=1	283	SSSTASSNSESL
SSSTASNNNESN	sp|Q85320|A9_VACCW	76	tr|J3KS31|J3KS31_HUMAN BUB3-interacting and GLEBS motif-containing protein ZNF207 (Fragment) OS=Homo sapiens OX=9606 GN=ZNF207 PE=1 SV=1	130	SSSTASSNSESL
SSSTASNNNESN	sp|Q85320|A9_VACCW	76	sp|O43670|ZN207_HUMAN BUB3-interacting and GLEBS motif-containing protein ZNF207 OS=Homo sapiens OX=9606 GN=ZNF207 PE=1 SV=1	267	SSSTASSNSESL
SSSTASNNNESN	sp|Q85320|A9_VACCW	76	tr|X6R4W8|X6R4W8_HUMAN BUB3-interacting and GLEBS motif-containing protein ZNF207 OS=Homo sapiens OX=9606 GN=ZNF207 PE=1 SV=1	286	SSSTASSNSESL
VLIENLYLSSMP	sp|Q80HX7|F11_VACCW	56	tr|I3L3H4|I3L3H4_HUMAN Tubulin-specific chaperone D (Fragment) OS=Homo sapiens OX=9606 GN=TBCD PE=1 SV=1	120	VLIEKLSLSKMP
VLIENLYLSSMP	sp|Q80HX7|F11_VACCW	56	tr|I3L131|I3L131_HUMAN Tubulin-specific chaperone D (Fragment) OS=Homo sapiens OX=9606 GN=TBCD PE=1 SV=2	120	VLIEKLSLSKMP
VLIENLYLSSMP	sp|Q80HX7|F11_VACCW	56	tr|I3L143|I3L143_HUMAN Tubulin-specific chaperone D (Fragment) OS=Homo sapiens OX=9606 GN=TBCD PE=1 SV=1	168	VLIEKLSLSKMP
VLIENLYLSSMP	sp|Q80HX7|F11_VACCW	56	tr|I3L1S3|I3L1S3_HUMAN Tubulin-specific chaperone D (Fragment) OS=Homo sapiens OX=9606 GN=TBCD PE=1 SV=1	74	VLIEKLSLSKMP
VLIENLYLSSMP	sp|Q80HX7|F11_VACCW	56	tr|I3L500|I3L500_HUMAN Tubulin-specific chaperone D (Fragment) OS=Homo sapiens OX=9606 GN=TBCD PE=1 SV=1	141	VLIEKLSLSKMP
VLIENLYLSSMP	sp|Q80HX7|F11_VACCW	56	tr|I3L163|I3L163_HUMAN Tubulin-specific chaperone D (Fragment) OS=Homo sapiens OX=9606 GN=TBCD PE=1 SV=1	120	VLIEKLSLSKMP
VLIENLYLSSMP	sp|Q80HX7|F11_VACCW	56	tr|I3L439|I3L439_HUMAN Tubulin-specific chaperone D (Fragment) OS=Homo sapiens OX=9606 GN=TBCD PE=1 SV=1	120	VLIEKLSLSKMP
VLIENLYLSSMP	sp|Q80HX7|F11_VACCW	56	tr|J3KR97|J3KR97_HUMAN Tubulin-specific chaperone D OS=Homo sapiens OX=9606 GN=TBCD PE=1 SV=1	682	VLIEKLSLSKMP
VLIENLYLSSMP	sp|Q80HX7|F11_VACCW	56	sp|Q9BTW9|TBCD_HUMAN Tubulin-specific chaperone D OS=Homo sapiens OX=9606 GN=TBCD PE=1 SV=2	682	VLIEKLSLSKMP
KTIFTLSSDNIL	sp|P29192|A6_VACCW	200	sp|Q04656|ATP7A_HUMAN Copper-transporting ATPase 1 OS=Homo sapiens OX=9606 GN=ATP7A PE=1 SV=4	820	ATIVTLDSDNIL
TSKSIDLFAPKY	sp|P15058|SPI1_VACCW	239	tr|F5H212|F5H212_HUMAN Zinc finger protein 40 OS=Homo sapiens OX=9606 GN=HIVEP1 PE=1 SV=2	1549	SSKSEDCFAPKY
TSKSIDLFAPKY	sp|P15058|SPI1_VACCW	239	sp|P15822|ZEP1_HUMAN Zinc finger protein 40 OS=Homo sapiens OX=9606 GN=HIVEP1 PE=1 SV=3	1549	SSKSEDCFAPKY
EPGYYLYIPIYY	sp|P68710|A20_VACCW	72	tr|H3BU60|H3BU60_HUMAN Pyruvate dehydrogenase phosphatase regulatory subunit, mitochondrial (Fragment) OS=Homo sapiens OX=9606 GN=PDPR PE=1 SV=1	32	EPGFMLYIPIEY
EPGYYLYIPIYY	sp|P68710|A20_VACCW	72	tr|H3BV59|H3BV59_HUMAN Pyruvate dehydrogenase phosphatase regulatory subunit, mitochondrial (Fragment) OS=Homo sapiens OX=9606 GN=PDPR PE=1 SV=1	32	EPGFMLYIPIEY
EPGYYLYIPIYY	sp|P68710|A20_VACCW	72	tr|H3BUH3|H3BUH3_HUMAN Pyruvate dehydrogenase phosphatase regulatory subunit, mitochondrial (Fragment) OS=Homo sapiens OX=9606 GN=PDPR PE=1 SV=1	57	EPGFMLYIPIEY
EPGYYLYIPIYY	sp|P68710|A20_VACCW	72	sp|Q8NCN5|PDPR_HUMAN Pyruvate dehydrogenase phosphatase regulatory subunit, mitochondrial OS=Homo sapiens OX=9606 GN=PDPR PE=1 SV=2	674	EPGFMLYIPIEY
EPGYYLYIPIYY	sp|P68710|A20_VACCW	72	tr|A8MT40|A8MT40_HUMAN Pyruvate dehydrogenase phosphatase regulatory subunit, mitochondrial OS=Homo sapiens OX=9606 GN=PDPR PE=1 SV=2	574	EPGFMLYIPIEY
EPGYYLYIPIYY	sp|P68710|A20_VACCW	72	tr|B7ZAR9|B7ZAR9_HUMAN Pyruvate dehydrogenase phosphatase regulatory subunit, mitochondrial OS=Homo sapiens OX=9606 GN=PDPR PE=1 SV=1	32	EPGFMLYIPIEY
APPSSLGGSSSS	sp|Q01218|HEMA_VACCW	256	sp|O60346|PHLP1_HUMAN PH domain leucine-rich repeat-containing protein phosphatase 1 OS=Homo sapiens OX=9606 GN=PHLPP1 PE=1 SV=3	364	DPYSSGGGSSSS
APPSSLGGSSSS	sp|Q01218|HEMA_VACCW	256	tr|A0A0U1RR70|A0A0U1RR70_HUMAN Serine/threonine-protein kinase DCLK2 OS=Homo sapiens OX=9606 GN=DCLK2 PE=1 SV=1	26	GAPSSSGGSSSS
APPSSLGGSSSS	sp|Q01218|HEMA_VACCW	256	tr|G5E9L9|G5E9L9_HUMAN Doublecortin and CaM kinase-like 2, isoform CRA_c OS=Homo sapiens OX=9606 GN=DCLK2 PE=1 SV=1	26	GAPSSSGGSSSS
APPSSLGGSSSS	sp|Q01218|HEMA_VACCW	256	sp|Q8N568|DCLK2_HUMAN Serine/threonine-protein kinase DCLK2 OS=Homo sapiens OX=9606 GN=DCLK2 PE=1 SV=4	26	GAPSSSGGSSSS
APPSSLGGSSSS	sp|Q01218|HEMA_VACCW	256	sp|Q75VX8|GARE2_HUMAN GRB2-associated and regulator of MAPK protein 2 OS=Homo sapiens OX=9606 GN=GAREM2 PE=1 SV=3	678	APPSSCAPSSSS
LSKYFEDISLYI	sp|P07239|DUSP_VACCW	85	sp|P28288|ABCD3_HUMAN ATP-binding cassette sub-family D member 3 OS=Homo sapiens OX=9606 GN=ABCD3 PE=1 SV=1	207	LSKPFLDIVLYI
LSKYFEDISLYI	sp|P07239|DUSP_VACCW	85	tr|A0A3B3ITW3|A0A3B3ITW3_HUMAN ATP-binding cassette sub-family D member 3 OS=Homo sapiens OX=9606 GN=ABCD3 PE=1 SV=2	207	LSKPFLDIVLYI
VAMFNIEKLENE	sp|Q89121|VPK2_VACCW	255	sp|Q9P1Z9|CC180_HUMAN Coiled-coil domain-containing protein 180 OS=Homo sapiens OX=9606 GN=CCDC180 PE=2 SV=3	1078	VIMLNMEKLENE
VAMFNIEKLENE	sp|Q89121|VPK2_VACCW	255	tr|A0A6E1Y6F7|A0A6E1Y6F7_HUMAN Coiled-coil domain-containing protein 180 OS=Homo sapiens OX=9606 GN=CCDC180 PE=1 SV=1	1034	VIMLNMEKLENE
YNKAITVRDKYY	sp|P07392|RP147_VACCW	166	sp|Q96GN5|CDA7L_HUMAN Cell division cycle-associated 7-like protein OS=Homo sapiens OX=9606 GN=CDCA7L PE=1 SV=2	334	ENVAITVRDKIY
YERSIDGNVPRI	sp|P06856|DPOL_VACCW	615	sp|P17301|ITA2_HUMAN Integrin alpha-2 OS=Homo sapiens OX=9606 GN=ITGA2 PE=1 SV=1	949	YEISSDGNVPSI
LDEELMDDDDFN	sp|P24758|A26_VACCW	367	tr|A0A087WWS8|A0A087WWS8_HUMAN Protein AATF (Fragment) OS=Homo sapiens OX=9606 GN=AATF PE=1 SV=1	91	LDEEIFDDDDFY
LDEELMDDDDFN	sp|P24758|A26_VACCW	367	sp|Q9NY61|AATF_HUMAN Protein AATF OS=Homo sapiens OX=9606 GN=AATF PE=1 SV=1	453	LDEEIFDDDDFY
LDEELMDDDDFN	sp|P24758|A26_VACCW	367	tr|A0A087WTH8|A0A087WTH8_HUMAN Protein AATF (Fragment) OS=Homo sapiens OX=9606 GN=AATF PE=1 SV=1	15	LDEEIFDDDDFY
NVQTSSTSVLSS	sp|Q80HV3|RUVV_VACCW	3	sp|Q8NHV4|NEDD1_HUMAN Protein NEDD1 OS=Homo sapiens OX=9606 GN=NEDD1 PE=1 SV=1	448	NPVTSSTSVLHS
NVQTSSTSVLSS	sp|Q80HV3|RUVV_VACCW	3	tr|A2A2F0|A2A2F0_HUMAN Ral GTPase-activating protein subunit beta (Fragment) OS=Homo sapiens OX=9606 GN=RALGAPB PE=1 SV=1	238	QHQTSSTSPLSS
NVQTSSTSVLSS	sp|Q80HV3|RUVV_VACCW	3	sp|Q86X10|RLGPB_HUMAN Ral GTPase-activating protein subunit beta OS=Homo sapiens OX=9606 GN=RALGAPB PE=1 SV=1	410	QHQTSSTSPLSS
DAIFRQILITSR	sp|P06856|DPOL_VACCW	792	sp|P62277|RS13_HUMAN 40S ribosomal protein S13 OS=Homo sapiens OX=9606 GN=RPS13 PE=1 SV=2	110	DAKFRLILIESR
NRDIKEKREATS	sp|P24759|ATI_VACCW	466	sp|A6NJZ7|RIM3C_HUMAN RIMS-binding protein 3C OS=Homo sapiens OX=9606 GN=RIMBP3C PE=1 SV=3	738	NRDIQEKREASL
NRDIKEKREATS	sp|P24759|ATI_VACCW	466	tr|J3KP16|J3KP16_HUMAN RIMS-binding protein 3C OS=Homo sapiens OX=9606 GN=RIMBP3C PE=3 SV=1	644	NRDIQEKREASL
NRDIKEKREATS	sp|P24759|ATI_VACCW	466	sp|A6NNM3|RIM3B_HUMAN RIMS-binding protein 3B OS=Homo sapiens OX=9606 GN=RIMBP3B PE=3 SV=3	738	NRDIQEKREASL
NRDIKEKREATS	sp|P24759|ATI_VACCW	466	sp|Q9UFD9|RIM3A_HUMAN RIMS-binding protein 3A OS=Homo sapiens OX=9606 GN=RIMBP3 PE=1 SV=4	738	NRDIQEKREASL
IGIPVLLLLIVD	sp|P24759|ATI_VACCW	146	sp|Q8TD43|TRPM4_HUMAN Transient receptor potential cation channel subfamily M member 4 OS=Homo sapiens OX=9606 GN=TRPM4 PE=1 SV=1	269	IDIPVLLLLIDG
DMLKSNKIEELM	sp|P04297|K1_VACCW	256	sp|Q6ZUJ8|BCAP_HUMAN Phosphoinositide 3-kinase adapter protein 1 OS=Homo sapiens OX=9606 GN=PIK3AP1 PE=1 SV=2	399	DMLKSHIKEELM
FKLSMNLVSLLA	sp|Q80HX1|O1_VACCW	648	tr|H0YB38|H0YB38_HUMAN Golgi-resident adenosine 3',5'-bisphosphate 3'-phosphatase (Fragment) OS=Homo sapiens OX=9606 GN=BPNT2 PE=1 SV=1	61	NKLVMQLVSLLA
YKRDLSRDRSRL	sp|Q80HU9|ATI4_VACCW	129	tr|A0A3B3IRV6|A0A3B3IRV6_HUMAN Tight junction protein ZO-2 (Fragment) OS=Homo sapiens OX=9606 GN=TJP2 PE=1 SV=1	164	RERDLSRDRSRG
YKRDLSRDRSRL	sp|Q80HU9|ATI4_VACCW	129	tr|A0A3B3ISZ5|A0A3B3ISZ5_HUMAN Tight junction protein ZO-2 OS=Homo sapiens OX=9606 GN=TJP2 PE=1 SV=1	187	RERDLSRDRSRG
YKRDLSRDRSRL	sp|Q80HU9|ATI4_VACCW	129	tr|A0A3B3ISF1|A0A3B3ISF1_HUMAN Tight junction protein ZO-2 OS=Homo sapiens OX=9606 GN=TJP2 PE=1 SV=1	187	RERDLSRDRSRG
YKRDLSRDRSRL	sp|Q80HU9|ATI4_VACCW	129	tr|A0A3B3IU51|A0A3B3IU51_HUMAN Tight junction protein ZO-2 OS=Homo sapiens OX=9606 GN=TJP2 PE=1 SV=1	191	RERDLSRDRSRG
YKRDLSRDRSRL	sp|Q80HU9|ATI4_VACCW	129	tr|A0A3B3IRI3|A0A3B3IRI3_HUMAN Tight junction protein ZO-2 OS=Homo sapiens OX=9606 GN=TJP2 PE=1 SV=1	164	RERDLSRDRSRG
YKRDLSRDRSRL	sp|Q80HU9|ATI4_VACCW	129	tr|A0A1B0GTW1|A0A1B0GTW1_HUMAN Tight junction protein ZO-2 OS=Homo sapiens OX=9606 GN=TJP2 PE=1 SV=1	246	RERDLSRDRSRG
YKRDLSRDRSRL	sp|Q80HU9|ATI4_VACCW	129	sp|Q9UDY2|ZO2_HUMAN Tight junction protein ZO-2 OS=Homo sapiens OX=9606 GN=TJP2 PE=1 SV=2	187	RERDLSRDRSRG
YKRDLSRDRSRL	sp|Q80HU9|ATI4_VACCW	129	tr|A0A3B3ITE1|A0A3B3ITE1_HUMAN Tight junction protein ZO-2 (Fragment) OS=Homo sapiens OX=9606 GN=TJP2 PE=1 SV=1	188	RERDLSRDRSRG
YKRDLSRDRSRL	sp|Q80HU9|ATI4_VACCW	129	tr|A0A2R8YDH4|A0A2R8YDH4_HUMAN Uncharacterized protein OS=Homo sapiens OX=9606 PE=1 SV=1	316	RERDLSRDRSRG
GDAARIASSQPI	sp|P04195|CAHH_VACCW	235	tr|A0A6I8PL36|A0A6I8PL36_HUMAN Cadherin EGF LAG seven-pass G-type receptor 1 (Fragment) OS=Homo sapiens OX=9606 GN=CELSR1 PE=1 SV=1	162	GGAARLASSQPP
GDAARIASSQPI	sp|P04195|CAHH_VACCW	235	tr|A0A6I8PRU0|A0A6I8PRU0_HUMAN Cadherin EGF LAG seven-pass G-type receptor 1 OS=Homo sapiens OX=9606 GN=CELSR1 PE=1 SV=2	2911	GGAARLASSQPP
GDAARIASSQPI	sp|P04195|CAHH_VACCW	235	sp|Q9NYQ6|CELR1_HUMAN Cadherin EGF LAG seven-pass G-type receptor 1 OS=Homo sapiens OX=9606 GN=CELSR1 PE=1 SV=1	2911	GGAARLASSQPP
NMVNKSNLDLLR	sp|P07614|L3_VACCW	257	sp|Q07864|DPOE1_HUMAN DNA polymerase epsilon catalytic subunit A OS=Homo sapiens OX=9606 GN=POLE PE=1 SV=5	2120	NQVNKLNRDLLR
NMVNKSNLDLLR	sp|P07614|L3_VACCW	257	tr|F5H1D6|F5H1D6_HUMAN DNA polymerase epsilon catalytic subunit OS=Homo sapiens OX=9606 GN=POLE PE=1 SV=1	2093	NQVNKLNRDLLR
LLYWVHVVGGYD	sp|Q01225|POXIN_VACCW	2	sp|Q6TFL4|KLH24_HUMAN Kelch-like protein 24 OS=Homo sapiens OX=9606 GN=KLHL24 PE=1 SV=1	405	LLGKVYVVGGYD
LPFDIMNFENPT	sp|P18380|K5_VACCW	17	sp|Q8TDW5|SYTL5_HUMAN Synaptotagmin-like protein 5 OS=Homo sapiens OX=9606 GN=SYTL5 PE=1 SV=1	512	IPFDSWNFENPT
QNSRFVIFLKKA	sp|P29192|A6_VACCW	228	sp|P49792|RBP2_HUMAN E3 SUMO-protein ligase RanBP2 OS=Homo sapiens OX=9606 GN=RANBP2 PE=1 SV=2	3168	NNSQFVITLKKA
EDDLLDPKLARV	sp|P06440|P4B_VACCW	325	tr|A0A1B0GTJ7|A0A1B0GTJ7_HUMAN Adenylosuccinate lyase OS=Homo sapiens OX=9606 GN=ADSL PE=1 SV=1	127	ALDLLLPKLARV
EDDLLDPKLARV	sp|P06440|P4B_VACCW	325	sp|P30566|PUR8_HUMAN Adenylosuccinate lyase OS=Homo sapiens OX=9606 GN=ADSL PE=1 SV=2	127	ALDLLLPKLARV
EDDLLDPKLARV	sp|P06440|P4B_VACCW	325	tr|A0A1B0GWJ0|A0A1B0GWJ0_HUMAN Adenylosuccinate lyase OS=Homo sapiens OX=9606 GN=ADSL PE=1 SV=1	127	ALDLLLPKLARV
EDDLLDPKLARV	sp|P06440|P4B_VACCW	325	tr|A0A1B0GWF8|A0A1B0GWF8_HUMAN Adenylosuccinase (Fragment) OS=Homo sapiens OX=9606 GN=ADSL PE=1 SV=1	127	ALDLLLPKLARV
VAPNANYLDVTK	sp|P16715|P4A_VACCW	333	sp|Q9UNG2|TNF18_HUMAN Tumor necrosis factor ligand superfamily member 18 OS=Homo sapiens OX=9606 GN=TNFSF18 PE=1 SV=2	123	VAPNANYNDVAP
LSNDVLEIADLK	sp|P68716|G7_VACCW	152	sp|P14410|SUIS_HUMAN Sucrase-isomaltase, intestinal OS=Homo sapiens OX=9606 GN=SI PE=1 SV=6	909	ASNQVLLIADLK
ASDFAKTLTSGR	sp|P15058|SPI1_VACCW	111	tr|A0A1W2PQ04|A0A1W2PQ04_HUMAN Tetraspanin-9 (Fragment) OS=Homo sapiens OX=9606 GN=TSPAN9 PE=1 SV=1	21	DSDFAKPSTSGR
