query	query_seqname	query_start	target_seqname	target_start	target
VVGISDLLSSIL	sp|P0C6U2|R1A_CVH22	2574	sp|Q9HA65|TBC17_HUMAN TBC1 domain family member 17 OS=Homo sapiens OX=9606 GN=TBC1D17 PE=1 SV=2	417	VQGMSDLLSPIL
VVGISDLLSSIL	sp|P0C6U2|R1A_CVH22	2574	tr|A0A087WXG5|A0A087WXG5_HUMAN TBC1 domain family member 17 OS=Homo sapiens OX=9606 GN=TBC1D17 PE=1 SV=1	68	VQGMSDLLSPIL
VVGISDLLSSIL	sp|P0C6U2|R1A_CVH22	2574	tr|M0R2L2|M0R2L2_HUMAN TBC1 domain family member 17 (Fragment) OS=Homo sapiens OX=9606 GN=TBC1D17 PE=1 SV=2	396	VQGMSDLLSPIL
VVGISDLLSSIL	sp|P0C6U2|R1A_CVH22	2574	tr|E9PQ18|E9PQ18_HUMAN XRCC1_N domain-containing protein OS=Homo sapiens OX=9606 GN=LOC100133315 PE=4 SV=2	192	VVGPSALLSSVL
VVGISDLLSSIL	sp|P0C6U2|R1A_CVH22	2574	tr|H0YEW9|H0YEW9_HUMAN XRCC1_N domain-containing protein (Fragment) OS=Homo sapiens OX=9606 GN=LOC100133315 PE=4 SV=1	123	VVGPSALLSSVL
VAVGGTLQALLS	sp|P0C6X1|R1AB_CVH22	442	tr|K7ENB5|K7ENB5_HUMAN BTB/POZ domain-containing protein KCTD9 OS=Homo sapiens OX=9606 GN=KCTD9 PE=1 SV=1	18	VAVYGTLSDLLS
VAVGGTLQALLS	sp|P0C6X1|R1AB_CVH22	442	sp|Q7L273|KCTD9_HUMAN BTB/POZ domain-containing protein KCTD9 OS=Homo sapiens OX=9606 GN=KCTD9 PE=1 SV=1	18	VAVYGTLSDLLS
VAVGGTLQALLS	sp|P0C6X1|R1AB_CVH22	442	tr|K7EQN1|K7EQN1_HUMAN BTB/POZ domain-containing protein KCTD9 OS=Homo sapiens OX=9606 GN=KCTD9 PE=1 SV=1	18	VAVYGTLSDLLS
LLDSDLLARPTM	sp|P0C6U2|R1A_CVH22	638	sp|Q9BSK4|FEM1A_HUMAN Protein fem-1 homolog A OS=Homo sapiens OX=9606 GN=FEM1A PE=1 SV=1	620	LLDEKLLARGTM
IGKHLKKDGDFE	sp|P0C6U2|R1A_CVH22	936	sp|O60437|PEPL_HUMAN Periplakin OS=Homo sapiens OX=9606 GN=PPL PE=1 SV=4	178	IGPHLAKDGDKE
DNLVRNVLADVE	sp|P0C6X1|R1AB_CVH22	4662	sp|P59827|BPIB4_HUMAN BPI fold-containing family B member 4 OS=Homo sapiens OX=9606 GN=BPIFB4 PE=2 SV=2	316	DNLVNRVLADVL
DNLVRNVLADVE	sp|P0C6X1|R1AB_CVH22	4662	tr|A0A669KBJ0|A0A669KBJ0_HUMAN BPI fold-containing family B member 4 OS=Homo sapiens OX=9606 GN=BPIFB4 PE=1 SV=1	438	DNLVNRVLADVL
IKMPQGILFNVI	sp|P0C6X1|R1AB_CVH22	6491	sp|P33527|MRP1_HUMAN Multidrug resistance-associated protein 1 OS=Homo sapiens OX=9606 GN=ABCC1 PE=1 SV=3	1091	IKMFMGSLFNVI
IKMPQGILFNVI	sp|P0C6X1|R1AB_CVH22	6491	tr|I3L4X2|I3L4X2_HUMAN Multidrug resistance-associated protein 1 (Fragment) OS=Homo sapiens OX=9606 GN=ABCC1 PE=1 SV=1	1000	IKMFMGSLFNVI
IKMPQGILFNVI	sp|P0C6X1|R1AB_CVH22	6491	tr|A0A0A0MS99|A0A0A0MS99_HUMAN Multidrug resistance-associated protein 1 OS=Homo sapiens OX=9606 GN=ABCC1 PE=1 SV=1	775	IKMFMGSLFNVI
RLVETLLVVLYK	sp|P0C6U2|R1A_CVH22	3690	sp|Q7Z434|MAVS_HUMAN Mitochondrial antiviral-signaling protein OS=Homo sapiens OX=9606 GN=MAVS PE=1 SV=2	525	VLVVTLLVVLYR
NAWQPLVVENEN	sp|P15130|NCAP_CVH22	23	tr|X6RKU3|X6RKU3_HUMAN F-box only protein 42 (Fragment) OS=Homo sapiens OX=9606 GN=FBXO42 PE=1 SV=7	40	WAWQPLKVENEE
NAWQPLVVENEN	sp|P15130|NCAP_CVH22	23	sp|Q6P3S6|FBX42_HUMAN F-box only protein 42 OS=Homo sapiens OX=9606 GN=FBXO42 PE=1 SV=1	322	WAWQPLKVENEE
LQTVKLTLDLTH	sp|P19739|NS4A_CVH22	18	sp|Q8IWW6|RHG12_HUMAN Rho GTPase-activating protein 12 OS=Homo sapiens OX=9606 GN=ARHGAP12 PE=1 SV=1	143	GQTVNLSLDLTH
LQTVKLTLDLTH	sp|P19739|NS4A_CVH22	18	tr|Q1RLN5|Q1RLN5_HUMAN ARHGAP12 protein OS=Homo sapiens OX=9606 GN=ARHGAP12 PE=1 SV=1	143	GQTVNLSLDLTH
GVTFIGEWANGP	sp|P0C6X1|R1AB_CVH22	6665	tr|H0Y543|H0Y543_HUMAN alpha-1,2-Mannosidase (Fragment) OS=Homo sapiens OX=9606 GN=MAN1A2 PE=1 SV=1	8	GLTFIGEWKNGH
GVTFIGEWANGP	sp|P0C6X1|R1AB_CVH22	6665	sp|O60476|MA1A2_HUMAN Mannosyl-oligosaccharide 1,2-alpha-mannosidase IB OS=Homo sapiens OX=9606 GN=MAN1A2 PE=1 SV=1	441	GLTFIGEWKNGH
GVTFIGEWANGP	sp|P0C6X1|R1AB_CVH22	6665	tr|H0Y7H1|H0Y7H1_HUMAN alpha-1,2-Mannosidase (Fragment) OS=Homo sapiens OX=9606 GN=MAN1A2 PE=1 SV=2	174	GLTFIGEWKNGH
GVLPISAIPANS	sp|P0C6U2|R1A_CVH22	3742	sp|Q5SWA1|PR15B_HUMAN Protein phosphatase 1 regulatory subunit 15B OS=Homo sapiens OX=9606 GN=PPP1R15B PE=1 SV=1	411	GDLPISARPACS
DIIKKYIHRTQT	sp|P0C6X1|R1AB_CVH22	5490	sp|Q16617|NKG7_HUMAN Protein NKG7 OS=Homo sapiens OX=9606 GN=NKG7 PE=1 SV=1	49	DIISGYIHVTQT
APVSTLKPRPIL	sp|P0C6U2|R1A_CVH22	1901	sp|Q9Y2D9|ZN652_HUMAN Zinc finger protein 652 OS=Homo sapiens OX=9606 GN=ZNF652 PE=1 SV=3	533	NPVSTLPPRPIP
APVSTLKPRPIL	sp|P0C6U2|R1A_CVH22	1901	tr|D6RF85|D6RF85_HUMAN Zinc finger protein 652 OS=Homo sapiens OX=9606 GN=ZNF652 PE=1 SV=1	353	NPVSTLPPRPIP
MKTVSVFYTTVI	sp|P0C6U2|R1A_CVH22	2298	sp|Q8NGP6|OR5M8_HUMAN Olfactory receptor 5M8 OS=Homo sapiens OX=9606 GN=OR5M8 PE=2 SV=1	270	GKMVAVFYTTVI
MKTVSVFYTTVI	sp|P0C6U2|R1A_CVH22	2298	sp|Q8NGP3|OR5M9_HUMAN Olfactory receptor 5M9 OS=Homo sapiens OX=9606 GN=OR5M9 PE=3 SV=1	269	GKMVAVFYTTVI
MKTVSVFYTTVI	sp|P0C6U2|R1A_CVH22	2298	tr|A0A286YEX6|A0A286YEX6_HUMAN G_PROTEIN_RECEP_F1_2 domain-containing protein OS=Homo sapiens OX=9606 PE=4 SV=1	374	GKMVAVFYTTVI
MKTVSVFYTTVI	sp|P0C6U2|R1A_CVH22	2298	sp|Q8NGP4|OR5M3_HUMAN Olfactory receptor 5M3 OS=Homo sapiens OX=9606 GN=OR5M3 PE=2 SV=2	269	GKMVAVFYTTVI
MKTVSVFYTTVI	sp|P0C6U2|R1A_CVH22	2298	sp|Q8NGM9|OR8D4_HUMAN Olfactory receptor 8D4 OS=Homo sapiens OX=9606 GN=OR8D4 PE=2 SV=1	271	EKVSSVFYTTVI
MKTVSVFYTTVI	sp|P0C6U2|R1A_CVH22	2298	sp|Q8WZ84|OR8D1_HUMAN Olfactory receptor 8D1 OS=Homo sapiens OX=9606 GN=OR8D1 PE=2 SV=1	271	EKVSSVFYTTVI
MKTVSVFYTTVI	sp|P0C6U2|R1A_CVH22	2298	sp|Q8NGQ6|OR9I1_HUMAN Olfactory receptor 9I1 OS=Homo sapiens OX=9606 GN=OR9I1 PE=3 SV=1	271	DKVVSVFYTVVI
MKTVSVFYTTVI	sp|P0C6U2|R1A_CVH22	2298	sp|Q8WZ94|OR5P3_HUMAN Olfactory receptor 5P3 OS=Homo sapiens OX=9606 GN=OR5P3 PE=2 SV=1	271	NKVVSVFYTVVI
KSVKTGDGWTAV	sp|P0C6U2|R1A_CVH22	3068	tr|H0Y448|H0Y448_HUMAN Cortactin-binding protein 2 (Fragment) OS=Homo sapiens OX=9606 GN=CTTNBP2 PE=1 SV=1	324	RSVKTTDGWTPV
KSVKTGDGWTAV	sp|P0C6U2|R1A_CVH22	3068	sp|Q8WZ74|CTTB2_HUMAN Cortactin-binding protein 2 OS=Homo sapiens OX=9606 GN=CTTNBP2 PE=1 SV=1	836	RSVKTTDGWTPV
LQVVFGTMGVCY	sp|P0C6U2|R1A_CVH22	2602	sp|Q9HAK2|COE2_HUMAN Transcription factor COE2 OS=Homo sapiens OX=9606 GN=EBF2 PE=1 SV=4	282	LQVVFGTMLVWS
LQVVFGTMGVCY	sp|P0C6U2|R1A_CVH22	2602	tr|B7Z934|B7Z934_HUMAN Transcription factor COE2 OS=Homo sapiens OX=9606 GN=EBF2 PE=1 SV=1	134	LQVVFGTMLVWS
LQVVFGTMGVCY	sp|P0C6U2|R1A_CVH22	2602	sp|Q9H4W6|COE3_HUMAN Transcription factor COE3 OS=Homo sapiens OX=9606 GN=EBF3 PE=1 SV=2	292	LQVVFGTMLVWS
LQVVFGTMGVCY	sp|P0C6U2|R1A_CVH22	2602	tr|H0Y3W9|H0Y3W9_HUMAN Transcription factor COE3 OS=Homo sapiens OX=9606 GN=EBF3 PE=1 SV=2	292	LQVVFGTMLVWS
YIDDISRSDVVL	sp|P0C6X1|R1AB_CVH22	4906	sp|Q8WWQ2|HPSE2_HUMAN Inactive heparanase-2 OS=Homo sapiens OX=9606 GN=HPSE2 PE=1 SV=3	147	YEDDIVRSDVAL
LAPVSTLKPRPI	sp|P0C6U2|R1A_CVH22	1900	sp|Q9Y2D9|ZN652_HUMAN Zinc finger protein 652 OS=Homo sapiens OX=9606 GN=ZNF652 PE=1 SV=3	532	MNPVSTLPPRPI
LAPVSTLKPRPI	sp|P0C6U2|R1A_CVH22	1900	tr|D6RF85|D6RF85_HUMAN Zinc finger protein 652 OS=Homo sapiens OX=9606 GN=ZNF652 PE=1 SV=1	352	MNPVSTLPPRPI
RQLEFTAQYPVL	sp|P0C6X1|R1AB_CVH22	5879	sp|O75127|PTCD1_HUMAN Pentatricopeptide repeat-containing protein 1, mitochondrial OS=Homo sapiens OX=9606 GN=PTCD1 PE=1 SV=2	626	RQLEFAAQYPPT
RQLEFTAQYPVL	sp|P0C6X1|R1AB_CVH22	5879	tr|G3V325|G3V325_HUMAN ATP5MF-PTCD1 readthrough OS=Homo sapiens OX=9606 GN=ATP5MF-PTCD1 PE=4 SV=1	675	RQLEFAAQYPPT
EGKNHIAEGDNV	sp|P0C6X1|R1AB_CVH22	6590	tr|V9GXZ5|V9GXZ5_HUMAN Ubiquitin carboxyl-terminal hydrolase 43 (Fragment) OS=Homo sapiens OX=9606 GN=USP43 PE=1 SV=1	129	EDLNTIAEGDNV
EGKNHIAEGDNV	sp|P0C6X1|R1AB_CVH22	6590	sp|Q70EL4|UBP43_HUMAN Ubiquitin carboxyl-terminal hydrolase 43 OS=Homo sapiens OX=9606 GN=USP43 PE=1 SV=2	342	EDLNTIAEGDNV
QAPRDKPRAGRY	sp|P15130|NCAP_CVH22	326	sp|Q8NHY6|ZFP28_HUMAN Zinc finger protein 28 homolog OS=Homo sapiens OX=9606 GN=ZFP28 PE=1 SV=1	19	GAPRTKPRAGRG
HASMTTNGAVGN	sp|P0C6X1|R1AB_CVH22	742	sp|Q8WXI7|MUC16_HUMAN Mucin-16 OS=Homo sapiens OX=9606 GN=MUC16 PE=1 SV=3	5711	HASMHTNTAVAN
ATPPASLAKSLG	sp|P0C6X1|R1AB_CVH22	6175	sp|P15056|BRAF_HUMAN Serine/threonine-protein kinase B-raf OS=Homo sapiens OX=9606 GN=BRAF PE=1 SV=4	400	ATPPASLPGSLT
ATPPASLAKSLG	sp|P0C6X1|R1AB_CVH22	6175	tr|A0A2U3TZI2|A0A2U3TZI2_HUMAN Non-specific serine/threonine protein kinase OS=Homo sapiens OX=9606 GN=BRAF PE=1 SV=1	440	ATPPASLPGSLT
ATPPASLAKSLG	sp|P0C6X1|R1AB_CVH22	6175	tr|H7C560|H7C560_HUMAN Non-specific serine/threonine protein kinase OS=Homo sapiens OX=9606 GN=BRAF PE=1 SV=2	400	ATPPASLPGSLT
ATPPASLAKSLG	sp|P0C6X1|R1AB_CVH22	6175	tr|A0A2R8Y8E0|A0A2R8Y8E0_HUMAN Non-specific serine/threonine protein kinase OS=Homo sapiens OX=9606 GN=BRAF PE=1 SV=1	440	ATPPASLPGSLT
ATPPASLAKSLG	sp|P0C6X1|R1AB_CVH22	6175	tr|A0A2R8Y492|A0A2R8Y492_HUMAN Serine/threonine-protein kinase B-raf (Fragment) OS=Homo sapiens OX=9606 GN=BRAF PE=1 SV=1	99	ATPPASLPGSLT
ATPPASLAKSLG	sp|P0C6X1|R1AB_CVH22	6175	tr|A0A2R8Y679|A0A2R8Y679_HUMAN Serine/threonine-protein kinase B-raf (Fragment) OS=Homo sapiens OX=9606 GN=BRAF PE=1 SV=1	81	ATPPASLPGSLT
ATPPASLAKSLG	sp|P0C6X1|R1AB_CVH22	6175	tr|A0A2R8YDP5|A0A2R8YDP5_HUMAN Non-specific serine/threonine protein kinase OS=Homo sapiens OX=9606 GN=BRAF PE=1 SV=1	400	ATPPASLPGSLT
PEAVATGYGYRT	sp|P0C6X1|R1AB_CVH22	2675	sp|P0DSN7|KVD37_HUMAN Probable non-functional immunoglobulinn kappa variable 1D-37 OS=Homo sapiens OX=9606 GN=IGKV1D-37 PE=1 SV=1	102	PEDVATYYGQRT
PEAVATGYGYRT	sp|P0C6X1|R1AB_CVH22	2675	sp|A0A075B6S9|KV137_HUMAN Probable non-functional immunoglobulinn kappa variable 1-37 OS=Homo sapiens OX=9606 GN=IGKV1-37 PE=1 SV=7	102	PEDVATYYGQRT
AGVTFIGEWANG	sp|P0C6X1|R1AB_CVH22	6664	tr|H0Y543|H0Y543_HUMAN alpha-1,2-Mannosidase (Fragment) OS=Homo sapiens OX=9606 GN=MAN1A2 PE=1 SV=1	7	GGLTFIGEWKNG
AGVTFIGEWANG	sp|P0C6X1|R1AB_CVH22	6664	sp|O60476|MA1A2_HUMAN Mannosyl-oligosaccharide 1,2-alpha-mannosidase IB OS=Homo sapiens OX=9606 GN=MAN1A2 PE=1 SV=1	440	GGLTFIGEWKNG
AGVTFIGEWANG	sp|P0C6X1|R1AB_CVH22	6664	tr|H0Y7H1|H0Y7H1_HUMAN alpha-1,2-Mannosidase (Fragment) OS=Homo sapiens OX=9606 GN=MAN1A2 PE=1 SV=2	173	GGLTFIGEWKNG
GISGGNAYASNK	sp|P0C6X1|R1AB_CVH22	5998	sp|Q99959|PKP2_HUMAN Plakophilin-2 OS=Homo sapiens OX=9606 GN=PKP2 PE=1 SV=2	824	AISAGDAYASNK
GTYYCFATQSAG	sp|P15423|SPIKE_CVH22	164	sp|Q8WZ75|ROBO4_HUMAN Roundabout homolog 4 OS=Homo sapiens OX=9606 GN=ROBO4 PE=1 SV=1	203	GTYMCVATNSAG
GTYYCFATQSAG	sp|P15423|SPIKE_CVH22	164	tr|B4DYV8|B4DYV8_HUMAN Roundabout homolog 4 OS=Homo sapiens OX=9606 GN=ROBO4 PE=1 SV=1	58	GTYMCVATNSAG
GTYYCFATQSAG	sp|P15423|SPIKE_CVH22	164	sp|Q9P232|CNTN3_HUMAN Contactin-3 OS=Homo sapiens OX=9606 GN=CNTN3 PE=1 SV=3	96	GTYQCFATNSLG
VAVGMLTTATLI	sp|P0C6X1|R1AB_CVH22	3558	sp|Q92504|S39A7_HUMAN Zinc transporter SLC39A7 OS=Homo sapiens OX=9606 GN=SLC39A7 PE=1 SV=2	11	VAVGLLTWATLG
AADDLDFVKGDA	sp|P0C6X1|R1AB_CVH22	173	tr|I3L397|I3L397_HUMAN Eukaryotic translation initiation factor 5A (Fragment) OS=Homo sapiens OX=9606 GN=EIF5A PE=1 SV=8	1	MADDLDFETGDA
AADDLDFVKGDA	sp|P0C6X1|R1AB_CVH22	173	sp|P63241|IF5A1_HUMAN Eukaryotic translation initiation factor 5A-1 OS=Homo sapiens OX=9606 GN=EIF5A PE=1 SV=2	1	MADDLDFETGDA
AADDLDFVKGDA	sp|P0C6X1|R1AB_CVH22	173	tr|I3L504|I3L504_HUMAN Eukaryotic translation initiation factor 5A-1 OS=Homo sapiens OX=9606 GN=EIF5A PE=1 SV=1	1	MADDLDFETGDA
AADDLDFVKGDA	sp|P0C6X1|R1AB_CVH22	173	sp|Q6IS14|IF5AL_HUMAN Eukaryotic translation initiation factor 5A-1-like OS=Homo sapiens OX=9606 GN=EIF5AL1 PE=2 SV=2	1	MADDLDFETGDA
KSSQHTSSKGRG	sp|P15130|NCAP_CVH22	150	sp|P11274|BCR_HUMAN Breakpoint cluster region protein OS=Homo sapiens OX=9606 GN=BCR PE=1 SV=2	461	SSSPHLSSKGRG
SAGWKYKNAGVI	sp|P0C6X1|R1AB_CVH22	4406	sp|Q96Q05|TPPC9_HUMAN Trafficking protein particle complex subunit 9 OS=Homo sapiens OX=9606 GN=TRAPPC9 PE=1 SV=2	332	SYYSKYKNAGVI
SAGWKYKNAGVI	sp|P0C6X1|R1AB_CVH22	4406	tr|H0YBR0|H0YBR0_HUMAN Trafficking protein particle complex subunit 9 (Fragment) OS=Homo sapiens OX=9606 GN=TRAPPC9 PE=1 SV=1	176	SYYSKYKNAGVI
VGGINLAISLSN	sp|P0C6X1|R1AB_CVH22	4620	tr|K7EIU8|K7EIU8_HUMAN Mothers against decapentaplegic homolog OS=Homo sapiens OX=9606 GN=SMAD4 PE=1 SV=1	379	VGGIAPAISLSA
VGGINLAISLSN	sp|P0C6X1|R1AB_CVH22	4620	sp|Q13485|SMAD4_HUMAN Mothers against decapentaplegic homolog 4 OS=Homo sapiens OX=9606 GN=SMAD4 PE=1 SV=1	475	VGGIAPAISLSA
LIRRNAKYQVRV	sp|P0C6U2|R1A_CVH22	1969	sp|Q8WTW4|NPRL2_HUMAN GATOR complex protein NPRL2 OS=Homo sapiens OX=9606 GN=NPRL2 PE=1 SV=2	322	LIRRLQKYPVRV
KSVSSAKRGALA	sp|P0C6X1|R1AB_CVH22	3912	sp|B2CW77|KILIN_HUMAN Killin OS=Homo sapiens OX=9606 GN=KLLN PE=1 SV=1	86	KSSSSFARGALA
RNSLDDEFLTVD	sp|P0C6X1|R1AB_CVH22	6317	tr|A0A0U1RRH6|A0A0U1RRH6_HUMAN PHD finger protein 14 OS=Homo sapiens OX=9606 GN=PHF14 PE=1 SV=1	278	RNSADDEELTND
RNSLDDEFLTVD	sp|P0C6X1|R1AB_CVH22	6317	sp|O94880|PHF14_HUMAN PHD finger protein 14 OS=Homo sapiens OX=9606 GN=PHF14 PE=1 SV=2	278	RNSADDEELTND
LVAVGGTLQALL	sp|P0C6X1|R1AB_CVH22	441	tr|A0A0C4DGF4|A0A0C4DGF4_HUMAN Transient receptor potential cation channel subfamily M member 5 (Fragment) OS=Homo sapiens OX=9606 GN=TRPM5 PE=4 SV=1	878	LVAYGVTTQALL
LVAVGGTLQALL	sp|P0C6X1|R1AB_CVH22	441	sp|Q9NZQ8|TRPM5_HUMAN Transient receptor potential cation channel subfamily M member 5 OS=Homo sapiens OX=9606 GN=TRPM5 PE=1 SV=1	884	LVAYGVTTQALL
LVAVGGTLQALL	sp|P0C6X1|R1AB_CVH22	441	tr|E9PQF7|E9PQF7_HUMAN Transient receptor potential cation channel subfamily M member 5 OS=Homo sapiens OX=9606 GN=TRPM5 PE=4 SV=1	884	LVAYGVTTQALL
LVAVGGTLQALL	sp|P0C6X1|R1AB_CVH22	441	tr|E9PRW0|E9PRW0_HUMAN Transient receptor potential cation channel subfamily M member 5 OS=Homo sapiens OX=9606 GN=TRPM5 PE=4 SV=1	884	LVAYGVTTQALL
LVAVGGTLQALL	sp|P0C6X1|R1AB_CVH22	441	sp|Q5VUJ6|LRCH2_HUMAN Leucine-rich repeat and calponin homology domain-containing protein 2 OS=Homo sapiens OX=9606 GN=LRCH2 PE=1 SV=2	741	LVKVGVTVQALL
AVFYTTLFAYLN	sp|P19739|NS4A_CVH22	85	sp|Q8NG85|OR2L3_HUMAN Olfactory receptor 2L3 OS=Homo sapiens OX=9606 GN=OR2L3 PE=2 SV=1	274	AVFYTTLTPMLN
SAPAGSSDPLKF	sp|P0C6X1|R1AB_CVH22	4031	sp|Q14774|HLX_HUMAN H2.0-like homeobox protein OS=Homo sapiens OX=9606 GN=HLX PE=1 SV=3	165	SAPAPSSKDLKF
QHVLQGLLFSVF	sp|P0C6U2|R1A_CVH22	1844	sp|Q96KK4|O10C1_HUMAN Olfactory receptor 10C1 OS=Homo sapiens OX=9606 GN=OR10C1 PE=2 SV=3	19	LADLQGLLFSVF
QHVLQGLLFSVF	sp|P0C6U2|R1A_CVH22	1844	tr|A0A087WY02|A0A087WY02_HUMAN Olfactory receptor OS=Homo sapiens OX=9606 GN=OR10C1 PE=3 SV=1	21	LADLQGLLFSVF
QHVLQGLLFSVF	sp|P0C6U2|R1A_CVH22	1844	tr|A0A0G2JL13|A0A0G2JL13_HUMAN Olfactory receptor OS=Homo sapiens OX=9606 GN=OR10C1 PE=3 SV=1	21	LADLQGLLFSVF
QHVLQGLLFSVF	sp|P0C6U2|R1A_CVH22	1844	tr|Q6IFQ5|Q6IFQ5_HUMAN Olfactory receptor OS=Homo sapiens OX=9606 GN=OR10C1 PE=3 SV=1	19	LADLQGLLFSVF
QHVLQGLLFSVF	sp|P0C6U2|R1A_CVH22	1844	tr|A0A140TA55|A0A140TA55_HUMAN Olfactory receptor OS=Homo sapiens OX=9606 GN=OR10C1 PE=3 SV=1	21	LADLQGLLFSVF
QHVLQGLLFSVF	sp|P0C6U2|R1A_CVH22	1844	tr|A0A140T9J0|A0A140T9J0_HUMAN Olfactory receptor OS=Homo sapiens OX=9606 GN=OR10C1 PE=3 SV=1	19	LADLQGLLFSVF
KEKTKIIGFYNV	sp|P15130|NCAP_CVH22	49	sp|Q5VTE6|ANGE2_HUMAN Protein angel homolog 2 OS=Homo sapiens OX=9606 GN=ANGEL2 PE=1 SV=1	143	KEKTKILGDKNV
LPGSAKPGDALA	sp|P0C6U2|R1A_CVH22	276	sp|Q8TBC5|ZSC18_HUMAN Zinc finger and SCAN domain-containing protein 18 OS=Homo sapiens OX=9606 GN=ZSCAN18 PE=1 SV=2	304	LPTEAPPGDALA
LPGSAKPGDALA	sp|P0C6U2|R1A_CVH22	276	tr|A0A0C4DG78|A0A0C4DG78_HUMAN Zinc finger and SCAN domain-containing protein 18 (Fragment) OS=Homo sapiens OX=9606 GN=ZSCAN18 PE=1 SV=1	201	LPTEAPPGDALA
WAAPNALLAVLN	sp|P0C6X1|R1AB_CVH22	3334	sp|O15303|GRM6_HUMAN Metabotropic glutamate receptor 6 OS=Homo sapiens OX=9606 GN=GRM6 PE=1 SV=2	585	WAAPPLLLAVLG
ADDLDFVKGDAL	sp|P0C6X1|R1AB_CVH22	174	tr|I3L397|I3L397_HUMAN Eukaryotic translation initiation factor 5A (Fragment) OS=Homo sapiens OX=9606 GN=EIF5A PE=1 SV=8	2	ADDLDFETGDAG
ADDLDFVKGDAL	sp|P0C6X1|R1AB_CVH22	174	sp|P63241|IF5A1_HUMAN Eukaryotic translation initiation factor 5A-1 OS=Homo sapiens OX=9606 GN=EIF5A PE=1 SV=2	2	ADDLDFETGDAG
ADDLDFVKGDAL	sp|P0C6X1|R1AB_CVH22	174	tr|I3L504|I3L504_HUMAN Eukaryotic translation initiation factor 5A-1 OS=Homo sapiens OX=9606 GN=EIF5A PE=1 SV=1	2	ADDLDFETGDAG
ADDLDFVKGDAL	sp|P0C6X1|R1AB_CVH22	174	sp|Q6IS14|IF5AL_HUMAN Eukaryotic translation initiation factor 5A-1-like OS=Homo sapiens OX=9606 GN=EIF5AL1 PE=2 SV=2	2	ADDLDFETGDAG
ALIFHILLVFVY	sp|P19739|NS4A_CVH22	71	sp|Q8IXM6|NRM_HUMAN Nurim OS=Homo sapiens OX=9606 GN=NRM PE=1 SV=1	150	LLIFSILLVFDY
ALIFHILLVFVY	sp|P19739|NS4A_CVH22	71	tr|H0Y6T6|H0Y6T6_HUMAN Nuclear envelope membrane protein (Fragment) OS=Homo sapiens OX=9606 GN=NRM PE=1 SV=1	150	LLIFSILLVFDY
QTVKLTLDLTHT	sp|P19739|NS4A_CVH22	19	sp|Q8IWW6|RHG12_HUMAN Rho GTPase-activating protein 12 OS=Homo sapiens OX=9606 GN=ARHGAP12 PE=1 SV=1	144	QTVNLSLDLTHN
QTVKLTLDLTHT	sp|P19739|NS4A_CVH22	19	tr|Q1RLN5|Q1RLN5_HUMAN ARHGAP12 protein OS=Homo sapiens OX=9606 GN=ARHGAP12 PE=1 SV=1	144	QTVNLSLDLTHN
AQYPVLLSDTAA	sp|P0C6X1|R1AB_CVH22	5885	sp|Q969Y2|GTPB3_HUMAN tRNA modification GTPase GTPBP3, mitochondrial OS=Homo sapiens OX=9606 GN=GTPBP3 PE=1 SV=2	295	AGFPVLLSDTAG
FDKPWAVVKDLL	sp|P0C6X1|R1AB_CVH22	792	sp|P35249|RFC4_HUMAN Replication factor C subunit 4 OS=Homo sapiens OX=9606 GN=RFC4 PE=1 SV=2	286	FDKLEAVVKDLI
FDKPWAVVKDLL	sp|P0C6X1|R1AB_CVH22	792	tr|H7C1P0|H7C1P0_HUMAN Replication factor C subunit 4 (Fragment) OS=Homo sapiens OX=9606 GN=RFC4 PE=1 SV=1	61	FDKLEAVVKDLI
LLSSILGAPTTA	sp|P0C6U2|R1A_CVH22	2580	tr|A0A6Q8PFM0|A0A6Q8PFM0_HUMAN Serine/threonine-protein kinase WNK1 (Fragment) OS=Homo sapiens OX=9606 GN=WNK1 PE=1 SV=1	488	FLSSIAGVPTTA
LLSSILGAPTTA	sp|P0C6U2|R1A_CVH22	2580	sp|Q9H4A3|WNK1_HUMAN Serine/threonine-protein kinase WNK1 OS=Homo sapiens OX=9606 GN=WNK1 PE=1 SV=2	1339	FLSSIAGVPTTA
LLSSILGAPTTA	sp|P0C6U2|R1A_CVH22	2580	tr|F5GWT4|F5GWT4_HUMAN Non-specific serine/threonine protein kinase OS=Homo sapiens OX=9606 GN=WNK1 PE=1 SV=1	1092	FLSSIAGVPTTA
LLSSILGAPTTA	sp|P0C6U2|R1A_CVH22	2580	sp|Q9NU02|ANKE1_HUMAN Ankyrin repeat and EF-hand domain-containing protein 1 OS=Homo sapiens OX=9606 GN=ANKEF1 PE=1 SV=2	680	LLSSIYGVPTTS
AWQPLVVENENP	sp|P15130|NCAP_CVH22	24	tr|X6RKU3|X6RKU3_HUMAN F-box only protein 42 (Fragment) OS=Homo sapiens OX=9606 GN=FBXO42 PE=1 SV=7	41	AWQPLKVENEEH
AWQPLVVENENP	sp|P15130|NCAP_CVH22	24	sp|Q6P3S6|FBX42_HUMAN F-box only protein 42 OS=Homo sapiens OX=9606 GN=FBXO42 PE=1 SV=1	323	AWQPLKVENEEH
AAAKDYDFFKFS	sp|P0C6X1|R1AB_CVH22	4511	sp|O14513|NCKP5_HUMAN Nck-associated protein 5 OS=Homo sapiens OX=9606 GN=NCKAP5 PE=1 SV=2	724	AAARDYTFFKRS
AAAKDYDFFKFS	sp|P0C6X1|R1AB_CVH22	4511	tr|A0A0A0MS79|A0A0A0MS79_HUMAN Nck-associated protein 5 OS=Homo sapiens OX=9606 GN=NCKAP5 PE=1 SV=1	724	AAARDYTFFKRS
SHSAEITFTLNK	sp|P15423|SPIKE_CVH22	1076	tr|A0A590UK29|A0A590UK29_HUMAN NAD(P) transhydrogenase, mitochondrial OS=Homo sapiens OX=9606 GN=NNT PE=1 SV=1	506	SHSAEITFIYIK
RISKIVDTALVV	sp|P0C6X1|R1AB_CVH22	3687	sp|Q12887|COX10_HUMAN Protoheme IX farnesyltransferase, mitochondrial OS=Homo sapiens OX=9606 GN=COX10 PE=2 SV=3	159	RLSKIKLTALVV
RISKIVDTALVV	sp|P0C6X1|R1AB_CVH22	3687	tr|A0A590UJJ5|A0A590UJJ5_HUMAN Heme O synthase OS=Homo sapiens OX=9606 GN=COX10 PE=1 SV=1	159	RLSKIKLTALVV
SNELNIPDVLED	sp|P0C6X1|R1AB_CVH22	997	tr|J3KRR7|J3KRR7_HUMAN Deubiquitinating enzyme CYLD OS=Homo sapiens OX=9606 GN=CYLD PE=1 SV=1	769	SLELNITDLLED
SNELNIPDVLED	sp|P0C6X1|R1AB_CVH22	997	tr|H3BS09|H3BS09_HUMAN Deubiquitinating enzyme CYLD OS=Homo sapiens OX=9606 GN=CYLD PE=1 SV=1	587	SLELNITDLLED
SNELNIPDVLED	sp|P0C6X1|R1AB_CVH22	997	sp|Q9NQC7|CYLD_HUMAN Ubiquitin carboxyl-terminal hydrolase CYLD OS=Homo sapiens OX=9606 GN=CYLD PE=1 SV=1	772	SLELNITDLLED
SARVEATLSPVK	sp|P0C6U2|R1A_CVH22	1244	sp|O60522|TDRD6_HUMAN Tudor domain-containing protein 6 OS=Homo sapiens OX=9606 GN=TDRD6 PE=2 SV=2	1269	TARVEATLSERK
FNAWQPLVVENE	sp|P15130|NCAP_CVH22	22	tr|X6RKU3|X6RKU3_HUMAN F-box only protein 42 (Fragment) OS=Homo sapiens OX=9606 GN=FBXO42 PE=1 SV=7	39	PWAWQPLKVENE
FNAWQPLVVENE	sp|P15130|NCAP_CVH22	22	sp|Q6P3S6|FBX42_HUMAN F-box only protein 42 OS=Homo sapiens OX=9606 GN=FBXO42 PE=1 SV=1	321	PWAWQPLKVENE
STPLVFKAKDFS	sp|P0C6X1|R1AB_CVH22	2428	tr|Q5TAA8|Q5TAA8_HUMAN Hermansky-Pudlak syndrome 1 protein (Fragment) OS=Homo sapiens OX=9606 GN=HPS1 PE=1 SV=1	241	STWLEFKAKAFS
STPLVFKAKDFS	sp|P0C6X1|R1AB_CVH22	2428	sp|Q92902|HPS1_HUMAN Hermansky-Pudlak syndrome 1 protein OS=Homo sapiens OX=9606 GN=HPS1 PE=1 SV=2	446	STWLEFKAKAFS
VDFTVDVLDNDL	sp|P0C6X1|R1AB_CVH22	632	sp|Q9NRY4|RHG35_HUMAN Rho GTPase-activating protein 35 OS=Homo sapiens OX=9606 GN=ARHGAP35 PE=1 SV=3	889	TDGAVDVLDNDL
LANVSDTSALNS	sp|P0C6U2|R1A_CVH22	2461	tr|A0A3B3ITG9|A0A3B3ITG9_HUMAN Double-stranded RNA-specific adenosine deaminase (Fragment) OS=Homo sapiens OX=9606 GN=ADAR PE=1 SV=1	12	LFNVSDSSALNL
LANVSDTSALNS	sp|P0C6U2|R1A_CVH22	2461	tr|A0A3B3ISX1|A0A3B3ISX1_HUMAN Double-stranded RNA-specific adenosine deaminase (Fragment) OS=Homo sapiens OX=9606 GN=ADAR PE=1 SV=1	226	LFNVSDSSALNL
LANVSDTSALNS	sp|P0C6U2|R1A_CVH22	2461	sp|P55265|DSRAD_HUMAN Double-stranded RNA-specific adenosine deaminase OS=Homo sapiens OX=9606 GN=ADAR PE=1 SV=4	307	LFNVSDSSALNL
LANVSDTSALNS	sp|P0C6U2|R1A_CVH22	2461	tr|A0A3B3IRQ9|A0A3B3IRQ9_HUMAN Double-stranded RNA-specific adenosine deaminase (Fragment) OS=Homo sapiens OX=9606 GN=ADAR PE=1 SV=1	284	LFNVSDSSALNL
GVKCAVSEARFW	sp|P0C6X1|R1AB_CVH22	5928	tr|C9J1N1|C9J1N1_HUMAN N-chimaerin (Fragment) OS=Homo sapiens OX=9606 GN=CHN1 PE=1 SV=9	181	GVKCAVLEARKS
GVKCAVSEARFW	sp|P0C6X1|R1AB_CVH22	5928	tr|F8W6K2|F8W6K2_HUMAN N-chimaerin (Fragment) OS=Homo sapiens OX=9606 GN=CHN1 PE=1 SV=2	8	GVKCAVLEARKS
GVKCAVSEARFW	sp|P0C6X1|R1AB_CVH22	5928	tr|A0A494C1M7|A0A494C1M7_HUMAN N-chimaerin OS=Homo sapiens OX=9606 GN=CHN1 PE=1 SV=1	108	GVKCAVLEARKS
LITGEEIYQVIV	sp|P0C6U2|R1A_CVH22	3205	tr|A0A087WUD3|A0A087WUD3_HUMAN Oligosaccharyltransferase complex subunit OS=Homo sapiens OX=9606 GN=OSTC PE=1 SV=1	43	LITGGIIYDVIV
LITGEEIYQVIV	sp|P0C6U2|R1A_CVH22	3205	sp|Q9NRP0|OSTC_HUMAN Oligosaccharyltransferase complex subunit OSTC OS=Homo sapiens OX=9606 GN=OSTC PE=1 SV=1	43	LITGGIIYDVIV
KFRTQGELILSA	sp|P0C6X1|R1AB_CVH22	5624	sp|P17480|UBF1_HUMAN Nucleolar transcription factor 1 OS=Homo sapiens OX=9606 GN=UBTF PE=1 SV=1	81	KFRTLTELILDA
KFRTQGELILSA	sp|P0C6X1|R1AB_CVH22	5624	tr|E9PKP7|E9PKP7_HUMAN Nucleolar transcription factor 1 OS=Homo sapiens OX=9606 GN=UBTF PE=1 SV=1	81	KFRTLTELILDA
FSVAAVCIRFGP	sp|P0C6X1|R1AB_CVH22	2006	tr|A0A3F2YNX0|A0A3F2YNX0_HUMAN Protein transport protein sec16 OS=Homo sapiens OX=9606 GN=SEC16A PE=1 SV=1	1267	FSVPHVCARFGP
FSVAAVCIRFGP	sp|P0C6X1|R1AB_CVH22	2006	tr|A0A3F2YNZ0|A0A3F2YNZ0_HUMAN Protein transport protein sec16 OS=Homo sapiens OX=9606 GN=SEC16A PE=1 SV=1	1267	FSVPHVCARFGP
FSVAAVCIRFGP	sp|P0C6X1|R1AB_CVH22	2006	tr|X6RGP5|X6RGP5_HUMAN Protein transport protein sec16 (Fragment) OS=Homo sapiens OX=9606 GN=SEC16A PE=1 SV=1	167	FSVPHVCARFGP
FSVAAVCIRFGP	sp|P0C6X1|R1AB_CVH22	2006	sp|O15027|SC16A_HUMAN Protein transport protein Sec16A OS=Homo sapiens OX=9606 GN=SEC16A PE=1 SV=4	1445	FSVPHVCARFGP
FSVAAVCIRFGP	sp|P0C6X1|R1AB_CVH22	2006	tr|F1T0I1|F1T0I1_HUMAN Protein transport protein sec16 OS=Homo sapiens OX=9606 GN=SEC16A PE=1 SV=1	1445	FSVPHVCARFGP
VLQGLLFSVFQG	sp|P0C6U2|R1A_CVH22	1846	sp|Q96KK4|O10C1_HUMAN Olfactory receptor 10C1 OS=Homo sapiens OX=9606 GN=OR10C1 PE=2 SV=3	21	DLQGLLFSVFLT
VLQGLLFSVFQG	sp|P0C6U2|R1A_CVH22	1846	tr|A0A087WY02|A0A087WY02_HUMAN Olfactory receptor OS=Homo sapiens OX=9606 GN=OR10C1 PE=3 SV=1	23	DLQGLLFSVFLT
VLQGLLFSVFQG	sp|P0C6U2|R1A_CVH22	1846	tr|A0A0G2JL13|A0A0G2JL13_HUMAN Olfactory receptor OS=Homo sapiens OX=9606 GN=OR10C1 PE=3 SV=1	23	DLQGLLFSVFLT
VLQGLLFSVFQG	sp|P0C6U2|R1A_CVH22	1846	tr|Q6IFQ5|Q6IFQ5_HUMAN Olfactory receptor OS=Homo sapiens OX=9606 GN=OR10C1 PE=3 SV=1	21	DLQGLLFSVFLT
VLQGLLFSVFQG	sp|P0C6U2|R1A_CVH22	1846	tr|A0A140TA55|A0A140TA55_HUMAN Olfactory receptor OS=Homo sapiens OX=9606 GN=OR10C1 PE=3 SV=1	23	DLQGLLFSVFLT
VLQGLLFSVFQG	sp|P0C6U2|R1A_CVH22	1846	tr|A0A140T9J0|A0A140T9J0_HUMAN Olfactory receptor OS=Homo sapiens OX=9606 GN=OR10C1 PE=3 SV=1	21	DLQGLLFSVFLT
CPKKAAVSTSSN	sp|P0C6X1|R1AB_CVH22	3003	tr|A0A0C4DG51|A0A0C4DG51_HUMAN Calcium-independent phospholipase A2-gamma (Fragment) OS=Homo sapiens OX=9606 GN=PNPLA8 PE=1 SV=1	459	CPKVAAVSTIVN
CPKKAAVSTSSN	sp|P0C6X1|R1AB_CVH22	3003	sp|Q9NP80|PLPL8_HUMAN Calcium-independent phospholipase A2-gamma OS=Homo sapiens OX=9606 GN=PNPLA8 PE=1 SV=1	559	CPKVAAVSTIVN
LQGLLFSVFQGP	sp|P0C6U2|R1A_CVH22	1847	sp|Q96KK4|O10C1_HUMAN Olfactory receptor 10C1 OS=Homo sapiens OX=9606 GN=OR10C1 PE=2 SV=3	22	LQGLLFSVFLTI
LQGLLFSVFQGP	sp|P0C6U2|R1A_CVH22	1847	tr|A0A087WY02|A0A087WY02_HUMAN Olfactory receptor OS=Homo sapiens OX=9606 GN=OR10C1 PE=3 SV=1	24	LQGLLFSVFLTI
LQGLLFSVFQGP	sp|P0C6U2|R1A_CVH22	1847	tr|A0A0G2JL13|A0A0G2JL13_HUMAN Olfactory receptor OS=Homo sapiens OX=9606 GN=OR10C1 PE=3 SV=1	24	LQGLLFSVFLTI
LQGLLFSVFQGP	sp|P0C6U2|R1A_CVH22	1847	tr|Q6IFQ5|Q6IFQ5_HUMAN Olfactory receptor OS=Homo sapiens OX=9606 GN=OR10C1 PE=3 SV=1	22	LQGLLFSVFLTI
LQGLLFSVFQGP	sp|P0C6U2|R1A_CVH22	1847	tr|A0A140TA55|A0A140TA55_HUMAN Olfactory receptor OS=Homo sapiens OX=9606 GN=OR10C1 PE=3 SV=1	24	LQGLLFSVFLTI
LQGLLFSVFQGP	sp|P0C6U2|R1A_CVH22	1847	tr|A0A140T9J0|A0A140T9J0_HUMAN Olfactory receptor OS=Homo sapiens OX=9606 GN=OR10C1 PE=3 SV=1	22	LQGLLFSVFLTI
EFSARVEATLSP	sp|P0C6U2|R1A_CVH22	1242	tr|E5RH49|E5RH49_HUMAN Homeobox protein Nkx-2.5 (Fragment) OS=Homo sapiens OX=9606 GN=NKX2-5 PE=1 SV=1	32	ELSARLEATLAP
EFSARVEATLSP	sp|P0C6U2|R1A_CVH22	1242	sp|P52952|NKX25_HUMAN Homeobox protein Nkx-2.5 OS=Homo sapiens OX=9606 GN=NKX2-5 PE=1 SV=1	32	ELSARLEATLAP
SSQHTSSKGRGD	sp|P15130|NCAP_CVH22	151	sp|P11274|BCR_HUMAN Breakpoint cluster region protein OS=Homo sapiens OX=9606 GN=BCR PE=1 SV=2	462	SSPHLSSKGRGS
ADFDWVTKGQLE	sp|P0C6X1|R1AB_CVH22	5953	sp|Q86VP1|TAXB1_HUMAN Tax1-binding protein 1 OS=Homo sapiens OX=9606 GN=TAX1BP1 PE=1 SV=2	514	ADFDIVTKGQVC
ADFDWVTKGQLE	sp|P0C6X1|R1AB_CVH22	5953	tr|H7C3L5|H7C3L5_HUMAN Tax1-binding protein 1 (Fragment) OS=Homo sapiens OX=9606 GN=TAX1BP1 PE=1 SV=1	69	ADFDIVTKGQVC
ADFDWVTKGQLE	sp|P0C6X1|R1AB_CVH22	5953	tr|B8ZZD4|B8ZZD4_HUMAN Tax1-binding protein 1 OS=Homo sapiens OX=9606 GN=TAX1BP1 PE=1 SV=1	514	ADFDIVTKGQVC
KLFGSPVMNQGQ	sp|P0C6U2|R1A_CVH22	217	sp|A5PL33|KRBA1_HUMAN Protein KRBA1 OS=Homo sapiens OX=9606 GN=KRBA1 PE=1 SV=3	476	LDFGSPVGNQGQ
