query	query_seqname	query_start	target_seqname	target_start	target
NNITGPPGTGKT	tr|Q6UZF1|Q6UZF1_SARS	5579	tr|A0A0A0MS18|A0A0A0MS18_HUMAN DNA repair protein RAD51 homolog 2 OS=Homo sapiens OX=9606 GN=RAD51B PE=1 SV=1	104	TEITGPPGCGKT
NNITGPPGTGKT	tr|Q6UZF1|Q6UZF1_SARS	5579	tr|D6RAW6|D6RAW6_HUMAN Cell cycle checkpoint protein RAD17 (Fragment) OS=Homo sapiens OX=9606 GN=RAD17 PE=1 SV=1	122	LLITGPPGCGKT
NNITGPPGTGKT	tr|Q6UZF1|Q6UZF1_SARS	5579	sp|O75943|RAD17_HUMAN Cell cycle checkpoint protein RAD17 OS=Homo sapiens OX=9606 GN=RAD17 PE=1 SV=2	133	LLITGPPGCGKT
NNITGPPGTGKT	tr|Q6UZF1|Q6UZF1_SARS	5579	tr|A0A0G2JPT5|A0A0G2JPT5_HUMAN Cell cycle checkpoint protein RAD17 OS=Homo sapiens OX=9606 GN=RAD17 PE=1 SV=1	133	LLITGPPGCGKT
NNITGPPGTGKT	tr|Q6UZF1|Q6UZF1_SARS	5579	tr|A0A0G2JP78|A0A0G2JP78_HUMAN Cell cycle checkpoint protein RAD17 OS=Homo sapiens OX=9606 GN=RAD17 PE=1 SV=1	36	LLITGPPGCGKT
NNITGPPGTGKT	tr|Q6UZF1|Q6UZF1_SARS	5579	sp|P35250|RFC2_HUMAN Replication factor C subunit 2 OS=Homo sapiens OX=9606 GN=RFC2 PE=1 SV=3	72	IIIAGPPGTGKT
NNITGPPGTGKT	tr|Q6UZF1|Q6UZF1_SARS	5579	tr|Q5JR04|Q5JR04_HUMAN RNA helicase OS=Homo sapiens OX=9606 GN=MOV10 PE=1 SV=1	464	YIIFGPPGTGKT
NNITGPPGTGKT	tr|Q6UZF1|Q6UZF1_SARS	5579	sp|Q9HCE1|MOV10_HUMAN Helicase MOV-10 OS=Homo sapiens OX=9606 GN=MOV10 PE=1 SV=2	520	YIIFGPPGTGKT
NNITGPPGTGKT	tr|Q6UZF1|Q6UZF1_SARS	5579	tr|F5GX64|F5GX64_HUMAN DNA-binding protein SMUBP-2 (Fragment) OS=Homo sapiens OX=9606 GN=IGHMBP2 PE=1 SV=2	198	AIIHGPPGTGKT
NNITGPPGTGKT	tr|Q6UZF1|Q6UZF1_SARS	5579	tr|A0A6Q8PFP3|A0A6Q8PFP3_HUMAN DNA-binding protein SMUBP-2 (Fragment) OS=Homo sapiens OX=9606 GN=IGHMBP2 PE=1 SV=1	198	AIIHGPPGTGKT
NNITGPPGTGKT	tr|Q6UZF1|Q6UZF1_SARS	5579	tr|A0A6Q8PGT6|A0A6Q8PGT6_HUMAN DNA-binding protein SMUBP-2 OS=Homo sapiens OX=9606 GN=IGHMBP2 PE=1 SV=1	210	AIIHGPPGTGKT
NNITGPPGTGKT	tr|Q6UZF1|Q6UZF1_SARS	5579	sp|P38935|SMBP2_HUMAN DNA-binding protein SMUBP-2 OS=Homo sapiens OX=9606 GN=IGHMBP2 PE=1 SV=3	210	AIIHGPPGTGKT
NNITGPPGTGKT	tr|Q6UZF1|Q6UZF1_SARS	5579	tr|A0A6Q8PGX2|A0A6Q8PGX2_HUMAN DNA-binding protein SMUBP-2 OS=Homo sapiens OX=9606 GN=IGHMBP2 PE=1 SV=1	210	AIIHGPPGTGKT
NNITGPPGTGKT	tr|Q6UZF1|Q6UZF1_SARS	5579	tr|Q5JXR5|Q5JXR5_HUMAN NFX1-type zinc finger-containing protein 1 (Fragment) OS=Homo sapiens OX=9606 GN=ZNFX1 PE=1 SV=1	615	AIIQGPPGTGKT
NNITGPPGTGKT	tr|Q6UZF1|Q6UZF1_SARS	5579	tr|Q5JXR6|Q5JXR6_HUMAN NFX1-type zinc finger-containing protein 1 OS=Homo sapiens OX=9606 GN=ZNFX1 PE=1 SV=1	615	AIIQGPPGTGKT
NNITGPPGTGKT	tr|Q6UZF1|Q6UZF1_SARS	5579	sp|Q9P2E3|ZNFX1_HUMAN NFX1-type zinc finger-containing protein 1 OS=Homo sapiens OX=9606 GN=ZNFX1 PE=2 SV=2	615	AIIQGPPGTGKT
NNITGPPGTGKT	tr|Q6UZF1|Q6UZF1_SARS	5579	tr|Q5JXR7|Q5JXR7_HUMAN NFX1-type zinc finger-containing protein 1 (Fragment) OS=Homo sapiens OX=9606 GN=ZNFX1 PE=1 SV=1	419	AIIQGPPGTGKT
NNITGPPGTGKT	tr|Q6UZF1|Q6UZF1_SARS	5579	sp|Q92900|RENT1_HUMAN Regulator of nonsense transcripts 1 OS=Homo sapiens OX=9606 GN=UPF1 PE=1 SV=2	499	SLIQGPPGTGKT
NNITGPPGTGKT	tr|Q6UZF1|Q6UZF1_SARS	5579	sp|Q9BYK8|HELZ2_HUMAN Helicase with zinc finger domain 2 OS=Homo sapiens OX=9606 GN=HELZ2 PE=1 SV=6	2170	TVIQGPPGTGKT
NNITGPPGTGKT	tr|Q6UZF1|Q6UZF1_SARS	5579	sp|Q9Y4W6|AFG32_HUMAN AFG3-like protein 2 OS=Homo sapiens OX=9606 GN=AFG3L2 PE=1 SV=2	344	AILTGPPGTGKT
AATGARPSSLPQ	tr|Q6UZF1|Q6UZF1_SARS	5916	sp|Q8N6N2|TTC9B_HUMAN Tetratricopeptide repeat protein 9B OS=Homo sapiens OX=9606 GN=TTC9B PE=2 SV=1	97	AAQGARPSGLPA
AATGARPSSLPQ	tr|Q6UZF1|Q6UZF1_SARS	5916	sp|Q6VUC0|AP2E_HUMAN Transcription factor AP-2-epsilon OS=Homo sapiens OX=9606 GN=TFAP2E PE=2 SV=1	18	AAGGARLSSLPQ
GLQAVILPNGFI	tr|Q6UZF1|Q6UZF1_SARS	6016	sp|Q96GQ5|RUSF1_HUMAN RUS family member 1 OS=Homo sapiens OX=9606 GN=RUSF1 PE=1 SV=2	72	GLQAVFLPQGFP
GLQAVILPNGFI	tr|Q6UZF1|Q6UZF1_SARS	6016	tr|H3BSM7|H3BSM7_HUMAN RUS family member 1 OS=Homo sapiens OX=9606 GN=RUSF1 PE=1 SV=1	72	GLQAVFLPQGFP
GLQAVILPNGFI	tr|Q6UZF1|Q6UZF1_SARS	6016	tr|H3BTA0|H3BTA0_HUMAN RUS family member 1 OS=Homo sapiens OX=9606 GN=RUSF1 PE=1 SV=1	72	GLQAVFLPQGFP
GLQAVILPNGFI	tr|Q6UZF1|Q6UZF1_SARS	6016	tr|H3BS97|H3BS97_HUMAN RUS family member 1 OS=Homo sapiens OX=9606 GN=RUSF1 PE=1 SV=1	72	GLQAVFLPQGFP
LRRLFQVLQMVS	tr|Q6UZF1|Q6UZF1_SARS	3682	sp|Q8TER5|ARH40_HUMAN Rho guanine nucleotide exchange factor 40 OS=Homo sapiens OX=9606 GN=ARHGEF40 PE=1 SV=3	786	LRRLQQVLQWLS
TTQGDITNAFAS	tr|Q6UZF1|Q6UZF1_SARS	5049	tr|B1AKF6|B1AKF6_HUMAN Trophinin (Fragment) OS=Homo sapiens OX=9606 GN=TRO PE=1 SV=1	189	TTQGQITNETAS
TTQGDITNAFAS	tr|Q6UZF1|Q6UZF1_SARS	5049	sp|Q12816|TROP_HUMAN Trophinin OS=Homo sapiens OX=9606 GN=TRO PE=1 SV=3	233	TTQGQITNETAS
TTQGDITNAFAS	tr|Q6UZF1|Q6UZF1_SARS	5049	tr|G5E9N2|G5E9N2_HUMAN Trophinin OS=Homo sapiens OX=9606 GN=TRO PE=1 SV=1	233	TTQGQITNETAS
AAPYQVRIVRFG	tr|Q6UZF1|Q6UZF1_SARS	6835	tr|K7EJB1|K7EJB1_HUMAN 3-ketoacyl-CoA thiolase, mitochondrial (Fragment) OS=Homo sapiens OX=9606 GN=ACAA2 PE=1 SV=1	69	QAPYCVRNVRFG
AAPYQVRIVRFG	tr|Q6UZF1|Q6UZF1_SARS	6835	tr|K7EJ68|K7EJ68_HUMAN 3-ketoacyl-CoA thiolase, mitochondrial (Fragment) OS=Homo sapiens OX=9606 GN=ACAA2 PE=1 SV=1	69	QAPYCVRNVRFG
AAPYQVRIVRFG	tr|Q6UZF1|Q6UZF1_SARS	6835	sp|P42765|THIM_HUMAN 3-ketoacyl-CoA thiolase, mitochondrial OS=Homo sapiens OX=9606 GN=ACAA2 PE=1 SV=2	124	QAPYCVRNVRFG
AAPYQVRIVRFG	tr|Q6UZF1|Q6UZF1_SARS	6835	tr|A0A0B4J2A4|A0A0B4J2A4_HUMAN 3-ketoacyl-CoA thiolase, mitochondrial OS=Homo sapiens OX=9606 GN=ACAA2 PE=1 SV=1	121	QAPYCVRNVRFG
AAPYQVRIVRFG	tr|Q6UZF1|Q6UZF1_SARS	6835	tr|K7EME0|K7EME0_HUMAN 3-ketoacyl-CoA thiolase, mitochondrial OS=Homo sapiens OX=9606 GN=ACAA2 PE=1 SV=1	69	QAPYCVRNVRFG
AEEEDEDDFVEE	tr|Q6UZF1|Q6UZF1_SARS	973	sp|O00213|APBB1_HUMAN Amyloid-beta A4 precursor protein-binding family B member 1 OS=Homo sapiens OX=9606 GN=APBB1 PE=1 SV=2	157	AEEEEEDDDDEE
AEEEDEDDFVEE	tr|Q6UZF1|Q6UZF1_SARS	973	tr|A0A075B7G8|A0A075B7G8_HUMAN Amyloid-beta A4 precursor protein-binding family B member 1 OS=Homo sapiens OX=9606 GN=APBB1 PE=1 SV=7	157	AEEEEEDDDDEE
AEEEDEDDFVEE	tr|Q6UZF1|Q6UZF1_SARS	973	tr|J3KPL8|J3KPL8_HUMAN Amyloid-beta A4 precursor protein-binding family B member 1 OS=Homo sapiens OX=9606 GN=APBB1 PE=1 SV=1	157	AEEEEEDDDDEE
AEEEDEDDFVEE	tr|Q6UZF1|Q6UZF1_SARS	973	tr|B4DFG0|B4DFG0_HUMAN Protein DEK OS=Homo sapiens OX=9606 GN=DEK PE=1 SV=1	33	EEEEDEDDEEEE
AEEEDEDDFVEE	tr|Q6UZF1|Q6UZF1_SARS	973	tr|A0A494C198|A0A494C198_HUMAN Protein DEK OS=Homo sapiens OX=9606 GN=DEK PE=1 SV=1	33	EEEEDEDDEEEE
AEEEDEDDFVEE	tr|Q6UZF1|Q6UZF1_SARS	973	tr|D6R9L5|D6R9L5_HUMAN Protein DEK OS=Homo sapiens OX=9606 GN=DEK PE=1 SV=2	33	EEEEDEDDEEEE
AEEEDEDDFVEE	tr|Q6UZF1|Q6UZF1_SARS	973	sp|P35659|DEK_HUMAN Protein DEK OS=Homo sapiens OX=9606 GN=DEK PE=1 SV=1	33	EEEEDEDDEEEE
AEEEDEDDFVEE	tr|Q6UZF1|Q6UZF1_SARS	973	tr|A0A494C028|A0A494C028_HUMAN Protein DEK OS=Homo sapiens OX=9606 GN=DEK PE=1 SV=1	38	EEEEDEDDEEEE
AEEEDEDDFVEE	tr|Q6UZF1|Q6UZF1_SARS	973	tr|H0Y993|H0Y993_HUMAN DEK oncogene (DNA binding), isoform CRA_b OS=Homo sapiens OX=9606 GN=DEK PE=1 SV=2	33	EEEEDEDDEEEE
AEEEDEDDFVEE	tr|Q6UZF1|Q6UZF1_SARS	973	tr|H0Y8X0|H0Y8X0_HUMAN Protein DEK OS=Homo sapiens OX=9606 GN=DEK PE=1 SV=2	33	EEEEDEDDEEEE
FNVVAITGNASL	tr|Q6UZF0|Q6UZF0_SARS	855	sp|P20333|TNR1B_HUMAN Tumor necrosis factor receptor superfamily member 1B OS=Homo sapiens OX=9606 GN=TNFRSF1B PE=1 SV=3	185	CNVVAIPGNASM
EEEDEDDFVEES	tr|Q6UZF1|Q6UZF1_SARS	974	tr|B4DFG0|B4DFG0_HUMAN Protein DEK OS=Homo sapiens OX=9606 GN=DEK PE=1 SV=1	34	EEEDEDDEEEEE
EEEDEDDFVEES	tr|Q6UZF1|Q6UZF1_SARS	974	tr|A0A494C198|A0A494C198_HUMAN Protein DEK OS=Homo sapiens OX=9606 GN=DEK PE=1 SV=1	34	EEEDEDDEEEEE
EEEDEDDFVEES	tr|Q6UZF1|Q6UZF1_SARS	974	tr|D6R9L5|D6R9L5_HUMAN Protein DEK OS=Homo sapiens OX=9606 GN=DEK PE=1 SV=2	34	EEEDEDDEEEEE
EEEDEDDFVEES	tr|Q6UZF1|Q6UZF1_SARS	974	sp|P35659|DEK_HUMAN Protein DEK OS=Homo sapiens OX=9606 GN=DEK PE=1 SV=1	34	EEEDEDDEEEEE
EEEDEDDFVEES	tr|Q6UZF1|Q6UZF1_SARS	974	tr|A0A494C028|A0A494C028_HUMAN Protein DEK OS=Homo sapiens OX=9606 GN=DEK PE=1 SV=1	39	EEEDEDDEEEEE
EEEDEDDFVEES	tr|Q6UZF1|Q6UZF1_SARS	974	tr|H0Y993|H0Y993_HUMAN DEK oncogene (DNA binding), isoform CRA_b OS=Homo sapiens OX=9606 GN=DEK PE=1 SV=2	34	EEEDEDDEEEEE
EEEDEDDFVEES	tr|Q6UZF1|Q6UZF1_SARS	974	tr|H0Y8X0|H0Y8X0_HUMAN Protein DEK OS=Homo sapiens OX=9606 GN=DEK PE=1 SV=2	34	EEEDEDDEEEEE
EEEDEDDFVEES	tr|Q6UZF1|Q6UZF1_SARS	974	tr|A0A0G2JHN8|A0A0G2JHN8_HUMAN Bromodomain-containing protein 2 (Fragment) OS=Homo sapiens OX=9606 GN=BRD2 PE=1 SV=1	23	EEEDEDEEEEES
EEEDEDDFVEES	tr|Q6UZF1|Q6UZF1_SARS	974	tr|A0A140T9I1|A0A140T9I1_HUMAN Bromodomain-containing protein 2 (Fragment) OS=Homo sapiens OX=9606 GN=BRD2 PE=1 SV=1	23	EEEDEDEEEEES
NVMTKMNTISDP	tr|Q6UZF1|Q6UZF1_SARS	1409	sp|Q9P265|DIP2B_HUMAN Disco-interacting protein 2 homolog B OS=Homo sapiens OX=9606 GN=DIP2B PE=1 SV=3	574	NVMNKMHTISVP
VSPLQELVNSLG	tr|Q6UZF1|Q6UZF1_SARS	884	sp|O14981|BTAF1_HUMAN TATA-binding protein-associated factor 172 OS=Homo sapiens OX=9606 GN=BTAF1 PE=1 SV=2	1076	DSPAQELVNSLQ
VSPLQELVNSLG	tr|Q6UZF1|Q6UZF1_SARS	884	tr|A0A0A0MTH9|A0A0A0MTH9_HUMAN TATA-binding protein-associated factor 172 OS=Homo sapiens OX=9606 GN=BTAF1 PE=1 SV=1	1076	DSPAQELVNSLQ
SNVLLLLFLSGG	tr|Q6UZF1|Q6UZF1_SARS	593	sp|P24043|LAMA2_HUMAN Laminin subunit alpha-2 OS=Homo sapiens OX=9606 GN=LAMA2 PE=1 SV=4	5	AGVLLLLLLSGG
SNVLLLLFLSGG	tr|Q6UZF1|Q6UZF1_SARS	593	tr|A0A087WYF1|A0A087WYF1_HUMAN Laminin subunit alpha-2 OS=Homo sapiens OX=9606 GN=LAMA2 PE=1 SV=1	5	AGVLLLLLLSGG
SNVLLLLFLSGG	tr|Q6UZF1|Q6UZF1_SARS	593	tr|A0A087WX80|A0A087WX80_HUMAN Laminin subunit alpha-2 OS=Homo sapiens OX=9606 GN=LAMA2 PE=1 SV=1	5	AGVLLLLLLSGG
YFAAGLTAAATV	tr|Q6UZF1|Q6UZF1_SARS	2315	tr|A0A0A0MR59|A0A0A0MR59_HUMAN Pumilio homolog 2 OS=Homo sapiens OX=9606 GN=PUM2 PE=1 SV=1	268	YTAAGLAAAATL
YFAAGLTAAATV	tr|Q6UZF1|Q6UZF1_SARS	2315	tr|A0A0C4DG68|A0A0C4DG68_HUMAN Pumilio homolog 2 (Fragment) OS=Homo sapiens OX=9606 GN=PUM2 PE=1 SV=1	215	YTAAGLAAAATL
YFAAGLTAAATV	tr|Q6UZF1|Q6UZF1_SARS	2315	sp|Q8TB72|PUM2_HUMAN Pumilio homolog 2 OS=Homo sapiens OX=9606 GN=PUM2 PE=1 SV=2	324	YTAAGLAAAATL
LTATTMAVSSVE	tr|Q6UZF1|Q6UZF1_SARS	4857	sp|Q9NPI6|DCP1A_HUMAN mRNA-decapping enzyme 1A OS=Homo sapiens OX=9606 GN=DCP1A PE=1 SV=3	490	VTATTTAVSSVL
QTKSLIFDSVFS	tr|Q6UZF0|Q6UZF0_SARS	147	sp|Q9Y512|SAM50_HUMAN Sorting and assembly machinery component 50 homolog OS=Homo sapiens OX=9606 GN=SAMM50 PE=1 SV=3	304	LNKQLIFDSVFS
ATGARPSSLPQR	tr|Q6UZF1|Q6UZF1_SARS	5917	sp|Q6VUC0|AP2E_HUMAN Transcription factor AP-2-epsilon OS=Homo sapiens OX=9606 GN=TFAP2E PE=2 SV=1	19	AGGARLSSLPQA
LAKDIPQGFTSI	tr|Q6UZF0|Q6UZF0_SARS	205	sp|Q9NU22|MDN1_HUMAN Midasin OS=Homo sapiens OX=9606 GN=MDN1 PE=1 SV=2	2542	LAKNIPQGLESI
ELQKLLAQLADG	tr|Q6UZF1|Q6UZF1_SARS	561	tr|E7EWP2|E7EWP2_HUMAN Triple functional domain protein OS=Homo sapiens OX=9606 GN=TRIO PE=1 SV=2	1135	ERVKLLIQLADG
ELQKLLAQLADG	tr|Q6UZF1|Q6UZF1_SARS	561	tr|E7EPJ7|E7EPJ7_HUMAN Non-specific serine/threonine protein kinase (Fragment) OS=Homo sapiens OX=9606 GN=TRIO PE=1 SV=2	927	ERVKLLIQLADG
ELQKLLAQLADG	tr|Q6UZF1|Q6UZF1_SARS	561	sp|O75962|TRIO_HUMAN Triple functional domain protein OS=Homo sapiens OX=9606 GN=TRIO PE=1 SV=2	1194	ERVKLLIQLADG
ELQKLLAQLADG	tr|Q6UZF1|Q6UZF1_SARS	561	tr|F5H228|F5H228_HUMAN Triple functional domain protein OS=Homo sapiens OX=9606 GN=TRIO PE=1 SV=1	1145	ERVKLLIQLADG
KAATGARPSSLP	tr|Q6UZF1|Q6UZF1_SARS	5915	sp|Q8N6N2|TTC9B_HUMAN Tetratricopeptide repeat protein 9B OS=Homo sapiens OX=9606 GN=TTC9B PE=2 SV=1	96	KAAQGARPSGLP
KAATGARPSSLP	tr|Q6UZF1|Q6UZF1_SARS	5915	sp|Q6VUC0|AP2E_HUMAN Transcription factor AP-2-epsilon OS=Homo sapiens OX=9606 GN=TFAP2E PE=2 SV=1	17	AAAGGARLSSLP
EWIRRGERLAYK	tr|Q6UZF1|Q6UZF1_SARS	1502	tr|M0QYD2|M0QYD2_HUMAN Anoctamin OS=Homo sapiens OX=9606 GN=ANO8 PE=1 SV=1	301	EWKRRGAELAYK
EWIRRGERLAYK	tr|Q6UZF1|Q6UZF1_SARS	1502	sp|Q9HCE9|ANO8_HUMAN Anoctamin-8 OS=Homo sapiens OX=9606 GN=ANO8 PE=1 SV=3	301	EWKRRGAELAYK
AQMLGAKLRSLT	tr|Q6UZF1|Q6UZF1_SARS	693	sp|O00482|NR5A2_HUMAN Nuclear receptor subfamily 5 group A member 2 OS=Homo sapiens OX=9606 GN=NR5A2 PE=1 SV=2	431	AQELVAKLRSLQ
LSVLLGGAMIIL	tr|Q6UZF1|Q6UZF1_SARS	3022	sp|Q9BQJ4|TMM47_HUMAN Transmembrane protein 47 OS=Homo sapiens OX=9606 GN=TMEM47 PE=1 SV=1	82	LALLLGGAAIIL
LPGLPKDISYKH	tr|Q6UZF1|Q6UZF1_SARS	5944	tr|A0A5F9ZI01|A0A5F9ZI01_HUMAN Tyrosine-protein kinase JAK1 (Fragment) OS=Homo sapiens OX=9606 GN=JAK1 PE=1 SV=1	208	LPELPKDISYKR
LPGLPKDISYKH	tr|Q6UZF1|Q6UZF1_SARS	5944	tr|A0A5F9ZI39|A0A5F9ZI39_HUMAN Tyrosine-protein kinase OS=Homo sapiens OX=9606 GN=JAK1 PE=1 SV=1	208	LPELPKDISYKR
LPGLPKDISYKH	tr|Q6UZF1|Q6UZF1_SARS	5944	sp|P23458|JAK1_HUMAN Tyrosine-protein kinase JAK1 OS=Homo sapiens OX=9606 GN=JAK1 PE=1 SV=2	208	LPELPKDISYKR
LPGLPKDISYKH	tr|Q6UZF1|Q6UZF1_SARS	5944	tr|A0A5F9ZH32|A0A5F9ZH32_HUMAN Tyrosine-protein kinase OS=Homo sapiens OX=9606 GN=JAK1 PE=1 SV=1	208	LPELPKDISYKR
NRDIGYLVPGLP	tr|Q6UZF1|Q6UZF1_SARS	2836	sp|Q86V42|F124A_HUMAN Protein FAM124A OS=Homo sapiens OX=9606 GN=FAM124A PE=1 SV=1	243	VRDIGELVPLLP
KSLIFDSVFSCN	tr|Q6UZF0|Q6UZF0_SARS	149	sp|Q9Y512|SAM50_HUMAN Sorting and assembly machinery component 50 homolog OS=Homo sapiens OX=9606 GN=SAMM50 PE=1 SV=3	306	KQLIFDSVFSAS
EDVLDSPNAQRE	tr|Q6UZF1|Q6UZF1_SARS	2026	sp|Q7Z406|MYH14_HUMAN Myosin-14 OS=Homo sapiens OX=9606 GN=MYH14 PE=1 SV=2	1173	EDTLDSTNAQQE
EDVLDSPNAQRE	tr|Q6UZF1|Q6UZF1_SARS	2026	tr|A0A0C4DFM8|A0A0C4DFM8_HUMAN Myosin-14 OS=Homo sapiens OX=9606 GN=MYH14 PE=1 SV=1	177	EDTLDSTNAQQE
EPKKEKHKRSED	tr|Q6UZE8|Q6UZE8_SARS	368	tr|M0QZD9|M0QZD9_HUMAN Bromodomain-containing protein 4 (Fragment) OS=Homo sapiens OX=9606 GN=BRD4 PE=1 SV=1	545	EKKKEKHKRKEE
EPKKEKHKRSED	tr|Q6UZE8|Q6UZE8_SARS	368	sp|O60885|BRD4_HUMAN Bromodomain-containing protein 4 OS=Homo sapiens OX=9606 GN=BRD4 PE=1 SV=2	545	EKKKEKHKRKEE
TKAATGARPSSL	tr|Q6UZF1|Q6UZF1_SARS	5914	sp|Q8N6N2|TTC9B_HUMAN Tetratricopeptide repeat protein 9B OS=Homo sapiens OX=9606 GN=TTC9B PE=2 SV=1	95	LKAAQGARPSGL
NCARGKEQISVV	tr|Q6UZF1|Q6UZF1_SARS	719	tr|A0A1B0GWD8|A0A1B0GWD8_HUMAN Sperm flagellar protein 2 OS=Homo sapiens OX=9606 GN=SPEF2 PE=1 SV=1	1961	NCLRGKENISAV
GDYTHVIVITMI	tr|Q6UZF1|Q6UZF1_SARS	3049	tr|Q5T284|Q5T284_HUMAN Small nuclear RNA-activating complex polypeptide 3 OS=Homo sapiens OX=9606 GN=SNAPC3 PE=1 SV=1	112	GDCEHVIVITDI
GDYTHVIVITMI	tr|Q6UZF1|Q6UZF1_SARS	3049	sp|Q92966|SNPC3_HUMAN snRNA-activating protein complex subunit 3 OS=Homo sapiens OX=9606 GN=SNAPC3 PE=1 SV=1	315	GDCEHVIVITDI
DDIDCDDDEIDE	tr|Q6UZF1|Q6UZF1_SARS	934	sp|Q6PL18|ATAD2_HUMAN ATPase family AAA domain-containing protein 2 OS=Homo sapiens OX=9606 GN=ATAD2 PE=1 SV=1	270	DDDDDDDDEDDE
VNYESVKTGLQV	tr|Q6UZF1|Q6UZF1_SARS	1751	sp|Q9Y227|ENTP4_HUMAN Ectonucleoside triphosphate diphosphohydrolase 4 OS=Homo sapiens OX=9606 GN=ENTPD4 PE=1 SV=1	508	VNYKSLKTALQV
VNYESVKTGLQV	tr|Q6UZF1|Q6UZF1_SARS	1751	tr|Q8NE73|Q8NE73_HUMAN ENTPD4 protein OS=Homo sapiens OX=9606 GN=ENTPD4 PE=1 SV=1	500	VNYKSLKTALQV
VNYESVKTGLQV	tr|Q6UZF1|Q6UZF1_SARS	1751	tr|H0YBY8|H0YBY8_HUMAN Ectonucleoside triphosphate diphosphohydrolase 4 (Fragment) OS=Homo sapiens OX=9606 GN=ENTPD4 PE=1 SV=1	103	VNYKSLKTALQV
EEDDDDDIDCDD	tr|Q6UZF1|Q6UZF1_SARS	929	tr|U3KQI6|U3KQI6_HUMAN Probable G-protein-coupled receptor 162 (Fragment) OS=Homo sapiens OX=9606 GN=GPR162 PE=1 SV=1	132	EEDGDDDGGCDD
EEDDDDDIDCDD	tr|Q6UZF1|Q6UZF1_SARS	929	tr|J3KPJ9|J3KPJ9_HUMAN G protein-coupled receptor 162, isoform CRA_b OS=Homo sapiens OX=9606 GN=GPR162 PE=1 SV=1	43	EEDGDDDGGCDD
EEDDDDDIDCDD	tr|Q6UZF1|Q6UZF1_SARS	929	sp|Q16538|GP162_HUMAN Probable G-protein coupled receptor 162 OS=Homo sapiens OX=9606 GN=GPR162 PE=1 SV=1	347	EEDGDDDGGCDD
EEDDDDDIDCDD	tr|Q6UZF1|Q6UZF1_SARS	929	sp|Q02880|TOP2B_HUMAN DNA topoisomerase 2-beta OS=Homo sapiens OX=9606 GN=TOP2B PE=1 SV=3	1377	EEDDDADDDDDD
EEDDDDDIDCDD	tr|Q6UZF1|Q6UZF1_SARS	929	tr|M0QZ43|M0QZ43_HUMAN Sarcoplasmic reticulum histidine-rich calcium-binding protein OS=Homo sapiens OX=9606 GN=HRC PE=1 SV=1	245	EDDDDDDDDDDD
EEDDDDDIDCDD	tr|Q6UZF1|Q6UZF1_SARS	929	sp|P23327|SRCH_HUMAN Sarcoplasmic reticulum histidine-rich calcium-binding protein OS=Homo sapiens OX=9606 GN=HRC PE=1 SV=1	245	EDDDDDDDDDDD
EEDDDDDIDCDD	tr|Q6UZF1|Q6UZF1_SARS	929	sp|Q6PL18|ATAD2_HUMAN ATPase family AAA domain-containing protein 2 OS=Homo sapiens OX=9606 GN=ATAD2 PE=1 SV=1	263	EDDDDDDDDDDD
EEDDDDDIDCDD	tr|Q6UZF1|Q6UZF1_SARS	929	sp|Q16594|TAF9_HUMAN Transcription initiation factor TFIID subunit 9 OS=Homo sapiens OX=9606 GN=TAF9 PE=1 SV=1	249	EDDDDDDDDDDD
EEDDDDDIDCDD	tr|Q6UZF1|Q6UZF1_SARS	929	sp|Q6PL18|ATAD2_HUMAN ATPase family AAA domain-containing protein 2 OS=Homo sapiens OX=9606 GN=ATAD2 PE=1 SV=1	262	DEDDDDDDDDDD
EEDDDDDIDCDD	tr|Q6UZF1|Q6UZF1_SARS	929	tr|M0QZ43|M0QZ43_HUMAN Sarcoplasmic reticulum histidine-rich calcium-binding protein OS=Homo sapiens OX=9606 GN=HRC PE=1 SV=1	244	EEDDDDDDDDDD
EEDDDDDIDCDD	tr|Q6UZF1|Q6UZF1_SARS	929	sp|P23327|SRCH_HUMAN Sarcoplasmic reticulum histidine-rich calcium-binding protein OS=Homo sapiens OX=9606 GN=HRC PE=1 SV=1	244	EEDDDDDDDDDD
EEDDDDDIDCDD	tr|Q6UZF1|Q6UZF1_SARS	929	sp|Q16594|TAF9_HUMAN Transcription initiation factor TFIID subunit 9 OS=Homo sapiens OX=9606 GN=TAF9 PE=1 SV=1	248	REDDDDDDDDDD
EEDDDDDIDCDD	tr|Q6UZF1|Q6UZF1_SARS	929	sp|P06748|NPM_HUMAN Nucleophosmin OS=Homo sapiens OX=9606 GN=NPM1 PE=1 SV=2	169	EEDDDEDDDDDD
EEDDDDDIDCDD	tr|Q6UZF1|Q6UZF1_SARS	929	sp|A1YPR0|ZBT7C_HUMAN Zinc finger and BTB domain-containing protein 7C OS=Homo sapiens OX=9606 GN=ZBTB7C PE=2 SV=1	139	KEDDDDDEDDDD
EEDDDDDIDCDD	tr|Q6UZF1|Q6UZF1_SARS	929	sp|Q92973|TNPO1_HUMAN Transportin-1 OS=Homo sapiens OX=9606 GN=TNPO1 PE=1 SV=2	365	EDDDDDEIDDDD
EEDDDDDIDCDD	tr|Q6UZF1|Q6UZF1_SARS	929	sp|Q92973|TNPO1_HUMAN Transportin-1 OS=Homo sapiens OX=9606 GN=TNPO1 PE=1 SV=2	364	EEDDDDDEIDDD
EEDDDDDIDCDD	tr|Q6UZF1|Q6UZF1_SARS	929	tr|H7BYJ1|H7BYJ1_HUMAN E3 ubiquitin-protein ligase RNF34 OS=Homo sapiens OX=9606 GN=RNF34 PE=1 SV=1	221	TEDDDDDDDEDD
EEDDDDDIDCDD	tr|Q6UZF1|Q6UZF1_SARS	929	tr|A0A087WTM5|A0A087WTM5_HUMAN E3 ubiquitin-protein ligase RNF34 OS=Homo sapiens OX=9606 GN=RNF34 PE=1 SV=1	29	TEDDDDDDDEDD
EEDDDDDIDCDD	tr|Q6UZF1|Q6UZF1_SARS	929	sp|Q969K3|RNF34_HUMAN E3 ubiquitin-protein ligase RNF34 OS=Homo sapiens OX=9606 GN=RNF34 PE=1 SV=1	221	TEDDDDDDDEDD
EEDDDDDIDCDD	tr|Q6UZF1|Q6UZF1_SARS	929	tr|A0A0A0MQV9|A0A0A0MQV9_HUMAN Histone-lysine N-methyltransferase SETD1B OS=Homo sapiens OX=9606 GN=SETD1B PE=1 SV=1	1059	EEEDDDDDDSDD
EEDDDDDIDCDD	tr|Q6UZF1|Q6UZF1_SARS	929	sp|Q8WV41|SNX33_HUMAN Sorting nexin-33 OS=Homo sapiens OX=9606 GN=SNX33 PE=1 SV=1	110	EEDDDDDWDDWD
ISLACLVAVVVC	tr|Q6UZF1|Q6UZF1_SARS	2753	tr|A0A1W2PQM5|A0A1W2PQM5_HUMAN Glutathione transferase OS=Homo sapiens OX=9606 GN=GSTT4 PE=3 SV=1	163	ISLADLVAVVEM
ISLACLVAVVVC	tr|Q6UZF1|Q6UZF1_SARS	2753	sp|A0A1W2PR19|GSTT4_HUMAN Glutathione S-transferase theta-4 OS=Homo sapiens OX=9606 GN=GSTT4 PE=3 SV=1	163	ISLADLVAVVEM
ISLACLVAVVVC	tr|Q6UZF1|Q6UZF1_SARS	2753	tr|A0A1W2PRG0|A0A1W2PRG0_HUMAN Glutathione transferase OS=Homo sapiens OX=9606 PE=3 SV=1	163	ISLADLVAVVEM
ADSHAIQLNDLS	tr|Q6UZF1|Q6UZF1_SARS	4081	sp|P24043|LAMA2_HUMAN Laminin subunit alpha-2 OS=Homo sapiens OX=9606 GN=LAMA2 PE=1 SV=4	1893	AESHAAQLNDSS
ADSHAIQLNDLS	tr|Q6UZF1|Q6UZF1_SARS	4081	tr|A0A087WYF1|A0A087WYF1_HUMAN Laminin subunit alpha-2 OS=Homo sapiens OX=9606 GN=LAMA2 PE=1 SV=1	1893	AESHAAQLNDSS
ADSHAIQLNDLS	tr|Q6UZF1|Q6UZF1_SARS	4081	tr|A0A087WX80|A0A087WX80_HUMAN Laminin subunit alpha-2 OS=Homo sapiens OX=9606 GN=LAMA2 PE=1 SV=1	1893	AESHAAQLNDSS
LQKTVPELQKLL	tr|Q6UZF1|Q6UZF1_SARS	555	sp|P31146|COR1A_HUMAN Coronin-1A OS=Homo sapiens OX=9606 GN=CORO1A PE=1 SV=4	440	LQATVQELQKRL
LQKTVPELQKLL	tr|Q6UZF1|Q6UZF1_SARS	555	tr|H3BRY3|H3BRY3_HUMAN Coronin OS=Homo sapiens OX=9606 GN=CORO1A PE=1 SV=1	368	LQATVQELQKRL
SEPKKEKHKRSE	tr|Q6UZE8|Q6UZE8_SARS	367	tr|M0QZD9|M0QZD9_HUMAN Bromodomain-containing protein 4 (Fragment) OS=Homo sapiens OX=9606 GN=BRD4 PE=1 SV=1	544	KEKKKEKHKRKE
SEPKKEKHKRSE	tr|Q6UZE8|Q6UZE8_SARS	367	sp|O60885|BRD4_HUMAN Bromodomain-containing protein 4 OS=Homo sapiens OX=9606 GN=BRD4 PE=1 SV=2	544	KEKKKEKHKRKE
GKLLSQCYRVVA	tr|Q6UZF1|Q6UZF1_SARS	2740	sp|P0C7T5|ATX1L_HUMAN Ataxin-1-like OS=Homo sapiens OX=9606 GN=ATXN1L PE=1 SV=1	342	GALASQDYRVVA
DDDDIDCDDDEI	tr|Q6UZF1|Q6UZF1_SARS	932	sp|Q6PL18|ATAD2_HUMAN ATPase family AAA domain-containing protein 2 OS=Homo sapiens OX=9606 GN=ATAD2 PE=1 SV=1	268	DDDDDDDDDDED
DDDDIDCDDDEI	tr|Q6UZF1|Q6UZF1_SARS	932	tr|A0A494C084|A0A494C084_HUMAN Asporin (Fragment) OS=Homo sapiens OX=9606 GN=ASPN PE=1 SV=1	14	DDDDDDDDDDED
DDDDIDCDDDEI	tr|Q6UZF1|Q6UZF1_SARS	932	tr|Q5TBF2|Q5TBF2_HUMAN Asporin OS=Homo sapiens OX=9606 GN=ASPN PE=1 SV=1	42	DDDDDDDDDDED
DDDDIDCDDDEI	tr|Q6UZF1|Q6UZF1_SARS	932	sp|Q9BXN1|ASPN_HUMAN Asporin OS=Homo sapiens OX=9606 GN=ASPN PE=1 SV=2	42	DDDDDDDDDDED
DDDDIDCDDDEI	tr|Q6UZF1|Q6UZF1_SARS	932	tr|A0A494C1J0|A0A494C1J0_HUMAN Asporin OS=Homo sapiens OX=9606 GN=ASPN PE=1 SV=1	42	DDDDDDDDDDED
DDDDIDCDDDEI	tr|Q6UZF1|Q6UZF1_SARS	932	sp|O94763|RMP_HUMAN Unconventional prefoldin RPB5 interactor 1 OS=Homo sapiens OX=9606 GN=URI1 PE=1 SV=3	302	DDDDDDDDDDNI
DDDDIDCDDDEI	tr|Q6UZF1|Q6UZF1_SARS	932	tr|I3L280|I3L280_HUMAN Unconventional prefoldin RPB5 interactor 1 (Fragment) OS=Homo sapiens OX=9606 GN=URI1 PE=1 SV=1	49	DDDDDDDDDDNI
DCTKAATGARPS	tr|Q6UZF1|Q6UZF1_SARS	5912	sp|Q96GY3|LIN37_HUMAN Protein lin-37 homolog OS=Homo sapiens OX=9606 GN=LIN37 PE=1 SV=1	55	DCSIAATGKRPS
FSKGTVGGLKAA	tr|Q6UZF1|Q6UZF1_SARS	6669	sp|Q5VTL7|FNDC7_HUMAN Fibronectin type III domain-containing protein 7 OS=Homo sapiens OX=9606 GN=FNDC7 PE=2 SV=3	75	NSPGTVTGLKAA
RISLACLVAVVV	tr|Q6UZF1|Q6UZF1_SARS	2752	tr|A0A1W2PQM5|A0A1W2PQM5_HUMAN Glutathione transferase OS=Homo sapiens OX=9606 GN=GSTT4 PE=3 SV=1	162	QISLADLVAVVE
RISLACLVAVVV	tr|Q6UZF1|Q6UZF1_SARS	2752	sp|A0A1W2PR19|GSTT4_HUMAN Glutathione S-transferase theta-4 OS=Homo sapiens OX=9606 GN=GSTT4 PE=3 SV=1	162	QISLADLVAVVE
RISLACLVAVVV	tr|Q6UZF1|Q6UZF1_SARS	2752	tr|A0A1W2PRG0|A0A1W2PRG0_HUMAN Glutathione transferase OS=Homo sapiens OX=9606 PE=3 SV=1	162	QISLADLVAVVE
AELPGLPKDISY	tr|Q6UZF1|Q6UZF1_SARS	5942	tr|A0A5F9ZI01|A0A5F9ZI01_HUMAN Tyrosine-protein kinase JAK1 (Fragment) OS=Homo sapiens OX=9606 GN=JAK1 PE=1 SV=1	206	MQLPELPKDISY
AELPGLPKDISY	tr|Q6UZF1|Q6UZF1_SARS	5942	tr|A0A5F9ZI39|A0A5F9ZI39_HUMAN Tyrosine-protein kinase OS=Homo sapiens OX=9606 GN=JAK1 PE=1 SV=1	206	MQLPELPKDISY
AELPGLPKDISY	tr|Q6UZF1|Q6UZF1_SARS	5942	sp|P23458|JAK1_HUMAN Tyrosine-protein kinase JAK1 OS=Homo sapiens OX=9606 GN=JAK1 PE=1 SV=2	206	MQLPELPKDISY
AELPGLPKDISY	tr|Q6UZF1|Q6UZF1_SARS	5942	tr|A0A5F9ZH32|A0A5F9ZH32_HUMAN Tyrosine-protein kinase OS=Homo sapiens OX=9606 GN=JAK1 PE=1 SV=1	206	MQLPELPKDISY
