query	query_seqname	query_start	target_seqname	target_start	target
SKKPNLQQNEKE	sp|O36633|GLYC_HRSVB	232	sp|P28288|ABCD3_HUMAN ATP-binding cassette sub-family D member 3 OS=Homo sapiens OX=9606 GN=ABCD3 PE=1 SV=1	40	SGKPPLQNNEKE
SKKPNLQQNEKE	sp|O36633|GLYC_HRSVB	232	tr|A0A3B3ITW3|A0A3B3ITW3_HUMAN ATP-binding cassette sub-family D member 3 OS=Homo sapiens OX=9606 GN=ABCD3 PE=1 SV=2	40	SGKPPLQNNEKE
GLSNKNNHFSES	sp|O36635|L_HRSVB	676	tr|A0A0C4DFR0|A0A0C4DFR0_HUMAN Dynein heavy chain 11, axonemal OS=Homo sapiens OX=9606 GN=DNAH11 PE=1 SV=1	170	VLSNKNNHKSWS
GLSNKNNHFSES	sp|O36635|L_HRSVB	676	tr|A0A087WYC6|A0A087WYC6_HUMAN Dynein heavy chain 11, axonemal OS=Homo sapiens OX=9606 GN=DNAH11 PE=1 SV=1	170	VLSNKNNHKSWS
GLSNKNNHFSES	sp|O36635|L_HRSVB	676	sp|Q96DT5|DYH11_HUMAN Dynein heavy chain 11, axonemal OS=Homo sapiens OX=9606 GN=DNAH11 PE=1 SV=4	170	VLSNKNNHKSWS
LKLLITFIELIK	sp|O36635|L_HRSVB	1636	sp|A5YKK6|CNOT1_HUMAN CCR4-NOT transcription complex subunit 1 OS=Homo sapiens OX=9606 GN=CNOT1 PE=1 SV=2	2320	WGLLITFIELIK
DIKNYLSTSVLP	sp|O36634|FUS_HRSVB	194	tr|G3V2U4|G3V2U4_HUMAN Protein unc-79 homolog OS=Homo sapiens OX=9606 GN=UNC79 PE=1 SV=1	192	DIIEYLSTSFLP
DIKNYLSTSVLP	sp|O36634|FUS_HRSVB	194	sp|Q9P2D8|UNC79_HUMAN Protein unc-79 homolog OS=Homo sapiens OX=9606 GN=UNC79 PE=2 SV=4	192	DIIEYLSTSFLP
KVYLDNRLLKYM	sp|O36635|L_HRSVB	1580	tr|F5H2B9|F5H2B9_HUMAN Uveal autoantigen with coiled-coil domains and ankyrin repeats OS=Homo sapiens OX=9606 GN=UACA PE=1 SV=1	612	KVYLDNKLLKEQ
KVYLDNRLLKYM	sp|O36635|L_HRSVB	1580	tr|H0YNH8|H0YNH8_HUMAN Uveal autoantigen with coiled-coil domains and ankyrin repeats OS=Homo sapiens OX=9606 GN=UACA PE=1 SV=1	706	KVYLDNKLLKEQ
KVYLDNRLLKYM	sp|O36635|L_HRSVB	1580	sp|Q9BZF9|UACA_HUMAN Uveal autoantigen with coiled-coil domains and ankyrin repeats OS=Homo sapiens OX=9606 GN=UACA PE=1 SV=2	721	KVYLDNKLLKEQ
SFETSDEDSSYS	sp|O42062|PHOSP_HRSVB	108	tr|E9PM87|E9PM87_HUMAN Tyrosine-protein phosphatase non-receptor type 22 OS=Homo sapiens OX=9606 GN=PTPN22 PE=1 SV=1	74	SLITSDEDSSYI
SFETSDEDSSYS	sp|O42062|PHOSP_HRSVB	108	tr|A0A0A0MTD9|A0A0A0MTD9_HUMAN Tyrosine-protein phosphatase non-receptor type 22 OS=Homo sapiens OX=9606 GN=PTPN22 PE=1 SV=1	74	SLITSDEDSSYI
SFETSDEDSSYS	sp|O42062|PHOSP_HRSVB	108	tr|F5H2S8|F5H2S8_HUMAN Tyrosine-protein phosphatase non-receptor type 22 OS=Homo sapiens OX=9606 GN=PTPN22 PE=1 SV=2	74	SLITSDEDSSYI
SFETSDEDSSYS	sp|O42062|PHOSP_HRSVB	108	sp|Q9Y2R2|PTN22_HUMAN Tyrosine-protein phosphatase non-receptor type 22 OS=Homo sapiens OX=9606 GN=PTPN22 PE=1 SV=2	74	SLITSDEDSSYI
SFETSDEDSSYS	sp|O42062|PHOSP_HRSVB	108	tr|A0A0B4J1S7|A0A0B4J1S7_HUMAN Tyrosine-protein phosphatase non-receptor type 22 OS=Homo sapiens OX=9606 GN=PTPN22 PE=1 SV=1	74	SLITSDEDSSYI
SFETSDEDSSYS	sp|O42062|PHOSP_HRSVB	108	tr|E9PMT0|E9PMT0_HUMAN Tyrosine-protein phosphatase non-receptor type 22 OS=Homo sapiens OX=9606 GN=PTPN22 PE=1 SV=1	74	SLITSDEDSSYI
SFETSDEDSSYS	sp|O42062|PHOSP_HRSVB	108	tr|A0A0A0MTE6|A0A0A0MTE6_HUMAN Tyrosine-protein phosphatase non-receptor type 22 OS=Homo sapiens OX=9606 GN=PTPN22 PE=1 SV=1	74	SLITSDEDSSYI
TKVLNDKFGEEE	sp|O36635|L_HRSVB	1369	sp|P55289|CAD12_HUMAN Cadherin-12 OS=Homo sapiens OX=9606 GN=CDH12 PE=2 SV=2	775	FKVLADMFGEEE
QKVYLDNRLLKY	sp|O36635|L_HRSVB	1579	tr|F5H2B9|F5H2B9_HUMAN Uveal autoantigen with coiled-coil domains and ankyrin repeats OS=Homo sapiens OX=9606 GN=UACA PE=1 SV=1	611	EKVYLDNKLLKE
QKVYLDNRLLKY	sp|O36635|L_HRSVB	1579	tr|H0YNH8|H0YNH8_HUMAN Uveal autoantigen with coiled-coil domains and ankyrin repeats OS=Homo sapiens OX=9606 GN=UACA PE=1 SV=1	705	EKVYLDNKLLKE
QKVYLDNRLLKY	sp|O36635|L_HRSVB	1579	sp|Q9BZF9|UACA_HUMAN Uveal autoantigen with coiled-coil domains and ankyrin repeats OS=Homo sapiens OX=9606 GN=UACA PE=1 SV=2	720	EKVYLDNKLLKE
IGLAGLIDNYVG	sp|O42050|M21_HRSVB	74	tr|A0A669KB03|A0A669KB03_HUMAN DNA mismatch repair protein Mlh1 OS=Homo sapiens OX=9606 GN=MLH1 PE=1 SV=1	393	IGLPLLIDNYVP
IGLAGLIDNYVG	sp|O42050|M21_HRSVB	74	sp|P40692|MLH1_HUMAN DNA mismatch repair protein Mlh1 OS=Homo sapiens OX=9606 GN=MLH1 PE=1 SV=1	637	IGLPLLIDNYVP
IGLAGLIDNYVG	sp|O42050|M21_HRSVB	74	tr|A0A669KAW3|A0A669KAW3_HUMAN DNA mismatch repair protein Mlh1 (Fragment) OS=Homo sapiens OX=9606 GN=MLH1 PE=1 SV=1	567	IGLPLLIDNYVP
LSGREKDLTIGK	sp|O36635|L_HRSVB	616	tr|I3L4A6|I3L4A6_HUMAN Mixed lineage kinase domain-like protein (Fragment) OS=Homo sapiens OX=9606 GN=MLKL PE=1 SV=1	118	LLDREKDLTLGK
LSGREKDLTIGK	sp|O36635|L_HRSVB	616	sp|Q8NB16|MLKL_HUMAN Mixed lineage kinase domain-like protein OS=Homo sapiens OX=9606 GN=MLKL PE=1 SV=1	294	LLDREKDLTLGK
DIKTKGYIILET	sp|O36635|L_HRSVB	225	tr|C9JZG1|C9JZG1_HUMAN Eukaryotic translation initiation factor 3 subunit B (Fragment) OS=Homo sapiens OX=9606 GN=EIF3B PE=1 SV=1	187	DGKTKGYIFLEY
DIKTKGYIILET	sp|O36635|L_HRSVB	225	sp|P55884|EIF3B_HUMAN Eukaryotic translation initiation factor 3 subunit B OS=Homo sapiens OX=9606 GN=EIF3B PE=1 SV=3	226	DGKTKGYIFLEY
LLNNSSCRVTNL	sp|O36634|FUS_HRSVB	206	sp|Q58WW2|DCAF6_HUMAN DDB1- and CUL4-associated factor 6 OS=Homo sapiens OX=9606 GN=DCAF6 PE=1 SV=1	248	HLNNKSCRVTSL
LLNNSSCRVTNL	sp|O36634|FUS_HRSVB	206	tr|F2Z305|F2Z305_HUMAN DDB1- and CUL4-associated factor 6 OS=Homo sapiens OX=9606 GN=DCAF6 PE=1 SV=1	248	HLNNKSCRVTSL
ILSRQLKALSSE	sp|O36635|L_HRSVB	1686	sp|O43889|CREB3_HUMAN Cyclic AMP-responsive element-binding protein 3 OS=Homo sapiens OX=9606 GN=CREB3 PE=1 SV=2	261	VLSRQLRALPSE
VSLHSNLLKKAV	sp|O36635|L_HRSVB	183	sp|Q8N139|ABCA6_HUMAN ATP-binding cassette sub-family A member 6 OS=Homo sapiens OX=9606 GN=ABCA6 PE=1 SV=2	315	VFLMSVLLKKAV
TLCKSVPTQKPR	sp|O36633|GLYC_HRSVB	184	tr|E7ERK8|E7ERK8_HUMAN Rho GTPase-activating protein 44 OS=Homo sapiens OX=9606 GN=ARHGAP44 PE=1 SV=3	722	TLSKSRPTPKPR
TLCKSVPTQKPR	sp|O36633|GLYC_HRSVB	184	sp|Q17R89|RHG44_HUMAN Rho GTPase-activating protein 44 OS=Homo sapiens OX=9606 GN=ARHGAP44 PE=1 SV=1	722	TLSKSRPTPKPR
TLCKSVPTQKPR	sp|O36633|GLYC_HRSVB	184	tr|K7EK86|K7EK86_HUMAN Rho GTPase-activating protein 44 (Fragment) OS=Homo sapiens OX=9606 GN=ARHGAP44 PE=4 SV=1	118	TLSKSRPTPKPR
NATFLRRINLNQ	sp|O36635|L_HRSVB	1333	sp|O60938|KERA_HUMAN Keratocan OS=Homo sapiens OX=9606 GN=KERA PE=1 SV=1	93	NATQLRWINLNK
LNNSSCRVTNLD	sp|O36634|FUS_HRSVB	207	sp|Q58WW2|DCAF6_HUMAN DDB1- and CUL4-associated factor 6 OS=Homo sapiens OX=9606 GN=DCAF6 PE=1 SV=1	249	LNNKSCRVTSLC
LNNSSCRVTNLD	sp|O36634|FUS_HRSVB	207	tr|F2Z305|F2Z305_HUMAN DDB1- and CUL4-associated factor 6 OS=Homo sapiens OX=9606 GN=DCAF6 PE=1 SV=1	249	LNNKSCRVTSLC
TDIKTKGYIILE	sp|O36635|L_HRSVB	224	tr|C9JZG1|C9JZG1_HUMAN Eukaryotic translation initiation factor 3 subunit B (Fragment) OS=Homo sapiens OX=9606 GN=EIF3B PE=1 SV=1	186	EDGKTKGYIFLE
TDIKTKGYIILE	sp|O36635|L_HRSVB	224	sp|P55884|EIF3B_HUMAN Eukaryotic translation initiation factor 3 subunit B OS=Homo sapiens OX=9606 GN=EIF3B PE=1 SV=3	225	EDGKTKGYIFLE
KDAGFHLKLSGL	sp|O42053|NCAP_HRSVB	84	tr|A0A0X1KG73|A0A0X1KG73_HUMAN Ryanodine receptor 3 OS=Homo sapiens OX=9606 GN=RYR3 PE=1 SV=1	3674	KDAGFFQSLSGL
KDAGFHLKLSGL	sp|O42053|NCAP_HRSVB	84	tr|A0A087X080|A0A087X080_HUMAN Ryanodine receptor 3 OS=Homo sapiens OX=9606 GN=RYR3 PE=1 SV=1	3678	KDAGFFQSLSGL
KDAGFHLKLSGL	sp|O42053|NCAP_HRSVB	84	sp|Q15413|RYR3_HUMAN Ryanodine receptor 3 OS=Homo sapiens OX=9606 GN=RYR3 PE=1 SV=3	3675	KDAGFFQSLSGL
KDAGFHLKLSGL	sp|O42053|NCAP_HRSVB	84	tr|A0A0U1RRH1|A0A0U1RRH1_HUMAN Ryanodine receptor 3 OS=Homo sapiens OX=9606 GN=RYR3 PE=1 SV=1	3670	KDAGFFQSLSGL
ELSGILDLDRSD	sp|O42050|M21_HRSVB	59	sp|Q96B97|SH3K1_HUMAN SH3 domain-containing kinase-binding protein 1 OS=Homo sapiens OX=9606 GN=SH3KBP1 PE=1 SV=2	445	SLSGILDKDLSD
ELSGILDLDRSD	sp|O42050|M21_HRSVB	59	tr|Q5JPT2|Q5JPT2_HUMAN SH3 domain-containing kinase-binding protein 1 (Fragment) OS=Homo sapiens OX=9606 GN=SH3KBP1 PE=1 SV=1	425	SLSGILDKDLSD
LFFLNKIEGKSL	sp|O36634|FUS_HRSVB	456	sp|P04114|APOB_HUMAN Apolipoprotein B-100 OS=Homo sapiens OX=9606 GN=APOB PE=1 SV=2	2844	LFFGNAIEGKSN
PNCILFIGDGLG	sp|O36635|L_HRSVB	1846	sp|P09923|PPBI_HUMAN Intestinal-type alkaline phosphatase OS=Homo sapiens OX=9606 GN=ALPI PE=1 SV=2	53	KNLILFLGDGLG
