query	query_seqname	query_start	target_seqname	target_start	target
IKSFDISSCPHL	sp|P21401|GP_RVFVZ	394	tr|C9JG08|C9JG08_HUMAN Uncharacterized protein C2orf16 OS=Homo sapiens OX=9606 GN=C2orf16 PE=1 SV=2	2633	IKSMDFSSGPHL
TFFLDLFGLSIG	sp|P27316|L_RVFVZ	617	sp|Q9HBA0|TRPV4_HUMAN Transient receptor potential cation channel subfamily V member 4 OS=Homo sapiens OX=9606 GN=TRPV4 PE=1 SV=2	668	TFLLDLFKLTIG
YTRAGKLRGMDE	sp|P27316|L_RVFVZ	1617	sp|Q96ST3|SIN3A_HUMAN Paired amphipathic helix protein Sin3a OS=Homo sapiens OX=9606 GN=SIN3A PE=1 SV=2	870	NTAAQKLRGMDE
DTSLANLRETCV	sp|P21401|GP_RVFVZ	937	sp|P48594|SPB4_HUMAN Serpin B4 OS=Homo sapiens OX=9606 GN=SERPINB4 PE=1 SV=2	269	WTSLQNMRETCV
DTSLANLRETCV	sp|P21401|GP_RVFVZ	937	tr|H0Y5H9|H0Y5H9_HUMAN Serpin B4 (Fragment) OS=Homo sapiens OX=9606 GN=SERPINB4 PE=1 SV=1	250	WTSLQNMRETCV
TSLANLRETCVR	sp|P21401|GP_RVFVZ	938	sp|P48594|SPB4_HUMAN Serpin B4 OS=Homo sapiens OX=9606 GN=SERPINB4 PE=1 SV=2	270	TSLQNMRETCVD
TSLANLRETCVR	sp|P21401|GP_RVFVZ	938	tr|H0Y5H9|H0Y5H9_HUMAN Serpin B4 (Fragment) OS=Homo sapiens OX=9606 GN=SERPINB4 PE=1 SV=1	251	TSLQNMRETCVD
KERRREYLRLFG	sp|P21700|NCAP_RVFVZ	211	sp|P25791|RBTN2_HUMAN Rhombotin-2 OS=Homo sapiens OX=9606 GN=LMO2 PE=1 SV=1	78	KLCRRDYLRLFG
FNNPMSLVVTSQ	sp|P21700|NCAP_RVFVZ	196	sp|Q13049|TRI32_HUMAN E3 ubiquitin-protein ligase TRIM32 OS=Homo sapiens OX=9606 GN=TRIM32 PE=1 SV=2	371	FNLPVSLYVTSQ
EEMAAELEWLYG	sp|P27316|L_RVFVZ	377	sp|P35354|PGH2_HUMAN Prostaglandin G/H synthase 2 OS=Homo sapiens OX=9606 GN=PTGS2 PE=1 SV=2	471	KEMSAELEALYG
EEMAAELEWLYG	sp|P27316|L_RVFVZ	377	tr|A0A2R8YDM0|A0A2R8YDM0_HUMAN Prostaglandin-endoperoxide synthase (Fragment) OS=Homo sapiens OX=9606 GN=PTGS1 PE=1 SV=1	338	KEMAAELEELYG
EEMAAELEWLYG	sp|P27316|L_RVFVZ	377	tr|A0A087X296|A0A087X296_HUMAN Cyclooxygenase-1 OS=Homo sapiens OX=9606 GN=PTGS1 PE=1 SV=1	436	KEMAAELEELYG
EEMAAELEWLYG	sp|P27316|L_RVFVZ	377	sp|P23219|PGH1_HUMAN Prostaglandin G/H synthase 1 OS=Homo sapiens OX=9606 GN=PTGS1 PE=1 SV=2	484	KEMAAELEELYG
FGKLVEKSDKLV	sp|P27316|L_RVFVZ	83	sp|Q6W2J9|BCOR_HUMAN BCL-6 corepressor OS=Homo sapiens OX=9606 GN=BCOR PE=1 SV=1	793	QGKTVVKSDKLV
FGKLVEKSDKLV	sp|P27316|L_RVFVZ	83	tr|H7BYY2|H7BYY2_HUMAN BCL-6 corepressor (Fragment) OS=Homo sapiens OX=9606 GN=BCOR PE=1 SV=1	793	QGKTVVKSDKLV
FGKLVEKSDKLV	sp|P27316|L_RVFVZ	83	tr|H7C231|H7C231_HUMAN BCL-6 corepressor (Fragment) OS=Homo sapiens OX=9606 GN=BCOR PE=1 SV=2	264	QGKTVVKSDKLV
FGKLVEKSDKLV	sp|P27316|L_RVFVZ	83	tr|A1A564|A1A564_HUMAN BCL-6 corepressor OS=Homo sapiens OX=9606 GN=BCOR PE=1 SV=1	200	QGKTVVKSDKLV
LEEKAISDDLSS	sp|P27316|L_RVFVZ	658	sp|Q96HP0|DOCK6_HUMAN Dedicator of cytokinesis protein 6 OS=Homo sapiens OX=9606 GN=DOCK6 PE=1 SV=3	1655	LEESAISDDILS
LEEKAISDDLSS	sp|P27316|L_RVFVZ	658	tr|K7ESB7|K7ESB7_HUMAN Dedicator of cytokinesis protein 6 (Fragment) OS=Homo sapiens OX=9606 GN=DOCK6 PE=1 SV=1	944	LEESAISDDILS
LEEKAISDDLSS	sp|P27316|L_RVFVZ	658	tr|K7EP51|K7EP51_HUMAN Dedicator of cytokinesis protein 6 (Fragment) OS=Homo sapiens OX=9606 GN=DOCK6 PE=1 SV=1	19	LEESAISDDILS
EGSLTSVDAGLT	sp|P21401|GP_RVFVZ	867	tr|H0YKM7|H0YKM7_HUMAN Alpha-mannosidase 2x (Fragment) OS=Homo sapiens OX=9606 GN=MAN2A2 PE=1 SV=8	81	NGSLTSSTAGLT
GSKLGKGCSLVQ	sp|P27316|L_RVFVZ	506	sp|Q5H8C1|FREM1_HUMAN FRAS1-related extracellular matrix protein 1 OS=Homo sapiens OX=9606 GN=FREM1 PE=1 SV=3	2144	RSKLGKSCVLVQ
ELRSSVFSRAVE	sp|P27316|L_RVFVZ	1973	sp|P41181|AQP2_HUMAN Aquaporin-2 OS=Homo sapiens OX=9606 GN=AQP2 PE=1 SV=1	3	ELRSIAFSRAVF
ELRSSVFSRAVE	sp|P27316|L_RVFVZ	1973	tr|F8W0S2|F8W0S2_HUMAN Aquaporin-2 OS=Homo sapiens OX=9606 GN=AQP2 PE=1 SV=1	3	ELRSIAFSRAVF
ELRSSVFSRAVE	sp|P27316|L_RVFVZ	1973	tr|F8VPL3|F8VPL3_HUMAN Aquaporin-2 (Fragment) OS=Homo sapiens OX=9606 GN=AQP2 PE=1 SV=1	3	ELRSIAFSRAVF
SDIFCSSNEEEG	sp|P21401|GP_RVFVZ	300	sp|P43361|MAGA8_HUMAN Melanoma-associated antigen 8 OS=Homo sapiens OX=9606 GN=MAGEA8 PE=1 SV=2	83	SDEGSSSNEEEG
KHKMGAAKCEKR	sp|P21401|GP_RVFVZ	109	sp|Q96QF7|ACRC_HUMAN Acidic repeat-containing protein OS=Homo sapiens OX=9606 GN=GCNA PE=1 SV=1	475	KKKPGAAKVEKR
MDQNGRPNAVVA	sp|P21700|NCAP_RVFVZ	224	sp|Q13107|UBP4_HUMAN Ubiquitin carboxyl-terminal hydrolase 4 OS=Homo sapiens OX=9606 GN=USP4 PE=1 SV=3	421	KDANGRPDAVVA
EVNEYEGSLTSV	sp|P21401|GP_RVFVZ	862	sp|Q8WXG9|AGRV1_HUMAN Adhesion G-protein coupled receptor V1 OS=Homo sapiens OX=9606 GN=ADGRV1 PE=1 SV=2	2970	EVNETHGSLTLV
DELRSSVFSRAV	sp|P27316|L_RVFVZ	1972	sp|P41181|AQP2_HUMAN Aquaporin-2 OS=Homo sapiens OX=9606 GN=AQP2 PE=1 SV=1	2	WELRSIAFSRAV
DELRSSVFSRAV	sp|P27316|L_RVFVZ	1972	tr|F8W0S2|F8W0S2_HUMAN Aquaporin-2 OS=Homo sapiens OX=9606 GN=AQP2 PE=1 SV=1	2	WELRSIAFSRAV
DELRSSVFSRAV	sp|P27316|L_RVFVZ	1972	tr|F8VPL3|F8VPL3_HUMAN Aquaporin-2 (Fragment) OS=Homo sapiens OX=9606 GN=AQP2 PE=1 SV=1	2	WELRSIAFSRAV
TSQFASKERRRE	sp|P21700|NCAP_RVFVZ	205	tr|B1AVV0|B1AVV0_HUMAN Cadherin-23 OS=Homo sapiens OX=9606 GN=CDH23 PE=1 SV=3	1148	TSQFPGKELRRE
VSARASQSFSES	sp|P27316|L_RVFVZ	852	tr|A6NNK5|A6NNK5_HUMAN TP53-binding protein 1 OS=Homo sapiens OX=9606 GN=TP53BP1 PE=1 SV=2	892	PSAHASQSFCES
VSARASQSFSES	sp|P27316|L_RVFVZ	852	sp|Q12888|TP53B_HUMAN TP53-binding protein 1 OS=Homo sapiens OX=9606 GN=TP53BP1 PE=1 SV=2	887	PSAHASQSFCES
VSARASQSFSES	sp|P27316|L_RVFVZ	852	tr|H7C3N7|H7C3N7_HUMAN TP53-binding protein 1 (Fragment) OS=Homo sapiens OX=9606 GN=TP53BP1 PE=1 SV=1	134	PSAHASQSFCES
VSARASQSFSES	sp|P27316|L_RVFVZ	852	tr|C9JXV0|C9JXV0_HUMAN TP53-binding protein 1 (Fragment) OS=Homo sapiens OX=9606 GN=TP53BP1 PE=1 SV=1	892	PSAHASQSFCES
GKLVEKSDKLVI	sp|P27316|L_RVFVZ	84	sp|Q6W2J9|BCOR_HUMAN BCL-6 corepressor OS=Homo sapiens OX=9606 GN=BCOR PE=1 SV=1	794	GKTVVKSDKLVY
GKLVEKSDKLVI	sp|P27316|L_RVFVZ	84	tr|H7BYY2|H7BYY2_HUMAN BCL-6 corepressor (Fragment) OS=Homo sapiens OX=9606 GN=BCOR PE=1 SV=1	794	GKTVVKSDKLVY
GKLVEKSDKLVI	sp|P27316|L_RVFVZ	84	tr|H7C231|H7C231_HUMAN BCL-6 corepressor (Fragment) OS=Homo sapiens OX=9606 GN=BCOR PE=1 SV=2	265	GKTVVKSDKLVY
GKLVEKSDKLVI	sp|P27316|L_RVFVZ	84	tr|A1A564|A1A564_HUMAN BCL-6 corepressor OS=Homo sapiens OX=9606 GN=BCOR PE=1 SV=1	201	GKTVVKSDKLVY
FNLLSRVLAYSG	sp|P27316|L_RVFVZ	1450	tr|A0A499FJI4|A0A499FJI4_HUMAN RCR-type E3 ubiquitin transferase OS=Homo sapiens OX=9606 GN=MYCBP2 PE=1 SV=1	3976	FELLSMVLALSG
FNLLSRVLAYSG	sp|P27316|L_RVFVZ	1450	tr|H7C3U4|H7C3U4_HUMAN E3 ubiquitin-protein ligase MYCBP2 (Fragment) OS=Homo sapiens OX=9606 GN=MYCBP2 PE=1 SV=1	397	FELLSMVLALSG
FNLLSRVLAYSG	sp|P27316|L_RVFVZ	1450	sp|O75592|MYCB2_HUMAN E3 ubiquitin-protein ligase MYCBP2 OS=Homo sapiens OX=9606 GN=MYCBP2 PE=1 SV=4	4014	FELLSMVLALSG
TGASEAGQSIVP	sp|P27316|L_RVFVZ	54	sp|Q9Y4R8|TELO2_HUMAN Telomere length regulation protein TEL2 homolog OS=Homo sapiens OX=9606 GN=TELO2 PE=1 SV=2	448	DGASEAGTSLVP
STSGSGSASART	sp|P21401|GP_RVFVZ	1053	sp|Q9P2K8|E2AK4_HUMAN eIF-2-alpha kinase GCN2 OS=Homo sapiens OX=9606 GN=EIF2AK4 PE=1 SV=3	712	STSGERSASARF
STSGSGSASART	sp|P21401|GP_RVFVZ	1053	tr|H0YME5|H0YME5_HUMAN Non-specific serine/threonine protein kinase (Fragment) OS=Homo sapiens OX=9606 GN=EIF2AK4 PE=1 SV=1	518	STSGERSASARF
STSGSGSASART	sp|P21401|GP_RVFVZ	1053	tr|M0R362|M0R362_HUMAN Atypical kinase COQ8B, mitochondrial (Fragment) OS=Homo sapiens OX=9606 GN=COQ8B PE=1 SV=1	62	STSLSGSARAPT
STSGSGSASART	sp|P21401|GP_RVFVZ	1053	tr|M0R0F4|M0R0F4_HUMAN Atypical kinase COQ8B, mitochondrial OS=Homo sapiens OX=9606 GN=COQ8B PE=1 SV=1	93	STSLSGSARAPT
LLAKVIETVSQI	sp|P21401|GP_RVFVZ	635	tr|F8WBN0|F8WBN0_HUMAN Diacylglycerol lipase-beta OS=Homo sapiens OX=9606 GN=DAGLB PE=1 SV=1	65	LLAVVICTVSAI
LLAKVIETVSQI	sp|P21401|GP_RVFVZ	635	tr|C9JA85|C9JA85_HUMAN Diacylglycerol lipase-beta (Fragment) OS=Homo sapiens OX=9606 GN=DAGLB PE=1 SV=1	65	LLAVVICTVSAI
LLAKVIETVSQI	sp|P21401|GP_RVFVZ	635	sp|Q8NCG7|DGLB_HUMAN Diacylglycerol lipase-beta OS=Homo sapiens OX=9606 GN=DAGLB PE=1 SV=2	65	LLAVVICTVSAI
LLAKVIETVSQI	sp|P21401|GP_RVFVZ	635	tr|E7ET49|E7ET49_HUMAN Diacylglycerol lipase-beta OS=Homo sapiens OX=9606 GN=DAGLB PE=1 SV=1	24	LLAVVICTVSAI
SNTQGGELGLKL	sp|P21401|GP_RVFVZ	530	sp|P12270|TPR_HUMAN Nucleoprotein TPR OS=Homo sapiens OX=9606 GN=TPR PE=1 SV=3	155	SNTTKGELQLKL
KSQKGGVKEIFL	sp|P27316|L_RVFVZ	919	tr|A0A494C1T9|A0A494C1T9_HUMAN Protein FAM83H OS=Homo sapiens OX=9606 GN=FAM83H PE=1 SV=1	423	KSFKGHVKEKFL
KSQKGGVKEIFL	sp|P27316|L_RVFVZ	919	sp|Q6ZRV2|FA83H_HUMAN Protein FAM83H OS=Homo sapiens OX=9606 GN=FAM83H PE=1 SV=3	222	KSFKGHVKEKFL
ICASASTSGSGS	sp|P21401|GP_RVFVZ	1048	sp|O00444|PLK4_HUMAN Serine/threonine-protein kinase PLK4 OS=Homo sapiens OX=9606 GN=PLK4 PE=1 SV=3	294	ITASSSTSISGS
ICASASTSGSGS	sp|P21401|GP_RVFVZ	1048	tr|J3KR82|J3KR82_HUMAN Polo-like kinase 4 OS=Homo sapiens OX=9606 GN=PLK4 PE=1 SV=1	294	ITASSSTSISGS
ICASASTSGSGS	sp|P21401|GP_RVFVZ	1048	tr|J3KR84|J3KR84_HUMAN Polo-like kinase 4 OS=Homo sapiens OX=9606 GN=PLK4 PE=1 SV=1	294	ITASSSTSISGS
KRKNKTELRALT	sp|P27316|L_RVFVZ	1850	sp|O75311|GLRA3_HUMAN Glycine receptor subunit alpha-3 OS=Homo sapiens OX=9606 GN=GLRA3 PE=1 SV=2	353	KRKNKTEAFALE
RVTPELLLRSNQ	sp|P27316|L_RVFVZ	107	tr|M0QXX8|M0QXX8_HUMAN Charged multivesicular body protein 2a (Fragment) OS=Homo sapiens OX=9606 GN=CHMP2A PE=1 SV=1	8	RKTPEELLRQNQ
RVTPELLLRSNQ	sp|P27316|L_RVFVZ	107	tr|M0R1L7|M0R1L7_HUMAN Charged multivesicular body protein 2a (Fragment) OS=Homo sapiens OX=9606 GN=CHMP2A PE=1 SV=1	8	RKTPEELLRQNQ
RVTPELLLRSNQ	sp|P27316|L_RVFVZ	107	sp|O43633|CHM2A_HUMAN Charged multivesicular body protein 2a OS=Homo sapiens OX=9606 GN=CHMP2A PE=1 SV=1	8	RKTPEELLRQNQ
MAAELEWLYGSR	sp|P27316|L_RVFVZ	379	tr|A0A2R8YDM0|A0A2R8YDM0_HUMAN Prostaglandin-endoperoxide synthase (Fragment) OS=Homo sapiens OX=9606 GN=PTGS1 PE=1 SV=1	340	MAAELEELYGDI
MAAELEWLYGSR	sp|P27316|L_RVFVZ	379	tr|A0A087X296|A0A087X296_HUMAN Cyclooxygenase-1 OS=Homo sapiens OX=9606 GN=PTGS1 PE=1 SV=1	438	MAAELEELYGDI
MAAELEWLYGSR	sp|P27316|L_RVFVZ	379	sp|P23219|PGH1_HUMAN Prostaglandin G/H synthase 1 OS=Homo sapiens OX=9606 GN=PTGS1 PE=1 SV=2	486	MAAELEELYGDI
AIFAEDPHIRQK	sp|P21401|GP_RVFVZ	150	tr|A0A1W2PPB7|A0A1W2PPB7_HUMAN Kinase D-interacting substrate of 220 kDa OS=Homo sapiens OX=9606 GN=KIDINS220 PE=1 SV=1	802	AIFASDPHIIIK
AIFAEDPHIRQK	sp|P21401|GP_RVFVZ	150	tr|H0Y8E4|H0Y8E4_HUMAN Kinase D-interacting substrate of 220 kDa (Fragment) OS=Homo sapiens OX=9606 GN=KIDINS220 PE=1 SV=1	549	AIFASDPHIIIK
AIFAEDPHIRQK	sp|P21401|GP_RVFVZ	150	tr|E9PH70|E9PH70_HUMAN Kinase D-interacting substrate of 220 kDa (Fragment) OS=Homo sapiens OX=9606 GN=KIDINS220 PE=1 SV=1	803	AIFASDPHIIIK
AIFAEDPHIRQK	sp|P21401|GP_RVFVZ	150	sp|Q9ULH0|KDIS_HUMAN Kinase D-interacting substrate of 220 kDa OS=Homo sapiens OX=9606 GN=KIDINS220 PE=1 SV=3	802	AIFASDPHIIIK
VLAHAIKWDLPC	sp|P27316|L_RVFVZ	140	sp|Q96GD3|SCMH1_HUMAN Polycomb protein SCMH1 OS=Homo sapiens OX=9606 GN=SCMH1 PE=1 SV=1	7	VLACEILWDLPC
EGRHTLKGLSHN	sp|P27316|L_RVFVZ	1916	sp|Q8NFQ8|TOIP2_HUMAN Torsin-1A-interacting protein 2 OS=Homo sapiens OX=9606 GN=TOR1AIP2 PE=1 SV=1	303	EGRETLKCLSHH
EGITSDEITCHP	sp|P21401|GP_RVFVZ	170	sp|P15311|EZRI_HUMAN Ezrin OS=Homo sapiens OX=9606 GN=EZR PE=1 SV=4	108	EGILSDEIYCPP
EGITSDEITCHP	sp|P21401|GP_RVFVZ	170	tr|E7EQR4|E7EQR4_HUMAN Ezrin OS=Homo sapiens OX=9606 GN=EZR PE=1 SV=3	108	EGILSDEIYCPP
AARESILARVDP	sp|P21401|GP_RVFVZ	215	tr|F8VW50|F8VW50_HUMAN Kinesin-like protein (Fragment) OS=Homo sapiens OX=9606 GN=KIF19 PE=1 SV=1	468	AARESIAALVDE
AARESILARVDP	sp|P21401|GP_RVFVZ	215	sp|Q2TAC6|KIF19_HUMAN Kinesin-like protein KIF19 OS=Homo sapiens OX=9606 GN=KIF19 PE=2 SV=2	510	AARESIAALVDE
LPEVSRTAVCEV	sp|P27316|L_RVFVZ	1117	tr|A0A669KBF1|A0A669KBF1_HUMAN Periaxin OS=Homo sapiens OX=9606 GN=PRX PE=1 SV=1	651	LPEVSEVAVPEV
LPEVSRTAVCEV	sp|P27316|L_RVFVZ	1117	sp|Q9BXM0|PRAX_HUMAN Periaxin OS=Homo sapiens OX=9606 GN=PRX PE=1 SV=2	556	LPEVSEVAVPEV
LPEVSRTAVCEV	sp|P27316|L_RVFVZ	1117	tr|A0A6Q8PGB6|A0A6Q8PGB6_HUMAN Periaxin (Fragment) OS=Homo sapiens OX=9606 GN=PRX PE=1 SV=1	510	LPEVSEVAVPEV
LSENICSPPSRL	sp|P27316|L_RVFVZ	954	sp|Q9HBG7|LY9_HUMAN T-lymphocyte surface antigen Ly-9 OS=Homo sapiens OX=9606 GN=LY9 PE=1 SV=3	441	LSENICSGPERN
LSENICSPPSRL	sp|P27316|L_RVFVZ	954	tr|Q5VYI1|Q5VYI1_HUMAN T-lymphocyte surface antigen Ly-9 (Fragment) OS=Homo sapiens OX=9606 GN=LY9 PE=1 SV=2	164	LSENICSGPERN
ASTSGSGSASAR	sp|P21401|GP_RVFVZ	1052	tr|M0R010|M0R010_HUMAN A-kinase anchor protein 8-like (Fragment) OS=Homo sapiens OX=9606 GN=AKAP8L PE=1 SV=1	97	ANTSASGSASAD
ASTSGSGSASAR	sp|P21401|GP_RVFVZ	1052	tr|M0R1Y5|M0R1Y5_HUMAN A-kinase anchor protein 8-like (Fragment) OS=Homo sapiens OX=9606 GN=AKAP8L PE=1 SV=2	16	ANTSASGSASAD
ASTSGSGSASAR	sp|P21401|GP_RVFVZ	1052	tr|M0QYT7|M0QYT7_HUMAN A-kinase anchor protein 8-like (Fragment) OS=Homo sapiens OX=9606 GN=AKAP8L PE=1 SV=1	67	ANTSASGSASAD
ASTSGSGSASAR	sp|P21401|GP_RVFVZ	1052	sp|Q9ULX6|AKP8L_HUMAN A-kinase anchor protein 8-like OS=Homo sapiens OX=9606 GN=AKAP8L PE=1 SV=4	78	ANTSASGSASAD
ASTSGSGSASAR	sp|P21401|GP_RVFVZ	1052	sp|Q9P2K8|E2AK4_HUMAN eIF-2-alpha kinase GCN2 OS=Homo sapiens OX=9606 GN=EIF2AK4 PE=1 SV=3	711	WSTSGERSASAR
ASTSGSGSASAR	sp|P21401|GP_RVFVZ	1052	tr|H0YME5|H0YME5_HUMAN Non-specific serine/threonine protein kinase (Fragment) OS=Homo sapiens OX=9606 GN=EIF2AK4 PE=1 SV=1	517	WSTSGERSASAR
SLRERSKSPYQP	sp|P27316|L_RVFVZ	432	tr|G3V2D8|G3V2D8_HUMAN Zinc finger FYVE domain-containing protein 26 OS=Homo sapiens OX=9606 GN=ZFYVE26 PE=1 SV=1	1782	SLRERSFPPTQP
SLRERSKSPYQP	sp|P27316|L_RVFVZ	432	sp|Q68DK2|ZFY26_HUMAN Zinc finger FYVE domain-containing protein 26 OS=Homo sapiens OX=9606 GN=ZFYVE26 PE=1 SV=3	1782	SLRERSFPPTQP
KEEMAAELEWLY	sp|P27316|L_RVFVZ	376	tr|A0A2R8YDM0|A0A2R8YDM0_HUMAN Prostaglandin-endoperoxide synthase (Fragment) OS=Homo sapiens OX=9606 GN=PTGS1 PE=1 SV=1	337	EKEMAAELEELY
KEEMAAELEWLY	sp|P27316|L_RVFVZ	376	tr|A0A087X296|A0A087X296_HUMAN Cyclooxygenase-1 OS=Homo sapiens OX=9606 GN=PTGS1 PE=1 SV=1	435	EKEMAAELEELY
KEEMAAELEWLY	sp|P27316|L_RVFVZ	376	sp|P23219|PGH1_HUMAN Prostaglandin G/H synthase 1 OS=Homo sapiens OX=9606 GN=PTGS1 PE=1 SV=2	483	EKEMAAELEELY
QELWLGFKEPDL	sp|P27316|L_RVFVZ	790	tr|E9PJ50|E9PJ50_HUMAN Zinc finger protein 48 (Fragment) OS=Homo sapiens OX=9606 GN=ZNF48 PE=1 SV=1	45	QEDDLGFKEEDL
QELWLGFKEPDL	sp|P27316|L_RVFVZ	790	sp|Q96MX3|ZNF48_HUMAN Zinc finger protein 48 OS=Homo sapiens OX=9606 GN=ZNF48 PE=1 SV=2	45	QEDDLGFKEEDL
TRAGKLRGMDEM	sp|P27316|L_RVFVZ	1618	sp|Q96ST3|SIN3A_HUMAN Paired amphipathic helix protein Sin3a OS=Homo sapiens OX=9606 GN=SIN3A PE=1 SV=2	871	TAAQKLRGMDEV
EMAAELEWLYGS	sp|P27316|L_RVFVZ	378	sp|P35354|PGH2_HUMAN Prostaglandin G/H synthase 2 OS=Homo sapiens OX=9606 GN=PTGS2 PE=1 SV=2	472	EMSAELEALYGD
EMAAELEWLYGS	sp|P27316|L_RVFVZ	378	tr|A0A2R8YDM0|A0A2R8YDM0_HUMAN Prostaglandin-endoperoxide synthase (Fragment) OS=Homo sapiens OX=9606 GN=PTGS1 PE=1 SV=1	339	EMAAELEELYGD
EMAAELEWLYGS	sp|P27316|L_RVFVZ	378	tr|A0A087X296|A0A087X296_HUMAN Cyclooxygenase-1 OS=Homo sapiens OX=9606 GN=PTGS1 PE=1 SV=1	437	EMAAELEELYGD
EMAAELEWLYGS	sp|P27316|L_RVFVZ	378	sp|P23219|PGH1_HUMAN Prostaglandin G/H synthase 1 OS=Homo sapiens OX=9606 GN=PTGS1 PE=1 SV=2	485	EMAAELEELYGD
CEGRHTLKGLSH	sp|P27316|L_RVFVZ	1915	sp|Q8NFQ8|TOIP2_HUMAN Torsin-1A-interacting protein 2 OS=Homo sapiens OX=9606 GN=TOR1AIP2 PE=1 SV=1	302	REGRETLKCLSH
EAARESILARVD	sp|P21401|GP_RVFVZ	214	tr|F8VW50|F8VW50_HUMAN Kinesin-like protein (Fragment) OS=Homo sapiens OX=9606 GN=KIF19 PE=1 SV=1	467	AAARESIAALVD
EAARESILARVD	sp|P21401|GP_RVFVZ	214	sp|Q2TAC6|KIF19_HUMAN Kinesin-like protein KIF19 OS=Homo sapiens OX=9606 GN=KIF19 PE=2 SV=2	509	AAARESIAALVD
EAARESILARVD	sp|P21401|GP_RVFVZ	214	sp|P42858|HD_HUMAN Huntingtin OS=Homo sapiens OX=9606 GN=HTT PE=1 SV=2	2166	EAAREVTLARVS
GASEAGQSIVPS	sp|P27316|L_RVFVZ	55	sp|Q9Y4R8|TELO2_HUMAN Telomere length regulation protein TEL2 homolog OS=Homo sapiens OX=9606 GN=TELO2 PE=1 SV=2	449	GASEAGTSLVPA
AVECVEIELQGP	sp|P27316|L_RVFVZ	1982	sp|Q8TF71|MOT10_HUMAN Monocarboxylate transporter 10 OS=Homo sapiens OX=9606 GN=SLC16A10 PE=1 SV=1	42	AVEKVEVELAGP
AVECVEIELQGP	sp|P27316|L_RVFVZ	1982	tr|A0A087X138|A0A087X138_HUMAN Monocarboxylate transporter 10 OS=Homo sapiens OX=9606 GN=SLC16A10 PE=1 SV=1	42	AVEKVEVELAGP
SARASQSFSESF	sp|P27316|L_RVFVZ	853	tr|A6NNK5|A6NNK5_HUMAN TP53-binding protein 1 OS=Homo sapiens OX=9606 GN=TP53BP1 PE=1 SV=2	893	SAHASQSFCESS
SARASQSFSESF	sp|P27316|L_RVFVZ	853	sp|Q12888|TP53B_HUMAN TP53-binding protein 1 OS=Homo sapiens OX=9606 GN=TP53BP1 PE=1 SV=2	888	SAHASQSFCESS
SARASQSFSESF	sp|P27316|L_RVFVZ	853	tr|H7C3N7|H7C3N7_HUMAN TP53-binding protein 1 (Fragment) OS=Homo sapiens OX=9606 GN=TP53BP1 PE=1 SV=1	135	SAHASQSFCESS
SARASQSFSESF	sp|P27316|L_RVFVZ	853	tr|C9JXV0|C9JXV0_HUMAN TP53-binding protein 1 (Fragment) OS=Homo sapiens OX=9606 GN=TP53BP1 PE=1 SV=1	893	SAHASQSFCESS
DQNGRPNAVVAL	sp|P21700|NCAP_RVFVZ	225	sp|Q13107|UBP4_HUMAN Ubiquitin carboxyl-terminal hydrolase 4 OS=Homo sapiens OX=9606 GN=USP4 PE=1 SV=3	422	DANGRPDAVVAK
SASTSGSGSASA	sp|P21401|GP_RVFVZ	1051	tr|Q5H909|Q5H909_HUMAN Melanoma-associated antigen D2 OS=Homo sapiens OX=9606 GN=MAGED2 PE=1 SV=2	544	SASTSGGFSAGA
SASTSGSGSASA	sp|P21401|GP_RVFVZ	1051	tr|Q5H907|Q5H907_HUMAN Melanoma antigen family D, 2, isoform CRA_d OS=Homo sapiens OX=9606 GN=MAGED2 PE=1 SV=1	477	SASTSGGFSAGA
SASTSGSGSASA	sp|P21401|GP_RVFVZ	1051	sp|Q9UNF1|MAGD2_HUMAN Melanoma-associated antigen D2 OS=Homo sapiens OX=9606 GN=MAGED2 PE=1 SV=2	562	SASTSGGFSAGA
SASTSGSGSASA	sp|P21401|GP_RVFVZ	1051	tr|M0R362|M0R362_HUMAN Atypical kinase COQ8B, mitochondrial (Fragment) OS=Homo sapiens OX=9606 GN=COQ8B PE=1 SV=1	60	SCSTSLSGSARA
SASTSGSGSASA	sp|P21401|GP_RVFVZ	1051	tr|M0R0F4|M0R0F4_HUMAN Atypical kinase COQ8B, mitochondrial OS=Homo sapiens OX=9606 GN=COQ8B PE=1 SV=1	91	SCSTSLSGSARA
SASTSGSGSASA	sp|P21401|GP_RVFVZ	1051	sp|Q5TCX8|M3K21_HUMAN Mitogen-activated protein kinase kinase kinase 21 OS=Homo sapiens OX=9606 GN=MAP3K21 PE=1 SV=3	27	SSSTSSGGSASA
SASTSGSGSASA	sp|P21401|GP_RVFVZ	1051	tr|M0R010|M0R010_HUMAN A-kinase anchor protein 8-like (Fragment) OS=Homo sapiens OX=9606 GN=AKAP8L PE=1 SV=1	96	NANTSASGSASA
SASTSGSGSASA	sp|P21401|GP_RVFVZ	1051	tr|M0R1Y5|M0R1Y5_HUMAN A-kinase anchor protein 8-like (Fragment) OS=Homo sapiens OX=9606 GN=AKAP8L PE=1 SV=2	15	NANTSASGSASA
SASTSGSGSASA	sp|P21401|GP_RVFVZ	1051	tr|M0QYT7|M0QYT7_HUMAN A-kinase anchor protein 8-like (Fragment) OS=Homo sapiens OX=9606 GN=AKAP8L PE=1 SV=1	66	NANTSASGSASA
SASTSGSGSASA	sp|P21401|GP_RVFVZ	1051	sp|Q9ULX6|AKP8L_HUMAN A-kinase anchor protein 8-like OS=Homo sapiens OX=9606 GN=AKAP8L PE=1 SV=4	77	NANTSASGSASA
SASTSGSGSASA	sp|P21401|GP_RVFVZ	1051	tr|E5RG56|E5RG56_HUMAN Aspartyl/asparaginyl beta-hydroxylase OS=Homo sapiens OX=9606 GN=ASPH PE=1 SV=1	14	SSSGSGSGSTSA
SASTSGSGSASA	sp|P21401|GP_RVFVZ	1051	sp|Q12797|ASPH_HUMAN Aspartyl/asparaginyl beta-hydroxylase OS=Homo sapiens OX=9606 GN=ASPH PE=1 SV=3	14	SSSGSGSGSTSA
SASTSGSGSASA	sp|P21401|GP_RVFVZ	1051	tr|E5RHJ2|E5RHJ2_HUMAN Aspartyl/asparaginyl beta-hydroxylase OS=Homo sapiens OX=9606 GN=ASPH PE=1 SV=1	14	SSSGSGSGSTSA
SASTSGSGSASA	sp|P21401|GP_RVFVZ	1051	sp|O14646|CHD1_HUMAN Chromodomain-helicase-DNA-binding protein 1 OS=Homo sapiens OX=9606 GN=CHD1 PE=1 SV=2	26	SASGSGSGSSSG
SASTSGSGSASA	sp|P21401|GP_RVFVZ	1051	sp|P15941|MUC1_HUMAN Mucin-1 OS=Homo sapiens OX=9606 GN=MUC1 PE=1 SV=3	960	SASGSASGSAST
SASTSGSGSASA	sp|P21401|GP_RVFVZ	1051	tr|A0A087X2A4|A0A087X2A4_HUMAN Mucin-1 OS=Homo sapiens OX=9606 GN=MUC1 PE=1 SV=1	189	SASGSASGSAST
SASTSGSGSASA	sp|P21401|GP_RVFVZ	1051	tr|A0A0C4DGW3|A0A0C4DGW3_HUMAN Mucin-1 OS=Homo sapiens OX=9606 GN=MUC1 PE=1 SV=1	180	SASGSASGSAST
SASTSGSGSASA	sp|P21401|GP_RVFVZ	1051	tr|A0A087WWM1|A0A087WWM1_HUMAN Mucin-1 OS=Homo sapiens OX=9606 GN=MUC1 PE=1 SV=1	967	SASGSASGSAST
DIKSFDISSCPH	sp|P21401|GP_RVFVZ	393	tr|C9JG08|C9JG08_HUMAN Uncharacterized protein C2orf16 OS=Homo sapiens OX=9606 GN=C2orf16 PE=1 SV=2	2632	DIKSMDFSSGPH
TCKGPVYNCASS	sp|P27316|L_RVFVZ	978	sp|P80370|DLK1_HUMAN Protein delta homolog 1 OS=Homo sapiens OX=9606 GN=DLK1 PE=1 SV=3	204	TCSRPVTNCASS
CASASTSGSGSA	sp|P21401|GP_RVFVZ	1049	tr|Q5H909|Q5H909_HUMAN Melanoma-associated antigen D2 OS=Homo sapiens OX=9606 GN=MAGED2 PE=1 SV=2	542	SASASTSGGFSA
CASASTSGSGSA	sp|P21401|GP_RVFVZ	1049	tr|Q5H907|Q5H907_HUMAN Melanoma antigen family D, 2, isoform CRA_d OS=Homo sapiens OX=9606 GN=MAGED2 PE=1 SV=1	475	SASASTSGGFSA
CASASTSGSGSA	sp|P21401|GP_RVFVZ	1049	sp|Q9UNF1|MAGD2_HUMAN Melanoma-associated antigen D2 OS=Homo sapiens OX=9606 GN=MAGED2 PE=1 SV=2	560	SASASTSGGFSA
DSLAPETYVCFD	sp|P21401|GP_RVFVZ	365	tr|K7EJ65|K7EJ65_HUMAN Protein Hook homolog 2 (Fragment) OS=Homo sapiens OX=9606 GN=HOOK2 PE=1 SV=1	196	DSLSPETYGNFD
DSLAPETYVCFD	sp|P21401|GP_RVFVZ	365	tr|K7EJA7|K7EJA7_HUMAN Protein Hook homolog 2 (Fragment) OS=Homo sapiens OX=9606 GN=HOOK2 PE=1 SV=1	44	DSLSPETYGNFD
DSLAPETYVCFD	sp|P21401|GP_RVFVZ	365	tr|K7EMG7|K7EMG7_HUMAN Protein Hook homolog 2 (Fragment) OS=Homo sapiens OX=9606 GN=HOOK2 PE=1 SV=8	87	DSLSPETYGNFD
DSLAPETYVCFD	sp|P21401|GP_RVFVZ	365	tr|K7EMR5|K7EMR5_HUMAN Protein Hook homolog 2 (Fragment) OS=Homo sapiens OX=9606 GN=HOOK2 PE=1 SV=1	87	DSLSPETYGNFD
DSLAPETYVCFD	sp|P21401|GP_RVFVZ	365	tr|K7EJ48|K7EJ48_HUMAN Protein Hook homolog 2 (Fragment) OS=Homo sapiens OX=9606 GN=HOOK2 PE=1 SV=1	87	DSLSPETYGNFD
DSLAPETYVCFD	sp|P21401|GP_RVFVZ	365	tr|K7ENU5|K7ENU5_HUMAN Protein Hook homolog 2 (Fragment) OS=Homo sapiens OX=9606 GN=HOOK2 PE=1 SV=1	87	DSLSPETYGNFD
DSLAPETYVCFD	sp|P21401|GP_RVFVZ	365	sp|Q96ED9|HOOK2_HUMAN Protein Hook homolog 2 OS=Homo sapiens OX=9606 GN=HOOK2 PE=1 SV=3	160	DSLSPETYGNFD
VLRNAGRWYLSE	sp|P27316|L_RVFVZ	945	sp|Q5T953|IER5L_HUMAN Immediate early response gene 5-like protein OS=Homo sapiens OX=9606 GN=IER5L PE=2 SV=1	39	VLRNARQLYLSE
VEAARESILARV	sp|P21401|GP_RVFVZ	213	tr|F8VW50|F8VW50_HUMAN Kinesin-like protein (Fragment) OS=Homo sapiens OX=9606 GN=KIF19 PE=1 SV=1	466	VAAARESIAALV
VEAARESILARV	sp|P21401|GP_RVFVZ	213	sp|Q2TAC6|KIF19_HUMAN Kinesin-like protein KIF19 OS=Homo sapiens OX=9606 GN=KIF19 PE=2 SV=2	508	VAAARESIAALV
VEAARESILARV	sp|P21401|GP_RVFVZ	213	sp|P42858|HD_HUMAN Huntingtin OS=Homo sapiens OX=9606 GN=HTT PE=1 SV=2	2165	FEAAREVTLARV
ELQGPFDLENWH	sp|P27316|L_RVFVZ	1989	sp|Q3SY00|T10IP_HUMAN Testis-specific protein 10-interacting protein OS=Homo sapiens OX=9606 GN=TSGA10IP PE=1 SV=2	314	ELQGPWDLEKLH
ERRREYLRLFGA	sp|P21700|NCAP_RVFVZ	212	sp|Q9BZL4|PP12C_HUMAN Protein phosphatase 1 regulatory subunit 12C OS=Homo sapiens OX=9606 GN=PPP1R12C PE=1 SV=1	20	ERRREQLRQWGA
AFILANLVSSAA	sp|P21401|GP_RVFVZ	1	sp|P23141|EST1_HUMAN Liver carboxylesterase 1 OS=Homo sapiens OX=9606 GN=CES1 PE=1 SV=2	5	AFILATLSASAA
GSLTSVDAGLTT	sp|P21401|GP_RVFVZ	868	tr|H0YKM7|H0YKM7_HUMAN Alpha-mannosidase 2x (Fragment) OS=Homo sapiens OX=9606 GN=MAN2A2 PE=1 SV=8	82	GSLTSSTAGLTS
YLSENICSPPSR	sp|P27316|L_RVFVZ	953	sp|Q9HBG7|LY9_HUMAN T-lymphocyte surface antigen Ly-9 OS=Homo sapiens OX=9606 GN=LY9 PE=1 SV=3	440	FLSENICSGPER
YLSENICSPPSR	sp|P27316|L_RVFVZ	953	tr|Q5VYI1|Q5VYI1_HUMAN T-lymphocyte surface antigen Ly-9 (Fragment) OS=Homo sapiens OX=9606 GN=LY9 PE=1 SV=2	163	FLSENICSGPER
SKLGKGCSLVQL	sp|P27316|L_RVFVZ	507	sp|Q5H8C1|FREM1_HUMAN FRAS1-related extracellular matrix protein 1 OS=Homo sapiens OX=9606 GN=FREM1 PE=1 SV=3	2145	SKLGKSCVLVQR
VQLMGLELTAQI	sp|P27316|L_RVFVZ	516	sp|A2RUH7|MBPHL_HUMAN Myosin-binding protein H-like OS=Homo sapiens OX=9606 GN=MYBPHL PE=1 SV=2	127	VQLGGLEATATI
SPLPMPHRMPLP	sp|P21401|GP_RVFVZ	662	sp|O75665|OFD1_HUMAN Oral-facial-digital syndrome 1 protein OS=Homo sapiens OX=9606 GN=OFD1 PE=1 SV=1	762	SPSPCPDRMPLP
SPLPMPHRMPLP	sp|P21401|GP_RVFVZ	662	tr|A6NF31|A6NF31_HUMAN Oral-facial-digital syndrome 1 protein OS=Homo sapiens OX=9606 GN=OFD1 PE=1 SV=1	622	SPSPCPDRMPLP
GWLSPPDIPKPK	sp|P27316|L_RVFVZ	678	tr|J3QSD7|J3QSD7_HUMAN Cyclin-dependent kinase 12 (Fragment) OS=Homo sapiens OX=9606 GN=CDK12 PE=1 SV=1	677	GDLSPPDSPEPK
GWLSPPDIPKPK	sp|P27316|L_RVFVZ	678	sp|Q9NYV4|CDK12_HUMAN Cyclin-dependent kinase 12 OS=Homo sapiens OX=9606 GN=CDK12 PE=1 SV=2	678	GDLSPPDSPEPK
TKRKNKTELRAL	sp|P27316|L_RVFVZ	1849	sp|O75311|GLRA3_HUMAN Glycine receptor subunit alpha-3 OS=Homo sapiens OX=9606 GN=GLRA3 PE=1 SV=2	352	RKRKNKTEAFAL
FGDTSSPELIDG	sp|P21401|GP_RVFVZ	31	tr|B1AUU8|B1AUU8_HUMAN Epidermal growth factor receptor substrate 15 OS=Homo sapiens OX=9606 GN=EPS15 PE=1 SV=1	103	FHDTSSPLLISG
FGDTSSPELIDG	sp|P21401|GP_RVFVZ	31	sp|P42566|EPS15_HUMAN Epidermal growth factor receptor substrate 15 OS=Homo sapiens OX=9606 GN=EPS15 PE=1 SV=2	103	FHDTSSPLLISG
RQKFRRMKISMG	sp|P27316|L_RVFVZ	396	sp|P05771|KPCB_HUMAN Protein kinase C beta type OS=Homo sapiens OX=9606 GN=PRKCB PE=1 SV=4	302	RQKFERAKISQG
EGEKLLPVLEEL	sp|P27316|L_RVFVZ	1694	sp|Q92817|EVPL_HUMAN Envoplakin OS=Homo sapiens OX=9606 GN=EVPL PE=1 SV=3	1230	EVEKLLPDLEVL
EGEKLLPVLEEL	sp|P27316|L_RVFVZ	1694	tr|K7EKI0|K7EKI0_HUMAN Envoplakin OS=Homo sapiens OX=9606 GN=EVPL PE=1 SV=1	1252	EVEKLLPDLEVL
ASASTSGSGSAS	sp|P21401|GP_RVFVZ	1050	tr|Q5H909|Q5H909_HUMAN Melanoma-associated antigen D2 OS=Homo sapiens OX=9606 GN=MAGED2 PE=1 SV=2	543	ASASTSGGFSAG
ASASTSGSGSAS	sp|P21401|GP_RVFVZ	1050	tr|Q5H907|Q5H907_HUMAN Melanoma antigen family D, 2, isoform CRA_d OS=Homo sapiens OX=9606 GN=MAGED2 PE=1 SV=1	476	ASASTSGGFSAG
ASASTSGSGSAS	sp|P21401|GP_RVFVZ	1050	sp|Q9UNF1|MAGD2_HUMAN Melanoma-associated antigen D2 OS=Homo sapiens OX=9606 GN=MAGED2 PE=1 SV=2	561	ASASTSGGFSAG
ASASTSGSGSAS	sp|P21401|GP_RVFVZ	1050	sp|P15941|MUC1_HUMAN Mucin-1 OS=Homo sapiens OX=9606 GN=MUC1 PE=1 SV=3	959	TSASGSASGSAS
ASASTSGSGSAS	sp|P21401|GP_RVFVZ	1050	tr|A0A087X2A4|A0A087X2A4_HUMAN Mucin-1 OS=Homo sapiens OX=9606 GN=MUC1 PE=1 SV=1	188	TSASGSASGSAS
ASASTSGSGSAS	sp|P21401|GP_RVFVZ	1050	tr|A0A0C4DGW3|A0A0C4DGW3_HUMAN Mucin-1 OS=Homo sapiens OX=9606 GN=MUC1 PE=1 SV=1	179	TSASGSASGSAS
ASASTSGSGSAS	sp|P21401|GP_RVFVZ	1050	tr|A0A087WWM1|A0A087WWM1_HUMAN Mucin-1 OS=Homo sapiens OX=9606 GN=MUC1 PE=1 SV=1	966	TSASGSASGSAS
ASASTSGSGSAS	sp|P21401|GP_RVFVZ	1050	tr|A0A0A0MT46|A0A0A0MT46_HUMAN POU domain protein (Fragment) OS=Homo sapiens OX=9606 GN=POU2F1 PE=1 SV=1	484	ASASTSEASSAS
ASASTSGSGSAS	sp|P21401|GP_RVFVZ	1050	sp|P14859|PO2F1_HUMAN POU domain, class 2, transcription factor 1 OS=Homo sapiens OX=9606 GN=POU2F1 PE=1 SV=2	530	ASASTSEASSAS
