query	query_seqname	query_start	target_seqname	target_start	target
GPQRSDPTESLL	sp|Q83883|POLG_NVN68	1700	tr|A0A6Q8PEY8|A0A6Q8PEY8_HUMAN Inverted formin-2 (Fragment) OS=Homo sapiens OX=9606 GN=INF2 PE=1 SV=1	19	GPQDSDPTEANL
GPQRSDPTESLL	sp|Q83883|POLG_NVN68	1700	tr|A0A6Q8PF91|A0A6Q8PF91_HUMAN Inverted formin-2 OS=Homo sapiens OX=9606 GN=INF2 PE=1 SV=1	19	GPQDSDPTEANL
GPQRSDPTESLL	sp|Q83883|POLG_NVN68	1700	tr|A0A6Q8PGX4|A0A6Q8PGX4_HUMAN Inverted formin-2 OS=Homo sapiens OX=9606 GN=INF2 PE=1 SV=1	19	GPQDSDPTEANL
GPQRSDPTESLL	sp|Q83883|POLG_NVN68	1700	tr|A0A6Q8PG64|A0A6Q8PG64_HUMAN Inverted formin-2 OS=Homo sapiens OX=9606 GN=INF2 PE=1 SV=1	19	GPQDSDPTEANL
GPQRSDPTESLL	sp|Q83883|POLG_NVN68	1700	tr|A0A6Q8PFJ1|A0A6Q8PFJ1_HUMAN Inverted formin-2 OS=Homo sapiens OX=9606 GN=INF2 PE=1 SV=1	19	GPQDSDPTEANL
GPQRSDPTESLL	sp|Q83883|POLG_NVN68	1700	tr|A0A6Q8PFY4|A0A6Q8PFY4_HUMAN Inverted formin-2 OS=Homo sapiens OX=9606 GN=INF2 PE=1 SV=1	19	GPQDSDPTEANL
GPQRSDPTESLL	sp|Q83883|POLG_NVN68	1700	tr|A0A6Q8PH59|A0A6Q8PH59_HUMAN Inverted formin-2 OS=Homo sapiens OX=9606 GN=INF2 PE=1 SV=1	19	GPQDSDPTEANL
GPQRSDPTESLL	sp|Q83883|POLG_NVN68	1700	tr|A0A6Q8PFB9|A0A6Q8PFB9_HUMAN Inverted formin-2 OS=Homo sapiens OX=9606 GN=INF2 PE=1 SV=1	19	GPQDSDPTEANL
GPQRSDPTESLL	sp|Q83883|POLG_NVN68	1700	tr|A0A6Q8PGC7|A0A6Q8PGC7_HUMAN Inverted formin-2 OS=Homo sapiens OX=9606 GN=INF2 PE=1 SV=1	19	GPQDSDPTEANL
GPQRSDPTESLL	sp|Q83883|POLG_NVN68	1700	tr|A0A087X118|A0A087X118_HUMAN Inverted formin-2 OS=Homo sapiens OX=9606 GN=INF2 PE=1 SV=1	19	GPQDSDPTEANL
GPQRSDPTESLL	sp|Q83883|POLG_NVN68	1700	tr|A0A6Q8PF44|A0A6Q8PF44_HUMAN Inverted formin-2 OS=Homo sapiens OX=9606 GN=INF2 PE=1 SV=1	19	GPQDSDPTEANL
GPQRSDPTESLL	sp|Q83883|POLG_NVN68	1700	tr|A0A6Q8PH25|A0A6Q8PH25_HUMAN Inverted formin-2 OS=Homo sapiens OX=9606 GN=INF2 PE=1 SV=1	19	GPQDSDPTEANL
GPQRSDPTESLL	sp|Q83883|POLG_NVN68	1700	tr|A0A6Q8PF29|A0A6Q8PF29_HUMAN Inverted formin-2 OS=Homo sapiens OX=9606 GN=INF2 PE=1 SV=1	19	GPQDSDPTEANL
GPQRSDPTESLL	sp|Q83883|POLG_NVN68	1700	tr|A0A6Q8PHG2|A0A6Q8PHG2_HUMAN Inverted formin-2 OS=Homo sapiens OX=9606 GN=INF2 PE=1 SV=1	19	GPQDSDPTEANL
GPQRSDPTESLL	sp|Q83883|POLG_NVN68	1700	sp|Q27J81|INF2_HUMAN Inverted formin-2 OS=Homo sapiens OX=9606 GN=INF2 PE=1 SV=2	19	GPQDSDPTEANL
GPQRSDPTESLL	sp|Q83883|POLG_NVN68	1700	tr|A0A6Q8PHA2|A0A6Q8PHA2_HUMAN Inverted formin-2 OS=Homo sapiens OX=9606 GN=INF2 PE=1 SV=1	51	GPQDSDPTEANL
GPQRSDPTESLL	sp|Q83883|POLG_NVN68	1700	tr|A0A6Q8PH63|A0A6Q8PH63_HUMAN Inverted formin-2 OS=Homo sapiens OX=9606 GN=INF2 PE=1 SV=1	19	GPQDSDPTEANL
GPQRSDPTESLL	sp|Q83883|POLG_NVN68	1700	tr|A0A6Q8PGU8|A0A6Q8PGU8_HUMAN Inverted formin-2 OS=Homo sapiens OX=9606 GN=INF2 PE=1 SV=1	19	GPQDSDPTEANL
GPQRSDPTESLL	sp|Q83883|POLG_NVN68	1700	tr|A0A6Q8PFN5|A0A6Q8PFN5_HUMAN Inverted formin-2 OS=Homo sapiens OX=9606 GN=INF2 PE=1 SV=1	19	GPQDSDPTEANL
GPQRSDPTESLL	sp|Q83883|POLG_NVN68	1700	tr|A0A6Q8PH71|A0A6Q8PH71_HUMAN Inverted formin-2 OS=Homo sapiens OX=9606 GN=INF2 PE=1 SV=1	19	GPQDSDPTEANL
GPQRSDPTESLL	sp|Q83883|POLG_NVN68	1700	tr|A0A6Q8PGY8|A0A6Q8PGY8_HUMAN Inverted formin-2 OS=Homo sapiens OX=9606 GN=INF2 PE=1 SV=1	19	GPQDSDPTEANL
GPQRSDPTESLL	sp|Q83883|POLG_NVN68	1700	tr|A0A6Q8PH52|A0A6Q8PH52_HUMAN Inverted formin-2 OS=Homo sapiens OX=9606 GN=INF2 PE=1 SV=1	19	GPQDSDPTEANL
GPQRSDPTESLL	sp|Q83883|POLG_NVN68	1700	tr|A0A6Q8PFW4|A0A6Q8PFW4_HUMAN Inverted formin-2 (Fragment) OS=Homo sapiens OX=9606 GN=INF2 PE=1 SV=1	19	GPQDSDPTEANL
GPQRSDPTESLL	sp|Q83883|POLG_NVN68	1700	tr|A0A6Q8PGN3|A0A6Q8PGN3_HUMAN Inverted formin-2 OS=Homo sapiens OX=9606 GN=INF2 PE=1 SV=1	19	GPQDSDPTEANL
GPQRSDPTESLL	sp|Q83883|POLG_NVN68	1700	tr|A0A6Q8PEY5|A0A6Q8PEY5_HUMAN Inverted formin-2 OS=Homo sapiens OX=9606 GN=INF2 PE=1 SV=1	19	GPQDSDPTEANL
TMQSAIRESLKP	sp|Q83883|POLG_NVN68	1338	sp|Q9BXM9|FSD1L_HUMAN FSD1-like protein OS=Homo sapiens OX=9606 GN=FSD1L PE=1 SV=2	157	TMASAFRLSLKP
TMQSAIRESLKP	sp|Q83883|POLG_NVN68	1338	tr|A0A0C4DG97|A0A0C4DG97_HUMAN FSD1-like protein OS=Homo sapiens OX=9606 GN=FSD1L PE=1 SV=1	125	TMASAFRLSLKP
TMQSAIRESLKP	sp|Q83883|POLG_NVN68	1338	tr|F8W946|F8W946_HUMAN FSD1-like protein OS=Homo sapiens OX=9606 GN=FSD1L PE=1 SV=1	125	TMASAFRLSLKP
TMQSAIRESLKP	sp|Q83883|POLG_NVN68	1338	tr|C9JD05|C9JD05_HUMAN FSD1-like protein OS=Homo sapiens OX=9606 GN=FSD1L PE=1 SV=1	157	TMASAFRLSLKP
RTKSKHKNSESK	sp|Q83883|POLG_NVN68	1047	sp|P11387|TOP1_HUMAN DNA topoisomerase 1 OS=Homo sapiens OX=9606 GN=TOP1 PE=1 SV=2	44	REKSKHSNSEHK
IGAAAAQTLGQI	sp|Q83885|VP2_NVN68	6	tr|A0A0A0MT17|A0A0A0MT17_HUMAN Sperm-associated antigen 6 (Fragment) OS=Homo sapiens OX=9606 GN=SPAG6 PE=1 SV=1	113	IKAAAAWALGQI
IGAAAAQTLGQI	sp|Q83885|VP2_NVN68	6	sp|O75602|SPAG6_HUMAN Sperm-associated antigen 6 OS=Homo sapiens OX=9606 GN=SPAG6 PE=2 SV=1	352	IKAAAAWALGQI
IGAAAAQTLGQI	sp|Q83885|VP2_NVN68	6	tr|A0A0A0MRT8|A0A0A0MRT8_HUMAN Sperm-associated antigen 6 OS=Homo sapiens OX=9606 GN=SPAG6 PE=1 SV=1	330	IKAAAAWALGQI
ATTESLSNTQSL	sp|Q83883|POLG_NVN68	13	sp|Q9Y4D2|DGLA_HUMAN Diacylglycerol lipase-alpha OS=Homo sapiens OX=9606 GN=DAGLA PE=1 SV=3	778	ATMESLSDTESL
LSGIGSGTWLGL	sp|Q83884|CAPSD_NVN68	361	sp|Q6P4Q7|CNNM4_HUMAN Metal transporter CNNM4 OS=Homo sapiens OX=9606 GN=CNNM4 PE=1 SV=3	195	LSGIFSGLNLGL
EGPLPVGYPDAG	sp|Q83884|CAPSD_NVN68	313	sp|P20333|TNR1B_HUMAN Tumor necrosis factor receptor superfamily member 1B OS=Homo sapiens OX=9606 GN=TNFRSF1B PE=1 SV=3	446	EKPLPLGVPDAG
NPSYQPSSISRS	sp|Q83885|VP2_NVN68	141	tr|A0A2R8YFX5|A0A2R8YFX5_HUMAN Neuron navigator 3 OS=Homo sapiens OX=9606 GN=NAV3 PE=1 SV=1	125	NVSSKPSSISRS
VCGPPGLGKSHL	sp|Q83883|POLG_NVN68	558	tr|M0QZP8|M0QZP8_HUMAN Immunity-related GTPase family Q protein (Fragment) OS=Homo sapiens OX=9606 GN=IRGQ PE=1 SV=1	12	FLGPPGLGKSAL
VCGPPGLGKSHL	sp|Q83883|POLG_NVN68	558	sp|Q8WZA9|IRGQ_HUMAN Immunity-related GTPase family Q protein OS=Homo sapiens OX=9606 GN=IRGQ PE=1 SV=1	12	FLGPPGLGKSAL
VCGPPGLGKSHL	sp|Q83883|POLG_NVN68	558	tr|A0A0D9SF58|A0A0D9SF58_HUMAN Chromosome transmission fidelity protein 18 homolog OS=Homo sapiens OX=9606 GN=CHTF18 PE=1 SV=1	567	LCGPPGLGKTTL
VCGPPGLGKSHL	sp|Q83883|POLG_NVN68	558	sp|Q8WVB6|CTF18_HUMAN Chromosome transmission fidelity protein 18 homolog OS=Homo sapiens OX=9606 GN=CHTF18 PE=1 SV=1	372	LCGPPGLGKTTL
VCGPPGLGKSHL	sp|Q83883|POLG_NVN68	558	tr|E7EXA6|E7EXA6_HUMAN Chromosome transmission fidelity protein 18 homolog OS=Homo sapiens OX=9606 GN=CHTF18 PE=1 SV=2	372	LCGPPGLGKTTL
VCGPPGLGKSHL	sp|Q83883|POLG_NVN68	558	tr|F8WCC1|F8WCC1_HUMAN Chromosome transmission fidelity protein 18 homolog OS=Homo sapiens OX=9606 GN=CHTF18 PE=1 SV=1	373	LCGPPGLGKTTL
DVVPEWLSDDGL	sp|Q83883|POLG_NVN68	1778	tr|C9JII1|C9JII1_HUMAN E3 ubiquitin-protein ligase (Fragment) OS=Homo sapiens OX=9606 GN=DTX2 PE=1 SV=1	109	GVVWEWLSDDGS
DVVPEWLSDDGL	sp|Q83883|POLG_NVN68	1778	tr|E7ET89|E7ET89_HUMAN E3 ubiquitin-protein ligase OS=Homo sapiens OX=9606 GN=DTX2 PE=1 SV=1	18	GVVWEWLSDDGS
DVVPEWLSDDGL	sp|Q83883|POLG_NVN68	1778	sp|Q86UW9|DTX2_HUMAN Probable E3 ubiquitin-protein ligase DTX2 OS=Homo sapiens OX=9606 GN=DTX2 PE=1 SV=3	109	GVVWEWLSDDGS
GICDQDEDESEE	sp|Q83883|POLG_NVN68	939	tr|F2Z2K0|F2Z2K0_HUMAN NSFL1 cofactor p47 OS=Homo sapiens OX=9606 GN=NSFL1C PE=1 SV=1	78	LIHDQDEDEEEE
GICDQDEDESEE	sp|Q83883|POLG_NVN68	939	sp|Q9UNZ2|NSF1C_HUMAN NSFL1 cofactor p47 OS=Homo sapiens OX=9606 GN=NSFL1C PE=1 SV=2	78	LIHDQDEDEEEE
GICDQDEDESEE	sp|Q83883|POLG_NVN68	939	tr|R4GNE6|R4GNE6_HUMAN NSFL1 cofactor p47 OS=Homo sapiens OX=9606 GN=NSFL1C PE=1 SV=1	78	LIHDQDEDEEEE
GGRDPKMSTGPT	sp|Q83883|POLG_NVN68	1327	sp|P40238|TPOR_HUMAN Thrombopoietin receptor OS=Homo sapiens OX=9606 GN=MPL PE=1 SV=1	172	GPRDPKNSTGPT
GGRDPKMSTGPT	sp|Q83883|POLG_NVN68	1327	tr|Q5JUY5|Q5JUY5_HUMAN Thrombopoietin receptor OS=Homo sapiens OX=9606 GN=MPL PE=1 SV=2	165	GPRDPKNSTGPT
ASRVKVVKVLIF	sp|Q83883|POLG_NVN68	858	tr|Q5R211|Q5R211_HUMAN Carbamoyl-phosphate synthase [ammonia], mitochondrial OS=Homo sapiens OX=9606 GN=CPS1 PE=1 SV=1	417	ASRVEVSKVLIL
ASRVKVVKVLIF	sp|Q83883|POLG_NVN68	858	sp|P31327|CPSM_HUMAN Carbamoyl-phosphate synthase [ammonia], mitochondrial OS=Homo sapiens OX=9606 GN=CPS1 PE=1 SV=2	417	ASRVEVSKVLIL
ALPSVATTESLS	sp|Q83883|POLG_NVN68	8	sp|Q8N122|RPTOR_HUMAN Regulatory-associated protein of mTOR OS=Homo sapiens OX=9606 GN=RPTOR PE=1 SV=1	693	ALPSPATTEGGS
WEFDTERLVAFS	sp|Q83883|POLG_NVN68	765	sp|P80108|PHLD_HUMAN Phosphatidylinositol-glycan-specific phospholipase D OS=Homo sapiens OX=9606 GN=GPLD1 PE=1 SV=3	108	WEKDTEKLVAFL
ADMGEFILRVKE	sp|Q83883|POLG_NVN68	1565	tr|H7C3P7|H7C3P7_HUMAN Small monomeric GTPase (Fragment) OS=Homo sapiens OX=9606 GN=RALA PE=1 SV=1	99	ADFREQILRVKE
ADMGEFILRVKE	sp|Q83883|POLG_NVN68	1565	sp|P11233|RALA_HUMAN Ras-related protein Ral-A OS=Homo sapiens OX=9606 GN=RALA PE=1 SV=1	105	ADFREQILRVKE
ATDLHPGGKVGI	sp|Q83883|POLG_NVN68	578	sp|Q15397|PUM3_HUMAN Pumilio homolog 3 OS=Homo sapiens OX=9606 GN=PUM3 PE=1 SV=3	534	ATGLHPGGKDGE
VEGLSGLGSVLP	sp|Q83884|CAPSD_NVN68	12	sp|O76013|KRT36_HUMAN Keratin, type I cuticular Ha6 OS=Homo sapiens OX=9606 GN=KRT36 PE=1 SV=1	53	RSGLSGLGSCLP
RNVHFSIREGLE	sp|Q83883|POLG_NVN68	147	tr|H0YKW6|H0YKW6_HUMAN FERM domain containing 5, isoform CRA_b OS=Homo sapiens OX=9606 GN=FRMD5 PE=1 SV=1	276	RAVHISIMEGLE
RNVHFSIREGLE	sp|Q83883|POLG_NVN68	147	tr|H0Y5N1|H0Y5N1_HUMAN FERM domain-containing protein 5 (Fragment) OS=Homo sapiens OX=9606 GN=FRMD5 PE=1 SV=1	336	RAVHISIMEGLE
RNVHFSIREGLE	sp|Q83883|POLG_NVN68	147	tr|B5MC67|B5MC67_HUMAN FERM domain-containing protein 5 OS=Homo sapiens OX=9606 GN=FRMD5 PE=1 SV=1	370	RAVHISIMEGLE
RNVHFSIREGLE	sp|Q83883|POLG_NVN68	147	sp|Q7Z6J6|FRMD5_HUMAN FERM domain-containing protein 5 OS=Homo sapiens OX=9606 GN=FRMD5 PE=1 SV=1	370	RAVHISIMEGLE
RNVHFSIREGLE	sp|Q83883|POLG_NVN68	147	tr|A0A087WVP2|A0A087WVP2_HUMAN FERM domain containing 5, isoform CRA_e OS=Homo sapiens OX=9606 GN=FRMD5 PE=1 SV=1	136	RAVHISIMEGLE
DPRGRAPEPGAV	sp|Q83883|POLG_NVN68	1352	tr|A0A1B0GVM0|A0A1B0GVM0_HUMAN Brain-enriched guanylate kinase-associated protein OS=Homo sapiens OX=9606 GN=BEGAIN PE=1 SV=1	132	VPRGRSPEPSAV
RSSSSGFPKRKK	sp|Q83883|POLG_NVN68	1395	tr|F8VVA6|F8VVA6_HUMAN Microspherule protein 1 (Fragment) OS=Homo sapiens OX=9606 GN=MCRS1 PE=1 SV=1	45	RRSSSRFIKRKK
RSSSSGFPKRKK	sp|Q83883|POLG_NVN68	1395	tr|F8VP44|F8VP44_HUMAN Microspherule protein 1 (Fragment) OS=Homo sapiens OX=9606 GN=MCRS1 PE=1 SV=1	45	RRSSSRFIKRKK
RSSSSGFPKRKK	sp|Q83883|POLG_NVN68	1395	tr|F8W126|F8W126_HUMAN Microspherule protein 1 (Fragment) OS=Homo sapiens OX=9606 GN=MCRS1 PE=1 SV=1	32	RRSSSRFIKRKK
RSSSSGFPKRKK	sp|Q83883|POLG_NVN68	1395	sp|Q96EZ8|MCRS1_HUMAN Microspherule protein 1 OS=Homo sapiens OX=9606 GN=MCRS1 PE=1 SV=1	45	RRSSSRFIKRKK
TGRIEKVNLDKS	sp|Q83883|POLG_NVN68	1683	sp|P46013|KI67_HUMAN Proliferation marker protein Ki-67 OS=Homo sapiens OX=9606 GN=MKI67 PE=1 SV=2	369	TGRRESVNLGKS
SWEFDTERLVAF	sp|Q83883|POLG_NVN68	764	sp|P80108|PHLD_HUMAN Phosphatidylinositol-glycan-specific phospholipase D OS=Homo sapiens OX=9606 GN=GPLD1 PE=1 SV=3	107	PWEKDTEKLVAF
TTELLAGVAGNL	sp|Q83883|POLG_NVN68	49	tr|H7C2V8|H7C2V8_HUMAN Histone-lysine N-methyltransferase 2C (Fragment) OS=Homo sapiens OX=9606 GN=KMT2C PE=1 SV=1	48	TTEELAGKAGVL
TTELLAGVAGNL	sp|Q83883|POLG_NVN68	49	sp|Q8NEZ4|KMT2C_HUMAN Histone-lysine N-methyltransferase 2C OS=Homo sapiens OX=9606 GN=KMT2C PE=1 SV=3	3922	TTEELAGKAGVL
TTELLAGVAGNL	sp|Q83883|POLG_NVN68	49	tr|H0Y765|H0Y765_HUMAN Histone-lysine N-methyltransferase 2C (Fragment) OS=Homo sapiens OX=9606 GN=KMT2C PE=1 SV=1	539	TTEELAGKAGVL
TTELLAGVAGNL	sp|Q83883|POLG_NVN68	49	tr|H7BY37|H7BY37_HUMAN Histone-lysine N-methyltransferase 2C (Fragment) OS=Homo sapiens OX=9606 GN=KMT2C PE=1 SV=1	1483	TTEELAGKAGVL
AEAPMDELRTMV	sp|Q83884|CAPSD_NVN68	158	sp|P30622|CLIP1_HUMAN CAP-Gly domain-containing linker protein 1 OS=Homo sapiens OX=9606 GN=CLIP1 PE=1 SV=2	406	LEAKMDQLRTMV
AEAPMDELRTMV	sp|Q83884|CAPSD_NVN68	158	tr|F5H6A0|F5H6A0_HUMAN CAP-Gly domain-containing linker protein 1 (Fragment) OS=Homo sapiens OX=9606 GN=CLIP1 PE=1 SV=2	340	LEAKMDQLRTMV
AEAPMDELRTMV	sp|Q83884|CAPSD_NVN68	158	tr|F5H0N7|F5H0N7_HUMAN CAP-Gly domain-containing linker protein 1 (Fragment) OS=Homo sapiens OX=9606 GN=CLIP1 PE=1 SV=2	157	LEAKMDQLRTMV
AEAPMDELRTMV	sp|Q83884|CAPSD_NVN68	158	tr|J3KP58|J3KP58_HUMAN CAP-Gly domain-containing linker protein 1 OS=Homo sapiens OX=9606 GN=CLIP1 PE=1 SV=2	406	LEAKMDQLRTMV
SSSSGFPKRKKR	sp|Q83883|POLG_NVN68	1396	sp|Q8TF01|PNISR_HUMAN Arginine/serine-rich protein PNISR OS=Homo sapiens OX=9606 GN=PNISR PE=1 SV=2	546	SSRSSSPKRKKR
KDVVPEWLSDDG	sp|Q83883|POLG_NVN68	1777	tr|C9JII1|C9JII1_HUMAN E3 ubiquitin-protein ligase (Fragment) OS=Homo sapiens OX=9606 GN=DTX2 PE=1 SV=1	108	RGVVWEWLSDDG
KDVVPEWLSDDG	sp|Q83883|POLG_NVN68	1777	tr|E7ET89|E7ET89_HUMAN E3 ubiquitin-protein ligase OS=Homo sapiens OX=9606 GN=DTX2 PE=1 SV=1	17	RGVVWEWLSDDG
KDVVPEWLSDDG	sp|Q83883|POLG_NVN68	1777	sp|Q86UW9|DTX2_HUMAN Probable E3 ubiquitin-protein ligase DTX2 OS=Homo sapiens OX=9606 GN=DTX2 PE=1 SV=3	108	RGVVWEWLSDDG
IATDLHPGGKVG	sp|Q83883|POLG_NVN68	577	sp|Q15397|PUM3_HUMAN Pumilio homolog 3 OS=Homo sapiens OX=9606 GN=PUM3 PE=1 SV=3	533	AATGLHPGGKDG
LIAVQREALPSV	sp|Q83883|POLG_NVN68	1	sp|Q9GZU1|MCLN1_HUMAN Mucolipin-1 OS=Homo sapiens OX=9606 GN=MCOLN1 PE=1 SV=1	414	LIATLRVALPSV
LIAVQREALPSV	sp|Q83883|POLG_NVN68	1	tr|M0R1X7|M0R1X7_HUMAN Mucolipin-1 (Fragment) OS=Homo sapiens OX=9606 GN=MCOLN1 PE=4 SV=1	40	LIATLRVALPSV
IKVNGRALHGTQ	sp|Q83883|POLG_NVN68	1207	sp|Q6UXK5|LRRN1_HUMAN Leucine-rich repeat neuronal protein 1 OS=Homo sapiens OX=9606 GN=LRRN1 PE=1 SV=1	514	IKVNGTLLDGTQ
AGAGVSLGGEAI	sp|Q83885|VP2_NVN68	18	sp|P22692|IBP4_HUMAN Insulin-like growth factor-binding protein 4 OS=Homo sapiens OX=9606 GN=IGFBP4 PE=1 SV=2	14	AGPGPSLGDEAI
YLSDALLMNNSL	sp|Q83883|POLG_NVN68	647	tr|A0A0C4DGQ4|A0A0C4DGQ4_HUMAN NACHT, LRR and PYD domains-containing protein 13 OS=Homo sapiens OX=9606 GN=NLRP13 PE=1 SV=1	886	HLSDALLQNRSL
YLSDALLMNNSL	sp|Q83883|POLG_NVN68	647	sp|Q86W25|NAL13_HUMAN NACHT, LRR and PYD domains-containing protein 13 OS=Homo sapiens OX=9606 GN=NLRP13 PE=2 SV=2	886	HLSDALLQNRSL
LAASRVKVVKVL	sp|Q83883|POLG_NVN68	856	tr|Q5R211|Q5R211_HUMAN Carbamoyl-phosphate synthase [ammonia], mitochondrial OS=Homo sapiens OX=9606 GN=CPS1 PE=1 SV=1	415	LVASRVEVSKVL
LAASRVKVVKVL	sp|Q83883|POLG_NVN68	856	sp|P31327|CPSM_HUMAN Carbamoyl-phosphate synthase [ammonia], mitochondrial OS=Homo sapiens OX=9606 GN=CPS1 PE=1 SV=2	415	LVASRVEVSKVL
GPPGLGKSHLLE	sp|Q83883|POLG_NVN68	560	tr|M0QZP8|M0QZP8_HUMAN Immunity-related GTPase family Q protein (Fragment) OS=Homo sapiens OX=9606 GN=IRGQ PE=1 SV=1	14	GPPGLGKSALIA
GPPGLGKSHLLE	sp|Q83883|POLG_NVN68	560	sp|Q8WZA9|IRGQ_HUMAN Immunity-related GTPase family Q protein OS=Homo sapiens OX=9606 GN=IRGQ PE=1 SV=1	14	GPPGLGKSALIA
GPPGLGKSHLLE	sp|Q83883|POLG_NVN68	560	tr|E9PMK9|E9PMK9_HUMAN Leucine-rich repeat serine/threonine-protein kinase 1 OS=Homo sapiens OX=9606 GN=LRRK1 PE=1 SV=1	645	GPPRQGKSTLLE
GPPGLGKSHLLE	sp|Q83883|POLG_NVN68	560	sp|Q38SD2|LRRK1_HUMAN Leucine-rich repeat serine/threonine-protein kinase 1 OS=Homo sapiens OX=9606 GN=LRRK1 PE=1 SV=3	645	GPPRQGKSTLLE
QDEDESEETVSA	sp|Q83883|POLG_NVN68	943	sp|Q96KN9|CXD4_HUMAN Gap junction delta-4 protein OS=Homo sapiens OX=9606 GN=GJD4 PE=2 SV=1	291	PDEDESEVTSSA
PRGRAPEPGAVE	sp|Q83883|POLG_NVN68	1353	tr|A0A1B0GVM0|A0A1B0GVM0_HUMAN Brain-enriched guanylate kinase-associated protein OS=Homo sapiens OX=9606 GN=BEGAIN PE=1 SV=1	133	PRGRSPEPSAVD
RDPKMSTGPTMQ	sp|Q83883|POLG_NVN68	1329	sp|P40238|TPOR_HUMAN Thrombopoietin receptor OS=Homo sapiens OX=9606 GN=MPL PE=1 SV=1	174	RDPKNSTGPTVI
RDPKMSTGPTMQ	sp|Q83883|POLG_NVN68	1329	tr|Q5JUY5|Q5JUY5_HUMAN Thrombopoietin receptor OS=Homo sapiens OX=9606 GN=MPL PE=1 SV=2	167	RDPKNSTGPTVI
TIKVNGRALHGT	sp|Q83883|POLG_NVN68	1206	sp|Q6UXK5|LRRN1_HUMAN Leucine-rich repeat neuronal protein 1 OS=Homo sapiens OX=9606 GN=LRRN1 PE=1 SV=1	513	TIKVNGTLLDGT
KISSKILKDLKS	sp|Q83883|POLG_NVN68	1737	sp|Q504Q3|PAN2_HUMAN PAN2-PAN3 deadenylation complex catalytic subunit PAN2 OS=Homo sapiens OX=9606 GN=PAN2 PE=1 SV=3	1053	KISSKHLTTLKS
TDLHPGGKVGIL	sp|Q83883|POLG_NVN68	579	sp|Q15397|PUM3_HUMAN Pumilio homolog 3 OS=Homo sapiens OX=9606 GN=PUM3 PE=1 SV=3	535	TGLHPGGKDGEL
GTWLGLIQFLSP	sp|Q83884|CAPSD_NVN68	367	tr|H0YJ96|H0YJ96_HUMAN Serine palmitoyltransferase 2 (Fragment) OS=Homo sapiens OX=9606 GN=SPTLC2 PE=4 SV=1	29	GTSLGLFCFLSP
EAPMDELRTMVF	sp|Q83884|CAPSD_NVN68	159	sp|P30622|CLIP1_HUMAN CAP-Gly domain-containing linker protein 1 OS=Homo sapiens OX=9606 GN=CLIP1 PE=1 SV=2	407	EAKMDQLRTMVE
EAPMDELRTMVF	sp|Q83884|CAPSD_NVN68	159	tr|F5H6A0|F5H6A0_HUMAN CAP-Gly domain-containing linker protein 1 (Fragment) OS=Homo sapiens OX=9606 GN=CLIP1 PE=1 SV=2	341	EAKMDQLRTMVE
EAPMDELRTMVF	sp|Q83884|CAPSD_NVN68	159	tr|F5H0N7|F5H0N7_HUMAN CAP-Gly domain-containing linker protein 1 (Fragment) OS=Homo sapiens OX=9606 GN=CLIP1 PE=1 SV=2	158	EAKMDQLRTMVE
EAPMDELRTMVF	sp|Q83884|CAPSD_NVN68	159	tr|J3KP58|J3KP58_HUMAN CAP-Gly domain-containing linker protein 1 OS=Homo sapiens OX=9606 GN=CLIP1 PE=1 SV=2	407	EAKMDQLRTMVE
AAQTLGQIAGAG	sp|Q83885|VP2_NVN68	10	sp|P55064|AQP5_HUMAN Aquaporin-5 OS=Homo sapiens OX=9606 GN=AQP5 PE=1 SV=1	92	AAQLVGAIAGAG
AAQTLGQIAGAG	sp|Q83885|VP2_NVN68	10	tr|J3KRM4|J3KRM4_HUMAN Aquaporin-4 (Fragment) OS=Homo sapiens OX=9606 GN=AQP4 PE=1 SV=1	79	AAQCLGAIIGAG
AAQTLGQIAGAG	sp|Q83885|VP2_NVN68	10	sp|P55087|AQP4_HUMAN Aquaporin-4 OS=Homo sapiens OX=9606 GN=AQP4 PE=1 SV=2	120	AAQCLGAIIGAG
AAQTLGQIAGAG	sp|Q83885|VP2_NVN68	10	tr|A0A5F9ZHR4|A0A5F9ZHR4_HUMAN Aquaporin-4 OS=Homo sapiens OX=9606 GN=AQP4 PE=1 SV=1	120	AAQCLGAIIGAG
AAQTLGQIAGAG	sp|Q83885|VP2_NVN68	10	tr|V9PBN7|V9PBN7_HUMAN Aquaporin 4 isoform delta4 OS=Homo sapiens OX=9606 GN=AQP4 PE=1 SV=1	120	AAQCLGAIIGAG
VAPMLAGGVGLV	sp|Q83883|POLG_NVN68	407	sp|Q6P1X6|CH082_HUMAN UPF0598 protein C8orf82 OS=Homo sapiens OX=9606 GN=C8orf82 PE=1 SV=2	157	PAPERAGGVGLV
VAPMLAGGVGLV	sp|Q83883|POLG_NVN68	407	tr|H0YF29|H0YF29_HUMAN UPF0598 protein C8orf82 (Fragment) OS=Homo sapiens OX=9606 GN=C8orf82 PE=1 SV=1	202	PAPERAGGVGLV
LTTTELLAGVAG	sp|Q83883|POLG_NVN68	47	sp|Q7Z7M1|AGRD2_HUMAN Adhesion G-protein coupled receptor D2 OS=Homo sapiens OX=9606 GN=ADGRD2 PE=2 SV=1	673	LTTTFLLFLVAG
LTTTELLAGVAG	sp|Q83883|POLG_NVN68	47	tr|A0A1W2PRP3|A0A1W2PRP3_HUMAN Adhesion G-protein-coupled receptor D2 (Fragment) OS=Homo sapiens OX=9606 GN=ADGRD2 PE=4 SV=1	69	LTTTFLLFLVAG
GRDPKMSTGPTM	sp|Q83883|POLG_NVN68	1328	sp|P40238|TPOR_HUMAN Thrombopoietin receptor OS=Homo sapiens OX=9606 GN=MPL PE=1 SV=1	173	PRDPKNSTGPTV
GRDPKMSTGPTM	sp|Q83883|POLG_NVN68	1328	tr|Q5JUY5|Q5JUY5_HUMAN Thrombopoietin receptor OS=Homo sapiens OX=9606 GN=MPL PE=1 SV=2	166	PRDPKNSTGPTV
LVVEIFGLFWTP	sp|Q83883|POLG_NVN68	370	sp|P49238|CX3C1_HUMAN CX3C chemokine receptor 1 OS=Homo sapiens OX=9606 GN=CX3CR1 PE=1 SV=1	235	LVVIVFFLFWTP
AASRVKVVKVLI	sp|Q83883|POLG_NVN68	857	tr|Q5R211|Q5R211_HUMAN Carbamoyl-phosphate synthase [ammonia], mitochondrial OS=Homo sapiens OX=9606 GN=CPS1 PE=1 SV=1	416	VASRVEVSKVLI
AASRVKVVKVLI	sp|Q83883|POLG_NVN68	857	sp|P31327|CPSM_HUMAN Carbamoyl-phosphate synthase [ammonia], mitochondrial OS=Homo sapiens OX=9606 GN=CPS1 PE=1 SV=2	416	VASRVEVSKVLI
CGPPGLGKSHLL	sp|Q83883|POLG_NVN68	559	tr|A0A0D9SF58|A0A0D9SF58_HUMAN Chromosome transmission fidelity protein 18 homolog OS=Homo sapiens OX=9606 GN=CHTF18 PE=1 SV=1	568	CGPPGLGKTTLA
CGPPGLGKSHLL	sp|Q83883|POLG_NVN68	559	sp|Q8WVB6|CTF18_HUMAN Chromosome transmission fidelity protein 18 homolog OS=Homo sapiens OX=9606 GN=CHTF18 PE=1 SV=1	373	CGPPGLGKTTLA
CGPPGLGKSHLL	sp|Q83883|POLG_NVN68	559	tr|E7EXA6|E7EXA6_HUMAN Chromosome transmission fidelity protein 18 homolog OS=Homo sapiens OX=9606 GN=CHTF18 PE=1 SV=2	373	CGPPGLGKTTLA
CGPPGLGKSHLL	sp|Q83883|POLG_NVN68	559	tr|F8WCC1|F8WCC1_HUMAN Chromosome transmission fidelity protein 18 homolog OS=Homo sapiens OX=9606 GN=CHTF18 PE=1 SV=1	374	CGPPGLGKTTLA
CGPPGLGKSHLL	sp|Q83883|POLG_NVN68	559	tr|M0QZP8|M0QZP8_HUMAN Immunity-related GTPase family Q protein (Fragment) OS=Homo sapiens OX=9606 GN=IRGQ PE=1 SV=1	13	LGPPGLGKSALI
CGPPGLGKSHLL	sp|Q83883|POLG_NVN68	559	sp|Q8WZA9|IRGQ_HUMAN Immunity-related GTPase family Q protein OS=Homo sapiens OX=9606 GN=IRGQ PE=1 SV=1	13	LGPPGLGKSALI
EGLSGLGSVLPE	sp|Q83884|CAPSD_NVN68	13	sp|O76013|KRT36_HUMAN Keratin, type I cuticular Ha6 OS=Homo sapiens OX=9606 GN=KRT36 PE=1 SV=1	54	SGLSGLGSCLPG
APMLAGGVGLVI	sp|Q83883|POLG_NVN68	408	sp|Q6P1X6|CH082_HUMAN UPF0598 protein C8orf82 OS=Homo sapiens OX=9606 GN=C8orf82 PE=1 SV=2	158	APERAGGVGLVR
APMLAGGVGLVI	sp|Q83883|POLG_NVN68	408	tr|H0YF29|H0YF29_HUMAN UPF0598 protein C8orf82 (Fragment) OS=Homo sapiens OX=9606 GN=C8orf82 PE=1 SV=1	203	APERAGGVGLVR
SRERAQRVLKTL	sp|Q83883|POLG_NVN68	422	tr|C9JQG1|C9JQG1_HUMAN Pendrin (Fragment) OS=Homo sapiens OX=9606 GN=SLC26A4 PE=1 SV=1	57	SRKRAFGVLKTL
SRERAQRVLKTL	sp|Q83883|POLG_NVN68	422	sp|O43511|S26A4_HUMAN Pendrin OS=Homo sapiens OX=9606 GN=SLC26A4 PE=1 SV=1	57	SRKRAFGVLKTL
GLSGLGSVLPEL	sp|Q83884|CAPSD_NVN68	14	sp|O76013|KRT36_HUMAN Keratin, type I cuticular Ha6 OS=Homo sapiens OX=9606 GN=KRT36 PE=1 SV=1	55	GLSGLGSCLPGS
TGEKDVVPEWLS	sp|Q83883|POLG_NVN68	1774	sp|Q9BYI3|HYCCI_HUMAN Hyccin OS=Homo sapiens OX=9606 GN=FAM126A PE=1 SV=2	3	TSEKGVVEEWLS
TGEKDVVPEWLS	sp|Q83883|POLG_NVN68	1774	tr|B8ZZA2|B8ZZA2_HUMAN Hyccin OS=Homo sapiens OX=9606 GN=FAM126A PE=1 SV=1	3	TSEKGVVEEWLS
GGDGGLGDTELE	sp|Q83883|POLG_NVN68	1028	sp|Q13753|LAMC2_HUMAN Laminin subunit gamma-2 OS=Homo sapiens OX=9606 GN=LAMC2 PE=1 SV=2	639	GGDGVVPDTELE
LSDALLMNNSLP	sp|Q83883|POLG_NVN68	648	tr|A0A0C4DGQ4|A0A0C4DGQ4_HUMAN NACHT, LRR and PYD domains-containing protein 13 OS=Homo sapiens OX=9606 GN=NLRP13 PE=1 SV=1	887	LSDALLQNRSLT
LSDALLMNNSLP	sp|Q83883|POLG_NVN68	648	sp|Q86W25|NAL13_HUMAN NACHT, LRR and PYD domains-containing protein 13 OS=Homo sapiens OX=9606 GN=NLRP13 PE=2 SV=2	887	LSDALLQNRSLT
AGGRDPKMSTGP	sp|Q83883|POLG_NVN68	1326	sp|P40238|TPOR_HUMAN Thrombopoietin receptor OS=Homo sapiens OX=9606 GN=MPL PE=1 SV=1	171	YGPRDPKNSTGP
AGGRDPKMSTGP	sp|Q83883|POLG_NVN68	1326	tr|Q5JUY5|Q5JUY5_HUMAN Thrombopoietin receptor OS=Homo sapiens OX=9606 GN=MPL PE=1 SV=2	164	YGPRDPKNSTGP
GHDLVRYGQGPL	sp|Q83883|POLG_NVN68	1290	tr|B8ZZP4|B8ZZP4_HUMAN Secernin-1 OS=Homo sapiens OX=9606 GN=SCRN1 PE=1 SV=1	109	GMDLVRNGQGEL
RGTGGLQSPPSN	sp|Q83883|POLG_NVN68	33	tr|M0QXZ8|M0QXZ8_HUMAN Rho GTPase-activating protein SYDE1 OS=Homo sapiens OX=9606 GN=SYDE1 PE=1 SV=1	295	RGRGGPESPPSN
RGTGGLQSPPSN	sp|Q83883|POLG_NVN68	33	sp|Q6ZW31|SYDE1_HUMAN Rho GTPase-activating protein SYDE1 OS=Homo sapiens OX=9606 GN=SYDE1 PE=1 SV=1	638	RGRGGPESPPSN
DEDESEETVSAA	sp|Q83883|POLG_NVN68	944	tr|H3BPE3|H3BPE3_HUMAN Eukaryotic translation initiation factor 3 subunit C (Fragment) OS=Homo sapiens OX=9606 GN=EIF3C PE=1 SV=8	113	DEDEDEDGVSAA
DEDESEETVSAA	sp|Q83883|POLG_NVN68	944	sp|Q99613|EIF3C_HUMAN Eukaryotic translation initiation factor 3 subunit C OS=Homo sapiens OX=9606 GN=EIF3C PE=1 SV=1	183	DEDEDEDGVSAA
DEDESEETVSAA	sp|Q83883|POLG_NVN68	944	sp|B5ME19|EIFCL_HUMAN Eukaryotic translation initiation factor 3 subunit C-like protein OS=Homo sapiens OX=9606 GN=EIF3CL PE=1 SV=1	183	DEDEDEDGVSAA
DEDESEETVSAA	sp|Q83883|POLG_NVN68	944	sp|Q96KN9|CXD4_HUMAN Gap junction delta-4 protein OS=Homo sapiens OX=9606 GN=GJD4 PE=2 SV=1	292	DEDESEVTSSAS
AVIGAAAAQTLG	sp|Q83885|VP2_NVN68	4	tr|J3QL86|J3QL86_HUMAN CDK5 regulatory subunit-associated protein 3 (Fragment) OS=Homo sapiens OX=9606 GN=CDK5RAP3 PE=1 SV=1	98	AEIGAAAQQSLG
AVIGAAAAQTLG	sp|Q83885|VP2_NVN68	4	sp|Q96JB5|CK5P3_HUMAN CDK5 regulatory subunit-associated protein 3 OS=Homo sapiens OX=9606 GN=CDK5RAP3 PE=1 SV=2	191	AEIGAAAQQSLG
AVIGAAAAQTLG	sp|Q83885|VP2_NVN68	4	tr|J3QQY1|J3QQY1_HUMAN CDK5 regulatory subunit-associated protein 3 (Fragment) OS=Homo sapiens OX=9606 GN=CDK5RAP3 PE=1 SV=1	191	AEIGAAAQQSLG
ICDQDEDESEET	sp|Q83883|POLG_NVN68	940	tr|F2Z2K0|F2Z2K0_HUMAN NSFL1 cofactor p47 OS=Homo sapiens OX=9606 GN=NSFL1C PE=1 SV=1	79	IHDQDEDEEEEE
ICDQDEDESEET	sp|Q83883|POLG_NVN68	940	sp|Q9UNZ2|NSF1C_HUMAN NSFL1 cofactor p47 OS=Homo sapiens OX=9606 GN=NSFL1C PE=1 SV=2	79	IHDQDEDEEEEE
ICDQDEDESEET	sp|Q83883|POLG_NVN68	940	tr|R4GNE6|R4GNE6_HUMAN NSFL1 cofactor p47 OS=Homo sapiens OX=9606 GN=NSFL1C PE=1 SV=1	79	IHDQDEDEEEEE
