query	query_seqname	query_start	target_seqname	target_start	target
INNSGQSASKLN	sp|P15423|SPIKE_CVH22	837	tr|A0A088AWL3|A0A088AWL3_HUMAN Nuclear receptor corepressor 1 OS=Homo sapiens OX=9606 GN=NCOR1 PE=1 SV=1	1298	DNNSGQSAIKHN
INNSGQSASKLN	sp|P15423|SPIKE_CVH22	837	sp|O75376|NCOR1_HUMAN Nuclear receptor corepressor 1 OS=Homo sapiens OX=9606 GN=NCOR1 PE=1 SV=2	1391	DNNSGQSAIKHN
INNSGQSASKLN	sp|P15423|SPIKE_CVH22	837	tr|E7EVK1|E7EVK1_HUMAN Nuclear receptor corepressor 1 (Fragment) OS=Homo sapiens OX=9606 GN=NCOR1 PE=1 SV=2	22	DNNSGQSAIKHN
MNNVKRGAAIGF	sp|P0C6U2|R1A_CVH22	3914	tr|A0A0A0MR62|A0A0A0MR62_HUMAN Formin-like protein 1 OS=Homo sapiens OX=9606 GN=FMNL1 PE=1 SV=1	503	MNSSKRGAAYGF
MNNVKRGAAIGF	sp|P0C6U2|R1A_CVH22	3914	tr|K7EK60|K7EK60_HUMAN Formin-like protein 1 OS=Homo sapiens OX=9606 GN=FMNL1 PE=1 SV=1	426	MNSSKRGAAYGF
MNNVKRGAAIGF	sp|P0C6U2|R1A_CVH22	3914	tr|K7EJE6|K7EJE6_HUMAN Formin-like protein 1 (Fragment) OS=Homo sapiens OX=9606 GN=FMNL1 PE=1 SV=1	178	MNSSKRGAAYGF
MNNVKRGAAIGF	sp|P0C6U2|R1A_CVH22	3914	sp|O95466|FMNL1_HUMAN Formin-like protein 1 OS=Homo sapiens OX=9606 GN=FMNL1 PE=1 SV=3	848	MNSSKRGAAYGF
FPTSGTSLLPAA	sp|P0C6U2|R1A_CVH22	880	sp|A0A1B0GV85|RELD1_HUMAN Reelin domain-containing protein 1 OS=Homo sapiens OX=9606 GN=REELD1 PE=2 SV=2	370	LQTSGTSGLPAA
ATSKPEPITPAS	sp|P0C6U2|R1A_CVH22	1175	sp|Q8TD26|CHD6_HUMAN Chromodomain-helicase-DNA-binding protein 6 OS=Homo sapiens OX=9606 GN=CHD6 PE=1 SV=4	2335	ATSAPEPATAAS
ASNVKPKPLVNQ	sp|P0C6U2|R1A_CVH22	1903	sp|Q9UIF8|BAZ2B_HUMAN Bromodomain adjacent to zinc finger domain protein 2B OS=Homo sapiens OX=9606 GN=BAZ2B PE=1 SV=3	381	VSNVKPLSLVNQ
ASNVKPKPLVNQ	sp|P0C6U2|R1A_CVH22	1903	tr|A0A0A0MR97|A0A0A0MR97_HUMAN Bromodomain adjacent to zinc finger domain protein 2B OS=Homo sapiens OX=9606 GN=BAZ2B PE=1 SV=1	185	VSNVKPLSLVNQ
NLSLQALECRRL	sp|P0C6X1|R1AB_CVH22	2349	sp|Q13155|AIMP2_HUMAN Aminoacyl tRNA synthase complex-interacting multifunctional protein 2 OS=Homo sapiens OX=9606 GN=AIMP2 PE=1 SV=2	49	NLSLQALESRQD
GRYSKDWFEFLK	sp|P0C6X1|R1AB_CVH22	4476	tr|A0A1W2PNN6|A0A1W2PNN6_HUMAN Calcium-activated potassium channel subunit alpha-1 (Fragment) OS=Homo sapiens OX=9606 GN=KCNMA1 PE=1 SV=1	50	SRYSKDPFEFKK
GRYSKDWFEFLK	sp|P0C6X1|R1AB_CVH22	4476	tr|A0A1W2PPS2|A0A1W2PPS2_HUMAN BK channel (Fragment) OS=Homo sapiens OX=9606 GN=KCNMA1 PE=1 SV=1	582	SRYSKDPFEFKK
GRYSKDWFEFLK	sp|P0C6X1|R1AB_CVH22	4476	tr|A0A1W2PNY7|A0A1W2PNY7_HUMAN BK channel (Fragment) OS=Homo sapiens OX=9606 GN=KCNMA1 PE=1 SV=1	683	SRYSKDPFEFKK
GRYSKDWFEFLK	sp|P0C6X1|R1AB_CVH22	4476	tr|A0A1W2PNG1|A0A1W2PNG1_HUMAN BK channel (Fragment) OS=Homo sapiens OX=9606 GN=KCNMA1 PE=1 SV=1	643	SRYSKDPFEFKK
GRYSKDWFEFLK	sp|P0C6X1|R1AB_CVH22	4476	tr|A0A0A0MRC3|A0A0A0MRC3_HUMAN BK channel OS=Homo sapiens OX=9606 GN=KCNMA1 PE=1 SV=1	568	SRYSKDPFEFKK
GRYSKDWFEFLK	sp|P0C6X1|R1AB_CVH22	4476	tr|A0A0A0MSE6|A0A0A0MSE6_HUMAN BK channel (Fragment) OS=Homo sapiens OX=9606 GN=KCNMA1 PE=1 SV=2	639	SRYSKDPFEFKK
VALGLFSATLAS	sp|P19739|NS4A_CVH22	1	sp|Q16186|ADRM1_HUMAN Proteasomal ubiquitin receptor ADRM1 OS=Homo sapiens OX=9606 GN=ADRM1 PE=1 SV=2	338	QALGMFSAALAS
VALGLFSATLAS	sp|P19739|NS4A_CVH22	1	tr|A0A087WX59|A0A087WX59_HUMAN Proteasomal ubiquitin receptor ADRM1 OS=Homo sapiens OX=9606 GN=ADRM1 PE=1 SV=1	299	QALGMFSAALAS
QPSVIKTVKKIV	sp|P0C6U2|R1A_CVH22	3660	tr|A6PVC9|A6PVC9_HUMAN Translocation protein SEC63 homolog (Fragment) OS=Homo sapiens OX=9606 GN=SEC63 PE=1 SV=1	11	QPNIIPTVKKIV
QPSVIKTVKKIV	sp|P0C6U2|R1A_CVH22	3660	sp|Q9UGP8|SEC63_HUMAN Translocation protein SEC63 homolog OS=Homo sapiens OX=9606 GN=SEC63 PE=1 SV=2	67	QPNIIPTVKKIV
GRTLTYVFLLCG	sp|P0C6X1|R1AB_CVH22	2488	tr|G5E9F5|G5E9F5_HUMAN MpV17 transgene, murine homolog, glomerulosclerosis, isoform CRA_d OS=Homo sapiens OX=9606 GN=MPV17 PE=1 SV=1	49	GRTLTMVSLGCG
GRTLTYVFLLCG	sp|P0C6X1|R1AB_CVH22	2488	tr|H0Y6M5|H0Y6M5_HUMAN Protein Mpv17 (Fragment) OS=Homo sapiens OX=9606 GN=MPV17 PE=1 SV=1	26	GRTLTMVSLGCG
GRTLTYVFLLCG	sp|P0C6X1|R1AB_CVH22	2488	tr|C9J473|C9J473_HUMAN Protein Mpv17 (Fragment) OS=Homo sapiens OX=9606 GN=MPV17 PE=1 SV=1	23	GRTLTMVSLGCG
GRTLTYVFLLCG	sp|P0C6X1|R1AB_CVH22	2488	tr|B5MCF8|B5MCF8_HUMAN Protein Mpv17 OS=Homo sapiens OX=9606 GN=MPV17 PE=1 SV=1	49	GRTLTMVSLGCG
GRTLTYVFLLCG	sp|P0C6X1|R1AB_CVH22	2488	sp|P39210|MPV17_HUMAN Protein Mpv17 OS=Homo sapiens OX=9606 GN=MPV17 PE=1 SV=1	49	GRTLTMVSLGCG
GRTLTYVFLLCG	sp|P0C6X1|R1AB_CVH22	2488	tr|E7EX18|E7EX18_HUMAN Protein Mpv17 OS=Homo sapiens OX=9606 GN=MPV17 PE=1 SV=1	64	GRTLTMVSLGCG
GRTLTYVFLLCG	sp|P0C6X1|R1AB_CVH22	2488	tr|B5MC53|B5MC53_HUMAN MpV17 transgene, murine homolog, glomerulosclerosis, isoform CRA_f OS=Homo sapiens OX=9606 GN=MPV17 PE=1 SV=1	49	GRTLTMVSLGCG
FAESILPPCPTA	sp|P0C6X1|R1AB_CVH22	703	tr|U3KQ82|U3KQ82_HUMAN Protein-serine/threonine phosphatase OS=Homo sapiens OX=9606 GN=DUSP13 PE=1 SV=1	22	TAWSSLPPCPTA
RVLLVGLELSNS	sp|P0C6U2|R1A_CVH22	358	sp|P78325|ADAM8_HUMAN Disintegrin and metalloproteinase domain-containing protein 8 OS=Homo sapiens OX=9606 GN=ADAM8 PE=1 SV=2	243	RVVLVGLEIWNS
LCTVPLDYILPL	sp|P0C6U2|R1A_CVH22	1569	sp|Q9Y5W8|SNX13_HUMAN Sorting nexin-13 OS=Homo sapiens OX=9606 GN=SNX13 PE=1 SV=4	369	LCTVPLDSILVD
LCTVPLDYILPL	sp|P0C6U2|R1A_CVH22	1569	tr|A0A087WUZ7|A0A087WUZ7_HUMAN Sorting nexin 13, isoform CRA_g OS=Homo sapiens OX=9606 GN=SNX13 PE=1 SV=1	369	LCTVPLDSILVD
LGDKLANYYSSS	sp|P19740|NS4B_CVH22	28	sp|Q13371|PHLP_HUMAN Phosducin-like protein OS=Homo sapiens OX=9606 GN=PDCL PE=1 SV=3	9	LGEKLQYYYSSS
DGKPAVTEDVYS	sp|P0C6U2|R1A_CVH22	124	sp|Q86V87|F16B2_HUMAN Protein FAM160B2 OS=Homo sapiens OX=9606 GN=FAM160B2 PE=2 SV=2	528	DGKTAVTEIVNS
ELNLSLQALECR	sp|P0C6X1|R1AB_CVH22	2347	sp|Q13155|AIMP2_HUMAN Aminoacyl tRNA synthase complex-interacting multifunctional protein 2 OS=Homo sapiens OX=9606 GN=AIMP2 PE=1 SV=2	47	ESNLSLQALESR
VLFLLFPLVVIA	sp|P15422|VME1_CVH22	50	sp|O75509|TNR21_HUMAN Tumor necrosis factor receptor superfamily member 21 OS=Homo sapiens OX=9606 GN=TNFRSF21 PE=1 SV=1	355	VLFLLLVLVVIV
INESLVNRGGHS	sp|P0C6X1|R1AB_CVH22	5891	sp|P98155|VLDLR_HUMAN Very low-density lipoprotein receptor OS=Homo sapiens OX=9606 GN=VLDLR PE=1 SV=1	357	INECLVNNGGCS
SALLNGLKLAHS	sp|P0C6U2|R1A_CVH22	1685	tr|A0A0A0MR36|A0A0A0MR36_HUMAN Unconventional myosin-Vb (Fragment) OS=Homo sapiens OX=9606 GN=MYO5B PE=1 SV=1	384	SLLLNQLKLAHE
SALLNGLKLAHS	sp|P0C6U2|R1A_CVH22	1685	sp|Q9ULV0|MYO5B_HUMAN Unconventional myosin-Vb OS=Homo sapiens OX=9606 GN=MYO5B PE=1 SV=3	1241	SLLLNQLKLAHE
IALGKAVAQLVL	sp|P0C6X1|R1AB_CVH22	4238	sp|P82987|ATL3_HUMAN ADAMTS-like protein 3 OS=Homo sapiens OX=9606 GN=ADAMTSL3 PE=1 SV=4	1371	NALGKAVATSVL
SNVKPKPLVNQI	sp|P0C6U2|R1A_CVH22	1904	sp|Q9UIF8|BAZ2B_HUMAN Bromodomain adjacent to zinc finger domain protein 2B OS=Homo sapiens OX=9606 GN=BAZ2B PE=1 SV=3	382	SNVKPLSLVNQA
SNVKPKPLVNQI	sp|P0C6U2|R1A_CVH22	1904	tr|A0A0A0MR97|A0A0A0MR97_HUMAN Bromodomain adjacent to zinc finger domain protein 2B OS=Homo sapiens OX=9606 GN=BAZ2B PE=1 SV=1	186	SNVKPLSLVNQA
SLGACSLALLIA	sp|P0C6U2|R1A_CVH22	2783	sp|O95622|ADCY5_HUMAN Adenylate cyclase type 5 OS=Homo sapiens OX=9606 GN=ADCY5 PE=1 SV=3	204	SLGACCLALLQI
SEPTALALNSPL	sp|P0C6X1|R1AB_CVH22	4439	sp|P27815|PDE4A_HUMAN cAMP-specific 3',5'-cyclic phosphodiesterase 4A OS=Homo sapiens OX=9606 GN=PDE4A PE=1 SV=3	809	SSPSALALQSPL
AVSVDLNGYVQL	sp|P0C6X1|R1AB_CVH22	3367	sp|Q9UNI1|CELA1_HUMAN Chymotrypsin-like elastase family member 1 OS=Homo sapiens OX=9606 GN=CELA1 PE=1 SV=2	118	AQSVTLNSYVQL
YNFVDKFGENDE	sp|P0C6X1|R1AB_CVH22	134	tr|A0A0A0MSJ8|A0A0A0MSJ8_HUMAN Serine/threonine-protein phosphatase 6 regulatory subunit 2 (Fragment) OS=Homo sapiens OX=9606 GN=PPP6R2 PE=1 SV=1	175	ANFVDQFGFNDE
YNFVDKFGENDE	sp|P0C6X1|R1AB_CVH22	134	tr|T1ECW5|T1ECW5_HUMAN Serine/threonine-protein phosphatase 6 regulatory subunit 2 (Fragment) OS=Homo sapiens OX=9606 GN=PPP6R2 PE=1 SV=1	299	ANFVDQFGFNDE
YNFVDKFGENDE	sp|P0C6X1|R1AB_CVH22	134	sp|O75170|PP6R2_HUMAN Serine/threonine-protein phosphatase 6 regulatory subunit 2 OS=Homo sapiens OX=9606 GN=PPP6R2 PE=1 SV=2	573	ANFVDQFGFNDE
DAVILIDKYLSL	sp|P0C6X1|R1AB_CVH22	4914	tr|E7EMD6|E7EMD6_HUMAN A-kinase anchor protein 10, mitochondrial OS=Homo sapiens OX=9606 GN=AKAP10 PE=1 SV=3	434	DAMILYDKYFSL
DAVILIDKYLSL	sp|P0C6X1|R1AB_CVH22	4914	sp|O43572|AKA10_HUMAN A-kinase anchor protein 10, mitochondrial OS=Homo sapiens OX=9606 GN=AKAP10 PE=1 SV=2	434	DAMILYDKYFSL
TSSIKQPKRSWR	sp|P0C6X1|R1AB_CVH22	3057	sp|P46013|KI67_HUMAN Proliferation marker protein Ki-67 OS=Homo sapiens OX=9606 GN=MKI67 PE=1 SV=2	1749	TSSKPQPKRSLR
AESILPPCPTAV	sp|P0C6X1|R1AB_CVH22	704	tr|U3KQ82|U3KQ82_HUMAN Protein-serine/threonine phosphatase OS=Homo sapiens OX=9606 GN=DUSP13 PE=1 SV=1	23	AWSSLPPCPTAS
LNLSLQALECRR	sp|P0C6X1|R1AB_CVH22	2348	sp|Q13155|AIMP2_HUMAN Aminoacyl tRNA synthase complex-interacting multifunctional protein 2 OS=Homo sapiens OX=9606 GN=AIMP2 PE=1 SV=2	48	SNLSLQALESRQ
VNNSTNLVEFDK	sp|P0C6U2|R1A_CVH22	3009	tr|V9GY21|V9GY21_HUMAN Component of oligomeric Golgi complex 2 OS=Homo sapiens OX=9606 GN=COG2 PE=1 SV=1	72	VNLSTNLVGMDK
VNNSTNLVEFDK	sp|P0C6U2|R1A_CVH22	3009	sp|Q14746|COG2_HUMAN Conserved oligomeric Golgi complex subunit 2 OS=Homo sapiens OX=9606 GN=COG2 PE=1 SV=1	72	VNLSTNLVGMDK
VNNSTNLVEFDK	sp|P0C6U2|R1A_CVH22	3009	tr|B7Z2Y2|B7Z2Y2_HUMAN Component of oligomeric Golgi complex 2 OS=Homo sapiens OX=9606 GN=COG2 PE=1 SV=1	13	VNLSTNLVGMDK
LNNLIKLLVVVP	sp|P0C6X1|R1AB_CVH22	3751	sp|Q7Z6Z7|HUWE1_HUMAN E3 ubiquitin-protein ligase HUWE1 OS=Homo sapiens OX=9606 GN=HUWE1 PE=1 SV=3	1554	LNVLIKLLEVVQ
ALGLFSATLASV	sp|P19739|NS4A_CVH22	2	sp|Q16186|ADRM1_HUMAN Proteasomal ubiquitin receptor ADRM1 OS=Homo sapiens OX=9606 GN=ADRM1 PE=1 SV=2	339	ALGMFSAALASG
ALGLFSATLASV	sp|P19739|NS4A_CVH22	2	tr|A0A087WX59|A0A087WX59_HUMAN Proteasomal ubiquitin receptor ADRM1 OS=Homo sapiens OX=9606 GN=ADRM1 PE=1 SV=1	300	ALGMFSAALASG
IKVVTTGSGSGT	sp|P0C6X1|R1AB_CVH22	3975	sp|Q86V97|KBTB6_HUMAN Kelch repeat and BTB domain-containing protein 6 OS=Homo sapiens OX=9606 GN=KBTBD6 PE=1 SV=1	67	IEVVTPGSGPGT
IKVVTTGSGSGT	sp|P0C6X1|R1AB_CVH22	3975	sp|Q8WVZ9|KBTB7_HUMAN Kelch repeat and BTB domain-containing protein 7 OS=Homo sapiens OX=9606 GN=KBTBD7 PE=1 SV=1	67	IEVVTPGSGPGT
IDPVKEEVSADS	sp|P15130|NCAP_CVH22	371	sp|P56962|STX17_HUMAN Syntaxin-17 OS=Homo sapiens OX=9606 GN=STX17 PE=1 SV=2	91	IDPVKEEASAAT
IDPVKEEVSADS	sp|P15130|NCAP_CVH22	371	tr|E9PIC2|E9PIC2_HUMAN Syntaxin-17 OS=Homo sapiens OX=9606 GN=STX17 PE=1 SV=1	91	IDPVKEEASAAT
TPKPQRQQSPAS	sp|P15130|NCAP_CVH22	210	tr|A0A0A0MRY4|A0A0A0MRY4_HUMAN Uncharacterized protein OS=Homo sapiens OX=9606 PE=4 SV=1	468	TPKPQSPQSPQS
PTSGTSLLPAAF	sp|P0C6U2|R1A_CVH22	881	sp|A0A1B0GV85|RELD1_HUMAN Reelin domain-containing protein 1 OS=Homo sapiens OX=9606 GN=REELD1 PE=2 SV=2	371	QTSGTSGLPAAG
SPWLVLALVMLF	sp|P0C6X1|R1AB_CVH22	2077	sp|Q96MM7|H6ST2_HUMAN Heparan-sulfate 6-O-sulfotransferase 2 OS=Homo sapiens OX=9606 GN=HS6ST2 PE=1 SV=2	151	SNKLLLALVMLF
FVVNVEGISVFK	sp|P0C6U2|R1A_CVH22	306	sp|Q8NEW0|ZNT7_HUMAN Zinc transporter 7 OS=Homo sapiens OX=9606 GN=SLC30A7 PE=2 SV=1	149	FVVNLIGIFVFK
LFTSEGGKAFLY	sp|P0C6U2|R1A_CVH22	3853	tr|J3KTP9|J3KTP9_HUMAN Hydrocephalus-inducing protein homolog (Fragment) OS=Homo sapiens OX=9606 GN=HYDIN PE=1 SV=1	133	LFTPEENKAFLY
AVVGMITTVSVA	sp|P0C6U2|R1A_CVH22	3558	tr|A0A2R8Y5X9|A0A2R8Y5X9_HUMAN UDP-N-acetylglucosamine/UDP-glucose/GDP-mannose transporter (Fragment) OS=Homo sapiens OX=9606 GN=SLC35D2 PE=4 SV=1	139	AVVGAIKNVSVA
AVVGMITTVSVA	sp|P0C6U2|R1A_CVH22	3558	sp|Q76EJ3|S35D2_HUMAN UDP-N-acetylglucosamine/UDP-glucose/GDP-mannose transporter OS=Homo sapiens OX=9606 GN=SLC35D2 PE=1 SV=1	271	AVVGAIKNVSVA
RYSKDWFEFLKS	sp|P0C6X1|R1AB_CVH22	4477	tr|A0A1W2PNN6|A0A1W2PNN6_HUMAN Calcium-activated potassium channel subunit alpha-1 (Fragment) OS=Homo sapiens OX=9606 GN=KCNMA1 PE=1 SV=1	51	RYSKDPFEFKKE
RYSKDWFEFLKS	sp|P0C6X1|R1AB_CVH22	4477	tr|A0A1W2PPS2|A0A1W2PPS2_HUMAN BK channel (Fragment) OS=Homo sapiens OX=9606 GN=KCNMA1 PE=1 SV=1	583	RYSKDPFEFKKE
RYSKDWFEFLKS	sp|P0C6X1|R1AB_CVH22	4477	tr|A0A1W2PNY7|A0A1W2PNY7_HUMAN BK channel (Fragment) OS=Homo sapiens OX=9606 GN=KCNMA1 PE=1 SV=1	684	RYSKDPFEFKKE
RYSKDWFEFLKS	sp|P0C6X1|R1AB_CVH22	4477	tr|A0A1W2PNG1|A0A1W2PNG1_HUMAN BK channel (Fragment) OS=Homo sapiens OX=9606 GN=KCNMA1 PE=1 SV=1	644	RYSKDPFEFKKE
RYSKDWFEFLKS	sp|P0C6X1|R1AB_CVH22	4477	tr|A0A0A0MRC3|A0A0A0MRC3_HUMAN BK channel OS=Homo sapiens OX=9606 GN=KCNMA1 PE=1 SV=1	569	RYSKDPFEFKKE
RYSKDWFEFLKS	sp|P0C6X1|R1AB_CVH22	4477	tr|A0A0A0MSE6|A0A0A0MSE6_HUMAN BK channel (Fragment) OS=Homo sapiens OX=9606 GN=KCNMA1 PE=1 SV=2	640	RYSKDPFEFKKE
VPDGAVFIKSLA	sp|P15423|SPIKE_CVH22	941	sp|Q2M3C6|TM266_HUMAN Transmembrane protein 266 OS=Homo sapiens OX=9606 GN=TMEM266 PE=1 SV=2	172	VFDGAVIILSLA
SAGGAQMLVSIQ	sp|P0C6X1|R1AB_CVH22	4619	tr|H0Y6Z7|H0Y6Z7_HUMAN Protein-tyrosine-phosphatase (Fragment) OS=Homo sapiens OX=9606 GN=PTPRF PE=1 SV=1	729	SAGGLQHLVSIR
SAGGAQMLVSIQ	sp|P0C6X1|R1AB_CVH22	4619	sp|P10586|PTPRF_HUMAN Receptor-type tyrosine-protein phosphatase F OS=Homo sapiens OX=9606 GN=PTPRF PE=1 SV=2	1083	SAGGLQHLVSIR
SAGGAQMLVSIQ	sp|P0C6X1|R1AB_CVH22	4619	tr|H0Y4H1|H0Y4H1_HUMAN Protein-tyrosine-phosphatase (Fragment) OS=Homo sapiens OX=9606 GN=PTPRF PE=1 SV=1	456	SAGGLQHLVSIR
SAGGAQMLVSIQ	sp|P0C6X1|R1AB_CVH22	4619	tr|H0Y380|H0Y380_HUMAN Protein-tyrosine-phosphatase (Fragment) OS=Homo sapiens OX=9606 GN=PTPRF PE=1 SV=1	144	SAGGLQHLVSIR
SAGGAQMLVSIQ	sp|P0C6X1|R1AB_CVH22	4619	tr|H0Y7Z9|H0Y7Z9_HUMAN Protein-tyrosine-phosphatase (Fragment) OS=Homo sapiens OX=9606 GN=PTPRF PE=1 SV=1	497	SAGGLQHLVSIR
EMLCTVPLDYIL	sp|P0C6U2|R1A_CVH22	1567	sp|Q9Y5W8|SNX13_HUMAN Sorting nexin-13 OS=Homo sapiens OX=9606 GN=SNX13 PE=1 SV=4	367	GKLCTVPLDSIL
EMLCTVPLDYIL	sp|P0C6U2|R1A_CVH22	1567	tr|A0A087WUZ7|A0A087WUZ7_HUMAN Sorting nexin 13, isoform CRA_g OS=Homo sapiens OX=9606 GN=SNX13 PE=1 SV=1	367	GKLCTVPLDSIL
KPAVTEDVYSYV	sp|P0C6U2|R1A_CVH22	126	sp|Q86V15|CASZ1_HUMAN Zinc finger protein castor homolog 1 OS=Homo sapiens OX=9606 GN=CASZ1 PE=1 SV=4	454	KPAVTEDVNIYQ
AYGDLSLGACSL	sp|P0C6U2|R1A_CVH22	2778	sp|P29622|KAIN_HUMAN Kallistatin OS=Homo sapiens OX=9606 GN=SERPINA4 PE=1 SV=3	85	AYAMLSLGACSH
VFHSSKVCIDPC	sp|P0C6X1|R1AB_CVH22	6471	tr|A0A6Q8PG35|A0A6Q8PG35_HUMAN Solute carrier family 52, riboflavin transporter, member 2 OS=Homo sapiens OX=9606 GN=SLC52A2 PE=1 SV=1	249	VFHSRKDCADPC
VFHSSKVCIDPC	sp|P0C6X1|R1AB_CVH22	6471	tr|E9PKE4|E9PKE4_HUMAN Solute carrier family 52, riboflavin transporter, member 2 OS=Homo sapiens OX=9606 GN=SLC52A2 PE=1 SV=3	268	VFHSRKDCADPC
VFHSSKVCIDPC	sp|P0C6X1|R1AB_CVH22	6471	sp|Q9HAB3|S52A2_HUMAN Solute carrier family 52, riboflavin transporter, member 2 OS=Homo sapiens OX=9606 GN=SLC52A2 PE=1 SV=1	432	VFHSRKDCADPC
VFHSSKVCIDPC	sp|P0C6X1|R1AB_CVH22	6471	tr|A0A6Q8PHF8|A0A6Q8PHF8_HUMAN Solute carrier family 52, riboflavin transporter, member 2 OS=Homo sapiens OX=9606 GN=SLC52A2 PE=1 SV=1	344	VFHSRKDCADPC
DNIDPCLSSKLI	sp|P0C6U2|R1A_CVH22	1836	sp|Q9BZP6|CHIA_HUMAN Acidic mammalian chitinase OS=Homo sapiens OX=9606 GN=CHIA PE=1 SV=1	44	DNIDPCLCTHLI
NDAVILIDKYLS	sp|P0C6X1|R1AB_CVH22	4913	tr|E7EMD6|E7EMD6_HUMAN A-kinase anchor protein 10, mitochondrial OS=Homo sapiens OX=9606 GN=AKAP10 PE=1 SV=3	433	NDAMILYDKYFS
NDAVILIDKYLS	sp|P0C6X1|R1AB_CVH22	4913	sp|O43572|AKA10_HUMAN A-kinase anchor protein 10, mitochondrial OS=Homo sapiens OX=9606 GN=AKAP10 PE=1 SV=2	433	NDAMILYDKYFS
LFQPELTALNVT	sp|P15422|VME1_CVH22	110	tr|H7C191|H7C191_HUMAN Mediator of RNA polymerase II transcription subunit 12 (Fragment) OS=Homo sapiens OX=9606 GN=MED12 PE=1 SV=1	16	LPQDELTALNVK
IAPKSLLPANRK	sp|P15130|NCAP_CVH22	38	tr|I3L2H5|I3L2H5_HUMAN Serine/threonine-protein kinase PLK1 (Fragment) OS=Homo sapiens OX=9606 GN=PLK1 PE=1 SV=1	87	IAPSSLDPSNRK
IAPKSLLPANRK	sp|P15130|NCAP_CVH22	38	sp|P53350|PLK1_HUMAN Serine/threonine-protein kinase PLK1 OS=Homo sapiens OX=9606 GN=PLK1 PE=1 SV=1	327	IAPSSLDPSNRK
PVSSAPQGLNAT	sp|P15422|VME1_CVH22	131	tr|D6RC00|D6RC00_HUMAN Iroquois-class homeodomain protein IRX-4 OS=Homo sapiens OX=9606 GN=IRX4 PE=1 SV=1	9	PYSSAPQFLMAT
PVSSAPQGLNAT	sp|P15422|VME1_CVH22	131	tr|D6RAS8|D6RAS8_HUMAN Iroquois-class homeodomain protein IRX-4 (Fragment) OS=Homo sapiens OX=9606 GN=IRX4 PE=1 SV=1	9	PYSSAPQFLMAT
PVSSAPQGLNAT	sp|P15422|VME1_CVH22	131	sp|P78413|IRX4_HUMAN Iroquois-class homeodomain protein IRX-4 OS=Homo sapiens OX=9606 GN=IRX4 PE=1 SV=2	9	PYSSAPQFLMAT
CTAPLEYVLPLA	sp|P0C6X1|R1AB_CVH22	1570	tr|D6RBJ7|D6RBJ7_HUMAN Gc-globulin OS=Homo sapiens OX=9606 GN=GC PE=1 SV=1	244	PTADLEDVLPLA
CTAPLEYVLPLA	sp|P0C6X1|R1AB_CVH22	1570	sp|P02774|VTDB_HUMAN Vitamin D-binding protein OS=Homo sapiens OX=9606 GN=GC PE=1 SV=2	244	PTADLEDVLPLA
CTAPLEYVLPLA	sp|P0C6X1|R1AB_CVH22	1570	tr|D6RF35|D6RF35_HUMAN Gc-globulin OS=Homo sapiens OX=9606 GN=GC PE=1 SV=1	244	PTADLEDVLPLA
TYEKLAQTATPD	sp|P0C6X1|R1AB_CVH22	2894	sp|Q9Y6I3|EPN1_HUMAN Epsin-1 OS=Homo sapiens OX=9606 GN=EPN1 PE=1 SV=2	150	TKEKLAQTATAS
IFANDRVSEFNL	sp|P0C6U2|R1A_CVH22	621	sp|P14543|NID1_HUMAN Nidogen-1 OS=Homo sapiens OX=9606 GN=NID1 PE=1 SV=3	238	IFANDRESVENL
AILVVSLCISWM	sp|P0C6U2|R1A_CVH22	3312	tr|A0A2R8YEM9|A0A2R8YEM9_HUMAN TPR and ankyrin repeat-containing protein 1 OS=Homo sapiens OX=9606 GN=TRANK1 PE=1 SV=1	2726	ACLVVSLCISWR
AILVVSLCISWM	sp|P0C6U2|R1A_CVH22	3312	sp|O15050|TRNK1_HUMAN TPR and ankyrin repeat-containing protein 1 OS=Homo sapiens OX=9606 GN=TRANK1 PE=2 SV=4	2682	ACLVVSLCISWR
VEEVIWSRIVSS	sp|P15423|SPIKE_CVH22	692	tr|H7C301|H7C301_HUMAN tRNA-splicing endonuclease subunit Sen2 (Fragment) OS=Homo sapiens OX=9606 GN=TSEN2 PE=1 SV=1	61	VQEVILSRWVSS
VEEVIWSRIVSS	sp|P15423|SPIKE_CVH22	692	sp|Q8NCE0|SEN2_HUMAN tRNA-splicing endonuclease subunit Sen2 OS=Homo sapiens OX=9606 GN=TSEN2 PE=1 SV=2	445	VQEVILSRWVSS
AVNGNLVITCLA	sp|P0C6U2|R1A_CVH22	2750	sp|Q9H2X9|S12A5_HUMAN Solute carrier family 12 member 5 OS=Homo sapiens OX=9606 GN=SLC12A5 PE=1 SV=3	492	AVNGNLVVGTLA
GRVLVVLWRLVL	sp|P19739|NS4A_CVH22	67	sp|Q8IY26|PLPP6_HUMAN Phospholipid phosphatase 6 OS=Homo sapiens OX=9606 GN=PLPP6 PE=1 SV=3	235	LRVLVVLWAFVL
LVVSLCISWMLK	sp|P0C6U2|R1A_CVH22	3314	tr|A0A2R8YEM9|A0A2R8YEM9_HUMAN TPR and ankyrin repeat-containing protein 1 OS=Homo sapiens OX=9606 GN=TRANK1 PE=1 SV=1	2728	LVVSLCISWRRR
LVVSLCISWMLK	sp|P0C6U2|R1A_CVH22	3314	sp|O15050|TRNK1_HUMAN TPR and ankyrin repeat-containing protein 1 OS=Homo sapiens OX=9606 GN=TRANK1 PE=2 SV=4	2684	LVVSLCISWRRR
