query	query_seqname	query_start	target_seqname	target_start	target
YEDLVLLLPDFD	sp|P26313|GLYC_JUNIN	112	tr|A0A2R8YE54|A0A2R8YE54_HUMAN Dynamin-like 120 kDa protein, form S1 OS=Homo sapiens OX=9606 GN=OPA1 PE=1 SV=1	159	SEDLVKLAPDFD
YEDLVLLLPDFD	sp|P26313|GLYC_JUNIN	112	tr|A0A2R8Y3X5|A0A2R8Y3X5_HUMAN Dynamin-like 120 kDa protein, form S1 OS=Homo sapiens OX=9606 GN=OPA1 PE=1 SV=1	35	SEDLVKLAPDFD
YEDLVLLLPDFD	sp|P26313|GLYC_JUNIN	112	tr|H7C321|H7C321_HUMAN Dynamin-like 120 kDa protein, mitochondrial (Fragment) OS=Homo sapiens OX=9606 GN=OPA1 PE=1 SV=2	33	SEDLVKLAPDFD
YEDLVLLLPDFD	sp|P26313|GLYC_JUNIN	112	tr|C9JY58|C9JY58_HUMAN Dynamin-like 120 kDa protein, mitochondrial (Fragment) OS=Homo sapiens OX=9606 GN=OPA1 PE=1 SV=1	35	SEDLVKLAPDFD
YEDLVLLLPDFD	sp|P26313|GLYC_JUNIN	112	tr|A0A2R8Y5G3|A0A2R8Y5G3_HUMAN Dynamin-like 120 kDa protein, mitochondrial OS=Homo sapiens OX=9606 GN=OPA1 PE=1 SV=1	159	SEDLVKLAPDFD
YEDLVLLLPDFD	sp|P26313|GLYC_JUNIN	112	tr|A0A2R8Y4G4|A0A2R8Y4G4_HUMAN Dynamin-like 120 kDa protein, form S1 (Fragment) OS=Homo sapiens OX=9606 GN=OPA1 PE=1 SV=1	46	SEDLVKLAPDFD
YEDLVLLLPDFD	sp|P26313|GLYC_JUNIN	112	tr|A0A2R8Y4Q3|A0A2R8Y4Q3_HUMAN Dynamin-like 120 kDa protein, form S1 OS=Homo sapiens OX=9606 GN=OPA1 PE=1 SV=1	35	SEDLVKLAPDFD
YEDLVLLLPDFD	sp|P26313|GLYC_JUNIN	112	sp|O60313|OPA1_HUMAN Dynamin-like 120 kDa protein, mitochondrial OS=Homo sapiens OX=9606 GN=OPA1 PE=1 SV=3	159	SEDLVKLAPDFD
YEDLVLLLPDFD	sp|P26313|GLYC_JUNIN	112	tr|C9JMB8|C9JMB8_HUMAN Dynamin-like 120 kDa protein, form S1 OS=Homo sapiens OX=9606 GN=OPA1 PE=1 SV=2	159	SEDLVKLAPDFD
YEDLVLLLPDFD	sp|P26313|GLYC_JUNIN	112	tr|A0A2R8YE78|A0A2R8YE78_HUMAN Dynamin-like 120 kDa protein, form S1 OS=Homo sapiens OX=9606 GN=OPA1 PE=1 SV=1	159	SEDLVKLAPDFD
YEDLVLLLPDFD	sp|P26313|GLYC_JUNIN	112	tr|A0A2R8YGE5|A0A2R8YGE5_HUMAN Dynamin-like 120 kDa protein, form S1 (Fragment) OS=Homo sapiens OX=9606 GN=OPA1 PE=1 SV=1	149	SEDLVKLAPDFD
YEDLVLLLPDFD	sp|P26313|GLYC_JUNIN	112	tr|A0A2R8YD53|A0A2R8YD53_HUMAN Dynamin-like 120 kDa protein, form S1 OS=Homo sapiens OX=9606 GN=OPA1 PE=1 SV=1	159	SEDLVKLAPDFD
YEDLVLLLPDFD	sp|P26313|GLYC_JUNIN	112	tr|A0A2R8YDM2|A0A2R8YDM2_HUMAN Dynamin-like 120 kDa protein, form S1 OS=Homo sapiens OX=9606 GN=OPA1 PE=1 SV=1	159	SEDLVKLAPDFD
YEDLVLLLPDFD	sp|P26313|GLYC_JUNIN	112	tr|A0A2R8Y5E2|A0A2R8Y5E2_HUMAN Dynamin-like 120 kDa protein, mitochondrial (Fragment) OS=Homo sapiens OX=9606 GN=OPA1 PE=1 SV=1	136	SEDLVKLAPDFD
ASPAAPPTILFV	sp|P14239|NCAP_JUNIN	546	tr|E9PAL7|E9PAL7_HUMAN Signal sequence receptor subunit alpha OS=Homo sapiens OX=9606 GN=SSR1 PE=1 SV=1	79	ASPSADTTILFV
ASPAAPPTILFV	sp|P14239|NCAP_JUNIN	546	tr|C9IZQ1|C9IZQ1_HUMAN Signal sequence receptor subunit alpha OS=Homo sapiens OX=9606 GN=SSR1 PE=1 SV=1	79	ASPSADTTILFV
ASPAAPPTILFV	sp|P14239|NCAP_JUNIN	546	tr|A0A3B3IRT8|A0A3B3IRT8_HUMAN Signal sequence receptor subunit alpha OS=Homo sapiens OX=9606 GN=SSR1 PE=1 SV=1	79	ASPSADTTILFV
ASPAAPPTILFV	sp|P14239|NCAP_JUNIN	546	sp|P43307|SSRA_HUMAN Translocon-associated protein subunit alpha OS=Homo sapiens OX=9606 GN=SSR1 PE=1 SV=3	79	ASPSADTTILFV
ASPAAPPTILFV	sp|P14239|NCAP_JUNIN	546	tr|C9J5W0|C9J5W0_HUMAN Signal sequence receptor subunit alpha OS=Homo sapiens OX=9606 GN=SSR1 PE=1 SV=1	79	ASPSADTTILFV
ASPAAPPTILFV	sp|P14239|NCAP_JUNIN	546	tr|C9J3L8|C9J3L8_HUMAN Signal sequence receptor subunit alpha OS=Homo sapiens OX=9606 GN=SSR1 PE=1 SV=1	79	ASPSADTTILFV
ASPAAPPTILFV	sp|P14239|NCAP_JUNIN	546	tr|C9JBX5|C9JBX5_HUMAN Signal sequence receptor subunit alpha OS=Homo sapiens OX=9606 GN=SSR1 PE=1 SV=1	79	ASPSADTTILFV
GIMVGSVLIIVS	sp|Q6XQI4|L_JUNIN	378	tr|A0A140T9G9|A0A140T9G9_HUMAN HLA class II histocompatibility antigen, DP alpha 1 chain (Fragment) OS=Homo sapiens OX=9606 GN=HLA-DPA1 PE=1 SV=1	104	GIIVGTVLIIKS
GIMVGSVLIIVS	sp|Q6XQI4|L_JUNIN	378	tr|A0A140T961|A0A140T961_HUMAN HLA class II histocompatibility antigen, DP alpha 1 chain (Fragment) OS=Homo sapiens OX=9606 GN=HLA-DPA1 PE=1 SV=1	104	GIIVGTVLIIKS
GIMVGSVLIIVS	sp|Q6XQI4|L_JUNIN	378	sp|P20036|DPA1_HUMAN HLA class II histocompatibility antigen, DP alpha 1 chain OS=Homo sapiens OX=9606 GN=HLA-DPA1 PE=1 SV=1	236	GIIVGTVLIIKS
GIMVGSVLIIVS	sp|Q6XQI4|L_JUNIN	378	tr|A0A140T992|A0A140T992_HUMAN HLA class II histocompatibility antigen, DP alpha 1 chain (Fragment) OS=Homo sapiens OX=9606 GN=HLA-DPA1 PE=1 SV=1	104	GIIVGTVLIIKS
GIMVGSVLIIVS	sp|Q6XQI4|L_JUNIN	378	tr|A0A140T968|A0A140T968_HUMAN HLA class II histocompatibility antigen, DP alpha 1 chain (Fragment) OS=Homo sapiens OX=9606 GN=HLA-DPA1 PE=1 SV=1	104	GIIVGTVLIIKS
GIMVGSVLIIVS	sp|Q6XQI4|L_JUNIN	378	tr|A0A140T9G7|A0A140T9G7_HUMAN HLA class II histocompatibility antigen, DP alpha 1 chain (Fragment) OS=Homo sapiens OX=9606 GN=HLA-DPA1 PE=1 SV=1	104	GIIVGTVLIIKS
GIMVGSVLIIVS	sp|Q6XQI4|L_JUNIN	378	tr|H0Y6F8|H0Y6F8_HUMAN HLA class II histocompatibility antigen, DP alpha 1 chain (Fragment) OS=Homo sapiens OX=9606 GN=HLA-DPA1 PE=1 SV=1	104	GIIVGTVLIIKS
GIMVGSVLIIVS	sp|Q6XQI4|L_JUNIN	378	tr|A0A140T9A6|A0A140T9A6_HUMAN HLA class II histocompatibility antigen, DP alpha 1 chain (Fragment) OS=Homo sapiens OX=9606 GN=HLA-DPA1 PE=1 SV=1	104	GIIVGTVLIIKS
GIMVGSVLIIVS	sp|Q6XQI4|L_JUNIN	378	tr|A0A140T977|A0A140T977_HUMAN HLA class II histocompatibility antigen, DP alpha 1 chain (Fragment) OS=Homo sapiens OX=9606 GN=HLA-DPA1 PE=1 SV=1	104	GIIVGTVLIIKS
DNEYLMSEVISK	sp|P26313|GLYC_JUNIN	398	sp|Q8NA54|IQUB_HUMAN IQ and ubiquitin-like domain-containing protein OS=Homo sapiens OX=9606 GN=IQUB PE=1 SV=2	74	DNEQLMEEVISP
DNEYLMSEVISK	sp|P26313|GLYC_JUNIN	398	tr|A1A4Z1|A1A4Z1_HUMAN IQ and ubiquitin-like domain-containing protein OS=Homo sapiens OX=9606 GN=IQUB PE=1 SV=1	74	DNEQLMEEVISP
ILLSSLRSSFSN	sp|Q6XQI4|L_JUNIN	495	tr|F8W1U3|F8W1U3_HUMAN Keratin, type II cytoskeletal 8 (Fragment) OS=Homo sapiens OX=9606 GN=KRT8 PE=1 SV=1	8	ILLSSLRFSVSR
ILLSSLRSSFSN	sp|Q6XQI4|L_JUNIN	495	tr|A0A0U1RQU6|A0A0U1RQU6_HUMAN Keratin, type II cytoskeletal 8 OS=Homo sapiens OX=9606 GN=KRT8 PE=4 SV=1	8	ILLSSLRFSVSR
EEANLKSSTEET	sp|Q6XQI4|L_JUNIN	304	sp|P49767|VEGFC_HUMAN Vascular endothelial growth factor C OS=Homo sapiens OX=9606 GN=VEGFC PE=1 SV=1	95	EQANLNSRTEET
TDYQNISFSLLG	sp|P26313|GLYC_JUNIN	68	sp|Q9NZM3|ITSN2_HUMAN Intersectin-2 OS=Homo sapiens OX=9606 GN=ITSN2 PE=1 SV=3	857	TDYQNVSFSNLT
TDYQNISFSLLG	sp|P26313|GLYC_JUNIN	68	tr|A0A087WVF7|A0A087WVF7_HUMAN Intersectin-2 OS=Homo sapiens OX=9606 GN=ITSN2 PE=1 SV=1	840	TDYQNVSFSNLT
VLEDSGSYWCEP	sp|Q6XQI4|L_JUNIN	563	sp|Q96P31|FCRL3_HUMAN Fc receptor-like protein 3 OS=Homo sapiens OX=9606 GN=FCRL3 PE=1 SV=1	251	WTEDSGSYWCEV
LGRLEKLDALTG	sp|P14239|NCAP_JUNIN	94	tr|A0A3B3ITL8|A0A3B3ITL8_HUMAN Sorbin and SH3 domain-containing protein 2 (Fragment) OS=Homo sapiens OX=9606 GN=SORBS2 PE=1 SV=1	122	LGELEKLGALTL
VDKFHTKGRYQL	sp|Q6XQI4|L_JUNIN	848	tr|F2Z2U4|F2Z2U4_HUMAN Transformation/transcription domain-associated protein OS=Homo sapiens OX=9606 GN=TRRAP PE=1 SV=3	453	VLKFHTIARYQL
VDKFHTKGRYQL	sp|Q6XQI4|L_JUNIN	848	sp|Q9Y4A5|TRRAP_HUMAN Transformation/transcription domain-associated protein OS=Homo sapiens OX=9606 GN=TRRAP PE=1 SV=3	453	VLKFHTIARYQL
VDKFHTKGRYQL	sp|Q6XQI4|L_JUNIN	848	tr|H0Y4W2|H0Y4W2_HUMAN Transformation/transcription domain-associated protein OS=Homo sapiens OX=9606 GN=TRRAP PE=1 SV=2	453	VLKFHTIARYQL
SSKLKSKTLTLD	sp|Q6XQI4|L_JUNIN	928	sp|O95477|ABCA1_HUMAN Phospholipid-transporting ATPase ABCA1 OS=Homo sapiens OX=9606 GN=ABCA1 PE=1 SV=3	1023	SSKLKSKTSQLS
DSSKLKSKTLTL	sp|Q6XQI4|L_JUNIN	927	sp|O95477|ABCA1_HUMAN Phospholipid-transporting ATPase ABCA1 OS=Homo sapiens OX=9606 GN=ABCA1 PE=1 SV=3	1022	PSSKLKSKTSQL
SLIGTNLTVILQ	sp|P26313|GLYC_JUNIN	327	sp|Q96AY4|TTC28_HUMAN Tetratricopeptide repeat protein 28 OS=Homo sapiens OX=9606 GN=TTC28 PE=1 SV=4	1722	SLIGQALTEILQ
SLIGTNLTVILQ	sp|P26313|GLYC_JUNIN	327	tr|A0A087WW06|A0A087WW06_HUMAN Tetratricopeptide repeat protein 28 OS=Homo sapiens OX=9606 GN=TTC28 PE=1 SV=1	1595	SLIGQALTEILQ
SLIGTNLTVILQ	sp|P26313|GLYC_JUNIN	327	tr|B0QYP5|B0QYP5_HUMAN Tetratricopeptide repeat protein 28 (Fragment) OS=Homo sapiens OX=9606 GN=TTC28 PE=1 SV=1	9	SLIGQALTEILQ
EDLVLLLPDFDM	sp|P26313|GLYC_JUNIN	113	tr|A0A2R8YE54|A0A2R8YE54_HUMAN Dynamin-like 120 kDa protein, form S1 OS=Homo sapiens OX=9606 GN=OPA1 PE=1 SV=1	160	EDLVKLAPDFDK
EDLVLLLPDFDM	sp|P26313|GLYC_JUNIN	113	tr|A0A2R8Y3X5|A0A2R8Y3X5_HUMAN Dynamin-like 120 kDa protein, form S1 OS=Homo sapiens OX=9606 GN=OPA1 PE=1 SV=1	36	EDLVKLAPDFDK
EDLVLLLPDFDM	sp|P26313|GLYC_JUNIN	113	tr|H7C321|H7C321_HUMAN Dynamin-like 120 kDa protein, mitochondrial (Fragment) OS=Homo sapiens OX=9606 GN=OPA1 PE=1 SV=2	34	EDLVKLAPDFDK
EDLVLLLPDFDM	sp|P26313|GLYC_JUNIN	113	tr|C9JY58|C9JY58_HUMAN Dynamin-like 120 kDa protein, mitochondrial (Fragment) OS=Homo sapiens OX=9606 GN=OPA1 PE=1 SV=1	36	EDLVKLAPDFDK
EDLVLLLPDFDM	sp|P26313|GLYC_JUNIN	113	tr|A0A2R8Y5G3|A0A2R8Y5G3_HUMAN Dynamin-like 120 kDa protein, mitochondrial OS=Homo sapiens OX=9606 GN=OPA1 PE=1 SV=1	160	EDLVKLAPDFDK
EDLVLLLPDFDM	sp|P26313|GLYC_JUNIN	113	tr|A0A2R8Y4G4|A0A2R8Y4G4_HUMAN Dynamin-like 120 kDa protein, form S1 (Fragment) OS=Homo sapiens OX=9606 GN=OPA1 PE=1 SV=1	47	EDLVKLAPDFDK
EDLVLLLPDFDM	sp|P26313|GLYC_JUNIN	113	tr|A0A2R8Y4Q3|A0A2R8Y4Q3_HUMAN Dynamin-like 120 kDa protein, form S1 OS=Homo sapiens OX=9606 GN=OPA1 PE=1 SV=1	36	EDLVKLAPDFDK
EDLVLLLPDFDM	sp|P26313|GLYC_JUNIN	113	sp|O60313|OPA1_HUMAN Dynamin-like 120 kDa protein, mitochondrial OS=Homo sapiens OX=9606 GN=OPA1 PE=1 SV=3	160	EDLVKLAPDFDK
EDLVLLLPDFDM	sp|P26313|GLYC_JUNIN	113	tr|C9JMB8|C9JMB8_HUMAN Dynamin-like 120 kDa protein, form S1 OS=Homo sapiens OX=9606 GN=OPA1 PE=1 SV=2	160	EDLVKLAPDFDK
EDLVLLLPDFDM	sp|P26313|GLYC_JUNIN	113	tr|A0A2R8YE78|A0A2R8YE78_HUMAN Dynamin-like 120 kDa protein, form S1 OS=Homo sapiens OX=9606 GN=OPA1 PE=1 SV=1	160	EDLVKLAPDFDK
EDLVLLLPDFDM	sp|P26313|GLYC_JUNIN	113	tr|A0A2R8YGE5|A0A2R8YGE5_HUMAN Dynamin-like 120 kDa protein, form S1 (Fragment) OS=Homo sapiens OX=9606 GN=OPA1 PE=1 SV=1	150	EDLVKLAPDFDK
EDLVLLLPDFDM	sp|P26313|GLYC_JUNIN	113	tr|A0A2R8YD53|A0A2R8YD53_HUMAN Dynamin-like 120 kDa protein, form S1 OS=Homo sapiens OX=9606 GN=OPA1 PE=1 SV=1	160	EDLVKLAPDFDK
EDLVLLLPDFDM	sp|P26313|GLYC_JUNIN	113	tr|A0A2R8YDM2|A0A2R8YDM2_HUMAN Dynamin-like 120 kDa protein, form S1 OS=Homo sapiens OX=9606 GN=OPA1 PE=1 SV=1	160	EDLVKLAPDFDK
EDLVLLLPDFDM	sp|P26313|GLYC_JUNIN	113	tr|A0A2R8Y5E2|A0A2R8Y5E2_HUMAN Dynamin-like 120 kDa protein, mitochondrial (Fragment) OS=Homo sapiens OX=9606 GN=OPA1 PE=1 SV=1	137	EDLVKLAPDFDK
NRGLKKVLVDSV	sp|Q6XQI4|L_JUNIN	1593	tr|Q5T532|Q5T532_HUMAN Golgin-45 (Fragment) OS=Homo sapiens OX=9606 GN=BLZF1 PE=1 SV=1	158	NRELKKLLVASV
NRGLKKVLVDSV	sp|Q6XQI4|L_JUNIN	1593	sp|Q9H2G9|GO45_HUMAN Golgin-45 OS=Homo sapiens OX=9606 GN=BLZF1 PE=1 SV=2	158	NRELKKLLVASV
KFLSLASFGEIH	sp|Q6XQI4|L_JUNIN	1547	tr|F6U4U2|F6U4U2_HUMAN Serine/threonine-protein kinase Nek2 OS=Homo sapiens OX=9606 GN=NEK2 PE=1 SV=1	362	KFLSLASNPESH
SELVEALCFREY	sp|Q6XQI4|L_JUNIN	1348	sp|Q9NZB2|F120A_HUMAN Constitutive coactivator of PPAR-gamma-like protein 1 OS=Homo sapiens OX=9606 GN=FAM120A PE=1 SV=2	656	PELVEALAFREW
SELVEALCFREY	sp|Q6XQI4|L_JUNIN	1348	tr|A0A0C4DG79|A0A0C4DG79_HUMAN Constitutive coactivator of PPAR-gamma-like protein 1 (Fragment) OS=Homo sapiens OX=9606 GN=FAM120A PE=1 SV=1	78	PELVEALAFREW
MLSKLKLNFGDF	sp|Q6XQI4|L_JUNIN	2046	tr|A0A669KBC5|A0A669KBC5_HUMAN Protein unc-80 homolog OS=Homo sapiens OX=9606 GN=UNC80 PE=1 SV=1	1975	MLRKLLLNIGDF
MLSKLKLNFGDF	sp|Q6XQI4|L_JUNIN	2046	tr|A0A669KAW8|A0A669KAW8_HUMAN Protein unc-80 homolog OS=Homo sapiens OX=9606 GN=UNC80 PE=1 SV=1	1907	MLRKLLLNIGDF
MLSKLKLNFGDF	sp|Q6XQI4|L_JUNIN	2046	sp|Q8N2C7|UNC80_HUMAN Protein unc-80 homolog OS=Homo sapiens OX=9606 GN=UNC80 PE=2 SV=2	1909	MLRKLLLNIGDF
ELVEALCFREYL	sp|Q6XQI4|L_JUNIN	1349	sp|Q9NZB2|F120A_HUMAN Constitutive coactivator of PPAR-gamma-like protein 1 OS=Homo sapiens OX=9606 GN=FAM120A PE=1 SV=2	657	ELVEALAFREWT
ELVEALCFREYL	sp|Q6XQI4|L_JUNIN	1349	tr|A0A0C4DG79|A0A0C4DG79_HUMAN Constitutive coactivator of PPAR-gamma-like protein 1 (Fragment) OS=Homo sapiens OX=9606 GN=FAM120A PE=1 SV=1	79	ELVEALAFREWT
EGHSQYSQRFLL	sp|Q6XQI4|L_JUNIN	142	sp|P09848|LPH_HUMAN Lactase-phlorizin hydrolase OS=Homo sapiens OX=9606 GN=LCT PE=2 SV=3	806	EGPSGYSQRFGL
EGHSQYSQRFLL	sp|Q6XQI4|L_JUNIN	142	tr|H0Y4E4|H0Y4E4_HUMAN Lactase-phlorizin hydrolase (Fragment) OS=Homo sapiens OX=9606 GN=LCT PE=1 SV=1	238	EGPSGYSQRFGL
IQDIERIQSDKD	sp|P14239|NCAP_JUNIN	211	sp|Q8IWV8|UBR2_HUMAN E3 ubiquitin-protein ligase UBR2 OS=Homo sapiens OX=9606 GN=UBR2 PE=1 SV=1	1340	IQSIERILSDED
TMLSKLKLNFGD	sp|Q6XQI4|L_JUNIN	2045	tr|H0YAL1|H0YAL1_HUMAN Centrosomal protein of 63 kDa (Fragment) OS=Homo sapiens OX=9606 GN=CEP63 PE=1 SV=1	167	TMLSSLVLNFGI
VILLSSLRSSFS	sp|Q6XQI4|L_JUNIN	494	tr|F8W1U3|F8W1U3_HUMAN Keratin, type II cytoskeletal 8 (Fragment) OS=Homo sapiens OX=9606 GN=KRT8 PE=1 SV=1	7	RILLSSLRFSVS
VILLSSLRSSFS	sp|Q6XQI4|L_JUNIN	494	tr|A0A0U1RQU6|A0A0U1RQU6_HUMAN Keratin, type II cytoskeletal 8 OS=Homo sapiens OX=9606 GN=KRT8 PE=4 SV=1	7	RILLSSLRFSVS
SEALLNKLVLEL	sp|Q6XQI4|L_JUNIN	662	tr|E7EQD9|E7EQD9_HUMAN Unconventional myosin-Ib (Fragment) OS=Homo sapiens OX=9606 GN=MYO1B PE=1 SV=1	216	SEELLNKLKLER
SEALLNKLVLEL	sp|Q6XQI4|L_JUNIN	662	tr|E9PDF6|E9PDF6_HUMAN Unconventional myosin-Ib OS=Homo sapiens OX=9606 GN=MYO1B PE=1 SV=1	216	SEELLNKLKLER
SEALLNKLVLEL	sp|Q6XQI4|L_JUNIN	662	sp|O43795|MYO1B_HUMAN Unconventional myosin-Ib OS=Homo sapiens OX=9606 GN=MYO1B PE=1 SV=3	216	SEELLNKLKLER
LSRVRDVTRDLD	sp|P14239|NCAP_JUNIN	64	sp|Q8TBE9|NANP_HUMAN N-acylneuraminate-9-phosphatase OS=Homo sapiens OX=9606 GN=NANP PE=1 SV=1	3	LSRVRAVFFDLD
NISFSLLGLFTS	sp|P26313|GLYC_JUNIN	72	sp|Q8NGR3|OR1K1_HUMAN Olfactory receptor 1K1 OS=Homo sapiens OX=9606 GN=OR1K1 PE=2 SV=1	10	GISFVLLGLTTS
DIISEQIGLLQK	sp|Q6XQI4|L_JUNIN	1779	sp|Q7Z3B4|NUP54_HUMAN Nucleoporin p54 OS=Homo sapiens OX=9606 GN=NUP54 PE=1 SV=2	352	DIISEDISELQK
YSLSLMAHLGVS	sp|P14239|NCAP_JUNIN	241	tr|A0A2R8Y752|A0A2R8Y752_HUMAN Leishmanolysin-like peptidase (Fragment) OS=Homo sapiens OX=9606 GN=LMLN2 PE=3 SV=1	273	VSLSLAKHLGVS
YSLSLMAHLGVS	sp|P14239|NCAP_JUNIN	241	tr|A0A2R8Y3T5|A0A2R8Y3T5_HUMAN Leishmanolysin-like peptidase OS=Homo sapiens OX=9606 GN=LMLN2 PE=3 SV=1	298	VSLSLAKHLGVS
YSLSLMAHLGVS	sp|P14239|NCAP_JUNIN	241	sp|A0A1B0GTW7|LMLN2_HUMAN Leishmanolysin-like peptidase 2 OS=Homo sapiens OX=9606 GN=LMLN2 PE=3 SV=1	356	VSLSLAKHLGVS
LTGSEALLNKLV	sp|Q6XQI4|L_JUNIN	659	sp|Q7Z4Y8|AT5L2_HUMAN Putative ATP synthase subunit g 2, mitochondrial OS=Homo sapiens OX=9606 GN=ATP5MGL PE=5 SV=1	68	LTVKEALLNGLV
RVSTSYGNLPML	sp|P14239|NCAP_JUNIN	166	sp|Q8N6Y1|PCD20_HUMAN Protocadherin-20 OS=Homo sapiens OX=9606 GN=PCDH20 PE=2 SV=2	35	RSSTSYRNLPHL
SFSNRALISERE	sp|Q6XQI4|L_JUNIN	503	tr|F5H6P5|F5H6P5_HUMAN Cleavage and polyadenylation-specificity factor subunit 7 OS=Homo sapiens OX=9606 GN=CPSF7 PE=1 SV=1	88	SFSWVGLISERE
LNDTLDTICETC	sp|Q6XQI4|L_JUNIN	1414	tr|J3KT08|J3KT08_HUMAN GOLD domain-containing protein (Fragment) OS=Homo sapiens OX=9606 PE=3 SV=1	148	LNDTLDAIEELC
ISFSLLGLFTSN	sp|P26313|GLYC_JUNIN	73	sp|Q8NGR3|OR1K1_HUMAN Olfactory receptor 1K1 OS=Homo sapiens OX=9606 GN=OR1K1 PE=2 SV=1	11	ISFVLLGLTTSP
GRREIRVADIKL	sp|P14239|NCAP_JUNIN	466	sp|Q15811|ITSN1_HUMAN Intersectin-1 OS=Homo sapiens OX=9606 GN=ITSN1 PE=1 SV=3	1676	GRTEIRVADIKK
NLLFIDLLIISL	sp|Q6XQI4|L_JUNIN	348	sp|Q96P66|GP101_HUMAN Probable G-protein coupled receptor 101 OS=Homo sapiens OX=9606 GN=GPR101 PE=1 SV=1	72	NLLVTDLLQISL
EGHLCALRLSPT	sp|P26313|GLYC_JUNIN	209	sp|Q8IZY2|ABCA7_HUMAN Phospholipid-transporting ATPase ABCA7 OS=Homo sapiens OX=9606 GN=ABCA7 PE=1 SV=3	1263	FGHYPALRLSPT
EGHLCALRLSPT	sp|P26313|GLYC_JUNIN	209	tr|A0A6E1ZGS3|A0A6E1ZGS3_HUMAN Phospholipid-transporting ATPase ABCA7 (Fragment) OS=Homo sapiens OX=9606 GN=ABCA7 PE=1 SV=1	420	FGHYPALRLSPT
VESEDLILHGVE	sp|Q6XQI4|L_JUNIN	745	tr|F5H7V8|F5H7V8_HUMAN 39S ribosomal protein L21, mitochondrial OS=Homo sapiens OX=9606 GN=MRPL21 PE=1 SV=1	108	VTSEDLILIGNE
VESEDLILHGVE	sp|Q6XQI4|L_JUNIN	745	sp|Q7Z2W9|RM21_HUMAN 39S ribosomal protein L21, mitochondrial OS=Homo sapiens OX=9606 GN=MRPL21 PE=1 SV=2	108	VTSEDLILIGNE
VESEDLILHGVE	sp|Q6XQI4|L_JUNIN	745	tr|H3BUY0|H3BUY0_HUMAN 39S ribosomal protein L21, mitochondrial OS=Homo sapiens OX=9606 GN=MRPL21 PE=1 SV=1	23	VTSEDLILIGNE
RSELVEALCFRE	sp|Q6XQI4|L_JUNIN	1347	sp|Q9NZB2|F120A_HUMAN Constitutive coactivator of PPAR-gamma-like protein 1 OS=Homo sapiens OX=9606 GN=FAM120A PE=1 SV=2	655	TPELVEALAFRE
RSELVEALCFRE	sp|Q6XQI4|L_JUNIN	1347	tr|A0A0C4DG79|A0A0C4DG79_HUMAN Constitutive coactivator of PPAR-gamma-like protein 1 (Fragment) OS=Homo sapiens OX=9606 GN=FAM120A PE=1 SV=1	77	TPELVEALAFRE
VSKFKLVRQNFG	sp|Q6XQI4|L_JUNIN	529	sp|O15254|ACOX3_HUMAN Peroxisomal acyl-coenzyme A oxidase 3 OS=Homo sapiens OX=9606 GN=ACOX3 PE=1 SV=2	287	VSPFKDVRQRFG
AQLPLEPSAPPP	sp|Q6IVU5|Z_JUNIN	83	sp|P31275|HXC12_HUMAN Homeobox protein Hox-C12 OS=Homo sapiens OX=9606 GN=HOXC12 PE=3 SV=2	123	ALLPLEPSGPPA
LHGRREIRVADI	sp|P14239|NCAP_JUNIN	464	sp|Q15811|ITSN1_HUMAN Intersectin-1 OS=Homo sapiens OX=9606 GN=ITSN1 PE=1 SV=3	1674	FLGRTEIRVADI
LMPMLEGHSQYS	sp|Q6XQI4|L_JUNIN	137	tr|A0A590UJT4|A0A590UJT4_HUMAN Steryl-sulfatase OS=Homo sapiens OX=9606 GN=STS PE=1 SV=2	421	LMPLLEGKSQRS
LMPMLEGHSQYS	sp|Q6XQI4|L_JUNIN	137	tr|A0A590UJY9|A0A590UJY9_HUMAN Steryl-sulfatase OS=Homo sapiens OX=9606 GN=STS PE=1 SV=2	375	LMPLLEGKSQRS
LMPMLEGHSQYS	sp|Q6XQI4|L_JUNIN	137	sp|P08842|STS_HUMAN Steryl-sulfatase OS=Homo sapiens OX=9606 GN=STS PE=1 SV=2	426	LMPLLEGKSQRS
LMPMLEGHSQYS	sp|Q6XQI4|L_JUNIN	137	tr|A0A590UJL0|A0A590UJL0_HUMAN Steryl-sulfatase OS=Homo sapiens OX=9606 GN=STS PE=1 SV=2	421	LMPLLEGKSQRS
LMPMLEGHSQYS	sp|Q6XQI4|L_JUNIN	137	sp|Q6ZVD7|STOX1_HUMAN Storkhead-box protein 1 OS=Homo sapiens OX=9606 GN=STOX1 PE=1 SV=2	748	LRQMLPGHSQYS
LMPMLEGHSQYS	sp|Q6XQI4|L_JUNIN	137	tr|A0A2R8Y5I4|A0A2R8Y5I4_HUMAN Storkhead-box protein 1 OS=Homo sapiens OX=9606 GN=STOX1 PE=1 SV=1	860	LRQMLPGHSQYS
GELGRLEKLDAL	sp|P14239|NCAP_JUNIN	92	sp|Q2I0M4|LRC26_HUMAN Leucine-rich repeat-containing protein 26 OS=Homo sapiens OX=9606 GN=LRRC26 PE=1 SV=2	185	GLLGRLPALDAL
EIRVADIKLSQE	sp|P14239|NCAP_JUNIN	469	sp|Q15811|ITSN1_HUMAN Intersectin-1 OS=Homo sapiens OX=9606 GN=ITSN1 PE=1 SV=3	1679	EIRVADIKKDQG
LVSLCQRIRGLK	sp|Q6XQI4|L_JUNIN	329	tr|A0A494C0T5|A0A494C0T5_HUMAN Pro-neuregulin-1, membrane-bound isoform (Fragment) OS=Homo sapiens OX=9606 GN=NRG1 PE=4 SV=1	4	LVSLCLCIAGLK
LVSLCQRIRGLK	sp|Q6XQI4|L_JUNIN	329	tr|H0YDC2|H0YDC2_HUMAN Pro-neuregulin-1, membrane-bound isoform OS=Homo sapiens OX=9606 GN=NRG1 PE=4 SV=2	85	LVSLCLCIAGLK
LVSLCQRIRGLK	sp|Q6XQI4|L_JUNIN	329	tr|A0A494C1B5|A0A494C1B5_HUMAN Pro-neuregulin-1, membrane-bound isoform OS=Homo sapiens OX=9606 GN=NRG1 PE=1 SV=1	85	LVSLCLCIAGLK
LVSLCQRIRGLK	sp|Q6XQI4|L_JUNIN	329	tr|A0A494C0L9|A0A494C0L9_HUMAN Pro-neuregulin-1, membrane-bound isoform OS=Homo sapiens OX=9606 GN=NRG1 PE=1 SV=1	85	LVSLCLCIAGLK
LVSLCQRIRGLK	sp|Q6XQI4|L_JUNIN	329	tr|A0A494C0Q4|A0A494C0Q4_HUMAN Pro-neuregulin-1, membrane-bound isoform OS=Homo sapiens OX=9606 GN=NRG1 PE=1 SV=1	85	LVSLCLCIAGLK
GVLEDSGSYWCE	sp|Q6XQI4|L_JUNIN	562	sp|Q96P31|FCRL3_HUMAN Fc receptor-like protein 3 OS=Homo sapiens OX=9606 GN=FCRL3 PE=1 SV=1	250	MWTEDSGSYWCE
KTDYQNISFSLL	sp|P26313|GLYC_JUNIN	67	sp|Q9NZM3|ITSN2_HUMAN Intersectin-2 OS=Homo sapiens OX=9606 GN=ITSN2 PE=1 SV=3	856	VTDYQNVSFSNL
KTDYQNISFSLL	sp|P26313|GLYC_JUNIN	67	tr|A0A087WVF7|A0A087WVF7_HUMAN Intersectin-2 OS=Homo sapiens OX=9606 GN=ITSN2 PE=1 SV=1	839	VTDYQNVSFSNL
LKSKTLTLDEKE	sp|Q6XQI4|L_JUNIN	931	tr|D6RGW0|D6RGW0_HUMAN Endoplasmic reticulum aminopeptidase 2 (Fragment) OS=Homo sapiens OX=9606 GN=ERAP2 PE=1 SV=1	605	LKSKTDTLDLPE
LKSKTLTLDEKE	sp|Q6XQI4|L_JUNIN	931	sp|Q6P179|ERAP2_HUMAN Endoplasmic reticulum aminopeptidase 2 OS=Homo sapiens OX=9606 GN=ERAP2 PE=1 SV=2	605	LKSKTDTLDLPE
ETMLSKLKLNFG	sp|Q6XQI4|L_JUNIN	2044	tr|H0YAL1|H0YAL1_HUMAN Centrosomal protein of 63 kDa (Fragment) OS=Homo sapiens OX=9606 GN=CEP63 PE=1 SV=1	166	FTMLSSLVLNFG
MKIRDELRVQSK	sp|Q6XQI4|L_JUNIN	1058	sp|Q9NZI5|GRHL1_HUMAN Grainyhead-like protein 1 homolog OS=Homo sapiens OX=9606 GN=GRHL1 PE=1 SV=2	427	RKIRDEERKQSK
MDNEYLMSEVIS	sp|P26313|GLYC_JUNIN	397	sp|Q8NA54|IQUB_HUMAN IQ and ubiquitin-like domain-containing protein OS=Homo sapiens OX=9606 GN=IQUB PE=1 SV=2	73	PDNEQLMEEVIS
MDNEYLMSEVIS	sp|P26313|GLYC_JUNIN	397	tr|A1A4Z1|A1A4Z1_HUMAN IQ and ubiquitin-like domain-containing protein OS=Homo sapiens OX=9606 GN=IQUB PE=1 SV=1	73	PDNEQLMEEVIS
KIRDELRVQSKE	sp|Q6XQI4|L_JUNIN	1059	sp|Q9NZI5|GRHL1_HUMAN Grainyhead-like protein 1 homolog OS=Homo sapiens OX=9606 GN=GRHL1 PE=1 SV=2	428	KIRDEERKQSKR
EDSGSYWCEPRK	sp|Q6XQI4|L_JUNIN	565	sp|Q96P31|FCRL3_HUMAN Fc receptor-like protein 3 OS=Homo sapiens OX=9606 GN=FCRL3 PE=1 SV=1	253	EDSGSYWCEVET
SLVSLCQRIRGL	sp|Q6XQI4|L_JUNIN	328	tr|Q7Z3Z5|Q7Z3Z5_HUMAN Mediator of RNA polymerase II transcription subunit 12 OS=Homo sapiens OX=9606 GN=MED12 PE=1 SV=1	323	SLDSLCNRIFGL
SLVSLCQRIRGL	sp|Q6XQI4|L_JUNIN	328	sp|Q93074|MED12_HUMAN Mediator of RNA polymerase II transcription subunit 12 OS=Homo sapiens OX=9606 GN=MED12 PE=1 SV=4	476	SLDSLCNRIFGL
VDSSKLKSKTLT	sp|Q6XQI4|L_JUNIN	926	sp|Q9UJL9|ZF69B_HUMAN Zinc finger protein 69 homolog B OS=Homo sapiens OX=9606 GN=ZFP69B PE=1 SV=2	142	VPSSDLKSKTKT
HGRREIRVADIK	sp|P14239|NCAP_JUNIN	465	sp|Q15811|ITSN1_HUMAN Intersectin-1 OS=Homo sapiens OX=9606 GN=ITSN1 PE=1 SV=3	1675	LGRTEIRVADIK
SQLNDTLDTICE	sp|Q6XQI4|L_JUNIN	1412	tr|J3KT08|J3KT08_HUMAN GOLD domain-containing protein (Fragment) OS=Homo sapiens OX=9606 PE=3 SV=1	146	KQLNDTLDAIEE
LSSLRSSFSNRA	sp|Q6XQI4|L_JUNIN	497	sp|Q8IYT1|FA71A_HUMAN Protein FAM71A OS=Homo sapiens OX=9606 GN=FAM71A PE=1 SV=2	457	KSSSRSSFSHRA
DSVSEDQLRLYE	sp|Q6XQI4|L_JUNIN	894	tr|A0A0A6YYL4|A0A0A6YYL4_HUMAN Coronin OS=Homo sapiens OX=9606 GN=CORO7-PAM16 PE=1 SV=1	702	DSQSERQLLLYE
DSVSEDQLRLYE	sp|Q6XQI4|L_JUNIN	894	sp|P57737|CORO7_HUMAN Coronin-7 OS=Homo sapiens OX=9606 GN=CORO7 PE=1 SV=2	702	DSQSERQLLLYE
SVLSEALSAGSH	sp|Q6XQI4|L_JUNIN	265	sp|Q8NGA4|G32P1_HUMAN Putative G-protein coupled receptor GPR32P1 OS=Homo sapiens OX=9606 GN=GPR32P1 PE=5 SV=2	259	LVLVSALSAGSH
SHVDSSKLKSKT	sp|Q6XQI4|L_JUNIN	924	sp|Q9UJL9|ZF69B_HUMAN Zinc finger protein 69 homolog B OS=Homo sapiens OX=9606 GN=ZFP69B PE=1 SV=2	140	SGVPSSDLKSKT
SELLKLGMSLMP	sp|Q6XQI4|L_JUNIN	128	sp|Q9P2G1|AKIB1_HUMAN Ankyrin repeat and IBR domain-containing protein 1 OS=Homo sapiens OX=9606 GN=ANKIB1 PE=1 SV=3	913	SELLELGDSLMR
GHLCALRLSPTN	sp|P26313|GLYC_JUNIN	210	sp|Q8IZY2|ABCA7_HUMAN Phospholipid-transporting ATPase ABCA7 OS=Homo sapiens OX=9606 GN=ABCA7 PE=1 SV=3	1264	GHYPALRLSPTM
GHLCALRLSPTN	sp|P26313|GLYC_JUNIN	210	tr|A0A6E1ZGS3|A0A6E1ZGS3_HUMAN Phospholipid-transporting ATPase ABCA7 (Fragment) OS=Homo sapiens OX=9606 GN=ABCA7 PE=1 SV=1	421	GHYPALRLSPTM
GSEALLNKLVLE	sp|Q6XQI4|L_JUNIN	661	tr|E7EQD9|E7EQD9_HUMAN Unconventional myosin-Ib (Fragment) OS=Homo sapiens OX=9606 GN=MYO1B PE=1 SV=1	215	ASEELLNKLKLE
GSEALLNKLVLE	sp|Q6XQI4|L_JUNIN	661	tr|E9PDF6|E9PDF6_HUMAN Unconventional myosin-Ib OS=Homo sapiens OX=9606 GN=MYO1B PE=1 SV=1	215	ASEELLNKLKLE
GSEALLNKLVLE	sp|Q6XQI4|L_JUNIN	661	sp|O43795|MYO1B_HUMAN Unconventional myosin-Ib OS=Homo sapiens OX=9606 GN=MYO1B PE=1 SV=3	215	ASEELLNKLKLE
SSLRSSFSNRAL	sp|Q6XQI4|L_JUNIN	498	sp|Q8IYT1|FA71A_HUMAN Protein FAM71A OS=Homo sapiens OX=9606 GN=FAM71A PE=1 SV=2	458	SSSRSSFSHRAN
RREIRVADIKLS	sp|P14239|NCAP_JUNIN	467	sp|Q15811|ITSN1_HUMAN Intersectin-1 OS=Homo sapiens OX=9606 GN=ITSN1 PE=1 SV=3	1677	RTEIRVADIKKD
VLECAVYTTVVD	sp|P14239|NCAP_JUNIN	527	tr|A0A590UJI7|A0A590UJI7_HUMAN Breast cancer type 2 susceptibility protein (Fragment) OS=Homo sapiens OX=9606 GN=BRCA2 PE=1 SV=1	167	VLEDEVYETVVD
VLECAVYTTVVD	sp|P14239|NCAP_JUNIN	527	sp|P51587|BRCA2_HUMAN Breast cancer type 2 susceptibility protein OS=Homo sapiens OX=9606 GN=BRCA2 PE=1 SV=3	290	VLEDEVYETVVD
LGIMVGSVLIIV	sp|Q6XQI4|L_JUNIN	377	tr|A0A140T9T2|A0A140T9T2_HUMAN HLA class II histocompatibility antigen, DM alpha chain (Fragment) OS=Homo sapiens OX=9606 GN=HLA-DMA PE=1 SV=1	223	LGIIVGIVLIIY
LGIMVGSVLIIV	sp|Q6XQI4|L_JUNIN	377	tr|A0A140T9N7|A0A140T9N7_HUMAN HLA class II histocompatibility antigen, DM alpha chain (Fragment) OS=Homo sapiens OX=9606 GN=HLA-DMA PE=1 SV=1	272	LGIIVGIVLIIY
LGIMVGSVLIIV	sp|Q6XQI4|L_JUNIN	377	tr|A0A140T9K8|A0A140T9K8_HUMAN HLA class II histocompatibility antigen, DM alpha chain (Fragment) OS=Homo sapiens OX=9606 GN=HLA-DMA PE=1 SV=1	272	LGIIVGIVLIIY
LGIMVGSVLIIV	sp|Q6XQI4|L_JUNIN	377	tr|A0A140T9N9|A0A140T9N9_HUMAN HLA class II histocompatibility antigen, DM alpha chain (Fragment) OS=Homo sapiens OX=9606 GN=HLA-DMA PE=1 SV=1	272	LGIIVGIVLIIY
LGIMVGSVLIIV	sp|Q6XQI4|L_JUNIN	377	tr|A0A140T9T3|A0A140T9T3_HUMAN HLA class II histocompatibility antigen, DM alpha chain (Fragment) OS=Homo sapiens OX=9606 GN=HLA-DMA PE=1 SV=1	272	LGIIVGIVLIIY
LGIMVGSVLIIV	sp|Q6XQI4|L_JUNIN	377	tr|A0A140T9X4|A0A140T9X4_HUMAN HLA class II histocompatibility antigen, DM alpha chain (Fragment) OS=Homo sapiens OX=9606 GN=HLA-DMA PE=1 SV=1	272	LGIIVGIVLIIY
LGIMVGSVLIIV	sp|Q6XQI4|L_JUNIN	377	tr|H0Y732|H0Y732_HUMAN HLA class II histocompatibility antigen, DM alpha chain (Fragment) OS=Homo sapiens OX=9606 GN=HLA-DMA PE=1 SV=1	272	LGIIVGIVLIIY
LGIMVGSVLIIV	sp|Q6XQI4|L_JUNIN	377	tr|A0A140T9V7|A0A140T9V7_HUMAN HLA class II histocompatibility antigen, DM alpha chain (Fragment) OS=Homo sapiens OX=9606 GN=HLA-DMA PE=1 SV=1	272	LGIIVGIVLIIY
LGIMVGSVLIIV	sp|Q6XQI4|L_JUNIN	377	tr|A0A140T9C4|A0A140T9C4_HUMAN HLA class II histocompatibility antigen, DM alpha chain OS=Homo sapiens OX=9606 GN=HLA-DMA PE=1 SV=1	147	LGIIVGIVLIIY
LGIMVGSVLIIV	sp|Q6XQI4|L_JUNIN	377	tr|Q5SP00|Q5SP00_HUMAN HLA class II histocompatibility antigen, DM alpha chain OS=Homo sapiens OX=9606 GN=HLA-DMA PE=1 SV=2	208	LGIIVGIVLIIY
LGIMVGSVLIIV	sp|Q6XQI4|L_JUNIN	377	sp|P28067|DMA_HUMAN HLA class II histocompatibility antigen, DM alpha chain OS=Homo sapiens OX=9606 GN=HLA-DMA PE=1 SV=1	242	LGIIVGIVLIIY
LGIMVGSVLIIV	sp|Q6XQI4|L_JUNIN	377	tr|A0A140T9G2|A0A140T9G2_HUMAN HLA class II histocompatibility antigen, DM alpha chain OS=Homo sapiens OX=9606 GN=HLA-DMA PE=1 SV=1	208	LGIIVGIVLIIY
