query	query_seqname	query_start	target_seqname	target_start	target
LLIIGTQDGIMK	sp|P17763|POLG_DEN1W	530	tr|F8W0U9|F8W0U9_HUMAN NACHT domain- and WD repeat-containing protein 1 OS=Homo sapiens OX=9606 GN=NWD1 PE=1 SV=1	882	LLVIGTQDGIMA
LLIIGTQDGIMK	sp|P17763|POLG_DEN1W	530	sp|Q149M9|NWD1_HUMAN NACHT domain- and WD repeat-containing protein 1 OS=Homo sapiens OX=9606 GN=NWD1 PE=1 SV=3	882	LLVIGTQDGIMA
IGESTPQPTAED	sp|P17763|POLG_DEN1W	2640	tr|H0Y9L4|H0Y9L4_HUMAN Histone-lysine N-methyltransferase NSD2 (Fragment) OS=Homo sapiens OX=9606 GN=NSD2 PE=1 SV=1	12	IGKSTPQKTAEA
IGESTPQPTAED	sp|P17763|POLG_DEN1W	2640	sp|O96028|NSD2_HUMAN Histone-lysine N-methyltransferase NSD2 OS=Homo sapiens OX=9606 GN=NSD2 PE=1 SV=1	418	IGKSTPQKTAEA
GNKRIVIEPDLL	sp|P17763|POLG_DEN1W	2753	sp|Q9C0G6|DYH6_HUMAN Dynein heavy chain 6, axonemal OS=Homo sapiens OX=9606 GN=DNAH6 PE=2 SV=3	2155	GNKRIVIFVDDL
DVVVSYRNAKVK	sp|P17763|POLG_DEN1W	515	sp|O15054|KDM6B_HUMAN Lysine-specific demethylase 6B OS=Homo sapiens OX=9606 GN=KDM6B PE=1 SV=4	1141	DVVRASRNAKVK
RMPNRISTKLTT	sp|P17763|POLG_DEN1W	2106	sp|P56975|NRG3_HUMAN Pro-neuregulin-3, membrane-bound isoform OS=Homo sapiens OX=9606 GN=NRG3 PE=1 SV=1	149	RTPNRISTRLTT
PAPIVSFGWTAA	sp|P17763|POLG_DEN1W	2606	tr|H9KVB3|H9KVB3_HUMAN Otogelin OS=Homo sapiens OX=9606 GN=OTOG PE=1 SV=2	1274	PADIVSFLLTAA
PAPIVSFGWTAA	sp|P17763|POLG_DEN1W	2606	sp|Q6ZRI0|OTOG_HUMAN Otogelin OS=Homo sapiens OX=9606 GN=OTOG PE=2 SV=3	1286	PADIVSFLLTAA
KKNVLAVPKAGA	sp|P17763|POLG_DEN1W	204	sp|P29536|LMOD1_HUMAN Leiomodin-1 OS=Homo sapiens OX=9606 GN=LMOD1 PE=1 SV=3	492	KKDLLEVPKAGA
TRRDSRGSGQAG	sp|P17763|POLG_DEN1W	3086	tr|D6REQ2|D6REQ2_HUMAN Protein FAM193B OS=Homo sapiens OX=9606 GN=FAM193B PE=4 SV=2	2	TRRRSRPSGGAG
TRRDSRGSGQAG	sp|P17763|POLG_DEN1W	3086	sp|Q96PV7|F193B_HUMAN Protein FAM193B OS=Homo sapiens OX=9606 GN=FAM193B PE=1 SV=3	2	TRRRSRPSGGAG
GKPTFQVLKRLK	sp|P17763|POLG_DEN1W	9	tr|A0A2R8Y461|A0A2R8Y461_HUMAN Putative Polycomb group protein ASXL3 (Fragment) OS=Homo sapiens OX=9606 GN=ASXL3 PE=1 SV=1	167	GKQTSQHLKRLK
GKPTFQVLKRLK	sp|P17763|POLG_DEN1W	9	sp|Q9C0F0|ASXL3_HUMAN Putative Polycomb group protein ASXL3 OS=Homo sapiens OX=9606 GN=ASXL3 PE=2 SV=3	223	GKQTSQHLKRLK
GKPTFQVLKRLK	sp|P17763|POLG_DEN1W	9	tr|K7EJ76|K7EJ76_HUMAN Putative Polycomb group protein ASXL3 OS=Homo sapiens OX=9606 GN=ASXL3 PE=1 SV=1	224	GKQTSQHLKRLK
VAITEILDLLKG	sp|P17763|POLG_DEN1W	1702	sp|Q8WTP8|AEN_HUMAN Apoptosis-enhancing nuclease OS=Homo sapiens OX=9606 GN=AEN PE=1 SV=2	176	VAQKEILKLLKG
VAITEILDLLKG	sp|P17763|POLG_DEN1W	1702	sp|Q96AZ6|ISG20_HUMAN Interferon-stimulated gene 20 kDa protein OS=Homo sapiens OX=9606 GN=ISG20 PE=1 SV=2	72	VARLEILQLLKG
SSGSSSLWIGRL	sp|P17763|POLG_DEN1W	552	tr|H3BP82|H3BP82_HUMAN RNA-binding protein with serine-rich domain 1 (Fragment) OS=Homo sapiens OX=9606 GN=RNPS1 PE=1 SV=1	69	SSGSSSLGPARL
EKKNVLAVPKAG	sp|P17763|POLG_DEN1W	203	sp|P29536|LMOD1_HUMAN Leiomodin-1 OS=Homo sapiens OX=9606 GN=LMOD1 PE=1 SV=3	491	EKKDLLEVPKAG
FKAEKLIDPKRC	sp|P17763|POLG_DEN1W	1893	sp|P36952|SPB5_HUMAN Serpin B5 OS=Homo sapiens OX=9606 GN=SERPINB5 PE=1 SV=2	276	FKVEKMIDPKAC
MALTLLLSELGA	sp|P17763|POLG_DEN1W	2238	sp|P05060|SCG1_HUMAN Secretogranin-1 OS=Homo sapiens OX=9606 GN=CHGB PE=1 SV=2	1	MQPTLLLSLLGA
ELLIIGTQDGIM	sp|P17763|POLG_DEN1W	529	tr|F8W0U9|F8W0U9_HUMAN NACHT domain- and WD repeat-containing protein 1 OS=Homo sapiens OX=9606 GN=NWD1 PE=1 SV=1	881	KLLVIGTQDGIM
ELLIIGTQDGIM	sp|P17763|POLG_DEN1W	529	sp|Q149M9|NWD1_HUMAN NACHT domain- and WD repeat-containing protein 1 OS=Homo sapiens OX=9606 GN=NWD1 PE=1 SV=3	881	KLLVIGTQDGIM
GRMPNRISTKLT	sp|P17763|POLG_DEN1W	2105	sp|P56975|NRG3_HUMAN Pro-neuregulin-3, membrane-bound isoform OS=Homo sapiens OX=9606 GN=NRG3 PE=1 SV=1	148	SRTPNRISTRLT
QKSLGTEQSERG	sp|P17763|POLG_DEN1W	428	sp|Q9UGU0|TCF20_HUMAN Transcription factor 20 OS=Homo sapiens OX=9606 GN=TCF20 PE=1 SV=3	1949	KGSLSTEQSERG
QKSLGTEQSERG	sp|P17763|POLG_DEN1W	428	tr|A9JX13|A9JX13_HUMAN Transcription factor 20 OS=Homo sapiens OX=9606 GN=TCF20 PE=1 SV=1	239	KGSLSTEQSERG
EIGESTPQPTAE	sp|P17763|POLG_DEN1W	2639	tr|H0Y9L4|H0Y9L4_HUMAN Histone-lysine N-methyltransferase NSD2 (Fragment) OS=Homo sapiens OX=9606 GN=NSD2 PE=1 SV=1	11	DIGKSTPQKTAE
EIGESTPQPTAE	sp|P17763|POLG_DEN1W	2639	sp|O96028|NSD2_HUMAN Histone-lysine N-methyltransferase NSD2 OS=Homo sapiens OX=9606 GN=NSD2 PE=1 SV=1	417	DIGKSTPQKTAE
PNRISTKLTTMA	sp|P17763|POLG_DEN1W	2108	sp|P56975|NRG3_HUMAN Pro-neuregulin-3, membrane-bound isoform OS=Homo sapiens OX=9606 GN=NRG3 PE=1 SV=1	151	PNRISTRLTTIT
MTRRDSRGSGQA	sp|P17763|POLG_DEN1W	3085	tr|D6REQ2|D6REQ2_HUMAN Protein FAM193B OS=Homo sapiens OX=9606 GN=FAM193B PE=4 SV=2	1	MTRRRSRPSGGA
MTRRDSRGSGQA	sp|P17763|POLG_DEN1W	3085	sp|Q96PV7|F193B_HUMAN Protein FAM193B OS=Homo sapiens OX=9606 GN=FAM193B PE=1 SV=3	1	MTRRRSRPSGGA
GPLQTLWEGSPG	sp|P17763|POLG_DEN1W	2444	sp|O94972|TRI37_HUMAN E3 ubiquitin-protein ligase TRIM37 OS=Homo sapiens OX=9606 GN=TRIM37 PE=1 SV=2	788	GDCQTLSEGSPG
KPVEDKYATAVT	sp|P17763|POLG_DEN1W	3160	tr|M0QX98|M0QX98_HUMAN Carcinoembryonic antigen-related cell adhesion molecule 5 (Fragment) OS=Homo sapiens OX=9606 GN=CEACAM5 PE=1 SV=1	122	KPVEDKDAVAFT
KPVEDKYATAVT	sp|P17763|POLG_DEN1W	3160	tr|A0A024R0K5|A0A024R0K5_HUMAN Carcinoembryonic antigen-related cell adhesion molecule 5 OS=Homo sapiens OX=9606 GN=CEACAM5 PE=1 SV=1	511	KPVEDKDAVAFT
KPVEDKYATAVT	sp|P17763|POLG_DEN1W	3160	sp|P06731|CEAM5_HUMAN Carcinoembryonic antigen-related cell adhesion molecule 5 OS=Homo sapiens OX=9606 GN=CEACAM5 PE=1 SV=3	511	KPVEDKDAVAFT
KPVEDKYATAVT	sp|P17763|POLG_DEN1W	3160	tr|A0A087WYX0|A0A087WYX0_HUMAN Carcinoembryonic antigen-related cell adhesion molecule 5 OS=Homo sapiens OX=9606 GN=CEACAM5 PE=1 SV=1	333	KPVEDKDAVAFT
KPVEDKYATAVT	sp|P17763|POLG_DEN1W	3160	tr|T2HUW8|T2HUW8_HUMAN Carcinoembryonic antigen-related cell adhesion molecule 5 OS=Homo sapiens OX=9606 GN=CEACAM5 PE=1 SV=1	155	KPVEDKDAVAFT
KPVEDKYATAVT	sp|P17763|POLG_DEN1W	3160	tr|M0R3J1|M0R3J1_HUMAN Carcinoembryonic antigen-related cell adhesion molecule 5 (Fragment) OS=Homo sapiens OX=9606 GN=CEACAM5 PE=1 SV=1	56	KPVEDKDAVAFT
KPVEDKYATAVT	sp|P17763|POLG_DEN1W	3160	tr|A0A024R0K5|A0A024R0K5_HUMAN Carcinoembryonic antigen-related cell adhesion molecule 5 OS=Homo sapiens OX=9606 GN=CEACAM5 PE=1 SV=1	155	KPVEDKDAVAFT
KPVEDKYATAVT	sp|P17763|POLG_DEN1W	3160	sp|P06731|CEAM5_HUMAN Carcinoembryonic antigen-related cell adhesion molecule 5 OS=Homo sapiens OX=9606 GN=CEACAM5 PE=1 SV=3	155	KPVEDKDAVAFT
KSVISGATEVSS	sp|P17763|POLG_DEN1W	541	sp|O60658|PDE8A_HUMAN High affinity cAMP-specific and IBMX-insensitive 3',5'-cyclic phosphodiesterase 8A OS=Homo sapiens OX=9606 GN=PDE8A PE=1 SV=2	363	KAVASRATEVSS
LVTEWTNKTVWA	sp|P17763|POLG_DEN1W	1263	tr|H0Y7J9|H0Y7J9_HUMAN Serine/threonine-protein kinase WNK2 (Fragment) OS=Homo sapiens OX=9606 GN=WNK2 PE=1 SV=1	602	LVDEWTSKTVGA
LVTEWTNKTVWA	sp|P17763|POLG_DEN1W	1263	sp|Q9Y3S1|WNK2_HUMAN Serine/threonine-protein kinase WNK2 OS=Homo sapiens OX=9606 GN=WNK2 PE=1 SV=4	2165	LVDEWTSKTVGA
LVTEWTNKTVWA	sp|P17763|POLG_DEN1W	1263	tr|F8W9F9|F8W9F9_HUMAN Non-specific serine/threonine protein kinase OS=Homo sapiens OX=9606 GN=WNK2 PE=1 SV=1	2128	LVDEWTSKTVGA
LVTEWTNKTVWA	sp|P17763|POLG_DEN1W	1263	tr|H0Y493|H0Y493_HUMAN Serine/threonine-protein kinase WNK2 (Fragment) OS=Homo sapiens OX=9606 GN=WNK2 PE=1 SV=1	925	LVDEWTSKTVGA
LVTEWTNKTVWA	sp|P17763|POLG_DEN1W	1263	tr|H0Y7T5|H0Y7T5_HUMAN Non-specific serine/threonine protein kinase (Fragment) OS=Homo sapiens OX=9606 GN=WNK2 PE=1 SV=1	2124	LVDEWTSKTVGA
LVTEWTNKTVWA	sp|P17763|POLG_DEN1W	1263	tr|H0Y7R3|H0Y7R3_HUMAN Non-specific serine/threonine protein kinase (Fragment) OS=Homo sapiens OX=9606 GN=WNK2 PE=1 SV=1	1620	LVDEWTSKTVGA
ELGRAKKDAPQF	sp|P17763|POLG_DEN1W	3175	sp|P30041|PRDX6_HUMAN Peroxiredoxin-6 OS=Homo sapiens OX=9606 GN=PRDX6 PE=1 SV=3	50	ELGRAAKLAPEF
EESLEAEVYTKE	sp|P17763|POLG_DEN1W	2050	sp|Q96M86|DNHD1_HUMAN Dynein heavy chain domain-containing protein 1 OS=Homo sapiens OX=9606 GN=DNHD1 PE=2 SV=2	3609	EESNEAEDQTKE
SLVIGKMWEDGA	sp|P17763|POLG_DEN1W	818	sp|Q8NDG6|TDRD9_HUMAN ATP-dependent RNA helicase TDRD9 OS=Homo sapiens OX=9606 GN=TDRD9 PE=2 SV=3	1022	SLVCGKHWSDGA
SLVIGKMWEDGA	sp|P17763|POLG_DEN1W	818	tr|A0A0C4DFS5|A0A0C4DFS5_HUMAN ATP-dependent RNA helicase TDRD9 OS=Homo sapiens OX=9606 GN=TDRD9 PE=1 SV=1	737	SLVCGKHWSDGA
SLVIGKMWEDGA	sp|P17763|POLG_DEN1W	818	tr|H0YJJ2|H0YJJ2_HUMAN ATP-dependent RNA helicase TDRD9 (Fragment) OS=Homo sapiens OX=9606 GN=TDRD9 PE=1 SV=1	749	SLVCGKHWSDGA
ELPAMGPVIAGG	sp|P17763|POLG_DEN1W	1370	sp|A8MVZ5|BTNLA_HUMAN Butyrophilin-like protein 10 OS=Homo sapiens OX=9606 GN=BTNL10 PE=5 SV=2	259	ILVAMGLVIAGG
SELLIIGTQDGI	sp|P17763|POLG_DEN1W	528	tr|F8W0U9|F8W0U9_HUMAN NACHT domain- and WD repeat-containing protein 1 OS=Homo sapiens OX=9606 GN=NWD1 PE=1 SV=1	880	EKLLVIGTQDGI
SELLIIGTQDGI	sp|P17763|POLG_DEN1W	528	sp|Q149M9|NWD1_HUMAN NACHT domain- and WD repeat-containing protein 1 OS=Homo sapiens OX=9606 GN=NWD1 PE=1 SV=3	880	EKLLVIGTQDGI
PQKVAITEILDL	sp|P17763|POLG_DEN1W	1699	sp|Q14542|S29A2_HUMAN Equilibrative nucleoside transporter 2 OS=Homo sapiens OX=9606 GN=SLC29A2 PE=1 SV=3	253	PQKVALTLDLDL
EGPDKLAALGPA	sp|P17763|POLG_DEN1W	1912	sp|Q6W3E5|GDPD4_HUMAN Glycerophosphodiester phosphodiesterase domain-containing protein 4 OS=Homo sapiens OX=9606 GN=GDPD4 PE=2 SV=1	527	EGPWTLAALYPA
SSSGSSSLWIGR	sp|P17763|POLG_DEN1W	551	tr|J3KS37|J3KS37_HUMAN ATP-dependent DNA helicase Q5 (Fragment) OS=Homo sapiens OX=9606 GN=RECQL5 PE=1 SV=1	74	SSSGGSSLAKGR
SSSGSSSLWIGR	sp|P17763|POLG_DEN1W	551	sp|O94762|RECQ5_HUMAN ATP-dependent DNA helicase Q5 OS=Homo sapiens OX=9606 GN=RECQL5 PE=1 SV=2	734	SSSGGSSLAKGR
GATEVSSSGSSS	sp|P17763|POLG_DEN1W	546	sp|Q86WI1|PKHL1_HUMAN Fibrocystin-L OS=Homo sapiens OX=9606 GN=PKHD1L1 PE=2 SV=2	4185	LAESVSSSGSSS
GATEVSSSGSSS	sp|P17763|POLG_DEN1W	546	tr|H0YF65|H0YF65_HUMAN Fibrocystin-L (Fragment) OS=Homo sapiens OX=9606 GN=PKHD1L1 PE=1 SV=1	1113	LAESVSSSGSSS
LPAMGPVIAGGL	sp|P17763|POLG_DEN1W	1371	sp|A8MVZ5|BTNLA_HUMAN Butyrophilin-like protein 10 OS=Homo sapiens OX=9606 GN=BTNL10 PE=5 SV=2	260	LVAMGLVIAGGI
QGRAVSLSPLLQ	sp|P17763|POLG_DEN1W	628	tr|K7EKA8|K7EKA8_HUMAN Disintegrin and metalloproteinase domain-containing protein 11 (Fragment) OS=Homo sapiens OX=9606 GN=ADAM11 PE=1 SV=1	491	QGRAVWLPPLCQ
ATEVSSSGSSSL	sp|P17763|POLG_DEN1W	547	sp|Q86WI1|PKHL1_HUMAN Fibrocystin-L OS=Homo sapiens OX=9606 GN=PKHD1L1 PE=2 SV=2	4186	AESVSSSGSSSS
ATEVSSSGSSSL	sp|P17763|POLG_DEN1W	547	tr|H0YF65|H0YF65_HUMAN Fibrocystin-L (Fragment) OS=Homo sapiens OX=9606 GN=PKHD1L1 PE=1 SV=1	1114	AESVSSSGSSSS
LIIGTQDGIMKS	sp|P17763|POLG_DEN1W	531	tr|F8W0U9|F8W0U9_HUMAN NACHT domain- and WD repeat-containing protein 1 OS=Homo sapiens OX=9606 GN=NWD1 PE=1 SV=1	883	LVIGTQDGIMAV
LIIGTQDGIMKS	sp|P17763|POLG_DEN1W	531	sp|Q149M9|NWD1_HUMAN NACHT domain- and WD repeat-containing protein 1 OS=Homo sapiens OX=9606 GN=NWD1 PE=1 SV=3	883	LVIGTQDGIMAV
LLSELGAMESQK	sp|P17763|POLG_DEN1W	2243	tr|H0YGR0|H0YGR0_HUMAN KICSTOR complex protein ITFG2 (Fragment) OS=Homo sapiens OX=9606 GN=ITFG2 PE=1 SV=1	28	LLQELGVGESQK
NKRIVIEPDLLN	sp|P17763|POLG_DEN1W	2754	sp|Q9C0G6|DYH6_HUMAN Dynein heavy chain 6, axonemal OS=Homo sapiens OX=9606 GN=DNAH6 PE=2 SV=3	2156	NKRIVIFVDDLN
VIMGILVLRLVT	sp|P17763|POLG_DEN1W	1254	sp|P34995|PE2R1_HUMAN Prostaglandin E2 receptor EP1 subtype OS=Homo sapiens OX=9606 GN=PTGER1 PE=2 SV=3	89	VIPGALVLRLYT
VGIGEKLMRATF	sp|P17763|POLG_DEN1W	660	sp|Q9UBP0|SPAST_HUMAN Spastin OS=Homo sapiens OX=9606 GN=SPAST PE=1 SV=1	416	VGEGEKLVRALF
VGIGEKLMRATF	sp|P17763|POLG_DEN1W	660	tr|A0A2U3TZR0|A0A2U3TZR0_HUMAN Spastin OS=Homo sapiens OX=9606 GN=SPAST PE=1 SV=1	415	VGEGEKLVRALF
VGIGEKLMRATF	sp|P17763|POLG_DEN1W	660	tr|A0A2R8Y4I8|A0A2R8Y4I8_HUMAN Spastin OS=Homo sapiens OX=9606 GN=SPAST PE=1 SV=1	383	VGEGEKLVRALF
VGIGEKLMRATF	sp|P17763|POLG_DEN1W	660	tr|A0A2R8Y481|A0A2R8Y481_HUMAN Spastin (Fragment) OS=Homo sapiens OX=9606 GN=SPAST PE=1 SV=1	250	VGEGEKLVRALF
VGIGEKLMRATF	sp|P17763|POLG_DEN1W	660	tr|A0A2R8YGN6|A0A2R8YGN6_HUMAN Spastin (Fragment) OS=Homo sapiens OX=9606 GN=SPAST PE=1 SV=1	329	VGEGEKLVRALF
VGIGEKLMRATF	sp|P17763|POLG_DEN1W	660	tr|A0A2R8YCL5|A0A2R8YCL5_HUMAN Spastin (Fragment) OS=Homo sapiens OX=9606 GN=SPAST PE=1 SV=1	375	VGEGEKLVRALF
VGIGEKLMRATF	sp|P17763|POLG_DEN1W	660	tr|A0A2R8YFW8|A0A2R8YFW8_HUMAN Spastin (Fragment) OS=Homo sapiens OX=9606 GN=SPAST PE=1 SV=1	341	VGEGEKLVRALF
VGIGEKLMRATF	sp|P17763|POLG_DEN1W	660	tr|A0A2R8Y5N9|A0A2R8Y5N9_HUMAN Spastin (Fragment) OS=Homo sapiens OX=9606 GN=SPAST PE=1 SV=1	233	VGEGEKLVRALF
VGIGEKLMRATF	sp|P17763|POLG_DEN1W	660	tr|A0A2R8YEA0|A0A2R8YEA0_HUMAN Spastin (Fragment) OS=Homo sapiens OX=9606 GN=SPAST PE=1 SV=1	136	VGEGEKLVRALF
LGLGLAISFLGA	sp|P17763|POLG_DEN1W	737	tr|F8WDW5|F8WDW5_HUMAN Prominin-2 OS=Homo sapiens OX=9606 GN=PROM2 PE=1 SV=1	14	LGLGLALSQLAA
LGLGLAISFLGA	sp|P17763|POLG_DEN1W	737	sp|Q8N271|PROM2_HUMAN Prominin-2 OS=Homo sapiens OX=9606 GN=PROM2 PE=1 SV=1	14	LGLGLALSQLAA
SFLGANSKTSTL	sp|P17763|POLG_DEN1W	744	tr|H0YLY0|H0YLY0_HUMAN Non-specific serine/threonine protein kinase (Fragment) OS=Homo sapiens OX=9606 GN=CDC42BPB PE=1 SV=8	429	SLLGAPSKTSSL
SFLGANSKTSTL	sp|P17763|POLG_DEN1W	744	sp|Q9Y5S2|MRCKB_HUMAN Serine/threonine-protein kinase MRCK beta OS=Homo sapiens OX=9606 GN=CDC42BPB PE=1 SV=2	1181	SLLGAPSKTSSL
MPNRISTKLTTM	sp|P17763|POLG_DEN1W	2107	sp|P56975|NRG3_HUMAN Pro-neuregulin-3, membrane-bound isoform OS=Homo sapiens OX=9606 GN=NRG3 PE=1 SV=1	150	TPNRISTRLTTI
