query	query_seqname	query_start	target_seqname	target_start	target
SNCYLTTLALLV	tr|Q6UZF1|Q6UZF1_SARS	1649	sp|Q9BZD2|S29A3_HUMAN Equilibrative nucleoside transporter 3 OS=Homo sapiens OX=9606 GN=SLC29A3 PE=1 SV=3	425	SNGYLSTLALLY
SNCYLTTLALLV	tr|Q6UZF1|Q6UZF1_SARS	1649	tr|A0A2R8YDR8|A0A2R8YDR8_HUMAN Equilibrative nucleoside transporter 3 OS=Homo sapiens OX=9606 GN=SLC29A3 PE=1 SV=1	347	SNGYLSTLALLY
SLNKRWYKLVSE	tr|Q6UZF1|Q6UZF1_SARS	5016	tr|A0A669KB61|A0A669KB61_HUMAN Nesprin-2 (Fragment) OS=Homo sapiens OX=9606 GN=SYNE2 PE=1 SV=1	653	RLNKRWRKLVSK
SLNKRWYKLVSE	tr|Q6UZF1|Q6UZF1_SARS	5016	sp|Q8WXH0|SYNE2_HUMAN Nesprin-2 OS=Homo sapiens OX=9606 GN=SYNE2 PE=1 SV=3	653	RLNKRWRKLVSK
SLNKRWYKLVSE	tr|Q6UZF1|Q6UZF1_SARS	5016	tr|A0A0A0MRE3|A0A0A0MRE3_HUMAN Nesprin-2 OS=Homo sapiens OX=9606 GN=SYNE2 PE=1 SV=1	653	RLNKRWRKLVSK
SLNKRWYKLVSE	tr|Q6UZF1|Q6UZF1_SARS	5016	tr|G3V5X4|G3V5X4_HUMAN Nesprin-2 OS=Homo sapiens OX=9606 GN=SYNE2 PE=1 SV=1	653	RLNKRWRKLVSK
SLNKRWYKLVSE	tr|Q6UZF1|Q6UZF1_SARS	5016	tr|A0A669KBG2|A0A669KBG2_HUMAN Nesprin-2 OS=Homo sapiens OX=9606 GN=SYNE2 PE=1 SV=1	653	RLNKRWRKLVSK
LNKRWYKLVSEC	tr|Q6UZF1|Q6UZF1_SARS	5017	tr|A0A669KB61|A0A669KB61_HUMAN Nesprin-2 (Fragment) OS=Homo sapiens OX=9606 GN=SYNE2 PE=1 SV=1	654	LNKRWRKLVSKT
LNKRWYKLVSEC	tr|Q6UZF1|Q6UZF1_SARS	5017	sp|Q8WXH0|SYNE2_HUMAN Nesprin-2 OS=Homo sapiens OX=9606 GN=SYNE2 PE=1 SV=3	654	LNKRWRKLVSKT
LNKRWYKLVSEC	tr|Q6UZF1|Q6UZF1_SARS	5017	tr|A0A0A0MRE3|A0A0A0MRE3_HUMAN Nesprin-2 OS=Homo sapiens OX=9606 GN=SYNE2 PE=1 SV=1	654	LNKRWRKLVSKT
LNKRWYKLVSEC	tr|Q6UZF1|Q6UZF1_SARS	5017	tr|G3V5X4|G3V5X4_HUMAN Nesprin-2 OS=Homo sapiens OX=9606 GN=SYNE2 PE=1 SV=1	654	LNKRWRKLVSKT
LNKRWYKLVSEC	tr|Q6UZF1|Q6UZF1_SARS	5017	tr|A0A669KBG2|A0A669KBG2_HUMAN Nesprin-2 OS=Homo sapiens OX=9606 GN=SYNE2 PE=1 SV=1	654	LNKRWRKLVSKT
ITGPPGTGKTHF	tr|Q6UZF1|Q6UZF1_SARS	5581	tr|A0A5K1VW56|A0A5K1VW56_HUMAN ATPase family AAA domain-containing protein 3B OS=Homo sapiens OX=9606 GN=ATAD3B PE=1 SV=1	244	LYGPPGTGKTLF
ITGPPGTGKTHF	tr|Q6UZF1|Q6UZF1_SARS	5581	sp|Q5T9A4|ATD3B_HUMAN ATPase family AAA domain-containing protein 3B OS=Homo sapiens OX=9606 GN=ATAD3B PE=1 SV=1	350	LYGPPGTGKTLF
ITGPPGTGKTHF	tr|Q6UZF1|Q6UZF1_SARS	5581	sp|Q5T2N8|ATD3C_HUMAN ATPase family AAA domain-containing protein 3C OS=Homo sapiens OX=9606 GN=ATAD3C PE=2 SV=2	175	LYGPPGTGKTLF
ITGPPGTGKTHF	tr|Q6UZF1|Q6UZF1_SARS	5581	sp|Q9NVI7|ATD3A_HUMAN ATPase family AAA domain-containing protein 3A OS=Homo sapiens OX=9606 GN=ATAD3A PE=1 SV=2	398	MYGPPGTGKTLF
ITGPPGTGKTHF	tr|Q6UZF1|Q6UZF1_SARS	5581	tr|C9J5S9|C9J5S9_HUMAN DNA repair protein RAD51 homolog 2 (Fragment) OS=Homo sapiens OX=9606 GN=RAD51B PE=1 SV=1	106	ITGPPGCGKTQF
ITGPPGTGKTHF	tr|Q6UZF1|Q6UZF1_SARS	5581	sp|O15315|RA51B_HUMAN DNA repair protein RAD51 homolog 2 OS=Homo sapiens OX=9606 GN=RAD51B PE=1 SV=2	106	ITGPPGCGKTQF
ITGPPGTGKTHF	tr|Q6UZF1|Q6UZF1_SARS	5581	tr|C9JYJ0|C9JYJ0_HUMAN DNA repair protein RAD51 homolog 2 OS=Homo sapiens OX=9606 GN=RAD51B PE=1 SV=1	106	ITGPPGCGKTQF
ITGPPGTGKTHF	tr|Q6UZF1|Q6UZF1_SARS	5581	tr|A0A0A0MS18|A0A0A0MS18_HUMAN DNA repair protein RAD51 homolog 2 OS=Homo sapiens OX=9606 GN=RAD51B PE=1 SV=1	106	ITGPPGCGKTQF
ITGPPGTGKTHF	tr|Q6UZF1|Q6UZF1_SARS	5581	sp|Q9Y4W6|AFG32_HUMAN AFG3-like protein 2 OS=Homo sapiens OX=9606 GN=AFG3L2 PE=1 SV=2	346	LTGPPGTGKTLL
ITGPPGTGKTHF	tr|Q6UZF1|Q6UZF1_SARS	5581	sp|P35250|RFC2_HUMAN Replication factor C subunit 2 OS=Homo sapiens OX=9606 GN=RFC2 PE=1 SV=3	74	IAGPPGTGKTTS
ITGPPGTGKTHF	tr|Q6UZF1|Q6UZF1_SARS	5581	tr|D6RAW6|D6RAW6_HUMAN Cell cycle checkpoint protein RAD17 (Fragment) OS=Homo sapiens OX=9606 GN=RAD17 PE=1 SV=1	124	ITGPPGCGKTTT
ITGPPGTGKTHF	tr|Q6UZF1|Q6UZF1_SARS	5581	sp|O75943|RAD17_HUMAN Cell cycle checkpoint protein RAD17 OS=Homo sapiens OX=9606 GN=RAD17 PE=1 SV=2	135	ITGPPGCGKTTT
ITGPPGTGKTHF	tr|Q6UZF1|Q6UZF1_SARS	5581	tr|A0A0G2JPT5|A0A0G2JPT5_HUMAN Cell cycle checkpoint protein RAD17 OS=Homo sapiens OX=9606 GN=RAD17 PE=1 SV=1	135	ITGPPGCGKTTT
ITGPPGTGKTHF	tr|Q6UZF1|Q6UZF1_SARS	5581	tr|A0A0G2JP78|A0A0G2JP78_HUMAN Cell cycle checkpoint protein RAD17 OS=Homo sapiens OX=9606 GN=RAD17 PE=1 SV=1	38	ITGPPGCGKTTT
ITGPPGTGKTHF	tr|Q6UZF1|Q6UZF1_SARS	5581	tr|F5GX64|F5GX64_HUMAN DNA-binding protein SMUBP-2 (Fragment) OS=Homo sapiens OX=9606 GN=IGHMBP2 PE=1 SV=2	200	IHGPPGTGKTTT
ITGPPGTGKTHF	tr|Q6UZF1|Q6UZF1_SARS	5581	tr|A0A6Q8PFP3|A0A6Q8PFP3_HUMAN DNA-binding protein SMUBP-2 (Fragment) OS=Homo sapiens OX=9606 GN=IGHMBP2 PE=1 SV=1	200	IHGPPGTGKTTT
ITGPPGTGKTHF	tr|Q6UZF1|Q6UZF1_SARS	5581	tr|A0A6Q8PGT6|A0A6Q8PGT6_HUMAN DNA-binding protein SMUBP-2 OS=Homo sapiens OX=9606 GN=IGHMBP2 PE=1 SV=1	212	IHGPPGTGKTTT
ITGPPGTGKTHF	tr|Q6UZF1|Q6UZF1_SARS	5581	sp|P38935|SMBP2_HUMAN DNA-binding protein SMUBP-2 OS=Homo sapiens OX=9606 GN=IGHMBP2 PE=1 SV=3	212	IHGPPGTGKTTT
ITGPPGTGKTHF	tr|Q6UZF1|Q6UZF1_SARS	5581	tr|A0A6Q8PGX2|A0A6Q8PGX2_HUMAN DNA-binding protein SMUBP-2 OS=Homo sapiens OX=9606 GN=IGHMBP2 PE=1 SV=1	212	IHGPPGTGKTTT
ITGPPGTGKTHF	tr|Q6UZF1|Q6UZF1_SARS	5581	tr|Q5JR04|Q5JR04_HUMAN RNA helicase OS=Homo sapiens OX=9606 GN=MOV10 PE=1 SV=1	466	IFGPPGTGKTVT
ITGPPGTGKTHF	tr|Q6UZF1|Q6UZF1_SARS	5581	sp|Q9HCE1|MOV10_HUMAN Helicase MOV-10 OS=Homo sapiens OX=9606 GN=MOV10 PE=1 SV=2	522	IFGPPGTGKTVT
ITGPPGTGKTHF	tr|Q6UZF1|Q6UZF1_SARS	5581	sp|Q92900|RENT1_HUMAN Regulator of nonsense transcripts 1 OS=Homo sapiens OX=9606 GN=UPF1 PE=1 SV=2	501	IQGPPGTGKTVT
ITGPPGTGKTHF	tr|Q6UZF1|Q6UZF1_SARS	5581	sp|Q9BYK8|HELZ2_HUMAN Helicase with zinc finger domain 2 OS=Homo sapiens OX=9606 GN=HELZ2 PE=1 SV=6	2172	IQGPPGTGKTIV
ITGPPGTGKTHF	tr|Q6UZF1|Q6UZF1_SARS	5581	tr|Q5JXR5|Q5JXR5_HUMAN NFX1-type zinc finger-containing protein 1 (Fragment) OS=Homo sapiens OX=9606 GN=ZNFX1 PE=1 SV=1	617	IQGPPGTGKTYV
ITGPPGTGKTHF	tr|Q6UZF1|Q6UZF1_SARS	5581	tr|Q5JXR6|Q5JXR6_HUMAN NFX1-type zinc finger-containing protein 1 OS=Homo sapiens OX=9606 GN=ZNFX1 PE=1 SV=1	617	IQGPPGTGKTYV
ITGPPGTGKTHF	tr|Q6UZF1|Q6UZF1_SARS	5581	sp|Q9P2E3|ZNFX1_HUMAN NFX1-type zinc finger-containing protein 1 OS=Homo sapiens OX=9606 GN=ZNFX1 PE=2 SV=2	617	IQGPPGTGKTYV
ITGPPGTGKTHF	tr|Q6UZF1|Q6UZF1_SARS	5581	tr|Q5JXR7|Q5JXR7_HUMAN NFX1-type zinc finger-containing protein 1 (Fragment) OS=Homo sapiens OX=9606 GN=ZNFX1 PE=1 SV=1	421	IQGPPGTGKTYV
CGATLLKITPCG	tr|Q6UZF1|Q6UZF1_SARS	4381	tr|E9PI91|E9PI91_HUMAN E3 ubiquitin-protein ligase pellino homolog 3 (Fragment) OS=Homo sapiens OX=9606 GN=PELI3 PE=1 SV=1	190	CGATLLWRTPAG
CGATLLKITPCG	tr|Q6UZF1|Q6UZF1_SARS	4381	sp|Q8N2H9|PELI3_HUMAN E3 ubiquitin-protein ligase pellino homolog 3 OS=Homo sapiens OX=9606 GN=PELI3 PE=1 SV=2	297	CGATLLWRTPAG
PGTGKTHFAVGL	tr|Q6UZF1|Q6UZF1_SARS	5585	tr|A0A5K1VW56|A0A5K1VW56_HUMAN ATPase family AAA domain-containing protein 3B OS=Homo sapiens OX=9606 GN=ATAD3B PE=1 SV=1	248	PGTGKTLFAKKL
PGTGKTHFAVGL	tr|Q6UZF1|Q6UZF1_SARS	5585	sp|Q5T9A4|ATD3B_HUMAN ATPase family AAA domain-containing protein 3B OS=Homo sapiens OX=9606 GN=ATAD3B PE=1 SV=1	354	PGTGKTLFAKKL
PGTGKTHFAVGL	tr|Q6UZF1|Q6UZF1_SARS	5585	sp|Q5T2N8|ATD3C_HUMAN ATPase family AAA domain-containing protein 3C OS=Homo sapiens OX=9606 GN=ATAD3C PE=2 SV=2	179	PGTGKTLFAKKL
PGTGKTHFAVGL	tr|Q6UZF1|Q6UZF1_SARS	5585	sp|Q9NVI7|ATD3A_HUMAN ATPase family AAA domain-containing protein 3A OS=Homo sapiens OX=9606 GN=ATAD3A PE=1 SV=2	402	PGTGKTLFAKKL
MLLTKALGLPSS	tr|Q6UZF1|Q6UZF1_SARS	5821	sp|Q96Q91|B3A4_HUMAN Anion exchange protein 4 OS=Homo sapiens OX=9606 GN=SLC4A9 PE=2 SV=2	765	MLLTSALGLPWY
NMLLTKALGLPS	tr|Q6UZF1|Q6UZF1_SARS	5820	sp|Q96Q91|B3A4_HUMAN Anion exchange protein 4 OS=Homo sapiens OX=9606 GN=SLC4A9 PE=2 SV=2	764	LMLLTSALGLPW
CETAKEPVVTNL	tr|Q6UZF1|Q6UZF1_SARS	4360	tr|G3V587|G3V587_HUMAN Unconventional myosin-Ia (Fragment) OS=Homo sapiens OX=9606 GN=MYO1A PE=1 SV=8	18	METAKEKVVTAL
CETAKEPVVTNL	tr|Q6UZF1|Q6UZF1_SARS	4360	tr|G3V342|G3V342_HUMAN Unconventional myosin-Ia OS=Homo sapiens OX=9606 GN=MYO1A PE=1 SV=1	160	METAKEKVVTAL
CETAKEPVVTNL	tr|Q6UZF1|Q6UZF1_SARS	4360	sp|Q9UBC5|MYO1A_HUMAN Unconventional myosin-Ia OS=Homo sapiens OX=9606 GN=MYO1A PE=1 SV=1	322	METAKEKVVTAL
ALLSVRQFKLVV	tr|Q6UZF1|Q6UZF1_SARS	5144	sp|Q1ZZU3|SWI5_HUMAN DNA repair protein SWI5 homolog OS=Homo sapiens OX=9606 GN=SWI5 PE=1 SV=1	38	AQLSVRQFTLRV
FPSLYATRDEAA	tr|Q6UZF1|Q6UZF1_SARS	5971	sp|Q5T160|SYRM_HUMAN Probable arginine--tRNA ligase, mitochondrial OS=Homo sapiens OX=9606 GN=RARS2 PE=1 SV=1	318	GTSLYATRDLAA
LNQLLRLLLAIP	tr|Q6UZF1|Q6UZF1_SARS	4041	tr|H0YA69|H0YA69_HUMAN Matrix metalloproteinase-23 (Fragment) OS=Homo sapiens OX=9606 GN=MMP23B PE=1 SV=1	183	LPQQLRLLLRIP
LNQLLRLLLAIP	tr|Q6UZF1|Q6UZF1_SARS	4041	tr|O75086|O75086_HUMAN MIFR-2 OS=Homo sapiens OX=9606 GN=MMP23B PE=1 SV=1	304	LPQQLRLLLRIP
LNQLLRLLLAIP	tr|Q6UZF1|Q6UZF1_SARS	4041	tr|H0YAE5|H0YAE5_HUMAN Matrix metalloproteinase-23 (Fragment) OS=Homo sapiens OX=9606 GN=MMP23B PE=1 SV=1	176	LPQQLRLLLRIP
LNQLLRLLLAIP	tr|Q6UZF1|Q6UZF1_SARS	4041	tr|H0Y6I4|H0Y6I4_HUMAN Matrix metalloproteinase-23 (Fragment) OS=Homo sapiens OX=9606 GN=MMP23B PE=1 SV=1	160	LPQQLRLLLRIP
DNASTSTNLLGK	tr|Q6UZF0|Q6UZF0_SARS	918	tr|B4DHA8|B4DHA8_HUMAN CUGBP Elav-like family member 4 OS=Homo sapiens OX=9606 GN=CELF4 PE=1 SV=1	14	DNASLSTNGLGS
DNASTSTNLLGK	tr|Q6UZF0|Q6UZF0_SARS	918	tr|A0A0C4DGR1|A0A0C4DGR1_HUMAN CUGBP Elav-like family member 4 (Fragment) OS=Homo sapiens OX=9606 GN=CELF4 PE=1 SV=1	14	DNASLSTNGLGS
DNASTSTNLLGK	tr|Q6UZF0|Q6UZF0_SARS	918	tr|M0QY66|M0QY66_HUMAN CUGBP Elav-like family member 4 OS=Homo sapiens OX=9606 GN=CELF4 PE=1 SV=1	14	DNASLSTNGLGS
DNASTSTNLLGK	tr|Q6UZF0|Q6UZF0_SARS	918	sp|Q9BZC1|CELF4_HUMAN CUGBP Elav-like family member 4 OS=Homo sapiens OX=9606 GN=CELF4 PE=1 SV=1	14	DNASLSTNGLGS
TDCVAGSQKRLE	tr|Q6UZF0|Q6UZF0_SARS	1012	tr|H7C3C7|H7C3C7_HUMAN Synaptosomal-associated protein 47 (Fragment) OS=Homo sapiens OX=9606 GN=SNAP47 PE=1 SV=1	160	TGLMAGSQKRLE
TDCVAGSQKRLE	tr|Q6UZF0|Q6UZF0_SARS	1012	sp|Q5SQN1|SNP47_HUMAN Synaptosomal-associated protein 47 OS=Homo sapiens OX=9606 GN=SNAP47 PE=1 SV=3	168	TGLMAGSQKRLE
TDCVAGSQKRLE	tr|Q6UZF0|Q6UZF0_SARS	1012	tr|A0A087X0B7|A0A087X0B7_HUMAN Synaptosomal-associated protein 47 OS=Homo sapiens OX=9606 GN=SNAP47 PE=1 SV=1	123	TGLMAGSQKRLE
TDCVAGSQKRLE	tr|Q6UZF0|Q6UZF0_SARS	1012	tr|U3KPT7|U3KPT7_HUMAN Synaptosomal-associated protein 47 (Fragment) OS=Homo sapiens OX=9606 GN=SNAP47 PE=1 SV=1	15	TGLMAGSQKRLE
EDDDDDIDCDDD	tr|Q6UZF1|Q6UZF1_SARS	930	sp|Q6PGQ1|DRIC1_HUMAN Aspartate-rich protein 1 OS=Homo sapiens OX=9606 GN=DRICH1 PE=1 SV=1	115	EDDDCDDDDDDD
EDDDDDIDCDDD	tr|Q6UZF1|Q6UZF1_SARS	930	tr|M0QZ43|M0QZ43_HUMAN Sarcoplasmic reticulum histidine-rich calcium-binding protein OS=Homo sapiens OX=9606 GN=HRC PE=1 SV=1	246	DDDDDDDDDDDD
EDDDDDIDCDDD	tr|Q6UZF1|Q6UZF1_SARS	930	sp|P23327|SRCH_HUMAN Sarcoplasmic reticulum histidine-rich calcium-binding protein OS=Homo sapiens OX=9606 GN=HRC PE=1 SV=1	246	DDDDDDDDDDDD
EDDDDDIDCDDD	tr|Q6UZF1|Q6UZF1_SARS	930	tr|M0QZ43|M0QZ43_HUMAN Sarcoplasmic reticulum histidine-rich calcium-binding protein OS=Homo sapiens OX=9606 GN=HRC PE=1 SV=1	247	DDDDDDDDDDDD
EDDDDDIDCDDD	tr|Q6UZF1|Q6UZF1_SARS	930	sp|P23327|SRCH_HUMAN Sarcoplasmic reticulum histidine-rich calcium-binding protein OS=Homo sapiens OX=9606 GN=HRC PE=1 SV=1	247	DDDDDDDDDDDD
EDDDDDIDCDDD	tr|Q6UZF1|Q6UZF1_SARS	930	sp|Q6PL18|ATAD2_HUMAN ATPase family AAA domain-containing protein 2 OS=Homo sapiens OX=9606 GN=ATAD2 PE=1 SV=1	264	DDDDDDDDDDDD
EDDDDDIDCDDD	tr|Q6UZF1|Q6UZF1_SARS	930	tr|A0A494C084|A0A494C084_HUMAN Asporin (Fragment) OS=Homo sapiens OX=9606 GN=ASPN PE=1 SV=1	10	DDDDDDDDDDDD
EDDDDDIDCDDD	tr|Q6UZF1|Q6UZF1_SARS	930	tr|Q5TBF2|Q5TBF2_HUMAN Asporin OS=Homo sapiens OX=9606 GN=ASPN PE=1 SV=1	38	DDDDDDDDDDDD
EDDDDDIDCDDD	tr|Q6UZF1|Q6UZF1_SARS	930	sp|Q9BXN1|ASPN_HUMAN Asporin OS=Homo sapiens OX=9606 GN=ASPN PE=1 SV=2	38	DDDDDDDDDDDD
EDDDDDIDCDDD	tr|Q6UZF1|Q6UZF1_SARS	930	tr|A0A494C1J0|A0A494C1J0_HUMAN Asporin OS=Homo sapiens OX=9606 GN=ASPN PE=1 SV=1	38	DDDDDDDDDDDD
EDDDDDIDCDDD	tr|Q6UZF1|Q6UZF1_SARS	930	tr|M0QZ43|M0QZ43_HUMAN Sarcoplasmic reticulum histidine-rich calcium-binding protein OS=Homo sapiens OX=9606 GN=HRC PE=1 SV=1	248	DDDDDDDDDDDD
EDDDDDIDCDDD	tr|Q6UZF1|Q6UZF1_SARS	930	sp|P23327|SRCH_HUMAN Sarcoplasmic reticulum histidine-rich calcium-binding protein OS=Homo sapiens OX=9606 GN=HRC PE=1 SV=1	248	DDDDDDDDDDDD
EDDDDDIDCDDD	tr|Q6UZF1|Q6UZF1_SARS	930	sp|Q6PL18|ATAD2_HUMAN ATPase family AAA domain-containing protein 2 OS=Homo sapiens OX=9606 GN=ATAD2 PE=1 SV=1	265	DDDDDDDDDDDD
EDDDDDIDCDDD	tr|Q6UZF1|Q6UZF1_SARS	930	tr|A0A494C084|A0A494C084_HUMAN Asporin (Fragment) OS=Homo sapiens OX=9606 GN=ASPN PE=1 SV=1	11	DDDDDDDDDDDD
EDDDDDIDCDDD	tr|Q6UZF1|Q6UZF1_SARS	930	tr|Q5TBF2|Q5TBF2_HUMAN Asporin OS=Homo sapiens OX=9606 GN=ASPN PE=1 SV=1	39	DDDDDDDDDDDD
EDDDDDIDCDDD	tr|Q6UZF1|Q6UZF1_SARS	930	sp|Q9BXN1|ASPN_HUMAN Asporin OS=Homo sapiens OX=9606 GN=ASPN PE=1 SV=2	39	DDDDDDDDDDDD
EDDDDDIDCDDD	tr|Q6UZF1|Q6UZF1_SARS	930	tr|A0A494C1J0|A0A494C1J0_HUMAN Asporin OS=Homo sapiens OX=9606 GN=ASPN PE=1 SV=1	39	DDDDDDDDDDDD
EDDDDDIDCDDD	tr|Q6UZF1|Q6UZF1_SARS	930	sp|O94763|RMP_HUMAN Unconventional prefoldin RPB5 interactor 1 OS=Homo sapiens OX=9606 GN=URI1 PE=1 SV=3	299	DDDDDDDDDDDD
EDDDDDIDCDDD	tr|Q6UZF1|Q6UZF1_SARS	930	tr|I3L280|I3L280_HUMAN Unconventional prefoldin RPB5 interactor 1 (Fragment) OS=Homo sapiens OX=9606 GN=URI1 PE=1 SV=1	46	DDDDDDDDDDDD
EDDDDDIDCDDD	tr|Q6UZF1|Q6UZF1_SARS	930	tr|M0QZ43|M0QZ43_HUMAN Sarcoplasmic reticulum histidine-rich calcium-binding protein OS=Homo sapiens OX=9606 GN=HRC PE=1 SV=1	249	DDDDDDDDDDDD
EDDDDDIDCDDD	tr|Q6UZF1|Q6UZF1_SARS	930	sp|P23327|SRCH_HUMAN Sarcoplasmic reticulum histidine-rich calcium-binding protein OS=Homo sapiens OX=9606 GN=HRC PE=1 SV=1	249	DDDDDDDDDDDD
EDDDDDIDCDDD	tr|Q6UZF1|Q6UZF1_SARS	930	sp|Q6PL18|ATAD2_HUMAN ATPase family AAA domain-containing protein 2 OS=Homo sapiens OX=9606 GN=ATAD2 PE=1 SV=1	266	DDDDDDDDDDDD
EDDDDDIDCDDD	tr|Q6UZF1|Q6UZF1_SARS	930	tr|A0A494C084|A0A494C084_HUMAN Asporin (Fragment) OS=Homo sapiens OX=9606 GN=ASPN PE=1 SV=1	12	DDDDDDDDDDDD
EDDDDDIDCDDD	tr|Q6UZF1|Q6UZF1_SARS	930	tr|Q5TBF2|Q5TBF2_HUMAN Asporin OS=Homo sapiens OX=9606 GN=ASPN PE=1 SV=1	40	DDDDDDDDDDDD
EDDDDDIDCDDD	tr|Q6UZF1|Q6UZF1_SARS	930	sp|Q9BXN1|ASPN_HUMAN Asporin OS=Homo sapiens OX=9606 GN=ASPN PE=1 SV=2	40	DDDDDDDDDDDD
EDDDDDIDCDDD	tr|Q6UZF1|Q6UZF1_SARS	930	tr|A0A494C1J0|A0A494C1J0_HUMAN Asporin OS=Homo sapiens OX=9606 GN=ASPN PE=1 SV=1	40	DDDDDDDDDDDD
EDDDDDIDCDDD	tr|Q6UZF1|Q6UZF1_SARS	930	sp|O94763|RMP_HUMAN Unconventional prefoldin RPB5 interactor 1 OS=Homo sapiens OX=9606 GN=URI1 PE=1 SV=3	300	DDDDDDDDDDDD
EDDDDDIDCDDD	tr|Q6UZF1|Q6UZF1_SARS	930	tr|I3L280|I3L280_HUMAN Unconventional prefoldin RPB5 interactor 1 (Fragment) OS=Homo sapiens OX=9606 GN=URI1 PE=1 SV=1	47	DDDDDDDDDDDD
EDDDDDIDCDDD	tr|Q6UZF1|Q6UZF1_SARS	930	tr|M0QZ43|M0QZ43_HUMAN Sarcoplasmic reticulum histidine-rich calcium-binding protein OS=Homo sapiens OX=9606 GN=HRC PE=1 SV=1	250	DDDDDDDDDDDD
EDDDDDIDCDDD	tr|Q6UZF1|Q6UZF1_SARS	930	sp|P23327|SRCH_HUMAN Sarcoplasmic reticulum histidine-rich calcium-binding protein OS=Homo sapiens OX=9606 GN=HRC PE=1 SV=1	250	DDDDDDDDDDDD
EDDDDDIDCDDD	tr|Q6UZF1|Q6UZF1_SARS	930	tr|M0QZ43|M0QZ43_HUMAN Sarcoplasmic reticulum histidine-rich calcium-binding protein OS=Homo sapiens OX=9606 GN=HRC PE=1 SV=1	245	EDDDDDDDDDDD
EDDDDDIDCDDD	tr|Q6UZF1|Q6UZF1_SARS	930	sp|P23327|SRCH_HUMAN Sarcoplasmic reticulum histidine-rich calcium-binding protein OS=Homo sapiens OX=9606 GN=HRC PE=1 SV=1	245	EDDDDDDDDDDD
EDDDDDIDCDDD	tr|Q6UZF1|Q6UZF1_SARS	930	sp|Q6PL18|ATAD2_HUMAN ATPase family AAA domain-containing protein 2 OS=Homo sapiens OX=9606 GN=ATAD2 PE=1 SV=1	263	EDDDDDDDDDDD
EDDDDDIDCDDD	tr|Q6UZF1|Q6UZF1_SARS	930	sp|Q16594|TAF9_HUMAN Transcription initiation factor TFIID subunit 9 OS=Homo sapiens OX=9606 GN=TAF9 PE=1 SV=1	249	EDDDDDDDDDDD
EDDDDDIDCDDD	tr|Q6UZF1|Q6UZF1_SARS	930	sp|O94763|RMP_HUMAN Unconventional prefoldin RPB5 interactor 1 OS=Homo sapiens OX=9606 GN=URI1 PE=1 SV=3	298	SDDDDDDDDDDD
EDDDDDIDCDDD	tr|Q6UZF1|Q6UZF1_SARS	930	tr|I3L280|I3L280_HUMAN Unconventional prefoldin RPB5 interactor 1 (Fragment) OS=Homo sapiens OX=9606 GN=URI1 PE=1 SV=1	45	SDDDDDDDDDDD
EDDDDDIDCDDD	tr|Q6UZF1|Q6UZF1_SARS	930	tr|A0A494C084|A0A494C084_HUMAN Asporin (Fragment) OS=Homo sapiens OX=9606 GN=ASPN PE=1 SV=1	9	TDDDDDDDDDDD
EDDDDDIDCDDD	tr|Q6UZF1|Q6UZF1_SARS	930	tr|Q5TBF2|Q5TBF2_HUMAN Asporin OS=Homo sapiens OX=9606 GN=ASPN PE=1 SV=1	37	TDDDDDDDDDDD
EDDDDDIDCDDD	tr|Q6UZF1|Q6UZF1_SARS	930	sp|Q9BXN1|ASPN_HUMAN Asporin OS=Homo sapiens OX=9606 GN=ASPN PE=1 SV=2	37	TDDDDDDDDDDD
EDDDDDIDCDDD	tr|Q6UZF1|Q6UZF1_SARS	930	tr|A0A494C1J0|A0A494C1J0_HUMAN Asporin OS=Homo sapiens OX=9606 GN=ASPN PE=1 SV=1	37	TDDDDDDDDDDD
EDDDDDIDCDDD	tr|Q6UZF1|Q6UZF1_SARS	930	tr|M0QZ43|M0QZ43_HUMAN Sarcoplasmic reticulum histidine-rich calcium-binding protein OS=Homo sapiens OX=9606 GN=HRC PE=1 SV=1	244	EEDDDDDDDDDD
EDDDDDIDCDDD	tr|Q6UZF1|Q6UZF1_SARS	930	sp|P23327|SRCH_HUMAN Sarcoplasmic reticulum histidine-rich calcium-binding protein OS=Homo sapiens OX=9606 GN=HRC PE=1 SV=1	244	EEDDDDDDDDDD
EDDDDDIDCDDD	tr|Q6UZF1|Q6UZF1_SARS	930	tr|A0A494C084|A0A494C084_HUMAN Asporin (Fragment) OS=Homo sapiens OX=9606 GN=ASPN PE=1 SV=1	7	EDTDDDDDDDDD
EDDDDDIDCDDD	tr|Q6UZF1|Q6UZF1_SARS	930	tr|Q5TBF2|Q5TBF2_HUMAN Asporin OS=Homo sapiens OX=9606 GN=ASPN PE=1 SV=1	35	EDTDDDDDDDDD
EDDDDDIDCDDD	tr|Q6UZF1|Q6UZF1_SARS	930	sp|Q9BXN1|ASPN_HUMAN Asporin OS=Homo sapiens OX=9606 GN=ASPN PE=1 SV=2	35	EDTDDDDDDDDD
EDDDDDIDCDDD	tr|Q6UZF1|Q6UZF1_SARS	930	tr|A0A494C1J0|A0A494C1J0_HUMAN Asporin OS=Homo sapiens OX=9606 GN=ASPN PE=1 SV=1	35	EDTDDDDDDDDD
EDDDDDIDCDDD	tr|Q6UZF1|Q6UZF1_SARS	930	sp|Q6PL18|ATAD2_HUMAN ATPase family AAA domain-containing protein 2 OS=Homo sapiens OX=9606 GN=ATAD2 PE=1 SV=1	260	EDDEDDDDDDDD
EDDDDDIDCDDD	tr|Q6UZF1|Q6UZF1_SARS	930	sp|P19338|NUCL_HUMAN Nucleolin OS=Homo sapiens OX=9606 GN=NCL PE=1 SV=3	190	EDDEDDEDDDDD
EDDDDDIDCDDD	tr|Q6UZF1|Q6UZF1_SARS	930	sp|Q92973|TNPO1_HUMAN Transportin-1 OS=Homo sapiens OX=9606 GN=TNPO1 PE=1 SV=2	365	EDDDDDEIDDDD
EDDDDDIDCDDD	tr|Q6UZF1|Q6UZF1_SARS	930	tr|H7BYJ1|H7BYJ1_HUMAN E3 ubiquitin-protein ligase RNF34 OS=Homo sapiens OX=9606 GN=RNF34 PE=1 SV=1	222	EDDDDDDDEDDD
EDDDDDIDCDDD	tr|Q6UZF1|Q6UZF1_SARS	930	tr|A0A087WTM5|A0A087WTM5_HUMAN E3 ubiquitin-protein ligase RNF34 OS=Homo sapiens OX=9606 GN=RNF34 PE=1 SV=1	30	EDDDDDDDEDDD
EDDDDDIDCDDD	tr|Q6UZF1|Q6UZF1_SARS	930	sp|Q969K3|RNF34_HUMAN E3 ubiquitin-protein ligase RNF34 OS=Homo sapiens OX=9606 GN=RNF34 PE=1 SV=1	222	EDDDDDDDEDDD
EDDDDDIDCDDD	tr|Q6UZF1|Q6UZF1_SARS	930	tr|E5RI98|E5RI98_HUMAN Nucleophosmin (Fragment) OS=Homo sapiens OX=9606 GN=NPM1 PE=1 SV=1	98	EDDDDDDEEDDD
EDDDDDIDCDDD	tr|Q6UZF1|Q6UZF1_SARS	930	sp|P06748|NPM_HUMAN Nucleophosmin OS=Homo sapiens OX=9606 GN=NPM1 PE=1 SV=2	162	EDDDDDDEEDDD
EDDDDDIDCDDD	tr|Q6UZF1|Q6UZF1_SARS	930	sp|P19338|NUCL_HUMAN Nucleolin OS=Homo sapiens OX=9606 GN=NCL PE=1 SV=3	245	EDDDDDEDDEDD
EDDDDDIDCDDD	tr|Q6UZF1|Q6UZF1_SARS	930	sp|Q8WV41|SNX33_HUMAN Sorting nexin-33 OS=Homo sapiens OX=9606 GN=SNX33 PE=1 SV=1	111	EDDDDDWDDWDD
EDDDDDIDCDDD	tr|Q6UZF1|Q6UZF1_SARS	930	sp|A1YPR0|ZBT7C_HUMAN Zinc finger and BTB domain-containing protein 7C OS=Homo sapiens OX=9606 GN=ZBTB7C PE=2 SV=1	140	EDDDDDEDDDDE
TVIACCASNCCQ	tr|Q6UZF0|Q6UZF0_SARS	1213	tr|F8WB54|F8WB54_HUMAN Interleukin-17 receptor E OS=Homo sapiens OX=9606 GN=IL17RE PE=4 SV=1	70	TVPAVCASICCQ
ARISLACLVAVV	tr|Q6UZF1|Q6UZF1_SARS	2751	tr|A0A1W2PQM5|A0A1W2PQM5_HUMAN Glutathione transferase OS=Homo sapiens OX=9606 GN=GSTT4 PE=3 SV=1	161	NQISLADLVAVV
ARISLACLVAVV	tr|Q6UZF1|Q6UZF1_SARS	2751	sp|A0A1W2PR19|GSTT4_HUMAN Glutathione S-transferase theta-4 OS=Homo sapiens OX=9606 GN=GSTT4 PE=3 SV=1	161	NQISLADLVAVV
ARISLACLVAVV	tr|Q6UZF1|Q6UZF1_SARS	2751	tr|A0A1W2PRG0|A0A1W2PRG0_HUMAN Glutathione transferase OS=Homo sapiens OX=9606 PE=3 SV=1	161	NQISLADLVAVV
DDDDDIDCDDDE	tr|Q6UZF1|Q6UZF1_SARS	931	tr|M0QZ43|M0QZ43_HUMAN Sarcoplasmic reticulum histidine-rich calcium-binding protein OS=Homo sapiens OX=9606 GN=HRC PE=1 SV=1	246	DDDDDDDDDDDD
DDDDDIDCDDDE	tr|Q6UZF1|Q6UZF1_SARS	931	sp|P23327|SRCH_HUMAN Sarcoplasmic reticulum histidine-rich calcium-binding protein OS=Homo sapiens OX=9606 GN=HRC PE=1 SV=1	246	DDDDDDDDDDDD
DDDDDIDCDDDE	tr|Q6UZF1|Q6UZF1_SARS	931	tr|M0QZ43|M0QZ43_HUMAN Sarcoplasmic reticulum histidine-rich calcium-binding protein OS=Homo sapiens OX=9606 GN=HRC PE=1 SV=1	247	DDDDDDDDDDDD
DDDDDIDCDDDE	tr|Q6UZF1|Q6UZF1_SARS	931	sp|P23327|SRCH_HUMAN Sarcoplasmic reticulum histidine-rich calcium-binding protein OS=Homo sapiens OX=9606 GN=HRC PE=1 SV=1	247	DDDDDDDDDDDD
DDDDDIDCDDDE	tr|Q6UZF1|Q6UZF1_SARS	931	sp|Q6PL18|ATAD2_HUMAN ATPase family AAA domain-containing protein 2 OS=Homo sapiens OX=9606 GN=ATAD2 PE=1 SV=1	264	DDDDDDDDDDDD
DDDDDIDCDDDE	tr|Q6UZF1|Q6UZF1_SARS	931	tr|A0A494C084|A0A494C084_HUMAN Asporin (Fragment) OS=Homo sapiens OX=9606 GN=ASPN PE=1 SV=1	10	DDDDDDDDDDDD
DDDDDIDCDDDE	tr|Q6UZF1|Q6UZF1_SARS	931	tr|Q5TBF2|Q5TBF2_HUMAN Asporin OS=Homo sapiens OX=9606 GN=ASPN PE=1 SV=1	38	DDDDDDDDDDDD
DDDDDIDCDDDE	tr|Q6UZF1|Q6UZF1_SARS	931	sp|Q9BXN1|ASPN_HUMAN Asporin OS=Homo sapiens OX=9606 GN=ASPN PE=1 SV=2	38	DDDDDDDDDDDD
DDDDDIDCDDDE	tr|Q6UZF1|Q6UZF1_SARS	931	tr|A0A494C1J0|A0A494C1J0_HUMAN Asporin OS=Homo sapiens OX=9606 GN=ASPN PE=1 SV=1	38	DDDDDDDDDDDD
DDDDDIDCDDDE	tr|Q6UZF1|Q6UZF1_SARS	931	tr|M0QZ43|M0QZ43_HUMAN Sarcoplasmic reticulum histidine-rich calcium-binding protein OS=Homo sapiens OX=9606 GN=HRC PE=1 SV=1	248	DDDDDDDDDDDD
DDDDDIDCDDDE	tr|Q6UZF1|Q6UZF1_SARS	931	sp|P23327|SRCH_HUMAN Sarcoplasmic reticulum histidine-rich calcium-binding protein OS=Homo sapiens OX=9606 GN=HRC PE=1 SV=1	248	DDDDDDDDDDDD
DDDDDIDCDDDE	tr|Q6UZF1|Q6UZF1_SARS	931	sp|Q6PL18|ATAD2_HUMAN ATPase family AAA domain-containing protein 2 OS=Homo sapiens OX=9606 GN=ATAD2 PE=1 SV=1	265	DDDDDDDDDDDD
DDDDDIDCDDDE	tr|Q6UZF1|Q6UZF1_SARS	931	tr|A0A494C084|A0A494C084_HUMAN Asporin (Fragment) OS=Homo sapiens OX=9606 GN=ASPN PE=1 SV=1	11	DDDDDDDDDDDD
DDDDDIDCDDDE	tr|Q6UZF1|Q6UZF1_SARS	931	tr|Q5TBF2|Q5TBF2_HUMAN Asporin OS=Homo sapiens OX=9606 GN=ASPN PE=1 SV=1	39	DDDDDDDDDDDD
DDDDDIDCDDDE	tr|Q6UZF1|Q6UZF1_SARS	931	sp|Q9BXN1|ASPN_HUMAN Asporin OS=Homo sapiens OX=9606 GN=ASPN PE=1 SV=2	39	DDDDDDDDDDDD
DDDDDIDCDDDE	tr|Q6UZF1|Q6UZF1_SARS	931	tr|A0A494C1J0|A0A494C1J0_HUMAN Asporin OS=Homo sapiens OX=9606 GN=ASPN PE=1 SV=1	39	DDDDDDDDDDDD
DDDDDIDCDDDE	tr|Q6UZF1|Q6UZF1_SARS	931	sp|O94763|RMP_HUMAN Unconventional prefoldin RPB5 interactor 1 OS=Homo sapiens OX=9606 GN=URI1 PE=1 SV=3	299	DDDDDDDDDDDD
DDDDDIDCDDDE	tr|Q6UZF1|Q6UZF1_SARS	931	tr|I3L280|I3L280_HUMAN Unconventional prefoldin RPB5 interactor 1 (Fragment) OS=Homo sapiens OX=9606 GN=URI1 PE=1 SV=1	46	DDDDDDDDDDDD
DDDDDIDCDDDE	tr|Q6UZF1|Q6UZF1_SARS	931	tr|M0QZ43|M0QZ43_HUMAN Sarcoplasmic reticulum histidine-rich calcium-binding protein OS=Homo sapiens OX=9606 GN=HRC PE=1 SV=1	249	DDDDDDDDDDDD
DDDDDIDCDDDE	tr|Q6UZF1|Q6UZF1_SARS	931	sp|P23327|SRCH_HUMAN Sarcoplasmic reticulum histidine-rich calcium-binding protein OS=Homo sapiens OX=9606 GN=HRC PE=1 SV=1	249	DDDDDDDDDDDD
DDDDDIDCDDDE	tr|Q6UZF1|Q6UZF1_SARS	931	sp|Q6PL18|ATAD2_HUMAN ATPase family AAA domain-containing protein 2 OS=Homo sapiens OX=9606 GN=ATAD2 PE=1 SV=1	266	DDDDDDDDDDDD
DDDDDIDCDDDE	tr|Q6UZF1|Q6UZF1_SARS	931	tr|A0A494C084|A0A494C084_HUMAN Asporin (Fragment) OS=Homo sapiens OX=9606 GN=ASPN PE=1 SV=1	12	DDDDDDDDDDDD
DDDDDIDCDDDE	tr|Q6UZF1|Q6UZF1_SARS	931	tr|Q5TBF2|Q5TBF2_HUMAN Asporin OS=Homo sapiens OX=9606 GN=ASPN PE=1 SV=1	40	DDDDDDDDDDDD
DDDDDIDCDDDE	tr|Q6UZF1|Q6UZF1_SARS	931	sp|Q9BXN1|ASPN_HUMAN Asporin OS=Homo sapiens OX=9606 GN=ASPN PE=1 SV=2	40	DDDDDDDDDDDD
DDDDDIDCDDDE	tr|Q6UZF1|Q6UZF1_SARS	931	tr|A0A494C1J0|A0A494C1J0_HUMAN Asporin OS=Homo sapiens OX=9606 GN=ASPN PE=1 SV=1	40	DDDDDDDDDDDD
DDDDDIDCDDDE	tr|Q6UZF1|Q6UZF1_SARS	931	sp|O94763|RMP_HUMAN Unconventional prefoldin RPB5 interactor 1 OS=Homo sapiens OX=9606 GN=URI1 PE=1 SV=3	300	DDDDDDDDDDDD
DDDDDIDCDDDE	tr|Q6UZF1|Q6UZF1_SARS	931	tr|I3L280|I3L280_HUMAN Unconventional prefoldin RPB5 interactor 1 (Fragment) OS=Homo sapiens OX=9606 GN=URI1 PE=1 SV=1	47	DDDDDDDDDDDD
DDDDDIDCDDDE	tr|Q6UZF1|Q6UZF1_SARS	931	tr|M0QZ43|M0QZ43_HUMAN Sarcoplasmic reticulum histidine-rich calcium-binding protein OS=Homo sapiens OX=9606 GN=HRC PE=1 SV=1	250	DDDDDDDDDDDD
DDDDDIDCDDDE	tr|Q6UZF1|Q6UZF1_SARS	931	sp|P23327|SRCH_HUMAN Sarcoplasmic reticulum histidine-rich calcium-binding protein OS=Homo sapiens OX=9606 GN=HRC PE=1 SV=1	250	DDDDDDDDDDDD
DDDDDIDCDDDE	tr|Q6UZF1|Q6UZF1_SARS	931	tr|H7BYJ1|H7BYJ1_HUMAN E3 ubiquitin-protein ligase RNF34 OS=Homo sapiens OX=9606 GN=RNF34 PE=1 SV=1	223	DDDDDDDEDDDD
DDDDDIDCDDDE	tr|Q6UZF1|Q6UZF1_SARS	931	tr|A0A087WTM5|A0A087WTM5_HUMAN E3 ubiquitin-protein ligase RNF34 OS=Homo sapiens OX=9606 GN=RNF34 PE=1 SV=1	31	DDDDDDDEDDDD
DDDDDIDCDDDE	tr|Q6UZF1|Q6UZF1_SARS	931	sp|Q969K3|RNF34_HUMAN E3 ubiquitin-protein ligase RNF34 OS=Homo sapiens OX=9606 GN=RNF34 PE=1 SV=1	223	DDDDDDDEDDDD
DDDDDIDCDDDE	tr|Q6UZF1|Q6UZF1_SARS	931	sp|Q6PL18|ATAD2_HUMAN ATPase family AAA domain-containing protein 2 OS=Homo sapiens OX=9606 GN=ATAD2 PE=1 SV=1	267	DDDDDDDDDDDE
DDDDDIDCDDDE	tr|Q6UZF1|Q6UZF1_SARS	931	tr|A0A494C084|A0A494C084_HUMAN Asporin (Fragment) OS=Homo sapiens OX=9606 GN=ASPN PE=1 SV=1	13	DDDDDDDDDDDE
DDDDDIDCDDDE	tr|Q6UZF1|Q6UZF1_SARS	931	tr|Q5TBF2|Q5TBF2_HUMAN Asporin OS=Homo sapiens OX=9606 GN=ASPN PE=1 SV=1	41	DDDDDDDDDDDE
DDDDDIDCDDDE	tr|Q6UZF1|Q6UZF1_SARS	931	sp|Q9BXN1|ASPN_HUMAN Asporin OS=Homo sapiens OX=9606 GN=ASPN PE=1 SV=2	41	DDDDDDDDDDDE
DDDDDIDCDDDE	tr|Q6UZF1|Q6UZF1_SARS	931	tr|A0A494C1J0|A0A494C1J0_HUMAN Asporin OS=Homo sapiens OX=9606 GN=ASPN PE=1 SV=1	41	DDDDDDDDDDDE
DDDDDIDCDDDE	tr|Q6UZF1|Q6UZF1_SARS	931	sp|P35716|SOX11_HUMAN Transcription factor SOX-11 OS=Homo sapiens OX=9606 GN=SOX11 PE=1 SV=2	223	DEDDDDDDDDDE
DDDDDIDCDDDE	tr|Q6UZF1|Q6UZF1_SARS	931	sp|P19338|NUCL_HUMAN Nucleolin OS=Homo sapiens OX=9606 GN=NCL PE=1 SV=3	191	DDEDDEDDDDDE
DDDDDIDCDDDE	tr|Q6UZF1|Q6UZF1_SARS	931	tr|H7BYJ1|H7BYJ1_HUMAN E3 ubiquitin-protein ligase RNF34 OS=Homo sapiens OX=9606 GN=RNF34 PE=1 SV=1	224	DDDDDDEDDDDE
DDDDDIDCDDDE	tr|Q6UZF1|Q6UZF1_SARS	931	tr|A0A087WTM5|A0A087WTM5_HUMAN E3 ubiquitin-protein ligase RNF34 OS=Homo sapiens OX=9606 GN=RNF34 PE=1 SV=1	32	DDDDDDEDDDDE
