query	query_seqname	query_start	target_seqname	target_start	target
LGIMVGSVLIIV	sp|Q6XQI4|L_JUNIN	377	tr|A0A140T9H8|A0A140T9H8_HUMAN HLA class II histocompatibility antigen, DM alpha chain OS=Homo sapiens OX=9606 GN=HLA-DMA PE=1 SV=1	242	LGIIVGIVLIIY
LGIMVGSVLIIV	sp|Q6XQI4|L_JUNIN	377	tr|A2AAT8|A2AAT8_HUMAN HLA class II histocompatibility antigen, DM alpha chain OS=Homo sapiens OX=9606 GN=HLA-DMA PE=1 SV=1	147	LGIIVGIVLIIY
YVSKFKLVRQNF	sp|Q6XQI4|L_JUNIN	528	sp|O15254|ACOX3_HUMAN Peroxisomal acyl-coenzyme A oxidase 3 OS=Homo sapiens OX=9606 GN=ACOX3 PE=1 SV=2	286	YVSPFKDVRQRF
LEDSGSYWCEPR	sp|Q6XQI4|L_JUNIN	564	sp|Q96P31|FCRL3_HUMAN Fc receptor-like protein 3 OS=Homo sapiens OX=9606 GN=FCRL3 PE=1 SV=1	252	TEDSGSYWCEVE
QDSSVPGLSKDL	sp|Q6XQI4|L_JUNIN	767	sp|Q6ZN30|BNC2_HUMAN Zinc finger protein basonuclin-2 OS=Homo sapiens OX=9606 GN=BNC2 PE=1 SV=1	901	LDSSQPSLSKDL
QDSSVPGLSKDL	sp|Q6XQI4|L_JUNIN	767	tr|B1APH0|B1APH0_HUMAN Zinc finger protein basonuclin-2 OS=Homo sapiens OX=9606 GN=BNC2 PE=1 SV=1	834	LDSSQPSLSKDL
FDSVSEDQLRLY	sp|Q6XQI4|L_JUNIN	893	tr|A0A0A6YYL4|A0A0A6YYL4_HUMAN Coronin OS=Homo sapiens OX=9606 GN=CORO7-PAM16 PE=1 SV=1	701	FDSQSERQLLLY
FDSVSEDQLRLY	sp|Q6XQI4|L_JUNIN	893	sp|P57737|CORO7_HUMAN Coronin-7 OS=Homo sapiens OX=9606 GN=CORO7 PE=1 SV=2	701	FDSQSERQLLLY
GRLHLQGDLKSS	sp|Q6XQI4|L_JUNIN	789	sp|Q6ZS81|WDFY4_HUMAN WD repeat- and FYVE domain-containing protein 4 OS=Homo sapiens OX=9606 GN=WDFY4 PE=1 SV=3	776	GTLHLRGDLKES
SYEDLVLLLPDF	sp|P26313|GLYC_JUNIN	111	tr|A0A2R8YE54|A0A2R8YE54_HUMAN Dynamin-like 120 kDa protein, form S1 OS=Homo sapiens OX=9606 GN=OPA1 PE=1 SV=1	158	SSEDLVKLAPDF
SYEDLVLLLPDF	sp|P26313|GLYC_JUNIN	111	tr|A0A2R8Y3X5|A0A2R8Y3X5_HUMAN Dynamin-like 120 kDa protein, form S1 OS=Homo sapiens OX=9606 GN=OPA1 PE=1 SV=1	34	SSEDLVKLAPDF
SYEDLVLLLPDF	sp|P26313|GLYC_JUNIN	111	tr|H7C321|H7C321_HUMAN Dynamin-like 120 kDa protein, mitochondrial (Fragment) OS=Homo sapiens OX=9606 GN=OPA1 PE=1 SV=2	32	SSEDLVKLAPDF
SYEDLVLLLPDF	sp|P26313|GLYC_JUNIN	111	tr|C9JY58|C9JY58_HUMAN Dynamin-like 120 kDa protein, mitochondrial (Fragment) OS=Homo sapiens OX=9606 GN=OPA1 PE=1 SV=1	34	SSEDLVKLAPDF
SYEDLVLLLPDF	sp|P26313|GLYC_JUNIN	111	tr|A0A2R8Y5G3|A0A2R8Y5G3_HUMAN Dynamin-like 120 kDa protein, mitochondrial OS=Homo sapiens OX=9606 GN=OPA1 PE=1 SV=1	158	SSEDLVKLAPDF
SYEDLVLLLPDF	sp|P26313|GLYC_JUNIN	111	tr|A0A2R8Y4G4|A0A2R8Y4G4_HUMAN Dynamin-like 120 kDa protein, form S1 (Fragment) OS=Homo sapiens OX=9606 GN=OPA1 PE=1 SV=1	45	SSEDLVKLAPDF
SYEDLVLLLPDF	sp|P26313|GLYC_JUNIN	111	tr|A0A2R8Y4Q3|A0A2R8Y4Q3_HUMAN Dynamin-like 120 kDa protein, form S1 OS=Homo sapiens OX=9606 GN=OPA1 PE=1 SV=1	34	SSEDLVKLAPDF
SYEDLVLLLPDF	sp|P26313|GLYC_JUNIN	111	sp|O60313|OPA1_HUMAN Dynamin-like 120 kDa protein, mitochondrial OS=Homo sapiens OX=9606 GN=OPA1 PE=1 SV=3	158	SSEDLVKLAPDF
SYEDLVLLLPDF	sp|P26313|GLYC_JUNIN	111	tr|C9JMB8|C9JMB8_HUMAN Dynamin-like 120 kDa protein, form S1 OS=Homo sapiens OX=9606 GN=OPA1 PE=1 SV=2	158	SSEDLVKLAPDF
SYEDLVLLLPDF	sp|P26313|GLYC_JUNIN	111	tr|A0A2R8YE78|A0A2R8YE78_HUMAN Dynamin-like 120 kDa protein, form S1 OS=Homo sapiens OX=9606 GN=OPA1 PE=1 SV=1	158	SSEDLVKLAPDF
SYEDLVLLLPDF	sp|P26313|GLYC_JUNIN	111	tr|A0A2R8YGE5|A0A2R8YGE5_HUMAN Dynamin-like 120 kDa protein, form S1 (Fragment) OS=Homo sapiens OX=9606 GN=OPA1 PE=1 SV=1	148	SSEDLVKLAPDF
SYEDLVLLLPDF	sp|P26313|GLYC_JUNIN	111	tr|A0A2R8YD53|A0A2R8YD53_HUMAN Dynamin-like 120 kDa protein, form S1 OS=Homo sapiens OX=9606 GN=OPA1 PE=1 SV=1	158	SSEDLVKLAPDF
SYEDLVLLLPDF	sp|P26313|GLYC_JUNIN	111	tr|A0A2R8YDM2|A0A2R8YDM2_HUMAN Dynamin-like 120 kDa protein, form S1 OS=Homo sapiens OX=9606 GN=OPA1 PE=1 SV=1	158	SSEDLVKLAPDF
SYEDLVLLLPDF	sp|P26313|GLYC_JUNIN	111	tr|A0A2R8Y5E2|A0A2R8Y5E2_HUMAN Dynamin-like 120 kDa protein, mitochondrial (Fragment) OS=Homo sapiens OX=9606 GN=OPA1 PE=1 SV=1	135	SSEDLVKLAPDF
DSSVPGLSKDLL	sp|Q6XQI4|L_JUNIN	768	sp|Q6ZN30|BNC2_HUMAN Zinc finger protein basonuclin-2 OS=Homo sapiens OX=9606 GN=BNC2 PE=1 SV=1	902	DSSQPSLSKDLR
DSSVPGLSKDLL	sp|Q6XQI4|L_JUNIN	768	tr|B1APH0|B1APH0_HUMAN Zinc finger protein basonuclin-2 OS=Homo sapiens OX=9606 GN=BNC2 PE=1 SV=1	835	DSSQPSLSKDLR
SAQLPLEPSAPP	sp|Q6IVU5|Z_JUNIN	82	sp|P31275|HXC12_HUMAN Homeobox protein Hox-C12 OS=Homo sapiens OX=9606 GN=HOXC12 PE=3 SV=2	122	AALLPLEPSGPP
SLSLMAHLGVSM	sp|P14239|NCAP_JUNIN	242	tr|A0A2R8Y752|A0A2R8Y752_HUMAN Leishmanolysin-like peptidase (Fragment) OS=Homo sapiens OX=9606 GN=LMLN2 PE=3 SV=1	274	SLSLAKHLGVSG
SLSLMAHLGVSM	sp|P14239|NCAP_JUNIN	242	tr|A0A2R8Y3T5|A0A2R8Y3T5_HUMAN Leishmanolysin-like peptidase OS=Homo sapiens OX=9606 GN=LMLN2 PE=3 SV=1	299	SLSLAKHLGVSG
SLSLMAHLGVSM	sp|P14239|NCAP_JUNIN	242	sp|A0A1B0GTW7|LMLN2_HUMAN Leishmanolysin-like peptidase 2 OS=Homo sapiens OX=9606 GN=LMLN2 PE=3 SV=1	357	SLSLAKHLGVSG
EDLILHGVERFY	sp|Q6XQI4|L_JUNIN	748	tr|E9PFY5|E9PFY5_HUMAN Afadin (Fragment) OS=Homo sapiens OX=9606 GN=AFDN PE=1 SV=1	35	EDLEFHGVMRFY
EDLILHGVERFY	sp|Q6XQI4|L_JUNIN	748	tr|F8W9I4|F8W9I4_HUMAN Afadin (Fragment) OS=Homo sapiens OX=9606 GN=AFDN PE=1 SV=1	35	EDLEFHGVMRFY
EDLILHGVERFY	sp|Q6XQI4|L_JUNIN	748	tr|J3KN01|J3KN01_HUMAN Afadin OS=Homo sapiens OX=9606 GN=AFDN PE=1 SV=1	35	EDLEFHGVMRFY
EDLILHGVERFY	sp|Q6XQI4|L_JUNIN	748	sp|P55196|AFAD_HUMAN Afadin OS=Homo sapiens OX=9606 GN=AFDN PE=1 SV=3	35	EDLEFHGVMRFY
EDLILHGVERFY	sp|Q6XQI4|L_JUNIN	748	tr|Q5TIG5|Q5TIG5_HUMAN Afadin OS=Homo sapiens OX=9606 GN=AFDN PE=1 SV=1	35	EDLEFHGVMRFY
RSELLKLGMSLM	sp|Q6XQI4|L_JUNIN	127	sp|Q9P2G1|AKIB1_HUMAN Ankyrin repeat and IBR domain-containing protein 1 OS=Homo sapiens OX=9606 GN=ANKIB1 PE=1 SV=3	912	SSELLELGDSLM
TLGIMVGSVLII	sp|Q6XQI4|L_JUNIN	376	tr|A0A140T9T2|A0A140T9T2_HUMAN HLA class II histocompatibility antigen, DM alpha chain (Fragment) OS=Homo sapiens OX=9606 GN=HLA-DMA PE=1 SV=1	222	VLGIIVGIVLII
TLGIMVGSVLII	sp|Q6XQI4|L_JUNIN	376	tr|A0A140T9N7|A0A140T9N7_HUMAN HLA class II histocompatibility antigen, DM alpha chain (Fragment) OS=Homo sapiens OX=9606 GN=HLA-DMA PE=1 SV=1	271	VLGIIVGIVLII
TLGIMVGSVLII	sp|Q6XQI4|L_JUNIN	376	tr|A0A140T9K8|A0A140T9K8_HUMAN HLA class II histocompatibility antigen, DM alpha chain (Fragment) OS=Homo sapiens OX=9606 GN=HLA-DMA PE=1 SV=1	271	VLGIIVGIVLII
TLGIMVGSVLII	sp|Q6XQI4|L_JUNIN	376	tr|A0A140T9N9|A0A140T9N9_HUMAN HLA class II histocompatibility antigen, DM alpha chain (Fragment) OS=Homo sapiens OX=9606 GN=HLA-DMA PE=1 SV=1	271	VLGIIVGIVLII
TLGIMVGSVLII	sp|Q6XQI4|L_JUNIN	376	tr|A0A140T9T3|A0A140T9T3_HUMAN HLA class II histocompatibility antigen, DM alpha chain (Fragment) OS=Homo sapiens OX=9606 GN=HLA-DMA PE=1 SV=1	271	VLGIIVGIVLII
TLGIMVGSVLII	sp|Q6XQI4|L_JUNIN	376	tr|A0A140T9X4|A0A140T9X4_HUMAN HLA class II histocompatibility antigen, DM alpha chain (Fragment) OS=Homo sapiens OX=9606 GN=HLA-DMA PE=1 SV=1	271	VLGIIVGIVLII
TLGIMVGSVLII	sp|Q6XQI4|L_JUNIN	376	tr|H0Y732|H0Y732_HUMAN HLA class II histocompatibility antigen, DM alpha chain (Fragment) OS=Homo sapiens OX=9606 GN=HLA-DMA PE=1 SV=1	271	VLGIIVGIVLII
TLGIMVGSVLII	sp|Q6XQI4|L_JUNIN	376	tr|A0A140T9V7|A0A140T9V7_HUMAN HLA class II histocompatibility antigen, DM alpha chain (Fragment) OS=Homo sapiens OX=9606 GN=HLA-DMA PE=1 SV=1	271	VLGIIVGIVLII
TLGIMVGSVLII	sp|Q6XQI4|L_JUNIN	376	tr|A0A140T9C4|A0A140T9C4_HUMAN HLA class II histocompatibility antigen, DM alpha chain OS=Homo sapiens OX=9606 GN=HLA-DMA PE=1 SV=1	146	VLGIIVGIVLII
TLGIMVGSVLII	sp|Q6XQI4|L_JUNIN	376	tr|Q5SP00|Q5SP00_HUMAN HLA class II histocompatibility antigen, DM alpha chain OS=Homo sapiens OX=9606 GN=HLA-DMA PE=1 SV=2	207	VLGIIVGIVLII
TLGIMVGSVLII	sp|Q6XQI4|L_JUNIN	376	sp|P28067|DMA_HUMAN HLA class II histocompatibility antigen, DM alpha chain OS=Homo sapiens OX=9606 GN=HLA-DMA PE=1 SV=1	241	VLGIIVGIVLII
TLGIMVGSVLII	sp|Q6XQI4|L_JUNIN	376	tr|A0A140T9G2|A0A140T9G2_HUMAN HLA class II histocompatibility antigen, DM alpha chain OS=Homo sapiens OX=9606 GN=HLA-DMA PE=1 SV=1	207	VLGIIVGIVLII
TLGIMVGSVLII	sp|Q6XQI4|L_JUNIN	376	tr|A0A140T9H8|A0A140T9H8_HUMAN HLA class II histocompatibility antigen, DM alpha chain OS=Homo sapiens OX=9606 GN=HLA-DMA PE=1 SV=1	241	VLGIIVGIVLII
TLGIMVGSVLII	sp|Q6XQI4|L_JUNIN	376	tr|A2AAT8|A2AAT8_HUMAN HLA class II histocompatibility antigen, DM alpha chain OS=Homo sapiens OX=9606 GN=HLA-DMA PE=1 SV=1	146	VLGIIVGIVLII
VLSEALSAGSHK	sp|Q6XQI4|L_JUNIN	266	sp|Q8NGA4|G32P1_HUMAN Putative G-protein coupled receptor GPR32P1 OS=Homo sapiens OX=9606 GN=GPR32P1 PE=5 SV=2	260	VLVSALSAGSHL
QLNDTLDTICET	sp|Q6XQI4|L_JUNIN	1413	tr|J3KT08|J3KT08_HUMAN GOLD domain-containing protein (Fragment) OS=Homo sapiens OX=9606 PE=3 SV=1	147	QLNDTLDAIEEL
LMCDVKLIISSG	sp|Q6XQI4|L_JUNIN	1169	sp|Q70Z35|PREX2_HUMAN Phosphatidylinositol 3,4,5-trisphosphate-dependent Rac exchanger 2 protein OS=Homo sapiens OX=9606 GN=PREX2 PE=1 SV=1	247	LMCGVLLKISSG
EDNVIQLVSKGG	sp|Q6XQI4|L_JUNIN	1511	tr|A0A1W2PRR5|A0A1W2PRR5_HUMAN Adhesion G-protein-coupled receptor V1 (Fragment) OS=Homo sapiens OX=9606 GN=ADGRV1 PE=1 SV=1	271	EDYVIQLVSVEG
EDNVIQLVSKGG	sp|Q6XQI4|L_JUNIN	1511	tr|A0A1W2PPA4|A0A1W2PPA4_HUMAN Adhesion G-protein-coupled receptor V1 (Fragment) OS=Homo sapiens OX=9606 GN=ADGRV1 PE=1 SV=1	198	EDYVIQLVSVEG
EDNVIQLVSKGG	sp|Q6XQI4|L_JUNIN	1511	sp|Q8WXG9|AGRV1_HUMAN Adhesion G-protein coupled receptor V1 OS=Homo sapiens OX=9606 GN=ADGRV1 PE=1 SV=2	4728	EDYVIQLVSVEG
EDNVIQLVSKGG	sp|Q6XQI4|L_JUNIN	1511	tr|A0A1X7SBU6|A0A1X7SBU6_HUMAN Adhesion G-protein-coupled receptor V1 (Fragment) OS=Homo sapiens OX=9606 GN=ADGRV1 PE=1 SV=1	1046	EDYVIQLVSVEG
IRVADIKLSQEQ	sp|P14239|NCAP_JUNIN	470	tr|A0A494C150|A0A494C150_HUMAN Probable E3 ubiquitin-protein ligase HECTD4 (Fragment) OS=Homo sapiens OX=9606 GN=HECTD4 PE=1 SV=1	1372	IRVSDIYLSKEQ
IRVADIKLSQEQ	sp|P14239|NCAP_JUNIN	470	tr|F8VWT9|F8VWT9_HUMAN Probable E3 ubiquitin-protein ligase HECTD4 OS=Homo sapiens OX=9606 GN=HECTD4 PE=1 SV=2	3562	IRVSDIYLSKEQ
IRVADIKLSQEQ	sp|P14239|NCAP_JUNIN	470	tr|J3KPF0|J3KPF0_HUMAN Probable E3 ubiquitin-protein ligase HECTD4 OS=Homo sapiens OX=9606 GN=HECTD4 PE=1 SV=3	3694	IRVSDIYLSKEQ
IRVADIKLSQEQ	sp|P14239|NCAP_JUNIN	470	sp|Q9Y4D8|HECD4_HUMAN Probable E3 ubiquitin-protein ligase HECTD4 OS=Homo sapiens OX=9606 GN=HECTD4 PE=1 SV=5	3274	IRVSDIYLSKEQ
EVEQLLLVISAL	sp|Q6XQI4|L_JUNIN	439	tr|J3KPV0|J3KPV0_HUMAN PTS1-BP (Fragment) OS=Homo sapiens OX=9606 GN=PEX5 PE=1 SV=1	351	ENEQELLAISAL
EVEQLLLVISAL	sp|Q6XQI4|L_JUNIN	439	sp|P50542|PEX5_HUMAN Peroxisomal targeting signal 1 receptor OS=Homo sapiens OX=9606 GN=PEX5 PE=1 SV=3	381	ENEQELLAISAL
EVEQLLLVISAL	sp|Q6XQI4|L_JUNIN	439	tr|B4E0T2|B4E0T2_HUMAN PTS1-BP OS=Homo sapiens OX=9606 GN=PEX5 PE=1 SV=1	402	ENEQELLAISAL
QGQGGSGIIKLW	sp|P14239|NCAP_JUNIN	148	tr|H3BSM2|H3BSM2_HUMAN Kunitz-type protease inhibitor 1 (Fragment) OS=Homo sapiens OX=9606 GN=SPINT1 PE=1 SV=1	217	QGFGGSGIPKAW
QGQGGSGIIKLW	sp|P14239|NCAP_JUNIN	148	tr|H3BTQ8|H3BTQ8_HUMAN Kunitz-type protease inhibitor 1 (Fragment) OS=Homo sapiens OX=9606 GN=SPINT1 PE=1 SV=8	155	QGFGGSGIPKAW
QGQGGSGIIKLW	sp|P14239|NCAP_JUNIN	148	sp|O43278|SPIT1_HUMAN Kunitz-type protease inhibitor 1 OS=Homo sapiens OX=9606 GN=SPINT1 PE=1 SV=2	155	QGFGGSGIPKAW
QGQGGSGIIKLW	sp|P14239|NCAP_JUNIN	148	tr|H3BVD9|H3BVD9_HUMAN Kunitz-type protease inhibitor 1 (Fragment) OS=Homo sapiens OX=9606 GN=SPINT1 PE=1 SV=1	115	QGFGGSGIPKAW
EFKFLSLASFGE	sp|Q6XQI4|L_JUNIN	1545	sp|P51955|NEK2_HUMAN Serine/threonine-protein kinase Nek2 OS=Homo sapiens OX=9606 GN=NEK2 PE=1 SV=1	360	ERKFLSLASNPE
EFKFLSLASFGE	sp|Q6XQI4|L_JUNIN	1545	tr|F6U4U2|F6U4U2_HUMAN Serine/threonine-protein kinase Nek2 OS=Homo sapiens OX=9606 GN=NEK2 PE=1 SV=1	360	ERKFLSLASNPE
REIRVADIKLSQ	sp|P14239|NCAP_JUNIN	468	sp|Q15811|ITSN1_HUMAN Intersectin-1 OS=Homo sapiens OX=9606 GN=ITSN1 PE=1 SV=3	1678	TEIRVADIKKDQ
ELGRLEKLDALT	sp|P14239|NCAP_JUNIN	93	tr|A0A3B3ITL8|A0A3B3ITL8_HUMAN Sorbin and SH3 domain-containing protein 2 (Fragment) OS=Homo sapiens OX=9606 GN=SORBS2 PE=1 SV=1	121	FLGELEKLGALT
