query	query_seqname	query_start	target_seqname	target_start	target
RISSTEAVPGRV	sp|P0C6U2|R1A_CVH22	3822	tr|I3L3L4|I3L3L4_HUMAN Heat shock protein 75 kDa, mitochondrial OS=Homo sapiens OX=9606 GN=TRAP1 PE=1 SV=1	74	IISSTESVQGRV
NKLHGLNWALSV	sp|P0C6X1|R1AB_CVH22	2453	sp|Q8N2C7|UNC80_HUMAN Protein unc-80 homolog OS=Homo sapiens OX=9606 GN=UNC80 PE=2 SV=2	56	NKLHGLSPALSE
NKLHGLNWALSV	sp|P0C6X1|R1AB_CVH22	2453	tr|A0A669KAW8|A0A669KAW8_HUMAN Protein unc-80 homolog OS=Homo sapiens OX=9606 GN=UNC80 PE=1 SV=1	56	NKLHGLSPALSE
NKLHGLNWALSV	sp|P0C6X1|R1AB_CVH22	2453	tr|A0A669KBC5|A0A669KBC5_HUMAN Protein unc-80 homolog OS=Homo sapiens OX=9606 GN=UNC80 PE=1 SV=1	56	NKLHGLSPALSE
AILKLLSFIKKV	sp|P0C6X1|R1AB_CVH22	2138	sp|P25942|TNR5_HUMAN Tumor necrosis factor receptor superfamily member 5 OS=Homo sapiens OX=9606 GN=CD40 PE=1 SV=1	207	AILLVLVFIKKV
ALKNLVWGILKK	sp|P0C6U2|R1A_CVH22	3715	sp|Q9BQQ7|RTP3_HUMAN Receptor-transporting protein 3 OS=Homo sapiens OX=9606 GN=RTP3 PE=1 SV=1	114	ILKNLVFRILKK
TNGDVLHFMKTL	sp|P0C6U2|R1A_CVH22	425	sp|Q05996|ZP2_HUMAN Zona pellucida sperm-binding protein 2 OS=Homo sapiens OX=9606 GN=ZP2 PE=1 SV=1	309	TNGMKLHFSKTL
VLASGVRAAKTS	sp|P0C6U2|R1A_CVH22	1686	tr|E9PEC3|E9PEC3_HUMAN Propionyl-CoA carboxylase beta chain, mitochondrial OS=Homo sapiens OX=9606 GN=PCCB PE=1 SV=1	16	VLASGLRAAVRS
VLASGVRAAKTS	sp|P0C6U2|R1A_CVH22	1686	tr|C9JVY9|C9JVY9_HUMAN Propionyl-CoA carboxylase beta chain, mitochondrial (Fragment) OS=Homo sapiens OX=9606 GN=PCCB PE=1 SV=8	16	VLASGLRAAVRS
VLASGVRAAKTS	sp|P0C6U2|R1A_CVH22	1686	tr|E7EUY3|E7EUY3_HUMAN Propionyl-CoA carboxylase beta chain, mitochondrial OS=Homo sapiens OX=9606 GN=PCCB PE=1 SV=1	16	VLASGLRAAVRS
VLASGVRAAKTS	sp|P0C6U2|R1A_CVH22	1686	tr|C9JQS9|C9JQS9_HUMAN Propionyl-CoA carboxylase beta chain, mitochondrial OS=Homo sapiens OX=9606 GN=PCCB PE=1 SV=1	16	VLASGLRAAVRS
VLASGVRAAKTS	sp|P0C6U2|R1A_CVH22	1686	tr|F8WBI9|F8WBI9_HUMAN Propionyl-CoA carboxylase beta chain, mitochondrial OS=Homo sapiens OX=9606 GN=PCCB PE=1 SV=1	16	VLASGLRAAVRS
VLASGVRAAKTS	sp|P0C6U2|R1A_CVH22	1686	sp|P05166|PCCB_HUMAN Propionyl-CoA carboxylase beta chain, mitochondrial OS=Homo sapiens OX=9606 GN=PCCB PE=1 SV=3	16	VLASGLRAAVRS
VLASGVRAAKTS	sp|P0C6U2|R1A_CVH22	1686	tr|E9PDR0|E9PDR0_HUMAN Propionyl-CoA carboxylase beta chain, mitochondrial OS=Homo sapiens OX=9606 GN=PCCB PE=1 SV=1	16	VLASGLRAAVRS
VLASGVRAAKTS	sp|P0C6U2|R1A_CVH22	1686	tr|E7ENC1|E7ENC1_HUMAN Propionyl-CoA carboxylase beta chain, mitochondrial OS=Homo sapiens OX=9606 GN=PCCB PE=1 SV=1	16	VLASGLRAAVRS
VLASGVRAAKTS	sp|P0C6U2|R1A_CVH22	1686	tr|E7ETT1|E7ETT1_HUMAN Propionyl-CoA carboxylase beta chain, mitochondrial OS=Homo sapiens OX=9606 GN=PCCB PE=1 SV=1	16	VLASGLRAAVRS
VLASGVRAAKTS	sp|P0C6U2|R1A_CVH22	1686	tr|E7EX59|E7EX59_HUMAN Propionyl-CoA carboxylase beta chain, mitochondrial OS=Homo sapiens OX=9606 GN=PCCB PE=1 SV=1	16	VLASGLRAAVRS
VLASGVRAAKTS	sp|P0C6U2|R1A_CVH22	1686	tr|E7ETT4|E7ETT4_HUMAN Propionyl-CoA carboxylase beta chain, mitochondrial OS=Homo sapiens OX=9606 GN=PCCB PE=1 SV=1	16	VLASGLRAAVRS
KGEAVKSVKSGS	sp|P0C6X1|R1AB_CVH22	181	tr|A0A5H1ZRS1|A0A5H1ZRS1_HUMAN Pericentriolar material 1 protein OS=Homo sapiens OX=9606 GN=PCM1 PE=1 SV=1	1440	KGENVKSVNSGT
KGEAVKSVKSGS	sp|P0C6X1|R1AB_CVH22	181	tr|A0A4W8VX11|A0A4W8VX11_HUMAN Pericentriolar material 1 protein OS=Homo sapiens OX=9606 GN=PCM1 PE=4 SV=1	1386	KGENVKSVNSGT
KGEAVKSVKSGS	sp|P0C6X1|R1AB_CVH22	181	tr|H0YBA1|H0YBA1_HUMAN Pericentriolar material 1 protein (Fragment) OS=Homo sapiens OX=9606 GN=PCM1 PE=1 SV=1	180	KGENVKSVNSGT
KGEAVKSVKSGS	sp|P0C6X1|R1AB_CVH22	181	sp|Q15154|PCM1_HUMAN Pericentriolar material 1 protein OS=Homo sapiens OX=9606 GN=PCM1 PE=1 SV=5	1440	KGENVKSVNSGT
FFLATAITSVGV	sp|P0C6X1|R1AB_CVH22	2099	sp|Q9UBL9|P2RX2_HUMAN P2X purinoceptor 2 OS=Homo sapiens OX=9606 GN=P2RX2 PE=1 SV=1	343	INLATALTSVGV
PPETLLLWTSVL	sp|P15423|SPIKE_CVH22	499	tr|A0A494C1M8|A0A494C1M8_HUMAN Protoporphyrinogen oxidase (Fragment) OS=Homo sapiens OX=9606 GN=PPOX PE=1 SV=1	42	PPFTPLLQTSVL
TIQVPSSFSSQI	sp|P15423|SPIKE_CVH22	581	sp|Q7Z7G8|VP13B_HUMAN Vacuolar protein sorting-associated protein 13B OS=Homo sapiens OX=9606 GN=VPS13B PE=1 SV=2	2810	VIQVPSSNSSII
VVYASLFLLPSL	sp|P0C6U2|R1A_CVH22	3328	tr|H7C106|H7C106_HUMAN Reticulon (Fragment) OS=Homo sapiens OX=9606 GN=RTN4 PE=1 SV=1	44	VFGASLFLLLSL
VVYASLFLLPSL	sp|P0C6U2|R1A_CVH22	3328	tr|F8W914|F8W914_HUMAN Reticulon OS=Homo sapiens OX=9606 GN=RTN4 PE=1 SV=1	173	VFGASLFLLLSL
VVYASLFLLPSL	sp|P0C6U2|R1A_CVH22	3328	sp|Q9NQC3|RTN4_HUMAN Reticulon-4 OS=Homo sapiens OX=9606 GN=RTN4 PE=1 SV=2	1020	VFGASLFLLLSL
EHSPINNNLKQL	sp|P0C6X1|R1AB_CVH22	5942	tr|A0A087X2C2|A0A087X2C2_HUMAN Divergent protein kinase domain 1A OS=Homo sapiens OX=9606 GN=DIPK1A PE=1 SV=1	361	EHSLILNNLKTL
EHSPINNNLKQL	sp|P0C6X1|R1AB_CVH22	5942	tr|A0A087WZK6|A0A087WZK6_HUMAN Divergent protein kinase domain 1A OS=Homo sapiens OX=9606 GN=DIPK1A PE=1 SV=1	347	EHSLILNNLKTL
EHSPINNNLKQL	sp|P0C6X1|R1AB_CVH22	5942	sp|Q5T7M9|DIK1A_HUMAN Divergent protein kinase domain 1A OS=Homo sapiens OX=9606 GN=DIPK1A PE=1 SV=1	406	EHSLILNNLKTL
EHSPINNNLKQL	sp|P0C6X1|R1AB_CVH22	5942	tr|A0A087WZ97|A0A087WZ97_HUMAN Divergent protein kinase domain 1A OS=Homo sapiens OX=9606 GN=DIPK1A PE=1 SV=1	381	EHSLILNNLKTL
IRTVEAGSGTKV	sp|P0C6X1|R1AB_CVH22	3126	tr|H0Y6S7|H0Y6S7_HUMAN Transmembrane protein 64 (Fragment) OS=Homo sapiens OX=9606 GN=TMEM64 PE=1 SV=1	104	IRVVEGGSGLKV
IRTVEAGSGTKV	sp|P0C6X1|R1AB_CVH22	3126	sp|Q6YI46|TMM64_HUMAN Transmembrane protein 64 OS=Homo sapiens OX=9606 GN=TMEM64 PE=2 SV=2	235	IRVVEGGSGLKV
MNGIKLVKSIES	sp|P0C6X1|R1AB_CVH22	1041	sp|A0AVK6|E2F8_HUMAN Transcription factor E2F8 OS=Homo sapiens OX=9606 GN=E2F8 PE=1 SV=1	395	PSLIKLVKSIES
DLISTVTIEYSG	sp|P0C6U2|R1A_CVH22	2319	sp|P07359|GP1BA_HUMAN Platelet glycoprotein Ib alpha chain OS=Homo sapiens OX=9606 GN=GP1BA PE=1 SV=2	638	DLLSTVSIRYSG
DLISTVTIEYSG	sp|P0C6U2|R1A_CVH22	2319	tr|A0A0C4DGZ8|A0A0C4DGZ8_HUMAN Glycoprotein Ib (Platelet), alpha polypeptide OS=Homo sapiens OX=9606 GN=GP1BA PE=1 SV=1	612	DLLSTVSIRYSG
VVVFCILLLVLL	sp|P19741|VEMP_CVH22	15	sp|A6NND4|O2AT4_HUMAN Olfactory receptor 2AT4 OS=Homo sapiens OX=9606 GN=OR2AT4 PE=1 SV=1	210	VVSFLPLLLVLL
GLSFLASVQENT	sp|P0C6U2|R1A_CVH22	2457	sp|Q8NEC5|CTSR1_HUMAN Cation channel sperm-associated protein 1 OS=Homo sapiens OX=9606 GN=CATSPER1 PE=1 SV=3	562	RLSFLTSVQEVT
TCYISTAIVTVN	sp|P0C6X1|R1AB_CVH22	1053	sp|Q8N9C0|IGS22_HUMAN Immunoglobulin superfamily member 22 OS=Homo sapiens OX=9606 GN=IGSF22 PE=2 SV=2	499	TEYYSTAIVTVE
KKVLYGCDSPDC	sp|P0C6X1|R1AB_CVH22	2147	tr|A0A1B0GTW4|A0A1B0GTW4_HUMAN Myocyte-specific enhancer factor 2C (Fragment) OS=Homo sapiens OX=9606 GN=MEF2C PE=1 SV=1	90	KKGLNGCDSPDP
KKVLYGCDSPDC	sp|P0C6X1|R1AB_CVH22	2147	tr|D6RG21|D6RG21_HUMAN Myocyte-specific enhancer factor 2C (Fragment) OS=Homo sapiens OX=9606 GN=MEF2C PE=1 SV=1	90	KKGLNGCDSPDP
KKVLYGCDSPDC	sp|P0C6X1|R1AB_CVH22	2147	tr|D6RCM6|D6RCM6_HUMAN Myocyte-specific enhancer factor 2C (Fragment) OS=Homo sapiens OX=9606 GN=MEF2C PE=1 SV=1	90	KKGLNGCDSPDP
KKVLYGCDSPDC	sp|P0C6X1|R1AB_CVH22	2147	tr|D6RJA7|D6RJA7_HUMAN Myocyte-specific enhancer factor 2C (Fragment) OS=Homo sapiens OX=9606 GN=MEF2C PE=1 SV=2	90	KKGLNGCDSPDP
KKVLYGCDSPDC	sp|P0C6X1|R1AB_CVH22	2147	tr|A0A1B0GV32|A0A1B0GV32_HUMAN Myocyte-specific enhancer factor 2C OS=Homo sapiens OX=9606 GN=MEF2C PE=1 SV=1	90	KKGLNGCDSPDP
KKVLYGCDSPDC	sp|P0C6X1|R1AB_CVH22	2147	tr|A0A0R4J2G5|A0A0R4J2G5_HUMAN Myocyte-specific enhancer factor 2C OS=Homo sapiens OX=9606 GN=MEF2C PE=1 SV=1	90	KKGLNGCDSPDP
KKVLYGCDSPDC	sp|P0C6X1|R1AB_CVH22	2147	sp|Q06413|MEF2C_HUMAN Myocyte-specific enhancer factor 2C OS=Homo sapiens OX=9606 GN=MEF2C PE=1 SV=1	90	KKGLNGCDSPDP
KKVLYGCDSPDC	sp|P0C6X1|R1AB_CVH22	2147	tr|D6RJG6|D6RJG6_HUMAN Myocyte-specific enhancer factor 2C OS=Homo sapiens OX=9606 GN=MEF2C PE=1 SV=1	90	KKGLNGCDSPDP
NSAKPRPLVSSA	sp|P0C6U2|R1A_CVH22	1904	sp|P41229|KDM5C_HUMAN Lysine-specific demethylase 5C OS=Homo sapiens OX=9606 GN=KDM5C PE=1 SV=2	1168	NSAKPSPLASSS
RDGLYFPTTGTS	sp|P0C6X1|R1AB_CVH22	875	tr|C9JD37|C9JD37_HUMAN Growth factor receptor-bound protein 14 (Fragment) OS=Homo sapiens OX=9606 GN=GRB14 PE=1 SV=9	215	RSGLYFSTKGTS
RDGLYFPTTGTS	sp|P0C6X1|R1AB_CVH22	875	sp|Q14449|GRB14_HUMAN Growth factor receptor-bound protein 14 OS=Homo sapiens OX=9606 GN=GRB14 PE=1 SV=2	260	RSGLYFSTKGTS
LRSGKLALRGTG	sp|P0C6X1|R1AB_CVH22	6734	sp|O00231|PSD11_HUMAN 26S proteasome non-ATPase regulatory subunit 11 OS=Homo sapiens OX=9606 GN=PSMD11 PE=1 SV=3	270	LVSGKLALRYAG
NSLLNSVLQIAQ	sp|P15423|SPIKE_CVH22	820	tr|A0A3B3ITU7|A0A3B3ITU7_HUMAN Fanconi anemia group E protein OS=Homo sapiens OX=9606 GN=FANCE PE=1 SV=1	111	ESGLLSVLQIAQ
NSLLNSVLQIAQ	sp|P15423|SPIKE_CVH22	820	sp|Q9HB96|FANCE_HUMAN Fanconi anemia group E protein OS=Homo sapiens OX=9606 GN=FANCE PE=1 SV=1	111	ESGLLSVLQIAQ
LGCSQNTGLNNQ	sp|P15423|SPIKE_CVH22	14	tr|A0A6E1W127|A0A6E1W127_HUMAN Myosin-7B OS=Homo sapiens OX=9606 GN=MYH7B PE=1 SV=1	1722	LLHSQNTGLLNQ
LGCSQNTGLNNQ	sp|P15423|SPIKE_CVH22	14	sp|A7E2Y1|MYH7B_HUMAN Myosin-7B OS=Homo sapiens OX=9606 GN=MYH7B PE=1 SV=4	1764	LLHSQNTGLLNQ
VLQIAQKVNELL	sp|P15423|SPIKE_CVH22	826	sp|Q9Y4P9|SPEF1_HUMAN Sperm flagellar protein 1 OS=Homo sapiens OX=9606 GN=SPEF1 PE=1 SV=3	183	VLQIAEKEQELL
IFKLMKDVKQGF	sp|P0C6X1|R1AB_CVH22	1108	sp|P84157|MXRA7_HUMAN Matrix-remodeling-associated protein 7 OS=Homo sapiens OX=9606 GN=MXRA7 PE=1 SV=1	176	IFKLMKDNKETF
NRVLGGKAQFSD	sp|P0C6X1|R1AB_CVH22	893	sp|A6NMZ7|CO6A6_HUMAN Collagen alpha-6(VI) chain OS=Homo sapiens OX=9606 GN=COL6A6 PE=1 SV=2	1035	NRVRIGAAQFSD
TKPGVRYVRFEH	sp|P0C6U2|R1A_CVH22	3869	sp|Q9UK22|FBX2_HUMAN F-box only protein 2 OS=Homo sapiens OX=9606 GN=FBXO2 PE=1 SV=2	260	YGPGVRFVRFEH
TKPGVRYVRFEH	sp|P0C6U2|R1A_CVH22	3869	tr|A0A286YF37|A0A286YF37_HUMAN F-box only protein 2 (Fragment) OS=Homo sapiens OX=9606 GN=FBXO2 PE=1 SV=1	232	YGPGVRFVRFEH
VKSVKSGSVAEV	sp|P0C6X1|R1AB_CVH22	185	sp|Q8TCU6|PREX1_HUMAN Phosphatidylinositol 3,4,5-trisphosphate-dependent Rac exchanger 1 protein OS=Homo sapiens OX=9606 GN=PREX1 PE=1 SV=3	648	VKSVQRGSLAEV
QALELIKDVKSQ	sp|P0C6U2|R1A_CVH22	192	tr|A0A590UK10|A0A590UK10_HUMAN Rho guanine nucleotide exchange factor 18 (Fragment) OS=Homo sapiens OX=9606 GN=ARHGEF18 PE=4 SV=1	375	QALNLIKDIISQ
QALELIKDVKSQ	sp|P0C6U2|R1A_CVH22	192	tr|A0A087WZG4|A0A087WZG4_HUMAN Rho guanine nucleotide exchange factor 18 OS=Homo sapiens OX=9606 GN=ARHGEF18 PE=1 SV=3	441	QALNLIKDIISQ
QALELIKDVKSQ	sp|P0C6U2|R1A_CVH22	192	sp|Q6ZSZ5|ARHGI_HUMAN Rho guanine nucleotide exchange factor 18 OS=Homo sapiens OX=9606 GN=ARHGEF18 PE=1 SV=4	629	QALNLIKDIISQ
QALELIKDVKSQ	sp|P0C6U2|R1A_CVH22	192	tr|A0A3B3IPE9|A0A3B3IPE9_HUMAN Rho guanine nucleotide exchange factor 18 OS=Homo sapiens OX=9606 GN=ARHGEF18 PE=1 SV=2	387	QALNLIKDIISQ
QALELIKDVKSQ	sp|P0C6U2|R1A_CVH22	192	tr|M0QZS0|M0QZS0_HUMAN Rho guanine nucleotide exchange factor 18 (Fragment) OS=Homo sapiens OX=9606 GN=ARHGEF18 PE=1 SV=1	86	QALNLIKDIISQ
LEYNPSNNTPAS	sp|P15130|NCAP_CVH22	359	sp|O75151|PHF2_HUMAN Lysine-specific demethylase PHF2 OS=Homo sapiens OX=9606 GN=PHF2 PE=1 SV=4	777	LEYNPSSQPPAS
KDLSVVQVTNLA	sp|P0C6U2|R1A_CVH22	1883	sp|Q9Y5L0|TNPO3_HUMAN Transportin-3 OS=Homo sapiens OX=9606 GN=TNPO3 PE=1 SV=3	98	KDLSPVIVTQLA
KDLSVVQVTNLA	sp|P0C6U2|R1A_CVH22	1883	tr|E9PFH4|E9PFH4_HUMAN Transportin-3 OS=Homo sapiens OX=9606 GN=TNPO3 PE=1 SV=1	32	KDLSPVIVTQLA
KDLSVVQVTNLA	sp|P0C6U2|R1A_CVH22	1883	tr|C9J7E5|C9J7E5_HUMAN Transportin-3 OS=Homo sapiens OX=9606 GN=TNPO3 PE=1 SV=1	98	KDLSPVIVTQLA
EGFYHVAASPTS	sp|P0C6U2|R1A_CVH22	571	sp|Q9BYI3|HYCCI_HUMAN Hyccin OS=Homo sapiens OX=9606 GN=FAM126A PE=1 SV=2	349	EGFYSRAASSTS
LQIAQKVNELLT	sp|P15423|SPIKE_CVH22	827	tr|F8WFC3|F8WFC3_HUMAN Regulator of microtubule dynamics protein 2 OS=Homo sapiens OX=9606 GN=RMDN2 PE=1 SV=1	73	LQILEKLNELLT
LQIAQKVNELLT	sp|P15423|SPIKE_CVH22	827	tr|C9JUD5|C9JUD5_HUMAN Regulator of microtubule dynamics protein 2 (Fragment) OS=Homo sapiens OX=9606 GN=RMDN2 PE=1 SV=1	73	LQILEKLNELLT
LQIAQKVNELLT	sp|P15423|SPIKE_CVH22	827	sp|Q96LZ7|RMD2_HUMAN Regulator of microtubule dynamics protein 2 OS=Homo sapiens OX=9606 GN=RMDN2 PE=1 SV=2	73	LQILEKLNELLT
SVRSPRKSWRNL	sp|P0C6X1|R1AB_CVH22	3059	tr|D6RBF0|D6RBF0_HUMAN PHD finger protein 3 (Fragment) OS=Homo sapiens OX=9606 GN=PHF3 PE=1 SV=1	52	SVRSPRKSPRLM
SVRSPRKSWRNL	sp|P0C6X1|R1AB_CVH22	3059	tr|D6R9X2|D6R9X2_HUMAN PHD finger protein 3 OS=Homo sapiens OX=9606 GN=PHF3 PE=1 SV=1	122	SVRSPRKSPRLM
SVRSPRKSWRNL	sp|P0C6X1|R1AB_CVH22	3059	tr|A0A1B0GX99|A0A1B0GX99_HUMAN PHD finger protein 3 (Fragment) OS=Homo sapiens OX=9606 GN=PHF3 PE=1 SV=1	75	SVRSPRKSPRLM
SVRSPRKSWRNL	sp|P0C6X1|R1AB_CVH22	3059	tr|E9PE34|E9PE34_HUMAN PHD finger protein 3 (Fragment) OS=Homo sapiens OX=9606 GN=PHF3 PE=1 SV=1	34	SVRSPRKSPRLM
SVRSPRKSWRNL	sp|P0C6X1|R1AB_CVH22	3059	sp|Q92576|PHF3_HUMAN PHD finger protein 3 OS=Homo sapiens OX=9606 GN=PHF3 PE=1 SV=3	122	SVRSPRKSPRLM
IQVPSSFSSQIS	sp|P15423|SPIKE_CVH22	582	sp|Q7Z7G8|VP13B_HUMAN Vacuolar protein sorting-associated protein 13B OS=Homo sapiens OX=9606 GN=VPS13B PE=1 SV=2	2811	IQVPSSNSSIIY
AVVHGVLGLLTL	sp|P0C6X1|R1AB_CVH22	4258	sp|Q8IWT1|SCN4B_HUMAN Sodium channel subunit beta-4 OS=Homo sapiens OX=9606 GN=SCN4B PE=1 SV=1	168	AVVGGVIGLLIL
AVVHGVLGLLTL	sp|P0C6X1|R1AB_CVH22	4258	sp|A0A2R8YCJ5|SIM41_HUMAN Small integral membrane protein 41 OS=Homo sapiens OX=9606 GN=SMIM41 PE=3 SV=1	37	AVVLGVLSLLVL
ELKESDGKNLKL	sp|P0C6X1|R1AB_CVH22	3787	sp|P07947|YES_HUMAN Tyrosine-protein kinase Yes OS=Homo sapiens OX=9606 GN=YES1 PE=1 SV=3	359	FLKEGDGKYLKL
ELKESDGKNLKL	sp|P0C6X1|R1AB_CVH22	3787	tr|J3QRU1|J3QRU1_HUMAN Tyrosine-protein kinase OS=Homo sapiens OX=9606 GN=YES1 PE=1 SV=1	364	FLKEGDGKYLKL
LSIREITLTTEK	sp|P0C6X1|R1AB_CVH22	1612	tr|A0A590UJW2|A0A590UJW2_HUMAN Histone H2A deubiquitinase MYSM1 OS=Homo sapiens OX=9606 GN=MYSM1 PE=1 SV=1	289	LSSSEITLWTEK
LSIREITLTTEK	sp|P0C6X1|R1AB_CVH22	1612	tr|A0A590UJD8|A0A590UJD8_HUMAN Histone H2A deubiquitinase MYSM1 OS=Homo sapiens OX=9606 GN=MYSM1 PE=1 SV=1	289	LSSSEITLWTEK
LSIREITLTTEK	sp|P0C6X1|R1AB_CVH22	1612	sp|Q5VVJ2|MYSM1_HUMAN Deubiquitinase MYSM1 OS=Homo sapiens OX=9606 GN=MYSM1 PE=1 SV=1	289	LSSSEITLWTEK
LSIREITLTTEK	sp|P0C6X1|R1AB_CVH22	1612	tr|A0A590UK32|A0A590UK32_HUMAN Histone H2A deubiquitinase MYSM1 (Fragment) OS=Homo sapiens OX=9606 GN=MYSM1 PE=1 SV=1	272	LSSSEITLWTEK
NELKESDGKNLK	sp|P0C6X1|R1AB_CVH22	3786	sp|Q14789|GOGB1_HUMAN Golgin subfamily B member 1 OS=Homo sapiens OX=9606 GN=GOLGB1 PE=1 SV=2	1951	NELLESEMKNLK
IKVYQPKAVREL	sp|P0C6X1|R1AB_CVH22	5912	sp|Q9C0B7|TNG6_HUMAN Transport and Golgi organization protein 6 homolog OS=Homo sapiens OX=9606 GN=TANGO6 PE=1 SV=2	264	DQVYQPLAVREL
TPKTVTFDSVTV	sp|P15423|SPIKE_CVH22	565	sp|Q9H2H9|S38A1_HUMAN Sodium-coupled neutral amino acid transporter 1 OS=Homo sapiens OX=9606 GN=SLC38A1 PE=1 SV=1	265	TPKYVTFNSKTV
TPKTVTFDSVTV	sp|P15423|SPIKE_CVH22	565	tr|F8VX04|F8VX04_HUMAN Sodium-coupled neutral amino acid transporter 1 OS=Homo sapiens OX=9606 GN=SLC38A1 PE=1 SV=1	265	TPKYVTFNSKTV
NSVRSPRKSWRN	sp|P0C6X1|R1AB_CVH22	3058	tr|D6RBF0|D6RBF0_HUMAN PHD finger protein 3 (Fragment) OS=Homo sapiens OX=9606 GN=PHF3 PE=1 SV=1	51	NSVRSPRKSPRL
NSVRSPRKSWRN	sp|P0C6X1|R1AB_CVH22	3058	tr|D6R9X2|D6R9X2_HUMAN PHD finger protein 3 OS=Homo sapiens OX=9606 GN=PHF3 PE=1 SV=1	121	NSVRSPRKSPRL
NSVRSPRKSWRN	sp|P0C6X1|R1AB_CVH22	3058	tr|A0A1B0GX99|A0A1B0GX99_HUMAN PHD finger protein 3 (Fragment) OS=Homo sapiens OX=9606 GN=PHF3 PE=1 SV=1	74	NSVRSPRKSPRL
NSVRSPRKSWRN	sp|P0C6X1|R1AB_CVH22	3058	tr|E9PE34|E9PE34_HUMAN PHD finger protein 3 (Fragment) OS=Homo sapiens OX=9606 GN=PHF3 PE=1 SV=1	33	NSVRSPRKSPRL
NSVRSPRKSWRN	sp|P0C6X1|R1AB_CVH22	3058	sp|Q92576|PHF3_HUMAN PHD finger protein 3 OS=Homo sapiens OX=9606 GN=PHF3 PE=1 SV=3	121	NSVRSPRKSPRL
TGAGTIEADFRK	sp|P15423|SPIKE_CVH22	703	sp|Q8TD57|DYH3_HUMAN Dynein heavy chain 3, axonemal OS=Homo sapiens OX=9606 GN=DNAH3 PE=2 SV=1	1962	TVAGTINADSRK
LADVFQGINDLA	sp|P15423|SPIKE_CVH22	805	sp|Q9BWP8|COL11_HUMAN Collectin-11 OS=Homo sapiens OX=9606 GN=COLEC11 PE=1 SV=1	198	LARVFIGINDLE
ISNNSVRSPRKS	sp|P0C6X1|R1AB_CVH22	3055	tr|D6RBF0|D6RBF0_HUMAN PHD finger protein 3 (Fragment) OS=Homo sapiens OX=9606 GN=PHF3 PE=1 SV=1	48	VEENSVRSPRKS
ISNNSVRSPRKS	sp|P0C6X1|R1AB_CVH22	3055	tr|D6R9X2|D6R9X2_HUMAN PHD finger protein 3 OS=Homo sapiens OX=9606 GN=PHF3 PE=1 SV=1	118	VEENSVRSPRKS
ISNNSVRSPRKS	sp|P0C6X1|R1AB_CVH22	3055	tr|A0A1B0GX99|A0A1B0GX99_HUMAN PHD finger protein 3 (Fragment) OS=Homo sapiens OX=9606 GN=PHF3 PE=1 SV=1	71	VEENSVRSPRKS
ISNNSVRSPRKS	sp|P0C6X1|R1AB_CVH22	3055	tr|E9PE34|E9PE34_HUMAN PHD finger protein 3 (Fragment) OS=Homo sapiens OX=9606 GN=PHF3 PE=1 SV=1	30	VEENSVRSPRKS
ISNNSVRSPRKS	sp|P0C6X1|R1AB_CVH22	3055	sp|Q92576|PHF3_HUMAN PHD finger protein 3 OS=Homo sapiens OX=9606 GN=PHF3 PE=1 SV=3	118	VEENSVRSPRKS
GIKLVKSIESTC	sp|P0C6X1|R1AB_CVH22	1043	sp|A0AVK6|E2F8_HUMAN Transcription factor E2F8 OS=Homo sapiens OX=9606 GN=E2F8 PE=1 SV=1	397	LIKLVKSIESDR
LYINSLRCYSDE	sp|P0C6X1|R1AB_CVH22	4855	sp|Q9Y2K7|KDM2A_HUMAN Lysine-specific demethylase 2A OS=Homo sapiens OX=9606 GN=KDM2A PE=1 SV=3	1144	LSINSLYCLSDE
LYINSLRCYSDE	sp|P0C6X1|R1AB_CVH22	4855	tr|I3VM54|I3VM54_HUMAN Lysine-specific demethylase 2A OS=Homo sapiens OX=9606 GN=KDM2A PE=1 SV=1	1127	LSINSLYCLSDE
LFQALTAYLVYF	sp|P19739|NS4A_CVH22	46	sp|P54707|AT12A_HUMAN Potassium-transporting ATPase alpha chain 2 OS=Homo sapiens OX=9606 GN=ATP12A PE=1 SV=3	874	LMQALGAFLVYF
VADTYQASAAED	sp|P0C6X1|R1AB_CVH22	4962	tr|A0A494C0E1|A0A494C0E1_HUMAN SH2 domain-containing protein 6 OS=Homo sapiens OX=9606 GN=SH2D6 PE=4 SV=1	232	VAPTGSASAAED
VADTYQASAAED	sp|P0C6X1|R1AB_CVH22	4962	sp|Q7Z4S9|SH2D6_HUMAN SH2 domain-containing protein 6 OS=Homo sapiens OX=9606 GN=SH2D6 PE=2 SV=1	46	VAPTGSASAAED
NGIKLVKSIEST	sp|P0C6X1|R1AB_CVH22	1042	sp|A0AVK6|E2F8_HUMAN Transcription factor E2F8 OS=Homo sapiens OX=9606 GN=E2F8 PE=1 SV=1	396	SLIKLVKSIESD
NGAVTLLLRDCA	sp|P0C6X1|R1AB_CVH22	1505	tr|Q4JDK3|Q4JDK3_HUMAN Non-receptor protein tyrosine phosphatase 20 variant 15 OS=Homo sapiens OX=9606 GN=PTPN20 PE=2 SV=1	53	EGAVSLLLRYCA
PVTRRPKPDYRR	sp|P0C6X1|R1AB_CVH22	4931	sp|P78524|DEN2B_HUMAN DENN domain-containing protein 2B OS=Homo sapiens OX=9606 GN=DENND2B PE=1 SV=3	429	PVTRRPKKDMRG
KSVKSGSVAEVA	sp|P0C6X1|R1AB_CVH22	186	sp|Q8TCU6|PREX1_HUMAN Phosphatidylinositol 3,4,5-trisphosphate-dependent Rac exchanger 1 protein OS=Homo sapiens OX=9606 GN=PREX1 PE=1 SV=3	649	KSVQRGSLAEVA
RERPHVGRYADE	sp|P15130|NCAP_CVH22	329	tr|A0A087X1T3|A0A087X1T3_HUMAN Component of oligomeric Golgi complex 8 (Fragment) OS=Homo sapiens OX=9606 GN=COG8 PE=1 SV=1	26	RERPDVGRYLRE
RERPHVGRYADE	sp|P15130|NCAP_CVH22	329	tr|H3BSH5|H3BSH5_HUMAN Component of oligomeric Golgi complex 8 (Fragment) OS=Homo sapiens OX=9606 GN=COG8 PE=1 SV=1	22	RERPDVGRYLRE
RERPHVGRYADE	sp|P15130|NCAP_CVH22	329	sp|Q96MW5|COG8_HUMAN Conserved oligomeric Golgi complex subunit 8 OS=Homo sapiens OX=9606 GN=COG8 PE=1 SV=2	41	RERPDVGRYLRE
RERPHVGRYADE	sp|P15130|NCAP_CVH22	329	tr|B4DYU2|B4DYU2_HUMAN Conserved oligomeric Golgi complex subunit 8 OS=Homo sapiens OX=9606 GN=COG8 PE=1 SV=1	68	RERPDVGRYLRE
RERPHVGRYADE	sp|P15130|NCAP_CVH22	329	tr|H3BQV3|H3BQV3_HUMAN Conserved oligomeric Golgi complex subunit 8 OS=Homo sapiens OX=9606 GN=COG8 PE=1 SV=1	41	RERPDVGRYLRE
EGMNMYKVLIVN	sp|P0C6U2|R1A_CVH22	311	tr|H7C0X5|H7C0X5_HUMAN Probable serine carboxypeptidase CPVL (Fragment) OS=Homo sapiens OX=9606 GN=CPVL PE=1 SV=1	77	EIMNNYKVLIYN
EGMNMYKVLIVN	sp|P0C6U2|R1A_CVH22	311	sp|Q9H3G5|CPVL_HUMAN Probable serine carboxypeptidase CPVL OS=Homo sapiens OX=9606 GN=CPVL PE=1 SV=2	373	EIMNNYKVLIYN
NLADVFQGINDL	sp|P15423|SPIKE_CVH22	804	sp|Q9BWP8|COL11_HUMAN Collectin-11 OS=Homo sapiens OX=9606 GN=COLEC11 PE=1 SV=1	197	GLARVFIGINDL
EYTGFRSSCCSV	sp|P0C6U2|R1A_CVH22	257	tr|J3QKX9|J3QKX9_HUMAN Lipoxygenase homology domain-containing protein 1 OS=Homo sapiens OX=9606 GN=LOXHD1 PE=4 SV=1	374	EYTGDRSSNCSS
EYTGFRSSCCSV	sp|P0C6U2|R1A_CVH22	257	sp|Q8IVV2|LOXH1_HUMAN Lipoxygenase homology domain-containing protein 1 OS=Homo sapiens OX=9606 GN=LOXHD1 PE=2 SV=4	1375	EYTGDRSSNCSS
EYTGFRSSCCSV	sp|P0C6U2|R1A_CVH22	257	tr|A0A2R8Y7K4|A0A2R8Y7K4_HUMAN Lipoxygenase homology domain-containing protein 1 OS=Homo sapiens OX=9606 GN=LOXHD1 PE=1 SV=1	1581	EYTGDRSSNCSS
EYTGFRSSCCSV	sp|P0C6U2|R1A_CVH22	257	tr|J3KRE7|J3KRE7_HUMAN Lipoxygenase homology domain-containing protein 1 OS=Homo sapiens OX=9606 GN=LOXHD1 PE=4 SV=1	470	EYTGDRSSNCSS
EYTGFRSSCCSV	sp|P0C6U2|R1A_CVH22	257	tr|F5GZB4|F5GZB4_HUMAN Lipoxygenase homology domain-containing protein 1 OS=Homo sapiens OX=9606 GN=LOXHD1 PE=1 SV=1	1581	EYTGDRSSNCSS
FVIVGFATCAYF	sp|P0C6X1|R1AB_CVH22	3470	sp|Q8WVZ7|RN133_HUMAN E3 ubiquitin-protein ligase RNF133 OS=Homo sapiens OX=9606 GN=RNF133 PE=2 SV=1	194	FVIVTTATLAYF
FVIVGFATCAYF	sp|P0C6X1|R1AB_CVH22	3470	sp|Q8N2K1|UB2J2_HUMAN Ubiquitin-conjugating enzyme E2 J2 OS=Homo sapiens OX=9606 GN=UBE2J2 PE=1 SV=3	237	FVIVGFAAFAYT
FVIVGFATCAYF	sp|P0C6X1|R1AB_CVH22	3470	tr|A6NGS0|A6NGS0_HUMAN Ubiquitin-conjugating enzyme E2 J2 OS=Homo sapiens OX=9606 GN=UBE2J2 PE=1 SV=1	185	FVIVGFAAFAYT
NSVADFEKDYQV	sp|P0C6U2|R1A_CVH22	3013	tr|A0A1W2PRZ5|A0A1W2PRZ5_HUMAN Potassium voltage-gated channel subfamily H member 1 (Fragment) OS=Homo sapiens OX=9606 GN=KCNH1 PE=1 SV=1	295	NSVRDFLKLYQV
NSVADFEKDYQV	sp|P0C6U2|R1A_CVH22	3013	tr|A0A1X7SBS6|A0A1X7SBS6_HUMAN Potassium voltage-gated channel subfamily H member 1 OS=Homo sapiens OX=9606 GN=KCNH1 PE=1 SV=1	490	NSVRDFLKLYQV
NSVADFEKDYQV	sp|P0C6U2|R1A_CVH22	3013	tr|A0A1W2PNI2|A0A1W2PNI2_HUMAN Potassium voltage-gated channel subfamily H member 1 OS=Homo sapiens OX=9606 GN=KCNH1 PE=1 SV=1	517	NSVRDFLKLYQV
NSVADFEKDYQV	sp|P0C6U2|R1A_CVH22	3013	sp|O95259|KCNH1_HUMAN Potassium voltage-gated channel subfamily H member 1 OS=Homo sapiens OX=9606 GN=KCNH1 PE=1 SV=1	517	NSVRDFLKLYQV
NSVADFEKDYQV	sp|P0C6U2|R1A_CVH22	3013	tr|A0A1W2PPA2|A0A1W2PPA2_HUMAN Potassium voltage-gated channel subfamily H member 1 OS=Homo sapiens OX=9606 GN=KCNH1 PE=1 SV=1	133	NSVRDFLKLYQV
VYQPKAVRELGQ	sp|P0C6X1|R1AB_CVH22	5914	sp|Q9C0B7|TNG6_HUMAN Transport and Golgi organization protein 6 homolog OS=Homo sapiens OX=9606 GN=TANGO6 PE=1 SV=2	266	VYQPLAVRELLI
ASKIKELLLEQK	sp|P0C6X1|R1AB_CVH22	6426	sp|Q8IYE0|CC146_HUMAN Coiled-coil domain-containing protein 146 OS=Homo sapiens OX=9606 GN=CCDC146 PE=1 SV=2	204	ASKQKQLLKEQK
VNENQVVSNLPV	sp|P0C6X1|R1AB_CVH22	2464	tr|E5RJC4|E5RJC4_HUMAN Heparan-alpha-glucosaminide N-acetyltransferase OS=Homo sapiens OX=9606 GN=HGSNAT PE=1 SV=1	105	VNEDPVDSNLPV
VNENQVVSNLPV	sp|P0C6X1|R1AB_CVH22	2464	sp|Q68CP4|HGNAT_HUMAN Heparan-alpha-glucosaminide N-acetyltransferase OS=Homo sapiens OX=9606 GN=HGSNAT PE=1 SV=2	183	VNEDPVDSNLPV
AIGGNITILVNV	sp|P0C6X1|R1AB_CVH22	443	sp|Q8NH57|O52P1_HUMAN Putative olfactory receptor 52P1 OS=Homo sapiens OX=9606 GN=OR52P1P PE=5 SV=2	40	TIVGNITILVVV
KFDSGQYAKVPD	sp|P0C6U2|R1A_CVH22	2665	sp|Q9H4D0|CSTN2_HUMAN Calsyntenin-2 OS=Homo sapiens OX=9606 GN=CLSTN2 PE=1 SV=2	357	KFDGRQGAKVPD
FVLLDHIDYESG	sp|P0C6U2|R1A_CVH22	2237	sp|Q8WYP5|ELYS_HUMAN Protein ELYS OS=Homo sapiens OX=9606 GN=AHCTF1 PE=1 SV=3	815	FWLIDHNDYESG
SLLNSVLQIAQK	sp|P15423|SPIKE_CVH22	821	tr|A0A3B3ITU7|A0A3B3ITU7_HUMAN Fanconi anemia group E protein OS=Homo sapiens OX=9606 GN=FANCE PE=1 SV=1	112	SGLLSVLQIAQQ
SLLNSVLQIAQK	sp|P15423|SPIKE_CVH22	821	sp|Q9HB96|FANCE_HUMAN Fanconi anemia group E protein OS=Homo sapiens OX=9606 GN=FANCE PE=1 SV=1	112	SGLLSVLQIAQQ
GVTVPSGPFDLL	sp|P0C6U2|R1A_CVH22	3514	tr|F8W733|F8W733_HUMAN BRCA1-A complex subunit BRE (Fragment) OS=Homo sapiens OX=9606 GN=BABAM2 PE=1 SV=1	251	EVSVPSGPFHLL
FLLDSPSGPSLK	sp|P0C6X1|R1AB_CVH22	3895	tr|F8VZK3|F8VZK3_HUMAN Calcium/calmodulin-dependent 3',5'-cyclic nucleotide phosphodiesterase 1B OS=Homo sapiens OX=9606 GN=PDE1B PE=1 SV=1	87	FLCDSPSGVSGK
SASFLLQTSALS	sp|P0C6X1|R1AB_CVH22	2797	tr|H0Y9M2|H0Y9M2_HUMAN Zinc finger protein 827 OS=Homo sapiens OX=9606 GN=ZNF827 PE=1 SV=2	1254	SASQALQTVALS
SLIGKVFDRAYD	sp|P0C6U2|R1A_CVH22	481	tr|B7ZM68|B7ZM68_HUMAN FGD5 protein OS=Homo sapiens OX=9606 GN=FGD5 PE=1 SV=1	831	SLISKVTDRAND
SLIGKVFDRAYD	sp|P0C6U2|R1A_CVH22	481	sp|Q6ZNL6|FGD5_HUMAN FYVE, RhoGEF and PH domain-containing protein 5 OS=Homo sapiens OX=9606 GN=FGD5 PE=1 SV=3	1072	SLISKVTDRAND
IGVLLTDNYNSF	sp|P15423|SPIKE_CVH22	511	sp|Q14627|I13R2_HUMAN Interleukin-13 receptor subunit alpha-2 OS=Homo sapiens OX=9606 GN=IL13RA2 PE=1 SV=1	161	IGVLLDTNYNLF
LNSAKPRPLVSS	sp|P0C6U2|R1A_CVH22	1903	sp|P41229|KDM5C_HUMAN Lysine-specific demethylase 5C OS=Homo sapiens OX=9606 GN=KDM5C PE=1 SV=2	1167	TNSAKPSPLASS
NSVSDDCKVLLL	sp|P0C6U2|R1A_CVH22	351	sp|Q9P225|DYH2_HUMAN Dynein heavy chain 2, axonemal OS=Homo sapiens OX=9606 GN=DNAH2 PE=1 SV=3	2179	NSVMDDNKVLTL
NNPTIIRSMRHL	sp|P0C6U2|R1A_CVH22	3659	sp|Q9P0X4|CAC1I_HUMAN Voltage-dependent T-type calcium channel subunit alpha-1I OS=Homo sapiens OX=9606 GN=CACNA1I PE=1 SV=1	1579	INPTIIRIMRVL
NNPTIIRSMRHL	sp|P0C6U2|R1A_CVH22	3659	tr|H3BUA8|H3BUA8_HUMAN Voltage-dependent T-type calcium channel subunit alpha-1H (Fragment) OS=Homo sapiens OX=9606 GN=CACNA1H PE=1 SV=1	451	INPTIIRIMRVL
NNPTIIRSMRHL	sp|P0C6U2|R1A_CVH22	3659	tr|H3BMW6|H3BMW6_HUMAN Voltage-dependent T-type calcium channel subunit alpha-1H (Fragment) OS=Homo sapiens OX=9606 GN=CACNA1H PE=1 SV=1	445	INPTIIRIMRVL
NNPTIIRSMRHL	sp|P0C6U2|R1A_CVH22	3659	sp|O95180|CAC1H_HUMAN Voltage-dependent T-type calcium channel subunit alpha-1H OS=Homo sapiens OX=9606 GN=CACNA1H PE=1 SV=4	1709	INPTIIRIMRVL
NNPTIIRSMRHL	sp|P0C6U2|R1A_CVH22	3659	tr|H3BNT0|H3BNT0_HUMAN Voltage-dependent T-type calcium channel subunit alpha-1H (Fragment) OS=Homo sapiens OX=9606 GN=CACNA1H PE=1 SV=1	456	INPTIIRIMRVL
NNPTIIRSMRHL	sp|P0C6U2|R1A_CVH22	3659	tr|A0A1W2PR14|A0A1W2PR14_HUMAN Voltage-dependent T-type calcium channel subunit alpha-1H OS=Homo sapiens OX=9606 GN=CACNA1H PE=1 SV=1	1696	INPTIIRIMRVL
NNPTIIRSMRHL	sp|P0C6U2|R1A_CVH22	3659	sp|O43497|CAC1G_HUMAN Voltage-dependent T-type calcium channel subunit alpha-1G OS=Homo sapiens OX=9606 GN=CACNA1G PE=1 SV=3	1703	INPTIIRIMRVL
SDAAVHPSVQAC	sp|P0C6U2|R1A_CVH22	641	sp|Q7L5N1|CSN6_HUMAN COP9 signalosome complex subunit 6 OS=Homo sapiens OX=9606 GN=COPS6 PE=1 SV=1	22	VDAAVVPSVMAC
