query	query_seqname	query_start	target_seqname	target_start	target
NSSVSFDDNDFG	tr|Q6TUZ1|Q6TUZ1_YMTV5	2	sp|Q7Z4H7|HAUS6_HUMAN HAUS augmin-like complex subunit 6 OS=Homo sapiens OX=9606 GN=HAUS6 PE=1 SV=2	763	ISSKSFKDNDFG
NSSVSFDDNDFG	tr|Q6TUZ1|Q6TUZ1_YMTV5	2	tr|Q5VY60|Q5VY60_HUMAN HAUS augmin-like complex subunit 6 OS=Homo sapiens OX=9606 GN=HAUS6 PE=1 SV=1	627	ISSKSFKDNDFG
NNKLYAIGGAYD	tr|Q6TUZ3|Q6TUZ3_YMTV5	346	sp|Q9C0H6|KLHL4_HUMAN Kelch-like protein 4 OS=Homo sapiens OX=9606 GN=KLHL4 PE=1 SV=2	569	NNKLYAIGGRDG
MKLDKKLNEILR	tr|Q6TUX6|Q6TUX6_YMTV5	96	tr|G3V5E2|G3V5E2_HUMAN Sec1 family domain-containing protein 1 (Fragment) OS=Homo sapiens OX=9606 GN=SCFD1 PE=1 SV=1	64	VKLDKKLRENLR
MKLDKKLNEILR	tr|Q6TUX6|Q6TUX6_YMTV5	96	sp|Q8WVM8|SCFD1_HUMAN Sec1 family domain-containing protein 1 OS=Homo sapiens OX=9606 GN=SCFD1 PE=1 SV=4	223	VKLDKKLRENLR
MKLDKKLNEILR	tr|Q6TUX6|Q6TUX6_YMTV5	96	tr|H0YJY1|H0YJY1_HUMAN Sec1 family domain-containing protein 1 (Fragment) OS=Homo sapiens OX=9606 GN=SCFD1 PE=1 SV=1	78	VKLDKKLRENLR
SNKDLTSSFIQS	tr|Q6TUS9|Q6TUS9_YMTV5	187	sp|Q9Y6Y1|CMTA1_HUMAN Calmodulin-binding transcription activator 1 OS=Homo sapiens OX=9606 GN=CAMTA1 PE=1 SV=4	591	SNKDYTSSFSQT
QTEILSISIEEV	sp|Q6TUY0|PAP1_YMTV5	358	sp|Q4G0P3|HYDIN_HUMAN Hydrocephalus-inducing protein homolog OS=Homo sapiens OX=9606 GN=HYDIN PE=1 SV=3	1318	QNEMLSIGIEEV
KCTIEKLNEKAL	tr|Q6TUY7|Q6TUY7_YMTV5	259	tr|B1AH78|B1AH78_HUMAN Ras-related C3 botulinum toxin substrate 2 (Fragment) OS=Homo sapiens OX=9606 GN=RAC2 PE=1 SV=1	123	KDTIEKLKEKKL
KCTIEKLNEKAL	tr|Q6TUY7|Q6TUY7_YMTV5	259	tr|B1AH77|B1AH77_HUMAN Ras-related C3 botulinum toxin substrate 2 OS=Homo sapiens OX=9606 GN=RAC2 PE=1 SV=1	79	KDTIEKLKEKKL
KCTIEKLNEKAL	tr|Q6TUY7|Q6TUY7_YMTV5	259	sp|P15153|RAC2_HUMAN Ras-related C3 botulinum toxin substrate 2 OS=Homo sapiens OX=9606 GN=RAC2 PE=1 SV=1	123	KDTIEKLKEKKL
KCTIEKLNEKAL	tr|Q6TUY7|Q6TUY7_YMTV5	259	tr|B1AH80|B1AH80_HUMAN Ras-related C3 botulinum toxin substrate 2 OS=Homo sapiens OX=9606 GN=RAC2 PE=1 SV=1	116	KDTIEKLKEKKL
KCTIEKLNEKAL	tr|Q6TUY7|Q6TUY7_YMTV5	259	sp|P63000|RAC1_HUMAN Ras-related C3 botulinum toxin substrate 1 OS=Homo sapiens OX=9606 GN=RAC1 PE=1 SV=1	123	KDTIEKLKEKKL
NSTSKRITRTFN	tr|Q6TUS9|Q6TUS9_YMTV5	13	tr|V9GYK2|V9GYK2_HUMAN Heterogeneous nuclear ribonucleoprotein L-like OS=Homo sapiens OX=9606 GN=HNRNPLL PE=1 SV=1	147	YSTSKRITRPGN
NSTSKRITRTFN	tr|Q6TUS9|Q6TUS9_YMTV5	13	tr|C9IYN3|C9IYN3_HUMAN Heterogeneous nuclear ribonucleoprotein L-like OS=Homo sapiens OX=9606 GN=HNRNPLL PE=1 SV=2	142	YSTSKRITRPGN
NSTSKRITRTFN	tr|Q6TUS9|Q6TUS9_YMTV5	13	tr|B7WPG3|B7WPG3_HUMAN Heterogeneous nuclear ribonucleoprotein L-like OS=Homo sapiens OX=9606 GN=HNRNPLL PE=1 SV=1	147	YSTSKRITRPGN
NSTSKRITRTFN	tr|Q6TUS9|Q6TUS9_YMTV5	13	tr|C9JJZ7|C9JJZ7_HUMAN Heterogeneous nuclear ribonucleoprotein L-like (Fragment) OS=Homo sapiens OX=9606 GN=HNRNPLL PE=1 SV=1	86	YSTSKRITRPGN
NSTSKRITRTFN	tr|Q6TUS9|Q6TUS9_YMTV5	13	sp|Q8WVV9|HNRLL_HUMAN Heterogeneous nuclear ribonucleoprotein L-like OS=Homo sapiens OX=9606 GN=HNRNPLL PE=1 SV=1	147	YSTSKRITRPGN
NSTSKRITRTFN	tr|Q6TUS9|Q6TUS9_YMTV5	13	tr|H7BXH8|H7BXH8_HUMAN Heterogeneous nuclear ribonucleoprotein L-like (Fragment) OS=Homo sapiens OX=9606 GN=HNRNPLL PE=1 SV=1	82	YSTSKRITRPGN
IFKEDIPSPSSF	tr|Q6TUU8|Q6TUU8_YMTV5	117	sp|Q9NZA1|CLIC5_HUMAN Chloride intracellular channel protein 5 OS=Homo sapiens OX=9606 GN=CLIC5 PE=1 SV=3	130	VMKEDLPSPSSF
LKTSLVIMLCLT	tr|Q6TUX9|Q6TUX9_YMTV5	357	sp|Q5JX69|F209B_HUMAN Protein FAM209B OS=Homo sapiens OX=9606 GN=FAM209B PE=2 SV=1	4	LKSSLVLLLCLT
LKTSLVIMLCLT	tr|Q6TUX9|Q6TUX9_YMTV5	357	sp|Q5JX71|F209A_HUMAN Protein FAM209A OS=Homo sapiens OX=9606 GN=FAM209A PE=1 SV=1	4	LKSSLVLLLCLT
SINTSTITLRTS	tr|Q6TUS4|Q6TUS4_YMTV5	159	tr|A0A087WVZ6|A0A087WVZ6_HUMAN Protein kinase C-binding protein 1 OS=Homo sapiens OX=9606 GN=ZMYND8 PE=1 SV=2	827	SPSTSTITLVTS
SINTSTITLRTS	tr|Q6TUS4|Q6TUS4_YMTV5	159	sp|Q9ULU4|PKCB1_HUMAN Protein kinase C-binding protein 1 OS=Homo sapiens OX=9606 GN=ZMYND8 PE=1 SV=2	878	SPSTSTITLVTS
SINTSTITLRTS	tr|Q6TUS4|Q6TUS4_YMTV5	159	tr|A0A087WYS3|A0A087WYS3_HUMAN Protein kinase C-binding protein 1 OS=Homo sapiens OX=9606 GN=ZMYND8 PE=1 SV=1	751	SPSTSTITLVTS
SINTSTITLRTS	tr|Q6TUS4|Q6TUS4_YMTV5	159	tr|H7C4X9|H7C4X9_HUMAN Protein kinase C-binding protein 1 (Fragment) OS=Homo sapiens OX=9606 GN=ZMYND8 PE=1 SV=2	759	SPSTSTITLVTS
ESESLPVAPANT	sp|Q90033|KITH_YMTV5	56	sp|A8MW95|BECN2_HUMAN Beclin-2 OS=Homo sapiens OX=9606 GN=BECN2 PE=1 SV=2	22	ESRSLPAAPAPT
IPVLKVFIRCGV	tr|Q6TUM8|Q6TUM8_YMTV5	9	tr|H0YJ47|H0YJ47_HUMAN AP-1 complex subunit gamma-like 2 (Fragment) OS=Homo sapiens OX=9606 GN=AP1G2 PE=1 SV=1	129	IPDLKVFEREGV
IPVLKVFIRCGV	tr|Q6TUM8|Q6TUM8_YMTV5	9	sp|O75843|AP1G2_HUMAN AP-1 complex subunit gamma-like 2 OS=Homo sapiens OX=9606 GN=AP1G2 PE=1 SV=1	667	IPDLKVFEREGV
KLKQNVGVFGSE	tr|Q6TUW4|Q6TUW4_YMTV5	145	tr|A8K0C1|A8K0C1_HUMAN Threonine synthase-like 2 OS=Homo sapiens OX=9606 GN=THNSL2 PE=1 SV=1	23	VLKQNVHVFGVE
KLKQNVGVFGSE	tr|Q6TUW4|Q6TUW4_YMTV5	145	sp|Q86YJ6|THNS2_HUMAN Threonine synthase-like 2 OS=Homo sapiens OX=9606 GN=THNSL2 PE=2 SV=3	181	VLKQNVHVFGVE
KLKQNVGVFGSE	tr|Q6TUW4|Q6TUW4_YMTV5	145	tr|C9JU10|C9JU10_HUMAN Threonine synthase-like 2 OS=Homo sapiens OX=9606 GN=THNSL2 PE=1 SV=1	149	VLKQNVHVFGVE
VEEKQNIFYFLK	sp|Q9QB84|ETF2_YMTV5	31	tr|A0A0J9YVZ0|A0A0J9YVZ0_HUMAN Putative speedy protein E16 OS=Homo sapiens OX=9606 GN=SPDYE16 PE=3 SV=1	223	EDPKQNIFYFLK
VEEKQNIFYFLK	sp|Q9QB84|ETF2_YMTV5	31	tr|A0A0J9YYF2|A0A0J9YYF2_HUMAN Putative speedy protein E16 OS=Homo sapiens OX=9606 GN=SPDYE16 PE=3 SV=1	223	EDPKQNIFYFLK
IQDLKIFGYISR	tr|Q6TUY2|Q6TUY2_YMTV5	37	tr|E9PSG0|E9PSG0_HUMAN Carboxyl-terminal PDZ ligand of neuronal nitric oxide synthase protein OS=Homo sapiens OX=9606 GN=NOS1AP PE=1 SV=1	118	SQDLKIFSYIAR
IQDLKIFGYISR	tr|Q6TUY2|Q6TUY2_YMTV5	37	sp|O75052|CAPON_HUMAN Carboxyl-terminal PDZ ligand of neuronal nitric oxide synthase protein OS=Homo sapiens OX=9606 GN=NOS1AP PE=1 SV=3	123	SQDLKIFSYIAR
IIMSTLIYVVGG	tr|Q6TUZ3|Q6TUZ3_YMTV5	295	sp|Q9UGH3|S23A2_HUMAN Solute carrier family 23 member 2 OS=Homo sapiens OX=9606 GN=SLC23A2 PE=1 SV=1	219	IIMSSLIEVVIG
LVKKLNKLDASA	tr|Q6TUU2|Q6TUU2_YMTV5	133	tr|X6R9L0|X6R9L0_HUMAN DnaJ homolog subfamily C member 3 OS=Homo sapiens OX=9606 GN=DNAJC3 PE=1 SV=1	213	QVKKLNKLIESA
LVKKLNKLDASA	tr|Q6TUU2|Q6TUU2_YMTV5	133	sp|Q13217|DNJC3_HUMAN DnaJ homolog subfamily C member 3 OS=Homo sapiens OX=9606 GN=DNAJC3 PE=1 SV=1	264	QVKKLNKLIESA
GGLEILTIHKKN	tr|Q6TUQ3|Q6TUQ3_YMTV5	769	sp|P55072|TERA_HUMAN Transitional endoplasmic reticulum ATPase OS=Homo sapiens OX=9606 GN=VCP PE=1 SV=4	376	GRLEILQIHTKN
FVKDPPQCQYFI	tr|Q6TV03|Q6TV03_YMTV5	45	tr|C9J3B7|C9J3B7_HUMAN Wiskott-Aldrich syndrome protein (Fragment) OS=Homo sapiens OX=9606 GN=WAS PE=1 SV=8	74	FVKDNPQKSYFI
FVKDPPQCQYFI	tr|Q6TV03|Q6TV03_YMTV5	45	sp|P42768|WASP_HUMAN Wiskott-Aldrich syndrome protein OS=Homo sapiens OX=9606 GN=WAS PE=1 SV=4	74	FVKDNPQKSYFI
KNLPDVLAESLQ	tr|Q6TUR8|Q6TUR8_YMTV5	435	sp|Q9H3L0|MMAD_HUMAN Cobalamin trafficking protein CblD OS=Homo sapiens OX=9606 GN=MMADHC PE=1 SV=2	97	KTLPDVLAEPLS
KNLPDVLAESLQ	tr|Q6TUR8|Q6TUR8_YMTV5	435	tr|F8WEC0|F8WEC0_HUMAN Cobalamin-trafficking protein CblD OS=Homo sapiens OX=9606 GN=MMADHC PE=1 SV=1	97	KTLPDVLAEPLS
TPNAGNPMDVDE	tr|Q6TUR8|Q6TUR8_YMTV5	53	sp|Q96K78|AGRG7_HUMAN Adhesion G-protein coupled receptor G7 OS=Homo sapiens OX=9606 GN=ADGRG7 PE=1 SV=2	109	TPNAGNPMAVRL
SGMAESLNVDNA	tr|Q6TUX9|Q6TUX9_YMTV5	195	tr|D6REY1|D6REY1_HUMAN Chitotriosidase-1 OS=Homo sapiens OX=9606 GN=CHIT1 PE=1 SV=1	235	SGAAASLNVDAA
SGMAESLNVDNA	tr|Q6TUX9|Q6TUX9_YMTV5	195	sp|Q13231|CHIT1_HUMAN Chitotriosidase-1 OS=Homo sapiens OX=9606 GN=CHIT1 PE=1 SV=1	235	SGAAASLNVDAA
DKELFSNKEDSE	tr|Q6TUS0|Q6TUS0_YMTV5	171	sp|O00566|MPP10_HUMAN U3 small nucleolar ribonucleoprotein protein MPP10 OS=Homo sapiens OX=9606 GN=MPHOSPH10 PE=1 SV=2	284	DDELDSNKEDDE
DKELFSNKEDSE	tr|Q6TUS0|Q6TUS0_YMTV5	171	tr|U3KQ48|U3KQ48_HUMAN U3 small nucleolar ribonucleoprotein protein MPP10 OS=Homo sapiens OX=9606 GN=MPHOSPH10 PE=1 SV=1	284	DDELDSNKEDDE
SILSDYSNLDKS	tr|Q6TUN5|Q6TUN5_YMTV5	53	sp|Q96M86|DNHD1_HUMAN Dynein heavy chain domain-containing protein 1 OS=Homo sapiens OX=9606 GN=DNHD1 PE=2 SV=2	1206	FILSDYSNLQDS
SILSDYSNLDKS	tr|Q6TUN5|Q6TUN5_YMTV5	53	sp|Q9Y4H2|IRS2_HUMAN Insulin receptor substrate 2 OS=Homo sapiens OX=9606 GN=IRS2 PE=1 SV=2	973	SPLSDYMNLDFS
DLYIQGVTVSSL	tr|Q6TUV1|Q6TUV1_YMTV5	259	tr|E9PLY0|E9PLY0_HUMAN Microtubule-actin cross-linking factor 1, isoforms 1/2/3/5 OS=Homo sapiens OX=9606 GN=MACF1 PE=1 SV=1	279	DLSISGVTVSIL
DLYIQGVTVSSL	tr|Q6TUV1|Q6TUV1_YMTV5	259	tr|E9PNZ4|E9PNZ4_HUMAN Microtubule-actin cross-linking factor 1, isoforms 1/2/3/5 (Fragment) OS=Homo sapiens OX=9606 GN=MACF1 PE=1 SV=1	279	DLSISGVTVSIL
FEFAENLSLEGK	tr|Q6TUZ2|Q6TUZ2_YMTV5	283	sp|P31350|RIR2_HUMAN Ribonucleoside-diphosphate reductase subunit M2 OS=Homo sapiens OX=9606 GN=RRM2 PE=1 SV=1	347	FDFMENISLEGK
FEFAENLSLEGK	tr|Q6TUZ2|Q6TUZ2_YMTV5	283	sp|Q7LG56|RIR2B_HUMAN Ribonucleoside-diphosphate reductase subunit M2 B OS=Homo sapiens OX=9606 GN=RRM2B PE=1 SV=1	309	FDFMENISLEGK
FEFAENLSLEGK	tr|Q6TUZ2|Q6TUZ2_YMTV5	283	tr|A0A0C4DGZ6|A0A0C4DGZ6_HUMAN Ribonucleoside-diphosphate reductase subunit M2 B OS=Homo sapiens OX=9606 GN=RRM2B PE=1 SV=1	255	FDFMENISLEGK
FEFAENLSLEGK	tr|Q6TUZ2|Q6TUZ2_YMTV5	283	tr|H0YAV1|H0YAV1_HUMAN Ribonucleoside-diphosphate reductase subunit M2 B (Fragment) OS=Homo sapiens OX=9606 GN=RRM2B PE=1 SV=1	366	FDFMENISLEGK
FEFAENLSLEGK	tr|Q6TUZ2|Q6TUZ2_YMTV5	283	tr|D6RAC0|D6RAC0_HUMAN T-complex protein 11 homolog (Fragment) OS=Homo sapiens OX=9606 GN=TCP11 PE=1 SV=1	10	FPTAMNLSLEGK
RLNCSGNNVINP	tr|Q6TUV4|Q6TUV4_YMTV5	282	sp|Q8NGL3|OR5DE_HUMAN Olfactory receptor 5D14 OS=Homo sapiens OX=9606 GN=OR5D14 PE=3 SV=1	167	RLNFSGPNVINH
SSNDSTDSVIEY	tr|Q6TUV4|Q6TUV4_YMTV5	190	tr|E9PES4|E9PES4_HUMAN Kinesin-like protein OS=Homo sapiens OX=9606 GN=KIF3A PE=1 SV=1	415	SSSDSTCSVIEK
SSNDSTDSVIEY	tr|Q6TUV4|Q6TUV4_YMTV5	190	tr|A0A087X011|A0A087X011_HUMAN Kinesin-like protein OS=Homo sapiens OX=9606 GN=KIF3A PE=1 SV=1	414	SSSDSTCSVIEK
LSVYTKDLLLSD	sp|Q9QB92|MCES_YMTV5	61	sp|O43187|IRAK2_HUMAN Interleukin-1 receptor-associated kinase-like 2 OS=Homo sapiens OX=9606 GN=IRAK2 PE=1 SV=2	420	SPVYLKDLLLSD
KSLEDIKARLKS	tr|Q6TUT9|Q6TUT9_YMTV5	15	sp|Q9UDT6|CLIP2_HUMAN CAP-Gly domain-containing linker protein 2 OS=Homo sapiens OX=9606 GN=CLIP2 PE=1 SV=1	626	KSLEDLKATLNS
LILIKNCLVYNI	tr|Q6TUM6|Q6TUM6_YMTV5	325	sp|O43264|ZW10_HUMAN Centromere/kinetochore protein zw10 homolog OS=Homo sapiens OX=9606 GN=ZW10 PE=1 SV=3	340	ECLIKNCLVYSI
KSVTLKSESGVD	sp|Q9QB84|ETF2_YMTV5	609	sp|O00444|PLK4_HUMAN Serine/threonine-protein kinase PLK4 OS=Homo sapiens OX=9606 GN=PLK4 PE=1 SV=3	748	KSYTLKSESEVN
KSVTLKSESGVD	sp|Q9QB84|ETF2_YMTV5	609	tr|J3KR84|J3KR84_HUMAN Polo-like kinase 4 OS=Homo sapiens OX=9606 GN=PLK4 PE=1 SV=1	687	KSYTLKSESEVN
KSVTLKSESGVD	sp|Q9QB84|ETF2_YMTV5	609	tr|J3KR82|J3KR82_HUMAN Polo-like kinase 4 OS=Homo sapiens OX=9606 GN=PLK4 PE=1 SV=1	670	KSYTLKSESEVN
TGKIFIPLPFGG	tr|Q6TUW4|Q6TUW4_YMTV5	473	sp|P04114|APOB_HUMAN Apolipoprotein B-100 OS=Homo sapiens OX=9606 GN=APOB PE=1 SV=2	1293	SLKIEIPLPFGG
ESQSEPDIKEIP	tr|Q6TUU0|Q6TUU0_YMTV5	153	sp|Q8N103|TAGAP_HUMAN T-cell activation Rho GTPase-activating protein OS=Homo sapiens OX=9606 GN=TAGAP PE=1 SV=1	23	ECQSEGDIKEHP
ESQSEPDIKEIP	tr|Q6TUU0|Q6TUU0_YMTV5	153	tr|A0A2R8YEB9|A0A2R8YEB9_HUMAN T-cell activation Rho GTPase-activating protein OS=Homo sapiens OX=9606 GN=TAGAP PE=4 SV=1	23	ECQSEGDIKEHP
LLRRALVDKNFV	tr|Q6TV05|Q6TV05_YMTV5	235	tr|F8VRB8|F8VRB8_HUMAN Mediator of RNA polymerase II transcription subunit 13-like (Fragment) OS=Homo sapiens OX=9606 GN=MED13L PE=1 SV=2	119	LLERCLMDKNFV
LLRRALVDKNFV	tr|Q6TV05|Q6TV05_YMTV5	235	tr|A0A3B3IRX3|A0A3B3IRX3_HUMAN Mediator of RNA polymerase II transcription subunit 13 OS=Homo sapiens OX=9606 GN=MED13L PE=1 SV=1	129	LLERCLMDKNFV
LLRRALVDKNFV	tr|Q6TV05|Q6TV05_YMTV5	235	sp|Q71F56|MD13L_HUMAN Mediator of RNA polymerase II transcription subunit 13-like OS=Homo sapiens OX=9606 GN=MED13L PE=1 SV=1	129	LLERCLMDKNFV
LLRRALVDKNFV	tr|Q6TV05|Q6TV05_YMTV5	235	tr|A0A3B3IS48|A0A3B3IS48_HUMAN Mediator of RNA polymerase II transcription subunit 13-like (Fragment) OS=Homo sapiens OX=9606 GN=MED13L PE=1 SV=1	99	LLERCLMDKNFV
IPLLSNVSIEDV	tr|Q6TUN5|Q6TUN5_YMTV5	173	sp|Q5T5Y3|CAMP1_HUMAN Calmodulin-regulated spectrin-associated protein 1 OS=Homo sapiens OX=9606 GN=CAMSAP1 PE=1 SV=2	527	KSLLSNVSIEDE
KRISKKQIKKAA	tr|Q6TUR6|Q6TUR6_YMTV5	136	sp|Q8N7X8|SIGL1_HUMAN SIGLEC family-like protein 1 OS=Homo sapiens OX=9606 GN=SIGLECL1 PE=1 SV=1	139	KHIRKKQAKKAA
KRISKKQIKKAA	tr|Q6TUR6|Q6TUR6_YMTV5	136	tr|B7ZLS6|B7ZLS6_HUMAN FLJ40235 protein OS=Homo sapiens OX=9606 GN=SIGLECL1 PE=2 SV=1	45	KHIRKKQAKKAA
NLKKSLVSFKNE	tr|Q6TUQ3|Q6TUQ3_YMTV5	51	tr|A0A3B3ITA9|A0A3B3ITA9_HUMAN Lysine-specific demethylase 5B (Fragment) OS=Homo sapiens OX=9606 GN=KDM5B PE=1 SV=1	179	NKKKSLVSFKAL
NLKKSLVSFKNE	tr|Q6TUQ3|Q6TUQ3_YMTV5	51	tr|B3KV94|B3KV94_HUMAN Jumonji, AT rich interactive domain 1B (RBP2-like), isoform CRA_a (Fragment) OS=Homo sapiens OX=9606 GN=KDM5B PE=1 SV=1	613	NKKKSLVSFKAL
NLKKSLVSFKNE	tr|Q6TUQ3|Q6TUQ3_YMTV5	51	tr|A0A3B3ITE7|A0A3B3ITE7_HUMAN [Histone H3]-trimethyl-L-lysine(4) demethylase OS=Homo sapiens OX=9606 GN=KDM5B PE=1 SV=1	771	NKKKSLVSFKAL
NLKKSLVSFKNE	tr|Q6TUQ3|Q6TUQ3_YMTV5	51	tr|A0A3B3ISE6|A0A3B3ISE6_HUMAN [Histone H3]-trimethyl-L-lysine(4) demethylase OS=Homo sapiens OX=9606 GN=KDM5B PE=1 SV=1	730	NKKKSLVSFKAL
NLKKSLVSFKNE	tr|Q6TUQ3|Q6TUQ3_YMTV5	51	tr|A0A3B3IS40|A0A3B3IS40_HUMAN [Histone H3]-trimethyl-L-lysine(4) demethylase OS=Homo sapiens OX=9606 GN=KDM5B PE=1 SV=1	766	NKKKSLVSFKAL
NLKKSLVSFKNE	tr|Q6TUQ3|Q6TUQ3_YMTV5	51	tr|A0A3B3ITJ7|A0A3B3ITJ7_HUMAN [Histone H3]-trimethyl-L-lysine(4) demethylase OS=Homo sapiens OX=9606 GN=KDM5B PE=1 SV=1	730	NKKKSLVSFKAL
NLKKSLVSFKNE	tr|Q6TUQ3|Q6TUQ3_YMTV5	51	sp|Q9UGL1|KDM5B_HUMAN Lysine-specific demethylase 5B OS=Homo sapiens OX=9606 GN=KDM5B PE=1 SV=3	771	NKKKSLVSFKAL
NLKKSLVSFKNE	tr|Q6TUQ3|Q6TUQ3_YMTV5	51	tr|A0A3B3ITA8|A0A3B3ITA8_HUMAN [Histone H3]-trimethyl-L-lysine(4) demethylase OS=Homo sapiens OX=9606 GN=KDM5B PE=1 SV=1	726	NKKKSLVSFKAL
NLKKSLVSFKNE	tr|Q6TUQ3|Q6TUQ3_YMTV5	51	tr|A0A3B3IT25|A0A3B3IT25_HUMAN [Histone H3]-trimethyl-L-lysine(4) demethylase OS=Homo sapiens OX=9606 GN=KDM5B PE=1 SV=1	771	NKKKSLVSFKAL
TKNALKFYLENQ	tr|Q6TUX5|Q6TUX5_YMTV5	455	sp|A6NFA0|F205C_HUMAN Protein FAM205C OS=Homo sapiens OX=9606 GN=FAM205C PE=3 SV=2	237	TKNNSKFVLENQ
KLKTTSGLMFFR	tr|Q6TUR8|Q6TUR8_YMTV5	190	tr|Q5FC05|Q5FC05_HUMAN IL6ST nirs variant 3 OS=Homo sapiens OX=9606 GN=IL6ST PE=1 SV=1	159	KLKNTSGLMFQI
LTTGLVYGEDIS	sp|Q9QB97|ETF1_YMTV5	308	tr|H7C4J9|H7C4J9_HUMAN TSC22 domain family protein 1 (Fragment) OS=Homo sapiens OX=9606 GN=TSC22D1 PE=1 SV=1	110	LTTPLVDGEDES
LTTGLVYGEDIS	sp|Q9QB97|ETF1_YMTV5	308	sp|Q15714|T22D1_HUMAN TSC22 domain family protein 1 OS=Homo sapiens OX=9606 GN=TSC22D1 PE=1 SV=3	960	LTTPLVDGEDES
LPKLLRKFLIDK	tr|Q6TUX3|Q6TUX3_YMTV5	624	sp|Q16099|GRIK4_HUMAN Glutamate receptor ionotropic, kainate 4 OS=Homo sapiens OX=9606 GN=GRIK4 PE=2 SV=2	175	LEKLLRQFLISK
RPFLRVLIELII	tr|Q6TUV2|Q6TUV2_YMTV5	39	sp|Q14571|ITPR2_HUMAN Inositol 1,4,5-trisphosphate receptor type 2 OS=Homo sapiens OX=9606 GN=ITPR2 PE=1 SV=2	1055	RTFLRVLIHLIM
ETKAEPYYLKAK	tr|Q6TUW8|Q6TUW8_YMTV5	87	sp|P19174|PLCG1_HUMAN 1-phosphatidylinositol 4,5-bisphosphate phosphodiesterase gamma-1 OS=Homo sapiens OX=9606 GN=PLCG1 PE=1 SV=1	985	ETKAEKYVNKAK
LIIDLFSNYKLG	tr|Q6TUT5|Q6TUT5_YMTV5	117	sp|O94822|LTN1_HUMAN E3 ubiquitin-protein ligase listerin OS=Homo sapiens OX=9606 GN=LTN1 PE=1 SV=6	1648	LIIQLPSNYPLG
KNKILSKAENFL	tr|Q6TUU1|Q6TUU1_YMTV5	249	sp|Q96RS0|TGS1_HUMAN Trimethylguanosine synthase OS=Homo sapiens OX=9606 GN=TGS1 PE=1 SV=3	508	KSKILSKVEKFL
KRHKKPKVLISS	tr|Q6TUQ8|Q6TUQ8_YMTV5	9	sp|Q9H2F5|EPC1_HUMAN Enhancer of polycomb homolog 1 OS=Homo sapiens OX=9606 GN=EPC1 PE=1 SV=1	337	KYEKKPKVLPSS
KRHKKPKVLISS	tr|Q6TUQ8|Q6TUQ8_YMTV5	9	tr|A0A590UJN0|A0A590UJN0_HUMAN Enhancer of polycomb homolog OS=Homo sapiens OX=9606 GN=EPC1 PE=1 SV=1	337	KYEKKPKVLPSS
IKGKTQYLESLS	tr|Q6TUW3|Q6TUW3_YMTV5	73	sp|Q9UKI2|BORG2_HUMAN Cdc42 effector protein 3 OS=Homo sapiens OX=9606 GN=CDC42EP3 PE=1 SV=1	214	IKGKTKSEESLS
LENPSKKKIIII	tr|Q6TUT6|Q6TUT6_YMTV5	582	tr|H7C0N3|H7C0N3_HUMAN Cortactin-binding protein 2 (Fragment) OS=Homo sapiens OX=9606 GN=CTTNBP2 PE=1 SV=1	170	KQSPSKKKIIII
LENPSKKKIIII	tr|Q6TUT6|Q6TUT6_YMTV5	582	tr|H0Y448|H0Y448_HUMAN Cortactin-binding protein 2 (Fragment) OS=Homo sapiens OX=9606 GN=CTTNBP2 PE=1 SV=1	673	KQSPSKKKIIII
LENPSKKKIIII	tr|Q6TUT6|Q6TUT6_YMTV5	582	sp|Q8WZ74|CTTB2_HUMAN Cortactin-binding protein 2 OS=Homo sapiens OX=9606 GN=CTTNBP2 PE=1 SV=1	1185	KQSPSKKKIIII
SLNKNDVSIDEV	tr|Q6TUR7|Q6TUR7_YMTV5	200	sp|Q8TE60|ATS18_HUMAN A disintegrin and metalloproteinase with thrombospondin motifs 18 OS=Homo sapiens OX=9606 GN=ADAMTS18 PE=1 SV=3	708	SPNKNDVCIDGV
VVKKIRNMTKFI	sp|Q6TUQ9|A18_YMTV5	362	sp|P08254|MMP3_HUMAN Stromelysin-1 OS=Homo sapiens OX=9606 GN=MMP3 PE=1 SV=2	60	VVKKIREMQKFL
LLVLKLNRKVID	tr|Q6TUX3|Q6TUX3_YMTV5	242	sp|Q13641|TPBG_HUMAN Trophoblast glycoprotein OS=Homo sapiens OX=9606 GN=TPBG PE=1 SV=1	371	LLVLYLNRKGIK
LLVLKLNRKVID	tr|Q6TUX3|Q6TUX3_YMTV5	242	tr|F8VYZ5|F8VYZ5_HUMAN Leucine-rich repeats and immunoglobulin-like domains protein 3 (Fragment) OS=Homo sapiens OX=9606 GN=LRIG3 PE=1 SV=1	101	LLVLKLNRNRIS
LLVLKLNRKVID	tr|Q6TUX3|Q6TUX3_YMTV5	242	tr|C9K080|C9K080_HUMAN Leucine-rich repeats and immunoglobulin-like domains protein 3 OS=Homo sapiens OX=9606 GN=LRIG3 PE=1 SV=2	194	LLVLKLNRNRIS
LLVLKLNRKVID	tr|Q6TUX3|Q6TUX3_YMTV5	242	sp|Q6UXM1|LRIG3_HUMAN Leucine-rich repeats and immunoglobulin-like domains protein 3 OS=Homo sapiens OX=9606 GN=LRIG3 PE=1 SV=1	194	LLVLKLNRNRIS
QMSLTKIELDSM	tr|Q6TUV4|Q6TUV4_YMTV5	267	tr|A0A0C4DGH6|A0A0C4DGH6_HUMAN UHRF1-binding protein 1-like OS=Homo sapiens OX=9606 GN=UHRF1BP1L PE=1 SV=1	760	QMSLDTISLDSM
QMSLTKIELDSM	tr|Q6TUV4|Q6TUV4_YMTV5	267	sp|A0JNW5|UH1BL_HUMAN UHRF1-binding protein 1-like OS=Homo sapiens OX=9606 GN=UHRF1BP1L PE=1 SV=2	1110	QMSLDTISLDSM
DETLIVTTLSLK	tr|Q6TUX0|Q6TUX0_YMTV5	2	sp|Q8WWL7|CCNB3_HUMAN G2/mitotic-specific cyclin-B3 OS=Homo sapiens OX=9606 GN=CCNB3 PE=1 SV=2	168	DETLINKSLSLK
KNTLSSVFEEID	tr|Q6TUW8|Q6TUW8_YMTV5	163	tr|F5GWB9|F5GWB9_HUMAN Spermatogenesis-associated protein 22 OS=Homo sapiens OX=9606 GN=SPATA22 PE=1 SV=1	274	KNTLPCVFYEID
KNTLSSVFEEID	tr|Q6TUW8|Q6TUW8_YMTV5	163	sp|Q8NHS9|SPT22_HUMAN Spermatogenesis-associated protein 22 OS=Homo sapiens OX=9606 GN=SPATA22 PE=1 SV=2	290	KNTLPCVFYEID
MIFLNTLLEGTK	tr|Q6TUX3|Q6TUX3_YMTV5	696	sp|Q8WW52|F151A_HUMAN Protein FAM151A OS=Homo sapiens OX=9606 GN=FAM151A PE=2 SV=2	366	MILLNTGLEGTV
LSGKNLPDVLAE	tr|Q6TUR8|Q6TUR8_YMTV5	432	sp|Q9H3L0|MMAD_HUMAN Cobalamin trafficking protein CblD OS=Homo sapiens OX=9606 GN=MMADHC PE=1 SV=2	94	LVHKTLPDVLAE
LSGKNLPDVLAE	tr|Q6TUR8|Q6TUR8_YMTV5	432	tr|F8WEC0|F8WEC0_HUMAN Cobalamin-trafficking protein CblD OS=Homo sapiens OX=9606 GN=MMADHC PE=1 SV=1	94	LVHKTLPDVLAE
GKGSAVQCTICG	tr|Q6TUQ8|Q6TUQ8_YMTV5	52	sp|Q01362|FCERB_HUMAN High affinity immunoglobulin epsilon receptor subunit beta OS=Homo sapiens OX=9606 GN=MS4A2 PE=1 SV=1	192	GLGSAVSLTICG
GKGSAVQCTICG	tr|Q6TUQ8|Q6TUQ8_YMTV5	52	tr|A0A0B4J2E9|A0A0B4J2E9_HUMAN High affinity immunoglobulin epsilon receptor subunit beta OS=Homo sapiens OX=9606 GN=MS4A2 PE=1 SV=1	147	GLGSAVSLTICG
LVQLFTGEPLRI	tr|Q6TUU7|Q6TUU7_YMTV5	210	sp|Q92918|M4K1_HUMAN Mitogen-activated protein kinase kinase kinase kinase 1 OS=Homo sapiens OX=9606 GN=MAP4K1 PE=1 SV=1	487	LVKLFNGCPLRI
LVQLFTGEPLRI	tr|Q6TUU7|Q6TUU7_YMTV5	210	tr|K7EJS6|K7EJS6_HUMAN Non-specific serine/threonine protein kinase (Fragment) OS=Homo sapiens OX=9606 GN=MAP4K1 PE=1 SV=1	191	LVKLFNGCPLRI
LVQLFTGEPLRI	tr|Q6TUU7|Q6TUU7_YMTV5	210	tr|K7ER95|K7ER95_HUMAN Mitogen-activated protein kinase kinase kinase kinase 1 OS=Homo sapiens OX=9606 GN=MAP4K1 PE=1 SV=1	483	LVKLFNGCPLRI
LEILSRLEKKVS	tr|Q6TUU4|Q6TUU4_YMTV5	1256	sp|Q9Y496|KIF3A_HUMAN Kinesin-like protein KIF3A OS=Homo sapiens OX=9606 GN=KIF3A PE=1 SV=4	469	LEKLSALEKKVI
LEILSRLEKKVS	tr|Q6TUU4|Q6TUU4_YMTV5	1256	tr|J3KPF9|J3KPF9_HUMAN Kinesin-like protein OS=Homo sapiens OX=9606 GN=KIF3A PE=1 SV=1	472	LEKLSALEKKVI
LEILSRLEKKVS	tr|Q6TUU4|Q6TUU4_YMTV5	1256	tr|E9PES4|E9PES4_HUMAN Kinesin-like protein OS=Homo sapiens OX=9606 GN=KIF3A PE=1 SV=1	496	LEKLSALEKKVI
LEILSRLEKKVS	tr|Q6TUU4|Q6TUU4_YMTV5	1256	tr|A0A087X011|A0A087X011_HUMAN Kinesin-like protein OS=Homo sapiens OX=9606 GN=KIF3A PE=1 SV=1	495	LEKLSALEKKVI
ISKYPESVSFKL	tr|Q6TUW4|Q6TUW4_YMTV5	81	sp|Q9UN42|AT1B4_HUMAN Protein ATP1B4 OS=Homo sapiens OX=9606 GN=ATP1B4 PE=1 SV=1	282	ISYYPESASFDL
ISKYPESVSFKL	tr|Q6TUW4|Q6TUW4_YMTV5	81	tr|B7ZKW0|B7ZKW0_HUMAN Sodium/potassium-transporting ATPase subunit beta OS=Homo sapiens OX=9606 GN=ATP1B4 PE=1 SV=1	239	ISYYPESASFDL
YNVTHKLEEAIP	tr|Q6TUT2|Q6TUT2_YMTV5	221	sp|Q8TB52|FBX30_HUMAN F-box only protein 30 OS=Homo sapiens OX=9606 GN=FBXO30 PE=1 SV=3	709	YNVVEKREEAIP
ENPSKKKIIIIE	tr|Q6TUT6|Q6TUT6_YMTV5	583	tr|H7C0N3|H7C0N3_HUMAN Cortactin-binding protein 2 (Fragment) OS=Homo sapiens OX=9606 GN=CTTNBP2 PE=1 SV=1	171	QSPSKKKIIIIL
ENPSKKKIIIIE	tr|Q6TUT6|Q6TUT6_YMTV5	583	tr|H0Y448|H0Y448_HUMAN Cortactin-binding protein 2 (Fragment) OS=Homo sapiens OX=9606 GN=CTTNBP2 PE=1 SV=1	674	QSPSKKKIIIIL
ENPSKKKIIIIE	tr|Q6TUT6|Q6TUT6_YMTV5	583	sp|Q8WZ74|CTTB2_HUMAN Cortactin-binding protein 2 OS=Homo sapiens OX=9606 GN=CTTNBP2 PE=1 SV=1	1186	QSPSKKKIIIIL
DDDTVFLTYTVV	tr|Q6TUM3|Q6TUM3_YMTV5	316	sp|Q96HR9|REEP6_HUMAN Receptor expression-enhancing protein 6 OS=Homo sapiens OX=9606 GN=REEP6 PE=1 SV=2	80	DDDTVWLTYWVV
DDDTVFLTYTVV	tr|Q6TUM3|Q6TUM3_YMTV5	316	tr|A8MXN1|A8MXN1_HUMAN Receptor expression-enhancing protein (Fragment) OS=Homo sapiens OX=9606 GN=REEP6 PE=1 SV=2	8	DDDTVWLTYWVV
YVKKSLYEKVSN	tr|Q6TUN7|Q6TUN7_YMTV5	1630	sp|A1Z1Q3|MACD2_HUMAN ADP-ribose glycohydrolase MACROD2 OS=Homo sapiens OX=9606 GN=MACROD2 PE=1 SV=2	63	QVKKSLTEKVSL
YVKKSLYEKVSN	tr|Q6TUN7|Q6TUN7_YMTV5	1630	tr|A0A2R8YFN3|A0A2R8YFN3_HUMAN ADP-ribose glycohydrolase MACROD2 OS=Homo sapiens OX=9606 GN=MACROD2 PE=1 SV=1	63	QVKKSLTEKVSL
FAASLVFLIIVV	tr|Q6TUW9|Q6TUW9_YMTV5	49	tr|B1AKC9|B1AKC9_HUMAN Receptor protein-tyrosine kinase OS=Homo sapiens OX=9606 GN=EPHB2 PE=1 SV=1	543	SAAGLVFLIAVV
FAASLVFLIIVV	tr|Q6TUW9|Q6TUW9_YMTV5	49	sp|P29323|EPHB2_HUMAN Ephrin type-B receptor 2 OS=Homo sapiens OX=9606 GN=EPHB2 PE=1 SV=5	548	SAAGLVFLIAVV
IIKTLIEDNKNI	sp|Q9QB97|ETF1_YMTV5	30	tr|H0YBA5|H0YBA5_HUMAN Protein FAM184A OS=Homo sapiens OX=9606 GN=FAM184A PE=1 SV=2	886	IIKKLIEDNKFY
IIKTLIEDNKNI	sp|Q9QB97|ETF1_YMTV5	30	tr|A0A0C4DGZ2|A0A0C4DGZ2_HUMAN Protein FAM184A OS=Homo sapiens OX=9606 GN=FAM184A PE=1 SV=1	158	IIKKLIEDNKFY
IIKTLIEDNKNI	sp|Q9QB97|ETF1_YMTV5	30	sp|Q8NB25|F184A_HUMAN Protein FAM184A OS=Homo sapiens OX=9606 GN=FAM184A PE=1 SV=3	1006	IIKKLIEDNKFY
IIKTLIEDNKNI	sp|Q9QB97|ETF1_YMTV5	30	tr|A0A087X2A7|A0A087X2A7_HUMAN Protein FAM184A OS=Homo sapiens OX=9606 GN=FAM184A PE=1 SV=1	964	IIKKLIEDNKFY
IIKTLIEDNKNI	sp|Q9QB97|ETF1_YMTV5	30	tr|B9DI78|B9DI78_HUMAN Protein FAM184A (Fragment) OS=Homo sapiens OX=9606 GN=FAM184A PE=1 SV=1	67	IIKKLIEDNKFY
KFEPDSGKMGFL	tr|Q6TUW0|Q6TUW0_YMTV5	75	sp|Q16548|B2LA1_HUMAN Bcl-2-related protein A1 OS=Homo sapiens OX=9606 GN=BCL2A1 PE=1 SV=1	147	KFEPKSGWMTFL
EKLRSIIIHEKA	tr|Q6TUN7|Q6TUN7_YMTV5	421	sp|Q8WW32|HMGB4_HUMAN High mobility group protein B4 OS=Homo sapiens OX=9606 GN=HMGB4 PE=1 SV=2	47	EKWRSISKHEKA
PISNIRISSAEN	tr|Q6TUY6|Q6TUY6_YMTV5	76	tr|F2Z2M5|F2Z2M5_HUMAN Centrosome and spindle pole-associated protein 1 OS=Homo sapiens OX=9606 GN=CSPP1 PE=1 SV=1	336	EQSNIRISSAEN
PISNIRISSAEN	tr|Q6TUY6|Q6TUY6_YMTV5	76	tr|A0A6Q8PGS3|A0A6Q8PGS3_HUMAN Centrosome and spindle pole-associated protein 1 OS=Homo sapiens OX=9606 GN=CSPP1 PE=1 SV=1	301	EQSNIRISSAEN
PISNIRISSAEN	tr|Q6TUY6|Q6TUY6_YMTV5	76	tr|A0A6Q8PHN8|A0A6Q8PHN8_HUMAN Centrosome and spindle pole-associated protein 1 OS=Homo sapiens OX=9606 GN=CSPP1 PE=1 SV=1	328	EQSNIRISSAEN
PISNIRISSAEN	tr|Q6TUY6|Q6TUY6_YMTV5	76	tr|A0A6Q8PF61|A0A6Q8PF61_HUMAN Centrosome and spindle pole-associated protein 1 OS=Homo sapiens OX=9606 GN=CSPP1 PE=1 SV=1	328	EQSNIRISSAEN
PISNIRISSAEN	tr|Q6TUY6|Q6TUY6_YMTV5	76	sp|Q1MSJ5|CSPP1_HUMAN Centrosome and spindle pole-associated protein 1 OS=Homo sapiens OX=9606 GN=CSPP1 PE=1 SV=4	372	EQSNIRISSAEN
PISNIRISSAEN	tr|Q6TUY6|Q6TUY6_YMTV5	76	tr|A0A6Q8PF96|A0A6Q8PF96_HUMAN Centrosome and spindle pole-associated protein 1 OS=Homo sapiens OX=9606 GN=CSPP1 PE=1 SV=1	301	EQSNIRISSAEN
KCLKKILRHLKS	tr|Q6TUM7|Q6TUM7_YMTV5	430	tr|A0A1W2PRR2|A0A1W2PRR2_HUMAN ATP-dependent RNA helicase DDX24 OS=Homo sapiens OX=9606 GN=DDX24 PE=1 SV=1	536	KVLKKELRHLLS
KCLKKILRHLKS	tr|Q6TUM7|Q6TUM7_YMTV5	430	sp|Q9GZR7|DDX24_HUMAN ATP-dependent RNA helicase DDX24 OS=Homo sapiens OX=9606 GN=DDX24 PE=1 SV=1	786	KVLKKELRHLLS
KCLKKILRHLKS	tr|Q6TUM7|Q6TUM7_YMTV5	430	tr|F5GYL3|F5GYL3_HUMAN ATP-dependent RNA helicase DDX24 OS=Homo sapiens OX=9606 GN=DDX24 PE=1 SV=1	536	KVLKKELRHLLS
KCLKKILRHLKS	tr|Q6TUM7|Q6TUM7_YMTV5	430	tr|G3V529|G3V529_HUMAN RNA helicase OS=Homo sapiens OX=9606 GN=DDX24 PE=1 SV=1	743	KVLKKELRHLLS
KCLKKILRHLKS	tr|Q6TUM7|Q6TUM7_YMTV5	430	tr|A0A087WXU8|A0A087WXU8_HUMAN ATP-dependent RNA helicase DDX24 OS=Homo sapiens OX=9606 GN=DDX24 PE=1 SV=1	412	KVLKKELRHLLS
LNKVNEALNVLT	tr|Q6TUY6|Q6TUY6_YMTV5	544	tr|A0A087WUA7|A0A087WUA7_HUMAN Zinc finger protein 804B OS=Homo sapiens OX=9606 GN=ZNF804B PE=4 SV=1	1252	LNEVKEALNVST
LNKVNEALNVLT	tr|Q6TUY6|Q6TUY6_YMTV5	544	sp|A4D1E1|Z804B_HUMAN Zinc finger protein 804B OS=Homo sapiens OX=9606 GN=ZNF804B PE=2 SV=2	1335	LNEVKEALNVST
VIGLRSIAQSIS	tr|Q6TUR8|Q6TUR8_YMTV5	206	tr|V9GY93|V9GY93_HUMAN GDT1 family protein (Fragment) OS=Homo sapiens OX=9606 GN=TMEM165 PE=1 SV=1	122	VIGGRMIAQKIS
VIGLRSIAQSIS	tr|Q6TUR8|Q6TUR8_YMTV5	206	sp|Q9HC07|TM165_HUMAN Transmembrane protein 165 OS=Homo sapiens OX=9606 GN=TMEM165 PE=1 SV=1	285	VIGGRMIAQKIS
VIGLRSIAQSIS	tr|Q6TUR8|Q6TUR8_YMTV5	206	tr|D6RD79|D6RD79_HUMAN GDT1 family protein OS=Homo sapiens OX=9606 GN=TMEM165 PE=1 SV=1	90	VIGGRMIAQKIS
