query	query_seqname	query_start	target_seqname	target_start	target
DNYCKGGFIRGL	tr|D9YRN2|D9YRN2_9VIRU	1609	sp|Q9ULJ7|ANR50_HUMAN Ankyrin repeat domain-containing protein 50 OS=Homo sapiens OX=9606 GN=ANKRD50 PE=1 SV=4	119	DTLCVGGFIRGL
QTAAKERRRIDL	tr|D9YRN2|D9YRN2_9VIRU	1482	sp|Q8TED9|AF1L1_HUMAN Actin filament-associated protein 1-like 1 OS=Homo sapiens OX=9606 GN=AFAP1L1 PE=1 SV=2	675	QCRAKEERRIDL
PELLDALPTLET	tr|D9YRN2|D9YRN2_9VIRU	1868	tr|X6RK58|X6RK58_HUMAN Leucine-rich repeat-containing protein 20 (Fragment) OS=Homo sapiens OX=9606 GN=LRRC20 PE=1 SV=7	113	PEQLTALPALET
PELLDALPTLET	tr|D9YRN2|D9YRN2_9VIRU	1868	tr|A0A0A0MS58|A0A0A0MS58_HUMAN Leucine rich repeat containing 20, isoform CRA_e OS=Homo sapiens OX=9606 GN=LRRC20 PE=1 SV=1	44	PEQLTALPALET
PELLDALPTLET	tr|D9YRN2|D9YRN2_9VIRU	1868	sp|Q8TCA0|LRC20_HUMAN Leucine-rich repeat-containing protein 20 OS=Homo sapiens OX=9606 GN=LRRC20 PE=1 SV=1	113	PEQLTALPALET
PELLDALPTLET	tr|D9YRN2|D9YRN2_9VIRU	1868	sp|P13224|GP1BB_HUMAN Platelet glycoprotein Ib beta chain OS=Homo sapiens OX=9606 GN=GP1BB PE=1 SV=1	72	PGLLDALPALRT
AKERRRIDLIRK	tr|D9YRN2|D9YRN2_9VIRU	1485	sp|Q8TED9|AF1L1_HUMAN Actin filament-associated protein 1-like 1 OS=Homo sapiens OX=9606 GN=AFAP1L1 PE=1 SV=2	678	AKEERRIDLELK
SGEQPPRMEFER	tr|D9YRN1|D9YRN1_9VIRU	136	sp|Q76N32|CEP68_HUMAN Centrosomal protein of 68 kDa OS=Homo sapiens OX=9606 GN=CEP68 PE=1 SV=2	38	SGEQPPRLEAEG
DNMGVGVAGGFA	tr|D9YRN2|D9YRN2_9VIRU	1698	sp|Q5TEC3|ZN697_HUMAN Zinc finger protein 697 OS=Homo sapiens OX=9606 GN=ZNF697 PE=1 SV=2	236	GMMGVGVAGGFG
SLVLIMRSPQMV	tr|D9YRN2|D9YRN2_9VIRU	479	tr|A0A2R8YCH5|A0A2R8YCH5_HUMAN Catenin beta-1 (Fragment) OS=Homo sapiens OX=9606 GN=CTNNB1 PE=1 SV=1	184	SRHAIMRSPQMV
SLVLIMRSPQMV	tr|D9YRN2|D9YRN2_9VIRU	479	tr|A0A2R8Y5C3|A0A2R8Y5C3_HUMAN Catenin beta-1 OS=Homo sapiens OX=9606 GN=CTNNB1 PE=1 SV=1	140	SRHAIMRSPQMV
SLVLIMRSPQMV	tr|D9YRN2|D9YRN2_9VIRU	479	sp|P35222|CTNB1_HUMAN Catenin beta-1 OS=Homo sapiens OX=9606 GN=CTNNB1 PE=1 SV=1	184	SRHAIMRSPQMV
SLVLIMRSPQMV	tr|D9YRN2|D9YRN2_9VIRU	479	tr|A0A2R8Y750|A0A2R8Y750_HUMAN Catenin beta-1 OS=Homo sapiens OX=9606 GN=CTNNB1 PE=1 SV=1	147	SRHAIMRSPQMV
SLVLIMRSPQMV	tr|D9YRN2|D9YRN2_9VIRU	479	tr|B4DGU4|B4DGU4_HUMAN Catenin beta-1 OS=Homo sapiens OX=9606 GN=CTNNB1 PE=1 SV=1	177	SRHAIMRSPQMV
SLVLIMRSPQMV	tr|D9YRN2|D9YRN2_9VIRU	479	tr|A0A2R8Y5A3|A0A2R8Y5A3_HUMAN Catenin beta-1 OS=Homo sapiens OX=9606 GN=CTNNB1 PE=1 SV=1	186	SRHAIMRSPQMV
SLVLIMRSPQMV	tr|D9YRN2|D9YRN2_9VIRU	479	tr|A0A2R8Y543|A0A2R8Y543_HUMAN Catenin beta-1 OS=Homo sapiens OX=9606 GN=CTNNB1 PE=1 SV=1	184	SRHAIMRSPQMV
SLVLIMRSPQMV	tr|D9YRN2|D9YRN2_9VIRU	479	tr|A0A2R8Y804|A0A2R8Y804_HUMAN Catenin beta-1 OS=Homo sapiens OX=9606 GN=CTNNB1 PE=1 SV=1	184	SRHAIMRSPQMV
SLVLIMRSPQMV	tr|D9YRN2|D9YRN2_9VIRU	479	tr|A0A2R8Y7Z0|A0A2R8Y7Z0_HUMAN Catenin beta-1 OS=Homo sapiens OX=9606 GN=CTNNB1 PE=1 SV=1	184	SRHAIMRSPQMV
SLVLIMRSPQMV	tr|D9YRN2|D9YRN2_9VIRU	479	tr|A0A2R8Y5Z1|A0A2R8Y5Z1_HUMAN Catenin beta-1 OS=Homo sapiens OX=9606 GN=CTNNB1 PE=1 SV=1	177	SRHAIMRSPQMV
MGVGVAGGFAVK	tr|D9YRN2|D9YRN2_9VIRU	1700	sp|Q5TEC3|ZN697_HUMAN Zinc finger protein 697 OS=Homo sapiens OX=9606 GN=ZNF697 PE=1 SV=2	238	MGVGVAGGFGAG
RESEINKLKSEL	tr|D9YRN1|D9YRN1_9VIRU	187	tr|A0A1B0GVK0|A0A1B0GVK0_HUMAN Fibroleukin OS=Homo sapiens OX=9606 GN=FGL2 PE=1 SV=1	133	LESEVNKLSSEL
RESEINKLKSEL	tr|D9YRN1|D9YRN1_9VIRU	187	sp|Q14314|FGL2_HUMAN Fibroleukin OS=Homo sapiens OX=9606 GN=FGL2 PE=1 SV=1	133	LESEVNKLSSEL
RESEINKLKSEL	tr|D9YRN1|D9YRN1_9VIRU	187	tr|E9PL50|E9PL50_HUMAN Syntabulin (Fragment) OS=Homo sapiens OX=9606 GN=SYBU PE=1 SV=8	132	RESEIVELKSQL
RESEINKLKSEL	tr|D9YRN1|D9YRN1_9VIRU	187	tr|B7Z4D2|B7Z4D2_HUMAN Syntabulin OS=Homo sapiens OX=9606 GN=SYBU PE=1 SV=1	165	RESEIVELKSQL
RESEINKLKSEL	tr|D9YRN1|D9YRN1_9VIRU	187	tr|A0A0C4DG86|A0A0C4DG86_HUMAN Syntabulin OS=Homo sapiens OX=9606 GN=SYBU PE=1 SV=1	300	RESEIVELKSQL
RESEINKLKSEL	tr|D9YRN1|D9YRN1_9VIRU	187	tr|B3KRD1|B3KRD1_HUMAN Syntabulin OS=Homo sapiens OX=9606 GN=SYBU PE=1 SV=1	89	RESEIVELKSQL
RESEINKLKSEL	tr|D9YRN1|D9YRN1_9VIRU	187	sp|Q9NX95|SYBU_HUMAN Syntabulin OS=Homo sapiens OX=9606 GN=SYBU PE=1 SV=2	295	RESEIVELKSQL
KKVREKEKKPLP	tr|D9YRN1|D9YRN1_9VIRU	806	tr|H7BYL6|H7BYL6_HUMAN A-kinase anchor protein 9 (Fragment) OS=Homo sapiens OX=9606 GN=AKAP9 PE=1 SV=1	501	KKQREKEKKRSP
KKVREKEKKPLP	tr|D9YRN1|D9YRN1_9VIRU	806	sp|Q99996|AKAP9_HUMAN A-kinase anchor protein 9 OS=Homo sapiens OX=9606 GN=AKAP9 PE=1 SV=4	2655	KKQREKEKKRSP
KKVREKEKKPLP	tr|D9YRN1|D9YRN1_9VIRU	806	tr|A0A0A0MRE9|A0A0A0MRE9_HUMAN A-kinase anchor protein 9 OS=Homo sapiens OX=9606 GN=AKAP9 PE=1 SV=1	2608	KKQREKEKKRSP
KKVREKEKKPLP	tr|D9YRN1|D9YRN1_9VIRU	806	tr|A0A0A0MRF6|A0A0A0MRF6_HUMAN A-kinase anchor protein 9 OS=Homo sapiens OX=9606 GN=AKAP9 PE=1 SV=1	2666	KKQREKEKKRSP
SALCAHALTAEP	tr|D9YRN0|D9YRN0_9VIRU	201	sp|Q9P296|C5AR2_HUMAN C5a anaphylatoxin chemotactic receptor 2 OS=Homo sapiens OX=9606 GN=C5AR2 PE=1 SV=1	263	SALLARALRAEP
KAKAQKKEVLRL	tr|D9YRN1|D9YRN1_9VIRU	982	tr|J3KQN4|J3KQN4_HUMAN 60S ribosomal protein L36a OS=Homo sapiens OX=9606 GN=RPL36A PE=1 SV=1	95	KAKTTKKIVLRL
KAKAQKKEVLRL	tr|D9YRN1|D9YRN1_9VIRU	982	sp|P83881|RL36A_HUMAN 60S ribosomal protein L36a OS=Homo sapiens OX=9606 GN=RPL36A PE=1 SV=2	59	KAKTTKKIVLRL
KAKAQKKEVLRL	tr|D9YRN1|D9YRN1_9VIRU	982	sp|Q969Q0|RL36L_HUMAN 60S ribosomal protein L36a-like OS=Homo sapiens OX=9606 GN=RPL36AL PE=1 SV=3	59	KAKTTKKIVLRL
KAKAQKKEVLRL	tr|D9YRN1|D9YRN1_9VIRU	982	tr|H7BZ11|H7BZ11_HUMAN RPL36A-HNRNPH2 readthrough OS=Homo sapiens OX=9606 GN=RPL36A-HNRNPH2 PE=3 SV=2	59	KAKTTKKIVLRL
KAKAQKKEVLRL	tr|D9YRN1|D9YRN1_9VIRU	982	tr|H0Y5B4|H0Y5B4_HUMAN 60S ribosomal protein L36a OS=Homo sapiens OX=9606 GN=RPL36A PE=1 SV=2	59	KAKTTKKIVLRL
KVREKEKKPLPK	tr|D9YRN1|D9YRN1_9VIRU	807	tr|H0YET3|H0YET3_HUMAN Protein NPAT (Fragment) OS=Homo sapiens OX=9606 GN=NPAT PE=1 SV=8	114	IKREKEKPPLPK
KVREKEKKPLPK	tr|D9YRN1|D9YRN1_9VIRU	807	sp|Q14207|NPAT_HUMAN Protein NPAT OS=Homo sapiens OX=9606 GN=NPAT PE=1 SV=3	1115	IKREKEKPPLPK
EINKLKSELREA	tr|D9YRN1|D9YRN1_9VIRU	190	sp|Q5TB80|CE162_HUMAN Centrosomal protein of 162 kDa OS=Homo sapiens OX=9606 GN=CEP162 PE=1 SV=2	1290	EITKLLEELREA
TCIACMEGILQY	tr|D9YRN1|D9YRN1_9VIRU	711	sp|P05067|A4_HUMAN Amyloid-beta precursor protein OS=Homo sapiens OX=9606 GN=APP PE=1 SV=3	61	TCIDTKEGILQY
TCIACMEGILQY	tr|D9YRN1|D9YRN1_9VIRU	711	tr|A0A0A0MRG2|A0A0A0MRG2_HUMAN ABPP OS=Homo sapiens OX=9606 GN=APP PE=1 SV=1	26	TCIDTKEGILQY
PPPAESSEESCD	tr|D9YRN1|D9YRN1_9VIRU	614	sp|Q9H6X2|ANTR1_HUMAN Anthrax toxin receptor 1 OS=Homo sapiens OX=9606 GN=ANTXR1 PE=1 SV=2	356	PPPAEESEEEDD
REKEKKPLPKQV	tr|D9YRN1|D9YRN1_9VIRU	809	tr|H0YET3|H0YET3_HUMAN Protein NPAT (Fragment) OS=Homo sapiens OX=9606 GN=NPAT PE=1 SV=8	116	REKEKPPLPKIL
REKEKKPLPKQV	tr|D9YRN1|D9YRN1_9VIRU	809	sp|Q14207|NPAT_HUMAN Protein NPAT OS=Homo sapiens OX=9606 GN=NPAT PE=1 SV=3	1117	REKEKPPLPKIL
LGAVLGYVILVL	tr|D9YRN1|D9YRN1_9VIRU	1304	sp|Q9UM47|NOTC3_HUMAN Neurogenic locus notch homolog protein 3 OS=Homo sapiens OX=9606 GN=NOTCH3 PE=1 SV=2	1649	AGAVLLLVILVL
GAMSNAGGEVGV	tr|D9YRN1|D9YRN1_9VIRU	673	sp|Q13111|CAF1A_HUMAN Chromatin assembly factor 1 subunit A OS=Homo sapiens OX=9606 GN=CHAF1A PE=1 SV=3	930	GAASGAGGGVGV
KLSREVLRDSYN	tr|D9YRN2|D9YRN2_9VIRU	269	tr|A0A0A0MSX2|A0A0A0MSX2_HUMAN (E2-independent) E3 ubiquitin-conjugating enzyme FATS (Fragment) OS=Homo sapiens OX=9606 GN=C10orf90 PE=1 SV=1	3	KLSGEGLRDSYH
KLSREVLRDSYN	tr|D9YRN2|D9YRN2_9VIRU	269	sp|Q96M02|CJ090_HUMAN (E2-independent) E3 ubiquitin-conjugating enzyme FATS OS=Homo sapiens OX=9606 GN=C10orf90 PE=2 SV=2	3	KLSGEGLRDSYH
KLSREVLRDSYN	tr|D9YRN2|D9YRN2_9VIRU	269	tr|S4R3Q7|S4R3Q7_HUMAN (E2-independent) E3 ubiquitin-conjugating enzyme FATS OS=Homo sapiens OX=9606 GN=C10orf90 PE=1 SV=1	3	KLSGEGLRDSYH
TSTLKLRTIETS	tr|D9YRN1|D9YRN1_9VIRU	1201	sp|Q5T5S1|CC183_HUMAN Coiled-coil domain-containing protein 183 OS=Homo sapiens OX=9606 GN=CCDC183 PE=2 SV=3	278	TETLKLRRKETS
AREFESAPSLRR	tr|D9YRN1|D9YRN1_9VIRU	260	tr|H0Y5I5|H0Y5I5_HUMAN Zinc finger protein 687 (Fragment) OS=Homo sapiens OX=9606 GN=ZNF687 PE=1 SV=1	602	ERSFCSAPSLRR
AREFESAPSLRR	tr|D9YRN1|D9YRN1_9VIRU	260	sp|Q8N1G0|ZN687_HUMAN Zinc finger protein 687 OS=Homo sapiens OX=9606 GN=ZNF687 PE=1 SV=1	999	ERSFCSAPSLRR
ADAPEDFLETMN	tr|D9YRN2|D9YRN2_9VIRU	1363	sp|Q13562|NDF1_HUMAN Neurogenic differentiation factor 1 OS=Homo sapiens OX=9606 GN=NEUROD1 PE=1 SV=3	36	ADKKEDDLETMN
NSGEQPPRMEFE	tr|D9YRN1|D9YRN1_9VIRU	135	sp|Q76N32|CEP68_HUMAN Centrosomal protein of 68 kDa OS=Homo sapiens OX=9606 GN=CEP68 PE=1 SV=2	37	MSGEQPPRLEAE
DMKLNFEDLEFE	tr|D9YRN2|D9YRN2_9VIRU	1987	tr|E7ETM8|E7ETM8_HUMAN Nexilin (Fragment) OS=Homo sapiens OX=9606 GN=NEXN PE=1 SV=1	120	KMKKNFEDLEKE
DMKLNFEDLEFE	tr|D9YRN2|D9YRN2_9VIRU	1987	tr|E7EUA0|E7EUA0_HUMAN Nexilin (Fragment) OS=Homo sapiens OX=9606 GN=NEXN PE=1 SV=1	170	KMKKNFEDLEKE
DMKLNFEDLEFE	tr|D9YRN2|D9YRN2_9VIRU	1987	sp|Q0ZGT2|NEXN_HUMAN Nexilin OS=Homo sapiens OX=9606 GN=NEXN PE=1 SV=1	184	KMKKNFEDLEKE
DMKLNFEDLEFE	tr|D9YRN2|D9YRN2_9VIRU	1987	tr|H7BXY5|H7BXY5_HUMAN Nexilin (Fragment) OS=Homo sapiens OX=9606 GN=NEXN PE=1 SV=1	84	KMKKNFEDLEKE
KLKSELREAVRR	tr|D9YRN1|D9YRN1_9VIRU	193	sp|Q8TDW5|SYTL5_HUMAN Synaptotagmin-like protein 5 OS=Homo sapiens OX=9606 GN=SYTL5 PE=1 SV=1	41	KLKNELLEAKRR
KLKSELREAVRR	tr|D9YRN1|D9YRN1_9VIRU	193	sp|O14733|MP2K7_HUMAN Dual specificity mitogen-activated protein kinase kinase 7 OS=Homo sapiens OX=9606 GN=MAP2K7 PE=1 SV=2	16	KLKQENREARRR
DKLSREVLRDSY	tr|D9YRN2|D9YRN2_9VIRU	268	tr|A0A0A0MSX2|A0A0A0MSX2_HUMAN (E2-independent) E3 ubiquitin-conjugating enzyme FATS (Fragment) OS=Homo sapiens OX=9606 GN=C10orf90 PE=1 SV=1	2	LKLSGEGLRDSY
DKLSREVLRDSY	tr|D9YRN2|D9YRN2_9VIRU	268	sp|Q96M02|CJ090_HUMAN (E2-independent) E3 ubiquitin-conjugating enzyme FATS OS=Homo sapiens OX=9606 GN=C10orf90 PE=2 SV=2	2	LKLSGEGLRDSY
DKLSREVLRDSY	tr|D9YRN2|D9YRN2_9VIRU	268	tr|S4R3Q7|S4R3Q7_HUMAN (E2-independent) E3 ubiquitin-conjugating enzyme FATS OS=Homo sapiens OX=9606 GN=C10orf90 PE=1 SV=1	2	LKLSGEGLRDSY
KGGEKGCKAVLS	tr|D9YRN2|D9YRN2_9VIRU	129	sp|Q3SY84|K2C71_HUMAN Keratin, type II cytoskeletal 71 OS=Homo sapiens OX=9606 GN=KRT71 PE=1 SV=3	14	KGGFSGCSAVLS
KGGEKGCKAVLS	tr|D9YRN2|D9YRN2_9VIRU	129	sp|Q86Y46|K2C73_HUMAN Keratin, type II cytoskeletal 73 OS=Homo sapiens OX=9606 GN=KRT73 PE=1 SV=1	14	KGGFSGCSAVLS
GAVLGYVILVLA	tr|D9YRN1|D9YRN1_9VIRU	1305	sp|Q9UM47|NOTC3_HUMAN Neurogenic locus notch homolog protein 3 OS=Homo sapiens OX=9606 GN=NOTCH3 PE=1 SV=2	1650	GAVLLLVILVLG
VREKEKKPLPKQ	tr|D9YRN1|D9YRN1_9VIRU	808	tr|H0YET3|H0YET3_HUMAN Protein NPAT (Fragment) OS=Homo sapiens OX=9606 GN=NPAT PE=1 SV=8	115	KREKEKPPLPKI
VREKEKKPLPKQ	tr|D9YRN1|D9YRN1_9VIRU	808	sp|Q14207|NPAT_HUMAN Protein NPAT OS=Homo sapiens OX=9606 GN=NPAT PE=1 SV=3	1116	KREKEKPPLPKI
DLLRYKPATDAV	tr|D9YRN1|D9YRN1_9VIRU	1096	tr|I3L382|I3L382_HUMAN Zinc finger CCCH domain-containing protein 7A (Fragment) OS=Homo sapiens OX=9606 GN=ZC3H7A PE=1 SV=8	135	DLGRYKKAYDAV
DLLRYKPATDAV	tr|D9YRN1|D9YRN1_9VIRU	1096	tr|I3L2K5|I3L2K5_HUMAN Zinc finger CCCH domain-containing protein 7A (Fragment) OS=Homo sapiens OX=9606 GN=ZC3H7A PE=1 SV=1	135	DLGRYKKAYDAV
DLLRYKPATDAV	tr|D9YRN1|D9YRN1_9VIRU	1096	sp|Q8IWR0|Z3H7A_HUMAN Zinc finger CCCH domain-containing protein 7A OS=Homo sapiens OX=9606 GN=ZC3H7A PE=1 SV=1	135	DLGRYKKAYDAV
SATMTAKGISKK	tr|F4Y5R8|F4Y5R8_9VIRU	180	sp|O60285|NUAK1_HUMAN NUAK family SNF1-like kinase 1 OS=Homo sapiens OX=9606 GN=NUAK1 PE=1 SV=1	459	SATMPKKGILKK
TSLSLPVFIQVP	tr|D9YRN2|D9YRN2_9VIRU	322	tr|H3BU64|H3BU64_HUMAN Regulator of G-protein-signaling protein-like OS=Homo sapiens OX=9606 GN=RGSL1 PE=1 SV=1	27	TFLSLPVFGQTP
TSLSLPVFIQVP	tr|D9YRN2|D9YRN2_9VIRU	322	tr|H3BRN5|H3BRN5_HUMAN Regulator of G-protein-signaling protein-like OS=Homo sapiens OX=9606 GN=RGSL1 PE=4 SV=1	27	TFLSLPVFGQTP
TSLSLPVFIQVP	tr|D9YRN2|D9YRN2_9VIRU	322	sp|A5PLK6|RGSL_HUMAN Regulator of G-protein signaling protein-like OS=Homo sapiens OX=9606 GN=RGSL1 PE=2 SV=1	27	TFLSLPVFGQTP
TSLSLPVFIQVP	tr|D9YRN2|D9YRN2_9VIRU	322	tr|H3BVE8|H3BVE8_HUMAN Regulator of G-protein-signaling protein-like OS=Homo sapiens OX=9606 GN=RGSL1 PE=4 SV=1	27	TFLSLPVFGQTP
VLLGTMHADSRI	tr|D9YRN1|D9YRN1_9VIRU	17	tr|E7ETN9|E7ETN9_HUMAN Uroplakin Ib OS=Homo sapiens OX=9606 GN=UPK1B PE=1 SV=1	167	VLLGTMFYWSRI
VLLGTMHADSRI	tr|D9YRN1|D9YRN1_9VIRU	17	sp|O75841|UPK1B_HUMAN Uroplakin-1b OS=Homo sapiens OX=9606 GN=UPK1B PE=1 SV=5	247	VLLGTMFYWSRI
VLLGTMHADSRI	tr|D9YRN1|D9YRN1_9VIRU	17	tr|C9J9M7|C9J9M7_HUMAN Tetraspanin OS=Homo sapiens OX=9606 GN=UPK1B PE=1 SV=1	239	VLLGTMFYWSRI
NMGVGVAGGFAV	tr|D9YRN2|D9YRN2_9VIRU	1699	sp|Q5TEC3|ZN697_HUMAN Zinc finger protein 697 OS=Homo sapiens OX=9606 GN=ZNF697 PE=1 SV=2	237	MMGVGVAGGFGA
ESEINKLKSELR	tr|D9YRN1|D9YRN1_9VIRU	188	tr|A0A1B0GVK0|A0A1B0GVK0_HUMAN Fibroleukin OS=Homo sapiens OX=9606 GN=FGL2 PE=1 SV=1	134	ESEVNKLSSELK
ESEINKLKSELR	tr|D9YRN1|D9YRN1_9VIRU	188	sp|Q14314|FGL2_HUMAN Fibroleukin OS=Homo sapiens OX=9606 GN=FGL2 PE=1 SV=1	134	ESEVNKLSSELK
MKLNFEDLEFEK	tr|D9YRN2|D9YRN2_9VIRU	1988	tr|E7ETM8|E7ETM8_HUMAN Nexilin (Fragment) OS=Homo sapiens OX=9606 GN=NEXN PE=1 SV=1	121	MKKNFEDLEKER
MKLNFEDLEFEK	tr|D9YRN2|D9YRN2_9VIRU	1988	tr|E7EUA0|E7EUA0_HUMAN Nexilin (Fragment) OS=Homo sapiens OX=9606 GN=NEXN PE=1 SV=1	171	MKKNFEDLEKER
MKLNFEDLEFEK	tr|D9YRN2|D9YRN2_9VIRU	1988	sp|Q0ZGT2|NEXN_HUMAN Nexilin OS=Homo sapiens OX=9606 GN=NEXN PE=1 SV=1	185	MKKNFEDLEKER
MKLNFEDLEFEK	tr|D9YRN2|D9YRN2_9VIRU	1988	tr|H7BXY5|H7BXY5_HUMAN Nexilin (Fragment) OS=Homo sapiens OX=9606 GN=NEXN PE=1 SV=1	85	MKKNFEDLEKER
LNPELLDALPTL	tr|D9YRN2|D9YRN2_9VIRU	1866	sp|P13224|GP1BB_HUMAN Platelet glycoprotein Ib beta chain OS=Homo sapiens OX=9606 GN=GP1BB PE=1 SV=1	70	LPPGLLDALPAL
NKRNKELEDIHV	tr|D9YRN1|D9YRN1_9VIRU	160	tr|A8CTZ0|A8CTZ0_HUMAN Intersectin 1 short form variant 13 OS=Homo sapiens OX=9606 GN=ITSN1 PE=1 SV=1	422	NQRNKEQEDIVV
NKRNKELEDIHV	tr|D9YRN1|D9YRN1_9VIRU	160	sp|Q15811|ITSN1_HUMAN Intersectin-1 OS=Homo sapiens OX=9606 GN=ITSN1 PE=1 SV=3	459	NQRNKEQEDIVV
NKRNKELEDIHV	tr|D9YRN1|D9YRN1_9VIRU	160	tr|F8W7U0|F8W7U0_HUMAN Intersectin-1 OS=Homo sapiens OX=9606 GN=ITSN1 PE=1 SV=1	459	NQRNKEQEDIVV
QFPKTLIKPTFA	tr|F4Y5R8|F4Y5R8_9VIRU	140	sp|P78325|ADAM8_HUMAN Disintegrin and metalloproteinase domain-containing protein 8 OS=Homo sapiens OX=9606 GN=ADAM8 PE=1 SV=2	769	QAPKQVIKPTFA
REFESAPSLRRP	tr|D9YRN1|D9YRN1_9VIRU	261	tr|H0Y5I5|H0Y5I5_HUMAN Zinc finger protein 687 (Fragment) OS=Homo sapiens OX=9606 GN=ZNF687 PE=1 SV=1	603	RSFCSAPSLRRH
REFESAPSLRRP	tr|D9YRN1|D9YRN1_9VIRU	261	sp|Q8N1G0|ZN687_HUMAN Zinc finger protein 687 OS=Homo sapiens OX=9606 GN=ZNF687 PE=1 SV=1	1000	RSFCSAPSLRRH
IDNMGVGVAGGF	tr|D9YRN2|D9YRN2_9VIRU	1697	sp|Q5TEC3|ZN697_HUMAN Zinc finger protein 697 OS=Homo sapiens OX=9606 GN=ZNF697 PE=1 SV=2	235	VGMMGVGVAGGF
IQRVAESALKAL	tr|D9YRN2|D9YRN2_9VIRU	707	sp|O14830|PPE2_HUMAN Serine/threonine-protein phosphatase with EF-hands 2 OS=Homo sapiens OX=9606 GN=PPEF2 PE=1 SV=2	551	ISRVEESALRAL
IQRVAESALKAL	tr|D9YRN2|D9YRN2_9VIRU	707	tr|A0A494C0J1|A0A494C0J1_HUMAN Serine/threonine-protein phosphatase with EF-hands 2 (Fragment) OS=Homo sapiens OX=9606 GN=PPEF2 PE=4 SV=1	72	ISRVEESALRAL
VDIRDIRRINKA	tr|D9YRN2|D9YRN2_9VIRU	1900	sp|Q86SF2|GALT7_HUMAN N-acetylgalactosaminyltransferase 7 OS=Homo sapiens OX=9606 GN=GALNT7 PE=1 SV=1	80	VDLESIRRINKA
VDIRDIRRINKA	tr|D9YRN2|D9YRN2_9VIRU	1900	tr|E9PBY3|E9PBY3_HUMAN N-acetylgalactosaminyltransferase 7 OS=Homo sapiens OX=9606 GN=GALNT7 PE=1 SV=1	80	VDLESIRRINKA
VLPDLLRYKPAT	tr|D9YRN1|D9YRN1_9VIRU	1093	tr|A0A0C4DFS6|A0A0C4DFS6_HUMAN Protein sprouty homolog 4 OS=Homo sapiens OX=9606 GN=SPRY4 PE=1 SV=1	267	VLPCLLCYLPAT
VLPDLLRYKPAT	tr|D9YRN1|D9YRN1_9VIRU	1093	sp|Q9C004|SPY4_HUMAN Protein sprouty homolog 4 OS=Homo sapiens OX=9606 GN=SPRY4 PE=1 SV=2	244	VLPCLLCYLPAT
GVWSLIEEAMSA	tr|D9YRN1|D9YRN1_9VIRU	1055	sp|P35573|GDE_HUMAN Glycogen debranching enzyme OS=Homo sapiens OX=9606 GN=AGL PE=1 SV=3	572	GISSLIREAMSA
RSVLEVFEEVRR	tr|D9YRN2|D9YRN2_9VIRU	190	sp|Q9BUY7|EFC11_HUMAN EF-hand calcium-binding domain-containing protein 11 OS=Homo sapiens OX=9606 GN=EFCAB11 PE=1 SV=1	130	RTVLEVFREVDR
VKLKGIKDDIKS	tr|D9YRN1|D9YRN1_9VIRU	220	sp|Q8WXH0|SYNE2_HUMAN Nesprin-2 OS=Homo sapiens OX=9606 GN=SYNE2 PE=1 SV=3	2323	VGQKIIKDDIKS
VKLKGIKDDIKS	tr|D9YRN1|D9YRN1_9VIRU	220	tr|A0A0A0MRE3|A0A0A0MRE3_HUMAN Nesprin-2 OS=Homo sapiens OX=9606 GN=SYNE2 PE=1 SV=1	2323	VGQKIIKDDIKS
VKLKGIKDDIKS	tr|D9YRN1|D9YRN1_9VIRU	220	tr|G3V5X4|G3V5X4_HUMAN Nesprin-2 OS=Homo sapiens OX=9606 GN=SYNE2 PE=1 SV=1	2323	VGQKIIKDDIKS
AVRAGDSKSLDE	tr|D9YRN0|D9YRN0_9VIRU	156	sp|Q8N9B4|ANR42_HUMAN Ankyrin repeat domain-containing protein 42 OS=Homo sapiens OX=9606 GN=ANKRD42 PE=2 SV=2	33	AVRAGDVKQLSE
AVRAGDSKSLDE	tr|D9YRN0|D9YRN0_9VIRU	156	tr|F8W6I9|F8W6I9_HUMAN Ankyrin repeat domain-containing protein 42 OS=Homo sapiens OX=9606 GN=ANKRD42 PE=1 SV=1	33	AVRAGDVKQLSE
AVRAGDSKSLDE	tr|D9YRN0|D9YRN0_9VIRU	156	tr|E9PKE2|E9PKE2_HUMAN Ankyrin repeat domain-containing protein 42 OS=Homo sapiens OX=9606 GN=ANKRD42 PE=1 SV=1	33	AVRAGDVKQLSE
AVRAGDSKSLDE	tr|D9YRN0|D9YRN0_9VIRU	156	tr|E9PP91|E9PP91_HUMAN Ankyrin repeat domain-containing protein 42 OS=Homo sapiens OX=9606 GN=ANKRD42 PE=1 SV=1	33	AVRAGDVKQLSE
AVRAGDSKSLDE	tr|D9YRN0|D9YRN0_9VIRU	156	tr|E9PIL2|E9PIL2_HUMAN Ankyrin repeat domain-containing protein 42 OS=Homo sapiens OX=9606 GN=ANKRD42 PE=1 SV=1	33	AVRAGDVKQLSE
