query	query_seqname	query_start	target_seqname	target_start	target
KLFGSPVMNQGQ	sp|P0C6U2|R1A_CVH22	217	tr|A0A0C4DH65|A0A0C4DH65_HUMAN Protein KRBA1 OS=Homo sapiens OX=9606 GN=KRBA1 PE=1 SV=1	510	LDFGSPVGNQGQ
KLFGSPVMNQGQ	sp|P0C6U2|R1A_CVH22	217	tr|A0A087WVC5|A0A087WVC5_HUMAN Protein KRBA1 (Fragment) OS=Homo sapiens OX=9606 GN=KRBA1 PE=1 SV=1	433	LDFGSPVGNQGQ
KETARIFLVESL	sp|P0C6X1|R1AB_CVH22	5122	sp|O15269|SPTC1_HUMAN Serine palmitoyltransferase 1 OS=Homo sapiens OX=9606 GN=SPTLC1 PE=1 SV=1	266	KYKARIFLEESL
KETARIFLVESL	sp|P0C6X1|R1AB_CVH22	5122	sp|Q9P1Z9|CC180_HUMAN Coiled-coil domain-containing protein 180 OS=Homo sapiens OX=9606 GN=CCDC180 PE=2 SV=3	1067	KEAARIELVESV
KETARIFLVESL	sp|P0C6X1|R1AB_CVH22	5122	tr|A0A6E1Y6F7|A0A6E1Y6F7_HUMAN Coiled-coil domain-containing protein 180 OS=Homo sapiens OX=9606 GN=CCDC180 PE=1 SV=1	1023	KEAARIELVESV
FTNTNFLLLRLA	sp|P0C6X1|R1AB_CVH22	5511	sp|O14804|TAAR5_HUMAN Trace amine-associated receptor 5 OS=Homo sapiens OX=9606 GN=TAAR5 PE=2 SV=2	66	HTPTNFLLLSLA
IKKYIHRTQTFS	sp|P0C6X1|R1AB_CVH22	5492	sp|Q16617|NKG7_HUMAN Protein NKG7 OS=Homo sapiens OX=9606 GN=NKG7 PE=1 SV=1	51	ISGYIHVTQTFS
FGSPVMNQGQNI	sp|P0C6U2|R1A_CVH22	219	sp|A5PL33|KRBA1_HUMAN Protein KRBA1 OS=Homo sapiens OX=9606 GN=KRBA1 PE=1 SV=3	478	FGSPVGNQGQHP
FGSPVMNQGQNI	sp|P0C6U2|R1A_CVH22	219	tr|A0A0C4DH65|A0A0C4DH65_HUMAN Protein KRBA1 OS=Homo sapiens OX=9606 GN=KRBA1 PE=1 SV=1	512	FGSPVGNQGQHP
FGSPVMNQGQNI	sp|P0C6U2|R1A_CVH22	219	tr|A0A087WVC5|A0A087WVC5_HUMAN Protein KRBA1 (Fragment) OS=Homo sapiens OX=9606 GN=KRBA1 PE=1 SV=1	435	FGSPVGNQGQHP
ELLDSDLLARPT	sp|P0C6U2|R1A_CVH22	637	tr|A0A075B780|A0A075B780_HUMAN Transportin-2 OS=Homo sapiens OX=9606 GN=TNPO2 PE=1 SV=1	159	ELLDSDALNRPL
ELLDSDLLARPT	sp|P0C6U2|R1A_CVH22	637	sp|O14787|TNPO2_HUMAN Transportin-2 OS=Homo sapiens OX=9606 GN=TNPO2 PE=1 SV=3	159	ELLDSDALNRPL
ELLDSDLLARPT	sp|P0C6U2|R1A_CVH22	637	sp|Q9BSK4|FEM1A_HUMAN Protein fem-1 homolog A OS=Homo sapiens OX=9606 GN=FEM1A PE=1 SV=1	619	ELLDEKLLARGT
QDEFSLNDVLRT	sp|P0C6X1|R1AB_CVH22	3249	sp|Q9NYU2|UGGG1_HUMAN UDP-glucose:glycoprotein glucosyltransferase 1 OS=Homo sapiens OX=9606 GN=UGGT1 PE=1 SV=3	405	QDIFSLFDVLRN
LTVVVFLFAIVV	sp|P0C6X1|R1AB_CVH22	3166	tr|B7Z1G8|B7Z1G8_HUMAN Surfeit locus protein 4 OS=Homo sapiens OX=9606 GN=SURF4 PE=1 SV=1	163	LTLVVWLFAINV
LTVVVFLFAIVV	sp|P0C6X1|R1AB_CVH22	3166	sp|O15260|SURF4_HUMAN Surfeit locus protein 4 OS=Homo sapiens OX=9606 GN=SURF4 PE=1 SV=3	206	LTLVVWLFAINV
KLTANSNGVLGS	sp|P0C6U2|R1A_CVH22	742	tr|G8JLJ2|G8JLJ2_HUMAN Superoxide dismutase (Fragment) OS=Homo sapiens OX=9606 GN=SOD2 PE=1 SV=1	49	KLTAASVGVQGS
KLTANSNGVLGS	sp|P0C6U2|R1A_CVH22	742	tr|F5H3C5|F5H3C5_HUMAN Superoxide dismutase (Fragment) OS=Homo sapiens OX=9606 GN=SOD2 PE=1 SV=1	88	KLTAASVGVQGS
KLTANSNGVLGS	sp|P0C6U2|R1A_CVH22	742	tr|F5H4R2|F5H4R2_HUMAN Superoxide dismutase (Fragment) OS=Homo sapiens OX=9606 GN=SOD2 PE=1 SV=1	157	KLTAASVGVQGS
KLTANSNGVLGS	sp|P0C6U2|R1A_CVH22	742	tr|F5GYZ5|F5GYZ5_HUMAN Superoxide dismutase (Fragment) OS=Homo sapiens OX=9606 GN=SOD2 PE=1 SV=1	157	KLTAASVGVQGS
KLTANSNGVLGS	sp|P0C6U2|R1A_CVH22	742	sp|P04179|SODM_HUMAN Superoxide dismutase [Mn], mitochondrial OS=Homo sapiens OX=9606 GN=SOD2 PE=1 SV=3	134	KLTAASVGVQGS
IRRNAKYQVRVT	sp|P0C6U2|R1A_CVH22	1970	sp|Q8WTW4|NPRL2_HUMAN GATOR complex protein NPRL2 OS=Homo sapiens OX=9606 GN=NPRL2 PE=1 SV=2	323	IRRLQKYPVRVT
LKLPPGDSYSKL	sp|P0C6X1|R1AB_CVH22	5730	sp|Q15029|U5S1_HUMAN 116 kDa U5 small nuclear ribonucleoprotein component OS=Homo sapiens OX=9606 GN=EFTUD2 PE=1 SV=1	267	LKLPPTDAYYKL
FTLSYDESLKHG	sp|P15423|SPIKE_CVH22	119	sp|P04114|APOB_HUMAN Apolipoprotein B-100 OS=Homo sapiens OX=9606 GN=APOB PE=1 SV=2	1418	FTLSYDGSLRHK
GATPPASLAKSL	sp|P0C6X1|R1AB_CVH22	6174	sp|P15056|BRAF_HUMAN Serine/threonine-protein kinase B-raf OS=Homo sapiens OX=9606 GN=BRAF PE=1 SV=4	399	SATPPASLPGSL
GATPPASLAKSL	sp|P0C6X1|R1AB_CVH22	6174	tr|A0A2U3TZI2|A0A2U3TZI2_HUMAN Non-specific serine/threonine protein kinase OS=Homo sapiens OX=9606 GN=BRAF PE=1 SV=1	439	SATPPASLPGSL
GATPPASLAKSL	sp|P0C6X1|R1AB_CVH22	6174	tr|H7C560|H7C560_HUMAN Non-specific serine/threonine protein kinase OS=Homo sapiens OX=9606 GN=BRAF PE=1 SV=2	399	SATPPASLPGSL
GATPPASLAKSL	sp|P0C6X1|R1AB_CVH22	6174	tr|A0A2R8Y8E0|A0A2R8Y8E0_HUMAN Non-specific serine/threonine protein kinase OS=Homo sapiens OX=9606 GN=BRAF PE=1 SV=1	439	SATPPASLPGSL
GATPPASLAKSL	sp|P0C6X1|R1AB_CVH22	6174	tr|A0A2R8Y492|A0A2R8Y492_HUMAN Serine/threonine-protein kinase B-raf (Fragment) OS=Homo sapiens OX=9606 GN=BRAF PE=1 SV=1	98	SATPPASLPGSL
GATPPASLAKSL	sp|P0C6X1|R1AB_CVH22	6174	tr|A0A2R8Y679|A0A2R8Y679_HUMAN Serine/threonine-protein kinase B-raf (Fragment) OS=Homo sapiens OX=9606 GN=BRAF PE=1 SV=1	80	SATPPASLPGSL
GATPPASLAKSL	sp|P0C6X1|R1AB_CVH22	6174	tr|A0A2R8YDP5|A0A2R8YDP5_HUMAN Non-specific serine/threonine protein kinase OS=Homo sapiens OX=9606 GN=BRAF PE=1 SV=1	399	SATPPASLPGSL
NLFAESALQSLR	sp|P0C6X1|R1AB_CVH22	770	tr|A0A0A0MT07|A0A0A0MT07_HUMAN Potassium voltage-gated channel subfamily KQT member 5 OS=Homo sapiens OX=9606 GN=KCNQ5 PE=1 SV=1	224	NIFATSALRSLR
NLFAESALQSLR	sp|P0C6X1|R1AB_CVH22	770	tr|A0A0A0MRC8|A0A0A0MRC8_HUMAN Potassium voltage-gated channel subfamily KQT member 5 OS=Homo sapiens OX=9606 GN=KCNQ5 PE=1 SV=1	224	NIFATSALRSLR
NLFAESALQSLR	sp|P0C6X1|R1AB_CVH22	770	sp|Q9NR82|KCNQ5_HUMAN Potassium voltage-gated channel subfamily KQT member 5 OS=Homo sapiens OX=9606 GN=KCNQ5 PE=1 SV=3	224	NIFATSALRSLR
NLFAESALQSLR	sp|P0C6X1|R1AB_CVH22	770	tr|F8WEA4|F8WEA4_HUMAN Potassium voltage-gated channel subfamily KQT member 5 OS=Homo sapiens OX=9606 GN=KCNQ5 PE=1 SV=1	224	NIFATSALRSLR
NLFAESALQSLR	sp|P0C6X1|R1AB_CVH22	770	tr|A0A0A0MSD9|A0A0A0MSD9_HUMAN Potassium voltage-gated channel subfamily KQT member 5 OS=Homo sapiens OX=9606 GN=KCNQ5 PE=1 SV=1	224	NIFATSALRSLR
NLFAESALQSLR	sp|P0C6X1|R1AB_CVH22	770	tr|A0A0A0MSC0|A0A0A0MSC0_HUMAN Potassium voltage-gated channel subfamily KQT member 5 OS=Homo sapiens OX=9606 GN=KCNQ5 PE=1 SV=1	224	NIFATSALRSLR
NLFAESALQSLR	sp|P0C6X1|R1AB_CVH22	770	tr|A0A0G2JQG6|A0A0G2JQG6_HUMAN Potassium voltage-gated channel subfamily KQT member 2 (Fragment) OS=Homo sapiens OX=9606 GN=KCNQ2 PE=1 SV=1	92	NVFATSALRSLR
NLFAESALQSLR	sp|P0C6X1|R1AB_CVH22	770	tr|A0A0D9SEV1|A0A0D9SEV1_HUMAN Potassium voltage-gated channel subfamily KQT member 2 OS=Homo sapiens OX=9606 GN=KCNQ2 PE=1 SV=1	190	NVFATSALRSLR
NLFAESALQSLR	sp|P0C6X1|R1AB_CVH22	770	tr|A0A0G2JRN9|A0A0G2JRN9_HUMAN Potassium voltage-gated channel subfamily KQT member 2 (Fragment) OS=Homo sapiens OX=9606 GN=KCNQ2 PE=1 SV=1	92	NVFATSALRSLR
NLFAESALQSLR	sp|P0C6X1|R1AB_CVH22	770	tr|A0A0D9SF10|A0A0D9SF10_HUMAN Potassium voltage-gated channel subfamily KQT member 2 OS=Homo sapiens OX=9606 GN=KCNQ2 PE=1 SV=1	190	NVFATSALRSLR
NLFAESALQSLR	sp|P0C6X1|R1AB_CVH22	770	tr|Q4VXP6|Q4VXP6_HUMAN Potassium voltage-gated channel subfamily KQT member 2 OS=Homo sapiens OX=9606 GN=KCNQ2 PE=1 SV=2	190	NVFATSALRSLR
NLFAESALQSLR	sp|P0C6X1|R1AB_CVH22	770	tr|A0A0D9SG49|A0A0D9SG49_HUMAN Potassium voltage-gated channel subfamily KQT member 2 OS=Homo sapiens OX=9606 GN=KCNQ2 PE=1 SV=1	190	NVFATSALRSLR
NLFAESALQSLR	sp|P0C6X1|R1AB_CVH22	770	tr|A0A1B0GW14|A0A1B0GW14_HUMAN Potassium voltage-gated channel subfamily KQT member 2 OS=Homo sapiens OX=9606 GN=KCNQ2 PE=1 SV=1	17	NVFATSALRSLR
NLFAESALQSLR	sp|P0C6X1|R1AB_CVH22	770	tr|A0A0G2JR60|A0A0G2JR60_HUMAN Potassium voltage-gated channel subfamily KQT member 2 (Fragment) OS=Homo sapiens OX=9606 GN=KCNQ2 PE=1 SV=1	92	NVFATSALRSLR
NLFAESALQSLR	sp|P0C6X1|R1AB_CVH22	770	tr|A0A0G2JR54|A0A0G2JR54_HUMAN Potassium voltage-gated channel subfamily KQT member 2 (Fragment) OS=Homo sapiens OX=9606 GN=KCNQ2 PE=1 SV=1	92	NVFATSALRSLR
NLFAESALQSLR	sp|P0C6X1|R1AB_CVH22	770	sp|O43526|KCNQ2_HUMAN Potassium voltage-gated channel subfamily KQT member 2 OS=Homo sapiens OX=9606 GN=KCNQ2 PE=1 SV=2	190	NVFATSALRSLR
NLFAESALQSLR	sp|P0C6X1|R1AB_CVH22	770	tr|A0A0G2JQC9|A0A0G2JQC9_HUMAN Potassium voltage-gated channel subfamily KQT member 2 (Fragment) OS=Homo sapiens OX=9606 GN=KCNQ2 PE=1 SV=1	92	NVFATSALRSLR
NLFAESALQSLR	sp|P0C6X1|R1AB_CVH22	770	tr|A0A0G2JSD3|A0A0G2JSD3_HUMAN Potassium voltage-gated channel subfamily KQT member 2 (Fragment) OS=Homo sapiens OX=9606 GN=KCNQ2 PE=1 SV=1	76	NVFATSALRSLR
NLFAESALQSLR	sp|P0C6X1|R1AB_CVH22	770	tr|A0A0G2JH35|A0A0G2JH35_HUMAN Potassium voltage-gated channel subfamily KQT member 2 (Fragment) OS=Homo sapiens OX=9606 GN=KCNQ2 PE=1 SV=1	76	NVFATSALRSLR
NLFAESALQSLR	sp|P0C6X1|R1AB_CVH22	770	tr|A0A0G2JRU6|A0A0G2JRU6_HUMAN Potassium voltage-gated channel subfamily KQT member 2 (Fragment) OS=Homo sapiens OX=9606 GN=KCNQ2 PE=1 SV=1	92	NVFATSALRSLR
TLVTAPLYRRKS	sp|P15423|SPIKE_CVH22	289	tr|F8VWT6|F8VWT6_HUMAN FYVE, RhoGEF and PH domain-containing protein 6 OS=Homo sapiens OX=9606 GN=FGD6 PE=4 SV=1	18	VLVTFPLMRRKS
SVKTGDGWTAVV	sp|P0C6U2|R1A_CVH22	3069	tr|H0Y448|H0Y448_HUMAN Cortactin-binding protein 2 (Fragment) OS=Homo sapiens OX=9606 GN=CTTNBP2 PE=1 SV=1	325	SVKTTDGWTPVH
SVKTGDGWTAVV	sp|P0C6U2|R1A_CVH22	3069	sp|Q8WZ74|CTTB2_HUMAN Cortactin-binding protein 2 OS=Homo sapiens OX=9606 GN=CTTNBP2 PE=1 SV=1	837	SVKTTDGWTPVH
EVWPMSKRPKPD	sp|P0C6X1|R1AB_CVH22	4928	sp|P42568|AF9_HUMAN Protein AF-9 OS=Homo sapiens OX=9606 GN=MLLT3 PE=1 SV=2	255	EPKPMSKEPKPD
YDNLVRNVLADV	sp|P0C6X1|R1AB_CVH22	4661	sp|P59827|BPIB4_HUMAN BPI fold-containing family B member 4 OS=Homo sapiens OX=9606 GN=BPIFB4 PE=2 SV=2	315	VDNLVNRVLADV
YDNLVRNVLADV	sp|P0C6X1|R1AB_CVH22	4661	tr|A0A669KBJ0|A0A669KBJ0_HUMAN BPI fold-containing family B member 4 OS=Homo sapiens OX=9606 GN=BPIFB4 PE=1 SV=1	437	VDNLVNRVLADV
DFTVDVLDNDLL	sp|P0C6X1|R1AB_CVH22	633	sp|Q9NRY4|RHG35_HUMAN Rho GTPase-activating protein 35 OS=Homo sapiens OX=9606 GN=ARHGAP35 PE=1 SV=3	890	DGAVDVLDNDLS
LWNGLSEIVTTN	sp|P15423|SPIKE_CVH22	808	sp|P46934|NEDD4_HUMAN E3 ubiquitin-protein ligase NEDD4 OS=Homo sapiens OX=9606 GN=NEDD4 PE=1 SV=4	1134	LKNGGSEIVVTN
LWNGLSEIVTTN	sp|P15423|SPIKE_CVH22	808	tr|H0Y8X6|H0Y8X6_HUMAN HECT-type E3 ubiquitin transferase (Fragment) OS=Homo sapiens OX=9606 GN=NEDD4 PE=1 SV=1	725	LKNGGSEIVVTN
QLQTVKLTLDLT	sp|P19739|NS4A_CVH22	17	sp|Q8IWW6|RHG12_HUMAN Rho GTPase-activating protein 12 OS=Homo sapiens OX=9606 GN=ARHGAP12 PE=1 SV=1	142	QGQTVNLSLDLT
QLQTVKLTLDLT	sp|P19739|NS4A_CVH22	17	tr|Q1RLN5|Q1RLN5_HUMAN ARHGAP12 protein OS=Homo sapiens OX=9606 GN=ARHGAP12 PE=1 SV=1	142	QGQTVNLSLDLT
ISGGNAYASNKA	sp|P0C6X1|R1AB_CVH22	5999	sp|Q99959|PKP2_HUMAN Plakophilin-2 OS=Homo sapiens OX=9606 GN=PKP2 PE=1 SV=2	825	ISAGDAYASNKA
LFGSPVMNQGQN	sp|P0C6U2|R1A_CVH22	218	sp|A5PL33|KRBA1_HUMAN Protein KRBA1 OS=Homo sapiens OX=9606 GN=KRBA1 PE=1 SV=3	477	DFGSPVGNQGQH
LFGSPVMNQGQN	sp|P0C6U2|R1A_CVH22	218	tr|A0A0C4DH65|A0A0C4DH65_HUMAN Protein KRBA1 OS=Homo sapiens OX=9606 GN=KRBA1 PE=1 SV=1	511	DFGSPVGNQGQH
LFGSPVMNQGQN	sp|P0C6U2|R1A_CVH22	218	tr|A0A087WVC5|A0A087WVC5_HUMAN Protein KRBA1 (Fragment) OS=Homo sapiens OX=9606 GN=KRBA1 PE=1 SV=1	434	DFGSPVGNQGQH
GNAYASNKAYKN	sp|P0C6X1|R1AB_CVH22	6002	sp|Q99959|PKP2_HUMAN Plakophilin-2 OS=Homo sapiens OX=9606 GN=PKP2 PE=1 SV=2	828	GDAYASNKASKA
YPSNGQSAAPVV	sp|P0C6U2|R1A_CVH22	880	tr|Q69YM1|Q69YM1_HUMAN Protein FAM234B (Fragment) OS=Homo sapiens OX=9606 GN=FAM234B PE=1 SV=1	27	YLSNGTLAAPVV
YPSNGQSAAPVV	sp|P0C6U2|R1A_CVH22	880	sp|A2RU67|F234B_HUMAN Protein FAM234B OS=Homo sapiens OX=9606 GN=FAM234B PE=1 SV=1	251	YLSNGTLAAPVV
VQDEFSLNDVLR	sp|P0C6X1|R1AB_CVH22	3248	sp|Q9NYU2|UGGG1_HUMAN UDP-glucose:glycoprotein glucosyltransferase 1 OS=Homo sapiens OX=9606 GN=UGGT1 PE=1 SV=3	404	TQDIFSLFDVLR
PVNALRAIPKPW	sp|P0C6X1|R1AB_CVH22	1450	sp|P48634|PRC2A_HUMAN Protein PRRC2A OS=Homo sapiens OX=9606 GN=PRRC2A PE=1 SV=3	2114	PPDALRWIPKPW
TRIGVLKLEDFL	sp|P0C6X1|R1AB_CVH22	6369	sp|P50750|CDK9_HUMAN Cyclin-dependent kinase 9 OS=Homo sapiens OX=9606 GN=CDK9 PE=1 SV=3	158	TRDGVLKLADFG
SGMGEAGKSLSY	sp|P0C6X1|R1AB_CVH22	2482	sp|P35568|IRS1_HUMAN Insulin receptor substrate 1 OS=Homo sapiens OX=9606 GN=IRS1 PE=1 SV=1	140	SGLGEAGEDLSY
VLGGFLAPVSTL	sp|P0C6U2|R1A_CVH22	1895	tr|A0A0C4DGS8|A0A0C4DGS8_HUMAN Hepatocyte nuclear factor 1-beta OS=Homo sapiens OX=9606 GN=HNF1B PE=1 SV=1	379	VSGGGLPPVSTL
VLGGFLAPVSTL	sp|P0C6U2|R1A_CVH22	1895	tr|A0A087WZC2|A0A087WZC2_HUMAN Hepatocyte nuclear factor 1-beta OS=Homo sapiens OX=9606 GN=HNF1B PE=1 SV=1	405	VSGGGLPPVSTL
VLGGFLAPVSTL	sp|P0C6U2|R1A_CVH22	1895	sp|P35680|HNF1B_HUMAN Hepatocyte nuclear factor 1-beta OS=Homo sapiens OX=9606 GN=HNF1B PE=1 SV=1	405	VSGGGLPPVSTL
VLQTGLGTLDID	sp|P15423|SPIKE_CVH22	700	tr|E9PJY4|E9PJY4_HUMAN Puromycin-sensitive aminopeptidase (Fragment) OS=Homo sapiens OX=9606 GN=NPEPPS PE=1 SV=2	107	TLQTGTGTLKID
VLQTGLGTLDID	sp|P15423|SPIKE_CVH22	700	tr|E9PP11|E9PP11_HUMAN Puromycin-sensitive aminopeptidase (Fragment) OS=Homo sapiens OX=9606 GN=NPEPPS PE=1 SV=1	123	TLQTGTGTLKID
VLQTGLGTLDID	sp|P15423|SPIKE_CVH22	700	sp|P55786|PSA_HUMAN Puromycin-sensitive aminopeptidase OS=Homo sapiens OX=9606 GN=NPEPPS PE=1 SV=2	136	TLQTGTGTLKID
VLQTGLGTLDID	sp|P15423|SPIKE_CVH22	700	tr|E9PLK3|E9PLK3_HUMAN Aminopeptidase OS=Homo sapiens OX=9606 GN=NPEPPS PE=1 SV=1	132	TLQTGTGTLKID
VLQTGLGTLDID	sp|P15423|SPIKE_CVH22	700	sp|A6NEC2|PSAL_HUMAN Puromycin-sensitive aminopeptidase-like protein OS=Homo sapiens OX=9606 GN=NPEPPSL1 PE=2 SV=3	136	TLQTGTGTLKID
VLQTGLGTLDID	sp|P15423|SPIKE_CVH22	700	tr|E9PPD4|E9PPD4_HUMAN Puromycin-sensitive aminopeptidase OS=Homo sapiens OX=9606 GN=NPEPPS PE=1 SV=1	136	TLQTGTGTLKID
KYDLEEVEVLDV	sp|P0C6U2|R1A_CVH22	842	sp|Q99848|EBP2_HUMAN Probable rRNA-processing protein EBP2 OS=Homo sapiens OX=9606 GN=EBNA1BP2 PE=1 SV=2	61	KRDLEWVERLDV
KYDLEEVEVLDV	sp|P0C6U2|R1A_CVH22	842	tr|H7C2Q8|H7C2Q8_HUMAN EBNA1 binding protein 2, isoform CRA_d OS=Homo sapiens OX=9606 GN=EBNA1BP2 PE=1 SV=1	116	KRDLEWVERLDV
LVAVGMLTTATL	sp|P0C6X1|R1AB_CVH22	3557	sp|Q92504|S39A7_HUMAN Zinc transporter SLC39A7 OS=Homo sapiens OX=9606 GN=SLC39A7 PE=1 SV=2	10	WVAVGLLTWATL
LKETARIFLVES	sp|P0C6X1|R1AB_CVH22	5121	sp|Q9P1Z9|CC180_HUMAN Coiled-coil domain-containing protein 180 OS=Homo sapiens OX=9606 GN=CCDC180 PE=2 SV=3	1066	EKEAARIELVES
LKETARIFLVES	sp|P0C6X1|R1AB_CVH22	5121	tr|A0A6E1Y6F7|A0A6E1Y6F7_HUMAN Coiled-coil domain-containing protein 180 OS=Homo sapiens OX=9606 GN=CCDC180 PE=1 SV=1	1022	EKEAARIELVES
SQLQTVKLTLDL	sp|P19739|NS4A_CVH22	16	sp|Q6P4R8|NFRKB_HUMAN Nuclear factor related to kappa-B-binding protein OS=Homo sapiens OX=9606 GN=NFRKB PE=1 SV=2	983	SQVTTVKLTQDL
SGGNAYASNKAY	sp|P0C6X1|R1AB_CVH22	6000	sp|Q99959|PKP2_HUMAN Plakophilin-2 OS=Homo sapiens OX=9606 GN=PKP2 PE=1 SV=2	826	SAGDAYASNKAS
PYAILAALALYG	sp|P0C6U2|R1A_CVH22	2078	sp|P24864|CCNE1_HUMAN G1/S-specific cyclin-E1 OS=Homo sapiens OX=9606 GN=CCNE1 PE=1 SV=2	295	PYGILAASALYH
PYAILAALALYG	sp|P0C6U2|R1A_CVH22	2078	tr|I3L413|I3L413_HUMAN G1/S-specific cyclin-E1 (Fragment) OS=Homo sapiens OX=9606 GN=CCNE1 PE=1 SV=1	168	PYGILAASALYH
PYAILAALALYG	sp|P0C6U2|R1A_CVH22	2078	tr|C9J2U0|C9J2U0_HUMAN Cyclin E variant ex7del OS=Homo sapiens OX=9606 GN=CCNE1 PE=1 SV=3	235	PYGILAASALYH
VLTLDLSGFLTI	sp|P0C6U2|R1A_CVH22	3367	sp|Q9NZP0|OR6C3_HUMAN Olfactory receptor 6C3 OS=Homo sapiens OX=9606 GN=OR6C3 PE=3 SV=2	142	VLCAWLSGFLTI
VLTLDLSGFLTI	sp|P0C6U2|R1A_CVH22	3367	tr|H3BUD6|H3BUD6_HUMAN Adenosine deaminase-like protein (Fragment) OS=Homo sapiens OX=9606 GN=ADAL PE=1 SV=1	15	VLGLDLSGDPTI
ECKKLVGVNIND	sp|P0C6X1|R1AB_CVH22	2356	sp|A9Z1Z3|FR1L4_HUMAN Fer-1-like protein 4 OS=Homo sapiens OX=9606 GN=FER1L4 PE=2 SV=1	34	EAQKLVGVNINP
PHGVKCAVSEAR	sp|P0C6X1|R1AB_CVH22	5926	tr|C9J1N1|C9J1N1_HUMAN N-chimaerin (Fragment) OS=Homo sapiens OX=9606 GN=CHN1 PE=1 SV=9	179	AQGVKCAVLEAR
PHGVKCAVSEAR	sp|P0C6X1|R1AB_CVH22	5926	tr|F8W6K2|F8W6K2_HUMAN N-chimaerin (Fragment) OS=Homo sapiens OX=9606 GN=CHN1 PE=1 SV=2	6	AQGVKCAVLEAR
PHGVKCAVSEAR	sp|P0C6X1|R1AB_CVH22	5926	tr|A0A494C1M7|A0A494C1M7_HUMAN N-chimaerin OS=Homo sapiens OX=9606 GN=CHN1 PE=1 SV=1	106	AQGVKCAVLEAR
TVGGINLAISLS	sp|P0C6X1|R1AB_CVH22	4619	tr|K7EIU8|K7EIU8_HUMAN Mothers against decapentaplegic homolog OS=Homo sapiens OX=9606 GN=SMAD4 PE=1 SV=1	378	SVGGIAPAISLS
TVGGINLAISLS	sp|P0C6X1|R1AB_CVH22	4619	sp|Q13485|SMAD4_HUMAN Mothers against decapentaplegic homolog 4 OS=Homo sapiens OX=9606 GN=SMAD4 PE=1 SV=1	474	SVGGIAPAISLS
YIHRTQTFSHAA	sp|P0C6X1|R1AB_CVH22	5495	sp|Q16617|NKG7_HUMAN Protein NKG7 OS=Homo sapiens OX=9606 GN=NKG7 PE=1 SV=1	54	YIHVTQTFSIMA
PSNGQSAAPVVW	sp|P0C6U2|R1A_CVH22	881	tr|K7EMM9|K7EMM9_HUMAN Contactin-associated protein 1 OS=Homo sapiens OX=9606 GN=CNTNAP1 PE=1 SV=1	703	PSLGSSAVPVVW
HLSALIITENEI	sp|P0C6U2|R1A_CVH22	5	sp|Q96ND8|ZN583_HUMAN Zinc finger protein 583 OS=Homo sapiens OX=9606 GN=ZNF583 PE=2 SV=2	138	HLSQLIITHKEI
LLVDNAAAKVVN	sp|P0C6U2|R1A_CVH22	494	sp|Q5T2D2|TRML2_HUMAN Trem-like transcript 2 protein OS=Homo sapiens OX=9606 GN=TREML2 PE=1 SV=2	78	LLQDDAQAKVVN
GKHLKKDGDFEQ	sp|P0C6U2|R1A_CVH22	937	sp|O60437|PEPL_HUMAN Periplakin OS=Homo sapiens OX=9606 GN=PPL PE=1 SV=4	179	GPHLAKDGDKEQ
