query	query_seqname	query_start	target_seqname	target_start	target
VSVESSAEKVLT	sp|P15423|SPIKE_CVH22	872	tr|E9PLY3|E9PLY3_HUMAN Cathepsin B (Fragment) OS=Homo sapiens OX=9606 GN=CTSB PE=1 SV=1	129	VSVEVSAEDLLT
VSVESSAEKVLT	sp|P15423|SPIKE_CVH22	872	tr|E9PSG5|E9PSG5_HUMAN Cathepsin B (Fragment) OS=Homo sapiens OX=9606 GN=CTSB PE=1 SV=1	129	VSVEVSAEDLLT
VSVESSAEKVLT	sp|P15423|SPIKE_CVH22	872	tr|E9PQM1|E9PQM1_HUMAN Cathepsin B (Fragment) OS=Homo sapiens OX=9606 GN=CTSB PE=1 SV=1	129	VSVEVSAEDLLT
VSVESSAEKVLT	sp|P15423|SPIKE_CVH22	872	sp|P07858|CATB_HUMAN Cathepsin B OS=Homo sapiens OX=9606 GN=CTSB PE=1 SV=3	129	VSVEVSAEDLLT
VAPDYAEASKQV	sp|P15423|SPIKE_CVH22	1029	tr|B4DQH6|B4DQH6_HUMAN Thrombospondin-3 OS=Homo sapiens OX=9606 GN=THBS3 PE=1 SV=1	206	VGIDYARASKQV
VAPDYAEASKQV	sp|P15423|SPIKE_CVH22	1029	sp|P49746|TSP3_HUMAN Thrombospondin-3 OS=Homo sapiens OX=9606 GN=THBS3 PE=1 SV=1	356	VGIDYARASKQV
VAPDYAEASKQV	sp|P15423|SPIKE_CVH22	1029	tr|F5H4Z8|F5H4Z8_HUMAN Thrombospondin-3 OS=Homo sapiens OX=9606 GN=THBS3 PE=1 SV=2	347	VGIDYARASKQV
LELIKDVKSQSK	sp|P0C6U2|R1A_CVH22	194	tr|A0A3B3ISF7|A0A3B3ISF7_HUMAN DBF4-type zinc finger-containing protein 2 OS=Homo sapiens OX=9606 GN=ZDBF2 PE=1 SV=1	240	LVLWKDVKSQGK
LELIKDVKSQSK	sp|P0C6U2|R1A_CVH22	194	tr|A0A3B3ISJ7|A0A3B3ISJ7_HUMAN DBF4-type zinc finger-containing protein 2 OS=Homo sapiens OX=9606 GN=ZDBF2 PE=1 SV=1	269	LVLWKDVKSQGK
LELIKDVKSQSK	sp|P0C6U2|R1A_CVH22	194	tr|A0A3B3IRN6|A0A3B3IRN6_HUMAN DBF4-type zinc finger-containing protein 2 (Fragment) OS=Homo sapiens OX=9606 GN=ZDBF2 PE=1 SV=1	269	LVLWKDVKSQGK
LELIKDVKSQSK	sp|P0C6U2|R1A_CVH22	194	tr|A0A3B3ITZ5|A0A3B3ITZ5_HUMAN DBF4-type zinc finger-containing protein 2 (Fragment) OS=Homo sapiens OX=9606 GN=ZDBF2 PE=1 SV=1	269	LVLWKDVKSQGK
LELIKDVKSQSK	sp|P0C6U2|R1A_CVH22	194	sp|Q9HCK1|ZDBF2_HUMAN DBF4-type zinc finger-containing protein 2 OS=Homo sapiens OX=9606 GN=ZDBF2 PE=1 SV=3	269	LVLWKDVKSQGK
LELIKDVKSQSK	sp|P0C6U2|R1A_CVH22	194	tr|N0DVX5|N0DVX5_HUMAN DBF4-type zinc finger-containing protein 2 OS=Homo sapiens OX=9606 GN=ZDBF2 PE=1 SV=1	267	LVLWKDVKSQGK
GQAFTVSPCSPP	sp|P15423|SPIKE_CVH22	489	sp|Q92988|DLX4_HUMAN Homeobox protein DLX-4 OS=Homo sapiens OX=9606 GN=DLX4 PE=1 SV=4	189	GRTFSVSPCSPP
LCTSLAVALGGN	sp|P0C6U2|R1A_CVH22	436	sp|Q9H344|O51I2_HUMAN Olfactory receptor 51I2 OS=Homo sapiens OX=9606 GN=OR51I2 PE=2 SV=1	31	LCVMYAVALGGN
KVCFGTSLLNGV	sp|P0C6U2|R1A_CVH22	2984	tr|A0A3B3ITT3|A0A3B3ITT3_HUMAN Monoglyceride lipase OS=Homo sapiens OX=9606 GN=MGLL PE=1 SV=1	206	KVCFGIQLLNAV
KVCFGTSLLNGV	sp|P0C6U2|R1A_CVH22	2984	tr|H7C599|H7C599_HUMAN Monoglyceride lipase (Fragment) OS=Homo sapiens OX=9606 GN=MGLL PE=1 SV=1	100	KVCFGIQLLNAV
KVCFGTSLLNGV	sp|P0C6U2|R1A_CVH22	2984	tr|H7C4E0|H7C4E0_HUMAN Monoglyceride lipase (Fragment) OS=Homo sapiens OX=9606 GN=MGLL PE=1 SV=1	112	KVCFGIQLLNAV
KVCFGTSLLNGV	sp|P0C6U2|R1A_CVH22	2984	sp|Q99685|MGLL_HUMAN Monoglyceride lipase OS=Homo sapiens OX=9606 GN=MGLL PE=1 SV=2	206	KVCFGIQLLNAV
KVCFGTSLLNGV	sp|P0C6U2|R1A_CVH22	2984	tr|A0A0C4DFN3|A0A0C4DFN3_HUMAN Monoglyceride lipase OS=Homo sapiens OX=9606 GN=MGLL PE=1 SV=1	216	KVCFGIQLLNAV
KVCFGTSLLNGV	sp|P0C6U2|R1A_CVH22	2984	tr|E7EWX8|E7EWX8_HUMAN Monoglyceride lipase OS=Homo sapiens OX=9606 GN=MGLL PE=1 SV=1	180	KVCFGIQLLNAV
SAVGGLVIGGLN	sp|P15423|SPIKE_CVH22	751	sp|Q6NV75|GP153_HUMAN Probable G-protein coupled receptor 153 OS=Homo sapiens OX=9606 GN=GPR153 PE=2 SV=2	10	SAVGWLVCGGLS
LSWTVSRLSTAA	sp|P15423|SPIKE_CVH22	1081	sp|Q96DN2|VWCE_HUMAN von Willebrand factor C and EGF domain-containing protein OS=Homo sapiens OX=9606 GN=VWCE PE=1 SV=2	921	LSPTTSRLSTAL
LSWTVSRLSTAA	sp|P15423|SPIKE_CVH22	1081	tr|B4DY31|B4DY31_HUMAN cDNA FLJ51386 OS=Homo sapiens OX=9606 GN=VWCE PE=1 SV=1	386	LSPTTSRLSTAL
LSWTVSRLSTAA	sp|P15423|SPIKE_CVH22	1081	tr|A0A087WVD8|A0A087WVD8_HUMAN von Willebrand factor C and EGF domain-containing protein OS=Homo sapiens OX=9606 GN=VWCE PE=1 SV=1	636	LSPTTSRLSTAL
AKSGDLEFAFLK	sp|P0C6U2|R1A_CVH22	3116	sp|Q5TGJ6|HDGL1_HUMAN Hepatoma-derived growth factor-like protein 1 OS=Homo sapiens OX=9606 GN=HDGFL1 PE=2 SV=1	9	YKSGDLVFAKLK
TDVIITALRSGK	sp|P0C6X1|R1AB_CVH22	6727	tr|X6RFN3|X6RFN3_HUMAN E3 ubiquitin-protein ligase RING2 (Fragment) OS=Homo sapiens OX=9606 GN=RNF2 PE=1 SV=2	73	ADCIITALRSGN
TDVIITALRSGK	sp|P0C6X1|R1AB_CVH22	6727	sp|Q99496|RING2_HUMAN E3 ubiquitin-protein ligase RING2 OS=Homo sapiens OX=9606 GN=RNF2 PE=1 SV=1	73	ADCIITALRSGN
LATAITSVGVFV	sp|P0C6X1|R1AB_CVH22	2101	sp|Q9UBL9|P2RX2_HUMAN P2X purinoceptor 2 OS=Homo sapiens OX=9606 GN=P2RX2 PE=1 SV=1	345	LATALTSVGVGS
SVVPILFNRVLG	sp|P0C6X1|R1AB_CVH22	886	sp|P47712|PA24A_HUMAN Cytosolic phospholipase A2 OS=Homo sapiens OX=9606 GN=PLA2G4A PE=1 SV=2	395	SAFSILFNRVLG
DLYKELAVLSGC	sp|P0C6X1|R1AB_CVH22	4202	tr|A0A0G2JPK4|A0A0G2JPK4_HUMAN Putative alpha-1-antitrypsin-related protein OS=Homo sapiens OX=9606 GN=SERPINA2 PE=1 SV=1	63	DLYKELADLSQT
DLYKELAVLSGC	sp|P0C6X1|R1AB_CVH22	4202	tr|A0A0U1RQB8|A0A0U1RQB8_HUMAN Putative alpha-1-antitrypsin-related protein OS=Homo sapiens OX=9606 GN=SERPINA2 PE=1 SV=1	63	DLYKELADLSQT
NENQVVSNLPVS	sp|P0C6X1|R1AB_CVH22	2465	tr|E5RJC4|E5RJC4_HUMAN Heparan-alpha-glucosaminide N-acetyltransferase OS=Homo sapiens OX=9606 GN=HGSNAT PE=1 SV=1	106	NEDPVDSNLPVS
NENQVVSNLPVS	sp|P0C6X1|R1AB_CVH22	2465	sp|Q68CP4|HGNAT_HUMAN Heparan-alpha-glucosaminide N-acetyltransferase OS=Homo sapiens OX=9606 GN=HGSNAT PE=1 SV=2	184	NEDPVDSNLPVS
APATNLKPKPLI	sp|P0C6X1|R1AB_CVH22	1901	tr|H7BXS9|H7BXS9_HUMAN Trinucleotide repeat-containing gene 18 protein (Fragment) OS=Homo sapiens OX=9606 GN=TNRC18 PE=1 SV=1	231	APATSLAPAPLI
APATNLKPKPLI	sp|P0C6X1|R1AB_CVH22	1901	tr|H9KVB4|H9KVB4_HUMAN Trinucleotide repeat-containing gene 18 protein OS=Homo sapiens OX=9606 GN=TNRC18 PE=1 SV=1	2417	APATSLAPAPLI
APATNLKPKPLI	sp|P0C6X1|R1AB_CVH22	1901	sp|O15417|TNC18_HUMAN Trinucleotide repeat-containing gene 18 protein OS=Homo sapiens OX=9606 GN=TNRC18 PE=1 SV=3	2417	APATSLAPAPLI
RLVDSRLFIDSL	sp|P0C6X1|R1AB_CVH22	696	tr|A0A0G2JQF2|A0A0G2JQF2_HUMAN Formimidoyltetrahydrofolate cyclodeaminase (Fragment) OS=Homo sapiens OX=9606 GN=FTCD PE=1 SV=1	301	RLVVSRLGLDSL
RLVDSRLFIDSL	sp|P0C6X1|R1AB_CVH22	696	tr|B7WPK3|B7WPK3_HUMAN Formimidoyltetrahydrofolate cyclodeaminase OS=Homo sapiens OX=9606 GN=FTCD PE=1 SV=1	301	RLVVSRLGLDSL
RLVDSRLFIDSL	sp|P0C6X1|R1AB_CVH22	696	sp|O95954|FTCD_HUMAN Formimidoyltransferase-cyclodeaminase OS=Homo sapiens OX=9606 GN=FTCD PE=1 SV=2	301	RLVVSRLGLDSL
KPGVRYVRFEHE	sp|P0C6U2|R1A_CVH22	3870	sp|Q9UK22|FBX2_HUMAN F-box only protein 2 OS=Homo sapiens OX=9606 GN=FBXO2 PE=1 SV=2	261	GPGVRFVRFEHG
KPGVRYVRFEHE	sp|P0C6U2|R1A_CVH22	3870	tr|A0A286YF37|A0A286YF37_HUMAN F-box only protein 2 (Fragment) OS=Homo sapiens OX=9606 GN=FBXO2 PE=1 SV=1	233	GPGVRFVRFEHG
PGVRYVRFEHES	sp|P0C6U2|R1A_CVH22	3871	sp|Q9UK22|FBX2_HUMAN F-box only protein 2 OS=Homo sapiens OX=9606 GN=FBXO2 PE=1 SV=2	262	PGVRFVRFEHGG
PGVRYVRFEHES	sp|P0C6U2|R1A_CVH22	3871	tr|A0A286YF37|A0A286YF37_HUMAN F-box only protein 2 (Fragment) OS=Homo sapiens OX=9606 GN=FBXO2 PE=1 SV=1	234	PGVRFVRFEHGG
QVPSSFSSQISV	sp|P15423|SPIKE_CVH22	583	sp|Q7Z7G8|VP13B_HUMAN Vacuolar protein sorting-associated protein 13B OS=Homo sapiens OX=9606 GN=VPS13B PE=1 SV=2	2812	QVPSSNSSIIYV
LLGLPNSLFLLG	sp|P0C6X1|R1AB_CVH22	2584	sp|Q96Q80|DERL3_HUMAN Derlin-3 OS=Homo sapiens OX=9606 GN=DERL3 PE=1 SV=2	110	LLGLLGSLFFLG
VIRSGVCVEKAV	sp|P0C6U2|R1A_CVH22	3216	tr|A0A0U1RR70|A0A0U1RR70_HUMAN Serine/threonine-protein kinase DCLK2 OS=Homo sapiens OX=9606 GN=DCLK2 PE=1 SV=1	201	VIRSGVKPRKAV
VIRSGVCVEKAV	sp|P0C6U2|R1A_CVH22	3216	tr|G5E9L9|G5E9L9_HUMAN Doublecortin and CaM kinase-like 2, isoform CRA_c OS=Homo sapiens OX=9606 GN=DCLK2 PE=1 SV=1	201	VIRSGVKPRKAV
VIRSGVCVEKAV	sp|P0C6U2|R1A_CVH22	3216	sp|Q8N568|DCLK2_HUMAN Serine/threonine-protein kinase DCLK2 OS=Homo sapiens OX=9606 GN=DCLK2 PE=1 SV=4	201	VIRSGVKPRKAV
KPLLSEDVFQYA	sp|P0C6X1|R1AB_CVH22	126	sp|Q9UIQ6|LCAP_HUMAN Leucyl-cystinyl aminopeptidase OS=Homo sapiens OX=9606 GN=LNPEP PE=1 SV=3	560	KTYLSEDVFQHA
SSIQSLRNLNIY	sp|P0C6U2|R1A_CVH22	2293	sp|Q15678|PTN14_HUMAN Tyrosine-protein phosphatase non-receptor type 14 OS=Homo sapiens OX=9606 GN=PTPN14 PE=1 SV=2	461	SQSQSLRNLNII
ISSTEAVPGRVK	sp|P0C6U2|R1A_CVH22	3823	tr|I3L3L4|I3L3L4_HUMAN Heat shock protein 75 kDa, mitochondrial OS=Homo sapiens OX=9606 GN=TRAP1 PE=1 SV=1	75	ISSTESVQGRVL
RFKKSPSEEANQ	sp|P15130|NCAP_CVH22	248	sp|Q9BXP8|PAPP2_HUMAN Pappalysin-2 OS=Homo sapiens OX=9606 GN=PAPPA2 PE=1 SV=4	230	RVKKSPPEESNQ
ALRSGKLALRGT	sp|P0C6X1|R1AB_CVH22	6733	sp|O00231|PSD11_HUMAN 26S proteasome non-ATPase regulatory subunit 11 OS=Homo sapiens OX=9606 GN=PSMD11 PE=1 SV=3	269	ALVSGKLALRYA
GSSIQSLRNLNI	sp|P0C6U2|R1A_CVH22	2292	sp|Q15678|PTN14_HUMAN Tyrosine-protein phosphatase non-receptor type 14 OS=Homo sapiens OX=9606 GN=PTPN14 PE=1 SV=2	460	DSQSQSLRNLNI
SSGDLIKFLKTV	sp|P0C6X1|R1AB_CVH22	425	sp|Q8IV33|K0825_HUMAN Uncharacterized protein KIAA0825 OS=Homo sapiens OX=9606 GN=KIAA0825 PE=1 SV=3	89	SHGDLIKFFKTL
LFFFLLIINGLA	sp|P0C6U2|R1A_CVH22	2847	sp|Q9H244|P2Y12_HUMAN P2Y purinoceptor 12 OS=Homo sapiens OX=9606 GN=P2RY12 PE=1 SV=1	35	LFFVGLITNGLA
EYLVYTTTGTSI	sp|P0C6X1|R1AB_CVH22	2284	sp|Q7Z570|Z804A_HUMAN Zinc finger protein 804A OS=Homo sapiens OX=9606 GN=ZNF804A PE=2 SV=3	442	EMLVYTTTKPSI
ILVNVPEKFLSL	sp|P0C6X1|R1AB_CVH22	450	sp|Q8IV33|K0825_HUMAN Uncharacterized protein KIAA0825 OS=Homo sapiens OX=9606 GN=KIAA0825 PE=1 SV=3	658	ILVEVLEKSLSL
WAAVLLILNLCA	sp|P0C6U2|R1A_CVH22	3309	sp|Q6T4R5|NHS_HUMAN Nance-Horan syndrome protein OS=Homo sapiens OX=9606 GN=NHS PE=1 SV=2	115	AAAVLLMLDLCA
PSLISQEHFSTA	sp|P0C6X1|R1AB_CVH22	5234	sp|Q6P6B1|ERIC5_HUMAN Glutamate-rich protein 5 OS=Homo sapiens OX=9606 GN=ERICH5 PE=1 SV=1	18	PSVTSNEHFSTA
LKESDGKNLKLK	sp|P0C6X1|R1AB_CVH22	3788	sp|P07947|YES_HUMAN Tyrosine-protein kinase Yes OS=Homo sapiens OX=9606 GN=YES1 PE=1 SV=3	360	LKEGDGKYLKLP
LKESDGKNLKLK	sp|P0C6X1|R1AB_CVH22	3788	tr|J3QRU1|J3QRU1_HUMAN Tyrosine-protein kinase OS=Homo sapiens OX=9606 GN=YES1 PE=1 SV=1	365	LKEGDGKYLKLP
FFVIVGFATCAY	sp|P0C6X1|R1AB_CVH22	3469	sp|Q8N2K1|UB2J2_HUMAN Ubiquitin-conjugating enzyme E2 J2 OS=Homo sapiens OX=9606 GN=UBE2J2 PE=1 SV=3	236	LFVIVGFAAFAY
FFVIVGFATCAY	sp|P0C6X1|R1AB_CVH22	3469	tr|A6NGS0|A6NGS0_HUMAN Ubiquitin-conjugating enzyme E2 J2 OS=Homo sapiens OX=9606 GN=UBE2J2 PE=1 SV=1	184	LFVIVGFAAFAY
LLASCVLGVFVL	sp|P0C6X1|R1AB_CVH22	2755	sp|P0CG01|GKN3_HUMAN Gastrokine-3 OS=Homo sapiens OX=9606 GN=GKN3P PE=3 SV=1	4	LVASSILGVFVL
SLLASCVLGVFV	sp|P0C6X1|R1AB_CVH22	2754	tr|D6RHJ0|D6RHJ0_HUMAN Sodium/hydrogen exchanger 9B1 (Fragment) OS=Homo sapiens OX=9606 GN=SLC9B1 PE=1 SV=1	236	SLLAGIVLGFFV
SLLASCVLGVFV	sp|P0C6X1|R1AB_CVH22	2754	sp|A6NJY1|SL9P1_HUMAN Putative SLC9B1-like protein SLC9B1P1 OS=Homo sapiens OX=9606 GN=SLC9B1P1 PE=5 SV=4	60	SLLAGIVLGFFV
SLLASCVLGVFV	sp|P0C6X1|R1AB_CVH22	2754	sp|Q4ZJI4|SL9B1_HUMAN Sodium/hydrogen exchanger 9B1 OS=Homo sapiens OX=9606 GN=SLC9B1 PE=2 SV=2	293	SLLAGIVLGFFV
SLLASCVLGVFV	sp|P0C6X1|R1AB_CVH22	2754	tr|H0Y9Z0|H0Y9Z0_HUMAN Sodium/hydrogen exchanger 9B1 (Fragment) OS=Homo sapiens OX=9606 GN=SLC9B1 PE=4 SV=1	18	SLLAGIVLGFFV
KSASSKLLKIAI	sp|P0C6X1|R1AB_CVH22	5901	sp|O95067|CCNB2_HUMAN G2/mitotic-specific cyclin-B2 OS=Homo sapiens OX=9606 GN=CCNB2 PE=1 SV=1	367	KYASSKLLKISM
KSASSKLLKIAI	sp|P0C6X1|R1AB_CVH22	5901	tr|H0YMP3|H0YMP3_HUMAN G2/mitotic-specific cyclin-B2 OS=Homo sapiens OX=9606 GN=CCNB2 PE=1 SV=1	239	KYASSKLLKISM
VFNSSWTVIVIN	sp|P0C6U2|R1A_CVH22	2741	tr|H0YBE3|H0YBE3_HUMAN Protein FAM184A (Fragment) OS=Homo sapiens OX=9606 GN=FAM184A PE=1 SV=1	10	VFNSSPTVGVIN
VFNSSWTVIVIN	sp|P0C6U2|R1A_CVH22	2741	tr|H0YBA5|H0YBA5_HUMAN Protein FAM184A OS=Homo sapiens OX=9606 GN=FAM184A PE=1 SV=2	911	VFNSSPTVGVIN
VFNSSWTVIVIN	sp|P0C6U2|R1A_CVH22	2741	tr|A0A0C4DGZ2|A0A0C4DGZ2_HUMAN Protein FAM184A OS=Homo sapiens OX=9606 GN=FAM184A PE=1 SV=1	183	VFNSSPTVGVIN
VFNSSWTVIVIN	sp|P0C6U2|R1A_CVH22	2741	sp|Q8NB25|F184A_HUMAN Protein FAM184A OS=Homo sapiens OX=9606 GN=FAM184A PE=1 SV=3	1031	VFNSSPTVGVIN
VFNSSWTVIVIN	sp|P0C6U2|R1A_CVH22	2741	tr|A0A087X2A7|A0A087X2A7_HUMAN Protein FAM184A OS=Homo sapiens OX=9606 GN=FAM184A PE=1 SV=1	989	VFNSSPTVGVIN
VFNSSWTVIVIN	sp|P0C6U2|R1A_CVH22	2741	tr|H0YBZ6|H0YBZ6_HUMAN Protein FAM184A (Fragment) OS=Homo sapiens OX=9606 GN=FAM184A PE=1 SV=1	17	VFNSSPTVGVIN
VFNSSWTVIVIN	sp|P0C6U2|R1A_CVH22	2741	tr|B9DI78|B9DI78_HUMAN Protein FAM184A (Fragment) OS=Homo sapiens OX=9606 GN=FAM184A PE=1 SV=1	92	VFNSSPTVGVIN
TGRLEDQGVVVF	sp|P0C6U2|R1A_CVH22	1130	sp|O43157|PLXB1_HUMAN Plexin-B1 OS=Homo sapiens OX=9606 GN=PLXNB1 PE=1 SV=3	1189	TGRLEDIRVVVG
