query	query_seqname	query_start	target_seqname	target_start	target
SFSSSPPKPRRS	tr|B6DVW7|B6DVW7_9POLY	295	sp|Q5T5P2|SKT_HUMAN Sickle tail protein homolog OS=Homo sapiens OX=9606 GN=KIAA1217 PE=1 SV=2	1892	SFSSSPPSPASS
EEVQQSSFQDED	tr|B6DVW7|B6DVW7_9POLY	249	sp|Q9UJ98|STAG3_HUMAN Cohesin subunit SA-3 OS=Homo sapiens OX=9606 GN=STAG3 PE=1 SV=2	683	EELLQSSFLDED
EEVQQSSFQDED	tr|B6DVW7|B6DVW7_9POLY	249	tr|D6W5U7|D6W5U7_HUMAN Cohesin subunit SA-3 OS=Homo sapiens OX=9606 GN=STAG3 PE=1 SV=1	683	EELLQSSFLDED
LEEVQQSSFQDE	tr|B6DVW7|B6DVW7_9POLY	248	sp|Q9UJ98|STAG3_HUMAN Cohesin subunit SA-3 OS=Homo sapiens OX=9606 GN=STAG3 PE=1 SV=2	682	LEELLQSSFLDE
LEEVQQSSFQDE	tr|B6DVW7|B6DVW7_9POLY	248	tr|D6W5U7|D6W5U7_HUMAN Cohesin subunit SA-3 OS=Homo sapiens OX=9606 GN=STAG3 PE=1 SV=1	682	LEELLQSSFLDE
PKLGLQSPEAPS	tr|B0G0W3|B0G0W3_9POLY	61	sp|Q53F19|NCBP3_HUMAN Nuclear cap-binding protein subunit 3 OS=Homo sapiens OX=9606 GN=NCBP3 PE=1 SV=2	19	PALGLPSPEAES
LNLSQGLSLELL	tr|B0G0W4|B0G0W4_9POLY	18	tr|I3L2S9|I3L2S9_HUMAN Asialoglycoprotein receptor 1 (Fragment) OS=Homo sapiens OX=9606 GN=ASGR1 PE=1 SV=1	42	LLLSLGLSLLLL
LNLSQGLSLELL	tr|B0G0W4|B0G0W4_9POLY	18	sp|P07306|ASGR1_HUMAN Asialoglycoprotein receptor 1 OS=Homo sapiens OX=9606 GN=ASGR1 PE=1 SV=2	42	LLLSLGLSLLLL
QPTGNSIPKSSS	tr|B6DVW7|B6DVW7_9POLY	192	tr|U3KPY3|U3KPY3_HUMAN Single-stranded DNA-binding protein 4 (Fragment) OS=Homo sapiens OX=9606 GN=SSBP4 PE=1 SV=2	16	SPSGNSIPYSSS
QPTGNSIPKSSS	tr|B6DVW7|B6DVW7_9POLY	192	sp|Q9BWG4|SSBP4_HUMAN Single-stranded DNA-binding protein 4 OS=Homo sapiens OX=9606 GN=SSBP4 PE=1 SV=1	245	SPSGNSIPYSSS
SSISFSSSPPKP	tr|B6DVW7|B6DVW7_9POLY	292	sp|Q9NUC0|SRTD4_HUMAN SERTA domain-containing protein 4 OS=Homo sapiens OX=9606 GN=SERTAD4 PE=1 SV=1	225	SSSSSSSSPPLP
SSISFSSSPPKP	tr|B6DVW7|B6DVW7_9POLY	292	tr|M0QY76|M0QY76_HUMAN Zinc finger protein 36, C3H type, homolog (Mouse), isoform CRA_a OS=Homo sapiens OX=9606 GN=ZFP36 PE=1 SV=1	217	SSFSPSSSPPPP
SSISFSSSPPKP	tr|B6DVW7|B6DVW7_9POLY	292	sp|P26651|TTP_HUMAN mRNA decay activator protein ZFP36 OS=Homo sapiens OX=9606 GN=ZFP36 PE=1 SV=1	211	SSFSPSSSPPPP
SSISFSSSPPKP	tr|B6DVW7|B6DVW7_9POLY	292	sp|Q15911|ZFHX3_HUMAN Zinc finger homeobox protein 3 OS=Homo sapiens OX=9606 GN=ZFHX3 PE=1 SV=2	1643	SSISLSSSTPSP
NKSSLSSLSSIS	tr|B6DVW7|B6DVW7_9POLY	284	tr|B7WP74|B7WP74_HUMAN Pre-mRNA-splicing factor CWC22 homolog (Fragment) OS=Homo sapiens OX=9606 GN=CWC22 PE=1 SV=1	664	NKSSPSSSSSAS
NKSSLSSLSSIS	tr|B6DVW7|B6DVW7_9POLY	284	sp|Q9HCG8|CWC22_HUMAN Pre-mRNA-splicing factor CWC22 homolog OS=Homo sapiens OX=9606 GN=CWC22 PE=1 SV=3	664	NKSSPSSSSSAS
NKSSLSSLSSIS	tr|B6DVW7|B6DVW7_9POLY	284	sp|A6NK53|ZN233_HUMAN Zinc finger protein 233 OS=Homo sapiens OX=9606 GN=ZNF233 PE=2 SV=3	658	SKSSLSSDSSES
NKSSLSSLSSIS	tr|B6DVW7|B6DVW7_9POLY	284	tr|A0A0A0MT46|A0A0A0MT46_HUMAN POU domain protein (Fragment) OS=Homo sapiens OX=9606 GN=POU2F1 PE=1 SV=1	309	NLSSDSSLSSPS
NKSSLSSLSSIS	tr|B6DVW7|B6DVW7_9POLY	284	sp|P14859|PO2F1_HUMAN POU domain, class 2, transcription factor 1 OS=Homo sapiens OX=9606 GN=POU2F1 PE=1 SV=2	355	NLSSDSSLSSPS
NKSSLSSLSSIS	tr|B6DVW7|B6DVW7_9POLY	284	tr|A0A0C4DG88|A0A0C4DG88_HUMAN POU domain protein (Fragment) OS=Homo sapiens OX=9606 GN=POU2F1 PE=1 SV=1	263	NLSSDSSLSSPS
NKSSLSSLSSIS	tr|B6DVW7|B6DVW7_9POLY	284	sp|P12755|SKI_HUMAN Ski oncogene OS=Homo sapiens OX=9606 GN=SKI PE=1 SV=1	492	FTSSLSSLSSPS
NKSSLSSLSSIS	tr|B6DVW7|B6DVW7_9POLY	284	tr|M0QZD4|M0QZD4_HUMAN Paternally-expressed gene 3 protein (Fragment) OS=Homo sapiens OX=9606 GN=PEG3 PE=1 SV=2	396	SVSSLSSLSSPS
NKSSLSSLSSIS	tr|B6DVW7|B6DVW7_9POLY	284	tr|A0A3B3ISL2|A0A3B3ISL2_HUMAN Paternally-expressed gene 3 protein (Fragment) OS=Homo sapiens OX=9606 GN=PEG3 PE=1 SV=1	303	SVSSLSSLSSPS
NKSSLSSLSSIS	tr|B6DVW7|B6DVW7_9POLY	284	sp|Q9GZU2|PEG3_HUMAN Paternally-expressed gene 3 protein OS=Homo sapiens OX=9606 GN=PEG3 PE=1 SV=1	427	SVSSLSSLSSPS
NKSSLSSLSSIS	tr|B6DVW7|B6DVW7_9POLY	284	tr|A0A3B3IRU6|A0A3B3IRU6_HUMAN Paternally-expressed gene 3 protein OS=Homo sapiens OX=9606 GN=PEG3 PE=1 SV=1	272	SVSSLSSLSSPS
NKSSLSSLSSIS	tr|B6DVW7|B6DVW7_9POLY	284	sp|Q8WWA1|TMM40_HUMAN Transmembrane protein 40 OS=Homo sapiens OX=9606 GN=TMEM40 PE=1 SV=2	48	NKSSSSSSSSSS
SNQPTGNSIPKS	tr|B6DVW7|B6DVW7_9POLY	190	sp|Q5VZ89|DEN4C_HUMAN DENN domain-containing protein 4C OS=Homo sapiens OX=9606 GN=DENND4C PE=1 SV=3	730	SRHPTGNSITKS
FSVNSISESTTH	tr|B6DVW7|B6DVW7_9POLY	148	sp|P78527|PRKDC_HUMAN DNA-dependent protein kinase catalytic subunit OS=Homo sapiens OX=9606 GN=PRKDC PE=1 SV=3	551	FSVNSSSESLNH
TLEEVQQSSFQD	tr|B6DVW7|B6DVW7_9POLY	247	tr|E7ER04|E7ER04_HUMAN T-cell differentiation antigen CD6 (Fragment) OS=Homo sapiens OX=9606 GN=CD6 PE=1 SV=2	378	TDEEVQQSRFQM
TLEEVQQSSFQD	tr|B6DVW7|B6DVW7_9POLY	247	sp|P30203|CD6_HUMAN T-cell differentiation antigen CD6 OS=Homo sapiens OX=9606 GN=CD6 PE=1 SV=3	511	TDEEVQQSRFQM
SSLSSLSSISFS	tr|B6DVW7|B6DVW7_9POLY	286	sp|Q9UPV0|CE164_HUMAN Centrosomal protein of 164 kDa OS=Homo sapiens OX=9606 GN=CEP164 PE=1 SV=3	1227	DSLSSESSESFS
SSLSSLSSISFS	tr|B6DVW7|B6DVW7_9POLY	286	sp|A0A1B0GTH6|CS2IP_HUMAN Casein kinase II subunit alpha'-interacting protein OS=Homo sapiens OX=9606 GN=CSNKA2IP PE=3 SV=1	636	SSSSSSSSSSFS
SSLSSLSSISFS	tr|B6DVW7|B6DVW7_9POLY	286	sp|Q13029|PRDM2_HUMAN PR domain zinc finger protein 2 OS=Homo sapiens OX=9606 GN=PRDM2 PE=1 SV=3	1054	SSSSSSSSSSFS
SSLSSLSSISFS	tr|B6DVW7|B6DVW7_9POLY	286	sp|P42568|AF9_HUMAN Protein AF-9 OS=Homo sapiens OX=9606 GN=MLLT3 PE=1 SV=2	183	SSSSSSSSTSFS
SSLSSLSSISFS	tr|B6DVW7|B6DVW7_9POLY	286	sp|Q9NXR8|ING3_HUMAN Inhibitor of growth protein 3 OS=Homo sapiens OX=9606 GN=ING3 PE=1 SV=2	317	SSSSSLSSCSSS
SSLSSLSSISFS	tr|B6DVW7|B6DVW7_9POLY	286	tr|E7ET07|E7ET07_HUMAN Inhibitor of growth protein OS=Homo sapiens OX=9606 GN=ING3 PE=1 SV=1	302	SSSSSLSSCSSS
SSLSSLSSISFS	tr|B6DVW7|B6DVW7_9POLY	286	sp|O15047|SET1A_HUMAN Histone-lysine N-methyltransferase SETD1A OS=Homo sapiens OX=9606 GN=SETD1A PE=1 SV=3	342	SSLSSSSSSSSS
SSLSSLSSISFS	tr|B6DVW7|B6DVW7_9POLY	286	sp|Q14774|HLX_HUMAN H2.0-like homeobox protein OS=Homo sapiens OX=9606 GN=HLX PE=1 SV=3	437	SSASSLSSSSTS
SSLSSLSSISFS	tr|B6DVW7|B6DVW7_9POLY	286	tr|E7EWN3|E7EWN3_HUMAN Histone-lysine N-methyltransferase SETD5 OS=Homo sapiens OX=9606 GN=SETD5 PE=1 SV=1	1308	SSESSLSSTSYS
SSLSSLSSISFS	tr|B6DVW7|B6DVW7_9POLY	286	sp|Q9C0A6|SETD5_HUMAN Histone-lysine N-methyltransferase SETD5 OS=Homo sapiens OX=9606 GN=SETD5 PE=1 SV=2	1289	SSESSLSSTSYS
SSLSSLSSISFS	tr|B6DVW7|B6DVW7_9POLY	286	tr|M0QZD4|M0QZD4_HUMAN Paternally-expressed gene 3 protein (Fragment) OS=Homo sapiens OX=9606 GN=PEG3 PE=1 SV=2	398	SSLSSLSSPSFT
SSLSSLSSISFS	tr|B6DVW7|B6DVW7_9POLY	286	tr|A0A3B3ISL2|A0A3B3ISL2_HUMAN Paternally-expressed gene 3 protein (Fragment) OS=Homo sapiens OX=9606 GN=PEG3 PE=1 SV=1	305	SSLSSLSSPSFT
SSLSSLSSISFS	tr|B6DVW7|B6DVW7_9POLY	286	sp|Q9GZU2|PEG3_HUMAN Paternally-expressed gene 3 protein OS=Homo sapiens OX=9606 GN=PEG3 PE=1 SV=1	429	SSLSSLSSPSFT
SSLSSLSSISFS	tr|B6DVW7|B6DVW7_9POLY	286	tr|A0A3B3IRU6|A0A3B3IRU6_HUMAN Paternally-expressed gene 3 protein OS=Homo sapiens OX=9606 GN=PEG3 PE=1 SV=1	274	SSLSSLSSPSFT
SSLSSLSSISFS	tr|B6DVW7|B6DVW7_9POLY	286	sp|P12755|SKI_HUMAN Ski oncogene OS=Homo sapiens OX=9606 GN=SKI PE=1 SV=1	494	SSLSSLSSPSFT
LSSLSSISFSSS	tr|B6DVW7|B6DVW7_9POLY	288	tr|M0QZD4|M0QZD4_HUMAN Paternally-expressed gene 3 protein (Fragment) OS=Homo sapiens OX=9606 GN=PEG3 PE=1 SV=2	400	LSSLSSPSFTES
LSSLSSISFSSS	tr|B6DVW7|B6DVW7_9POLY	288	tr|A0A3B3ISL2|A0A3B3ISL2_HUMAN Paternally-expressed gene 3 protein (Fragment) OS=Homo sapiens OX=9606 GN=PEG3 PE=1 SV=1	307	LSSLSSPSFTES
LSSLSSISFSSS	tr|B6DVW7|B6DVW7_9POLY	288	sp|Q9GZU2|PEG3_HUMAN Paternally-expressed gene 3 protein OS=Homo sapiens OX=9606 GN=PEG3 PE=1 SV=1	431	LSSLSSPSFTES
LSSLSSISFSSS	tr|B6DVW7|B6DVW7_9POLY	288	tr|A0A3B3IRU6|A0A3B3IRU6_HUMAN Paternally-expressed gene 3 protein OS=Homo sapiens OX=9606 GN=PEG3 PE=1 SV=1	276	LSSLSSPSFTES
LSSLSSISFSSS	tr|B6DVW7|B6DVW7_9POLY	288	sp|Q13029|PRDM2_HUMAN PR domain zinc finger protein 2 OS=Homo sapiens OX=9606 GN=PRDM2 PE=1 SV=3	1056	SSSSSSSSFSSS
LSSLSSISFSSS	tr|B6DVW7|B6DVW7_9POLY	288	sp|Q2Q1W2|LIN41_HUMAN E3 ubiquitin-protein ligase TRIM71 OS=Homo sapiens OX=9606 GN=TRIM71 PE=1 SV=1	25	LSSNSSASSSSS
LSSLSSISFSSS	tr|B6DVW7|B6DVW7_9POLY	288	sp|Q9NZM4|BICRA_HUMAN BRD4-interacting chromatin-remodeling complex-associated protein OS=Homo sapiens OX=9606 GN=BICRA PE=1 SV=2	1265	SSSLSSSSSSSS
LSSLSSISFSSS	tr|B6DVW7|B6DVW7_9POLY	288	tr|A0A087WWH3|A0A087WWH3_HUMAN BRD4-interacting chromatin-remodeling complex-associated protein OS=Homo sapiens OX=9606 GN=BICRA PE=1 SV=1	1213	SSSLSSSSSSSS
LSSLSSISFSSS	tr|B6DVW7|B6DVW7_9POLY	288	sp|O15047|SET1A_HUMAN Histone-lysine N-methyltransferase SETD1A OS=Homo sapiens OX=9606 GN=SETD1A PE=1 SV=3	341	SSSLSSSSSSSS
LSSLSSISFSSS	tr|B6DVW7|B6DVW7_9POLY	288	sp|Q13029|PRDM2_HUMAN PR domain zinc finger protein 2 OS=Homo sapiens OX=9606 GN=PRDM2 PE=1 SV=3	1051	LSSSSSSSSSSS
LSSLSSISFSSS	tr|B6DVW7|B6DVW7_9POLY	288	sp|O15047|SET1A_HUMAN Histone-lysine N-methyltransferase SETD1A OS=Homo sapiens OX=9606 GN=SETD1A PE=1 SV=3	344	LSSSSSSSSSSS
LSSLSSISFSSS	tr|B6DVW7|B6DVW7_9POLY	288	tr|H0YNG1|H0YNG1_HUMAN POU domain, class 2, transcription factor 2 (Fragment) OS=Homo sapiens OX=9606 GN=POU2F2 PE=4 SV=1	162	LSSSSSSSSSSS
LSSLSSISFSSS	tr|B6DVW7|B6DVW7_9POLY	288	tr|B5ME60|B5ME60_HUMAN POU domain protein OS=Homo sapiens OX=9606 GN=POU2F2 PE=1 SV=4	550	LSSSSSSSSSSS
LSSLSSISFSSS	tr|B6DVW7|B6DVW7_9POLY	288	sp|A8MTJ6|FOXI3_HUMAN Forkhead box protein I3 OS=Homo sapiens OX=9606 GN=FOXI3 PE=2 SV=3	316	FSSLSSLSVSSS
LSSLSSISFSSS	tr|B6DVW7|B6DVW7_9POLY	288	sp|P12755|SKI_HUMAN Ski oncogene OS=Homo sapiens OX=9606 GN=SKI PE=1 SV=1	496	LSSLSSPSFTSS
TVDDLKIYDGSD	tr|B0G0W3|B0G0W3_9POLY	350	tr|H7BZ74|H7BZ74_HUMAN FYVE and coiled-coil domain-containing protein 1 (Fragment) OS=Homo sapiens OX=9606 GN=FYCO1 PE=1 SV=1	254	TVDRPVIYDGSD
TVDDLKIYDGSD	tr|B0G0W3|B0G0W3_9POLY	350	sp|Q9BQS8|FYCO1_HUMAN FYVE and coiled-coil domain-containing protein 1 OS=Homo sapiens OX=9606 GN=FYCO1 PE=1 SV=3	1465	TVDRPVIYDGSD
TVDDLKIYDGSD	tr|B0G0W3|B0G0W3_9POLY	350	tr|C9J2W6|C9J2W6_HUMAN FYVE and coiled-coil domain-containing protein 1 OS=Homo sapiens OX=9606 GN=FYCO1 PE=1 SV=1	136	TVDRPVIYDGSD
TTLEEVQQSSFQ	tr|B6DVW7|B6DVW7_9POLY	246	tr|E7ER04|E7ER04_HUMAN T-cell differentiation antigen CD6 (Fragment) OS=Homo sapiens OX=9606 GN=CD6 PE=1 SV=2	377	VTDEEVQQSRFQ
TTLEEVQQSSFQ	tr|B6DVW7|B6DVW7_9POLY	246	sp|P30203|CD6_HUMAN T-cell differentiation antigen CD6 OS=Homo sapiens OX=9606 GN=CD6 PE=1 SV=3	510	VTDEEVQQSRFQ
DMVSIVSGDESV	tr|B0G0W3|B0G0W3_9POLY	41	tr|C9JGA2|C9JGA2_HUMAN 5-azacytidine-induced protein 2 (Fragment) OS=Homo sapiens OX=9606 GN=AZI2 PE=1 SV=1	24	TPVSIYSGDESV
DMVSIVSGDESV	tr|B0G0W3|B0G0W3_9POLY	41	tr|C9JVK8|C9JVK8_HUMAN 5-azacytidine-induced protein 2 (Fragment) OS=Homo sapiens OX=9606 GN=AZI2 PE=1 SV=1	24	TPVSIYSGDESV
DMVSIVSGDESV	tr|B0G0W3|B0G0W3_9POLY	41	sp|Q9H6S1|AZI2_HUMAN 5-azacytidine-induced protein 2 OS=Homo sapiens OX=9606 GN=AZI2 PE=1 SV=1	24	TPVSIYSGDESV
SSKFVFNQSLSS	tr|B0G0W4|B0G0W4_9POLY	172	tr|G3V515|G3V515_HUMAN mRNA decay activator protein ZFP36L1 (Fragment) OS=Homo sapiens OX=9606 GN=ZFP36L1 PE=1 SV=1	128	SSKFHQNQLLSS
SSKFVFNQSLSS	tr|B0G0W4|B0G0W4_9POLY	172	tr|G3V2D5|G3V2D5_HUMAN mRNA decay activator protein ZFP36L1 (Fragment) OS=Homo sapiens OX=9606 GN=ZFP36L1 PE=1 SV=1	37	SSKFHQNQLLSS
SSKFVFNQSLSS	tr|B0G0W4|B0G0W4_9POLY	172	tr|G3V2P5|G3V2P5_HUMAN mRNA decay activator protein ZFP36L1 (Fragment) OS=Homo sapiens OX=9606 GN=ZFP36L1 PE=1 SV=1	65	SSKFHQNQLLSS
SSKFVFNQSLSS	tr|B0G0W4|B0G0W4_9POLY	172	sp|Q07352|TISB_HUMAN mRNA decay activator protein ZFP36L1 OS=Homo sapiens OX=9606 GN=ZFP36L1 PE=1 SV=1	59	SSKFHQNQLLSS
MVSIVSGDESVN	tr|B0G0W3|B0G0W3_9POLY	42	tr|C9JGA2|C9JGA2_HUMAN 5-azacytidine-induced protein 2 (Fragment) OS=Homo sapiens OX=9606 GN=AZI2 PE=1 SV=1	25	PVSIYSGDESVA
MVSIVSGDESVN	tr|B0G0W3|B0G0W3_9POLY	42	tr|C9JVK8|C9JVK8_HUMAN 5-azacytidine-induced protein 2 (Fragment) OS=Homo sapiens OX=9606 GN=AZI2 PE=1 SV=1	25	PVSIYSGDESVA
MVSIVSGDESVN	tr|B0G0W3|B0G0W3_9POLY	42	sp|Q9H6S1|AZI2_HUMAN 5-azacytidine-induced protein 2 OS=Homo sapiens OX=9606 GN=AZI2 PE=1 SV=1	25	PVSIYSGDESVA
KCVCLTCRVTRN	tr|B0G0V7|B0G0V7_9POLY	118	tr|H7C0D9|H7C0D9_HUMAN DNA-directed RNA polymerase (Fragment) OS=Homo sapiens OX=9606 GN=POLR1B PE=1 SV=8	250	KCVCITMRVPRN
KCVCLTCRVTRN	tr|B0G0V7|B0G0V7_9POLY	118	sp|Q9H9Y6|RPA2_HUMAN DNA-directed RNA polymerase I subunit RPA2 OS=Homo sapiens OX=9606 GN=POLR1B PE=1 SV=2	865	KCVCITMRVPRN
ILEALEGKLLSL	tr|B6DVW7|B6DVW7_9POLY	606	sp|Q5T2E6|ARMD3_HUMAN Armadillo-like helical domain-containing protein 3 OS=Homo sapiens OX=9606 GN=ARMH3 PE=1 SV=1	55	NLEYLEGKLESL
ILEALEGKLLSL	tr|B6DVW7|B6DVW7_9POLY	606	tr|Q5T2E7|Q5T2E7_HUMAN Armadillo-like helical domain-containing protein 3 OS=Homo sapiens OX=9606 GN=ARMH3 PE=1 SV=1	55	NLEYLEGKLESL
ILEALEGKLLSL	tr|B6DVW7|B6DVW7_9POLY	606	sp|Q9NRL2|BAZ1A_HUMAN Bromodomain adjacent to zinc finger domain protein 1A OS=Homo sapiens OX=9606 GN=BAZ1A PE=1 SV=2	616	ILHALCGKLLTL
ILEALEGKLLSL	tr|B6DVW7|B6DVW7_9POLY	606	tr|A0A087WWN7|A0A087WWN7_HUMAN Bromodomain adjacent to zinc finger domain protein 1A (Fragment) OS=Homo sapiens OX=9606 GN=BAZ1A PE=1 SV=1	72	ILHALCGKLLTL
SLSSLSSISFSS	tr|B6DVW7|B6DVW7_9POLY	287	tr|M0QZD4|M0QZD4_HUMAN Paternally-expressed gene 3 protein (Fragment) OS=Homo sapiens OX=9606 GN=PEG3 PE=1 SV=2	399	SLSSLSSPSFTE
SLSSLSSISFSS	tr|B6DVW7|B6DVW7_9POLY	287	tr|A0A3B3ISL2|A0A3B3ISL2_HUMAN Paternally-expressed gene 3 protein (Fragment) OS=Homo sapiens OX=9606 GN=PEG3 PE=1 SV=1	306	SLSSLSSPSFTE
SLSSLSSISFSS	tr|B6DVW7|B6DVW7_9POLY	287	sp|Q9GZU2|PEG3_HUMAN Paternally-expressed gene 3 protein OS=Homo sapiens OX=9606 GN=PEG3 PE=1 SV=1	430	SLSSLSSPSFTE
SLSSLSSISFSS	tr|B6DVW7|B6DVW7_9POLY	287	tr|A0A3B3IRU6|A0A3B3IRU6_HUMAN Paternally-expressed gene 3 protein OS=Homo sapiens OX=9606 GN=PEG3 PE=1 SV=1	275	SLSSLSSPSFTE
SLSSLSSISFSS	tr|B6DVW7|B6DVW7_9POLY	287	sp|Q9UPV0|CE164_HUMAN Centrosomal protein of 164 kDa OS=Homo sapiens OX=9606 GN=CEP164 PE=1 SV=3	1228	SLSSESSESFSP
SLSSLSSISFSS	tr|B6DVW7|B6DVW7_9POLY	287	sp|Q9ULB5|CADH7_HUMAN Cadherin-7 OS=Homo sapiens OX=9606 GN=CDH7 PE=2 SV=2	744	SLSSLDSISSNS
SLSSLSSISFSS	tr|B6DVW7|B6DVW7_9POLY	287	sp|Q13029|PRDM2_HUMAN PR domain zinc finger protein 2 OS=Homo sapiens OX=9606 GN=PRDM2 PE=1 SV=3	1055	SSSSSSSSSFSS
SLSSLSSISFSS	tr|B6DVW7|B6DVW7_9POLY	287	sp|Q96M60|F227B_HUMAN Protein FAM227B OS=Homo sapiens OX=9606 GN=FAM227B PE=2 SV=2	486	SLSSSSSSSPSS
SLSSLSSISFSS	tr|B6DVW7|B6DVW7_9POLY	287	sp|Q9NXR8|ING3_HUMAN Inhibitor of growth protein 3 OS=Homo sapiens OX=9606 GN=ING3 PE=1 SV=2	318	SSSSLSSCSSSS
SLSSLSSISFSS	tr|B6DVW7|B6DVW7_9POLY	287	tr|E7ET07|E7ET07_HUMAN Inhibitor of growth protein OS=Homo sapiens OX=9606 GN=ING3 PE=1 SV=1	303	SSSSLSSCSSSS
SLSSLSSISFSS	tr|B6DVW7|B6DVW7_9POLY	287	sp|Q8IY92|SLX4_HUMAN Structure-specific endonuclease subunit SLX4 OS=Homo sapiens OX=9606 GN=SLX4 PE=1 SV=3	1710	SDSSLSSQSSSS
SLSSLSSISFSS	tr|B6DVW7|B6DVW7_9POLY	287	sp|O15047|SET1A_HUMAN Histone-lysine N-methyltransferase SETD1A OS=Homo sapiens OX=9606 GN=SETD1A PE=1 SV=3	340	SSSSLSSSSSSS
SLSSLSSISFSS	tr|B6DVW7|B6DVW7_9POLY	287	sp|O15047|SET1A_HUMAN Histone-lysine N-methyltransferase SETD1A OS=Homo sapiens OX=9606 GN=SETD1A PE=1 SV=3	343	SLSSSSSSSSSS
SLSSLSSISFSS	tr|B6DVW7|B6DVW7_9POLY	287	tr|E7EWN3|E7EWN3_HUMAN Histone-lysine N-methyltransferase SETD5 OS=Homo sapiens OX=9606 GN=SETD5 PE=1 SV=1	1309	SESSLSSTSYSS
SLSSLSSISFSS	tr|B6DVW7|B6DVW7_9POLY	287	sp|Q9C0A6|SETD5_HUMAN Histone-lysine N-methyltransferase SETD5 OS=Homo sapiens OX=9606 GN=SETD5 PE=1 SV=2	1290	SESSLSSTSYSS
SLSSLSSISFSS	tr|B6DVW7|B6DVW7_9POLY	287	sp|P12755|SKI_HUMAN Ski oncogene OS=Homo sapiens OX=9606 GN=SKI PE=1 SV=1	495	SLSSLSSPSFTS
QLTGLGTLLSAG	tr|B0G0W4|B0G0W4_9POLY	89	tr|A0A0A0MT07|A0A0A0MT07_HUMAN Potassium voltage-gated channel subfamily KQT member 5 OS=Homo sapiens OX=9606 GN=KCNQ5 PE=1 SV=1	319	PLTWLGRLLSAG
QLTGLGTLLSAG	tr|B0G0W4|B0G0W4_9POLY	89	tr|A0A0A0MRC8|A0A0A0MRC8_HUMAN Potassium voltage-gated channel subfamily KQT member 5 OS=Homo sapiens OX=9606 GN=KCNQ5 PE=1 SV=1	319	PLTWLGRLLSAG
QLTGLGTLLSAG	tr|B0G0W4|B0G0W4_9POLY	89	sp|Q9NR82|KCNQ5_HUMAN Potassium voltage-gated channel subfamily KQT member 5 OS=Homo sapiens OX=9606 GN=KCNQ5 PE=1 SV=3	319	PLTWLGRLLSAG
QLTGLGTLLSAG	tr|B0G0W4|B0G0W4_9POLY	89	tr|F8WEA4|F8WEA4_HUMAN Potassium voltage-gated channel subfamily KQT member 5 OS=Homo sapiens OX=9606 GN=KCNQ5 PE=1 SV=1	319	PLTWLGRLLSAG
QLTGLGTLLSAG	tr|B0G0W4|B0G0W4_9POLY	89	tr|A0A0A0MSD9|A0A0A0MSD9_HUMAN Potassium voltage-gated channel subfamily KQT member 5 OS=Homo sapiens OX=9606 GN=KCNQ5 PE=1 SV=1	319	PLTWLGRLLSAG
QLTGLGTLLSAG	tr|B0G0W4|B0G0W4_9POLY	89	tr|A0A0A0MSC0|A0A0A0MSC0_HUMAN Potassium voltage-gated channel subfamily KQT member 5 OS=Homo sapiens OX=9606 GN=KCNQ5 PE=1 SV=1	319	PLTWLGRLLSAG
PEPPSTSDEPEE	tr|B6DVW7|B6DVW7_9POLY	221	sp|A0A1W2PR82|PERC1_HUMAN Protein PERCC1 OS=Homo sapiens OX=9606 GN=PERCC1 PE=3 SV=1	27	PEPPETSEEEEE
QTKTKRPSNSLS	tr|B6DVW7|B6DVW7_9POLY	115	tr|A0A3B3IT47|A0A3B3IT47_HUMAN WD repeat-containing protein 37 OS=Homo sapiens OX=9606 GN=WDR37 PE=1 SV=1	13	QTKQKRKSHSLS
QTKTKRPSNSLS	tr|B6DVW7|B6DVW7_9POLY	115	sp|Q9Y2I8|WDR37_HUMAN WD repeat-containing protein 37 OS=Homo sapiens OX=9606 GN=WDR37 PE=1 SV=2	13	QTKQKRKSHSLS
QTKTKRPSNSLS	tr|B6DVW7|B6DVW7_9POLY	115	tr|E7EQ49|E7EQ49_HUMAN WD repeat-containing protein 37 OS=Homo sapiens OX=9606 GN=WDR37 PE=1 SV=1	13	QTKQKRKSHSLS
QTKTKRPSNSLS	tr|B6DVW7|B6DVW7_9POLY	115	tr|A0A087WTQ2|A0A087WTQ2_HUMAN WD repeat-containing protein 37 OS=Homo sapiens OX=9606 GN=WDR37 PE=1 SV=1	13	QTKQKRKSHSLS
SSLSSISFSSSP	tr|B6DVW7|B6DVW7_9POLY	289	sp|Q9NZM4|BICRA_HUMAN BRD4-interacting chromatin-remodeling complex-associated protein OS=Homo sapiens OX=9606 GN=BICRA PE=1 SV=2	1266	SSLSSSSSSSSA
SSLSSISFSSSP	tr|B6DVW7|B6DVW7_9POLY	289	tr|A0A087WWH3|A0A087WWH3_HUMAN BRD4-interacting chromatin-remodeling complex-associated protein OS=Homo sapiens OX=9606 GN=BICRA PE=1 SV=1	1214	SSLSSSSSSSSA
SSLSSISFSSSP	tr|B6DVW7|B6DVW7_9POLY	289	sp|Q9ULE0|WWC3_HUMAN Protein WWC3 OS=Homo sapiens OX=9606 GN=WWC3 PE=1 SV=3	456	SSLSSLSPPSSP
SSLSSISFSSSP	tr|B6DVW7|B6DVW7_9POLY	289	sp|Q5VZ18|SHE_HUMAN SH2 domain-containing adapter protein E OS=Homo sapiens OX=9606 GN=SHE PE=1 SV=1	168	SSSSSSSASSSP
SSLSSISFSSSP	tr|B6DVW7|B6DVW7_9POLY	289	tr|E7EUR8|E7EUR8_HUMAN Protein FAM193A (Fragment) OS=Homo sapiens OX=9606 GN=FAM193A PE=1 SV=1	114	SSASSGSGSSSP
SSLSSISFSSSP	tr|B6DVW7|B6DVW7_9POLY	289	tr|A0A1B0GVL4|A0A1B0GVL4_HUMAN Protein FAM193A OS=Homo sapiens OX=9606 GN=FAM193A PE=1 SV=1	551	SSASSGSGSSSP
SSLSSISFSSSP	tr|B6DVW7|B6DVW7_9POLY	289	sp|P78312|F193A_HUMAN Protein FAM193A OS=Homo sapiens OX=9606 GN=FAM193A PE=1 SV=2	260	SSASSGSGSSSP
SSLSSISFSSSP	tr|B6DVW7|B6DVW7_9POLY	289	tr|D6RFZ4|D6RFZ4_HUMAN Protein FAM193A OS=Homo sapiens OX=9606 GN=FAM193A PE=1 SV=1	260	SSASSGSGSSSP
SSLSSISFSSSP	tr|B6DVW7|B6DVW7_9POLY	289	sp|Q8TAB5|CA216_HUMAN UPF0500 protein C1orf216 OS=Homo sapiens OX=9606 GN=C1orf216 PE=1 SV=1	116	SSLSIDSRSSSP
SSLSSISFSSSP	tr|B6DVW7|B6DVW7_9POLY	289	sp|A0A1B0GTH6|CS2IP_HUMAN Casein kinase II subunit alpha'-interacting protein OS=Homo sapiens OX=9606 GN=CSNKA2IP PE=3 SV=1	643	SSSFSISSSSSP
SSLSSISFSSSP	tr|B6DVW7|B6DVW7_9POLY	289	sp|Q13029|PRDM2_HUMAN PR domain zinc finger protein 2 OS=Homo sapiens OX=9606 GN=PRDM2 PE=1 SV=3	1062	SSFSSSSSSSSP
SSLSSISFSSSP	tr|B6DVW7|B6DVW7_9POLY	289	tr|K7EIY6|K7EIY6_HUMAN RING-type E3 ubiquitin transferase (Fragment) OS=Homo sapiens OX=9606 GN=RNF126 PE=1 SV=7	264	SSSSSSSSSSSP
SSLSSISFSSSP	tr|B6DVW7|B6DVW7_9POLY	289	sp|Q9BV68|RN126_HUMAN E3 ubiquitin-protein ligase RNF126 OS=Homo sapiens OX=9606 GN=RNF126 PE=1 SV=2	291	SSSSSSSSSSSP
SSLSSISFSSSP	tr|B6DVW7|B6DVW7_9POLY	289	sp|Q9UQ35|SRRM2_HUMAN Serine/arginine repetitive matrix protein 2 OS=Homo sapiens OX=9606 GN=SRRM2 PE=1 SV=2	2638	SSSSSSSSSSSP
SSLSSISFSSSP	tr|B6DVW7|B6DVW7_9POLY	289	sp|P78426|NKX61_HUMAN Homeobox protein Nkx-6.1 OS=Homo sapiens OX=9606 GN=NKX6-1 PE=1 SV=2	49	SSSSSSSSSSSP
SSLSSISFSSSP	tr|B6DVW7|B6DVW7_9POLY	289	sp|Q17RH7|TPRXL_HUMAN Putative protein TPRXL OS=Homo sapiens OX=9606 GN=TPRXL PE=5 SV=2	93	SSSSSSSSSSSP
SSLSSISFSSSP	tr|B6DVW7|B6DVW7_9POLY	289	sp|Q9NVW2|RNF12_HUMAN E3 ubiquitin-protein ligase RLIM OS=Homo sapiens OX=9606 GN=RLIM PE=1 SV=3	466	SSSSSSSSSSSP
SSLSSISFSSSP	tr|B6DVW7|B6DVW7_9POLY	289	sp|Q17RH7|TPRXL_HUMAN Putative protein TPRXL OS=Homo sapiens OX=9606 GN=TPRXL PE=5 SV=2	157	SSSSSSSSSSSP
SSLSSISFSSSP	tr|B6DVW7|B6DVW7_9POLY	289	sp|Q6VN20|RBP10_HUMAN Ran-binding protein 10 OS=Homo sapiens OX=9606 GN=RANBP10 PE=1 SV=1	412	SSSSSSSSSSSP
SSLSSISFSSSP	tr|B6DVW7|B6DVW7_9POLY	289	tr|A0A0D9SEU5|A0A0D9SEU5_HUMAN Ran-binding protein 10 OS=Homo sapiens OX=9606 GN=RANBP10 PE=1 SV=1	412	SSSSSSSSSSSP
SSLSSISFSSSP	tr|B6DVW7|B6DVW7_9POLY	289	tr|R4GMX8|R4GMX8_HUMAN Ran-binding protein 10 OS=Homo sapiens OX=9606 GN=RANBP10 PE=1 SV=1	412	SSSSSSSSSSSP
SSLSSISFSSSP	tr|B6DVW7|B6DVW7_9POLY	289	tr|K7EPA1|K7EPA1_HUMAN Chromatin assembly factor 1 subunit A (Fragment) OS=Homo sapiens OX=9606 GN=CHAF1A PE=1 SV=8	70	SSLSSPSSTSSP
SSLSSISFSSSP	tr|B6DVW7|B6DVW7_9POLY	289	sp|Q13111|CAF1A_HUMAN Chromatin assembly factor 1 subunit A OS=Homo sapiens OX=9606 GN=CHAF1A PE=1 SV=3	285	SSLSSPSSTSSP
SSLSSISFSSSP	tr|B6DVW7|B6DVW7_9POLY	289	tr|A0A0D9SES4|A0A0D9SES4_HUMAN Contactin-associated protein-like 2 (Fragment) OS=Homo sapiens OX=9606 GN=CNTNAP2 PE=1 SV=4	49	SSSSSISGSYSP
SSLSSISFSSSP	tr|B6DVW7|B6DVW7_9POLY	289	sp|Q9UHC6|CNTP2_HUMAN Contactin-associated protein-like 2 OS=Homo sapiens OX=9606 GN=CNTNAP2 PE=1 SV=1	49	SSSSSISGSYSP
SSLSSISFSSSP	tr|B6DVW7|B6DVW7_9POLY	289	sp|Q13029|PRDM2_HUMAN PR domain zinc finger protein 2 OS=Homo sapiens OX=9606 GN=PRDM2 PE=1 SV=3	1057	SSSSSSSFSSSS
SSLSSISFSSSP	tr|B6DVW7|B6DVW7_9POLY	289	sp|O15047|SET1A_HUMAN Histone-lysine N-methyltransferase SETD1A OS=Homo sapiens OX=9606 GN=SETD1A PE=1 SV=3	342	SSLSSSSSSSSS
SSLSSISFSSSP	tr|B6DVW7|B6DVW7_9POLY	289	sp|P12755|SKI_HUMAN Ski oncogene OS=Homo sapiens OX=9606 GN=SKI PE=1 SV=1	497	SSLSSPSFTSSS
SSLSSISFSSSP	tr|B6DVW7|B6DVW7_9POLY	289	sp|A8MTJ6|FOXI3_HUMAN Forkhead box protein I3 OS=Homo sapiens OX=9606 GN=FOXI3 PE=2 SV=3	317	SSLSSLSVSSSV
SLEQFSSFSLLI	tr|B0G0W4|B0G0W4_9POLY	63	sp|O76042|ERIT1_HUMAN Putative uncharacterized protein encoded by ERC2-IT1 OS=Homo sapiens OX=9606 GN=ERC2-IT1 PE=5 SV=2	106	SLAQQWSFSLLI
LEALEGKLLSLS	tr|B6DVW7|B6DVW7_9POLY	607	sp|Q5T2E6|ARMD3_HUMAN Armadillo-like helical domain-containing protein 3 OS=Homo sapiens OX=9606 GN=ARMH3 PE=1 SV=1	56	LEYLEGKLESLD
LEALEGKLLSLS	tr|B6DVW7|B6DVW7_9POLY	607	tr|Q5T2E7|Q5T2E7_HUMAN Armadillo-like helical domain-containing protein 3 OS=Homo sapiens OX=9606 GN=ARMH3 PE=1 SV=1	56	LEYLEGKLESLD
PSLRVKAEKDGS	tr|B0G0W3|B0G0W3_9POLY	214	sp|Q9Y3Q8|T22D4_HUMAN TSC22 domain family protein 4 OS=Homo sapiens OX=9606 GN=TSC22D4 PE=1 SV=2	214	PSLRVEAEAGGS
AASLERKRISKR	tr|B6DVW7|B6DVW7_9POLY	673	sp|Q8NEV4|MYO3A_HUMAN Myosin-IIIa OS=Homo sapiens OX=9606 GN=MYO3A PE=1 SV=2	1255	AAYLERKAISER
SLSSISFSSSPP	tr|B6DVW7|B6DVW7_9POLY	290	tr|M0QY76|M0QY76_HUMAN Zinc finger protein 36, C3H type, homolog (Mouse), isoform CRA_a OS=Homo sapiens OX=9606 GN=ZFP36 PE=1 SV=1	215	SSSSFSPSSSPP
SLSSISFSSSPP	tr|B6DVW7|B6DVW7_9POLY	290	sp|P26651|TTP_HUMAN mRNA decay activator protein ZFP36 OS=Homo sapiens OX=9606 GN=ZFP36 PE=1 SV=1	209	SSSSFSPSSSPP
SLSSISFSSSPP	tr|B6DVW7|B6DVW7_9POLY	290	sp|Q9NUC0|SRTD4_HUMAN SERTA domain-containing protein 4 OS=Homo sapiens OX=9606 GN=SERTAD4 PE=1 SV=1	223	SSSSSSSSSSPP
SLSSISFSSSPP	tr|B6DVW7|B6DVW7_9POLY	290	sp|Q9P1Z0|ZBTB4_HUMAN Zinc finger and BTB domain-containing protein 4 OS=Homo sapiens OX=9606 GN=ZBTB4 PE=1 SV=3	102	SSSSSSSSSSPP
KSSLSSLSSISF	tr|B6DVW7|B6DVW7_9POLY	285	sp|P12755|SKI_HUMAN Ski oncogene OS=Homo sapiens OX=9606 GN=SKI PE=1 SV=1	493	TSSLSSLSSPSF
KSSLSSLSSISF	tr|B6DVW7|B6DVW7_9POLY	285	tr|M0QZD4|M0QZD4_HUMAN Paternally-expressed gene 3 protein (Fragment) OS=Homo sapiens OX=9606 GN=PEG3 PE=1 SV=2	397	VSSLSSLSSPSF
KSSLSSLSSISF	tr|B6DVW7|B6DVW7_9POLY	285	tr|A0A3B3ISL2|A0A3B3ISL2_HUMAN Paternally-expressed gene 3 protein (Fragment) OS=Homo sapiens OX=9606 GN=PEG3 PE=1 SV=1	304	VSSLSSLSSPSF
KSSLSSLSSISF	tr|B6DVW7|B6DVW7_9POLY	285	sp|Q9GZU2|PEG3_HUMAN Paternally-expressed gene 3 protein OS=Homo sapiens OX=9606 GN=PEG3 PE=1 SV=1	428	VSSLSSLSSPSF
KSSLSSLSSISF	tr|B6DVW7|B6DVW7_9POLY	285	tr|A0A3B3IRU6|A0A3B3IRU6_HUMAN Paternally-expressed gene 3 protein OS=Homo sapiens OX=9606 GN=PEG3 PE=1 SV=1	273	VSSLSSLSSPSF
KSSLSSLSSISF	tr|B6DVW7|B6DVW7_9POLY	285	sp|A6NK53|ZN233_HUMAN Zinc finger protein 233 OS=Homo sapiens OX=9606 GN=ZNF233 PE=2 SV=3	659	KSSLSSDSSESP
VSIVSGDESVNQ	tr|B0G0W3|B0G0W3_9POLY	43	tr|C9JGA2|C9JGA2_HUMAN 5-azacytidine-induced protein 2 (Fragment) OS=Homo sapiens OX=9606 GN=AZI2 PE=1 SV=1	26	VSIYSGDESVAS
VSIVSGDESVNQ	tr|B0G0W3|B0G0W3_9POLY	43	tr|C9JVK8|C9JVK8_HUMAN 5-azacytidine-induced protein 2 (Fragment) OS=Homo sapiens OX=9606 GN=AZI2 PE=1 SV=1	26	VSIYSGDESVAS
VSIVSGDESVNQ	tr|B0G0W3|B0G0W3_9POLY	43	sp|Q9H6S1|AZI2_HUMAN 5-azacytidine-induced protein 2 OS=Homo sapiens OX=9606 GN=AZI2 PE=1 SV=1	26	VSIYSGDESVAS
LTGLGTLLSAGL	tr|B0G0W4|B0G0W4_9POLY	90	tr|A0A0A0MT07|A0A0A0MT07_HUMAN Potassium voltage-gated channel subfamily KQT member 5 OS=Homo sapiens OX=9606 GN=KCNQ5 PE=1 SV=1	320	LTWLGRLLSAGF
LTGLGTLLSAGL	tr|B0G0W4|B0G0W4_9POLY	90	tr|A0A0A0MRC8|A0A0A0MRC8_HUMAN Potassium voltage-gated channel subfamily KQT member 5 OS=Homo sapiens OX=9606 GN=KCNQ5 PE=1 SV=1	320	LTWLGRLLSAGF
LTGLGTLLSAGL	tr|B0G0W4|B0G0W4_9POLY	90	sp|Q9NR82|KCNQ5_HUMAN Potassium voltage-gated channel subfamily KQT member 5 OS=Homo sapiens OX=9606 GN=KCNQ5 PE=1 SV=3	320	LTWLGRLLSAGF
LTGLGTLLSAGL	tr|B0G0W4|B0G0W4_9POLY	90	tr|F8WEA4|F8WEA4_HUMAN Potassium voltage-gated channel subfamily KQT member 5 OS=Homo sapiens OX=9606 GN=KCNQ5 PE=1 SV=1	320	LTWLGRLLSAGF
LTGLGTLLSAGL	tr|B0G0W4|B0G0W4_9POLY	90	tr|A0A0A0MSD9|A0A0A0MSD9_HUMAN Potassium voltage-gated channel subfamily KQT member 5 OS=Homo sapiens OX=9606 GN=KCNQ5 PE=1 SV=1	320	LTWLGRLLSAGF
