query	query_seqname	query_start	target_seqname	target_start	target
AELKKRKLLNSG	tr|B6DVW7|B6DVW7_9POLY	728	tr|H0Y6A7|H0Y6A7_HUMAN Ganglioside-induced differentiation-associated protein 1-like 1 (Fragment) OS=Homo sapiens OX=9606 GN=GDAP1L1 PE=1 SV=1	190	AELEKRKLENEG
AELKKRKLLNSG	tr|B6DVW7|B6DVW7_9POLY	728	tr|Q5TE61|Q5TE61_HUMAN Ganglioside-induced differentiation-associated protein 1-like 1 (Fragment) OS=Homo sapiens OX=9606 GN=GDAP1L1 PE=1 SV=1	185	AELEKRKLENEG
AELKKRKLLNSG	tr|B6DVW7|B6DVW7_9POLY	728	sp|Q96MZ0|GD1L1_HUMAN Ganglioside-induced differentiation-associated protein 1-like 1 OS=Homo sapiens OX=9606 GN=GDAP1L1 PE=2 SV=2	243	AELEKRKLENEG
AELKKRKLLNSG	tr|B6DVW7|B6DVW7_9POLY	728	tr|H0UIB3|H0UIB3_HUMAN Ganglioside-induced differentiation-associated protein 1-like 1 OS=Homo sapiens OX=9606 GN=GDAP1L1 PE=1 SV=1	154	AELEKRKLENEG
AELKKRKLLNSG	tr|B6DVW7|B6DVW7_9POLY	728	tr|Q5TE58|Q5TE58_HUMAN Ganglioside-induced differentiation-associated protein 1-like 1 (Fragment) OS=Homo sapiens OX=9606 GN=GDAP1L1 PE=1 SV=1	25	AELEKRKLENEG
PLLQLLLEDEGP	tr|B6DVW7|B6DVW7_9POLY	792	sp|Q96DX5|ASB9_HUMAN Ankyrin repeat and SOCS box protein 9 OS=Homo sapiens OX=9606 GN=ASB9 PE=1 SV=1	244	PLAQLFLEREGP
LKVEHDGSFPLE	tr|B0G0W3|B0G0W3_9POLY	218	sp|Q8IVF2|AHNK2_HUMAN Protein AHNAK2 OS=Homo sapiens OX=9606 GN=AHNAK2 PE=1 SV=2	2841	LKVEADGSFPSM
ESVELLFFVGGL	tr|B6DVW7|B6DVW7_9POLY	547	sp|Q9Y2J8|PADI2_HUMAN Protein-arginine deiminase type-2 OS=Homo sapiens OX=9606 GN=PADI2 PE=1 SV=2	244	GSAELLFFVEGL
QVLLQILTSGLT	tr|B0G0W4|B0G0W4_9POLY	71	sp|O15120|PLCB_HUMAN 1-acyl-sn-glycerol-3-phosphate acyltransferase beta OS=Homo sapiens OX=9606 GN=AGPAT2 PE=1 SV=1	226	QVLEAIPTSGLT
TIQNVAIDESGI	tr|B0G0W3|B0G0W3_9POLY	262	tr|D6RC56|D6RC56_HUMAN Kynurenine/alpha-aminoadipate aminotransferase, mitochondrial (Fragment) OS=Homo sapiens OX=9606 GN=AADAT PE=1 SV=1	155	NIINVASDESGI
TIQNVAIDESGI	tr|B0G0W3|B0G0W3_9POLY	262	tr|D6RFY7|D6RFY7_HUMAN Kynurenine/alpha-aminoadipate aminotransferase, mitochondrial (Fragment) OS=Homo sapiens OX=9606 GN=AADAT PE=1 SV=1	155	NIINVASDESGI
TIQNVAIDESGI	tr|B0G0W3|B0G0W3_9POLY	262	tr|D6REB9|D6REB9_HUMAN Kynurenine/alpha-aminoadipate aminotransferase, mitochondrial (Fragment) OS=Homo sapiens OX=9606 GN=AADAT PE=1 SV=1	146	NIINVASDESGI
TIQNVAIDESGI	tr|B0G0W3|B0G0W3_9POLY	262	sp|Q8N5Z0|AADAT_HUMAN Kynurenine/alpha-aminoadipate aminotransferase, mitochondrial OS=Homo sapiens OX=9606 GN=AADAT PE=1 SV=2	155	NIINVASDESGI
NVAIDESGIGPV	tr|B0G0W3|B0G0W3_9POLY	265	tr|D6RC56|D6RC56_HUMAN Kynurenine/alpha-aminoadipate aminotransferase, mitochondrial (Fragment) OS=Homo sapiens OX=9606 GN=AADAT PE=1 SV=1	158	NVASDESGIVPD
NVAIDESGIGPV	tr|B0G0W3|B0G0W3_9POLY	265	tr|D6RFY7|D6RFY7_HUMAN Kynurenine/alpha-aminoadipate aminotransferase, mitochondrial (Fragment) OS=Homo sapiens OX=9606 GN=AADAT PE=1 SV=1	158	NVASDESGIVPD
NVAIDESGIGPV	tr|B0G0W3|B0G0W3_9POLY	265	tr|D6REB9|D6REB9_HUMAN Kynurenine/alpha-aminoadipate aminotransferase, mitochondrial (Fragment) OS=Homo sapiens OX=9606 GN=AADAT PE=1 SV=1	149	NVASDESGIVPD
NVAIDESGIGPV	tr|B0G0W3|B0G0W3_9POLY	265	sp|Q8N5Z0|AADAT_HUMAN Kynurenine/alpha-aminoadipate aminotransferase, mitochondrial OS=Homo sapiens OX=9606 GN=AADAT PE=1 SV=2	158	NVASDESGIVPD
EGPEENEESTDS	tr|B6DVW7|B6DVW7_9POLY	801	sp|O15047|SET1A_HUMAN Histone-lysine N-methyltransferase SETD1A OS=Homo sapiens OX=9606 GN=SETD1A PE=1 SV=3	1368	EGEEEEEESSDS
HDGSFPLELFCP	tr|B0G0W3|B0G0W3_9POLY	222	sp|Q6ZWI9|RFPLB_HUMAN Ret finger protein-like 4B OS=Homo sapiens OX=9606 GN=RFPL4B PE=2 SV=2	232	HDGFFSLELLCP
ELTFAGTQELLH	tr|B0G0W4|B0G0W4_9POLY	114	sp|Q96A49|SYAP1_HUMAN Synapse-associated protein 1 OS=Homo sapiens OX=9606 GN=SYAP1 PE=1 SV=1	41	ELQQAGDQELLH
SSLQGLGSLASV	tr|B0G0W4|B0G0W4_9POLY	88	tr|Q96GL6|Q96GL6_HUMAN Chromaffin granule amine transporter OS=Homo sapiens OX=9606 GN=SLC18A1 PE=1 SV=1	207	SSVAGLGMLASV
SSLQGLGSLASV	tr|B0G0W4|B0G0W4_9POLY	88	sp|P54219|VMAT1_HUMAN Chromaffin granule amine transporter OS=Homo sapiens OX=9606 GN=SLC18A1 PE=1 SV=1	207	SSVAGLGMLASV
ELLFFVGGLIFF	tr|B6DVW7|B6DVW7_9POLY	550	sp|Q9Y2J8|PADI2_HUMAN Protein-arginine deiminase type-2 OS=Homo sapiens OX=9606 GN=PADI2 PE=1 SV=2	247	ELLFFVEGLCFP
LGSEPLLQLLLE	tr|B6DVW7|B6DVW7_9POLY	788	sp|Q09013|DMPK_HUMAN Myotonin-protein kinase OS=Homo sapiens OX=9606 GN=DMPK PE=1 SV=3	20	LGLEPLLDLLLG
LGSEPLLQLLLE	tr|B6DVW7|B6DVW7_9POLY	788	tr|K7EQX1|K7EQX1_HUMAN Myotonin-protein kinase OS=Homo sapiens OX=9606 GN=DMPK PE=1 SV=1	20	LGLEPLLDLLLG
IQNVAIDESGIG	tr|B0G0W3|B0G0W3_9POLY	263	tr|D6RC56|D6RC56_HUMAN Kynurenine/alpha-aminoadipate aminotransferase, mitochondrial (Fragment) OS=Homo sapiens OX=9606 GN=AADAT PE=1 SV=1	156	IINVASDESGIV
IQNVAIDESGIG	tr|B0G0W3|B0G0W3_9POLY	263	tr|D6RFY7|D6RFY7_HUMAN Kynurenine/alpha-aminoadipate aminotransferase, mitochondrial (Fragment) OS=Homo sapiens OX=9606 GN=AADAT PE=1 SV=1	156	IINVASDESGIV
IQNVAIDESGIG	tr|B0G0W3|B0G0W3_9POLY	263	tr|D6REB9|D6REB9_HUMAN Kynurenine/alpha-aminoadipate aminotransferase, mitochondrial (Fragment) OS=Homo sapiens OX=9606 GN=AADAT PE=1 SV=1	147	IINVASDESGIV
IQNVAIDESGIG	tr|B0G0W3|B0G0W3_9POLY	263	sp|Q8N5Z0|AADAT_HUMAN Kynurenine/alpha-aminoadipate aminotransferase, mitochondrial OS=Homo sapiens OX=9606 GN=AADAT PE=1 SV=2	156	IINVASDESGIV
EENVSNPEPPSS	tr|B6DVW7|B6DVW7_9POLY	215	tr|H7C1M2|H7C1M2_HUMAN Protein SON (Fragment) OS=Homo sapiens OX=9606 GN=SON PE=1 SV=1	200	EESVSQPEPPVS
EENVSNPEPPSS	tr|B6DVW7|B6DVW7_9POLY	215	sp|P18583|SON_HUMAN Protein SON OS=Homo sapiens OX=9606 GN=SON PE=1 SV=4	1205	EESVSQPEPPVS
KLREYGVGLPIQ	tr|B0G0W3|B0G0W3_9POLY	148	sp|Q9NUG4|CCM2L_HUMAN Cerebral cavernous malformations 2 protein-like OS=Homo sapiens OX=9606 GN=CCM2L PE=1 SV=3	437	LLREYRLGLPIQ
SVELLFFVGGLI	tr|B6DVW7|B6DVW7_9POLY	548	sp|Q9Y2J8|PADI2_HUMAN Protein-arginine deiminase type-2 OS=Homo sapiens OX=9606 GN=PADI2 PE=1 SV=2	245	SAELLFFVEGLC
DEGPEENEESTD	tr|B6DVW7|B6DVW7_9POLY	800	sp|Q9HAU5|RENT2_HUMAN Regulator of nonsense transcripts 2 OS=Homo sapiens OX=9606 GN=UPF2 PE=1 SV=1	1066	DEGEEEEEENTD
SGTSPPRSQSQT	tr|B6DVW7|B6DVW7_9POLY	131	sp|Q8IZF2|AGRF5_HUMAN Adhesion G protein-coupled receptor F5 OS=Homo sapiens OX=9606 GN=ADGRF5 PE=1 SV=3	838	SGDSPPLSFSQT
PHSSTRSEGSFD	tr|B6DVW7|B6DVW7_9POLY	199	tr|B4E009|B4E009_HUMAN Early activation antigen CD69 OS=Homo sapiens OX=9606 GN=CD69 PE=1 SV=1	27	PHFSTRHEGSFQ
PHSSTRSEGSFD	tr|B6DVW7|B6DVW7_9POLY	199	sp|Q07108|CD69_HUMAN Early activation antigen CD69 OS=Homo sapiens OX=9606 GN=CD69 PE=1 SV=1	27	PHFSTRHEGSFQ
QNVAIDESGIGP	tr|B0G0W3|B0G0W3_9POLY	264	tr|D6RC56|D6RC56_HUMAN Kynurenine/alpha-aminoadipate aminotransferase, mitochondrial (Fragment) OS=Homo sapiens OX=9606 GN=AADAT PE=1 SV=1	157	INVASDESGIVP
QNVAIDESGIGP	tr|B0G0W3|B0G0W3_9POLY	264	tr|D6RFY7|D6RFY7_HUMAN Kynurenine/alpha-aminoadipate aminotransferase, mitochondrial (Fragment) OS=Homo sapiens OX=9606 GN=AADAT PE=1 SV=1	157	INVASDESGIVP
QNVAIDESGIGP	tr|B0G0W3|B0G0W3_9POLY	264	tr|D6REB9|D6REB9_HUMAN Kynurenine/alpha-aminoadipate aminotransferase, mitochondrial (Fragment) OS=Homo sapiens OX=9606 GN=AADAT PE=1 SV=1	148	INVASDESGIVP
QNVAIDESGIGP	tr|B0G0W3|B0G0W3_9POLY	264	sp|Q8N5Z0|AADAT_HUMAN Kynurenine/alpha-aminoadipate aminotransferase, mitochondrial OS=Homo sapiens OX=9606 GN=AADAT PE=1 SV=2	157	INVASDESGIVP
LGSLASVGVKLS	tr|B0G0W4|B0G0W4_9POLY	93	sp|P56524|HDAC4_HUMAN Histone deacetylase 4 OS=Homo sapiens OX=9606 GN=HDAC4 PE=1 SV=3	739	LGSLASVFVRLP
PRPGCCPSMLTA	tr|B0G0W3|B0G0W3_9POLY	20	sp|Q9NS98|SEM3G_HUMAN Semaphorin-3G OS=Homo sapiens OX=9606 GN=SEMA3G PE=1 SV=1	377	PRPGVCPSKMTA
SSTPEWALPAAV	tr|B0G0W4|B0G0W4_9POLY	205	tr|A0A0A0MRW6|A0A0A0MRW6_HUMAN Nucleolar protein 6 OS=Homo sapiens OX=9606 GN=NOL6 PE=1 SV=1	652	SSTGEEALVAAV
SSTPEWALPAAV	tr|B0G0W4|B0G0W4_9POLY	205	sp|Q9H6R4|NOL6_HUMAN Nucleolar protein 6 OS=Homo sapiens OX=9606 GN=NOL6 PE=1 SV=2	652	SSTGEEALVAAV
SSSDEPEEPPQS	tr|B6DVW7|B6DVW7_9POLY	225	sp|Q5SZK8|FREM2_HUMAN FRAS1-related extracellular matrix protein 2 OS=Homo sapiens OX=9606 GN=FREM2 PE=1 SV=2	3150	SSSSEPMVPPQS
QWKSAVSSELNY	tr|B6DVW7|B6DVW7_9POLY	765	tr|A0A087X1M1|A0A087X1M1_HUMAN Izumo sperm-egg fusion protein 4 OS=Homo sapiens OX=9606 GN=IZUMO4 PE=1 SV=1	167	QWKSAVQGLLNY
QWKSAVSSELNY	tr|B6DVW7|B6DVW7_9POLY	765	tr|A0A087X221|A0A087X221_HUMAN Izumo sperm-egg fusion protein 4 (Fragment) OS=Homo sapiens OX=9606 GN=IZUMO4 PE=1 SV=1	117	QWKSAVQGLLNY
QWKSAVSSELNY	tr|B6DVW7|B6DVW7_9POLY	765	sp|Q1ZYL8|IZUM4_HUMAN Izumo sperm-egg fusion protein 4 OS=Homo sapiens OX=9606 GN=IZUMO4 PE=2 SV=2	162	QWKSAVQGLLNY
QWKSAVSSELNY	tr|B6DVW7|B6DVW7_9POLY	765	tr|A0A0A0MS61|A0A0A0MS61_HUMAN Izumo sperm-egg fusion protein 4 OS=Homo sapiens OX=9606 GN=IZUMO4 PE=1 SV=1	162	QWKSAVQGLLNY
QWKSAVSSELNY	tr|B6DVW7|B6DVW7_9POLY	765	tr|A0A087X160|A0A087X160_HUMAN Izumo sperm-egg fusion protein 4 (Fragment) OS=Homo sapiens OX=9606 GN=IZUMO4 PE=1 SV=1	106	QWKSAVQGLLNY
KLKVEHDGSFPL	tr|B0G0W3|B0G0W3_9POLY	217	sp|Q8IVF2|AHNK2_HUMAN Protein AHNAK2 OS=Homo sapiens OX=9606 GN=AHNAK2 PE=1 SV=2	2840	ELKVEADGSFPS
LLLEISNLYSKF	tr|B6DVW7|B6DVW7_9POLY	51	tr|B1ALG6|B1ALG6_HUMAN Lymphoid-specific helicase (Fragment) OS=Homo sapiens OX=9606 GN=HELLS PE=1 SV=1	54	HLLEKSNIYSKF
LLLEISNLYSKF	tr|B6DVW7|B6DVW7_9POLY	51	tr|A0A0B4J1V9|A0A0B4J1V9_HUMAN Helicase, lymphoid-specific, isoform CRA_b OS=Homo sapiens OX=9606 GN=HELLS PE=1 SV=1	70	HLLEKSNIYSKF
LLLEISNLYSKF	tr|B6DVW7|B6DVW7_9POLY	51	sp|Q9NRZ9|HELLS_HUMAN Lymphoid-specific helicase OS=Homo sapiens OX=9606 GN=HELLS PE=1 SV=1	70	HLLEKSNIYSKF
LLLEISNLYSKF	tr|B6DVW7|B6DVW7_9POLY	51	tr|Q76H82|Q76H82_HUMAN Lymphoid specific helicase variant1 OS=Homo sapiens OX=9606 GN=HELLS PE=1 SV=1	70	HLLEKSNIYSKF
DLGSEPLLQLLL	tr|B6DVW7|B6DVW7_9POLY	787	sp|Q09013|DMPK_HUMAN Myotonin-protein kinase OS=Homo sapiens OX=9606 GN=DMPK PE=1 SV=3	19	FLGLEPLLDLLL
DLGSEPLLQLLL	tr|B6DVW7|B6DVW7_9POLY	787	tr|K7EQX1|K7EQX1_HUMAN Myotonin-protein kinase OS=Homo sapiens OX=9606 GN=DMPK PE=1 SV=1	19	FLGLEPLLDLLL
LREYGVGLPIQG	tr|B0G0W3|B0G0W3_9POLY	149	sp|Q9NUG4|CCM2L_HUMAN Cerebral cavernous malformations 2 protein-like OS=Homo sapiens OX=9606 GN=CCM2L PE=1 SV=3	438	LREYRLGLPIQD
TPDNPLKESAPL	tr|B0G0W3|B0G0W3_9POLY	89	sp|Q96T21|SEBP2_HUMAN Selenocysteine insertion sequence-binding protein 2 OS=Homo sapiens OX=9606 GN=SECISBP2 PE=1 SV=2	503	TPHNPLDSSAPL
SLKERADGAAIL	tr|B6DVW7|B6DVW7_9POLY	663	sp|Q5T440|CAF17_HUMAN Putative transferase CAF17, mitochondrial OS=Homo sapiens OX=9606 GN=IBA57 PE=1 SV=1	174	SLQERAGAAAIL
GLGSLASVGVKL	tr|B0G0W4|B0G0W4_9POLY	92	sp|P56524|HDAC4_HUMAN Histone deacetylase 4 OS=Homo sapiens OX=9606 GN=HDAC4 PE=1 SV=3	738	LLGSLASVFVRL
LKLKVEHDGSFP	tr|B0G0W3|B0G0W3_9POLY	216	sp|Q8IVF2|AHNK2_HUMAN Protein AHNAK2 OS=Homo sapiens OX=9606 GN=AHNAK2 PE=1 SV=2	2839	SELKVEADGSFP
ILSSLQGLGSLA	tr|B0G0W4|B0G0W4_9POLY	86	sp|Q8IYV9|IZUM1_HUMAN Izumo sperm-egg fusion protein 1 OS=Homo sapiens OX=9606 GN=IZUMO1 PE=1 SV=2	322	IKSSLFGLGSGA
VELLFFVGGLIF	tr|B6DVW7|B6DVW7_9POLY	549	sp|Q9Y2J8|PADI2_HUMAN Protein-arginine deiminase type-2 OS=Homo sapiens OX=9606 GN=PADI2 PE=1 SV=2	246	AELLFFVEGLCF
LSRESLNLLRRE	tr|B0G0W4|B0G0W4_9POLY	103	sp|O00507|USP9Y_HUMAN Probable ubiquitin carboxyl-terminal hydrolase FAF-Y OS=Homo sapiens OX=9606 GN=USP9Y PE=2 SV=2	2157	LLRATLNLLRRE
LSRESLNLLRRE	tr|B0G0W4|B0G0W4_9POLY	103	sp|Q93008|USP9X_HUMAN Probable ubiquitin carboxyl-terminal hydrolase FAF-X OS=Homo sapiens OX=9606 GN=USP9X PE=1 SV=4	2156	LLRAVLNLLRRE
TSPPRSQSQTTG	tr|B6DVW7|B6DVW7_9POLY	133	sp|Q5GH72|XKR7_HUMAN XK-related protein 7 OS=Homo sapiens OX=9606 GN=XKR7 PE=2 SV=1	470	TSPPRSLPRTTG
APHSSTRSEGSF	tr|B6DVW7|B6DVW7_9POLY	198	tr|B4E009|B4E009_HUMAN Early activation antigen CD69 OS=Homo sapiens OX=9606 GN=CD69 PE=1 SV=1	26	SPHFSTRHEGSF
APHSSTRSEGSF	tr|B6DVW7|B6DVW7_9POLY	198	sp|Q07108|CD69_HUMAN Early activation antigen CD69 OS=Homo sapiens OX=9606 GN=CD69 PE=1 SV=1	26	SPHFSTRHEGSF
LLEISNLYSKFQ	tr|B6DVW7|B6DVW7_9POLY	52	tr|B1ALG6|B1ALG6_HUMAN Lymphoid-specific helicase (Fragment) OS=Homo sapiens OX=9606 GN=HELLS PE=1 SV=1	55	LLEKSNIYSKFL
LLEISNLYSKFQ	tr|B6DVW7|B6DVW7_9POLY	52	tr|A0A0B4J1V9|A0A0B4J1V9_HUMAN Helicase, lymphoid-specific, isoform CRA_b OS=Homo sapiens OX=9606 GN=HELLS PE=1 SV=1	71	LLEKSNIYSKFL
LLEISNLYSKFQ	tr|B6DVW7|B6DVW7_9POLY	52	sp|Q9NRZ9|HELLS_HUMAN Lymphoid-specific helicase OS=Homo sapiens OX=9606 GN=HELLS PE=1 SV=1	71	LLEKSNIYSKFL
LLEISNLYSKFQ	tr|B6DVW7|B6DVW7_9POLY	52	tr|Q76H82|Q76H82_HUMAN Lymphoid specific helicase variant1 OS=Homo sapiens OX=9606 GN=HELLS PE=1 SV=1	71	LLEKSNIYSKFL
KPFPCSKCEQRS	tr|B6DVW7|B6DVW7_9POLY	469	sp|Q9Y2Y4|ZBT32_HUMAN Zinc finger and BTB domain-containing protein 32 OS=Homo sapiens OX=9606 GN=ZBTB32 PE=1 SV=1	399	KPFSCSLCPQRS
