query	query_seqname	query_start	target_seqname	target_start	target
VISTAKTLASNL	sp|P0DOJ2|VP2_POVK6	237	tr|K7EKB0|K7EKB0_HUMAN Breast carcinoma-amplified sequence 3 (Fragment) OS=Homo sapiens OX=9606 GN=BCAS3 PE=1 SV=1	40	VISAAKTLKSGL
VISTAKTLASNL	sp|P0DOJ2|VP2_POVK6	237	tr|K7EJH7|K7EJH7_HUMAN Breast carcinoma-amplified sequence 3 (Fragment) OS=Homo sapiens OX=9606 GN=BCAS3 PE=1 SV=1	40	VISAAKTLKSGL
VISTAKTLASNL	sp|P0DOJ2|VP2_POVK6	237	tr|K7EML5|K7EML5_HUMAN Breast carcinoma-amplified sequence 3 (Fragment) OS=Homo sapiens OX=9606 GN=BCAS3 PE=1 SV=1	40	VISAAKTLKSGL
VISTAKTLASNL	sp|P0DOJ2|VP2_POVK6	237	tr|K7ESE9|K7ESE9_HUMAN Breast carcinoma-amplified sequence 3 OS=Homo sapiens OX=9606 GN=BCAS3 PE=1 SV=1	40	VISAAKTLKSGL
VISTAKTLASNL	sp|P0DOJ2|VP2_POVK6	237	sp|Q9H6U6|BCAS3_HUMAN Breast carcinoma-amplified sequence 3 OS=Homo sapiens OX=9606 GN=BCAS3 PE=1 SV=3	269	VISAAKTLKSGL
SSNNIPMAEDTG	sp|P0DOI3|VP1_POVK6	249	sp|Q08493|PDE4C_HUMAN cAMP-specific 3',5'-cyclic phosphodiesterase 4C OS=Homo sapiens OX=9606 GN=PDE4C PE=1 SV=2	191	SSNQLPPAEDTG
SRKYKHIYTELE	sp|P0DOI6|LT_POVK6	374	tr|J3QRL2|J3QRL2_HUMAN Myosin phosphatase Rho-interacting protein (Fragment) OS=Homo sapiens OX=9606 GN=MPRIP PE=1 SV=1	52	SDKYKDIYTELS
SRKYKHIYTELE	sp|P0DOI6|LT_POVK6	374	tr|H0Y2S9|H0Y2S9_HUMAN Myosin phosphatase Rho-interacting protein (Fragment) OS=Homo sapiens OX=9606 GN=MPRIP PE=1 SV=3	1694	SDKYKDIYTELS
SRKYKHIYTELE	sp|P0DOI6|LT_POVK6	374	tr|H7C3G6|H7C3G6_HUMAN Myosin phosphatase Rho-interacting protein (Fragment) OS=Homo sapiens OX=9606 GN=MPRIP PE=1 SV=2	177	SDKYKDIYTELS
SRKYKHIYTELE	sp|P0DOI6|LT_POVK6	374	tr|J3KSW8|J3KSW8_HUMAN Myosin phosphatase Rho-interacting protein (Fragment) OS=Homo sapiens OX=9606 GN=MPRIP PE=1 SV=1	744	SDKYKDIYTELS
SRKYKHIYTELE	sp|P0DOI6|LT_POVK6	374	tr|A0A494BZV2|A0A494BZV2_HUMAN Myosin phosphatase Rho-interacting protein OS=Homo sapiens OX=9606 GN=MPRIP PE=1 SV=1	2325	SDKYKDIYTELS
SRKYKHIYTELE	sp|P0DOI6|LT_POVK6	374	sp|Q6WCQ1|MPRIP_HUMAN Myosin phosphatase Rho-interacting protein OS=Homo sapiens OX=9606 GN=MPRIP PE=1 SV=3	938	SDKYKDIYTELS
SRKYKHIYTELE	sp|P0DOI6|LT_POVK6	374	tr|H0Y7E2|H0Y7E2_HUMAN Myosin phosphatase Rho-interacting protein (Fragment) OS=Homo sapiens OX=9606 GN=MPRIP PE=1 SV=3	1004	SDKYKDIYTELS
SRKYKHIYTELE	sp|P0DOI6|LT_POVK6	374	tr|K7EL39|K7EL39_HUMAN Myosin phosphatase Rho-interacting protein (Fragment) OS=Homo sapiens OX=9606 GN=MPRIP PE=1 SV=1	6	SDKYKDIYTELS
ERPGDLPPTSPQ	sp|P0DOJ2|VP2_POVK6	98	sp|P32927|IL3RB_HUMAN Cytokine receptor common subunit beta OS=Homo sapiens OX=9606 GN=CSF2RB PE=1 SV=2	798	ERPADVSPTSPQ
ERPGDLPPTSPQ	sp|P0DOJ2|VP2_POVK6	98	tr|Q6NSJ8|Q6NSJ8_HUMAN CSF2RB protein OS=Homo sapiens OX=9606 GN=CSF2RB PE=1 SV=1	798	ERPADVSPTSPQ
LGGSPAEVVGAN	sp|P0DOI3|VP1_POVK6	164	sp|Q9BX59|TPSNR_HUMAN Tapasin-related protein OS=Homo sapiens OX=9606 GN=TAPBPL PE=1 SV=2	340	LGGSPAQVSGAS
LLGGSPAEVVGA	sp|P0DOI3|VP1_POVK6	163	sp|Q9BX59|TPSNR_HUMAN Tapasin-related protein OS=Homo sapiens OX=9606 GN=TAPBPL PE=1 SV=2	339	ELGGSPAQVSGA
EGCAELQLEKKK	sp|P0DOI6|LT_POVK6	512	sp|Q99767|APBA2_HUMAN Amyloid-beta A4 precursor protein-binding family A member 2 OS=Homo sapiens OX=9606 GN=APBA2 PE=1 SV=3	564	ENCKELQLEKHK
LIRRRTEEARPA	sp|P0DOJ2|VP2_POVK6	347	tr|H7C459|H7C459_HUMAN Mitogen-activated protein kinase kinase kinase 13 (Fragment) OS=Homo sapiens OX=9606 GN=MAP3K13 PE=1 SV=1	199	LIRRRREELRHA
LIRRRTEEARPA	sp|P0DOJ2|VP2_POVK6	347	sp|O43283|M3K13_HUMAN Mitogen-activated protein kinase kinase kinase 13 OS=Homo sapiens OX=9606 GN=MAP3K13 PE=1 SV=1	454	LIRRRREELRHA
LSRKYKHIYTEL	sp|P0DOI6|LT_POVK6	373	tr|J3QRL2|J3QRL2_HUMAN Myosin phosphatase Rho-interacting protein (Fragment) OS=Homo sapiens OX=9606 GN=MPRIP PE=1 SV=1	51	ASDKYKDIYTEL
LSRKYKHIYTEL	sp|P0DOI6|LT_POVK6	373	tr|H0Y2S9|H0Y2S9_HUMAN Myosin phosphatase Rho-interacting protein (Fragment) OS=Homo sapiens OX=9606 GN=MPRIP PE=1 SV=3	1693	ASDKYKDIYTEL
LSRKYKHIYTEL	sp|P0DOI6|LT_POVK6	373	tr|H7C3G6|H7C3G6_HUMAN Myosin phosphatase Rho-interacting protein (Fragment) OS=Homo sapiens OX=9606 GN=MPRIP PE=1 SV=2	176	ASDKYKDIYTEL
LSRKYKHIYTEL	sp|P0DOI6|LT_POVK6	373	tr|J3KSW8|J3KSW8_HUMAN Myosin phosphatase Rho-interacting protein (Fragment) OS=Homo sapiens OX=9606 GN=MPRIP PE=1 SV=1	743	ASDKYKDIYTEL
LSRKYKHIYTEL	sp|P0DOI6|LT_POVK6	373	tr|A0A494BZV2|A0A494BZV2_HUMAN Myosin phosphatase Rho-interacting protein OS=Homo sapiens OX=9606 GN=MPRIP PE=1 SV=1	2324	ASDKYKDIYTEL
LSRKYKHIYTEL	sp|P0DOI6|LT_POVK6	373	sp|Q6WCQ1|MPRIP_HUMAN Myosin phosphatase Rho-interacting protein OS=Homo sapiens OX=9606 GN=MPRIP PE=1 SV=3	937	ASDKYKDIYTEL
LSRKYKHIYTEL	sp|P0DOI6|LT_POVK6	373	tr|H0Y7E2|H0Y7E2_HUMAN Myosin phosphatase Rho-interacting protein (Fragment) OS=Homo sapiens OX=9606 GN=MPRIP PE=1 SV=3	1003	ASDKYKDIYTEL
LSRKYKHIYTEL	sp|P0DOI6|LT_POVK6	373	tr|K7EL39|K7EL39_HUMAN Myosin phosphatase Rho-interacting protein (Fragment) OS=Homo sapiens OX=9606 GN=MPRIP PE=1 SV=1	5	ASDKYKDIYTEL
THLAYGAFTNYF	sp|P0DOJ2|VP2_POVK6	184	sp|O95081|AGFG2_HUMAN Arf-GAP domain and FG repeat-containing protein 2 OS=Homo sapiens OX=9606 GN=AGFG2 PE=1 SV=2	357	TGLAFGAFTNPF
THLAYGAFTNYF	sp|P0DOJ2|VP2_POVK6	184	tr|H7BZA5|H7BZA5_HUMAN Arf-GAP domain and FG repeat-containing protein 2 (Fragment) OS=Homo sapiens OX=9606 GN=AGFG2 PE=1 SV=1	99	TGLAFGAFTNPF
PTSPQGQATGVK	sp|P0DOJ2|VP2_POVK6	105	sp|A6NJZ7|RIM3C_HUMAN RIMS-binding protein 3C OS=Homo sapiens OX=9606 GN=RIMBP3C PE=1 SV=3	1404	PHSRQGQALGVK
PTSPQGQATGVK	sp|P0DOJ2|VP2_POVK6	105	tr|J3KP16|J3KP16_HUMAN RIMS-binding protein 3C OS=Homo sapiens OX=9606 GN=RIMBP3C PE=3 SV=1	1310	PHSRQGQALGVK
PTSPQGQATGVK	sp|P0DOJ2|VP2_POVK6	105	sp|A6NNM3|RIM3B_HUMAN RIMS-binding protein 3B OS=Homo sapiens OX=9606 GN=RIMBP3B PE=3 SV=3	1404	PHSRQGQALGVK
PTSPQGQATGVK	sp|P0DOJ2|VP2_POVK6	105	sp|Q9UFD9|RIM3A_HUMAN RIMS-binding protein 3A OS=Homo sapiens OX=9606 GN=RIMBP3 PE=1 SV=4	1404	PHSRQGQALGVK
EKGGTEENLKVL	sp|P0DOI6|LT_POVK6	44	sp|Q8TCU6|PREX1_HUMAN Phosphatidylinositol 3,4,5-trisphosphate-dependent Rac exchanger 1 protein OS=Homo sapiens OX=9606 GN=PREX1 PE=1 SV=3	88	EKGLTEENVKVL
ELAPPEIPSQVT	sp|P0DOI3|VP1_POVK6	108	sp|Q14146|URB2_HUMAN Unhealthy ribosome biogenesis protein 2 homolog OS=Homo sapiens OX=9606 GN=URB2 PE=1 SV=2	1209	VLADPEIPVQVT
SLPNGTGVSTMD	sp|P0DOI6|LT_POVK6	494	sp|Q9UJF2|NGAP_HUMAN Ras GTPase-activating protein nGAP OS=Homo sapiens OX=9606 GN=RASAL2 PE=1 SV=2	700	SLPNGRSVSLMD
SLPNGTGVSTMD	sp|P0DOI6|LT_POVK6	494	tr|H0Y638|H0Y638_HUMAN Ras GTPase-activating protein nGAP (Fragment) OS=Homo sapiens OX=9606 GN=RASAL2 PE=1 SV=1	251	SLPNGRSVSLMD
PDLLALTLIGGL	sp|P0DOJ2|VP2_POVK6	8	tr|A0A087WTU3|A0A087WTU3_HUMAN Testis-expressed protein 264 OS=Homo sapiens OX=9606 GN=TEX264 PE=1 SV=1	2	SDLLLLGLIGGL
PDLLALTLIGGL	sp|P0DOJ2|VP2_POVK6	8	tr|C9JL43|C9JL43_HUMAN Testis-expressed protein 264 (Fragment) OS=Homo sapiens OX=9606 GN=TEX264 PE=1 SV=1	2	SDLLLLGLIGGL
PDLLALTLIGGL	sp|P0DOJ2|VP2_POVK6	8	tr|C9JUC3|C9JUC3_HUMAN Testis-expressed protein 264 (Fragment) OS=Homo sapiens OX=9606 GN=TEX264 PE=1 SV=8	2	SDLLLLGLIGGL
PDLLALTLIGGL	sp|P0DOJ2|VP2_POVK6	8	tr|C9J7N0|C9J7N0_HUMAN Testis-expressed protein 264 (Fragment) OS=Homo sapiens OX=9606 GN=TEX264 PE=1 SV=1	2	SDLLLLGLIGGL
PDLLALTLIGGL	sp|P0DOJ2|VP2_POVK6	8	tr|C9JXQ7|C9JXQ7_HUMAN Testis-expressed protein 264 (Fragment) OS=Homo sapiens OX=9606 GN=TEX264 PE=1 SV=8	2	SDLLLLGLIGGL
PDLLALTLIGGL	sp|P0DOJ2|VP2_POVK6	8	tr|C9JHH5|C9JHH5_HUMAN Testis-expressed protein 264 (Fragment) OS=Homo sapiens OX=9606 GN=TEX264 PE=1 SV=8	2	SDLLLLGLIGGL
PDLLALTLIGGL	sp|P0DOJ2|VP2_POVK6	8	sp|Q9Y6I9|TX264_HUMAN Testis-expressed protein 264 OS=Homo sapiens OX=9606 GN=TEX264 PE=1 SV=1	2	SDLLLLGLIGGL
GGSPAEVVGANP	sp|P0DOI3|VP1_POVK6	165	tr|J3QS36|J3QS36_HUMAN L-xylulose reductase (Fragment) OS=Homo sapiens OX=9606 GN=DCXR PE=1 SV=1	213	GGSPASVVPAVP
APDLLALTLIGG	sp|P0DOJ2|VP2_POVK6	7	sp|P00156|CYB_HUMAN Cytochrome b OS=Homo sapiens OX=9606 GN=MT-CYB PE=1 SV=2	329	AADLLILTWIGG
ISENLSSLKDLN	sp|P0DOI9|ST_POVK6	62	tr|Q5JYA8|Q5JYA8_HUMAN Monofunctional C1-tetrahydrofolate synthase, mitochondrial OS=Homo sapiens OX=9606 GN=MTHFD1L PE=1 SV=2	50	ISENLFSNKVLN
ISENLSSLKDLN	sp|P0DOI9|ST_POVK6	62	tr|Q5JYA3|Q5JYA3_HUMAN Monofunctional C1-tetrahydrofolate synthase, mitochondrial (Fragment) OS=Homo sapiens OX=9606 GN=MTHFD1L PE=1 SV=1	50	ISENLFSNKVLN
ISENLSSLKDLN	sp|P0DOI9|ST_POVK6	62	sp|Q6UB35|C1TM_HUMAN Monofunctional C1-tetrahydrofolate synthase, mitochondrial OS=Homo sapiens OX=9606 GN=MTHFD1L PE=1 SV=1	160	ISENLFSNKVLN
ISENLSSLKDLN	sp|P0DOI9|ST_POVK6	62	tr|H0Y327|H0Y327_HUMAN Monofunctional C1-tetrahydrofolate synthase, mitochondrial (Fragment) OS=Homo sapiens OX=9606 GN=MTHFD1L PE=1 SV=1	120	ISENLFSNKVLN
ISENLSSLKDLN	sp|P0DOI9|ST_POVK6	62	tr|A0A087WVM4|A0A087WVM4_HUMAN Formyltetrahydrofolate synthetase OS=Homo sapiens OX=9606 GN=MTHFD1L PE=1 SV=1	94	ISENLFSNKVLN
ISENLSSLKDLN	sp|P0DOI9|ST_POVK6	62	tr|B7ZM99|B7ZM99_HUMAN Formyltetrahydrofolate synthetase OS=Homo sapiens OX=9606 GN=MTHFD1L PE=1 SV=1	160	ISENLFSNKVLN
PLPPQITQTAPT	sp|P0DOI3|VP1_POVK6	340	tr|A0A669KBI7|A0A669KBI7_HUMAN [Histone H3]-lysine(4) N-trimethyltransferase OS=Homo sapiens OX=9606 GN=KMT2B PE=1 SV=1	2197	PLPPTISPTAPT
PLPPQITQTAPT	sp|P0DOI3|VP1_POVK6	340	sp|Q9UMN6|KMT2B_HUMAN Histone-lysine N-methyltransferase 2B OS=Homo sapiens OX=9606 GN=KMT2B PE=1 SV=1	2219	PLPPTISPTAPT
TLTPPGEPRTAR	sp|P0DOI3|VP1_POVK6	187	sp|Q9HCM7|FBSL_HUMAN Fibrosin-1-like protein OS=Homo sapiens OX=9606 GN=FBRSL1 PE=1 SV=4	551	TLVPPGRPRGAR
LAPPEIPSQVTE	sp|P0DOI3|VP1_POVK6	109	sp|Q14146|URB2_HUMAN Unhealthy ribosome biogenesis protein 2 homolog OS=Homo sapiens OX=9606 GN=URB2 PE=1 SV=2	1210	LADPEIPVQVTQ
LVGQNTGIIRGV	sp|P0DOI3|VP1_POVK6	143	tr|B1AM48|B1AM48_HUMAN ELAV-like protein (Fragment) OS=Homo sapiens OX=9606 GN=ELAVL2 PE=1 SV=1	157	LVDQVTGISRGV
LVGQNTGIIRGV	sp|P0DOI3|VP1_POVK6	143	tr|C9JB16|C9JB16_HUMAN ELAV-like protein 2 (Fragment) OS=Homo sapiens OX=9606 GN=ELAVL2 PE=1 SV=1	22	LVDQVTGISRGV
LVGQNTGIIRGV	sp|P0DOI3|VP1_POVK6	143	sp|Q12926|ELAV2_HUMAN ELAV-like protein 2 OS=Homo sapiens OX=9606 GN=ELAVL2 PE=1 SV=2	157	LVDQVTGISRGV
LVGQNTGIIRGV	sp|P0DOI3|VP1_POVK6	143	tr|A0A0A0MRX1|A0A0A0MRX1_HUMAN ELAV-like protein OS=Homo sapiens OX=9606 GN=ELAVL2 PE=1 SV=1	186	LVDQVTGISRGV
KISENLSSLKDL	sp|P0DOI9|ST_POVK6	61	tr|F8VQE1|F8VQE1_HUMAN LIM domain and actin-binding protein 1 OS=Homo sapiens OX=9606 GN=LIMA1 PE=1 SV=1	63	KISENSYSLDDL
KISENLSSLKDL	sp|P0DOI9|ST_POVK6	61	sp|Q9UHB6|LIMA1_HUMAN LIM domain and actin-binding protein 1 OS=Homo sapiens OX=9606 GN=LIMA1 PE=1 SV=1	223	KISENSYSLDDL
KISENLSSLKDL	sp|P0DOI9|ST_POVK6	61	tr|F8VRN8|F8VRN8_HUMAN LIM domain and actin-binding protein 1 OS=Homo sapiens OX=9606 GN=LIMA1 PE=1 SV=1	223	KISENSYSLDDL
KGGTEENLKVLN	sp|P0DOI6|LT_POVK6	45	sp|Q8TCU6|PREX1_HUMAN Phosphatidylinositol 3,4,5-trisphosphate-dependent Rac exchanger 1 protein OS=Homo sapiens OX=9606 GN=PREX1 PE=1 SV=3	89	KGLTEENVKVLF
GPLPPQITQTAP	sp|P0DOI3|VP1_POVK6	339	sp|Q6DN72|FCRL6_HUMAN Fc receptor-like protein 6 OS=Homo sapiens OX=9606 GN=FCRL6 PE=1 SV=2	337	GPLPSQIPPTAP
ARTPFSLQVAWR	sp|P0DOI3|VP1_POVK6	302	sp|Q6NSJ5|LRC8E_HUMAN Volume-regulated anion channel subunit LRRC8E OS=Homo sapiens OX=9606 GN=LRRC8E PE=1 SV=2	472	ARLPFSLQVFLR
AYGAFTNYFTAG	sp|P0DOJ2|VP2_POVK6	187	sp|O95081|AGFG2_HUMAN Arf-GAP domain and FG repeat-containing protein 2 OS=Homo sapiens OX=9606 GN=AGFG2 PE=1 SV=2	360	AFGAFTNPFTAP
AYGAFTNYFTAG	sp|P0DOJ2|VP2_POVK6	187	tr|H7BZA5|H7BZA5_HUMAN Arf-GAP domain and FG repeat-containing protein 2 (Fragment) OS=Homo sapiens OX=9606 GN=AGFG2 PE=1 SV=1	102	AFGAFTNPFTAP
VCNTLLEKVLLE	sp|P0DOI6|LT_POVK6	348	sp|O15498|YKT6_HUMAN Synaptobrevin homolog YKT6 OS=Homo sapiens OX=9606 GN=YKT6 PE=1 SV=1	89	VAFTLLEKVLDE
NLSVGQPIEVSK	sp|P0DOJ2|VP2_POVK6	255	tr|A0A087WYF1|A0A087WYF1_HUMAN Laminin subunit alpha-2 OS=Homo sapiens OX=9606 GN=LAMA2 PE=1 SV=1	2644	NLTVEQPIEVKK
NLSVGQPIEVSK	sp|P0DOJ2|VP2_POVK6	255	sp|P24043|LAMA2_HUMAN Laminin subunit alpha-2 OS=Homo sapiens OX=9606 GN=LAMA2 PE=1 SV=4	2648	NLTVEQPIEVKK
NLSVGQPIEVSK	sp|P0DOJ2|VP2_POVK6	255	tr|A0A087WX80|A0A087WX80_HUMAN Laminin subunit alpha-2 OS=Homo sapiens OX=9606 GN=LAMA2 PE=1 SV=1	2647	NLTVEQPIEVKK
GKVWVNCLDVVG	sp|P0DOI3|VP1_POVK6	268	sp|P05091|ALDH2_HUMAN Aldehyde dehydrogenase, mitochondrial OS=Homo sapiens OX=9606 GN=ALDH2 PE=1 SV=2	466	GTVWVNCYDVFG
AALQGGIGVIGG	sp|P0DOJ2|VP2_POVK6	79	sp|Q0D2K2|KLH30_HUMAN Kelch-like protein 30 OS=Homo sapiens OX=9606 GN=KLHL30 PE=2 SV=3	373	AALNGEIYVIGG
TKSRRRKGRSTT	sp|P0DOJ2|VP2_POVK6	379	sp|Q9UQ35|SRRM2_HUMAN Serine/arginine repetitive matrix protein 2 OS=Homo sapiens OX=9606 GN=SRRM2 PE=1 SV=2	1833	TSSRRRRGRSRT
TEENLKVLNNAF	sp|P0DOI6|LT_POVK6	48	sp|Q9H015|S22A4_HUMAN Solute carrier family 22 member 4 OS=Homo sapiens OX=9606 GN=SLC22A4 PE=1 SV=3	540	TEENPKVLITAF
PEKGGTEENLKV	sp|P0DOI6|LT_POVK6	43	sp|Q8TCU6|PREX1_HUMAN Phosphatidylinositol 3,4,5-trisphosphate-dependent Rac exchanger 1 protein OS=Homo sapiens OX=9606 GN=PREX1 PE=1 SV=3	87	VEKGLTEENVKV
TQLIRRRTEEAR	sp|P0DOJ2|VP2_POVK6	345	sp|Q14CX5|MF13A_HUMAN Transmembrane protein 180 OS=Homo sapiens OX=9606 GN=MFSD13A PE=1 SV=1	211	TQLLRRRVEAAR
DLLALTLIGGLE	sp|P0DOJ2|VP2_POVK6	9	tr|A0A087WTU3|A0A087WTU3_HUMAN Testis-expressed protein 264 OS=Homo sapiens OX=9606 GN=TEX264 PE=1 SV=1	3	DLLLLGLIGGLT
DLLALTLIGGLE	sp|P0DOJ2|VP2_POVK6	9	tr|C9JL43|C9JL43_HUMAN Testis-expressed protein 264 (Fragment) OS=Homo sapiens OX=9606 GN=TEX264 PE=1 SV=1	3	DLLLLGLIGGLT
DLLALTLIGGLE	sp|P0DOJ2|VP2_POVK6	9	tr|C9JUC3|C9JUC3_HUMAN Testis-expressed protein 264 (Fragment) OS=Homo sapiens OX=9606 GN=TEX264 PE=1 SV=8	3	DLLLLGLIGGLT
DLLALTLIGGLE	sp|P0DOJ2|VP2_POVK6	9	tr|C9J7N0|C9J7N0_HUMAN Testis-expressed protein 264 (Fragment) OS=Homo sapiens OX=9606 GN=TEX264 PE=1 SV=1	3	DLLLLGLIGGLT
DLLALTLIGGLE	sp|P0DOJ2|VP2_POVK6	9	tr|C9JXQ7|C9JXQ7_HUMAN Testis-expressed protein 264 (Fragment) OS=Homo sapiens OX=9606 GN=TEX264 PE=1 SV=8	3	DLLLLGLIGGLT
DLLALTLIGGLE	sp|P0DOJ2|VP2_POVK6	9	tr|C9JHH5|C9JHH5_HUMAN Testis-expressed protein 264 (Fragment) OS=Homo sapiens OX=9606 GN=TEX264 PE=1 SV=8	3	DLLLLGLIGGLT
DLLALTLIGGLE	sp|P0DOJ2|VP2_POVK6	9	sp|Q9Y6I9|TX264_HUMAN Testis-expressed protein 264 OS=Homo sapiens OX=9606 GN=TEX264 PE=1 SV=1	3	DLLLLGLIGGLT
TITTLRHPVHLP	sp|P0DOJ2|VP2_POVK6	129	sp|Q00005|2ABB_HUMAN Serine/threonine-protein phosphatase 2A 55 kDa regulatory subunit B beta isoform OS=Homo sapiens OX=9606 GN=PPP2R2B PE=1 SV=1	144	TITTLRVPVLRP
LAYGAFTNYFTA	sp|P0DOJ2|VP2_POVK6	186	sp|O95081|AGFG2_HUMAN Arf-GAP domain and FG repeat-containing protein 2 OS=Homo sapiens OX=9606 GN=AGFG2 PE=1 SV=2	359	LAFGAFTNPFTA
LAYGAFTNYFTA	sp|P0DOJ2|VP2_POVK6	186	tr|H7BZA5|H7BZA5_HUMAN Arf-GAP domain and FG repeat-containing protein 2 (Fragment) OS=Homo sapiens OX=9606 GN=AGFG2 PE=1 SV=1	101	LAFGAFTNPFTA
LLALTLIGGLEL	sp|P0DOJ2|VP2_POVK6	10	tr|A0A087WTU3|A0A087WTU3_HUMAN Testis-expressed protein 264 OS=Homo sapiens OX=9606 GN=TEX264 PE=1 SV=1	4	LLLLGLIGGLTL
LLALTLIGGLEL	sp|P0DOJ2|VP2_POVK6	10	tr|C9JL43|C9JL43_HUMAN Testis-expressed protein 264 (Fragment) OS=Homo sapiens OX=9606 GN=TEX264 PE=1 SV=1	4	LLLLGLIGGLTL
LLALTLIGGLEL	sp|P0DOJ2|VP2_POVK6	10	tr|C9JUC3|C9JUC3_HUMAN Testis-expressed protein 264 (Fragment) OS=Homo sapiens OX=9606 GN=TEX264 PE=1 SV=8	4	LLLLGLIGGLTL
LLALTLIGGLEL	sp|P0DOJ2|VP2_POVK6	10	tr|C9J7N0|C9J7N0_HUMAN Testis-expressed protein 264 (Fragment) OS=Homo sapiens OX=9606 GN=TEX264 PE=1 SV=1	4	LLLLGLIGGLTL
LLALTLIGGLEL	sp|P0DOJ2|VP2_POVK6	10	tr|C9JXQ7|C9JXQ7_HUMAN Testis-expressed protein 264 (Fragment) OS=Homo sapiens OX=9606 GN=TEX264 PE=1 SV=8	4	LLLLGLIGGLTL
LLALTLIGGLEL	sp|P0DOJ2|VP2_POVK6	10	tr|C9JHH5|C9JHH5_HUMAN Testis-expressed protein 264 (Fragment) OS=Homo sapiens OX=9606 GN=TEX264 PE=1 SV=8	4	LLLLGLIGGLTL
LLALTLIGGLEL	sp|P0DOJ2|VP2_POVK6	10	sp|Q9Y6I9|TX264_HUMAN Testis-expressed protein 264 OS=Homo sapiens OX=9606 GN=TEX264 PE=1 SV=1	4	LLLLGLIGGLTL
ASAGETEPASAV	sp|P0DOJ2|VP2_POVK6	226	tr|G3V5M7|G3V5M7_HUMAN Pre-mRNA-processing factor 39 (Fragment) OS=Homo sapiens OX=9606 GN=PRPF39 PE=1 SV=1	53	ASTEETEMASAV
ASAGETEPASAV	sp|P0DOJ2|VP2_POVK6	226	tr|F8WB90|F8WB90_HUMAN Pre-mRNA-processing factor 39 OS=Homo sapiens OX=9606 GN=PRPF39 PE=1 SV=1	53	ASTEETEMASAV
ASAGETEPASAV	sp|P0DOJ2|VP2_POVK6	226	sp|Q86UA1|PRP39_HUMAN Pre-mRNA-processing factor 39 OS=Homo sapiens OX=9606 GN=PRPF39 PE=1 SV=3	53	ASTEETEMASAV
HLAYGAFTNYFT	sp|P0DOJ2|VP2_POVK6	185	sp|O95081|AGFG2_HUMAN Arf-GAP domain and FG repeat-containing protein 2 OS=Homo sapiens OX=9606 GN=AGFG2 PE=1 SV=2	358	GLAFGAFTNPFT
HLAYGAFTNYFT	sp|P0DOJ2|VP2_POVK6	185	tr|H7BZA5|H7BZA5_HUMAN Arf-GAP domain and FG repeat-containing protein 2 (Fragment) OS=Homo sapiens OX=9606 GN=AGFG2 PE=1 SV=1	100	GLAFGAFTNPFT
