query	query_seqname	query_start	target_seqname	target_start	target
APTGTVIKFDLG	sp|P0C6U2|R1A_CVH22	1522	tr|Q5T1U7|Q5T1U7_HUMAN Collagen alpha-1(XXVII) chain (Fragment) OS=Homo sapiens OX=9606 GN=COL27A1 PE=1 SV=1	31	APTGTVIPAALG
APTGTVIKFDLG	sp|P0C6U2|R1A_CVH22	1522	sp|Q8IZC6|CORA1_HUMAN Collagen alpha-1(XXVII) chain OS=Homo sapiens OX=9606 GN=COL27A1 PE=2 SV=1	84	APTGTVIPAALG
QPVINSGSSLLE	sp|P0C6U2|R1A_CVH22	221	tr|A0A0J9YY01|A0A0J9YY01_HUMAN Unconventional myosin-XVB OS=Homo sapiens OX=9606 GN=MYO15B PE=1 SV=1	1812	QPVISSGLSDLE
QPVINSGSSLLE	sp|P0C6U2|R1A_CVH22	221	tr|A0A286YF23|A0A286YF23_HUMAN Unconventional myosin-XVB OS=Homo sapiens OX=9606 GN=MYO15B PE=1 SV=1	348	QPVISSGLSDLE
QPVINSGSSLLE	sp|P0C6U2|R1A_CVH22	221	tr|A0A2R8YFM0|A0A2R8YFM0_HUMAN Unconventional myosin-XVB OS=Homo sapiens OX=9606 GN=MYO15B PE=1 SV=2	1860	QPVISSGLSDLE
QPVINSGSSLLE	sp|P0C6U2|R1A_CVH22	221	sp|Q96JP2|MY15B_HUMAN Unconventional myosin-XVB OS=Homo sapiens OX=9606 GN=MYO15B PE=1 SV=3	786	QPVISSGLSDLE
ETVSQVATINLV	sp|P0C6X1|R1AB_CVH22	3158	tr|A0A096LPG1|A0A096LPG1_HUMAN Hemicentin-2 (Fragment) OS=Homo sapiens OX=9606 GN=HMCN2 PE=1 SV=1	173	ETVSQVAGSPLV
ETVSQVATINLV	sp|P0C6X1|R1AB_CVH22	3158	sp|Q8NDA2|HMCN2_HUMAN Hemicentin-2 OS=Homo sapiens OX=9606 GN=HMCN2 PE=2 SV=3	3140	ETVSQVAGSPLV
ASLFLLPSLAAV	sp|P0C6U2|R1A_CVH22	3331	sp|P29323|EPHB2_HUMAN Ephrin type-B receptor 2 OS=Homo sapiens OX=9606 GN=EPHB2 PE=1 SV=5	8	AALLLLPLLAAV
ASLFLLPSLAAV	sp|P0C6U2|R1A_CVH22	3331	tr|Q6NVW1|Q6NVW1_HUMAN EPHB2 protein OS=Homo sapiens OX=9606 GN=EPHB2 PE=1 SV=1	8	AALLLLPLLAAV
ITALRSGKLALR	sp|P0C6X1|R1AB_CVH22	6731	sp|O00231|PSD11_HUMAN 26S proteasome non-ATPase regulatory subunit 11 OS=Homo sapiens OX=9606 GN=PSMD11 PE=1 SV=3	267	VQALVSGKLALR
INVGVCSVLLVL	sp|P0C6U2|R1A_CVH22	2782	sp|O00238|BMR1B_HUMAN Bone morphogenetic protein receptor type-1B OS=Homo sapiens OX=9606 GN=BMPR1B PE=1 SV=1	130	ISVTVCSLLLVL
VFKRASDPVYQQ	sp|P0C6U2|R1A_CVH22	2064	sp|P13667|PDIA4_HUMAN Protein disulfide-isomerase A4 OS=Homo sapiens OX=9606 GN=PDIA4 PE=1 SV=2	311	VFKGESDPAYQQ
VFKRASDPVYQQ	sp|P0C6U2|R1A_CVH22	2064	tr|A0A499FI48|A0A499FI48_HUMAN Protein disulfide-isomerase OS=Homo sapiens OX=9606 GN=PDIA4 PE=1 SV=1	311	VFKGESDPAYQQ
NNSVRSPRKSWR	sp|P0C6X1|R1AB_CVH22	3057	tr|D6RBF0|D6RBF0_HUMAN PHD finger protein 3 (Fragment) OS=Homo sapiens OX=9606 GN=PHF3 PE=1 SV=1	50	ENSVRSPRKSPR
NNSVRSPRKSWR	sp|P0C6X1|R1AB_CVH22	3057	tr|D6R9X2|D6R9X2_HUMAN PHD finger protein 3 OS=Homo sapiens OX=9606 GN=PHF3 PE=1 SV=1	120	ENSVRSPRKSPR
NNSVRSPRKSWR	sp|P0C6X1|R1AB_CVH22	3057	tr|A0A1B0GX99|A0A1B0GX99_HUMAN PHD finger protein 3 (Fragment) OS=Homo sapiens OX=9606 GN=PHF3 PE=1 SV=1	73	ENSVRSPRKSPR
NNSVRSPRKSWR	sp|P0C6X1|R1AB_CVH22	3057	tr|E9PE34|E9PE34_HUMAN PHD finger protein 3 (Fragment) OS=Homo sapiens OX=9606 GN=PHF3 PE=1 SV=1	32	ENSVRSPRKSPR
NNSVRSPRKSWR	sp|P0C6X1|R1AB_CVH22	3057	sp|Q92576|PHF3_HUMAN PHD finger protein 3 OS=Homo sapiens OX=9606 GN=PHF3 PE=1 SV=3	120	ENSVRSPRKSPR
SLASLDEKGLLL	sp|P0C6U2|R1A_CVH22	1489	sp|Q07954|LRP1_HUMAN Prolow-density lipoprotein receptor-related protein 1 OS=Homo sapiens OX=9606 GN=LRP1 PE=1 SV=2	4520	SLASTDEKRELL
SVFNSSWTVIVI	sp|P0C6U2|R1A_CVH22	2740	tr|H0YBE3|H0YBE3_HUMAN Protein FAM184A (Fragment) OS=Homo sapiens OX=9606 GN=FAM184A PE=1 SV=1	9	KVFNSSPTVGVI
SVFNSSWTVIVI	sp|P0C6U2|R1A_CVH22	2740	tr|H0YBA5|H0YBA5_HUMAN Protein FAM184A OS=Homo sapiens OX=9606 GN=FAM184A PE=1 SV=2	910	KVFNSSPTVGVI
SVFNSSWTVIVI	sp|P0C6U2|R1A_CVH22	2740	tr|A0A0C4DGZ2|A0A0C4DGZ2_HUMAN Protein FAM184A OS=Homo sapiens OX=9606 GN=FAM184A PE=1 SV=1	182	KVFNSSPTVGVI
SVFNSSWTVIVI	sp|P0C6U2|R1A_CVH22	2740	sp|Q8NB25|F184A_HUMAN Protein FAM184A OS=Homo sapiens OX=9606 GN=FAM184A PE=1 SV=3	1030	KVFNSSPTVGVI
SVFNSSWTVIVI	sp|P0C6U2|R1A_CVH22	2740	tr|A0A087X2A7|A0A087X2A7_HUMAN Protein FAM184A OS=Homo sapiens OX=9606 GN=FAM184A PE=1 SV=1	988	KVFNSSPTVGVI
SVFNSSWTVIVI	sp|P0C6U2|R1A_CVH22	2740	tr|H0YBZ6|H0YBZ6_HUMAN Protein FAM184A (Fragment) OS=Homo sapiens OX=9606 GN=FAM184A PE=1 SV=1	16	KVFNSSPTVGVI
SVFNSSWTVIVI	sp|P0C6U2|R1A_CVH22	2740	tr|B9DI78|B9DI78_HUMAN Protein FAM184A (Fragment) OS=Homo sapiens OX=9606 GN=FAM184A PE=1 SV=1	91	KVFNSSPTVGVI
NNKLHGLNWALS	sp|P0C6X1|R1AB_CVH22	2452	sp|Q8N2C7|UNC80_HUMAN Protein unc-80 homolog OS=Homo sapiens OX=9606 GN=UNC80 PE=2 SV=2	55	ENKLHGLSPALS
NNKLHGLNWALS	sp|P0C6X1|R1AB_CVH22	2452	tr|A0A669KAW8|A0A669KAW8_HUMAN Protein unc-80 homolog OS=Homo sapiens OX=9606 GN=UNC80 PE=1 SV=1	55	ENKLHGLSPALS
NNKLHGLNWALS	sp|P0C6X1|R1AB_CVH22	2452	tr|A0A669KBC5|A0A669KBC5_HUMAN Protein unc-80 homolog OS=Homo sapiens OX=9606 GN=UNC80 PE=1 SV=1	55	ENKLHGLSPALS
DVIITALRSGKL	sp|P0C6X1|R1AB_CVH22	6728	tr|X6RFN3|X6RFN3_HUMAN E3 ubiquitin-protein ligase RING2 (Fragment) OS=Homo sapiens OX=9606 GN=RNF2 PE=1 SV=2	74	DCIITALRSGNK
DVIITALRSGKL	sp|P0C6X1|R1AB_CVH22	6728	sp|Q99496|RING2_HUMAN E3 ubiquitin-protein ligase RING2 OS=Homo sapiens OX=9606 GN=RNF2 PE=1 SV=1	74	DCIITALRSGNK
VTVPSGPFDLLF	sp|P0C6U2|R1A_CVH22	3515	tr|F8W733|F8W733_HUMAN BRCA1-A complex subunit BRE (Fragment) OS=Homo sapiens OX=9606 GN=BABAM2 PE=1 SV=1	252	VSVPSGPFHLLI
LITSLLGLPNSL	sp|P0C6X1|R1AB_CVH22	2580	sp|Q86V87|F16B2_HUMAN Protein FAM160B2 OS=Homo sapiens OX=9606 GN=FAM160B2 PE=2 SV=2	245	LITSLLGLCQSK
RRDGLYFPTTGT	sp|P0C6X1|R1AB_CVH22	874	tr|C9JD37|C9JD37_HUMAN Growth factor receptor-bound protein 14 (Fragment) OS=Homo sapiens OX=9606 GN=GRB14 PE=1 SV=9	214	RRSGLYFSTKGT
RRDGLYFPTTGT	sp|P0C6X1|R1AB_CVH22	874	sp|Q14449|GRB14_HUMAN Growth factor receptor-bound protein 14 OS=Homo sapiens OX=9606 GN=GRB14 PE=1 SV=2	259	RRSGLYFSTKGT
LKNLVWGILKKA	sp|P0C6U2|R1A_CVH22	3716	sp|Q9BQQ7|RTP3_HUMAN Receptor-transporting protein 3 OS=Homo sapiens OX=9606 GN=RTP3 PE=1 SV=1	115	LKNLVFRILKKC
GGKSASSKLLKI	sp|P0C6X1|R1AB_CVH22	5899	sp|O95067|CCNB2_HUMAN G2/mitotic-specific cyclin-B2 OS=Homo sapiens OX=9606 GN=CCNB2 PE=1 SV=1	365	KNKYASSKLLKI
GGKSASSKLLKI	sp|P0C6X1|R1AB_CVH22	5899	tr|H0YMP3|H0YMP3_HUMAN G2/mitotic-specific cyclin-B2 OS=Homo sapiens OX=9606 GN=CCNB2 PE=1 SV=1	237	KNKYASSKLLKI
SVSVESSAEKVL	sp|P15423|SPIKE_CVH22	871	tr|A0A2R8Y5K2|A0A2R8Y5K2_HUMAN Guanine nucleotide exchange C9orf72 OS=Homo sapiens OX=9606 GN=C9orf72 PE=1 SV=1	234	SVVVGSSAEKVN
SVSVESSAEKVL	sp|P15423|SPIKE_CVH22	871	sp|Q96LT7|CI072_HUMAN Guanine nucleotide exchange C9orf72 OS=Homo sapiens OX=9606 GN=C9orf72 PE=1 SV=2	234	SVVVGSSAEKVN
SVSVESSAEKVL	sp|P15423|SPIKE_CVH22	871	tr|A0A5F9ZHW7|A0A5F9ZHW7_HUMAN Guanine nucleotide exchange C9orf72 OS=Homo sapiens OX=9606 GN=C9orf72 PE=1 SV=1	234	SVVVGSSAEKVN
SVSVESSAEKVL	sp|P15423|SPIKE_CVH22	871	tr|A0A2R8Y5U5|A0A2R8Y5U5_HUMAN Guanine nucleotide exchange C9orf72 OS=Homo sapiens OX=9606 GN=C9orf72 PE=1 SV=1	234	SVVVGSSAEKVN
KVYQPKAVRELG	sp|P0C6X1|R1AB_CVH22	5913	sp|Q9C0B7|TNG6_HUMAN Transport and Golgi organization protein 6 homolog OS=Homo sapiens OX=9606 GN=TANGO6 PE=1 SV=2	265	QVYQPLAVRELL
VTDVIITALRSG	sp|P0C6X1|R1AB_CVH22	6726	tr|X6RFN3|X6RFN3_HUMAN E3 ubiquitin-protein ligase RING2 (Fragment) OS=Homo sapiens OX=9606 GN=RNF2 PE=1 SV=2	72	CADCIITALRSG
VTDVIITALRSG	sp|P0C6X1|R1AB_CVH22	6726	sp|Q99496|RING2_HUMAN E3 ubiquitin-protein ligase RING2 OS=Homo sapiens OX=9606 GN=RNF2 PE=1 SV=1	72	CADCIITALRSG
IGGNITILVNVP	sp|P0C6X1|R1AB_CVH22	444	sp|Q8NH57|O52P1_HUMAN Putative olfactory receptor 52P1 OS=Homo sapiens OX=9606 GN=OR52P1P PE=5 SV=2	41	IVGNITILVVVA
DLSWTVSRLSTA	sp|P15423|SPIKE_CVH22	1080	sp|Q96DN2|VWCE_HUMAN von Willebrand factor C and EGF domain-containing protein OS=Homo sapiens OX=9606 GN=VWCE PE=1 SV=2	920	VLSPTTSRLSTA
DLSWTVSRLSTA	sp|P15423|SPIKE_CVH22	1080	tr|B4DY31|B4DY31_HUMAN cDNA FLJ51386 OS=Homo sapiens OX=9606 GN=VWCE PE=1 SV=1	385	VLSPTTSRLSTA
DLSWTVSRLSTA	sp|P15423|SPIKE_CVH22	1080	tr|A0A087WVD8|A0A087WVD8_HUMAN von Willebrand factor C and EGF domain-containing protein OS=Homo sapiens OX=9606 GN=VWCE PE=1 SV=1	635	VLSPTTSRLSTA
GKSASSKLLKIA	sp|P0C6X1|R1AB_CVH22	5900	sp|O95067|CCNB2_HUMAN G2/mitotic-specific cyclin-B2 OS=Homo sapiens OX=9606 GN=CCNB2 PE=1 SV=1	366	NKYASSKLLKIS
GKSASSKLLKIA	sp|P0C6X1|R1AB_CVH22	5900	tr|H0YMP3|H0YMP3_HUMAN G2/mitotic-specific cyclin-B2 OS=Homo sapiens OX=9606 GN=CCNB2 PE=1 SV=1	238	NKYASSKLLKIS
CKKKRFFCVECE	sp|P0C6X1|R1AB_CVH22	2194	sp|Q6IV72|ZN425_HUMAN Zinc finger protein 425 OS=Homo sapiens OX=9606 GN=ZNF425 PE=1 SV=1	241	CQKKRFQCSECE
AVVQHNLNILIG	sp|P0C6X1|R1AB_CVH22	4642	tr|A0A1W2PP70|A0A1W2PP70_HUMAN HLA class II histocompatibility antigen, DQ alpha 1 chain OS=Homo sapiens OX=9606 GN=HLA-DQA1 PE=1 SV=1	72	AVLKHNLNILIK
AVVQHNLNILIG	sp|P0C6X1|R1AB_CVH22	4642	tr|Q08AS3|Q08AS3_HUMAN HLA class II histocompatibility antigen DQ alpha chain OS=Homo sapiens OX=9606 GN=HLA-DQA1 PE=1 SV=1	89	AVLKHNLNILIK
GEYTGFRSSCCS	sp|P0C6U2|R1A_CVH22	256	tr|J3QKX9|J3QKX9_HUMAN Lipoxygenase homology domain-containing protein 1 OS=Homo sapiens OX=9606 GN=LOXHD1 PE=4 SV=1	373	KEYTGDRSSNCS
GEYTGFRSSCCS	sp|P0C6U2|R1A_CVH22	256	sp|Q8IVV2|LOXH1_HUMAN Lipoxygenase homology domain-containing protein 1 OS=Homo sapiens OX=9606 GN=LOXHD1 PE=2 SV=4	1374	KEYTGDRSSNCS
GEYTGFRSSCCS	sp|P0C6U2|R1A_CVH22	256	tr|A0A2R8Y7K4|A0A2R8Y7K4_HUMAN Lipoxygenase homology domain-containing protein 1 OS=Homo sapiens OX=9606 GN=LOXHD1 PE=1 SV=1	1580	KEYTGDRSSNCS
GEYTGFRSSCCS	sp|P0C6U2|R1A_CVH22	256	tr|J3KRE7|J3KRE7_HUMAN Lipoxygenase homology domain-containing protein 1 OS=Homo sapiens OX=9606 GN=LOXHD1 PE=4 SV=1	469	KEYTGDRSSNCS
GEYTGFRSSCCS	sp|P0C6U2|R1A_CVH22	256	tr|F5GZB4|F5GZB4_HUMAN Lipoxygenase homology domain-containing protein 1 OS=Homo sapiens OX=9606 GN=LOXHD1 PE=1 SV=1	1580	KEYTGDRSSNCS
YPVTRRPKPDYR	sp|P0C6X1|R1AB_CVH22	4930	sp|P78524|DEN2B_HUMAN DENN domain-containing protein 2B OS=Homo sapiens OX=9606 GN=DENND2B PE=1 SV=3	428	PPVTRRPKKDMR
AALMNTGVTNQQ	sp|P0C6X1|R1AB_CVH22	4461	sp|Q6YHK3|CD109_HUMAN CD109 antigen OS=Homo sapiens OX=9606 GN=CD109 PE=1 SV=2	1195	AALMNTERTNIQ
LFLLPSLAAVVA	sp|P0C6U2|R1A_CVH22	3333	tr|X6RA92|X6RA92_HUMAN Myogenesis-regulating glycosidase (Fragment) OS=Homo sapiens OX=9606 GN=MYORG PE=1 SV=1	26	LGLLLVLAAVVA
LFLLPSLAAVVA	sp|P0C6U2|R1A_CVH22	3333	sp|Q6NSJ0|MYORG_HUMAN Myogenesis-regulating glycosidase OS=Homo sapiens OX=9606 GN=MYORG PE=1 SV=2	63	LGLLLVLAAVVA
SNNSVRSPRKSW	sp|P0C6X1|R1AB_CVH22	3056	tr|D6RBF0|D6RBF0_HUMAN PHD finger protein 3 (Fragment) OS=Homo sapiens OX=9606 GN=PHF3 PE=1 SV=1	49	EENSVRSPRKSP
SNNSVRSPRKSW	sp|P0C6X1|R1AB_CVH22	3056	tr|D6R9X2|D6R9X2_HUMAN PHD finger protein 3 OS=Homo sapiens OX=9606 GN=PHF3 PE=1 SV=1	119	EENSVRSPRKSP
SNNSVRSPRKSW	sp|P0C6X1|R1AB_CVH22	3056	tr|A0A1B0GX99|A0A1B0GX99_HUMAN PHD finger protein 3 (Fragment) OS=Homo sapiens OX=9606 GN=PHF3 PE=1 SV=1	72	EENSVRSPRKSP
SNNSVRSPRKSW	sp|P0C6X1|R1AB_CVH22	3056	tr|E9PE34|E9PE34_HUMAN PHD finger protein 3 (Fragment) OS=Homo sapiens OX=9606 GN=PHF3 PE=1 SV=1	31	EENSVRSPRKSP
SNNSVRSPRKSW	sp|P0C6X1|R1AB_CVH22	3056	sp|Q92576|PHF3_HUMAN PHD finger protein 3 OS=Homo sapiens OX=9606 GN=PHF3 PE=1 SV=3	119	EENSVRSPRKSP
CDLYKELAVLSG	sp|P0C6X1|R1AB_CVH22	4201	tr|A0A0G2JPK4|A0A0G2JPK4_HUMAN Putative alpha-1-antitrypsin-related protein OS=Homo sapiens OX=9606 GN=SERPINA2 PE=1 SV=1	62	FDLYKELADLSQ
CDLYKELAVLSG	sp|P0C6X1|R1AB_CVH22	4201	tr|A0A0U1RQB8|A0A0U1RQB8_HUMAN Putative alpha-1-antitrypsin-related protein OS=Homo sapiens OX=9606 GN=SERPINA2 PE=1 SV=1	62	FDLYKELADLSQ
LKGKVDKEVSLT	sp|P19740|NS4B_CVH22	45	sp|A8K2U0|A2ML1_HUMAN Alpha-2-macroglobulin-like protein 1 OS=Homo sapiens OX=9606 GN=A2ML1 PE=1 SV=3	1087	MKGGVDDEVSLT
LKGKVDKEVSLT	sp|P19740|NS4B_CVH22	45	tr|H0YGG5|H0YGG5_HUMAN Alpha-2-macroglobulin-like protein 1 (Fragment) OS=Homo sapiens OX=9606 GN=A2ML1 PE=1 SV=1	637	MKGGVDDEVSLT
TALRSGKLALRG	sp|P0C6X1|R1AB_CVH22	6732	tr|C9JCD5|C9JCD5_HUMAN Transmembrane 4 L6 family member 19 OS=Homo sapiens OX=9606 GN=TM4SF19 PE=3 SV=1	96	TALLSGGLALLG
TALRSGKLALRG	sp|P0C6X1|R1AB_CVH22	6732	sp|Q96DZ7|T4S19_HUMAN Transmembrane 4 L6 family member 19 OS=Homo sapiens OX=9606 GN=TM4SF19 PE=1 SV=2	96	TALLSGGLALLG
TALRSGKLALRG	sp|P0C6X1|R1AB_CVH22	6732	sp|O00231|PSD11_HUMAN 26S proteasome non-ATPase regulatory subunit 11 OS=Homo sapiens OX=9606 GN=PSMD11 PE=1 SV=3	268	QALVSGKLALRY
DLITSLLGLPNS	sp|P0C6X1|R1AB_CVH22	2579	sp|Q86V87|F16B2_HUMAN Protein FAM160B2 OS=Homo sapiens OX=9606 GN=FAM160B2 PE=2 SV=2	244	NLITSLLGLCQS
TVLQTSANCLAT	sp|P0C6X1|R1AB_CVH22	4761	tr|E9PK39|E9PK39_HUMAN Leucine-rich repeat serine/threonine-protein kinase 1 OS=Homo sapiens OX=9606 GN=LRRK1 PE=1 SV=1	281	TELDLSANCLAT
TVLQTSANCLAT	sp|P0C6X1|R1AB_CVH22	4761	tr|E9PMK9|E9PMK9_HUMAN Leucine-rich repeat serine/threonine-protein kinase 1 OS=Homo sapiens OX=9606 GN=LRRK1 PE=1 SV=1	281	TELDLSANCLAT
TVLQTSANCLAT	sp|P0C6X1|R1AB_CVH22	4761	sp|Q38SD2|LRRK1_HUMAN Leucine-rich repeat serine/threonine-protein kinase 1 OS=Homo sapiens OX=9606 GN=LRRK1 PE=1 SV=3	281	TELDLSANCLAT
MARSGGHTIPLL	sp|P0C6X1|R1AB_CVH22	6249	sp|Q13393|PLD1_HUMAN Phospholipase D1 OS=Homo sapiens OX=9606 GN=PLD1 PE=1 SV=1	227	MKRSGGHRIPGL
ALGDVDVFIAYV	sp|P0C6U2|R1A_CVH22	1730	sp|Q9HAV4|XPO5_HUMAN Exportin-5 OS=Homo sapiens OX=9606 GN=XPO5 PE=1 SV=1	688	VLSDVDAFIAYV
EVVFLSYKLVGL	sp|P0C6X1|R1AB_CVH22	3523	tr|J3QS93|J3QS93_HUMAN Netrin receptor DCC OS=Homo sapiens OX=9606 GN=DCC PE=1 SV=1	232	EVDGLSYKLEGL
EVVFLSYKLVGL	sp|P0C6X1|R1AB_CVH22	3523	tr|E7EQM8|E7EQM8_HUMAN Netrin receptor DCC OS=Homo sapiens OX=9606 GN=DCC PE=1 SV=2	554	EVDGLSYKLEGL
EVVFLSYKLVGL	sp|P0C6X1|R1AB_CVH22	3523	sp|P43146|DCC_HUMAN Netrin receptor DCC OS=Homo sapiens OX=9606 GN=DCC PE=1 SV=2	577	EVDGLSYKLEGL
EVVFLSYKLVGL	sp|P0C6X1|R1AB_CVH22	3523	tr|H0Y2Q5|H0Y2Q5_HUMAN Netrin receptor DCC (Fragment) OS=Homo sapiens OX=9606 GN=DCC PE=1 SV=2	511	EVDGLSYKLEGL
AVKVLGISNTSV	sp|P0C6X1|R1AB_CVH22	5518	sp|P22033|MUTA_HUMAN Methylmalonyl-CoA mutase, mitochondrial OS=Homo sapiens OX=9606 GN=MMUT PE=1 SV=4	499	AVEVLAIDNTSV
HEFHVVTDIHDN	sp|P0C6X1|R1AB_CVH22	5113	sp|Q15761|NPY5R_HUMAN Neuropeptide Y receptor type 5 OS=Homo sapiens OX=9606 GN=NPY5R PE=2 SV=2	385	HLFHVVTDFNDN
AVSCLLGAYAIF	sp|P0C6U2|R1A_CVH22	2756	sp|O60779|S19A2_HUMAN Thiamine transporter 1 OS=Homo sapiens OX=9606 GN=SLC19A2 PE=1 SV=2	338	AVSTLLGAVAVF
AAVLLILNLCAN	sp|P0C6U2|R1A_CVH22	3310	sp|Q6T4R5|NHS_HUMAN Nance-Horan syndrome protein OS=Homo sapiens OX=9606 GN=NHS PE=1 SV=2	116	AAVLLMLDLCAV
NLAAAGGFVIPL	sp|P0C6U2|R1A_CVH22	1892	sp|Q9C0G0|ZN407_HUMAN Zinc finger protein 407 OS=Homo sapiens OX=9606 GN=ZNF407 PE=1 SV=2	273	NLAARGGFVQIL
SGFLCDHLIAGG	sp|P0C6X1|R1AB_CVH22	6611	sp|Q9BYT1|S17A9_HUMAN Solute carrier family 17 member 9 OS=Homo sapiens OX=9606 GN=SLC17A9 PE=1 SV=2	293	SGFLSDHLINQG
IKKVLYGCDSPD	sp|P0C6X1|R1AB_CVH22	2146	tr|A0A1B0GTW4|A0A1B0GTW4_HUMAN Myocyte-specific enhancer factor 2C (Fragment) OS=Homo sapiens OX=9606 GN=MEF2C PE=1 SV=1	89	RKKGLNGCDSPD
IKKVLYGCDSPD	sp|P0C6X1|R1AB_CVH22	2146	tr|D6RG21|D6RG21_HUMAN Myocyte-specific enhancer factor 2C (Fragment) OS=Homo sapiens OX=9606 GN=MEF2C PE=1 SV=1	89	RKKGLNGCDSPD
IKKVLYGCDSPD	sp|P0C6X1|R1AB_CVH22	2146	tr|D6RCM6|D6RCM6_HUMAN Myocyte-specific enhancer factor 2C (Fragment) OS=Homo sapiens OX=9606 GN=MEF2C PE=1 SV=1	89	RKKGLNGCDSPD
IKKVLYGCDSPD	sp|P0C6X1|R1AB_CVH22	2146	tr|D6RJA7|D6RJA7_HUMAN Myocyte-specific enhancer factor 2C (Fragment) OS=Homo sapiens OX=9606 GN=MEF2C PE=1 SV=2	89	RKKGLNGCDSPD
IKKVLYGCDSPD	sp|P0C6X1|R1AB_CVH22	2146	tr|A0A1B0GV32|A0A1B0GV32_HUMAN Myocyte-specific enhancer factor 2C OS=Homo sapiens OX=9606 GN=MEF2C PE=1 SV=1	89	RKKGLNGCDSPD
IKKVLYGCDSPD	sp|P0C6X1|R1AB_CVH22	2146	tr|A0A0R4J2G5|A0A0R4J2G5_HUMAN Myocyte-specific enhancer factor 2C OS=Homo sapiens OX=9606 GN=MEF2C PE=1 SV=1	89	RKKGLNGCDSPD
IKKVLYGCDSPD	sp|P0C6X1|R1AB_CVH22	2146	sp|Q06413|MEF2C_HUMAN Myocyte-specific enhancer factor 2C OS=Homo sapiens OX=9606 GN=MEF2C PE=1 SV=1	89	RKKGLNGCDSPD
IKKVLYGCDSPD	sp|P0C6X1|R1AB_CVH22	2146	tr|D6RJG6|D6RJG6_HUMAN Myocyte-specific enhancer factor 2C OS=Homo sapiens OX=9606 GN=MEF2C PE=1 SV=1	89	RKKGLNGCDSPD
DAAVHPSVQACV	sp|P0C6U2|R1A_CVH22	642	sp|Q7L5N1|CSN6_HUMAN COP9 signalosome complex subunit 6 OS=Homo sapiens OX=9606 GN=COPS6 PE=1 SV=1	23	DAAVVPSVMACG
KLGSTYDGVLFG	sp|P0C6U2|R1A_CVH22	3136	tr|A0A0A0MSA3|A0A0A0MSA3_HUMAN Melanoma-associated antigen B16 OS=Homo sapiens OX=9606 GN=MAGEB16 PE=1 SV=1	217	KLGLTYDGMLSG
KLGSTYDGVLFG	sp|P0C6U2|R1A_CVH22	3136	sp|A2A368|MAGBG_HUMAN Melanoma-associated antigen B16 OS=Homo sapiens OX=9606 GN=MAGEB16 PE=4 SV=2	185	KLGLTYDGMLSG
GEILLSTTNMGV	sp|P0C6X1|R1AB_CVH22	283	tr|H7C237|H7C237_HUMAN 1-phosphatidylinositol 4,5-bisphosphate phosphodiesterase delta-4 (Fragment) OS=Homo sapiens OX=9606 GN=PLCD4 PE=1 SV=1	33	GEQLLSTTLDGV
GEILLSTTNMGV	sp|P0C6X1|R1AB_CVH22	283	sp|Q9BRC7|PLCD4_HUMAN 1-phosphatidylinositol 4,5-bisphosphate phosphodiesterase delta-4 OS=Homo sapiens OX=9606 GN=PLCD4 PE=1 SV=1	404	GEQLLSTTLDGV
GEILLSTTNMGV	sp|P0C6X1|R1AB_CVH22	283	tr|C9JEA7|C9JEA7_HUMAN Phosphoinositide phospholipase C OS=Homo sapiens OX=9606 GN=PLCD4 PE=1 SV=1	404	GEQLLSTTLDGV
ATNGDVLHFMKT	sp|P0C6U2|R1A_CVH22	424	sp|Q05996|ZP2_HUMAN Zona pellucida sperm-binding protein 2 OS=Homo sapiens OX=9606 GN=ZP2 PE=1 SV=1	308	ATNGMKLHFSKT
IVQVVVFCILLL	sp|P19741|VEMP_CVH22	12	tr|D6RH02|D6RH02_HUMAN Alpha-1,3-mannosyl-glycoprotein 4-beta-N-acetylglucosaminyltransferase-like protein MGAT4D OS=Homo sapiens OX=9606 GN=MGAT4D PE=3 SV=1	232	IKQVLDFCILLL
IVQVVVFCILLL	sp|P19741|VEMP_CVH22	12	sp|A6NG13|MGT4D_HUMAN Alpha-1,3-mannosyl-glycoprotein 4-beta-N-acetylglucosaminyltransferase-like protein MGAT4D OS=Homo sapiens OX=9606 GN=MGAT4D PE=2 SV=3	232	IKQVLDFCILLL
SRLSTAADTVSN	sp|P15423|SPIKE_CVH22	1086	sp|O75886|STAM2_HUMAN Signal transducing adapter molecule 2 OS=Homo sapiens OX=9606 GN=STAM2 PE=1 SV=1	447	SYLSTGQDTVSN
TTGRLEDQGVVV	sp|P0C6U2|R1A_CVH22	1129	sp|O43157|PLXB1_HUMAN Plexin-B1 OS=Homo sapiens OX=9606 GN=PLXNB1 PE=1 SV=3	1188	LTGRLEDIRVVV
ISRSQCPALLGA	sp|P0C6X1|R1AB_CVH22	2566	sp|P51788|CLCN2_HUMAN Chloride channel protein 2 OS=Homo sapiens OX=9606 GN=CLCN2 PE=1 SV=2	627	IERSQVVALLGA
KSGDLEFAFLKT	sp|P0C6U2|R1A_CVH22	3117	sp|Q5TGJ6|HDGL1_HUMAN Hepatoma-derived growth factor-like protein 1 OS=Homo sapiens OX=9606 GN=HDGFL1 PE=2 SV=1	10	KSGDLVFAKLKG
TAQYTTILELQR	sp|P0C6X1|R1AB_CVH22	6697	sp|P07359|GP1BA_HUMAN Platelet glycoprotein Ib alpha chain OS=Homo sapiens OX=9606 GN=GP1BA PE=1 SV=2	573	TATQTTHLELQR
TAQYTTILELQR	sp|P0C6X1|R1AB_CVH22	6697	tr|A0A0C4DGZ8|A0A0C4DGZ8_HUMAN Glycoprotein Ib (Platelet), alpha polypeptide OS=Homo sapiens OX=9606 GN=GP1BA PE=1 SV=1	547	TATQTTHLELQR
NPTIIRSMRHLV	sp|P0C6U2|R1A_CVH22	3660	sp|Q9P0X4|CAC1I_HUMAN Voltage-dependent T-type calcium channel subunit alpha-1I OS=Homo sapiens OX=9606 GN=CACNA1I PE=1 SV=1	1580	NPTIIRIMRVLR
NPTIIRSMRHLV	sp|P0C6U2|R1A_CVH22	3660	tr|H3BUA8|H3BUA8_HUMAN Voltage-dependent T-type calcium channel subunit alpha-1H (Fragment) OS=Homo sapiens OX=9606 GN=CACNA1H PE=1 SV=1	452	NPTIIRIMRVLR
NPTIIRSMRHLV	sp|P0C6U2|R1A_CVH22	3660	tr|H3BMW6|H3BMW6_HUMAN Voltage-dependent T-type calcium channel subunit alpha-1H (Fragment) OS=Homo sapiens OX=9606 GN=CACNA1H PE=1 SV=1	446	NPTIIRIMRVLR
NPTIIRSMRHLV	sp|P0C6U2|R1A_CVH22	3660	sp|O95180|CAC1H_HUMAN Voltage-dependent T-type calcium channel subunit alpha-1H OS=Homo sapiens OX=9606 GN=CACNA1H PE=1 SV=4	1710	NPTIIRIMRVLR
NPTIIRSMRHLV	sp|P0C6U2|R1A_CVH22	3660	tr|H3BNT0|H3BNT0_HUMAN Voltage-dependent T-type calcium channel subunit alpha-1H (Fragment) OS=Homo sapiens OX=9606 GN=CACNA1H PE=1 SV=1	457	NPTIIRIMRVLR
NPTIIRSMRHLV	sp|P0C6U2|R1A_CVH22	3660	tr|A0A1W2PR14|A0A1W2PR14_HUMAN Voltage-dependent T-type calcium channel subunit alpha-1H OS=Homo sapiens OX=9606 GN=CACNA1H PE=1 SV=1	1697	NPTIIRIMRVLR
NPTIIRSMRHLV	sp|P0C6U2|R1A_CVH22	3660	sp|O43497|CAC1G_HUMAN Voltage-dependent T-type calcium channel subunit alpha-1G OS=Homo sapiens OX=9606 GN=CACNA1G PE=1 SV=3	1704	NPTIIRIMRVLR
KGKVDKEVSLTK	sp|P19740|NS4B_CVH22	46	sp|A8K2U0|A2ML1_HUMAN Alpha-2-macroglobulin-like protein 1 OS=Homo sapiens OX=9606 GN=A2ML1 PE=1 SV=3	1088	KGGVDDEVSLTA
KGKVDKEVSLTK	sp|P19740|NS4B_CVH22	46	tr|H0YGG5|H0YGG5_HUMAN Alpha-2-macroglobulin-like protein 1 (Fragment) OS=Homo sapiens OX=9606 GN=A2ML1 PE=1 SV=1	638	KGGVDDEVSLTA
KGKVDKEVSLTK	sp|P19740|NS4B_CVH22	46	sp|Q9UKD2|MRT4_HUMAN mRNA turnover protein 4 homolog OS=Homo sapiens OX=9606 GN=MRTO4 PE=1 SV=2	3	KSKRDKKVSLTK
STCYISTAIVTV	sp|P0C6X1|R1AB_CVH22	1052	sp|Q8N9C0|IGS22_HUMAN Immunoglobulin superfamily member 22 OS=Homo sapiens OX=9606 GN=IGSF22 PE=2 SV=2	498	PTEYYSTAIVTV
SYKLVGLGGPKS	sp|P0C6X1|R1AB_CVH22	3528	sp|P35908|K22E_HUMAN Keratin, type II cytoskeletal 2 epidermal OS=Homo sapiens OX=9606 GN=KRT2 PE=1 SV=2	60	SRSLVGLGGTKS
LKGEAVKSVKSG	sp|P0C6X1|R1AB_CVH22	180	tr|A0A5H1ZRS1|A0A5H1ZRS1_HUMAN Pericentriolar material 1 protein OS=Homo sapiens OX=9606 GN=PCM1 PE=1 SV=1	1439	EKGENVKSVNSG
LKGEAVKSVKSG	sp|P0C6X1|R1AB_CVH22	180	tr|A0A4W8VX11|A0A4W8VX11_HUMAN Pericentriolar material 1 protein OS=Homo sapiens OX=9606 GN=PCM1 PE=4 SV=1	1385	EKGENVKSVNSG
LKGEAVKSVKSG	sp|P0C6X1|R1AB_CVH22	180	tr|H0YBA1|H0YBA1_HUMAN Pericentriolar material 1 protein (Fragment) OS=Homo sapiens OX=9606 GN=PCM1 PE=1 SV=1	179	EKGENVKSVNSG
LKGEAVKSVKSG	sp|P0C6X1|R1AB_CVH22	180	sp|Q15154|PCM1_HUMAN Pericentriolar material 1 protein OS=Homo sapiens OX=9606 GN=PCM1 PE=1 SV=5	1439	EKGENVKSVNSG
TAVVQHNLNILI	sp|P0C6X1|R1AB_CVH22	4641	tr|A0A1W2PP70|A0A1W2PP70_HUMAN HLA class II histocompatibility antigen, DQ alpha 1 chain OS=Homo sapiens OX=9606 GN=HLA-DQA1 PE=1 SV=1	71	IAVLKHNLNILI
TAVVQHNLNILI	sp|P0C6X1|R1AB_CVH22	4641	tr|Q08AS3|Q08AS3_HUMAN HLA class II histocompatibility antigen DQ alpha chain OS=Homo sapiens OX=9606 GN=HLA-DQA1 PE=1 SV=1	88	IAVLKHNLNILI
FLATAITSVGVF	sp|P0C6X1|R1AB_CVH22	2100	sp|Q9UBL9|P2RX2_HUMAN P2X purinoceptor 2 OS=Homo sapiens OX=9606 GN=P2RX2 PE=1 SV=1	344	NLATALTSVGVG
LGDVDVFIAYVY	sp|P0C6U2|R1A_CVH22	1731	sp|Q9HAV4|XPO5_HUMAN Exportin-5 OS=Homo sapiens OX=9606 GN=XPO5 PE=1 SV=1	689	LSDVDAFIAYVG
NPDLSREIGNLT	sp|P0C6U2|R1A_CVH22	2215	tr|C9JYJ6|C9JYJ6_HUMAN Filamin A-interacting protein 1-like (Fragment) OS=Homo sapiens OX=9606 GN=FILIP1L PE=1 SV=1	517	NRDLGREIENLT
NPDLSREIGNLT	sp|P0C6U2|R1A_CVH22	2215	sp|Q4L180|FIL1L_HUMAN Filamin A-interacting protein 1-like OS=Homo sapiens OX=9606 GN=FILIP1L PE=1 SV=2	757	NRDLGREIENLT
MSSGDLIKFLKT	sp|P0C6X1|R1AB_CVH22	424	sp|Q8IV33|K0825_HUMAN Uncharacterized protein KIAA0825 OS=Homo sapiens OX=9606 GN=KIAA0825 PE=1 SV=3	88	ISHGDLIKFFKT
IKLVKSIESTCY	sp|P0C6X1|R1AB_CVH22	1044	sp|A0AVK6|E2F8_HUMAN Transcription factor E2F8 OS=Homo sapiens OX=9606 GN=E2F8 PE=1 SV=1	398	IKLVKSIESDRR
DCDLYKELAVLS	sp|P0C6X1|R1AB_CVH22	4200	tr|A0A0G2JPK4|A0A0G2JPK4_HUMAN Putative alpha-1-antitrypsin-related protein OS=Homo sapiens OX=9606 GN=SERPINA2 PE=1 SV=1	61	AFDLYKELADLS
DCDLYKELAVLS	sp|P0C6X1|R1AB_CVH22	4200	tr|A0A0U1RQB8|A0A0U1RQB8_HUMAN Putative alpha-1-antitrypsin-related protein OS=Homo sapiens OX=9606 GN=SERPINA2 PE=1 SV=1	61	AFDLYKELADLS
QGSAVGGLVIGG	sp|P15423|SPIKE_CVH22	749	sp|Q6NV75|GP153_HUMAN Probable G-protein coupled receptor 153 OS=Homo sapiens OX=9606 GN=GPR153 PE=2 SV=2	8	PGSAVGWLVCGG
GSAVGGLVIGGL	sp|P15423|SPIKE_CVH22	750	sp|Q6NV75|GP153_HUMAN Probable G-protein coupled receptor 153 OS=Homo sapiens OX=9606 GN=GPR153 PE=2 SV=2	9	GSAVGWLVCGGL
EELTGVRMLRSL	sp|P0C6U2|R1A_CVH22	1039	sp|Q96D09|GASP2_HUMAN G-protein coupled receptor-associated sorting protein 2 OS=Homo sapiens OX=9606 GN=GPRASP2 PE=1 SV=1	695	EQLTGIRMLRHL
PTGTVIKFDLGT	sp|P0C6U2|R1A_CVH22	1523	tr|Q5T1U7|Q5T1U7_HUMAN Collagen alpha-1(XXVII) chain (Fragment) OS=Homo sapiens OX=9606 GN=COL27A1 PE=1 SV=1	32	PTGTVIPAALGT
PTGTVIKFDLGT	sp|P0C6U2|R1A_CVH22	1523	sp|Q8IZC6|CORA1_HUMAN Collagen alpha-1(XXVII) chain OS=Homo sapiens OX=9606 GN=COL27A1 PE=2 SV=1	85	PTGTVIPAALGT
SKRGRLVALAYR	sp|P19739|NS4A_CVH22	64	sp|P33897|ABCD1_HUMAN ATP-binding cassette sub-family D member 1 OS=Homo sapiens OX=9606 GN=ABCD1 PE=1 SV=2	161	SFRSRLVAHAYR
LSFLASVQENTM	sp|P0C6U2|R1A_CVH22	2458	sp|Q8NEC5|CTSR1_HUMAN Cation channel sperm-associated protein 1 OS=Homo sapiens OX=9606 GN=CATSPER1 PE=1 SV=3	563	LSFLTSVQEVTG
LTVAAIFVVSLV	sp|P15423|SPIKE_CVH22	1122	sp|Q8N4A0|GALT4_HUMAN Polypeptide N-acetylgalactosaminyltransferase 4 OS=Homo sapiens OX=9606 GN=GALNT4 PE=1 SV=2	18	LTVAYIFVELLV
DSVSVESSAEKV	sp|P15423|SPIKE_CVH22	870	tr|A0A2R8Y5K2|A0A2R8Y5K2_HUMAN Guanine nucleotide exchange C9orf72 OS=Homo sapiens OX=9606 GN=C9orf72 PE=1 SV=1	233	CSVVVGSSAEKV
DSVSVESSAEKV	sp|P15423|SPIKE_CVH22	870	sp|Q96LT7|CI072_HUMAN Guanine nucleotide exchange C9orf72 OS=Homo sapiens OX=9606 GN=C9orf72 PE=1 SV=2	233	CSVVVGSSAEKV
DSVSVESSAEKV	sp|P15423|SPIKE_CVH22	870	tr|A0A5F9ZHW7|A0A5F9ZHW7_HUMAN Guanine nucleotide exchange C9orf72 OS=Homo sapiens OX=9606 GN=C9orf72 PE=1 SV=1	233	CSVVVGSSAEKV
DSVSVESSAEKV	sp|P15423|SPIKE_CVH22	870	tr|A0A2R8Y5U5|A0A2R8Y5U5_HUMAN Guanine nucleotide exchange C9orf72 OS=Homo sapiens OX=9606 GN=C9orf72 PE=1 SV=1	233	CSVVVGSSAEKV
FNSSWTVIVING	sp|P0C6U2|R1A_CVH22	2742	tr|H0YBE3|H0YBE3_HUMAN Protein FAM184A (Fragment) OS=Homo sapiens OX=9606 GN=FAM184A PE=1 SV=1	11	FNSSPTVGVINP
FNSSWTVIVING	sp|P0C6U2|R1A_CVH22	2742	tr|H0YBA5|H0YBA5_HUMAN Protein FAM184A OS=Homo sapiens OX=9606 GN=FAM184A PE=1 SV=2	912	FNSSPTVGVINP
FNSSWTVIVING	sp|P0C6U2|R1A_CVH22	2742	tr|A0A0C4DGZ2|A0A0C4DGZ2_HUMAN Protein FAM184A OS=Homo sapiens OX=9606 GN=FAM184A PE=1 SV=1	184	FNSSPTVGVINP
FNSSWTVIVING	sp|P0C6U2|R1A_CVH22	2742	sp|Q8NB25|F184A_HUMAN Protein FAM184A OS=Homo sapiens OX=9606 GN=FAM184A PE=1 SV=3	1032	FNSSPTVGVINP
FNSSWTVIVING	sp|P0C6U2|R1A_CVH22	2742	tr|A0A087X2A7|A0A087X2A7_HUMAN Protein FAM184A OS=Homo sapiens OX=9606 GN=FAM184A PE=1 SV=1	990	FNSSPTVGVINP
FNSSWTVIVING	sp|P0C6U2|R1A_CVH22	2742	tr|H0YBZ6|H0YBZ6_HUMAN Protein FAM184A (Fragment) OS=Homo sapiens OX=9606 GN=FAM184A PE=1 SV=1	18	FNSSPTVGVINP
FNSSWTVIVING	sp|P0C6U2|R1A_CVH22	2742	tr|B9DI78|B9DI78_HUMAN Protein FAM184A (Fragment) OS=Homo sapiens OX=9606 GN=FAM184A PE=1 SV=1	93	FNSSPTVGVINP
VSVESSAEKVLT	sp|P15423|SPIKE_CVH22	872	tr|E9PNL5|E9PNL5_HUMAN Cathepsin B (Fragment) OS=Homo sapiens OX=9606 GN=CTSB PE=1 SV=1	129	VSVEVSAEDLLT
VSVESSAEKVLT	sp|P15423|SPIKE_CVH22	872	tr|E9PHZ5|E9PHZ5_HUMAN Cathepsin B (Fragment) OS=Homo sapiens OX=9606 GN=CTSB PE=1 SV=8	129	VSVEVSAEDLLT
