query	query_seqname	query_start	target_seqname	target_start	target
NLLGQDFTTCLD	tr|A9LXW2|A9LXW2_BUNSH	472	sp|Q17R55|F187B_HUMAN Protein FAM187B OS=Homo sapiens OX=9606 GN=FAM187B PE=2 SV=2	257	QLSGQDFTTFLD
HVTTENSTRFEV	tr|A9LXW2|A9LXW2_BUNSH	123	sp|Q76L83|ASXL2_HUMAN Putative Polycomb group protein ASXL2 OS=Homo sapiens OX=9606 GN=ASXL2 PE=1 SV=1	996	TNTTENSTREEV
HVTTENSTRFEV	tr|A9LXW2|A9LXW2_BUNSH	123	tr|E7EWD6|E7EWD6_HUMAN Putative Polycomb group protein ASXL2 OS=Homo sapiens OX=9606 GN=ASXL2 PE=1 SV=1	968	TNTTENSTREEV
TIPEDLVELIIK	tr|A9LXW2|A9LXW2_BUNSH	342	sp|Q6KC79|NIPBL_HUMAN Nipped-B-like protein OS=Homo sapiens OX=9606 GN=NIPBL PE=1 SV=2	2068	TIEEDLMKLIIK
TIPEDLVELIIK	tr|A9LXW2|A9LXW2_BUNSH	342	tr|A0A590UJS4|A0A590UJS4_HUMAN Nipped-B protein OS=Homo sapiens OX=9606 GN=NIPBL PE=1 SV=1	2068	TIEEDLMKLIIK
KTPGQSQNASYK	tr|A8WA74|A8WA74_BUNSH	312	tr|C9J5L1|C9J5L1_HUMAN U2 snRNP-associated SURP motif-containing protein (Fragment) OS=Homo sapiens OX=9606 GN=U2SURP PE=1 SV=1	4	KTPGGSQKASSK
KTPGQSQNASYK	tr|A8WA74|A8WA74_BUNSH	312	tr|E7EW00|E7EW00_HUMAN U2 snRNP-associated SURP motif-containing protein OS=Homo sapiens OX=9606 GN=U2SURP PE=1 SV=1	4	KTPGGSQKASSK
KTPGQSQNASYK	tr|A8WA74|A8WA74_BUNSH	312	sp|O15042|SR140_HUMAN U2 snRNP-associated SURP motif-containing protein OS=Homo sapiens OX=9606 GN=U2SURP PE=1 SV=2	4	KTPGGSQKASSK
KTPGQSQNASYK	tr|A8WA74|A8WA74_BUNSH	312	tr|H0Y8D9|H0Y8D9_HUMAN U2 snRNP-associated SURP motif-containing protein (Fragment) OS=Homo sapiens OX=9606 GN=U2SURP PE=1 SV=1	6	KTPGGSQKASSK
KTPGQSQNASYK	tr|A8WA74|A8WA74_BUNSH	312	tr|E7ET15|E7ET15_HUMAN U2 snRNP-associated SURP motif-containing protein OS=Homo sapiens OX=9606 GN=U2SURP PE=1 SV=1	4	KTPGGSQKASSK
AILLGVIIGLIY	tr|A9LXW2|A9LXW2_BUNSH	371	sp|O75379|VAMP4_HUMAN Vesicle-associated membrane protein 4 OS=Homo sapiens OX=9606 GN=VAMP4 PE=1 SV=2	125	AILLLVIIILIV
HGPINAITLVNL	tr|A9LXW2|A9LXW2_BUNSH	305	sp|Q16602|CALRL_HUMAN Calcitonin gene-related peptide type 1 receptor OS=Homo sapiens OX=9606 GN=CALCRL PE=1 SV=2	295	HGPICAALLVNL
TSKLKDKYPGTA	tr|A9LXW2|A9LXW2_BUNSH	674	tr|C9J2I3|C9J2I3_HUMAN Homeobox protein Hox-B3 (Fragment) OS=Homo sapiens OX=9606 GN=HOXB3 PE=4 SV=1	66	TSKLKNNSPGTA
TSKLKDKYPGTA	tr|A9LXW2|A9LXW2_BUNSH	674	sp|P14651|HXB3_HUMAN Homeobox protein Hox-B3 OS=Homo sapiens OX=9606 GN=HOXB3 PE=2 SV=2	139	TSKLKNNSPGTA
RARGLKLEASVE	tr|A8WA74|A8WA74_BUNSH	1049	sp|P02549|SPTA1_HUMAN Spectrin alpha chain, erythrocytic 1 OS=Homo sapiens OX=9606 GN=SPTA1 PE=1 SV=5	1809	KARGLKLEESLE
RARGLKLEASVE	tr|A8WA74|A8WA74_BUNSH	1049	tr|K7EJY2|K7EJY2_HUMAN Ankyrin repeat and SAM domain-containing protein 3 (Fragment) OS=Homo sapiens OX=9606 GN=ANKS3 PE=1 SV=1	153	RAQGLSSEASVE
RARGLKLEASVE	tr|A8WA74|A8WA74_BUNSH	1049	tr|K7ELU8|K7ELU8_HUMAN Ankyrin repeat and SAM domain-containing protein 3 (Fragment) OS=Homo sapiens OX=9606 GN=ANKS3 PE=1 SV=1	252	RAQGLSSEASVE
RARGLKLEASVE	tr|A8WA74|A8WA74_BUNSH	1049	tr|K7ERF3|K7ERF3_HUMAN Ankyrin repeat and SAM domain-containing protein 3 (Fragment) OS=Homo sapiens OX=9606 GN=ANKS3 PE=1 SV=1	186	RAQGLSSEASVE
RARGLKLEASVE	tr|A8WA74|A8WA74_BUNSH	1049	tr|D3DUE4|D3DUE4_HUMAN Ankyrin repeat and SAM domain-containing protein 3 OS=Homo sapiens OX=9606 GN=ANKS3 PE=1 SV=1	230	RAQGLSSEASVE
RARGLKLEASVE	tr|A8WA74|A8WA74_BUNSH	1049	sp|Q6ZW76|ANKS3_HUMAN Ankyrin repeat and SAM domain-containing protein 3 OS=Homo sapiens OX=9606 GN=ANKS3 PE=1 SV=1	359	RAQGLSSEASVE
RARGLKLEASVE	tr|A8WA74|A8WA74_BUNSH	1049	tr|F6WF08|F6WF08_HUMAN Ankyrin repeat and SAM domain-containing protein 3 OS=Homo sapiens OX=9606 GN=ANKS3 PE=1 SV=1	252	RAQGLSSEASVE
ELHKILYERFGE	tr|A8WA74|A8WA74_BUNSH	163	sp|Q9HAC7|SUCHY_HUMAN Succinate--hydroxymethylglutarate CoA-transferase OS=Homo sapiens OX=9606 GN=SUGCT PE=1 SV=2	328	ELIKILSERFEE
ELHKILYERFGE	tr|A8WA74|A8WA74_BUNSH	163	tr|H0Y4N1|H0Y4N1_HUMAN Succinate--hydroxymethylglutarate CoA-transferase OS=Homo sapiens OX=9606 GN=SUGCT PE=1 SV=2	321	ELIKILSERFEE
ISLEGSDSADGA	tr|A9LXW2|A9LXW2_BUNSH	965	sp|Q08499|PDE4D_HUMAN cAMP-specific 3',5'-cyclic phosphodiesterase 4D OS=Homo sapiens OX=9606 GN=PDE4D PE=1 SV=2	13	GSGEGSDSAGGA
AKTSAAQPLADN	tr|A9YU75|A9YU75_BUNSH	119	sp|P34910|EVI2B_HUMAN Protein EVI2B OS=Homo sapiens OX=9606 GN=EVI2B PE=1 SV=2	94	AHTSAGQPLAYN
LGAESGSLFFLM	tr|A8WA74|A8WA74_BUNSH	1347	sp|Q86V15|CASZ1_HUMAN Zinc finger protein castor homolog 1 OS=Homo sapiens OX=9606 GN=CASZ1 PE=1 SV=4	1622	LGAEPGSLLFLQ
VTTENSTRFEVA	tr|A9LXW2|A9LXW2_BUNSH	124	sp|Q76L83|ASXL2_HUMAN Putative Polycomb group protein ASXL2 OS=Homo sapiens OX=9606 GN=ASXL2 PE=1 SV=1	997	NTTENSTREEVN
VTTENSTRFEVA	tr|A9LXW2|A9LXW2_BUNSH	124	tr|E7EWD6|E7EWD6_HUMAN Putative Polycomb group protein ASXL2 OS=Homo sapiens OX=9606 GN=ASXL2 PE=1 SV=1	969	NTTENSTREEVN
NQRAELNLAIAD	tr|A9LXW2|A9LXW2_BUNSH	1335	tr|I3L495|I3L495_HUMAN Platelet-activating factor acetylhydrolase IB subunit beta (Fragment) OS=Homo sapiens OX=9606 GN=PAFAH1B1 PE=1 SV=1	6	RQRDELNRAIAD
NQRAELNLAIAD	tr|A9LXW2|A9LXW2_BUNSH	1335	tr|A0A6Q8PG63|A0A6Q8PG63_HUMAN Platelet-activating factor acetylhydrolase IB subunit beta OS=Homo sapiens OX=9606 GN=PAFAH1B1 PE=1 SV=1	6	RQRDELNRAIAD
NQRAELNLAIAD	tr|A9LXW2|A9LXW2_BUNSH	1335	sp|P43034|LIS1_HUMAN Platelet-activating factor acetylhydrolase IB subunit beta OS=Homo sapiens OX=9606 GN=PAFAH1B1 PE=1 SV=2	6	RQRDELNRAIAD
TPKFGEYSLDVL	tr|A9YU75|A9YU75_BUNSH	62	tr|G3V2Y4|G3V2Y4_HUMAN Glycine hydroxymethyltransferase (Fragment) OS=Homo sapiens OX=9606 GN=SHMT2 PE=1 SV=1	183	TPMFREYSLQVL
TPKFGEYSLDVL	tr|A9YU75|A9YU75_BUNSH	62	sp|P34897|GLYM_HUMAN Serine hydroxymethyltransferase, mitochondrial OS=Homo sapiens OX=9606 GN=SHMT2 PE=1 SV=3	344	TPMFREYSLQVL
TPKFGEYSLDVL	tr|A9YU75|A9YU75_BUNSH	62	tr|H0YIZ0|H0YIZ0_HUMAN Glycine hydroxymethyltransferase (Fragment) OS=Homo sapiens OX=9606 GN=SHMT2 PE=1 SV=1	144	TPMFREYSLQVL
KTSAAQPLADNT	tr|A9YU75|A9YU75_BUNSH	120	sp|P34910|EVI2B_HUMAN Protein EVI2B OS=Homo sapiens OX=9606 GN=EVI2B PE=1 SV=2	95	HTSAGQPLAYNT
TTENSTRFEVAG	tr|A9LXW2|A9LXW2_BUNSH	125	sp|Q76L83|ASXL2_HUMAN Putative Polycomb group protein ASXL2 OS=Homo sapiens OX=9606 GN=ASXL2 PE=1 SV=1	998	TTENSTREEVNE
TTENSTRFEVAG	tr|A9LXW2|A9LXW2_BUNSH	125	tr|E7EWD6|E7EWD6_HUMAN Putative Polycomb group protein ASXL2 OS=Homo sapiens OX=9606 GN=ASXL2 PE=1 SV=1	970	TTENSTREEVNE
THKLDIGVANIS	tr|A8WA74|A8WA74_BUNSH	1853	sp|Q5VUA4|ZN318_HUMAN Zinc finger protein 318 OS=Homo sapiens OX=9606 GN=ZNF318 PE=1 SV=2	598	TIGLDIGVAEIS
LPTRLPSLSKGS	tr|A9LXW2|A9LXW2_BUNSH	720	sp|Q2TAK8|PWP3A_HUMAN PWWP domain-containing DNA repair factor 3A OS=Homo sapiens OX=9606 GN=PWWP3A PE=1 SV=3	529	LGTKLPQLSKGS
LPTRLPSLSKGS	tr|A9LXW2|A9LXW2_BUNSH	720	tr|J3KNX4|J3KNX4_HUMAN PWWP domain-containing DNA repair factor 3A OS=Homo sapiens OX=9606 GN=PWWP3A PE=1 SV=1	530	LGTKLPQLSKGS
LPTRLPSLSKGS	tr|A9LXW2|A9LXW2_BUNSH	720	tr|A0A0D9SGJ8|A0A0D9SGJ8_HUMAN PWWP domain-containing DNA repair factor 3A OS=Homo sapiens OX=9606 GN=PWWP3A PE=1 SV=1	530	LGTKLPQLSKGS
VVILLIVYIILP	tr|A9LXW2|A9LXW2_BUNSH	1407	sp|Q7Z3D4|LYSM3_HUMAN LysM and putative peptidoglycan-binding domain-containing protein 3 OS=Homo sapiens OX=9606 GN=LYSMD3 PE=1 SV=2	222	VVIMLIVGIITP
NYGVIKEIAPSF	tr|A8WA74|A8WA74_BUNSH	892	sp|Q96MT7|CFA44_HUMAN Cilia- and flagella-associated protein 44 OS=Homo sapiens OX=9606 GN=CFAP44 PE=1 SV=2	857	NYGCIKSIANSF
QNLEISQEELNI	tr|A8WA74|A8WA74_BUNSH	1561	tr|A0A0A0MSD9|A0A0A0MSD9_HUMAN Potassium voltage-gated channel subfamily KQT member 5 OS=Homo sapiens OX=9606 GN=KCNQ5 PE=1 SV=1	843	QNLIRSTEELNI
QNLEISQEELNI	tr|A8WA74|A8WA74_BUNSH	1561	sp|Q9NR82|KCNQ5_HUMAN Potassium voltage-gated channel subfamily KQT member 5 OS=Homo sapiens OX=9606 GN=KCNQ5 PE=1 SV=3	833	QNLIRSTEELNI
QNLEISQEELNI	tr|A8WA74|A8WA74_BUNSH	1561	tr|A0A0A0MRC8|A0A0A0MRC8_HUMAN Potassium voltage-gated channel subfamily KQT member 5 OS=Homo sapiens OX=9606 GN=KCNQ5 PE=1 SV=1	852	QNLIRSTEELNI
QNLEISQEELNI	tr|A8WA74|A8WA74_BUNSH	1561	tr|A0A0A0MSC0|A0A0A0MSC0_HUMAN Potassium voltage-gated channel subfamily KQT member 5 OS=Homo sapiens OX=9606 GN=KCNQ5 PE=1 SV=1	824	QNLIRSTEELNI
QNLEISQEELNI	tr|A8WA74|A8WA74_BUNSH	1561	tr|F8WEA4|F8WEA4_HUMAN Potassium voltage-gated channel subfamily KQT member 5 OS=Homo sapiens OX=9606 GN=KCNQ5 PE=1 SV=1	833	QNLIRSTEELNI
QNLEISQEELNI	tr|A8WA74|A8WA74_BUNSH	1561	tr|A0A0A0MT07|A0A0A0MT07_HUMAN Potassium voltage-gated channel subfamily KQT member 5 OS=Homo sapiens OX=9606 GN=KCNQ5 PE=1 SV=1	723	QNLIRSTEELNI
GAILLGVIIGLI	tr|A9LXW2|A9LXW2_BUNSH	370	sp|O75379|VAMP4_HUMAN Vesicle-associated membrane protein 4 OS=Homo sapiens OX=9606 GN=VAMP4 PE=1 SV=2	124	AAILLLVIIILI
DLNDVLKTNDML	tr|A8WA74|A8WA74_BUNSH	2032	sp|Q8IZ73|RUSD2_HUMAN RNA pseudouridylate synthase domain-containing protein 2 OS=Homo sapiens OX=9606 GN=RPUSD2 PE=1 SV=2	196	DLNIVLKDNDFL
QKHDPYANLMTN	tr|A9LXW2|A9LXW2_BUNSH	505	sp|C9JE40|PATL2_HUMAN Protein PAT1 homolog 2 OS=Homo sapiens OX=9606 GN=PATL2 PE=1 SV=1	181	QQPDPYANLMTR
YSSEAITQLTTN	tr|A8WA74|A8WA74_BUNSH	1120	tr|E7EPM4|E7EPM4_HUMAN Mucin-17 OS=Homo sapiens OX=9606 GN=MUC17 PE=1 SV=1	229	ASSEAITLLTTP
YSSEAITQLTTN	tr|A8WA74|A8WA74_BUNSH	1120	sp|Q685J3|MUC17_HUMAN Mucin-17 OS=Homo sapiens OX=9606 GN=MUC17 PE=1 SV=2	229	ASSEAITLLTTP
PIDLAIVKIEPA	tr|A8WA74|A8WA74_BUNSH	123	tr|A0A1W2PQ39|A0A1W2PQ39_HUMAN BK channel (Fragment) OS=Homo sapiens OX=9606 GN=KCNMA1 PE=1 SV=1	413	PHDLARVKIESA
PIDLAIVKIEPA	tr|A8WA74|A8WA74_BUNSH	123	tr|H0Y379|H0Y379_HUMAN BK channel (Fragment) OS=Homo sapiens OX=9606 GN=KCNMA1 PE=1 SV=2	408	PHDLARVKIESA
PIDLAIVKIEPA	tr|A8WA74|A8WA74_BUNSH	123	tr|A0A1W2PQ93|A0A1W2PQ93_HUMAN BK channel (Fragment) OS=Homo sapiens OX=9606 GN=KCNMA1 PE=1 SV=1	517	PHDLARVKIESA
PIDLAIVKIEPA	tr|A8WA74|A8WA74_BUNSH	123	tr|A0A1W2PQK5|A0A1W2PQK5_HUMAN BK channel OS=Homo sapiens OX=9606 GN=KCNMA1 PE=1 SV=1	473	PHDLARVKIESA
PIDLAIVKIEPA	tr|A8WA74|A8WA74_BUNSH	123	tr|A0A1W2PNQ3|A0A1W2PNQ3_HUMAN BK channel OS=Homo sapiens OX=9606 GN=KCNMA1 PE=1 SV=1	473	PHDLARVKIESA
PIDLAIVKIEPA	tr|A8WA74|A8WA74_BUNSH	123	tr|A0A1W2PQU4|A0A1W2PQU4_HUMAN BK channel OS=Homo sapiens OX=9606 GN=KCNMA1 PE=1 SV=1	473	PHDLARVKIESA
PIDLAIVKIEPA	tr|A8WA74|A8WA74_BUNSH	123	tr|A0A1W2PNW6|A0A1W2PNW6_HUMAN BK channel OS=Homo sapiens OX=9606 GN=KCNMA1 PE=1 SV=1	473	PHDLARVKIESA
PIDLAIVKIEPA	tr|A8WA74|A8WA74_BUNSH	123	tr|A0A1W2PPY5|A0A1W2PPY5_HUMAN BK channel OS=Homo sapiens OX=9606 GN=KCNMA1 PE=1 SV=1	473	PHDLARVKIESA
PIDLAIVKIEPA	tr|A8WA74|A8WA74_BUNSH	123	tr|A0A1W2PSD3|A0A1W2PSD3_HUMAN BK channel OS=Homo sapiens OX=9606 GN=KCNMA1 PE=1 SV=1	473	PHDLARVKIESA
PIDLAIVKIEPA	tr|A8WA74|A8WA74_BUNSH	123	tr|A0A1W2PS97|A0A1W2PS97_HUMAN BK channel (Fragment) OS=Homo sapiens OX=9606 GN=KCNMA1 PE=1 SV=1	408	PHDLARVKIESA
PIDLAIVKIEPA	tr|A8WA74|A8WA74_BUNSH	123	tr|B7ZMF5|B7ZMF5_HUMAN BK channel OS=Homo sapiens OX=9606 GN=KCNMA1 PE=1 SV=1	473	PHDLARVKIESA
PIDLAIVKIEPA	tr|A8WA74|A8WA74_BUNSH	123	tr|J3KQ16|J3KQ16_HUMAN BK channel OS=Homo sapiens OX=9606 GN=KCNMA1 PE=1 SV=2	305	PHDLARVKIESA
PIDLAIVKIEPA	tr|A8WA74|A8WA74_BUNSH	123	tr|A0A1W2PRX6|A0A1W2PRX6_HUMAN BK channel (Fragment) OS=Homo sapiens OX=9606 GN=KCNMA1 PE=1 SV=1	408	PHDLARVKIESA
PIDLAIVKIEPA	tr|A8WA74|A8WA74_BUNSH	123	tr|Q5SVK0|Q5SVK0_HUMAN BK channel (Fragment) OS=Homo sapiens OX=9606 GN=KCNMA1 PE=1 SV=2	408	PHDLARVKIESA
PIDLAIVKIEPA	tr|A8WA74|A8WA74_BUNSH	123	tr|A0A1W2PRG5|A0A1W2PRG5_HUMAN BK channel OS=Homo sapiens OX=9606 GN=KCNMA1 PE=1 SV=1	473	PHDLARVKIESA
PIDLAIVKIEPA	tr|A8WA74|A8WA74_BUNSH	123	tr|A0A1W2PP94|A0A1W2PP94_HUMAN BK channel OS=Homo sapiens OX=9606 GN=KCNMA1 PE=1 SV=1	473	PHDLARVKIESA
PIDLAIVKIEPA	tr|A8WA74|A8WA74_BUNSH	123	tr|A0A1W2PQ53|A0A1W2PQ53_HUMAN BK channel (Fragment) OS=Homo sapiens OX=9606 GN=KCNMA1 PE=1 SV=1	354	PHDLARVKIESA
PIDLAIVKIEPA	tr|A8WA74|A8WA74_BUNSH	123	tr|A0A1W2PRE5|A0A1W2PRE5_HUMAN BK channel (Fragment) OS=Homo sapiens OX=9606 GN=KCNMA1 PE=1 SV=1	424	PHDLARVKIESA
PIDLAIVKIEPA	tr|A8WA74|A8WA74_BUNSH	123	tr|A0A0A0MRR0|A0A0A0MRR0_HUMAN BK channel OS=Homo sapiens OX=9606 GN=KCNMA1 PE=1 SV=2	473	PHDLARVKIESA
PIDLAIVKIEPA	tr|A8WA74|A8WA74_BUNSH	123	tr|A0A1W2PNY9|A0A1W2PNY9_HUMAN BK channel OS=Homo sapiens OX=9606 GN=KCNMA1 PE=1 SV=1	473	PHDLARVKIESA
PIDLAIVKIEPA	tr|A8WA74|A8WA74_BUNSH	123	tr|A0A1W2PRJ1|A0A1W2PRJ1_HUMAN BK channel (Fragment) OS=Homo sapiens OX=9606 GN=KCNMA1 PE=1 SV=1	259	PHDLARVKIESA
PIDLAIVKIEPA	tr|A8WA74|A8WA74_BUNSH	123	tr|A0A1W2PNH9|A0A1W2PNH9_HUMAN BK channel OS=Homo sapiens OX=9606 GN=KCNMA1 PE=1 SV=1	473	PHDLARVKIESA
PIDLAIVKIEPA	tr|A8WA74|A8WA74_BUNSH	123	tr|A0A1W2PNY7|A0A1W2PNY7_HUMAN BK channel (Fragment) OS=Homo sapiens OX=9606 GN=KCNMA1 PE=1 SV=1	449	PHDLARVKIESA
PIDLAIVKIEPA	tr|A8WA74|A8WA74_BUNSH	123	tr|A0A1W2PRV4|A0A1W2PRV4_HUMAN BK channel OS=Homo sapiens OX=9606 GN=KCNMA1 PE=1 SV=1	473	PHDLARVKIESA
PIDLAIVKIEPA	tr|A8WA74|A8WA74_BUNSH	123	tr|A0A0A0MSE6|A0A0A0MSE6_HUMAN BK channel (Fragment) OS=Homo sapiens OX=9606 GN=KCNMA1 PE=1 SV=2	408	PHDLARVKIESA
PIDLAIVKIEPA	tr|A8WA74|A8WA74_BUNSH	123	tr|Q5SVJ9|Q5SVJ9_HUMAN BK channel OS=Homo sapiens OX=9606 GN=KCNMA1 PE=1 SV=2	473	PHDLARVKIESA
PIDLAIVKIEPA	tr|A8WA74|A8WA74_BUNSH	123	sp|Q12791|KCMA1_HUMAN Calcium-activated potassium channel subunit alpha-1 OS=Homo sapiens OX=9606 GN=KCNMA1 PE=1 SV=2	473	PHDLARVKIESA
PIDLAIVKIEPA	tr|A8WA74|A8WA74_BUNSH	123	tr|Q5SVJ8|Q5SVJ8_HUMAN BK channel OS=Homo sapiens OX=9606 GN=KCNMA1 PE=1 SV=2	473	PHDLARVKIESA
PIDLAIVKIEPA	tr|A8WA74|A8WA74_BUNSH	123	tr|A0A1W2PR62|A0A1W2PR62_HUMAN BK channel OS=Homo sapiens OX=9606 GN=KCNMA1 PE=1 SV=1	473	PHDLARVKIESA
PIDLAIVKIEPA	tr|A8WA74|A8WA74_BUNSH	123	tr|A0A0A0MRC3|A0A0A0MRC3_HUMAN BK channel OS=Homo sapiens OX=9606 GN=KCNMA1 PE=1 SV=1	305	PHDLARVKIESA
PIDLAIVKIEPA	tr|A8WA74|A8WA74_BUNSH	123	tr|H0Y382|H0Y382_HUMAN BK channel (Fragment) OS=Homo sapiens OX=9606 GN=KCNMA1 PE=1 SV=3	447	PHDLARVKIESA
PIDLAIVKIEPA	tr|A8WA74|A8WA74_BUNSH	123	tr|Q5SVJ7|Q5SVJ7_HUMAN BK channel OS=Homo sapiens OX=9606 GN=KCNMA1 PE=1 SV=2	473	PHDLARVKIESA
PIDLAIVKIEPA	tr|A8WA74|A8WA74_BUNSH	123	tr|A0A1W2PQ61|A0A1W2PQ61_HUMAN BK channel OS=Homo sapiens OX=9606 GN=KCNMA1 PE=1 SV=1	473	PHDLARVKIESA
PIDLAIVKIEPA	tr|A8WA74|A8WA74_BUNSH	123	tr|A0A1W2PQA0|A0A1W2PQA0_HUMAN BK channel OS=Homo sapiens OX=9606 GN=KCNMA1 PE=1 SV=1	473	PHDLARVKIESA
PIDLAIVKIEPA	tr|A8WA74|A8WA74_BUNSH	123	tr|A0A1W2PRB0|A0A1W2PRB0_HUMAN BK channel OS=Homo sapiens OX=9606 GN=KCNMA1 PE=1 SV=1	473	PHDLARVKIESA
PIDLAIVKIEPA	tr|A8WA74|A8WA74_BUNSH	123	tr|S4R2X4|S4R2X4_HUMAN BK channel (Fragment) OS=Homo sapiens OX=9606 GN=KCNMA1 PE=1 SV=2	334	PHDLARVKIESA
PIDLAIVKIEPA	tr|A8WA74|A8WA74_BUNSH	123	tr|D5MRH1|D5MRH1_HUMAN BK channel OS=Homo sapiens OX=9606 GN=KCNMA1 PE=1 SV=1	419	PHDLARVKIESA
PIDLAIVKIEPA	tr|A8WA74|A8WA74_BUNSH	123	tr|A0A1W2PP26|A0A1W2PP26_HUMAN BK channel (Fragment) OS=Homo sapiens OX=9606 GN=KCNMA1 PE=1 SV=1	449	PHDLARVKIESA
PIDLAIVKIEPA	tr|A8WA74|A8WA74_BUNSH	123	tr|A0A1W2PR56|A0A1W2PR56_HUMAN BK channel OS=Homo sapiens OX=9606 GN=KCNMA1 PE=1 SV=1	473	PHDLARVKIESA
PIDLAIVKIEPA	tr|A8WA74|A8WA74_BUNSH	123	tr|A0A1W2PPZ1|A0A1W2PPZ1_HUMAN BK channel OS=Homo sapiens OX=9606 GN=KCNMA1 PE=1 SV=1	473	PHDLARVKIESA
PIDLAIVKIEPA	tr|A8WA74|A8WA74_BUNSH	123	tr|A0A1W2PP06|A0A1W2PP06_HUMAN BK channel (Fragment) OS=Homo sapiens OX=9606 GN=KCNMA1 PE=1 SV=1	459	PHDLARVKIESA
PIDLAIVKIEPA	tr|A8WA74|A8WA74_BUNSH	123	tr|A0A1W2PPX7|A0A1W2PPX7_HUMAN BK channel OS=Homo sapiens OX=9606 GN=KCNMA1 PE=1 SV=1	473	PHDLARVKIESA
PIDLAIVKIEPA	tr|A8WA74|A8WA74_BUNSH	123	tr|Q5SVK5|Q5SVK5_HUMAN BK channel (Fragment) OS=Homo sapiens OX=9606 GN=KCNMA1 PE=1 SV=2	410	PHDLARVKIESA
PIDLAIVKIEPA	tr|A8WA74|A8WA74_BUNSH	123	tr|A0A1W2PPQ3|A0A1W2PPQ3_HUMAN BK channel (Fragment) OS=Homo sapiens OX=9606 GN=KCNMA1 PE=1 SV=1	408	PHDLARVKIESA
PIDLAIVKIEPA	tr|A8WA74|A8WA74_BUNSH	123	tr|A0A1W2PPS2|A0A1W2PPS2_HUMAN BK channel (Fragment) OS=Homo sapiens OX=9606 GN=KCNMA1 PE=1 SV=1	347	PHDLARVKIESA
PIDLAIVKIEPA	tr|A8WA74|A8WA74_BUNSH	123	tr|A0A1W2PNG1|A0A1W2PNG1_HUMAN BK channel (Fragment) OS=Homo sapiens OX=9606 GN=KCNMA1 PE=1 SV=1	408	PHDLARVKIESA
PIDLAIVKIEPA	tr|A8WA74|A8WA74_BUNSH	123	tr|A0A1W2PRN5|A0A1W2PRN5_HUMAN BK channel OS=Homo sapiens OX=9606 GN=KCNMA1 PE=1 SV=1	473	PHDLARVKIESA
PIDLAIVKIEPA	tr|A8WA74|A8WA74_BUNSH	123	tr|A0A1W2PPH9|A0A1W2PPH9_HUMAN BK channel (Fragment) OS=Homo sapiens OX=9606 GN=KCNMA1 PE=1 SV=1	408	PHDLARVKIESA
PIDLAIVKIEPA	tr|A8WA74|A8WA74_BUNSH	123	tr|A0A1W2PQR1|A0A1W2PQR1_HUMAN BK channel OS=Homo sapiens OX=9606 GN=KCNMA1 PE=1 SV=1	473	PHDLARVKIESA
PIDLAIVKIEPA	tr|A8WA74|A8WA74_BUNSH	123	tr|A0A1B0GWD4|A0A1B0GWD4_HUMAN BKCA alpha (Fragment) OS=Homo sapiens OX=9606 GN=KCNMA1 PE=1 SV=2	274	PHDLARVKIESA
PIDLAIVKIEPA	tr|A8WA74|A8WA74_BUNSH	123	tr|A0A1W2PQJ9|A0A1W2PQJ9_HUMAN BK channel (Fragment) OS=Homo sapiens OX=9606 GN=KCNMA1 PE=1 SV=1	408	PHDLARVKIESA
KHQFLQGTYSYS	tr|A8WA74|A8WA74_BUNSH	1140	sp|Q4LDE5|SVEP1_HUMAN Sushi, von Willebrand factor type A, EGF and pentraxin domain-containing protein 1 OS=Homo sapiens OX=9606 GN=SVEP1 PE=1 SV=3	1053	KAQCKQGTYSYS
KHQFLQGTYSYS	tr|A8WA74|A8WA74_BUNSH	1140	tr|A0A0A0MSD0|A0A0A0MSD0_HUMAN Sushi, von Willebrand factor type A, EGF and pentraxin domain-containing protein 1 OS=Homo sapiens OX=9606 GN=SVEP1 PE=1 SV=1	1053	KAQCKQGTYSYS
MSGGRKLVLNKS	tr|A8WA74|A8WA74_BUNSH	1745	tr|E9PNS0|E9PNS0_HUMAN Tubulin-specific chaperone cofactor E-like protein (Fragment) OS=Homo sapiens OX=9606 GN=TBCEL PE=1 SV=1	125	FSGVRKLVLNNS
MSGGRKLVLNKS	tr|A8WA74|A8WA74_BUNSH	1745	tr|A0A2R8YFB7|A0A2R8YFB7_HUMAN TBCEL-TECTA readthrough (Fragment) OS=Homo sapiens OX=9606 GN=TBCEL-TECTA PE=4 SV=1	109	FSGVRKLVLNNS
MSGGRKLVLNKS	tr|A8WA74|A8WA74_BUNSH	1745	sp|Q5QJ74|TBCEL_HUMAN Tubulin-specific chaperone cofactor E-like protein OS=Homo sapiens OX=9606 GN=TBCEL PE=1 SV=2	125	FSGVRKLVLNNS
HQFLQGTYSYSS	tr|A8WA74|A8WA74_BUNSH	1141	sp|Q8NE79|POPD1_HUMAN Blood vessel epicardial substance OS=Homo sapiens OX=9606 GN=BVES PE=1 SV=1	307	HQFLRGTSSMSS
YDRDISIVILLA	tr|A9LXW2|A9LXW2_BUNSH	635	tr|A0A126GVZ9|A0A126GVZ9_HUMAN Olfactory receptor OS=Homo sapiens OX=9606 GN=OR10R2 PE=3 SV=1	186	YFCDISAVILLA
YDRDISIVILLA	tr|A9LXW2|A9LXW2_BUNSH	635	tr|A0A286YEZ2|A0A286YEZ2_HUMAN Olfactory receptor OS=Homo sapiens OX=9606 GN=OR10R2 PE=3 SV=1	186	YFCDISAVILLA
YDRDISIVILLA	tr|A9LXW2|A9LXW2_BUNSH	635	sp|Q8NGX6|O10R2_HUMAN Olfactory receptor 10R2 OS=Homo sapiens OX=9606 GN=OR10R2 PE=3 SV=3	197	YFCDISAVILLA
TRTCRRCKACGA	tr|A9LXW2|A9LXW2_BUNSH	245	tr|A0A0A0MRV7|A0A0A0MRV7_HUMAN Protein-associated with UVRAG as autophagy enhancer OS=Homo sapiens OX=9606 GN=RUBCNL PE=1 SV=1	403	TATCRRCSACRA
TRTCRRCKACGA	tr|A9LXW2|A9LXW2_BUNSH	245	tr|B7ZBN5|B7ZBN5_HUMAN Protein-associated with UVRAG as autophagy enhancer OS=Homo sapiens OX=9606 GN=RUBCNL PE=1 SV=2	461	TATCRRCSACRA
TRTCRRCKACGA	tr|A9LXW2|A9LXW2_BUNSH	245	sp|Q9H714|PACER_HUMAN Protein associated with UVRAG as autophagy enhancer OS=Homo sapiens OX=9606 GN=RUBCNL PE=1 SV=3	618	TATCRRCSACRA
TRTCRRCKACGA	tr|A9LXW2|A9LXW2_BUNSH	245	tr|A0A6Q8PFX0|A0A6Q8PFX0_HUMAN Protein-associated with UVRAG as autophagy enhancer OS=Homo sapiens OX=9606 GN=RUBCNL PE=1 SV=1	527	TATCRRCSACRA
QRAELNLAIADL	tr|A9LXW2|A9LXW2_BUNSH	1336	tr|I3L495|I3L495_HUMAN Platelet-activating factor acetylhydrolase IB subunit beta (Fragment) OS=Homo sapiens OX=9606 GN=PAFAH1B1 PE=1 SV=1	7	QRDELNRAIADY
QRAELNLAIADL	tr|A9LXW2|A9LXW2_BUNSH	1336	tr|A0A6Q8PG63|A0A6Q8PG63_HUMAN Platelet-activating factor acetylhydrolase IB subunit beta OS=Homo sapiens OX=9606 GN=PAFAH1B1 PE=1 SV=1	7	QRDELNRAIADY
QRAELNLAIADL	tr|A9LXW2|A9LXW2_BUNSH	1336	sp|P43034|LIS1_HUMAN Platelet-activating factor acetylhydrolase IB subunit beta OS=Homo sapiens OX=9606 GN=PAFAH1B1 PE=1 SV=2	7	QRDELNRAIADY
NYSEWNTTHKLD	tr|A8WA74|A8WA74_BUNSH	1846	tr|H7BZH9|H7BZH9_HUMAN Protein prune homolog 2 (Fragment) OS=Homo sapiens OX=9606 GN=PRUNE2 PE=1 SV=1	362	NSSEINTTHNLD
NYSEWNTTHKLD	tr|A8WA74|A8WA74_BUNSH	1846	tr|A0A088AWP5|A0A088AWP5_HUMAN Protein prune homolog 2 OS=Homo sapiens OX=9606 GN=PRUNE2 PE=1 SV=1	1040	NSSEINTTHNLD
NYSEWNTTHKLD	tr|A8WA74|A8WA74_BUNSH	1846	sp|Q8WUY3|PRUN2_HUMAN Protein prune homolog 2 OS=Homo sapiens OX=9606 GN=PRUNE2 PE=1 SV=3	1040	NSSEINTTHNLD
NYSEWNTTHKLD	tr|A8WA74|A8WA74_BUNSH	1846	tr|E9PDC2|E9PDC2_HUMAN Protein prune homolog 2 OS=Homo sapiens OX=9606 GN=PRUNE2 PE=1 SV=1	681	NSSEINTTHNLD
RSQKHDPYANLM	tr|A9LXW2|A9LXW2_BUNSH	503	sp|C9JE40|PATL2_HUMAN Protein PAT1 homolog 2 OS=Homo sapiens OX=9606 GN=PATL2 PE=1 SV=1	179	WSQQPDPYANLM
AAKETIVIVNLL	tr|A9LXW2|A9LXW2_BUNSH	463	tr|C9JBJ1|C9JBJ1_HUMAN Trifunctional purine biosynthetic protein adenosine-3 (Fragment) OS=Homo sapiens OX=9606 GN=GART PE=1 SV=8	182	AAGETIVIEELL
AAKETIVIVNLL	tr|A9LXW2|A9LXW2_BUNSH	463	tr|C9JTV6|C9JTV6_HUMAN Trifunctional purine biosynthetic protein adenosine-3 (Fragment) OS=Homo sapiens OX=9606 GN=GART PE=1 SV=1	182	AAGETIVIEELL
AAKETIVIVNLL	tr|A9LXW2|A9LXW2_BUNSH	463	tr|H7C366|H7C366_HUMAN Trifunctional purine biosynthetic protein adenosine-3 (Fragment) OS=Homo sapiens OX=9606 GN=GART PE=1 SV=1	61	AAGETIVIEELL
AAKETIVIVNLL	tr|A9LXW2|A9LXW2_BUNSH	463	tr|F8WD69|F8WD69_HUMAN Trifunctional purine biosynthetic protein adenosine-3 OS=Homo sapiens OX=9606 GN=GART PE=1 SV=1	182	AAGETIVIEELL
AAKETIVIVNLL	tr|A9LXW2|A9LXW2_BUNSH	463	sp|P22102|PUR2_HUMAN Trifunctional purine biosynthetic protein adenosine-3 OS=Homo sapiens OX=9606 GN=GART PE=1 SV=1	182	AAGETIVIEELL
SQKHDPYANLMT	tr|A9LXW2|A9LXW2_BUNSH	504	sp|C9JE40|PATL2_HUMAN Protein PAT1 homolog 2 OS=Homo sapiens OX=9606 GN=PATL2 PE=1 SV=1	180	SQQPDPYANLMT
LLSIANNRIVQI	tr|A8WA74|A8WA74_BUNSH	1584	tr|F8VYZ5|F8VYZ5_HUMAN Leucine-rich repeats and immunoglobulin-like domains protein 3 (Fragment) OS=Homo sapiens OX=9606 GN=LRIG3 PE=1 SV=1	32	LLSLAGNRIVEI
LLSIANNRIVQI	tr|A8WA74|A8WA74_BUNSH	1584	tr|C9K080|C9K080_HUMAN Leucine-rich repeats and immunoglobulin-like domains protein 3 OS=Homo sapiens OX=9606 GN=LRIG3 PE=1 SV=2	125	LLSLAGNRIVEI
LLSIANNRIVQI	tr|A8WA74|A8WA74_BUNSH	1584	sp|Q6UXM1|LRIG3_HUMAN Leucine-rich repeats and immunoglobulin-like domains protein 3 OS=Homo sapiens OX=9606 GN=LRIG3 PE=1 SV=1	125	LLSLAGNRIVEI
AESETKKRRILT	tr|A8WA74|A8WA74_BUNSH	864	tr|A0A1W2PRC7|A0A1W2PRC7_HUMAN Adhesion G-protein-coupled receptor V1 (Fragment) OS=Homo sapiens OX=9606 GN=ADGRV1 PE=1 SV=1	1744	AEGETKKTVILT
AESETKKRRILT	tr|A8WA74|A8WA74_BUNSH	864	sp|Q8WXG9|AGRV1_HUMAN Adhesion G-protein coupled receptor V1 OS=Homo sapiens OX=9606 GN=ADGRV1 PE=1 SV=2	2647	AEGETKKTVILT
ARGLKLEASVEA	tr|A8WA74|A8WA74_BUNSH	1050	sp|P02549|SPTA1_HUMAN Spectrin alpha chain, erythrocytic 1 OS=Homo sapiens OX=9606 GN=SPTA1 PE=1 SV=5	1810	ARGLKLEESLEY
SSEAITQLTTNL	tr|A8WA74|A8WA74_BUNSH	1121	tr|E7EPM4|E7EPM4_HUMAN Mucin-17 OS=Homo sapiens OX=9606 GN=MUC17 PE=1 SV=1	230	SSEAITLLTTPV
SSEAITQLTTNL	tr|A8WA74|A8WA74_BUNSH	1121	sp|Q685J3|MUC17_HUMAN Mucin-17 OS=Homo sapiens OX=9606 GN=MUC17 PE=1 SV=2	230	SSEAITLLTTPV
YLVQVVVILLIV	tr|A9LXW2|A9LXW2_BUNSH	1402	sp|Q8NH83|OR4A5_HUMAN Olfactory receptor 4A5 OS=Homo sapiens OX=9606 GN=OR4A5 PE=3 SV=4	33	YLVTVVGNLLIV
VQRFPLVTCDQD	tr|A9LXW2|A9LXW2_BUNSH	857	tr|B7Z5R6|B7Z5R6_HUMAN Next to BRCA1 gene 1 protein OS=Homo sapiens OX=9606 GN=NBR1 PE=1 SV=1	112	VQSFPLVPCDTD
VQRFPLVTCDQD	tr|A9LXW2|A9LXW2_BUNSH	857	sp|Q14596|NBR1_HUMAN Next to BRCA1 gene 1 protein OS=Homo sapiens OX=9606 GN=NBR1 PE=1 SV=3	133	VQSFPLVPCDTD
SLGAESGSLFFL	tr|A8WA74|A8WA74_BUNSH	1346	sp|Q86V15|CASZ1_HUMAN Zinc finger protein castor homolog 1 OS=Homo sapiens OX=9606 GN=CASZ1 PE=1 SV=4	1621	SLGAEPGSLLFL
AFLSWFPGSDLY	tr|A9YU75|A9YU75_BUNSH	141	sp|Q5THR3|EFCB6_HUMAN EF-hand calcium-binding domain-containing protein 6 OS=Homo sapiens OX=9606 GN=EFCAB6 PE=1 SV=1	130	AFLSRFGGIDLY
AFLSWFPGSDLY	tr|A9YU75|A9YU75_BUNSH	141	tr|B0QYI5|B0QYI5_HUMAN EF-hand calcium-binding domain-containing protein 6 OS=Homo sapiens OX=9606 GN=EFCAB6 PE=1 SV=1	24	AFLSRFGGIDLY
LFKELIKELMSL	tr|A8WA74|A8WA74_BUNSH	1162	sp|P22033|MUTA_HUMAN Methylmalonyl-CoA mutase, mitochondrial OS=Homo sapiens OX=9606 GN=MMUT PE=1 SV=4	681	LVPELIKELNSL
LLGQDFTTCLDT	tr|A9LXW2|A9LXW2_BUNSH	473	sp|Q17R55|F187B_HUMAN Protein FAM187B OS=Homo sapiens OX=9606 GN=FAM187B PE=2 SV=2	258	LSGQDFTTFLDP
SGGRKLVLNKSI	tr|A8WA74|A8WA74_BUNSH	1746	tr|E9PNS0|E9PNS0_HUMAN Tubulin-specific chaperone cofactor E-like protein (Fragment) OS=Homo sapiens OX=9606 GN=TBCEL PE=1 SV=1	126	SGVRKLVLNNSK
SGGRKLVLNKSI	tr|A8WA74|A8WA74_BUNSH	1746	tr|A0A2R8YFB7|A0A2R8YFB7_HUMAN TBCEL-TECTA readthrough (Fragment) OS=Homo sapiens OX=9606 GN=TBCEL-TECTA PE=4 SV=1	110	SGVRKLVLNNSK
SGGRKLVLNKSI	tr|A8WA74|A8WA74_BUNSH	1746	sp|Q5QJ74|TBCEL_HUMAN Tubulin-specific chaperone cofactor E-like protein OS=Homo sapiens OX=9606 GN=TBCEL PE=1 SV=2	126	SGVRKLVLNNSK
ELNLAIADLKPL	tr|A9LXW2|A9LXW2_BUNSH	1339	sp|P51686|CCR9_HUMAN C-C chemokine receptor type 9 OS=Homo sapiens OX=9606 GN=CCR9 PE=1 SV=2	87	LLNLAIADLLFL
ELIKELMSLVEG	tr|A8WA74|A8WA74_BUNSH	1165	sp|Q9H8M7|MINY3_HUMAN Ubiquitin carboxyl-terminal hydrolase MINDY-3 OS=Homo sapiens OX=9606 GN=MINDY3 PE=1 SV=1	3	ELTKELMELVWG
LNLAIADLKPLL	tr|A9LXW2|A9LXW2_BUNSH	1340	tr|D3DNG8|D3DNG8_HUMAN Angiotensin II receptor, type 1, isoform CRA_a OS=Homo sapiens OX=9606 GN=AGTR1 PE=1 SV=1	103	LNLALADLCFLL
LNLAIADLKPLL	tr|A9LXW2|A9LXW2_BUNSH	1340	tr|A0A0A0MSE3|A0A0A0MSE3_HUMAN Angiotensin II receptor, type 1, isoform CRA_c OS=Homo sapiens OX=9606 GN=AGTR1 PE=1 SV=1	97	LNLALADLCFLL
LNLAIADLKPLL	tr|A9LXW2|A9LXW2_BUNSH	1340	sp|P30556|AGTR1_HUMAN Type-1 angiotensin II receptor OS=Homo sapiens OX=9606 GN=AGTR1 PE=1 SV=1	68	LNLALADLCFLL
LNLAIADLKPLL	tr|A9LXW2|A9LXW2_BUNSH	1340	sp|P51681|CCR5_HUMAN C-C chemokine receptor type 5 OS=Homo sapiens OX=9606 GN=CCR5 PE=1 SV=1	70	LNLAISDLFFLL
LNLAIADLKPLL	tr|A9LXW2|A9LXW2_BUNSH	1340	tr|C9JKF3|C9JKF3_HUMAN G-protein coupled receptor 1 (Fragment) OS=Homo sapiens OX=9606 GN=GPR1 PE=4 SV=1	77	LNLAIADFIFLL
LNLAIADLKPLL	tr|A9LXW2|A9LXW2_BUNSH	1340	tr|C9J456|C9J456_HUMAN G-protein coupled receptor 1 (Fragment) OS=Homo sapiens OX=9606 GN=GPR1 PE=4 SV=1	77	LNLAIADFIFLL
LNLAIADLKPLL	tr|A9LXW2|A9LXW2_BUNSH	1340	tr|C9JQB7|C9JQB7_HUMAN G-protein coupled receptor 1 (Fragment) OS=Homo sapiens OX=9606 GN=GPR1 PE=4 SV=1	77	LNLAIADFIFLL
LNLAIADLKPLL	tr|A9LXW2|A9LXW2_BUNSH	1340	sp|P46091|GPR1_HUMAN G-protein coupled receptor 1 OS=Homo sapiens OX=9606 GN=GPR1 PE=1 SV=2	77	LNLAIADFIFLL
