query	query_seqname	query_start	target_seqname	target_start	target
VSSSVSQTKEYL	sp|Q9IH63|FUS_NIPAV	463	sp|Q9UPV0|CE164_HUMAN Centrosomal protein of 164 kDa OS=Homo sapiens OX=9606 GN=CEP164 PE=1 SV=3	1078	VSSSLSQSKEDL
SPLCTKASPAPH	sp|Q997F2|V_NIPAV	428	sp|Q9UPA5|BSN_HUMAN Protein bassoon OS=Homo sapiens OX=9606 GN=BSN PE=1 SV=4	573	SPLSTKASPLPS
KPSAPYKLKKDI	sp|Q997F0|L_NIPAV	843	tr|C9JFV4|C9JFV4_HUMAN Modulator of non-genomic activity of estrogen receptor OS=Homo sapiens OX=9606 GN=PELP1 PE=1 SV=2	540	KPSAPKKLKLDV
KPSAPYKLKKDI	sp|Q997F0|L_NIPAV	843	sp|Q8IZL8|PELP1_HUMAN Proline-, glutamic acid- and leucine-rich protein 1 OS=Homo sapiens OX=9606 GN=PELP1 PE=1 SV=2	490	KPSAPKKLKLDV
KPSAPYKLKKDI	sp|Q997F0|L_NIPAV	843	tr|E7EV54|E7EV54_HUMAN Modulator of non-genomic activity of estrogen receptor OS=Homo sapiens OX=9606 GN=PELP1 PE=1 SV=1	343	KPSAPKKLKLDV
QTFLIFILSFCD	sp|Q997F0|L_NIPAV	1630	sp|Q8NH49|OR4X1_HUMAN Olfactory receptor 4X1 OS=Homo sapiens OX=9606 GN=OR4X1 PE=3 SV=1	157	QTFLIFQLPFCG
QQEEDDLESADW	sp|P0C1C7|W_NIPAV	239	sp|Q13402|MYO7A_HUMAN Unconventional myosin-VIIa OS=Homo sapiens OX=9606 GN=MYO7A PE=1 SV=2	473	EQEEYDLESIDW
QQEEDDLESADW	sp|P0C1C7|W_NIPAV	239	tr|A0A087WT71|A0A087WT71_HUMAN Unconventional myosin-VIIa OS=Homo sapiens OX=9606 GN=MYO7A PE=1 SV=1	473	EQEEYDLESIDW
TSEQSLLIRDIM	sp|Q9IH62|GLYCP_NIPAV	76	sp|Q9Y6K8|KAD5_HUMAN Adenylate kinase isoenzyme 5 OS=Homo sapiens OX=9606 GN=AK5 PE=1 SV=2	418	ESERSKLIRDIM
GKMLTSTGEQNL	sp|Q9IH63|FUS_NIPAV	398	sp|A0A0U1RQI7|KLF18_HUMAN Kruppel-like factor 18 OS=Homo sapiens OX=9606 GN=KLF18 PE=3 SV=1	502	GQMMTSTGNQNL
GKMLTSTGEQNL	sp|Q9IH63|FUS_NIPAV	398	sp|A0A0U1RQI7|KLF18_HUMAN Kruppel-like factor 18 OS=Homo sapiens OX=9606 GN=KLF18 PE=3 SV=1	740	GQMMTSTGNQNL
GKMLTSTGEQNL	sp|Q9IH63|FUS_NIPAV	398	sp|A0A0U1RQI7|KLF18_HUMAN Kruppel-like factor 18 OS=Homo sapiens OX=9606 GN=KLF18 PE=3 SV=1	404	GQMMTSTGNQNL
GKMLTSTGEQNL	sp|Q9IH63|FUS_NIPAV	398	sp|A0A0U1RQI7|KLF18_HUMAN Kruppel-like factor 18 OS=Homo sapiens OX=9606 GN=KLF18 PE=3 SV=1	348	GQMMTSTGNQNL
GKMLTSTGEQNL	sp|Q9IH63|FUS_NIPAV	398	sp|A0A0U1RQI7|KLF18_HUMAN Kruppel-like factor 18 OS=Homo sapiens OX=9606 GN=KLF18 PE=3 SV=1	852	GQMMTSTGNQNL
GKMLTSTGEQNL	sp|Q9IH63|FUS_NIPAV	398	sp|A0A0U1RQI7|KLF18_HUMAN Kruppel-like factor 18 OS=Homo sapiens OX=9606 GN=KLF18 PE=3 SV=1	432	GQMTTSTGNQNL
GKMLTSTGEQNL	sp|Q9IH63|FUS_NIPAV	398	sp|A0A0U1RQI7|KLF18_HUMAN Kruppel-like factor 18 OS=Homo sapiens OX=9606 GN=KLF18 PE=3 SV=1	376	GQMTTSTGNQNL
GKMLTSTGEQNL	sp|Q9IH63|FUS_NIPAV	398	sp|A0A0U1RQI7|KLF18_HUMAN Kruppel-like factor 18 OS=Homo sapiens OX=9606 GN=KLF18 PE=3 SV=1	320	GQMTTSTGNQNL
IGNCNRGISKTK	sp|Q9IH62|GLYCP_NIPAV	237	sp|Q9BXU7|UBP26_HUMAN Ubiquitin carboxyl-terminal hydrolase 26 OS=Homo sapiens OX=9606 GN=USP26 PE=1 SV=1	12	IGNCKTGISKSK
RLLDTMNPQLIT	sp|Q9IH63|FUS_NIPAV	479	tr|D6R9L9|D6R9L9_HUMAN Cilia- and flagella-associated protein 206 OS=Homo sapiens OX=9606 GN=CFAP206 PE=1 SV=1	69	RLLDTKNPSLDT
RLLDTMNPQLIT	sp|Q9IH63|FUS_NIPAV	479	tr|D6RBZ4|D6RBZ4_HUMAN Cilia- and flagella-associated protein 206 (Fragment) OS=Homo sapiens OX=9606 GN=CFAP206 PE=1 SV=8	69	RLLDTKNPSLDT
RLLDTMNPQLIT	sp|Q9IH63|FUS_NIPAV	479	sp|Q8IYR0|CF206_HUMAN Cilia- and flagella-associated protein 206 OS=Homo sapiens OX=9606 GN=CFAP206 PE=1 SV=2	69	RLLDTKNPSLDT
RDVKYVVGGAMV	sp|Q9IK92|NCAP_NIPAV	411	tr|A0A0C4DGF2|A0A0C4DGF2_HUMAN Kelch-like protein 6 (Fragment) OS=Homo sapiens OX=9606 GN=KLHL6 PE=1 SV=1	504	RDRIYVVGGAMR
RDVKYVVGGAMV	sp|Q9IK92|NCAP_NIPAV	411	sp|Q8WZ60|KLHL6_HUMAN Kelch-like protein 6 OS=Homo sapiens OX=9606 GN=KLHL6 PE=1 SV=3	515	RDRIYVVGGAMR
ACASRSMHSLVP	sp|Q997F0|L_NIPAV	2017	tr|A0A5F9ZHN1|A0A5F9ZHN1_HUMAN Ankyrin repeat and death domain-containing protein 1B (Fragment) OS=Homo sapiens OX=9606 GN=ANKDD1B PE=4 SV=1	329	AVASRSNHSLVV
ACASRSMHSLVP	sp|Q997F0|L_NIPAV	2017	tr|A0A5F9ZHD3|A0A5F9ZHD3_HUMAN Ankyrin repeat and death domain-containing protein 1B (Fragment) OS=Homo sapiens OX=9606 GN=ANKDD1B PE=4 SV=1	110	AVASRSNHSLVV
ACASRSMHSLVP	sp|Q997F0|L_NIPAV	2017	tr|A0A5F9ZHN3|A0A5F9ZHN3_HUMAN Ankyrin repeat and death domain-containing protein 1B OS=Homo sapiens OX=9606 GN=ANKDD1B PE=4 SV=1	230	AVASRSNHSLVV
ACASRSMHSLVP	sp|Q997F0|L_NIPAV	2017	tr|A0A5F9ZHP8|A0A5F9ZHP8_HUMAN Ankyrin repeat and death domain-containing protein 1B OS=Homo sapiens OX=9606 GN=ANKDD1B PE=4 SV=1	119	AVASRSNHSLVV
ACASRSMHSLVP	sp|Q997F0|L_NIPAV	2017	sp|A6NHY2|AKD1B_HUMAN Ankyrin repeat and death domain-containing protein 1B OS=Homo sapiens OX=9606 GN=ANKDD1B PE=4 SV=3	372	AVASRSNHSLVV
GLYIDSSSNIDQ	sp|Q9IH62|GLYCP_NIPAV	523	tr|A0A3B3IRX3|A0A3B3IRX3_HUMAN Mediator of RNA polymerase II transcription subunit 13 OS=Homo sapiens OX=9606 GN=MED13L PE=1 SV=1	1146	GLYIPDSSNEDQ
GLYIDSSSNIDQ	sp|Q9IH62|GLYCP_NIPAV	523	sp|Q71F56|MD13L_HUMAN Mediator of RNA polymerase II transcription subunit 13-like OS=Homo sapiens OX=9606 GN=MED13L PE=1 SV=1	1146	GLYIPDSSNEDQ
GLYIDSSSNIDQ	sp|Q9IH62|GLYCP_NIPAV	523	tr|A0A3B3IS46|A0A3B3IS46_HUMAN Mediator of RNA polymerase II transcription subunit 13 (Fragment) OS=Homo sapiens OX=9606 GN=MED13L PE=1 SV=1	541	GLYIPDSSNEDQ
GLYIDSSSNIDQ	sp|Q9IH62|GLYCP_NIPAV	523	tr|H0YHC1|H0YHC1_HUMAN Mediator of RNA polymerase II transcription subunit 13-like (Fragment) OS=Homo sapiens OX=9606 GN=MED13L PE=1 SV=2	956	GLYIPDSSNEDQ
SLTYTTEGILLG	sp|Q9IH63|FUS_NIPAV	435	sp|Q8TBY9|CF251_HUMAN Cilia- and flagella-associated protein 251 OS=Homo sapiens OX=9606 GN=CFAP251 PE=1 SV=2	654	SLTYNPEGALLG
QEIPGLGPKDTL	sp|P0C1C7|W_NIPAV	304	sp|O60488|ACSL4_HUMAN Long-chain-fatty-acid--CoA ligase 4 OS=Homo sapiens OX=9606 GN=ACSL4 PE=1 SV=2	304	ERIPGLGPKDTY
ARLFQQEEDDLE	sp|P0C1C7|W_NIPAV	235	sp|Q86YN6|PRGC2_HUMAN Peroxisome proliferator-activated receptor gamma coactivator 1-beta OS=Homo sapiens OX=9606 GN=PPARGC1B PE=1 SV=2	424	ARLQQQEEEDEE
ARLFQQEEDDLE	sp|P0C1C7|W_NIPAV	235	tr|H0Y713|H0Y713_HUMAN Peroxisome proliferator-activated receptor gamma coactivator 1-beta (Fragment) OS=Homo sapiens OX=9606 GN=PPARGC1B PE=1 SV=1	111	ARLQQQEEEDEE
ARLFQQEEDDLE	sp|P0C1C7|W_NIPAV	235	sp|P42566|EPS15_HUMAN Epidermal growth factor receptor substrate 15 OS=Homo sapiens OX=9606 GN=EPS15 PE=1 SV=2	872	ARLNQQEQEDLE
ARLFQQEEDDLE	sp|P0C1C7|W_NIPAV	235	tr|B1AUU8|B1AUU8_HUMAN Epidermal growth factor receptor substrate 15 OS=Homo sapiens OX=9606 GN=EPS15 PE=1 SV=1	738	ARLNQQEQEDLE
SIKESLTAKENR	sp|P0C1C7|W_NIPAV	291	tr|K7EPP6|K7EPP6_HUMAN ELKS/Rab6-interacting/CAST family member 1 (Fragment) OS=Homo sapiens OX=9606 GN=ERC1 PE=1 SV=1	326	VLKESLTAKEQR
SIKESLTAKENR	sp|P0C1C7|W_NIPAV	291	sp|O15083|ERC2_HUMAN ERC protein 2 OS=Homo sapiens OX=9606 GN=ERC2 PE=1 SV=3	473	VLKESLTAKEQR
SIKESLTAKENR	sp|P0C1C7|W_NIPAV	291	tr|H7C4G9|H7C4G9_HUMAN ERC protein 2 (Fragment) OS=Homo sapiens OX=9606 GN=ERC2 PE=1 SV=1	112	VLKESLTAKEQR
SIKESLTAKENR	sp|P0C1C7|W_NIPAV	291	sp|Q8IUD2|RB6I2_HUMAN ELKS/Rab6-interacting/CAST family member 1 OS=Homo sapiens OX=9606 GN=ERC1 PE=1 SV=1	505	VLKESLTAKEQR
SIKESLTAKENR	sp|P0C1C7|W_NIPAV	291	tr|G8JLD3|G8JLD3_HUMAN ELKS/Rab6-interacting/CAST family member 1 OS=Homo sapiens OX=9606 GN=ERC1 PE=1 SV=1	505	VLKESLTAKEQR
SIKESLTAKENR	sp|P0C1C7|W_NIPAV	291	tr|X6RLX0|X6RLX0_HUMAN ELKS/Rab6-interacting/CAST family member 1 OS=Homo sapiens OX=9606 GN=ERC1 PE=1 SV=1	505	VLKESLTAKEQR
SIKESLTAKENR	sp|P0C1C7|W_NIPAV	291	tr|X6RM00|X6RM00_HUMAN ELKS/Rab6-interacting/CAST family member 1 OS=Homo sapiens OX=9606 GN=ERC1 PE=1 SV=1	505	VLKESLTAKEQR
RRLWLEEYCSPL	sp|Q997F2|V_NIPAV	419	sp|P0C7T7|FMAS1_HUMAN Putative uncharacterized protein FRMD6-AS1 OS=Homo sapiens OX=9606 GN=FRMD6-AS1 PE=5 SV=1	324	RRRWLRESCSPL
PLADRRGERVSE	sp|Q9IK92|NCAP_NIPAV	112	sp|P43116|PE2R2_HUMAN Prostaglandin E2 receptor EP2 subtype OS=Homo sapiens OX=9606 GN=PTGER2 PE=2 SV=2	245	PGARRRGERVSM
SKEDKDSEIAKL	sp|Q9IK91|PHOSP_NIPAV	166	sp|Q9NU22|MDN1_HUMAN Midasin OS=Homo sapiens OX=9606 GN=MDN1 PE=1 SV=2	1498	SPEDKDSEIELL
SLALLGASVVDG	sp|Q997F0|L_NIPAV	1394	sp|Q5MY95|ENTP8_HUMAN Ectonucleoside triphosphate diphosphohydrolase 8 OS=Homo sapiens OX=9606 GN=ENTPD8 PE=1 SV=2	10	FLALLGASGVSG
SGSLPDSNQLQK	sp|Q997F0|L_NIPAV	1059	tr|A0A0A0MTM3|A0A0A0MTM3_HUMAN Cbp/p300-interacting transactivator 2 OS=Homo sapiens OX=9606 GN=CITED2 PE=1 SV=1	112	GGSLPASMQLQK
SGSLPDSNQLQK	sp|Q997F0|L_NIPAV	1059	sp|Q99967|CITE2_HUMAN Cbp/p300-interacting transactivator 2 OS=Homo sapiens OX=9606 GN=CITED2 PE=1 SV=2	107	GGSLPASMQLQK
TSCDVSHLAVLL	sp|Q9IK90|MATRX_NIPAV	316	sp|Q49AG3|ZBED5_HUMAN Zinc finger BED domain-containing protein 5 OS=Homo sapiens OX=9606 GN=ZBED5 PE=2 SV=2	279	ESADVSGLAVLL
NSPISSSVDYIL	sp|Q997F0|L_NIPAV	976	sp|P51685|CCR8_HUMAN C-C chemokine receptor type 8 OS=Homo sapiens OX=9606 GN=CCR8 PE=1 SV=1	344	HSSRSSSVDYIL
TDDPLVREIARD	sp|Q997F2|V_NIPAV	337	tr|D6RFM0|D6RFM0_HUMAN Ubiquitin-conjugating enzyme E2 D2 (Fragment) OS=Homo sapiens OX=9606 GN=UBE2D2 PE=1 SV=1	86	PDDPLVPEIARI
TDDPLVREIARD	sp|Q997F2|V_NIPAV	337	tr|H9KV45|H9KV45_HUMAN Ubiquitin-conjugating enzyme E2 D3 OS=Homo sapiens OX=9606 GN=UBE2D3 PE=1 SV=1	109	PDDPLVPEIARI
TDDPLVREIARD	sp|Q997F2|V_NIPAV	337	sp|P61077|UB2D3_HUMAN Ubiquitin-conjugating enzyme E2 D3 OS=Homo sapiens OX=9606 GN=UBE2D3 PE=1 SV=1	115	PDDPLVPEIARI
TDDPLVREIARD	sp|Q997F2|V_NIPAV	337	tr|A0A087WY85|A0A087WY85_HUMAN Ubiquitin-conjugating enzyme E2 D3 OS=Homo sapiens OX=9606 GN=UBE2D3 PE=1 SV=1	116	PDDPLVPEIARI
TDDPLVREIARD	sp|Q997F2|V_NIPAV	337	tr|D6RAH7|D6RAH7_HUMAN Ubiquitin-conjugating enzyme E2 D3 OS=Homo sapiens OX=9606 GN=UBE2D3 PE=1 SV=1	86	PDDPLVPEIARI
TDDPLVREIARD	sp|Q997F2|V_NIPAV	337	tr|A0A0A0MQU3|A0A0A0MQU3_HUMAN Ubiquitin-conjugating enzyme E2 D2 OS=Homo sapiens OX=9606 GN=UBE2D2 PE=1 SV=1	115	PDDPLVPEIARI
TDDPLVREIARD	sp|Q997F2|V_NIPAV	337	sp|P62837|UB2D2_HUMAN Ubiquitin-conjugating enzyme E2 D2 OS=Homo sapiens OX=9606 GN=UBE2D2 PE=1 SV=1	115	PDDPLVPEIARI
ASRSMHSLVPPS	sp|Q997F0|L_NIPAV	2019	sp|Q96L34|MARK4_HUMAN MAP/microtubule affinity-regulating kinase 4 OS=Homo sapiens OX=9606 GN=MARK4 PE=1 SV=1	542	ASPSSHSLAPPS
APLADRRGERVS	sp|Q9IK92|NCAP_NIPAV	111	sp|P43116|PE2R2_HUMAN Prostaglandin E2 receptor EP2 subtype OS=Homo sapiens OX=9606 GN=PTGER2 PE=2 SV=2	244	GPGARRRGERVS
SRQTEVPGLGPK	sp|Q997F2|V_NIPAV	301	sp|Q9UGP4|LIMD1_HUMAN LIM domain-containing protein 1 OS=Homo sapiens OX=9606 GN=LIMD1 PE=1 SV=1	360	SQQGAVPGLGPK
SRQTEVPGLGPK	sp|Q997F2|V_NIPAV	301	tr|C9JRJ5|C9JRJ5_HUMAN LIM domain-containing protein 1 OS=Homo sapiens OX=9606 GN=LIMD1 PE=1 SV=1	360	SQQGAVPGLGPK
DSRISSSGLQPS	sp|Q997F2|V_NIPAV	178	tr|A0A087WVE6|A0A087WVE6_HUMAN mRNA-decapping enzyme 1A (Fragment) OS=Homo sapiens OX=9606 GN=DCP1A PE=1 SV=1	173	DSNISSPGLQPS
DSRISSSGLQPS	sp|Q997F2|V_NIPAV	178	tr|A0A087WT55|A0A087WT55_HUMAN mRNA-decapping enzyme 1A (Fragment) OS=Homo sapiens OX=9606 GN=DCP1A PE=1 SV=1	162	DSNISSPGLQPS
DSRISSSGLQPS	sp|Q997F2|V_NIPAV	178	sp|Q9NPI6|DCP1A_HUMAN mRNA-decapping enzyme 1A OS=Homo sapiens OX=9606 GN=DCP1A PE=1 SV=3	175	DSNISSPGLQPS
GSTAKETATVRE	sp|Q997F2|V_NIPAV	289	sp|Q8TDJ6|DMXL2_HUMAN DmX-like protein 2 OS=Homo sapiens OX=9606 GN=DMXL2 PE=1 SV=2	1403	GSTAKETVTVGK
GSTAKETATVRE	sp|Q997F2|V_NIPAV	289	tr|H0YLM8|H0YLM8_HUMAN DmX-like protein 2 OS=Homo sapiens OX=9606 GN=DMXL2 PE=1 SV=2	1403	GSTAKETVTVGK
TNEALMGLSPEE	sp|P0C1C7|W_NIPAV	258	sp|A6NEY8|PRXD1_HUMAN Putative prolyl-tRNA synthetase associated domain-containing protein 1 OS=Homo sapiens OX=9606 GN=PRORSD1P PE=5 SV=3	140	TNAATMGLSPED
TNEALMGLSPEE	sp|P0C1C7|W_NIPAV	258	sp|P13797|PLST_HUMAN Plastin-3 OS=Homo sapiens OX=9606 GN=PLS3 PE=1 SV=4	260	TLEELMKLSPEE
TNEALMGLSPEE	sp|P0C1C7|W_NIPAV	258	tr|A0A0A0MSQ0|A0A0A0MSQ0_HUMAN Plastin-3 OS=Homo sapiens OX=9606 GN=PLS3 PE=1 SV=1	238	TLEELMKLSPEE
VLGQVVAAILTV	sp|Q9IH62|GLYCP_NIPAV	56	tr|A0A2R8Y8D9|A0A2R8Y8D9_HUMAN Proline and serine-rich protein 3 (Fragment) OS=Homo sapiens OX=9606 GN=PROSER3 PE=1 SV=1	252	VLGQVVAARLFP
LEGSTAKETATV	sp|Q997F2|V_NIPAV	287	tr|K7EQ86|K7EQ86_HUMAN KIAA0100, isoform CRA_a OS=Homo sapiens OX=9606 GN=KIAA0100 PE=1 SV=1	590	LEVSTAKLTAFV
LEGSTAKETATV	sp|Q997F2|V_NIPAV	287	tr|Q08E86|Q08E86_HUMAN KIAA0100 protein OS=Homo sapiens OX=9606 GN=KIAA0100 PE=1 SV=1	590	LEVSTAKLTAFV
LEGSTAKETATV	sp|Q997F2|V_NIPAV	287	sp|Q14667|K0100_HUMAN Protein KIAA0100 OS=Homo sapiens OX=9606 GN=KIAA0100 PE=1 SV=3	733	LEVSTAKLTAFV
LEGSTAKETATV	sp|Q997F2|V_NIPAV	287	sp|Q8TDJ6|DMXL2_HUMAN DmX-like protein 2 OS=Homo sapiens OX=9606 GN=DMXL2 PE=1 SV=2	1401	VSGSTAKETVTV
LEGSTAKETATV	sp|Q997F2|V_NIPAV	287	tr|H0YLM8|H0YLM8_HUMAN DmX-like protein 2 OS=Homo sapiens OX=9606 GN=DMXL2 PE=1 SV=2	1401	VSGSTAKETVTV
VLHEEPPSRKVP	sp|Q997F2|V_NIPAV	315	tr|A0A494C1I6|A0A494C1I6_HUMAN Agrin OS=Homo sapiens OX=9606 GN=AGRN PE=1 SV=1	1641	VLGESPKSRKVP
VLHEEPPSRKVP	sp|Q997F2|V_NIPAV	315	sp|O00468|AGRIN_HUMAN Agrin OS=Homo sapiens OX=9606 GN=AGRN PE=1 SV=6	1746	VLGESPKSRKVP
VLHEEPPSRKVP	sp|Q997F2|V_NIPAV	315	tr|A0A087X208|A0A087X208_HUMAN Agrin OS=Homo sapiens OX=9606 GN=AGRN PE=1 SV=1	1608	VLGESPKSRKVP
IPGLGPKDTLMR	sp|P0C1C7|W_NIPAV	306	sp|O60488|ACSL4_HUMAN Long-chain-fatty-acid--CoA ligase 4 OS=Homo sapiens OX=9606 GN=ACSL4 PE=1 SV=2	306	IPGLGPKDTYIG
LSDPARESPVVI	sp|Q997F2|V_NIPAV	198	tr|H0Y7Z1|H0Y7Z1_HUMAN Fibronectin (Fragment) OS=Homo sapiens OX=9606 GN=FN1 PE=1 SV=1	603	LNDNARSSPVVI
LSDPARESPVVI	sp|Q997F2|V_NIPAV	198	sp|P02751|FINC_HUMAN Fibronectin OS=Homo sapiens OX=9606 GN=FN1 PE=1 SV=5	1977	LNDNARSSPVVI
LSDPARESPVVI	sp|Q997F2|V_NIPAV	198	tr|H0Y4K8|H0Y4K8_HUMAN Fibronectin (Fragment) OS=Homo sapiens OX=9606 GN=FN1 PE=1 SV=1	5	LNDNARSSPVVI
FLACASRSMHSL	sp|Q997F0|L_NIPAV	2015	tr|A0A5F9ZHN1|A0A5F9ZHN1_HUMAN Ankyrin repeat and death domain-containing protein 1B (Fragment) OS=Homo sapiens OX=9606 GN=ANKDD1B PE=4 SV=1	327	ALAVASRSNHSL
FLACASRSMHSL	sp|Q997F0|L_NIPAV	2015	tr|A0A5F9ZHD3|A0A5F9ZHD3_HUMAN Ankyrin repeat and death domain-containing protein 1B (Fragment) OS=Homo sapiens OX=9606 GN=ANKDD1B PE=4 SV=1	108	ALAVASRSNHSL
FLACASRSMHSL	sp|Q997F0|L_NIPAV	2015	tr|A0A5F9ZHN3|A0A5F9ZHN3_HUMAN Ankyrin repeat and death domain-containing protein 1B OS=Homo sapiens OX=9606 GN=ANKDD1B PE=4 SV=1	228	ALAVASRSNHSL
FLACASRSMHSL	sp|Q997F0|L_NIPAV	2015	tr|A0A5F9ZHP8|A0A5F9ZHP8_HUMAN Ankyrin repeat and death domain-containing protein 1B OS=Homo sapiens OX=9606 GN=ANKDD1B PE=4 SV=1	117	ALAVASRSNHSL
FLACASRSMHSL	sp|Q997F0|L_NIPAV	2015	sp|A6NHY2|AKD1B_HUMAN Ankyrin repeat and death domain-containing protein 1B OS=Homo sapiens OX=9606 GN=ANKDD1B PE=4 SV=3	370	ALAVASRSNHSL
SEQSLLIRDIMN	sp|Q9IH62|GLYCP_NIPAV	77	sp|Q9Y6K8|KAD5_HUMAN Adenylate kinase isoenzyme 5 OS=Homo sapiens OX=9606 GN=AK5 PE=1 SV=2	419	SERSKLIRDIME
LLSSIKLMNVDV	sp|Q9IK91|PHOSP_NIPAV	520	sp|Q92543|SNX19_HUMAN Sorting nexin-19 OS=Homo sapiens OX=9606 GN=SNX19 PE=1 SV=2	23	LLSSRKLMAVGV
DDVNTQQPTDGS	sp|P0C1C7|W_NIPAV	76	tr|A0A2R8Y5U3|A0A2R8Y5U3_HUMAN Vacuolar protein sorting-associated protein 33A (Fragment) OS=Homo sapiens OX=9606 GN=VPS33A PE=1 SV=1	143	DDVNEQNPTDIS
DDVNTQQPTDGS	sp|P0C1C7|W_NIPAV	76	tr|H3BMM5|H3BMM5_HUMAN Uncharacterized protein OS=Homo sapiens OX=9606 PE=3 SV=1	436	DDVNEQNPTDIS
DDVNTQQPTDGS	sp|P0C1C7|W_NIPAV	76	tr|A0A2R8YF87|A0A2R8YF87_HUMAN Vacuolar protein sorting-associated protein 33A OS=Homo sapiens OX=9606 GN=VPS33A PE=1 SV=1	516	DDVNEQNPTDIS
DDVNTQQPTDGS	sp|P0C1C7|W_NIPAV	76	sp|Q96AX1|VP33A_HUMAN Vacuolar protein sorting-associated protein 33A OS=Homo sapiens OX=9606 GN=VPS33A PE=1 SV=1	475	DDVNEQNPTDIS
LLVLGQVVAAIL	sp|Q9IH62|GLYCP_NIPAV	54	tr|A0A2R8Y8D9|A0A2R8Y8D9_HUMAN Proline and serine-rich protein 3 (Fragment) OS=Homo sapiens OX=9606 GN=PROSER3 PE=1 SV=1	250	RGVLGQVVAARL
CSPLCTKASPAP	sp|Q997F2|V_NIPAV	427	sp|Q9UPA5|BSN_HUMAN Protein bassoon OS=Homo sapiens OX=9606 GN=BSN PE=1 SV=4	572	ASPLSTKASPLP
LWNQILLVLGQV	sp|Q9IH62|GLYCP_NIPAV	49	tr|B0QYH4|B0QYH4_HUMAN Seizure 6-like protein OS=Homo sapiens OX=9606 GN=SEZ6L PE=1 SV=1	121	LANQTLLVEGQV
LWNQILLVLGQV	sp|Q9IH62|GLYCP_NIPAV	49	tr|B7ZLJ8|B7ZLJ8_HUMAN SEZ6L protein OS=Homo sapiens OX=9606 GN=SEZ6L PE=1 SV=1	348	LANQTLLVEGQV
LWNQILLVLGQV	sp|Q9IH62|GLYCP_NIPAV	49	tr|B0QYH5|B0QYH5_HUMAN Seizure 6-like protein OS=Homo sapiens OX=9606 GN=SEZ6L PE=1 SV=1	121	LANQTLLVEGQV
LWNQILLVLGQV	sp|Q9IH62|GLYCP_NIPAV	49	sp|Q9BYH1|SE6L1_HUMAN Seizure 6-like protein OS=Homo sapiens OX=9606 GN=SEZ6L PE=1 SV=1	348	LANQTLLVEGQV
TTNEALMGLSPE	sp|P0C1C7|W_NIPAV	257	sp|A6NEY8|PRXD1_HUMAN Putative prolyl-tRNA synthetase associated domain-containing protein 1 OS=Homo sapiens OX=9606 GN=PRORSD1P PE=5 SV=3	139	MTNAATMGLSPE
IINMLLNLAIED	sp|Q997F0|L_NIPAV	1959	sp|Q9BYT9|ANO3_HUMAN Anoctamin-3 OS=Homo sapiens OX=9606 GN=ANO3 PE=2 SV=2	605	IIIMLLNLAYEK
IINMLLNLAIED	sp|Q997F0|L_NIPAV	1959	tr|A0A5F9ZHL6|A0A5F9ZHL6_HUMAN Anoctamin OS=Homo sapiens OX=9606 GN=ANO3 PE=1 SV=1	666	IIIMLLNLAYEK
IINMLLNLAIED	sp|Q997F0|L_NIPAV	1959	tr|E9PQ79|E9PQ79_HUMAN Anoctamin OS=Homo sapiens OX=9606 GN=ANO3 PE=1 SV=1	589	IIIMLLNLAYEK
VTPMEESDTLED	sp|Q9IK91|PHOSP_NIPAV	464	sp|Q92736|RYR2_HUMAN Ryanodine receptor 2 OS=Homo sapiens OX=9606 GN=RYR2 PE=1 SV=3	1855	ATPEEESDTLEK
VTPMEESDTLED	sp|Q9IK91|PHOSP_NIPAV	464	tr|H7BY35|H7BY35_HUMAN Ryanodine receptor 2 OS=Homo sapiens OX=9606 GN=RYR2 PE=1 SV=2	1839	ATPEEESDTLEK
KLMNVDVKISHA	sp|Q9IK91|PHOSP_NIPAV	525	tr|G3V599|G3V599_HUMAN Melanoma inhibitory activity protein 2 OS=Homo sapiens OX=9606 GN=MIA2 PE=1 SV=1	948	KLSKVDEKISHA
KLMNVDVKISHA	sp|Q9IK91|PHOSP_NIPAV	525	sp|Q96PC5|MIA2_HUMAN Melanoma inhibitory activity protein 2 OS=Homo sapiens OX=9606 GN=MIA2 PE=1 SV=4	1021	KLSKVDEKISHA
LAVLLSPQLPKD	sp|Q9IK90|MATRX_NIPAV	323	sp|P22413|ENPP1_HUMAN Ectonucleotide pyrophosphatase/phosphodiesterase family member 1 OS=Homo sapiens OX=9606 GN=ENPP1 PE=1 SV=2	351	LAVLQWLQLPKD
LAVLLSPQLPKD	sp|Q9IK90|MATRX_NIPAV	323	tr|E9PE72|E9PE72_HUMAN Ectonucleotide pyrophosphatase/phosphodiesterase family member 1 OS=Homo sapiens OX=9606 GN=ENPP1 PE=1 SV=1	351	LAVLQWLQLPKD
YIDDLLNMLTID	sp|Q997F0|L_NIPAV	337	tr|J3KP92|J3KP92_HUMAN Homeodomain-interacting protein kinase 1 OS=Homo sapiens OX=9606 GN=HIPK1 PE=1 SV=1	491	YIDLLKKMLTID
YIDDLLNMLTID	sp|Q997F0|L_NIPAV	337	sp|Q86Z02|HIPK1_HUMAN Homeodomain-interacting protein kinase 1 OS=Homo sapiens OX=9606 GN=HIPK1 PE=1 SV=1	491	YIDLLKKMLTID
YIDDLLNMLTID	sp|Q997F0|L_NIPAV	337	tr|Q5SQL3|Q5SQL3_HUMAN Homeodomain-interacting protein kinase 1 OS=Homo sapiens OX=9606 GN=HIPK1 PE=1 SV=1	491	YIDLLKKMLTID
LEKSIDDLIVER	sp|Q997F0|L_NIPAV	1945	tr|H0YK48|H0YK48_HUMAN Tropomyosin alpha-1 chain OS=Homo sapiens OX=9606 GN=TPM1 PE=1 SV=1	213	LEKSIDDLEDEL
LEKSIDDLIVER	sp|Q997F0|L_NIPAV	1945	sp|P09493|TPM1_HUMAN Tropomyosin alpha-1 chain OS=Homo sapiens OX=9606 GN=TPM1 PE=1 SV=2	249	LEKSIDDLEDEL
LEKSIDDLIVER	sp|Q997F0|L_NIPAV	1945	tr|A0A0S2Z4G6|A0A0S2Z4G6_HUMAN Tropomyosin 1 (Alpha), isoform CRA_o (Fragment) OS=Homo sapiens OX=9606 GN=TPM1 PE=1 SV=1	249	LEKSIDDLEDEL
LEKSIDDLIVER	sp|Q997F0|L_NIPAV	1945	tr|H0YKJ4|H0YKJ4_HUMAN Tropomyosin 1 (Alpha), isoform CRA_b OS=Homo sapiens OX=9606 GN=TPM1 PE=1 SV=2	213	LEKSIDDLEDEL
LEKSIDDLIVER	sp|Q997F0|L_NIPAV	1945	tr|A0A494C0I0|A0A494C0I0_HUMAN Tropomyosin alpha-1 chain (Fragment) OS=Homo sapiens OX=9606 GN=TPM1 PE=1 SV=1	27	LEKSIDDLEDEL
GTDDPLVREIAR	sp|Q997F2|V_NIPAV	336	tr|D6RFM0|D6RFM0_HUMAN Ubiquitin-conjugating enzyme E2 D2 (Fragment) OS=Homo sapiens OX=9606 GN=UBE2D2 PE=1 SV=1	85	NPDDPLVPEIAR
GTDDPLVREIAR	sp|Q997F2|V_NIPAV	336	tr|H9KV45|H9KV45_HUMAN Ubiquitin-conjugating enzyme E2 D3 OS=Homo sapiens OX=9606 GN=UBE2D3 PE=1 SV=1	108	NPDDPLVPEIAR
GTDDPLVREIAR	sp|Q997F2|V_NIPAV	336	sp|P61077|UB2D3_HUMAN Ubiquitin-conjugating enzyme E2 D3 OS=Homo sapiens OX=9606 GN=UBE2D3 PE=1 SV=1	114	NPDDPLVPEIAR
GTDDPLVREIAR	sp|Q997F2|V_NIPAV	336	tr|A0A087WY85|A0A087WY85_HUMAN Ubiquitin-conjugating enzyme E2 D3 OS=Homo sapiens OX=9606 GN=UBE2D3 PE=1 SV=1	115	NPDDPLVPEIAR
GTDDPLVREIAR	sp|Q997F2|V_NIPAV	336	tr|D6RAH7|D6RAH7_HUMAN Ubiquitin-conjugating enzyme E2 D3 OS=Homo sapiens OX=9606 GN=UBE2D3 PE=1 SV=1	85	NPDDPLVPEIAR
GTDDPLVREIAR	sp|Q997F2|V_NIPAV	336	tr|A0A0A0MQU3|A0A0A0MQU3_HUMAN Ubiquitin-conjugating enzyme E2 D2 OS=Homo sapiens OX=9606 GN=UBE2D2 PE=1 SV=1	114	NPDDPLVPEIAR
GTDDPLVREIAR	sp|Q997F2|V_NIPAV	336	sp|P62837|UB2D2_HUMAN Ubiquitin-conjugating enzyme E2 D2 OS=Homo sapiens OX=9606 GN=UBE2D2 PE=1 SV=1	114	NPDDPLVPEIAR
ESEDDLSELVTS	sp|Q9IK91|PHOSP_NIPAV	689	tr|M0QXT1|M0QXT1_HUMAN FERM, ARHGEF and pleckstrin domain-containing protein 1 (Fragment) OS=Homo sapiens OX=9606 GN=FARP1 PE=1 SV=1	218	ESEDDLSASRTS
ESEDDLSELVTS	sp|Q9IK91|PHOSP_NIPAV	689	sp|Q9Y4F1|FARP1_HUMAN FERM, ARHGEF and pleckstrin domain-containing protein 1 OS=Homo sapiens OX=9606 GN=FARP1 PE=1 SV=1	888	ESEDDLSASRTS
ESEDDLSELVTS	sp|Q9IK91|PHOSP_NIPAV	689	tr|C9JME2|C9JME2_HUMAN FERM, ARHGEF and pleckstrin domain-containing protein 1 OS=Homo sapiens OX=9606 GN=FARP1 PE=1 SV=2	919	ESEDDLSASRTS
IQSLEKTKPGTP	sp|P0C1C7|W_NIPAV	384	tr|J3QKL0|J3QKL0_HUMAN Beta-N-acetylhexosaminidase OS=Homo sapiens OX=9606 GN=HEXD PE=1 SV=1	344	ISSLEKTDPGSP
ADSRISSSGLQP	sp|Q997F2|V_NIPAV	177	tr|A0A087WVE6|A0A087WVE6_HUMAN mRNA-decapping enzyme 1A (Fragment) OS=Homo sapiens OX=9606 GN=DCP1A PE=1 SV=1	172	GDSNISSPGLQP
ADSRISSSGLQP	sp|Q997F2|V_NIPAV	177	tr|A0A087WT55|A0A087WT55_HUMAN mRNA-decapping enzyme 1A (Fragment) OS=Homo sapiens OX=9606 GN=DCP1A PE=1 SV=1	161	GDSNISSPGLQP
ADSRISSSGLQP	sp|Q997F2|V_NIPAV	177	sp|Q9NPI6|DCP1A_HUMAN mRNA-decapping enzyme 1A OS=Homo sapiens OX=9606 GN=DCP1A PE=1 SV=3	174	GDSNISSPGLQP
PASTSLRECVSG	sp|Q9IH63|FUS_NIPAV	347	tr|M0R038|M0R038_HUMAN Pleckstrin homology-like domain family B member 3 (Fragment) OS=Homo sapiens OX=9606 GN=PHLDB3 PE=1 SV=1	85	PASTSSREGVRG
PASTSLRECVSG	sp|Q9IH63|FUS_NIPAV	347	tr|M0R3I7|M0R3I7_HUMAN Pleckstrin homology-like domain family B member 3 (Fragment) OS=Homo sapiens OX=9606 GN=PHLDB3 PE=1 SV=1	85	PASTSSREGVRG
PASTSLRECVSG	sp|Q9IH63|FUS_NIPAV	347	sp|Q6NSJ2|PHLB3_HUMAN Pleckstrin homology-like domain family B member 3 OS=Homo sapiens OX=9606 GN=PHLDB3 PE=1 SV=3	85	PASTSSREGVRG
PASTSLRECVSG	sp|Q9IH63|FUS_NIPAV	347	sp|Q8N144|CXD3_HUMAN Gap junction delta-3 protein OS=Homo sapiens OX=9606 GN=GJD3 PE=1 SV=1	268	PAPASLRECGSG
GAPLADRRGERV	sp|Q9IK92|NCAP_NIPAV	110	sp|P43116|PE2R2_HUMAN Prostaglandin E2 receptor EP2 subtype OS=Homo sapiens OX=9606 GN=PTGER2 PE=2 SV=2	243	GGPGARRRGERV
EGSTAKETATVR	sp|Q997F2|V_NIPAV	288	sp|Q8TDJ6|DMXL2_HUMAN DmX-like protein 2 OS=Homo sapiens OX=9606 GN=DMXL2 PE=1 SV=2	1402	SGSTAKETVTVG
EGSTAKETATVR	sp|Q997F2|V_NIPAV	288	tr|H0YLM8|H0YLM8_HUMAN DmX-like protein 2 OS=Homo sapiens OX=9606 GN=DMXL2 PE=1 SV=2	1402	SGSTAKETVTVG
TPMEESDTLEDK	sp|Q9IK91|PHOSP_NIPAV	465	sp|Q92736|RYR2_HUMAN Ryanodine receptor 2 OS=Homo sapiens OX=9606 GN=RYR2 PE=1 SV=3	1856	TPEEESDTLEKE
TPMEESDTLEDK	sp|Q9IK91|PHOSP_NIPAV	465	tr|H7BY35|H7BY35_HUMAN Ryanodine receptor 2 OS=Homo sapiens OX=9606 GN=RYR2 PE=1 SV=2	1840	TPEEESDTLEKE
SSTDLLVGINPD	sp|Q9IK91|PHOSP_NIPAV	257	tr|H0YC29|H0YC29_HUMAN Zinc finger transcription factor Trps1 (Fragment) OS=Homo sapiens OX=9606 GN=TRPS1 PE=1 SV=2	204	SKTDLLVNDNPD
SSTDLLVGINPD	sp|Q9IK91|PHOSP_NIPAV	257	tr|E5RFF3|E5RFF3_HUMAN Zinc finger transcription factor Trps1 OS=Homo sapiens OX=9606 GN=TRPS1 PE=1 SV=1	154	SKTDLLVNDNPD
SSTDLLVGINPD	sp|Q9IK91|PHOSP_NIPAV	257	sp|Q9UHF7|TRPS1_HUMAN Zinc finger transcription factor Trps1 OS=Homo sapiens OX=9606 GN=TRPS1 PE=1 SV=2	200	SKTDLLVNDNPD
SSTDLLVGINPD	sp|Q9IK91|PHOSP_NIPAV	257	tr|E5RJ97|E5RJ97_HUMAN Zinc finger transcription factor Trps1 OS=Homo sapiens OX=9606 GN=TRPS1 PE=1 SV=1	200	SKTDLLVNDNPD
NLRDCRHLGDAG	sp|Q997F0|L_NIPAV	147	sp|Q8N1E6|FXL14_HUMAN F-box/LRR-repeat protein 14 OS=Homo sapiens OX=9606 GN=FBXL14 PE=1 SV=1	175	NLRSCRHLSDVG
GSLPDSNQLQKS	sp|Q997F0|L_NIPAV	1060	tr|A0A0A0MTM3|A0A0A0MTM3_HUMAN Cbp/p300-interacting transactivator 2 OS=Homo sapiens OX=9606 GN=CITED2 PE=1 SV=1	113	GSLPASMQLQKL
GSLPDSNQLQKS	sp|Q997F0|L_NIPAV	1060	sp|Q99967|CITE2_HUMAN Cbp/p300-interacting transactivator 2 OS=Homo sapiens OX=9606 GN=CITED2 PE=1 SV=2	108	GSLPASMQLQKL
ETMGRQLEGNSV	sp|Q9IK91|PHOSP_NIPAV	281	tr|F6QMI7|F6QMI7_HUMAN Dystonin OS=Homo sapiens OX=9606 GN=DST PE=1 SV=2	3444	ETRNRQLEGISV
ETMGRQLEGNSV	sp|Q9IK91|PHOSP_NIPAV	281	tr|E9PHM6|E9PHM6_HUMAN Dystonin OS=Homo sapiens OX=9606 GN=DST PE=1 SV=3	3404	ETRNRQLEGISV
ETMGRQLEGNSV	sp|Q9IK91|PHOSP_NIPAV	281	tr|A0A0U1RQJ2|A0A0U1RQJ2_HUMAN Dystonin OS=Homo sapiens OX=9606 GN=DST PE=1 SV=2	596	ETRNRQLEGISV
ETMGRQLEGNSV	sp|Q9IK91|PHOSP_NIPAV	281	sp|Q03001|DYST_HUMAN Dystonin OS=Homo sapiens OX=9606 GN=DST PE=1 SV=4	5490	ETRNRQLEGISV
ETMGRQLEGNSV	sp|Q9IK91|PHOSP_NIPAV	281	tr|F8W9J4|F8W9J4_HUMAN Dystonin OS=Homo sapiens OX=9606 GN=DST PE=1 SV=1	5490	ETRNRQLEGISV
SLLLLINEILSY	sp|Q997F0|L_NIPAV	2120	sp|Q9Y5W7|SNX14_HUMAN Sorting nexin-14 OS=Homo sapiens OX=9606 GN=SNX14 PE=1 SV=3	265	SLTLLIREILSG
SLLLLINEILSY	sp|Q997F0|L_NIPAV	2120	tr|D6RJG9|D6RJG9_HUMAN Sorting nexin-14 (Fragment) OS=Homo sapiens OX=9606 GN=SNX14 PE=1 SV=1	192	SLTLLIREILSG
SLLLLINEILSY	sp|Q997F0|L_NIPAV	2120	tr|D6RDH9|D6RDH9_HUMAN Sorting nexin-14 OS=Homo sapiens OX=9606 GN=SNX14 PE=1 SV=1	265	SLTLLIREILSG
SCDVSHLAVLLS	sp|Q9IK90|MATRX_NIPAV	317	sp|Q49AG3|ZBED5_HUMAN Zinc finger BED domain-containing protein 5 OS=Homo sapiens OX=9606 GN=ZBED5 PE=2 SV=2	280	SADVSGLAVLLV
GFSTTPEHGFSD	sp|Q9IK91|PHOSP_NIPAV	127	tr|Q5SZ59|Q5SZ59_HUMAN Ubiquitinyl hydrolase 1 (Fragment) OS=Homo sapiens OX=9606 GN=OTUD7B PE=1 SV=1	61	GGSRTPEKGFSD
GFSTTPEHGFSD	sp|Q9IK91|PHOSP_NIPAV	127	sp|Q6GQQ9|OTU7B_HUMAN OTU domain-containing protein 7B OS=Homo sapiens OX=9606 GN=OTUD7B PE=1 SV=1	61	GGSRTPEKGFSD
NRVVSTEPGEIS	sp|Q997F0|L_NIPAV	1038	sp|Q14686|NCOA6_HUMAN Nuclear receptor coactivator 6 OS=Homo sapiens OX=9606 GN=NCOA6 PE=1 SV=3	1227	NRPPSTEPSEIS
LVLGQVVAAILT	sp|Q9IH62|GLYCP_NIPAV	55	tr|A0A2R8Y8D9|A0A2R8Y8D9_HUMAN Proline and serine-rich protein 3 (Fragment) OS=Homo sapiens OX=9606 GN=PROSER3 PE=1 SV=1	251	GVLGQVVAARLF
DDPLVREIARDQ	sp|Q997F2|V_NIPAV	338	tr|D6RFM0|D6RFM0_HUMAN Ubiquitin-conjugating enzyme E2 D2 (Fragment) OS=Homo sapiens OX=9606 GN=UBE2D2 PE=1 SV=1	87	DDPLVPEIARIY
DDPLVREIARDQ	sp|Q997F2|V_NIPAV	338	tr|H9KV45|H9KV45_HUMAN Ubiquitin-conjugating enzyme E2 D3 OS=Homo sapiens OX=9606 GN=UBE2D3 PE=1 SV=1	110	DDPLVPEIARIY
