query	query_seqname	query_start	target_seqname	target_start	target
EVVKKIRNMTKF	sp|Q6TUQ9|A18_YMTV5	361	sp|P08254|MMP3_HUMAN Stromelysin-1 OS=Homo sapiens OX=9606 GN=MMP3 PE=1 SV=2	59	PVVKKIREMQKF
NSSQPEKVVRDL	tr|Q6TUR8|Q6TUR8_YMTV5	485	sp|Q96N67|DOCK7_HUMAN Dedicator of cytokinesis protein 7 OS=Homo sapiens OX=9606 GN=DOCK7 PE=1 SV=4	778	NSSQLEPVVRFL
NSSQPEKVVRDL	tr|Q6TUR8|Q6TUR8_YMTV5	485	tr|A0A0U1RRC1|A0A0U1RRC1_HUMAN Dedicator of cytokinesis protein 7 (Fragment) OS=Homo sapiens OX=9606 GN=DOCK7 PE=1 SV=1	51	NSSQLEPVVRFL
NSSQPEKVVRDL	tr|Q6TUR8|Q6TUR8_YMTV5	485	tr|A0A0U1RQJ5|A0A0U1RQJ5_HUMAN Dedicator of cytokinesis protein 7 (Fragment) OS=Homo sapiens OX=9606 GN=DOCK7 PE=1 SV=1	63	NSSQLEPVVRFL
PNTRNSMVNLAC	tr|Q6TUR0|Q6TUR0_YMTV5	110	tr|H7BXN7|H7BXN7_HUMAN Mucin-4 (Fragment) OS=Homo sapiens OX=9606 GN=MUC4 PE=1 SV=1	163	RNTRRSMVNTAC
PNTRNSMVNLAC	tr|Q6TUR0|Q6TUR0_YMTV5	110	tr|A0A0G2JRE6|A0A0G2JRE6_HUMAN Mucin-4 (Fragment) OS=Homo sapiens OX=9606 GN=MUC4 PE=1 SV=1	4363	RNTRRSMVNTAC
PNTRNSMVNLAC	tr|Q6TUR0|Q6TUR0_YMTV5	110	tr|A0A0G2JS42|A0A0G2JS42_HUMAN Mucin-4 (Fragment) OS=Homo sapiens OX=9606 GN=MUC4 PE=1 SV=1	4392	RNTRRSMVNTAC
PNTRNSMVNLAC	tr|Q6TUR0|Q6TUR0_YMTV5	110	tr|E7EQG8|E7EQG8_HUMAN Mucin-4 OS=Homo sapiens OX=9606 GN=MUC4 PE=1 SV=1	4419	RNTRRSMVNTAC
PNTRNSMVNLAC	tr|Q6TUR0|Q6TUR0_YMTV5	110	tr|A0A0G2JS91|A0A0G2JS91_HUMAN Mucin-4 (Fragment) OS=Homo sapiens OX=9606 GN=MUC4 PE=1 SV=1	4393	RNTRRSMVNTAC
PNTRNSMVNLAC	tr|Q6TUR0|Q6TUR0_YMTV5	110	tr|H0Y2Y1|H0Y2Y1_HUMAN Mucin-4 (Fragment) OS=Homo sapiens OX=9606 GN=MUC4 PE=1 SV=1	133	RNTRRSMVNTAC
PNTRNSMVNLAC	tr|Q6TUR0|Q6TUR0_YMTV5	110	tr|A0A0G2JRW3|A0A0G2JRW3_HUMAN Mucin-4 (Fragment) OS=Homo sapiens OX=9606 GN=MUC4 PE=1 SV=1	4362	RNTRRSMVNTAC
PNTRNSMVNLAC	tr|Q6TUR0|Q6TUR0_YMTV5	110	tr|A0A0G2JSE4|A0A0G2JSE4_HUMAN Mucin-4 (Fragment) OS=Homo sapiens OX=9606 GN=MUC4 PE=1 SV=1	156	RNTRRSMVNTAC
PNTRNSMVNLAC	tr|Q6TUR0|Q6TUR0_YMTV5	110	tr|A0A0G2JRS2|A0A0G2JRS2_HUMAN Mucin-4 OS=Homo sapiens OX=9606 GN=MUC4 PE=1 SV=1	6395	RNTRRSMVNTAC
PNTRNSMVNLAC	tr|Q6TUR0|Q6TUR0_YMTV5	110	tr|A0A0G2JRC8|A0A0G2JRC8_HUMAN Mucin-4 (Fragment) OS=Homo sapiens OX=9606 GN=MUC4 PE=1 SV=1	126	RNTRRSMVNTAC
PNTRNSMVNLAC	tr|Q6TUR0|Q6TUR0_YMTV5	110	tr|E7EW47|E7EW47_HUMAN Mucin-4 OS=Homo sapiens OX=9606 GN=MUC4 PE=1 SV=1	4389	RNTRRSMVNTAC
PNTRNSMVNLAC	tr|Q6TUR0|Q6TUR0_YMTV5	110	tr|A0A0G2JR46|A0A0G2JR46_HUMAN Mucin-4 OS=Homo sapiens OX=9606 GN=MUC4 PE=1 SV=1	6425	RNTRRSMVNTAC
MLYFEVFIVVVI	tr|Q6TUU9|Q6TUU9_YMTV5	31	tr|F6RH32|F6RH32_HUMAN Voltage-dependent N-type calcium channel subunit alpha OS=Homo sapiens OX=9606 GN=CACNA1B PE=1 SV=1	1150	MRYFEVVILVVI
MLYFEVFIVVVI	tr|Q6TUU9|Q6TUU9_YMTV5	31	sp|Q00975|CAC1B_HUMAN Voltage-dependent N-type calcium channel subunit alpha-1B OS=Homo sapiens OX=9606 GN=CACNA1B PE=1 SV=1	1149	MRYFEVVILVVI
MLYFEVFIVVVI	tr|Q6TUU9|Q6TUU9_YMTV5	31	tr|B1AQK6|B1AQK6_HUMAN Voltage-dependent N-type calcium channel subunit alpha OS=Homo sapiens OX=9606 GN=CACNA1B PE=1 SV=1	1149	MRYFEVVILVVI
MLYFEVFIVVVI	tr|Q6TUU9|Q6TUU9_YMTV5	31	tr|B1AQK7|B1AQK7_HUMAN Voltage-dependent N-type calcium channel subunit alpha OS=Homo sapiens OX=9606 GN=CACNA1B PE=1 SV=1	1150	MRYFEVVILVVI
MLYFEVFIVVVI	tr|Q6TUU9|Q6TUU9_YMTV5	31	tr|E9PDR3|E9PDR3_HUMAN Voltage-dependent N-type calcium channel subunit alpha OS=Homo sapiens OX=9606 GN=CACNA1B PE=1 SV=3	1149	MRYFEVVILVVI
LVGYFKTLDLDI	tr|Q6TUY5|Q6TUY5_YMTV5	208	tr|D6RDM4|D6RDM4_HUMAN Interleukin-7 receptor subunit alpha OS=Homo sapiens OX=9606 GN=IL7R PE=1 SV=1	138	LLGYLKTLCLDI
EDVTEELFPSEA	tr|Q6TUT9|Q6TUT9_YMTV5	32	sp|O15245|S22A1_HUMAN Solute carrier family 22 member 1 OS=Homo sapiens OX=9606 GN=SLC22A1 PE=1 SV=2	324	EDVTEKLSPSFA
NSSDNLDIQSNI	tr|Q6TUP6|Q6TUP6_YMTV5	116	tr|H0Y8M0|H0Y8M0_HUMAN TFIIA-alpha and beta-like factor (Fragment) OS=Homo sapiens OX=9606 GN=GTF2A1L PE=4 SV=1	48	NSSDNEDPQVNI
NSSDNLDIQSNI	tr|Q6TUP6|Q6TUP6_YMTV5	116	tr|A0A0A6YYG5|A0A0A6YYG5_HUMAN Protein STON1-GTF2A1L OS=Homo sapiens OX=9606 GN=STON1-GTF2A1L PE=3 SV=1	1056	NSSDNEDPQVNI
NSSDNLDIQSNI	tr|Q6TUP6|Q6TUP6_YMTV5	116	sp|Q9UNN4|TF2AY_HUMAN TFIIA-alpha and beta-like factor OS=Homo sapiens OX=9606 GN=GTF2A1L PE=1 SV=2	399	NSSDNEDPQVNI
NSSDNLDIQSNI	tr|Q6TUP6|Q6TUP6_YMTV5	116	tr|Q53S48|Q53S48_HUMAN STON1-GTF2A1L readthrough OS=Homo sapiens OX=9606 GN=STON1-GTF2A1L PE=3 SV=1	1103	NSSDNEDPQVNI
STATTDTRSVES	sp|Q9QB92|MCES_YMTV5	265	sp|Q9BY15|AGRE3_HUMAN Adhesion G protein-coupled receptor E3 OS=Homo sapiens OX=9606 GN=ADGRE3 PE=2 SV=2	159	STATTILRDVES
SKELRTNLISSI	tr|Q6TUW3|Q6TUW3_YMTV5	507	tr|E9PJY3|E9PJY3_HUMAN Centrosomal protein of 295 kDa (Fragment) OS=Homo sapiens OX=9606 GN=CEP295 PE=1 SV=1	11	SKEEETNIISSI
SKELRTNLISSI	tr|Q6TUW3|Q6TUW3_YMTV5	507	sp|Q9C0D2|CE295_HUMAN Centrosomal protein of 295 kDa OS=Homo sapiens OX=9606 GN=CEP295 PE=1 SV=4	1999	SKEEETNIISSI
SKYTSPTSLEVL	tr|Q6TUT2|Q6TUT2_YMTV5	629	sp|O00472|ELL2_HUMAN RNA polymerase II elongation factor ELL2 OS=Homo sapiens OX=9606 GN=ELL2 PE=1 SV=2	427	DKYTSRTSLETL
FEEVLALGGRIE	tr|Q6TUT0|Q6TUT0_YMTV5	111	sp|Q8IYX7|SAXO1_HUMAN Stabilizer of axonemal microtubules 1 OS=Homo sapiens OX=9606 GN=SAXO1 PE=1 SV=2	432	FEEVDALGHRIY
FEEVLALGGRIE	tr|Q6TUT0|Q6TUT0_YMTV5	111	tr|F6S232|F6S232_HUMAN Stabilizer of axonemal microtubules 1 OS=Homo sapiens OX=9606 GN=SAXO1 PE=1 SV=2	367	FEEVDALGHRIY
TKERRYLKITER	tr|Q6TV04|Q6TV04_YMTV5	140	sp|Q9Y216|MTMR7_HUMAN Myotubularin-related protein 7 OS=Homo sapiens OX=9606 GN=MTMR7 PE=1 SV=3	444	QKERRELKIQER
LEILTIHKKNMD	tr|Q6TUQ3|Q6TUQ3_YMTV5	771	sp|P55072|TERA_HUMAN Transitional endoplasmic reticulum ATPase OS=Homo sapiens OX=9606 GN=VCP PE=1 SV=4	378	LEILQIHTKNMK
EELVKALTYLND	tr|Q6TUX7|Q6TUX7_YMTV5	19	tr|A0A6Q8PG59|A0A6Q8PG59_HUMAN Polyphosphoinositide phosphatase OS=Homo sapiens OX=9606 GN=FIG4 PE=1 SV=1	392	EELVAAVTYLNQ
EELVKALTYLND	tr|Q6TUX7|Q6TUX7_YMTV5	19	tr|A0A6Q8PFJ3|A0A6Q8PFJ3_HUMAN Polyphosphoinositide phosphatase OS=Homo sapiens OX=9606 GN=FIG4 PE=1 SV=1	392	EELVAAVTYLNQ
EELVKALTYLND	tr|Q6TUX7|Q6TUX7_YMTV5	19	tr|A0A6Q8PGC1|A0A6Q8PGC1_HUMAN Polyphosphoinositide phosphatase (Fragment) OS=Homo sapiens OX=9606 GN=FIG4 PE=1 SV=1	82	EELVAAVTYLNQ
EELVKALTYLND	tr|Q6TUX7|Q6TUX7_YMTV5	19	tr|A0A6Q8PHP5|A0A6Q8PHP5_HUMAN Polyphosphoinositide phosphatase OS=Homo sapiens OX=9606 GN=FIG4 PE=1 SV=1	392	EELVAAVTYLNQ
EELVKALTYLND	tr|Q6TUX7|Q6TUX7_YMTV5	19	tr|A0A6Q8PF70|A0A6Q8PF70_HUMAN Polyphosphoinositide phosphatase OS=Homo sapiens OX=9606 GN=FIG4 PE=1 SV=1	392	EELVAAVTYLNQ
EELVKALTYLND	tr|Q6TUX7|Q6TUX7_YMTV5	19	tr|A0A6Q8PHC7|A0A6Q8PHC7_HUMAN Polyphosphoinositide phosphatase OS=Homo sapiens OX=9606 GN=FIG4 PE=1 SV=1	349	EELVAAVTYLNQ
EELVKALTYLND	tr|Q6TUX7|Q6TUX7_YMTV5	19	tr|A0A6Q8PF62|A0A6Q8PF62_HUMAN Polyphosphoinositide phosphatase OS=Homo sapiens OX=9606 GN=FIG4 PE=1 SV=1	390	EELVAAVTYLNQ
EELVKALTYLND	tr|Q6TUX7|Q6TUX7_YMTV5	19	tr|A0A6Q8PGW5|A0A6Q8PGW5_HUMAN Polyphosphoinositide phosphatase OS=Homo sapiens OX=9606 GN=FIG4 PE=1 SV=1	315	EELVAAVTYLNQ
EELVKALTYLND	tr|Q6TUX7|Q6TUX7_YMTV5	19	tr|A0A6Q8PGP4|A0A6Q8PGP4_HUMAN Polyphosphoinositide phosphatase OS=Homo sapiens OX=9606 GN=FIG4 PE=1 SV=1	261	EELVAAVTYLNQ
EELVKALTYLND	tr|Q6TUX7|Q6TUX7_YMTV5	19	sp|Q92562|FIG4_HUMAN Polyphosphoinositide phosphatase OS=Homo sapiens OX=9606 GN=FIG4 PE=1 SV=1	392	EELVAAVTYLNQ
EELVKALTYLND	tr|Q6TUX7|Q6TUX7_YMTV5	19	tr|A0A6Q8PF27|A0A6Q8PF27_HUMAN Polyphosphoinositide phosphatase OS=Homo sapiens OX=9606 GN=FIG4 PE=1 SV=1	277	EELVAAVTYLNQ
EELVKALTYLND	tr|Q6TUX7|Q6TUX7_YMTV5	19	tr|A0A6Q8PHH5|A0A6Q8PHH5_HUMAN Polyphosphoinositide phosphatase OS=Homo sapiens OX=9606 GN=FIG4 PE=1 SV=1	398	EELVAAVTYLNQ
EELVKALTYLND	tr|Q6TUX7|Q6TUX7_YMTV5	19	tr|A0A6Q8PGY7|A0A6Q8PGY7_HUMAN Polyphosphoinositide phosphatase OS=Homo sapiens OX=9606 GN=FIG4 PE=1 SV=1	392	EELVAAVTYLNQ
EELVKALTYLND	tr|Q6TUX7|Q6TUX7_YMTV5	19	tr|A0A6Q8PGW0|A0A6Q8PGW0_HUMAN Polyphosphoinositide phosphatase OS=Homo sapiens OX=9606 GN=FIG4 PE=1 SV=1	315	EELVAAVTYLNQ
EELVKALTYLND	tr|Q6TUX7|Q6TUX7_YMTV5	19	tr|A0A6Q8PHA1|A0A6Q8PHA1_HUMAN Polyphosphoinositide phosphatase OS=Homo sapiens OX=9606 GN=FIG4 PE=1 SV=1	392	EELVAAVTYLNQ
EELVKALTYLND	tr|Q6TUX7|Q6TUX7_YMTV5	19	tr|A0A6Q8PGB4|A0A6Q8PGB4_HUMAN Polyphosphoinositide phosphatase OS=Homo sapiens OX=9606 GN=FIG4 PE=1 SV=1	392	EELVAAVTYLNQ
EELVKALTYLND	tr|Q6TUX7|Q6TUX7_YMTV5	19	tr|A0A6Q8PGY4|A0A6Q8PGY4_HUMAN Polyphosphoinositide phosphatase OS=Homo sapiens OX=9606 GN=FIG4 PE=1 SV=1	349	EELVAAVTYLNQ
EELVKALTYLND	tr|Q6TUX7|Q6TUX7_YMTV5	19	tr|A0A6Q8PHK3|A0A6Q8PHK3_HUMAN Polyphosphoinositide phosphatase OS=Homo sapiens OX=9606 GN=FIG4 PE=1 SV=1	392	EELVAAVTYLNQ
VRSDDEVGSAKE	tr|Q6TUU4|Q6TUU4_YMTV5	27	sp|Q6ULP2|AFTIN_HUMAN Aftiphilin OS=Homo sapiens OX=9606 GN=AFTPH PE=1 SV=3	374	KTSDDEVGSPKE
VRSDDEVGSAKE	tr|Q6TUU4|Q6TUU4_YMTV5	27	tr|B8ZZI9|B8ZZI9_HUMAN Aftiphilin (Fragment) OS=Homo sapiens OX=9606 GN=AFTPH PE=1 SV=2	29	KTSDDEVGSPKE
RNANLSTNKVLC	sp|Q9QB93|NTP1_YMTV5	170	tr|Q5SR50|Q5SR50_HUMAN Phosphatidylinositol-4,5-bisphosphate 3-kinase OS=Homo sapiens OX=9606 GN=PIK3CD PE=1 SV=2	38	RNANLSTIKQLL
RNANLSTNKVLC	sp|Q9QB93|NTP1_YMTV5	170	tr|F8W9P4|F8W9P4_HUMAN Phosphatidylinositol-4,5-bisphosphate 3-kinase OS=Homo sapiens OX=9606 GN=PIK3CD PE=1 SV=1	38	RNANLSTIKQLL
RNANLSTNKVLC	sp|Q9QB93|NTP1_YMTV5	170	sp|O00329|PK3CD_HUMAN Phosphatidylinositol 4,5-bisphosphate 3-kinase catalytic subunit delta isoform OS=Homo sapiens OX=9606 GN=PIK3CD PE=1 SV=2	38	RNANLSTIKQLL
FKKEALKSYKNL	tr|Q6TUX3|Q6TUX3_YMTV5	839	sp|A6NF36|CC182_HUMAN Coiled-coil domain-containing protein 182 OS=Homo sapiens OX=9606 GN=CCDC182 PE=2 SV=1	65	FKKEALKSIHYL
TNNFSFNTYNRL	tr|Q6TUR2|Q6TUR2_YMTV5	31	tr|A0A087WYZ9|A0A087WYZ9_HUMAN Histone-lysine N-methyltransferase SETDB2 OS=Homo sapiens OX=9606 GN=SETDB2 PE=1 SV=1	219	TDNFSFNTYVQL
TNNFSFNTYNRL	tr|Q6TUR2|Q6TUR2_YMTV5	31	sp|Q96T68|SETB2_HUMAN Histone-lysine N-methyltransferase SETDB2 OS=Homo sapiens OX=9606 GN=SETDB2 PE=1 SV=2	219	TDNFSFNTYVQL
TNNFSFNTYNRL	tr|Q6TUR2|Q6TUR2_YMTV5	31	tr|X6R383|X6R383_HUMAN Histone-lysine N-methyltransferase SETDB2 OS=Homo sapiens OX=9606 GN=SETDB2 PE=1 SV=1	207	TDNFSFNTYVQL
TIILLNDPEYKI	tr|Q6TUT6|Q6TUT6_YMTV5	610	tr|H0YIA9|H0YIA9_HUMAN Integrator complex subunit 13 (Fragment) OS=Homo sapiens OX=9606 GN=INTS13 PE=1 SV=1	79	TNFLLNDPRYKI
VSNKEVKSRKMK	tr|Q6TUN8|Q6TUN8_YMTV5	53	tr|E9PAV9|E9PAV9_HUMAN G patch domain-containing protein 4 OS=Homo sapiens OX=9606 GN=GPATCH4 PE=1 SV=1	7	PSNDEVKSRGMK
FKIKKKSANTSK	tr|Q6TUV1|Q6TUV1_YMTV5	231	sp|Q8WXD0|RXFP2_HUMAN Relaxin receptor 2 OS=Homo sapiens OX=9606 GN=RXFP2 PE=1 SV=1	715	FKIKKKSLSTSI
GDLIGILRVLEK	tr|Q6TUW3|Q6TUW3_YMTV5	34	sp|Q8TC07|TBC15_HUMAN TBC1 domain family member 15 OS=Homo sapiens OX=9606 GN=TBC1D15 PE=1 SV=2	32	GLISGILRVLEK
GDLIGILRVLEK	tr|Q6TUW3|Q6TUW3_YMTV5	34	tr|F8WCB5|F8WCB5_HUMAN TBC1 domain family member 15 OS=Homo sapiens OX=9606 GN=TBC1D15 PE=1 SV=1	32	GLISGILRVLEK
GDLIGILRVLEK	tr|Q6TUW3|Q6TUW3_YMTV5	34	tr|F8WDJ1|F8WDJ1_HUMAN TBC1 domain family member 15 OS=Homo sapiens OX=9606 GN=TBC1D15 PE=1 SV=1	32	GLISGILRVLEK
GDLIGILRVLEK	tr|Q6TUW3|Q6TUW3_YMTV5	34	tr|F8WF35|F8WF35_HUMAN TBC1 domain family member 15 OS=Homo sapiens OX=9606 GN=TBC1D15 PE=1 SV=1	32	GLISGILRVLEK
PSKKKIIIIEFG	tr|Q6TUT6|Q6TUT6_YMTV5	585	tr|H7C0N3|H7C0N3_HUMAN Cortactin-binding protein 2 (Fragment) OS=Homo sapiens OX=9606 GN=CTTNBP2 PE=1 SV=1	173	PSKKKIIIILEN
PSKKKIIIIEFG	tr|Q6TUT6|Q6TUT6_YMTV5	585	tr|H0Y448|H0Y448_HUMAN Cortactin-binding protein 2 (Fragment) OS=Homo sapiens OX=9606 GN=CTTNBP2 PE=1 SV=1	676	PSKKKIIIILEN
PSKKKIIIIEFG	tr|Q6TUT6|Q6TUT6_YMTV5	585	sp|Q8WZ74|CTTB2_HUMAN Cortactin-binding protein 2 OS=Homo sapiens OX=9606 GN=CTTNBP2 PE=1 SV=1	1188	PSKKKIIIILEN
SGTSAISSSDDW	tr|Q6TV05|Q6TV05_YMTV5	132	tr|H0YDN9|H0YDN9_HUMAN ADP-ribosylation factor GTPase-activating protein 2 (Fragment) OS=Homo sapiens OX=9606 GN=ARFGAP2 PE=1 SV=1	177	SGSSAISSSDLF
SGTSAISSSDDW	tr|Q6TV05|Q6TV05_YMTV5	132	sp|Q8N6H7|ARFG2_HUMAN ADP-ribosylation factor GTPase-activating protein 2 OS=Homo sapiens OX=9606 GN=ARFGAP2 PE=1 SV=1	455	SGSSAISSSDLF
SGTSAISSSDDW	tr|Q6TV05|Q6TV05_YMTV5	132	tr|A0A0D9SF70|A0A0D9SF70_HUMAN ADP-ribosylation factor GTPase-activating protein 2 OS=Homo sapiens OX=9606 GN=ARFGAP2 PE=1 SV=1	319	SGSSAISSSDLF
SGTSAISSSDDW	tr|Q6TV05|Q6TV05_YMTV5	132	tr|G5E9L0|G5E9L0_HUMAN ADP-ribosylation factor GTPase-activating protein 2 OS=Homo sapiens OX=9606 GN=ARFGAP2 PE=1 SV=2	427	SGSSAISSSDLF
PSSHKTSEDPKY	tr|Q6TUT2|Q6TUT2_YMTV5	20	sp|Q6B0B8|TIGD3_HUMAN Tigger transposable element-derived protein 3 OS=Homo sapiens OX=9606 GN=TIGD3 PE=1 SV=1	372	PSSHKTSEMPPV
VLNSTEDAEVLK	tr|Q6TUY2|Q6TUY2_YMTV5	133	sp|Q9HAZ2|PRD16_HUMAN Histone-lysine N-methyltransferase PRDM16 OS=Homo sapiens OX=9606 GN=PRDM16 PE=1 SV=3	1211	VLNSTLDSEALK
VLNSTEDAEVLK	tr|Q6TUY2|Q6TUY2_YMTV5	133	tr|H0YA13|H0YA13_HUMAN Histone-lysine N-methyltransferase PRDM16 (Fragment) OS=Homo sapiens OX=9606 GN=PRDM16 PE=1 SV=1	1019	VLNSTLDSEALK
VHITKKKLSKSM	tr|Q6TUX8|Q6TUX8_YMTV5	38	sp|Q9NPB8|GPCP1_HUMAN Glycerophosphocholine phosphodiesterase GPCPD1 OS=Homo sapiens OX=9606 GN=GPCPD1 PE=1 SV=2	145	VSITKKKLKKSR
ETEACVSGSSLV	tr|Q6TUM3|Q6TUM3_YMTV5	126	sp|Q92619|HMHA1_HUMAN Rho GTPase-activating protein 45 OS=Homo sapiens OX=9606 GN=ARHGAP45 PE=1 SV=2	943	PTEATVSLSSLV
ETEACVSGSSLV	tr|Q6TUM3|Q6TUM3_YMTV5	126	tr|K7EM85|K7EM85_HUMAN Rho GTPase-activating protein 45 OS=Homo sapiens OX=9606 GN=ARHGAP45 PE=1 SV=1	970	PTEATVSLSSLV
ETEACVSGSSLV	tr|Q6TUM3|Q6TUM3_YMTV5	126	tr|F5H1R4|F5H1R4_HUMAN Rho GTPase-activating protein 45 OS=Homo sapiens OX=9606 GN=ARHGAP45 PE=1 SV=1	826	PTEATVSLSSLV
ETEACVSGSSLV	tr|Q6TUM3|Q6TUM3_YMTV5	126	tr|K7ES92|K7ES92_HUMAN Rho GTPase-activating protein 45 OS=Homo sapiens OX=9606 GN=ARHGAP45 PE=1 SV=1	578	PTEATVSLSSLV
ETEACVSGSSLV	tr|Q6TUM3|Q6TUM3_YMTV5	126	tr|K7ES98|K7ES98_HUMAN Rho GTPase-activating protein 45 OS=Homo sapiens OX=9606 GN=ARHGAP45 PE=1 SV=1	947	PTEATVSLSSLV
KKSYDLNLKNKF	tr|Q6TUZ9|Q6TUZ9_YMTV5	142	tr|A0A0A0MQW8|A0A0A0MQW8_HUMAN G protein-coupled receptor 161, isoform CRA_b OS=Homo sapiens OX=9606 GN=GPR161 PE=1 SV=1	71	KKSYLLTLSNKF
KKSYDLNLKNKF	tr|Q6TUZ9|Q6TUZ9_YMTV5	142	sp|Q8N6U8|GP161_HUMAN G-protein coupled receptor 161 OS=Homo sapiens OX=9606 GN=GPR161 PE=1 SV=1	54	KKSYLLTLSNKF
YFAPVDLKLKLI	tr|Q6TUZ9|Q6TUZ9_YMTV5	617	sp|Q9NVH2|INT7_HUMAN Integrator complex subunit 7 OS=Homo sapiens OX=9606 GN=INTS7 PE=1 SV=1	187	LATPVDLKLKLI
VIGMNFDVTVTP	tr|Q6TUX5|Q6TUX5_YMTV5	132	sp|Q8N475|FSTL5_HUMAN Follistatin-related protein 5 OS=Homo sapiens OX=9606 GN=FSTL5 PE=2 SV=2	686	VIGFNSDVTGTP
DLGTGNVNKITK	tr|Q6TUQ6|Q6TUQ6_YMTV5	97	sp|P11021|BIP_HUMAN Endoplasmic reticulum chaperone BiP OS=Homo sapiens OX=9606 GN=HSPA5 PE=1 SV=2	515	DKGTGNKNKITI
DLGTGNVNKITK	tr|Q6TUQ6|Q6TUQ6_YMTV5	97	sp|P83876|TXN4A_HUMAN Thioredoxin-like protein 4A OS=Homo sapiens OX=9606 GN=TXNL4A PE=1 SV=1	93	DLGTGNNNKINW
DLGTGNVNKITK	tr|Q6TUQ6|Q6TUQ6_YMTV5	97	tr|K7ESL1|K7ESL1_HUMAN Thioredoxin-like protein 4A OS=Homo sapiens OX=9606 GN=TXNL4A PE=1 SV=1	22	DLGTGNNNKINW
KLDKKLNEILRK	tr|Q6TUX6|Q6TUX6_YMTV5	97	tr|G3V5E2|G3V5E2_HUMAN Sec1 family domain-containing protein 1 (Fragment) OS=Homo sapiens OX=9606 GN=SCFD1 PE=1 SV=1	65	KLDKKLRENLRD
KLDKKLNEILRK	tr|Q6TUX6|Q6TUX6_YMTV5	97	sp|Q8WVM8|SCFD1_HUMAN Sec1 family domain-containing protein 1 OS=Homo sapiens OX=9606 GN=SCFD1 PE=1 SV=4	224	KLDKKLRENLRD
KLDKKLNEILRK	tr|Q6TUX6|Q6TUX6_YMTV5	97	tr|H0YJY1|H0YJY1_HUMAN Sec1 family domain-containing protein 1 (Fragment) OS=Homo sapiens OX=9606 GN=SCFD1 PE=1 SV=1	79	KLDKKLRENLRD
FVQRNANLSTNK	sp|Q9QB93|NTP1_YMTV5	167	tr|Q5SR50|Q5SR50_HUMAN Phosphatidylinositol-4,5-bisphosphate 3-kinase OS=Homo sapiens OX=9606 GN=PIK3CD PE=1 SV=2	35	PVSRNANLSTIK
FVQRNANLSTNK	sp|Q9QB93|NTP1_YMTV5	167	tr|F8W9P4|F8W9P4_HUMAN Phosphatidylinositol-4,5-bisphosphate 3-kinase OS=Homo sapiens OX=9606 GN=PIK3CD PE=1 SV=1	35	PVSRNANLSTIK
FVQRNANLSTNK	sp|Q9QB93|NTP1_YMTV5	167	sp|O00329|PK3CD_HUMAN Phosphatidylinositol 4,5-bisphosphate 3-kinase catalytic subunit delta isoform OS=Homo sapiens OX=9606 GN=PIK3CD PE=1 SV=2	35	PVSRNANLSTIK
KINELFNFIDES	tr|Q6TUQ1|Q6TUQ1_YMTV5	208	tr|A0A494C1Q3|A0A494C1Q3_HUMAN Coiled-coil domain-containing protein 39 OS=Homo sapiens OX=9606 GN=CCDC39 PE=1 SV=1	468	KINELNLFIDRS
KINELFNFIDES	tr|Q6TUQ1|Q6TUQ1_YMTV5	208	sp|Q9UFE4|CCD39_HUMAN Coiled-coil domain-containing protein 39 OS=Homo sapiens OX=9606 GN=CCDC39 PE=2 SV=3	532	KINELNLFIDRS
KVHITKKKLSKS	tr|Q6TUX8|Q6TUX8_YMTV5	37	sp|Q9NPB8|GPCP1_HUMAN Glycerophosphocholine phosphodiesterase GPCPD1 OS=Homo sapiens OX=9606 GN=GPCPD1 PE=1 SV=2	144	PVSITKKKLKKS
IFRLLIINLYEV	tr|Q6TUP1|Q6TUP1_YMTV5	226	sp|Q9NX52|RHBL2_HUMAN Rhomboid-related protein 2 OS=Homo sapiens OX=9606 GN=RHBDL2 PE=1 SV=2	214	IFRLLIIILIIV
HGKNVTIAVVVF	tr|Q6TUN5|Q6TUN5_YMTV5	154	tr|A0A0J9YYI4|A0A0J9YYI4_HUMAN Serine incorporator 5 OS=Homo sapiens OX=9606 GN=SERINC5 PE=1 SV=1	289	HGKNVTICVPDF
HGKNVTIAVVVF	tr|Q6TUN5|Q6TUN5_YMTV5	154	sp|Q86VE9|SERC5_HUMAN Serine incorporator 5 OS=Homo sapiens OX=9606 GN=SERINC5 PE=2 SV=1	291	HGKNVTICVPDF
GGNVSAFIVLPI	tr|Q6TUV5|Q6TUV5_YMTV5	42	tr|B1ANV5|B1ANV5_HUMAN Cytosolic carboxypeptidase 6 OS=Homo sapiens OX=9606 GN=AGBL4 PE=1 SV=1	22	GGNVSKYIVLPT
GGNVSAFIVLPI	tr|Q6TUV5|Q6TUV5_YMTV5	42	sp|Q5VU57|CBPC6_HUMAN Cytosolic carboxypeptidase 6 OS=Homo sapiens OX=9606 GN=AGBL4 PE=2 SV=3	22	GGNVSKYIVLPT
GGNVSAFIVLPI	tr|Q6TUV5|Q6TUV5_YMTV5	42	tr|B1AMW3|B1AMW3_HUMAN Cytosolic carboxypeptidase 6 OS=Homo sapiens OX=9606 GN=AGBL4 PE=1 SV=1	22	GGNVSKYIVLPT
DDTVFLTYTVVH	tr|Q6TUM3|Q6TUM3_YMTV5	317	sp|Q96HR9|REEP6_HUMAN Receptor expression-enhancing protein 6 OS=Homo sapiens OX=9606 GN=REEP6 PE=1 SV=2	81	DDTVWLTYWVVY
DDTVFLTYTVVH	tr|Q6TUM3|Q6TUM3_YMTV5	317	tr|A8MXN1|A8MXN1_HUMAN Receptor expression-enhancing protein (Fragment) OS=Homo sapiens OX=9606 GN=REEP6 PE=1 SV=2	9	DDTVWLTYWVVY
ELLVLKLNRKVI	tr|Q6TUX3|Q6TUX3_YMTV5	241	sp|Q13641|TPBG_HUMAN Trophoblast glycoprotein OS=Homo sapiens OX=9606 GN=TPBG PE=1 SV=1	370	FLLVLYLNRKGI
ELLVLKLNRKVI	tr|Q6TUX3|Q6TUX3_YMTV5	241	tr|F8VYZ5|F8VYZ5_HUMAN Leucine-rich repeats and immunoglobulin-like domains protein 3 (Fragment) OS=Homo sapiens OX=9606 GN=LRIG3 PE=1 SV=1	100	TLLVLKLNRNRI
ELLVLKLNRKVI	tr|Q6TUX3|Q6TUX3_YMTV5	241	tr|C9K080|C9K080_HUMAN Leucine-rich repeats and immunoglobulin-like domains protein 3 OS=Homo sapiens OX=9606 GN=LRIG3 PE=1 SV=2	193	TLLVLKLNRNRI
ELLVLKLNRKVI	tr|Q6TUX3|Q6TUX3_YMTV5	241	sp|Q6UXM1|LRIG3_HUMAN Leucine-rich repeats and immunoglobulin-like domains protein 3 OS=Homo sapiens OX=9606 GN=LRIG3 PE=1 SV=1	193	TLLVLKLNRNRI
TTIIILVLMLIM	tr|Q6TUY4|Q6TUY4_YMTV5	5	tr|D6RA09|D6RA09_HUMAN MARVEL domain-containing protein 2 (Fragment) OS=Homo sapiens OX=9606 GN=MARVELD2 PE=1 SV=1	266	TTIIILVLGMSM
TTIIILVLMLIM	tr|Q6TUY4|Q6TUY4_YMTV5	5	tr|A0A0G2JN23|A0A0G2JN23_HUMAN MARVEL domain-containing protein 2 (Fragment) OS=Homo sapiens OX=9606 GN=MARVELD2 PE=1 SV=1	266	TTIIILVLGMSM
TTIIILVLMLIM	tr|Q6TUY4|Q6TUY4_YMTV5	5	sp|Q8N4S9|MALD2_HUMAN MARVEL domain-containing protein 2 OS=Homo sapiens OX=9606 GN=MARVELD2 PE=1 SV=2	266	TTIIILVLGMSM
VREEEDKHLIEN	sp|Q6TUY0|PAP1_YMTV5	233	sp|P22459|KCNA4_HUMAN Potassium voltage-gated channel subfamily A member 4 OS=Homo sapiens OX=9606 GN=KCNA4 PE=1 SV=2	276	VREEEDRALPEN
MISLSMFLLLII	tr|Q6TV00|Q6TV00_YMTV5	160	sp|Q8NGD4|OR4K1_HUMAN Olfactory receptor 4K1 OS=Homo sapiens OX=9606 GN=OR4K1 PE=2 SV=1	205	LISLSCFLALII
AIVVVALIISAV	tr|Q6TUV3|Q6TUV3_YMTV5	188	tr|B7Z4W8|B7Z4W8_HUMAN GRAM domain-containing protein 2B OS=Homo sapiens OX=9606 GN=GRAMD2B PE=1 SV=1	242	AIVVCALIISTF
AIVVVALIISAV	tr|Q6TUV3|Q6TUV3_YMTV5	188	sp|Q96HH9|GRM2B_HUMAN GRAM domain-containing protein 2B OS=Homo sapiens OX=9606 GN=GRAMD2B PE=1 SV=1	351	AIVVCALIISTF
AIVVVALIISAV	tr|Q6TUV3|Q6TUV3_YMTV5	188	tr|E9PD09|E9PD09_HUMAN GRAM domain-containing protein 2B OS=Homo sapiens OX=9606 GN=GRAMD2B PE=1 SV=1	329	AIVVCALIISTF
FSSLKSETLDIL	tr|Q6TUS1|Q6TUS1_YMTV5	122	sp|Q5KSL6|DGKK_HUMAN Diacylglycerol kinase kappa OS=Homo sapiens OX=9606 GN=DGKK PE=1 SV=1	827	ISSLKSEDLDNL
LYLNLDDETKQL	tr|Q6TUY6|Q6TUY6_YMTV5	404	sp|Q5T5P2|SKT_HUMAN Sickle tail protein homolog OS=Homo sapiens OX=9606 GN=KIAA1217 PE=1 SV=2	187	LYLQYGDETKQL
LYLNLDDETKQL	tr|Q6TUY6|Q6TUY6_YMTV5	404	tr|Q5T5P0|Q5T5P0_HUMAN Sickle tail protein homolog (Fragment) OS=Homo sapiens OX=9606 GN=KIAA1217 PE=1 SV=1	37	LYLQYGDETKQL
LYLNLDDETKQL	tr|Q6TUY6|Q6TUY6_YMTV5	404	tr|Q5T5P1|Q5T5P1_HUMAN Sickle tail protein homolog (Fragment) OS=Homo sapiens OX=9606 GN=KIAA1217 PE=1 SV=2	187	LYLQYGDETKQL
YLILNYITVVTV	tr|Q6TUP1|Q6TUP1_YMTV5	108	tr|F2Z2Z2|F2Z2Z2_HUMAN Probable ATP-dependent RNA helicase DHX35 OS=Homo sapiens OX=9606 GN=DHX35 PE=1 SV=2	65	YLIENYQTVVIV
YLILNYITVVTV	tr|Q6TUP1|Q6TUP1_YMTV5	108	sp|Q9H5Z1|DHX35_HUMAN Probable ATP-dependent RNA helicase DHX35 OS=Homo sapiens OX=9606 GN=DHX35 PE=1 SV=2	65	YLIENYQTVVIV
YLILNYITVVTV	tr|Q6TUP1|Q6TUP1_YMTV5	108	tr|Q5THR1|Q5THR1_HUMAN RNA helicase OS=Homo sapiens OX=9606 GN=DHX35 PE=1 SV=1	65	YLIENYQTVVIV
IILETSPRLIIE	tr|Q6TUU4|Q6TUU4_YMTV5	421	tr|F8W7W4|F8W7W4_HUMAN Androglobin (Fragment) OS=Homo sapiens OX=9606 GN=ADGB PE=1 SV=1	245	TILETSPRLIRK
IILETSPRLIIE	tr|Q6TUU4|Q6TUU4_YMTV5	421	sp|Q8N7X0|ADGB_HUMAN Androglobin OS=Homo sapiens OX=9606 GN=ADGB PE=2 SV=3	1522	TILETSPRLIRK
IILETSPRLIIE	tr|Q6TUU4|Q6TUU4_YMTV5	421	tr|H0Y334|H0Y334_HUMAN Androglobin (Fragment) OS=Homo sapiens OX=9606 GN=ADGB PE=1 SV=1	480	TILETSPRLIRK
SIYQVNKLYDTG	tr|Q6TUW4|Q6TUW4_YMTV5	463	sp|O75445|USH2A_HUMAN Usherin OS=Homo sapiens OX=9606 GN=USH2A PE=1 SV=3	3054	SIYVNNKLYKTG
LSLEDLIKRVYS	tr|Q6TUW4|Q6TUW4_YMTV5	434	sp|Q8NI27|THOC2_HUMAN THO complex subunit 2 OS=Homo sapiens OX=9606 GN=THOC2 PE=1 SV=2	788	LSTEDYIKRVPS
LSLEDLIKRVYS	tr|Q6TUW4|Q6TUW4_YMTV5	434	tr|A0A0C4DG98|A0A0C4DG98_HUMAN THO complex subunit 2 OS=Homo sapiens OX=9606 GN=THOC2 PE=1 SV=1	673	LSTEDYIKRVPS
ELIKLALSLNRM	tr|Q6TUS9|Q6TUS9_YMTV5	217	tr|Q5SZ59|Q5SZ59_HUMAN Ubiquitinyl hydrolase 1 (Fragment) OS=Homo sapiens OX=9606 GN=OTUD7B PE=1 SV=1	260	ELIKLASSEPRM
ELIKLALSLNRM	tr|Q6TUS9|Q6TUS9_YMTV5	217	sp|Q6GQQ9|OTU7B_HUMAN OTU domain-containing protein 7B OS=Homo sapiens OX=9606 GN=OTUD7B PE=1 SV=1	260	ELIKLASSEPRM
FSEQSVTVNFLT	tr|Q6TUN7|Q6TUN7_YMTV5	576	sp|Q8ND71|GIMA8_HUMAN GTPase IMAP family member 8 OS=Homo sapiens OX=9606 GN=GIMAP8 PE=2 SV=2	277	FSEQSVTQSFLS
TLVFKNTEISKK	tr|Q6TUR7|Q6TUR7_YMTV5	181	tr|A0A087WWI3|A0A087WWI3_HUMAN Zinc finger protein 568 OS=Homo sapiens OX=9606 GN=ZNF568 PE=1 SV=1	70	TLVRKVTSISKK
TLVFKNTEISKK	tr|Q6TUR7|Q6TUR7_YMTV5	181	tr|A0A0C4DGP9|A0A0C4DGP9_HUMAN Zinc finger protein 568 (Fragment) OS=Homo sapiens OX=9606 GN=ZNF568 PE=1 SV=1	70	TLVRKVTSISKK
TLVFKNTEISKK	tr|Q6TUR7|Q6TUR7_YMTV5	181	sp|Q3ZCX4|ZN568_HUMAN Zinc finger protein 568 OS=Homo sapiens OX=9606 GN=ZNF568 PE=2 SV=2	134	TLVRKVTSISKK
FIILETSPRLII	tr|Q6TUU4|Q6TUU4_YMTV5	420	tr|F8W7W4|F8W7W4_HUMAN Androglobin (Fragment) OS=Homo sapiens OX=9606 GN=ADGB PE=1 SV=1	244	PTILETSPRLIR
FIILETSPRLII	tr|Q6TUU4|Q6TUU4_YMTV5	420	sp|Q8N7X0|ADGB_HUMAN Androglobin OS=Homo sapiens OX=9606 GN=ADGB PE=2 SV=3	1521	PTILETSPRLIR
FIILETSPRLII	tr|Q6TUU4|Q6TUU4_YMTV5	420	tr|H0Y334|H0Y334_HUMAN Androglobin (Fragment) OS=Homo sapiens OX=9606 GN=ADGB PE=1 SV=1	479	PTILETSPRLIR
EEVSKLTSIKIF	tr|Q6TUW6|Q6TUW6_YMTV5	219	sp|P18433|PTPRA_HUMAN Receptor-type tyrosine-protein phosphatase alpha OS=Homo sapiens OX=9606 GN=PTPRA PE=1 SV=3	535	EEFKKLTSIKIQ
SNSSDVLSNSSY	tr|Q6TUQ4|Q6TUQ4_YMTV5	266	sp|Q13129|RLF_HUMAN Zinc finger protein Rlf OS=Homo sapiens OX=9606 GN=RLF PE=1 SV=2	894	SNSSDQLSHSSS
HYFSKDVDEKNF	tr|Q6TUQ6|Q6TUQ6_YMTV5	59	tr|F8W124|F8W124_HUMAN DCC-interacting protein 13-beta (Fragment) OS=Homo sapiens OX=9606 GN=APPL2 PE=1 SV=1	44	HYFSKVVDELNL
HYFSKDVDEKNF	tr|Q6TUQ6|Q6TUQ6_YMTV5	59	tr|F8VWV2|F8VWV2_HUMAN DCC-interacting protein 13-beta (Fragment) OS=Homo sapiens OX=9606 GN=APPL2 PE=1 SV=1	54	HYFSKVVDELNL
HYFSKDVDEKNF	tr|Q6TUQ6|Q6TUQ6_YMTV5	59	tr|F8VXB0|F8VXB0_HUMAN DCC-interacting protein 13-beta OS=Homo sapiens OX=9606 GN=APPL2 PE=1 SV=1	87	HYFSKVVDELNL
HYFSKDVDEKNF	tr|Q6TUQ6|Q6TUQ6_YMTV5	59	sp|Q8NEU8|DP13B_HUMAN DCC-interacting protein 13-beta OS=Homo sapiens OX=9606 GN=APPL2 PE=1 SV=3	87	HYFSKVVDELNL
LPESVLSNSPKP	tr|Q6TUW4|Q6TUW4_YMTV5	265	sp|Q9UP65|PA24C_HUMAN Cytosolic phospholipase A2 gamma OS=Homo sapiens OX=9606 GN=PLA2G4C PE=1 SV=2	150	LPESHLSNMKKP
IFIPLPFGGKDN	tr|Q6TUW4|Q6TUW4_YMTV5	476	sp|P04114|APOB_HUMAN Apolipoprotein B-100 OS=Homo sapiens OX=9606 GN=APOB PE=1 SV=2	1296	IEIPLPFGGKSS
GTGNVNKITKNY	tr|Q6TUQ6|Q6TUQ6_YMTV5	99	sp|Q9BT17|MTG1_HUMAN Mitochondrial ribosome-associated GTPase 1 OS=Homo sapiens OX=9606 GN=MTG1 PE=1 SV=2	287	GTGNVNIIQPNY
GTGNVNKITKNY	tr|Q6TUQ6|Q6TUQ6_YMTV5	99	tr|U3KQ69|U3KQ69_HUMAN Mitochondrial GTPase 1 OS=Homo sapiens OX=9606 GN=MTG1 PE=1 SV=1	246	GTGNVNIIQPNY
GTGNVNKITKNY	tr|Q6TUQ6|Q6TUQ6_YMTV5	99	tr|E7EVK2|E7EVK2_HUMAN Mitochondrial GTPase 1 OS=Homo sapiens OX=9606 GN=MTG1 PE=1 SV=1	236	GTGNVNIIQPNY
IIYLILNYITVV	tr|Q6TUP1|Q6TUP1_YMTV5	106	tr|F2Z2Z2|F2Z2Z2_HUMAN Probable ATP-dependent RNA helicase DHX35 OS=Homo sapiens OX=9606 GN=DHX35 PE=1 SV=2	63	ILYLIENYQTVV
IIYLILNYITVV	tr|Q6TUP1|Q6TUP1_YMTV5	106	sp|Q9H5Z1|DHX35_HUMAN Probable ATP-dependent RNA helicase DHX35 OS=Homo sapiens OX=9606 GN=DHX35 PE=1 SV=2	63	ILYLIENYQTVV
IIYLILNYITVV	tr|Q6TUP1|Q6TUP1_YMTV5	106	tr|Q5THR1|Q5THR1_HUMAN RNA helicase OS=Homo sapiens OX=9606 GN=DHX35 PE=1 SV=1	63	ILYLIENYQTVV
LKGGFNFSVIDV	tr|Q6TUN5|Q6TUN5_YMTV5	278	sp|Q8NCM8|DYHC2_HUMAN Cytoplasmic dynein 2 heavy chain 1 OS=Homo sapiens OX=9606 GN=DYNC2H1 PE=1 SV=4	3944	LKQFFNSSVIDV
LKGGFNFSVIDV	tr|Q6TUN5|Q6TUN5_YMTV5	278	tr|H0YDE0|H0YDE0_HUMAN Cytoplasmic dynein 2 heavy chain 1 (Fragment) OS=Homo sapiens OX=9606 GN=DYNC2H1 PE=1 SV=1	337	LKQFFNSSVIDV
EAISLEKLDAAK	tr|Q6TUU4|Q6TUU4_YMTV5	590	sp|Q96A26|F162A_HUMAN Protein FAM162A OS=Homo sapiens OX=9606 GN=FAM162A PE=1 SV=2	85	ETVSLEMLDAAK
EAISLEKLDAAK	tr|Q6TUU4|Q6TUU4_YMTV5	590	tr|F8W7Q4|F8W7Q4_HUMAN Protein FAM162A OS=Homo sapiens OX=9606 GN=FAM162A PE=1 SV=1	75	ETVSLEMLDAAK
EAISLEKLDAAK	tr|Q6TUU4|Q6TUU4_YMTV5	590	tr|E9PH05|E9PH05_HUMAN Protein FAM162A OS=Homo sapiens OX=9606 GN=FAM162A PE=1 SV=1	85	ETVSLEMLDAAK
KFYFLGLKKKTN	tr|Q6TUP6|Q6TUP6_YMTV5	99	tr|H7BYQ5|H7BYQ5_HUMAN Apolipoprotein L3 OS=Homo sapiens OX=9606 GN=APOL3 PE=3 SV=1	70	KRSFLGLRKKTN
