query	query_seqname	query_start	target_seqname	target_start	target
PLLSNVSIEDVV	tr|Q6TUN5|Q6TUN5_YMTV5	174	sp|Q5T5Y3|CAMP1_HUMAN Calmodulin-regulated spectrin-associated protein 1 OS=Homo sapiens OX=9606 GN=CAMSAP1 PE=1 SV=2	528	SLLSNVSIEDEE
ILEIVCIVDAGV	tr|Q6TUQ5|Q6TUQ5_YMTV5	1	tr|A0A0G2JQG6|A0A0G2JQG6_HUMAN Potassium voltage-gated channel subfamily KQT member 2 (Fragment) OS=Homo sapiens OX=9606 GN=KCNQ2 PE=1 SV=1	30	ILEIVTIVVFGV
ILEIVCIVDAGV	tr|Q6TUQ5|Q6TUQ5_YMTV5	1	tr|A0A0D9SEV1|A0A0D9SEV1_HUMAN Potassium voltage-gated channel subfamily KQT member 2 OS=Homo sapiens OX=9606 GN=KCNQ2 PE=1 SV=1	128	ILEIVTIVVFGV
ILEIVCIVDAGV	tr|Q6TUQ5|Q6TUQ5_YMTV5	1	tr|A0A0G2JRN9|A0A0G2JRN9_HUMAN Potassium voltage-gated channel subfamily KQT member 2 (Fragment) OS=Homo sapiens OX=9606 GN=KCNQ2 PE=1 SV=1	30	ILEIVTIVVFGV
ILEIVCIVDAGV	tr|Q6TUQ5|Q6TUQ5_YMTV5	1	tr|A0A0D9SF10|A0A0D9SF10_HUMAN Potassium voltage-gated channel subfamily KQT member 2 OS=Homo sapiens OX=9606 GN=KCNQ2 PE=1 SV=1	128	ILEIVTIVVFGV
ILEIVCIVDAGV	tr|Q6TUQ5|Q6TUQ5_YMTV5	1	tr|Q4VXP6|Q4VXP6_HUMAN Potassium voltage-gated channel subfamily KQT member 2 OS=Homo sapiens OX=9606 GN=KCNQ2 PE=1 SV=2	128	ILEIVTIVVFGV
ILEIVCIVDAGV	tr|Q6TUQ5|Q6TUQ5_YMTV5	1	tr|A0A0D9SG49|A0A0D9SG49_HUMAN Potassium voltage-gated channel subfamily KQT member 2 OS=Homo sapiens OX=9606 GN=KCNQ2 PE=1 SV=1	128	ILEIVTIVVFGV
ILEIVCIVDAGV	tr|Q6TUQ5|Q6TUQ5_YMTV5	1	tr|A0A0G2JR60|A0A0G2JR60_HUMAN Potassium voltage-gated channel subfamily KQT member 2 (Fragment) OS=Homo sapiens OX=9606 GN=KCNQ2 PE=1 SV=1	30	ILEIVTIVVFGV
ILEIVCIVDAGV	tr|Q6TUQ5|Q6TUQ5_YMTV5	1	tr|A0A0G2JR54|A0A0G2JR54_HUMAN Potassium voltage-gated channel subfamily KQT member 2 (Fragment) OS=Homo sapiens OX=9606 GN=KCNQ2 PE=1 SV=1	30	ILEIVTIVVFGV
ILEIVCIVDAGV	tr|Q6TUQ5|Q6TUQ5_YMTV5	1	sp|O43526|KCNQ2_HUMAN Potassium voltage-gated channel subfamily KQT member 2 OS=Homo sapiens OX=9606 GN=KCNQ2 PE=1 SV=2	128	ILEIVTIVVFGV
ILEIVCIVDAGV	tr|Q6TUQ5|Q6TUQ5_YMTV5	1	tr|A0A0G2JQC9|A0A0G2JQC9_HUMAN Potassium voltage-gated channel subfamily KQT member 2 (Fragment) OS=Homo sapiens OX=9606 GN=KCNQ2 PE=1 SV=1	30	ILEIVTIVVFGV
ILEIVCIVDAGV	tr|Q6TUQ5|Q6TUQ5_YMTV5	1	tr|A0A0G2JSD3|A0A0G2JSD3_HUMAN Potassium voltage-gated channel subfamily KQT member 2 (Fragment) OS=Homo sapiens OX=9606 GN=KCNQ2 PE=1 SV=1	14	ILEIVTIVVFGV
ILEIVCIVDAGV	tr|Q6TUQ5|Q6TUQ5_YMTV5	1	tr|A0A0G2JH35|A0A0G2JH35_HUMAN Potassium voltage-gated channel subfamily KQT member 2 (Fragment) OS=Homo sapiens OX=9606 GN=KCNQ2 PE=1 SV=1	14	ILEIVTIVVFGV
ILEIVCIVDAGV	tr|Q6TUQ5|Q6TUQ5_YMTV5	1	tr|A0A0G2JRU6|A0A0G2JRU6_HUMAN Potassium voltage-gated channel subfamily KQT member 2 (Fragment) OS=Homo sapiens OX=9606 GN=KCNQ2 PE=1 SV=1	30	ILEIVTIVVFGV
NFNNKLYAIGGA	tr|Q6TUZ3|Q6TUZ3_YMTV5	344	sp|Q9C0H6|KLHL4_HUMAN Kelch-like protein 4 OS=Homo sapiens OX=9606 GN=KLHL4 PE=1 SV=2	567	ALNNKLYAIGGR
VTVTPIYFNGEP	tr|Q6TUX5|Q6TUX5_YMTV5	139	tr|J3QT83|J3QT83_HUMAN Collagen alpha-1(XIV) chain (Fragment) OS=Homo sapiens OX=9606 GN=COL14A1 PE=1 SV=1	619	VTVTPIYTDGEG
VTVTPIYFNGEP	tr|Q6TUX5|Q6TUX5_YMTV5	139	sp|Q05707|COEA1_HUMAN Collagen alpha-1(XIV) chain OS=Homo sapiens OX=9606 GN=COL14A1 PE=1 SV=3	806	VTVTPIYTDGEG
EIELEKLREENK	tr|Q6TUU1|Q6TUU1_YMTV5	34	tr|G3V5P0|G3V5P0_HUMAN Kinectin (Fragment) OS=Homo sapiens OX=9606 GN=KTN1 PE=1 SV=1	147	EQELERLRSENK
EIELEKLREENK	tr|Q6TUU1|Q6TUU1_YMTV5	34	tr|G3V4Y7|G3V4Y7_HUMAN Kinectin OS=Homo sapiens OX=9606 GN=KTN1 PE=1 SV=1	452	EQELERLRSENK
EIELEKLREENK	tr|Q6TUU1|Q6TUU1_YMTV5	34	tr|B7Z6P3|B7Z6P3_HUMAN Kinectin OS=Homo sapiens OX=9606 GN=KTN1 PE=1 SV=1	191	EQELERLRSENK
EIELEKLREENK	tr|Q6TUU1|Q6TUU1_YMTV5	34	sp|Q86UP2|KTN1_HUMAN Kinectin OS=Homo sapiens OX=9606 GN=KTN1 PE=1 SV=1	1186	EQELERLRSENK
FENDIHIQIHRM	tr|Q6TUY6|Q6TUY6_YMTV5	347	sp|O75691|UTP20_HUMAN Small subunit processome component 20 homolog OS=Homo sapiens OX=9606 GN=UTP20 PE=1 SV=3	1575	FENMKHIQIHRR
LLSSYVRSIILS	tr|Q6TUT6|Q6TUT6_YMTV5	563	sp|Q9Y3B7|RM11_HUMAN 39S ribosomal protein L11, mitochondrial OS=Homo sapiens OX=9606 GN=MRPL11 PE=1 SV=1	136	PLSSVVRSIIGS
LLSSYVRSIILS	tr|Q6TUT6|Q6TUT6_YMTV5	563	tr|H0YCD5|H0YCD5_HUMAN 39S ribosomal protein L11, mitochondrial (Fragment) OS=Homo sapiens OX=9606 GN=MRPL11 PE=1 SV=1	18	PLSSVVRSIIGS
SLEILSRLEKKV	tr|Q6TUU4|Q6TUU4_YMTV5	1255	sp|Q9Y496|KIF3A_HUMAN Kinesin-like protein KIF3A OS=Homo sapiens OX=9606 GN=KIF3A PE=1 SV=4	468	LLEKLSALEKKV
SLEILSRLEKKV	tr|Q6TUU4|Q6TUU4_YMTV5	1255	tr|J3KPF9|J3KPF9_HUMAN Kinesin-like protein OS=Homo sapiens OX=9606 GN=KIF3A PE=1 SV=1	471	LLEKLSALEKKV
SLEILSRLEKKV	tr|Q6TUU4|Q6TUU4_YMTV5	1255	tr|E9PES4|E9PES4_HUMAN Kinesin-like protein OS=Homo sapiens OX=9606 GN=KIF3A PE=1 SV=1	495	LLEKLSALEKKV
SLEILSRLEKKV	tr|Q6TUU4|Q6TUU4_YMTV5	1255	tr|A0A087X011|A0A087X011_HUMAN Kinesin-like protein OS=Homo sapiens OX=9606 GN=KIF3A PE=1 SV=1	494	LLEKLSALEKKV
DFTEKMNKDKFT	tr|Q6TUQ6|Q6TUQ6_YMTV5	21	tr|M0R2I7|M0R2I7_HUMAN Heterogeneous nuclear ribonucleoprotein M (Fragment) OS=Homo sapiens OX=9606 GN=HNRNPM PE=1 SV=1	186	DFTWKMLKDKFN
DFTEKMNKDKFT	tr|Q6TUQ6|Q6TUQ6_YMTV5	21	sp|P52272|HNRPM_HUMAN Heterogeneous nuclear ribonucleoprotein M OS=Homo sapiens OX=9606 GN=HNRNPM PE=1 SV=3	663	DFTWKMLKDKFN
DFTEKMNKDKFT	tr|Q6TUQ6|Q6TUQ6_YMTV5	21	tr|A0A087X0X3|A0A087X0X3_HUMAN Heterogeneous nuclear ribonucleoprotein M OS=Homo sapiens OX=9606 GN=HNRNPM PE=1 SV=1	663	DFTWKMLKDKFN
DFTEKMNKDKFT	tr|Q6TUQ6|Q6TUQ6_YMTV5	21	tr|M0QY96|M0QY96_HUMAN Heterogeneous nuclear ribonucleoprotein M (Fragment) OS=Homo sapiens OX=9606 GN=HNRNPM PE=1 SV=1	87	DFTWKMLKDKFN
KEISIQDISKLK	tr|Q6TUV9|Q6TUV9_YMTV5	356	tr|Q5JVD3|Q5JVD3_HUMAN Centriolin OS=Homo sapiens OX=9606 GN=CNTRL PE=1 SV=2	204	KISSLQDISKLK
KEISIQDISKLK	tr|Q6TUV9|Q6TUV9_YMTV5	356	sp|Q7Z7A1|CNTRL_HUMAN Centriolin OS=Homo sapiens OX=9606 GN=CNTRL PE=1 SV=2	204	KISSLQDISKLK
QLPELTIYLGSN	sp|Q9QB92|MCES_YMTV5	21	sp|A0A075B6P5|KV228_HUMAN Immunoglobulin kappa variable 2-28 OS=Homo sapiens OX=9606 GN=IGKV2-28 PE=3 SV=1	67	QSPQLLIYLGSN
QLPELTIYLGSN	sp|Q9QB92|MCES_YMTV5	21	sp|P01615|KVD28_HUMAN Immunoglobulin kappa variable 2D-28 OS=Homo sapiens OX=9606 GN=IGKV2D-28 PE=1 SV=2	67	QSPQLLIYLGSN
QLPELTIYLGSN	sp|Q9QB92|MCES_YMTV5	21	tr|A0A5H1ZRS2|A0A5H1ZRS2_HUMAN Immunoglobulin kappa variable 2D-28 OS=Homo sapiens OX=9606 GN=IGKV2D-28 PE=1 SV=1	47	QSPQLLIYLGSN
FEEDAISVEDIL	tr|Q6TUS4|Q6TUS4_YMTV5	617	sp|Q14204|DYHC1_HUMAN Cytoplasmic dynein 1 heavy chain 1 OS=Homo sapiens OX=9606 GN=DYNC1H1 PE=1 SV=5	1516	FEEDALSWEDKL
PVIISGGTGIGK	tr|Q6TUW4|Q6TUW4_YMTV5	184	sp|Q63HN8|RN213_HUMAN E3 ubiquitin-protein ligase RNF213 OS=Homo sapiens OX=9606 GN=RNF213 PE=1 SV=3	2415	PVIIMGETGCGK
PVIISGGTGIGK	tr|Q6TUW4|Q6TUW4_YMTV5	184	tr|A0A0A0MTR7|A0A0A0MTR7_HUMAN E3 ubiquitin-protein ligase RNF213 OS=Homo sapiens OX=9606 GN=RNF213 PE=1 SV=1	2415	PVIIMGETGCGK
PVIISGGTGIGK	tr|Q6TUW4|Q6TUW4_YMTV5	184	tr|A0A0A0MTC1|A0A0A0MTC1_HUMAN E3 ubiquitin-protein ligase RNF213 OS=Homo sapiens OX=9606 GN=RNF213 PE=1 SV=1	2464	PVIIMGETGCGK
PYGIVEEKQNIF	sp|Q9QB84|ETF2_YMTV5	27	sp|O95139|NDUB6_HUMAN NADH dehydrogenase [ubiquinone] 1 beta subcomplex subunit 6 OS=Homo sapiens OX=9606 GN=NDUFB6 PE=1 SV=3	94	PYGIVEKKSRIF
PYGIVEEKQNIF	sp|Q9QB84|ETF2_YMTV5	27	tr|A0A087WZX2|A0A087WZX2_HUMAN Complex I-B17 OS=Homo sapiens OX=9606 GN=NDUFB6 PE=1 SV=1	63	PYGIVEKKSRIF
YIIKTLIEDNKN	sp|Q9QB97|ETF1_YMTV5	29	tr|H0YBA5|H0YBA5_HUMAN Protein FAM184A OS=Homo sapiens OX=9606 GN=FAM184A PE=1 SV=2	885	QIIKKLIEDNKF
YIIKTLIEDNKN	sp|Q9QB97|ETF1_YMTV5	29	tr|A0A0C4DGZ2|A0A0C4DGZ2_HUMAN Protein FAM184A OS=Homo sapiens OX=9606 GN=FAM184A PE=1 SV=1	157	QIIKKLIEDNKF
YIIKTLIEDNKN	sp|Q9QB97|ETF1_YMTV5	29	sp|Q8NB25|F184A_HUMAN Protein FAM184A OS=Homo sapiens OX=9606 GN=FAM184A PE=1 SV=3	1005	QIIKKLIEDNKF
YIIKTLIEDNKN	sp|Q9QB97|ETF1_YMTV5	29	tr|A0A087X2A7|A0A087X2A7_HUMAN Protein FAM184A OS=Homo sapiens OX=9606 GN=FAM184A PE=1 SV=1	963	QIIKKLIEDNKF
YIIKTLIEDNKN	sp|Q9QB97|ETF1_YMTV5	29	tr|B9DI78|B9DI78_HUMAN Protein FAM184A (Fragment) OS=Homo sapiens OX=9606 GN=FAM184A PE=1 SV=1	66	QIIKKLIEDNKF
IVVVALIISAVY	tr|Q6TUV3|Q6TUV3_YMTV5	189	tr|B7Z4W8|B7Z4W8_HUMAN GRAM domain-containing protein 2B OS=Homo sapiens OX=9606 GN=GRAMD2B PE=1 SV=1	243	IVVCALIISTFY
IVVVALIISAVY	tr|Q6TUV3|Q6TUV3_YMTV5	189	sp|Q96HH9|GRM2B_HUMAN GRAM domain-containing protein 2B OS=Homo sapiens OX=9606 GN=GRAMD2B PE=1 SV=1	352	IVVCALIISTFY
IVVVALIISAVY	tr|Q6TUV3|Q6TUV3_YMTV5	189	tr|E9PD09|E9PD09_HUMAN GRAM domain-containing protein 2B OS=Homo sapiens OX=9606 GN=GRAMD2B PE=1 SV=1	330	IVVCALIISTFY
KKIFAKIKNLTS	tr|Q6TUP3|Q6TUP3_YMTV5	51	sp|P34932|HSP74_HUMAN Heat shock 70 kDa protein 4 OS=Homo sapiens OX=9606 GN=HSPA4 PE=1 SV=4	766	KEIEAKIKELTS
DPFSLNENVDNL	tr|Q6TUZ9|Q6TUZ9_YMTV5	179	tr|F8WE06|F8WE06_HUMAN Condensin-2 complex subunit G2 OS=Homo sapiens OX=9606 GN=NCAPG2 PE=1 SV=1	31	DPFSLNELLDEL
DPFSLNENVDNL	tr|Q6TUZ9|Q6TUZ9_YMTV5	179	sp|Q86XI2|CNDG2_HUMAN Condensin-2 complex subunit G2 OS=Homo sapiens OX=9606 GN=NCAPG2 PE=1 SV=1	31	DPFSLNELLDEL
EELISTHDFHLR	tr|Q6TUS4|Q6TUS4_YMTV5	94	sp|A6NJG2|SWAHD_HUMAN Ankyrin repeat domain-containing protein SOWAHD OS=Homo sapiens OX=9606 GN=SOWAHD PE=2 SV=1	162	EELILVHDFALR
LASDNIDLIKLL	tr|Q6TUZ9|Q6TUZ9_YMTV5	59	tr|A0A087X021|A0A087X021_HUMAN Hydroxymethylbilane hydrolyase [cyclizing] (Fragment) OS=Homo sapiens OX=9606 GN=UROS PE=1 SV=1	71	LSGDNIDQIKLL
SSFKEEINIKSI	tr|Q6TUU0|Q6TUU0_YMTV5	312	sp|Q14151|SAFB2_HUMAN Scaffold attachment factor B2 OS=Homo sapiens OX=9606 GN=SAFB2 PE=1 SV=1	382	SSFKEEKDIKPI
TILWVFGVIGSL	tr|Q6TUM9|Q6TUM9_YMTV5	38	sp|P48651|PTSS1_HUMAN Phosphatidylserine synthase 1 OS=Homo sapiens OX=9606 GN=PTDSS1 PE=1 SV=1	352	TQCWVFGVIGFL
LKSSSESAEDVT	tr|Q6TUT9|Q6TUT9_YMTV5	24	tr|B9EGE7|B9EGE7_HUMAN ZNF507 protein OS=Homo sapiens OX=9606 GN=ZNF507 PE=1 SV=1	847	LKSSEESADPVT
LKSSSESAEDVT	tr|Q6TUT9|Q6TUT9_YMTV5	24	sp|Q8TCN5|ZN507_HUMAN Zinc finger protein 507 OS=Homo sapiens OX=9606 GN=ZNF507 PE=1 SV=2	843	LKSSEESADPVT
ISNIRISSAENE	tr|Q6TUY6|Q6TUY6_YMTV5	77	tr|F2Z2M5|F2Z2M5_HUMAN Centrosome and spindle pole-associated protein 1 OS=Homo sapiens OX=9606 GN=CSPP1 PE=1 SV=1	337	QSNIRISSAENK
ISNIRISSAENE	tr|Q6TUY6|Q6TUY6_YMTV5	77	tr|A0A6Q8PGS3|A0A6Q8PGS3_HUMAN Centrosome and spindle pole-associated protein 1 OS=Homo sapiens OX=9606 GN=CSPP1 PE=1 SV=1	302	QSNIRISSAENK
ISNIRISSAENE	tr|Q6TUY6|Q6TUY6_YMTV5	77	tr|A0A6Q8PHN8|A0A6Q8PHN8_HUMAN Centrosome and spindle pole-associated protein 1 OS=Homo sapiens OX=9606 GN=CSPP1 PE=1 SV=1	329	QSNIRISSAENK
ISNIRISSAENE	tr|Q6TUY6|Q6TUY6_YMTV5	77	tr|A0A6Q8PF61|A0A6Q8PF61_HUMAN Centrosome and spindle pole-associated protein 1 OS=Homo sapiens OX=9606 GN=CSPP1 PE=1 SV=1	329	QSNIRISSAENK
ISNIRISSAENE	tr|Q6TUY6|Q6TUY6_YMTV5	77	sp|Q1MSJ5|CSPP1_HUMAN Centrosome and spindle pole-associated protein 1 OS=Homo sapiens OX=9606 GN=CSPP1 PE=1 SV=4	373	QSNIRISSAENK
ISNIRISSAENE	tr|Q6TUY6|Q6TUY6_YMTV5	77	tr|A0A6Q8PF96|A0A6Q8PF96_HUMAN Centrosome and spindle pole-associated protein 1 OS=Homo sapiens OX=9606 GN=CSPP1 PE=1 SV=1	302	QSNIRISSAENK
CDDDTVFLTYTV	tr|Q6TUM3|Q6TUM3_YMTV5	315	sp|Q96HR9|REEP6_HUMAN Receptor expression-enhancing protein 6 OS=Homo sapiens OX=9606 GN=REEP6 PE=1 SV=2	79	KDDDTVWLTYWV
CDDDTVFLTYTV	tr|Q6TUM3|Q6TUM3_YMTV5	315	tr|A8MXN1|A8MXN1_HUMAN Receptor expression-enhancing protein (Fragment) OS=Homo sapiens OX=9606 GN=REEP6 PE=1 SV=2	7	KDDDTVWLTYWV
GKNLPDVLAESL	tr|Q6TUR8|Q6TUR8_YMTV5	434	sp|Q9H3L0|MMAD_HUMAN Cobalamin trafficking protein CblD OS=Homo sapiens OX=9606 GN=MMADHC PE=1 SV=2	96	HKTLPDVLAEPL
GKNLPDVLAESL	tr|Q6TUR8|Q6TUR8_YMTV5	434	tr|F8WEC0|F8WEC0_HUMAN Cobalamin-trafficking protein CblD OS=Homo sapiens OX=9606 GN=MMADHC PE=1 SV=1	96	HKTLPDVLAEPL
CPISAQSGSMFS	tr|Q6TUS4|Q6TUS4_YMTV5	404	tr|K7EIJ1|K7EIJ1_HUMAN Zinc phosphodiesterase ELAC protein 1 OS=Homo sapiens OX=9606 GN=ELAC1 PE=1 SV=1	76	CTISLQSGSMVS
CPISAQSGSMFS	tr|Q6TUS4|Q6TUS4_YMTV5	404	sp|Q9H777|RNZ1_HUMAN Zinc phosphodiesterase ELAC protein 1 OS=Homo sapiens OX=9606 GN=ELAC1 PE=1 SV=2	76	CTISLQSGSMVS
SVYTKDLLLSDS	sp|Q9QB92|MCES_YMTV5	62	sp|O43187|IRAK2_HUMAN Interleukin-1 receptor-associated kinase-like 2 OS=Homo sapiens OX=9606 GN=IRAK2 PE=1 SV=2	421	PVYLKDLLLSDI
NILDTKIINQSF	tr|Q6TUX3|Q6TUX3_YMTV5	982	sp|Q7Z443|PK1L3_HUMAN Polycystic kidney disease protein 1-like 3 OS=Homo sapiens OX=9606 GN=PKD1L3 PE=1 SV=1	1501	NILDTSIILISF
KMLHMVLVLLLV	tr|Q6TV00|Q6TV00_YMTV5	243	tr|F8W186|F8W186_HUMAN Integrin beta-7 (Fragment) OS=Homo sapiens OX=9606 GN=ITGB7 PE=1 SV=9	2	VALPMVLVLLLV
KMLHMVLVLLLV	tr|Q6TV00|Q6TV00_YMTV5	243	tr|H3BRM2|H3BRM2_HUMAN Integrin beta-7 (Fragment) OS=Homo sapiens OX=9606 GN=ITGB7 PE=1 SV=1	2	VALPMVLVLLLV
KMLHMVLVLLLV	tr|Q6TV00|Q6TV00_YMTV5	243	tr|F8VNX4|F8VNX4_HUMAN Integrin beta-7 (Fragment) OS=Homo sapiens OX=9606 GN=ITGB7 PE=1 SV=2	2	VALPMVLVLLLV
KMLHMVLVLLLV	tr|Q6TV00|Q6TV00_YMTV5	243	tr|F5H6T4|F5H6T4_HUMAN Integrin beta OS=Homo sapiens OX=9606 GN=ITGB7 PE=1 SV=1	2	VALPMVLVLLLV
KMLHMVLVLLLV	tr|Q6TV00|Q6TV00_YMTV5	243	sp|P26010|ITB7_HUMAN Integrin beta-7 OS=Homo sapiens OX=9606 GN=ITGB7 PE=1 SV=1	2	VALPMVLVLLLV
NFEDDLSLLLPV	tr|Q6TUW2|Q6TUW2_YMTV5	95	sp|Q13200|PSMD2_HUMAN 26S proteasome non-ATPase regulatory subunit 2 OS=Homo sapiens OX=9606 GN=PSMD2 PE=1 SV=3	493	NREDVLTLLLPV
SQSLDYILNFLN	tr|Q6TUU0|Q6TUU0_YMTV5	500	tr|K7EJ18|K7EJ18_HUMAN E3 ubiquitin-protein ligase RNFT1 (Fragment) OS=Homo sapiens OX=9606 GN=RNFT1 PE=1 SV=1	190	SQSLYYSLIFLN
SQSLDYILNFLN	tr|Q6TUU0|Q6TUU0_YMTV5	500	sp|Q5M7Z0|RNFT1_HUMAN E3 ubiquitin-protein ligase RNFT1 OS=Homo sapiens OX=9606 GN=RNFT1 PE=1 SV=2	225	SQSLYYSLIFLN
SNRPIILKGCRF	tr|Q6TUY3|Q6TUY3_YMTV5	52	sp|Q8NAP8|ZBT8B_HUMAN Zinc finger and BTB domain-containing protein 8B OS=Homo sapiens OX=9606 GN=ZBTB8B PE=1 SV=2	394	SNRPIICKGCRR
LIHGTISLESES	tr|Q6TUT1|Q6TUT1_YMTV5	84	tr|J3KRA9|J3KRA9_HUMAN Non-specific serine/threonine protein kinase (Fragment) OS=Homo sapiens OX=9606 GN=SMG1 PE=1 SV=1	1750	AIVGTISLSSES
LIHGTISLESES	tr|Q6TUT1|Q6TUT1_YMTV5	84	sp|Q96Q15|SMG1_HUMAN Serine/threonine-protein kinase SMG1 OS=Homo sapiens OX=9606 GN=SMG1 PE=1 SV=3	1860	AIVGTISLSSES
VNLISLHKYLNI	tr|Q6TV00|Q6TV00_YMTV5	132	tr|A0A1B0GWD8|A0A1B0GWD8_HUMAN Sperm flagellar protein 2 OS=Homo sapiens OX=9606 GN=SPEF2 PE=1 SV=1	2067	VNSIYLHKYPNI
SVNVDHCLNDIK	tr|Q6TUX6|Q6TUX6_YMTV5	29	sp|Q8IVF4|DYH10_HUMAN Dynein heavy chain 10, axonemal OS=Homo sapiens OX=9606 GN=DNAH10 PE=1 SV=4	1165	SVNVEHALGDIK
SVNVDHCLNDIK	tr|Q6TUX6|Q6TUX6_YMTV5	29	tr|A0A1C7CYW8|A0A1C7CYW8_HUMAN Dynein heavy chain 10, axonemal OS=Homo sapiens OX=9606 GN=DNAH10 PE=1 SV=1	1226	SVNVEHALGDIK
SVNVDHCLNDIK	tr|Q6TUX6|Q6TUX6_YMTV5	29	tr|A0A669KB38|A0A669KB38_HUMAN Dynein heavy chain 10, axonemal OS=Homo sapiens OX=9606 GN=DNAH10 PE=1 SV=1	1283	SVNVEHALGDIK
PYSSTETTHPIC	tr|Q6TUQ3|Q6TUQ3_YMTV5	943	sp|Q7L590|MCM10_HUMAN Protein MCM10 homolog OS=Homo sapiens OX=9606 GN=MCM10 PE=1 SV=2	235	PGSSGETTQPIC
PYSSTETTHPIC	tr|Q6TUQ3|Q6TUQ3_YMTV5	943	tr|Q5T670|Q5T670_HUMAN Protein MCM10 homolog OS=Homo sapiens OX=9606 GN=MCM10 PE=1 SV=1	234	PGSSGETTQPIC
LNHFTVVYLRTV	tr|Q6TUZ3|Q6TUZ3_YMTV5	101	sp|Q96JB1|DYH8_HUMAN Dynein heavy chain 8, axonemal OS=Homo sapiens OX=9606 GN=DNAH8 PE=1 SV=2	4461	LTFITVVYLRTV
LNHFTVVYLRTV	tr|Q6TUZ3|Q6TUZ3_YMTV5	101	tr|A0A075B6F3|A0A075B6F3_HUMAN Dynein heavy chain 8, axonemal OS=Homo sapiens OX=9606 GN=DNAH8 PE=1 SV=2	4678	LTFITVVYLRTV
LDEDNNIKDITT	tr|Q6TUU1|Q6TUU1_YMTV5	120	sp|P57058|HUNK_HUMAN Hormonally up-regulated neu tumor-associated kinase OS=Homo sapiens OX=9606 GN=HUNK PE=1 SV=1	194	LDEDNNIKLIDF
LDEDNNIKDITT	tr|Q6TUU1|Q6TUU1_YMTV5	120	tr|H7C3H0|H7C3H0_HUMAN Hormonally up-regulated neu tumor-associated kinase (Fragment) OS=Homo sapiens OX=9606 GN=HUNK PE=1 SV=1	79	LDEDNNIKLIDF
TGNILDLGTGNV	tr|Q6TUQ6|Q6TUQ6_YMTV5	92	tr|A0A087WVE9|A0A087WVE9_HUMAN Aryl hydrocarbon receptor nuclear translocator 2 OS=Homo sapiens OX=9606 GN=ARNT2 PE=1 SV=1	207	TGRILDLKTGTV
TGNILDLGTGNV	tr|Q6TUQ6|Q6TUQ6_YMTV5	92	sp|Q9HBZ2|ARNT2_HUMAN Aryl hydrocarbon receptor nuclear translocator 2 OS=Homo sapiens OX=9606 GN=ARNT2 PE=1 SV=2	207	TGRILDLKTGTV
TGNILDLGTGNV	tr|Q6TUQ6|Q6TUQ6_YMTV5	92	tr|A6NGV6|A6NGV6_HUMAN Aryl hydrocarbon receptor nuclear translocator OS=Homo sapiens OX=9606 GN=ARNT PE=1 SV=4	233	TGRILDLKTGTV
TGNILDLGTGNV	tr|Q6TUQ6|Q6TUQ6_YMTV5	92	sp|P27540|ARNT_HUMAN Aryl hydrocarbon receptor nuclear translocator OS=Homo sapiens OX=9606 GN=ARNT PE=1 SV=1	233	TGRILDLKTGTV
SFSEQSVTVNFL	tr|Q6TUN7|Q6TUN7_YMTV5	575	sp|Q8ND71|GIMA8_HUMAN GTPase IMAP family member 8 OS=Homo sapiens OX=9606 GN=GIMAP8 PE=2 SV=2	276	GFSEQSVTQSFL
CKKLKSLSDIYM	tr|Q6TV00|Q6TV00_YMTV5	71	tr|E9PH76|E9PH76_HUMAN C-C chemokine receptor type 2 (Fragment) OS=Homo sapiens OX=9606 GN=CCR2 PE=1 SV=1	70	CKKLKCLTDIYL
CKKLKSLSDIYM	tr|Q6TV00|Q6TV00_YMTV5	71	sp|P41597|CCR2_HUMAN C-C chemokine receptor type 2 OS=Homo sapiens OX=9606 GN=CCR2 PE=1 SV=1	70	CKKLKCLTDIYL
CISEKVLNINEL	tr|Q6TUV9|Q6TUV9_YMTV5	379	sp|Q9Y5B6|PAXB1_HUMAN PAX3- and PAX7-binding protein 1 OS=Homo sapiens OX=9606 GN=PAXBP1 PE=1 SV=2	457	CFSEKVPLINEL
KKKKVDYGDLRR	tr|Q6TUQ4|Q6TUQ4_YMTV5	129	sp|Q86VS8|HOOK3_HUMAN Protein Hook homolog 3 OS=Homo sapiens OX=9606 GN=HOOK3 PE=1 SV=2	324	KKKLEDLGDLRR
TIEDLRQKGLKT	tr|Q6TUS1|Q6TUS1_YMTV5	295	sp|Q6A162|K1C40_HUMAN Keratin, type I cytoskeletal 40 OS=Homo sapiens OX=9606 GN=KRT40 PE=1 SV=2	142	TIEDLQQKILCT
TIEDLRQKGLKT	tr|Q6TUS1|Q6TUS1_YMTV5	295	tr|G3V1C2|G3V1C2_HUMAN Keratin, type I cytoskeletal 40 OS=Homo sapiens OX=9606 GN=KRT40 PE=1 SV=1	142	TIEDLQQKILCT
QSFGSIVTKDSP	tr|Q6TUN7|Q6TUN7_YMTV5	704	sp|Q9HAB8|PPCS_HUMAN Phosphopantothenate--cysteine ligase OS=Homo sapiens OX=9606 GN=PPCS PE=1 SV=2	264	QSFVFIVTKDSE
VDKLKLAFSEFY	tr|Q6TUS1|Q6TUS1_YMTV5	1	sp|Q9UBH6|XPR1_HUMAN Xenotropic and polytropic retrovirus receptor 1 OS=Homo sapiens OX=9606 GN=XPR1 PE=1 SV=1	128	IKDLKLAFSEFY
DANLEKLKLKSE	tr|Q6TUS0|Q6TUS0_YMTV5	18	sp|Q9NZ43|USE1_HUMAN Vesicle transport protein USE1 OS=Homo sapiens OX=9606 GN=USE1 PE=1 SV=2	209	DQNLEKLKTESE
DANLEKLKLKSE	tr|Q6TUS0|Q6TUS0_YMTV5	18	tr|G8JLK1|G8JLK1_HUMAN USE1-like protein OS=Homo sapiens OX=9606 GN=USE1 PE=1 SV=2	206	DQNLEKLKTESE
ILETSPRLIIET	tr|Q6TUU4|Q6TUU4_YMTV5	422	tr|F8W7W4|F8W7W4_HUMAN Androglobin (Fragment) OS=Homo sapiens OX=9606 GN=ADGB PE=1 SV=1	246	ILETSPRLIRKA
ILETSPRLIIET	tr|Q6TUU4|Q6TUU4_YMTV5	422	sp|Q8N7X0|ADGB_HUMAN Androglobin OS=Homo sapiens OX=9606 GN=ADGB PE=2 SV=3	1523	ILETSPRLIRKA
ILETSPRLIIET	tr|Q6TUU4|Q6TUU4_YMTV5	422	tr|H0Y334|H0Y334_HUMAN Androglobin (Fragment) OS=Homo sapiens OX=9606 GN=ADGB PE=1 SV=1	481	ILETSPRLIRKA
YTAEVTSAGDNK	tr|Q6TUX8|Q6TUX8_YMTV5	127	sp|Q9H091|ZMY15_HUMAN Zinc finger MYND domain-containing protein 15 OS=Homo sapiens OX=9606 GN=ZMYND15 PE=2 SV=2	379	YTAEVTSETFNK
DKMKIMKSKKED	tr|Q6TUQ4|Q6TUQ4_YMTV5	279	sp|P46940|IQGA1_HUMAN Ras GTPase-activating-like protein IQGAP1 OS=Homo sapiens OX=9606 GN=IQGAP1 PE=1 SV=1	1436	DKMKKSKSVKED
DKMKIMKSKKED	tr|Q6TUQ4|Q6TUQ4_YMTV5	279	tr|H0YLE8|H0YLE8_HUMAN Ras GTPase-activating-like protein IQGAP1 OS=Homo sapiens OX=9606 GN=IQGAP1 PE=1 SV=1	864	DKMKKSKSVKED
TEACVSGSSLVN	tr|Q6TUM3|Q6TUM3_YMTV5	127	sp|Q92619|HMHA1_HUMAN Rho GTPase-activating protein 45 OS=Homo sapiens OX=9606 GN=ARHGAP45 PE=1 SV=2	944	TEATVSLSSLVD
TEACVSGSSLVN	tr|Q6TUM3|Q6TUM3_YMTV5	127	tr|K7EM85|K7EM85_HUMAN Rho GTPase-activating protein 45 OS=Homo sapiens OX=9606 GN=ARHGAP45 PE=1 SV=1	971	TEATVSLSSLVD
TEACVSGSSLVN	tr|Q6TUM3|Q6TUM3_YMTV5	127	tr|F5H1R4|F5H1R4_HUMAN Rho GTPase-activating protein 45 OS=Homo sapiens OX=9606 GN=ARHGAP45 PE=1 SV=1	827	TEATVSLSSLVD
TEACVSGSSLVN	tr|Q6TUM3|Q6TUM3_YMTV5	127	tr|K7ES92|K7ES92_HUMAN Rho GTPase-activating protein 45 OS=Homo sapiens OX=9606 GN=ARHGAP45 PE=1 SV=1	579	TEATVSLSSLVD
TEACVSGSSLVN	tr|Q6TUM3|Q6TUM3_YMTV5	127	tr|K7ES98|K7ES98_HUMAN Rho GTPase-activating protein 45 OS=Homo sapiens OX=9606 GN=ARHGAP45 PE=1 SV=1	948	TEATVSLSSLVD
FYNHDLFLSLIK	sp|Q6TUY0|PAP1_YMTV5	37	sp|Q70CQ2|UBP34_HUMAN Ubiquitin carboxyl-terminal hydrolase 34 OS=Homo sapiens OX=9606 GN=USP34 PE=1 SV=2	423	RYIHDLFPSLIK
VDGEPIEPRALG	tr|Q6TUU4|Q6TUU4_YMTV5	686	sp|Q96NY7|CLIC6_HUMAN Chloride intracellular channel protein 6 OS=Homo sapiens OX=9606 GN=CLIC6 PE=2 SV=3	437	EDGEASEPRALG
ISSMRSSGGMSL	tr|Q6TUU1|Q6TUU1_YMTV5	195	tr|G8JLG2|G8JLG2_HUMAN Corneodesmosin OS=Homo sapiens OX=9606 GN=CDSN PE=1 SV=1	78	ISSARSSGGGSS
ISSMRSSGGMSL	tr|Q6TUU1|Q6TUU1_YMTV5	195	sp|Q15517|CDSN_HUMAN Corneodesmosin OS=Homo sapiens OX=9606 GN=CDSN PE=1 SV=3	78	ISSARSSGGGSS
ISSMRSSGGMSL	tr|Q6TUU1|Q6TUU1_YMTV5	195	tr|Q2L6G8|Q2L6G8_HUMAN Corneodesmosin OS=Homo sapiens OX=9606 GN=CDSN PE=1 SV=1	78	ISSARSSGGGSS
STSKRITRTFNL	tr|Q6TUS9|Q6TUS9_YMTV5	14	tr|V9GYK2|V9GYK2_HUMAN Heterogeneous nuclear ribonucleoprotein L-like OS=Homo sapiens OX=9606 GN=HNRNPLL PE=1 SV=1	148	STSKRITRPGNT
STSKRITRTFNL	tr|Q6TUS9|Q6TUS9_YMTV5	14	tr|C9IYN3|C9IYN3_HUMAN Heterogeneous nuclear ribonucleoprotein L-like OS=Homo sapiens OX=9606 GN=HNRNPLL PE=1 SV=2	143	STSKRITRPGNT
STSKRITRTFNL	tr|Q6TUS9|Q6TUS9_YMTV5	14	tr|B7WPG3|B7WPG3_HUMAN Heterogeneous nuclear ribonucleoprotein L-like OS=Homo sapiens OX=9606 GN=HNRNPLL PE=1 SV=1	148	STSKRITRPGNT
STSKRITRTFNL	tr|Q6TUS9|Q6TUS9_YMTV5	14	tr|C9JJZ7|C9JJZ7_HUMAN Heterogeneous nuclear ribonucleoprotein L-like (Fragment) OS=Homo sapiens OX=9606 GN=HNRNPLL PE=1 SV=1	87	STSKRITRPGNT
STSKRITRTFNL	tr|Q6TUS9|Q6TUS9_YMTV5	14	sp|Q8WVV9|HNRLL_HUMAN Heterogeneous nuclear ribonucleoprotein L-like OS=Homo sapiens OX=9606 GN=HNRNPLL PE=1 SV=1	148	STSKRITRPGNT
STSKRITRTFNL	tr|Q6TUS9|Q6TUS9_YMTV5	14	tr|H7BXH8|H7BXH8_HUMAN Heterogeneous nuclear ribonucleoprotein L-like (Fragment) OS=Homo sapiens OX=9606 GN=HNRNPLL PE=1 SV=1	83	STSKRITRPGNT
VIGSLVMASLLV	tr|Q6TUM9|Q6TUM9_YMTV5	45	tr|H0YHW7|H0YHW7_HUMAN Low-density lipoprotein receptor-related protein 10 (Fragment) OS=Homo sapiens OX=9606 GN=LRP10 PE=1 SV=1	348	VIGSLVCGLLLV
VIGSLVMASLLV	tr|Q6TUM9|Q6TUM9_YMTV5	45	sp|Q7Z4F1|LRP10_HUMAN Low-density lipoprotein receptor-related protein 10 OS=Homo sapiens OX=9606 GN=LRP10 PE=1 SV=2	446	VIGSLVCGLLLV
EILSRLEKKVSQ	tr|Q6TUU4|Q6TUU4_YMTV5	1257	sp|A6NCM1|IQCAL_HUMAN IQ and AAA domain-containing protein 1-like OS=Homo sapiens OX=9606 GN=IQCA1L PE=3 SV=3	141	EILSRLEPVSSQ
ILNRSLLKSLQD	tr|Q6TUV6|Q6TUV6_YMTV5	12	sp|A6NKB5|PCX2_HUMAN Pecanex-like protein 2 OS=Homo sapiens OX=9606 GN=PCNX2 PE=1 SV=3	1551	IKNESLLKSLQP
LFAIVVVALIIS	tr|Q6TUV3|Q6TUV3_YMTV5	186	tr|B7Z4W8|B7Z4W8_HUMAN GRAM domain-containing protein 2B OS=Homo sapiens OX=9606 GN=GRAMD2B PE=1 SV=1	240	FYAIVVCALIIS
LFAIVVVALIIS	tr|Q6TUV3|Q6TUV3_YMTV5	186	sp|Q96HH9|GRM2B_HUMAN GRAM domain-containing protein 2B OS=Homo sapiens OX=9606 GN=GRAMD2B PE=1 SV=1	349	FYAIVVCALIIS
LFAIVVVALIIS	tr|Q6TUV3|Q6TUV3_YMTV5	186	tr|E9PD09|E9PD09_HUMAN GRAM domain-containing protein 2B OS=Homo sapiens OX=9606 GN=GRAMD2B PE=1 SV=1	327	FYAIVVCALIIS
RFSNLVKNLSDL	tr|Q6TUT6|Q6TUT6_YMTV5	685	sp|Q9BZW8|CD244_HUMAN Natural killer cell receptor 2B4 OS=Homo sapiens OX=9606 GN=CD244 PE=1 SV=2	82	RFSFIVKNLSLL
ISEILRDSEDEY	tr|Q6TUQ3|Q6TUQ3_YMTV5	1071	sp|Q5JTH9|RRP12_HUMAN RRP12-like protein OS=Homo sapiens OX=9606 GN=RRP12 PE=1 SV=2	1073	IEEILADSEDEE
ECSFSNMLPFYA	tr|Q6TUY6|Q6TUY6_YMTV5	577	sp|Q6IEE8|SN12L_HUMAN Schlafen family member 12-like OS=Homo sapiens OX=9606 GN=SLFN12L PE=2 SV=4	98	ENSFSNMLPFVP
ECSFSNMLPFYA	tr|Q6TUY6|Q6TUY6_YMTV5	577	tr|A0A499FJ85|A0A499FJ85_HUMAN Schlafen family member 12-like OS=Homo sapiens OX=9606 GN=SLFN12L PE=4 SV=1	80	ENSFSNMLPFVP
EFLIPITEVLNN	sp|Q6TUY0|PAP1_YMTV5	425	tr|A0A494C0W7|A0A494C0W7_HUMAN Cytochrome P450 3A4 OS=Homo sapiens OX=9606 GN=CYP3A4 PE=1 SV=1	178	PFLIPILEVLNI
EFLIPITEVLNN	sp|Q6TUY0|PAP1_YMTV5	425	tr|E7EVM8|E7EVM8_HUMAN Cytochrome P450 3A4 OS=Homo sapiens OX=9606 GN=CYP3A4 PE=1 SV=1	77	PFLIPILEVLNI
EFLIPITEVLNN	sp|Q6TUY0|PAP1_YMTV5	425	sp|P08684|CP3A4_HUMAN Cytochrome P450 3A4 OS=Homo sapiens OX=9606 GN=CYP3A4 PE=1 SV=4	227	PFLIPILEVLNI
EFLIPITEVLNN	sp|Q6TUY0|PAP1_YMTV5	425	tr|A0A494C192|A0A494C192_HUMAN Cytochrome P450 3A4 OS=Homo sapiens OX=9606 GN=CYP3A4 PE=1 SV=1	74	PFLIPILEVLNI
EFLIPITEVLNN	sp|Q6TUY0|PAP1_YMTV5	425	tr|A0A499FJM4|A0A499FJM4_HUMAN Cytochrome P450 3A4 OS=Homo sapiens OX=9606 GN=CYP3A4 PE=1 SV=1	227	PFLIPILEVLNI
SHLNLKREDMFV	tr|Q6TUX4|Q6TUX4_YMTV5	256	tr|Q8N450|Q8N450_HUMAN FSD1-like protein OS=Homo sapiens OX=9606 GN=FSD1L PE=1 SV=1	90	SHLNLKVEDTCV
SHLNLKREDMFV	tr|Q6TUX4|Q6TUX4_YMTV5	256	sp|Q9BXM9|FSD1L_HUMAN FSD1-like protein OS=Homo sapiens OX=9606 GN=FSD1L PE=1 SV=2	309	SHLNLKVEDTCV
SHLNLKREDMFV	tr|Q6TUX4|Q6TUX4_YMTV5	256	tr|A0A0C4DG97|A0A0C4DG97_HUMAN FSD1-like protein OS=Homo sapiens OX=9606 GN=FSD1L PE=1 SV=1	277	SHLNLKVEDTCV
SHLNLKREDMFV	tr|Q6TUX4|Q6TUX4_YMTV5	256	tr|F8W946|F8W946_HUMAN FSD1-like protein OS=Homo sapiens OX=9606 GN=FSD1L PE=1 SV=1	277	SHLNLKVEDTCV
SHLNLKREDMFV	tr|Q6TUX4|Q6TUX4_YMTV5	256	tr|C9JD05|C9JD05_HUMAN FSD1-like protein OS=Homo sapiens OX=9606 GN=FSD1L PE=1 SV=1	309	SHLNLKVEDTCV
ISKHILRDGDTL	tr|Q6TV03|Q6TV03_YMTV5	60	sp|Q8NCJ5|SPRY3_HUMAN SPRY domain-containing protein 3 OS=Homo sapiens OX=9606 GN=SPRYD3 PE=1 SV=2	45	RFKHILVDGDTL
ISKHILRDGDTL	tr|Q6TV03|Q6TV03_YMTV5	60	tr|F8VWW7|F8VWW7_HUMAN SPRY domain-containing protein 3 OS=Homo sapiens OX=9606 GN=SPRYD3 PE=1 SV=1	82	RFKHILVDGDTL
ISKHILRDGDTL	tr|Q6TV03|Q6TV03_YMTV5	60	tr|B7Z1Y3|B7Z1Y3_HUMAN SPRY domain-containing protein 3 OS=Homo sapiens OX=9606 GN=SPRYD3 PE=1 SV=1	45	RFKHILVDGDTL
SSASIILTQNEN	tr|Q6TUP4|Q6TUP4_YMTV5	54	tr|A0A6Q8PGP6|A0A6Q8PGP6_HUMAN Centrosomal protein of 290 kDa OS=Homo sapiens OX=9606 GN=CEP290 PE=1 SV=1	772	SSASIINSQNEY
SSASIILTQNEN	tr|Q6TUP4|Q6TUP4_YMTV5	54	tr|A0A6Q8PG44|A0A6Q8PG44_HUMAN Centrosomal protein of 290 kDa OS=Homo sapiens OX=9606 GN=CEP290 PE=1 SV=1	772	SSASIINSQNEY
SSASIILTQNEN	tr|Q6TUP4|Q6TUP4_YMTV5	54	sp|O15078|CE290_HUMAN Centrosomal protein of 290 kDa OS=Homo sapiens OX=9606 GN=CEP290 PE=1 SV=2	772	SSASIINSQNEY
SSASIILTQNEN	tr|Q6TUP4|Q6TUP4_YMTV5	54	tr|A0A6Q8PGB1|A0A6Q8PGB1_HUMAN Centrosomal protein of 290 kDa OS=Homo sapiens OX=9606 GN=CEP290 PE=1 SV=1	1059	SSASIINSQNEY
SSASIILTQNEN	tr|Q6TUP4|Q6TUP4_YMTV5	54	tr|A0A6Q8PH78|A0A6Q8PH78_HUMAN Centrosomal protein of 290 kDa OS=Homo sapiens OX=9606 GN=CEP290 PE=1 SV=1	1028	SSASIINSQNEY
SSASIILTQNEN	tr|Q6TUP4|Q6TUP4_YMTV5	54	tr|A0A6Q8PH24|A0A6Q8PH24_HUMAN Centrosomal protein of 290 kDa OS=Homo sapiens OX=9606 GN=CEP290 PE=1 SV=1	765	SSASIINSQNEY
