query	query_seqname	query_start	target_seqname	target_start	target
NKTSILLQLKEK	tr|G8H3V2|G8H3V2_PIARV	25	sp|Q9UBU7|DBF4A_HUMAN Protein DBF4 homolog A OS=Homo sapiens OX=9606 GN=DBF4 PE=1 SV=1	279	GGTSIQLQLKEK
SVTLSLLNSVKS	tr|G8H3V2|G8H3V2_PIARV	488	tr|A0A087X0J2|A0A087X0J2_HUMAN UBX domain-containing protein 8 (Fragment) OS=Homo sapiens OX=9606 GN=UBXN8 PE=1 SV=1	231	SVTTSWLNSFKS
SVTLSLLNSVKS	tr|G8H3V2|G8H3V2_PIARV	488	tr|A0A087WWA4|A0A087WWA4_HUMAN UBX domain-containing protein 8 (Fragment) OS=Homo sapiens OX=9606 GN=UBXN8 PE=1 SV=1	24	SVTTSWLNSFKS
SVTLSLLNSVKS	tr|G8H3V2|G8H3V2_PIARV	488	tr|A0A087WT23|A0A087WT23_HUMAN UBX domain-containing protein 8 OS=Homo sapiens OX=9606 GN=UBXN8 PE=1 SV=1	93	SVTTSWLNSFKS
SVTLSLLNSVKS	tr|G8H3V2|G8H3V2_PIARV	488	sp|O00124|UBXN8_HUMAN UBX domain-containing protein 8 OS=Homo sapiens OX=9606 GN=UBXN8 PE=1 SV=2	53	SVTTSWLNSFKS
SVTLSLLNSVKS	tr|G8H3V2|G8H3V2_PIARV	488	tr|A0A087WV67|A0A087WV67_HUMAN UBX domain-containing protein 8 OS=Homo sapiens OX=9606 GN=UBXN8 PE=1 SV=1	53	SVTTSWLNSFKS
SVTLSLLNSVKS	tr|G8H3V2|G8H3V2_PIARV	488	tr|A0A087WUA4|A0A087WUA4_HUMAN UBX domain-containing protein 8 OS=Homo sapiens OX=9606 GN=UBXN8 PE=1 SV=1	53	SVTTSWLNSFKS
KLKGEAKLLLKS	tr|G8H3V2|G8H3V2_PIARV	1529	tr|I3L121|I3L121_HUMAN Clusterin-associated protein 1 (Fragment) OS=Homo sapiens OX=9606 GN=CLUAP1 PE=1 SV=1	131	KLKEEEKRLLKS
KLKGEAKLLLKS	tr|G8H3V2|G8H3V2_PIARV	1529	sp|Q96AJ1|CLUA1_HUMAN Clusterin-associated protein 1 OS=Homo sapiens OX=9606 GN=CLUAP1 PE=1 SV=4	297	KLKEEEKRLLKS
KLKGEAKLLLKS	tr|G8H3V2|G8H3V2_PIARV	1529	tr|J3KNW5|J3KNW5_HUMAN Clusterin-associated protein 1 OS=Homo sapiens OX=9606 GN=CLUAP1 PE=1 SV=1	297	KLKEEEKRLLKS
KLKGEAKLLLKS	tr|G8H3V2|G8H3V2_PIARV	1529	tr|I3L3S9|I3L3S9_HUMAN Clusterin associated protein 1, isoform CRA_a OS=Homo sapiens OX=9606 GN=CLUAP1 PE=1 SV=1	297	KLKEEEKRLLKS
TREGLIKIFDLR	tr|B3SN54|B3SN54_PIARV	152	sp|Q9UI33|SCNBA_HUMAN Sodium channel protein type 11 subunit alpha OS=Homo sapiens OX=9606 GN=SCN11A PE=1 SV=2	1410	TLECLIKIFALR
TREGLIKIFDLR	tr|B3SN54|B3SN54_PIARV	152	tr|A0A6Q8PFM8|A0A6Q8PFM8_HUMAN Sodium channel protein OS=Homo sapiens OX=9606 GN=SCN11A PE=1 SV=1	1283	TLECLIKIFALR
TREGLIKIFDLR	tr|B3SN54|B3SN54_PIARV	152	tr|A0A6Q8PGN4|A0A6Q8PGN4_HUMAN Sodium channel protein OS=Homo sapiens OX=9606 GN=SCN11A PE=3 SV=1	1350	TLECLIKIFALR
TREGLIKIFDLR	tr|B3SN54|B3SN54_PIARV	152	tr|A0A6Q8PGY3|A0A6Q8PGY3_HUMAN Sodium channel protein type 11 subunit alpha OS=Homo sapiens OX=9606 GN=SCN11A PE=1 SV=1	1410	TLECLIKIFALR
VSLNVQLFLSEI	tr|G8H3V2|G8H3V2_PIARV	1888	sp|Q9Y672|ALG6_HUMAN Dolichyl pyrophosphate Man9GlcNAc2 alpha-1,3-glucosyltransferase OS=Homo sapiens OX=9606 GN=ALG6 PE=1 SV=2	351	VSLPVCLVLSEI
YQLQATLLLRLI	tr|B3SN54|B3SN54_PIARV	240	sp|P43116|PE2R2_HUMAN Prostaglandin E2 receptor EP2 subtype OS=Homo sapiens OX=9606 GN=PTGER2 PE=2 SV=2	197	LQLYATLLLLLI
SINSVTLSLLNS	tr|G8H3V2|G8H3V2_PIARV	485	sp|Q8IZP9|AGRG2_HUMAN Adhesion G-protein coupled receptor G2 OS=Homo sapiens OX=9606 GN=ADGRG2 PE=1 SV=2	73	SLNDVTLSLLPS
YSNLLLLEDLII	tr|G8H3V2|G8H3V2_PIARV	660	sp|Q58EX2|SDK2_HUMAN Protein sidekick-2 OS=Homo sapiens OX=9606 GN=SDK2 PE=1 SV=3	748	DVNNLLLEDLII
IDLLSDLEKLKK	tr|B3SN54|B3SN54_PIARV	98	sp|Q9NXG0|CNTLN_HUMAN Centlein OS=Homo sapiens OX=9606 GN=CNTLN PE=1 SV=6	255	TDLLNDLEKLRK
TSILLQLKEKLV	tr|G8H3V2|G8H3V2_PIARV	27	sp|Q9UBU7|DBF4A_HUMAN Protein DBF4 homolog A OS=Homo sapiens OX=9606 GN=DBF4 PE=1 SV=1	281	TSIQLQLKEKKK
DLLSDLEKLKKK	tr|B3SN54|B3SN54_PIARV	99	sp|Q9NXG0|CNTLN_HUMAN Centlein OS=Homo sapiens OX=9606 GN=CNTLN PE=1 SV=6	256	DLLNDLEKLRKQ
DVKNLPRDRDEQ	tr|B3SN54|B3SN54_PIARV	352	sp|Q4VXU2|PAP1L_HUMAN Polyadenylate-binding protein 1-like OS=Homo sapiens OX=9606 GN=PABPC1L PE=2 SV=1	194	YVKNLPVDVDEQ
DVKNLPRDRDEQ	tr|B3SN54|B3SN54_PIARV	352	tr|A0A6Q8JFT6|A0A6Q8JFT6_HUMAN Polyadenylate-binding protein OS=Homo sapiens OX=9606 GN=PABPC1L PE=1 SV=1	194	YVKNLPVDVDEQ
KTSILLQLKEKL	tr|G8H3V2|G8H3V2_PIARV	26	sp|Q9UBU7|DBF4A_HUMAN Protein DBF4 homolog A OS=Homo sapiens OX=9606 GN=DBF4 PE=1 SV=1	280	GTSIQLQLKEKK
NPPLRSGGSPDV	tr|B3SN54|B3SN54_PIARV	342	tr|A0A0A0MRA3|A0A0A0MRA3_HUMAN Titin OS=Homo sapiens OX=9606 GN=TTN PE=1 SV=1	21571	NPPLRDGGSKIV
NPPLRSGGSPDV	tr|B3SN54|B3SN54_PIARV	342	tr|A0A0A0MTS7|A0A0A0MTS7_HUMAN Titin OS=Homo sapiens OX=9606 GN=TTN PE=1 SV=1	30444	NPPLRDGGSKIV
NPPLRSGGSPDV	tr|B3SN54|B3SN54_PIARV	342	sp|Q8WZ42|TITIN_HUMAN Titin OS=Homo sapiens OX=9606 GN=TTN PE=1 SV=4	28803	NPPLRDGGSKIV
QIQLETNVSLFK	tr|Q9YTW9|Q9YTW9_PIARV	341	tr|A0A075B778|A0A075B778_HUMAN ATP-binding cassette sub-family A member 5 OS=Homo sapiens OX=9606 GN=ABCA5 PE=1 SV=1	184	IIQLKTNVSLWK
QIQLETNVSLFK	tr|Q9YTW9|Q9YTW9_PIARV	341	tr|K7EPM3|K7EPM3_HUMAN ATP-binding cassette sub-family A member 5 (Fragment) OS=Homo sapiens OX=9606 GN=ABCA5 PE=1 SV=1	184	IIQLKTNVSLWK
QIQLETNVSLFK	tr|Q9YTW9|Q9YTW9_PIARV	341	sp|Q8WWZ7|ABCA5_HUMAN ATP-binding cassette sub-family A member 5 OS=Homo sapiens OX=9606 GN=ABCA5 PE=2 SV=2	184	IIQLKTNVSLWK
QIQLETNVSLFK	tr|Q9YTW9|Q9YTW9_PIARV	341	tr|K7ENF9|K7ENF9_HUMAN ATP-binding cassette sub-family A member 5 (Fragment) OS=Homo sapiens OX=9606 GN=ABCA5 PE=1 SV=1	48	IIQLKTNVSLWK
LVIAELFLKSSS	tr|G8H3V2|G8H3V2_PIARV	97	tr|F8WAE6|F8WAE6_HUMAN Mediator of RNA polymerase II transcription subunit 12-like protein OS=Homo sapiens OX=9606 GN=MED12L PE=1 SV=1	719	VVEAELLLKSSS
LVIAELFLKSSS	tr|G8H3V2|G8H3V2_PIARV	97	sp|Q86YW9|MD12L_HUMAN Mediator of RNA polymerase II transcription subunit 12-like protein OS=Homo sapiens OX=9606 GN=MED12L PE=1 SV=2	859	VVEAELLLKSSS
LDLASFLDFVTQ	tr|G8H3V2|G8H3V2_PIARV	587	tr|F5GYQ1|F5GYQ1_HUMAN V-type proton ATPase subunit OS=Homo sapiens OX=9606 GN=ATP6V0D1 PE=1 SV=1	91	EPLASFLDFITQ
VLEDTGPWKVRG	tr|G8H3V2|G8H3V2_PIARV	2167	sp|Q68BL7|OLM2A_HUMAN Olfactomedin-like protein 2A OS=Homo sapiens OX=9606 GN=OLFML2A PE=2 SV=1	506	VYEDTTPWKWRG
VEGVRLLSLLVD	tr|G8H3V2|G8H3V2_PIARV	40	tr|K7EPD9|K7EPD9_HUMAN Gastric inhibitory polypeptide receptor OS=Homo sapiens OX=9606 GN=GIPR PE=4 SV=1	236	VEGVYLHSLLVL
VEGVRLLSLLVD	tr|G8H3V2|G8H3V2_PIARV	40	tr|A0A494C077|A0A494C077_HUMAN Gastric inhibitory polypeptide receptor OS=Homo sapiens OX=9606 GN=GIPR PE=4 SV=1	175	VEGVYLHSLLVL
VEGVRLLSLLVD	tr|G8H3V2|G8H3V2_PIARV	40	sp|P48546|GIPR_HUMAN Gastric inhibitory polypeptide receptor OS=Homo sapiens OX=9606 GN=GIPR PE=1 SV=1	236	VEGVYLHSLLVL
VKNLPRDRDEQL	tr|B3SN54|B3SN54_PIARV	353	sp|Q4VXU2|PAP1L_HUMAN Polyadenylate-binding protein 1-like OS=Homo sapiens OX=9606 GN=PABPC1L PE=2 SV=1	195	VKNLPVDVDEQG
VKNLPRDRDEQL	tr|B3SN54|B3SN54_PIARV	353	tr|A0A6Q8JFT6|A0A6Q8JFT6_HUMAN Polyadenylate-binding protein OS=Homo sapiens OX=9606 GN=PABPC1L PE=1 SV=1	195	VKNLPVDVDEQG
DLASFLDFVTQP	tr|G8H3V2|G8H3V2_PIARV	588	tr|F5GYQ1|F5GYQ1_HUMAN V-type proton ATPase subunit OS=Homo sapiens OX=9606 GN=ATP6V0D1 PE=1 SV=1	92	PLASFLDFITQE
VNPTQTLEVPNE	tr|G8H3V2|G8H3V2_PIARV	729	tr|A0A494C0J7|A0A494C0J7_HUMAN TGc domain-containing protein OS=Homo sapiens OX=9606 PE=3 SV=1	612	DNPTLTLEVLNE
VNPTQTLEVPNE	tr|G8H3V2|G8H3V2_PIARV	729	sp|Q08188|TGM3_HUMAN Protein-glutamine gamma-glutamyltransferase E OS=Homo sapiens OX=9606 GN=TGM3 PE=1 SV=4	593	DNPTLTLEVLNE
LPTCYALRTGNF	tr|Q9YTW9|Q9YTW9_PIARV	396	tr|K7EN33|K7EN33_HUMAN Notchless protein homolog 1 (Fragment) OS=Homo sapiens OX=9606 GN=NLE1 PE=1 SV=1	75	LSTDYALRTGAF
LPTCYALRTGNF	tr|Q9YTW9|Q9YTW9_PIARV	396	tr|A0A0A0MRH0|A0A0A0MRH0_HUMAN Notchless protein homolog 1 OS=Homo sapiens OX=9606 GN=NLE1 PE=1 SV=1	253	LSTDYALRTGAF
LPTCYALRTGNF	tr|Q9YTW9|Q9YTW9_PIARV	396	sp|Q9NVX2|NLE1_HUMAN Notchless protein homolog 1 OS=Homo sapiens OX=9606 GN=NLE1 PE=1 SV=4	295	LSTDYALRTGAF
DALTVMNIIGII	tr|B3SN54|B3SN54_PIARV	193	sp|P62750|RL23A_HUMAN 60S ribosomal protein L23a OS=Homo sapiens OX=9606 GN=RPL23A PE=1 SV=1	145	DALDVANKIGII
DALTVMNIIGII	tr|B3SN54|B3SN54_PIARV	193	tr|K7EMA7|K7EMA7_HUMAN 60S ribosomal protein L23a OS=Homo sapiens OX=9606 GN=RPL23A PE=1 SV=1	59	DALDVANKIGII
DALTVMNIIGII	tr|B3SN54|B3SN54_PIARV	193	tr|A8MUS3|A8MUS3_HUMAN 60S ribosomal protein L23a OS=Homo sapiens OX=9606 GN=RPL23A PE=1 SV=1	183	DALDVANKIGII
DALTVMNIIGII	tr|B3SN54|B3SN54_PIARV	193	tr|H7BY10|H7BY10_HUMAN 60S ribosomal protein L23a (Fragment) OS=Homo sapiens OX=9606 GN=RPL23A PE=1 SV=1	147	DALDVANKIGII
DALTVMNIIGII	tr|B3SN54|B3SN54_PIARV	193	tr|K7ERT8|K7ERT8_HUMAN 60S ribosomal protein L23a (Fragment) OS=Homo sapiens OX=9606 GN=RPL23A PE=1 SV=1	164	DALDVANKIGII
SNLLLLEDLIIV	tr|G8H3V2|G8H3V2_PIARV	661	sp|Q58EX2|SDK2_HUMAN Protein sidekick-2 OS=Homo sapiens OX=9606 GN=SDK2 PE=1 SV=3	749	VNNLLLEDLIIW
RVEVPRLISKLS	tr|G8H3V2|G8H3V2_PIARV	1676	sp|Q9P258|RCC2_HUMAN Protein RCC2 OS=Homo sapiens OX=9606 GN=RCC2 PE=1 SV=2	189	RVEAPRLIEGLS
GVAIHRKKKGLM	tr|B3SN54|B3SN54_PIARV	502	tr|A0A0C4DH52|A0A0C4DH52_HUMAN Constitutive coactivator of PPAR-gamma-like protein 1 (Fragment) OS=Homo sapiens OX=9606 GN=FAM120A PE=1 SV=1	401	RVAEHRHKKGLM
GVAIHRKKKGLM	tr|B3SN54|B3SN54_PIARV	502	sp|Q9NZB2|F120A_HUMAN Constitutive coactivator of PPAR-gamma-like protein 1 OS=Homo sapiens OX=9606 GN=FAM120A PE=1 SV=2	557	RVAEHRHKKGLM
SHDLKRKRGEEE	tr|B3SN51|B3SN51_PIARV	6	sp|Q9UHV2|SRTD1_HUMAN SERTA domain-containing protein 1 OS=Homo sapiens OX=9606 GN=SERTAD1 PE=1 SV=2	3	SKGLKRKREEEE
KQLSNYLCECKK	tr|G8H3V2|G8H3V2_PIARV	1851	sp|Q9P0K7|RAI14_HUMAN Ankycorbin OS=Homo sapiens OX=9606 GN=RAI14 PE=1 SV=2	926	KQLQNQLAECKK
VAIHRKKKGLMT	tr|B3SN54|B3SN54_PIARV	503	tr|A0A0C4DH52|A0A0C4DH52_HUMAN Constitutive coactivator of PPAR-gamma-like protein 1 (Fragment) OS=Homo sapiens OX=9606 GN=FAM120A PE=1 SV=1	402	VAEHRHKKGLMY
VAIHRKKKGLMT	tr|B3SN54|B3SN54_PIARV	503	sp|Q9NZB2|F120A_HUMAN Constitutive coactivator of PPAR-gamma-like protein 1 OS=Homo sapiens OX=9606 GN=FAM120A PE=1 SV=2	558	VAEHRHKKGLMY
QLQATLLLRLIL	tr|B3SN54|B3SN54_PIARV	241	sp|P43116|PE2R2_HUMAN Prostaglandin E2 receptor EP2 subtype OS=Homo sapiens OX=9606 GN=PTGER2 PE=2 SV=2	198	QLYATLLLLLIV
LELPFQILEVFI	tr|G8H3V2|G8H3V2_PIARV	1211	sp|Q8NDG6|TDRD9_HUMAN ATP-dependent RNA helicase TDRD9 OS=Homo sapiens OX=9606 GN=TDRD9 PE=2 SV=3	1002	LELPFQALEFKI
LELPFQILEVFI	tr|G8H3V2|G8H3V2_PIARV	1211	tr|A0A0C4DFS5|A0A0C4DFS5_HUMAN ATP-dependent RNA helicase TDRD9 OS=Homo sapiens OX=9606 GN=TDRD9 PE=1 SV=1	717	LELPFQALEFKI
LELPFQILEVFI	tr|G8H3V2|G8H3V2_PIARV	1211	tr|H0YJJ2|H0YJJ2_HUMAN ATP-dependent RNA helicase TDRD9 (Fragment) OS=Homo sapiens OX=9606 GN=TDRD9 PE=1 SV=1	729	LELPFQALEFKI
TVEGVRLLSLLV	tr|G8H3V2|G8H3V2_PIARV	39	tr|K7EPD9|K7EPD9_HUMAN Gastric inhibitory polypeptide receptor OS=Homo sapiens OX=9606 GN=GIPR PE=4 SV=1	235	LVEGVYLHSLLV
TVEGVRLLSLLV	tr|G8H3V2|G8H3V2_PIARV	39	tr|A0A494C077|A0A494C077_HUMAN Gastric inhibitory polypeptide receptor OS=Homo sapiens OX=9606 GN=GIPR PE=4 SV=1	174	LVEGVYLHSLLV
TVEGVRLLSLLV	tr|G8H3V2|G8H3V2_PIARV	39	sp|P48546|GIPR_HUMAN Gastric inhibitory polypeptide receptor OS=Homo sapiens OX=9606 GN=GIPR PE=1 SV=1	235	LVEGVYLHSLLV
TLCELGSYLFSR	tr|G8H3V2|G8H3V2_PIARV	1665	sp|P48553|TPC10_HUMAN Trafficking protein particle complex subunit 10 OS=Homo sapiens OX=9606 GN=TRAPPC10 PE=1 SV=2	302	TLLDLRSYLFSR
DTLQDALTVMNI	tr|B3SN54|B3SN54_PIARV	189	tr|B1ALD0|B1ALD0_HUMAN AP complex subunit beta OS=Homo sapiens OX=9606 GN=AP4B1 PE=1 SV=1	487	DTLQMALQVVNI
DTLQDALTVMNI	tr|B3SN54|B3SN54_PIARV	189	sp|Q9Y6B7|AP4B1_HUMAN AP-4 complex subunit beta-1 OS=Homo sapiens OX=9606 GN=AP4B1 PE=1 SV=2	655	DTLQMALQVVNI
NLLLLEDLIIVI	tr|G8H3V2|G8H3V2_PIARV	662	sp|Q58EX2|SDK2_HUMAN Protein sidekick-2 OS=Homo sapiens OX=9606 GN=SDK2 PE=1 SV=3	750	NNLLLEDLIIWT
TLVEWKKLLSAT	tr|B3SN54|B3SN54_PIARV	38	sp|P19075|TSN8_HUMAN Tetraspanin-8 OS=Homo sapiens OX=9606 GN=TSPAN8 PE=1 SV=1	120	TLYENTKLLSAT
LQEKLNRFLSPK	tr|G8H3V2|G8H3V2_PIARV	1337	sp|Q8IYT8|ULK2_HUMAN Serine/threonine-protein kinase ULK2 OS=Homo sapiens OX=9606 GN=ULK2 PE=1 SV=3	938	LTEKLNRFFSDK
GNLLNILTTIPD	tr|Q9YTW9|Q9YTW9_PIARV	2	sp|O14581|OR7AH_HUMAN Olfactory receptor 7A17 OS=Homo sapiens OX=9606 GN=OR7A17 PE=1 SV=1	41	GNLLIILATISD
GNLLNILTTIPD	tr|Q9YTW9|Q9YTW9_PIARV	2	sp|Q15622|OR7A5_HUMAN Olfactory receptor 7A5 OS=Homo sapiens OX=9606 GN=OR7A5 PE=2 SV=2	41	GNLLIILATISD
GNLLNILTTIPD	tr|Q9YTW9|Q9YTW9_PIARV	2	sp|O76100|OR7AA_HUMAN Olfactory receptor 7A10 OS=Homo sapiens OX=9606 GN=OR7A10 PE=3 SV=1	41	GNLLIILATISD
VIAELFLKSSSE	tr|G8H3V2|G8H3V2_PIARV	98	tr|F8WAE6|F8WAE6_HUMAN Mediator of RNA polymerase II transcription subunit 12-like protein OS=Homo sapiens OX=9606 GN=MED12L PE=1 SV=1	720	VEAELLLKSSSL
VIAELFLKSSSE	tr|G8H3V2|G8H3V2_PIARV	98	sp|Q86YW9|MD12L_HUMAN Mediator of RNA polymerase II transcription subunit 12-like protein OS=Homo sapiens OX=9606 GN=MED12L PE=1 SV=2	860	VEAELLLKSSSL
NPTQTLEVPNEE	tr|G8H3V2|G8H3V2_PIARV	730	tr|A0A494C0J7|A0A494C0J7_HUMAN TGc domain-containing protein OS=Homo sapiens OX=9606 PE=3 SV=1	613	NPTLTLEVLNEA
NPTQTLEVPNEE	tr|G8H3V2|G8H3V2_PIARV	730	sp|Q08188|TGM3_HUMAN Protein-glutamine gamma-glutamyltransferase E OS=Homo sapiens OX=9606 GN=TGM3 PE=1 SV=4	594	NPTLTLEVLNEA
LDLTNSRSMMLP	tr|G8H3V2|G8H3V2_PIARV	804	sp|Q6IEE8|SN12L_HUMAN Schlafen family member 12-like OS=Homo sapiens OX=9606 GN=SLFN12L PE=2 SV=4	95	LDLENSFSNMLP
LDLTNSRSMMLP	tr|G8H3V2|G8H3V2_PIARV	804	tr|A0A499FJ85|A0A499FJ85_HUMAN Schlafen family member 12-like OS=Homo sapiens OX=9606 GN=SLFN12L PE=4 SV=1	77	LDLENSFSNMLP
QRTVSVEDMELG	tr|G8H3V2|G8H3V2_PIARV	1866	tr|A0A140T9L7|A0A140T9L7_HUMAN Tenascin-X (Fragment) OS=Homo sapiens OX=9606 GN=TNXB PE=1 SV=1	1404	QRTVTVEDLEPG
QRTVSVEDMELG	tr|G8H3V2|G8H3V2_PIARV	1866	tr|A0A140TA41|A0A140TA41_HUMAN Tenascin-X OS=Homo sapiens OX=9606 GN=TNXB PE=1 SV=1	3497	QRTVTVEDLEPG
QRTVSVEDMELG	tr|G8H3V2|G8H3V2_PIARV	1866	tr|A0A140T9C0|A0A140T9C0_HUMAN Tenascin-X OS=Homo sapiens OX=9606 GN=TNXB PE=1 SV=1	3477	QRTVTVEDLEPG
QRTVSVEDMELG	tr|G8H3V2|G8H3V2_PIARV	1866	tr|A0A140TA33|A0A140TA33_HUMAN Tenascin-X OS=Homo sapiens OX=9606 GN=TNXB PE=1 SV=1	3497	QRTVTVEDLEPG
QRTVSVEDMELG	tr|G8H3V2|G8H3V2_PIARV	1866	tr|A0A140T902|A0A140T902_HUMAN Tenascin-X OS=Homo sapiens OX=9606 GN=TNXB PE=1 SV=1	3477	QRTVTVEDLEPG
QRTVSVEDMELG	tr|G8H3V2|G8H3V2_PIARV	1866	tr|A0A140T8Y3|A0A140T8Y3_HUMAN Tenascin-X OS=Homo sapiens OX=9606 GN=TNXB PE=1 SV=1	3477	QRTVTVEDLEPG
QRTVSVEDMELG	tr|G8H3V2|G8H3V2_PIARV	1866	tr|A0A140TA52|A0A140TA52_HUMAN Tenascin-X OS=Homo sapiens OX=9606 GN=TNXB PE=1 SV=1	3497	QRTVTVEDLEPG
QRTVSVEDMELG	tr|G8H3V2|G8H3V2_PIARV	1866	tr|A0A140T8Z8|A0A140T8Z8_HUMAN Tenascin-X (Fragment) OS=Homo sapiens OX=9606 GN=TNXB PE=1 SV=1	2551	QRTVTVEDLEPG
QRTVSVEDMELG	tr|G8H3V2|G8H3V2_PIARV	1866	tr|A0A087X0I0|A0A087X0I0_HUMAN Tenascin-X OS=Homo sapiens OX=9606 GN=TNXB PE=1 SV=1	1217	QRTVTVEDLEPG
QRTVSVEDMELG	tr|G8H3V2|G8H3V2_PIARV	1866	sp|P22105|TENX_HUMAN Tenascin-X OS=Homo sapiens OX=9606 GN=TNXB PE=1 SV=5	3499	QRTVTVEDLEPG
QRTVSVEDMELG	tr|G8H3V2|G8H3V2_PIARV	1866	tr|A0A3B3ISX9|A0A3B3ISX9_HUMAN Tenascin-X OS=Homo sapiens OX=9606 GN=TNXB PE=1 SV=1	3746	QRTVTVEDLEPG
FRLASLIGQLER	tr|G8H3V2|G8H3V2_PIARV	244	tr|A0A0A0MS69|A0A0A0MS69_HUMAN Phosphodiesterase OS=Homo sapiens OX=9606 GN=PDE1C PE=1 SV=1	102	FRLRSLVKQLER
GKSQYYIEWIPD	tr|G8H3V2|G8H3V2_PIARV	142	sp|Q96L12|CALR3_HUMAN Calreticulin-3 OS=Homo sapiens OX=9606 GN=CALR3 PE=1 SV=2	124	GKSQYYIMFGPD
LASFLDFVTQPI	tr|G8H3V2|G8H3V2_PIARV	589	tr|F5GYQ1|F5GYQ1_HUMAN V-type proton ATPase subunit OS=Homo sapiens OX=9606 GN=ATP6V0D1 PE=1 SV=1	93	LASFLDFITQES
WDNTSIYSELVV	tr|Q9YTW9|Q9YTW9_PIARV	419	sp|Q6ZU64|CFA65_HUMAN Cilia- and flagella-associated protein 65 OS=Homo sapiens OX=9606 GN=CFAP65 PE=1 SV=2	1422	WDNSSIHSRLVV
IQLETNVSLFKH	tr|Q9YTW9|Q9YTW9_PIARV	342	tr|A0A075B778|A0A075B778_HUMAN ATP-binding cassette sub-family A member 5 OS=Homo sapiens OX=9606 GN=ABCA5 PE=1 SV=1	185	IQLKTNVSLWKE
IQLETNVSLFKH	tr|Q9YTW9|Q9YTW9_PIARV	342	tr|K7EPM3|K7EPM3_HUMAN ATP-binding cassette sub-family A member 5 (Fragment) OS=Homo sapiens OX=9606 GN=ABCA5 PE=1 SV=1	185	IQLKTNVSLWKE
IQLETNVSLFKH	tr|Q9YTW9|Q9YTW9_PIARV	342	sp|Q8WWZ7|ABCA5_HUMAN ATP-binding cassette sub-family A member 5 OS=Homo sapiens OX=9606 GN=ABCA5 PE=2 SV=2	185	IQLKTNVSLWKE
IQLETNVSLFKH	tr|Q9YTW9|Q9YTW9_PIARV	342	tr|K7ENF9|K7ENF9_HUMAN ATP-binding cassette sub-family A member 5 (Fragment) OS=Homo sapiens OX=9606 GN=ABCA5 PE=1 SV=1	49	IQLKTNVSLWKE
