query	query_seqname	query_start	target_seqname	target_start	target
NTRRNSLLFVEL	sp|Q6XQI4|L_JUNIN	343	sp|Q8IYW5|RN168_HUMAN E3 ubiquitin-protein ligase RNF168 OS=Homo sapiens OX=9606 GN=RNF168 PE=1 SV=1	65	HTRRNSLVNVEL
NTRRNSLLFVEL	sp|Q6XQI4|L_JUNIN	343	tr|F8WD60|F8WD60_HUMAN E3 ubiquitin-protein ligase RNF168 OS=Homo sapiens OX=9606 GN=RNF168 PE=1 SV=1	65	HTRRNSLVNVEL
MIRFKLKRLLEM	sp|Q6XQI4|L_JUNIN	1226	tr|E9PFE2|E9PFE2_HUMAN General transcription factor II-I repeat domain-containing protein 1 OS=Homo sapiens OX=9606 GN=GTF2IRD1 PE=1 SV=1	195	RIRFKLKRPLED
MIRFKLKRLLEM	sp|Q6XQI4|L_JUNIN	1226	sp|Q9UHL9|GT2D1_HUMAN General transcription factor II-I repeat domain-containing protein 1 OS=Homo sapiens OX=9606 GN=GTF2IRD1 PE=1 SV=1	195	RIRFKLKRPLED
LMVLIQLMLILH	sp|P26313|GLYC_JUNIN	22	sp|Q96AM1|MRGRF_HUMAN Mas-related G-protein coupled receptor member F OS=Homo sapiens OX=9606 GN=MRGPRF PE=2 SV=1	212	LMVLPCLALILH
DDLLELKSVMKQ	sp|Q6XQI4|L_JUNIN	1927	sp|Q9H095|DRC9_HUMAN Dynein regulatory complex protein 9 OS=Homo sapiens OX=9606 GN=IQCG PE=1 SV=1	389	QDLLELKSVIKL
AIFDLLPLTFTQ	sp|Q6XQI4|L_JUNIN	1315	sp|Q9P1Q0|VPS54_HUMAN Vacuolar protein sorting-associated protein 54 OS=Homo sapiens OX=9606 GN=VPS54 PE=1 SV=2	900	AIFDLLPEEQTQ
SSLNLEVADRCF	sp|Q6XQI4|L_JUNIN	315	tr|M0R315|M0R315_HUMAN fMet-Leu-Phe receptor (Fragment) OS=Homo sapiens OX=9606 GN=FPR1 PE=1 SV=1	63	SYLNLAVADFCF
SSLNLEVADRCF	sp|Q6XQI4|L_JUNIN	315	sp|P21462|FPR1_HUMAN fMet-Leu-Phe receptor OS=Homo sapiens OX=9606 GN=FPR1 PE=1 SV=3	63	SYLNLAVADFCF
SSLSLLVVSSVK	sp|Q6XQI4|L_JUNIN	490	sp|Q96B01|R51A1_HUMAN RAD51-associated protein 1 OS=Homo sapiens OX=9606 GN=RAD51AP1 PE=1 SV=1	315	SSSSPLVVVSVK
KLKRLLEMPMSL	sp|Q6XQI4|L_JUNIN	1230	tr|C9J9E2|C9J9E2_HUMAN CaM kinase-like vesicle-associated protein OS=Homo sapiens OX=9606 GN=CAMKV PE=1 SV=1	416	KGKRLLVMPRSL
EELPSLVRTIQS	sp|Q6XQI4|L_JUNIN	1575	tr|E9PQ67|E9PQ67_HUMAN Transcription factor SOX-6 (Fragment) OS=Homo sapiens OX=9606 GN=SOX6 PE=1 SV=1	54	EELPTLVSTIQQ
EELPSLVRTIQS	sp|Q6XQI4|L_JUNIN	1575	tr|E9PN02|E9PN02_HUMAN Transcription factor SOX-6 (Fragment) OS=Homo sapiens OX=9606 GN=SOX6 PE=1 SV=1	54	EELPTLVSTIQQ
EELPSLVRTIQS	sp|Q6XQI4|L_JUNIN	1575	tr|E9PQ78|E9PQ78_HUMAN Transcription factor SOX-6 OS=Homo sapiens OX=9606 GN=SOX6 PE=1 SV=1	54	EELPTLVSTIQQ
EELPSLVRTIQS	sp|Q6XQI4|L_JUNIN	1575	tr|E9PQL4|E9PQL4_HUMAN Transcription factor SOX-6 (Fragment) OS=Homo sapiens OX=9606 GN=SOX6 PE=1 SV=1	54	EELPTLVSTIQQ
EELPSLVRTIQS	sp|Q6XQI4|L_JUNIN	1575	sp|P35712|SOX6_HUMAN Transcription factor SOX-6 OS=Homo sapiens OX=9606 GN=SOX6 PE=1 SV=3	54	EELPTLVSTIQQ
EELPSLVRTIQS	sp|Q6XQI4|L_JUNIN	1575	sp|O00410|IPO5_HUMAN Importin-5 OS=Homo sapiens OX=9606 GN=IPO5 PE=1 SV=4	946	EALPLLVRVIQS
EELPSLVRTIQS	sp|Q6XQI4|L_JUNIN	1575	tr|H0Y8C6|H0Y8C6_HUMAN Importin-5 (Fragment) OS=Homo sapiens OX=9606 GN=IPO5 PE=1 SV=1	948	EALPLLVRVIQS
GDMKETLLHEDL	sp|Q6XQI4|L_JUNIN	228	sp|Q9NQV6|PRD10_HUMAN PR domain zinc finger protein 10 OS=Homo sapiens OX=9606 GN=PRDM10 PE=1 SV=3	260	GDRKERDLHEDL
GDMKETLLHEDL	sp|Q6XQI4|L_JUNIN	228	tr|E9PLV1|E9PLV1_HUMAN PR domain zinc finger protein 10 OS=Homo sapiens OX=9606 GN=PRDM10 PE=1 SV=1	234	GDRKERDLHEDL
LKFSVEHDTEHL	sp|Q6XQI4|L_JUNIN	457	sp|O75165|DJC13_HUMAN DnaJ homolog subfamily C member 13 OS=Homo sapiens OX=9606 GN=DNAJC13 PE=1 SV=5	83	LKFSTEHRTELL
LKFSVEHDTEHL	sp|Q6XQI4|L_JUNIN	457	tr|A0A3B3IRM0|A0A3B3IRM0_HUMAN DnaJ homolog subfamily C member 13 OS=Homo sapiens OX=9606 GN=DNAJC13 PE=1 SV=1	83	LKFSTEHRTELL
AANKFLTMLLRS	sp|Q6XQI4|L_JUNIN	1394	tr|M0R220|M0R220_HUMAN IgG receptor FcRn large subunit p51 (Fragment) OS=Homo sapiens OX=9606 GN=FCGRT PE=1 SV=1	134	AANKELTFLLFS
AANKFLTMLLRS	sp|Q6XQI4|L_JUNIN	1394	tr|M0R0H0|M0R0H0_HUMAN IgG receptor FcRn large subunit p51 (Fragment) OS=Homo sapiens OX=9606 GN=FCGRT PE=1 SV=1	87	AANKELTFLLFS
AANKFLTMLLRS	sp|Q6XQI4|L_JUNIN	1394	tr|M0QYN9|M0QYN9_HUMAN IgG receptor FcRn large subunit p51 OS=Homo sapiens OX=9606 GN=FCGRT PE=1 SV=1	170	AANKELTFLLFS
AANKFLTMLLRS	sp|Q6XQI4|L_JUNIN	1394	tr|M0QYN1|M0QYN1_HUMAN IgG receptor FcRn large subunit p51 (Fragment) OS=Homo sapiens OX=9606 GN=FCGRT PE=1 SV=1	169	AANKELTFLLFS
AANKFLTMLLRS	sp|Q6XQI4|L_JUNIN	1394	sp|P55899|FCGRN_HUMAN IgG receptor FcRn large subunit p51 OS=Homo sapiens OX=9606 GN=FCGRT PE=1 SV=1	170	AANKELTFLLFS
APGLINFLLGAL	sp|P14239|NCAP_JUNIN	433	tr|E9PFK5|E9PFK5_HUMAN Nucleolar protein 14 OS=Homo sapiens OX=9606 GN=NOP14 PE=1 SV=1	609	IPELINFLLGIL
APGLINFLLGAL	sp|P14239|NCAP_JUNIN	433	sp|P78316|NOP14_HUMAN Nucleolar protein 14 OS=Homo sapiens OX=9606 GN=NOP14 PE=1 SV=3	609	IPELINFLLGIL
QDDLLELKSVMK	sp|Q6XQI4|L_JUNIN	1926	sp|Q9H095|DRC9_HUMAN Dynein regulatory complex protein 9 OS=Homo sapiens OX=9606 GN=IQCG PE=1 SV=1	388	KQDLLELKSVIK
AFNSLLNEGEEL	sp|Q6XQI4|L_JUNIN	673	tr|C9JAM8|C9JAM8_HUMAN Plastin-1 (Fragment) OS=Homo sapiens OX=9606 GN=PLS1 PE=1 SV=1	170	ALIALLNEGEEL
AFNSLLNEGEEL	sp|Q6XQI4|L_JUNIN	673	sp|Q14651|PLSI_HUMAN Plastin-1 OS=Homo sapiens OX=9606 GN=PLS1 PE=1 SV=2	249	ALIALLNEGEEL
ASSLSLLVVSSV	sp|Q6XQI4|L_JUNIN	489	sp|Q9P2K9|DISP3_HUMAN Protein dispatched homolog 3 OS=Homo sapiens OX=9606 GN=DISP3 PE=2 SV=2	1238	AISLSILVGSSV
LLDISEFTLNMR	sp|Q6XQI4|L_JUNIN	1873	tr|A0A6Q8PFZ3|A0A6Q8PFZ3_HUMAN Transient receptor potential cation channel subfamily V member 4 OS=Homo sapiens OX=9606 GN=TRPV4 PE=1 SV=1	213	LLDIAERTGNMR
LLDISEFTLNMR	sp|Q6XQI4|L_JUNIN	1873	tr|F5H6Q4|F5H6Q4_HUMAN Transient receptor potential cation channel subfamily V member 4 OS=Homo sapiens OX=9606 GN=TRPV4 PE=1 SV=1	213	LLDIAERTGNMR
LLDISEFTLNMR	sp|Q6XQI4|L_JUNIN	1873	sp|Q9HBA0|TRPV4_HUMAN Transient receptor potential cation channel subfamily V member 4 OS=Homo sapiens OX=9606 GN=TRPV4 PE=1 SV=2	213	LLDIAERTGNMR
SKEIKSNTESQV	sp|Q6XQI4|L_JUNIN	760	sp|Q9BXU1|STK31_HUMAN Serine/threonine-protein kinase 31 OS=Homo sapiens OX=9606 GN=STK31 PE=2 SV=2	577	DKEIISNTYSQV
DLSLRQSSEESS	sp|Q6XQI4|L_JUNIN	305	tr|M0R201|M0R201_HUMAN Hormone-sensitive lipase (Fragment) OS=Homo sapiens OX=9606 GN=LIPE PE=1 SV=1	151	DLSLRGNSETSS
DLSLRQSSEESS	sp|Q6XQI4|L_JUNIN	305	tr|M0QY29|M0QY29_HUMAN Hormone-sensitive lipase (Fragment) OS=Homo sapiens OX=9606 GN=LIPE PE=1 SV=1	108	DLSLRGNSETSS
DLSLRQSSEESS	sp|Q6XQI4|L_JUNIN	305	sp|Q05469|LIPS_HUMAN Hormone-sensitive lipase OS=Homo sapiens OX=9606 GN=LIPE PE=1 SV=4	878	DLSLRGNSETSS
NSLLNEGEELEI	sp|Q6XQI4|L_JUNIN	675	tr|C9JAM8|C9JAM8_HUMAN Plastin-1 (Fragment) OS=Homo sapiens OX=9606 GN=PLS1 PE=1 SV=1	172	IALLNEGEELEE
NSLLNEGEELEI	sp|Q6XQI4|L_JUNIN	675	sp|Q14651|PLSI_HUMAN Plastin-1 OS=Homo sapiens OX=9606 GN=PLS1 PE=1 SV=2	251	IALLNEGEELEE
SLLFVELLLLTV	sp|Q6XQI4|L_JUNIN	348	sp|P48751|B3A3_HUMAN Anion exchange protein 3 OS=Homo sapiens OX=9606 GN=SLC4A3 PE=1 SV=2	1178	SLAFPFLLLLTV
LTPEDYDKKFKN	sp|Q6XQI4|L_JUNIN	107	tr|A0A2R8Y4H4|A0A2R8Y4H4_HUMAN Leucine-rich repeat-containing protein 9 OS=Homo sapiens OX=9606 GN=LRRC9 PE=4 SV=1	1420	LTPEVEDKKNKN
VDGLLMLITVPI	sp|Q6XQI4|L_JUNIN	2009	tr|A0A140T9S5|A0A140T9S5_HUMAN VWA7 OS=Homo sapiens OX=9606 GN=VWA7 PE=1 SV=1	521	VDGLLQKITVRI
VDGLLMLITVPI	sp|Q6XQI4|L_JUNIN	2009	sp|Q9Y334|VWA7_HUMAN von Willebrand factor A domain-containing protein 7 OS=Homo sapiens OX=9606 GN=VWA7 PE=2 SV=4	521	VDGLLQKITVRI
RAFEDNLLSLIN	sp|Q6XQI4|L_JUNIN	1508	sp|O60287|NPA1P_HUMAN Nucleolar pre-ribosomal-associated protein 1 OS=Homo sapiens OX=9606 GN=URB1 PE=1 SV=4	1549	RAYEQNKLSLIN
RKSLDYKYAQVL	sp|Q6XQI4|L_JUNIN	1541	sp|Q9H426|RIMS4_HUMAN Regulating synaptic membrane exocytosis protein 4 OS=Homo sapiens OX=9606 GN=RIMS4 PE=1 SV=3	174	RKSLDPLYNQVL
ILQSNGNEDAKK	sp|P14239|NCAP_JUNIN	449	sp|O95257|GA45G_HUMAN Growth arrest and DNA damage-inducible protein GADD45 gamma OS=Homo sapiens OX=9606 GN=GADD45G PE=1 SV=1	120	ILISNPNEDAWK
ILQSNGNEDAKK	sp|P14239|NCAP_JUNIN	449	tr|Q5VZ88|Q5VZ88_HUMAN Growth arrest and DNA damage-inducible protein GADD45 gamma OS=Homo sapiens OX=9606 GN=GADD45G PE=1 SV=1	102	ILISNPNEDAWK
GRAFEDNLLSLI	sp|Q6XQI4|L_JUNIN	1507	sp|Q67FW5|B3GNL_HUMAN UDP-GlcNAc:betaGal beta-1,3-N-acetylglucosaminyltransferase-like protein 1 OS=Homo sapiens OX=9606 GN=B3GNTL1 PE=2 SV=2	339	GGAFEDNLRSLH
GRAFEDNLLSLI	sp|Q6XQI4|L_JUNIN	1507	tr|I3L232|I3L232_HUMAN HCG30384, isoform CRA_d OS=Homo sapiens OX=9606 GN=B3GNTL1 PE=1 SV=1	161	GGAFEDNLRSLH
GRAFEDNLLSLI	sp|Q6XQI4|L_JUNIN	1507	tr|I3L4B6|I3L4B6_HUMAN HCG30384, isoform CRA_b OS=Homo sapiens OX=9606 GN=B3GNTL1 PE=1 SV=1	228	GGAFEDNLRSLH
AFTLDVKSPKDK	sp|Q6XQI4|L_JUNIN	1204	sp|P12036|NFH_HUMAN Neurofilament heavy polypeptide OS=Homo sapiens OX=9606 GN=NEFH PE=1 SV=4	762	AKTLDVKSPEAK
SLLEIFCLGKLH	sp|Q6XQI4|L_JUNIN	1240	tr|A0A6Q8PFP0|A0A6Q8PFP0_HUMAN Cyclin N-terminal domain-containing protein OS=Homo sapiens OX=9606 PE=3 SV=1	341	SLAEIFPLGKNH
SLLEIFCLGKLH	sp|Q6XQI4|L_JUNIN	1240	tr|A0A0U1RQD1|A0A0U1RQD1_HUMAN Chromosome 12 open reading frame 5, isoform CRA_b OS=Homo sapiens OX=9606 GN=TIGAR PE=1 SV=1	106	SLAEIFPLGKNH
SLLEIFCLGKLH	sp|Q6XQI4|L_JUNIN	1240	sp|Q9NQ88|TIGAR_HUMAN Fructose-2,6-bisphosphatase TIGAR OS=Homo sapiens OX=9606 GN=TIGAR PE=1 SV=1	165	SLAEIFPLGKNH
VPAWSEELIIDL	sp|Q6XQI4|L_JUNIN	579	sp|O95479|G6PE_HUMAN GDH/6PGL endoplasmic bifunctional protein OS=Homo sapiens OX=9606 GN=H6PD PE=1 SV=2	556	VSAWSEELISKL
ERVLKKPDVDSI	sp|Q6XQI4|L_JUNIN	432	sp|Q96TA1|NIBA2_HUMAN Protein Niban 2 OS=Homo sapiens OX=9606 GN=NIBAN2 PE=1 SV=3	474	ERVLKKYDYDSS
LGLLARQLTSAL	sp|Q6XQI4|L_JUNIN	1006	sp|O15417|TNC18_HUMAN Trinucleotide repeat-containing gene 18 protein OS=Homo sapiens OX=9606 GN=TNRC18 PE=1 SV=3	1865	LGLLARFAASAL
LGLLARQLTSAL	sp|Q6XQI4|L_JUNIN	1006	tr|H9KVB4|H9KVB4_HUMAN Trinucleotide repeat-containing gene 18 protein OS=Homo sapiens OX=9606 GN=TNRC18 PE=1 SV=1	1865	LGLLARFAASAL
TRRNSLLFVELL	sp|Q6XQI4|L_JUNIN	344	sp|Q8IYW5|RN168_HUMAN E3 ubiquitin-protein ligase RNF168 OS=Homo sapiens OX=9606 GN=RNF168 PE=1 SV=1	66	TRRNSLVNVELW
TRRNSLLFVELL	sp|Q6XQI4|L_JUNIN	344	tr|F8WD60|F8WD60_HUMAN E3 ubiquitin-protein ligase RNF168 OS=Homo sapiens OX=9606 GN=RNF168 PE=1 SV=1	66	TRRNSLVNVELW
SRKMVEKEELPS	sp|Q6XQI4|L_JUNIN	1568	sp|Q9P2P6|STAR9_HUMAN StAR-related lipid transfer protein 9 OS=Homo sapiens OX=9606 GN=STARD9 PE=1 SV=3	4634	SRKMVRGEILPS
KEELPSLVRTIQ	sp|Q6XQI4|L_JUNIN	1574	tr|E9PQ67|E9PQ67_HUMAN Transcription factor SOX-6 (Fragment) OS=Homo sapiens OX=9606 GN=SOX6 PE=1 SV=1	53	SEELPTLVSTIQ
KEELPSLVRTIQ	sp|Q6XQI4|L_JUNIN	1574	tr|E9PN02|E9PN02_HUMAN Transcription factor SOX-6 (Fragment) OS=Homo sapiens OX=9606 GN=SOX6 PE=1 SV=1	53	SEELPTLVSTIQ
KEELPSLVRTIQ	sp|Q6XQI4|L_JUNIN	1574	tr|E9PQ78|E9PQ78_HUMAN Transcription factor SOX-6 OS=Homo sapiens OX=9606 GN=SOX6 PE=1 SV=1	53	SEELPTLVSTIQ
KEELPSLVRTIQ	sp|Q6XQI4|L_JUNIN	1574	tr|E9PQL4|E9PQL4_HUMAN Transcription factor SOX-6 (Fragment) OS=Homo sapiens OX=9606 GN=SOX6 PE=1 SV=1	53	SEELPTLVSTIQ
KEELPSLVRTIQ	sp|Q6XQI4|L_JUNIN	1574	sp|P35712|SOX6_HUMAN Transcription factor SOX-6 OS=Homo sapiens OX=9606 GN=SOX6 PE=1 SV=3	53	SEELPTLVSTIQ
LRKGRAFEDNLL	sp|Q6XQI4|L_JUNIN	1504	tr|A0A6Q8PHG6|A0A6Q8PHG6_HUMAN Endoribonuclease Dicer (Fragment) OS=Homo sapiens OX=9606 GN=DICER1 PE=1 SV=1	505	LRKFRAHETNLL
LRKGRAFEDNLL	sp|Q6XQI4|L_JUNIN	1504	sp|Q9UPY3|DICER_HUMAN Endoribonuclease Dicer OS=Homo sapiens OX=9606 GN=DICER1 PE=1 SV=3	505	LRKFRAHETNLL
LRKGRAFEDNLL	sp|Q6XQI4|L_JUNIN	1504	tr|H0YJZ6|H0YJZ6_HUMAN Endoribonuclease Dicer OS=Homo sapiens OX=9606 GN=DICER1 PE=1 SV=2	505	LRKFRAHETNLL
SGTDGTKSLVDG	sp|Q6XQI4|L_JUNIN	2000	tr|A0A087WW79|A0A087WW79_HUMAN Mitogen-activated protein kinase kinase kinase 9 OS=Homo sapiens OX=9606 GN=MAP3K9 PE=1 SV=1	396	SGDEGLKSLVDG
SGTDGTKSLVDG	sp|Q6XQI4|L_JUNIN	2000	tr|G3V4P9|G3V4P9_HUMAN Mitogen-activated protein kinase kinase kinase 9 OS=Homo sapiens OX=9606 GN=MAP3K9 PE=1 SV=1	348	SGDEGLKSLVDG
SGTDGTKSLVDG	sp|Q6XQI4|L_JUNIN	2000	tr|G3V347|G3V347_HUMAN Mitogen-activated protein kinase kinase kinase 9 OS=Homo sapiens OX=9606 GN=MAP3K9 PE=1 SV=1	353	SGDEGLKSLVDG
SGTDGTKSLVDG	sp|Q6XQI4|L_JUNIN	2000	tr|J3KPI6|J3KPI6_HUMAN Mitogen-activated protein kinase kinase kinase OS=Homo sapiens OX=9606 GN=MAP3K9 PE=1 SV=1	611	SGDEGLKSLVDG
TVERVLKKPDVD	sp|Q6XQI4|L_JUNIN	430	sp|P34932|HSP74_HUMAN Heat shock 70 kDa protein 4 OS=Homo sapiens OX=9606 GN=HSPA4 PE=1 SV=4	128	TAESVLKKPVVD
TVERVLKKPDVD	sp|Q6XQI4|L_JUNIN	430	tr|A0A087WYC1|A0A087WYC1_HUMAN Heat shock 70 kDa protein 4 OS=Homo sapiens OX=9606 GN=HSPA4 PE=1 SV=1	128	TAESVLKKPVVD
TVERVLKKPDVD	sp|Q6XQI4|L_JUNIN	430	tr|A0A087WTS8|A0A087WTS8_HUMAN Heat shock 70 kDa protein 4 OS=Homo sapiens OX=9606 GN=HSPA4 PE=1 SV=1	128	TAESVLKKPVVD
PPEVILQSNGNE	sp|P14239|NCAP_JUNIN	445	sp|Q15746|MYLK_HUMAN Myosin light chain kinase, smooth muscle OS=Homo sapiens OX=9606 GN=MYLK PE=1 SV=4	651	PPEVIWLHNGNE
IKSLGILLGTLL	sp|Q6XQI4|L_JUNIN	374	tr|B7Z3B5|B7Z3B5_HUMAN Non-specific serine/threonine protein kinase OS=Homo sapiens OX=9606 GN=RPS6KA2 PE=1 SV=1	505	IWSLGILLYTML
IKSLGILLGTLL	sp|Q6XQI4|L_JUNIN	374	sp|Q15349|KS6A2_HUMAN Ribosomal protein S6 kinase alpha-2 OS=Homo sapiens OX=9606 GN=RPS6KA2 PE=1 SV=2	594	IWSLGILLYTML
IKSLGILLGTLL	sp|Q6XQI4|L_JUNIN	374	tr|F2Z2J1|F2Z2J1_HUMAN Ribosomal protein S6 kinase OS=Homo sapiens OX=9606 GN=RPS6KA2 PE=1 SV=1	619	IWSLGILLYTML
IKSLGILLGTLL	sp|Q6XQI4|L_JUNIN	374	tr|E9PGT3|E9PGT3_HUMAN Ribosomal protein S6 kinase OS=Homo sapiens OX=9606 GN=RPS6KA1 PE=1 SV=1	586	IWSLGILLYTML
IKSLGILLGTLL	sp|Q6XQI4|L_JUNIN	374	sp|Q15418|KS6A1_HUMAN Ribosomal protein S6 kinase alpha-1 OS=Homo sapiens OX=9606 GN=RPS6KA1 PE=1 SV=2	597	IWSLGILLYTML
LGILLGTLLVVL	sp|Q6XQI4|L_JUNIN	377	sp|Q6PXP3|GTR7_HUMAN Solute carrier family 2, facilitated glucose transporter member 7 OS=Homo sapiens OX=9606 GN=SLC2A7 PE=1 SV=2	86	LGGLLGSLLVGL
QSLDLLDISEFT	sp|Q6XQI4|L_JUNIN	1869	tr|A0A2R8YEQ5|A0A2R8YEQ5_HUMAN Neurite extension and migration factor OS=Homo sapiens OX=9606 GN=NEXMIF PE=1 SV=1	1048	ESTDLLDISNFT
QSLDLLDISEFT	sp|Q6XQI4|L_JUNIN	1869	sp|Q5QGS0|NEXMI_HUMAN Neurite extension and migration factor OS=Homo sapiens OX=9606 GN=NEXMIF PE=2 SV=1	1048	ESTDLLDISNFT
DLLELKSVMKQI	sp|Q6XQI4|L_JUNIN	1928	sp|Q9H095|DRC9_HUMAN Dynein regulatory complex protein 9 OS=Homo sapiens OX=9606 GN=IQCG PE=1 SV=1	390	DLLELKSVIKLQ
SLSLLVVSSVKS	sp|Q6XQI4|L_JUNIN	491	sp|Q96B01|R51A1_HUMAN RAD51-associated protein 1 OS=Homo sapiens OX=9606 GN=RAD51AP1 PE=1 SV=1	316	SSSPLVVVSVKS
SFYYWQEALEAE	sp|Q6XQI4|L_JUNIN	1855	tr|C9JS55|C9JS55_HUMAN PDZ and LIM domain protein 2 (Fragment) OS=Homo sapiens OX=9606 GN=PDLIM2 PE=1 SV=1	241	SFRLLQEALEAE
SFYYWQEALEAE	sp|Q6XQI4|L_JUNIN	1855	tr|H7C1D1|H7C1D1_HUMAN Uncharacterized protein (Fragment) OS=Homo sapiens OX=9606 PE=4 SV=2	35	SFRLLQEALEAE
SFYYWQEALEAE	sp|Q6XQI4|L_JUNIN	1855	tr|E5RGS7|E5RGS7_HUMAN LIM zinc-binding domain-containing protein OS=Homo sapiens OX=9606 PE=4 SV=1	35	SFRLLQEALEAE
SFYYWQEALEAE	sp|Q6XQI4|L_JUNIN	1855	sp|Q96JY6|PDLI2_HUMAN PDZ and LIM domain protein 2 OS=Homo sapiens OX=9606 GN=PDLIM2 PE=1 SV=1	241	SFRLLQEALEAE
SFYYWQEALEAE	sp|Q6XQI4|L_JUNIN	1855	tr|A0A087WVI1|A0A087WVI1_HUMAN PDZ and LIM domain protein 2 OS=Homo sapiens OX=9606 GN=PDLIM2 PE=1 SV=1	214	SFRLLQEALEAE
SFYYWQEALEAE	sp|Q6XQI4|L_JUNIN	1855	tr|B3KPU0|B3KPU0_HUMAN PDZ and LIM domain protein 2 OS=Homo sapiens OX=9606 GN=PDLIM2 PE=1 SV=1	35	SFRLLQEALEAE
SFYYWQEALEAE	sp|Q6XQI4|L_JUNIN	1855	tr|H0YBP7|H0YBP7_HUMAN DUF4749 domain-containing protein (Fragment) OS=Homo sapiens OX=9606 PE=1 SV=1	53	SFRLLQEALEAE
SFYYWQEALEAE	sp|Q6XQI4|L_JUNIN	1855	tr|A0A087WUQ1|A0A087WUQ1_HUMAN PDZ and LIM domain protein 2 OS=Homo sapiens OX=9606 GN=PDLIM2 PE=1 SV=1	35	SFRLLQEALEAE
LCELKLIASNGD	sp|Q6XQI4|L_JUNIN	1170	tr|A0A2R8YCW8|A0A2R8YCW8_HUMAN Band 4.1 OS=Homo sapiens OX=9606 GN=EPB41 PE=1 SV=1	48	WCEQKLKASNGD
LCELKLIASNGD	sp|Q6XQI4|L_JUNIN	1170	tr|A0A3B3ITC5|A0A3B3ITC5_HUMAN Band 4.1 OS=Homo sapiens OX=9606 GN=EPB41 PE=1 SV=1	48	WCEQKLKASNGD
LCELKLIASNGD	sp|Q6XQI4|L_JUNIN	1170	tr|A0A2R8YFR9|A0A2R8YFR9_HUMAN Band 4.1 (Fragment) OS=Homo sapiens OX=9606 GN=EPB41 PE=1 SV=1	48	WCEQKLKASNGD
LCELKLIASNGD	sp|Q6XQI4|L_JUNIN	1170	tr|A0A2R8Y6G5|A0A2R8Y6G5_HUMAN Band 4.1 OS=Homo sapiens OX=9606 GN=EPB41 PE=1 SV=1	48	WCEQKLKASNGD
LCELKLIASNGD	sp|Q6XQI4|L_JUNIN	1170	tr|A0A2U3TZH6|A0A2U3TZH6_HUMAN Band 4.1 OS=Homo sapiens OX=9606 GN=EPB41 PE=1 SV=1	48	WCEQKLKASNGD
LCELKLIASNGD	sp|Q6XQI4|L_JUNIN	1170	tr|A0A2R8Y570|A0A2R8Y570_HUMAN Band 4.1 OS=Homo sapiens OX=9606 GN=EPB41 PE=1 SV=1	48	WCEQKLKASNGD
LCELKLIASNGD	sp|Q6XQI4|L_JUNIN	1170	tr|A0A3B3IU06|A0A3B3IU06_HUMAN Band 4.1 OS=Homo sapiens OX=9606 GN=EPB41 PE=1 SV=1	48	WCEQKLKASNGD
LCELKLIASNGD	sp|Q6XQI4|L_JUNIN	1170	sp|P11171|EPB41_HUMAN Protein 4.1 OS=Homo sapiens OX=9606 GN=EPB41 PE=1 SV=4	48	WCEQKLKASNGD
LCELKLIASNGD	sp|Q6XQI4|L_JUNIN	1170	tr|A0A2R8Y5G2|A0A2R8Y5G2_HUMAN Band 4.1 OS=Homo sapiens OX=9606 GN=EPB41 PE=1 SV=1	48	WCEQKLKASNGD
LCELKLIASNGD	sp|Q6XQI4|L_JUNIN	1170	tr|A0A2R8Y5Z6|A0A2R8Y5Z6_HUMAN Band 4.1 OS=Homo sapiens OX=9606 GN=EPB41 PE=1 SV=1	48	WCEQKLKASNGD
LCELKLIASNGD	sp|Q6XQI4|L_JUNIN	1170	tr|A0A2R8YFU8|A0A2R8YFU8_HUMAN Protein 4.1 OS=Homo sapiens OX=9606 GN=EPB41 PE=1 SV=1	48	WCEQKLKASNGD
LCELKLIASNGD	sp|Q6XQI4|L_JUNIN	1170	tr|A0A3B3IUD6|A0A3B3IUD6_HUMAN Band 4.1 OS=Homo sapiens OX=9606 GN=EPB41 PE=1 SV=1	48	WCEQKLKASNGD
VERVLKKPDVDS	sp|Q6XQI4|L_JUNIN	431	sp|Q96TA1|NIBA2_HUMAN Protein Niban 2 OS=Homo sapiens OX=9606 GN=NIBAN2 PE=1 SV=3	473	LERVLKKYDYDS
TMIRFKLKRLLE	sp|Q6XQI4|L_JUNIN	1225	tr|E9PFE2|E9PFE2_HUMAN General transcription factor II-I repeat domain-containing protein 1 OS=Homo sapiens OX=9606 GN=GTF2IRD1 PE=1 SV=1	194	HRIRFKLKRPLE
TMIRFKLKRLLE	sp|Q6XQI4|L_JUNIN	1225	sp|Q9UHL9|GT2D1_HUMAN General transcription factor II-I repeat domain-containing protein 1 OS=Homo sapiens OX=9606 GN=GTF2IRD1 PE=1 SV=1	194	HRIRFKLKRPLE
TIEPDSADYMLL	sp|Q6XQI4|L_JUNIN	858	sp|P98160|PGBM_HUMAN Basement membrane-specific heparan sulfate proteoglycan core protein OS=Homo sapiens OX=9606 GN=HSPG2 PE=1 SV=4	3691	TFRPDSADGMLL
VSRDLLSFCLNL	sp|Q6XQI4|L_JUNIN	774	sp|Q8TB24|RIN3_HUMAN Ras and Rab interactor 3 OS=Homo sapiens OX=9606 GN=RIN3 PE=1 SV=4	145	VSRDLLPFTLRL
VSRDLLSFCLNL	sp|Q6XQI4|L_JUNIN	774	tr|A0A087WWY9|A0A087WWY9_HUMAN Ras and Rab interactor 3 OS=Homo sapiens OX=9606 GN=RIN3 PE=1 SV=1	145	VSRDLLPFTLRL
SLLNEGEELEIF	sp|Q6XQI4|L_JUNIN	676	tr|C9JAM8|C9JAM8_HUMAN Plastin-1 (Fragment) OS=Homo sapiens OX=9606 GN=PLS1 PE=1 SV=1	173	ALLNEGEELEEL
SLLNEGEELEIF	sp|Q6XQI4|L_JUNIN	676	sp|Q14651|PLSI_HUMAN Plastin-1 OS=Homo sapiens OX=9606 GN=PLS1 PE=1 SV=2	252	ALLNEGEELEEL
VNTFLDFSKDLL	sp|Q6XQI4|L_JUNIN	594	tr|E5RJE4|E5RJE4_HUMAN PH and SEC7 domain-containing protein 3 (Fragment) OS=Homo sapiens OX=9606 GN=PSD3 PE=1 SV=1	153	VNEGVDFSKDLL
VNTFLDFSKDLL	sp|Q6XQI4|L_JUNIN	594	sp|Q9NYI0|PSD3_HUMAN PH and SEC7 domain-containing protein 3 OS=Homo sapiens OX=9606 GN=PSD3 PE=1 SV=2	713	VNEGVDFSKDLL
VNTFLDFSKDLL	sp|Q6XQI4|L_JUNIN	594	tr|E5RJ29|E5RJ29_HUMAN PH and SEC7 domain-containing protein 3 OS=Homo sapiens OX=9606 GN=PSD3 PE=1 SV=1	647	VNEGVDFSKDLL
VNTFLDFSKDLL	sp|Q6XQI4|L_JUNIN	594	tr|H0YC20|H0YC20_HUMAN PH and SEC7 domain-containing protein 3 (Fragment) OS=Homo sapiens OX=9606 GN=PSD3 PE=1 SV=1	145	VNEGVDFSKDLL
LNDLSLSRQMES	sp|Q6XQI4|L_JUNIN	1755	sp|Q96MT3|PRIC1_HUMAN Prickle-like protein 1 OS=Homo sapiens OX=9606 GN=PRICKLE1 PE=1 SV=2	375	LDDLSLSRQGTS
KGRAFEDNLLSL	sp|Q6XQI4|L_JUNIN	1506	sp|Q67FW5|B3GNL_HUMAN UDP-GlcNAc:betaGal beta-1,3-N-acetylglucosaminyltransferase-like protein 1 OS=Homo sapiens OX=9606 GN=B3GNTL1 PE=2 SV=2	338	TGGAFEDNLRSL
KGRAFEDNLLSL	sp|Q6XQI4|L_JUNIN	1506	tr|I3L232|I3L232_HUMAN HCG30384, isoform CRA_d OS=Homo sapiens OX=9606 GN=B3GNTL1 PE=1 SV=1	160	TGGAFEDNLRSL
KGRAFEDNLLSL	sp|Q6XQI4|L_JUNIN	1506	tr|I3L4B6|I3L4B6_HUMAN HCG30384, isoform CRA_b OS=Homo sapiens OX=9606 GN=B3GNTL1 PE=1 SV=1	227	TGGAFEDNLRSL
CELKLIASNGDA	sp|Q6XQI4|L_JUNIN	1171	tr|A0A2R8YCW8|A0A2R8YCW8_HUMAN Band 4.1 OS=Homo sapiens OX=9606 GN=EPB41 PE=1 SV=1	49	CEQKLKASNGDT
CELKLIASNGDA	sp|Q6XQI4|L_JUNIN	1171	tr|A0A3B3ITC5|A0A3B3ITC5_HUMAN Band 4.1 OS=Homo sapiens OX=9606 GN=EPB41 PE=1 SV=1	49	CEQKLKASNGDT
CELKLIASNGDA	sp|Q6XQI4|L_JUNIN	1171	tr|A0A2R8YFR9|A0A2R8YFR9_HUMAN Band 4.1 (Fragment) OS=Homo sapiens OX=9606 GN=EPB41 PE=1 SV=1	49	CEQKLKASNGDT
CELKLIASNGDA	sp|Q6XQI4|L_JUNIN	1171	tr|A0A2R8Y6G5|A0A2R8Y6G5_HUMAN Band 4.1 OS=Homo sapiens OX=9606 GN=EPB41 PE=1 SV=1	49	CEQKLKASNGDT
CELKLIASNGDA	sp|Q6XQI4|L_JUNIN	1171	tr|A0A2U3TZH6|A0A2U3TZH6_HUMAN Band 4.1 OS=Homo sapiens OX=9606 GN=EPB41 PE=1 SV=1	49	CEQKLKASNGDT
CELKLIASNGDA	sp|Q6XQI4|L_JUNIN	1171	tr|A0A2R8Y570|A0A2R8Y570_HUMAN Band 4.1 OS=Homo sapiens OX=9606 GN=EPB41 PE=1 SV=1	49	CEQKLKASNGDT
CELKLIASNGDA	sp|Q6XQI4|L_JUNIN	1171	tr|A0A3B3IU06|A0A3B3IU06_HUMAN Band 4.1 OS=Homo sapiens OX=9606 GN=EPB41 PE=1 SV=1	49	CEQKLKASNGDT
CELKLIASNGDA	sp|Q6XQI4|L_JUNIN	1171	sp|P11171|EPB41_HUMAN Protein 4.1 OS=Homo sapiens OX=9606 GN=EPB41 PE=1 SV=4	49	CEQKLKASNGDT
CELKLIASNGDA	sp|Q6XQI4|L_JUNIN	1171	tr|A0A2R8Y5G2|A0A2R8Y5G2_HUMAN Band 4.1 OS=Homo sapiens OX=9606 GN=EPB41 PE=1 SV=1	49	CEQKLKASNGDT
CELKLIASNGDA	sp|Q6XQI4|L_JUNIN	1171	tr|A0A2R8Y5Z6|A0A2R8Y5Z6_HUMAN Band 4.1 OS=Homo sapiens OX=9606 GN=EPB41 PE=1 SV=1	49	CEQKLKASNGDT
CELKLIASNGDA	sp|Q6XQI4|L_JUNIN	1171	tr|A0A2R8YFU8|A0A2R8YFU8_HUMAN Protein 4.1 OS=Homo sapiens OX=9606 GN=EPB41 PE=1 SV=1	49	CEQKLKASNGDT
CELKLIASNGDA	sp|Q6XQI4|L_JUNIN	1171	tr|A0A3B3IUD6|A0A3B3IUD6_HUMAN Band 4.1 OS=Homo sapiens OX=9606 GN=EPB41 PE=1 SV=1	49	CEQKLKASNGDT
RNSLLFVELLLL	sp|Q6XQI4|L_JUNIN	346	sp|A6NF34|ANTRL_HUMAN Anthrax toxin receptor-like OS=Homo sapiens OX=9606 GN=ANTXRL PE=3 SV=3	352	RNWLYFVPLLLL
RNSLLFVELLLL	sp|Q6XQI4|L_JUNIN	346	tr|A0A087WVT0|A0A087WVT0_HUMAN Anthrax toxin receptor-like OS=Homo sapiens OX=9606 GN=ANTXRL PE=1 SV=1	352	RNWLYFVPLLLL
RNSLLFVELLLL	sp|Q6XQI4|L_JUNIN	346	tr|A0A087WX92|A0A087WX92_HUMAN Monocarboxylate transporter 7 OS=Homo sapiens OX=9606 GN=SLC16A6 PE=1 SV=1	180	RYSLLFVGLLQL
RNSLLFVELLLL	sp|Q6XQI4|L_JUNIN	346	sp|O15403|MOT7_HUMAN Monocarboxylate transporter 7 OS=Homo sapiens OX=9606 GN=SLC16A6 PE=1 SV=2	180	RYSLLFVGLLQL
SLDLLDISEFTL	sp|Q6XQI4|L_JUNIN	1870	tr|A0A2R8YEQ5|A0A2R8YEQ5_HUMAN Neurite extension and migration factor OS=Homo sapiens OX=9606 GN=NEXMIF PE=1 SV=1	1049	STDLLDISNFTP
SLDLLDISEFTL	sp|Q6XQI4|L_JUNIN	1870	sp|Q5QGS0|NEXMI_HUMAN Neurite extension and migration factor OS=Homo sapiens OX=9606 GN=NEXMIF PE=2 SV=1	1049	STDLLDISNFTP
DKEFDRILCELK	sp|Q6XQI4|L_JUNIN	1163	sp|Q96M91|CFA53_HUMAN Cilia- and flagella-associated protein 53 OS=Homo sapiens OX=9606 GN=CFAP53 PE=1 SV=2	357	EKEFDRILEEDK
KEIKSNTESQVP	sp|Q6XQI4|L_JUNIN	761	sp|Q9BXU1|STK31_HUMAN Serine/threonine-protein kinase 31 OS=Homo sapiens OX=9606 GN=STK31 PE=2 SV=2	578	KEIISNTYSQVL
FNSLLNEGEELE	sp|Q6XQI4|L_JUNIN	674	tr|C9JAM8|C9JAM8_HUMAN Plastin-1 (Fragment) OS=Homo sapiens OX=9606 GN=PLS1 PE=1 SV=1	171	LIALLNEGEELE
FNSLLNEGEELE	sp|Q6XQI4|L_JUNIN	674	sp|Q14651|PLSI_HUMAN Plastin-1 OS=Homo sapiens OX=9606 GN=PLS1 PE=1 SV=2	250	LIALLNEGEELE
SEVCPLGLLARQ	sp|Q6XQI4|L_JUNIN	1001	sp|Q9HBX8|LGR6_HUMAN Leucine-rich repeat-containing G-protein coupled receptor 6 OS=Homo sapiens OX=9606 GN=LGR6 PE=1 SV=3	507	SSKRPLGLLARQ
RALSHLSVHLSS	sp|Q6XQI4|L_JUNIN	1433	sp|Q15751|HERC1_HUMAN Probable E3 ubiquitin-protein ligase HERC1 OS=Homo sapiens OX=9606 GN=HERC1 PE=1 SV=2	3192	RALSLLSVSGSS
IRFKLKRLLEMP	sp|Q6XQI4|L_JUNIN	1227	tr|E9PFE2|E9PFE2_HUMAN General transcription factor II-I repeat domain-containing protein 1 OS=Homo sapiens OX=9606 GN=GTF2IRD1 PE=1 SV=1	196	IRFKLKRPLEDG
IRFKLKRLLEMP	sp|Q6XQI4|L_JUNIN	1227	sp|Q9UHL9|GT2D1_HUMAN General transcription factor II-I repeat domain-containing protein 1 OS=Homo sapiens OX=9606 GN=GTF2IRD1 PE=1 SV=1	196	IRFKLKRPLEDG
SLTKPSVRIAVL	sp|Q6XQI4|L_JUNIN	606	sp|O43173|SIA8C_HUMAN Sia-alpha-2,3-Gal-beta-1,4-GlcNAc-R:alpha 2,8-sialyltransferase OS=Homo sapiens OX=9606 GN=ST8SIA3 PE=1 SV=3	115	SLTKNSVRIGQL
PGLINFLLGALP	sp|P14239|NCAP_JUNIN	434	tr|E9PFK5|E9PFK5_HUMAN Nucleolar protein 14 OS=Homo sapiens OX=9606 GN=NOP14 PE=1 SV=1	610	PELINFLLGILY
PGLINFLLGALP	sp|P14239|NCAP_JUNIN	434	sp|P78316|NOP14_HUMAN Nucleolar protein 14 OS=Homo sapiens OX=9606 GN=NOP14 PE=1 SV=3	610	PELINFLLGILY
KEFDRILCELKL	sp|Q6XQI4|L_JUNIN	1164	sp|Q96M91|CFA53_HUMAN Cilia- and flagella-associated protein 53 OS=Homo sapiens OX=9606 GN=CFAP53 PE=1 SV=2	358	KEFDRILEEDKA
LLNEGEELEIFF	sp|Q6XQI4|L_JUNIN	677	tr|C9JAM8|C9JAM8_HUMAN Plastin-1 (Fragment) OS=Homo sapiens OX=9606 GN=PLS1 PE=1 SV=1	174	LLNEGEELEELM
LLNEGEELEIFF	sp|Q6XQI4|L_JUNIN	677	sp|Q14651|PLSI_HUMAN Plastin-1 OS=Homo sapiens OX=9606 GN=PLS1 PE=1 SV=2	253	LLNEGEELEELM
LHAMSVQELQEL	sp|P14239|NCAP_JUNIN	351	sp|Q6P2S7|TTC41_HUMAN Putative tetratricopeptide repeat protein 41 OS=Homo sapiens OX=9606 GN=TTC41P PE=5 SV=3	560	LEAVSVQELWEL
CITKLVELLFQA	sp|Q6XQI4|L_JUNIN	287	sp|Q9ULI4|KI26A_HUMAN Kinesin-like protein KIF26A OS=Homo sapiens OX=9606 GN=KIF26A PE=1 SV=3	73	CHTKLVELKRQA
HIYRLASSLSLL	sp|Q6XQI4|L_JUNIN	484	sp|Q6ZVH7|ESPNL_HUMAN Espin-like protein OS=Homo sapiens OX=9606 GN=ESPNL PE=1 SV=3	595	HISRLVRSLSLL
EAFNSLLNEGEE	sp|Q6XQI4|L_JUNIN	672	tr|C9JAM8|C9JAM8_HUMAN Plastin-1 (Fragment) OS=Homo sapiens OX=9606 GN=PLS1 PE=1 SV=1	169	EALIALLNEGEE
EAFNSLLNEGEE	sp|Q6XQI4|L_JUNIN	672	sp|Q14651|PLSI_HUMAN Plastin-1 OS=Homo sapiens OX=9606 GN=PLS1 PE=1 SV=2	248	EALIALLNEGEE
GGENLSQAVSAI	sp|P14239|NCAP_JUNIN	186	sp|Q16401|PSMD5_HUMAN 26S proteasome non-ATPase regulatory subunit 5 OS=Homo sapiens OX=9606 GN=PSMD5 PE=1 SV=3	135	GGENLSVAKAAI
