query	query_seqname	query_start	target_seqname	target_start	target
VSSASIILTQNE	tr|Q6TUP4|Q6TUP4_YMTV5	53	tr|A0A6Q8PGP6|A0A6Q8PGP6_HUMAN Centrosomal protein of 290 kDa OS=Homo sapiens OX=9606 GN=CEP290 PE=1 SV=1	771	PSSASIINSQNE
VSSASIILTQNE	tr|Q6TUP4|Q6TUP4_YMTV5	53	tr|A0A6Q8PG44|A0A6Q8PG44_HUMAN Centrosomal protein of 290 kDa OS=Homo sapiens OX=9606 GN=CEP290 PE=1 SV=1	771	PSSASIINSQNE
VSSASIILTQNE	tr|Q6TUP4|Q6TUP4_YMTV5	53	sp|O15078|CE290_HUMAN Centrosomal protein of 290 kDa OS=Homo sapiens OX=9606 GN=CEP290 PE=1 SV=2	771	PSSASIINSQNE
VSSASIILTQNE	tr|Q6TUP4|Q6TUP4_YMTV5	53	tr|A0A6Q8PGB1|A0A6Q8PGB1_HUMAN Centrosomal protein of 290 kDa OS=Homo sapiens OX=9606 GN=CEP290 PE=1 SV=1	1058	PSSASIINSQNE
VSSASIILTQNE	tr|Q6TUP4|Q6TUP4_YMTV5	53	tr|A0A6Q8PH78|A0A6Q8PH78_HUMAN Centrosomal protein of 290 kDa OS=Homo sapiens OX=9606 GN=CEP290 PE=1 SV=1	1027	PSSASIINSQNE
VSSASIILTQNE	tr|Q6TUP4|Q6TUP4_YMTV5	53	tr|A0A6Q8PH24|A0A6Q8PH24_HUMAN Centrosomal protein of 290 kDa OS=Homo sapiens OX=9606 GN=CEP290 PE=1 SV=1	764	PSSASIINSQNE
VSSASIILTQNE	tr|Q6TUP4|Q6TUP4_YMTV5	53	tr|A0A6Q8PGC3|A0A6Q8PGC3_HUMAN Centrosomal protein of 290 kDa OS=Homo sapiens OX=9606 GN=CEP290 PE=1 SV=1	771	PSSASIINSQNE
VSSASIILTQNE	tr|Q6TUP4|Q6TUP4_YMTV5	53	tr|A0A5F9ZHU6|A0A5F9ZHU6_HUMAN Centrosomal protein of 290 kDa OS=Homo sapiens OX=9606 GN=CEP290 PE=1 SV=2	771	PSSASIINSQNE
VSSASIILTQNE	tr|Q6TUP4|Q6TUP4_YMTV5	53	tr|J3KNF5|J3KNF5_HUMAN Centrosomal protein of 290 kDa OS=Homo sapiens OX=9606 GN=CEP290 PE=1 SV=2	771	PSSASIINSQNE
VSSASIILTQNE	tr|Q6TUP4|Q6TUP4_YMTV5	53	tr|S4R322|S4R322_HUMAN Centrosomal protein of 290 kDa (Fragment) OS=Homo sapiens OX=9606 GN=CEP290 PE=1 SV=1	524	PSSASIINSQNE
TKLNTTATPTSS	tr|Q6TUV3|Q6TUV3_YMTV5	168	sp|Q9HC84|MUC5B_HUMAN Mucin-5B OS=Homo sapiens OX=9606 GN=MUC5B PE=1 SV=3	3694	TKLTTTATTTES
NEILRKNNESDK	tr|Q6TUX6|Q6TUX6_YMTV5	103	sp|Q9C099|LRCC1_HUMAN Leucine-rich repeat and coiled-coil domain-containing protein 1 OS=Homo sapiens OX=9606 GN=LRRCC1 PE=1 SV=2	798	NECLRKTNESDS
KKYLRVQSKLLK	tr|Q6TUQ4|Q6TUQ4_YMTV5	344	sp|O95239|KIF4A_HUMAN Chromosome-associated kinesin KIF4A OS=Homo sapiens OX=9606 GN=KIF4A PE=1 SV=3	613	KKKLNEQSKLLK
KKYLRVQSKLLK	tr|Q6TUQ4|Q6TUQ4_YMTV5	344	sp|Q2VIQ3|KIF4B_HUMAN Chromosome-associated kinesin KIF4B OS=Homo sapiens OX=9606 GN=KIF4B PE=2 SV=2	613	KKKLNEQSKLLK
LTQKKNKFEKRF	tr|Q6TUU0|Q6TUU0_YMTV5	442	tr|A0A0C4DG31|A0A0C4DG31_HUMAN RNA exonuclease 4 (Fragment) OS=Homo sapiens OX=9606 GN=REXO4 PE=1 SV=1	26	LTRKKNKKKKRF
LTQKKNKFEKRF	tr|Q6TUU0|Q6TUU0_YMTV5	442	sp|Q9GZR2|REXO4_HUMAN RNA exonuclease 4 OS=Homo sapiens OX=9606 GN=REXO4 PE=1 SV=2	26	LTRKKNKKKKRF
ILKPIIPLLSNV	tr|Q6TUN5|Q6TUN5_YMTV5	168	sp|Q96P70|IPO9_HUMAN Importin-9 OS=Homo sapiens OX=9606 GN=IPO9 PE=1 SV=3	917	ILKLIINELSNV
GKNTLSSVFEEI	tr|Q6TUW8|Q6TUW8_YMTV5	162	tr|F5GWB9|F5GWB9_HUMAN Spermatogenesis-associated protein 22 OS=Homo sapiens OX=9606 GN=SPATA22 PE=1 SV=1	273	GKNTLPCVFYEI
GKNTLSSVFEEI	tr|Q6TUW8|Q6TUW8_YMTV5	162	sp|Q8NHS9|SPT22_HUMAN Spermatogenesis-associated protein 22 OS=Homo sapiens OX=9606 GN=SPATA22 PE=1 SV=2	289	GKNTLPCVFYEI
LDLGTGNVNKIT	tr|Q6TUQ6|Q6TUQ6_YMTV5	96	sp|P83876|TXN4A_HUMAN Thioredoxin-like protein 4A OS=Homo sapiens OX=9606 GN=TXNL4A PE=1 SV=1	92	IDLGTGNNNKIN
LDLGTGNVNKIT	tr|Q6TUQ6|Q6TUQ6_YMTV5	96	tr|K7ESL1|K7ESL1_HUMAN Thioredoxin-like protein 4A OS=Homo sapiens OX=9606 GN=TXNL4A PE=1 SV=1	21	IDLGTGNNNKIN
LDLGTGNVNKIT	tr|Q6TUQ6|Q6TUQ6_YMTV5	96	sp|P11021|BIP_HUMAN Endoplasmic reticulum chaperone BiP OS=Homo sapiens OX=9606 GN=HSPA5 PE=1 SV=2	514	EDKGTGNKNKIT
VVEKLSVMRRFV	tr|Q6TUS0|Q6TUS0_YMTV5	254	tr|D6RA86|D6RA86_HUMAN E3 ubiquitin-protein transferase MAEA OS=Homo sapiens OX=9606 GN=MAEA PE=1 SV=1	74	VVEKLSVLKRKV
VLGRGGFGYVYY	tr|Q6TUN2|Q6TUN2_YMTV5	26	sp|Q86V86|PIM3_HUMAN Serine/threonine-protein kinase pim-3 OS=Homo sapiens OX=9606 GN=PIM3 PE=1 SV=3	45	VLGSGGFGTVYA
LHMVLVLLLVSA	tr|Q6TV00|Q6TV00_YMTV5	245	tr|F8W186|F8W186_HUMAN Integrin beta-7 (Fragment) OS=Homo sapiens OX=9606 GN=ITGB7 PE=1 SV=9	4	LPMVLVLLLVLS
LHMVLVLLLVSA	tr|Q6TV00|Q6TV00_YMTV5	245	tr|H3BRM2|H3BRM2_HUMAN Integrin beta-7 (Fragment) OS=Homo sapiens OX=9606 GN=ITGB7 PE=1 SV=1	4	LPMVLVLLLVLS
LHMVLVLLLVSA	tr|Q6TV00|Q6TV00_YMTV5	245	tr|F8VNX4|F8VNX4_HUMAN Integrin beta-7 (Fragment) OS=Homo sapiens OX=9606 GN=ITGB7 PE=1 SV=2	4	LPMVLVLLLVLS
LHMVLVLLLVSA	tr|Q6TV00|Q6TV00_YMTV5	245	tr|F5H6T4|F5H6T4_HUMAN Integrin beta OS=Homo sapiens OX=9606 GN=ITGB7 PE=1 SV=1	4	LPMVLVLLLVLS
LHMVLVLLLVSA	tr|Q6TV00|Q6TV00_YMTV5	245	sp|P26010|ITB7_HUMAN Integrin beta-7 OS=Homo sapiens OX=9606 GN=ITGB7 PE=1 SV=1	4	LPMVLVLLLVLS
DFYNFDETKVFL	tr|Q6TUX1|Q6TUX1_YMTV5	74	tr|F6X3S4|F6X3S4_HUMAN Angiotensin-converting enzyme OS=Homo sapiens OX=9606 PE=3 SV=2	658	DFYNETETKIFL
VKEEYIRKFKVE	tr|Q6TUX0|Q6TUX0_YMTV5	55	sp|Q8N4P6|LRC71_HUMAN Leucine-rich repeat-containing protein 71 OS=Homo sapiens OX=9606 GN=LRRC71 PE=2 SV=1	140	VKEIYIRGWKVE
ISSSDDWLVEEG	tr|Q6TV05|Q6TV05_YMTV5	137	sp|Q9NY61|AATF_HUMAN Protein AATF OS=Homo sapiens OX=9606 GN=AATF PE=1 SV=1	319	ISSEDDELVEEK
IIFRLLIINLYE	tr|Q6TUP1|Q6TUP1_YMTV5	225	sp|Q9NR20|DYRK4_HUMAN Dual specificity tyrosine-phosphorylation-regulated kinase 4 OS=Homo sapiens OX=9606 GN=DYRK4 PE=1 SV=2	181	ITFELLGINLYE
IIFRLLIINLYE	tr|Q6TUP1|Q6TUP1_YMTV5	225	tr|A0A0A0MTH5|A0A0A0MTH5_HUMAN Dual-specificity kinase OS=Homo sapiens OX=9606 GN=DYRK4 PE=1 SV=1	296	ITFELLGINLYE
RREDIFYDEIIF	tr|Q6TV03|Q6TV03_YMTV5	78	tr|G3V1A9|G3V1A9_HUMAN Condensin-2 complex subunit D3 OS=Homo sapiens OX=9606 GN=NCAPD3 PE=1 SV=1	184	RREDIEMDEIIE
RREDIFYDEIIF	tr|Q6TV03|Q6TV03_YMTV5	78	sp|P42695|CNDD3_HUMAN Condensin-2 complex subunit D3 OS=Homo sapiens OX=9606 GN=NCAPD3 PE=1 SV=2	184	RREDIEMDEIIE
RREDIFYDEIIF	tr|Q6TV03|Q6TV03_YMTV5	78	tr|E9PKK4|E9PKK4_HUMAN Condensin-2 complex subunit D3 OS=Homo sapiens OX=9606 GN=NCAPD3 PE=1 SV=1	184	RREDIEMDEIIE
SYNTEDFAKVGI	tr|Q6TUS4|Q6TUS4_YMTV5	49	tr|E9PPA1|E9PPA1_HUMAN Oxysterols receptor LXR-alpha (Fragment) OS=Homo sapiens OX=9606 GN=NR1H3 PE=1 SV=1	126	SYNREDFAKAGL
SYNTEDFAKVGI	tr|Q6TUS4|Q6TUS4_YMTV5	49	sp|Q13133|NR1H3_HUMAN Oxysterols receptor LXR-alpha OS=Homo sapiens OX=9606 GN=NR1H3 PE=1 SV=2	320	SYNREDFAKAGL
SYNTEDFAKVGI	tr|Q6TUS4|Q6TUS4_YMTV5	49	tr|E9PID2|E9PID2_HUMAN Oxysterols receptor LXR-alpha OS=Homo sapiens OX=9606 GN=NR1H3 PE=1 SV=1	169	SYNREDFAKAGL
SYNTEDFAKVGI	tr|Q6TUS4|Q6TUS4_YMTV5	49	tr|B5MBY7|B5MBY7_HUMAN Oxysterols receptor LXR-alpha OS=Homo sapiens OX=9606 GN=NR1H3 PE=1 SV=1	215	SYNREDFAKAGL
SYNTEDFAKVGI	tr|Q6TUS4|Q6TUS4_YMTV5	49	tr|E9PLL4|E9PLL4_HUMAN Oxysterols receptor LXR-alpha OS=Homo sapiens OX=9606 GN=NR1H3 PE=1 SV=1	339	SYNREDFAKAGL
SYNTEDFAKVGI	tr|Q6TUS4|Q6TUS4_YMTV5	49	tr|B4DXU5|B4DXU5_HUMAN Oxysterols receptor LXR-alpha OS=Homo sapiens OX=9606 GN=NR1H3 PE=1 SV=1	326	SYNREDFAKAGL
NDEELVKALTYL	tr|Q6TUX7|Q6TUX7_YMTV5	17	sp|Q8N1W1|ARG28_HUMAN Rho guanine nucleotide exchange factor 28 OS=Homo sapiens OX=9606 GN=ARHGEF28 PE=1 SV=3	132	LDEELVLALTHL
MFKIKKKSANTS	tr|Q6TUV1|Q6TUV1_YMTV5	230	sp|Q8WXD0|RXFP2_HUMAN Relaxin receptor 2 OS=Homo sapiens OX=9606 GN=RXFP2 PE=1 SV=1	714	IFKIKKKSLSTS
KPISNIRISSAE	tr|Q6TUY6|Q6TUY6_YMTV5	75	tr|F2Z2M5|F2Z2M5_HUMAN Centrosome and spindle pole-associated protein 1 OS=Homo sapiens OX=9606 GN=CSPP1 PE=1 SV=1	335	IEQSNIRISSAE
KPISNIRISSAE	tr|Q6TUY6|Q6TUY6_YMTV5	75	tr|A0A6Q8PGS3|A0A6Q8PGS3_HUMAN Centrosome and spindle pole-associated protein 1 OS=Homo sapiens OX=9606 GN=CSPP1 PE=1 SV=1	300	IEQSNIRISSAE
KPISNIRISSAE	tr|Q6TUY6|Q6TUY6_YMTV5	75	tr|A0A6Q8PHN8|A0A6Q8PHN8_HUMAN Centrosome and spindle pole-associated protein 1 OS=Homo sapiens OX=9606 GN=CSPP1 PE=1 SV=1	327	IEQSNIRISSAE
KPISNIRISSAE	tr|Q6TUY6|Q6TUY6_YMTV5	75	tr|A0A6Q8PF61|A0A6Q8PF61_HUMAN Centrosome and spindle pole-associated protein 1 OS=Homo sapiens OX=9606 GN=CSPP1 PE=1 SV=1	327	IEQSNIRISSAE
KPISNIRISSAE	tr|Q6TUY6|Q6TUY6_YMTV5	75	sp|Q1MSJ5|CSPP1_HUMAN Centrosome and spindle pole-associated protein 1 OS=Homo sapiens OX=9606 GN=CSPP1 PE=1 SV=4	371	IEQSNIRISSAE
KPISNIRISSAE	tr|Q6TUY6|Q6TUY6_YMTV5	75	tr|A0A6Q8PF96|A0A6Q8PF96_HUMAN Centrosome and spindle pole-associated protein 1 OS=Homo sapiens OX=9606 GN=CSPP1 PE=1 SV=1	300	IEQSNIRISSAE
KTMLSLNEGFAS	tr|Q6TUU8|Q6TUU8_YMTV5	94	sp|A6NEC2|PSAL_HUMAN Puromycin-sensitive aminopeptidase-like protein OS=Homo sapiens OX=9606 GN=NPEPPSL1 PE=2 SV=3	368	WTHLRLNEGFAS
KTMLSLNEGFAS	tr|Q6TUU8|Q6TUU8_YMTV5	94	tr|E9PJ74|E9PJ74_HUMAN Puromycin-sensitive aminopeptidase (Fragment) OS=Homo sapiens OX=9606 GN=NPEPPS PE=4 SV=1	51	WTHLWLNEGFAS
KTMLSLNEGFAS	tr|Q6TUU8|Q6TUU8_YMTV5	94	tr|E9PRQ5|E9PRQ5_HUMAN Puromycin-sensitive aminopeptidase (Fragment) OS=Homo sapiens OX=9606 GN=NPEPPS PE=4 SV=1	65	WTHLWLNEGFAS
KTMLSLNEGFAS	tr|Q6TUU8|Q6TUU8_YMTV5	94	sp|P55786|PSA_HUMAN Puromycin-sensitive aminopeptidase OS=Homo sapiens OX=9606 GN=NPEPPS PE=1 SV=2	368	WTHLWLNEGFAS
KTMLSLNEGFAS	tr|Q6TUU8|Q6TUU8_YMTV5	94	tr|E9PLK3|E9PLK3_HUMAN Aminopeptidase OS=Homo sapiens OX=9606 GN=NPEPPS PE=1 SV=1	364	WTHLWLNEGFAS
KTMLSLNEGFAS	tr|Q6TUU8|Q6TUU8_YMTV5	94	tr|E9PI82|E9PI82_HUMAN Puromycin-sensitive aminopeptidase OS=Homo sapiens OX=9606 GN=NPEPPS PE=4 SV=1	51	WTHLWLNEGFAS
AFGKPFCGVCEN	tr|Q6TUW0|Q6TUW0_YMTV5	7	sp|Q7Z3T8|ZFY16_HUMAN Zinc finger FYVE domain-containing protein 16 OS=Homo sapiens OX=9606 GN=ZFYVE16 PE=1 SV=3	771	ACGKVFCGVCCN
LTPCERKSSTPS	tr|Q6TUY1|Q6TUY1_YMTV5	62	tr|U3KQJ0|U3KQJ0_HUMAN M-phase phosphoprotein 9 (Fragment) OS=Homo sapiens OX=9606 GN=MPHOSPH9 PE=1 SV=1	150	LPPSNRKSSTPS
IIEELKTLYGSS	sp|Q9QB97|ETF1_YMTV5	133	tr|J3QQV3|J3QQV3_HUMAN Centrosomal protein of 112 kDa (Fragment) OS=Homo sapiens OX=9606 GN=CEP112 PE=1 SV=1	293	EIEELKTLYRSK
IIEELKTLYGSS	sp|Q9QB97|ETF1_YMTV5	133	tr|F5GYE8|F5GYE8_HUMAN Centrosomal protein of 112 kDa OS=Homo sapiens OX=9606 GN=CEP112 PE=1 SV=1	251	EIEELKTLYRSK
IIEELKTLYGSS	sp|Q9QB97|ETF1_YMTV5	133	sp|Q8N8E3|CE112_HUMAN Centrosomal protein of 112 kDa OS=Homo sapiens OX=9606 GN=CEP112 PE=1 SV=2	293	EIEELKTLYRSK
LRPFLRVLIELI	tr|Q6TUV2|Q6TUV2_YMTV5	38	sp|Q14571|ITPR2_HUMAN Inositol 1,4,5-trisphosphate receptor type 2 OS=Homo sapiens OX=9606 GN=ITPR2 PE=1 SV=2	1054	GRTFLRVLIHLI
AASLVFLIIVVF	tr|Q6TUW9|Q6TUW9_YMTV5	50	tr|B1AKC9|B1AKC9_HUMAN Receptor protein-tyrosine kinase OS=Homo sapiens OX=9606 GN=EPHB2 PE=1 SV=1	544	AAGLVFLIAVVV
AASLVFLIIVVF	tr|Q6TUW9|Q6TUW9_YMTV5	50	sp|P29323|EPHB2_HUMAN Ephrin type-B receptor 2 OS=Homo sapiens OX=9606 GN=EPHB2 PE=1 SV=5	549	AAGLVFLIAVVV
ILSRLEKKVSQK	tr|Q6TUU4|Q6TUU4_YMTV5	1258	sp|A6NCM1|IQCAL_HUMAN IQ and AAA domain-containing protein 1-like OS=Homo sapiens OX=9606 GN=IQCA1L PE=3 SV=3	142	ILSRLEPVSSQK
SGEDGKKGVDFS	tr|Q6TV05|Q6TV05_YMTV5	102	sp|Q9ULW6|NP1L2_HUMAN Nucleosome assembly protein 1-like 2 OS=Homo sapiens OX=9606 GN=NAP1L2 PE=1 SV=1	69	SGEDGKKGGDTD
NPSKKKIIIIEF	tr|Q6TUT6|Q6TUT6_YMTV5	584	tr|H7C0N3|H7C0N3_HUMAN Cortactin-binding protein 2 (Fragment) OS=Homo sapiens OX=9606 GN=CTTNBP2 PE=1 SV=1	172	SPSKKKIIIILE
NPSKKKIIIIEF	tr|Q6TUT6|Q6TUT6_YMTV5	584	tr|H0Y448|H0Y448_HUMAN Cortactin-binding protein 2 (Fragment) OS=Homo sapiens OX=9606 GN=CTTNBP2 PE=1 SV=1	675	SPSKKKIIIILE
NPSKKKIIIIEF	tr|Q6TUT6|Q6TUT6_YMTV5	584	sp|Q8WZ74|CTTB2_HUMAN Cortactin-binding protein 2 OS=Homo sapiens OX=9606 GN=CTTNBP2 PE=1 SV=1	1187	SPSKKKIIIILE
SNISICLELLRS	tr|Q6TUX3|Q6TUX3_YMTV5	861	tr|D6RA11|D6RA11_HUMAN Ubiquitin-conjugating enzyme E2 D3 (Fragment) OS=Homo sapiens OX=9606 GN=UBE2D3 PE=1 SV=1	80	SNGSICLDILRS
SNISICLELLRS	tr|Q6TUX3|Q6TUX3_YMTV5	861	tr|D6RAW0|D6RAW0_HUMAN Ubiquitin-conjugating enzyme E2 D3 (Fragment) OS=Homo sapiens OX=9606 GN=UBE2D3 PE=3 SV=1	51	SNGSICLDILRS
SNISICLELLRS	tr|Q6TUX3|Q6TUX3_YMTV5	861	tr|D6RFM0|D6RFM0_HUMAN Ubiquitin-conjugating enzyme E2 D2 (Fragment) OS=Homo sapiens OX=9606 GN=UBE2D2 PE=1 SV=1	51	SNGSICLDILRS
SNISICLELLRS	tr|Q6TUX3|Q6TUX3_YMTV5	861	tr|H9KV45|H9KV45_HUMAN Ubiquitin-conjugating enzyme E2 D3 OS=Homo sapiens OX=9606 GN=UBE2D3 PE=1 SV=1	74	SNGSICLDILRS
SNISICLELLRS	tr|Q6TUX3|Q6TUX3_YMTV5	861	sp|P61077|UB2D3_HUMAN Ubiquitin-conjugating enzyme E2 D3 OS=Homo sapiens OX=9606 GN=UBE2D3 PE=1 SV=1	80	SNGSICLDILRS
SNISICLELLRS	tr|Q6TUX3|Q6TUX3_YMTV5	861	tr|A0A087WY85|A0A087WY85_HUMAN Ubiquitin-conjugating enzyme E2 D3 OS=Homo sapiens OX=9606 GN=UBE2D3 PE=1 SV=1	81	SNGSICLDILRS
SNISICLELLRS	tr|Q6TUX3|Q6TUX3_YMTV5	861	tr|D6RAH7|D6RAH7_HUMAN Ubiquitin-conjugating enzyme E2 D3 OS=Homo sapiens OX=9606 GN=UBE2D3 PE=1 SV=1	51	SNGSICLDILRS
SNISICLELLRS	tr|Q6TUX3|Q6TUX3_YMTV5	861	tr|A0A0A0MQU3|A0A0A0MQU3_HUMAN Ubiquitin-conjugating enzyme E2 D2 OS=Homo sapiens OX=9606 GN=UBE2D2 PE=1 SV=1	80	SNGSICLDILRS
SNISICLELLRS	tr|Q6TUX3|Q6TUX3_YMTV5	861	sp|P62837|UB2D2_HUMAN Ubiquitin-conjugating enzyme E2 D2 OS=Homo sapiens OX=9606 GN=UBE2D2 PE=1 SV=1	80	SNGSICLDILRS
SNISICLELLRS	tr|Q6TUX3|Q6TUX3_YMTV5	861	tr|C9J9H9|C9J9H9_HUMAN Ubiquitin-conjugating enzyme E2 D4 OS=Homo sapiens OX=9606 GN=UBE2D4 PE=1 SV=1	80	SNGSICLDILRS
SNISICLELLRS	tr|Q6TUX3|Q6TUX3_YMTV5	861	tr|A0A087WW00|A0A087WW00_HUMAN Ubiquitin-conjugating enzyme E2 D1 OS=Homo sapiens OX=9606 GN=UBE2D1 PE=1 SV=1	42	SNGSICLDILRS
SNISICLELLRS	tr|Q6TUX3|Q6TUX3_YMTV5	861	sp|P51668|UB2D1_HUMAN Ubiquitin-conjugating enzyme E2 D1 OS=Homo sapiens OX=9606 GN=UBE2D1 PE=1 SV=1	80	SNGSICLDILRS
SNISICLELLRS	tr|Q6TUX3|Q6TUX3_YMTV5	861	sp|Q9Y2X8|UB2D4_HUMAN Ubiquitin-conjugating enzyme E2 D4 OS=Homo sapiens OX=9606 GN=UBE2D4 PE=1 SV=1	80	SNGSICLDILRS
GKSADIVKLSLD	tr|Q6TUT9|Q6TUT9_YMTV5	152	sp|Q9P2S2|NRX2A_HUMAN Neurexin-2 OS=Homo sapiens OX=9606 GN=NRXN2 PE=2 SV=1	331	GKSADYVNLSLK
GKSADIVKLSLD	tr|Q6TUT9|Q6TUT9_YMTV5	152	tr|G5E9G7|G5E9G7_HUMAN Neurexin 2, isoform CRA_a OS=Homo sapiens OX=9606 GN=NRXN2 PE=1 SV=1	331	GKSADYVNLSLK
GKSADIVKLSLD	tr|Q6TUT9|Q6TUT9_YMTV5	152	tr|H7C3J4|H7C3J4_HUMAN Neurexin-2 (Fragment) OS=Homo sapiens OX=9606 GN=NRXN2 PE=1 SV=1	121	GKSADYVNLSLK
GKSADIVKLSLD	tr|Q6TUT9|Q6TUT9_YMTV5	152	tr|H7C3D6|H7C3D6_HUMAN Neurexin-2 (Fragment) OS=Homo sapiens OX=9606 GN=NRXN2 PE=1 SV=1	92	GKSADYVNLSLK
GKSADIVKLSLD	tr|Q6TUT9|Q6TUT9_YMTV5	152	tr|H7BZC7|H7BZC7_HUMAN Neurexin-2 (Fragment) OS=Homo sapiens OX=9606 GN=NRXN2 PE=1 SV=8	102	GKSADYVNLSLK
NVLVNILLEDIV	tr|Q6TUZ5|Q6TUZ5_YMTV5	114	sp|P42858|HD_HUMAN Huntingtin OS=Homo sapiens OX=9606 GN=HTT PE=1 SV=2	1745	LQLVGILLEDIV
PYIHSYLLVREE	sp|Q6TUY0|PAP1_YMTV5	225	sp|Q8NDM7|CFA43_HUMAN Cilia- and flagella-associated protein 43 OS=Homo sapiens OX=9606 GN=CFAP43 PE=2 SV=3	610	PYICSYLLPEEE
PYIHSYLLVREE	sp|Q6TUY0|PAP1_YMTV5	225	tr|Q5TA04|Q5TA04_HUMAN Cilia- and flagella-associated protein 43 OS=Homo sapiens OX=9606 GN=CFAP43 PE=1 SV=2	611	PYICSYLLPEEE
WKDLKPSSDFST	tr|Q6TUU4|Q6TUU4_YMTV5	576	sp|O43581|SYT7_HUMAN Synaptotagmin-7 OS=Homo sapiens OX=9606 GN=SYT7 PE=1 SV=3	254	WKDLKPCSDGSG
KAFAEISNLSGR	tr|Q6TUN7|Q6TUN7_YMTV5	1220	sp|Q14584|ZN266_HUMAN Zinc finger protein 266 OS=Homo sapiens OX=9606 GN=ZNF266 PE=1 SV=2	415	KAFAISSNLSGH
KAFAEISNLSGR	tr|Q6TUN7|Q6TUN7_YMTV5	1220	tr|A0A3F2YPB8|A0A3F2YPB8_HUMAN Zinc finger protein 266 OS=Homo sapiens OX=9606 GN=ZNF266 PE=1 SV=1	482	KAFAISSNLSGH
KAFAEISNLSGR	tr|Q6TUN7|Q6TUN7_YMTV5	1220	sp|Q9BUY5|ZN426_HUMAN Zinc finger protein 426 OS=Homo sapiens OX=9606 GN=ZNF426 PE=1 SV=1	399	KAFAVSSNLSGH
KAFAEISNLSGR	tr|Q6TUN7|Q6TUN7_YMTV5	1220	tr|K7ER43|K7ER43_HUMAN Zinc finger protein 426 OS=Homo sapiens OX=9606 GN=ZNF426 PE=1 SV=1	361	KAFAVSSNLSGH
GLIDGSSLLFIG	tr|Q6TUU7|Q6TUU7_YMTV5	57	sp|O43603|GALR2_HUMAN Galanin receptor type 2 OS=Homo sapiens OX=9606 GN=GALR2 PE=1 SV=1	147	GLIWGLSLLFSG
RILKRSFVNIVI	tr|Q6TUV2|Q6TUV2_YMTV5	61	tr|A0A0A0MSQ2|A0A0A0MSQ2_HUMAN DNA-binding protein RFX5 (Fragment) OS=Homo sapiens OX=9606 GN=RFX5 PE=1 SV=6	214	RILKRSFSSIVE
RILKRSFVNIVI	tr|Q6TUV2|Q6TUV2_YMTV5	61	tr|H0Y4B4|H0Y4B4_HUMAN DNA-binding protein RFX5 (Fragment) OS=Homo sapiens OX=9606 GN=RFX5 PE=1 SV=1	106	RILKRSFSSIVE
RILKRSFVNIVI	tr|Q6TUV2|Q6TUV2_YMTV5	61	tr|F8W689|F8W689_HUMAN DNA-binding protein RFX5 (Fragment) OS=Homo sapiens OX=9606 GN=RFX5 PE=1 SV=1	214	RILKRSFSSIVE
RILKRSFVNIVI	tr|Q6TUV2|Q6TUV2_YMTV5	61	sp|P48382|RFX5_HUMAN DNA-binding protein RFX5 OS=Homo sapiens OX=9606 GN=RFX5 PE=1 SV=1	214	RILKRSFSSIVE
NSYNTEDFAKVG	tr|Q6TUS4|Q6TUS4_YMTV5	48	tr|E9PPA1|E9PPA1_HUMAN Oxysterols receptor LXR-alpha (Fragment) OS=Homo sapiens OX=9606 GN=NR1H3 PE=1 SV=1	125	FSYNREDFAKAG
NSYNTEDFAKVG	tr|Q6TUS4|Q6TUS4_YMTV5	48	sp|Q13133|NR1H3_HUMAN Oxysterols receptor LXR-alpha OS=Homo sapiens OX=9606 GN=NR1H3 PE=1 SV=2	319	FSYNREDFAKAG
NSYNTEDFAKVG	tr|Q6TUS4|Q6TUS4_YMTV5	48	tr|E9PID2|E9PID2_HUMAN Oxysterols receptor LXR-alpha OS=Homo sapiens OX=9606 GN=NR1H3 PE=1 SV=1	168	FSYNREDFAKAG
NSYNTEDFAKVG	tr|Q6TUS4|Q6TUS4_YMTV5	48	tr|B5MBY7|B5MBY7_HUMAN Oxysterols receptor LXR-alpha OS=Homo sapiens OX=9606 GN=NR1H3 PE=1 SV=1	214	FSYNREDFAKAG
NSYNTEDFAKVG	tr|Q6TUS4|Q6TUS4_YMTV5	48	tr|E9PLL4|E9PLL4_HUMAN Oxysterols receptor LXR-alpha OS=Homo sapiens OX=9606 GN=NR1H3 PE=1 SV=1	338	FSYNREDFAKAG
NSYNTEDFAKVG	tr|Q6TUS4|Q6TUS4_YMTV5	48	tr|B4DXU5|B4DXU5_HUMAN Oxysterols receptor LXR-alpha OS=Homo sapiens OX=9606 GN=NR1H3 PE=1 SV=1	325	FSYNREDFAKAG
SSVSFDDNDFGL	tr|Q6TUZ1|Q6TUZ1_YMTV5	3	sp|Q7Z4H7|HAUS6_HUMAN HAUS augmin-like complex subunit 6 OS=Homo sapiens OX=9606 GN=HAUS6 PE=1 SV=2	764	SSKSFKDNDFGI
SSVSFDDNDFGL	tr|Q6TUZ1|Q6TUZ1_YMTV5	3	tr|Q5VY60|Q5VY60_HUMAN HAUS augmin-like complex subunit 6 OS=Homo sapiens OX=9606 GN=HAUS6 PE=1 SV=1	628	SSKSFKDNDFGI
LLSRPDLNNLLL	tr|Q6TUZ9|Q6TUZ9_YMTV5	477	tr|A0A3B3ITP6|A0A3B3ITP6_HUMAN DNA helicase OS=Homo sapiens OX=9606 GN=MCM4 PE=1 SV=1	640	LLSRFDLIFLLL
LLSRPDLNNLLL	tr|Q6TUZ9|Q6TUZ9_YMTV5	477	tr|A0A3B3IU45|A0A3B3IU45_HUMAN DNA helicase OS=Homo sapiens OX=9606 GN=MCM4 PE=1 SV=1	590	LLSRFDLIFLLL
LLSRPDLNNLLL	tr|Q6TUZ9|Q6TUZ9_YMTV5	477	tr|E5RG31|E5RG31_HUMAN DNA helicase (Fragment) OS=Homo sapiens OX=9606 GN=MCM4 PE=1 SV=9	359	LLSRFDLIFLLL
LLSRPDLNNLLL	tr|Q6TUZ9|Q6TUZ9_YMTV5	477	sp|P33991|MCM4_HUMAN DNA replication licensing factor MCM4 OS=Homo sapiens OX=9606 GN=MCM4 PE=1 SV=5	640	LLSRFDLIFLLL
LLSRPDLNNLLL	tr|Q6TUZ9|Q6TUZ9_YMTV5	477	tr|A0A3B3IT92|A0A3B3IT92_HUMAN DNA helicase OS=Homo sapiens OX=9606 GN=MCM4 PE=1 SV=1	681	LLSRFDLIFLLL
LLSRPDLNNLLL	tr|Q6TUZ9|Q6TUZ9_YMTV5	477	tr|A0A3B3IS57|A0A3B3IS57_HUMAN DNA helicase OS=Homo sapiens OX=9606 GN=MCM4 PE=1 SV=1	526	LLSRFDLIFLLL
LLSRPDLNNLLL	tr|Q6TUZ9|Q6TUZ9_YMTV5	477	tr|D6RBP5|D6RBP5_HUMAN Group XIIA secretory phospholipase A2 OS=Homo sapiens OX=9606 GN=PLA2G12A PE=1 SV=1	3	LLSRPALTLLLL
LLSRPDLNNLLL	tr|Q6TUZ9|Q6TUZ9_YMTV5	477	tr|A0A0C4DGC6|A0A0C4DGC6_HUMAN Group XIIA secretory phospholipase A2 OS=Homo sapiens OX=9606 GN=PLA2G12A PE=1 SV=1	3	LLSRPALTLLLL
LLSRPDLNNLLL	tr|Q6TUZ9|Q6TUZ9_YMTV5	477	sp|Q9BZM1|PG12A_HUMAN Group XIIA secretory phospholipase A2 OS=Homo sapiens OX=9606 GN=PLA2G12A PE=1 SV=1	3	LLSRPALTLLLL
PLKGENLFLLKQ	tr|Q6TUP2|Q6TUP2_YMTV5	164	tr|A0A087WZ16|A0A087WZ16_HUMAN Intermediate filament family orphan 1 OS=Homo sapiens OX=9606 GN=IFFO1 PE=1 SV=1	3	PLFGPNLFLLQQ
PLKGENLFLLKQ	tr|Q6TUP2|Q6TUP2_YMTV5	164	sp|Q0D2I5|IFFO1_HUMAN Non-homologous end joining factor IFFO1 OS=Homo sapiens OX=9606 GN=IFFO1 PE=1 SV=2	3	PLFGPNLFLLQQ
VLVNILLEDIVN	tr|Q6TUZ5|Q6TUZ5_YMTV5	115	sp|P42858|HD_HUMAN Huntingtin OS=Homo sapiens OX=9606 GN=HTT PE=1 SV=2	1746	QLVGILLEDIVT
DNKVPLKVVVEK	tr|Q6TUS0|Q6TUS0_YMTV5	246	tr|A0A140T947|A0A140T947_HUMAN Pre-mRNA-splicing factor ATP-dependent RNA helicase DHX16 (Fragment) OS=Homo sapiens OX=9606 GN=DHX16 PE=1 SV=1	67	WNKVPRKAVVEK
DNKVPLKVVVEK	tr|Q6TUS0|Q6TUS0_YMTV5	246	sp|O60231|DHX16_HUMAN Pre-mRNA-splicing factor ATP-dependent RNA helicase DHX16 OS=Homo sapiens OX=9606 GN=DHX16 PE=1 SV=2	67	WNKVPRKAVVEK
RSDDEVGSAKEG	tr|Q6TUU4|Q6TUU4_YMTV5	28	sp|Q6ULP2|AFTIN_HUMAN Aftiphilin OS=Homo sapiens OX=9606 GN=AFTPH PE=1 SV=3	375	TSDDEVGSPKEE
RSDDEVGSAKEG	tr|Q6TUU4|Q6TUU4_YMTV5	28	tr|B8ZZI9|B8ZZI9_HUMAN Aftiphilin (Fragment) OS=Homo sapiens OX=9606 GN=AFTPH PE=1 SV=2	30	TSDDEVGSPKEE
INSHIMEINLKN	sp|Q9QB93|NTP1_YMTV5	558	sp|Q96JP9|CDHR1_HUMAN Cadherin-related family member 1 OS=Homo sapiens OX=9606 GN=CDHR1 PE=1 SV=2	622	INSHTGEIWLKN
INSHIMEINLKN	sp|Q9QB93|NTP1_YMTV5	558	tr|A0A0A6YYA3|A0A0A6YYA3_HUMAN Cadherin-related family member 1 (Fragment) OS=Homo sapiens OX=9606 GN=CDHR1 PE=1 SV=1	361	INSHTGEIWLKN
INSHIMEINLKN	sp|Q9QB93|NTP1_YMTV5	558	tr|A0A096LNV6|A0A096LNV6_HUMAN Cadherin-related family member 1 (Fragment) OS=Homo sapiens OX=9606 GN=CDHR1 PE=4 SV=1	13	INSHTGEIWLKN
PDKYYKYVSDRK	tr|Q6TUN7|Q6TUN7_YMTV5	1408	sp|Q5T5Y3|CAMP1_HUMAN Calmodulin-regulated spectrin-associated protein 1 OS=Homo sapiens OX=9606 GN=CAMSAP1 PE=1 SV=2	1552	IDKLYKYSSDRK
PFEFAENLSLEG	tr|Q6TUZ2|Q6TUZ2_YMTV5	282	sp|P31350|RIR2_HUMAN Ribonucleoside-diphosphate reductase subunit M2 OS=Homo sapiens OX=9606 GN=RRM2 PE=1 SV=1	346	PFDFMENISLEG
PFEFAENLSLEG	tr|Q6TUZ2|Q6TUZ2_YMTV5	282	sp|Q7LG56|RIR2B_HUMAN Ribonucleoside-diphosphate reductase subunit M2 B OS=Homo sapiens OX=9606 GN=RRM2B PE=1 SV=1	308	PFDFMENISLEG
PFEFAENLSLEG	tr|Q6TUZ2|Q6TUZ2_YMTV5	282	tr|A0A0C4DGZ6|A0A0C4DGZ6_HUMAN Ribonucleoside-diphosphate reductase subunit M2 B OS=Homo sapiens OX=9606 GN=RRM2B PE=1 SV=1	254	PFDFMENISLEG
PFEFAENLSLEG	tr|Q6TUZ2|Q6TUZ2_YMTV5	282	tr|H0YAV1|H0YAV1_HUMAN Ribonucleoside-diphosphate reductase subunit M2 B (Fragment) OS=Homo sapiens OX=9606 GN=RRM2B PE=1 SV=1	365	PFDFMENISLEG
KNFLLKKNEVSG	tr|Q6TUT6|Q6TUT6_YMTV5	237	sp|Q9UKN7|MYO15_HUMAN Unconventional myosin-XV OS=Homo sapiens OX=9606 GN=MYO15A PE=1 SV=2	139	KKFLLKKAEESG
KNFLLKKNEVSG	tr|Q6TUT6|Q6TUT6_YMTV5	237	tr|A0A087WYA1|A0A087WYA1_HUMAN Unconventional myosin-XV OS=Homo sapiens OX=9606 GN=MYO15A PE=1 SV=1	139	KKFLLKKAEESG
NEKYVNENAELI	tr|Q6TUP0|Q6TUP0_YMTV5	84	sp|Q9H1V8|S6A17_HUMAN Sodium-dependent neutral amino acid transporter SLC6A17 OS=Homo sapiens OX=9606 GN=SLC6A17 PE=1 SV=3	363	NEKCVVENAEKI
SLKSKEGLFGSC	tr|Q6TUS7|Q6TUS7_YMTV5	123	tr|F8WF51|F8WF51_HUMAN Coiled-coil domain-containing protein 138 OS=Homo sapiens OX=9606 GN=CCDC138 PE=1 SV=1	17	SLKSRYGLGGSC
SLKSKEGLFGSC	tr|Q6TUS7|Q6TUS7_YMTV5	123	sp|Q96M89|CC138_HUMAN Coiled-coil domain-containing protein 138 OS=Homo sapiens OX=9606 GN=CCDC138 PE=1 SV=1	17	SLKSRYGLGGSC
SLKSKEGLFGSC	tr|Q6TUS7|Q6TUS7_YMTV5	123	tr|H7BZ08|H7BZ08_HUMAN Coiled-coil domain-containing protein 138 OS=Homo sapiens OX=9606 GN=CCDC138 PE=1 SV=1	17	SLKSRYGLGGSC
KAKLVELKSGVV	sp|Q9QB93|NTP1_YMTV5	273	sp|P15018|LIF_HUMAN Leukemia inhibitory factor OS=Homo sapiens OX=9606 GN=LIF PE=1 SV=1	99	KAKLVELYRIVV
NKVPLKVVVEKL	tr|Q6TUS0|Q6TUS0_YMTV5	247	tr|A0A140T947|A0A140T947_HUMAN Pre-mRNA-splicing factor ATP-dependent RNA helicase DHX16 (Fragment) OS=Homo sapiens OX=9606 GN=DHX16 PE=1 SV=1	68	NKVPRKAVVEKP
NKVPLKVVVEKL	tr|Q6TUS0|Q6TUS0_YMTV5	247	sp|O60231|DHX16_HUMAN Pre-mRNA-splicing factor ATP-dependent RNA helicase DHX16 OS=Homo sapiens OX=9606 GN=DHX16 PE=1 SV=2	68	NKVPRKAVVEKP
STLIKLGKELRL	tr|Q6TUU5|Q6TUU5_YMTV5	26	sp|Q8IXT1|DDIAS_HUMAN DNA damage-induced apoptosis suppressor protein OS=Homo sapiens OX=9606 GN=DDIAS PE=2 SV=2	306	STAEKLGKELGL
VNVDHCLNDIKR	tr|Q6TUX6|Q6TUX6_YMTV5	30	sp|Q8IVF4|DYH10_HUMAN Dynein heavy chain 10, axonemal OS=Homo sapiens OX=9606 GN=DNAH10 PE=1 SV=4	1166	VNVEHALGDIKR
VNVDHCLNDIKR	tr|Q6TUX6|Q6TUX6_YMTV5	30	tr|A0A1C7CYW8|A0A1C7CYW8_HUMAN Dynein heavy chain 10, axonemal OS=Homo sapiens OX=9606 GN=DNAH10 PE=1 SV=1	1227	VNVEHALGDIKR
VNVDHCLNDIKR	tr|Q6TUX6|Q6TUX6_YMTV5	30	tr|A0A669KB38|A0A669KB38_HUMAN Dynein heavy chain 10, axonemal OS=Homo sapiens OX=9606 GN=DNAH10 PE=1 SV=1	1284	VNVEHALGDIKR
FLNKFTKVLDVD	tr|Q6TUV9|Q6TUV9_YMTV5	279	sp|Q4KMQ2|ANO6_HUMAN Anoctamin-6 OS=Homo sapiens OX=9606 GN=ANO6 PE=1 SV=2	160	TLNWFTKVLSVD
AVNSDSVNGIIF	tr|Q6TUV0|Q6TUV0_YMTV5	59	tr|F8WF50|F8WF50_HUMAN Rab-like protein 3 OS=Homo sapiens OX=9606 GN=RABL3 PE=1 SV=1	82	AVFYNSVNGIIF
AVNSDSVNGIIF	tr|Q6TUV0|Q6TUV0_YMTV5	59	sp|Q5HYI8|RABL3_HUMAN Rab-like protein 3 OS=Homo sapiens OX=9606 GN=RABL3 PE=1 SV=1	82	AVFYNSVNGIIF
AVNSDSVNGIIF	tr|Q6TUV0|Q6TUV0_YMTV5	59	tr|C9JXM3|C9JXM3_HUMAN Rab-like protein 3 OS=Homo sapiens OX=9606 GN=RABL3 PE=1 SV=1	82	AVFYNSVNGIIF
AVNSDSVNGIIF	tr|Q6TUV0|Q6TUV0_YMTV5	59	tr|F8WDC7|F8WDC7_HUMAN Rab-like protein 3 OS=Homo sapiens OX=9606 GN=RABL3 PE=1 SV=1	82	AVFYNSVNGIIF
MAINPGKCVIFE	sp|Q9QB93|NTP1_YMTV5	375	sp|O75366|AVIL_HUMAN Advillin OS=Homo sapiens OX=9606 GN=AVIL PE=1 SV=3	486	MAIFKGKLVIFE
LRTVLGNLNNLK	tr|Q6TUN5|Q6TUN5_YMTV5	1	sp|Q9Y2B4|T53G5_HUMAN TP53-target gene 5 protein OS=Homo sapiens OX=9606 GN=TP53TG5 PE=1 SV=1	39	LRTVLKNLSLLK
VDSNRPIILKGC	tr|Q6TUY3|Q6TUY3_YMTV5	50	sp|Q8NAP8|ZBT8B_HUMAN Zinc finger and BTB domain-containing protein 8B OS=Homo sapiens OX=9606 GN=ZBTB8B PE=1 SV=2	392	HRSNRPIICKGC
ISRGKIPVLSNI	tr|Q6TUS2|Q6TUS2_YMTV5	94	tr|A0A6Q8PGS5|A0A6Q8PGS5_HUMAN Phosphatidylinositol-3,5-bisphosphate 3-phosphatase OS=Homo sapiens OX=9606 GN=MTMR2 PE=1 SV=1	190	RSRGRIPVLSWI
ISRGKIPVLSNI	tr|Q6TUS2|Q6TUS2_YMTV5	94	tr|C9JEX3|C9JEX3_HUMAN Phosphatidylinositol-3,5-bisphosphate 3-phosphatase (Fragment) OS=Homo sapiens OX=9606 GN=MTMR2 PE=1 SV=8	190	RSRGRIPVLSWI
ISRGKIPVLSNI	tr|Q6TUS2|Q6TUS2_YMTV5	94	sp|Q13614|MTMR2_HUMAN Myotubularin-related protein 2 OS=Homo sapiens OX=9606 GN=MTMR2 PE=1 SV=4	262	RSRGRIPVLSWI
ISRGKIPVLSNI	tr|Q6TUS2|Q6TUS2_YMTV5	94	tr|A0A6Q8PHL9|A0A6Q8PHL9_HUMAN Phosphatidylinositol-3,5-bisphosphate 3-phosphatase OS=Homo sapiens OX=9606 GN=MTMR2 PE=1 SV=1	200	RSRGRIPVLSWI
ISRGKIPVLSNI	tr|Q6TUS2|Q6TUS2_YMTV5	94	tr|A0A6Q8PHS7|A0A6Q8PHS7_HUMAN Phosphatidylinositol-3,5-bisphosphate 3-phosphatase OS=Homo sapiens OX=9606 GN=MTMR2 PE=1 SV=1	146	RSRGRIPVLSWI
EEDAISVEDILN	tr|Q6TUS4|Q6TUS4_YMTV5	618	sp|Q14204|DYHC1_HUMAN Cytoplasmic dynein 1 heavy chain 1 OS=Homo sapiens OX=9606 GN=DYNC1H1 PE=1 SV=5	1517	EEDALSWEDKLN
SITDEETECYVD	tr|Q6TUV1|Q6TUV1_YMTV5	60	sp|Q9UGR2|Z3H7B_HUMAN Zinc finger CCCH domain-containing protein 7B OS=Homo sapiens OX=9606 GN=ZC3H7B PE=1 SV=2	202	SIDDIETDCYVD
VNLKKSLVSFKN	tr|Q6TUQ3|Q6TUQ3_YMTV5	50	tr|A0A3B3ITA9|A0A3B3ITA9_HUMAN Lysine-specific demethylase 5B (Fragment) OS=Homo sapiens OX=9606 GN=KDM5B PE=1 SV=1	178	INKKKSLVSFKA
VNLKKSLVSFKN	tr|Q6TUQ3|Q6TUQ3_YMTV5	50	tr|B3KV94|B3KV94_HUMAN Jumonji, AT rich interactive domain 1B (RBP2-like), isoform CRA_a (Fragment) OS=Homo sapiens OX=9606 GN=KDM5B PE=1 SV=1	612	INKKKSLVSFKA
