query	query_seqname	query_start	target_seqname	target_start	target
LSADAGAYLSKF	sp|P0C6X1|R1AB_CVH22	6325	tr|K7ES95|K7ES95_HUMAN Leucine zipper and CTNNBIP1 domain-containing protein (Fragment) OS=Homo sapiens OX=9606 GN=LZIC PE=1 SV=1	117	LSANAGAILSQF
LSADAGAYLSKF	sp|P0C6X1|R1AB_CVH22	6325	sp|Q8WZA0|LZIC_HUMAN Protein LZIC OS=Homo sapiens OX=9606 GN=LZIC PE=1 SV=1	153	LSANAGAILSQF
NNVPAPKVVISK	sp|P0C6X1|R1AB_CVH22	5399	tr|H0YBT0|H0YBT0_HUMAN Myc proto-oncogene protein OS=Homo sapiens OX=9606 GN=MYC PE=1 SV=1	400	NNEKAPKVVILK
NNVPAPKVVISK	sp|P0C6X1|R1AB_CVH22	5399	sp|P01106|MYC_HUMAN Myc proto-oncogene protein OS=Homo sapiens OX=9606 GN=MYC PE=1 SV=1	386	NNEKAPKVVILK
NNVPAPKVVISK	sp|P0C6X1|R1AB_CVH22	5399	tr|A0A494C1T8|A0A494C1T8_HUMAN Myc proto-oncogene protein OS=Homo sapiens OX=9606 GN=MYC PE=1 SV=1	286	NNEKAPKVVILK
NNVPAPKVVISK	sp|P0C6X1|R1AB_CVH22	5399	tr|A0A087WUS5|A0A087WUS5_HUMAN Myc proto-oncogene protein OS=Homo sapiens OX=9606 GN=MYC PE=1 SV=1	401	NNEKAPKVVILK
IFTKPVFLNMAV	sp|P0C6X1|R1AB_CVH22	233	tr|A0A1B0GUH0|A0A1B0GUH0_HUMAN Oxygen-regulated protein 1 OS=Homo sapiens OX=9606 GN=RP1 PE=1 SV=1	696	IFVKGVFLNSAV
IFTKPVFLNMAV	sp|P0C6X1|R1AB_CVH22	233	tr|A0A1B0GTV9|A0A1B0GTV9_HUMAN Oxygen-regulated protein 1 OS=Homo sapiens OX=9606 GN=RP1 PE=1 SV=1	663	IFVKGVFLNSAV
ILYNDTALSAED	sp|P0C6X1|R1AB_CVH22	1484	tr|C9JU06|C9JU06_HUMAN Integral membrane protein GPR175 (Fragment) OS=Homo sapiens OX=9606 GN=TPRA1 PE=1 SV=1	171	ILYPDAHLSAED
ILYNDTALSAED	sp|P0C6X1|R1AB_CVH22	1484	sp|Q86W33|TPRA1_HUMAN Transmembrane protein adipocyte-associated 1 OS=Homo sapiens OX=9606 GN=TPRA1 PE=1 SV=1	171	ILYPDAHLSAED
ILYNDTALSAED	sp|P0C6X1|R1AB_CVH22	1484	tr|F8WC44|F8WC44_HUMAN Integral membrane protein GPR175 OS=Homo sapiens OX=9606 GN=TPRA1 PE=1 SV=1	171	ILYPDAHLSAED
RTYEKLAQTATP	sp|P0C6X1|R1AB_CVH22	2893	sp|Q9Y6I3|EPN1_HUMAN Epsin-1 OS=Homo sapiens OX=9606 GN=EPN1 PE=1 SV=2	149	KTKEKLAQTATA
EGGTDATVPLAA	sp|P0C6U2|R1A_CVH22	975	tr|A0A0C4DFM2|A0A0C4DFM2_HUMAN HCG1643764, isoform CRA_b OS=Homo sapiens OX=9606 GN=ZNF574 PE=1 SV=1	278	EGGEGATVPSAA
EGGTDATVPLAA	sp|P0C6U2|R1A_CVH22	975	sp|Q6ZN55|ZN574_HUMAN Zinc finger protein 574 OS=Homo sapiens OX=9606 GN=ZNF574 PE=1 SV=2	188	EGGEGATVPSAA
LTSYSKVFEDGY	sp|P0C6X1|R1AB_CVH22	547	sp|Q96JB1|DYH8_HUMAN Dynein heavy chain 8, axonemal OS=Homo sapiens OX=9606 GN=DNAH8 PE=1 SV=2	2291	LTLYEKVFEDTY
LTSYSKVFEDGY	sp|P0C6X1|R1AB_CVH22	547	tr|A0A075B6F3|A0A075B6F3_HUMAN Dynein heavy chain 8, axonemal OS=Homo sapiens OX=9606 GN=DNAH8 PE=1 SV=2	2508	LTLYEKVFEDTY
LTSYSKVFEDGY	sp|P0C6X1|R1AB_CVH22	547	tr|H0Y7V4|H0Y7V4_HUMAN Dynein heavy chain 8, axonemal OS=Homo sapiens OX=9606 GN=DNAH8 PE=1 SV=1	2508	LTLYEKVFEDTY
NLLVPSTQLLWS	sp|P15422|VME1_CVH22	169	tr|K7ERT3|K7ERT3_HUMAN Activity-dependent neuroprotector homeobox protein 2 (Fragment) OS=Homo sapiens OX=9606 GN=ADNP2 PE=1 SV=1	61	DLAVPSHQLLWS
LHSLKGKVVAAN	sp|P0C6X1|R1AB_CVH22	1823	tr|D3DX46|D3DX46_HUMAN MAGUK p55 subfamily member 3 OS=Homo sapiens OX=9606 GN=MPP3 PE=1 SV=1	423	LHELKQKVVAEN
LHSLKGKVVAAN	sp|P0C6X1|R1AB_CVH22	1823	sp|Q13368|MPP3_HUMAN MAGUK p55 subfamily member 3 OS=Homo sapiens OX=9606 GN=MPP3 PE=1 SV=2	398	LHELKQKVVAEN
KNAKLKDASRDS	sp|P0C6X1|R1AB_CVH22	3794	sp|Q9P219|DAPLE_HUMAN Protein Daple OS=Homo sapiens OX=9606 GN=CCDC88C PE=1 SV=3	441	KNADLSDASRKS
LVNLLKSAAYGL	sp|P0C6X1|R1AB_CVH22	3712	sp|Q12923|PTN13_HUMAN Tyrosine-protein phosphatase non-receptor type 13 OS=Homo sapiens OX=9606 GN=PTPN13 PE=1 SV=2	1093	LVNLKKDAKYGL
CNKVLVESICLR	sp|P0C6X1|R1AB_CVH22	5305	sp|Q9Y2L9|LRCH1_HUMAN Leucine-rich repeat and calponin homology domain-containing protein 1 OS=Homo sapiens OX=9606 GN=LRCH1 PE=1 SV=3	242	CNKVLVIPICFR
TAPLEYVLPLAI	sp|P0C6X1|R1AB_CVH22	1571	tr|D6RBJ7|D6RBJ7_HUMAN Gc-globulin OS=Homo sapiens OX=9606 GN=GC PE=1 SV=1	245	TADLEDVLPLAE
TAPLEYVLPLAI	sp|P0C6X1|R1AB_CVH22	1571	sp|P02774|VTDB_HUMAN Vitamin D-binding protein OS=Homo sapiens OX=9606 GN=GC PE=1 SV=2	245	TADLEDVLPLAE
TAPLEYVLPLAI	sp|P0C6X1|R1AB_CVH22	1571	tr|D6RF35|D6RF35_HUMAN Gc-globulin OS=Homo sapiens OX=9606 GN=GC PE=1 SV=1	245	TADLEDVLPLAE
LVPSTQLLWSKL	sp|P15422|VME1_CVH22	171	tr|K7ERT3|K7ERT3_HUMAN Activity-dependent neuroprotector homeobox protein 2 (Fragment) OS=Homo sapiens OX=9606 GN=ADNP2 PE=1 SV=1	63	AVPSHQLLWSKS
FDTAAKTVVLDV	sp|P0C6X1|R1AB_CVH22	4661	sp|P51587|BRCA2_HUMAN Breast cancer type 2 susceptibility protein OS=Homo sapiens OX=9606 GN=BRCA2 PE=1 SV=3	2679	DDTAAKTLVLCV
FDTAAKTVVLDV	sp|P0C6X1|R1AB_CVH22	4661	tr|A0A590UJU6|A0A590UJU6_HUMAN Breast cancer type 2 susceptibility protein (Fragment) OS=Homo sapiens OX=9606 GN=BRCA2 PE=1 SV=1	201	DDTAAKTLVLCV
EDVICVAEEKPI	sp|P0C6X1|R1AB_CVH22	1472	sp|O95197|RTN3_HUMAN Reticulon-3 OS=Homo sapiens OX=9606 GN=RTN3 PE=1 SV=2	593	EDVSEVAPEKPI
AEAIHELRNSSR	sp|P0C6X1|R1AB_CVH22	194	tr|E2QRF0|E2QRF0_HUMAN Ubiquitin carboxyl-terminal hydrolase OS=Homo sapiens OX=9606 GN=USP45 PE=1 SV=1	508	AEAISELRLSST
AEAIHELRNSSR	sp|P0C6X1|R1AB_CVH22	194	sp|Q70EL2|UBP45_HUMAN Ubiquitin carboxyl-terminal hydrolase 45 OS=Homo sapiens OX=9606 GN=USP45 PE=1 SV=3	556	AEAISELRLSST
EVHKDASPFDVP	sp|P0C6X1|R1AB_CVH22	1026	tr|K7ENE1|K7ENE1_HUMAN Major facilitator superfamily domain-containing protein 12 (Fragment) OS=Homo sapiens OX=9606 GN=MFSD12 PE=4 SV=1	135	EVHRDHSPGDVP
VIVGGNLSLILT	sp|P0C6X1|R1AB_CVH22	442	sp|Q8NGD3|OR4K5_HUMAN Olfactory receptor 4K5 OS=Homo sapiens OX=9606 GN=OR4K5 PE=3 SV=1	37	VIVLGNLLIILT
IRTYEKLAQTAT	sp|P0C6X1|R1AB_CVH22	2892	sp|Q9Y6I3|EPN1_HUMAN Epsin-1 OS=Homo sapiens OX=9606 GN=EPN1 PE=1 SV=2	148	LKTKEKLAQTAT
PTALALNSPLLA	sp|P0C6X1|R1AB_CVH22	4441	tr|A0A0C4DGJ6|A0A0C4DGJ6_HUMAN Methyl-CpG-binding domain protein 6 (Fragment) OS=Homo sapiens OX=9606 GN=MBD6 PE=1 SV=1	172	PTLIALNSALLA
PTALALNSPLLA	sp|P0C6X1|R1AB_CVH22	4441	sp|Q96DN6|MBD6_HUMAN Methyl-CpG-binding domain protein 6 OS=Homo sapiens OX=9606 GN=MBD6 PE=1 SV=2	671	PTLIALNSALLA
PTALALNSPLLA	sp|P0C6X1|R1AB_CVH22	4441	sp|P27815|PDE4A_HUMAN cAMP-specific 3',5'-cyclic phosphodiesterase 4A OS=Homo sapiens OX=9606 GN=PDE4A PE=1 SV=3	811	PSALALQSPLLP
VVFCKDQVAISF	sp|P0C6X1|R1AB_CVH22	6442	tr|A0A590UJD5|A0A590UJD5_HUMAN Obscurin (Fragment) OS=Homo sapiens OX=9606 GN=OBSCN PE=1 SV=1	411	VVFAKDQVAHSE
VVFCKDQVAISF	sp|P0C6X1|R1AB_CVH22	6442	tr|A6NGQ3|A6NGQ3_HUMAN Non-specific serine/threonine protein kinase OS=Homo sapiens OX=9606 GN=OBSCN PE=1 SV=5	1072	VVFAKDQVAHSE
VVFCKDQVAISF	sp|P0C6X1|R1AB_CVH22	6442	tr|A0A590UJ10|A0A590UJ10_HUMAN Obscurin OS=Homo sapiens OX=9606 GN=OBSCN PE=1 SV=1	980	VVFAKDQVAHSE
VVFCKDQVAISF	sp|P0C6X1|R1AB_CVH22	6442	sp|Q5VST9|OBSCN_HUMAN Obscurin OS=Homo sapiens OX=9606 GN=OBSCN PE=1 SV=3	980	VVFAKDQVAHSE
FKLLLVSTIECF	sp|P0C6U2|R1A_CVH22	316	sp|Q16602|CALRL_HUMAN Calcitonin gene-related peptide type 1 receptor OS=Homo sapiens OX=9606 GN=CALCRL PE=1 SV=2	375	FQGLLVSTIFCF
QSVNPFIILAAA	sp|P0C6U2|R1A_CVH22	2074	tr|H0YD97|H0YD97_HUMAN Pyruvate dehydrogenase protein X component, mitochondrial (Fragment) OS=Homo sapiens OX=9606 GN=PDHX PE=1 SV=1	14	VSVNDFIIKAAA
QSVNPFIILAAA	sp|P0C6U2|R1A_CVH22	2074	sp|O00330|ODPX_HUMAN Pyruvate dehydrogenase protein X component, mitochondrial OS=Homo sapiens OX=9606 GN=PDHX PE=1 SV=3	326	VSVNDFIIKAAA
GGKVYQGLAKNA	sp|P0C6X1|R1AB_CVH22	720	tr|A0A2R8Y7L2|A0A2R8Y7L2_HUMAN Peroxisomal multifunctional enzyme type 2 OS=Homo sapiens OX=9606 GN=HSD17B4 PE=1 SV=1	525	SGKVYQGPAKGA
GGKVYQGLAKNA	sp|P0C6X1|R1AB_CVH22	720	sp|P51659|DHB4_HUMAN Peroxisomal multifunctional enzyme type 2 OS=Homo sapiens OX=9606 GN=HSD17B4 PE=1 SV=3	672	SGKVYQGPAKGA
GGKVYQGLAKNA	sp|P0C6X1|R1AB_CVH22	720	tr|E7ET17|E7ET17_HUMAN Peroxisomal multifunctional enzyme type 2 OS=Homo sapiens OX=9606 GN=HSD17B4 PE=1 SV=1	535	SGKVYQGPAKGA
GGKVYQGLAKNA	sp|P0C6X1|R1AB_CVH22	720	tr|E7EPL9|E7EPL9_HUMAN Peroxisomal multifunctional enzyme type 2 OS=Homo sapiens OX=9606 GN=HSD17B4 PE=1 SV=1	410	SGKVYQGPAKGA
GGKVYQGLAKNA	sp|P0C6X1|R1AB_CVH22	720	tr|A0A2R8YD50|A0A2R8YD50_HUMAN Peroxisomal multifunctional enzyme type 2 OS=Homo sapiens OX=9606 GN=HSD17B4 PE=1 SV=1	672	SGKVYQGPAKGA
GGKVYQGLAKNA	sp|P0C6X1|R1AB_CVH22	720	tr|A0A2R8YF39|A0A2R8YF39_HUMAN Peroxisomal multifunctional enzyme type 2 (Fragment) OS=Homo sapiens OX=9606 GN=HSD17B4 PE=1 SV=1	3	SGKVYQGPAKGA
SLALLCCCSSGC	sp|P15423|SPIKE_CVH22	1131	tr|A0A087WXQ9|A0A087WXQ9_HUMAN Keratin-associated protein 5-11 OS=Homo sapiens OX=9606 GN=KRTAP5-11 PE=4 SV=1	145	SCCKLCCCSSGC
KELNLSLQALEC	sp|P0C6X1|R1AB_CVH22	2346	sp|Q13155|AIMP2_HUMAN Aminoacyl tRNA synthase complex-interacting multifunctional protein 2 OS=Homo sapiens OX=9606 GN=AIMP2 PE=1 SV=2	46	EESNLSLQALES
TSKPEPITPASY	sp|P0C6U2|R1A_CVH22	1176	tr|H0YDM2|H0YDM2_HUMAN Protein SOGA1 (Fragment) OS=Homo sapiens OX=9606 GN=SOGA1 PE=1 SV=1	1165	TKKPEPLSPASY
TSKPEPITPASY	sp|P0C6U2|R1A_CVH22	1176	sp|O94964|SOGA1_HUMAN Protein SOGA1 OS=Homo sapiens OX=9606 GN=SOGA1 PE=1 SV=2	1313	TKKPEPLSPASY
TIDPVKEEVSAD	sp|P15130|NCAP_CVH22	370	sp|P56962|STX17_HUMAN Syntaxin-17 OS=Homo sapiens OX=9606 GN=STX17 PE=1 SV=2	90	MIDPVKEEASAA
TIDPVKEEVSAD	sp|P15130|NCAP_CVH22	370	tr|E9PIC2|E9PIC2_HUMAN Syntaxin-17 OS=Homo sapiens OX=9606 GN=STX17 PE=1 SV=1	90	MIDPVKEEASAA
LLIMIQSCLWEF	sp|P0C6U2|R1A_CVH22	3340	sp|O75443|TECTA_HUMAN Alpha-tectorin OS=Homo sapiens OX=9606 GN=TECTA PE=1 SV=3	2136	LLIMIQISLWHF
LLIMIQSCLWEF	sp|P0C6U2|R1A_CVH22	3340	tr|A0A2R8YGQ5|A0A2R8YGQ5_HUMAN Alpha-tectorin (Fragment) OS=Homo sapiens OX=9606 GN=TECTA PE=1 SV=1	1310	LLIMIQISLWHF
LLIMIQSCLWEF	sp|P0C6U2|R1A_CVH22	3340	tr|A0A2R8YDL0|A0A2R8YDL0_HUMAN Alpha-tectorin OS=Homo sapiens OX=9606 GN=TECTA PE=1 SV=1	2131	LLIMIQISLWHF
DLSLGACSLALL	sp|P0C6U2|R1A_CVH22	2781	sp|O95622|ADCY5_HUMAN Adenylate cyclase type 5 OS=Homo sapiens OX=9606 GN=ADCY5 PE=1 SV=3	202	VLSLGACCLALL
ESALLNGLKLAH	sp|P0C6U2|R1A_CVH22	1684	tr|A0A0A0MR36|A0A0A0MR36_HUMAN Unconventional myosin-Vb (Fragment) OS=Homo sapiens OX=9606 GN=MYO5B PE=1 SV=1	383	YSLLLNQLKLAH
ESALLNGLKLAH	sp|P0C6U2|R1A_CVH22	1684	sp|Q9ULV0|MYO5B_HUMAN Unconventional myosin-Vb OS=Homo sapiens OX=9606 GN=MYO5B PE=1 SV=3	1240	YSLLLNQLKLAH
ESALLNGLKLAH	sp|P0C6U2|R1A_CVH22	1684	sp|Q96HJ9|FMC1_HUMAN Protein FMC1 homolog OS=Homo sapiens OX=9606 GN=FMC1 PE=1 SV=2	93	ESAGLVGLKLPH
VVLFLLFPLVVI	sp|P15422|VME1_CVH22	49	sp|O75509|TNR21_HUMAN Tumor necrosis factor receptor superfamily member 21 OS=Homo sapiens OX=9606 GN=TNFRSF21 PE=1 SV=1	354	IVLFLLLVLVVI
RVLVVLWRLVLA	sp|P19739|NS4A_CVH22	68	sp|Q8IY26|PLPP6_HUMAN Phospholipid phosphatase 6 OS=Homo sapiens OX=9606 GN=PLPP6 PE=1 SV=3	236	RVLVVLWAFVLG
LSLGACSLALLI	sp|P0C6U2|R1A_CVH22	2782	sp|P47871|GLR_HUMAN Glucagon receptor OS=Homo sapiens OX=9606 GN=GCGR PE=1 SV=1	151	LSLGALLLALAI
LSLGACSLALLI	sp|P0C6U2|R1A_CVH22	2782	tr|I3L454|I3L454_HUMAN Glucagon receptor OS=Homo sapiens OX=9606 GN=GCGR PE=1 SV=1	151	LSLGALLLALAI
LSLGACSLALLI	sp|P0C6U2|R1A_CVH22	2782	sp|O95622|ADCY5_HUMAN Adenylate cyclase type 5 OS=Homo sapiens OX=9606 GN=ADCY5 PE=1 SV=3	203	LSLGACCLALLQ
LPNDLNQTELVS	sp|P0C6X1|R1AB_CVH22	1643	tr|H0YJ14|H0YJ14_HUMAN Fanconi anemia group M protein (Fragment) OS=Homo sapiens OX=9606 GN=FANCM PE=1 SV=1	1003	LPNDLNQDRLKS
LPNDLNQTELVS	sp|P0C6X1|R1AB_CVH22	1643	tr|H0YJS3|H0YJS3_HUMAN Fanconi anemia group M protein (Fragment) OS=Homo sapiens OX=9606 GN=FANCM PE=1 SV=1	1551	LPNDLNQDRLKS
LPNDLNQTELVS	sp|P0C6X1|R1AB_CVH22	1643	sp|Q8IYD8|FANCM_HUMAN Fanconi anemia group M protein OS=Homo sapiens OX=9606 GN=FANCM PE=1 SV=2	2035	LPNDLNQDRLKS
VTKIAPNGTMVR	sp|P0C6U2|R1A_CVH22	1518	tr|H0Y5D8|H0Y5D8_HUMAN Rho GTPase-activating protein 12 (Fragment) OS=Homo sapiens OX=9606 GN=ARHGAP12 PE=1 SV=1	143	VTKIAENGKKVR
VTKIAPNGTMVR	sp|P0C6U2|R1A_CVH22	1518	sp|Q8IWW6|RHG12_HUMAN Rho GTPase-activating protein 12 OS=Homo sapiens OX=9606 GN=ARHGAP12 PE=1 SV=1	472	VTKIAENGKKVR
VTKIAPNGTMVR	sp|P0C6U2|R1A_CVH22	1518	tr|Q1RLN5|Q1RLN5_HUMAN ARHGAP12 protein OS=Homo sapiens OX=9606 GN=ARHGAP12 PE=1 SV=1	425	VTKIAENGKKVR
TIQVLTFNETKG	sp|P15423|SPIKE_CVH22	326	sp|O15457|MSH4_HUMAN MutS protein homolog 4 OS=Homo sapiens OX=9606 GN=MSH4 PE=1 SV=2	239	TIQRKYFNETKG
VVCNKLNVVIVT	sp|P0C6U2|R1A_CVH22	1	sp|Q8NGN0|OR4D5_HUMAN Olfactory receptor 4D5 OS=Homo sapiens OX=9606 GN=OR4D5 PE=2 SV=1	39	VVGNLLIVVIVT
AQINRLDTPKLD	sp|P0C6X1|R1AB_CVH22	1436	sp|Q8NDT2|RB15B_HUMAN Putative RNA-binding protein 15B OS=Homo sapiens OX=9606 GN=RBM15B PE=1 SV=3	766	AQRLRLDQPKLD
VAILVVSLCISW	sp|P0C6U2|R1A_CVH22	3311	tr|A0A2R8YEM9|A0A2R8YEM9_HUMAN TPR and ankyrin repeat-containing protein 1 OS=Homo sapiens OX=9606 GN=TRANK1 PE=1 SV=1	2725	RACLVVSLCISW
VAILVVSLCISW	sp|P0C6U2|R1A_CVH22	3311	sp|O15050|TRNK1_HUMAN TPR and ankyrin repeat-containing protein 1 OS=Homo sapiens OX=9606 GN=TRANK1 PE=2 SV=4	2681	RACLVVSLCISW
EAVLADSDALDF	sp|P0C6X1|R1AB_CVH22	6549	sp|Q32MZ4|LRRF1_HUMAN Leucine-rich repeat flightless-interacting protein 1 OS=Homo sapiens OX=9606 GN=LRRFIP1 PE=1 SV=2	668	EEVLADGDTLDF
FSVFNIVLVCLK	sp|P0C6U2|R1A_CVH22	2003	tr|E9PPZ0|E9PPZ0_HUMAN IKs producing slow voltage-gated potassium channel subunit alpha KvLQT1 (Fragment) OS=Homo sapiens OX=9606 GN=KCNQ1 PE=1 SV=1	40	FAVFLIVLVCLI
FSVFNIVLVCLK	sp|P0C6U2|R1A_CVH22	2003	sp|P51787|KCNQ1_HUMAN Potassium voltage-gated channel subfamily KQT member 1 OS=Homo sapiens OX=9606 GN=KCNQ1 PE=1 SV=3	127	FAVFLIVLVCLI
FSVFNIVLVCLK	sp|P0C6U2|R1A_CVH22	2003	tr|A0A2R8YEQ9|A0A2R8YEQ9_HUMAN Potassium voltage-gated channel subfamily KQT member 1 (Fragment) OS=Homo sapiens OX=9606 GN=KCNQ1 PE=1 SV=1	9	FAVFLIVLVCLI
VLYWNYLLNIFT	sp|P0C6X1|R1AB_CVH22	1934	sp|Q96F81|DISP1_HUMAN Protein dispatched homolog 1 OS=Homo sapiens OX=9606 GN=DISP1 PE=1 SV=3	657	VLHERYLLNIFT
LQTRVCAVGPDI	sp|P0C6X1|R1AB_CVH22	5421	tr|E9PQ73|E9PQ73_HUMAN Protocadherin Fat 3 OS=Homo sapiens OX=9606 GN=FAT3 PE=1 SV=1	2999	LLTRVQAVDPDI
LQTRVCAVGPDI	sp|P0C6X1|R1AB_CVH22	5421	sp|Q8TDW7|FAT3_HUMAN Protocadherin Fat 3 OS=Homo sapiens OX=9606 GN=FAT3 PE=2 SV=3	3149	LLTRVQAVDPDI
GDLSLGACSLAL	sp|P0C6U2|R1A_CVH22	2780	sp|O95622|ADCY5_HUMAN Adenylate cyclase type 5 OS=Homo sapiens OX=9606 GN=ADCY5 PE=1 SV=3	201	AVLSLGACCLAL
PTHSSSKTQSKG	sp|P15130|NCAP_CVH22	148	tr|V9GYQ5|V9GYQ5_HUMAN WD repeat-containing protein 5 (Fragment) OS=Homo sapiens OX=9606 GN=WDR5 PE=1 SV=1	17	PTPSSSATQSKP
PTHSSSKTQSKG	sp|P15130|NCAP_CVH22	148	tr|V9GZ59|V9GZ59_HUMAN WD repeat-containing protein 5 (Fragment) OS=Homo sapiens OX=9606 GN=WDR5 PE=1 SV=8	17	PTPSSSATQSKP
PTHSSSKTQSKG	sp|P15130|NCAP_CVH22	148	sp|P61964|WDR5_HUMAN WD repeat-containing protein 5 OS=Homo sapiens OX=9606 GN=WDR5 PE=1 SV=1	17	PTPSSSATQSKP
YAVMFLSWLPFY	sp|P0C6U2|R1A_CVH22	2833	tr|E9PQC2|E9PQC2_HUMAN Fatty acid desaturase 3 (Fragment) OS=Homo sapiens OX=9606 GN=FADS3 PE=1 SV=1	180	YARFFLSYLPFY
YAVMFLSWLPFY	sp|P0C6U2|R1A_CVH22	2833	tr|E9PS00|E9PS00_HUMAN Fatty acid desaturase 3 OS=Homo sapiens OX=9606 GN=FADS3 PE=1 SV=1	276	YARFFLSYLPFY
YAVMFLSWLPFY	sp|P0C6U2|R1A_CVH22	2833	sp|Q9Y5Q0|FADS3_HUMAN Fatty acid desaturase 3 OS=Homo sapiens OX=9606 GN=FADS3 PE=1 SV=1	304	YARFFLSYLPFY
YAVMFLSWLPFY	sp|P0C6U2|R1A_CVH22	2833	tr|E9PKP8|E9PKP8_HUMAN Fatty acid desaturase 3 OS=Homo sapiens OX=9606 GN=FADS3 PE=1 SV=1	180	YARFFLSYLPFY
YAVMFLSWLPFY	sp|P0C6U2|R1A_CVH22	2833	tr|H0YED5|H0YED5_HUMAN Fatty acid desaturase 3 (Fragment) OS=Homo sapiens OX=9606 GN=FADS3 PE=1 SV=1	79	YARFFLSYLPFY
FGVLSGTAVLTV	sp|P0C6X1|R1AB_CVH22	6264	tr|F8WC99|F8WC99_HUMAN OX-2 membrane glycoprotein OS=Homo sapiens OX=9606 GN=CD200 PE=1 SV=1	128	FGKISGTACLTV
FGVLSGTAVLTV	sp|P0C6X1|R1AB_CVH22	6264	tr|F8WEX3|F8WEX3_HUMAN OX-2 membrane glycoprotein OS=Homo sapiens OX=9606 GN=CD200 PE=1 SV=1	54	FGKISGTACLTV
FGVLSGTAVLTV	sp|P0C6X1|R1AB_CVH22	6264	tr|U3KQG5|U3KQG5_HUMAN OX-2 membrane glycoprotein (Fragment) OS=Homo sapiens OX=9606 GN=CD200 PE=1 SV=1	99	FGKISGTACLTV
FGVLSGTAVLTV	sp|P0C6X1|R1AB_CVH22	6264	tr|F8W7G1|F8W7G1_HUMAN OX-2 membrane glycoprotein OS=Homo sapiens OX=9606 GN=CD200 PE=1 SV=1	54	FGKISGTACLTV
FGVLSGTAVLTV	sp|P0C6X1|R1AB_CVH22	6264	sp|P41217|OX2G_HUMAN OX-2 membrane glycoprotein OS=Homo sapiens OX=9606 GN=CD200 PE=1 SV=4	128	FGKISGTACLTV
HSAGGAQMLVSI	sp|P0C6X1|R1AB_CVH22	4618	tr|H0Y6Z7|H0Y6Z7_HUMAN Protein-tyrosine-phosphatase (Fragment) OS=Homo sapiens OX=9606 GN=PTPRF PE=1 SV=1	728	SSAGGLQHLVSI
HSAGGAQMLVSI	sp|P0C6X1|R1AB_CVH22	4618	sp|P10586|PTPRF_HUMAN Receptor-type tyrosine-protein phosphatase F OS=Homo sapiens OX=9606 GN=PTPRF PE=1 SV=2	1082	SSAGGLQHLVSI
HSAGGAQMLVSI	sp|P0C6X1|R1AB_CVH22	4618	tr|H0Y4H1|H0Y4H1_HUMAN Protein-tyrosine-phosphatase (Fragment) OS=Homo sapiens OX=9606 GN=PTPRF PE=1 SV=1	455	SSAGGLQHLVSI
HSAGGAQMLVSI	sp|P0C6X1|R1AB_CVH22	4618	tr|H0Y380|H0Y380_HUMAN Protein-tyrosine-phosphatase (Fragment) OS=Homo sapiens OX=9606 GN=PTPRF PE=1 SV=1	143	SSAGGLQHLVSI
HSAGGAQMLVSI	sp|P0C6X1|R1AB_CVH22	4618	tr|H0Y7Z9|H0Y7Z9_HUMAN Protein-tyrosine-phosphatase (Fragment) OS=Homo sapiens OX=9606 GN=PTPRF PE=1 SV=1	496	SSAGGLQHLVSI
NNSGQSASKLNS	sp|P15423|SPIKE_CVH22	838	tr|A0A088AWL3|A0A088AWL3_HUMAN Nuclear receptor corepressor 1 OS=Homo sapiens OX=9606 GN=NCOR1 PE=1 SV=1	1299	NNSGQSAIKHNV
NNSGQSASKLNS	sp|P15423|SPIKE_CVH22	838	sp|O75376|NCOR1_HUMAN Nuclear receptor corepressor 1 OS=Homo sapiens OX=9606 GN=NCOR1 PE=1 SV=2	1392	NNSGQSAIKHNV
NNSGQSASKLNS	sp|P15423|SPIKE_CVH22	838	tr|E7EVK1|E7EVK1_HUMAN Nuclear receptor corepressor 1 (Fragment) OS=Homo sapiens OX=9606 GN=NCOR1 PE=1 SV=2	23	NNSGQSAIKHNV
LTVITQVGLYAG	sp|P0C6U2|R1A_CVH22	2102	sp|Q86SQ3|AGRE4_HUMAN Putative adhesion G protein-coupled receptor E4P OS=Homo sapiens OX=9606 GN=ADGRE4P PE=5 SV=1	190	LTVITQVGLTIS
SSHPVLTPNLAE	sp|P15130|NCAP_CVH22	349	sp|Q9H190|SDCB2_HUMAN Syntenin-2 OS=Homo sapiens OX=9606 GN=SDCBP2 PE=1 SV=2	38	SPPPVLYPNLAE
SLVIVAGGSATL	sp|P0C6U2|R1A_CVH22	439	sp|Q9BQT8|ODC_HUMAN Mitochondrial 2-oxodicarboxylate carrier OS=Homo sapiens OX=9606 GN=SLC25A21 PE=1 SV=1	14	SRQIVAGGSAGL
RKVFTLISASNY	sp|P15423|SPIKE_CVH22	656	sp|A2A2Z9|AN18B_HUMAN Ankyrin repeat domain-containing protein 18B OS=Homo sapiens OX=9606 GN=ANKRD18B PE=1 SV=1	686	RKVFELISLLNY
RKVFTLISASNY	sp|P15423|SPIKE_CVH22	656	tr|A2A300|A2A300_HUMAN Ankyrin repeat domain-containing protein 18B (Fragment) OS=Homo sapiens OX=9606 GN=ANKRD18B PE=1 SV=1	67	RKVFELISLLNY
RKVFTLISASNY	sp|P15423|SPIKE_CVH22	656	sp|O14830|PPE2_HUMAN Serine/threonine-protein phosphatase with EF-hands 2 OS=Homo sapiens OX=9606 GN=PPEF2 PE=1 SV=2	501	RKVLTIFSASNY
RKVFTLISASNY	sp|P15423|SPIKE_CVH22	656	tr|A0A494C0J1|A0A494C0J1_HUMAN Serine/threonine-protein phosphatase with EF-hands 2 (Fragment) OS=Homo sapiens OX=9606 GN=PPEF2 PE=4 SV=1	22	RKVLTIFSASNY
ALGKAVAQLVLR	sp|P0C6X1|R1AB_CVH22	4239	sp|P82987|ATL3_HUMAN ADAMTS-like protein 3 OS=Homo sapiens OX=9606 GN=ADAMTSL3 PE=1 SV=4	1372	ALGKAVATSVLH
MSPWLVLALVML	sp|P0C6X1|R1AB_CVH22	2076	sp|P30953|OR1E1_HUMAN Olfactory receptor 1E1 OS=Homo sapiens OX=9606 GN=OR1E1 PE=3 SV=1	136	MSPMLCLALVAL
ITIDPVKEEVSA	sp|P15130|NCAP_CVH22	369	sp|P56962|STX17_HUMAN Syntaxin-17 OS=Homo sapiens OX=9606 GN=STX17 PE=1 SV=2	89	RMIDPVKEEASA
ITIDPVKEEVSA	sp|P15130|NCAP_CVH22	369	tr|E9PIC2|E9PIC2_HUMAN Syntaxin-17 OS=Homo sapiens OX=9606 GN=STX17 PE=1 SV=1	89	RMIDPVKEEASA
DLTVTGCQTVLS	sp|P0C6U2|R1A_CVH22	15	tr|F8VWT9|F8VWT9_HUMAN Probable E3 ubiquitin-protein ligase HECTD4 OS=Homo sapiens OX=9606 GN=HECTD4 PE=1 SV=2	1770	DYVVPGCQTVLS
DLTVTGCQTVLS	sp|P0C6U2|R1A_CVH22	15	tr|J3KPF0|J3KPF0_HUMAN Probable E3 ubiquitin-protein ligase HECTD4 OS=Homo sapiens OX=9606 GN=HECTD4 PE=1 SV=3	1902	DYVVPGCQTVLS
DLTVTGCQTVLS	sp|P0C6U2|R1A_CVH22	15	sp|Q9Y4D8|HECD4_HUMAN Probable E3 ubiquitin-protein ligase HECTD4 OS=Homo sapiens OX=9606 GN=HECTD4 PE=1 SV=5	1482	DYVVPGCQTVLS
VPLDYILPLIMS	sp|P0C6U2|R1A_CVH22	1572	sp|O00400|ACATN_HUMAN Acetyl-coenzyme A transporter 1 OS=Homo sapiens OX=9606 GN=SLC33A1 PE=1 SV=1	353	VPLQIILPLIIS
VPLDYILPLIMS	sp|P0C6U2|R1A_CVH22	1572	tr|H7C562|H7C562_HUMAN Acetyl-coenzyme A transporter 1 (Fragment) OS=Homo sapiens OX=9606 GN=SLC33A1 PE=1 SV=1	73	VPLQIILPLIIS
LNCVFNAQGVHW	sp|P15423|SPIKE_CVH22	79	sp|O15294|OGT1_HUMAN UDP-N-acetylglucosamine--peptide N-acetylglucosaminyltransferase 110 kDa subunit OS=Homo sapiens OX=9606 GN=OGT PE=1 SV=3	197	LGCVFNAQGEIW
SFLKVDPFPKKI	sp|P19741|VEMP_CVH22	63	tr|B7WPD9|B7WPD9_HUMAN Kinesin-like protein KIF26B OS=Homo sapiens OX=9606 GN=KIF26B PE=1 SV=1	89	SFLKVDPRKKQI
SFLKVDPFPKKI	sp|P19741|VEMP_CVH22	63	tr|A0A0G2JR66|A0A0G2JR66_HUMAN Kinesin-like protein KIF26B (Fragment) OS=Homo sapiens OX=9606 GN=KIF26B PE=1 SV=1	316	SFLKVDPRKKQI
SFLKVDPFPKKI	sp|P19741|VEMP_CVH22	63	sp|Q2KJY2|KI26B_HUMAN Kinesin-like protein KIF26B OS=Homo sapiens OX=9606 GN=KIF26B PE=2 SV=1	470	SFLKVDPRKKQI
LVAILVVSLCIS	sp|P0C6U2|R1A_CVH22	3310	tr|A0A2R8YEM9|A0A2R8YEM9_HUMAN TPR and ankyrin repeat-containing protein 1 OS=Homo sapiens OX=9606 GN=TRANK1 PE=1 SV=1	2724	RRACLVVSLCIS
LVAILVVSLCIS	sp|P0C6U2|R1A_CVH22	3310	sp|O15050|TRNK1_HUMAN TPR and ankyrin repeat-containing protein 1 OS=Homo sapiens OX=9606 GN=TRANK1 PE=2 SV=4	2680	RRACLVVSLCIS
GKELNLSLQALE	sp|P0C6X1|R1AB_CVH22	2345	sp|Q13155|AIMP2_HUMAN Aminoacyl tRNA synthase complex-interacting multifunctional protein 2 OS=Homo sapiens OX=9606 GN=AIMP2 PE=1 SV=2	45	QEESNLSLQALE
MLCTVPLDYILP	sp|P0C6U2|R1A_CVH22	1568	sp|Q9Y5W8|SNX13_HUMAN Sorting nexin-13 OS=Homo sapiens OX=9606 GN=SNX13 PE=1 SV=4	368	KLCTVPLDSILV
MLCTVPLDYILP	sp|P0C6U2|R1A_CVH22	1568	tr|A0A087WUZ7|A0A087WUZ7_HUMAN Sorting nexin 13, isoform CRA_g OS=Homo sapiens OX=9606 GN=SNX13 PE=1 SV=1	368	KLCTVPLDSILV
TSGTSLLPAAFQ	sp|P0C6U2|R1A_CVH22	882	sp|A0A1B0GV85|RELD1_HUMAN Reelin domain-containing protein 1 OS=Homo sapiens OX=9606 GN=REELD1 PE=2 SV=2	372	TSGTSGLPAAGD
TSGTSLLPAAFQ	sp|P0C6U2|R1A_CVH22	882	sp|O00308|WWP2_HUMAN NEDD4-like E3 ubiquitin-protein ligase WWP2 OS=Homo sapiens OX=9606 GN=WWP2 PE=1 SV=2	286	TSGTQQLPAAAQ
TNNASLEWVTVN	sp|P15423|SPIKE_CVH22	589	tr|F5H0L2|F5H0L2_HUMAN Protein crumbs homolog 1 OS=Homo sapiens OX=9606 GN=CRB1 PE=1 SV=1	800	TNNASLNPVLVN
TNNASLEWVTVN	sp|P15423|SPIKE_CVH22	589	tr|A0A075B6G4|A0A075B6G4_HUMAN Protein crumbs homolog 1 OS=Homo sapiens OX=9606 GN=CRB1 PE=1 SV=1	250	TNNASLNPVLVN
TNNASLEWVTVN	sp|P15423|SPIKE_CVH22	589	sp|P82279|CRUM1_HUMAN Protein crumbs homolog 1 OS=Homo sapiens OX=9606 GN=CRB1 PE=1 SV=2	869	TNNASLNPVLVN
SKRGKKADVSPK	sp|P15130|NCAP_CVH22	66	tr|A0A1B0GWJ6|A0A1B0GWJ6_HUMAN Unconventional myosin-XVIIIa (Fragment) OS=Homo sapiens OX=9606 GN=MYO18A PE=1 SV=1	131	SKRGEKAASSPK
SAGLKHLVTPTG	sp|P0C6U2|R1A_CVH22	2965	sp|Q9NW07|ZN358_HUMAN Zinc finger protein 358 OS=Homo sapiens OX=9606 GN=ZNF358 PE=1 SV=2	276	SALLKHLRTHTG
AGTSDEARNSKI	sp|P0C6U2|R1A_CVH22	526	sp|Q2QGD7|ZXDC_HUMAN Zinc finger protein ZXDC OS=Homo sapiens OX=9606 GN=ZXDC PE=1 SV=2	526	AGGSDEALNSGI
AGTSDEARNSKI	sp|P0C6U2|R1A_CVH22	526	tr|H0YAA9|H0YAA9_HUMAN Zinc finger protein ZXDC (Fragment) OS=Homo sapiens OX=9606 GN=ZXDC PE=1 SV=1	234	AGGSDEALNSGI
YVLPASNVKPKP	sp|P0C6U2|R1A_CVH22	1899	sp|Q13202|DUS8_HUMAN Dual specificity protein phosphatase 8 OS=Homo sapiens OX=9606 GN=DUSP8 PE=1 SV=2	189	YVLNASNSCPKP
YVLPASNVKPKP	sp|P0C6U2|R1A_CVH22	1899	sp|Q9BY84|DUS16_HUMAN Dual specificity protein phosphatase 16 OS=Homo sapiens OX=9606 GN=DUSP16 PE=1 SV=1	187	YVLNASNTCPKP
VPSTQLLWSKLG	sp|P15422|VME1_CVH22	172	tr|K7ERT3|K7ERT3_HUMAN Activity-dependent neuroprotector homeobox protein 2 (Fragment) OS=Homo sapiens OX=9606 GN=ADNP2 PE=1 SV=1	64	VPSHQLLWSKSC
NGSVLVTCVAGI	sp|P0C6X1|R1AB_CVH22	2752	sp|Q9BY84|DUS16_HUMAN Dual specificity protein phosphatase 16 OS=Homo sapiens OX=9606 GN=DUSP16 PE=1 SV=1	237	NGCVLVHCLAGI
NSDIVSLLSEAA	sp|P0C6X1|R1AB_CVH22	4719	sp|Q9BT40|INP5K_HUMAN Inositol polyphosphate 5-phosphatase K OS=Homo sapiens OX=9606 GN=INPP5K PE=1 SV=3	56	NSGIISLLSDAA
NSDIVSLLSEAA	sp|P0C6X1|R1AB_CVH22	4719	tr|I3L2L1|I3L2L1_HUMAN Inositol polyphosphate 5-phosphatase K (Fragment) OS=Homo sapiens OX=9606 GN=INPP5K PE=1 SV=1	56	NSGIISLLSDAA
SVFNIVLVCLKF	sp|P0C6U2|R1A_CVH22	2004	tr|E9PPZ0|E9PPZ0_HUMAN IKs producing slow voltage-gated potassium channel subunit alpha KvLQT1 (Fragment) OS=Homo sapiens OX=9606 GN=KCNQ1 PE=1 SV=1	41	AVFLIVLVCLIF
SVFNIVLVCLKF	sp|P0C6U2|R1A_CVH22	2004	sp|P51787|KCNQ1_HUMAN Potassium voltage-gated channel subfamily KQT member 1 OS=Homo sapiens OX=9606 GN=KCNQ1 PE=1 SV=3	128	AVFLIVLVCLIF
SVFNIVLVCLKF	sp|P0C6U2|R1A_CVH22	2004	tr|A0A2R8YEQ9|A0A2R8YEQ9_HUMAN Potassium voltage-gated channel subfamily KQT member 1 (Fragment) OS=Homo sapiens OX=9606 GN=KCNQ1 PE=1 SV=1	10	AVFLIVLVCLIF
SVNPFIILAAAA	sp|P0C6U2|R1A_CVH22	2075	tr|H0YD97|H0YD97_HUMAN Pyruvate dehydrogenase protein X component, mitochondrial (Fragment) OS=Homo sapiens OX=9606 GN=PDHX PE=1 SV=1	15	SVNDFIIKAAAV
SVNPFIILAAAA	sp|P0C6U2|R1A_CVH22	2075	sp|O00330|ODPX_HUMAN Pyruvate dehydrogenase protein X component, mitochondrial OS=Homo sapiens OX=9606 GN=PDHX PE=1 SV=3	327	SVNDFIIKAAAV
RSKRGKKADVSP	sp|P15130|NCAP_CVH22	65	tr|A0A1B0GWJ6|A0A1B0GWJ6_HUMAN Unconventional myosin-XVIIIa (Fragment) OS=Homo sapiens OX=9606 GN=MYO18A PE=1 SV=1	130	RSKRGEKAASSP
LQTLVTSFLGIP	sp|P0C6U2|R1A_CVH22	3628	tr|F5H163|F5H163_HUMAN Mevalonate kinase OS=Homo sapiens OX=9606 GN=MVK PE=1 SV=1	67	LQSLDTSFLGGP
QVVSKIKCENLS	sp|P15423|SPIKE_CVH22	257	tr|C9JRH1|C9JRH1_HUMAN Dehydrogenase/reductase SDR family member on chromosome X (Fragment) OS=Homo sapiens OX=9606 GN=DHRSX PE=1 SV=8	15	QVVSKIKEETLN
QVVSKIKCENLS	sp|P15423|SPIKE_CVH22	257	sp|Q8N5I4|DHRSX_HUMAN Dehydrogenase/reductase SDR family member on chromosome X OS=Homo sapiens OX=9606 GN=DHRSX PE=1 SV=2	82	QVVSKIKEETLN
YCDHPLMGLLTS	sp|P19740|NS4B_CVH22	70	tr|A0A2R8YF61|A0A2R8YF61_HUMAN Cyclin-dependent kinase 13 (Fragment) OS=Homo sapiens OX=9606 GN=CDK13 PE=1 SV=1	231	YMDHDLMGLLES
YCDHPLMGLLTS	sp|P19740|NS4B_CVH22	70	tr|A0A2R8Y644|A0A2R8Y644_HUMAN Cyclin-dependent kinase 13 (Fragment) OS=Homo sapiens OX=9606 GN=CDK13 PE=1 SV=1	103	YMDHDLMGLLES
YCDHPLMGLLTS	sp|P19740|NS4B_CVH22	70	tr|A0A2R8YD28|A0A2R8YD28_HUMAN Cyclin-dependent kinase 13 (Fragment) OS=Homo sapiens OX=9606 GN=CDK13 PE=1 SV=1	311	YMDHDLMGLLES
YCDHPLMGLLTS	sp|P19740|NS4B_CVH22	70	tr|Q9BVE2|Q9BVE2_HUMAN CDC2L5 protein OS=Homo sapiens OX=9606 GN=CDK13 PE=1 SV=1	179	YMDHDLMGLLES
YCDHPLMGLLTS	sp|P19740|NS4B_CVH22	70	tr|A0A087X209|A0A087X209_HUMAN Cyclin-dependent kinase 13 OS=Homo sapiens OX=9606 GN=CDK13 PE=1 SV=1	179	YMDHDLMGLLES
