query	query_seqname	query_start	target_seqname	target_start	target
DEDVTLITELKL	sp|Q87040|POL_SFVCP	1040	tr|A0A2R8Y4K8|A0A2R8Y4K8_HUMAN SAM domain-containing protein SAMSN-1 OS=Homo sapiens OX=9606 GN=SAMSN1 PE=1 SV=1	199	DEDDTLISCLKL
YILTHVRNHVQK	sp|Q87041|ENV_SFVCP	634	tr|A0A087WVP2|A0A087WVP2_HUMAN FERM domain containing 5, isoform CRA_e OS=Homo sapiens OX=9606 GN=FRMD5 PE=1 SV=1	3	WILTHVRNEVTK
TDEIKPSKKDKV	sp|Q87041|ENV_SFVCP	43	sp|Q9ULW0|TPX2_HUMAN Targeting protein for Xklp2 OS=Homo sapiens OX=9606 GN=TPX2 PE=1 SV=2	151	IDEILPSKKMKV
RRELPSLPIMSA	sp|Q87039|GAG_SFVCP	275	sp|Q9UBZ4|APEX2_HUMAN DNA-(apurinic or apyrimidinic site) endonuclease 2 OS=Homo sapiens OX=9606 GN=APEX2 PE=1 SV=1	409	DIELPSLPLMSA
LIRGAADQDGIL	sp|Q87039|GAG_SFVCP	399	tr|Q5VWV2|Q5VWV2_HUMAN Partitioning defective 3 homolog OS=Homo sapiens OX=9606 GN=PARD3 PE=1 SV=1	450	LPRGAAIQDGRL
LIRGAADQDGIL	sp|Q87039|GAG_SFVCP	399	tr|F5GZI3|F5GZI3_HUMAN Partitioning defective 3 homolog OS=Homo sapiens OX=9606 GN=PARD3 PE=1 SV=1	224	LPRGAAIQDGRL
LIRGAADQDGIL	sp|Q87039|GAG_SFVCP	399	sp|Q8TEW0|PARD3_HUMAN Partitioning defective 3 homolog OS=Homo sapiens OX=9606 GN=PARD3 PE=1 SV=2	494	LPRGAAIQDGRL
LIRGAADQDGIL	sp|Q87039|GAG_SFVCP	399	tr|Q5VWU8|Q5VWU8_HUMAN Partitioning defective 3 homolog OS=Homo sapiens OX=9606 GN=PARD3 PE=1 SV=1	494	LPRGAAIQDGRL
ELPSLPIMSAPL	sp|Q87039|GAG_SFVCP	277	sp|Q9UBZ4|APEX2_HUMAN DNA-(apurinic or apyrimidinic site) endonuclease 2 OS=Homo sapiens OX=9606 GN=APEX2 PE=1 SV=1	411	ELPSLPLMSALM
AQSVNELVVEYE	sp|Q87041|ENV_SFVCP	200	tr|A0A0A0MRM2|A0A0A0MRM2_HUMAN Nebulin-related-anchoring protein OS=Homo sapiens OX=9606 GN=NRAP PE=1 SV=1	361	AQSVNKLVSEVE
AQSVNELVVEYE	sp|Q87041|ENV_SFVCP	200	sp|Q86VF7|NRAP_HUMAN Nebulin-related-anchoring protein OS=Homo sapiens OX=9606 GN=NRAP PE=1 SV=2	361	AQSVNKLVSEVE
RLRSLTGDPPRS	sp|Q87039|GAG_SFVCP	314	sp|Q2KHT3|CL16A_HUMAN Protein CLEC16A OS=Homo sapiens OX=9606 GN=CLEC16A PE=1 SV=2	1017	SLRSLTGMPPLS
VSSSTEETNNNQ	sp|Q87039|GAG_SFVCP	632	sp|Q9Y3Y4|PYGO1_HUMAN Pygopus homolog 1 OS=Homo sapiens OX=9606 GN=PYGO1 PE=1 SV=2	288	RSSSTEATNNNP
SSSTEETNNNQQ	sp|Q87039|GAG_SFVCP	633	sp|Q9Y3Y4|PYGO1_HUMAN Pygopus homolog 1 OS=Homo sapiens OX=9606 GN=PYGO1 PE=1 SV=2	289	SSSTEATNNNPA
EFHLLNSWQVPL	sp|Q87040|POL_SFVCP	626	sp|Q9NZ20|PA2G3_HUMAN Group 3 secretory phospholipase A2 OS=Homo sapiens OX=9606 GN=PLA2G3 PE=1 SV=2	381	EFQLLNSAQEPL
RVDSELEENSRL	sp|Q87039|GAG_SFVCP	447	tr|A0A2R8Y2X6|A0A2R8Y2X6_HUMAN BICD family-like cargo adapter 2 OS=Homo sapiens OX=9606 GN=BICDL2 PE=1 SV=1	307	RRVSELEEESRL
RVDSELEENSRL	sp|Q87039|GAG_SFVCP	447	sp|A1A5D9|BICL2_HUMAN BICD family-like cargo adapter 2 OS=Homo sapiens OX=9606 GN=BICDL2 PE=1 SV=2	274	RRVSELEEESRL
SLEQQLDNQEKF	sp|Q87041|ENV_SFVCP	328	sp|Q69YQ0|CYTSA_HUMAN Cytospin-A OS=Homo sapiens OX=9606 GN=SPECC1L PE=1 SV=2	277	SLEQRLDNSEKL
SLEQQLDNQEKF	sp|Q87041|ENV_SFVCP	328	tr|C9J8U1|C9J8U1_HUMAN Cytospin-A (Fragment) OS=Homo sapiens OX=9606 GN=SPECC1L PE=3 SV=8	277	SLEQRLDNSEKL
SLEQQLDNQEKF	sp|Q87041|ENV_SFVCP	328	tr|F8WAN1|F8WAN1_HUMAN Cytospin-A OS=Homo sapiens OX=9606 GN=SPECC1L-ADORA2A PE=3 SV=2	277	SLEQRLDNSEKL
SLEQQLDNQEKF	sp|Q87041|ENV_SFVCP	328	tr|A0A494C1J1|A0A494C1J1_HUMAN Cytospin-A OS=Homo sapiens OX=9606 GN=SPECC1L PE=1 SV=1	296	SLEQRLDNSEKL
FIRPVLLGVGAA	sp|Q87041|ENV_SFVCP	957	tr|A0A087WX24|A0A087WX24_HUMAN Sterile alpha motif domain-containing protein 11 OS=Homo sapiens OX=9606 GN=SAMD11 PE=1 SV=1	150	SCRPVLLGEGAA
IEEKLPESRILA	sp|Q87040|POL_SFVCP	449	tr|A0A6Q8PFI7|A0A6Q8PFI7_HUMAN E3 ubiquitin-protein ligase OS=Homo sapiens OX=9606 GN=NEDD4L PE=1 SV=1	5	ILEKLGESRILR
IRPVLLGVGAAL	sp|Q87041|ENV_SFVCP	958	tr|A0A087WX24|A0A087WX24_HUMAN Sterile alpha motif domain-containing protein 11 OS=Homo sapiens OX=9606 GN=SAMD11 PE=1 SV=1	151	CRPVLLGEGAAS
LPESRILARVTT	sp|Q87040|POL_SFVCP	453	sp|Q4AC94|C2CD3_HUMAN C2 domain-containing protein 3 OS=Homo sapiens OX=9606 GN=C2CD3 PE=1 SV=4	1131	LPLSRICAMVTT
AVEDPEENPHKP	sp|Q87043|BET_SFVCP	38	sp|Q15291|RBBP5_HUMAN Retinoblastoma-binding protein 5 OS=Homo sapiens OX=9606 GN=RBBP5 PE=1 SV=2	407	EVEDPEENPYGP
KYPQSPIPRRRT	sp|Q87043|BET_SFVCP	389	tr|A0A0A0MTP7|A0A0A0MTP7_HUMAN Protein SCAF11 OS=Homo sapiens OX=9606 GN=SCAF11 PE=1 SV=1	752	KRPQSPSPRRET
KYPQSPIPRRRT	sp|Q87043|BET_SFVCP	389	sp|Q99590|SCAFB_HUMAN Protein SCAF11 OS=Homo sapiens OX=9606 GN=SCAF11 PE=1 SV=2	812	KRPQSPSPRRET
KYPQSPIPRRRT	sp|Q87043|BET_SFVCP	389	tr|F8VXG7|F8VXG7_HUMAN Protein SCAF11 OS=Homo sapiens OX=9606 GN=SCAF11 PE=1 SV=1	620	KRPQSPSPRRET
LPIPPPPPIGLA	sp|Q87039|GAG_SFVCP	298	sp|Q96N64|PWP2A_HUMAN PWWP domain-containing protein 2A OS=Homo sapiens OX=9606 GN=PWWP2A PE=1 SV=2	68	LPPPPPPPGELA
LPIPPPPPIGLA	sp|Q87039|GAG_SFVCP	298	sp|O14669|TMG2_HUMAN Transmembrane gamma-carboxyglutamic acid protein 2 OS=Homo sapiens OX=9606 GN=PRRG2 PE=1 SV=1	165	LPPPPPPPPGLP
PPPPPIGLAIPA	sp|Q87039|GAG_SFVCP	301	sp|Q05925|HME1_HUMAN Homeobox protein engrailed-1 OS=Homo sapiens OX=9606 GN=EN1 PE=3 SV=3	79	PPPPPQHLAAPA
VEDPEENPHKPK	sp|Q87043|BET_SFVCP	39	sp|Q15291|RBBP5_HUMAN Retinoblastoma-binding protein 5 OS=Homo sapiens OX=9606 GN=RBBP5 PE=1 SV=2	408	VEDPEENPYGPP
GRGSQLPDPNSG	sp|Q87039|GAG_SFVCP	496	tr|A0A087WW43|A0A087WW43_HUMAN Inter-alpha-trypsin inhibitor heavy chain H3 OS=Homo sapiens OX=9606 GN=ITIH3 PE=1 SV=1	649	GRGSPLHHPNSG
QSVNELVVEYEL	sp|Q87041|ENV_SFVCP	201	sp|Q8N3K9|CMYA5_HUMAN Cardiomyopathy-associated protein 5 OS=Homo sapiens OX=9606 GN=CMYA5 PE=1 SV=3	3750	QEVNELVEEYRL
RPVLLGVGAALL	sp|Q87041|ENV_SFVCP	959	tr|A0A087WX24|A0A087WX24_HUMAN Sterile alpha motif domain-containing protein 11 OS=Homo sapiens OX=9606 GN=SAMD11 PE=1 SV=1	152	RPVLLGEGAASA
QPRPTRGRGRGS	sp|Q87039|GAG_SFVCP	488	tr|B7Z645|B7Z645_HUMAN Heterogeneous nuclear ribonucleoprotein Q OS=Homo sapiens OX=9606 GN=SYNCRIP PE=1 SV=1	341	MPPPTRGRGRGG
QPRPTRGRGRGS	sp|Q87039|GAG_SFVCP	488	sp|O60506|HNRPQ_HUMAN Heterogeneous nuclear ribonucleoprotein Q OS=Homo sapiens OX=9606 GN=SYNCRIP PE=1 SV=2	439	MPPPTRGRGRGG
PRPTRGRGRGSQ	sp|Q87039|GAG_SFVCP	489	tr|B7Z645|B7Z645_HUMAN Heterogeneous nuclear ribonucleoprotein Q OS=Homo sapiens OX=9606 GN=SYNCRIP PE=1 SV=1	342	PPPTRGRGRGGR
PRPTRGRGRGSQ	sp|Q87039|GAG_SFVCP	489	sp|O60506|HNRPQ_HUMAN Heterogeneous nuclear ribonucleoprotein Q OS=Homo sapiens OX=9606 GN=SYNCRIP PE=1 SV=2	440	PPPTRGRGRGGR
LTHVRNHVQKLR	sp|Q87041|ENV_SFVCP	636	tr|A0A087WVP2|A0A087WVP2_HUMAN FERM domain containing 5, isoform CRA_e OS=Homo sapiens OX=9606 GN=FRMD5 PE=1 SV=1	5	LTHVRNEVTKLK
LNATPLHNGSYL	sp|Q87041|ENV_SFVCP	801	sp|A0A075B6U4|TVA7_HUMAN T cell receptor alpha variable 7 OS=Homo sapiens OX=9606 GN=TRAV7 PE=3 SV=1	83	LNATLLKNGSSL
DCPVFLELIKEP	sp|Q87041|ENV_SFVCP	788	tr|E7EQW4|E7EQW4_HUMAN Breast cancer type 1 susceptibility protein (Fragment) OS=Homo sapiens OX=9606 GN=BRCA1 PE=1 SV=1	23	ECPICLELIKEP
DCPVFLELIKEP	sp|Q87041|ENV_SFVCP	788	tr|E7EUM2|E7EUM2_HUMAN RING-type E3 ubiquitin transferase BRCA1 (Fragment) OS=Homo sapiens OX=9606 GN=BRCA1 PE=1 SV=1	23	ECPICLELIKEP
DCPVFLELIKEP	sp|Q87041|ENV_SFVCP	788	tr|A0A0U1RRA9|A0A0U1RRA9_HUMAN Breast cancer type 1 susceptibility protein (Fragment) OS=Homo sapiens OX=9606 GN=BRCA1 PE=1 SV=1	23	ECPICLELIKEP
DCPVFLELIKEP	sp|Q87041|ENV_SFVCP	788	tr|Q3B891|Q3B891_HUMAN BRCA1 protein (Fragment) OS=Homo sapiens OX=9606 GN=BRCA1 PE=1 SV=1	23	ECPICLELIKEP
DCPVFLELIKEP	sp|Q87041|ENV_SFVCP	788	tr|E7EWN5|E7EWN5_HUMAN Breast cancer type 1 susceptibility protein (Fragment) OS=Homo sapiens OX=9606 GN=BRCA1 PE=1 SV=1	23	ECPICLELIKEP
DCPVFLELIKEP	sp|Q87041|ENV_SFVCP	788	sp|P38398|BRCA1_HUMAN Breast cancer type 1 susceptibility protein OS=Homo sapiens OX=9606 GN=BRCA1 PE=1 SV=2	23	ECPICLELIKEP
DCPVFLELIKEP	sp|Q87041|ENV_SFVCP	788	tr|Q5YLB2|Q5YLB2_HUMAN Breast cancer type 1 susceptibility protein OS=Homo sapiens OX=9606 GN=BRCA1 PE=1 SV=1	23	ECPICLELIKEP
DCPVFLELIKEP	sp|Q87041|ENV_SFVCP	788	tr|A0A2R8Y6Y9|A0A2R8Y6Y9_HUMAN Breast cancer type 1 susceptibility protein OS=Homo sapiens OX=9606 GN=BRCA1 PE=1 SV=1	23	ECPICLELIKEP
DCPVFLELIKEP	sp|Q87041|ENV_SFVCP	788	tr|E7ENB7|E7ENB7_HUMAN Breast cancer type 1 susceptibility protein (Fragment) OS=Homo sapiens OX=9606 GN=BRCA1 PE=1 SV=1	23	ECPICLELIKEP
DCPVFLELIKEP	sp|Q87041|ENV_SFVCP	788	tr|E9PH68|E9PH68_HUMAN Breast cancer type 1 susceptibility protein (Fragment) OS=Homo sapiens OX=9606 GN=BRCA1 PE=1 SV=1	23	ECPICLELIKEP
DCPVFLELIKEP	sp|Q87041|ENV_SFVCP	788	tr|E9PC22|E9PC22_HUMAN Breast cancer type 1 susceptibility protein OS=Homo sapiens OX=9606 GN=BRCA1 PE=1 SV=1	23	ECPICLELIKEP
PQPRPTRGRGRG	sp|Q87039|GAG_SFVCP	487	tr|B7Z645|B7Z645_HUMAN Heterogeneous nuclear ribonucleoprotein Q OS=Homo sapiens OX=9606 GN=SYNCRIP PE=1 SV=1	340	HMPPPTRGRGRG
PQPRPTRGRGRG	sp|Q87039|GAG_SFVCP	487	sp|O60506|HNRPQ_HUMAN Heterogeneous nuclear ribonucleoprotein Q OS=Homo sapiens OX=9606 GN=SYNCRIP PE=1 SV=2	438	HMPPPTRGRGRG
NTTGASDLSTAS	sp|Q87043|BET_SFVCP	12	tr|F8WAE6|F8WAE6_HUMAN Mediator of RNA polymerase II transcription subunit 12-like protein OS=Homo sapiens OX=9606 GN=MED12L PE=1 SV=1	1437	NGTLASDLSNAS
NTTGASDLSTAS	sp|Q87043|BET_SFVCP	12	sp|Q86YW9|MD12L_HUMAN Mediator of RNA polymerase II transcription subunit 12-like protein OS=Homo sapiens OX=9606 GN=MED12L PE=1 SV=2	1577	NGTLASDLSNAS
ETYLNHVSVLYE	sp|Q87039|GAG_SFVCP	459	tr|K7ERJ7|K7ERJ7_HUMAN Zinc finger protein 793 (Fragment) OS=Homo sapiens OX=9606 GN=ZNF793 PE=4 SV=8	39	ETYSNLVSVGYE
ETYLNHVSVLYE	sp|Q87039|GAG_SFVCP	459	tr|K7EL37|K7EL37_HUMAN Zinc finger protein 793 (Fragment) OS=Homo sapiens OX=9606 GN=ZNF793 PE=4 SV=1	32	ETYSNLVSVGYE
ETYLNHVSVLYE	sp|Q87039|GAG_SFVCP	459	sp|Q6ZN11|ZN793_HUMAN Zinc finger protein 793 OS=Homo sapiens OX=9606 GN=ZNF793 PE=2 SV=2	39	ETYSNLVSVGYE
ETYLNHVSVLYE	sp|Q87039|GAG_SFVCP	459	tr|K7EN11|K7EN11_HUMAN Zinc finger protein 793 OS=Homo sapiens OX=9606 GN=ZNF793 PE=4 SV=1	39	ETYSNLVSVGYE
ETYLNHVSVLYE	sp|Q87039|GAG_SFVCP	459	tr|K7EQP3|K7EQP3_HUMAN Zinc finger protein 793 OS=Homo sapiens OX=9606 GN=ZNF793 PE=4 SV=1	39	ETYSNLVSVGYE
ETYLNHVSVLYE	sp|Q87039|GAG_SFVCP	459	tr|K7EMU0|K7EMU0_HUMAN Zinc finger protein 793 OS=Homo sapiens OX=9606 GN=ZNF793 PE=4 SV=1	39	ETYSNLVSVGYE
LIQWLPIPPPPP	sp|Q87039|GAG_SFVCP	294	sp|Q7L0R7|RNF44_HUMAN RING finger protein 44 OS=Homo sapiens OX=9606 GN=RNF44 PE=1 SV=1	284	LQQPLPPPPPPP
LIQWLPIPPPPP	sp|Q87039|GAG_SFVCP	294	tr|H0Y9W0|H0Y9W0_HUMAN RING finger protein 44 (Fragment) OS=Homo sapiens OX=9606 GN=RNF44 PE=1 SV=1	39	LQQPLPPPPPPP
SIEEKLPESRIL	sp|Q87040|POL_SFVCP	448	tr|A0A6Q8PFI7|A0A6Q8PFI7_HUMAN E3 ubiquitin-protein ligase OS=Homo sapiens OX=9606 GN=NEDD4L PE=1 SV=1	4	LILEKLGESRIL
QEEMRRKWERGF	sp|Q87043|BET_SFVCP	455	sp|Q8IXQ6|PARP9_HUMAN Protein mono-ADP-ribosyltransferase PARP9 OS=Homo sapiens OX=9606 GN=PARP9 PE=1 SV=2	608	QEEMARKKERGL
QEEMRRKWERGF	sp|Q87043|BET_SFVCP	455	tr|G5E9U8|G5E9U8_HUMAN Poly (ADP-ribose) polymerase family, member 9, isoform CRA_b OS=Homo sapiens OX=9606 GN=PARP9 PE=1 SV=1	153	QEEMARKKERGL
LDLVTQLFTLVA	sp|Q87040|POL_SFVCP	408	sp|Q6WRX3|ZY11A_HUMAN Protein zyg-11 homolog A OS=Homo sapiens OX=9606 GN=ZYG11A PE=2 SV=3	528	LDDVTFLFTLKA
AIAVEDPEENPH	sp|Q87043|BET_SFVCP	36	sp|Q15291|RBBP5_HUMAN Retinoblastoma-binding protein 5 OS=Homo sapiens OX=9606 GN=RBBP5 PE=1 SV=2	405	APEVEDPEENPY
WSLEQQLDNQEK	sp|Q87041|ENV_SFVCP	327	sp|Q69YQ0|CYTSA_HUMAN Cytospin-A OS=Homo sapiens OX=9606 GN=SPECC1L PE=1 SV=2	276	FSLEQRLDNSEK
WSLEQQLDNQEK	sp|Q87041|ENV_SFVCP	327	tr|C9J8U1|C9J8U1_HUMAN Cytospin-A (Fragment) OS=Homo sapiens OX=9606 GN=SPECC1L PE=3 SV=8	276	FSLEQRLDNSEK
WSLEQQLDNQEK	sp|Q87041|ENV_SFVCP	327	tr|F8WAN1|F8WAN1_HUMAN Cytospin-A OS=Homo sapiens OX=9606 GN=SPECC1L-ADORA2A PE=3 SV=2	276	FSLEQRLDNSEK
WSLEQQLDNQEK	sp|Q87041|ENV_SFVCP	327	tr|A0A494C1J1|A0A494C1J1_HUMAN Cytospin-A OS=Homo sapiens OX=9606 GN=SPECC1L PE=1 SV=1	295	FSLEQRLDNSEK
PESRILARVTTQ	sp|Q87040|POL_SFVCP	454	sp|Q4AC94|C2CD3_HUMAN C2 domain-containing protein 3 OS=Homo sapiens OX=9606 GN=C2CD3 PE=1 SV=4	1132	PLSRICAMVTTQ
EAIAVEDPEENP	sp|Q87043|BET_SFVCP	35	sp|Q15291|RBBP5_HUMAN Retinoblastoma-binding protein 5 OS=Homo sapiens OX=9606 GN=RBBP5 PE=1 SV=2	404	IAPEVEDPEENP
LLGVGAALLIAA	sp|Q87041|ENV_SFVCP	962	sp|O15230|LAMA5_HUMAN Laminin subunit alpha-5 OS=Homo sapiens OX=9606 GN=LAMA5 PE=1 SV=8	22	LLLVGLALLGAA
PPLIQWLPIPPP	sp|Q87039|GAG_SFVCP	292	sp|Q9UJ55|MAGL2_HUMAN MAGE-like protein 2 OS=Homo sapiens OX=9606 GN=MAGEL2 PE=1 SV=2	511	PPLWQALPPPPP
DEIKPSKKDKVH	sp|Q87041|ENV_SFVCP	44	sp|Q9ULW0|TPX2_HUMAN Targeting protein for Xklp2 OS=Homo sapiens OX=9606 GN=TPX2 PE=1 SV=2	152	DEILPSKKMKVS
AAGVRLNEGFWG	sp|Q87039|GAG_SFVCP	35	tr|K7EMM9|K7EMM9_HUMAN Contactin-associated protein 1 OS=Homo sapiens OX=9606 GN=CNTNAP1 PE=1 SV=1	434	AAGYRLNDGFWH
AAGVRLNEGFWG	sp|Q87039|GAG_SFVCP	35	sp|P78357|CNTP1_HUMAN Contactin-associated protein 1 OS=Homo sapiens OX=9606 GN=CNTNAP1 PE=1 SV=1	434	AAGYRLNDGFWH
ILTHVRNHVQKL	sp|Q87041|ENV_SFVCP	635	tr|A0A087WVP2|A0A087WVP2_HUMAN FERM domain containing 5, isoform CRA_e OS=Homo sapiens OX=9606 GN=FRMD5 PE=1 SV=1	4	ILTHVRNEVTKL
PSPPRLQTTPGT	sp|Q87039|GAG_SFVCP	217	sp|Q9H6K5|PRR36_HUMAN Proline-rich protein 36 OS=Homo sapiens OX=9606 GN=PRR36 PE=1 SV=2	503	PSPPSLQATPHT
DTTPTSPRPAQA	sp|Q87039|GAG_SFVCP	575	tr|A2A2F0|A2A2F0_HUMAN Ral GTPase-activating protein subunit beta (Fragment) OS=Homo sapiens OX=9606 GN=RALGAPB PE=1 SV=1	560	PTTPDSERPAQA
DTTPTSPRPAQA	sp|Q87039|GAG_SFVCP	575	sp|Q86X10|RLGPB_HUMAN Ral GTPase-activating protein subunit beta OS=Homo sapiens OX=9606 GN=RALGAPB PE=1 SV=1	732	PTTPDSERPAQA
DTTPTSPRPAQA	sp|Q87039|GAG_SFVCP	575	tr|A0A0J9YW54|A0A0J9YW54_HUMAN Ral GTPase-activating protein subunit beta (Fragment) OS=Homo sapiens OX=9606 GN=RALGAPB PE=1 SV=1	100	PTTPDSERPAQA
NLAQPVPADAKG	sp|Q87040|POL_SFVCP	5	sp|Q86SU0|ILDR1_HUMAN Immunoglobulin-like domain-containing receptor 1 OS=Homo sapiens OX=9606 GN=ILDR1 PE=1 SV=2	297	NLAQPLPPDLKG
QIPKKLYISNFS	sp|Q87041|ENV_SFVCP	711	tr|Q5T987|Q5T987_HUMAN Inter-alpha-trypsin inhibitor heavy chain H2 (Fragment) OS=Homo sapiens OX=9606 GN=ITIH2 PE=1 SV=1	84	QIPKGAFISNFS
QIPKKLYISNFS	sp|Q87041|ENV_SFVCP	711	tr|Q5T985|Q5T985_HUMAN Inter-alpha-trypsin inhibitor heavy chain H2 OS=Homo sapiens OX=9606 GN=ITIH2 PE=1 SV=1	98	QIPKGAFISNFS
QIPKKLYISNFS	sp|Q87041|ENV_SFVCP	711	sp|P19823|ITIH2_HUMAN Inter-alpha-trypsin inhibitor heavy chain H2 OS=Homo sapiens OX=9606 GN=ITIH2 PE=1 SV=2	109	QIPKGAFISNFS
ILMMDEPEENPR	sp|Q87042|BEL1_SFVCP	36	sp|Q15165|PON2_HUMAN Serum paraoxonase/arylesterase 2 OS=Homo sapiens OX=9606 GN=PON2 PE=1 SV=4	85	ILMMDLKEEKPR
ILMMDEPEENPR	sp|Q87042|BEL1_SFVCP	36	tr|A0A0J9YXF2|A0A0J9YXF2_HUMAN Paraoxonase 2, isoform CRA_a OS=Homo sapiens OX=9606 GN=PON2 PE=1 SV=1	106	ILMMDLKEEKPR
ILMMDEPEENPR	sp|Q87042|BEL1_SFVCP	36	tr|G3XAK4|G3XAK4_HUMAN Paraoxonase 2, isoform CRA_c OS=Homo sapiens OX=9606 GN=PON2 PE=1 SV=1	85	ILMMDLKEEKPR
TQSVPDVEVKVN	sp|Q87042|BEL1_SFVCP	263	sp|Q96DY7|MTBP_HUMAN Mdm2-binding protein OS=Homo sapiens OX=9606 GN=MTBP PE=1 SV=1	386	TISVPDVEVKGE
LRSLTGDPPRSP	sp|Q87039|GAG_SFVCP	315	sp|Q2KHT3|CL16A_HUMAN Protein CLEC16A OS=Homo sapiens OX=9606 GN=CLEC16A PE=1 SV=2	1018	LRSLTGMPPLST
TGVLQSINSIND	sp|Q87041|ENV_SFVCP	588	sp|Q96NR3|PTHD1_HUMAN Patched domain-containing protein 1 OS=Homo sapiens OX=9606 GN=PTCHD1 PE=2 SV=2	212	TYYLQSINSLND
GETQSVPDVEVK	sp|Q87042|BEL1_SFVCP	261	sp|Q96DY7|MTBP_HUMAN Mdm2-binding protein OS=Homo sapiens OX=9606 GN=MTBP PE=1 SV=1	384	PKTISVPDVEVK
ELRRIMQKILLG	sp|Q87040|POL_SFVCP	977	sp|A3KMH1|VWA8_HUMAN von Willebrand factor A domain-containing protein 8 OS=Homo sapiens OX=9606 GN=VWA8 PE=1 SV=2	92	HLRWIMQKDLLG
LFNLLGFIRPVL	sp|Q87041|ENV_SFVCP	951	tr|Q96B65|Q96B65_HUMAN USP25 protein OS=Homo sapiens OX=9606 GN=USP25 PE=1 SV=1	187	LFNLLEFRRLVL
LFNLLGFIRPVL	sp|Q87041|ENV_SFVCP	951	sp|Q9UHP3|UBP25_HUMAN Ubiquitin carboxyl-terminal hydrolase 25 OS=Homo sapiens OX=9606 GN=USP25 PE=1 SV=4	187	LFNLLEFRRLVL
WLPIPPPPPIGL	sp|Q87039|GAG_SFVCP	297	sp|O14669|TMG2_HUMAN Transmembrane gamma-carboxyglutamic acid protein 2 OS=Homo sapiens OX=9606 GN=PRRG2 PE=1 SV=1	164	PLPPPPPPPPGL
SQLPDPNSGPAQ	sp|Q87039|GAG_SFVCP	499	tr|A0A0A0MR72|A0A0A0MR72_HUMAN E1A-binding protein p400 (Fragment) OS=Homo sapiens OX=9606 GN=EP400 PE=1 SV=1	572	SQLPIPPSQPAQ
SQLPDPNSGPAQ	sp|Q87039|GAG_SFVCP	499	sp|Q96L91|EP400_HUMAN E1A-binding protein p400 OS=Homo sapiens OX=9606 GN=EP400 PE=1 SV=4	645	SQLPIPPSQPAQ
SQLPDPNSGPAQ	sp|Q87039|GAG_SFVCP	499	tr|A0A0A0MR80|A0A0A0MR80_HUMAN E1A-binding protein p400 OS=Homo sapiens OX=9606 GN=EP400 PE=1 SV=1	645	SQLPIPPSQPAQ
NVSSSTEETNNN	sp|Q87039|GAG_SFVCP	631	sp|Q9Y3Y4|PYGO1_HUMAN Pygopus homolog 1 OS=Homo sapiens OX=9606 GN=PYGO1 PE=1 SV=2	287	SRSSSTEATNNN
LRRIMQKILLGK	sp|Q87040|POL_SFVCP	978	sp|A3KMH1|VWA8_HUMAN von Willebrand factor A domain-containing protein 8 OS=Homo sapiens OX=9606 GN=VWA8 PE=1 SV=2	93	LRWIMQKDLLGQ
RQRPPVQTFQGV	sp|Q87039|GAG_SFVCP	192	sp|P08240|SRPRA_HUMAN Signal recognition particle receptor subunit alpha OS=Homo sapiens OX=9606 GN=SRPRA PE=1 SV=2	415	RQRPYVVTFCGV
ETQSVPDVEVKV	sp|Q87042|BEL1_SFVCP	262	sp|Q96DY7|MTBP_HUMAN Mdm2-binding protein OS=Homo sapiens OX=9606 GN=MTBP PE=1 SV=1	385	KTISVPDVEVKG
RRPRSNNRDRRR	sp|Q87039|GAG_SFVCP	265	sp|Q7L014|DDX46_HUMAN Probable ATP-dependent RNA helicase DDX46 OS=Homo sapiens OX=9606 GN=DDX46 PE=1 SV=2	38	RRSRSRDRDRRR
RRPRSNNRDRRR	sp|Q87039|GAG_SFVCP	265	tr|A0A0C4DG89|A0A0C4DG89_HUMAN RNA helicase OS=Homo sapiens OX=9606 GN=DDX46 PE=1 SV=1	38	RRSRSRDRDRRR
RRPRSNNRDRRR	sp|Q87039|GAG_SFVCP	265	tr|D6RJA6|D6RJA6_HUMAN RNA helicase OS=Homo sapiens OX=9606 GN=DDX46 PE=1 SV=1	38	RRSRSRDRDRRR
RRPRSNNRDRRR	sp|Q87039|GAG_SFVCP	265	sp|O95104|SCAF4_HUMAN SR-related and CTD-associated factor 4 OS=Homo sapiens OX=9606 GN=SCAF4 PE=1 SV=3	460	RRSRSRSRDRRR
LNLAQPVPADAK	sp|Q87040|POL_SFVCP	4	sp|Q86SU0|ILDR1_HUMAN Immunoglobulin-like domain-containing receptor 1 OS=Homo sapiens OX=9606 GN=ILDR1 PE=1 SV=2	296	LNLAQPLPPDLK
TTPTSPRPAQAG	sp|Q87039|GAG_SFVCP	576	tr|A2A2F0|A2A2F0_HUMAN Ral GTPase-activating protein subunit beta (Fragment) OS=Homo sapiens OX=9606 GN=RALGAPB PE=1 SV=1	561	TTPDSERPAQAL
TTPTSPRPAQAG	sp|Q87039|GAG_SFVCP	576	sp|Q86X10|RLGPB_HUMAN Ral GTPase-activating protein subunit beta OS=Homo sapiens OX=9606 GN=RALGAPB PE=1 SV=1	733	TTPDSERPAQAL
TTPTSPRPAQAG	sp|Q87039|GAG_SFVCP	576	tr|A0A0J9YW54|A0A0J9YW54_HUMAN Ral GTPase-activating protein subunit beta (Fragment) OS=Homo sapiens OX=9606 GN=RALGAPB PE=1 SV=1	101	TTPDSERPAQAL
SPPRLQTTPGTL	sp|Q87039|GAG_SFVCP	218	tr|E5RJU4|E5RJU4_HUMAN Transforming acidic coiled-coil-containing protein 1 (Fragment) OS=Homo sapiens OX=9606 GN=TACC1 PE=1 SV=1	92	SPPDLKETPGTL
SPPRLQTTPGTL	sp|Q87039|GAG_SFVCP	218	tr|E7ET87|E7ET87_HUMAN Transforming acidic coiled-coil-containing protein 1 OS=Homo sapiens OX=9606 GN=TACC1 PE=1 SV=1	92	SPPDLKETPGTL
SPPRLQTTPGTL	sp|Q87039|GAG_SFVCP	218	sp|O75410|TACC1_HUMAN Transforming acidic coiled-coil-containing protein 1 OS=Homo sapiens OX=9606 GN=TACC1 PE=1 SV=2	287	SPPDLKETPGTL
SPPRLQTTPGTL	sp|Q87039|GAG_SFVCP	218	tr|R4GMT7|R4GMT7_HUMAN Transforming acidic coiled-coil-containing protein 1 OS=Homo sapiens OX=9606 GN=TACC1 PE=1 SV=1	251	SPPDLKETPGTL
SPPRLQTTPGTL	sp|Q87039|GAG_SFVCP	218	tr|E7EVI4|E7EVI4_HUMAN Transforming acidic coiled-coil-containing protein 1 OS=Homo sapiens OX=9606 GN=TACC1 PE=1 SV=1	92	SPPDLKETPGTL
SPPRLQTTPGTL	sp|Q87039|GAG_SFVCP	218	tr|E5RFM9|E5RFM9_HUMAN Transforming acidic coiled-coil-containing protein 1 (Fragment) OS=Homo sapiens OX=9606 GN=TACC1 PE=1 SV=1	259	SPPDLKETPGTL
SPPRLQTTPGTL	sp|Q87039|GAG_SFVCP	218	tr|H0YAY0|H0YAY0_HUMAN Transforming acidic coiled-coil-containing protein 1 (Fragment) OS=Homo sapiens OX=9606 GN=TACC1 PE=1 SV=1	62	SPPDLKETPGTL
SPPRLQTTPGTL	sp|Q87039|GAG_SFVCP	218	sp|Q9H6K5|PRR36_HUMAN Proline-rich protein 36 OS=Homo sapiens OX=9606 GN=PRR36 PE=1 SV=2	504	SPPSLQATPHTL
SQEEMRRKWERG	sp|Q87043|BET_SFVCP	454	sp|O15488|GLYG2_HUMAN Glycogenin-2 OS=Homo sapiens OX=9606 GN=GYG2 PE=1 SV=2	468	SPEEERRKWEEG
SQEEMRRKWERG	sp|Q87043|BET_SFVCP	454	tr|A0A1W2PQ75|A0A1W2PQ75_HUMAN Glycogenin-2 OS=Homo sapiens OX=9606 GN=GYG2 PE=1 SV=1	397	SPEEERRKWEEG
SQEEMRRKWERG	sp|Q87043|BET_SFVCP	454	sp|Q8IXQ6|PARP9_HUMAN Protein mono-ADP-ribosyltransferase PARP9 OS=Homo sapiens OX=9606 GN=PARP9 PE=1 SV=2	607	VQEEMARKKERG
SQEEMRRKWERG	sp|Q87043|BET_SFVCP	454	tr|G5E9U8|G5E9U8_HUMAN Poly (ADP-ribose) polymerase family, member 9, isoform CRA_b OS=Homo sapiens OX=9606 GN=PARP9 PE=1 SV=1	152	VQEEMARKKERG
PTSPRPAQAGQG	sp|Q87039|GAG_SFVCP	578	tr|A0A2U3TZI3|A0A2U3TZI3_HUMAN Calcium-transporting ATPase OS=Homo sapiens OX=9606 GN=ATP2B2 PE=1 SV=1	1177	PTSLPPAAAGQG
QAVSTTKSLGAL	sp|Q87040|POL_SFVCP	228	sp|Q9Y4P3|TBL2_HUMAN Transducin beta-like protein 2 OS=Homo sapiens OX=9606 GN=TBL2 PE=1 SV=1	434	QAQETLKSLGAL
QAVSTTKSLGAL	sp|Q87040|POL_SFVCP	228	tr|E9PF19|E9PF19_HUMAN Transducin beta-like protein 2 OS=Homo sapiens OX=9606 GN=TBL2 PE=1 SV=1	398	QAQETLKSLGAL
RPRSNNRDRRRE	sp|Q87039|GAG_SFVCP	266	sp|Q9BTC0|DIDO1_HUMAN Death-inducer obliterator 1 OS=Homo sapiens OX=9606 GN=DIDO1 PE=1 SV=5	2151	RERSANRDRERE
RPRSNNRDRRRE	sp|Q87039|GAG_SFVCP	266	sp|Q7L014|DDX46_HUMAN Probable ATP-dependent RNA helicase DDX46 OS=Homo sapiens OX=9606 GN=DDX46 PE=1 SV=2	39	RSRSRDRDRRRE
RPRSNNRDRRRE	sp|Q87039|GAG_SFVCP	266	tr|A0A0C4DG89|A0A0C4DG89_HUMAN RNA helicase OS=Homo sapiens OX=9606 GN=DDX46 PE=1 SV=1	39	RSRSRDRDRRRE
RPRSNNRDRRRE	sp|Q87039|GAG_SFVCP	266	tr|D6RJA6|D6RJA6_HUMAN RNA helicase OS=Homo sapiens OX=9606 GN=DDX46 PE=1 SV=1	39	RSRSRDRDRRRE
RPRSNNRDRRRE	sp|Q87039|GAG_SFVCP	266	sp|P84103|SRSF3_HUMAN Serine/arginine-rich splicing factor 3 OS=Homo sapiens OX=9606 GN=SRSF3 PE=1 SV=1	125	RSRSLSRDRRRE
LEDKKPKKLKLS	sp|Q87043|BET_SFVCP	68	tr|F8VSI3|F8VSI3_HUMAN Decorin OS=Homo sapiens OX=9606 GN=DCN PE=1 SV=1	83	LEDKSPERLKLS
CPVFLELIKEPY	sp|Q87041|ENV_SFVCP	789	tr|E7EQW4|E7EQW4_HUMAN Breast cancer type 1 susceptibility protein (Fragment) OS=Homo sapiens OX=9606 GN=BRCA1 PE=1 SV=1	24	CPICLELIKEPV
CPVFLELIKEPY	sp|Q87041|ENV_SFVCP	789	tr|E7EUM2|E7EUM2_HUMAN RING-type E3 ubiquitin transferase BRCA1 (Fragment) OS=Homo sapiens OX=9606 GN=BRCA1 PE=1 SV=1	24	CPICLELIKEPV
CPVFLELIKEPY	sp|Q87041|ENV_SFVCP	789	tr|A0A0U1RRA9|A0A0U1RRA9_HUMAN Breast cancer type 1 susceptibility protein (Fragment) OS=Homo sapiens OX=9606 GN=BRCA1 PE=1 SV=1	24	CPICLELIKEPV
CPVFLELIKEPY	sp|Q87041|ENV_SFVCP	789	tr|Q3B891|Q3B891_HUMAN BRCA1 protein (Fragment) OS=Homo sapiens OX=9606 GN=BRCA1 PE=1 SV=1	24	CPICLELIKEPV
CPVFLELIKEPY	sp|Q87041|ENV_SFVCP	789	tr|E7EWN5|E7EWN5_HUMAN Breast cancer type 1 susceptibility protein (Fragment) OS=Homo sapiens OX=9606 GN=BRCA1 PE=1 SV=1	24	CPICLELIKEPV
CPVFLELIKEPY	sp|Q87041|ENV_SFVCP	789	sp|P38398|BRCA1_HUMAN Breast cancer type 1 susceptibility protein OS=Homo sapiens OX=9606 GN=BRCA1 PE=1 SV=2	24	CPICLELIKEPV
CPVFLELIKEPY	sp|Q87041|ENV_SFVCP	789	tr|Q5YLB2|Q5YLB2_HUMAN Breast cancer type 1 susceptibility protein OS=Homo sapiens OX=9606 GN=BRCA1 PE=1 SV=1	24	CPICLELIKEPV
CPVFLELIKEPY	sp|Q87041|ENV_SFVCP	789	tr|A0A2R8Y6Y9|A0A2R8Y6Y9_HUMAN Breast cancer type 1 susceptibility protein OS=Homo sapiens OX=9606 GN=BRCA1 PE=1 SV=1	24	CPICLELIKEPV
CPVFLELIKEPY	sp|Q87041|ENV_SFVCP	789	tr|E7ENB7|E7ENB7_HUMAN Breast cancer type 1 susceptibility protein (Fragment) OS=Homo sapiens OX=9606 GN=BRCA1 PE=1 SV=1	24	CPICLELIKEPV
CPVFLELIKEPY	sp|Q87041|ENV_SFVCP	789	tr|E9PH68|E9PH68_HUMAN Breast cancer type 1 susceptibility protein (Fragment) OS=Homo sapiens OX=9606 GN=BRCA1 PE=1 SV=1	24	CPICLELIKEPV
CPVFLELIKEPY	sp|Q87041|ENV_SFVCP	789	tr|E9PC22|E9PC22_HUMAN Breast cancer type 1 susceptibility protein OS=Homo sapiens OX=9606 GN=BRCA1 PE=1 SV=1	24	CPICLELIKEPV
IQTVGRQEPGNE	sp|Q87043|BET_SFVCP	112	sp|P78527|PRKDC_HUMAN DNA-dependent protein kinase catalytic subunit OS=Homo sapiens OX=9606 GN=PRKDC PE=1 SV=3	585	IQTVGEQENGDE
EAAGVRLNEGFW	sp|Q87039|GAG_SFVCP	34	tr|K7EMM9|K7EMM9_HUMAN Contactin-associated protein 1 OS=Homo sapiens OX=9606 GN=CNTNAP1 PE=1 SV=1	433	FAAGYRLNDGFW
EAAGVRLNEGFW	sp|Q87039|GAG_SFVCP	34	sp|P78357|CNTP1_HUMAN Contactin-associated protein 1 OS=Homo sapiens OX=9606 GN=CNTNAP1 PE=1 SV=1	433	FAAGYRLNDGFW
RELPSLPIMSAP	sp|Q87039|GAG_SFVCP	276	sp|Q9UBZ4|APEX2_HUMAN DNA-(apurinic or apyrimidinic site) endonuclease 2 OS=Homo sapiens OX=9606 GN=APEX2 PE=1 SV=1	410	IELPSLPLMSAL
LETYLNHVSVLY	sp|Q87039|GAG_SFVCP	458	tr|K7ERJ7|K7ERJ7_HUMAN Zinc finger protein 793 (Fragment) OS=Homo sapiens OX=9606 GN=ZNF793 PE=4 SV=8	38	LETYSNLVSVGY
LETYLNHVSVLY	sp|Q87039|GAG_SFVCP	458	tr|K7EL37|K7EL37_HUMAN Zinc finger protein 793 (Fragment) OS=Homo sapiens OX=9606 GN=ZNF793 PE=4 SV=1	31	LETYSNLVSVGY
LETYLNHVSVLY	sp|Q87039|GAG_SFVCP	458	sp|Q6ZN11|ZN793_HUMAN Zinc finger protein 793 OS=Homo sapiens OX=9606 GN=ZNF793 PE=2 SV=2	38	LETYSNLVSVGY
LETYLNHVSVLY	sp|Q87039|GAG_SFVCP	458	tr|K7EN11|K7EN11_HUMAN Zinc finger protein 793 OS=Homo sapiens OX=9606 GN=ZNF793 PE=4 SV=1	38	LETYSNLVSVGY
LETYLNHVSVLY	sp|Q87039|GAG_SFVCP	458	tr|K7EQP3|K7EQP3_HUMAN Zinc finger protein 793 OS=Homo sapiens OX=9606 GN=ZNF793 PE=4 SV=1	38	LETYSNLVSVGY
LETYLNHVSVLY	sp|Q87039|GAG_SFVCP	458	tr|K7EMU0|K7EMU0_HUMAN Zinc finger protein 793 OS=Homo sapiens OX=9606 GN=ZNF793 PE=4 SV=1	38	LETYSNLVSVGY
