query	query_seqname	query_start	target_seqname	target_start	target
LSEKDDKFILIK	sp|P16272|DNLI_VACCW	31	tr|A0A6Q8PGM4|A0A6Q8PGM4_HUMAN UDP-glucuronic acid decarboxylase 1 (Fragment) OS=Homo sapiens OX=9606 GN=UXS1 PE=1 SV=1	28	LSEKDRKRILIT
LSEKDDKFILIK	sp|P16272|DNLI_VACCW	31	tr|C9JW33|C9JW33_HUMAN UDP-glucuronic acid decarboxylase 1 (Fragment) OS=Homo sapiens OX=9606 GN=UXS1 PE=1 SV=1	26	LSEKDRKRILIT
LSEKDDKFILIK	sp|P16272|DNLI_VACCW	31	sp|Q8NBZ7|UXS1_HUMAN UDP-glucuronic acid decarboxylase 1 OS=Homo sapiens OX=9606 GN=UXS1 PE=1 SV=1	83	LSEKDRKRILIT
ISSFKMLSIECS	sp|P68613|VLTF1_VACCW	100	sp|Q86TD4|SRCA_HUMAN Sarcalumenin OS=Homo sapiens OX=9606 GN=SRL PE=1 SV=3	410	ISSFKLLSQQCS
LVAPNANYLDVT	sp|P16715|P4A_VACCW	332	sp|Q9UNG2|TNF18_HUMAN Tumor necrosis factor ligand superfamily member 18 OS=Homo sapiens OX=9606 GN=TNFSF18 PE=1 SV=2	122	QVAPNANYNDVA
QLSTSPSPGAAT	sp|P29191|A4_VACCW	210	tr|F8W7X8|F8W7X8_HUMAN Serine/threonine-protein kinase tousled-like 1 OS=Homo sapiens OX=9606 GN=TLK1 PE=1 SV=1	18	QLSTSPTPGSAA
QLSTSPSPGAAT	sp|P29191|A4_VACCW	210	sp|Q9UKI8|TLK1_HUMAN Serine/threonine-protein kinase tousled-like 1 OS=Homo sapiens OX=9606 GN=TLK1 PE=1 SV=2	18	QLSTSPTPGSAA
QLSTSPSPGAAT	sp|P29191|A4_VACCW	210	tr|B3KRP1|B3KRP1_HUMAN Serine/threonine-protein kinase tousled-like 1 OS=Homo sapiens OX=9606 GN=TLK1 PE=1 SV=1	18	QLSTSPTPGSAA
LATAETAEENEY	sp|P16715|P4A_VACCW	7	sp|Q8NDA2|HMCN2_HUMAN Hemicentin-2 OS=Homo sapiens OX=9606 GN=HMCN2 PE=2 SV=3	4600	LATALQAEENEV
LATAETAEENEY	sp|P16715|P4A_VACCW	7	tr|H0Y3X1|H0Y3X1_HUMAN Hemicentin-2 (Fragment) OS=Homo sapiens OX=9606 GN=HMCN2 PE=1 SV=2	64	LATALQAEENEV
LLHPSAVEEYKK	sp|P16913|B1_VACCW	60	sp|Q71UM5|RS27L_HUMAN 40S ribosomal protein S27-like OS=Homo sapiens OX=9606 GN=RPS27L PE=1 SV=3	7	LLHPSLEEEKKK
LLHPSAVEEYKK	sp|P16913|B1_VACCW	60	tr|H0YMV8|H0YMV8_HUMAN 40S ribosomal protein S27 OS=Homo sapiens OX=9606 GN=RPS27L PE=1 SV=1	23	LLHPSLEEEKKK
LLHPSAVEEYKK	sp|P16913|B1_VACCW	60	tr|C9JLI6|C9JLI6_HUMAN 40S ribosomal protein S27 OS=Homo sapiens OX=9606 GN=RPS27L PE=1 SV=1	7	LLHPSLEEEKKK
KLSMNLVSLLAD	sp|Q80HX1|O1_VACCW	649	tr|H0YB38|H0YB38_HUMAN Golgi-resident adenosine 3',5'-bisphosphate 3'-phosphatase (Fragment) OS=Homo sapiens OX=9606 GN=BPNT2 PE=1 SV=1	62	KLVMQLVSLLAM
PISSVPLKSSLI	sp|P21604|E2_VACCW	350	tr|A0A494BZU9|A0A494BZU9_HUMAN Nuclear pore complex protein Nup214 (Fragment) OS=Homo sapiens OX=9606 GN=NUP214 PE=1 SV=1	523	PPSSVPLKSSVL
PISSVPLKSSLI	sp|P21604|E2_VACCW	350	sp|P35658|NU214_HUMAN Nuclear pore complex protein Nup214 OS=Homo sapiens OX=9606 GN=NUP214 PE=1 SV=2	633	PPSSVPLKSSVL
PISSVPLKSSLI	sp|P21604|E2_VACCW	350	tr|A0A0A0MSW3|A0A0A0MSW3_HUMAN Nuclear pore complex protein Nup214 OS=Homo sapiens OX=9606 GN=NUP214 PE=1 SV=1	62	PPSSVPLKSSVL
PISSVPLKSSLI	sp|P21604|E2_VACCW	350	tr|A0A494C1F2|A0A494C1F2_HUMAN Nuclear pore complex protein Nup214 OS=Homo sapiens OX=9606 GN=NUP214 PE=1 SV=1	621	PPSSVPLKSSVL
LSGKDIIPHIPQ	sp|Q76ZJ3|C22L_VACCW	17	tr|A0A0C4DGD2|A0A0C4DGD2_HUMAN Pre-mRNA-splicing factor SLU7 (Fragment) OS=Homo sapiens OX=9606 GN=SLU7 PE=1 SV=1	54	EEGKDINPHIPQ
LSGKDIIPHIPQ	sp|Q76ZJ3|C22L_VACCW	17	tr|E5RGM7|E5RGM7_HUMAN Pre-mRNA-splicing factor SLU7 (Fragment) OS=Homo sapiens OX=9606 GN=SLU7 PE=1 SV=1	54	EEGKDINPHIPQ
LSGKDIIPHIPQ	sp|Q76ZJ3|C22L_VACCW	17	tr|E5RK41|E5RK41_HUMAN Pre-mRNA-splicing factor SLU7 (Fragment) OS=Homo sapiens OX=9606 GN=SLU7 PE=1 SV=1	54	EEGKDINPHIPQ
LSGKDIIPHIPQ	sp|Q76ZJ3|C22L_VACCW	17	sp|O95391|SLU7_HUMAN Pre-mRNA-splicing factor SLU7 OS=Homo sapiens OX=9606 GN=SLU7 PE=1 SV=2	54	EEGKDINPHIPQ
GSSLVDTKCIKT	sp|Q805H7|C23L_VACCW	183	sp|Q5TCS8|KAD9_HUMAN Adenylate kinase 9 OS=Homo sapiens OX=9606 GN=AK9 PE=1 SV=2	509	GSSLVDTEEAKT
GSSLVDTKCIKT	sp|Q805H7|C23L_VACCW	183	tr|J3KP89|J3KP89_HUMAN Nucleoside-diphosphate kinase OS=Homo sapiens OX=9606 GN=AK9 PE=1 SV=1	509	GSSLVDTEEAKT
EEILEWIAERNN	sp|P21603|RP30_VACCW	38	tr|E9PPF6|E9PPF6_HUMAN Liprin-alpha-1 (Fragment) OS=Homo sapiens OX=9606 GN=PPFIA1 PE=1 SV=1	109	EEIAELKAERNN
EEILEWIAERNN	sp|P21603|RP30_VACCW	38	tr|E9PJZ7|E9PJZ7_HUMAN Liprin-alpha-1 OS=Homo sapiens OX=9606 GN=PPFIA1 PE=1 SV=1	109	EEIAELKAERNN
EEILEWIAERNN	sp|P21603|RP30_VACCW	38	sp|Q13136|LIPA1_HUMAN Liprin-alpha-1 OS=Homo sapiens OX=9606 GN=PPFIA1 PE=1 SV=1	109	EEIAELKAERNN
EEILEWIAERNN	sp|P21603|RP30_VACCW	38	tr|A0A2R8Y7R9|A0A2R8Y7R9_HUMAN Liprin-alpha-1 (Fragment) OS=Homo sapiens OX=9606 GN=PPFIA1 PE=1 SV=1	91	EEIAELKAERNN
EEILEWIAERNN	sp|P21603|RP30_VACCW	38	tr|R4GNF1|R4GNF1_HUMAN Liprin-alpha-3 (Fragment) OS=Homo sapiens OX=9606 GN=PPFIA3 PE=1 SV=8	101	EEIAELKAERNN
EEILEWIAERNN	sp|P21603|RP30_VACCW	38	tr|R4GN36|R4GN36_HUMAN Liprin-alpha-3 OS=Homo sapiens OX=9606 GN=PPFIA3 PE=1 SV=1	101	EEIAELKAERNN
EEILEWIAERNN	sp|P21603|RP30_VACCW	38	sp|O75145|LIPA3_HUMAN Liprin-alpha-3 OS=Homo sapiens OX=9606 GN=PPFIA3 PE=1 SV=3	101	EEIAELKAERNN
EEILEWIAERNN	sp|P21603|RP30_VACCW	38	tr|F8VWR9|F8VWR9_HUMAN Liprin-alpha-2 (Fragment) OS=Homo sapiens OX=9606 GN=PPFIA2 PE=1 SV=1	104	EEISELKAERNN
EEILEWIAERNN	sp|P21603|RP30_VACCW	38	sp|O75335|LIPA4_HUMAN Liprin-alpha-4 OS=Homo sapiens OX=9606 GN=PPFIA4 PE=2 SV=3	99	EEISELKAERNN
EEILEWIAERNN	sp|P21603|RP30_VACCW	38	tr|B1APN9|B1APN9_HUMAN Liprin-alpha-4 OS=Homo sapiens OX=9606 GN=PPFIA4 PE=1 SV=2	99	EEISELKAERNN
EEILEWIAERNN	sp|P21603|RP30_VACCW	38	tr|G3V200|G3V200_HUMAN Liprin-alpha-2 OS=Homo sapiens OX=9606 GN=PPFIA2 PE=1 SV=2	122	EEISELKAERNN
EEILEWIAERNN	sp|P21603|RP30_VACCW	38	sp|O75334|LIPA2_HUMAN Liprin-alpha-2 OS=Homo sapiens OX=9606 GN=PPFIA2 PE=1 SV=2	122	EEISELKAERNN
YESLEVDLEVID	sp|P17364|C8_VACCW	141	sp|Q9BRK3|MXRA8_HUMAN Matrix remodeling-associated protein 8 OS=Homo sapiens OX=9606 GN=MXRA8 PE=1 SV=1	147	YESLAVRLEVTD
AELVNMKDLGTY	sp|P07392|RP147_VACCW	1126	tr|Q5VTS8|Q5VTS8_HUMAN Mitochondrial uncoupling protein 4 (Fragment) OS=Homo sapiens OX=9606 GN=SLC25A27 PE=1 SV=1	130	AALVNMGDLTTY
AELVNMKDLGTY	sp|P07392|RP147_VACCW	1126	tr|S4R3J2|S4R3J2_HUMAN Mitochondrial uncoupling protein 4 (Fragment) OS=Homo sapiens OX=9606 GN=SLC25A27 PE=1 SV=1	45	AALVNMGDLTTY
AELVNMKDLGTY	sp|P07392|RP147_VACCW	1126	sp|O95847|UCP4_HUMAN Mitochondrial uncoupling protein 4 OS=Homo sapiens OX=9606 GN=SLC25A27 PE=2 SV=1	200	AALVNMGDLTTY
KLRNLEKFASKL	sp|P21604|E2_VACCW	79	tr|E9PLA9|E9PLA9_HUMAN Caprin-1 (Fragment) OS=Homo sapiens OX=9606 GN=CAPRIN1 PE=1 SV=1	64	KLRNLEKKKGKL
KLRNLEKFASKL	sp|P21604|E2_VACCW	79	sp|Q14444|CAPR1_HUMAN Caprin-1 OS=Homo sapiens OX=9606 GN=CAPRIN1 PE=1 SV=2	64	KLRNLEKKKGKL
KYLQHLYEKVDL	sp|P68456|G2_VACCW	51	sp|Q8NAB2|KBTB3_HUMAN Kelch repeat and BTB domain-containing protein 3 OS=Homo sapiens OX=9606 GN=KBTBD3 PE=2 SV=3	232	KYLPHLIEKVRL
KYLQHLYEKVDL	sp|P68456|G2_VACCW	51	tr|G3V161|G3V161_HUMAN Kelch repeat and BTB (POZ) domain containing 3, isoform CRA_a OS=Homo sapiens OX=9606 GN=KBTBD3 PE=1 SV=1	153	KYLPHLIEKVRL
TKLDSEFLKTYA	sp|P12927|NPH2_VACCW	517	sp|P42704|LPPRC_HUMAN Leucine-rich PPR motif-containing protein, mitochondrial OS=Homo sapiens OX=9606 GN=LRPPRC PE=1 SV=3	1349	TKLDDLFLKRYA
LKNKLPISKLKG	sp|P04298|MCEL_VACCW	76	sp|Q9NY47|CA2D2_HUMAN Voltage-dependent calcium channel subunit alpha-2/delta-2 OS=Homo sapiens OX=9606 GN=CACNA2D2 PE=1 SV=2	658	LQVKLPISKLKD
LKNKLPISKLKG	sp|P04298|MCEL_VACCW	76	tr|C9JVC9|C9JVC9_HUMAN Voltage-dependent calcium channel subunit alpha-2/delta-2 OS=Homo sapiens OX=9606 GN=CACNA2D2 PE=1 SV=1	658	LQVKLPISKLKD
FQGDGLYTLSIR	sp|P24770|B8_VACCW	35	sp|O43242|PSMD3_HUMAN 26S proteasome non-ATPase regulatory subunit 3 OS=Homo sapiens OX=9606 GN=PSMD3 PE=1 SV=2	386	FQADGTYTLIIR
KGKDGSSKGSKS	sp|P17356|V018_VACCW	17	tr|G3XAF7|G3XAF7_HUMAN Breast carcinoma amplified sequence 1, isoform CRA_c OS=Homo sapiens OX=9606 GN=BCAS1 PE=1 SV=1	416	KGKEGSSKDKKS
KGKDGSSKGSKS	sp|P17356|V018_VACCW	17	sp|O75363|BCAS1_HUMAN Breast carcinoma-amplified sequence 1 OS=Homo sapiens OX=9606 GN=BCAS1 PE=1 SV=2	494	KGKEGSSKDKKS
KGKDGSSKGSKS	sp|P17356|V018_VACCW	17	tr|H7C1E7|H7C1E7_HUMAN Breast carcinoma-amplified sequence 1 (Fragment) OS=Homo sapiens OX=9606 GN=BCAS1 PE=1 SV=1	157	KGKEGSSKDKKS
KGKDGSSKGSKS	sp|P17356|V018_VACCW	17	tr|H0Y542|H0Y542_HUMAN Breast carcinoma-amplified sequence 1 (Fragment) OS=Homo sapiens OX=9606 GN=BCAS1 PE=1 SV=1	365	KGKEGSSKDKKS
AKALGTLNITLP	sp|P18380|K5_VACCW	53	tr|H3BMN1|H3BMN1_HUMAN Arginine/serine-rich protein 1 (Fragment) OS=Homo sapiens OX=9606 GN=RSRP1 PE=1 SV=1	45	AKALGTTNIDLP
AKALGTLNITLP	sp|P18380|K5_VACCW	53	sp|Q9BUV0|RSRP1_HUMAN Arginine/serine-rich protein 1 OS=Homo sapiens OX=9606 GN=RSRP1 PE=1 SV=2	187	AKALGTTNIDLP
AKALGTLNITLP	sp|P18380|K5_VACCW	53	tr|H3BP33|H3BP33_HUMAN Arginine/serine-rich protein 1 (Fragment) OS=Homo sapiens OX=9606 GN=RSRP1 PE=1 SV=1	80	AKALGTTNIDLP
AKALGTLNITLP	sp|P18380|K5_VACCW	53	tr|H3BTJ0|H3BTJ0_HUMAN Arginine/serine-rich protein 1 OS=Homo sapiens OX=9606 GN=RSRP1 PE=1 SV=1	187	AKALGTTNIDLP
NVELSSVKDLLT	sp|P68710|A20_VACCW	4	sp|P10911|MCF2_HUMAN Proto-oncogene DBL OS=Homo sapiens OX=9606 GN=MCF2 PE=1 SV=3	58	VVMLSSVSDLLT
NVELSSVKDLLT	sp|P68710|A20_VACCW	4	tr|A0A2U3TZL4|A0A2U3TZL4_HUMAN Proto-oncogene DBL OS=Homo sapiens OX=9606 GN=MCF2 PE=1 SV=1	161	VVMLSSVSDLLT
WGNITPENIIGA	sp|P06856|DPOL_VACCW	560	tr|F8VPW3|F8VPW3_HUMAN SCY1-like protein 2 (Fragment) OS=Homo sapiens OX=9606 GN=SCYL2 PE=1 SV=1	3	HGNITPENIILN
WGNITPENIIGA	sp|P06856|DPOL_VACCW	560	tr|A0A0U1RQQ9|A0A0U1RQQ9_HUMAN SCY1-like protein 2 OS=Homo sapiens OX=9606 GN=SCYL2 PE=1 SV=1	176	HGNITPENIILN
WGNITPENIIGA	sp|P06856|DPOL_VACCW	560	tr|F8VSC5|F8VSC5_HUMAN SCY1-like protein 2 (Fragment) OS=Homo sapiens OX=9606 GN=SCYL2 PE=1 SV=1	176	HGNITPENIILN
WGNITPENIIGA	sp|P06856|DPOL_VACCW	560	sp|Q6P3W7|SCYL2_HUMAN SCY1-like protein 2 OS=Homo sapiens OX=9606 GN=SCYL2 PE=1 SV=1	176	HGNITPENIILN
DAKELVRSIPYD	sp|P24772|B14_VACCW	67	sp|Q9H3K2|GHITM_HUMAN Growth hormone-inducible transmembrane protein OS=Homo sapiens OX=9606 GN=GHITM PE=1 SV=2	172	GAGMLVRSIPYD
TVVESIEPLFVS	sp|Q80HX6|F12_VACCW	598	sp|Q6ZR37|PKHG7_HUMAN Pleckstrin homology domain-containing family G member 7 OS=Homo sapiens OX=9606 GN=PLEKHG7 PE=2 SV=1	300	LVVKSIEPLHVS
TVVESIEPLFVS	sp|Q80HX6|F12_VACCW	598	tr|A0A1X7SBZ7|A0A1X7SBZ7_HUMAN Pleckstrin homology domain-containing family G member 7 OS=Homo sapiens OX=9606 GN=PLEKHG7 PE=4 SV=2	612	LVVKSIEPLHVS
TVVESIEPLFVS	sp|Q80HX6|F12_VACCW	598	sp|Q9ULI1|NWD2_HUMAN NACHT and WD repeat domain-containing protein 2 OS=Homo sapiens OX=9606 GN=NWD2 PE=2 SV=3	637	TVHESIEQLFWS
LIGAVVAVVVFI	sp|P07612|L1_VACCW	190	tr|A0A087X0T8|A0A087X0T8_HUMAN Cell adhesion molecule 1 OS=Homo sapiens OX=9606 GN=CADM1 PE=1 SV=1	307	VIGGVVAVVVFA
LIGAVVAVVVFI	sp|P07612|L1_VACCW	190	sp|Q9BY67|CADM1_HUMAN Cell adhesion molecule 1 OS=Homo sapiens OX=9606 GN=CADM1 PE=1 SV=2	376	VIGGVVAVVVFA
LIGAVVAVVVFI	sp|P07612|L1_VACCW	190	tr|X5DQS5|X5DQS5_HUMAN Cell adhesion molecule 1 (Fragment) OS=Homo sapiens OX=9606 GN=CADM1 PE=1 SV=1	377	VIGGVVAVVVFA
LIGAVVAVVVFI	sp|P07612|L1_VACCW	190	tr|A0A087X1W8|A0A087X1W8_HUMAN Cell adhesion molecule 1 OS=Homo sapiens OX=9606 GN=CADM1 PE=1 SV=1	346	VIGGVVAVVVFA
LIGAVVAVVVFI	sp|P07612|L1_VACCW	190	tr|A0A0A0MTJ8|A0A0A0MTJ8_HUMAN Cell adhesion molecule 1 (Fragment) OS=Homo sapiens OX=9606 GN=CADM1 PE=1 SV=1	347	VIGGVVAVVVFA
LIGAVVAVVVFI	sp|P07612|L1_VACCW	190	sp|Q8N3J6|CADM2_HUMAN Cell adhesion molecule 2 OS=Homo sapiens OX=9606 GN=CADM2 PE=2 SV=1	369	LIGGIVAVVVFV
MNNYNVLFKTKI	sp|P15058|SPI1_VACCW	315	sp|O95347|SMC2_HUMAN Structural maintenance of chromosomes protein 2 OS=Homo sapiens OX=9606 GN=SMC2 PE=1 SV=2	1150	FNNANVLFKTKF
LLRVDKPTQPMC	sp|P07396|F17_VACCW	45	sp|Q07954|LRP1_HUMAN Prolow-density lipoprotein receptor-related protein 1 OS=Homo sapiens OX=9606 GN=LRP1 PE=1 SV=2	2455	LLRVDIPQQPMG
VTNVLSLSSMSD	sp|P04298|MCEL_VACCW	50	tr|B0QYC3|B0QYC3_HUMAN Caspase recruitment domain-containing protein 10 (Fragment) OS=Homo sapiens OX=9606 GN=CARD10 PE=1 SV=8	13	ETQVLSFSSMSD
SPMSLSSKDLYS	sp|P06440|P4B_VACCW	400	sp|Q5VZB9|DMRTA_HUMAN Doublesex- and mab-3-related transcription factor A1 OS=Homo sapiens OX=9606 GN=DMRTA1 PE=1 SV=1	291	SPRSLSSSDLES
TEYDDDEDDEEE	sp|P68611|RP19_VACCW	16	sp|P19338|NUCL_HUMAN Nucleolin OS=Homo sapiens OX=9606 GN=NCL PE=1 SV=3	253	DEDDDDEDDEEE
TEYDDDEDDEEE	sp|P68611|RP19_VACCW	16	sp|Q9Y4W2|LAS1L_HUMAN Ribosomal biogenesis protein LAS1L OS=Homo sapiens OX=9606 GN=LAS1L PE=1 SV=2	592	EEDEDDEDDEEE
TEYDDDEDDEEE	sp|P68611|RP19_VACCW	16	sp|A1YPR0|ZBT7C_HUMAN Zinc finger and BTB domain-containing protein 7C OS=Homo sapiens OX=9606 GN=ZBTB7C PE=2 SV=1	145	DEDDDDEEDEEE
LTVKSVTAKDVG	sp|Q01218|HEMA_VACCW	88	sp|Q9NR99|MXRA5_HUMAN Matrix-remodeling-associated protein 5 OS=Homo sapiens OX=9606 GN=MXRA5 PE=1 SV=3	2206	LVVKSVTDKDAG
KANRDIKEKREA	sp|P24759|ATI_VACCW	464	sp|A6NJZ7|RIM3C_HUMAN RIMS-binding protein 3C OS=Homo sapiens OX=9606 GN=RIMBP3C PE=1 SV=3	736	QPNRDIQEKREA
KANRDIKEKREA	sp|P24759|ATI_VACCW	464	tr|J3KP16|J3KP16_HUMAN RIMS-binding protein 3C OS=Homo sapiens OX=9606 GN=RIMBP3C PE=3 SV=1	642	QPNRDIQEKREA
KANRDIKEKREA	sp|P24759|ATI_VACCW	464	sp|A6NNM3|RIM3B_HUMAN RIMS-binding protein 3B OS=Homo sapiens OX=9606 GN=RIMBP3B PE=3 SV=3	736	QPNRDIQEKREA
KANRDIKEKREA	sp|P24759|ATI_VACCW	464	sp|Q9UFD9|RIM3A_HUMAN RIMS-binding protein 3A OS=Homo sapiens OX=9606 GN=RIMBP3 PE=1 SV=4	736	QPNRDIQEKREA
LGRTVRAKVVKL	sp|P18378|K3_VACCW	59	sp|Q2WGJ9|FR1L6_HUMAN Fer-1-like protein 6 OS=Homo sapiens OX=9606 GN=FER1L6 PE=2 SV=2	914	LGATVAAPVVKL
ILGRGGFGSMYS	sp|P16913|B1_VACCW	21	sp|P11309|PIM1_HUMAN Serine/threonine-protein kinase pim-1 OS=Homo sapiens OX=9606 GN=PIM1 PE=1 SV=4	43	LLGSGGFGSVYS
FLFNDCGLLKES	sp|P04305|D5_VACCW	100	tr|A0A2R8YGW0|A0A2R8YGW0_HUMAN Chloride channel protein (Fragment) OS=Homo sapiens OX=9606 GN=CLCN5 PE=1 SV=1	207	ELFNDCGLLDSS
FLFNDCGLLKES	sp|P04305|D5_VACCW	100	sp|P51795|CLCN5_HUMAN H(+)/Cl(-) exchange transporter 5 OS=Homo sapiens OX=9606 GN=CLCN5 PE=1 SV=2	457	ELFNDCGLLDSS
RSKKLNLLISEE	sp|P68438|RAP94_VACCW	124	sp|Q13634|CAD18_HUMAN Cadherin-18 OS=Homo sapiens OX=9606 GN=CDH18 PE=2 SV=1	638	RSKKEPLIISEE
LNKSELEKIRRE	sp|P17367|C5_VACCW	4	sp|Q9BV57|MTND_HUMAN 1,2-dihydroxy-3-keto-5-methylthiopentene dioxygenase OS=Homo sapiens OX=9606 GN=ADI1 PE=1 SV=1	47	ENDPELEKIRRE
MSIDKKSHALDK	sp|Q805K5|VA005_VACCW	11	sp|Q8WWL7|CCNB3_HUMAN G2/mitotic-specific cyclin-B3 OS=Homo sapiens OX=9606 GN=CCNB3 PE=1 SV=2	343	MSILKKSLALQK
LLAYDLLENLEY	sp|P24769|B4_VACCW	313	tr|A0A384DVP2|A0A384DVP2_HUMAN Inactive caspase-12 OS=Homo sapiens OX=9606 GN=CASP12 PE=3 SV=1	121	LLGMDLLENLGY
DISVQTYTIPES	sp|P68462|I6_VACCW	147	sp|Q5T1H1|EYS_HUMAN Protein eyes shut homolog OS=Homo sapiens OX=9606 GN=EYS PE=1 SV=5	1255	PISTQTYTIPPS
LSEEELNDKLFC	sp|Q76ZP7|RP132_VACCW	980	sp|P80217|IN35_HUMAN Interferon-induced 35 kDa protein OS=Homo sapiens OX=9606 GN=IFI35 PE=1 SV=5	146	LSEEELLDKLEI
VESIEPLFVSSF	sp|Q80HX6|F12_VACCW	600	sp|Q6ZR37|PKHG7_HUMAN Pleckstrin homology domain-containing family G member 7 OS=Homo sapiens OX=9606 GN=PLEKHG7 PE=2 SV=1	302	VKSIEPLHVSVF
VESIEPLFVSSF	sp|Q80HX6|F12_VACCW	600	tr|A0A1X7SBZ7|A0A1X7SBZ7_HUMAN Pleckstrin homology domain-containing family G member 7 OS=Homo sapiens OX=9606 GN=PLEKHG7 PE=4 SV=2	614	VKSIEPLHVSVF
SLKPSYIEKPKR	sp|P68440|D13_VACCW	223	sp|P27544|CERS1_HUMAN Ceramide synthase 1 OS=Homo sapiens OX=9606 GN=CERS1 PE=1 SV=1	330	SLKPSKAEKPLR
YNDEASSESGLT	sp|P24759|ATI_VACCW	25	sp|Q9HCD6|TANC2_HUMAN Protein TANC2 OS=Homo sapiens OX=9606 GN=TANC2 PE=1 SV=3	909	ANVDASSESGLT
YNDEASSESGLT	sp|P24759|ATI_VACCW	25	tr|J3KRP9|J3KRP9_HUMAN Protein TANC2 (Fragment) OS=Homo sapiens OX=9606 GN=TANC2 PE=1 SV=1	838	ANVDASSESGLT
GSQNSSCSPGNN	sp|P68638|VCP_VACCW	242	tr|H0YLC5|H0YLC5_HUMAN POU domain, class 2, transcription factor 3 (Fragment) OS=Homo sapiens OX=9606 GN=POU2F3 PE=4 SV=9	114	GTVTSSCSPGNN
GSQNSSCSPGNN	sp|P68638|VCP_VACCW	242	sp|Q9UKI9|PO2F3_HUMAN POU domain, class 2, transcription factor 3 OS=Homo sapiens OX=9606 GN=POU2F3 PE=2 SV=3	377	GTVTSSCSPGNN
GIEGRIYDADGN	sp|P05807|NTP1_VACCW	598	sp|P09228|CYTT_HUMAN Cystatin-SA OS=Homo sapiens OX=9606 GN=CST2 PE=1 SV=1	29	IIEGGIYDADLN
ILKSVRINMTEG	sp|P17361|N1_VACCW	42	tr|H0YJR8|H0YJR8_HUMAN Dehydrogenase/reductase SDR family member 7 (Fragment) OS=Homo sapiens OX=9606 GN=DHRS7 PE=1 SV=1	166	ILKSLRQNMTEK
VCLVILVIAILL	sp|P68593|A17_VACCW	120	sp|Q9BXN2|CLC7A_HUMAN C-type lectin domain family 7 member A OS=Homo sapiens OX=9606 GN=CLEC7A PE=1 SV=1	53	LCLVILVIAVVL
VCLVILVIAILL	sp|P68593|A17_VACCW	120	tr|Q68D78|Q68D78_HUMAN C-type lectin domain family 7 member A OS=Homo sapiens OX=9606 GN=CLEC7A PE=1 SV=1	53	LCLVILVIAVVL
GICARITEKYGY	sp|P68466|K7_VACCW	103	sp|P30085|KCY_HUMAN UMP-CMP kinase OS=Homo sapiens OX=9606 GN=CMPK1 PE=1 SV=3	18	TQCARIVEKYGY
GICARITEKYGY	sp|P68466|K7_VACCW	103	tr|Q5T0D2|Q5T0D2_HUMAN Nucleoside-diphosphate kinase OS=Homo sapiens OX=9606 GN=CMPK1 PE=1 SV=1	50	TQCARIVEKYGY
YDLDENAKACQR	sp|P24358|F5_VACCW	23	tr|F8VRJ5|F8VRJ5_HUMAN Protein FAM186B OS=Homo sapiens OX=9606 GN=FAM186B PE=1 SV=1	58	YDLKENAKSQQR
YDLDENAKACQR	sp|P24358|F5_VACCW	23	sp|Q8IYM0|F186B_HUMAN Protein FAM186B OS=Homo sapiens OX=9606 GN=FAM186B PE=2 SV=2	58	YDLKENAKSQQR
VSSANYTVLSSP	sp|P04318|MCES_VACCW	225	tr|A0A3F2YNW7|A0A3F2YNW7_HUMAN AT-rich interactive domain-containing protein 1B OS=Homo sapiens OX=9606 GN=ARID1B PE=1 SV=1	443	GSSAGYGVLSSP
VSSANYTVLSSP	sp|P04318|MCES_VACCW	225	tr|A0A6Q8NVI4|A0A6Q8NVI4_HUMAN AT-rich interactive domain-containing protein 1B OS=Homo sapiens OX=9606 GN=ARID1B PE=1 SV=1	443	GSSAGYGVLSSP
VSSANYTVLSSP	sp|P04318|MCES_VACCW	225	sp|Q8NFD5|ARI1B_HUMAN AT-rich interactive domain-containing protein 1B OS=Homo sapiens OX=9606 GN=ARID1B PE=1 SV=2	360	GSSAGYGVLSSP
VSSANYTVLSSP	sp|P04318|MCES_VACCW	225	tr|A0A6I8PTU7|A0A6I8PTU7_HUMAN AT-rich interactive domain-containing protein 1B (Fragment) OS=Homo sapiens OX=9606 GN=ARID1B PE=1 SV=1	357	GSSAGYGVLSSP
VSSANYTVLSSP	sp|P04318|MCES_VACCW	225	sp|P11831|SRF_HUMAN Serum response factor OS=Homo sapiens OX=9606 GN=SRF PE=1 SV=1	315	VSSANGTVLKST
EETKFVESKVLE	sp|P04298|MCEL_VACCW	329	tr|Q8N7S5|Q8N7S5_HUMAN Phosphoinositide phospholipase C OS=Homo sapiens OX=9606 GN=PLCZ1 PE=1 SV=1	84	EEDKFKESEVLE
EETKFVESKVLE	sp|P04298|MCEL_VACCW	329	tr|A0A3B3ISW9|A0A3B3ISW9_HUMAN Phosphoinositide phospholipase C OS=Homo sapiens OX=9606 GN=PLCZ1 PE=1 SV=1	343	EEDKFKESEVLE
FSNGGGGVWGGG	sp|P17356|V018_VACCW	29	sp|P23490|LORI_HUMAN Loricrin OS=Homo sapiens OX=9606 GN=LORICRIN PE=1 SV=2	129	FSSGGGGSSGGG
FSNGGGGVWGGG	sp|P17356|V018_VACCW	29	sp|P23490|LORI_HUMAN Loricrin OS=Homo sapiens OX=9606 GN=LORICRIN PE=1 SV=2	114	FSSGGGGSSGGG
RYLDNGGNKRPG	sp|P12848|RIR1_VACCW	284	sp|P23921|RIR1_HUMAN Ribonucleoside-diphosphate reductase large subunit OS=Homo sapiens OX=9606 GN=RRM1 PE=1 SV=1	284	RYVDQGGNKRPG
RYLDNGGNKRPG	sp|P12848|RIR1_VACCW	284	tr|E9PL69|E9PL69_HUMAN Ribonucleoside-diphosphate reductase large subunit OS=Homo sapiens OX=9606 GN=RRM1 PE=1 SV=1	62	RYVDQGGNKRPG
PQTSDSGIWLCL	sp|P25212|IL1BP_VACCW	89	sp|Q6WRI0|IGS10_HUMAN Immunoglobulin superfamily member 10 OS=Homo sapiens OX=9606 GN=IGSF10 PE=1 SV=1	2595	PQTSDSGIYKCT
LIAPRRLKTIKN	sp|P17364|C8_VACCW	166	sp|P60507|EFC1_HUMAN Endogenous retrovirus group FC1 Env polyprotein OS=Homo sapiens OX=9606 GN=ERVFC1 PE=1 SV=1	534	LIAPCVLKFIKN
YKIEGASAPLLL	sp|P68438|RAP94_VACCW	215	sp|P49137|MAPK2_HUMAN MAP kinase-activated protein kinase 2 OS=Homo sapiens OX=9606 GN=MAPKAPK2 PE=1 SV=1	373	KKIEDASNPLLL
FLSEKDDKFILI	sp|P16272|DNLI_VACCW	30	tr|A0A6Q8PGM4|A0A6Q8PGM4_HUMAN UDP-glucuronic acid decarboxylase 1 (Fragment) OS=Homo sapiens OX=9606 GN=UXS1 PE=1 SV=1	27	FLSEKDRKRILI
FLSEKDDKFILI	sp|P16272|DNLI_VACCW	30	tr|C9JW33|C9JW33_HUMAN UDP-glucuronic acid decarboxylase 1 (Fragment) OS=Homo sapiens OX=9606 GN=UXS1 PE=1 SV=1	25	FLSEKDRKRILI
FLSEKDDKFILI	sp|P16272|DNLI_VACCW	30	sp|Q8NBZ7|UXS1_HUMAN UDP-glucuronic acid decarboxylase 1 OS=Homo sapiens OX=9606 GN=UXS1 PE=1 SV=1	82	FLSEKDRKRILI
KRIKSSSSNKSS	sp|P68619|A36_VACCW	44	sp|Q99500|S1PR3_HUMAN Sphingosine 1-phosphate receptor 3 OS=Homo sapiens OX=9606 GN=S1PR3 PE=1 SV=2	335	SRSKSSSSNNSS
KRIKSSSSNKSS	sp|P68619|A36_VACCW	44	tr|C9JN15|C9JN15_HUMAN Peptidyl-prolyl cis-trans isomerase (Fragment) OS=Homo sapiens OX=9606 GN=PPIG PE=1 SV=1	189	KRHKSSSSSSSS
KRIKSSSSNKSS	sp|P68619|A36_VACCW	44	tr|E9PG73|E9PG73_HUMAN Peptidyl-prolyl cis-trans isomerase G OS=Homo sapiens OX=9606 GN=PPIG PE=1 SV=1	174	KRHKSSSSSSSS
KRIKSSSSNKSS	sp|P68619|A36_VACCW	44	sp|Q13427|PPIG_HUMAN Peptidyl-prolyl cis-trans isomerase G OS=Homo sapiens OX=9606 GN=PPIG PE=1 SV=2	189	KRHKSSSSSSSS
KRIKSSSSNKSS	sp|P68619|A36_VACCW	44	tr|C9JM79|C9JM79_HUMAN Peptidyl-prolyl cis-trans isomerase G (Fragment) OS=Homo sapiens OX=9606 GN=PPIG PE=1 SV=1	185	KRHKSSSSSSSS
IYLESHTLLNAV	sp|P24357|F3_VACCW	86	sp|Q6V0L0|CP26C_HUMAN Cytochrome P450 26C1 OS=Homo sapiens OX=9606 GN=CYP26C1 PE=2 SV=2	123	ILLGSHTLLGAV
IYLESHTLLNAV	sp|P24357|F3_VACCW	86	tr|A0A096LNL5|A0A096LNL5_HUMAN Cytochrome P450 26C1 OS=Homo sapiens OX=9606 GN=CYP26C1 PE=3 SV=1	123	ILLGSHTLLGAV
DWGLNIPKFLDL	sp|P68710|A20_VACCW	157	tr|A0A2R8Y566|A0A2R8Y566_HUMAN RAB11-binding protein RELCH OS=Homo sapiens OX=9606 GN=RELCH PE=1 SV=1	293	DVGLNIPKPPDL
DWGLNIPKFLDL	sp|P68710|A20_VACCW	157	sp|Q9P260|RELCH_HUMAN RAB11-binding protein RELCH OS=Homo sapiens OX=9606 GN=RELCH PE=1 SV=2	293	DVGLNIPKPPDL
DWGLNIPKFLDL	sp|P68710|A20_VACCW	157	tr|A0A075B785|A0A075B785_HUMAN RAB11-binding protein RELCH OS=Homo sapiens OX=9606 GN=RELCH PE=1 SV=7	293	DVGLNIPKPPDL
TIFTLSSDNILY	sp|P29192|A6_VACCW	201	sp|Q04656|ATP7A_HUMAN Copper-transporting ATPase 1 OS=Homo sapiens OX=9606 GN=ATP7A PE=1 SV=4	821	TIVTLDSDNILL
AMSSSSIFSRKS	sp|Q76ZP7|RP132_VACCW	914	sp|Q8IW70|T151B_HUMAN Transmembrane protein 151B OS=Homo sapiens OX=9606 GN=TMEM151B PE=2 SV=2	439	AVSSSSIFSRSA
DAISSLTVKSVT	sp|Q01218|HEMA_VACCW	83	sp|Q8NG31|KNL1_HUMAN Kinetochore scaffold 1 OS=Homo sapiens OX=9606 GN=KNL1 PE=1 SV=3	741	TAISSHTVKSVL
DAISSLTVKSVT	sp|Q01218|HEMA_VACCW	83	tr|E9PPJ1|E9PPJ1_HUMAN Kinetochore scaffold 1 OS=Homo sapiens OX=9606 GN=KNL1 PE=1 SV=2	715	TAISSHTVKSVL
YLFICPLQLPYN	sp|P06856|DPOL_VACCW	930	sp|P07333|CSF1R_HUMAN Macrophage colony-stimulating factor 1 receptor OS=Homo sapiens OX=9606 GN=CSF1R PE=1 SV=2	561	YTFIDPTQLPYN
YLFICPLQLPYN	sp|P06856|DPOL_VACCW	930	tr|E9PEK4|E9PEK4_HUMAN Receptor protein-tyrosine kinase OS=Homo sapiens OX=9606 GN=CSF1R PE=1 SV=1	561	YTFIDPTQLPYN
DIPSISSGIVNG	sp|Q01227|B5_VACCW	187	sp|O43687|AKA7A_HUMAN A-kinase anchor protein 7 isoforms alpha and beta OS=Homo sapiens OX=9606 GN=AKAP7 PE=1 SV=4	33	DIPSWSSGEKNG
INPLFSDVLKFI	sp|P26673|A47_VACCW	199	sp|Q86UP3|ZFHX4_HUMAN Zinc finger homeobox protein 4 OS=Homo sapiens OX=9606 GN=ZFHX4 PE=1 SV=1	507	ISPLSSSVLKFI
INPLFSDVLKFI	sp|P26673|A47_VACCW	199	tr|E7EVZ1|E7EVZ1_HUMAN Zinc finger homeobox protein 4 OS=Homo sapiens OX=9606 GN=ZFHX4 PE=1 SV=1	507	ISPLSSSVLKFI
INPLFSDVLKFI	sp|P26673|A47_VACCW	199	tr|E5RI93|E5RI93_HUMAN Zinc finger homeobox protein 4 (Fragment) OS=Homo sapiens OX=9606 GN=ZFHX4 PE=1 SV=2	507	ISPLSSSVLKFI
LTGGTGAGKSTS	sp|P12927|NPH2_VACCW	183	tr|A0A0C4DG33|A0A0C4DG33_HUMAN Peroxin-1 OS=Homo sapiens OX=9606 GN=PEX1 PE=1 SV=1	597	LTGGKGSGKSTL
LTGGTGAGKSTS	sp|P12927|NPH2_VACCW	183	sp|O43933|PEX1_HUMAN Peroxisome biogenesis factor 1 OS=Homo sapiens OX=9606 GN=PEX1 PE=1 SV=1	597	LTGGKGSGKSTL
LTGGTGAGKSTS	sp|P12927|NPH2_VACCW	183	tr|E5RFN6|E5RFN6_HUMAN ATP-binding cassette sub-family A member 10 OS=Homo sapiens OX=9606 GN=ABCA10 PE=1 SV=1	1237	LLGHNGAGKSTS
LTGGTGAGKSTS	sp|P12927|NPH2_VACCW	183	sp|Q8WWZ4|ABCAA_HUMAN ATP-binding cassette sub-family A member 10 OS=Homo sapiens OX=9606 GN=ABCA10 PE=2 SV=3	1237	LLGHNGAGKSTS
LTGGTGAGKSTS	sp|P12927|NPH2_VACCW	183	sp|Q4W5N1|ABCAB_HUMAN Putative ATP-binding cassette sub-family A member 11 OS=Homo sapiens OX=9606 GN=ABCA11P PE=2 SV=1	96	LLGHNGAGKSTS
LTGGTGAGKSTS	sp|P12927|NPH2_VACCW	183	tr|A0A0A0MSU4|A0A0A0MSU4_HUMAN ATP-binding cassette sub-family A member 8 OS=Homo sapiens OX=9606 GN=ABCA8 PE=1 SV=1	1316	LLGHNGAGKSTS
LTGGTGAGKSTS	sp|P12927|NPH2_VACCW	183	sp|O94911|ABCA8_HUMAN ABC-type organic anion transporter ABCA8 OS=Homo sapiens OX=9606 GN=ABCA8 PE=1 SV=4	1321	LLGHNGAGKSTS
SKVVLNFAMEIQ	sp|P68438|RAP94_VACCW	433	tr|A0A0U1RQK4|A0A0U1RQK4_HUMAN [Protein ADP-ribosylarginine] hydrolase-like protein 1 OS=Homo sapiens OX=9606 GN=ADPRHL1 PE=1 SV=1	1404	SKVVLNPAKEPQ
DLDEELMDDDDF	sp|P24758|A26_VACCW	366	tr|A0A087WWS8|A0A087WWS8_HUMAN Protein AATF (Fragment) OS=Homo sapiens OX=9606 GN=AATF PE=1 SV=1	90	DLDEEIFDDDDF
DLDEELMDDDDF	sp|P24758|A26_VACCW	366	sp|Q9NY61|AATF_HUMAN Protein AATF OS=Homo sapiens OX=9606 GN=AATF PE=1 SV=1	452	DLDEEIFDDDDF
DLDEELMDDDDF	sp|P24758|A26_VACCW	366	tr|A0A087WTH8|A0A087WTH8_HUMAN Protein AATF (Fragment) OS=Homo sapiens OX=9606 GN=AATF PE=1 SV=1	14	DLDEEIFDDDDF
IFLFSRGKNIVD	sp|P68710|A20_VACCW	86	tr|B4DZ96|B4DZ96_HUMAN Tubulin--tyrosine ligase-like protein 9 OS=Homo sapiens OX=9606 GN=TTLL9 PE=2 SV=1	159	IFLFRRLKDIVD
IFLFSRGKNIVD	sp|P68710|A20_VACCW	86	sp|Q3SXZ7|TTLL9_HUMAN Probable tubulin polyglutamylase TTLL9 OS=Homo sapiens OX=9606 GN=TTLL9 PE=2 SV=3	177	IFLFRRLKDIVD
IFLFSRGKNIVD	sp|P68710|A20_VACCW	86	tr|A0A2R8Y6A5|A0A2R8Y6A5_HUMAN Tubulin--tyrosine ligase-like protein 9 OS=Homo sapiens OX=9606 GN=TTLL9 PE=3 SV=1	159	IFLFRRLKDIVD
IFLFSRGKNIVD	sp|P68710|A20_VACCW	86	tr|A0A087WXF5|A0A087WXF5_HUMAN Tubulin--tyrosine ligase-like protein 9 OS=Homo sapiens OX=9606 GN=TTLL9 PE=3 SV=1	159	IFLFRRLKDIVD
SNDVLEIADLKY	sp|P68716|G7_VACCW	153	sp|P14410|SUIS_HUMAN Sucrase-isomaltase, intestinal OS=Homo sapiens OX=9606 GN=SI PE=1 SV=6	910	SNQVLLIADLKL
LRSKRDFRKFLV	sp|P24362|KRB2_VACCW	228	tr|V9GYF8|V9GYF8_HUMAN Rab GDP dissociation inhibitor (Fragment) OS=Homo sapiens OX=9606 GN=GDI2 PE=1 SV=1	112	LFEKRRFRKFLV
LRSKRDFRKFLV	sp|P24362|KRB2_VACCW	228	tr|Q5SX86|Q5SX86_HUMAN Rab GDP dissociation inhibitor (Fragment) OS=Homo sapiens OX=9606 GN=GDI2 PE=1 SV=1	98	LFEKRRFRKFLV
LRSKRDFRKFLV	sp|P24362|KRB2_VACCW	228	tr|Q5SX87|Q5SX87_HUMAN Rab GDP dissociation inhibitor (Fragment) OS=Homo sapiens OX=9606 GN=GDI2 PE=1 SV=1	124	LFEKRRFRKFLV
LRSKRDFRKFLV	sp|P24362|KRB2_VACCW	228	sp|P50395|GDIB_HUMAN Rab GDP dissociation inhibitor beta OS=Homo sapiens OX=9606 GN=GDI2 PE=1 SV=2	134	LFEKRRFRKFLV
