query	query_seqname	query_start	target_seqname	target_start	target
IPISSVPLKSSL	sp|P21604|E2_VACCW	349	tr|A0A494BZU9|A0A494BZU9_HUMAN Nuclear pore complex protein Nup214 (Fragment) OS=Homo sapiens OX=9606 GN=NUP214 PE=1 SV=1	522	APPSSVPLKSSV
IPISSVPLKSSL	sp|P21604|E2_VACCW	349	sp|P35658|NU214_HUMAN Nuclear pore complex protein Nup214 OS=Homo sapiens OX=9606 GN=NUP214 PE=1 SV=2	632	APPSSVPLKSSV
IPISSVPLKSSL	sp|P21604|E2_VACCW	349	tr|A0A0A0MSW3|A0A0A0MSW3_HUMAN Nuclear pore complex protein Nup214 OS=Homo sapiens OX=9606 GN=NUP214 PE=1 SV=1	61	APPSSVPLKSSV
IPISSVPLKSSL	sp|P21604|E2_VACCW	349	tr|A0A494C1F2|A0A494C1F2_HUMAN Nuclear pore complex protein Nup214 OS=Homo sapiens OX=9606 GN=NUP214 PE=1 SV=1	620	APPSSVPLKSSV
VKDGFHYIEGSV	sp|Q805H7|C23L_VACCW	213	sp|Q9UJW2|TINAG_HUMAN Tubulointerstitial nephritis antigen OS=Homo sapiens OX=9606 GN=TINAG PE=2 SV=3	121	FKDGQHYEEGSV
VKDGFHYIEGSV	sp|Q805H7|C23L_VACCW	213	tr|Q5T471|Q5T471_HUMAN Tubulointerstitial nephritis antigen OS=Homo sapiens OX=9606 GN=TINAG PE=1 SV=1	117	FKDGQHYEEGSV
VKDGFHYIEGSV	sp|Q805H7|C23L_VACCW	213	tr|Q5T466|Q5T466_HUMAN Tubulointerstitial nephritis antigen OS=Homo sapiens OX=9606 GN=TINAG PE=1 SV=1	103	FKDGQHYEEGSV
SGKKTEDFLSNQ	sp|Q80HV2|VITF3_VACCW	151	sp|Q9NZ63|TLS1_HUMAN Telomere length and silencing protein 1 homolog OS=Homo sapiens OX=9606 GN=C9orf78 PE=1 SV=1	157	SAKKTEEMLSNQ
KSIPTTENFLSI	sp|P04298|MCEL_VACCW	730	sp|Q6IQ21|ZN770_HUMAN Zinc finger protein 770 OS=Homo sapiens OX=9606 GN=ZNF770 PE=1 SV=1	420	KGILTTENILSI
KQMEENKGLIVY	sp|P21604|E2_VACCW	443	tr|A0A0C4DGG8|A0A0C4DGG8_HUMAN Cell division cycle and apoptosis regulator protein 1 (Fragment) OS=Homo sapiens OX=9606 GN=CCAR1 PE=1 SV=1	1001	KDVEENVGLIVY
KQMEENKGLIVY	sp|P21604|E2_VACCW	443	sp|Q8IX12|CCAR1_HUMAN Cell division cycle and apoptosis regulator protein 1 OS=Homo sapiens OX=9606 GN=CCAR1 PE=1 SV=2	1016	KDVEENVGLIVY
QHLYEKVDLTEE	sp|P68456|G2_VACCW	54	tr|H0YKA5|H0YKA5_HUMAN Ras GTPase-activating-like protein IQGAP1 (Fragment) OS=Homo sapiens OX=9606 GN=IQGAP1 PE=1 SV=1	25	QDLYGKVDFTEE
QHLYEKVDLTEE	sp|P68456|G2_VACCW	54	tr|A0A0J9YXZ5|A0A0J9YXZ5_HUMAN Ras GTPase-activating-like protein IQGAP1 OS=Homo sapiens OX=9606 GN=IQGAP1 PE=1 SV=1	169	QDLYGKVDFTEE
QHLYEKVDLTEE	sp|P68456|G2_VACCW	54	sp|P46940|IQGA1_HUMAN Ras GTPase-activating-like protein IQGAP1 OS=Homo sapiens OX=9606 GN=IQGAP1 PE=1 SV=1	169	QDLYGKVDFTEE
TQLSTSPSPGAA	sp|P29191|A4_VACCW	209	tr|F8W7X8|F8W7X8_HUMAN Serine/threonine-protein kinase tousled-like 1 OS=Homo sapiens OX=9606 GN=TLK1 PE=1 SV=1	17	SQLSTSPTPGSA
TQLSTSPSPGAA	sp|P29191|A4_VACCW	209	sp|Q9UKI8|TLK1_HUMAN Serine/threonine-protein kinase tousled-like 1 OS=Homo sapiens OX=9606 GN=TLK1 PE=1 SV=2	17	SQLSTSPTPGSA
TQLSTSPSPGAA	sp|P29191|A4_VACCW	209	tr|B3KRP1|B3KRP1_HUMAN Serine/threonine-protein kinase tousled-like 1 OS=Homo sapiens OX=9606 GN=TLK1 PE=1 SV=1	17	SQLSTSPTPGSA
VLNPPPRPKQPQ	sp|P21117|ATI3_VACCW	20	sp|Q9UDV7|ZN282_HUMAN Zinc finger protein 282 OS=Homo sapiens OX=9606 GN=ZNF282 PE=1 SV=3	400	VKNPPPAPPQPQ
ISWDTGISASRV	sp|P68440|D13_VACCW	535	tr|A0A3B3IU90|A0A3B3IU90_HUMAN WW domain-binding protein 1-like OS=Homo sapiens OX=9606 GN=WBP1L PE=1 SV=1	200	QSWLTAISASRV
IKLVVHSLTRLL	sp|P12848|RIR1_VACCW	469	sp|Q9BU79|TM243_HUMAN Transmembrane protein 243 OS=Homo sapiens OX=9606 GN=TMEM243 PE=1 SV=1	30	INLVVGSLTSLL
IKLVVHSLTRLL	sp|P12848|RIR1_VACCW	469	tr|C9JY04|C9JY04_HUMAN Transmembrane protein 243 OS=Homo sapiens OX=9606 GN=TMEM243 PE=1 SV=1	30	INLVVGSLTSLL
FLRELLCCESHA	sp|P26672|A46_VACCW	149	sp|P50479|PDLI4_HUMAN PDZ and LIM domain protein 4 OS=Homo sapiens OX=9606 GN=PDLIM4 PE=1 SV=2	295	FLDERLYCESHA
RRANILRALLYV	sp|P21607|E6_VACCW	171	sp|Q8IZ69|TRM2A_HUMAN tRNA (uracil-5-)-methyltransferase homolog A OS=Homo sapiens OX=9606 GN=TRMT2A PE=1 SV=2	525	RRAKNLRRLLYV
RRANILRALLYV	sp|P21607|E6_VACCW	171	tr|F2Z2W7|F2Z2W7_HUMAN tRNA (uracil-5-)-methyltransferase homolog A OS=Homo sapiens OX=9606 GN=TRMT2A PE=1 SV=1	543	RRAKNLRRLLYV
VDDVDSYATQLN	sp|P16272|DNLI_VACCW	108	tr|A0A6Q8PFA6|A0A6Q8PFA6_HUMAN Kinesin-like protein OS=Homo sapiens OX=9606 GN=KIF2A PE=1 SV=1	634	DYDVDSYATQLE
VDDVDSYATQLN	sp|P16272|DNLI_VACCW	108	sp|O00139|KIF2A_HUMAN Kinesin-like protein KIF2A OS=Homo sapiens OX=9606 GN=KIF2A PE=1 SV=3	653	DYDVDSYATQLE
VDDVDSYATQLN	sp|P16272|DNLI_VACCW	108	tr|A0A6Q8PGH7|A0A6Q8PGH7_HUMAN Kinesin-like protein (Fragment) OS=Homo sapiens OX=9606 GN=KIF2A PE=1 SV=1	632	DYDVDSYATQLE
VDDVDSYATQLN	sp|P16272|DNLI_VACCW	108	tr|A0A6Q8PH57|A0A6Q8PH57_HUMAN Kinesin-like protein OS=Homo sapiens OX=9606 GN=KIF2A PE=1 SV=1	672	DYDVDSYATQLE
VDDVDSYATQLN	sp|P16272|DNLI_VACCW	108	tr|A0A6Q8PG37|A0A6Q8PG37_HUMAN Kinesin-like protein OS=Homo sapiens OX=9606 GN=KIF2A PE=1 SV=1	664	DYDVDSYATQLE
VDDVDSYATQLN	sp|P16272|DNLI_VACCW	108	tr|A0A6Q8PGG1|A0A6Q8PGG1_HUMAN Kinesin-like protein KIF2A OS=Homo sapiens OX=9606 GN=KIF2A PE=1 SV=1	537	DYDVDSYATQLE
SGTGQSSDDMSR	sp|Q80HU9|ATI4_VACCW	61	sp|Q9H4Z2|ZN335_HUMAN Zinc finger protein 335 OS=Homo sapiens OX=9606 GN=ZNF335 PE=1 SV=1	54	SGVGQSSDRGSR
KSRRLAESLLVR	sp|P26670|3BHS_VACCW	149	tr|F8VUX9|F8VUX9_HUMAN WD repeat-containing protein 90 OS=Homo sapiens OX=9606 GN=WDR90 PE=1 SV=1	164	KSIRLCASLLVR
KSRRLAESLLVR	sp|P26670|3BHS_VACCW	149	sp|Q96KV7|WDR90_HUMAN WD repeat-containing protein 90 OS=Homo sapiens OX=9606 GN=WDR90 PE=1 SV=2	164	KSIRLCASLLVR
NPFVPSFNIEVR	sp|P07617|MCE_VACCW	198	sp|O43164|PJA2_HUMAN E3 ubiquitin-protein ligase Praja-2 OS=Homo sapiens OX=9606 GN=PJA2 PE=1 SV=4	216	SPPVPSFNCEVR
ELKQSSPDLLLI	sp|P16712|A18_VACCW	171	tr|A0A6Q8PGT7|A0A6Q8PGT7_HUMAN Mitochondrial import inner membrane translocase subunit Tim23B OS=Homo sapiens OX=9606 GN=TIMM23B-AGAP6 PE=4 SV=1	61	ELKQSSPLSLLS
SLNMDDLEDTLF	sp|P26671|A43_VACCW	67	sp|Q9P2J3|KLHL9_HUMAN Kelch-like protein 9 OS=Homo sapiens OX=9606 GN=KLHL9 PE=1 SV=2	116	SLNMDNLQDTLE
SLNMDDLEDTLF	sp|P26671|A43_VACCW	67	tr|A0A0C4DG80|A0A0C4DG80_HUMAN Kelch-like protein 13 OS=Homo sapiens OX=9606 GN=KLHL13 PE=1 SV=1	107	SLNMDNLQDTLE
SLNMDDLEDTLF	sp|P26671|A43_VACCW	67	sp|Q9P2N7|KLH13_HUMAN Kelch-like protein 13 OS=Homo sapiens OX=9606 GN=KLHL13 PE=1 SV=3	158	SLNMDNLQDTLE
SISKVVLNFAME	sp|P68438|RAP94_VACCW	431	tr|A0A0U1RQK4|A0A0U1RQK4_HUMAN [Protein ADP-ribosylarginine] hydrolase-like protein 1 OS=Homo sapiens OX=9606 GN=ADPRHL1 PE=1 SV=1	1402	SGSKVVLNPAKE
SLAYKEIITAPL	sp|P16715|P4A_VACCW	176	sp|Q13085|ACACA_HUMAN Acetyl-CoA carboxylase 1 OS=Homo sapiens OX=9606 GN=ACACA PE=1 SV=2	1808	SLAYNEIITISL
SLAYKEIITAPL	sp|P16715|P4A_VACCW	176	tr|Q59FY4|Q59FY4_HUMAN Acetyl-CoA carboxylase 1 (Fragment) OS=Homo sapiens OX=9606 GN=ACACA PE=1 SV=1	460	SLAYNEIITISL
TSSTSVLSSPLT	sp|Q80HV3|RUVV_VACCW	6	tr|A2A2F0|A2A2F0_HUMAN Ral GTPase-activating protein subunit beta (Fragment) OS=Homo sapiens OX=9606 GN=RALGAPB PE=1 SV=1	241	TSSTSPLSSPNQ
TSSTSVLSSPLT	sp|Q80HV3|RUVV_VACCW	6	sp|Q86X10|RLGPB_HUMAN Ral GTPase-activating protein subunit beta OS=Homo sapiens OX=9606 GN=RALGAPB PE=1 SV=1	413	TSSTSPLSSPNQ
TSSTSVLSSPLT	sp|Q80HV3|RUVV_VACCW	6	tr|A0A1B0GU45|A0A1B0GU45_HUMAN Inositol 1,4,5-triphosphate receptor-associated 2 OS=Homo sapiens OX=9606 GN=IRAG2 PE=1 SV=1	96	TPSTSHLSSPET
ITDEITKNVEDQ	sp|P24762|A37_VACCW	33	sp|Q9BTE3|MCMBP_HUMAN Mini-chromosome maintenance complex-binding protein OS=Homo sapiens OX=9606 GN=MCMBP PE=1 SV=2	565	ISDEITKAVEDD
SNGGGGVWGGGS	sp|P17356|V018_VACCW	30	sp|O14497|ARI1A_HUMAN AT-rich interactive domain-containing protein 1A OS=Homo sapiens OX=9606 GN=ARID1A PE=1 SV=3	79	SNGGGGGGGAGS
SNGGGGVWGGGS	sp|P17356|V018_VACCW	30	sp|P09651|ROA1_HUMAN Heterogeneous nuclear ribonucleoprotein A1 OS=Homo sapiens OX=9606 GN=HNRNPA1 PE=1 SV=5	291	NNGGGGGFGGGS
SNGGGGVWGGGS	sp|P17356|V018_VACCW	30	sp|Q8IXZ3|SP8_HUMAN Transcription factor Sp8 OS=Homo sapiens OX=9606 GN=SP8 PE=1 SV=3	137	SGGGGGGGGGGS
SNGGGGVWGGGS	sp|P17356|V018_VACCW	30	sp|P18146|EGR1_HUMAN Early growth response protein 1 OS=Homo sapiens OX=9606 GN=EGR1 PE=1 SV=1	66	SSGGGGGGGGGS
SNGGGGVWGGGS	sp|P17356|V018_VACCW	30	sp|Q9UHB9|SRP68_HUMAN Signal recognition particle subunit SRP68 OS=Homo sapiens OX=9606 GN=SRP68 PE=1 SV=2	16	SGGGGGSGGGGS
SNGGGGVWGGGS	sp|P17356|V018_VACCW	30	tr|K7EQC2|K7EQC2_HUMAN Signal recognition particle subunit SRP68 OS=Homo sapiens OX=9606 GN=SRP68 PE=1 SV=1	16	SGGGGGSGGGGS
SNGGGGVWGGGS	sp|P17356|V018_VACCW	30	tr|K7EN53|K7EN53_HUMAN Signal recognition particle subunit SRP68 OS=Homo sapiens OX=9606 GN=SRP68 PE=1 SV=1	16	SGGGGGSGGGGS
SNGGGGVWGGGS	sp|P17356|V018_VACCW	30	sp|Q6NUN9|ZN746_HUMAN Zinc finger protein 746 OS=Homo sapiens OX=9606 GN=ZNF746 PE=1 SV=1	492	SGGGGGGSGGGS
SNGGGGVWGGGS	sp|P17356|V018_VACCW	30	tr|A0A2R8YDQ5|A0A2R8YDQ5_HUMAN Zinc finger protein 746 OS=Homo sapiens OX=9606 GN=ZNF746 PE=1 SV=1	507	SGGGGGGSGGGS
SNGGGGVWGGGS	sp|P17356|V018_VACCW	30	sp|P23490|LORI_HUMAN Loricrin OS=Homo sapiens OX=9606 GN=LORICRIN PE=1 SV=2	130	SSGGGGSSGGGS
SNGGGGVWGGGS	sp|P17356|V018_VACCW	30	sp|P23490|LORI_HUMAN Loricrin OS=Homo sapiens OX=9606 GN=LORICRIN PE=1 SV=2	115	SSGGGGSSGGGS
SNGGGGVWGGGS	sp|P17356|V018_VACCW	30	sp|Q92908|GATA6_HUMAN Transcription factor GATA-6 OS=Homo sapiens OX=9606 GN=GATA6 PE=1 SV=2	287	SGGAGGVSGGGS
SNGGGGVWGGGS	sp|P17356|V018_VACCW	30	tr|A0A1B0GVI3|A0A1B0GVI3_HUMAN Keratin, type I cytoskeletal 10 (Fragment) OS=Homo sapiens OX=9606 GN=KRT10 PE=1 SV=1	18	SGGGGGGYGGGS
SNGGGGVWGGGS	sp|P17356|V018_VACCW	30	sp|P13645|K1C10_HUMAN Keratin, type I cytoskeletal 10 OS=Homo sapiens OX=9606 GN=KRT10 PE=1 SV=6	535	SGGGGGGYGGGS
KNGKCIIINTKA	sp|P03296|C10_VACCW	210	tr|Q5SVL2|Q5SVL2_HUMAN Caspase-7 (Fragment) OS=Homo sapiens OX=9606 GN=CASP7 PE=1 SV=1	66	KLGKCIIINNKN
KNGKCIIINTKA	sp|P03296|C10_VACCW	210	tr|A0A5F9ZHZ6|A0A5F9ZHZ6_HUMAN Caspase-7 OS=Homo sapiens OX=9606 GN=CASP7 PE=1 SV=1	65	KLGKCIIINNKN
KNGKCIIINTKA	sp|P03296|C10_VACCW	210	sp|P55210|CASP7_HUMAN Caspase-7 OS=Homo sapiens OX=9606 GN=CASP7 PE=1 SV=1	66	KLGKCIIINNKN
KNGKCIIINTKA	sp|P03296|C10_VACCW	210	tr|A0A0A0MRL7|A0A0A0MRL7_HUMAN Caspase-7 OS=Homo sapiens OX=9606 GN=CASP7 PE=1 SV=1	151	KLGKCIIINNKN
GHERDLCDVVIT	sp|Q01219|A51_VACCW	115	sp|Q8IZU8|DSEL_HUMAN Dermatan-sulfate epimerase-like protein OS=Homo sapiens OX=9606 GN=DSEL PE=2 SV=2	847	GHHMDLPDVVIT
SLAHELKQSSPD	sp|P16712|A18_VACCW	167	sp|Q96NM4|TOX2_HUMAN TOX high mobility group box family member 2 OS=Homo sapiens OX=9606 GN=TOX2 PE=1 SV=2	295	SLGEEQKQSSPD
REVKLRIGPRYV	sp|P16272|DNLI_VACCW	152	sp|Q13394|MB211_HUMAN Putative nucleotidyltransferase MAB21L1 OS=Homo sapiens OX=9606 GN=MAB21L1 PE=1 SV=1	156	SEVKLRIRDRYV
REVKLRIGPRYV	sp|P16272|DNLI_VACCW	152	sp|Q9Y586|MB212_HUMAN Protein mab-21-like 2 OS=Homo sapiens OX=9606 GN=MAB21L2 PE=1 SV=1	156	SEVKLRIRERYV
SESIDFSLLKTK	sp|P68615|A32_VACCW	75	tr|A0A0A0MRJ3|A0A0A0MRJ3_HUMAN Neuron navigator 1 OS=Homo sapiens OX=9606 GN=NAV1 PE=1 SV=1	708	SSSIDPSLLSTK
SESIDFSLLKTK	sp|P68615|A32_VACCW	75	sp|Q8NEY1|NAV1_HUMAN Neuron navigator 1 OS=Homo sapiens OX=9606 GN=NAV1 PE=1 SV=2	695	SSSIDPSLLSTK
SESIDFSLLKTK	sp|P68615|A32_VACCW	75	tr|H0Y6F6|H0Y6F6_HUMAN Neuron navigator 1 (Fragment) OS=Homo sapiens OX=9606 GN=NAV1 PE=1 SV=1	253	SSSIDPSLLSTK
LNNSNIEKISLV	sp|P17366|P28_VACCW	8	tr|C9JW92|C9JW92_HUMAN Shugoshin 2 (Fragment) OS=Homo sapiens OX=9606 GN=SGO2 PE=1 SV=1	44	LNNSSIFKISLK
LNNSNIEKISLV	sp|P17366|P28_VACCW	8	sp|Q562F6|SGO2_HUMAN Shugoshin 2 OS=Homo sapiens OX=9606 GN=SGO2 PE=1 SV=2	44	LNNSSIFKISLK
FVSRIVDEVLVV	sp|P68440|D13_VACCW	287	sp|Q5T6L9|EMARD_HUMAN Endoplasmic reticulum membrane-associated RNA degradation protein OS=Homo sapiens OX=9606 GN=ERMARD PE=2 SV=1	524	FCPRIVLEVLVV
FVSRIVDEVLVV	sp|P68440|D13_VACCW	287	tr|K7ERF7|K7ERF7_HUMAN Endoplasmic reticulum membrane-associated RNA degradation protein OS=Homo sapiens OX=9606 GN=ERMARD PE=1 SV=1	388	FCPRIVLEVLVV
NVYAASIYNLSS	sp|P68438|RAP94_VACCW	38	tr|J3KNJ3|J3KNJ3_HUMAN N-acetylated-alpha-linked acidic dipeptidase 2 OS=Homo sapiens OX=9606 GN=NAALAD2 PE=1 SV=1	562	KNYAASIYNLSK
NVYAASIYNLSS	sp|P68438|RAP94_VACCW	38	sp|Q9Y3Q0|NALD2_HUMAN N-acetylated-alpha-linked acidic dipeptidase 2 OS=Homo sapiens OX=9606 GN=NAALAD2 PE=1 SV=1	595	KNYAASIYNLSK
EVSSANYTVLSS	sp|P04318|MCES_VACCW	224	sp|P11831|SRF_HUMAN Serum response factor OS=Homo sapiens OX=9606 GN=SRF PE=1 SV=1	314	AVSSANGTVLKS
TNLEIKILSKGG	sp|P68462|I6_VACCW	284	sp|P50135|HNMT_HUMAN Histamine N-methyltransferase OS=Homo sapiens OX=9606 GN=HNMT PE=1 SV=1	50	TKSEIKILSIGG
VDAKELVRSIPY	sp|P24772|B14_VACCW	66	sp|Q9H3K2|GHITM_HUMAN Growth hormone-inducible transmembrane protein OS=Homo sapiens OX=9606 GN=GHITM PE=1 SV=2	171	VGAGMLVRSIPY
GIGIRILSISYM	sp|P24356|F1_VACCW	142	sp|Q8NDH2|CC168_HUMAN Coiled-coil domain-containing protein 168 OS=Homo sapiens OX=9606 GN=CCDC168 PE=2 SV=2	1512	GIFIRSLSISIM
GNDLLFVLRQIG	sp|P04305|D5_VACCW	7	sp|Q15075|EEA1_HUMAN Early endosome antigen 1 OS=Homo sapiens OX=9606 GN=EEA1 PE=1 SV=2	508	QNDLEQVLRQIG
PSPKELESGSLE	sp|P68638|VCP_VACCW	87	tr|C9J0U9|C9J0U9_HUMAN EARP and GARP complex-interacting protein 1 (Fragment) OS=Homo sapiens OX=9606 GN=EIPR1 PE=1 SV=1	134	RMPKELESGSHE
PSPKELESGSLE	sp|P68638|VCP_VACCW	87	sp|Q53HC9|EIPR1_HUMAN EARP and GARP complex-interacting protein 1 OS=Homo sapiens OX=9606 GN=EIPR1 PE=1 SV=2	100	RMPKELESGSHE
PSPKELESGSLE	sp|P68638|VCP_VACCW	87	tr|A8MUM1|A8MUM1_HUMAN EARP and GARP complex-interacting protein 1 OS=Homo sapiens OX=9606 GN=EIPR1 PE=1 SV=2	127	RMPKELESGSHE
PSPKELESGSLE	sp|P68638|VCP_VACCW	87	tr|D3YTH5|D3YTH5_HUMAN EARP and GARP complex-interacting protein 1 OS=Homo sapiens OX=9606 GN=EIPR1 PE=1 SV=1	100	RMPKELESGSHE
CEKWKDDLDKLK	sp|P24759|ATI_VACCW	568	sp|Q5W0B1|OBI1_HUMAN ORC ubiquitin ligase 1 OS=Homo sapiens OX=9606 GN=OBI1 PE=1 SV=1	171	YEKVKDDVDKLK
SLNALKREIEDD	sp|P24759|ATI_VACCW	605	sp|Q16594|TAF9_HUMAN Transcription initiation factor TFIID subunit 9 OS=Homo sapiens OX=9606 GN=TAF9 PE=1 SV=1	240	SSNALKRKREDD
SKTLSVQPLLDL	sp|P68317|RP07_VACCW	51	sp|Q5T3U5|MRP7_HUMAN ATP-binding cassette sub-family C member 10 OS=Homo sapiens OX=9606 GN=ABCC10 PE=1 SV=1	73	SFLLSVFPLLDL
NDVKKGRIDYYL	sp|P21604|E2_VACCW	243	tr|J3KSW2|J3KSW2_HUMAN DNA polymerase iota OS=Homo sapiens OX=9606 GN=POLI PE=1 SV=1	339	NTAKKGLIDYYL
NDVKKGRIDYYL	sp|P21604|E2_VACCW	243	tr|J3KQ09|J3KQ09_HUMAN DNA polymerase iota OS=Homo sapiens OX=9606 GN=POLI PE=1 SV=1	363	NTAKKGLIDYYL
NDVKKGRIDYYL	sp|P21604|E2_VACCW	243	tr|X6R2I3|X6R2I3_HUMAN DNA polymerase iota (Fragment) OS=Homo sapiens OX=9606 GN=POLI PE=1 SV=2	380	NTAKKGLIDYYL
NDVKKGRIDYYL	sp|P21604|E2_VACCW	243	sp|Q9UNA4|POLI_HUMAN DNA polymerase iota OS=Homo sapiens OX=9606 GN=POLI PE=1 SV=3	442	NTAKKGLIDYYL
EEADNEVDYEPE	sp|P07617|MCE_VACCW	14	tr|B8ZZQ6|B8ZZQ6_HUMAN Prothymosin alpha OS=Homo sapiens OX=9606 GN=PTMA PE=1 SV=1	46	QEADNEVDEEEE
EEADNEVDYEPE	sp|P07617|MCE_VACCW	14	tr|B8ZZA1|B8ZZA1_HUMAN Prothymosin alpha OS=Homo sapiens OX=9606 GN=PTMA PE=1 SV=1	67	QEADNEVDEEEE
EEADNEVDYEPE	sp|P07617|MCE_VACCW	14	sp|P06454|PTMA_HUMAN Prothymosin alpha OS=Homo sapiens OX=9606 GN=PTMA PE=1 SV=2	47	QEADNEVDEEEE
EEADNEVDYEPE	sp|P07617|MCE_VACCW	14	tr|H7C2N1|H7C2N1_HUMAN Prothymosin alpha (Fragment) OS=Homo sapiens OX=9606 GN=PTMA PE=1 SV=1	84	QEADNEVDEEEE
EEADNEVDYEPE	sp|P07617|MCE_VACCW	14	tr|B8ZZW7|B8ZZW7_HUMAN Prothymosin alpha OS=Homo sapiens OX=9606 GN=PTMA PE=1 SV=1	72	QEADNEVDEEEE
VYAASIYNLSSV	sp|P68438|RAP94_VACCW	39	tr|J3KNJ3|J3KNJ3_HUMAN N-acetylated-alpha-linked acidic dipeptidase 2 OS=Homo sapiens OX=9606 GN=NAALAD2 PE=1 SV=1	563	NYAASIYNLSKK
VYAASIYNLSSV	sp|P68438|RAP94_VACCW	39	sp|Q9Y3Q0|NALD2_HUMAN N-acetylated-alpha-linked acidic dipeptidase 2 OS=Homo sapiens OX=9606 GN=NAALAD2 PE=1 SV=1	596	NYAASIYNLSKK
GGGSSSGMHSGM	sp|P17356|V018_VACCW	38	sp|P13645|K1C10_HUMAN Keratin, type I cytoskeletal 10 OS=Homo sapiens OX=9606 GN=KRT10 PE=1 SV=6	514	GGGSSSGGHGGS
GGGSSSGMHSGM	sp|P17356|V018_VACCW	38	sp|Q96RY5|CRML_HUMAN Protein cramped-like OS=Homo sapiens OX=9606 GN=CRAMP1 PE=1 SV=3	119	GGGSSSGNVSGV
EMSIGISFEIST	sp|Q80HY2|M2_VACCW	39	sp|Q6PI78|TMM65_HUMAN Transmembrane protein 65 OS=Homo sapiens OX=9606 GN=TMEM65 PE=1 SV=2	144	EMSIGIILGIST
RLKNKLPISKLK	sp|P04298|MCEL_VACCW	75	sp|Q9NY47|CA2D2_HUMAN Voltage-dependent calcium channel subunit alpha-2/delta-2 OS=Homo sapiens OX=9606 GN=CACNA2D2 PE=1 SV=2	657	ILQVKLPISKLK
RLKNKLPISKLK	sp|P04298|MCEL_VACCW	75	tr|C9JVC9|C9JVC9_HUMAN Voltage-dependent calcium channel subunit alpha-2/delta-2 OS=Homo sapiens OX=9606 GN=CACNA2D2 PE=1 SV=1	657	ILQVKLPISKLK
LPSIIPRNLINL	sp|P04308|ETF1_VACCW	16	tr|E9PK39|E9PK39_HUMAN Leucine-rich repeat serine/threonine-protein kinase 1 OS=Homo sapiens OX=9606 GN=LRRK1 PE=1 SV=1	293	LPSVIPWGLINL
LPSIIPRNLINL	sp|P04308|ETF1_VACCW	16	tr|E9PMK9|E9PMK9_HUMAN Leucine-rich repeat serine/threonine-protein kinase 1 OS=Homo sapiens OX=9606 GN=LRRK1 PE=1 SV=1	293	LPSVIPWGLINL
LPSIIPRNLINL	sp|P04308|ETF1_VACCW	16	sp|Q38SD2|LRRK1_HUMAN Leucine-rich repeat serine/threonine-protein kinase 1 OS=Homo sapiens OX=9606 GN=LRRK1 PE=1 SV=3	293	LPSVIPWGLINL
MSSSSIFSRKSL	sp|Q76ZP7|RP132_VACCW	915	sp|Q8IW70|T151B_HUMAN Transmembrane protein 151B OS=Homo sapiens OX=9606 GN=TMEM151B PE=2 SV=2	440	VSSSSIFSRSAL
EMISNTSKSLEL	sp|P18377|K4_VACCW	33	tr|A0A3B3IRK4|A0A3B3IRK4_HUMAN Myelin transcription factor 1-like protein (Fragment) OS=Homo sapiens OX=9606 GN=MYT1L PE=1 SV=1	224	EMNSNTSNSLED
EMISNTSKSLEL	sp|P18377|K4_VACCW	33	tr|A0A3B3IU66|A0A3B3IU66_HUMAN Myelin transcription factor 1-like protein OS=Homo sapiens OX=9606 GN=MYT1L PE=1 SV=1	224	EMNSNTSNSLED
EMISNTSKSLEL	sp|P18377|K4_VACCW	33	tr|A0A3B3IRX5|A0A3B3IRX5_HUMAN Myelin transcription factor 1-like protein OS=Homo sapiens OX=9606 GN=MYT1L PE=1 SV=1	224	EMNSNTSNSLED
EMISNTSKSLEL	sp|P18377|K4_VACCW	33	tr|A0A3B3IS14|A0A3B3IS14_HUMAN Myelin transcription factor 1-like protein OS=Homo sapiens OX=9606 GN=MYT1L PE=1 SV=1	224	EMNSNTSNSLED
EMISNTSKSLEL	sp|P18377|K4_VACCW	33	tr|A0A3B3IS61|A0A3B3IS61_HUMAN Myelin transcription factor 1-like protein OS=Homo sapiens OX=9606 GN=MYT1L PE=1 SV=1	224	EMNSNTSNSLED
EMISNTSKSLEL	sp|P18377|K4_VACCW	33	tr|A0A3B3IRM3|A0A3B3IRM3_HUMAN Myelin transcription factor 1-like protein OS=Homo sapiens OX=9606 GN=MYT1L PE=1 SV=1	224	EMNSNTSNSLED
EMISNTSKSLEL	sp|P18377|K4_VACCW	33	tr|A0A3B3ISN1|A0A3B3ISN1_HUMAN Myelin transcription factor 1-like protein (Fragment) OS=Homo sapiens OX=9606 GN=MYT1L PE=1 SV=1	224	EMNSNTSNSLED
EMISNTSKSLEL	sp|P18377|K4_VACCW	33	tr|A0A2R8YF72|A0A2R8YF72_HUMAN Myelin transcription factor 1-like protein OS=Homo sapiens OX=9606 GN=MYT1L PE=1 SV=1	224	EMNSNTSNSLED
EMISNTSKSLEL	sp|P18377|K4_VACCW	33	tr|A0A3B3ISP2|A0A3B3ISP2_HUMAN Myelin transcription factor 1-like protein (Fragment) OS=Homo sapiens OX=9606 GN=MYT1L PE=1 SV=1	56	EMNSNTSNSLED
EMISNTSKSLEL	sp|P18377|K4_VACCW	33	sp|Q9UL68|MYT1L_HUMAN Myelin transcription factor 1-like protein OS=Homo sapiens OX=9606 GN=MYT1L PE=2 SV=3	224	EMNSNTSNSLED
EMISNTSKSLEL	sp|P18377|K4_VACCW	33	tr|A0A3B3ITJ8|A0A3B3ITJ8_HUMAN Myelin transcription factor 1-like protein OS=Homo sapiens OX=9606 GN=MYT1L PE=1 SV=1	223	EMNSNTSNSLED
EMISNTSKSLEL	sp|P18377|K4_VACCW	33	tr|A0A3B3IRT9|A0A3B3IRT9_HUMAN Myelin transcription factor 1-like protein OS=Homo sapiens OX=9606 GN=MYT1L PE=1 SV=1	203	EMNSNTSNSLED
EMISNTSKSLEL	sp|P18377|K4_VACCW	33	tr|A0A3B3ISW5|A0A3B3ISW5_HUMAN Myelin transcription factor 1-like protein OS=Homo sapiens OX=9606 GN=MYT1L PE=1 SV=1	224	EMNSNTSNSLED
SKSIDLFAPKYK	sp|P15058|SPI1_VACCW	240	tr|F5H212|F5H212_HUMAN Zinc finger protein 40 OS=Homo sapiens OX=9606 GN=HIVEP1 PE=1 SV=2	1550	SKSEDCFAPKYQ
SKSIDLFAPKYK	sp|P15058|SPI1_VACCW	240	sp|P15822|ZEP1_HUMAN Zinc finger protein 40 OS=Homo sapiens OX=9606 GN=HIVEP1 PE=1 SV=3	1550	SKSEDCFAPKYQ
VRITHLFSLKKF	sp|Q76ZP7|RP132_VACCW	451	sp|Q9ULD0|OGDHL_HUMAN 2-oxoglutarate dehydrogenase-like, mitochondrial OS=Homo sapiens OX=9606 GN=OGDHL PE=1 SV=3	984	NRNTHLVSLKKF
IYNLSSVSEDEI	sp|P68438|RAP94_VACCW	44	sp|Q86YD3|TMM25_HUMAN Transmembrane protein 25 OS=Homo sapiens OX=9606 GN=TMEM25 PE=1 SV=1	353	IYRVSSVSSDEI
IYNLSSVSEDEI	sp|P68438|RAP94_VACCW	44	tr|H0YC87|H0YC87_HUMAN Transmembrane protein 25 (Fragment) OS=Homo sapiens OX=9606 GN=TMEM25 PE=1 SV=1	187	IYRVSSVSSDEI
LTRVTNIAEKER	sp|Q80HV8|A11_VACCW	38	tr|A0A2R8YEM9|A0A2R8YEM9_HUMAN TPR and ankyrin repeat-containing protein 1 OS=Homo sapiens OX=9606 GN=TRANK1 PE=1 SV=1	2098	LKRVTNNAEKEM
LTRVTNIAEKER	sp|Q80HV8|A11_VACCW	38	sp|O15050|TRNK1_HUMAN TPR and ankyrin repeat-containing protein 1 OS=Homo sapiens OX=9606 GN=TRANK1 PE=2 SV=4	2054	LKRVTNNAEKEM
IYKSCKEKLNRM	sp|Q76ZN5|PROF_VACCW	117	tr|A0A087WW00|A0A087WW00_HUMAN Ubiquitin-conjugating enzyme E2 D1 OS=Homo sapiens OX=9606 GN=UBE2D1 PE=1 SV=1	88	IYKSDKEKYNRH
IYKSCKEKLNRM	sp|Q76ZN5|PROF_VACCW	117	sp|P51668|UB2D1_HUMAN Ubiquitin-conjugating enzyme E2 D1 OS=Homo sapiens OX=9606 GN=UBE2D1 PE=1 SV=1	126	IYKSDKEKYNRH
NGGGGVWGGGSS	sp|P17356|V018_VACCW	31	sp|P09651|ROA1_HUMAN Heterogeneous nuclear ribonucleoprotein A1 OS=Homo sapiens OX=9606 GN=HNRNPA1 PE=1 SV=5	292	NGGGGGFGGGSG
NGGGGVWGGGSS	sp|P17356|V018_VACCW	31	sp|Q9UI36|DACH1_HUMAN Dachshund homolog 1 OS=Homo sapiens OX=9606 GN=DACH1 PE=1 SV=4	91	NGGGGGGGGGGS
NGGGGVWGGGSS	sp|P17356|V018_VACCW	31	sp|P31277|HXD11_HUMAN Homeobox protein Hox-D11 OS=Homo sapiens OX=9606 GN=HOXD11 PE=3 SV=3	78	GGGGGSAGGGSS
NGGGGVWGGGSS	sp|P17356|V018_VACCW	31	sp|P23490|LORI_HUMAN Loricrin OS=Homo sapiens OX=9606 GN=LORICRIN PE=1 SV=2	266	SGGGSVCGGGSS
NGGGGVWGGGSS	sp|P17356|V018_VACCW	31	sp|Q5VUJ6|LRCH2_HUMAN Leucine-rich repeat and calponin homology domain-containing protein 2 OS=Homo sapiens OX=9606 GN=LRCH2 PE=1 SV=2	11	SGGGGCGGGGSS
NGGGGVWGGGSS	sp|P17356|V018_VACCW	31	sp|Q8IXZ3|SP8_HUMAN Transcription factor Sp8 OS=Homo sapiens OX=9606 GN=SP8 PE=1 SV=3	138	GGGGGGGGGGSS
NGGGGVWGGGSS	sp|P17356|V018_VACCW	31	sp|Q9BZ72|PITM2_HUMAN Membrane-associated phosphatidylinositol transfer protein 2 OS=Homo sapiens OX=9606 GN=PITPNM2 PE=1 SV=1	613	GGGGGGGGGGSS
NGGGGVWGGGSS	sp|P17356|V018_VACCW	31	sp|Q12906|ILF3_HUMAN Interleukin enhancer-binding factor 3 OS=Homo sapiens OX=9606 GN=ILF3 PE=1 SV=3	700	SGGGGGGGGGSS
NGGGGVWGGGSS	sp|P17356|V018_VACCW	31	tr|A0A0G2JNJ7|A0A0G2JNJ7_HUMAN CCR4-NOT transcription complex subunit 3 (Fragment) OS=Homo sapiens OX=9606 GN=CNOT3 PE=1 SV=1	320	GGGGGSGGGGSS
NGGGGVWGGGSS	sp|P17356|V018_VACCW	31	tr|H7C148|H7C148_HUMAN CCR4-NOT transcription complex subunit 3 (Fragment) OS=Homo sapiens OX=9606 GN=CNOT3 PE=1 SV=2	399	GGGGGSGGGGSS
NGGGGVWGGGSS	sp|P17356|V018_VACCW	31	sp|O75175|CNOT3_HUMAN CCR4-NOT transcription complex subunit 3 OS=Homo sapiens OX=9606 GN=CNOT3 PE=1 SV=1	398	GGGGGSGGGGSS
NGGGGVWGGGSS	sp|P17356|V018_VACCW	31	tr|H7C3F5|H7C3F5_HUMAN CCR4-NOT transcription complex subunit 3 OS=Homo sapiens OX=9606 GN=CNOT3 PE=1 SV=2	217	GGGGGSGGGGSS
NGGGGVWGGGSS	sp|P17356|V018_VACCW	31	tr|A0A2H2FJL5|A0A2H2FJL5_HUMAN CCR4-NOT transcription complex subunit 3 OS=Homo sapiens OX=9606 GN=CNOT3 PE=1 SV=1	217	GGGGGSGGGGSS
NGGGGVWGGGSS	sp|P17356|V018_VACCW	31	tr|B7Z6J7|B7Z6J7_HUMAN CCR4-NOT transcription complex subunit 3 OS=Homo sapiens OX=9606 GN=CNOT3 PE=1 SV=1	398	GGGGGSGGGGSS
NGGGGVWGGGSS	sp|P17356|V018_VACCW	31	sp|Q92908|GATA6_HUMAN Transcription factor GATA-6 OS=Homo sapiens OX=9606 GN=GATA6 PE=1 SV=2	288	GGAGGVSGGGSS
NGGGGVWGGGSS	sp|P17356|V018_VACCW	31	tr|A0A1B0GVI3|A0A1B0GVI3_HUMAN Keratin, type I cytoskeletal 10 (Fragment) OS=Homo sapiens OX=9606 GN=KRT10 PE=1 SV=1	19	GGGGGGYGGGSS
NGGGGVWGGGSS	sp|P17356|V018_VACCW	31	sp|P13645|K1C10_HUMAN Keratin, type I cytoskeletal 10 OS=Homo sapiens OX=9606 GN=KRT10 PE=1 SV=6	536	GGGGGGYGGGSS
NGGGGVWGGGSS	sp|P17356|V018_VACCW	31	sp|Q96CX2|KCD12_HUMAN BTB/POZ domain-containing protein KCTD12 OS=Homo sapiens OX=9606 GN=KCTD12 PE=1 SV=1	12	NGGGGGGGSGSS
DRSEEMGLYLNI	sp|P21604|E2_VACCW	263	sp|Q92729|PTPRU_HUMAN Receptor-type tyrosine-protein phosphatase U OS=Homo sapiens OX=9606 GN=PTPRU PE=1 SV=2	740	QRSEEMGLILGI
SSSSNKSSKTSD	sp|P68619|A36_VACCW	48	tr|H0YKH0|H0YKH0_HUMAN Transducin-like enhancer protein 3 OS=Homo sapiens OX=9606 GN=TLE3 PE=1 SV=1	292	SSSSTPSSKTKD
SSSSNKSSKTSD	sp|P68619|A36_VACCW	48	tr|H0YLI3|H0YLI3_HUMAN Transducin-like enhancer protein 3 OS=Homo sapiens OX=9606 GN=TLE3 PE=1 SV=2	292	SSSSTPSSKTKD
SSSSNKSSKTSD	sp|P68619|A36_VACCW	48	tr|H0YKT5|H0YKT5_HUMAN Transducin-like enhancer protein 3 OS=Homo sapiens OX=9606 GN=TLE3 PE=1 SV=1	297	SSSSTPSSKTKD
SSSSNKSSKTSD	sp|P68619|A36_VACCW	48	tr|H0YLW9|H0YLW9_HUMAN Transducin-like enhancer protein 3 OS=Homo sapiens OX=9606 GN=TLE3 PE=1 SV=1	292	SSSSTPSSKTKD
SSSSNKSSKTSD	sp|P68619|A36_VACCW	48	tr|A0A0D9SES8|A0A0D9SES8_HUMAN Transducin-like enhancer protein 3 OS=Homo sapiens OX=9606 GN=TLE3 PE=1 SV=1	292	SSSSTPSSKTKD
SSSSNKSSKTSD	sp|P68619|A36_VACCW	48	tr|H0YL70|H0YL70_HUMAN Transducin-like enhancer protein 3 OS=Homo sapiens OX=9606 GN=TLE3 PE=1 SV=1	302	SSSSTPSSKTKD
SSSSNKSSKTSD	sp|P68619|A36_VACCW	48	tr|H0YKN8|H0YKN8_HUMAN Transducin-like enhancer protein 3 OS=Homo sapiens OX=9606 GN=TLE3 PE=1 SV=1	298	SSSSTPSSKTKD
SSSSNKSSKTSD	sp|P68619|A36_VACCW	48	tr|H0YNT2|H0YNT2_HUMAN Transducin-like enhancer protein 3 OS=Homo sapiens OX=9606 GN=TLE3 PE=1 SV=1	236	SSSSTPSSKTKD
SSSSNKSSKTSD	sp|P68619|A36_VACCW	48	sp|Q04726|TLE3_HUMAN Transducin-like enhancer protein 3 OS=Homo sapiens OX=9606 GN=TLE3 PE=1 SV=2	292	SSSSTPSSKTKD
SSSSNKSSKTSD	sp|P68619|A36_VACCW	48	tr|A0A140T9E9|A0A140T9E9_HUMAN Bromodomain-containing protein 2 (Fragment) OS=Homo sapiens OX=9606 GN=BRD2 PE=1 SV=1	792	SSSSSSSSDTSD
SSSSNKSSKTSD	sp|P68619|A36_VACCW	48	tr|A0A0G2JK44|A0A0G2JK44_HUMAN Bromodomain-containing protein 2 OS=Homo sapiens OX=9606 GN=BRD2 PE=1 SV=1	821	SSSSSSSSDTSD
SSSSNKSSKTSD	sp|P68619|A36_VACCW	48	sp|P25440|BRD2_HUMAN Bromodomain-containing protein 2 OS=Homo sapiens OX=9606 GN=BRD2 PE=1 SV=2	786	SSSSSSSSDTSD
SSSSNKSSKTSD	sp|P68619|A36_VACCW	48	tr|A0A0G2JHN8|A0A0G2JHN8_HUMAN Bromodomain-containing protein 2 (Fragment) OS=Homo sapiens OX=9606 GN=BRD2 PE=1 SV=1	313	SSSSSSSSDTSD
SSSSNKSSKTSD	sp|P68619|A36_VACCW	48	tr|A0A140T9I1|A0A140T9I1_HUMAN Bromodomain-containing protein 2 (Fragment) OS=Homo sapiens OX=9606 GN=BRD2 PE=1 SV=1	348	SSSSSSSSDTSD
SSSSNKSSKTSD	sp|P68619|A36_VACCW	48	tr|H0Y6K2|H0Y6K2_HUMAN Bromodomain-containing protein 2 (Fragment) OS=Homo sapiens OX=9606 GN=BRD2 PE=1 SV=1	792	SSSSSSSSDTSD
