query	query_seqname	query_start	target_seqname	target_start	target
DDPLVREIARDQ	sp|Q997F2|V_NIPAV	338	sp|P61077|UB2D3_HUMAN Ubiquitin-conjugating enzyme E2 D3 OS=Homo sapiens OX=9606 GN=UBE2D3 PE=1 SV=1	116	DDPLVPEIARIY
DDPLVREIARDQ	sp|Q997F2|V_NIPAV	338	tr|A0A087WY85|A0A087WY85_HUMAN Ubiquitin-conjugating enzyme E2 D3 OS=Homo sapiens OX=9606 GN=UBE2D3 PE=1 SV=1	117	DDPLVPEIARIY
DDPLVREIARDQ	sp|Q997F2|V_NIPAV	338	tr|D6RAH7|D6RAH7_HUMAN Ubiquitin-conjugating enzyme E2 D3 OS=Homo sapiens OX=9606 GN=UBE2D3 PE=1 SV=1	87	DDPLVPEIARIY
DDPLVREIARDQ	sp|Q997F2|V_NIPAV	338	tr|A0A0A0MQU3|A0A0A0MQU3_HUMAN Ubiquitin-conjugating enzyme E2 D2 OS=Homo sapiens OX=9606 GN=UBE2D2 PE=1 SV=1	116	DDPLVPEIARIY
DDPLVREIARDQ	sp|Q997F2|V_NIPAV	338	sp|P62837|UB2D2_HUMAN Ubiquitin-conjugating enzyme E2 D2 OS=Homo sapiens OX=9606 GN=UBE2D2 PE=1 SV=1	116	DDPLVPEIARIY
IKESLTAKENRQ	sp|P0C1C7|W_NIPAV	292	tr|K7EPP6|K7EPP6_HUMAN ELKS/Rab6-interacting/CAST family member 1 (Fragment) OS=Homo sapiens OX=9606 GN=ERC1 PE=1 SV=1	327	LKESLTAKEQRA
IKESLTAKENRQ	sp|P0C1C7|W_NIPAV	292	sp|O15083|ERC2_HUMAN ERC protein 2 OS=Homo sapiens OX=9606 GN=ERC2 PE=1 SV=3	474	LKESLTAKEQRA
IKESLTAKENRQ	sp|P0C1C7|W_NIPAV	292	tr|H7C4G9|H7C4G9_HUMAN ERC protein 2 (Fragment) OS=Homo sapiens OX=9606 GN=ERC2 PE=1 SV=1	113	LKESLTAKEQRA
IKESLTAKENRQ	sp|P0C1C7|W_NIPAV	292	sp|Q8IUD2|RB6I2_HUMAN ELKS/Rab6-interacting/CAST family member 1 OS=Homo sapiens OX=9606 GN=ERC1 PE=1 SV=1	506	LKESLTAKEQRA
IKESLTAKENRQ	sp|P0C1C7|W_NIPAV	292	tr|G8JLD3|G8JLD3_HUMAN ELKS/Rab6-interacting/CAST family member 1 OS=Homo sapiens OX=9606 GN=ERC1 PE=1 SV=1	506	LKESLTAKEQRA
IKESLTAKENRQ	sp|P0C1C7|W_NIPAV	292	tr|X6RLX0|X6RLX0_HUMAN ELKS/Rab6-interacting/CAST family member 1 OS=Homo sapiens OX=9606 GN=ERC1 PE=1 SV=1	506	LKESLTAKEQRA
IKESLTAKENRQ	sp|P0C1C7|W_NIPAV	292	tr|X6RM00|X6RM00_HUMAN ELKS/Rab6-interacting/CAST family member 1 OS=Homo sapiens OX=9606 GN=ERC1 PE=1 SV=1	506	LKESLTAKEQRA
GQVLSKMTRFLT	sp|Q997F0|L_NIPAV	1360	tr|A0A087WVE9|A0A087WVE9_HUMAN Aryl hydrocarbon receptor nuclear translocator 2 OS=Homo sapiens OX=9606 GN=ARNT2 PE=1 SV=1	394	GQVLSVMYRFRT
GQVLSKMTRFLT	sp|Q997F0|L_NIPAV	1360	sp|Q9HBZ2|ARNT2_HUMAN Aryl hydrocarbon receptor nuclear translocator 2 OS=Homo sapiens OX=9606 GN=ARNT2 PE=1 SV=2	394	GQVLSVMYRFRT
LSPSLLCLYKSE	sp|Q997F0|L_NIPAV	210	tr|Q05CH1|Q05CH1_HUMAN ARAP3 protein (Fragment) OS=Homo sapiens OX=9606 GN=ARAP3 PE=1 SV=1	414	LSPGELALYKSE
LSPSLLCLYKSE	sp|Q997F0|L_NIPAV	210	tr|G5E9Y3|G5E9Y3_HUMAN Arf-GAP with Rho-GAP domain, ANK repeat and PH domain-containing protein 3 OS=Homo sapiens OX=9606 GN=ARAP3 PE=1 SV=1	336	LSPGELALYKSE
LSPSLLCLYKSE	sp|Q997F0|L_NIPAV	210	sp|Q8WWN8|ARAP3_HUMAN Arf-GAP with Rho-GAP domain, ANK repeat and PH domain-containing protein 3 OS=Homo sapiens OX=9606 GN=ARAP3 PE=1 SV=1	414	LSPGELALYKSE
EEEVESLEYDEE	sp|Q9IK91|PHOSP_NIPAV	242	sp|Q8N4C8|MINK1_HUMAN Misshapen-like kinase 1 OS=Homo sapiens OX=9606 GN=MINK1 PE=1 SV=2	827	SEEVESSEDDEE
EEEVESLEYDEE	sp|Q9IK91|PHOSP_NIPAV	242	tr|M0R2M5|M0R2M5_HUMAN Transcription elongation factor SPT5 (Fragment) OS=Homo sapiens OX=9606 GN=SUPT5H PE=1 SV=1	46	EEEEEEEEYDEE
EEEVESLEYDEE	sp|Q9IK91|PHOSP_NIPAV	242	sp|O00267|SPT5H_HUMAN Transcription elongation factor SPT5 OS=Homo sapiens OX=9606 GN=SUPT5H PE=1 SV=1	46	EEEEEEEEYDEE
EEEVESLEYDEE	sp|Q9IK91|PHOSP_NIPAV	242	sp|Q8TC90|CCER1_HUMAN Coiled-coil domain-containing glutamate-rich protein 1 OS=Homo sapiens OX=9606 GN=CCER1 PE=1 SV=1	319	EEEVEEAEYVEE
QILLVLGQVVAA	sp|Q9IH62|GLYCP_NIPAV	52	tr|A0A2R8Y8D9|A0A2R8Y8D9_HUMAN Proline and serine-rich protein 3 (Fragment) OS=Homo sapiens OX=9606 GN=PROSER3 PE=1 SV=1	248	QLRGVLGQVVAA
GDAGKSLSSNHY	sp|Q997F0|L_NIPAV	155	tr|C9JSZ1|C9JSZ1_HUMAN Far upstream element-binding protein 1 (Fragment) OS=Homo sapiens OX=9606 GN=FUBP1 PE=1 SV=1	47	GDAGTSLNSNDY
GDAGKSLSSNHY	sp|Q997F0|L_NIPAV	155	tr|E9PEB5|E9PEB5_HUMAN Far upstream element-binding protein 1 OS=Homo sapiens OX=9606 GN=FUBP1 PE=1 SV=1	47	GDAGTSLNSNDY
GDAGKSLSSNHY	sp|Q997F0|L_NIPAV	155	sp|Q96AE4|FUBP1_HUMAN Far upstream element-binding protein 1 OS=Homo sapiens OX=9606 GN=FUBP1 PE=1 SV=3	47	GDAGTSLNSNDY
HIINMLLNLAIE	sp|Q997F0|L_NIPAV	1958	sp|Q9BYT9|ANO3_HUMAN Anoctamin-3 OS=Homo sapiens OX=9606 GN=ANO3 PE=2 SV=2	604	FIIIMLLNLAYE
HIINMLLNLAIE	sp|Q997F0|L_NIPAV	1958	tr|A0A5F9ZHL6|A0A5F9ZHL6_HUMAN Anoctamin OS=Homo sapiens OX=9606 GN=ANO3 PE=1 SV=1	665	FIIIMLLNLAYE
HIINMLLNLAIE	sp|Q997F0|L_NIPAV	1958	tr|E9PQ79|E9PQ79_HUMAN Anoctamin OS=Homo sapiens OX=9606 GN=ANO3 PE=1 SV=1	588	FIIIMLLNLAYE
EVTPMEESDTLE	sp|Q9IK91|PHOSP_NIPAV	463	sp|Q92736|RYR2_HUMAN Ryanodine receptor 2 OS=Homo sapiens OX=9606 GN=RYR2 PE=1 SV=3	1854	AATPEEESDTLE
EVTPMEESDTLE	sp|Q9IK91|PHOSP_NIPAV	463	tr|H7BY35|H7BY35_HUMAN Ryanodine receptor 2 OS=Homo sapiens OX=9606 GN=RYR2 PE=1 SV=2	1838	AATPEEESDTLE
QQEIPGLGPKDT	sp|P0C1C7|W_NIPAV	303	sp|O60488|ACSL4_HUMAN Long-chain-fatty-acid--CoA ligase 4 OS=Homo sapiens OX=9606 GN=ACSL4 PE=1 SV=2	303	CERIPGLGPKDT
PLSTTASLSIIS	sp|Q9IH63|FUS_NIPAV	221	tr|A0A087WUP2|A0A087WUP2_HUMAN Variable charge X-linked protein 3 OS=Homo sapiens OX=9606 GN=VCX3A PE=3 SV=1	123	PLSVTASYSPIS
TLLYTSLALLGA	sp|Q997F0|L_NIPAV	1389	sp|Q5BLP8|CD048_HUMAN Neuropeptide-like protein C4orf48 OS=Homo sapiens OX=9606 GN=C4orf48 PE=1 SV=3	19	LLLLLSLALLGA
FFLSLSWLKHGL	sp|Q997F0|L_NIPAV	1724	sp|Q9HCC8|GDPD2_HUMAN Glycerophosphoinositol inositolphosphodiesterase GDPD2 OS=Homo sapiens OX=9606 GN=GDPD2 PE=2 SV=1	48	FLLSLSWLYIGL
IPGNRSGINKKL	sp|Q9IK91|PHOSP_NIPAV	420	sp|Q6ZTR5|CFA47_HUMAN Cilia- and flagella-associated protein 47 OS=Homo sapiens OX=9606 GN=CFAP47 PE=2 SV=5	1368	IPGSHSGINNKL
VSSQGVSPQVLP	sp|P0C1C7|W_NIPAV	181	tr|J3KQ09|J3KQ09_HUMAN DNA polymerase iota OS=Homo sapiens OX=9606 GN=POLI PE=1 SV=1	35	ASSQGVHDQVLP
VSSQGVSPQVLP	sp|P0C1C7|W_NIPAV	181	sp|Q9UNA4|POLI_HUMAN DNA polymerase iota OS=Homo sapiens OX=9606 GN=POLI PE=1 SV=3	35	ASSQGVHDQVLP
EGEYLPGTKDLR	sp|Q997F0|L_NIPAV	1869	sp|Q92769|HDAC2_HUMAN Histone deacetylase 2 OS=Homo sapiens OX=9606 GN=HDAC2 PE=1 SV=2	202	YGEYFPGTGDLR
EGEYLPGTKDLR	sp|Q997F0|L_NIPAV	1869	tr|Q5TEE2|Q5TEE2_HUMAN Histone deacetylase (Fragment) OS=Homo sapiens OX=9606 GN=HDAC1 PE=1 SV=1	176	YGEYFPGTGDLR
EGEYLPGTKDLR	sp|Q997F0|L_NIPAV	1869	sp|Q13547|HDAC1_HUMAN Histone deacetylase 1 OS=Homo sapiens OX=9606 GN=HDAC1 PE=1 SV=1	201	YGEYFPGTGDLR
GSVQSEPYGAIA	sp|Q9IK91|PHOSP_NIPAV	620	sp|Q9NRR6|INP5E_HUMAN Phosphatidylinositol polyphosphate 5-phosphatase type IV OS=Homo sapiens OX=9606 GN=INPP5E PE=1 SV=2	114	GSVQSEGPGAPA
KESLTAKENRQQ	sp|P0C1C7|W_NIPAV	293	tr|K7EPP6|K7EPP6_HUMAN ELKS/Rab6-interacting/CAST family member 1 (Fragment) OS=Homo sapiens OX=9606 GN=ERC1 PE=1 SV=1	328	KESLTAKEQRAA
KESLTAKENRQQ	sp|P0C1C7|W_NIPAV	293	sp|O15083|ERC2_HUMAN ERC protein 2 OS=Homo sapiens OX=9606 GN=ERC2 PE=1 SV=3	475	KESLTAKEQRAA
KESLTAKENRQQ	sp|P0C1C7|W_NIPAV	293	tr|H7C4G9|H7C4G9_HUMAN ERC protein 2 (Fragment) OS=Homo sapiens OX=9606 GN=ERC2 PE=1 SV=1	114	KESLTAKEQRAA
KESLTAKENRQQ	sp|P0C1C7|W_NIPAV	293	sp|Q8IUD2|RB6I2_HUMAN ELKS/Rab6-interacting/CAST family member 1 OS=Homo sapiens OX=9606 GN=ERC1 PE=1 SV=1	507	KESLTAKEQRAA
KESLTAKENRQQ	sp|P0C1C7|W_NIPAV	293	tr|G8JLD3|G8JLD3_HUMAN ELKS/Rab6-interacting/CAST family member 1 OS=Homo sapiens OX=9606 GN=ERC1 PE=1 SV=1	507	KESLTAKEQRAA
KESLTAKENRQQ	sp|P0C1C7|W_NIPAV	293	tr|X6RLX0|X6RLX0_HUMAN ELKS/Rab6-interacting/CAST family member 1 OS=Homo sapiens OX=9606 GN=ERC1 PE=1 SV=1	507	KESLTAKEQRAA
KESLTAKENRQQ	sp|P0C1C7|W_NIPAV	293	tr|X6RM00|X6RM00_HUMAN ELKS/Rab6-interacting/CAST family member 1 OS=Homo sapiens OX=9606 GN=ERC1 PE=1 SV=1	507	KESLTAKEQRAA
NHIINMLLNLAI	sp|Q997F0|L_NIPAV	1957	sp|Q9BYT9|ANO3_HUMAN Anoctamin-3 OS=Homo sapiens OX=9606 GN=ANO3 PE=2 SV=2	603	NFIIIMLLNLAY
NHIINMLLNLAI	sp|Q997F0|L_NIPAV	1957	tr|A0A5F9ZHL6|A0A5F9ZHL6_HUMAN Anoctamin OS=Homo sapiens OX=9606 GN=ANO3 PE=1 SV=1	664	NFIIIMLLNLAY
NHIINMLLNLAI	sp|Q997F0|L_NIPAV	1957	tr|E9PQ79|E9PQ79_HUMAN Anoctamin OS=Homo sapiens OX=9606 GN=ANO3 PE=1 SV=1	587	NFIIIMLLNLAY
SRISSSGLQPSA	sp|Q997F2|V_NIPAV	179	tr|A0A087WVE6|A0A087WVE6_HUMAN mRNA-decapping enzyme 1A (Fragment) OS=Homo sapiens OX=9606 GN=DCP1A PE=1 SV=1	174	SNISSPGLQPST
SRISSSGLQPSA	sp|Q997F2|V_NIPAV	179	tr|A0A087WT55|A0A087WT55_HUMAN mRNA-decapping enzyme 1A (Fragment) OS=Homo sapiens OX=9606 GN=DCP1A PE=1 SV=1	163	SNISSPGLQPST
SRISSSGLQPSA	sp|Q997F2|V_NIPAV	179	sp|Q9NPI6|DCP1A_HUMAN mRNA-decapping enzyme 1A OS=Homo sapiens OX=9606 GN=DCP1A PE=1 SV=3	176	SNISSPGLQPST
EPPSRRLPILIE	sp|P0C1C7|W_NIPAV	319	tr|W4VSQ8|W4VSQ8_HUMAN Nudix (Nucleoside diphosphate linked moiety X)-type motif 16-like 1, isoform CRA_b OS=Homo sapiens OX=9606 GN=NUDT16L1 PE=1 SV=1	174	EGPSRRLPQLPE
QTVSLTENITDK	sp|Q9IH62|GLYCP_NIPAV	134	tr|A2A2M0|A2A2M0_HUMAN Regulation of nuclear pre-mRNA domain-containing protein 1B (Fragment) OS=Homo sapiens OX=9606 GN=RPRD1B PE=1 SV=1	91	QDVSLLEKITDK
QTVSLTENITDK	sp|Q9IH62|GLYCP_NIPAV	134	sp|Q9NQG5|RPR1B_HUMAN Regulation of nuclear pre-mRNA domain-containing protein 1B OS=Homo sapiens OX=9606 GN=RPRD1B PE=1 SV=1	209	QDVSLLEKITDK
LACASRSMHSLV	sp|Q997F0|L_NIPAV	2016	tr|A0A5F9ZHN1|A0A5F9ZHN1_HUMAN Ankyrin repeat and death domain-containing protein 1B (Fragment) OS=Homo sapiens OX=9606 GN=ANKDD1B PE=4 SV=1	328	LAVASRSNHSLV
LACASRSMHSLV	sp|Q997F0|L_NIPAV	2016	tr|A0A5F9ZHD3|A0A5F9ZHD3_HUMAN Ankyrin repeat and death domain-containing protein 1B (Fragment) OS=Homo sapiens OX=9606 GN=ANKDD1B PE=4 SV=1	109	LAVASRSNHSLV
LACASRSMHSLV	sp|Q997F0|L_NIPAV	2016	tr|A0A5F9ZHN3|A0A5F9ZHN3_HUMAN Ankyrin repeat and death domain-containing protein 1B OS=Homo sapiens OX=9606 GN=ANKDD1B PE=4 SV=1	229	LAVASRSNHSLV
LACASRSMHSLV	sp|Q997F0|L_NIPAV	2016	tr|A0A5F9ZHP8|A0A5F9ZHP8_HUMAN Ankyrin repeat and death domain-containing protein 1B OS=Homo sapiens OX=9606 GN=ANKDD1B PE=4 SV=1	118	LAVASRSNHSLV
LACASRSMHSLV	sp|Q997F0|L_NIPAV	2016	sp|A6NHY2|AKD1B_HUMAN Ankyrin repeat and death domain-containing protein 1B OS=Homo sapiens OX=9606 GN=ANKDD1B PE=4 SV=3	371	LAVASRSNHSLV
EEVESLEYDEEF	sp|Q9IK91|PHOSP_NIPAV	243	sp|Q8N4C8|MINK1_HUMAN Misshapen-like kinase 1 OS=Homo sapiens OX=9606 GN=MINK1 PE=1 SV=2	828	EEVESSEDDEEE
LSYAPDLVLQRD	sp|P0C1C7|W_NIPAV	157	sp|Q92731|ESR2_HUMAN Estrogen receptor beta OS=Homo sapiens OX=9606 GN=ESR2 PE=1 SV=2	354	LIFAPDLVLDRD
LSYAPDLVLQRD	sp|P0C1C7|W_NIPAV	157	tr|G3V5S2|G3V5S2_HUMAN Estrogen receptor beta OS=Homo sapiens OX=9606 GN=ESR2 PE=1 SV=2	354	LIFAPDLVLDRD
EIPGLGPKDTLM	sp|P0C1C7|W_NIPAV	305	sp|O60488|ACSL4_HUMAN Long-chain-fatty-acid--CoA ligase 4 OS=Homo sapiens OX=9606 GN=ACSL4 PE=1 SV=2	305	RIPGLGPKDTYI
LALLGASVVDGK	sp|Q997F0|L_NIPAV	1395	sp|Q5MY95|ENTP8_HUMAN Ectonucleoside triphosphate diphosphohydrolase 8 OS=Homo sapiens OX=9606 GN=ENTPD8 PE=1 SV=2	11	LALLGASGVSGL
PLCTKASPAPHK	sp|Q997F2|V_NIPAV	429	sp|Q8N967|LRTM2_HUMAN Leucine-rich repeat and transmembrane domain-containing protein 2 OS=Homo sapiens OX=9606 GN=LRTM2 PE=2 SV=1	267	PPCTKASPEPAK
PLCTKASPAPHK	sp|Q997F2|V_NIPAV	429	sp|Q9UPA5|BSN_HUMAN Protein bassoon OS=Homo sapiens OX=9606 GN=BSN PE=1 SV=4	574	PLSTKASPLPSK
QEEDDLESADWD	sp|P0C1C7|W_NIPAV	240	sp|Q13402|MYO7A_HUMAN Unconventional myosin-VIIa OS=Homo sapiens OX=9606 GN=MYO7A PE=1 SV=2	474	QEEYDLESIDWL
QEEDDLESADWD	sp|P0C1C7|W_NIPAV	240	tr|A0A087WT71|A0A087WT71_HUMAN Unconventional myosin-VIIa OS=Homo sapiens OX=9606 GN=MYO7A PE=1 SV=1	474	QEEYDLESIDWL
RNHIINMLLNLA	sp|Q997F0|L_NIPAV	1956	sp|Q9BYT9|ANO3_HUMAN Anoctamin-3 OS=Homo sapiens OX=9606 GN=ANO3 PE=2 SV=2	602	INFIIIMLLNLA
RNHIINMLLNLA	sp|Q997F0|L_NIPAV	1956	tr|A0A5F9ZHL6|A0A5F9ZHL6_HUMAN Anoctamin OS=Homo sapiens OX=9606 GN=ANO3 PE=1 SV=1	663	INFIIIMLLNLA
RNHIINMLLNLA	sp|Q997F0|L_NIPAV	1956	tr|E9PQ79|E9PQ79_HUMAN Anoctamin OS=Homo sapiens OX=9606 GN=ANO3 PE=1 SV=1	586	INFIIIMLLNLA
NKMLPWKKVASN	sp|Q9IK90|MATRX_NIPAV	136	tr|A0A2R8YG38|A0A2R8YG38_HUMAN Inositol polyphosphate 5-phosphatase OCRL (Fragment) OS=Homo sapiens OX=9606 GN=OCRL PE=1 SV=1	69	NKMLPREKEASN
NKMLPWKKVASN	sp|Q9IK90|MATRX_NIPAV	136	sp|Q01968|OCRL_HUMAN Inositol polyphosphate 5-phosphatase OCRL OS=Homo sapiens OX=9606 GN=OCRL PE=1 SV=3	185	NKMLPREKEASN
LLYTSLALLGAS	sp|Q997F0|L_NIPAV	1390	sp|Q5BLP8|CD048_HUMAN Neuropeptide-like protein C4orf48 OS=Homo sapiens OX=9606 GN=C4orf48 PE=1 SV=3	20	LLLLSLALLGAR
LIAARAIQIPES	sp|Q9IK92|NCAP_NIPAV	174	tr|A0A590UJS8|A0A590UJS8_HUMAN ATP-binding cassette sub-family B member 7, mitochondrial OS=Homo sapiens OX=9606 GN=ABCB7 PE=1 SV=1	49	LGTARAYQIPES
LIAARAIQIPES	sp|Q9IK92|NCAP_NIPAV	174	sp|O75027|ABCB7_HUMAN ATP-binding cassette sub-family B member 7, mitochondrial OS=Homo sapiens OX=9606 GN=ABCB7 PE=1 SV=2	49	LGTARAYQIPES
LIAARAIQIPES	sp|Q9IK92|NCAP_NIPAV	174	tr|A0A2R8Y3N2|A0A2R8Y3N2_HUMAN ATP-binding cassette sub-family B member 7, mitochondrial (Fragment) OS=Homo sapiens OX=9606 GN=ABCB7 PE=1 SV=1	53	LGTARAYQIPES
QEDNTLSRSATN	sp|Q9IH62|GLYCP_NIPAV	553	sp|Q5JY77|GASP1_HUMAN G-protein coupled receptor-associated sorting protein 1 OS=Homo sapiens OX=9606 GN=GPRASP1 PE=1 SV=3	231	QEANTMSRSQTN
NITQLINDYAVI	sp|Q997F0|L_NIPAV	1526	tr|A0A0B4J211|A0A0B4J211_HUMAN ATPase family AAA domain-containing protein 2 OS=Homo sapiens OX=9606 GN=ATAD2 PE=1 SV=1	666	NIFQLENLYAVI
NITQLINDYAVI	sp|Q997F0|L_NIPAV	1526	sp|Q6PL18|ATAD2_HUMAN ATPase family AAA domain-containing protein 2 OS=Homo sapiens OX=9606 GN=ATAD2 PE=1 SV=1	1348	NIFQLENLYAVI
ESLLLLINEILS	sp|Q997F0|L_NIPAV	2119	sp|Q9Y5W7|SNX14_HUMAN Sorting nexin-14 OS=Homo sapiens OX=9606 GN=SNX14 PE=1 SV=3	264	RSLTLLIREILS
ESLLLLINEILS	sp|Q997F0|L_NIPAV	2119	tr|D6RJG9|D6RJG9_HUMAN Sorting nexin-14 (Fragment) OS=Homo sapiens OX=9606 GN=SNX14 PE=1 SV=1	191	RSLTLLIREILS
ESLLLLINEILS	sp|Q997F0|L_NIPAV	2119	tr|D6RDH9|D6RDH9_HUMAN Sorting nexin-14 OS=Homo sapiens OX=9606 GN=SNX14 PE=1 SV=1	264	RSLTLLIREILS
SSVDYILSMALL	sp|Q997F0|L_NIPAV	981	sp|Q13200|PSMD2_HUMAN 26S proteasome non-ATPase regulatory subunit 2 OS=Homo sapiens OX=9606 GN=PSMD2 PE=1 SV=3	435	SSEDYIKSGALL
FSSDEEELESVD	sp|Q997F2|V_NIPAV	238	sp|Q9UKY1|ZHX1_HUMAN Zinc fingers and homeoboxes protein 1 OS=Homo sapiens OX=9606 GN=ZHX1 PE=1 SV=1	46	ISSDEEVHESVD
DRRGERVSEEAE	sp|Q9IK92|NCAP_NIPAV	115	sp|Q8TF61|FBX41_HUMAN F-box only protein 41 OS=Homo sapiens OX=9606 GN=FBXO41 PE=2 SV=5	216	DRRLERLSEEVE
GEYLPGTKDLRL	sp|Q997F0|L_NIPAV	1870	sp|Q92769|HDAC2_HUMAN Histone deacetylase 2 OS=Homo sapiens OX=9606 GN=HDAC2 PE=1 SV=2	203	GEYFPGTGDLRD
GEYLPGTKDLRL	sp|Q997F0|L_NIPAV	1870	tr|Q5TEE2|Q5TEE2_HUMAN Histone deacetylase (Fragment) OS=Homo sapiens OX=9606 GN=HDAC1 PE=1 SV=1	177	GEYFPGTGDLRD
GEYLPGTKDLRL	sp|Q997F0|L_NIPAV	1870	sp|Q13547|HDAC1_HUMAN Histone deacetylase 1 OS=Homo sapiens OX=9606 GN=HDAC1 PE=1 SV=1	202	GEYFPGTGDLRD
AKPSAPYKLKKD	sp|Q997F0|L_NIPAV	842	tr|C9JFV4|C9JFV4_HUMAN Modulator of non-genomic activity of estrogen receptor OS=Homo sapiens OX=9606 GN=PELP1 PE=1 SV=2	539	GKPSAPKKLKLD
AKPSAPYKLKKD	sp|Q997F0|L_NIPAV	842	sp|Q8IZL8|PELP1_HUMAN Proline-, glutamic acid- and leucine-rich protein 1 OS=Homo sapiens OX=9606 GN=PELP1 PE=1 SV=2	489	GKPSAPKKLKLD
AKPSAPYKLKKD	sp|Q997F0|L_NIPAV	842	tr|E7EV54|E7EV54_HUMAN Modulator of non-genomic activity of estrogen receptor OS=Homo sapiens OX=9606 GN=PELP1 PE=1 SV=1	342	GKPSAPKKLKLD
LQTFLIFILSFC	sp|Q997F0|L_NIPAV	1629	sp|Q8NH49|OR4X1_HUMAN Olfactory receptor 4X1 OS=Homo sapiens OX=9606 GN=OR4X1 PE=3 SV=1	156	GQTFLIFQLPFC
GLEKSIDDLIVE	sp|Q997F0|L_NIPAV	1944	tr|H0YK48|H0YK48_HUMAN Tropomyosin alpha-1 chain OS=Homo sapiens OX=9606 GN=TPM1 PE=1 SV=1	212	KLEKSIDDLEDE
GLEKSIDDLIVE	sp|Q997F0|L_NIPAV	1944	sp|P09493|TPM1_HUMAN Tropomyosin alpha-1 chain OS=Homo sapiens OX=9606 GN=TPM1 PE=1 SV=2	248	KLEKSIDDLEDE
GLEKSIDDLIVE	sp|Q997F0|L_NIPAV	1944	tr|A0A0S2Z4G6|A0A0S2Z4G6_HUMAN Tropomyosin 1 (Alpha), isoform CRA_o (Fragment) OS=Homo sapiens OX=9606 GN=TPM1 PE=1 SV=1	248	KLEKSIDDLEDE
GLEKSIDDLIVE	sp|Q997F0|L_NIPAV	1944	tr|H0YKJ4|H0YKJ4_HUMAN Tropomyosin 1 (Alpha), isoform CRA_b OS=Homo sapiens OX=9606 GN=TPM1 PE=1 SV=2	212	KLEKSIDDLEDE
GLEKSIDDLIVE	sp|Q997F0|L_NIPAV	1944	tr|A0A494C0I0|A0A494C0I0_HUMAN Tropomyosin alpha-1 chain (Fragment) OS=Homo sapiens OX=9606 GN=TPM1 PE=1 SV=1	26	KLEKSIDDLEDE
SSQGVSPQVLPF	sp|P0C1C7|W_NIPAV	182	tr|J3KQ09|J3KQ09_HUMAN DNA polymerase iota OS=Homo sapiens OX=9606 GN=POLI PE=1 SV=1	36	SSQGVHDQVLPT
SSQGVSPQVLPF	sp|P0C1C7|W_NIPAV	182	sp|Q9UNA4|POLI_HUMAN DNA polymerase iota OS=Homo sapiens OX=9606 GN=POLI PE=1 SV=3	36	SSQGVHDQVLPT
RLLEKSSAKEEI	sp|Q997F0|L_NIPAV	2031	sp|O75691|UTP20_HUMAN Small subunit processome component 20 homolog OS=Homo sapiens OX=9606 GN=UTP20 PE=1 SV=3	977	RLLEDRSFKEEI
ARDVKYVVGGAM	sp|Q9IK92|NCAP_NIPAV	410	tr|A0A0C4DGF2|A0A0C4DGF2_HUMAN Kelch-like protein 6 (Fragment) OS=Homo sapiens OX=9606 GN=KLHL6 PE=1 SV=1	503	FRDRIYVVGGAM
ARDVKYVVGGAM	sp|Q9IK92|NCAP_NIPAV	410	sp|Q8WZ60|KLHL6_HUMAN Kelch-like protein 6 OS=Homo sapiens OX=9606 GN=KLHL6 PE=1 SV=3	514	FRDRIYVVGGAM
ASQESVMDALLA	sp|Q9IK92|NCAP_NIPAV	384	sp|Q86XL3|ANKL2_HUMAN Ankyrin repeat and LEM domain-containing protein 2 OS=Homo sapiens OX=9606 GN=ANKLE2 PE=1 SV=4	59	ASGEMTMDALLA
SSDEEELESVDF	sp|Q997F2|V_NIPAV	239	sp|Q9UKY1|ZHX1_HUMAN Zinc fingers and homeoboxes protein 1 OS=Homo sapiens OX=9606 GN=ZHX1 PE=1 SV=1	47	SSDEEVHESVDS
