query	query_seqname	query_start	target_seqname	target_start	target
LQISGDVFSNFL	sp|Q9YJJ8|VP8_BAVJK	110	sp|Q8WWH4|ASZ1_HUMAN Ankyrin repeat, SAM and basic leucine zipper domain-containing protein 1 OS=Homo sapiens OX=9606 GN=ASZ1 PE=1 SV=1	349	LEISGDEFLNFL
TGIAKALEKNTN	sp|Q9INI2|NS1_BAVJK	280	tr|D6RCE4|D6RCE4_HUMAN Protocadherin Fat 1 (Fragment) OS=Homo sapiens OX=9606 GN=FAT1 PE=1 SV=1	117	TLIVKALEKNTN
TGIAKALEKNTN	sp|Q9INI2|NS1_BAVJK	280	sp|Q14517|FAT1_HUMAN Protocadherin Fat 1 OS=Homo sapiens OX=9606 GN=FAT1 PE=1 SV=2	117	TLIVKALEKNTN
TGIAKALEKNTN	sp|Q9INI2|NS1_BAVJK	280	tr|A0A087WVP1|A0A087WVP1_HUMAN Protocadherin Fat 1 OS=Homo sapiens OX=9606 GN=FAT1 PE=1 SV=1	117	TLIVKALEKNTN
ATGIAKALEKNT	sp|Q9INI2|NS1_BAVJK	279	tr|D6RCE4|D6RCE4_HUMAN Protocadherin Fat 1 (Fragment) OS=Homo sapiens OX=9606 GN=FAT1 PE=1 SV=1	116	YTLIVKALEKNT
ATGIAKALEKNT	sp|Q9INI2|NS1_BAVJK	279	sp|Q14517|FAT1_HUMAN Protocadherin Fat 1 OS=Homo sapiens OX=9606 GN=FAT1 PE=1 SV=2	116	YTLIVKALEKNT
ATGIAKALEKNT	sp|Q9INI2|NS1_BAVJK	279	tr|A0A087WVP1|A0A087WVP1_HUMAN Protocadherin Fat 1 OS=Homo sapiens OX=9606 GN=FAT1 PE=1 SV=1	116	YTLIVKALEKNT
SRLTSLGAVSNN	sp|Q9INJ1|RDRP_BAVJK	592	tr|A0A0C4DGD4|A0A0C4DGD4_HUMAN D-glutamate cyclase, mitochondrial (Fragment) OS=Homo sapiens OX=9606 GN=DGLUCY PE=1 SV=1	232	SPLTSLGAVSSC
SRLTSLGAVSNN	sp|Q9INJ1|RDRP_BAVJK	592	sp|Q7Z3D6|GLUCM_HUMAN D-glutamate cyclase, mitochondrial OS=Homo sapiens OX=9606 GN=DGLUCY PE=1 SV=2	227	SPLTSLGAVSSC
SRLTSLGAVSNN	sp|Q9INJ1|RDRP_BAVJK	592	tr|H0YB09|H0YB09_HUMAN D-glutamate cyclase, mitochondrial (Fragment) OS=Homo sapiens OX=9606 GN=DGLUCY PE=1 SV=1	217	SPLTSLGAVSSC
SRLTSLGAVSNN	sp|Q9INJ1|RDRP_BAVJK	592	tr|H0YB62|H0YB62_HUMAN D-glutamate cyclase, mitochondrial (Fragment) OS=Homo sapiens OX=9606 GN=DGLUCY PE=1 SV=1	134	SPLTSLGAVSSC
ISNNIELDLKSN	sp|Q9YIT9|NS5_BAVJK	170	sp|Q7L1W4|LRC8D_HUMAN Volume-regulated anion channel subunit LRRC8D OS=Homo sapiens OX=9606 GN=LRRC8D PE=1 SV=1	657	LSNLQELDLKSN
LNGKKIKMGTAA	sp|Q9INJ1|RDRP_BAVJK	62	sp|Q13492|PICAL_HUMAN Phosphatidylinositol-binding clathrin assembly protein OS=Homo sapiens OX=9606 GN=PICALM PE=1 SV=2	285	LEGKKIKDSTAA
VEGPFLVIAPLG	sp|Q9YJJ8|VP8_BAVJK	201	sp|Q9P2D1|CHD7_HUMAN Chromodomain-helicase-DNA-binding protein 7 OS=Homo sapiens OX=9606 GN=CHD7 PE=1 SV=3	1015	IHGPFLVIAPLS
VEGPFLVIAPLG	sp|Q9YJJ8|VP8_BAVJK	201	tr|A0A2R8Y840|A0A2R8Y840_HUMAN DNA helicase (Fragment) OS=Homo sapiens OX=9606 GN=CHD8 PE=1 SV=1	860	IHGPFLVIAPLS
VEGPFLVIAPLG	sp|Q9YJJ8|VP8_BAVJK	201	sp|Q9HCK8|CHD8_HUMAN Chromodomain-helicase-DNA-binding protein 8 OS=Homo sapiens OX=9606 GN=CHD8 PE=1 SV=5	858	IHGPFLVIAPLS
VEGPFLVIAPLG	sp|Q9YJJ8|VP8_BAVJK	201	tr|H0YJG4|H0YJG4_HUMAN Chromodomain-helicase-DNA-binding protein 8 (Fragment) OS=Homo sapiens OX=9606 GN=CHD8 PE=1 SV=2	84	IHGPFLVIAPLS
VEGPFLVIAPLG	sp|Q9YJJ8|VP8_BAVJK	201	tr|A0A2R8Y4P3|A0A2R8Y4P3_HUMAN DNA helicase (Fragment) OS=Homo sapiens OX=9606 GN=CHD8 PE=1 SV=1	829	IHGPFLVIAPLS
LAAVEAALTRAA	sp|Q9YJJ8|VP8_BAVJK	29	sp|Q96A11|G3ST3_HUMAN Galactose-3-O-sulfotransferase 3 OS=Homo sapiens OX=9606 GN=GAL3ST3 PE=1 SV=1	276	LAAIPAALARAA
LAAVEAALTRAA	sp|Q9YJJ8|VP8_BAVJK	29	tr|K7ERE6|K7ERE6_HUMAN Podocan-like protein 1 (Fragment) OS=Homo sapiens OX=9606 GN=PODNL1 PE=1 SV=1	22	PAAQPAALTRAA
LAAVEAALTRAA	sp|Q9YJJ8|VP8_BAVJK	29	sp|Q96EX3|DC2I2_HUMAN Cytoplasmic dynein 2 intermediate chain 2 OS=Homo sapiens OX=9606 GN=DYNC2I2 PE=1 SV=2	364	LAAGEAALTRMP
YKRSLNGVDALS	sp|Q9INI2|NS1_BAVJK	197	sp|Q6P996|PDXD1_HUMAN Pyridoxal-dependent decarboxylase domain-containing protein 1 OS=Homo sapiens OX=9606 GN=PDXDC1 PE=1 SV=2	707	FKRSLRGSDALS
YKRSLNGVDALS	sp|Q9INI2|NS1_BAVJK	197	tr|H3BND4|H3BND4_HUMAN Pyridoxal-dependent decarboxylase domain-containing protein 1 OS=Homo sapiens OX=9606 GN=PDXDC1 PE=1 SV=1	725	FKRSLRGSDALS
SQSSHTSSNTVT	sp|Q9INJ1|RDRP_BAVJK	714	sp|Q5M775|CYTSB_HUMAN Cytospin-B OS=Homo sapiens OX=9606 GN=SPECC1 PE=1 SV=1	131	SVSSPTSSNTPT
RTSVFKDLNGKK	sp|Q9INJ1|RDRP_BAVJK	55	sp|Q5CZC0|FSIP2_HUMAN Fibrous sheath-interacting protein 2 OS=Homo sapiens OX=9606 GN=FSIP2 PE=2 SV=4	6267	YTSVFKDLMGKS
RTSVFKDLNGKK	sp|Q9INJ1|RDRP_BAVJK	55	tr|A0A087WUX3|A0A087WUX3_HUMAN Fibrous sheath-interacting protein 2 OS=Homo sapiens OX=9606 GN=FSIP2 PE=1 SV=1	431	YTSVFKDLMGKS
VELPGVTANSTL	sp|Q9YWQ1|SPIKE_BAVJK	231	sp|O95568|MET18_HUMAN Histidine protein methyltransferase 1 homolog OS=Homo sapiens OX=9606 GN=METTL18 PE=1 SV=1	226	VTLPNVVANSTL
AEHMIHSSPGNL	sp|Q9INJ1|RDRP_BAVJK	1075	sp|Q8IZF2|AGRF5_HUMAN Adhesion G protein-coupled receptor F5 OS=Homo sapiens OX=9606 GN=ADGRF5 PE=1 SV=3	759	AEHEISSSPGSL
TGSYYAGIDSLF	sp|Q9INI2|NS1_BAVJK	47	sp|Q5W064|LIPJ_HUMAN Lipase member J OS=Homo sapiens OX=9606 GN=LIPJ PE=2 SV=3	335	TISYYNHIDSLF
TVERILRNYEFE	sp|Q9INI1|NS2_BAVJK	144	sp|Q9Y2W2|WBP11_HUMAN WW domain-binding protein 11 OS=Homo sapiens OX=9606 GN=WBP11 PE=1 SV=1	88	TFERILRLYEKE
TVERILRNYEFE	sp|Q9INI1|NS2_BAVJK	144	tr|F5H5G4|F5H5G4_HUMAN WW domain-binding protein 11 OS=Homo sapiens OX=9606 GN=WBP11 PE=1 SV=1	88	TFERILRLYEKE
VGDSPGPRFKKF	sp|Q9INI4|VP3_BAVJK	241	tr|D6RD47|D6RD47_HUMAN 40S ribosomal protein S23 OS=Homo sapiens OX=9606 GN=RPS23 PE=1 SV=1	112	VGDIPGVRFKSF
DAVSEEIEEDDD	sp|Q9YWQ0|NS3_BAVJK	294	tr|A0A3B3ISF7|A0A3B3ISF7_HUMAN DBF4-type zinc finger-containing protein 2 OS=Homo sapiens OX=9606 GN=ZDBF2 PE=1 SV=1	55	DAFSEEEEEDED
DAVSEEIEEDDD	sp|Q9YWQ0|NS3_BAVJK	294	tr|A0A3B3ISJ7|A0A3B3ISJ7_HUMAN DBF4-type zinc finger-containing protein 2 OS=Homo sapiens OX=9606 GN=ZDBF2 PE=1 SV=1	84	DAFSEEEEEDED
DAVSEEIEEDDD	sp|Q9YWQ0|NS3_BAVJK	294	tr|A0A3B3IRN6|A0A3B3IRN6_HUMAN DBF4-type zinc finger-containing protein 2 (Fragment) OS=Homo sapiens OX=9606 GN=ZDBF2 PE=1 SV=1	84	DAFSEEEEEDED
DAVSEEIEEDDD	sp|Q9YWQ0|NS3_BAVJK	294	tr|A0A3B3ITZ5|A0A3B3ITZ5_HUMAN DBF4-type zinc finger-containing protein 2 (Fragment) OS=Homo sapiens OX=9606 GN=ZDBF2 PE=1 SV=1	84	DAFSEEEEEDED
DAVSEEIEEDDD	sp|Q9YWQ0|NS3_BAVJK	294	sp|Q9HCK1|ZDBF2_HUMAN DBF4-type zinc finger-containing protein 2 OS=Homo sapiens OX=9606 GN=ZDBF2 PE=1 SV=3	84	DAFSEEEEEDED
DAVSEEIEEDDD	sp|Q9YWQ0|NS3_BAVJK	294	tr|N0DVX5|N0DVX5_HUMAN DBF4-type zinc finger-containing protein 2 OS=Homo sapiens OX=9606 GN=ZDBF2 PE=1 SV=1	82	DAFSEEEEEDED
IAKALEKNTNLK	sp|Q9INI2|NS1_BAVJK	282	tr|D6RCE4|D6RCE4_HUMAN Protocadherin Fat 1 (Fragment) OS=Homo sapiens OX=9606 GN=FAT1 PE=1 SV=1	119	IVKALEKNTNVE
IAKALEKNTNLK	sp|Q9INI2|NS1_BAVJK	282	sp|Q14517|FAT1_HUMAN Protocadherin Fat 1 OS=Homo sapiens OX=9606 GN=FAT1 PE=1 SV=2	119	IVKALEKNTNVE
IAKALEKNTNLK	sp|Q9INI2|NS1_BAVJK	282	tr|A0A087WVP1|A0A087WVP1_HUMAN Protocadherin Fat 1 OS=Homo sapiens OX=9606 GN=FAT1 PE=1 SV=1	119	IVKALEKNTNVE
IAKALEKNTNLK	sp|Q9INI2|NS1_BAVJK	282	tr|B0QYT5|B0QYT5_HUMAN Ran GTPase-activating protein 1 (Fragment) OS=Homo sapiens OX=9606 GN=RANGAP1 PE=1 SV=1	69	IAKALEKKSELK
IAKALEKNTNLK	sp|Q9INI2|NS1_BAVJK	282	tr|B0QYT4|B0QYT4_HUMAN Ran GTPase-activating protein 1 (Fragment) OS=Homo sapiens OX=9606 GN=RANGAP1 PE=1 SV=1	69	IAKALEKKSELK
IAKALEKNTNLK	sp|Q9INI2|NS1_BAVJK	282	sp|P46060|RAGP1_HUMAN Ran GTPase-activating protein 1 OS=Homo sapiens OX=9606 GN=RANGAP1 PE=1 SV=1	69	IAKALEKKSELK
IAKALEKNTNLK	sp|Q9INI2|NS1_BAVJK	282	tr|H0Y4Q3|H0Y4Q3_HUMAN Ran GTPase-activating protein 1 (Fragment) OS=Homo sapiens OX=9606 GN=RANGAP1 PE=1 SV=1	10	IAKALEKKSELK
PKSVVIVSSDTG	sp|Q9INI5|VP2_BAVJK	190	tr|Q6P2G0|Q6P2G0_HUMAN Disintegrin and metalloproteinase domain-containing protein 2 OS=Homo sapiens OX=9606 GN=ADAM2 PE=1 SV=1	102	PKSVVMVSTCTG
PKSVVIVSSDTG	sp|Q9INI5|VP2_BAVJK	190	sp|Q99965|ADAM2_HUMAN Disintegrin and metalloproteinase domain-containing protein 2 OS=Homo sapiens OX=9606 GN=ADAM2 PE=2 SV=2	102	PKSVVMVSTCTG
PKSVVIVSSDTG	sp|Q9INI5|VP2_BAVJK	190	tr|B4DWY7|B4DWY7_HUMAN Disintegrin and metalloproteinase domain-containing protein 2 OS=Homo sapiens OX=9606 GN=ADAM2 PE=1 SV=1	102	PKSVVMVSTCTG
FLTTHITEVDAA	sp|Q9INJ1|RDRP_BAVJK	540	sp|P55212|CASP6_HUMAN Caspase-6 OS=Homo sapiens OX=9606 GN=CASP6 PE=1 SV=2	184	KLDTNITEVDAA
NFLAAVEAALTR	sp|Q9YJJ8|VP8_BAVJK	27	sp|Q96EX3|DC2I2_HUMAN Cytoplasmic dynein 2 intermediate chain 2 OS=Homo sapiens OX=9606 GN=DYNC2I2 PE=1 SV=2	362	CSLAAGEAALTR
NFLAAVEAALTR	sp|Q9YJJ8|VP8_BAVJK	27	sp|P83436|COG7_HUMAN Conserved oligomeric Golgi complex subunit 7 OS=Homo sapiens OX=9606 GN=COG7 PE=1 SV=1	562	NLLAAPRAALTR
SLLDSRSLATNT	sp|Q9INI5|VP2_BAVJK	289	tr|F8VRY4|F8VRY4_HUMAN Protein O-mannosyl-transferase TMTC3 OS=Homo sapiens OX=9606 GN=TMTC3 PE=1 SV=1	314	SLLDIRNLATFT
SLLDSRSLATNT	sp|Q9INI5|VP2_BAVJK	289	sp|Q6ZXV5|TMTC3_HUMAN Protein O-mannosyl-transferase TMTC3 OS=Homo sapiens OX=9606 GN=TMTC3 PE=1 SV=2	314	SLLDIRNLATFT
SLLDSRSLATNT	sp|Q9INI5|VP2_BAVJK	289	sp|Q8NFH3|NUP43_HUMAN Nucleoporin Nup43 OS=Homo sapiens OX=9606 GN=NUP43 PE=1 SV=1	344	SLLPSRSLSVNT
EALMELEITEMS	sp|Q9INJ1|RDRP_BAVJK	667	sp|Q9NZJ4|SACS_HUMAN Sacsin OS=Homo sapiens OX=9606 GN=SACS PE=1 SV=2	2325	EALMQNEITKMS
LDVSPEQIHKGH	sp|Q9INJ1|RDRP_BAVJK	388	sp|O75127|PTCD1_HUMAN Pentatricopeptide repeat-containing protein 1, mitochondrial OS=Homo sapiens OX=9606 GN=PTCD1 PE=1 SV=2	267	LDVFKEIIHKGH
LDVSPEQIHKGH	sp|Q9INJ1|RDRP_BAVJK	388	tr|G3V325|G3V325_HUMAN ATP5MF-PTCD1 readthrough OS=Homo sapiens OX=9606 GN=ATP5MF-PTCD1 PE=4 SV=1	316	LDVFKEIIHKGH
RSRGEKGEVVYE	sp|Q9INI5|VP2_BAVJK	46	tr|H0Y4S7|H0Y4S7_HUMAN RanBP-type and C3HC4-type zinc finger-containing protein 1 (Fragment) OS=Homo sapiens OX=9606 GN=RBCK1 PE=1 SV=1	48	RSRGEKTEEVGE
RSRGEKGEVVYE	sp|Q9INI5|VP2_BAVJK	46	tr|B5MCW3|B5MCW3_HUMAN Bromodomain-containing protein 8 OS=Homo sapiens OX=9606 GN=BRD8 PE=1 SV=1	80	RKRGEKGEVVET
RSRGEKGEVVYE	sp|Q9INI5|VP2_BAVJK	46	sp|Q9H0E9|BRD8_HUMAN Bromodomain-containing protein 8 OS=Homo sapiens OX=9606 GN=BRD8 PE=1 SV=2	80	RKRGEKGEVVET
RSRGEKGEVVYE	sp|Q9INI5|VP2_BAVJK	46	tr|H7C127|H7C127_HUMAN Bromodomain-containing protein 8 (Fragment) OS=Homo sapiens OX=9606 GN=BRD8 PE=1 SV=1	75	RKRGEKGEVVET
RSRGEKGEVVYE	sp|Q9INI5|VP2_BAVJK	46	tr|H7C179|H7C179_HUMAN Bromodomain-containing protein 8 (Fragment) OS=Homo sapiens OX=9606 GN=BRD8 PE=1 SV=1	75	RKRGEKGEVVET
RSRGEKGEVVYE	sp|Q9INI5|VP2_BAVJK	46	tr|H7C128|H7C128_HUMAN Bromodomain-containing protein 8 (Fragment) OS=Homo sapiens OX=9606 GN=BRD8 PE=1 SV=1	74	RKRGEKGEVVET
EPNQNPKLELKQ	sp|Q9YWQ3|NS4_BAVJK	167	tr|J3KPI3|J3KPI3_HUMAN Retroelement silencing factor 1 (Fragment) OS=Homo sapiens OX=9606 GN=RESF1 PE=1 SV=8	436	EPAQNSKLSLKQ
EPNQNPKLELKQ	sp|Q9YWQ3|NS4_BAVJK	167	sp|Q9HCM1|RESF1_HUMAN Retroelement silencing factor 1 OS=Homo sapiens OX=9606 GN=RESF1 PE=1 SV=3	436	EPAQNSKLSLKQ
DLTMVSSGLGAL	sp|Q9YJJ8|VP8_BAVJK	148	sp|P24903|CP2F1_HUMAN Cytochrome P450 2F1 OS=Homo sapiens OX=9606 GN=CYP2F1 PE=1 SV=2	469	DLTPLSSGLGNL
SNNIELDLKSND	sp|Q9YIT9|NS5_BAVJK	171	sp|Q7L1W4|LRC8D_HUMAN Volume-regulated anion channel subunit LRRC8D OS=Homo sapiens OX=9606 GN=LRRC8D PE=1 SV=1	658	SNLQELDLKSNN
GEVEKVLASRKD	sp|Q9YWQ1|SPIKE_BAVJK	37	sp|Q8TDX9|PK1L1_HUMAN Polycystic kidney disease protein 1-like 1 OS=Homo sapiens OX=9606 GN=PKD1L1 PE=1 SV=1	2241	GEVEKVLAARQQ
LVIAPLGTPAIA	sp|Q9YJJ8|VP8_BAVJK	206	sp|Q6UWB1|I27RA_HUMAN Interleukin-27 receptor subunit alpha OS=Homo sapiens OX=9606 GN=IL27RA PE=1 SV=2	425	LQDAPPGTPAIA
SSNGVQNIARTK	sp|Q9INI2|NS1_BAVJK	494	tr|C9JG86|C9JG86_HUMAN Histone-lysine N-methyltransferase SETD2 (Fragment) OS=Homo sapiens OX=9606 GN=SETD2 PE=1 SV=1	673	SSNGFQNISRCK
SSNGVQNIARTK	sp|Q9INI2|NS1_BAVJK	494	tr|H7BZ93|H7BZ93_HUMAN Histone-lysine N-methyltransferase SETD2 (Fragment) OS=Homo sapiens OX=9606 GN=SETD2 PE=1 SV=1	435	SSNGFQNISRCK
SSNGVQNIARTK	sp|Q9INI2|NS1_BAVJK	494	tr|H7C3H4|H7C3H4_HUMAN Histone-lysine N-methyltransferase SETD2 (Fragment) OS=Homo sapiens OX=9606 GN=SETD2 PE=1 SV=1	351	SSNGFQNISRCK
SSNGVQNIARTK	sp|Q9INI2|NS1_BAVJK	494	sp|Q9BYW2|SETD2_HUMAN Histone-lysine N-methyltransferase SETD2 OS=Homo sapiens OX=9606 GN=SETD2 PE=1 SV=3	717	SSNGFQNISRCK
SSNGVQNIARTK	sp|Q9INI2|NS1_BAVJK	494	tr|H7BXT4|H7BXT4_HUMAN Histone-lysine N-methyltransferase SETD2 (Fragment) OS=Homo sapiens OX=9606 GN=SETD2 PE=1 SV=1	589	SSNGFQNISRCK
NPNTQKLFVRDP	sp|Q9INI5|VP2_BAVJK	936	sp|Q15165|PON2_HUMAN Serum paraoxonase/arylesterase 2 OS=Homo sapiens OX=9606 GN=PON2 PE=1 SV=4	284	HPNGQKLFVYDP
NPNTQKLFVRDP	sp|Q9INI5|VP2_BAVJK	936	tr|A0A0J9YXF2|A0A0J9YXF2_HUMAN Paraoxonase 2, isoform CRA_a OS=Homo sapiens OX=9606 GN=PON2 PE=1 SV=1	305	HPNGQKLFVYDP
GTRLVSVNSVVL	sp|Q9YWQ1|SPIKE_BAVJK	86	sp|Q12923|PTN13_HUMAN Tyrosine-protein phosphatase non-receptor type 13 OS=Homo sapiens OX=9606 GN=PTPN13 PE=1 SV=2	1141	GDRLISVNSVSL
LNSRLTSLGAVS	sp|Q9INJ1|RDRP_BAVJK	590	tr|A0A0C4DGD4|A0A0C4DGD4_HUMAN D-glutamate cyclase, mitochondrial (Fragment) OS=Homo sapiens OX=9606 GN=DGLUCY PE=1 SV=1	230	WPSPLTSLGAVS
LNSRLTSLGAVS	sp|Q9INJ1|RDRP_BAVJK	590	sp|Q7Z3D6|GLUCM_HUMAN D-glutamate cyclase, mitochondrial OS=Homo sapiens OX=9606 GN=DGLUCY PE=1 SV=2	225	WPSPLTSLGAVS
LNSRLTSLGAVS	sp|Q9INJ1|RDRP_BAVJK	590	tr|H0YB09|H0YB09_HUMAN D-glutamate cyclase, mitochondrial (Fragment) OS=Homo sapiens OX=9606 GN=DGLUCY PE=1 SV=1	215	WPSPLTSLGAVS
LNSRLTSLGAVS	sp|Q9INJ1|RDRP_BAVJK	590	tr|H0YB62|H0YB62_HUMAN D-glutamate cyclase, mitochondrial (Fragment) OS=Homo sapiens OX=9606 GN=DGLUCY PE=1 SV=1	132	WPSPLTSLGAVS
GYKVRGTKVSLS	sp|Q9INI4|VP3_BAVJK	74	tr|K7EJS8|K7EJS8_HUMAN Kin of IRRE-like protein 2 OS=Homo sapiens OX=9606 GN=KIRREL2 PE=1 SV=2	568	YYKVRGVSVSLS
GYKVRGTKVSLS	sp|Q9INI4|VP3_BAVJK	74	sp|Q6UWL6|KIRR2_HUMAN Kin of IRRE-like protein 2 OS=Homo sapiens OX=9606 GN=KIRREL2 PE=1 SV=2	603	YYKVRGVSVSLS
SRGEVEKVLASR	sp|Q9YWQ1|SPIKE_BAVJK	35	sp|Q8TDX9|PK1L1_HUMAN Polycystic kidney disease protein 1-like 1 OS=Homo sapiens OX=9606 GN=PKD1L1 PE=1 SV=1	2239	CAGEVEKVLAAR
IRKYLKELEVTL	sp|Q9INI4|VP3_BAVJK	632	sp|Q8NDH2|CC168_HUMAN Coiled-coil domain-containing protein 168 OS=Homo sapiens OX=9606 GN=CCDC168 PE=2 SV=2	1105	IRKISKELYVTL
SLEAIKLADGQP	sp|Q9INJ1|RDRP_BAVJK	758	sp|Q9H3S7|PTN23_HUMAN Tyrosine-protein phosphatase non-receptor type 23 OS=Homo sapiens OX=9606 GN=PTPN23 PE=1 SV=1	280	LNEAIKLAKGQP
PRSRGEKGEVVY	sp|Q9INI5|VP2_BAVJK	45	tr|B5MCW3|B5MCW3_HUMAN Bromodomain-containing protein 8 OS=Homo sapiens OX=9606 GN=BRD8 PE=1 SV=1	79	KRKRGEKGEVVE
PRSRGEKGEVVY	sp|Q9INI5|VP2_BAVJK	45	sp|Q9H0E9|BRD8_HUMAN Bromodomain-containing protein 8 OS=Homo sapiens OX=9606 GN=BRD8 PE=1 SV=2	79	KRKRGEKGEVVE
PRSRGEKGEVVY	sp|Q9INI5|VP2_BAVJK	45	tr|H7C127|H7C127_HUMAN Bromodomain-containing protein 8 (Fragment) OS=Homo sapiens OX=9606 GN=BRD8 PE=1 SV=1	74	KRKRGEKGEVVE
PRSRGEKGEVVY	sp|Q9INI5|VP2_BAVJK	45	tr|H7C179|H7C179_HUMAN Bromodomain-containing protein 8 (Fragment) OS=Homo sapiens OX=9606 GN=BRD8 PE=1 SV=1	74	KRKRGEKGEVVE
PRSRGEKGEVVY	sp|Q9INI5|VP2_BAVJK	45	tr|H7C128|H7C128_HUMAN Bromodomain-containing protein 8 (Fragment) OS=Homo sapiens OX=9606 GN=BRD8 PE=1 SV=1	73	KRKRGEKGEVVE
EGLARDGRILPV	sp|Q9INI5|VP2_BAVJK	78	sp|Q99489|OXDD_HUMAN D-aspartate oxidase OS=Homo sapiens OX=9606 GN=DDO PE=1 SV=1	289	ELLARDGQRLPV
SSLTSPVSDPAT	sp|Q9INI2|NS1_BAVJK	431	tr|A0A1B0GUX8|A0A1B0GUX8_HUMAN Genetic suppressor element 1 (Fragment) OS=Homo sapiens OX=9606 GN=GSE1 PE=1 SV=1	17	SSESSPVSSPAT
SSLTSPVSDPAT	sp|Q9INI2|NS1_BAVJK	431	sp|Q14687|GSE1_HUMAN Genetic suppressor element 1 OS=Homo sapiens OX=9606 GN=GSE1 PE=1 SV=3	80	SSESSPVSSPAT
KSKAKVKGQNKE	sp|Q9INI2|NS1_BAVJK	254	tr|E9PLM6|E9PLM6_HUMAN Midkine OS=Homo sapiens OX=9606 GN=MDK PE=1 SV=1	129	KTKAKAKGQRKE
KLEDTTEQSDAD	sp|Q9INI1|NS2_BAVJK	16	tr|A0A087WZU5|A0A087WZU5_HUMAN Tetraspanin-6 OS=Homo sapiens OX=9606 GN=TSPAN6 PE=1 SV=1	91	KLEDCTPQRDAD
KLEDTTEQSDAD	sp|Q9INI1|NS2_BAVJK	16	sp|O43657|TSN6_HUMAN Tetraspanin-6 OS=Homo sapiens OX=9606 GN=TSPAN6 PE=1 SV=1	179	KLEDCTPQRDAD
KLEDTTEQSDAD	sp|Q9INI1|NS2_BAVJK	16	tr|A0A087WYV6|A0A087WYV6_HUMAN Tetraspanin-6 OS=Homo sapiens OX=9606 GN=TSPAN6 PE=1 SV=1	91	KLEDCTPQRDAD
KLEDTTEQSDAD	sp|Q9INI1|NS2_BAVJK	16	sp|Q8WWB5|PIHD2_HUMAN PIH1 domain-containing protein 2 OS=Homo sapiens OX=9606 GN=PIH1D2 PE=1 SV=1	92	KPEDTTEISDAY
KLEDTTEQSDAD	sp|Q9INI1|NS2_BAVJK	16	tr|A0A0A0MTE1|A0A0A0MTE1_HUMAN PIH1 domain-containing protein 2 (Fragment) OS=Homo sapiens OX=9606 GN=PIH1D2 PE=1 SV=1	57	KPEDTTEISDAY
MAEEVALEEQVK	sp|Q9INJ1|RDRP_BAVJK	357	tr|D6RF05|D6RF05_HUMAN Histidine--tRNA ligase, cytoplasmic OS=Homo sapiens OX=9606 GN=HARS1 PE=1 SV=1	1	MAERAALEELVK
MAEEVALEEQVK	sp|Q9INJ1|RDRP_BAVJK	357	tr|A0A6Q8PHQ0|A0A6Q8PHQ0_HUMAN Histidine--tRNA ligase, cytoplasmic OS=Homo sapiens OX=9606 GN=HARS1 PE=1 SV=1	1	MAERAALEELVK
MAEEVALEEQVK	sp|Q9INJ1|RDRP_BAVJK	357	tr|B4E1C5|B4E1C5_HUMAN Histidine--tRNA ligase, cytoplasmic OS=Homo sapiens OX=9606 GN=HARS1 PE=1 SV=1	1	MAERAALEELVK
MAEEVALEEQVK	sp|Q9INJ1|RDRP_BAVJK	357	tr|B4DDD8|B4DDD8_HUMAN Histidine--tRNA ligase, cytoplasmic OS=Homo sapiens OX=9606 GN=HARS1 PE=1 SV=1	1	MAERAALEELVK
MAEEVALEEQVK	sp|Q9INJ1|RDRP_BAVJK	357	tr|A0A6Q8PFG9|A0A6Q8PFG9_HUMAN Histidine--tRNA ligase, cytoplasmic OS=Homo sapiens OX=9606 GN=HARS1 PE=1 SV=1	1	MAERAALEELVK
MAEEVALEEQVK	sp|Q9INJ1|RDRP_BAVJK	357	tr|A0A6Q8PFN6|A0A6Q8PFN6_HUMAN Histidine--tRNA ligase, cytoplasmic OS=Homo sapiens OX=9606 GN=HARS1 PE=1 SV=1	1	MAERAALEELVK
MAEEVALEEQVK	sp|Q9INJ1|RDRP_BAVJK	357	tr|A0A6Q8PFF2|A0A6Q8PFF2_HUMAN Histidine--tRNA ligase, cytoplasmic OS=Homo sapiens OX=9606 GN=HARS1 PE=1 SV=1	1	MAERAALEELVK
MAEEVALEEQVK	sp|Q9INJ1|RDRP_BAVJK	357	sp|P12081|HARS1_HUMAN Histidine--tRNA ligase, cytoplasmic OS=Homo sapiens OX=9606 GN=HARS1 PE=1 SV=2	1	MAERAALEELVK
MAEEVALEEQVK	sp|Q9INJ1|RDRP_BAVJK	357	tr|E7ETE2|E7ETE2_HUMAN Histidine--tRNA ligase, cytoplasmic OS=Homo sapiens OX=9606 GN=HARS1 PE=1 SV=2	1	MAERAALEELVK
MAEEVALEEQVK	sp|Q9INJ1|RDRP_BAVJK	357	tr|A0A6Q8PF47|A0A6Q8PF47_HUMAN Histidine--tRNA ligase, cytoplasmic OS=Homo sapiens OX=9606 GN=HARS1 PE=1 SV=1	1	MAERAALEELVK
MAEEVALEEQVK	sp|Q9INJ1|RDRP_BAVJK	357	tr|A0A6Q8PHA5|A0A6Q8PHA5_HUMAN Histidine--tRNA ligase, cytoplasmic OS=Homo sapiens OX=9606 GN=HARS1 PE=1 SV=1	1	MAERAALEELVK
MAEEVALEEQVK	sp|Q9INJ1|RDRP_BAVJK	357	tr|A0A6Q8PHE3|A0A6Q8PHE3_HUMAN Histidine--tRNA ligase, cytoplasmic OS=Homo sapiens OX=9606 GN=HARS1 PE=1 SV=1	1	MAERAALEELVK
MAEEVALEEQVK	sp|Q9INJ1|RDRP_BAVJK	357	tr|A0A2R8YCI2|A0A2R8YCI2_HUMAN Histidine--tRNA ligase, cytoplasmic OS=Homo sapiens OX=9606 GN=HARS1 PE=1 SV=1	1	MAERAALEELVK
YEQTTFGTLQRL	sp|Q9INJ1|RDRP_BAVJK	639	tr|A0A0J9YXN9|A0A0J9YXN9_HUMAN Solute carrier family 22 member 18 (Fragment) OS=Homo sapiens OX=9606 GN=SLC22A18 PE=4 SV=1	63	YLQTTFGVLQLL
YEQTTFGTLQRL	sp|Q9INJ1|RDRP_BAVJK	639	tr|E9PMN7|E9PMN7_HUMAN Solute carrier family 22 member 18 (Fragment) OS=Homo sapiens OX=9606 GN=SLC22A18 PE=4 SV=1	63	YLQTTFGVLQLL
YEQTTFGTLQRL	sp|Q9INJ1|RDRP_BAVJK	639	sp|Q96BI1|S22AI_HUMAN Solute carrier family 22 member 18 OS=Homo sapiens OX=9606 GN=SLC22A18 PE=1 SV=3	63	YLQTTFGVLQLL
YEQTTFGTLQRL	sp|Q9INJ1|RDRP_BAVJK	639	tr|A0A024RCG2|A0A024RCG2_HUMAN Solute carrier family 22 (Organic cation transporter), member 18, isoform CRA_a OS=Homo sapiens OX=9606 GN=SLC22A18 PE=1 SV=1	63	YLQTTFGVLQLL
YEQTTFGTLQRL	sp|Q9INJ1|RDRP_BAVJK	639	tr|E9PRM7|E9PRM7_HUMAN Solute carrier family 22 member 18 OS=Homo sapiens OX=9606 GN=SLC22A18 PE=1 SV=1	63	YLQTTFGVLQLL
YEQTTFGTLQRL	sp|Q9INJ1|RDRP_BAVJK	639	tr|A0A0J9YWM3|A0A0J9YWM3_HUMAN Solute carrier family 22 member 18 OS=Homo sapiens OX=9606 GN=SLC22A18 PE=1 SV=1	63	YLQTTFGVLQLL
PVEGPFLVIAPL	sp|Q9YJJ8|VP8_BAVJK	200	sp|Q9P2D1|CHD7_HUMAN Chromodomain-helicase-DNA-binding protein 7 OS=Homo sapiens OX=9606 GN=CHD7 PE=1 SV=3	1014	GIHGPFLVIAPL
PVEGPFLVIAPL	sp|Q9YJJ8|VP8_BAVJK	200	tr|A0A2R8Y840|A0A2R8Y840_HUMAN DNA helicase (Fragment) OS=Homo sapiens OX=9606 GN=CHD8 PE=1 SV=1	859	GIHGPFLVIAPL
PVEGPFLVIAPL	sp|Q9YJJ8|VP8_BAVJK	200	sp|Q9HCK8|CHD8_HUMAN Chromodomain-helicase-DNA-binding protein 8 OS=Homo sapiens OX=9606 GN=CHD8 PE=1 SV=5	857	GIHGPFLVIAPL
PVEGPFLVIAPL	sp|Q9YJJ8|VP8_BAVJK	200	tr|H0YJG4|H0YJG4_HUMAN Chromodomain-helicase-DNA-binding protein 8 (Fragment) OS=Homo sapiens OX=9606 GN=CHD8 PE=1 SV=2	83	GIHGPFLVIAPL
PVEGPFLVIAPL	sp|Q9YJJ8|VP8_BAVJK	200	tr|A0A2R8Y4P3|A0A2R8Y4P3_HUMAN DNA helicase (Fragment) OS=Homo sapiens OX=9606 GN=CHD8 PE=1 SV=1	828	GIHGPFLVIAPL
STESDYLSFGSF	sp|Q9INI2|NS1_BAVJK	142	sp|P19525|E2AK2_HUMAN Interferon-induced, double-stranded RNA-activated protein kinase OS=Homo sapiens OX=9606 GN=EIF2AK2 PE=1 SV=2	171	SVKSDYLSSGSF
LLGGGSLSSKEY	sp|Q9INI4|VP3_BAVJK	519	sp|Q8N398|VW5B2_HUMAN von Willebrand factor A domain-containing protein 5B2 OS=Homo sapiens OX=9606 GN=VWA5B2 PE=2 SV=3	281	MLEGGSLSSAEY
LLGGGSLSSKEY	sp|Q9INI4|VP3_BAVJK	519	tr|E9PF42|E9PF42_HUMAN von Willebrand factor A domain-containing protein 5B2 OS=Homo sapiens OX=9606 GN=VWA5B2 PE=1 SV=1	62	MLEGGSLSSAEY
LLRGELSPDSAL	sp|Q9YWQ0|NS3_BAVJK	162	sp|P24855|DNAS1_HUMAN Deoxyribonuclease-1 OS=Homo sapiens OX=9606 GN=DNASE1 PE=1 SV=1	242	LLRGAVVPDSAL
LLRGELSPDSAL	sp|Q9YWQ0|NS3_BAVJK	162	tr|I3L4C7|I3L4C7_HUMAN Deoxyribonuclease-1 (Fragment) OS=Homo sapiens OX=9606 GN=DNASE1 PE=3 SV=1	31	LLRGAVVPDSAL
LLRGELSPDSAL	sp|Q9YWQ0|NS3_BAVJK	162	tr|I3L4B8|I3L4B8_HUMAN Deoxyribonuclease-1 (Fragment) OS=Homo sapiens OX=9606 GN=DNASE1 PE=1 SV=1	38	LLRGAVVPDSAL
SSVTIAGSERAD	sp|Q9YJJ8|VP8_BAVJK	137	sp|O43896|KIF1C_HUMAN Kinesin-like protein KIF1C OS=Homo sapiens OX=9606 GN=KIF1C PE=1 SV=3	245	SLVDLAGSERAD
SSVTIAGSERAD	sp|Q9YJJ8|VP8_BAVJK	137	tr|A0A3B3ITF7|A0A3B3ITF7_HUMAN Kinesin-like protein KIF1A OS=Homo sapiens OX=9606 GN=KIF1A PE=1 SV=1	245	SLVDLAGSERAD
SSVTIAGSERAD	sp|Q9YJJ8|VP8_BAVJK	137	tr|A0A3B3IUA1|A0A3B3IUA1_HUMAN Kinesin-like protein KIF1A OS=Homo sapiens OX=9606 GN=KIF1A PE=1 SV=1	245	SLVDLAGSERAD
SSVTIAGSERAD	sp|Q9YJJ8|VP8_BAVJK	137	sp|Q12756|KIF1A_HUMAN Kinesin-like protein KIF1A OS=Homo sapiens OX=9606 GN=KIF1A PE=1 SV=2	245	SLVDLAGSERAD
SSVTIAGSERAD	sp|Q9YJJ8|VP8_BAVJK	137	tr|A0A3F2YNW9|A0A3F2YNW9_HUMAN Kinesin-like protein KIF1A OS=Homo sapiens OX=9606 GN=KIF1A PE=1 SV=1	245	SLVDLAGSERAD
SSVTIAGSERAD	sp|Q9YJJ8|VP8_BAVJK	137	tr|A0A3B3ITW6|A0A3B3ITW6_HUMAN Kinesin-like protein KIF1A OS=Homo sapiens OX=9606 GN=KIF1A PE=1 SV=1	245	SLVDLAGSERAD
SSVTIAGSERAD	sp|Q9YJJ8|VP8_BAVJK	137	tr|H7C0K6|H7C0K6_HUMAN Kinesin-like protein (Fragment) OS=Homo sapiens OX=9606 GN=KIF1A PE=1 SV=2	245	SLVDLAGSERAD
SSVTIAGSERAD	sp|Q9YJJ8|VP8_BAVJK	137	tr|A0A3B3IT28|A0A3B3IT28_HUMAN Kinesin-like protein KIF1A OS=Homo sapiens OX=9606 GN=KIF1A PE=1 SV=1	245	SLVDLAGSERAD
SSVTIAGSERAD	sp|Q9YJJ8|VP8_BAVJK	137	tr|A0A3B3IU40|A0A3B3IU40_HUMAN Kinesin-like protein KIF1A OS=Homo sapiens OX=9606 GN=KIF1A PE=1 SV=1	245	SLVDLAGSERAD
SSVTIAGSERAD	sp|Q9YJJ8|VP8_BAVJK	137	tr|A0A3B3ITE5|A0A3B3ITE5_HUMAN Kinesin-like protein KIF1A OS=Homo sapiens OX=9606 GN=KIF1A PE=1 SV=1	245	SLVDLAGSERAD
SSVTIAGSERAD	sp|Q9YJJ8|VP8_BAVJK	137	tr|A0A087WWA3|A0A087WWA3_HUMAN Kinesin-like protein KIF1B OS=Homo sapiens OX=9606 GN=KIF1B PE=1 SV=1	245	SLVDLAGSERAD
SSVTIAGSERAD	sp|Q9YJJ8|VP8_BAVJK	137	sp|O60333|KIF1B_HUMAN Kinesin-like protein KIF1B OS=Homo sapiens OX=9606 GN=KIF1B PE=1 SV=5	245	SLVDLAGSERAD
SSVTIAGSERAD	sp|Q9YJJ8|VP8_BAVJK	137	tr|Q4R9M9|Q4R9M9_HUMAN Kinesin family member 1Bbeta isoform II OS=Homo sapiens OX=9606 GN=KIF1B PE=1 SV=1	245	SLVDLAGSERAD
PFLVIAPLGTPA	sp|Q9YJJ8|VP8_BAVJK	204	tr|H3BTW3|H3BTW3_HUMAN DNA helicase OS=Homo sapiens OX=9606 GN=CHD9 PE=1 SV=9	436	PFLIIAPLSTIA
PFLVIAPLGTPA	sp|Q9YJJ8|VP8_BAVJK	204	sp|Q3L8U1|CHD9_HUMAN Chromodomain-helicase-DNA-binding protein 9 OS=Homo sapiens OX=9606 GN=CHD9 PE=1 SV=2	910	PFLIIAPLSTIA
PFLVIAPLGTPA	sp|Q9YJJ8|VP8_BAVJK	204	sp|Q9P2D1|CHD7_HUMAN Chromodomain-helicase-DNA-binding protein 7 OS=Homo sapiens OX=9606 GN=CHD7 PE=1 SV=3	1018	PFLVIAPLSTIP
PFLVIAPLGTPA	sp|Q9YJJ8|VP8_BAVJK	204	tr|A0A2R8Y840|A0A2R8Y840_HUMAN DNA helicase (Fragment) OS=Homo sapiens OX=9606 GN=CHD8 PE=1 SV=1	863	PFLVIAPLSTIT
PFLVIAPLGTPA	sp|Q9YJJ8|VP8_BAVJK	204	sp|Q9HCK8|CHD8_HUMAN Chromodomain-helicase-DNA-binding protein 8 OS=Homo sapiens OX=9606 GN=CHD8 PE=1 SV=5	861	PFLVIAPLSTIT
PFLVIAPLGTPA	sp|Q9YJJ8|VP8_BAVJK	204	tr|H0YJG4|H0YJG4_HUMAN Chromodomain-helicase-DNA-binding protein 8 (Fragment) OS=Homo sapiens OX=9606 GN=CHD8 PE=1 SV=2	87	PFLVIAPLSTIT
PFLVIAPLGTPA	sp|Q9YJJ8|VP8_BAVJK	204	tr|A0A2R8Y4P3|A0A2R8Y4P3_HUMAN DNA helicase (Fragment) OS=Homo sapiens OX=9606 GN=CHD8 PE=1 SV=1	832	PFLVIAPLSTIT
NSSLTSPVSDPA	sp|Q9INI2|NS1_BAVJK	430	tr|F5H271|F5H271_HUMAN Protein C12orf4 OS=Homo sapiens OX=9606 GN=C12orf4 PE=1 SV=1	66	NSSLRSPVEDHA
LGGGSLSSKEYL	sp|Q9INI4|VP3_BAVJK	520	sp|Q8N398|VW5B2_HUMAN von Willebrand factor A domain-containing protein 5B2 OS=Homo sapiens OX=9606 GN=VWA5B2 PE=2 SV=3	282	LEGGSLSSAEYE
LGGGSLSSKEYL	sp|Q9INI4|VP3_BAVJK	520	tr|E9PF42|E9PF42_HUMAN von Willebrand factor A domain-containing protein 5B2 OS=Homo sapiens OX=9606 GN=VWA5B2 PE=1 SV=1	63	LEGGSLSSAEYE
SYQVYSVLEELE	sp|Q9INI5|VP2_BAVJK	830	tr|E7EWP2|E7EWP2_HUMAN Triple functional domain protein OS=Homo sapiens OX=9606 GN=TRIO PE=1 SV=2	961	SEQVCSVLESLE
SYQVYSVLEELE	sp|Q9INI5|VP2_BAVJK	830	tr|E7EPJ7|E7EPJ7_HUMAN Non-specific serine/threonine protein kinase (Fragment) OS=Homo sapiens OX=9606 GN=TRIO PE=1 SV=2	753	SEQVCSVLESLE
SYQVYSVLEELE	sp|Q9INI5|VP2_BAVJK	830	sp|O75962|TRIO_HUMAN Triple functional domain protein OS=Homo sapiens OX=9606 GN=TRIO PE=1 SV=2	1020	SEQVCSVLESLE
SYQVYSVLEELE	sp|Q9INI5|VP2_BAVJK	830	tr|F5H228|F5H228_HUMAN Triple functional domain protein OS=Homo sapiens OX=9606 GN=TRIO PE=1 SV=1	971	SEQVCSVLESLE
SYQVYSVLEELE	sp|Q9INI5|VP2_BAVJK	830	tr|C9IZQ6|C9IZQ6_HUMAN HCG2022551, isoform CRA_j OS=Homo sapiens OX=9606 GN=KALRN PE=1 SV=1	1003	SEQVCSVLESLE
SYQVYSVLEELE	sp|Q9INI5|VP2_BAVJK	830	sp|O60229|KALRN_HUMAN Kalirin OS=Homo sapiens OX=9606 GN=KALRN PE=1 SV=3	1012	SEQVCSVLESLE
SYQVYSVLEELE	sp|Q9INI5|VP2_BAVJK	830	tr|H7BXZ5|H7BXZ5_HUMAN Non-specific serine/threonine protein kinase (Fragment) OS=Homo sapiens OX=9606 GN=KALRN PE=1 SV=1	981	SEQVCSVLESLE
NLKLEDTTEQSD	sp|Q9INI1|NS2_BAVJK	14	sp|Q86WI1|PKHL1_HUMAN Fibrocystin-L OS=Homo sapiens OX=9606 GN=PKHD1L1 PE=2 SV=2	3645	NIKLVDTTEQSK
NLKLEDTTEQSD	sp|Q9INI1|NS2_BAVJK	14	tr|H0YF65|H0YF65_HUMAN Fibrocystin-L (Fragment) OS=Homo sapiens OX=9606 GN=PKHD1L1 PE=1 SV=1	573	NIKLVDTTEQSK
EAIKLADGQPAQ	sp|Q9INJ1|RDRP_BAVJK	760	sp|Q9H3S7|PTN23_HUMAN Tyrosine-protein phosphatase non-receptor type 23 OS=Homo sapiens OX=9606 GN=PTPN23 PE=1 SV=1	282	EAIKLAKGQPDT
