query	query_seqname	query_start	target_seqname	target_start	target
VEEIKGELKLGL	tr|Q4QXJ9|Q4QXJ9_EEEVF	357	tr|C9IZQ6|C9IZQ6_HUMAN HCG2022551, isoform CRA_j OS=Homo sapiens OX=9606 GN=KALRN PE=1 SV=1	1423	CEEGKGELKDGL
VEEIKGELKLGL	tr|Q4QXJ9|Q4QXJ9_EEEVF	357	sp|O60229|KALRN_HUMAN Kalirin OS=Homo sapiens OX=9606 GN=KALRN PE=1 SV=3	1432	CEEGKGELKDGL
VEEIKGELKLGL	tr|Q4QXJ9|Q4QXJ9_EEEVF	357	tr|H7BXZ5|H7BXZ5_HUMAN Non-specific serine/threonine protein kinase (Fragment) OS=Homo sapiens OX=9606 GN=KALRN PE=1 SV=1	1401	CEEGKGELKDGL
VEEIKGELKLGL	tr|Q4QXJ9|Q4QXJ9_EEEVF	357	sp|Q6N069|NAA16_HUMAN N-alpha-acetyltransferase 16, NatA auxiliary subunit OS=Homo sapiens OX=9606 GN=NAA16 PE=1 SV=2	226	VEEIKGEILLKL
VEEIKGELKLGL	tr|Q4QXJ9|Q4QXJ9_EEEVF	357	sp|Q9BXJ9|NAA15_HUMAN N-alpha-acetyltransferase 15, NatA auxiliary subunit OS=Homo sapiens OX=9606 GN=NAA15 PE=1 SV=1	226	VEETKGELLLQL
VEEIKGELKLGL	tr|Q4QXJ9|Q4QXJ9_EEEVF	357	tr|A0A0B4J1W3|A0A0B4J1W3_HUMAN N-alpha-acetyltransferase 15, NatA auxiliary subunit OS=Homo sapiens OX=9606 GN=NAA15 PE=1 SV=1	226	VEETKGELLLQL
EKSPAASGKIRL	sp|Q4QXJ8|POLN_EEEVF	1373	sp|O75683|SURF6_HUMAN Surfeit locus protein 6 OS=Homo sapiens OX=9606 GN=SURF6 PE=1 SV=3	72	EKSPAASGARRP
TLSKTQFESAPA	sp|Q4QXJ8|POLN_EEEVF	1025	sp|Q5VT52|RPRD2_HUMAN Regulation of nuclear pre-mRNA domain-containing protein 2 OS=Homo sapiens OX=9606 GN=RPRD2 PE=1 SV=1	524	ALSKTQTQSAPA
LHTLKEVLKKYP	sp|Q4QXJ8|POLN_EEEVF	1093	sp|Q9NRY4|RHG35_HUMAN Rho GTPase-activating protein 35 OS=Homo sapiens OX=9606 GN=ARHGAP35 PE=1 SV=3	1354	LHALKEVLKKFP
MAVEEIKGELKL	tr|Q4QXJ9|Q4QXJ9_EEEVF	355	tr|E5RHB1|E5RHB1_HUMAN EF-hand calcium-binding domain-containing protein 3 (Fragment) OS=Homo sapiens OX=9606 GN=EFCAB3 PE=1 SV=1	1	MAVSEIKPKLKL
MAVEEIKGELKL	tr|Q4QXJ9|Q4QXJ9_EEEVF	355	tr|E5RJB7|E5RJB7_HUMAN EF-hand calcium-binding domain-containing protein 3 (Fragment) OS=Homo sapiens OX=9606 GN=EFCAB3 PE=1 SV=1	1	MAVSEIKPKLKL
MAVEEIKGELKL	tr|Q4QXJ9|Q4QXJ9_EEEVF	355	sp|Q8N7B9|EFCB3_HUMAN EF-hand calcium-binding domain-containing protein 3 OS=Homo sapiens OX=9606 GN=EFCAB3 PE=1 SV=1	1	MAVSEIKPKLKL
MAVEEIKGELKL	tr|Q4QXJ9|Q4QXJ9_EEEVF	355	sp|Q9BXJ9|NAA15_HUMAN N-alpha-acetyltransferase 15, NatA auxiliary subunit OS=Homo sapiens OX=9606 GN=NAA15 PE=1 SV=1	224	LAVEETKGELLL
MAVEEIKGELKL	tr|Q4QXJ9|Q4QXJ9_EEEVF	355	tr|A0A0B4J1W3|A0A0B4J1W3_HUMAN N-alpha-acetyltransferase 15, NatA auxiliary subunit OS=Homo sapiens OX=9606 GN=NAA15 PE=1 SV=1	224	LAVEETKGELLL
LCLHTLKEVLKK	sp|Q4QXJ8|POLN_EEEVF	1091	sp|Q9NRY4|RHG35_HUMAN Rho GTPase-activating protein 35 OS=Homo sapiens OX=9606 GN=ARHGAP35 PE=1 SV=3	1352	QKLHALKEVLKK
LAKLCTLILQEN	sp|Q4QXJ8|POLN_EEEVF	2007	sp|Q9Y2C9|TLR6_HUMAN Toll-like receptor 6 OS=Homo sapiens OX=9606 GN=TLR6 PE=1 SV=2	376	LVKLETLILQKN
AETCALGTLPAT	tr|Q4QXJ9|Q4QXJ9_EEEVF	1070	sp|Q9NR96|TLR9_HUMAN Toll-like receptor 9 OS=Homo sapiens OX=9606 GN=TLR9 PE=1 SV=2	21	AMTLALGTLPAF
AETCALGTLPAT	tr|Q4QXJ9|Q4QXJ9_EEEVF	1070	tr|H0Y858|H0Y858_HUMAN Toll-like receptor 9 (Fragment) OS=Homo sapiens OX=9606 PE=3 SV=1	175	AMTLALGTLPAF
RFRATGVSHVQC	sp|Q4QXJ8|POLN_EEEVF	1621	sp|Q14623|IHH_HUMAN Indian hedgehog protein OS=Homo sapiens OX=9606 GN=IHH PE=1 SV=4	289	RFRATFASHVQP
TSGSQSTLTTLG	sp|Q4QXJ8|POLN_EEEVF	1690	tr|H0YA77|H0YA77_HUMAN Ciliogenesis and planar polarity effector 1 (Fragment) OS=Homo sapiens OX=9606 GN=CPLANE1 PE=1 SV=1	460	TSLSRSTLTELG
TSGSQSTLTTLG	sp|Q4QXJ8|POLN_EEEVF	1690	tr|A0A494BZW6|A0A494BZW6_HUMAN Ciliogenesis and planar polarity effector 1 (Fragment) OS=Homo sapiens OX=9606 GN=CPLANE1 PE=1 SV=1	1455	TSLSRSTLTELG
TSGSQSTLTTLG	sp|Q4QXJ8|POLN_EEEVF	1690	sp|Q9H799|CPLN1_HUMAN Ciliogenesis and planar polarity effector 1 OS=Homo sapiens OX=9606 GN=CPLANE1 PE=1 SV=4	1455	TSLSRSTLTELG
TSGSQSTLTTLG	sp|Q4QXJ8|POLN_EEEVF	1690	tr|H0Y9I8|H0Y9I8_HUMAN Ciliogenesis and planar polarity effector 1 (Fragment) OS=Homo sapiens OX=9606 GN=CPLANE1 PE=1 SV=1	503	TSLSRSTLTELG
PRFRATGVSHVQ	sp|Q4QXJ8|POLN_EEEVF	1620	sp|Q14623|IHH_HUMAN Indian hedgehog protein OS=Homo sapiens OX=9606 GN=IHH PE=1 SV=4	288	ARFRATFASHVQ
ASRGGTCLALGW	sp|Q4QXJ8|POLN_EEEVF	1244	sp|Q9UQF0|SYCY1_HUMAN Syncytin-1 OS=Homo sapiens OX=9606 GN=ERVW-1 PE=1 SV=1	391	AERGGTCLFLGE
ISGEGLDFNYGN	tr|Q4QXJ9|Q4QXJ9_EEEVF	642	sp|P22897|MRC1_HUMAN Macrophage mannose receptor 1 OS=Homo sapiens OX=9606 GN=MRC1 PE=1 SV=1	110	IKGEDLFFNYGN
LETALISAADAM	sp|Q4QXJ8|POLN_EEEVF	2282	sp|Q5KSL6|DGKK_HUMAN Diacylglycerol kinase kappa OS=Homo sapiens OX=9606 GN=DGKK PE=1 SV=1	1173	DETALQSALDAM
ANPSLALNSDRV	sp|Q4QXJ8|POLN_EEEVF	560	sp|P40938|RFC3_HUMAN Replication factor C subunit 3 OS=Homo sapiens OX=9606 GN=RFC3 PE=1 SV=2	95	VNPSDAGNSDRV
LSTLIPAALMLA	tr|Q4QXJ9|Q4QXJ9_EEEVF	764	sp|P0DKB5|TPBGL_HUMAN Trophoblast glycoprotein-like OS=Homo sapiens OX=9606 GN=TPBGL PE=3 SV=1	184	LSRLPPAALRLA
DSKAPQPPSQDS	sp|Q4QXJ8|POLN_EEEVF	1771	sp|Q9UKJ3|GPTC8_HUMAN G patch domain-containing protein 8 OS=Homo sapiens OX=9606 GN=GPATCH8 PE=1 SV=2	1057	DSKATGPPSQNS
YALRRVNANPGL	sp|Q4QXJ8|POLN_EEEVF	283	sp|O15303|GRM6_HUMAN Metabotropic glutamate receptor 6 OS=Homo sapiens OX=9606 GN=GRM6 PE=1 SV=2	74	YALDRVNADPEL
AIATNVFSGSTN	sp|Q4QXJ8|POLN_EEEVF	1311	sp|Q5M8T2|S35D3_HUMAN Solute carrier family 35 member D3 OS=Homo sapiens OX=9606 GN=SLC35D3 PE=2 SV=1	15	AIAHGVFSGSLN
RRVQLCLTDGNK	sp|Q4QXJ8|POLN_EEEVF	1936	tr|A0A6Q8PGI7|A0A6Q8PGI7_HUMAN Nephrocystin-1 (Fragment) OS=Homo sapiens OX=9606 GN=NPHP1 PE=1 SV=1	327	RHVRLCLFDGNK
RRVQLCLTDGNK	sp|Q4QXJ8|POLN_EEEVF	1936	tr|C9JNM7|C9JNM7_HUMAN Nephrocystin-1 OS=Homo sapiens OX=9606 GN=NPHP1 PE=1 SV=1	349	RHVRLCLFDGNK
RRVQLCLTDGNK	sp|Q4QXJ8|POLN_EEEVF	1936	sp|O15259|NPHP1_HUMAN Nephrocystin-1 OS=Homo sapiens OX=9606 GN=NPHP1 PE=1 SV=1	405	RHVRLCLFDGNK
RRVQLCLTDGNK	sp|Q4QXJ8|POLN_EEEVF	1936	tr|A0A6Q8PHD4|A0A6Q8PHD4_HUMAN Nephrocystin-1 OS=Homo sapiens OX=9606 GN=NPHP1 PE=1 SV=1	289	RHVRLCLFDGNK
RRVQLCLTDGNK	sp|Q4QXJ8|POLN_EEEVF	1936	tr|A0A6Q8PHS3|A0A6Q8PHS3_HUMAN Nephrocystin-1 OS=Homo sapiens OX=9606 GN=NPHP1 PE=1 SV=1	83	RHVRLCLFDGNK
RRVQLCLTDGNK	sp|Q4QXJ8|POLN_EEEVF	1936	tr|A0A6Q8PH10|A0A6Q8PH10_HUMAN Nephrocystin-1 (Fragment) OS=Homo sapiens OX=9606 GN=NPHP1 PE=1 SV=1	82	RHVRLCLFDGNK
HTLKEVLKKYPC	sp|Q4QXJ8|POLN_EEEVF	1094	sp|Q9NRY4|RHG35_HUMAN Rho GTPase-activating protein 35 OS=Homo sapiens OX=9606 GN=ARHGAP35 PE=1 SV=3	1355	HALKEVLKKFPK
SKLPTPPLGPPV	tr|Q4QXJ9|Q4QXJ9_EEEVF	55	sp|Q9Y3S1|WNK2_HUMAN Serine/threonine-protein kinase WNK2 OS=Homo sapiens OX=9606 GN=WNK2 PE=1 SV=4	1549	SQLPSPPLGPTV
SKLPTPPLGPPV	tr|Q4QXJ9|Q4QXJ9_EEEVF	55	tr|F8W9F9|F8W9F9_HUMAN Non-specific serine/threonine protein kinase OS=Homo sapiens OX=9606 GN=WNK2 PE=1 SV=1	1512	SQLPSPPLGPTV
SKLPTPPLGPPV	tr|Q4QXJ9|Q4QXJ9_EEEVF	55	tr|H0Y493|H0Y493_HUMAN Serine/threonine-protein kinase WNK2 (Fragment) OS=Homo sapiens OX=9606 GN=WNK2 PE=1 SV=1	309	SQLPSPPLGPTV
SKLPTPPLGPPV	tr|Q4QXJ9|Q4QXJ9_EEEVF	55	tr|H0Y7T5|H0Y7T5_HUMAN Non-specific serine/threonine protein kinase (Fragment) OS=Homo sapiens OX=9606 GN=WNK2 PE=1 SV=1	1508	SQLPSPPLGPTV
SKLPTPPLGPPV	tr|Q4QXJ9|Q4QXJ9_EEEVF	55	tr|H0Y7R3|H0Y7R3_HUMAN Non-specific serine/threonine protein kinase (Fragment) OS=Homo sapiens OX=9606 GN=WNK2 PE=1 SV=1	1116	SQLPSPPLGPTV
SKLPTPPLGPPV	tr|Q4QXJ9|Q4QXJ9_EEEVF	55	tr|H0Y7J9|H0Y7J9_HUMAN Serine/threonine-protein kinase WNK2 (Fragment) OS=Homo sapiens OX=9606 GN=WNK2 PE=1 SV=1	35	SQLPSPPLGPTV
ETALISAADAMY	sp|Q4QXJ8|POLN_EEEVF	2283	sp|Q5KSL6|DGKK_HUMAN Diacylglycerol kinase kappa OS=Homo sapiens OX=9606 GN=DGKK PE=1 SV=1	1174	ETALQSALDAMN
DHYDNTPGPSLF	sp|Q4QXJ8|POLN_EEEVF	1078	sp|Q02325|PLGB_HUMAN Plasminogen-like protein B OS=Homo sapiens OX=9606 GN=PLGLB1 PE=3 SV=1	23	DDYVNTQGPSLF
DHYDNTPGPSLF	sp|Q4QXJ8|POLN_EEEVF	1078	tr|F8WCD6|F8WCD6_HUMAN Plasminogen-like protein B OS=Homo sapiens OX=9606 GN=PLGLB1 PE=4 SV=1	23	DDYVNTQGPSLF
SRRVQLCLTDGN	sp|Q4QXJ8|POLN_EEEVF	1935	tr|A0A6Q8PGI7|A0A6Q8PGI7_HUMAN Nephrocystin-1 (Fragment) OS=Homo sapiens OX=9606 GN=NPHP1 PE=1 SV=1	326	SRHVRLCLFDGN
SRRVQLCLTDGN	sp|Q4QXJ8|POLN_EEEVF	1935	tr|C9JNM7|C9JNM7_HUMAN Nephrocystin-1 OS=Homo sapiens OX=9606 GN=NPHP1 PE=1 SV=1	348	SRHVRLCLFDGN
SRRVQLCLTDGN	sp|Q4QXJ8|POLN_EEEVF	1935	sp|O15259|NPHP1_HUMAN Nephrocystin-1 OS=Homo sapiens OX=9606 GN=NPHP1 PE=1 SV=1	404	SRHVRLCLFDGN
SRRVQLCLTDGN	sp|Q4QXJ8|POLN_EEEVF	1935	tr|A0A6Q8PHD4|A0A6Q8PHD4_HUMAN Nephrocystin-1 OS=Homo sapiens OX=9606 GN=NPHP1 PE=1 SV=1	288	SRHVRLCLFDGN
SRRVQLCLTDGN	sp|Q4QXJ8|POLN_EEEVF	1935	tr|A0A6Q8PHS3|A0A6Q8PHS3_HUMAN Nephrocystin-1 OS=Homo sapiens OX=9606 GN=NPHP1 PE=1 SV=1	82	SRHVRLCLFDGN
SRRVQLCLTDGN	sp|Q4QXJ8|POLN_EEEVF	1935	tr|A0A6Q8PH10|A0A6Q8PH10_HUMAN Nephrocystin-1 (Fragment) OS=Homo sapiens OX=9606 GN=NPHP1 PE=1 SV=1	81	SRHVRLCLFDGN
QRAGLQDEVAKA	sp|Q4QXJ8|POLN_EEEVF	2444	tr|A0A3B3IT18|A0A3B3IT18_HUMAN cAMP and cAMP-inhibited cGMP 3',5'-cyclic phosphodiesterase 10A (Fragment) OS=Homo sapiens OX=9606 GN=PDE10A PE=1 SV=1	21	QRAGLTDEKVKA
QRAGLQDEVAKA	sp|Q4QXJ8|POLN_EEEVF	2444	tr|A0A3B3ISJ6|A0A3B3ISJ6_HUMAN Phosphodiesterase OS=Homo sapiens OX=9606 GN=PDE10A PE=1 SV=1	22	QRAGLTDEKVKA
SGYEAKSSTSVT	sp|Q4QXJ8|POLN_EEEVF	1728	sp|P60484|PTEN_HUMAN Phosphatidylinositol 3,4,5-trisphosphate 3-phosphatase and dual-specificity protein phosphatase PTEN OS=Homo sapiens OX=9606 GN=PTEN PE=1 SV=1	355	SNPEASSSTSVT
SARRRKPPPPVR	tr|Q4QXJ9|Q4QXJ9_EEEVF	79	tr|A0A0U1RQS4|A0A0U1RQS4_HUMAN SH3 and multiple ankyrin repeat domains protein 3 OS=Homo sapiens OX=9606 GN=SHANK3 PE=1 SV=2	539	GARRRAPPPPKR
SARRRKPPPPVR	tr|Q4QXJ9|Q4QXJ9_EEEVF	79	sp|Q9BYB0|SHAN3_HUMAN SH3 and multiple ankyrin repeat domains protein 3 OS=Homo sapiens OX=9606 GN=SHANK3 PE=1 SV=3	672	GARRRAPPPPKR
SARRRKPPPPVR	tr|Q4QXJ9|Q4QXJ9_EEEVF	79	tr|A0A0U1RR93|A0A0U1RR93_HUMAN SH3 and multiple ankyrin repeat domains protein 3 OS=Homo sapiens OX=9606 GN=SHANK3 PE=1 SV=1	665	GARRRAPPPPKR
ATYCPAKIHTFP	sp|Q4QXJ8|POLN_EEEVF	2048	sp|Q8IZU8|DSEL_HUMAN Dermatan-sulfate epimerase-like protein OS=Homo sapiens OX=9606 GN=DSEL PE=2 SV=2	402	ADYGTAKIHTFP
PSLFGLCLHTLK	sp|Q4QXJ8|POLN_EEEVF	1086	tr|C9JK90|C9JK90_HUMAN Cordon-bleu protein-like 1 (Fragment) OS=Homo sapiens OX=9606 GN=COBLL1 PE=1 SV=1	9	PSLCGLCLEELK
CLHTLKEVLKKY	sp|Q4QXJ8|POLN_EEEVF	1092	sp|Q9NRY4|RHG35_HUMAN Rho GTPase-activating protein 35 OS=Homo sapiens OX=9606 GN=ARHGAP35 PE=1 SV=3	1353	KLHALKEVLKKF
NPSLALNSDRVL	sp|Q4QXJ8|POLN_EEEVF	561	sp|P40938|RFC3_HUMAN Replication factor C subunit 3 OS=Homo sapiens OX=9606 GN=RFC3 PE=1 SV=2	96	NPSDAGNSDRVV
AVEEIKGELKLG	tr|Q4QXJ9|Q4QXJ9_EEEVF	356	sp|Q9BXJ9|NAA15_HUMAN N-alpha-acetyltransferase 15, NatA auxiliary subunit OS=Homo sapiens OX=9606 GN=NAA15 PE=1 SV=1	225	AVEETKGELLLQ
AVEEIKGELKLG	tr|Q4QXJ9|Q4QXJ9_EEEVF	356	tr|A0A0B4J1W3|A0A0B4J1W3_HUMAN N-alpha-acetyltransferase 15, NatA auxiliary subunit OS=Homo sapiens OX=9606 GN=NAA15 PE=1 SV=1	225	AVEETKGELLLQ
ASKKSCNLTTVK	sp|Q4QXJ8|POLN_EEEVF	2088	sp|Q5JVG8|ZN506_HUMAN Zinc finger protein 506 OS=Homo sapiens OX=9606 GN=ZNF506 PE=2 SV=2	237	AYKQSCNLTTHK
RIVLAVAGGASE	tr|Q4QXJ9|Q4QXJ9_EEEVF	222	tr|G3V0E4|G3V0E4_HUMAN Beta-MPP OS=Homo sapiens OX=9606 GN=PMPCB PE=1 SV=1	238	RIVLAAAGGVSH
RIVLAVAGGASE	tr|Q4QXJ9|Q4QXJ9_EEEVF	222	sp|O75439|MPPB_HUMAN Mitochondrial-processing peptidase subunit beta OS=Homo sapiens OX=9606 GN=PMPCB PE=1 SV=2	238	RIVLAAAGGVSH
VSDTERATAIAT	sp|Q4QXJ8|POLN_EEEVF	1303	sp|P46098|5HT3A_HUMAN 5-hydroxytryptamine receptor 3A OS=Homo sapiens OX=9606 GN=HTR3A PE=1 SV=1	291	VSDTLPATAIGT
APRFRATGVSHV	sp|Q4QXJ8|POLN_EEEVF	1619	sp|Q14623|IHH_HUMAN Indian hedgehog protein OS=Homo sapiens OX=9606 GN=IHH PE=1 SV=4	287	AARFRATFASHV
YYEYFKQSPIKL	sp|Q4QXJ8|POLN_EEEVF	2123	sp|Q96RL7|VP13A_HUMAN Vacuolar protein sorting-associated protein 13A OS=Homo sapiens OX=9606 GN=VPS13A PE=1 SV=2	2765	LYEYFHISPIKL
ARRRKPPPPVRH	tr|Q4QXJ9|Q4QXJ9_EEEVF	80	tr|A0A0U1RQS4|A0A0U1RQS4_HUMAN SH3 and multiple ankyrin repeat domains protein 3 OS=Homo sapiens OX=9606 GN=SHANK3 PE=1 SV=2	540	ARRRAPPPPKRA
ARRRKPPPPVRH	tr|Q4QXJ9|Q4QXJ9_EEEVF	80	sp|Q9BYB0|SHAN3_HUMAN SH3 and multiple ankyrin repeat domains protein 3 OS=Homo sapiens OX=9606 GN=SHANK3 PE=1 SV=3	673	ARRRAPPPPKRA
ARRRKPPPPVRH	tr|Q4QXJ9|Q4QXJ9_EEEVF	80	tr|A0A0U1RR93|A0A0U1RR93_HUMAN SH3 and multiple ankyrin repeat domains protein 3 OS=Homo sapiens OX=9606 GN=SHANK3 PE=1 SV=1	666	ARRRAPPPPKRA
ARRRKPPPPVRH	tr|Q4QXJ9|Q4QXJ9_EEEVF	80	sp|Q6PRD1|GP179_HUMAN Probable G-protein coupled receptor 179 OS=Homo sapiens OX=9606 GN=GPR179 PE=2 SV=2	924	ARRRLPHPPIRH
ARRRKPPPPVRH	tr|Q4QXJ9|Q4QXJ9_EEEVF	80	tr|A0A087WW83|A0A087WW83_HUMAN Probable G-protein-coupled receptor 179 OS=Homo sapiens OX=9606 GN=GPR179 PE=1 SV=1	925	ARRRLPHPPIRH
ARRRKPPPPVRH	tr|Q4QXJ9|Q4QXJ9_EEEVF	80	tr|A0A087X0K8|A0A087X0K8_HUMAN Probable G-protein-coupled receptor 179 OS=Homo sapiens OX=9606 GN=GPR179 PE=1 SV=1	924	ARRRLPHPPIRH
GEGLDFNYGNRP	tr|Q4QXJ9|Q4QXJ9_EEEVF	644	sp|P22897|MRC1_HUMAN Macrophage mannose receptor 1 OS=Homo sapiens OX=9606 GN=MRC1 PE=1 SV=1	112	GEDLFFNYGNRQ
LLKYKVSDSPAY	sp|Q4QXJ8|POLN_EEEVF	924	sp|P21817|RYR1_HUMAN Ryanodine receptor 1 OS=Homo sapiens OX=9606 GN=RYR1 PE=1 SV=3	4578	LLFYKVSDSPPG
ARSVHLRASVPS	tr|Q4QXJ9|Q4QXJ9_EEEVF	504	sp|P53675|CLH2_HUMAN Clathrin heavy chain 2 OS=Homo sapiens OX=9606 GN=CLTCL1 PE=1 SV=2	475	ALSVYLRANVPS
ARSVHLRASVPS	tr|Q4QXJ9|Q4QXJ9_EEEVF	504	tr|A0A087WX41|A0A087WX41_HUMAN Clathrin heavy chain 2 OS=Homo sapiens OX=9606 GN=CLTCL1 PE=1 SV=1	475	ALSVYLRANVPS
KLNPGTKHQDDK	sp|Q4QXJ8|POLN_EEEVF	2181	tr|C9JG08|C9JG08_HUMAN Uncharacterized protein C2orf16 OS=Homo sapiens OX=9606 GN=C2orf16 PE=1 SV=2	2539	KLNPKTKSQDMK
ATLLANITFGTI	tr|Q4QXJ9|Q4QXJ9_EEEVF	930	sp|Q9H511|KLH31_HUMAN Kelch-like protein 31 OS=Homo sapiens OX=9606 GN=KLHL31 PE=2 SV=1	252	ADLLSNIRFGTI
TNTLSTNFQSIE	sp|Q4QXJ8|POLN_EEEVF	1994	sp|Q6ZP01|RBM44_HUMAN RNA-binding protein 44 OS=Homo sapiens OX=9606 GN=RBM44 PE=2 SV=3	88	TNTESTQFQSSE
TTVRHLPAAFTQ	sp|Q4QXJ8|POLN_EEEVF	436	tr|A6NGQ3|A6NGQ3_HUMAN Non-specific serine/threonine protein kinase OS=Homo sapiens OX=9606 GN=OBSCN PE=1 SV=5	4312	LTVRALPARFTQ
TTVRHLPAAFTQ	sp|Q4QXJ8|POLN_EEEVF	436	tr|H3BQA7|H3BQA7_HUMAN Obscurin (Fragment) OS=Homo sapiens OX=9606 GN=OBSCN PE=1 SV=3	367	LTVRALPARFTQ
YEYFKQSPIKLQ	sp|Q4QXJ8|POLN_EEEVF	2124	sp|Q96RL7|VP13A_HUMAN Vacuolar protein sorting-associated protein 13A OS=Homo sapiens OX=9606 GN=VPS13A PE=1 SV=2	2766	YEYFHISPIKLH
TVRHLPAAFTQY	sp|Q4QXJ8|POLN_EEEVF	437	tr|A6NGQ3|A6NGQ3_HUMAN Non-specific serine/threonine protein kinase OS=Homo sapiens OX=9606 GN=OBSCN PE=1 SV=5	4313	TVRALPARFTQD
TVRHLPAAFTQY	sp|Q4QXJ8|POLN_EEEVF	437	tr|H3BQA7|H3BQA7_HUMAN Obscurin (Fragment) OS=Homo sapiens OX=9606 GN=OBSCN PE=1 SV=3	368	TVRALPARFTQD
YEKSPAASGKIR	sp|Q4QXJ8|POLN_EEEVF	1372	sp|O75683|SURF6_HUMAN Surfeit locus protein 6 OS=Homo sapiens OX=9606 GN=SURF6 PE=1 SV=3	71	GEKSPAASGARR
KAETCALGTLPA	tr|Q4QXJ9|Q4QXJ9_EEEVF	1069	sp|Q9NR96|TLR9_HUMAN Toll-like receptor 9 OS=Homo sapiens OX=9606 GN=TLR9 PE=1 SV=2	20	LAMTLALGTLPA
KAETCALGTLPA	tr|Q4QXJ9|Q4QXJ9_EEEVF	1069	tr|H0Y858|H0Y858_HUMAN Toll-like receptor 9 (Fragment) OS=Homo sapiens OX=9606 PE=3 SV=1	174	LAMTLALGTLPA
SKAPQPPSQDSR	sp|Q4QXJ8|POLN_EEEVF	1772	sp|Q8N3F8|MILK1_HUMAN MICAL-like protein 1 OS=Homo sapiens OX=9606 GN=MICALL1 PE=1 SV=2	389	SSSPGPPSQDSR
ALGWGNLERLQE	sp|Q4QXJ8|POLN_EEEVF	1252	sp|O94966|UBP19_HUMAN Ubiquitin carboxyl-terminal hydrolase 19 OS=Homo sapiens OX=9606 GN=USP19 PE=1 SV=2	1020	ALVWRNNERLQE
ALGWGNLERLQE	sp|Q4QXJ8|POLN_EEEVF	1252	tr|E7ESU0|E7ESU0_HUMAN Ubiquitin carboxyl-terminal hydrolase 19 (Fragment) OS=Homo sapiens OX=9606 GN=USP19 PE=1 SV=2	919	ALVWRNNERLQE
LALGWGNLERLQ	sp|Q4QXJ8|POLN_EEEVF	1251	sp|O94966|UBP19_HUMAN Ubiquitin carboxyl-terminal hydrolase 19 OS=Homo sapiens OX=9606 GN=USP19 PE=1 SV=2	1019	LALVWRNNERLQ
LALGWGNLERLQ	sp|Q4QXJ8|POLN_EEEVF	1251	tr|E7ESU0|E7ESU0_HUMAN Ubiquitin carboxyl-terminal hydrolase 19 (Fragment) OS=Homo sapiens OX=9606 GN=USP19 PE=1 SV=2	918	LALVWRNNERLQ
KYFGLELDTGAF	sp|Q4QXJ8|POLN_EEEVF	1055	tr|D6RFF8|D6RFF8_HUMAN Glucosamine-6-phosphate isomerase (Fragment) OS=Homo sapiens OX=9606 GN=GNPDA1 PE=1 SV=1	33	KYFTLGLPTGAF
GTDSKAPQPPSQ	sp|Q4QXJ8|POLN_EEEVF	1769	sp|Q9UKJ3|GPTC8_HUMAN G patch domain-containing protein 8 OS=Homo sapiens OX=9606 GN=GPATCH8 PE=1 SV=2	1055	GDDSKATGPPSQ
ARSPQGIILLRD	tr|Q4QXJ9|Q4QXJ9_EEEVF	1132	sp|Q92576|PHF3_HUMAN PHD finger protein 3 OS=Homo sapiens OX=9606 GN=PHF3 PE=1 SV=3	1640	ARSPQFINLKRD
GRIVLAVAGGAS	tr|Q4QXJ9|Q4QXJ9_EEEVF	221	tr|G3V0E4|G3V0E4_HUMAN Beta-MPP OS=Homo sapiens OX=9606 GN=PMPCB PE=1 SV=1	237	PRIVLAAAGGVS
GRIVLAVAGGAS	tr|Q4QXJ9|Q4QXJ9_EEEVF	221	sp|O75439|MPPB_HUMAN Mitochondrial-processing peptidase subunit beta OS=Homo sapiens OX=9606 GN=PMPCB PE=1 SV=2	237	PRIVLAAAGGVS
HASRGGTCLALG	sp|Q4QXJ8|POLN_EEEVF	1243	sp|Q9UQF0|SYCY1_HUMAN Syncytin-1 OS=Homo sapiens OX=9606 GN=ERVW-1 PE=1 SV=1	390	TAERGGTCLFLG
YLLKYKVSDSPA	sp|Q4QXJ8|POLN_EEEVF	923	sp|P21817|RYR1_HUMAN Ryanodine receptor 1 OS=Homo sapiens OX=9606 GN=RYR1 PE=1 SV=3	4577	ILLFYKVSDSPP
ALATCPPGESLQ	tr|Q4QXJ9|Q4QXJ9_EEEVF	423	sp|P23634|AT2B4_HUMAN Plasma membrane calcium-transporting ATPase 4 OS=Homo sapiens OX=9606 GN=ATP2B4 PE=1 SV=2	889	ALATEPPTESLL
ALATCPPGESLQ	tr|Q4QXJ9|Q4QXJ9_EEEVF	423	sp|Q16720|AT2B3_HUMAN Plasma membrane calcium-transporting ATPase 3 OS=Homo sapiens OX=9606 GN=ATP2B3 PE=1 SV=3	898	ALATEPPTESLL
ALATCPPGESLQ	tr|Q4QXJ9|Q4QXJ9_EEEVF	423	sp|P20020|AT2B1_HUMAN Plasma membrane calcium-transporting ATPase 1 OS=Homo sapiens OX=9606 GN=ATP2B1 PE=1 SV=4	901	ALATEPPTESLL
ALATCPPGESLQ	tr|Q4QXJ9|Q4QXJ9_EEEVF	423	tr|E7ERY9|E7ERY9_HUMAN Calcium-transporting ATPase OS=Homo sapiens OX=9606 GN=ATP2B1 PE=1 SV=2	644	ALATEPPTESLL
SGEGLDFNYGNR	tr|Q4QXJ9|Q4QXJ9_EEEVF	643	sp|P22897|MRC1_HUMAN Macrophage mannose receptor 1 OS=Homo sapiens OX=9606 GN=MRC1 PE=1 SV=1	111	KGEDLFFNYGNR
PRKPVPPVPLPL	sp|Q4QXJ8|POLN_EEEVF	1669	tr|A0A0C4DG26|A0A0C4DG26_HUMAN Carbohydrate-responsive element-binding protein OS=Homo sapiens OX=9606 GN=MLXIPL PE=1 SV=1	291	PRLPPPPVPPPL
PRKPVPPVPLPL	sp|Q4QXJ8|POLN_EEEVF	1669	sp|Q9NP71|MLXPL_HUMAN Carbohydrate-responsive element-binding protein OS=Homo sapiens OX=9606 GN=MLXIPL PE=1 SV=1	384	PRLPPPPVPPPL
EEIKGELKLGLA	tr|Q4QXJ9|Q4QXJ9_EEEVF	358	tr|C9IZQ6|C9IZQ6_HUMAN HCG2022551, isoform CRA_j OS=Homo sapiens OX=9606 GN=KALRN PE=1 SV=1	1424	EEGKGELKDGLE
EEIKGELKLGLA	tr|Q4QXJ9|Q4QXJ9_EEEVF	358	sp|O60229|KALRN_HUMAN Kalirin OS=Homo sapiens OX=9606 GN=KALRN PE=1 SV=3	1433	EEGKGELKDGLE
EEIKGELKLGLA	tr|Q4QXJ9|Q4QXJ9_EEEVF	358	tr|H7BXZ5|H7BXZ5_HUMAN Non-specific serine/threonine protein kinase (Fragment) OS=Homo sapiens OX=9606 GN=KALRN PE=1 SV=1	1402	EEGKGELKDGLE
LSKTQFESAPAY	sp|Q4QXJ8|POLN_EEEVF	1026	sp|Q5VT52|RPRD2_HUMAN Regulation of nuclear pre-mRNA domain-containing protein 2 OS=Homo sapiens OX=9606 GN=RPRD2 PE=1 SV=1	525	LSKTQTQSAPAL
VYLLKYKVSDSP	sp|Q4QXJ8|POLN_EEEVF	922	sp|P21817|RYR1_HUMAN Ryanodine receptor 1 OS=Homo sapiens OX=9606 GN=RYR1 PE=1 SV=3	4576	FILLFYKVSDSP
YALATCPPGESL	tr|Q4QXJ9|Q4QXJ9_EEEVF	422	sp|P23634|AT2B4_HUMAN Plasma membrane calcium-transporting ATPase 4 OS=Homo sapiens OX=9606 GN=ATP2B4 PE=1 SV=2	888	LALATEPPTESL
YALATCPPGESL	tr|Q4QXJ9|Q4QXJ9_EEEVF	422	sp|Q16720|AT2B3_HUMAN Plasma membrane calcium-transporting ATPase 3 OS=Homo sapiens OX=9606 GN=ATP2B3 PE=1 SV=3	897	LALATEPPTESL
YALATCPPGESL	tr|Q4QXJ9|Q4QXJ9_EEEVF	422	sp|P20020|AT2B1_HUMAN Plasma membrane calcium-transporting ATPase 1 OS=Homo sapiens OX=9606 GN=ATP2B1 PE=1 SV=4	900	LALATEPPTESL
YALATCPPGESL	tr|Q4QXJ9|Q4QXJ9_EEEVF	422	tr|E7ERY9|E7ERY9_HUMAN Calcium-transporting ATPase OS=Homo sapiens OX=9606 GN=ATP2B1 PE=1 SV=2	643	LALATEPPTESL
PVSKTDTFTSAV	tr|Q4QXJ9|Q4QXJ9_EEEVF	1193	sp|Q8TC76|F110B_HUMAN Protein FAM110B OS=Homo sapiens OX=9606 GN=FAM110B PE=1 SV=1	14	PVSPAGTFTSAV
FRPIKLEGHAEN	tr|Q4QXJ9|Q4QXJ9_EEEVF	134	tr|B1AKL4|B1AKL4_HUMAN Eukaryotic translation initiation factor 4E transporter OS=Homo sapiens OX=9606 GN=EIF4ENIF1 PE=1 SV=1	383	FAPIPLEDHAEN
FRPIKLEGHAEN	tr|Q4QXJ9|Q4QXJ9_EEEVF	134	sp|Q9NRA8|4ET_HUMAN Eukaryotic translation initiation factor 4E transporter OS=Homo sapiens OX=9606 GN=EIF4ENIF1 PE=1 SV=2	383	FAPIPLEDHAEN
GNEATPSKQYVE	tr|Q4QXJ9|Q4QXJ9_EEEVF	622	sp|Q9HBD1|RC3H2_HUMAN Roquin-2 OS=Homo sapiens OX=9606 GN=RC3H2 PE=1 SV=2	955	GNEATSSAHYVE
GNEATPSKQYVE	tr|Q4QXJ9|Q4QXJ9_EEEVF	622	tr|H0Y5D9|H0Y5D9_HUMAN Roquin-2 (Fragment) OS=Homo sapiens OX=9606 GN=RC3H2 PE=1 SV=1	14	GNEATSSAHYVE
GPSLFGLCLHTL	sp|Q4QXJ8|POLN_EEEVF	1085	tr|C9JK90|C9JK90_HUMAN Cordon-bleu protein-like 1 (Fragment) OS=Homo sapiens OX=9606 GN=COBLL1 PE=1 SV=1	8	GPSLCGLCLEEL
HLALGISSRLAV	sp|Q4QXJ8|POLN_EEEVF	355	tr|H7C4W0|H7C4W0_HUMAN Acid-sensing ion channel 3 (Fragment) OS=Homo sapiens OX=9606 GN=ASIC3 PE=3 SV=1	131	HLSLGPSSRPAV
HLALGISSRLAV	sp|Q4QXJ8|POLN_EEEVF	355	tr|H7C5N6|H7C5N6_HUMAN Acid-sensing ion channel 3 (Fragment) OS=Homo sapiens OX=9606 GN=ASIC3 PE=3 SV=1	126	HLSLGPSSRPAV
