query	query_seqname	query_start	target_seqname	target_start	target
VSVEAVAALDFL	tr|A0A0K1NYE4|A0A0K1NYE4_HED68	1324	tr|C9J4M0|C9J4M0_HUMAN TBCC domain-containing protein 1 (Fragment) OS=Homo sapiens OX=9606 GN=TBCCD1 PE=1 SV=1	204	VSREAVVALSFL
VSVEAVAALDFL	tr|A0A0K1NYE4|A0A0K1NYE4_HED68	1324	sp|Q9NVR7|TBCC1_HUMAN TBCC domain-containing protein 1 OS=Homo sapiens OX=9606 GN=TBCCD1 PE=1 SV=1	204	VSREAVVALSFL
WSSLSTPIAMPI	tr|A0A0K1NYE4|A0A0K1NYE4_HED68	1079	sp|Q6WKZ4|RFIP1_HUMAN Rab11 family-interacting protein 1 OS=Homo sapiens OX=9606 GN=RAB11FIP1 PE=1 SV=3	595	FSSLSSPIAAPI
LKAVLDYDAIVT	tr|A0A0K1NYE4|A0A0K1NYE4_HED68	1293	sp|Q9Y5E2|PCDB7_HUMAN Protocadherin beta-7 OS=Homo sapiens OX=9606 GN=PCDHB7 PE=2 SV=1	303	LKAQLDYEAIQT
AAKIAATVPGAA	tr|A0A0K1NYE4|A0A0K1NYE4_HED68	802	sp|Q7L5N7|PCAT2_HUMAN Lysophosphatidylcholine acyltransferase 2 OS=Homo sapiens OX=9606 GN=LPCAT2 PE=1 SV=1	7	AAEVAATVPGAG
TKDAMEAAKIAA	tr|A0A0K1NYE4|A0A0K1NYE4_HED68	796	sp|Q96T17|MA7D2_HUMAN MAP7 domain-containing protein 2 OS=Homo sapiens OX=9606 GN=MAP7D2 PE=1 SV=2	394	TTDAGEAAKILA
VISKGNFQDPDV	tr|A0A0K1NYE4|A0A0K1NYE4_HED68	75	sp|Q8TAG9|EXOC6_HUMAN Exocyst complex component 6 OS=Homo sapiens OX=9606 GN=EXOC6 PE=1 SV=3	459	VISKFPFQDPDL
VISKGNFQDPDV	tr|A0A0K1NYE4|A0A0K1NYE4_HED68	75	tr|E7EW84|E7EW84_HUMAN Exocyst complex component OS=Homo sapiens OX=9606 GN=EXOC6 PE=1 SV=1	356	VISKFPFQDPDL
VISKGNFQDPDV	tr|A0A0K1NYE4|A0A0K1NYE4_HED68	75	tr|F2Z3K0|F2Z3K0_HUMAN Exocyst complex component 6 OS=Homo sapiens OX=9606 GN=EXOC6 PE=1 SV=1	136	VISKFPFQDPDL
TGSSELESGAFS	tr|A0A0K1NYE4|A0A0K1NYE4_HED68	1839	sp|O75037|KI21B_HUMAN Kinesin-like protein KIF21B OS=Homo sapiens OX=9606 GN=KIF21B PE=1 SV=2	854	TTSSEAESGARS
EAAKIAATVPGA	tr|A0A0K1NYE4|A0A0K1NYE4_HED68	801	sp|Q7L5N7|PCAT2_HUMAN Lysophosphatidylcholine acyltransferase 2 OS=Homo sapiens OX=9606 GN=LPCAT2 PE=1 SV=1	6	QAAEVAATVPGA
SSLSTPIAMPIK	tr|A0A0K1NYE4|A0A0K1NYE4_HED68	1080	sp|Q6WKZ4|RFIP1_HUMAN Rab11 family-interacting protein 1 OS=Homo sapiens OX=9606 GN=RAB11FIP1 PE=1 SV=3	596	SSLSSPIAAPIS
NVISKGNFQDPD	tr|A0A0K1NYE4|A0A0K1NYE4_HED68	74	sp|Q8TAG9|EXOC6_HUMAN Exocyst complex component 6 OS=Homo sapiens OX=9606 GN=EXOC6 PE=1 SV=3	458	IVISKFPFQDPD
NVISKGNFQDPD	tr|A0A0K1NYE4|A0A0K1NYE4_HED68	74	tr|E7EW84|E7EW84_HUMAN Exocyst complex component OS=Homo sapiens OX=9606 GN=EXOC6 PE=1 SV=1	355	IVISKFPFQDPD
NVISKGNFQDPD	tr|A0A0K1NYE4|A0A0K1NYE4_HED68	74	tr|F2Z3K0|F2Z3K0_HUMAN Exocyst complex component 6 OS=Homo sapiens OX=9606 GN=EXOC6 PE=1 SV=1	135	IVISKFPFQDPD
PSSEDKDLYGTV	tr|A0A0K1NYE4|A0A0K1NYE4_HED68	1445	tr|Q5VVD7|Q5VVD7_HUMAN Pleckstrin homology domain-containing family M member 2 OS=Homo sapiens OX=9606 GN=PLEKHM2 PE=1 SV=1	214	PSSEDGDLTDTV
KNVISKGNFQDP	tr|A0A0K1NYE4|A0A0K1NYE4_HED68	73	sp|Q8TAG9|EXOC6_HUMAN Exocyst complex component 6 OS=Homo sapiens OX=9606 GN=EXOC6 PE=1 SV=3	457	KIVISKFPFQDP
KNVISKGNFQDP	tr|A0A0K1NYE4|A0A0K1NYE4_HED68	73	tr|E7EW84|E7EW84_HUMAN Exocyst complex component OS=Homo sapiens OX=9606 GN=EXOC6 PE=1 SV=1	354	KIVISKFPFQDP
KNVISKGNFQDP	tr|A0A0K1NYE4|A0A0K1NYE4_HED68	73	tr|F2Z3K0|F2Z3K0_HUMAN Exocyst complex component 6 OS=Homo sapiens OX=9606 GN=EXOC6 PE=1 SV=1	134	KIVISKFPFQDP
FDLAANASWPDH	tr|A0A0K1NYE4|A0A0K1NYE4_HED68	630	tr|Q8N5B3|Q8N5B3_HUMAN CDH23 protein OS=Homo sapiens OX=9606 GN=CDH23 PE=1 SV=1	429	FDLFANESVPDH
FDLAANASWPDH	tr|A0A0K1NYE4|A0A0K1NYE4_HED68	630	tr|A0A0A0MS94|A0A0A0MS94_HUMAN Cadherin-23 OS=Homo sapiens OX=9606 GN=CDH23 PE=1 SV=1	429	FDLFANESVPDH
FDLAANASWPDH	tr|A0A0K1NYE4|A0A0K1NYE4_HED68	630	tr|B1AVV0|B1AVV0_HUMAN Cadherin-23 OS=Homo sapiens OX=9606 GN=CDH23 PE=1 SV=3	429	FDLFANESVPDH
FDLAANASWPDH	tr|A0A0K1NYE4|A0A0K1NYE4_HED68	630	tr|R4GN92|R4GN92_HUMAN Cadherin-23 (Fragment) OS=Homo sapiens OX=9606 GN=CDH23 PE=1 SV=2	240	FDLFANESVPDH
FDLAANASWPDH	tr|A0A0K1NYE4|A0A0K1NYE4_HED68	630	sp|Q9H251|CAD23_HUMAN Cadherin-23 OS=Homo sapiens OX=9606 GN=CDH23 PE=1 SV=2	429	FDLFANESVPDH
FDLAANASWPDH	tr|A0A0K1NYE4|A0A0K1NYE4_HED68	630	tr|A0A087X097|A0A087X097_HUMAN Cadherin-23 OS=Homo sapiens OX=9606 GN=CDH23 PE=1 SV=1	429	FDLFANESVPDH
FDLAANASWPDH	tr|A0A0K1NYE4|A0A0K1NYE4_HED68	630	tr|A0A087WYR8|A0A087WYR8_HUMAN Cadherin-23 OS=Homo sapiens OX=9606 GN=CDH23 PE=1 SV=2	429	FDLFANESVPDH
FDLAANASWPDH	tr|A0A0K1NYE4|A0A0K1NYE4_HED68	630	tr|G8JLI8|G8JLI8_HUMAN Cadherin-23 OS=Homo sapiens OX=9606 GN=CDH23 PE=1 SV=2	344	FDLFANESVPDH
FDLAANASWPDH	tr|A0A0K1NYE4|A0A0K1NYE4_HED68	630	tr|A0A087WWD9|A0A087WWD9_HUMAN Cadherin-23 (Fragment) OS=Homo sapiens OX=9606 GN=CDH23 PE=1 SV=1	86	FDLFANESVPDH
FDLAANASWPDH	tr|A0A0K1NYE4|A0A0K1NYE4_HED68	630	tr|A0A2R8Y663|A0A2R8Y663_HUMAN Cadherin-23 (Fragment) OS=Homo sapiens OX=9606 GN=CDH23 PE=1 SV=1	317	FDLFANESVPDH
RELDAGLLCPYR	tr|A0A0K1NYE4|A0A0K1NYE4_HED68	2134	tr|F5GZG7|F5GZG7_HUMAN Multiple epidermal growth factor-like domains protein 8 OS=Homo sapiens OX=9606 GN=MEGF8 PE=1 SV=1	2	RELPAGLLPPGR
YLAILSEHDSAV	tr|A0A0K1NYE4|A0A0K1NYE4_HED68	712	sp|Q13905|RPGF1_HUMAN Rap guanine nucleotide exchange factor 1 OS=Homo sapiens OX=9606 GN=RAPGEF1 PE=1 SV=3	929	YLAILSALDSAP
LKSLATPYTSHG	tr|A0A0K1NYE4|A0A0K1NYE4_HED68	1180	sp|Q13105|ZBT17_HUMAN Zinc finger and BTB domain-containing protein 17 OS=Homo sapiens OX=9606 GN=ZBTB17 PE=1 SV=3	111	LKSLAEPATSPG
QYLAILSEHDSA	tr|A0A0K1NYE4|A0A0K1NYE4_HED68	711	sp|Q13905|RPGF1_HUMAN Rap guanine nucleotide exchange factor 1 OS=Homo sapiens OX=9606 GN=RAPGEF1 PE=1 SV=3	928	SYLAILSALDSA
