query	query_seqname	query_start	target_seqname	target_start	target
GLIAWEELDLSL	sp|Q9W850|MATRX_MEASC	275	tr|E7EV07|E7EV07_HUMAN Rho guanine nucleotide exchange factor 4 OS=Homo sapiens OX=9606 GN=ARHGEF4 PE=1 SV=3	124	GLHAKEELDLSP
AAVSAIDRLSRI	sp|Q9WMB5|NCAP_MEASC	94	tr|A0A1B0GV38|A0A1B0GV38_HUMAN GABA(A) receptor subunit alpha-1 OS=Homo sapiens OX=9606 GN=GABRA1 PE=1 SV=1	429	NSVSKIDRLSRI
AAVSAIDRLSRI	sp|Q9WMB5|NCAP_MEASC	94	sp|P14867|GBRA1_HUMAN Gamma-aminobutyric acid receptor subunit alpha-1 OS=Homo sapiens OX=9606 GN=GABRA1 PE=1 SV=3	414	NSVSKIDRLSRI
PMEPSRGRILDK	sp|Q9WMB5|NCAP_MEASC	235	tr|F8VZA0|F8VZA0_HUMAN Pseudouridylate synthase 7 homolog-like protein OS=Homo sapiens OX=9606 GN=PUS7L PE=1 SV=1	158	PPEFSIGRILDK
PMEPSRGRILDK	sp|Q9WMB5|NCAP_MEASC	235	sp|Q9H0K6|PUS7L_HUMAN Pseudouridylate synthase 7 homolog-like protein OS=Homo sapiens OX=9606 GN=PUS7L PE=1 SV=1	158	PPEFSIGRILDK
PILGLDLGLLPI	sp|Q9WMB5|NCAP_MEASC	462	tr|A0A2R8Y4W7|A0A2R8Y4W7_HUMAN Pendrin (Fragment) OS=Homo sapiens OX=9606 GN=SLC26A4 PE=1 SV=1	61	IILGLDLGLLAG
PILGLDLGLLPI	sp|Q9WMB5|NCAP_MEASC	462	sp|O43511|S26A4_HUMAN Pendrin OS=Homo sapiens OX=9606 GN=SLC26A4 PE=1 SV=1	490	IILGLDLGLLAG
KDIDVKGEGDDK	sp|Q9WMB4|PHOSP_MEASC	413	sp|Q9UJU5|FOXD3_HUMAN Forkhead box protein D3 OS=Homo sapiens OX=9606 GN=FOXD3 PE=1 SV=1	23	VDIDVVGEGDDG
HQMVLTVQRSLG	sp|Q9YZN9|C_MEASC	156	sp|Q96SZ6|CK5P1_HUMAN Mitochondrial tRNA methylthiotransferase CDK5RAP1 OS=Homo sapiens OX=9606 GN=CDK5RAP1 PE=1 SV=2	4	LQCVLQVQRSLG
LKDIDVKGEGDD	sp|Q9WMB4|PHOSP_MEASC	412	sp|Q9UJU5|FOXD3_HUMAN Forkhead box protein D3 OS=Homo sapiens OX=9606 GN=FOXD3 PE=1 SV=1	22	DVDIDVVGEGDD
VILNLCACSGTS	sp|Q786F3|FUS_MEASC	379	sp|Q92621|NU205_HUMAN Nuclear pore complex protein Nup205 OS=Homo sapiens OX=9606 GN=NUP205 PE=1 SV=3	1066	VIYQLCACSDTS
GDGTGAVTIPGE	sp|Q9WMB5|NCAP_MEASC	56	sp|P45877|PPIC_HUMAN Peptidyl-prolyl cis-trans isomerase C OS=Homo sapiens OX=9606 GN=PPIC PE=1 SV=1	104	GDGTGGVSIYGE
LEETELLALALL	sp|Q786F3|FUS_MEASC	96	sp|Q9C0B2|CFA74_HUMAN Cilia- and flagella-associated protein 74 OS=Homo sapiens OX=9606 GN=CFAP74 PE=2 SV=3	8	LPEDELLADALL
FLITYLVYDRSK	sp|Q786F2|HEMA_MEASC	35	sp|Q8TBE7|S35G2_HUMAN Solute carrier family 35 member G2 OS=Homo sapiens OX=9606 GN=SLC35G2 PE=1 SV=3	119	ALITRLVSDRSK
TLAGLQRLPPDT	sp|Q9WMB5|NCAP_MEASC	397	tr|F5H3H7|F5H3H7_HUMAN Beta-1,3-N-acetylglucosaminyltransferase radical fringe OS=Homo sapiens OX=9606 GN=RFNG PE=1 SV=2	135	HLENLQRLPPDT
TLAGLQRLPPDT	sp|Q9WMB5|NCAP_MEASC	397	sp|Q9Y644|RFNG_HUMAN Beta-1,3-N-acetylglucosaminyltransferase radical fringe OS=Homo sapiens OX=9606 GN=RFNG PE=2 SV=3	261	HLENLQRLPPDT
ISAPGYGSGRSG	sp|Q9WMB5|NCAP_MEASC	166	sp|O75474|FRAT2_HUMAN GSK-3-binding protein FRAT2 OS=Homo sapiens OX=9606 GN=FRAT2 PE=2 SV=3	209	ASAPGPGGGRSG
AGLGTLSSFGGL	sp|Q786F3|FUS_MEASC	85	sp|Q9BRN9|TM2D3_HUMAN TM2 domain-containing protein 3 OS=Homo sapiens OX=9606 GN=TM2D3 PE=2 SV=2	211	EGLGKLFSFGGL
AGLGTLSSFGGL	sp|Q786F3|FUS_MEASC	85	tr|B3KT51|B3KT51_HUMAN TM2 domain containing 3, isoform CRA_a OS=Homo sapiens OX=9606 GN=TM2D3 PE=1 SV=1	146	EGLGKLFSFGGL
VALMNNSVSSPC	sp|Q786F2|HEMA_MEASC	324	sp|Q8NBZ7|UXS1_HUMAN UDP-glucuronic acid decarboxylase 1 OS=Homo sapiens OX=9606 GN=UXS1 PE=1 SV=1	310	VALMNSNVSSPV
VALMNNSVSSPC	sp|Q786F2|HEMA_MEASC	324	tr|C9JE50|C9JE50_HUMAN UDP-glucuronic acid decarboxylase 1 (Fragment) OS=Homo sapiens OX=9606 GN=UXS1 PE=1 SV=8	154	VALMNSNVSSPV
RGEGRILEPVIQ	sp|Q9WMB5|NCAP_MEASC	423	tr|H3BPF5|H3BPF5_HUMAN Protein fantom (Fragment) OS=Homo sapiens OX=9606 GN=RPGRIP1L PE=1 SV=1	205	RGEIRNLENVIQ
RGEGRILEPVIQ	sp|Q9WMB5|NCAP_MEASC	423	tr|H3BS47|H3BS47_HUMAN Protein fantom OS=Homo sapiens OX=9606 GN=RPGRIP1L PE=1 SV=1	205	RGEIRNLENVIQ
RGEGRILEPVIQ	sp|Q9WMB5|NCAP_MEASC	423	tr|A0A087WX34|A0A087WX34_HUMAN Protein fantom OS=Homo sapiens OX=9606 GN=RPGRIP1L PE=1 SV=1	205	RGEIRNLENVIQ
RGEGRILEPVIQ	sp|Q9WMB5|NCAP_MEASC	423	sp|Q68CZ1|FTM_HUMAN Protein fantom OS=Homo sapiens OX=9606 GN=RPGRIP1L PE=1 SV=2	205	RGEIRNLENVIQ
RGEGRILEPVIQ	sp|Q9WMB5|NCAP_MEASC	423	tr|H3BV03|H3BV03_HUMAN Protein fantom OS=Homo sapiens OX=9606 GN=RPGRIP1L PE=1 SV=1	205	RGEIRNLENVIQ
SRLLMQATRSHA	sp|Q9YZN9|C_MEASC	119	sp|Q5T3U5|MRP7_HUMAN ATP-binding cassette sub-family C member 10 OS=Homo sapiens OX=9606 GN=ABCC10 PE=1 SV=1	891	SLLLMQATRNAA
RDSRESPSVFRS	sp|Q9WMB3|L_MEASC	817	sp|Q2M3C7|SPKAP_HUMAN A-kinase anchor protein SPHKAP OS=Homo sapiens OX=9606 GN=SPHKAP PE=1 SV=1	1204	RDSRESASSRRS
AFYKEEETLGDL	sp|Q9WMB5|NCAP_MEASC	106	sp|Q01826|SATB1_HUMAN DNA-binding protein SATB1 OS=Homo sapiens OX=9606 GN=SATB1 PE=1 SV=1	717	AEYKEEELLKDL
SRIVERLLCLMV	sp|Q786F2|HEMA_MEASC	276	sp|O75907|DGAT1_HUMAN Diacylglycerol O-acyltransferase 1 OS=Homo sapiens OX=9606 GN=DGAT1 PE=1 SV=2	317	SRIIERLLKLAV
EITERDALLLMK	sp|Q9WMB3|L_MEASC	403	sp|Q9NQ50|RM40_HUMAN 39S ribosomal protein L40, mitochondrial OS=Homo sapiens OX=9606 GN=MRPL40 PE=1 SV=1	109	EETERRALLLKK
DKLIGWLDSRDS	sp|Q9WMB5|NCAP_MEASC	245	sp|Q9UPU9|SMAG1_HUMAN Protein Smaug homolog 1 OS=Homo sapiens OX=9606 GN=SAMD4A PE=1 SV=3	185	DKLNGWQNSRDS
PGLATIRSQGSS	sp|Q9WMB4|PHOSP_MEASC	483	tr|A0A088AWP5|A0A088AWP5_HUMAN Protein prune homolog 2 OS=Homo sapiens OX=9606 GN=PRUNE2 PE=1 SV=1	428	SGLATIRSSRSS
PGLATIRSQGSS	sp|Q9WMB4|PHOSP_MEASC	483	sp|Q8WUY3|PRUN2_HUMAN Protein prune homolog 2 OS=Homo sapiens OX=9606 GN=PRUNE2 PE=1 SV=3	428	SGLATIRSSRSS
PGLATIRSQGSS	sp|Q9WMB4|PHOSP_MEASC	483	tr|E9PDC2|E9PDC2_HUMAN Protein prune homolog 2 OS=Homo sapiens OX=9606 GN=PRUNE2 PE=1 SV=1	69	SGLATIRSSRSS
ILGLDLGLLPIT	sp|Q9WMB5|NCAP_MEASC	463	tr|A0A2R8Y4W7|A0A2R8Y4W7_HUMAN Pendrin (Fragment) OS=Homo sapiens OX=9606 GN=SLC26A4 PE=1 SV=1	62	ILGLDLGLLAGL
ILGLDLGLLPIT	sp|Q9WMB5|NCAP_MEASC	463	sp|O43511|S26A4_HUMAN Pendrin OS=Homo sapiens OX=9606 GN=SLC26A4 PE=1 SV=1	491	ILGLDLGLLAGL
ESIDVKTKEEDT	sp|Q9WMB5|NCAP_MEASC	304	sp|Q9P0U3|SENP1_HUMAN Sentrin-specific protease 1 OS=Homo sapiens OX=9606 GN=SENP1 PE=1 SV=2	570	ESIDKKRKEFDT
AVSAIDRLSRIA	sp|Q9WMB5|NCAP_MEASC	95	tr|A0A1B0GV38|A0A1B0GV38_HUMAN GABA(A) receptor subunit alpha-1 OS=Homo sapiens OX=9606 GN=GABRA1 PE=1 SV=1	430	SVSKIDRLSRIA
AVSAIDRLSRIA	sp|Q9WMB5|NCAP_MEASC	95	sp|P14867|GBRA1_HUMAN Gamma-aminobutyric acid receptor subunit alpha-1 OS=Homo sapiens OX=9606 GN=GABRA1 PE=1 SV=3	415	SVSKIDRLSRIA
GLGTLSSFGGLE	sp|Q786F3|FUS_MEASC	86	sp|Q9BRN9|TM2D3_HUMAN TM2 domain-containing protein 3 OS=Homo sapiens OX=9606 GN=TM2D3 PE=2 SV=2	212	GLGKLFSFGGLG
GLGTLSSFGGLE	sp|Q786F3|FUS_MEASC	86	tr|B3KT51|B3KT51_HUMAN TM2 domain containing 3, isoform CRA_a OS=Homo sapiens OX=9606 GN=TM2D3 PE=1 SV=1	147	GLGKLFSFGGLG
ERCLRSTRPDME	sp|P0C774|V_MEASC	177	sp|O14684|PTGES_HUMAN Prostaglandin E synthase OS=Homo sapiens OX=9606 GN=PTGES PE=1 SV=2	66	ERCLRAHRNDME
DVEKLEDLPTRT	sp|Q9W850|MATRX_MEASC	138	tr|H0YC05|H0YC05_HUMAN PHD finger protein 20-like protein 1 (Fragment) OS=Homo sapiens OX=9606 GN=PHF20L1 PE=1 SV=1	62	DVEKKEDLPTSS
DVEKLEDLPTRT	sp|Q9W850|MATRX_MEASC	138	tr|A0A0A0MQS0|A0A0A0MQS0_HUMAN PHD finger protein 20-like protein 1 OS=Homo sapiens OX=9606 GN=PHF20L1 PE=1 SV=1	200	DVEKKEDLPTSS
DVEKLEDLPTRT	sp|Q9W850|MATRX_MEASC	138	sp|A8MW92|P20L1_HUMAN PHD finger protein 20-like protein 1 OS=Homo sapiens OX=9606 GN=PHF20L1 PE=1 SV=2	226	DVEKKEDLPTSS
DVEKLEDLPTRT	sp|Q9W850|MATRX_MEASC	138	tr|A8MUE8|A8MUE8_HUMAN PHD finger protein 20-like protein 1 OS=Homo sapiens OX=9606 GN=PHF20L1 PE=1 SV=1	226	DVEKKEDLPTSS
DVEKLEDLPTRT	sp|Q9W850|MATRX_MEASC	138	tr|E9PM57|E9PM57_HUMAN PHD finger protein 20-like protein 1 OS=Homo sapiens OX=9606 GN=PHF20L1 PE=1 SV=1	200	DVEKKEDLPTSS
DVEKLEDLPTRT	sp|Q9W850|MATRX_MEASC	138	tr|F8W9L8|F8W9L8_HUMAN PHD finger protein 20-like protein 1 OS=Homo sapiens OX=9606 GN=PHF20L1 PE=1 SV=1	200	DVEKKEDLPTSS
DVEKLEDLPTRT	sp|Q9W850|MATRX_MEASC	138	tr|A8MXR8|A8MXR8_HUMAN PHD finger protein 20-like protein 1 OS=Homo sapiens OX=9606 GN=PHF20L1 PE=1 SV=1	230	DVEKKEDLPTSS
LAGLQRLPPDTL	sp|Q9WMB5|NCAP_MEASC	398	tr|F5H3H7|F5H3H7_HUMAN Beta-1,3-N-acetylglucosaminyltransferase radical fringe OS=Homo sapiens OX=9606 GN=RFNG PE=1 SV=2	136	LENLQRLPPDTL
LAGLQRLPPDTL	sp|Q9WMB5|NCAP_MEASC	398	sp|Q9Y644|RFNG_HUMAN Beta-1,3-N-acetylglucosaminyltransferase radical fringe OS=Homo sapiens OX=9606 GN=RFNG PE=2 SV=3	262	LENLQRLPPDTL
GRATILERGVAS	sp|Q9WMB4|PHOSP_MEASC	254	sp|Q9NZ56|FMN2_HUMAN Formin-2 OS=Homo sapiens OX=9606 GN=FMN2 PE=1 SV=4	498	GSAHLLERGVAS
SAPGYGSGRSGN	sp|Q9WMB5|NCAP_MEASC	167	sp|O75474|FRAT2_HUMAN GSK-3-binding protein FRAT2 OS=Homo sapiens OX=9606 GN=FRAT2 PE=2 SV=3	210	SAPGPGGGRSGP
SDSDSDGGENET	sp|Q9WMB4|PHOSP_MEASC	431	sp|O75864|PPR37_HUMAN Protein phosphatase 1 regulatory subunit 37 OS=Homo sapiens OX=9606 GN=PPP1R37 PE=1 SV=4	507	SDSDSDGEEEEE
KMLTSLILPDII	sp|Q786F2|HEMA_MEASC	263	sp|Q02108|GCYA1_HUMAN Guanylate cyclase soluble subunit alpha-1 OS=Homo sapiens OX=9606 GN=GUCY1A1 PE=1 SV=2	208	KRTTSLILPGII
STKLTSIKICES	sp|Q9WMB3|L_MEASC	357	tr|A0A6Q8PHE0|A0A6Q8PHE0_HUMAN Ligand-dependent nuclear receptor corepressor-like protein OS=Homo sapiens OX=9606 GN=LCORL PE=1 SV=1	235	STKKTSIKSEES
STKLTSIKICES	sp|Q9WMB3|L_MEASC	357	tr|A0A6Q8PG24|A0A6Q8PG24_HUMAN Ligand-dependent nuclear receptor corepressor-like protein (Fragment) OS=Homo sapiens OX=9606 GN=LCORL PE=1 SV=1	235	STKKTSIKSEES
STKLTSIKICES	sp|Q9WMB3|L_MEASC	357	tr|A0A6Q8PFT7|A0A6Q8PFT7_HUMAN Ligand-dependent nuclear receptor corepressor-like protein (Fragment) OS=Homo sapiens OX=9606 GN=LCORL PE=1 SV=1	235	STKKTSIKSEES
STKLTSIKICES	sp|Q9WMB3|L_MEASC	357	sp|Q8N3X6|LCORL_HUMAN Ligand-dependent nuclear receptor corepressor-like protein OS=Homo sapiens OX=9606 GN=LCORL PE=1 SV=4	235	STKKTSIKSEES
STKLTSIKICES	sp|Q9WMB3|L_MEASC	357	tr|C9JI46|C9JI46_HUMAN Ligand-dependent nuclear receptor corepressor-like protein OS=Homo sapiens OX=9606 GN=LCORL PE=1 SV=1	151	STKKTSIKSEES
STKLTSIKICES	sp|Q9WMB3|L_MEASC	357	tr|A0A1B0GVP4|A0A1B0GVP4_HUMAN Ligand-dependent nuclear receptor corepressor-like protein OS=Homo sapiens OX=9606 GN=LCORL PE=1 SV=1	235	STKKTSIKSEES
LVYDRSKGLDGG	sp|Q786F2|HEMA_MEASC	40	sp|P34896|GLYC_HUMAN Serine hydroxymethyltransferase, cytosolic OS=Homo sapiens OX=9606 GN=SHMT1 PE=1 SV=1	360	LVDLRSKGTDGG
SDVRPNGVVSLL	sp|Q9WMB3|L_MEASC	2056	tr|E9PHB6|E9PHB6_HUMAN Sodium channel protein OS=Homo sapiens OX=9606 GN=SCN5A PE=1 SV=1	593	STVDCNGVVSLL
SDVRPNGVVSLL	sp|Q9WMB3|L_MEASC	2056	sp|Q14524|SCN5A_HUMAN Sodium channel protein type 5 subunit alpha OS=Homo sapiens OX=9606 GN=SCN5A PE=1 SV=2	593	STVDCNGVVSLL
SDVRPNGVVSLL	sp|Q9WMB3|L_MEASC	2056	tr|H9KVD2|H9KVD2_HUMAN Sodium channel protein OS=Homo sapiens OX=9606 GN=SCN5A PE=1 SV=1	593	STVDCNGVVSLL
SDVRPNGVVSLL	sp|Q9WMB3|L_MEASC	2056	tr|E9PG18|E9PG18_HUMAN Sodium channel protein OS=Homo sapiens OX=9606 GN=SCN5A PE=3 SV=1	593	STVDCNGVVSLL
SDVRPNGVVSLL	sp|Q9WMB3|L_MEASC	2056	tr|K4DIA1|K4DIA1_HUMAN Sodium channel protein OS=Homo sapiens OX=9606 GN=SCN5A PE=3 SV=1	593	STVDCNGVVSLL
SDVRPNGVVSLL	sp|Q9WMB3|L_MEASC	2056	tr|A0A0A0MT39|A0A0A0MT39_HUMAN Sodium channel protein OS=Homo sapiens OX=9606 GN=SCN5A PE=1 SV=1	593	STVDCNGVVSLL
LTKELDSQLNNP	sp|Q9WMB4|PHOSP_MEASC	375	tr|H7C3P6|H7C3P6_HUMAN Nuclear pore complex protein Nup98-Nup96 (Fragment) OS=Homo sapiens OX=9606 GN=NUP98 PE=1 SV=1	218	HLKELDSQLNEP
LTKELDSQLNNP	sp|Q9WMB4|PHOSP_MEASC	375	sp|P52948|NUP98_HUMAN Nuclear pore complex protein Nup98-Nup96 OS=Homo sapiens OX=9606 GN=NUP98 PE=1 SV=4	1282	HLKELDSQLNEP
LTKELDSQLNNP	sp|Q9WMB4|PHOSP_MEASC	375	tr|A0A3B3ITD8|A0A3B3ITD8_HUMAN Nuclear pore complex protein Nup98-Nup96 OS=Homo sapiens OX=9606 GN=NUP98 PE=1 SV=1	1265	HLKELDSQLNEP
IDRLSRIAFYKE	sp|Q9WMB5|NCAP_MEASC	99	tr|A0A1B0GV38|A0A1B0GV38_HUMAN GABA(A) receptor subunit alpha-1 OS=Homo sapiens OX=9606 GN=GABRA1 PE=1 SV=1	434	IDRLSRIAFPLL
IDRLSRIAFYKE	sp|Q9WMB5|NCAP_MEASC	99	sp|P14867|GBRA1_HUMAN Gamma-aminobutyric acid receptor subunit alpha-1 OS=Homo sapiens OX=9606 GN=GABRA1 PE=1 SV=3	419	IDRLSRIAFPLL
ANSPILGLDLGL	sp|Q9WMB5|NCAP_MEASC	459	tr|A0A2R8Y4W7|A0A2R8Y4W7_HUMAN Pendrin (Fragment) OS=Homo sapiens OX=9606 GN=SLC26A4 PE=1 SV=1	58	IVSIILGLDLGL
ANSPILGLDLGL	sp|Q9WMB5|NCAP_MEASC	459	sp|O43511|S26A4_HUMAN Pendrin OS=Homo sapiens OX=9606 GN=SLC26A4 PE=1 SV=1	487	IVSIILGLDLGL
SLLSSKGITMSL	sp|Q9YZN9|C_MEASC	34	tr|A0A1W2PPL5|A0A1W2PPL5_HUMAN Uncharacterized protein KIAA1614 (Fragment) OS=Homo sapiens OX=9606 GN=KIAA1614 PE=1 SV=1	49	SLLSSKGNRSSL
SLLSSKGITMSL	sp|Q9YZN9|C_MEASC	34	sp|Q5VZ46|K1614_HUMAN Uncharacterized protein KIAA1614 OS=Homo sapiens OX=9606 GN=KIAA1614 PE=2 SV=3	1071	SLLSSKGNRSSL
SLREGRLGSENA	sp|Q9WMB4|PHOSP_MEASC	448	sp|Q08170|SRSF4_HUMAN Serine/arginine-rich splicing factor 4 OS=Homo sapiens OX=9606 GN=SRSF4 PE=1 SV=2	423	SQREGRGESENA
TSVAETKRRKGL	sp|Q786F2|HEMA_MEASC	161	tr|A0A494C193|A0A494C193_HUMAN Uncharacterized protein OS=Homo sapiens OX=9606 PE=4 SV=1	21	TPKAETRRRKGL
RPDRIVTDNRVF	sp|Q9WMB3|L_MEASC	694	tr|C9J710|C9J710_HUMAN Centrosomal protein of 70 kDa (Fragment) OS=Homo sapiens OX=9606 GN=CEP70 PE=1 SV=1	166	EEDRIVTQNRVF
RPDRIVTDNRVF	sp|Q9WMB3|L_MEASC	694	tr|C9J966|C9J966_HUMAN Centrosomal protein of 70 kDa (Fragment) OS=Homo sapiens OX=9606 GN=CEP70 PE=1 SV=2	165	EEDRIVTQNRVF
RPDRIVTDNRVF	sp|Q9WMB3|L_MEASC	694	sp|Q8NHQ1|CEP70_HUMAN Centrosomal protein of 70 kDa OS=Homo sapiens OX=9606 GN=CEP70 PE=1 SV=2	186	EEDRIVTQNRVF
RPDRIVTDNRVF	sp|Q9WMB3|L_MEASC	694	tr|B7Z2D2|B7Z2D2_HUMAN Centrosomal protein of 70 kDa OS=Homo sapiens OX=9606 GN=CEP70 PE=1 SV=1	34	EEDRIVTQNRVF
SGQGSNSIAPPM	sp|Q786F2|HEMA_MEASC	430	sp|Q68DA7|FMN1_HUMAN Formin-1 OS=Homo sapiens OX=9606 GN=FMN1 PE=1 SV=3	883	SGLGSLSPAPPM
SGQGSNSIAPPM	sp|Q786F2|HEMA_MEASC	430	tr|A0A5F9ZHS8|A0A5F9ZHS8_HUMAN Formin-1 OS=Homo sapiens OX=9606 GN=FMN1 PE=1 SV=1	305	SGLGSLSPAPPM
SGQGSNSIAPPM	sp|Q786F2|HEMA_MEASC	430	tr|H0YM30|H0YM30_HUMAN Formin-1 OS=Homo sapiens OX=9606 GN=FMN1 PE=1 SV=1	785	SGLGSLSPAPPM
GVRRPKGSKGGK	sp|Q786F2|HEMA_MEASC	489	tr|A0A0U1RRA7|A0A0U1RRA7_HUMAN Collagen alpha-1(XI) chain (Fragment) OS=Homo sapiens OX=9606 GN=COL11A1 PE=1 SV=1	542	GVRGLKGSKGEK
GVRRPKGSKGGK	sp|Q786F2|HEMA_MEASC	489	sp|P12107|COBA1_HUMAN Collagen alpha-1(XI) chain OS=Homo sapiens OX=9606 GN=COL11A1 PE=1 SV=4	769	GVRGLKGSKGEK
PDRIVTDNRVFD	sp|Q9WMB3|L_MEASC	695	tr|C9J710|C9J710_HUMAN Centrosomal protein of 70 kDa (Fragment) OS=Homo sapiens OX=9606 GN=CEP70 PE=1 SV=1	167	EDRIVTQNRVFA
PDRIVTDNRVFD	sp|Q9WMB3|L_MEASC	695	tr|C9J966|C9J966_HUMAN Centrosomal protein of 70 kDa (Fragment) OS=Homo sapiens OX=9606 GN=CEP70 PE=1 SV=2	166	EDRIVTQNRVFA
PDRIVTDNRVFD	sp|Q9WMB3|L_MEASC	695	sp|Q8NHQ1|CEP70_HUMAN Centrosomal protein of 70 kDa OS=Homo sapiens OX=9606 GN=CEP70 PE=1 SV=2	187	EDRIVTQNRVFA
PDRIVTDNRVFD	sp|Q9WMB3|L_MEASC	695	tr|B7Z2D2|B7Z2D2_HUMAN Centrosomal protein of 70 kDa OS=Homo sapiens OX=9606 GN=CEP70 PE=1 SV=1	35	EDRIVTQNRVFA
MGLIAWEELDLS	sp|Q9W850|MATRX_MEASC	274	tr|E7EV07|E7EV07_HUMAN Rho guanine nucleotide exchange factor 4 OS=Homo sapiens OX=9606 GN=ARHGEF4 PE=1 SV=3	123	PGLHAKEELDLS
AKAANLRSESSK	sp|Q9WMB4|PHOSP_MEASC	311	sp|Q9BT09|CNPY3_HUMAN Protein canopy homolog 3 OS=Homo sapiens OX=9606 GN=CNPY3 PE=1 SV=1	233	AKAAGGRSSSSK
DIDVKGEGDDKI	sp|Q9WMB4|PHOSP_MEASC	414	sp|Q9UJU5|FOXD3_HUMAN Forkhead box protein D3 OS=Homo sapiens OX=9606 GN=FOXD3 PE=1 SV=1	24	DIDVVGEGDDGL
SPILGLDLGLLP	sp|Q9WMB5|NCAP_MEASC	461	tr|A0A2R8Y4W7|A0A2R8Y4W7_HUMAN Pendrin (Fragment) OS=Homo sapiens OX=9606 GN=SLC26A4 PE=1 SV=1	60	SIILGLDLGLLA
SPILGLDLGLLP	sp|Q9WMB5|NCAP_MEASC	461	sp|O43511|S26A4_HUMAN Pendrin OS=Homo sapiens OX=9606 GN=SLC26A4 PE=1 SV=1	489	SIILGLDLGLLA
RVARILVRFQSP	sp|Q9W850|MATRX_MEASC	243	tr|E5RJ03|E5RJ03_HUMAN Cell death activator CIDE-A OS=Homo sapiens OX=9606 GN=CIDEA PE=4 SV=1	17	RVPLIAVRFQSP
GEGRILEPVIQS	sp|Q9WMB5|NCAP_MEASC	424	tr|H3BPF5|H3BPF5_HUMAN Protein fantom (Fragment) OS=Homo sapiens OX=9606 GN=RPGRIP1L PE=1 SV=1	206	GEIRNLENVIQS
GEGRILEPVIQS	sp|Q9WMB5|NCAP_MEASC	424	tr|H3BS47|H3BS47_HUMAN Protein fantom OS=Homo sapiens OX=9606 GN=RPGRIP1L PE=1 SV=1	206	GEIRNLENVIQS
GEGRILEPVIQS	sp|Q9WMB5|NCAP_MEASC	424	tr|A0A087WX34|A0A087WX34_HUMAN Protein fantom OS=Homo sapiens OX=9606 GN=RPGRIP1L PE=1 SV=1	206	GEIRNLENVIQS
GEGRILEPVIQS	sp|Q9WMB5|NCAP_MEASC	424	sp|Q68CZ1|FTM_HUMAN Protein fantom OS=Homo sapiens OX=9606 GN=RPGRIP1L PE=1 SV=2	206	GEIRNLENVIQS
GEGRILEPVIQS	sp|Q9WMB5|NCAP_MEASC	424	tr|H3BV03|H3BV03_HUMAN Protein fantom OS=Homo sapiens OX=9606 GN=RPGRIP1L PE=1 SV=1	206	GEIRNLENVIQS
AIDRLSRIAFYK	sp|Q9WMB5|NCAP_MEASC	98	tr|A0A1B0GV38|A0A1B0GV38_HUMAN GABA(A) receptor subunit alpha-1 OS=Homo sapiens OX=9606 GN=GABRA1 PE=1 SV=1	433	KIDRLSRIAFPL
AIDRLSRIAFYK	sp|Q9WMB5|NCAP_MEASC	98	sp|P14867|GBRA1_HUMAN Gamma-aminobutyric acid receptor subunit alpha-1 OS=Homo sapiens OX=9606 GN=GABRA1 PE=1 SV=3	418	KIDRLSRIAFPL
AALAISLGVWCI	sp|Q9WMB3|L_MEASC	1218	sp|Q9N2K0|ENH1_HUMAN HERV-H_2q24.3 provirus ancestral Env polyprotein OS=Homo sapiens OX=9606 PE=2 SV=1	303	AALAGSLGVWVQ
AALAISLGVWCI	sp|Q9WMB3|L_MEASC	1218	sp|Q9N2J8|ENH3_HUMAN HERV-H_2q24.1 provirus ancestral Env polyprotein OS=Homo sapiens OX=9606 PE=2 SV=1	303	AALAGSLGVWVQ
GAGAAYAGDGIP	sp|Q786F3|FUS_MEASC	274	sp|Q9H461|FZD8_HUMAN Frizzled-8 OS=Homo sapiens OX=9606 GN=FZD8 PE=1 SV=1	359	GAGAAGAGAGGP
LSTILPSLIGSL	sp|Q786F3|FUS_MEASC	194	sp|Q5T1B0|AXDN1_HUMAN Axonemal dynein light chain domain-containing protein 1 OS=Homo sapiens OX=9606 GN=AXDND1 PE=2 SV=1	601	YSKILPSLISSL
LSTILPSLIGSL	sp|Q786F3|FUS_MEASC	194	tr|B1AM31|B1AM31_HUMAN Axonemal dynein light chain domain-containing protein 1 (Fragment) OS=Homo sapiens OX=9606 GN=AXDND1 PE=1 SV=1	535	YSKILPSLISSL
LQRLPPDTLKAN	sp|Q9WMB5|NCAP_MEASC	401	tr|F5H3H7|F5H3H7_HUMAN Beta-1,3-N-acetylglucosaminyltransferase radical fringe OS=Homo sapiens OX=9606 GN=RFNG PE=1 SV=2	139	LQRLPPDTLLQQ
LQRLPPDTLKAN	sp|Q9WMB5|NCAP_MEASC	401	sp|Q9Y644|RFNG_HUMAN Beta-1,3-N-acetylglucosaminyltransferase radical fringe OS=Homo sapiens OX=9606 GN=RFNG PE=2 SV=3	265	LQRLPPDTLLQQ
LKRAALAISLGV	sp|Q9WMB3|L_MEASC	1215	sp|Q9N2K0|ENH1_HUMAN HERV-H_2q24.3 provirus ancestral Env polyprotein OS=Homo sapiens OX=9606 PE=2 SV=1	300	LTAAALAGSLGV
LKRAALAISLGV	sp|Q9WMB3|L_MEASC	1215	sp|Q9N2J8|ENH3_HUMAN HERV-H_2q24.1 provirus ancestral Env polyprotein OS=Homo sapiens OX=9606 PE=2 SV=1	300	LTAAALAGSLGV
GLQRLPPDTLKA	sp|Q9WMB5|NCAP_MEASC	400	tr|F5H3H7|F5H3H7_HUMAN Beta-1,3-N-acetylglucosaminyltransferase radical fringe OS=Homo sapiens OX=9606 GN=RFNG PE=1 SV=2	138	NLQRLPPDTLLQ
GLQRLPPDTLKA	sp|Q9WMB5|NCAP_MEASC	400	sp|Q9Y644|RFNG_HUMAN Beta-1,3-N-acetylglucosaminyltransferase radical fringe OS=Homo sapiens OX=9606 GN=RFNG PE=2 SV=3	264	NLQRLPPDTLLQ
GRSDLTLAGLQR	sp|Q9WMB5|NCAP_MEASC	392	sp|Q4U2R8|S22A6_HUMAN Solute carrier family 22 member 6 OS=Homo sapiens OX=9606 GN=SLC22A6 PE=1 SV=1	279	GRLDLTLRALQR
TILPSLIGSLLP	sp|Q786F3|FUS_MEASC	196	sp|O43280|TREA_HUMAN Trehalase OS=Homo sapiens OX=9606 GN=TREH PE=1 SV=2	571	TLLPSLLLSLLP
LEFDEKESATQL	sp|Q9WMB4|PHOSP_MEASC	95	tr|A6NGQ3|A6NGQ3_HUMAN Non-specific serine/threonine protein kinase OS=Homo sapiens OX=9606 GN=OBSCN PE=1 SV=5	342	LEVREKESATFL
LEFDEKESATQL	sp|Q9WMB4|PHOSP_MEASC	95	tr|A0A590UJ10|A0A590UJ10_HUMAN Obscurin OS=Homo sapiens OX=9606 GN=OBSCN PE=1 SV=1	342	LEVREKESATFL
LEFDEKESATQL	sp|Q9WMB4|PHOSP_MEASC	95	sp|Q5VST9|OBSCN_HUMAN Obscurin OS=Homo sapiens OX=9606 GN=OBSCN PE=1 SV=3	342	LEVREKESATFL
IKTHDKPPIYRL	sp|Q786F2|HEMA_MEASC	596	sp|Q6ZU65|UBN2_HUMAN Ubinuclein-2 OS=Homo sapiens OX=9606 GN=UBN2 PE=1 SV=2	971	IKTSDKPLMYRL
GLGPTLLRSRLI	sp|Q9WMB3|L_MEASC	2152	tr|A0A286YF65|A0A286YF65_HUMAN Nucleotide-binding oligomerization domain-containing protein 2 OS=Homo sapiens OX=9606 GN=NOD2 PE=4 SV=1	507	GLGPSLLRGRLP
GLGPTLLRSRLI	sp|Q9WMB3|L_MEASC	2152	sp|Q9HC29|NOD2_HUMAN Nucleotide-binding oligomerization domain-containing protein 2 OS=Homo sapiens OX=9606 GN=NOD2 PE=1 SV=1	534	GLGPSLLRGRLP
TKELDSQLNNPE	sp|Q9WMB4|PHOSP_MEASC	376	tr|H7C3P6|H7C3P6_HUMAN Nuclear pore complex protein Nup98-Nup96 (Fragment) OS=Homo sapiens OX=9606 GN=NUP98 PE=1 SV=1	219	LKELDSQLNEPR
TKELDSQLNNPE	sp|Q9WMB4|PHOSP_MEASC	376	sp|P52948|NUP98_HUMAN Nuclear pore complex protein Nup98-Nup96 OS=Homo sapiens OX=9606 GN=NUP98 PE=1 SV=4	1283	LKELDSQLNEPR
TKELDSQLNNPE	sp|Q9WMB4|PHOSP_MEASC	376	tr|A0A3B3ITD8|A0A3B3ITD8_HUMAN Nuclear pore complex protein Nup98-Nup96 OS=Homo sapiens OX=9606 GN=NUP98 PE=1 SV=1	1266	LKELDSQLNEPR
AGAAYAGDGIPG	sp|Q786F3|FUS_MEASC	275	sp|Q9H461|FZD8_HUMAN Frizzled-8 OS=Homo sapiens OX=9606 GN=FZD8 PE=1 SV=1	360	AGAAGAGAGGPG
KALNVWDKEPEL	sp|Q786F2|HEMA_MEASC	23	sp|Q5JSZ5|PRC2B_HUMAN Protein PRRC2B OS=Homo sapiens OX=9606 GN=PRRC2B PE=1 SV=2	948	KALKVEDKEKEL
KALNVWDKEPEL	sp|Q786F2|HEMA_MEASC	23	tr|A0A494C0D3|A0A494C0D3_HUMAN Protein PRRC2B (Fragment) OS=Homo sapiens OX=9606 GN=PRRC2B PE=1 SV=1	180	KALKVEDKEKEL
DKDSAVVEESSC	sp|P0C774|V_MEASC	3	sp|Q8IWZ6|BBS7_HUMAN Bardet-Biedl syndrome 7 protein OS=Homo sapiens OX=9606 GN=BBS7 PE=1 SV=2	421	DKNSAVVSFSSC
GLATIRSQGSSW	sp|Q9WMB4|PHOSP_MEASC	484	tr|A0A088AWP5|A0A088AWP5_HUMAN Protein prune homolog 2 OS=Homo sapiens OX=9606 GN=PRUNE2 PE=1 SV=1	429	GLATIRSSRSSK
GLATIRSQGSSW	sp|Q9WMB4|PHOSP_MEASC	484	sp|Q8WUY3|PRUN2_HUMAN Protein prune homolog 2 OS=Homo sapiens OX=9606 GN=PRUNE2 PE=1 SV=3	429	GLATIRSSRSSK
GLATIRSQGSSW	sp|Q9WMB4|PHOSP_MEASC	484	tr|E9PDC2|E9PDC2_HUMAN Protein prune homolog 2 OS=Homo sapiens OX=9606 GN=PRUNE2 PE=1 SV=1	70	GLATIRSSRSSK
QIDVEKLEDLPT	sp|Q9W850|MATRX_MEASC	136	tr|H0YC05|H0YC05_HUMAN PHD finger protein 20-like protein 1 (Fragment) OS=Homo sapiens OX=9606 GN=PHF20L1 PE=1 SV=1	60	TPDVEKKEDLPT
QIDVEKLEDLPT	sp|Q9W850|MATRX_MEASC	136	tr|A0A0A0MQS0|A0A0A0MQS0_HUMAN PHD finger protein 20-like protein 1 OS=Homo sapiens OX=9606 GN=PHF20L1 PE=1 SV=1	198	TPDVEKKEDLPT
QIDVEKLEDLPT	sp|Q9W850|MATRX_MEASC	136	sp|A8MW92|P20L1_HUMAN PHD finger protein 20-like protein 1 OS=Homo sapiens OX=9606 GN=PHF20L1 PE=1 SV=2	224	TPDVEKKEDLPT
QIDVEKLEDLPT	sp|Q9W850|MATRX_MEASC	136	tr|A8MUE8|A8MUE8_HUMAN PHD finger protein 20-like protein 1 OS=Homo sapiens OX=9606 GN=PHF20L1 PE=1 SV=1	224	TPDVEKKEDLPT
QIDVEKLEDLPT	sp|Q9W850|MATRX_MEASC	136	tr|E9PM57|E9PM57_HUMAN PHD finger protein 20-like protein 1 OS=Homo sapiens OX=9606 GN=PHF20L1 PE=1 SV=1	198	TPDVEKKEDLPT
QIDVEKLEDLPT	sp|Q9W850|MATRX_MEASC	136	tr|F8W9L8|F8W9L8_HUMAN PHD finger protein 20-like protein 1 OS=Homo sapiens OX=9606 GN=PHF20L1 PE=1 SV=1	198	TPDVEKKEDLPT
QIDVEKLEDLPT	sp|Q9W850|MATRX_MEASC	136	tr|A8MXR8|A8MXR8_HUMAN PHD finger protein 20-like protein 1 OS=Homo sapiens OX=9606 GN=PHF20L1 PE=1 SV=1	228	TPDVEKKEDLPT
QMVLTVQRSLGK	sp|Q9YZN9|C_MEASC	157	sp|Q96SZ6|CK5P1_HUMAN Mitochondrial tRNA methylthiotransferase CDK5RAP1 OS=Homo sapiens OX=9606 GN=CDK5RAP1 PE=1 SV=2	5	QCVLQVQRSLGW
TERDALLLMKIS	sp|Q9WMB3|L_MEASC	405	sp|Q9NQ50|RM40_HUMAN 39S ribosomal protein L40, mitochondrial OS=Homo sapiens OX=9606 GN=MRPL40 PE=1 SV=1	111	TERRALLLKKWS
DRIVTDNRVFDA	sp|Q9WMB3|L_MEASC	696	tr|C9J710|C9J710_HUMAN Centrosomal protein of 70 kDa (Fragment) OS=Homo sapiens OX=9606 GN=CEP70 PE=1 SV=1	168	DRIVTQNRVFAY
DRIVTDNRVFDA	sp|Q9WMB3|L_MEASC	696	tr|C9J966|C9J966_HUMAN Centrosomal protein of 70 kDa (Fragment) OS=Homo sapiens OX=9606 GN=CEP70 PE=1 SV=2	167	DRIVTQNRVFAY
DRIVTDNRVFDA	sp|Q9WMB3|L_MEASC	696	sp|Q8NHQ1|CEP70_HUMAN Centrosomal protein of 70 kDa OS=Homo sapiens OX=9606 GN=CEP70 PE=1 SV=2	188	DRIVTQNRVFAY
DRIVTDNRVFDA	sp|Q9WMB3|L_MEASC	696	tr|B7Z2D2|B7Z2D2_HUMAN Centrosomal protein of 70 kDa OS=Homo sapiens OX=9606 GN=CEP70 PE=1 SV=1	36	DRIVTQNRVFAY
RSKGERRSEDGA	sp|Q9WMB5|NCAP_MEASC	448	sp|Q6NUJ5|PWP2B_HUMAN PWWP domain-containing protein 2B OS=Homo sapiens OX=9606 GN=PWWP2B PE=1 SV=3	231	RSKRERREEDRA
YGLGPTLLRSRL	sp|Q9WMB3|L_MEASC	2151	tr|A0A286YF65|A0A286YF65_HUMAN Nucleotide-binding oligomerization domain-containing protein 2 OS=Homo sapiens OX=9606 GN=NOD2 PE=4 SV=1	506	QGLGPSLLRGRL
YGLGPTLLRSRL	sp|Q9WMB3|L_MEASC	2151	sp|Q9HC29|NOD2_HUMAN Nucleotide-binding oligomerization domain-containing protein 2 OS=Homo sapiens OX=9606 GN=NOD2 PE=1 SV=1	533	QGLGPSLLRGRL
GISSVCAVFQQL	sp|Q786F3|FUS_MEASC	356	tr|K7ESP4|K7ESP4_HUMAN Dephospho-CoA kinase domain-containing protein (Fragment) OS=Homo sapiens OX=9606 GN=DCAKD PE=1 SV=1	13	GKSSVIQVFQQL
GISSVCAVFQQL	sp|Q786F3|FUS_MEASC	356	sp|Q8WVC6|DCAKD_HUMAN Dephospho-CoA kinase domain-containing protein OS=Homo sapiens OX=9606 GN=DCAKD PE=1 SV=1	13	GKSSVIQVFQQL
IDVEKLEDLPTR	sp|Q9W850|MATRX_MEASC	137	tr|H0YC05|H0YC05_HUMAN PHD finger protein 20-like protein 1 (Fragment) OS=Homo sapiens OX=9606 GN=PHF20L1 PE=1 SV=1	61	PDVEKKEDLPTS
IDVEKLEDLPTR	sp|Q9W850|MATRX_MEASC	137	tr|A0A0A0MQS0|A0A0A0MQS0_HUMAN PHD finger protein 20-like protein 1 OS=Homo sapiens OX=9606 GN=PHF20L1 PE=1 SV=1	199	PDVEKKEDLPTS
IDVEKLEDLPTR	sp|Q9W850|MATRX_MEASC	137	sp|A8MW92|P20L1_HUMAN PHD finger protein 20-like protein 1 OS=Homo sapiens OX=9606 GN=PHF20L1 PE=1 SV=2	225	PDVEKKEDLPTS
IDVEKLEDLPTR	sp|Q9W850|MATRX_MEASC	137	tr|A8MUE8|A8MUE8_HUMAN PHD finger protein 20-like protein 1 OS=Homo sapiens OX=9606 GN=PHF20L1 PE=1 SV=1	225	PDVEKKEDLPTS
IDVEKLEDLPTR	sp|Q9W850|MATRX_MEASC	137	tr|E9PM57|E9PM57_HUMAN PHD finger protein 20-like protein 1 OS=Homo sapiens OX=9606 GN=PHF20L1 PE=1 SV=1	199	PDVEKKEDLPTS
IDVEKLEDLPTR	sp|Q9W850|MATRX_MEASC	137	tr|F8W9L8|F8W9L8_HUMAN PHD finger protein 20-like protein 1 OS=Homo sapiens OX=9606 GN=PHF20L1 PE=1 SV=1	199	PDVEKKEDLPTS
IDVEKLEDLPTR	sp|Q9W850|MATRX_MEASC	137	tr|A8MXR8|A8MXR8_HUMAN PHD finger protein 20-like protein 1 OS=Homo sapiens OX=9606 GN=PHF20L1 PE=1 SV=1	229	PDVEKKEDLPTS
AGLQRLPPDTLK	sp|Q9WMB5|NCAP_MEASC	399	tr|F5H3H7|F5H3H7_HUMAN Beta-1,3-N-acetylglucosaminyltransferase radical fringe OS=Homo sapiens OX=9606 GN=RFNG PE=1 SV=2	137	ENLQRLPPDTLL
AGLQRLPPDTLK	sp|Q9WMB5|NCAP_MEASC	399	sp|Q9Y644|RFNG_HUMAN Beta-1,3-N-acetylglucosaminyltransferase radical fringe OS=Homo sapiens OX=9606 GN=RFNG PE=2 SV=3	263	ENLQRLPPDTLL
TSDSDSDGGENE	sp|Q9WMB4|PHOSP_MEASC	430	sp|O75864|PPR37_HUMAN Protein phosphatase 1 regulatory subunit 37 OS=Homo sapiens OX=9606 GN=PPP1R37 PE=1 SV=4	506	DSDSDSDGEEEE
LPLSGLPSSENE	sp|Q9WMB4|PHOSP_MEASC	272	sp|Q96DR7|ARHGQ_HUMAN Rho guanine nucleotide exchange factor 26 OS=Homo sapiens OX=9606 GN=ARHGEF26 PE=1 SV=4	215	LPLQRLPSQENE
STGTSITENLKL	sp|Q9WMB3|L_MEASC	188	sp|Q9P2D6|F135A_HUMAN Protein FAM135A OS=Homo sapiens OX=9606 GN=FAM135A PE=1 SV=2	960	STGTAITLNSKL
