query	query_seqname	query_start	target_seqname	target_start	target
AEDLLTGTENEI	sp|O09705|L_LASSJ	385	tr|H0YN79|H0YN79_HUMAN DET1 homolog OS=Homo sapiens OX=9606 GN=DET1 PE=1 SV=1	48	AEDLLQGYEGEI
AEDLLTGTENEI	sp|O09705|L_LASSJ	385	sp|Q7L5Y6|DET1_HUMAN DET1 homolog OS=Homo sapiens OX=9606 GN=DET1 PE=1 SV=2	93	AEDLLQGYEGEI
LRFGDQLKYIDF	sp|O09705|L_LASSJ	917	sp|Q9H190|SDCB2_HUMAN Syntenin-2 OS=Homo sapiens OX=9606 GN=SDCBP2 PE=1 SV=2	146	LRFGDQLLQIDG
SSELEDLRKQAY	sp|O09705|L_LASSJ	2202	tr|F6RU00|F6RU00_HUMAN Golgi SNAP receptor complex member 1 OS=Homo sapiens OX=9606 GN=GOSR1 PE=1 SV=1	6	SSYWEDLRKQAR
SSELEDLRKQAY	sp|O09705|L_LASSJ	2202	tr|K7EJC8|K7EJC8_HUMAN Golgi SNAP receptor complex member 1 OS=Homo sapiens OX=9606 GN=GOSR1 PE=1 SV=1	6	SSYWEDLRKQAR
SSELEDLRKQAY	sp|O09705|L_LASSJ	2202	sp|O95249|GOSR1_HUMAN Golgi SNAP receptor complex member 1 OS=Homo sapiens OX=9606 GN=GOSR1 PE=1 SV=1	6	SSYWEDLRKQAR
SSELEDLRKQAY	sp|O09705|L_LASSJ	2202	tr|B4DQA8|B4DQA8_HUMAN 28 kDa Golgi SNARE protein OS=Homo sapiens OX=9606 GN=GOSR1 PE=1 SV=1	6	SSYWEDLRKQAR
SSELEDLRKQAY	sp|O09705|L_LASSJ	2202	tr|E9PCW1|E9PCW1_HUMAN Golgi SNAP receptor complex member 1 OS=Homo sapiens OX=9606 GN=GOSR1 PE=1 SV=1	6	SSYWEDLRKQAR
GNRNLNIGMNFT	sp|P08669|GLYC_LASSJ	398	sp|Q8TD20|GTR12_HUMAN Solute carrier family 2, facilitated glucose transporter member 12 OS=Homo sapiens OX=9606 GN=SLC2A12 PE=2 SV=1	362	GIVNLNIHMNFT
LPSVDLESKGLT	sp|O09705|L_LASSJ	1857	tr|A0A087X1T7|A0A087X1T7_HUMAN Aggrecan core protein OS=Homo sapiens OX=9606 GN=ACAN PE=1 SV=1	894	LPSGDLDSSGLT
LPSVDLESKGLT	sp|O09705|L_LASSJ	1857	tr|H0YMF1|H0YMF1_HUMAN Aggrecan core protein OS=Homo sapiens OX=9606 GN=ACAN PE=1 SV=2	894	LPSGDLDSSGLT
LPSVDLESKGLT	sp|O09705|L_LASSJ	1857	sp|P16112|PGCA_HUMAN Aggrecan core protein OS=Homo sapiens OX=9606 GN=ACAN PE=1 SV=3	894	LPSGDLDSSGLT
LPSVDLESKGLT	sp|O09705|L_LASSJ	1857	tr|A0A5K1VW97|A0A5K1VW97_HUMAN Aggrecan core protein (Fragment) OS=Homo sapiens OX=9606 GN=ACAN PE=1 SV=1	418	LPSGDLDSSGLT
DQLLKQGKLDMY	sp|P13699|NCAP_LASSJ	548	tr|A0A2U3TZV8|A0A2U3TZV8_HUMAN Phosphoinositide phospholipase C OS=Homo sapiens OX=9606 GN=PLCH1 PE=1 SV=1	333	DQLLSQSKVDMY
DQLLKQGKLDMY	sp|P13699|NCAP_LASSJ	548	sp|Q4KWH8|PLCH1_HUMAN 1-phosphatidylinositol 4,5-bisphosphate phosphodiesterase eta-1 OS=Homo sapiens OX=9606 GN=PLCH1 PE=1 SV=1	321	DQLLSQSKVDMY
SATGTSALTVKV	sp|O09705|L_LASSJ	1576	tr|B4DTR2|B4DTR2_HUMAN Cadherin-5 OS=Homo sapiens OX=9606 GN=CDH5 PE=1 SV=1	3	SRTGTSTLTVAV
SATGTSALTVKV	sp|O09705|L_LASSJ	1576	sp|P33151|CADH5_HUMAN Cadherin-5 OS=Homo sapiens OX=9606 GN=CDH5 PE=1 SV=5	564	SRTGTSTLTVAV
SATGTSALTVKV	sp|O09705|L_LASSJ	1576	tr|H0YLX2|H0YLX2_HUMAN DNA-binding protein RFX7 OS=Homo sapiens OX=9606 GN=RFX7 PE=1 SV=2	431	SAGGTSAVEVKV
SATGTSALTVKV	sp|O09705|L_LASSJ	1576	sp|Q2KHR2|RFX7_HUMAN DNA-binding protein RFX7 OS=Homo sapiens OX=9606 GN=RFX7 PE=1 SV=1	431	SAGGTSAVEVKV
SATGTSALTVKV	sp|O09705|L_LASSJ	1576	tr|A0A669KBM4|A0A669KBM4_HUMAN DNA-binding protein RFX7 OS=Homo sapiens OX=9606 GN=RFX7 PE=1 SV=1	528	SAGGTSAVEVKV
SLRFGDQLKYID	sp|O09705|L_LASSJ	916	sp|Q9H190|SDCB2_HUMAN Syntenin-2 OS=Homo sapiens OX=9606 GN=SDCBP2 PE=1 SV=2	145	GLRFGDQLLQID
LVLEEPYPGDDH	sp|O09705|L_LASSJ	1559	sp|Q7Z6L1|TCPR1_HUMAN Tectonin beta-propeller repeat-containing protein 1 OS=Homo sapiens OX=9606 GN=TECPR1 PE=1 SV=1	520	LGLEEPYGVDDH
THLLHSSPQIKD	sp|P08669|GLYC_LASSJ	112	sp|Q2M1Z3|RHG31_HUMAN Rho GTPase-activating protein 31 OS=Homo sapiens OX=9606 GN=ARHGAP31 PE=1 SV=2	1048	THLGHSSPQIRQ
ILLISTSARLLG	sp|P13699|NCAP_LASSJ	249	sp|A8MUP6|GS1L2_HUMAN Germ cell-specific gene 1-like protein 2 OS=Homo sapiens OX=9606 GN=GSG1L2 PE=3 SV=3	133	IVLILTSAILLG
QLLKQGKLDMYA	sp|P13699|NCAP_LASSJ	549	tr|A0A2U3TZV8|A0A2U3TZV8_HUMAN Phosphoinositide phospholipase C OS=Homo sapiens OX=9606 GN=PLCH1 PE=1 SV=1	334	QLLSQSKVDMYA
QLLKQGKLDMYA	sp|P13699|NCAP_LASSJ	549	sp|Q4KWH8|PLCH1_HUMAN 1-phosphatidylinositol 4,5-bisphosphate phosphodiesterase eta-1 OS=Homo sapiens OX=9606 GN=PLCH1 PE=1 SV=1	322	QLLSQSKVDMYA
KDSLYCDLLHLF	sp|P08669|GLYC_LASSJ	298	sp|Q6ZS30|NBEL1_HUMAN Neurobeachin-like protein 1 OS=Homo sapiens OX=9606 GN=NBEAL1 PE=2 SV=3	209	KESLKCCLLHLF
AGGSILEGYLNV	sp|O09705|L_LASSJ	176	sp|P41091|IF2G_HUMAN Eukaryotic translation initiation factor 2 subunit 3 OS=Homo sapiens OX=9606 GN=EIF2S3 PE=1 SV=3	279	AGGSILKGVLKV
AGGSILEGYLNV	sp|O09705|L_LASSJ	176	sp|Q2VIR3|IF2GL_HUMAN Eukaryotic translation initiation factor 2 subunit 3B OS=Homo sapiens OX=9606 GN=EIF2S3B PE=2 SV=2	279	AGGSILKGVLKV
SIVQIIIDALGE	sp|O09705|L_LASSJ	49	sp|Q9P2K2|TXD16_HUMAN Thioredoxin domain-containing protein 16 OS=Homo sapiens OX=9606 GN=TXNDC16 PE=1 SV=4	601	DIVQIITDALLE
DSLINSNLGVPS	sp|P08669|GLYC_LASSJ	184	sp|Q68CP4|HGNAT_HUMAN Heparan-alpha-glucosaminide N-acetyltransferase OS=Homo sapiens OX=9606 GN=HGSNAT PE=1 SV=2	234	DRLINSELGSPS
LALDRVNGSKPS	sp|P13699|NCAP_LASSJ	12	sp|Q01668|CAC1D_HUMAN Voltage-dependent L-type calcium channel subunit alpha-1D OS=Homo sapiens OX=9606 GN=CACNA1D PE=1 SV=2	2007	EALDQVNGSLPS
LALDRVNGSKPS	sp|P13699|NCAP_LASSJ	12	tr|A0A1B0GTN0|A0A1B0GTN0_HUMAN Voltage-dependent L-type calcium channel subunit alpha OS=Homo sapiens OX=9606 GN=CACNA1D PE=1 SV=1	2016	EALDQVNGSLPS
LALDRVNGSKPS	sp|P13699|NCAP_LASSJ	12	tr|A0A1B0GUN6|A0A1B0GUN6_HUMAN Voltage-dependent L-type calcium channel subunit alpha OS=Homo sapiens OX=9606 GN=CACNA1D PE=1 SV=1	1992	EALDQVNGSLPS
LALDRVNGSKPS	sp|P13699|NCAP_LASSJ	12	tr|Q59GD8|Q59GD8_HUMAN Calcium channel, voltage-dependent, L type, alpha 1D subunit variant (Fragment) OS=Homo sapiens OX=9606 GN=CACNA1D PE=1 SV=1	1700	EALDQVNGSLPS
QRVEGQMSKIMN	sp|O09705|L_LASSJ	1247	sp|Q6UX71|PXDC2_HUMAN Plexin domain-containing protein 2 OS=Homo sapiens OX=9606 GN=PLXDC2 PE=1 SV=1	305	HRVELQMSKITN
ALDRVNGSKPSG	sp|P13699|NCAP_LASSJ	13	sp|Q01668|CAC1D_HUMAN Voltage-dependent L-type calcium channel subunit alpha-1D OS=Homo sapiens OX=9606 GN=CACNA1D PE=1 SV=2	2008	ALDQVNGSLPSL
ALDRVNGSKPSG	sp|P13699|NCAP_LASSJ	13	tr|A0A1B0GTN0|A0A1B0GTN0_HUMAN Voltage-dependent L-type calcium channel subunit alpha OS=Homo sapiens OX=9606 GN=CACNA1D PE=1 SV=1	2017	ALDQVNGSLPSL
ALDRVNGSKPSG	sp|P13699|NCAP_LASSJ	13	tr|A0A1B0GUN6|A0A1B0GUN6_HUMAN Voltage-dependent L-type calcium channel subunit alpha OS=Homo sapiens OX=9606 GN=CACNA1D PE=1 SV=1	1993	ALDQVNGSLPSL
ALDRVNGSKPSG	sp|P13699|NCAP_LASSJ	13	tr|Q59GD8|Q59GD8_HUMAN Calcium channel, voltage-dependent, L type, alpha 1D subunit variant (Fragment) OS=Homo sapiens OX=9606 GN=CACNA1D PE=1 SV=1	1701	ALDQVNGSLPSL
SLSNKQRSDKLG	sp|O09705|L_LASSJ	2000	sp|Q6KC79|NIPBL_HUMAN Nipped-B-like protein OS=Homo sapiens OX=9606 GN=NIPBL PE=1 SV=2	898	GDSNKSRSDKLG
SLSNKQRSDKLG	sp|O09705|L_LASSJ	2000	tr|A0A590UJS4|A0A590UJS4_HUMAN Nipped-B protein OS=Homo sapiens OX=9606 GN=NIPBL PE=1 SV=1	898	GDSNKSRSDKLG
ENKTVLLMEEIQ	sp|P13699|NCAP_LASSJ	76	sp|P11717|MPRI_HUMAN Cation-independent mannose-6-phosphate receptor OS=Homo sapiens OX=9606 GN=IGF2R PE=1 SV=3	2364	ENETEWLMEEIQ
KLEAPDILLDFE	sp|O09705|L_LASSJ	1194	tr|A0A0A0MRA3|A0A0A0MRA3_HUMAN Titin OS=Homo sapiens OX=9606 GN=TTN PE=1 SV=1	16631	KLEAPDIDLDLE
KLEAPDILLDFE	sp|O09705|L_LASSJ	1194	tr|A0A0A0MTS7|A0A0A0MTS7_HUMAN Titin OS=Homo sapiens OX=9606 GN=TTN PE=1 SV=1	25504	KLEAPDIDLDLE
KLEAPDILLDFE	sp|O09705|L_LASSJ	1194	sp|Q8WZ42|TITIN_HUMAN Titin OS=Homo sapiens OX=9606 GN=TTN PE=1 SV=4	23863	KLEAPDIDLDLE
ALPSVDLESKGL	sp|O09705|L_LASSJ	1856	tr|H0YB09|H0YB09_HUMAN D-glutamate cyclase, mitochondrial (Fragment) OS=Homo sapiens OX=9606 GN=DGLUCY PE=1 SV=1	551	ALPSVIKESKGR
TQECIVDLMKEL	sp|O09705|L_LASSJ	1113	sp|Q86YS3|RFIP4_HUMAN Rab11 family-interacting protein 4 OS=Homo sapiens OX=9606 GN=RAB11FIP4 PE=1 SV=1	496	TQELIEDLRKEL
TQECIVDLMKEL	sp|O09705|L_LASSJ	1113	tr|A0A024R6I7|A0A024R6I7_HUMAN Alpha-1-antitrypsin OS=Homo sapiens OX=9606 GN=SERPINA1 PE=1 SV=1	189	TQGKIVDLVKEL
TQECIVDLMKEL	sp|O09705|L_LASSJ	1113	tr|A0A0G2JRN3|A0A0G2JRN3_HUMAN Alpha-1-antitrypsin OS=Homo sapiens OX=9606 GN=SERPINA1 PE=1 SV=1	189	TQGKIVDLVKEL
TQECIVDLMKEL	sp|O09705|L_LASSJ	1113	sp|P01009|A1AT_HUMAN Alpha-1-antitrypsin OS=Homo sapiens OX=9606 GN=SERPINA1 PE=1 SV=3	189	TQGKIVDLVKEL
ITTHLLHSSPQI	sp|P08669|GLYC_LASSJ	110	sp|Q2M1Z3|RHG31_HUMAN Rho GTPase-activating protein 31 OS=Homo sapiens OX=9606 GN=ARHGAP31 PE=1 SV=2	1046	LGTHLGHSSPQI
VQLFLSLGVNSE	sp|O09705|L_LASSJ	809	sp|Q9UJX5|APC4_HUMAN Anaphase-promoting complex subunit 4 OS=Homo sapiens OX=9606 GN=ANAPC4 PE=1 SV=2	667	VQLPLSLVYNSE
SHGITSLHDINS	sp|P13699|NCAP_LASSJ	501	sp|Q8WXI7|MUC16_HUMAN Mucin-16 OS=Homo sapiens OX=9606 GN=MUC16 PE=1 SV=3	1948	STGITSGPDINS
PNEIDVLLSGSQ	sp|O09705|L_LASSJ	2183	tr|A0A499FJD3|A0A499FJD3_HUMAN GATOR complex protein WDR24 OS=Homo sapiens OX=9606 GN=WDR24 PE=1 SV=1	192	PTEAHVLLSGSQ
PNEIDVLLSGSQ	sp|O09705|L_LASSJ	2183	sp|Q96S15|WDR24_HUMAN GATOR complex protein WDR24 OS=Homo sapiens OX=9606 GN=WDR24 PE=1 SV=2	130	PTEAHVLLSGSQ
PNEIDVLLSGSQ	sp|O09705|L_LASSJ	2183	tr|A0A3B3ISA1|A0A3B3ISA1_HUMAN GATOR complex protein WDR24 OS=Homo sapiens OX=9606 GN=WDR24 PE=1 SV=1	130	PTEAHVLLSGSQ
IKLEAPDILLDF	sp|O09705|L_LASSJ	1193	tr|A0A0A0MRA3|A0A0A0MRA3_HUMAN Titin OS=Homo sapiens OX=9606 GN=TTN PE=1 SV=1	16630	EKLEAPDIDLDL
IKLEAPDILLDF	sp|O09705|L_LASSJ	1193	tr|A0A0A0MTS7|A0A0A0MTS7_HUMAN Titin OS=Homo sapiens OX=9606 GN=TTN PE=1 SV=1	25503	EKLEAPDIDLDL
IKLEAPDILLDF	sp|O09705|L_LASSJ	1193	sp|Q8WZ42|TITIN_HUMAN Titin OS=Homo sapiens OX=9606 GN=TTN PE=1 SV=4	23862	EKLEAPDIDLDL
LKDSSLCNERTG	sp|O09705|L_LASSJ	630	sp|O14646|CHD1_HUMAN Chromodomain-helicase-DNA-binding protein 1 OS=Homo sapiens OX=9606 GN=CHD1 PE=1 SV=2	1180	LKDSSSGTERTG
SDTMALSRFYRS	sp|O09705|L_LASSJ	205	sp|Q9UQ05|KCNH4_HUMAN Potassium voltage-gated channel subfamily H member 4 OS=Homo sapiens OX=9606 GN=KCNH4 PE=2 SV=1	692	SDTSGLSRFSRS
MVNYKILLQKKT	sp|P13699|NCAP_LASSJ	277	sp|Q96M94|KLH15_HUMAN Kelch-like protein 15 OS=Homo sapiens OX=9606 GN=KLHL15 PE=1 SV=2	293	MVNSKILLLKKP
SSAVKTELIRQD	sp|P13699|NCAP_LASSJ	393	sp|Q9BSD3|RHNO1_HUMAN RAD9, HUS1, RAD1-interacting nuclear orphan protein 1 OS=Homo sapiens OX=9606 GN=RHNO1 PE=1 SV=1	162	SSSVKEELIPQD
SLGGNRNLNIGM	sp|P08669|GLYC_LASSJ	395	sp|P04066|FUCO_HUMAN Tissue alpha-L-fucosidase OS=Homo sapiens OX=9606 GN=FUCA1 PE=1 SV=4	330	SLGGNYLLNIGP
LEAPDILLDFEY	sp|O09705|L_LASSJ	1195	tr|A0A0A0MRA3|A0A0A0MRA3_HUMAN Titin OS=Homo sapiens OX=9606 GN=TTN PE=1 SV=1	16632	LEAPDIDLDLEL
LEAPDILLDFEY	sp|O09705|L_LASSJ	1195	tr|A0A0A0MTS7|A0A0A0MTS7_HUMAN Titin OS=Homo sapiens OX=9606 GN=TTN PE=1 SV=1	25505	LEAPDIDLDLEL
LEAPDILLDFEY	sp|O09705|L_LASSJ	1195	sp|Q8WZ42|TITIN_HUMAN Titin OS=Homo sapiens OX=9606 GN=TTN PE=1 SV=4	23864	LEAPDIDLDLEL
LISTSARLLGSV	sp|P13699|NCAP_LASSJ	251	sp|A8MUP6|GS1L2_HUMAN Germ cell-specific gene 1-like protein 2 OS=Homo sapiens OX=9606 GN=GSG1L2 PE=3 SV=3	135	LILTSAILLGSR
QSLGGNRNLNIG	sp|P08669|GLYC_LASSJ	394	sp|P04066|FUCO_HUMAN Tissue alpha-L-fucosidase OS=Homo sapiens OX=9606 GN=FUCA1 PE=1 SV=4	329	VSLGGNYLLNIG
KTELIRQDVLRV	sp|P13699|NCAP_LASSJ	397	sp|Q8NGH7|O52L1_HUMAN Olfactory receptor 52L1 OS=Homo sapiens OX=9606 GN=OR52L1 PE=1 SV=4	313	KTQQIRQRVLRV
LSNKQRSDKLGV	sp|O09705|L_LASSJ	2001	sp|Q6KC79|NIPBL_HUMAN Nipped-B-like protein OS=Homo sapiens OX=9606 GN=NIPBL PE=1 SV=2	899	DSNKSRSDKLGF
LSNKQRSDKLGV	sp|O09705|L_LASSJ	2001	tr|A0A590UJS4|A0A590UJS4_HUMAN Nipped-B protein OS=Homo sapiens OX=9606 GN=NIPBL PE=1 SV=1	899	DSNKSRSDKLGF
LIKLEAPDILLD	sp|O09705|L_LASSJ	1192	tr|A0A0A0MRA3|A0A0A0MRA3_HUMAN Titin OS=Homo sapiens OX=9606 GN=TTN PE=1 SV=1	16629	EEKLEAPDIDLD
LIKLEAPDILLD	sp|O09705|L_LASSJ	1192	tr|A0A0A0MTS7|A0A0A0MTS7_HUMAN Titin OS=Homo sapiens OX=9606 GN=TTN PE=1 SV=1	25502	EEKLEAPDIDLD
LIKLEAPDILLD	sp|O09705|L_LASSJ	1192	sp|Q8WZ42|TITIN_HUMAN Titin OS=Homo sapiens OX=9606 GN=TTN PE=1 SV=4	23861	EEKLEAPDIDLD
LLISTSARLLGS	sp|P13699|NCAP_LASSJ	250	sp|A8MUP6|GS1L2_HUMAN Germ cell-specific gene 1-like protein 2 OS=Homo sapiens OX=9606 GN=GSG1L2 PE=3 SV=3	134	VLILTSAILLGS
GSQLLSFVYRSS	sp|O09705|L_LASSJ	2192	tr|A0A075B6H3|A0A075B6H3_HUMAN Transmembrane and coiled-coil domain-containing protein 4 OS=Homo sapiens OX=9606 GN=TMCO4 PE=1 SV=1	462	GDWLLSFVYRTS
GSQLLSFVYRSS	sp|O09705|L_LASSJ	2192	sp|Q5TGY1|TMCO4_HUMAN Transmembrane and coiled-coil domain-containing protein 4 OS=Homo sapiens OX=9606 GN=TMCO4 PE=1 SV=1	462	GDWLLSFVYRTS
TTHLLHSSPQIK	sp|P08669|GLYC_LASSJ	111	sp|Q2M1Z3|RHG31_HUMAN Rho GTPase-activating protein 31 OS=Homo sapiens OX=9606 GN=ARHGAP31 PE=1 SV=2	1047	GTHLGHSSPQIR
RVEGQMSKIMNK	sp|O09705|L_LASSJ	1248	sp|Q6UX71|PXDC2_HUMAN Plexin domain-containing protein 2 OS=Homo sapiens OX=9606 GN=PLXDC2 PE=1 SV=1	306	RVELQMSKITNI
SRSDSKKVTAKD	sp|P13699|NCAP_LASSJ	52	sp|Q8TF01|PNISR_HUMAN Arginine/serine-rich protein PNISR OS=Homo sapiens OX=9606 GN=PNISR PE=1 SV=2	736	SRQDSKKSTTKD
VKTELIRQDVLR	sp|P13699|NCAP_LASSJ	396	sp|Q8NGH7|O52L1_HUMAN Olfactory receptor 52L1 OS=Homo sapiens OX=9606 GN=OR52L1 PE=1 SV=4	312	VKTQQIRQRVLR
SNKQRSDKLGVV	sp|O09705|L_LASSJ	2002	sp|Q6KC79|NIPBL_HUMAN Nipped-B-like protein OS=Homo sapiens OX=9606 GN=NIPBL PE=1 SV=2	900	SNKSRSDKLGFK
SNKQRSDKLGVV	sp|O09705|L_LASSJ	2002	tr|A0A590UJS4|A0A590UJS4_HUMAN Nipped-B protein OS=Homo sapiens OX=9606 GN=NIPBL PE=1 SV=1	900	SNKSRSDKLGFK
AFQRSSYYISFL	sp|P08669|GLYC_LASSJ	364	sp|Q9Y5F7|PCDGL_HUMAN Protocadherin gamma-C4 OS=Homo sapiens OX=9606 GN=PCDHGC4 PE=2 SV=1	241	AFQQSSYRISVL
EMVNYKILLQKK	sp|P13699|NCAP_LASSJ	276	sp|Q96M94|KLH15_HUMAN Kelch-like protein 15 OS=Homo sapiens OX=9606 GN=KLHL15 PE=1 SV=2	292	SMVNSKILLLKK
AGFSSTLQEDRK	sp|O09705|L_LASSJ	736	sp|Q5T8I3|F102B_HUMAN Protein FAM102B OS=Homo sapiens OX=9606 GN=FAM102B PE=1 SV=2	162	AGESESLQEDRK
GSLVPRGLGWDR	sp|P13699|NCAP_LASSJ	149	sp|Q8IVL8|CBPO_HUMAN Carboxypeptidase O OS=Homo sapiens OX=9606 GN=CPO PE=1 SV=1	12	GMLVPGGLGYDR
SESGRLTRIDGI	sp|P13699|NCAP_LASSJ	35	sp|Q8WXI7|MUC16_HUMAN Mucin-16 OS=Homo sapiens OX=9606 GN=MUC16 PE=1 SV=3	10418	SLSTRLTRTDGI
IVQIIIDALGEP	sp|O09705|L_LASSJ	50	sp|Q9P2K2|TXD16_HUMAN Thioredoxin domain-containing protein 16 OS=Homo sapiens OX=9606 GN=TXNDC16 PE=1 SV=4	602	IVQIITDALLEM
LALPSVDLESKG	sp|O09705|L_LASSJ	1855	tr|H0YB09|H0YB09_HUMAN D-glutamate cyclase, mitochondrial (Fragment) OS=Homo sapiens OX=9606 GN=DGLUCY PE=1 SV=1	550	QALPSVIKESKG
RSSELEDLRKQA	sp|O09705|L_LASSJ	2201	tr|F6RU00|F6RU00_HUMAN Golgi SNAP receptor complex member 1 OS=Homo sapiens OX=9606 GN=GOSR1 PE=1 SV=1	5	TSSYWEDLRKQA
RSSELEDLRKQA	sp|O09705|L_LASSJ	2201	tr|K7EJC8|K7EJC8_HUMAN Golgi SNAP receptor complex member 1 OS=Homo sapiens OX=9606 GN=GOSR1 PE=1 SV=1	5	TSSYWEDLRKQA
RSSELEDLRKQA	sp|O09705|L_LASSJ	2201	sp|O95249|GOSR1_HUMAN Golgi SNAP receptor complex member 1 OS=Homo sapiens OX=9606 GN=GOSR1 PE=1 SV=1	5	TSSYWEDLRKQA
RSSELEDLRKQA	sp|O09705|L_LASSJ	2201	tr|B4DQA8|B4DQA8_HUMAN 28 kDa Golgi SNARE protein OS=Homo sapiens OX=9606 GN=GOSR1 PE=1 SV=1	5	TSSYWEDLRKQA
RSSELEDLRKQA	sp|O09705|L_LASSJ	2201	tr|E9PCW1|E9PCW1_HUMAN Golgi SNAP receptor complex member 1 OS=Homo sapiens OX=9606 GN=GOSR1 PE=1 SV=1	5	TSSYWEDLRKQA
