query	query_seqname	query_start	target_seqname	target_start	target
VNVNEEKLDLLK	tr|Q0GP72|Q0GP72_HSPV	24	sp|Q9NYQ8|FAT2_HUMAN Protocadherin Fat 2 OS=Homo sapiens OX=9606 GN=FAT2 PE=1 SV=2	3916	VVVNEEALDLLA
VNVNEEKLDLLK	tr|Q0GP72|Q0GP72_HSPV	24	tr|H0YBK2|H0YBK2_HUMAN Protocadherin Fat 2 (Fragment) OS=Homo sapiens OX=9606 GN=FAT2 PE=1 SV=1	689	VVVNEEALDLLA
PGYQINNKDKKL	tr|Q0GP70|Q0GP70_HSPV	538	tr|C9JB30|C9JB30_HUMAN Microtubule-associated protein RP/EB family member 3 (Fragment) OS=Homo sapiens OX=9606 GN=MAPRE3 PE=1 SV=1	141	PGDQIFNKSKKL
PGYQINNKDKKL	tr|Q0GP70|Q0GP70_HSPV	538	sp|Q9UPY8|MARE3_HUMAN Microtubule-associated protein RP/EB family member 3 OS=Homo sapiens OX=9606 GN=MAPRE3 PE=1 SV=1	141	PGDQIFNKSKKL
DLENLEKSAKLF	tr|Q0GNT1|Q0GNT1_HSPV	61	tr|E7ENI6|E7ENI6_HUMAN Islet cell autoantigen 1 OS=Homo sapiens OX=9606 GN=ICA1 PE=1 SV=1	275	PLENLEKSKVLF
DLENLEKSAKLF	tr|Q0GNT1|Q0GNT1_HSPV	61	sp|Q9UKI9|PO2F3_HUMAN POU domain, class 2, transcription factor 3 OS=Homo sapiens OX=9606 GN=POU2F3 PE=2 SV=3	187	DLEELEKFAKTF
SLFFCKGVVLTI	tr|Q0GP43|Q0GP43_HSPV	177	tr|H3BN15|H3BN15_HUMAN Tyrosine-protein kinase CSK (Fragment) OS=Homo sapiens OX=9606 GN=CSK PE=1 SV=8	27	DLPFCKGDVLTI
SLFFCKGVVLTI	tr|Q0GP43|Q0GP43_HSPV	177	tr|H3BUM9|H3BUM9_HUMAN Tyrosine-protein kinase CSK (Fragment) OS=Homo sapiens OX=9606 GN=CSK PE=1 SV=1	27	DLPFCKGDVLTI
SLFFCKGVVLTI	tr|Q0GP43|Q0GP43_HSPV	177	sp|P41240|CSK_HUMAN Tyrosine-protein kinase CSK OS=Homo sapiens OX=9606 GN=CSK PE=1 SV=1	27	DLPFCKGDVLTI
SNVLICKYINSQ	tr|Q0GNV9|Q0GNV9_HSPV	199	sp|Q9BVR0|HRC23_HUMAN Putative HERC2-like protein 3 OS=Homo sapiens OX=9606 GN=HERC2P3 PE=5 SV=2	872	WNGLINKYINSQ
SNVLICKYINSQ	tr|Q0GNV9|Q0GNV9_HSPV	199	sp|O95714|HERC2_HUMAN E3 ubiquitin-protein ligase HERC2 OS=Homo sapiens OX=9606 GN=HERC2 PE=1 SV=2	2159	WNGLINKYINSQ
KGTLASLYMGCL	tr|Q0GNP8|Q0GNP8_HSPV	353	sp|P01019|ANGT_HUMAN Angiotensinogen OS=Homo sapiens OX=9606 GN=AGT PE=1 SV=1	140	FGTLASLYLGAL
LSDTDILILDLE	tr|Q0GP75|Q0GP75_HSPV	87	tr|M0QXZ8|M0QXZ8_HUMAN Rho GTPase-activating protein SYDE1 OS=Homo sapiens OX=9606 GN=SYDE1 PE=1 SV=1	370	LKDFDALILDLE
LSDTDILILDLE	tr|Q0GP75|Q0GP75_HSPV	87	sp|Q6ZW31|SYDE1_HUMAN Rho GTPase-activating protein SYDE1 OS=Homo sapiens OX=9606 GN=SYDE1 PE=1 SV=1	713	LKDFDALILDLE
ATIKLTIEIFKS	tr|Q0GP10|Q0GP10_HSPV	25	tr|H0YK04|H0YK04_HUMAN Rho GTPase-activating protein 5 (Fragment) OS=Homo sapiens OX=9606 GN=ARHGAP5 PE=1 SV=1	128	AGIKLTKTIFKS
YYPKRKLSGALA	tr|Q0GNW7|Q0GNW7_HSPV	224	sp|Q86UK0|ABCAC_HUMAN ATP-binding cassette sub-family A member 12 OS=Homo sapiens OX=9606 GN=ABCA12 PE=1 SV=3	2392	YGTKRKLSTALA
EEIVDDIEFSLS	tr|Q0GNX8|Q0GNX8_HSPV	328	tr|E7ET15|E7ET15_HUMAN U2 snRNP-associated SURP motif-containing protein OS=Homo sapiens OX=9606 GN=U2SURP PE=1 SV=1	570	EEIVDCITESLS
EEIVDDIEFSLS	tr|Q0GNX8|Q0GNX8_HSPV	328	sp|O15042|SR140_HUMAN U2 snRNP-associated SURP motif-containing protein OS=Homo sapiens OX=9606 GN=U2SURP PE=1 SV=2	571	EEIVDCITESLS
TDLDEETKLIED	tr|Q0GP59|Q0GP59_HSPV	73	tr|C9J9C5|C9J9C5_HUMAN Interferon regulatory factor 1 (Fragment) OS=Homo sapiens OX=9606 GN=IRF1 PE=1 SV=1	184	TDEDEEGKLPED
TDLDEETKLIED	tr|Q0GP59|Q0GP59_HSPV	73	sp|P10914|IRF1_HUMAN Interferon regulatory factor 1 OS=Homo sapiens OX=9606 GN=IRF1 PE=1 SV=2	225	TDEDEEGKLPED
LKSKLICCNNVP	tr|Q0GNQ9|Q0GNQ9_HSPV	50	tr|A6ZJ87|A6ZJ87_HUMAN G-protein coupled receptor 24 OS=Homo sapiens OX=9606 GN=MCHR1 PE=4 SV=1	136	KKSKLHWCNNVP
LKSKLICCNNVP	tr|Q0GNQ9|Q0GNQ9_HSPV	50	sp|Q99705|MCHR1_HUMAN Melanin-concentrating hormone receptor 1 OS=Homo sapiens OX=9606 GN=MCHR1 PE=1 SV=2	136	KKSKLHWCNNVP
FVDKVTKKDVSS	tr|Q0GNR4|Q0GNR4_HSPV	177	sp|P15924|DESP_HUMAN Desmoplakin OS=Homo sapiens OX=9606 GN=DSP PE=1 SV=3	2172	FVDPVTKKKVSY
STKKRGITIVVK	tr|Q0GP17|Q0GP17_HSPV	146	tr|I3L4V1|I3L4V1_HUMAN RNA N6-adenosine-methyltransferase METTL16 (Fragment) OS=Homo sapiens OX=9606 GN=METTL16 PE=1 SV=2	101	STLRRGIDIVVK
GPPRIKPPTEPS	tr|Q0GNY2|Q0GNY2_HSPV	269	sp|Q9P2R6|RERE_HUMAN Arginine-glutamic acid dipeptide repeats protein OS=Homo sapiens OX=9606 GN=RERE PE=1 SV=2	1043	GPPPITPPTCPS
GPPRIKPPTEPS	tr|Q0GNY2|Q0GNY2_HSPV	269	tr|B1AKN3|B1AKN3_HUMAN Arginine-glutamic acid dipeptide (RE) repeats, isoform CRA_b OS=Homo sapiens OX=9606 GN=RERE PE=1 SV=1	775	GPPPITPPTCPS
LFLRQILYGFTQ	tr|Q0GP23|Q0GP23_HSPV	40	sp|Q6ZS81|WDFY4_HUMAN WD repeat- and FYVE domain-containing protein 4 OS=Homo sapiens OX=9606 GN=WDFY4 PE=1 SV=3	2972	LRLRQALYGHTQ
GDKLSRRKVNLL	tr|Q0GNR0|Q0GNR0_HSPV	63	tr|F2Z2U4|F2Z2U4_HUMAN Transformation/transcription domain-associated protein OS=Homo sapiens OX=9606 GN=TRRAP PE=1 SV=3	2100	GEVLSRRCVNLL
GDKLSRRKVNLL	tr|Q0GNR0|Q0GNR0_HSPV	63	tr|H0Y4W2|H0Y4W2_HUMAN Transformation/transcription domain-associated protein OS=Homo sapiens OX=9606 GN=TRRAP PE=1 SV=2	2126	GEVLSRRCVNLL
GDKLSRRKVNLL	tr|Q0GNR0|Q0GNR0_HSPV	63	sp|Q9Y4A5|TRRAP_HUMAN Transformation/transcription domain-associated protein OS=Homo sapiens OX=9606 GN=TRRAP PE=1 SV=3	2119	GEVLSRRCVNLL
RVNIDTVSDFLK	tr|Q0GNV8|Q0GNV8_HSPV	642	sp|Q8NGR9|OR1N2_HUMAN Olfactory receptor 1N2 OS=Homo sapiens OX=9606 GN=OR1N2 PE=2 SV=2	20	RVNQTTVSDFLL
RVNIDTVSDFLK	tr|Q0GNV8|Q0GNV8_HSPV	642	tr|A0A126GW94|A0A126GW94_HUMAN Olfactory receptor OS=Homo sapiens OX=9606 GN=OR1N2 PE=3 SV=1	6	RVNQTTVSDFLL
VLPAHFNSTMVY	tr|Q0GNW6|Q0GNW6_HSPV	251	sp|Q8WWZ7|ABCA5_HUMAN ATP-binding cassette sub-family A member 5 OS=Homo sapiens OX=9606 GN=ABCA5 PE=2 SV=2	967	VFAAVFNSTMVY
VIVKLGLNSSLA	tr|Q0GP06|Q0GP06_HSPV	263	tr|A0A1B0GUM5|A0A1B0GUM5_HUMAN Two pore calcium channel protein 2 OS=Homo sapiens OX=9606 GN=TPCN2 PE=1 SV=1	604	VIVALPGNSSLA
VIVKLGLNSSLA	tr|Q0GP06|Q0GP06_HSPV	263	tr|A0A1B0GVQ7|A0A1B0GVQ7_HUMAN Ion_trans domain-containing protein (Fragment) OS=Homo sapiens OX=9606 PE=4 SV=1	223	VIVALPGNSSLA
VIVKLGLNSSLA	tr|Q0GP06|Q0GP06_HSPV	263	sp|Q8NHX9|TPC2_HUMAN Two pore calcium channel protein 2 OS=Homo sapiens OX=9606 GN=TPCN2 PE=1 SV=2	604	VIVALPGNSSLA
KDVAAGSSSSSS	tr|Q0GP37|Q0GP37_HSPV	241	sp|Q9Y4C8|RBM19_HUMAN Probable RNA-binding protein 19 OS=Homo sapiens OX=9606 GN=RBM19 PE=1 SV=3	214	KMVKAGSSSSSE
KDVAAGSSSSSS	tr|Q0GP37|Q0GP37_HSPV	241	tr|H0Y7K5|H0Y7K5_HUMAN Wilms tumor protein OS=Homo sapiens OX=9606 GN=WT1 PE=1 SV=2	321	KGVAAGSSSSVK
KDVAAGSSSSSS	tr|Q0GP37|Q0GP37_HSPV	241	sp|P19544|WT1_HUMAN Wilms tumor protein OS=Homo sapiens OX=9606 GN=WT1 PE=1 SV=2	248	KGVAAGSSSSVK
KDVAAGSSSSSS	tr|Q0GP37|Q0GP37_HSPV	241	tr|A0A0A0MT54|A0A0A0MT54_HUMAN Wilms tumor protein OS=Homo sapiens OX=9606 GN=WT1 PE=1 SV=2	321	KGVAAGSSSSVK
KDVAAGSSSSSS	tr|Q0GP37|Q0GP37_HSPV	241	tr|H0YED9|H0YED9_HUMAN Wilms tumor protein (Fragment) OS=Homo sapiens OX=9606 GN=WT1 PE=1 SV=1	7	KGVAAGSSSSVK
GDAPVSITEIKH	tr|Q0GNW8|Q0GNW8_HSPV	250	tr|E7EPB6|E7EPB6_HUMAN Cystic fibrosis transmembrane conductance regulator (Fragment) OS=Homo sapiens OX=9606 GN=CFTR PE=1 SV=1	643	GDAPVSWTETKK
GDAPVSITEIKH	tr|Q0GNW8|Q0GNW8_HSPV	250	sp|P13569|CFTR_HUMAN Cystic fibrosis transmembrane conductance regulator OS=Homo sapiens OX=9606 GN=CFTR PE=1 SV=3	673	GDAPVSWTETKK
GDAPVSITEIKH	tr|Q0GNW8|Q0GNW8_HSPV	250	tr|A0A3B3ITW5|A0A3B3ITW5_HUMAN Cystic fibrosis transmembrane conductance regulator OS=Homo sapiens OX=9606 GN=CFTR PE=1 SV=1	612	GDAPVSWTETKK
SQLPCKPKTRSP	tr|Q0GP92|Q0GP92_HSPV	81	sp|Q92793|CBP_HUMAN CREB-binding protein OS=Homo sapiens OX=9606 GN=CREBBP PE=1 SV=3	841	SQLPCPPVTQSP
SQLPCKPKTRSP	tr|Q0GP92|Q0GP92_HSPV	81	tr|I3L466|I3L466_HUMAN Histone acetyltransferase (Fragment) OS=Homo sapiens OX=9606 GN=CREBBP PE=1 SV=2	376	SQLPCPPVTQSP
TARLQMPSLKTV	tr|Q0GNN3|Q0GNN3_HSPV	280	sp|A0A0B4J1V6|HV373_HUMAN Immunoglobulin heavy variable 3-73 OS=Homo sapiens OX=9606 GN=IGHV3-73 PE=3 SV=1	99	TAYLQMNSLKTE
NAREEVDLTRDE	tr|Q0GNQ7|Q0GNQ7_HSPV	148	sp|Q6ZNA4|RN111_HUMAN E3 ubiquitin-protein ligase Arkadia OS=Homo sapiens OX=9606 GN=RNF111 PE=1 SV=3	378	NAAEVVDLTVDE
NAREEVDLTRDE	tr|Q0GNQ7|Q0GNQ7_HSPV	148	tr|H0YLK9|H0YLK9_HUMAN E3 ubiquitin-protein ligase Arkadia (Fragment) OS=Homo sapiens OX=9606 GN=RNF111 PE=1 SV=1	111	NAAEVVDLTVDE
LKGIKDDDADPP	tr|Q0GNQ8|Q0GNQ8_HSPV	59	tr|E9PGE5|E9PGE5_HUMAN TBC1 domain family member 23 OS=Homo sapiens OX=9606 GN=TBC1D23 PE=1 SV=1	165	LLGIKDDDADLS
LKGIKDDDADPP	tr|Q0GNQ8|Q0GNQ8_HSPV	59	sp|Q9NUY8|TBC23_HUMAN TBC1 domain family member 23 OS=Homo sapiens OX=9606 GN=TBC1D23 PE=1 SV=3	302	LLGIKDDDADLS
IRHPEMLTFPIS	tr|Q0GNV8|Q0GNV8_HSPV	10	tr|A0A3B3IRL2|A0A3B3IRL2_HUMAN Cellular repressor of E1A-stimulated genes 1, isoform CRA_a OS=Homo sapiens OX=9606 GN=CREG1 PE=1 SV=1	173	IRHPEMKTWPSS
IRHPEMLTFPIS	tr|Q0GNV8|Q0GNV8_HSPV	10	sp|O75629|CREG1_HUMAN Protein CREG1 OS=Homo sapiens OX=9606 GN=CREG1 PE=1 SV=1	173	IRHPEMKTWPSS
STKHQIDVGSPA	tr|Q0GNW6|Q0GNW6_HSPV	218	sp|Q9BZV2|S19A3_HUMAN Thiamine transporter 2 OS=Homo sapiens OX=9606 GN=SLC19A3 PE=1 SV=1	463	STKSQKDVQSPA
STKHQIDVGSPA	tr|Q0GNW6|Q0GNW6_HSPV	218	tr|A0A2R8YHG5|A0A2R8YHG5_HUMAN Thiamine transporter 2 OS=Homo sapiens OX=9606 GN=SLC19A3 PE=1 SV=1	475	STKSQKDVQSPA
GDLLAKDIPISY	tr|Q0GP49|Q0GP49_HSPV	177	sp|Q8NH73|OR4S2_HUMAN Olfactory receptor 4S2 OS=Homo sapiens OX=9606 GN=OR4S2 PE=3 SV=2	81	VDLLAKDKTISY
VNNNGPQHGKYF	tr|Q0GNW2|Q0GNW2_HSPV	52	sp|A8K979|ERI2_HUMAN ERI1 exoribonuclease 2 OS=Homo sapiens OX=9606 GN=ERI2 PE=2 SV=2	608	VSNNGPNHGKVF
VQRYTLLAITKE	tr|Q0GP27|Q0GP27_HSPV	11	sp|Q9UBC0|HNF6_HUMAN Hepatocyte nuclear factor 6 OS=Homo sapiens OX=9606 GN=ONECUT1 PE=2 SV=1	395	VQRRTLHAIFKE
LVEVVTASRLIE	tr|Q0GNN6|Q0GNN6_HSPV	147	tr|H0YMF1|H0YMF1_HUMAN Aggrecan core protein OS=Homo sapiens OX=9606 GN=ACAN PE=1 SV=2	1666	LVEVVTASTASE
LVEVVTASRLIE	tr|Q0GNN6|Q0GNN6_HSPV	147	sp|P16112|PGCA_HUMAN Aggrecan core protein OS=Homo sapiens OX=9606 GN=ACAN PE=1 SV=3	1666	LVEVVTASTASE
LVEVVTASRLIE	tr|Q0GNN6|Q0GNN6_HSPV	147	tr|A0A5K1VW97|A0A5K1VW97_HUMAN Aggrecan core protein (Fragment) OS=Homo sapiens OX=9606 GN=ACAN PE=1 SV=1	1190	LVEVVTASTASE
LVEVVTASRLIE	tr|Q0GNN6|Q0GNN6_HSPV	147	tr|A0A087X1T7|A0A087X1T7_HUMAN Aggrecan core protein OS=Homo sapiens OX=9606 GN=ACAN PE=1 SV=1	1647	LVEVVTASTASE
LVEVVTASRLIE	tr|Q0GNN6|Q0GNN6_HSPV	147	sp|O43680|TCF21_HUMAN Transcription factor 21 OS=Homo sapiens OX=9606 GN=TCF21 PE=1 SV=2	164	LKEVVTASRLCG
RSSQSEHLNSVQ	tr|Q0GNW8|Q0GNW8_HSPV	352	tr|H0YJ14|H0YJ14_HUMAN Fanconi anemia group M protein (Fragment) OS=Homo sapiens OX=9606 GN=FANCM PE=1 SV=1	833	RRSQSEMLNSVN
RSSQSEHLNSVQ	tr|Q0GNW8|Q0GNW8_HSPV	352	tr|H0YJS3|H0YJS3_HUMAN Fanconi anemia group M protein (Fragment) OS=Homo sapiens OX=9606 GN=FANCM PE=1 SV=1	1381	RRSQSEMLNSVN
RSSQSEHLNSVQ	tr|Q0GNW8|Q0GNW8_HSPV	352	sp|Q8IYD8|FANCM_HUMAN Fanconi anemia group M protein OS=Homo sapiens OX=9606 GN=FANCM PE=1 SV=2	1865	RRSQSEMLNSVN
RSSQSEHLNSVQ	tr|Q0GNW8|Q0GNW8_HSPV	352	tr|H0YJN7|H0YJN7_HUMAN Fanconi anemia group M protein (Fragment) OS=Homo sapiens OX=9606 GN=FANCM PE=1 SV=1	85	RRSQSEMLNSVN
VLRSSQSEHLNS	tr|Q0GNW8|Q0GNW8_HSPV	350	tr|H0YJ14|H0YJ14_HUMAN Fanconi anemia group M protein (Fragment) OS=Homo sapiens OX=9606 GN=FANCM PE=1 SV=1	831	VERRSQSEMLNS
VLRSSQSEHLNS	tr|Q0GNW8|Q0GNW8_HSPV	350	tr|H0YJS3|H0YJS3_HUMAN Fanconi anemia group M protein (Fragment) OS=Homo sapiens OX=9606 GN=FANCM PE=1 SV=1	1379	VERRSQSEMLNS
VLRSSQSEHLNS	tr|Q0GNW8|Q0GNW8_HSPV	350	sp|Q8IYD8|FANCM_HUMAN Fanconi anemia group M protein OS=Homo sapiens OX=9606 GN=FANCM PE=1 SV=2	1863	VERRSQSEMLNS
VLRSSQSEHLNS	tr|Q0GNW8|Q0GNW8_HSPV	350	tr|H0YJN7|H0YJN7_HUMAN Fanconi anemia group M protein (Fragment) OS=Homo sapiens OX=9606 GN=FANCM PE=1 SV=1	83	VERRSQSEMLNS
EARDLALELSKR	tr|Q0GNZ8|Q0GNZ8_HSPV	57	tr|A0A1W2PQ72|A0A1W2PQ72_HUMAN Heat shock 70 kDa protein 14 OS=Homo sapiens OX=9606 GN=HSPA14 PE=1 SV=1	286	ENRRLARELSKR
LHEKQPPEVRNS	tr|Q0GNT6|Q0GNT6_HSPV	259	sp|Q96P70|IPO9_HUMAN Importin-9 OS=Homo sapiens OX=9606 GN=IPO9 PE=1 SV=3	525	LHETQPPSVRIS
ASVTISIKNKTA	tr|Q0GP29|Q0GP29_HSPV	617	sp|Q0IIM8|TBC8B_HUMAN TBC1 domain family member 8B OS=Homo sapiens OX=9606 GN=TBC1D8B PE=1 SV=2	357	KSVIISIKGKTA
ASVTISIKNKTA	tr|Q0GP29|Q0GP29_HSPV	617	tr|J3KN75|J3KN75_HUMAN TBC1 domain family member 8B OS=Homo sapiens OX=9606 GN=TBC1D8B PE=1 SV=1	357	KSVIISIKGKTA
ASVTISIKNKTA	tr|Q0GP29|Q0GP29_HSPV	617	tr|D6RFZ2|D6RFZ2_HUMAN TBC1 domain family member 8B OS=Homo sapiens OX=9606 GN=TBC1D8B PE=1 SV=1	357	KSVIISIKGKTA
KQKLVLQIKTKG	tr|Q0GNR0|Q0GNR0_HSPV	403	sp|O95071|UBR5_HUMAN E3 ubiquitin-protein ligase UBR5 OS=Homo sapiens OX=9606 GN=UBR5 PE=1 SV=2	2784	KQKLLLAIKTKN
KQKLVLQIKTKG	tr|Q0GNR0|Q0GNR0_HSPV	403	tr|E7EMW7|E7EMW7_HUMAN E3 ubiquitin-protein ligase UBR5 OS=Homo sapiens OX=9606 GN=UBR5 PE=1 SV=1	2777	KQKLLLAIKTKN
KQKLVLQIKTKG	tr|Q0GNR0|Q0GNR0_HSPV	403	tr|E7ET84|E7ET84_HUMAN E3 ubiquitin-protein ligase UBR5 OS=Homo sapiens OX=9606 GN=UBR5 PE=1 SV=1	512	KQKLLLAIKTKN
DTLDSGTGIVSK	tr|Q0GNM8|Q0GNM8_HSPV	292	tr|C9JXX7|C9JXX7_HUMAN Integrin alpha-6 (Fragment) OS=Homo sapiens OX=9606 GN=ITGA6 PE=1 SV=1	146	FSLDSGKGIVSK
DTLDSGTGIVSK	tr|Q0GNM8|Q0GNM8_HSPV	292	sp|P23229|ITA6_HUMAN Integrin alpha-6 OS=Homo sapiens OX=9606 GN=ITGA6 PE=1 SV=5	299	FSLDSGKGIVSK
KELKERFRELLF	tr|Q0GNY9|Q0GNY9_HSPV	57	sp|Q9Y4W2|LAS1L_HUMAN Ribosomal biogenesis protein LAS1L OS=Homo sapiens OX=9606 GN=LAS1L PE=1 SV=2	263	KELYERARELLV
DTIVNTSTLQPS	tr|Q0GNW6|Q0GNW6_HSPV	125	sp|A3KMH1|VWA8_HUMAN von Willebrand factor A domain-containing protein 8 OS=Homo sapiens OX=9606 GN=VWA8 PE=1 SV=2	810	DTTVQTLTLQPS
KGTIRAMLIEEM	tr|Q0GNY3|Q0GNY3_HSPV	277	sp|Q6ZT07|TBCD9_HUMAN TBC1 domain family member 9 OS=Homo sapiens OX=9606 GN=TBC1D9 PE=2 SV=2	781	FGTIRADLIEQM
RLARSTFRLIIT	tr|Q0GP19|Q0GP19_HSPV	594	sp|Q7Z2G1|H2BWT_HUMAN Histone H2B type W-T OS=Homo sapiens OX=9606 GN=H2BW1 PE=1 SV=2	123	RLARSTKRQTIT
VLNNWYNGIDLN	tr|Q0GNX1|Q0GNX1_HSPV	242	sp|Q13029|PRDM2_HUMAN PR domain zinc finger protein 2 OS=Homo sapiens OX=9606 GN=PRDM2 PE=1 SV=3	891	VLLNEYNGIDLP
LDSLNDIMRSVP	tr|Q0GNR7|Q0GNR7_HSPV	165	sp|A6NCI4|VWA3A_HUMAN von Willebrand factor A domain-containing protein 3A OS=Homo sapiens OX=9606 GN=VWA3A PE=2 SV=3	262	LDSLVAIMRSCP
LDSLNDIMRSVP	tr|Q0GNR7|Q0GNR7_HSPV	165	tr|H3BUS3|H3BUS3_HUMAN von Willebrand factor A domain-containing protein 3A (Fragment) OS=Homo sapiens OX=9606 GN=VWA3A PE=1 SV=8	262	LDSLVAIMRSCP
KDLQKVSVVSKL	tr|Q0GP06|Q0GP06_HSPV	294	sp|Q9NQZ2|SAS10_HUMAN Something about silencing protein 10 OS=Homo sapiens OX=9606 GN=UTP3 PE=1 SV=1	205	KDLAKVSVKEKL
EMEENNLQLINC	tr|Q0GP38|Q0GP38_HSPV	130	sp|A1A5B4|ANO9_HUMAN Anoctamin-9 OS=Homo sapiens OX=9606 GN=ANO9 PE=1 SV=3	304	EQEEMALQLINC
LAVKKVLTVFSL	tr|Q0GNY2|Q0GNY2_HSPV	420	sp|Q8TDV5|GP119_HUMAN Glucose-dependent insulinotropic receptor OS=Homo sapiens OX=9606 GN=GPR119 PE=1 SV=1	295	LGVKKVLTSFLL
LSLVLNNLSIYD	tr|Q0GNY9|Q0GNY9_HSPV	233	sp|Q6WRI0|IGS10_HUMAN Immunoglobulin superfamily member 10 OS=Homo sapiens OX=9606 GN=IGSF10 PE=1 SV=1	1803	GTLVLHNLSIYD
TNNTIDKSLSGS	tr|Q0GNZ3|Q0GNZ3_HSPV	29	tr|A0A0C4DGG5|A0A0C4DGG5_HUMAN Rho GTPase-activating protein 20 OS=Homo sapiens OX=9606 GN=ARHGAP20 PE=1 SV=1	317	TQNTKKKSLSGS
TNNTIDKSLSGS	tr|Q0GNZ3|Q0GNZ3_HSPV	29	sp|Q9P2F6|RHG20_HUMAN Rho GTPase-activating protein 20 OS=Homo sapiens OX=9606 GN=ARHGAP20 PE=1 SV=2	774	TQNTKKKSLSGS
GTIRAMLIEEMM	tr|Q0GNY3|Q0GNY3_HSPV	278	sp|Q6ZT07|TBCD9_HUMAN TBC1 domain family member 9 OS=Homo sapiens OX=9606 GN=TBC1D9 PE=2 SV=2	782	GTIRADLIEQMR
RPLALPIKGQVE	tr|Q0GNX4|Q0GNX4_HSPV	656	tr|U3KQV5|U3KQV5_HUMAN Granzyme M OS=Homo sapiens OX=9606 GN=GZMM PE=1 SV=2	89	RPLALPSKRQVV
RPLALPIKGQVE	tr|Q0GNX4|Q0GNX4_HSPV	656	sp|P51124|GRAM_HUMAN Granzyme M OS=Homo sapiens OX=9606 GN=GZMM PE=1 SV=2	128	RPLALPSKRQVV
LDTAYPLSPVAQ	tr|Q0GNY6|Q0GNY6_HSPV	1259	sp|Q2VPB7|AP5B1_HUMAN AP-5 complex subunit beta-1 OS=Homo sapiens OX=9606 GN=AP5B1 PE=1 SV=4	275	LDTSYLLTPVAQ
AAGSSSSSSTTF	tr|Q0GP37|Q0GP37_HSPV	244	sp|Q6VY07|PACS1_HUMAN Phosphofurin acidic cluster sorting protein 1 OS=Homo sapiens OX=9606 GN=PACS1 PE=1 SV=2	63	AAASSSSSSTST
PKNKAFSSVYHT	tr|Q0GNX3|Q0GNX3_HSPV	623	tr|A0A0A0MRM2|A0A0A0MRM2_HUMAN Nebulin-related-anchoring protein OS=Homo sapiens OX=9606 GN=NRAP PE=1 SV=1	59	PKNNTFTSVYHT
PKNKAFSSVYHT	tr|Q0GNX3|Q0GNX3_HSPV	623	sp|Q86VF7|NRAP_HUMAN Nebulin-related-anchoring protein OS=Homo sapiens OX=9606 GN=NRAP PE=1 SV=2	59	PKNNTFTSVYHT
LTINILTDITNL	tr|Q0GP43|Q0GP43_HSPV	186	tr|Q5JTQ6|Q5JTQ6_HUMAN Alpha-catulin OS=Homo sapiens OX=9606 GN=CTNNAL1 PE=1 SV=1	112	ETIAALTDITNL
LTINILTDITNL	tr|Q0GP43|Q0GP43_HSPV	186	sp|Q9UBT7|CTNL1_HUMAN Alpha-catulin OS=Homo sapiens OX=9606 GN=CTNNAL1 PE=1 SV=2	112	ETIAALTDITNL
SLNSRRESGFTE	tr|Q0GNM8|Q0GNM8_HSPV	1644	tr|J3QRH7|J3QRH7_HUMAN Probable E3 ubiquitin-protein ligase MARCHF10 (Fragment) OS=Homo sapiens OX=9606 GN=MARCHF10 PE=4 SV=2	149	SLNSRRESDDTE
SLNSRRESGFTE	tr|Q0GNM8|Q0GNM8_HSPV	1644	tr|J3KTN9|J3KTN9_HUMAN Probable E3 ubiquitin-protein ligase MARCHF10 OS=Homo sapiens OX=9606 GN=MARCHF10 PE=1 SV=1	319	SLNSRRESDDTE
SLNSRRESGFTE	tr|Q0GNM8|Q0GNM8_HSPV	1644	sp|Q8NA82|MARHA_HUMAN Probable E3 ubiquitin-protein ligase MARCHF10 OS=Homo sapiens OX=9606 GN=MARCHF10 PE=1 SV=3	281	SLNSRRESDDTE
SLNSRRESGFTE	tr|Q0GNM8|Q0GNM8_HSPV	1644	tr|G3V1Q5|G3V1Q5_HUMAN Probable E3 ubiquitin-protein ligase MARCHF10 OS=Homo sapiens OX=9606 GN=MARCHF10 PE=1 SV=1	280	SLNSRRESDDTE
ILDSILSDPSDI	tr|Q0GNS4|Q0GNS4_HSPV	171	sp|Q9NUD5|ZCHC3_HUMAN Zinc finger CCHC domain-containing protein 3 OS=Homo sapiens OX=9606 GN=ZCCHC3 PE=1 SV=2	189	ILRSIGMDPSDI
LETVELVLRLDG	tr|Q0GNT6|Q0GNT6_HSPV	131	sp|Q08379|GOGA2_HUMAN Golgin subfamily A member 2 OS=Homo sapiens OX=9606 GN=GOLGA2 PE=1 SV=3	883	LELQELVLRLVG
LETVELVLRLDG	tr|Q0GNT6|Q0GNT6_HSPV	131	tr|A0A6Q8KRG2|A0A6Q8KRG2_HUMAN Golgin subfamily A member 2 OS=Homo sapiens OX=9606 GN=GOLGA2 PE=1 SV=1	871	LELQELVLRLVG
LETVELVLRLDG	tr|Q0GNT6|Q0GNT6_HSPV	131	tr|A0A087WYC0|A0A087WYC0_HUMAN Golgin subfamily A member 2 OS=Homo sapiens OX=9606 GN=GOLGA2 PE=1 SV=1	167	LELQELVLRLVG
AIRTLAMPAKGN	tr|Q0GNU0|Q0GNU0_HSPV	798	sp|Q14573|ITPR3_HUMAN Inositol 1,4,5-trisphosphate receptor type 3 OS=Homo sapiens OX=9606 GN=ITPR3 PE=1 SV=2	1525	CIRTLAMVAKGR
IRTLAMPAKGNL	tr|Q0GNU0|Q0GNU0_HSPV	799	sp|Q14573|ITPR3_HUMAN Inositol 1,4,5-trisphosphate receptor type 3 OS=Homo sapiens OX=9606 GN=ITPR3 PE=1 SV=2	1526	IRTLAMVAKGRA
EHTMIDAMATSF	tr|Q0GP94|Q0GP94_HSPV	81	tr|B4DUK8|B4DUK8_HUMAN 5'-AMP-activated protein kinase subunit gamma-3 OS=Homo sapiens OX=9606 GN=PRKAG3 PE=1 SV=1	190	EHTCYDAMATSS
EHTMIDAMATSF	tr|Q0GP94|Q0GP94_HSPV	81	sp|Q9UGI9|AAKG3_HUMAN 5'-AMP-activated protein kinase subunit gamma-3 OS=Homo sapiens OX=9606 GN=PRKAG3 PE=1 SV=3	190	EHTCYDAMATSS
DCLSLYSRGACP	tr|Q0GP62|Q0GP62_HSPV	183	tr|A0A2R8YDS7|A0A2R8YDS7_HUMAN B-cell lymphoma/leukemia 11A (Fragment) OS=Homo sapiens OX=9606 GN=BCL11A PE=1 SV=1	53	DCLSTSSRGICP
DCLSLYSRGACP	tr|Q0GP62|Q0GP62_HSPV	183	tr|A0A2R8YGT9|A0A2R8YGT9_HUMAN B-cell lymphoma/leukemia 11A (Fragment) OS=Homo sapiens OX=9606 GN=BCL11A PE=1 SV=1	79	DCLSTSSRGICP
DCLSLYSRGACP	tr|Q0GP62|Q0GP62_HSPV	183	tr|A0A2R8YDW6|A0A2R8YDW6_HUMAN B-cell lymphoma/leukemia 11A (Fragment) OS=Homo sapiens OX=9606 GN=BCL11A PE=1 SV=1	106	DCLSTSSRGICP
DCLSLYSRGACP	tr|Q0GP62|Q0GP62_HSPV	183	sp|Q9H165|BC11A_HUMAN B-cell lymphoma/leukemia 11A OS=Homo sapiens OX=9606 GN=BCL11A PE=1 SV=2	111	DCLSTSSRGICP
DCLSLYSRGACP	tr|Q0GP62|Q0GP62_HSPV	183	tr|A0A0J9YXG2|A0A0J9YXG2_HUMAN B-cell lymphoma/leukemia 11A OS=Homo sapiens OX=9606 GN=BCL11A PE=1 SV=2	109	DCLSTSSRGICP
DCLSLYSRGACP	tr|Q0GP62|Q0GP62_HSPV	183	tr|A0A2R8YHH4|A0A2R8YHH4_HUMAN B-cell lymphoma/leukemia 11A OS=Homo sapiens OX=9606 GN=BCL11A PE=1 SV=1	111	DCLSTSSRGICP
DCLSLYSRGACP	tr|Q0GP62|Q0GP62_HSPV	183	tr|A0A2R8YCR5|A0A2R8YCR5_HUMAN B-cell lymphoma/leukemia 11A (Fragment) OS=Homo sapiens OX=9606 GN=BCL11A PE=1 SV=1	87	DCLSTSSRGICP
DCLSLYSRGACP	tr|Q0GP62|Q0GP62_HSPV	183	tr|A0A2R8YEK1|A0A2R8YEK1_HUMAN B-cell CLL/lymphoma 11A (Zinc finger protein), isoform CRA_d OS=Homo sapiens OX=9606 GN=BCL11A PE=1 SV=1	111	DCLSTSSRGICP
DCLSLYSRGACP	tr|Q0GP62|Q0GP62_HSPV	183	tr|A0A2U3TZJ5|A0A2U3TZJ5_HUMAN B-cell lymphoma/leukemia 11A OS=Homo sapiens OX=9606 GN=BCL11A PE=1 SV=1	111	DCLSTSSRGICP
DCLSLYSRGACP	tr|Q0GP62|Q0GP62_HSPV	183	tr|A0A2R8Y7B0|A0A2R8Y7B0_HUMAN B-cell lymphoma/leukemia 11A (Fragment) OS=Homo sapiens OX=9606 GN=BCL11A PE=1 SV=1	106	DCLSTSSRGICP
DCLSLYSRGACP	tr|Q0GP62|Q0GP62_HSPV	183	tr|A0A2R8Y2E8|A0A2R8Y2E8_HUMAN B-cell lymphoma/leukemia 11A OS=Homo sapiens OX=9606 GN=BCL11A PE=1 SV=1	111	DCLSTSSRGICP
DCLSLYSRGACP	tr|Q0GP62|Q0GP62_HSPV	183	tr|A0A0J9YYJ9|A0A0J9YYJ9_HUMAN B-cell lymphoma/leukemia 11A OS=Homo sapiens OX=9606 GN=BCL11A PE=1 SV=1	111	DCLSTSSRGICP
DCLSLYSRGACP	tr|Q0GP62|Q0GP62_HSPV	183	tr|A0A2R8Y7W4|A0A2R8Y7W4_HUMAN B-cell lymphoma/leukemia 11A (Fragment) OS=Homo sapiens OX=9606 GN=BCL11A PE=1 SV=1	60	DCLSTSSRGICP
ETYREERCGKQF	tr|Q0GP22|Q0GP22_HSPV	411	sp|Q9GZV8|PRD14_HUMAN PR domain zinc finger protein 14 OS=Homo sapiens OX=9606 GN=PRDM14 PE=1 SV=1	398	EGYRCERCGKVF
KDLLTLNMTKVV	tr|Q0GNN5|Q0GNN5_HSPV	83	tr|C9JLY8|C9JLY8_HUMAN Cytospin-A (Fragment) OS=Homo sapiens OX=9606 GN=SPECC1L PE=3 SV=1	125	KDLLTLAKTKDV
KDLLTLNMTKVV	tr|Q0GNN5|Q0GNN5_HSPV	83	sp|Q69YQ0|CYTSA_HUMAN Cytospin-A OS=Homo sapiens OX=9606 GN=SPECC1L PE=1 SV=2	186	KDLLTLAKTKDV
KDLLTLNMTKVV	tr|Q0GNN5|Q0GNN5_HSPV	83	tr|C9J8U1|C9J8U1_HUMAN Cytospin-A (Fragment) OS=Homo sapiens OX=9606 GN=SPECC1L PE=3 SV=8	186	KDLLTLAKTKDV
KDLLTLNMTKVV	tr|Q0GNN5|Q0GNN5_HSPV	83	tr|F8WAN1|F8WAN1_HUMAN Cytospin-A OS=Homo sapiens OX=9606 GN=SPECC1L-ADORA2A PE=3 SV=2	186	KDLLTLAKTKDV
KDLLTLNMTKVV	tr|Q0GNN5|Q0GNN5_HSPV	83	tr|A0A494C1J1|A0A494C1J1_HUMAN Cytospin-A OS=Homo sapiens OX=9606 GN=SPECC1L PE=1 SV=1	205	KDLLTLAKTKDV
LVALFKMRSNVL	tr|Q0GNV9|Q0GNV9_HSPV	191	sp|Q9ULV1|FZD4_HUMAN Frizzled-4 OS=Homo sapiens OX=9606 GN=FZD4 PE=1 SV=2	410	LVALFKIRSNLQ
TSGDKLREYLVN	tr|Q0GNV9|Q0GNV9_HSPV	4	tr|A0A1X7SBS5|A0A1X7SBS5_HUMAN GABA(A) receptor subunit gamma-2 (Fragment) OS=Homo sapiens OX=9606 GN=GABRG2 PE=1 SV=1	243	TSEDKLHEILVN
GHELDSKSSEVI	tr|Q0GNW8|Q0GNW8_HSPV	124	sp|P10451|OSTP_HUMAN Osteopontin OS=Homo sapiens OX=9606 GN=SPP1 PE=1 SV=1	303	SHELDSASSEVN
IERSSTIFTTTK	tr|Q0GP22|Q0GP22_HSPV	850	sp|O94916|NFAT5_HUMAN Nuclear factor of activated T-cells 5 OS=Homo sapiens OX=9606 GN=NFAT5 PE=1 SV=1	615	EKRSSTIFKTTK
AKELSLPISVLD	tr|Q0GNX8|Q0GNX8_HSPV	732	sp|Q7Z7M1|AGRD2_HUMAN Adhesion G-protein coupled receptor D2 OS=Homo sapiens OX=9606 GN=ADGRD2 PE=2 SV=1	934	AKEHSLPFSVLP
EGGSESADLGIK	tr|Q0GP15|Q0GP15_HSPV	49	sp|Q9BQG1|SYT3_HUMAN Synaptotagmin-3 OS=Homo sapiens OX=9606 GN=SYT3 PE=1 SV=1	424	EGGSEKADLGEL
TKGLNNVTPENV	tr|Q0GNQ6|Q0GNQ6_HSPV	26	sp|Q9Y4A0|JERKL_HUMAN Jerky protein homolog-like OS=Homo sapiens OX=9606 GN=JRKL PE=2 SV=2	417	TKGLENVTTENL
SVKSALLSEYDL	tr|Q0GNM1|Q0GNM1_HSPV	439	sp|Q8N3K9|CMYA5_HUMAN Cardiomyopathy-associated protein 5 OS=Homo sapiens OX=9606 GN=CMYA5 PE=1 SV=3	3097	SVESALEHEYDL
YTQTLGGTSVIY	tr|Q0GNX5|Q0GNX5_HSPV	46	tr|K7EK00|K7EK00_HUMAN Protein FAM210A (Fragment) OS=Homo sapiens OX=9606 GN=FAM210A PE=1 SV=1	202	YTVTLGGTSVTV
YTQTLGGTSVIY	tr|Q0GNX5|Q0GNX5_HSPV	46	sp|Q96ND0|F210A_HUMAN Protein FAM210A OS=Homo sapiens OX=9606 GN=FAM210A PE=1 SV=2	202	YTVTLGGTSVTV
MRELDINRVMLR	tr|Q0GNU0|Q0GNU0_HSPV	891	tr|A0A0J9YY01|A0A0J9YY01_HUMAN Unconventional myosin-XVB OS=Homo sapiens OX=9606 GN=MYO15B PE=1 SV=1	1552	QRALDINKVMLR
MRELDINRVMLR	tr|Q0GNU0|Q0GNU0_HSPV	891	tr|A0A286YF23|A0A286YF23_HUMAN Unconventional myosin-XVB OS=Homo sapiens OX=9606 GN=MYO15B PE=1 SV=1	88	QRALDINKVMLR
MRELDINRVMLR	tr|Q0GNU0|Q0GNU0_HSPV	891	tr|A0A2R8YFM0|A0A2R8YFM0_HUMAN Unconventional myosin-XVB OS=Homo sapiens OX=9606 GN=MYO15B PE=1 SV=2	1600	QRALDINKVMLR
MRELDINRVMLR	tr|Q0GNU0|Q0GNU0_HSPV	891	sp|Q96JP2|MY15B_HUMAN Unconventional myosin-XVB OS=Homo sapiens OX=9606 GN=MYO15B PE=1 SV=3	510	QRALDINKVMLR
HTDLMSLDLKYK	tr|Q0GNX3|Q0GNX3_HSPV	434	sp|Q6ZQY2|LR74B_HUMAN Leucine-rich repeat-containing protein 74B OS=Homo sapiens OX=9606 GN=LRRC74B PE=2 SV=3	190	HTDLKSLDLSYN
ILHTKILLLLEH	tr|Q0GNW7|Q0GNW7_HSPV	40	tr|A0A087X1N3|A0A087X1N3_HUMAN Ribonuclease P 40kDa subunit, isoform CRA_c OS=Homo sapiens OX=9606 GN=RPP40 PE=1 SV=1	243	ILPEKICLLLEH
ILHTKILLLLEH	tr|Q0GNW7|Q0GNW7_HSPV	40	tr|X6RLL4|X6RLL4_HUMAN Ribonuclease P protein subunit p40 OS=Homo sapiens OX=9606 GN=RPP40 PE=1 SV=1	225	ILPEKICLLLEH
ILHTKILLLLEH	tr|Q0GNW7|Q0GNW7_HSPV	40	sp|O75818|RPP40_HUMAN Ribonuclease P protein subunit p40 OS=Homo sapiens OX=9606 GN=RPP40 PE=1 SV=3	285	ILPEKICLLLEH
QNTGNALCTVFN	tr|Q0GP18|Q0GP18_HSPV	22	sp|Q6SJ93|F111B_HUMAN Serine protease FAM111B OS=Homo sapiens OX=9606 GN=FAM111B PE=1 SV=1	470	GNTGNATCFVFN
DDLDDVTKETEE	tr|Q0GNQ7|Q0GNQ7_HSPV	14	tr|D6RGY2|D6RGY2_HUMAN Calnexin (Fragment) OS=Homo sapiens OX=9606 GN=CANX PE=1 SV=1	33	DDLDDVIEEVEE
FSSKSAEDPEKL	tr|Q0GNW5|Q0GNW5_HSPV	12	sp|Q13443|ADAM9_HUMAN Disintegrin and metalloproteinase domain-containing protein 9 OS=Homo sapiens OX=9606 GN=ADAM9 PE=1 SV=1	382	FSSCSAEDFEKL
FSSKSAEDPEKL	tr|Q0GNW5|Q0GNW5_HSPV	12	tr|A0AVL1|A0AVL1_HUMAN ADAM9 protein OS=Homo sapiens OX=9606 GN=ADAM9 PE=1 SV=1	382	FSSCSAEDFEKL
FSSKSAEDPEKL	tr|Q0GNW5|Q0GNW5_HSPV	12	tr|F8WC54|F8WC54_HUMAN Disintegrin and metalloproteinase domain-containing protein 9 OS=Homo sapiens OX=9606 GN=ADAM9 PE=1 SV=1	382	FSSCSAEDFEKL
FSSKSAEDPEKL	tr|Q0GNW5|Q0GNW5_HSPV	12	sp|Q07617|SPAG1_HUMAN Sperm-associated antigen 1 OS=Homo sapiens OX=9606 GN=SPAG1 PE=1 SV=3	787	KSSRSPEDPEKL
ESISDVTDPLSD	tr|Q0GNQ4|Q0GNQ4_HSPV	250	tr|F5GZ41|F5GZ41_HUMAN Peroxisomal targeting signal 1 receptor (Fragment) OS=Homo sapiens OX=9606 GN=PEX5 PE=1 SV=1	60	EFISEVTDPLSV
ESISDVTDPLSD	tr|Q0GNQ4|Q0GNQ4_HSPV	250	tr|F5H0L9|F5H0L9_HUMAN Peroxisomal targeting signal 1 receptor (Fragment) OS=Homo sapiens OX=9606 GN=PEX5 PE=1 SV=8	60	EFISEVTDPLSV
ESISDVTDPLSD	tr|Q0GNQ4|Q0GNQ4_HSPV	250	tr|F5GYB4|F5GYB4_HUMAN Peroxisomal targeting signal 1 receptor (Fragment) OS=Homo sapiens OX=9606 GN=PEX5 PE=1 SV=1	60	EFISEVTDPLSV
ESISDVTDPLSD	tr|Q0GNQ4|Q0GNQ4_HSPV	250	tr|F5H3X7|F5H3X7_HUMAN Peroxisomal targeting signal 1 receptor (Fragment) OS=Homo sapiens OX=9606 GN=PEX5 PE=1 SV=1	143	EFISEVTDPLSV
ESISDVTDPLSD	tr|Q0GNQ4|Q0GNQ4_HSPV	250	sp|P50542|PEX5_HUMAN Peroxisomal targeting signal 1 receptor OS=Homo sapiens OX=9606 GN=PEX5 PE=1 SV=3	143	EFISEVTDPLSV
ESISDVTDPLSD	tr|Q0GNQ4|Q0GNQ4_HSPV	250	tr|B4E0T2|B4E0T2_HUMAN PTS1-BP OS=Homo sapiens OX=9606 GN=PEX5 PE=1 SV=1	164	EFISEVTDPLSV
ESISDVTDPLSD	tr|Q0GNQ4|Q0GNQ4_HSPV	250	tr|J3KPV0|J3KPV0_HUMAN PTS1-BP (Fragment) OS=Homo sapiens OX=9606 GN=PEX5 PE=1 SV=1	158	EFISEVTDPLSV
