query	query_seqname	query_start	target_seqname	target_start	target
IIKELAELTESA	sp|P12296|POLG_ENMGO	345	tr|H7C0E3|H7C0E3_HUMAN Glutamine-rich protein 2 (Fragment) OS=Homo sapiens OX=9606 GN=QRICH2 PE=1 SV=1	147	IEKELAELRESQ
IIKELAELTESA	sp|P12296|POLG_ENMGO	345	sp|Q9H0J4|QRIC2_HUMAN Glutamine-rich protein 2 OS=Homo sapiens OX=9606 GN=QRICH2 PE=1 SV=1	1139	IEKELAELRESQ
IIKELAELTESA	sp|P12296|POLG_ENMGO	345	tr|A0A1B0GW36|A0A1B0GW36_HUMAN Glutamine-rich protein 2 OS=Homo sapiens OX=9606 GN=QRICH2 PE=1 SV=1	1305	IEKELAELRESQ
FAPAWRTSLELS	sp|P12296|POLG_ENMGO	1176	sp|Q8IZJ1|UNC5B_HUMAN Netrin receptor UNC5B OS=Homo sapiens OX=9606 GN=UNC5B PE=1 SV=2	700	FAPALCTSLEYS
LELHRSQNRQGW	sp|P12296|POLG_ENMGO	866	sp|Q6ZV60|YL023_HUMAN Putative uncharacterized protein encoded by LINC00173 OS=Homo sapiens OX=9606 GN=LINC00173 PE=5 SV=1	107	LELHRSQNRGGS
AKLALQRDHVRP	sp|P12296|POLG_ENMGO	1582	sp|Q9Y6V0|PCLO_HUMAN Protein piccolo OS=Homo sapiens OX=9606 GN=PCLO PE=1 SV=5	270	AKLPLQRDASRP
KPRREGPRPDEL	sp|P12296|POLG_ENMGO	630	tr|A0A1B0GU03|A0A1B0GU03_HUMAN Peptidase A1 domain-containing protein OS=Homo sapiens OX=9606 PE=1 SV=1	508	KPRLEWPRPDVL
LAFYFEPISLST	sp|P12296|POLG_ENMGO	513	sp|Q9Y257|KCNK6_HUMAN Potassium channel subfamily K member 6 OS=Homo sapiens OX=9606 GN=KCNK6 PE=1 SV=1	203	DAFYFCFISLST
SVKNELTAALRW	sp|P12296|POLG_ENMGO	612	tr|F8W835|F8W835_HUMAN Peripherin (Fragment) OS=Homo sapiens OX=9606 GN=PRPH PE=1 SV=2	143	TVKPELTAALRD
SVKNELTAALRW	sp|P12296|POLG_ENMGO	612	sp|P41219|PERI_HUMAN Peripherin OS=Homo sapiens OX=9606 GN=PRPH PE=1 SV=2	256	TVKPELTAALRD
ELHRSQNRQGWQ	sp|P12296|POLG_ENMGO	867	sp|Q6ZV60|YL023_HUMAN Putative uncharacterized protein encoded by LINC00173 OS=Homo sapiens OX=9606 GN=LINC00173 PE=5 SV=1	108	ELHRSQNRGGSE
GVLTGVPGGRNQ	sp|P12296|POLG_ENMGO	1633	tr|D6RFM1|D6RFM1_HUMAN Pro-thyrotropin-releasing hormone OS=Homo sapiens OX=9606 GN=TRH PE=1 SV=1	14	LNLTGVPGGRAQ
GVLTGVPGGRNQ	sp|P12296|POLG_ENMGO	1633	sp|P20396|TRH_HUMAN Pro-thyrotropin-releasing hormone OS=Homo sapiens OX=9606 GN=TRH PE=1 SV=1	14	LNLTGVPGGRAQ
AHPPPLVALSNK	sp|P12296|POLG_ENMGO	905	sp|P06396|GELS_HUMAN Gelsolin OS=Homo sapiens OX=9606 GN=GSN PE=1 SV=1	664	AHPPRLFACSNK
AHPPPLVALSNK	sp|P12296|POLG_ENMGO	905	tr|A0A0A0MT01|A0A0A0MT01_HUMAN Actin-depolymerizing factor OS=Homo sapiens OX=9606 GN=GSN PE=1 SV=1	649	AHPPRLFACSNK
AHPPPLVALSNK	sp|P12296|POLG_ENMGO	905	tr|A0A0A0MS51|A0A0A0MS51_HUMAN Actin-depolymerizing factor OS=Homo sapiens OX=9606 GN=GSN PE=1 SV=1	630	AHPPRLFACSNK
VKNELTAALRWD	sp|P12296|POLG_ENMGO	613	tr|F8W835|F8W835_HUMAN Peripherin (Fragment) OS=Homo sapiens OX=9606 GN=PRPH PE=1 SV=2	144	VKPELTAALRDI
VKNELTAALRWD	sp|P12296|POLG_ENMGO	613	sp|P41219|PERI_HUMAN Peripherin OS=Homo sapiens OX=9606 GN=PRPH PE=1 SV=2	257	VKPELTAALRDI
QLHLSRDSLHLS	sp|P12296|POLG_ENMGO	1740	tr|H0YFY6|H0YFY6_HUMAN Nuclear mitotic apparatus protein 1 (Fragment) OS=Homo sapiens OX=9606 GN=NUMA1 PE=1 SV=1	548	QLDLSIDSLDLS
QLHLSRDSLHLS	sp|P12296|POLG_ENMGO	1740	tr|K4DIE0|K4DIE0_HUMAN Nuclear mitotic apparatus protein 1 (Fragment) OS=Homo sapiens OX=9606 GN=NUMA1 PE=1 SV=1	307	QLDLSIDSLDLS
QLHLSRDSLHLS	sp|P12296|POLG_ENMGO	1740	sp|Q14980|NUMA1_HUMAN Nuclear mitotic apparatus protein 1 OS=Homo sapiens OX=9606 GN=NUMA1 PE=1 SV=2	1717	QLDLSIDSLDLS
QLHLSRDSLHLS	sp|P12296|POLG_ENMGO	1740	tr|A0A087WY61|A0A087WY61_HUMAN Nuclear mitotic apparatus protein 1 OS=Homo sapiens OX=9606 GN=NUMA1 PE=1 SV=1	1701	QLDLSIDSLDLS
VVLELHRSQNRQ	sp|P12296|POLG_ENMGO	864	sp|Q6ZV60|YL023_HUMAN Putative uncharacterized protein encoded by LINC00173 OS=Homo sapiens OX=9606 GN=LINC00173 PE=5 SV=1	105	RYLELHRSQNRG
SDSQTGGDGSIS	sp|P0DJX8|ALT2B_ENMGO	39	sp|Q9P267|MBD5_HUMAN Methyl-CpG-binding domain protein 5 OS=Homo sapiens OX=9606 GN=MBD5 PE=1 SV=3	227	SGSQIYGDGSIS
SDSQTGGDGSIS	sp|P0DJX8|ALT2B_ENMGO	39	tr|A0A1B0GW10|A0A1B0GW10_HUMAN Methyl-CpG-binding domain protein 5 OS=Homo sapiens OX=9606 GN=MBD5 PE=4 SV=2	227	SGSQIYGDGSIS
SDSQTGGDGSIS	sp|P0DJX8|ALT2B_ENMGO	39	tr|A0A0D9SG23|A0A0D9SG23_HUMAN Methyl-CpG-binding domain protein 5 OS=Homo sapiens OX=9606 GN=MBD5 PE=1 SV=1	227	SGSQIYGDGSIS
SDSQTGGDGSIS	sp|P0DJX8|ALT2B_ENMGO	39	tr|A0A2R8YDL9|A0A2R8YDL9_HUMAN Methyl-CpG-binding domain protein 5 OS=Homo sapiens OX=9606 GN=MBD5 PE=1 SV=1	227	SGSQIYGDGSIS
SIFKESLLGSKS	sp|P12296|POLG_ENMGO	694	tr|G3V4I9|G3V4I9_HUMAN Protein NEDD1 (Fragment) OS=Homo sapiens OX=9606 GN=NEDD1 PE=1 SV=1	82	SLFKKSLLGSVS
SIFKESLLGSKS	sp|P12296|POLG_ENMGO	694	sp|Q8NHV4|NEDD1_HUMAN Protein NEDD1 OS=Homo sapiens OX=9606 GN=NEDD1 PE=1 SV=1	171	SLFKKSLLGSVS
EDEWTYEQVVSV	sp|P12296|POLG_ENMGO	602	sp|Q9BWM5|ZN416_HUMAN Zinc finger protein 416 OS=Homo sapiens OX=9606 GN=ZNF416 PE=2 SV=1	74	EDEETPEQSVSV
AGQNSAAIAPKG	sp|P12296|POLG_ENMGO	151	sp|O15014|ZN609_HUMAN Zinc finger protein 609 OS=Homo sapiens OX=9606 GN=ZNF609 PE=1 SV=2	131	AGGLVAAIAPKG
AGQNSAAIAPKG	sp|P12296|POLG_ENMGO	151	tr|E7ERY8|E7ERY8_HUMAN Zinc finger protein 609 OS=Homo sapiens OX=9606 GN=ZNF609 PE=1 SV=1	131	AGGLVAAIAPKG
SLHLSEYSLTVT	sp|P12296|POLG_ENMGO	1747	sp|Q9NTM9|CUTC_HUMAN Copper homeostasis protein cutC homolog OS=Homo sapiens OX=9606 GN=CUTC PE=1 SV=1	245	SLSCSEYSLKVT
RSSDSQTGGDGS	sp|P0DJX8|ALT2B_ENMGO	37	tr|A0A494C055|A0A494C055_HUMAN Protein-tyrosine-phosphatase OS=Homo sapiens OX=9606 GN=PTPRZ1 PE=1 SV=1	1490	VSSDSQTGMDRS
RSSDSQTGGDGS	sp|P0DJX8|ALT2B_ENMGO	37	tr|A0A494C1F0|A0A494C1F0_HUMAN Receptor-type tyrosine-protein phosphatase zeta (Fragment) OS=Homo sapiens OX=9606 GN=PTPRZ1 PE=1 SV=1	68	VSSDSQTGMDRS
RSSDSQTGGDGS	sp|P0DJX8|ALT2B_ENMGO	37	tr|A0A494C1B4|A0A494C1B4_HUMAN Protein-tyrosine-phosphatase OS=Homo sapiens OX=9606 GN=PTPRZ1 PE=1 SV=1	1044	VSSDSQTGMDRS
RSSDSQTGGDGS	sp|P0DJX8|ALT2B_ENMGO	37	tr|A0A494C087|A0A494C087_HUMAN Protein-tyrosine-phosphatase OS=Homo sapiens OX=9606 GN=PTPRZ1 PE=1 SV=1	1490	VSSDSQTGMDRS
RSSDSQTGGDGS	sp|P0DJX8|ALT2B_ENMGO	37	sp|P23471|PTPRZ_HUMAN Receptor-type tyrosine-protein phosphatase zeta OS=Homo sapiens OX=9606 GN=PTPRZ1 PE=1 SV=4	1490	VSSDSQTGMDRS
RSSDSQTGGDGS	sp|P0DJX8|ALT2B_ENMGO	37	tr|A0A494C0U4|A0A494C0U4_HUMAN Protein-tyrosine-phosphatase OS=Homo sapiens OX=9606 GN=PTPRZ1 PE=1 SV=1	1234	VSSDSQTGMDRS
ANRFVNNLTLLG	sp|P12296|POLG_ENMGO	2199	tr|F5GXF6|F5GXF6_HUMAN N-alpha-acetyltransferase 40 OS=Homo sapiens OX=9606 GN=NAA40 PE=1 SV=1	32	ANRVMPNLTLLG
SAGTGGDGLPAP	sp|P12296|POLG_ENMGO	466	sp|Q7Z5R6|AB1IP_HUMAN Amyloid beta A4 precursor protein-binding family B member 1-interacting protein OS=Homo sapiens OX=9606 GN=APBB1IP PE=1 SV=1	538	AKGTGGGGLPAP
ESLLGSKSQTDT	sp|P12296|POLG_ENMGO	698	tr|H7BY83|H7BY83_HUMAN WD repeat-containing protein 44 (Fragment) OS=Homo sapiens OX=9606 GN=WDR44 PE=1 SV=1	467	ESLSSSKSDTDT
ESLLGSKSQTDT	sp|P12296|POLG_ENMGO	698	sp|Q5JSH3|WDR44_HUMAN WD repeat-containing protein 44 OS=Homo sapiens OX=9606 GN=WDR44 PE=1 SV=1	567	ESLSSSKSDTDT
EKLCTFAPRFPR	sp|P12296|POLG_ENMGO	1881	tr|Q5SZL8|Q5SZL8_HUMAN TBC1 domain family member 7 (Fragment) OS=Homo sapiens OX=9606 GN=TBC1D7 PE=1 SV=1	40	EKLCTFSQRFPL
EKLCTFAPRFPR	sp|P12296|POLG_ENMGO	1881	tr|Q5SZM2|Q5SZM2_HUMAN TBC1 domain family member 7 (Fragment) OS=Homo sapiens OX=9606 GN=TBC1D7 PE=1 SV=1	40	EKLCTFSQRFPL
EKLCTFAPRFPR	sp|P12296|POLG_ENMGO	1881	tr|Q5SZM1|Q5SZM1_HUMAN TBC1 domain family member 7 (Fragment) OS=Homo sapiens OX=9606 GN=TBC1D7 PE=1 SV=1	40	EKLCTFSQRFPL
EKLCTFAPRFPR	sp|P12296|POLG_ENMGO	1881	tr|B4DK47|B4DK47_HUMAN TBC1 domain family member 7 OS=Homo sapiens OX=9606 GN=TBC1D7 PE=1 SV=1	40	EKLCTFSQRFPL
EKLCTFAPRFPR	sp|P12296|POLG_ENMGO	1881	tr|Q5SZL4|Q5SZL4_HUMAN TBC1 domain family member 7 (Fragment) OS=Homo sapiens OX=9606 GN=TBC1D7 PE=1 SV=1	40	EKLCTFSQRFPL
EKLCTFAPRFPR	sp|P12296|POLG_ENMGO	1881	sp|Q9P0N9|TBCD7_HUMAN TBC1 domain family member 7 OS=Homo sapiens OX=9606 GN=TBC1D7 PE=1 SV=1	40	EKLCTFSQRFPL
EKLCTFAPRFPR	sp|P12296|POLG_ENMGO	1881	tr|U3KQD8|U3KQD8_HUMAN TBC1 domain family member 7 (Fragment) OS=Homo sapiens OX=9606 GN=TBC1D7 PE=1 SV=1	40	EKLCTFSQRFPL
EKLCTFAPRFPR	sp|P12296|POLG_ENMGO	1881	tr|U3KQQ0|U3KQQ0_HUMAN TBC1 domain family member 7 (Fragment) OS=Homo sapiens OX=9606 GN=TBC1D7 PE=1 SV=1	40	EKLCTFSQRFPL
SLRSRDCKSPIS	sp|P0DJX8|ALT2B_ENMGO	21	sp|A2VEC9|SSPO_HUMAN SCO-spondin OS=Homo sapiens OX=9606 GN=SSPOP PE=2 SV=2	4027	SLRSRSCSSPPS
MIIKELAELTES	sp|P12296|POLG_ENMGO	344	tr|H7C0E3|H7C0E3_HUMAN Glutamine-rich protein 2 (Fragment) OS=Homo sapiens OX=9606 GN=QRICH2 PE=1 SV=1	146	DIEKELAELRES
MIIKELAELTES	sp|P12296|POLG_ENMGO	344	sp|Q9H0J4|QRIC2_HUMAN Glutamine-rich protein 2 OS=Homo sapiens OX=9606 GN=QRICH2 PE=1 SV=1	1138	DIEKELAELRES
MIIKELAELTES	sp|P12296|POLG_ENMGO	344	tr|A0A1B0GW36|A0A1B0GW36_HUMAN Glutamine-rich protein 2 OS=Homo sapiens OX=9606 GN=QRICH2 PE=1 SV=1	1304	DIEKELAELRES
KEKLCTFAPRFP	sp|P12296|POLG_ENMGO	1880	tr|Q5SZL8|Q5SZL8_HUMAN TBC1 domain family member 7 (Fragment) OS=Homo sapiens OX=9606 GN=TBC1D7 PE=1 SV=1	39	TEKLCTFSQRFP
KEKLCTFAPRFP	sp|P12296|POLG_ENMGO	1880	tr|Q5SZM2|Q5SZM2_HUMAN TBC1 domain family member 7 (Fragment) OS=Homo sapiens OX=9606 GN=TBC1D7 PE=1 SV=1	39	TEKLCTFSQRFP
KEKLCTFAPRFP	sp|P12296|POLG_ENMGO	1880	tr|Q5SZM1|Q5SZM1_HUMAN TBC1 domain family member 7 (Fragment) OS=Homo sapiens OX=9606 GN=TBC1D7 PE=1 SV=1	39	TEKLCTFSQRFP
KEKLCTFAPRFP	sp|P12296|POLG_ENMGO	1880	tr|B4DK47|B4DK47_HUMAN TBC1 domain family member 7 OS=Homo sapiens OX=9606 GN=TBC1D7 PE=1 SV=1	39	TEKLCTFSQRFP
KEKLCTFAPRFP	sp|P12296|POLG_ENMGO	1880	tr|Q5SZL4|Q5SZL4_HUMAN TBC1 domain family member 7 (Fragment) OS=Homo sapiens OX=9606 GN=TBC1D7 PE=1 SV=1	39	TEKLCTFSQRFP
KEKLCTFAPRFP	sp|P12296|POLG_ENMGO	1880	sp|Q9P0N9|TBCD7_HUMAN TBC1 domain family member 7 OS=Homo sapiens OX=9606 GN=TBC1D7 PE=1 SV=1	39	TEKLCTFSQRFP
KEKLCTFAPRFP	sp|P12296|POLG_ENMGO	1880	tr|U3KQD8|U3KQD8_HUMAN TBC1 domain family member 7 (Fragment) OS=Homo sapiens OX=9606 GN=TBC1D7 PE=1 SV=1	39	TEKLCTFSQRFP
KEKLCTFAPRFP	sp|P12296|POLG_ENMGO	1880	tr|U3KQQ0|U3KQQ0_HUMAN TBC1 domain family member 7 (Fragment) OS=Homo sapiens OX=9606 GN=TBC1D7 PE=1 SV=1	39	TEKLCTFSQRFP
VSVKNELTAALR	sp|P12296|POLG_ENMGO	611	tr|F8W835|F8W835_HUMAN Peripherin (Fragment) OS=Homo sapiens OX=9606 GN=PRPH PE=1 SV=2	142	ATVKPELTAALR
VSVKNELTAALR	sp|P12296|POLG_ENMGO	611	sp|P41219|PERI_HUMAN Peripherin OS=Homo sapiens OX=9606 GN=PRPH PE=1 SV=2	255	ATVKPELTAALR
EPLNSLTGSFYG	sp|P12296|POLG_ENMGO	662	sp|P06732|KCRM_HUMAN Creatine kinase M-type OS=Homo sapiens OX=9606 GN=CKM PE=1 SV=2	160	EALNSLTGEFKG
LSAAKGTVFLLL	sp|P12296|POLG_ENMGO	125	tr|K7EP35|K7EP35_HUMAN Complex I-B14.7 (Fragment) OS=Homo sapiens OX=9606 PE=3 SV=1	129	VSAAGGCVFLLL
LSAAKGTVFLLL	sp|P12296|POLG_ENMGO	125	tr|K7EMT4|K7EMT4_HUMAN Complex I-B14.7 (Fragment) OS=Homo sapiens OX=9606 PE=3 SV=1	154	VSAAGGCVFLLL
FVSPLGLLVVIL	sp|P12296|POLG_ENMGO	1443	sp|Q9BZJ6|GPR63_HUMAN Probable G-protein coupled receptor 63 OS=Homo sapiens OX=9606 GN=GPR63 PE=2 SV=2	93	FVSFLGNLVVCL
VLTGVPGGRNQS	sp|P12296|POLG_ENMGO	1634	tr|D6RFM1|D6RFM1_HUMAN Pro-thyrotropin-releasing hormone OS=Homo sapiens OX=9606 GN=TRH PE=1 SV=1	15	NLTGVPGGRAQP
VLTGVPGGRNQS	sp|P12296|POLG_ENMGO	1634	sp|P20396|TRH_HUMAN Pro-thyrotropin-releasing hormone OS=Homo sapiens OX=9606 GN=TRH PE=1 SV=1	15	NLTGVPGGRAQP
AFYFEPISLSTS	sp|P12296|POLG_ENMGO	514	sp|Q9Y257|KCNK6_HUMAN Potassium channel subfamily K member 6 OS=Homo sapiens OX=9606 GN=KCNK6 PE=1 SV=1	204	AFYFCFISLSTI
LTGVPGGRNQSV	sp|P12296|POLG_ENMGO	1635	tr|D6RFM1|D6RFM1_HUMAN Pro-thyrotropin-releasing hormone OS=Homo sapiens OX=9606 GN=TRH PE=1 SV=1	16	LTGVPGGRAQPE
LTGVPGGRNQSV	sp|P12296|POLG_ENMGO	1635	sp|P20396|TRH_HUMAN Pro-thyrotropin-releasing hormone OS=Homo sapiens OX=9606 GN=TRH PE=1 SV=1	16	LTGVPGGRAQPE
GTGGDGLPAPVL	sp|P12296|POLG_ENMGO	468	sp|Q7Z5R6|AB1IP_HUMAN Amyloid beta A4 precursor protein-binding family B member 1-interacting protein OS=Homo sapiens OX=9606 GN=APBB1IP PE=1 SV=1	540	GTGGGGLPAPPD
IQLVCVGGPVAV	sp|P12296|POLG_ENMGO	2216	sp|P26010|ITB7_HUMAN Integrin beta-7 OS=Homo sapiens OX=9606 GN=ITGB7 PE=1 SV=1	727	IVLGCVGGIVAV
IQLVCVGGPVAV	sp|P12296|POLG_ENMGO	2216	tr|H3BRX4|H3BRX4_HUMAN Integrin beta-7 (Fragment) OS=Homo sapiens OX=9606 GN=ITGB7 PE=1 SV=1	62	IVLGCVGGIVAV
AGTGGDGLPAPV	sp|P12296|POLG_ENMGO	467	sp|Q7Z5R6|AB1IP_HUMAN Amyloid beta A4 precursor protein-binding family B member 1-interacting protein OS=Homo sapiens OX=9606 GN=APBB1IP PE=1 SV=1	539	KGTGGGGLPAPP
VLELHRSQNRQG	sp|P12296|POLG_ENMGO	865	sp|Q6ZV60|YL023_HUMAN Putative uncharacterized protein encoded by LINC00173 OS=Homo sapiens OX=9606 GN=LINC00173 PE=5 SV=1	106	YLELHRSQNRGG
DVVLELHRSQNR	sp|P12296|POLG_ENMGO	863	sp|Q6ZV60|YL023_HUMAN Putative uncharacterized protein encoded by LINC00173 OS=Homo sapiens OX=9606 GN=LINC00173 PE=5 SV=1	104	SRYLELHRSQNR
SAAKGTVFLLLN	sp|P12296|POLG_ENMGO	126	tr|K7EP35|K7EP35_HUMAN Complex I-B14.7 (Fragment) OS=Homo sapiens OX=9606 PE=3 SV=1	130	SAAGGCVFLLLP
SAAKGTVFLLLN	sp|P12296|POLG_ENMGO	126	tr|K7EMT4|K7EMT4_HUMAN Complex I-B14.7 (Fragment) OS=Homo sapiens OX=9606 PE=3 SV=1	155	SAAGGCVFLLLP
SSDSQTGGDGSI	sp|P0DJX8|ALT2B_ENMGO	38	sp|Q9P267|MBD5_HUMAN Methyl-CpG-binding domain protein 5 OS=Homo sapiens OX=9606 GN=MBD5 PE=1 SV=3	226	SSGSQIYGDGSI
SSDSQTGGDGSI	sp|P0DJX8|ALT2B_ENMGO	38	tr|A0A1B0GW10|A0A1B0GW10_HUMAN Methyl-CpG-binding domain protein 5 OS=Homo sapiens OX=9606 GN=MBD5 PE=4 SV=2	226	SSGSQIYGDGSI
SSDSQTGGDGSI	sp|P0DJX8|ALT2B_ENMGO	38	tr|A0A0D9SG23|A0A0D9SG23_HUMAN Methyl-CpG-binding domain protein 5 OS=Homo sapiens OX=9606 GN=MBD5 PE=1 SV=1	226	SSGSQIYGDGSI
SSDSQTGGDGSI	sp|P0DJX8|ALT2B_ENMGO	38	tr|A0A2R8YDL9|A0A2R8YDL9_HUMAN Methyl-CpG-binding domain protein 5 OS=Homo sapiens OX=9606 GN=MBD5 PE=1 SV=1	226	SSGSQIYGDGSI
SSDSQTGGDGSI	sp|P0DJX8|ALT2B_ENMGO	38	tr|A0A494C055|A0A494C055_HUMAN Protein-tyrosine-phosphatase OS=Homo sapiens OX=9606 GN=PTPRZ1 PE=1 SV=1	1491	SSDSQTGMDRSP
SSDSQTGGDGSI	sp|P0DJX8|ALT2B_ENMGO	38	tr|A0A494C1F0|A0A494C1F0_HUMAN Receptor-type tyrosine-protein phosphatase zeta (Fragment) OS=Homo sapiens OX=9606 GN=PTPRZ1 PE=1 SV=1	69	SSDSQTGMDRSP
SSDSQTGGDGSI	sp|P0DJX8|ALT2B_ENMGO	38	tr|A0A494C1B4|A0A494C1B4_HUMAN Protein-tyrosine-phosphatase OS=Homo sapiens OX=9606 GN=PTPRZ1 PE=1 SV=1	1045	SSDSQTGMDRSP
SSDSQTGGDGSI	sp|P0DJX8|ALT2B_ENMGO	38	tr|A0A494C087|A0A494C087_HUMAN Protein-tyrosine-phosphatase OS=Homo sapiens OX=9606 GN=PTPRZ1 PE=1 SV=1	1491	SSDSQTGMDRSP
SSDSQTGGDGSI	sp|P0DJX8|ALT2B_ENMGO	38	sp|P23471|PTPRZ_HUMAN Receptor-type tyrosine-protein phosphatase zeta OS=Homo sapiens OX=9606 GN=PTPRZ1 PE=1 SV=4	1491	SSDSQTGMDRSP
SSDSQTGGDGSI	sp|P0DJX8|ALT2B_ENMGO	38	tr|A0A494C0U4|A0A494C0U4_HUMAN Protein-tyrosine-phosphatase OS=Homo sapiens OX=9606 GN=PTPRZ1 PE=1 SV=1	1235	SSDSQTGMDRSP
AFGPSLNPTQKA	sp|P12296|POLG_ENMGO	1929	tr|F8VRU2|F8VRU2_HUMAN DNA-directed RNA polymerase (Fragment) OS=Homo sapiens OX=9606 GN=POLR3B PE=1 SV=8	22	AFGPSLEECQKA
AFGPSLNPTQKA	sp|P12296|POLG_ENMGO	1929	sp|Q9NW08|RPC2_HUMAN DNA-directed RNA polymerase III subunit RPC2 OS=Homo sapiens OX=9606 GN=POLR3B PE=1 SV=2	264	AFGPSLEECQKA
SEGNATSAGTGG	sp|P12296|POLG_ENMGO	460	sp|Q9ULU8|CAPS1_HUMAN Calcium-dependent secretion activator 1 OS=Homo sapiens OX=9606 GN=CADPS PE=1 SV=3	39	SEGSAGSAGLGG
SEGNATSAGTGG	sp|P12296|POLG_ENMGO	460	tr|F1T0E5|F1T0E5_HUMAN Calcium-dependent secretion activator 1 OS=Homo sapiens OX=9606 GN=CADPS PE=1 SV=1	39	SEGSAGSAGLGG
SEGNATSAGTGG	sp|P12296|POLG_ENMGO	460	sp|P60468|SC61B_HUMAN Protein transport protein Sec61 subunit beta OS=Homo sapiens OX=9606 GN=SEC61B PE=1 SV=2	43	SAGRTTSAGTGG
SEGNATSAGTGG	sp|P12296|POLG_ENMGO	460	tr|U3KQU3|U3KQU3_HUMAN Zinc finger protein 462 (Fragment) OS=Homo sapiens OX=9606 GN=ZNF462 PE=1 SV=1	73	SGQNATSLGTGG
SEGNATSAGTGG	sp|P12296|POLG_ENMGO	460	sp|Q96JM2|ZN462_HUMAN Zinc finger protein 462 OS=Homo sapiens OX=9606 GN=ZNF462 PE=1 SV=3	73	SGQNATSLGTGG
NISEILNPELPT	sp|P12296|POLG_ENMGO	1894	tr|F5GWF7|F5GWF7_HUMAN Protein AMN1 homolog (Fragment) OS=Homo sapiens OX=9606 GN=AMN1 PE=1 SV=1	36	NISEILHPEVQT
NISEILNPELPT	sp|P12296|POLG_ENMGO	1894	tr|F5H1R2|F5H1R2_HUMAN Protein AMN1 homolog (Fragment) OS=Homo sapiens OX=9606 GN=AMN1 PE=1 SV=1	36	NISEILHPEVQT
NISEILNPELPT	sp|P12296|POLG_ENMGO	1894	sp|Q8IY45|AMN1_HUMAN Protein AMN1 homolog OS=Homo sapiens OX=9606 GN=AMN1 PE=2 SV=4	54	NISEILHPEVQT
