query	query_seqname	query_start	target_seqname	target_start	target
REGGICYRVLTR	sp|A4UHP8|NCAP_EBLV1	391	tr|F8WF38|F8WF38_HUMAN Gamma-aminobutyric acid type B receptor subunit 1 OS=Homo sapiens OX=9606 GN=GABBR1 PE=1 SV=1	37	WEGGIRYRGLTR
REGGICYRVLTR	sp|A4UHP8|NCAP_EBLV1	391	tr|F8WAS6|F8WAS6_HUMAN Gamma-aminobutyric acid type B receptor subunit 1 OS=Homo sapiens OX=9606 GN=GABBR1 PE=1 SV=1	37	WEGGIRYRGLTR
REGGICYRVLTR	sp|A4UHP8|NCAP_EBLV1	391	tr|A0A140T9S4|A0A140T9S4_HUMAN Gamma-aminobutyric acid type B receptor subunit 1 OS=Homo sapiens OX=9606 GN=GABBR1 PE=1 SV=1	37	WEGGIRYRGLTR
REGGICYRVLTR	sp|A4UHP8|NCAP_EBLV1	391	tr|C9J342|C9J342_HUMAN Gamma-aminobutyric acid type B receptor subunit 1 (Fragment) OS=Homo sapiens OX=9606 GN=GABBR1 PE=1 SV=1	42	WEGGIRYRGLTR
REGGICYRVLTR	sp|A4UHP8|NCAP_EBLV1	391	tr|F8WAV2|F8WAV2_HUMAN Gamma-aminobutyric acid type B receptor subunit 1 OS=Homo sapiens OX=9606 GN=GABBR1 PE=1 SV=1	37	WEGGIRYRGLTR
REGGICYRVLTR	sp|A4UHP8|NCAP_EBLV1	391	tr|C9JZG6|C9JZG6_HUMAN Gamma-aminobutyric acid type B receptor subunit 1 (Fragment) OS=Homo sapiens OX=9606 GN=GABBR1 PE=1 SV=1	37	WEGGIRYRGLTR
REGGICYRVLTR	sp|A4UHP8|NCAP_EBLV1	391	tr|F8WDC0|F8WDC0_HUMAN Gamma-aminobutyric acid type B receptor subunit 1 OS=Homo sapiens OX=9606 GN=GABBR1 PE=1 SV=1	37	WEGGIRYRGLTR
REGGICYRVLTR	sp|A4UHP8|NCAP_EBLV1	391	sp|Q9UBS5|GABR1_HUMAN Gamma-aminobutyric acid type B receptor subunit 1 OS=Homo sapiens OX=9606 GN=GABBR1 PE=1 SV=1	37	WEGGIRYRGLTR
REGGICYRVLTR	sp|A4UHP8|NCAP_EBLV1	391	tr|A0A0G2JKF9|A0A0G2JKF9_HUMAN GABBR1 OS=Homo sapiens OX=9606 GN=GABBR1 PE=1 SV=1	37	WEGGIRYRGLTR
REGGICYRVLTR	sp|A4UHP8|NCAP_EBLV1	391	tr|A0A140TA42|A0A140TA42_HUMAN Gamma-aminobutyric acid type B receptor subunit 1 OS=Homo sapiens OX=9606 GN=GABBR1 PE=1 SV=1	37	WEGGIRYRGLTR
LHERSTILYMSM	sp|A4UHQ0|MATRX_EBLV1	78	tr|C9IZQ6|C9IZQ6_HUMAN HCG2022551, isoform CRA_j OS=Homo sapiens OX=9606 GN=KALRN PE=1 SV=1	407	LDERSTILAMSA
LHERSTILYMSM	sp|A4UHQ0|MATRX_EBLV1	78	tr|H7BXZ5|H7BXZ5_HUMAN Non-specific serine/threonine protein kinase (Fragment) OS=Homo sapiens OX=9606 GN=KALRN PE=1 SV=1	385	LDERSTILAMSA
LHERSTILYMSM	sp|A4UHQ0|MATRX_EBLV1	78	sp|O60229|KALRN_HUMAN Kalirin OS=Homo sapiens OX=9606 GN=KALRN PE=1 SV=3	407	LDERSTILAMSA
FLELSVTEIDSI	sp|A4UHQ2|L_EBLV1	2037	sp|Q6JEL2|KLH10_HUMAN Kelch-like protein 10 OS=Homo sapiens OX=9606 GN=KLHL10 PE=1 SV=1	178	FLELSVTELKDI
GDGFARGKRAAG	sp|A4UHQ2|L_EBLV1	1047	sp|Q66K64|DCA15_HUMAN DDB1- and CUL4-associated factor 15 OS=Homo sapiens OX=9606 GN=DCAF15 PE=1 SV=1	19	GPGGAGGKRAAG
GDGFARGKRAAG	sp|A4UHQ2|L_EBLV1	1047	tr|K7ENG0|K7ENG0_HUMAN DDB1- and CUL4-associated factor 15 (Fragment) OS=Homo sapiens OX=9606 GN=DCAF15 PE=1 SV=1	18	GPGGAGGKRAAG
VLSAVLPLLSEA	sp|A4UHQ2|L_EBLV1	2074	tr|K7EPS2|K7EPS2_HUMAN Transcription factor E2-alpha (Fragment) OS=Homo sapiens OX=9606 GN=TCF3 PE=1 SV=2	147	VLSAPHPGLSEA
VLSAVLPLLSEA	sp|A4UHQ2|L_EBLV1	2074	tr|A0A0A0MRB7|A0A0A0MRB7_HUMAN Transcription factor E2-alpha OS=Homo sapiens OX=9606 GN=TCF3 PE=1 SV=1	582	VLSAPHPGLSEA
VLSAVLPLLSEA	sp|A4UHQ2|L_EBLV1	2074	tr|K7ERZ7|K7ERZ7_HUMAN Transcription factor E2-alpha (Fragment) OS=Homo sapiens OX=9606 GN=TCF3 PE=1 SV=1	186	VLSAPHPGLSEA
VLSAVLPLLSEA	sp|A4UHQ2|L_EBLV1	2074	tr|X6REB3|X6REB3_HUMAN Transcription factor E2-alpha OS=Homo sapiens OX=9606 GN=TCF3 PE=1 SV=2	661	VLSAPHPGLSEA
VLSAVLPLLSEA	sp|A4UHQ2|L_EBLV1	2074	tr|K7EMM4|K7EMM4_HUMAN Transcription factor E2-alpha (Fragment) OS=Homo sapiens OX=9606 GN=TCF3 PE=1 SV=2	202	VLSAPHPGLSEA
VLSAVLPLLSEA	sp|A4UHQ2|L_EBLV1	2074	tr|A0A0A0MTS0|A0A0A0MTS0_HUMAN Transcription factor E2-alpha (Fragment) OS=Homo sapiens OX=9606 GN=TCF3 PE=1 SV=1	141	VLSAPHPGLSEA
VLSAVLPLLSEA	sp|A4UHQ2|L_EBLV1	2074	tr|K7ENH8|K7ENH8_HUMAN Transcription factor E2-alpha (Fragment) OS=Homo sapiens OX=9606 GN=TCF3 PE=1 SV=2	296	VLSAPHPGLSEA
VLSAVLPLLSEA	sp|A4UHQ2|L_EBLV1	2074	sp|P15923|TFE2_HUMAN Transcription factor E2-alpha OS=Homo sapiens OX=9606 GN=TCF3 PE=1 SV=1	636	VLSAPHPGLSEA
VLSAVLPLLSEA	sp|A4UHQ2|L_EBLV1	2074	tr|K7EKB9|K7EKB9_HUMAN Transcription factor E2-alpha (Fragment) OS=Homo sapiens OX=9606 GN=TCF3 PE=1 SV=1	161	VLSAPHPGLSEA
