query	query_seqname	query_start	target_seqname	target_start	target
KLILEFEEKFKG	sp|P23456|L_HANTV	507	sp|Q9HB65|ELL3_HUMAN RNA polymerase II elongation factor ELL3 OS=Homo sapiens OX=9606 GN=ELL3 PE=1 SV=2	385	GLILEFEEKNRG
LVQLNSKINKFV	sp|P23456|L_HANTV	1180	sp|Q96FC7|PHIPL_HUMAN Phytanoyl-CoA hydroxylase-interacting protein-like OS=Homo sapiens OX=9606 GN=PHYHIPL PE=1 SV=3	300	LPQLNSKDNKFL
LKLDHISAAKTG	sp|P23456|L_HANTV	1772	tr|H0YMD2|H0YMD2_HUMAN Nucleolar and spindle-associated protein 1 (Fragment) OS=Homo sapiens OX=9606 GN=NUSAP1 PE=1 SV=1	129	LKRSAISAAKTG
LKLDHISAAKTG	sp|P23456|L_HANTV	1772	sp|Q9BXS6|NUSAP_HUMAN Nucleolar and spindle-associated protein 1 OS=Homo sapiens OX=9606 GN=NUSAP1 PE=1 SV=1	270	LKRSAISAAKTG
LQFRALLEELIK	sp|P23456|L_HANTV	1318	sp|Q9Y6X0|SETBP_HUMAN SET-binding protein OS=Homo sapiens OX=9606 GN=SETBP1 PE=1 SV=3	951	LQFLADLEELIT
LKFNVSNLSSRL	sp|P08668|GP_HANTV	282	tr|E7EPI0|E7EPI0_HUMAN Inhibitor of Bruton tyrosine kinase OS=Homo sapiens OX=9606 GN=IBTK PE=1 SV=1	725	KKFDFSNLSSRL
LKFNVSNLSSRL	sp|P08668|GP_HANTV	282	sp|Q9P2D0|IBTK_HUMAN Inhibitor of Bruton tyrosine kinase OS=Homo sapiens OX=9606 GN=IBTK PE=1 SV=3	725	KKFDFSNLSSRL
STAIKKGLRCYN	sp|P23456|L_HANTV	1262	sp|O94827|PKHG5_HUMAN Pleckstrin homology domain-containing family G member 5 OS=Homo sapiens OX=9606 GN=PLEKHG5 PE=1 SV=3	5	SPAEKKGLRCQN
STAIKKGLRCYN	sp|P23456|L_HANTV	1262	tr|A0A5F9ZHW8|A0A5F9ZHW8_HUMAN Pleckstrin homology domain-containing family G member 5 OS=Homo sapiens OX=9606 GN=PLEKHG5 PE=1 SV=1	48	SPAEKKGLRCQN
STAIKKGLRCYN	sp|P23456|L_HANTV	1262	tr|Q5SY18|Q5SY18_HUMAN Pleckstrin homology domain-containing family G member 5 OS=Homo sapiens OX=9606 GN=PLEKHG5 PE=1 SV=1	26	SPAEKKGLRCQN
KFNVSNLSSRLL	sp|P08668|GP_HANTV	283	tr|E7EPI0|E7EPI0_HUMAN Inhibitor of Bruton tyrosine kinase OS=Homo sapiens OX=9606 GN=IBTK PE=1 SV=1	726	KFDFSNLSSRLD
KFNVSNLSSRLL	sp|P08668|GP_HANTV	283	sp|Q9P2D0|IBTK_HUMAN Inhibitor of Bruton tyrosine kinase OS=Homo sapiens OX=9606 GN=IBTK PE=1 SV=3	726	KFDFSNLSSRLD
LVSPLFFLQHKL	sp|P23456|L_HANTV	409	tr|C9JM56|C9JM56_HUMAN Solute carrier family 25 member 48 OS=Homo sapiens OX=9606 GN=SLC25A48 PE=3 SV=1	58	AVSPLFFLQLKS
SVVGSETTAYIL	sp|P08668|GP_HANTV	1072	tr|A0A3B3ISV4|A0A3B3ISV4_HUMAN Vitamin-K-epoxide reductase (warfarin-sensitive) OS=Homo sapiens OX=9606 GN=VKORC1L1 PE=1 SV=1	167	SVVGSLYLAYIL
SVVGSETTAYIL	sp|P08668|GP_HANTV	1072	sp|Q8N0U8|VKORL_HUMAN Vitamin K epoxide reductase complex subunit 1-like protein 1 OS=Homo sapiens OX=9606 GN=VKORC1L1 PE=1 SV=2	120	SVVGSLYLAYIL
RKAVSPQPSEDE	sp|P05133|NCAP_HANTV	62	tr|A0A2R8Y2X6|A0A2R8Y2X6_HUMAN BICD family-like cargo adapter 2 OS=Homo sapiens OX=9606 GN=BICDL2 PE=1 SV=1	360	RKASSPQPSPPE
RKAVSPQPSEDE	sp|P05133|NCAP_HANTV	62	sp|A1A5D9|BICL2_HUMAN BICD family-like cargo adapter 2 OS=Homo sapiens OX=9606 GN=BICDL2 PE=1 SV=2	327	RKASSPQPSPPE
NQSTAIKKGLRC	sp|P23456|L_HANTV	1260	sp|O94827|PKHG5_HUMAN Pleckstrin homology domain-containing family G member 5 OS=Homo sapiens OX=9606 GN=PLEKHG5 PE=1 SV=3	3	DQSPAEKKGLRC
NQSTAIKKGLRC	sp|P23456|L_HANTV	1260	tr|A0A5F9ZHW8|A0A5F9ZHW8_HUMAN Pleckstrin homology domain-containing family G member 5 OS=Homo sapiens OX=9606 GN=PLEKHG5 PE=1 SV=1	46	DQSPAEKKGLRC
NQSTAIKKGLRC	sp|P23456|L_HANTV	1260	tr|Q5SY18|Q5SY18_HUMAN Pleckstrin homology domain-containing family G member 5 OS=Homo sapiens OX=9606 GN=PLEKHG5 PE=1 SV=1	24	DQSPAEKKGLRC
FKFLLLHMEEKM	sp|P23456|L_HANTV	1416	sp|P01160|ANF_HUMAN Natriuretic peptides A OS=Homo sapiens OX=9606 GN=NPPA PE=1 SV=2	40	FKNLLDHLEEKM
FKFLLLHMEEKM	sp|P23456|L_HANTV	1416	tr|A0A087X094|A0A087X094_HUMAN Atrial natriuretic factor OS=Homo sapiens OX=9606 GN=NPPA PE=1 SV=1	40	FKNLLDHLEEKM
LEEILLSAQIFA	sp|P05133|NCAP_HANTV	312	sp|Q7Z7G8|VP13B_HUMAN Vacuolar protein sorting-associated protein 13B OS=Homo sapiens OX=9606 GN=VPS13B PE=1 SV=2	1489	LHEILLSAQAFD
FANYRADSLFVE	sp|P23456|L_HANTV	1226	tr|F8WDH4|F8WDH4_HUMAN Angiomotin-like protein 1 (Fragment) OS=Homo sapiens OX=9606 GN=AMOTL1 PE=1 SV=1	23	FASTRADSEFVE
SLLARTTHLLIP	sp|P23456|L_HANTV	2110	sp|P32241|VIPR1_HUMAN Vasoactive intestinal polypeptide receptor 1 OS=Homo sapiens OX=9606 GN=VIPR1 PE=1 SV=1	337	SRLARSTLLLIP
EVTGKGGVGAVL	sp|P08668|GP_HANTV	900	tr|C9JA25|C9JA25_HUMAN Elongation factor G, mitochondrial (Fragment) OS=Homo sapiens OX=9606 GN=GFM1 PE=1 SV=1	3	EVKGKDGVGAVM
EVTGKGGVGAVL	sp|P08668|GP_HANTV	900	tr|F8WAU4|F8WAU4_HUMAN Elongation factor G, mitochondrial OS=Homo sapiens OX=9606 GN=GFM1 PE=1 SV=1	78	EVKGKDGVGAVM
EVTGKGGVGAVL	sp|P08668|GP_HANTV	900	sp|Q96RP9|EFGM_HUMAN Elongation factor G, mitochondrial OS=Homo sapiens OX=9606 GN=GFM1 PE=1 SV=2	78	EVKGKDGVGAVM
EVTGKGGVGAVL	sp|P08668|GP_HANTV	900	tr|C9IZ01|C9IZ01_HUMAN Elongation factor G, mitochondrial OS=Homo sapiens OX=9606 GN=GFM1 PE=1 SV=1	78	EVKGKDGVGAVM
ADHLAYLLENSL	sp|P23456|L_HANTV	1150	tr|M0R014|M0R014_HUMAN Ryanodine receptor 1 (Fragment) OS=Homo sapiens OX=9606 GN=RYR1 PE=1 SV=1	69	FDHLSYLLENSG
ADHLAYLLENSL	sp|P23456|L_HANTV	1150	sp|P21817|RYR1_HUMAN Ryanodine receptor 1 OS=Homo sapiens OX=9606 GN=RYR1 PE=1 SV=3	2251	FDHLSYLLENSG
ADHLAYLLENSL	sp|P23456|L_HANTV	1150	sp|Q92736|RYR2_HUMAN Ryanodine receptor 2 OS=Homo sapiens OX=9606 GN=RYR2 PE=1 SV=3	2215	FDHLSYLLENSS
ADHLAYLLENSL	sp|P23456|L_HANTV	1150	tr|H7BY35|H7BY35_HUMAN Ryanodine receptor 2 OS=Homo sapiens OX=9606 GN=RYR2 PE=1 SV=2	2199	FDHLSYLLENSS
VSSGTLGGQMSV	sp|P08668|GP_HANTV	930	sp|Q96PD2|DCBD2_HUMAN Discoidin, CUB and LCCL domain-containing protein 2 OS=Homo sapiens OX=9606 GN=DCBLD2 PE=1 SV=1	245	VVSNTLGGQISV
ELVQLNSKINKF	sp|P23456|L_HANTV	1179	sp|Q96FC7|PHIPL_HUMAN Phytanoyl-CoA hydroxylase-interacting protein-like OS=Homo sapiens OX=9606 GN=PHYHIPL PE=1 SV=3	299	RLPQLNSKDNKF
VSPLFFLQHKLS	sp|P23456|L_HANTV	410	tr|C9JM56|C9JM56_HUMAN Solute carrier family 25 member 48 OS=Homo sapiens OX=9606 GN=SLC25A48 PE=3 SV=1	59	VSPLFFLQLKSL
FKLPVDEDSLNK	sp|P23456|L_HANTV	1662	sp|Q9BXU1|STK31_HUMAN Serine/threonine-protein kinase 31 OS=Homo sapiens OX=9606 GN=STK31 PE=2 SV=2	455	FILEVDESSLNK
DASPTISYDALI	sp|P23456|L_HANTV	42	sp|Q12913|PTPRJ_HUMAN Receptor-type tyrosine-protein phosphatase eta OS=Homo sapiens OX=9606 GN=PTPRJ PE=1 SV=3	650	DASPTYSYCLLI
DASPTISYDALI	sp|P23456|L_HANTV	42	tr|A0A087WTK0|A0A087WTK0_HUMAN Protein-tyrosine-phosphatase OS=Homo sapiens OX=9606 GN=PTPRJ PE=1 SV=1	650	DASPTYSYCLLI
DASPTISYDALI	sp|P23456|L_HANTV	42	tr|A0A087WVC6|A0A087WVC6_HUMAN Protein-tyrosine-phosphatase OS=Homo sapiens OX=9606 GN=PTPRJ PE=1 SV=1	650	DASPTYSYCLLI
LKARVHVKLLQK	sp|P23456|L_HANTV	1807	sp|Q6NUP7|PP4R4_HUMAN Serine/threonine-protein phosphatase 4 regulatory subunit 4 OS=Homo sapiens OX=9606 GN=PPP4R4 PE=1 SV=1	498	LKWRTHEKLLQK
VKSKYYISIQVI	sp|P08668|GP_HANTV	478	tr|C9JC21|C9JC21_HUMAN Unconventional myosin-VIIb (Fragment) OS=Homo sapiens OX=9606 GN=MYO7B PE=1 SV=1	44	VKSKKHIPIQVI
VKSKYYISIQVI	sp|P08668|GP_HANTV	478	sp|Q6PIF6|MYO7B_HUMAN Unconventional myosin-VIIb OS=Homo sapiens OX=9606 GN=MYO7B PE=1 SV=2	1191	VKSKKHIPIQVI
VKSKYYISIQVI	sp|P08668|GP_HANTV	478	tr|B9A063|B9A063_HUMAN Unconventional myosin-VIIb OS=Homo sapiens OX=9606 GN=MYO7B PE=1 SV=1	44	VKSKKHIPIQVI
RADHLAYLLENS	sp|P23456|L_HANTV	1149	tr|M0R014|M0R014_HUMAN Ryanodine receptor 1 (Fragment) OS=Homo sapiens OX=9606 GN=RYR1 PE=1 SV=1	68	MFDHLSYLLENS
RADHLAYLLENS	sp|P23456|L_HANTV	1149	sp|P21817|RYR1_HUMAN Ryanodine receptor 1 OS=Homo sapiens OX=9606 GN=RYR1 PE=1 SV=3	2250	MFDHLSYLLENS
RADHLAYLLENS	sp|P23456|L_HANTV	1149	sp|Q92736|RYR2_HUMAN Ryanodine receptor 2 OS=Homo sapiens OX=9606 GN=RYR2 PE=1 SV=3	2214	MFDHLSYLLENS
RADHLAYLLENS	sp|P23456|L_HANTV	1149	tr|H7BY35|H7BY35_HUMAN Ryanodine receptor 2 OS=Homo sapiens OX=9606 GN=RYR2 PE=1 SV=2	2198	MFDHLSYLLENS
PSNITSHLSWFQ	sp|P23456|L_HANTV	767	sp|O15389|SIGL5_HUMAN Sialic acid-binding Ig-like lectin 5 OS=Homo sapiens OX=9606 GN=SIGLEC5 PE=1 SV=1	272	PSNPPAHLSWFQ
LILEFEEKFKGF	sp|P23456|L_HANTV	508	sp|Q9HB65|ELL3_HUMAN RNA polymerase II elongation factor ELL3 OS=Homo sapiens OX=9606 GN=ELL3 PE=1 SV=2	386	LILEFEEKNRGS
DHLAYLLENSLS	sp|P23456|L_HANTV	1151	tr|M0R014|M0R014_HUMAN Ryanodine receptor 1 (Fragment) OS=Homo sapiens OX=9606 GN=RYR1 PE=1 SV=1	70	DHLSYLLENSGI
DHLAYLLENSLS	sp|P23456|L_HANTV	1151	sp|P21817|RYR1_HUMAN Ryanodine receptor 1 OS=Homo sapiens OX=9606 GN=RYR1 PE=1 SV=3	2252	DHLSYLLENSGI
DHLAYLLENSLS	sp|P23456|L_HANTV	1151	sp|Q92736|RYR2_HUMAN Ryanodine receptor 2 OS=Homo sapiens OX=9606 GN=RYR2 PE=1 SV=3	2216	DHLSYLLENSSV
DHLAYLLENSLS	sp|P23456|L_HANTV	1151	tr|H7BY35|H7BY35_HUMAN Ryanodine receptor 2 OS=Homo sapiens OX=9606 GN=RYR2 PE=1 SV=2	2200	DHLSYLLENSSV
QSTAIKKGLRCY	sp|P23456|L_HANTV	1261	sp|O94827|PKHG5_HUMAN Pleckstrin homology domain-containing family G member 5 OS=Homo sapiens OX=9606 GN=PLEKHG5 PE=1 SV=3	4	QSPAEKKGLRCQ
QSTAIKKGLRCY	sp|P23456|L_HANTV	1261	tr|A0A5F9ZHW8|A0A5F9ZHW8_HUMAN Pleckstrin homology domain-containing family G member 5 OS=Homo sapiens OX=9606 GN=PLEKHG5 PE=1 SV=1	47	QSPAEKKGLRCQ
QSTAIKKGLRCY	sp|P23456|L_HANTV	1261	tr|Q5SY18|Q5SY18_HUMAN Pleckstrin homology domain-containing family G member 5 OS=Homo sapiens OX=9606 GN=PLEKHG5 PE=1 SV=1	25	QSPAEKKGLRCQ
ETFLVIAILLRR	sp|P05133|NCAP_HANTV	43	tr|H3BN18|H3BN18_HUMAN NADPH oxidase organizer 1 (Fragment) OS=Homo sapiens OX=9606 GN=NOXO1 PE=1 SV=1	54	ETFPVEAGLLRR
ETFLVIAILLRR	sp|P05133|NCAP_HANTV	43	sp|Q8NFA2|NOXO1_HUMAN NADPH oxidase organizer 1 OS=Homo sapiens OX=9606 GN=NOXO1 PE=1 SV=1	54	ETFPVEAGLLRR
NVGLLLDLTGGV	sp|P23456|L_HANTV	174	sp|Q6S8J3|POTEE_HUMAN POTE ankyrin domain family member E OS=Homo sapiens OX=9606 GN=POTEE PE=2 SV=3	426	NVGLLENLTNGV
NVGLLLDLTGGV	sp|P23456|L_HANTV	174	sp|A5A3E0|POTEF_HUMAN POTE ankyrin domain family member F OS=Homo sapiens OX=9606 GN=POTEF PE=1 SV=2	426	NVGLLENLTNGV
LSVHNVGLLLDL	sp|P23456|L_HANTV	170	sp|P38435|VKGC_HUMAN Vitamin K-dependent gamma-carboxylase OS=Homo sapiens OX=9606 GN=GGCX PE=1 SV=2	253	LVVHWGGLLLDL
SFRVRMPDRITE	sp|P23456|L_HANTV	1535	tr|H3BV22|H3BV22_HUMAN Serine/threonine-protein phosphatase (Fragment) OS=Homo sapiens OX=9606 GN=PPP4C PE=1 SV=1	65	LFRVRYPDRITL
SFRVRMPDRITE	sp|P23456|L_HANTV	1535	tr|H3BTA2|H3BTA2_HUMAN Serine/threonine-protein phosphatase (Fragment) OS=Homo sapiens OX=9606 GN=PPP4C PE=1 SV=1	65	LFRVRYPDRITL
KSFRVRMPDRIT	sp|P23456|L_HANTV	1534	tr|H3BV22|H3BV22_HUMAN Serine/threonine-protein phosphatase (Fragment) OS=Homo sapiens OX=9606 GN=PPP4C PE=1 SV=1	64	ELFRVRYPDRIT
KSFRVRMPDRIT	sp|P23456|L_HANTV	1534	tr|H3BTA2|H3BTA2_HUMAN Serine/threonine-protein phosphatase (Fragment) OS=Homo sapiens OX=9606 GN=PPP4C PE=1 SV=1	64	ELFRVRYPDRIT
ANYRADSLFVEA	sp|P23456|L_HANTV	1227	tr|F8WDH4|F8WDH4_HUMAN Angiomotin-like protein 1 (Fragment) OS=Homo sapiens OX=9606 GN=AMOTL1 PE=1 SV=1	24	ASTRADSEFVEA
LDEHVKSSNWAR	sp|P23456|L_HANTV	1351	tr|C9J0Q4|C9J0Q4_HUMAN E3 ubiquitin-protein ligase RAD18 (Fragment) OS=Homo sapiens OX=9606 GN=RAD18 PE=1 SV=8	78	LDELVKSLNFAR
LDEHVKSSNWAR	sp|P23456|L_HANTV	1351	sp|Q9NS91|RAD18_HUMAN E3 ubiquitin-protein ligase RAD18 OS=Homo sapiens OX=9606 GN=RAD18 PE=1 SV=2	78	LDELVKSLNFAR
LDEHVKSSNWAR	sp|P23456|L_HANTV	1351	tr|F8WE49|F8WE49_HUMAN RING-type E3 ubiquitin transferase RAD18 OS=Homo sapiens OX=9606 GN=RAD18 PE=1 SV=1	78	LDELVKSLNFAR
FEVTGKGGVGAV	sp|P08668|GP_HANTV	899	tr|C9JA25|C9JA25_HUMAN Elongation factor G, mitochondrial (Fragment) OS=Homo sapiens OX=9606 GN=GFM1 PE=1 SV=1	2	HEVKGKDGVGAV
FEVTGKGGVGAV	sp|P08668|GP_HANTV	899	tr|F8WAU4|F8WAU4_HUMAN Elongation factor G, mitochondrial OS=Homo sapiens OX=9606 GN=GFM1 PE=1 SV=1	77	HEVKGKDGVGAV
FEVTGKGGVGAV	sp|P08668|GP_HANTV	899	sp|Q96RP9|EFGM_HUMAN Elongation factor G, mitochondrial OS=Homo sapiens OX=9606 GN=GFM1 PE=1 SV=2	77	HEVKGKDGVGAV
FEVTGKGGVGAV	sp|P08668|GP_HANTV	899	tr|C9IZ01|C9IZ01_HUMAN Elongation factor G, mitochondrial OS=Homo sapiens OX=9606 GN=GFM1 PE=1 SV=1	77	HEVKGKDGVGAV
QLEEILLSAQIF	sp|P05133|NCAP_HANTV	311	sp|Q7Z7G8|VP13B_HUMAN Vacuolar protein sorting-associated protein 13B OS=Homo sapiens OX=9606 GN=VPS13B PE=1 SV=2	1488	FLHEILLSAQAF
GVLALVALRRPG	sp|P23456|L_HANTV	605	sp|A6NL88|SHSA7_HUMAN Protein shisa-7 OS=Homo sapiens OX=9606 GN=SHISA7 PE=2 SV=3	345	GTLPLHALRRPG
SRTDVLDSVGIG	sp|P05133|NCAP_HANTV	389	sp|Q96LR2|LURA1_HUMAN Leucine rich adaptor protein 1 OS=Homo sapiens OX=9606 GN=LURAP1 PE=1 SV=1	134	STTDRLDSVSIG
EKKIRAKAYSKG	sp|P23456|L_HANTV	2122	sp|O95365|ZBT7A_HUMAN Zinc finger and BTB domain-containing protein 7A OS=Homo sapiens OX=9606 GN=ZBTB7A PE=1 SV=1	373	EKKIRAKAFQKC
PEKKIRAKAYSK	sp|P23456|L_HANTV	2121	sp|O95365|ZBT7A_HUMAN Zinc finger and BTB domain-containing protein 7A OS=Homo sapiens OX=9606 GN=ZBTB7A PE=1 SV=1	372	VEKKIRAKAFQK
CLQFRALLEELI	sp|P23456|L_HANTV	1317	sp|Q9Y6X0|SETBP_HUMAN SET-binding protein OS=Homo sapiens OX=9606 GN=SETBP1 PE=1 SV=3	950	DLQFLADLEELI
ALFGVNAFPAEN	sp|P08668|GP_HANTV	582	sp|Q9BQD1|MCHL2_HUMAN Putative pro-MCH-like protein 2 OS=Homo sapiens OX=9606 GN=PMCHL2 PE=5 SV=1	28	ALEGSVAFPAEN
ALFGVNAFPAEN	sp|P08668|GP_HANTV	582	sp|Q16048|MCHL1_HUMAN Putative pro-MCH-like protein 1 OS=Homo sapiens OX=9606 GN=PMCHL1 PE=5 SV=2	28	ALEGSVAFPAEN
ALFGVNAFPAEN	sp|P08668|GP_HANTV	582	sp|P20382|MCH_HUMAN Pro-MCH OS=Homo sapiens OX=9606 GN=PMCH PE=1 SV=3	107	ALKGSVAFPAEN
FRVRMPDRITES	sp|P23456|L_HANTV	1536	tr|H3BV22|H3BV22_HUMAN Serine/threonine-protein phosphatase (Fragment) OS=Homo sapiens OX=9606 GN=PPP4C PE=1 SV=1	66	FRVRYPDRITLI
FRVRMPDRITES	sp|P23456|L_HANTV	1536	tr|H3BTA2|H3BTA2_HUMAN Serine/threonine-protein phosphatase (Fragment) OS=Homo sapiens OX=9606 GN=PPP4C PE=1 SV=1	66	FRVRYPDRITLI
ESSVFLKFNVSN	sp|P08668|GP_HANTV	277	sp|Q96EW2|HBAP1_HUMAN HSPB1-associated protein 1 OS=Homo sapiens OX=9606 GN=HSPBAP1 PE=1 SV=1	213	ESSVFSKINVVN
SLVSPLFFLQHK	sp|P23456|L_HANTV	408	tr|C9JM56|C9JM56_HUMAN Solute carrier family 25 member 48 OS=Homo sapiens OX=9606 GN=SLC25A48 PE=3 SV=1	57	WAVSPLFFLQLK
