query	query_seqname	query_start	target_seqname	target_start	target
SGVFFIQMASAD	sp|P08543|RIR1_HHV11	6	tr|H0YBR2|H0YBR2_HUMAN Epithelial-splicing regulatory protein 1 (Fragment) OS=Homo sapiens OX=9606 GN=ESRP1 PE=1 SV=1	354	SGDAFIQMKSAD
SGVFFIQMASAD	sp|P08543|RIR1_HHV11	6	tr|H0YBB3|H0YBB3_HUMAN Epithelial-splicing regulatory protein 1 (Fragment) OS=Homo sapiens OX=9606 GN=ESRP1 PE=1 SV=1	347	SGDAFIQMKSAD
SGVFFIQMASAD	sp|P08543|RIR1_HHV11	6	sp|Q6NXG1|ESRP1_HUMAN Epithelial splicing regulatory protein 1 OS=Homo sapiens OX=9606 GN=ESRP1 PE=1 SV=2	488	SGDAFIQMKSAD
SGVFFIQMASAD	sp|P08543|RIR1_HHV11	6	tr|A0A2U3TZN9|A0A2U3TZN9_HUMAN Epithelial splicing regulatory protein 1 OS=Homo sapiens OX=9606 GN=ESRP1 PE=1 SV=1	488	SGDAFIQMKSAD
RRGRAPPRGPRR	sp|P04487|RNB_HHV11	3	sp|Q12870|TCF15_HUMAN Transcription factor 15 OS=Homo sapiens OX=9606 GN=TCF15 PE=2 SV=3	188	VRGVAPLRGPRR
LDVSASMVGIAL	sp|P10234|DUT_HHV11	57	tr|A0A087WT60|A0A087WT60_HUMAN Parkin coregulated gene protein OS=Homo sapiens OX=9606 GN=PACRG PE=1 SV=1	81	LVVSAEMVGKAL
LDVSASMVGIAL	sp|P10234|DUT_HHV11	57	sp|Q96M98|PACRG_HUMAN Parkin coregulated gene protein OS=Homo sapiens OX=9606 GN=PACRG PE=1 SV=2	175	LVVSAEMVGKAL
LDVSASMVGIAL	sp|P10234|DUT_HHV11	57	tr|H0YGE0|H0YGE0_HUMAN Parkin coregulated gene protein (Fragment) OS=Homo sapiens OX=9606 GN=PACRG PE=1 SV=1	91	LVVSAEMVGKAL
LDVSASMVGIAL	sp|P10234|DUT_HHV11	57	tr|H0YFE8|H0YFE8_HUMAN Parkin coregulated gene protein (Fragment) OS=Homo sapiens OX=9606 GN=PACRG PE=1 SV=1	33	LVVSAEMVGKAL
LDVSASMVGIAL	sp|P10234|DUT_HHV11	57	tr|H7C5A6|H7C5A6_HUMAN Inter-alpha-trypsin inhibitor heavy chain H5 (Fragment) OS=Homo sapiens OX=9606 GN=ITIH5 PE=1 SV=1	78	LDSSASMVGTKL
LDVSASMVGIAL	sp|P10234|DUT_HHV11	57	sp|Q86UX2|ITIH5_HUMAN Inter-alpha-trypsin inhibitor heavy chain H5 OS=Homo sapiens OX=9606 GN=ITIH5 PE=2 SV=2	300	LDSSASMVGTKL
LDVSASMVGIAL	sp|P10234|DUT_HHV11	57	tr|C9J2H1|C9J2H1_HUMAN Inter-alpha-trypsin inhibitor heavy chain H5 OS=Homo sapiens OX=9606 GN=ITIH5 PE=1 SV=2	300	LDSSASMVGTKL
LDVSASMVGIAL	sp|P10234|DUT_HHV11	57	tr|A0A096LP62|A0A096LP62_HUMAN Inter-alpha-trypsin inhibitor heavy chain H5 OS=Homo sapiens OX=9606 GN=ITIH5 PE=1 SV=1	86	LDSSASMVGTKL
LDVSASMVGIAL	sp|P10234|DUT_HHV11	57	tr|G5E9D8|G5E9D8_HUMAN Inter-alpha (Globulin) inhibitor H5, isoform CRA_e OS=Homo sapiens OX=9606 GN=ITIH5 PE=1 SV=1	300	LDSSASMVGTKL
LRGLTKKQALNA	sp|P04293|DPOL_HHV11	1009	tr|A0A6I8PIT3|A0A6I8PIT3_HUMAN Leucyl-tRNA synthetase OS=Homo sapiens OX=9606 GN=LARS1 PE=1 SV=1	403	LRDLKKKQALRA
LRGLTKKQALNA	sp|P04293|DPOL_HHV11	1009	tr|A0A6I8PTV8|A0A6I8PTV8_HUMAN Leucyl-tRNA synthetase OS=Homo sapiens OX=9606 GN=LARS1 PE=1 SV=1	403	LRDLKKKQALRA
LRGLTKKQALNA	sp|P04293|DPOL_HHV11	1009	tr|A0A6I8PIP7|A0A6I8PIP7_HUMAN Leucyl-tRNA synthetase OS=Homo sapiens OX=9606 GN=LARS1 PE=1 SV=1	403	LRDLKKKQALRA
LRGLTKKQALNA	sp|P04293|DPOL_HHV11	1009	tr|A0A6I8PLB3|A0A6I8PLB3_HUMAN Leucyl-tRNA synthetase OS=Homo sapiens OX=9606 GN=LARS1 PE=1 SV=1	251	LRDLKKKQALRA
LRGLTKKQALNA	sp|P04293|DPOL_HHV11	1009	sp|Q9P2J5|SYLC_HUMAN Leucine--tRNA ligase, cytoplasmic OS=Homo sapiens OX=9606 GN=LARS1 PE=1 SV=2	403	LRDLKKKQALRA
LRGLTKKQALNA	sp|P04293|DPOL_HHV11	1009	tr|A0A6I8PS05|A0A6I8PS05_HUMAN Leucyl-tRNA synthetase OS=Homo sapiens OX=9606 GN=LARS1 PE=1 SV=1	276	LRDLKKKQALRA
LRGLTKKQALNA	sp|P04293|DPOL_HHV11	1009	tr|B4DER1|B4DER1_HUMAN Leucyl-tRNA synthetase OS=Homo sapiens OX=9606 GN=LARS1 PE=1 SV=1	376	LRDLKKKQALRA
LRGLTKKQALNA	sp|P04293|DPOL_HHV11	1009	tr|A0A6I8PL42|A0A6I8PL42_HUMAN Leucyl-tRNA synthetase OS=Homo sapiens OX=9606 GN=LARS1 PE=1 SV=1	357	LRDLKKKQALRA
LRGLTKKQALNA	sp|P04293|DPOL_HHV11	1009	tr|A0A6I8PLB8|A0A6I8PLB8_HUMAN Leucyl-tRNA synthetase OS=Homo sapiens OX=9606 GN=LARS1 PE=1 SV=1	403	LRDLKKKQALRA
LRGLTKKQALNA	sp|P04293|DPOL_HHV11	1009	tr|A0A6I8PIV1|A0A6I8PIV1_HUMAN Leucyl-tRNA synthetase OS=Homo sapiens OX=9606 GN=LARS1 PE=1 SV=1	403	LRDLKKKQALRA
LRGLTKKQALNA	sp|P04293|DPOL_HHV11	1009	tr|A0A6I8PRS0|A0A6I8PRS0_HUMAN Leucyl-tRNA synthetase OS=Homo sapiens OX=9606 GN=LARS1 PE=1 SV=1	349	LRDLKKKQALRA
LRGLTKKQALNA	sp|P04293|DPOL_HHV11	1009	tr|A0A6I8PRU9|A0A6I8PRU9_HUMAN Leucyl-tRNA synthetase OS=Homo sapiens OX=9606 GN=LARS1 PE=1 SV=1	403	LRDLKKKQALRA
AREEAEQASPIR	sp|P10238|ICP27_HHV11	107	sp|Q494R4|CC153_HUMAN Coiled-coil domain-containing protein 153 OS=Homo sapiens OX=9606 GN=CCDC153 PE=1 SV=2	126	AREEAEQALGER
PSALAAARGRAA	sp|P08392|ICP4_HHV11	446	tr|K7ENT7|K7ENT7_HUMAN Serine/threonine-protein kinase WNK4 OS=Homo sapiens OX=9606 GN=WNK4 PE=1 SV=1	423	PQALAAHGGRAA
SPRPNLAPGVTP	sp|P10228|GC_HHV11	7	tr|C9K0M5|C9K0M5_HUMAN Phosphatidylinositol 4,5-bisphosphate 5-phosphatase A (Fragment) OS=Homo sapiens OX=9606 GN=INPP5J PE=1 SV=1	14	SPRPILAPLCTP
SPRPNLAPGVTP	sp|P10228|GC_HHV11	7	sp|Q15735|PI5PA_HUMAN Phosphatidylinositol 4,5-bisphosphate 5-phosphatase A OS=Homo sapiens OX=9606 GN=INPP5J PE=1 SV=3	81	SPRPILAPLCTP
SPRPNLAPGVTP	sp|P10228|GC_HHV11	7	tr|B4DF95|B4DF95_HUMAN Phosphatidylinositol 4,5-bisphosphate 5-phosphatase A OS=Homo sapiens OX=9606 GN=INPP5J PE=1 SV=1	14	SPRPILAPLCTP
DQIYRPLSQDPA	sp|P10225|SHUT_HHV11	451	tr|A2A2V2|A2A2V2_HUMAN RNA-binding protein 34 (Fragment) OS=Homo sapiens OX=9606 GN=RBM34 PE=1 SV=1	90	SQIERPLSQEPA
DQIYRPLSQDPA	sp|P10225|SHUT_HHV11	451	sp|P42696|RBM34_HUMAN RNA-binding protein 34 OS=Homo sapiens OX=9606 GN=RBM34 PE=1 SV=2	92	SQIERPLSQEPA
DQIYRPLSQDPA	sp|P10225|SHUT_HHV11	451	tr|Q5TCT4|Q5TCT4_HUMAN RNA-binding protein 34 (Fragment) OS=Homo sapiens OX=9606 GN=RBM34 PE=1 SV=1	92	SQIERPLSQEPA
QGSPASPAPAGA	sp|P08393|ICP0_HHV11	387	sp|Q504T8|MIDN_HUMAN Midnolin OS=Homo sapiens OX=9606 GN=MIDN PE=1 SV=2	335	QCSPASPAPDLA
ALRARAPWALAR	sp|P36313|ICP34_HHV11	155	tr|A0A024R7N8|A0A024R7N8_HUMAN Ceramide synthase 1 OS=Homo sapiens OX=9606 GN=CERS1 PE=3 SV=1	218	ALRPRAPAACAR
ALRARAPWALAR	sp|P36313|ICP34_HHV11	155	sp|P27539|GDF1_HUMAN Embryonic growth/differentiation factor 1 OS=Homo sapiens OX=9606 GN=GDF1 PE=2 SV=2	218	ALRPRAPAACAR
ALRARAPWALAR	sp|P36313|ICP34_HHV11	155	tr|A0A0A0MR43|A0A0A0MR43_HUMAN Vascular endothelial growth factor A OS=Homo sapiens OX=9606 GN=VEGFA PE=1 SV=1	130	APAARAPQALAR
ALRARAPWALAR	sp|P36313|ICP34_HHV11	155	tr|A0A0A0MRQ4|A0A0A0MRQ4_HUMAN Vascular endothelial growth factor A OS=Homo sapiens OX=9606 GN=VEGFA PE=1 SV=1	130	APAARAPQALAR
ALRARAPWALAR	sp|P36313|ICP34_HHV11	155	tr|A0A0A0MSI7|A0A0A0MSI7_HUMAN Vascular endothelial growth factor A OS=Homo sapiens OX=9606 GN=VEGFA PE=1 SV=1	130	APAARAPQALAR
ALRARAPWALAR	sp|P36313|ICP34_HHV11	155	tr|H0YBZ0|H0YBZ0_HUMAN Vascular endothelial growth factor A (Fragment) OS=Homo sapiens OX=9606 GN=VEGFA PE=1 SV=1	102	APAARAPQALAR
ALRARAPWALAR	sp|P36313|ICP34_HHV11	155	tr|A0A0A0MSH5|A0A0A0MSH5_HUMAN Vascular endothelial growth factor A OS=Homo sapiens OX=9606 GN=VEGFA PE=1 SV=1	130	APAARAPQALAR
ALRARAPWALAR	sp|P36313|ICP34_HHV11	155	tr|J3KPA4|J3KPA4_HUMAN Vascular endothelial growth factor A OS=Homo sapiens OX=9606 GN=VEGFA PE=1 SV=1	130	APAARAPQALAR
ALRARAPWALAR	sp|P36313|ICP34_HHV11	155	tr|H3BLW8|H3BLW8_HUMAN Vascular endothelial growth factor A OS=Homo sapiens OX=9606 GN=VEGFA PE=1 SV=1	130	APAARAPQALAR
ALRARAPWALAR	sp|P36313|ICP34_HHV11	155	tr|A0A5F9ZH41|A0A5F9ZH41_HUMAN Vascular endothelial growth factor A OS=Homo sapiens OX=9606 GN=VEGFA PE=1 SV=1	130	APAARAPQALAR
ALRARAPWALAR	sp|P36313|ICP34_HHV11	155	tr|A0A0A0MTB2|A0A0A0MTB2_HUMAN Vascular endothelial growth factor A OS=Homo sapiens OX=9606 GN=VEGFA PE=1 SV=1	130	APAARAPQALAR
ALRARAPWALAR	sp|P36313|ICP34_HHV11	155	tr|A0A0A0MSH7|A0A0A0MSH7_HUMAN Vascular endothelial growth factor A OS=Homo sapiens OX=9606 GN=VEGFA PE=1 SV=1	130	APAARAPQALAR
ADTVVLPTCRTT	sp|P10220|LTP_HHV11	2594	tr|C9J7Z4|C9J7Z4_HUMAN tRNA-intron endonuclease Sen2 (Fragment) OS=Homo sapiens OX=9606 GN=TSEN2 PE=1 SV=1	331	AFTVVQPTFRTT
ADTVVLPTCRTT	sp|P10220|LTP_HHV11	2594	sp|Q8NCE0|SEN2_HUMAN tRNA-splicing endonuclease subunit Sen2 OS=Homo sapiens OX=9606 GN=TSEN2 PE=1 SV=2	331	AFTVVQPTFRTT
ARRANPLLVSDE	sp|P10189|HELI_HHV11	265	sp|Q460N5|PAR14_HUMAN Protein mono-ADP-ribosyltransferase PARP14 OS=Homo sapiens OX=9606 GN=PARP14 PE=1 SV=3	1187	ARRANGNLVSDK
ARRANPLLVSDE	sp|P10189|HELI_HHV11	265	tr|H7C5R8|H7C5R8_HUMAN Protein mono-ADP-ribosyltransferase PARP14 (Fragment) OS=Homo sapiens OX=9606 GN=PARP14 PE=1 SV=1	1028	ARRANGNLVSDK
GVAALGPARLQL	sp|P10190|PORTL_HHV11	1	sp|Q9BZJ7|GPR62_HUMAN G-protein coupled receptor 62 OS=Homo sapiens OX=9606 GN=GPR62 PE=1 SV=2	105	GVAALGLARYRL
GQESRSPIATRE	sp|P10228|GC_HHV11	209	sp|Q9C0C2|TB182_HUMAN 182 kDa tankyrase-1-binding protein OS=Homo sapiens OX=9606 GN=TNKS1BP1 PE=1 SV=4	598	GQESPLPLATRE
RADDGPGTEAAA	sp|P10238|ICP27_HHV11	287	tr|J3KSW8|J3KSW8_HUMAN Myosin phosphatase Rho-interacting protein (Fragment) OS=Homo sapiens OX=9606 GN=MPRIP PE=1 SV=1	406	DATDGPGTEDAA
RADDGPGTEAAA	sp|P10238|ICP27_HHV11	287	sp|Q6WCQ1|MPRIP_HUMAN Myosin phosphatase Rho-interacting protein OS=Homo sapiens OX=9606 GN=MPRIP PE=1 SV=3	600	DATDGPGTEDAA
RADDGPGTEAAA	sp|P10238|ICP27_HHV11	287	tr|H0Y2S9|H0Y2S9_HUMAN Myosin phosphatase Rho-interacting protein (Fragment) OS=Homo sapiens OX=9606 GN=MPRIP PE=1 SV=3	87	DATDGPGTEDAA
RADDGPGTEAAA	sp|P10238|ICP27_HHV11	287	tr|A0A494BZV2|A0A494BZV2_HUMAN Myosin phosphatase Rho-interacting protein OS=Homo sapiens OX=9606 GN=MPRIP PE=1 SV=1	718	DATDGPGTEDAA
LTSGFLRPELAI	sp|P08392|ICP4_HHV11	721	tr|H0YDB0|H0YDB0_HUMAN Gasdermin-D (Fragment) OS=Homo sapiens OX=9606 GN=GSDMD PE=1 SV=1	54	LSSGMLVPELAI
LTSGFLRPELAI	sp|P08392|ICP4_HHV11	721	sp|P57764|GSDMD_HUMAN Gasdermin-D OS=Homo sapiens OX=9606 GN=GSDMD PE=1 SV=1	358	LSSGMLVPELAI
LTSGFLRPELAI	sp|P08392|ICP4_HHV11	721	tr|G3V1A6|G3V1A6_HUMAN Gasdermin domain containing 1, isoform CRA_d OS=Homo sapiens OX=9606 GN=GSDMD PE=1 SV=1	406	LSSGMLVPELAI
TAPNYFPAAERP	sp|P10204|UL20_HHV11	146	sp|Q8WZA9|IRGQ_HUMAN Immunity-related GTPase family Q protein OS=Homo sapiens OX=9606 GN=IRGQ PE=1 SV=1	259	TAPTPFPAPERP
PPRAGATDASAA	sp|P0DTH5|KITH_HHV11	356	sp|Q8IVV7|GID4_HUMAN Glucose-induced degradation protein 4 homolog OS=Homo sapiens OX=9606 GN=GID4 PE=1 SV=1	91	PPPAGASAASAA
PPRAGATDASAA	sp|P0DTH5|KITH_HHV11	356	tr|K4DI96|K4DI96_HUMAN Glucose-induced degradation protein 4 homolog OS=Homo sapiens OX=9606 GN=GID4 PE=1 SV=1	91	PPPAGASAASAA
CTYASAVFPYLG	sp|P10201|CVC1_HHV11	424	sp|O00548|DLL1_HUMAN Delta-like protein 1 OS=Homo sapiens OX=9606 GN=DLL1 PE=1 SV=2	77	CTYGSAVTPVLG
LLLGSPRVAAGA	sp|P10221|ITP_HHV11	1027	sp|Q6ZRF8|RN207_HUMAN RING finger protein 207 OS=Homo sapiens OX=9606 GN=RNF207 PE=1 SV=2	354	LLLGPRRVAAAA
LLLGSPRVAAGA	sp|P10221|ITP_HHV11	1027	tr|H3BLV4|H3BLV4_HUMAN Sushi domain-containing protein 1 (Fragment) OS=Homo sapiens OX=9606 GN=SUSD1 PE=1 SV=1	3	LLLGLARGAAGA
LLLGSPRVAAGA	sp|P10221|ITP_HHV11	1027	tr|F8WAQ1|F8WAQ1_HUMAN Sushi domain-containing protein 1 OS=Homo sapiens OX=9606 GN=SUSD1 PE=1 SV=1	19	LLLGLARGAAGA
LLLGSPRVAAGA	sp|P10221|ITP_HHV11	1027	sp|Q6UWL2|SUSD1_HUMAN Sushi domain-containing protein 1 OS=Homo sapiens OX=9606 GN=SUSD1 PE=1 SV=1	19	LLLGLARGAAGA
LLLGSPRVAAGA	sp|P10221|ITP_HHV11	1027	sp|Q643R3|LPCT4_HUMAN Lysophospholipid acyltransferase LPCAT4 OS=Homo sapiens OX=9606 GN=LPCAT4 PE=1 SV=1	439	LLLGSPHPAATA
LLLGSPRVAAGA	sp|P10221|ITP_HHV11	1027	tr|A0A0C4DGT4|A0A0C4DGT4_HUMAN Lysophospholipid acyltransferase LPCAT4 OS=Homo sapiens OX=9606 GN=LPCAT4 PE=1 SV=1	266	LLLGSPHPAATA
VVDALLLGVLAP	sp|P10220|LTP_HHV11	2020	tr|D6RBR4|D6RBR4_HUMAN Arylsulfatase K OS=Homo sapiens OX=9606 GN=ARSK PE=1 SV=1	8	VVAALALAVLAP
VVDALLLGVLAP	sp|P10220|LTP_HHV11	2020	tr|E9PGI0|E9PGI0_HUMAN Arylsulfatase K OS=Homo sapiens OX=9606 GN=ARSK PE=1 SV=1	8	VVAALALAVLAP
VVDALLLGVLAP	sp|P10220|LTP_HHV11	2020	sp|Q6UWY0|ARSK_HUMAN Arylsulfatase K OS=Homo sapiens OX=9606 GN=ARSK PE=1 SV=1	8	VVAALALAVLAP
VVDALLLGVLAP	sp|P10220|LTP_HHV11	2020	tr|D6R9F9|D6R9F9_HUMAN Arylsulfatase K OS=Homo sapiens OX=9606 GN=ARSK PE=4 SV=1	8	VVAALALAVLAP
DSLPSALGLWLL	sp|P04290|UL13_HHV11	130	tr|H3BU51|H3BU51_HUMAN Neuroplastin OS=Homo sapiens OX=9606 GN=NPTN PE=1 SV=1	4	SSLPSALALSLL
DSLPSALGLWLL	sp|P04290|UL13_HHV11	130	sp|Q9Y639|NPTN_HUMAN Neuroplastin OS=Homo sapiens OX=9606 GN=NPTN PE=1 SV=2	4	SSLPSALALSLL
VKPQADTLKITD	sp|P10211|GB_HHV11	776	tr|G5E9C5|G5E9C5_HUMAN Phosphodiesterase OS=Homo sapiens OX=9606 GN=PDE5A PE=1 SV=1	495	VVPSAQTLKITD
VKPQADTLKITD	sp|P10211|GB_HHV11	776	sp|O76074|PDE5A_HUMAN cGMP-specific 3',5'-cyclic phosphodiesterase OS=Homo sapiens OX=9606 GN=PDE5A PE=1 SV=2	547	VVPSAQTLKITD
PALAPEMAHASG	sp|P04288|GM_HHV11	47	tr|A0A499FJE4|A0A499FJE4_HUMAN RIPOR family member 3 OS=Homo sapiens OX=9606 GN=RIPOR3 PE=1 SV=1	453	PGLLPEMAHLSG
PALAPEMAHASG	sp|P04288|GM_HHV11	47	sp|Q96MK2|RIPR3_HUMAN RIPOR family member 3 OS=Homo sapiens OX=9606 GN=RIPOR3 PE=1 SV=4	449	PGLLPEMAHLSG
CKLREPLAPADR	sp|P10209|CVC2_HHV11	401	sp|Q2WGJ9|FR1L6_HUMAN Fer-1-like protein 6 OS=Homo sapiens OX=9606 GN=FER1L6 PE=2 SV=2	1090	CKLREPLAPITQ
VAAELPLRAGGA	sp|O09800|GN_HHV11	4	sp|P49247|RPIA_HUMAN Ribose-5-phosphate isomerase OS=Homo sapiens OX=9606 GN=RPIA PE=1 SV=3	14	VLAPLPGRAGGA
VAAELPLRAGGA	sp|O09800|GN_HHV11	4	sp|Q7RTS3|PTF1A_HUMAN Pancreas transcription factor 1 subunit alpha OS=Homo sapiens OX=9606 GN=PTF1A PE=1 SV=1	219	VQADLPLRGGGA
PGTEAAAPSWPT	sp|P10238|ICP27_HHV11	292	sp|Q96RK0|CIC_HUMAN Protein capicua homolog OS=Homo sapiens OX=9606 GN=CIC PE=1 SV=2	846	PGTKAAAPSGPA
PGTEAAAPSWPT	sp|P10238|ICP27_HHV11	292	tr|I3L2J0|I3L2J0_HUMAN Protein capicua homolog OS=Homo sapiens OX=9606 GN=CIC PE=1 SV=1	1755	PGTKAAAPSGPA
PGTEAAAPSWPT	sp|P10238|ICP27_HHV11	292	tr|A0A0A0MQR4|A0A0A0MQR4_HUMAN Protein capicua homolog OS=Homo sapiens OX=9606 GN=CIC PE=1 SV=1	846	PGTKAAAPSGPA
IPYPLLFLPLLI	sp|P06492|VP16_HHV11	123	sp|Q16821|PPR3A_HUMAN Protein phosphatase 1 regulatory subunit 3A OS=Homo sapiens OX=9606 GN=PPP1R3A PE=1 SV=3	1076	IPYFLLFLIFLI
LESRDVSFRGEA	sp|P06486|US10_HHV11	79	tr|I3L3P0|I3L3P0_HUMAN Membrane-associated tyrosine- and threonine-specific cdc2-inhibitory kinase (Fragment) OS=Homo sapiens OX=9606 GN=PKMYT1 PE=1 SV=1	77	LQPRRVSFRGEA
LESRDVSFRGEA	sp|P06486|US10_HHV11	79	tr|I3L1H7|I3L1H7_HUMAN Membrane-associated tyrosine- and threonine-specific cdc2-inhibitory kinase (Fragment) OS=Homo sapiens OX=9606 GN=PKMYT1 PE=1 SV=1	77	LQPRRVSFRGEA
LESRDVSFRGEA	sp|P06486|US10_HHV11	79	tr|I3L4K3|I3L4K3_HUMAN Membrane-associated tyrosine- and threonine-specific cdc2-inhibitory kinase (Fragment) OS=Homo sapiens OX=9606 GN=PKMYT1 PE=1 SV=1	77	LQPRRVSFRGEA
LESRDVSFRGEA	sp|P06486|US10_HHV11	79	tr|I3L136|I3L136_HUMAN Membrane-associated tyrosine- and threonine-specific cdc2-inhibitory kinase (Fragment) OS=Homo sapiens OX=9606 GN=PKMYT1 PE=1 SV=8	68	LQPRRVSFRGEA
LESRDVSFRGEA	sp|P06486|US10_HHV11	79	tr|A6NHV6|A6NHV6_HUMAN Membrane-associated tyrosine- and threonine-specific cdc2-inhibitory kinase OS=Homo sapiens OX=9606 GN=PKMYT1 PE=1 SV=3	68	LQPRRVSFRGEA
LESRDVSFRGEA	sp|P06486|US10_HHV11	79	sp|Q99640|PMYT1_HUMAN Membrane-associated tyrosine- and threonine-specific cdc2-inhibitory kinase OS=Homo sapiens OX=9606 GN=PKMYT1 PE=1 SV=1	77	LQPRRVSFRGEA
LESRDVSFRGEA	sp|P06486|US10_HHV11	79	tr|B4DZM6|B4DZM6_HUMAN Membrane-associated tyrosine- and threonine-specific cdc2-inhibitory kinase OS=Homo sapiens OX=9606 GN=PKMYT1 PE=1 SV=1	77	LQPRRVSFRGEA
PLLFLPLLILRA	sp|P06492|VP16_HHV11	126	sp|P54753|EPHB3_HUMAN Ephrin type-B receptor 3 OS=Homo sapiens OX=9606 GN=EPHB3 PE=1 SV=2	22	PLLLLPLLLLPA
PLLFLPLLILRA	sp|P06492|VP16_HHV11	126	sp|Q14112|NID2_HUMAN Nidogen-2 OS=Homo sapiens OX=9606 GN=NID2 PE=1 SV=3	17	VLLLLPLLMLRA
PLLFLPLLILRA	sp|P06492|VP16_HHV11	126	tr|A0A087WZP6|A0A087WZP6_HUMAN Nidogen-2 OS=Homo sapiens OX=9606 GN=NID2 PE=1 SV=1	17	VLLLLPLLMLRA
ALRVSGLIPGGA	sp|P10221|ITP_HHV11	654	sp|Q8TEM1|PO210_HUMAN Nuclear pore membrane glycoprotein 210 OS=Homo sapiens OX=9606 GN=NUP210 PE=1 SV=3	556	PLRISGLMPGGA
RFDSPDAPPLPR	sp|P10220|LTP_HHV11	1068	sp|Q9H4L4|SENP3_HUMAN Sentrin-specific protease 3 OS=Homo sapiens OX=9606 GN=SENP3 PE=1 SV=2	185	RFDSPRGPPPPR
RFDSPDAPPLPR	sp|P10220|LTP_HHV11	1068	tr|A0A087X0R7|A0A087X0R7_HUMAN SENP3-EIF4A1 readthrough (NMD candidate) (Fragment) OS=Homo sapiens OX=9606 GN=SENP3-EIF4A1 PE=3 SV=1	115	RFDSPRGPPPPR
GRRSLLAGGYSQ	sp|P10215|NEC1_HHV11	89	sp|Q9BYW1|GTR11_HUMAN Solute carrier family 2, facilitated glucose transporter member 11 OS=Homo sapiens OX=9606 GN=SLC2A11 PE=1 SV=1	336	GRRVLLIGGYSL
RRSLLAGGYSQA	sp|P10215|NEC1_HHV11	90	tr|K7EKL6|K7EKL6_HUMAN TOM1-like protein 2 (Fragment) OS=Homo sapiens OX=9606 GN=TOM1L2 PE=1 SV=1	27	RRSLEAGGCSHA
DLAEDLFLRLTG	sp|P06491|MCP_HHV11	1210	tr|H0YFT5|H0YFT5_HUMAN Fermitin family homolog 3 (Fragment) OS=Homo sapiens OX=9606 GN=FERMT3 PE=1 SV=1	168	ELDEDLFLQLTG
DLAEDLFLRLTG	sp|P06491|MCP_HHV11	1210	sp|Q86UX7|URP2_HUMAN Fermitin family homolog 3 OS=Homo sapiens OX=9606 GN=FERMT3 PE=1 SV=1	651	ELDEDLFLQLTG
SRTLTDAESRKL	sp|P10226|PAP_HHV11	381	tr|B1AKB2|B1AKB2_HUMAN Transcription factor EB (Fragment) OS=Homo sapiens OX=9606 GN=TFEB PE=1 SV=1	219	KRELTDAESRAL
SRTLTDAESRKL	sp|P10226|PAP_HHV11	381	tr|A0A1B0GXL9|A0A1B0GXL9_HUMAN Transcription factor EB (Fragment) OS=Homo sapiens OX=9606 GN=TFEB PE=1 SV=1	219	KRELTDAESRAL
SRTLTDAESRKL	sp|P10226|PAP_HHV11	381	tr|B1AKB4|B1AKB4_HUMAN Transcription factor EB OS=Homo sapiens OX=9606 GN=TFEB PE=1 SV=1	219	KRELTDAESRAL
SRTLTDAESRKL	sp|P10226|PAP_HHV11	381	tr|B0QYS6|B0QYS6_HUMAN Transcription factor EB OS=Homo sapiens OX=9606 GN=TFEB PE=1 SV=1	233	KRELTDAESRAL
SRTLTDAESRKL	sp|P10226|PAP_HHV11	381	sp|P19484|TFEB_HUMAN Transcription factor EB OS=Homo sapiens OX=9606 GN=TFEB PE=1 SV=3	219	KRELTDAESRAL
SRTLTDAESRKL	sp|P10226|PAP_HHV11	381	tr|B1AKB5|B1AKB5_HUMAN Transcription factor EB (Fragment) OS=Homo sapiens OX=9606 GN=TFEB PE=1 SV=1	77	KRELTDAESRAL
SRTLTDAESRKL	sp|P10226|PAP_HHV11	381	tr|B0QYS7|B0QYS7_HUMAN Transcription factor EB OS=Homo sapiens OX=9606 GN=TFEB PE=1 SV=1	305	KRELTDAESRAL
PVNAQTMLAPVV	sp|P06491|MCP_HHV11	66	tr|E7EPN9|E7EPN9_HUMAN Protein PRRC2C OS=Homo sapiens OX=9606 GN=PRRC2C PE=1 SV=1	1123	TVNQQTMAAPVV
PVNAQTMLAPVV	sp|P06491|MCP_HHV11	66	sp|Q9Y520|PRC2C_HUMAN Protein PRRC2C OS=Homo sapiens OX=9606 GN=PRRC2C PE=1 SV=4	1121	TVNQQTMAAPVV
SDPRAAAAAALY	sp|P08392|ICP4_HHV11	1189	tr|H0YF36|H0YF36_HUMAN Nuclear pore complex protein Nup214 (Fragment) OS=Homo sapiens OX=9606 GN=NUP214 PE=1 SV=1	85	SAPQAAAAAALR
SDPRAAAAAALY	sp|P08392|ICP4_HHV11	1189	sp|P35658|NU214_HUMAN Nuclear pore complex protein Nup214 OS=Homo sapiens OX=9606 GN=NUP214 PE=1 SV=2	1087	SAPQAAAAAALR
SDPRAAAAAALY	sp|P08392|ICP4_HHV11	1189	tr|A0A0A0MSW3|A0A0A0MSW3_HUMAN Nuclear pore complex protein Nup214 OS=Homo sapiens OX=9606 GN=NUP214 PE=1 SV=1	516	SAPQAAAAAALR
SDPRAAAAAALY	sp|P08392|ICP4_HHV11	1189	tr|A0A494C1F2|A0A494C1F2_HUMAN Nuclear pore complex protein Nup214 OS=Homo sapiens OX=9606 GN=NUP214 PE=1 SV=1	1075	SAPQAAAAAALR
SDPRAAAAAALY	sp|P08392|ICP4_HHV11	1189	tr|D6RF55|D6RF55_HUMAN Catenin delta-2 (Fragment) OS=Homo sapiens OX=9606 GN=CTNND2 PE=1 SV=1	151	DAPPAAAAAALY
SDPRAAAAAALY	sp|P08392|ICP4_HHV11	1189	sp|Q9UQB3|CTND2_HUMAN Catenin delta-2 OS=Homo sapiens OX=9606 GN=CTNND2 PE=1 SV=3	242	DAPPAAAAAALY
SDPRAAAAAALY	sp|P08392|ICP4_HHV11	1189	tr|E7EPC8|E7EPC8_HUMAN Catenin delta-2 OS=Homo sapiens OX=9606 GN=CTNND2 PE=1 SV=1	151	DAPPAAAAAALY
LAQFPDAGRASD	sp|P10236|PRIM_HHV11	452	tr|Q5TEV0|Q5TEV0_HUMAN Rho guanine nucleotide exchange factor 19 (Fragment) OS=Homo sapiens OX=9606 GN=ARHGEF19 PE=1 SV=1	3	LAQFPAAGRGSP
LAQFPDAGRASD	sp|P10236|PRIM_HHV11	452	tr|H0Y4D8|H0Y4D8_HUMAN Rho guanine nucleotide exchange factor 19 (Fragment) OS=Homo sapiens OX=9606 GN=ARHGEF19 PE=1 SV=1	9	LAQFPAAGRGSP
LVAWLVLPVLGL	sp|P10227|MB43_HHV11	308	tr|H0YC66|H0YC66_HUMAN Disintegrin and metalloproteinase domain-containing protein 19 (Fragment) OS=Homo sapiens OX=9606 GN=ADAM19 PE=1 SV=1	279	LVAILVLAVLML
LVAWLVLPVLGL	sp|P10227|MB43_HHV11	308	sp|Q9H013|ADA19_HUMAN Disintegrin and metalloproteinase domain-containing protein 19 OS=Homo sapiens OX=9606 GN=ADAM19 PE=1 SV=3	708	LVAILVLAVLML
RPVPASASLENI	sp|P10225|SHUT_HHV11	221	tr|F5GYA2|F5GYA2_HUMAN Uracil-DNA glycosylase OS=Homo sapiens OX=9606 GN=UNG PE=1 SV=1	162	RPVPPPPSLENI
RPVPASASLENI	sp|P10225|SHUT_HHV11	221	sp|P13051|UNG_HUMAN Uracil-DNA glycosylase OS=Homo sapiens OX=9606 GN=UNG PE=1 SV=2	171	RPVPPPPSLENI
KMPGAHLPWPAP	sp|P10210|SCAF_HHV11	588	tr|J3KRR4|J3KRR4_HUMAN Proline-rich protein 29 (Fragment) OS=Homo sapiens OX=9606 GN=PRR29 PE=4 SV=1	111	PSPGALLPWPAP
KMPGAHLPWPAP	sp|P10210|SCAF_HHV11	588	sp|P0C7W0|PRR29_HUMAN Proline-rich protein 29 OS=Homo sapiens OX=9606 GN=PRR29 PE=2 SV=2	118	PSPGALLPWPAP
KMPGAHLPWPAP	sp|P10210|SCAF_HHV11	588	tr|J3QR92|J3QR92_HUMAN Proline-rich protein 29 OS=Homo sapiens OX=9606 GN=PRR29 PE=4 SV=1	67	PSPGALLPWPAP
EGTTNGPVTPTS	sp|P10220|LTP_HHV11	1964	sp|Q04900|MUC24_HUMAN Sialomucin core protein 24 OS=Homo sapiens OX=9606 GN=CD164 PE=1 SV=2	142	SGTTNNTVTPTS
EGTTNGPVTPTS	sp|P10220|LTP_HHV11	1964	tr|D6R9B4|D6R9B4_HUMAN Sialomucin core protein 24 OS=Homo sapiens OX=9606 GN=CD164 PE=1 SV=1	108	SGTTNNTVTPTS
RWIRLLGLLPRL	sp|P06485|US02_HHV11	162	sp|Q9ULD8|KCNH3_HUMAN Potassium voltage-gated channel subfamily H member 3 OS=Homo sapiens OX=9606 GN=KCNH3 PE=1 SV=2	338	RLLRLLRLLPRL
EERTKVPIPDDL	sp|P04293|DPOL_HHV11	555	sp|Q9Y5F7|PCDGL_HUMAN Protocadherin gamma-C4 OS=Homo sapiens OX=9606 GN=PCDHGC4 PE=2 SV=1	627	EVRTAVPIPADL
LDADGGGRAVMD	sp|P08392|ICP4_HHV11	42	tr|C9J681|C9J681_HUMAN Interleukin-36 gamma (Fragment) OS=Homo sapiens OX=9606 GN=IL36G PE=1 SV=1	6	GDADGGGRAVYQ
LDADGGGRAVMD	sp|P08392|ICP4_HHV11	42	sp|Q9NZH8|IL36G_HUMAN Interleukin-36 gamma OS=Homo sapiens OX=9606 GN=IL36G PE=1 SV=1	6	GDADGGGRAVYQ
ALHLGGAASASL	sp|P10231|TEG5_HHV11	117	sp|Q7Z5L9|I2BP2_HUMAN Interferon regulatory factor 2-binding protein 2 OS=Homo sapiens OX=9606 GN=IRF2BP2 PE=1 SV=2	202	ALGLGGRAAASL
ALHLGGAASASL	sp|P10231|TEG5_HHV11	117	sp|Q96N68|CR015_HUMAN Putative uncharacterized protein C18orf15 OS=Homo sapiens OX=9606 GN=C18orf15 PE=5 SV=1	88	FFGLGGAASASL
RSSFLTTPESQK	sp|P04488|GE_HHV11	168	sp|Q9P2W1|HOP2_HUMAN Homologous-pairing protein 2 homolog OS=Homo sapiens OX=9606 GN=PSMC3IP PE=1 SV=1	117	LSSALTTPEMQK
RSSFLTTPESQK	sp|P04488|GE_HHV11	168	tr|K7ERB6|K7ERB6_HUMAN Homologous-pairing protein 2 homolog OS=Homo sapiens OX=9606 GN=PSMC3IP PE=1 SV=1	54	LSSALTTPEMQK
EGYPATELSVAD	sp|P08543|RIR1_HHV11	1122	sp|Q9C091|GRB1L_HUMAN GREB1-like protein OS=Homo sapiens OX=9606 GN=GREB1L PE=1 SV=2	992	LGNPATELSVAT
SLGTRARPPGMA	sp|P10220|LTP_HHV11	2331	sp|Q15772|SPEG_HUMAN Striated muscle preferentially expressed protein kinase OS=Homo sapiens OX=9606 GN=SPEG PE=1 SV=4	2094	SLGGRARDPRMA
SLGTRARPPGMA	sp|P10220|LTP_HHV11	2331	tr|K7EJ17|K7EJ17_HUMAN Ran-binding protein 3 OS=Homo sapiens OX=9606 GN=RANBP3 PE=4 SV=1	59	SLGGRLRPPTMA
QPTTLQLLYGLA	sp|P10220|LTP_HHV11	2706	sp|P49641|MA2A2_HUMAN Alpha-mannosidase 2x OS=Homo sapiens OX=9606 GN=MAN2A2 PE=2 SV=3	1116	QPTSLTLLYPLA
QPTTLQLLYGLA	sp|P10220|LTP_HHV11	2706	tr|H0YLB9|H0YLB9_HUMAN Alpha-mannosidase (Fragment) OS=Homo sapiens OX=9606 GN=MAN2A2 PE=1 SV=1	759	QPTSLTLLYPLA
QPTTLQLLYGLA	sp|P10220|LTP_HHV11	2706	tr|H0YKH9|H0YKH9_HUMAN Alpha-mannosidase 2x (Fragment) OS=Homo sapiens OX=9606 GN=MAN2A2 PE=1 SV=1	326	QPTSLTLLYPLA
QPTTLQLLYGLA	sp|P10220|LTP_HHV11	2706	tr|H0YML7|H0YML7_HUMAN Alpha-mannosidase 2x (Fragment) OS=Homo sapiens OX=9606 GN=MAN2A2 PE=4 SV=1	24	QPTSLTLLYPLA
RWLLPGLLLLMV	sp|P32888|TRX1_HHV11	248	sp|P83105|HTRA4_HUMAN Serine protease HTRA4 OS=Homo sapiens OX=9606 GN=HTRA4 PE=1 SV=1	13	RCLLPGLLLLLV
RWLLPGLLLLMV	sp|P32888|TRX1_HHV11	248	sp|Q7Z6M3|MILR1_HUMAN Allergin-1 OS=Homo sapiens OX=9606 GN=MILR1 PE=1 SV=2	227	KLLLPGLLLLLV
DVSRDISDQHTA	sp|P04288|GM_HHV11	387	tr|B5MCF4|B5MCF4_HUMAN Fibroblast growth factor 1 OS=Homo sapiens OX=9606 GN=FGF1 PE=1 SV=1	47	DGTRDRSDQHTA
GEDGAPLHDLEV	sp|P04488|GE_HHV11	441	sp|Q8WUT4|LRRN4_HUMAN Leucine-rich repeat neuronal protein 4 OS=Homo sapiens OX=9606 GN=LRRN4 PE=1 SV=3	197	GEDGAPLVTLEV
DDLPLLATFYLA	sp|P04293|DPOL_HHV11	564	sp|Q9UQ05|KCNH4_HUMAN Potassium voltage-gated channel subfamily H member 4 OS=Homo sapiens OX=9606 GN=KCNH4 PE=2 SV=1	230	DGLILLATFYVA
DDLPLLATFYLA	sp|P04293|DPOL_HHV11	564	sp|Q96L42|KCNH8_HUMAN Potassium voltage-gated channel subfamily H member 8 OS=Homo sapiens OX=9606 GN=KCNH8 PE=2 SV=2	225	DWLILLATFYVA
EDAARAAARPRP	sp|P08392|ICP4_HHV11	838	sp|Q5FWE3|PRRT3_HUMAN Proline-rich transmembrane protein 3 OS=Homo sapiens OX=9606 GN=PRRT3 PE=1 SV=3	694	ALAAVAAARPRP
PAELLPGAASQA	sp|P10220|LTP_HHV11	1713	sp|Q9Y4E1|WAC2C_HUMAN WASH complex subunit 2C OS=Homo sapiens OX=9606 GN=WASHC2C PE=1 SV=4	944	PAALLPTAASQI
PAELLPGAASQA	sp|P10220|LTP_HHV11	1713	tr|A0A0A0MR88|A0A0A0MR88_HUMAN WASH complex subunit 2C OS=Homo sapiens OX=9606 GN=WASHC2C PE=1 SV=1	965	PAALLPTAASQI
PAELLPGAASQA	sp|P10220|LTP_HHV11	1713	tr|A0A096LPC5|A0A096LPC5_HUMAN WASH complex subunit 2C OS=Homo sapiens OX=9606 GN=WASHC2C PE=1 SV=1	965	PAALLPTAASQI
PAELLPGAASQA	sp|P10220|LTP_HHV11	1713	tr|J3KP36|J3KP36_HUMAN WASH complex subunit 2C OS=Homo sapiens OX=9606 GN=WASHC2C PE=1 SV=3	886	PAALLPTAASQI
PAELLPGAASQA	sp|P10220|LTP_HHV11	1713	tr|E7ESD2|E7ESD2_HUMAN WASH complex subunit 2A OS=Homo sapiens OX=9606 GN=WASHC2A PE=1 SV=2	903	PAALLPTAASQI
PAELLPGAASQA	sp|P10220|LTP_HHV11	1713	sp|Q641Q2|WAC2A_HUMAN WASH complex subunit 2A OS=Homo sapiens OX=9606 GN=WASHC2A PE=1 SV=3	965	PAALLPTAASQI
PAELLPGAASQA	sp|P10220|LTP_HHV11	1713	tr|F8W7U3|F8W7U3_HUMAN WASH complex subunit 2A OS=Homo sapiens OX=9606 GN=WASHC2A PE=1 SV=1	877	PAALLPTAASQI
PAELLPGAASQA	sp|P10220|LTP_HHV11	1713	tr|A0A087WYF6|A0A087WYF6_HUMAN WASH complex subunit 2A OS=Homo sapiens OX=9606 GN=WASHC2A PE=1 SV=1	869	PAALLPTAASQI
AAGNLVGPEYNV	sp|P08543|RIR1_HHV11	941	sp|P49675|STAR_HUMAN Steroidogenic acute regulatory protein, mitochondrial OS=Homo sapiens OX=9606 GN=STAR PE=1 SV=2	174	AAGNLVGPRDFV
AAGNLVGPEYNV	sp|P08543|RIR1_HHV11	941	tr|H0YB94|H0YB94_HUMAN START domain-containing protein 1 (Fragment) OS=Homo sapiens OX=9606 GN=STAR PE=1 SV=8	153	AAGNLVGPRDFV
PDALRPAVTRGV	sp|P04293|DPOL_HHV11	453	tr|M0R3I4|M0R3I4_HUMAN Myelin-associated glycoprotein OS=Homo sapiens OX=9606 GN=MAG PE=1 SV=1	47	PDELRPAVVHGV
