query	query_seqname	query_start	target_seqname	target_start	target
VCPNGSKLVKGG	tr|Q6IVU0|Q6IVU0_MACHU	1025	tr|A6NL76|A6NL76_HUMAN Actin, alpha skeletal muscle OS=Homo sapiens OX=9606 GN=ACTA1 PE=1 SV=3	11	VCDNGSGLVKAG
VCPNGSKLVKGG	tr|Q6IVU0|Q6IVU0_MACHU	1025	sp|P68032|ACTC_HUMAN Actin, alpha cardiac muscle 1 OS=Homo sapiens OX=9606 GN=ACTC1 PE=1 SV=1	11	VCDNGSGLVKAG
VCPNGSKLVKGG	tr|Q6IVU0|Q6IVU0_MACHU	1025	sp|P68133|ACTS_HUMAN Actin, alpha skeletal muscle OS=Homo sapiens OX=9606 GN=ACTA1 PE=1 SV=1	11	VCDNGSGLVKAG
HSALVPFVSSLR	tr|Q6IVU0|Q6IVU0_MACHU	484	sp|Q8N616|TM148_HUMAN Putative uncharacterized protein encoded by LINC00311 OS=Homo sapiens OX=9606 GN=LINC00311 PE=5 SV=1	38	SAALVPPVSSLR
KARDEDDLLELK	tr|Q8AZ68|Q8AZ68_MACHU	490	tr|A0A1B0GVT7|A0A1B0GVT7_HUMAN Transcription initiation protein SPT3 homolog OS=Homo sapiens OX=9606 GN=SUPT3H PE=1 SV=1	50	KGIDEDDLLEDK
KARDEDDLLELK	tr|Q8AZ68|Q8AZ68_MACHU	490	sp|O75486|SUPT3_HUMAN Transcription initiation protein SPT3 homolog OS=Homo sapiens OX=9606 GN=SUPT3H PE=1 SV=3	112	KGIDEDDLLEDK
KARDEDDLLELK	tr|Q8AZ68|Q8AZ68_MACHU	490	tr|A0A6I8PRV1|A0A6I8PRV1_HUMAN Transcription initiation protein SPT3 homolog OS=Homo sapiens OX=9606 GN=SUPT3H PE=1 SV=1	79	KGIDEDDLLEDK
QISKPYIIRFLE	tr|Q8AZ57|Q8AZ57_MACHU	10	sp|A8MWA4|Z705E_HUMAN Putative zinc finger protein 705E OS=Homo sapiens OX=9606 GN=ZNF705E PE=3 SV=2	49	QISKSYIILQLE
QISKPYIIRFLE	tr|Q8AZ57|Q8AZ57_MACHU	10	tr|J3KPU9|J3KPU9_HUMAN Zinc finger protein 705A (Fragment) OS=Homo sapiens OX=9606 GN=ZNF705A PE=4 SV=1	49	QISKSYIILQLE
QISKPYIIRFLE	tr|Q8AZ57|Q8AZ57_MACHU	10	sp|Q6ZN79|Z705A_HUMAN Zinc finger protein 705A OS=Homo sapiens OX=9606 GN=ZNF705A PE=2 SV=1	49	QISKSYIILQLE
QISKPYIIRFLE	tr|Q8AZ57|Q8AZ57_MACHU	10	sp|P0CH99|Z705D_HUMAN Zinc finger protein 705D OS=Homo sapiens OX=9606 GN=ZNF705D PE=1 SV=1	49	QISKSYIILQLE
QISKPYIIRFLE	tr|Q8AZ57|Q8AZ57_MACHU	10	sp|A8MVS1|Z705F_HUMAN Zinc finger protein 705F OS=Homo sapiens OX=9606 GN=ZNF705F PE=3 SV=1	49	QISKSYIILQLE
QISKPYIIRFLE	tr|Q8AZ57|Q8AZ57_MACHU	10	sp|A8MUZ8|Z705G_HUMAN Putative zinc finger protein 705G OS=Homo sapiens OX=9606 GN=ZNF705G PE=2 SV=2	49	QISKSYIILQLE
QISKPYIIRFLE	tr|Q8AZ57|Q8AZ57_MACHU	10	tr|A0A0G2JMF9|A0A0G2JMF9_HUMAN Putative zinc finger protein 705G OS=Homo sapiens OX=9606 GN=ZNF705G PE=4 SV=1	49	QISKSYIILQLE
QISKPYIIRFLE	tr|Q8AZ57|Q8AZ57_MACHU	10	sp|P0CI00|Z705B_HUMAN Putative zinc finger protein 705B OS=Homo sapiens OX=9606 GN=ZNF705B PE=5 SV=1	49	QISKSYIILQLE
GVIFQKDAQVST	tr|Q6IVU0|Q6IVU0_MACHU	950	tr|A0A0C4DGE7|A0A0C4DGE7_HUMAN Ellis van Creveld syndrome 2 (Limbin), isoform CRA_c OS=Homo sapiens OX=9606 GN=EVC2 PE=1 SV=1	85	GVIFQKCALVSG
GVIFQKDAQVST	tr|Q6IVU0|Q6IVU0_MACHU	950	sp|Q86UK5|LBN_HUMAN Limbin OS=Homo sapiens OX=9606 GN=EVC2 PE=2 SV=1	165	GVIFQKCALVSG
GVIFQKDAQVST	tr|Q6IVU0|Q6IVU0_MACHU	950	tr|E9PFT2|E9PFT2_HUMAN Limbin OS=Homo sapiens OX=9606 GN=EVC2 PE=4 SV=1	85	GVIFQKCALVSG
GVLLGMDLYRPF	tr|Q6IVU0|Q6IVU0_MACHU	569	tr|J3KT79|J3KT79_HUMAN Secernin-2 OS=Homo sapiens OX=9606 GN=SCRN2 PE=1 SV=1	110	EALLGMDLLRPF
LRQGRKQRRLVS	tr|Q8AZ68|Q8AZ68_MACHU	247	tr|H0YI49|H0YI49_HUMAN G2/M phase-specific E3 ubiquitin-protein ligase (Fragment) OS=Homo sapiens OX=9606 GN=G2E3 PE=1 SV=1	102	LRQGSKFRRNVS
LRQGRKQRRLVS	tr|Q8AZ68|Q8AZ68_MACHU	247	tr|G3V483|G3V483_HUMAN G2/M phase-specific E3 ubiquitin-protein ligase OS=Homo sapiens OX=9606 GN=G2E3 PE=1 SV=1	366	LRQGSKFRRNVS
LRQGRKQRRLVS	tr|Q8AZ68|Q8AZ68_MACHU	247	sp|Q7L622|G2E3_HUMAN G2/M phase-specific E3 ubiquitin-protein ligase OS=Homo sapiens OX=9606 GN=G2E3 PE=1 SV=1	336	LRQGSKFRRNVS
LRQGRKQRRLVS	tr|Q8AZ68|Q8AZ68_MACHU	247	tr|F5GX24|F5GX24_HUMAN G2/M phase-specific E3 ubiquitin-protein ligase OS=Homo sapiens OX=9606 GN=G2E3 PE=1 SV=1	290	LRQGSKFRRNVS
TVASNIVDQSLT	tr|Q6IVU0|Q6IVU0_MACHU	26	sp|P35555|FBN1_HUMAN Fibrillin-1 OS=Homo sapiens OX=9606 GN=FBN1 PE=1 SV=4	2736	TDASNIEDQSET
LKSKGGNLPLKE	tr|Q6IVU0|Q6IVU0_MACHU	523	sp|Q86YL5|TDRP_HUMAN Testis development-related protein OS=Homo sapiens OX=9606 GN=TDRP PE=1 SV=2	67	PKSKGTNLRLKE
KGGNLPLKEELT	tr|Q6IVU0|Q6IVU0_MACHU	526	sp|Q86YL5|TDRP_HUMAN Testis development-related protein OS=Homo sapiens OX=9606 GN=TDRP PE=1 SV=2	70	KGTNLRLKEELK
VEAGSVILAVSS	tr|Q8AZ57|Q8AZ57_MACHU	289	sp|Q14CX7|NAA25_HUMAN N-alpha-acetyltransferase 25, NatB auxiliary subunit OS=Homo sapiens OX=9606 GN=NAA25 PE=1 SV=1	845	VETISVILWVSS
GAHEITHEFPTK	tr|Q8AZ57|Q8AZ57_MACHU	317	sp|P12544|GRAA_HUMAN Granzyme A OS=Homo sapiens OX=9606 GN=GZMA PE=1 SV=2	81	GAHSITREEPTK
YDKLRLGGLIDK	tr|Q8AZ68|Q8AZ68_MACHU	103	sp|Q92830|KAT2A_HUMAN Histone acetyltransferase KAT2A OS=Homo sapiens OX=9606 GN=KAT2A PE=1 SV=3	826	YFKLKEGGLIDK
LVVEFSQTGSKG	tr|Q6IVU0|Q6IVU0_MACHU	795	tr|C9J8B1|C9J8B1_HUMAN Serine/threonine-protein kinase 33 (Fragment) OS=Homo sapiens OX=9606 GN=STK33 PE=1 SV=1	38	LVVEMSQTSSIG
LVVEFSQTGSKG	tr|Q6IVU0|Q6IVU0_MACHU	795	tr|C9JCS6|C9JCS6_HUMAN Serine/threonine-protein kinase 33 (Fragment) OS=Homo sapiens OX=9606 GN=STK33 PE=1 SV=1	38	LVVEMSQTSSIG
LVVEFSQTGSKG	tr|Q6IVU0|Q6IVU0_MACHU	795	sp|Q9BYT3|STK33_HUMAN Serine/threonine-protein kinase 33 OS=Homo sapiens OX=9606 GN=STK33 PE=1 SV=1	38	LVVEMSQTSSIG
KSKGGNLPLKEE	tr|Q6IVU0|Q6IVU0_MACHU	524	sp|Q86YL5|TDRP_HUMAN Testis development-related protein OS=Homo sapiens OX=9606 GN=TDRP PE=1 SV=2	68	KSKGTNLRLKEE
IGETMPMVASTL	tr|Q6IVU0|Q6IVU0_MACHU	2015	tr|A0A590UKB7|A0A590UKB7_HUMAN Ryanodine receptor 2 (Fragment) OS=Homo sapiens OX=9606 GN=RYR2 PE=1 SV=1	422	KGETGPMVAATL
IGETMPMVASTL	tr|Q6IVU0|Q6IVU0_MACHU	2015	tr|A0A590UJZ8|A0A590UJZ8_HUMAN Ryanodine receptor 2 (Fragment) OS=Homo sapiens OX=9606 GN=RYR2 PE=1 SV=1	1141	KGETGPMVAATL
IGETMPMVASTL	tr|Q6IVU0|Q6IVU0_MACHU	2015	sp|Q92736|RYR2_HUMAN Ryanodine receptor 2 OS=Homo sapiens OX=9606 GN=RYR2 PE=1 SV=3	3748	KGETGPMVAATL
IGETMPMVASTL	tr|Q6IVU0|Q6IVU0_MACHU	2015	tr|H7BY35|H7BY35_HUMAN Ryanodine receptor 2 OS=Homo sapiens OX=9606 GN=RYR2 PE=1 SV=2	3732	KGETGPMVAATL
DTKFLLLRETEL	tr|Q6IVU0|Q6IVU0_MACHU	912	tr|E9PKV5|E9PKV5_HUMAN Polyribonucleotide 5'-hydroxyl-kinase Clp1 (Fragment) OS=Homo sapiens OX=9606 GN=CLP1 PE=1 SV=1	12	TTKFELERETEL
DTKFLLLRETEL	tr|Q6IVU0|Q6IVU0_MACHU	912	tr|E9PJM4|E9PJM4_HUMAN Polyribonucleotide 5'-hydroxyl-kinase Clp1 (Fragment) OS=Homo sapiens OX=9606 GN=CLP1 PE=1 SV=1	12	TTKFELERETEL
DTKFLLLRETEL	tr|Q6IVU0|Q6IVU0_MACHU	912	sp|Q92989|CLP1_HUMAN Polyribonucleotide 5'-hydroxyl-kinase Clp1 OS=Homo sapiens OX=9606 GN=CLP1 PE=1 SV=1	12	TTKFELERETEL
DTKFLLLRETEL	tr|Q6IVU0|Q6IVU0_MACHU	912	tr|E9PL17|E9PL17_HUMAN Polyribonucleotide 5'-hydroxyl-kinase Clp1 OS=Homo sapiens OX=9606 GN=CLP1 PE=1 SV=1	23	TTKFELERETEL
GAEQVKRLGLAI	tr|Q8AZ68|Q8AZ68_MACHU	265	tr|A0A1W2PRX2|A0A1W2PRX2_HUMAN Uncharacterized protein OS=Homo sapiens OX=9606 PE=4 SV=1	48	EAEQVLRLGLAL
LKGEEDASYKDK	tr|Q8AZ68|Q8AZ68_MACHU	151	tr|Q5H918|Q5H918_HUMAN HIV Tat-specific factor 1 (Fragment) OS=Homo sapiens OX=9606 GN=HTATSF1 PE=1 SV=1	220	LKGEYDASKKKK
LKGEEDASYKDK	tr|Q8AZ68|Q8AZ68_MACHU	151	sp|O43719|HTSF1_HUMAN HIV Tat-specific factor 1 OS=Homo sapiens OX=9606 GN=HTATSF1 PE=1 SV=1	220	LKGEYDASKKKK
LRGTQSSSEDSI	tr|Q6IVU0|Q6IVU0_MACHU	1751	sp|Q9BQI7|PSD2_HUMAN PH and SEC7 domain-containing protein 2 OS=Homo sapiens OX=9606 GN=PSD2 PE=2 SV=3	150	LRGTQYSSLDSL
ILRGTQSSSEDS	tr|Q6IVU0|Q6IVU0_MACHU	1750	sp|Q9BQI7|PSD2_HUMAN PH and SEC7 domain-containing protein 2 OS=Homo sapiens OX=9606 GN=PSD2 PE=2 SV=3	149	LLRGTQYSSLDS
LPLKEELTASTP	tr|Q6IVU0|Q6IVU0_MACHU	530	sp|Q8N7X0|ADGB_HUMAN Androglobin OS=Homo sapiens OX=9606 GN=ADGB PE=2 SV=3	1228	LPLVEEETTSTP
LGTIGEGSESCN	tr|Q6IVU0|Q6IVU0_MACHU	1231	sp|O15173|PGRC2_HUMAN Membrane-associated progesterone receptor component 2 OS=Homo sapiens OX=9606 GN=PGRMC2 PE=1 SV=1	10	LGTLGSGSESSN
LGNAKNCFNPKC	tr|Q6UY77|Q6UY77_MACHU	71	sp|Q96CX6|LRC58_HUMAN Leucine-rich repeat-containing protein 58 OS=Homo sapiens OX=9606 GN=LRRC58 PE=1 SV=2	290	LGSASNCPNPKC
ILENLKVKDVLN	tr|Q6IVU0|Q6IVU0_MACHU	1699	tr|Q14DU5|Q14DU5_HUMAN Non-specific serine/threonine protein kinase OS=Homo sapiens OX=9606 GN=ROCK2 PE=1 SV=1	90	INELLKQKDVLN
ILENLKVKDVLN	tr|Q6IVU0|Q6IVU0_MACHU	1699	sp|O75116|ROCK2_HUMAN Rho-associated protein kinase 2 OS=Homo sapiens OX=9606 GN=ROCK2 PE=1 SV=4	775	INELLKQKDVLN
ILENLKVKDVLN	tr|Q6IVU0|Q6IVU0_MACHU	1699	tr|E9PF63|E9PF63_HUMAN Rho-associated protein kinase 2 OS=Homo sapiens OX=9606 GN=ROCK2 PE=1 SV=1	532	INELLKQKDVLN
SVILAVSSEEKF	tr|Q8AZ57|Q8AZ57_MACHU	293	sp|P02808|STAT_HUMAN Statherin OS=Homo sapiens OX=9606 GN=STATH PE=1 SV=2	15	SMIGADSSEEKF
LLQARSTESDLV	tr|Q6IVU0|Q6IVU0_MACHU	1621	sp|Q9UKN1|MUC12_HUMAN Mucin-12 OS=Homo sapiens OX=9606 GN=MUC12 PE=1 SV=2	5062	PLPARSTASDLV
ENLKVKDVLNKD	tr|Q6IVU0|Q6IVU0_MACHU	1701	tr|Q14DU5|Q14DU5_HUMAN Non-specific serine/threonine protein kinase OS=Homo sapiens OX=9606 GN=ROCK2 PE=1 SV=1	92	ELLKQKDVLNED
ENLKVKDVLNKD	tr|Q6IVU0|Q6IVU0_MACHU	1701	sp|O75116|ROCK2_HUMAN Rho-associated protein kinase 2 OS=Homo sapiens OX=9606 GN=ROCK2 PE=1 SV=4	777	ELLKQKDVLNED
ENLKVKDVLNKD	tr|Q6IVU0|Q6IVU0_MACHU	1701	tr|E9PF63|E9PF63_HUMAN Rho-associated protein kinase 2 OS=Homo sapiens OX=9606 GN=ROCK2 PE=1 SV=1	534	ELLKQKDVLNED
KAYGTLVDLLTD	tr|Q8AZ68|Q8AZ68_MACHU	162	tr|A0A5F9ZI13|A0A5F9ZI13_HUMAN Outer dynein arm-docking complex subunit 2 OS=Homo sapiens OX=9606 GN=ODAD2 PE=1 SV=1	448	KAIETLVGLLTD
KAYGTLVDLLTD	tr|Q8AZ68|Q8AZ68_MACHU	162	tr|A0A5F9ZH22|A0A5F9ZH22_HUMAN Outer dynein arm-docking complex subunit 2 OS=Homo sapiens OX=9606 GN=ODAD2 PE=1 SV=1	448	KAIETLVGLLTD
KAYGTLVDLLTD	tr|Q8AZ68|Q8AZ68_MACHU	162	sp|Q5T2S8|ODAD2_HUMAN Outer dynein arm-docking complex subunit 2 OS=Homo sapiens OX=9606 GN=ODAD2 PE=1 SV=1	756	KAIETLVGLLTD
EAGVAKLDNLYD	tr|Q8AZ68|Q8AZ68_MACHU	93	tr|H0YBI0|H0YBI0_HUMAN E3 ubiquitin-protein ligase SHPRH (Fragment) OS=Homo sapiens OX=9606 GN=SHPRH PE=1 SV=1	17	EAGLAKLDFLSD
EAGVAKLDNLYD	tr|Q8AZ68|Q8AZ68_MACHU	93	tr|K4DI94|K4DI94_HUMAN E3 ubiquitin-protein ligase SHPRH OS=Homo sapiens OX=9606 GN=SHPRH PE=1 SV=2	107	EAGLAKLDFLSD
EAGVAKLDNLYD	tr|Q8AZ68|Q8AZ68_MACHU	93	tr|A0A0D9SFM0|A0A0D9SFM0_HUMAN E3 ubiquitin-protein ligase SHPRH OS=Homo sapiens OX=9606 GN=SHPRH PE=1 SV=1	218	EAGLAKLDFLSD
EAGVAKLDNLYD	tr|Q8AZ68|Q8AZ68_MACHU	93	sp|Q149N8|SHPRH_HUMAN E3 ubiquitin-protein ligase SHPRH OS=Homo sapiens OX=9606 GN=SHPRH PE=1 SV=2	218	EAGLAKLDFLSD
EAGVAKLDNLYD	tr|Q8AZ68|Q8AZ68_MACHU	93	tr|H7C2W2|H7C2W2_HUMAN E3 ubiquitin-protein ligase SHPRH (Fragment) OS=Homo sapiens OX=9606 GN=SHPRH PE=1 SV=1	196	EAGLAKLDFLSD
LGAEQVKRLGLA	tr|Q8AZ68|Q8AZ68_MACHU	264	tr|A0A1W2PRX2|A0A1W2PRX2_HUMAN Uncharacterized protein OS=Homo sapiens OX=9606 PE=4 SV=1	47	AEAEQVLRLGLA
LGAEQVKRLGLA	tr|Q8AZ68|Q8AZ68_MACHU	264	sp|Q9UJP4|KLH21_HUMAN Kelch-like protein 21 OS=Homo sapiens OX=9606 GN=KLHL21 PE=1 SV=4	168	LGAEQLERLPLA
ERTFSLSGSRSL	tr|Q6IVU0|Q6IVU0_MACHU	1424	sp|Q8TF01|PNISR_HUMAN Arginine/serine-rich protein PNISR OS=Homo sapiens OX=9606 GN=PNISR PE=1 SV=2	718	ERTFSRSGSISV
LLRQGRKQRRLV	tr|Q8AZ68|Q8AZ68_MACHU	246	tr|H0YI49|H0YI49_HUMAN G2/M phase-specific E3 ubiquitin-protein ligase (Fragment) OS=Homo sapiens OX=9606 GN=G2E3 PE=1 SV=1	101	LLRQGSKFRRNV
LLRQGRKQRRLV	tr|Q8AZ68|Q8AZ68_MACHU	246	tr|G3V483|G3V483_HUMAN G2/M phase-specific E3 ubiquitin-protein ligase OS=Homo sapiens OX=9606 GN=G2E3 PE=1 SV=1	365	LLRQGSKFRRNV
LLRQGRKQRRLV	tr|Q8AZ68|Q8AZ68_MACHU	246	sp|Q7L622|G2E3_HUMAN G2/M phase-specific E3 ubiquitin-protein ligase OS=Homo sapiens OX=9606 GN=G2E3 PE=1 SV=1	335	LLRQGSKFRRNV
LLRQGRKQRRLV	tr|Q8AZ68|Q8AZ68_MACHU	246	tr|F5GX24|F5GX24_HUMAN G2/M phase-specific E3 ubiquitin-protein ligase OS=Homo sapiens OX=9606 GN=G2E3 PE=1 SV=1	289	LLRQGSKFRRNV
SGNKSLLTLVMV	tr|Q8AZ68|Q8AZ68_MACHU	59	sp|Q15058|KIF14_HUMAN Kinesin-like protein KIF14 OS=Homo sapiens OX=9606 GN=KIF14 PE=1 SV=1	625	SINKSLLTLGKV
TESDKDLSSLRL	tr|Q6IVU0|Q6IVU0_MACHU	1452	tr|C9JE46|C9JE46_HUMAN Neurexophilin-1 (Fragment) OS=Homo sapiens OX=9606 GN=NXPH1 PE=1 SV=1	47	TESSKDLSISRL
TESDKDLSSLRL	tr|Q6IVU0|Q6IVU0_MACHU	1452	tr|C9JPD0|C9JPD0_HUMAN Neurexophilin-1 (Fragment) OS=Homo sapiens OX=9606 GN=NXPH1 PE=1 SV=1	47	TESSKDLSISRL
TESDKDLSSLRL	tr|Q6IVU0|Q6IVU0_MACHU	1452	sp|P58417|NXPH1_HUMAN Neurexophilin-1 OS=Homo sapiens OX=9606 GN=NXPH1 PE=2 SV=1	47	TESSKDLSISRL
TESDKDLSSLRL	tr|Q6IVU0|Q6IVU0_MACHU	1452	tr|R4GMM9|R4GMM9_HUMAN Neurexophilin OS=Homo sapiens OX=9606 GN=NXPH1 PE=1 SV=1	29	TESSKDLSISRL
SGEDSLKFLVRL	tr|Q6IVU0|Q6IVU0_MACHU	1270	sp|O15370|SOX12_HUMAN Transcription factor SOX-12 OS=Homo sapiens OX=9606 GN=SOX12 PE=2 SV=2	247	SGEESLGFLSRL
LDDNVILLRQGR	tr|Q8AZ68|Q8AZ68_MACHU	240	tr|A0A0G2JHI1|A0A0G2JHI1_HUMAN Retinoic acid receptor RXR-beta (Fragment) OS=Homo sapiens OX=9606 GN=RXRB PE=1 SV=1	36	LDDQVILLRAGL
LDDNVILLRQGR	tr|Q8AZ68|Q8AZ68_MACHU	240	sp|P19793|RXRA_HUMAN Retinoic acid receptor RXR-alpha OS=Homo sapiens OX=9606 GN=RXRA PE=1 SV=1	294	LDDQVILLRAGW
LDDNVILLRQGR	tr|Q8AZ68|Q8AZ68_MACHU	240	tr|A0A5F9ZHH6|A0A5F9ZHH6_HUMAN Retinoic acid receptor RXR-alpha OS=Homo sapiens OX=9606 GN=RXRA PE=1 SV=1	267	LDDQVILLRAGW
LDDNVILLRQGR	tr|Q8AZ68|Q8AZ68_MACHU	240	tr|A0A0G2JKR7|A0A0G2JKR7_HUMAN Retinoic acid receptor RXR-beta OS=Homo sapiens OX=9606 GN=RXRB PE=1 SV=1	175	LDDQVILLRAGW
LDDNVILLRQGR	tr|Q8AZ68|Q8AZ68_MACHU	240	sp|P28702|RXRB_HUMAN Retinoic acid receptor RXR-beta OS=Homo sapiens OX=9606 GN=RXRB PE=1 SV=2	365	LDDQVILLRAGW
FLLLQARSTESD	tr|Q6IVU0|Q6IVU0_MACHU	1619	tr|E9PRE3|E9PRE3_HUMAN LIM domain only protein 7 (Fragment) OS=Homo sapiens OX=9606 GN=LMO7 PE=1 SV=1	74	FLLLQALQTYSD
FLLLQARSTESD	tr|Q6IVU0|Q6IVU0_MACHU	1619	tr|H0Y424|H0Y424_HUMAN LIM domain only protein 7 (Fragment) OS=Homo sapiens OX=9606 GN=LMO7 PE=1 SV=8	77	FLLLQALQTYSD
FLLLQARSTESD	tr|Q6IVU0|Q6IVU0_MACHU	1619	tr|F8WD26|F8WD26_HUMAN LIM domain only protein 7 OS=Homo sapiens OX=9606 GN=LMO7 PE=1 SV=2	401	FLLLQALQTYSD
FLLLQARSTESD	tr|Q6IVU0|Q6IVU0_MACHU	1619	tr|E9PMT2|E9PMT2_HUMAN LIM domain only protein 7 OS=Homo sapiens OX=9606 GN=LMO7 PE=1 SV=1	168	FLLLQALQTYSD
FLLLQARSTESD	tr|Q6IVU0|Q6IVU0_MACHU	1619	tr|J3KP06|J3KP06_HUMAN LIM domain only protein 7 OS=Homo sapiens OX=9606 GN=LMO7 PE=1 SV=2	438	FLLLQALQTYSD
FLLLQARSTESD	tr|Q6IVU0|Q6IVU0_MACHU	1619	tr|A0A0A0MTE2|A0A0A0MTE2_HUMAN LIM domain only protein 7 OS=Homo sapiens OX=9606 GN=LMO7 PE=1 SV=1	168	FLLLQALQTYSD
FLLLQARSTESD	tr|Q6IVU0|Q6IVU0_MACHU	1619	sp|Q8WWI1|LMO7_HUMAN LIM domain only protein 7 OS=Homo sapiens OX=9606 GN=LMO7 PE=1 SV=3	453	FLLLQALQTYSD
VLLGMDLYRPFL	tr|Q6IVU0|Q6IVU0_MACHU	570	tr|J3KT79|J3KT79_HUMAN Secernin-2 OS=Homo sapiens OX=9606 GN=SCRN2 PE=1 SV=1	111	ALLGMDLLRPFH
LTLKLRASNNDG	tr|Q8AZ57|Q8AZ57_MACHU	479	tr|E5RIZ8|E5RIZ8_HUMAN Calbindin (Fragment) OS=Homo sapiens OX=9606 GN=CALB1 PE=1 SV=1	92	LMLKLFDSNNDG
LTLKLRASNNDG	tr|Q8AZ57|Q8AZ57_MACHU	479	sp|P05937|CALB1_HUMAN Calbindin OS=Homo sapiens OX=9606 GN=CALB1 PE=1 SV=2	149	LMLKLFDSNNDG
RELHNGNEIVGV	tr|Q8AZ68|Q8AZ68_MACHU	38	tr|F2Z2C0|F2Z2C0_HUMAN Exosome complex exonuclease RRP44 OS=Homo sapiens OX=9606 GN=DIS3 PE=1 SV=1	493	RELENGNLEVGV
RELHNGNEIVGV	tr|Q8AZ68|Q8AZ68_MACHU	38	sp|Q9Y2L1|RRP44_HUMAN Exosome complex exonuclease RRP44 OS=Homo sapiens OX=9606 GN=DIS3 PE=1 SV=2	493	RELENGNLEVGV
RELHNGNEIVGV	tr|Q8AZ68|Q8AZ68_MACHU	38	tr|G3V1J5|G3V1J5_HUMAN Exosome complex exonuclease RRP44 OS=Homo sapiens OX=9606 GN=DIS3 PE=1 SV=1	331	RELENGNLEVGV
LNERKNPELLKS	tr|Q6IVU0|Q6IVU0_MACHU	448	tr|K7EKA3|K7EKA3_HUMAN Inactive rhomboid protein 2 (Fragment) OS=Homo sapiens OX=9606 GN=RHBDF2 PE=1 SV=1	48	LPERKNPAYLKS
LNERKNPELLKS	tr|Q6IVU0|Q6IVU0_MACHU	448	tr|K7EIY3|K7EIY3_HUMAN Inactive rhomboid protein 2 (Fragment) OS=Homo sapiens OX=9606 GN=RHBDF2 PE=1 SV=1	48	LPERKNPAYLKS
LNERKNPELLKS	tr|Q6IVU0|Q6IVU0_MACHU	448	tr|K7EQ53|K7EQ53_HUMAN Inactive rhomboid protein 2 (Fragment) OS=Homo sapiens OX=9606 GN=RHBDF2 PE=1 SV=8	48	LPERKNPAYLKS
LNERKNPELLKS	tr|Q6IVU0|Q6IVU0_MACHU	448	tr|K7EKI1|K7EKI1_HUMAN Inactive rhomboid protein 2 (Fragment) OS=Homo sapiens OX=9606 GN=RHBDF2 PE=1 SV=8	48	LPERKNPAYLKS
SKGGNLPLKEEL	tr|Q6IVU0|Q6IVU0_MACHU	525	sp|Q86YL5|TDRP_HUMAN Testis development-related protein OS=Homo sapiens OX=9606 GN=TDRP PE=1 SV=2	69	SKGTNLRLKEEL
LVTVTKELLEIP	tr|Q6IVU0|Q6IVU0_MACHU	1077	sp|Q58FG1|HS904_HUMAN Putative heat shock protein HSP 90-alpha A4 OS=Homo sapiens OX=9606 GN=HSP90AA4P PE=5 SV=1	249	LVSVTKEDLELP
LVTVTKELLEIP	tr|Q6IVU0|Q6IVU0_MACHU	1077	sp|P08238|HS90B_HUMAN Heat shock protein HSP 90-beta OS=Homo sapiens OX=9606 GN=HSP90AB1 PE=1 SV=4	533	LVSVTKEGLELP
LVTVTKELLEIP	tr|Q6IVU0|Q6IVU0_MACHU	1077	sp|Q58FF7|H90B3_HUMAN Putative heat shock protein HSP 90-beta-3 OS=Homo sapiens OX=9606 GN=HSP90AB3P PE=5 SV=1	406	LVSVTKEGLELP
LVTVTKELLEIP	tr|Q6IVU0|Q6IVU0_MACHU	1077	sp|P07900|HS90A_HUMAN Heat shock protein HSP 90-alpha OS=Homo sapiens OX=9606 GN=HSP90AA1 PE=1 SV=5	541	LVSVTKEGLELP
LVTVTKELLEIP	tr|Q6IVU0|Q6IVU0_MACHU	1077	sp|Q58FF8|H90B2_HUMAN Putative heat shock protein HSP 90-beta 2 OS=Homo sapiens OX=9606 GN=HSP90AB2P PE=1 SV=2	306	LVSVTKEGLELP
LSLSQLKVTAAT	tr|Q6IVU0|Q6IVU0_MACHU	1996	tr|A0A590UKC3|A0A590UKC3_HUMAN Proline dehydrogenase OS=Homo sapiens OX=9606 GN=PRODH2 PE=1 SV=1	154	ASLMQLKVTALT
LSLSQLKVTAAT	tr|Q6IVU0|Q6IVU0_MACHU	1996	sp|Q9UF12|HYPDH_HUMAN Hydroxyproline dehydrogenase OS=Homo sapiens OX=9606 GN=PRODH2 PE=1 SV=1	230	ASLMQLKVTALT
WLDDNVILLRQG	tr|Q8AZ68|Q8AZ68_MACHU	239	tr|A0A0G2JHI1|A0A0G2JHI1_HUMAN Retinoic acid receptor RXR-beta (Fragment) OS=Homo sapiens OX=9606 GN=RXRB PE=1 SV=1	35	PLDDQVILLRAG
WLDDNVILLRQG	tr|Q8AZ68|Q8AZ68_MACHU	239	sp|P19793|RXRA_HUMAN Retinoic acid receptor RXR-alpha OS=Homo sapiens OX=9606 GN=RXRA PE=1 SV=1	293	PLDDQVILLRAG
WLDDNVILLRQG	tr|Q8AZ68|Q8AZ68_MACHU	239	tr|A0A5F9ZHH6|A0A5F9ZHH6_HUMAN Retinoic acid receptor RXR-alpha OS=Homo sapiens OX=9606 GN=RXRA PE=1 SV=1	266	PLDDQVILLRAG
WLDDNVILLRQG	tr|Q8AZ68|Q8AZ68_MACHU	239	tr|A0A0G2JKR7|A0A0G2JKR7_HUMAN Retinoic acid receptor RXR-beta OS=Homo sapiens OX=9606 GN=RXRB PE=1 SV=1	174	PLDDQVILLRAG
WLDDNVILLRQG	tr|Q8AZ68|Q8AZ68_MACHU	239	sp|P28702|RXRB_HUMAN Retinoic acid receptor RXR-beta OS=Homo sapiens OX=9606 GN=RXRB PE=1 SV=2	364	PLDDQVILLRAG
SELERTFSLSGS	tr|Q6IVU0|Q6IVU0_MACHU	1421	sp|Q8TF01|PNISR_HUMAN Arginine/serine-rich protein PNISR OS=Homo sapiens OX=9606 GN=PNISR PE=1 SV=2	715	RESERTFSRSGS
LLGMDLYRPFLS	tr|Q6IVU0|Q6IVU0_MACHU	571	tr|J3KT79|J3KT79_HUMAN Secernin-2 OS=Homo sapiens OX=9606 GN=SCRN2 PE=1 SV=1	112	LLGMDLLRPFHG
GGNLPLKEELTA	tr|Q6IVU0|Q6IVU0_MACHU	527	sp|Q86YL5|TDRP_HUMAN Testis development-related protein OS=Homo sapiens OX=9606 GN=TDRP PE=1 SV=2	71	GTNLRLKEELKA
LYDLLKLSLSQL	tr|Q6IVU0|Q6IVU0_MACHU	1990	tr|A0A669KBE7|A0A669KBE7_HUMAN ADAMTS-like protein 4 OS=Homo sapiens OX=9606 GN=ADAMTSL4 PE=1 SV=1	10	LYLLLLLSLPQL
LYDLLKLSLSQL	tr|Q6IVU0|Q6IVU0_MACHU	1990	sp|Q6UY14|ATL4_HUMAN ADAMTS-like protein 4 OS=Homo sapiens OX=9606 GN=ADAMTSL4 PE=1 SV=2	10	LYLLLLLSLPQL
SATGGGSFPNIK	tr|Q6IVU0|Q6IVU0_MACHU	168	sp|O15211|RGL2_HUMAN Ral guanine nucleotide dissociation stimulator-like 2 OS=Homo sapiens OX=9606 GN=RGL2 PE=1 SV=1	755	SEGGGGSFPRIK
VPPEFIENDKGL	tr|Q6IVU0|Q6IVU0_MACHU	1197	sp|O60674|JAK2_HUMAN Tyrosine-protein kinase JAK2 OS=Homo sapiens OX=9606 GN=JAK2 PE=1 SV=2	719	VPPECIENPKNL
SKLKKSHLKFCI	tr|Q8AZ57|Q8AZ57_MACHU	260	sp|Q9NR09|BIRC6_HUMAN Baculoviral IAP repeat-containing protein 6 OS=Homo sapiens OX=9606 GN=BIRC6 PE=1 SV=2	415	SKLMKVHLKFEI
SKLKKSHLKFCI	tr|Q8AZ57|Q8AZ57_MACHU	260	tr|A0A3B3IUB9|A0A3B3IUB9_HUMAN Baculoviral IAP repeat-containing protein 6 (Fragment) OS=Homo sapiens OX=9606 GN=BIRC6 PE=1 SV=1	361	SKLMKVHLKFEI
QVKRLGLAIVIK	tr|Q8AZ68|Q8AZ68_MACHU	268	sp|O76027|ANXA9_HUMAN Annexin A9 OS=Homo sapiens OX=9606 GN=ANXA9 PE=1 SV=3	258	QVALLGLASVIK
KGVIFQKDAQVS	tr|Q6IVU0|Q6IVU0_MACHU	949	tr|A0A0C4DGE7|A0A0C4DGE7_HUMAN Ellis van Creveld syndrome 2 (Limbin), isoform CRA_c OS=Homo sapiens OX=9606 GN=EVC2 PE=1 SV=1	84	NGVIFQKCALVS
KGVIFQKDAQVS	tr|Q6IVU0|Q6IVU0_MACHU	949	sp|Q86UK5|LBN_HUMAN Limbin OS=Homo sapiens OX=9606 GN=EVC2 PE=2 SV=1	164	NGVIFQKCALVS
KGVIFQKDAQVS	tr|Q6IVU0|Q6IVU0_MACHU	949	tr|E9PFT2|E9PFT2_HUMAN Limbin OS=Homo sapiens OX=9606 GN=EVC2 PE=4 SV=1	84	NGVIFQKCALVS
ELERTFSLSGSR	tr|Q6IVU0|Q6IVU0_MACHU	1422	sp|Q8TF01|PNISR_HUMAN Arginine/serine-rich protein PNISR OS=Homo sapiens OX=9606 GN=PNISR PE=1 SV=2	716	ESERTFSRSGSI
TLVDLLTDLTWL	tr|Q8AZ68|Q8AZ68_MACHU	166	sp|A6NNT2|CP096_HUMAN Uncharacterized protein C16orf96 OS=Homo sapiens OX=9606 GN=C16orf96 PE=4 SV=3	144	TLQDLLTDLHAL
AEQVKRLGLAIV	tr|Q8AZ68|Q8AZ68_MACHU	266	tr|A0A1W2PRX2|A0A1W2PRX2_HUMAN Uncharacterized protein OS=Homo sapiens OX=9606 PE=4 SV=1	49	AEQVLRLGLALS
SLSQLKVTAATE	tr|Q6IVU0|Q6IVU0_MACHU	1997	tr|A0A590UKC3|A0A590UKC3_HUMAN Proline dehydrogenase OS=Homo sapiens OX=9606 GN=PRODH2 PE=1 SV=1	155	SLMQLKVTALTS
SLSQLKVTAATE	tr|Q6IVU0|Q6IVU0_MACHU	1997	sp|Q9UF12|HYPDH_HUMAN Hydroxyproline dehydrogenase OS=Homo sapiens OX=9606 GN=PRODH2 PE=1 SV=1	231	SLMQLKVTALTS
DKRMVNVRDLSL	tr|Q6IVU0|Q6IVU0_MACHU	1371	tr|X6R8I9|X6R8I9_HUMAN Tumor necrosis factor ligand superfamily member 15 OS=Homo sapiens OX=9606 GN=TNFSF15 PE=1 SV=1	147	DKLMVNVSDISL
DKRMVNVRDLSL	tr|Q6IVU0|Q6IVU0_MACHU	1371	sp|O95150|TNF15_HUMAN Tumor necrosis factor ligand superfamily member 15 OS=Homo sapiens OX=9606 GN=TNFSF15 PE=1 SV=2	224	DKLMVNVSDISL
EDGSGNKSLLTL	tr|Q8AZ68|Q8AZ68_MACHU	56	sp|Q15058|KIF14_HUMAN Kinesin-like protein KIF14 OS=Homo sapiens OX=9606 GN=KIF14 PE=1 SV=1	622	EGVSINKSLLTL
LERTFSLSGSRS	tr|Q6IVU0|Q6IVU0_MACHU	1423	sp|Q8TF01|PNISR_HUMAN Arginine/serine-rich protein PNISR OS=Homo sapiens OX=9606 GN=PNISR PE=1 SV=2	717	SERTFSRSGSIS
TKFLLLRETELV	tr|Q6IVU0|Q6IVU0_MACHU	913	tr|E9PKV5|E9PKV5_HUMAN Polyribonucleotide 5'-hydroxyl-kinase Clp1 (Fragment) OS=Homo sapiens OX=9606 GN=CLP1 PE=1 SV=1	13	TKFELERETELR
TKFLLLRETELV	tr|Q6IVU0|Q6IVU0_MACHU	913	tr|E9PJM4|E9PJM4_HUMAN Polyribonucleotide 5'-hydroxyl-kinase Clp1 (Fragment) OS=Homo sapiens OX=9606 GN=CLP1 PE=1 SV=1	13	TKFELERETELR
TKFLLLRETELV	tr|Q6IVU0|Q6IVU0_MACHU	913	sp|Q92989|CLP1_HUMAN Polyribonucleotide 5'-hydroxyl-kinase Clp1 OS=Homo sapiens OX=9606 GN=CLP1 PE=1 SV=1	13	TKFELERETELR
TKFLLLRETELV	tr|Q6IVU0|Q6IVU0_MACHU	913	tr|E9PL17|E9PL17_HUMAN Polyribonucleotide 5'-hydroxyl-kinase Clp1 OS=Homo sapiens OX=9606 GN=CLP1 PE=1 SV=1	24	TKFELERETELR
SFLENQSKARDE	tr|Q8AZ68|Q8AZ68_MACHU	483	sp|Q9NTG1|PKDRE_HUMAN Polycystic kidney disease and receptor for egg jelly-related protein OS=Homo sapiens OX=9606 GN=PKDREJ PE=2 SV=2	2205	SFLTSQSKAKDE
PPEFIENDKGLN	tr|Q6IVU0|Q6IVU0_MACHU	1198	sp|O60674|JAK2_HUMAN Tyrosine-protein kinase JAK2 OS=Homo sapiens OX=9606 GN=JAK2 PE=1 SV=2	720	PPECIENPKNLN
QLKVTAATEDCK	tr|Q6IVU0|Q6IVU0_MACHU	2000	tr|H0YGD3|H0YGD3_HUMAN Nesprin-1 (Fragment) OS=Homo sapiens OX=9606 GN=SYNE1 PE=1 SV=1	9	QAKVTAAKEDWK
QLKVTAATEDCK	tr|Q6IVU0|Q6IVU0_MACHU	2000	tr|E7ENN3|E7ENN3_HUMAN Nesprin-1 OS=Homo sapiens OX=9606 GN=SYNE1 PE=1 SV=2	3166	QAKVTAAKEDWK
QLKVTAATEDCK	tr|Q6IVU0|Q6IVU0_MACHU	2000	tr|A0A0C4DG40|A0A0C4DG40_HUMAN Nesprin-1 OS=Homo sapiens OX=9606 GN=SYNE1 PE=1 SV=1	3151	QAKVTAAKEDWK
QLKVTAATEDCK	tr|Q6IVU0|Q6IVU0_MACHU	2000	sp|Q8NF91|SYNE1_HUMAN Nesprin-1 OS=Homo sapiens OX=9606 GN=SYNE1 PE=1 SV=4	3144	QAKVTAAKEDWK
QLKVTAATEDCK	tr|Q6IVU0|Q6IVU0_MACHU	2000	tr|A0A0C4DH48|A0A0C4DH48_HUMAN Nesprin-1 (Fragment) OS=Homo sapiens OX=9606 GN=SYNE1 PE=1 SV=1	260	QAKVTAAKEDWK
RTFSLSGSRSLK	tr|Q6IVU0|Q6IVU0_MACHU	1425	sp|Q8TF01|PNISR_HUMAN Arginine/serine-rich protein PNISR OS=Homo sapiens OX=9606 GN=PNISR PE=1 SV=2	719	RTFSRSGSISVK
LNISKSTEVLSV	tr|Q6IVU0|Q6IVU0_MACHU	1014	sp|Q96RT1|ERBIN_HUMAN Erbin OS=Homo sapiens OX=9606 GN=ERBIN PE=1 SV=2	847	LGISKSTEDLSP
GGGSFPNIKQGG	tr|Q6IVU0|Q6IVU0_MACHU	171	sp|O15211|RGL2_HUMAN Ral guanine nucleotide dissociation stimulator-like 2 OS=Homo sapiens OX=9606 GN=RGL2 PE=1 SV=1	758	GGGSFPRIKATG
SDKDLSSLRLNQ	tr|Q6IVU0|Q6IVU0_MACHU	1454	sp|Q6ZSZ6|TSH1_HUMAN Teashirt homolog 1 OS=Homo sapiens OX=9606 GN=TSHZ1 PE=1 SV=2	996	SLKDLSKLPLNQ
VYISIRVPGFDP	tr|Q6IVU0|Q6IVU0_MACHU	770	sp|Q8TC92|ENOX1_HUMAN Ecto-NOX disulfide-thiol exchanger 1 OS=Homo sapiens OX=9606 GN=ENOX1 PE=1 SV=1	68	VSDSICVPGFDP
ALVPFVSSLRIA	tr|Q6IVU0|Q6IVU0_MACHU	486	sp|Q8N616|TM148_HUMAN Putative uncharacterized protein encoded by LINC00311 OS=Homo sapiens OX=9606 GN=LINC00311 PE=5 SV=1	40	ALVPPVSSLRPN
FSFLENQSKARD	tr|Q8AZ68|Q8AZ68_MACHU	482	sp|Q9NTG1|PKDRE_HUMAN Polycystic kidney disease and receptor for egg jelly-related protein OS=Homo sapiens OX=9606 GN=PKDREJ PE=2 SV=2	2204	FSFLTSQSKAKD
LLLFVLVPGVHF	tr|Q6IVU0|Q6IVU0_MACHU	1246	sp|Q07954|LRP1_HUMAN Prolow-density lipoprotein receptor-related protein 1 OS=Homo sapiens OX=9606 GN=LRP1 PE=1 SV=2	4431	LLLLVLVAGVVF
RKQRRLVSQSPS	tr|Q8AZ68|Q8AZ68_MACHU	251	tr|A0A0U1RRB6|A0A0U1RRB6_HUMAN Exocyst complex component OS=Homo sapiens OX=9606 GN=EXOC6B PE=1 SV=1	320	RKQARLVLQPPS
RKQRRLVSQSPS	tr|Q8AZ68|Q8AZ68_MACHU	251	sp|Q9Y2D4|EXC6B_HUMAN Exocyst complex component 6B OS=Homo sapiens OX=9606 GN=EXOC6B PE=1 SV=3	320	RKQARLVLQPPS
RKQRRLVSQSPS	tr|Q8AZ68|Q8AZ68_MACHU	251	tr|J3QT38|J3QT38_HUMAN Exocyst complex component OS=Homo sapiens OX=9606 GN=EXOC6B PE=1 SV=1	320	RKQARLVLQPPS
PLNISKSTEVLS	tr|Q6IVU0|Q6IVU0_MACHU	1013	sp|Q96RT1|ERBIN_HUMAN Erbin OS=Homo sapiens OX=9606 GN=ERBIN PE=1 SV=2	846	DLGISKSTEDLS
LLLAVFVQLGEL	tr|Q6IVU0|Q6IVU0_MACHU	221	tr|K7ENX1|K7ENX1_HUMAN Relaxin-3 OS=Homo sapiens OX=9606 GN=RLN3 PE=4 SV=1	8	LLLAVWVLTGEL
LLLAVFVQLGEL	tr|Q6IVU0|Q6IVU0_MACHU	221	sp|Q8WXF3|REL3_HUMAN Relaxin-3 OS=Homo sapiens OX=9606 GN=RLN3 PE=1 SV=1	8	LLLAVWVLTGEL
LSPAHVSKSGML	tr|Q6IVU0|Q6IVU0_MACHU	269	sp|Q8NFQ6|BPIFC_HUMAN BPI fold-containing family C protein OS=Homo sapiens OX=9606 GN=BPIFC PE=2 SV=1	165	LSHAHVSFSGEL
LQARSTESDLVD	tr|Q6IVU0|Q6IVU0_MACHU	1622	sp|Q9UKN1|MUC12_HUMAN Mucin-12 OS=Homo sapiens OX=9606 GN=MUC12 PE=1 SV=2	5063	LPARSTASDLVG
SALVPFVSSLRI	tr|Q6IVU0|Q6IVU0_MACHU	485	sp|Q8N616|TM148_HUMAN Putative uncharacterized protein encoded by LINC00311 OS=Homo sapiens OX=9606 GN=LINC00311 PE=5 SV=1	39	AALVPPVSSLRP
VEAGVAKLDNLY	tr|Q8AZ68|Q8AZ68_MACHU	92	sp|P48637|GSHB_HUMAN Glutathione synthetase OS=Homo sapiens OX=9606 GN=GSS PE=1 SV=1	461	VAAGVAVLDNPY
VEAGVAKLDNLY	tr|Q8AZ68|Q8AZ68_MACHU	92	tr|A0A2R8Y5T7|A0A2R8Y5T7_HUMAN Glutathione synthase (Fragment) OS=Homo sapiens OX=9606 GN=GSS PE=1 SV=1	347	VAAGVAVLDNPY
