query	query_seqname	query_start	target_seqname	target_start	target
PLVVCLITSACA	sp|Q9QR69|K15_HHV8P	10	tr|E5RJJ0|E5RJJ0_HUMAN Transmembrane protein 71 OS=Homo sapiens OX=9606 GN=TMEM71 PE=4 SV=1	239	LLAVCLIISACA
PLVVCLITSACA	sp|Q9QR69|K15_HHV8P	10	sp|Q6P5X7|TMM71_HUMAN Transmembrane protein 71 OS=Homo sapiens OX=9606 GN=TMEM71 PE=1 SV=2	239	LLAVCLIISACA
DYHSATSTPTST	sp|Q2HR63|SCP_HHV8P	65	tr|E9PMC9|E9PMC9_HUMAN BRCA2-interacting transcriptional repressor EMSY OS=Homo sapiens OX=9606 GN=EMSY PE=1 SV=1	146	SYTSTTSTPTST
DYHSATSTPTST	sp|Q2HR63|SCP_HHV8P	65	sp|Q7Z589|EMSY_HUMAN BRCA2-interacting transcriptional repressor EMSY OS=Homo sapiens OX=9606 GN=EMSY PE=1 SV=2	145	SYTSTTSTPTST
RSPRAVPVDTAA	sp|F5HB39|CVC1_HHV8P	101	tr|A0A494C0S0|A0A494C0S0_HUMAN Sorting nexin-25 OS=Homo sapiens OX=9606 GN=SNX25 PE=1 SV=1	116	RSPRAQPPDFAA
GAGAELSEAGPP	sp|Q2HRB2|UL24_HHV8P	81	sp|O15354|GPR37_HUMAN Prosaposin receptor GPR37 OS=Homo sapiens OX=9606 GN=GPR37 PE=1 SV=2	99	GRGAEASAAGPP
VQPIKSVQLYLS	sp|Q98157|VMI2_HHV8P	77	sp|Q14773|ICAM4_HUMAN Intercellular adhesion molecule 4 OS=Homo sapiens OX=9606 GN=ICAM4 PE=1 SV=1	59	VQPGKSVQLNCS
LAAVIQEEKVQQ	sp|F5HGN8|TRX2_HHV8P	229	tr|R4GMY6|R4GMY6_HUMAN Multimerin-2 (Fragment) OS=Homo sapiens OX=9606 GN=MMRN2 PE=1 SV=1	102	LAAVINEVEVQQ
LAAVIQEEKVQQ	sp|F5HGN8|TRX2_HHV8P	229	tr|V9GY43|V9GY43_HUMAN Multimerin-2 (Fragment) OS=Homo sapiens OX=9606 GN=MMRN2 PE=1 SV=1	63	LAAVINEVEVQQ
LAAVIQEEKVQQ	sp|F5HGN8|TRX2_HHV8P	229	tr|V9GYS9|V9GYS9_HUMAN Multimerin-2 (Fragment) OS=Homo sapiens OX=9606 GN=MMRN2 PE=1 SV=1	137	LAAVINEVEVQQ
LAAVIQEEKVQQ	sp|F5HGN8|TRX2_HHV8P	229	sp|Q9H8L6|MMRN2_HUMAN Multimerin-2 OS=Homo sapiens OX=9606 GN=MMRN2 PE=1 SV=2	163	LAAVINEVEVQQ
RVLELTVRDSGW	sp|F5HGN8|TRX2_HHV8P	16	sp|Q96N16|JKIP1_HUMAN Janus kinase and microtubule-interacting protein 1 OS=Homo sapiens OX=9606 GN=JAKMIP1 PE=1 SV=1	597	RVLELEVRDSIC
TLPAEQLLLSSR	sp|Q77Q36|VCYCL_HHV8P	184	sp|Q8NEP3|DAAF1_HUMAN Dynein assembly factor 1, axonemal OS=Homo sapiens OX=9606 GN=DNAAF1 PE=2 SV=5	467	TLPAETLLLSPP
TLPAEQLLLSSR	sp|Q77Q36|VCYCL_HHV8P	184	sp|Q8NEP3|DAAF1_HUMAN Dynein assembly factor 1, axonemal OS=Homo sapiens OX=9606 GN=DNAAF1 PE=2 SV=5	415	TLPAETLLLSSP
PFLDALEQGPGS	sp|F5HCV3|ORF50_HHV8P	254	tr|A0A0G2JJT9|A0A0G2JJT9_HUMAN Valine--tRNA ligase (Fragment) OS=Homo sapiens OX=9606 GN=VARS1 PE=1 SV=1	55	PRLPALEQGPGG
PFLDALEQGPGS	sp|F5HCV3|ORF50_HHV8P	254	tr|A2ABF4|A2ABF4_HUMAN Valine--tRNA ligase (Fragment) OS=Homo sapiens OX=9606 GN=VARS1 PE=1 SV=1	55	PRLPALEQGPGG
PFLDALEQGPGS	sp|F5HCV3|ORF50_HHV8P	254	tr|A0A140T954|A0A140T954_HUMAN Valine--tRNA ligase (Fragment) OS=Homo sapiens OX=9606 GN=VARS1 PE=1 SV=1	55	PRLPALEQGPGG
PFLDALEQGPGS	sp|F5HCV3|ORF50_HHV8P	254	sp|P26640|SYVC_HUMAN Valine--tRNA ligase OS=Homo sapiens OX=9606 GN=VARS1 PE=1 SV=4	55	PRLPALEQGPGG
PRGCTLLLLFLA	sp|F5HFD2|ORF24_HHV8P	722	sp|P51805|PLXA3_HUMAN Plexin-A3 OS=Homo sapiens OX=9606 GN=PLXNA3 PE=1 SV=2	2	PSVCLLLLLFLA
PLRALRLGRGTD	sp|F5HG20|UL49_HHV8P	196	tr|F8VYK9|F8VYK9_HUMAN Insulin-like growth factor-binding protein 6 OS=Homo sapiens OX=9606 GN=IGFBP6 PE=1 SV=1	93	PLRALLLGRGRC
PLRALRLGRGTD	sp|F5HG20|UL49_HHV8P	196	sp|P24592|IBP6_HUMAN Insulin-like growth factor-binding protein 6 OS=Homo sapiens OX=9606 GN=IGFBP6 PE=1 SV=1	93	PLRALLLGRGRC
PLRALRLGRGTD	sp|F5HG20|UL49_HHV8P	196	tr|F8VVA5|F8VVA5_HUMAN Insulin-like growth factor-binding protein 6 OS=Homo sapiens OX=9606 GN=IGFBP6 PE=1 SV=1	93	PLRALLLGRGRC
SGMLLHPYSLFL	sp|F5H8Y5|TRX1_HHV8P	116	tr|H7BYK3|H7BYK3_HUMAN Protein unc-50 homolog (Fragment) OS=Homo sapiens OX=9606 GN=UNC50 PE=3 SV=1	116	TGMELHPYSLFF
VFPFPESLFVRG	sp|Q2HR64|LTP_HHV8P	1131	tr|A0A3B3IRX3|A0A3B3IRX3_HUMAN Mediator of RNA polymerase II transcription subunit 13 OS=Homo sapiens OX=9606 GN=MED13L PE=1 SV=1	1865	PFPFPISLFVRS
PGQPSAVPLEQL	sp|Q9QR71|LANA1_HHV8P	607	tr|A0A0J9YY01|A0A0J9YY01_HUMAN Unconventional myosin-XVB OS=Homo sapiens OX=9606 GN=MYO15B PE=1 SV=1	1535	PGQPLAKPLTQL
PGQPSAVPLEQL	sp|Q9QR71|LANA1_HHV8P	607	tr|A0A286YF23|A0A286YF23_HUMAN Unconventional myosin-XVB OS=Homo sapiens OX=9606 GN=MYO15B PE=1 SV=1	71	PGQPLAKPLTQL
PGQPSAVPLEQL	sp|Q9QR71|LANA1_HHV8P	607	tr|A0A2R8YFM0|A0A2R8YFM0_HUMAN Unconventional myosin-XVB OS=Homo sapiens OX=9606 GN=MYO15B PE=1 SV=2	1583	PGQPLAKPLTQL
PGQPSAVPLEQL	sp|Q9QR71|LANA1_HHV8P	607	sp|Q96JP2|MY15B_HUMAN Unconventional myosin-XVB OS=Homo sapiens OX=9606 GN=MYO15B PE=1 SV=3	493	PGQPLAKPLTQL
VSVCCNVGGCCV	sp|F5HCV3|ORF50_HHV8P	76	tr|K7EJE2|K7EJE2_HUMAN Flt3-interacting zinc finger protein 1 (Fragment) OS=Homo sapiens OX=9606 GN=FIZ1 PE=1 SV=8	151	CSVCCNVGPCSV
VSVCCNVGGCCV	sp|F5HCV3|ORF50_HHV8P	76	sp|Q96SL8|FIZ1_HUMAN Flt3-interacting zinc finger protein 1 OS=Homo sapiens OX=9606 GN=FIZ1 PE=1 SV=2	151	CSVCCNVGPCSV
VREELQLPFIAD	sp|F5HAK9|GH_HHV8P	527	tr|E9PRP1|E9PRP1_HUMAN FERM domain-containing protein 8 (Fragment) OS=Homo sapiens OX=9606 GN=FRMD8 PE=1 SV=1	53	VREVLQLPDIAL
VREELQLPFIAD	sp|F5HAK9|GH_HHV8P	527	tr|E9PRA3|E9PRA3_HUMAN FERM domain-containing protein 8 (Fragment) OS=Homo sapiens OX=9606 GN=FRMD8 PE=1 SV=1	61	VREVLQLPDIAL
VREELQLPFIAD	sp|F5HAK9|GH_HHV8P	527	sp|Q9BZ67|FRMD8_HUMAN FERM domain-containing protein 8 OS=Homo sapiens OX=9606 GN=FRMD8 PE=1 SV=1	61	VREVLQLPDIAL
SAMSNRPGRSDS	sp|F5HFD2|ORF24_HHV8P	451	sp|Q8WZ74|CTTB2_HUMAN Cortactin-binding protein 2 OS=Homo sapiens OX=9606 GN=CTTNBP2 PE=1 SV=1	672	SASSCRPGASDS
ATRGTTEAHTGG	sp|Q2HRB3|CVC2_HHV8P	4	sp|O94776|MTA2_HUMAN Metastasis-associated protein MTA2 OS=Homo sapiens OX=9606 GN=MTA2 PE=1 SV=1	413	ATRGTTEPHSRG
TVPPGYPRSLLE	sp|Q2HR71|VIRF2_HHV8P	351	sp|Q9Y5R2|MMP24_HUMAN Matrix metalloproteinase-24 OS=Homo sapiens OX=9606 GN=MMP24 PE=2 SV=1	455	TVEPGYPHSLGE
RHILRKRFRVTA	sp|F5HAI6|CEP1_HHV8P	135	sp|Q5VZ03|NXNL2_HUMAN Nucleoredoxin-like protein 2 OS=Homo sapiens OX=9606 GN=NXNL2 PE=2 SV=1	100	RHELRKRYNVTA
VRLPAEIDLVTV	sp|F5HCV3|ORF50_HHV8P	155	tr|A0A6Q8PHB1|A0A6Q8PHB1_HUMAN Heat shock protein beta-8 (Fragment) OS=Homo sapiens OX=9606 GN=HSPB8 PE=1 SV=1	45	VRLPAEVDPVTV
TQLFPILLPGPA	sp|Q2HR98|UL95_HHV8P	196	sp|A6NF89|OR6C6_HUMAN Olfactory receptor 6C6 OS=Homo sapiens OX=9606 GN=OR6C6 PE=3 SV=1	97	TQLFFILLPGVT
GQQEELQEREQE	sp|Q9QR71|LANA1_HHV8P	197	sp|Q6DT37|MRCKG_HUMAN Serine/threonine-protein kinase MRCK gamma OS=Homo sapiens OX=9606 GN=CDC42BPG PE=1 SV=2	517	GQQEELLQRLQE
EVGPVKESSPVA	sp|Q2HR64|LTP_HHV8P	2402	sp|Q13332|PTPRS_HUMAN Receptor-type tyrosine-protein phosphatase S OS=Homo sapiens OX=9606 GN=PTPRS PE=1 SV=3	701	EVGPGPESSPVV
ASCISNSLSQGP	sp|Q2HR73|VIRF4_HHV8P	809	sp|Q9NXL9|MCM9_HUMAN DNA helicase MCM9 OS=Homo sapiens OX=9606 GN=MCM9 PE=1 SV=4	773	ASKISNSTSQGK
RIRAVERGESAV	sp|F5HIN0|PRIM_HHV8P	786	tr|A0A087X128|A0A087X128_HUMAN Protein turtle homolog A OS=Homo sapiens OX=9606 GN=IGSF9 PE=1 SV=1	192	RIRRVERGSSGV
RIRAVERGESAV	sp|F5HIN0|PRIM_HHV8P	786	sp|Q9P2J2|TUTLA_HUMAN Protein turtle homolog A OS=Homo sapiens OX=9606 GN=IGSF9 PE=1 SV=2	192	RIRRVERGSSGV
GAETEQKEEDDE	sp|Q9QR71|LANA1_HHV8P	628	tr|A0A087WX51|A0A087WX51_HUMAN DNA polymerase epsilon catalytic subunit A (Fragment) OS=Homo sapiens OX=9606 GN=POLE PE=1 SV=1	42	GAEDEQENEDDE
GAETEQKEEDDE	sp|Q9QR71|LANA1_HHV8P	628	tr|A0A087WW42|A0A087WW42_HUMAN DNA polymerase epsilon catalytic subunit (Fragment) OS=Homo sapiens OX=9606 GN=POLE PE=1 SV=1	45	GAEDEQENEDDE
GAETEQKEEDDE	sp|Q9QR71|LANA1_HHV8P	628	sp|Q07864|DPOE1_HUMAN DNA polymerase epsilon catalytic subunit A OS=Homo sapiens OX=9606 GN=POLE PE=1 SV=5	1945	GAEDEQENEDDE
GAETEQKEEDDE	sp|Q9QR71|LANA1_HHV8P	628	tr|F5H1D6|F5H1D6_HUMAN DNA polymerase epsilon catalytic subunit OS=Homo sapiens OX=9606 GN=POLE PE=1 SV=1	1918	GAEDEQENEDDE
APDLAKPTVESV	sp|F5HCV3|ORF50_HHV8P	417	tr|E7ENL6|E7ENL6_HUMAN Collagen alpha-3(VI) chain OS=Homo sapiens OX=9606 GN=COL6A3 PE=1 SV=2	2555	APVLAKPGVISV
APDLAKPTVESV	sp|F5HCV3|ORF50_HHV8P	417	sp|P12111|CO6A3_HUMAN Collagen alpha-3(VI) chain OS=Homo sapiens OX=9606 GN=COL6A3 PE=1 SV=5	3163	APVLAKPGVISV
PQTELLTPSLES	sp|Q2HR73|VIRF4_HHV8P	635	tr|H3BNY9|H3BNY9_HUMAN Phosphomannomutase OS=Homo sapiens OX=9606 GN=PMM2 PE=1 SV=1	78	NQRGLLTPSLES
TRLSSVAQEDPK	sp|Q2HRC8|ORF11_HHV8P	217	tr|A0A0U1RR71|A0A0U1RR71_HUMAN Pleckstrin homology domain-containing family G member 3 (Fragment) OS=Homo sapiens OX=9606 GN=PLEKHG3 PE=1 SV=1	558	SRRSSVAQEDSK
TRLSSVAQEDPK	sp|Q2HRC8|ORF11_HHV8P	217	sp|A1L390|PKHG3_HUMAN Pleckstrin homology domain-containing family G member 3 OS=Homo sapiens OX=9606 GN=PLEKHG3 PE=1 SV=1	614	SRRSSVAQEDSK
TRLSSVAQEDPK	sp|Q2HRC8|ORF11_HHV8P	217	tr|G3V311|G3V311_HUMAN Pleckstrin homology domain-containing family G member 3 OS=Homo sapiens OX=9606 GN=PLEKHG3 PE=1 SV=1	119	SRRSSVAQEDSK
TRELLVLSVGAA	sp|F5HB39|CVC1_HHV8P	315	sp|Q86VD9|PIGZ_HUMAN GPI mannosyltransferase 4 OS=Homo sapiens OX=9606 GN=PIGZ PE=2 SV=4	255	TREALVLLPGAA
TRELLVLSVGAA	sp|F5HB39|CVC1_HHV8P	315	tr|A0A087WXI2|A0A087WXI2_HUMAN IgGFc-binding protein OS=Homo sapiens OX=9606 GN=FCGBP PE=1 SV=3	4030	TRGLCVLSVGAN
TRELLVLSVGAA	sp|F5HB39|CVC1_HHV8P	315	sp|Q9Y6R7|FCGBP_HUMAN IgGFc-binding protein OS=Homo sapiens OX=9606 GN=FCGBP PE=1 SV=3	5231	TRGLCVLSVGAN
RLCRSGEEGYQL	sp|Q2HR64|LTP_HHV8P	1933	sp|Q8TDN1|KCNG4_HUMAN Potassium voltage-gated channel subfamily G member 4 OS=Homo sapiens OX=9606 GN=KCNG4 PE=1 SV=1	89	RLCRSYEEIVQL
AIQKPPLGGRSL	sp|Q2HRB3|CVC2_HHV8P	418	tr|H0Y659|H0Y659_HUMAN E3 ubiquitin-protein ligase HUWE1 (Fragment) OS=Homo sapiens OX=9606 GN=HUWE1 PE=1 SV=1	532	ASQKRPLGGREL
AIQKPPLGGRSL	sp|Q2HRB3|CVC2_HHV8P	418	sp|Q7Z6Z7|HUWE1_HUMAN E3 ubiquitin-protein ligase HUWE1 OS=Homo sapiens OX=9606 GN=HUWE1 PE=1 SV=3	3694	ASQKRPLGGREL
LLPTRRPLCRMR	sp|Q2HRD5|K1_HHV8P	138	tr|Q5SRQ3|Q5SRQ3_HUMAN Casein kinase II subunit beta OS=Homo sapiens OX=9606 GN=CSNK2B PE=1 SV=1	196	LLPRRRPFCRMH
AATAPRASATAS	sp|F5HF47|UL32_HHV8P	332	tr|M0QZL7|M0QZL7_HUMAN Tubulin beta-4A chain (Fragment) OS=Homo sapiens OX=9606 GN=TUBB4A PE=1 SV=8	32	AAAAPRARATAA
AATAPRASATAS	sp|F5HF47|UL32_HHV8P	332	tr|M0R278|M0R278_HUMAN Tubulin beta-4A chain (Fragment) OS=Homo sapiens OX=9606 GN=TUBB4A PE=1 SV=1	26	AAAAPRARATAA
AATAPRASATAS	sp|F5HF47|UL32_HHV8P	332	tr|E9PBC6|E9PBC6_HUMAN Transforming acidic coiled-coil-containing protein 2 OS=Homo sapiens OX=9606 GN=TACC2 PE=1 SV=1	1347	AATAPGAGAKAS
AATAPRASATAS	sp|F5HF47|UL32_HHV8P	332	tr|E7EMZ9|E7EMZ9_HUMAN Transforming acidic coiled-coil-containing protein 2 OS=Homo sapiens OX=9606 GN=TACC2 PE=1 SV=1	1347	AATAPGAGAKAS
AATAPRASATAS	sp|F5HF47|UL32_HHV8P	332	sp|O95359|TACC2_HUMAN Transforming acidic coiled-coil-containing protein 2 OS=Homo sapiens OX=9606 GN=TACC2 PE=1 SV=3	1347	AATAPGAGAKAS
SSTLTLSPGSGR	sp|F5HID2|PAP_HHV8P	170	sp|Q9UIF8|BAZ2B_HUMAN Bromodomain adjacent to zinc finger domain protein 2B OS=Homo sapiens OX=9606 GN=BAZ2B PE=1 SV=3	722	SSTLTSSPHSGT
IEEAASVSAPLP	sp|Q2HRC8|ORF11_HHV8P	320	tr|K7ENT5|K7ENT5_HUMAN Gametogenetin (Fragment) OS=Homo sapiens OX=9606 GN=GGN PE=1 SV=1	4	PEEAAAVSAPPP
IEEAASVSAPLP	sp|Q2HRC8|ORF11_HHV8P	320	sp|Q86UU5|GGN_HUMAN Gametogenetin OS=Homo sapiens OX=9606 GN=GGN PE=1 SV=2	87	PEEAAAVSAPPP
RAAKVLLSSVKL	sp|Q2HRA7|MCP_HHV8P	970	sp|Q5TIA1|MEI1_HUMAN Meiosis inhibitor protein 1 OS=Homo sapiens OX=9606 GN=MEI1 PE=2 SV=2	975	RAAAVLLSSTGL
HGLWVLSYPASP	sp|Q2HR67|RIR1_HHV8P	433	sp|Q5SZK8|FREM2_HUMAN FRAS1-related extracellular matrix protein 2 OS=Homo sapiens OX=9606 GN=FREM2 PE=1 SV=2	2752	HGLFVLSHPASF
FLALPALLQPLY	sp|F5HAD1|ORF58_HHV8P	211	sp|Q5VWC8|HACD4_HUMAN Very-long-chain (3R)-3-hydroxyacyl-CoA dehydratase 4 OS=Homo sapiens OX=9606 GN=HACD4 PE=1 SV=1	3	PLALPAWLQPRY
ELGSLSILSILV	sp|Q2HR64|LTP_HHV8P	60	sp|A6NIV6|LRIQ4_HUMAN Leucine-rich repeat and IQ domain-containing protein 4 OS=Homo sapiens OX=9606 GN=LRRIQ4 PE=4 SV=2	344	ELGSLSKLKILG
PQPQQQSEPVPF	sp|Q9QR71|LANA1_HHV8P	1003	tr|H0YDN0|H0YDN0_HUMAN Target of Nesh-SH3 (Fragment) OS=Homo sapiens OX=9606 GN=ABI3BP PE=1 SV=8	63	PQIQPVSEPVPF
RIARNMLPPFAQ	sp|Q9QR70|ORF75_HHV8P	1250	tr|H0Y7R8|H0Y7R8_HUMAN Afadin (Fragment) OS=Homo sapiens OX=9606 GN=AFDN PE=1 SV=1	10	CIARVMLPPGAQ
RIARNMLPPFAQ	sp|Q9QR70|ORF75_HHV8P	1250	tr|J3KN01|J3KN01_HUMAN Afadin OS=Homo sapiens OX=9606 GN=AFDN PE=1 SV=1	296	CIARVMLPPGAQ
RIARNMLPPFAQ	sp|Q9QR70|ORF75_HHV8P	1250	tr|A8MQ02|A8MQ02_HUMAN Afadin OS=Homo sapiens OX=9606 GN=AFDN PE=1 SV=2	255	CIARVMLPPGAQ
RIARNMLPPFAQ	sp|Q9QR70|ORF75_HHV8P	1250	sp|P55196|AFAD_HUMAN Afadin OS=Homo sapiens OX=9606 GN=AFDN PE=1 SV=3	296	CIARVMLPPGAQ
RIARNMLPPFAQ	sp|Q9QR70|ORF75_HHV8P	1250	tr|Q5TIG5|Q5TIG5_HUMAN Afadin OS=Homo sapiens OX=9606 GN=AFDN PE=1 SV=1	296	CIARVMLPPGAQ
TESLPLTPEFPY	sp|Q2HRD2|TRM1_HHV8P	234	sp|Q9UBK2|PRGC1_HUMAN Peroxisome proliferator-activated receptor gamma coactivator 1-alpha OS=Homo sapiens OX=9606 GN=PPARGC1A PE=1 SV=1	257	TLSLPLTPESPN
TESLPLTPEFPY	sp|Q2HRD2|TRM1_HHV8P	234	tr|A0A087WTJ3|A0A087WTJ3_HUMAN Peroxisome proliferator-activated receptor gamma coactivator 1-alpha OS=Homo sapiens OX=9606 GN=PPARGC1A PE=1 SV=1	253	TLSLPLTPESPN
TESLPLTPEFPY	sp|Q2HRD2|TRM1_HHV8P	234	tr|A0A087WVW3|A0A087WVW3_HUMAN Peroxisome proliferator-activated receptor gamma coactivator 1-alpha OS=Homo sapiens OX=9606 GN=PPARGC1A PE=1 SV=1	253	TLSLPLTPESPN
PTSVLLLALELV	sp|F5HEU7|ITP_HHV8P	267	sp|Q96M86|DNHD1_HUMAN Dynein heavy chain domain-containing protein 1 OS=Homo sapiens OX=9606 GN=DNHD1 PE=2 SV=2	1669	PALVLLLALEEV
ELARPELLLGAG	sp|Q2HRC6|DYR_HHV8P	173	sp|Q86VR2|RETR3_HUMAN Reticulophagy regulator 3 OS=Homo sapiens OX=9606 GN=RETREG3 PE=1 SV=1	376	EAALPELLLGAL
ELARPELLLGAG	sp|Q2HRC6|DYR_HHV8P	173	tr|K7EQI9|K7EQI9_HUMAN Reticulophagy regulator 3 OS=Homo sapiens OX=9606 GN=RETREG3 PE=1 SV=1	279	EAALPELLLGAL
AAFDHDGCENMI	sp|F5HF47|UL32_HHV8P	282	tr|A0A3B3ITK7|A0A3B3ITK7_HUMAN Phosphoglucomutase-1 OS=Homo sapiens OX=9606 GN=PGM1 PE=1 SV=1	285	AAFDGDGDRNMI
AAFDHDGCENMI	sp|F5HF47|UL32_HHV8P	282	sp|P36871|PGM1_HUMAN Phosphoglucomutase-1 OS=Homo sapiens OX=9606 GN=PGM1 PE=1 SV=3	285	AAFDGDGDRNMI
TSSTLTLSPGSG	sp|F5HID2|PAP_HHV8P	169	sp|P19320|VCAM1_HUMAN Vascular cell adhesion protein 1 OS=Homo sapiens OX=9606 GN=VCAM1 PE=1 SV=1	364	TNSTLTLSPVSF
TSSTLTLSPGSG	sp|F5HID2|PAP_HHV8P	169	sp|Q9UIF8|BAZ2B_HUMAN Bromodomain adjacent to zinc finger domain protein 2B OS=Homo sapiens OX=9606 GN=BAZ2B PE=1 SV=3	721	SSSTLTSSPHSG
RDKTRQKKCYEY	sp|Q2HR64|LTP_HHV8P	2172	tr|H7C0D0|H7C0D0_HUMAN Lanosterol 14-alpha demethylase (Fragment) OS=Homo sapiens OX=9606 GN=CYP51A1 PE=1 SV=1	76	RDKTLQKKCYLE
RDKTRQKKCYEY	sp|Q2HR64|LTP_HHV8P	2172	sp|Q16850|CP51A_HUMAN Lanosterol 14-alpha demethylase OS=Homo sapiens OX=9606 GN=CYP51A1 PE=1 SV=3	329	RDKTLQKKCYLE
RDKTRQKKCYEY	sp|Q2HR64|LTP_HHV8P	2172	tr|A0A0C4DFL7|A0A0C4DFL7_HUMAN Lanosterol 14-alpha demethylase OS=Homo sapiens OX=9606 GN=CYP51A1 PE=1 SV=1	335	RDKTLQKKCYLE
ATDSPEVAVLKL	sp|Q2HR64|LTP_HHV8P	1677	tr|A0A3B3ITZ5|A0A3B3ITZ5_HUMAN DBF4-type zinc finger-containing protein 2 (Fragment) OS=Homo sapiens OX=9606 GN=ZDBF2 PE=1 SV=1	883	VTNSPEVAVKKL
ATDSPEVAVLKL	sp|Q2HR64|LTP_HHV8P	1677	sp|Q9HCK1|ZDBF2_HUMAN DBF4-type zinc finger-containing protein 2 OS=Homo sapiens OX=9606 GN=ZDBF2 PE=1 SV=3	883	VTNSPEVAVKKL
ATDSPEVAVLKL	sp|Q2HR64|LTP_HHV8P	1677	tr|N0DVX5|N0DVX5_HUMAN DBF4-type zinc finger-containing protein 2 OS=Homo sapiens OX=9606 GN=ZDBF2 PE=1 SV=1	881	VTNSPEVAVKKL
LPPLSSVGLEGH	sp|Q2HR71|VIRF2_HHV8P	528	sp|Q8N6P7|I22R1_HUMAN Interleukin-22 receptor subunit alpha-1 OS=Homo sapiens OX=9606 GN=IL22RA1 PE=1 SV=1	496	LPLLSSVQIEGH
AALRRTGSPPLP	sp|Q2HRC6|DYR_HHV8P	25	tr|H0YBK5|H0YBK5_HUMAN Uncharacterized protein C1orf127 (Fragment) OS=Homo sapiens OX=9606 GN=C1orf127 PE=4 SV=1	355	AALRTTPSPPSP
AALRRTGSPPLP	sp|Q2HRC6|DYR_HHV8P	25	sp|Q8N9H9|CA127_HUMAN Uncharacterized protein C1orf127 OS=Homo sapiens OX=9606 GN=C1orf127 PE=2 SV=2	210	AALRTTPSPPSP
AALRRTGSPPLP	sp|Q2HRC6|DYR_HHV8P	25	tr|G8JLG8|G8JLG8_HUMAN Uncharacterized protein C1orf127 OS=Homo sapiens OX=9606 GN=C1orf127 PE=4 SV=1	377	AALRTTPSPPSP
AALRRTGSPPLP	sp|Q2HRC6|DYR_HHV8P	25	tr|H3BM07|H3BM07_HUMAN Uncharacterized protein C1orf127 (Fragment) OS=Homo sapiens OX=9606 GN=C1orf127 PE=4 SV=1	212	AALRTTPSPPSP
SGAESAVRADLL	sp|F5HIC6|VIRF3_HHV8P	216	sp|Q13487|SNPC2_HUMAN snRNA-activating protein complex subunit 2 OS=Homo sapiens OX=9606 GN=SNAPC2 PE=1 SV=1	226	SAAESAVVLDLL
WLRRPLLSHSPL	sp|Q2HRC6|DYR_HHV8P	147	tr|B0QY92|B0QY92_HUMAN Beta-1,4-mannosyl-glycoprotein 4-beta-N-acetylglucosaminyltransferase (Fragment) OS=Homo sapiens OX=9606 GN=MGAT3 PE=4 SV=1	97	LLRTPLYSHSPL
WLRRPLLSHSPL	sp|Q2HRC6|DYR_HHV8P	147	tr|B0QY93|B0QY93_HUMAN Beta-1,4-mannosyl-glycoprotein 4-beta-N-acetylglucosaminyltransferase (Fragment) OS=Homo sapiens OX=9606 GN=MGAT3 PE=1 SV=1	69	LLRTPLYSHSPL
WLRRPLLSHSPL	sp|Q2HRC6|DYR_HHV8P	147	sp|Q09327|MGAT3_HUMAN Beta-1,4-mannosyl-glycoprotein 4-beta-N-acetylglucosaminyltransferase OS=Homo sapiens OX=9606 GN=MGAT3 PE=1 SV=3	69	LLRTPLYSHSPL
NLSGNFSSVFSL	sp|Q2HR95|AN_HHV8P	210	sp|P42684|ABL2_HUMAN Tyrosine-protein kinase ABL2 OS=Homo sapiens OX=9606 GN=ABL2 PE=1 SV=1	684	ELTGNFSSVASL
NLSVSELLTSRF	sp|F5HDB7|GL_HHV8P	79	sp|A4FU69|EFCB5_HUMAN EF-hand calcium-binding domain-containing protein 5 OS=Homo sapiens OX=9606 GN=EFCAB5 PE=1 SV=3	832	PLSVSETLTSFF
NLSVSELLTSRF	sp|F5HDB7|GL_HHV8P	79	tr|K7EJC3|K7EJC3_HUMAN EF-hand calcium-binding domain-containing protein 5 (Fragment) OS=Homo sapiens OX=9606 GN=EFCAB5 PE=1 SV=1	631	PLSVSETLTSFF
RQLFNLLSPVLL	sp|Q9QR69|K15_HHV8P	187	sp|Q9UJ37|SIA7B_HUMAN Alpha-N-acetylgalactosaminide alpha-2,6-sialyltransferase 2 OS=Homo sapiens OX=9606 GN=ST6GALNAC2 PE=1 SV=1	81	RGLFNLSIPVLL
VRAGDALILVSC	sp|Q9QR70|ORF75_HHV8P	816	tr|A0A087X080|A0A087X080_HUMAN Ryanodine receptor 3 OS=Homo sapiens OX=9606 GN=RYR3 PE=1 SV=1	165	VRIGDDLILVSV
VRAGDALILVSC	sp|Q9QR70|ORF75_HHV8P	816	sp|Q15413|RYR3_HUMAN Ryanodine receptor 3 OS=Homo sapiens OX=9606 GN=RYR3 PE=1 SV=3	165	VRIGDDLILVSV
VRAGDALILVSC	sp|Q9QR70|ORF75_HHV8P	816	tr|A0A0X1KG73|A0A0X1KG73_HUMAN Ryanodine receptor 3 OS=Homo sapiens OX=9606 GN=RYR3 PE=1 SV=1	165	VRIGDDLILVSV
VRAGDALILVSC	sp|Q9QR70|ORF75_HHV8P	816	tr|A0A0U1RRH1|A0A0U1RRH1_HUMAN Ryanodine receptor 3 OS=Homo sapiens OX=9606 GN=RYR3 PE=1 SV=1	165	VRIGDDLILVSV
VRAGDALILVSC	sp|Q9QR70|ORF75_HHV8P	816	sp|Q92736|RYR2_HUMAN Ryanodine receptor 2 OS=Homo sapiens OX=9606 GN=RYR2 PE=1 SV=3	175	VRVGDDLILVSV
VRAGDALILVSC	sp|Q9QR70|ORF75_HHV8P	816	tr|H7BY35|H7BY35_HUMAN Ryanodine receptor 2 OS=Homo sapiens OX=9606 GN=RYR2 PE=1 SV=2	159	VRVGDDLILVSV
TSASRLPPSSAL	sp|F5HCV3|ORF50_HHV8P	174	tr|H7BYF2|H7BYF2_HUMAN Nucleoporin p58/p45 (Fragment) OS=Homo sapiens OX=9606 GN=NUP58 PE=1 SV=1	129	TSASGLTLSSAL
TSASRLPPSSAL	sp|F5HCV3|ORF50_HHV8P	174	tr|Q5JRG1|Q5JRG1_HUMAN Nucleoporin p58/p45 (Fragment) OS=Homo sapiens OX=9606 GN=NUP58 PE=1 SV=1	76	TSASGLTLSSAL
TSASRLPPSSAL	sp|F5HCV3|ORF50_HHV8P	174	sp|Q9BVL2|NUP58_HUMAN Nucleoporin p58/p45 OS=Homo sapiens OX=9606 GN=NUP58 PE=1 SV=1	129	TSASGLTLSSAL
NGNVPVCLIDHL	sp|F5HEF2|CEP2_HHV8P	215	tr|A0A6Q8PG65|A0A6Q8PG65_HUMAN Ribitol-5-phosphate transferase OS=Homo sapiens OX=9606 GN=FKTN PE=1 SV=1	67	NQNVPVFLIDPL
NGNVPVCLIDHL	sp|F5HEF2|CEP2_HHV8P	215	tr|A0A6Q8PG93|A0A6Q8PG93_HUMAN Ribitol-5-phosphate transferase OS=Homo sapiens OX=9606 GN=FKTN PE=1 SV=1	67	NQNVPVFLIDPL
NGNVPVCLIDHL	sp|F5HEF2|CEP2_HHV8P	215	sp|O75072|FKTN_HUMAN Fukutin OS=Homo sapiens OX=9606 GN=FKTN PE=1 SV=2	67	NQNVPVFLIDPL
NGNVPVCLIDHL	sp|F5HEF2|CEP2_HHV8P	215	tr|A0A6Q8PF14|A0A6Q8PF14_HUMAN Ribitol-5-phosphate transferase OS=Homo sapiens OX=9606 GN=FKTN PE=1 SV=1	67	NQNVPVFLIDPL
NGNVPVCLIDHL	sp|F5HEF2|CEP2_HHV8P	215	tr|A0A2R8Y768|A0A2R8Y768_HUMAN Ribitol-5-phosphate transferase OS=Homo sapiens OX=9606 GN=FKTN PE=1 SV=1	67	NQNVPVFLIDPL
NGNVPVCLIDHL	sp|F5HEF2|CEP2_HHV8P	215	tr|A0A6Q8PGV4|A0A6Q8PGV4_HUMAN Fukutin OS=Homo sapiens OX=9606 GN=FKTN PE=1 SV=1	67	NQNVPVFLIDPL
NGNVPVCLIDHL	sp|F5HEF2|CEP2_HHV8P	215	tr|A0A6Q8PHN1|A0A6Q8PHN1_HUMAN Fukutin OS=Homo sapiens OX=9606 GN=FKTN PE=4 SV=1	67	NQNVPVFLIDPL
IVLFMSATMEVL	sp|Q9QR70|ORF75_HHV8P	577	sp|P25100|ADA1D_HUMAN Alpha-1D adrenergic receptor OS=Homo sapiens OX=9606 GN=ADRA1D PE=1 SV=2	148	TVLPFSATMEVL
LPDGTLPIQALK	sp|Q2HRB2|UL24_HHV8P	212	tr|A0A087WTU9|A0A087WTU9_HUMAN Alstrom syndrome protein 1 OS=Homo sapiens OX=9606 GN=ALMS1 PE=1 SV=1	641	LPDGHLTDQALK
LPDGTLPIQALK	sp|Q2HRB2|UL24_HHV8P	212	sp|Q8TCU4|ALMS1_HUMAN Alstrom syndrome protein 1 OS=Homo sapiens OX=9606 GN=ALMS1 PE=1 SV=4	683	LPDGHLTDQALK
LPDGTLPIQALK	sp|Q2HRB2|UL24_HHV8P	212	tr|A0A087WV20|A0A087WV20_HUMAN Alstrom syndrome protein 1 OS=Homo sapiens OX=9606 GN=ALMS1 PE=1 SV=1	683	LPDGHLTDQALK
LINRTPAAVTYL	sp|F5HEF2|CEP2_HHV8P	40	sp|Q92688|AN32B_HUMAN Acidic leucine-rich nuclear phosphoprotein 32 family member B OS=Homo sapiens OX=9606 GN=ANP32B PE=1 SV=1	11	LRNRTPAAVREL
TATILASPGDDA	sp|P0C788|OX2V_HHV8P	80	sp|Q13112|CAF1B_HUMAN Chromatin assembly factor 1 subunit B OS=Homo sapiens OX=9606 GN=CHAF1B PE=1 SV=1	77	TGEILASGGDDA
LVRAGDALILVS	sp|Q9QR70|ORF75_HHV8P	815	tr|A0A087X080|A0A087X080_HUMAN Ryanodine receptor 3 OS=Homo sapiens OX=9606 GN=RYR3 PE=1 SV=1	164	KVRIGDDLILVS
LVRAGDALILVS	sp|Q9QR70|ORF75_HHV8P	815	sp|Q15413|RYR3_HUMAN Ryanodine receptor 3 OS=Homo sapiens OX=9606 GN=RYR3 PE=1 SV=3	164	KVRIGDDLILVS
LVRAGDALILVS	sp|Q9QR70|ORF75_HHV8P	815	tr|A0A0X1KG73|A0A0X1KG73_HUMAN Ryanodine receptor 3 OS=Homo sapiens OX=9606 GN=RYR3 PE=1 SV=1	164	KVRIGDDLILVS
LVRAGDALILVS	sp|Q9QR70|ORF75_HHV8P	815	tr|A0A0U1RRH1|A0A0U1RRH1_HUMAN Ryanodine receptor 3 OS=Homo sapiens OX=9606 GN=RYR3 PE=1 SV=1	164	KVRIGDDLILVS
LVRAGDALILVS	sp|Q9QR70|ORF75_HHV8P	815	sp|Q92736|RYR2_HUMAN Ryanodine receptor 2 OS=Homo sapiens OX=9606 GN=RYR2 PE=1 SV=3	174	KVRVGDDLILVS
LVRAGDALILVS	sp|Q9QR70|ORF75_HHV8P	815	tr|H7BY35|H7BY35_HUMAN Ryanodine receptor 2 OS=Homo sapiens OX=9606 GN=RYR2 PE=1 SV=2	158	KVRVGDDLILVS
PRGSPEVLEKAL	sp|Q2HR71|VIRF2_HHV8P	148	tr|E2QRP2|E2QRP2_HUMAN Zinc finger protein 44 OS=Homo sapiens OX=9606 GN=ZNF44 PE=4 SV=1	34	PRGQPEVLEWGL
PRGSPEVLEKAL	sp|Q2HR71|VIRF2_HHV8P	148	sp|P15621|ZNF44_HUMAN Zinc finger protein 44 OS=Homo sapiens OX=9606 GN=ZNF44 PE=2 SV=3	34	PRGQPEVLEWGL
PRGSPEVLEKAL	sp|Q2HR71|VIRF2_HHV8P	148	tr|M0R160|M0R160_HUMAN Zinc finger protein 44 OS=Homo sapiens OX=9606 GN=ZNF44 PE=1 SV=1	34	PRGQPEVLEWGL
LIASTPGPSRAP	sp|Q2HRD3|DNBI_HHV8P	688	sp|Q5VV11|U633B_HUMAN Putative UPF0633 protein ENSP00000303136 OS=Homo sapiens OX=9606 PE=5 SV=1	6	LRASNPGPSGAP
LIASTPGPSRAP	sp|Q2HRD3|DNBI_HHV8P	688	sp|A6NN06|U633A_HUMAN Putative UPF0633 protein MGC21881 OS=Homo sapiens OX=9606 PE=5 SV=1	6	LRASNPGPSGAP
LIASTPGPSRAP	sp|Q2HRD3|DNBI_HHV8P	688	sp|Q5XG85|U633C_HUMAN Putative UPF0633 protein LOC554249 OS=Homo sapiens OX=9606 PE=5 SV=1	6	LRASNPGPSGAP
GLSSLKSSIPLG	sp|F5HID2|PAP_HHV8P	182	tr|C9JY61|C9JY61_HUMAN E3 ubiquitin-protein ligase (Fragment) OS=Homo sapiens OX=9606 GN=DTX2 PE=1 SV=8	55	GLGSLAHSIPLG
GLSSLKSSIPLG	sp|F5HID2|PAP_HHV8P	182	tr|C9JEH4|C9JEH4_HUMAN E3 ubiquitin-protein ligase (Fragment) OS=Homo sapiens OX=9606 GN=DTX2 PE=1 SV=1	55	GLGSLAHSIPLG
GLSSLKSSIPLG	sp|F5HID2|PAP_HHV8P	182	tr|C9JII1|C9JII1_HUMAN E3 ubiquitin-protein ligase (Fragment) OS=Homo sapiens OX=9606 GN=DTX2 PE=1 SV=1	55	GLGSLAHSIPLG
GLSSLKSSIPLG	sp|F5HID2|PAP_HHV8P	182	sp|Q86UW9|DTX2_HUMAN Probable E3 ubiquitin-protein ligase DTX2 OS=Homo sapiens OX=9606 GN=DTX2 PE=1 SV=3	55	GLGSLAHSIPLG
IYSSENTKRASA	sp|Q2HR92|HEPA_HHV8P	500	tr|A0A1B0GU24|A0A1B0GU24_HUMAN Trinucleotide repeat-containing gene 6C protein OS=Homo sapiens OX=9606 GN=TNRC6C PE=1 SV=1	54	ISSSNNGKRASA
SVTPVAGQDPPE	sp|Q2HR64|LTP_HHV8P	353	sp|Q99835|SMO_HUMAN Smoothened homolog OS=Homo sapiens OX=9606 GN=SMO PE=1 SV=1	638	SVTPVATPVPPE
PSSSPRAGRTSG	sp|Q2HR71|VIRF2_HHV8P	459	sp|Q92610|ZN592_HUMAN Zinc finger protein 592 OS=Homo sapiens OX=9606 GN=ZNF592 PE=1 SV=2	677	PSSSPKHGLTSG
PSSSPRAGRTSG	sp|Q2HR71|VIRF2_HHV8P	459	tr|H0YM74|H0YM74_HUMAN Zinc finger protein 592 OS=Homo sapiens OX=9606 GN=ZNF592 PE=1 SV=1	677	PSSSPKHGLTSG
PSSSPRAGRTSG	sp|Q2HR71|VIRF2_HHV8P	459	tr|K7ELN3|K7ELN3_HUMAN Dynein heavy chain 17, axonemal (Fragment) OS=Homo sapiens OX=9606 GN=DNAH17 PE=1 SV=1	1542	PSCSPWPGRTSG
EEAMVVSSDTRS	sp|Q2HR71|VIRF2_HHV8P	40	tr|H0Y650|H0Y650_HUMAN Dynein assembly factor 5, axonemal (Fragment) OS=Homo sapiens OX=9606 GN=DNAAF5 PE=1 SV=1	214	EEAAVVQSCTRS
EEAMVVSSDTRS	sp|Q2HR71|VIRF2_HHV8P	40	sp|Q86Y56|DAAF5_HUMAN Dynein assembly factor 5, axonemal OS=Homo sapiens OX=9606 GN=DNAAF5 PE=1 SV=4	412	EEAAVVQSCTRS
SLPLTPEFPYRF	sp|Q2HRD2|TRM1_HHV8P	236	tr|A0A087WVW3|A0A087WVW3_HUMAN Peroxisome proliferator-activated receptor gamma coactivator 1-alpha OS=Homo sapiens OX=9606 GN=PPARGC1A PE=1 SV=1	255	SLPLTPESPNLF
TLLFLTLLYLGL	sp|Q98146|VGPCR_HHV8P	62	tr|B4DKD1|B4DKD1_HUMAN Protein tweety homolog OS=Homo sapiens OX=9606 GN=TTYH2 PE=1 SV=1	18	WLLFLSLLFLGL
TLLFLTLLYLGL	sp|Q98146|VGPCR_HHV8P	62	sp|P34096|RNAS4_HUMAN Ribonuclease 4 OS=Homo sapiens OX=9606 GN=RNASE4 PE=1 SV=3	11	LLLLLTLLGLGL
SLSLPLSLLQPA	sp|Q2HR64|LTP_HHV8P	981	sp|Q9BSJ8|ESYT1_HUMAN Extended synaptotagmin-1 OS=Homo sapiens OX=9606 GN=ESYT1 PE=1 SV=1	875	SLSLPLSELLVA
VTTLSEGVTILD	sp|F5HEU7|ITP_HHV8P	131	sp|Q8WVY7|UBCP1_HUMAN Ubiquitin-like domain-containing CTD phosphatase 1 OS=Homo sapiens OX=9606 GN=UBLCP1 PE=1 SV=2	16	VTTLSEDDTVLD
EAASVSAPLPAL	sp|Q2HRC8|ORF11_HHV8P	322	tr|K7ENT5|K7ENT5_HUMAN Gametogenetin (Fragment) OS=Homo sapiens OX=9606 GN=GGN PE=1 SV=1	6	EAAAVSAPPPAP
EAASVSAPLPAL	sp|Q2HRC8|ORF11_HHV8P	322	sp|Q86UU5|GGN_HUMAN Gametogenetin OS=Homo sapiens OX=9606 GN=GGN PE=1 SV=2	89	EAAAVSAPPPAP
PIRLVRFSSGRP	sp|Q2HR92|HEPA_HHV8P	358	sp|Q12809|KCNH2_HUMAN Potassium voltage-gated channel subfamily H member 2 OS=Homo sapiens OX=9606 GN=KCNH2 PE=1 SV=1	952	PLRLVPFSSPRP
SGLDSYAPDLAK	sp|F5HCV3|ORF50_HHV8P	411	sp|Q9BZ29|DOCK9_HUMAN Dedicator of cytokinesis protein 9 OS=Homo sapiens OX=9606 GN=DOCK9 PE=1 SV=2	310	SGLDSYLPELAK
SGLDSYAPDLAK	sp|F5HCV3|ORF50_HHV8P	411	tr|A0A0A0MSY4|A0A0A0MSY4_HUMAN Dedicator of cytokinesis protein 9 OS=Homo sapiens OX=9606 GN=DOCK9 PE=1 SV=1	309	SGLDSYLPELAK
SGLDSYAPDLAK	sp|F5HCV3|ORF50_HHV8P	411	tr|A0A088AWN3|A0A088AWN3_HUMAN Dedicator of cytokinesis protein 9 OS=Homo sapiens OX=9606 GN=DOCK9 PE=1 SV=2	321	SGLDSYLPELAK
SGLDSYAPDLAK	sp|F5HCV3|ORF50_HHV8P	411	tr|Q6ZSL5|Q6ZSL5_HUMAN Dedicator of cytokinesis protein 9 OS=Homo sapiens OX=9606 GN=DOCK9 PE=1 SV=1	321	SGLDSYLPELAK
