query	query_seqname	query_start	target_seqname	target_start	target
YEALLNTALHPP	sp|P10192|HEPA_HHV11	588	tr|Q5JQP8|Q5JQP8_HUMAN DNA polymerase OS=Homo sapiens OX=9606 GN=POLL PE=1 SV=1	70	HEALLQTALSPP
QEADASCGATEA	sp|P10217|TRM2_HHV11	38	sp|P08F94|PKHD1_HUMAN Fibrocystin OS=Homo sapiens OX=9606 GN=PKHD1 PE=1 SV=1	4048	QEKKASCGATEA
ALQRTPRPGAGL	sp|P08393|ICP0_HHV11	621	tr|H3BTF6|H3BTF6_HUMAN Tubulin epsilon and delta complex protein 2 (Fragment) OS=Homo sapiens OX=9606 GN=TEDC2 PE=1 SV=1	135	MGARTPRPGAGL
ALQRTPRPGAGL	sp|P08393|ICP0_HHV11	621	tr|H3BND0|H3BND0_HUMAN Tubulin epsilon and delta complex protein 2 OS=Homo sapiens OX=9606 GN=TEDC2 PE=1 SV=1	168	MGARTPRPGAGL
ALQRTPRPGAGL	sp|P08393|ICP0_HHV11	621	sp|Q7L2K0|TEDC2_HUMAN Tubulin epsilon and delta complex protein 2 OS=Homo sapiens OX=9606 GN=TEDC2 PE=1 SV=1	168	MGARTPRPGAGL
PRRPPPGPSDPP	sp|P04487|RNB_HHV11	146	sp|Q92777|SYN2_HUMAN Synapsin-2 OS=Homo sapiens OX=9606 GN=SYN2 PE=2 SV=4	474	PRRLPPGPSLPP
PRRPPPGPSDPP	sp|P04487|RNB_HHV11	146	sp|Q9Y5R5|DMRT2_HUMAN Doublesex- and mab-3-related transcription factor 2 OS=Homo sapiens OX=9606 GN=DMRT2 PE=1 SV=2	30	PRSTPPGPSPPP
DRDTTSGGEALI	sp|P10210|SCAF_HHV11	46	sp|Q5THJ4|VP13D_HUMAN Vacuolar protein sorting-associated protein 13D OS=Homo sapiens OX=9606 GN=VPS13D PE=1 SV=2	1935	ERFTTSGEEALI
DRDTTSGGEALI	sp|P10210|SCAF_HHV11	46	tr|H3BLS7|H3BLS7_HUMAN Vacuolar protein sorting-associated protein 13D (Fragment) OS=Homo sapiens OX=9606 GN=VPS13D PE=1 SV=1	758	ERFTTSGEEALI
DRDTTSGGEALI	sp|P10210|SCAF_HHV11	46	tr|A0A2R8YD87|A0A2R8YD87_HUMAN Vacuolar protein sorting-associated protein 13D (Fragment) OS=Homo sapiens OX=9606 GN=VPS13D PE=1 SV=1	158	ERFTTSGEEALI
AKLAGEAKEYAL	sp|P04293|DPOL_HHV11	1150	sp|P49792|RBP2_HUMAN E3 SUMO-protein ligase RanBP2 OS=Homo sapiens OX=9606 GN=RANBP2 PE=1 SV=2	33	AKLYYEAKEYDL
AKLAGEAKEYAL	sp|P04293|DPOL_HHV11	1150	tr|C9J1P2|C9J1P2_HUMAN RANBP2-like and GRIP domain-containing protein 5/6 (Fragment) OS=Homo sapiens OX=9606 GN=RGPD6 PE=4 SV=1	7	AKLYYEAKEYDL
AKLAGEAKEYAL	sp|P04293|DPOL_HHV11	1150	tr|C9J1W9|C9J1W9_HUMAN RANBP2-like and GRIP domain-containing protein 5/6 (Fragment) OS=Homo sapiens OX=9606 GN=RGPD5 PE=1 SV=1	32	AKLYYEAKEYDL
AKLAGEAKEYAL	sp|P04293|DPOL_HHV11	1150	tr|C9JF75|C9JF75_HUMAN RANBP2-like and GRIP domain-containing protein 5/6 (Fragment) OS=Homo sapiens OX=9606 GN=RGPD6 PE=1 SV=1	32	AKLYYEAKEYDL
AKLAGEAKEYAL	sp|P04293|DPOL_HHV11	1150	sp|Q99666|RGPD5_HUMAN RANBP2-like and GRIP domain-containing protein 5/6 OS=Homo sapiens OX=9606 GN=RGPD5 PE=1 SV=3	33	AKLYYEAKEYDL
AKLAGEAKEYAL	sp|P04293|DPOL_HHV11	1150	tr|F8W705|F8W705_HUMAN RANBP2-like and GRIP domain-containing protein 8 OS=Homo sapiens OX=9606 GN=RGPD8 PE=1 SV=1	33	AKLYYEAKEYDL
AKLAGEAKEYAL	sp|P04293|DPOL_HHV11	1150	sp|O14715|RGPD8_HUMAN RANBP2-like and GRIP domain-containing protein 8 OS=Homo sapiens OX=9606 GN=RGPD8 PE=1 SV=2	33	AKLYYEAKEYDL
AKLAGEAKEYAL	sp|P04293|DPOL_HHV11	1150	tr|J3KQ37|J3KQ37_HUMAN RANBP2-like and GRIP domain-containing protein 8 OS=Homo sapiens OX=9606 GN=RGPD8 PE=1 SV=1	7	AKLYYEAKEYDL
AKLAGEAKEYAL	sp|P04293|DPOL_HHV11	1150	sp|A6NKT7|RGPD3_HUMAN RanBP2-like and GRIP domain-containing protein 3 OS=Homo sapiens OX=9606 GN=RGPD3 PE=3 SV=2	33	AKLYYEAKEYDL
AKLAGEAKEYAL	sp|P04293|DPOL_HHV11	1150	tr|J3KNE0|J3KNE0_HUMAN RanBP2-like and GRIP domain-containing protein 3 OS=Homo sapiens OX=9606 GN=RGPD3 PE=1 SV=2	33	AKLYYEAKEYDL
AKLAGEAKEYAL	sp|P04293|DPOL_HHV11	1150	sp|Q7Z3J3|RGPD4_HUMAN RanBP2-like and GRIP domain-containing protein 4 OS=Homo sapiens OX=9606 GN=RGPD4 PE=2 SV=3	33	AKLYYEAKEYDL
AKLAGEAKEYAL	sp|P04293|DPOL_HHV11	1150	tr|A0A1W2PNU4|A0A1W2PNU4_HUMAN RANBP2-like and GRIP domain-containing protein 2 OS=Homo sapiens OX=9606 GN=RGPD2 PE=4 SV=1	32	AKLYYEAKEYDL
AKLAGEAKEYAL	sp|P04293|DPOL_HHV11	1150	sp|P0DJD1|RGPD2_HUMAN RANBP2-like and GRIP domain-containing protein 2 OS=Homo sapiens OX=9606 GN=RGPD2 PE=2 SV=1	32	AKLYYEAKEYDL
AKLAGEAKEYAL	sp|P04293|DPOL_HHV11	1150	sp|P0DJD0|RGPD1_HUMAN RANBP2-like and GRIP domain-containing protein 1 OS=Homo sapiens OX=9606 GN=RGPD1 PE=2 SV=1	24	AKLYYEAKEYDL
AKLAGEAKEYAL	sp|P04293|DPOL_HHV11	1150	tr|A0A286YES2|A0A286YES2_HUMAN RANBP2-like and GRIP domain-containing protein 1 OS=Homo sapiens OX=9606 GN=RGPD1 PE=4 SV=1	32	AKLYYEAKEYDL
AKLAGEAKEYAL	sp|P04293|DPOL_HHV11	1150	tr|F8VYC4|F8VYC4_HUMAN RANBP2-like and GRIP domain-containing protein 1 OS=Homo sapiens OX=9606 GN=RGPD1 PE=4 SV=1	32	AKLYYEAKEYDL
AKLAGEAKEYAL	sp|P04293|DPOL_HHV11	1150	tr|F8WBP7|F8WBP7_HUMAN E3 SUMO-protein ligase RanBP2 OS=Homo sapiens OX=9606 GN=RANBP2 PE=1 SV=1	33	AKLYYEAKEYDL
ASATDFEEAPAG	sp|P06491|MCP_HHV11	587	sp|O15230|LAMA5_HUMAN Laminin subunit alpha-5 OS=Homo sapiens OX=9606 GN=LAMA5 PE=1 SV=8	60	ASATCGEEAPAR
PASRAPDAAEPT	sp|P08392|ICP4_HHV11	1118	tr|E9PBB9|E9PBB9_HUMAN C-Jun-amino-terminal kinase-interacting protein 1 OS=Homo sapiens OX=9606 GN=MAPK8IP1 PE=1 SV=1	275	PVQRPPDAAEPT
PASRAPDAAEPT	sp|P08392|ICP4_HHV11	1118	sp|Q9UQF2|JIP1_HUMAN C-Jun-amino-terminal kinase-interacting protein 1 OS=Homo sapiens OX=9606 GN=MAPK8IP1 PE=1 SV=1	285	PVQRPPDAAEPT
ARLSAVARGADP	sp|P08392|ICP4_HHV11	1045	tr|D6RA47|D6RA47_HUMAN Major facilitator superfamily domain-containing protein 10 OS=Homo sapiens OX=9606 GN=MFSD10 PE=1 SV=1	252	LRFSAVARGQDP
ARLSAVARGADP	sp|P08392|ICP4_HHV11	1045	tr|D6RIZ4|D6RIZ4_HUMAN Major facilitator superfamily domain-containing protein 10 OS=Homo sapiens OX=9606 GN=MFSD10 PE=1 SV=1	252	LRFSAVARGQDP
ARLSAVARGADP	sp|P08392|ICP4_HHV11	1045	tr|D6RE79|D6RE79_HUMAN Major facilitator superfamily domain-containing protein 10 OS=Homo sapiens OX=9606 GN=MFSD10 PE=1 SV=1	252	LRFSAVARGQDP
ARLSAVARGADP	sp|P08392|ICP4_HHV11	1045	sp|Q14728|MFS10_HUMAN Major facilitator superfamily domain-containing protein 10 OS=Homo sapiens OX=9606 GN=MFSD10 PE=1 SV=1	252	LRFSAVARGQDP
SLAVLRALPPSA	sp|P10202|TRX2_HHV11	262	sp|Q8N9W4|GG6L2_HUMAN Golgin subfamily A member 6-like protein 2 OS=Homo sapiens OX=9606 GN=GOLGA6L2 PE=1 SV=3	894	RGAVLRALPPSL
SLAVLRALPPSA	sp|P10202|TRX2_HHV11	262	tr|F8WBV9|F8WBV9_HUMAN Golgin subfamily A member 6-like protein 2 OS=Homo sapiens OX=9606 GN=GOLGA6L2 PE=1 SV=1	299	RGAVLRALPPSL
VREVCGAKSERA	sp|P10236|PRIM_HHV11	340	sp|Q2TB90|HKDC1_HUMAN Hexokinase HKDC1 OS=Homo sapiens OX=9606 GN=HKDC1 PE=1 SV=3	818	VKEVCGAVSRRA
DLGRWRLLCSRA	sp|P10231|TEG5_HHV11	150	tr|C9J315|C9J315_HUMAN Lanosterol synthase (Fragment) OS=Homo sapiens OX=9606 GN=LSS PE=1 SV=1	22	DLGRWRLNCERG
DLGRWRLLCSRA	sp|P10231|TEG5_HHV11	150	sp|P48449|LSS_HUMAN Lanosterol synthase OS=Homo sapiens OX=9606 GN=LSS PE=1 SV=1	21	DLGRWRLNCERG
SGPPSTPTQPRE	sp|P04487|RNB_HHV11	89	sp|P31629|ZEP2_HUMAN Transcription factor HIVEP2 OS=Homo sapiens OX=9606 GN=HIVEP2 PE=1 SV=2	2293	SGPPSTPSSPRL
RHDAALSVPESQ	sp|P10220|LTP_HHV11	993	tr|D2WEZ3|D2WEZ3_HUMAN Neurogenic locus notch homolog protein 2 OS=Homo sapiens OX=9606 GN=NOTCH2 PE=1 SV=1	800	ILDLALSVPESQ
RAASARLRADLE	sp|P10231|TEG5_HHV11	459	tr|F5H5M8|F5H5M8_HUMAN Tektin (Fragment) OS=Homo sapiens OX=9606 GN=TEKT3 PE=1 SV=1	149	RAASAKLRDDIE
RAASARLRADLE	sp|P10231|TEG5_HHV11	459	sp|Q9BXF9|TEKT3_HUMAN Tektin-3 OS=Homo sapiens OX=9606 GN=TEKT3 PE=1 SV=1	315	RAASAKLRDDIE
LGASGGWPGAIL	sp|P10220|LTP_HHV11	1363	sp|Q9HCU4|CELR2_HUMAN Cadherin EGF LAG seven-pass G-type receptor 2 OS=Homo sapiens OX=9606 GN=CELSR2 PE=1 SV=1	1706	LGASGGPGHAIL
RIRVSGFGPSTA	sp|P08543|RIR1_HHV11	930	sp|P98164|LRP2_HUMAN Low-density lipoprotein receptor-related protein 2 OS=Homo sapiens OX=9606 GN=LRP2 PE=1 SV=3	4488	DIGVSGFGPETA
LSAAARRRRQEC	sp|P10192|HEPA_HHV11	53	sp|A8K010|CF176_HUMAN Putative transcriptional regulator encoded by LINC00473 OS=Homo sapiens OX=9606 GN=LINC00473 PE=5 SV=2	3	LSAAAGRRRQAP
APQNIPAVAAAP	sp|P10210|SCAF_HHV11	147	sp|O14559|RHG33_HUMAN Rho GTPase-activating protein 33 OS=Homo sapiens OX=9606 GN=ARHGAP33 PE=1 SV=2	181	ASLNIPAVAAAH
APQNIPAVAAAP	sp|P10210|SCAF_HHV11	147	tr|A0A0A0MQQ9|A0A0A0MQQ9_HUMAN Rho GTPase-activating protein 33 OS=Homo sapiens OX=9606 GN=ARHGAP33 PE=1 SV=1	181	ASLNIPAVAAAH
VDPAVAASPFFP	sp|P06491|MCP_HHV11	501	sp|Q96E09|PBIR1_HUMAN PPP2R1A-PPP2R2A-interacting phosphatase regulator 1 OS=Homo sapiens OX=9606 GN=PABIR1 PE=1 SV=1	269	VSPAQAASPFIP
FPAAGPPLPAAR	sp|P08392|ICP4_HHV11	1060	sp|O14813|PHX2A_HUMAN Paired mesoderm homeobox protein 2A OS=Homo sapiens OX=9606 GN=PHOX2A PE=1 SV=2	42	FPAAGPPCPALG
FPAAGPPLPAAR	sp|P08392|ICP4_HHV11	1060	sp|Q9Y4F5|C170B_HUMAN Centrosomal protein of 170 kDa protein B OS=Homo sapiens OX=9606 GN=CEP170B PE=1 SV=4	1081	KPAAPPPSPAAR
FPAAGPPLPAAR	sp|P08392|ICP4_HHV11	1060	tr|J3KQR7|J3KQR7_HUMAN Centrosomal protein of 170 kDa protein B OS=Homo sapiens OX=9606 GN=CEP170B PE=1 SV=1	1082	KPAAPPPSPAAR
GQSLDSIPPGLL	sp|P04291|TEG3_HHV11	185	sp|Q9UKF2|ADA30_HUMAN Disintegrin and metalloproteinase domain-containing protein 30 OS=Homo sapiens OX=9606 GN=ADAM30 PE=1 SV=2	667	GGSIDSGPPGLL
AAPEDADLTPAR	sp|P06492|VP16_HHV11	350	sp|Q9H254|SPTN4_HUMAN Spectrin beta chain, non-erythrocytic 4 OS=Homo sapiens OX=9606 GN=SPTBN4 PE=1 SV=2	2209	AAPEDAAETPAT
AAPEDADLTPAR	sp|P06492|VP16_HHV11	350	tr|C9JY79|C9JY79_HUMAN Spectrin beta chain OS=Homo sapiens OX=9606 GN=SPTBN4 PE=1 SV=2	2209	AAPEDAAETPAT
ELSSGGTPAEPP	sp|P08393|ICP0_HHV11	644	sp|Q6ZSZ5|ARHGI_HUMAN Rho guanine nucleotide exchange factor 18 OS=Homo sapiens OX=9606 GN=ARHGEF18 PE=1 SV=4	129	CLSGGGTPAESP
ELSSGGTPAEPP	sp|P08393|ICP0_HHV11	644	tr|A0A0A6YYC8|A0A0A6YYC8_HUMAN Uncharacterized protein OS=Homo sapiens OX=9606 PE=1 SV=1	129	CLSGGGTPAESP
ELSSGGTPAEPP	sp|P08393|ICP0_HHV11	644	tr|A0A5F9ZHI8|A0A5F9ZHI8_HUMAN Uncharacterized protein OS=Homo sapiens OX=9606 PE=4 SV=1	191	CLSGGGTPAESP
YEEHRGGLEVFL	sp|P10205|TEG4_HHV11	352	sp|P62805|H4_HUMAN Histone H4 OS=Homo sapiens OX=9606 GN=H4C1 PE=1 SV=2	52	YEETRGVLKVFL
GSFKGAARLGAE	sp|P10221|ITP_HHV11	554	sp|Q1L5Z9|LONF2_HUMAN LON peptidase N-terminal domain and RING finger protein 2 OS=Homo sapiens OX=9606 GN=LONRF2 PE=1 SV=3	79	GAFRGAARLGAL
FVMLLLSLAHAP	sp|P10186|UNG_HHV11	215	tr|A0A2R8Y566|A0A2R8Y566_HUMAN RAB11-binding protein RELCH OS=Homo sapiens OX=9606 GN=RELCH PE=1 SV=1	933	DVMTLLSLSHAP
FVMLLLSLAHAP	sp|P10186|UNG_HHV11	215	sp|Q9P260|RELCH_HUMAN RAB11-binding protein RELCH OS=Homo sapiens OX=9606 GN=RELCH PE=1 SV=2	933	DVMTLLSLSHAP
FVMLLLSLAHAP	sp|P10186|UNG_HHV11	215	tr|A0A075B785|A0A075B785_HUMAN RAB11-binding protein RELCH OS=Homo sapiens OX=9606 GN=RELCH PE=1 SV=7	929	DVMTLLSLSHAP
FVMLLLSLAHAP	sp|P10186|UNG_HHV11	215	tr|A0A075B768|A0A075B768_HUMAN RAB11-binding protein RELCH (Fragment) OS=Homo sapiens OX=9606 GN=RELCH PE=1 SV=1	166	DVMTLLSLSHAP
VLLPHPGAPARK	sp|P06491|MCP_HHV11	784	tr|M0R149|M0R149_HUMAN PML-RARA-regulated adapter molecule 1 (Fragment) OS=Homo sapiens OX=9606 GN=PRAM1 PE=1 SV=1	131	ASLPEPGAPARK
VLLPHPGAPARK	sp|P06491|MCP_HHV11	784	sp|Q96QH2|PRAM_HUMAN PML-RARA-regulated adapter molecule 1 OS=Homo sapiens OX=9606 GN=PRAM1 PE=1 SV=3	155	ASLPEPGAPARK
FLTLLLGCPVLM	sp|P10193|OBP_HHV11	324	sp|Q4G0N8|SL9C1_HUMAN Sodium/hydrogen exchanger 10 OS=Homo sapiens OX=9606 GN=SLC9C1 PE=2 SV=2	342	FLTLLLISPVLS
TPASHGAPLPAP	sp|P10235|TEG7_HHV11	60	tr|D6RBK6|D6RBK6_HUMAN Type-1 angiotensin II receptor-associated protein OS=Homo sapiens OX=9606 GN=AGTRAP PE=1 SV=1	124	TEASHAAPGPAP
NSLAVLRALPPS	sp|P10202|TRX2_HHV11	261	sp|Q8N9W4|GG6L2_HUMAN Golgin subfamily A member 6-like protein 2 OS=Homo sapiens OX=9606 GN=GOLGA6L2 PE=1 SV=3	893	ARGAVLRALPPS
NSLAVLRALPPS	sp|P10202|TRX2_HHV11	261	tr|F8WBV9|F8WBV9_HUMAN Golgin subfamily A member 6-like protein 2 OS=Homo sapiens OX=9606 GN=GOLGA6L2 PE=1 SV=1	298	ARGAVLRALPPS
PRDPGLARWTTG	sp|P04485|ICP22_HHV11	248	sp|Q9Y603|ETV7_HUMAN Transcription factor ETV7 OS=Homo sapiens OX=9606 GN=ETV7 PE=1 SV=1	174	LDDPGLARWTPG
SIAAAALGAAAD	sp|P08392|ICP4_HHV11	80	tr|G3V2N2|G3V2N2_HUMAN Homeobox protein SIX4 (Fragment) OS=Homo sapiens OX=9606 GN=SIX4 PE=1 SV=3	63	AVAAAAAGAAAD
SIAAAALGAAAD	sp|P08392|ICP4_HHV11	80	sp|Q9UIU6|SIX4_HUMAN Homeobox protein SIX4 OS=Homo sapiens OX=9606 GN=SIX4 PE=1 SV=2	71	AVAAAAAGAAAD
SIAAAALGAAAD	sp|P08392|ICP4_HHV11	80	tr|D6REE2|D6REE2_HUMAN tRNA-uridine aminocarboxypropyltransferase OS=Homo sapiens OX=9606 GN=DTWD2 PE=1 SV=1	37	VPAAAALGAEAD
SIAAAALGAAAD	sp|P08392|ICP4_HHV11	80	sp|Q8NBA8|DTWD2_HUMAN tRNA-uridine aminocarboxypropyltransferase 2 OS=Homo sapiens OX=9606 GN=DTWD2 PE=1 SV=1	37	VPAAAALGAEAD
SIAAAALGAAAD	sp|P08392|ICP4_HHV11	80	tr|D6RBD8|D6RBD8_HUMAN tRNA-uridine aminocarboxypropyltransferase OS=Homo sapiens OX=9606 GN=DTWD2 PE=1 SV=1	37	VPAAAALGAEAD
SIAAAALGAAAD	sp|P08392|ICP4_HHV11	80	sp|Q9BRX8|PXL2A_HUMAN Peroxiredoxin-like 2A OS=Homo sapiens OX=9606 GN=PRXL2A PE=1 SV=3	16	SIGAGALGAAAL
SIAAAALGAAAD	sp|P08392|ICP4_HHV11	80	sp|Q8NAT2|TDRD5_HUMAN Tudor domain-containing protein 5 OS=Homo sapiens OX=9606 GN=TDRD5 PE=1 SV=3	951	STATAALGAAAR
SIAAAALGAAAD	sp|P08392|ICP4_HHV11	80	tr|A0A0C4DG74|A0A0C4DG74_HUMAN Tudor domain-containing protein 5 (Fragment) OS=Homo sapiens OX=9606 GN=TDRD5 PE=1 SV=1	461	STATAALGAAAR
DGAGLLLSAGSP	sp|P04294|AN_HHV11	190	sp|Q8N612|F16A2_HUMAN FTS and Hook-interacting protein OS=Homo sapiens OX=9606 GN=FAM160A2 PE=1 SV=3	887	DGAGLGLSGGSP
EILTAAACRGGR	sp|P10191|CEP1_HHV11	146	tr|D6RAX6|D6RAX6_HUMAN Mitochondria-eating protein OS=Homo sapiens OX=9606 GN=SPATA18 PE=1 SV=1	56	GILTAAAQEGGR
EILTAAACRGGR	sp|P10191|CEP1_HHV11	146	tr|E7EVV3|E7EVV3_HUMAN Mitochondria-eating protein OS=Homo sapiens OX=9606 GN=SPATA18 PE=1 SV=1	56	GILTAAAQEGGR
EILTAAACRGGR	sp|P10191|CEP1_HHV11	146	sp|Q8TC71|MIEAP_HUMAN Mitochondria-eating protein OS=Homo sapiens OX=9606 GN=SPATA18 PE=1 SV=1	56	GILTAAAQEGGR
PALPGGASPLPC	sp|P10227|MB43_HHV11	235	tr|F5H595|F5H595_HUMAN Pyrin OS=Homo sapiens OX=9606 GN=MEFV PE=1 SV=1	180	PALPGGRSPGPC
PALPGGASPLPC	sp|P10227|MB43_HHV11	235	tr|I3L0S7|I3L0S7_HUMAN Pyrin OS=Homo sapiens OX=9606 GN=MEFV PE=1 SV=1	180	PALPGGRSPGPC
PALPGGASPLPC	sp|P10227|MB43_HHV11	235	tr|F5H2E5|F5H2E5_HUMAN Pyrin OS=Homo sapiens OX=9606 GN=MEFV PE=1 SV=1	180	PALPGGRSPGPC
PALPGGASPLPC	sp|P10227|MB43_HHV11	235	sp|O15553|MEFV_HUMAN Pyrin OS=Homo sapiens OX=9606 GN=MEFV PE=1 SV=1	180	PALPGGRSPGPC
PALPGGASPLPC	sp|P10227|MB43_HHV11	235	tr|F5H6N9|F5H6N9_HUMAN Pyrin OS=Homo sapiens OX=9606 GN=MEFV PE=1 SV=1	180	PALPGGRSPGPC
PALPGGASPLPC	sp|P10227|MB43_HHV11	235	sp|Q53EQ6|TIGD5_HUMAN Tigger transposable element-derived protein 5 OS=Homo sapiens OX=9606 GN=TIGD5 PE=1 SV=3	207	PALPSGAGPLPD
PALPGGASPLPC	sp|P10227|MB43_HHV11	235	tr|C9JU10|C9JU10_HUMAN Threonine synthase-like 2 OS=Homo sapiens OX=9606 GN=THNSL2 PE=1 SV=1	235	AALPGAASPLPL
LSSGGTPAEPPP	sp|P08393|ICP0_HHV11	645	sp|Q6ZSZ5|ARHGI_HUMAN Rho guanine nucleotide exchange factor 18 OS=Homo sapiens OX=9606 GN=ARHGEF18 PE=1 SV=4	130	LSGGGTPAESPG
LSSGGTPAEPPP	sp|P08393|ICP0_HHV11	645	tr|A0A0A6YYC8|A0A0A6YYC8_HUMAN Uncharacterized protein OS=Homo sapiens OX=9606 PE=1 SV=1	130	LSGGGTPAESPG
LSSGGTPAEPPP	sp|P08393|ICP0_HHV11	645	tr|A0A5F9ZHI8|A0A5F9ZHI8_HUMAN Uncharacterized protein OS=Homo sapiens OX=9606 PE=4 SV=1	192	LSGGGTPAESPG
ALEPLLGGAFAP	sp|P10220|LTP_HHV11	2410	sp|Q9P225|DYH2_HUMAN Dynein heavy chain 2, axonemal OS=Homo sapiens OX=9606 GN=DNAH2 PE=1 SV=3	170	ALLRLLGGVFAP
LPWPAPPGVPPI	sp|P10210|SCAF_HHV11	594	sp|Q9Y2W2|WBP11_HUMAN WW domain-binding protein 11 OS=Homo sapiens OX=9606 GN=WBP11 PE=1 SV=1	491	LPPPAPPGIPPP
LPWPAPPGVPPI	sp|P10210|SCAF_HHV11	594	tr|A0A0A0MQV9|A0A0A0MQV9_HUMAN Histone-lysine N-methyltransferase SETD1B OS=Homo sapiens OX=9606 GN=SETD1B PE=1 SV=1	728	PPLPAPPGVPPP
LPWPAPPGVPPI	sp|P10210|SCAF_HHV11	594	sp|Q9UPS6|SET1B_HUMAN Histone-lysine N-methyltransferase SETD1B OS=Homo sapiens OX=9606 GN=SETD1B PE=1 SV=3	728	PPLPAPPGVPPP
MRSESEASGGDL	sp|P08392|ICP4_HHV11	16	sp|Q92529|SHC3_HUMAN SHC-transforming protein 3 OS=Homo sapiens OX=9606 GN=SHC3 PE=1 SV=1	250	MRSISFASGGDP
RALLRWTLPPGP	sp|P04294|AN_HHV11	237	sp|A0A1B0GW54|SIM39_HUMAN Small integral membrane protein 39 OS=Homo sapiens OX=9606 GN=SMIM39 PE=3 SV=1	19	RALLRCNLPPGA
RALLRWTLPPGP	sp|P04294|AN_HHV11	237	tr|F8WFD8|F8WFD8_HUMAN Ceramide kinase OS=Homo sapiens OX=9606 GN=CERK PE=1 SV=1	29	RALLRWWRSPGP
RALLRWTLPPGP	sp|P04294|AN_HHV11	237	sp|Q8TCT0|CERK1_HUMAN Ceramide kinase OS=Homo sapiens OX=9606 GN=CERK PE=1 SV=1	29	RALLRWWRSPGP
ALGRPGEPRGND	sp|P08392|ICP4_HHV11	375	tr|A0A096LNK9|A0A096LNK9_HUMAN Smoothelin (Fragment) OS=Homo sapiens OX=9606 GN=SMTN PE=1 SV=1	31	ARGRPGEGRGNT
ALGRPGEPRGND	sp|P08392|ICP4_HHV11	375	sp|P53814|SMTN_HUMAN Smoothelin OS=Homo sapiens OX=9606 GN=SMTN PE=1 SV=7	634	ARGRPGEGRGNT
ALGRPGEPRGND	sp|P08392|ICP4_HHV11	375	tr|A0A087X1R1|A0A087X1R1_HUMAN Smoothelin OS=Homo sapiens OX=9606 GN=SMTN PE=1 SV=1	719	ARGRPGEGRGNT
ALGRPGEPRGND	sp|P08392|ICP4_HHV11	375	tr|A0A087WVP4|A0A087WVP4_HUMAN Smoothelin OS=Homo sapiens OX=9606 GN=SMTN PE=1 SV=1	690	ARGRPGEGRGNT
LDRQQSSAANDS	sp|P10202|TRX2_HHV11	241	sp|Q6IWH7|ANO7_HUMAN Anoctamin-7 OS=Homo sapiens OX=9606 GN=ANO7 PE=1 SV=2	122	LDRQQDSAARDR
LDRQQSSAANDS	sp|P10202|TRX2_HHV11	241	tr|A0A6I8PRE6|A0A6I8PRE6_HUMAN Anoctamin OS=Homo sapiens OX=9606 GN=ANO7 PE=1 SV=1	68	LDRQQDSAARDR
LDRQQSSAANDS	sp|P10202|TRX2_HHV11	241	tr|A0A6Q8JTU6|A0A6Q8JTU6_HUMAN Anoctamin OS=Homo sapiens OX=9606 GN=ANO7 PE=1 SV=1	67	LDRQQDSAARDR
LDRQQSSAANDS	sp|P10202|TRX2_HHV11	241	tr|A0A6Q8JT31|A0A6Q8JT31_HUMAN Anoctamin-7 OS=Homo sapiens OX=9606 GN=ANO7 PE=1 SV=1	67	LDRQQDSAARDR
AGLGPVGSAGGA	sp|P10190|PORTL_HHV11	241	sp|Q8NHW3|MAFA_HUMAN Transcription factor MafA OS=Homo sapiens OX=9606 GN=MAFA PE=1 SV=2	318	AGRGGPGSAGGA
RCGSLDRGPPRP	sp|P08392|ICP4_HHV11	271	tr|H3BS19|H3BS19_HUMAN Zinc finger protein 469 OS=Homo sapiens OX=9606 GN=ZNF469 PE=1 SV=2	1071	RCGSLAAGRPRP
PAPVPAPPGPRA	sp|P06487|GI_HHV11	205	sp|Q99583|MNT_HUMAN Max-binding protein MNT OS=Homo sapiens OX=9606 GN=MNT PE=1 SV=1	70	PAPPPAPPPPLA
PAPVPAPPGPRA	sp|P06487|GI_HHV11	205	sp|Q6SPF0|SAMD1_HUMAN Atherin OS=Homo sapiens OX=9606 GN=SAMD1 PE=1 SV=1	160	PSPGPAQPGPRA
PAPVPAPPGPRA	sp|P06487|GI_HHV11	205	tr|A0A0A0MQW5|A0A0A0MQW5_HUMAN Serine/threonine-protein kinase LMTK3 OS=Homo sapiens OX=9606 GN=LMTK3 PE=1 SV=1	780	PAPPPPPPPPRA
PAPVPAPPGPRA	sp|P06487|GI_HHV11	205	tr|A0A3B3ISL5|A0A3B3ISL5_HUMAN Serine/threonine-protein kinase LMTK3 OS=Homo sapiens OX=9606 GN=LMTK3 PE=1 SV=1	777	PAPPPPPPPPRA
PAPVPAPPGPRA	sp|P06487|GI_HHV11	205	sp|Q96Q04|LMTK3_HUMAN Serine/threonine-protein kinase LMTK3 OS=Homo sapiens OX=9606 GN=LMTK3 PE=1 SV=2	751	PAPPPPPPPPRA
PAPVPAPPGPRA	sp|P06487|GI_HHV11	205	tr|A0A5F9ZH67|A0A5F9ZH67_HUMAN Serine/threonine-protein kinase LMTK3 OS=Homo sapiens OX=9606 GN=LMTK3 PE=1 SV=1	506	PAPPPPPPPPRA
PAPVPAPPGPRA	sp|P06487|GI_HHV11	205	tr|F2Z2U4|F2Z2U4_HUMAN Transformation/transcription domain-associated protein OS=Homo sapiens OX=9606 GN=TRRAP PE=1 SV=3	500	PAPVPAPPPPPP
PAPVPAPPGPRA	sp|P06487|GI_HHV11	205	sp|Q9Y4A5|TRRAP_HUMAN Transformation/transcription domain-associated protein OS=Homo sapiens OX=9606 GN=TRRAP PE=1 SV=3	500	PAPVPAPPPPPP
PAPVPAPPGPRA	sp|P06487|GI_HHV11	205	tr|H0Y4W2|H0Y4W2_HUMAN Transformation/transcription domain-associated protein OS=Homo sapiens OX=9606 GN=TRRAP PE=1 SV=2	500	PAPVPAPPPPPP
PAPVPAPPGPRA	sp|P06487|GI_HHV11	205	sp|Q8N4B1|SESQ1_HUMAN Sesquipedalian-1 OS=Homo sapiens OX=9606 GN=PHETA1 PE=1 SV=1	166	PAPVPALPLPRR
PAPVPAPPGPRA	sp|P06487|GI_HHV11	205	tr|C9JV81|C9JV81_HUMAN Vasopressin V2 receptor (Fragment) OS=Homo sapiens OX=9606 GN=AVPR2 PE=1 SV=1	328	PAPPPAPPWPRT
IAPLQAALNAAS	sp|P10201|CVC1_HHV11	364	tr|E7ESL9|E7ESL9_HUMAN Arf-GAP with GTPase, ANK repeat and PH domain-containing protein 3 OS=Homo sapiens OX=9606 GN=AGAP3 PE=1 SV=1	40	AAALQAALCAAS
RDTTSGGEALIT	sp|P10210|SCAF_HHV11	47	sp|Q5THJ4|VP13D_HUMAN Vacuolar protein sorting-associated protein 13D OS=Homo sapiens OX=9606 GN=VPS13D PE=1 SV=2	1936	RFTTSGEEALIF
RDTTSGGEALIT	sp|P10210|SCAF_HHV11	47	tr|H3BLS7|H3BLS7_HUMAN Vacuolar protein sorting-associated protein 13D (Fragment) OS=Homo sapiens OX=9606 GN=VPS13D PE=1 SV=1	759	RFTTSGEEALIF
RDTTSGGEALIT	sp|P10210|SCAF_HHV11	47	tr|A0A2R8YD87|A0A2R8YD87_HUMAN Vacuolar protein sorting-associated protein 13D (Fragment) OS=Homo sapiens OX=9606 GN=VPS13D PE=1 SV=1	159	RFTTSGEEALIF
CLLISALAILVP	sp|P10200|CEP2_HHV11	342	tr|A0A1B0GUR5|A0A1B0GUR5_HUMAN Neuronal acetylcholine receptor subunit alpha-7 (Fragment) OS=Homo sapiens OX=9606 GN=CHRNA7 PE=4 SV=1	97	CVLISALALLVF
CLLISALAILVP	sp|P10200|CEP2_HHV11	342	tr|A0A1B0GW52|A0A1B0GW52_HUMAN Neuronal acetylcholine receptor subunit alpha-7 (Fragment) OS=Homo sapiens OX=9606 GN=CHRNA7 PE=3 SV=1	162	CVLISALALLVF
CLLISALAILVP	sp|P10200|CEP2_HHV11	342	tr|A0A1B0GVN6|A0A1B0GVN6_HUMAN Neuronal acetylcholine receptor subunit alpha-7 (Fragment) OS=Homo sapiens OX=9606 GN=CHRNA7 PE=4 SV=1	14	CVLISALALLVF
CLLISALAILVP	sp|P10200|CEP2_HHV11	342	tr|A0A1B0GV44|A0A1B0GV44_HUMAN Neuronal acetylcholine receptor subunit alpha-7 (Fragment) OS=Homo sapiens OX=9606 GN=CHRNA7 PE=3 SV=1	224	CVLISALALLVF
CLLISALAILVP	sp|P10200|CEP2_HHV11	342	tr|A0A1B0GW47|A0A1B0GW47_HUMAN Neuronal acetylcholine receptor subunit alpha-7 (Fragment) OS=Homo sapiens OX=9606 GN=CHRNA7 PE=3 SV=1	217	CVLISALALLVF
CLLISALAILVP	sp|P10200|CEP2_HHV11	342	tr|A0A1B0GV25|A0A1B0GV25_HUMAN Neuronal acetylcholine receptor subunit alpha-7 (Fragment) OS=Homo sapiens OX=9606 GN=CHRNA7 PE=3 SV=1	189	CVLISALALLVF
CLLISALAILVP	sp|P10200|CEP2_HHV11	342	tr|A0A1B0GV86|A0A1B0GV86_HUMAN Neuronal acetylcholine receptor subunit alpha-7 (Fragment) OS=Homo sapiens OX=9606 GN=CHRNA7 PE=4 SV=1	60	CVLISALALLVF
CLLISALAILVP	sp|P10200|CEP2_HHV11	342	tr|A0A0G2JNX5|A0A0G2JNX5_HUMAN CHRNA7-FAM7A fusion protein OS=Homo sapiens OX=9606 GN=CHRFAM7A PE=4 SV=1	60	CVLISALALLVF
CLLISALAILVP	sp|P10200|CEP2_HHV11	342	tr|A0A0G2JMC1|A0A0G2JMC1_HUMAN CHRNA7-FAM7A fusion protein OS=Homo sapiens OX=9606 GN=CHRFAM7A PE=4 SV=1	151	CVLISALALLVF
CLLISALAILVP	sp|P10200|CEP2_HHV11	342	tr|A0A1B0GVH2|A0A1B0GVH2_HUMAN Neuronal acetylcholine receptor subunit alpha-7 OS=Homo sapiens OX=9606 GN=CHRNA7 PE=3 SV=1	179	CVLISALALLVF
CLLISALAILVP	sp|P10200|CEP2_HHV11	342	tr|A0A1W2PN81|A0A1W2PN81_HUMAN Neuronal acetylcholine receptor subunit alpha-7 OS=Homo sapiens OX=9606 GN=CHRNA7 PE=3 SV=1	241	CVLISALALLVF
CLLISALAILVP	sp|P10200|CEP2_HHV11	342	tr|A0A1B0GV43|A0A1B0GV43_HUMAN Neuronal acetylcholine receptor subunit alpha-7 OS=Homo sapiens OX=9606 GN=CHRNA7 PE=3 SV=1	162	CVLISALALLVF
CLLISALAILVP	sp|P10200|CEP2_HHV11	342	tr|A0A0A6YYA8|A0A0A6YYA8_HUMAN CHRNA7-FAM7A fusion protein OS=Homo sapiens OX=9606 GN=CHRFAM7A PE=4 SV=1	60	CVLISALALLVF
CLLISALAILVP	sp|P10200|CEP2_HHV11	342	sp|P36544|ACHA7_HUMAN Neuronal acetylcholine receptor subunit alpha-7 OS=Homo sapiens OX=9606 GN=CHRNA7 PE=1 SV=5	241	CVLISALALLVF
CLLISALAILVP	sp|P10200|CEP2_HHV11	342	sp|Q494W8|CRFM7_HUMAN CHRNA7-FAM7A fusion protein OS=Homo sapiens OX=9606 GN=CHRFAM7A PE=1 SV=1	151	CVLISALALLVF
CLLISALAILVP	sp|P10200|CEP2_HHV11	342	tr|A0A1B0GTT9|A0A1B0GTT9_HUMAN Neuronal acetylcholine receptor subunit alpha-7 OS=Homo sapiens OX=9606 GN=CHRNA7 PE=3 SV=1	179	CVLISALALLVF
RISGALAAAKAV	sp|P10220|LTP_HHV11	2455	sp|P15502|ELN_HUMAN Elastin OS=Homo sapiens OX=9606 GN=ELN PE=1 SV=4	644	RVPGALAAAKAA
DPAAGGGFTANG	sp|P08393|ICP0_HHV11	577	tr|A0A087X1F6|A0A087X1F6_HUMAN Tonsoku-like protein OS=Homo sapiens OX=9606 GN=TONSL PE=1 SV=1	337	DPAAGGGRGASG
GAGLLLSAGSPP	sp|P04294|AN_HHV11	191	sp|Q8N612|F16A2_HUMAN FTS and Hook-interacting protein OS=Homo sapiens OX=9606 GN=FAM160A2 PE=1 SV=3	888	GAGLGLSGGSPG
YLPAAPEDADLT	sp|P06492|VP16_HHV11	347	sp|Q9H254|SPTN4_HUMAN Spectrin beta chain, non-erythrocytic 4 OS=Homo sapiens OX=9606 GN=SPTBN4 PE=1 SV=2	2206	ALPAAPEDAAET
YLPAAPEDADLT	sp|P06492|VP16_HHV11	347	tr|C9JY79|C9JY79_HUMAN Spectrin beta chain OS=Homo sapiens OX=9606 GN=SPTBN4 PE=1 SV=2	2206	ALPAAPEDAAET
ELTEALAAEEAT	sp|P10221|ITP_HHV11	246	sp|Q02952|AKA12_HUMAN A-kinase anchor protein 12 OS=Homo sapiens OX=9606 GN=AKAP12 PE=1 SV=4	989	EGTEASAAEETT
SLGEGRSADDPV	sp|P10192|HEPA_HHV11	21	sp|P59817|Z280A_HUMAN Zinc finger protein 280A OS=Homo sapiens OX=9606 GN=ZNF280A PE=1 SV=3	104	SLSEGRSTDSPV
SLGEGRSADDPV	sp|P10192|HEPA_HHV11	21	tr|A0A0G2JN84|A0A0G2JN84_HUMAN Suppressor of hairy wing homolog 1 (Drosophila) OS=Homo sapiens OX=9606 GN=ZNF280A PE=1 SV=1	104	SLSEGRSTDSPV
SEVVRLRASSLP	sp|P10208|UL24_HHV11	187	tr|H3BNY8|H3BNY8_HUMAN Mannose-6-phosphate isomerase (Fragment) OS=Homo sapiens OX=9606 GN=MPI PE=1 SV=1	25	SEVARLLASSDP
SEVVRLRASSLP	sp|P10208|UL24_HHV11	187	tr|H3BU66|H3BU66_HUMAN Mannose-6-phosphate isomerase (Fragment) OS=Homo sapiens OX=9606 GN=MPI PE=1 SV=1	25	SEVARLLASSDP
SEVVRLRASSLP	sp|P10208|UL24_HHV11	187	tr|H3BPU7|H3BPU7_HUMAN Mannose-6-phosphate isomerase (Fragment) OS=Homo sapiens OX=9606 GN=MPI PE=1 SV=1	5	SEVARLLASSDP
SEVVRLRASSLP	sp|P10208|UL24_HHV11	187	tr|H3BPM5|H3BPM5_HUMAN Mannose-6-phosphate isomerase (Fragment) OS=Homo sapiens OX=9606 GN=MPI PE=1 SV=1	5	SEVARLLASSDP
SEVVRLRASSLP	sp|P10208|UL24_HHV11	187	tr|H3BP57|H3BP57_HUMAN Mannose-6-phosphate isomerase (Fragment) OS=Homo sapiens OX=9606 GN=MPI PE=1 SV=1	5	SEVARLLASSDP
SEVVRLRASSLP	sp|P10208|UL24_HHV11	187	sp|P34949|MPI_HUMAN Mannose-6-phosphate isomerase OS=Homo sapiens OX=9606 GN=MPI PE=1 SV=2	25	SEVARLLASSDP
SEVVRLRASSLP	sp|P10208|UL24_HHV11	187	tr|H3BPB8|H3BPB8_HUMAN Mannose-6-phosphate isomerase OS=Homo sapiens OX=9606 GN=MPI PE=1 SV=1	5	SEVARLLASSDP
SEVVRLRASSLP	sp|P10208|UL24_HHV11	187	tr|H3BT48|H3BT48_HUMAN Mannose-6-phosphate isomerase OS=Homo sapiens OX=9606 GN=MPI PE=1 SV=1	5	SEVARLLASSDP
SEVVRLRASSLP	sp|P10208|UL24_HHV11	187	tr|H3BUZ9|H3BUZ9_HUMAN Mannose-6-phosphate isomerase OS=Homo sapiens OX=9606 GN=MPI PE=1 SV=1	25	SEVARLLASSDP
SEVVRLRASSLP	sp|P10208|UL24_HHV11	187	tr|H3BPP3|H3BPP3_HUMAN Mannose-6-phosphate isomerase OS=Homo sapiens OX=9606 GN=MPI PE=1 SV=1	25	SEVARLLASSDP
SEVVRLRASSLP	sp|P10208|UL24_HHV11	187	tr|H3BMZ9|H3BMZ9_HUMAN Mannose-6-phosphate isomerase OS=Homo sapiens OX=9606 GN=MPI PE=1 SV=1	25	SEVARLLASSDP
SEVVRLRASSLP	sp|P10208|UL24_HHV11	187	tr|H3BT46|H3BT46_HUMAN Mannose-6-phosphate isomerase (Fragment) OS=Homo sapiens OX=9606 GN=MPI PE=1 SV=1	12	SEVARLLASSDP
SEVVRLRASSLP	sp|P10208|UL24_HHV11	187	tr|H3BQX0|H3BQX0_HUMAN Mannose-6-phosphate isomerase (Fragment) OS=Homo sapiens OX=9606 GN=MPI PE=1 SV=8	25	SEVARLLASSDP
