query	query_seqname	query_start	target_seqname	target_start	target
FETLAGGCAPMA	sp|P32886|POLG_JAEVJ	1088	sp|O60336|MABP1_HUMAN Mitogen-activated protein kinase-binding protein 1 OS=Homo sapiens OX=9606 GN=MAPKBP1 PE=1 SV=4	1073	FETLASGAAPGA
DVSLAYQCGRKA	sp|P32886|POLG_JAEVJ	2769	sp|Q9NSI6|BRWD1_HUMAN Bromodomain and WD repeat-containing protein 1 OS=Homo sapiens OX=9606 GN=BRWD1 PE=1 SV=4	1586	PVSLANGCGRKA
TLLNTVRDQGSK	sp|P0DOH8|POLS_JAEVJ	121	sp|Q7Z5M8|AB12B_HUMAN Protein ABHD12B OS=Homo sapiens OX=9606 GN=ABHD12B PE=1 SV=1	348	TLLITVRDFLSK
MDEKGGTLILVP	sp|P32886|POLG_JAEVJ	1693	tr|C9J7B4|C9J7B4_HUMAN E3 ubiquitin-protein ligase RNF13 (Fragment) OS=Homo sapiens OX=9606 GN=RNF13 PE=1 SV=1	44	TYEKGGHLILVP
MDEKGGTLILVP	sp|P32886|POLG_JAEVJ	1693	tr|C9IY58|C9IY58_HUMAN E3 ubiquitin-protein ligase RNF13 (Fragment) OS=Homo sapiens OX=9606 GN=RNF13 PE=1 SV=3	44	TYEKGGHLILVP
MDEKGGTLILVP	sp|P32886|POLG_JAEVJ	1693	tr|C9JCY0|C9JCY0_HUMAN E3 ubiquitin-protein ligase RNF13 (Fragment) OS=Homo sapiens OX=9606 GN=RNF13 PE=1 SV=1	44	TYEKGGHLILVP
MDEKGGTLILVP	sp|P32886|POLG_JAEVJ	1693	sp|O43567|RNF13_HUMAN E3 ubiquitin-protein ligase RNF13 OS=Homo sapiens OX=9606 GN=RNF13 PE=1 SV=1	163	TYEKGGHLILVP
VVSFAGEPPRAR	sp|P32886|POLG_JAEVJ	3329	tr|K7EIL3|K7EIL3_HUMAN Intercellular adhesion molecule 5 (Fragment) OS=Homo sapiens OX=9606 GN=ICAM5 PE=1 SV=8	41	RRSFAGEPPRAR
VVSFAGEPPRAR	sp|P32886|POLG_JAEVJ	3329	sp|Q9UMF0|ICAM5_HUMAN Intercellular adhesion molecule 5 OS=Homo sapiens OX=9606 GN=ICAM5 PE=1 SV=3	166	RRSFAGEPPRAR
PQGTRPPGFLLT	sp|P0DOH8|POLS_JAEVJ	284	tr|A0A1B0GWE0|A0A1B0GWE0_HUMAN Dedicator of cytokinesis protein 7 (Fragment) OS=Homo sapiens OX=9606 GN=DOCK7 PE=1 SV=1	399	PQLTRPGSFLLT
PQGTRPPGFLLT	sp|P0DOH8|POLS_JAEVJ	284	sp|Q96N67|DOCK7_HUMAN Dedicator of cytokinesis protein 7 OS=Homo sapiens OX=9606 GN=DOCK7 PE=1 SV=4	1299	PQLTRPGSFLLT
LKGYPGDLKVGR	sp|P32886|POLG_JAEVJ	1647	sp|P52824|DGKQ_HUMAN Diacylglycerol kinase theta OS=Homo sapiens OX=9606 GN=DGKQ PE=1 SV=2	399	LKIYPGWLKVGV
LKGYPGDLKVGR	sp|P32886|POLG_JAEVJ	1647	tr|H0YA20|H0YA20_HUMAN Diacylglycerol kinase (Fragment) OS=Homo sapiens OX=9606 GN=DGKQ PE=1 SV=1	346	LKIYPGWLKVGV
DTAIGGPVQSRV	sp|P32886|POLG_JAEVJ	1261	sp|Q9P265|DIP2B_HUMAN Disco-interacting protein 2 homolog B OS=Homo sapiens OX=9606 GN=DIP2B PE=1 SV=3	262	DTADGVPVSSRV
SEEEVELVISFL	sp|P0DOH8|POLS_JAEVJ	444	tr|C9J3F6|C9J3F6_HUMAN TBC1 domain family member 5 OS=Homo sapiens OX=9606 GN=TBC1D5 PE=1 SV=1	558	SEEELEAQISFL
SEEEVELVISFL	sp|P0DOH8|POLS_JAEVJ	444	sp|Q92609|TBCD5_HUMAN TBC1 domain family member 5 OS=Homo sapiens OX=9606 GN=TBC1D5 PE=1 SV=1	584	SEEELEAQISFL
HTACQKLRAKGI	sp|P32886|POLG_JAEVJ	823	sp|Q9Y6X2|PIAS3_HUMAN E3 SUMO-protein ligase PIAS3 OS=Homo sapiens OX=9606 GN=PIAS3 PE=1 SV=2	283	GTLLQKLRAKGI
HTACQKLRAKGI	sp|P32886|POLG_JAEVJ	823	tr|E9PHH8|E9PHH8_HUMAN E3 SUMO-protein ligase PIAS3 OS=Homo sapiens OX=9606 GN=PIAS3 PE=1 SV=1	248	GTLLQKLRAKGI
AAILFVDIGNAF	sp|P32886|POLG_JAEVJ	2385	tr|M0R058|M0R058_HUMAN Alpha-soluble NSF attachment protein (Fragment) OS=Homo sapiens OX=9606 GN=NAPA PE=1 SV=1	31	AATCFVDAGNAF
AAILFVDIGNAF	sp|P32886|POLG_JAEVJ	2385	tr|M0R2M1|M0R2M1_HUMAN Alpha-soluble NSF attachment protein (Fragment) OS=Homo sapiens OX=9606 GN=NAPA PE=1 SV=1	91	AATCFVDAGNAF
AAILFVDIGNAF	sp|P32886|POLG_JAEVJ	2385	sp|P54920|SNAA_HUMAN Alpha-soluble NSF attachment protein OS=Homo sapiens OX=9606 GN=NAPA PE=1 SV=3	81	AATCFVDAGNAF
AAILFVDIGNAF	sp|P32886|POLG_JAEVJ	2385	tr|M0R0I4|M0R0I4_HUMAN Alpha-soluble NSF attachment protein (Fragment) OS=Homo sapiens OX=9606 GN=NAPA PE=1 SV=1	22	AATCFVDAGNAF
VGVSQAFVLQLF	sp|P32886|POLG_JAEVJ	1770	tr|F8W6G6|F8W6G6_HUMAN Leukocyte immunoglobulin-like receptor subfamily B member 3 OS=Homo sapiens OX=9606 GN=LILRB3 PE=1 SV=2	458	IGVSVAFVLLLF
VGVSQAFVLQLF	sp|P32886|POLG_JAEVJ	1770	tr|A0A0G2JM46|A0A0G2JM46_HUMAN Leukocyte immunoglobulin-like receptor subfamily B member 3 OS=Homo sapiens OX=9606 GN=LILRB3 PE=1 SV=1	446	IGVSVAFVLLLF
VGVSQAFVLQLF	sp|P32886|POLG_JAEVJ	1770	tr|A0A0G2JMZ3|A0A0G2JMZ3_HUMAN Leukocyte immunoglobulin-like receptor subfamily B member 3 OS=Homo sapiens OX=9606 GN=LILRB3 PE=1 SV=1	463	IGVSVAFVLLLF
VGVSQAFVLQLF	sp|P32886|POLG_JAEVJ	1770	tr|A0A0G2JPW1|A0A0G2JPW1_HUMAN Leukocyte immunoglobulin-like receptor subfamily A member 6 OS=Homo sapiens OX=9606 GN=LILRA6 PE=1 SV=1	446	IGVSVAFVLLLF
VGVSQAFVLQLF	sp|P32886|POLG_JAEVJ	1770	tr|A0A0G2JQ25|A0A0G2JQ25_HUMAN Leukocyte immunoglobulin-like receptor subfamily A member 6 OS=Homo sapiens OX=9606 GN=LILRA6 PE=1 SV=1	446	IGVSVAFVLLLF
VGVSQAFVLQLF	sp|P32886|POLG_JAEVJ	1770	tr|A0A0G2JNB3|A0A0G2JNB3_HUMAN Leukocyte immunoglobulin-like receptor subfamily B member 3 OS=Homo sapiens OX=9606 GN=LILRB3 PE=1 SV=1	446	IGVSVAFVLLLF
VGVSQAFVLQLF	sp|P32886|POLG_JAEVJ	1770	sp|O75022|LIRB3_HUMAN Leukocyte immunoglobulin-like receptor subfamily B member 3 OS=Homo sapiens OX=9606 GN=LILRB3 PE=1 SV=3	446	IGVSVAFVLLLF
VGVSQAFVLQLF	sp|P32886|POLG_JAEVJ	1770	tr|A0A0G2JN67|A0A0G2JN67_HUMAN Leukocyte immunoglobulin-like receptor subfamily B member 3 OS=Homo sapiens OX=9606 GN=LILRB3 PE=1 SV=1	463	IGVSVAFVLLLF
VGVSQAFVLQLF	sp|P32886|POLG_JAEVJ	1770	tr|A0A0G2JPR9|A0A0G2JPR9_HUMAN Leukocyte immunoglobulin-like receptor subfamily A member 6 OS=Homo sapiens OX=9606 GN=LILRA6 PE=1 SV=1	463	IGVSVAFVLLLF
VGVSQAFVLQLF	sp|P32886|POLG_JAEVJ	1770	tr|A0A0G2JLT7|A0A0G2JLT7_HUMAN Leukocyte immunoglobulin-like receptor subfamily B member 3 OS=Homo sapiens OX=9606 GN=LILRB3 PE=1 SV=1	446	IGVSVAFVLLLF
VGVSQAFVLQLF	sp|P32886|POLG_JAEVJ	1770	tr|A0A0G2JMM1|A0A0G2JMM1_HUMAN Leukocyte immunoglobulin-like receptor subfamily B member 3 OS=Homo sapiens OX=9606 GN=LILRB3 PE=1 SV=1	463	IGVSVAFVLLLF
VGVSQAFVLQLF	sp|P32886|POLG_JAEVJ	1770	tr|A0A0G2JPK5|A0A0G2JPK5_HUMAN Leukocyte immunoglobulin-like receptor subfamily B member 3 OS=Homo sapiens OX=9606 GN=LILRB3 PE=1 SV=1	446	IGVSVAFVLLLF
VGVSQAFVLQLF	sp|P32886|POLG_JAEVJ	1770	tr|A0A0G2JN08|A0A0G2JN08_HUMAN Leukocyte immunoglobulin-like receptor subfamily B member 3 OS=Homo sapiens OX=9606 GN=LILRB3 PE=1 SV=1	446	IGVSVAFVLLLF
VGVSQAFVLQLF	sp|P32886|POLG_JAEVJ	1770	tr|A0A0G2JNY7|A0A0G2JNY7_HUMAN Leukocyte immunoglobulin-like receptor subfamily B member 5 OS=Homo sapiens OX=9606 GN=LILRB5 PE=1 SV=1	361	TGVSVAFVLLLF
VGVSQAFVLQLF	sp|P32886|POLG_JAEVJ	1770	sp|O75023|LIRB5_HUMAN Leukocyte immunoglobulin-like receptor subfamily B member 5 OS=Homo sapiens OX=9606 GN=LILRB5 PE=1 SV=1	461	TGVSVAFVLLLF
VGVSQAFVLQLF	sp|P32886|POLG_JAEVJ	1770	tr|A0A0G2JPM8|A0A0G2JPM8_HUMAN Leukocyte immunoglobulin-like receptor subfamily B member 5 OS=Homo sapiens OX=9606 GN=LILRB5 PE=1 SV=1	461	TGVSVAFVLLLF
VGVSQAFVLQLF	sp|P32886|POLG_JAEVJ	1770	tr|A0A0G2JMX5|A0A0G2JMX5_HUMAN Leukocyte immunoglobulin-like receptor subfamily B member 5 OS=Homo sapiens OX=9606 GN=LILRB5 PE=1 SV=1	453	TGVSVAFVLLLF
VGVSQAFVLQLF	sp|P32886|POLG_JAEVJ	1770	tr|A0A0G2JNP3|A0A0G2JNP3_HUMAN Leukocyte immunoglobulin-like receptor subfamily B member 5 OS=Homo sapiens OX=9606 GN=LILRB5 PE=1 SV=1	461	TGVSVAFVLLLF
TACQKLRAKGIP	sp|P32886|POLG_JAEVJ	824	sp|Q9Y6X2|PIAS3_HUMAN E3 SUMO-protein ligase PIAS3 OS=Homo sapiens OX=9606 GN=PIAS3 PE=1 SV=2	284	TLLQKLRAKGIR
TACQKLRAKGIP	sp|P32886|POLG_JAEVJ	824	tr|E9PHH8|E9PHH8_HUMAN E3 SUMO-protein ligase PIAS3 OS=Homo sapiens OX=9606 GN=PIAS3 PE=1 SV=1	249	TLLQKLRAKGIR
QRMDSEEEVELV	sp|P0DOH8|POLS_JAEVJ	440	tr|D6RCA0|D6RCA0_HUMAN Protein FAM13B (Fragment) OS=Homo sapiens OX=9606 GN=FAM13B PE=1 SV=1	75	QRYDSGEEVDLV
QRMDSEEEVELV	sp|P0DOH8|POLS_JAEVJ	440	tr|D6RAT6|D6RAT6_HUMAN Protein FAM13B (Fragment) OS=Homo sapiens OX=9606 GN=FAM13B PE=1 SV=1	75	QRYDSGEEVDLV
QRMDSEEEVELV	sp|P0DOH8|POLS_JAEVJ	440	tr|D6RDL7|D6RDL7_HUMAN Protein FAM13B (Fragment) OS=Homo sapiens OX=9606 GN=FAM13B PE=1 SV=1	75	QRYDSGEEVDLV
QRMDSEEEVELV	sp|P0DOH8|POLS_JAEVJ	440	sp|Q9NYF5|FA13B_HUMAN Protein FAM13B OS=Homo sapiens OX=9606 GN=FAM13B PE=1 SV=2	75	QRYDSGEEVDLV
SRVLLRRMQMRA	sp|P32886|POLG_JAEVJ	1270	sp|P19532|TFE3_HUMAN Transcription factor E3 OS=Homo sapiens OX=9606 GN=TFE3 PE=1 SV=4	112	SRVLLRQQLMRA
KPPGVGLSEGEG	sp|P0DOH8|POLS_JAEVJ	672	tr|B7WPH3|B7WPH3_HUMAN Cat eye syndrome critical region protein 2 OS=Homo sapiens OX=9606 GN=CECR2 PE=1 SV=2	799	KPPGVGTSEGVY
KPPGVGLSEGEG	sp|P0DOH8|POLS_JAEVJ	672	sp|Q9BXF3|CECR2_HUMAN Cat eye syndrome critical region protein 2 OS=Homo sapiens OX=9606 GN=CECR2 PE=1 SV=2	983	KPPGVGTSEGVY
KPPGVGLSEGEG	sp|P0DOH8|POLS_JAEVJ	672	tr|A0A0R4J2E1|A0A0R4J2E1_HUMAN Cat eye syndrome critical region protein 2 OS=Homo sapiens OX=9606 GN=CECR2 PE=1 SV=1	800	KPPGVGTSEGVY
KPPGVGLSEGEG	sp|P0DOH8|POLS_JAEVJ	672	tr|A0A087WT21|A0A087WT21_HUMAN Cat eye syndrome critical region protein 2 OS=Homo sapiens OX=9606 GN=CECR2 PE=1 SV=1	941	KPPGVGTSEGVY
DEKGGTLILVPD	sp|P32886|POLG_JAEVJ	1694	tr|C9J7B4|C9J7B4_HUMAN E3 ubiquitin-protein ligase RNF13 (Fragment) OS=Homo sapiens OX=9606 GN=RNF13 PE=1 SV=1	45	YEKGGHLILVPE
DEKGGTLILVPD	sp|P32886|POLG_JAEVJ	1694	tr|C9IY58|C9IY58_HUMAN E3 ubiquitin-protein ligase RNF13 (Fragment) OS=Homo sapiens OX=9606 GN=RNF13 PE=1 SV=3	45	YEKGGHLILVPE
DEKGGTLILVPD	sp|P32886|POLG_JAEVJ	1694	tr|C9JCY0|C9JCY0_HUMAN E3 ubiquitin-protein ligase RNF13 (Fragment) OS=Homo sapiens OX=9606 GN=RNF13 PE=1 SV=1	45	YEKGGHLILVPE
DEKGGTLILVPD	sp|P32886|POLG_JAEVJ	1694	sp|O43567|RNF13_HUMAN E3 ubiquitin-protein ligase RNF13 OS=Homo sapiens OX=9606 GN=RNF13 PE=1 SV=1	164	YEKGGHLILVPE
KKIQTALDCLKR	sp|P0DOH8|POLS_JAEVJ	74	tr|F2Z2U4|F2Z2U4_HUMAN Transformation/transcription domain-associated protein OS=Homo sapiens OX=9606 GN=TRRAP PE=1 SV=3	940	KAIETALDCLKS
KKIQTALDCLKR	sp|P0DOH8|POLS_JAEVJ	74	sp|Q9Y4A5|TRRAP_HUMAN Transformation/transcription domain-associated protein OS=Homo sapiens OX=9606 GN=TRRAP PE=1 SV=3	941	KAIETALDCLKS
KKIQTALDCLKR	sp|P0DOH8|POLS_JAEVJ	74	tr|H0Y4W2|H0Y4W2_HUMAN Transformation/transcription domain-associated protein OS=Homo sapiens OX=9606 GN=TRRAP PE=1 SV=2	941	KAIETALDCLKS
LGLGDILGREAI	sp|P32886|POLG_JAEVJ	1920	sp|Q9UQQ1|NALDL_HUMAN Aminopeptidase NAALADL1 OS=Homo sapiens OX=9606 GN=NAALADL1 PE=1 SV=2	17	LGLGIILGHFAI
LGLGDILGREAI	sp|P32886|POLG_JAEVJ	1920	tr|C9JFW8|C9JFW8_HUMAN Aminopeptidase NAALADL1 OS=Homo sapiens OX=9606 GN=NAALADL1 PE=1 SV=1	17	LGLGIILGHFAI
KTSALNSARLLP	sp|P32886|POLG_JAEVJ	506	tr|E9PJT4|E9PJT4_HUMAN Dynein heavy chain domain-containing protein 1 (Fragment) OS=Homo sapiens OX=9606 GN=DNHD1 PE=4 SV=2	133	KTSASGSAWLLP
QDSTKEILLGML	sp|P32886|POLG_JAEVJ	1877	sp|Q8NB46|ANR52_HUMAN Serine/threonine-protein phosphatase 6 regulatory ankyrin repeat subunit C OS=Homo sapiens OX=9606 GN=ANKRD52 PE=1 SV=3	835	QDSTTEMLLGAL
VTPDFDLSNVSG	sp|P0DOH8|POLS_JAEVJ	760	sp|Q9BX10|GTPB2_HUMAN GTP-binding protein 2 OS=Homo sapiens OX=9606 GN=GTPBP2 PE=1 SV=1	368	VTPIFTLSSVSG
ACHSGGEPVKIV	sp|P32886|POLG_JAEVJ	1836	sp|Q9H3Y6|SRMS_HUMAN Tyrosine-protein kinase Srms OS=Homo sapiens OX=9606 GN=SRMS PE=1 SV=1	290	AVCSGGEPVYIV
EKGKISLVIGLG	sp|P32886|POLG_JAEVJ	917	sp|O60774|FMO6_HUMAN Putative dimethylaniline monooxygenase [N-oxide-forming] 6 OS=Homo sapiens OX=9606 GN=FMO6P PE=5 SV=1	182	FKGKRVLVIGLG
NTWGCGNGTRMA	sp|P0DOH8|POLS_JAEVJ	1047	sp|P02545|LMNA_HUMAN Prelamin-A/C OS=Homo sapiens OX=9606 GN=LMNA PE=1 SV=1	518	NTWGCGNSLRTA
NTWGCGNGTRMA	sp|P0DOH8|POLS_JAEVJ	1047	tr|A0A6Q8PFJ0|A0A6Q8PFJ0_HUMAN Prelamin-A/C OS=Homo sapiens OX=9606 GN=LMNA PE=1 SV=1	518	NTWGCGNSLRTA
NTWGCGNGTRMA	sp|P0DOH8|POLS_JAEVJ	1047	tr|Q5TCI8|Q5TCI8_HUMAN Prelamin-A/C OS=Homo sapiens OX=9606 GN=LMNA PE=1 SV=1	437	NTWGCGNSLRTA
NTWGCGNGTRMA	sp|P0DOH8|POLS_JAEVJ	1047	tr|A0A0C4DGC5|A0A0C4DGC5_HUMAN Prelamin-A/C (Fragment) OS=Homo sapiens OX=9606 GN=LMNA PE=1 SV=1	144	NTWGCGNSLRTA
RLALGYRVWSEG	sp|P32886|POLG_JAEVJ	770	tr|Q0P5T2|Q0P5T2_HUMAN C6orf136 protein (Fragment) OS=Homo sapiens OX=9606 GN=C6orf136 PE=1 SV=1	98	RLALGERSWQEG
RLALGYRVWSEG	sp|P32886|POLG_JAEVJ	770	tr|A0A140T9G8|A0A140T9G8_HUMAN Uncharacterized protein C6orf136 (Fragment) OS=Homo sapiens OX=9606 GN=C6orf136 PE=1 SV=1	98	RLALGERSWQEG
KRTERVLHRDPK	sp|P32886|POLG_JAEVJ	1299	tr|H0YMG4|H0YMG4_HUMAN E3 ubiquitin-protein ligase RNF31 (Fragment) OS=Homo sapiens OX=9606 GN=RNF31 PE=1 SV=2	313	KLTEGVLMRDPK
KRTERVLHRDPK	sp|P32886|POLG_JAEVJ	1299	tr|H0YKX0|H0YKX0_HUMAN RBR-type E3 ubiquitin transferase (Fragment) OS=Homo sapiens OX=9606 GN=RNF31 PE=1 SV=1	629	KLTEGVLMRDPK
KRTERVLHRDPK	sp|P32886|POLG_JAEVJ	1299	sp|Q96EP0|RNF31_HUMAN E3 ubiquitin-protein ligase RNF31 OS=Homo sapiens OX=9606 GN=RNF31 PE=1 SV=1	784	KLTEGVLMRDPK
KRTERVLHRDPK	sp|P32886|POLG_JAEVJ	1299	tr|A0A0B4J293|A0A0B4J293_HUMAN Uncharacterized protein (Fragment) OS=Homo sapiens OX=9606 PE=4 SV=1	259	KLTEGVLMRDPK
LLKSLAMARGTE	sp|P0DOH8|POLS_JAEVJ	455	tr|B1AKD8|B1AKD8_HUMAN Rootletin (Fragment) OS=Homo sapiens OX=9606 GN=CROCC PE=1 SV=2	1226	LLGSLEEARGTE
LLKSLAMARGTE	sp|P0DOH8|POLS_JAEVJ	455	sp|Q5TZA2|CROCC_HUMAN Rootletin OS=Homo sapiens OX=9606 GN=CROCC PE=1 SV=1	1366	LLGSLEEARGTE
NVLKGYPGDLKV	sp|P32886|POLG_JAEVJ	1645	sp|P52824|DGKQ_HUMAN Diacylglycerol kinase theta OS=Homo sapiens OX=9606 GN=DGKQ PE=1 SV=2	397	EVLKIYPGWLKV
NVLKGYPGDLKV	sp|P32886|POLG_JAEVJ	1645	tr|H0YA20|H0YA20_HUMAN Diacylglycerol kinase (Fragment) OS=Homo sapiens OX=9606 GN=DGKQ PE=1 SV=1	344	EVLKIYPGWLKV
ANVSPMHTRAYI	sp|P32886|POLG_JAEVJ	55	sp|Q16706|MA2A1_HUMAN Alpha-mannosidase 2 OS=Homo sapiens OX=9606 GN=MAN2A1 PE=1 SV=2	914	ANVYPMTTMAYI
TDLRSQAVFDAI	sp|P32886|POLG_JAEVJ	2827	tr|A0A087WX11|A0A087WX11_HUMAN Folliculin-interacting protein 1 OS=Homo sapiens OX=9606 GN=FNIP1 PE=1 SV=1	517	TELRSQAVVDQI
TDLRSQAVFDAI	sp|P32886|POLG_JAEVJ	2827	sp|Q8TF40|FNIP1_HUMAN Folliculin-interacting protein 1 OS=Homo sapiens OX=9606 GN=FNIP1 PE=1 SV=3	765	TELRSQAVVDQI
TDLRSQAVFDAI	sp|P32886|POLG_JAEVJ	2827	tr|J3KNG8|J3KNG8_HUMAN Folliculin-interacting protein 1 OS=Homo sapiens OX=9606 GN=FNIP1 PE=1 SV=1	720	TELRSQAVVDQI
WKPPGVGLSEGE	sp|P0DOH8|POLS_JAEVJ	671	tr|B7WPH3|B7WPH3_HUMAN Cat eye syndrome critical region protein 2 OS=Homo sapiens OX=9606 GN=CECR2 PE=1 SV=2	798	EKPPGVGTSEGV
WKPPGVGLSEGE	sp|P0DOH8|POLS_JAEVJ	671	sp|Q9BXF3|CECR2_HUMAN Cat eye syndrome critical region protein 2 OS=Homo sapiens OX=9606 GN=CECR2 PE=1 SV=2	982	EKPPGVGTSEGV
WKPPGVGLSEGE	sp|P0DOH8|POLS_JAEVJ	671	tr|A0A0R4J2E1|A0A0R4J2E1_HUMAN Cat eye syndrome critical region protein 2 OS=Homo sapiens OX=9606 GN=CECR2 PE=1 SV=1	799	EKPPGVGTSEGV
WKPPGVGLSEGE	sp|P0DOH8|POLS_JAEVJ	671	tr|A0A087WT21|A0A087WT21_HUMAN Cat eye syndrome critical region protein 2 OS=Homo sapiens OX=9606 GN=CECR2 PE=1 SV=1	940	EKPPGVGTSEGV
VRAVTGAWTGTI	sp|P32886|POLG_JAEVJ	588	sp|P23443|KS6B1_HUMAN Ribosomal protein S6 kinase beta-1 OS=Homo sapiens OX=9606 GN=RPS6KB1 PE=1 SV=2	108	VRKVTGANTGKI
VRAVTGAWTGTI	sp|P32886|POLG_JAEVJ	588	tr|K7ER06|K7ER06_HUMAN Ribosomal protein S6 kinase beta-1 OS=Homo sapiens OX=9606 GN=RPS6KB1 PE=1 SV=1	108	VRKVTGANTGKI
FAHNVMKRTLPE	sp|P32886|POLG_JAEVJ	2330	tr|H3BTB7|H3BTB7_HUMAN Glutamyl-tRNA synthetase OS=Homo sapiens OX=9606 GN=EARS2 PE=1 SV=1	318	FAENQMGRTLPE
FAHNVMKRTLPE	sp|P32886|POLG_JAEVJ	2330	sp|Q5JPH6|SYEM_HUMAN Probable glutamate--tRNA ligase, mitochondrial OS=Homo sapiens OX=9606 GN=EARS2 PE=1 SV=2	318	FAENQMGRTLPE
EVAALALRHELT	sp|P32886|POLG_JAEVJ	559	tr|A0A1W2PPT1|A0A1W2PPT1_HUMAN Lactosylceramide alpha-2,3-sialyltransferase OS=Homo sapiens OX=9606 GN=ST3GAL5 PE=1 SV=1	186	EGAALALRHFLL
SFLLKSLAMARG	sp|P0DOH8|POLS_JAEVJ	453	sp|Q8NGH6|O52L2_HUMAN Putative olfactory receptor 52L2 OS=Homo sapiens OX=9606 GN=OR52L2P PE=5 SV=3	8	SFLLKSLIMALS
EKGGTLILVPDG	sp|P32886|POLG_JAEVJ	1695	tr|C9J7B4|C9J7B4_HUMAN E3 ubiquitin-protein ligase RNF13 (Fragment) OS=Homo sapiens OX=9606 GN=RNF13 PE=1 SV=1	46	EKGGHLILVPEF
EKGGTLILVPDG	sp|P32886|POLG_JAEVJ	1695	tr|C9IY58|C9IY58_HUMAN E3 ubiquitin-protein ligase RNF13 (Fragment) OS=Homo sapiens OX=9606 GN=RNF13 PE=1 SV=3	46	EKGGHLILVPEF
EKGGTLILVPDG	sp|P32886|POLG_JAEVJ	1695	tr|C9JCY0|C9JCY0_HUMAN E3 ubiquitin-protein ligase RNF13 (Fragment) OS=Homo sapiens OX=9606 GN=RNF13 PE=1 SV=1	46	EKGGHLILVPEF
EKGGTLILVPDG	sp|P32886|POLG_JAEVJ	1695	sp|O43567|RNF13_HUMAN E3 ubiquitin-protein ligase RNF13 OS=Homo sapiens OX=9606 GN=RNF13 PE=1 SV=1	165	EKGGHLILVPEF
DLVRKTIARAHT	sp|P0DOH8|POLS_JAEVJ	13	sp|Q5UAW9|GP157_HUMAN G-protein coupled receptor 157 OS=Homo sapiens OX=9606 GN=GPR157 PE=2 SV=2	190	LLVRKHINRAHT
GTGPVCCGGGQG	sp|P32886|POLG_JAEVJ	705	sp|Q9NQX0|PRDM6_HUMAN Putative histone-lysine N-methyltransferase PRDM6 OS=Homo sapiens OX=9606 GN=PRDM6 PE=1 SV=2	144	GPGPVKCGGGGG
SGGEPVKIVFRL	sp|P32886|POLG_JAEVJ	1839	sp|Q9H3Y6|SRMS_HUMAN Tyrosine-protein kinase Srms OS=Homo sapiens OX=9606 GN=SRMS PE=1 SV=1	293	SGGEPVYIVTEL
LVRKTIARAHTT	sp|P0DOH8|POLS_JAEVJ	14	sp|Q5UAW9|GP157_HUMAN G-protein coupled receptor 157 OS=Homo sapiens OX=9606 GN=GPR157 PE=2 SV=2	191	LVRKHINRAHTA
LVRKTIARAHTT	sp|P0DOH8|POLS_JAEVJ	14	sp|Q969H6|POP5_HUMAN Ribonuclease P/MRP protein subunit POP5 OS=Homo sapiens OX=9606 GN=POP5 PE=1 SV=1	32	LVRDTIARVHGT
TGDFVKAQKEAA	sp|P0DOH8|POLS_JAEVJ	295	tr|X6RJV5|X6RJV5_HUMAN Protein artemis (Fragment) OS=Homo sapiens OX=9606 GN=DCLRE1C PE=1 SV=1	19	TGDFRLAQGEAA
TGDFVKAQKEAA	sp|P0DOH8|POLS_JAEVJ	295	tr|X6R9W9|X6R9W9_HUMAN Protein artemis (Fragment) OS=Homo sapiens OX=9606 GN=DCLRE1C PE=1 SV=1	14	TGDFRLAQGEAA
TGDFVKAQKEAA	sp|P0DOH8|POLS_JAEVJ	295	sp|Q96SD1|DCR1C_HUMAN Protein artemis OS=Homo sapiens OX=9606 GN=DCLRE1C PE=1 SV=2	134	TGDFRLAQGEAA
QESLRVEVEKNK	sp|P32886|POLG_JAEVJ	2713	sp|P33176|KINH_HUMAN Kinesin-1 heavy chain OS=Homo sapiens OX=9606 GN=KIF5B PE=1 SV=1	744	QERLRVEHEKLK
LGAVEGRRWIRA	sp|P32886|POLG_JAEVJ	1055	sp|Q14012|KCC1A_HUMAN Calcium/calmodulin-dependent protein kinase type 1 OS=Homo sapiens OX=9606 GN=CAMK1 PE=1 SV=1	2	LGAVEGPRWKQA
LGAVEGRRWIRA	sp|P32886|POLG_JAEVJ	1055	tr|C9JES6|C9JES6_HUMAN Calcium/calmodulin-dependent protein kinase type 1 (Fragment) OS=Homo sapiens OX=9606 GN=CAMK1 PE=1 SV=1	2	LGAVEGPRWKQA
LGAVEGRRWIRA	sp|P32886|POLG_JAEVJ	1055	tr|F8W6S9|F8W6S9_HUMAN Calcium/calmodulin-dependent protein kinase type 1 OS=Homo sapiens OX=9606 GN=CAMK1 PE=1 SV=1	2	LGAVEGPRWKQA
YKSATKAKEELA	sp|P32886|POLG_JAEVJ	2060	sp|Q2NKJ3|CTC1_HUMAN CST complex subunit CTC1 OS=Homo sapiens OX=9606 GN=CTC1 PE=1 SV=2	467	YLWATKALEELA
STFAATSHKKAP	sp|P32886|POLG_JAEVJ	2595	tr|A0A0C4DGF2|A0A0C4DGF2_HUMAN Kelch-like protein 6 (Fragment) OS=Homo sapiens OX=9606 GN=KLHL6 PE=1 SV=1	448	SSFAATSHKKKL
STFAATSHKKAP	sp|P32886|POLG_JAEVJ	2595	sp|Q8WZ60|KLHL6_HUMAN Kelch-like protein 6 OS=Homo sapiens OX=9606 GN=KLHL6 PE=1 SV=3	459	SSFAATSHKKKL
RDDNALVKGASG	sp|P0DOH8|POLS_JAEVJ	620	sp|Q6UWP2|DHR11_HUMAN Dehydrogenase/reductase SDR family member 11 OS=Homo sapiens OX=9606 GN=DHRS11 PE=1 SV=1	10	RDRLALVTGASG
RDDNALVKGASG	sp|P0DOH8|POLS_JAEVJ	620	tr|A0A087WYV4|A0A087WYV4_HUMAN Dehydrogenase/reductase SDR family member 11 OS=Homo sapiens OX=9606 GN=DHRS11 PE=1 SV=1	10	RDRLALVTGASG
VSLAYQCGRKAM	sp|P32886|POLG_JAEVJ	2770	sp|Q9NSI6|BRWD1_HUMAN Bromodomain and WD repeat-containing protein 1 OS=Homo sapiens OX=9606 GN=BRWD1 PE=1 SV=4	1587	VSLANGCGRKAT
TLPESIVPLLGG	sp|P32886|POLG_JAEVJ	2338	sp|Q9Y493|ZAN_HUMAN Zonadhesin OS=Homo sapiens OX=9606 GN=ZAN PE=2 SV=5	1217	TLPESTVTLLKG
SIQYGVCDNTTG	sp|P32886|POLG_JAEVJ	541	sp|Q06828|FMOD_HUMAN Fibromodulin OS=Homo sapiens OX=9606 GN=FMOD PE=1 SV=2	119	SIQEGVFDNATG
SIQYGVCDNTTG	sp|P32886|POLG_JAEVJ	541	tr|A0A3B3IRN5|A0A3B3IRN5_HUMAN Fibromodulin OS=Homo sapiens OX=9606 GN=FMOD PE=1 SV=1	30	SIQEGVFDNATG
VLKRISGGINII	sp|P32886|POLG_JAEVJ	627	tr|H3BV95|H3BV95_HUMAN Ubiquitin-conjugating enzyme E2 Q2 OS=Homo sapiens OX=9606 GN=UBE2Q2 PE=1 SV=1	107	VLPVLSGGINII
VLKRISGGINII	sp|P32886|POLG_JAEVJ	627	tr|H3BN94|H3BN94_HUMAN Ubiquitin-conjugating enzyme E2 Q2 (Fragment) OS=Homo sapiens OX=9606 GN=UBE2Q2 PE=1 SV=1	80	VLPVLSGGINII
VEVAALALRHEL	sp|P32886|POLG_JAEVJ	558	tr|A0A1W2PPT1|A0A1W2PPT1_HUMAN Lactosylceramide alpha-2,3-sialyltransferase OS=Homo sapiens OX=9606 GN=ST3GAL5 PE=1 SV=1	185	PEGAALALRHFL
TPTTGAAQVLAL	sp|P32886|POLG_JAEVJ	1500	sp|O15151|MDM4_HUMAN Protein Mdm4 OS=Homo sapiens OX=9606 GN=MDM4 PE=1 SV=2	111	TATTDAAQTLAL
GVSQAFVLQLFW	sp|P32886|POLG_JAEVJ	1771	tr|F8W6G6|F8W6G6_HUMAN Leukocyte immunoglobulin-like receptor subfamily B member 3 OS=Homo sapiens OX=9606 GN=LILRB3 PE=1 SV=2	459	GVSVAFVLLLFL
GVSQAFVLQLFW	sp|P32886|POLG_JAEVJ	1771	tr|A0A0G2JNY7|A0A0G2JNY7_HUMAN Leukocyte immunoglobulin-like receptor subfamily B member 5 OS=Homo sapiens OX=9606 GN=LILRB5 PE=1 SV=1	362	GVSVAFVLLLFL
GVSQAFVLQLFW	sp|P32886|POLG_JAEVJ	1771	sp|O75023|LIRB5_HUMAN Leukocyte immunoglobulin-like receptor subfamily B member 5 OS=Homo sapiens OX=9606 GN=LILRB5 PE=1 SV=1	462	GVSVAFVLLLFL
GVSQAFVLQLFW	sp|P32886|POLG_JAEVJ	1771	tr|A0A0G2JPM8|A0A0G2JPM8_HUMAN Leukocyte immunoglobulin-like receptor subfamily B member 5 OS=Homo sapiens OX=9606 GN=LILRB5 PE=1 SV=1	462	GVSVAFVLLLFL
GVSQAFVLQLFW	sp|P32886|POLG_JAEVJ	1771	tr|A0A0G2JMX5|A0A0G2JMX5_HUMAN Leukocyte immunoglobulin-like receptor subfamily B member 5 OS=Homo sapiens OX=9606 GN=LILRB5 PE=1 SV=1	454	GVSVAFVLLLFL
GVSQAFVLQLFW	sp|P32886|POLG_JAEVJ	1771	tr|A0A0G2JNP3|A0A0G2JNP3_HUMAN Leukocyte immunoglobulin-like receptor subfamily B member 5 OS=Homo sapiens OX=9606 GN=LILRB5 PE=1 SV=1	462	GVSVAFVLLLFL
GVSQAFVLQLFW	sp|P32886|POLG_JAEVJ	1771	tr|A0A0G2JM46|A0A0G2JM46_HUMAN Leukocyte immunoglobulin-like receptor subfamily B member 3 OS=Homo sapiens OX=9606 GN=LILRB3 PE=1 SV=1	447	GVSVAFVLLLFL
GVSQAFVLQLFW	sp|P32886|POLG_JAEVJ	1771	tr|A0A0G2JMZ3|A0A0G2JMZ3_HUMAN Leukocyte immunoglobulin-like receptor subfamily B member 3 OS=Homo sapiens OX=9606 GN=LILRB3 PE=1 SV=1	464	GVSVAFVLLLFL
GVSQAFVLQLFW	sp|P32886|POLG_JAEVJ	1771	tr|A0A0G2JPW1|A0A0G2JPW1_HUMAN Leukocyte immunoglobulin-like receptor subfamily A member 6 OS=Homo sapiens OX=9606 GN=LILRA6 PE=1 SV=1	447	GVSVAFVLLLFL
GVSQAFVLQLFW	sp|P32886|POLG_JAEVJ	1771	tr|A0A0G2JQ25|A0A0G2JQ25_HUMAN Leukocyte immunoglobulin-like receptor subfamily A member 6 OS=Homo sapiens OX=9606 GN=LILRA6 PE=1 SV=1	447	GVSVAFVLLLFL
GVSQAFVLQLFW	sp|P32886|POLG_JAEVJ	1771	tr|A0A0G2JNB3|A0A0G2JNB3_HUMAN Leukocyte immunoglobulin-like receptor subfamily B member 3 OS=Homo sapiens OX=9606 GN=LILRB3 PE=1 SV=1	447	GVSVAFVLLLFL
GVSQAFVLQLFW	sp|P32886|POLG_JAEVJ	1771	sp|O75022|LIRB3_HUMAN Leukocyte immunoglobulin-like receptor subfamily B member 3 OS=Homo sapiens OX=9606 GN=LILRB3 PE=1 SV=3	447	GVSVAFVLLLFL
GVSQAFVLQLFW	sp|P32886|POLG_JAEVJ	1771	tr|A0A0G2JN67|A0A0G2JN67_HUMAN Leukocyte immunoglobulin-like receptor subfamily B member 3 OS=Homo sapiens OX=9606 GN=LILRB3 PE=1 SV=1	464	GVSVAFVLLLFL
GVSQAFVLQLFW	sp|P32886|POLG_JAEVJ	1771	tr|A0A0G2JPR9|A0A0G2JPR9_HUMAN Leukocyte immunoglobulin-like receptor subfamily A member 6 OS=Homo sapiens OX=9606 GN=LILRA6 PE=1 SV=1	464	GVSVAFVLLLFL
GVSQAFVLQLFW	sp|P32886|POLG_JAEVJ	1771	tr|A0A0G2JLT7|A0A0G2JLT7_HUMAN Leukocyte immunoglobulin-like receptor subfamily B member 3 OS=Homo sapiens OX=9606 GN=LILRB3 PE=1 SV=1	447	GVSVAFVLLLFL
GVSQAFVLQLFW	sp|P32886|POLG_JAEVJ	1771	tr|A0A0G2JMM1|A0A0G2JMM1_HUMAN Leukocyte immunoglobulin-like receptor subfamily B member 3 OS=Homo sapiens OX=9606 GN=LILRB3 PE=1 SV=1	464	GVSVAFVLLLFL
GVSQAFVLQLFW	sp|P32886|POLG_JAEVJ	1771	tr|A0A0G2JPK5|A0A0G2JPK5_HUMAN Leukocyte immunoglobulin-like receptor subfamily B member 3 OS=Homo sapiens OX=9606 GN=LILRB3 PE=1 SV=1	447	GVSVAFVLLLFL
GVSQAFVLQLFW	sp|P32886|POLG_JAEVJ	1771	tr|A0A0G2JN08|A0A0G2JN08_HUMAN Leukocyte immunoglobulin-like receptor subfamily B member 3 OS=Homo sapiens OX=9606 GN=LILRB3 PE=1 SV=1	447	GVSVAFVLLLFL
ETLAGGCAPMAP	sp|P32886|POLG_JAEVJ	1089	sp|O60336|MABP1_HUMAN Mitogen-activated protein kinase-binding protein 1 OS=Homo sapiens OX=9606 GN=MAPKBP1 PE=1 SV=4	1074	ETLASGAAPGAP
TFGSEVGETENN	sp|P0DOH8|POLS_JAEVJ	803	sp|Q96JB1|DYH8_HUMAN Dynein heavy chain 8, axonemal OS=Homo sapiens OX=9606 GN=DNAH8 PE=1 SV=2	801	VFGSETGEGENN
TFGSEVGETENN	sp|P0DOH8|POLS_JAEVJ	803	tr|A0A075B6F3|A0A075B6F3_HUMAN Dynein heavy chain 8, axonemal OS=Homo sapiens OX=9606 GN=DNAH8 PE=1 SV=2	1018	VFGSETGEGENN
TFGSEVGETENN	sp|P0DOH8|POLS_JAEVJ	803	tr|H0Y7V4|H0Y7V4_HUMAN Dynein heavy chain 8, axonemal OS=Homo sapiens OX=9606 GN=DNAH8 PE=1 SV=1	1018	VFGSETGEGENN
DGRATKTADPGS	sp|P32886|POLG_JAEVJ	955	sp|Q9H607|OCEL1_HUMAN Occludin/ELL domain-containing protein 1 OS=Homo sapiens OX=9606 GN=OCEL1 PE=2 SV=1	5	DGSASPTADPGS
DGRATKTADPGS	sp|P32886|POLG_JAEVJ	955	tr|M0QXM2|M0QXM2_HUMAN Occludin/ELL domain-containing protein 1 (Fragment) OS=Homo sapiens OX=9606 GN=OCEL1 PE=4 SV=1	4	DGSASPTADPGS
DGRATKTADPGS	sp|P32886|POLG_JAEVJ	955	tr|M0R0F7|M0R0F7_HUMAN Occludin/ELL domain-containing protein 1 OS=Homo sapiens OX=9606 GN=OCEL1 PE=4 SV=1	5	DGSASPTADPGS
VISFLLKSLAMA	sp|P0DOH8|POLS_JAEVJ	451	sp|Q8NGH6|O52L2_HUMAN Putative olfactory receptor 52L2 OS=Homo sapiens OX=9606 GN=OR52L2P PE=5 SV=3	6	FFSFLLKSLIMA
LAPWADTAALLV	sp|P32886|POLG_JAEVJ	616	sp|Q8N442|GUF1_HUMAN Translation factor GUF1, mitochondrial OS=Homo sapiens OX=9606 GN=GUF1 PE=2 SV=1	15	LAPRATGAALLV
LAPWADTAALLV	sp|P32886|POLG_JAEVJ	616	tr|D6RBJ0|D6RBJ0_HUMAN Translation factor GUF1, mitochondrial OS=Homo sapiens OX=9606 GN=GUF1 PE=4 SV=1	15	LAPRATGAALLV
WFPPLDPGFKKI	sp|P0DOH8|POLS_JAEVJ	65	tr|A0A0A0MRA3|A0A0A0MRA3_HUMAN Titin OS=Homo sapiens OX=9606 GN=TTN PE=1 SV=1	15271	WFPPLDDGGAKI
WFPPLDPGFKKI	sp|P0DOH8|POLS_JAEVJ	65	tr|A0A0A0MTS7|A0A0A0MTS7_HUMAN Titin OS=Homo sapiens OX=9606 GN=TTN PE=1 SV=1	24144	WFPPLDDGGAKI
WFPPLDPGFKKI	sp|P0DOH8|POLS_JAEVJ	65	sp|Q8WZ42|TITIN_HUMAN Titin OS=Homo sapiens OX=9606 GN=TTN PE=1 SV=4	22503	WFPPLDDGGAKI
VLKGYPGDLKVG	sp|P32886|POLG_JAEVJ	1646	sp|P52824|DGKQ_HUMAN Diacylglycerol kinase theta OS=Homo sapiens OX=9606 GN=DGKQ PE=1 SV=2	398	VLKIYPGWLKVG
VLKGYPGDLKVG	sp|P32886|POLG_JAEVJ	1646	tr|H0YA20|H0YA20_HUMAN Diacylglycerol kinase (Fragment) OS=Homo sapiens OX=9606 GN=DGKQ PE=1 SV=1	345	VLKIYPGWLKVG
LRAMLDSVDASV	sp|P32886|POLG_JAEVJ	690	sp|Q9BYK8|HELZ2_HUMAN Helicase with zinc finger domain 2 OS=Homo sapiens OX=9606 GN=HELZ2 PE=1 SV=6	1475	LPARLDSVDACV
VSFAGEPPRARD	sp|P32886|POLG_JAEVJ	3330	tr|K7EIL3|K7EIL3_HUMAN Intercellular adhesion molecule 5 (Fragment) OS=Homo sapiens OX=9606 GN=ICAM5 PE=1 SV=8	42	RSFAGEPPRARG
