query	query_seqname	query_start	target_seqname	target_start	target
VSFAGEPPRARD	sp|P32886|POLG_JAEVJ	3330	sp|Q9UMF0|ICAM5_HUMAN Intercellular adhesion molecule 5 OS=Homo sapiens OX=9606 GN=ICAM5 PE=1 SV=3	167	RSFAGEPPRARG
GWKPPGVGLSEG	sp|P0DOH8|POLS_JAEVJ	670	tr|B7WPH3|B7WPH3_HUMAN Cat eye syndrome critical region protein 2 OS=Homo sapiens OX=9606 GN=CECR2 PE=1 SV=2	797	EEKPPGVGTSEG
GWKPPGVGLSEG	sp|P0DOH8|POLS_JAEVJ	670	sp|Q9BXF3|CECR2_HUMAN Cat eye syndrome critical region protein 2 OS=Homo sapiens OX=9606 GN=CECR2 PE=1 SV=2	981	EEKPPGVGTSEG
GWKPPGVGLSEG	sp|P0DOH8|POLS_JAEVJ	670	tr|A0A0R4J2E1|A0A0R4J2E1_HUMAN Cat eye syndrome critical region protein 2 OS=Homo sapiens OX=9606 GN=CECR2 PE=1 SV=1	798	EEKPPGVGTSEG
GWKPPGVGLSEG	sp|P0DOH8|POLS_JAEVJ	670	tr|A0A087WT21|A0A087WT21_HUMAN Cat eye syndrome critical region protein 2 OS=Homo sapiens OX=9606 GN=CECR2 PE=1 SV=1	939	EEKPPGVGTSEG
SFAGEPPRARDD	sp|P32886|POLG_JAEVJ	3331	tr|K7EIL3|K7EIL3_HUMAN Intercellular adhesion molecule 5 (Fragment) OS=Homo sapiens OX=9606 GN=ICAM5 PE=1 SV=8	43	SFAGEPPRARGA
SFAGEPPRARDD	sp|P32886|POLG_JAEVJ	3331	sp|Q9UMF0|ICAM5_HUMAN Intercellular adhesion molecule 5 OS=Homo sapiens OX=9606 GN=ICAM5 PE=1 SV=3	168	SFAGEPPRARGA
KEVLLTFLDEVI	sp|P32886|POLG_JAEVJ	2175	tr|E5RK45|E5RK45_HUMAN 5-hydroxytryptamine receptor 4 OS=Homo sapiens OX=9606 GN=HTR4 PE=3 SV=1	19	KVVLLTFLSTVI
KEVLLTFLDEVI	sp|P32886|POLG_JAEVJ	2175	sp|Q13639|5HT4R_HUMAN 5-hydroxytryptamine receptor 4 OS=Homo sapiens OX=9606 GN=HTR4 PE=1 SV=2	19	KVVLLTFLSTVI
KGKISLVIGLGE	sp|P32886|POLG_JAEVJ	918	sp|O60774|FMO6_HUMAN Putative dimethylaniline monooxygenase [N-oxide-forming] 6 OS=Homo sapiens OX=9606 GN=FMO6P PE=5 SV=1	183	KGKRVLVIGLGN
MKIVCLSWSGQV	sp|P32886|POLG_JAEVJ	24	tr|C9JRH2|C9JRH2_HUMAN Regulator of chromosome condensation (Fragment) OS=Homo sapiens OX=9606 GN=RCC1 PE=1 SV=1	77	MHTVCLSKSGQV
MKIVCLSWSGQV	sp|P32886|POLG_JAEVJ	24	tr|C9JMJ4|C9JMJ4_HUMAN Regulator of chromosome condensation (Fragment) OS=Homo sapiens OX=9606 GN=RCC1 PE=1 SV=1	77	MHTVCLSKSGQV
MKIVCLSWSGQV	sp|P32886|POLG_JAEVJ	24	tr|C9JQZ4|C9JQZ4_HUMAN Regulator of chromosome condensation (Fragment) OS=Homo sapiens OX=9606 GN=RCC1 PE=1 SV=1	77	MHTVCLSKSGQV
MKIVCLSWSGQV	sp|P32886|POLG_JAEVJ	24	tr|C9JW69|C9JW69_HUMAN Regulator of chromosome condensation (Fragment) OS=Homo sapiens OX=9606 GN=RCC1 PE=1 SV=1	94	MHTVCLSKSGQV
MKIVCLSWSGQV	sp|P32886|POLG_JAEVJ	24	sp|P18754|RCC1_HUMAN Regulator of chromosome condensation OS=Homo sapiens OX=9606 GN=RCC1 PE=1 SV=1	77	MHTVCLSKSGQV
MKIVCLSWSGQV	sp|P32886|POLG_JAEVJ	24	tr|C9J3R0|C9J3R0_HUMAN Regulator of chromosome condensation (Fragment) OS=Homo sapiens OX=9606 GN=RCC1 PE=1 SV=9	77	MHTVCLSKSGQV
KHYIEKLGERAG	sp|P32886|POLG_JAEVJ	445	tr|E7ENT5|E7ENT5_HUMAN Zinc transporter ZIP10 (Fragment) OS=Homo sapiens OX=9606 GN=SLC39A10 PE=1 SV=1	61	KYYIEKLFERYG
KHYIEKLGERAG	sp|P32886|POLG_JAEVJ	445	tr|E7EV45|E7EV45_HUMAN Zinc transporter ZIP10 (Fragment) OS=Homo sapiens OX=9606 GN=SLC39A10 PE=1 SV=1	61	KYYIEKLFERYG
KHYIEKLGERAG	sp|P32886|POLG_JAEVJ	445	sp|Q9ULF5|S39AA_HUMAN Zinc transporter ZIP10 OS=Homo sapiens OX=9606 GN=SLC39A10 PE=1 SV=2	61	KYYIEKLFERYG
TGARWPGRIKLL	sp|P32886|POLG_JAEVJ	2132	tr|H0YJJ5|H0YJJ5_HUMAN Vesicle transport through interaction with t-SNAREs homolog 1B (Fragment) OS=Homo sapiens OX=9606 GN=VTI1B PE=1 SV=1	93	TGARHPGRPGLL
FKKIQTALDCLK	sp|P0DOH8|POLS_JAEVJ	73	tr|F2Z2U4|F2Z2U4_HUMAN Transformation/transcription domain-associated protein OS=Homo sapiens OX=9606 GN=TRRAP PE=1 SV=3	939	EKAIETALDCLK
FKKIQTALDCLK	sp|P0DOH8|POLS_JAEVJ	73	sp|Q9Y4A5|TRRAP_HUMAN Transformation/transcription domain-associated protein OS=Homo sapiens OX=9606 GN=TRRAP PE=1 SV=3	940	EKAIETALDCLK
FKKIQTALDCLK	sp|P0DOH8|POLS_JAEVJ	73	tr|H0Y4W2|H0Y4W2_HUMAN Transformation/transcription domain-associated protein OS=Homo sapiens OX=9606 GN=TRRAP PE=1 SV=2	940	EKAIETALDCLK
FGSEVGETENNT	sp|P0DOH8|POLS_JAEVJ	804	sp|Q96JB1|DYH8_HUMAN Dynein heavy chain 8, axonemal OS=Homo sapiens OX=9606 GN=DNAH8 PE=1 SV=2	802	FGSETGEGENND
FGSEVGETENNT	sp|P0DOH8|POLS_JAEVJ	804	tr|A0A075B6F3|A0A075B6F3_HUMAN Dynein heavy chain 8, axonemal OS=Homo sapiens OX=9606 GN=DNAH8 PE=1 SV=2	1019	FGSETGEGENND
FGSEVGETENNT	sp|P0DOH8|POLS_JAEVJ	804	tr|H0Y7V4|H0Y7V4_HUMAN Dynein heavy chain 8, axonemal OS=Homo sapiens OX=9606 GN=DNAH8 PE=1 SV=1	1019	FGSETGEGENND
GSPVAGISYGQP	sp|P32886|POLG_JAEVJ	809	tr|E9PIF4|E9PIF4_HUMAN Exo-alpha-sialidase OS=Homo sapiens OX=9606 GN=NEU1 PE=1 SV=1	243	GSGVSGIPYGQP
GSPVAGISYGQP	sp|P32886|POLG_JAEVJ	809	sp|Q99519|NEUR1_HUMAN Sialidase-1 OS=Homo sapiens OX=9606 GN=NEU1 PE=1 SV=1	243	GSGVSGIPYGQP
PLSTFAATSHKK	sp|P32886|POLG_JAEVJ	2593	tr|A0A0C4DGF2|A0A0C4DGF2_HUMAN Kelch-like protein 6 (Fragment) OS=Homo sapiens OX=9606 GN=KLHL6 PE=1 SV=1	446	HVSSFAATSHKK
PLSTFAATSHKK	sp|P32886|POLG_JAEVJ	2593	sp|Q8WZ60|KLHL6_HUMAN Kelch-like protein 6 OS=Homo sapiens OX=9606 GN=KLHL6 PE=1 SV=3	457	HVSSFAATSHKK
LSTFAATSHKKA	sp|P32886|POLG_JAEVJ	2594	tr|A0A0C4DGF2|A0A0C4DGF2_HUMAN Kelch-like protein 6 (Fragment) OS=Homo sapiens OX=9606 GN=KLHL6 PE=1 SV=1	447	VSSFAATSHKKK
LSTFAATSHKKA	sp|P32886|POLG_JAEVJ	2594	sp|Q8WZ60|KLHL6_HUMAN Kelch-like protein 6 OS=Homo sapiens OX=9606 GN=KLHL6 PE=1 SV=3	458	VSSFAATSHKKK
TVVSFAGEPPRA	sp|P32886|POLG_JAEVJ	3328	tr|K7EIL3|K7EIL3_HUMAN Intercellular adhesion molecule 5 (Fragment) OS=Homo sapiens OX=9606 GN=ICAM5 PE=1 SV=8	40	IRRSFAGEPPRA
TVVSFAGEPPRA	sp|P32886|POLG_JAEVJ	3328	sp|Q9UMF0|ICAM5_HUMAN Intercellular adhesion molecule 5 OS=Homo sapiens OX=9606 GN=ICAM5 PE=1 SV=3	165	IRRSFAGEPPRA
ASIRLVELYLSL	sp|P32886|POLG_JAEVJ	1232	sp|Q86SJ2|AMGO2_HUMAN Amphoterin-induced protein 2 OS=Homo sapiens OX=9606 GN=AMIGO2 PE=1 SV=1	408	ASIVLVLLYLYL
FAGEPPRARDDY	sp|P32886|POLG_JAEVJ	3332	tr|K7EIL3|K7EIL3_HUMAN Intercellular adhesion molecule 5 (Fragment) OS=Homo sapiens OX=9606 GN=ICAM5 PE=1 SV=8	44	FAGEPPRARGAV
FAGEPPRARDDY	sp|P32886|POLG_JAEVJ	3332	sp|Q9UMF0|ICAM5_HUMAN Intercellular adhesion molecule 5 OS=Homo sapiens OX=9606 GN=ICAM5 PE=1 SV=3	169	FAGEPPRARGAV
VIYDGGPCRNQP	sp|P32886|POLG_JAEVJ	3314	sp|Q5BKY1|LRC10_HUMAN Leucine-rich repeat-containing protein 10 OS=Homo sapiens OX=9606 GN=LRRC10 PE=2 SV=1	217	VIYDHNPCRNAP
ISFLLKSLAMAR	sp|P0DOH8|POLS_JAEVJ	452	sp|Q8NGH6|O52L2_HUMAN Putative olfactory receptor 52L2 OS=Homo sapiens OX=9606 GN=OR52L2P PE=5 SV=3	7	FSFLLKSLIMAL
AAEVEAGKIGFE	sp|P0DOH8|POLS_JAEVJ	918	tr|F8WBW8|F8WBW8_HUMAN BAH and coiled-coil domain-containing protein 1 OS=Homo sapiens OX=9606 GN=BAHCC1 PE=1 SV=2	552	AAEVEQGGIGAE
AAEVEAGKIGFE	sp|P0DOH8|POLS_JAEVJ	918	sp|Q9P281|BAHC1_HUMAN BAH and coiled-coil domain-containing protein 1 OS=Homo sapiens OX=9606 GN=BAHCC1 PE=1 SV=4	552	AAEVEQGGIGAE
KSATKAKEELAV	sp|P32886|POLG_JAEVJ	2061	sp|Q7L099|RUFY3_HUMAN Protein RUFY3 OS=Homo sapiens OX=9606 GN=RUFY3 PE=1 SV=1	290	KSNTKLTEELAV
