query	query_seqname	query_start	target_seqname	target_start	target
SKHLLSANKRTE	sp|Q6SW81|NEC2_HCMVM	248	sp|O00370|LORF2_HUMAN LINE-1 retrotransposable element ORF2 protein OS=Homo sapiens OX=9606 PE=1 SV=1	210	SKALLSKCKRTE
RSSLSFHYCERT	sp|F7V995|RL8A_HCMVM	7	sp|C9JN71|ZN878_HUMAN Zinc finger protein 878 OS=Homo sapiens OX=9606 GN=ZNF878 PE=3 SV=2	377	TSSNSFHYHERT
SPSCLWRGSTPV	sp|Q6SWA3|UL298_HCMVM	672	tr|C9K0C0|C9K0C0_HUMAN Protein FAM71F2 OS=Homo sapiens OX=9606 GN=FAM71F2 PE=4 SV=3	135	SPSCCWRLSRPV
WLERSLMDIDSL	sp|F5HFB4|UL18_HCMVM	128	sp|P48775|T23O_HUMAN Tryptophan 2,3-dioxygenase OS=Homo sapiens OX=9606 GN=TDO2 PE=1 SV=1	309	QLLTSLMDIDSL
ATRNKLVGACLV	sp|F7V998|U150A_HCMVM	22	tr|A0A0D9SFP6|A0A0D9SFP6_HUMAN Tyrosine-protein kinase receptor OS=Homo sapiens OX=9606 GN=NTRK3 PE=1 SV=1	681	ATRNCLVGANLL
ATRNKLVGACLV	sp|F7V998|U150A_HCMVM	22	sp|Q16288|NTRK3_HUMAN NT-3 growth factor receptor OS=Homo sapiens OX=9606 GN=NTRK3 PE=1 SV=2	681	ATRNCLVGANLL
ATRNKLVGACLV	sp|F7V998|U150A_HCMVM	22	tr|H0YM90|H0YM90_HUMAN Tyrosine-protein kinase receptor OS=Homo sapiens OX=9606 GN=NTRK3 PE=1 SV=1	673	ATRNCLVGANLL
ATRNKLVGACLV	sp|F7V998|U150A_HCMVM	22	tr|B7Z7U4|B7Z7U4_HUMAN Tyrosine-protein kinase receptor OS=Homo sapiens OX=9606 GN=NTRK3 PE=1 SV=1	583	ATRNCLVGANLL
ATRNKLVGACLV	sp|F7V998|U150A_HCMVM	22	tr|R4GMR8|R4GMR8_HUMAN Receptor protein-tyrosine kinase (Fragment) OS=Homo sapiens OX=9606 GN=NTRK3 PE=1 SV=1	78	ATRNCLVGANLL
ATRNKLVGACLV	sp|F7V998|U150A_HCMVM	22	tr|A0A6Q8PHG5|A0A6Q8PHG5_HUMAN Tyrosine-protein kinase receptor OS=Homo sapiens OX=9606 GN=NTRK1 PE=1 SV=1	592	ATRNCLVGQGLV
ATRNKLVGACLV	sp|F7V998|U150A_HCMVM	22	tr|J3KP20|J3KP20_HUMAN Tyrosine-protein kinase receptor OS=Homo sapiens OX=9606 GN=NTRK1 PE=1 SV=1	649	ATRNCLVGQGLV
ATRNKLVGACLV	sp|F7V998|U150A_HCMVM	22	sp|P04629|NTRK1_HUMAN High affinity nerve growth factor receptor OS=Homo sapiens OX=9606 GN=NTRK1 PE=1 SV=4	652	ATRNCLVGQGLV
ARLPVVPVSGNE	sp|Q6SW77|DPOL_HCMVM	919	tr|A8MT87|A8MT87_HUMAN Phenylethanolamine N-methyltransferase OS=Homo sapiens OX=9606 GN=PNMT PE=1 SV=1	129	ARLTVVPVSEEE
ARLPVVPVSGNE	sp|Q6SW77|DPOL_HCMVM	919	sp|P11086|PNMT_HUMAN Phenylethanolamine N-methyltransferase OS=Homo sapiens OX=9606 GN=PNMT PE=1 SV=1	227	ARLTVVPVSEEE
TFSLLPRILVAL	sp|Q6SW84|LTP_HCMVM	1264	tr|C9J786|C9J786_HUMAN Transmembrane protein 14B OS=Homo sapiens OX=9606 GN=TMEM14B PE=3 SV=1	76	EFSLLPRILYAF
TFSLLPRILVAL	sp|Q6SW84|LTP_HCMVM	1264	tr|B4DFL6|B4DFL6_HUMAN Transmembrane protein 14B OS=Homo sapiens OX=9606 GN=TMEM14B PE=1 SV=1	110	EFSLLPRILYAF
SYRDSESEALFA	sp|F5HHT6|US21_HCMVM	148	sp|Q6V0I7|FAT4_HUMAN Protocadherin Fat 4 OS=Homo sapiens OX=9606 GN=FAT4 PE=1 SV=2	71	TYRLSESHALFA
SYRDSESEALFA	sp|F5HHT6|US21_HCMVM	148	tr|A0A6Q8JR05|A0A6Q8JR05_HUMAN Protocadherin Fat 4 OS=Homo sapiens OX=9606 GN=FAT4 PE=1 SV=1	71	TYRLSESHALFA
QLLLRHALRYLG	sp|F5HFJ7|US10_HCMVM	48	tr|A8MWV3|A8MWV3_HUMAN Osteoclast-associated immunoglobulin-like receptor OS=Homo sapiens OX=9606 GN=OSCAR PE=4 SV=2	136	QLLLSHALRALR
QLLLRHALRYLG	sp|F5HFJ7|US10_HCMVM	48	tr|A0A0G2JNK2|A0A0G2JNK2_HUMAN Osteoclast-associated immunoglobulin-like receptor OS=Homo sapiens OX=9606 GN=OSCAR PE=4 SV=1	136	QLLLSHALRALR
FSQLMRLDTILP	sp|F5HIN9|TRX2_HCMVM	200	sp|O43897|TLL1_HUMAN Tolloid-like protein 1 OS=Homo sapiens OX=9606 GN=TLL1 PE=1 SV=1	304	FSRGMFLDTILP
FSQLMRLDTILP	sp|F5HIN9|TRX2_HCMVM	200	tr|E9PD25|E9PD25_HUMAN Metalloendopeptidase OS=Homo sapiens OX=9606 GN=TLL1 PE=1 SV=1	304	FSRGMFLDTILP
ALMRVLELERSL	sp|F5HC79|TRM1_HCMVM	318	sp|Q8IZJ1|UNC5B_HUMAN Netrin receptor UNC5B OS=Homo sapiens OX=9606 GN=UNC5B PE=1 SV=2	723	ALKEVLELERTL
VDGQDLVLSQRT	sp|F5H8R6|UL96_HCMVM	57	tr|A0A096LPG1|A0A096LPG1_HUMAN Hemicentin-2 (Fragment) OS=Homo sapiens OX=9606 GN=HMCN2 PE=1 SV=1	109	KDGQPLVLAQRT
VDGQDLVLSQRT	sp|F5H8R6|UL96_HCMVM	57	sp|Q8NDA2|HMCN2_HUMAN Hemicentin-2 OS=Homo sapiens OX=9606 GN=HMCN2 PE=2 SV=3	3076	KDGQPLVLAQRT
TLAYDCGIEEFD	sp|F5H991|US26_HCMVM	497	tr|A0A590UJV4|A0A590UJV4_HUMAN Voltage-gated potassium channel subunit beta-2 OS=Homo sapiens OX=9606 GN=KCNAB2 PE=1 SV=1	60	TLAYDNGINLFD
TLAYDCGIEEFD	sp|F5H991|US26_HCMVM	497	tr|K7EKU4|K7EKU4_HUMAN Voltage-gated potassium channel subunit beta-2 OS=Homo sapiens OX=9606 GN=KCNAB2 PE=1 SV=2	60	TLAYDNGINLFD
TLAYDCGIEEFD	sp|F5H991|US26_HCMVM	497	tr|K7EIR5|K7EIR5_HUMAN Voltage-gated potassium channel subunit beta-2 OS=Homo sapiens OX=9606 GN=KCNAB2 PE=1 SV=2	74	TLAYDNGINLFD
TLAYDCGIEEFD	sp|F5H991|US26_HCMVM	497	tr|A0A590UJU1|A0A590UJU1_HUMAN Voltage-gated potassium channel subunit beta-2 (Fragment) OS=Homo sapiens OX=9606 GN=KCNAB2 PE=1 SV=1	74	TLAYDNGINLFD
TLAYDCGIEEFD	sp|F5H991|US26_HCMVM	497	tr|A0A590UK89|A0A590UK89_HUMAN Voltage-gated potassium channel subunit beta-2 OS=Homo sapiens OX=9606 GN=KCNAB2 PE=1 SV=1	60	TLAYDNGINLFD
TLAYDCGIEEFD	sp|F5H991|US26_HCMVM	497	tr|A0A590UJU4|A0A590UJU4_HUMAN Voltage-gated potassium channel subunit beta-2 OS=Homo sapiens OX=9606 GN=KCNAB2 PE=1 SV=1	74	TLAYDNGINLFD
TLAYDCGIEEFD	sp|F5H991|US26_HCMVM	497	tr|A0A590UJB8|A0A590UJB8_HUMAN Voltage-gated potassium channel subunit beta-2 (Fragment) OS=Homo sapiens OX=9606 GN=KCNAB2 PE=1 SV=1	7	TLAYDNGINLFD
TLAYDCGIEEFD	sp|F5H991|US26_HCMVM	497	tr|A0A590UJY1|A0A590UJY1_HUMAN Voltage-gated potassium channel subunit beta-2 (Fragment) OS=Homo sapiens OX=9606 GN=KCNAB2 PE=1 SV=1	74	TLAYDNGINLFD
TLAYDCGIEEFD	sp|F5H991|US26_HCMVM	497	tr|Q5TG84|Q5TG84_HUMAN Voltage-gated potassium channel subunit beta-2 (Fragment) OS=Homo sapiens OX=9606 GN=KCNAB2 PE=1 SV=2	74	TLAYDNGINLFD
TLAYDCGIEEFD	sp|F5H991|US26_HCMVM	497	tr|Q5TG81|Q5TG81_HUMAN Voltage-gated potassium channel subunit beta-2 (Fragment) OS=Homo sapiens OX=9606 GN=KCNAB2 PE=1 SV=2	7	TLAYDNGINLFD
TLAYDCGIEEFD	sp|F5H991|US26_HCMVM	497	tr|A0A590UJJ4|A0A590UJJ4_HUMAN K(+) channel subunit beta-2 OS=Homo sapiens OX=9606 GN=KCNAB2 PE=1 SV=1	60	TLAYDNGINLFD
TLAYDCGIEEFD	sp|F5H991|US26_HCMVM	497	sp|Q13303|KCAB2_HUMAN Voltage-gated potassium channel subunit beta-2 OS=Homo sapiens OX=9606 GN=KCNAB2 PE=1 SV=2	74	TLAYDNGINLFD
TLAYDCGIEEFD	sp|F5H991|US26_HCMVM	497	tr|A0A590UJB6|A0A590UJB6_HUMAN K(+) channel subunit beta-2 OS=Homo sapiens OX=9606 GN=KCNAB2 PE=1 SV=1	105	TLAYDNGINLFD
TLAYDCGIEEFD	sp|F5H991|US26_HCMVM	497	tr|A0A5F9UN28|A0A5F9UN28_HUMAN K(+) channel subunit beta-2 OS=Homo sapiens OX=9606 GN=KCNAB2 PE=1 SV=1	74	TLAYDNGINLFD
TLAYDCGIEEFD	sp|F5H991|US26_HCMVM	497	tr|Q5TG78|Q5TG78_HUMAN Voltage-gated potassium channel subunit beta-2 (Fragment) OS=Homo sapiens OX=9606 GN=KCNAB2 PE=1 SV=9	74	TLAYDNGINLFD
TLAYDCGIEEFD	sp|F5H991|US26_HCMVM	497	tr|A0A590UJX9|A0A590UJX9_HUMAN Voltage-gated potassium channel subunit beta-2 OS=Homo sapiens OX=9606 GN=KCNAB2 PE=1 SV=1	60	TLAYDNGINLFD
HRTVALMILEAY	sp|Q6SW67|GH_HCMVM	580	sp|Q9HCE0|EPG5_HUMAN Ectopic P granules protein 5 homolog OS=Homo sapiens OX=9606 GN=EPG5 PE=1 SV=2	916	HAEVALMVLEAY
HVLLFSFLVVSP	sp|F5HIG1|HEPA_HCMVM	751	sp|P25189|MYP0_HUMAN Myelin protein P0 OS=Homo sapiens OX=9606 GN=MPZ PE=1 SV=1	15	AVLLFSSLVLSP
HVLLFSFLVVSP	sp|F5HIG1|HEPA_HCMVM	751	tr|A0A5F9ZI26|A0A5F9ZI26_HUMAN Myelin peripheral protein OS=Homo sapiens OX=9606 GN=MPZ PE=1 SV=1	15	AVLLFSSLVLSP
HVLLFSFLVVSP	sp|F5HIG1|HEPA_HCMVM	751	tr|A0A0J9YWT2|A0A0J9YWT2_HUMAN Myelin protein P0 OS=Homo sapiens OX=9606 GN=MPZ PE=1 SV=2	15	AVLLFSSLVLSP
LRARSPEEGLRD	sp|F5HCH8|GL_HCMVM	231	sp|Q96S19|MTL26_HUMAN Methyltransferase-like 26 OS=Homo sapiens OX=9606 GN=METTL26 PE=1 SV=2	160	LRCRNPEWGLRD
LRARSPEEGLRD	sp|F5HCH8|GL_HCMVM	231	tr|A0A087WYU2|A0A087WYU2_HUMAN Methyltransferase-like 26 OS=Homo sapiens OX=9606 GN=METTL26 PE=1 SV=1	140	LRCRNPEWGLRD
LRARSPEEGLRD	sp|F5HCH8|GL_HCMVM	231	tr|K7ELW3|K7ELW3_HUMAN Epidermal growth factor receptor kinase substrate 8-like protein 1 OS=Homo sapiens OX=9606 GN=EPS8L1 PE=1 SV=1	358	LRAVSPEEGARV
LRARSPEEGLRD	sp|F5HCH8|GL_HCMVM	231	tr|B4DKV7|B4DKV7_HUMAN Epidermal growth factor receptor kinase substrate 8-like protein 1 OS=Homo sapiens OX=9606 GN=EPS8L1 PE=1 SV=1	608	LRAVSPEEGARV
LRARSPEEGLRD	sp|F5HCH8|GL_HCMVM	231	sp|Q8TE68|ES8L1_HUMAN Epidermal growth factor receptor kinase substrate 8-like protein 1 OS=Homo sapiens OX=9606 GN=EPS8L1 PE=1 SV=3	672	LRAVSPEEGARV
TWALGLGESLVC	sp|F5HF35|UL136_HCMVM	204	sp|P78559|MAP1A_HUMAN Microtubule-associated protein 1A OS=Homo sapiens OX=9606 GN=MAP1A PE=1 SV=6	1618	TKALGLEESLVQ
TWALGLGESLVC	sp|F5HF35|UL136_HCMVM	204	tr|E9PGC8|E9PGC8_HUMAN Microtubule-associated protein 1A OS=Homo sapiens OX=9606 GN=MAP1A PE=1 SV=1	1856	TKALGLEESLVQ
RLKFASSGLACQ	sp|Q6SW59|PP65_HCMVM	104	sp|Q96PV7|F193B_HUMAN Protein FAM193B OS=Homo sapiens OX=9606 GN=FAM193B PE=1 SV=3	365	GHKFAHSGLACQ
RLKFASSGLACQ	sp|Q6SW59|PP65_HCMVM	104	tr|H0Y9W8|H0Y9W8_HUMAN Protein FAM193B (Fragment) OS=Homo sapiens OX=9606 GN=FAM193B PE=1 SV=1	18	GHKFAHSGLACQ
PAGAECTLDRLL	sp|Q6SW63|UL79_HCMVM	261	tr|H3BUX9|H3BUX9_HUMAN Vacuolar fusion protein MON1 homolog (Fragment) OS=Homo sapiens OX=9606 GN=MON1B PE=1 SV=1	222	LAGSERTLDRLL
PAGAECTLDRLL	sp|Q6SW63|UL79_HCMVM	261	sp|Q7L1V2|MON1B_HUMAN Vacuolar fusion protein MON1 homolog B OS=Homo sapiens OX=9606 GN=MON1B PE=1 SV=1	222	LAGSERTLDRLL
PAGAECTLDRLL	sp|Q6SW63|UL79_HCMVM	261	tr|E7EW32|E7EW32_HUMAN Vacuolar fusion protein MON1 homolog OS=Homo sapiens OX=9606 GN=MON1B PE=1 SV=1	113	LAGSERTLDRLL
QEPGGVRKVPLT	sp|Q6SW84|LTP_HCMVM	1127	sp|P11831|SRF_HUMAN Serum response factor OS=Homo sapiens OX=9606 GN=SRF PE=1 SV=1	449	QEPGGVPQVFLT
FRRRHSPEQPQL	sp|Q6SW84|LTP_HCMVM	152	sp|Q86V86|PIM3_HUMAN Serine/threonine-protein kinase pim-3 OS=Homo sapiens OX=9606 GN=PIM3 PE=1 SV=3	258	FRRRVSPECQQL
SPLLNLSRTAPS	sp|F5HCH8|GL_HCMVM	75	sp|O95222|OR6A2_HUMAN Olfactory receptor 6A2 OS=Homo sapiens OX=9606 GN=OR6A2 PE=2 SV=2	187	SPLLNLSCTDMS
SKSQVRDYLEGT	sp|F7V998|U150A_HCMVM	73	sp|Q9HAQ2|KIF9_HUMAN Kinesin-like protein KIF9 OS=Homo sapiens OX=9606 GN=KIF9 PE=1 SV=4	395	INSQVRRYLEGT
GLVTVPLLLAPL	sp|Q6SVX2|TRS1_HCMVM	451	tr|F5GWJ4|F5GWJ4_HUMAN Tumor necrosis factor receptor superfamily member 1A OS=Homo sapiens OX=9606 GN=TNFRSF1A PE=4 SV=1	2	GLSTVPDLLLPL
GLVTVPLLLAPL	sp|Q6SVX2|TRS1_HCMVM	451	tr|F5H061|F5H061_HUMAN Tumor necrosis factor receptor superfamily member 1A OS=Homo sapiens OX=9606 GN=TNFRSF1A PE=1 SV=1	2	GLSTVPDLLLPL
GLVTVPLLLAPL	sp|Q6SVX2|TRS1_HCMVM	451	tr|F5H7N1|F5H7N1_HUMAN Tumor necrosis factor receptor superfamily member 1A OS=Homo sapiens OX=9606 GN=TNFRSF1A PE=1 SV=1	2	GLSTVPDLLLPL
GLVTVPLLLAPL	sp|Q6SVX2|TRS1_HCMVM	451	tr|F5H6Z2|F5H6Z2_HUMAN Tumor necrosis factor receptor superfamily member 1A (Fragment) OS=Homo sapiens OX=9606 GN=TNFRSF1A PE=1 SV=1	2	GLSTVPDLLLPL
GLVTVPLLLAPL	sp|Q6SVX2|TRS1_HCMVM	451	tr|F5H4T5|F5H4T5_HUMAN Tumor necrosis factor receptor superfamily member 1A OS=Homo sapiens OX=9606 GN=TNFRSF1A PE=1 SV=1	2	GLSTVPDLLLPL
GLVTVPLLLAPL	sp|Q6SVX2|TRS1_HCMVM	451	tr|F5H6V7|F5H6V7_HUMAN Tumor necrosis factor receptor superfamily member 1A (Fragment) OS=Homo sapiens OX=9606 GN=TNFRSF1A PE=1 SV=1	2	GLSTVPDLLLPL
GLVTVPLLLAPL	sp|Q6SVX2|TRS1_HCMVM	451	tr|F5H8A6|F5H8A6_HUMAN Tumor necrosis factor receptor superfamily member 1A (Fragment) OS=Homo sapiens OX=9606 GN=TNFRSF1A PE=1 SV=1	2	GLSTVPDLLLPL
GLVTVPLLLAPL	sp|Q6SVX2|TRS1_HCMVM	451	sp|P19438|TNR1A_HUMAN Tumor necrosis factor receptor superfamily member 1A OS=Homo sapiens OX=9606 GN=TNFRSF1A PE=1 SV=1	2	GLSTVPDLLLPL
ELGPGLQRALAQ	sp|Q6SW81|NEC2_HCMVM	312	tr|H7C215|H7C215_HUMAN Reticulon-4 receptor (Fragment) OS=Homo sapiens OX=9606 GN=RTN4R PE=1 SV=1	230	ELGPGLFRGLAA
ELGPGLQRALAQ	sp|Q6SW81|NEC2_HCMVM	312	sp|Q9BZR6|RTN4R_HUMAN Reticulon-4 receptor OS=Homo sapiens OX=9606 GN=RTN4R PE=1 SV=1	144	ELGPGLFRGLAA
ELGPGLQRALAQ	sp|Q6SW81|NEC2_HCMVM	312	tr|H7C0V4|H7C0V4_HUMAN Reticulon-4 receptor (Fragment) OS=Homo sapiens OX=9606 GN=RTN4R PE=1 SV=1	164	ELGPGLFRGLAA
AVAVPPRDSRMT	sp|F5HG98|UL38_HCMVM	216	tr|A0A0G2JL52|A0A0G2JL52_HUMAN Valyl-tRNA synthetase OS=Homo sapiens OX=9606 GN=VARS2 PE=1 SV=1	377	AVAVHPDDSRYT
AVAVPPRDSRMT	sp|F5HG98|UL38_HCMVM	216	tr|B4E0K6|B4E0K6_HUMAN Valyl-tRNA synthetase OS=Homo sapiens OX=9606 GN=VARS2 PE=1 SV=1	347	AVAVHPDDSRYT
AVAVPPRDSRMT	sp|F5HG98|UL38_HCMVM	216	tr|A0A0G2JIA5|A0A0G2JIA5_HUMAN Valyl-tRNA synthetase OS=Homo sapiens OX=9606 GN=VARS2 PE=1 SV=1	347	AVAVHPDDSRYT
AVAVPPRDSRMT	sp|F5HG98|UL38_HCMVM	216	tr|A0A140TA36|A0A140TA36_HUMAN Valyl-tRNA synthetase OS=Homo sapiens OX=9606 GN=VARS2 PE=1 SV=1	377	AVAVHPDDSRYT
AVAVPPRDSRMT	sp|F5HG98|UL38_HCMVM	216	tr|A0A140TA35|A0A140TA35_HUMAN Valyl-tRNA synthetase OS=Homo sapiens OX=9606 GN=VARS2 PE=1 SV=1	377	AVAVHPDDSRYT
AVAVPPRDSRMT	sp|F5HG98|UL38_HCMVM	216	tr|A0A140T8Y0|A0A140T8Y0_HUMAN Valyl-tRNA synthetase OS=Homo sapiens OX=9606 GN=VARS2 PE=1 SV=1	347	AVAVHPDDSRYT
AVAVPPRDSRMT	sp|F5HG98|UL38_HCMVM	216	sp|Q5ST30|SYVM_HUMAN Valine--tRNA ligase, mitochondrial OS=Homo sapiens OX=9606 GN=VARS2 PE=1 SV=2	347	AVAVHPDDSRYT
AVAVPPRDSRMT	sp|F5HG98|UL38_HCMVM	216	tr|B7ZL25|B7ZL25_HUMAN Valyl-tRNA synthetase OS=Homo sapiens OX=9606 GN=VARS2 PE=1 SV=1	347	AVAVHPDDSRYT
AVAVPPRDSRMT	sp|F5HG98|UL38_HCMVM	216	tr|A0A140TA45|A0A140TA45_HUMAN Valyl-tRNA synthetase OS=Homo sapiens OX=9606 GN=VARS2 PE=1 SV=1	347	AVAVHPDDSRYT
AVAVPPRDSRMT	sp|F5HG98|UL38_HCMVM	216	tr|A0A140TA40|A0A140TA40_HUMAN Valyl-tRNA synthetase OS=Homo sapiens OX=9606 GN=VARS2 PE=1 SV=1	347	AVAVHPDDSRYT
AVAVPPRDSRMT	sp|F5HG98|UL38_HCMVM	216	tr|A0A0A0MTG1|A0A0A0MTG1_HUMAN Valyl-tRNA synthetase OS=Homo sapiens OX=9606 GN=VARS2 PE=1 SV=1	347	AVAVHPDDSRYT
TYLRNAAVADTL	sp|Q6SVX2|TRS1_HCMVM	267	tr|J3KTN5|J3KTN5_HUMAN C-C chemokine receptor type 7 (Fragment) OS=Homo sapiens OX=9606 GN=CCR7 PE=1 SV=1	32	TYLLNLAVADIL
TYLRNAAVADTL	sp|Q6SVX2|TRS1_HCMVM	267	tr|J3KSS9|J3KSS9_HUMAN C-C chemokine receptor type 7 OS=Homo sapiens OX=9606 GN=CCR7 PE=1 SV=1	89	TYLLNLAVADIL
TYLRNAAVADTL	sp|Q6SVX2|TRS1_HCMVM	267	sp|P32248|CCR7_HUMAN C-C chemokine receptor type 7 OS=Homo sapiens OX=9606 GN=CCR7 PE=1 SV=2	95	TYLLNLAVADIL
NLHSISYPVVTS	sp|F5HGU6|UL132_HCMVM	199	tr|Q5T3Q7|Q5T3Q7_HUMAN HEAT repeat-containing protein 1 OS=Homo sapiens OX=9606 GN=HEATR1 PE=1 SV=1	911	QLASISSPVVTS
NLHSISYPVVTS	sp|F5HGU6|UL132_HCMVM	199	sp|Q9H583|HEAT1_HUMAN HEAT repeat-containing protein 1 OS=Homo sapiens OX=9606 GN=HEATR1 PE=1 SV=3	911	QLASISSPVVTS
ASLGAWVGAVLH	sp|Q6SW04|IRS1_HCMVM	9	sp|Q96M86|DNHD1_HUMAN Dynein heavy chain domain-containing protein 1 OS=Homo sapiens OX=9606 GN=DNHD1 PE=2 SV=2	3324	ASLAAWLWAVLH
AQRLLLAPVERE	sp|F5HI87|CEP3_HCMVM	179	tr|E7EUJ0|E7EUJ0_HUMAN Deoxyribonuclease-1-like 1 (Fragment) OS=Homo sapiens OX=9606 GN=DNASE1L1 PE=1 SV=1	26	AQRLTLAKVARE
AQRLLLAPVERE	sp|F5HI87|CEP3_HCMVM	179	tr|E7ESG1|E7ESG1_HUMAN Deoxyribonuclease-1-like 1 (Fragment) OS=Homo sapiens OX=9606 GN=DNASE1L1 PE=1 SV=1	26	AQRLTLAKVARE
AQRLLLAPVERE	sp|F5HI87|CEP3_HCMVM	179	tr|Q5HY40|Q5HY40_HUMAN Deoxyribonuclease-1-like 1 (Fragment) OS=Homo sapiens OX=9606 GN=DNASE1L1 PE=1 SV=8	26	AQRLTLAKVARE
AQRLLLAPVERE	sp|F5HI87|CEP3_HCMVM	179	tr|A6QRJ0|A6QRJ0_HUMAN Deoxyribonuclease-1-like 1 (Fragment) OS=Homo sapiens OX=9606 GN=DNASE1L1 PE=1 SV=1	26	AQRLTLAKVARE
AQRLLLAPVERE	sp|F5HI87|CEP3_HCMVM	179	sp|P49184|DNSL1_HUMAN Deoxyribonuclease-1-like 1 OS=Homo sapiens OX=9606 GN=DNASE1L1 PE=1 SV=1	26	AQRLTLAKVARE
PAAPPDAAAVRK	sp|Q6SW62|SCAF_HCMVM	235	sp|Q96SC8|DMTA2_HUMAN Doublesex- and mab-3-related transcription factor A2 OS=Homo sapiens OX=9606 GN=DMRTA2 PE=2 SV=2	364	PAAPPDKAAVGA
RTGPEGTLWDTS	sp|F5HB40|UL84_HCMVM	337	sp|Q13480|GAB1_HUMAN GRB2-associated-binding protein 1 OS=Homo sapiens OX=9606 GN=GAB1 PE=1 SV=2	321	RTFPEGTLGQTS
RTGPEGTLWDTS	sp|F5HB40|UL84_HCMVM	337	tr|B7Z3B9|B7Z3B9_HUMAN GRB2-associated-binding protein 1 OS=Homo sapiens OX=9606 GN=GAB1 PE=1 SV=1	218	RTFPEGTLGQTS
RILRLQPADISV	sp|F5HEN8|HELI_HCMVM	679	tr|A0A0A0MRI8|A0A0A0MRI8_HUMAN Obscurin (Fragment) OS=Homo sapiens OX=9606 GN=OBSCN PE=1 SV=1	374	RILRLMPADAGV
RILRLQPADISV	sp|F5HEN8|HELI_HCMVM	679	tr|A0A590UJ10|A0A590UJ10_HUMAN Obscurin OS=Homo sapiens OX=9606 GN=OBSCN PE=1 SV=1	2526	RILRLMPADAGV
RILRLQPADISV	sp|F5HEN8|HELI_HCMVM	679	tr|A6NGQ3|A6NGQ3_HUMAN Non-specific serine/threonine protein kinase OS=Homo sapiens OX=9606 GN=OBSCN PE=1 SV=5	2955	RILRLMPADAGV
RILRLQPADISV	sp|F5HEN8|HELI_HCMVM	679	sp|Q5VST9|OBSCN_HUMAN Obscurin OS=Homo sapiens OX=9606 GN=OBSCN PE=1 SV=3	2526	RILRLMPADAGV
PQLLSRQSLLDN	sp|F5HB40|UL84_HCMVM	261	sp|Q9NR99|MXRA5_HUMAN Matrix-remodeling-associated protein 5 OS=Homo sapiens OX=9606 GN=MXRA5 PE=1 SV=3	2682	PQTLGRVSLLDN
LVAAALAAVASL	sp|F7V998|U150A_HCMVM	32	sp|P52790|HXK3_HUMAN Hexokinase-3 OS=Homo sapiens OX=9606 GN=HK3 PE=1 SV=2	398	LCAAALAAVLSC
LVAAALAAVASL	sp|F7V998|U150A_HCMVM	32	sp|Q96SC8|DMTA2_HUMAN Doublesex- and mab-3-related transcription factor A2 OS=Homo sapiens OX=9606 GN=DMRTA2 PE=2 SV=2	31	SVAAAAAAAASL
TDLLVLVPAGGV	sp|Q6SVX2|TRS1_HCMVM	297	sp|Q96KA5|CLP1L_HUMAN Cleft lip and palate transmembrane protein 1-like protein OS=Homo sapiens OX=9606 GN=CLPTM1L PE=1 SV=1	345	TSLLVLVPAGVG
ELATMNVSRGPA	sp|Q6SWC3|UL07_HCMVM	28	sp|Q16186|ADRM1_HUMAN Proteasomal ubiquitin receptor ADRM1 OS=Homo sapiens OX=9606 GN=ADRM1 PE=1 SV=2	270	ILATMNVPAGPA
ELATMNVSRGPA	sp|Q6SWC3|UL07_HCMVM	28	tr|A0A087WX59|A0A087WX59_HUMAN Proteasomal ubiquitin receptor ADRM1 OS=Homo sapiens OX=9606 GN=ADRM1 PE=1 SV=1	231	ILATMNVPAGPA
GVLKRRKEVLSV	sp|F5HBR4|PORTL_HCMVM	113	tr|B3KTY4|B3KTY4_HUMAN SLIT and NTRK-like family, member 2, isoform CRA_b (Fragment) OS=Homo sapiens OX=9606 GN=SLITRK2 PE=1 SV=1	642	FVLKRRKGVPSV
GVLKRRKEVLSV	sp|F5HBR4|PORTL_HCMVM	113	sp|Q9H156|SLIK2_HUMAN SLIT and NTRK-like protein 2 OS=Homo sapiens OX=9606 GN=SLITRK2 PE=1 SV=1	642	FVLKRRKGVPSV
PWHGAGSGAGLS	sp|Q6SW37|EP84_HCMVM	292	sp|O95936|EOMES_HUMAN Eomesodermin homolog OS=Homo sapiens OX=9606 GN=EOMES PE=1 SV=3	210	PGAGAGSGAGGS
SSSPGATSTSSA	sp|Q6SW14|UL139_HCMVM	17	sp|Q9UI36|DACH1_HUMAN Dachshund homolog 1 OS=Homo sapiens OX=9606 GN=DACH1 PE=1 SV=4	25	SSSGTTTSTSSA
SSSPGATSTSSA	sp|Q6SW14|UL139_HCMVM	17	tr|A0A590UJ53|A0A590UJ53_HUMAN KAT8 regulatory NSL complex subunit 3 OS=Homo sapiens OX=9606 GN=KANSL3 PE=1 SV=1	739	SSLPGATSASSL
SSSPGATSTSSA	sp|Q6SW14|UL139_HCMVM	17	sp|Q9P2N6|KANL3_HUMAN KAT8 regulatory NSL complex subunit 3 OS=Homo sapiens OX=9606 GN=KANSL3 PE=1 SV=2	739	SSLPGATSASSL
VAVVAATVRFSA	sp|Q6SW50|CVC1_HCMVM	352	sp|P46597|ASMT_HUMAN Acetylserotonin O-methyltransferase OS=Homo sapiens OX=9606 GN=ASMT PE=1 SV=1	46	VAAVAAGVRASA
PAGTPDQSSSSL	sp|F5HAQ7|UL135_HCMVM	116	sp|Q9NPC8|SIX2_HUMAN Homeobox protein SIX2 OS=Homo sapiens OX=9606 GN=SIX2 PE=1 SV=1	218	PSGTPDHSSSSP
SPDSVGPLPGAR	sp|Q6SW04|IRS1_HCMVM	138	sp|Q96A47|ISL2_HUMAN Insulin gene enhancer protein ISL-2 OS=Homo sapiens OX=9606 GN=ISL2 PE=1 SV=1	154	SPRSPGPLPGAR
SLGELHVPQPAE	sp|Q6SW67|GH_HCMVM	278	tr|A0A0G2JIA5|A0A0G2JIA5_HUMAN Valyl-tRNA synthetase OS=Homo sapiens OX=9606 GN=VARS2 PE=1 SV=1	759	ALGEKFVPQPAE
SLGELHVPQPAE	sp|Q6SW67|GH_HCMVM	278	tr|A0A140TA36|A0A140TA36_HUMAN Valyl-tRNA synthetase OS=Homo sapiens OX=9606 GN=VARS2 PE=1 SV=1	789	ALGEKFVPQPAE
SLGELHVPQPAE	sp|Q6SW67|GH_HCMVM	278	tr|A0A140TA45|A0A140TA45_HUMAN Valyl-tRNA synthetase OS=Homo sapiens OX=9606 GN=VARS2 PE=1 SV=1	757	ALGEKFVPQPAE
SLGELHVPQPAE	sp|Q6SW67|GH_HCMVM	278	tr|A0A140TA35|A0A140TA35_HUMAN Valyl-tRNA synthetase OS=Homo sapiens OX=9606 GN=VARS2 PE=1 SV=1	789	ALGEKFVPQPAE
SLGELHVPQPAE	sp|Q6SW67|GH_HCMVM	278	tr|A0A140TA40|A0A140TA40_HUMAN Valyl-tRNA synthetase OS=Homo sapiens OX=9606 GN=VARS2 PE=1 SV=1	757	ALGEKFVPQPAE
SLGELHVPQPAE	sp|Q6SW67|GH_HCMVM	278	tr|A0A140T8Y0|A0A140T8Y0_HUMAN Valyl-tRNA synthetase OS=Homo sapiens OX=9606 GN=VARS2 PE=1 SV=1	759	ALGEKFVPQPAE
SLGELHVPQPAE	sp|Q6SW67|GH_HCMVM	278	tr|A0A0A0MTG1|A0A0A0MTG1_HUMAN Valyl-tRNA synthetase OS=Homo sapiens OX=9606 GN=VARS2 PE=1 SV=1	757	ALGEKFVPQPAE
SLGELHVPQPAE	sp|Q6SW67|GH_HCMVM	278	sp|Q5ST30|SYVM_HUMAN Valine--tRNA ligase, mitochondrial OS=Homo sapiens OX=9606 GN=VARS2 PE=1 SV=2	759	ALGEKFVPQPAE
SLGELHVPQPAE	sp|Q6SW67|GH_HCMVM	278	tr|B7ZL25|B7ZL25_HUMAN Valyl-tRNA synthetase OS=Homo sapiens OX=9606 GN=VARS2 PE=1 SV=1	757	ALGEKFVPQPAE
SLGELHVPQPAE	sp|Q6SW67|GH_HCMVM	278	tr|A0A0G2JL52|A0A0G2JL52_HUMAN Valyl-tRNA synthetase OS=Homo sapiens OX=9606 GN=VARS2 PE=1 SV=1	789	ALGEKFVPQPAE
SLGELHVPQPAE	sp|Q6SW67|GH_HCMVM	278	tr|B4E0K6|B4E0K6_HUMAN Valyl-tRNA synthetase OS=Homo sapiens OX=9606 GN=VARS2 PE=1 SV=1	759	ALGEKFVPQPAE
LFSRNGDSEILL	sp|F5HE12|UL35_HCMVM	627	sp|Q7L4S7|ARMX6_HUMAN Protein ARMCX6 OS=Homo sapiens OX=9606 GN=ARMCX6 PE=2 SV=1	284	LFIRNGNREILL
DSPGCSSQSACA	sp|Q6SW62|SCAF_HCMVM	596	sp|Q2NL68|PRSR3_HUMAN Proline and serine-rich protein 3 OS=Homo sapiens OX=9606 GN=PROSER3 PE=1 SV=1	136	DSPDPSSQSAAA
DSPGCSSQSACA	sp|Q6SW62|SCAF_HCMVM	596	tr|M0QY86|M0QY86_HUMAN Proline and serine-rich protein 3 OS=Homo sapiens OX=9606 GN=PROSER3 PE=4 SV=1	36	DSPDPSSQSAAA
DSPGCSSQSACA	sp|Q6SW62|SCAF_HCMVM	596	tr|M0QZ53|M0QZ53_HUMAN Proline and serine-rich protein 3 (Fragment) OS=Homo sapiens OX=9606 GN=PROSER3 PE=4 SV=1	109	DSPDPSSQSAAA
PPAAPPDAAAVR	sp|Q6SW62|SCAF_HCMVM	234	sp|Q96SC8|DMTA2_HUMAN Doublesex- and mab-3-related transcription factor A2 OS=Homo sapiens OX=9606 GN=DMRTA2 PE=2 SV=2	363	GPAAPPDKAAVG
PPAAPPDAAAVR	sp|Q6SW62|SCAF_HCMVM	234	tr|A0A499FIZ0|A0A499FIZ0_HUMAN WD repeat-containing protein 26 OS=Homo sapiens OX=9606 GN=WDR26 PE=1 SV=1	76	PAAAPPAAAAVP
RPLPTLSTLGTA	sp|F5HBC6|PP71_HCMVM	133	tr|K7ER61|K7ER61_HUMAN Protein lyl-1 (Fragment) OS=Homo sapiens OX=9606 GN=LYL1 PE=4 SV=1	11	PPLLQLSTLGTA
RPLPTLSTLGTA	sp|F5HBC6|PP71_HCMVM	133	sp|P12980|LYL1_HUMAN Protein lyl-1 OS=Homo sapiens OX=9606 GN=LYL1 PE=1 SV=3	85	PPLLQLSTLGTA
GLIRGFRPASDR	sp|F5HGJ4|PP85_HCMVM	84	tr|Q5TF85|Q5TF85_HUMAN Family with sequence similarity 46, member A, isoform CRA_a OS=Homo sapiens OX=9606 GN=TENT5A PE=1 SV=1	380	LLVRGFRPASDE
GLIRGFRPASDR	sp|F5HGJ4|PP85_HCMVM	84	sp|Q96IP4|TET5A_HUMAN Terminal nucleotidyltransferase 5A OS=Homo sapiens OX=9606 GN=TENT5A PE=1 SV=2	299	LLVRGFRPASDE
PAVGTTAGGTLS	sp|F5HAQ7|UL135_HCMVM	134	sp|Q9BX10|GTPB2_HUMAN GTP-binding protein 2 OS=Homo sapiens OX=9606 GN=GTPBP2 PE=1 SV=1	420	PEVGTVVGGTLS
SIFTPQINALLV	sp|Q6SW70|DUT_HCMVM	132	sp|Q8TE73|DYH5_HUMAN Dynein heavy chain 5, axonemal OS=Homo sapiens OX=9606 GN=DNAH5 PE=1 SV=3	2944	VIRTPQGNALLV
DRLRGMAASKGL	sp|F5HC79|TRM1_HCMVM	219	sp|Q8IUC8|GLT13_HUMAN Polypeptide N-acetylgalactosaminyltransferase 13 OS=Homo sapiens OX=9606 GN=GALNT13 PE=2 SV=2	191	ARLRGAAASKGQ
PVPARLCSSPTL	sp|F5HEN8|HELI_HCMVM	47	sp|Q9UPT8|ZC3H4_HUMAN Zinc finger CCCH domain-containing protein 4 OS=Homo sapiens OX=9606 GN=ZC3H4 PE=1 SV=3	997	PVPAALQSMPTL
PVPARLCSSPTL	sp|F5HEN8|HELI_HCMVM	47	tr|M0QY97|M0QY97_HUMAN Zinc finger CCCH domain-containing protein 4 (Fragment) OS=Homo sapiens OX=9606 GN=ZC3H4 PE=1 SV=1	604	PVPAALQSMPTL
LSFDKLQLVDRA	sp|Q6SW84|LTP_HCMVM	301	sp|Q86TB3|ALPK2_HUMAN Alpha-protein kinase 2 OS=Homo sapiens OX=9606 GN=ALPK2 PE=1 SV=3	1106	LSGDKSQTVDRA
EEIVTFSHYAAG	sp|F5HCU8|TRM3_HCMVM	317	tr|B4DYB8|B4DYB8_HUMAN Mannose-6-phosphate isomerase OS=Homo sapiens OX=9606 GN=MPI PE=1 SV=1	105	EEIVTFLKTAAG
EEIVTFSHYAAG	sp|F5HCU8|TRM3_HCMVM	317	tr|H3BT46|H3BT46_HUMAN Mannose-6-phosphate isomerase (Fragment) OS=Homo sapiens OX=9606 GN=MPI PE=1 SV=1	142	EEIVTFLKTAAG
EEEPRQQPRTTT	sp|Q6SWB8|UL13_HCMVM	72	sp|Q9H7N4|SFR19_HUMAN Splicing factor, arginine/serine-rich 19 OS=Homo sapiens OX=9606 GN=SCAF1 PE=1 SV=3	1035	EEEEEQQPATTT
LGESHLAVLLTV	sp|F5HCH8|GL_HCMVM	15	sp|Q8NE01|CNNM3_HUMAN Metal transporter CNNM3 OS=Homo sapiens OX=9606 GN=CNNM3 PE=1 SV=1	256	LGLSRLAVLLTL
AITSLRFGISSV	sp|F5HEN8|HELI_HCMVM	790	tr|A0A590PXD8|A0A590PXD8_HUMAN Cordon-bleu protein-like 1 OS=Homo sapiens OX=9606 GN=COBLL1 PE=1 SV=1	480	AITSLTSGISSD
AITSLRFGISSV	sp|F5HEN8|HELI_HCMVM	790	tr|A0A0D9SG04|A0A0D9SG04_HUMAN Cordon-bleu protein-like 1 OS=Homo sapiens OX=9606 GN=COBLL1 PE=1 SV=2	508	AITSLTSGISSD
VAAERERRGLNA	sp|Q6SW50|CVC1_HCMVM	204	sp|P48681|NEST_HUMAN Nestin OS=Homo sapiens OX=9606 GN=NES PE=1 SV=2	142	VAHEEERVGLNA
SRSRCASSTTQT	sp|Q6SW99|PP150_HCMVM	268	tr|D6RBK6|D6RBK6_HUMAN Type-1 angiotensin II receptor-associated protein OS=Homo sapiens OX=9606 GN=AGTRAP PE=1 SV=1	64	SRSPAASSTTCT
AAMEALQVLNHD	sp|F5H8R6|UL96_HCMVM	15	tr|H3BQW6|H3BQW6_HUMAN NEDD8-activating enzyme E1 regulatory subunit (Fragment) OS=Homo sapiens OX=9606 GN=NAE1 PE=1 SV=1	123	AAMEFLQELNSD
AAMEALQVLNHD	sp|F5H8R6|UL96_HCMVM	15	tr|J3KRK3|J3KRK3_HUMAN NEDD8-activating enzyme E1 regulatory subunit (Fragment) OS=Homo sapiens OX=9606 GN=NAE1 PE=1 SV=1	82	AAMEFLQELNSD
AAMEALQVLNHD	sp|F5H8R6|UL96_HCMVM	15	sp|Q13564|ULA1_HUMAN NEDD8-activating enzyme E1 regulatory subunit OS=Homo sapiens OX=9606 GN=NAE1 PE=1 SV=1	88	AAMEFLQELNSD
LELLPGVLAYLE	sp|F5HA93|TRX1_HCMVM	250	tr|A0A5F9ZHW8|A0A5F9ZHW8_HUMAN Pleckstrin homology domain-containing family G member 5 OS=Homo sapiens OX=9606 GN=PLEKHG5 PE=1 SV=1	13	LEALPGDLAELE
GSASPGQLLTRM	sp|Q6SW04|IRS1_HCMVM	69	sp|Q86UR5|RIMS1_HUMAN Regulating synaptic membrane exocytosis protein 1 OS=Homo sapiens OX=9606 GN=RIMS1 PE=1 SV=1	1236	GSAPPSPLLTRM
GNQMVQRVAAML	sp|F5HIN9|TRX2_HCMVM	53	tr|A0A2R8Y7S1|A0A2R8Y7S1_HUMAN Sodium bicarbonate transporter-like protein 11 OS=Homo sapiens OX=9606 GN=SLC4A11 PE=1 SV=1	759	GNQLVQRVALLL
GNQMVQRVAAML	sp|F5HIN9|TRX2_HCMVM	53	sp|Q8NBS3|S4A11_HUMAN Sodium bicarbonate transporter-like protein 11 OS=Homo sapiens OX=9606 GN=SLC4A11 PE=1 SV=2	798	GNQLVQRVALLL
GNQMVQRVAAML	sp|F5HIN9|TRX2_HCMVM	53	tr|A0A2R8YFD9|A0A2R8YFD9_HUMAN Sodium bicarbonate transporter-like protein 11 OS=Homo sapiens OX=9606 GN=SLC4A11 PE=1 SV=1	744	GNQLVQRVALLL
GNQMVQRVAAML	sp|F5HIN9|TRX2_HCMVM	53	tr|A0A2R8Y4A6|A0A2R8Y4A6_HUMAN Sodium bicarbonate transporter-like protein 11 OS=Homo sapiens OX=9606 GN=SLC4A11 PE=1 SV=1	739	GNQLVQRVALLL
KTLDPISEAPNA	sp|Q6SW29|VIE2_HCMVM	313	sp|Q92820|GGH_HUMAN Gamma-glutamyl hydrolase OS=Homo sapiens OX=9606 GN=GGH PE=1 SV=2	253	KNLDGISHAPNA
LSLASRLARGDI	sp|Q6SW48|UL95_HCMVM	492	sp|Q5JR59|MTUS2_HUMAN Microtubule-associated tumor suppressor candidate 2 OS=Homo sapiens OX=9606 GN=MTUS2 PE=1 SV=3	198	LSLDSREARGQI
LQLVSLCVYFST	sp|F5HA10|CEP1_HCMVM	230	tr|A0A494C017|A0A494C017_HUMAN Myeloid-associated differentiation marker (Fragment) OS=Homo sapiens OX=9606 GN=MYADM PE=1 SV=1	42	LQLVSTCVAFSL
