query	query_seqname	query_start	target_seqname	target_start	target
SRRSSGSYELSE	sp|A4UHQ2|L_EBLV1	754	sp|Q9NYF0|DACT1_HUMAN Dapper homolog 1 OS=Homo sapiens OX=9606 GN=DACT1 PE=1 SV=2	155	SRPSSGFYELSD
SRRSSGSYELSE	sp|A4UHQ2|L_EBLV1	754	tr|B7WPD9|B7WPD9_HUMAN Kinesin-like protein KIF26B OS=Homo sapiens OX=9606 GN=KIF26B PE=1 SV=1	892	SRRSSISSWLSE
SRRSSGSYELSE	sp|A4UHQ2|L_EBLV1	754	tr|A0A0G2JR66|A0A0G2JR66_HUMAN Kinesin-like protein KIF26B (Fragment) OS=Homo sapiens OX=9606 GN=KIF26B PE=1 SV=1	1119	SRRSSISSWLSE
SRRSSGSYELSE	sp|A4UHQ2|L_EBLV1	754	sp|Q2KJY2|KI26B_HUMAN Kinesin-like protein KIF26B OS=Homo sapiens OX=9606 GN=KIF26B PE=2 SV=1	1273	SRRSSISSWLSE
ARSPGEWLFSRL	sp|A4UHQ2|L_EBLV1	1528	sp|P58335|ANTR2_HUMAN Anthrax toxin receptor 2 OS=Homo sapiens OX=9606 GN=ANTXR2 PE=1 SV=5	8	ARSPGSWLFPGL
SAVLPLLSEAVT	sp|A4UHQ2|L_EBLV1	2076	tr|A0A0A0MT46|A0A0A0MT46_HUMAN POU domain protein (Fragment) OS=Homo sapiens OX=9606 GN=POU2F1 PE=1 SV=1	433	SPVLPLTSAAVT
SAVLPLLSEAVT	sp|A4UHQ2|L_EBLV1	2076	sp|P14859|PO2F1_HUMAN POU domain, class 2, transcription factor 1 OS=Homo sapiens OX=9606 GN=POU2F1 PE=1 SV=2	479	SPVLPLTSAAVT
SAVLPLLSEAVT	sp|A4UHQ2|L_EBLV1	2076	tr|A0A0C4DG88|A0A0C4DG88_HUMAN POU domain protein (Fragment) OS=Homo sapiens OX=9606 GN=POU2F1 PE=1 SV=1	387	SPVLPLTSAAVT
LLLSLTLDVLSI	sp|A4UHQ2|L_EBLV1	682	tr|D6R9G9|D6R9G9_HUMAN Solute carrier family 35 member B1 (Fragment) OS=Homo sapiens OX=9606 GN=SLC35B1 PE=1 SV=3	133	LLLSLTLDGLTG
LLLSLTLDVLSI	sp|A4UHQ2|L_EBLV1	682	tr|D6RHG0|D6RHG0_HUMAN Solute carrier family 35 member B1 (Fragment) OS=Homo sapiens OX=9606 GN=SLC35B1 PE=1 SV=9	210	LLLSLTLDGLTG
LLLSLTLDVLSI	sp|A4UHQ2|L_EBLV1	682	tr|D6RE58|D6RE58_HUMAN Solute carrier family 35 member B1 (Fragment) OS=Homo sapiens OX=9606 GN=SLC35B1 PE=1 SV=1	145	LLLSLTLDGLTG
LLLSLTLDVLSI	sp|A4UHQ2|L_EBLV1	682	tr|D6RB73|D6RB73_HUMAN Solute carrier family 35 member B1 (Fragment) OS=Homo sapiens OX=9606 GN=SLC35B1 PE=1 SV=1	179	LLLSLTLDGLTG
LLLSLTLDVLSI	sp|A4UHQ2|L_EBLV1	682	tr|D6R981|D6R981_HUMAN Solute carrier family 35 member B1 (Fragment) OS=Homo sapiens OX=9606 GN=SLC35B1 PE=1 SV=1	109	LLLSLTLDGLTG
LLLSLTLDVLSI	sp|A4UHQ2|L_EBLV1	682	sp|P78383|S35B1_HUMAN Solute carrier family 35 member B1 OS=Homo sapiens OX=9606 GN=SLC35B1 PE=1 SV=1	176	LLLSLTLDGLTG
PGFDGGSGINFG	sp|A4UHQ2|L_EBLV1	1062	sp|P09651|ROA1_HUMAN Heterogeneous nuclear ribonucleoprotein A1 OS=Homo sapiens OX=9606 GN=HNRNPA1 PE=1 SV=5	296	GGFGGGSGSNFG
NEPILKIVAYSS	sp|A4UHQ1|GLYCO_EBLV1	290	sp|Q9UBB4|ATX10_HUMAN Ataxin-10 OS=Homo sapiens OX=9606 GN=ATXN10 PE=1 SV=1	167	NHPDKKIVAYSS
NEPILKIVAYSS	sp|A4UHQ1|GLYCO_EBLV1	290	tr|A0A1W2PQD2|A0A1W2PQD2_HUMAN Ataxin-10 OS=Homo sapiens OX=9606 GN=ATXN10 PE=1 SV=1	167	NHPDKKIVAYSS
SIEEDKWFKSKK	sp|A4UHP9|PHOSP_EBLV1	214	tr|D6RDM5|D6RDM5_HUMAN START domain containing 4, sterol regulated, isoform CRA_e OS=Homo sapiens OX=9606 GN=STARD4 PE=1 SV=1	23	SIEEDKWRVAKK
SIEEDKWFKSKK	sp|A4UHP9|PHOSP_EBLV1	214	tr|D6REN7|D6REN7_HUMAN StAR-related lipid transfer protein 4 OS=Homo sapiens OX=9606 GN=STARD4 PE=1 SV=1	23	SIEEDKWRVAKK
SIEEDKWFKSKK	sp|A4UHP9|PHOSP_EBLV1	214	sp|Q96DR4|STAR4_HUMAN StAR-related lipid transfer protein 4 OS=Homo sapiens OX=9606 GN=STARD4 PE=1 SV=1	23	SIEEDKWRVAKK
KKRLSVFRHPLI	sp|A4UHQ2|L_EBLV1	179	tr|C9J8B6|C9J8B6_HUMAN Neuronal cell adhesion molecule (Fragment) OS=Homo sapiens OX=9606 GN=NRCAM PE=1 SV=1	9	KKRLSAGRVPLI
KKRLSVFRHPLI	sp|A4UHQ2|L_EBLV1	179	tr|C9JH43|C9JH43_HUMAN Neuronal cell adhesion molecule (Fragment) OS=Homo sapiens OX=9606 GN=NRCAM PE=1 SV=1	9	KKRLSAGRVPLI
KKRLSVFRHPLI	sp|A4UHQ2|L_EBLV1	179	tr|A0A087X2B3|A0A087X2B3_HUMAN Neuronal cell adhesion molecule OS=Homo sapiens OX=9606 GN=NRCAM PE=1 SV=1	9	KKRLSAGRVPLI
KKRLSVFRHPLI	sp|A4UHQ2|L_EBLV1	179	tr|C9JUR7|C9JUR7_HUMAN Neuronal cell adhesion molecule (Fragment) OS=Homo sapiens OX=9606 GN=NRCAM PE=1 SV=1	9	KKRLSAGRVPLI
KKRLSVFRHPLI	sp|A4UHQ2|L_EBLV1	179	tr|C9JF43|C9JF43_HUMAN Neuronal cell adhesion molecule (Fragment) OS=Homo sapiens OX=9606 GN=NRCAM PE=1 SV=1	9	KKRLSAGRVPLI
KKRLSVFRHPLI	sp|A4UHQ2|L_EBLV1	179	tr|C9JYY6|C9JYY6_HUMAN Neuronal cell adhesion molecule OS=Homo sapiens OX=9606 GN=NRCAM PE=1 SV=3	9	KKRLSAGRVPLI
KKRLSVFRHPLI	sp|A4UHQ2|L_EBLV1	179	sp|Q92823|NRCAM_HUMAN Neuronal cell adhesion molecule OS=Homo sapiens OX=9606 GN=NRCAM PE=1 SV=3	9	KKRLSAGRVPLI
KKRLSVFRHPLI	sp|A4UHQ2|L_EBLV1	179	tr|F8W775|F8W775_HUMAN Neuronal cell adhesion molecule OS=Homo sapiens OX=9606 GN=NRCAM PE=1 SV=2	4	KKRLSAGRVPLI
SNNSSGEFLSFF	sp|A4UHQ2|L_EBLV1	255	tr|C9J9B2|C9J9B2_HUMAN RNA-binding motif, single-stranded-interacting protein 3 OS=Homo sapiens OX=9606 GN=RBMS3 PE=1 SV=1	50	SNNSSGEQLSKT
SNNSSGEFLSFF	sp|A4UHQ2|L_EBLV1	255	sp|Q6XE24|RBMS3_HUMAN RNA-binding motif, single-stranded-interacting protein 3 OS=Homo sapiens OX=9606 GN=RBMS3 PE=1 SV=1	50	SNNSSGEQLSKT
SNNSSGEFLSFF	sp|A4UHQ2|L_EBLV1	255	tr|C9JIJ9|C9JIJ9_HUMAN RNA-binding motif, single-stranded-interacting protein 3 OS=Homo sapiens OX=9606 GN=RBMS3 PE=1 SV=1	49	SNNSSGEQLSKT
SNNSSGEFLSFF	sp|A4UHQ2|L_EBLV1	255	tr|A0A1B0GUW5|A0A1B0GUW5_HUMAN RNA-binding motif, single-stranded-interacting protein 3 OS=Homo sapiens OX=9606 GN=RBMS3 PE=1 SV=2	176	SNNSSGEQLSKT
VSHGTSLRHVGN	sp|A4UHQ2|L_EBLV1	1606	sp|Q53RY4|KCP3_HUMAN Keratinocyte-associated protein 3 OS=Homo sapiens OX=9606 GN=KRTCAP3 PE=1 SV=1	38	VLHGTVLRHVAN
SGSYELSERPQR	sp|A4UHQ2|L_EBLV1	758	sp|Q9Y6B2|EID1_HUMAN EP300-interacting inhibitor of differentiation 1 OS=Homo sapiens OX=9606 GN=EID1 PE=1 SV=1	35	SGSRELSLRPSR
IEEDKWFKSKKT	sp|A4UHP9|PHOSP_EBLV1	215	tr|D6RDM5|D6RDM5_HUMAN START domain containing 4, sterol regulated, isoform CRA_e OS=Homo sapiens OX=9606 GN=STARD4 PE=1 SV=1	24	IEEDKWRVAKKT
IEEDKWFKSKKT	sp|A4UHP9|PHOSP_EBLV1	215	tr|D6REN7|D6REN7_HUMAN StAR-related lipid transfer protein 4 OS=Homo sapiens OX=9606 GN=STARD4 PE=1 SV=1	24	IEEDKWRVAKKT
IEEDKWFKSKKT	sp|A4UHP9|PHOSP_EBLV1	215	sp|Q96DR4|STAR4_HUMAN StAR-related lipid transfer protein 4 OS=Homo sapiens OX=9606 GN=STARD4 PE=1 SV=1	24	IEEDKWRVAKKT
QISSSPGSSDIA	sp|A4UHQ2|L_EBLV1	1660	sp|Q8IUG5|MY18B_HUMAN Unconventional myosin-XVIIIb OS=Homo sapiens OX=9606 GN=MYO18B PE=1 SV=2	94	DQSSSPGSSDIL
QISSSPGSSDIA	sp|A4UHQ2|L_EBLV1	1660	tr|F5H6I8|F5H6I8_HUMAN Unconventional myosin-XVIIIb OS=Homo sapiens OX=9606 GN=MYO18B PE=1 SV=1	94	DQSSSPGSSDIL
LLVSLESDLSKT	sp|A4UHQ2|L_EBLV1	341	sp|P00748|FA12_HUMAN Coagulation factor XII OS=Homo sapiens OX=9606 GN=F12 PE=1 SV=3	10	LLVSLESTLSIP
PLLVSLESDLSK	sp|A4UHQ2|L_EBLV1	340	sp|P00748|FA12_HUMAN Coagulation factor XII OS=Homo sapiens OX=9606 GN=F12 PE=1 SV=3	9	FLLVSLESTLSI
VSRGVSASRRSS	sp|A4UHQ2|L_EBLV1	747	tr|D6RA03|D6RA03_HUMAN Regulating synaptic membrane exocytosis protein 2 OS=Homo sapiens OX=9606 GN=RIMS2 PE=1 SV=1	936	VSRTSSASRFSS
VSRGVSASRRSS	sp|A4UHQ2|L_EBLV1	747	tr|F8W6W8|F8W6W8_HUMAN Regulating synaptic membrane exocytosis protein 2 (Fragment) OS=Homo sapiens OX=9606 GN=RIMS2 PE=1 SV=1	1009	VSRTSSASRFSS
VSRGVSASRRSS	sp|A4UHQ2|L_EBLV1	747	tr|A0A590UJL1|A0A590UJL1_HUMAN Regulating synaptic membrane exocytosis protein 2 OS=Homo sapiens OX=9606 GN=RIMS2 PE=1 SV=1	1245	VSRTSSASRFSS
LGSYMILLLSLT	sp|A4UHQ2|L_EBLV1	676	sp|P03905|NU4M_HUMAN NADH-ubiquinone oxidoreductase chain 4 OS=Homo sapiens OX=9606 GN=MT-ND4 PE=1 SV=1	171	LGSLNILLLTLT
KEEGENTETTGV	sp|A4UHQ1|GLYCO_EBLV1	147	sp|Q14246|AGRE1_HUMAN Adhesion G protein-coupled receptor E1 OS=Homo sapiens OX=9606 GN=ADGRE1 PE=2 SV=3	467	IEESESTETTGV
VPWTSSLKSPQD	sp|A4UHQ1|GLYCO_EBLV1	5	sp|Q7L0X0|TRIL_HUMAN TLR4 interactor with leucine rich repeats OS=Homo sapiens OX=9606 GN=TRIL PE=1 SV=2	49	VPKTSSLPSPHD
ILLLSLTLDVLS	sp|A4UHQ2|L_EBLV1	681	sp|O15552|FFAR2_HUMAN Free fatty acid receptor 2 OS=Homo sapiens OX=9606 GN=FFAR2 PE=1 SV=1	46	ILLLSLTLADLL
ILLLSLTLDVLS	sp|A4UHQ2|L_EBLV1	681	tr|D6R9G9|D6R9G9_HUMAN Solute carrier family 35 member B1 (Fragment) OS=Homo sapiens OX=9606 GN=SLC35B1 PE=1 SV=3	132	LLLLSLTLDGLT
ILLLSLTLDVLS	sp|A4UHQ2|L_EBLV1	681	tr|D6RHG0|D6RHG0_HUMAN Solute carrier family 35 member B1 (Fragment) OS=Homo sapiens OX=9606 GN=SLC35B1 PE=1 SV=9	209	LLLLSLTLDGLT
ILLLSLTLDVLS	sp|A4UHQ2|L_EBLV1	681	tr|D6RE58|D6RE58_HUMAN Solute carrier family 35 member B1 (Fragment) OS=Homo sapiens OX=9606 GN=SLC35B1 PE=1 SV=1	144	LLLLSLTLDGLT
ILLLSLTLDVLS	sp|A4UHQ2|L_EBLV1	681	tr|D6RB73|D6RB73_HUMAN Solute carrier family 35 member B1 (Fragment) OS=Homo sapiens OX=9606 GN=SLC35B1 PE=1 SV=1	178	LLLLSLTLDGLT
ILLLSLTLDVLS	sp|A4UHQ2|L_EBLV1	681	tr|D6R981|D6R981_HUMAN Solute carrier family 35 member B1 (Fragment) OS=Homo sapiens OX=9606 GN=SLC35B1 PE=1 SV=1	108	LLLLSLTLDGLT
ILLLSLTLDVLS	sp|A4UHQ2|L_EBLV1	681	sp|P78383|S35B1_HUMAN Solute carrier family 35 member B1 OS=Homo sapiens OX=9606 GN=SLC35B1 PE=1 SV=1	175	LLLLSLTLDGLT
ISSSPGSSDIAL	sp|A4UHQ2|L_EBLV1	1661	sp|Q8IUG5|MY18B_HUMAN Unconventional myosin-XVIIIb OS=Homo sapiens OX=9606 GN=MYO18B PE=1 SV=2	95	QSSSPGSSDILG
ISSSPGSSDIAL	sp|A4UHQ2|L_EBLV1	1661	tr|F5H6I8|F5H6I8_HUMAN Unconventional myosin-XVIIIb OS=Homo sapiens OX=9606 GN=MYO18B PE=1 SV=1	95	QSSSPGSSDILG
PSSGETGIPVRA	sp|A4UHQ0|MATRX_EBLV1	61	sp|Q9NXL9|MCM9_HUMAN DNA helicase MCM9 OS=Homo sapiens OX=9606 GN=MCM9 PE=1 SV=4	801	PSPGETGVPWRA
MILLLSLTLDVL	sp|A4UHQ2|L_EBLV1	680	sp|O15552|FFAR2_HUMAN Free fatty acid receptor 2 OS=Homo sapiens OX=9606 GN=FFAR2 PE=1 SV=1	45	HILLLSLTLADL
MILLLSLTLDVL	sp|A4UHQ2|L_EBLV1	680	tr|D6R9G9|D6R9G9_HUMAN Solute carrier family 35 member B1 (Fragment) OS=Homo sapiens OX=9606 GN=SLC35B1 PE=1 SV=3	131	LLLLLSLTLDGL
MILLLSLTLDVL	sp|A4UHQ2|L_EBLV1	680	tr|D6RHG0|D6RHG0_HUMAN Solute carrier family 35 member B1 (Fragment) OS=Homo sapiens OX=9606 GN=SLC35B1 PE=1 SV=9	208	LLLLLSLTLDGL
MILLLSLTLDVL	sp|A4UHQ2|L_EBLV1	680	tr|D6RE58|D6RE58_HUMAN Solute carrier family 35 member B1 (Fragment) OS=Homo sapiens OX=9606 GN=SLC35B1 PE=1 SV=1	143	LLLLLSLTLDGL
MILLLSLTLDVL	sp|A4UHQ2|L_EBLV1	680	tr|D6RB73|D6RB73_HUMAN Solute carrier family 35 member B1 (Fragment) OS=Homo sapiens OX=9606 GN=SLC35B1 PE=1 SV=1	177	LLLLLSLTLDGL
MILLLSLTLDVL	sp|A4UHQ2|L_EBLV1	680	tr|D6R981|D6R981_HUMAN Solute carrier family 35 member B1 (Fragment) OS=Homo sapiens OX=9606 GN=SLC35B1 PE=1 SV=1	107	LLLLLSLTLDGL
MILLLSLTLDVL	sp|A4UHQ2|L_EBLV1	680	sp|P78383|S35B1_HUMAN Solute carrier family 35 member B1 OS=Homo sapiens OX=9606 GN=SLC35B1 PE=1 SV=1	174	LLLLLSLTLDGL
RLHERSTILYMS	sp|A4UHQ0|MATRX_EBLV1	77	tr|C9IZQ6|C9IZQ6_HUMAN HCG2022551, isoform CRA_j OS=Homo sapiens OX=9606 GN=KALRN PE=1 SV=1	406	ALDERSTILAMS
RLHERSTILYMS	sp|A4UHQ0|MATRX_EBLV1	77	tr|H7BXZ5|H7BXZ5_HUMAN Non-specific serine/threonine protein kinase (Fragment) OS=Homo sapiens OX=9606 GN=KALRN PE=1 SV=1	384	ALDERSTILAMS
RLHERSTILYMS	sp|A4UHQ0|MATRX_EBLV1	77	sp|O60229|KALRN_HUMAN Kalirin OS=Homo sapiens OX=9606 GN=KALRN PE=1 SV=3	406	ALDERSTILAMS
SNRLDLVYTRLG	sp|A4UHQ2|L_EBLV1	226	sp|P98164|LRP2_HUMAN Low-density lipoprotein receptor-related protein 2 OS=Homo sapiens OX=9606 GN=LRP2 PE=1 SV=3	546	SNRKDLVKTKLG
KPLLVSLESDLS	sp|A4UHQ2|L_EBLV1	339	sp|P00748|FA12_HUMAN Coagulation factor XII OS=Homo sapiens OX=9606 GN=F12 PE=1 SV=3	8	GFLLVSLESTLS
HGTSLRHVGNPL	sp|A4UHQ2|L_EBLV1	1608	sp|Q53RY4|KCP3_HUMAN Keratinocyte-associated protein 3 OS=Homo sapiens OX=9606 GN=KRTCAP3 PE=1 SV=1	40	HGTVLRHVANPR
TLSNNSSGEFLS	sp|A4UHQ2|L_EBLV1	253	tr|C9J9B2|C9J9B2_HUMAN RNA-binding motif, single-stranded-interacting protein 3 OS=Homo sapiens OX=9606 GN=RBMS3 PE=1 SV=1	48	NSSNNSSGEQLS
TLSNNSSGEFLS	sp|A4UHQ2|L_EBLV1	253	sp|Q6XE24|RBMS3_HUMAN RNA-binding motif, single-stranded-interacting protein 3 OS=Homo sapiens OX=9606 GN=RBMS3 PE=1 SV=1	48	NSSNNSSGEQLS
TLSNNSSGEFLS	sp|A4UHQ2|L_EBLV1	253	tr|C9JIJ9|C9JIJ9_HUMAN RNA-binding motif, single-stranded-interacting protein 3 OS=Homo sapiens OX=9606 GN=RBMS3 PE=1 SV=1	47	NSSNNSSGEQLS
TLSNNSSGEFLS	sp|A4UHQ2|L_EBLV1	253	tr|A0A1B0GUW5|A0A1B0GUW5_HUMAN RNA-binding motif, single-stranded-interacting protein 3 OS=Homo sapiens OX=9606 GN=RBMS3 PE=1 SV=2	174	NSSNNSSGEQLS
DSSDALDLSSVS	sp|A4UHQ2|L_EBLV1	1638	sp|Q7Z3T8|ZFY16_HUMAN Zinc finger FYVE domain-containing protein 16 OS=Homo sapiens OX=9606 GN=ZFYVE16 PE=1 SV=3	159	DSLIGLDLSSVS
SLSFALSMFLWY	sp|A4UHQ2|L_EBLV1	581	sp|Q03518|TAP1_HUMAN Antigen peptide transporter 1 OS=Homo sapiens OX=9606 GN=TAP1 PE=1 SV=2	358	SLSENLSLFLWY
SLSFALSMFLWY	sp|A4UHQ2|L_EBLV1	581	tr|A0A140T9T7|A0A140T9T7_HUMAN Antigen peptide transporter 1 OS=Homo sapiens OX=9606 GN=TAP1 PE=1 SV=1	358	SLSENLSLFLWY
IQISSSPGSSDI	sp|A4UHQ2|L_EBLV1	1659	sp|Q8IUG5|MY18B_HUMAN Unconventional myosin-XVIIIb OS=Homo sapiens OX=9606 GN=MYO18B PE=1 SV=2	93	DDQSSSPGSSDI
IQISSSPGSSDI	sp|A4UHQ2|L_EBLV1	1659	tr|F5H6I8|F5H6I8_HUMAN Unconventional myosin-XVIIIb OS=Homo sapiens OX=9606 GN=MYO18B PE=1 SV=1	93	DDQSSSPGSSDI
GGICYRVLTRDA	sp|A4UHP8|NCAP_EBLV1	393	tr|F8WF38|F8WF38_HUMAN Gamma-aminobutyric acid type B receptor subunit 1 OS=Homo sapiens OX=9606 GN=GABBR1 PE=1 SV=1	39	GGIRYRGLTRDQ
GGICYRVLTRDA	sp|A4UHP8|NCAP_EBLV1	393	tr|F8WAS6|F8WAS6_HUMAN Gamma-aminobutyric acid type B receptor subunit 1 OS=Homo sapiens OX=9606 GN=GABBR1 PE=1 SV=1	39	GGIRYRGLTRDQ
GGICYRVLTRDA	sp|A4UHP8|NCAP_EBLV1	393	tr|A0A140T9S4|A0A140T9S4_HUMAN Gamma-aminobutyric acid type B receptor subunit 1 OS=Homo sapiens OX=9606 GN=GABBR1 PE=1 SV=1	39	GGIRYRGLTRDQ
GGICYRVLTRDA	sp|A4UHP8|NCAP_EBLV1	393	tr|C9J342|C9J342_HUMAN Gamma-aminobutyric acid type B receptor subunit 1 (Fragment) OS=Homo sapiens OX=9606 GN=GABBR1 PE=1 SV=1	44	GGIRYRGLTRDQ
GGICYRVLTRDA	sp|A4UHP8|NCAP_EBLV1	393	tr|F8WAV2|F8WAV2_HUMAN Gamma-aminobutyric acid type B receptor subunit 1 OS=Homo sapiens OX=9606 GN=GABBR1 PE=1 SV=1	39	GGIRYRGLTRDQ
GGICYRVLTRDA	sp|A4UHP8|NCAP_EBLV1	393	tr|C9JZG6|C9JZG6_HUMAN Gamma-aminobutyric acid type B receptor subunit 1 (Fragment) OS=Homo sapiens OX=9606 GN=GABBR1 PE=1 SV=1	39	GGIRYRGLTRDQ
GGICYRVLTRDA	sp|A4UHP8|NCAP_EBLV1	393	tr|F8WDC0|F8WDC0_HUMAN Gamma-aminobutyric acid type B receptor subunit 1 OS=Homo sapiens OX=9606 GN=GABBR1 PE=1 SV=1	39	GGIRYRGLTRDQ
GGICYRVLTRDA	sp|A4UHP8|NCAP_EBLV1	393	sp|Q9UBS5|GABR1_HUMAN Gamma-aminobutyric acid type B receptor subunit 1 OS=Homo sapiens OX=9606 GN=GABBR1 PE=1 SV=1	39	GGIRYRGLTRDQ
GGICYRVLTRDA	sp|A4UHP8|NCAP_EBLV1	393	tr|A0A0G2JKF9|A0A0G2JKF9_HUMAN GABBR1 OS=Homo sapiens OX=9606 GN=GABBR1 PE=1 SV=1	39	GGIRYRGLTRDQ
GGICYRVLTRDA	sp|A4UHP8|NCAP_EBLV1	393	tr|A0A140TA42|A0A140TA42_HUMAN Gamma-aminobutyric acid type B receptor subunit 1 OS=Homo sapiens OX=9606 GN=GABBR1 PE=1 SV=1	39	GGIRYRGLTRDQ
GGSGINFGWAWV	sp|A4UHQ2|L_EBLV1	1066	tr|C9JWM2|C9JWM2_HUMAN Secretory carrier-associated membrane protein (Fragment) OS=Homo sapiens OX=9606 GN=SCAMP4 PE=1 SV=2	65	GGSGTNFGLAFV
GGSGINFGWAWV	sp|A4UHQ2|L_EBLV1	1066	tr|A0A087WVT5|A0A087WVT5_HUMAN Secretory carrier-associated membrane protein OS=Homo sapiens OX=9606 GN=SCAMP4 PE=3 SV=1	21	GGSGTNFGLAFV
GGSGINFGWAWV	sp|A4UHQ2|L_EBLV1	1066	sp|Q969E2|SCAM4_HUMAN Secretory carrier-associated membrane protein 4 OS=Homo sapiens OX=9606 GN=SCAMP4 PE=1 SV=1	65	GGSGTNFGLAFV
ISTDKEEGENTE	sp|A4UHQ1|GLYCO_EBLV1	143	sp|Q9BYT9|ANO3_HUMAN Anoctamin-3 OS=Homo sapiens OX=9606 GN=ANO3 PE=2 SV=2	73	ISTDKAEQVNTE
ISTDKEEGENTE	sp|A4UHQ1|GLYCO_EBLV1	143	tr|A0A5F9ZHL6|A0A5F9ZHL6_HUMAN Anoctamin OS=Homo sapiens OX=9606 GN=ANO3 PE=1 SV=1	134	ISTDKAEQVNTE
ISTDKEEGENTE	sp|A4UHQ1|GLYCO_EBLV1	143	tr|E9PQ79|E9PQ79_HUMAN Anoctamin OS=Homo sapiens OX=9606 GN=ANO3 PE=1 SV=1	57	ISTDKAEQVNTE
ISTDKEEGENTE	sp|A4UHQ1|GLYCO_EBLV1	143	tr|E9PKW2|E9PKW2_HUMAN Anoctamin-3 OS=Homo sapiens OX=9606 GN=ANO3 PE=1 SV=1	73	ISTDKAEQVNTE
LFIMTATDITLS	sp|A4UHQ2|L_EBLV1	244	sp|Q6KC79|NIPBL_HUMAN Nipped-B-like protein OS=Homo sapiens OX=9606 GN=NIPBL PE=1 SV=2	2447	LFIMHHIDITLS
ASRRSSGSYELS	sp|A4UHQ2|L_EBLV1	753	sp|Q9NYF0|DACT1_HUMAN Dapper homolog 1 OS=Homo sapiens OX=9606 GN=DACT1 PE=1 SV=2	154	DSRPSSGFYELS
MDPVSQSASFDT	sp|A4UHP9|PHOSP_EBLV1	76	tr|F8WF23|F8WF23_HUMAN Synaptoporin OS=Homo sapiens OX=9606 GN=SYNPR PE=1 SV=1	1	MDPVSQLASAGT
MDPVSQSASFDT	sp|A4UHP9|PHOSP_EBLV1	76	tr|F8WE43|F8WE43_HUMAN Synaptoporin OS=Homo sapiens OX=9606 GN=SYNPR PE=1 SV=1	1	MDPVSQLASAGT
ASQPKPKDCGRV	sp|A4UHQ1|GLYCO_EBLV1	358	tr|A0A087WUI7|A0A087WUI7_HUMAN Down syndrome cell adhesion molecule OS=Homo sapiens OX=9606 GN=DSCAM PE=1 SV=1	1708	ASPPKPQDGGRV
ASQPKPKDCGRV	sp|A4UHQ1|GLYCO_EBLV1	358	sp|O60469|DSCAM_HUMAN Down syndrome cell adhesion molecule OS=Homo sapiens OX=9606 GN=DSCAM PE=1 SV=2	1873	ASPPKPQDGGRV
ASQPKPKDCGRV	sp|A4UHQ1|GLYCO_EBLV1	358	tr|Q8WY19|Q8WY19_HUMAN Down syndrome cell adhesion molecule (Fragment) OS=Homo sapiens OX=9606 GN=DSCAM PE=1 SV=1	1625	ASPPKPQDGGRV
SSSPGSSDIALG	sp|A4UHQ2|L_EBLV1	1662	sp|Q96LB8|PGRP4_HUMAN Peptidoglycan recognition protein 4 OS=Homo sapiens OX=9606 GN=PGLYRP4 PE=1 SV=2	295	SSTPGYDDIALG
SSSPGSSDIALG	sp|A4UHQ2|L_EBLV1	1662	sp|Q8IUG5|MY18B_HUMAN Unconventional myosin-XVIIIb OS=Homo sapiens OX=9606 GN=MYO18B PE=1 SV=2	96	SSSPGSSDILGK
SSSPGSSDIALG	sp|A4UHQ2|L_EBLV1	1662	tr|F5H6I8|F5H6I8_HUMAN Unconventional myosin-XVIIIb OS=Homo sapiens OX=9606 GN=MYO18B PE=1 SV=1	96	SSSPGSSDILGK
EISAEASKEVLR	sp|A4UHP9|PHOSP_EBLV1	131	tr|A0A5F9ZI30|A0A5F9ZI30_HUMAN Ankyrin-2 OS=Homo sapiens OX=9606 GN=ANK2 PE=1 SV=1	3426	EISDEASKLVDR
EISAEASKEVLR	sp|A4UHP9|PHOSP_EBLV1	131	tr|A0A5F9ZI65|A0A5F9ZI65_HUMAN Ankyrin-2 OS=Homo sapiens OX=9606 GN=ANK2 PE=1 SV=1	3426	EISDEASKLVDR
EISAEASKEVLR	sp|A4UHP9|PHOSP_EBLV1	131	tr|A0A5F9ZGY3|A0A5F9ZGY3_HUMAN Ankyrin-2 OS=Homo sapiens OX=9606 GN=ANK2 PE=1 SV=1	3426	EISDEASKLVDR
EISAEASKEVLR	sp|A4UHP9|PHOSP_EBLV1	131	tr|A0A5F9ZH30|A0A5F9ZH30_HUMAN Ankyrin-2 OS=Homo sapiens OX=9606 GN=ANK2 PE=1 SV=1	3426	EISDEASKLVDR
EISAEASKEVLR	sp|A4UHP9|PHOSP_EBLV1	131	tr|A0A5F9ZGY4|A0A5F9ZGY4_HUMAN Ankyrin-2 OS=Homo sapiens OX=9606 GN=ANK2 PE=1 SV=1	3426	EISDEASKLVDR
EISAEASKEVLR	sp|A4UHP9|PHOSP_EBLV1	131	tr|A0A5F9ZH19|A0A5F9ZH19_HUMAN Ankyrin-2 OS=Homo sapiens OX=9606 GN=ANK2 PE=1 SV=1	3418	EISDEASKLVDR
EISAEASKEVLR	sp|A4UHP9|PHOSP_EBLV1	131	tr|A0A5F9ZHS1|A0A5F9ZHS1_HUMAN Ankyrin-2 OS=Homo sapiens OX=9606 GN=ANK2 PE=1 SV=1	3507	EISDEASKLVDR
EISAEASKEVLR	sp|A4UHP9|PHOSP_EBLV1	131	tr|A0A5F9ZI46|A0A5F9ZI46_HUMAN Ankyrin-2 OS=Homo sapiens OX=9606 GN=ANK2 PE=1 SV=1	3405	EISDEASKLVDR
EISAEASKEVLR	sp|A4UHP9|PHOSP_EBLV1	131	tr|A0A5F9ZHF7|A0A5F9ZHF7_HUMAN Ankyrin-2 OS=Homo sapiens OX=9606 GN=ANK2 PE=1 SV=1	3385	EISDEASKLVDR
EISAEASKEVLR	sp|A4UHP9|PHOSP_EBLV1	131	tr|I6L894|I6L894_HUMAN Ankyrin-2 OS=Homo sapiens OX=9606 GN=ANK2 PE=1 SV=1	3447	EISDEASKLVDR
EISAEASKEVLR	sp|A4UHP9|PHOSP_EBLV1	131	sp|Q01484|ANK2_HUMAN Ankyrin-2 OS=Homo sapiens OX=9606 GN=ANK2 PE=1 SV=4	3480	EISDEASKLVDR
EISAEASKEVLR	sp|A4UHP9|PHOSP_EBLV1	131	tr|A0A5F9ZGX3|A0A5F9ZGX3_HUMAN Ankyrin-2 OS=Homo sapiens OX=9606 GN=ANK2 PE=1 SV=1	3495	EISDEASKLVDR
EISAEASKEVLR	sp|A4UHP9|PHOSP_EBLV1	131	tr|A0A5F9ZHT8|A0A5F9ZHT8_HUMAN Ankyrin-2 OS=Homo sapiens OX=9606 GN=ANK2 PE=1 SV=1	3414	EISDEASKLVDR
EISAEASKEVLR	sp|A4UHP9|PHOSP_EBLV1	131	tr|A0A5F9ZHR8|A0A5F9ZHR8_HUMAN Ankyrin-2 OS=Homo sapiens OX=9606 GN=ANK2 PE=1 SV=1	3462	EISDEASKLVDR
EISAEASKEVLR	sp|A4UHP9|PHOSP_EBLV1	131	tr|A0A5F9ZI40|A0A5F9ZI40_HUMAN Ankyrin-2 OS=Homo sapiens OX=9606 GN=ANK2 PE=1 SV=1	3438	EISDEASKLVDR
EISAEASKEVLR	sp|A4UHP9|PHOSP_EBLV1	131	tr|A0A5F9ZHT4|A0A5F9ZHT4_HUMAN Ankyrin-2 OS=Homo sapiens OX=9606 GN=ANK2 PE=1 SV=1	3393	EISDEASKLVDR
EISAEASKEVLR	sp|A4UHP9|PHOSP_EBLV1	131	tr|A0A5F9ZHN5|A0A5F9ZHN5_HUMAN Ankyrin-2 OS=Homo sapiens OX=9606 GN=ANK2 PE=1 SV=1	3426	EISDEASKLVDR
EISAEASKEVLR	sp|A4UHP9|PHOSP_EBLV1	131	tr|A0A5F9ZHD2|A0A5F9ZHD2_HUMAN Ankyrin 2, neuronal, isoform CRA_b OS=Homo sapiens OX=9606 GN=ANK2 PE=1 SV=1	3459	EISDEASKLVDR
EISAEASKEVLR	sp|A4UHP9|PHOSP_EBLV1	131	tr|A0A5F9ZHE4|A0A5F9ZHE4_HUMAN Ankyrin-2 OS=Homo sapiens OX=9606 GN=ANK2 PE=1 SV=1	3426	EISDEASKLVDR
EISAEASKEVLR	sp|A4UHP9|PHOSP_EBLV1	131	tr|D6RHE1|D6RHE1_HUMAN Ankyrin-2 OS=Homo sapiens OX=9606 GN=ANK2 PE=1 SV=2	3426	EISDEASKLVDR
EISAEASKEVLR	sp|A4UHP9|PHOSP_EBLV1	131	tr|A0A5F9ZGZ5|A0A5F9ZGZ5_HUMAN Ankyrin-2 (Fragment) OS=Homo sapiens OX=9606 GN=ANK2 PE=1 SV=1	3419	EISDEASKLVDR
RGVSASRRSSGS	sp|A4UHQ2|L_EBLV1	749	sp|Q53F19|NCBP3_HUMAN Nuclear cap-binding protein subunit 3 OS=Homo sapiens OX=9606 GN=NCBP3 PE=1 SV=2	384	RERSASRRSSAS
SGLKANCLVFGG	sp|A4UHQ1|GLYCO_EBLV1	460	tr|E9PBP6|E9PBP6_HUMAN Microsomal triglyceride transfer protein large subunit OS=Homo sapiens OX=9606 GN=MTTP PE=1 SV=1	772	SGLKANIEVQGG
SGLKANCLVFGG	sp|A4UHQ1|GLYCO_EBLV1	460	sp|P55157|MTP_HUMAN Microsomal triglyceride transfer protein large subunit OS=Homo sapiens OX=9606 GN=MTTP PE=1 SV=1	745	SGLKANIEVQGG
EGGICYRVLTRD	sp|A4UHP8|NCAP_EBLV1	392	tr|F8WF38|F8WF38_HUMAN Gamma-aminobutyric acid type B receptor subunit 1 OS=Homo sapiens OX=9606 GN=GABBR1 PE=1 SV=1	38	EGGIRYRGLTRD
EGGICYRVLTRD	sp|A4UHP8|NCAP_EBLV1	392	tr|F8WAS6|F8WAS6_HUMAN Gamma-aminobutyric acid type B receptor subunit 1 OS=Homo sapiens OX=9606 GN=GABBR1 PE=1 SV=1	38	EGGIRYRGLTRD
EGGICYRVLTRD	sp|A4UHP8|NCAP_EBLV1	392	tr|A0A140T9S4|A0A140T9S4_HUMAN Gamma-aminobutyric acid type B receptor subunit 1 OS=Homo sapiens OX=9606 GN=GABBR1 PE=1 SV=1	38	EGGIRYRGLTRD
EGGICYRVLTRD	sp|A4UHP8|NCAP_EBLV1	392	tr|C9J342|C9J342_HUMAN Gamma-aminobutyric acid type B receptor subunit 1 (Fragment) OS=Homo sapiens OX=9606 GN=GABBR1 PE=1 SV=1	43	EGGIRYRGLTRD
EGGICYRVLTRD	sp|A4UHP8|NCAP_EBLV1	392	tr|F8WAV2|F8WAV2_HUMAN Gamma-aminobutyric acid type B receptor subunit 1 OS=Homo sapiens OX=9606 GN=GABBR1 PE=1 SV=1	38	EGGIRYRGLTRD
EGGICYRVLTRD	sp|A4UHP8|NCAP_EBLV1	392	tr|C9JZG6|C9JZG6_HUMAN Gamma-aminobutyric acid type B receptor subunit 1 (Fragment) OS=Homo sapiens OX=9606 GN=GABBR1 PE=1 SV=1	38	EGGIRYRGLTRD
EGGICYRVLTRD	sp|A4UHP8|NCAP_EBLV1	392	tr|F8WDC0|F8WDC0_HUMAN Gamma-aminobutyric acid type B receptor subunit 1 OS=Homo sapiens OX=9606 GN=GABBR1 PE=1 SV=1	38	EGGIRYRGLTRD
EGGICYRVLTRD	sp|A4UHP8|NCAP_EBLV1	392	sp|Q9UBS5|GABR1_HUMAN Gamma-aminobutyric acid type B receptor subunit 1 OS=Homo sapiens OX=9606 GN=GABBR1 PE=1 SV=1	38	EGGIRYRGLTRD
EGGICYRVLTRD	sp|A4UHP8|NCAP_EBLV1	392	tr|A0A0G2JKF9|A0A0G2JKF9_HUMAN GABBR1 OS=Homo sapiens OX=9606 GN=GABBR1 PE=1 SV=1	38	EGGIRYRGLTRD
EGGICYRVLTRD	sp|A4UHP8|NCAP_EBLV1	392	tr|A0A140TA42|A0A140TA42_HUMAN Gamma-aminobutyric acid type B receptor subunit 1 OS=Homo sapiens OX=9606 GN=GABBR1 PE=1 SV=1	38	EGGIRYRGLTRD
KRLSVFRHPLIL	sp|A4UHQ2|L_EBLV1	180	tr|C9J8B6|C9J8B6_HUMAN Neuronal cell adhesion molecule (Fragment) OS=Homo sapiens OX=9606 GN=NRCAM PE=1 SV=1	10	KRLSAGRVPLIL
KRLSVFRHPLIL	sp|A4UHQ2|L_EBLV1	180	tr|C9JH43|C9JH43_HUMAN Neuronal cell adhesion molecule (Fragment) OS=Homo sapiens OX=9606 GN=NRCAM PE=1 SV=1	10	KRLSAGRVPLIL
KRLSVFRHPLIL	sp|A4UHQ2|L_EBLV1	180	tr|A0A087X2B3|A0A087X2B3_HUMAN Neuronal cell adhesion molecule OS=Homo sapiens OX=9606 GN=NRCAM PE=1 SV=1	10	KRLSAGRVPLIL
KRLSVFRHPLIL	sp|A4UHQ2|L_EBLV1	180	tr|C9JUR7|C9JUR7_HUMAN Neuronal cell adhesion molecule (Fragment) OS=Homo sapiens OX=9606 GN=NRCAM PE=1 SV=1	10	KRLSAGRVPLIL
KRLSVFRHPLIL	sp|A4UHQ2|L_EBLV1	180	tr|C9JF43|C9JF43_HUMAN Neuronal cell adhesion molecule (Fragment) OS=Homo sapiens OX=9606 GN=NRCAM PE=1 SV=1	10	KRLSAGRVPLIL
KRLSVFRHPLIL	sp|A4UHQ2|L_EBLV1	180	tr|C9JYY6|C9JYY6_HUMAN Neuronal cell adhesion molecule OS=Homo sapiens OX=9606 GN=NRCAM PE=1 SV=3	10	KRLSAGRVPLIL
KRLSVFRHPLIL	sp|A4UHQ2|L_EBLV1	180	sp|Q92823|NRCAM_HUMAN Neuronal cell adhesion molecule OS=Homo sapiens OX=9606 GN=NRCAM PE=1 SV=3	10	KRLSAGRVPLIL
KRLSVFRHPLIL	sp|A4UHQ2|L_EBLV1	180	tr|F8W775|F8W775_HUMAN Neuronal cell adhesion molecule OS=Homo sapiens OX=9606 GN=NRCAM PE=1 SV=2	5	KRLSAGRVPLIL
GGPSLDQFVIPR	sp|A4UHQ1|GLYCO_EBLV1	470	sp|O94993|SOX30_HUMAN Transcription factor SOX-30 OS=Homo sapiens OX=9606 GN=SOX30 PE=1 SV=1	142	LGPSLDQSVGPR
SHGTSLRHVGNP	sp|A4UHQ2|L_EBLV1	1607	sp|Q53RY4|KCP3_HUMAN Keratinocyte-associated protein 3 OS=Homo sapiens OX=9606 GN=KRTCAP3 PE=1 SV=1	39	LHGTVLRHVANP
KQLHSLSAIDSL	sp|A4UHQ2|L_EBLV1	794	sp|Q9HC77|CENPJ_HUMAN Centromere protein J OS=Homo sapiens OX=9606 GN=CENPJ PE=1 SV=2	656	KQLHSLSSADEL
KQLHSLSAIDSL	sp|A4UHQ2|L_EBLV1	794	tr|F6VUX8|F6VUX8_HUMAN Centromere protein J OS=Homo sapiens OX=9606 GN=CENPJ PE=1 SV=1	656	KQLHSLSSADEL
SRQSSFSPNAAK	sp|A4UHQ2|L_EBLV1	512	tr|H0Y760|H0Y760_HUMAN Helicase ARIP4 (Fragment) OS=Homo sapiens OX=9606 GN=RAD54L2 PE=1 SV=1	1020	SRQSSPSTNAAL
SRQSSFSPNAAK	sp|A4UHQ2|L_EBLV1	512	sp|Q9Y4B4|ARIP4_HUMAN Helicase ARIP4 OS=Homo sapiens OX=9606 GN=RAD54L2 PE=1 SV=4	1191	SRQSSPSTNAAL
GFDGGSGINFGW	sp|A4UHQ2|L_EBLV1	1063	sp|P09651|ROA1_HUMAN Heterogeneous nuclear ribonucleoprotein A1 OS=Homo sapiens OX=9606 GN=HNRNPA1 PE=1 SV=5	297	GFGGGSGSNFGG
LSNNSSGEFLSF	sp|A4UHQ2|L_EBLV1	254	tr|C9J9B2|C9J9B2_HUMAN RNA-binding motif, single-stranded-interacting protein 3 OS=Homo sapiens OX=9606 GN=RBMS3 PE=1 SV=1	49	SSNNSSGEQLSK
LSNNSSGEFLSF	sp|A4UHQ2|L_EBLV1	254	sp|Q6XE24|RBMS3_HUMAN RNA-binding motif, single-stranded-interacting protein 3 OS=Homo sapiens OX=9606 GN=RBMS3 PE=1 SV=1	49	SSNNSSGEQLSK
LSNNSSGEFLSF	sp|A4UHQ2|L_EBLV1	254	tr|C9JIJ9|C9JIJ9_HUMAN RNA-binding motif, single-stranded-interacting protein 3 OS=Homo sapiens OX=9606 GN=RBMS3 PE=1 SV=1	48	SSNNSSGEQLSK
LSNNSSGEFLSF	sp|A4UHQ2|L_EBLV1	254	tr|A0A1B0GUW5|A0A1B0GUW5_HUMAN RNA-binding motif, single-stranded-interacting protein 3 OS=Homo sapiens OX=9606 GN=RBMS3 PE=1 SV=2	175	SSNNSSGEQLSK
GPSLDQFVIPRC	sp|A4UHQ1|GLYCO_EBLV1	471	sp|O94993|SOX30_HUMAN Transcription factor SOX-30 OS=Homo sapiens OX=9606 GN=SOX30 PE=1 SV=1	143	GPSLDQSVGPRG
TSRQSSFSPNAA	sp|A4UHQ2|L_EBLV1	511	tr|H0Y760|H0Y760_HUMAN Helicase ARIP4 (Fragment) OS=Homo sapiens OX=9606 GN=RAD54L2 PE=1 SV=1	1019	ESRQSSPSTNAA
TSRQSSFSPNAA	sp|A4UHQ2|L_EBLV1	511	sp|Q9Y4B4|ARIP4_HUMAN Helicase ARIP4 OS=Homo sapiens OX=9606 GN=RAD54L2 PE=1 SV=4	1190	ESRQSSPSTNAA
EEGENTETTGVL	sp|A4UHQ1|GLYCO_EBLV1	148	sp|Q14246|AGRE1_HUMAN Adhesion G protein-coupled receptor E1 OS=Homo sapiens OX=9606 GN=ADGRE1 PE=2 SV=3	468	EESESTETTGVA
DWQLNLLKADLR	sp|A4UHQ2|L_EBLV1	1572	sp|P04275|VWF_HUMAN von Willebrand factor OS=Homo sapiens OX=9606 GN=VWF PE=1 SV=4	470	DVQLPLLKGDLR
GEWLFSRLHQEL	sp|A4UHQ2|L_EBLV1	1532	tr|B0QYP5|B0QYP5_HUMAN Tetratricopeptide repeat protein 28 (Fragment) OS=Homo sapiens OX=9606 GN=TTC28 PE=1 SV=1	132	GEQLISRLHQVL
