query	query_seqname	query_start	target_seqname	target_start	target
NAVLSSKPGSNS	sp|P0DTC1|R1A_SARS2	2343	sp|Q5VU43|MYOME_HUMAN Myomegalin OS=Homo sapiens OX=9606 GN=PDE4DIP PE=1 SV=3	1651	SAVLSSKPSSTS
SSLNPTSTIEDQ	sp|P0DTC1|R1A_SARS2	565	sp|Q9NR09|BIRC6_HUMAN Baculoviral IAP repeat-containing protein 6 OS=Homo sapiens OX=9606 GN=BIRC6 PE=1 SV=2	4275	SSHNPTSTEEQQ
VSHNATRTLDVG	sp|P0DTD1|R1AB_SARS2	1549	sp|P98161|PKD1_HUMAN Polycystin-1 OS=Homo sapiens OX=9606 GN=PKD1 PE=1 SV=3	74	VSHNLLRALDVG
RGELKCDFDFLS	sp|P0DTD1|R1AB_SARS2	4496	sp|Q68CQ4|DIEXF_HUMAN Digestive organ expansion factor homolog OS=Homo sapiens OX=9606 GN=DIEXF PE=1 SV=2	462	EGEKKRDFDFLS
RGELKCDFDFLS	sp|P0DTD1|R1AB_SARS2	4496	tr|H7C2R4|H7C2R4_HUMAN UTP25 small subunit processor component (Fragment) OS=Homo sapiens OX=9606 GN=UTP25 PE=1 SV=1	143	EGEKKRDFDFLS
NVLTRTLDKELC	sp|P0DTD1|R1AB_SARS2	3620	tr|A0A087WWV0|A0A087WWV0_HUMAN Relaxin receptor 1 OS=Homo sapiens OX=9606 GN=RXFP1 PE=1 SV=1	102	NVLTRLPDKPLC
NVLTRTLDKELC	sp|P0DTD1|R1AB_SARS2	3620	sp|Q9HBX9|RXFP1_HUMAN Relaxin receptor 1 OS=Homo sapiens OX=9606 GN=RXFP1 PE=1 SV=2	232	NVLTRLPDKPLC
NVLTRTLDKELC	sp|P0DTD1|R1AB_SARS2	3620	tr|E9PCA3|E9PCA3_HUMAN Relaxin receptor 1 OS=Homo sapiens OX=9606 GN=RXFP1 PE=1 SV=1	151	NVLTRLPDKPLC
NVLTRTLDKELC	sp|P0DTD1|R1AB_SARS2	3620	tr|B4DGP2|B4DGP2_HUMAN Relaxin receptor 1 OS=Homo sapiens OX=9606 GN=RXFP1 PE=1 SV=1	259	NVLTRLPDKPLC
NVLTRTLDKELC	sp|P0DTD1|R1AB_SARS2	3620	tr|A0A0A0MT52|A0A0A0MT52_HUMAN Relaxin receptor 1 OS=Homo sapiens OX=9606 GN=RXFP1 PE=1 SV=1	100	NVLTRLPDKPLC
VLDLLIILVPSL	sp|P0DTD1|R1AB_SARS2	1903	sp|Q13326|SGCG_HUMAN Gamma-sarcoglycan OS=Homo sapiens OX=9606 GN=SGCG PE=1 SV=4	40	VLLLLIILVVNL
DDDQENHKSPEQ	sp|P0DTC9|NCAP_SARS2	353	sp|Q86VV8|RTTN_HUMAN Rotatin OS=Homo sapiens OX=9606 GN=RTTN PE=1 SV=3	1829	DDSQENQKSLEQ
SLFANTVSCFLG	sp|P0DTD1|R1AB_SARS2	1848	sp|Q9UKJ8|ADA21_HUMAN Disintegrin and metalloproteinase domain-containing protein 21 OS=Homo sapiens OX=9606 GN=ADAM21 PE=1 SV=2	333	SLFANTVAHELG
PIETDFSPLVET	sp|P0DTD1|R1AB_SARS2	6330	sp|Q86WI1|PKHL1_HUMAN Fibrocystin-L OS=Homo sapiens OX=9606 GN=PKHD1L1 PE=2 SV=2	1240	PIITDFSPKVRT
LLTLFIPAEVSG	sp|P0DTC5|VME1_SARS2	31	sp|O60494|CUBN_HUMAN Cubilin OS=Homo sapiens OX=9606 GN=CUBN PE=1 SV=5	12	LLTLLIFAEVNG
LALEGLAKTSGL	sp|P0DTD1|R1AB_SARS2	6631	tr|H3BVI6|H3BVI6_HUMAN Calponin OS=Homo sapiens OX=9606 GN=CNN2 PE=1 SV=2	125	LALAGKAKTKGL
LALEGLAKTSGL	sp|P0DTD1|R1AB_SARS2	6631	tr|A0A087X1X5|A0A087X1X5_HUMAN Calponin (Fragment) OS=Homo sapiens OX=9606 GN=CNN2 PE=1 SV=1	62	LALAGKAKTKGL
LALEGLAKTSGL	sp|P0DTD1|R1AB_SARS2	6631	sp|Q99439|CNN2_HUMAN Calponin-2 OS=Homo sapiens OX=9606 GN=CNN2 PE=1 SV=4	125	LALAGKAKTKGL
LSLVMSTPVLPS	sp|P0DTC1|R1A_SARS2	4149	tr|E9PB87|E9PB87_HUMAN WAS/WASL-interacting protein family member 1 OS=Homo sapiens OX=9606 GN=WIPF1 PE=1 SV=1	339	LSLSSSTPPLPS
LSLVMSTPVLPS	sp|P0DTC1|R1A_SARS2	4149	sp|O43516|WIPF1_HUMAN WAS/WASL-interacting protein family member 1 OS=Homo sapiens OX=9606 GN=WIPF1 PE=1 SV=3	339	LSLSSSTPPLPS
GGASAYILFYLG	sp|P0DTD1|R1AB_SARS2	2074	tr|G3XAG5|G3XAG5_HUMAN Chloride channel protein OS=Homo sapiens OX=9606 GN=CLCN4 PE=1 SV=1	144	EGASAYILNYLM
GGASAYILFYLG	sp|P0DTD1|R1AB_SARS2	2074	sp|P51793|CLCN4_HUMAN H(+)/Cl(-) exchange transporter 4 OS=Homo sapiens OX=9606 GN=CLCN4 PE=1 SV=2	144	EGASAYILNYLM
GGASAYILFYLG	sp|P0DTD1|R1AB_SARS2	2074	tr|A0A6Q8PG54|A0A6Q8PG54_HUMAN Chloride channel protein OS=Homo sapiens OX=9606 GN=CLCN4 PE=1 SV=1	144	EGASAYILNYLM
SVGKSLYVSETA	sp|P0DTD1|R1AB_SARS2	1375	sp|P01024|CO3_HUMAN Complement C3 OS=Homo sapiens OX=9606 GN=C3 PE=1 SV=2	319	LVGKSLYVSATV
IVLRSEDSKDAK	sp|P0DTD1|R1AB_SARS2	1496	tr|E9PPG2|E9PPG2_HUMAN AMP deaminase 3 (Fragment) OS=Homo sapiens OX=9606 GN=AMPD3 PE=1 SV=1	27	KVLREEDSKDAL
IVLRSEDSKDAK	sp|P0DTD1|R1AB_SARS2	1496	tr|E9PLK6|E9PLK6_HUMAN AMP deaminase 3 (Fragment) OS=Homo sapiens OX=9606 GN=AMPD3 PE=1 SV=1	27	KVLREEDSKDAL
IVLRSEDSKDAK	sp|P0DTD1|R1AB_SARS2	1496	sp|Q01432|AMPD3_HUMAN AMP deaminase 3 OS=Homo sapiens OX=9606 GN=AMPD3 PE=1 SV=1	27	KVLREEDSKDAL
IVLRSEDSKDAK	sp|P0DTD1|R1AB_SARS2	1496	tr|E9PKC5|E9PKC5_HUMAN AMP deaminase OS=Homo sapiens OX=9606 GN=AMPD3 PE=1 SV=1	27	KVLREEDSKDAL
IVLRSEDSKDAK	sp|P0DTD1|R1AB_SARS2	1496	tr|E9PIR5|E9PIR5_HUMAN AMP deaminase 3 OS=Homo sapiens OX=9606 GN=AMPD3 PE=1 SV=1	36	KVLREEDSKDAL
NDKTGTTGPKVD	sp|P0DTD1|R1AB_SARS2	4658	sp|Q9Y2I2|NTNG1_HUMAN Netrin-G1 OS=Homo sapiens OX=9606 GN=NTNG1 PE=1 SV=3	439	ECKTGTTGPKCD
EFEEKSLEMRIE	sp|P0DTC6|NS6_SARS2	38	sp|Q9BXL7|CAR11_HUMAN Caspase recruitment domain-containing protein 11 OS=Homo sapiens OX=9606 GN=CARD11 PE=1 SV=3	409	ELEEKNDEMRIE
AKTVVLKKKRSP	sp|P0DTC1|R1A_SARS2	402	sp|Q8NFC6|BD1L1_HUMAN Biorientation of chromosomes in cell division protein 1-like 1 OS=Homo sapiens OX=9606 GN=BOD1L1 PE=1 SV=2	1452	AETVKLKHKRSP
GASAYILFYLGK	sp|P0DTD1|R1AB_SARS2	2075	tr|G3XAG5|G3XAG5_HUMAN Chloride channel protein OS=Homo sapiens OX=9606 GN=CLCN4 PE=1 SV=1	145	GASAYILNYLMY
GASAYILFYLGK	sp|P0DTD1|R1AB_SARS2	2075	sp|P51793|CLCN4_HUMAN H(+)/Cl(-) exchange transporter 4 OS=Homo sapiens OX=9606 GN=CLCN4 PE=1 SV=2	145	GASAYILNYLMY
GASAYILFYLGK	sp|P0DTD1|R1AB_SARS2	2075	tr|A0A6Q8PG54|A0A6Q8PG54_HUMAN Chloride channel protein OS=Homo sapiens OX=9606 GN=CLCN4 PE=1 SV=1	145	GASAYILNYLMY
LLIILVPSLPNI	sp|P0DTD1|R1AB_SARS2	1906	tr|H0YMP0|H0YMP0_HUMAN Formin-1 (Fragment) OS=Homo sapiens OX=9606 GN=FMN1 PE=1 SV=1	46	LLILLVPSLPTA
VIETLNVTLFRS	sp|P0DTC2|SPIKE_SARS2	1034	sp|Q8WZ64|ARAP2_HUMAN Arf-GAP with Rho-GAP domain, ANK repeat and PH domain-containing protein 2 OS=Homo sapiens OX=9606 GN=ARAP2 PE=1 SV=3	1679	VIEELNVVLQRS
AALETGLTVATC	sp|P0DTC1|R1A_SARS2	1688	sp|Q96SB3|NEB2_HUMAN Neurabin-2 OS=Homo sapiens OX=9606 GN=PPP1R9B PE=1 SV=3	327	AALENGSTVATA
DKTGTTGPKVDK	sp|P0DTD1|R1AB_SARS2	4659	sp|Q9Y2I2|NTNG1_HUMAN Netrin-G1 OS=Homo sapiens OX=9606 GN=NTNG1 PE=1 SV=3	440	CKTGTTGPKCDE
NPSVLKSQFELL	sp|P0DTC1|R1A_SARS2	1935	sp|Q6NWY9|PR40B_HUMAN Pre-mRNA-processing factor 40 homolog B OS=Homo sapiens OX=9606 GN=PRPF40B PE=1 SV=1	122	KPSVLKSKAELL
NPSVLKSQFELL	sp|P0DTC1|R1A_SARS2	1935	tr|F8VU11|F8VU11_HUMAN PRP40 pre-mRNA processing factor 40 homolog B (Yeast), isoform CRA_a OS=Homo sapiens OX=9606 GN=PRPF40B PE=1 SV=2	144	KPSVLKSKAELL
SSTTSLFANTVS	sp|P0DTD1|R1AB_SARS2	1844	sp|Q96AY4|TTC28_HUMAN Tetratricopeptide repeat protein 28 OS=Homo sapiens OX=9606 GN=TTC28 PE=1 SV=4	1361	QSMTSLFSNTVS
SSTTSLFANTVS	sp|P0DTD1|R1AB_SARS2	1844	tr|A0A087WW06|A0A087WW06_HUMAN Tetratricopeptide repeat protein 28 OS=Homo sapiens OX=9606 GN=TTC28 PE=1 SV=1	1234	QSMTSLFSNTVS
VVFILVSRAAVV	sp|P0DTC4|VEMP_SARS2	42	sp|Q96J65|MRP9_HUMAN ATP-binding cassette sub-family C member 12 OS=Homo sapiens OX=9606 GN=ABCC12 PE=1 SV=2	937	VVFILVILAAVF
VVFILVSRAAVV	sp|P0DTC4|VEMP_SARS2	42	sp|Q86T13|CLC14_HUMAN C-type lectin domain family 14 member A OS=Homo sapiens OX=9606 GN=CLEC14A PE=1 SV=1	398	VVFIFVSTAVVV
SLVMSTPVLPSF	sp|P0DTC1|R1A_SARS2	4150	sp|O14684|PTGES_HUMAN Prostaglandin E synthase OS=Homo sapiens OX=9606 GN=PTGES PE=1 SV=2	5	SLVMSSPALPAF
LEYNEKLLVLVC	sp|P0DTD1|R1AB_SARS2	2738	tr|Q5VUC3|Q5VUC3_HUMAN Ribonuclease P protein subunit p38 (Fragment) OS=Homo sapiens OX=9606 GN=RPP38 PE=1 SV=8	124	LERRELLLVLVC
LEYNEKLLVLVC	sp|P0DTD1|R1AB_SARS2	2738	sp|P78345|RPP38_HUMAN Ribonuclease P protein subunit p38 OS=Homo sapiens OX=9606 GN=RPP38 PE=1 SV=2	124	LERRELLLVLVC
LCAASMPIHLKL	sp|P0DTD3|ORF9C_SARS2	16	sp|Q5W150|YT011_HUMAN Putative uncharacterized protein MGC163334 OS=Homo sapiens OX=9606 PE=1 SV=1	128	LCAASLPPSLKL
LQECKQPQLLSV	sp|P0DTD1|R1AB_SARS2	1968	sp|O95613|PCNT_HUMAN Pericentrin OS=Homo sapiens OX=9606 GN=PCNT PE=1 SV=4	904	LQERHQQQLLSV
SLKTMSNVTGHT	sp|P0DTC1|R1A_SARS2	471	sp|P51948|MAT1_HUMAN CDK-activating kinase assembly factor MAT1 OS=Homo sapiens OX=9606 GN=MNAT1 PE=1 SV=1	18	SLKLMVNVCGHT
YNLLKNLSNTLL	sp|P0DTC1|R1A_SARS2	4077	sp|O60774|FMO6_HUMAN Putative dimethylaniline monooxygenase [N-oxide-forming] 6 OS=Homo sapiens OX=9606 GN=FMO6P PE=5 SV=1	519	YNLLKMLSFPLL
GELKCDFDFLSY	sp|P0DTD1|R1AB_SARS2	4497	sp|Q68CQ4|DIEXF_HUMAN Digestive organ expansion factor homolog OS=Homo sapiens OX=9606 GN=DIEXF PE=1 SV=2	463	GEKKRDFDFLSS
GELKCDFDFLSY	sp|P0DTD1|R1AB_SARS2	4497	tr|H7C2R4|H7C2R4_HUMAN UTP25 small subunit processor component (Fragment) OS=Homo sapiens OX=9606 GN=UTP25 PE=1 SV=1	144	GEKKRDFDFLSS
YQNWLLFLSGLF	sp|P0DTD1|R1AB_SARS2	993	tr|B4DKD1|B4DKD1_HUMAN Protein tweety homolog OS=Homo sapiens OX=9606 GN=TTYH2 PE=1 SV=1	15	YLRWLLFLSLLF
PKVCALLVSLKM	sp|P0DTD1|R1AB_SARS2	1598	sp|Q8NGG1|OR8J2_HUMAN Olfactory receptor 8J2 OS=Homo sapiens OX=9606 GN=OR8J2 PE=3 SV=2	138	PKVCRLLVSLTY
CYQNWLLFLSGL	sp|P0DTD1|R1AB_SARS2	992	tr|B4DKD1|B4DKD1_HUMAN Protein tweety homolog OS=Homo sapiens OX=9606 GN=TTYH2 PE=1 SV=1	14	CYLRWLLFLSLL
LLIADFLLFLLP	sp|P0DTG1|ORF3C_SARS2	5	sp|Q7Z7H3|CATIP_HUMAN Ciliogenesis-associated TTC17-interacting protein OS=Homo sapiens OX=9606 GN=CATIP PE=1 SV=1	326	ALISDFLLFLLL
NLLAYEVDATLL	sp|P0DTD1|R1AB_SARS2	535	tr|A0A0C4DFW6|A0A0C4DFW6_HUMAN Forkhead box P3, isoform CRA_b OS=Homo sapiens OX=9606 GN=FOXP3 PE=1 SV=1	374	WLLASEVDAHLL
RTLLERTAVDGI	sp|P0DTD2|ORF9B_SARS2	39	sp|Q9H1V8|S6A17_HUMAN Sodium-dependent neutral amino acid transporter SLC6A17 OS=Homo sapiens OX=9606 GN=SLC6A17 PE=1 SV=3	270	RGLLLRGAVDGI
GAADFRISILSE	sp|P0DTD1|R1AB_SARS2	5171	sp|O00526|UPK2_HUMAN Uroplakin-2 OS=Homo sapiens OX=9606 GN=UPK2 PE=1 SV=2	23	GAADFNISSLSG
SIENLVELPASF	sp|P0DTC1|R1A_SARS2	3745	tr|C9JDY8|C9JDY8_HUMAN Amiloride-sensitive sodium channel subunit delta (Fragment) OS=Homo sapiens OX=9606 GN=SCNN1D PE=3 SV=1	81	HQEGLVELPASF
SIENLVELPASF	sp|P0DTC1|R1A_SARS2	3745	sp|P51172|SCNND_HUMAN Amiloride-sensitive sodium channel subunit delta OS=Homo sapiens OX=9606 GN=SCNN1D PE=1 SV=3	209	HQEGLVELPASF
IALGLAYFQQVL	sp|P0DTC2|SPIKE_SARS2	7	sp|Q9NYG8|KCNK4_HUMAN Potassium channel subfamily K member 4 OS=Homo sapiens OX=9606 GN=KCNK4 PE=1 SV=2	239	ILLGLAYFASVL
NQELVAAYIQKL	sp|P0DTC1|R1A_SARS2	3290	sp|Q9UJG1|MSPD1_HUMAN Motile sperm domain-containing protein 1 OS=Homo sapiens OX=9606 GN=MOSPD1 PE=1 SV=1	194	NQKLVAAYILGL
NQELVAAYIQKL	sp|P0DTC1|R1A_SARS2	3290	tr|J3KS79|J3KS79_HUMAN Bleomycin hydrolase OS=Homo sapiens OX=9606 GN=BLMH PE=1 SV=1	7	NSEKVAALIQKL
NQELVAAYIQKL	sp|P0DTC1|R1A_SARS2	3290	sp|Q13867|BLMH_HUMAN Bleomycin hydrolase OS=Homo sapiens OX=9606 GN=BLMH PE=1 SV=1	7	NSEKVAALIQKL
NQELVAAYIQKL	sp|P0DTC1|R1A_SARS2	3290	tr|K7ES02|K7ES02_HUMAN Bleomycin hydrolase (Fragment) OS=Homo sapiens OX=9606 GN=BLMH PE=1 SV=1	7	NSEKVAALIQKL
NQELVAAYIQKL	sp|P0DTC1|R1A_SARS2	3290	tr|K7ENH5|K7ENH5_HUMAN Bleomycin hydrolase OS=Homo sapiens OX=9606 GN=BLMH PE=1 SV=1	7	NSEKVAALIQKL
STGINFIPFTLT	sp|P0DTC2|SPIKE_SARS2	425	sp|P0DTE0|T2R36_HUMAN Putative taste receptor type 2 member 36 OS=Homo sapiens OX=9606 GN=TAS2R36 PE=5 SV=1	180	STLANLIPFTLT
LGNAKVLTGTSG	sp|P0DTD1|R1AB_SARS2	3501	sp|Q9HC35|EMAL4_HUMAN Echinoderm microtubule-associated protein-like 4 OS=Homo sapiens OX=9606 GN=EML4 PE=1 SV=3	465	LGNGDVLTGDSG
LGNAKVLTGTSG	sp|P0DTD1|R1AB_SARS2	3501	tr|B5MBZ0|B5MBZ0_HUMAN Echinoderm microtubule-associated protein-like 4 OS=Homo sapiens OX=9606 GN=EML4 PE=1 SV=3	476	LGNGDVLTGDSG
TSQDALLASRGH	sp|P0DTC1|R1A_SARS2	4030	sp|Q5T0L3|SPT46_HUMAN Spermatogenesis-associated protein 46 OS=Homo sapiens OX=9606 GN=SPATA46 PE=1 SV=3	165	TSQDILMASRWH
VETEALQATTIR	sp|P0DTD1|R1AB_SARS2	6339	sp|Q13332|PTPRS_HUMAN Receptor-type tyrosine-protein phosphatase S OS=Homo sapiens OX=9606 GN=PTPRS PE=1 SV=3	727	VEAEALNATAIR
LGLARLLCSLKL	sp|P0DTC1|R1A_SARS2	3688	tr|C9JIB2|C9JIB2_HUMAN Zinc transporter ZIP5 (Fragment) OS=Homo sapiens OX=9606 GN=SLC39A5 PE=1 SV=1	56	GGLARLLHSLGL
LGLARLLCSLKL	sp|P0DTC1|R1A_SARS2	3688	tr|C9JVC6|C9JVC6_HUMAN Zinc transporter ZIP5 (Fragment) OS=Homo sapiens OX=9606 GN=SLC39A5 PE=1 SV=1	56	GGLARLLHSLGL
LGLARLLCSLKL	sp|P0DTC1|R1A_SARS2	3688	tr|C9JPS6|C9JPS6_HUMAN Zinc transporter ZIP5 (Fragment) OS=Homo sapiens OX=9606 GN=SLC39A5 PE=1 SV=8	56	GGLARLLHSLGL
LGLARLLCSLKL	sp|P0DTC1|R1A_SARS2	3688	tr|C9JPS5|C9JPS5_HUMAN Zinc transporter ZIP5 (Fragment) OS=Homo sapiens OX=9606 GN=SLC39A5 PE=1 SV=1	56	GGLARLLHSLGL
LGLARLLCSLKL	sp|P0DTC1|R1A_SARS2	3688	tr|C9JB28|C9JB28_HUMAN Zinc transporter ZIP5 (Fragment) OS=Homo sapiens OX=9606 GN=SLC39A5 PE=1 SV=1	27	GGLARLLHSLGL
LGLARLLCSLKL	sp|P0DTC1|R1A_SARS2	3688	sp|Q6ZMH5|S39A5_HUMAN Zinc transporter ZIP5 OS=Homo sapiens OX=9606 GN=SLC39A5 PE=1 SV=3	56	GGLARLLHSLGL
AKTSGLKKTETK	sp|P0DTD1|R1AB_SARS2	6637	sp|Q86VY9|T200A_HUMAN Transmembrane protein 200A OS=Homo sapiens OX=9606 GN=TMEM200A PE=1 SV=1	267	DKTSGSKKCETK
LAALETGLTVAT	sp|P0DTC1|R1A_SARS2	1687	sp|Q96SB3|NEB2_HUMAN Neurabin-2 OS=Homo sapiens OX=9606 GN=PPP1R9B PE=1 SV=3	326	HAALENGSTVAT
ASVSTALGTQEN	sp|P0DTD1|R1AB_SARS2	2464	sp|Q92989|CLP1_HUMAN Polyribonucleotide 5'-hydroxyl-kinase Clp1 OS=Homo sapiens OX=9606 GN=CLP1 PE=1 SV=1	366	LSVSTAEGTEEN
ASVSTALGTQEN	sp|P0DTD1|R1AB_SARS2	2464	tr|E9PL17|E9PL17_HUMAN Polyribonucleotide 5'-hydroxyl-kinase Clp1 OS=Homo sapiens OX=9606 GN=CLP1 PE=1 SV=1	377	LSVSTAEGTEEN
APSARLGHLAKS	sp|P0DTD1|R1AB_SARS2	3247	tr|A0A1B0GUS7|A0A1B0GUS7_HUMAN Protein unc-13 homolog B OS=Homo sapiens OX=9606 GN=UNC13B PE=1 SV=1	1295	APSAQLGFLEKS
HIPELAALTQDE	sp|P0DTD1|R1AB_SARS2	1047	sp|Q92889|XPF_HUMAN DNA repair endonuclease XPF OS=Homo sapiens OX=9606 GN=ERCC4 PE=1 SV=3	872	NIAELAALSQDE
FTVEQEIDNKVQ	sp|P0DTD1|R1AB_SARS2	3016	sp|Q99574|NEUS_HUMAN Neuroserpin OS=Homo sapiens OX=9606 GN=SERPINI1 PE=1 SV=1	295	FTVEQEIDLKDV
FTVEQEIDNKVQ	sp|P0DTD1|R1AB_SARS2	3016	tr|H7C5T9|H7C5T9_HUMAN Neuroserpin (Fragment) OS=Homo sapiens OX=9606 GN=SERPINI1 PE=1 SV=1	4	FTVEQEIDLKDV
EVVVAFARLEGV	sp|P0DTD1|R1AB_SARS2	5817	sp|Q7LG56|RIR2B_HUMAN Ribonucleoside-diphosphate reductase subunit M2 B OS=Homo sapiens OX=9606 GN=RRM2B PE=1 SV=1	185	ERVVAFAAVEGV
EVVVAFARLEGV	sp|P0DTD1|R1AB_SARS2	5817	tr|A0A0C4DGZ6|A0A0C4DGZ6_HUMAN Ribonucleoside-diphosphate reductase subunit M2 B OS=Homo sapiens OX=9606 GN=RRM2B PE=1 SV=1	131	ERVVAFAAVEGV
EVVVAFARLEGV	sp|P0DTD1|R1AB_SARS2	5817	tr|H0YAV1|H0YAV1_HUMAN Ribonucleoside-diphosphate reductase subunit M2 B (Fragment) OS=Homo sapiens OX=9606 GN=RRM2B PE=1 SV=1	242	ERVVAFAAVEGV
VLRSEDSKDAKI	sp|P0DTD1|R1AB_SARS2	1497	tr|E9PPG2|E9PPG2_HUMAN AMP deaminase 3 (Fragment) OS=Homo sapiens OX=9606 GN=AMPD3 PE=1 SV=1	28	VLREEDSKDALS
VLRSEDSKDAKI	sp|P0DTD1|R1AB_SARS2	1497	tr|E9PLK6|E9PLK6_HUMAN AMP deaminase 3 (Fragment) OS=Homo sapiens OX=9606 GN=AMPD3 PE=1 SV=1	28	VLREEDSKDALS
VLRSEDSKDAKI	sp|P0DTD1|R1AB_SARS2	1497	sp|Q01432|AMPD3_HUMAN AMP deaminase 3 OS=Homo sapiens OX=9606 GN=AMPD3 PE=1 SV=1	28	VLREEDSKDALS
VLRSEDSKDAKI	sp|P0DTD1|R1AB_SARS2	1497	tr|E9PKC5|E9PKC5_HUMAN AMP deaminase OS=Homo sapiens OX=9606 GN=AMPD3 PE=1 SV=1	28	VLREEDSKDALS
VLRSEDSKDAKI	sp|P0DTD1|R1AB_SARS2	1497	tr|E9PIR5|E9PIR5_HUMAN AMP deaminase 3 OS=Homo sapiens OX=9606 GN=AMPD3 PE=1 SV=1	37	VLREEDSKDALS
LVLLDSVKQGTG	sp|P0DTD1|R1AB_SARS2	1194	tr|H0Y6C2|H0Y6C2_HUMAN Glucagon-like peptide 2 receptor OS=Homo sapiens OX=9606 GN=GLP2R PE=4 SV=4	55	LVLLVSIKQVTG
LVLLDSVKQGTG	sp|P0DTD1|R1AB_SARS2	1194	sp|O95838|GLP2R_HUMAN Glucagon-like peptide 2 receptor OS=Homo sapiens OX=9606 GN=GLP2R PE=2 SV=1	55	LVLLVSIKQVTG
KVLDLLIILVPS	sp|P0DTD1|R1AB_SARS2	1902	sp|Q709C8|VP13C_HUMAN Vacuolar protein sorting-associated protein 13C OS=Homo sapiens OX=9606 GN=VPS13C PE=1 SV=1	686	KVLDLRINLKPS
LLYVKLVAGWEE	sp|P0DTC1|R1A_SARS2	3060	sp|A5PKW4|PSD1_HUMAN PH and SEC7 domain-containing protein 1 OS=Homo sapiens OX=9606 GN=PSD PE=1 SV=2	958	LLRVKLKAGSEE
ESTRYTSTSSGR	sp|P0DTC1|R1A_SARS2	952	sp|Q8NBT3|TM145_HUMAN Transmembrane protein 145 OS=Homo sapiens OX=9606 GN=TMEM145 PE=2 SV=2	125	EGTRYLSCSSGR
ESTRYTSTSSGR	sp|P0DTC1|R1A_SARS2	952	tr|A0A5F9ZGX1|A0A5F9ZGX1_HUMAN Transmembrane protein 145 OS=Homo sapiens OX=9606 GN=TMEM145 PE=1 SV=1	125	EGTRYLSCSSGR
ESTRYTSTSSGR	sp|P0DTC1|R1A_SARS2	952	tr|M0QZX2|M0QZX2_HUMAN Transmembrane protein 145 OS=Homo sapiens OX=9606 GN=TMEM145 PE=4 SV=1	135	EGTRYLSCSSGR
ESTRYTSTSSGR	sp|P0DTC1|R1A_SARS2	952	tr|A0A5F9ZH48|A0A5F9ZH48_HUMAN Transmembrane protein 145 OS=Homo sapiens OX=9606 GN=TMEM145 PE=1 SV=1	125	EGTRYLSCSSGR
GNFMRFRVNSNS	sp|P0DTD1|R1AB_SARS2	5925	sp|Q9NSI8|SAMN1_HUMAN SAM domain-containing protein SAMSN-1 OS=Homo sapiens OX=9606 GN=SAMSN1 PE=1 SV=1	25	GNFDRFRNNSLS
GNFMRFRVNSNS	sp|P0DTD1|R1AB_SARS2	5925	tr|A0A2R8Y4K8|A0A2R8Y4K8_HUMAN SAM domain-containing protein SAMSN-1 OS=Homo sapiens OX=9606 GN=SAMSN1 PE=1 SV=1	321	GNFDRFRNNSLS
EGLWAIGTLLDE	sp|P0DTC1|R1A_SARS2	1184	sp|Q9NY59|NSMA2_HUMAN Sphingomyelin phosphodiesterase 3 OS=Homo sapiens OX=9606 GN=SMPD3 PE=1 SV=1	543	EKPWAIGTLLDT
EGLWAIGTLLDE	sp|P0DTC1|R1A_SARS2	1184	tr|H3BS51|H3BS51_HUMAN Sphingomyelin phosphodiesterase OS=Homo sapiens OX=9606 GN=SMPD3 PE=1 SV=1	543	EKPWAIGTLLDT
QLTALIDDLITL	sp|P0DTC1|R1A_SARS2	323	tr|A0A6Q8PGZ2|A0A6Q8PGZ2_HUMAN E3 ubiquitin-protein ligase LRSAM1 OS=Homo sapiens OX=9606 GN=LRSAM1 PE=1 SV=1	92	QLTALPDDLGQL
QLTALIDDLITL	sp|P0DTC1|R1A_SARS2	323	tr|A0A6Q8PG90|A0A6Q8PG90_HUMAN E3 ubiquitin-protein ligase LRSAM1 OS=Homo sapiens OX=9606 GN=LRSAM1 PE=1 SV=1	92	QLTALPDDLGQL
QLTALIDDLITL	sp|P0DTC1|R1A_SARS2	323	tr|A0A6Q8PGH9|A0A6Q8PGH9_HUMAN E3 ubiquitin-protein ligase LRSAM1 OS=Homo sapiens OX=9606 GN=LRSAM1 PE=1 SV=1	92	QLTALPDDLGQL
QLTALIDDLITL	sp|P0DTC1|R1A_SARS2	323	tr|A0A6Q8PGB2|A0A6Q8PGB2_HUMAN E3 ubiquitin-protein ligase LRSAM1 OS=Homo sapiens OX=9606 GN=LRSAM1 PE=1 SV=1	92	QLTALPDDLGQL
QLTALIDDLITL	sp|P0DTC1|R1A_SARS2	323	tr|A0A6Q8PFI6|A0A6Q8PFI6_HUMAN E3 ubiquitin-protein ligase LRSAM1 OS=Homo sapiens OX=9606 GN=LRSAM1 PE=1 SV=1	92	QLTALPDDLGQL
QLTALIDDLITL	sp|P0DTC1|R1A_SARS2	323	tr|A0A6Q8PFW1|A0A6Q8PFW1_HUMAN E3 ubiquitin-protein ligase LRSAM1 OS=Homo sapiens OX=9606 GN=LRSAM1 PE=1 SV=1	92	QLTALPDDLGQL
QLTALIDDLITL	sp|P0DTC1|R1A_SARS2	323	tr|A0A6Q8PH70|A0A6Q8PH70_HUMAN E3 ubiquitin-protein ligase LRSAM1 OS=Homo sapiens OX=9606 GN=LRSAM1 PE=1 SV=1	92	QLTALPDDLGQL
QLTALIDDLITL	sp|P0DTC1|R1A_SARS2	323	tr|A0A6Q8PFT9|A0A6Q8PFT9_HUMAN E3 ubiquitin-protein ligase LRSAM1 OS=Homo sapiens OX=9606 GN=LRSAM1 PE=1 SV=1	92	QLTALPDDLGQL
QLTALIDDLITL	sp|P0DTC1|R1A_SARS2	323	tr|A0A6Q8PGW1|A0A6Q8PGW1_HUMAN E3 ubiquitin-protein ligase LRSAM1 OS=Homo sapiens OX=9606 GN=LRSAM1 PE=1 SV=1	92	QLTALPDDLGQL
QLTALIDDLITL	sp|P0DTC1|R1A_SARS2	323	tr|A0A6Q8PG02|A0A6Q8PG02_HUMAN E3 ubiquitin-protein ligase LRSAM1 OS=Homo sapiens OX=9606 GN=LRSAM1 PE=1 SV=1	73	QLTALPDDLGQL
QLTALIDDLITL	sp|P0DTC1|R1A_SARS2	323	sp|Q6UWE0|LRSM1_HUMAN E3 ubiquitin-protein ligase LRSAM1 OS=Homo sapiens OX=9606 GN=LRSAM1 PE=1 SV=1	92	QLTALPDDLGQL
QLTALIDDLITL	sp|P0DTC1|R1A_SARS2	323	tr|A0A6Q8PGF7|A0A6Q8PGF7_HUMAN E3 ubiquitin-protein ligase LRSAM1 OS=Homo sapiens OX=9606 GN=LRSAM1 PE=1 SV=1	77	QLTALPDDLGQL
QLTALIDDLITL	sp|P0DTC1|R1A_SARS2	323	tr|A0A6Q8PGT8|A0A6Q8PGT8_HUMAN E3 ubiquitin-protein ligase LRSAM1 OS=Homo sapiens OX=9606 GN=LRSAM1 PE=1 SV=1	92	QLTALPDDLGQL
QLTALIDDLITL	sp|P0DTC1|R1A_SARS2	323	tr|A0A6Q8PFL5|A0A6Q8PFL5_HUMAN E3 ubiquitin-protein ligase LRSAM1 OS=Homo sapiens OX=9606 GN=LRSAM1 PE=1 SV=1	92	QLTALPDDLGQL
QLTALIDDLITL	sp|P0DTC1|R1A_SARS2	323	tr|A0A6Q8PFL1|A0A6Q8PFL1_HUMAN E3 ubiquitin-protein ligase LRSAM1 OS=Homo sapiens OX=9606 GN=LRSAM1 PE=1 SV=1	92	QLTALPDDLGQL
QLTALIDDLITL	sp|P0DTC1|R1A_SARS2	323	tr|A0A6Q8PHH6|A0A6Q8PHH6_HUMAN E3 ubiquitin-protein ligase LRSAM1 OS=Homo sapiens OX=9606 GN=LRSAM1 PE=1 SV=1	92	QLTALPDDLGQL
KAWESKNLLAYE	sp|P0DTD1|R1AB_SARS2	529	sp|Q8NCX0|CC150_HUMAN Coiled-coil domain-containing protein 150 OS=Homo sapiens OX=9606 GN=CCDC150 PE=1 SV=2	549	KITESKNKLAYE
TLAGVEATKSGT	sp|P0DTC1|R1A_SARS2	3547	tr|H0Y9K5|H0Y9K5_HUMAN Adhesion G protein-coupled receptor L3 (Fragment) OS=Homo sapiens OX=9606 GN=ADGRL3 PE=1 SV=1	833	TLAGVAATESVT
TLAGVEATKSGT	sp|P0DTC1|R1A_SARS2	3547	tr|E7EUW2|E7EUW2_HUMAN Adhesion G protein-coupled receptor L3 OS=Homo sapiens OX=9606 GN=ADGRL3 PE=1 SV=1	1495	TLAGVAATESVT
TLAGVEATKSGT	sp|P0DTC1|R1A_SARS2	3547	tr|E7EVD6|E7EVD6_HUMAN Adhesion G protein-coupled receptor L3 OS=Homo sapiens OX=9606 GN=ADGRL3 PE=1 SV=1	1443	TLAGVAATESVT
TLAGVEATKSGT	sp|P0DTC1|R1A_SARS2	3547	tr|E7ETE3|E7ETE3_HUMAN Adhesion G protein-coupled receptor L3 OS=Homo sapiens OX=9606 GN=ADGRL3 PE=1 SV=1	1486	TLAGVAATESVT
TLAGVEATKSGT	sp|P0DTC1|R1A_SARS2	3547	sp|Q9HAR2|AGRL3_HUMAN Adhesion G protein-coupled receptor L3 OS=Homo sapiens OX=9606 GN=ADGRL3 PE=1 SV=2	1362	TLAGVAATESVT
TLAGVEATKSGT	sp|P0DTC1|R1A_SARS2	3547	tr|E7EW95|E7EW95_HUMAN Adhesion G protein-coupled receptor L3 OS=Homo sapiens OX=9606 GN=ADGRL3 PE=1 SV=1	1427	TLAGVAATESVT
TLAGVEATKSGT	sp|P0DTC1|R1A_SARS2	3547	tr|E9PBG4|E9PBG4_HUMAN Adhesion G protein-coupled receptor L3 OS=Homo sapiens OX=9606 GN=ADGRL3 PE=1 SV=1	1418	TLAGVAATESVT
YNAKQNKVDQKV	sp|P0DTC9|NCAP_SARS2	380	sp|Q32P41|TRM5_HUMAN tRNA (guanine(37)-N1)-methyltransferase OS=Homo sapiens OX=9606 GN=TRMT5 PE=1 SV=2	338	YNCKLNKVDQKV
NAKQNKVDQKVP	sp|P0DTC9|NCAP_SARS2	381	sp|Q32P41|TRM5_HUMAN tRNA (guanine(37)-N1)-methyltransferase OS=Homo sapiens OX=9606 GN=TRMT5 PE=1 SV=2	339	NCKLNKVDQKVK
FTQGVTKNVFKA	sp|P0DTD1|R1AB_SARS2	5853	sp|Q96P88|GNRR2_HUMAN Putative gonadotropin-releasing hormone II receptor OS=Homo sapiens OX=9606 GN=GNRHR2 PE=5 SV=4	98	FTQCVTKGSFKA
ALEGLAKTSGLK	sp|P0DTD1|R1AB_SARS2	6632	sp|Q8N412|STPG2_HUMAN Sperm-tail PG-rich repeat-containing protein 2 OS=Homo sapiens OX=9606 GN=STPG2 PE=2 SV=1	225	ALKSLKKTSGLK
KTIASFLNVQAT	sp|P0DTD1|R1AB_SARS2	2254	sp|Q9UP83|COG5_HUMAN Conserved oligomeric Golgi complex subunit 5 OS=Homo sapiens OX=9606 GN=COG5 PE=1 SV=3	519	KTIASELNVAAV
EVILAFIAQDMT	sp|P0DTC1|R1A_SARS2	1274	sp|Q04771|ACVR1_HUMAN Activin receptor type-1 OS=Homo sapiens OX=9606 GN=ACVR1 PE=1 SV=1	260	ENILGFIASDMT
DTNYLYAAIKHC	sp|P0DTD1|R1AB_SARS2	5598	sp|Q86VV4|RNB3L_HUMAN Ran-binding protein 3-like OS=Homo sapiens OX=9606 GN=RANBP3L PE=1 SV=2	394	DTAYLYAAIHHR
QCYTSPLVAEHF	sp|P0DTC1|R1A_SARS2	430	sp|Q9UN42|AT1B4_HUMAN Protein ATP1B4 OS=Homo sapiens OX=9606 GN=ATP1B4 PE=1 SV=1	305	VNYTSPLVAMHF
QCYTSPLVAEHF	sp|P0DTC1|R1A_SARS2	430	tr|B7ZKW0|B7ZKW0_HUMAN Sodium/potassium-transporting ATPase subunit beta OS=Homo sapiens OX=9606 GN=ATP1B4 PE=1 SV=1	262	VNYTSPLVAMHF
LLLARTESLTVL	sp|P0DTC7|NS7A_SARS2	47	sp|P98161|PKD1_HUMAN Polycystin-1 OS=Homo sapiens OX=9606 GN=PKD1 PE=1 SV=3	770	RLLAATEQLTVL
SQFELLDAVLTA	sp|P0DTC1|R1A_SARS2	1941	tr|A0A1W2PQD6|A0A1W2PQD6_HUMAN Uncharacterized protein OS=Homo sapiens OX=9606 PE=1 SV=1	171	SQFVGLMAVLTA
SQFELLDAVLTA	sp|P0DTC1|R1A_SARS2	1941	tr|A0A1W2PS77|A0A1W2PS77_HUMAN Uncharacterized protein OS=Homo sapiens OX=9606 PE=1 SV=1	171	SQFVGLMAVLTA
SQFELLDAVLTA	sp|P0DTC1|R1A_SARS2	1941	tr|A0A1W2PQH2|A0A1W2PQH2_HUMAN UDP-N-acetylglucosamine transporter OS=Homo sapiens OX=9606 GN=SLC35A3 PE=1 SV=1	171	SQFVGLMAVLTA
SQFELLDAVLTA	sp|P0DTC1|R1A_SARS2	1941	tr|A0A1W2PNF0|A0A1W2PNF0_HUMAN UDP-N-acetylglucosamine transporter OS=Homo sapiens OX=9606 GN=SLC35A3 PE=1 SV=1	130	SQFVGLMAVLTA
SQFELLDAVLTA	sp|P0DTC1|R1A_SARS2	1941	tr|A0A1W2PQ60|A0A1W2PQ60_HUMAN UDP-N-acetylglucosamine transporter OS=Homo sapiens OX=9606 GN=SLC35A3 PE=1 SV=1	171	SQFVGLMAVLTA
SQFELLDAVLTA	sp|P0DTC1|R1A_SARS2	1941	tr|A0A1W2PS45|A0A1W2PS45_HUMAN Uncharacterized protein OS=Homo sapiens OX=9606 PE=1 SV=1	130	SQFVGLMAVLTA
SQFELLDAVLTA	sp|P0DTC1|R1A_SARS2	1941	tr|A0A1W2PPG9|A0A1W2PPG9_HUMAN Uncharacterized protein OS=Homo sapiens OX=9606 PE=1 SV=1	171	SQFVGLMAVLTA
SQFELLDAVLTA	sp|P0DTC1|R1A_SARS2	1941	tr|A0A1W2PPE6|A0A1W2PPE6_HUMAN Uncharacterized protein OS=Homo sapiens OX=9606 PE=1 SV=1	171	SQFVGLMAVLTA
SQFELLDAVLTA	sp|P0DTC1|R1A_SARS2	1941	tr|A0A1W2PNY6|A0A1W2PNY6_HUMAN UDP-N-acetylglucosamine transporter OS=Homo sapiens OX=9606 GN=SLC35A3 PE=1 SV=1	171	SQFVGLMAVLTA
SQFELLDAVLTA	sp|P0DTC1|R1A_SARS2	1941	sp|Q9Y2D2|S35A3_HUMAN UDP-N-acetylglucosamine transporter OS=Homo sapiens OX=9606 GN=SLC35A3 PE=1 SV=1	171	SQFVGLMAVLTA
SQFELLDAVLTA	sp|P0DTC1|R1A_SARS2	1941	tr|A0A1W2PRT7|A0A1W2PRT7_HUMAN UDP-N-acetylglucosamine transporter OS=Homo sapiens OX=9606 GN=SLC35A3 PE=1 SV=1	130	SQFVGLMAVLTA
SQFELLDAVLTA	sp|P0DTC1|R1A_SARS2	1941	tr|A0A1W2PSD1|A0A1W2PSD1_HUMAN UDP-N-acetylglucosamine transporter OS=Homo sapiens OX=9606 GN=SLC35A3 PE=1 SV=1	171	SQFVGLMAVLTA
SQFELLDAVLTA	sp|P0DTC1|R1A_SARS2	1941	tr|A0A1W2PQL8|A0A1W2PQL8_HUMAN UDP-N-acetylglucosamine transporter OS=Homo sapiens OX=9606 GN=SLC35A3 PE=1 SV=1	130	SQFVGLMAVLTA
SQFELLDAVLTA	sp|P0DTC1|R1A_SARS2	1941	tr|A0A1W2PSA9|A0A1W2PSA9_HUMAN MFS domain-containing protein OS=Homo sapiens OX=9606 PE=1 SV=1	171	SQFVGLMAVLTA
SQFELLDAVLTA	sp|P0DTC1|R1A_SARS2	1941	tr|A0A1W2PQ13|A0A1W2PQ13_HUMAN Uncharacterized protein OS=Homo sapiens OX=9606 PE=1 SV=1	171	SQFVGLMAVLTA
SQFELLDAVLTA	sp|P0DTC1|R1A_SARS2	1941	tr|A0A1W2PPH4|A0A1W2PPH4_HUMAN UDP-N-acetylglucosamine transporter OS=Homo sapiens OX=9606 GN=SLC35A3 PE=1 SV=1	171	SQFVGLMAVLTA
SQFELLDAVLTA	sp|P0DTC1|R1A_SARS2	1941	tr|A0A1W2PRN3|A0A1W2PRN3_HUMAN UDP-N-acetylglucosamine transporter OS=Homo sapiens OX=9606 GN=SLC35A3 PE=1 SV=1	171	SQFVGLMAVLTA
LVKLYNLLKNLS	sp|P0DTC1|R1A_SARS2	4073	sp|Q6ZRQ5|MMS22_HUMAN Protein MMS22-like OS=Homo sapiens OX=9606 GN=MMS22L PE=1 SV=3	853	LVKLTRLLFNLS
LVKLYNLLKNLS	sp|P0DTC1|R1A_SARS2	4073	tr|E2QRD4|E2QRD4_HUMAN Methyl methanesulfonate-sensitivity protein 22-like OS=Homo sapiens OX=9606 GN=MMS22L PE=1 SV=1	813	LVKLTRLLFNLS
LYVLSDFSGFLV	sp|P0DTD1|R1AB_SARS2	314	sp|Q03692|COAA1_HUMAN Collagen alpha-1(X) chain OS=Homo sapiens OX=9606 GN=COL10A1 PE=1 SV=2	666	EYVHSSFSGFLV
CYTSPLVAEHFE	sp|P0DTC1|R1A_SARS2	431	sp|Q9UN42|AT1B4_HUMAN Protein ATP1B4 OS=Homo sapiens OX=9606 GN=ATP1B4 PE=1 SV=1	306	NYTSPLVAMHFT
CYTSPLVAEHFE	sp|P0DTC1|R1A_SARS2	431	tr|B7ZKW0|B7ZKW0_HUMAN Sodium/potassium-transporting ATPase subunit beta OS=Homo sapiens OX=9606 GN=ATP1B4 PE=1 SV=1	263	NYTSPLVAMHFT
PDEVPLNAPGFL	sp|P0DTD1|R1AB_SARS2	4887	sp|Q8NFZ4|NLGN2_HUMAN Neuroligin-2 OS=Homo sapiens OX=9606 GN=NLGN2 PE=1 SV=1	777	PDDVPLLAPGAL
KGVLYLRCYGLV	sp|P0DTC8|NS8_SARS2	85	tr|J3QRD5|J3QRD5_HUMAN Mannose-P-dolichol utilization defect 1 protein (Fragment) OS=Homo sapiens OX=9606 GN=MPDU1 PE=1 SV=8	129	KGVAFLACYGLV
KGVLYLRCYGLV	sp|P0DTC8|NS8_SARS2	85	sp|O75352|MPU1_HUMAN Mannose-P-dolichol utilization defect 1 protein OS=Homo sapiens OX=9606 GN=MPDU1 PE=1 SV=2	129	KGVAFLACYGLV
