query	query_seqname	query_start	target_seqname	target_start	target
ASDSEGSSAPEQ	sp|F5HHS3|UL124_HCMVM	16	tr|I3L3Q8|I3L3Q8_HUMAN Serine/arginine repetitive matrix protein 2 (Fragment) OS=Homo sapiens OX=9606 GN=SRRM2 PE=1 SV=1	163	SSDSEGSSLPVQ
ASDSEGSSAPEQ	sp|F5HHS3|UL124_HCMVM	16	sp|Q9UQ35|SRRM2_HUMAN Serine/arginine repetitive matrix protein 2 OS=Homo sapiens OX=9606 GN=SRRM2 PE=1 SV=2	2560	SSDSEGSSLPVQ
ATYPPSPGPATR	sp|Q6SW04|IRS1_HCMVM	244	sp|Q6SPF0|SAMD1_HUMAN Atherin OS=Homo sapiens OX=9606 GN=SAMD1 PE=1 SV=1	156	ATAPPSPGPAQP
LAAAPAATPALA	sp|Q6SW04|IRS1_HCMVM	162	tr|F8WEG7|F8WEG7_HUMAN Splicing factor 1 OS=Homo sapiens OX=9606 GN=SF1 PE=1 SV=1	40	VAAAAAATPAAA
LAAAPAATPALA	sp|Q6SW04|IRS1_HCMVM	162	tr|E9PM67|E9PM67_HUMAN Inner centromere protein (Fragment) OS=Homo sapiens OX=9606 GN=INCENP PE=1 SV=1	128	AAAAAAATMALA
LAAAPAATPALA	sp|Q6SW04|IRS1_HCMVM	162	sp|Q9NQS7|INCE_HUMAN Inner centromere protein OS=Homo sapiens OX=9606 GN=INCENP PE=1 SV=3	128	AAAAAAATMALA
LAAAPAATPALA	sp|Q6SW04|IRS1_HCMVM	162	sp|P0C7V6|SP202_HUMAN Putative transcription factor SPT20 homolog-like 2 OS=Homo sapiens OX=9606 GN=SUPT20HL2 PE=5 SV=1	507	PAPAPAAAPALA
LAAAPAATPALA	sp|Q6SW04|IRS1_HCMVM	162	sp|Q6ZUT6|CCD9B_HUMAN Coiled-coil domain-containing protein 9B OS=Homo sapiens OX=9606 GN=CCDC9B PE=1 SV=1	380	LGSAPAASPALA
LAAAPAATPALA	sp|Q6SW04|IRS1_HCMVM	162	tr|A0A0A0MR59|A0A0A0MR59_HUMAN Pumilio homolog 2 OS=Homo sapiens OX=9606 GN=PUM2 PE=1 SV=1	353	LAAAAAANPTLA
LAAAPAATPALA	sp|Q6SW04|IRS1_HCMVM	162	tr|A0A0C4DG68|A0A0C4DG68_HUMAN Pumilio homolog 2 (Fragment) OS=Homo sapiens OX=9606 GN=PUM2 PE=1 SV=1	300	LAAAAAANPTLA
LAAAPAATPALA	sp|Q6SW04|IRS1_HCMVM	162	sp|Q8TB72|PUM2_HUMAN Pumilio homolog 2 OS=Homo sapiens OX=9606 GN=PUM2 PE=1 SV=2	409	LAAAAAANPTLA
LAAAPAATPALA	sp|Q6SW04|IRS1_HCMVM	162	sp|Q86Y97|KMT5C_HUMAN Histone-lysine N-methyltransferase KMT5C OS=Homo sapiens OX=9606 GN=KMT5C PE=1 SV=1	409	LAPAPPATPAPA
LAAAPAATPALA	sp|Q6SW04|IRS1_HCMVM	162	tr|A0A0D9SF94|A0A0D9SF94_HUMAN [histone H4]-N-methyl-L-lysine20 N-methyltransferase KMT5B OS=Homo sapiens OX=9606 GN=KMT5C PE=1 SV=1	294	LAPAPPATPAPA
HKTSCDSDSLST	sp|F5HC33|US09_HCMVM	105	tr|F5GXG5|F5GXG5_HUMAN Exophilin-5 (Fragment) OS=Homo sapiens OX=9606 GN=EXPH5 PE=1 SV=1	682	HKTSCDSLDLSS
HKTSCDSDSLST	sp|F5HC33|US09_HCMVM	105	tr|E9PPH6|E9PPH6_HUMAN Exophilin-5 (Fragment) OS=Homo sapiens OX=9606 GN=EXPH5 PE=1 SV=1	794	HKTSCDSLDLSS
HKTSCDSDSLST	sp|F5HC33|US09_HCMVM	105	sp|Q8NEV8|EXPH5_HUMAN Exophilin-5 OS=Homo sapiens OX=9606 GN=EXPH5 PE=1 SV=3	870	HKTSCDSLDLSS
SSTASGLEFSSP	sp|F5HD92|US14_HCMVM	30	tr|A0A669KB10|A0A669KB10_HUMAN Golgi-specific brefeldin A-resistance guanine nucleotide exchange factor 1 OS=Homo sapiens OX=9606 GN=GBF1 PE=1 SV=1	313	PSTDSGLEFSSQ
SSTASGLEFSSP	sp|F5HD92|US14_HCMVM	30	sp|Q92538|GBF1_HUMAN Golgi-specific brefeldin A-resistance guanine nucleotide exchange factor 1 OS=Homo sapiens OX=9606 GN=GBF1 PE=1 SV=2	288	PSTDSGLEFSSQ
SSTASGLEFSSP	sp|F5HD92|US14_HCMVM	30	tr|A0A669KBG8|A0A669KBG8_HUMAN Golgi-specific brefeldin A-resistance guanine nucleotide exchange factor 1 OS=Homo sapiens OX=9606 GN=GBF1 PE=1 SV=1	321	PSTDSGLEFSSQ
RRGLHRQVAGLF	sp|Q6SWB7|UL14_HCMVM	23	sp|Q9BQS8|FYCO1_HUMAN FYVE and coiled-coil domain-containing protein 1 OS=Homo sapiens OX=9606 GN=FYCO1 PE=1 SV=3	944	REGLERQVAGLQ
AYQKVLELKTNL	sp|F5HDK1|US27_HCMVM	345	tr|B1AHC5|B1AHC5_HUMAN PHD finger protein 21B OS=Homo sapiens OX=9606 GN=PHF21B PE=1 SV=1	253	AVQKCLELKTSL
AYQKVLELKTNL	sp|F5HDK1|US27_HCMVM	345	sp|Q96EK2|PF21B_HUMAN PHD finger protein 21B OS=Homo sapiens OX=9606 GN=PHF21B PE=1 SV=1	457	AVQKCLELKTSL
PTLTQLLNKDLL	sp|F5HC79|TRM1_HCMVM	566	tr|F5H422|F5H422_HUMAN Nesprin-1 OS=Homo sapiens OX=9606 GN=SYNE1 PE=1 SV=1	9	STSTQLLFKDLL
PTLTQLLNKDLL	sp|F5HC79|TRM1_HCMVM	566	tr|H0YFT4|H0YFT4_HUMAN Nesprin-1 (Fragment) OS=Homo sapiens OX=9606 GN=SYNE1 PE=1 SV=1	8	STSTQLLFKDLL
ESFLRRENLRLN	sp|F5HA06|UL147_HCMVM	33	tr|A0A590UJE1|A0A590UJE1_HUMAN Misshapen-like kinase 1 (Fragment) OS=Homo sapiens OX=9606 GN=MINK1 PE=1 SV=1	343	ESTLRREFLRLQ
ESFLRRENLRLN	sp|F5HA06|UL147_HCMVM	33	tr|I3L2I2|I3L2I2_HUMAN Misshapen-like kinase 1 (Fragment) OS=Homo sapiens OX=9606 GN=MINK1 PE=1 SV=1	211	ESTLRREFLRLQ
ESFLRRENLRLN	sp|F5HA06|UL147_HCMVM	33	sp|Q8N4C8|MINK1_HUMAN Misshapen-like kinase 1 OS=Homo sapiens OX=9606 GN=MINK1 PE=1 SV=2	348	ESTLRREFLRLQ
KAVSFLGLLPTY	sp|Q6SW55|UL87_HCMVM	719	sp|Q8NBB2|STAS1_HUMAN Putative uncharacterized protein ST20-AS1 OS=Homo sapiens OX=9606 GN=ST20-AS1 PE=5 SV=1	20	KAVSHLRLLPTA
LTAGAPGLDVPG	sp|F5HDQ6|DNBI_HCMVM	525	tr|A0A499FJE4|A0A499FJE4_HUMAN RIPOR family member 3 OS=Homo sapiens OX=9606 GN=RIPOR3 PE=1 SV=1	615	LTAGAPELDVLL
LTAGAPGLDVPG	sp|F5HDQ6|DNBI_HCMVM	525	sp|Q96MK2|RIPR3_HUMAN RIPOR family member 3 OS=Homo sapiens OX=9606 GN=RIPOR3 PE=1 SV=4	611	LTAGAPELDVLL
AFLDDRRTEAEM	tr|U3KRG9|U3KRG9_HCMVM	36	tr|A0A1B0GTM3|A0A1B0GTM3_HUMAN Ceramidase OS=Homo sapiens OX=9606 GN=ASAH1 PE=1 SV=1	309	FFLDDRRTPAKM
AFLDDRRTEAEM	tr|U3KRG9|U3KRG9_HCMVM	36	tr|A0A1B0GV06|A0A1B0GV06_HUMAN Acid ceramidase (Fragment) OS=Homo sapiens OX=9606 GN=ASAH1 PE=1 SV=1	133	FFLDDRRTPAKM
AFLDDRRTEAEM	tr|U3KRG9|U3KRG9_HCMVM	36	tr|E7EMM4|E7EMM4_HUMAN Ceramidase OS=Homo sapiens OX=9606 GN=ASAH1 PE=1 SV=1	303	FFLDDRRTPAKM
AFLDDRRTEAEM	tr|U3KRG9|U3KRG9_HCMVM	36	tr|A0A1B0GUG1|A0A1B0GUG1_HUMAN Ceramidase OS=Homo sapiens OX=9606 GN=ASAH1 PE=1 SV=1	299	FFLDDRRTPAKM
AFLDDRRTEAEM	tr|U3KRG9|U3KRG9_HCMVM	36	tr|A0A1B0GW68|A0A1B0GW68_HUMAN Ceramidase OS=Homo sapiens OX=9606 GN=ASAH1 PE=1 SV=1	307	FFLDDRRTPAKM
AFLDDRRTEAEM	tr|U3KRG9|U3KRG9_HCMVM	36	tr|A0A1B0GUH5|A0A1B0GUH5_HUMAN Ceramidase OS=Homo sapiens OX=9606 GN=ASAH1 PE=1 SV=1	326	FFLDDRRTPAKM
AFLDDRRTEAEM	tr|U3KRG9|U3KRG9_HCMVM	36	tr|A0A1B0GUE3|A0A1B0GUE3_HUMAN Acid ceramidase OS=Homo sapiens OX=9606 GN=ASAH1 PE=1 SV=1	263	FFLDDRRTPAKM
AFLDDRRTEAEM	tr|U3KRG9|U3KRG9_HCMVM	36	tr|A0A1B0GUW4|A0A1B0GUW4_HUMAN Acid ceramidase (Fragment) OS=Homo sapiens OX=9606 GN=ASAH1 PE=1 SV=1	301	FFLDDRRTPAKM
AFLDDRRTEAEM	tr|U3KRG9|U3KRG9_HCMVM	36	tr|A0A1B0GUA4|A0A1B0GUA4_HUMAN Ceramidase OS=Homo sapiens OX=9606 GN=ASAH1 PE=1 SV=1	308	FFLDDRRTPAKM
AFLDDRRTEAEM	tr|U3KRG9|U3KRG9_HCMVM	36	sp|Q13510|ASAH1_HUMAN Acid ceramidase OS=Homo sapiens OX=9606 GN=ASAH1 PE=1 SV=5	328	FFLDDRRTPAKM
AFLDDRRTEAEM	tr|U3KRG9|U3KRG9_HCMVM	36	tr|A0A1B0GTP7|A0A1B0GTP7_HUMAN Acid ceramidase OS=Homo sapiens OX=9606 GN=ASAH1 PE=1 SV=1	221	FFLDDRRTPAKM
AFLDDRRTEAEM	tr|U3KRG9|U3KRG9_HCMVM	36	tr|A0A1B0GTZ5|A0A1B0GTZ5_HUMAN Ceramidase OS=Homo sapiens OX=9606 GN=ASAH1 PE=1 SV=1	319	FFLDDRRTPAKM
ALALVSSLAGLL	sp|F5HDQ6|DNBI_HCMVM	1149	sp|Q7L0J3|SV2A_HUMAN Synaptic vesicle glycoprotein 2A OS=Homo sapiens OX=9606 GN=SV2A PE=1 SV=1	722	ALALGSSLALKL
AYPKAFSDKSVP	sp|Q6SW77|DPOL_HCMVM	1150	sp|Q9P2T0|THEG_HUMAN Testicular haploid expressed gene protein OS=Homo sapiens OX=9606 GN=THEG PE=1 SV=1	304	ARPKAQSDKCVP
GLLLFREGQHGL	sp|Q6SW82|UL49_HCMVM	50	tr|A0A2P0CT92|A0A2P0CT92_HUMAN Contactin-associated protein-like 3B OS=Homo sapiens OX=9606 GN=CNTNAP3B PE=4 SV=1	219	GILLHREGQHGN
GLLLFREGQHGL	sp|Q6SW82|UL49_HCMVM	50	tr|F2Z2X5|F2Z2X5_HUMAN Contactin-associated protein-like 3B OS=Homo sapiens OX=9606 GN=CNTNAP3B PE=1 SV=1	219	GILLHREGQHGN
GLLLFREGQHGL	sp|Q6SW82|UL49_HCMVM	50	tr|A0A087WUG9|A0A087WUG9_HUMAN Contactin-associated protein-like 3B OS=Homo sapiens OX=9606 GN=CNTNAP3B PE=1 SV=1	219	GILLHREGQHGN
GLLLFREGQHGL	sp|Q6SW82|UL49_HCMVM	50	tr|A0A087WZ03|A0A087WZ03_HUMAN Contactin-associated protein-like 3B OS=Homo sapiens OX=9606 GN=CNTNAP3B PE=1 SV=1	219	GILLHREGQHGN
GLLLFREGQHGL	sp|Q6SW82|UL49_HCMVM	50	sp|Q96NU0|CNT3B_HUMAN Contactin-associated protein-like 3B OS=Homo sapiens OX=9606 GN=CNTNAP3B PE=2 SV=3	219	GILLHREGQHGN
GLLLFREGQHGL	sp|Q6SW82|UL49_HCMVM	50	tr|A0A087WXL9|A0A087WXL9_HUMAN Contactin-associated protein-like 3B OS=Homo sapiens OX=9606 GN=CNTNAP3B PE=1 SV=1	219	GILLHREGQHGN
GLLLFREGQHGL	sp|Q6SW82|UL49_HCMVM	50	tr|A0A087X119|A0A087X119_HUMAN Contactin-associated protein-like 3B OS=Homo sapiens OX=9606 GN=CNTNAP3B PE=1 SV=1	219	GILLHREGQHGN
GLLLFREGQHGL	sp|Q6SW82|UL49_HCMVM	50	tr|A0A1B0GTE1|A0A1B0GTE1_HUMAN Contactin-associated protein family member 3C (Fragment) OS=Homo sapiens OX=9606 GN=CNTNAP3C PE=4 SV=1	219	GILLHREGQHGN
GLLLFREGQHGL	sp|Q6SW82|UL49_HCMVM	50	tr|F2Z2X6|F2Z2X6_HUMAN Contactin-associated protein-like 3 OS=Homo sapiens OX=9606 GN=CNTNAP3 PE=1 SV=1	219	GILLHREGQHGN
GLLLFREGQHGL	sp|Q6SW82|UL49_HCMVM	50	tr|B1AMA2|B1AMA2_HUMAN Contactin-associated protein-like 3 OS=Homo sapiens OX=9606 GN=CNTNAP3 PE=1 SV=1	131	GILLHREGQHGN
GLLLFREGQHGL	sp|Q6SW82|UL49_HCMVM	50	sp|Q9BZ76|CNTP3_HUMAN Contactin-associated protein-like 3 OS=Homo sapiens OX=9606 GN=CNTNAP3 PE=2 SV=3	219	GILLHREGQHGN
GLLLFREGQHGL	sp|Q6SW82|UL49_HCMVM	50	tr|B1AM99|B1AM99_HUMAN Contactin-associated protein-like 3 OS=Homo sapiens OX=9606 GN=CNTNAP3 PE=1 SV=1	219	GILLHREGQHGN
GLLLFREGQHGL	sp|Q6SW82|UL49_HCMVM	50	tr|A6NC89|A6NC89_HUMAN Contactin-associated protein-like 3 OS=Homo sapiens OX=9606 GN=CNTNAP3 PE=1 SV=2	219	GILLHREGQHGN
ILARTVAATDLA	sp|F5HET1|UL78_HCMVM	57	sp|Q9UQ16|DYN3_HUMAN Dynamin-3 OS=Homo sapiens OX=9606 GN=DNM3 PE=1 SV=4	171	ILAVTPANTDLA
ILARTVAATDLA	sp|F5HET1|UL78_HCMVM	57	tr|E5RIK2|E5RIK2_HUMAN Dynamin GTPase (Fragment) OS=Homo sapiens OX=9606 GN=DNM3 PE=1 SV=1	61	ILAVTPANTDLA
ILARTVAATDLA	sp|F5HET1|UL78_HCMVM	57	tr|E5RHK8|E5RHK8_HUMAN Dynamin GTPase OS=Homo sapiens OX=9606 GN=DNM3 PE=1 SV=1	171	ILAVTPANTDLA
SALSVLSPESSV	sp|F7V998|U150A_HCMVM	167	tr|H7C436|H7C436_HUMAN Inositol hexakisphosphate and diphosphoinositol-pentakisphosphate kinase 1 (Fragment) OS=Homo sapiens OX=9606 GN=PPIP5K1 PE=1 SV=1	36	SRSSVYSPESSV
SALSVLSPESSV	sp|F7V998|U150A_HCMVM	167	sp|Q6PFW1|VIP1_HUMAN Inositol hexakisphosphate and diphosphoinositol-pentakisphosphate kinase 1 OS=Homo sapiens OX=9606 GN=PPIP5K1 PE=1 SV=1	228	SRSSVYSPESSV
SALSVLSPESSV	sp|F7V998|U150A_HCMVM	167	tr|F8W9A8|F8W9A8_HUMAN Inositol hexakisphosphate and diphosphoinositol-pentakisphosphate kinase OS=Homo sapiens OX=9606 GN=PPIP5K1 PE=1 SV=1	228	SRSSVYSPESSV
SALSVLSPESSV	sp|F7V998|U150A_HCMVM	167	tr|B7WPL9|B7WPL9_HUMAN Inositol hexakisphosphate and diphosphoinositol-pentakisphosphate kinase OS=Homo sapiens OX=9606 GN=PPIP5K1 PE=1 SV=1	228	SRSSVYSPESSV
QRVSTLLTLAAT	sp|Q6SW05|UL150_HCMVM	233	tr|F8WCS8|F8WCS8_HUMAN Alpha-N-acetylneuraminide alpha-2,8-sialyltransferase OS=Homo sapiens OX=9606 GN=ST8SIA1 PE=4 SV=1	78	FSVSTLLTLAAH
KPGKAPGTYAEG	sp|Q6SW04|IRS1_HCMVM	451	sp|Q8IUX7|AEBP1_HUMAN Adipocyte enhancer-binding protein 1 OS=Homo sapiens OX=9606 GN=AEBP1 PE=1 SV=1	74	KPGKRPGTAAEV
KPGKAPGTYAEG	sp|Q6SW04|IRS1_HCMVM	451	tr|H7C3D7|H7C3D7_HUMAN Adipocyte enhancer-binding protein 1 (Fragment) OS=Homo sapiens OX=9606 GN=AEBP1 PE=1 SV=1	32	KPGKRPGTAAEV
RRMELIVKKSRD	sp|F5HC71|IL10H_HCMVM	109	sp|Q9H2X9|S12A5_HUMAN Solute carrier family 12 member 5 OS=Homo sapiens OX=9606 GN=SLC12A5 PE=1 SV=3	1078	RLNEVIVKKSRD
RVPCSVHAVVAP	sp|F5HF35|UL136_HCMVM	54	sp|Q4ZG55|GREB1_HUMAN Protein GREB1 OS=Homo sapiens OX=9606 GN=GREB1 PE=2 SV=1	953	RVPCSPLAVVAY
IAIFVGILSFLF	sp|Q6SW43|GM_HCMVM	252	sp|Q9Y225|RNF24_HUMAN RING finger protein 24 OS=Homo sapiens OX=9606 GN=RNF24 PE=1 SV=1	31	TAIFVFILSLLF
IAIFVGILSFLF	sp|Q6SW43|GM_HCMVM	252	tr|K7EQ23|K7EQ23_HUMAN NPC intracellular cholesterol transporter 1 (Fragment) OS=Homo sapiens OX=9606 GN=NPC1 PE=1 SV=1	532	IAIFVGVLSFSI
IAIFVGILSFLF	sp|Q6SW43|GM_HCMVM	252	sp|O15118|NPC1_HUMAN NPC intracellular cholesterol transporter 1 OS=Homo sapiens OX=9606 GN=NPC1 PE=1 SV=2	839	IAIFVGVLSFSI
LSPDATKSLLAL	sp|F5HAR3|US19_HCMVM	131	sp|Q8TDF6|GRP4_HUMAN RAS guanyl-releasing protein 4 OS=Homo sapiens OX=9606 GN=RASGRP4 PE=1 SV=2	312	LSPDSTKALLEL
LSPDATKSLLAL	sp|F5HAR3|US19_HCMVM	131	tr|C0LTP6|C0LTP6_HUMAN RAS guanyl releasing protein 4 variant 9 OS=Homo sapiens OX=9606 GN=RASGRP4 PE=1 SV=1	312	LSPDSTKALLEL
ESIIGECPRCMR	sp|F5HAY6|VICA_HCMVM	186	sp|Q5DJT8|CT452_HUMAN Cancer/testis antigen family 45 member A2 OS=Homo sapiens OX=9606 GN=CT45A2 PE=2 SV=3	163	ESIIKEAARCMR
ESIIGECPRCMR	sp|F5HAY6|VICA_HCMVM	186	sp|Q8NHU0|CT453_HUMAN Cancer/testis antigen family 45 member A3 OS=Homo sapiens OX=9606 GN=CT45A3 PE=1 SV=1	163	ESIIKEAARCMR
ESIIGECPRCMR	sp|F5HAY6|VICA_HCMVM	186	sp|P0DMU8|CT455_HUMAN Cancer/testis antigen family 45 member A5 OS=Homo sapiens OX=9606 GN=CT45A5 PE=2 SV=1	163	ESIIKEAARCMR
ESIIGECPRCMR	sp|F5HAY6|VICA_HCMVM	186	sp|P0DMU9|CT45A_HUMAN Cancer/testis antigen family 45 member A10 OS=Homo sapiens OX=9606 GN=CT45A10 PE=1 SV=1	163	ESIIKEAARCMR
ESIIGECPRCMR	sp|F5HAY6|VICA_HCMVM	186	sp|Q5HYN5|CT451_HUMAN Cancer/testis antigen family 45 member A1 OS=Homo sapiens OX=9606 GN=CT45A1 PE=1 SV=1	163	ESIIKEAARCMR
ESIIGECPRCMR	sp|F5HAY6|VICA_HCMVM	186	sp|P0DMU7|CT456_HUMAN Cancer/testis antigen family 45 member A6 OS=Homo sapiens OX=9606 GN=CT45A6 PE=2 SV=1	163	ESIIKEAARCMR
ESIIGECPRCMR	sp|F5HAY6|VICA_HCMVM	186	sp|P0DMV1|CT458_HUMAN Cancer/testis antigen family 45 member A8 OS=Homo sapiens OX=9606 GN=CT45A8 PE=3 SV=1	163	ESIIKEAARCMR
ESIIGECPRCMR	sp|F5HAY6|VICA_HCMVM	186	sp|P0DMV2|CT459_HUMAN Cancer/testis antigen family 45 member A9 OS=Homo sapiens OX=9606 GN=CT45A9 PE=3 SV=1	163	ESIIKEAARCMR
ESIIGECPRCMR	sp|F5HAY6|VICA_HCMVM	186	sp|P0DMV0|CT457_HUMAN Cancer/testis antigen family 45 member A7 OS=Homo sapiens OX=9606 GN=CT45A7 PE=3 SV=1	163	ESIIKEAARCMR
AWAVRLITRGSA	sp|F5HIG1|HEPA_HCMVM	122	tr|A0A0U1RQT0|A0A0U1RQT0_HUMAN Glutamine--tRNA ligase (Fragment) OS=Homo sapiens OX=9606 GN=QARS1 PE=1 SV=1	315	AWAVELIRRGLA
AWAVRLITRGSA	sp|F5HIG1|HEPA_HCMVM	122	tr|A0A0U1RQQ5|A0A0U1RQQ5_HUMAN Glutamine--tRNA ligase (Fragment) OS=Homo sapiens OX=9606 GN=QARS1 PE=1 SV=2	7	AWAVELIRRGLA
AWAVRLITRGSA	sp|F5HIG1|HEPA_HCMVM	122	sp|P47897|SYQ_HUMAN Glutamine--tRNA ligase OS=Homo sapiens OX=9606 GN=QARS1 PE=1 SV=1	344	AWAVELIRRGLA
AWAVRLITRGSA	sp|F5HIG1|HEPA_HCMVM	122	tr|B4DDN1|B4DDN1_HUMAN Glutaminyl-tRNA synthetase OS=Homo sapiens OX=9606 GN=QARS1 PE=1 SV=1	199	AWAVELIRRGLA
AWAVRLITRGSA	sp|F5HIG1|HEPA_HCMVM	122	tr|A0A1B0GVU9|A0A1B0GVU9_HUMAN Glutaminyl-tRNA synthetase (Fragment) OS=Homo sapiens OX=9606 GN=QARS1 PE=1 SV=1	288	AWAVELIRRGLA
YLRARSPEEGLR	sp|F5HCH8|GL_HCMVM	230	tr|K7ELW3|K7ELW3_HUMAN Epidermal growth factor receptor kinase substrate 8-like protein 1 OS=Homo sapiens OX=9606 GN=EPS8L1 PE=1 SV=1	357	ELRAVSPEEGAR
YLRARSPEEGLR	sp|F5HCH8|GL_HCMVM	230	tr|B4DKV7|B4DKV7_HUMAN Epidermal growth factor receptor kinase substrate 8-like protein 1 OS=Homo sapiens OX=9606 GN=EPS8L1 PE=1 SV=1	607	ELRAVSPEEGAR
YLRARSPEEGLR	sp|F5HCH8|GL_HCMVM	230	sp|Q8TE68|ES8L1_HUMAN Epidermal growth factor receptor kinase substrate 8-like protein 1 OS=Homo sapiens OX=9606 GN=EPS8L1 PE=1 SV=3	671	ELRAVSPEEGAR
SRGRAQTRAAGA	sp|Q6SW66|UL76_HCMVM	50	sp|A5PLN7|F149A_HUMAN Protein FAM149A OS=Homo sapiens OX=9606 GN=FAM149A PE=2 SV=2	79	SRGSAASRAAGA
LPLLTLLYLIMV	sp|F5HE44|US12_HCMVM	198	sp|Q6UX01|LMBRL_HUMAN Protein LMBR1L OS=Homo sapiens OX=9606 GN=LMBR1L PE=1 SV=2	158	LMLLTLLVLGMV
EGYGLRVSTGLL	sp|F5HF49|AN_HCMVM	548	tr|I3L1H9|I3L1H9_HUMAN Zymogen granule protein 16 homolog B (Fragment) OS=Homo sapiens OX=9606 GN=ZG16B PE=1 SV=1	54	EITGLRVSVGLL
EGYGLRVSTGLL	sp|F5HF49|AN_HCMVM	548	tr|I3L3X0|I3L3X0_HUMAN Zymogen granule protein 16 homolog B (Fragment) OS=Homo sapiens OX=9606 GN=ZG16B PE=1 SV=1	72	EITGLRVSVGLL
EGYGLRVSTGLL	sp|F5HF49|AN_HCMVM	548	sp|Q96DA0|ZG16B_HUMAN Zymogen granule protein 16 homolog B OS=Homo sapiens OX=9606 GN=ZG16B PE=1 SV=3	73	EITGLRVSVGLL
EGYGLRVSTGLL	sp|F5HF49|AN_HCMVM	548	tr|A0A0C4DGN4|A0A0C4DGN4_HUMAN Zymogen granule protein 16 homolog B OS=Homo sapiens OX=9606 GN=ZG16B PE=1 SV=1	43	EITGLRVSVGLL
LGRTLIALLANL	sp|C1BEG3|UL74A_HCMVM	58	sp|O14893|GEMI2_HUMAN Gem-associated protein 2 OS=Homo sapiens OX=9606 GN=GEMIN2 PE=1 SV=1	211	LGRWLYALLACL
LGRTLIALLANL	sp|C1BEG3|UL74A_HCMVM	58	tr|A0A3B3IU42|A0A3B3IU42_HUMAN Gem-associated protein 2 OS=Homo sapiens OX=9606 GN=GEMIN2 PE=1 SV=1	200	LGRWLYALLACL
IVLIVLTWTCAI	sp|F5HHT6|US21_HCMVM	183	sp|Q9P2W7|B3GA1_HUMAN Galactosylgalactosylxylosylprotein 3-beta-glucuronosyltransferase 1 OS=Homo sapiens OX=9606 GN=B3GAT1 PE=1 SV=2	10	IVLIVLPWTLLI
SPHLSLEESCSE	sp|F5HI87|CEP3_HCMVM	26	tr|A0A286YEY4|A0A286YEY4_HUMAN Immunoglobulin heavy constant gamma 2 (Fragment) OS=Homo sapiens OX=9606 GN=IGHG2 PE=1 SV=1	323	SPELQLEESCAE
SPHLSLEESCSE	sp|F5HI87|CEP3_HCMVM	26	tr|A0A0A0MS08|A0A0A0MS08_HUMAN Immunoglobulin heavy constant gamma 1 (Fragment) OS=Homo sapiens OX=9606 GN=IGHG1 PE=1 SV=1	327	SPELQLEESCAE
SPHLSLEESCSE	sp|F5HI87|CEP3_HCMVM	26	tr|A0A286YES1|A0A286YES1_HUMAN Immunoglobulin heavy constant gamma 3 (Fragment) OS=Homo sapiens OX=9606 GN=IGHG3 PE=1 SV=1	374	SPELQLEESCAE
TEPAAKPRLLPS	sp|F5HHS3|UL124_HCMVM	136	sp|Q9HCU0|CD248_HUMAN Endosialin OS=Homo sapiens OX=9606 GN=CD248 PE=1 SV=1	612	TQPAALPTLLPS
TPLLELAELQPP	sp|Q6SW99|PP150_HCMVM	411	sp|Q9UJX2|CDC23_HUMAN Cell division cycle protein 23 homolog OS=Homo sapiens OX=9606 GN=CDC23 PE=1 SV=3	62	LPALPLAELQPP
TPLLELAELQPP	sp|Q6SW99|PP150_HCMVM	411	tr|H0Y936|H0Y936_HUMAN Cell division cycle protein 23 homolog (Fragment) OS=Homo sapiens OX=9606 GN=CDC23 PE=1 SV=1	60	LPALPLAELQPP
TPLLELAELQPP	sp|Q6SW99|PP150_HCMVM	411	tr|D6RCF8|D6RCF8_HUMAN Cell division cycle protein 23 homolog OS=Homo sapiens OX=9606 GN=CDC23 PE=1 SV=1	62	LPALPLAELQPP
QALRLAETRRDE	sp|Q6SW04|IRS1_HCMVM	464	tr|A2RRE0|A2RRE0_HUMAN WD repeat-containing protein 7 OS=Homo sapiens OX=9606 GN=WDR7 PE=1 SV=1	353	QALLLAELRRIE
QALRLAETRRDE	sp|Q6SW04|IRS1_HCMVM	464	sp|Q9Y4E6|WDR7_HUMAN WD repeat-containing protein 7 OS=Homo sapiens OX=9606 GN=WDR7 PE=1 SV=2	1028	QALLLAELRRIE
ERERAWRYEAES	sp|F5HD03|US32_HCMVM	172	tr|A0A669KAW0|A0A669KAW0_HUMAN P-type phospholipid transporter OS=Homo sapiens OX=9606 GN=ATP10A PE=1 SV=1	539	ESERELRYEAES
ERERAWRYEAES	sp|F5HD03|US32_HCMVM	172	tr|A0A669KBE2|A0A669KBE2_HUMAN Phospholipid-transporting ATPase OS=Homo sapiens OX=9606 GN=ATP10A PE=1 SV=1	686	ESERELRYEAES
ERERAWRYEAES	sp|F5HD03|US32_HCMVM	172	sp|O60312|AT10A_HUMAN Phospholipid-transporting ATPase VA OS=Homo sapiens OX=9606 GN=ATP10A PE=1 SV=2	686	ESERELRYEAES
PPGPGAVGDEPY	sp|Q6SVX2|TRS1_HCMVM	472	tr|F8W8L6|F8W8L6_HUMAN Eukaryotic translation initiation factor 2B subunit 4 delta transcript variant 4 OS=Homo sapiens OX=9606 GN=EIF2B4 PE=1 SV=1	21	PPGPGAVGREMT
PPGPGAVGDEPY	sp|Q6SVX2|TRS1_HCMVM	472	tr|A0A087WW69|A0A087WW69_HUMAN Translation initiation factor eIF-2B subunit delta OS=Homo sapiens OX=9606 GN=EIF2B4 PE=1 SV=1	6	PPGPGAVGREMT
PPGPGAVGDEPY	sp|Q6SVX2|TRS1_HCMVM	472	tr|E7ERK9|E7ERK9_HUMAN Translation initiation factor eIF-2B subunit delta OS=Homo sapiens OX=9606 GN=EIF2B4 PE=1 SV=1	42	PPGPGAVGREMT
PPGPGAVGDEPY	sp|Q6SVX2|TRS1_HCMVM	472	sp|Q9UI10|EI2BD_HUMAN Translation initiation factor eIF-2B subunit delta OS=Homo sapiens OX=9606 GN=EIF2B4 PE=1 SV=2	21	PPGPGAVGREMT
PPPPCLLPVREG	sp|Q6SVX2|TRS1_HCMVM	42	tr|A0A0A0MSU2|A0A0A0MSU2_HUMAN Mitotic deacetylase-associated SANT domain protein (Fragment) OS=Homo sapiens OX=9606 GN=MIDEAS PE=1 SV=6	655	TPPPILSPVREG
PPPPCLLPVREG	sp|Q6SVX2|TRS1_HCMVM	42	sp|Q6PJG2|MDEAS_HUMAN Mitotic deacetylase-associated SANT domain protein OS=Homo sapiens OX=9606 GN=MIDEAS PE=1 SV=2	655	TPPPILSPVREG
PPPPCLLPVREG	sp|Q6SVX2|TRS1_HCMVM	42	tr|A0A1C7CYX1|A0A1C7CYX1_HUMAN Mitotic deacetylase-associated SANT domain protein OS=Homo sapiens OX=9606 GN=MIDEAS PE=1 SV=1	655	TPPPILSPVREG
VSNLSLETKKHF	sp|Q6SW99|PP150_HCMVM	846	sp|P23921|RIR1_HUMAN Ribonucleoside-diphosphate reductase large subunit OS=Homo sapiens OX=9606 GN=RRM1 PE=1 SV=1	83	VSNLHKETKKVF
ASSLSSRAPWRH	sp|F5HAM4|US31_HCMVM	15	tr|H0YCH4|H0YCH4_HUMAN Zinc finger protein 692 (Fragment) OS=Homo sapiens OX=9606 GN=ZNF692 PE=1 SV=1	40	ASSLSSRAPPPA
ASSLSSRAPWRH	sp|F5HAM4|US31_HCMVM	15	sp|Q9BU19|ZN692_HUMAN Zinc finger protein 692 OS=Homo sapiens OX=9606 GN=ZNF692 PE=1 SV=1	260	ASSLSSRAPPPA
SYVSAVDYALGL	sp|Q6SW62|SCAF_HCMVM	144	tr|H0YLJ2|H0YLJ2_HUMAN Solute carrier family 12 member 1 (Fragment) OS=Homo sapiens OX=9606 GN=SLC12A1 PE=1 SV=1	472	SYVSALDNALEL
SYVSAVDYALGL	sp|Q6SW62|SCAF_HCMVM	144	tr|A0A2R8Y6V7|A0A2R8Y6V7_HUMAN Solute carrier family 12 member 1 OS=Homo sapiens OX=9606 GN=SLC12A1 PE=1 SV=1	705	SYVSALDNALEL
SYVSAVDYALGL	sp|Q6SW62|SCAF_HCMVM	144	sp|Q13621|S12A1_HUMAN Solute carrier family 12 member 1 OS=Homo sapiens OX=9606 GN=SLC12A1 PE=2 SV=2	659	SYVSALDNALEL
DGPPGPGAVGDE	sp|Q6SVX2|TRS1_HCMVM	470	tr|F8W8L6|F8W8L6_HUMAN Eukaryotic translation initiation factor 2B subunit 4 delta transcript variant 4 OS=Homo sapiens OX=9606 GN=EIF2B4 PE=1 SV=1	19	ELPPGPGAVGRE
DGPPGPGAVGDE	sp|Q6SVX2|TRS1_HCMVM	470	tr|A0A087WW69|A0A087WW69_HUMAN Translation initiation factor eIF-2B subunit delta OS=Homo sapiens OX=9606 GN=EIF2B4 PE=1 SV=1	4	ELPPGPGAVGRE
DGPPGPGAVGDE	sp|Q6SVX2|TRS1_HCMVM	470	tr|E7ERK9|E7ERK9_HUMAN Translation initiation factor eIF-2B subunit delta OS=Homo sapiens OX=9606 GN=EIF2B4 PE=1 SV=1	40	ELPPGPGAVGRE
DGPPGPGAVGDE	sp|Q6SVX2|TRS1_HCMVM	470	sp|Q9UI10|EI2BD_HUMAN Translation initiation factor eIF-2B subunit delta OS=Homo sapiens OX=9606 GN=EIF2B4 PE=1 SV=2	19	ELPPGPGAVGRE
AELSGSSSTESV	sp|Q6SW29|VIE2_HCMVM	241	sp|P49790|NU153_HUMAN Nuclear pore complex protein Nup153 OS=Homo sapiens OX=9606 GN=NUP153 PE=1 SV=2	557	AELSGSSSTLEP
GLAGIYKDNSVS	sp|F5HB53|GB_HCMVM	314	sp|Q9H7N4|SFR19_HUMAN Splicing factor, arginine/serine-rich 19 OS=Homo sapiens OX=9606 GN=SCAF1 PE=1 SV=3	300	TLAGIYDDNSLS
GEFGHVFGGGFG	sp|F5HDQ6|DNBI_HCMVM	1174	sp|P13645|K1C10_HUMAN Keratin, type I cytoskeletal 10 OS=Homo sapiens OX=9606 GN=KRT10 PE=1 SV=6	125	GGFGGGFGGGFG
GEFGHVFGGGFG	sp|F5HDQ6|DNBI_HCMVM	1174	sp|Q2M2I5|K1C24_HUMAN Keratin, type I cytoskeletal 24 OS=Homo sapiens OX=9606 GN=KRT24 PE=1 SV=1	58	GAFGGSFGGGFG
GEFGHVFGGGFG	sp|F5HDQ6|DNBI_HCMVM	1174	sp|P19012|K1C15_HUMAN Keratin, type I cytoskeletal 15 OS=Homo sapiens OX=9606 GN=KRT15 PE=1 SV=3	71	GGAGSVFGGGFG
EAAADALRLNDI	sp|F5HEN8|HELI_HCMVM	347	sp|P31639|SC5A2_HUMAN Sodium/glucose cotransporter 2 OS=Homo sapiens OX=9606 GN=SLC5A2 PE=2 SV=1	632	EAAAAARRLEDI
EAAADALRLNDI	sp|F5HEN8|HELI_HCMVM	347	tr|H7C4M5|H7C4M5_HUMAN CLIP-associating protein 2 (Fragment) OS=Homo sapiens OX=9606 GN=CLASP2 PE=1 SV=8	103	EAVADALLLGDI
EAAADALRLNDI	sp|F5HEN8|HELI_HCMVM	347	tr|E7ERI8|E7ERI8_HUMAN CLIP-associating protein 2 OS=Homo sapiens OX=9606 GN=CLASP2 PE=1 SV=1	812	EAVADALLLGDI
EAAADALRLNDI	sp|F5HEN8|HELI_HCMVM	347	tr|E7EW49|E7EW49_HUMAN CLIP-associating protein 2 OS=Homo sapiens OX=9606 GN=CLASP2 PE=1 SV=1	813	EAVADALLLGDI
EAAADALRLNDI	sp|F5HEN8|HELI_HCMVM	347	tr|A0A0U1RQI6|A0A0U1RQI6_HUMAN CLIP-associating protein 2 OS=Homo sapiens OX=9606 GN=CLASP2 PE=1 SV=1	603	EAVADALLLGDI
EGARLEAQARLH	sp|F5HBR4|PORTL_HCMVM	99	sp|O75052|CAPON_HUMAN Carboxyl-terminal PDZ ligand of neuronal nitric oxide synthase protein OS=Homo sapiens OX=9606 GN=NOS1AP PE=1 SV=3	325	AAARLEAQARVH
DSSTGEAVREAS	sp|Q6SW85|ITP_HCMVM	413	tr|F5H395|F5H395_HUMAN Kv channel-interacting protein 4 OS=Homo sapiens OX=9606 GN=KCNIP4 PE=4 SV=1	16	ASSTGEAVIEHS
ILRRELASDART	sp|F5HF62|US28_HCMVM	34	tr|H0YJI4|H0YJI4_HUMAN Probable phospholipid-transporting ATPase VA (Fragment) OS=Homo sapiens OX=9606 GN=ATP10A PE=4 SV=2	59	ILRREDKSDARS
YSQDYVPASSFY	sp|F5HGQ8|UL138_HCMVM	61	sp|O94900|TOX_HUMAN Thymocyte selection-associated high mobility group box protein TOX OS=Homo sapiens OX=9606 GN=TOX PE=1 SV=3	47	PSQDYVPASQSY
AVLPLSDGRGYS	sp|Q6SW73|ICP27_HCMVM	75	sp|Q9Y586|MB212_HUMAN Protein mab-21-like 2 OS=Homo sapiens OX=9606 GN=MAB21L2 PE=1 SV=1	98	AVLKLSDGRKRS
AVLPLSDGRGYS	sp|Q6SW73|ICP27_HCMVM	75	sp|Q13394|MB211_HUMAN Putative nucleotidyltransferase MAB21L1 OS=Homo sapiens OX=9606 GN=MAB21L1 PE=1 SV=1	98	AVLKLSDGRKRS
AVLPLSDGRGYS	sp|Q6SW73|ICP27_HCMVM	75	tr|H7C3H4|H7C3H4_HUMAN Histone-lysine N-methyltransferase SETD2 (Fragment) OS=Homo sapiens OX=9606 GN=SETD2 PE=1 SV=1	1467	AVPPLSEGDGYS
AVLPLSDGRGYS	sp|Q6SW73|ICP27_HCMVM	75	tr|A0A1W2PPX9|A0A1W2PPX9_HUMAN Histone-lysine N-methyltransferase SETD2 OS=Homo sapiens OX=9606 GN=SETD2 PE=1 SV=1	383	AVPPLSEGDGYS
AVLPLSDGRGYS	sp|Q6SW73|ICP27_HCMVM	75	sp|Q9BYW2|SETD2_HUMAN Histone-lysine N-methyltransferase SETD2 OS=Homo sapiens OX=9606 GN=SETD2 PE=1 SV=3	1833	AVPPLSEGDGYS
PAAALASVSSKG	sp|F5HDQ6|DNBI_HCMVM	671	sp|Q6P5Z2|PKN3_HUMAN Serine/threonine-protein kinase N3 OS=Homo sapiens OX=9606 GN=PKN3 PE=1 SV=1	300	PAAALASSPSEG
PAAALASVSSKG	sp|F5HDQ6|DNBI_HCMVM	671	tr|H3BSK8|H3BSK8_HUMAN E3 ubiquitin-protein ligase RBBP6 (Fragment) OS=Homo sapiens OX=9606 GN=RBBP6 PE=1 SV=1	305	PAAALASEHSKG
PAAALASVSSKG	sp|F5HDQ6|DNBI_HCMVM	671	tr|A0A2R8Y880|A0A2R8Y880_HUMAN E3 ubiquitin-protein ligase RBBP6 (Fragment) OS=Homo sapiens OX=9606 GN=RBBP6 PE=1 SV=1	476	PAAALASEHSKG
PAAALASVSSKG	sp|F5HDQ6|DNBI_HCMVM	671	sp|Q7Z6E9|RBBP6_HUMAN E3 ubiquitin-protein ligase RBBP6 OS=Homo sapiens OX=9606 GN=RBBP6 PE=1 SV=1	438	PAAALASEHSKG
PAAALASVSSKG	sp|F5HDQ6|DNBI_HCMVM	671	tr|B4DEX3|B4DEX3_HUMAN A disintegrin and metalloproteinase with thrombospondin motifs 18 OS=Homo sapiens OX=9606 GN=ADAMTS18 PE=2 SV=1	42	VAAALASDSSSG
PAAALASVSSKG	sp|F5HDQ6|DNBI_HCMVM	671	sp|Q8TE60|ATS18_HUMAN A disintegrin and metalloproteinase with thrombospondin motifs 18 OS=Homo sapiens OX=9606 GN=ADAMTS18 PE=1 SV=3	42	VAAALASDSSSG
LNRLGNRPVFVG	sp|F5HG51|PRIM_HCMVM	36	tr|K7EKB4|K7EKB4_HUMAN E3 ubiquitin ligase RNF157 OS=Homo sapiens OX=9606 GN=RNF157 PE=1 SV=1	60	LNFLGNRPVVVW
HVVRTDVSDAEP	sp|F5HG51|PRIM_HCMVM	415	sp|Q13233|M3K1_HUMAN Mitogen-activated protein kinase kinase kinase 1 OS=Homo sapiens OX=9606 GN=MAP3K1 PE=1 SV=4	775	HIVSTDVSQAEP
RTPDTHYPEVFD	sp|F5HG51|PRIM_HCMVM	687	tr|H7C4B0|H7C4B0_HUMAN DNA topoisomerase (Fragment) OS=Homo sapiens OX=9606 GN=TOP3B PE=1 SV=1	70	RTETTHYPENFD
RTPDTHYPEVFD	sp|F5HG51|PRIM_HCMVM	687	tr|H0Y6W0|H0Y6W0_HUMAN DNA topoisomerase (Fragment) OS=Homo sapiens OX=9606 GN=TOP3B PE=1 SV=1	133	RTETTHYPENFD
RTPDTHYPEVFD	sp|F5HG51|PRIM_HCMVM	687	sp|O95985|TOP3B_HUMAN DNA topoisomerase 3-beta-1 OS=Homo sapiens OX=9606 GN=TOP3B PE=1 SV=1	338	RTETTHYPENFD
LHFTMVNSLLSA	sp|F5HG51|PRIM_HCMVM	813	tr|A0A5F9ZHN1|A0A5F9ZHN1_HUMAN Ankyrin repeat and death domain-containing protein 1B (Fragment) OS=Homo sapiens OX=9606 GN=ANKDD1B PE=4 SV=1	269	NHITVVNSLLSA
