query	query_seqname	query_start	target_seqname	target_start	target
FSQSPASSSLSP	sp|A4UHQ2|L_EBLV1	1950	tr|G3V5H0|G3V5H0_HUMAN Nuclear factor of-activated T-cells, cytoplasmic 4 (Fragment) OS=Homo sapiens OX=9606 GN=NFATC4 PE=1 SV=8	144	FSPSPGSSSLSS
FSQSPASSSLSP	sp|A4UHQ2|L_EBLV1	1950	sp|Q14934|NFAC4_HUMAN Nuclear factor of activated T-cells, cytoplasmic 4 OS=Homo sapiens OX=9606 GN=NFATC4 PE=1 SV=2	167	FSPSPGSSSLSS
DNALWEKELQAS	sp|A4UHP9|PHOSP_EBLV1	147	tr|A0A3B3ITQ9|A0A3B3ITQ9_HUMAN Caspase recruitment domain-containing protein 14 (Fragment) OS=Homo sapiens OX=9606 GN=CARD14 PE=1 SV=1	64	SNALQEKELAAS
DNALWEKELQAS	sp|A4UHP9|PHOSP_EBLV1	147	tr|I3L414|I3L414_HUMAN Caspase recruitment domain family, member 14, isoform CRA_d OS=Homo sapiens OX=9606 GN=CARD14 PE=1 SV=1	206	SNALQEKELAAS
DNALWEKELQAS	sp|A4UHP9|PHOSP_EBLV1	147	tr|A0A494BZY0|A0A494BZY0_HUMAN Caspase recruitment domain-containing protein 14 OS=Homo sapiens OX=9606 GN=CARD14 PE=1 SV=1	206	SNALQEKELAAS
DNALWEKELQAS	sp|A4UHP9|PHOSP_EBLV1	147	tr|A0A494C199|A0A494C199_HUMAN Caspase recruitment domain-containing protein 14 OS=Homo sapiens OX=9606 GN=CARD14 PE=1 SV=1	206	SNALQEKELAAS
DNALWEKELQAS	sp|A4UHP9|PHOSP_EBLV1	147	tr|A0A494C1N2|A0A494C1N2_HUMAN Caspase recruitment domain-containing protein 14 OS=Homo sapiens OX=9606 GN=CARD14 PE=1 SV=1	206	SNALQEKELAAS
DNALWEKELQAS	sp|A4UHP9|PHOSP_EBLV1	147	tr|A0A494C0J4|A0A494C0J4_HUMAN Caspase recruitment domain-containing protein 14 OS=Homo sapiens OX=9606 GN=CARD14 PE=1 SV=1	206	SNALQEKELAAS
DNALWEKELQAS	sp|A4UHP9|PHOSP_EBLV1	147	sp|Q9BXL6|CAR14_HUMAN Caspase recruitment domain-containing protein 14 OS=Homo sapiens OX=9606 GN=CARD14 PE=1 SV=2	206	SNALQEKELAAS
DNALWEKELQAS	sp|A4UHP9|PHOSP_EBLV1	147	tr|I3L3F1|I3L3F1_HUMAN Caspase recruitment domain-containing protein 14 (Fragment) OS=Homo sapiens OX=9606 GN=CARD14 PE=1 SV=1	3	SNALQEKELAAS
RVLSRDSRSFSE	sp|A4UHQ2|L_EBLV1	414	tr|J3QRJ8|J3QRJ8_HUMAN Very long-chain-specific acyl-CoA dehydrogenase, mitochondrial (Fragment) OS=Homo sapiens OX=9606 GN=ACADVL PE=1 SV=1	159	VVLSRASRSLSE
RVLSRDSRSFSE	sp|A4UHQ2|L_EBLV1	414	sp|P49748|ACADV_HUMAN Very long-chain specific acyl-CoA dehydrogenase, mitochondrial OS=Homo sapiens OX=9606 GN=ACADVL PE=1 SV=1	580	VVLSRASRSLSE
SEIKSYRVDIDD	sp|A4UHQ2|L_EBLV1	2078	tr|A6NEP9|A6NEP9_HUMAN Tetraspanin (Fragment) OS=Homo sapiens OX=9606 GN=TSPAN14 PE=1 SV=2	99	SNIKSYRDDIDL
SEIKSYRVDIDD	sp|A4UHQ2|L_EBLV1	2078	sp|Q8NG11|TSN14_HUMAN Tetraspanin-14 OS=Homo sapiens OX=9606 GN=TSPAN14 PE=1 SV=1	129	SNIKSYRDDIDL
ERKGVNNPLSAS	sp|A4UHP9|PHOSP_EBLV1	103	sp|Q8WVQ1|CANT1_HUMAN Soluble calcium-activated nucleotidase 1 OS=Homo sapiens OX=9606 GN=CANT1 PE=1 SV=1	313	ERKGANLLLSAS
MFSQSPASSSLS	sp|A4UHQ2|L_EBLV1	1949	tr|G3V5H0|G3V5H0_HUMAN Nuclear factor of-activated T-cells, cytoplasmic 4 (Fragment) OS=Homo sapiens OX=9606 GN=NFATC4 PE=1 SV=8	143	FFSPSPGSSSLS
MFSQSPASSSLS	sp|A4UHQ2|L_EBLV1	1949	sp|Q14934|NFAC4_HUMAN Nuclear factor of activated T-cells, cytoplasmic 4 OS=Homo sapiens OX=9606 GN=NFATC4 PE=1 SV=2	166	FFSPSPGSSSLS
GRLRGLLRGKLA	sp|A4UHQ2|L_EBLV1	594	sp|Q96B18|DACT3_HUMAN Dapper homolog 3 OS=Homo sapiens OX=9606 GN=DACT3 PE=1 SV=2	14	GRLRGWLEGSLA
GRLRGLLRGKLA	sp|A4UHQ2|L_EBLV1	594	tr|G5E9H6|G5E9H6_HUMAN Dapper homolog 3 OS=Homo sapiens OX=9606 GN=DACT3 PE=1 SV=1	14	GRLRGWLEGSLA
VLSRDSRSFSET	sp|A4UHQ2|L_EBLV1	415	tr|J3QRJ8|J3QRJ8_HUMAN Very long-chain-specific acyl-CoA dehydrogenase, mitochondrial (Fragment) OS=Homo sapiens OX=9606 GN=ACADVL PE=1 SV=1	160	VLSRASRSLSEG
VLSRDSRSFSET	sp|A4UHQ2|L_EBLV1	415	sp|P49748|ACADV_HUMAN Very long-chain specific acyl-CoA dehydrogenase, mitochondrial OS=Homo sapiens OX=9606 GN=ACADVL PE=1 SV=1	581	VLSRASRSLSEG
DFKIKYISILKN	sp|A4UHP9|PHOSP_EBLV1	90	sp|Q9UHN1|DPOG2_HUMAN DNA polymerase subunit gamma-2, mitochondrial OS=Homo sapiens OX=9606 GN=POLG2 PE=1 SV=1	473	DFLIKYISSAKN
HLITLVTSKGNQ	sp|A4UHQ2|L_EBLV1	672	tr|V9GYS8|V9GYS8_HUMAN Protein phosphatase 1K, mitochondrial (Fragment) OS=Homo sapiens OX=9606 GN=PPM1K PE=1 SV=1	5	ALITLVRSGGNQ
HLITLVTSKGNQ	sp|A4UHQ2|L_EBLV1	672	tr|A0A0A0MQZ4|A0A0A0MQZ4_HUMAN Protein phosphatase 1K, mitochondrial OS=Homo sapiens OX=9606 GN=PPM1K PE=1 SV=1	5	ALITLVRSGGNQ
HLITLVTSKGNQ	sp|A4UHQ2|L_EBLV1	672	sp|Q8N3J5|PPM1K_HUMAN Protein phosphatase 1K, mitochondrial OS=Homo sapiens OX=9606 GN=PPM1K PE=1 SV=1	5	ALITLVRSGGNQ
HLITLVTSKGNQ	sp|A4UHQ2|L_EBLV1	672	tr|V9GYZ5|V9GYZ5_HUMAN Protein phosphatase 1K (PP2C domain containing), isoform CRA_b OS=Homo sapiens OX=9606 GN=PPM1K PE=1 SV=1	5	ALITLVRSGGNQ
VTEPPCVCVSFF	sp|A4UHP8|NCAP_EBLV1	14	sp|Q86TD4|SRCA_HUMAN Sarcalumenin OS=Homo sapiens OX=9606 GN=SRL PE=1 SV=3	282	VTEPPRVYVSSF
RPGNQVQEGQKL	sp|A4UHQ2|L_EBLV1	907	sp|Q96LA5|FCRL2_HUMAN Fc receptor-like protein 2 OS=Homo sapiens OX=9606 GN=FCRL2 PE=1 SV=1	211	APGGQVTEGQKL
NDRRWRITLTLS	sp|A4UHQ2|L_EBLV1	920	sp|Q8WYK1|CNTP5_HUMAN Contactin-associated protein-like 5 OS=Homo sapiens OX=9606 GN=CNTNAP5 PE=2 SV=1	456	NARRNRITLTLD
GGGPLERGYRLK	sp|A4UHQ2|L_EBLV1	211	tr|A0A3B3IRX9|A0A3B3IRX9_HUMAN Carbonic anhydrase OS=Homo sapiens OX=9606 GN=CA5A PE=1 SV=1	116	SGGPLENHYRLK
GGGPLERGYRLK	sp|A4UHQ2|L_EBLV1	211	sp|P35218|CAH5A_HUMAN Carbonic anhydrase 5A, mitochondrial OS=Homo sapiens OX=9606 GN=CA5A PE=1 SV=1	116	SGGPLENHYRLK
GGGPLERGYRLK	sp|A4UHQ2|L_EBLV1	211	tr|A0A3B3ITU9|A0A3B3ITU9_HUMAN Carbonic anhydrase OS=Homo sapiens OX=9606 GN=CA5A PE=1 SV=1	116	SGGPLENHYRLK
GGGPLERGYRLK	sp|A4UHQ2|L_EBLV1	211	tr|C9JA11|C9JA11_HUMAN Carbonic anhydrase 5B, mitochondrial (Fragment) OS=Homo sapiens OX=9606 GN=CA5B PE=1 SV=1	116	KGGPLEHNYRLK
GGGPLERGYRLK	sp|A4UHQ2|L_EBLV1	211	sp|Q9Y2D0|CAH5B_HUMAN Carbonic anhydrase 5B, mitochondrial OS=Homo sapiens OX=9606 GN=CA5B PE=1 SV=1	116	KGGPLEHNYRLK
GGGPLERGYRLK	sp|A4UHQ2|L_EBLV1	211	sp|P43166|CAH7_HUMAN Carbonic anhydrase 7 OS=Homo sapiens OX=9606 GN=CA7 PE=1 SV=1	82	TGGPLEGPYRLK
EPRGSIELVRPL	sp|A4UHQ2|L_EBLV1	500	sp|Q9UIQ6|LCAP_HUMAN Leucyl-cystinyl aminopeptidase OS=Homo sapiens OX=9606 GN=LNPEP PE=1 SV=3	47	EPRGSRLLVRGL
LLSFSDFEILKQ	sp|A4UHQ2|L_EBLV1	660	sp|Q9H6B9|EPHX3_HUMAN Epoxide hydrolase 3 OS=Homo sapiens OX=9606 GN=EPHX3 PE=1 SV=1	233	LLSMSDFQILKT
PGNQVQEGQKLF	sp|A4UHQ2|L_EBLV1	908	sp|Q96LA5|FCRL2_HUMAN Fc receptor-like protein 2 OS=Homo sapiens OX=9606 GN=FCRL2 PE=1 SV=1	212	PGGQVTEGQKLI
LGPTGGLPSSRL	sp|A4UHQ2|L_EBLV1	1042	tr|H0YKE4|H0YKE4_HUMAN Jun dimerization protein 2 (Fragment) OS=Homo sapiens OX=9606 GN=JDP2 PE=1 SV=8	19	LGPLTGLPSSAL
LGPTGGLPSSRL	sp|A4UHQ2|L_EBLV1	1042	sp|Q8WYK2|JDP2_HUMAN Jun dimerization protein 2 OS=Homo sapiens OX=9606 GN=JDP2 PE=1 SV=1	19	LGPLTGLPSSAL
LGPTGGLPSSRL	sp|A4UHQ2|L_EBLV1	1042	tr|F8S0F2|F8S0F2_HUMAN Broad substrate-specificity ATP-binding cassette transporter ABCG2 (Fragment) OS=Homo sapiens OX=9606 GN=ABCG2 PE=1 SV=1	79	LGPTGGGKSSLL
LGPTGGLPSSRL	sp|A4UHQ2|L_EBLV1	1042	sp|Q9UNQ0|ABCG2_HUMAN Broad substrate specificity ATP-binding cassette transporter ABCG2 OS=Homo sapiens OX=9606 GN=ABCG2 PE=1 SV=3	79	LGPTGGGKSSLL
DYGSWEFQGKLV	sp|A4UHQ1|GLYCO_EBLV1	288	tr|A0A6Q8PGK4|A0A6Q8PGK4_HUMAN Intraflagellar transport protein 172 homolog OS=Homo sapiens OX=9606 GN=IFT172 PE=1 SV=1	183	DEGSGESQGKLV
DYGSWEFQGKLV	sp|A4UHQ1|GLYCO_EBLV1	288	sp|Q9UG01|IF172_HUMAN Intraflagellar transport protein 172 homolog OS=Homo sapiens OX=9606 GN=IFT172 PE=1 SV=2	183	DEGSGESQGKLV
DYGSWEFQGKLV	sp|A4UHQ1|GLYCO_EBLV1	288	tr|F5GZ56|F5GZ56_HUMAN Intraflagellar transport protein 172 homolog OS=Homo sapiens OX=9606 GN=IFT172 PE=1 SV=1	162	DEGSGESQGKLV
DYGSWEFQGKLV	sp|A4UHQ1|GLYCO_EBLV1	288	tr|A0A6Q8PGJ2|A0A6Q8PGJ2_HUMAN Intraflagellar transport protein 172 homolog OS=Homo sapiens OX=9606 GN=IFT172 PE=1 SV=1	183	DEGSGESQGKLV
DYGSWEFQGKLV	sp|A4UHQ1|GLYCO_EBLV1	288	tr|A0A6Q8PFK2|A0A6Q8PFK2_HUMAN Intraflagellar transport protein 172 homolog OS=Homo sapiens OX=9606 GN=IFT172 PE=1 SV=1	162	DEGSGESQGKLV
EISTEMLLCVSR	sp|A4UHQ2|L_EBLV1	609	tr|C9JCM7|C9JCM7_HUMAN Neuroblastoma-amplified sequence (Fragment) OS=Homo sapiens OX=9606 GN=NBAS PE=1 SV=1	167	EIFTESLLCSSR
EISTEMLLCVSR	sp|A4UHQ2|L_EBLV1	609	sp|A2RRP1|NBAS_HUMAN Neuroblastoma-amplified sequence OS=Homo sapiens OX=9606 GN=NBAS PE=1 SV=2	1120	EIFTESLLCSSR
EISTEMLLCVSR	sp|A4UHQ2|L_EBLV1	609	tr|H0Y5G7|H0Y5G7_HUMAN Neuroblastoma-amplified sequence (Fragment) OS=Homo sapiens OX=9606 GN=NBAS PE=1 SV=1	168	EIFTESLLCSSR
PITNNIRGRYPH	sp|A4UHQ1|GLYCO_EBLV1	273	sp|Q86WS5|TMPSC_HUMAN Transmembrane protease serine 12 OS=Homo sapiens OX=9606 GN=TMPRSS12 PE=1 SV=2	137	IGTNNIHGRYPH
PITNNIRGRYPH	sp|A4UHQ1|GLYCO_EBLV1	273	tr|F8WBX2|F8WBX2_HUMAN Transmembrane protease serine 12 OS=Homo sapiens OX=9606 GN=TMPRSS12 PE=1 SV=1	137	IGTNNIHGRYPH
RLAVIELERAHL	sp|A4UHP9|PHOSP_EBLV1	256	tr|H7BY33|H7BY33_HUMAN Coiled-coil domain-containing protein 88B OS=Homo sapiens OX=9606 GN=CCDC88B PE=1 SV=1	344	RLARLELERAQL
RLAVIELERAHL	sp|A4UHP9|PHOSP_EBLV1	256	sp|A6NC98|CC88B_HUMAN Coiled-coil domain-containing protein 88B OS=Homo sapiens OX=9606 GN=CCDC88B PE=1 SV=1	1192	RLARLELERAQL
TNNIRGRYPHLE	sp|A4UHQ1|GLYCO_EBLV1	275	sp|Q86WS5|TMPSC_HUMAN Transmembrane protease serine 12 OS=Homo sapiens OX=9606 GN=TMPRSS12 PE=1 SV=2	139	TNNIHGRYPHTK
TNNIRGRYPHLE	sp|A4UHQ1|GLYCO_EBLV1	275	tr|F8WBX2|F8WBX2_HUMAN Transmembrane protease serine 12 OS=Homo sapiens OX=9606 GN=TMPRSS12 PE=1 SV=1	139	TNNIHGRYPHTK
AERLRLAVIELE	sp|A4UHP9|PHOSP_EBLV1	252	sp|Q15149|PLEC_HUMAN Plectin OS=Homo sapiens OX=9606 GN=PLEC PE=1 SV=3	2582	AERLREAIAELE
AERLRLAVIELE	sp|A4UHP9|PHOSP_EBLV1	252	tr|M0R2U7|M0R2U7_HUMAN Homer protein homolog 3 (Fragment) OS=Homo sapiens OX=9606 GN=HOMER3 PE=1 SV=1	224	AERLRQRVAELE
AERLRLAVIELE	sp|A4UHP9|PHOSP_EBLV1	252	sp|Q9NSC5|HOME3_HUMAN Homer protein homolog 3 OS=Homo sapiens OX=9606 GN=HOMER3 PE=1 SV=2	224	AERLRQRVAELE
AERLRLAVIELE	sp|A4UHP9|PHOSP_EBLV1	252	tr|M0QYF9|M0QYF9_HUMAN Homer protein homolog 3 OS=Homo sapiens OX=9606 GN=HOMER3 PE=1 SV=1	15	AERLRQRVAELE
SVSNVKGAAVHR	sp|A4UHQ2|L_EBLV1	1922	tr|G3V5G6|G3V5G6_HUMAN Cochlin OS=Homo sapiens OX=9606 GN=COCH PE=1 SV=1	69	SVSSICGAAVHR
SVSNVKGAAVHR	sp|A4UHQ2|L_EBLV1	1922	tr|G3V5V4|G3V5V4_HUMAN Cochlin (Fragment) OS=Homo sapiens OX=9606 GN=COCH PE=1 SV=1	53	SVSSICGAAVHR
SVSNVKGAAVHR	sp|A4UHQ2|L_EBLV1	1922	tr|A0A2R8Y3T0|A0A2R8Y3T0_HUMAN Cochlin OS=Homo sapiens OX=9606 GN=COCH PE=1 SV=1	69	SVSSICGAAVHR
SVSNVKGAAVHR	sp|A4UHQ2|L_EBLV1	1922	tr|A0A2U3TZE7|A0A2U3TZE7_HUMAN Cochlin OS=Homo sapiens OX=9606 GN=COCH PE=1 SV=1	134	SVSSICGAAVHR
SVSNVKGAAVHR	sp|A4UHQ2|L_EBLV1	1922	sp|O43405|COCH_HUMAN Cochlin OS=Homo sapiens OX=9606 GN=COCH PE=1 SV=1	69	SVSSICGAAVHR
SVSNVKGAAVHR	sp|A4UHQ2|L_EBLV1	1922	tr|H0YJJ0|H0YJJ0_HUMAN Cochlin (Fragment) OS=Homo sapiens OX=9606 GN=COCH PE=1 SV=1	41	SVSSICGAAVHR
SGSSILLPGLEL	sp|A4UHQ2|L_EBLV1	81	sp|Q5VWT5|FYB2_HUMAN FYN-binding protein 2 OS=Homo sapiens OX=9606 GN=FYB2 PE=1 SV=1	568	SAFSILLPDLEL
ITLVTSKGNQRR	sp|A4UHQ2|L_EBLV1	674	tr|V9GYS8|V9GYS8_HUMAN Protein phosphatase 1K, mitochondrial (Fragment) OS=Homo sapiens OX=9606 GN=PPM1K PE=1 SV=1	7	ITLVRSGGNQVR
ITLVTSKGNQRR	sp|A4UHQ2|L_EBLV1	674	tr|A0A0A0MQZ4|A0A0A0MQZ4_HUMAN Protein phosphatase 1K, mitochondrial OS=Homo sapiens OX=9606 GN=PPM1K PE=1 SV=1	7	ITLVRSGGNQVR
ITLVTSKGNQRR	sp|A4UHQ2|L_EBLV1	674	sp|Q8N3J5|PPM1K_HUMAN Protein phosphatase 1K, mitochondrial OS=Homo sapiens OX=9606 GN=PPM1K PE=1 SV=1	7	ITLVRSGGNQVR
ITLVTSKGNQRR	sp|A4UHQ2|L_EBLV1	674	tr|V9GYZ5|V9GYZ5_HUMAN Protein phosphatase 1K (PP2C domain containing), isoform CRA_b OS=Homo sapiens OX=9606 GN=PPM1K PE=1 SV=1	7	ITLVRSGGNQVR
PKRGAPTRTPIT	sp|A4UHQ1|GLYCO_EBLV1	264	tr|M0QYS5|M0QYS5_HUMAN DNA repair protein XRCC1 (Fragment) OS=Homo sapiens OX=9606 GN=XRCC1 PE=1 SV=1	280	PKLPAPTRTPAT
PKRGAPTRTPIT	sp|A4UHQ1|GLYCO_EBLV1	264	tr|F5H8D7|F5H8D7_HUMAN DNA repair protein XRCC1 OS=Homo sapiens OX=9606 GN=XRCC1 PE=1 SV=2	242	PKLPAPTRTPAT
PKRGAPTRTPIT	sp|A4UHQ1|GLYCO_EBLV1	264	sp|P18887|XRCC1_HUMAN DNA repair protein XRCC1 OS=Homo sapiens OX=9606 GN=XRCC1 PE=1 SV=2	273	PKLPAPTRTPAT
TREPIKDTDVLR	sp|A4UHQ2|L_EBLV1	223	sp|Q92523|CPT1B_HUMAN Carnitine O-palmitoyltransferase 1, muscle isoform OS=Homo sapiens OX=9606 GN=CPT1B PE=1 SV=2	316	TRIPGKDTDVLQ
TSVLSAMWLDGG	sp|A4UHQ1|GLYCO_EBLV1	230	tr|M0QZD8|M0QZD8_HUMAN Uncharacterized protein OS=Homo sapiens OX=9606 GN=LOC400499 PE=4 SV=3	874	TSVRSAASLDGG
FPLLVLLIKLIF	sp|A4UHQ2|L_EBLV1	1788	sp|Q6P9F7|LRC8B_HUMAN Volume-regulated anion channel subunit LRRC8B OS=Homo sapiens OX=9606 GN=LRRC8B PE=1 SV=2	121	FPYLVLLHTLIF
FPLLVLLIKLIF	sp|A4UHQ2|L_EBLV1	1788	sp|Q8IWT6|LRC8A_HUMAN Volume-regulated anion channel subunit LRRC8A OS=Homo sapiens OX=9606 GN=LRRC8A PE=1 SV=1	125	FPYLVLLHTLIF
ERLRLAVIELER	sp|A4UHP9|PHOSP_EBLV1	253	sp|Q15149|PLEC_HUMAN Plectin OS=Homo sapiens OX=9606 GN=PLEC PE=1 SV=3	2583	ERLREAIAELER
LLRYADLLDDDQ	sp|A4UHQ2|L_EBLV1	751	tr|H0Y2T8|H0Y2T8_HUMAN tRNA (cytosine(38)-C(5))-methyltransferase (Fragment) OS=Homo sapiens OX=9606 GN=TRDMT1 PE=1 SV=2	206	LLRYALLLDIVQ
LLRYADLLDDDQ	sp|A4UHQ2|L_EBLV1	751	sp|O14717|TRDMT_HUMAN tRNA (cytosine(38)-C(5))-methyltransferase OS=Homo sapiens OX=9606 GN=TRDMT1 PE=1 SV=1	273	LLRYALLLDIVQ
LLRYADLLDDDQ	sp|A4UHQ2|L_EBLV1	751	tr|B7Z8H2|B7Z8H2_HUMAN cDNA FLJ52038, highly similar to DNA (cytosine-5)-methyltransferase-like protein 2 OS=Homo sapiens OX=9606 GN=TRDMT1 PE=1 SV=1	150	LLRYALLLDIVQ
DIEGKSNSLIID	sp|A4UHQ2|L_EBLV1	1861	sp|Q4KWH8|PLCH1_HUMAN 1-phosphatidylinositol 4,5-bisphosphate phosphodiesterase eta-1 OS=Homo sapiens OX=9606 GN=PLCH1 PE=1 SV=1	991	DIEGKENSLAED
DIEGKSNSLIID	sp|A4UHQ2|L_EBLV1	1861	tr|A0A2U3TZV8|A0A2U3TZV8_HUMAN Phosphoinositide phospholipase C OS=Homo sapiens OX=9606 GN=PLCH1 PE=1 SV=1	983	DIEGKENSLAED
ALLSFSDFEILK	sp|A4UHQ2|L_EBLV1	659	sp|Q9H6B9|EPHX3_HUMAN Epoxide hydrolase 3 OS=Homo sapiens OX=9606 GN=EPHX3 PE=1 SV=1	232	KLLSMSDFQILK
LHRSLSIATGLN	sp|A4UHQ2|L_EBLV1	1435	sp|Q9UHR4|BI2L1_HUMAN Brain-specific angiogenesis inhibitor 1-associated protein 2-like protein 1 OS=Homo sapiens OX=9606 GN=BAIAP2L1 PE=1 SV=2	326	LQRSVSVATGLN
NALWEKELQASK	sp|A4UHP9|PHOSP_EBLV1	148	tr|A0A3B3ITQ9|A0A3B3ITQ9_HUMAN Caspase recruitment domain-containing protein 14 (Fragment) OS=Homo sapiens OX=9606 GN=CARD14 PE=1 SV=1	65	NALQEKELAASR
NALWEKELQASK	sp|A4UHP9|PHOSP_EBLV1	148	tr|I3L414|I3L414_HUMAN Caspase recruitment domain family, member 14, isoform CRA_d OS=Homo sapiens OX=9606 GN=CARD14 PE=1 SV=1	207	NALQEKELAASR
NALWEKELQASK	sp|A4UHP9|PHOSP_EBLV1	148	tr|A0A494BZY0|A0A494BZY0_HUMAN Caspase recruitment domain-containing protein 14 OS=Homo sapiens OX=9606 GN=CARD14 PE=1 SV=1	207	NALQEKELAASR
NALWEKELQASK	sp|A4UHP9|PHOSP_EBLV1	148	tr|A0A494C199|A0A494C199_HUMAN Caspase recruitment domain-containing protein 14 OS=Homo sapiens OX=9606 GN=CARD14 PE=1 SV=1	207	NALQEKELAASR
NALWEKELQASK	sp|A4UHP9|PHOSP_EBLV1	148	tr|A0A494C1N2|A0A494C1N2_HUMAN Caspase recruitment domain-containing protein 14 OS=Homo sapiens OX=9606 GN=CARD14 PE=1 SV=1	207	NALQEKELAASR
NALWEKELQASK	sp|A4UHP9|PHOSP_EBLV1	148	tr|A0A494C0J4|A0A494C0J4_HUMAN Caspase recruitment domain-containing protein 14 OS=Homo sapiens OX=9606 GN=CARD14 PE=1 SV=1	207	NALQEKELAASR
NALWEKELQASK	sp|A4UHP9|PHOSP_EBLV1	148	sp|Q9BXL6|CAR14_HUMAN Caspase recruitment domain-containing protein 14 OS=Homo sapiens OX=9606 GN=CARD14 PE=1 SV=2	207	NALQEKELAASR
NALWEKELQASK	sp|A4UHP9|PHOSP_EBLV1	148	tr|I3L3F1|I3L3F1_HUMAN Caspase recruitment domain-containing protein 14 (Fragment) OS=Homo sapiens OX=9606 GN=CARD14 PE=1 SV=1	4	NALQEKELAASR
QKAARECLILID	sp|A4UHQ2|L_EBLV1	351	sp|P54136|SYRC_HUMAN Arginine--tRNA ligase, cytoplasmic OS=Homo sapiens OX=9606 GN=RARS1 PE=1 SV=2	556	QKAARETKILLD
RLRLAVIELERA	sp|A4UHP9|PHOSP_EBLV1	254	tr|H7BY33|H7BY33_HUMAN Coiled-coil domain-containing protein 88B OS=Homo sapiens OX=9606 GN=CCDC88B PE=1 SV=1	342	RGRLARLELERA
RLRLAVIELERA	sp|A4UHP9|PHOSP_EBLV1	254	sp|A6NC98|CC88B_HUMAN Coiled-coil domain-containing protein 88B OS=Homo sapiens OX=9606 GN=CCDC88B PE=1 SV=1	1190	RGRLARLELERA
STRSVLSTPRQE	sp|A4UHQ2|L_EBLV1	1714	tr|V9GYT9|V9GYT9_HUMAN Probable E3 ubiquitin-protein ligase HECTD4 (Fragment) OS=Homo sapiens OX=9606 GN=HECTD4 PE=1 SV=1	242	STGSVLGQPRQE
LITLVTSKGNQR	sp|A4UHQ2|L_EBLV1	673	tr|V9GYS8|V9GYS8_HUMAN Protein phosphatase 1K, mitochondrial (Fragment) OS=Homo sapiens OX=9606 GN=PPM1K PE=1 SV=1	6	LITLVRSGGNQV
LITLVTSKGNQR	sp|A4UHQ2|L_EBLV1	673	tr|A0A0A0MQZ4|A0A0A0MQZ4_HUMAN Protein phosphatase 1K, mitochondrial OS=Homo sapiens OX=9606 GN=PPM1K PE=1 SV=1	6	LITLVRSGGNQV
LITLVTSKGNQR	sp|A4UHQ2|L_EBLV1	673	sp|Q8N3J5|PPM1K_HUMAN Protein phosphatase 1K, mitochondrial OS=Homo sapiens OX=9606 GN=PPM1K PE=1 SV=1	6	LITLVRSGGNQV
LITLVTSKGNQR	sp|A4UHQ2|L_EBLV1	673	tr|V9GYZ5|V9GYZ5_HUMAN Protein phosphatase 1K (PP2C domain containing), isoform CRA_b OS=Homo sapiens OX=9606 GN=PPM1K PE=1 SV=1	6	LITLVRSGGNQV
SFDILIHDLLLI	sp|A4UHQ2|L_EBLV1	1263	sp|Q92545|TM131_HUMAN Transmembrane protein 131 OS=Homo sapiens OX=9606 GN=TMEM131 PE=1 SV=3	463	SFAILIHDVLLP
LSSLIGLYASEI	sp|A4UHQ2|L_EBLV1	2069	tr|E5RHS5|E5RHS5_HUMAN Eukaryotic translation initiation factor 3 subunit E (Fragment) OS=Homo sapiens OX=9606 GN=EIF3E PE=1 SV=1	39	LSSLWGKLASEI
LSSLIGLYASEI	sp|A4UHQ2|L_EBLV1	2069	sp|P60228|EIF3E_HUMAN Eukaryotic translation initiation factor 3 subunit E OS=Homo sapiens OX=9606 GN=EIF3E PE=1 SV=1	166	LSSLWGKLASEI
LSSLIGLYASEI	sp|A4UHQ2|L_EBLV1	2069	tr|E5RGA2|E5RGA2_HUMAN Eukaryotic translation initiation factor 3 subunit E OS=Homo sapiens OX=9606 GN=EIF3E PE=1 SV=1	73	LSSLWGKLASEI
VSRALDSSLHSS	sp|A4UHQ2|L_EBLV1	618	sp|Q13415|ORC1_HUMAN Origin recognition complex subunit 1 OS=Homo sapiens OX=9606 GN=ORC1 PE=1 SV=2	439	VSRNLRSSLKSS
TVSGNEESFSPH	sp|A4UHQ2|L_EBLV1	1353	tr|A0A7D9NKF2|A0A7D9NKF2_HUMAN Leucine-rich repeat-containing protein 63 OS=Homo sapiens OX=9606 GN=LRRC63 PE=1 SV=1	443	TVDGNELSFFPH
TVSGNEESFSPH	sp|A4UHQ2|L_EBLV1	1353	sp|Q05C16|LRC63_HUMAN Leucine-rich repeat-containing protein 63 OS=Homo sapiens OX=9606 GN=LRRC63 PE=2 SV=2	443	TVDGNELSFFPH
FNDRRWRITLTL	sp|A4UHQ2|L_EBLV1	919	sp|Q8WYK1|CNTP5_HUMAN Contactin-associated protein-like 5 OS=Homo sapiens OX=9606 GN=CNTNAP5 PE=2 SV=1	455	INARRNRITLTL
VSFDILIHDLLL	sp|A4UHQ2|L_EBLV1	1262	sp|Q92545|TM131_HUMAN Transmembrane protein 131 OS=Homo sapiens OX=9606 GN=TMEM131 PE=1 SV=3	462	FSFAILIHDVLL
KTREPIKDTDVL	sp|A4UHQ2|L_EBLV1	222	sp|Q92523|CPT1B_HUMAN Carnitine O-palmitoyltransferase 1, muscle isoform OS=Homo sapiens OX=9606 GN=CPT1B PE=1 SV=2	315	TTRIPGKDTDVL
GGPLERGYRLKT	sp|A4UHQ2|L_EBLV1	212	tr|A0A3B3IRX9|A0A3B3IRX9_HUMAN Carbonic anhydrase OS=Homo sapiens OX=9606 GN=CA5A PE=1 SV=1	117	GGPLENHYRLKQ
GGPLERGYRLKT	sp|A4UHQ2|L_EBLV1	212	sp|P35218|CAH5A_HUMAN Carbonic anhydrase 5A, mitochondrial OS=Homo sapiens OX=9606 GN=CA5A PE=1 SV=1	117	GGPLENHYRLKQ
GGPLERGYRLKT	sp|A4UHQ2|L_EBLV1	212	tr|A0A3B3ITU9|A0A3B3ITU9_HUMAN Carbonic anhydrase OS=Homo sapiens OX=9606 GN=CA5A PE=1 SV=1	117	GGPLENHYRLKQ
GGPLERGYRLKT	sp|A4UHQ2|L_EBLV1	212	tr|C9JA11|C9JA11_HUMAN Carbonic anhydrase 5B, mitochondrial (Fragment) OS=Homo sapiens OX=9606 GN=CA5B PE=1 SV=1	117	GGPLEHNYRLKQ
GGPLERGYRLKT	sp|A4UHQ2|L_EBLV1	212	sp|Q9Y2D0|CAH5B_HUMAN Carbonic anhydrase 5B, mitochondrial OS=Homo sapiens OX=9606 GN=CA5B PE=1 SV=1	117	GGPLEHNYRLKQ
GGPLERGYRLKT	sp|A4UHQ2|L_EBLV1	212	sp|P43166|CAH7_HUMAN Carbonic anhydrase 7 OS=Homo sapiens OX=9606 GN=CA7 PE=1 SV=1	83	GGPLEGPYRLKQ
RRPGNQVQEGQK	sp|A4UHQ2|L_EBLV1	906	sp|Q96LA5|FCRL2_HUMAN Fc receptor-like protein 2 OS=Homo sapiens OX=9606 GN=FCRL2 PE=1 SV=1	210	RAPGGQVTEGQK
EKELQASKTQFT	sp|A4UHP9|PHOSP_EBLV1	152	tr|H0YB14|H0YB14_HUMAN Dedicator of cytokinesis protein 5 (Fragment) OS=Homo sapiens OX=9606 GN=DOCK5 PE=1 SV=1	4	EKELQASKNLVT
EKELQASKTQFT	sp|A4UHP9|PHOSP_EBLV1	152	tr|H0Y7N4|H0Y7N4_HUMAN Dedicator of cytokinesis protein 5 (Fragment) OS=Homo sapiens OX=9606 GN=DOCK5 PE=1 SV=1	369	EKELQASKNLVT
EKELQASKTQFT	sp|A4UHP9|PHOSP_EBLV1	152	sp|Q9H7D0|DOCK5_HUMAN Dedicator of cytokinesis protein 5 OS=Homo sapiens OX=9606 GN=DOCK5 PE=1 SV=3	597	EKELQASKNLVT
LLSLGPTGGLPS	sp|A4UHQ2|L_EBLV1	1039	tr|C9JWX1|C9JWX1_HUMAN Beta-galactosidase (Fragment) OS=Homo sapiens OX=9606 GN=GLB1 PE=1 SV=1	15	LLLLGPTRGLRS
GLDDSLNEDIEG	sp|A4UHQ2|L_EBLV1	1853	tr|E9PIY5|E9PIY5_HUMAN S100P-binding protein (Fragment) OS=Homo sapiens OX=9606 GN=S100PBP PE=1 SV=1	33	GLDDSLLELSEG
GLDDSLNEDIEG	sp|A4UHQ2|L_EBLV1	1853	tr|E9PMK1|E9PMK1_HUMAN S100P-binding protein (Fragment) OS=Homo sapiens OX=9606 GN=S100PBP PE=1 SV=1	33	GLDDSLLELSEG
GLDDSLNEDIEG	sp|A4UHQ2|L_EBLV1	1853	tr|E9PL86|E9PL86_HUMAN S100P-binding protein (Fragment) OS=Homo sapiens OX=9606 GN=S100PBP PE=1 SV=1	33	GLDDSLLELSEG
GLDDSLNEDIEG	sp|A4UHQ2|L_EBLV1	1853	tr|E9PSA0|E9PSA0_HUMAN S100P-binding protein (Fragment) OS=Homo sapiens OX=9606 GN=S100PBP PE=1 SV=1	33	GLDDSLLELSEG
GLDDSLNEDIEG	sp|A4UHQ2|L_EBLV1	1853	sp|Q96BU1|S1PBP_HUMAN S100P-binding protein OS=Homo sapiens OX=9606 GN=S100PBP PE=1 SV=1	33	GLDDSLLELSEG
LTVSGNEESFSP	sp|A4UHQ2|L_EBLV1	1352	tr|A0A7D9NKF2|A0A7D9NKF2_HUMAN Leucine-rich repeat-containing protein 63 OS=Homo sapiens OX=9606 GN=LRRC63 PE=1 SV=1	442	LTVDGNELSFFP
LTVSGNEESFSP	sp|A4UHQ2|L_EBLV1	1352	sp|Q05C16|LRC63_HUMAN Leucine-rich repeat-containing protein 63 OS=Homo sapiens OX=9606 GN=LRRC63 PE=2 SV=2	442	LTVDGNELSFFP
AKSDSIKYSEPS	sp|A4UHP9|PHOSP_EBLV1	135	tr|A0A0D9SF51|A0A0D9SF51_HUMAN Phosphoinositide phospholipase C (Fragment) OS=Homo sapiens OX=9606 GN=PLCB1 PE=1 SV=1	869	AKKDSKKKSEPS
AKSDSIKYSEPS	sp|A4UHP9|PHOSP_EBLV1	135	tr|A0A0D9SG17|A0A0D9SG17_HUMAN Phosphoinositide phospholipase C (Fragment) OS=Homo sapiens OX=9606 GN=PLCB1 PE=1 SV=1	869	AKKDSKKKSEPS
AKSDSIKYSEPS	sp|A4UHP9|PHOSP_EBLV1	135	tr|A0A087WW73|A0A087WW73_HUMAN 1-phosphatidylinositol 4,5-bisphosphate phosphodiesterase OS=Homo sapiens OX=9606 GN=PLCB1 PE=1 SV=1	890	AKKDSKKKSEPS
AKSDSIKYSEPS	sp|A4UHP9|PHOSP_EBLV1	135	tr|A0A1B0GWB6|A0A1B0GWB6_HUMAN 1-phosphatidylinositol 4,5-bisphosphate phosphodiesterase OS=Homo sapiens OX=9606 GN=PLCB1 PE=1 SV=1	869	AKKDSKKKSEPS
AKSDSIKYSEPS	sp|A4UHP9|PHOSP_EBLV1	135	tr|H0YCJ2|H0YCJ2_HUMAN Phosphoinositide phospholipase C (Fragment) OS=Homo sapiens OX=9606 GN=PLCB1 PE=1 SV=1	711	AKKDSKKKSEPS
AKSDSIKYSEPS	sp|A4UHP9|PHOSP_EBLV1	135	sp|Q9NQ66|PLCB1_HUMAN 1-phosphatidylinositol 4,5-bisphosphate phosphodiesterase beta-1 OS=Homo sapiens OX=9606 GN=PLCB1 PE=1 SV=1	970	AKKDSKKKSEPS
AKSDSIKYSEPS	sp|A4UHP9|PHOSP_EBLV1	135	tr|A0A087WT80|A0A087WT80_HUMAN 1-phosphatidylinositol 4,5-bisphosphate phosphodiesterase OS=Homo sapiens OX=9606 GN=PLCB1 PE=1 SV=1	890	AKKDSKKKSEPS
AKSDSIKYSEPS	sp|A4UHP9|PHOSP_EBLV1	135	tr|A0A1B0GW62|A0A1B0GW62_HUMAN 1-phosphatidylinositol 4,5-bisphosphate phosphodiesterase beta-1 (Fragment) OS=Homo sapiens OX=9606 GN=PLCB1 PE=1 SV=1	27	AKKDSKKKSEPS
AKSDSIKYSEPS	sp|A4UHP9|PHOSP_EBLV1	135	tr|A0A0D9SGI7|A0A0D9SGI7_HUMAN 1-phosphatidylinositol 4,5-bisphosphate phosphodiesterase beta-1 (Fragment) OS=Homo sapiens OX=9606 GN=PLCB1 PE=1 SV=1	57	AKKDSKKKSEPS
ASEIKSYRVDID	sp|A4UHQ2|L_EBLV1	2077	tr|A6NEP9|A6NEP9_HUMAN Tetraspanin (Fragment) OS=Homo sapiens OX=9606 GN=TSPAN14 PE=1 SV=2	98	ESNIKSYRDDID
ASEIKSYRVDID	sp|A4UHQ2|L_EBLV1	2077	sp|Q8NG11|TSN14_HUMAN Tetraspanin-14 OS=Homo sapiens OX=9606 GN=TSPAN14 PE=1 SV=1	128	ESNIKSYRDDID
ITNNIRGRYPHL	sp|A4UHQ1|GLYCO_EBLV1	274	sp|Q86WS5|TMPSC_HUMAN Transmembrane protease serine 12 OS=Homo sapiens OX=9606 GN=TMPRSS12 PE=1 SV=2	138	GTNNIHGRYPHT
ITNNIRGRYPHL	sp|A4UHQ1|GLYCO_EBLV1	274	tr|F8WBX2|F8WBX2_HUMAN Transmembrane protease serine 12 OS=Homo sapiens OX=9606 GN=TMPRSS12 PE=1 SV=1	138	GTNNIHGRYPHT
EDSEKRLDLSSK	sp|A4UHQ2|L_EBLV1	115	tr|H7C4B2|H7C4B2_HUMAN BCL-6 corepressor-like protein 1 (Fragment) OS=Homo sapiens OX=9606 GN=BCORL1 PE=1 SV=1	52	ECSEMPLDLSSK
EDSEKRLDLSSK	sp|A4UHQ2|L_EBLV1	115	sp|Q5H9F3|BCORL_HUMAN BCL-6 corepressor-like protein 1 OS=Homo sapiens OX=9606 GN=BCORL1 PE=1 SV=1	616	ECSEMPLDLSSK
EDSEKRLDLSSK	sp|A4UHQ2|L_EBLV1	115	tr|A0A075B6Q3|A0A075B6Q3_HUMAN BCL-6 corepressor-like protein 1 (Fragment) OS=Homo sapiens OX=9606 GN=BCORL1 PE=1 SV=1	216	ECSEMPLDLSSK
