query	query_seqname	query_start	target_seqname	target_start	target
SAKYFNVTVKLL	sp|Q9PY93|NSP2_ROTHC	265	tr|F8WEW3|F8WEW3_HUMAN Procollagen-lysine,2-oxoglutarate 5-dioxygenase 2 OS=Homo sapiens OX=9606 GN=PLOD2 PE=1 SV=1	58	SAKYFNYTVKKE
SAKYFNVTVKLL	sp|Q9PY93|NSP2_ROTHC	265	tr|C9JXZ0|C9JXZ0_HUMAN Procollagen-lysine,2-oxoglutarate 5-dioxygenase 2 (Fragment) OS=Homo sapiens OX=9606 GN=PLOD2 PE=1 SV=1	30	SAKYFNYTVKVL
SAKYFNVTVKLL	sp|Q9PY93|NSP2_ROTHC	265	sp|O00469|PLOD2_HUMAN Procollagen-lysine,2-oxoglutarate 5-dioxygenase 2 OS=Homo sapiens OX=9606 GN=PLOD2 PE=1 SV=2	58	SAKYFNYTVKVL
SAKYFNVTVKLL	sp|Q9PY93|NSP2_ROTHC	265	tr|E7ETU9|E7ETU9_HUMAN Procollagen-lysine 5-dioxygenase OS=Homo sapiens OX=9606 GN=PLOD2 PE=1 SV=1	3	SAKYFNYTVKVL
STVLTNGKAATY	sp|P69481|VP6_ROTHC	197	sp|Q9NVP1|DDX18_HUMAN ATP-dependent RNA helicase DDX18 OS=Homo sapiens OX=9606 GN=DDX18 PE=1 SV=2	90	STVLTNGEAAMQ
RSIYNSFHVYHN	sp|Q91E96|VP2_ROTHC	45	sp|O60260|PRKN_HUMAN E3 ubiquitin-protein ligase parkin OS=Homo sapiens OX=9606 GN=PRKN PE=1 SV=2	140	RSIYNSFYVYCK
RSIYNSFHVYHN	sp|Q91E96|VP2_ROTHC	45	tr|A0A669KBE3|A0A669KBE3_HUMAN E3 ubiquitin-protein ligase parkin (Fragment) OS=Homo sapiens OX=9606 GN=PRKN PE=1 SV=1	139	RSIYNSFYVYCK
RSIYNSFHVYHN	sp|Q91E96|VP2_ROTHC	45	tr|B1AKC3|B1AKC3_HUMAN E3 ubiquitin-protein ligase parkin OS=Homo sapiens OX=9606 GN=PRKN PE=1 SV=1	140	RSIYNSFYVYCK
FESAKYFNVTVK	sp|Q9PY93|NSP2_ROTHC	263	tr|F8WEW3|F8WEW3_HUMAN Procollagen-lysine,2-oxoglutarate 5-dioxygenase 2 OS=Homo sapiens OX=9606 GN=PLOD2 PE=1 SV=1	56	MQSAKYFNYTVK
FESAKYFNVTVK	sp|Q9PY93|NSP2_ROTHC	263	tr|C9JXZ0|C9JXZ0_HUMAN Procollagen-lysine,2-oxoglutarate 5-dioxygenase 2 (Fragment) OS=Homo sapiens OX=9606 GN=PLOD2 PE=1 SV=1	28	MQSAKYFNYTVK
FESAKYFNVTVK	sp|Q9PY93|NSP2_ROTHC	263	sp|O00469|PLOD2_HUMAN Procollagen-lysine,2-oxoglutarate 5-dioxygenase 2 OS=Homo sapiens OX=9606 GN=PLOD2 PE=1 SV=2	56	MQSAKYFNYTVK
FESAKYFNVTVK	sp|Q9PY93|NSP2_ROTHC	263	tr|E7ETU9|E7ETU9_HUMAN Procollagen-lysine 5-dioxygenase OS=Homo sapiens OX=9606 GN=PLOD2 PE=1 SV=1	1	MQSAKYFNYTVK
EPTEIRILVKSV	sp|Q82041|VP3_ROTHC	669	tr|E9PEX9|E9PEX9_HUMAN Kelch-like protein 2 OS=Homo sapiens OX=9606 GN=KLHL2 PE=1 SV=1	187	LPTEQRILMKSV
EPTEIRILVKSV	sp|Q82041|VP3_ROTHC	669	tr|B4DFZ5|B4DFZ5_HUMAN Kelch-like protein 2 OS=Homo sapiens OX=9606 GN=KLHL2 PE=1 SV=1	118	LPTEQRILMKSV
EPTEIRILVKSV	sp|Q82041|VP3_ROTHC	669	sp|O95198|KLHL2_HUMAN Kelch-like protein 2 OS=Homo sapiens OX=9606 GN=KLHL2 PE=1 SV=2	284	LPTEQRILMKSV
ESLDNVESYIPN	sp|Q82041|VP3_ROTHC	291	tr|A0A3B3ISX1|A0A3B3ISX1_HUMAN Double-stranded RNA-specific adenosine deaminase (Fragment) OS=Homo sapiens OX=9606 GN=ADAR PE=1 SV=1	619	ESLDNLESMMPN
ESLDNVESYIPN	sp|Q82041|VP3_ROTHC	291	sp|P55265|DSRAD_HUMAN Double-stranded RNA-specific adenosine deaminase OS=Homo sapiens OX=9606 GN=ADAR PE=1 SV=4	700	ESLDNLESMMPN
ESAKYFNVTVKL	sp|Q9PY93|NSP2_ROTHC	264	tr|F8WEW3|F8WEW3_HUMAN Procollagen-lysine,2-oxoglutarate 5-dioxygenase 2 OS=Homo sapiens OX=9606 GN=PLOD2 PE=1 SV=1	57	QSAKYFNYTVKK
ESAKYFNVTVKL	sp|Q9PY93|NSP2_ROTHC	264	tr|C9JXZ0|C9JXZ0_HUMAN Procollagen-lysine,2-oxoglutarate 5-dioxygenase 2 (Fragment) OS=Homo sapiens OX=9606 GN=PLOD2 PE=1 SV=1	29	QSAKYFNYTVKV
ESAKYFNVTVKL	sp|Q9PY93|NSP2_ROTHC	264	sp|O00469|PLOD2_HUMAN Procollagen-lysine,2-oxoglutarate 5-dioxygenase 2 OS=Homo sapiens OX=9606 GN=PLOD2 PE=1 SV=2	57	QSAKYFNYTVKV
ESAKYFNVTVKL	sp|Q9PY93|NSP2_ROTHC	264	tr|E7ETU9|E7ETU9_HUMAN Procollagen-lysine 5-dioxygenase OS=Homo sapiens OX=9606 GN=PLOD2 PE=1 SV=1	2	QSAKYFNYTVKV
AKIIPVQRFAEE	sp|Q91E96|VP2_ROTHC	264	sp|Q5JY77|GASP1_HUMAN G-protein coupled receptor-associated sorting protein 1 OS=Homo sapiens OX=9606 GN=GPRASP1 PE=1 SV=3	80	AKAIPVSRFKEE
AYLSSVPSRTLS	sp|Q91E96|VP2_ROTHC	690	sp|Q8NC54|KCT2_HUMAN Keratinocyte-associated transmembrane protein 2 OS=Homo sapiens OX=9606 GN=KCT2 PE=1 SV=2	42	AALSSVVSRTDS
IILSANLGSTNT	sp|Q91E95|RDRP_ROTHC	62	tr|H0Y8L0|H0Y8L0_HUMAN PHD finger protein 3 (Fragment) OS=Homo sapiens OX=9606 GN=PHF3 PE=1 SV=1	148	ILLSANLKSENT
NILDLFSSSSTS	sp|Q82040|VP4_ROTHC	676	tr|A0A087WZL9|A0A087WZL9_HUMAN Zinc finger protein 644 OS=Homo sapiens OX=9606 GN=ZNF644 PE=1 SV=1	342	NSLHLFSSSSNS
NILDLFSSSSTS	sp|Q82040|VP4_ROTHC	676	sp|Q9H582|ZN644_HUMAN Zinc finger protein 644 OS=Homo sapiens OX=9606 GN=ZNF644 PE=1 SV=2	770	NSLHLFSSSSNS
VFSGELADINRS	sp|Q9PY95|NSP3_ROTHC	304	tr|H0YC29|H0YC29_HUMAN Zinc finger transcription factor Trps1 (Fragment) OS=Homo sapiens OX=9606 GN=TRPS1 PE=1 SV=2	290	VFSGVLQDINSS
VFSGELADINRS	sp|Q9PY95|NSP3_ROTHC	304	tr|E5RFF3|E5RFF3_HUMAN Zinc finger transcription factor Trps1 OS=Homo sapiens OX=9606 GN=TRPS1 PE=1 SV=1	240	VFSGVLQDINSS
VFSGELADINRS	sp|Q9PY95|NSP3_ROTHC	304	sp|Q9UHF7|TRPS1_HUMAN Zinc finger transcription factor Trps1 OS=Homo sapiens OX=9606 GN=TRPS1 PE=1 SV=2	286	VFSGVLQDINSS
VFSGELADINRS	sp|Q9PY95|NSP3_ROTHC	304	tr|E5RJ97|E5RJ97_HUMAN Zinc finger transcription factor Trps1 OS=Homo sapiens OX=9606 GN=TRPS1 PE=1 SV=1	286	VFSGVLQDINSS
GYKVTLEKSMLV	sp|P69481|VP6_ROTHC	154	sp|Q401N2|ZACN_HUMAN Zinc-activated ligand-gated ion channel OS=Homo sapiens OX=9606 GN=ZACN PE=1 SV=2	263	GYKVTLLLSYLV
NYSANGENVNGA	sp|Q82040|VP4_ROTHC	352	tr|A0A3B3ISF9|A0A3B3ISF9_HUMAN Endothelin-converting enzyme 1 OS=Homo sapiens OX=9606 GN=ECE1 PE=1 SV=1	635	NYSVNGEPVNGR
NYSANGENVNGA	sp|Q82040|VP4_ROTHC	352	sp|P42892|ECE1_HUMAN Endothelin-converting enzyme 1 OS=Homo sapiens OX=9606 GN=ECE1 PE=1 SV=2	651	NYSVNGEPVNGR
NYSANGENVNGA	sp|Q82040|VP4_ROTHC	352	tr|B4DKB2|B4DKB2_HUMAN Endothelin-converting enzyme 1 OS=Homo sapiens OX=9606 GN=ECE1 PE=1 SV=1	651	NYSVNGEPVNGR
ETQDGWLVASKL	sp|Q91E95|RDRP_ROTHC	666	tr|H7C5G2|H7C5G2_HUMAN Hermansky-Pudlak syndrome 3 protein (Fragment) OS=Homo sapiens OX=9606 GN=HPS3 PE=1 SV=1	111	ETQPGLLVASVL
ETQDGWLVASKL	sp|Q91E95|RDRP_ROTHC	666	tr|G5E9V4|G5E9V4_HUMAN Hermansky-Pudlak syndrome 3 protein homolog OS=Homo sapiens OX=9606 GN=HPS3 PE=1 SV=1	570	ETQPGLLVASVL
ETQDGWLVASKL	sp|Q91E95|RDRP_ROTHC	666	sp|Q969F9|HPS3_HUMAN Hermansky-Pudlak syndrome 3 protein OS=Homo sapiens OX=9606 GN=HPS3 PE=1 SV=1	735	ETQPGLLVASVL
DELPRSVSHKSA	sp|Q91E96|VP2_ROTHC	592	sp|Q02224|CENPE_HUMAN Centromere-associated protein E OS=Homo sapiens OX=9606 GN=CENPE PE=1 SV=2	1252	DELRRSVSEKTA
DELPRSVSHKSA	sp|Q91E96|VP2_ROTHC	592	tr|A0A087X0P0|A0A087X0P0_HUMAN Centromere-associated protein E OS=Homo sapiens OX=9606 GN=CENPE PE=1 SV=1	1252	DELRRSVSEKTA
PTEIRILVKSVE	sp|Q82041|VP3_ROTHC	670	tr|E9PEX9|E9PEX9_HUMAN Kelch-like protein 2 OS=Homo sapiens OX=9606 GN=KLHL2 PE=1 SV=1	188	PTEQRILMKSVR
PTEIRILVKSVE	sp|Q82041|VP3_ROTHC	670	tr|B4DFZ5|B4DFZ5_HUMAN Kelch-like protein 2 OS=Homo sapiens OX=9606 GN=KLHL2 PE=1 SV=1	119	PTEQRILMKSVR
PTEIRILVKSVE	sp|Q82041|VP3_ROTHC	670	sp|O95198|KLHL2_HUMAN Kelch-like protein 2 OS=Homo sapiens OX=9606 GN=KLHL2 PE=1 SV=2	285	PTEQRILMKSVR
TSSKSMNFSIDS	sp|Q91E96|VP2_ROTHC	314	tr|H0YCL3|H0YCL3_HUMAN Clathrin interactor 1 (Fragment) OS=Homo sapiens OX=9606 GN=CLINT1 PE=4 SV=1	22	TSSQSMNFSMMS
TSSKSMNFSIDS	sp|Q91E96|VP2_ROTHC	314	sp|Q14677|EPN4_HUMAN Clathrin interactor 1 OS=Homo sapiens OX=9606 GN=CLINT1 PE=1 SV=1	435	TSSQSMNFSMMS
DLFSSSSTSLID	sp|Q82040|VP4_ROTHC	679	tr|H0Y6V3|H0Y6V3_HUMAN Non-specific serine/threonine protein kinase (Fragment) OS=Homo sapiens OX=9606 GN=CDC42BPA PE=1 SV=1	143	DSFSSSSSSLID
LYTGSWGVTKIF	sp|Q89865|VP7_ROTHC	131	tr|C9JKT2|C9JKT2_HUMAN Aldehyde dehydrogenase, dimeric NADP-preferring (Fragment) OS=Homo sapiens OX=9606 GN=ALDH3A1 PE=1 SV=2	175	LYTGSTGVGKII
LYTGSWGVTKIF	sp|Q89865|VP7_ROTHC	131	tr|C9JMC5|C9JMC5_HUMAN Aldehyde dehydrogenase, dimeric NADP-preferring (Fragment) OS=Homo sapiens OX=9606 GN=ALDH3A1 PE=1 SV=1	185	LYTGSTGVGKII
LYTGSWGVTKIF	sp|Q89865|VP7_ROTHC	131	tr|E9PNN6|E9PNN6_HUMAN Aldehyde dehydrogenase, dimeric NADP-preferring OS=Homo sapiens OX=9606 GN=ALDH3A1 PE=1 SV=1	185	LYTGSTGVGKII
LYTGSWGVTKIF	sp|Q89865|VP7_ROTHC	131	sp|P30838|AL3A1_HUMAN Aldehyde dehydrogenase, dimeric NADP-preferring OS=Homo sapiens OX=9606 GN=ALDH3A1 PE=1 SV=3	185	LYTGSTGVGKII
LYTGSWGVTKIF	sp|Q89865|VP7_ROTHC	131	tr|I3L3I9|I3L3I9_HUMAN Aldehyde dehydrogenase, dimeric NADP-preferring OS=Homo sapiens OX=9606 GN=ALDH3A1 PE=1 SV=1	112	LYTGSTGVGKII
LYTGSWGVTKIF	sp|Q89865|VP7_ROTHC	131	tr|A8MYB8|A8MYB8_HUMAN Aldehyde dehydrogenase, dimeric NADP-preferring OS=Homo sapiens OX=9606 GN=ALDH3A1 PE=1 SV=1	185	LYTGSTGVGKII
EISPNGKTYIIA	sp|Q82040|VP4_ROTHC	529	sp|Q9ULI1|NWD2_HUMAN NACHT and WD repeat domain-containing protein 2 OS=Homo sapiens OX=9606 GN=NWD2 PE=2 SV=3	1531	EISPNGKLGIIA
VLYTGSWGVTKI	sp|Q89865|VP7_ROTHC	130	tr|C9JKT2|C9JKT2_HUMAN Aldehyde dehydrogenase, dimeric NADP-preferring (Fragment) OS=Homo sapiens OX=9606 GN=ALDH3A1 PE=1 SV=2	174	ILYTGSTGVGKI
VLYTGSWGVTKI	sp|Q89865|VP7_ROTHC	130	tr|C9JMC5|C9JMC5_HUMAN Aldehyde dehydrogenase, dimeric NADP-preferring (Fragment) OS=Homo sapiens OX=9606 GN=ALDH3A1 PE=1 SV=1	184	ILYTGSTGVGKI
VLYTGSWGVTKI	sp|Q89865|VP7_ROTHC	130	tr|E9PNN6|E9PNN6_HUMAN Aldehyde dehydrogenase, dimeric NADP-preferring OS=Homo sapiens OX=9606 GN=ALDH3A1 PE=1 SV=1	184	ILYTGSTGVGKI
VLYTGSWGVTKI	sp|Q89865|VP7_ROTHC	130	sp|P30838|AL3A1_HUMAN Aldehyde dehydrogenase, dimeric NADP-preferring OS=Homo sapiens OX=9606 GN=ALDH3A1 PE=1 SV=3	184	ILYTGSTGVGKI
VLYTGSWGVTKI	sp|Q89865|VP7_ROTHC	130	tr|I3L3I9|I3L3I9_HUMAN Aldehyde dehydrogenase, dimeric NADP-preferring OS=Homo sapiens OX=9606 GN=ALDH3A1 PE=1 SV=1	111	ILYTGSTGVGKI
VLYTGSWGVTKI	sp|Q89865|VP7_ROTHC	130	tr|A8MYB8|A8MYB8_HUMAN Aldehyde dehydrogenase, dimeric NADP-preferring OS=Homo sapiens OX=9606 GN=ALDH3A1 PE=1 SV=1	184	ILYTGSTGVGKI
AYKKNASQAYLS	sp|Q91E96|VP2_ROTHC	682	tr|Q70T24|Q70T24_HUMAN Short transient receptor potential channel 7 OS=Homo sapiens OX=9606 GN=TRPC7 PE=2 SV=1	221	AYKGLASAAYLS
AYKKNASQAYLS	sp|Q91E96|VP2_ROTHC	682	sp|Q9HCX4|TRPC7_HUMAN Short transient receptor potential channel 7 OS=Homo sapiens OX=9606 GN=TRPC7 PE=1 SV=1	221	AYKGLASAAYLS
AYKKNASQAYLS	sp|Q91E96|VP2_ROTHC	682	tr|A1A4Z5|A1A4Z5_HUMAN Short transient receptor potential channel 7 OS=Homo sapiens OX=9606 GN=TRPC7 PE=2 SV=1	221	AYKGLASAAYLS
AYKKNASQAYLS	sp|Q91E96|VP2_ROTHC	682	tr|Q70T25|Q70T25_HUMAN Short transient receptor potential channel 7 OS=Homo sapiens OX=9606 GN=TRPC7 PE=2 SV=1	221	AYKGLASAAYLS
AYKKNASQAYLS	sp|Q91E96|VP2_ROTHC	682	tr|D6RC49|D6RC49_HUMAN Short transient receptor potential channel 3 OS=Homo sapiens OX=9606 GN=TRPC3 PE=1 SV=1	217	AYKGLASPAYLS
AYKKNASQAYLS	sp|Q91E96|VP2_ROTHC	682	sp|Q13507|TRPC3_HUMAN Short transient receptor potential channel 3 OS=Homo sapiens OX=9606 GN=TRPC3 PE=1 SV=3	205	AYKGLASPAYLS
AYKKNASQAYLS	sp|Q91E96|VP2_ROTHC	682	tr|J3QTB0|J3QTB0_HUMAN Short transient receptor potential channel 3 OS=Homo sapiens OX=9606 GN=TRPC3 PE=1 SV=1	217	AYKGLASPAYLS
AYKKNASQAYLS	sp|Q91E96|VP2_ROTHC	682	tr|E9PJN4|E9PJN4_HUMAN Short transient receptor potential channel 6 OS=Homo sapiens OX=9606 GN=TRPC6 PE=1 SV=1	276	AYKGLASPAYLS
AYKKNASQAYLS	sp|Q91E96|VP2_ROTHC	682	sp|Q9Y210|TRPC6_HUMAN Short transient receptor potential channel 6 OS=Homo sapiens OX=9606 GN=TRPC6 PE=1 SV=1	276	AYKGLASPAYLS
SREAKLEFNDLD	sp|Q00682|NSP5_ROTHC	167	sp|Q8IWV2|CNTN4_HUMAN Contactin-4 OS=Homo sapiens OX=9606 GN=CNTN4 PE=1 SV=1	111	SREAKLQFAYLD
SREAKLEFNDLD	sp|Q00682|NSP5_ROTHC	167	tr|F8WD58|F8WD58_HUMAN Contactin-4 OS=Homo sapiens OX=9606 GN=CNTN4 PE=1 SV=1	111	SREAKLQFAYLD
INSTVLTNGKAA	sp|P69481|VP6_ROTHC	195	sp|Q9NVP1|DDX18_HUMAN ATP-dependent RNA helicase DDX18 OS=Homo sapiens OX=9606 GN=DDX18 PE=1 SV=2	88	QKSTVLTNGEAA
GEISPNGKTYII	sp|Q82040|VP4_ROTHC	528	sp|Q9ULI1|NWD2_HUMAN NACHT and WD repeat domain-containing protein 2 OS=Homo sapiens OX=9606 GN=NWD2 PE=2 SV=3	1530	FEISPNGKLGII
LNILDLFSSSST	sp|Q82040|VP4_ROTHC	675	tr|A0A087WZL9|A0A087WZL9_HUMAN Zinc finger protein 644 OS=Homo sapiens OX=9606 GN=ZNF644 PE=1 SV=1	341	LNSLHLFSSSSN
LNILDLFSSSST	sp|Q82040|VP4_ROTHC	675	sp|Q9H582|ZN644_HUMAN Zinc finger protein 644 OS=Homo sapiens OX=9606 GN=ZNF644 PE=1 SV=2	769	LNSLHLFSSSSN
LDLFSSSSTSLI	sp|Q82040|VP4_ROTHC	678	tr|H0Y6V3|H0Y6V3_HUMAN Non-specific serine/threonine protein kinase (Fragment) OS=Homo sapiens OX=9606 GN=CDC42BPA PE=1 SV=1	142	EDSFSSSSSSLI
NSTVLTNGKAAT	sp|P69481|VP6_ROTHC	196	sp|Q9NVP1|DDX18_HUMAN ATP-dependent RNA helicase DDX18 OS=Homo sapiens OX=9606 GN=DDX18 PE=1 SV=2	89	KSTVLTNGEAAM
HFSIIYLLKSWS	sp|Q82041|VP3_ROTHC	642	tr|A0A286YFA9|A0A286YFA9_HUMAN Protein furry homolog OS=Homo sapiens OX=9606 GN=FRY PE=1 SV=1	11	EISIKYLLKSWS
HFSIIYLLKSWS	sp|Q82041|VP3_ROTHC	642	sp|Q5TBA9|FRY_HUMAN Protein furry homolog OS=Homo sapiens OX=9606 GN=FRY PE=1 SV=1	11	EISIKYLLKSWS
HFSIIYLLKSWS	sp|Q82041|VP3_ROTHC	642	tr|A0A0C4DFX2|A0A0C4DFX2_HUMAN Protein furry homolog OS=Homo sapiens OX=9606 GN=FRY PE=1 SV=1	11	EISIKYLLKSWS
LTNGKAATYTRY	sp|P69481|VP6_ROTHC	200	tr|A0A0A0MR27|A0A0A0MR27_HUMAN Coiled-coil domain-containing protein 14 OS=Homo sapiens OX=9606 GN=CCDC14 PE=1 SV=1	23	LTNGKKATYLRK
LTNGKAATYTRY	sp|P69481|VP6_ROTHC	200	sp|Q49A88|CCD14_HUMAN Coiled-coil domain-containing protein 14 OS=Homo sapiens OX=9606 GN=CCDC14 PE=1 SV=3	71	LTNGKKATYLRK
LTNGKAATYTRY	sp|P69481|VP6_ROTHC	200	tr|J3QT39|J3QT39_HUMAN Coiled-coil domain containing 14, isoform CRA_c OS=Homo sapiens OX=9606 GN=CCDC14 PE=1 SV=2	23	LTNGKKATYLRK
EAEKQSYDTLTD	sp|Q82040|VP4_ROTHC	571	sp|Q9HB71|CYBP_HUMAN Calcyclin-binding protein OS=Homo sapiens OX=9606 GN=CACYBP PE=1 SV=2	175	EKEKPSYDTETD
SLKTKSGCTNPY	sp|Q82055|NSP4_ROTHC	47	sp|Q16890|TPD53_HUMAN Tumor protein D53 OS=Homo sapiens OX=9606 GN=TPD52L1 PE=1 SV=1	160	SLKTKVGGTNPN
SLKTKSGCTNPY	sp|Q82055|NSP4_ROTHC	47	tr|E9PPQ1|E9PPQ1_HUMAN Tumor protein D53 OS=Homo sapiens OX=9606 GN=TPD52L1 PE=1 SV=1	147	SLKTKVGGTNPN
SLKTKSGCTNPY	sp|Q82055|NSP4_ROTHC	47	tr|J3KNE7|J3KNE7_HUMAN Tumor protein D53 OS=Homo sapiens OX=9606 GN=TPD52L1 PE=1 SV=1	165	SLKTKVGGTNPN
TKRSIYNSFHVY	sp|Q91E96|VP2_ROTHC	43	sp|O60260|PRKN_HUMAN E3 ubiquitin-protein ligase parkin OS=Homo sapiens OX=9606 GN=PRKN PE=1 SV=2	138	AGRSIYNSFYVY
TKRSIYNSFHVY	sp|Q91E96|VP2_ROTHC	43	tr|A0A669KBE3|A0A669KBE3_HUMAN E3 ubiquitin-protein ligase parkin (Fragment) OS=Homo sapiens OX=9606 GN=PRKN PE=1 SV=1	137	AGRSIYNSFYVY
TKRSIYNSFHVY	sp|Q91E96|VP2_ROTHC	43	tr|B1AKC3|B1AKC3_HUMAN E3 ubiquitin-protein ligase parkin OS=Homo sapiens OX=9606 GN=PRKN PE=1 SV=1	138	AGRSIYNSFYVY
ISVIDVQRVSAQ	sp|Q82040|VP4_ROTHC	130	sp|Q7RTY8|TMPS7_HUMAN Transmembrane protease serine 7 OS=Homo sapiens OX=9606 GN=TMPRSS7 PE=2 SV=3	17	ISNISVQVVSAQ
LFESNETNHRIS	sp|Q82041|VP3_ROTHC	372	tr|A0A3B3ISV5|A0A3B3ISV5_HUMAN Uncharacterized protein OS=Homo sapiens OX=9606 PE=4 SV=1	230	LCESSELNHRIS
INDRVELSPVAH	sp|Q91E95|RDRP_ROTHC	685	sp|Q96AE7|TTC17_HUMAN Tetratricopeptide repeat protein 17 OS=Homo sapiens OX=9606 GN=TTC17 PE=1 SV=1	468	INDSVKSSPVAH
FSIIYLLKSWSM	sp|Q82041|VP3_ROTHC	643	tr|A0A286YFA9|A0A286YFA9_HUMAN Protein furry homolog OS=Homo sapiens OX=9606 GN=FRY PE=1 SV=1	12	ISIKYLLKSWSN
FSIIYLLKSWSM	sp|Q82041|VP3_ROTHC	643	sp|Q5TBA9|FRY_HUMAN Protein furry homolog OS=Homo sapiens OX=9606 GN=FRY PE=1 SV=1	12	ISIKYLLKSWSN
FSIIYLLKSWSM	sp|Q82041|VP3_ROTHC	643	tr|A0A0C4DFX2|A0A0C4DFX2_HUMAN Protein furry homolog OS=Homo sapiens OX=9606 GN=FRY PE=1 SV=1	12	ISIKYLLKSWSN
KSTKQLITNPDI	sp|Q91E96|VP2_ROTHC	285	sp|Q05940|VMAT2_HUMAN Synaptic vesicular amine transporter OS=Homo sapiens OX=9606 GN=SLC18A2 PE=1 SV=2	138	KATVQLITNPFI
LNCKTGMWYSNF	sp|P69481|VP6_ROTHC	120	tr|Q5JPT2|Q5JPT2_HUMAN SH3 domain-containing kinase-binding protein 1 (Fragment) OS=Homo sapiens OX=9606 GN=SH3KBP1 PE=1 SV=1	76	LNGKTGMFPSNF
LNCKTGMWYSNF	sp|P69481|VP6_ROTHC	120	tr|Q5VSN0|Q5VSN0_HUMAN SH3 domain-containing kinase-binding protein 1 OS=Homo sapiens OX=9606 GN=SH3KBP1 PE=1 SV=1	140	LNGKTGMFPSNF
LNCKTGMWYSNF	sp|P69481|VP6_ROTHC	120	tr|Q5JPT3|Q5JPT3_HUMAN SH3 domain-containing kinase-binding protein 1 (Fragment) OS=Homo sapiens OX=9606 GN=SH3KBP1 PE=1 SV=1	48	LNGKTGMFPSNF
LNCKTGMWYSNF	sp|P69481|VP6_ROTHC	120	tr|Q5JPT1|Q5JPT1_HUMAN SH3 domain-containing kinase-binding protein 1 (Fragment) OS=Homo sapiens OX=9606 GN=SH3KBP1 PE=1 SV=1	87	LNGKTGMFPSNF
LNCKTGMWYSNF	sp|P69481|VP6_ROTHC	120	sp|Q96B97|SH3K1_HUMAN SH3 domain-containing kinase-binding protein 1 OS=Homo sapiens OX=9606 GN=SH3KBP1 PE=1 SV=2	140	LNGKTGMFPSNF
ANSAIPLTTITA	sp|Q82040|VP4_ROTHC	203	sp|P01588|EPO_HUMAN Erythropoietin OS=Homo sapiens OX=9606 GN=EPO PE=1 SV=1	151	AASAAPLRTITA
LLFFVLLLDIII	sp|Q82041|VP3_ROTHC	239	sp|Q9NSD7|RL3R1_HUMAN Relaxin-3 receptor 1 OS=Homo sapiens OX=9606 GN=RXFP3 PE=1 SV=1	273	LLGFVLPLGIII
LLFFVLLLDIII	sp|Q82041|VP3_ROTHC	239	sp|Q92629|SGCD_HUMAN Delta-sarcoglycan OS=Homo sapiens OX=9606 GN=SGCD PE=1 SV=2	34	LYFFVLLLMILI
LLFFVLLLDIII	sp|Q82041|VP3_ROTHC	239	tr|E5RI34|E5RI34_HUMAN Delta-sarcoglycan OS=Homo sapiens OX=9606 GN=SGCD PE=1 SV=1	35	LYFFVLLLMILI
AKYFNVTVKLLN	sp|Q9PY93|NSP2_ROTHC	266	tr|C9JXZ0|C9JXZ0_HUMAN Procollagen-lysine,2-oxoglutarate 5-dioxygenase 2 (Fragment) OS=Homo sapiens OX=9606 GN=PLOD2 PE=1 SV=1	31	AKYFNYTVKVLG
AKYFNVTVKLLN	sp|Q9PY93|NSP2_ROTHC	266	sp|O00469|PLOD2_HUMAN Procollagen-lysine,2-oxoglutarate 5-dioxygenase 2 OS=Homo sapiens OX=9606 GN=PLOD2 PE=1 SV=2	59	AKYFNYTVKVLG
AKYFNVTVKLLN	sp|Q9PY93|NSP2_ROTHC	266	tr|E7ETU9|E7ETU9_HUMAN Procollagen-lysine 5-dioxygenase OS=Homo sapiens OX=9606 GN=PLOD2 PE=1 SV=1	4	AKYFNYTVKVLG
VLNILDLFSSSS	sp|Q82040|VP4_ROTHC	674	tr|A0A087WZL9|A0A087WZL9_HUMAN Zinc finger protein 644 OS=Homo sapiens OX=9606 GN=ZNF644 PE=1 SV=1	340	SLNSLHLFSSSS
VLNILDLFSSSS	sp|Q82040|VP4_ROTHC	674	sp|Q9H582|ZN644_HUMAN Zinc finger protein 644 OS=Homo sapiens OX=9606 GN=ZNF644 PE=1 SV=2	768	SLNSLHLFSSSS
INYSANGENVNG	sp|Q82040|VP4_ROTHC	351	tr|A0A3B3ISF9|A0A3B3ISF9_HUMAN Endothelin-converting enzyme 1 OS=Homo sapiens OX=9606 GN=ECE1 PE=1 SV=1	634	SNYSVNGEPVNG
INYSANGENVNG	sp|Q82040|VP4_ROTHC	351	sp|P42892|ECE1_HUMAN Endothelin-converting enzyme 1 OS=Homo sapiens OX=9606 GN=ECE1 PE=1 SV=2	650	SNYSVNGEPVNG
INYSANGENVNG	sp|Q82040|VP4_ROTHC	351	tr|B4DKB2|B4DKB2_HUMAN Endothelin-converting enzyme 1 OS=Homo sapiens OX=9606 GN=ECE1 PE=1 SV=1	650	SNYSVNGEPVNG
GSAMSKIPSFRG	sp|Q82040|VP4_ROTHC	642	sp|Q86YV5|PRAG1_HUMAN Inactive tyrosine-protein kinase PRAG1 OS=Homo sapiens OX=9606 GN=PRAG1 PE=1 SV=4	739	GSAESLSPSFRG
ISPNGKTYIIAS	sp|Q82040|VP4_ROTHC	530	sp|Q9ULI1|NWD2_HUMAN NACHT and WD repeat domain-containing protein 2 OS=Homo sapiens OX=9606 GN=NWD2 PE=2 SV=3	1532	ISPNGKLGIIAR
DSKSGKLLLSLV	sp|Q91E96|VP2_ROTHC	828	sp|Q96MM7|H6ST2_HUMAN Heparan-sulfate 6-O-sulfotransferase 2 OS=Homo sapiens OX=9606 GN=HS6ST2 PE=1 SV=2	148	DEKSNKLLLALV
KRSIYNSFHVYH	sp|Q91E96|VP2_ROTHC	44	sp|O60260|PRKN_HUMAN E3 ubiquitin-protein ligase parkin OS=Homo sapiens OX=9606 GN=PRKN PE=1 SV=2	139	GRSIYNSFYVYC
KRSIYNSFHVYH	sp|Q91E96|VP2_ROTHC	44	tr|A0A669KBE3|A0A669KBE3_HUMAN E3 ubiquitin-protein ligase parkin (Fragment) OS=Homo sapiens OX=9606 GN=PRKN PE=1 SV=1	138	GRSIYNSFYVYC
KRSIYNSFHVYH	sp|Q91E96|VP2_ROTHC	44	tr|B1AKC3|B1AKC3_HUMAN E3 ubiquitin-protein ligase parkin OS=Homo sapiens OX=9606 GN=PRKN PE=1 SV=1	139	GRSIYNSFYVYC
TEDSVYPKLRNI	sp|Q91E96|VP2_ROTHC	431	sp|Q09161|NCBP1_HUMAN Nuclear cap-binding protein subunit 1 OS=Homo sapiens OX=9606 GN=NCBP1 PE=1 SV=1	277	TEDSVYPMPRVI
VLTNGKAATYTR	sp|P69481|VP6_ROTHC	199	tr|A0A0A0MR27|A0A0A0MR27_HUMAN Coiled-coil domain-containing protein 14 OS=Homo sapiens OX=9606 GN=CCDC14 PE=1 SV=1	22	KLTNGKKATYLR
VLTNGKAATYTR	sp|P69481|VP6_ROTHC	199	sp|Q49A88|CCD14_HUMAN Coiled-coil domain-containing protein 14 OS=Homo sapiens OX=9606 GN=CCDC14 PE=1 SV=3	70	KLTNGKKATYLR
VLTNGKAATYTR	sp|P69481|VP6_ROTHC	199	tr|J3QT39|J3QT39_HUMAN Coiled-coil domain containing 14, isoform CRA_c OS=Homo sapiens OX=9606 GN=CCDC14 PE=1 SV=2	22	KLTNGKKATYLR
SVLNILDLFSSS	sp|Q82040|VP4_ROTHC	673	tr|A0A087WZL9|A0A087WZL9_HUMAN Zinc finger protein 644 OS=Homo sapiens OX=9606 GN=ZNF644 PE=1 SV=1	339	SSLNSLHLFSSS
SVLNILDLFSSS	sp|Q82040|VP4_ROTHC	673	sp|Q9H582|ZN644_HUMAN Zinc finger protein 644 OS=Homo sapiens OX=9606 GN=ZNF644 PE=1 SV=2	767	SSLNSLHLFSSS
DNLIETQVDSLK	sp|Q91E95|RDRP_ROTHC	633	sp|Q8NI27|THOC2_HUMAN THO complex subunit 2 OS=Homo sapiens OX=9606 GN=THOC2 PE=1 SV=2	591	DNLITPVVDSLK
DNLIETQVDSLK	sp|Q91E95|RDRP_ROTHC	633	tr|A0A0C4DG98|A0A0C4DG98_HUMAN THO complex subunit 2 OS=Homo sapiens OX=9606 GN=THOC2 PE=1 SV=1	476	DNLITPVVDSLK
FYYGNLSLTGKS	sp|Q91E95|RDRP_ROTHC	189	sp|Q5T1R4|ZEP3_HUMAN Transcription factor HIVEP3 OS=Homo sapiens OX=9606 GN=HIVEP3 PE=2 SV=1	1013	FDYGSLSLTGPS
SFNMYVLSTEGE	sp|Q91E96|VP2_ROTHC	94	sp|Q14952|KI2S3_HUMAN Killer cell immunoglobulin-like receptor 2DS3 OS=Homo sapiens OX=9606 GN=KIR2DS3 PE=2 SV=1	154	SYDMYHLSTEGE
SFNMYVLSTEGE	sp|Q91E96|VP2_ROTHC	94	tr|K7RE56|K7RE56_HUMAN KIR2DS3 OS=Homo sapiens OX=9606 GN=KIR2DS3 PE=4 SV=1	154	SYDMYHLSTEGE
PTLVNYPISTNT	sp|Q9PY93|NSP2_ROTHC	121	sp|Q8WXI7|MUC16_HUMAN Mucin-16 OS=Homo sapiens OX=9606 GN=MUC16 PE=1 SV=3	1237	PTLSTYPESTNT
FSSSSTSLIDDT	sp|Q82040|VP4_ROTHC	681	tr|H0Y6V3|H0Y6V3_HUMAN Non-specific serine/threonine protein kinase (Fragment) OS=Homo sapiens OX=9606 GN=CDC42BPA PE=1 SV=1	145	FSSSSSSLIDFL
LMSFLVPFGNIV	sp|P69481|VP6_ROTHC	133	sp|O43497|CAC1G_HUMAN Voltage-dependent T-type calcium channel subunit alpha-1G OS=Homo sapiens OX=9606 GN=CACNA1G PE=1 SV=3	1405	LMSSLKPIGNIV
LMSFLVPFGNIV	sp|P69481|VP6_ROTHC	133	tr|H0YAN0|H0YAN0_HUMAN Voltage-dependent T-type calcium channel subunit alpha-1G (Fragment) OS=Homo sapiens OX=9606 GN=CACNA1G PE=1 SV=1	220	LMSSLKPIGNIV
LMSFLVPFGNIV	sp|P69481|VP6_ROTHC	133	tr|A0A0B4J1X2|A0A0B4J1X2_HUMAN Voltage-dependent T-type calcium channel subunit alpha-1G OS=Homo sapiens OX=9606 GN=CACNA1G PE=1 SV=1	1405	LMSSLKPIGNIV
AKRTGLYPVIDI	sp|Q9PY94|NSP1_ROTHC	29	tr|Q5TG12|Q5TG12_HUMAN Protein-tyrosine-phosphatase OS=Homo sapiens OX=9606 GN=PTPRK PE=1 SV=1	1105	AGRTGCYIVIDI
AKRTGLYPVIDI	sp|Q9PY94|NSP1_ROTHC	29	tr|E9PGC5|E9PGC5_HUMAN Protein-tyrosine-phosphatase OS=Homo sapiens OX=9606 GN=PTPRK PE=1 SV=1	1119	AGRTGCYIVIDI
AKRTGLYPVIDI	sp|Q9PY94|NSP1_ROTHC	29	sp|Q15262|PTPRK_HUMAN Receptor-type tyrosine-protein phosphatase kappa OS=Homo sapiens OX=9606 GN=PTPRK PE=1 SV=2	1086	AGRTGCYIVIDI
LFSSSSTSLIDD	sp|Q82040|VP4_ROTHC	680	tr|H0Y6V3|H0Y6V3_HUMAN Non-specific serine/threonine protein kinase (Fragment) OS=Homo sapiens OX=9606 GN=CDC42BPA PE=1 SV=1	144	SFSSSSSSLIDF
DSLKTKSGCTNP	sp|Q82055|NSP4_ROTHC	46	sp|Q16890|TPD53_HUMAN Tumor protein D53 OS=Homo sapiens OX=9606 GN=TPD52L1 PE=1 SV=1	159	TSLKTKVGGTNP
DSLKTKSGCTNP	sp|Q82055|NSP4_ROTHC	46	tr|E9PPQ1|E9PPQ1_HUMAN Tumor protein D53 OS=Homo sapiens OX=9606 GN=TPD52L1 PE=1 SV=1	146	TSLKTKVGGTNP
DSLKTKSGCTNP	sp|Q82055|NSP4_ROTHC	46	tr|J3KNE7|J3KNE7_HUMAN Tumor protein D53 OS=Homo sapiens OX=9606 GN=TPD52L1 PE=1 SV=1	164	TSLKTKVGGTNP
RQERLNEEQLRT	sp|Q91E96|VP2_ROTHC	141	tr|K7EKX7|K7EKX7_HUMAN Glutathione peroxidase (Fragment) OS=Homo sapiens OX=9606 GN=GPX4 PE=1 SV=3	164	RQERLRGEALRT
RQERLNEEQLRT	sp|Q91E96|VP2_ROTHC	141	tr|K7EJ20|K7EJ20_HUMAN Glutathione peroxidase OS=Homo sapiens OX=9606 GN=GPX4 PE=1 SV=3	151	RQERLRGEALRT
LTTLGLASQVSL	sp|Q91E96|VP2_ROTHC	561	sp|Q01362|FCERB_HUMAN High affinity immunoglobulin epsilon receptor subunit beta OS=Homo sapiens OX=9606 GN=MS4A2 PE=1 SV=1	188	LTILGLGSAVSL
LTTLGLASQVSL	sp|Q91E96|VP2_ROTHC	561	tr|A0A0B4J2E9|A0A0B4J2E9_HUMAN High affinity immunoglobulin epsilon receptor subunit beta OS=Homo sapiens OX=9606 GN=MS4A2 PE=1 SV=1	143	LTILGLGSAVSL
VHDDGKIKLYAQ	sp|Q91E95|RDRP_ROTHC	426	sp|Q9NY28|GALT8_HUMAN Probable polypeptide N-acetylgalactosaminyltransferase 8 OS=Homo sapiens OX=9606 GN=GALNT8 PE=2 SV=1	230	VHLDEKIKLYNQ
SIIYLLKSWSMP	sp|Q82041|VP3_ROTHC	644	tr|A0A286YFA9|A0A286YFA9_HUMAN Protein furry homolog OS=Homo sapiens OX=9606 GN=FRY PE=1 SV=1	13	SIKYLLKSWSNT
SIIYLLKSWSMP	sp|Q82041|VP3_ROTHC	644	sp|Q5TBA9|FRY_HUMAN Protein furry homolog OS=Homo sapiens OX=9606 GN=FRY PE=1 SV=1	13	SIKYLLKSWSNT
SIIYLLKSWSMP	sp|Q82041|VP3_ROTHC	644	tr|A0A0C4DFX2|A0A0C4DFX2_HUMAN Protein furry homolog OS=Homo sapiens OX=9606 GN=FRY PE=1 SV=1	13	SIKYLLKSWSNT
