query	query_seqname	query_start	target_seqname	target_start	target
LHLSSLEDSMPV	tr|Q0GNM7|Q0GNM7_HSPV	37	sp|Q5JV73|FRPD3_HUMAN FERM and PDZ domain-containing protein 3 OS=Homo sapiens OX=9606 GN=FRMPD3 PE=2 SV=2	1078	LHLSQQEDSLPV
LHLSSLEDSMPV	tr|Q0GNM7|Q0GNM7_HSPV	37	tr|A0A0A0MSP7|A0A0A0MSP7_HUMAN FERM and PDZ domain-containing protein 3 (Fragment) OS=Homo sapiens OX=9606 GN=FRMPD3 PE=1 SV=1	1026	LHLSQQEDSLPV
SNEIHAIGELLL	tr|Q0GNU0|Q0GNU0_HSPV	235	sp|Q9GZX6|IL22_HUMAN Interleukin-22 OS=Homo sapiens OX=9606 GN=IL22 PE=1 SV=1	158	SGEIKAIGELDL
ALRNALSKDDET	tr|Q0GNT6|Q0GNT6_HSPV	86	sp|Q9ULE6|PALD_HUMAN Paladin OS=Homo sapiens OX=9606 GN=PALD1 PE=1 SV=3	644	ALRAALSKDPGT
SEQSKTKDNLIK	tr|Q0GNS4|Q0GNS4_HSPV	125	sp|Q8IWW6|RHG12_HUMAN Rho GTPase-activating protein 12 OS=Homo sapiens OX=9606 GN=ARHGAP12 PE=1 SV=1	621	SEQKKTKKNLKK
SEQSKTKDNLIK	tr|Q0GNS4|Q0GNS4_HSPV	125	tr|Q1RLN5|Q1RLN5_HUMAN ARHGAP12 protein OS=Homo sapiens OX=9606 GN=ARHGAP12 PE=1 SV=1	574	SEQKKTKKNLKK
KSKRISDVFLTS	tr|Q0GNP4|Q0GNP4_HSPV	11	sp|Q86UW6|N4BP2_HUMAN NEDD4-binding protein 2 OS=Homo sapiens OX=9606 GN=N4BP2 PE=1 SV=2	310	KSTRVSDVFLPS
LKVLNNWYNGID	tr|Q0GNX1|Q0GNX1_HSPV	240	sp|Q13029|PRDM2_HUMAN PR domain zinc finger protein 2 OS=Homo sapiens OX=9606 GN=PRDM2 PE=1 SV=3	889	QKVLLNEYNGID
DKMYYKLSFKKR	tr|Q0GP25|Q0GP25_HSPV	88	tr|A0A2R8YED7|A0A2R8YED7_HUMAN Connector enhancer of kinase suppressor of ras 2 OS=Homo sapiens OX=9606 GN=CNKSR2 PE=1 SV=1	906	TKMEYKLSFIKR
DKMYYKLSFKKR	tr|Q0GP25|Q0GP25_HSPV	88	sp|Q8WXI2|CNKR2_HUMAN Connector enhancer of kinase suppressor of ras 2 OS=Homo sapiens OX=9606 GN=CNKSR2 PE=1 SV=1	931	TKMEYKLSFIKR
DKMYYKLSFKKR	tr|Q0GP25|Q0GP25_HSPV	88	tr|A0A2R8Y700|A0A2R8Y700_HUMAN Connector enhancer of kinase suppressor of ras 2 OS=Homo sapiens OX=9606 GN=CNKSR2 PE=1 SV=1	852	TKMEYKLSFIKR
DKMYYKLSFKKR	tr|Q0GP25|Q0GP25_HSPV	88	tr|A0A2R8Y7A1|A0A2R8Y7A1_HUMAN Connector enhancer of kinase suppressor of ras 2 OS=Homo sapiens OX=9606 GN=CNKSR2 PE=1 SV=1	882	TKMEYKLSFIKR
FLNLFDNELKPS	tr|Q0GP20|Q0GP20_HSPV	66	sp|Q7L0X0|TRIL_HUMAN TLR4 interactor with leucine rich repeats OS=Homo sapiens OX=9606 GN=TRIL PE=1 SV=2	207	FLNLSANELQPS
KPLKKDSERKEE	tr|Q0GNU0|Q0GNU0_HSPV	139	sp|P78559|MAP1A_HUMAN Microtubule-associated protein 1A OS=Homo sapiens OX=9606 GN=MAP1A PE=1 SV=6	428	KELKKDEGRKEE
KPLKKDSERKEE	tr|Q0GNU0|Q0GNU0_HSPV	139	tr|E9PGC8|E9PGC8_HUMAN Microtubule-associated protein 1A OS=Homo sapiens OX=9606 GN=MAP1A PE=1 SV=1	666	KELKKDEGRKEE
WRYTQTLGGTSV	tr|Q0GNX5|Q0GNX5_HSPV	44	tr|K7EK00|K7EK00_HUMAN Protein FAM210A (Fragment) OS=Homo sapiens OX=9606 GN=FAM210A PE=1 SV=1	200	ARYTVTLGGTSV
WRYTQTLGGTSV	tr|Q0GNX5|Q0GNX5_HSPV	44	sp|Q96ND0|F210A_HUMAN Protein FAM210A OS=Homo sapiens OX=9606 GN=FAM210A PE=1 SV=2	200	ARYTVTLGGTSV
SISDVTDPLSDS	tr|Q0GNQ4|Q0GNQ4_HSPV	251	tr|F5GZ41|F5GZ41_HUMAN Peroxisomal targeting signal 1 receptor (Fragment) OS=Homo sapiens OX=9606 GN=PEX5 PE=1 SV=1	61	FISEVTDPLSVS
SISDVTDPLSDS	tr|Q0GNQ4|Q0GNQ4_HSPV	251	tr|F5H0L9|F5H0L9_HUMAN Peroxisomal targeting signal 1 receptor (Fragment) OS=Homo sapiens OX=9606 GN=PEX5 PE=1 SV=8	61	FISEVTDPLSVS
SISDVTDPLSDS	tr|Q0GNQ4|Q0GNQ4_HSPV	251	tr|F5GYB4|F5GYB4_HUMAN Peroxisomal targeting signal 1 receptor (Fragment) OS=Homo sapiens OX=9606 GN=PEX5 PE=1 SV=1	61	FISEVTDPLSVS
SISDVTDPLSDS	tr|Q0GNQ4|Q0GNQ4_HSPV	251	tr|F5H3X7|F5H3X7_HUMAN Peroxisomal targeting signal 1 receptor (Fragment) OS=Homo sapiens OX=9606 GN=PEX5 PE=1 SV=1	144	FISEVTDPLSVS
SISDVTDPLSDS	tr|Q0GNQ4|Q0GNQ4_HSPV	251	sp|P50542|PEX5_HUMAN Peroxisomal targeting signal 1 receptor OS=Homo sapiens OX=9606 GN=PEX5 PE=1 SV=3	144	FISEVTDPLSVS
SISDVTDPLSDS	tr|Q0GNQ4|Q0GNQ4_HSPV	251	tr|B4E0T2|B4E0T2_HUMAN PTS1-BP OS=Homo sapiens OX=9606 GN=PEX5 PE=1 SV=1	165	FISEVTDPLSVS
SISDVTDPLSDS	tr|Q0GNQ4|Q0GNQ4_HSPV	251	tr|J3KPV0|J3KPV0_HUMAN PTS1-BP (Fragment) OS=Homo sapiens OX=9606 GN=PEX5 PE=1 SV=1	159	FISEVTDPLSVS
SISDVTDPLSDS	tr|Q0GNQ4|Q0GNQ4_HSPV	251	tr|F5H5C0|F5H5C0_HUMAN Peroxisomal targeting signal 1 receptor (Fragment) OS=Homo sapiens OX=9606 GN=PEX5 PE=1 SV=1	132	FISEVTDPLSVS
AFDKDIEYTEPK	tr|Q0GP16|Q0GP16_HSPV	20	tr|A2A3E5|A2A3E5_HUMAN Protocadherin-15 OS=Homo sapiens OX=9606 GN=PCDH15 PE=1 SV=1	428	ALDKDIEDEEPK
LYLKDSDDLSKM	tr|Q0GP70|Q0GP70_HSPV	549	tr|X6R7N2|X6R7N2_HUMAN Sperm protein-associated with the nucleus on the X chromosome N4 OS=Homo sapiens OX=9606 GN=SPANXN4 PE=1 SV=1	119	LYVGDSDTLSKM
YKCKVNNDPQVE	tr|Q0GNV2|Q0GNV2_HSPV	5	sp|Q96KR1|ZFR_HUMAN Zinc finger RNA-binding protein OS=Homo sapiens OX=9606 GN=ZFR PE=1 SV=2	610	YKKKVNPDLQVE
FAKEANVVALVT	tr|Q0GNW6|Q0GNW6_HSPV	449	tr|H0YD82|H0YD82_HUMAN Putative deoxyribonuclease TATDN3 (Fragment) OS=Homo sapiens OX=9606 GN=TATDN3 PE=1 SV=1	29	KAKKANVVALVA
FAKEANVVALVT	tr|Q0GNW6|Q0GNW6_HSPV	449	tr|E9PPF0|E9PPF0_HUMAN Putative deoxyribonuclease TATDN3 OS=Homo sapiens OX=9606 GN=TATDN3 PE=1 SV=1	30	KAKKANVVALVA
FAKEANVVALVT	tr|Q0GNW6|Q0GNW6_HSPV	449	tr|H0YCC7|H0YCC7_HUMAN Putative deoxyribonuclease TATDN3 (Fragment) OS=Homo sapiens OX=9606 GN=TATDN3 PE=1 SV=1	30	KAKKANVVALVA
FAKEANVVALVT	tr|Q0GNW6|Q0GNW6_HSPV	449	tr|E9PRA1|E9PRA1_HUMAN Putative deoxyribonuclease TATDN3 (Fragment) OS=Homo sapiens OX=9606 GN=TATDN3 PE=1 SV=2	29	KAKKANVVALVA
FAKEANVVALVT	tr|Q0GNW6|Q0GNW6_HSPV	449	tr|E9PP81|E9PP81_HUMAN Putative deoxyribonuclease TATDN3 OS=Homo sapiens OX=9606 GN=TATDN3 PE=1 SV=1	30	KAKKANVVALVA
FAKEANVVALVT	tr|Q0GNW6|Q0GNW6_HSPV	449	sp|Q17R31|TATD3_HUMAN Putative deoxyribonuclease TATDN3 OS=Homo sapiens OX=9606 GN=TATDN3 PE=1 SV=1	30	KAKKANVVALVA
FAKEANVVALVT	tr|Q0GNW6|Q0GNW6_HSPV	449	tr|E9PQP8|E9PQP8_HUMAN Putative deoxyribonuclease TATDN3 OS=Homo sapiens OX=9606 GN=TATDN3 PE=1 SV=1	30	KAKKANVVALVA
CITSICNSSVLE	tr|Q0GNU0|Q0GNU0_HSPV	1095	sp|Q13415|ORC1_HUMAN Origin recognition complex subunit 1 OS=Homo sapiens OX=9606 GN=ORC1 PE=1 SV=2	763	YITAIKNSSVLE
KSKLICCNNVPK	tr|Q0GNQ9|Q0GNQ9_HSPV	51	tr|A6ZJ87|A6ZJ87_HUMAN G-protein coupled receptor 24 OS=Homo sapiens OX=9606 GN=MCHR1 PE=4 SV=1	137	KSKLHWCNNVPD
KSKLICCNNVPK	tr|Q0GNQ9|Q0GNQ9_HSPV	51	sp|Q99705|MCHR1_HUMAN Melanin-concentrating hormone receptor 1 OS=Homo sapiens OX=9606 GN=MCHR1 PE=1 SV=2	137	KSKLHWCNNVPD
GELLLVSAEVMH	tr|Q0GNU0|Q0GNU0_HSPV	242	sp|Q6IQ32|ADNP2_HUMAN Activity-dependent neuroprotector homeobox protein 2 OS=Homo sapiens OX=9606 GN=ADNP2 PE=1 SV=1	959	SELLLVSGEVMH
PEDGAYDRLHSS	tr|Q0GP49|Q0GP49_HSPV	74	sp|Q9Y6Q6|TNR11_HUMAN Tumor necrosis factor receptor superfamily member 11A OS=Homo sapiens OX=9606 GN=TNFRSF11A PE=1 SV=1	493	PEDGADGRLPSS
EPSLLVTKDLIN	tr|Q0GNY2|Q0GNY2_HSPV	278	sp|Q8N7H5|PAF1_HUMAN RNA polymerase II-associated factor 1 homolog OS=Homo sapiens OX=9606 GN=PAF1 PE=1 SV=2	77	EPDLGVTIDLIN
ELLKWPLKAFYE	tr|Q0GNX8|Q0GNX8_HSPV	43	tr|A0A1B0GUF7|A0A1B0GUF7_HUMAN IQ domain-containing protein M OS=Homo sapiens OX=9606 GN=IQCM PE=4 SV=1	183	ELLKEPDKAFYD
ELLKWPLKAFYE	tr|Q0GNX8|Q0GNX8_HSPV	43	sp|A0A1B0GVH7|IQCM_HUMAN IQ domain-containing protein M OS=Homo sapiens OX=9606 GN=IQCM PE=4 SV=1	183	ELLKEPDKAFYD
LDNVAYIDYFLE	tr|Q0GP91|Q0GP91_HSPV	49	tr|H7C2X0|H7C2X0_HUMAN Translation initiation factor eIF-2B subunit epsilon (Fragment) OS=Homo sapiens OX=9606 GN=EIF2B5 PE=1 SV=1	66	LANVALIDYTLE
LDNVAYIDYFLE	tr|Q0GP91|Q0GP91_HSPV	49	tr|C9JRD9|C9JRD9_HUMAN Translation initiation factor eIF-2B subunit epsilon OS=Homo sapiens OX=9606 GN=EIF2B5 PE=1 SV=1	70	LANVALIDYTLE
LDNVAYIDYFLE	tr|Q0GP91|Q0GP91_HSPV	49	tr|A0A3B3ISS1|A0A3B3ISS1_HUMAN Translation initiation factor eIF-2B subunit epsilon (Fragment) OS=Homo sapiens OX=9606 GN=EIF2B5 PE=1 SV=1	53	LANVALIDYTLE
LDNVAYIDYFLE	tr|Q0GP91|Q0GP91_HSPV	49	tr|A0A3B3IS56|A0A3B3IS56_HUMAN Translation initiation factor eIF-2B subunit epsilon OS=Homo sapiens OX=9606 GN=EIF2B5 PE=1 SV=1	70	LANVALIDYTLE
LDNVAYIDYFLE	tr|Q0GP91|Q0GP91_HSPV	49	tr|A0A3B3ITQ2|A0A3B3ITQ2_HUMAN Translation initiation factor eIF-2B subunit epsilon (Fragment) OS=Homo sapiens OX=9606 GN=EIF2B5 PE=1 SV=1	68	LANVALIDYTLE
LDNVAYIDYFLE	tr|Q0GP91|Q0GP91_HSPV	49	tr|A0A3B3ISX3|A0A3B3ISX3_HUMAN Translation initiation factor eIF-2B subunit epsilon OS=Homo sapiens OX=9606 GN=EIF2B5 PE=1 SV=1	70	LANVALIDYTLE
LDNVAYIDYFLE	tr|Q0GP91|Q0GP91_HSPV	49	sp|Q13144|EI2BE_HUMAN Translation initiation factor eIF-2B subunit epsilon OS=Homo sapiens OX=9606 GN=EIF2B5 PE=1 SV=3	70	LANVALIDYTLE
LDNVAYIDYFLE	tr|Q0GP91|Q0GP91_HSPV	49	tr|A0A3B3ITG6|A0A3B3ITG6_HUMAN Translation initiation factor eIF-2B subunit epsilon (Fragment) OS=Homo sapiens OX=9606 GN=EIF2B5 PE=1 SV=1	26	LANVALIDYTLE
LDNVAYIDYFLE	tr|Q0GP91|Q0GP91_HSPV	49	tr|A0A3B3IUF2|A0A3B3IUF2_HUMAN Translation initiation factor eIF-2B subunit epsilon OS=Homo sapiens OX=9606 GN=EIF2B5 PE=1 SV=1	70	LANVALIDYTLE
LDNVAYIDYFLE	tr|Q0GP91|Q0GP91_HSPV	49	tr|A0A3B3ISM8|A0A3B3ISM8_HUMAN Translation initiation factor eIF-2B subunit epsilon OS=Homo sapiens OX=9606 GN=EIF2B5 PE=1 SV=1	70	LANVALIDYTLE
LDNVAYIDYFLE	tr|Q0GP91|Q0GP91_HSPV	49	tr|A0A3B3IRP4|A0A3B3IRP4_HUMAN Translation initiation factor eIF-2B subunit epsilon OS=Homo sapiens OX=9606 GN=EIF2B5 PE=1 SV=1	70	LANVALIDYTLE
LDNVAYIDYFLE	tr|Q0GP91|Q0GP91_HSPV	49	tr|A0A3B3IUB1|A0A3B3IUB1_HUMAN eIF-2B GDP-GTP exchange factor subunit epsilon OS=Homo sapiens OX=9606 GN=EIF2B5 PE=1 SV=1	70	LANVALIDYTLE
YEGGSESADLGI	tr|Q0GP15|Q0GP15_HSPV	48	sp|Q9BQG1|SYT3_HUMAN Synaptotagmin-3 OS=Homo sapiens OX=9606 GN=SYT3 PE=1 SV=1	423	VEGGSEKADLGE
DTKGTTSEILSN	tr|Q0GNM8|Q0GNM8_HSPV	881	sp|Q92769|HDAC2_HUMAN Histone deacetylase 2 OS=Homo sapiens OX=9606 GN=HDAC2 PE=1 SV=2	476	DTKGTKSEQLSN
SILSDPSDIVEL	tr|Q0GNS4|Q0GNS4_HSPV	174	sp|Q8N6C5|IGSF1_HUMAN Immunoglobulin superfamily member 1 OS=Homo sapiens OX=9606 GN=IGSF1 PE=1 SV=3	855	SIWSEPSDPVEL
SILSDPSDIVEL	tr|Q0GNS4|Q0GNS4_HSPV	174	tr|A0A494C0K8|A0A494C0K8_HUMAN Immunoglobulin superfamily member 1 OS=Homo sapiens OX=9606 GN=IGSF1 PE=1 SV=1	855	SIWSEPSDPVEL
PYVCEVSVLSSA	tr|Q0GP93|Q0GP93_HSPV	114	sp|O14686|KMT2D_HUMAN Histone-lysine N-methyltransferase 2D OS=Homo sapiens OX=9606 GN=KMT2D PE=1 SV=2	36	PHVGEVSVLSSG
LRSSQSEHLNSV	tr|Q0GNW8|Q0GNW8_HSPV	351	tr|H0YJ14|H0YJ14_HUMAN Fanconi anemia group M protein (Fragment) OS=Homo sapiens OX=9606 GN=FANCM PE=1 SV=1	832	ERRSQSEMLNSV
LRSSQSEHLNSV	tr|Q0GNW8|Q0GNW8_HSPV	351	tr|H0YJS3|H0YJS3_HUMAN Fanconi anemia group M protein (Fragment) OS=Homo sapiens OX=9606 GN=FANCM PE=1 SV=1	1380	ERRSQSEMLNSV
LRSSQSEHLNSV	tr|Q0GNW8|Q0GNW8_HSPV	351	sp|Q8IYD8|FANCM_HUMAN Fanconi anemia group M protein OS=Homo sapiens OX=9606 GN=FANCM PE=1 SV=2	1864	ERRSQSEMLNSV
LRSSQSEHLNSV	tr|Q0GNW8|Q0GNW8_HSPV	351	tr|H0YJN7|H0YJN7_HUMAN Fanconi anemia group M protein (Fragment) OS=Homo sapiens OX=9606 GN=FANCM PE=1 SV=1	84	ERRSQSEMLNSV
KDIIEDEEVEDE	tr|Q0GNP0|Q0GNP0_HSPV	26	sp|Q8IU57|INLR1_HUMAN Interferon lambda receptor 1 OS=Homo sapiens OX=9606 GN=IFNLR1 PE=1 SV=1	320	KDLAEDEEEEDE
RESNEIHAIGEL	tr|Q0GNU0|Q0GNU0_HSPV	233	sp|Q9GZX6|IL22_HUMAN Interleukin-22 OS=Homo sapiens OX=9606 GN=IL22 PE=1 SV=1	156	GESGEIKAIGEL
LTIDSTKKKPLK	tr|Q0GNU0|Q0GNU0_HSPV	131	tr|H0YAP2|H0YAP2_HUMAN Polyadenylate-binding protein 1 (Fragment) OS=Homo sapiens OX=9606 GN=PABPC1 PE=1 SV=1	116	GTITSAKKKPLK
DSTNNSENYYLI	tr|Q0GNV9|Q0GNV9_HSPV	82	tr|U3KPY3|U3KPY3_HUMAN Single-stranded DNA-binding protein 4 (Fragment) OS=Homo sapiens OX=9606 GN=SSBP4 PE=1 SV=2	52	DSTNSSENMYTI
DSTNNSENYYLI	tr|Q0GNV9|Q0GNV9_HSPV	82	sp|Q9BWG4|SSBP4_HUMAN Single-stranded DNA-binding protein 4 OS=Homo sapiens OX=9606 GN=SSBP4 PE=1 SV=1	281	DSTNSSENMYTI
NPLIPSFRGRTF	tr|Q0GNW6|Q0GNW6_HSPV	143	sp|Q99527|GPER1_HUMAN G-protein coupled estrogen receptor 1 OS=Homo sapiens OX=9606 GN=GPER1 PE=1 SV=1	320	NPLIYSFLGETF
RTLAMPAKGNLI	tr|Q0GNU0|Q0GNU0_HSPV	800	sp|Q14573|ITPR3_HUMAN Inositol 1,4,5-trisphosphate receptor type 3 OS=Homo sapiens OX=9606 GN=ITPR3 PE=1 SV=2	1527	RTLAMVAKGRAI
PPKARWHVRSRS	tr|Q0GNZ7|Q0GNZ7_HSPV	133	sp|B3KS81|SRRM5_HUMAN Serine/arginine repetitive matrix protein 5 OS=Homo sapiens OX=9606 GN=SRRM5 PE=1 SV=3	455	PNKARDHSRSRS
WGTKSGGGIGHG	tr|Q0GP71|Q0GP71_HSPV	3	sp|A6NMB9|FIGL2_HUMAN Fidgetin-like protein 2 OS=Homo sapiens OX=9606 GN=FIGNL2 PE=2 SV=2	116	PGTKSGGGGGSG
DIDKELARSLNS	tr|Q0GNV3|Q0GNV3_HSPV	18	sp|O14964|HGS_HUMAN Hepatocyte growth factor-regulated tyrosine kinase substrate OS=Homo sapiens OX=9606 GN=HGS PE=1 SV=1	321	DIDPELARYLNR
DIDKELARSLNS	tr|Q0GNV3|Q0GNV3_HSPV	18	tr|I3L1E3|I3L1E3_HUMAN Hepatocyte growth factor-regulated tyrosine kinase substrate (Fragment) OS=Homo sapiens OX=9606 GN=HGS PE=1 SV=1	41	DIDPELARYLNR
MDPRRVYDSLNM	tr|Q0GP87|Q0GP87_HSPV	26	tr|A0A5K1VW79|A0A5K1VW79_HUMAN Cytoplasmic polyadenylation element-binding protein 2 OS=Homo sapiens OX=9606 GN=CPEB2 PE=1 SV=1	651	MDRSRMYDSLNM
AGSSSSSSTTFA	tr|Q0GP37|Q0GP37_HSPV	245	sp|Q96JA1|LRIG1_HUMAN Leucine-rich repeats and immunoglobulin-like domains protein 1 OS=Homo sapiens OX=9606 GN=LRIG1 PE=1 SV=2	518	AASSSSSPMTFA
AGSSSSSSTTFA	tr|Q0GP37|Q0GP37_HSPV	245	sp|O15066|KIF3B_HUMAN Kinesin-like protein KIF3B OS=Homo sapiens OX=9606 GN=KIF3B PE=1 SV=1	723	SGSSSSSSGTPA
GIFNGSTSSFPN	tr|Q0GNW8|Q0GNW8_HSPV	603	tr|H0Y902|H0Y902_HUMAN Solute carrier family 23 member 1 (Fragment) OS=Homo sapiens OX=9606 GN=SLC23A1 PE=1 SV=1	121	GTGNGSTSSSPN
GIFNGSTSSFPN	tr|Q0GNW8|Q0GNW8_HSPV	603	tr|H0Y544|H0Y544_HUMAN Solute carrier family 23 member 2 (Fragment) OS=Homo sapiens OX=9606 GN=SLC23A2 PE=1 SV=1	190	GTGNGSTSSSPN
GIFNGSTSSFPN	tr|Q0GNW8|Q0GNW8_HSPV	603	sp|Q9UGH3|S23A2_HUMAN Solute carrier family 23 member 2 OS=Homo sapiens OX=9606 GN=SLC23A2 PE=1 SV=1	433	GTGNGSTSSSPN
GIFNGSTSSFPN	tr|Q0GNW8|Q0GNW8_HSPV	603	sp|Q9UHI7|S23A1_HUMAN Solute carrier family 23 member 1 OS=Homo sapiens OX=9606 GN=SLC23A1 PE=1 SV=3	374	GTGNGSTSSSPN
ITSICNSSVLEG	tr|Q0GNU0|Q0GNU0_HSPV	1096	sp|Q13415|ORC1_HUMAN Origin recognition complex subunit 1 OS=Homo sapiens OX=9606 GN=ORC1 PE=1 SV=2	764	ITAIKNSSVLEQ
MTNDIDLEVQRV	tr|Q0GNV8|Q0GNV8_HSPV	632	sp|P0C7T5|ATX1L_HUMAN Ataxin-1-like OS=Homo sapiens OX=9606 GN=ATXN1L PE=1 SV=1	329	GTPDTDLEVQRV
LDLWPLGFKLLG	tr|Q0GP25|Q0GP25_HSPV	188	tr|H7BZN3|H7BZN3_HUMAN Telomere-associated protein RIF1 (Fragment) OS=Homo sapiens OX=9606 GN=RIF1 PE=1 SV=1	242	LKLWPLFVKLLG
LDLWPLGFKLLG	tr|Q0GP25|Q0GP25_HSPV	188	sp|Q5UIP0|RIF1_HUMAN Telomere-associated protein RIF1 OS=Homo sapiens OX=9606 GN=RIF1 PE=1 SV=2	250	LKLWPLFVKLLG
IEVKRNTILQDV	tr|Q0GNY3|Q0GNY3_HSPV	175	sp|Q9NRD9|DUOX1_HUMAN Dual oxidase 1 OS=Homo sapiens OX=9606 GN=DUOX1 PE=1 SV=1	529	IEEIRNTTLQDV
NLNNYEYEELDL	tr|Q0GNU3|Q0GNU3_HSPV	230	tr|Q5T321|Q5T321_HUMAN Neurobeachin OS=Homo sapiens OX=9606 GN=NBEA PE=1 SV=1	2320	VLTNYESEELDL
NLNNYEYEELDL	tr|Q0GNU3|Q0GNU3_HSPV	230	sp|Q8NFP9|NBEA_HUMAN Neurobeachin OS=Homo sapiens OX=9606 GN=NBEA PE=1 SV=3	2323	VLTNYESEELDL
NLNNYEYEELDL	tr|Q0GNU3|Q0GNU3_HSPV	230	tr|F5GXV7|F5GXV7_HUMAN Neurobeachin OS=Homo sapiens OX=9606 GN=NBEA PE=1 SV=2	2324	VLTNYESEELDL
NLNNYEYEELDL	tr|Q0GNU3|Q0GNU3_HSPV	230	tr|A0A0D9SF28|A0A0D9SF28_HUMAN Neurobeachin OS=Homo sapiens OX=9606 GN=NBEA PE=1 SV=1	2323	VLTNYESEELDL
GTKSGGGIGHGS	tr|Q0GP71|Q0GP71_HSPV	4	sp|A6NMB9|FIGL2_HUMAN Fidgetin-like protein 2 OS=Homo sapiens OX=9606 GN=FIGNL2 PE=2 SV=2	117	GTKSGGGGGSGA
ENEDMFPKLIDI	tr|Q0GP60|Q0GP60_HSPV	170	sp|Q96QB1|RHG07_HUMAN Rho GTPase-activating protein 7 OS=Homo sapiens OX=9606 GN=DLC1 PE=1 SV=4	898	ENEDIFPELDDI
SLLLGESSVEGE	tr|Q0GNY6|Q0GNY6_HSPV	875	tr|A0A590UJZ8|A0A590UJZ8_HUMAN Ryanodine receptor 2 (Fragment) OS=Homo sapiens OX=9606 GN=RYR2 PE=1 SV=1	1704	SLLLGGSLVEGA
SLLLGESSVEGE	tr|Q0GNY6|Q0GNY6_HSPV	875	tr|A0A590UKB7|A0A590UKB7_HUMAN Ryanodine receptor 2 (Fragment) OS=Homo sapiens OX=9606 GN=RYR2 PE=1 SV=1	996	SLLLGGSLVEGA
SLLLGESSVEGE	tr|Q0GNY6|Q0GNY6_HSPV	875	sp|Q92736|RYR2_HUMAN Ryanodine receptor 2 OS=Homo sapiens OX=9606 GN=RYR2 PE=1 SV=3	4311	SLLLGGSLVEGA
SLLLGESSVEGE	tr|Q0GNY6|Q0GNY6_HSPV	875	tr|H7BY35|H7BY35_HUMAN Ryanodine receptor 2 OS=Homo sapiens OX=9606 GN=RYR2 PE=1 SV=2	4295	SLLLGGSLVEGA
YDKSESGLERLE	tr|Q0GP36|Q0GP36_HSPV	340	sp|Q9C0I9|LRC27_HUMAN Leucine-rich repeat-containing protein 27 OS=Homo sapiens OX=9606 GN=LRRC27 PE=1 SV=2	50	LDLSESGLCRLE
LSPVAQSTPLMF	tr|Q0GNY6|Q0GNY6_HSPV	1265	tr|D6RD98|D6RD98_HUMAN Myb/SANT-like DNA-binding domain-containing protein 1 OS=Homo sapiens OX=9606 GN=MSANTD1 PE=4 SV=1	160	LSPPAKSTPLYF
LSPVAQSTPLMF	tr|Q0GNY6|Q0GNY6_HSPV	1265	tr|D6RDG6|D6RDG6_HUMAN Myb/SANT-like DNA-binding domain-containing protein 1 OS=Homo sapiens OX=9606 GN=MSANTD1 PE=4 SV=1	160	LSPPAKSTPLYF
LSPVAQSTPLMF	tr|Q0GNY6|Q0GNY6_HSPV	1265	sp|Q6ZTZ1|MSD1_HUMAN Myb/SANT-like DNA-binding domain-containing protein 1 OS=Homo sapiens OX=9606 GN=MSANTD1 PE=2 SV=2	160	LSPPAKSTPLYF
LSPVAQSTPLMF	tr|Q0GNY6|Q0GNY6_HSPV	1265	tr|D6R9L8|D6R9L8_HUMAN Myb/SANT-like DNA-binding domain-containing protein 1 OS=Homo sapiens OX=9606 GN=MSANTD1 PE=4 SV=1	147	LSPPAKSTPLYF
FVKNIIDTIEDE	tr|Q0GNX8|Q0GNX8_HSPV	201	sp|Q96DU9|PABP5_HUMAN Polyadenylate-binding protein 5 OS=Homo sapiens OX=9606 GN=PABPC5 PE=1 SV=1	202	FVKNIGDDIDDE
FVKNIIDTIEDE	tr|Q0GNX8|Q0GNX8_HSPV	201	tr|Q5JQF3|Q5JQF3_HUMAN Polyadenylate-binding protein 5 OS=Homo sapiens OX=9606 GN=PABPC5 PE=1 SV=1	38	FVKNIGDDIDDE
GGIGGGGNGSKS	tr|Q0GP71|Q0GP71_HSPV	50	sp|Q9ULM3|YETS2_HUMAN YEATS domain-containing protein 2 OS=Homo sapiens OX=9606 GN=YEATS2 PE=1 SV=2	806	GGGGGGGGGSGS
GGIGGGGNGSKS	tr|Q0GP71|Q0GP71_HSPV	50	sp|P22670|RFX1_HUMAN MHC class II regulatory factor RFX1 OS=Homo sapiens OX=9606 GN=RFX1 PE=1 SV=2	391	GGGGGGGGGSGS
GGIGGGGNGSKS	tr|Q0GP71|Q0GP71_HSPV	50	tr|F8VXG0|F8VXG0_HUMAN Homeobox protein Hox-B3 OS=Homo sapiens OX=9606 GN=HOXB3 PE=4 SV=1	36	GGGGGGGGGDKS
GGIGGGGNGSKS	tr|Q0GP71|Q0GP71_HSPV	50	sp|P14651|HXB3_HUMAN Homeobox protein Hox-B3 OS=Homo sapiens OX=9606 GN=HOXB3 PE=2 SV=2	170	GGGGGGGGGDKS
GGIGGGGNGSKS	tr|Q0GP71|Q0GP71_HSPV	50	sp|Q16204|CCDC6_HUMAN Coiled-coil domain-containing protein 6 OS=Homo sapiens OX=9606 GN=CCDC6 PE=1 SV=2	35	GGGGGGGGGGKS
GGIGGGGNGSKS	tr|Q0GP71|Q0GP71_HSPV	50	tr|J9JIF5|J9JIF5_HUMAN CXXC-type zinc finger protein 4 OS=Homo sapiens OX=9606 GN=CXXC4 PE=1 SV=1	126	GGGGGGGGGRKS
GGIGGGGNGSKS	tr|Q0GP71|Q0GP71_HSPV	50	sp|P18146|EGR1_HUMAN Early growth response protein 1 OS=Homo sapiens OX=9606 GN=EGR1 PE=1 SV=1	68	GGGGGGGGGSNS
GGIGGGGNGSKS	tr|Q0GP71|Q0GP71_HSPV	50	sp|A6NKD9|CC85C_HUMAN Coiled-coil domain-containing protein 85C OS=Homo sapiens OX=9606 GN=CCDC85C PE=1 SV=1	167	GGGGGGGAGSRS
GGIGGGGNGSKS	tr|Q0GP71|Q0GP71_HSPV	50	sp|P35908|K22E_HUMAN Keratin, type II cytoskeletal 2 epidermal OS=Homo sapiens OX=9606 GN=KRT2 PE=1 SV=2	51	GGFGGGGFGSRS
GGIGGGGNGSKS	tr|Q0GP71|Q0GP71_HSPV	50	sp|Q96CX2|KCD12_HUMAN BTB/POZ domain-containing protein KCTD12 OS=Homo sapiens OX=9606 GN=KCTD12 PE=1 SV=1	13	GGGGGGGSGSSS
DNILPLERLTIE	tr|Q0GP43|Q0GP43_HSPV	302	tr|H3BPU4|H3BPU4_HUMAN Gamma-tubulin complex component (Fragment) OS=Homo sapiens OX=9606 GN=TUBGCP4 PE=1 SV=1	327	DNLLPLLHLTIE
DNILPLERLTIE	tr|Q0GP43|Q0GP43_HSPV	302	sp|Q9UGJ1|GCP4_HUMAN Gamma-tubulin complex component 4 OS=Homo sapiens OX=9606 GN=TUBGCP4 PE=1 SV=1	408	DNLLPLLHLTIE
NESISDVTDPLS	tr|Q0GNQ4|Q0GNQ4_HSPV	249	tr|F5GZ41|F5GZ41_HUMAN Peroxisomal targeting signal 1 receptor (Fragment) OS=Homo sapiens OX=9606 GN=PEX5 PE=1 SV=1	59	QEFISEVTDPLS
NESISDVTDPLS	tr|Q0GNQ4|Q0GNQ4_HSPV	249	tr|F5H0L9|F5H0L9_HUMAN Peroxisomal targeting signal 1 receptor (Fragment) OS=Homo sapiens OX=9606 GN=PEX5 PE=1 SV=8	59	QEFISEVTDPLS
NESISDVTDPLS	tr|Q0GNQ4|Q0GNQ4_HSPV	249	tr|F5GYB4|F5GYB4_HUMAN Peroxisomal targeting signal 1 receptor (Fragment) OS=Homo sapiens OX=9606 GN=PEX5 PE=1 SV=1	59	QEFISEVTDPLS
NESISDVTDPLS	tr|Q0GNQ4|Q0GNQ4_HSPV	249	tr|F5H3X7|F5H3X7_HUMAN Peroxisomal targeting signal 1 receptor (Fragment) OS=Homo sapiens OX=9606 GN=PEX5 PE=1 SV=1	142	QEFISEVTDPLS
NESISDVTDPLS	tr|Q0GNQ4|Q0GNQ4_HSPV	249	sp|P50542|PEX5_HUMAN Peroxisomal targeting signal 1 receptor OS=Homo sapiens OX=9606 GN=PEX5 PE=1 SV=3	142	QEFISEVTDPLS
NESISDVTDPLS	tr|Q0GNQ4|Q0GNQ4_HSPV	249	tr|B4E0T2|B4E0T2_HUMAN PTS1-BP OS=Homo sapiens OX=9606 GN=PEX5 PE=1 SV=1	163	QEFISEVTDPLS
NESISDVTDPLS	tr|Q0GNQ4|Q0GNQ4_HSPV	249	tr|J3KPV0|J3KPV0_HUMAN PTS1-BP (Fragment) OS=Homo sapiens OX=9606 GN=PEX5 PE=1 SV=1	157	QEFISEVTDPLS
NESISDVTDPLS	tr|Q0GNQ4|Q0GNQ4_HSPV	249	tr|F5H5C0|F5H5C0_HUMAN Peroxisomal targeting signal 1 receptor (Fragment) OS=Homo sapiens OX=9606 GN=PEX5 PE=1 SV=1	130	QEFISEVTDPLS
VIKLIGYTNDHI	tr|Q0GP79|Q0GP79_HSPV	104	sp|P07195|LDHB_HUMAN L-lactate dehydrogenase B chain OS=Homo sapiens OX=9606 GN=LDHB PE=1 SV=2	242	VIKLKGYTNWAI
VIKLIGYTNDHI	tr|Q0GP79|Q0GP79_HSPV	104	tr|A0A5F9ZHM4|A0A5F9ZHM4_HUMAN L-lactate dehydrogenase OS=Homo sapiens OX=9606 GN=LDHB PE=1 SV=1	242	VIKLKGYTNWAI
VIKLIGYTNDHI	tr|Q0GP79|Q0GP79_HSPV	104	tr|A0A3B3IS95|A0A3B3IS95_HUMAN L-lactate dehydrogenase OS=Homo sapiens OX=9606 PE=3 SV=1	242	VIKLKGYTNWAI
PRTLKPAASAIY	tr|Q0GNU8|Q0GNU8_HSPV	147	tr|Q5QPL9|Q5QPL9_HUMAN RNA-binding protein Raly (Fragment) OS=Homo sapiens OX=9606 GN=RALY PE=1 SV=1	98	PKGLKRAASAIY
PRTLKPAASAIY	tr|Q0GNU8|Q0GNU8_HSPV	147	tr|Q5QPM1|Q5QPM1_HUMAN RNA-binding protein Raly (Fragment) OS=Homo sapiens OX=9606 GN=RALY PE=1 SV=1	98	PKGLKRAASAIY
PRTLKPAASAIY	tr|Q0GNU8|Q0GNU8_HSPV	147	sp|Q9UKM9|RALY_HUMAN RNA-binding protein Raly OS=Homo sapiens OX=9606 GN=RALY PE=1 SV=1	98	PKGLKRAASAIY
SSVLSIIPVDAP	tr|Q0GNQ8|Q0GNQ8_HSPV	200	sp|Q86WK7|AMGO3_HUMAN Amphoterin-induced protein 3 OS=Homo sapiens OX=9606 GN=AMIGO3 PE=2 SV=1	433	SSVLSTTPPDAP
LEHTMIDAMATS	tr|Q0GP94|Q0GP94_HSPV	80	tr|B4DUK8|B4DUK8_HUMAN 5'-AMP-activated protein kinase subunit gamma-3 OS=Homo sapiens OX=9606 GN=PRKAG3 PE=1 SV=1	189	QEHTCYDAMATS
LEHTMIDAMATS	tr|Q0GP94|Q0GP94_HSPV	80	sp|Q9UGI9|AAKG3_HUMAN 5'-AMP-activated protein kinase subunit gamma-3 OS=Homo sapiens OX=9606 GN=PRKAG3 PE=1 SV=3	189	QEHTCYDAMATS
KDIDKELARSLN	tr|Q0GNV3|Q0GNV3_HSPV	17	sp|P0C1S8|WEE2_HUMAN Wee1-like protein kinase 2 OS=Homo sapiens OX=9606 GN=WEE2 PE=1 SV=2	4	KDIDKELRQKLN
KDIDKELARSLN	tr|Q0GNV3|Q0GNV3_HSPV	17	sp|O14964|HGS_HUMAN Hepatocyte growth factor-regulated tyrosine kinase substrate OS=Homo sapiens OX=9606 GN=HGS PE=1 SV=1	320	EDIDPELARYLN
KDIDKELARSLN	tr|Q0GNV3|Q0GNV3_HSPV	17	tr|I3L1E3|I3L1E3_HUMAN Hepatocyte growth factor-regulated tyrosine kinase substrate (Fragment) OS=Homo sapiens OX=9606 GN=HGS PE=1 SV=1	40	EDIDPELARYLN
KVLCCNDNLISD	tr|Q0GNX4|Q0GNX4_HSPV	252	sp|Q8IW52|SLIK4_HUMAN SLIT and NTRK-like protein 4 OS=Homo sapiens OX=9606 GN=SLITRK4 PE=1 SV=1	158	KVLILNDNLISF
TTALLLIEVAKG	tr|Q0GP11|Q0GP11_HSPV	10	tr|H0YG27|H0YG27_HUMAN Tripartite motif-containing protein 65 (Fragment) OS=Homo sapiens OX=9606 GN=TRIM65 PE=1 SV=1	70	TTALRSIEVAKT
TTALLLIEVAKG	tr|Q0GP11|Q0GP11_HSPV	10	sp|Q6PJ69|TRI65_HUMAN Tripartite motif-containing protein 65 OS=Homo sapiens OX=9606 GN=TRIM65 PE=1 SV=3	196	TTALRSIEVAKT
TTALLLIEVAKG	tr|Q0GP11|Q0GP11_HSPV	10	tr|H0YGS7|H0YGS7_HUMAN Tripartite motif-containing protein 65 (Fragment) OS=Homo sapiens OX=9606 GN=TRIM65 PE=1 SV=1	188	TTALRSIEVAKT
IPGKGIFTPLLK	tr|Q0GP50|Q0GP50_HSPV	410	tr|H7C1V3|H7C1V3_HUMAN Carbohydrate-responsive element-binding protein (Fragment) OS=Homo sapiens OX=9606 GN=MLXIPL PE=1 SV=1	113	IPGKGILTPELA
VIIKYADNFVKE	tr|Q0GP29|Q0GP29_HSPV	595	tr|A0A3B3ITT4|A0A3B3ITT4_HUMAN Testosterone 17-beta-dehydrogenase 3 (Fragment) OS=Homo sapiens OX=9606 GN=HSD17B3 PE=1 SV=1	207	VITKTADEFVKE
VIIKYADNFVKE	tr|Q0GP29|Q0GP29_HSPV	595	sp|P37058|DHB3_HUMAN Testosterone 17-beta-dehydrogenase 3 OS=Homo sapiens OX=9606 GN=HSD17B3 PE=1 SV=2	243	VITKTADEFVKE
VIIKYADNFVKE	tr|Q0GP29|Q0GP29_HSPV	595	tr|A0A0S2Z3U6|A0A0S2Z3U6_HUMAN Hydroxysteroid dehydrogenase 3 isoform 3 OS=Homo sapiens OX=9606 GN=HSD17B3 PE=1 SV=1	243	VITKTADEFVKE
TEKRTMLGNTNI	tr|Q0GP06|Q0GP06_HSPV	510	sp|P18206|VINC_HUMAN Vinculin OS=Homo sapiens OX=9606 GN=VCL PE=1 SV=4	1068	TVKATMLGRTNI
EVDGSYYTKVRK	tr|Q0GP51|Q0GP51_HSPV	62	tr|C9JHU5|C9JHU5_HUMAN Tensin-3 (Fragment) OS=Homo sapiens OX=9606 GN=TNS3 PE=1 SV=1	437	PVDGSLYAKVRK
EVDGSYYTKVRK	tr|Q0GP51|Q0GP51_HSPV	62	tr|E9PCX8|E9PCX8_HUMAN Tensin-3 (Fragment) OS=Homo sapiens OX=9606 GN=TNS3 PE=1 SV=8	451	PVDGSLYAKVRK
EVDGSYYTKVRK	tr|Q0GP51|Q0GP51_HSPV	62	sp|Q68CZ2|TENS3_HUMAN Tensin-3 OS=Homo sapiens OX=9606 GN=TNS3 PE=1 SV=2	348	PVDGSLYAKVRK
VVGFLMKSYSSN	tr|Q0GP43|Q0GP43_HSPV	165	tr|F5H0K2|F5H0K2_HUMAN Sarcospan OS=Homo sapiens OX=9606 GN=SSPN PE=1 SV=1	69	VVGFLMASISSS
VVGFLMKSYSSN	tr|Q0GP43|Q0GP43_HSPV	165	sp|Q14714|SSPN_HUMAN Sarcospan OS=Homo sapiens OX=9606 GN=SSPN PE=2 SV=3	69	VVGFLMASISSS
NQLITAQLKITP	tr|Q0GP02|Q0GP02_HSPV	227	sp|O95104|SCAF4_HUMAN SR-related and CTD-associated factor 4 OS=Homo sapiens OX=9606 GN=SCAF4 PE=1 SV=3	227	VQAITAQLKTTP
TKKLVLSIGVEL	tr|Q0GNU3|Q0GNU3_HSPV	126	tr|H0YE03|H0YE03_HUMAN CWF19-like protein 2 (Fragment) OS=Homo sapiens OX=9606 GN=CWF19L2 PE=1 SV=1	520	GKKLLLSIGVLL
LTSDIISEELLE	tr|Q0GNP8|Q0GNP8_HSPV	94	sp|P08048|ZFY_HUMAN Zinc finger Y-chromosomal protein OS=Homo sapiens OX=9606 GN=ZFY PE=1 SV=3	167	LTSDIVSEEVLV
KYIDISILIKVL	tr|Q0GP85|Q0GP85_HSPV	81	tr|E5RGE5|E5RGE5_HUMAN AN1-type zinc finger protein 1 OS=Homo sapiens OX=9606 GN=ZFAND1 PE=1 SV=1	109	HYNNISILIKVL
LRESNEIHAIGE	tr|Q0GNU0|Q0GNU0_HSPV	232	sp|Q9GZX6|IL22_HUMAN Interleukin-22 OS=Homo sapiens OX=9606 GN=IL22 PE=1 SV=1	155	LGESGEIKAIGE
LQSDMLGNVVKD	tr|Q0GP24|Q0GP24_HSPV	138	tr|E7EWK3|E7EWK3_HUMAN RNA helicase (Fragment) OS=Homo sapiens OX=9606 GN=DHX36 PE=1 SV=1	255	LQSDVLMTVVKD
LQSDMLGNVVKD	tr|Q0GP24|Q0GP24_HSPV	138	sp|Q9H2U1|DHX36_HUMAN ATP-dependent DNA/RNA helicase DHX36 OS=Homo sapiens OX=9606 GN=DHX36 PE=1 SV=2	341	LQSDVLMTVVKD
NLVKDLLYTACK	tr|Q0GP91|Q0GP91_HSPV	226	tr|A0A1B0GU05|A0A1B0GU05_HUMAN Voltage-dependent L-type calcium channel subunit beta-4 OS=Homo sapiens OX=9606 GN=CACNB4 PE=1 SV=1	299	DLVKDLLYIKCK
NLVKDLLYTACK	tr|Q0GP91|Q0GP91_HSPV	226	tr|A0A1B0GV16|A0A1B0GV16_HUMAN Calcium channel voltage-dependent subunit beta 3 OS=Homo sapiens OX=9606 GN=CACNB4 PE=1 SV=1	283	DLVKDLLYIKCK
DHEKISKGLEKL	tr|Q0GNX5|Q0GNX5_HSPV	139	tr|J3KPY9|J3KPY9_HUMAN Anthrax toxin receptor OS=Homo sapiens OX=9606 GN=ANTXR2 PE=1 SV=1	21	DRGKISKGLEDL
DHEKISKGLEKL	tr|Q0GNX5|Q0GNX5_HSPV	139	sp|P58335|ANTR2_HUMAN Anthrax toxin receptor 2 OS=Homo sapiens OX=9606 GN=ANTXR2 PE=1 SV=5	98	DRGKISKGLEDL
DHEKISKGLEKL	tr|Q0GNX5|Q0GNX5_HSPV	139	tr|A0A0C4DG84|A0A0C4DG84_HUMAN Anthrax toxin receptor 2 OS=Homo sapiens OX=9606 GN=ANTXR2 PE=1 SV=1	21	DRGKISKGLEDL
