query	query_seqname	query_start	target_seqname	target_start	target
VIRAAIEVVALN	tr|Q64HX2|Q64HX2_SVC12	1856	sp|P0C7T3|O56A5_HUMAN Olfactory receptor 56A5 OS=Homo sapiens OX=9606 GN=OR56A5 PE=3 SV=1	144	VARAAIFVVARN
VIRAAIEVVALN	tr|Q64HX2|Q64HX2_SVC12	1856	tr|A0A087WUB2|A0A087WUB2_HUMAN Olfactory receptor 56A5 OS=Homo sapiens OX=9606 GN=OR56A5 PE=4 SV=1	76	VARAAIFVVARN
SEDNATVVLEPG	tr|Q64HX2|Q64HX2_SVC12	695	tr|Q5TF98|Q5TF98_HUMAN Nuclear receptor coactivator 7 (Fragment) OS=Homo sapiens OX=9606 GN=NCOA7 PE=1 SV=1	42	KEDNNTVVLEPD
SEDNATVVLEPG	tr|Q64HX2|Q64HX2_SVC12	695	tr|Q5TF97|Q5TF97_HUMAN Nuclear receptor coactivator 7 (Fragment) OS=Homo sapiens OX=9606 GN=NCOA7 PE=1 SV=1	42	KEDNNTVVLEPD
SEDNATVVLEPG	tr|Q64HX2|Q64HX2_SVC12	695	tr|Q5TF96|Q5TF96_HUMAN Nuclear receptor coactivator 7 (Fragment) OS=Homo sapiens OX=9606 GN=NCOA7 PE=1 SV=1	42	KEDNNTVVLEPD
SEDNATVVLEPG	tr|Q64HX2|Q64HX2_SVC12	695	sp|Q8NI08|NCOA7_HUMAN Nuclear receptor coactivator 7 OS=Homo sapiens OX=9606 GN=NCOA7 PE=1 SV=2	42	KEDNNTVVLEPD
GPVRLDSRTPRS	tr|Q64HX2|Q64HX2_SVC12	2201	sp|A2A3K4|PTPC1_HUMAN Protein tyrosine phosphatase domain-containing protein 1 OS=Homo sapiens OX=9606 GN=PTPDC1 PE=1 SV=1	536	GSVRQNSRTPRS
GPVRLDSRTPRS	tr|Q64HX2|Q64HX2_SVC12	2201	tr|A0A087WTF0|A0A087WTF0_HUMAN Protein tyrosine phosphatase domain-containing protein 1 OS=Homo sapiens OX=9606 GN=PTPDC1 PE=1 SV=1	590	GSVRQNSRTPRS
GFMRFIALSLRS	tr|Q64HX2|Q64HX2_SVC12	49	tr|M0R3A5|M0R3A5_HUMAN Zinc finger protein 83 OS=Homo sapiens OX=9606 GN=ZNF83 PE=4 SV=1	73	GFKRFSRLSLRS
VAEKVKTSVTNL	tr|Q64HX2|Q64HX2_SVC12	852	tr|E5RJ18|E5RJ18_HUMAN PDZ domain-containing protein 9 OS=Homo sapiens OX=9606 GN=PDZD9 PE=4 SV=1	14	VSNKVKTSVHNL
VAEKVKTSVTNL	tr|Q64HX2|Q64HX2_SVC12	852	sp|Q8IXQ8|PDZD9_HUMAN PDZ domain-containing protein 9 OS=Homo sapiens OX=9606 GN=PDZD9 PE=2 SV=2	14	VSNKVKTSVHNL
FSEDNATVVLEP	tr|Q64HX2|Q64HX2_SVC12	694	tr|Q5TF98|Q5TF98_HUMAN Nuclear receptor coactivator 7 (Fragment) OS=Homo sapiens OX=9606 GN=NCOA7 PE=1 SV=1	41	GKEDNNTVVLEP
FSEDNATVVLEP	tr|Q64HX2|Q64HX2_SVC12	694	tr|Q5TF97|Q5TF97_HUMAN Nuclear receptor coactivator 7 (Fragment) OS=Homo sapiens OX=9606 GN=NCOA7 PE=1 SV=1	41	GKEDNNTVVLEP
FSEDNATVVLEP	tr|Q64HX2|Q64HX2_SVC12	694	tr|Q5TF96|Q5TF96_HUMAN Nuclear receptor coactivator 7 (Fragment) OS=Homo sapiens OX=9606 GN=NCOA7 PE=1 SV=1	41	GKEDNNTVVLEP
FSEDNATVVLEP	tr|Q64HX2|Q64HX2_SVC12	694	sp|Q8NI08|NCOA7_HUMAN Nuclear receptor coactivator 7 OS=Homo sapiens OX=9606 GN=NCOA7 PE=1 SV=2	41	GKEDNNTVVLEP
LMVACSAPVSAT	tr|Q64HX2|Q64HX2_SVC12	1015	tr|H0Y9U7|H0Y9U7_HUMAN Long-chain-fatty-acid--CoA ligase 1 (Fragment) OS=Homo sapiens OX=9606 GN=ACSL1 PE=1 SV=1	36	LMVTGAAPVSAT
LMVACSAPVSAT	tr|Q64HX2|Q64HX2_SVC12	1015	tr|B7Z3Z9|B7Z3Z9_HUMAN Long-chain-fatty-acid--CoA ligase 1 OS=Homo sapiens OX=9606 GN=ACSL1 PE=1 SV=1	259	LMVTGAAPVSAT
LMVACSAPVSAT	tr|Q64HX2|Q64HX2_SVC12	1015	sp|P33121|ACSL1_HUMAN Long-chain-fatty-acid--CoA ligase 1 OS=Homo sapiens OX=9606 GN=ACSL1 PE=1 SV=1	430	LMVTGAAPVSAT
LMVACSAPVSAT	tr|Q64HX2|Q64HX2_SVC12	1015	tr|E7EPM6|E7EPM6_HUMAN Long-chain-fatty-acid--CoA ligase 1 OS=Homo sapiens OX=9606 GN=ACSL1 PE=1 SV=1	396	LMVTGAAPVSAT
SNAASAFAAGGQ	tr|Q64HX0|Q64HX0_SVC12	50	tr|K7ELE3|K7ELE3_HUMAN TLE family member 5 (Fragment) OS=Homo sapiens OX=9606 GN=TLE5 PE=1 SV=1	226	RGAAAAFAAGGQ
GKVFTAGTGSCS	tr|Q64HX2|Q64HX2_SVC12	1404	sp|Q96M66|YP010_HUMAN Putative uncharacterized protein FLJ32790 OS=Homo sapiens OX=9606 PE=2 SV=2	177	GKEDTAGYGSCS
EKPGLNLAEPMR	tr|Q64HX2|Q64HX2_SVC12	516	tr|H3BPF3|H3BPF3_HUMAN E3 ubiquitin-protein ligase ZNF598 (Fragment) OS=Homo sapiens OX=9606 GN=ZNF598 PE=4 SV=1	66	EWPGLALAEPSR
LAVPDFEITQQR	tr|Q64HX2|Q64HX2_SVC12	17	tr|D6RGW0|D6RGW0_HUMAN Endoplasmic reticulum aminopeptidase 2 (Fragment) OS=Homo sapiens OX=9606 GN=ERAP2 PE=1 SV=1	194	LAVTDFEPTQAR
LAVPDFEITQQR	tr|Q64HX2|Q64HX2_SVC12	17	sp|Q6P179|ERAP2_HUMAN Endoplasmic reticulum aminopeptidase 2 OS=Homo sapiens OX=9606 GN=ERAP2 PE=1 SV=2	194	LAVTDFEPTQAR
RVGQGAVILRNS	tr|Q64HX2|Q64HX2_SVC12	633	tr|F8WCU9|F8WCU9_HUMAN AT-rich interactive domain-containing protein 2 (Fragment) OS=Homo sapiens OX=9606 GN=ARID2 PE=1 SV=2	259	RVLQIAVILRNL
RVGQGAVILRNS	tr|Q64HX2|Q64HX2_SVC12	633	sp|Q68CP9|ARID2_HUMAN AT-rich interactive domain-containing protein 2 OS=Homo sapiens OX=9606 GN=ARID2 PE=1 SV=2	285	RVLQIAVILRNL
LAQSSPANSDVE	tr|Q64HX0|Q64HX0_SVC12	69	sp|O60293|ZC3H1_HUMAN Zinc finger C3H1 domain-containing protein OS=Homo sapiens OX=9606 GN=ZFC3H1 PE=1 SV=3	801	TSSSSPANSDVE
ALAPVFGRRAVH	tr|Q64HX2|Q64HX2_SVC12	767	tr|A0A087WZX6|A0A087WZX6_HUMAN Phospholipid-transporting ATPase ABCA7 (Fragment) OS=Homo sapiens OX=9606 GN=ABCA7 PE=1 SV=1	207	ALARVFGELAVH
ALAPVFGRRAVH	tr|Q64HX2|Q64HX2_SVC12	767	sp|Q8IZY2|ABCA7_HUMAN Phospholipid-transporting ATPase ABCA7 OS=Homo sapiens OX=9606 GN=ABCA7 PE=1 SV=3	2066	ALARVFGELAVH
ALAPVFGRRAVH	tr|Q64HX2|Q64HX2_SVC12	767	tr|H0YCN5|H0YCN5_HUMAN Phospholipid-transporting ATPase ABCA7 (Fragment) OS=Homo sapiens OX=9606 GN=ABCA7 PE=1 SV=2	511	ALARVFGELAVH
SVASSSTAKGTA	tr|Q64HX2|Q64HX2_SVC12	270	sp|Q9H422|HIPK3_HUMAN Homeodomain-interacting protein kinase 3 OS=Homo sapiens OX=9606 GN=HIPK3 PE=1 SV=1	569	PVASSSTATLTA
TRLELLRNLDQK	tr|Q64HX2|Q64HX2_SVC12	1763	tr|G3V4G1|G3V4G1_HUMAN Neuroguidin (Fragment) OS=Homo sapiens OX=9606 GN=NGDN PE=1 SV=8	69	TVLEKLRPLDQK
TRLELLRNLDQK	tr|Q64HX2|Q64HX2_SVC12	1763	sp|Q8NEJ9|NGDN_HUMAN Neuroguidin OS=Homo sapiens OX=9606 GN=NGDN PE=1 SV=1	94	TVLEKLRPLDQK
LVLTRNRHTLGA	tr|Q64HX1|Q64HX1_SVC12	246	sp|Q9Y4R8|TELO2_HUMAN Telomere length regulation protein TEL2 homolog OS=Homo sapiens OX=9606 GN=TELO2 PE=1 SV=2	722	LVLGRLAHTLGA
PAGSCDSLLSAS	tr|Q64HX2|Q64HX2_SVC12	1634	sp|Q12789|TF3C1_HUMAN General transcription factor 3C polypeptide 1 OS=Homo sapiens OX=9606 GN=GTF3C1 PE=1 SV=4	745	PSGSGDSQLSAS
PAGSCDSLLSAS	tr|Q64HX2|Q64HX2_SVC12	1634	tr|K7EQI6|K7EQI6_HUMAN Rho GTPase-activating protein 33 (Fragment) OS=Homo sapiens OX=9606 GN=ARHGAP33 PE=1 SV=2	310	PAGSCESLSSSS
PAGSCDSLLSAS	tr|Q64HX2|Q64HX2_SVC12	1634	sp|O14559|RHG33_HUMAN Rho GTPase-activating protein 33 OS=Homo sapiens OX=9606 GN=ARHGAP33 PE=1 SV=2	671	PAGSCESLSSSS
PAGSCDSLLSAS	tr|Q64HX2|Q64HX2_SVC12	1634	tr|K7EMC2|K7EMC2_HUMAN Rho GTPase-activating protein 33 (Fragment) OS=Homo sapiens OX=9606 GN=ARHGAP33 PE=1 SV=3	247	PAGSCESLSSSS
PAGSCDSLLSAS	tr|Q64HX2|Q64HX2_SVC12	1634	tr|A0A0A0MQQ9|A0A0A0MQQ9_HUMAN Rho GTPase-activating protein 33 OS=Homo sapiens OX=9606 GN=ARHGAP33 PE=1 SV=1	671	PAGSCESLSSSS
PVRLDSRTPRSP	tr|Q64HX2|Q64HX2_SVC12	2202	sp|A2A3K4|PTPC1_HUMAN Protein tyrosine phosphatase domain-containing protein 1 OS=Homo sapiens OX=9606 GN=PTPDC1 PE=1 SV=1	537	SVRQNSRTPRSP
PVRLDSRTPRSP	tr|Q64HX2|Q64HX2_SVC12	2202	tr|A0A087WTF0|A0A087WTF0_HUMAN Protein tyrosine phosphatase domain-containing protein 1 OS=Homo sapiens OX=9606 GN=PTPDC1 PE=1 SV=1	591	SVRQNSRTPRSP
YSAVRKRKFYAV	tr|Q64HX2|Q64HX2_SVC12	1582	tr|A0A669K9V7|A0A669K9V7_HUMAN SH3 and multiple ankyrin repeat domains protein 3 (Fragment) OS=Homo sapiens OX=9606 GN=SHANK3 PE=1 SV=1	20	YSAVPGRKFIAV
YSAVRKRKFYAV	tr|Q64HX2|Q64HX2_SVC12	1582	tr|A0A669KBA8|A0A669KBA8_HUMAN SH3 and multiple ankyrin repeat domains protein 3 OS=Homo sapiens OX=9606 GN=SHANK3 PE=1 SV=1	454	YSAVPGRKFIAV
YSAVRKRKFYAV	tr|Q64HX2|Q64HX2_SVC12	1582	tr|A0A0U1RQS4|A0A0U1RQS4_HUMAN SH3 and multiple ankyrin repeat domains protein 3 OS=Homo sapiens OX=9606 GN=SHANK3 PE=1 SV=2	335	YSAVPGRKFIAV
YSAVRKRKFYAV	tr|Q64HX2|Q64HX2_SVC12	1582	sp|Q9BYB0|SHAN3_HUMAN SH3 and multiple ankyrin repeat domains protein 3 OS=Homo sapiens OX=9606 GN=SHANK3 PE=1 SV=3	468	YSAVPGRKFIAV
YSAVRKRKFYAV	tr|Q64HX2|Q64HX2_SVC12	1582	tr|A0A0U1RR93|A0A0U1RR93_HUMAN SH3 and multiple ankyrin repeat domains protein 3 OS=Homo sapiens OX=9606 GN=SHANK3 PE=1 SV=1	461	YSAVPGRKFIAV
EDNATVVLEPGV	tr|Q64HX2|Q64HX2_SVC12	696	tr|Q5TF98|Q5TF98_HUMAN Nuclear receptor coactivator 7 (Fragment) OS=Homo sapiens OX=9606 GN=NCOA7 PE=1 SV=1	43	EDNNTVVLEPDK
EDNATVVLEPGV	tr|Q64HX2|Q64HX2_SVC12	696	tr|Q5TF97|Q5TF97_HUMAN Nuclear receptor coactivator 7 (Fragment) OS=Homo sapiens OX=9606 GN=NCOA7 PE=1 SV=1	43	EDNNTVVLEPDK
EDNATVVLEPGV	tr|Q64HX2|Q64HX2_SVC12	696	tr|Q5TF96|Q5TF96_HUMAN Nuclear receptor coactivator 7 (Fragment) OS=Homo sapiens OX=9606 GN=NCOA7 PE=1 SV=1	43	EDNNTVVLEPDK
EDNATVVLEPGV	tr|Q64HX2|Q64HX2_SVC12	696	sp|Q8NI08|NCOA7_HUMAN Nuclear receptor coactivator 7 OS=Homo sapiens OX=9606 GN=NCOA7 PE=1 SV=2	43	EDNNTVVLEPDK
RSLAVPDFEITQ	tr|Q64HX2|Q64HX2_SVC12	15	tr|D6RF46|D6RF46_HUMAN Endoplasmic reticulum aminopeptidase 2 (Fragment) OS=Homo sapiens OX=9606 GN=ERAP2 PE=4 SV=1	18	RILAVTDFEPTQ
RSLAVPDFEITQ	tr|Q64HX2|Q64HX2_SVC12	15	tr|D6RGW0|D6RGW0_HUMAN Endoplasmic reticulum aminopeptidase 2 (Fragment) OS=Homo sapiens OX=9606 GN=ERAP2 PE=1 SV=1	192	RILAVTDFEPTQ
RSLAVPDFEITQ	tr|Q64HX2|Q64HX2_SVC12	15	sp|Q6P179|ERAP2_HUMAN Endoplasmic reticulum aminopeptidase 2 OS=Homo sapiens OX=9606 GN=ERAP2 PE=1 SV=2	192	RILAVTDFEPTQ
SSPANSDVELVV	tr|Q64HX0|Q64HX0_SVC12	72	sp|O60293|ZC3H1_HUMAN Zinc finger C3H1 domain-containing protein OS=Homo sapiens OX=9606 GN=ZFC3H1 PE=1 SV=3	804	SSPANSDVEIDG
VASSSTAKGTAA	tr|Q64HX2|Q64HX2_SVC12	271	sp|Q9H422|HIPK3_HUMAN Homeodomain-interacting protein kinase 3 OS=Homo sapiens OX=9606 GN=HIPK3 PE=1 SV=1	570	VASSSTATLTAN
LTSEPIDGTYRV	tr|Q64HX2|Q64HX2_SVC12	623	sp|P20742|PZP_HUMAN Pregnancy zone protein OS=Homo sapiens OX=9606 GN=PZP PE=1 SV=4	193	LSSEPIQGSYRV
AQSSPANSDVEL	tr|Q64HX0|Q64HX0_SVC12	70	sp|O60293|ZC3H1_HUMAN Zinc finger C3H1 domain-containing protein OS=Homo sapiens OX=9606 GN=ZFC3H1 PE=1 SV=3	802	SSSSPANSDVEI
NAASAFAAGGQA	tr|Q64HX0|Q64HX0_SVC12	51	tr|K7ELE3|K7ELE3_HUMAN TLE family member 5 (Fragment) OS=Homo sapiens OX=9606 GN=TLE5 PE=1 SV=1	227	GAAAAFAAGGQR
KLAVYHGRRAEG	tr|Q64HX1|Q64HX1_SVC12	110	tr|A0A6Q8JR05|A0A6Q8JR05_HUMAN Protocadherin Fat 4 OS=Homo sapiens OX=9606 GN=FAT4 PE=1 SV=1	4891	KPRRYHGRRAEG
KLAVYHGRRAEG	tr|Q64HX1|Q64HX1_SVC12	110	sp|Q6V0I7|FAT4_HUMAN Protocadherin Fat 4 OS=Homo sapiens OX=9606 GN=FAT4 PE=1 SV=2	4889	KPRRYHGRRAEG
VFAVFLFVIPPT	tr|Q64HX2|Q64HX2_SVC12	1486	sp|Q9UGF5|O14J1_HUMAN Olfactory receptor 14J1 OS=Homo sapiens OX=9606 GN=OR14J1 PE=2 SV=1	271	VFSVFYTVIPPT
AFLVLTRNRHTL	tr|Q64HX1|Q64HX1_SVC12	244	sp|Q7L775|EPMIP_HUMAN EPM2A-interacting protein 1 OS=Homo sapiens OX=9606 GN=EPM2AIP1 PE=1 SV=1	560	AFSYLTRNQHTL
PTQGIKLLVGTA	tr|Q64HX1|Q64HX1_SVC12	435	sp|Q8NDM7|CFA43_HUMAN Cilia- and flagella-associated protein 43 OS=Homo sapiens OX=9606 GN=CFAP43 PE=2 SV=3	483	DQQGIFLLVGTA
PTQGIKLLVGTA	tr|Q64HX1|Q64HX1_SVC12	435	tr|Q5TA04|Q5TA04_HUMAN Cilia- and flagella-associated protein 43 OS=Homo sapiens OX=9606 GN=CFAP43 PE=1 SV=2	484	DQQGIFLLVGTA
LPAEGAKTSNTI	tr|Q64HX2|Q64HX2_SVC12	901	sp|O75891|AL1L1_HUMAN Cytosolic 10-formyltetrahydrofolate dehydrogenase OS=Homo sapiens OX=9606 GN=ALDH1L1 PE=1 SV=2	431	VDAEGAKTSETI
VSLNSALAGAIP	tr|Q64HX2|Q64HX2_SVC12	865	sp|Q9H089|LSG1_HUMAN Large subunit GTPase 1 homolog OS=Homo sapiens OX=9606 GN=LSG1 PE=1 SV=2	236	VIFWSALAGAIP
PAEGAKTSNTIY	tr|Q64HX2|Q64HX2_SVC12	902	sp|O75891|AL1L1_HUMAN Cytosolic 10-formyltetrahydrofolate dehydrogenase OS=Homo sapiens OX=9606 GN=ALDH1L1 PE=1 SV=2	432	DAEGAKTSETIN
AASAFAAGGQAQ	tr|Q64HX0|Q64HX0_SVC12	52	tr|K7ELE3|K7ELE3_HUMAN TLE family member 5 (Fragment) OS=Homo sapiens OX=9606 GN=TLE5 PE=1 SV=1	228	AAAAFAAGGQRR
TAGTGSCSHRSH	tr|Q64HX2|Q64HX2_SVC12	1408	sp|Q96M66|YP010_HUMAN Putative uncharacterized protein FLJ32790 OS=Homo sapiens OX=9606 PE=2 SV=2	181	TAGYGSCSPRSL
RAAIEVVALNAL	tr|Q64HX2|Q64HX2_SVC12	1858	sp|P0C7T3|O56A5_HUMAN Olfactory receptor 56A5 OS=Homo sapiens OX=9606 GN=OR56A5 PE=3 SV=1	146	RAAIFVVARNGL
RAAIEVVALNAL	tr|Q64HX2|Q64HX2_SVC12	1858	tr|A0A087WUB2|A0A087WUB2_HUMAN Olfactory receptor 56A5 OS=Homo sapiens OX=9606 GN=OR56A5 PE=4 SV=1	78	RAAIFVVARNGL
AEGAKTSNTIYI	tr|Q64HX2|Q64HX2_SVC12	903	sp|O75891|AL1L1_HUMAN Cytosolic 10-formyltetrahydrofolate dehydrogenase OS=Homo sapiens OX=9606 GN=ALDH1L1 PE=1 SV=2	433	AEGAKTSETINP
GTAAAPSVTEGP	tr|Q64HX1|Q64HX1_SVC12	444	sp|Q99607|ELF4_HUMAN ETS-related transcription factor Elf-4 OS=Homo sapiens OX=9606 GN=ELF4 PE=1 SV=1	529	GTTAAPRVKEGP
GTAAAPSVTEGP	tr|Q64HX1|Q64HX1_SVC12	444	tr|A0A087WU18|A0A087WU18_HUMAN ETS-related transcription factor Elf-4 OS=Homo sapiens OX=9606 GN=ELF4 PE=1 SV=1	528	GTTAAPRVKEGP
DGPNRTAGTTGQ	tr|Q64HX1|Q64HX1_SVC12	57	sp|P05997|CO5A2_HUMAN Collagen alpha-2(V) chain OS=Homo sapiens OX=9606 GN=COL5A2 PE=1 SV=3	980	DGPPGPAGTTGQ
DGPNRTAGTTGQ	tr|Q64HX1|Q64HX1_SVC12	57	tr|A0A087WYX9|A0A087WYX9_HUMAN Collagen alpha-2(V) chain OS=Homo sapiens OX=9606 GN=COL5A2 PE=1 SV=1	593	DGPPGPAGTTGQ
VISDAGVLIMTS	tr|Q64HX2|Q64HX2_SVC12	259	sp|Q9HBY0|NOX3_HUMAN NADPH oxidase 3 OS=Homo sapiens OX=9606 GN=NOX3 PE=1 SV=1	179	VISLALVLIMTS
QGIKLLVGTAAA	tr|Q64HX1|Q64HX1_SVC12	437	sp|Q8NDM7|CFA43_HUMAN Cilia- and flagella-associated protein 43 OS=Homo sapiens OX=9606 GN=CFAP43 PE=2 SV=3	485	QGIFLLVGTAEG
QGIKLLVGTAAA	tr|Q64HX1|Q64HX1_SVC12	437	tr|Q5TA04|Q5TA04_HUMAN Cilia- and flagella-associated protein 43 OS=Homo sapiens OX=9606 GN=CFAP43 PE=1 SV=2	486	QGIFLLVGTAEG
LFVIPPTEGEVT	tr|Q64HX2|Q64HX2_SVC12	1491	tr|H0YHR3|H0YHR3_HUMAN Protein phosphatase Slingshot homolog 1 (Fragment) OS=Homo sapiens OX=9606 GN=SSH1 PE=1 SV=1	16	LFVDKPTEGERT
LFVIPPTEGEVT	tr|Q64HX2|Q64HX2_SVC12	1491	sp|Q8WYL5|SSH1_HUMAN Protein phosphatase Slingshot homolog 1 OS=Homo sapiens OX=9606 GN=SSH1 PE=1 SV=2	240	LFVDKPTEGERT
LVFAVFLFVIPP	tr|Q64HX2|Q64HX2_SVC12	1485	sp|Q9UGF5|O14J1_HUMAN Olfactory receptor 14J1 OS=Homo sapiens OX=9606 GN=OR14J1 PE=2 SV=1	270	LVFSVFYTVIPP
VRLDSRTPRSPA	tr|Q64HX2|Q64HX2_SVC12	2203	sp|A2A3K4|PTPC1_HUMAN Protein tyrosine phosphatase domain-containing protein 1 OS=Homo sapiens OX=9606 GN=PTPDC1 PE=1 SV=1	538	VRQNSRTPRSPL
VRLDSRTPRSPA	tr|Q64HX2|Q64HX2_SVC12	2203	tr|A0A087WTF0|A0A087WTF0_HUMAN Protein tyrosine phosphatase domain-containing protein 1 OS=Homo sapiens OX=9606 GN=PTPDC1 PE=1 SV=1	592	VRQNSRTPRSPL
FTAGTGSCSHRS	tr|Q64HX2|Q64HX2_SVC12	1407	sp|Q96M66|YP010_HUMAN Putative uncharacterized protein FLJ32790 OS=Homo sapiens OX=9606 PE=2 SV=2	180	DTAGYGSCSPRS
ISDAGVLIMTSV	tr|Q64HX2|Q64HX2_SVC12	260	sp|Q9HBY0|NOX3_HUMAN NADPH oxidase 3 OS=Homo sapiens OX=9606 GN=NOX3 PE=1 SV=1	180	ISLALVLIMTSS
QPYGSIAGGAKT	tr|Q64HX2|Q64HX2_SVC12	1510	tr|A0A0A0MRJ3|A0A0A0MRJ3_HUMAN Neuron navigator 1 OS=Homo sapiens OX=9606 GN=NAV1 PE=1 SV=1	161	QAKGSPAGGAKT
QPYGSIAGGAKT	tr|Q64HX2|Q64HX2_SVC12	1510	sp|Q8NEY1|NAV1_HUMAN Neuron navigator 1 OS=Homo sapiens OX=9606 GN=NAV1 PE=1 SV=2	148	QAKGSPAGGAKT
PFLNSLTLVPGL	tr|Q64HX2|Q64HX2_SVC12	493	sp|Q9Y2V3|RX_HUMAN Retinal homeobox protein Rx OS=Homo sapiens OX=9606 GN=RAX PE=1 SV=2	282	PFLNSPPLGPGL
RLNEHTLAPQRL	tr|Q64HX2|Q64HX2_SVC12	1312	sp|P52790|HXK3_HUMAN Hexokinase-3 OS=Homo sapiens OX=9606 GN=HK3 PE=1 SV=2	481	RLLEETLAPFRL
ASNAASAFAAGG	tr|Q64HX0|Q64HX0_SVC12	49	sp|A6NJT0|UNC4_HUMAN Homeobox protein unc-4 homolog OS=Homo sapiens OX=9606 GN=UNCX PE=3 SV=1	348	ASNAAAAAAAGL
TQGIKLLVGTAA	tr|Q64HX1|Q64HX1_SVC12	436	sp|Q8NDM7|CFA43_HUMAN Cilia- and flagella-associated protein 43 OS=Homo sapiens OX=9606 GN=CFAP43 PE=2 SV=3	484	QQGIFLLVGTAE
TQGIKLLVGTAA	tr|Q64HX1|Q64HX1_SVC12	436	tr|Q5TA04|Q5TA04_HUMAN Cilia- and flagella-associated protein 43 OS=Homo sapiens OX=9606 GN=CFAP43 PE=1 SV=2	485	QQGIFLLVGTAE
GHTTEHGSLSHG	tr|Q64HX2|Q64HX2_SVC12	746	sp|Q5D862|FILA2_HUMAN Filaggrin-2 OS=Homo sapiens OX=9606 GN=FLG2 PE=1 SV=1	1927	GDTTEHGHPSHG
ALLQFVEVGASC	tr|Q64HX2|Q64HX2_SVC12	185	sp|O95613|PCNT_HUMAN Pericentrin OS=Homo sapiens OX=9606 GN=PCNT PE=1 SV=4	552	ALLDSVEVGLSC
AERQEEQDGGKP	tr|Q64HX1|Q64HX1_SVC12	494	tr|A0A6Q8PFP5|A0A6Q8PFP5_HUMAN Ganglioside-induced differentiation-associated protein 1 OS=Homo sapiens OX=9606 GN=GDAP1 PE=1 SV=1	2	AERQEEQRGSPP
AERQEEQDGGKP	tr|Q64HX1|Q64HX1_SVC12	494	tr|A0A6Q8PFU1|A0A6Q8PFU1_HUMAN Ganglioside-induced differentiation-associated protein 1 OS=Homo sapiens OX=9606 GN=GDAP1 PE=1 SV=1	2	AERQEEQRGSPP
AERQEEQDGGKP	tr|Q64HX1|Q64HX1_SVC12	494	tr|A0A6Q8PFZ0|A0A6Q8PFZ0_HUMAN Ganglioside-induced differentiation-associated protein 1 OS=Homo sapiens OX=9606 GN=GDAP1 PE=1 SV=1	2	AERQEEQRGSPP
AERQEEQDGGKP	tr|Q64HX1|Q64HX1_SVC12	494	tr|A0A6Q8PG78|A0A6Q8PG78_HUMAN Ganglioside-induced differentiation-associated protein 1 OS=Homo sapiens OX=9606 GN=GDAP1 PE=1 SV=1	2	AERQEEQRGSPP
AERQEEQDGGKP	tr|Q64HX1|Q64HX1_SVC12	494	tr|E5RGI2|E5RGI2_HUMAN Ganglioside-induced differentiation-associated protein 1 OS=Homo sapiens OX=9606 GN=GDAP1 PE=1 SV=1	2	AERQEEQRGSPP
AERQEEQDGGKP	tr|Q64HX1|Q64HX1_SVC12	494	tr|A0A6Q8PGU0|A0A6Q8PGU0_HUMAN Ganglioside-induced differentiation-associated protein 1 OS=Homo sapiens OX=9606 GN=GDAP1 PE=1 SV=1	2	AERQEEQRGSPP
AERQEEQDGGKP	tr|Q64HX1|Q64HX1_SVC12	494	tr|A0A6Q8PFX7|A0A6Q8PFX7_HUMAN Ganglioside-induced differentiation-associated protein 1 OS=Homo sapiens OX=9606 GN=GDAP1 PE=1 SV=1	2	AERQEEQRGSPP
AERQEEQDGGKP	tr|Q64HX1|Q64HX1_SVC12	494	tr|A0A6Q8PF20|A0A6Q8PF20_HUMAN Ganglioside-induced differentiation-associated protein 1 OS=Homo sapiens OX=9606 GN=GDAP1 PE=1 SV=1	2	AERQEEQRGSPP
AERQEEQDGGKP	tr|Q64HX1|Q64HX1_SVC12	494	tr|A0A6Q8PGQ9|A0A6Q8PGQ9_HUMAN Ganglioside-induced differentiation-associated protein 1 OS=Homo sapiens OX=9606 GN=GDAP1 PE=1 SV=1	2	AERQEEQRGSPP
AERQEEQDGGKP	tr|Q64HX1|Q64HX1_SVC12	494	tr|A0A6Q8PGB8|A0A6Q8PGB8_HUMAN Ganglioside-induced differentiation-associated protein 1 OS=Homo sapiens OX=9606 GN=GDAP1 PE=1 SV=1	2	AERQEEQRGSPP
AERQEEQDGGKP	tr|Q64HX1|Q64HX1_SVC12	494	tr|A0A6Q8PH97|A0A6Q8PH97_HUMAN Ganglioside-induced differentiation-associated protein 1 OS=Homo sapiens OX=9606 GN=GDAP1 PE=1 SV=1	2	AERQEEQRGSPP
AERQEEQDGGKP	tr|Q64HX1|Q64HX1_SVC12	494	tr|A0A6Q8PHC1|A0A6Q8PHC1_HUMAN Ganglioside-induced differentiation-associated protein 1 OS=Homo sapiens OX=9606 GN=GDAP1 PE=1 SV=1	2	AERQEEQRGSPP
AERQEEQDGGKP	tr|Q64HX1|Q64HX1_SVC12	494	sp|Q8TB36|GDAP1_HUMAN Ganglioside-induced differentiation-associated protein 1 OS=Homo sapiens OX=9606 GN=GDAP1 PE=1 SV=3	2	AERQEEQRGSPP
AERQEEQDGGKP	tr|Q64HX1|Q64HX1_SVC12	494	tr|A0A6Q8PH79|A0A6Q8PH79_HUMAN Ganglioside-induced differentiation-associated protein 1 OS=Homo sapiens OX=9606 GN=GDAP1 PE=1 SV=1	2	AERQEEQRGSPP
AERQEEQDGGKP	tr|Q64HX1|Q64HX1_SVC12	494	tr|A0A6Q8PHN7|A0A6Q8PHN7_HUMAN Ganglioside-induced differentiation-associated protein 1 OS=Homo sapiens OX=9606 GN=GDAP1 PE=1 SV=1	2	AERQEEQRGSPP
AERQEEQDGGKP	tr|Q64HX1|Q64HX1_SVC12	494	tr|A0A6Q8PEX8|A0A6Q8PEX8_HUMAN Ganglioside-induced differentiation-associated protein 1 OS=Homo sapiens OX=9606 GN=GDAP1 PE=1 SV=1	2	AERQEEQRGSPP
AERQEEQDGGKP	tr|Q64HX1|Q64HX1_SVC12	494	tr|A0A6Q8PH88|A0A6Q8PH88_HUMAN Ganglioside-induced differentiation-associated protein 1 OS=Homo sapiens OX=9606 GN=GDAP1 PE=1 SV=1	2	AERQEEQRGSPP
AERQEEQDGGKP	tr|Q64HX1|Q64HX1_SVC12	494	tr|A0A6Q8PGL3|A0A6Q8PGL3_HUMAN Ganglioside-induced differentiation-associated protein 1 OS=Homo sapiens OX=9606 GN=GDAP1 PE=1 SV=1	2	AERQEEQRGSPP
AERQEEQDGGKP	tr|Q64HX1|Q64HX1_SVC12	494	tr|A0A6Q8PGS2|A0A6Q8PGS2_HUMAN Ganglioside-induced differentiation-associated protein 1 OS=Homo sapiens OX=9606 GN=GDAP1 PE=1 SV=1	2	AERQEEQRGSPP
AERQEEQDGGKP	tr|Q64HX1|Q64HX1_SVC12	494	tr|A0A6Q8PFF4|A0A6Q8PFF4_HUMAN Ganglioside-induced differentiation-associated protein 1 OS=Homo sapiens OX=9606 GN=GDAP1 PE=1 SV=1	2	AERQEEQRGSPP
AERQEEQDGGKP	tr|Q64HX1|Q64HX1_SVC12	494	tr|A0A6Q8PEZ4|A0A6Q8PEZ4_HUMAN Ganglioside-induced differentiation-associated protein 1 OS=Homo sapiens OX=9606 GN=GDAP1 PE=1 SV=1	2	AERQEEQRGSPP
AERQEEQDGGKP	tr|Q64HX1|Q64HX1_SVC12	494	tr|A0A6Q8PFG4|A0A6Q8PFG4_HUMAN Ganglioside-induced differentiation-associated protein 1 OS=Homo sapiens OX=9606 GN=GDAP1 PE=1 SV=1	2	AERQEEQRGSPP
TNEQGTVLAFLV	tr|Q64HX1|Q64HX1_SVC12	236	sp|P52198|RND2_HUMAN Rho-related GTP-binding protein RhoN OS=Homo sapiens OX=9606 GN=RND2 PE=1 SV=2	142	THEQGTVLAKQV
HVISDAGVLIMT	tr|Q64HX2|Q64HX2_SVC12	258	sp|Q9HBY0|NOX3_HUMAN NADPH oxidase 3 OS=Homo sapiens OX=9606 GN=NOX3 PE=1 SV=1	178	LVISLALVLIMT
HASNAASAFAAG	tr|Q64HX0|Q64HX0_SVC12	48	sp|A6NJT0|UNC4_HUMAN Homeobox protein unc-4 homolog OS=Homo sapiens OX=9606 GN=UNCX PE=3 SV=1	347	AASNAAAAAAAG
LVWGLLILHSYT	tr|Q64HX2|Q64HX2_SVC12	974	sp|Q8NH80|O10D3_HUMAN Putative olfactory receptor 10D3 OS=Homo sapiens OX=9606 GN=OR10D3 PE=5 SV=1	208	LVCFLLILLSYT
YRVGQGAVILRN	tr|Q64HX2|Q64HX2_SVC12	632	tr|F8WCU9|F8WCU9_HUMAN AT-rich interactive domain-containing protein 2 (Fragment) OS=Homo sapiens OX=9606 GN=ARID2 PE=1 SV=2	258	QRVLQIAVILRN
YRVGQGAVILRN	tr|Q64HX2|Q64HX2_SVC12	632	sp|Q68CP9|ARID2_HUMAN AT-rich interactive domain-containing protein 2 OS=Homo sapiens OX=9606 GN=ARID2 PE=1 SV=2	284	QRVLQIAVILRN
QSSPANSDVELV	tr|Q64HX0|Q64HX0_SVC12	71	sp|O60293|ZC3H1_HUMAN Zinc finger C3H1 domain-containing protein OS=Homo sapiens OX=9606 GN=ZFC3H1 PE=1 SV=3	803	SSSPANSDVEID
TATSHTLLPSST	tr|Q64HX2|Q64HX2_SVC12	1911	sp|Q9HC84|MUC5B_HUMAN Mucin-5B OS=Homo sapiens OX=9606 GN=MUC5B PE=1 SV=3	4746	TATSFTPIPSST
TATSHTLLPSST	tr|Q64HX2|Q64HX2_SVC12	1911	sp|Q9HC84|MUC5B_HUMAN Mucin-5B OS=Homo sapiens OX=9606 GN=MUC5B PE=1 SV=3	4319	TATSVTPIPSST
