query	query_seqname	query_start	target_seqname	target_start	target
SAHLEPRSSSRL	sp|F5HDE4|ORF45_HHV8P	180	sp|Q6ZUU3|FOXNB_HUMAN FOXL2 neighbor protein OS=Homo sapiens OX=9606 GN=FOXL2NB PE=2 SV=1	107	SASLEPLSSSRA
SLHLASSTRSPG	sp|F5HFD2|ORF24_HHV8P	237	tr|A0A1B0GWJ3|A0A1B0GWJ3_HUMAN Glutamate receptor-interacting protein 2 OS=Homo sapiens OX=9606 GN=GRIP2 PE=1 SV=1	440	SLSLASSTVGPG
SLHLASSTRSPG	sp|F5HFD2|ORF24_HHV8P	237	sp|Q9C0E4|GRIP2_HUMAN Glutamate receptor-interacting protein 2 OS=Homo sapiens OX=9606 GN=GRIP2 PE=1 SV=4	435	SLSLASSTVGPG
SLHLASSTRSPG	sp|F5HFD2|ORF24_HHV8P	237	tr|A0A087WX15|A0A087WX15_HUMAN Glutamate receptor-interacting protein 2 OS=Homo sapiens OX=9606 GN=GRIP2 PE=1 SV=1	532	SLSLASSTVGPG
SLHLASSTRSPG	sp|F5HFD2|ORF24_HHV8P	237	tr|V9GZ38|V9GZ38_HUMAN Uncharacterized protein (Fragment) OS=Homo sapiens OX=9606 PE=4 SV=3	187	SLHLASSTESVS
LLSPVLLPSTFL	sp|Q9QR69|K15_HHV8P	192	sp|Q4VNC0|AT135_HUMAN Probable cation-transporting ATPase 13A5 OS=Homo sapiens OX=9606 GN=ATP13A5 PE=2 SV=1	968	LLSPPLLLSIFL
PTIKINRVDPSV	sp|F5HDE4|ORF45_HHV8P	12	sp|Q8TBB1|LNX1_HUMAN E3 ubiquitin-protein ligase LNX OS=Homo sapiens OX=9606 GN=LNX1 PE=1 SV=1	273	TSIKINRVDPSE
IKPLGKGTSVGD	sp|Q2HR75|ICP27_HHV8P	263	sp|P16455|MGMT_HUMAN Methylated-DNA--protein-cysteine methyltransferase OS=Homo sapiens OX=9606 GN=MGMT PE=1 SV=1	31	IKLLGKGTSAAD
IKPLGKGTSVGD	sp|Q2HR75|ICP27_HHV8P	263	tr|B4DEE8|B4DEE8_HUMAN 6-O-methylguanine-DNA methyltransferase OS=Homo sapiens OX=9606 GN=MGMT PE=1 SV=1	62	IKLLGKGTSAAD
AGDSGAESAVRA	sp|F5HIC6|VIRF3_HHV8P	213	tr|C9IZA0|C9IZA0_HUMAN Heme-binding protein 2 OS=Homo sapiens OX=9606 GN=HEBP2 PE=1 SV=1	16	AGDSNAESAWPA
GTRRPTRLLPVP	sp|Q2HR73|VIRF4_HHV8P	249	sp|Q5RKV6|EXOS6_HUMAN Exosome complex component MTR3 OS=Homo sapiens OX=9606 GN=EXOSC6 PE=1 SV=1	29	GTRDPTRLRPVY
SPGSGRGLSSLK	sp|F5HID2|PAP_HHV8P	176	sp|Q9HBW1|LRRC4_HUMAN Leucine-rich repeat-containing protein 4 OS=Homo sapiens OX=9606 GN=LRRC4 PE=1 SV=2	234	RPGSFHGLSSLK
DDIETTQQGNTA	sp|P0C788|OX2V_HHV8P	241	sp|Q9Y385|UB2J1_HUMAN Ubiquitin-conjugating enzyme E2 J1 OS=Homo sapiens OX=9606 GN=UBE2J1 PE=1 SV=2	212	DDIPTTFQGATA
NTLLPYDDLLLP	sp|Q2HR92|HEPA_HHV8P	572	sp|Q5KSL6|DGKK_HUMAN Diacylglycerol kinase kappa OS=Homo sapiens OX=9606 GN=DGKK PE=1 SV=1	380	NTLSITDDLLLP
EGRFRGDRGAPS	sp|Q2HR73|VIRF4_HHV8P	795	tr|X6R7U9|X6R7U9_HUMAN Guanine nucleotide-binding protein G(s) subunit alpha isoforms short OS=Homo sapiens OX=9606 GN=GNAS PE=1 SV=1	699	EGRFRLDRPAPA
EGRFRGDRGAPS	sp|Q2HR73|VIRF4_HHV8P	795	tr|A0A590UK00|A0A590UK00_HUMAN Guanine nucleotide-binding protein G(s) subunit alpha isoforms short (Fragment) OS=Homo sapiens OX=9606 GN=GNAS PE=1 SV=1	398	EGRFRLDRPAPA
VTQIINGSVPVR	sp|Q9QR70|ORF75_HHV8P	292	tr|E9PRK7|E9PRK7_HUMAN ARL14 effector protein (Fragment) OS=Homo sapiens OX=9606 GN=ARL14EP PE=1 SV=1	119	CTQIINGSVDVD
VTQIINGSVPVR	sp|Q9QR70|ORF75_HHV8P	292	sp|Q8N8R7|AL14E_HUMAN ARL14 effector protein OS=Homo sapiens OX=9606 GN=ARL14EP PE=1 SV=1	119	CTQIINGSVDVD
RLVRAVRVPPLV	sp|F5HCD4|ORF35_HHV8P	85	sp|P03971|MIS_HUMAN Muellerian-inhibiting factor OS=Homo sapiens OX=9606 GN=AMH PE=2 SV=3	296	RLVRALRVPPAR
TLSLRNQHGKVT	sp|Q2HRB3|CVC2_HHV8P	475	tr|A0A1B0GTX4|A0A1B0GTX4_HUMAN Cyclin-dependent kinase-like 5 (Fragment) OS=Homo sapiens OX=9606 GN=CDKL5 PE=1 SV=1	322	TLSNRNQAGKST
TLSLRNQHGKVT	sp|Q2HRB3|CVC2_HHV8P	475	tr|A0A096LNR9|A0A096LNR9_HUMAN Cyclin-dependent kinase-like 5 (Fragment) OS=Homo sapiens OX=9606 GN=CDKL5 PE=1 SV=1	322	TLSNRNQAGKST
TLSLRNQHGKVT	sp|Q2HRB3|CVC2_HHV8P	475	tr|A0A669KBC2|A0A669KBC2_HUMAN Cyclin-dependent kinase-like 5 OS=Homo sapiens OX=9606 GN=CDKL5 PE=1 SV=1	322	TLSNRNQAGKST
TLSLRNQHGKVT	sp|Q2HRB3|CVC2_HHV8P	475	tr|A0A1B0GUM4|A0A1B0GUM4_HUMAN Cyclin-dependent kinase-like 5 OS=Homo sapiens OX=9606 GN=CDKL5 PE=1 SV=1	322	TLSNRNQAGKST
TLSLRNQHGKVT	sp|Q2HRB3|CVC2_HHV8P	475	sp|O76039|CDKL5_HUMAN Cyclin-dependent kinase-like 5 OS=Homo sapiens OX=9606 GN=CDKL5 PE=1 SV=2	322	TLSNRNQAGKST
APQEQESGPEPT	sp|Q9QR71|LANA1_HHV8P	556	sp|Q6XYB7|LBX2_HUMAN Transcription factor LBX2 OS=Homo sapiens OX=9606 GN=LBX2 PE=1 SV=1	31	APQLPESGPGPT
LTETMLNHCEQL	sp|F5HGK9|PORTL_HHV8P	153	sp|Q5JPF3|AN36C_HUMAN Ankyrin repeat domain-containing protein 36C OS=Homo sapiens OX=9606 GN=ANKRD36C PE=1 SV=3	1245	LTELKDNHCEQL
PFAGLSLLSAAA	sp|F5H8Y5|TRX1_HHV8P	65	sp|Q96MU8|KREM1_HUMAN Kremen protein 1 OS=Homo sapiens OX=9606 GN=KREMEN1 PE=1 SV=3	4	PAARLALLSAAA
PFAGLSLLSAAA	sp|F5H8Y5|TRX1_HHV8P	65	sp|Q96DN6|MBD6_HUMAN Methyl-CpG-binding domain protein 6 OS=Homo sapiens OX=9606 GN=MBD6 PE=1 SV=2	317	PFLASSLLSAAA
LSELLDFRLSAS	sp|F5HEZ4|VFLIP_HHV8P	40	sp|Q5TGY3|AHDC1_HUMAN AT-hook DNA-binding motif-containing protein 1 OS=Homo sapiens OX=9606 GN=AHDC1 PE=1 SV=1	849	SSDLLDFALSAS
SASDETGLRRLE	sp|F5HEZ4|VFLIP_HHV8P	49	tr|K7ES42|K7ES42_HUMAN Scaffold attachment factor B1 OS=Homo sapiens OX=9606 GN=SAFB PE=1 SV=1	21	SASSETGTRRLS
SASDETGLRRLE	sp|F5HEZ4|VFLIP_HHV8P	49	sp|Q15424|SAFB1_HUMAN Scaffold attachment factor B1 OS=Homo sapiens OX=9606 GN=SAFB PE=1 SV=4	21	SASSETGTRRLS
DETQEEAFLKCL	sp|Q77Q36|VCYCL_HHV8P	209	sp|Q99757|THIOM_HUMAN Thioredoxin, mitochondrial OS=Homo sapiens OX=9606 GN=TXN2 PE=1 SV=2	153	DEDQLEAFLKKL
DETQEEAFLKCL	sp|Q77Q36|VCYCL_HHV8P	209	tr|M0QXH0|M0QXH0_HUMAN Thioredoxin, mitochondrial OS=Homo sapiens OX=9606 GN=TXN2 PE=1 SV=1	51	DEDQLEAFLKKL
KTESLPLTPEFP	sp|Q2HRD2|TRM1_HHV8P	233	sp|Q9UBK2|PRGC1_HUMAN Peroxisome proliferator-activated receptor gamma coactivator 1-alpha OS=Homo sapiens OX=9606 GN=PPARGC1A PE=1 SV=1	256	TTLSLPLTPESP
KTESLPLTPEFP	sp|Q2HRD2|TRM1_HHV8P	233	tr|A0A087WTJ3|A0A087WTJ3_HUMAN Peroxisome proliferator-activated receptor gamma coactivator 1-alpha OS=Homo sapiens OX=9606 GN=PPARGC1A PE=1 SV=1	252	TTLSLPLTPESP
KTESLPLTPEFP	sp|Q2HRD2|TRM1_HHV8P	233	tr|A0A087WVW3|A0A087WVW3_HUMAN Peroxisome proliferator-activated receptor gamma coactivator 1-alpha OS=Homo sapiens OX=9606 GN=PPARGC1A PE=1 SV=1	252	TTLSLPLTPESP
ALLLRILGPIEC	sp|F5HFA1|UNG_HHV8P	217	sp|Q06190|P2R3A_HUMAN Serine/threonine-protein phosphatase 2A regulatory subunit B'' subunit alpha OS=Homo sapiens OX=9606 GN=PPP2R3A PE=1 SV=1	589	ALLLRILESIED
TSRPKEVPGSPD	sp|Q2HRD4|ORF4_HHV8P	535	sp|Q9P1Y5|CAMP3_HUMAN Calmodulin-regulated spectrin-associated protein 3 OS=Homo sapiens OX=9606 GN=CAMSAP3 PE=1 SV=2	676	TSRPKAVTFSPD
AQESLVTKFNLR	sp|Q2HRD3|DNBI_HHV8P	936	sp|Q8TE73|DYH5_HUMAN Dynein heavy chain 5, axonemal OS=Homo sapiens OX=9606 GN=DNAH5 PE=1 SV=3	213	AQESLKEKVNLR
LFGFDIFLDVEL	sp|Q2HRD3|DNBI_HHV8P	908	tr|H7BZY4|H7BZY4_HUMAN Tubulin polyglutamylase TTLL4 (Fragment) OS=Homo sapiens OX=9606 GN=TTLL4 PE=1 SV=8	180	LFGFDIMLDENL
LFGFDIFLDVEL	sp|Q2HRD3|DNBI_HHV8P	908	sp|Q14679|TTLL4_HUMAN Tubulin polyglutamylase TTLL4 OS=Homo sapiens OX=9606 GN=TTLL4 PE=1 SV=2	889	LFGFDIMLDENL
LFGFDIFLDVEL	sp|Q2HRD3|DNBI_HHV8P	908	tr|E7EX20|E7EX20_HUMAN Tubulin polyglutamylase TTLL4 OS=Homo sapiens OX=9606 GN=TTLL4 PE=1 SV=1	825	LFGFDIMLDENL
LFGFDIFLDVEL	sp|Q2HRD3|DNBI_HHV8P	908	tr|E9PH58|E9PH58_HUMAN Tubulin polyglutamylase TTLL4 OS=Homo sapiens OX=9606 GN=TTLL4 PE=1 SV=1	724	LFGFDIMLDENL
LFGFDIFLDVEL	sp|Q2HRD3|DNBI_HHV8P	908	tr|H7C470|H7C470_HUMAN Tubulin polyglutamylase TTLL4 (Fragment) OS=Homo sapiens OX=9606 GN=TTLL4 PE=1 SV=8	34	LFGFDIMLDENL
STLTLSPGSGRG	sp|F5HID2|PAP_HHV8P	171	sp|Q9ULE0|WWC3_HUMAN Protein WWC3 OS=Homo sapiens OX=9606 GN=WWC3 PE=1 SV=3	359	STLTVSSGSSRG
VFSQQESPPSDL	sp|Q2HRD2|TRM1_HHV8P	401	tr|A0A087WTU9|A0A087WTU9_HUMAN Alstrom syndrome protein 1 OS=Homo sapiens OX=9606 GN=ALMS1 PE=1 SV=1	921	VFYQQELPDSDL
VFSQQESPPSDL	sp|Q2HRD2|TRM1_HHV8P	401	sp|Q8TCU4|ALMS1_HUMAN Alstrom syndrome protein 1 OS=Homo sapiens OX=9606 GN=ALMS1 PE=1 SV=4	963	VFYQQELPDSDL
VFSQQESPPSDL	sp|Q2HRD2|TRM1_HHV8P	401	tr|A0A087WV20|A0A087WV20_HUMAN Alstrom syndrome protein 1 OS=Homo sapiens OX=9606 GN=ALMS1 PE=1 SV=1	963	VFYQQELPDSDL
PAPGNLSGGLRA	sp|Q2HR75|ICP27_HHV8P	160	sp|Q5T447|HECD3_HUMAN E3 ubiquitin-protein ligase HECTD3 OS=Homo sapiens OX=9606 GN=HECTD3 PE=1 SV=1	80	PAPGTGSGPLRA
LSVLRTTFSYAF	sp|Q2HRD0|DPOL_HHV8P	233	tr|E5RI39|E5RI39_HUMAN Cyclin-C (Fragment) OS=Homo sapiens OX=9606 GN=CCNC PE=1 SV=1	160	TSVLKTRFSYAF
LSVLRTTFSYAF	sp|Q2HRD0|DPOL_HHV8P	233	tr|J3KP90|J3KP90_HUMAN Cyclin-C OS=Homo sapiens OX=9606 GN=CCNC PE=1 SV=1	113	TSVLKTRFSYAF
LSVLRTTFSYAF	sp|Q2HRD0|DPOL_HHV8P	233	tr|E5RFX8|E5RFX8_HUMAN Cyclin-C (Fragment) OS=Homo sapiens OX=9606 GN=CCNC PE=1 SV=1	28	TSVLKTRFSYAF
LSVLRTTFSYAF	sp|Q2HRD0|DPOL_HHV8P	233	tr|H0YBQ5|H0YBQ5_HUMAN Cyclin-C (Fragment) OS=Homo sapiens OX=9606 GN=CCNC PE=1 SV=1	59	TSVLKTRFSYAF
LSVLRTTFSYAF	sp|Q2HRD0|DPOL_HHV8P	233	tr|E5RFK5|E5RFK5_HUMAN Cyclin-C OS=Homo sapiens OX=9606 GN=CCNC PE=1 SV=1	113	TSVLKTRFSYAF
LSVLRTTFSYAF	sp|Q2HRD0|DPOL_HHV8P	233	sp|P24863|CCNC_HUMAN Cyclin-C OS=Homo sapiens OX=9606 GN=CCNC PE=1 SV=2	113	TSVLKTRFSYAF
LSVLRTTFSYAF	sp|Q2HRD0|DPOL_HHV8P	233	tr|G5E954|G5E954_HUMAN Cyclin-C OS=Homo sapiens OX=9606 GN=CCNC PE=1 SV=1	113	TSVLKTRFSYAF
ASHSQRSVSVDD	sp|Q2HR92|HEPA_HHV8P	634	tr|A0A087WZ88|A0A087WZ88_HUMAN Retinoic acid receptor RXR-gamma OS=Homo sapiens OX=9606 GN=RXRG PE=1 SV=1	189	ASFSHRSVSVQD
ASHSQRSVSVDD	sp|Q2HR92|HEPA_HHV8P	634	sp|P48443|RXRG_HUMAN Retinoic acid receptor RXR-gamma OS=Homo sapiens OX=9606 GN=RXRG PE=1 SV=1	312	ASFSHRSVSVQD
EEEAPEAYVDIF	sp|F5HDE4|ORF45_HHV8P	289	tr|A0A087WTU2|A0A087WTU2_HUMAN Pyrroline-5-carboxylate reductase 3 (Fragment) OS=Homo sapiens OX=9606 GN=PYCR3 PE=1 SV=1	25	CEEVPEAYVDIH
EEEAPEAYVDIF	sp|F5HDE4|ORF45_HHV8P	289	tr|A0A0A0MQS1|A0A0A0MQS1_HUMAN Pyrroline-5-carboxylate reductase OS=Homo sapiens OX=9606 GN=PYCR3 PE=1 SV=1	174	CEEVPEAYVDIH
EEEAPEAYVDIF	sp|F5HDE4|ORF45_HHV8P	289	sp|Q53H96|P5CR3_HUMAN Pyrroline-5-carboxylate reductase 3 OS=Homo sapiens OX=9606 GN=PYCR3 PE=1 SV=3	162	CEEVPEAYVDIH
EEEAPEAYVDIF	sp|F5HDE4|ORF45_HHV8P	289	tr|B5MD87|B5MD87_HUMAN Pyrroline-5-carboxylate reductase OS=Homo sapiens OX=9606 GN=PYCR3 PE=1 SV=2	25	CEEVPEAYVDIH
EPQERDQAQQEP	sp|Q9QR71|LANA1_HHV8P	212	sp|Q9NZD4|AHSP_HUMAN Alpha-hemoglobin-stabilizing protein OS=Homo sapiens OX=9606 GN=AHSP PE=1 SV=1	59	EPQERDKALQEL
ASLLPRTRLRVG	sp|Q2HR73|VIRF4_HHV8P	572	sp|P84996|ALEX_HUMAN Protein ALEX OS=Homo sapiens OX=9606 GN=GNAS PE=3 SV=1	203	ASLPPRTRLPSG
EKVQQPSRAELA	sp|F5HGN8|TRX2_HHV8P	236	tr|H3BQH9|H3BQH9_HUMAN Alpha-mannosidase 2C1 (Fragment) OS=Homo sapiens OX=9606 GN=MAN2C1 PE=1 SV=8	155	EKMFQLSRAELA
EKVQQPSRAELA	sp|F5HGN8|TRX2_HHV8P	236	tr|H3BRI3|H3BRI3_HUMAN Alpha-mannosidase 2C1 (Fragment) OS=Homo sapiens OX=9606 GN=MAN2C1 PE=1 SV=1	126	EKMFQLSRAELA
EKVQQPSRAELA	sp|F5HGN8|TRX2_HHV8P	236	tr|H3BSE5|H3BSE5_HUMAN Alpha-mannosidase 2C1 (Fragment) OS=Homo sapiens OX=9606 GN=MAN2C1 PE=1 SV=2	51	EKMFQLSRAELA
EKVQQPSRAELA	sp|F5HGN8|TRX2_HHV8P	236	sp|Q9NTJ4|MA2C1_HUMAN Alpha-mannosidase 2C1 OS=Homo sapiens OX=9606 GN=MAN2C1 PE=1 SV=1	168	EKMFQLSRAELA
EKVQQPSRAELA	sp|F5HGN8|TRX2_HHV8P	236	tr|B4DH23|B4DH23_HUMAN Alpha-mannosidase 2C1 OS=Homo sapiens OX=9606 GN=MAN2C1 PE=1 SV=1	168	EKMFQLSRAELA
DLLMLLVPGKAL	sp|F5HGH5|VPK_HHV8P	150	tr|A0A0G2JM99|A0A0G2JM99_HUMAN Leukocyte immunoglobulin-like receptor subfamily A member 3 (Fragment) OS=Homo sapiens OX=9606 GN=LILRA3 PE=1 SV=1	230	DLLGLLVPGAAE
LFSLLLLCASLA	sp|F5HAD1|ORF58_HHV8P	89	sp|P20594|ANPRB_HUMAN Atrial natriuretic peptide receptor 2 OS=Homo sapiens OX=9606 GN=NPR2 PE=1 SV=1	3	LPSLLLLVAALA
LFSLLLLCASLA	sp|F5HAD1|ORF58_HHV8P	89	tr|A0A1W2PR41|A0A1W2PR41_HUMAN Tumor necrosis factor receptor superfamily member 11A OS=Homo sapiens OX=9606 GN=TNFRSF11A PE=1 SV=1	11	LFALLLLCALLA
LFSLLLLCASLA	sp|F5HAD1|ORF58_HHV8P	89	sp|Q9Y6Q6|TNR11_HUMAN Tumor necrosis factor receptor superfamily member 11A OS=Homo sapiens OX=9606 GN=TNFRSF11A PE=1 SV=1	11	LFALLLLCALLA
LFSLLLLCASLA	sp|F5HAD1|ORF58_HHV8P	89	sp|Q9BR26|OCSTP_HUMAN Osteoclast stimulatory transmembrane protein OS=Homo sapiens OX=9606 GN=OCSTAMP PE=2 SV=2	48	LLTQLLLCASLA
LFSLLLLCASLA	sp|F5HAD1|ORF58_HHV8P	89	sp|Q9UN66|PCDB8_HUMAN Protocadherin beta-8 OS=Homo sapiens OX=9606 GN=PCDHB8 PE=2 SV=4	15	LFSFLLLGLSLA
LFSLLLLCASLA	sp|F5HAD1|ORF58_HHV8P	89	sp|Q9Y5F0|PCDBD_HUMAN Protocadherin beta-13 OS=Homo sapiens OX=9606 GN=PCDHB13 PE=2 SV=1	15	LFSFLLLGLSLA
ASKLITPGALSL	sp|F5HF36|K42_HHV8P	122	sp|P51815|ZN75D_HUMAN Zinc finger protein 75D OS=Homo sapiens OX=9606 GN=ZNF75D PE=2 SV=2	223	ASKLILPESLSL
STGSVIIIISGV	sp|F5HB98|K81_HHV8P	97	sp|O60341|KDM1A_HUMAN Lysine-specific histone demethylase 1A OS=Homo sapiens OX=9606 GN=KDM1A PE=1 SV=2	277	KTGKVIIIGSGV
STGSVIIIISGV	sp|F5HB98|K81_HHV8P	97	tr|R4GMQ1|R4GMQ1_HUMAN Lysine-specific histone demethylase OS=Homo sapiens OX=9606 GN=KDM1A PE=1 SV=2	277	KTGKVIIIGSGV
KMDGTLDRPDRP	sp|Q2HR63|SCP_HHV8P	49	tr|F5H0D8|F5H0D8_HUMAN CUGBP Elav-like family member 1 (Fragment) OS=Homo sapiens OX=9606 GN=CELF1 PE=1 SV=1	27	KMNGTLDHPDQP
KMDGTLDRPDRP	sp|Q2HR63|SCP_HHV8P	49	tr|E9PKU1|E9PKU1_HUMAN CUGBP Elav-like family member 1 (Fragment) OS=Homo sapiens OX=9606 GN=CELF1 PE=1 SV=1	27	KMNGTLDHPDQP
KMDGTLDRPDRP	sp|Q2HR63|SCP_HHV8P	49	tr|G5EA30|G5EA30_HUMAN CUG triplet repeat, RNA binding protein 1, isoform CRA_c OS=Homo sapiens OX=9606 GN=CELF1 PE=1 SV=1	27	KMNGTLDHPDQP
GFPRLIFCQPSA	sp|F5HDY6|ORF27_HHV8P	247	sp|Q6ZUK4|TMM26_HUMAN Transmembrane protein 26 OS=Homo sapiens OX=9606 GN=TMEM26 PE=1 SV=1	241	GFPSLFFCQYSA
FQLPRGPLSSFR	sp|F5HIN0|PRIM_HHV8P	511	sp|A2RUS2|DEND3_HUMAN DENN domain-containing protein 3 OS=Homo sapiens OX=9606 GN=DENND3 PE=1 SV=2	1027	FQLPRGGLTSIR
FQLPRGPLSSFR	sp|F5HIN0|PRIM_HHV8P	511	tr|B3KRG7|B3KRG7_HUMAN DENN domain-containing protein 3 OS=Homo sapiens OX=9606 GN=DENND3 PE=1 SV=1	77	FQLPRGGLTSIR
FQLPRGPLSSFR	sp|F5HIN0|PRIM_HHV8P	511	tr|E9PF32|E9PF32_HUMAN DENN domain-containing protein 3 OS=Homo sapiens OX=9606 GN=DENND3 PE=1 SV=1	1107	FQLPRGGLTSIR
FQLPRGPLSSFR	sp|F5HIN0|PRIM_HHV8P	511	tr|H0YAY3|H0YAY3_HUMAN DENN domain-containing protein 3 (Fragment) OS=Homo sapiens OX=9606 GN=DENND3 PE=1 SV=1	1032	FQLPRGGLTSIR
DLAFFREQPTAL	sp|F5HIN0|PRIM_HHV8P	185	tr|J9PBQ5|J9PBQ5_HUMAN Meckel syndrome type 1 protein OS=Homo sapiens OX=9606 GN=MKS1 PE=1 SV=1	53	DLATFRPQPTAS
DLAFFREQPTAL	sp|F5HIN0|PRIM_HHV8P	185	tr|J3KSC6|J3KSC6_HUMAN Meckel syndrome type 1 protein OS=Homo sapiens OX=9606 GN=MKS1 PE=1 SV=2	53	DLATFRPQPTAS
DLAFFREQPTAL	sp|F5HIN0|PRIM_HHV8P	185	tr|H0Y2S2|H0Y2S2_HUMAN Meckel syndrome type 1 protein OS=Homo sapiens OX=9606 GN=MKS1 PE=1 SV=2	53	DLATFRPQPTAS
DLAFFREQPTAL	sp|F5HIN0|PRIM_HHV8P	185	sp|Q9NXB0|MKS1_HUMAN Meckel syndrome type 1 protein OS=Homo sapiens OX=9606 GN=MKS1 PE=1 SV=2	53	DLATFRPQPTAS
DLAFFREQPTAL	sp|F5HIN0|PRIM_HHV8P	185	tr|A0A6Q8PGJ4|A0A6Q8PGJ4_HUMAN Meckel syndrome type 1 protein OS=Homo sapiens OX=9606 GN=MKS1 PE=1 SV=1	53	DLATFRPQPTAS
DLAFFREQPTAL	sp|F5HIN0|PRIM_HHV8P	185	tr|A0A6Q8PG98|A0A6Q8PG98_HUMAN Meckel syndrome type 1 protein OS=Homo sapiens OX=9606 GN=MKS1 PE=1 SV=1	53	DLATFRPQPTAS
DLAFFREQPTAL	sp|F5HIN0|PRIM_HHV8P	185	tr|J3KRR3|J3KRR3_HUMAN Meckel syndrome type 1 protein OS=Homo sapiens OX=9606 GN=MKS1 PE=1 SV=1	53	DLATFRPQPTAT
TKVVSEVVTFSS	sp|Q2HRD0|DPOL_HHV8P	586	sp|Q8WXI7|MUC16_HUMAN Mucin-16 OS=Homo sapiens OX=9606 GN=MUC16 PE=1 SV=3	9543	TKVISPVVTSSS
VSGLSDTLIHIS	sp|Q77Q36|VCYCL_HHV8P	142	tr|A0A2R8YFX5|A0A2R8YFX5_HUMAN Neuron navigator 3 OS=Homo sapiens OX=9606 GN=NAV3 PE=1 SV=1	387	SSGLSDTLDNIS
VSGLSDTLIHIS	sp|Q77Q36|VCYCL_HHV8P	142	sp|Q8IVL0|NAV3_HUMAN Neuron navigator 3 OS=Homo sapiens OX=9606 GN=NAV3 PE=1 SV=3	887	SSGLSDTLDNIS
KSIETPLVRLDV	sp|F5HB81|GB_HHV8P	451	sp|Q92629|SGCD_HUMAN Delta-sarcoglycan OS=Homo sapiens OX=9606 GN=SGCD PE=1 SV=2	175	KSIETPNVRADP
EPEEAQGQQEEL	sp|Q9QR71|LANA1_HHV8P	191	sp|Q6DT37|MRCKG_HUMAN Serine/threonine-protein kinase MRCK gamma OS=Homo sapiens OX=9606 GN=CDC42BPG PE=1 SV=2	511	ELCRAQGQQEEL
VTFLGSSHTSLT	sp|Q9QR69|K15_HHV8P	86	sp|Q8N1M1|BEST3_HUMAN Bestrophin-3 OS=Homo sapiens OX=9606 GN=BEST3 PE=1 SV=1	593	PGFLGSSHTSLG
HSATSTPTSTPL	sp|Q2HR63|SCP_HHV8P	67	tr|E9PMC9|E9PMC9_HUMAN BRCA2-interacting transcriptional repressor EMSY OS=Homo sapiens OX=9606 GN=EMSY PE=1 SV=1	148	TSTTSTPTSTPV
HSATSTPTSTPL	sp|Q2HR63|SCP_HHV8P	67	sp|Q7Z589|EMSY_HUMAN BRCA2-interacting transcriptional repressor EMSY OS=Homo sapiens OX=9606 GN=EMSY PE=1 SV=2	147	TSTTSTPTSTPV
GKSVPRLGNSLP	sp|Q2HR82|KBZIP_HHV8P	55	sp|Q6PIF2|SYCE2_HUMAN Synaptonemal complex central element protein 2 OS=Homo sapiens OX=9606 GN=SYCE2 PE=1 SV=2	179	GKSPPRPGNSQP
GKSVPRLGNSLP	sp|Q2HR82|KBZIP_HHV8P	55	tr|K7EM50|K7EM50_HUMAN Synaptonemal complex central element protein 2 (Fragment) OS=Homo sapiens OX=9606 GN=SYCE2 PE=1 SV=1	22	GKSPPRPGNSQP
LEPKLEETETEP	sp|Q9QR71|LANA1_HHV8P	1067	sp|Q12955|ANK3_HUMAN Ankyrin-3 OS=Homo sapiens OX=9606 GN=ANK3 PE=1 SV=3	3034	LCPPLEETETSP
LEPKLEETETEP	sp|Q9QR71|LANA1_HHV8P	1067	tr|A0A087WTP5|A0A087WTP5_HUMAN Ankyrin-3 (Fragment) OS=Homo sapiens OX=9606 GN=ANK3 PE=1 SV=1	264	LCPPLEETETSP
TFLGSSHTSLTF	sp|Q9QR69|K15_HHV8P	87	sp|Q8N1M1|BEST3_HUMAN Bestrophin-3 OS=Homo sapiens OX=9606 GN=BEST3 PE=1 SV=1	594	GFLGSSHTSLGN
PATRAPPRPGAP	sp|Q2HRC9|ORF10_HHV8P	321	sp|A8MWP4|YU008_HUMAN Putative uncharacterized protein ENSP00000401716 OS=Homo sapiens OX=9606 PE=5 SV=1	14	ASTRAPPRPSAP
VEEEQQQEKLQQ	sp|Q9QR71|LANA1_HHV8P	855	sp|Q02410|APBA1_HUMAN Amyloid-beta A4 precursor protein-binding family A member 1 OS=Homo sapiens OX=9606 GN=APBA1 PE=1 SV=3	34	VEEEQQQPPQQQ
VEEEQQQEKLQQ	sp|Q9QR71|LANA1_HHV8P	855	tr|G0Z2K0|G0Z2K0_HUMAN F-box and WD repeat domain containing 7 isoform 1 (Fragment) OS=Homo sapiens OX=9606 GN=FBXW7 PE=1 SV=1	37	VEEEQQQQLRQQ
VEEEQQQEKLQQ	sp|Q9QR71|LANA1_HHV8P	855	tr|S4R3N3|S4R3N3_HUMAN F-box/WD repeat-containing protein 7 (Fragment) OS=Homo sapiens OX=9606 GN=FBXW7 PE=1 SV=1	37	VEEEQQQQLRQQ
VEEEQQQEKLQQ	sp|Q9QR71|LANA1_HHV8P	855	sp|Q969H0|FBXW7_HUMAN F-box/WD repeat-containing protein 7 OS=Homo sapiens OX=9606 GN=FBXW7 PE=1 SV=1	37	VEEEQQQQLRQQ
VEEEQQQEKLQQ	sp|Q9QR71|LANA1_HHV8P	855	tr|S4R3U4|S4R3U4_HUMAN F-box/WD repeat-containing protein 7 OS=Homo sapiens OX=9606 GN=FBXW7 PE=1 SV=1	37	VEEEQQQQLRQQ
LVREELQLPFIA	sp|F5HAK9|GH_HHV8P	526	tr|E9PRP1|E9PRP1_HUMAN FERM domain-containing protein 8 (Fragment) OS=Homo sapiens OX=9606 GN=FRMD8 PE=1 SV=1	52	AVREVLQLPDIA
LVREELQLPFIA	sp|F5HAK9|GH_HHV8P	526	tr|E9PRA3|E9PRA3_HUMAN FERM domain-containing protein 8 (Fragment) OS=Homo sapiens OX=9606 GN=FRMD8 PE=1 SV=1	60	AVREVLQLPDIA
LVREELQLPFIA	sp|F5HAK9|GH_HHV8P	526	sp|Q9BZ67|FRMD8_HUMAN FERM domain-containing protein 8 OS=Homo sapiens OX=9606 GN=FRMD8 PE=1 SV=1	60	AVREVLQLPDIA
PTQLFPILLPGP	sp|Q2HR98|UL95_HHV8P	195	sp|A6NF89|OR6C6_HUMAN Olfactory receptor 6C6 OS=Homo sapiens OX=9606 GN=OR6C6 PE=3 SV=1	96	ATQLFFILLPGV
VDADVVSKVYLE	sp|Q9QR70|ORF75_HHV8P	228	sp|Q7Z794|K2C1B_HUMAN Keratin, type II cytoskeletal 1b OS=Homo sapiens OX=9606 GN=KRT77 PE=1 SV=3	275	VDAAYVSKVDLE
EAPPTPAAPSLL	sp|F5HCV3|ORF50_HHV8P	437	sp|P78414|IRX1_HUMAN Iroquois-class homeodomain protein IRX-1 OS=Homo sapiens OX=9606 GN=IRX1 PE=2 SV=3	250	EAPHAPAAPSAL
PLLAYSEWLLGV	sp|Q9QR70|ORF75_HHV8P	960	sp|Q3B726|RPA43_HUMAN DNA-directed RNA polymerase I subunit RPA43 OS=Homo sapiens OX=9606 GN=POLR1F PE=1 SV=1	78	ELLRYSESLLGV
LLKAAAARRMPA	sp|F5HIM6|ORF23_HHV8P	152	tr|A0A1W2PQP5|A0A1W2PQP5_HUMAN Protein PRRC2B OS=Homo sapiens OX=9606 GN=PRRC2B PE=1 SV=1	48	LGKVAAARRMPP
LLKAAAARRMPA	sp|F5HIM6|ORF23_HHV8P	152	sp|Q5JSZ5|PRC2B_HUMAN Protein PRRC2B OS=Homo sapiens OX=9606 GN=PRRC2B PE=1 SV=2	48	LGKVAAARRMPP
DTQGLQSLVALA	sp|F5HGB6|TRM3_HHV8P	288	sp|Q9UNW8|GP132_HUMAN Probable G-protein coupled receptor 132 OS=Homo sapiens OX=9606 GN=GPR132 PE=1 SV=1	343	DTEELQSPVALA
EAQGQQEELQER	sp|Q9QR71|LANA1_HHV8P	194	sp|Q6DT37|MRCKG_HUMAN Serine/threonine-protein kinase MRCK gamma OS=Homo sapiens OX=9606 GN=CDC42BPG PE=1 SV=2	514	RAQGQQEELLQR
SQGMSFALLLRI	sp|F5HFA1|UNG_HHV8P	211	sp|Q6ZWB6|KCTD8_HUMAN BTB/POZ domain-containing protein KCTD8 OS=Homo sapiens OX=9606 GN=KCTD8 PE=1 SV=1	170	SQGSSDALLLRG
GAINRDGTSLQS	sp|Q9QR70|ORF75_HHV8P	689	tr|A0A669KB06|A0A669KB06_HUMAN Microtubule-actin cross-linking factor 1, isoforms 1/2/3/5 (Fragment) OS=Homo sapiens OX=9606 GN=MACF1 PE=1 SV=1	365	GAIGRDTDSLQS
GAINRDGTSLQS	sp|Q9QR70|ORF75_HHV8P	689	tr|H3BPE1|H3BPE1_HUMAN Microtubule-actin cross-linking factor 1, isoforms 1/2/3/5 OS=Homo sapiens OX=9606 GN=MACF1 PE=1 SV=1	5146	GAIGRDTDSLQS
GAINRDGTSLQS	sp|Q9QR70|ORF75_HHV8P	689	tr|H3BQK9|H3BQK9_HUMAN Microtubule-actin cross-linking factor 1, isoforms 1/2/3/5 OS=Homo sapiens OX=9606 GN=MACF1 PE=1 SV=1	5183	GAIGRDTDSLQS
GAINRDGTSLQS	sp|Q9QR70|ORF75_HHV8P	689	tr|A0A590UJG2|A0A590UJG2_HUMAN Microtubule-actin cross-linking factor 1, isoforms 1/2/3/5 OS=Homo sapiens OX=9606 GN=MACF1 PE=1 SV=1	3033	GAIGRDTDSLQS
GAINRDGTSLQS	sp|Q9QR70|ORF75_HHV8P	689	sp|Q9UPN3|MACF1_HUMAN Microtubule-actin cross-linking factor 1, isoforms 1/2/3/5 OS=Homo sapiens OX=9606 GN=MACF1 PE=1 SV=4	5151	GAIGRDTDSLQS
GAINRDGTSLQS	sp|Q9QR70|ORF75_HHV8P	689	tr|H0Y390|H0Y390_HUMAN Microtubule-actin cross-linking factor 1, isoforms 1/2/3/5 (Fragment) OS=Homo sapiens OX=9606 GN=MACF1 PE=1 SV=1	2197	GAIGRDTDSLQS
SSVAQEDPKATG	sp|Q2HRC8|ORF11_HHV8P	220	tr|A0A0U1RR71|A0A0U1RR71_HUMAN Pleckstrin homology domain-containing family G member 3 (Fragment) OS=Homo sapiens OX=9606 GN=PLEKHG3 PE=1 SV=1	561	SSVAQEDSKSSG
SSVAQEDPKATG	sp|Q2HRC8|ORF11_HHV8P	220	sp|A1L390|PKHG3_HUMAN Pleckstrin homology domain-containing family G member 3 OS=Homo sapiens OX=9606 GN=PLEKHG3 PE=1 SV=1	617	SSVAQEDSKSSG
SSVAQEDPKATG	sp|Q2HRC8|ORF11_HHV8P	220	tr|G3V311|G3V311_HUMAN Pleckstrin homology domain-containing family G member 3 OS=Homo sapiens OX=9606 GN=PLEKHG3 PE=1 SV=1	122	SSVAQEDSKSSG
DANKGGPPVSLG	sp|F5HID2|PAP_HHV8P	262	sp|A9Z1Z3|FR1L4_HUMAN Fer-1-like protein 4 OS=Homo sapiens OX=9606 GN=FER1L4 PE=2 SV=1	839	DHNKFGPPVFLG
APTLLQKLFTMT	sp|Q2HR67|RIR1_HHV8P	563	sp|Q9P278|FNIP2_HUMAN Folliculin-interacting protein 2 OS=Homo sapiens OX=9606 GN=FNIP2 PE=1 SV=2	2	APTLLQKLFNKR
VKLVLPFPLRAL	sp|F5HG20|UL49_HHV8P	189	sp|Q92616|GCN1_HUMAN eIF-2-alpha kinase activator GCN1 OS=Homo sapiens OX=9606 GN=GCN1 PE=1 SV=6	1495	VKLVLPSLLAAL
FVKNIDSDSEEV	sp|F5HIM6|ORF23_HHV8P	11	sp|Q9Y2C9|TLR6_HUMAN Toll-like receptor 6 OS=Homo sapiens OX=9606 GN=TLR6 PE=1 SV=2	540	FVKNIDQVSSEV
FVKNIDSDSEEV	sp|F5HIM6|ORF23_HHV8P	11	sp|Q15399|TLR1_HUMAN Toll-like receptor 1 OS=Homo sapiens OX=9606 GN=TLR1 PE=1 SV=3	535	FVKNIDQVSSEV
QSGMLLHPYSLF	sp|F5H8Y5|TRX1_HHV8P	115	tr|H7BYK3|H7BYK3_HUMAN Protein unc-50 homolog (Fragment) OS=Homo sapiens OX=9606 GN=UNC50 PE=3 SV=1	115	GTGMELHPYSLF
PLLRSRPPLFEG	sp|F5HB62|KITH_HHV8P	73	sp|Q9NZJ4|SACS_HUMAN Sacsin OS=Homo sapiens OX=9606 GN=SACS PE=1 SV=2	4271	PGLRSIPPLFSG
YLCTDLLLMPTT	sp|Q2HRD2|TRM1_HHV8P	441	sp|P38570|ITAE_HUMAN Integrin alpha-E OS=Homo sapiens OX=9606 GN=ITGAE PE=1 SV=3	760	QLCEDLLLMPTE
QEQLLSEEELPE	sp|Q9QR71|LANA1_HHV8P	394	tr|F8WD58|F8WD58_HUMAN Contactin-4 OS=Homo sapiens OX=9606 GN=CNTN4 PE=1 SV=1	219	QYQLLSGEELME
EPRADLAANAGE	sp|F5HES7|ORF30_HHV8P	42	sp|Q8NEN9|PDZD8_HUMAN PDZ domain-containing protein 8 OS=Homo sapiens OX=9606 GN=PDZD8 PE=1 SV=1	32	EPPADEAARAGE
DEDTKAELHGRA	sp|P90495|MIR1_HHV8P	146	sp|Q9C093|SPEF2_HUMAN Sperm flagellar protein 2 OS=Homo sapiens OX=9606 GN=SPEF2 PE=1 SV=2	1098	DEETKAELHQRV
DEDTKAELHGRA	sp|P90495|MIR1_HHV8P	146	tr|A0A1B0GWD8|A0A1B0GWD8_HUMAN Sperm flagellar protein 2 OS=Homo sapiens OX=9606 GN=SPEF2 PE=1 SV=1	1098	DEETKAELHQRV
TRLLHSENLALT	sp|Q2HR98|UL95_HHV8P	81	tr|K7EPN4|K7EPN4_HUMAN Ectopic P granules protein 5 homolog OS=Homo sapiens OX=9606 GN=EPG5 PE=1 SV=1	661	TRLLESIHLALT
TRLLHSENLALT	sp|Q2HR98|UL95_HHV8P	81	sp|Q9HCE0|EPG5_HUMAN Ectopic P granules protein 5 homolog OS=Homo sapiens OX=9606 GN=EPG5 PE=1 SV=2	1786	TRLLESIHLALT
LRASVLSIILLA	sp|F5HDD0|GM_HHV8P	270	sp|Q68CP4|HGNAT_HUMAN Heparan-alpha-glucosaminide N-acetyltransferase OS=Homo sapiens OX=9606 GN=HGSNAT PE=1 SV=2	41	LAASVLSAALLA
LRASVLSIILLA	sp|F5HDD0|GM_HHV8P	270	tr|E5RH11|E5RH11_HUMAN Heparan-alpha-glucosaminide N-acetyltransferase OS=Homo sapiens OX=9606 GN=HGSNAT PE=1 SV=1	13	LAASVLSAALLA
LRASVLSIILLA	sp|F5HDD0|GM_HHV8P	270	tr|A0A1W2PQB9|A0A1W2PQB9_HUMAN Cilia- and flagella-associated protein 46 (Fragment) OS=Homo sapiens OX=9606 GN=CFAP46 PE=1 SV=1	73	LRASVLWENLLA
PGALSLGAGSAF	sp|F5HF36|K42_HHV8P	128	sp|Q9UMD9|COHA1_HUMAN Collagen alpha-1(XVII) chain OS=Homo sapiens OX=9606 GN=COL17A1 PE=1 SV=3	1316	GGAGSLGAGGAF
LLFRNGRSFLLA	sp|F5HGH5|VPK_HHV8P	59	tr|V9GY27|V9GY27_HUMAN Death effector domain-containing protein (Fragment) OS=Homo sapiens OX=9606 GN=DEDD PE=1 SV=1	59	GLIRNGRDFLLA
LLFRNGRSFLLA	sp|F5HGH5|VPK_HHV8P	59	sp|O75618|DEDD_HUMAN Death effector domain-containing protein OS=Homo sapiens OX=9606 GN=DEDD PE=1 SV=1	59	GLIRNGRDFLLA
LLFRNGRSFLLA	sp|F5HGH5|VPK_HHV8P	59	tr|B1AQP5|B1AQP5_HUMAN Death effector domain containing, isoform CRA_b OS=Homo sapiens OX=9606 GN=DEDD PE=1 SV=1	59	GLIRNGRDFLLA
EIETILLKAAAA	sp|F5HIM6|ORF23_HHV8P	147	sp|Q9NZU7|CABP1_HUMAN Calcium-binding protein 1 OS=Homo sapiens OX=9606 GN=CABP1 PE=1 SV=5	66	ESKTSLLKAAAA
EQLLEPKLEETE	sp|Q9QR71|LANA1_HHV8P	1064	tr|A0A1B0GTU5|A0A1B0GTU5_HUMAN AT-rich interactive domain-containing protein 1A (Fragment) OS=Homo sapiens OX=9606 GN=ARID1A PE=1 SV=1	1384	EELLGPKLEEEE
EQLLEPKLEETE	sp|Q9QR71|LANA1_HHV8P	1064	sp|O14497|ARI1A_HUMAN AT-rich interactive domain-containing protein 1A OS=Homo sapiens OX=9606 GN=ARID1A PE=1 SV=3	1766	EELLGPKLEEEE
EQLLEPKLEETE	sp|Q9QR71|LANA1_HHV8P	1064	tr|H0Y488|H0Y488_HUMAN AT-rich interactive domain-containing protein 1A OS=Homo sapiens OX=9606 GN=ARID1A PE=1 SV=2	1382	EELLGPKLEEEE
EQLLEPKLEETE	sp|Q9QR71|LANA1_HHV8P	1064	tr|I3L0Q3|I3L0Q3_HUMAN Zinc finger and SCAN domain-containing protein 10 (Fragment) OS=Homo sapiens OX=9606 GN=ZSCAN10 PE=1 SV=2	13	EQLGEVKLEEEE
EQLLEPKLEETE	sp|Q9QR71|LANA1_HHV8P	1064	tr|I3L1J3|I3L1J3_HUMAN Zinc finger and SCAN domain-containing protein 10 OS=Homo sapiens OX=9606 GN=ZSCAN10 PE=1 SV=2	13	EQLGEVKLEEEE
EQLLEPKLEETE	sp|Q9QR71|LANA1_HHV8P	1064	tr|I3NI43|I3NI43_HUMAN Zinc finger and SCAN domain-containing protein 10 OS=Homo sapiens OX=9606 GN=ZSCAN10 PE=1 SV=2	13	EQLGEVKLEEEE
DAVPSRALGPQP	sp|F5HCV3|ORF50_HHV8P	225	sp|Q9H3T2|SEM6C_HUMAN Semaphorin-6C OS=Homo sapiens OX=9606 GN=SEMA6C PE=2 SV=4	198	DAVVYRSLGPQP
