query	query_seqname	query_start	target_seqname	target_start	target
PNREGPIPERNA	sp|P04585|POL_HV1H2	1011	sp|A6NEV1|PR23A_HUMAN Proline-rich protein 23A OS=Homo sapiens OX=9606 GN=PRR23A PE=3 SV=1	189	PYREGPIPEPCA
PNREGPIPERNA	sp|P04585|POL_HV1H2	1011	sp|Q6ZRT6|PR23B_HUMAN Proline-rich protein 23B OS=Homo sapiens OX=9606 GN=PRR23B PE=1 SV=1	188	PYREGPIPEPCA
GTTGQFFSLGEA	sp|P04578|ENV_HV1H2	692	sp|P39060|COIA1_HUMAN Collagen alpha-1(XVIII) chain OS=Homo sapiens OX=9606 GN=COL18A1 PE=1 SV=5	965	GRTGQKGSLGEA
RLIASREAFDPE	sp|P69726|VPR_HV1H2	16	tr|D6RIV3|D6RIV3_HUMAN Zinc finger CCHC domain-containing protein 10 OS=Homo sapiens OX=9606 GN=ZCCHC10 PE=4 SV=1	7	RLIARRQAFDTE
RLIASREAFDPE	sp|P69726|VPR_HV1H2	16	tr|D6R9G7|D6R9G7_HUMAN Zinc finger CCHC domain-containing protein 10 OS=Homo sapiens OX=9606 GN=ZCCHC10 PE=1 SV=1	7	RLIARRQAFDTE
RLIASREAFDPE	sp|P69726|VPR_HV1H2	16	sp|Q8TBK6|ZCH10_HUMAN Zinc finger CCHC domain-containing protein 10 OS=Homo sapiens OX=9606 GN=ZCCHC10 PE=1 SV=1	7	RLIARRQAFDTE
RLIASREAFDPE	sp|P69726|VPR_HV1H2	16	tr|B3KVL5|B3KVL5_HUMAN Zinc finger CCHC domain-containing protein 10 OS=Homo sapiens OX=9606 GN=ZCCHC10 PE=1 SV=1	7	RLIARRQAFDTE
TSQTVPGGRRLR	sp|P04618|REV_HV1H2	34	tr|A0A087WW86|A0A087WW86_HUMAN GPALPP motifs-containing protein 1 OS=Homo sapiens OX=9606 GN=GPALPP1 PE=1 SV=1	76	SSQTVAGGRRLG
TQELQRIRTVGL	sp|P04585|POL_HV1H2	514	sp|Q8N3T6|T132C_HUMAN Transmembrane protein 132C OS=Homo sapiens OX=9606 GN=TMEM132C PE=2 SV=3	263	TSHLQRIGTVGL
VLSHTHAQGVKG	sp|P69723|VIF_HV1H2	110	tr|H7C5T8|H7C5T8_HUMAN Membrane-associated guanylate kinase, WW and PDZ domain-containing protein 1 (Fragment) OS=Homo sapiens OX=9606 GN=MAGI1 PE=1 SV=1	313	VLGHTHAQVVKI
VLSHTHAQGVKG	sp|P69723|VIF_HV1H2	110	tr|A0A087WT53|A0A087WT53_HUMAN Membrane-associated guanylate kinase, WW and PDZ domain-containing protein 1 OS=Homo sapiens OX=9606 GN=MAGI1 PE=1 SV=1	220	VLGHTHAQVVKI
VLSHTHAQGVKG	sp|P69723|VIF_HV1H2	110	sp|Q96QZ7|MAGI1_HUMAN Membrane-associated guanylate kinase, WW and PDZ domain-containing protein 1 OS=Homo sapiens OX=9606 GN=MAGI1 PE=1 SV=3	527	VLGHTHAQVVKI
VLSHTHAQGVKG	sp|P69723|VIF_HV1H2	110	tr|H7C4U7|H7C4U7_HUMAN Membrane-associated guanylate kinase, WW and PDZ domain-containing protein 1 (Fragment) OS=Homo sapiens OX=9606 GN=MAGI1 PE=1 SV=1	402	VLGHTHAQVVKI
VLSHTHAQGVKG	sp|P69723|VIF_HV1H2	110	tr|A0A087WXD2|A0A087WXD2_HUMAN Membrane-associated guanylate kinase, WW and PDZ domain-containing protein 1 OS=Homo sapiens OX=9606 GN=MAGI1 PE=1 SV=1	220	VLGHTHAQVVKI
VLSHTHAQGVKG	sp|P69723|VIF_HV1H2	110	tr|H7C535|H7C535_HUMAN Membrane-associated guanylate kinase, WW and PDZ domain-containing protein 1 (Fragment) OS=Homo sapiens OX=9606 GN=MAGI1 PE=1 SV=1	408	VLGHTHAQVVKI
QKLDYKGKLKLK	sp|P04585|POL_HV1H2	800	tr|A0A087WTB2|A0A087WTB2_HUMAN Cyclic nucleotide-binding domain-containing protein 1 OS=Homo sapiens OX=9606 GN=CNBD1 PE=4 SV=1	244	QKLVYMGKLKEK
QKLDYKGKLKLK	sp|P04585|POL_HV1H2	800	tr|H0YC59|H0YC59_HUMAN Cyclic nucleotide-binding domain-containing protein 1 (Fragment) OS=Homo sapiens OX=9606 GN=CNBD1 PE=4 SV=1	80	QKLVYMGKLKEK
QKLDYKGKLKLK	sp|P04585|POL_HV1H2	800	tr|H0YAN5|H0YAN5_HUMAN Cyclic nucleotide-binding domain-containing protein 1 (Fragment) OS=Homo sapiens OX=9606 GN=CNBD1 PE=4 SV=1	25	QKLVYMGKLKEK
QKLDYKGKLKLK	sp|P04585|POL_HV1H2	800	sp|Q8NA66|CNBD1_HUMAN Cyclic nucleotide-binding domain-containing protein 1 OS=Homo sapiens OX=9606 GN=CNBD1 PE=2 SV=1	388	QKLVYMGKLKEK
QRIRTVGLKAAQ	sp|P04585|POL_HV1H2	518	sp|Q8N3T6|T132C_HUMAN Transmembrane protein 132C OS=Homo sapiens OX=9606 GN=TMEM132C PE=2 SV=3	267	QRIGTVGLYRAQ
RIRTVGLKAAQD	sp|P04585|POL_HV1H2	519	sp|Q8N3T6|T132C_HUMAN Transmembrane protein 132C OS=Homo sapiens OX=9606 GN=TMEM132C PE=2 SV=3	268	RIGTVGLYRAQD
QAAIGAIPSQYN	sp|P04591|GAG_HV1H2	52	tr|F8WCU9|F8WCU9_HUMAN AT-rich interactive domain-containing protein 2 (Fragment) OS=Homo sapiens OX=9606 GN=ARID2 PE=1 SV=2	95	QLPIGAIPSSYN
QAAIGAIPSQYN	sp|P04591|GAG_HV1H2	52	sp|Q68CP9|ARID2_HUMAN AT-rich interactive domain-containing protein 2 OS=Homo sapiens OX=9606 GN=ARID2 PE=1 SV=2	121	QLPIGAIPSSYN
GEEKADAVNRPP	sp|P04601|NEF_HV1H2	136	tr|A0A1W2PRD7|A0A1W2PRD7_HUMAN Triple functional domain protein (Fragment) OS=Homo sapiens OX=9606 GN=TRIO PE=1 SV=2	163	GEEGADAVPLPP
GEEKADAVNRPP	sp|P04601|NEF_HV1H2	136	tr|E7EWP2|E7EWP2_HUMAN Triple functional domain protein OS=Homo sapiens OX=9606 GN=TRIO PE=1 SV=2	1801	GEEGADAVPLPP
GEEKADAVNRPP	sp|P04601|NEF_HV1H2	136	tr|E7EPJ7|E7EPJ7_HUMAN Non-specific serine/threonine protein kinase (Fragment) OS=Homo sapiens OX=9606 GN=TRIO PE=1 SV=2	1593	GEEGADAVPLPP
GEEKADAVNRPP	sp|P04601|NEF_HV1H2	136	sp|O75962|TRIO_HUMAN Triple functional domain protein OS=Homo sapiens OX=9606 GN=TRIO PE=1 SV=2	1860	GEEGADAVPLPP
PDVNLTKIRLKA	sp|P04585|POL_HV1H2	90	sp|O00534|VMA5A_HUMAN von Willebrand factor A domain-containing protein 5A OS=Homo sapiens OX=9606 GN=VWA5A PE=1 SV=2	539	PDVNLTIHRLAA
NQCGVALHALEE	sp|P04601|NEF_HV1H2	76	sp|Q92935|EXTL1_HUMAN Exostosin-like 1 OS=Homo sapiens OX=9606 GN=EXTL1 PE=1 SV=2	220	PQPGVALLALEE
QCGVALHALEED	sp|P04601|NEF_HV1H2	77	sp|Q92935|EXTL1_HUMAN Exostosin-like 1 OS=Homo sapiens OX=9606 GN=EXTL1 PE=1 SV=2	221	QPGVALLALEEE
YAGWGDLQGPPI	sp|P04578|ENV_HV1H2	271	sp|Q13444|ADA15_HUMAN Disintegrin and metalloproteinase domain-containing protein 15 OS=Homo sapiens OX=9606 GN=ADAM15 PE=1 SV=4	154	EQGPGDLQGPPI
MVLSHTHAQGVK	sp|P69723|VIF_HV1H2	109	tr|H7C5T8|H7C5T8_HUMAN Membrane-associated guanylate kinase, WW and PDZ domain-containing protein 1 (Fragment) OS=Homo sapiens OX=9606 GN=MAGI1 PE=1 SV=1	312	CVLGHTHAQVVK
MVLSHTHAQGVK	sp|P69723|VIF_HV1H2	109	tr|A0A087WT53|A0A087WT53_HUMAN Membrane-associated guanylate kinase, WW and PDZ domain-containing protein 1 OS=Homo sapiens OX=9606 GN=MAGI1 PE=1 SV=1	219	CVLGHTHAQVVK
MVLSHTHAQGVK	sp|P69723|VIF_HV1H2	109	sp|Q96QZ7|MAGI1_HUMAN Membrane-associated guanylate kinase, WW and PDZ domain-containing protein 1 OS=Homo sapiens OX=9606 GN=MAGI1 PE=1 SV=3	526	CVLGHTHAQVVK
MVLSHTHAQGVK	sp|P69723|VIF_HV1H2	109	tr|H7C4U7|H7C4U7_HUMAN Membrane-associated guanylate kinase, WW and PDZ domain-containing protein 1 (Fragment) OS=Homo sapiens OX=9606 GN=MAGI1 PE=1 SV=1	401	CVLGHTHAQVVK
MVLSHTHAQGVK	sp|P69723|VIF_HV1H2	109	tr|A0A087WXD2|A0A087WXD2_HUMAN Membrane-associated guanylate kinase, WW and PDZ domain-containing protein 1 OS=Homo sapiens OX=9606 GN=MAGI1 PE=1 SV=1	219	CVLGHTHAQVVK
MVLSHTHAQGVK	sp|P69723|VIF_HV1H2	109	tr|H7C535|H7C535_HUMAN Membrane-associated guanylate kinase, WW and PDZ domain-containing protein 1 (Fragment) OS=Homo sapiens OX=9606 GN=MAGI1 PE=1 SV=1	407	CVLGHTHAQVVK
GWGDLQGPPISG	sp|P04578|ENV_HV1H2	273	sp|Q13444|ADA15_HUMAN Disintegrin and metalloproteinase domain-containing protein 15 OS=Homo sapiens OX=9606 GN=ADAM15 PE=1 SV=4	156	GPGDLQGPPIIS
LQRIRTVGLKAA	sp|P04585|POL_HV1H2	517	sp|Q8N3T6|T132C_HUMAN Transmembrane protein 132C OS=Homo sapiens OX=9606 GN=TMEM132C PE=2 SV=3	266	LQRIGTVGLYRA
YVGGRSKLWKIL	sp|P69723|VIF_HV1H2	170	tr|H0Y8N8|H0Y8N8_HUMAN Rap guanine nucleotide exchange factor 2 (Fragment) OS=Homo sapiens OX=9606 GN=RAPGEF2 PE=1 SV=1	164	TVGGRNKLKKIL
YVGGRSKLWKIL	sp|P69723|VIF_HV1H2	170	tr|A0A2R8YGD3|A0A2R8YGD3_HUMAN Cyclic nucleotide ras GEF OS=Homo sapiens OX=9606 GN=RAPGEF2 PE=1 SV=1	681	TVGGRNKLKKIL
YVGGRSKLWKIL	sp|P69723|VIF_HV1H2	170	sp|Q9Y4G8|RPGF2_HUMAN Rap guanine nucleotide exchange factor 2 OS=Homo sapiens OX=9606 GN=RAPGEF2 PE=1 SV=1	526	TVGGRNKLKKIL
YVGGRSKLWKIL	sp|P69723|VIF_HV1H2	170	tr|A0A2R8Y661|A0A2R8Y661_HUMAN Cyclic nucleotide ras GEF OS=Homo sapiens OX=9606 GN=RAPGEF2 PE=1 SV=1	569	TVGGRNKLKKIL
GTMHGGLTAHLS	sp|P04585|POL_HV1H2	764	sp|Q9NPJ3|ACO13_HUMAN Acyl-coenzyme A thioesterase 13 OS=Homo sapiens OX=9606 GN=ACOT13 PE=1 SV=1	53	GTLHGGLTATLV
KNEFMQRIADAE	sp|P04591|GAG_HV1H2	352	tr|A0A2R8Y7M0|A0A2R8Y7M0_HUMAN TATA element modulatory factor OS=Homo sapiens OX=9606 GN=TMF1 PE=1 SV=1	500	KDEFTQRIAEAE
KNEFMQRIADAE	sp|P04591|GAG_HV1H2	352	tr|F8WF45|F8WF45_HUMAN TATA element modulatory factor OS=Homo sapiens OX=9606 GN=TMF1 PE=1 SV=1	500	KDEFTQRIAEAE
KNEFMQRIADAE	sp|P04591|GAG_HV1H2	352	sp|P82094|TMF1_HUMAN TATA element modulatory factor OS=Homo sapiens OX=9606 GN=TMF1 PE=1 SV=2	500	KDEFTQRIAEAE
VFTPTIEGWKAQ	sp|P04585|POL_HV1H2	626	tr|H0Y7Z9|H0Y7Z9_HUMAN Protein-tyrosine-phosphatase (Fragment) OS=Homo sapiens OX=9606 GN=PTPRF PE=1 SV=1	117	VFTPTIEARTAQ
VFTPTIEGWKAQ	sp|P04585|POL_HV1H2	626	tr|H0Y4H1|H0Y4H1_HUMAN Protein-tyrosine-phosphatase (Fragment) OS=Homo sapiens OX=9606 GN=PTPRF PE=1 SV=1	260	VFTPTIEARTAQ
VFTPTIEGWKAQ	sp|P04585|POL_HV1H2	626	tr|H0Y6Z7|H0Y6Z7_HUMAN Protein-tyrosine-phosphatase (Fragment) OS=Homo sapiens OX=9606 GN=PTPRF PE=1 SV=1	249	VFTPTIEARTAQ
VFTPTIEGWKAQ	sp|P04585|POL_HV1H2	626	sp|P10586|PTPRF_HUMAN Receptor-type tyrosine-protein phosphatase F OS=Homo sapiens OX=9606 GN=PTPRF PE=1 SV=2	592	VFTPTIEARTAQ
KLKAIAPEDPEA	sp|P04585|POL_HV1H2	458	sp|Q9NYB0|TE2IP_HUMAN Telomeric repeat-binding factor 2-interacting protein 1 OS=Homo sapiens OX=9606 GN=TERF2IP PE=1 SV=1	208	KLKRKAEEDPEA
KLKAIAPEDPEA	sp|P04585|POL_HV1H2	458	tr|A0A590UJT3|A0A590UJT3_HUMAN Telomeric repeat-binding factor 2-interacting protein 1 OS=Homo sapiens OX=9606 GN=TERF2IP PE=1 SV=1	208	KLKRKAEEDPEA
KLKAIAPEDPEA	sp|P04585|POL_HV1H2	458	tr|H3BMI8|H3BMI8_HUMAN Telomeric repeat-binding factor 2-interacting protein 1 (Fragment) OS=Homo sapiens OX=9606 GN=TERF2IP PE=1 SV=1	37	KLKRKAEEDPEA
SQTVPGGRRLRE	sp|P04618|REV_HV1H2	35	tr|A0A087WW86|A0A087WW86_HUMAN GPALPP motifs-containing protein 1 OS=Homo sapiens OX=9606 GN=GPALPP1 PE=1 SV=1	77	SQTVAGGRRLGD
LVYAGWGDLQGP	sp|P04578|ENV_HV1H2	269	tr|K7EIK1|K7EIK1_HUMAN WW domain-binding protein 2 (Fragment) OS=Homo sapiens OX=9606 GN=WBP2 PE=1 SV=1	175	LVAAGWGREQGP
LVYAGWGDLQGP	sp|P04578|ENV_HV1H2	269	sp|P98161|PKD1_HUMAN Polycystin-1 OS=Homo sapiens OX=9606 GN=PKD1 PE=1 SV=3	545	LVGAPSGDLQGP
LSHTHAQGVKGF	sp|P69723|VIF_HV1H2	111	tr|H7C5T8|H7C5T8_HUMAN Membrane-associated guanylate kinase, WW and PDZ domain-containing protein 1 (Fragment) OS=Homo sapiens OX=9606 GN=MAGI1 PE=1 SV=1	314	LGHTHAQVVKIF
LSHTHAQGVKGF	sp|P69723|VIF_HV1H2	111	tr|A0A087WT53|A0A087WT53_HUMAN Membrane-associated guanylate kinase, WW and PDZ domain-containing protein 1 OS=Homo sapiens OX=9606 GN=MAGI1 PE=1 SV=1	221	LGHTHAQVVKIF
LSHTHAQGVKGF	sp|P69723|VIF_HV1H2	111	sp|Q96QZ7|MAGI1_HUMAN Membrane-associated guanylate kinase, WW and PDZ domain-containing protein 1 OS=Homo sapiens OX=9606 GN=MAGI1 PE=1 SV=3	528	LGHTHAQVVKIF
LSHTHAQGVKGF	sp|P69723|VIF_HV1H2	111	tr|H7C4U7|H7C4U7_HUMAN Membrane-associated guanylate kinase, WW and PDZ domain-containing protein 1 (Fragment) OS=Homo sapiens OX=9606 GN=MAGI1 PE=1 SV=1	403	LGHTHAQVVKIF
LSHTHAQGVKGF	sp|P69723|VIF_HV1H2	111	tr|A0A087WXD2|A0A087WXD2_HUMAN Membrane-associated guanylate kinase, WW and PDZ domain-containing protein 1 OS=Homo sapiens OX=9606 GN=MAGI1 PE=1 SV=1	221	LGHTHAQVVKIF
LSHTHAQGVKGF	sp|P69723|VIF_HV1H2	111	tr|H7C535|H7C535_HUMAN Membrane-associated guanylate kinase, WW and PDZ domain-containing protein 1 (Fragment) OS=Homo sapiens OX=9606 GN=MAGI1 PE=1 SV=1	409	LGHTHAQVVKIF
PQVPLEAKSALS	sp|P04585|POL_HV1H2	352	sp|O95625|ZBT11_HUMAN Zinc finger and BTB domain-containing protein 11 OS=Homo sapiens OX=9606 GN=ZBTB11 PE=1 SV=2	386	PQVSSEAESALS
MNSDLKIDDLQE	sp|P04585|POL_HV1H2	1253	sp|Q86VH2|KIF27_HUMAN Kinesin-like protein KIF27 OS=Homo sapiens OX=9606 GN=KIF27 PE=1 SV=1	692	ENEDLKIDCLQE
ENTDTNKPSVEG	sp|P04578|ENV_HV1H2	816	tr|A0A6Q8PGK9|A0A6Q8PGK9_HUMAN Inverted formin-2 (Fragment) OS=Homo sapiens OX=9606 GN=INF2 PE=1 SV=1	46	QNTTTPKPSVEG
ENTDTNKPSVEG	sp|P04578|ENV_HV1H2	816	tr|A0A6Q8PH59|A0A6Q8PH59_HUMAN Inverted formin-2 OS=Homo sapiens OX=9606 GN=INF2 PE=1 SV=1	374	QNTTTPKPSVEG
ENTDTNKPSVEG	sp|P04578|ENV_HV1H2	816	tr|A0A6Q8PFB9|A0A6Q8PFB9_HUMAN Inverted formin-2 OS=Homo sapiens OX=9606 GN=INF2 PE=1 SV=1	374	QNTTTPKPSVEG
ENTDTNKPSVEG	sp|P04578|ENV_HV1H2	816	tr|A0A6Q8PGC7|A0A6Q8PGC7_HUMAN Inverted formin-2 OS=Homo sapiens OX=9606 GN=INF2 PE=1 SV=1	374	QNTTTPKPSVEG
ENTDTNKPSVEG	sp|P04578|ENV_HV1H2	816	tr|A0A087X118|A0A087X118_HUMAN Inverted formin-2 OS=Homo sapiens OX=9606 GN=INF2 PE=1 SV=1	374	QNTTTPKPSVEG
ENTDTNKPSVEG	sp|P04578|ENV_HV1H2	816	tr|A0A6Q8PF44|A0A6Q8PF44_HUMAN Inverted formin-2 OS=Homo sapiens OX=9606 GN=INF2 PE=1 SV=1	374	QNTTTPKPSVEG
ENTDTNKPSVEG	sp|P04578|ENV_HV1H2	816	tr|A0A6Q8PH25|A0A6Q8PH25_HUMAN Inverted formin-2 OS=Homo sapiens OX=9606 GN=INF2 PE=1 SV=1	374	QNTTTPKPSVEG
ENTDTNKPSVEG	sp|P04578|ENV_HV1H2	816	tr|A0A6Q8PF29|A0A6Q8PF29_HUMAN Inverted formin-2 OS=Homo sapiens OX=9606 GN=INF2 PE=1 SV=1	374	QNTTTPKPSVEG
ENTDTNKPSVEG	sp|P04578|ENV_HV1H2	816	tr|A0A6Q8PHG2|A0A6Q8PHG2_HUMAN Inverted formin-2 OS=Homo sapiens OX=9606 GN=INF2 PE=1 SV=1	374	QNTTTPKPSVEG
ENTDTNKPSVEG	sp|P04578|ENV_HV1H2	816	sp|Q27J81|INF2_HUMAN Inverted formin-2 OS=Homo sapiens OX=9606 GN=INF2 PE=1 SV=2	374	QNTTTPKPSVEG
ENTDTNKPSVEG	sp|P04578|ENV_HV1H2	816	tr|A0A6Q8PGN3|A0A6Q8PGN3_HUMAN Inverted formin-2 OS=Homo sapiens OX=9606 GN=INF2 PE=1 SV=1	366	QNTTTPKPSVEG
ENTDTNKPSVEG	sp|P04578|ENV_HV1H2	816	tr|A0A6Q8PHA2|A0A6Q8PHA2_HUMAN Inverted formin-2 OS=Homo sapiens OX=9606 GN=INF2 PE=1 SV=1	406	QNTTTPKPSVEG
ENTDTNKPSVEG	sp|P04578|ENV_HV1H2	816	tr|A0A6Q8PH63|A0A6Q8PH63_HUMAN Inverted formin-2 OS=Homo sapiens OX=9606 GN=INF2 PE=1 SV=1	374	QNTTTPKPSVEG
ENTDTNKPSVEG	sp|P04578|ENV_HV1H2	816	tr|A0A6Q8PGU8|A0A6Q8PGU8_HUMAN Inverted formin-2 OS=Homo sapiens OX=9606 GN=INF2 PE=1 SV=1	374	QNTTTPKPSVEG
ENTDTNKPSVEG	sp|P04578|ENV_HV1H2	816	tr|A0A6Q8PFN5|A0A6Q8PFN5_HUMAN Inverted formin-2 OS=Homo sapiens OX=9606 GN=INF2 PE=1 SV=1	374	QNTTTPKPSVEG
ENTDTNKPSVEG	sp|P04578|ENV_HV1H2	816	tr|A0A6Q8PH71|A0A6Q8PH71_HUMAN Inverted formin-2 OS=Homo sapiens OX=9606 GN=INF2 PE=1 SV=1	374	QNTTTPKPSVEG
ENTDTNKPSVEG	sp|P04578|ENV_HV1H2	816	tr|A0A6Q8PGY8|A0A6Q8PGY8_HUMAN Inverted formin-2 OS=Homo sapiens OX=9606 GN=INF2 PE=1 SV=1	374	QNTTTPKPSVEG
ENTDTNKPSVEG	sp|P04578|ENV_HV1H2	816	tr|A0A6Q8PH52|A0A6Q8PH52_HUMAN Inverted formin-2 OS=Homo sapiens OX=9606 GN=INF2 PE=1 SV=1	374	QNTTTPKPSVEG
PLRSVSLIEPRS	sp|P04618|REV_HV1H2	49	tr|K7EKA3|K7EKA3_HUMAN Inactive rhomboid protein 2 (Fragment) OS=Homo sapiens OX=9606 GN=RHBDF2 PE=1 SV=1	56	YLKSVSLQEPRS
PLRSVSLIEPRS	sp|P04618|REV_HV1H2	49	tr|K7EIY3|K7EIY3_HUMAN Inactive rhomboid protein 2 (Fragment) OS=Homo sapiens OX=9606 GN=RHBDF2 PE=1 SV=1	56	YLKSVSLQEPRS
PLRSVSLIEPRS	sp|P04618|REV_HV1H2	49	tr|K7EQ53|K7EQ53_HUMAN Inactive rhomboid protein 2 (Fragment) OS=Homo sapiens OX=9606 GN=RHBDF2 PE=1 SV=8	56	YLKSVSLQEPRS
PLRSVSLIEPRS	sp|P04618|REV_HV1H2	49	tr|K7EKI1|K7EKI1_HUMAN Inactive rhomboid protein 2 (Fragment) OS=Homo sapiens OX=9606 GN=RHBDF2 PE=1 SV=8	56	YLKSVSLQEPRS
PLRSVSLIEPRS	sp|P04618|REV_HV1H2	49	tr|K7EPV3|K7EPV3_HUMAN Inactive rhomboid protein 2 (Fragment) OS=Homo sapiens OX=9606 GN=RHBDF2 PE=1 SV=1	85	YLKSVSLQEPRS
PLRSVSLIEPRS	sp|P04618|REV_HV1H2	49	sp|Q6PJF5|RHDF2_HUMAN Inactive rhomboid protein 2 OS=Homo sapiens OX=9606 GN=RHBDF2 PE=1 SV=2	85	YLKSVSLQEPRS
DKGTVEDMDQDK	sp|P04591|GAG_HV1H2	84	sp|Q9Y2W2|WBP11_HUMAN WW domain-binding protein 11 OS=Homo sapiens OX=9606 GN=WBP11 PE=1 SV=1	255	DDGYPEDMDQDK
RGYPILDQAKGS	sp|P04585|POL_HV1H2	324	sp|P02458|CO2A1_HUMAN Collagen alpha-1(II) chain OS=Homo sapiens OX=9606 GN=COL2A1 PE=1 SV=3	290	RGYPGLDGAKGE
PKEPQAAVGDLL	sp|P04585|POL_HV1H2	722	sp|Q9NS98|SEM3G_HUMAN Semaphorin-3G OS=Homo sapiens OX=9606 GN=SEMA3G PE=1 SV=1	605	PKSPQAAVRWLL
AILLSIVRTLAV	sp|P04578|ENV_HV1H2	783	sp|O60306|AQR_HUMAN RNA helicase aquarius OS=Homo sapiens OX=9606 GN=AQR PE=1 SV=4	1270	YILLSLVRTRAV
YNEWIGGLGDPG	sp|P04585|POL_HV1H2	491	tr|H0Y5R1|H0Y5R1_HUMAN Aryl hydrocarbon receptor nuclear translocator-like protein 2 (Fragment) OS=Homo sapiens OX=9606 GN=ARNTL2 PE=1 SV=1	568	YLEAEGGLGDPG
YNEWIGGLGDPG	sp|P04585|POL_HV1H2	491	sp|Q8WYA1|BMAL2_HUMAN Aryl hydrocarbon receptor nuclear translocator-like protein 2 OS=Homo sapiens OX=9606 GN=ARNTL2 PE=1 SV=2	616	YLEAEGGLGDPG
GGRRLRERRPLR	sp|P04618|REV_HV1H2	40	tr|M0QX40|M0QX40_HUMAN Protein ABHD8 (Fragment) OS=Homo sapiens OX=9606 GN=ABHD8 PE=1 SV=1	161	GGRRRRARRPKR
GGRRLRERRPLR	sp|P04618|REV_HV1H2	40	sp|Q96I13|ABHD8_HUMAN Protein ABHD8 OS=Homo sapiens OX=9606 GN=ABHD8 PE=1 SV=1	145	GGRRRRARRPKR
GGRRLRERRPLR	sp|P04618|REV_HV1H2	40	sp|Q99748|NRTN_HUMAN Neurturin OS=Homo sapiens OX=9606 GN=NRTN PE=1 SV=1	144	GLRRLRQRRRLR
EGGTPIKAAMAL	sp|P04585|POL_HV1H2	701	tr|J3KTJ6|J3KTJ6_HUMAN Gamma-soluble NSF attachment protein (Fragment) OS=Homo sapiens OX=9606 GN=NAPG PE=1 SV=3	152	ENGTPDTAAMAL
EGGTPIKAAMAL	sp|P04585|POL_HV1H2	701	sp|Q99747|SNAG_HUMAN Gamma-soluble NSF attachment protein OS=Homo sapiens OX=9606 GN=NAPG PE=1 SV=1	107	ENGTPDTAAMAL
LARAGGPTSEPA	sp|P04585|POL_HV1H2	833	sp|Q2M3D2|EX3L2_HUMAN Exocyst complex component 3-like protein 2 OS=Homo sapiens OX=9606 GN=EXOC3L2 PE=1 SV=1	141	LARVGPPESEPA
LARAGGPTSEPA	sp|P04585|POL_HV1H2	833	tr|A0A1C7CYX0|A0A1C7CYX0_HUMAN Exocyst complex component 3-like protein 2 OS=Homo sapiens OX=9606 GN=EXOC3L2 PE=1 SV=1	534	LARVGPPESEPA
NTDTNKPSVEGL	sp|P04578|ENV_HV1H2	817	tr|A0A6Q8PGK9|A0A6Q8PGK9_HUMAN Inverted formin-2 (Fragment) OS=Homo sapiens OX=9606 GN=INF2 PE=1 SV=1	47	NTTTPKPSVEGQ
NTDTNKPSVEGL	sp|P04578|ENV_HV1H2	817	tr|A0A6Q8PH59|A0A6Q8PH59_HUMAN Inverted formin-2 OS=Homo sapiens OX=9606 GN=INF2 PE=1 SV=1	375	NTTTPKPSVEGQ
NTDTNKPSVEGL	sp|P04578|ENV_HV1H2	817	tr|A0A6Q8PFB9|A0A6Q8PFB9_HUMAN Inverted formin-2 OS=Homo sapiens OX=9606 GN=INF2 PE=1 SV=1	375	NTTTPKPSVEGQ
NTDTNKPSVEGL	sp|P04578|ENV_HV1H2	817	tr|A0A6Q8PGC7|A0A6Q8PGC7_HUMAN Inverted formin-2 OS=Homo sapiens OX=9606 GN=INF2 PE=1 SV=1	375	NTTTPKPSVEGQ
NTDTNKPSVEGL	sp|P04578|ENV_HV1H2	817	tr|A0A087X118|A0A087X118_HUMAN Inverted formin-2 OS=Homo sapiens OX=9606 GN=INF2 PE=1 SV=1	375	NTTTPKPSVEGQ
NTDTNKPSVEGL	sp|P04578|ENV_HV1H2	817	tr|A0A6Q8PF44|A0A6Q8PF44_HUMAN Inverted formin-2 OS=Homo sapiens OX=9606 GN=INF2 PE=1 SV=1	375	NTTTPKPSVEGQ
NTDTNKPSVEGL	sp|P04578|ENV_HV1H2	817	tr|A0A6Q8PH25|A0A6Q8PH25_HUMAN Inverted formin-2 OS=Homo sapiens OX=9606 GN=INF2 PE=1 SV=1	375	NTTTPKPSVEGQ
NTDTNKPSVEGL	sp|P04578|ENV_HV1H2	817	tr|A0A6Q8PF29|A0A6Q8PF29_HUMAN Inverted formin-2 OS=Homo sapiens OX=9606 GN=INF2 PE=1 SV=1	375	NTTTPKPSVEGQ
NTDTNKPSVEGL	sp|P04578|ENV_HV1H2	817	tr|A0A6Q8PHG2|A0A6Q8PHG2_HUMAN Inverted formin-2 OS=Homo sapiens OX=9606 GN=INF2 PE=1 SV=1	375	NTTTPKPSVEGQ
NTDTNKPSVEGL	sp|P04578|ENV_HV1H2	817	sp|Q27J81|INF2_HUMAN Inverted formin-2 OS=Homo sapiens OX=9606 GN=INF2 PE=1 SV=2	375	NTTTPKPSVEGQ
NTDTNKPSVEGL	sp|P04578|ENV_HV1H2	817	tr|A0A6Q8PGN3|A0A6Q8PGN3_HUMAN Inverted formin-2 OS=Homo sapiens OX=9606 GN=INF2 PE=1 SV=1	367	NTTTPKPSVEGQ
NTDTNKPSVEGL	sp|P04578|ENV_HV1H2	817	tr|A0A6Q8PHA2|A0A6Q8PHA2_HUMAN Inverted formin-2 OS=Homo sapiens OX=9606 GN=INF2 PE=1 SV=1	407	NTTTPKPSVEGQ
NTDTNKPSVEGL	sp|P04578|ENV_HV1H2	817	tr|A0A6Q8PH63|A0A6Q8PH63_HUMAN Inverted formin-2 OS=Homo sapiens OX=9606 GN=INF2 PE=1 SV=1	375	NTTTPKPSVEGQ
NTDTNKPSVEGL	sp|P04578|ENV_HV1H2	817	tr|A0A6Q8PGU8|A0A6Q8PGU8_HUMAN Inverted formin-2 OS=Homo sapiens OX=9606 GN=INF2 PE=1 SV=1	375	NTTTPKPSVEGQ
NTDTNKPSVEGL	sp|P04578|ENV_HV1H2	817	tr|A0A6Q8PFN5|A0A6Q8PFN5_HUMAN Inverted formin-2 OS=Homo sapiens OX=9606 GN=INF2 PE=1 SV=1	375	NTTTPKPSVEGQ
NTDTNKPSVEGL	sp|P04578|ENV_HV1H2	817	tr|A0A6Q8PH71|A0A6Q8PH71_HUMAN Inverted formin-2 OS=Homo sapiens OX=9606 GN=INF2 PE=1 SV=1	375	NTTTPKPSVEGQ
NTDTNKPSVEGL	sp|P04578|ENV_HV1H2	817	tr|A0A6Q8PGY8|A0A6Q8PGY8_HUMAN Inverted formin-2 OS=Homo sapiens OX=9606 GN=INF2 PE=1 SV=1	375	NTTTPKPSVEGQ
NTDTNKPSVEGL	sp|P04578|ENV_HV1H2	817	tr|A0A6Q8PH52|A0A6Q8PH52_HUMAN Inverted formin-2 OS=Homo sapiens OX=9606 GN=INF2 PE=1 SV=1	375	NTTTPKPSVEGQ
NSDLKIDDLQEI	sp|P04585|POL_HV1H2	1254	sp|Q86VH2|KIF27_HUMAN Kinesin-like protein KIF27 OS=Homo sapiens OX=9606 GN=KIF27 PE=1 SV=1	693	NEDLKIDCLQES
PNAGEGQKGGGS	sp|P04585|POL_HV1H2	1120	tr|E5RG39|E5RG39_HUMAN Zinc finger protein 696 (Fragment) OS=Homo sapiens OX=9606 GN=ZNF696 PE=1 SV=1	108	PNAGPGAEGGGS
PNAGEGQKGGGS	sp|P04585|POL_HV1H2	1120	sp|Q9H7X3|ZN696_HUMAN Zinc finger protein 696 OS=Homo sapiens OX=9606 GN=ZNF696 PE=1 SV=2	108	PNAGPGAEGGGS
PNAGEGQKGGGS	sp|P04585|POL_HV1H2	1120	sp|P0DPQ3|PR20G_HUMAN Proline-rich protein 20G OS=Homo sapiens OX=9606 GN=PRR20G PE=3 SV=1	64	PPAGRGQRGGGS
QTSQTVPGGRRL	sp|P04618|REV_HV1H2	33	tr|A0A087WW86|A0A087WW86_HUMAN GPALPP motifs-containing protein 1 OS=Homo sapiens OX=9606 GN=GPALPP1 PE=1 SV=1	75	FSSQTVAGGRRL
ILLSIVRTLAVQ	sp|P04578|ENV_HV1H2	784	sp|O60306|AQR_HUMAN RNA helicase aquarius OS=Homo sapiens OX=9606 GN=AQR PE=1 SV=4	1271	ILLSLVRTRAVG
KDYIAVLLKRAR	sp|P04578|ENV_HV1H2	50	sp|Q9UBF1|MAGC2_HUMAN Melanoma-associated antigen C2 OS=Homo sapiens OX=9606 GN=MAGEC2 PE=1 SV=1	175	KDYFPVILKRAR
LGTMHGGLTAHL	sp|P04585|POL_HV1H2	763	sp|Q9NPJ3|ACO13_HUMAN Acyl-coenzyme A thioesterase 13 OS=Homo sapiens OX=9606 GN=ACOT13 PE=1 SV=1	52	IGTLHGGLTATL
VGGRSKLWKILK	sp|P69723|VIF_HV1H2	171	tr|H0Y8N8|H0Y8N8_HUMAN Rap guanine nucleotide exchange factor 2 (Fragment) OS=Homo sapiens OX=9606 GN=RAPGEF2 PE=1 SV=1	165	VGGRNKLKKILD
VGGRSKLWKILK	sp|P69723|VIF_HV1H2	171	tr|A0A2R8YGD3|A0A2R8YGD3_HUMAN Cyclic nucleotide ras GEF OS=Homo sapiens OX=9606 GN=RAPGEF2 PE=1 SV=1	682	VGGRNKLKKILD
VGGRSKLWKILK	sp|P69723|VIF_HV1H2	171	sp|Q9Y4G8|RPGF2_HUMAN Rap guanine nucleotide exchange factor 2 OS=Homo sapiens OX=9606 GN=RAPGEF2 PE=1 SV=1	527	VGGRNKLKKILD
VGGRSKLWKILK	sp|P69723|VIF_HV1H2	171	tr|A0A2R8Y661|A0A2R8Y661_HUMAN Cyclic nucleotide ras GEF OS=Homo sapiens OX=9606 GN=RAPGEF2 PE=1 SV=1	570	VGGRNKLKKILD
LRSVSLIEPRSA	sp|P04618|REV_HV1H2	50	tr|K7EKA3|K7EKA3_HUMAN Inactive rhomboid protein 2 (Fragment) OS=Homo sapiens OX=9606 GN=RHBDF2 PE=1 SV=1	57	LKSVSLQEPRSR
LRSVSLIEPRSA	sp|P04618|REV_HV1H2	50	tr|K7EIY3|K7EIY3_HUMAN Inactive rhomboid protein 2 (Fragment) OS=Homo sapiens OX=9606 GN=RHBDF2 PE=1 SV=1	57	LKSVSLQEPRSR
LRSVSLIEPRSA	sp|P04618|REV_HV1H2	50	tr|K7EQ53|K7EQ53_HUMAN Inactive rhomboid protein 2 (Fragment) OS=Homo sapiens OX=9606 GN=RHBDF2 PE=1 SV=8	57	LKSVSLQEPRSR
LRSVSLIEPRSA	sp|P04618|REV_HV1H2	50	tr|K7EKI1|K7EKI1_HUMAN Inactive rhomboid protein 2 (Fragment) OS=Homo sapiens OX=9606 GN=RHBDF2 PE=1 SV=8	57	LKSVSLQEPRSR
LRSVSLIEPRSA	sp|P04618|REV_HV1H2	50	tr|K7EPV3|K7EPV3_HUMAN Inactive rhomboid protein 2 (Fragment) OS=Homo sapiens OX=9606 GN=RHBDF2 PE=1 SV=1	86	LKSVSLQEPRSR
LRSVSLIEPRSA	sp|P04618|REV_HV1H2	50	sp|Q6PJF5|RHDF2_HUMAN Inactive rhomboid protein 2 OS=Homo sapiens OX=9606 GN=RHBDF2 PE=1 SV=2	86	LKSVSLQEPRSR
GTVEDMDQDKQD	sp|P04591|GAG_HV1H2	86	sp|Q9Y2W2|WBP11_HUMAN WW domain-binding protein 11 OS=Homo sapiens OX=9606 GN=WBP11 PE=1 SV=1	257	GYPEDMDQDKHD
ERGYPILDQAKG	sp|P04585|POL_HV1H2	323	sp|P02458|CO2A1_HUMAN Collagen alpha-1(II) chain OS=Homo sapiens OX=9606 GN=COL2A1 PE=1 SV=3	289	HRGYPGLDGAKG
VDQLQIVLVDLE	sp|P04585|POL_HV1H2	405	sp|Q86UU1|PHLB1_HUMAN Pleckstrin homology-like domain family B member 1 OS=Homo sapiens OX=9606 GN=PHLDB1 PE=1 SV=1	773	VDQLQEKLVALE
VDQLQIVLVDLE	sp|P04585|POL_HV1H2	405	tr|A0A087WZL0|A0A087WZL0_HUMAN Pleckstrin homology-like domain family B member 1 (Fragment) OS=Homo sapiens OX=9606 GN=PHLDB1 PE=1 SV=1	52	VDQLQEKLVALE
DQVVKMLPPDTT	sp|P04585|POL_HV1H2	437	tr|F8VX58|F8VX58_HUMAN Decorin (Fragment) OS=Homo sapiens OX=9606 GN=DCN PE=1 SV=1	73	DKVPKDLPPDTT
DQVVKMLPPDTT	sp|P04585|POL_HV1H2	437	tr|F8VXZ8|F8VXZ8_HUMAN Decorin (Fragment) OS=Homo sapiens OX=9606 GN=DCN PE=1 SV=1	73	DKVPKDLPPDTT
DQVVKMLPPDTT	sp|P04585|POL_HV1H2	437	tr|F8VUF6|F8VUF6_HUMAN Decorin (Fragment) OS=Homo sapiens OX=9606 GN=DCN PE=1 SV=1	73	DKVPKDLPPDTT
DQVVKMLPPDTT	sp|P04585|POL_HV1H2	437	tr|F8VWU0|F8VWU0_HUMAN Decorin (Fragment) OS=Homo sapiens OX=9606 GN=DCN PE=1 SV=1	73	DKVPKDLPPDTT
DQVVKMLPPDTT	sp|P04585|POL_HV1H2	437	sp|P07585|PGS2_HUMAN Decorin OS=Homo sapiens OX=9606 GN=DCN PE=1 SV=1	73	DKVPKDLPPDTT
LRTEPDADRQNR	sp|P04601|NEF_HV1H2	24	tr|A0A0U1RR59|A0A0U1RR59_HUMAN Gamma-aminobutyric acid type B receptor subunit 2 (Fragment) OS=Homo sapiens OX=9606 GN=GABBR2 PE=1 SV=1	156	LRTNPDAATQNR
LRTEPDADRQNR	sp|P04601|NEF_HV1H2	24	sp|O75899|GABR2_HUMAN Gamma-aminobutyric acid type B receptor subunit 2 OS=Homo sapiens OX=9606 GN=GABBR2 PE=1 SV=1	747	LRTNPDAATQNR
AGWGDLQGPPIS	sp|P04578|ENV_HV1H2	272	sp|Q13444|ADA15_HUMAN Disintegrin and metalloproteinase domain-containing protein 15 OS=Homo sapiens OX=9606 GN=ADAM15 PE=1 SV=4	155	QGPGDLQGPPII
KLMELQHREALT	sp|P04585|POL_HV1H2	813	sp|P23634|AT2B4_HUMAN Plasma membrane calcium-transporting ATPase 4 OS=Homo sapiens OX=9606 GN=ATP2B4 PE=1 SV=2	31	KLMELRSRDALT
