query	query_seqname	query_start	target_seqname	target_start	target
APGHWGPESIWF	sp|Q65900|POLG_CX16G	1195	sp|Q8NAX2|KDF1_HUMAN Keratinocyte differentiation factor 1 OS=Homo sapiens OX=9606 GN=KDF1 PE=1 SV=2	49	DPGHHGPESITF
APGHWGPESIWF	sp|Q65900|POLG_CX16G	1195	tr|Q68D65|Q68D65_HUMAN Keratinocyte differentiation factor 1 OS=Homo sapiens OX=9606 GN=KDF1 PE=1 SV=1	49	DPGHHGPESITF
ISTAAHQLADAQ	sp|Q65900|POLG_CX16G	1119	sp|Q8TEJ3|SH3R3_HUMAN E3 ubiquitin-protein ligase SH3RF3 OS=Homo sapiens OX=9606 GN=SH3RF3 PE=1 SV=2	607	ISTAAHSAAQAQ
KGLYTLQKHIDN	sp|Q65900|POLG_CX16G	1825	sp|Q9Y2G3|AT11B_HUMAN Probable phospholipid-transporting ATPase IF OS=Homo sapiens OX=9606 GN=ATP11B PE=1 SV=2	31	NGLYTPQKFIDN
KGLYTLQKHIDN	sp|Q65900|POLG_CX16G	1825	tr|A0A0C4DG94|A0A0C4DG94_HUMAN P-type phospholipid transporter OS=Homo sapiens OX=9606 GN=ATP11B PE=1 SV=1	31	NGLYTPQKFIDN
VCSGKTGSGCSA	sp|Q65900|POLG_CX16G	410	sp|Q8NHV1|GIMA7_HUMAN GTPase IMAP family member 7 OS=Homo sapiens OX=9606 GN=GIMAP7 PE=1 SV=1	12	VLVGKTGSGKSA
SKQTKPNKSNGS	sp|Q65900|POLG_CX16G	184	tr|A0A0U1RR07|A0A0U1RR07_HUMAN Synaptotagmin-like protein 2 OS=Homo sapiens OX=9606 GN=SYTL2 PE=1 SV=1	218	SKQTLPGLSNGS
SKQTKPNKSNGS	sp|Q65900|POLG_CX16G	184	sp|Q9HCH5|SYTL2_HUMAN Synaptotagmin-like protein 2 OS=Homo sapiens OX=9606 GN=SYTL2 PE=1 SV=3	217	SKQTLPGLSNGS
VDPVAQGCRSSK	sp|Q65900|POLG_CX16G	1547	sp|Q96M86|DNHD1_HUMAN Dynein heavy chain domain-containing protein 1 OS=Homo sapiens OX=9606 GN=DNHD1 PE=2 SV=2	2248	SDPVAQSFRSSK
SGSGQGGDLGSI	sp|Q65900|POLG_CX16G	1159	tr|E7EVL1|E7EVL1_HUMAN Adenylate cyclase type 8 OS=Homo sapiens OX=9606 GN=ADCY8 PE=1 SV=1	119	SGSGGGGDLGFL
SGSGQGGDLGSI	sp|Q65900|POLG_CX16G	1159	sp|P40145|ADCY8_HUMAN Adenylate cyclase type 8 OS=Homo sapiens OX=9606 GN=ADCY8 PE=1 SV=1	119	SGSGGGGDLGFL
GLYTLQKHIDNL	sp|Q65900|POLG_CX16G	1826	sp|Q9Y2G3|AT11B_HUMAN Probable phospholipid-transporting ATPase IF OS=Homo sapiens OX=9606 GN=ATP11B PE=1 SV=2	32	GLYTPQKFIDNR
GLYTLQKHIDNL	sp|Q65900|POLG_CX16G	1826	tr|A0A0C4DG94|A0A0C4DG94_HUMAN P-type phospholipid transporter OS=Homo sapiens OX=9606 GN=ATP11B PE=1 SV=1	32	GLYTPQKFIDNR
TAATLAPNAGVM	sp|Q65900|POLG_CX16G	85	sp|P52655|TF2AA_HUMAN Transcription initiation factor IIA subunit 1 OS=Homo sapiens OX=9606 GN=GTF2A1 PE=1 SV=1	139	TAATLALPAGVT
CSGKTGSGCSAT	sp|Q65900|POLG_CX16G	411	sp|Q6P9H5|GIMA6_HUMAN GTPase IMAP family member 6 OS=Homo sapiens OX=9606 GN=GIMAP6 PE=2 SV=1	45	LMGKTGSGKSAT
CSGKTGSGCSAT	sp|Q65900|POLG_CX16G	411	tr|B4DH95|B4DH95_HUMAN GTPase IMAP family member 6 OS=Homo sapiens OX=9606 GN=GIMAP6 PE=1 SV=1	115	LMGKTGSGKSAT
CSGKTGSGCSAT	sp|Q65900|POLG_CX16G	411	sp|Q8NHV1|GIMA7_HUMAN GTPase IMAP family member 7 OS=Homo sapiens OX=9606 GN=GIMAP7 PE=1 SV=1	13	LVGKTGSGKSAT
SRTLLTNRDLSS	sp|Q65900|POLG_CX16G	247	tr|E9PPS7|E9PPS7_HUMAN Zinc finger protein 707 (Fragment) OS=Homo sapiens OX=9606 GN=ZNF707 PE=1 SV=1	62	SRGLKTGRDLSS
GTAATLAPNAGV	sp|Q65900|POLG_CX16G	84	sp|P52655|TF2AA_HUMAN Transcription initiation factor IIA subunit 1 OS=Homo sapiens OX=9606 GN=GTF2A1 PE=1 SV=1	138	ATAATLALPAGV
QPILNEATFWVV	sp|Q65900|POLG_CX16G	548	tr|A0A0A0MRD9|A0A0A0MRD9_HUMAN Haptoglobin-related protein OS=Homo sapiens OX=9606 GN=HPR PE=1 SV=1	206	QPILNEHTFCVG
QPILNEATFWVV	sp|Q65900|POLG_CX16G	548	sp|P00739|HPTR_HUMAN Haptoglobin-related protein OS=Homo sapiens OX=9606 GN=HPR PE=2 SV=2	273	QPILNEHTFCVG
QIASGSGQGGDL	sp|Q65900|POLG_CX16G	1156	tr|E7EVL1|E7EVL1_HUMAN Adenylate cyclase type 8 OS=Homo sapiens OX=9606 GN=ADCY8 PE=1 SV=1	116	GSASGSGGGGDL
QIASGSGQGGDL	sp|Q65900|POLG_CX16G	1156	sp|P40145|ADCY8_HUMAN Adenylate cyclase type 8 OS=Homo sapiens OX=9606 GN=ADCY8 PE=1 SV=1	116	GSASGSGGGGDL
NQPILNEATFWV	sp|Q65900|POLG_CX16G	547	tr|A0A0A0MRD9|A0A0A0MRD9_HUMAN Haptoglobin-related protein OS=Homo sapiens OX=9606 GN=HPR PE=1 SV=1	205	VQPILNEHTFCV
NQPILNEATFWV	sp|Q65900|POLG_CX16G	547	sp|P00739|HPTR_HUMAN Haptoglobin-related protein OS=Homo sapiens OX=9606 GN=HPR PE=2 SV=2	272	VQPILNEHTFCV
GKTGSGCSATAQ	sp|Q65900|POLG_CX16G	413	sp|Q8NHV1|GIMA7_HUMAN GTPase IMAP family member 7 OS=Homo sapiens OX=9606 GN=GIMAP7 PE=1 SV=1	15	GKTGSGKSATAN
GKTGSGCSATAQ	sp|Q65900|POLG_CX16G	413	sp|Q6P9H5|GIMA6_HUMAN GTPase IMAP family member 6 OS=Homo sapiens OX=9606 GN=GIMAP6 PE=2 SV=1	47	GKTGSGKSATGN
GKTGSGCSATAQ	sp|Q65900|POLG_CX16G	413	tr|B4DH95|B4DH95_HUMAN GTPase IMAP family member 6 OS=Homo sapiens OX=9606 GN=GIMAP6 PE=1 SV=1	117	GKTGSGKSATGN
AAAAGTMISTAA	sp|Q65900|POLG_CX16G	1112	sp|P0CG40|SP9_HUMAN Transcription factor Sp9 OS=Homo sapiens OX=9606 GN=SP9 PE=3 SV=1	276	AAAASAMISGAA
QGPNISAIVGGV	sp|Q65900|POLG_CX16G	32	tr|D3DSM0|D3DSM0_HUMAN Integrin beta OS=Homo sapiens OX=9606 GN=ITGB2 PE=1 SV=1	640	AGPNIAAIVGGT
QGPNISAIVGGV	sp|Q65900|POLG_CX16G	32	sp|P05107|ITB2_HUMAN Integrin beta-2 OS=Homo sapiens OX=9606 GN=ITGB2 PE=1 SV=2	697	AGPNIAAIVGGT
QGPNISAIVGGV	sp|Q65900|POLG_CX16G	32	tr|A0A494C0X7|A0A494C0X7_HUMAN Integrin beta OS=Homo sapiens OX=9606 GN=ITGB2 PE=1 SV=1	697	AGPNIAAIVGGT
YQGPNISAIVGG	sp|Q65900|POLG_CX16G	31	tr|D3DSM0|D3DSM0_HUMAN Integrin beta OS=Homo sapiens OX=9606 GN=ITGB2 PE=1 SV=1	639	VAGPNIAAIVGG
YQGPNISAIVGG	sp|Q65900|POLG_CX16G	31	sp|P05107|ITB2_HUMAN Integrin beta-2 OS=Homo sapiens OX=9606 GN=ITGB2 PE=1 SV=2	696	VAGPNIAAIVGG
YQGPNISAIVGG	sp|Q65900|POLG_CX16G	31	tr|A0A494C0X7|A0A494C0X7_HUMAN Integrin beta OS=Homo sapiens OX=9606 GN=ITGB2 PE=1 SV=1	696	VAGPNIAAIVGG
ALKSIDELLTDA	sp|Q65900|POLG_CX16G	1088	tr|F5GZ06|F5GZ06_HUMAN Maestro heat-like repeat-containing protein family member 2B OS=Homo sapiens OX=9606 GN=MROH2B PE=1 SV=1	923	ALKKILELLTDR
ALKSIDELLTDA	sp|Q65900|POLG_CX16G	1088	sp|Q7Z745|MRO2B_HUMAN Maestro heat-like repeat-containing protein family member 2B OS=Homo sapiens OX=9606 GN=MROH2B PE=2 SV=3	1368	ALKKILELLTDR
GNLAPVLGLLKA	sp|Q65900|POLG_CX16G	1287	tr|J3KSL5|J3KSL5_HUMAN Cytochrome b-561 (Fragment) OS=Homo sapiens OX=9606 GN=CYB561 PE=1 SV=1	252	GVLANVLGLLLA
GNLAPVLGLLKA	sp|Q65900|POLG_CX16G	1287	tr|J3QS47|J3QS47_HUMAN Cytochrome b-561 OS=Homo sapiens OX=9606 GN=CYB561 PE=1 SV=1	169	GVLANVLGLLLA
GNLAPVLGLLKA	sp|Q65900|POLG_CX16G	1287	sp|P49447|CY561_HUMAN Cytochrome b561 OS=Homo sapiens OX=9606 GN=CYB561 PE=1 SV=2	198	GVLANVLGLLLA
GNLAPVLGLLKA	sp|Q65900|POLG_CX16G	1287	tr|J3QRH5|J3QRH5_HUMAN Cytochrome b-561 OS=Homo sapiens OX=9606 GN=CYB561 PE=1 SV=1	205	GVLANVLGLLLA
GNLAPVLGLLKA	sp|Q65900|POLG_CX16G	1287	tr|F5H757|F5H757_HUMAN Cytochrome b-561 OS=Homo sapiens OX=9606 GN=CYB561 PE=1 SV=1	265	GVLANVLGLLLA
SFIGNLAPVLGL	sp|Q65900|POLG_CX16G	1284	sp|Q9Y5F2|PCDBB_HUMAN Protocadherin beta-11 OS=Homo sapiens OX=9606 GN=PCDHB11 PE=2 SV=1	43	SFVGNLAKDLGL
SFIGNLAPVLGL	sp|Q65900|POLG_CX16G	1284	tr|A0A096LP27|A0A096LP27_HUMAN Protocadherin beta-12 OS=Homo sapiens OX=9606 GN=PCDHB12 PE=4 SV=1	43	SFVGNLAKTLGL
SFIGNLAPVLGL	sp|Q65900|POLG_CX16G	1284	sp|Q9Y5F1|PCDBC_HUMAN Protocadherin beta-12 OS=Homo sapiens OX=9606 GN=PCDHB12 PE=1 SV=1	43	SFVGNLAKTLGL
IALKSIDELLTD	sp|Q65900|POLG_CX16G	1087	tr|F5GZ06|F5GZ06_HUMAN Maestro heat-like repeat-containing protein family member 2B OS=Homo sapiens OX=9606 GN=MROH2B PE=1 SV=1	922	KALKKILELLTD
IALKSIDELLTD	sp|Q65900|POLG_CX16G	1087	sp|Q7Z745|MRO2B_HUMAN Maestro heat-like repeat-containing protein family member 2B OS=Homo sapiens OX=9606 GN=MROH2B PE=2 SV=3	1367	KALKKILELLTD
IASGSGQGGDLG	sp|Q65900|POLG_CX16G	1157	tr|E7EVL1|E7EVL1_HUMAN Adenylate cyclase type 8 OS=Homo sapiens OX=9606 GN=ADCY8 PE=1 SV=1	117	SASGSGGGGDLG
IASGSGQGGDLG	sp|Q65900|POLG_CX16G	1157	sp|P40145|ADCY8_HUMAN Adenylate cyclase type 8 OS=Homo sapiens OX=9606 GN=ADCY8 PE=1 SV=1	117	SASGSGGGGDLG
IDVANKDSEKLK	sp|Q65900|POLG_CX16G	610	sp|Q7Z4S6|KI21A_HUMAN Kinesin-like protein KIF21A OS=Homo sapiens OX=9606 GN=KIF21A PE=1 SV=2	538	IDLAKKDLEKLK
IDVANKDSEKLK	sp|Q65900|POLG_CX16G	610	tr|A0A1B0GV47|A0A1B0GV47_HUMAN Kinesin-like protein KIF21A (Fragment) OS=Homo sapiens OX=9606 GN=KIF21A PE=1 SV=1	529	IDLAKKDLEKLK
VFGVLTQYVVTV	sp|Q65900|POLG_CX16G	53	sp|Q86VZ1|P2RY8_HUMAN P2Y purinoceptor 8 OS=Homo sapiens OX=9606 GN=P2RY8 PE=1 SV=1	90	VFGVLLCNVVTV
REEQKAADKERI	sp|Q65900|POLG_CX16G	363	sp|Q96A33|CCD47_HUMAN Coiled-coil domain-containing protein 47 OS=Homo sapiens OX=9606 GN=CCDC47 PE=1 SV=1	433	REEKKRAEKERI
REEQKAADKERI	sp|Q65900|POLG_CX16G	363	tr|A0A087WYW6|A0A087WYW6_HUMAN Coiled-coil domain-containing protein 47 OS=Homo sapiens OX=9606 GN=CCDC47 PE=1 SV=1	140	REEKKRAEKERI
REEQKAADKERI	sp|Q65900|POLG_CX16G	363	tr|J3QR89|J3QR89_HUMAN Coiled-coil domain-containing protein 47 (Fragment) OS=Homo sapiens OX=9606 PE=4 SV=1	29	REEKKRAEKERI
PVGSLILLPLAT	sp|Q65900|POLG_CX16G	450	sp|O60245|PCDH7_HUMAN Protocadherin-7 OS=Homo sapiens OX=9606 GN=PCDH7 PE=1 SV=2	157	PVGTLYLLPTAT
WKPVGSLILLPL	sp|Q65900|POLG_CX16G	448	tr|H0YDZ8|H0YDZ8_HUMAN Liprin-alpha-1 (Fragment) OS=Homo sapiens OX=9606 GN=PPFIA1 PE=4 SV=1	61	WNPVESLILLIL
DPVAQGCRSSKA	sp|Q65900|POLG_CX16G	1548	sp|Q96M86|DNHD1_HUMAN Dynein heavy chain domain-containing protein 1 OS=Homo sapiens OX=9606 GN=DNHD1 PE=2 SV=2	2249	DPVAQSFRSSKS
SEPSFLSTDGLS	sp|Q65900|POLG_CX16G	2142	tr|F5H522|F5H522_HUMAN Voltage-dependent L-type calcium channel subunit alpha OS=Homo sapiens OX=9606 GN=CACNA1C PE=1 SV=1	1874	SEPSLLSTEMLS
SEPSFLSTDGLS	sp|Q65900|POLG_CX16G	2142	tr|A0A0A0MR67|A0A0A0MR67_HUMAN Voltage-dependent L-type calcium channel subunit alpha OS=Homo sapiens OX=9606 GN=CACNA1C PE=1 SV=1	1884	SEPSLLSTEMLS
SEPSFLSTDGLS	sp|Q65900|POLG_CX16G	2142	sp|Q13936|CAC1C_HUMAN Voltage-dependent L-type calcium channel subunit alpha-1C OS=Homo sapiens OX=9606 GN=CACNA1C PE=1 SV=4	1932	SEPSLLSTEMLS
SEPSFLSTDGLS	sp|Q65900|POLG_CX16G	2142	tr|E9PDI6|E9PDI6_HUMAN Voltage-dependent L-type calcium channel subunit alpha OS=Homo sapiens OX=9606 GN=CACNA1C PE=1 SV=1	1920	SEPSLLSTEMLS
SEPSFLSTDGLS	sp|Q65900|POLG_CX16G	2142	tr|F5GY28|F5GY28_HUMAN Voltage-dependent L-type calcium channel subunit alpha OS=Homo sapiens OX=9606 GN=CACNA1C PE=1 SV=1	1920	SEPSLLSTEMLS
SEPSFLSTDGLS	sp|Q65900|POLG_CX16G	2142	tr|A0A0A0MSA1|A0A0A0MSA1_HUMAN Voltage-dependent L-type calcium channel subunit alpha OS=Homo sapiens OX=9606 GN=CACNA1C PE=1 SV=1	1884	SEPSLLSTEMLS
GPNISAIVGGVP	sp|Q65900|POLG_CX16G	33	tr|D3DSM0|D3DSM0_HUMAN Integrin beta OS=Homo sapiens OX=9606 GN=ITGB2 PE=1 SV=1	641	GPNIAAIVGGTV
GPNISAIVGGVP	sp|Q65900|POLG_CX16G	33	sp|P05107|ITB2_HUMAN Integrin beta-2 OS=Homo sapiens OX=9606 GN=ITGB2 PE=1 SV=2	698	GPNIAAIVGGTV
GPNISAIVGGVP	sp|Q65900|POLG_CX16G	33	tr|A0A494C0X7|A0A494C0X7_HUMAN Integrin beta OS=Homo sapiens OX=9606 GN=ITGB2 PE=1 SV=1	698	GPNIAAIVGGTV
LKASLSDEHSVY	sp|Q65900|POLG_CX16G	1391	sp|Q9UKF2|ADA30_HUMAN Disintegrin and metalloproteinase domain-containing protein 30 OS=Homo sapiens OX=9606 GN=ADAM30 PE=1 SV=2	149	LKASPSFEHVVY
IQNTFILSNGQE	sp|Q65900|POLG_CX16G	950	sp|Q8IWK6|AGRA3_HUMAN Adhesion G protein-coupled receptor A3 OS=Homo sapiens OX=9606 GN=ADGRA3 PE=1 SV=2	1287	IQNGPIKSNGQE
AVPLQDTLDKLF	sp|Q65900|POLG_CX16G	1795	tr|A0A0U1RRL8|A0A0U1RRL8_HUMAN Spermatogenesis-associated protein 20 OS=Homo sapiens OX=9606 GN=SPATA20 PE=1 SV=1	600	ALRLQDTQDKLF
AVPLQDTLDKLF	sp|Q65900|POLG_CX16G	1795	sp|Q8TB22|SPT20_HUMAN Spermatogenesis-associated protein 20 OS=Homo sapiens OX=9606 GN=SPATA20 PE=2 SV=3	600	ALRLQDTQDKLF
LYTLQKHIDNLQ	sp|Q65900|POLG_CX16G	1827	tr|C9JH62|C9JH62_HUMAN Zinc finger protein 277 (Fragment) OS=Homo sapiens OX=9606 GN=ZNF277 PE=1 SV=1	126	LCTLQKKLDNLQ
LYTLQKHIDNLQ	sp|Q65900|POLG_CX16G	1827	sp|Q9NRM2|ZN277_HUMAN Zinc finger protein 277 OS=Homo sapiens OX=9606 GN=ZNF277 PE=1 SV=2	214	LCTLQKKLDNLQ
LYTLQKHIDNLQ	sp|Q65900|POLG_CX16G	1827	tr|G5E9M4|G5E9M4_HUMAN Zinc finger protein 277 OS=Homo sapiens OX=9606 GN=ZNF277 PE=1 SV=1	214	LCTLQKKLDNLQ
SGKTGSGCSATA	sp|Q65900|POLG_CX16G	412	sp|Q8NHV1|GIMA7_HUMAN GTPase IMAP family member 7 OS=Homo sapiens OX=9606 GN=GIMAP7 PE=1 SV=1	14	VGKTGSGKSATA
SGKTGSGCSATA	sp|Q65900|POLG_CX16G	412	sp|Q6P9H5|GIMA6_HUMAN GTPase IMAP family member 6 OS=Homo sapiens OX=9606 GN=GIMAP6 PE=2 SV=1	46	MGKTGSGKSATG
SGKTGSGCSATA	sp|Q65900|POLG_CX16G	412	tr|B4DH95|B4DH95_HUMAN GTPase IMAP family member 6 OS=Homo sapiens OX=9606 GN=GIMAP6 PE=1 SV=1	116	MGKTGSGKSATG
KTGSGCSATAQR	sp|Q65900|POLG_CX16G	414	sp|Q8NHV1|GIMA7_HUMAN GTPase IMAP family member 7 OS=Homo sapiens OX=9606 GN=GIMAP7 PE=1 SV=1	16	KTGSGKSATANT
VAAGSIEEGLMT	sp|Q65900|POLG_CX16G	1480	sp|P08754|GNAI3_HUMAN Guanine nucleotide-binding protein G(i) subunit alpha-3 OS=Homo sapiens OX=9606 GN=GNAI3 PE=1 SV=3	109	VLAGSAEEGVMT
PGHWGPESIWFT	sp|Q65900|POLG_CX16G	1196	sp|Q8NAX2|KDF1_HUMAN Keratinocyte differentiation factor 1 OS=Homo sapiens OX=9606 GN=KDF1 PE=1 SV=2	50	PGHHGPESITFI
PGHWGPESIWFT	sp|Q65900|POLG_CX16G	1196	tr|Q68D65|Q68D65_HUMAN Keratinocyte differentiation factor 1 OS=Homo sapiens OX=9606 GN=KDF1 PE=1 SV=1	50	PGHHGPESITFI
ASGSGQGGDLGS	sp|Q65900|POLG_CX16G	1158	tr|E7EVL1|E7EVL1_HUMAN Adenylate cyclase type 8 OS=Homo sapiens OX=9606 GN=ADCY8 PE=1 SV=1	118	ASGSGGGGDLGF
ASGSGQGGDLGS	sp|Q65900|POLG_CX16G	1158	sp|P40145|ADCY8_HUMAN Adenylate cyclase type 8 OS=Homo sapiens OX=9606 GN=ADCY8 PE=1 SV=1	118	ASGSGGGGDLGF
