query	query_seqname	query_start	target_seqname	target_start	target
LQGSRRRWMDLG	sp|Q88435|NCAP_PIV5	191	tr|E5RGS2|E5RGS2_HUMAN Receptor expression-enhancing protein OS=Homo sapiens OX=9606 GN=REEP4 PE=1 SV=1	219	LQGSRAIWRDLG
TPAISELRAEAE	sp|P11207|V_PIV5	67	sp|P0C7U0|ELFN1_HUMAN Protein ELFN1 OS=Homo sapiens OX=9606 GN=ELFN1 PE=1 SV=2	684	TPAAAVLRAEAE
GAVALSIKSGLY	sp|Q88434|L_PIV5	1056	sp|P08574|CY1_HUMAN Cytochrome c1, heme protein, mitochondrial OS=Homo sapiens OX=9606 GN=CYC1 PE=1 SV=3	43	QAVALSSKSGLS
LGKYVVNEGATA	sp|Q88434|L_PIV5	382	sp|Q8TD33|SG1C1_HUMAN Secretoglobin family 1C member 1 OS=Homo sapiens OX=9606 GN=SCGB1C1 PE=3 SV=2	50	LGKYNVNEDAKA
LGKYVVNEGATA	sp|Q88434|L_PIV5	382	sp|P0DMR2|SG1C2_HUMAN Secretoglobin family 1C member 2 OS=Homo sapiens OX=9606 GN=SCGB1C2 PE=1 SV=1	50	LGKYNVNEDAKA
PTLEVQLLITVL	sp|Q88434|L_PIV5	914	tr|A0A087WSW8|A0A087WSW8_HUMAN Protocadherin alpha-4 OS=Homo sapiens OX=9606 GN=PCDHA4 PE=1 SV=1	221	LTGTVQLLITVL
PTLEVQLLITVL	sp|Q88434|L_PIV5	914	tr|A0A5F9ZHY0|A0A5F9ZHY0_HUMAN Protocadherin alpha-4 OS=Homo sapiens OX=9606 GN=PCDHA4 PE=1 SV=1	222	LTGTVQLLITVL
PTLEVQLLITVL	sp|Q88434|L_PIV5	914	tr|D6RA20|D6RA20_HUMAN Protocadherin alpha-4 OS=Homo sapiens OX=9606 GN=PCDHA4 PE=1 SV=2	222	LTGTVQLLITVL
PTLEVQLLITVL	sp|Q88434|L_PIV5	914	sp|Q9UN74|PCDA4_HUMAN Protocadherin alpha-4 OS=Homo sapiens OX=9606 GN=PCDHA4 PE=1 SV=1	222	LTGTVQLLITVL
PTLEVQLLITVL	sp|Q88434|L_PIV5	914	sp|Q9Y5H5|PCDA9_HUMAN Protocadherin alpha-9 OS=Homo sapiens OX=9606 GN=PCDHA9 PE=2 SV=1	222	LTGTVQLLITVL
PTLEVQLLITVL	sp|Q88434|L_PIV5	914	sp|Q9UN72|PCDA7_HUMAN Protocadherin alpha-7 OS=Homo sapiens OX=9606 GN=PCDHA7 PE=2 SV=1	222	LTGTVQLLITVL
DIQIPSLGIILI	sp|P04850|HN_PIV5	541	tr|G3V4J5|G3V4J5_HUMAN Calcium permeable stress-gated cation channel 1 (Fragment) OS=Homo sapiens OX=9606 GN=TMEM63C PE=1 SV=1	145	IICIPSLGIILP
DIQIPSLGIILI	sp|P04850|HN_PIV5	541	sp|Q9P1W3|CSC1_HUMAN Calcium permeable stress-gated cation channel 1 OS=Homo sapiens OX=9606 GN=TMEM63C PE=2 SV=1	145	IICIPSLGIILP
RNLLNEVSALNP	sp|Q88434|L_PIV5	1418	sp|Q70CQ2|UBP34_HUMAN Ubiquitin carboxyl-terminal hydrolase 34 OS=Homo sapiens OX=9606 GN=USP34 PE=1 SV=2	442	RHLLNLVSALEP
LAASGERSLETV	sp|Q88435|NCAP_PIV5	3	tr|E7EVY0|E7EVY0_HUMAN Mitochondrial inner membrane protein OXA1L OS=Homo sapiens OX=9606 GN=OXA1L PE=1 SV=1	56	LAASGPRSLSTS
LAASGERSLETV	sp|Q88435|NCAP_PIV5	3	tr|A0A087X0L7|A0A087X0L7_HUMAN Mitochondrial inner membrane protein OXA1L OS=Homo sapiens OX=9606 GN=OXA1L PE=1 SV=1	56	LAASGPRSLSTS
LAASGERSLETV	sp|Q88435|NCAP_PIV5	3	sp|Q15070|OXA1L_HUMAN Mitochondrial inner membrane protein OXA1L OS=Homo sapiens OX=9606 GN=OXA1L PE=1 SV=3	56	LAASGPRSLSTS
LAASGERSLETV	sp|Q88435|NCAP_PIV5	3	tr|J3KNA0|J3KNA0_HUMAN Mitochondrial inner membrane protein OXA1L OS=Homo sapiens OX=9606 GN=OXA1L PE=1 SV=1	116	LAASGPRSLSTS
LLHAIIALRSIA	sp|Q88434|L_PIV5	1358	tr|E5RGD8|E5RGD8_HUMAN Acyl-CoA 6-desaturase (Fragment) OS=Homo sapiens OX=9606 GN=FADS2 PE=1 SV=1	14	LLAHIIALESIA
LLHAIIALRSIA	sp|Q88434|L_PIV5	1358	tr|E5RGZ5|E5RGZ5_HUMAN Acyl-CoA 6-desaturase (Fragment) OS=Homo sapiens OX=9606 GN=FADS2 PE=1 SV=1	14	LLAHIIALESIA
LLHAIIALRSIA	sp|Q88434|L_PIV5	1358	sp|O95864|FADS2_HUMAN Acyl-CoA 6-desaturase OS=Homo sapiens OX=9606 GN=FADS2 PE=1 SV=1	136	LLAHIIALESIA
AAEAFLENALGP	sp|Q88435|NCAP_PIV5	106	tr|A0A140TA73|A0A140TA73_HUMAN Beta-2-syntrophin (Fragment) OS=Homo sapiens OX=9606 GN=SNTB2 PE=1 SV=1	54	AAAAELEPALGP
AAEAFLENALGP	sp|Q88435|NCAP_PIV5	106	sp|Q13425|SNTB2_HUMAN Beta-2-syntrophin OS=Homo sapiens OX=9606 GN=SNTB2 PE=1 SV=1	54	AAAAELEPALGP
VTSSLATKPSVS	sp|P04850|HN_PIV5	355	sp|Q8TAB3|PCD19_HUMAN Protocadherin-19 OS=Homo sapiens OX=9606 GN=PCDH19 PE=1 SV=3	1071	LKSSLPTKPSVS
LGAVALSIKSGL	sp|Q88434|L_PIV5	1055	sp|P08574|CY1_HUMAN Cytochrome c1, heme protein, mitochondrial OS=Homo sapiens OX=9606 GN=CYC1 PE=1 SV=3	42	PQAVALSSKSGL
EEVLAKNARKLK	sp|Q88434|L_PIV5	1401	sp|Q0IIM8|TBC8B_HUMAN TBC1 domain family member 8B OS=Homo sapiens OX=9606 GN=TBC1D8B PE=1 SV=2	6	EEVLLKNALKLW
EEVLAKNARKLK	sp|Q88434|L_PIV5	1401	tr|J3KN75|J3KN75_HUMAN TBC1 domain family member 8B OS=Homo sapiens OX=9606 GN=TBC1D8B PE=1 SV=1	6	EEVLLKNALKLW
EEVLAKNARKLK	sp|Q88434|L_PIV5	1401	tr|D6RFZ2|D6RFZ2_HUMAN TBC1 domain family member 8B OS=Homo sapiens OX=9606 GN=TBC1D8B PE=1 SV=1	6	EEVLLKNALKLW
EEVLAKNARKLK	sp|Q88434|L_PIV5	1401	sp|O95759|TBCD8_HUMAN TBC1 domain family member 8 OS=Homo sapiens OX=9606 GN=TBC1D8 PE=1 SV=3	6	EEVLLKNALKLW
EEVLAKNARKLK	sp|Q88434|L_PIV5	1401	tr|J3KQ40|J3KQ40_HUMAN TBC1 domain family member 8 OS=Homo sapiens OX=9606 GN=TBC1D8 PE=1 SV=1	6	EEVLLKNALKLW
SQNCHLLTEDDS	sp|P11208|PHOSP_PIV5	55	sp|Q8WZA1|PMGT1_HUMAN Protein O-linked-mannose beta-1,2-N-acetylglucosaminyltransferase 1 OS=Homo sapiens OX=9606 GN=POMGNT1 PE=1 SV=2	407	SQSIHLLEEDDS
ATLDLSSKNINE	sp|Q88434|L_PIV5	1757	tr|F8VYZ5|F8VYZ5_HUMAN Leucine-rich repeats and immunoglobulin-like domains protein 3 (Fragment) OS=Homo sapiens OX=9606 GN=LRIG3 PE=1 SV=1	55	ETLDLSSNNISE
ATLDLSSKNINE	sp|Q88434|L_PIV5	1757	tr|C9K080|C9K080_HUMAN Leucine-rich repeats and immunoglobulin-like domains protein 3 OS=Homo sapiens OX=9606 GN=LRIG3 PE=1 SV=2	148	ETLDLSSNNISE
ATLDLSSKNINE	sp|Q88434|L_PIV5	1757	sp|Q6UXM1|LRIG3_HUMAN Leucine-rich repeats and immunoglobulin-like domains protein 3 OS=Homo sapiens OX=9606 GN=LRIG3 PE=1 SV=1	148	ETLDLSSNNISE
SMGPLTAKEFIA	sp|Q88434|L_PIV5	609	sp|Q0VDD8|DYH14_HUMAN Dynein heavy chain 14, axonemal OS=Homo sapiens OX=9606 GN=DNAH14 PE=2 SV=3	705	SMGELTSKEFEA
QYLCLVSQTTNG	sp|P04850|HN_PIV5	513	tr|K7EPH4|K7EPH4_HUMAN Probable phospholipid-transporting ATPase IIB OS=Homo sapiens OX=9606 GN=ATP9B PE=1 SV=1	265	QCLCLCSETTNG
AINGADSRGDLK	sp|Q88434|L_PIV5	1583	sp|Q7Z6Z7|HUWE1_HUMAN E3 ubiquitin-protein ligase HUWE1 OS=Homo sapiens OX=9606 GN=HUWE1 PE=1 SV=3	2934	AISGADSRGILE
SYALLALCTTEA	sp|Q88435|NCAP_PIV5	448	sp|Q5JWF8|ACL10_HUMAN Actin-like protein 10 OS=Homo sapiens OX=9606 GN=ACTL10 PE=2 SV=1	3	STALLALCSTGA
LVKVLAKDKAIL	sp|P11208|PHOSP_PIV5	10	tr|E9PQU5|E9PQU5_HUMAN RNA-binding protein 25 (Fragment) OS=Homo sapiens OX=9606 GN=RBM25 PE=1 SV=1	158	LVKVDAKTKAQL
LVKVLAKDKAIL	sp|P11208|PHOSP_PIV5	10	sp|P49756|RBM25_HUMAN RNA-binding protein 25 OS=Homo sapiens OX=9606 GN=RBM25 PE=1 SV=3	158	LVKVDAKTKAQL
ERLLGFPAPTDK	sp|Q88435|NCAP_PIV5	174	sp|P50219|MNX1_HUMAN Motor neuron and pancreas homeobox protein 1 OS=Homo sapiens OX=9606 GN=MNX1 PE=1 SV=3	331	EELLGPPAPGDK
LSQSTRLSKWPL	sp|Q88434|L_PIV5	774	tr|H0Y3X7|H0Y3X7_HUMAN Probable ATP-dependent DNA helicase HFM1 (Fragment) OS=Homo sapiens OX=9606 GN=HFM1 PE=1 SV=1	512	LSSSTRGSKLPL
LSQSTRLSKWPL	sp|Q88434|L_PIV5	774	sp|A2PYH4|HFM1_HUMAN Probable ATP-dependent DNA helicase HFM1 OS=Homo sapiens OX=9606 GN=HFM1 PE=2 SV=2	1300	LSSSTRGSKLPL
LLTDALASTYKR	sp|Q88435|NCAP_PIV5	225	sp|Q5W0V3|F16B1_HUMAN Protein FAM160B1 OS=Homo sapiens OX=9606 GN=FAM160B1 PE=1 SV=1	308	LLTDRLASLYKA
LLIAWLVTTLIL	sp|P04849|FUS_PIV5	320	sp|Q96FB5|RRNAD_HUMAN Protein RRNAD1 OS=Homo sapiens OX=9606 GN=RRNAD1 PE=2 SV=2	414	LLLAPLVETLIL
LLIAWLVTTLIL	sp|P04849|FUS_PIV5	320	tr|A0A1B0GUX2|A0A1B0GUX2_HUMAN ATP-sensitive inward rectifier potassium channel 10 OS=Homo sapiens OX=9606 GN=KCNJ10 PE=1 SV=1	146	LLIAQLVLTTIL
LLIAWLVTTLIL	sp|P04849|FUS_PIV5	320	tr|A0A1W2PQC0|A0A1W2PQC0_HUMAN ATP-sensitive inward rectifier potassium channel 10 OS=Homo sapiens OX=9606 GN=KCNJ10 PE=1 SV=1	146	LLIAQLVLTTIL
LLIAWLVTTLIL	sp|P04849|FUS_PIV5	320	tr|A0A1W2PP51|A0A1W2PP51_HUMAN ATP-sensitive inward rectifier potassium channel 10 (Fragment) OS=Homo sapiens OX=9606 GN=KCNJ10 PE=1 SV=1	136	LLIAQLVLTTIL
LLIAWLVTTLIL	sp|P04849|FUS_PIV5	320	tr|A0A1W2PPI0|A0A1W2PPI0_HUMAN ATP-sensitive inward rectifier potassium channel 10 (Fragment) OS=Homo sapiens OX=9606 GN=KCNJ10 PE=1 SV=1	137	LLIAQLVLTTIL
LLIAWLVTTLIL	sp|P04849|FUS_PIV5	320	sp|P78508|KCJ10_HUMAN ATP-sensitive inward rectifier potassium channel 10 OS=Homo sapiens OX=9606 GN=KCNJ10 PE=1 SV=1	146	LLIAQLVLTTIL
LLIAWLVTTLIL	sp|P04849|FUS_PIV5	320	tr|A0A1W2PQP0|A0A1W2PQP0_HUMAN ATP-sensitive inward rectifier potassium channel 10 (Fragment) OS=Homo sapiens OX=9606 GN=KCNJ10 PE=1 SV=1	54	LLIAQLVLTTIL
ALLIAWLVTTLI	sp|P04849|FUS_PIV5	319	sp|Q96FB5|RRNAD_HUMAN Protein RRNAD1 OS=Homo sapiens OX=9606 GN=RRNAD1 PE=2 SV=2	413	ALLLAPLVETLI
KKIDELNKFVFF	sp|Q88434|L_PIV5	410	sp|Q86T29|ZN605_HUMAN Zinc finger protein 605 OS=Homo sapiens OX=9606 GN=ZNF605 PE=2 SV=1	118	KKIDELNKKLLF
SALDLASELGSA	sp|Q88434|L_PIV5	1482	tr|F6XZD3|F6XZD3_HUMAN Ankyrin repeat domain-containing protein 35 OS=Homo sapiens OX=9606 GN=ANKRD35 PE=1 SV=1	98	SALILACEKGSA
SALDLASELGSA	sp|Q88434|L_PIV5	1482	sp|Q8N283|ANR35_HUMAN Ankyrin repeat domain-containing protein 35 OS=Homo sapiens OX=9606 GN=ANKRD35 PE=2 SV=2	188	SALILACEKGSA
ALDLASELGSAL	sp|Q88434|L_PIV5	1483	tr|H9KV90|H9KV90_HUMAN SH3 and multiple ankyrin repeat domains protein 1 OS=Homo sapiens OX=9606 GN=SHANK1 PE=1 SV=1	1354	ALDPASPLGLAL
ALDLASELGSAL	sp|Q88434|L_PIV5	1483	sp|Q9Y566|SHAN1_HUMAN SH3 and multiple ankyrin repeat domains protein 1 OS=Homo sapiens OX=9606 GN=SHANK1 PE=1 SV=2	1346	ALDPASPLGLAL
ALDLASELGSAL	sp|Q88434|L_PIV5	1483	sp|Q9H977|WDR54_HUMAN WD repeat-containing protein 54 OS=Homo sapiens OX=9606 GN=WDR54 PE=1 SV=1	257	ALDLASEVGKLL
