query	query_seqname	query_start	target_seqname	target_start	target
IRNELASERELD	sp|F5HEN8|HELI_HCMVM	481	sp|Q9UBU9|NXF1_HUMAN Nuclear RNA export factor 1 OS=Homo sapiens OX=9606 GN=NXF1 PE=1 SV=1	299	SGNELKSERELD
PCAHAPGPGHGA	sp|Q6SW82|UL49_HCMVM	367	sp|Q14657|LAGE3_HUMAN EKC/KEOPS complex subunit LAGE3 OS=Homo sapiens OX=9606 GN=LAGE3 PE=1 SV=2	38	PPAHAPGPGRDA
AAHEEALFLQYR	sp|Q6SW82|UL49_HCMVM	423	tr|H0YA69|H0YA69_HUMAN Matrix metalloproteinase-23 (Fragment) OS=Homo sapiens OX=9606 GN=MMP23B PE=1 SV=1	177	AAHEEALPQQLR
AAHEEALFLQYR	sp|Q6SW82|UL49_HCMVM	423	tr|O75086|O75086_HUMAN MIFR-2 OS=Homo sapiens OX=9606 GN=MMP23B PE=1 SV=1	298	AAHEEALPQQLR
AAHEEALFLQYR	sp|Q6SW82|UL49_HCMVM	423	tr|H0YAE5|H0YAE5_HUMAN Matrix metalloproteinase-23 (Fragment) OS=Homo sapiens OX=9606 GN=MMP23B PE=1 SV=1	170	AAHEEALPQQLR
AAHEEALFLQYR	sp|Q6SW82|UL49_HCMVM	423	tr|H0Y6I4|H0Y6I4_HUMAN Matrix metalloproteinase-23 (Fragment) OS=Homo sapiens OX=9606 GN=MMP23B PE=1 SV=1	154	AAHEEALPQQLR
GLRPPDYEALPA	sp|Q6SW04|IRS1_HCMVM	41	sp|Q5JR59|MTUS2_HUMAN Microtubule-associated tumor suppressor candidate 2 OS=Homo sapiens OX=9606 GN=MTUS2 PE=1 SV=3	835	GLRPPGYSRLPA
LLTLAATLTPGS	sp|Q6SW05|UL150_HCMVM	238	sp|Q8TAE8|G45IP_HUMAN Growth arrest and DNA damage-inducible proteins-interacting protein 1 OS=Homo sapiens OX=9606 GN=GADD45GIP1 PE=1 SV=1	11	LLGVAATLAPGS
LQATGDPPELVR	sp|Q6SVX2|TRS1_HCMVM	514	sp|Q12836|ZP4_HUMAN Zona pellucida sperm-binding protein 4 OS=Homo sapiens OX=9606 GN=ZP4 PE=1 SV=1	488	LQATKDPPEKLR
FIADLLYQCFLP	sp|Q6SW92|UL40_HCMVM	68	sp|P46093|GPR4_HUMAN G-protein coupled receptor 4 OS=Homo sapiens OX=9606 GN=GPR4 PE=1 SV=2	60	SIADLLYICTLP
EPETEPVYPELV	sp|Q6SW81|NEC2_HCMVM	198	sp|O15446|RPA34_HUMAN DNA-directed RNA polymerase I subunit RPA34 OS=Homo sapiens OX=9606 GN=POLR1G PE=1 SV=1	398	EPETEVVGPELP
SLTHQLAPFDTP	sp|Q6SW67|GH_HCMVM	453	tr|A0A0G2JRT3|A0A0G2JRT3_HUMAN Leucine-rich repeat-containing protein 37A3 OS=Homo sapiens OX=9606 GN=LRRC37A3 PE=1 SV=1	512	SLTHQEAPAQTP
SLTHQLAPFDTP	sp|Q6SW67|GH_HCMVM	453	tr|A0A0G2JMZ2|A0A0G2JMZ2_HUMAN Leucine-rich repeat-containing protein 37A3 OS=Homo sapiens OX=9606 GN=LRRC37A3 PE=1 SV=1	512	SLTHQEAPAQTP
SLTHQLAPFDTP	sp|Q6SW67|GH_HCMVM	453	tr|A0A0G2JRB3|A0A0G2JRB3_HUMAN Leucine-rich repeat-containing protein 37A OS=Homo sapiens OX=9606 GN=LRRC37A PE=4 SV=1	512	SLTHQEAPAQTP
SLTHQLAPFDTP	sp|Q6SW67|GH_HCMVM	453	tr|A0A0G2JNC9|A0A0G2JNC9_HUMAN Leucine-rich repeat-containing protein 37A OS=Homo sapiens OX=9606 GN=LRRC37A PE=4 SV=1	512	SLTHQEAPAQTP
SLTHQLAPFDTP	sp|Q6SW67|GH_HCMVM	453	tr|A0A0G2JS48|A0A0G2JS48_HUMAN Leucine-rich repeat-containing protein 37A2 OS=Homo sapiens OX=9606 GN=LRRC37A2 PE=1 SV=1	512	SLTHQEAPAQTP
SLTHQLAPFDTP	sp|Q6SW67|GH_HCMVM	453	tr|A0A0G2JNP1|A0A0G2JNP1_HUMAN Leucine-rich repeat-containing protein 37A2 OS=Homo sapiens OX=9606 GN=LRRC37A2 PE=1 SV=1	512	SLTHQEAPAQTP
SLTHQLAPFDTP	sp|Q6SW67|GH_HCMVM	453	tr|A8MUI5|A8MUI5_HUMAN Leucine-rich repeat-containing protein 37A OS=Homo sapiens OX=9606 GN=LRRC37A PE=1 SV=2	512	SLTHQEAPAQTP
SLTHQLAPFDTP	sp|Q6SW67|GH_HCMVM	453	sp|A6NMS7|L37A1_HUMAN Leucine-rich repeat-containing protein 37A OS=Homo sapiens OX=9606 GN=LRRC37A PE=2 SV=3	512	SLTHQEAPAQTP
SLTHQLAPFDTP	sp|Q6SW67|GH_HCMVM	453	sp|A6NM11|L37A2_HUMAN Leucine-rich repeat-containing protein 37A2 OS=Homo sapiens OX=9606 GN=LRRC37A2 PE=2 SV=2	512	SLTHQEAPAQTP
SLTHQLAPFDTP	sp|Q6SW67|GH_HCMVM	453	sp|O60309|L37A3_HUMAN Leucine-rich repeat-containing protein 37A3 OS=Homo sapiens OX=9606 GN=LRRC37A3 PE=2 SV=2	512	SLTHQEAPAQTP
SLTHQLAPFDTP	sp|Q6SW67|GH_HCMVM	453	tr|A0A0J9YWT4|A0A0J9YWT4_HUMAN Leucine-rich repeat-containing protein 37A2 OS=Homo sapiens OX=9606 GN=LRRC37A2 PE=1 SV=1	512	SLTHQEAPAQTP
SLTHQLAPFDTP	sp|Q6SW67|GH_HCMVM	453	tr|A0A0J9YVP4|A0A0J9YVP4_HUMAN Leucine-rich repeat-containing protein 37A2 OS=Homo sapiens OX=9606 GN=LRRC37A2 PE=1 SV=1	512	SLTHQEAPAQTP
SLTHQLAPFDTP	sp|Q6SW67|GH_HCMVM	453	tr|A0A0G2JP19|A0A0G2JP19_HUMAN Leucine-rich repeat-containing protein 37A2 OS=Homo sapiens OX=9606 GN=LRRC37A2 PE=1 SV=1	512	SLTHQEAPAQTP
DTESAPPRREPL	sp|F5HCH8|GL_HCMVM	102	sp|O75526|RMXL2_HUMAN RNA-binding motif protein, X-linked-like-2 OS=Homo sapiens OX=9606 GN=RBMXL2 PE=1 SV=3	188	DGYSGPPRREPL
YRSVLLLERRFD	sp|F5HBR4|PORTL_HCMVM	467	sp|Q96QU6|1A1L1_HUMAN 1-aminocyclopropane-1-carboxylate synthase-like protein 1 OS=Homo sapiens OX=9606 GN=ACCS PE=1 SV=1	300	YRSVLSLERLPD
EAHAPGLLPFDA	sp|F5HIG1|HEPA_HCMVM	407	tr|A0A087WU70|A0A087WU70_HUMAN Carbohydrate sulfotransferase OS=Homo sapiens OX=9606 GN=CHST13 PE=1 SV=1	142	EAHAPGRLPSLA
EAHAPGLLPFDA	sp|F5HIG1|HEPA_HCMVM	407	sp|Q8NET6|CHSTD_HUMAN Carbohydrate sulfotransferase 13 OS=Homo sapiens OX=9606 GN=CHST13 PE=1 SV=1	142	EAHAPGRLPSLA
GENPVSAGGGSA	sp|Q6SW37|EP84_HCMVM	406	sp|Q9ULL5|PRR12_HUMAN Proline-rich protein 12 OS=Homo sapiens OX=9606 GN=PRR12 PE=1 SV=3	1680	AKNPVSAGGSSA
GENPVSAGGGSA	sp|Q6SW37|EP84_HCMVM	406	tr|A0A3Q5ADB5|A0A3Q5ADB5_HUMAN Proline-rich protein 12 OS=Homo sapiens OX=9606 GN=PRR12 PE=1 SV=1	859	AKNPVSAGGSSA
ALLPVQVPLPRV	sp|F5HG95|US29_HCMVM	53	tr|F8VS58|F8VS58_HUMAN 60S acidic ribosomal protein P0 (Fragment) OS=Homo sapiens OX=9606 GN=RPLP0 PE=1 SV=1	106	KLLPVLVPLPHV
LGDVLDAESLLD	sp|Q6SW65|CVC2_HCMVM	326	tr|H7C4R5|H7C4R5_HUMAN FAST kinase domain-containing protein 4 (Fragment) OS=Homo sapiens OX=9606 GN=TBRG4 PE=1 SV=1	233	YGWVLDAEVLLD
LGDVLDAESLLD	sp|Q6SW65|CVC2_HCMVM	326	sp|Q969Z0|FAKD4_HUMAN FAST kinase domain-containing protein 4 OS=Homo sapiens OX=9606 GN=TBRG4 PE=1 SV=1	518	YGWVLDAEVLLD
LPVRTLVTDYND	sp|F5HG95|US29_HCMVM	104	tr|A0A1W2PPB7|A0A1W2PPB7_HUMAN Kinase D-interacting substrate of 220 kDa OS=Homo sapiens OX=9606 GN=KIDINS220 PE=1 SV=1	593	LPVRFLFTDYNR
LPVRTLVTDYND	sp|F5HG95|US29_HCMVM	104	tr|H0Y8E4|H0Y8E4_HUMAN Kinase D-interacting substrate of 220 kDa (Fragment) OS=Homo sapiens OX=9606 GN=KIDINS220 PE=1 SV=1	340	LPVRFLFTDYNR
LPVRTLVTDYND	sp|F5HG95|US29_HCMVM	104	tr|E9PH70|E9PH70_HUMAN Kinase D-interacting substrate of 220 kDa (Fragment) OS=Homo sapiens OX=9606 GN=KIDINS220 PE=1 SV=1	594	LPVRFLFTDYNR
LPVRTLVTDYND	sp|F5HG95|US29_HCMVM	104	sp|Q9ULH0|KDIS_HUMAN Kinase D-interacting substrate of 220 kDa OS=Homo sapiens OX=9606 GN=KIDINS220 PE=1 SV=3	593	LPVRFLFTDYNR
SSTGEAVREASQ	sp|Q6SW85|ITP_HCMVM	414	tr|F5H395|F5H395_HUMAN Kv channel-interacting protein 4 OS=Homo sapiens OX=9606 GN=KCNIP4 PE=4 SV=1	17	SSTGEAVIEHSL
PRRPVPRDDLKS	sp|Q6SW73|ICP27_HCMVM	38	tr|Q0P5T2|Q0P5T2_HUMAN C6orf136 protein (Fragment) OS=Homo sapiens OX=9606 GN=C6orf136 PE=1 SV=1	56	PRLPVPRGDLKG
PRRPVPRDDLKS	sp|Q6SW73|ICP27_HCMVM	38	tr|A0A140T9G8|A0A140T9G8_HUMAN Uncharacterized protein C6orf136 (Fragment) OS=Homo sapiens OX=9606 GN=C6orf136 PE=1 SV=1	56	PRLPVPRGDLKG
ALGAPLLLGLSV	sp|F5HCH8|GL_HCMVM	165	sp|Q9NRU3|CNNM1_HUMAN Metal transporter CNNM1 OS=Homo sapiens OX=9606 GN=CNNM1 PE=1 SV=3	226	ALGALLLLALSA
LVSSLAGLLLLV	sp|F5HDQ6|DNBI_HCMVM	1152	tr|F8WBM7|F8WBM7_HUMAN Coagulation factor X OS=Homo sapiens OX=9606 GN=F10 PE=1 SV=1	10	LSASLAGLLLLG
LVSSLAGLLLLV	sp|F5HDQ6|DNBI_HCMVM	1152	tr|Q5JVE8|Q5JVE8_HUMAN Coagulation factor X OS=Homo sapiens OX=9606 GN=F10 PE=1 SV=1	10	LSASLAGLLLLG
LVSSLAGLLLLV	sp|F5HDQ6|DNBI_HCMVM	1152	tr|B7ZBK1|B7ZBK1_HUMAN Coagulation factor X OS=Homo sapiens OX=9606 GN=F10 PE=1 SV=1	10	LSASLAGLLLLG
LVSSLAGLLLLV	sp|F5HDQ6|DNBI_HCMVM	1152	sp|P00742|FA10_HUMAN Coagulation factor X OS=Homo sapiens OX=9606 GN=F10 PE=1 SV=2	10	LSASLAGLLLLG
LVSSLAGLLLLV	sp|F5HDQ6|DNBI_HCMVM	1152	tr|F8VWQ2|F8VWQ2_HUMAN Protein OS-9 OS=Homo sapiens OX=9606 GN=OS9 PE=4 SV=1	6	LLSSLLGLLLLG
LVSSLAGLLLLV	sp|F5HDQ6|DNBI_HCMVM	1152	tr|F8W0R2|F8W0R2_HUMAN Protein OS-9 OS=Homo sapiens OX=9606 GN=OS9 PE=1 SV=1	6	LLSSLLGLLLLG
LVSSLAGLLLLV	sp|F5HDQ6|DNBI_HCMVM	1152	tr|B4E321|B4E321_HUMAN Protein OS-9 OS=Homo sapiens OX=9606 GN=OS9 PE=1 SV=1	6	LLSSLLGLLLLG
LVSSLAGLLLLV	sp|F5HDQ6|DNBI_HCMVM	1152	sp|Q13438|OS9_HUMAN Protein OS-9 OS=Homo sapiens OX=9606 GN=OS9 PE=1 SV=1	6	LLSSLLGLLLLG
LVSSLAGLLLLV	sp|F5HDQ6|DNBI_HCMVM	1152	tr|F8W1N0|F8W1N0_HUMAN Protein OS-9 OS=Homo sapiens OX=9606 GN=OS9 PE=1 SV=1	6	LLSSLLGLLLLG
LVSSLAGLLLLV	sp|F5HDQ6|DNBI_HCMVM	1152	tr|F8W1V2|F8W1V2_HUMAN Protein OS-9 (Fragment) OS=Homo sapiens OX=9606 GN=OS9 PE=1 SV=1	6	LLSSLLGLLLLG
LVSSLAGLLLLV	sp|F5HDQ6|DNBI_HCMVM	1152	tr|F8VZI7|F8VZI7_HUMAN Protein OS-9 (Fragment) OS=Homo sapiens OX=9606 GN=OS9 PE=1 SV=1	6	LLSSLLGLLLLG
LVSSLAGLLLLV	sp|F5HDQ6|DNBI_HCMVM	1152	sp|Q9UHG3|PCYOX_HUMAN Prenylcysteine oxidase 1 OS=Homo sapiens OX=9606 GN=PCYOX1 PE=1 SV=3	8	LVSSLLGLWLLL
LVSSLAGLLLLV	sp|F5HDQ6|DNBI_HCMVM	1152	tr|F8W8W4|F8W8W4_HUMAN Prenylcysteine oxidase 1 OS=Homo sapiens OX=9606 GN=PCYOX1 PE=1 SV=1	8	LVSSLLGLWLLL
GQALLLILEDHT	sp|F5HC97|VPAP_HCMVM	386	tr|H7C528|H7C528_HUMAN Polyhomeotic-like protein 3 (Fragment) OS=Homo sapiens OX=9606 GN=PHC3 PE=1 SV=1	126	GQALLLLKEDHL
GQALLLILEDHT	sp|F5HC97|VPAP_HCMVM	386	sp|Q8NDX5|PHC3_HUMAN Polyhomeotic-like protein 3 OS=Homo sapiens OX=9606 GN=PHC3 PE=1 SV=1	948	GQALLLLKEDHL
GQALLLILEDHT	sp|F5HC97|VPAP_HCMVM	386	sp|Q8IXK0|PHC2_HUMAN Polyhomeotic-like protein 2 OS=Homo sapiens OX=9606 GN=PHC2 PE=1 SV=1	823	GQALLLLKEDHL
GQALLLILEDHT	sp|F5HC97|VPAP_HCMVM	386	tr|B3KPJ4|B3KPJ4_HUMAN Polyhomeotic-like protein 2 OS=Homo sapiens OX=9606 GN=PHC2 PE=1 SV=1	429	GQALLLLKEDHL
GQALLLILEDHT	sp|F5HC97|VPAP_HCMVM	386	tr|A0A0A0MSI2|A0A0A0MSI2_HUMAN Polyhomeotic-like protein 2 OS=Homo sapiens OX=9606 GN=PHC2 PE=1 SV=1	795	GQALLLLKEDHL
SVNLMTITADLY	sp|F5HCU8|TRM3_HCMVM	235	sp|Q8IXU6|S35F2_HUMAN Solute carrier family 35 member F2 OS=Homo sapiens OX=9606 GN=SLC35F2 PE=1 SV=1	290	SVNLGILTADLY
SVNLMTITADLY	sp|F5HCU8|TRM3_HCMVM	235	sp|Q5T1Q4|S35F1_HUMAN Solute carrier family 35 member F1 OS=Homo sapiens OX=9606 GN=SLC35F1 PE=1 SV=2	311	SVNLSLLTADLY
VPVPARLCSSPT	sp|F5HEN8|HELI_HCMVM	46	tr|A0A3B3IUD2|A0A3B3IUD2_HUMAN Protein misato homolog 1 OS=Homo sapiens OX=9606 GN=MSTO1 PE=1 SV=1	340	VTVPYRLCSSPV
VPVPARLCSSPT	sp|F5HEN8|HELI_HCMVM	46	sp|Q9BUK6|MSTO1_HUMAN Protein misato homolog 1 OS=Homo sapiens OX=9606 GN=MSTO1 PE=1 SV=1	340	VTVPYRLCSSPV
DWYGWKLSYTTE	sp|F5HD27|UL121_HCMVM	16	tr|F5H2D0|F5H2D0_HUMAN Complement subcomponent C1r OS=Homo sapiens OX=9606 GN=C1R PE=1 SV=3	260	DSRGWKLRYTTE
DWYGWKLSYTTE	sp|F5HD27|UL121_HCMVM	16	tr|B4DPQ0|B4DPQ0_HUMAN Complement subcomponent C1r OS=Homo sapiens OX=9606 GN=C1R PE=1 SV=1	308	DSRGWKLRYTTE
DWYGWKLSYTTE	sp|F5HD27|UL121_HCMVM	16	sp|P00736|C1R_HUMAN Complement C1r subcomponent OS=Homo sapiens OX=9606 GN=C1R PE=1 SV=2	294	DSRGWKLRYTTE
DWYGWKLSYTTE	sp|F5HD27|UL121_HCMVM	16	tr|A0A3B3ISR2|A0A3B3ISR2_HUMAN Complement subcomponent C1r OS=Homo sapiens OX=9606 GN=C1R PE=1 SV=1	294	DSRGWKLRYTTE
PSETGRRRLRLK	sp|F5HGJ4|PP85_HCMVM	327	tr|A0A0C4DGW7|A0A0C4DGW7_HUMAN Protein FAM47A OS=Homo sapiens OX=9606 GN=FAM47A PE=1 SV=1	354	PSETGVSRLRLA
PSETGRRRLRLK	sp|F5HGJ4|PP85_HCMVM	327	sp|Q5JRC9|FA47A_HUMAN Protein FAM47A OS=Homo sapiens OX=9606 GN=FAM47A PE=2 SV=3	354	PSETGVSRLRLA
TGVEVLRFLLMG	sp|F5HEN8|HELI_HCMVM	429	sp|Q9Y330|ZBT12_HUMAN Zinc finger and BTB domain-containing protein 12 OS=Homo sapiens OX=9606 GN=ZBTB12 PE=1 SV=1	3	SGVEVLRFQLPG
LVSLLCYCSGLA	sp|F5HHT6|US21_HCMVM	75	sp|Q15465|SHH_HUMAN Sonic hedgehog protein OS=Homo sapiens OX=9606 GN=SHH PE=1 SV=1	12	LVSSLLVCSGLA
VATPLPTASTPT	sp|F5HHQ0|GN_HCMVM	123	tr|A0A2R8Y5S6|A0A2R8Y5S6_HUMAN Connector enhancer of kinase suppressor of ras 2 OS=Homo sapiens OX=9606 GN=CNKSR2 PE=1 SV=1	281	VATPSSTISTPT
VATPLPTASTPT	sp|F5HHQ0|GN_HCMVM	123	tr|A0A2R8YE27|A0A2R8YE27_HUMAN Connector enhancer of kinase suppressor of ras 2 OS=Homo sapiens OX=9606 GN=CNKSR2 PE=1 SV=1	53	VATPSSTISTPT
VATPLPTASTPT	sp|F5HHQ0|GN_HCMVM	123	tr|A0A2U3TZH5|A0A2U3TZH5_HUMAN Connector enhancer of kinase suppressor of ras 2 OS=Homo sapiens OX=9606 GN=CNKSR2 PE=1 SV=1	330	VATPSSTISTPT
VATPLPTASTPT	sp|F5HHQ0|GN_HCMVM	123	tr|A0A2R8Y622|A0A2R8Y622_HUMAN Connector enhancer of kinase suppressor of ras 2 OS=Homo sapiens OX=9606 GN=CNKSR2 PE=1 SV=1	281	VATPSSTISTPT
VATPLPTASTPT	sp|F5HHQ0|GN_HCMVM	123	tr|A0A2R8YE71|A0A2R8YE71_HUMAN Connector enhancer of kinase suppressor of ras 2 (Fragment) OS=Homo sapiens OX=9606 GN=CNKSR2 PE=1 SV=1	78	VATPSSTISTPT
VATPLPTASTPT	sp|F5HHQ0|GN_HCMVM	123	tr|A0A2R8Y700|A0A2R8Y700_HUMAN Connector enhancer of kinase suppressor of ras 2 OS=Homo sapiens OX=9606 GN=CNKSR2 PE=1 SV=1	281	VATPSSTISTPT
VATPLPTASTPT	sp|F5HHQ0|GN_HCMVM	123	tr|A0A2R8Y7K8|A0A2R8Y7K8_HUMAN Connector enhancer of kinase suppressor of ras 2 OS=Homo sapiens OX=9606 GN=CNKSR2 PE=1 SV=1	281	VATPSSTISTPT
VATPLPTASTPT	sp|F5HHQ0|GN_HCMVM	123	tr|A0A2R8YGJ7|A0A2R8YGJ7_HUMAN Connector enhancer of kinase suppressor of ras 2 OS=Homo sapiens OX=9606 GN=CNKSR2 PE=1 SV=1	281	VATPSSTISTPT
VATPLPTASTPT	sp|F5HHQ0|GN_HCMVM	123	sp|Q8WXI2|CNKR2_HUMAN Connector enhancer of kinase suppressor of ras 2 OS=Homo sapiens OX=9606 GN=CNKSR2 PE=1 SV=1	330	VATPSSTISTPT
VATPLPTASTPT	sp|F5HHQ0|GN_HCMVM	123	tr|A0A2R8Y7A1|A0A2R8Y7A1_HUMAN Connector enhancer of kinase suppressor of ras 2 OS=Homo sapiens OX=9606 GN=CNKSR2 PE=1 SV=1	281	VATPSSTISTPT
VATPLPTASTPT	sp|F5HHQ0|GN_HCMVM	123	tr|A0A2R8YED7|A0A2R8YED7_HUMAN Connector enhancer of kinase suppressor of ras 2 OS=Homo sapiens OX=9606 GN=CNKSR2 PE=1 SV=1	281	VATPSSTISTPT
SGLALGAPLLLG	sp|F5HCH8|GL_HCMVM	162	sp|P21709|EPHA1_HUMAN Ephrin type-A receptor 1 OS=Homo sapiens OX=9606 GN=EPHA1 PE=1 SV=4	553	FGLLLGAALLLG
SGLALGAPLLLG	sp|F5HCH8|GL_HCMVM	162	sp|O94826|TOM70_HUMAN Mitochondrial import receptor subunit TOM70 OS=Homo sapiens OX=9606 GN=TOMM70 PE=1 SV=1	41	LALAVGAPLLLG
PPALMRVLELER	sp|F5HC79|TRM1_HCMVM	316	sp|Q8IZJ1|UNC5B_HUMAN Netrin receptor UNC5B OS=Homo sapiens OX=9606 GN=UNC5B PE=1 SV=2	721	PVALKEVLELER
DRGSGLVAAQDQ	sp|F5HGG3|UL26_HCMVM	63	tr|F5GYD2|F5GYD2_HUMAN Arginine/serine-rich coiled-coil protein 2 (Fragment) OS=Homo sapiens OX=9606 GN=RSRC2 PE=4 SV=1	67	NGGSGLVPAQDQ
PLLGPELLVLAT	sp|F5HFA5|UL117_HCMVM	19	sp|Q12767|TMM94_HUMAN Transmembrane protein 94 OS=Homo sapiens OX=9606 GN=TMEM94 PE=1 SV=1	327	PLLFPVLWVLAT
LLDWGGLGLLSV	sp|Q6SW65|CVC2_HCMVM	335	sp|Q9BVI0|PHF20_HUMAN PHD finger protein 20 OS=Homo sapiens OX=9606 GN=PHF20 PE=1 SV=2	923	LLDRGGEGLLSS
WKVCGRYLQGQL	sp|F5HC33|US09_HCMVM	38	sp|Q0D2K2|KLH30_HUMAN Kelch-like protein 30 OS=Homo sapiens OX=9606 GN=KLHL30 PE=2 SV=3	119	QKVCGRYLQQQL
SLAIARDQLLFE	sp|F5HBC6|PP71_HCMVM	80	tr|A0A140TA25|A0A140TA25_HUMAN Unconventional myosin-Ih OS=Homo sapiens OX=9606 GN=MYO1H PE=1 SV=1	147	SLQIARDRLLFS
SLAIARDQLLFE	sp|F5HBC6|PP71_HCMVM	80	sp|Q8N1T3|MYO1H_HUMAN Unconventional myosin-Ih OS=Homo sapiens OX=9606 GN=MYO1H PE=1 SV=2	131	SLQIARDRLLFS
QQWYRRSLAESG	sp|F5HG98|UL38_HCMVM	181	tr|F8WBK6|F8WBK6_HUMAN Beta-glucuronidase OS=Homo sapiens OX=9606 GN=GUSB PE=1 SV=1	61	EQWYRRPLWESG
QQWYRRSLAESG	sp|F5HG98|UL38_HCMVM	181	tr|F2Z3L6|F2Z3L6_HUMAN Beta-glucuronidase OS=Homo sapiens OX=9606 GN=GUSB PE=1 SV=1	61	EQWYRRPLWESG
QQWYRRSLAESG	sp|F5HG98|UL38_HCMVM	181	sp|P08236|BGLR_HUMAN Beta-glucuronidase OS=Homo sapiens OX=9606 GN=GUSB PE=1 SV=2	61	EQWYRRPLWESG
LTHQLAPFDTPR	sp|Q6SW67|GH_HCMVM	454	tr|A0A2R8YDT1|A0A2R8YDT1_HUMAN Glutamine synthetase OS=Homo sapiens OX=9606 GN=GLUL PE=1 SV=1	65	LTHQPACSDTPR
RRALRQERQIEV	sp|F5HBR4|PORTL_HCMVM	662	tr|A0A2R8Y4D7|A0A2R8Y4D7_HUMAN Rho guanine nucleotide exchange factor 17 OS=Homo sapiens OX=9606 GN=ARHGEF17 PE=1 SV=1	267	RRFLRQEMVIEV
RRALRQERQIEV	sp|F5HBR4|PORTL_HCMVM	662	sp|Q96PE2|ARHGH_HUMAN Rho guanine nucleotide exchange factor 17 OS=Homo sapiens OX=9606 GN=ARHGEF17 PE=1 SV=1	1286	RRFLRQEMVIEV
PGELRSPEAGDN	sp|Q6SWD5|IR01_HCMVM	30	tr|A0A0A0MQW5|A0A0A0MQW5_HUMAN Serine/threonine-protein kinase LMTK3 OS=Homo sapiens OX=9606 GN=LMTK3 PE=1 SV=1	1005	NGELRSPEAGEK
PGELRSPEAGDN	sp|Q6SWD5|IR01_HCMVM	30	tr|A0A3B3ISL5|A0A3B3ISL5_HUMAN Serine/threonine-protein kinase LMTK3 OS=Homo sapiens OX=9606 GN=LMTK3 PE=1 SV=1	1002	NGELRSPEAGEK
PGELRSPEAGDN	sp|Q6SWD5|IR01_HCMVM	30	sp|Q96Q04|LMTK3_HUMAN Serine/threonine-protein kinase LMTK3 OS=Homo sapiens OX=9606 GN=LMTK3 PE=1 SV=2	976	NGELRSPEAGEK
PGELRSPEAGDN	sp|Q6SWD5|IR01_HCMVM	30	tr|A0A5F9ZH67|A0A5F9ZH67_HUMAN Serine/threonine-protein kinase LMTK3 OS=Homo sapiens OX=9606 GN=LMTK3 PE=1 SV=1	731	NGELRSPEAGEK
KQSPYKAPRRPV	sp|Q6SW73|ICP27_HCMVM	31	sp|Q92611|EDEM1_HUMAN ER degradation-enhancing alpha-mannosidase-like protein 1 OS=Homo sapiens OX=9606 GN=EDEM1 PE=1 SV=1	80	AQSPRKAPRRPG
SPIKTVPFGGQP	sp|Q6SWC0|UL10_HCMVM	17	sp|Q8IZ40|RCOR2_HUMAN REST corepressor 2 OS=Homo sapiens OX=9606 GN=RCOR2 PE=1 SV=2	18	SRAKTVPNGGQP
DGPPALGCGLAR	sp|F5HDQ6|DNBI_HCMVM	1013	sp|Q8TE76|MORC4_HUMAN MORC family CW-type zinc finger protein 4 OS=Homo sapiens OX=9606 GN=MORC4 PE=1 SV=2	9	AGPGAPGCGLAR
RSRCASSTTQTG	sp|Q6SW99|PP150_HCMVM	269	tr|D6RBK6|D6RBK6_HUMAN Type-1 angiotensin II receptor-associated protein OS=Homo sapiens OX=9606 GN=AGTRAP PE=1 SV=1	65	RSPAASSTTCTG
LRLEERTRRVPA	sp|F5H9F9|UL88_HCMVM	230	tr|A0A1B0GUE0|A0A1B0GUE0_HUMAN Janus kinase and microtubule-interacting protein 1 OS=Homo sapiens OX=9606 GN=JAKMIP1 PE=1 SV=1	167	LELEERERRSPA
QRFQHLPFLGVS	sp|Q6SW37|EP84_HCMVM	224	sp|Q8TCJ2|STT3B_HUMAN Dolichyl-diphosphooligosaccharide--protein glycosyltransferase subunit STT3B OS=Homo sapiens OX=9606 GN=STT3B PE=1 SV=1	347	QEFQTLFFLGVS
VFGGGFGARVLG	sp|F5HDQ6|DNBI_HCMVM	1179	sp|P19012|K1C15_HUMAN Keratin, type I cytoskeletal 15 OS=Homo sapiens OX=9606 GN=KRT15 PE=1 SV=3	76	VFGGGFGGGVGG
RLFAAMNLLQRA	sp|F5H9N4|VP22_HCMVM	72	tr|V9GYV7|V9GYV7_HUMAN ATP-dependent 6-phosphofructokinase, platelet type (Fragment) OS=Homo sapiens OX=9606 GN=PFKP PE=1 SV=1	69	RLKAACNLLQRG
RLFAAMNLLQRA	sp|F5H9N4|VP22_HCMVM	72	tr|Q5VSR5|Q5VSR5_HUMAN ATP-dependent 6-phosphofructokinase, platelet type (Fragment) OS=Homo sapiens OX=9606 GN=PFKP PE=1 SV=1	69	RLKAACNLLQRG
RLFAAMNLLQRA	sp|F5H9N4|VP22_HCMVM	72	sp|Q01813|PFKAP_HUMAN ATP-dependent 6-phosphofructokinase, platelet type OS=Homo sapiens OX=9606 GN=PFKP PE=1 SV=2	107	RLKAACNLLQRG
VQADRTMKFHER	sp|Q6SW73|ICP27_HCMVM	301	tr|B4DSF6|B4DSF6_HUMAN Voltage-dependent calcium channel subunit alpha-2/delta-3 OS=Homo sapiens OX=9606 GN=CACNA2D3 PE=1 SV=1	219	VQADRTNKEHFR
VQADRTMKFHER	sp|Q6SW73|ICP27_HCMVM	301	sp|Q8IZS8|CA2D3_HUMAN Voltage-dependent calcium channel subunit alpha-2/delta-3 OS=Homo sapiens OX=9606 GN=CACNA2D3 PE=1 SV=1	313	VQADRTNKEHFR
PVAAPTPEWQPG	sp|F5HE44|US12_HCMVM	50	tr|H0YAN4|H0YAN4_HUMAN La-related protein 1 (Fragment) OS=Homo sapiens OX=9606 GN=LARP1 PE=1 SV=1	60	PVAPPTPAWQPE
PVAAPTPEWQPG	sp|F5HE44|US12_HCMVM	50	tr|E5RH50|E5RH50_HUMAN La-related protein 1 (Fragment) OS=Homo sapiens OX=9606 GN=LARP1 PE=1 SV=8	93	PVAPPTPAWQPE
PVAAPTPEWQPG	sp|F5HE44|US12_HCMVM	50	tr|A0A0B4J210|A0A0B4J210_HUMAN La-related protein 1 (Fragment) OS=Homo sapiens OX=9606 GN=LARP1 PE=1 SV=5	298	PVAPPTPAWQPE
PVAAPTPEWQPG	sp|F5HE44|US12_HCMVM	50	sp|Q6PKG0|LARP1_HUMAN La-related protein 1 OS=Homo sapiens OX=9606 GN=LARP1 PE=1 SV=2	298	PVAPPTPAWQPE
SALRLVAFHPLP	sp|Q6SW84|LTP_HCMVM	1390	tr|J3QR88|J3QR88_HUMAN Pyrroline-5-carboxylate reductase 1, mitochondrial (Fragment) OS=Homo sapiens OX=9606 GN=PYCR1 PE=1 SV=1	43	SALRLSAFRPAP
VAEFKVSQLSFN	sp|F5HEN8|HELI_HCMVM	123	sp|A0A0A6YYJ7|TVA83_HUMAN T cell receptor alpha variable 8-3 OS=Homo sapiens OX=9606 GN=TRAV8-3 PE=3 SV=5	83	EAEFKRSQSSFN
RVRLVRFFGLWH	sp|Q6SW65|CVC2_HCMVM	259	tr|A0A075B6T1|A0A075B6T1_HUMAN Activating molecule in BECN1-regulated autophagy protein 1 OS=Homo sapiens OX=9606 GN=AMBRA1 PE=1 SV=1	182	RVRLVRFDPLGH
RVRLVRFFGLWH	sp|Q6SW65|CVC2_HCMVM	259	sp|Q9C0C7|AMRA1_HUMAN Activating molecule in BECN1-regulated autophagy protein 1 OS=Homo sapiens OX=9606 GN=AMBRA1 PE=1 SV=2	182	RVRLVRFDPLGH
SSRGSEKAASSQ	sp|Q6SW62|SCAF_HCMVM	472	sp|Q92545|TM131_HUMAN Transmembrane protein 131 OS=Homo sapiens OX=9606 GN=TMEM131 PE=1 SV=3	1244	SSRTSAQAASSQ
LGELHVPQPAEM	sp|Q6SW67|GH_HCMVM	279	tr|A0A0G2JIA5|A0A0G2JIA5_HUMAN Valyl-tRNA synthetase OS=Homo sapiens OX=9606 GN=VARS2 PE=1 SV=1	760	LGEKFVPQPAEE
LGELHVPQPAEM	sp|Q6SW67|GH_HCMVM	279	tr|A0A140TA36|A0A140TA36_HUMAN Valyl-tRNA synthetase OS=Homo sapiens OX=9606 GN=VARS2 PE=1 SV=1	790	LGEKFVPQPAEE
LGELHVPQPAEM	sp|Q6SW67|GH_HCMVM	279	tr|A0A140TA45|A0A140TA45_HUMAN Valyl-tRNA synthetase OS=Homo sapiens OX=9606 GN=VARS2 PE=1 SV=1	758	LGEKFVPQPAEE
LGELHVPQPAEM	sp|Q6SW67|GH_HCMVM	279	tr|A0A140TA35|A0A140TA35_HUMAN Valyl-tRNA synthetase OS=Homo sapiens OX=9606 GN=VARS2 PE=1 SV=1	790	LGEKFVPQPAEE
LGELHVPQPAEM	sp|Q6SW67|GH_HCMVM	279	tr|A0A140TA40|A0A140TA40_HUMAN Valyl-tRNA synthetase OS=Homo sapiens OX=9606 GN=VARS2 PE=1 SV=1	758	LGEKFVPQPAEE
LGELHVPQPAEM	sp|Q6SW67|GH_HCMVM	279	tr|A0A140T8Y0|A0A140T8Y0_HUMAN Valyl-tRNA synthetase OS=Homo sapiens OX=9606 GN=VARS2 PE=1 SV=1	760	LGEKFVPQPAEE
LGELHVPQPAEM	sp|Q6SW67|GH_HCMVM	279	tr|A0A0A0MTG1|A0A0A0MTG1_HUMAN Valyl-tRNA synthetase OS=Homo sapiens OX=9606 GN=VARS2 PE=1 SV=1	758	LGEKFVPQPAEE
LGELHVPQPAEM	sp|Q6SW67|GH_HCMVM	279	sp|Q5ST30|SYVM_HUMAN Valine--tRNA ligase, mitochondrial OS=Homo sapiens OX=9606 GN=VARS2 PE=1 SV=2	760	LGEKFVPQPAEE
LGELHVPQPAEM	sp|Q6SW67|GH_HCMVM	279	tr|B7ZL25|B7ZL25_HUMAN Valyl-tRNA synthetase OS=Homo sapiens OX=9606 GN=VARS2 PE=1 SV=1	758	LGEKFVPQPAEE
LGELHVPQPAEM	sp|Q6SW67|GH_HCMVM	279	tr|A0A0G2JL52|A0A0G2JL52_HUMAN Valyl-tRNA synthetase OS=Homo sapiens OX=9606 GN=VARS2 PE=1 SV=1	790	LGEKFVPQPAEE
LGELHVPQPAEM	sp|Q6SW67|GH_HCMVM	279	tr|B4E0K6|B4E0K6_HUMAN Valyl-tRNA synthetase OS=Homo sapiens OX=9606 GN=VARS2 PE=1 SV=1	760	LGEKFVPQPAEE
LCLKCSENKKMT	sp|F5HI32|IR10_HCMVM	24	sp|Q9H8H0|NOL11_HUMAN Nucleolar protein 11 OS=Homo sapiens OX=9606 GN=NOL11 PE=1 SV=1	623	LYLKCSENATMT
LSLYLTCSRTPL	sp|Q6SW55|UL87_HCMVM	604	tr|F8WCW8|F8WCW8_HUMAN Nostrin OS=Homo sapiens OX=9606 GN=NOSTRIN PE=1 SV=1	58	CSLRLLCSRTPL
RLVEQQEEEMKT	sp|F5HEA3|TEG7_HCMVM	334	sp|P35579|MYH9_HUMAN Myosin-9 OS=Homo sapiens OX=9606 GN=MYH9 PE=1 SV=4	1528	RALEQQVEEMKT
RESFLRRENLRL	sp|F5HA06|UL147_HCMVM	32	tr|A0A590UJE1|A0A590UJE1_HUMAN Misshapen-like kinase 1 (Fragment) OS=Homo sapiens OX=9606 GN=MINK1 PE=1 SV=1	342	GESTLRREFLRL
RESFLRRENLRL	sp|F5HA06|UL147_HCMVM	32	tr|I3L2I2|I3L2I2_HUMAN Misshapen-like kinase 1 (Fragment) OS=Homo sapiens OX=9606 GN=MINK1 PE=1 SV=1	210	GESTLRREFLRL
RESFLRRENLRL	sp|F5HA06|UL147_HCMVM	32	sp|Q8N4C8|MINK1_HUMAN Misshapen-like kinase 1 OS=Homo sapiens OX=9606 GN=MINK1 PE=1 SV=2	347	GESTLRREFLRL
ILCTVSVPSFTL	sp|F5HB53|GB_HCMVM	853	sp|P01718|LV327_HUMAN Immunoglobulin lambda variable 3-27 OS=Homo sapiens OX=9606 GN=IGLV3-27 PE=1 SV=2	12	ILCTVSVASYEL
GTDHHFGFLLNT	sp|F5HAM0|UL144_HCMVM	34	sp|Q13275|SEM3F_HUMAN Semaphorin-3F OS=Homo sapiens OX=9606 GN=SEMA3F PE=2 SV=2	43	GTAHFFNFLLNT
GTDHHFGFLLNT	sp|F5HAM0|UL144_HCMVM	34	tr|C9J1V2|C9J1V2_HUMAN Semaphorin-3F (Fragment) OS=Homo sapiens OX=9606 GN=SEMA3F PE=1 SV=1	43	GTAHFFNFLLNT
GTDHHFGFLLNT	sp|F5HAM0|UL144_HCMVM	34	tr|C9J4H5|C9J4H5_HUMAN Semaphorin-3F (Fragment) OS=Homo sapiens OX=9606 GN=SEMA3F PE=1 SV=8	43	GTAHFFNFLLNT
GTDHHFGFLLNT	sp|F5HAM0|UL144_HCMVM	34	tr|H7C4A2|H7C4A2_HUMAN Semaphorin-3F (Fragment) OS=Homo sapiens OX=9606 GN=SEMA3F PE=1 SV=1	1	GTAHFFNFLLNT
GTDHHFGFLLNT	sp|F5HAM0|UL144_HCMVM	34	tr|C9IYS6|C9IYS6_HUMAN Semaphorin-3F (Fragment) OS=Homo sapiens OX=9606 GN=SEMA3F PE=1 SV=1	43	GTAHFFNFLLNT
NTPLEVPKGLPC	sp|F5HAM0|UL144_HCMVM	44	tr|A0A096LNS9|A0A096LNS9_HUMAN Uncharacterized protein C8orf89 OS=Homo sapiens OX=9606 GN=C8orf89 PE=4 SV=1	74	STPLEVPKRLPR
NTPLEVPKGLPC	sp|F5HAM0|UL144_HCMVM	44	sp|P0DMQ9|CH089_HUMAN Putative uncharacterized protein C8orf89 OS=Homo sapiens OX=9606 GN=C8orf89 PE=2 SV=1	74	STPLEVPKRLPR
KRTTAETNLTTE	sp|Q6SWD0|RL12_HCMVM	11	tr|A0A3B3ITF7|A0A3B3ITF7_HUMAN Kinesin-like protein KIF1A OS=Homo sapiens OX=9606 GN=KIF1A PE=1 SV=1	228	KRHDAETNITTE
KRTTAETNLTTE	sp|Q6SWD0|RL12_HCMVM	11	tr|A0A3B3IUA1|A0A3B3IUA1_HUMAN Kinesin-like protein KIF1A OS=Homo sapiens OX=9606 GN=KIF1A PE=1 SV=1	228	KRHDAETNITTE
KRTTAETNLTTE	sp|Q6SWD0|RL12_HCMVM	11	sp|Q12756|KIF1A_HUMAN Kinesin-like protein KIF1A OS=Homo sapiens OX=9606 GN=KIF1A PE=1 SV=2	228	KRHDAETNITTE
KRTTAETNLTTE	sp|Q6SWD0|RL12_HCMVM	11	tr|A0A3F2YNW9|A0A3F2YNW9_HUMAN Kinesin-like protein KIF1A OS=Homo sapiens OX=9606 GN=KIF1A PE=1 SV=1	228	KRHDAETNITTE
KRTTAETNLTTE	sp|Q6SWD0|RL12_HCMVM	11	tr|A0A3B3ITW6|A0A3B3ITW6_HUMAN Kinesin-like protein KIF1A OS=Homo sapiens OX=9606 GN=KIF1A PE=1 SV=1	228	KRHDAETNITTE
KRTTAETNLTTE	sp|Q6SWD0|RL12_HCMVM	11	tr|H7C0K6|H7C0K6_HUMAN Kinesin-like protein (Fragment) OS=Homo sapiens OX=9606 GN=KIF1A PE=1 SV=2	228	KRHDAETNITTE
KRTTAETNLTTE	sp|Q6SWD0|RL12_HCMVM	11	tr|A0A3B3IT28|A0A3B3IT28_HUMAN Kinesin-like protein KIF1A OS=Homo sapiens OX=9606 GN=KIF1A PE=1 SV=1	228	KRHDAETNITTE
KRTTAETNLTTE	sp|Q6SWD0|RL12_HCMVM	11	tr|A0A3B3IU40|A0A3B3IU40_HUMAN Kinesin-like protein KIF1A OS=Homo sapiens OX=9606 GN=KIF1A PE=1 SV=1	228	KRHDAETNITTE
KRTTAETNLTTE	sp|Q6SWD0|RL12_HCMVM	11	tr|A0A3B3ITE5|A0A3B3ITE5_HUMAN Kinesin-like protein KIF1A OS=Homo sapiens OX=9606 GN=KIF1A PE=1 SV=1	228	KRHDAETNITTE
SDAERSFSERQL	tr|U3KRG9|U3KRG9_HCMVM	54	sp|Q9NRD8|DUOX2_HUMAN Dual oxidase 2 OS=Homo sapiens OX=9606 GN=DUOX2 PE=1 SV=2	192	SDALRSFSGGQL
SDAERSFSERQL	tr|U3KRG9|U3KRG9_HCMVM	54	tr|X6RAN8|X6RAN8_HUMAN NAD(P)H oxidase (H(2)O(2)-forming) OS=Homo sapiens OX=9606 GN=DUOX2 PE=1 SV=1	192	SDALRSFSGGQL
SDAERSFSERQL	tr|U3KRG9|U3KRG9_HCMVM	54	sp|Q9NRD9|DUOX1_HUMAN Dual oxidase 1 OS=Homo sapiens OX=9606 GN=DUOX1 PE=1 SV=1	186	SDALRSFSRGQL
SDAERSFSERQL	tr|U3KRG9|U3KRG9_HCMVM	54	tr|H0YK19|H0YK19_HUMAN Dual oxidase 1 OS=Homo sapiens OX=9606 GN=DUOX1 PE=1 SV=1	186	SDALRSFSRGQL
SYIVTNRRRVAL	sp|Q6SWC0|UL10_HCMVM	98	sp|Q6H8Q1|ABLM2_HUMAN Actin-binding LIM protein 2 OS=Homo sapiens OX=9606 GN=ABLIM2 PE=1 SV=2	553	SLIVTNRIRVKL
SYIVTNRRRVAL	sp|Q6SWC0|UL10_HCMVM	98	tr|F5GYR0|F5GYR0_HUMAN Actin-binding LIM protein 2 OS=Homo sapiens OX=9606 GN=ABLIM2 PE=1 SV=2	588	SLIVTNRIRVKL
RTQTVPPAGTAT	sp|F5HFA5|UL117_HCMVM	164	tr|A0A1W2PRC7|A0A1W2PRC7_HUMAN Adhesion G-protein-coupled receptor V1 (Fragment) OS=Homo sapiens OX=9606 GN=ADGRV1 PE=1 SV=1	1890	RTQGVPPAGIAL
RTQTVPPAGTAT	sp|F5HFA5|UL117_HCMVM	164	sp|Q8WXG9|AGRV1_HUMAN Adhesion G-protein coupled receptor V1 OS=Homo sapiens OX=9606 GN=ADGRV1 PE=1 SV=2	2793	RTQGVPPAGIAL
FAPCAHAPGPGH	sp|Q6SW82|UL49_HCMVM	365	sp|Q14657|LAGE3_HUMAN EKC/KEOPS complex subunit LAGE3 OS=Homo sapiens OX=9606 GN=LAGE3 PE=1 SV=2	36	GAPPAHAPGPGR
