query	query_seqname	query_start	target_seqname	target_start	target
PLAPESRDASGG	sp|P08392|ICP4_HHV11	1149	tr|A0A286YES1|A0A286YES1_HUMAN Immunoglobulin heavy constant gamma 3 (Fragment) OS=Homo sapiens OX=9606 GN=IGHG3 PE=1 SV=1	10	PLAPCSRSTSGG
PLAPESRDASGG	sp|P08392|ICP4_HHV11	1149	tr|A0A4W9A917|A0A4W9A917_HUMAN Immunoglobulin heavy constant gamma 3 (Fragment) OS=Homo sapiens OX=9606 GN=IGHG3 PE=1 SV=1	10	PLAPCSRSTSGG
PLAPESRDASGG	sp|P08392|ICP4_HHV11	1149	sp|P01860|IGHG3_HUMAN Immunoglobulin heavy constant gamma 3 OS=Homo sapiens OX=9606 GN=IGHG3 PE=1 SV=2	10	PLAPCSRSTSGG
LDARAQCSPGRT	sp|P10226|PAP_HHV11	85	sp|Q92786|PROX1_HUMAN Prospero homeobox protein 1 OS=Homo sapiens OX=9606 GN=PROX1 PE=1 SV=2	284	LDARAQDSVGRS
TLPVARARVDNL	sp|P10240|UL56_HHV11	166	sp|Q9HCD6|TANC2_HUMAN Protein TANC2 OS=Homo sapiens OX=9606 GN=TANC2 PE=1 SV=3	1952	TLPVAQAYQDNL
GEAQRADGALRI	sp|P10220|LTP_HHV11	1582	tr|A6NJ28|A6NJ28_HUMAN RAS guanyl-releasing protein 2 OS=Homo sapiens OX=9606 GN=RASGRP2 PE=1 SV=1	127	GGAQRAGGALSI
NCLLISALAILV	sp|P10200|CEP2_HHV11	341	tr|A0A1B0GUR5|A0A1B0GUR5_HUMAN Neuronal acetylcholine receptor subunit alpha-7 (Fragment) OS=Homo sapiens OX=9606 GN=CHRNA7 PE=4 SV=1	96	PCVLISALALLV
NCLLISALAILV	sp|P10200|CEP2_HHV11	341	tr|A0A1B0GW52|A0A1B0GW52_HUMAN Neuronal acetylcholine receptor subunit alpha-7 (Fragment) OS=Homo sapiens OX=9606 GN=CHRNA7 PE=3 SV=1	161	PCVLISALALLV
NCLLISALAILV	sp|P10200|CEP2_HHV11	341	tr|A0A1B0GVN6|A0A1B0GVN6_HUMAN Neuronal acetylcholine receptor subunit alpha-7 (Fragment) OS=Homo sapiens OX=9606 GN=CHRNA7 PE=4 SV=1	13	PCVLISALALLV
NCLLISALAILV	sp|P10200|CEP2_HHV11	341	tr|A0A1B0GV44|A0A1B0GV44_HUMAN Neuronal acetylcholine receptor subunit alpha-7 (Fragment) OS=Homo sapiens OX=9606 GN=CHRNA7 PE=3 SV=1	223	PCVLISALALLV
NCLLISALAILV	sp|P10200|CEP2_HHV11	341	tr|A0A1B0GW47|A0A1B0GW47_HUMAN Neuronal acetylcholine receptor subunit alpha-7 (Fragment) OS=Homo sapiens OX=9606 GN=CHRNA7 PE=3 SV=1	216	PCVLISALALLV
NCLLISALAILV	sp|P10200|CEP2_HHV11	341	tr|A0A1B0GV25|A0A1B0GV25_HUMAN Neuronal acetylcholine receptor subunit alpha-7 (Fragment) OS=Homo sapiens OX=9606 GN=CHRNA7 PE=3 SV=1	188	PCVLISALALLV
NCLLISALAILV	sp|P10200|CEP2_HHV11	341	tr|A0A1B0GV86|A0A1B0GV86_HUMAN Neuronal acetylcholine receptor subunit alpha-7 (Fragment) OS=Homo sapiens OX=9606 GN=CHRNA7 PE=4 SV=1	59	PCVLISALALLV
NCLLISALAILV	sp|P10200|CEP2_HHV11	341	tr|A0A0G2JNX5|A0A0G2JNX5_HUMAN CHRNA7-FAM7A fusion protein OS=Homo sapiens OX=9606 GN=CHRFAM7A PE=4 SV=1	59	PCVLISALALLV
NCLLISALAILV	sp|P10200|CEP2_HHV11	341	tr|A0A0G2JMC1|A0A0G2JMC1_HUMAN CHRNA7-FAM7A fusion protein OS=Homo sapiens OX=9606 GN=CHRFAM7A PE=4 SV=1	150	PCVLISALALLV
NCLLISALAILV	sp|P10200|CEP2_HHV11	341	tr|A0A1B0GVH2|A0A1B0GVH2_HUMAN Neuronal acetylcholine receptor subunit alpha-7 OS=Homo sapiens OX=9606 GN=CHRNA7 PE=3 SV=1	178	PCVLISALALLV
NCLLISALAILV	sp|P10200|CEP2_HHV11	341	tr|A0A1W2PN81|A0A1W2PN81_HUMAN Neuronal acetylcholine receptor subunit alpha-7 OS=Homo sapiens OX=9606 GN=CHRNA7 PE=3 SV=1	240	PCVLISALALLV
NCLLISALAILV	sp|P10200|CEP2_HHV11	341	tr|A0A1B0GV43|A0A1B0GV43_HUMAN Neuronal acetylcholine receptor subunit alpha-7 OS=Homo sapiens OX=9606 GN=CHRNA7 PE=3 SV=1	161	PCVLISALALLV
NCLLISALAILV	sp|P10200|CEP2_HHV11	341	tr|A0A0A6YYA8|A0A0A6YYA8_HUMAN CHRNA7-FAM7A fusion protein OS=Homo sapiens OX=9606 GN=CHRFAM7A PE=4 SV=1	59	PCVLISALALLV
NCLLISALAILV	sp|P10200|CEP2_HHV11	341	sp|P36544|ACHA7_HUMAN Neuronal acetylcholine receptor subunit alpha-7 OS=Homo sapiens OX=9606 GN=CHRNA7 PE=1 SV=5	240	PCVLISALALLV
NCLLISALAILV	sp|P10200|CEP2_HHV11	341	sp|Q494W8|CRFM7_HUMAN CHRNA7-FAM7A fusion protein OS=Homo sapiens OX=9606 GN=CHRFAM7A PE=1 SV=1	150	PCVLISALALLV
NCLLISALAILV	sp|P10200|CEP2_HHV11	341	tr|A0A1B0GTT9|A0A1B0GTT9_HUMAN Neuronal acetylcholine receptor subunit alpha-7 OS=Homo sapiens OX=9606 GN=CHRNA7 PE=3 SV=1	178	PCVLISALALLV
LRDSVFTSTACA	sp|P04294|AN_HHV11	557	sp|P40200|TACT_HUMAN T-cell surface protein tactile OS=Homo sapiens OX=9606 GN=CD96 PE=1 SV=2	477	LHDNVFTSTARA
LRDSVFTSTACA	sp|P04294|AN_HHV11	557	tr|E9PEJ1|E9PEJ1_HUMAN T-cell surface protein tactile OS=Homo sapiens OX=9606 GN=CD96 PE=1 SV=1	460	LHDNVFTSTARA
PPRHTPASLEPG	sp|P10238|ICP27_HHV11	497	sp|P0C1Z6|TFPT_HUMAN TCF3 fusion partner OS=Homo sapiens OX=9606 GN=TFPT PE=1 SV=1	168	PPRRTPAPPEPG
YTPTDYSGNTKS	sp|P10230|TEG1_HHV11	397	sp|Q9Y216|MTMR7_HUMAN Myotubularin-related protein 7 OS=Homo sapiens OX=9606 GN=MTMR7 PE=1 SV=3	577	NTPQDYSGNMKS
RLRTEARRPATS	sp|P10230|TEG1_HHV11	121	tr|M0QXQ3|M0QXQ3_HUMAN Insulin-like 3 (Fragment) OS=Homo sapiens OX=9606 GN=INSL3 PE=1 SV=1	50	RWSTEARRPATG
RLRTEARRPATS	sp|P10230|TEG1_HHV11	121	sp|P51460|INSL3_HUMAN Insulin-like 3 OS=Homo sapiens OX=9606 GN=INSL3 PE=1 SV=2	50	RWSTEARRPATG
NLPPQLASRGPA	sp|P10220|LTP_HHV11	1999	sp|A6NCL7|AN33B_HUMAN Ankyrin repeat domain-containing protein 33B OS=Homo sapiens OX=9606 GN=ANKRD33B PE=3 SV=1	386	GLPPALGSRGPA
TDSGISLATTVA	sp|P10226|PAP_HHV11	24	sp|Q7Z5P9|MUC19_HUMAN Mucin-19 OS=Homo sapiens OX=9606 GN=MUC19 PE=1 SV=3	7236	GTSGVSLATTVA
TDSGISLATTVA	sp|P10226|PAP_HHV11	24	tr|A0A2R8Y6K8|A0A2R8Y6K8_HUMAN Mucin-19 (Fragment) OS=Homo sapiens OX=9606 GN=MUC19 PE=4 SV=1	1	XTSGVSLATTVA
DAASGAKLTSGF	sp|P08392|ICP4_HHV11	714	sp|Q5TFG8|ZC21B_HUMAN Zinc finger C2HC domain-containing protein 1B OS=Homo sapiens OX=9606 GN=ZC2HC1B PE=1 SV=2	204	DPASGAKLRQGF
EQAWVGTYVALL	sp|P06491|MCP_HHV11	1340	sp|Q6V0I7|FAT4_HUMAN Protocadherin Fat 4 OS=Homo sapiens OX=9606 GN=FAT4 PE=1 SV=2	369	ENAQVGTVVALL
EQAWVGTYVALL	sp|P06491|MCP_HHV11	1340	tr|A0A6Q8JR05|A0A6Q8JR05_HUMAN Protocadherin Fat 4 OS=Homo sapiens OX=9606 GN=FAT4 PE=1 SV=1	369	ENAQVGTVVALL
PGAPARKPATRP	sp|P06491|MCP_HHV11	789	tr|A0A3B3ITB2|A0A3B3ITB2_HUMAN Nance-Horan syndrome protein (Fragment) OS=Homo sapiens OX=9606 GN=NHS PE=1 SV=1	10	PGEPARGPAARP
LRTSLDEALTQR	sp|P10217|TRM2_HHV11	70	sp|Q569K6|CC157_HUMAN Coiled-coil domain-containing protein 157 OS=Homo sapiens OX=9606 GN=CCDC157 PE=1 SV=3	468	LRGSLDEAEAQR
LRTSLDEALTQR	sp|P10217|TRM2_HHV11	70	tr|E9PS96|E9PS96_HUMAN Regulator of G-protein signaling 5 (Fragment) OS=Homo sapiens OX=9606 GN=RGS5 PE=1 SV=1	14	ERTSLDEALQWR
PLARLVPLALPL	sp|P10220|LTP_HHV11	682	sp|A5PL33|KRBA1_HUMAN Protein KRBA1 OS=Homo sapiens OX=9606 GN=KRBA1 PE=1 SV=3	960	PLPPLVPAALPL
PLARLVPLALPL	sp|P10220|LTP_HHV11	682	tr|A0A0C4DH65|A0A0C4DH65_HUMAN Protein KRBA1 OS=Homo sapiens OX=9606 GN=KRBA1 PE=1 SV=1	994	PLPPLVPAALPL
PLARLVPLALPL	sp|P10220|LTP_HHV11	682	tr|Q05BJ3|Q05BJ3_HUMAN Neurosecretory protein VGF OS=Homo sapiens OX=9606 GN=VGF PE=1 SV=1	341	PAARPCPLALPL
LPAAGAACALAC	sp|P08392|ICP4_HHV11	605	sp|P21817|RYR1_HUMAN Ryanodine receptor 1 OS=Homo sapiens OX=9606 GN=RYR1 PE=1 SV=3	1786	LPAAGAAEAPAR
AFLGQAAAQEPD	sp|P10220|LTP_HHV11	937	sp|Q13564|ULA1_HUMAN NEDD8-activating enzyme E1 regulatory subunit OS=Homo sapiens OX=9606 GN=NAE1 PE=1 SV=1	495	AFLGGAAAQEVI
AFLGQAAAQEPD	sp|P10220|LTP_HHV11	937	tr|J3QLH4|J3QLH4_HUMAN NEDD8-activating enzyme E1 regulatory subunit (Fragment) OS=Homo sapiens OX=9606 GN=NAE1 PE=1 SV=1	73	AFLGGAAAQEVI
APHALAAAADAK	sp|P10220|LTP_HHV11	2671	sp|P53007|TXTP_HUMAN Tricarboxylate transport protein, mitochondrial OS=Homo sapiens OX=9606 GN=SLC25A1 PE=1 SV=2	6	APRALAAAAPAS
EHIGRYRARSLG	sp|P04290|UL13_HHV11	87	tr|E5RIP2|E5RIP2_HUMAN ATPase family AAA domain-containing protein 2 OS=Homo sapiens OX=9606 GN=ATAD2 PE=1 SV=2	32	EHIGRRRLRSAG
EHIGRYRARSLG	sp|P04290|UL13_HHV11	87	sp|Q6PL18|ATAD2_HUMAN ATPase family AAA domain-containing protein 2 OS=Homo sapiens OX=9606 GN=ATAD2 PE=1 SV=1	32	EHIGRRRLRSAG
EHIGRYRARSLG	sp|P04290|UL13_HHV11	87	tr|E5RHW7|E5RHW7_HUMAN ATPase family AAA domain-containing protein 2 OS=Homo sapiens OX=9606 GN=ATAD2 PE=1 SV=1	32	EHIGRRRLRSAG
AARLGAELPLAA	sp|P10221|ITP_HHV11	559	sp|Q8NAF0|ZN579_HUMAN Zinc finger protein 579 OS=Homo sapiens OX=9606 GN=ZNF579 PE=1 SV=2	203	AAELRAELALAA
AARLGAELPLAA	sp|P10221|ITP_HHV11	559	sp|P15151|PVR_HUMAN Poliovirus receptor OS=Homo sapiens OX=9606 GN=PVR PE=1 SV=2	96	AARLGAELRNAS
AARLGAELPLAA	sp|P10221|ITP_HHV11	559	tr|A0A0A0MSA9|A0A0A0MSA9_HUMAN Poliovirus receptor OS=Homo sapiens OX=9606 GN=PVR PE=1 SV=1	96	AARLGAELRNAS
AARLGAELPLAA	sp|P10221|ITP_HHV11	559	tr|A0A0C4DG49|A0A0C4DG49_HUMAN Poliovirus receptor OS=Homo sapiens OX=9606 GN=PVR PE=1 SV=1	96	AARLGAELRNAS
EAGARGLIAGAP	sp|P10220|LTP_HHV11	2093	sp|Q5VW22|AGAP6_HUMAN Arf-GAP with GTPase, ANK repeat and PH domain-containing protein 6 OS=Homo sapiens OX=9606 GN=AGAP6 PE=2 SV=1	33	EAGARDRMAGAP
EAGARGLIAGAP	sp|P10220|LTP_HHV11	2093	sp|Q7Z7M1|AGRD2_HUMAN Adhesion G-protein coupled receptor D2 OS=Homo sapiens OX=9606 GN=ADGRD2 PE=2 SV=1	231	RAGARGLGAGHP
SPVGSATTAGRA	sp|Q69091|GD_HHV11	299	sp|Q7Z5P9|MUC19_HUMAN Mucin-19 OS=Homo sapiens OX=9606 GN=MUC19 PE=1 SV=3	6610	SPGGSATTRGRI
LLSFDLNAGLSV	sp|P06477|GH_HHV11	185	tr|X6RB12|X6RB12_HUMAN CD209 antigen OS=Homo sapiens OX=9606 GN=CD209 PE=1 SV=1	47	LLSFTLLAGLLV
LLSFDLNAGLSV	sp|P06477|GH_HHV11	185	sp|Q9NNX6|CD209_HUMAN CD209 antigen OS=Homo sapiens OX=9606 GN=CD209 PE=1 SV=1	47	LLSFTLLAGLLV
SVLAQEALAGAT	sp|P10220|LTP_HHV11	23	tr|H0Y4I5|H0Y4I5_HUMAN Chondroadherin-like protein (Fragment) OS=Homo sapiens OX=9606 GN=CHADL PE=1 SV=1	193	SVLAPEALAGLP
SVLAQEALAGAT	sp|P10220|LTP_HHV11	23	sp|Q6NUI6|CHADL_HUMAN Chondroadherin-like protein OS=Homo sapiens OX=9606 GN=CHADL PE=1 SV=2	195	SVLAPEALAGLP
AAPRSESLGGVT	sp|P08393|ICP0_HHV11	349	sp|Q8NHG8|ZNRF2_HUMAN E3 ubiquitin-protein ligase ZNRF2 OS=Homo sapiens OX=9606 GN=ZNRF2 PE=1 SV=1	76	AAPRSRSLGGAV
LAATEGAEVPFF	sp|P10190|PORTL_HHV11	599	sp|Q92902|HPS1_HUMAN Hermansky-Pudlak syndrome 1 protein OS=Homo sapiens OX=9606 GN=HPS1 PE=1 SV=2	5	LVATEGAEVLFY
RDSVLGLRADIH	sp|P10190|PORTL_HHV11	125	tr|A0A0A0MRA3|A0A0A0MRA3_HUMAN Titin OS=Homo sapiens OX=9606 GN=TTN PE=1 SV=1	22089	PDSNLSLRADIH
RDSVLGLRADIH	sp|P10190|PORTL_HHV11	125	tr|A0A0A0MTS7|A0A0A0MTS7_HUMAN Titin OS=Homo sapiens OX=9606 GN=TTN PE=1 SV=1	30962	PDSNLSLRADIH
RDSVLGLRADIH	sp|P10190|PORTL_HHV11	125	sp|Q8WZ42|TITIN_HUMAN Titin OS=Homo sapiens OX=9606 GN=TTN PE=1 SV=4	29321	PDSNLSLRADIH
RSRALRRPVPTP	sp|P04487|RNB_HHV11	125	tr|A0A494C071|A0A494C071_HUMAN Uncharacterized protein OS=Homo sapiens OX=9606 PE=3 SV=1	1110	RSPALRAIVPTP
ASDGPGNERRGG	sp|P10201|CVC1_HHV11	543	sp|Q8TDD1|DDX54_HUMAN ATP-dependent RNA helicase DDX54 OS=Homo sapiens OX=9606 GN=DDX54 PE=1 SV=2	787	ASDRRGPERRGG
ASVEGLDLTRVC	sp|P10216|UL32_HHV11	287	tr|D6RBL4|D6RBL4_HUMAN N6-adenosine-methyltransferase non-catalytic subunit (Fragment) OS=Homo sapiens OX=9606 GN=METTL14 PE=1 SV=2	59	GSGEGLDLGRVC
ASVEGLDLTRVC	sp|P10216|UL32_HHV11	287	sp|Q9HCE5|MET14_HUMAN N6-adenosine-methyltransferase non-catalytic subunit OS=Homo sapiens OX=9606 GN=METTL14 PE=1 SV=2	236	GSGEGLDLGRVC
TQVRSAIVQELS	sp|P10220|LTP_HHV11	196	sp|Q6STE5|SMRD3_HUMAN SWI/SNF-related matrix-associated actin-dependent regulator of chromatin subfamily D member 3 OS=Homo sapiens OX=9606 GN=SMARCD3 PE=1 SV=1	277	TQSRSAIVQALW
DHKQSRAPLAFA	sp|P08543|RIR1_HHV11	641	tr|H7BYJ3|H7BYJ3_HUMAN Non-specific serine/threonine protein kinase (Fragment) OS=Homo sapiens OX=9606 GN=CIT PE=1 SV=1	1435	DLKWSRLPLAFA
DHKQSRAPLAFA	sp|P08543|RIR1_HHV11	641	sp|O14578|CTRO_HUMAN Citron Rho-interacting kinase OS=Homo sapiens OX=9606 GN=CIT PE=1 SV=2	1822	DLKWSRLPLAFA
NFARRANPLLVS	sp|P10189|HELI_HHV11	263	sp|Q460N5|PAR14_HUMAN Protein mono-ADP-ribosyltransferase PARP14 OS=Homo sapiens OX=9606 GN=PARP14 PE=1 SV=3	1185	EFARRANGNLVS
NFARRANPLLVS	sp|P10189|HELI_HHV11	263	tr|H7C5R8|H7C5R8_HUMAN Protein mono-ADP-ribosyltransferase PARP14 (Fragment) OS=Homo sapiens OX=9606 GN=PARP14 PE=1 SV=1	1026	EFARRANGNLVS
AAISATGGRQLA	sp|P10235|TEG7_HHV11	226	tr|D6RBE5|D6RBE5_HUMAN Endosomal/lysosomal potassium channel TMEM175 (Fragment) OS=Homo sapiens OX=9606 GN=TMEM175 PE=1 SV=1	219	AALSATGPRFLA
AAISATGGRQLA	sp|P10235|TEG7_HHV11	226	sp|Q9BSA9|TM175_HUMAN Endosomal/lysosomal potassium channel TMEM175 OS=Homo sapiens OX=9606 GN=TMEM175 PE=1 SV=1	301	AALSATGPRFLA
AAISATGGRQLA	sp|P10235|TEG7_HHV11	226	tr|F6UWG6|F6UWG6_HUMAN Endosomal/lysosomal potassium channel TMEM175 OS=Homo sapiens OX=9606 GN=TMEM175 PE=1 SV=1	219	AALSATGPRFLA
RDLPNLERASAG	sp|P04295|TRM3_HHV11	8	sp|Q9NUP1|BL1S4_HUMAN Biogenesis of lysosome-related organelles complex 1 subunit 4 OS=Homo sapiens OX=9606 GN=BLOC1S4 PE=1 SV=1	56	RDLPLLRRAAAG
LPSRGVSAPLPA	sp|P06486|US10_HHV11	176	tr|C9J1B5|C9J1B5_HUMAN Golgin subfamily A member 8B OS=Homo sapiens OX=9606 GN=GOLGA8B PE=4 SV=2	56	LPQRGLGAPLPA
LPSRGVSAPLPA	sp|P06486|US10_HHV11	176	sp|A7E2F4|GOG8A_HUMAN Golgin subfamily A member 8A OS=Homo sapiens OX=9606 GN=GOLGA8A PE=2 SV=3	54	LPQRGLGAPLPA
EPAAEGPAHGGQ	sp|P10210|SCAF_HHV11	336	sp|Q86V15|CASZ1_HUMAN Zinc finger protein castor homolog 1 OS=Homo sapiens OX=9606 GN=CASZ1 PE=1 SV=4	1602	EPAAEGPAPGPP
VVAAARAFGSYL	sp|P10210|SCAF_HHV11	173	sp|Q6X4W1|NSMF_HUMAN NMDA receptor synaptonuclear signaling and neuronal migration factor OS=Homo sapiens OX=9606 GN=NSMF PE=1 SV=1	22	KVRAARAFGEYL
ARLVPLALPLDP	sp|P10220|LTP_HHV11	684	tr|H0Y9P2|H0Y9P2_HUMAN Fibroblast growth factor receptor 4 (Fragment) OS=Homo sapiens OX=9606 GN=FGFR4 PE=1 SV=1	79	AGLVSLDLPLDP
ARLVPLALPLDP	sp|P10220|LTP_HHV11	684	sp|P22455|FGFR4_HUMAN Fibroblast growth factor receptor 4 OS=Homo sapiens OX=9606 GN=FGFR4 PE=1 SV=2	447	AGLVSLDLPLDP
ARLVPLALPLDP	sp|P10220|LTP_HHV11	684	tr|Q05BJ3|Q05BJ3_HUMAN Neurosecretory protein VGF OS=Homo sapiens OX=9606 GN=VGF PE=1 SV=1	343	ARPCPLALPLSP
SDSPASAVGAGL	sp|P10220|LTP_HHV11	2854	sp|O15063|GRRE1_HUMAN Granule associated Rac and RHOG effector protein 1 OS=Homo sapiens OX=9606 GN=GARRE1 PE=1 SV=2	761	SQQPAQAVGAGL
APAEGPAELNAA	sp|P08392|ICP4_HHV11	772	tr|F5GX32|F5GX32_HUMAN DNA repair protein RAD52 homolog OS=Homo sapiens OX=9606 GN=RAD52 PE=1 SV=1	272	APAEAPAEAAAA
FSLPLSEASVSS	sp|P10187|NP03_HHV11	154	tr|A0A096LNH6|A0A096LNH6_HUMAN Dedicator of cytokinesis protein 1 OS=Homo sapiens OX=9606 GN=DOCK1 PE=1 SV=1	1662	SSRPLSVASVSS
FSLPLSEASVSS	sp|P10187|NP03_HHV11	154	sp|Q14185|DOCK1_HUMAN Dedicator of cytokinesis protein 1 OS=Homo sapiens OX=9606 GN=DOCK1 PE=1 SV=2	1641	SSRPLSVASVSS
RAGSMPAPAVPA	sp|P08392|ICP4_HHV11	254	sp|Q6ZVC0|NYAP1_HUMAN Neuronal tyrosine-phosphorylated phosphoinositide-3-kinase adapter 1 OS=Homo sapiens OX=9606 GN=NYAP1 PE=2 SV=1	366	PAGSTPAPQVPA
RAGSMPAPAVPA	sp|P08392|ICP4_HHV11	254	tr|C9JS30|C9JS30_HUMAN Neuronal tyrosine-phosphorylated phosphoinositide-3-kinase adapter 1 OS=Homo sapiens OX=9606 GN=NYAP1 PE=1 SV=1	309	PAGSTPAPQVPA
PDLDADGGGRAV	sp|P08392|ICP4_HHV11	40	tr|C9J681|C9J681_HUMAN Interleukin-36 gamma (Fragment) OS=Homo sapiens OX=9606 GN=IL36G PE=1 SV=1	4	TPGDADGGGRAV
PDLDADGGGRAV	sp|P08392|ICP4_HHV11	40	sp|Q9NZH8|IL36G_HUMAN Interleukin-36 gamma OS=Homo sapiens OX=9606 GN=IL36G PE=1 SV=1	4	TPGDADGGGRAV
YSNLTESILAWY	sp|P10211|GB_HHV11	855	tr|E9PEZ1|E9PEZ1_HUMAN Cullin-9 OS=Homo sapiens OX=9606 GN=CUL9 PE=1 SV=1	1115	YSNLTSSILAGC
YSNLTESILAWY	sp|P10211|GB_HHV11	855	sp|Q8IWT3|CUL9_HUMAN Cullin-9 OS=Homo sapiens OX=9606 GN=CUL9 PE=1 SV=2	1115	YSNLTSSILAGC
LLTVEAPDAAPG	sp|P04291|TEG3_HHV11	145	sp|Q96JQ0|PCD16_HUMAN Protocadherin-16 OS=Homo sapiens OX=9606 GN=DCHS1 PE=1 SV=1	2621	LLHVEASDADPG
ADLKIRAQMSSE	sp|P04413|US03_HHV11	361	sp|Q13825|AUHM_HUMAN Methylglutaconyl-CoA hydratase, mitochondrial OS=Homo sapiens OX=9606 GN=AUH PE=1 SV=1	141	ADLKERAKMSSS
MGAPVSSTAAAP	sp|P04488|GE_HHV11	464	sp|Q5QP82|DCA10_HUMAN DDB1- and CUL4-associated factor 10 OS=Homo sapiens OX=9606 GN=DCAF10 PE=1 SV=1	74	PGAPESSTASAP
MRLRTEARRPAT	sp|P10230|TEG1_HHV11	120	tr|M0QXQ3|M0QXQ3_HUMAN Insulin-like 3 (Fragment) OS=Homo sapiens OX=9606 GN=INSL3 PE=1 SV=1	49	PRWSTEARRPAT
MRLRTEARRPAT	sp|P10230|TEG1_HHV11	120	sp|P51460|INSL3_HUMAN Insulin-like 3 OS=Homo sapiens OX=9606 GN=INSL3 PE=1 SV=2	49	PRWSTEARRPAT
TYYGGRLLAGAA	sp|P10210|SCAF_HHV11	446	sp|P98073|ENTK_HUMAN Enteropeptidase OS=Homo sapiens OX=9606 GN=TMPRSS15 PE=1 SV=3	802	LYYGGRLLCGAS
GVGLGVPRHGHP	sp|P10227|MB43_HHV11	269	tr|A0A2R8YFM9|A0A2R8YFM9_HUMAN Uncharacterized protein CFAP92 OS=Homo sapiens OX=9606 GN=CFAP92 PE=1 SV=2	605	VVGLGVPRDGHQ
GVGLGVPRHGHP	sp|P10227|MB43_HHV11	269	sp|Q6ZUG5|YC006_HUMAN Uncharacterized protein FLJ43738 OS=Homo sapiens OX=9606 PE=2 SV=1	151	VVGLGVPRDGHQ
RERGGVEPPLPA	sp|P06492|VP16_HHV11	98	tr|A0A1B0GUX8|A0A1B0GUX8_HUMAN Genetic suppressor element 1 (Fragment) OS=Homo sapiens OX=9606 GN=GSE1 PE=1 SV=1	90	RERLIVEPPLPQ
RERGGVEPPLPA	sp|P06492|VP16_HHV11	98	tr|C9JLW9|C9JLW9_HUMAN Genetic suppressor element 1 (Fragment) OS=Homo sapiens OX=9606 GN=GSE1 PE=1 SV=8	49	RERLIVEPPLPQ
RERGGVEPPLPA	sp|P06492|VP16_HHV11	98	sp|Q14687|GSE1_HUMAN Genetic suppressor element 1 OS=Homo sapiens OX=9606 GN=GSE1 PE=1 SV=3	153	RERLIVEPPLPQ
TPPDPRRHRAVD	sp|P10228|GC_HHV11	36	tr|A2A2F0|A2A2F0_HUMAN Ral GTPase-activating protein subunit beta (Fragment) OS=Homo sapiens OX=9606 GN=RALGAPB PE=1 SV=1	207	TPPHNRRHRAVT
TPPDPRRHRAVD	sp|P10228|GC_HHV11	36	sp|Q86X10|RLGPB_HUMAN Ral GTPase-activating protein subunit beta OS=Homo sapiens OX=9606 GN=RALGAPB PE=1 SV=1	379	TPPHNRRHRAVT
AAAHLTGASPRL	sp|P06486|US10_HHV11	248	sp|P47872|SCTR_HUMAN Secretin receptor OS=Homo sapiens OX=9606 GN=SCTR PE=1 SV=2	20	CAAHSTGALPRL
AAVARVDCALAP	sp|P10231|TEG5_HHV11	385	sp|Q8IW35|CEP97_HUMAN Centrosomal protein of 97 kDa OS=Homo sapiens OX=9606 GN=CEP97 PE=1 SV=1	1	MAVARVDAALPP
AAVARVDCALAP	sp|P10231|TEG5_HHV11	385	tr|E9PG22|E9PG22_HUMAN Centrosomal protein of 97 kDa OS=Homo sapiens OX=9606 GN=CEP97 PE=1 SV=1	1	MAVARVDAALPP
AAVARVDCALAP	sp|P10231|TEG5_HHV11	385	tr|F8WF91|F8WF91_HUMAN Centrosomal protein of 97 kDa OS=Homo sapiens OX=9606 GN=CEP97 PE=1 SV=1	1	MAVARVDAALPP
RQGAVVLLTLPA	sp|P68331|GK_HHV11	32	sp|Q9HC58|NCKX3_HUMAN Sodium/potassium/calcium exchanger 3 OS=Homo sapiens OX=9606 GN=SLC24A3 PE=2 SV=4	106	RQGAVVLHVLCA
GWPASELLVAEI	sp|P10230|TEG1_HHV11	29	tr|F5H5C0|F5H5C0_HUMAN Peroxisomal targeting signal 1 receptor (Fragment) OS=Homo sapiens OX=9606 GN=PEX5 PE=1 SV=1	43	GAPASEALVAEF
PAPAPLLPRSDA	sp|P04488|GE_HHV11	9	sp|Q99583|MNT_HUMAN Max-binding protein MNT OS=Homo sapiens OX=9606 GN=MNT PE=1 SV=1	144	PTPAPLLPDSKA
GAAALGAQERRA	sp|P10205|TEG4_HHV11	113	sp|Q96L58|B3GT6_HUMAN Beta-1,3-galactosyltransferase 6 OS=Homo sapiens OX=9606 GN=B3GALT6 PE=1 SV=2	97	GTAGLGAEERRA
PAGRPELRPEPR	sp|P36313|ICP34_HHV11	219	sp|Q5T749|KPRP_HUMAN Keratinocyte proline-rich protein OS=Homo sapiens OX=9606 GN=KPRP PE=1 SV=1	402	PAPRPRLRPEPC
SPAPAARVAPPA	sp|P08392|ICP4_HHV11	394	sp|Q8IVT2|MISP_HUMAN Mitotic interactor and substrate of PLK1 OS=Homo sapiens OX=9606 GN=MISP PE=1 SV=1	400	SPAPDARAADPA
GISLATTVATGC	sp|P10226|PAP_HHV11	27	sp|Q7Z5P9|MUC19_HUMAN Mucin-19 OS=Homo sapiens OX=9606 GN=MUC19 PE=1 SV=3	7239	GVSLATTVAPGS
GISLATTVATGC	sp|P10226|PAP_HHV11	27	tr|A0A2R8Y6K8|A0A2R8Y6K8_HUMAN Mucin-19 (Fragment) OS=Homo sapiens OX=9606 GN=MUC19 PE=4 SV=1	4	GVSLATTVAPGS
AALYPLYAAPVP	sp|P08392|ICP4_HHV11	1197	sp|Q86Z02|HIPK1_HUMAN Homeodomain-interacting protein kinase 1 OS=Homo sapiens OX=9606 GN=HIPK1 PE=1 SV=1	614	SALYPSSAAPVP
AALYPLYAAPVP	sp|P08392|ICP4_HHV11	1197	tr|J3KP92|J3KP92_HUMAN Homeodomain-interacting protein kinase 1 OS=Homo sapiens OX=9606 GN=HIPK1 PE=1 SV=1	580	SALYPSSAAPVP
AALYPLYAAPVP	sp|P08392|ICP4_HHV11	1197	tr|Q5SQL3|Q5SQL3_HUMAN Homeodomain-interacting protein kinase 1 OS=Homo sapiens OX=9606 GN=HIPK1 PE=1 SV=1	614	SALYPSSAAPVP
AALNSRATPALP	sp|P10220|LTP_HHV11	1478	sp|Q7Z7M1|AGRD2_HUMAN Adhesion G-protein coupled receptor D2 OS=Homo sapiens OX=9606 GN=ADGRD2 PE=2 SV=1	159	AALFSVAAPALP
PAPAARVAPPAA	sp|P08392|ICP4_HHV11	395	tr|E7EQR1|E7EQR1_HUMAN SH3 domain and tetratricopeptide repeat-containing protein 1 (Fragment) OS=Homo sapiens OX=9606 GN=SH3TC1 PE=1 SV=1	59	EAPPARVAGPAA
PAPAARVAPPAA	sp|P08392|ICP4_HHV11	395	sp|Q8TE82|S3TC1_HUMAN SH3 domain and tetratricopeptide repeat-containing protein 1 OS=Homo sapiens OX=9606 GN=SH3TC1 PE=1 SV=3	59	EAPPARVAGPAA
PAPAARVAPPAA	sp|P08392|ICP4_HHV11	395	sp|Q5T440|CAF17_HUMAN Putative transferase CAF17, mitochondrial OS=Homo sapiens OX=9606 GN=IBA57 PE=1 SV=1	81	PSPAAAGAPPAA
PAPAARVAPPAA	sp|P08392|ICP4_HHV11	395	sp|Q49A92|CH034_HUMAN Uncharacterized protein C8orf34 OS=Homo sapiens OX=9606 GN=C8orf34 PE=2 SV=3	22	SAPHARVAPRAA
PAPAARVAPPAA	sp|P08392|ICP4_HHV11	395	sp|Q8N6I1|EID2_HUMAN EP300-interacting inhibitor of differentiation 2 OS=Homo sapiens OX=9606 GN=EID2 PE=1 SV=3	70	PAAAARGAPVAA
PAPAARVAPPAA	sp|P08392|ICP4_HHV11	395	tr|F8W9F9|F8W9F9_HUMAN Non-specific serine/threonine protein kinase OS=Homo sapiens OX=9606 GN=WNK2 PE=1 SV=1	96	PAPAALVAQPGA
PAPAARVAPPAA	sp|P08392|ICP4_HHV11	395	tr|H0Y7T5|H0Y7T5_HUMAN Non-specific serine/threonine protein kinase (Fragment) OS=Homo sapiens OX=9606 GN=WNK2 PE=1 SV=1	92	PAPAALVAQPGA
PAPAARVAPPAA	sp|P08392|ICP4_HHV11	395	sp|Q9Y3S1|WNK2_HUMAN Serine/threonine-protein kinase WNK2 OS=Homo sapiens OX=9606 GN=WNK2 PE=1 SV=4	96	PAPAALVAQPGA
PAPAARVAPPAA	sp|P08392|ICP4_HHV11	395	tr|A6PVV2|A6PVV2_HUMAN Non-specific serine/threonine protein kinase (Fragment) OS=Homo sapiens OX=9606 GN=WNK2 PE=1 SV=1	96	PAPAALVAQPGA
VPQSLALSPGDL	sp|P10205|TEG4_HHV11	47	tr|B0QY07|B0QY07_HUMAN Cytokine receptor common subunit beta (Fragment) OS=Homo sapiens OX=9606 GN=CSF2RB PE=1 SV=8	78	SPQSHWLSPGDL
VPQSLALSPGDL	sp|P10205|TEG4_HHV11	47	sp|P32927|IL3RB_HUMAN Cytokine receptor common subunit beta OS=Homo sapiens OX=9606 GN=CSF2RB PE=1 SV=2	158	SPQSHWLSPGDL
VPQSLALSPGDL	sp|P10205|TEG4_HHV11	47	tr|Q6NSJ8|Q6NSJ8_HUMAN CSF2RB protein OS=Homo sapiens OX=9606 GN=CSF2RB PE=1 SV=1	158	SPQSHWLSPGDL
VSVLAQEALAGA	sp|P10220|LTP_HHV11	22	tr|H0Y4I5|H0Y4I5_HUMAN Chondroadherin-like protein (Fragment) OS=Homo sapiens OX=9606 GN=CHADL PE=1 SV=1	192	LSVLAPEALAGL
VSVLAQEALAGA	sp|P10220|LTP_HHV11	22	sp|Q6NUI6|CHADL_HUMAN Chondroadherin-like protein OS=Homo sapiens OX=9606 GN=CHADL PE=1 SV=2	194	LSVLAPEALAGL
RARVRPGVTLQP	sp|P06485|US02_HHV11	121	sp|P53805|RCAN1_HUMAN Calcipressin-1 OS=Homo sapiens OX=9606 GN=RCAN1 PE=1 SV=4	21	EARARPGVTLRP
LARLRGAPVFAL	sp|P10189|HELI_HHV11	689	sp|Q8N9M5|TM102_HUMAN Transmembrane protein 102 OS=Homo sapiens OX=9606 GN=TMEM102 PE=1 SV=1	473	LARLRGDPARAL
EDEGPPPPSKTG	sp|P10220|LTP_HHV11	2111	sp|Q5SXM8|DNLZ_HUMAN DNL-type zinc finger protein OS=Homo sapiens OX=9606 GN=DNLZ PE=1 SV=1	165	EDEGPPSPGKTE
AAALGAQERRAG	sp|P10205|TEG4_HHV11	114	sp|Q03113|GNA12_HUMAN Guanine nucleotide-binding protein subunit alpha-12 OS=Homo sapiens OX=9606 GN=GNA12 PE=1 SV=4	15	AEAGGARERRAG
RAFVAPRETKTV	sp|P10212|TRM1_HHV11	230	tr|H7C2E4|H7C2E4_HUMAN Aspartate carbamoyltransferase (Fragment) OS=Homo sapiens OX=9606 GN=CAD PE=1 SV=1	152	RAFVASRGTKQV
RADLEAVLAPHA	sp|P10231|TEG5_HHV11	466	sp|Q8WZA9|IRGQ_HUMAN Immunity-related GTPase family Q protein OS=Homo sapiens OX=9606 GN=IRGQ PE=1 SV=1	609	RADAEAVLAPPE
YPAASSTFAAGA	sp|P10210|SCAF_HHV11	290	sp|P09629|HXB7_HUMAN Homeobox protein Hox-B7 OS=Homo sapiens OX=9606 GN=HOXB7 PE=1 SV=4	14	YPASSSVFATGA
RDLYETLRFADD	sp|P10221|ITP_HHV11	516	tr|K7ELC8|K7ELC8_HUMAN Sperm-associated antigen 5 (Fragment) OS=Homo sapiens OX=9606 GN=SPAG5 PE=1 SV=1	81	RDLKETLEFADQ
RDLYETLRFADD	sp|P10221|ITP_HHV11	516	tr|E9PMD0|E9PMD0_HUMAN Uncharacterized protein (Fragment) OS=Homo sapiens OX=9606 PE=4 SV=1	202	RDLKETLEFADQ
RDLYETLRFADD	sp|P10221|ITP_HHV11	516	sp|Q96R06|SPAG5_HUMAN Sperm-associated antigen 5 OS=Homo sapiens OX=9606 GN=SPAG5 PE=1 SV=2	797	RDLKETLEFADQ
TSCSIREDLPAE	sp|P06484|GG_HHV11	58	tr|C9JR56|C9JR56_HUMAN DNA-binding protein SATB OS=Homo sapiens OX=9606 GN=SATB2 PE=1 SV=1	98	QSCSKLEDLPAE
TSCSIREDLPAE	sp|P06484|GG_HHV11	58	sp|Q9UPW6|SATB2_HUMAN DNA-binding protein SATB2 OS=Homo sapiens OX=9606 GN=SATB2 PE=1 SV=2	157	QSCSKLEDLPAE
RASGAGLTLVAA	sp|P04296|DNBI_HHV11	241	sp|O75445|USH2A_HUMAN Usherin OS=Homo sapiens OX=9606 GN=USH2A PE=1 SV=3	1455	SASGAGQTLAAA
NAVARAQAALVL	sp|P32888|TRX1_HHV11	103	sp|Q9Y490|TLN1_HUMAN Talin-1 OS=Homo sapiens OX=9606 GN=TLN1 PE=1 SV=3	673	KAVASAAAALVL
VSCELSFPWADR	sp|P10225|SHUT_HHV11	413	sp|Q8N398|VW5B2_HUMAN von Willebrand factor A domain-containing protein 5B2 OS=Homo sapiens OX=9606 GN=VWA5B2 PE=2 SV=3	615	VSAELSSPWAAR
VSCELSFPWADR	sp|P10225|SHUT_HHV11	413	tr|E9PF42|E9PF42_HUMAN von Willebrand factor A domain-containing protein 5B2 OS=Homo sapiens OX=9606 GN=VWA5B2 PE=1 SV=1	396	VSAELSSPWAAR
AGLLLSAGSPPI	sp|P04294|AN_HHV11	192	tr|M0R243|M0R243_HUMAN Zinc finger protein 98 (Fragment) OS=Homo sapiens OX=9606 GN=ZNF98 PE=4 SV=1	57	AGVAVSAGSPPI
AGLLLSAGSPPI	sp|P04294|AN_HHV11	192	tr|A0A087WTU3|A0A087WTU3_HUMAN Testis-expressed protein 264 OS=Homo sapiens OX=9606 GN=TEX264 PE=1 SV=1	32	AGVEVSAGSPPI
AGLLLSAGSPPI	sp|P04294|AN_HHV11	192	tr|C9JL43|C9JL43_HUMAN Testis-expressed protein 264 (Fragment) OS=Homo sapiens OX=9606 GN=TEX264 PE=1 SV=1	32	AGVEVSAGSPPI
AGLLLSAGSPPI	sp|P04294|AN_HHV11	192	tr|C9JUC3|C9JUC3_HUMAN Testis-expressed protein 264 (Fragment) OS=Homo sapiens OX=9606 GN=TEX264 PE=1 SV=8	32	AGVEVSAGSPPI
AGLLLSAGSPPI	sp|P04294|AN_HHV11	192	tr|C9J7N0|C9J7N0_HUMAN Testis-expressed protein 264 (Fragment) OS=Homo sapiens OX=9606 GN=TEX264 PE=1 SV=1	32	AGVEVSAGSPPI
AGLLLSAGSPPI	sp|P04294|AN_HHV11	192	tr|C9JXQ7|C9JXQ7_HUMAN Testis-expressed protein 264 (Fragment) OS=Homo sapiens OX=9606 GN=TEX264 PE=1 SV=8	32	AGVEVSAGSPPI
AGLLLSAGSPPI	sp|P04294|AN_HHV11	192	tr|C9JHH5|C9JHH5_HUMAN Testis-expressed protein 264 (Fragment) OS=Homo sapiens OX=9606 GN=TEX264 PE=1 SV=8	32	AGVEVSAGSPPI
AGLLLSAGSPPI	sp|P04294|AN_HHV11	192	sp|Q9Y6I9|TX264_HUMAN Testis-expressed protein 264 OS=Homo sapiens OX=9606 GN=TEX264 PE=1 SV=1	32	AGVEVSAGSPPI
APPLGAPHALAA	sp|P10220|LTP_HHV11	2666	tr|C9JWM1|C9JWM1_HUMAN Runt-related transcription factor 1 (Fragment) OS=Homo sapiens OX=9606 GN=RUNX1 PE=1 SV=1	42	ALPLGAPDAGAA
APPLGAPHALAA	sp|P10220|LTP_HHV11	2666	tr|H9KVB1|H9KVB1_HUMAN Runt-related transcription factor OS=Homo sapiens OX=9606 GN=RUNX1 PE=1 SV=1	28	ALPLGAPDAGAA
APPLGAPHALAA	sp|P10220|LTP_HHV11	2666	tr|A8MZI9|A8MZI9_HUMAN Runt-related transcription factor 1 (Fragment) OS=Homo sapiens OX=9606 GN=RUNX1 PE=1 SV=2	43	ALPLGAPDAGAA
APPLGAPHALAA	sp|P10220|LTP_HHV11	2666	sp|Q01196|RUNX1_HUMAN Runt-related transcription factor 1 OS=Homo sapiens OX=9606 GN=RUNX1 PE=1 SV=3	28	ALPLGAPDAGAA
