query	query_seqname	query_start	target_seqname	target_start	target
QQKFYVARVLSL	tr|B2XXZ9|B2XXZ9_DUVV	429	tr|A0A1U9X989|A0A1U9X989_HUMAN NOTCH4 OS=Homo sapiens OX=9606 GN=NOTCH4 PE=1 SV=2	1309	QQLFALARVLSL
QQKFYVARVLSL	tr|B2XXZ9|B2XXZ9_DUVV	429	tr|A0A140T9R5|A0A140T9R5_HUMAN NOTCH4 OS=Homo sapiens OX=9606 GN=NOTCH4 PE=1 SV=1	1312	QQLFALARVLSL
QQKFYVARVLSL	tr|B2XXZ9|B2XXZ9_DUVV	429	sp|Q99466|NOTC4_HUMAN Neurogenic locus notch homolog protein 4 OS=Homo sapiens OX=9606 GN=NOTCH4 PE=1 SV=2	1310	QQLFALARVLSL
QQKFYVARVLSL	tr|B2XXZ9|B2XXZ9_DUVV	429	tr|A0A140T8Y6|A0A140T8Y6_HUMAN NOTCH4 OS=Homo sapiens OX=9606 GN=NOTCH4 PE=1 SV=1	1310	QQLFALARVLSL
QQKFYVARVLSL	tr|B2XXZ9|B2XXZ9_DUVV	429	sp|Q5XUX1|FBXW9_HUMAN F-box/WD repeat-containing protein 9 OS=Homo sapiens OX=9606 GN=FBXW9 PE=1 SV=3	29	QAKAYVARVLSP
QQKFYVARVLSL	tr|B2XXZ9|B2XXZ9_DUVV	429	tr|K7EL01|K7EL01_HUMAN F-box/WD repeat-containing protein 9 OS=Homo sapiens OX=9606 GN=FBXW9 PE=1 SV=1	29	QAKAYVARVLSP
KQQKFYVARVLS	tr|B2XXZ9|B2XXZ9_DUVV	428	sp|Q5XUX1|FBXW9_HUMAN F-box/WD repeat-containing protein 9 OS=Homo sapiens OX=9606 GN=FBXW9 PE=1 SV=3	28	AQAKAYVARVLS
KQQKFYVARVLS	tr|B2XXZ9|B2XXZ9_DUVV	428	tr|K7EL01|K7EL01_HUMAN F-box/WD repeat-containing protein 9 OS=Homo sapiens OX=9606 GN=FBXW9 PE=1 SV=1	28	AQAKAYVARVLS
IKSTSWPTGPGP	tr|B2XY07|B2XY07_DUVV	307	tr|H3BUF6|H3BUF6_HUMAN Ataxin-2-like protein OS=Homo sapiens OX=9606 GN=ATXN2L PE=1 SV=1	682	NKSTSTPTSPGP
IKSTSWPTGPGP	tr|B2XY07|B2XY07_DUVV	307	sp|Q8WWM7|ATX2L_HUMAN Ataxin-2-like protein OS=Homo sapiens OX=9606 GN=ATXN2L PE=1 SV=2	676	NKSTSTPTSPGP
IKSTSWPTGPGP	tr|B2XY07|B2XY07_DUVV	307	tr|H3BRB0|H3BRB0_HUMAN Ataxin-2-like protein (Fragment) OS=Homo sapiens OX=9606 GN=ATXN2L PE=1 SV=2	1	NKSTSTPTSPGP
IKSTSWPTGPGP	tr|B2XY07|B2XY07_DUVV	307	tr|A0A0C4DGL7|A0A0C4DGL7_HUMAN Ataxin-2-like protein (Fragment) OS=Homo sapiens OX=9606 GN=ATXN2L PE=1 SV=1	1	NKSTSTPTSPGP
DKKLDVKQCSGK	tr|B2XXZ9|B2XXZ9_DUVV	342	tr|A0A5K1VW52|A0A5K1VW52_HUMAN Thrombospondin type-1 domain-containing protein 7B OS=Homo sapiens OX=9606 GN=THSD7B PE=1 SV=1	1519	DKKADVKNLSGK
DKKLDVKQCSGK	tr|B2XXZ9|B2XXZ9_DUVV	342	sp|Q9C0I4|THS7B_HUMAN Thrombospondin type-1 domain-containing protein 7B OS=Homo sapiens OX=9606 GN=THSD7B PE=2 SV=3	1517	DKKADVKNLSGK
DKKLDVKQCSGK	tr|B2XXZ9|B2XXZ9_DUVV	342	tr|C9JKN6|C9JKN6_HUMAN Thrombospondin type-1 domain-containing protein 7B OS=Homo sapiens OX=9606 GN=THSD7B PE=1 SV=3	1488	DKKADVKNLSGK
KSTSWPTGPGPV	tr|B2XY07|B2XY07_DUVV	308	tr|H3BUF6|H3BUF6_HUMAN Ataxin-2-like protein OS=Homo sapiens OX=9606 GN=ATXN2L PE=1 SV=1	683	KSTSTPTSPGPR
KSTSWPTGPGPV	tr|B2XY07|B2XY07_DUVV	308	sp|Q8WWM7|ATX2L_HUMAN Ataxin-2-like protein OS=Homo sapiens OX=9606 GN=ATXN2L PE=1 SV=2	677	KSTSTPTSPGPR
KSTSWPTGPGPV	tr|B2XY07|B2XY07_DUVV	308	tr|H3BRB0|H3BRB0_HUMAN Ataxin-2-like protein (Fragment) OS=Homo sapiens OX=9606 GN=ATXN2L PE=1 SV=2	2	KSTSTPTSPGPR
KSTSWPTGPGPV	tr|B2XY07|B2XY07_DUVV	308	tr|A0A0C4DGL7|A0A0C4DGL7_HUMAN Ataxin-2-like protein (Fragment) OS=Homo sapiens OX=9606 GN=ATXN2L PE=1 SV=1	2	KSTSTPTSPGPR
FISALTVYHVIW	tr|B2XY08|B2XY08_DUVV	20	sp|P48048|KCNJ1_HUMAN ATP-sensitive inward rectifier potassium channel 1 OS=Homo sapiens OX=9606 GN=KCNJ1 PE=1 SV=1	262	FISPLTIYHVID
LSSSALAVDKRL	tr|B2XY08|B2XY08_DUVV	1028	sp|Q8TAU3|ZN417_HUMAN Zinc finger protein 417 OS=Homo sapiens OX=9606 GN=ZNF417 PE=1 SV=2	502	LSSSALHVHKRV
LSSSALAVDKRL	tr|B2XY08|B2XY08_DUVV	1028	tr|M0R230|M0R230_HUMAN Zinc finger protein 417 OS=Homo sapiens OX=9606 GN=ZNF417 PE=1 SV=1	501	LSSSALHVHKRV
LSSSALAVDKRL	tr|B2XY08|B2XY08_DUVV	1028	sp|Q96SQ5|ZN587_HUMAN Zinc finger protein 587 OS=Homo sapiens OX=9606 GN=ZNF587 PE=1 SV=1	502	LSSSALHVHKRV
TVGKALLLLPLA	tr|B2XY08|B2XY08_DUVV	691	tr|A0A140T9S5|A0A140T9S5_HUMAN VWA7 OS=Homo sapiens OX=9606 GN=VWA7 PE=1 SV=1	878	TVGGVLLLLGLA
TVGKALLLLPLA	tr|B2XY08|B2XY08_DUVV	691	sp|Q9Y334|VWA7_HUMAN von Willebrand factor A domain-containing protein 7 OS=Homo sapiens OX=9606 GN=VWA7 PE=2 SV=4	878	TVGGVLLLLGLA
TVGKALLLLPLA	tr|B2XY08|B2XY08_DUVV	691	sp|Q8IV16|HDBP1_HUMAN Glycosylphosphatidylinositol-anchored high density lipoprotein-binding protein 1 OS=Homo sapiens OX=9606 GN=GPIHBP1 PE=1 SV=2	163	TVGAALLLNLLA
LSRLLKLISWLV	tr|B2XY08|B2XY08_DUVV	224	sp|Q96RY5|CRML_HUMAN Protein cramped-like OS=Homo sapiens OX=9606 GN=CRAMP1 PE=1 SV=3	730	LSCLLKLISTEV
LDEIFKELSQDF	tr|B2XY05|B2XY05_DUVV	244	sp|P26196|DDX6_HUMAN Probable ATP-dependent RNA helicase DDX6 OS=Homo sapiens OX=9606 GN=DDX6 PE=1 SV=2	245	LDEADKLLSQDF
ISTSFEGLDTSK	tr|B2XY07|B2XY07_DUVV	365	tr|A0A0U1RR27|A0A0U1RR27_HUMAN C-myc promoter-binding protein OS=Homo sapiens OX=9606 GN=DENND4A PE=1 SV=2	1573	ISTSASGLDTSA
ISTSFEGLDTSK	tr|B2XY07|B2XY07_DUVV	365	sp|Q7Z401|MYCPP_HUMAN C-myc promoter-binding protein OS=Homo sapiens OX=9606 GN=DENND4A PE=1 SV=2	1530	ISTSASGLDTSA
RGLSLNDDILQG	tr|B2XY08|B2XY08_DUVV	1478	sp|P08581|MET_HUMAN Hepatocyte growth factor receptor OS=Homo sapiens OX=9606 GN=MET PE=1 SV=4	333	IGASLNDDILFG
RGLSLNDDILQG	tr|B2XY08|B2XY08_DUVV	1478	sp|Q9ULK0|GRID1_HUMAN Glutamate receptor ionotropic, delta-1 OS=Homo sapiens OX=9606 GN=GRID1 PE=2 SV=2	46	SDLSLNDDILQS
RGLSLNDDILQG	tr|B2XY08|B2XY08_DUVV	1478	tr|G3V186|G3V186_HUMAN Glutamate receptor OS=Homo sapiens OX=9606 GN=GRID1 PE=1 SV=1	46	SDLSLNDDILQS
GDPGLLCLPEVS	tr|B2XY07|B2XY07_DUVV	413	tr|H3BVE3|H3BVE3_HUMAN Serine/threonine-protein phosphatase 4 catalytic subunit OS=Homo sapiens OX=9606 GN=PPP4C PE=1 SV=1	44	GDPGLLLSPERS
INPENLLVDLRQ	tr|B2XY08|B2XY08_DUVV	1404	sp|O60229|KALRN_HUMAN Kalirin OS=Homo sapiens OX=9606 GN=KALRN PE=1 SV=3	2804	IKPENLLIDLRI
INPENLLVDLRQ	tr|B2XY08|B2XY08_DUVV	1404	tr|H7BXZ5|H7BXZ5_HUMAN Non-specific serine/threonine protein kinase (Fragment) OS=Homo sapiens OX=9606 GN=KALRN PE=1 SV=1	2773	IKPENLLIDLRI
INPENLLVDLRQ	tr|B2XY08|B2XY08_DUVV	1404	sp|Q86V86|PIM3_HUMAN Serine/threonine-protein kinase pim-3 OS=Homo sapiens OX=9606 GN=PIM3 PE=1 SV=3	171	IKDENLLVDLRS
SGFHAGRSLSVA	tr|B2XXZ9|B2XXZ9_DUVV	216	sp|Q96SU4|OSBL9_HUMAN Oxysterol-binding protein-related protein 9 OS=Homo sapiens OX=9606 GN=OSBPL9 PE=1 SV=2	439	SAFHAGRKGSVA
TTSSVVPYSNLT	tr|B2XY08|B2XY08_DUVV	2110	tr|A0A2R8YFX5|A0A2R8YFX5_HUMAN Neuron navigator 3 OS=Homo sapiens OX=9606 GN=NAV3 PE=1 SV=1	404	TTSSVSSYSNIT
TTSSVVPYSNLT	tr|B2XY08|B2XY08_DUVV	2110	sp|Q8IVL0|NAV3_HUMAN Neuron navigator 3 OS=Homo sapiens OX=9606 GN=NAV3 PE=1 SV=3	904	TTSSVSSYSNIT
KKRLKWISSLHS	tr|B2XY08|B2XY08_DUVV	563	tr|F5GYN0|F5GYN0_HUMAN Protein FAM186A OS=Homo sapiens OX=9606 GN=FAM186A PE=1 SV=1	1953	KKRLAIISSLKS
KKRLKWISSLHS	tr|B2XY08|B2XY08_DUVV	563	sp|A6NE01|F186A_HUMAN Protein FAM186A OS=Homo sapiens OX=9606 GN=FAM186A PE=2 SV=3	1953	KKRLAIISSLKS
HPNISEGASLLE	tr|B2XY08|B2XY08_DUVV	199	sp|Q2KHM9|MOONR_HUMAN Protein moonraker OS=Homo sapiens OX=9606 GN=KIAA0753 PE=1 SV=3	207	HKNISEQKSLLE
HPNISEGASLLE	tr|B2XY08|B2XY08_DUVV	199	tr|I3L3Y0|I3L3Y0_HUMAN Protein moonraker OS=Homo sapiens OX=9606 GN=KIAA0753 PE=1 SV=1	207	HKNISEQKSLLE
HPNISEGASLLE	tr|B2XY08|B2XY08_DUVV	199	tr|I3L2A7|I3L2A7_HUMAN Protein moonraker (Fragment) OS=Homo sapiens OX=9606 GN=KIAA0753 PE=1 SV=1	23	HKNISEQKSLLE
EVKDSLLRKMCL	tr|B2XY08|B2XY08_DUVV	710	tr|D6R9Z7|D6R9Z7_HUMAN Cytochrome c oxidase polypeptide VIIc OS=Homo sapiens OX=9606 GN=COX7C PE=1 SV=1	32	ENKWSLLAKMCL
EVKDSLLRKMCL	tr|B2XY08|B2XY08_DUVV	710	sp|P15954|COX7C_HUMAN Cytochrome c oxidase subunit 7C, mitochondrial OS=Homo sapiens OX=9606 GN=COX7C PE=1 SV=1	32	ENKWSLLAKMCL
EVKDSLLRKMCL	tr|B2XY08|B2XY08_DUVV	710	sp|O95373|IPO7_HUMAN Importin-7 OS=Homo sapiens OX=9606 GN=IPO7 PE=1 SV=1	772	EVKTSELRTMCL
LGIVWLLILLLL	tr|B2XY07|B2XY07_DUVV	476	tr|C9JE84|C9JE84_HUMAN STEAP family member 1B (Fragment) OS=Homo sapiens OX=9606 GN=STEAP1B PE=1 SV=1	222	LGIVGLAILALL
LGIVWLLILLLL	tr|B2XY07|B2XY07_DUVV	476	tr|H7C0D8|H7C0D8_HUMAN Metalloreductase STEAP1 (Fragment) OS=Homo sapiens OX=9606 GN=STEAP1 PE=4 SV=1	41	LGIVGLAILALL
LGIVWLLILLLL	tr|B2XY07|B2XY07_DUVV	476	sp|Q9UHE8|STEA1_HUMAN Metalloreductase STEAP1 OS=Homo sapiens OX=9606 GN=STEAP1 PE=1 SV=1	222	LGIVGLAILALL
LGIVWLLILLLL	tr|B2XY07|B2XY07_DUVV	476	sp|Q6NZ63|STEAL_HUMAN STEAP family member 1B OS=Homo sapiens OX=9606 GN=STEAP1B PE=1 SV=1	203	LGIVGLAILALL
LGIVWLLILLLL	tr|B2XY07|B2XY07_DUVV	476	sp|Q9BZW8|CD244_HUMAN Natural killer cell receptor 2B4 OS=Homo sapiens OX=9606 GN=CD244 PE=1 SV=2	2	LGQVVTLILLLL
ASLNQLKSIDFS	tr|B2XY08|B2XY08_DUVV	1778	tr|A0A2R8Y4Q2|A0A2R8Y4Q2_HUMAN Toll-like receptor 5 (Fragment) OS=Homo sapiens OX=9606 GN=TLR5 PE=1 SV=1	167	GKLNSLKSIDFS
ASLNQLKSIDFS	tr|B2XY08|B2XY08_DUVV	1778	sp|O60602|TLR5_HUMAN Toll-like receptor 5 OS=Homo sapiens OX=9606 GN=TLR5 PE=1 SV=4	167	GKLNSLKSIDFS
ASLNQLKSIDFS	tr|B2XY08|B2XY08_DUVV	1778	tr|A0A2R8Y7Z4|A0A2R8Y7Z4_HUMAN Toll-like receptor 5 OS=Homo sapiens OX=9606 GN=TLR5 PE=1 SV=1	167	GKLNSLKSIDFS
QVGSEYPIPLQV	tr|B2XY08|B2XY08_DUVV	237	sp|Q70EL1|UBP54_HUMAN Inactive ubiquitin carboxyl-terminal hydrolase 54 OS=Homo sapiens OX=9606 GN=USP54 PE=1 SV=4	890	QPTSEQPIPLQV
YTSDRQGDPDSV	tr|B2XY06|B2XY06_DUVV	95	sp|Q96MT8|CEP63_HUMAN Centrosomal protein of 63 kDa OS=Homo sapiens OX=9606 GN=CEP63 PE=1 SV=1	321	YTSQGQGDLDSV
ENPTADQFLTTL	tr|B2XY08|B2XY08_DUVV	1953	tr|F5GXC5|F5GXC5_HUMAN T-cell immunomodulatory protein OS=Homo sapiens OX=9606 GN=ITFG1 PE=1 SV=1	101	EDFTADLFLTTL
ENPTADQFLTTL	tr|B2XY08|B2XY08_DUVV	1953	sp|Q8TB96|TIP_HUMAN T-cell immunomodulatory protein OS=Homo sapiens OX=9606 GN=ITFG1 PE=1 SV=1	214	EDFTADLFLTTL
STSFEGLDTSKL	tr|B2XY07|B2XY07_DUVV	366	tr|A0A0U1RR27|A0A0U1RR27_HUMAN C-myc promoter-binding protein OS=Homo sapiens OX=9606 GN=DENND4A PE=1 SV=2	1574	STSASGLDTSAL
STSFEGLDTSKL	tr|B2XY07|B2XY07_DUVV	366	sp|Q7Z401|MYCPP_HUMAN C-myc promoter-binding protein OS=Homo sapiens OX=9606 GN=DENND4A PE=1 SV=2	1531	STSASGLDTSAL
QASHSREELEQY	tr|B2XY08|B2XY08_DUVV	1851	sp|O95602|RPA1_HUMAN DNA-directed RNA polymerase I subunit RPA1 OS=Homo sapiens OX=9606 GN=POLR1A PE=1 SV=2	153	SASEIREELEQY
QASHSREELEQY	tr|B2XY08|B2XY08_DUVV	1851	tr|B9ZVN9|B9ZVN9_HUMAN DNA-directed RNA polymerase subunit OS=Homo sapiens OX=9606 GN=POLR1A PE=1 SV=1	153	SASEIREELEQY
PRGLSLNDDILQ	tr|B2XY08|B2XY08_DUVV	1477	sp|Q9ULK0|GRID1_HUMAN Glutamate receptor ionotropic, delta-1 OS=Homo sapiens OX=9606 GN=GRID1 PE=2 SV=2	45	VSDLSLNDDILQ
PRGLSLNDDILQ	tr|B2XY08|B2XY08_DUVV	1477	tr|G3V186|G3V186_HUMAN Glutamate receptor OS=Homo sapiens OX=9606 GN=GRID1 PE=1 SV=1	45	VSDLSLNDDILQ
SLNDDILQGIVG	tr|B2XY08|B2XY08_DUVV	1481	sp|Q5SZK8|FREM2_HUMAN FRAS1-related extracellular matrix protein 2 OS=Homo sapiens OX=9606 GN=FREM2 PE=1 SV=2	1097	SLNDDILCTIVI
LSLNDDILQGIV	tr|B2XY08|B2XY08_DUVV	1480	sp|Q9ULK0|GRID1_HUMAN Glutamate receptor ionotropic, delta-1 OS=Homo sapiens OX=9606 GN=GRID1 PE=2 SV=2	48	LSLNDDILQSEK
LSLNDDILQGIV	tr|B2XY08|B2XY08_DUVV	1480	tr|G3V186|G3V186_HUMAN Glutamate receptor OS=Homo sapiens OX=9606 GN=GRID1 PE=1 SV=1	48	LSLNDDILQSEK
LSLNDDILQGIV	tr|B2XY08|B2XY08_DUVV	1480	sp|Q5SZK8|FREM2_HUMAN FRAS1-related extracellular matrix protein 2 OS=Homo sapiens OX=9606 GN=FREM2 PE=1 SV=2	1096	DSLNDDILCTIV
TYLAMPLEKGYS	tr|B2XXZ9|B2XXZ9_DUVV	32	tr|A0A286YEZ9|A0A286YEZ9_HUMAN Protein furry homolog-like (Fragment) OS=Homo sapiens OX=9606 GN=FRYL PE=1 SV=1	731	TYLAELLEKGLS
TYLAMPLEKGYS	tr|B2XXZ9|B2XXZ9_DUVV	32	tr|H0Y9X0|H0Y9X0_HUMAN Protein furry homolog-like (Fragment) OS=Homo sapiens OX=9606 GN=FRYL PE=1 SV=1	1054	TYLAELLEKGLS
TYLAMPLEKGYS	tr|B2XXZ9|B2XXZ9_DUVV	32	tr|A0A2C9F2R7|A0A2C9F2R7_HUMAN Protein furry homolog-like (Fragment) OS=Homo sapiens OX=9606 GN=FRYL PE=1 SV=1	893	TYLAELLEKGLS
TYLAMPLEKGYS	tr|B2XXZ9|B2XXZ9_DUVV	32	sp|O94915|FRYL_HUMAN Protein furry homolog-like OS=Homo sapiens OX=9606 GN=FRYL PE=1 SV=2	2184	TYLAELLEKGLS
APFLLTFSTLTS	tr|B2XY08|B2XY08_DUVV	606	sp|Q8WW34|TM239_HUMAN Transmembrane protein 239 OS=Homo sapiens OX=9606 GN=TMEM239 PE=1 SV=3	165	ASFLLLFSTLLS
KTEKYSPEERIY	tr|B2XY07|B2XY07_DUVV	72	tr|H7C3M9|H7C3M9_HUMAN Protein FAM228A (Fragment) OS=Homo sapiens OX=9606 GN=FAM228A PE=3 SV=1	167	KTYKYSPEKLIY
KTEKYSPEERIY	tr|B2XY07|B2XY07_DUVV	72	tr|H7C4B8|H7C4B8_HUMAN Protein FAM228A (Fragment) OS=Homo sapiens OX=9606 GN=FAM228A PE=3 SV=1	30	KTYKYSPEKLIY
KTEKYSPEERIY	tr|B2XY07|B2XY07_DUVV	72	sp|Q86W67|F228A_HUMAN Protein FAM228A OS=Homo sapiens OX=9606 GN=FAM228A PE=1 SV=1	129	KTYKYSPEKLIY
AVREGTSSLLEC	tr|B2XY08|B2XY08_DUVV	481	sp|Q96RW7|HMCN1_HUMAN Hemicentin-1 OS=Homo sapiens OX=9606 GN=HMCN1 PE=1 SV=2	3070	NVREGTSVSLEC
GLSSSALAVDKR	tr|B2XY08|B2XY08_DUVV	1027	sp|Q8TAU3|ZN417_HUMAN Zinc finger protein 417 OS=Homo sapiens OX=9606 GN=ZNF417 PE=1 SV=2	501	FLSSSALHVHKR
GLSSSALAVDKR	tr|B2XY08|B2XY08_DUVV	1027	tr|M0R230|M0R230_HUMAN Zinc finger protein 417 OS=Homo sapiens OX=9606 GN=ZNF417 PE=1 SV=1	500	FLSSSALHVHKR
GLSSSALAVDKR	tr|B2XY08|B2XY08_DUVV	1027	sp|Q96SQ5|ZN587_HUMAN Zinc finger protein 587 OS=Homo sapiens OX=9606 GN=ZNF587 PE=1 SV=1	501	FLSSSALHVHKR
SYWLVSFTLSDR	tr|B2XY08|B2XY08_DUVV	1837	sp|Q9P2P5|HECW2_HUMAN E3 ubiquitin-protein ligase HECW2 OS=Homo sapiens OX=9606 GN=HECW2 PE=1 SV=2	181	SRKLVSFTLSDL
SYWLVSFTLSDR	tr|B2XY08|B2XY08_DUVV	1837	tr|A0A2R8Y6F3|A0A2R8Y6F3_HUMAN HECT-type E3 ubiquitin transferase OS=Homo sapiens OX=9606 GN=HECW2 PE=1 SV=1	181	SRKLVSFTLSDL
EIVDEKGLRSKV	tr|B2XY07|B2XY07_DUVV	246	sp|Q8IUG5|MY18B_HUMAN Unconventional myosin-XVIIIb OS=Homo sapiens OX=9606 GN=MYO18B PE=1 SV=2	1619	ESVFEKGLREKV
DRDLLNSKRALG	tr|B2XY08|B2XY08_DUVV	1496	sp|Q9HA90|EFCC1_HUMAN EF-hand and coiled-coil domain-containing protein 1 OS=Homo sapiens OX=9606 GN=EFCC1 PE=2 SV=2	527	LRDLNISKRALG
ASHSREELEQYI	tr|B2XY08|B2XY08_DUVV	1852	sp|O95602|RPA1_HUMAN DNA-directed RNA polymerase I subunit RPA1 OS=Homo sapiens OX=9606 GN=POLR1A PE=1 SV=2	154	ASEIREELEQYT
ASHSREELEQYI	tr|B2XY08|B2XY08_DUVV	1852	tr|B9ZVN9|B9ZVN9_HUMAN DNA-directed RNA polymerase subunit OS=Homo sapiens OX=9606 GN=POLR1A PE=1 SV=1	154	ASEIREELEQYT
QFLTTLDQNRSK	tr|B2XY08|B2XY08_DUVV	1959	sp|Q8IUD2|RB6I2_HUMAN ELKS/Rab6-interacting/CAST family member 1 OS=Homo sapiens OX=9606 GN=ERC1 PE=1 SV=1	1011	QPLLELDQNRSK
QFLTTLDQNRSK	tr|B2XY08|B2XY08_DUVV	1959	tr|X6RLX0|X6RLX0_HUMAN ELKS/Rab6-interacting/CAST family member 1 OS=Homo sapiens OX=9606 GN=ERC1 PE=1 SV=1	1015	QPLLELDQNRSK
QFLTTLDQNRSK	tr|B2XY08|B2XY08_DUVV	1959	tr|G8JLD3|G8JLD3_HUMAN ELKS/Rab6-interacting/CAST family member 1 OS=Homo sapiens OX=9606 GN=ERC1 PE=1 SV=1	1011	QPLLELDQNRSK
QFLTTLDQNRSK	tr|B2XY08|B2XY08_DUVV	1959	tr|K7EP25|K7EP25_HUMAN ELKS/Rab6-interacting/CAST family member 1 (Fragment) OS=Homo sapiens OX=9606 GN=ERC1 PE=1 SV=1	22	QPLLELDQNRSK
GVSLFFSPSDSA	tr|B2XY08|B2XY08_DUVV	1871	tr|I3L2E8|I3L2E8_HUMAN Leucine-rich repeat-containing protein 59 (Fragment) OS=Homo sapiens OX=9606 GN=LRRC59 PE=4 SV=1	21	RVSLFPGPSDSA
KSFDDQEERGLA	tr|B2XY08|B2XY08_DUVV	1738	sp|Q13315|ATM_HUMAN Serine-protein kinase ATM OS=Homo sapiens OX=9606 GN=ATM PE=1 SV=4	1965	KSMDDQEKRSLA
SRSSSRYFLWDT	tr|B2XY08|B2XY08_DUVV	520	tr|C9J417|C9J417_HUMAN Bcl-2-like protein 11 (Fragment) OS=Homo sapiens OX=9606 GN=BCL2L11 PE=1 SV=1	90	SRSSSGYFSFDT
SRSSSRYFLWDT	tr|B2XY08|B2XY08_DUVV	520	sp|O43521|B2L11_HUMAN Bcl-2-like protein 11 OS=Homo sapiens OX=9606 GN=BCL2L11 PE=1 SV=1	90	SRSSSGYFSFDT
RISTSFEGLDTS	tr|B2XY07|B2XY07_DUVV	364	tr|A0A0U1RR27|A0A0U1RR27_HUMAN C-myc promoter-binding protein OS=Homo sapiens OX=9606 GN=DENND4A PE=1 SV=2	1572	CISTSASGLDTS
RISTSFEGLDTS	tr|B2XY07|B2XY07_DUVV	364	sp|Q7Z401|MYCPP_HUMAN C-myc promoter-binding protein OS=Homo sapiens OX=9606 GN=DENND4A PE=1 SV=2	1529	CISTSASGLDTS
SSALAVDKRLHS	tr|B2XY08|B2XY08_DUVV	1030	sp|Q8TAU3|ZN417_HUMAN Zinc finger protein 417 OS=Homo sapiens OX=9606 GN=ZNF417 PE=1 SV=2	504	SSALHVHKRVHS
SSALAVDKRLHS	tr|B2XY08|B2XY08_DUVV	1030	tr|M0R230|M0R230_HUMAN Zinc finger protein 417 OS=Homo sapiens OX=9606 GN=ZNF417 PE=1 SV=1	503	SSALHVHKRVHS
SSALAVDKRLHS	tr|B2XY08|B2XY08_DUVV	1030	sp|Q96SQ5|ZN587_HUMAN Zinc finger protein 587 OS=Homo sapiens OX=9606 GN=ZNF587 PE=1 SV=1	504	SSALHVHKRVHS
VKDSLLRKMCLQ	tr|B2XY08|B2XY08_DUVV	711	sp|O15397|IPO8_HUMAN Importin-8 OS=Homo sapiens OX=9606 GN=IPO8 PE=1 SV=2	773	VKTSELRTMCLQ
VKDSLLRKMCLQ	tr|B2XY08|B2XY08_DUVV	711	sp|O95373|IPO7_HUMAN Importin-7 OS=Homo sapiens OX=9606 GN=IPO7 PE=1 SV=1	773	VKTSELRTMCLQ
GMIVAQAVVVLS	tr|B2XY05|B2XY05_DUVV	16	tr|J3QQM9|J3QQM9_HUMAN Secernin-2 (Fragment) OS=Homo sapiens OX=9606 GN=SCRN2 PE=1 SV=1	188	GMGVAQAPQVLS
GMIVAQAVVVLS	tr|B2XY05|B2XY05_DUVV	16	tr|J3QL71|J3QL71_HUMAN Secernin-2 OS=Homo sapiens OX=9606 GN=SCRN2 PE=1 SV=1	330	GMGVAQAPQVLS
GMIVAQAVVVLS	tr|B2XY05|B2XY05_DUVV	16	sp|Q96FV2|SCRN2_HUMAN Secernin-2 OS=Homo sapiens OX=9606 GN=SCRN2 PE=1 SV=3	322	GMGVAQAPQVLS
SSSALAVDKRLH	tr|B2XY08|B2XY08_DUVV	1029	sp|Q8TAU3|ZN417_HUMAN Zinc finger protein 417 OS=Homo sapiens OX=9606 GN=ZNF417 PE=1 SV=2	503	SSSALHVHKRVH
SSSALAVDKRLH	tr|B2XY08|B2XY08_DUVV	1029	tr|M0R230|M0R230_HUMAN Zinc finger protein 417 OS=Homo sapiens OX=9606 GN=ZNF417 PE=1 SV=1	502	SSSALHVHKRVH
SSSALAVDKRLH	tr|B2XY08|B2XY08_DUVV	1029	sp|Q96SQ5|ZN587_HUMAN Zinc finger protein 587 OS=Homo sapiens OX=9606 GN=ZNF587 PE=1 SV=1	503	SSSALHVHKRVH
SELILAGGSEEG	tr|B2XY07|B2XY07_DUVV	449	tr|K7EPD9|K7EPD9_HUMAN Gastric inhibitory polypeptide receptor OS=Homo sapiens OX=9606 GN=GIPR PE=4 SV=1	243	SLLVLVGGSEEG
SELILAGGSEEG	tr|B2XY07|B2XY07_DUVV	449	tr|A0A494C077|A0A494C077_HUMAN Gastric inhibitory polypeptide receptor OS=Homo sapiens OX=9606 GN=GIPR PE=4 SV=1	182	SLLVLVGGSEEG
SELILAGGSEEG	tr|B2XY07|B2XY07_DUVV	449	sp|P48546|GIPR_HUMAN Gastric inhibitory polypeptide receptor OS=Homo sapiens OX=9606 GN=GIPR PE=1 SV=1	243	SLLVLVGGSEEG
DEIFKELSQDFI	tr|B2XY05|B2XY05_DUVV	245	sp|Q7RTW8|OTOAN_HUMAN Otoancorin OS=Homo sapiens OX=9606 GN=OTOA PE=1 SV=1	1061	DEIFKELSAEQI
ELSFLQFKLGSL	tr|B2XY08|B2XY08_DUVV	1364	tr|K7EQ71|K7EQ71_HUMAN Periplakin (Fragment) OS=Homo sapiens OX=9606 GN=PPL PE=1 SV=1	511	ELSFLQDKLKRL
ELSFLQFKLGSL	tr|B2XY08|B2XY08_DUVV	1364	sp|O60437|PEPL_HUMAN Periplakin OS=Homo sapiens OX=9606 GN=PPL PE=1 SV=4	1090	ELSFLQDKLKRL
ELSFLQFKLGSL	tr|B2XY08|B2XY08_DUVV	1364	tr|K7EKI8|K7EKI8_HUMAN Periplakin OS=Homo sapiens OX=9606 GN=PPL PE=1 SV=1	1088	ELSFLQDKLKRL
SLNQLKSIDFSI	tr|B2XY08|B2XY08_DUVV	1779	tr|A0A2R8Y4Q2|A0A2R8Y4Q2_HUMAN Toll-like receptor 5 (Fragment) OS=Homo sapiens OX=9606 GN=TLR5 PE=1 SV=1	168	KLNSLKSIDFSS
SLNQLKSIDFSI	tr|B2XY08|B2XY08_DUVV	1779	sp|O60602|TLR5_HUMAN Toll-like receptor 5 OS=Homo sapiens OX=9606 GN=TLR5 PE=1 SV=4	168	KLNSLKSIDFSS
SLNQLKSIDFSI	tr|B2XY08|B2XY08_DUVV	1779	tr|A0A2R8Y7Z4|A0A2R8Y7Z4_HUMAN Toll-like receptor 5 OS=Homo sapiens OX=9606 GN=TLR5 PE=1 SV=1	168	KLNSLKSIDFSS
IVAQAVVVLSGA	tr|B2XY05|B2XY05_DUVV	18	tr|A0A3B3IRI1|A0A3B3IRI1_HUMAN Mannosyl-oligosaccharide glucosidase OS=Homo sapiens OX=9606 GN=MOGS PE=1 SV=1	43	GVALAVVVLSLA
IVAQAVVVLSGA	tr|B2XY05|B2XY05_DUVV	18	tr|A0A3B3IRK6|A0A3B3IRK6_HUMAN Mannosyl-oligosaccharide glucosidase (Fragment) OS=Homo sapiens OX=9606 GN=MOGS PE=1 SV=1	15	GVALAVVVLSLA
IVAQAVVVLSGA	tr|B2XY05|B2XY05_DUVV	18	tr|B8ZZE2|B8ZZE2_HUMAN Mannosyl-oligosaccharide glucosidase OS=Homo sapiens OX=9606 GN=MOGS PE=1 SV=1	43	GVALAVVVLSLA
IVAQAVVVLSGA	tr|B2XY05|B2XY05_DUVV	18	tr|A0A3B3ITC1|A0A3B3ITC1_HUMAN Mannosyl-oligosaccharide glucosidase OS=Homo sapiens OX=9606 GN=MOGS PE=1 SV=1	43	GVALAVVVLSLA
IVAQAVVVLSGA	tr|B2XY05|B2XY05_DUVV	18	sp|Q13724|MOGS_HUMAN Mannosyl-oligosaccharide glucosidase OS=Homo sapiens OX=9606 GN=MOGS PE=1 SV=5	43	GVALAVVVLSLA
IVAQAVVVLSGA	tr|B2XY05|B2XY05_DUVV	18	tr|A0A3B3ITU6|A0A3B3ITU6_HUMAN Mannosyl-oligosaccharide glucosidase (Fragment) OS=Homo sapiens OX=9606 GN=MOGS PE=1 SV=1	43	GVALAVVVLSLA
IVAQAVVVLSGA	tr|B2XY05|B2XY05_DUVV	18	tr|A0A3B3IS52|A0A3B3IS52_HUMAN Mannosyl-oligosaccharide glucosidase (Fragment) OS=Homo sapiens OX=9606 GN=MOGS PE=1 SV=1	43	GVALAVVVLSLA
IVAQAVVVLSGA	tr|B2XY05|B2XY05_DUVV	18	tr|B4E3B8|B4E3B8_HUMAN Mannosyl-oligosaccharide glucosidase OS=Homo sapiens OX=9606 GN=MOGS PE=1 SV=1	43	GVALAVVVLSLA
GLSLNDDILQGI	tr|B2XY08|B2XY08_DUVV	1479	sp|Q9ULK0|GRID1_HUMAN Glutamate receptor ionotropic, delta-1 OS=Homo sapiens OX=9606 GN=GRID1 PE=2 SV=2	47	DLSLNDDILQSE
GLSLNDDILQGI	tr|B2XY08|B2XY08_DUVV	1479	tr|G3V186|G3V186_HUMAN Glutamate receptor OS=Homo sapiens OX=9606 GN=GRID1 PE=1 SV=1	47	DLSLNDDILQSE
GLSLNDDILQGI	tr|B2XY08|B2XY08_DUVV	1479	sp|P08581|MET_HUMAN Hepatocyte growth factor receptor OS=Homo sapiens OX=9606 GN=MET PE=1 SV=4	334	GASLNDDILFGV
MSYWLVSFTLSD	tr|B2XY08|B2XY08_DUVV	1836	sp|Q9P2P5|HECW2_HUMAN E3 ubiquitin-protein ligase HECW2 OS=Homo sapiens OX=9606 GN=HECW2 PE=1 SV=2	180	HSRKLVSFTLSD
MSYWLVSFTLSD	tr|B2XY08|B2XY08_DUVV	1836	tr|A0A2R8Y6F3|A0A2R8Y6F3_HUMAN HECT-type E3 ubiquitin transferase OS=Homo sapiens OX=9606 GN=HECW2 PE=1 SV=1	180	HSRKLVSFTLSD
DSTPRGIDYYLR	tr|B2XY08|B2XY08_DUVV	272	sp|A4D0V7|CPED1_HUMAN Cadherin-like and PC-esterase domain-containing protein 1 OS=Homo sapiens OX=9606 GN=CPED1 PE=2 SV=1	776	DSTNRGIMYYLI
SLFFSPSDSAAF	tr|B2XY08|B2XY08_DUVV	1873	tr|I3L2E8|I3L2E8_HUMAN Leucine-rich repeat-containing protein 59 (Fragment) OS=Homo sapiens OX=9606 GN=LRRC59 PE=4 SV=1	23	SLFPGPSDSAWF
LGPLIVFHLRKK	tr|B2XY08|B2XY08_DUVV	33	sp|Q8N7X8|SIGL1_HUMAN SIGLEC family-like protein 1 OS=Homo sapiens OX=9606 GN=SIGLECL1 PE=1 SV=1	133	LLPLIVKHIRKK
LGPLIVFHLRKK	tr|B2XY08|B2XY08_DUVV	33	tr|B7ZLS6|B7ZLS6_HUMAN FLJ40235 protein OS=Homo sapiens OX=9606 GN=SIGLECL1 PE=2 SV=1	39	LLPLIVKHIRKK
KINPENLLVDLR	tr|B2XY08|B2XY08_DUVV	1403	sp|O60229|KALRN_HUMAN Kalirin OS=Homo sapiens OX=9606 GN=KALRN PE=1 SV=3	2803	DIKPENLLIDLR
KINPENLLVDLR	tr|B2XY08|B2XY08_DUVV	1403	tr|H7BXZ5|H7BXZ5_HUMAN Non-specific serine/threonine protein kinase (Fragment) OS=Homo sapiens OX=9606 GN=KALRN PE=1 SV=1	2772	DIKPENLLIDLR
KINPENLLVDLR	tr|B2XY08|B2XY08_DUVV	1403	sp|Q86V86|PIM3_HUMAN Serine/threonine-protein kinase pim-3 OS=Homo sapiens OX=9606 GN=PIM3 PE=1 SV=3	170	DIKDENLLVDLR
LLILLLLPYESP	tr|B2XY07|B2XY07_DUVV	481	sp|Q5TIA1|MEI1_HUMAN Meiosis inhibitor protein 1 OS=Homo sapiens OX=9606 GN=MEI1 PE=2 SV=2	844	LLILLDLIYSSP
VAQAVVVLSGAD	tr|B2XY05|B2XY05_DUVV	19	tr|A0A3B3IRI1|A0A3B3IRI1_HUMAN Mannosyl-oligosaccharide glucosidase OS=Homo sapiens OX=9606 GN=MOGS PE=1 SV=1	44	VALAVVVLSLAL
VAQAVVVLSGAD	tr|B2XY05|B2XY05_DUVV	19	tr|A0A3B3IRK6|A0A3B3IRK6_HUMAN Mannosyl-oligosaccharide glucosidase (Fragment) OS=Homo sapiens OX=9606 GN=MOGS PE=1 SV=1	16	VALAVVVLSLAL
VAQAVVVLSGAD	tr|B2XY05|B2XY05_DUVV	19	tr|B8ZZE2|B8ZZE2_HUMAN Mannosyl-oligosaccharide glucosidase OS=Homo sapiens OX=9606 GN=MOGS PE=1 SV=1	44	VALAVVVLSLAL
VAQAVVVLSGAD	tr|B2XY05|B2XY05_DUVV	19	tr|A0A3B3ITC1|A0A3B3ITC1_HUMAN Mannosyl-oligosaccharide glucosidase OS=Homo sapiens OX=9606 GN=MOGS PE=1 SV=1	44	VALAVVVLSLAL
VAQAVVVLSGAD	tr|B2XY05|B2XY05_DUVV	19	sp|Q13724|MOGS_HUMAN Mannosyl-oligosaccharide glucosidase OS=Homo sapiens OX=9606 GN=MOGS PE=1 SV=5	44	VALAVVVLSLAL
VAQAVVVLSGAD	tr|B2XY05|B2XY05_DUVV	19	tr|A0A3B3ITU6|A0A3B3ITU6_HUMAN Mannosyl-oligosaccharide glucosidase (Fragment) OS=Homo sapiens OX=9606 GN=MOGS PE=1 SV=1	44	VALAVVVLSLAL
VAQAVVVLSGAD	tr|B2XY05|B2XY05_DUVV	19	tr|A0A3B3IS52|A0A3B3IS52_HUMAN Mannosyl-oligosaccharide glucosidase (Fragment) OS=Homo sapiens OX=9606 GN=MOGS PE=1 SV=1	44	VALAVVVLSLAL
VAQAVVVLSGAD	tr|B2XY05|B2XY05_DUVV	19	tr|B4E3B8|B4E3B8_HUMAN Mannosyl-oligosaccharide glucosidase OS=Homo sapiens OX=9606 GN=MOGS PE=1 SV=1	44	VALAVVVLSLAL
VLSGADEIQAIG	tr|B2XY05|B2XY05_DUVV	25	tr|E9PMD4|E9PMD4_HUMAN FACT complex subunit SSRP1 (Fragment) OS=Homo sapiens OX=9606 GN=SSRP1 PE=1 SV=2	88	VLSKADVIQATG
VLSGADEIQAIG	tr|B2XY05|B2XY05_DUVV	25	sp|Q08945|SSRP1_HUMAN FACT complex subunit SSRP1 OS=Homo sapiens OX=9606 GN=SSRP1 PE=1 SV=1	185	VLSKADVIQATG
VSLFFSPSDSAA	tr|B2XY08|B2XY08_DUVV	1872	tr|I3L2E8|I3L2E8_HUMAN Leucine-rich repeat-containing protein 59 (Fragment) OS=Homo sapiens OX=9606 GN=LRRC59 PE=4 SV=1	22	VSLFPGPSDSAW
SKPTPVNLSNSL	tr|B2XY08|B2XY08_DUVV	896	sp|Q7Z443|PK1L3_HUMAN Polycystic kidney disease protein 1-like 3 OS=Homo sapiens OX=9606 GN=PKD1L3 PE=1 SV=1	318	SKPAQVNLINSL
SDSTPRGIDYYL	tr|B2XY08|B2XY08_DUVV	271	sp|A4D0V7|CPED1_HUMAN Cadherin-like and PC-esterase domain-containing protein 1 OS=Homo sapiens OX=9606 GN=CPED1 PE=2 SV=1	775	GDSTNRGIMYYL
SVRFVRVARTTS	tr|B2XY08|B2XY08_DUVV	2101	tr|D6REP2|D6REP2_HUMAN F-box only protein 4 OS=Homo sapiens OX=9606 GN=FBXO4 PE=1 SV=1	37	SVSKERVARTTS
SVRFVRVARTTS	tr|B2XY08|B2XY08_DUVV	2101	sp|Q9UKT5|FBX4_HUMAN F-box only protein 4 OS=Homo sapiens OX=9606 GN=FBXO4 PE=1 SV=2	37	SVSKERVARTTS
SVRFVRVARTTS	tr|B2XY08|B2XY08_DUVV	2101	tr|D6RAJ6|D6RAJ6_HUMAN F-box only protein 4 OS=Homo sapiens OX=9606 GN=FBXO4 PE=1 SV=1	37	SVSKERVARTTS
SVRFVRVARTTS	tr|B2XY08|B2XY08_DUVV	2101	tr|D6RAU6|D6RAU6_HUMAN F-box only protein 4 OS=Homo sapiens OX=9606 GN=FBXO4 PE=1 SV=1	37	SVSKERVARTTS
RDLLNSKRALGH	tr|B2XY08|B2XY08_DUVV	1497	sp|Q9HA90|EFCC1_HUMAN EF-hand and coiled-coil domain-containing protein 1 OS=Homo sapiens OX=9606 GN=EFCC1 PE=2 SV=2	528	RDLNISKRALGK
LNQLKSIDFSII	tr|B2XY08|B2XY08_DUVV	1780	tr|A0A2R8Y4Q2|A0A2R8Y4Q2_HUMAN Toll-like receptor 5 (Fragment) OS=Homo sapiens OX=9606 GN=TLR5 PE=1 SV=1	169	LNSLKSIDFSSN
LNQLKSIDFSII	tr|B2XY08|B2XY08_DUVV	1780	sp|O60602|TLR5_HUMAN Toll-like receptor 5 OS=Homo sapiens OX=9606 GN=TLR5 PE=1 SV=4	169	LNSLKSIDFSSN
LNQLKSIDFSII	tr|B2XY08|B2XY08_DUVV	1780	tr|A0A2R8Y7Z4|A0A2R8Y7Z4_HUMAN Toll-like receptor 5 OS=Homo sapiens OX=9606 GN=TLR5 PE=1 SV=1	169	LNSLKSIDFSSN
VREGTSSLLECS	tr|B2XY08|B2XY08_DUVV	482	sp|Q96RW7|HMCN1_HUMAN Hemicentin-1 OS=Homo sapiens OX=9606 GN=HMCN1 PE=1 SV=2	3071	VREGTSVSLECE
LVVLMTLFVFLN	tr|B2XY08|B2XY08_DUVV	385	tr|H7C2Z8|H7C2Z8_HUMAN Rho GTPase-activating protein 4 (Fragment) OS=Homo sapiens OX=9606 GN=ARHGAP4 PE=1 SV=8	118	LVVLRYLFTFLN
LVVLMTLFVFLN	tr|B2XY08|B2XY08_DUVV	385	tr|E7EQN5|E7EQN5_HUMAN Rho GTPase-activating protein 4 OS=Homo sapiens OX=9606 GN=ARHGAP4 PE=1 SV=1	608	LVVLRYLFTFLN
LVVLMTLFVFLN	tr|B2XY08|B2XY08_DUVV	385	sp|P98171|RHG04_HUMAN Rho GTPase-activating protein 4 OS=Homo sapiens OX=9606 GN=ARHGAP4 PE=1 SV=2	629	LVVLRYLFTFLN
LVVLMTLFVFLN	tr|B2XY08|B2XY08_DUVV	385	tr|E9PCM6|E9PCM6_HUMAN Rho GTPase-activating protein 4 OS=Homo sapiens OX=9606 GN=ARHGAP4 PE=1 SV=1	451	LVVLRYLFTFLN
LVVLMTLFVFLN	tr|B2XY08|B2XY08_DUVV	385	tr|H7C3K8|H7C3K8_HUMAN Rho GTPase-activating protein 4 (Fragment) OS=Homo sapiens OX=9606 GN=ARHGAP4 PE=1 SV=1	129	LVVLRYLFTFLN
