query	query_seqname	query_start	target_seqname	target_start	target
LLVDELRYRRSP	sp|Q88434|L_PIV5	2022	tr|J3KQ26|J3KQ26_HUMAN Armadillo repeat-containing protein 5 OS=Homo sapiens OX=9606 GN=ARMC5 PE=1 SV=1	421	VLVDELRQRRDP
LLVDELRYRRSP	sp|Q88434|L_PIV5	2022	sp|Q96C12|ARMC5_HUMAN Armadillo repeat-containing protein 5 OS=Homo sapiens OX=9606 GN=ARMC5 PE=1 SV=2	326	VLVDELRQRRDP
LLVDELRYRRSP	sp|Q88434|L_PIV5	2022	sp|Q4AC94|C2CD3_HUMAN C2 domain-containing protein 3 OS=Homo sapiens OX=9606 GN=C2CD3 PE=1 SV=4	1174	LLDVGLRYRRSP
GIGTEEPEALNL	sp|P11208|PHOSP_PIV5	104	tr|A0A087X080|A0A087X080_HUMAN Ryanodine receptor 3 OS=Homo sapiens OX=9606 GN=RYR3 PE=1 SV=1	564	CILTESPEALNL
GIGTEEPEALNL	sp|P11208|PHOSP_PIV5	104	sp|Q15413|RYR3_HUMAN Ryanodine receptor 3 OS=Homo sapiens OX=9606 GN=RYR3 PE=1 SV=3	564	CILTESPEALNL
GIGTEEPEALNL	sp|P11208|PHOSP_PIV5	104	tr|A0A0X1KG73|A0A0X1KG73_HUMAN Ryanodine receptor 3 OS=Homo sapiens OX=9606 GN=RYR3 PE=1 SV=1	564	CILTESPEALNL
GIGTEEPEALNL	sp|P11208|PHOSP_PIV5	104	tr|A0A0U1RRH1|A0A0U1RRH1_HUMAN Ryanodine receptor 3 OS=Homo sapiens OX=9606 GN=RYR3 PE=1 SV=1	564	CILTESPEALNL
FVSYESIAVSLL	sp|Q88435|NCAP_PIV5	327	tr|A0A2I3JL00|A0A2I3JL00_HUMAN Major facilitator superfamily domain-containing protein 2B OS=Homo sapiens OX=9606 GN=MFSD2B PE=1 SV=1	376	FVSGVSIAVSLL
FVSYESIAVSLL	sp|Q88435|NCAP_PIV5	327	sp|A6NFX1|MFS2B_HUMAN Major facilitator superfamily domain-containing protein 2B OS=Homo sapiens OX=9606 GN=MFSD2B PE=1 SV=4	376	FVSGVSIAVSLL
FVSYESIAVSLL	sp|Q88435|NCAP_PIV5	327	tr|A0A590UK14|A0A590UK14_HUMAN Major facilitator superfamily domain-containing protein 2B OS=Homo sapiens OX=9606 GN=MFSD2B PE=1 SV=1	404	FVSGVSIAVSLL
IGTEEPEALNLS	sp|P11208|PHOSP_PIV5	105	tr|A0A087X080|A0A087X080_HUMAN Ryanodine receptor 3 OS=Homo sapiens OX=9606 GN=RYR3 PE=1 SV=1	565	ILTESPEALNLI
IGTEEPEALNLS	sp|P11208|PHOSP_PIV5	105	sp|Q15413|RYR3_HUMAN Ryanodine receptor 3 OS=Homo sapiens OX=9606 GN=RYR3 PE=1 SV=3	565	ILTESPEALNLI
IGTEEPEALNLS	sp|P11208|PHOSP_PIV5	105	tr|A0A0X1KG73|A0A0X1KG73_HUMAN Ryanodine receptor 3 OS=Homo sapiens OX=9606 GN=RYR3 PE=1 SV=1	565	ILTESPEALNLI
IGTEEPEALNLS	sp|P11208|PHOSP_PIV5	105	tr|A0A0U1RRH1|A0A0U1RRH1_HUMAN Ryanodine receptor 3 OS=Homo sapiens OX=9606 GN=RYR3 PE=1 SV=1	565	ILTESPEALNLI
NTYTLSNTFHLP	sp|P04850|HN_PIV5	326	sp|Q99062|CSF3R_HUMAN Granulocyte colony-stimulating factor receptor OS=Homo sapiens OX=9606 GN=CSF3R PE=1 SV=1	389	NTTELSCTFHLP
ALRSQLAEQSAL	sp|Q88435|NCAP_PIV5	310	sp|Q9UNA0|ATS5_HUMAN A disintegrin and metalloproteinase with thrombospondin motifs 5 OS=Homo sapiens OX=9606 GN=ADAMTS5 PE=1 SV=2	233	ALASQLLDQSAL
VATSEVLFNTDR	sp|P04850|HN_PIV5	314	sp|Q9BRB3|PIGQ_HUMAN Phosphatidylinositol N-acetylglucosaminyltransferase subunit Q OS=Homo sapiens OX=9606 GN=PIGQ PE=1 SV=3	169	VARSEVLFRSDR
VATSEVLFNTDR	sp|P04850|HN_PIV5	314	tr|E7ERP4|E7ERP4_HUMAN Phosphatidylinositol N-acetylglucosaminyltransferase subunit Q OS=Homo sapiens OX=9606 GN=PIGQ PE=1 SV=1	183	VARSEVLFRSDR
VATSEVLFNTDR	sp|P04850|HN_PIV5	314	tr|B8ZZ31|B8ZZ31_HUMAN Phosphatidylinositol N-acetylglucosaminyltransferase subunit Q OS=Homo sapiens OX=9606 GN=PIGQ PE=1 SV=2	169	VARSEVLFRSDR
PSDGQSTSPSVS	sp|P11207|V_PIV5	140	sp|Q9Y6V0|PCLO_HUMAN Protein piccolo OS=Homo sapiens OX=9606 GN=PCLO PE=1 SV=5	4663	PSPGQPGSPSVS
VIDYAAKSYGWN	sp|Q88435|NCAP_PIV5	26	sp|Q76I76|SSH2_HUMAN Protein phosphatase Slingshot homolog 2 OS=Homo sapiens OX=9606 GN=SSH2 PE=1 SV=1	403	VIAYAMKEYGWN
VIDYAAKSYGWN	sp|Q88435|NCAP_PIV5	26	tr|F5H527|F5H527_HUMAN Protein phosphatase Slingshot homolog 2 OS=Homo sapiens OX=9606 GN=SSH2 PE=1 SV=1	430	VIAYAMKEYGWN
VIDYAAKSYGWN	sp|Q88435|NCAP_PIV5	26	tr|A0A3B3IS79|A0A3B3IS79_HUMAN Protein phosphatase Slingshot homolog 2 OS=Homo sapiens OX=9606 GN=SSH2 PE=1 SV=1	409	VIAYAMKEYGWN
MILPNDGIEKES	sp|Q88434|L_PIV5	217	tr|F6UZG9|F6UZG9_HUMAN DNA helicase OS=Homo sapiens OX=9606 GN=FBH1 PE=1 SV=1	201	GILSNCGIEKES
MILPNDGIEKES	sp|Q88434|L_PIV5	217	sp|Q8NFZ0|FBH1_HUMAN F-box DNA helicase 1 OS=Homo sapiens OX=9606 GN=FBH1 PE=1 SV=2	275	GILSNCGIEKES
QELNTLRPQIEE	sp|Q88434|L_PIV5	1391	sp|Q15149|PLEC_HUMAN Plectin OS=Homo sapiens OX=9606 GN=PLEC PE=1 SV=3	2323	QELTTLRLQLEE
AISELRAEAEEK	sp|P11207|V_PIV5	69	tr|E7EU82|E7EU82_HUMAN SPARC-like protein 1 (Fragment) OS=Homo sapiens OX=9606 GN=SPARCL1 PE=1 SV=2	41	AIPSLRAEAEEN
AISELRAEAEEK	sp|P11207|V_PIV5	69	tr|F5H4Y3|F5H4Y3_HUMAN SPARC-like protein 1 (Fragment) OS=Homo sapiens OX=9606 GN=SPARCL1 PE=1 SV=1	41	AIPSLRAEAEEN
AISELRAEAEEK	sp|P11207|V_PIV5	69	tr|D6RA29|D6RA29_HUMAN SPARC-like protein 1 (Fragment) OS=Homo sapiens OX=9606 GN=SPARCL1 PE=1 SV=1	41	AIPSLRAEAEEN
AISELRAEAEEK	sp|P11207|V_PIV5	69	tr|F5H331|F5H331_HUMAN SPARC-like protein 1 (Fragment) OS=Homo sapiens OX=9606 GN=SPARCL1 PE=1 SV=1	41	AIPSLRAEAEEN
AISELRAEAEEK	sp|P11207|V_PIV5	69	tr|C9JJR8|C9JJR8_HUMAN SPARC-like protein 1 (Fragment) OS=Homo sapiens OX=9606 GN=SPARCL1 PE=1 SV=1	41	AIPSLRAEAEEN
AISELRAEAEEK	sp|P11207|V_PIV5	69	tr|E9PC64|E9PC64_HUMAN SPARC-like protein 1 (Fragment) OS=Homo sapiens OX=9606 GN=SPARCL1 PE=1 SV=8	41	AIPSLRAEAEEN
AISELRAEAEEK	sp|P11207|V_PIV5	69	sp|Q14515|SPRL1_HUMAN SPARC-like protein 1 OS=Homo sapiens OX=9606 GN=SPARCL1 PE=1 SV=2	41	AIPSLRAEAEEN
LENALGPFYAFL	sp|Q88435|NCAP_PIV5	111	sp|Q02487|DSC2_HUMAN Desmocollin-2 OS=Homo sapiens OX=9606 GN=DSC2 PE=1 SV=1	145	LENSLGPFPLFL
LENALGPFYAFL	sp|Q88435|NCAP_PIV5	111	tr|A0A3B3ISU0|A0A3B3ISU0_HUMAN Desmocollin-2 OS=Homo sapiens OX=9606 GN=DSC2 PE=1 SV=1	2	LENSLGPFPLFL
IIVAGSLSDSKL	sp|P16629|MATRX_PIV5	261	sp|Q3ZCT8|KBTBC_HUMAN Kelch repeat and BTB domain-containing protein 12 OS=Homo sapiens OX=9606 GN=KBTBD12 PE=2 SV=2	334	IIVAGEASASKL
ATSLSFGKLEEL	sp|Q88434|L_PIV5	91	sp|Q719I0|AHSA2_HUMAN Putative activator of 90 kDa heat shock protein ATPase homolog 2 OS=Homo sapiens OX=9606 GN=AHSA2P PE=5 SV=2	32	ATSLSKGKFQEL
LQKIGLNWLQLV	sp|Q88434|L_PIV5	858	sp|Q9H4L7|SMRCD_HUMAN SWI/SNF-related matrix-associated actin-dependent regulator of chromatin subfamily A containing DEAD/H box 1 OS=Homo sapiens OX=9606 GN=SMARCAD1 PE=1 SV=2	500	YQKVGLNWLALV
LQKIGLNWLQLV	sp|Q88434|L_PIV5	858	tr|H0Y3V5|H0Y3V5_HUMAN Thyroid adenoma-associated protein (Fragment) OS=Homo sapiens OX=9606 GN=THADA PE=1 SV=1	245	LQKLSLNSLQLV
LQKIGLNWLQLV	sp|Q88434|L_PIV5	858	sp|Q6YHU6|THADA_HUMAN Thyroid adenoma-associated protein OS=Homo sapiens OX=9606 GN=THADA PE=1 SV=1	931	LQKLSLNSLQLV
SSLATKPSVSGL	sp|P04850|HN_PIV5	357	sp|Q8TAB3|PCD19_HUMAN Protocadherin-19 OS=Homo sapiens OX=9606 GN=PCDH19 PE=1 SV=3	1073	SSLPTKPSVSYT
LLALCTTEAARA	sp|Q88435|NCAP_PIV5	451	sp|Q8NCV1|ADAD2_HUMAN Adenosine deaminase domain-containing protein 2 OS=Homo sapiens OX=9606 GN=ADAD2 PE=2 SV=1	539	LLALKTYEAAKA
SLLTDALASTYK	sp|Q88435|NCAP_PIV5	224	sp|Q5W0V3|F16B1_HUMAN Protein FAM160B1 OS=Homo sapiens OX=9606 GN=FAM160B1 PE=1 SV=1	307	ELLTDRLASLYK
LRAEAEEKKPSK	sp|P11207|V_PIV5	73	tr|C9JVY5|C9JVY5_HUMAN PALM2 and AKAP2 fusion (Fragment) OS=Homo sapiens OX=9606 GN=PALM2AKAP2 PE=1 SV=1	230	LRAFHEDKKPSK
LRAEAEEKKPSK	sp|P11207|V_PIV5	73	sp|Q9Y2D5|AKAP2_HUMAN A-kinase anchor protein 2 OS=Homo sapiens OX=9606 GN=AKAP2 PE=1 SV=3	181	LRAFHEDKKPSK
TSSLATKPSVSG	sp|P04850|HN_PIV5	356	sp|Q8TAB3|PCD19_HUMAN Protocadherin-19 OS=Homo sapiens OX=9606 GN=PCDH19 PE=1 SV=3	1072	KSSLPTKPSVSY
YLAASGERSLET	sp|Q88435|NCAP_PIV5	2	tr|E7EVY0|E7EVY0_HUMAN Mitochondrial inner membrane protein OXA1L OS=Homo sapiens OX=9606 GN=OXA1L PE=1 SV=1	55	FLAASGPRSLST
YLAASGERSLET	sp|Q88435|NCAP_PIV5	2	tr|A0A087X0L7|A0A087X0L7_HUMAN Mitochondrial inner membrane protein OXA1L OS=Homo sapiens OX=9606 GN=OXA1L PE=1 SV=1	55	FLAASGPRSLST
YLAASGERSLET	sp|Q88435|NCAP_PIV5	2	sp|Q15070|OXA1L_HUMAN Mitochondrial inner membrane protein OXA1L OS=Homo sapiens OX=9606 GN=OXA1L PE=1 SV=3	55	FLAASGPRSLST
YLAASGERSLET	sp|Q88435|NCAP_PIV5	2	tr|J3KNA0|J3KNA0_HUMAN Mitochondrial inner membrane protein OXA1L OS=Homo sapiens OX=9606 GN=OXA1L PE=1 SV=1	115	FLAASGPRSLST
RGVKTGAGIKSP	sp|P11208|PHOSP_PIV5	272	tr|A0A2R8Y7J0|A0A2R8Y7J0_HUMAN Uncharacterized protein CFAP97D2 OS=Homo sapiens OX=9606 GN=CFAP97D2 PE=3 SV=1	132	GGVKTGAGLRSP
PAISELRAEAEE	sp|P11207|V_PIV5	68	tr|E7EU82|E7EU82_HUMAN SPARC-like protein 1 (Fragment) OS=Homo sapiens OX=9606 GN=SPARCL1 PE=1 SV=2	40	TAIPSLRAEAEE
PAISELRAEAEE	sp|P11207|V_PIV5	68	tr|F5H4Y3|F5H4Y3_HUMAN SPARC-like protein 1 (Fragment) OS=Homo sapiens OX=9606 GN=SPARCL1 PE=1 SV=1	40	TAIPSLRAEAEE
PAISELRAEAEE	sp|P11207|V_PIV5	68	tr|D6RA29|D6RA29_HUMAN SPARC-like protein 1 (Fragment) OS=Homo sapiens OX=9606 GN=SPARCL1 PE=1 SV=1	40	TAIPSLRAEAEE
PAISELRAEAEE	sp|P11207|V_PIV5	68	tr|F5H331|F5H331_HUMAN SPARC-like protein 1 (Fragment) OS=Homo sapiens OX=9606 GN=SPARCL1 PE=1 SV=1	40	TAIPSLRAEAEE
PAISELRAEAEE	sp|P11207|V_PIV5	68	tr|C9JJR8|C9JJR8_HUMAN SPARC-like protein 1 (Fragment) OS=Homo sapiens OX=9606 GN=SPARCL1 PE=1 SV=1	40	TAIPSLRAEAEE
PAISELRAEAEE	sp|P11207|V_PIV5	68	tr|E9PC64|E9PC64_HUMAN SPARC-like protein 1 (Fragment) OS=Homo sapiens OX=9606 GN=SPARCL1 PE=1 SV=8	40	TAIPSLRAEAEE
PAISELRAEAEE	sp|P11207|V_PIV5	68	sp|Q14515|SPRL1_HUMAN SPARC-like protein 1 OS=Homo sapiens OX=9606 GN=SPARCL1 PE=1 SV=2	40	TAIPSLRAEAEE
TLEVQLLITVLC	sp|Q88434|L_PIV5	915	tr|A0A087WSW8|A0A087WSW8_HUMAN Protocadherin alpha-4 OS=Homo sapiens OX=9606 GN=PCDHA4 PE=1 SV=1	222	TGTVQLLITVLD
TLEVQLLITVLC	sp|Q88434|L_PIV5	915	tr|A0A5F9ZHY0|A0A5F9ZHY0_HUMAN Protocadherin alpha-4 OS=Homo sapiens OX=9606 GN=PCDHA4 PE=1 SV=1	223	TGTVQLLITVLD
TLEVQLLITVLC	sp|Q88434|L_PIV5	915	tr|D6RA20|D6RA20_HUMAN Protocadherin alpha-4 OS=Homo sapiens OX=9606 GN=PCDHA4 PE=1 SV=2	223	TGTVQLLITVLD
TLEVQLLITVLC	sp|Q88434|L_PIV5	915	sp|Q9UN74|PCDA4_HUMAN Protocadherin alpha-4 OS=Homo sapiens OX=9606 GN=PCDHA4 PE=1 SV=1	223	TGTVQLLITVLD
TLEVQLLITVLC	sp|Q88434|L_PIV5	915	sp|Q9Y5H5|PCDA9_HUMAN Protocadherin alpha-9 OS=Homo sapiens OX=9606 GN=PCDHA9 PE=2 SV=1	223	TGTVQLLITVLD
TLEVQLLITVLC	sp|Q88434|L_PIV5	915	sp|Q9UN72|PCDA7_HUMAN Protocadherin alpha-7 OS=Homo sapiens OX=9606 GN=PCDHA7 PE=2 SV=1	223	TGTVQLLITVLD
ILPNDGIEKESM	sp|Q88434|L_PIV5	218	tr|F6UZG9|F6UZG9_HUMAN DNA helicase OS=Homo sapiens OX=9606 GN=FBH1 PE=1 SV=1	202	ILSNCGIEKESD
ILPNDGIEKESM	sp|Q88434|L_PIV5	218	sp|Q8NFZ0|FBH1_HUMAN F-box DNA helicase 1 OS=Homo sapiens OX=9606 GN=FBH1 PE=1 SV=2	276	ILSNCGIEKESD
QKIGLNWLQLVL	sp|Q88434|L_PIV5	859	sp|Q9H4L7|SMRCD_HUMAN SWI/SNF-related matrix-associated actin-dependent regulator of chromatin subfamily A containing DEAD/H box 1 OS=Homo sapiens OX=9606 GN=SMARCAD1 PE=1 SV=2	501	QKVGLNWLALVH
IQIPSLGIILIT	sp|P04850|HN_PIV5	542	tr|G3V4J5|G3V4J5_HUMAN Calcium permeable stress-gated cation channel 1 (Fragment) OS=Homo sapiens OX=9606 GN=TMEM63C PE=1 SV=1	146	ICIPSLGIILPI
IQIPSLGIILIT	sp|P04850|HN_PIV5	542	sp|Q9P1W3|CSC1_HUMAN Calcium permeable stress-gated cation channel 1 OS=Homo sapiens OX=9606 GN=TMEM63C PE=2 SV=1	146	ICIPSLGIILPI
LQVLPQTLPIFV	sp|P04849|FUS_PIV5	45	sp|Q15388|TOM20_HUMAN Mitochondrial import receptor subunit TOM20 homolog OS=Homo sapiens OX=9606 GN=TOMM20 PE=1 SV=1	107	LQVLQQTLPPPV
GVKTGAGIKSPL	sp|P11208|PHOSP_PIV5	273	tr|A0A2R8Y7J0|A0A2R8Y7J0_HUMAN Uncharacterized protein CFAP97D2 OS=Homo sapiens OX=9606 GN=CFAP97D2 PE=3 SV=1	133	GVKTGAGLRSPG
FKEKEKKKGLYR	sp|P16629|MATRX_PIV5	53	tr|V9GY54|V9GY54_HUMAN DDB1- and CUL4-associated factor 8 OS=Homo sapiens OX=9606 GN=DCAF8 PE=1 SV=1	325	TKEKEKKVGLYT
FKEKEKKKGLYR	sp|P16629|MATRX_PIV5	53	sp|Q5TAQ9|DCAF8_HUMAN DDB1- and CUL4-associated factor 8 OS=Homo sapiens OX=9606 GN=DCAF8 PE=1 SV=1	325	TKEKEKKVGLYT
QGGTGWSCELDI	sp|P11207|V_PIV5	188	tr|F8VVB6|F8VVB6_HUMAN Protein kinase C-binding protein NELL2 OS=Homo sapiens OX=9606 GN=NELL2 PE=1 SV=1	544	QGFTGPSCETDI
QGGTGWSCELDI	sp|P11207|V_PIV5	188	sp|Q99435|NELL2_HUMAN Protein kinase C-binding protein NELL2 OS=Homo sapiens OX=9606 GN=NELL2 PE=1 SV=1	545	QGFTGPSCETDI
LVDELRYRRSPY	sp|Q88434|L_PIV5	2023	tr|J3KQ26|J3KQ26_HUMAN Armadillo repeat-containing protein 5 OS=Homo sapiens OX=9606 GN=ARMC5 PE=1 SV=1	422	LVDELRQRRDPN
LVDELRYRRSPY	sp|Q88434|L_PIV5	2023	sp|Q96C12|ARMC5_HUMAN Armadillo repeat-containing protein 5 OS=Homo sapiens OX=9606 GN=ARMC5 PE=1 SV=2	327	LVDELRQRRDPN
RTMLPAQAQTSE	sp|Q88435|NCAP_PIV5	480	tr|A0A590UK50|A0A590UK50_HUMAN Mitotic checkpoint serine/threonine-protein kinase BUB1 (Fragment) OS=Homo sapiens OX=9606 GN=BUB1 PE=1 SV=1	140	ETHLPAQARTSE
RTMLPAQAQTSE	sp|Q88435|NCAP_PIV5	480	sp|O43683|BUB1_HUMAN Mitotic checkpoint serine/threonine-protein kinase BUB1 OS=Homo sapiens OX=9606 GN=BUB1 PE=1 SV=1	149	ETHLPAQARTSE
IEEVLAKNARKL	sp|Q88434|L_PIV5	1400	sp|Q0IIM8|TBC8B_HUMAN TBC1 domain family member 8B OS=Homo sapiens OX=9606 GN=TBC1D8B PE=1 SV=2	5	PEEVLLKNALKL
IEEVLAKNARKL	sp|Q88434|L_PIV5	1400	tr|J3KN75|J3KN75_HUMAN TBC1 domain family member 8B OS=Homo sapiens OX=9606 GN=TBC1D8B PE=1 SV=1	5	PEEVLLKNALKL
IEEVLAKNARKL	sp|Q88434|L_PIV5	1400	tr|D6RFZ2|D6RFZ2_HUMAN TBC1 domain family member 8B OS=Homo sapiens OX=9606 GN=TBC1D8B PE=1 SV=1	5	PEEVLLKNALKL
IEEVLAKNARKL	sp|Q88434|L_PIV5	1400	sp|O95759|TBCD8_HUMAN TBC1 domain family member 8 OS=Homo sapiens OX=9606 GN=TBC1D8 PE=1 SV=3	5	PEEVLLKNALKL
IEEVLAKNARKL	sp|Q88434|L_PIV5	1400	tr|J3KQ40|J3KQ40_HUMAN TBC1 domain family member 8 OS=Homo sapiens OX=9606 GN=TBC1D8 PE=1 SV=1	5	PEEVLLKNALKL
GSLSDSKLFVVS	sp|P16629|MATRX_PIV5	265	sp|Q9Y4C5|CHST2_HUMAN Carbohydrate sulfotransferase 2 OS=Homo sapiens OX=9606 GN=CHST2 PE=1 SV=2	461	GSGSSSKPFVVS
LALLKRFAETVE	sp|P04849|FUS_PIV5	2	tr|A0A2R8YGQ6|A0A2R8YGQ6_HUMAN ATP-binding cassette sub-family C member 8 (Fragment) OS=Homo sapiens OX=9606 GN=ABCC8 PE=1 SV=1	649	LPLLSHFAETVE
LALLKRFAETVE	sp|P04849|FUS_PIV5	2	tr|A0A2R8Y775|A0A2R8Y775_HUMAN ATP-binding cassette sub-family C member 8 (Fragment) OS=Homo sapiens OX=9606 GN=ABCC8 PE=1 SV=1	253	LPLLSHFAETVE
LALLKRFAETVE	sp|P04849|FUS_PIV5	2	tr|A0A2R8Y4V0|A0A2R8Y4V0_HUMAN ATP-binding cassette sub-family C member 8 OS=Homo sapiens OX=9606 GN=ABCC8 PE=1 SV=1	1219	LPLLSHFAETVE
LALLKRFAETVE	sp|P04849|FUS_PIV5	2	sp|Q09428|ABCC8_HUMAN ATP-binding cassette sub-family C member 8 OS=Homo sapiens OX=9606 GN=ABCC8 PE=1 SV=6	1197	LPLLSHFAETVE
LALLKRFAETVE	sp|P04849|FUS_PIV5	2	tr|A0A2R8YDG0|A0A2R8YDG0_HUMAN ATP-binding cassette sub-family C member 8 OS=Homo sapiens OX=9606 GN=ABCC8 PE=1 SV=1	1196	LPLLSHFAETVE
LALLKRFAETVE	sp|P04849|FUS_PIV5	2	tr|A0A2R8Y6Q0|A0A2R8Y6Q0_HUMAN ATP-binding cassette sub-family C member 8 OS=Homo sapiens OX=9606 GN=ABCC8 PE=1 SV=1	1114	LPLLSHFAETVE
LALLKRFAETVE	sp|P04849|FUS_PIV5	2	tr|A0A2R8Y5D8|A0A2R8Y5D8_HUMAN ATP-binding cassette sub-family C member 8 OS=Homo sapiens OX=9606 GN=ABCC8 PE=1 SV=1	1197	LPLLSHFAETVE
LALLKRFAETVE	sp|P04849|FUS_PIV5	2	tr|H0YDH8|H0YDH8_HUMAN ATP-binding cassette sub-family C member 8 (Fragment) OS=Homo sapiens OX=9606 GN=ABCC8 PE=4 SV=1	21	LPLLSHFAETVE
LALLKRFAETVE	sp|P04849|FUS_PIV5	2	tr|A0A2R8Y4Z4|A0A2R8Y4Z4_HUMAN ATP-binding cassette sub-family C member 8 OS=Homo sapiens OX=9606 GN=ABCC8 PE=1 SV=1	1196	LPLLSHFAETVE
LALLKRFAETVE	sp|P04849|FUS_PIV5	2	tr|A0A2R8YHG6|A0A2R8YHG6_HUMAN ATP-binding cassette sub-family C member 8 (Fragment) OS=Homo sapiens OX=9606 GN=ABCC8 PE=1 SV=1	559	LPLLSHFAETVE
SYSSALDLASEL	sp|Q88434|L_PIV5	1479	tr|H0YLJ2|H0YLJ2_HUMAN Solute carrier family 12 member 1 (Fragment) OS=Homo sapiens OX=9606 GN=SLC12A1 PE=1 SV=1	472	SYVSALDNALEL
SYSSALDLASEL	sp|Q88434|L_PIV5	1479	tr|A0A2R8Y6V7|A0A2R8Y6V7_HUMAN Solute carrier family 12 member 1 OS=Homo sapiens OX=9606 GN=SLC12A1 PE=1 SV=1	705	SYVSALDNALEL
SYSSALDLASEL	sp|Q88434|L_PIV5	1479	sp|Q13621|S12A1_HUMAN Solute carrier family 12 member 1 OS=Homo sapiens OX=9606 GN=SLC12A1 PE=2 SV=2	659	SYVSALDNALEL
STLLLLAQICLL	sp|Q88434|L_PIV5	2012	tr|E9PLV9|E9PLV9_HUMAN Large neutral amino acids transporter small subunit 2 OS=Homo sapiens OX=9606 GN=SLC7A8 PE=1 SV=1	159	SGLRLLAAICLL
STLLLLAQICLL	sp|Q88434|L_PIV5	2012	sp|Q9UHI5|LAT2_HUMAN Large neutral amino acids transporter small subunit 2 OS=Homo sapiens OX=9606 GN=SLC7A8 PE=1 SV=1	159	SGLRLLAAICLL
DGLDVLKTRLAG	sp|P11207|V_PIV5	169	tr|G5E9W6|G5E9W6_HUMAN Coiled-coil domain-containing protein 183 OS=Homo sapiens OX=9606 GN=CCDC183 PE=1 SV=1	174	DLLDYLKTVLAG
DGLDVLKTRLAG	sp|P11207|V_PIV5	169	sp|Q5T5S1|CC183_HUMAN Coiled-coil domain-containing protein 183 OS=Homo sapiens OX=9606 GN=CCDC183 PE=2 SV=3	174	DLLDYLKTVLAG
SFVSYESIAVSL	sp|Q88435|NCAP_PIV5	326	tr|A0A2I3JL00|A0A2I3JL00_HUMAN Major facilitator superfamily domain-containing protein 2B OS=Homo sapiens OX=9606 GN=MFSD2B PE=1 SV=1	375	AFVSGVSIAVSL
SFVSYESIAVSL	sp|Q88435|NCAP_PIV5	326	sp|A6NFX1|MFS2B_HUMAN Major facilitator superfamily domain-containing protein 2B OS=Homo sapiens OX=9606 GN=MFSD2B PE=1 SV=4	375	AFVSGVSIAVSL
SFVSYESIAVSL	sp|Q88435|NCAP_PIV5	326	tr|A0A590UK14|A0A590UK14_HUMAN Major facilitator superfamily domain-containing protein 2B OS=Homo sapiens OX=9606 GN=MFSD2B PE=1 SV=1	403	AFVSGVSIAVSL
DSLDPIEELIEG	sp|P16629|MATRX_PIV5	309	tr|J3KT08|J3KT08_HUMAN GOLD domain-containing protein (Fragment) OS=Homo sapiens OX=9606 PE=3 SV=1	150	DTLDAIEELCEG
QDIQIPSLGIIL	sp|P04850|HN_PIV5	540	tr|G3V4J5|G3V4J5_HUMAN Calcium permeable stress-gated cation channel 1 (Fragment) OS=Homo sapiens OX=9606 GN=TMEM63C PE=1 SV=1	144	LIICIPSLGIIL
QDIQIPSLGIIL	sp|P04850|HN_PIV5	540	sp|Q9P1W3|CSC1_HUMAN Calcium permeable stress-gated cation channel 1 OS=Homo sapiens OX=9606 GN=TMEM63C PE=2 SV=1	144	LIICIPSLGIIL
ILVSTAVQSSSG	sp|P11208|PHOSP_PIV5	139	sp|Q9NY47|CA2D2_HUMAN Voltage-dependent calcium channel subunit alpha-2/delta-2 OS=Homo sapiens OX=9606 GN=CACNA2D2 PE=1 SV=2	822	ILVSTAVELSLG
ILVSTAVQSSSG	sp|P11208|PHOSP_PIV5	139	tr|C9JVC9|C9JVC9_HUMAN Voltage-dependent calcium channel subunit alpha-2/delta-2 OS=Homo sapiens OX=9606 GN=CACNA2D2 PE=1 SV=1	822	ILVSTAVELSLG
ILVSTAVQSSSG	sp|P11208|PHOSP_PIV5	139	tr|C9JE82|C9JE82_HUMAN Voltage-dependent calcium channel subunit alpha-2/delta-2 OS=Homo sapiens OX=9606 GN=CACNA2D2 PE=1 SV=1	815	ILVSTAVELSLG
GSSVTCDGVSAA	sp|P04850|HN_PIV5	193	tr|A0A0G2JHX4|A0A0G2JHX4_HUMAN Mucin-21 OS=Homo sapiens OX=9606 GN=MUC21 PE=4 SV=1	49	GSSVTSSGVSTA
GSSVTCDGVSAA	sp|P04850|HN_PIV5	193	tr|A0A0G2JMC4|A0A0G2JMC4_HUMAN Mucin-21 OS=Homo sapiens OX=9606 GN=MUC21 PE=4 SV=1	49	GSSVTSSGVSTA
GSSVTCDGVSAA	sp|P04850|HN_PIV5	193	tr|A0A140TA51|A0A140TA51_HUMAN Mucin-21 OS=Homo sapiens OX=9606 GN=MUC21 PE=4 SV=1	49	GSSVTSSGVSTA
GSSVTCDGVSAA	sp|P04850|HN_PIV5	193	tr|A0A140TA38|A0A140TA38_HUMAN Mucin-21 OS=Homo sapiens OX=9606 GN=MUC21 PE=4 SV=1	49	GSSVTSSGVSTA
GSSVTCDGVSAA	sp|P04850|HN_PIV5	193	tr|A0A140T8X8|A0A140T8X8_HUMAN Mucin-21 OS=Homo sapiens OX=9606 GN=MUC21 PE=4 SV=1	49	GSSVTSSGVSTA
GSSVTCDGVSAA	sp|P04850|HN_PIV5	193	tr|A0A0G2JKD1|A0A0G2JKD1_HUMAN Mucin-21 OS=Homo sapiens OX=9606 GN=MUC21 PE=4 SV=1	49	GSSVTSSGVSTA
GSSVTCDGVSAA	sp|P04850|HN_PIV5	193	sp|Q5SSG8|MUC21_HUMAN Mucin-21 OS=Homo sapiens OX=9606 GN=MUC21 PE=1 SV=2	49	GSSVTSSGVSTA
GSSVTCDGVSAA	sp|P04850|HN_PIV5	193	tr|A0A0G2JJF7|A0A0G2JJF7_HUMAN Mucin-21 OS=Homo sapiens OX=9606 GN=MUC21 PE=4 SV=1	49	GSSVTSSGVSTA
GLDVLKTRLAGA	sp|P11207|V_PIV5	170	sp|Q8N3U4|STAG2_HUMAN Cohesin subunit SA-2 OS=Homo sapiens OX=9606 GN=STAG2 PE=1 SV=3	960	GLDQLKTREAIA
SSTLTTQNINYT	sp|P04849|FUS_PIV5	25	tr|A0A087X2A5|A0A087X2A5_HUMAN Zinc finger protein 117 OS=Homo sapiens OX=9606 GN=ZNF117 PE=1 SV=1	205	SSTLTTHNIIHT
SSTLTTQNINYT	sp|P04849|FUS_PIV5	25	sp|Q03924|ZN117_HUMAN Zinc finger protein 117 OS=Homo sapiens OX=9606 GN=ZNF117 PE=2 SV=5	205	SSTLTTHNIIHT
LRSQLAEQSALA	sp|Q88435|NCAP_PIV5	311	sp|P18858|DNLI1_HUMAN DNA ligase 1 OS=Homo sapiens OX=9606 GN=LIG1 PE=1 SV=1	450	LRLGLAEQSVLA
LRSQLAEQSALA	sp|Q88435|NCAP_PIV5	311	tr|F5GZ28|F5GZ28_HUMAN DNA ligase OS=Homo sapiens OX=9606 GN=LIG1 PE=1 SV=1	382	LRLGLAEQSVLA
LRSQLAEQSALA	sp|Q88435|NCAP_PIV5	311	tr|M0R0Q7|M0R0Q7_HUMAN DNA ligase OS=Homo sapiens OX=9606 GN=LIG1 PE=1 SV=1	449	LRLGLAEQSVLA
LTTSYSSALDLA	sp|Q88434|L_PIV5	1476	sp|Q9H201|EPN3_HUMAN Epsin-3 OS=Homo sapiens OX=9606 GN=EPN3 PE=2 SV=1	293	LKTSQSSILDLA
PFKEKEKKKGLY	sp|P16629|MATRX_PIV5	52	tr|V9GY54|V9GY54_HUMAN DDB1- and CUL4-associated factor 8 OS=Homo sapiens OX=9606 GN=DCAF8 PE=1 SV=1	324	VTKEKEKKVGLY
PFKEKEKKKGLY	sp|P16629|MATRX_PIV5	52	sp|Q5TAQ9|DCAF8_HUMAN DDB1- and CUL4-associated factor 8 OS=Homo sapiens OX=9606 GN=DCAF8 PE=1 SV=1	324	VTKEKEKKVGLY
RDSATCDEIGST	sp|Q88434|L_PIV5	1076	tr|H3BRN5|H3BRN5_HUMAN Regulator of G-protein-signaling protein-like OS=Homo sapiens OX=9606 GN=RGSL1 PE=4 SV=1	116	RDSQEDDEIGST
SGEVQKSLQQFL	sp|Q88434|L_PIV5	306	sp|Q9BTX1|NDC1_HUMAN Nucleoporin NDC1 OS=Homo sapiens OX=9606 GN=NDC1 PE=1 SV=2	659	SAEHQKRLQQFL
ELRAEAEEKKPS	sp|P11207|V_PIV5	72	tr|C9JVY5|C9JVY5_HUMAN PALM2 and AKAP2 fusion (Fragment) OS=Homo sapiens OX=9606 GN=PALM2AKAP2 PE=1 SV=1	229	ELRAFHEDKKPS
ELRAEAEEKKPS	sp|P11207|V_PIV5	72	sp|Q9Y2D5|AKAP2_HUMAN A-kinase anchor protein 2 OS=Homo sapiens OX=9606 GN=AKAP2 PE=1 SV=3	180	ELRAFHEDKKPS
SLGPIGNQSASS	sp|P04850|HN_PIV5	476	sp|Q9NRD8|DUOX2_HUMAN Dual oxidase 2 OS=Homo sapiens OX=9606 GN=DUOX2 PE=1 SV=2	19	SLGPSGNQDALS
QMEILPNQWEGL	sp|Q88434|L_PIV5	581	sp|Q92673|SORL_HUMAN Sortilin-related receptor OS=Homo sapiens OX=9606 GN=SORL1 PE=1 SV=2	993	QMEILANQLTGL
LLVRLSSLASIL	sp|P04849|FUS_PIV5	364	sp|Q8TCU3|S7A13_HUMAN Solute carrier family 7 member 13 OS=Homo sapiens OX=9606 GN=SLC7A13 PE=2 SV=1	342	LLVTLGSLAIIL
QLISSLFSQVTS	sp|P04850|HN_PIV5	346	tr|A0A338VFC5|A0A338VFC5_HUMAN Centrosomal protein of 83 kDa OS=Homo sapiens OX=9606 GN=CEP83 PE=1 SV=1	440	QQISSLQIQVTS
QLISSLFSQVTS	sp|P04850|HN_PIV5	346	tr|A0A0A0MS84|A0A0A0MS84_HUMAN Centrosomal protein of 83 kDa OS=Homo sapiens OX=9606 GN=CEP83 PE=1 SV=1	344	QQISSLQIQVTS
QLISSLFSQVTS	sp|P04850|HN_PIV5	346	sp|Q9Y592|CEP83_HUMAN Centrosomal protein of 83 kDa OS=Homo sapiens OX=9606 GN=CEP83 PE=1 SV=3	473	QQISSLQIQVTS
TMLPAQAQTSEA	sp|Q88435|NCAP_PIV5	481	tr|A0A590UK50|A0A590UK50_HUMAN Mitotic checkpoint serine/threonine-protein kinase BUB1 (Fragment) OS=Homo sapiens OX=9606 GN=BUB1 PE=1 SV=1	141	THLPAQARTSEP
TMLPAQAQTSEA	sp|Q88435|NCAP_PIV5	481	sp|O43683|BUB1_HUMAN Mitotic checkpoint serine/threonine-protein kinase BUB1 OS=Homo sapiens OX=9606 GN=BUB1 PE=1 SV=1	150	THLPAQARTSEP
LATASLLSVTFP	sp|P04849|FUS_PIV5	471	sp|Q9P0S3|ORML1_HUMAN ORM1-like protein 1 OS=Homo sapiens OX=9606 GN=ORMDL1 PE=1 SV=1	126	LNTASLLSVLIP
LLDRSGEAELFL	sp|Q88434|L_PIV5	131	sp|Q86UU0|BCL9L_HUMAN B-cell CLL/lymphoma 9-like protein OS=Homo sapiens OX=9606 GN=BCL9L PE=1 SV=1	420	LLLRSGETEPFL
LLDRSGEAELFL	sp|Q88434|L_PIV5	131	tr|A0A087WZX0|A0A087WZX0_HUMAN B-cell CLL/lymphoma 9-like protein OS=Homo sapiens OX=9606 GN=BCL9L PE=1 SV=1	383	LLLRSGETEPFL
KEKEKKKGLYRT	sp|P16629|MATRX_PIV5	54	tr|V9GY54|V9GY54_HUMAN DDB1- and CUL4-associated factor 8 OS=Homo sapiens OX=9606 GN=DCAF8 PE=1 SV=1	326	KEKEKKVGLYTI
KEKEKKKGLYRT	sp|P16629|MATRX_PIV5	54	sp|Q5TAQ9|DCAF8_HUMAN DDB1- and CUL4-associated factor 8 OS=Homo sapiens OX=9606 GN=DCAF8 PE=1 SV=1	326	KEKEKKVGLYTI
KEVPHSEPFTMD	sp|P11207|V_PIV5	55	tr|H0YH15|H0YH15_HUMAN Aquarius homolog (Mouse), isoform CRA_a OS=Homo sapiens OX=9606 GN=AQR PE=1 SV=1	234	KSVPLSEPVTMD
KEVPHSEPFTMD	sp|P11207|V_PIV5	55	sp|O60306|AQR_HUMAN RNA helicase aquarius OS=Homo sapiens OX=9606 GN=AQR PE=1 SV=4	234	KSVPLSEPVTMD
DVLKTRLAGAIT	sp|P11207|V_PIV5	172	tr|C9JIF3|C9JIF3_HUMAN Reticulophagy regulator 2 (Fragment) OS=Homo sapiens OX=9606 GN=RETREG2 PE=1 SV=1	88	DVKKTALALAIT
DVLKTRLAGAIT	sp|P11207|V_PIV5	172	sp|Q8NC44|RETR2_HUMAN Reticulophagy regulator 2 OS=Homo sapiens OX=9606 GN=RETREG2 PE=1 SV=3	295	DVKKTALALAIT
AEQSALARGDSF	sp|Q88435|NCAP_PIV5	316	sp|Q68D91|MBLC2_HUMAN Metallo-beta-lactamase domain-containing protein 2 OS=Homo sapiens OX=9606 GN=MBLAC2 PE=1 SV=3	103	AEAEALARGDNF
TLDLSSKNINET	sp|Q88434|L_PIV5	1758	tr|F8VYZ5|F8VYZ5_HUMAN Leucine-rich repeats and immunoglobulin-like domains protein 3 (Fragment) OS=Homo sapiens OX=9606 GN=LRIG3 PE=1 SV=1	56	TLDLSSNNISEL
TLDLSSKNINET	sp|Q88434|L_PIV5	1758	tr|C9K080|C9K080_HUMAN Leucine-rich repeats and immunoglobulin-like domains protein 3 OS=Homo sapiens OX=9606 GN=LRIG3 PE=1 SV=2	149	TLDLSSNNISEL
TLDLSSKNINET	sp|Q88434|L_PIV5	1758	sp|Q6UXM1|LRIG3_HUMAN Leucine-rich repeats and immunoglobulin-like domains protein 3 OS=Homo sapiens OX=9606 GN=LRIG3 PE=1 SV=1	149	TLDLSSNNISEL
WAINGADSRGDL	sp|Q88434|L_PIV5	1582	sp|Q7Z6Z7|HUWE1_HUMAN E3 ubiquitin-protein ligase HUWE1 OS=Homo sapiens OX=9606 GN=HUWE1 PE=1 SV=3	2933	VAISGADSRGIL
LLDYLSFRIDLS	sp|Q88434|L_PIV5	432	sp|Q9UP83|COG5_HUMAN Conserved oligomeric Golgi complex subunit 5 OS=Homo sapiens OX=9606 GN=COG5 PE=1 SV=3	209	ELDYLSQGIDLS
LDYLSFRIDLSF	sp|Q88434|L_PIV5	433	sp|Q9UP83|COG5_HUMAN Conserved oligomeric Golgi complex subunit 5 OS=Homo sapiens OX=9606 GN=COG5 PE=1 SV=3	210	LDYLSQGIDLSG
AVALSIKSGLYA	sp|Q88434|L_PIV5	1057	sp|P08574|CY1_HUMAN Cytochrome c1, heme protein, mitochondrial OS=Homo sapiens OX=9606 GN=CYC1 PE=1 SV=3	44	AVALSSKSGLSR
STIDIGMPAMGE	sp|Q88435|NCAP_PIV5	267	sp|Q99250|SCN2A_HUMAN Sodium channel protein type 2 subunit alpha OS=Homo sapiens OX=9606 GN=SCN2A PE=1 SV=3	1144	STVDIGAPAEGE
STIDIGMPAMGE	sp|Q88435|NCAP_PIV5	267	tr|A0A1B0GWA6|A0A1B0GWA6_HUMAN Sodium channel protein OS=Homo sapiens OX=9606 GN=SCN2A PE=1 SV=1	1012	STVDIGAPAEGE
VSYESIAVSLLV	sp|Q88435|NCAP_PIV5	328	tr|A0A2I3JL00|A0A2I3JL00_HUMAN Major facilitator superfamily domain-containing protein 2B OS=Homo sapiens OX=9606 GN=MFSD2B PE=1 SV=1	377	VSGVSIAVSLLL
VSYESIAVSLLV	sp|Q88435|NCAP_PIV5	328	sp|A6NFX1|MFS2B_HUMAN Major facilitator superfamily domain-containing protein 2B OS=Homo sapiens OX=9606 GN=MFSD2B PE=1 SV=4	377	VSGVSIAVSLLL
VSYESIAVSLLV	sp|Q88435|NCAP_PIV5	328	tr|A0A590UK14|A0A590UK14_HUMAN Major facilitator superfamily domain-containing protein 2B OS=Homo sapiens OX=9606 GN=MFSD2B PE=1 SV=1	405	VSGVSIAVSLLL
EVLAKNARKLKL	sp|Q88434|L_PIV5	1402	sp|Q0IIM8|TBC8B_HUMAN TBC1 domain family member 8B OS=Homo sapiens OX=9606 GN=TBC1D8B PE=1 SV=2	7	EVLLKNALKLWL
EVLAKNARKLKL	sp|Q88434|L_PIV5	1402	tr|J3KN75|J3KN75_HUMAN TBC1 domain family member 8B OS=Homo sapiens OX=9606 GN=TBC1D8B PE=1 SV=1	7	EVLLKNALKLWL
EVLAKNARKLKL	sp|Q88434|L_PIV5	1402	tr|D6RFZ2|D6RFZ2_HUMAN TBC1 domain family member 8B OS=Homo sapiens OX=9606 GN=TBC1D8B PE=1 SV=1	7	EVLLKNALKLWL
