query	query_seqname	query_start	target_seqname	target_start	target
NGTILSEDSPEG	tr|Q0GP25|Q0GP25_HSPV	249	sp|Q96PY6|NEK1_HUMAN Serine/threonine-protein kinase Nek1 OS=Homo sapiens OX=9606 GN=NEK1 PE=1 SV=2	829	NTTIRSEISPEG
SPENLSDKILKS	tr|Q0GP62|Q0GP62_HSPV	71	sp|P85299|PRR5_HUMAN Proline-rich protein 5 OS=Homo sapiens OX=9606 GN=PRR5 PE=1 SV=1	344	SPENLVDQILES
HDMSLSFFEFDV	tr|Q0GNU1|Q0GNU1_HSPV	365	tr|A0A2R8YFA9|A0A2R8YFA9_HUMAN F-actin monooxygenase OS=Homo sapiens OX=9606 GN=MICAL2 PE=1 SV=1	207	TDHSLSEFEFDV
HDMSLSFFEFDV	tr|Q0GNU1|Q0GNU1_HSPV	365	sp|O94851|MICA2_HUMAN [F-actin]-monooxygenase MICAL2 OS=Homo sapiens OX=9606 GN=MICAL2 PE=1 SV=1	207	TDHSLSEFEFDV
TEAKLILKLDGL	tr|Q0GP29|Q0GP29_HSPV	448	tr|C9JDB3|C9JDB3_HUMAN Dedicator of cytokinesis protein 4 (Fragment) OS=Homo sapiens OX=9606 GN=DOCK4 PE=1 SV=1	4	VEAKLIDKLDSL
TEAKLILKLDGL	tr|Q0GP29|Q0GP29_HSPV	448	tr|H0Y7H7|H0Y7H7_HUMAN Dedicator of cytokinesis protein 4 (Fragment) OS=Homo sapiens OX=9606 GN=DOCK4 PE=1 SV=1	558	VEAKLIDKLDSL
TEAKLILKLDGL	tr|Q0GP29|Q0GP29_HSPV	448	tr|H0Y599|H0Y599_HUMAN Dedicator of cytokinesis protein 4 (Fragment) OS=Homo sapiens OX=9606 GN=DOCK4 PE=1 SV=1	1130	VEAKLIDKLDSL
TEAKLILKLDGL	tr|Q0GP29|Q0GP29_HSPV	448	sp|Q8N1I0|DOCK4_HUMAN Dedicator of cytokinesis protein 4 OS=Homo sapiens OX=9606 GN=DOCK4 PE=1 SV=3	1106	VEAKLIDKLDSL
TEAKLILKLDGL	tr|Q0GP29|Q0GP29_HSPV	448	tr|A0A590UJ51|A0A590UJ51_HUMAN Dedicator of cytokinesis protein 4 (Fragment) OS=Homo sapiens OX=9606 GN=DOCK4 PE=1 SV=1	78	VEAKLIDKLDSL
LASLENLDILHL	tr|Q0GP88|Q0GP88_HSPV	367	sp|O00206|TLR4_HUMAN Toll-like receptor 4 OS=Homo sapiens OX=9606 GN=TLR4 PE=1 SV=2	138	LASLENFPIGHL
NVLNVLSYATNG	tr|Q0GP84|Q0GP84_HSPV	123	sp|Q8NHS1|CLDN2_HUMAN Claudin domain-containing protein 2 OS=Homo sapiens OX=9606 GN=CLDND2 PE=1 SV=1	19	NVLMVLSTATNY
LGDLLAKDIPIS	tr|Q0GP49|Q0GP49_HSPV	176	sp|Q8NGY0|O10X1_HUMAN Olfactory receptor 10X1 OS=Homo sapiens OX=9606 GN=OR10X1 PE=3 SV=2	98	LEDLLAKDRSIS
IAQDVVGFLMKS	tr|Q0GP43|Q0GP43_HSPV	161	tr|F5H0K2|F5H0K2_HUMAN Sarcospan OS=Homo sapiens OX=9606 GN=SSPN PE=1 SV=1	65	IAVTVVGFLMAS
IAQDVVGFLMKS	tr|Q0GP43|Q0GP43_HSPV	161	sp|Q14714|SSPN_HUMAN Sarcospan OS=Homo sapiens OX=9606 GN=SSPN PE=2 SV=3	65	IAVTVVGFLMAS
GIFILVFRLNIE	tr|Q0GNN3|Q0GNN3_HSPV	71	sp|Q8WXG9|AGRV1_HUMAN Adhesion G-protein coupled receptor V1 OS=Homo sapiens OX=9606 GN=ADGRV1 PE=1 SV=2	3296	GIFIPVEDLNIE
STATKLLDRMAL	tr|Q0GNM8|Q0GNM8_HSPV	743	tr|C9J6Z7|C9J6Z7_HUMAN IQ calmodulin-binding motif-containing protein 1 (Fragment) OS=Homo sapiens OX=9606 GN=IQCB1 PE=1 SV=1	44	STATKLLLLMAE
STATKLLDRMAL	tr|Q0GNM8|Q0GNM8_HSPV	743	tr|C9JXD7|C9JXD7_HUMAN IQ calmodulin-binding motif-containing protein 1 (Fragment) OS=Homo sapiens OX=9606 GN=IQCB1 PE=1 SV=1	44	STATKLLLLMAE
STATKLLDRMAL	tr|Q0GNM8|Q0GNM8_HSPV	743	sp|Q15051|IQCB1_HUMAN IQ calmodulin-binding motif-containing protein 1 OS=Homo sapiens OX=9606 GN=IQCB1 PE=1 SV=1	228	STATKLLLLMAE
LKNREMLDEVIK	tr|Q0GP48|Q0GP48_HSPV	29	tr|H0YEJ7|H0YEJ7_HUMAN Rho GTPase-activating protein 42 (Fragment) OS=Homo sapiens OX=9606 GN=ARHGAP42 PE=1 SV=1	126	EKNREMLDILIK
LKNREMLDEVIK	tr|Q0GP48|Q0GP48_HSPV	29	sp|A6NI28|RHG42_HUMAN Rho GTPase-activating protein 42 OS=Homo sapiens OX=9606 GN=ARHGAP42 PE=1 SV=3	502	EKNREMLDILIK
LKNREMLDEVIK	tr|Q0GP48|Q0GP48_HSPV	29	tr|E9PJK4|E9PJK4_HUMAN Rho GTPase-activating protein 42 OS=Homo sapiens OX=9606 GN=ARHGAP42 PE=1 SV=1	468	EKNREMLDILIK
LYSSPKEVSDDE	tr|Q0GP46|Q0GP46_HSPV	26	sp|O75069|TMCC2_HUMAN Transmembrane and coiled-coil domains protein 2 OS=Homo sapiens OX=9606 GN=TMCC2 PE=1 SV=3	467	LVSSPKYGSDDE
LYSSPKEVSDDE	tr|Q0GP46|Q0GP46_HSPV	26	tr|A0A0C4DFR1|A0A0C4DFR1_HUMAN Transmembrane and coiled-coil domains protein 2 OS=Homo sapiens OX=9606 GN=TMCC2 PE=1 SV=2	272	LVSSPKYGSDDE
LALIDSQLNSED	tr|Q0GNR1|Q0GNR1_HSPV	66	sp|Q6V1P9|PCD23_HUMAN Protocadherin-23 OS=Homo sapiens OX=9606 GN=DCHS2 PE=2 SV=2	2941	LPLIKSQLNKED
LEIDDLKAKTNK	tr|Q0GNX5|Q0GNX5_HSPV	63	tr|H0YLP3|H0YLP3_HUMAN Eukaryotic translation initiation factor 3 30 kDa subunit (Fragment) OS=Homo sapiens OX=9606 GN=EIF3J PE=1 SV=1	50	LEIDDLKKITNS
LEIDDLKAKTNK	tr|Q0GNX5|Q0GNX5_HSPV	63	sp|O75822|EIF3J_HUMAN Eukaryotic translation initiation factor 3 subunit J OS=Homo sapiens OX=9606 GN=EIF3J PE=1 SV=2	191	LEIDDLKKITNS
LEIDDLKAKTNK	tr|Q0GNX5|Q0GNX5_HSPV	63	tr|H0YGJ7|H0YGJ7_HUMAN Eukaryotic translation initiation factor 3 30 kDa subunit (Fragment) OS=Homo sapiens OX=9606 GN=EIF3J PE=1 SV=1	70	LEIDDLKKITNS
YSQANKDTRPEL	tr|Q0GNW9|Q0GNW9_HSPV	1	tr|Q3SXZ0|Q3SXZ0_HUMAN C9orf126 protein OS=Homo sapiens OX=9606 GN=SCAI PE=1 SV=1	163	YSQVNKEDRPEL
YSQANKDTRPEL	tr|Q0GNW9|Q0GNW9_HSPV	1	sp|Q8N9R8|SCAI_HUMAN Protein SCAI OS=Homo sapiens OX=9606 GN=SCAI PE=1 SV=2	163	YSQVNKEDRPEL
RHAKLEFFVSCG	tr|Q0GNM0|Q0GNM0_HSPV	167	tr|E9PAK5|E9PAK5_HUMAN DENN domain-containing protein 4B (Fragment) OS=Homo sapiens OX=9606 GN=DENND4B PE=1 SV=1	653	RHAALEFFDSCV
RHAKLEFFVSCG	tr|Q0GNM0|Q0GNM0_HSPV	167	sp|O75064|DEN4B_HUMAN DENN domain-containing protein 4B OS=Homo sapiens OX=9606 GN=DENND4B PE=1 SV=4	642	RHAALEFFDSCV
DRPTTQPPSSQP	tr|Q0GNW1|Q0GNW1_HSPV	174	sp|P32927|IL3RB_HUMAN Cytokine receptor common subunit beta OS=Homo sapiens OX=9606 GN=CSF2RB PE=1 SV=2	560	DLPTEQPPSPQP
DRPTTQPPSSQP	tr|Q0GNW1|Q0GNW1_HSPV	174	tr|Q6NSJ8|Q6NSJ8_HUMAN CSF2RB protein OS=Homo sapiens OX=9606 GN=CSF2RB PE=1 SV=1	560	DLPTEQPPSPQP
AIEILNNKRLVI	tr|Q0GP37|Q0GP37_HSPV	152	tr|A0A5F9ZHV6|A0A5F9ZHV6_HUMAN Ankyrin repeat and death domain-containing protein 1B (Fragment) OS=Homo sapiens OX=9606 GN=ANKDD1B PE=4 SV=1	54	DIDILNQKRLVI
TKELSSDDYDKE	tr|Q0GP41|Q0GP41_HSPV	13	sp|P35659|DEK_HUMAN Protein DEK OS=Homo sapiens OX=9606 GN=DEK PE=1 SV=1	239	NKEESSDDEDKE
TKELSSDDYDKE	tr|Q0GP41|Q0GP41_HSPV	13	tr|B4DFG0|B4DFG0_HUMAN Protein DEK OS=Homo sapiens OX=9606 GN=DEK PE=1 SV=1	211	NKEESSDDEDKE
TKELSSDDYDKE	tr|Q0GP41|Q0GP41_HSPV	13	tr|A0A494C198|A0A494C198_HUMAN Protein DEK OS=Homo sapiens OX=9606 GN=DEK PE=1 SV=1	167	NKEESSDDEDKE
TKELSSDDYDKE	tr|Q0GP41|Q0GP41_HSPV	13	tr|A0A494C028|A0A494C028_HUMAN Protein DEK OS=Homo sapiens OX=9606 GN=DEK PE=1 SV=1	244	NKEESSDDEDKE
TKELSSDDYDKE	tr|Q0GP41|Q0GP41_HSPV	13	tr|H0Y993|H0Y993_HUMAN DEK oncogene (DNA binding), isoform CRA_b OS=Homo sapiens OX=9606 GN=DEK PE=1 SV=2	239	NKEESSDDEDKE
TKELSSDDYDKE	tr|Q0GP41|Q0GP41_HSPV	13	tr|H0Y8X0|H0Y8X0_HUMAN Protein DEK OS=Homo sapiens OX=9606 GN=DEK PE=1 SV=2	239	NKEESSDDEDKE
KEKETFPVTEVL	tr|Q0GP04|Q0GP04_HSPV	167	sp|O14924|RGS12_HUMAN Regulator of G-protein signaling 12 OS=Homo sapiens OX=9606 GN=RGS12 PE=1 SV=1	1049	KAKPTKPVTEVL
KDRELLENELVA	tr|Q0GP19|Q0GP19_HSPV	28	sp|O14776|TCRG1_HUMAN Transcription elongation regulator 1 OS=Homo sapiens OX=9606 GN=TCERG1 PE=1 SV=2	767	KDREALFNEFVA
KDRELLENELVA	tr|Q0GP19|Q0GP19_HSPV	28	tr|G3V220|G3V220_HUMAN Transcription elongation regulator 1 OS=Homo sapiens OX=9606 GN=TCERG1 PE=1 SV=1	767	KDREALFNEFVA
DISDKSSKDKSF	tr|Q0GNP8|Q0GNP8_HSPV	377	sp|Q15058|KIF14_HUMAN Kinesin-like protein KIF14 OS=Homo sapiens OX=9606 GN=KIF14 PE=1 SV=1	1114	DISDKSSSDTSI
AIDNSNKSRMNP	tr|Q0GP45|Q0GP45_HSPV	362	tr|A0A3B3IUB9|A0A3B3IUB9_HUMAN Baculoviral IAP repeat-containing protein 6 (Fragment) OS=Homo sapiens OX=9606 GN=BIRC6 PE=1 SV=1	1663	HNKNSNKSRMNP
AIDNSNKSRMNP	tr|Q0GP45|Q0GP45_HSPV	362	sp|Q9NR09|BIRC6_HUMAN Baculoviral IAP repeat-containing protein 6 OS=Homo sapiens OX=9606 GN=BIRC6 PE=1 SV=2	1743	HNKNSNKSRMNP
DSPIIRTGFTGT	tr|Q0GNQ4|Q0GNQ4_HSPV	85	tr|E5RJ65|E5RJ65_HUMAN Sorting nexin-16 (Fragment) OS=Homo sapiens OX=9606 GN=SNX16 PE=1 SV=1	69	SSPLIRTKFTGT
DSPIIRTGFTGT	tr|Q0GNQ4|Q0GNQ4_HSPV	85	tr|E5RHF1|E5RHF1_HUMAN Sorting nexin-16 (Fragment) OS=Homo sapiens OX=9606 GN=SNX16 PE=1 SV=1	69	SSPLIRTKFTGT
DSPIIRTGFTGT	tr|Q0GNQ4|Q0GNQ4_HSPV	85	tr|E5RGS8|E5RGS8_HUMAN Sorting nexin-16 (Fragment) OS=Homo sapiens OX=9606 GN=SNX16 PE=1 SV=1	69	SSPLIRTKFTGT
DSPIIRTGFTGT	tr|Q0GNQ4|Q0GNQ4_HSPV	85	tr|E5RGQ6|E5RGQ6_HUMAN Sorting nexin-16 (Fragment) OS=Homo sapiens OX=9606 GN=SNX16 PE=1 SV=1	69	SSPLIRTKFTGT
DSPIIRTGFTGT	tr|Q0GNQ4|Q0GNQ4_HSPV	85	sp|P57768|SNX16_HUMAN Sorting nexin-16 OS=Homo sapiens OX=9606 GN=SNX16 PE=1 SV=2	69	SSPLIRTKFTGT
DSPIIRTGFTGT	tr|Q0GNQ4|Q0GNQ4_HSPV	85	tr|A0A0C4DGW2|A0A0C4DGW2_HUMAN Sorting nexin-16 OS=Homo sapiens OX=9606 GN=SNX16 PE=1 SV=1	69	SSPLIRTKFTGT
YLEIDDLKAKTN	tr|Q0GNX5|Q0GNX5_HSPV	62	tr|H0YLP3|H0YLP3_HUMAN Eukaryotic translation initiation factor 3 30 kDa subunit (Fragment) OS=Homo sapiens OX=9606 GN=EIF3J PE=1 SV=1	49	SLEIDDLKKITN
YLEIDDLKAKTN	tr|Q0GNX5|Q0GNX5_HSPV	62	sp|O75822|EIF3J_HUMAN Eukaryotic translation initiation factor 3 subunit J OS=Homo sapiens OX=9606 GN=EIF3J PE=1 SV=2	190	SLEIDDLKKITN
YLEIDDLKAKTN	tr|Q0GNX5|Q0GNX5_HSPV	62	tr|H0YGJ7|H0YGJ7_HUMAN Eukaryotic translation initiation factor 3 30 kDa subunit (Fragment) OS=Homo sapiens OX=9606 GN=EIF3J PE=1 SV=1	69	SLEIDDLKKITN
VLSGITDSSSVL	tr|Q0GNQ8|Q0GNQ8_HSPV	192	sp|O75830|SPI2_HUMAN Serpin I2 OS=Homo sapiens OX=9606 GN=SERPINI2 PE=1 SV=1	316	DLSGITDSSEVY
VLSGITDSSSVL	tr|Q0GNQ8|Q0GNQ8_HSPV	192	tr|A0A0C4DGW9|A0A0C4DGW9_HUMAN Serpin I2 OS=Homo sapiens OX=9606 GN=SERPINI2 PE=1 SV=1	326	DLSGITDSSEVY
IGELLLVSAEVM	tr|Q0GNU0|Q0GNU0_HSPV	241	sp|Q6IQ32|ADNP2_HUMAN Activity-dependent neuroprotector homeobox protein 2 OS=Homo sapiens OX=9606 GN=ADNP2 PE=1 SV=1	958	NSELLLVSGEVM
DALSLEEYLYLT	tr|Q0GNX8|Q0GNX8_HSPV	157	sp|Q08AE8|SPIR1_HUMAN Protein spire homolog 1 OS=Homo sapiens OX=9606 GN=SPIRE1 PE=1 SV=3	38	DALSLEEILRLY
IRTEKPRVSLAL	tr|Q0GNM3|Q0GNM3_HSPV	76	sp|C9JSJ3|MEIOS_HUMAN Meiosis initiator protein OS=Homo sapiens OX=9606 GN=MEIOSIN PE=3 SV=2	189	TRTPKPRRSLAL
SLKGIKDDDADP	tr|Q0GNQ8|Q0GNQ8_HSPV	58	tr|E9PGE5|E9PGE5_HUMAN TBC1 domain family member 23 OS=Homo sapiens OX=9606 GN=TBC1D23 PE=1 SV=1	164	TLLGIKDDDADL
SLKGIKDDDADP	tr|Q0GNQ8|Q0GNQ8_HSPV	58	sp|Q9NUY8|TBC23_HUMAN TBC1 domain family member 23 OS=Homo sapiens OX=9606 GN=TBC1D23 PE=1 SV=3	301	TLLGIKDDDADL
YDMIIISDIAVI	tr|Q0GNM3|Q0GNM3_HSPV	133	sp|Q8TDD5|MCLN3_HUMAN Mucolipin-3 OS=Homo sapiens OX=9606 GN=MCOLN3 PE=1 SV=1	342	YIMIIISDILTI
GGCTLNIIQVTI	tr|Q0GNN5|Q0GNN5_HSPV	108	tr|A0A494C1K3|A0A494C1K3_HUMAN General transcription factor II-I OS=Homo sapiens OX=9606 GN=GTF2I PE=1 SV=1	1001	GVEDLNIIQVTI
GGCTLNIIQVTI	tr|Q0GNN5|Q0GNN5_HSPV	108	sp|P78347|GTF2I_HUMAN General transcription factor II-I OS=Homo sapiens OX=9606 GN=GTF2I PE=1 SV=2	840	GVEDLNIIQVTI
RYSSKEGEYKYI	tr|Q0GNU6|Q0GNU6_HSPV	1	tr|Q5T8G8|Q5T8G8_HUMAN Dynein intermediate chain 1, axonemal (Fragment) OS=Homo sapiens OX=9606 GN=DNAI1 PE=1 SV=1	72	RYSFKEGTYKPI
RYSSKEGEYKYI	tr|Q0GNU6|Q0GNU6_HSPV	1	sp|Q9UI46|DNAI1_HUMAN Dynein intermediate chain 1, axonemal OS=Homo sapiens OX=9606 GN=DNAI1 PE=1 SV=1	83	RYSFKEGTYKPI
RYSSKEGEYKYI	tr|Q0GNU6|Q0GNU6_HSPV	1	tr|A0A087WWV9|A0A087WWV9_HUMAN Dynein intermediate chain 1, axonemal OS=Homo sapiens OX=9606 GN=DNAI1 PE=1 SV=1	83	RYSFKEGTYKPI
ELLLVSAEVMHE	tr|Q0GNU0|Q0GNU0_HSPV	243	sp|Q6IQ32|ADNP2_HUMAN Activity-dependent neuroprotector homeobox protein 2 OS=Homo sapiens OX=9606 GN=ADNP2 PE=1 SV=1	960	ELLLVSGEVMHD
STSSLKDIDKEL	tr|Q0GNV3|Q0GNV3_HSPV	12	sp|O95248|MTMR5_HUMAN Myotubularin-related protein 5 OS=Homo sapiens OX=9606 GN=SBF1 PE=1 SV=4	357	STSSLKMQDKEL
ARHLTRFPTSKS	tr|Q0GP23|Q0GP23_HSPV	143	sp|Q8TD84|DSCL1_HUMAN Down syndrome cell adhesion molecule-like protein 1 OS=Homo sapiens OX=9606 GN=DSCAML1 PE=1 SV=2	1941	ARHLTLDPASKS
ARHLTRFPTSKS	tr|Q0GP23|Q0GP23_HSPV	143	tr|A0A384DVL8|A0A384DVL8_HUMAN Down syndrome cell adhesion molecule like 1, isoform CRA_b OS=Homo sapiens OX=9606 GN=DSCAML1 PE=1 SV=1	2001	ARHLTLDPASKS
ITKSRAEIAVIS	tr|Q0GNU8|Q0GNU8_HSPV	90	sp|A2A2Z9|AN18B_HUMAN Ankyrin repeat domain-containing protein 18B OS=Homo sapiens OX=9606 GN=ANKRD18B PE=1 SV=1	921	ITKSDKKIAVIS
ITKSRAEIAVIS	tr|Q0GNU8|Q0GNU8_HSPV	90	tr|A2A300|A2A300_HUMAN Ankyrin repeat domain-containing protein 18B (Fragment) OS=Homo sapiens OX=9606 GN=ANKRD18B PE=1 SV=1	302	ITKSDKKIAVIS
ITKSRAEIAVIS	tr|Q0GNU8|Q0GNU8_HSPV	90	tr|R4GNB3|R4GNB3_HUMAN Ankyrin repeat domain-containing protein 18B (Fragment) OS=Homo sapiens OX=9606 GN=ANKRD18B PE=4 SV=1	69	ITKSDKKIAVIS
AGIYINSNELGF	tr|Q0GNP5|Q0GNP5_HSPV	1	sp|Q9ULE6|PALD_HUMAN Paladin OS=Homo sapiens OX=9606 GN=PALD1 PE=1 SV=3	811	AGIYEILNELGF
GDDDVTPLILEE	tr|Q0GNN0|Q0GNN0_HSPV	23	tr|K7ELM2|K7ELM2_HUMAN Telomerase-binding protein EST1A (Fragment) OS=Homo sapiens OX=9606 GN=SMG6 PE=1 SV=1	105	PDDDLTLLILEE
GDDDVTPLILEE	tr|Q0GNN0|Q0GNN0_HSPV	23	tr|K7EKV2|K7EKV2_HUMAN Telomerase-binding protein EST1A (Fragment) OS=Homo sapiens OX=9606 GN=SMG6 PE=1 SV=8	105	PDDDLTLLILEE
GDDDVTPLILEE	tr|Q0GNN0|Q0GNN0_HSPV	23	tr|I3L390|I3L390_HUMAN Telomerase-binding protein EST1A (Fragment) OS=Homo sapiens OX=9606 GN=SMG6 PE=1 SV=2	48	PDDDLTLLILEE
GDDDVTPLILEE	tr|Q0GNN0|Q0GNN0_HSPV	23	sp|Q86US8|EST1A_HUMAN Telomerase-binding protein EST1A OS=Homo sapiens OX=9606 GN=SMG6 PE=1 SV=2	1082	PDDDLTLLILEE
YTKTLILTELFL	tr|Q0GNV5|Q0GNV5_HSPV	57	sp|P03886|NU1M_HUMAN NADH-ubiquinone oxidoreductase chain 1 OS=Homo sapiens OX=9606 GN=MT-ND1 PE=1 SV=1	260	VTKTLLLTSLFL
ELNKRLEGNFKK	tr|Q0GNT8|Q0GNT8_HSPV	142	tr|H7BYL6|H7BYL6_HUMAN A-kinase anchor protein 9 (Fragment) OS=Homo sapiens OX=9606 GN=AKAP9 PE=1 SV=1	491	ELQKLLEGNEKK
ELNKRLEGNFKK	tr|Q0GNT8|Q0GNT8_HSPV	142	sp|Q99996|AKAP9_HUMAN A-kinase anchor protein 9 OS=Homo sapiens OX=9606 GN=AKAP9 PE=1 SV=4	2645	ELQKLLEGNEKK
ELNKRLEGNFKK	tr|Q0GNT8|Q0GNT8_HSPV	142	tr|A0A0A0MRE9|A0A0A0MRE9_HUMAN A-kinase anchor protein 9 OS=Homo sapiens OX=9606 GN=AKAP9 PE=1 SV=1	2598	ELQKLLEGNEKK
ELNKRLEGNFKK	tr|Q0GNT8|Q0GNT8_HSPV	142	tr|A0A0A0MRF6|A0A0A0MRF6_HUMAN A-kinase anchor protein 9 OS=Homo sapiens OX=9606 GN=AKAP9 PE=1 SV=1	2656	ELQKLLEGNEKK
TIDGNSLPKTTY	tr|Q0GNQ1|Q0GNQ1_HSPV	223	sp|A0AUZ9|KAL1L_HUMAN KAT8 regulatory NSL complex subunit 1-like protein OS=Homo sapiens OX=9606 GN=KANSL1L PE=1 SV=2	280	TILGNSLPKCTE
LYYAGLFYTLID	tr|Q0GNY2|Q0GNY2_HSPV	63	tr|A0A0B4J1Y2|A0A0B4J1Y2_HUMAN Tetratricopeptide repeat protein 21A OS=Homo sapiens OX=9606 GN=TTC21A PE=1 SV=1	113	LYYAGLFLWLIG
LYYAGLFYTLID	tr|Q0GNY2|Q0GNY2_HSPV	63	sp|Q8NDW8|TT21A_HUMAN Tetratricopeptide repeat protein 21A OS=Homo sapiens OX=9606 GN=TTC21A PE=1 SV=3	113	LYYAGLFLWLIG
SEGNLSIKTPNE	tr|Q0GP13|Q0GP13_HSPV	303	tr|A2VCS9|A2VCS9_HUMAN MAP9 protein (Fragment) OS=Homo sapiens OX=9606 GN=MAP9 PE=1 SV=1	259	SEGNASGKDPNE
SEGNLSIKTPNE	tr|Q0GP13|Q0GP13_HSPV	303	sp|Q49MG5|MAP9_HUMAN Microtubule-associated protein 9 OS=Homo sapiens OX=9606 GN=MAP9 PE=1 SV=3	260	SEGNASGKDPNE
SEGNLSIKTPNE	tr|Q0GP13|Q0GP13_HSPV	303	tr|A0A0C4DG83|A0A0C4DG83_HUMAN Aster-associated protein, isoform CRA_b OS=Homo sapiens OX=9606 GN=MAP9 PE=1 SV=1	260	SEGNASGKDPNE
DKGLLEYATKYG	tr|Q0GNU0|Q0GNU0_HSPV	830	tr|H7C4R5|H7C4R5_HUMAN FAST kinase domain-containing protein 4 (Fragment) OS=Homo sapiens OX=9606 GN=TBRG4 PE=1 SV=1	223	DKGSLEVATQYG
DKGLLEYATKYG	tr|Q0GNU0|Q0GNU0_HSPV	830	sp|Q969Z0|FAKD4_HUMAN FAST kinase domain-containing protein 4 OS=Homo sapiens OX=9606 GN=TBRG4 PE=1 SV=1	508	DKGSLEVATQYG
DDDVTPLILEEF	tr|Q0GNN0|Q0GNN0_HSPV	24	tr|K7ELM2|K7ELM2_HUMAN Telomerase-binding protein EST1A (Fragment) OS=Homo sapiens OX=9606 GN=SMG6 PE=1 SV=1	106	DDDLTLLILEED
DDDVTPLILEEF	tr|Q0GNN0|Q0GNN0_HSPV	24	tr|K7EKV2|K7EKV2_HUMAN Telomerase-binding protein EST1A (Fragment) OS=Homo sapiens OX=9606 GN=SMG6 PE=1 SV=8	106	DDDLTLLILEED
DDDVTPLILEEF	tr|Q0GNN0|Q0GNN0_HSPV	24	tr|I3L390|I3L390_HUMAN Telomerase-binding protein EST1A (Fragment) OS=Homo sapiens OX=9606 GN=SMG6 PE=1 SV=2	49	DDDLTLLILEED
DDDVTPLILEEF	tr|Q0GNN0|Q0GNN0_HSPV	24	sp|Q86US8|EST1A_HUMAN Telomerase-binding protein EST1A OS=Homo sapiens OX=9606 GN=SMG6 PE=1 SV=2	1083	DDDLTLLILEED
IGIMFKIECVEL	tr|Q0GNY6|Q0GNY6_HSPV	699	sp|P61026|RAB10_HUMAN Ras-related protein Rab-10 OS=Homo sapiens OX=9606 GN=RAB10 PE=1 SV=1	42	IGIDFKIKTVEL
KDEFKNTSMILL	tr|Q0GNV4|Q0GNV4_HSPV	26	sp|Q02223|TNR17_HUMAN Tumor necrosis factor receptor superfamily member 17 OS=Homo sapiens OX=9606 GN=TNFRSF17 PE=1 SV=2	86	KDEFKNTGSGLL
DLLAKDIPISYR	tr|Q0GP49|Q0GP49_HSPV	178	sp|Q8NH73|OR4S2_HUMAN Olfactory receptor 4S2 OS=Homo sapiens OX=9606 GN=OR4S2 PE=3 SV=2	82	DLLAKDKTISYV
KVERLSDTSADS	tr|Q0GP50|Q0GP50_HSPV	158	sp|Q5T5P2|SKT_HUMAN Sickle tail protein homolog OS=Homo sapiens OX=9606 GN=KIAA1217 PE=1 SV=2	136	PVEHLSETSADS
KVERLSDTSADS	tr|Q0GP50|Q0GP50_HSPV	158	tr|Q5T5P1|Q5T5P1_HUMAN Sickle tail protein homolog (Fragment) OS=Homo sapiens OX=9606 GN=KIAA1217 PE=1 SV=2	136	PVEHLSETSADS
VDISDKSSKDKS	tr|Q0GNP8|Q0GNP8_HSPV	376	sp|Q15058|KIF14_HUMAN Kinesin-like protein KIF14 OS=Homo sapiens OX=9606 GN=KIF14 PE=1 SV=1	1113	HDISDKSSSDTS
LLLVSAEVMHEN	tr|Q0GNU0|Q0GNU0_HSPV	244	sp|Q6IQ32|ADNP2_HUMAN Activity-dependent neuroprotector homeobox protein 2 OS=Homo sapiens OX=9606 GN=ADNP2 PE=1 SV=1	961	LLLVSGEVMHDS
DVAAGSSSSSST	tr|Q0GP37|Q0GP37_HSPV	242	sp|Q6VY07|PACS1_HUMAN Phosphofurin acidic cluster sorting protein 1 OS=Homo sapiens OX=9606 GN=PACS1 PE=1 SV=2	61	SAAAASSSSSST
LLRDNAYLSIIN	tr|Q0GNU0|Q0GNU0_HSPV	1029	sp|P46940|IQGA1_HUMAN Ras GTPase-activating-like protein IQGAP1 OS=Homo sapiens OX=9606 GN=IQGAP1 PE=1 SV=1	1241	FLGDNAHLSIIN
LLRDNAYLSIIN	tr|Q0GNU0|Q0GNU0_HSPV	1029	tr|H0YLE8|H0YLE8_HUMAN Ras GTPase-activating-like protein IQGAP1 OS=Homo sapiens OX=9606 GN=IQGAP1 PE=1 SV=1	669	FLGDNAHLSIIN
IVGLTAKVKCPS	tr|Q0GP90|Q0GP90_HSPV	199	sp|Q09666|AHNK_HUMAN Neuroblast differentiation-associated protein AHNAK OS=Homo sapiens OX=9606 GN=AHNAK PE=1 SV=2	5175	IEGLDAKVKTPS
VDGSYYTKVRKD	tr|Q0GP51|Q0GP51_HSPV	63	tr|C9JHU5|C9JHU5_HUMAN Tensin-3 (Fragment) OS=Homo sapiens OX=9606 GN=TNS3 PE=1 SV=1	438	VDGSLYAKVRKK
VDGSYYTKVRKD	tr|Q0GP51|Q0GP51_HSPV	63	tr|E9PCX8|E9PCX8_HUMAN Tensin-3 (Fragment) OS=Homo sapiens OX=9606 GN=TNS3 PE=1 SV=8	452	VDGSLYAKVRKK
VDGSYYTKVRKD	tr|Q0GP51|Q0GP51_HSPV	63	sp|Q68CZ2|TENS3_HUMAN Tensin-3 OS=Homo sapiens OX=9606 GN=TNS3 PE=1 SV=2	349	VDGSLYAKVRKK
PSLAETTPDKKL	tr|Q0GNM8|Q0GNM8_HSPV	406	tr|Q5VW52|Q5VW52_HUMAN Glycerol-3-phosphate acyltransferase 1, mitochondrial OS=Homo sapiens OX=9606 GN=GPAM PE=1 SV=1	669	PSLAEQQWDKKL
PSLAETTPDKKL	tr|Q0GNM8|Q0GNM8_HSPV	406	sp|Q9HCL2|GPAT1_HUMAN Glycerol-3-phosphate acyltransferase 1, mitochondrial OS=Homo sapiens OX=9606 GN=GPAM PE=1 SV=3	669	PSLAEQQWDKKL
LLDPDSFPSLLD	tr|Q0GP37|Q0GP37_HSPV	228	sp|Q9Y2J2|E41L3_HUMAN Band 4.1-like protein 3 OS=Homo sapiens OX=9606 GN=EPB41L3 PE=1 SV=2	590	LQLPESFPSLLD
PKLVDKALSKGV	tr|Q0GNW8|Q0GNW8_HSPV	433	sp|Q9Y6V0|PCLO_HUMAN Protein piccolo OS=Homo sapiens OX=9606 GN=PCLO PE=1 SV=5	4608	PKAVDKAKSPGV
SIEVFSLSASTL	tr|Q0GNS5|Q0GNS5_HSPV	126	tr|G3V3F4|G3V3F4_HUMAN Centrosomal protein of 128 kDa (Fragment) OS=Homo sapiens OX=9606 GN=CEP128 PE=1 SV=8	103	SISVTSLSASDL
SIEVFSLSASTL	tr|Q0GNS5|Q0GNS5_HSPV	126	tr|Q86TS1|Q86TS1_HUMAN Centrosomal protein of 128 kDa (Fragment) OS=Homo sapiens OX=9606 GN=CEP128 PE=1 SV=1	103	SISVTSLSASDL
SIEVFSLSASTL	tr|Q0GNS5|Q0GNS5_HSPV	126	sp|Q6ZU80|CE128_HUMAN Centrosomal protein of 128 kDa OS=Homo sapiens OX=9606 GN=CEP128 PE=1 SV=2	103	SISVTSLSASDL
AADTECDDITGN	tr|Q0GP39|Q0GP39_HSPV	46	tr|C9J6Y5|C9J6Y5_HUMAN Ubinuclein-2 (Fragment) OS=Homo sapiens OX=9606 GN=UBN2 PE=1 SV=1	72	ASDTEEDDITDN
AADTECDDITGN	tr|Q0GP39|Q0GP39_HSPV	46	tr|H7C4P8|H7C4P8_HUMAN Ubinuclein-2 (Fragment) OS=Homo sapiens OX=9606 GN=UBN2 PE=1 SV=1	18	ASDTEEDDITDN
AADTECDDITGN	tr|Q0GP39|Q0GP39_HSPV	46	sp|Q6ZU65|UBN2_HUMAN Ubinuclein-2 OS=Homo sapiens OX=9606 GN=UBN2 PE=1 SV=2	249	ASDTEEDDITDN
NVKIDNRRNLVF	tr|Q0GP45|Q0GP45_HSPV	225	sp|Q6ZMV8|ZN730_HUMAN Putative zinc finger protein 730 OS=Homo sapiens OX=9606 GN=ZNF730 PE=2 SV=1	31	NVMLDNYRNLVF
NVKIDNRRNLVF	tr|Q0GP45|Q0GP45_HSPV	225	sp|Q14593|ZN273_HUMAN Zinc finger protein 273 OS=Homo sapiens OX=9606 GN=ZNF273 PE=1 SV=3	64	NVMLDNYRNLVF
DVISIDKTRTNK	tr|Q0GNN6|Q0GNN6_HSPV	53	sp|P62701|RS4X_HUMAN 40S ribosomal protein S4, X isoform OS=Homo sapiens OX=9606 GN=RPS4X PE=1 SV=2	88	DVISIDKTGENF
QIIGLIYIYNKI	tr|Q0GNM8|Q0GNM8_HSPV	323	sp|Q5TAH2|SL9C2_HUMAN Sodium/hydrogen exchanger 11 OS=Homo sapiens OX=9606 GN=SLC9C2 PE=2 SV=1	614	QIINLIYIYPMI
KMYYKLSFKKRK	tr|Q0GP25|Q0GP25_HSPV	89	tr|A0A2R8YED7|A0A2R8YED7_HUMAN Connector enhancer of kinase suppressor of ras 2 OS=Homo sapiens OX=9606 GN=CNKSR2 PE=1 SV=1	907	KMEYKLSFIKRC
KMYYKLSFKKRK	tr|Q0GP25|Q0GP25_HSPV	89	sp|Q8WXI2|CNKR2_HUMAN Connector enhancer of kinase suppressor of ras 2 OS=Homo sapiens OX=9606 GN=CNKSR2 PE=1 SV=1	932	KMEYKLSFIKRC
KMYYKLSFKKRK	tr|Q0GP25|Q0GP25_HSPV	89	tr|A0A2R8Y700|A0A2R8Y700_HUMAN Connector enhancer of kinase suppressor of ras 2 OS=Homo sapiens OX=9606 GN=CNKSR2 PE=1 SV=1	853	KMEYKLSFIKRC
KMYYKLSFKKRK	tr|Q0GP25|Q0GP25_HSPV	89	tr|A0A2R8Y7A1|A0A2R8Y7A1_HUMAN Connector enhancer of kinase suppressor of ras 2 OS=Homo sapiens OX=9606 GN=CNKSR2 PE=1 SV=1	883	KMEYKLSFIKRC
LNNYEYEELDLK	tr|Q0GNU3|Q0GNU3_HSPV	231	tr|Q5T321|Q5T321_HUMAN Neurobeachin OS=Homo sapiens OX=9606 GN=NBEA PE=1 SV=1	2321	LTNYESEELDLT
LNNYEYEELDLK	tr|Q0GNU3|Q0GNU3_HSPV	231	sp|Q8NFP9|NBEA_HUMAN Neurobeachin OS=Homo sapiens OX=9606 GN=NBEA PE=1 SV=3	2324	LTNYESEELDLT
LNNYEYEELDLK	tr|Q0GNU3|Q0GNU3_HSPV	231	tr|F5GXV7|F5GXV7_HUMAN Neurobeachin OS=Homo sapiens OX=9606 GN=NBEA PE=1 SV=2	2325	LTNYESEELDLT
LNNYEYEELDLK	tr|Q0GNU3|Q0GNU3_HSPV	231	tr|A0A0D9SF28|A0A0D9SF28_HUMAN Neurobeachin OS=Homo sapiens OX=9606 GN=NBEA PE=1 SV=1	2324	LTNYESEELDLT
SPIIRTGFTGTC	tr|Q0GNQ4|Q0GNQ4_HSPV	86	tr|E5RJ65|E5RJ65_HUMAN Sorting nexin-16 (Fragment) OS=Homo sapiens OX=9606 GN=SNX16 PE=1 SV=1	70	SPLIRTKFTGTA
SPIIRTGFTGTC	tr|Q0GNQ4|Q0GNQ4_HSPV	86	tr|E5RHF1|E5RHF1_HUMAN Sorting nexin-16 (Fragment) OS=Homo sapiens OX=9606 GN=SNX16 PE=1 SV=1	70	SPLIRTKFTGTA
SPIIRTGFTGTC	tr|Q0GNQ4|Q0GNQ4_HSPV	86	tr|E5RGS8|E5RGS8_HUMAN Sorting nexin-16 (Fragment) OS=Homo sapiens OX=9606 GN=SNX16 PE=1 SV=1	70	SPLIRTKFTGTA
SPIIRTGFTGTC	tr|Q0GNQ4|Q0GNQ4_HSPV	86	tr|E5RGQ6|E5RGQ6_HUMAN Sorting nexin-16 (Fragment) OS=Homo sapiens OX=9606 GN=SNX16 PE=1 SV=1	70	SPLIRTKFTGTA
SPIIRTGFTGTC	tr|Q0GNQ4|Q0GNQ4_HSPV	86	sp|P57768|SNX16_HUMAN Sorting nexin-16 OS=Homo sapiens OX=9606 GN=SNX16 PE=1 SV=2	70	SPLIRTKFTGTA
SPIIRTGFTGTC	tr|Q0GNQ4|Q0GNQ4_HSPV	86	tr|A0A0C4DGW2|A0A0C4DGW2_HUMAN Sorting nexin-16 OS=Homo sapiens OX=9606 GN=SNX16 PE=1 SV=1	70	SPLIRTKFTGTA
LLIYLLGRNLIL	tr|Q0GNS2|Q0GNS2_HSPV	192	tr|H3BMZ1|H3BMZ1_HUMAN Very-long-chain (3R)-3-hydroxyacyl-CoA dehydratase (Fragment) OS=Homo sapiens OX=9606 GN=HACD3 PE=1 SV=1	100	SLIQLLGRNFIL
LLIYLLGRNLIL	tr|Q0GNS2|Q0GNS2_HSPV	192	tr|H3BS72|H3BS72_HUMAN Very-long-chain (3R)-3-hydroxyacyl-CoA dehydratase OS=Homo sapiens OX=9606 GN=HACD3 PE=1 SV=1	255	SLIQLLGRNFIL
LLIYLLGRNLIL	tr|Q0GNS2|Q0GNS2_HSPV	192	sp|Q9P035|HACD3_HUMAN Very-long-chain (3R)-3-hydroxyacyl-CoA dehydratase 3 OS=Homo sapiens OX=9606 GN=HACD3 PE=1 SV=2	217	SLIQLLGRNFIL
LLIYLLGRNLIL	tr|Q0GNS2|Q0GNS2_HSPV	192	tr|H3BRL8|H3BRL8_HUMAN Very-long-chain (3R)-3-hydroxyacyl-CoA dehydratase OS=Homo sapiens OX=9606 GN=HACD3 PE=1 SV=1	100	SLIQLLGRNFIL
LLIYLLGRNLIL	tr|Q0GNS2|Q0GNS2_HSPV	192	tr|H3BPZ1|H3BPZ1_HUMAN Very-long-chain (3R)-3-hydroxyacyl-CoA dehydratase OS=Homo sapiens OX=9606 GN=HACD3 PE=1 SV=1	192	SLIQLLGRNFIL
ISDLILSEIISN	tr|Q0GP34|Q0GP34_HSPV	28	sp|Q13972|RGRF1_HUMAN Ras-specific guanine nucleotide-releasing factor 1 OS=Homo sapiens OX=9606 GN=RASGRF1 PE=1 SV=2	1089	ISNLIASEIIRN
SVRSLNKSSSID	tr|Q0GNU6|Q0GNU6_HSPV	269	sp|P55283|CADH4_HUMAN Cadherin-4 OS=Homo sapiens OX=9606 GN=CDH4 PE=2 SV=2	879	SVSSLNSSSSGD
SVRSLNKSSSID	tr|Q0GNU6|Q0GNU6_HSPV	269	tr|A0A0G2JRA4|A0A0G2JRA4_HUMAN Cadherin-4 (Fragment) OS=Homo sapiens OX=9606 GN=CDH4 PE=1 SV=1	529	SVSSLNSSSSGD
SVRSLNKSSSID	tr|Q0GNU6|Q0GNU6_HSPV	269	tr|A0A087WX99|A0A087WX99_HUMAN Cadherin-4 OS=Homo sapiens OX=9606 GN=CDH4 PE=1 SV=1	785	SVSSLNSSSSGD
IQFILVNILVAV	tr|Q0GNW6|Q0GNW6_HSPV	91	sp|O14494|PLPP1_HUMAN Phospholipid phosphatase 1 OS=Homo sapiens OX=9606 GN=PLPP1 PE=1 SV=1	233	IQGALVAILVAV
LENLEKSAKLFA	tr|Q0GNT1|Q0GNT1_HSPV	62	sp|Q15006|EMC2_HUMAN ER membrane protein complex subunit 2 OS=Homo sapiens OX=9606 GN=EMC2 PE=1 SV=1	205	LENLELSRKYFA
LENLEKSAKLFA	tr|Q0GNT1|Q0GNT1_HSPV	62	tr|E7ENI6|E7ENI6_HUMAN Islet cell autoantigen 1 OS=Homo sapiens OX=9606 GN=ICA1 PE=1 SV=1	276	LENLEKSKVLFI
VTFGKDQRSKIL	tr|Q0GNZ8|Q0GNZ8_HSPV	230	tr|A0A1W2PQJ7|A0A1W2PQJ7_HUMAN Retinoic acid-induced protein 1 OS=Homo sapiens OX=9606 GN=RAI1 PE=1 SV=1	1088	STPGKDQRSMIL
VTFGKDQRSKIL	tr|Q0GNZ8|Q0GNZ8_HSPV	230	sp|Q7Z5J4|RAI1_HUMAN Retinoic acid-induced protein 1 OS=Homo sapiens OX=9606 GN=RAI1 PE=1 SV=2	1135	STPGKDQRSMIL
ILFIDIHRVTPF	tr|Q0GNM1|Q0GNM1_HSPV	112	sp|Q16610|ECM1_HUMAN Extracellular matrix protein 1 OS=Homo sapiens OX=9606 GN=ECM1 PE=1 SV=2	409	ILTIDIGRVTPN
DNSGYGRLARST	tr|Q0GP19|Q0GP19_HSPV	588	sp|P32241|VIPR1_HUMAN Vasoactive intestinal polypeptide receptor 1 OS=Homo sapiens OX=9606 GN=VIPR1 PE=1 SV=1	332	DSSPYSRLARST
VAAGSSSSSSTT	tr|Q0GP37|Q0GP37_HSPV	243	sp|Q6VY07|PACS1_HUMAN Phosphofurin acidic cluster sorting protein 1 OS=Homo sapiens OX=9606 GN=PACS1 PE=1 SV=2	62	AAAASSSSSSTS
VAAGSSSSSSTT	tr|Q0GP37|Q0GP37_HSPV	243	tr|H7C1R2|H7C1R2_HUMAN Oxysterol-binding protein 2 (Fragment) OS=Homo sapiens OX=9606 GN=OSBP2 PE=1 SV=8	251	VAAFSVSSYSTT
VAAGSSSSSSTT	tr|Q0GP37|Q0GP37_HSPV	243	tr|H7C368|H7C368_HUMAN Oxysterol-binding protein (Fragment) OS=Homo sapiens OX=9606 GN=OSBP2 PE=1 SV=1	211	VAAFSVSSYSTT
VAAGSSSSSSTT	tr|Q0GP37|Q0GP37_HSPV	243	tr|H7C428|H7C428_HUMAN Oxysterol-binding protein (Fragment) OS=Homo sapiens OX=9606 GN=OSBP2 PE=1 SV=1	252	VAAFSVSSYSTT
VAAGSSSSSSTT	tr|Q0GP37|Q0GP37_HSPV	243	sp|Q969R2|OSBP2_HUMAN Oxysterol-binding protein 2 OS=Homo sapiens OX=9606 GN=OSBP2 PE=1 SV=2	580	VAAFSVSSYSTT
VAAGSSSSSSTT	tr|Q0GP37|Q0GP37_HSPV	243	tr|Q6ZN50|Q6ZN50_HUMAN Oxysterol-binding protein OS=Homo sapiens OX=9606 GN=OSBP2 PE=1 SV=1	407	VAAFSVSSYSTT
VAAGSSSSSSTT	tr|Q0GP37|Q0GP37_HSPV	243	tr|A0A0A0MSB4|A0A0A0MSB4_HUMAN Oxysterol-binding protein OS=Homo sapiens OX=9606 GN=OSBP2 PE=1 SV=1	300	VAAFSVSSYSTT
VAAGSSSSSSTT	tr|Q0GP37|Q0GP37_HSPV	243	tr|H0Y7K5|H0Y7K5_HUMAN Wilms tumor protein OS=Homo sapiens OX=9606 GN=WT1 PE=1 SV=2	323	VAAGSSSSVKWT
VAAGSSSSSSTT	tr|Q0GP37|Q0GP37_HSPV	243	sp|P19544|WT1_HUMAN Wilms tumor protein OS=Homo sapiens OX=9606 GN=WT1 PE=1 SV=2	250	VAAGSSSSVKWT
VAAGSSSSSSTT	tr|Q0GP37|Q0GP37_HSPV	243	tr|A0A0A0MT54|A0A0A0MT54_HUMAN Wilms tumor protein OS=Homo sapiens OX=9606 GN=WT1 PE=1 SV=2	323	VAAGSSSSVKWT
