query	query_seqname	query_start	target_seqname	target_start	target
AATPDREGVPLC	sp|P13889|POLN_RUBVT	648	tr|A0A0J9YWB6|A0A0J9YWB6_HUMAN RNA polymerase II subunit A C-terminal domain phosphatase (Fragment) OS=Homo sapiens OX=9606 GN=CTDP1 PE=1 SV=1	742	AAFPDREGVPPT
AATPDREGVPLC	sp|P13889|POLN_RUBVT	648	tr|A0A0J9YWJ4|A0A0J9YWJ4_HUMAN RNA polymerase II subunit A C-terminal domain phosphatase (Fragment) OS=Homo sapiens OX=9606 GN=CTDP1 PE=1 SV=1	674	AAFPDREGVPPT
AATPDREGVPLC	sp|P13889|POLN_RUBVT	648	tr|K7EJD2|K7EJD2_HUMAN RNA polymerase II subunit A C-terminal domain phosphatase (Fragment) OS=Homo sapiens OX=9606 GN=CTDP1 PE=1 SV=1	674	AAFPDREGVPPT
AATPDREGVPLC	sp|P13889|POLN_RUBVT	648	tr|A0A0A0MR03|A0A0A0MR03_HUMAN RNA polymerase II subunit A C-terminal domain phosphatase OS=Homo sapiens OX=9606 GN=CTDP1 PE=1 SV=1	623	AAFPDREGVPPT
AATPDREGVPLC	sp|P13889|POLN_RUBVT	648	sp|Q9Y5B0|CTDP1_HUMAN RNA polymerase II subunit A C-terminal domain phosphatase OS=Homo sapiens OX=9606 GN=CTDP1 PE=1 SV=3	742	AAFPDREGVPPT
TRAAADVLRRHH	sp|P13889|POLN_RUBVT	1837	sp|Q9UBN4|TRPC4_HUMAN Short transient receptor potential channel 4 OS=Homo sapiens OX=9606 GN=TRPC4 PE=1 SV=1	693	GRRAADNLRRHH
AGAPPLLRVGLT	sp|P13889|POLN_RUBVT	827	tr|H0YCB1|H0YCB1_HUMAN Nuclear receptor-binding protein 2 (Fragment) OS=Homo sapiens OX=9606 GN=NRBP2 PE=1 SV=1	136	EGTPRLLRVGLT
RFKETLSLPAPF	sp|P07566|POLS_RUBVT	765	sp|O43929|ORC4_HUMAN Origin recognition complex subunit 4 OS=Homo sapiens OX=9606 GN=ORC4 PE=1 SV=2	229	IFKEQLSLPAEF
DHFAFVEVIARI	sp|P13889|POLN_RUBVT	215	sp|Q96F07|CYFP2_HUMAN Cytoplasmic FMR1-interacting protein 2 OS=Homo sapiens OX=9606 GN=CYFIP2 PE=1 SV=2	446	EKFAFVEVIAMI
DHFAFVEVIARI	sp|P13889|POLN_RUBVT	215	tr|E7EVJ5|E7EVJ5_HUMAN Cytoplasmic FMR1-interacting protein OS=Homo sapiens OX=9606 GN=CYFIP2 PE=1 SV=1	420	EKFAFVEVIAMI
DHFAFVEVIARI	sp|P13889|POLN_RUBVT	215	tr|H7C229|H7C229_HUMAN Cytoplasmic FMR1-interacting protein 2 OS=Homo sapiens OX=9606 GN=CYFIP2 PE=1 SV=2	310	EKFAFVEVIAMI
DHFAFVEVIARI	sp|P13889|POLN_RUBVT	215	tr|E7EW33|E7EW33_HUMAN Cytoplasmic FMR1-interacting protein 2 OS=Homo sapiens OX=9606 GN=CYFIP2 PE=1 SV=1	250	EKFAFVEVIAMI
WAPRFGPLPVAP	sp|P07566|POLS_RUBVT	126	tr|A0A0B4J290|A0A0B4J290_HUMAN Protein yippee-like OS=Homo sapiens OX=9606 GN=YPEL3 PE=3 SV=1	26	AAPRVGPLPPAP
GGDALRPAGDAL	sp|P13889|POLN_RUBVT	324	sp|Q96PN6|ADCYA_HUMAN Adenylate cyclase type 10 OS=Homo sapiens OX=9606 GN=ADCY10 PE=1 SV=3	90	GGDILKFAGDAL
GGDALRPAGDAL	sp|P13889|POLN_RUBVT	324	sp|O43323|DHH_HUMAN Desert hedgehog protein OS=Homo sapiens OX=9606 GN=DHH PE=1 SV=1	304	GGDALRPARVAR
GVYRGEAAAAPR	sp|P13889|POLN_RUBVT	1801	tr|A0A1W2PQW2|A0A1W2PQW2_HUMAN Voltage-dependent T-type calcium channel subunit alpha-1H OS=Homo sapiens OX=9606 GN=CACNA1H PE=1 SV=1	1550	AAARGEAAAAPR
TETAGTQGPISY	sp|P07566|POLS_RUBVT	571	sp|P56693|SOX10_HUMAN Transcription factor SOX-10 OS=Homo sapiens OX=9606 GN=SOX10 PE=1 SV=1	358	TETAGPQGPPHY
RAAAAVEAMYTV	sp|P13889|POLN_RUBVT	1051	sp|P17040|ZSC20_HUMAN Zinc finger and SCAN domain-containing protein 20 OS=Homo sapiens OX=9606 GN=ZSCAN20 PE=1 SV=3	570	RARAAVRAMGTV
AAGGRGCQTPRA	sp|P07566|POLS_RUBVT	857	sp|Q9BQE6|LBHD1_HUMAN LBH domain-containing protein 1 OS=Homo sapiens OX=9606 GN=LBHD1 PE=1 SV=3	226	APGGRGCDRPRA
GTPVRNAASTTL	sp|P13889|POLN_RUBVT	1633	tr|Q5JSB6|Q5JSB6_HUMAN Transcription factor Dp-1 (Fragment) OS=Homo sapiens OX=9606 GN=TFDP1 PE=1 SV=8	65	GTPQRPAASNTL
GTPVRNAASTTL	sp|P13889|POLN_RUBVT	1633	tr|Q5JSB5|Q5JSB5_HUMAN Transcription factor Dp-1 (Fragment) OS=Homo sapiens OX=9606 GN=TFDP1 PE=1 SV=8	65	GTPQRPAASNTL
GTPVRNAASTTL	sp|P13889|POLN_RUBVT	1633	sp|Q14186|TFDP1_HUMAN Transcription factor Dp-1 OS=Homo sapiens OX=9606 GN=TFDP1 PE=1 SV=1	65	GTPQRPAASNTL
LESNADLCYGVR	sp|P13889|POLN_RUBVT	1917	sp|P17735|ATTY_HUMAN Tyrosine aminotransferase OS=Homo sapiens OX=9606 GN=TAT PE=1 SV=1	346	LKSNADLCYGAL
APRFGPLPVAPM	sp|P07566|POLS_RUBVT	127	tr|A0A0B4J290|A0A0B4J290_HUMAN Protein yippee-like OS=Homo sapiens OX=9606 GN=YPEL3 PE=3 SV=1	27	APRVGPLPPAPA
APVVAAIALGRF	sp|P07566|POLS_RUBVT	296	sp|P08908|5HT1A_HUMAN 5-hydroxytryptamine receptor 1A OS=Homo sapiens OX=9606 GN=HTR1A PE=1 SV=3	55	ACVVAAIALERS
AEASGTMGKEEV	sp|P13889|POLN_RUBVT	2044	sp|Q9H875|PKRI1_HUMAN PRKR-interacting protein 1 OS=Homo sapiens OX=9606 GN=PRKRIP1 PE=1 SV=1	166	AEASGTEEEEEV
AEASGTMGKEEV	sp|P13889|POLN_RUBVT	2044	tr|E9PC43|E9PC43_HUMAN PRKR-interacting protein 1 OS=Homo sapiens OX=9606 GN=PRKRIP1 PE=1 SV=1	109	AEASGTEEEEEV
ETCARAQDAPPA	sp|P13889|POLN_RUBVT	163	sp|P0DPQ3|PR20G_HUMAN Proline-rich protein 20G OS=Homo sapiens OX=9606 GN=PRR20G PE=3 SV=1	55	EPPARAQPAPPA
LLRGGDALRPAG	sp|P13889|POLN_RUBVT	321	sp|P57679|EVC_HUMAN Ellis-van Creveld syndrome protein OS=Homo sapiens OX=9606 GN=EVC PE=2 SV=1	14	LLLGRDALRPAP
LLRGGDALRPAG	sp|P13889|POLN_RUBVT	321	tr|E9PCN4|E9PCN4_HUMAN Ellis-van Creveld syndrome protein OS=Homo sapiens OX=9606 GN=EVC PE=1 SV=1	14	LLLGRDALRPAP
LLRGGDALRPAG	sp|P13889|POLN_RUBVT	321	sp|O43323|DHH_HUMAN Desert hedgehog protein OS=Homo sapiens OX=9606 GN=DHH PE=1 SV=1	301	LAPGGDALRPAR
VGGALARRYSGY	sp|P07566|POLS_RUBVT	814	tr|A0A590UJI3|A0A590UJI3_HUMAN Proton-translocating NAD(P)(+) transhydrogenase OS=Homo sapiens OX=9606 GN=NNT PE=1 SV=1	475	VGGYLAALYSGY
VGGALARRYSGY	sp|P07566|POLS_RUBVT	814	tr|A0A590UK15|A0A590UK15_HUMAN Proton-translocating NAD(P)(+) transhydrogenase OS=Homo sapiens OX=9606 GN=NNT PE=1 SV=1	547	VGGYLAALYSGY
VGGALARRYSGY	sp|P07566|POLS_RUBVT	814	sp|Q13423|NNTM_HUMAN NAD(P) transhydrogenase, mitochondrial OS=Homo sapiens OX=9606 GN=NNT PE=1 SV=3	606	VGGYLAALYSGY
VGGALARRYSGY	sp|P07566|POLS_RUBVT	814	tr|E9PCX7|E9PCX7_HUMAN Proton-translocating NAD(P)(+) transhydrogenase OS=Homo sapiens OX=9606 GN=NNT PE=1 SV=1	475	VGGYLAALYSGY
SADHFAFVEVIA	sp|P13889|POLN_RUBVT	213	sp|Q96F07|CYFP2_HUMAN Cytoplasmic FMR1-interacting protein 2 OS=Homo sapiens OX=9606 GN=CYFIP2 PE=1 SV=2	444	SEEKFAFVEVIA
SADHFAFVEVIA	sp|P13889|POLN_RUBVT	213	tr|E7EVJ5|E7EVJ5_HUMAN Cytoplasmic FMR1-interacting protein OS=Homo sapiens OX=9606 GN=CYFIP2 PE=1 SV=1	418	SEEKFAFVEVIA
SADHFAFVEVIA	sp|P13889|POLN_RUBVT	213	tr|H7C229|H7C229_HUMAN Cytoplasmic FMR1-interacting protein 2 OS=Homo sapiens OX=9606 GN=CYFIP2 PE=1 SV=2	308	SEEKFAFVEVIA
SADHFAFVEVIA	sp|P13889|POLN_RUBVT	213	tr|E7EW33|E7EW33_HUMAN Cytoplasmic FMR1-interacting protein 2 OS=Homo sapiens OX=9606 GN=CYFIP2 PE=1 SV=1	248	SEEKFAFVEVIA
TNLESNADLCYG	sp|P13889|POLN_RUBVT	1915	sp|P17735|ATTY_HUMAN Tyrosine aminotransferase OS=Homo sapiens OX=9606 GN=TAT PE=1 SV=1	344	SFLKSNADLCYG
LRTVVQERWVAL	sp|P13889|POLN_RUBVT	1503	sp|Q8IYA2|C144C_HUMAN Putative coiled-coil domain-containing protein 144C OS=Homo sapiens OX=9606 GN=CCDC144CP PE=5 SV=3	574	LRTVVQERNDAQ
LAREESVEAPPR	sp|P13889|POLN_RUBVT	189	tr|H0Y9L8|H0Y9L8_HUMAN Bifunctional lysine-specific demethylase and histidyl-hydroxylase (Fragment) OS=Homo sapiens OX=9606 GN=RIOX2 PE=1 SV=1	51	LAREYSVEAEER
LAREESVEAPPR	sp|P13889|POLN_RUBVT	189	sp|Q8IUF8|RIOX2_HUMAN Ribosomal oxygenase 2 OS=Homo sapiens OX=9606 GN=RIOX2 PE=1 SV=1	205	LAREYSVEAEER
LLHLLAQGANGA	sp|P13889|POLN_RUBVT	74	sp|P52797|EFNA3_HUMAN Ephrin-A3 OS=Homo sapiens OX=9606 GN=EFNA3 PE=1 SV=1	17	LLPLLAQGPGGA
LLHLLAQGANGA	sp|P13889|POLN_RUBVT	74	sp|Q8WY22|BRI3B_HUMAN BRI3-binding protein OS=Homo sapiens OX=9606 GN=BRI3BP PE=1 SV=1	24	LLGLLAPGAQGA
LLHLLAQGANGA	sp|P13889|POLN_RUBVT	74	tr|A0A5F9ZHY7|A0A5F9ZHY7_HUMAN BRI3-binding protein OS=Homo sapiens OX=9606 GN=BRI3BP PE=1 SV=1	24	LLGLLAPGAQGA
PVVAVVVAAEVC	sp|P13889|POLN_RUBVT	747	sp|P54753|EPHB3_HUMAN Ephrin type-B receptor 3 OS=Homo sapiens OX=9606 GN=EPHB3 PE=1 SV=2	570	FVVAVVVIAIVC
AVAFPVAGTAGA	sp|P13889|POLN_RUBVT	720	tr|E5RFM8|E5RFM8_HUMAN Cytoplasmic dynein 2 light intermediate chain 1 OS=Homo sapiens OX=9606 GN=DYNC2LI1 PE=1 SV=1	72	ASASQVAGTAGA
AVAFPVAGTAGA	sp|P13889|POLN_RUBVT	720	tr|A0A1B0GVY9|A0A1B0GVY9_HUMAN KIF-binding protein OS=Homo sapiens OX=9606 GN=KIFBP PE=1 SV=1	174	ASAFIVAGTTGA
PSYGRRPLEAGL	sp|P13889|POLN_RUBVT	803	tr|A0A3B3IRR3|A0A3B3IRR3_HUMAN Fibrosin-1-like protein OS=Homo sapiens OX=9606 GN=FBRSL1 PE=1 SV=1	130	PSENRRPLEAGS
PSYGRRPLEAGL	sp|P13889|POLN_RUBVT	803	sp|Q9HCM7|FBSL_HUMAN Fibrosin-1-like protein OS=Homo sapiens OX=9606 GN=FBRSL1 PE=1 SV=4	130	PSENRRPLEAGS
PSYGRRPLEAGL	sp|P13889|POLN_RUBVT	803	tr|A0A1B0GUN3|A0A1B0GUN3_HUMAN Fibrosin-1-like protein OS=Homo sapiens OX=9606 GN=FBRSL1 PE=1 SV=1	31	PSENRRPLEAGS
PLLGARLTPPVR	sp|P13889|POLN_RUBVT	1002	sp|Q15572|TAF1C_HUMAN TATA box-binding protein-associated factor RNA polymerase I subunit C OS=Homo sapiens OX=9606 GN=TAF1C PE=1 SV=2	487	PLLLARLLPPPR
PLLGARLTPPVR	sp|P13889|POLN_RUBVT	1002	tr|H3BR71|H3BR71_HUMAN TATA box-binding protein-associated factor RNA polymerase I subunit C (Fragment) OS=Homo sapiens OX=9606 GN=TAF1C PE=1 SV=1	104	PLLLARLLPPPR
DALCETAIEDPA	sp|P13889|POLN_RUBVT	2084	sp|Q9P2P6|STAR9_HUMAN StAR-related lipid transfer protein 9 OS=Homo sapiens OX=9606 GN=STARD9 PE=1 SV=3	1754	DALTETALEIPA
RVGLTPHRRLEL	sp|P13889|POLN_RUBVT	834	tr|A0A2R8Y682|A0A2R8Y682_HUMAN CMP-N-acetylneuraminate-beta-1,4-galactoside alpha-2,3-sialyltransferase (Fragment) OS=Homo sapiens OX=9606 GN=ST3GAL3 PE=3 SV=1	146	RVGLTPLPRLEC
PRQPLAPRNLAG	sp|P13889|POLN_RUBVT	2025	sp|P57058|HUNK_HUMAN Hormonally up-regulated neu tumor-associated kinase OS=Homo sapiens OX=9606 GN=HUNK PE=1 SV=1	693	PLQPLAPVNLAF
IALGRFGRHELQ	sp|P07566|POLS_RUBVT	302	sp|Q8NH43|OR4L1_HUMAN Olfactory receptor 4L1 OS=Homo sapiens OX=9606 GN=OR4L1 PE=3 SV=1	13	ILLGFFGRWELQ
RLTQRRAADLTE	sp|P13889|POLN_RUBVT	1812	tr|K7EIE2|K7EIE2_HUMAN Breast carcinoma-amplified sequence 3 (Fragment) OS=Homo sapiens OX=9606 GN=BCAS3 PE=1 SV=1	139	RLSQDRAQDLTE
HFAFVEVIARIH	sp|P13889|POLN_RUBVT	216	sp|Q96F07|CYFP2_HUMAN Cytoplasmic FMR1-interacting protein 2 OS=Homo sapiens OX=9606 GN=CYFIP2 PE=1 SV=2	447	KFAFVEVIAMIK
HFAFVEVIARIH	sp|P13889|POLN_RUBVT	216	tr|E7EVJ5|E7EVJ5_HUMAN Cytoplasmic FMR1-interacting protein OS=Homo sapiens OX=9606 GN=CYFIP2 PE=1 SV=1	421	KFAFVEVIAMIK
HFAFVEVIARIH	sp|P13889|POLN_RUBVT	216	tr|H7C229|H7C229_HUMAN Cytoplasmic FMR1-interacting protein 2 OS=Homo sapiens OX=9606 GN=CYFIP2 PE=1 SV=2	311	KFAFVEVIAMIK
HFAFVEVIARIH	sp|P13889|POLN_RUBVT	216	tr|E7EW33|E7EW33_HUMAN Cytoplasmic FMR1-interacting protein 2 OS=Homo sapiens OX=9606 GN=CYFIP2 PE=1 SV=1	251	KFAFVEVIAMIK
LHLLAQGANGAR	sp|P13889|POLN_RUBVT	75	sp|Q8WY22|BRI3B_HUMAN BRI3-binding protein OS=Homo sapiens OX=9606 GN=BRI3BP PE=1 SV=1	25	LGLLAPGAQGAR
LHLLAQGANGAR	sp|P13889|POLN_RUBVT	75	tr|A0A5F9ZHY7|A0A5F9ZHY7_HUMAN BRI3-binding protein OS=Homo sapiens OX=9606 GN=BRI3BP PE=1 SV=1	25	LGLLAPGAQGAR
RGGDALRPAGDA	sp|P13889|POLN_RUBVT	323	sp|O43323|DHH_HUMAN Desert hedgehog protein OS=Homo sapiens OX=9606 GN=DHH PE=1 SV=1	303	PGGDALRPARVA
AAAAVEAMYTVV	sp|P13889|POLN_RUBVT	1052	sp|A7E2V4|ZSWM8_HUMAN Zinc finger SWIM domain-containing protein 8 OS=Homo sapiens OX=9606 GN=ZSWIM8 PE=1 SV=1	1471	AAAAVTAAATVV
AAAAVEAMYTVV	sp|P13889|POLN_RUBVT	1052	tr|H7C453|H7C453_HUMAN Zinc finger SWIM domain-containing protein 8 (Fragment) OS=Homo sapiens OX=9606 GN=ZSWIM8 PE=1 SV=1	746	AAAAVTAAATVV
AAAAVEAMYTVV	sp|P13889|POLN_RUBVT	1052	tr|S4R3U7|S4R3U7_HUMAN Zinc finger SWIM domain-containing protein 8 (Fragment) OS=Homo sapiens OX=9606 GN=ZSWIM8 PE=1 SV=1	811	AAAAVTAAATVV
AAAAVEAMYTVV	sp|P13889|POLN_RUBVT	1052	tr|S4R410|S4R410_HUMAN Zinc finger SWIM domain-containing protein 8 OS=Homo sapiens OX=9606 GN=ZSWIM8 PE=1 SV=1	1476	AAAAVTAAATVV
AAAAVEAMYTVV	sp|P13889|POLN_RUBVT	1052	tr|S4R393|S4R393_HUMAN Zinc finger SWIM domain-containing protein 8 OS=Homo sapiens OX=9606 GN=ZSWIM8 PE=1 SV=1	1438	AAAAVTAAATVV
AAAAVEAMYTVV	sp|P13889|POLN_RUBVT	1052	tr|S4R3B3|S4R3B3_HUMAN Zinc finger SWIM domain-containing protein 8 (Fragment) OS=Homo sapiens OX=9606 GN=ZSWIM8 PE=1 SV=1	744	AAAAVTAAATVV
FKETLSLPAPFL	sp|P07566|POLS_RUBVT	766	sp|O43929|ORC4_HUMAN Origin recognition complex subunit 4 OS=Homo sapiens OX=9606 GN=ORC4 PE=1 SV=2	230	FKEQLSLPAEFP
FAFVEVIARIHQ	sp|P13889|POLN_RUBVT	217	sp|Q96F07|CYFP2_HUMAN Cytoplasmic FMR1-interacting protein 2 OS=Homo sapiens OX=9606 GN=CYFIP2 PE=1 SV=2	448	FAFVEVIAMIKG
FAFVEVIARIHQ	sp|P13889|POLN_RUBVT	217	tr|E7EVJ5|E7EVJ5_HUMAN Cytoplasmic FMR1-interacting protein OS=Homo sapiens OX=9606 GN=CYFIP2 PE=1 SV=1	422	FAFVEVIAMIKG
FAFVEVIARIHQ	sp|P13889|POLN_RUBVT	217	tr|H7C229|H7C229_HUMAN Cytoplasmic FMR1-interacting protein 2 OS=Homo sapiens OX=9606 GN=CYFIP2 PE=1 SV=2	312	FAFVEVIAMIKG
FAFVEVIARIHQ	sp|P13889|POLN_RUBVT	217	tr|E7EW33|E7EW33_HUMAN Cytoplasmic FMR1-interacting protein 2 OS=Homo sapiens OX=9606 GN=CYFIP2 PE=1 SV=1	252	FAFVEVIAMIKG
VVALPILWALAM	sp|P13889|POLN_RUBVT	1691	sp|Q6UXH0|ANGL8_HUMAN Angiopoietin-like protein 8 OS=Homo sapiens OX=9606 GN=ANGPTL8 PE=1 SV=1	3	VPALCLLWALAM
AGGPGGCVGRAR	sp|P07566|POLS_RUBVT	594	sp|O15399|NMDE4_HUMAN Glutamate receptor ionotropic, NMDA 2D OS=Homo sapiens OX=9606 GN=GRIN2D PE=1 SV=2	38	AGGPGGGLGGAR
PRLTQRRAADLT	sp|P13889|POLN_RUBVT	1811	tr|K7EIE2|K7EIE2_HUMAN Breast carcinoma-amplified sequence 3 (Fragment) OS=Homo sapiens OX=9606 GN=BCAS3 PE=1 SV=1	138	PRLSQDRAQDLT
ALRTVVQERWVA	sp|P13889|POLN_RUBVT	1502	sp|Q8IYA2|C144C_HUMAN Putative coiled-coil domain-containing protein 144C OS=Homo sapiens OX=9606 GN=CCDC144CP PE=5 SV=3	573	ELRTVVQERNDA
ACEAPIWELALA	sp|P13889|POLN_RUBVT	463	sp|Q15042|RB3GP_HUMAN Rab3 GTPase-activating protein catalytic subunit OS=Homo sapiens OX=9606 GN=RAB3GAP1 PE=1 SV=3	271	ACEDPISELHLA
AFVEVIARIHQL	sp|P13889|POLN_RUBVT	218	sp|Q96F07|CYFP2_HUMAN Cytoplasmic FMR1-interacting protein 2 OS=Homo sapiens OX=9606 GN=CYFIP2 PE=1 SV=2	449	AFVEVIAMIKGL
AFVEVIARIHQL	sp|P13889|POLN_RUBVT	218	tr|E7EVJ5|E7EVJ5_HUMAN Cytoplasmic FMR1-interacting protein OS=Homo sapiens OX=9606 GN=CYFIP2 PE=1 SV=1	423	AFVEVIAMIKGL
AFVEVIARIHQL	sp|P13889|POLN_RUBVT	218	tr|H7C229|H7C229_HUMAN Cytoplasmic FMR1-interacting protein 2 OS=Homo sapiens OX=9606 GN=CYFIP2 PE=1 SV=2	313	AFVEVIAMIKGL
AFVEVIARIHQL	sp|P13889|POLN_RUBVT	218	tr|E7EW33|E7EW33_HUMAN Cytoplasmic FMR1-interacting protein 2 OS=Homo sapiens OX=9606 GN=CYFIP2 PE=1 SV=1	253	AFVEVIAMIKGL
ETLSLPAPFLSP	sp|P07566|POLS_RUBVT	768	tr|A0A5H1ZRP3|A0A5H1ZRP3_HUMAN Methylcytosine dioxygenase TET OS=Homo sapiens OX=9606 GN=TET3 PE=1 SV=1	293	EALSPPAPFRSP
ETLSLPAPFLSP	sp|P07566|POLS_RUBVT	768	sp|O43151|TET3_HUMAN Methylcytosine dioxygenase TET3 OS=Homo sapiens OX=9606 GN=TET3 PE=1 SV=4	386	EALSPPAPFRSP
RQPLAPRNLAGD	sp|P13889|POLN_RUBVT	2026	sp|P57058|HUNK_HUMAN Hormonally up-regulated neu tumor-associated kinase OS=Homo sapiens OX=9606 GN=HUNK PE=1 SV=1	694	LQPLAPVNLAFD
LEAGLEEAAPRG	sp|P13889|POLN_RUBVT	810	tr|H7C1D1|H7C1D1_HUMAN Uncharacterized protein (Fragment) OS=Homo sapiens OX=9606 PE=4 SV=2	199	LEAGLEEEAVGG
LEAGLEEAAPRG	sp|P13889|POLN_RUBVT	810	tr|A0A087WX44|A0A087WX44_HUMAN Uncharacterized protein C8orf58 OS=Homo sapiens OX=9606 GN=C8orf58 PE=4 SV=1	164	LEAGLEEEAVGG
LEAGLEEAAPRG	sp|P13889|POLN_RUBVT	810	sp|Q8NAV2|CH058_HUMAN Uncharacterized protein C8orf58 OS=Homo sapiens OX=9606 GN=C8orf58 PE=2 SV=2	164	LEAGLEEEAVGG
LEAGLEEAAPRG	sp|P13889|POLN_RUBVT	810	tr|A0A087WZ43|A0A087WZ43_HUMAN Uncharacterized protein C8orf58 OS=Homo sapiens OX=9606 GN=C8orf58 PE=4 SV=2	92	LEAGLEEEAVGG
PRPLARGYRAAR	sp|P13889|POLN_RUBVT	1230	tr|H0Y3E9|H0Y3E9_HUMAN Tumor protein p53-inducible protein 13 (Fragment) OS=Homo sapiens OX=9606 GN=TP53I13 PE=4 SV=2	80	PRPLPRGPRAGR
ARVESRLRDALR	sp|P13889|POLN_RUBVT	1097	tr|A0A499FJM0|A0A499FJM0_HUMAN Ankyrin repeat and LEM domain-containing protein 1 OS=Homo sapiens OX=9606 GN=ANKLE1 PE=1 SV=1	59	ARLARRLRDALR
ARVESRLRDALR	sp|P13889|POLN_RUBVT	1097	sp|Q8NAG6|ANKL1_HUMAN Ankyrin repeat and LEM domain-containing protein 1 OS=Homo sapiens OX=9606 GN=ANKLE1 PE=1 SV=2	5	ARLARRLRDALR
ARVESRLRDALR	sp|P13889|POLN_RUBVT	1097	tr|M0R002|M0R002_HUMAN Ankyrin repeat and LEM domain-containing protein 1 (Fragment) OS=Homo sapiens OX=9606 GN=ANKLE1 PE=1 SV=2	6	ARLARRLRDALR
ARVESRLRDALR	sp|P13889|POLN_RUBVT	1097	tr|M0QX15|M0QX15_HUMAN Ankyrin repeat and LEM domain-containing protein 1 OS=Homo sapiens OX=9606 GN=ANKLE1 PE=1 SV=4	5	ARLARRLRDALR
ARVESRLRDALR	sp|P13889|POLN_RUBVT	1097	tr|A0A0A0MSC6|A0A0A0MSC6_HUMAN Ankyrin repeat and LEM domain-containing protein 1 OS=Homo sapiens OX=9606 GN=ANKLE1 PE=1 SV=1	5	ARLARRLRDALR
SLASRLCRVLDR	sp|P13889|POLN_RUBVT	234	sp|Q9Y6C2|EMIL1_HUMAN EMILIN-1 OS=Homo sapiens OX=9606 GN=EMILIN1 PE=1 SV=3	402	SLASRLSRLEDR
RTVVQERWVALK	sp|P13889|POLN_RUBVT	1504	sp|Q8IYA2|C144C_HUMAN Putative coiled-coil domain-containing protein 144C OS=Homo sapiens OX=9606 GN=CCDC144CP PE=5 SV=3	575	RTVVQERNDAQK
RIHQLAYGHSLA	sp|P13889|POLN_RUBVT	225	sp|P54198|HIRA_HUMAN Protein HIRA OS=Homo sapiens OX=9606 GN=HIRA PE=1 SV=2	373	RIHQSTYGKSLA
DPRQPLAPRNLA	sp|P13889|POLN_RUBVT	2024	sp|P57058|HUNK_HUMAN Hormonally up-regulated neu tumor-associated kinase OS=Homo sapiens OX=9606 GN=HUNK PE=1 SV=1	692	PPLQPLAPVNLA
DYGTDVALAGVH	sp|P13889|POLN_RUBVT	541	tr|F5H7K7|F5H7K7_HUMAN Lysophospholipid acyltransferase 5 OS=Homo sapiens OX=9606 GN=LPCAT3 PE=1 SV=1	8	DEGTVVALAGVL
DYGTDVALAGVH	sp|P13889|POLN_RUBVT	541	tr|F5H680|F5H680_HUMAN Lysophospholipid acyltransferase 5 OS=Homo sapiens OX=9606 GN=LPCAT3 PE=1 SV=1	8	DEGTVVALAGVL
DYGTDVALAGVH	sp|P13889|POLN_RUBVT	541	tr|B7Z3N5|B7Z3N5_HUMAN Lysophospholipid acyltransferase 5 OS=Homo sapiens OX=9606 GN=LPCAT3 PE=1 SV=1	8	DEGTVVALAGVL
DYGTDVALAGVH	sp|P13889|POLN_RUBVT	541	tr|F5GYT3|F5GYT3_HUMAN Lysophospholipid acyltransferase 5 OS=Homo sapiens OX=9606 GN=LPCAT3 PE=1 SV=1	8	DEGTVVALAGVL
DYGTDVALAGVH	sp|P13889|POLN_RUBVT	541	tr|F5H0M4|F5H0M4_HUMAN Lysophospholipid acyltransferase 5 OS=Homo sapiens OX=9606 GN=LPCAT3 PE=1 SV=1	8	DEGTVVALAGVL
DYGTDVALAGVH	sp|P13889|POLN_RUBVT	541	sp|Q6P1A2|MBOA5_HUMAN Lysophospholipid acyltransferase 5 OS=Homo sapiens OX=9606 GN=LPCAT3 PE=1 SV=1	8	DEGTVVALAGVL
ARPVTAGRAVGA	sp|P07566|POLS_RUBVT	884	sp|Q9P258|RCC2_HUMAN Protein RCC2 OS=Homo sapiens OX=9606 GN=RCC2 PE=1 SV=2	70	ARPATAGKAGGA
PVGAVGAPWPPA	sp|P07566|POLS_RUBVT	68	tr|C9J9P4|C9J9P4_HUMAN Phospholipid scramblase (Fragment) OS=Homo sapiens OX=9606 GN=PLSCR1 PE=1 SV=1	77	PVGAAGVPWMPA
PVGAVGAPWPPA	sp|P07566|POLS_RUBVT	68	tr|H7C5I5|H7C5I5_HUMAN Phospholipid scramblase (Fragment) OS=Homo sapiens OX=9606 GN=PLSCR1 PE=1 SV=1	19	PVGAAGVPWMPA
PVGAVGAPWPPA	sp|P07566|POLS_RUBVT	68	tr|C9JE06|C9JE06_HUMAN Phospholipid scramblase (Fragment) OS=Homo sapiens OX=9606 GN=PLSCR1 PE=1 SV=1	77	PVGAAGVPWMPA
PVGAVGAPWPPA	sp|P07566|POLS_RUBVT	68	sp|O15162|PLS1_HUMAN Phospholipid scramblase 1 OS=Homo sapiens OX=9606 GN=PLSCR1 PE=1 SV=1	77	PVGAAGVPWMPA
PVGAVGAPWPPA	sp|P07566|POLS_RUBVT	68	tr|C9J7K9|C9J7K9_HUMAN Phospholipid scramblase OS=Homo sapiens OX=9606 GN=PLSCR1 PE=1 SV=1	70	PVGAAGVPWMPA
TMTLATVDCRPF	sp|P13889|POLN_RUBVT	2001	sp|P60507|EFC1_HUMAN Endogenous retrovirus group FC1 Env polyprotein OS=Homo sapiens OX=9606 GN=ERVFC1 PE=1 SV=1	49	TVTLATVDCQPH
RGDPRQPLAPRN	sp|P13889|POLN_RUBVT	2022	tr|A0A0G2JIN1|A0A0G2JIN1_HUMAN Choline transporter-like protein 4 (Fragment) OS=Homo sapiens OX=9606 GN=SLC44A4 PE=1 SV=1	54	YGDPRQVLYPRN
RGDPRQPLAPRN	sp|P13889|POLN_RUBVT	2022	sp|Q53GD3|CTL4_HUMAN Choline transporter-like protein 4 OS=Homo sapiens OX=9606 GN=SLC44A4 PE=1 SV=2	58	YGDPRQVLYPRN
RGDPRQPLAPRN	sp|P13889|POLN_RUBVT	2022	tr|H0Y5I3|H0Y5I3_HUMAN Choline transporter-like protein 4 (Fragment) OS=Homo sapiens OX=9606 GN=SLC44A4 PE=1 SV=1	54	YGDPRQVLYPRN
VGAVGAPWPPAS	sp|P07566|POLS_RUBVT	69	sp|P02458|CO2A1_HUMAN Collagen alpha-1(II) chain OS=Homo sapiens OX=9606 GN=COL2A1 PE=1 SV=3	1064	VGAPGAPGPPGS
VGAVGAPWPPAS	sp|P07566|POLS_RUBVT	69	sp|Q96GQ5|RUSF1_HUMAN RUS family member 1 OS=Homo sapiens OX=9606 GN=RUSF1 PE=1 SV=2	60	VGASGAPSPPLS
VGAVGAPWPPAS	sp|P07566|POLS_RUBVT	69	tr|H3BSM7|H3BSM7_HUMAN RUS family member 1 OS=Homo sapiens OX=9606 GN=RUSF1 PE=1 SV=1	60	VGASGAPSPPLS
VGAVGAPWPPAS	sp|P07566|POLS_RUBVT	69	tr|H3BTA0|H3BTA0_HUMAN RUS family member 1 OS=Homo sapiens OX=9606 GN=RUSF1 PE=1 SV=1	60	VGASGAPSPPLS
VGAVGAPWPPAS	sp|P07566|POLS_RUBVT	69	tr|H3BS97|H3BS97_HUMAN RUS family member 1 OS=Homo sapiens OX=9606 GN=RUSF1 PE=1 SV=1	60	VGASGAPSPPLS
EAAPRGLCLVIA	sp|P13889|POLN_RUBVT	816	tr|A0A075B7E2|A0A075B7E2_HUMAN Uncharacterized protein C17orf50 OS=Homo sapiens OX=9606 GN=C17orf50 PE=4 SV=1	98	TAAPRGLCLLRA
EAAPRGLCLVIA	sp|P13889|POLN_RUBVT	816	tr|A0A075B7C2|A0A075B7C2_HUMAN Uncharacterized protein C17orf50 OS=Homo sapiens OX=9606 GN=C17orf50 PE=4 SV=1	135	TAAPRGLCLLRA
GAPPLLRVGLTP	sp|P13889|POLN_RUBVT	828	tr|H0YCB1|H0YCB1_HUMAN Nuclear receptor-binding protein 2 (Fragment) OS=Homo sapiens OX=9606 GN=NRBP2 PE=1 SV=1	137	GTPRLLRVGLTL
GAGPVAARPVTA	sp|P07566|POLS_RUBVT	878	sp|Q8IYB0|YK038_HUMAN Putative uncharacterized protein MGC39545 OS=Homo sapiens OX=9606 PE=5 SV=2	35	GAHPTAARPATA
ALETGVCHPLPV	sp|P13889|POLN_RUBVT	1412	sp|Q96CK0|ZN653_HUMAN Zinc finger protein 653 OS=Homo sapiens OX=9606 GN=ZNF653 PE=1 SV=1	272	ALETVVCVPVPV
HPSYGRRPLEAG	sp|P13889|POLN_RUBVT	802	tr|A0A3B3IRR3|A0A3B3IRR3_HUMAN Fibrosin-1-like protein OS=Homo sapiens OX=9606 GN=FBRSL1 PE=1 SV=1	129	EPSENRRPLEAG
HPSYGRRPLEAG	sp|P13889|POLN_RUBVT	802	sp|Q9HCM7|FBSL_HUMAN Fibrosin-1-like protein OS=Homo sapiens OX=9606 GN=FBRSL1 PE=1 SV=4	129	EPSENRRPLEAG
HPSYGRRPLEAG	sp|P13889|POLN_RUBVT	802	tr|A0A1B0GUN3|A0A1B0GUN3_HUMAN Fibrosin-1-like protein OS=Homo sapiens OX=9606 GN=FBRSL1 PE=1 SV=1	30	EPSENRRPLEAG
NLLRGGDALRPA	sp|P13889|POLN_RUBVT	320	sp|O43323|DHH_HUMAN Desert hedgehog protein OS=Homo sapiens OX=9606 GN=DHH PE=1 SV=1	300	VLAPGGDALRPA
NLLRGGDALRPA	sp|P13889|POLN_RUBVT	320	sp|P57679|EVC_HUMAN Ellis-van Creveld syndrome protein OS=Homo sapiens OX=9606 GN=EVC PE=2 SV=1	13	RLLLGRDALRPA
NLLRGGDALRPA	sp|P13889|POLN_RUBVT	320	tr|E9PCN4|E9PCN4_HUMAN Ellis-van Creveld syndrome protein OS=Homo sapiens OX=9606 GN=EVC PE=1 SV=1	13	RLLLGRDALRPA
PADTQGPVWLQF	sp|P07566|POLS_RUBVT	332	sp|Q7L190|DPPA4_HUMAN Developmental pluripotency-associated protein 4 OS=Homo sapiens OX=9606 GN=DPPA4 PE=1 SV=2	239	PADTDGWVHLQF
VAPAQGHLVLQA	sp|P07566|POLS_RUBVT	826	sp|Q4ZG55|GREB1_HUMAN Protein GREB1 OS=Homo sapiens OX=9606 GN=GREB1 PE=2 SV=1	1233	VAPAAGTWVLQA
NLESNADLCYGV	sp|P13889|POLN_RUBVT	1916	sp|P17735|ATTY_HUMAN Tyrosine aminotransferase OS=Homo sapiens OX=9606 GN=TAT PE=1 SV=1	345	FLKSNADLCYGA
VYRGEAAAAPRL	sp|P13889|POLN_RUBVT	1802	tr|A0A1W2PQW2|A0A1W2PQW2_HUMAN Voltage-dependent T-type calcium channel subunit alpha-1H OS=Homo sapiens OX=9606 GN=CACNA1H PE=1 SV=1	1551	AARGEAAAAPRE
LRVGLTPHRRLE	sp|P13889|POLN_RUBVT	833	tr|A0A2R8Y682|A0A2R8Y682_HUMAN CMP-N-acetylneuraminate-beta-1,4-galactoside alpha-2,3-sialyltransferase (Fragment) OS=Homo sapiens OX=9606 GN=ST3GAL3 PE=3 SV=1	145	ERVGLTPLPRLE
CPPPSPHFQDKR	sp|P07566|POLS_RUBVT	979	sp|P06213|INSR_HUMAN Insulin receptor OS=Homo sapiens OX=9606 GN=INSR PE=1 SV=4	268	CPPPYYHFQDWR
SQDHRALKRSAP	sp|P07566|POLS_RUBVT	1028	sp|Q7L5A3|F214B_HUMAN Protein FAM214B OS=Homo sapiens OX=9606 GN=FAM214B PE=1 SV=1	60	SEPHRALKRQAP
RAATPDREGVPL	sp|P13889|POLN_RUBVT	647	tr|A0A0J9YWB6|A0A0J9YWB6_HUMAN RNA polymerase II subunit A C-terminal domain phosphatase (Fragment) OS=Homo sapiens OX=9606 GN=CTDP1 PE=1 SV=1	741	PAAFPDREGVPP
RAATPDREGVPL	sp|P13889|POLN_RUBVT	647	tr|A0A0J9YWJ4|A0A0J9YWJ4_HUMAN RNA polymerase II subunit A C-terminal domain phosphatase (Fragment) OS=Homo sapiens OX=9606 GN=CTDP1 PE=1 SV=1	673	PAAFPDREGVPP
RAATPDREGVPL	sp|P13889|POLN_RUBVT	647	tr|K7EJD2|K7EJD2_HUMAN RNA polymerase II subunit A C-terminal domain phosphatase (Fragment) OS=Homo sapiens OX=9606 GN=CTDP1 PE=1 SV=1	673	PAAFPDREGVPP
RAATPDREGVPL	sp|P13889|POLN_RUBVT	647	tr|A0A0A0MR03|A0A0A0MR03_HUMAN RNA polymerase II subunit A C-terminal domain phosphatase OS=Homo sapiens OX=9606 GN=CTDP1 PE=1 SV=1	622	PAAFPDREGVPP
RAATPDREGVPL	sp|P13889|POLN_RUBVT	647	sp|Q9Y5B0|CTDP1_HUMAN RNA polymerase II subunit A C-terminal domain phosphatase OS=Homo sapiens OX=9606 GN=CTDP1 PE=1 SV=3	741	PAAFPDREGVPP
RGEAAAAPRLTQ	sp|P13889|POLN_RUBVT	1804	tr|A0A1W2PQW2|A0A1W2PQW2_HUMAN Voltage-dependent T-type calcium channel subunit alpha-1H OS=Homo sapiens OX=9606 GN=CACNA1H PE=1 SV=1	1553	RGEAAAAPREEA
EAGLEEAAPRGL	sp|P13889|POLN_RUBVT	811	tr|H7C1D1|H7C1D1_HUMAN Uncharacterized protein (Fragment) OS=Homo sapiens OX=9606 PE=4 SV=2	200	EAGLEEEAVGGL
EAGLEEAAPRGL	sp|P13889|POLN_RUBVT	811	tr|A0A087WX44|A0A087WX44_HUMAN Uncharacterized protein C8orf58 OS=Homo sapiens OX=9606 GN=C8orf58 PE=4 SV=1	165	EAGLEEEAVGGL
EAGLEEAAPRGL	sp|P13889|POLN_RUBVT	811	sp|Q8NAV2|CH058_HUMAN Uncharacterized protein C8orf58 OS=Homo sapiens OX=9606 GN=C8orf58 PE=2 SV=2	165	EAGLEEEAVGGL
EAGLEEAAPRGL	sp|P13889|POLN_RUBVT	811	tr|A0A087WZ43|A0A087WZ43_HUMAN Uncharacterized protein C8orf58 OS=Homo sapiens OX=9606 GN=C8orf58 PE=4 SV=2	93	EAGLEEEAVGGL
AAPRGLCLVIAG	sp|P13889|POLN_RUBVT	817	tr|A0A075B7E2|A0A075B7E2_HUMAN Uncharacterized protein C17orf50 OS=Homo sapiens OX=9606 GN=C17orf50 PE=4 SV=1	99	AAPRGLCLLRAP
AAPRGLCLVIAG	sp|P13889|POLN_RUBVT	817	tr|A0A075B7C2|A0A075B7C2_HUMAN Uncharacterized protein C17orf50 OS=Homo sapiens OX=9606 GN=C17orf50 PE=4 SV=1	136	AAPRGLCLLRAP
LDYGTDVALAGV	sp|P13889|POLN_RUBVT	540	tr|F5H7K7|F5H7K7_HUMAN Lysophospholipid acyltransferase 5 OS=Homo sapiens OX=9606 GN=LPCAT3 PE=1 SV=1	7	GDEGTVVALAGV
LDYGTDVALAGV	sp|P13889|POLN_RUBVT	540	tr|F5H680|F5H680_HUMAN Lysophospholipid acyltransferase 5 OS=Homo sapiens OX=9606 GN=LPCAT3 PE=1 SV=1	7	GDEGTVVALAGV
LDYGTDVALAGV	sp|P13889|POLN_RUBVT	540	tr|B7Z3N5|B7Z3N5_HUMAN Lysophospholipid acyltransferase 5 OS=Homo sapiens OX=9606 GN=LPCAT3 PE=1 SV=1	7	GDEGTVVALAGV
LDYGTDVALAGV	sp|P13889|POLN_RUBVT	540	tr|F5GYT3|F5GYT3_HUMAN Lysophospholipid acyltransferase 5 OS=Homo sapiens OX=9606 GN=LPCAT3 PE=1 SV=1	7	GDEGTVVALAGV
LDYGTDVALAGV	sp|P13889|POLN_RUBVT	540	tr|F5H0M4|F5H0M4_HUMAN Lysophospholipid acyltransferase 5 OS=Homo sapiens OX=9606 GN=LPCAT3 PE=1 SV=1	7	GDEGTVVALAGV
LDYGTDVALAGV	sp|P13889|POLN_RUBVT	540	sp|Q6P1A2|MBOA5_HUMAN Lysophospholipid acyltransferase 5 OS=Homo sapiens OX=9606 GN=LPCAT3 PE=1 SV=1	7	GDEGTVVALAGV
QPLAPRNLAGDI	sp|P13889|POLN_RUBVT	2027	sp|P57058|HUNK_HUMAN Hormonally up-regulated neu tumor-associated kinase OS=Homo sapiens OX=9606 GN=HUNK PE=1 SV=1	695	QPLAPVNLAFDM
