query	query_seqname	query_start	target_seqname	target_start	target
KARQVLGPPAEA	sp|Q69091|GD_HHV11	231	tr|H7BXT3|H7BXT3_HUMAN Proprotein convertase subtilisin/kexin type 6 OS=Homo sapiens OX=9606 GN=PCSK6 PE=1 SV=2	74	WAVQVLGGPAEA
KARQVLGPPAEA	sp|Q69091|GD_HHV11	231	sp|P29122|PCSK6_HUMAN Proprotein convertase subtilisin/kexin type 6 OS=Homo sapiens OX=9606 GN=PCSK6 PE=1 SV=1	74	WAVQVLGGPAEA
KARQVLGPPAEA	sp|Q69091|GD_HHV11	231	tr|A0A087WY68|A0A087WY68_HUMAN Proprotein convertase subtilisin/kexin type 6 OS=Homo sapiens OX=9606 GN=PCSK6 PE=1 SV=1	74	WAVQVLGGPAEA
KARQVLGPPAEA	sp|Q69091|GD_HHV11	231	tr|A0A087WZR0|A0A087WZR0_HUMAN Proprotein convertase subtilisin/kexin type 6 OS=Homo sapiens OX=9606 GN=PCSK6 PE=1 SV=1	74	WAVQVLGGPAEA
VGRVSPEVESGP	sp|P10227|MB43_HHV11	348	sp|Q9NPG4|PCD12_HUMAN Protocadherin-12 OS=Homo sapiens OX=9606 GN=PCDH12 PE=1 SV=1	917	NGKVSPEKESGP
DPSMSRLDAARV	sp|P10220|LTP_HHV11	2224	sp|P54753|EPHB3_HUMAN Ephrin type-B receptor 3 OS=Homo sapiens OX=9606 GN=EPHB3 PE=1 SV=2	163	DESFSRLDAGRV
PPAAAVAPVTRR	sp|P08392|ICP4_HHV11	403	sp|Q1W6H9|F110C_HUMAN Protein FAM110C OS=Homo sapiens OX=9606 GN=FAM110C PE=1 SV=2	77	PPARAPAPVARR
APGAQDPSSPRS	sp|P10186|UNG_HHV11	90	sp|A6NKF2|ARI3C_HUMAN AT-rich interactive domain-containing protein 3C OS=Homo sapiens OX=9606 GN=ARID3C PE=1 SV=1	77	RPGAQGPSSPSS
APGAQDPSSPRS	sp|P10186|UNG_HHV11	90	sp|P40222|TXLNA_HUMAN Alpha-taxilin OS=Homo sapiens OX=9606 GN=TXLNA PE=1 SV=3	507	GPGAQAPSSPRV
AAEPRAQRGPAP	sp|P10238|ICP27_HHV11	73	tr|H0Y3E9|H0Y3E9_HUMAN Tumor protein p53-inducible protein 13 (Fragment) OS=Homo sapiens OX=9606 GN=TP53I13 PE=4 SV=2	27	AAPPRAARGPTP
AAEPRAQRGPAP	sp|P10238|ICP27_HHV11	73	sp|Q8NBR0|P5I13_HUMAN Tumor protein p53-inducible protein 13 OS=Homo sapiens OX=9606 GN=TP53I13 PE=1 SV=1	294	AAPPRAARGPTP
GLPPTSRFEDLP	sp|P04294|AN_HHV11	357	tr|A8MXE8|A8MXE8_HUMAN Retinoic acid-induced protein 1 (Fragment) OS=Homo sapiens OX=9606 GN=RAI1 PE=1 SV=1	855	LLPPTSRKEDLE
GLPPTSRFEDLP	sp|P04294|AN_HHV11	357	tr|A0A1W2PQJ7|A0A1W2PQJ7_HUMAN Retinoic acid-induced protein 1 OS=Homo sapiens OX=9606 GN=RAI1 PE=1 SV=1	808	LLPPTSRKEDLE
GLPPTSRFEDLP	sp|P04294|AN_HHV11	357	sp|Q7Z5J4|RAI1_HUMAN Retinoic acid-induced protein 1 OS=Homo sapiens OX=9606 GN=RAI1 PE=1 SV=2	855	LLPPTSRKEDLE
LVDTLADTLVTI	sp|P06487|GI_HHV11	135	sp|P21108|PRPS3_HUMAN Ribose-phosphate pyrophosphokinase 3 OS=Homo sapiens OX=9606 GN=PRPS1L1 PE=1 SV=2	218	LVDDMADTCVTI
LVDTLADTLVTI	sp|P06487|GI_HHV11	135	tr|A0A0B4J207|A0A0B4J207_HUMAN Ribose-phosphate diphosphokinase OS=Homo sapiens OX=9606 GN=PRPS1L1 PE=1 SV=1	218	LVDDMADTCVTI
LVAGTVQSAAGR	sp|P10221|ITP_HHV11	875	sp|Q7RTY9|PRS41_HUMAN Serine protease 41 OS=Homo sapiens OX=9606 GN=PRSS41 PE=2 SV=1	54	LVAGGVESARGR
LVAGTVQSAAGR	sp|P10221|ITP_HHV11	875	tr|A0A6Q8NYF4|A0A6Q8NYF4_HUMAN Serine protease 41 OS=Homo sapiens OX=9606 GN=PRSS41 PE=1 SV=1	41	LVAGGVESARGR
LVAGTVQSAAGR	sp|P10221|ITP_HHV11	875	tr|A0A6I8PU99|A0A6I8PU99_HUMAN Serine protease 41 OS=Homo sapiens OX=9606 GN=PRSS41 PE=1 SV=1	70	LVAGGVESARGR
LRDLYETLRFAD	sp|P10221|ITP_HHV11	515	tr|K7ELC8|K7ELC8_HUMAN Sperm-associated antigen 5 (Fragment) OS=Homo sapiens OX=9606 GN=SPAG5 PE=1 SV=1	80	VRDLKETLEFAD
LRDLYETLRFAD	sp|P10221|ITP_HHV11	515	tr|E9PMD0|E9PMD0_HUMAN Uncharacterized protein (Fragment) OS=Homo sapiens OX=9606 PE=4 SV=1	201	VRDLKETLEFAD
LRDLYETLRFAD	sp|P10221|ITP_HHV11	515	sp|Q96R06|SPAG5_HUMAN Sperm-associated antigen 5 OS=Homo sapiens OX=9606 GN=SPAG5 PE=1 SV=2	796	VRDLKETLEFAD
PLSEASVSSVLG	sp|P10187|NP03_HHV11	157	tr|C9JFX4|C9JFX4_HUMAN Single Ig IL-1-related receptor OS=Homo sapiens OX=9606 GN=SIGIRR PE=1 SV=1	73	NLSEVLVSSVLG
PLSEASVSSVLG	sp|P10187|NP03_HHV11	157	sp|Q6IA17|SIGIR_HUMAN Single Ig IL-1-related receptor OS=Homo sapiens OX=9606 GN=SIGIRR PE=1 SV=3	73	NLSEVLVSSVLG
HGPAPVPAPPGP	sp|P06487|GI_HHV11	203	tr|F5GZM8|F5GZM8_HUMAN Phospholipid-transporting ATPase IK OS=Homo sapiens OX=9606 GN=ATP8B3 PE=4 SV=1	14	AGPEPSPAPPGP
HGPAPVPAPPGP	sp|P06487|GI_HHV11	203	tr|K7EJ52|K7EJ52_HUMAN Phospholipid-transporting ATPase IK (Fragment) OS=Homo sapiens OX=9606 GN=ATP8B3 PE=1 SV=2	14	AGPEPSPAPPGP
HGPAPVPAPPGP	sp|P06487|GI_HHV11	203	sp|O60423|AT8B3_HUMAN Phospholipid-transporting ATPase IK OS=Homo sapiens OX=9606 GN=ATP8B3 PE=2 SV=4	14	AGPEPSPAPPGP
HGPAPVPAPPGP	sp|P06487|GI_HHV11	203	sp|Q8WZ82|OVCA2_HUMAN Esterase OVCA2 OS=Homo sapiens OX=9606 GN=OVCA2 PE=1 SV=1	43	SGPHPVPDPPGP
HGPAPVPAPPGP	sp|P06487|GI_HHV11	203	tr|H0Y3F0|H0Y3F0_HUMAN Wilms tumor protein OS=Homo sapiens OX=9606 GN=WT1 PE=1 SV=2	125	GGPAPPPAPPPP
HGPAPVPAPPGP	sp|P06487|GI_HHV11	203	tr|J3KNN9|J3KNN9_HUMAN Wilms tumor protein OS=Homo sapiens OX=9606 GN=WT1 PE=1 SV=2	125	GGPAPPPAPPPP
HGPAPVPAPPGP	sp|P06487|GI_HHV11	203	tr|A0A1W2PQQ0|A0A1W2PQQ0_HUMAN Wilms tumor protein OS=Homo sapiens OX=9606 GN=WT1 PE=1 SV=2	125	GGPAPPPAPPPP
HGPAPVPAPPGP	sp|P06487|GI_HHV11	203	tr|H0Y7K5|H0Y7K5_HUMAN Wilms tumor protein OS=Homo sapiens OX=9606 GN=WT1 PE=1 SV=2	125	GGPAPPPAPPPP
HGPAPVPAPPGP	sp|P06487|GI_HHV11	203	sp|P19544|WT1_HUMAN Wilms tumor protein OS=Homo sapiens OX=9606 GN=WT1 PE=1 SV=2	52	GGPAPPPAPPPP
HGPAPVPAPPGP	sp|P06487|GI_HHV11	203	tr|A0A0A0MT54|A0A0A0MT54_HUMAN Wilms tumor protein OS=Homo sapiens OX=9606 GN=WT1 PE=1 SV=2	125	GGPAPPPAPPPP
HGPAPVPAPPGP	sp|P06487|GI_HHV11	203	tr|F2Z2U4|F2Z2U4_HUMAN Transformation/transcription domain-associated protein OS=Homo sapiens OX=9606 GN=TRRAP PE=1 SV=3	498	PSPAPVPAPPPP
HGPAPVPAPPGP	sp|P06487|GI_HHV11	203	sp|Q9Y4A5|TRRAP_HUMAN Transformation/transcription domain-associated protein OS=Homo sapiens OX=9606 GN=TRRAP PE=1 SV=3	498	PSPAPVPAPPPP
HGPAPVPAPPGP	sp|P06487|GI_HHV11	203	tr|H0Y4W2|H0Y4W2_HUMAN Transformation/transcription domain-associated protein OS=Homo sapiens OX=9606 GN=TRRAP PE=1 SV=2	498	PSPAPVPAPPPP
PDESAYNIPSEL	sp|P08543|RIR1_HHV11	206	sp|P59510|ATS20_HUMAN A disintegrin and metalloproteinase with thrombospondin motifs 20 OS=Homo sapiens OX=9606 GN=ADAMTS20 PE=2 SV=2	467	PDEEIYNLPSEL
PDESAYNIPSEL	sp|P08543|RIR1_HHV11	206	tr|G3V1X8|G3V1X8_HUMAN A disintegrin and metalloproteinase with thrombospondin motifs 20 OS=Homo sapiens OX=9606 GN=ADAMTS20 PE=1 SV=1	467	PDEEIYNLPSEL
PDESAYNIPSEL	sp|P08543|RIR1_HHV11	206	tr|E9PBD5|E9PBD5_HUMAN A disintegrin and metalloproteinase with thrombospondin motifs 20 OS=Homo sapiens OX=9606 GN=ADAMTS20 PE=4 SV=2	467	PDEEIYNLPSEL
SVEGLDLTRVCV	sp|P10216|UL32_HHV11	288	tr|D6RBL4|D6RBL4_HUMAN N6-adenosine-methyltransferase non-catalytic subunit (Fragment) OS=Homo sapiens OX=9606 GN=METTL14 PE=1 SV=2	60	SGEGLDLGRVCL
SVEGLDLTRVCV	sp|P10216|UL32_HHV11	288	sp|Q9HCE5|MET14_HUMAN N6-adenosine-methyltransferase non-catalytic subunit OS=Homo sapiens OX=9606 GN=METTL14 PE=1 SV=2	237	SGEGLDLGRVCL
APKQLAFFAAAA	sp|P10227|MB43_HHV11	98	tr|H0YJU4|H0YJU4_HUMAN Transcriptional repressor protein YY1 (Fragment) OS=Homo sapiens OX=9606 GN=YY1 PE=1 SV=1	103	DPKQLAEFARAA
PLAFPPAGVAVL	sp|P08392|ICP4_HHV11	683	sp|P15863|PAX1_HUMAN Paired box protein Pax-1 OS=Homo sapiens OX=9606 GN=PAX1 PE=1 SV=4	400	PLAPPGAGVAVH
PLAFPPAGVAVL	sp|P08392|ICP4_HHV11	683	tr|A0A087WXV5|A0A087WXV5_HUMAN Paired box protein Pax-1 OS=Homo sapiens OX=9606 GN=PAX1 PE=1 SV=1	400	PLAPPGAGVAVH
PLAFPPAGVAVL	sp|P08392|ICP4_HHV11	683	sp|Q96PX9|PKH4B_HUMAN Pleckstrin homology domain-containing family G member 4B OS=Homo sapiens OX=9606 GN=PLEKHG4B PE=1 SV=4	561	AEAFPGAGVAVL
PLAFPPAGVAVL	sp|P08392|ICP4_HHV11	683	tr|A0A1B0GW72|A0A1B0GW72_HUMAN Pleckstrin homology domain-containing family G member 4B OS=Homo sapiens OX=9606 GN=PLEKHG4B PE=1 SV=1	917	AEAFPGAGVAVL
LTITSAFLVQRL	sp|P10205|TEG4_HHV11	58	sp|Q6PXP3|GTR7_HUMAN Solute carrier family 2, facilitated glucose transporter member 7 OS=Homo sapiens OX=9606 GN=SLC2A7 PE=1 SV=2	334	MTITSAVLVERL
AVNFFLGAAFAE	sp|P10192|HEPA_HHV11	266	sp|O95563|MPC2_HUMAN Mitochondrial pyruvate carrier 2 OS=Homo sapiens OX=9606 GN=MPC2 PE=1 SV=1	98	AVNFFVGAAGAS
GSVPFRKRTSIA	sp|P10190|PORTL_HHV11	185	sp|Q15319|PO4F3_HUMAN POU domain, class 4, transcription factor 3 OS=Homo sapiens OX=9606 GN=POU4F3 PE=1 SV=1	271	GSERKRKRTSIA
LQAVCLNLLPLL	sp|P10215|NEC1_HHV11	67	sp|Q6UXU4|GSG1L_HUMAN Germ cell-specific gene 1-like protein OS=Homo sapiens OX=9606 GN=GSG1L PE=1 SV=2	10	LLAVALNLLALL
ACAAASRLPDRP	sp|P08392|ICP4_HHV11	790	sp|O75129|ASTN2_HUMAN Astrotactin-2 OS=Homo sapiens OX=9606 GN=ASTN2 PE=1 SV=2	51	ATAAASREPDSP
APPAPLTLLGET	sp|P10220|LTP_HHV11	1391	sp|Q9H2X0|CHRD_HUMAN Chordin OS=Homo sapiens OX=9606 GN=CHRD PE=1 SV=2	6	APPAPLLLLGLL
APPAPLTLLGET	sp|P10220|LTP_HHV11	1391	tr|E7ESX1|E7ESX1_HUMAN Chordin OS=Homo sapiens OX=9606 GN=CHRD PE=1 SV=1	6	APPAPLLLLGLL
ALENTRAALGSD	sp|P10192|HEPA_HHV11	607	sp|Q06481|APLP2_HUMAN Amyloid-like protein 2 OS=Homo sapiens OX=9606 GN=APLP2 PE=1 SV=2	471	ALENYLAALQSD
PMAGPTSGSNFA	sp|P06477|GH_HHV11	234	sp|Q9C0A1|ZFHX2_HUMAN Zinc finger homeobox protein 2 OS=Homo sapiens OX=9606 GN=ZFHX2 PE=1 SV=3	2315	PVAGPTSSSNDA
ALAEAQGTHECE	sp|P10201|CVC1_HHV11	29	sp|Q8TBC5|ZSC18_HUMAN Zinc finger and SCAN domain-containing protein 18 OS=Homo sapiens OX=9606 GN=ZSCAN18 PE=1 SV=2	455	ALAEHQKTHEKE
ALAEAQGTHECE	sp|P10201|CVC1_HHV11	29	tr|A0A0C4DG78|A0A0C4DG78_HUMAN Zinc finger and SCAN domain-containing protein 18 (Fragment) OS=Homo sapiens OX=9606 GN=ZSCAN18 PE=1 SV=1	352	ALAEHQKTHEKE
APARYAAVPYGV	sp|P08392|ICP4_HHV11	639	sp|Q96RF0|SNX18_HUMAN Sorting nexin-18 OS=Homo sapiens OX=9606 GN=SNX18 PE=1 SV=2	74	APARYANVPPGG
PVDGVLLFAYHV	sp|P04295|TRM3_HHV11	411	tr|E9PP49|E9PP49_HUMAN Collagen alpha-2(VIII) chain OS=Homo sapiens OX=9606 GN=COL8A2 PE=1 SV=1	550	PVGGVYYFAYHV
PVDGVLLFAYHV	sp|P04295|TRM3_HHV11	411	sp|P25067|CO8A2_HUMAN Collagen alpha-2(VIII) chain OS=Homo sapiens OX=9606 GN=COL8A2 PE=1 SV=2	615	PVGGVYYFAYHV
GARLSRRRLIDL	sp|P10231|TEG5_HHV11	140	tr|M0QYV7|M0QYV7_HUMAN F-box only protein 17 OS=Homo sapiens OX=9606 GN=FBXO17 PE=1 SV=1	2	GARLSRRRLPAD
GARLSRRRLIDL	sp|P10231|TEG5_HHV11	140	sp|Q96EF6|FBX17_HUMAN F-box only protein 17 OS=Homo sapiens OX=9606 GN=FBXO17 PE=1 SV=1	2	GARLSRRRLPAD
EAPDAAPGGEAA	sp|P04291|TEG3_HHV11	149	tr|E9PPP7|E9PPP7_HUMAN Maestro heat-like repeat-containing protein family member 6 (Fragment) OS=Homo sapiens OX=9606 GN=MROH6 PE=1 SV=8	478	EAPAAAPGACAA
LGGWPASDTGAS	sp|P10238|ICP27_HHV11	230	sp|O95450|ATS2_HUMAN A disintegrin and metalloproteinase with thrombospondin motifs 2 OS=Homo sapiens OX=9606 GN=ADAMTS2 PE=2 SV=2	221	LGGPQALDTGAS
LGGWPASDTGAS	sp|P10238|ICP27_HHV11	230	tr|A0A1B0GTY3|A0A1B0GTY3_HUMAN A disintegrin and metalloproteinase with thrombospondin motifs 2 OS=Homo sapiens OX=9606 GN=ADAMTS2 PE=1 SV=2	221	LGGPQALDTGAS
GVLSTAPVGGGR	sp|P08393|ICP0_HHV11	101	sp|Q15084|PDIA6_HUMAN Protein disulfide-isomerase A6 OS=Homo sapiens OX=9606 GN=PDIA6 PE=1 SV=1	391	GRGSTAPVGGGA
SVTPRPLPDTAL	sp|P10221|ITP_HHV11	476	tr|A0A087X2C4|A0A087X2C4_HUMAN Protocadherin-7 (Fragment) OS=Homo sapiens OX=9606 GN=PCDH7 PE=1 SV=1	458	SVDSRPLPDVAL
SVTPRPLPDTAL	sp|P10221|ITP_HHV11	476	tr|H0YAH0|H0YAH0_HUMAN Protocadherin-7 (Fragment) OS=Homo sapiens OX=9606 GN=PCDH7 PE=1 SV=1	811	SVDSRPLPDVAL
AGSMPAPAVPAD	sp|P08392|ICP4_HHV11	255	sp|P0C2W7|CT47B_HUMAN Cancer/testis antigen 47B OS=Homo sapiens OX=9606 GN=CT47B1 PE=4 SV=1	199	AASVPEPAVPAD
AGSMPAPAVPAD	sp|P08392|ICP4_HHV11	255	sp|Q5JQC4|CT47A_HUMAN Cancer/testis antigen 47A OS=Homo sapiens OX=9606 GN=CT47A1 PE=2 SV=1	192	AASVPEPAVPAD
AGSMPAPAVPAD	sp|P08392|ICP4_HHV11	255	sp|Q6ZVC0|NYAP1_HUMAN Neuronal tyrosine-phosphorylated phosphoinositide-3-kinase adapter 1 OS=Homo sapiens OX=9606 GN=NYAP1 PE=2 SV=1	367	AGSTPAPQVPAR
AGSMPAPAVPAD	sp|P08392|ICP4_HHV11	255	tr|C9JS30|C9JS30_HUMAN Neuronal tyrosine-phosphorylated phosphoinositide-3-kinase adapter 1 OS=Homo sapiens OX=9606 GN=NYAP1 PE=1 SV=1	310	AGSTPAPQVPAR
AAAACGARLSRR	sp|P10231|TEG5_HHV11	135	sp|O75882|ATRN_HUMAN Attractin OS=Homo sapiens OX=9606 GN=ATRN PE=1 SV=2	4	AAAATEARLRRR
TVLPGGPPVPNA	sp|P10231|TEG5_HHV11	325	tr|H0Y7B8|H0Y7B8_HUMAN Golgin subfamily A member 2 (Fragment) OS=Homo sapiens OX=9606 GN=GOLGA2 PE=1 SV=7	42	TVLPGGVPSPGA
TVLPGGPPVPNA	sp|P10231|TEG5_HHV11	325	tr|B7ZC06|B7ZC06_HUMAN Golgin subfamily A member 2 (Fragment) OS=Homo sapiens OX=9606 GN=GOLGA2 PE=1 SV=2	99	TVLPGGVPSPGA
TVLPGGPPVPNA	sp|P10231|TEG5_HHV11	325	sp|Q08379|GOGA2_HUMAN Golgin subfamily A member 2 OS=Homo sapiens OX=9606 GN=GOLGA2 PE=1 SV=3	84	TVLPGGVPSPGA
TVLPGGPPVPNA	sp|P10231|TEG5_HHV11	325	tr|A0A6Q8KRG2|A0A6Q8KRG2_HUMAN Golgin subfamily A member 2 OS=Homo sapiens OX=9606 GN=GOLGA2 PE=1 SV=1	72	TVLPGGVPSPGA
TSPAGVAGSRSG	sp|P10230|TEG1_HHV11	131	tr|A0A087WUV6|A0A087WUV6_HUMAN AT-rich interactive domain-containing protein 1A OS=Homo sapiens OX=9606 GN=ARID1A PE=1 SV=1	318	GSPASVAQSRSG
TSPAGVAGSRSG	sp|P10230|TEG1_HHV11	131	tr|A0A1B0GTU5|A0A1B0GTU5_HUMAN AT-rich interactive domain-containing protein 1A (Fragment) OS=Homo sapiens OX=9606 GN=ARID1A PE=1 SV=1	320	GSPASVAQSRSG
TSPAGVAGSRSG	sp|P10230|TEG1_HHV11	131	tr|H0Y488|H0Y488_HUMAN AT-rich interactive domain-containing protein 1A OS=Homo sapiens OX=9606 GN=ARID1A PE=1 SV=2	318	GSPASVAQSRSG
TSPAGVAGSRSG	sp|P10230|TEG1_HHV11	131	sp|O14497|ARI1A_HUMAN AT-rich interactive domain-containing protein 1A OS=Homo sapiens OX=9606 GN=ARID1A PE=1 SV=3	701	GSPASVAQSRSG
DLSAAARRRRQE	sp|P10192|HEPA_HHV11	52	sp|A8K010|CF176_HUMAN Putative transcriptional regulator encoded by LINC00473 OS=Homo sapiens OX=9606 GN=LINC00473 PE=5 SV=2	2	ELSAAAGRRRQA
LPGLLLLMVPAD	sp|P32888|TRX1_HHV11	251	sp|P83105|HTRA4_HUMAN Serine protease HTRA4 OS=Homo sapiens OX=9606 GN=HTRA4 PE=1 SV=1	16	LPGLLLLLVPVL
AEGPAHGGQGEV	sp|P10210|SCAF_HHV11	339	sp|O14579|COPE_HUMAN Coatomer subunit epsilon OS=Homo sapiens OX=9606 GN=COPE PE=1 SV=3	5	APGPASGGSGEV
AEGPAHGGQGEV	sp|P10210|SCAF_HHV11	339	tr|M0QXB4|M0QXB4_HUMAN Coatomer subunit epsilon OS=Homo sapiens OX=9606 GN=COPE PE=1 SV=1	5	APGPASGGSGEV
AEGPAHGGQGEV	sp|P10210|SCAF_HHV11	339	tr|M0R061|M0R061_HUMAN Coatomer subunit epsilon OS=Homo sapiens OX=9606 GN=COPE PE=1 SV=1	5	APGPASGGSGEV
ASEPTNDLGGLV	sp|P06492|VP16_HHV11	268	tr|H0Y5G0|H0Y5G0_HUMAN Stromal membrane-associated protein 1 (Fragment) OS=Homo sapiens OX=9606 GN=SMAP1 PE=1 SV=1	86	AAEPTVDLLGLV
TRGDTFYGLLVR	sp|P10236|PRIM_HHV11	240	sp|Q8IV04|TB10C_HUMAN Carabin OS=Homo sapiens OX=9606 GN=TBC1D10C PE=1 SV=1	411	TRGKTFHGLLTR
LPRSPSVSLEEL	sp|P10240|UL56_HHV11	36	sp|Q16378|PROL4_HUMAN Proline-rich protein 4 OS=Homo sapiens OX=9606 GN=PRR4 PE=1 SV=3	104	LPRFPSVSLQEA
LPRSPSVSLEEL	sp|P10240|UL56_HHV11	36	tr|A0A0J9YXF8|A0A0J9YXF8_HUMAN Proline-rich protein 4 OS=Homo sapiens OX=9606 GN=PRR4 PE=4 SV=1	117	LPRFPSVSLQEA
VLDRQQSSAAND	sp|P10202|TRX2_HHV11	240	sp|Q6IWH7|ANO7_HUMAN Anoctamin-7 OS=Homo sapiens OX=9606 GN=ANO7 PE=1 SV=2	121	KLDRQQDSAARD
VLDRQQSSAAND	sp|P10202|TRX2_HHV11	240	tr|A0A6I8PRE6|A0A6I8PRE6_HUMAN Anoctamin OS=Homo sapiens OX=9606 GN=ANO7 PE=1 SV=1	67	KLDRQQDSAARD
VLDRQQSSAAND	sp|P10202|TRX2_HHV11	240	tr|A0A6Q8JTU6|A0A6Q8JTU6_HUMAN Anoctamin OS=Homo sapiens OX=9606 GN=ANO7 PE=1 SV=1	66	KLDRQQDSAARD
VLDRQQSSAAND	sp|P10202|TRX2_HHV11	240	tr|A0A6Q8JT31|A0A6Q8JT31_HUMAN Anoctamin-7 OS=Homo sapiens OX=9606 GN=ANO7 PE=1 SV=1	66	KLDRQQDSAARD
RHPPHPPRSTAA	sp|P04488|GE_HHV11	394	sp|Q76NI1|KNDC1_HUMAN Kinase non-catalytic C-lobe domain-containing protein 1 OS=Homo sapiens OX=9606 GN=KNDC1 PE=2 SV=2	826	RHPPKPPRSKAT
GVAFCIRGVPPR	sp|P10240|UL56_HHV11	21	sp|Q9P227|RHG23_HUMAN Rho GTPase-activating protein 23 OS=Homo sapiens OX=9606 GN=ARHGAP23 PE=1 SV=2	3	GVAFCLVGIPPR
DVGLAESSPSQT	sp|O09802|US8A_HHV11	1	sp|A8MPX8|PP2D1_HUMAN Protein phosphatase 2C-like domain-containing protein 1 OS=Homo sapiens OX=9606 GN=PP2D1 PE=2 SV=2	338	HDGLAESSPSQE
SCSAEALLAPMS	sp|P08392|ICP4_HHV11	28	sp|Q9Y6N8|CAD10_HUMAN Cadherin-10 OS=Homo sapiens OX=9606 GN=CDH10 PE=1 SV=2	597	SCSAEALLLPAG
ADPEEAPASRAP	sp|P08392|ICP4_HHV11	1112	sp|Q12962|TAF10_HUMAN Transcription initiation factor TFIID subunit 10 OS=Homo sapiens OX=9606 GN=TAF10 PE=1 SV=1	8	ADPEAAPASAAS
TAIPAVGVPAAA	sp|P10202|TRX2_HHV11	209	sp|O00268|TAF4_HUMAN Transcription initiation factor TFIID subunit 4 OS=Homo sapiens OX=9606 GN=TAF4 PE=1 SV=2	292	TAAPAVPPPAAA
QARLLNREPAAS	sp|P10220|LTP_HHV11	2275	sp|A4D1N5|YG018_HUMAN Putative uncharacterized protein FLJ40288 OS=Homo sapiens OX=9606 PE=2 SV=1	51	QGRLLPREPAAE
APVSERGRFPSG	sp|P36313|ICP34_HHV11	2	tr|B5MDQ6|B5MDQ6_HUMAN Zinc finger protein 74 OS=Homo sapiens OX=9606 GN=ZNF74 PE=1 SV=1	11	ALVSERGSFLSG
LMQEVALFLAVM	sp|P10221|ITP_HHV11	206	sp|Q86V21|AACS_HUMAN Acetoacetyl-CoA synthetase OS=Homo sapiens OX=9606 GN=AACS PE=1 SV=1	134	LRQEVALFAAAM
SRPSGARSERNS	sp|P08392|ICP4_HHV11	1236	sp|Q86UU1|PHLB1_HUMAN Pleckstrin homology-like domain family B member 1 OS=Homo sapiens OX=9606 GN=PHLDB1 PE=1 SV=1	301	SRPSGARSESPR
ALIAAAYAVRVL	sp|P04294|AN_HHV11	568	sp|Q9NZJ4|SACS_HUMAN Sacsin OS=Homo sapiens OX=9606 GN=SACS PE=1 SV=2	4484	ALIAADYAVRGK
ALIAAAYAVRVL	sp|P04294|AN_HHV11	568	tr|F8VYZ3|F8VYZ3_HUMAN Serine dehydratase-like (Fragment) OS=Homo sapiens OX=9606 GN=SDSL PE=1 SV=1	17	AGIAAAYAARKL
ALIAAAYAVRVL	sp|P04294|AN_HHV11	568	sp|Q96GA7|SDSL_HUMAN Serine dehydratase-like OS=Homo sapiens OX=9606 GN=SDSL PE=1 SV=1	75	AGIAAAYAARKL
ALIAAAYAVRVL	sp|P04294|AN_HHV11	568	sp|Q05469|LIPS_HUMAN Hormone-sensitive lipase OS=Homo sapiens OX=9606 GN=LIPE PE=1 SV=4	735	ALRAAAYGVRVP
CALIAAAYAVRV	sp|P04294|AN_HHV11	567	sp|Q9NZJ4|SACS_HUMAN Sacsin OS=Homo sapiens OX=9606 GN=SACS PE=1 SV=2	4483	LALIAADYAVRG
CALIAAAYAVRV	sp|P04294|AN_HHV11	567	tr|A0A6I8PRU0|A0A6I8PRU0_HUMAN Cadherin EGF LAG seven-pass G-type receptor 1 OS=Homo sapiens OX=9606 GN=CELSR1 PE=1 SV=2	185	CALRRAAGAVRV
CALIAAAYAVRV	sp|P04294|AN_HHV11	567	sp|Q9NYQ6|CELR1_HUMAN Cadherin EGF LAG seven-pass G-type receptor 1 OS=Homo sapiens OX=9606 GN=CELSR1 PE=1 SV=1	185	CALRRAAGAVRV
CALIAAAYAVRV	sp|P04294|AN_HHV11	567	sp|Q05469|LIPS_HUMAN Hormone-sensitive lipase OS=Homo sapiens OX=9606 GN=LIPE PE=1 SV=4	734	VALRAAAYGVRV
AVHTDRSEAPGA	sp|P10230|TEG1_HHV11	432	sp|O75676|KS6A4_HUMAN Ribosomal protein S6 kinase alpha-4 OS=Homo sapiens OX=9606 GN=RPS6KA4 PE=1 SV=1	373	AVMTDGLEAPGA
AVHTDRSEAPGA	sp|P10230|TEG1_HHV11	432	tr|A0A0A6YYC0|A0A0A6YYC0_HUMAN Non-specific serine/threonine protein kinase (Fragment) OS=Homo sapiens OX=9606 GN=RPS6KA4 PE=1 SV=5	357	AVMTDGLEAPGA
AVHTDRSEAPGA	sp|P10230|TEG1_HHV11	432	tr|E9PJN1|E9PJN1_HUMAN Ribosomal protein S6 kinase OS=Homo sapiens OX=9606 GN=RPS6KA4 PE=1 SV=1	373	AVMTDGLEAPGA
VLGTSPLLLAVL	sp|P10210|SCAF_HHV11	394	sp|O43150|ASAP2_HUMAN Arf-GAP with SH3 domain, ANK repeat and PH domain-containing protein 2 OS=Homo sapiens OX=9606 GN=ASAP2 PE=1 SV=3	480	VLGTSELLLAKN
AEDEGPPPPSKT	sp|P10220|LTP_HHV11	2110	sp|Q5SXM8|DNLZ_HUMAN DNL-type zinc finger protein OS=Homo sapiens OX=9606 GN=DNLZ PE=1 SV=1	164	GEDEGPPSPGKT
PRDAPAPAPDPP	sp|P08392|ICP4_HHV11	314	tr|F8VPC8|F8VPC8_HUMAN BTB/POZ domain-containing protein 6 (Fragment) OS=Homo sapiens OX=9606 GN=BTBD6 PE=4 SV=1	34	PPSAPAPAPPPP
PRDAPAPAPDPP	sp|P08392|ICP4_HHV11	314	sp|Q96KE9|BTBD6_HUMAN BTB/POZ domain-containing protein 6 OS=Homo sapiens OX=9606 GN=BTBD6 PE=1 SV=3	34	PPSAPAPAPPPP
PRDAPAPAPDPP	sp|P08392|ICP4_HHV11	314	sp|Q5T442|CXG2_HUMAN Gap junction gamma-2 protein OS=Homo sapiens OX=9606 GN=GJC2 PE=1 SV=1	305	PASAPAPAPRPP
TLRDSVFTSTAC	sp|P04294|AN_HHV11	556	sp|P40200|TACT_HUMAN T-cell surface protein tactile OS=Homo sapiens OX=9606 GN=CD96 PE=1 SV=2	476	TLHDNVFTSTAR
TLRDSVFTSTAC	sp|P04294|AN_HHV11	556	tr|E9PEJ1|E9PEJ1_HUMAN T-cell surface protein tactile OS=Homo sapiens OX=9606 GN=CD96 PE=1 SV=1	459	TLHDNVFTSTAR
DQAAPVAPEALL	sp|P08392|ICP4_HHV11	938	sp|Q9UIQ6|LCAP_HUMAN Leucyl-cystinyl aminopeptidase OS=Homo sapiens OX=9606 GN=LNPEP PE=1 SV=3	241	GQIAIVAPEALL
HALRRLESCAQP	sp|P10188|NP04_HHV11	66	sp|Q9BQS8|FYCO1_HUMAN FYVE and coiled-coil domain-containing protein 1 OS=Homo sapiens OX=9606 GN=FYCO1 PE=1 SV=3	335	TALRRLESMLQP
ADLVDDDRAQLA	sp|P10190|PORTL_HHV11	640	tr|H0Y2X5|H0Y2X5_HUMAN Aldehyde dehydrogenase 1 family, member A3, isoform CRA_b OS=Homo sapiens OX=9606 GN=ALDH1A3 PE=1 SV=1	104	ADLVERDRATLA
ADLVDDDRAQLA	sp|P10190|PORTL_HHV11	640	tr|H0YKF9|H0YKF9_HUMAN Aldehyde dehydrogenase family 1 member A3 (Fragment) OS=Homo sapiens OX=9606 GN=ALDH1A3 PE=1 SV=8	76	ADLVERDRATLA
ADLVDDDRAQLA	sp|P10190|PORTL_HHV11	640	sp|P47895|AL1A3_HUMAN Aldehyde dehydrogenase family 1 member A3 OS=Homo sapiens OX=9606 GN=ALDH1A3 PE=1 SV=2	104	ADLVERDRATLA
ADLVDDDRAQLA	sp|P10190|PORTL_HHV11	640	tr|H0YNQ3|H0YNQ3_HUMAN Aldehyde dehydrogenase family 1 member A3 OS=Homo sapiens OX=9606 GN=ALDH1A3 PE=1 SV=1	104	ADLVERDRATLA
ADLVDDDRAQLA	sp|P10190|PORTL_HHV11	640	tr|Q9UED3|Q9UED3_HUMAN RALDH2-T (Fragment) OS=Homo sapiens OX=9606 GN=ALDH1A2 PE=1 SV=1	14	ADLVERDRAVLA
ADLVDDDRAQLA	sp|P10190|PORTL_HHV11	640	tr|H0YKL3|H0YKL3_HUMAN Retinal dehydrogenase 2 (Fragment) OS=Homo sapiens OX=9606 GN=ALDH1A2 PE=1 SV=1	14	ADLVERDRAVLA
ADLVDDDRAQLA	sp|P10190|PORTL_HHV11	640	tr|H0YMG7|H0YMG7_HUMAN Retinal dehydrogenase 2 OS=Homo sapiens OX=9606 GN=ALDH1A2 PE=1 SV=1	81	ADLVERDRAVLA
ADLVDDDRAQLA	sp|P10190|PORTL_HHV11	640	sp|O94788|AL1A2_HUMAN Retinal dehydrogenase 2 OS=Homo sapiens OX=9606 GN=ALDH1A2 PE=1 SV=3	110	ADLVERDRAVLA
ADDAAWAAAGLA	sp|P08392|ICP4_HHV11	496	sp|Q8N9B5|JMY_HUMAN Junction-mediating and -regulatory protein OS=Homo sapiens OX=9606 GN=JMY PE=1 SV=2	157	ADDAAGAAAAAA
ADDAAWAAAGLA	sp|P08392|ICP4_HHV11	496	sp|Q5BIV9|SPRN_HUMAN Shadow of prion protein OS=Homo sapiens OX=9606 GN=SPRN PE=2 SV=1	73	AGAAAGAAAGLA
VPPSARCTPLPA	sp|P10210|SCAF_HHV11	516	sp|Q8TDC3|BRSK1_HUMAN Serine/threonine-protein kinase BRSK1 OS=Homo sapiens OX=9606 GN=BRSK1 PE=1 SV=2	493	PPPSARSTPLPG
VPPSARCTPLPA	sp|P10210|SCAF_HHV11	516	tr|J3KNK0|J3KNK0_HUMAN Serine/threonine-protein kinase BRSK1 OS=Homo sapiens OX=9606 GN=BRSK1 PE=1 SV=1	188	PPPSARSTPLPG
VPPSARCTPLPA	sp|P10210|SCAF_HHV11	516	sp|O00160|MYO1F_HUMAN Unconventional myosin-If OS=Homo sapiens OX=9606 GN=MYO1F PE=1 SV=3	958	VPPSARGGPLPL
SVALILVCNYLV	sp|P10201|CVC1_HHV11	216	sp|Q9NV64|TM39A_HUMAN Transmembrane protein 39A OS=Homo sapiens OX=9606 GN=TMEM39A PE=1 SV=1	450	SMALILFCNYYV
RRIPFFVGLRPF	sp|P10212|TRM1_HHV11	80	tr|H3BLU5|H3BLU5_HUMAN Protein unc-80 homolog (Fragment) OS=Homo sapiens OX=9606 GN=UNC80 PE=1 SV=1	369	TRIPIFVLLRPF
RRIPFFVGLRPF	sp|P10212|TRM1_HHV11	80	tr|A0A669KBC5|A0A669KBC5_HUMAN Protein unc-80 homolog OS=Homo sapiens OX=9606 GN=UNC80 PE=1 SV=1	2909	TRIPIFVLLRPF
RRIPFFVGLRPF	sp|P10212|TRM1_HHV11	80	tr|A0A669KAW8|A0A669KAW8_HUMAN Protein unc-80 homolog OS=Homo sapiens OX=9606 GN=UNC80 PE=1 SV=1	2841	TRIPIFVLLRPF
RRIPFFVGLRPF	sp|P10212|TRM1_HHV11	80	sp|Q8N2C7|UNC80_HUMAN Protein unc-80 homolog OS=Homo sapiens OX=9606 GN=UNC80 PE=2 SV=2	2843	TRIPIFVLLRPF
TPGLPRSPSVSL	sp|P10240|UL56_HHV11	33	sp|O14682|ENC1_HUMAN Ectoderm-neural cortex protein 1 OS=Homo sapiens OX=9606 GN=ENC1 PE=1 SV=2	400	TGCLPASPSVSL
SGAAAPLYPGRP	sp|P10193|OBP_HHV11	13	tr|A0A0A0MQW5|A0A0A0MQW5_HUMAN Serine/threonine-protein kinase LMTK3 OS=Homo sapiens OX=9606 GN=LMTK3 PE=1 SV=1	766	MGAAAPQYPGRG
SGAAAPLYPGRP	sp|P10193|OBP_HHV11	13	tr|A0A3B3ISL5|A0A3B3ISL5_HUMAN Serine/threonine-protein kinase LMTK3 OS=Homo sapiens OX=9606 GN=LMTK3 PE=1 SV=1	763	MGAAAPQYPGRG
SGAAAPLYPGRP	sp|P10193|OBP_HHV11	13	sp|Q96Q04|LMTK3_HUMAN Serine/threonine-protein kinase LMTK3 OS=Homo sapiens OX=9606 GN=LMTK3 PE=1 SV=2	737	MGAAAPQYPGRG
SGAAAPLYPGRP	sp|P10193|OBP_HHV11	13	tr|A0A5F9ZH67|A0A5F9ZH67_HUMAN Serine/threonine-protein kinase LMTK3 OS=Homo sapiens OX=9606 GN=LMTK3 PE=1 SV=1	492	MGAAAPQYPGRG
SGAAAPLYPGRP	sp|P10193|OBP_HHV11	13	tr|J3KMX2|J3KMX2_HUMAN SWI/SNF-related matrix-associated actin-dependent regulator of chromatin subfamily D member 2 OS=Homo sapiens OX=9606 GN=SMARCD2 PE=1 SV=1	22	FGAAAPLRPGMP
SGAAAPLYPGRP	sp|P10193|OBP_HHV11	13	tr|B9EGA3|B9EGA3_HUMAN SMARCD2 protein OS=Homo sapiens OX=9606 GN=SMARCD2 PE=1 SV=1	60	FGAAAPLRPGMP
SGAAAPLYPGRP	sp|P10193|OBP_HHV11	13	sp|Q92925|SMRD2_HUMAN SWI/SNF-related matrix-associated actin-dependent regulator of chromatin subfamily D member 2 OS=Homo sapiens OX=9606 GN=SMARCD2 PE=1 SV=3	97	FGAAAPLRPGMP
SGAAAPLYPGRP	sp|P10193|OBP_HHV11	13	tr|J3QQL7|J3QQL7_HUMAN SWI/SNF-related matrix-associated actin-dependent regulator of chromatin subfamily D member 2 (Fragment) OS=Homo sapiens OX=9606 GN=SMARCD2 PE=1 SV=1	25	FGAAAPLRPGMP
AAPVAPEALLGL	sp|P08392|ICP4_HHV11	940	sp|Q9NR96|TLR9_HUMAN Toll-like receptor 9 OS=Homo sapiens OX=9606 GN=TLR9 PE=1 SV=2	187	ALEVAPGALLGL
AAPVAPEALLGL	sp|P08392|ICP4_HHV11	940	tr|H0Y858|H0Y858_HUMAN Toll-like receptor 9 (Fragment) OS=Homo sapiens OX=9606 PE=3 SV=1	341	ALEVAPGALLGL
AAPVAPEALLGL	sp|P08392|ICP4_HHV11	940	sp|P51843|NR0B1_HUMAN Nuclear receptor subfamily 0 group B member 1 OS=Homo sapiens OX=9606 GN=NR0B1 PE=1 SV=2	92	AAPKAPEATLGP
LEAKVGELNAPL	sp|P10221|ITP_HHV11	384	tr|A0A6E1W127|A0A6E1W127_HUMAN Myosin-7B OS=Homo sapiens OX=9606 GN=MYH7B PE=1 SV=1	1822	LEAKVRELEAEL
LEAKVGELNAPL	sp|P10221|ITP_HHV11	384	sp|A7E2Y1|MYH7B_HUMAN Myosin-7B OS=Homo sapiens OX=9606 GN=MYH7B PE=1 SV=4	1864	LEAKVRELEAEL
LSEASVSSVLGP	sp|P10187|NP03_HHV11	158	tr|C9JFX4|C9JFX4_HUMAN Single Ig IL-1-related receptor OS=Homo sapiens OX=9606 GN=SIGIRR PE=1 SV=1	74	LSEVLVSSVLGV
LSEASVSSVLGP	sp|P10187|NP03_HHV11	158	sp|Q6IA17|SIGIR_HUMAN Single Ig IL-1-related receptor OS=Homo sapiens OX=9606 GN=SIGIRR PE=1 SV=3	74	LSEVLVSSVLGV
RAWIASKPLGLH	sp|P04290|UL13_HHV11	365	tr|A0A1C7CYY8|A0A1C7CYY8_HUMAN Embryonic polyadenylate-binding protein 2 (Fragment) OS=Homo sapiens OX=9606 GN=PABPN1L PE=4 SV=1	254	GAWIRSKPLVLH
ARRGLGRARPDP	sp|P10238|ICP27_HHV11	439	sp|Q96HY7|DHTK1_HUMAN Probable 2-oxoglutarate dehydrogenase E1 component DHKTD1, mitochondrial OS=Homo sapiens OX=9606 GN=DHTKD1 PE=1 SV=2	9	ARRGLGRALPLF
ARRGLGRARPDP	sp|P10238|ICP27_HHV11	439	tr|C9JWN1|C9JWN1_HUMAN Probable 2-oxoglutarate dehydrogenase E1 component DHKTD1, mitochondrial (Fragment) OS=Homo sapiens OX=9606 GN=DHTKD1 PE=1 SV=8	9	ARRGLGRALPLF
PAGPRPRRGVPP	sp|P36313|ICP34_HHV11	74	tr|A0A0G2JS76|A0A0G2JS76_HUMAN Microtubule-associated protein OS=Homo sapiens OX=9606 GN=MAPT PE=1 SV=1	513	PAGPRSERGEPP
PAGPRPRRGVPP	sp|P36313|ICP34_HHV11	74	tr|A0A0G2JMX7|A0A0G2JMX7_HUMAN Microtubule-associated protein OS=Homo sapiens OX=9606 GN=MAPT PE=1 SV=1	513	PAGPRSERGEPP
