query	query_seqname	query_start	target_seqname	target_start	target
KDLLSRTSNLLR	sp|F5HAW0|RIR2_HHV8P	33	tr|H0YEZ7|H0YEZ7_HUMAN Serine/threonine-protein kinase 33 (Fragment) OS=Homo sapiens OX=9606 GN=STK33 PE=1 SV=1	23	KDLPSRTSNVER
KDLLSRTSNLLR	sp|F5HAW0|RIR2_HHV8P	33	tr|C9JCS6|C9JCS6_HUMAN Serine/threonine-protein kinase 33 (Fragment) OS=Homo sapiens OX=9606 GN=STK33 PE=1 SV=1	73	KDLPSRTSNVER
KDLLSRTSNLLR	sp|F5HAW0|RIR2_HHV8P	33	tr|C9J6X7|C9J6X7_HUMAN Serine/threonine-protein kinase 33 (Fragment) OS=Homo sapiens OX=9606 GN=STK33 PE=1 SV=1	32	KDLPSRTSNVER
KDLLSRTSNLLR	sp|F5HAW0|RIR2_HHV8P	33	tr|C9J319|C9J319_HUMAN Serine/threonine-protein kinase 33 (Fragment) OS=Homo sapiens OX=9606 GN=STK33 PE=1 SV=1	32	KDLPSRTSNVER
KDLLSRTSNLLR	sp|F5HAW0|RIR2_HHV8P	33	tr|B4DDH2|B4DDH2_HUMAN Serine/threonine-protein kinase 33 OS=Homo sapiens OX=9606 GN=STK33 PE=1 SV=1	32	KDLPSRTSNVER
KDLLSRTSNLLR	sp|F5HAW0|RIR2_HHV8P	33	sp|Q9BYT3|STK33_HUMAN Serine/threonine-protein kinase 33 OS=Homo sapiens OX=9606 GN=STK33 PE=1 SV=1	73	KDLPSRTSNVER
LALPALLQPLYG	sp|F5HAD1|ORF58_HHV8P	212	sp|Q8IX05|CD302_HUMAN CD302 antigen OS=Homo sapiens OX=9606 GN=CD302 PE=1 SV=1	4	AALPALLLPLLG
LALPALLQPLYG	sp|F5HAD1|ORF58_HHV8P	212	tr|A0A087WT00|A0A087WT00_HUMAN CD302 antigen OS=Homo sapiens OX=9606 GN=CD302 PE=4 SV=1	4	AALPALLLPLLG
LALPALLQPLYG	sp|F5HAD1|ORF58_HHV8P	212	sp|Q5VWC8|HACD4_HUMAN Very-long-chain (3R)-3-hydroxyacyl-CoA dehydratase 4 OS=Homo sapiens OX=9606 GN=HACD4 PE=1 SV=1	4	LALPAWLQPRYR
QELGSLSILSIL	sp|Q2HR64|LTP_HHV8P	59	sp|A6NIV6|LRIQ4_HUMAN Leucine-rich repeat and IQ domain-containing protein 4 OS=Homo sapiens OX=9606 GN=LRRIQ4 PE=4 SV=2	343	SELGSLSKLKIL
DEENQQQLDDQQ	sp|Q9QR71|LANA1_HHV8P	654	tr|H0Y9T6|H0Y9T6_HUMAN WD repeat and FYVE domain-containing protein 3 (Fragment) OS=Homo sapiens OX=9606 GN=WDFY3 PE=1 SV=1	101	DEENQEQLQDQI
DEENQQQLDDQQ	sp|Q9QR71|LANA1_HHV8P	654	sp|Q8IZQ1|WDFY3_HUMAN WD repeat and FYVE domain-containing protein 3 OS=Homo sapiens OX=9606 GN=WDFY3 PE=1 SV=2	2498	DEENQEQLQDQI
DEENQQQLDDQQ	sp|Q9QR71|LANA1_HHV8P	654	sp|O15514|RPB4_HUMAN DNA-directed RNA polymerase II subunit RPB4 OS=Homo sapiens OX=9606 GN=POLR2D PE=1 SV=1	124	DEELQQILDDIQ
DEENQQQLDDQQ	sp|Q9QR71|LANA1_HHV8P	654	tr|E9PB93|E9PB93_HUMAN DNA-directed RNA polymerase II subunit RPB4 OS=Homo sapiens OX=9606 GN=POLR2D PE=1 SV=1	86	DEELQQILDDIQ
DEENQQQLDDQQ	sp|Q9QR71|LANA1_HHV8P	654	tr|E9PHV4|E9PHV4_HUMAN DNA-directed RNA polymerase II subunit RPB4 OS=Homo sapiens OX=9606 GN=POLR2D PE=1 SV=1	92	DEELQQILDDIQ
TTVSALDFTTIR	sp|F5HAW0|RIR2_HHV8P	274	tr|C9JEE7|C9JEE7_HUMAN WD repeat-containing protein 43 (Fragment) OS=Homo sapiens OX=9606 GN=WDR43 PE=1 SV=1	120	TPVSSLMFTTIR
TTVSALDFTTIR	sp|F5HAW0|RIR2_HHV8P	274	tr|C9IZK7|C9IZK7_HUMAN WD repeat-containing protein 43 (Fragment) OS=Homo sapiens OX=9606 GN=WDR43 PE=1 SV=1	28	TPVSSLMFTTIR
TTVSALDFTTIR	sp|F5HAW0|RIR2_HHV8P	274	sp|Q15061|WDR43_HUMAN WD repeat-containing protein 43 OS=Homo sapiens OX=9606 GN=WDR43 PE=1 SV=3	209	TPVSSLMFTTIR
SVAEQAPGEAAE	sp|F5HDE4|ORF45_HHV8P	105	tr|H0Y7T8|H0Y7T8_HUMAN Amphiphysin (Fragment) OS=Homo sapiens OX=9606 GN=AMPH PE=1 SV=1	365	SAAEGAPGEEAE
SVAEQAPGEAAE	sp|F5HDE4|ORF45_HHV8P	105	sp|P49418|AMPH_HUMAN Amphiphysin OS=Homo sapiens OX=9606 GN=AMPH PE=1 SV=1	482	SAAEGAPGEEAE
SVAEQAPGEAAE	sp|F5HDE4|ORF45_HHV8P	105	sp|Q8TEQ0|SNX29_HUMAN Sorting nexin-29 OS=Homo sapiens OX=9606 GN=SNX29 PE=1 SV=3	571	TVAEQKPGEIAE
SVAEQAPGEAAE	sp|F5HDE4|ORF45_HHV8P	105	tr|A0A0C4DGM3|A0A0C4DGM3_HUMAN Sorting nexin-29 (Fragment) OS=Homo sapiens OX=9606 GN=SNX29 PE=1 SV=1	60	TVAEQKPGEIAE
LASNAEAVTSTE	sp|F5HCV3|ORF50_HHV8P	572	tr|A0A087WWF3|A0A087WWF3_HUMAN Large neutral amino acids transporter small subunit 2 OS=Homo sapiens OX=9606 GN=SLC7A8 PE=4 SV=1	94	LASNAVAVTFGE
LASNAEAVTSTE	sp|F5HCV3|ORF50_HHV8P	572	sp|Q9UHI5|LAT2_HUMAN Large neutral amino acids transporter small subunit 2 OS=Homo sapiens OX=9606 GN=SLC7A8 PE=1 SV=1	297	LASNAVAVTFGE
IPYVETETSRQA	sp|Q9QR70|ORF75_HHV8P	654	sp|Q9UHR4|BI2L1_HUMAN Brain-specific angiogenesis inhibitor 1-associated protein 2-like protein 1 OS=Homo sapiens OX=9606 GN=BAIAP2L1 PE=1 SV=2	161	IEYVETVTSRQS
NVFDVERHEAAG	sp|F5HB81|GB_HHV8P	82	sp|Q92619|HMHA1_HUMAN Rho GTPase-activating protein 45 OS=Homo sapiens OX=9606 GN=ARHGAP45 PE=1 SV=2	580	NVSDVARPEAAG
NVFDVERHEAAG	sp|F5HB81|GB_HHV8P	82	tr|K7EM85|K7EM85_HUMAN Rho GTPase-activating protein 45 OS=Homo sapiens OX=9606 GN=ARHGAP45 PE=1 SV=1	607	NVSDVARPEAAG
NVFDVERHEAAG	sp|F5HB81|GB_HHV8P	82	tr|F5H1R4|F5H1R4_HUMAN Rho GTPase-activating protein 45 OS=Homo sapiens OX=9606 GN=ARHGAP45 PE=1 SV=1	463	NVSDVARPEAAG
NVFDVERHEAAG	sp|F5HB81|GB_HHV8P	82	tr|K7ES92|K7ES92_HUMAN Rho GTPase-activating protein 45 OS=Homo sapiens OX=9606 GN=ARHGAP45 PE=1 SV=1	215	NVSDVARPEAAG
NVFDVERHEAAG	sp|F5HB81|GB_HHV8P	82	tr|K7ES98|K7ES98_HUMAN Rho GTPase-activating protein 45 OS=Homo sapiens OX=9606 GN=ARHGAP45 PE=1 SV=1	584	NVSDVARPEAAG
RQAPANVQNPAQ	sp|Q2HR82|KBZIP_HHV8P	214	tr|E7EVM0|E7EVM0_HUMAN Thyroglobulin OS=Homo sapiens OX=9606 GN=TG PE=1 SV=1	588	RQKPANVLNDAQ
RQAPANVQNPAQ	sp|Q2HR82|KBZIP_HHV8P	214	sp|P01266|THYG_HUMAN Thyroglobulin OS=Homo sapiens OX=9606 GN=TG PE=1 SV=5	2455	RQKPANVLNDAQ
RQAPANVQNPAQ	sp|Q2HR82|KBZIP_HHV8P	214	tr|H0YBY1|H0YBY1_HUMAN Thyroglobulin (Fragment) OS=Homo sapiens OX=9606 GN=TG PE=1 SV=1	911	RQKPANVLNDAQ
DVTPLLSSLGPM	sp|F5HB62|KITH_HHV8P	261	tr|M0R1P1|M0R1P1_HUMAN Zinc finger protein 333 OS=Homo sapiens OX=9606 GN=ZNF333 PE=4 SV=1	128	RVTPLLSSDGEM
PLDPAANPMLTF	sp|F5HB39|CVC1_HHV8P	5	sp|Q9P2R6|RERE_HUMAN Arginine-glutamic acid dipeptide repeats protein OS=Homo sapiens OX=9606 GN=RERE PE=1 SV=2	1336	PLHPAANPMEHF
PLDPAANPMLTF	sp|F5HB39|CVC1_HHV8P	5	tr|B1AKN3|B1AKN3_HUMAN Arginine-glutamic acid dipeptide (RE) repeats, isoform CRA_b OS=Homo sapiens OX=9606 GN=RERE PE=1 SV=1	1068	PLHPAANPMEHF
LELARPELLLGA	sp|Q2HRC6|DYR_HHV8P	172	sp|Q86VR2|RETR3_HUMAN Reticulophagy regulator 3 OS=Homo sapiens OX=9606 GN=RETREG3 PE=1 SV=1	375	DEAALPELLLGA
LELARPELLLGA	sp|Q2HRC6|DYR_HHV8P	172	tr|K7EQI9|K7EQI9_HUMAN Reticulophagy regulator 3 OS=Homo sapiens OX=9606 GN=RETREG3 PE=1 SV=1	278	DEAALPELLLGA
LELARPELLLGA	sp|Q2HRC6|DYR_HHV8P	172	tr|E7ER40|E7ER40_HUMAN PHD finger protein 3 (Fragment) OS=Homo sapiens OX=9606 GN=PHF3 PE=1 SV=8	603	LELHRPNLLLGL
LELARPELLLGA	sp|Q2HRC6|DYR_HHV8P	172	sp|Q92576|PHF3_HUMAN PHD finger protein 3 OS=Homo sapiens OX=9606 GN=PHF3 PE=1 SV=3	1334	LELHRPNLLLGL
PEPPPTVFKEVH	sp|Q2HR64|LTP_HHV8P	1354	sp|Q9BR09|NEUL2_HUMAN Neuralized-like protein 2 OS=Homo sapiens OX=9606 GN=NEURL2 PE=2 SV=1	19	PEPPPTRFHRVH
VVTFSSHGLSEL	sp|Q2HRD0|DPOL_HHV8P	592	sp|P10643|CO7_HUMAN Complement component C7 OS=Homo sapiens OX=9606 GN=C7 PE=1 SV=2	345	VVKFSSHGCKEL
APLFSLLLLCAS	sp|F5HAD1|ORF58_HHV8P	87	tr|A0A1W2PR41|A0A1W2PR41_HUMAN Tumor necrosis factor receptor superfamily member 11A OS=Homo sapiens OX=9606 GN=TNFRSF11A PE=1 SV=1	9	RPLFALLLLCAL
APLFSLLLLCAS	sp|F5HAD1|ORF58_HHV8P	87	sp|Q9Y6Q6|TNR11_HUMAN Tumor necrosis factor receptor superfamily member 11A OS=Homo sapiens OX=9606 GN=TNFRSF11A PE=1 SV=1	9	RPLFALLLLCAL
VTPLLSSLGPME	sp|F5HB62|KITH_HHV8P	262	tr|M0R1P1|M0R1P1_HUMAN Zinc finger protein 333 OS=Homo sapiens OX=9606 GN=ZNF333 PE=4 SV=1	129	VTPLLSSDGEMG
LLAFIACLGNKL	sp|Q2HRD2|TRM1_HHV8P	80	sp|C9JR72|KBTBD_HUMAN Kelch repeat and BTB domain-containing protein 13 OS=Homo sapiens OX=9606 GN=KBTBD13 PE=1 SV=1	200	LLAGVATLGNKL
EQKEEDDEDDQE	sp|Q9QR71|LANA1_HHV8P	632	sp|Q7Z6Z7|HUWE1_HUMAN E3 ubiquitin-protein ligase HUWE1 OS=Homo sapiens OX=9606 GN=HUWE1 PE=1 SV=3	2436	EEEEEDEEDDQE
VFRLILFPVMAY	sp|F5HDD0|GM_HHV8P	312	sp|Q8NGK9|OR5DG_HUMAN Olfactory receptor 5D16 OS=Homo sapiens OX=9606 GN=OR5D16 PE=3 SV=1	111	VTELILFAVMAY
TRAPPRPGAPTP	sp|Q2HRC9|ORF10_HHV8P	323	sp|Q66K66|TM198_HUMAN Transmembrane protein 198 OS=Homo sapiens OX=9606 GN=TMEM198 PE=1 SV=1	285	PRAPPRPGPPDP
TRAPPRPGAPTP	sp|Q2HRC9|ORF10_HHV8P	323	tr|A0A5F9ZHX6|A0A5F9ZHX6_HUMAN Activated CDC42 kinase 1 (Fragment) OS=Homo sapiens OX=9606 GN=TNK2 PE=1 SV=1	119	TRALPRPLHPTP
TRAPPRPGAPTP	sp|Q2HRC9|ORF10_HHV8P	323	sp|Q07912|ACK1_HUMAN Activated CDC42 kinase 1 OS=Homo sapiens OX=9606 GN=TNK2 PE=1 SV=3	609	TRALPRPLHPTP
TRAPPRPGAPTP	sp|Q2HRC9|ORF10_HHV8P	323	tr|A0A5F9ZHD0|A0A5F9ZHD0_HUMAN Activated CDC42 kinase 1 OS=Homo sapiens OX=9606 GN=TNK2 PE=1 SV=1	119	TRALPRPLHPTP
TRAPPRPGAPTP	sp|Q2HRC9|ORF10_HHV8P	323	tr|A0A5F9ZHJ2|A0A5F9ZHJ2_HUMAN Non-specific protein-tyrosine kinase OS=Homo sapiens OX=9606 GN=TNK2 PE=1 SV=1	641	TRALPRPLHPTP
TRAPPRPGAPTP	sp|Q2HRC9|ORF10_HHV8P	323	tr|A0A5F9ZI29|A0A5F9ZI29_HUMAN Non-specific protein-tyrosine kinase OS=Homo sapiens OX=9606 GN=TNK2 PE=1 SV=1	609	TRALPRPLHPTP
TRAPPRPGAPTP	sp|Q2HRC9|ORF10_HHV8P	323	tr|A0A5F9ZGX5|A0A5F9ZGX5_HUMAN Non-specific protein-tyrosine kinase OS=Homo sapiens OX=9606 GN=TNK2 PE=1 SV=1	624	TRALPRPLHPTP
TRAPPRPGAPTP	sp|Q2HRC9|ORF10_HHV8P	323	tr|A0A499FJ16|A0A499FJ16_HUMAN Non-specific protein-tyrosine kinase OS=Homo sapiens OX=9606 GN=TNK2 PE=1 SV=1	687	TRALPRPLHPTP
TRAPPRPGAPTP	sp|Q2HRC9|ORF10_HHV8P	323	tr|C9J1X3|C9J1X3_HUMAN Non-specific protein-tyrosine kinase OS=Homo sapiens OX=9606 GN=TNK2 PE=1 SV=1	641	TRALPRPLHPTP
TRAPPRPGAPTP	sp|Q2HRC9|ORF10_HHV8P	323	tr|A0A5F9ZHP4|A0A5F9ZHP4_HUMAN Non-specific protein-tyrosine kinase OS=Homo sapiens OX=9606 GN=TNK2 PE=1 SV=1	609	TRALPRPLHPTP
TRAPPRPGAPTP	sp|Q2HRC9|ORF10_HHV8P	323	sp|A8MWP4|YU008_HUMAN Putative uncharacterized protein ENSP00000401716 OS=Homo sapiens OX=9606 PE=5 SV=1	16	TRAPPRPSAPQQ
GRQRLPSALSLG	sp|F5HIC6|VIRF3_HHV8P	236	tr|A0A494C0S9|A0A494C0S9_HUMAN C3 and PZP-like alpha-2-macroglobulin domain-containing protein 8 OS=Homo sapiens OX=9606 GN=CPAMD8 PE=1 SV=1	481	GAQYLPSYLSLG
GRQRLPSALSLG	sp|F5HIC6|VIRF3_HHV8P	236	sp|Q8IZJ3|CPMD8_HUMAN C3 and PZP-like alpha-2-macroglobulin domain-containing protein 8 OS=Homo sapiens OX=9606 GN=CPAMD8 PE=1 SV=2	434	GAQYLPSYLSLG
TGLEVTGKHEQA	sp|Q2HRD4|ORF4_HHV8P	196	sp|O60303|KATIP_HUMAN Katanin-interacting protein OS=Homo sapiens OX=9606 GN=KATNIP PE=1 SV=4	1229	TGLEVVGKEGQA
TELNSSHLPDFR	sp|Q2HRC8|ORF11_HHV8P	27	sp|Q15911|ZFHX3_HUMAN Zinc finger homeobox protein 3 OS=Homo sapiens OX=9606 GN=ZFHX3 PE=1 SV=2	25	TELNSTHLPDKP
LDLAFVGMSRDS	sp|Q9QR70|ORF75_HHV8P	858	sp|Q5VZB9|DMRTA_HUMAN Doublesex- and mab-3-related transcription factor A1 OS=Homo sapiens OX=9606 GN=DMRTA1 PE=1 SV=1	470	LDYAFSGMIRDS
SGLSDTLIHISY	sp|Q77Q36|VCYCL_HHV8P	143	tr|A0A2R8YFX5|A0A2R8YFX5_HUMAN Neuron navigator 3 OS=Homo sapiens OX=9606 GN=NAV3 PE=1 SV=1	388	SGLSDTLDNIST
SGLSDTLIHISY	sp|Q77Q36|VCYCL_HHV8P	143	sp|Q8IVL0|NAV3_HUMAN Neuron navigator 3 OS=Homo sapiens OX=9606 GN=NAV3 PE=1 SV=3	888	SGLSDTLDNIST
SEESLAAARKRG	sp|F5HCD4|ORF35_HHV8P	118	sp|Q02535|ID3_HUMAN DNA-binding protein inhibitor ID-3 OS=Homo sapiens OX=9606 GN=ID3 PE=1 SV=2	18	SERSLAIARGRG
SEESLAAARKRG	sp|F5HCD4|ORF35_HHV8P	118	tr|B1AMN7|B1AMN7_HUMAN CTTNBP2 N-terminal-like protein (Fragment) OS=Homo sapiens OX=9606 GN=CTTNBP2NL PE=1 SV=1	217	LEEELAAERKRG
SEESLAAARKRG	sp|F5HCD4|ORF35_HHV8P	118	sp|Q9P2B4|CT2NL_HUMAN CTTNBP2 N-terminal-like protein OS=Homo sapiens OX=9606 GN=CTTNBP2NL PE=1 SV=2	217	LEEELAAERKRG
SPYLISPTVQTR	sp|Q2HR98|UL95_HHV8P	2	sp|P42858|HD_HUMAN Huntingtin OS=Homo sapiens OX=9606 GN=HTT PE=1 SV=2	1702	SPYLISCTVINR
LPRSNGRSHGDL	sp|F5HIN0|PRIM_HHV8P	16	sp|Q9BUN1|MENT_HUMAN Protein MENT OS=Homo sapiens OX=9606 GN=MENT PE=1 SV=1	154	LPRSPGRSTEDL
PVTFLGSSHTSL	sp|Q9QR69|K15_HHV8P	85	sp|Q8N1M1|BEST3_HUMAN Bestrophin-3 OS=Homo sapiens OX=9606 GN=BEST3 PE=1 SV=1	592	LPGFLGSSHTSL
AKPGALAEAGVE	sp|F5H8Y5|TRX1_HHV8P	136	sp|Q9NYB0|TE2IP_HUMAN Telomeric repeat-binding factor 2-interacting protein 1 OS=Homo sapiens OX=9606 GN=TERF2IP PE=1 SV=1	113	AKPGALAEGAAE
AKPGALAEAGVE	sp|F5H8Y5|TRX1_HHV8P	136	tr|A0A590UJT3|A0A590UJT3_HUMAN Telomeric repeat-binding factor 2-interacting protein 1 OS=Homo sapiens OX=9606 GN=TERF2IP PE=1 SV=1	113	AKPGALAEGAAE
AKPGALAEAGVE	sp|F5H8Y5|TRX1_HHV8P	136	sp|O14917|PCD17_HUMAN Protocadherin-17 OS=Homo sapiens OX=9606 GN=PCDH17 PE=1 SV=2	1059	AKPGALAEASSQ
AKPGALAEAGVE	sp|F5H8Y5|TRX1_HHV8P	136	tr|A0A087WXV2|A0A087WXV2_HUMAN Protocadherin-17 (Fragment) OS=Homo sapiens OX=9606 GN=PCDH17 PE=1 SV=1	446	AKPGALAEASSQ
RSVCCVAARKCL	sp|F5HG20|UL49_HHV8P	235	tr|Q5T321|Q5T321_HUMAN Neurobeachin OS=Homo sapiens OX=9606 GN=NBEA PE=1 SV=1	1470	RLVCCVAVRNCL
RSVCCVAARKCL	sp|F5HG20|UL49_HHV8P	235	sp|Q8NFP9|NBEA_HUMAN Neurobeachin OS=Homo sapiens OX=9606 GN=NBEA PE=1 SV=3	1473	RLVCCVAVRNCL
RSVCCVAARKCL	sp|F5HG20|UL49_HHV8P	235	tr|F5GXV7|F5GXV7_HUMAN Neurobeachin OS=Homo sapiens OX=9606 GN=NBEA PE=1 SV=2	1474	RLVCCVAVRNCL
RSVCCVAARKCL	sp|F5HG20|UL49_HHV8P	235	tr|A0A0D9SF28|A0A0D9SF28_HUMAN Neurobeachin OS=Homo sapiens OX=9606 GN=NBEA PE=1 SV=1	1473	RLVCCVAVRNCL
PVSLDSDDDLAV	sp|F5HDE4|ORF45_HHV8P	372	tr|F8WC04|F8WC04_HUMAN TOX high mobility group box family member 4 OS=Homo sapiens OX=9606 GN=TOX4 PE=1 SV=1	41	PISLDSDPSLAV
PVSLDSDDDLAV	sp|F5HDE4|ORF45_HHV8P	372	tr|A0A669KA85|A0A669KA85_HUMAN TOX high mobility group box family member 4 (Fragment) OS=Homo sapiens OX=9606 GN=TOX4 PE=1 SV=1	41	PISLDSDPSLAV
PVSLDSDDDLAV	sp|F5HDE4|ORF45_HHV8P	372	tr|A0A669KB71|A0A669KB71_HUMAN TOX high mobility group box family member 4 OS=Homo sapiens OX=9606 GN=TOX4 PE=1 SV=1	41	PISLDSDPSLAV
PVSLDSDDDLAV	sp|F5HDE4|ORF45_HHV8P	372	tr|C9JNL1|C9JNL1_HUMAN TOX high mobility group box family member 4 (Fragment) OS=Homo sapiens OX=9606 GN=TOX4 PE=1 SV=1	70	PISLDSDPSLAV
PVSLDSDDDLAV	sp|F5HDE4|ORF45_HHV8P	372	tr|C9J919|C9J919_HUMAN TOX high mobility group box family member 4 (Fragment) OS=Homo sapiens OX=9606 GN=TOX4 PE=1 SV=1	18	PISLDSDPSLAV
PVSLDSDDDLAV	sp|F5HDE4|ORF45_HHV8P	372	sp|O94842|TOX4_HUMAN TOX high mobility group box family member 4 OS=Homo sapiens OX=9606 GN=TOX4 PE=1 SV=1	41	PISLDSDPSLAV
LTTAGKSAPRAN	sp|F5HFD2|ORF24_HHV8P	667	tr|E9PRU1|E9PRU1_HUMAN EGF-containing fibulin-like extracellular matrix protein 2 OS=Homo sapiens OX=9606 GN=EFEMP2 PE=1 SV=1	396	LTGAGSSAPRAS
LTTAGKSAPRAN	sp|F5HFD2|ORF24_HHV8P	667	tr|H0YET5|H0YET5_HUMAN EGF-containing fibulin-like extracellular matrix protein 2 (Fragment) OS=Homo sapiens OX=9606 GN=EFEMP2 PE=1 SV=1	142	LTGAGSSAPRAS
TGLGDKVLEEVQ	sp|Q2HRC7|VIL6_HHV8P	86	sp|Q58EX2|SDK2_HUMAN Protein sidekick-2 OS=Homo sapiens OX=9606 GN=SDK2 PE=1 SV=3	1264	TGLGKYVLYEVQ
TGLGDKVLEEVQ	sp|Q2HRC7|VIL6_HHV8P	86	tr|H7C2P2|H7C2P2_HUMAN Protein sidekick-2 (Fragment) OS=Homo sapiens OX=9606 GN=SDK2 PE=1 SV=1	440	TGLGKYVLYEVQ
VDPAGTVNSLPP	sp|Q9QR70|ORF75_HHV8P	949	sp|O95835|LATS1_HUMAN Serine/threonine-protein kinase LATS1 OS=Homo sapiens OX=9606 GN=LATS1 PE=1 SV=1	362	VVPAGTVNRQPP
SVLRTTFSYAFV	sp|Q2HRD0|DPOL_HHV8P	234	tr|E5RI39|E5RI39_HUMAN Cyclin-C (Fragment) OS=Homo sapiens OX=9606 GN=CCNC PE=1 SV=1	161	SVLKTRFSYAFP
SVLRTTFSYAFV	sp|Q2HRD0|DPOL_HHV8P	234	tr|J3KP90|J3KP90_HUMAN Cyclin-C OS=Homo sapiens OX=9606 GN=CCNC PE=1 SV=1	114	SVLKTRFSYAFP
SVLRTTFSYAFV	sp|Q2HRD0|DPOL_HHV8P	234	tr|E5RFX8|E5RFX8_HUMAN Cyclin-C (Fragment) OS=Homo sapiens OX=9606 GN=CCNC PE=1 SV=1	29	SVLKTRFSYAFP
SVLRTTFSYAFV	sp|Q2HRD0|DPOL_HHV8P	234	tr|H0YBQ5|H0YBQ5_HUMAN Cyclin-C (Fragment) OS=Homo sapiens OX=9606 GN=CCNC PE=1 SV=1	60	SVLKTRFSYAFP
SVLRTTFSYAFV	sp|Q2HRD0|DPOL_HHV8P	234	tr|E5RFK5|E5RFK5_HUMAN Cyclin-C OS=Homo sapiens OX=9606 GN=CCNC PE=1 SV=1	114	SVLKTRFSYAFP
SVLRTTFSYAFV	sp|Q2HRD0|DPOL_HHV8P	234	sp|P24863|CCNC_HUMAN Cyclin-C OS=Homo sapiens OX=9606 GN=CCNC PE=1 SV=2	114	SVLKTRFSYAFP
SVLRTTFSYAFV	sp|Q2HRD0|DPOL_HHV8P	234	tr|G5E954|G5E954_HUMAN Cyclin-C OS=Homo sapiens OX=9606 GN=CCNC PE=1 SV=1	114	SVLKTRFSYAFP
LLLLQLLQMLLG	sp|Q2HR64|LTP_HHV8P	1228	sp|Q8WY22|BRI3B_HUMAN BRI3-binding protein OS=Homo sapiens OX=9606 GN=BRI3BP PE=1 SV=1	15	LLLLLLLLLLLG
LLLLQLLQMLLG	sp|Q2HR64|LTP_HHV8P	1228	tr|A0A5F9ZHY7|A0A5F9ZHY7_HUMAN BRI3-binding protein OS=Homo sapiens OX=9606 GN=BRI3BP PE=1 SV=1	15	LLLLLLLLLLLG
LLLLQLLQMLLG	sp|Q2HR64|LTP_HHV8P	1228	sp|A6NCL2|LRCL1_HUMAN Leucine-rich colipase-like protein 1 OS=Homo sapiens OX=9606 GN=LRCOL1 PE=2 SV=3	8	LLLLLLLLLLLG
LLLLQLLQMLLG	sp|Q2HR64|LTP_HHV8P	1228	tr|A0A087WZ94|A0A087WZ94_HUMAN Leucine-rich colipase-like protein 1 OS=Homo sapiens OX=9606 GN=LRCOL1 PE=1 SV=1	8	LLLLLLLLLLLG
LLLLQLLQMLLG	sp|Q2HR64|LTP_HHV8P	1228	tr|A0A087WT69|A0A087WT69_HUMAN Leucine-rich colipase-like protein 1 OS=Homo sapiens OX=9606 GN=LRCOL1 PE=4 SV=1	8	LLLLLLLLLLLG
LLLLQLLQMLLG	sp|Q2HR64|LTP_HHV8P	1228	tr|A0A087WYD7|A0A087WYD7_HUMAN Leucine-rich colipase-like protein 1 OS=Homo sapiens OX=9606 GN=LRCOL1 PE=4 SV=1	8	LLLLLLLLLLLG
LLLLQLLQMLLG	sp|Q2HR64|LTP_HHV8P	1228	sp|Q86UD1|OAF_HUMAN Out at first protein homolog OS=Homo sapiens OX=9606 GN=OAF PE=2 SV=1	14	LLLLPLLAPLLG
KETLFQSSAVLL	sp|F5HIM6|ORF23_HHV8P	32	sp|Q9BRK3|MXRA8_HUMAN Matrix remodeling-associated protein 8 OS=Homo sapiens OX=9606 GN=MXRA8 PE=1 SV=1	11	KLVLLQSSAVLL
LDRQSDEQQQEQ	sp|Q9QR71|LANA1_HHV8P	408	sp|Q9Y2J4|AMOL2_HUMAN Angiomotin-like protein 2 OS=Homo sapiens OX=9606 GN=AMOTL2 PE=1 SV=3	423	LLAQSYEQQQEQ
QEQQPQQQEKQQ	sp|Q9QR71|LANA1_HHV8P	45	tr|E7ETG2|E7ETG2_HUMAN Endoribonuclease OS=Homo sapiens OX=9606 GN=ERN2 PE=1 SV=1	400	LEQQPQVVEKQQ
QEQQPQQQEKQQ	sp|Q9QR71|LANA1_HHV8P	45	sp|Q8NDV7|TNR6A_HUMAN Trinucleotide repeat-containing gene 6A protein OS=Homo sapiens OX=9606 GN=TNRC6A PE=1 SV=2	100	QQQQPQQQQPQQ
QEQQPQQQEKQQ	sp|Q9QR71|LANA1_HHV8P	45	sp|Q86UP3|ZFHX4_HUMAN Zinc finger homeobox protein 4 OS=Homo sapiens OX=9606 GN=ZFHX4 PE=1 SV=1	3282	QKQQKQQQEQQQ
QEQQPQQQEKQQ	sp|Q9QR71|LANA1_HHV8P	45	tr|E7EVZ1|E7EVZ1_HUMAN Zinc finger homeobox protein 4 OS=Homo sapiens OX=9606 GN=ZFHX4 PE=1 SV=1	3305	QKQQKQQQEQQQ
QEQQPQQQEKQQ	sp|Q9QR71|LANA1_HHV8P	45	sp|O76074|PDE5A_HUMAN cGMP-specific 3',5'-cyclic phosphodiesterase OS=Homo sapiens OX=9606 GN=PDE5A PE=1 SV=2	13	QQQQPQQQKQQQ
QEQQPQQQEKQQ	sp|Q9QR71|LANA1_HHV8P	45	tr|A0A0A0MSU2|A0A0A0MSU2_HUMAN Mitotic deacetylase-associated SANT domain protein (Fragment) OS=Homo sapiens OX=9606 GN=MIDEAS PE=1 SV=6	250	QQQQPQQQQQQQ
QEQQPQQQEKQQ	sp|Q9QR71|LANA1_HHV8P	45	sp|Q6PJG2|MDEAS_HUMAN Mitotic deacetylase-associated SANT domain protein OS=Homo sapiens OX=9606 GN=MIDEAS PE=1 SV=2	250	QQQQPQQQQQQQ
QEQQPQQQEKQQ	sp|Q9QR71|LANA1_HHV8P	45	tr|A0A1C7CYX1|A0A1C7CYX1_HUMAN Mitotic deacetylase-associated SANT domain protein OS=Homo sapiens OX=9606 GN=MIDEAS PE=1 SV=1	250	QQQQPQQQQQQQ
QEQQPQQQEKQQ	sp|Q9QR71|LANA1_HHV8P	45	tr|H7C1L3|H7C1L3_HUMAN Mitotic deacetylase-associated SANT domain protein (Fragment) OS=Homo sapiens OX=9606 GN=MIDEAS PE=1 SV=1	72	QQQQPQQQQQQQ
QEQQPQQQEKQQ	sp|Q9QR71|LANA1_HHV8P	45	sp|O94916|NFAT5_HUMAN Nuclear factor of activated T-cells 5 OS=Homo sapiens OX=9606 GN=NFAT5 PE=1 SV=1	1248	QEQQQQQQQQQQ
SNLVLLGVEYHT	sp|Q2HRA7|MCP_HHV8P	292	tr|G3XAG5|G3XAG5_HUMAN Chloride channel protein OS=Homo sapiens OX=9606 GN=CLCN4 PE=1 SV=1	314	SRLVLFYVEYHT
SNLVLLGVEYHT	sp|Q2HRA7|MCP_HHV8P	292	tr|E9PE15|E9PE15_HUMAN Chloride channel protein (Fragment) OS=Homo sapiens OX=9606 GN=CLCN3 PE=1 SV=1	345	SRLVLFYVEYHT
SNLVLLGVEYHT	sp|Q2HRA7|MCP_HHV8P	292	tr|A0A0A0MTB7|A0A0A0MTB7_HUMAN Chloride channel protein OS=Homo sapiens OX=9606 GN=CLCN3 PE=1 SV=1	355	SRLVLFYVEYHT
SNLVLLGVEYHT	sp|Q2HRA7|MCP_HHV8P	292	sp|P51790|CLCN3_HUMAN H(+)/Cl(-) exchange transporter 3 OS=Homo sapiens OX=9606 GN=CLCN3 PE=1 SV=2	372	SRLVLFYVEYHT
SNLVLLGVEYHT	sp|Q2HRA7|MCP_HHV8P	292	tr|A0A087WU31|A0A087WU31_HUMAN Chloride channel protein OS=Homo sapiens OX=9606 GN=CLCN3 PE=1 SV=1	345	SRLVLFYVEYHT
SNLVLLGVEYHT	sp|Q2HRA7|MCP_HHV8P	292	sp|P51793|CLCN4_HUMAN H(+)/Cl(-) exchange transporter 4 OS=Homo sapiens OX=9606 GN=CLCN4 PE=1 SV=2	314	SRLVLFYVEYHT
SNLVLLGVEYHT	sp|Q2HRA7|MCP_HHV8P	292	tr|A0A6Q8PG54|A0A6Q8PG54_HUMAN Chloride channel protein OS=Homo sapiens OX=9606 GN=CLCN4 PE=1 SV=1	314	SRLVLFYVEYHT
TAPPLQELGSLS	sp|Q2HR64|LTP_HHV8P	54	tr|J3QQM9|J3QQM9_HUMAN Secernin-2 (Fragment) OS=Homo sapiens OX=9606 GN=SCRN2 PE=1 SV=1	246	WAPPLWELGSLF
TAPPLQELGSLS	sp|Q2HR64|LTP_HHV8P	54	tr|J3QL71|J3QL71_HUMAN Secernin-2 OS=Homo sapiens OX=9606 GN=SCRN2 PE=1 SV=1	410	WAPPLWELGSLF
TAPPLQELGSLS	sp|Q2HR64|LTP_HHV8P	54	sp|Q96FV2|SCRN2_HUMAN Secernin-2 OS=Homo sapiens OX=9606 GN=SCRN2 PE=1 SV=3	402	WAPPLWELGSLF
APEGGCLPVPAA	sp|Q2HRD0|DPOL_HHV8P	738	sp|O60391|NMD3B_HUMAN Glutamate receptor ionotropic, NMDA 3B OS=Homo sapiens OX=9606 GN=GRIN3B PE=2 SV=2	224	APVGGEAPVPAA
SSKLGKDISSQV	sp|Q2HRB6|SCAF_HHV8P	183	sp|Q86YP4|P66A_HUMAN Transcriptional repressor p66-alpha OS=Homo sapiens OX=9606 GN=GATAD2A PE=1 SV=1	231	SSKLGPQASSQV
ALKARTVAKDRA	sp|Q2HRC8|ORF11_HHV8P	332	tr|A0A0A0MRY1|A0A0A0MRY1_HUMAN Structural maintenance of chromosomes protein 6 (Fragment) OS=Homo sapiens OX=9606 GN=SMC6 PE=1 SV=6	348	ALKADVVAKKRA
ALKARTVAKDRA	sp|Q2HRC8|ORF11_HHV8P	332	tr|C9JMN1|C9JMN1_HUMAN Structural maintenance of chromosomes protein 6 (Fragment) OS=Homo sapiens OX=9606 GN=SMC6 PE=1 SV=1	374	ALKADVVAKKRA
ALKARTVAKDRA	sp|Q2HRC8|ORF11_HHV8P	332	sp|Q96SB8|SMC6_HUMAN Structural maintenance of chromosomes protein 6 OS=Homo sapiens OX=9606 GN=SMC6 PE=1 SV=2	348	ALKADVVAKKRA
RTEPEPPKKQPE	sp|Q9QR71|LANA1_HHV8P	477	sp|Q5T1R4|ZEP3_HUMAN Transcription factor HIVEP3 OS=Homo sapiens OX=9606 GN=HIVEP3 PE=2 SV=1	868	DTEPEPPPKEPE
HPLDPKGQSAGL	sp|Q2HRA7|MCP_HHV8P	134	tr|A0A087WUJ1|A0A087WUJ1_HUMAN Lck-interacting transmembrane adapter 1 (Fragment) OS=Homo sapiens OX=9606 GN=LIME1 PE=1 SV=6	208	DPLDPKGQGAIL
HPLDPKGQSAGL	sp|Q2HRA7|MCP_HHV8P	134	sp|Q9H400|LIME1_HUMAN Lck-interacting transmembrane adapter 1 OS=Homo sapiens OX=9606 GN=LIME1 PE=1 SV=1	216	DPLDPKGQGAIL
ASSSPNLPTYDT	sp|F5HB81|GB_HHV8P	643	sp|Q9NRR6|INP5E_HUMAN Phosphatidylinositol polyphosphate 5-phosphatase type IV OS=Homo sapiens OX=9606 GN=INPP5E PE=1 SV=2	165	ASSSPNLPHRDA
LKARTVAKDRAR	sp|Q2HRC8|ORF11_HHV8P	333	tr|A0A494BZR8|A0A494BZR8_HUMAN Eukaryotic translation initiation factor 2-alpha kinase 3 (Fragment) OS=Homo sapiens OX=9606 GN=EIF2AK3 PE=1 SV=1	23	LAARTVAAGRAR
LKARTVAKDRAR	sp|Q2HRC8|ORF11_HHV8P	333	sp|Q9NZJ5|E2AK3_HUMAN Eukaryotic translation initiation factor 2-alpha kinase 3 OS=Homo sapiens OX=9606 GN=EIF2AK3 PE=1 SV=3	23	LAARTVAAGRAR
LKARTVAKDRAR	sp|Q2HRC8|ORF11_HHV8P	333	tr|A0A494C186|A0A494C186_HUMAN Eukaryotic translation initiation factor 2-alpha kinase 3 OS=Homo sapiens OX=9606 GN=EIF2AK3 PE=4 SV=1	23	LAARTVAAGRAR
EDLAFFREQPTA	sp|F5HIN0|PRIM_HHV8P	184	tr|J9PBQ5|J9PBQ5_HUMAN Meckel syndrome type 1 protein OS=Homo sapiens OX=9606 GN=MKS1 PE=1 SV=1	52	IDLATFRPQPTA
EDLAFFREQPTA	sp|F5HIN0|PRIM_HHV8P	184	tr|J3KSC6|J3KSC6_HUMAN Meckel syndrome type 1 protein OS=Homo sapiens OX=9606 GN=MKS1 PE=1 SV=2	52	IDLATFRPQPTA
EDLAFFREQPTA	sp|F5HIN0|PRIM_HHV8P	184	tr|H0Y2S2|H0Y2S2_HUMAN Meckel syndrome type 1 protein OS=Homo sapiens OX=9606 GN=MKS1 PE=1 SV=2	52	IDLATFRPQPTA
EDLAFFREQPTA	sp|F5HIN0|PRIM_HHV8P	184	sp|Q9NXB0|MKS1_HUMAN Meckel syndrome type 1 protein OS=Homo sapiens OX=9606 GN=MKS1 PE=1 SV=2	52	IDLATFRPQPTA
EDLAFFREQPTA	sp|F5HIN0|PRIM_HHV8P	184	tr|A0A6Q8PGJ4|A0A6Q8PGJ4_HUMAN Meckel syndrome type 1 protein OS=Homo sapiens OX=9606 GN=MKS1 PE=1 SV=1	52	IDLATFRPQPTA
EDLAFFREQPTA	sp|F5HIN0|PRIM_HHV8P	184	tr|A0A6Q8PG98|A0A6Q8PG98_HUMAN Meckel syndrome type 1 protein OS=Homo sapiens OX=9606 GN=MKS1 PE=1 SV=1	52	IDLATFRPQPTA
EDLAFFREQPTA	sp|F5HIN0|PRIM_HHV8P	184	tr|J3KRR3|J3KRR3_HUMAN Meckel syndrome type 1 protein OS=Homo sapiens OX=9606 GN=MKS1 PE=1 SV=1	52	IDLATFRPQPTA
AQGQQEELQERE	sp|Q9QR71|LANA1_HHV8P	195	sp|Q6DT37|MRCKG_HUMAN Serine/threonine-protein kinase MRCK gamma OS=Homo sapiens OX=9606 GN=CDC42BPG PE=1 SV=2	515	AQGQQEELLQRL
APLLLTMVLFLL	sp|Q9QR70|ORF75_HHV8P	1066	sp|Q9Y256|FACE2_HUMAN CAAX prenyl protease 2 OS=Homo sapiens OX=9606 GN=RCE1 PE=1 SV=1	118	LPLLLTMILFLG
APLLLTMVLFLL	sp|Q9QR70|ORF75_HHV8P	1066	tr|E9PI08|E9PI08_HUMAN Farnesylated proteins-converting enzyme 2 OS=Homo sapiens OX=9606 GN=RCE1 PE=1 SV=1	118	LPLLLTMILFLG
IRAANRLCTVSL	sp|Q2HR67|RIR1_HHV8P	755	tr|U3KQ81|U3KQ81_HUMAN Pituitary homeobox 2 OS=Homo sapiens OX=9606 GN=PITX2 PE=1 SV=1	253	PRAANRLQPVSL
SADSSTASGTRA	sp|F5HDE4|ORF45_HHV8P	326	sp|P20930|FILA_HUMAN Filaggrin OS=Homo sapiens OX=9606 GN=FLG PE=1 SV=3	673	SADSSRKSGTRH
SADSSTASGTRA	sp|F5HDE4|ORF45_HHV8P	326	sp|P20930|FILA_HUMAN Filaggrin OS=Homo sapiens OX=9606 GN=FLG PE=1 SV=3	349	SADSSRQSGTRH
SADSSTASGTRA	sp|F5HDE4|ORF45_HHV8P	326	sp|P20930|FILA_HUMAN Filaggrin OS=Homo sapiens OX=9606 GN=FLG PE=1 SV=3	1970	SADSSRQSGTRH
SADSSTASGTRA	sp|F5HDE4|ORF45_HHV8P	326	sp|P20930|FILA_HUMAN Filaggrin OS=Homo sapiens OX=9606 GN=FLG PE=1 SV=3	2619	SADSSRQSGTRH
SADSSTASGTRA	sp|F5HDE4|ORF45_HHV8P	326	sp|P20930|FILA_HUMAN Filaggrin OS=Homo sapiens OX=9606 GN=FLG PE=1 SV=3	2943	SADSSRQSGTRH
SADSSTASGTRA	sp|F5HDE4|ORF45_HHV8P	326	sp|P20930|FILA_HUMAN Filaggrin OS=Homo sapiens OX=9606 GN=FLG PE=1 SV=3	1688	SADSSTDSGTGR
EEQPEEEGEQPR	sp|Q9QR71|LANA1_HHV8P	450	tr|C9JCA5|C9JCA5_HUMAN Troponin T, fast skeletal muscle (Fragment) OS=Homo sapiens OX=9606 GN=TNNT3 PE=1 SV=1	10	EEQYEEEEEKPR
EEQPEEEGEQPR	sp|Q9QR71|LANA1_HHV8P	450	sp|P0C7V8|DC8L2_HUMAN DDB1- and CUL4-associated factor 8-like protein 2 OS=Homo sapiens OX=9606 GN=DCAF8L2 PE=2 SV=2	139	EEEEEEEEEQPR
EEQPEEEGEQPR	sp|Q9QR71|LANA1_HHV8P	450	tr|V9GYQ9|V9GYQ9_HUMAN DDB1- and CUL4-associated factor 8 (Fragment) OS=Homo sapiens OX=9606 GN=DCAF8 PE=1 SV=1	79	EEEEEEEEEQPR
EEQPEEEGEQPR	sp|Q9QR71|LANA1_HHV8P	450	tr|Q5TAQ8|Q5TAQ8_HUMAN DDB1- and CUL4-associated factor 8 (Fragment) OS=Homo sapiens OX=9606 GN=DCAF8 PE=1 SV=1	104	EEEEEEEEEQPR
EEQPEEEGEQPR	sp|Q9QR71|LANA1_HHV8P	450	tr|V9GY54|V9GY54_HUMAN DDB1- and CUL4-associated factor 8 OS=Homo sapiens OX=9606 GN=DCAF8 PE=1 SV=1	104	EEEEEEEEEQPR
EEQPEEEGEQPR	sp|Q9QR71|LANA1_HHV8P	450	sp|Q5TAQ9|DCAF8_HUMAN DDB1- and CUL4-associated factor 8 OS=Homo sapiens OX=9606 GN=DCAF8 PE=1 SV=1	104	EEEEEEEEEQPR
SHTPPIISSGPG	sp|Q2HRB6|SCAF_HHV8P	147	sp|P55317|FOXA1_HUMAN Hepatocyte nuclear factor 3-alpha OS=Homo sapiens OX=9606 GN=FOXA1 PE=1 SV=2	354	SSTAPPISSGPG
ALHATGDIRVAV	sp|F5HB62|KITH_HHV8P	213	tr|J3KS22|J3KS22_HUMAN L-xylulose reductase (Fragment) OS=Homo sapiens OX=9606 GN=DCXR PE=1 SV=8	24	ALHATGARVVAV
ALHATGDIRVAV	sp|F5HB62|KITH_HHV8P	213	sp|Q7Z4W1|DCXR_HUMAN L-xylulose reductase OS=Homo sapiens OX=9606 GN=DCXR PE=1 SV=2	26	ALHATGARVVAV
