query	query_seqname	query_start	target_seqname	target_start	target
LAVGRNNSMVFS	sp|P0DTD1|R1AB_SARS2	212	tr|T2HUW8|T2HUW8_HUMAN Carcinoembryonic antigen-related cell adhesion molecule 5 OS=Homo sapiens OX=9606 GN=CEACAM5 PE=1 SV=1	304	LATGRNNSIVKS
LAVGRNNSMVFS	sp|P0DTD1|R1AB_SARS2	212	tr|A0A024R0K5|A0A024R0K5_HUMAN Carcinoembryonic antigen-related cell adhesion molecule 5 OS=Homo sapiens OX=9606 GN=CEACAM5 PE=1 SV=1	660	LATGRNNSIVKS
LAVGRNNSMVFS	sp|P0DTD1|R1AB_SARS2	212	sp|P06731|CEAM5_HUMAN Carcinoembryonic antigen-related cell adhesion molecule 5 OS=Homo sapiens OX=9606 GN=CEACAM5 PE=1 SV=3	660	LATGRNNSIVKS
LAVGRNNSMVFS	sp|P0DTD1|R1AB_SARS2	212	tr|A0A087WYX0|A0A087WYX0_HUMAN Carcinoembryonic antigen-related cell adhesion molecule 5 OS=Homo sapiens OX=9606 GN=CEACAM5 PE=1 SV=1	482	LATGRNNSIVKS
LASEFPKDRVLF	sp|P0DTC1|R1A_SARS2	1007	sp|Q9HCK8|CHD8_HUMAN Chromodomain-helicase-DNA-binding protein 8 OS=Homo sapiens OX=9606 GN=CHD8 PE=1 SV=5	2150	RASEWPKDRVLI
LASEFPKDRVLF	sp|P0DTC1|R1A_SARS2	1007	tr|H0YJG4|H0YJG4_HUMAN Chromodomain-helicase-DNA-binding protein 8 (Fragment) OS=Homo sapiens OX=9606 GN=CHD8 PE=1 SV=2	1384	RASEWPKDRVLI
LASEFPKDRVLF	sp|P0DTC1|R1A_SARS2	1007	tr|H0YJA4|H0YJA4_HUMAN Chromodomain-helicase-DNA-binding protein 8 (Fragment) OS=Homo sapiens OX=9606 GN=CHD8 PE=1 SV=2	1	XASEWPKDRVLI
NSVGKSLYVSET	sp|P0DTD1|R1AB_SARS2	1374	sp|P01024|CO3_HUMAN Complement C3 OS=Homo sapiens OX=9606 GN=C3 PE=1 SV=2	318	DLVGKSLYVSAT
KTSGLKKTETKS	sp|P0DTD1|R1AB_SARS2	6638	sp|Q86VY9|T200A_HUMAN Transmembrane protein 200A OS=Homo sapiens OX=9606 GN=TMEM200A PE=1 SV=1	268	KTSGSKKCETKS
EEFVKVLSSELD	sp|P0DTC1|R1A_SARS2	1195	sp|P46939|UTRO_HUMAN Utrophin OS=Homo sapiens OX=9606 GN=UTRN PE=1 SV=2	1687	EEIVKRLVSELD
GDTVPVNLVAVT	sp|P0DTC1|R1A_SARS2	47	tr|A0A0A0MSK6|A0A0A0MSK6_HUMAN Rho GTPase-activating protein 5 OS=Homo sapiens OX=9606 GN=ARHGAP5 PE=1 SV=1	874	QDTIPVQLVAVT
GDTVPVNLVAVT	sp|P0DTC1|R1A_SARS2	47	sp|Q13017|RHG05_HUMAN Rho GTPase-activating protein 5 OS=Homo sapiens OX=9606 GN=ARHGAP5 PE=1 SV=2	874	QDTIPVQLVAVT
SKTKKGIGDLSA	sp|P0DTD1|R1AB_SARS2	2280	sp|Q14684|RRP1B_HUMAN Ribosomal RNA processing protein 1 homolog B OS=Homo sapiens OX=9606 GN=RRP1B PE=1 SV=3	235	QKTKVGDGDLSA
QSDAELNLFNVL	sp|P0DTD1|R1AB_SARS2	4239	sp|Q96AV8|E2F7_HUMAN Transcription factor E2F7 OS=Homo sapiens OX=9606 GN=E2F7 PE=1 SV=3	710	QSPAGLNGFNVL
IRIAAPGTPAAA	sp|P0DTD1|R1AB_SARS2	3461	tr|H0Y8S7|H0Y8S7_HUMAN RNA-binding protein 24 (Fragment) OS=Homo sapiens OX=9606 GN=RBM24 PE=1 SV=1	166	ITAAAPGTAAAA
IRIAAPGTPAAA	sp|P0DTD1|R1AB_SARS2	3461	sp|Q9BX46|RBM24_HUMAN RNA-binding protein 24 OS=Homo sapiens OX=9606 GN=RBM24 PE=1 SV=1	201	ITAAAPGTAAAA
IRIAAPGTPAAA	sp|P0DTD1|R1AB_SARS2	3461	sp|Q8TDN4|CABL1_HUMAN CDK5 and ABL1 enzyme substrate 1 OS=Homo sapiens OX=9606 GN=CABLES1 PE=1 SV=2	120	IALAAPGTPAAG
NQLASEFPKDRV	sp|P0DTC1|R1A_SARS2	1005	sp|Q9HCK8|CHD8_HUMAN Chromodomain-helicase-DNA-binding protein 8 OS=Homo sapiens OX=9606 GN=CHD8 PE=1 SV=5	2148	RQRASEWPKDRV
NQLASEFPKDRV	sp|P0DTC1|R1A_SARS2	1005	tr|H0YJG4|H0YJG4_HUMAN Chromodomain-helicase-DNA-binding protein 8 (Fragment) OS=Homo sapiens OX=9606 GN=CHD8 PE=1 SV=2	1382	RQRASEWPKDRV
SAAHGPAGDSAA	sp|P0DTC1|R1A_SARS2	3574	sp|Q8IWQ3|BRSK2_HUMAN Serine/threonine-protein kinase BRSK2 OS=Homo sapiens OX=9606 GN=BRSK2 PE=1 SV=3	695	RSAHGPLGDSAA
IYTCHLVSLTTR	sp|P0DTC2|SPIKE_SARS2	930	sp|Q5TIE3|VW5B1_HUMAN von Willebrand factor A domain-containing protein 5B1 OS=Homo sapiens OX=9606 GN=VWA5B1 PE=1 SV=2	1084	PFTCHRVSLTTR
TDKSPVLDSFVR	sp|P0DTC1|R1A_SARS2	1955	sp|P51530|DNA2_HUMAN DNA replication ATP-dependent helicase/nuclease DNA2 OS=Homo sapiens OX=9606 GN=DNA2 PE=1 SV=3	972	RDKSIVLVSFVR
TDKSPVLDSFVR	sp|P0DTC1|R1A_SARS2	1955	tr|H0Y455|H0Y455_HUMAN DNA replication ATP-dependent helicase/nuclease (Fragment) OS=Homo sapiens OX=9606 GN=DNA2 PE=1 SV=1	294	RDKSIVLVSFVR
TDKSPVLDSFVR	sp|P0DTC1|R1A_SARS2	1955	tr|F8VR31|F8VR31_HUMAN DNA replication ATP-dependent helicase/nuclease OS=Homo sapiens OX=9606 GN=DNA2 PE=1 SV=3	734	RDKSIVLVSFVR
DLVDAQDTLENH	sp|P0DTC1|R1A_SARS2	1835	sp|O94804|STK10_HUMAN Serine/threonine-protein kinase 10 OS=Homo sapiens OX=9606 GN=STK10 PE=1 SV=1	329	DAVDAASTLENH
SIYTCHLVSLTT	sp|P0DTC2|SPIKE_SARS2	929	sp|Q5TIE3|VW5B1_HUMAN von Willebrand factor A domain-containing protein 5B1 OS=Homo sapiens OX=9606 GN=VWA5B1 PE=1 SV=2	1083	SPFTCHRVSLTT
SPRLLSGSVPLL	sp|P0DTD1|R1AB_SARS2	129	tr|K7EKV2|K7EKV2_HUMAN Telomerase-binding protein EST1A (Fragment) OS=Homo sapiens OX=9606 GN=SMG6 PE=1 SV=8	116	EDRLLSGFVPLL
SPRLLSGSVPLL	sp|P0DTD1|R1AB_SARS2	129	tr|I3L390|I3L390_HUMAN Telomerase-binding protein EST1A (Fragment) OS=Homo sapiens OX=9606 GN=SMG6 PE=1 SV=2	59	EDRLLSGFVPLL
SPRLLSGSVPLL	sp|P0DTD1|R1AB_SARS2	129	sp|Q86US8|EST1A_HUMAN Telomerase-binding protein EST1A OS=Homo sapiens OX=9606 GN=SMG6 PE=1 SV=2	1093	EDRLLSGFVPLL
SDLDMKPVLEKN	sp|P0DTC1|R1A_SARS2	641	sp|Q9P2H0|CE126_HUMAN Centrosomal protein of 126 kDa OS=Homo sapiens OX=9606 GN=CEP126 PE=1 SV=3	41	SYLDMKIHLEKN
SDLDMKPVLEKN	sp|P0DTC1|R1A_SARS2	641	tr|A0A590UJH0|A0A590UJH0_HUMAN Centrosomal protein of 126 kDa OS=Homo sapiens OX=9606 GN=CEP126 PE=1 SV=1	41	SYLDMKIHLEKN
SDLDMKPVLEKN	sp|P0DTC1|R1A_SARS2	641	tr|A0A590UK33|A0A590UK33_HUMAN Centrosomal protein of 126 kDa OS=Homo sapiens OX=9606 GN=CEP126 PE=1 SV=1	41	SYLDMKIHLEKN
LLERTAVDGILY	sp|P0DTD2|ORF9B_SARS2	41	sp|Q9H1V8|S6A17_HUMAN Sodium-dependent neutral amino acid transporter SLC6A17 OS=Homo sapiens OX=9606 GN=SLC6A17 PE=1 SV=3	272	LLLRGAVDGILH
LNSCPPPTFTSV	sp|P0DTC2|SPIKE_SARS2	833	sp|Q92575|UBXN4_HUMAN UBX domain-containing protein 4 OS=Homo sapiens OX=9606 GN=UBXN4 PE=1 SV=2	433	LFSNPPPTQTSV
ATVNHLVHLAAA	sp|P0DTC2|SPIKE_SARS2	1081	sp|Q6NSW5|DE10B_HUMAN Putative DENN domain-containing protein 10 B OS=Homo sapiens OX=9606 GN=DENND10P1 PE=5 SV=1	340	ATENFLYHLAAA
ATVNHLVHLAAA	sp|P0DTC2|SPIKE_SARS2	1081	sp|Q8TCE6|DEN10_HUMAN DENN domain-containing protein 10 OS=Homo sapiens OX=9606 GN=DENND10 PE=1 SV=1	340	ATENFLYHLAAA
ATVNHLVHLAAA	sp|P0DTC2|SPIKE_SARS2	1081	tr|A0A3B3IRE4|A0A3B3IRE4_HUMAN DENN domain-containing protein 10 OS=Homo sapiens OX=9606 GN=DENND10 PE=1 SV=1	229	ATENFLYHLAAA
VGSTSSDTNEEL	sp|P0DTC1|R1A_SARS2	3362	tr|J3QRP6|J3QRP6_HUMAN Ezrin-radixin-moesin-binding phosphoprotein 50 (Fragment) OS=Homo sapiens OX=9606 GN=SLC9A3R1 PE=1 SV=1	167	VRSASSDTSEEL
VGSTSSDTNEEL	sp|P0DTC1|R1A_SARS2	3362	sp|O14745|NHRF1_HUMAN Na(+)/H(+) exchange regulatory cofactor NHE-RF1 OS=Homo sapiens OX=9606 GN=SLC9A3R1 PE=1 SV=4	286	VRSASSDTSEEL
PSVLKSQFELLD	sp|P0DTC1|R1A_SARS2	1936	sp|Q6NWY9|PR40B_HUMAN Pre-mRNA-processing factor 40 homolog B OS=Homo sapiens OX=9606 GN=PRPF40B PE=1 SV=1	123	PSVLKSKAELLL
PSVLKSQFELLD	sp|P0DTC1|R1A_SARS2	1936	tr|F8VU11|F8VU11_HUMAN PRP40 pre-mRNA processing factor 40 homolog B (Yeast), isoform CRA_a OS=Homo sapiens OX=9606 GN=PRPF40B PE=1 SV=2	145	PSVLKSKAELLL
GNNENKLEYHVG	sp|P0DTC1|R1A_SARS2	2294	sp|P04114|APOB_HUMAN Apolipoprotein B-100 OS=Homo sapiens OX=9606 GN=APOB PE=1 SV=2	3105	GNNENIMEAHVG
TQLQKLIKRDMT	sp|P0DTC2|SPIKE_SARS2	199	sp|Q96M86|DNHD1_HUMAN Dynein heavy chain domain-containing protein 1 OS=Homo sapiens OX=9606 GN=DNHD1 PE=2 SV=2	3425	TQLQKLKGRCMT
KTKKGIGDLSAF	sp|P0DTD1|R1AB_SARS2	2281	sp|Q14684|RRP1B_HUMAN Ribosomal RNA processing protein 1 homolog B OS=Homo sapiens OX=9606 GN=RRP1B PE=1 SV=3	236	KTKVGDGDLSAE
AAHGPAGDSAAD	sp|P0DTC1|R1A_SARS2	3575	sp|Q8IWQ3|BRSK2_HUMAN Serine/threonine-protein kinase BRSK2 OS=Homo sapiens OX=9606 GN=BRSK2 PE=1 SV=3	696	SAHGPLGDSAAA
YTCHLVSLTTRL	sp|P0DTC2|SPIKE_SARS2	931	sp|Q5TIE3|VW5B1_HUMAN von Willebrand factor A domain-containing protein 5B1 OS=Homo sapiens OX=9606 GN=VWA5B1 PE=1 SV=2	1085	FTCHRVSLTTRP
NAGCASSTTSLF	sp|P0DTD1|R1AB_SARS2	1839	sp|Q8WZ42|TITIN_HUMAN Titin OS=Homo sapiens OX=9606 GN=TTN PE=1 SV=4	6897	NAGQASCTTRLF
NAGCASSTTSLF	sp|P0DTD1|R1AB_SARS2	1839	tr|A0A0A0MTS7|A0A0A0MTS7_HUMAN Titin OS=Homo sapiens OX=9606 GN=TTN PE=1 SV=1	7214	NAGQASCTTRLF
YNPSQNSLALLR	sp|P0DTD1|R1AB_SARS2	5183	tr|A0A0G2JM37|A0A0G2JM37_HUMAN C6orf10 OS=Homo sapiens OX=9606 GN=TSBP1 PE=1 SV=1	79	YTPSTNSLALSR
YNPSQNSLALLR	sp|P0DTD1|R1AB_SARS2	5183	tr|A0A0G2JML4|A0A0G2JML4_HUMAN Testis-expressed basic protein 1 OS=Homo sapiens OX=9606 GN=TSBP1 PE=1 SV=1	72	YTPSTNSLALSR
YNPSQNSLALLR	sp|P0DTD1|R1AB_SARS2	5183	tr|A0A0G2JK66|A0A0G2JK66_HUMAN Testis-expressed basic protein 1 (Fragment) OS=Homo sapiens OX=9606 GN=TSBP1 PE=1 SV=1	79	YTPSTNSLALSR
YNPSQNSLALLR	sp|P0DTD1|R1AB_SARS2	5183	tr|A0A0G2JKA5|A0A0G2JKA5_HUMAN Testis-expressed basic protein 1 OS=Homo sapiens OX=9606 GN=TSBP1 PE=1 SV=1	79	YTPSTNSLALSR
YNPSQNSLALLR	sp|P0DTD1|R1AB_SARS2	5183	tr|A0A0G2JN18|A0A0G2JN18_HUMAN Testis-expressed basic protein 1 OS=Homo sapiens OX=9606 GN=TSBP1 PE=1 SV=1	78	YTPSTNSLALSR
YNPSQNSLALLR	sp|P0DTD1|R1AB_SARS2	5183	tr|E9PNQ4|E9PNQ4_HUMAN Testis-expressed basic protein 1 (Fragment) OS=Homo sapiens OX=9606 GN=TSBP1 PE=1 SV=1	83	YTPSTNSLALSR
YNPSQNSLALLR	sp|P0DTD1|R1AB_SARS2	5183	tr|A0A140T9Y3|A0A140T9Y3_HUMAN Testis-expressed basic protein 1 OS=Homo sapiens OX=9606 GN=TSBP1 PE=1 SV=1	79	YTPSTNSLALSR
YNPSQNSLALLR	sp|P0DTD1|R1AB_SARS2	5183	tr|A0A0G2JPA5|A0A0G2JPA5_HUMAN C6orf10 OS=Homo sapiens OX=9606 GN=TSBP1 PE=1 SV=1	79	YTPSTNSLALSR
YNPSQNSLALLR	sp|P0DTD1|R1AB_SARS2	5183	tr|A0A0G2JN90|A0A0G2JN90_HUMAN C6orf10 OS=Homo sapiens OX=9606 GN=TSBP1 PE=1 SV=1	79	YTPSTNSLALSR
YNPSQNSLALLR	sp|P0DTD1|R1AB_SARS2	5183	tr|A0A0G2JMH0|A0A0G2JMH0_HUMAN Testis-expressed basic protein 1 OS=Homo sapiens OX=9606 GN=TSBP1 PE=1 SV=1	72	YTPSTNSLALSR
YNPSQNSLALLR	sp|P0DTD1|R1AB_SARS2	5183	tr|A0A0G2JMA0|A0A0G2JMA0_HUMAN Testis-expressed basic protein 1 OS=Homo sapiens OX=9606 GN=TSBP1 PE=1 SV=1	72	YTPSTNSLALSR
YNPSQNSLALLR	sp|P0DTD1|R1AB_SARS2	5183	tr|A0A140T8X9|A0A140T8X9_HUMAN Testis-expressed basic protein 1 OS=Homo sapiens OX=9606 GN=TSBP1 PE=1 SV=1	79	YTPSTNSLALSR
YNPSQNSLALLR	sp|P0DTD1|R1AB_SARS2	5183	tr|A0A140T960|A0A140T960_HUMAN Testis-expressed basic protein 1 OS=Homo sapiens OX=9606 GN=TSBP1 PE=1 SV=1	79	YTPSTNSLALSR
YNPSQNSLALLR	sp|P0DTD1|R1AB_SARS2	5183	tr|C9J9T8|C9J9T8_HUMAN Testis-expressed basic protein 1 OS=Homo sapiens OX=9606 GN=TSBP1 PE=1 SV=2	72	YTPSTNSLALSR
YNPSQNSLALLR	sp|P0DTD1|R1AB_SARS2	5183	tr|E9PLW3|E9PLW3_HUMAN Testis-expressed basic protein 1 OS=Homo sapiens OX=9606 GN=TSBP1 PE=1 SV=1	72	YTPSTNSLALSR
YNPSQNSLALLR	sp|P0DTD1|R1AB_SARS2	5183	tr|A0A0G2JQ19|A0A0G2JQ19_HUMAN Testis-expressed basic protein 1 OS=Homo sapiens OX=9606 GN=TSBP1 PE=1 SV=1	78	YTPSTNSLALSR
YNPSQNSLALLR	sp|P0DTD1|R1AB_SARS2	5183	tr|A0A0G2JNW1|A0A0G2JNW1_HUMAN Testis-expressed basic protein 1 OS=Homo sapiens OX=9606 GN=TSBP1 PE=1 SV=1	78	YTPSTNSLALSR
YNPSQNSLALLR	sp|P0DTD1|R1AB_SARS2	5183	tr|A0A087WYQ2|A0A087WYQ2_HUMAN Testis-expressed basic protein 1 OS=Homo sapiens OX=9606 GN=TSBP1 PE=1 SV=1	78	YTPSTNSLALSR
SKVGTVTHYSVY	sp|P0DTC1|R1A_SARS2	746	tr|I3L222|I3L222_HUMAN Phospholipase D2 OS=Homo sapiens OX=9606 GN=PLD2 PE=1 SV=1	79	SKVGTCTLYSVR
SKVGTVTHYSVY	sp|P0DTC1|R1A_SARS2	746	tr|I3L1F3|I3L1F3_HUMAN Phospholipase D2 (Fragment) OS=Homo sapiens OX=9606 GN=PLD2 PE=1 SV=1	79	SKVGTCTLYSVR
SKVGTVTHYSVY	sp|P0DTC1|R1A_SARS2	746	sp|O14939|PLD2_HUMAN Phospholipase D2 OS=Homo sapiens OX=9606 GN=PLD2 PE=1 SV=2	79	SKVGTCTLYSVR
FCLAMLLLSLIL	sp|P0DTD8|NS7B_SARS2	31	sp|Q6UWJ1|TMCO3_HUMAN Transmembrane and coiled-coil domain-containing protein 3 OS=Homo sapiens OX=9606 GN=TMCO3 PE=1 SV=1	591	FLLAALVLSLIL
FCLAMLLLSLIL	sp|P0DTD8|NS7B_SARS2	31	tr|A0A087WVR2|A0A087WVR2_HUMAN Transmembrane and coiled-coil domain-containing protein 3 (Fragment) OS=Homo sapiens OX=9606 GN=TMCO3 PE=4 SV=1	1	FLLAALVLSLIL
ENLVELPASFEG	sp|P0DTC1|R1A_SARS2	3747	tr|C9JDY8|C9JDY8_HUMAN Amiloride-sensitive sodium channel subunit delta (Fragment) OS=Homo sapiens OX=9606 GN=SCNN1D PE=3 SV=1	83	EGLVELPASFRE
ENLVELPASFEG	sp|P0DTC1|R1A_SARS2	3747	sp|P51172|SCNND_HUMAN Amiloride-sensitive sodium channel subunit delta OS=Homo sapiens OX=9606 GN=SCNN1D PE=1 SV=3	211	EGLVELPASFRE
ELRNDERGLKSL	sp|P0DTD1|R1AB_SARS2	4793	sp|Q96RT7|GCP6_HUMAN Gamma-tubulin complex component 6 OS=Homo sapiens OX=9606 GN=TUBGCP6 PE=1 SV=3	737	ELRDRERRLKSL
ELRNDERGLKSL	sp|P0DTD1|R1AB_SARS2	4793	tr|E7EQL8|E7EQL8_HUMAN Gamma-tubulin complex component 6 OS=Homo sapiens OX=9606 GN=TUBGCP6 PE=1 SV=1	737	ELRDRERRLKSL
LLTKAAAEDKAG	sp|P0DTD1|R1AB_SARS2	6029	tr|K7EL71|K7EL71_HUMAN Vacuolar protein sorting-associated protein 4B OS=Homo sapiens OX=9606 GN=VPS4B PE=1 SV=1	14	LASKAAQEDKAG
LLTKAAAEDKAG	sp|P0DTD1|R1AB_SARS2	6029	sp|O75351|VPS4B_HUMAN Vacuolar protein sorting-associated protein 4B OS=Homo sapiens OX=9606 GN=VPS4B PE=1 SV=2	14	LASKAAQEDKAG
LLTKAAAEDKAG	sp|P0DTD1|R1AB_SARS2	6029	tr|K7EKZ3|K7EKZ3_HUMAN Vacuolar protein sorting-associated protein 4B OS=Homo sapiens OX=9606 GN=VPS4B PE=1 SV=1	14	LASKAAQEDKAG
AELSLRDATQLA	sp|P0DTD1|R1AB_SARS2	483	tr|A0A0G2JK30|A0A0G2JK30_HUMAN G patch domain and ankyrin repeat-containing protein 1 (Fragment) OS=Homo sapiens OX=9606 GN=GPANK1 PE=1 SV=1	173	CELSGRDAAQLA
AELSLRDATQLA	sp|P0DTD1|R1AB_SARS2	483	tr|A0A0G2JK37|A0A0G2JK37_HUMAN G patch domain and ankyrin repeat-containing protein 1 (Fragment) OS=Homo sapiens OX=9606 GN=GPANK1 PE=1 SV=1	173	CELSGRDAAQLA
AELSLRDATQLA	sp|P0DTD1|R1AB_SARS2	483	sp|O95872|GPAN1_HUMAN G patch domain and ankyrin repeat-containing protein 1 OS=Homo sapiens OX=9606 GN=GPANK1 PE=1 SV=1	173	CELSGRDAAQLA
AELSLRDATQLA	sp|P0DTD1|R1AB_SARS2	483	tr|A0A0G2JHL1|A0A0G2JHL1_HUMAN G patch domain and ankyrin repeat-containing protein 1 OS=Homo sapiens OX=9606 GN=GPANK1 PE=1 SV=1	173	CELSGRDAAQLA
TVVFILVSRAAV	sp|P0DTC4|VEMP_SARS2	41	sp|Q96J65|MRP9_HUMAN ATP-binding cassette sub-family C member 12 OS=Homo sapiens OX=9606 GN=ABCC12 PE=1 SV=2	936	MVVFILVILAAV
LTKAAAEDKAGL	sp|P0DTD1|R1AB_SARS2	6030	tr|A0A087WT84|A0A087WT84_HUMAN 2-oxoglutarate and iron-dependent oxygenase JMJD4 OS=Homo sapiens OX=9606 GN=JMJD4 PE=1 SV=1	352	LREAAAEDGAGL
LTKAAAEDKAGL	sp|P0DTD1|R1AB_SARS2	6030	sp|Q9H9V9|JMJD4_HUMAN 2-oxoglutarate and iron-dependent oxygenase JMJD4 OS=Homo sapiens OX=9606 GN=JMJD4 PE=1 SV=2	398	LREAAAEDGAGL
TQLEGGLNQGLV	sp|P0DTD1|R1AB_SARS2	6382	sp|Q6PIS1|S23A3_HUMAN Solute carrier family 23 member 3 OS=Homo sapiens OX=9606 GN=SLC23A3 PE=2 SV=2	514	TQLERGLGQGLP
MQLTYLITLPFL	sp|P0DTD1|R1AB_SARS2	2593	tr|G3V1R5|G3V1R5_HUMAN Nardilysin OS=Homo sapiens OX=9606 GN=NRDC PE=1 SV=1	1049	MQLTYLPTSPLL
MQLTYLITLPFL	sp|P0DTD1|R1AB_SARS2	2593	tr|H0Y5G9|H0Y5G9_HUMAN Nardilysin (Fragment) OS=Homo sapiens OX=9606 GN=NRDC PE=1 SV=1	500	MQLTYLPTSPLL
MQLTYLITLPFL	sp|P0DTD1|R1AB_SARS2	2593	sp|O43847|NRDC_HUMAN Nardilysin OS=Homo sapiens OX=9606 GN=NRDC PE=1 SV=3	1113	MQLTYLPTSPLL
SLSPNTFFILIV	sp|P0DTC6|NS6_SARS2	22	sp|O60330|PCDGC_HUMAN Protocadherin gamma-A12 OS=Homo sapiens OX=9606 GN=PCDHGA12 PE=2 SV=1	171	ELSPNTHFSLIV
LSPNTFFILIVK	sp|P0DTC6|NS6_SARS2	23	sp|O60330|PCDGC_HUMAN Protocadherin gamma-A12 OS=Homo sapiens OX=9606 GN=PCDHGA12 PE=2 SV=1	172	LSPNTHFSLIVQ
LAELYKYKAELK	sp|P0DTD1|R1AB_SARS2	744	sp|O75528|TADA3_HUMAN Transcriptional adapter 3 OS=Homo sapiens OX=9606 GN=TADA3 PE=1 SV=1	343	LAELRKRQAELK
LDLLIILVPSLP	sp|P0DTD1|R1AB_SARS2	1904	tr|H0YMP0|H0YMP0_HUMAN Formin-1 (Fragment) OS=Homo sapiens OX=9606 GN=FMN1 PE=1 SV=1	44	KQLLILLVPSLP
FLSGLFQIFKSA	sp|P0DTD1|R1AB_SARS2	999	tr|A0A1B0GUS7|A0A1B0GUS7_HUMAN Protein unc-13 homolog B OS=Homo sapiens OX=9606 GN=UNC13B PE=1 SV=1	1147	FLSGLFNRFSSA
RLSITLDRLWSV	sp|P0DTC2|SPIKE_SARS2	39	tr|S4R351|S4R351_HUMAN Zinc finger protein basonuclin-2 (Fragment) OS=Homo sapiens OX=9606 GN=BNC2 PE=1 SV=1	107	RLKILLDRLFSV
RLSITLDRLWSV	sp|P0DTC2|SPIKE_SARS2	39	sp|Q01954|BNC1_HUMAN Zinc finger protein basonuclin-1 OS=Homo sapiens OX=9606 GN=BNC1 PE=1 SV=2	107	RLKILLDRLFSV
RLSITLDRLWSV	sp|P0DTC2|SPIKE_SARS2	39	tr|F5GY04|F5GY04_HUMAN Zinc finger protein basonuclin-1 OS=Homo sapiens OX=9606 GN=BNC1 PE=1 SV=1	100	RLKILLDRLFSV
RLSITLDRLWSV	sp|P0DTC2|SPIKE_SARS2	39	tr|S4R3R8|S4R3R8_HUMAN Zinc finger protein basonuclin-2 (Fragment) OS=Homo sapiens OX=9606 GN=BNC2 PE=1 SV=1	143	RLKILLDRLFSV
RLSITLDRLWSV	sp|P0DTC2|SPIKE_SARS2	39	tr|Q06HB9|Q06HB9_HUMAN Basonuclin 2 (Fragment) OS=Homo sapiens OX=9606 GN=BNC2 PE=1 SV=1	107	RLKILLDRLFSV
RLSITLDRLWSV	sp|P0DTC2|SPIKE_SARS2	39	tr|A0A1B0GX98|A0A1B0GX98_HUMAN Zinc finger protein basonuclin-2 (Fragment) OS=Homo sapiens OX=9606 GN=BNC2 PE=1 SV=1	107	RLKILLDRLFSV
RLSITLDRLWSV	sp|P0DTC2|SPIKE_SARS2	39	sp|Q6ZN30|BNC2_HUMAN Zinc finger protein basonuclin-2 OS=Homo sapiens OX=9606 GN=BNC2 PE=1 SV=1	185	RLKILLDRLFSV
RLSITLDRLWSV	sp|P0DTC2|SPIKE_SARS2	39	tr|B1APH0|B1APH0_HUMAN Zinc finger protein basonuclin-2 OS=Homo sapiens OX=9606 GN=BNC2 PE=1 SV=1	118	RLKILLDRLFSV
RLSITLDRLWSV	sp|P0DTC2|SPIKE_SARS2	39	tr|F5H586|F5H586_HUMAN Zinc finger protein basonuclin-2 OS=Homo sapiens OX=9606 GN=BNC2 PE=1 SV=2	11	RLKILLDRLFSV
RLSITLDRLWSV	sp|P0DTC2|SPIKE_SARS2	39	tr|H0Y6W5|H0Y6W5_HUMAN Zinc finger protein basonuclin-2 (Fragment) OS=Homo sapiens OX=9606 GN=BNC2 PE=1 SV=1	142	RLKILLDRLFSV
CPLSGADVVVPY	sp|P0DTD1|R1AB_SARS2	4629	tr|A2A2F0|A2A2F0_HUMAN Ral GTPase-activating protein subunit beta (Fragment) OS=Homo sapiens OX=9606 GN=RALGAPB PE=1 SV=1	401	CDLKGIDVVVPY
CPLSGADVVVPY	sp|P0DTD1|R1AB_SARS2	4629	sp|Q86X10|RLGPB_HUMAN Ral GTPase-activating protein subunit beta OS=Homo sapiens OX=9606 GN=RALGAPB PE=1 SV=1	573	CDLKGIDVVVPY
DLICLEVKVEKI	sp|P0DTC1|R1A_SARS2	3586	sp|Q07065|CKAP4_HUMAN Cytoskeleton-associated protein 4 OS=Homo sapiens OX=9606 GN=CKAP4 PE=1 SV=2	587	DLDRLFVKVEKI
ITKKPKTVFKQP	sp|P0DTC2|SPIKE_SARS2	252	sp|Q5HYC2|K2026_HUMAN Uncharacterized protein KIAA2026 OS=Homo sapiens OX=9606 GN=KIAA2026 PE=2 SV=2	747	ITKKRKTVIKSP
ITKKPKTVFKQP	sp|P0DTC2|SPIKE_SARS2	252	tr|H0YGV4|H0YGV4_HUMAN Uncharacterized protein KIAA2026 (Fragment) OS=Homo sapiens OX=9606 GN=KIAA2026 PE=4 SV=1	31	ITKKRKTVIKSP
GEGLWAIGTLLD	sp|P0DTC1|R1A_SARS2	1183	sp|Q9NY59|NSMA2_HUMAN Sphingomyelin phosphodiesterase 3 OS=Homo sapiens OX=9606 GN=SMPD3 PE=1 SV=1	542	EEKPWAIGTLLD
GEGLWAIGTLLD	sp|P0DTC1|R1A_SARS2	1183	tr|H3BS51|H3BS51_HUMAN Sphingomyelin phosphodiesterase OS=Homo sapiens OX=9606 GN=SMPD3 PE=1 SV=1	542	EEKPWAIGTLLD
LIADFLLFLLPS	sp|P0DTG1|ORF3C_SARS2	6	sp|Q7Z7H3|CATIP_HUMAN Ciliogenesis-associated TTC17-interacting protein OS=Homo sapiens OX=9606 GN=CATIP PE=1 SV=1	327	LISDFLLFLLLR
RLLSGSVPLLVL	sp|P0DTD1|R1AB_SARS2	131	tr|K7EKV2|K7EKV2_HUMAN Telomerase-binding protein EST1A (Fragment) OS=Homo sapiens OX=9606 GN=SMG6 PE=1 SV=8	118	RLLSGFVPLLAA
RLLSGSVPLLVL	sp|P0DTD1|R1AB_SARS2	131	tr|I3L390|I3L390_HUMAN Telomerase-binding protein EST1A (Fragment) OS=Homo sapiens OX=9606 GN=SMG6 PE=1 SV=2	61	RLLSGFVPLLAA
RLLSGSVPLLVL	sp|P0DTD1|R1AB_SARS2	131	sp|Q86US8|EST1A_HUMAN Telomerase-binding protein EST1A OS=Homo sapiens OX=9606 GN=SMG6 PE=1 SV=2	1095	RLLSGFVPLLAA
TKVPLFIPVGVT	sp|P0DTD1|R1AB_SARS2	5967	sp|O43155|FLRT2_HUMAN Leucine-rich repeat transmembrane protein FLRT2 OS=Homo sapiens OX=9606 GN=FLRT2 PE=1 SV=1	55	TSVPLGIPEGVT
GLARLLCSLKLK	sp|P0DTC1|R1A_SARS2	3689	tr|C9JIB2|C9JIB2_HUMAN Zinc transporter ZIP5 (Fragment) OS=Homo sapiens OX=9606 GN=SLC39A5 PE=1 SV=1	57	GLARLLHSLGLG
GLARLLCSLKLK	sp|P0DTC1|R1A_SARS2	3689	tr|C9JVC6|C9JVC6_HUMAN Zinc transporter ZIP5 (Fragment) OS=Homo sapiens OX=9606 GN=SLC39A5 PE=1 SV=1	57	GLARLLHSLGLG
GLARLLCSLKLK	sp|P0DTC1|R1A_SARS2	3689	tr|C9JPS6|C9JPS6_HUMAN Zinc transporter ZIP5 (Fragment) OS=Homo sapiens OX=9606 GN=SLC39A5 PE=1 SV=8	57	GLARLLHSLGLG
GLARLLCSLKLK	sp|P0DTC1|R1A_SARS2	3689	tr|C9JPS5|C9JPS5_HUMAN Zinc transporter ZIP5 (Fragment) OS=Homo sapiens OX=9606 GN=SLC39A5 PE=1 SV=1	57	GLARLLHSLGLG
GLARLLCSLKLK	sp|P0DTC1|R1A_SARS2	3689	tr|C9JB28|C9JB28_HUMAN Zinc transporter ZIP5 (Fragment) OS=Homo sapiens OX=9606 GN=SLC39A5 PE=1 SV=1	28	GLARLLHSLGLG
GLARLLCSLKLK	sp|P0DTC1|R1A_SARS2	3689	sp|Q6ZMH5|S39A5_HUMAN Zinc transporter ZIP5 OS=Homo sapiens OX=9606 GN=SLC39A5 PE=1 SV=3	57	GLARLLHSLGLG
TLLALGYVLGVI	sp|P0DTC1|R1A_SARS2	384	sp|Q687X5|STEA4_HUMAN Metalloreductase STEAP4 OS=Homo sapiens OX=9606 GN=STEAP4 PE=1 SV=1	253	TLLALVYLPGVI
TLLALGYVLGVI	sp|P0DTC1|R1A_SARS2	384	tr|C9JS50|C9JS50_HUMAN Metalloreductase STEAP4 OS=Homo sapiens OX=9606 GN=STEAP4 PE=1 SV=1	253	TLLALVYLPGVI
TLLALGYVLGVI	sp|P0DTC1|R1A_SARS2	384	sp|Q9UHE8|STEA1_HUMAN Metalloreductase STEAP1 OS=Homo sapiens OX=9606 GN=STEAP1 PE=1 SV=1	124	TLLALVYLPGVI
TLLALGYVLGVI	sp|P0DTC1|R1A_SARS2	384	tr|C9JL51|C9JL51_HUMAN STEAP family member 1B (Fragment) OS=Homo sapiens OX=9606 GN=STEAP1B PE=1 SV=1	124	TLLALVYLPGVI
TLLALGYVLGVI	sp|P0DTC1|R1A_SARS2	384	tr|C9JE84|C9JE84_HUMAN STEAP family member 1B (Fragment) OS=Homo sapiens OX=9606 GN=STEAP1B PE=1 SV=1	124	TLLALVYLPGVI
TLLALGYVLGVI	sp|P0DTC1|R1A_SARS2	384	sp|Q6NZ63|STEAL_HUMAN STEAP family member 1B OS=Homo sapiens OX=9606 GN=STEAP1B PE=1 SV=1	105	TLLALVYLPGVI
IPELAALTQDEE	sp|P0DTD1|R1AB_SARS2	1048	sp|Q92889|XPF_HUMAN DNA repair endonuclease XPF OS=Homo sapiens OX=9606 GN=ERCC4 PE=1 SV=3	873	IAELAALSQDEL
LKKVRTALGNAK	sp|P0DTD1|R1AB_SARS2	3494	sp|Q96GR2|ACBG1_HUMAN Long-chain-fatty-acid--CoA ligase ACSBG1 OS=Homo sapiens OX=9606 GN=ACSBG1 PE=1 SV=2	433	LAKVRQALGFAK
LKKVRTALGNAK	sp|P0DTD1|R1AB_SARS2	3494	tr|F5H4U6|F5H4U6_HUMAN Long-chain-fatty-acid--CoA ligase ACSBG1 OS=Homo sapiens OX=9606 GN=ACSBG1 PE=1 SV=1	191	LAKVRQALGFAK
FPKVCALLVSLK	sp|P0DTD1|R1AB_SARS2	1597	sp|Q8NGG1|OR8J2_HUMAN Olfactory receptor 8J2 OS=Homo sapiens OX=9606 GN=OR8J2 PE=3 SV=2	137	SPKVCRLLVSLT
VGKSLYVSETAF	sp|P0DTD1|R1AB_SARS2	1376	sp|P01024|CO3_HUMAN Complement C3 OS=Homo sapiens OX=9606 GN=C3 PE=1 SV=2	320	VGKSLYVSATVI
TDTNYLYAAIKH	sp|P0DTD1|R1AB_SARS2	5597	sp|Q86VV4|RNB3L_HUMAN Ran-binding protein 3-like OS=Homo sapiens OX=9606 GN=RANBP3L PE=1 SV=2	393	QDTAYLYAAIHH
ALIPDRSFEGSN	sp|P0DTD1|R1AB_SARS2	3472	sp|A6NMK8|INY2B_HUMAN Protein INSYN2B OS=Homo sapiens OX=9606 GN=INSYN2B PE=2 SV=1	220	ALSPDRSAEVSN
RIAAPGTPAAAL	sp|P0DTD1|R1AB_SARS2	3462	sp|Q8TDN4|CABL1_HUMAN CDK5 and ABL1 enzyme substrate 1 OS=Homo sapiens OX=9606 GN=CABLES1 PE=1 SV=2	121	ALAAPGTPAAGL
QLASEFPKDRVL	sp|P0DTC1|R1A_SARS2	1006	sp|Q9HCK8|CHD8_HUMAN Chromodomain-helicase-DNA-binding protein 8 OS=Homo sapiens OX=9606 GN=CHD8 PE=1 SV=5	2149	QRASEWPKDRVL
QLASEFPKDRVL	sp|P0DTC1|R1A_SARS2	1006	tr|H0YJG4|H0YJG4_HUMAN Chromodomain-helicase-DNA-binding protein 8 (Fragment) OS=Homo sapiens OX=9606 GN=CHD8 PE=1 SV=2	1383	QRASEWPKDRVL
KNLANIRNPQEA	sp|P0DTC1|R1A_SARS2	15	sp|P35580|MYH10_HUMAN Myosin-10 OS=Homo sapiens OX=9606 GN=MYH10 PE=1 SV=3	1023	KNLAKIRNKQEV
EFCTLLNLVLFS	sp|P0DTC4|VEMP_SARS2	57	sp|Q9NZ38|IDAS1_HUMAN Uncharacterized protein IDI2-AS1 OS=Homo sapiens OX=9606 GN=IDI2-AS1 PE=2 SV=1	150	EDCTSLNRVLFS
DLLIILVPSLPN	sp|P0DTD1|R1AB_SARS2	1905	tr|H0YMP0|H0YMP0_HUMAN Formin-1 (Fragment) OS=Homo sapiens OX=9606 GN=FMN1 PE=1 SV=1	45	QLLILLVPSLPT
IENLVELPASFE	sp|P0DTC1|R1A_SARS2	3746	tr|C9JDY8|C9JDY8_HUMAN Amiloride-sensitive sodium channel subunit delta (Fragment) OS=Homo sapiens OX=9606 GN=SCNN1D PE=3 SV=1	82	QEGLVELPASFR
IENLVELPASFE	sp|P0DTC1|R1A_SARS2	3746	sp|P51172|SCNND_HUMAN Amiloride-sensitive sodium channel subunit delta OS=Homo sapiens OX=9606 GN=SCNN1D PE=1 SV=3	210	QEGLVELPASFR
LLARTESLTVLD	sp|P0DTC7|NS7A_SARS2	48	sp|P98161|PKD1_HUMAN Polycystin-1 OS=Homo sapiens OX=9606 GN=PKD1 PE=1 SV=3	771	LLAATEQLTVLL
YLLIADFLLFLL	sp|P0DTG1|ORF3C_SARS2	4	sp|Q7Z7H3|CATIP_HUMAN Ciliogenesis-associated TTC17-interacting protein OS=Homo sapiens OX=9606 GN=CATIP PE=1 SV=1	325	HALISDFLLFLL
AHGPAGDSAADL	sp|P0DTC1|R1A_SARS2	3576	sp|Q8IWQ3|BRSK2_HUMAN Serine/threonine-protein kinase BRSK2 OS=Homo sapiens OX=9606 GN=BRSK2 PE=1 SV=3	697	AHGPLGDSAAAG
VLELPLPYIYLT	sp|P0DTD1|R1AB_SARS2	6920	sp|Q96BY7|ATG2B_HUMAN Autophagy-related protein 2 homolog B OS=Homo sapiens OX=9606 GN=ATG2B PE=1 SV=5	936	VLELTLPNIYVT
RSRKLLLDIVRL	sp|P0DTC5|VME1_SARS2	156	sp|Q05940|VMAT2_HUMAN Synaptic vesicular amine transporter OS=Homo sapiens OX=9606 GN=SLC18A2 PE=1 SV=2	17	RSRKLILFIVFL
TMKISQAMLLEA	sp|P0DTD1|R1AB_SARS2	3048	tr|D4PHA4|D4PHA4_HUMAN GC-rich promoter binding protein 1, isoform CRA_c OS=Homo sapiens OX=9606 GN=GPBP1 PE=1 SV=1	170	TKKISQAPLLEY
PRLLSGSVPLLV	sp|P0DTD1|R1AB_SARS2	130	tr|K7EKV2|K7EKV2_HUMAN Telomerase-binding protein EST1A (Fragment) OS=Homo sapiens OX=9606 GN=SMG6 PE=1 SV=8	117	DRLLSGFVPLLA
PRLLSGSVPLLV	sp|P0DTD1|R1AB_SARS2	130	tr|I3L390|I3L390_HUMAN Telomerase-binding protein EST1A (Fragment) OS=Homo sapiens OX=9606 GN=SMG6 PE=1 SV=2	60	DRLLSGFVPLLA
PRLLSGSVPLLV	sp|P0DTD1|R1AB_SARS2	130	sp|Q86US8|EST1A_HUMAN Telomerase-binding protein EST1A OS=Homo sapiens OX=9606 GN=SMG6 PE=1 SV=2	1094	DRLLSGFVPLLA
TFPKVCALLVSL	sp|P0DTD1|R1AB_SARS2	1596	sp|Q8NGG1|OR8J2_HUMAN Olfactory receptor 8J2 OS=Homo sapiens OX=9606 GN=OR8J2 PE=3 SV=2	136	VSPKVCRLLVSL
ELSLRDATQLAY	sp|P0DTD1|R1AB_SARS2	484	tr|A0A0G2JK30|A0A0G2JK30_HUMAN G patch domain and ankyrin repeat-containing protein 1 (Fragment) OS=Homo sapiens OX=9606 GN=GPANK1 PE=1 SV=1	174	ELSGRDAAQLAE
ELSLRDATQLAY	sp|P0DTD1|R1AB_SARS2	484	tr|A0A0G2JK37|A0A0G2JK37_HUMAN G patch domain and ankyrin repeat-containing protein 1 (Fragment) OS=Homo sapiens OX=9606 GN=GPANK1 PE=1 SV=1	174	ELSGRDAAQLAE
ELSLRDATQLAY	sp|P0DTD1|R1AB_SARS2	484	sp|O95872|GPAN1_HUMAN G patch domain and ankyrin repeat-containing protein 1 OS=Homo sapiens OX=9606 GN=GPANK1 PE=1 SV=1	174	ELSGRDAAQLAE
ELSLRDATQLAY	sp|P0DTD1|R1AB_SARS2	484	tr|A0A0G2JHL1|A0A0G2JHL1_HUMAN G patch domain and ankyrin repeat-containing protein 1 OS=Homo sapiens OX=9606 GN=GPANK1 PE=1 SV=1	174	ELSGRDAAQLAE
GDGEEEEVRCNA	sp|P0DTD1|R1AB_SARS2	6508	sp|Q8N371|KDM8_HUMAN Bifunctional peptidase and arginyl-hydroxylase JMJD5 OS=Homo sapiens OX=9606 GN=KDM8 PE=1 SV=1	298	GDGEEEEITINA
GDGEEEEVRCNA	sp|P0DTD1|R1AB_SARS2	6508	tr|H3BPT5|H3BPT5_HUMAN Bifunctional peptidase and arginyl-hydroxylase JMJD5 (Fragment) OS=Homo sapiens OX=9606 GN=KDM8 PE=1 SV=1	45	GDGEEEEITINA
YTSPLVAEHFEK	sp|P0DTC1|R1A_SARS2	432	sp|Q9UN42|AT1B4_HUMAN Protein ATP1B4 OS=Homo sapiens OX=9606 GN=ATP1B4 PE=1 SV=1	307	YTSPLVAMHFTD
YTSPLVAEHFEK	sp|P0DTC1|R1A_SARS2	432	tr|B7ZKW0|B7ZKW0_HUMAN Sodium/potassium-transporting ATPase subunit beta OS=Homo sapiens OX=9606 GN=ATP1B4 PE=1 SV=1	264	YTSPLVAMHFTD
NAVLSSKPGSNS	sp|P0DTC1|R1A_SARS2	2343	tr|A0A075B749|A0A075B749_HUMAN Myomegalin OS=Homo sapiens OX=9606 GN=PDE4DIP PE=1 SV=2	1787	SAVLSSKPSSTS
