query	query_seqname	query_start	target_seqname	target_start	target
NRTANSKLDIIA	tr|Q0GNR0|Q0GNR0_HSPV	540	tr|F5GXH2|F5GXH2_HUMAN L-lactate dehydrogenase A chain (Fragment) OS=Homo sapiens OX=9606 GN=LDHA PE=1 SV=1	84	NVTANSKLVIIT
NRTANSKLDIIA	tr|Q0GNR0|Q0GNR0_HSPV	540	tr|F5GYU2|F5GYU2_HUMAN L-lactate dehydrogenase A chain (Fragment) OS=Homo sapiens OX=9606 GN=LDHA PE=1 SV=1	84	NVTANSKLVIIT
NRTANSKLDIIA	tr|Q0GNR0|Q0GNR0_HSPV	540	tr|F5GXY2|F5GXY2_HUMAN L-lactate dehydrogenase A chain (Fragment) OS=Homo sapiens OX=9606 GN=LDHA PE=1 SV=8	84	NVTANSKLVIIT
NRTANSKLDIIA	tr|Q0GNR0|Q0GNR0_HSPV	540	sp|P00338|LDHA_HUMAN L-lactate dehydrogenase A chain OS=Homo sapiens OX=9606 GN=LDHA PE=1 SV=2	84	NVTANSKLVIIT
SLVLNNLSIYDI	tr|Q0GNY9|Q0GNY9_HSPV	234	sp|Q6WRI0|IGS10_HUMAN Immunoglobulin superfamily member 10 OS=Homo sapiens OX=9606 GN=IGSF10 PE=1 SV=1	1804	TLVLHNLSIYDR
GTLITDTKSNDD	tr|Q0GP07|Q0GP07_HSPV	553	tr|J3QT83|J3QT83_HUMAN Collagen alpha-1(XIV) chain (Fragment) OS=Homo sapiens OX=9606 GN=COL14A1 PE=1 SV=1	76	GILITDGKSQDD
GTLITDTKSNDD	tr|Q0GP07|Q0GP07_HSPV	553	sp|Q05707|COEA1_HUMAN Collagen alpha-1(XIV) chain OS=Homo sapiens OX=9606 GN=COL14A1 PE=1 SV=3	263	GILITDGKSQDD
GTLITDTKSNDD	tr|Q0GP07|Q0GP07_HSPV	553	tr|Q4G0W3|Q4G0W3_HUMAN COL14A1 protein OS=Homo sapiens OX=9606 GN=COL14A1 PE=1 SV=1	263	GILITDGKSQDD
GTLITDTKSNDD	tr|Q0GP07|Q0GP07_HSPV	553	tr|A0A087X0A8|A0A087X0A8_HUMAN Collagen alpha-1(XII) chain OS=Homo sapiens OX=9606 GN=COL12A1 PE=1 SV=1	115	GVLITDGKSQDD
GTLITDTKSNDD	tr|Q0GP07|Q0GP07_HSPV	553	tr|D6RGG3|D6RGG3_HUMAN Collagen alpha-1(XII) chain OS=Homo sapiens OX=9606 GN=COL12A1 PE=1 SV=1	1304	GVLITDGKSQDD
GTLITDTKSNDD	tr|Q0GP07|Q0GP07_HSPV	553	sp|Q99715|COCA1_HUMAN Collagen alpha-1(XII) chain OS=Homo sapiens OX=9606 GN=COL12A1 PE=1 SV=2	1304	GVLITDGKSQDD
GTLITDTKSNDD	tr|Q0GP07|Q0GP07_HSPV	553	tr|H0Y4P7|H0Y4P7_HUMAN Collagen alpha-1(XII) chain (Fragment) OS=Homo sapiens OX=9606 GN=COL12A1 PE=1 SV=1	46	GVLITDGKSQDD
FLKKGGLVPGEH	tr|Q0GP00|Q0GP00_HSPV	32	sp|Q9BXP8|PAPP2_HUMAN Pappalysin-2 OS=Homo sapiens OX=9606 GN=PAPPA2 PE=1 SV=4	1281	FLTTDGLVPGEH
CEIKKLFTKKES	tr|Q0GNL9|Q0GNL9_HSPV	100	tr|C9J2D3|C9J2D3_HUMAN Zinc finger protein 566 (Fragment) OS=Homo sapiens OX=9606 GN=ZNF566 PE=1 SV=8	84	CETKKLFLKKEI
CEIKKLFTKKES	tr|Q0GNL9|Q0GNL9_HSPV	100	tr|C9J6X1|C9J6X1_HUMAN Zinc finger protein 566 (Fragment) OS=Homo sapiens OX=9606 GN=ZNF566 PE=1 SV=1	83	CETKKLFLKKEI
CEIKKLFTKKES	tr|Q0GNL9|Q0GNL9_HSPV	100	sp|Q969W8|ZN566_HUMAN Zinc finger protein 566 OS=Homo sapiens OX=9606 GN=ZNF566 PE=1 SV=1	83	CETKKLFLKKEI
CEIKKLFTKKES	tr|Q0GNL9|Q0GNL9_HSPV	100	tr|M0R287|M0R287_HUMAN Zinc finger protein 83 OS=Homo sapiens OX=9606 GN=ZNF83 PE=1 SV=1	53	CEIKELPPKKES
CEIKKLFTKKES	tr|Q0GNL9|Q0GNL9_HSPV	100	tr|L0R8M2|L0R8M2_HUMAN Alternative protein ZNF83 OS=Homo sapiens OX=9606 GN=ZNF83 PE=1 SV=1	53	CEIKELPPKKES
YGRLARSTFRLI	tr|Q0GP19|Q0GP19_HSPV	592	sp|P47872|SCTR_HUMAN Secretin receptor OS=Homo sapiens OX=9606 GN=SCTR PE=1 SV=2	337	YKRLARSTLLLI
YGRLARSTFRLI	tr|Q0GP19|Q0GP19_HSPV	592	sp|P41586|PACR_HUMAN Pituitary adenylate cyclase-activating polypeptide type I receptor OS=Homo sapiens OX=9606 GN=ADCYAP1R1 PE=1 SV=1	348	YLRLARSTLLLI
YGRLARSTFRLI	tr|Q0GP19|Q0GP19_HSPV	592	sp|P32241|VIPR1_HUMAN Vasoactive intestinal polypeptide receptor 1 OS=Homo sapiens OX=9606 GN=VIPR1 PE=1 SV=1	336	YSRLARSTLLLI
TDSTLFEVEIHF	tr|Q0GNX8|Q0GNX8_HSPV	811	tr|H0YNP9|H0YNP9_HUMAN Guanosine-3',5'-bis(diphosphate) 3'-pyrophosphohydrolase MESH1 OS=Homo sapiens OX=9606 GN=HDDC3 PE=1 SV=1	67	TDTTLDEVELHF
TDSTLFEVEIHF	tr|Q0GNX8|Q0GNX8_HSPV	811	tr|H0YKT9|H0YKT9_HUMAN Guanosine-3',5'-bis(diphosphate) 3'-pyrophosphohydrolase MESH1 (Fragment) OS=Homo sapiens OX=9606 GN=HDDC3 PE=1 SV=1	60	TDTTLDEVELHF
TDSTLFEVEIHF	tr|Q0GNX8|Q0GNX8_HSPV	811	sp|Q8N4P3|MESH1_HUMAN Guanosine-3',5'-bis(diphosphate) 3'-pyrophosphohydrolase MESH1 OS=Homo sapiens OX=9606 GN=HDDC3 PE=1 SV=3	67	TDTTLDEVELHF
FSTFFSLFFLDL	tr|Q0GNL8|Q0GNL8_HSPV	40	sp|Q7Z7M0|MEGF8_HUMAN Multiple epidermal growth factor-like domains protein 8 OS=Homo sapiens OX=9606 GN=MEGF8 PE=1 SV=2	2652	FSVFFSCFFLFL
FSTFFSLFFLDL	tr|Q0GNL8|Q0GNL8_HSPV	40	tr|F5GZG7|F5GZG7_HUMAN Multiple epidermal growth factor-like domains protein 8 OS=Homo sapiens OX=9606 GN=MEGF8 PE=1 SV=1	246	FSVFFSCFFLFL
VLISNRLVLNTL	sp|Q0GNN1|KBTB2_HSPV	205	tr|C9IYN1|C9IYN1_HUMAN Transmembrane protein 39A (Fragment) OS=Homo sapiens OX=9606 GN=TMEM39A PE=1 SV=8	154	VLISARLVLLTL
VLISNRLVLNTL	sp|Q0GNN1|KBTB2_HSPV	205	sp|Q9NV64|TM39A_HUMAN Transmembrane protein 39A OS=Homo sapiens OX=9606 GN=TMEM39A PE=1 SV=1	154	VLISARLVLLTL
IVAESVMESDTV	tr|Q0GNW6|Q0GNW6_HSPV	47	tr|A0A0J9YX80|A0A0J9YX80_HUMAN Deformed epidermal autoregulatory factor 1 homolog (Fragment) OS=Homo sapiens OX=9606 GN=DEAF1 PE=1 SV=1	136	HVAESVMEKVTV
IVAESVMESDTV	tr|Q0GNW6|Q0GNW6_HSPV	47	sp|O75398|DEAF1_HUMAN Deformed epidermal autoregulatory factor 1 homolog OS=Homo sapiens OX=9606 GN=DEAF1 PE=1 SV=1	554	HVAESVMEKVTV
IVAESVMESDTV	tr|Q0GNW6|Q0GNW6_HSPV	47	tr|A0A0J9YWD6|A0A0J9YWD6_HUMAN Deformed epidermal autoregulatory factor 1 homolog (Fragment) OS=Homo sapiens OX=9606 GN=DEAF1 PE=1 SV=1	150	HVAESVMEKVTV
ISVRIKTKSASI	tr|Q0GP15|Q0GP15_HSPV	252	sp|P11532|DMD_HUMAN Dystrophin OS=Homo sapiens OX=9606 GN=DMD PE=1 SV=3	1767	ISHRIKTGKASI
ISVRIKTKSASI	tr|Q0GP15|Q0GP15_HSPV	252	tr|A0A075B6G3|A0A075B6G3_HUMAN Dystrophin OS=Homo sapiens OX=9606 GN=DMD PE=1 SV=1	1767	ISHRIKTGKASI
ISVRIKTKSASI	tr|Q0GP15|Q0GP15_HSPV	252	tr|A0A5H1ZRP8|A0A5H1ZRP8_HUMAN Dystrophin OS=Homo sapiens OX=9606 GN=DMD PE=1 SV=1	1763	ISHRIKTGKASI
ISVRIKTKSASI	tr|Q0GP15|Q0GP15_HSPV	252	tr|A0A087WV90|A0A087WV90_HUMAN Dystrophin OS=Homo sapiens OX=9606 GN=DMD PE=1 SV=1	1763	ISHRIKTGKASI
ISVRIKTKSASI	tr|Q0GP15|Q0GP15_HSPV	252	tr|A0A087WTU7|A0A087WTU7_HUMAN Dystrophin OS=Homo sapiens OX=9606 GN=DMD PE=1 SV=1	1767	ISHRIKTGKASI
NNSSDVDGGRSL	tr|Q0GP37|Q0GP37_HSPV	176	sp|Q9BY49|PECR_HUMAN Peroxisomal trans-2-enoyl-CoA reductase OS=Homo sapiens OX=9606 GN=PECR PE=1 SV=2	256	GQSVDVDGGRSL
KFSSKSAEDPEK	tr|Q0GNW5|Q0GNW5_HSPV	11	sp|Q13443|ADAM9_HUMAN Disintegrin and metalloproteinase domain-containing protein 9 OS=Homo sapiens OX=9606 GN=ADAM9 PE=1 SV=1	381	NFSSCSAEDFEK
KFSSKSAEDPEK	tr|Q0GNW5|Q0GNW5_HSPV	11	tr|A0AVL1|A0AVL1_HUMAN ADAM9 protein OS=Homo sapiens OX=9606 GN=ADAM9 PE=1 SV=1	381	NFSSCSAEDFEK
KFSSKSAEDPEK	tr|Q0GNW5|Q0GNW5_HSPV	11	tr|F8WC54|F8WC54_HUMAN Disintegrin and metalloproteinase domain-containing protein 9 OS=Homo sapiens OX=9606 GN=ADAM9 PE=1 SV=1	381	NFSSCSAEDFEK
RRELYMKILQEN	tr|Q0GP70|Q0GP70_HSPV	110	tr|A0A0G2JQ92|A0A0G2JQ92_HUMAN CDP-diacylglycerol synthase (Fragment) OS=Homo sapiens OX=9606 GN=TAMM41 PE=1 SV=1	212	FRELYGSILQEN
RRELYMKILQEN	tr|Q0GP70|Q0GP70_HSPV	110	sp|Q96BW9|TAM41_HUMAN Phosphatidate cytidylyltransferase, mitochondrial OS=Homo sapiens OX=9606 GN=TAMM41 PE=1 SV=2	212	FRELYGSILQEN
RRELYMKILQEN	tr|Q0GP70|Q0GP70_HSPV	110	tr|H7C1A2|H7C1A2_HUMAN CDP-diacylglycerol synthase (Fragment) OS=Homo sapiens OX=9606 GN=TAMM41 PE=1 SV=1	25	FRELYGSILQEN
ELVALFKMRSNV	tr|Q0GNV9|Q0GNV9_HSPV	190	sp|Q9ULV1|FZD4_HUMAN Frizzled-4 OS=Homo sapiens OX=9606 GN=FZD4 PE=1 SV=2	409	GLVALFKIRSNL
SALSAANNKGSI	tr|Q0GNQ4|Q0GNQ4_HSPV	27	tr|H0Y6V3|H0Y6V3_HUMAN Non-specific serine/threonine protein kinase (Fragment) OS=Homo sapiens OX=9606 GN=CDC42BPA PE=1 SV=1	380	SQLSASNNKCSI
SALSAANNKGSI	tr|Q0GNQ4|Q0GNQ4_HSPV	27	sp|Q5VT25|MRCKA_HUMAN Serine/threonine-protein kinase MRCK alpha OS=Homo sapiens OX=9606 GN=CDC42BPA PE=1 SV=1	1168	SQLSASNNKCSI
SALSAANNKGSI	tr|Q0GNQ4|Q0GNQ4_HSPV	27	tr|A0A0A0MRJ1|A0A0A0MRJ1_HUMAN Non-specific serine/threonine protein kinase OS=Homo sapiens OX=9606 GN=CDC42BPA PE=1 SV=1	454	SQLSASNNKCSI
SALSAANNKGSI	tr|Q0GNQ4|Q0GNQ4_HSPV	27	tr|H0Y5V1|H0Y5V1_HUMAN Non-specific serine/threonine protein kinase (Fragment) OS=Homo sapiens OX=9606 GN=CDC42BPA PE=1 SV=1	484	SQLSASNNKCSI
SALSAANNKGSI	tr|Q0GNQ4|Q0GNQ4_HSPV	27	tr|A0A0A0MRJ0|A0A0A0MRJ0_HUMAN Non-specific serine/threonine protein kinase OS=Homo sapiens OX=9606 GN=CDC42BPA PE=1 SV=1	1135	SQLSASNNKCSI
SALSAANNKGSI	tr|Q0GNQ4|Q0GNQ4_HSPV	27	tr|H0Y6R0|H0Y6R0_HUMAN Serine/threonine-protein kinase MRCK alpha (Fragment) OS=Homo sapiens OX=9606 GN=CDC42BPA PE=1 SV=1	53	SQLSASNNKCSI
SALSAANNKGSI	tr|Q0GNQ4|Q0GNQ4_HSPV	27	tr|H0Y7V8|H0Y7V8_HUMAN Non-specific serine/threonine protein kinase (Fragment) OS=Homo sapiens OX=9606 GN=CDC42BPA PE=1 SV=1	358	SQLSASNNKCSI
PLSVCPSYSPFS	tr|Q0GNM8|Q0GNM8_HSPV	651	tr|A0A087WUP2|A0A087WUP2_HUMAN Variable charge X-linked protein 3 OS=Homo sapiens OX=9606 GN=VCX3A PE=3 SV=1	123	PLSVTASYSPIS
RPMQDCALRKKK	tr|Q0GP31|Q0GP31_HSPV	22	sp|Q96QH2|PRAM_HUMAN PML-RARA-regulated adapter molecule 1 OS=Homo sapiens OX=9606 GN=PRAM1 PE=1 SV=3	537	RPPQDPALRKEK
LTSSSVAVDLGT	tr|Q0GP39|Q0GP39_HSPV	33	sp|P60507|EFC1_HUMAN Endogenous retrovirus group FC1 Env polyprotein OS=Homo sapiens OX=9606 GN=ERVFC1 PE=1 SV=1	395	LTSSLVASGLGT
IYAGSLIENGGD	tr|Q0GNM1|Q0GNM1_HSPV	425	tr|A0A096LNH2|A0A096LNH2_HUMAN EF-hand calcium-binding domain-containing protein 8 OS=Homo sapiens OX=9606 GN=EFCAB8 PE=1 SV=1	829	IYAWSLHENGGL
NLSSLFIPLSKE	tr|Q0GNX1|Q0GNX1_HSPV	60	sp|Q8N7R7|CCYL1_HUMAN Cyclin-Y-like protein 1 OS=Homo sapiens OX=9606 GN=CCNYL1 PE=1 SV=2	306	NLNFLFAPLSKE
NLSSLFIPLSKE	tr|Q0GNX1|Q0GNX1_HSPV	60	tr|H7C0P7|H7C0P7_HUMAN Cyclin-Y-like protein 1 (Fragment) OS=Homo sapiens OX=9606 GN=CCNYL1 PE=1 SV=1	116	NLNFLFAPLSKE
DLLKLYVKKTCI	tr|Q0GNY6|Q0GNY6_HSPV	417	tr|B4DKD6|B4DKD6_HUMAN BTB/POZ domain-containing protein 8 OS=Homo sapiens OX=9606 GN=BTBD8 PE=1 SV=1	195	DLLKLYVKPCCP
DLLKLYVKKTCI	tr|Q0GNY6|Q0GNY6_HSPV	417	tr|A0A1B0GUL6|A0A1B0GUL6_HUMAN BTB/POZ domain-containing protein 8 OS=Homo sapiens OX=9606 GN=BTBD8 PE=1 SV=1	195	DLLKLYVKPCCP
DLLKLYVKKTCI	tr|Q0GNY6|Q0GNY6_HSPV	417	sp|Q5XKL5|BTBD8_HUMAN BTB/POZ domain-containing protein 8 OS=Homo sapiens OX=9606 GN=BTBD8 PE=2 SV=2	195	DLLKLYVKPCCP
KKVLCCNDNLIS	tr|Q0GNX4|Q0GNX4_HSPV	251	sp|Q8IW52|SLIK4_HUMAN SLIT and NTRK-like protein 4 OS=Homo sapiens OX=9606 GN=SLITRK4 PE=1 SV=1	157	LKVLILNDNLIS
LVIENLGNTSLQ	tr|Q0GP35|Q0GP35_HSPV	336	sp|Q15018|ABRX2_HUMAN BRISC complex subunit Abraxas 2 OS=Homo sapiens OX=9606 GN=ABRAXAS2 PE=1 SV=2	160	LAIPNLGNTSQQ
KKDNDRKLRFLN	tr|Q0GP60|Q0GP60_HSPV	104	tr|A3KCU8|A3KCU8_HUMAN E3 ubiquitin-protein ligase RNF19A (Fragment) OS=Homo sapiens OX=9606 GN=RNF19A PE=1 SV=1	74	KKDNKRKSRELN
KKDNDRKLRFLN	tr|Q0GP60|Q0GP60_HSPV	104	tr|A0A0C4DGD6|A0A0C4DGD6_HUMAN E3 ubiquitin-protein ligase RNF19A (Fragment) OS=Homo sapiens OX=9606 GN=RNF19A PE=1 SV=1	43	KKDNKRKSRELN
KKDNDRKLRFLN	tr|Q0GP60|Q0GP60_HSPV	104	tr|E7EQ63|E7EQ63_HUMAN E3 ubiquitin-protein ligase RNF19A (Fragment) OS=Homo sapiens OX=9606 GN=RNF19A PE=1 SV=1	74	KKDNKRKSRELN
KKDNDRKLRFLN	tr|Q0GP60|Q0GP60_HSPV	104	tr|E7EQV8|E7EQV8_HUMAN E3 ubiquitin-protein ligase RNF19A (Fragment) OS=Homo sapiens OX=9606 GN=RNF19A PE=1 SV=1	74	KKDNKRKSRELN
KKDNDRKLRFLN	tr|Q0GP60|Q0GP60_HSPV	104	tr|E7ETB2|E7ETB2_HUMAN E3 ubiquitin-protein ligase RNF19A (Fragment) OS=Homo sapiens OX=9606 GN=RNF19A PE=1 SV=1	74	KKDNKRKSRELN
KKDNDRKLRFLN	tr|Q0GP60|Q0GP60_HSPV	104	sp|Q9NV58|RN19A_HUMAN E3 ubiquitin-protein ligase RNF19A OS=Homo sapiens OX=9606 GN=RNF19A PE=1 SV=3	74	KKDNKRKSRELN
GVLTLDKVESSF	tr|Q0GNW1|Q0GNW1_HSPV	154	tr|E9PJ21|E9PJ21_HUMAN Hypoxia up-regulated protein 1 (Fragment) OS=Homo sapiens OX=9606 GN=HYOU1 PE=1 SV=1	549	GVLSLDRVESVF
GVLTLDKVESSF	tr|Q0GNW1|Q0GNW1_HSPV	154	tr|A0A087WWI4|A0A087WWI4_HUMAN Hypoxia up-regulated protein 1 OS=Homo sapiens OX=9606 GN=HYOU1 PE=1 SV=1	549	GVLSLDRVESVF
GVLTLDKVESSF	tr|Q0GNW1|Q0GNW1_HSPV	154	tr|A0A494C039|A0A494C039_HUMAN Hypoxia up-regulated protein 1 OS=Homo sapiens OX=9606 GN=HYOU1 PE=1 SV=1	549	GVLSLDRVESVF
GVLTLDKVESSF	tr|Q0GNW1|Q0GNW1_HSPV	154	sp|Q9Y4L1|HYOU1_HUMAN Hypoxia up-regulated protein 1 OS=Homo sapiens OX=9606 GN=HYOU1 PE=1 SV=1	549	GVLSLDRVESVF
GVLTLDKVESSF	tr|Q0GNW1|Q0GNW1_HSPV	154	tr|K7EQK2|K7EQK2_HUMAN Hypoxia up-regulated protein 1 OS=Homo sapiens OX=9606 GN=HYOU1 PE=1 SV=1	549	GVLSLDRVESVF
GVLTLDKVESSF	tr|Q0GNW1|Q0GNW1_HSPV	154	tr|A0A087X054|A0A087X054_HUMAN Hypoxia up-regulated protein 1 OS=Homo sapiens OX=9606 GN=HYOU1 PE=1 SV=1	549	GVLSLDRVESVF
KGKEKDCEFIHT	tr|Q0GP77|Q0GP77_HSPV	11	tr|K7EL90|K7EL90_HUMAN CEP295 N-terminal-like protein (Fragment) OS=Homo sapiens OX=9606 GN=CEP295NL PE=4 SV=1	3	KGPEKDIEFIYT
KGKEKDCEFIHT	tr|Q0GP77|Q0GP77_HSPV	11	tr|B4DFW2|B4DFW2_HUMAN Metalloproteinase inhibitor 2 OS=Homo sapiens OX=9606 GN=TIMP2 PE=1 SV=1	3	KGPEKDIEFIYT
KGKEKDCEFIHT	tr|Q0GP77|Q0GP77_HSPV	11	sp|P16035|TIMP2_HUMAN Metalloproteinase inhibitor 2 OS=Homo sapiens OX=9606 GN=TIMP2 PE=1 SV=2	80	KGPEKDIEFIYT
KGKEKDCEFIHT	tr|Q0GP77|Q0GP77_HSPV	11	tr|K7EIX4|K7EIX4_HUMAN Metalloproteinase inhibitor 2 OS=Homo sapiens OX=9606 GN=TIMP2 PE=1 SV=1	3	KGPEKDIEFIYT
ISDVFLTSNSDS	tr|Q0GNP4|Q0GNP4_HSPV	15	sp|C9J3I9|CE058_HUMAN Putative uncharacterized protein C5orf58 OS=Homo sapiens OX=9606 GN=C5orf58 PE=4 SV=1	90	ISDVSLVSNSFS
YLYYAGLFYTLI	tr|Q0GNY2|Q0GNY2_HSPV	62	tr|A0A0B4J1Y2|A0A0B4J1Y2_HUMAN Tetratricopeptide repeat protein 21A OS=Homo sapiens OX=9606 GN=TTC21A PE=1 SV=1	112	ALYYAGLFLWLI
YLYYAGLFYTLI	tr|Q0GNY2|Q0GNY2_HSPV	62	sp|Q8NDW8|TT21A_HUMAN Tetratricopeptide repeat protein 21A OS=Homo sapiens OX=9606 GN=TTC21A PE=1 SV=3	112	ALYYAGLFLWLI
IIILIGSAVLYA	tr|Q0GNS7|Q0GNS7_HSPV	63	sp|P05160|F13B_HUMAN Coagulation factor XIII B chain OS=Homo sapiens OX=9606 GN=F13B PE=1 SV=3	9	IIILIISGELYA
CFLSTEYLIKAL	tr|Q0GP24|Q0GP24_HSPV	153	tr|K7EII2|K7EII2_HUMAN Centrosomal protein of 76 kDa OS=Homo sapiens OX=9606 GN=CEP76 PE=1 SV=1	45	QHLSTEDLIKAL
CFLSTEYLIKAL	tr|Q0GP24|Q0GP24_HSPV	153	tr|B4DP81|B4DP81_HUMAN Centrosomal protein of 76 kDa OS=Homo sapiens OX=9606 GN=CEP76 PE=1 SV=1	45	QHLSTEDLIKAL
CFLSTEYLIKAL	tr|Q0GP24|Q0GP24_HSPV	153	sp|Q8TAP6|CEP76_HUMAN Centrosomal protein of 76 kDa OS=Homo sapiens OX=9606 GN=CEP76 PE=1 SV=1	45	QHLSTEDLIKAL
KILANLVDINDN	tr|Q0GP25|Q0GP25_HSPV	51	sp|Q9Y5H9|PCDA2_HUMAN Protocadherin alpha-2 OS=Homo sapiens OX=9606 GN=PCDHA2 PE=1 SV=1	335	KISLKLVDINDN
LKWAGPISDVFL	tr|Q0GNW5|Q0GNW5_HSPV	100	sp|O00750|P3C2B_HUMAN Phosphatidylinositol 4-phosphate 3-kinase C2 domain-containing subunit beta OS=Homo sapiens OX=9606 GN=PIK3C2B PE=1 SV=2	1361	LKSSGRISDVFL
LKWAGPISDVFL	tr|Q0GNW5|Q0GNW5_HSPV	100	tr|F5GWN5|F5GWN5_HUMAN Phosphatidylinositol-4-phosphate 3-kinase OS=Homo sapiens OX=9606 GN=PIK3C2B PE=1 SV=1	1333	LKSSGRISDVFL
LSGITDSSSVLS	tr|Q0GNQ8|Q0GNQ8_HSPV	193	sp|O75830|SPI2_HUMAN Serpin I2 OS=Homo sapiens OX=9606 GN=SERPINI2 PE=1 SV=1	317	LSGITDSSEVYV
LSGITDSSSVLS	tr|Q0GNQ8|Q0GNQ8_HSPV	193	tr|A0A0C4DGW9|A0A0C4DGW9_HUMAN Serpin I2 OS=Homo sapiens OX=9606 GN=SERPINI2 PE=1 SV=1	327	LSGITDSSEVYV
IITVNITNLDFN	tr|Q0GNU1|Q0GNU1_HSPV	233	tr|Q8N5B3|Q8N5B3_HUMAN CDH23 protein OS=Homo sapiens OX=9606 GN=CDH23 PE=1 SV=1	761	IATVNITLLDIN
IITVNITNLDFN	tr|Q0GNU1|Q0GNU1_HSPV	233	tr|A0A0A0MS94|A0A0A0MS94_HUMAN Cadherin-23 OS=Homo sapiens OX=9606 GN=CDH23 PE=1 SV=1	761	IATVNITLLDIN
IITVNITNLDFN	tr|Q0GNU1|Q0GNU1_HSPV	233	tr|B1AVV0|B1AVV0_HUMAN Cadherin-23 OS=Homo sapiens OX=9606 GN=CDH23 PE=1 SV=3	761	IATVNITLLDIN
IITVNITNLDFN	tr|Q0GNU1|Q0GNU1_HSPV	233	tr|R4GN92|R4GN92_HUMAN Cadherin-23 (Fragment) OS=Homo sapiens OX=9606 GN=CDH23 PE=1 SV=2	572	IATVNITLLDIN
IITVNITNLDFN	tr|Q0GNU1|Q0GNU1_HSPV	233	sp|Q9H251|CAD23_HUMAN Cadherin-23 OS=Homo sapiens OX=9606 GN=CDH23 PE=1 SV=2	761	IATVNITLLDIN
IITVNITNLDFN	tr|Q0GNU1|Q0GNU1_HSPV	233	tr|A0A087X097|A0A087X097_HUMAN Cadherin-23 OS=Homo sapiens OX=9606 GN=CDH23 PE=1 SV=1	761	IATVNITLLDIN
IITVNITNLDFN	tr|Q0GNU1|Q0GNU1_HSPV	233	tr|A0A087WYR8|A0A087WYR8_HUMAN Cadherin-23 OS=Homo sapiens OX=9606 GN=CDH23 PE=1 SV=2	761	IATVNITLLDIN
ENRLKNIDLILK	tr|Q0GNX1|Q0GNX1_HSPV	263	sp|P23443|KS6B1_HUMAN Ribosomal protein S6 kinase beta-1 OS=Homo sapiens OX=9606 GN=RPS6KB1 PE=1 SV=2	296	ENRKKTIDKILK
GTLASLYMGCLM	tr|Q0GNP8|Q0GNP8_HSPV	354	sp|P01019|ANGT_HUMAN Angiotensinogen OS=Homo sapiens OX=9606 GN=AGT PE=1 SV=1	141	GTLASLYLGALD
TKSASQNSGLLK	tr|Q0GNV8|Q0GNV8_HSPV	279	sp|Q9BXX3|AN30A_HUMAN Ankyrin repeat domain-containing protein 30A OS=Homo sapiens OX=9606 GN=ANKRD30A PE=1 SV=3	1158	TKRASQYSGQLK
TKSASQNSGLLK	tr|Q0GNV8|Q0GNV8_HSPV	279	tr|Q5W026|Q5W026_HUMAN Ankyrin repeat domain-containing protein 30A OS=Homo sapiens OX=9606 GN=ANKRD30A PE=1 SV=2	1277	TKRASQYSGQLK
TKSASQNSGLLK	tr|Q0GNV8|Q0GNV8_HSPV	279	tr|R4GNA2|R4GNA2_HUMAN Ankyrin repeat domain-containing protein 30A OS=Homo sapiens OX=9606 GN=ANKRD30A PE=1 SV=1	1102	TKRASQYSGQLK
MEGKLMTRINDG	tr|Q0GP37|Q0GP37_HSPV	140	sp|Q06033|ITIH3_HUMAN Inter-alpha-trypsin inhibitor heavy chain H3 OS=Homo sapiens OX=9606 GN=ITIH3 PE=1 SV=2	354	MEDKGMTNINDG
MEGKLMTRINDG	tr|Q0GP37|Q0GP37_HSPV	140	tr|A0A087WW43|A0A087WW43_HUMAN Inter-alpha-trypsin inhibitor heavy chain H3 OS=Homo sapiens OX=9606 GN=ITIH3 PE=1 SV=1	354	MEDKGMTNINDG
MEGKLMTRINDG	tr|Q0GP37|Q0GP37_HSPV	140	tr|E7ET33|E7ET33_HUMAN Inter-alpha-trypsin inhibitor heavy chain H3 OS=Homo sapiens OX=9606 GN=ITIH3 PE=1 SV=1	354	MEDKGMTNINDG
TFGKDQRSKILP	tr|Q0GNZ8|Q0GNZ8_HSPV	231	tr|A0A1W2PQJ7|A0A1W2PQJ7_HUMAN Retinoic acid-induced protein 1 OS=Homo sapiens OX=9606 GN=RAI1 PE=1 SV=1	1089	TPGKDQRSMILR
TFGKDQRSKILP	tr|Q0GNZ8|Q0GNZ8_HSPV	231	sp|Q7Z5J4|RAI1_HUMAN Retinoic acid-induced protein 1 OS=Homo sapiens OX=9606 GN=RAI1 PE=1 SV=2	1136	TPGKDQRSMILR
RYEGGSESADLG	tr|Q0GP15|Q0GP15_HSPV	47	sp|Q9BQG1|SYT3_HUMAN Synaptotagmin-3 OS=Homo sapiens OX=9606 GN=SYT3 PE=1 SV=1	422	IVEGGSEKADLG
QICKVCVSTIYT	tr|Q0GNT6|Q0GNT6_HSPV	50	sp|Q16538|GP162_HUMAN Probable G-protein coupled receptor 162 OS=Homo sapiens OX=9606 GN=GPR162 PE=1 SV=1	88	SICKVFVSTYYT
SQGTVEPDTIDQ	tr|Q0GNZ6|Q0GNZ6_HSPV	169	sp|O76082|S22A5_HUMAN Solute carrier family 22 member 5 OS=Homo sapiens OX=9606 GN=SLC22A5 PE=1 SV=1	512	SFGTPLPDTIDQ
QLITAQLKITPN	tr|Q0GP02|Q0GP02_HSPV	228	sp|O95104|SCAF4_HUMAN SR-related and CTD-associated factor 4 OS=Homo sapiens OX=9606 GN=SCAF4 PE=1 SV=3	228	QAITAQLKTTPT
ATTALLLIEVAK	tr|Q0GP11|Q0GP11_HSPV	9	tr|H0YG27|H0YG27_HUMAN Tripartite motif-containing protein 65 (Fragment) OS=Homo sapiens OX=9606 GN=TRIM65 PE=1 SV=1	69	HTTALRSIEVAK
ATTALLLIEVAK	tr|Q0GP11|Q0GP11_HSPV	9	sp|Q6PJ69|TRI65_HUMAN Tripartite motif-containing protein 65 OS=Homo sapiens OX=9606 GN=TRIM65 PE=1 SV=3	195	HTTALRSIEVAK
ATTALLLIEVAK	tr|Q0GP11|Q0GP11_HSPV	9	tr|H0YGS7|H0YGS7_HUMAN Tripartite motif-containing protein 65 (Fragment) OS=Homo sapiens OX=9606 GN=TRIM65 PE=1 SV=1	187	HTTALRSIEVAK
EEFLTLPSNLFL	tr|Q0GP23|Q0GP23_HSPV	31	sp|Q5VVJ2|MYSM1_HUMAN Deubiquitinase MYSM1 OS=Homo sapiens OX=9606 GN=MYSM1 PE=1 SV=1	795	EEFLTEIENLFL
PDENRRLFVQNL	tr|Q0GNT8|Q0GNT8_HSPV	169	tr|H3BTJ7|H3BTJ7_HUMAN CDP-diacylglycerol--inositol 3-phosphatidyltransferase OS=Homo sapiens OX=9606 GN=CDIPT PE=4 SV=2	2	PDENIFLFVPNL
PDENRRLFVQNL	tr|Q0GNT8|Q0GNT8_HSPV	169	tr|H3BUR9|H3BUR9_HUMAN CDP-diacylglycerol--inositol 3-phosphatidyltransferase OS=Homo sapiens OX=9606 GN=CDIPT PE=1 SV=1	2	PDENIFLFVPNL
PDENRRLFVQNL	tr|Q0GNT8|Q0GNT8_HSPV	169	sp|O14735|CDIPT_HUMAN CDP-diacylglycerol--inositol 3-phosphatidyltransferase OS=Homo sapiens OX=9606 GN=CDIPT PE=1 SV=1	2	PDENIFLFVPNL
PSVEVRMPFVLQ	tr|Q0GP29|Q0GP29_HSPV	124	tr|H3BP95|H3BP95_HUMAN Nuclear pore complex protein Nup93 (Fragment) OS=Homo sapiens OX=9606 GN=NUP93 PE=1 SV=1	123	SSVEVRMEFVRQ
PSVEVRMPFVLQ	tr|Q0GP29|Q0GP29_HSPV	124	tr|H3BPA9|H3BPA9_HUMAN Nuclear pore complex protein Nup93 (Fragment) OS=Homo sapiens OX=9606 GN=NUP93 PE=1 SV=8	39	SSVEVRMEFVRQ
PSVEVRMPFVLQ	tr|Q0GP29|Q0GP29_HSPV	124	tr|H3BVG0|H3BVG0_HUMAN Nuclear pore complex protein Nup93 OS=Homo sapiens OX=9606 GN=NUP93 PE=1 SV=1	246	SSVEVRMEFVRQ
PSVEVRMPFVLQ	tr|Q0GP29|Q0GP29_HSPV	124	sp|Q8N1F7|NUP93_HUMAN Nuclear pore complex protein Nup93 OS=Homo sapiens OX=9606 GN=NUP93 PE=1 SV=2	246	SSVEVRMEFVRQ
DKEDDVEEVTLK	tr|Q0GP19|Q0GP19_HSPV	445	tr|H0Y760|H0Y760_HUMAN Helicase ARIP4 (Fragment) OS=Homo sapiens OX=9606 GN=RAD54L2 PE=1 SV=1	1285	DKDDDVIEVTGK
DKEDDVEEVTLK	tr|Q0GP19|Q0GP19_HSPV	445	sp|Q9Y4B4|ARIP4_HUMAN Helicase ARIP4 OS=Homo sapiens OX=9606 GN=RAD54L2 PE=1 SV=4	1456	DKDDDVIEVTGK
LKFAARYNKFLY	tr|Q0GNX7|Q0GNX7_HSPV	72	sp|Q15672|TWST1_HUMAN Twist-related protein 1 OS=Homo sapiens OX=9606 GN=TWIST1 PE=1 SV=1	149	LKLAARYIDFLY
LKFAARYNKFLY	tr|Q0GNX7|Q0GNX7_HSPV	72	tr|H7C4D7|H7C4D7_HUMAN Twist-related protein 1 (Fragment) OS=Homo sapiens OX=9606 GN=TWIST1 PE=1 SV=1	17	LKLAARYIDFLY
LKFAARYNKFLY	tr|Q0GNX7|Q0GNX7_HSPV	72	tr|H7BY00|H7BY00_HUMAN Twist-related protein 1 (Fragment) OS=Homo sapiens OX=9606 GN=TWIST1 PE=1 SV=1	82	LKLAARYIDFLY
LKFAARYNKFLY	tr|Q0GNX7|Q0GNX7_HSPV	72	sp|Q8WVJ9|TWST2_HUMAN Twist-related protein 2 OS=Homo sapiens OX=9606 GN=TWIST2 PE=1 SV=1	107	LKLAARYIDFLY
ILPLERLTIELV	tr|Q0GP43|Q0GP43_HSPV	304	tr|D6RG15|D6RG15_HUMAN Twinfilin-2 OS=Homo sapiens OX=9606 GN=TWF2 PE=1 SV=1	204	KLDLERETIELV
ILPLERLTIELV	tr|Q0GP43|Q0GP43_HSPV	304	tr|H0Y858|H0Y858_HUMAN Toll-like receptor 9 (Fragment) OS=Homo sapiens OX=9606 PE=3 SV=1	65	KLDLERETIELV
ILPLERLTIELV	tr|Q0GP43|Q0GP43_HSPV	304	sp|Q6IBS0|TWF2_HUMAN Twinfilin-2 OS=Homo sapiens OX=9606 GN=TWF2 PE=1 SV=2	204	KLDLERETIELV
ALSLEEYLYLTE	tr|Q0GNX8|Q0GNX8_HSPV	158	sp|Q14494|NF2L1_HUMAN Endoplasmic reticulum membrane sensor NFE2L1 OS=Homo sapiens OX=9606 GN=NFE2L1 PE=1 SV=1	250	ALSLEECLRLLE
ALSLEEYLYLTE	tr|Q0GNX8|Q0GNX8_HSPV	158	tr|J9JIE5|J9JIE5_HUMAN Endoplasmic reticulum membrane sensor NFE2L1 OS=Homo sapiens OX=9606 GN=NFE2L1 PE=1 SV=1	239	ALSLEECLRLLE
GRLARSTFRLII	tr|Q0GP19|Q0GP19_HSPV	593	sp|Q7Z2G1|H2BWT_HUMAN Histone H2B type W-T OS=Homo sapiens OX=9606 GN=H2BW1 PE=1 SV=2	122	GRLARSTKRQTI
TALLLIEVAKGP	tr|Q0GP11|Q0GP11_HSPV	11	sp|Q9P1W8|SIRPG_HUMAN Signal-regulatory protein gamma OS=Homo sapiens OX=9606 GN=SIRPG PE=1 SV=3	367	TALLLIAVLLGP
NAAVNNLLLRDV	tr|Q0GNR0|Q0GNR0_HSPV	502	tr|E7EMW7|E7EMW7_HUMAN E3 ubiquitin-protein ligase UBR5 OS=Homo sapiens OX=9606 GN=UBR5 PE=1 SV=1	217	NLAVNNLLSRDD
NAAVNNLLLRDV	tr|Q0GNR0|Q0GNR0_HSPV	502	sp|O95071|UBR5_HUMAN E3 ubiquitin-protein ligase UBR5 OS=Homo sapiens OX=9606 GN=UBR5 PE=1 SV=2	217	NLAVNNLLSRDD
YLDHKPTLKLLL	tr|Q0GNU6|Q0GNU6_HSPV	292	tr|A0A2R8Y7H0|A0A2R8Y7H0_HUMAN Sodium channel protein OS=Homo sapiens OX=9606 GN=SCN10A PE=1 SV=1	1175	YLDQKPTVKALL
YLDHKPTLKLLL	tr|Q0GNU6|Q0GNU6_HSPV	292	sp|Q9Y5Y9|SCNAA_HUMAN Sodium channel protein type 10 subunit alpha OS=Homo sapiens OX=9606 GN=SCN10A PE=1 SV=2	1175	YLDQKPTVKALL
YLDHKPTLKLLL	tr|Q0GNU6|Q0GNU6_HSPV	292	tr|A0A590UJM0|A0A590UJM0_HUMAN Sodium channel protein OS=Homo sapiens OX=9606 GN=SCN10A PE=3 SV=1	1183	YLDQKPTVKALL
YLDHKPTLKLLL	tr|Q0GNU6|Q0GNU6_HSPV	292	tr|A0A2R8Y6J6|A0A2R8Y6J6_HUMAN Sodium channel protein OS=Homo sapiens OX=9606 GN=SCN10A PE=1 SV=1	1174	YLDQKPTVKALL
SAALNSKRYPLL	tr|Q0GNY2|Q0GNY2_HSPV	116	sp|Q9Y6R9|CCD61_HUMAN Centrosomal protein CCDC61 OS=Homo sapiens OX=9606 GN=CCDC61 PE=1 SV=3	111	SAQLNSKRYLIL
RLLGILLDLIRD	tr|Q0GNP8|Q0GNP8_HSPV	254	sp|P20020|AT2B1_HUMAN Plasma membrane calcium-transporting ATPase 1 OS=Homo sapiens OX=9606 GN=ATP2B1 PE=1 SV=4	548	ALLGLLLDLKRD
RLLGILLDLIRD	tr|Q0GNP8|Q0GNP8_HSPV	254	tr|E7ERY9|E7ERY9_HUMAN Calcium-transporting ATPase OS=Homo sapiens OX=9606 GN=ATP2B1 PE=1 SV=2	291	ALLGLLLDLKRD
LYSLNSRRESGF	tr|Q0GNM8|Q0GNM8_HSPV	1642	sp|Q9Y4D2|DGLA_HUMAN Diacylglycerol lipase-alpha OS=Homo sapiens OX=9606 GN=DAGLA PE=1 SV=3	789	LYSFDSRRSSGF
KDVISIDKTRTN	tr|Q0GNN6|Q0GNN6_HSPV	52	sp|P62701|RS4X_HUMAN 40S ribosomal protein S4, X isoform OS=Homo sapiens OX=9606 GN=RPS4X PE=1 SV=2	87	MDVISIDKTGEN
IWLLLYEPISGE	tr|Q0GP56|Q0GP56_HSPV	9	sp|Q9H269|VPS16_HUMAN Vacuolar protein sorting-associated protein 16 homolog OS=Homo sapiens OX=9606 GN=VPS16 PE=1 SV=2	536	IKLLEYEPRSGE
DMSLSFFEFDVD	tr|Q0GNU1|Q0GNU1_HSPV	366	tr|A0A2R8YFA9|A0A2R8YFA9_HUMAN F-actin monooxygenase OS=Homo sapiens OX=9606 GN=MICAL2 PE=1 SV=1	208	DHSLSEFEFDVI
DMSLSFFEFDVD	tr|Q0GNU1|Q0GNU1_HSPV	366	sp|O94851|MICA2_HUMAN [F-actin]-monooxygenase MICAL2 OS=Homo sapiens OX=9606 GN=MICAL2 PE=1 SV=1	208	DHSLSEFEFDVI
KGKDETVMYSVP	tr|Q0GNU6|Q0GNU6_HSPV	379	sp|Q6DN72|FCRL6_HUMAN Fc receptor-like protein 6 OS=Homo sapiens OX=9606 GN=FCRL6 PE=1 SV=2	363	KGKDEGVVYSVV
KVLETVELVLRL	tr|Q0GNT6|Q0GNT6_HSPV	129	sp|Q08379|GOGA2_HUMAN Golgin subfamily A member 2 OS=Homo sapiens OX=9606 GN=GOLGA2 PE=1 SV=3	881	KLLELQELVLRL
KVLETVELVLRL	tr|Q0GNT6|Q0GNT6_HSPV	129	tr|A0A6Q8KRG2|A0A6Q8KRG2_HUMAN Golgin subfamily A member 2 OS=Homo sapiens OX=9606 GN=GOLGA2 PE=1 SV=1	869	KLLELQELVLRL
KVLETVELVLRL	tr|Q0GNT6|Q0GNT6_HSPV	129	tr|A0A087WYC0|A0A087WYC0_HUMAN Golgin subfamily A member 2 OS=Homo sapiens OX=9606 GN=GOLGA2 PE=1 SV=1	165	KLLELQELVLRL
DKSPSSQFSLQF	tr|Q0GNX2|Q0GNX2_HSPV	93	sp|Q5VT06|CE350_HUMAN Centrosome-associated protein 350 OS=Homo sapiens OX=9606 GN=CEP350 PE=1 SV=1	1257	PLSPSSQKSLQF
NNLKLISRGLKE	tr|Q0GNX8|Q0GNX8_HSPV	780	sp|P16383|GCFC2_HUMAN Intron Large complex component GCFC2 OS=Homo sapiens OX=9606 GN=GCFC2 PE=1 SV=2	510	NPLKLESTGLKE
TKNKVRILGCAK	tr|Q0GP07|Q0GP07_HSPV	74	sp|O95405|ZFYV9_HUMAN Zinc finger FYVE domain-containing protein 9 OS=Homo sapiens OX=9606 GN=ZFYVE9 PE=1 SV=2	611	TKNKNDILGKAK
NNDSFTIVSSGD	tr|Q0GNX3|Q0GNX3_HSPV	389	sp|P48552|NRIP1_HUMAN Nuclear receptor-interacting protein 1 OS=Homo sapiens OX=9606 GN=NRIP1 PE=1 SV=2	420	NNPSFTDDSSGD
TKGTTSEILSNN	tr|Q0GNM8|Q0GNM8_HSPV	882	sp|Q92769|HDAC2_HUMAN Histone deacetylase 2 OS=Homo sapiens OX=9606 GN=HDAC2 PE=1 SV=2	477	TKGTKSEQLSNP
KRKLSGALAFET	tr|Q0GNW7|Q0GNW7_HSPV	227	sp|Q9UI36|DACH1_HUMAN Dachshund homolog 1 OS=Homo sapiens OX=9606 GN=DACH1 PE=1 SV=4	689	KRKLQEALEFET
DNSTILSDLNSN	tr|Q0GP83|Q0GP83_HSPV	42	sp|Q99570|PI3R4_HUMAN Phosphoinositide 3-kinase regulatory subunit 4 OS=Homo sapiens OX=9606 GN=PIK3R4 PE=1 SV=3	217	DPSTPLVDLNSN
GCFMTCALNESQ	tr|Q0GNX4|Q0GNX4_HSPV	427	sp|P24593|IBP5_HUMAN Insulin-like growth factor-binding protein 5 OS=Homo sapiens OX=9606 GN=IGFBP5 PE=1 SV=1	54	GCCMTCALAEGQ
GCFMTCALNESQ	tr|Q0GNX4|Q0GNX4_HSPV	427	tr|C9JXX4|C9JXX4_HUMAN Insulin-like growth factor-binding protein 5 (Fragment) OS=Homo sapiens OX=9606 GN=IGFBP5 PE=1 SV=1	54	GCCMTCALAEGQ
DIIIVGLTAKVK	tr|Q0GP90|Q0GP90_HSPV	196	sp|Q09666|AHNK_HUMAN Neuroblast differentiation-associated protein AHNAK OS=Homo sapiens OX=9606 GN=AHNAK PE=1 SV=2	5172	DINIEGLDAKVK
