query	query_seqname	query_start	target_seqname	target_start	target
VVAVVVAAEVCH	sp|P13889|POLN_RUBVT	748	sp|P54753|EPHB3_HUMAN Ephrin type-B receptor 3 OS=Homo sapiens OX=9606 GN=EPHB3 PE=1 SV=2	571	VVAVVVIAIVCL
AFPVAGTAGATH	sp|P13889|POLN_RUBVT	722	tr|A0A1B0GVY9|A0A1B0GVY9_HUMAN KIF-binding protein OS=Homo sapiens OX=9606 GN=KIFBP PE=1 SV=1	176	AFIVAGTTGACH
EEPEERDRLRGV	sp|P13889|POLN_RUBVT	509	tr|E9PIM1|E9PIM1_HUMAN Cleavage and polyadenylation-specificity factor subunit 1 OS=Homo sapiens OX=9606 GN=CPSF1 PE=1 SV=3	124	EEPELRDRAAGV
AAPVVAAIALGR	sp|P07566|POLS_RUBVT	295	sp|P08908|5HT1A_HUMAN 5-hydroxytryptamine receptor 1A OS=Homo sapiens OX=9606 GN=HTR1A PE=1 SV=3	54	NACVVAAIALER
SGDVRAAAAVEA	sp|P13889|POLN_RUBVT	1047	tr|B4DLN1|B4DLN1_HUMAN cDNA FLJ60124, highly similar to Mitochondrial dicarboxylate carrier OS=Homo sapiens OX=9606 PE=2 SV=1	105	SGAVPAAAAQEA
SGDVRAAAAVEA	sp|P13889|POLN_RUBVT	1047	sp|P52815|RM12_HUMAN 39S ribosomal protein L12, mitochondrial OS=Homo sapiens OX=9606 GN=MRPL12 PE=1 SV=2	105	SGAVPAAAAQEA
LRAATPDREGVP	sp|P13889|POLN_RUBVT	646	tr|A0A0J9YWB6|A0A0J9YWB6_HUMAN RNA polymerase II subunit A C-terminal domain phosphatase (Fragment) OS=Homo sapiens OX=9606 GN=CTDP1 PE=1 SV=1	740	SPAAFPDREGVP
LRAATPDREGVP	sp|P13889|POLN_RUBVT	646	tr|A0A0J9YWJ4|A0A0J9YWJ4_HUMAN RNA polymerase II subunit A C-terminal domain phosphatase (Fragment) OS=Homo sapiens OX=9606 GN=CTDP1 PE=1 SV=1	672	SPAAFPDREGVP
LRAATPDREGVP	sp|P13889|POLN_RUBVT	646	tr|K7EJD2|K7EJD2_HUMAN RNA polymerase II subunit A C-terminal domain phosphatase (Fragment) OS=Homo sapiens OX=9606 GN=CTDP1 PE=1 SV=1	672	SPAAFPDREGVP
LRAATPDREGVP	sp|P13889|POLN_RUBVT	646	tr|A0A0A0MR03|A0A0A0MR03_HUMAN RNA polymerase II subunit A C-terminal domain phosphatase OS=Homo sapiens OX=9606 GN=CTDP1 PE=1 SV=1	621	SPAAFPDREGVP
LRAATPDREGVP	sp|P13889|POLN_RUBVT	646	sp|Q9Y5B0|CTDP1_HUMAN RNA polymerase II subunit A C-terminal domain phosphatase OS=Homo sapiens OX=9606 GN=CTDP1 PE=1 SV=3	740	SPAAFPDREGVP
RAAADVLRRHHG	sp|P13889|POLN_RUBVT	1838	sp|Q9UBN4|TRPC4_HUMAN Short transient receptor potential channel 4 OS=Homo sapiens OX=9606 GN=TRPC4 PE=1 SV=1	694	RRAADNLRRHHQ
YRGEAAAAPRLT	sp|P13889|POLN_RUBVT	1803	tr|A0A1W2PQW2|A0A1W2PQW2_HUMAN Voltage-dependent T-type calcium channel subunit alpha-1H OS=Homo sapiens OX=9606 GN=CACNA1H PE=1 SV=1	1552	ARGEAAAAPREE
AARPVTAGRAVG	sp|P07566|POLS_RUBVT	883	sp|Q9P258|RCC2_HUMAN Protein RCC2 OS=Homo sapiens OX=9606 GN=RCC2 PE=1 SV=2	69	AARPATAGKAGG
AARPVTAGRAVG	sp|P07566|POLS_RUBVT	883	tr|A0A494BZR8|A0A494BZR8_HUMAN Eukaryotic translation initiation factor 2-alpha kinase 3 (Fragment) OS=Homo sapiens OX=9606 GN=EIF2AK3 PE=1 SV=1	24	AARTVAAGRARG
AARPVTAGRAVG	sp|P07566|POLS_RUBVT	883	sp|Q9NZJ5|E2AK3_HUMAN Eukaryotic translation initiation factor 2-alpha kinase 3 OS=Homo sapiens OX=9606 GN=EIF2AK3 PE=1 SV=3	24	AARTVAAGRARG
AARPVTAGRAVG	sp|P07566|POLS_RUBVT	883	tr|A0A494C186|A0A494C186_HUMAN Eukaryotic translation initiation factor 2-alpha kinase 3 OS=Homo sapiens OX=9606 GN=EIF2AK3 PE=4 SV=1	24	AARTVAAGRARG
RTMTLATVDCRP	sp|P13889|POLN_RUBVT	2000	sp|P60507|EFC1_HUMAN Endogenous retrovirus group FC1 Env polyprotein OS=Homo sapiens OX=9606 GN=ERVFC1 PE=1 SV=1	48	STVTLATVDCQP
LGEYLAAARSGD	sp|P13889|POLN_RUBVT	1155	tr|A6NG92|A6NG92_HUMAN CCDC144A protein OS=Homo sapiens OX=9606 GN=CCDC144A PE=2 SV=4	81	LGELHRAARSGD
LGEYLAAARSGD	sp|P13889|POLN_RUBVT	1155	tr|C9JT67|C9JT67_HUMAN Coiled-coil domain-containing protein 144A OS=Homo sapiens OX=9606 GN=CCDC144A PE=4 SV=1	81	LGELHRAARSGD
LGEYLAAARSGD	sp|P13889|POLN_RUBVT	1155	sp|A2RUR9|C144A_HUMAN Coiled-coil domain-containing protein 144A OS=Homo sapiens OX=9606 GN=CCDC144A PE=2 SV=1	81	LGELHRAARSGD
LGEYLAAARSGD	sp|P13889|POLN_RUBVT	1155	tr|A0A087WSY3|A0A087WSY3_HUMAN Coiled-coil domain-containing protein 144A OS=Homo sapiens OX=9606 GN=CCDC144A PE=4 SV=1	81	LGELHRAARSGD
LGEYLAAARSGD	sp|P13889|POLN_RUBVT	1155	tr|A6NJB5|A6NJB5_HUMAN Coiled-coil domain-containing protein 144A OS=Homo sapiens OX=9606 GN=CCDC144A PE=4 SV=2	81	LGELHRAARSGD
LGEYLAAARSGD	sp|P13889|POLN_RUBVT	1155	sp|Q6NUI1|C144L_HUMAN Putative coiled-coil domain-containing protein 144 N-terminal-like OS=Homo sapiens OX=9606 GN=CCDC144NL PE=5 SV=1	81	LGELHRAARSGD
LGEYLAAARSGD	sp|P13889|POLN_RUBVT	1155	sp|Q3MJ40|C144B_HUMAN Coiled-coil domain-containing protein 144B OS=Homo sapiens OX=9606 GN=CCDC144B PE=2 SV=1	81	LGELHRAARSGD
LGEYLAAARSGD	sp|P13889|POLN_RUBVT	1155	sp|Q8IYA2|C144C_HUMAN Putative coiled-coil domain-containing protein 144C OS=Homo sapiens OX=9606 GN=CCDC144CP PE=5 SV=3	81	LGELHRAARSGD
GDPRQPLAPRNL	sp|P13889|POLN_RUBVT	2023	tr|A0A0G2JIN1|A0A0G2JIN1_HUMAN Choline transporter-like protein 4 (Fragment) OS=Homo sapiens OX=9606 GN=SLC44A4 PE=1 SV=1	55	GDPRQVLYPRNS
GDPRQPLAPRNL	sp|P13889|POLN_RUBVT	2023	sp|Q53GD3|CTL4_HUMAN Choline transporter-like protein 4 OS=Homo sapiens OX=9606 GN=SLC44A4 PE=1 SV=2	59	GDPRQVLYPRNS
GDPRQPLAPRNL	sp|P13889|POLN_RUBVT	2023	tr|H0Y5I3|H0Y5I3_HUMAN Choline transporter-like protein 4 (Fragment) OS=Homo sapiens OX=9606 GN=SLC44A4 PE=1 SV=1	55	GDPRQVLYPRNS
PHAARYGAGAGG	sp|P13889|POLN_RUBVT	1206	tr|H3BRD8|H3BRD8_HUMAN Golgi apparatus protein 1 (Fragment) OS=Homo sapiens OX=9606 GN=GLG1 PE=1 SV=1	60	PPARRGGAGAGG
PHAARYGAGAGG	sp|P13889|POLN_RUBVT	1206	tr|H3BQU9|H3BQU9_HUMAN Golgi apparatus protein 1 OS=Homo sapiens OX=9606 GN=GLG1 PE=1 SV=1	97	PPARRGGAGAGG
PHAARYGAGAGG	sp|P13889|POLN_RUBVT	1206	tr|H3BM42|H3BM42_HUMAN Golgi apparatus protein 1 OS=Homo sapiens OX=9606 GN=GLG1 PE=1 SV=1	97	PPARRGGAGAGG
PHAARYGAGAGG	sp|P13889|POLN_RUBVT	1206	sp|Q92896|GSLG1_HUMAN Golgi apparatus protein 1 OS=Homo sapiens OX=9606 GN=GLG1 PE=1 SV=2	97	PPARRGGAGAGG
LNCPELAREESV	sp|P13889|POLN_RUBVT	184	sp|Q2KHT3|CL16A_HUMAN Protein CLEC16A OS=Homo sapiens OX=9606 GN=CLEC16A PE=1 SV=2	586	LACLEGAREESV
VESRLRDALRGG	sp|P13889|POLN_RUBVT	1099	tr|D6RB21|D6RB21_HUMAN Testican-1 (Fragment) OS=Homo sapiens OX=9606 GN=SPOCK1 PE=1 SV=1	19	VESRHLDALAGG
VESRLRDALRGG	sp|P13889|POLN_RUBVT	1099	sp|Q08629|TICN1_HUMAN Testican-1 OS=Homo sapiens OX=9606 GN=SPOCK1 PE=1 SV=1	19	VESRHLDALAGG
PARGANIAEISV	sp|P13889|POLN_RUBVT	1541	sp|Q9Y619|ORNT1_HUMAN Mitochondrial ornithine transporter 1 OS=Homo sapiens OX=9606 GN=SLC25A15 PE=1 SV=1	69	PALIANIAENSV
PARGANIAEISV	sp|P13889|POLN_RUBVT	1541	tr|Q5VZD9|Q5VZD9_HUMAN Mitochondrial ornithine transporter 1 (Fragment) OS=Homo sapiens OX=9606 GN=SLC25A15 PE=1 SV=1	69	PALIANIAENSV
LQFITSTLSYGG	sp|P07566|POLS_RUBVT	341	tr|I3L3S2|I3L3S2_HUMAN Zinc finger CCCH domain-containing protein 7A (Fragment) OS=Homo sapiens OX=9606 GN=ZC3H7A PE=1 SV=1	19	LQFIQSPLSYPG
LQFITSTLSYGG	sp|P07566|POLS_RUBVT	341	tr|I3L3F9|I3L3F9_HUMAN Zinc finger CCCH domain-containing protein 7A (Fragment) OS=Homo sapiens OX=9606 GN=ZC3H7A PE=1 SV=1	19	LQFIQSPLSYPG
LQFITSTLSYGG	sp|P07566|POLS_RUBVT	341	tr|I3L1Y3|I3L1Y3_HUMAN Zinc finger CCCH domain-containing protein 7A (Fragment) OS=Homo sapiens OX=9606 GN=ZC3H7A PE=1 SV=1	19	LQFIQSPLSYPG
LQFITSTLSYGG	sp|P07566|POLS_RUBVT	341	tr|I3L382|I3L382_HUMAN Zinc finger CCCH domain-containing protein 7A (Fragment) OS=Homo sapiens OX=9606 GN=ZC3H7A PE=1 SV=8	19	LQFIQSPLSYPG
LQFITSTLSYGG	sp|P07566|POLS_RUBVT	341	tr|I3L2K5|I3L2K5_HUMAN Zinc finger CCCH domain-containing protein 7A (Fragment) OS=Homo sapiens OX=9606 GN=ZC3H7A PE=1 SV=1	19	LQFIQSPLSYPG
LQFITSTLSYGG	sp|P07566|POLS_RUBVT	341	sp|Q8IWR0|Z3H7A_HUMAN Zinc finger CCCH domain-containing protein 7A OS=Homo sapiens OX=9606 GN=ZC3H7A PE=1 SV=1	19	LQFIQSPLSYPG
AARYGAGAGGVR	sp|P13889|POLN_RUBVT	1208	sp|P0CJ78|ZN865_HUMAN Zinc finger protein 865 OS=Homo sapiens OX=9606 GN=ZNF865 PE=1 SV=1	427	AAHAGAGAGGPR
RPRPLARGYRAA	sp|P13889|POLN_RUBVT	1229	tr|A2AB15|A2AB15_HUMAN Pre-mRNA-splicing factor ATP-dependent RNA helicase DHX16 (Fragment) OS=Homo sapiens OX=9606 GN=DHX16 PE=1 SV=1	215	RVRDLAREYRAA
RPRPLARGYRAA	sp|P13889|POLN_RUBVT	1229	tr|A0A140T947|A0A140T947_HUMAN Pre-mRNA-splicing factor ATP-dependent RNA helicase DHX16 (Fragment) OS=Homo sapiens OX=9606 GN=DHX16 PE=1 SV=1	275	RVRDLAREYRAA
RPRPLARGYRAA	sp|P13889|POLN_RUBVT	1229	sp|O60231|DHX16_HUMAN Pre-mRNA-splicing factor ATP-dependent RNA helicase DHX16 OS=Homo sapiens OX=9606 GN=DHX16 PE=1 SV=2	275	RVRDLAREYRAA
