query	query_seqname	query_start	target_seqname	target_start	target
TEIFMKIPQLLL	sp|P03433|PA_I34A1	652	tr|K7ENY4|K7ENY4_HUMAN Ras-related protein Rab-5C (Fragment) OS=Homo sapiens OX=9606 GN=RAB5C PE=1 SV=1	103	NEIFMAIGQLLL
FGGHEDDLGRIL	sp|P03468|NRAM_I34A1	38	sp|Q9H720|PG2IP_HUMAN PGAP2-interacting protein OS=Homo sapiens OX=9606 GN=CWH43 PE=2 SV=2	549	FGNHEDDLDRKL
FGGHEDDLGRIL	sp|P03468|NRAM_I34A1	38	tr|E7EQL2|E7EQL2_HUMAN PGAP2-interacting protein OS=Homo sapiens OX=9606 GN=CWH43 PE=1 SV=1	522	FGNHEDDLDRKL
GCSIDVSSAVIV	sp|P03468|NRAM_I34A1	81	sp|A6NHC0|CAN8_HUMAN Calpain-8 OS=Homo sapiens OX=9606 GN=CAPN8 PE=1 SV=3	239	GCSIDVSSAAEA
GCSIDVSSAVIV	sp|P03468|NRAM_I34A1	81	tr|B1B154|B1B154_HUMAN Calpain-8 OS=Homo sapiens OX=9606 GN=CAPN8 PE=1 SV=1	239	GCSIDVSSAAEA
GCSIDVSSAVIV	sp|P03468|NRAM_I34A1	81	tr|H0YEJ4|H0YEJ4_HUMAN Calpain-8 (Fragment) OS=Homo sapiens OX=9606 GN=CAPN8 PE=1 SV=1	112	GCSIDVSSAAEA
GCSIDVSSAVIV	sp|P03468|NRAM_I34A1	81	sp|Q9H0S4|DDX47_HUMAN Probable ATP-dependent RNA helicase DDX47 OS=Homo sapiens OX=9606 GN=DDX47 PE=1 SV=1	116	GSSIGVQSAVIV
LPERKMLSCTEF	sp|P0CK64|PAX_I34A1	40	tr|A0A075B754|A0A075B754_HUMAN ATPase family AAA domain-containing protein 5 OS=Homo sapiens OX=9606 GN=ATAD5 PE=1 SV=1	737	LPERKKLSETED
LPERKMLSCTEF	sp|P0CK64|PAX_I34A1	40	sp|Q96QE3|ATAD5_HUMAN ATPase family AAA domain-containing protein 5 OS=Homo sapiens OX=9606 GN=ATAD5 PE=1 SV=4	737	LPERKKLSETED
LLLSLLILKQRG	sp|P0DOG6|PB2S1_I34A1	171	tr|H3BLT0|H3BLT0_HUMAN Receptor protein-tyrosine kinase (Fragment) OS=Homo sapiens OX=9606 GN=ERBB4 PE=1 SV=1	430	SGLSLLILKQQG
LLLSLLILKQRG	sp|P0DOG6|PB2S1_I34A1	171	tr|A0A0A0MSE1|A0A0A0MSE1_HUMAN Receptor protein-tyrosine kinase OS=Homo sapiens OX=9606 GN=ERBB4 PE=1 SV=2	404	SGLSLLILKQQG
LLLSLLILKQRG	sp|P0DOG6|PB2S1_I34A1	171	sp|Q15303|ERBB4_HUMAN Receptor tyrosine-protein kinase erbB-4 OS=Homo sapiens OX=9606 GN=ERBB4 PE=1 SV=1	430	SGLSLLILKQQG
SVGSPKSGENAL	sp|P03452|HEMA_I34A1	123	tr|A0A2R8Y7U0|A0A2R8Y7U0_HUMAN GATOR complex protein DEPDC5 OS=Homo sapiens OX=9606 GN=DEPDC5 PE=1 SV=1	442	SLGSPKESENAL
SVGSPKSGENAL	sp|P03452|HEMA_I34A1	123	tr|A0A2R8Y6H8|A0A2R8Y6H8_HUMAN GATOR complex protein DEPDC5 OS=Homo sapiens OX=9606 GN=DEPDC5 PE=1 SV=1	442	SLGSPKESENAL
SVGSPKSGENAL	sp|P03452|HEMA_I34A1	123	tr|A0A2R8YF50|A0A2R8YF50_HUMAN Uncharacterized protein OS=Homo sapiens OX=9606 PE=4 SV=1	414	SLGSPKESENAL
SVGSPKSGENAL	sp|P03452|HEMA_I34A1	123	tr|A0A2R8Y721|A0A2R8Y721_HUMAN GATOR complex protein DEPDC5 OS=Homo sapiens OX=9606 GN=DEPDC5 PE=1 SV=1	442	SLGSPKESENAL
SVGSPKSGENAL	sp|P03452|HEMA_I34A1	123	tr|A0A2R8Y6H3|A0A2R8Y6H3_HUMAN GATOR complex protein DEPDC5 OS=Homo sapiens OX=9606 GN=DEPDC5 PE=1 SV=1	442	SLGSPKESENAL
SVGSPKSGENAL	sp|P03452|HEMA_I34A1	123	tr|A0A5F9UWT1|A0A5F9UWT1_HUMAN GATOR complex protein DEPDC5 OS=Homo sapiens OX=9606 GN=DEPDC5 PE=1 SV=1	442	SLGSPKESENAL
SVGSPKSGENAL	sp|P03452|HEMA_I34A1	123	tr|A0A2R8Y842|A0A2R8Y842_HUMAN GATOR complex protein DEPDC5 OS=Homo sapiens OX=9606 GN=DEPDC5 PE=1 SV=1	442	SLGSPKESENAL
SVGSPKSGENAL	sp|P03452|HEMA_I34A1	123	tr|A0A2R8YF97|A0A2R8YF97_HUMAN GATOR complex protein DEPDC5 (Fragment) OS=Homo sapiens OX=9606 GN=DEPDC5 PE=1 SV=1	442	SLGSPKESENAL
SVGSPKSGENAL	sp|P03452|HEMA_I34A1	123	tr|A0A2R8Y5T1|A0A2R8Y5T1_HUMAN GATOR complex protein DEPDC5 OS=Homo sapiens OX=9606 GN=DEPDC5 PE=1 SV=1	442	SLGSPKESENAL
SVGSPKSGENAL	sp|P03452|HEMA_I34A1	123	tr|A0A2R8Y6V4|A0A2R8Y6V4_HUMAN GATOR complex protein DEPDC5 OS=Homo sapiens OX=9606 GN=DEPDC5 PE=1 SV=1	442	SLGSPKESENAL
SVGSPKSGENAL	sp|P03452|HEMA_I34A1	123	tr|A0A2R8Y5K9|A0A2R8Y5K9_HUMAN GATOR complex protein DEPDC5 (Fragment) OS=Homo sapiens OX=9606 GN=DEPDC5 PE=1 SV=1	414	SLGSPKESENAL
SVGSPKSGENAL	sp|P03452|HEMA_I34A1	123	sp|O75140|DEPD5_HUMAN GATOR complex protein DEPDC5 OS=Homo sapiens OX=9606 GN=DEPDC5 PE=1 SV=2	442	SLGSPKESENAL
SVGSPKSGENAL	sp|P03452|HEMA_I34A1	123	tr|H0Y770|H0Y770_HUMAN GATOR complex protein DEPDC5 OS=Homo sapiens OX=9606 GN=DEPDC5 PE=1 SV=2	414	SLGSPKESENAL
SVGSPKSGENAL	sp|P03452|HEMA_I34A1	123	tr|A0A2R8YEW8|A0A2R8YEW8_HUMAN GATOR complex protein DEPDC5 OS=Homo sapiens OX=9606 GN=DEPDC5 PE=1 SV=1	442	SLGSPKESENAL
SVGSPKSGENAL	sp|P03452|HEMA_I34A1	123	tr|A0A2R8Y7U6|A0A2R8Y7U6_HUMAN GATOR complex protein DEPDC5 OS=Homo sapiens OX=9606 GN=DEPDC5 PE=1 SV=1	442	SLGSPKESENAL
SVGSPKSGENAL	sp|P03452|HEMA_I34A1	123	tr|A0A2R8Y5E9|A0A2R8Y5E9_HUMAN GATOR complex protein DEPDC5 (Fragment) OS=Homo sapiens OX=9606 GN=DEPDC5 PE=1 SV=1	442	SLGSPKESENAL
SVGSPKSGENAL	sp|P03452|HEMA_I34A1	123	tr|A0A2R8Y5P2|A0A2R8Y5P2_HUMAN GATOR complex protein DEPDC5 OS=Homo sapiens OX=9606 GN=DEPDC5 PE=4 SV=1	414	SLGSPKESENAL
SVGSPKSGENAL	sp|P03452|HEMA_I34A1	123	sp|O60292|SI1L3_HUMAN Signal-induced proliferation-associated 1-like protein 3 OS=Homo sapiens OX=9606 GN=SIPA1L3 PE=1 SV=3	448	SVGSPSSGEGHL
EEQSEDVPGLAE	sp|P03428|PB2_I34A1	599	sp|Q6PIF6|MYO7B_HUMAN Unconventional myosin-VIIb OS=Homo sapiens OX=9606 GN=MYO7B PE=1 SV=2	959	EEPEEDVDGLAE
TLHVKRISDLGQ	sp|P0C0U1|PB1F2_I34A1	47	sp|O94967|WDR47_HUMAN WD repeat-containing protein 47 OS=Homo sapiens OX=9606 GN=WDR47 PE=1 SV=1	325	TSHDKRISDLGN
TLHVKRISDLGQ	sp|P0C0U1|PB1F2_I34A1	47	tr|A0A0A0MRE6|A0A0A0MRE6_HUMAN WD repeat-containing protein 47 OS=Homo sapiens OX=9606 GN=WDR47 PE=1 SV=1	297	TSHDKRISDLGN
EIFMKIPQLLLK	sp|P03433|PA_I34A1	653	tr|K7ENY4|K7ENY4_HUMAN Ras-related protein Rab-5C (Fragment) OS=Homo sapiens OX=9606 GN=RAB5C PE=1 SV=1	104	EIFMAIGQLLLL
NKEKFKISAPAS	sp|P03433|PA_I34A1	401	sp|Q9UQL6|HDAC5_HUMAN Histone deacetylase 5 OS=Homo sapiens OX=9606 GN=HDAC5 PE=1 SV=2	169	NKEKSKESAIAS
NKEKFKISAPAS	sp|P03433|PA_I34A1	401	tr|C9J481|C9J481_HUMAN Histone deacetylase (Fragment) OS=Homo sapiens OX=9606 GN=HDAC4 PE=1 SV=1	126	NKEKGKESAVAS
NKEKFKISAPAS	sp|P03433|PA_I34A1	401	sp|P56524|HDAC4_HUMAN Histone deacetylase 4 OS=Homo sapiens OX=9606 GN=HDAC4 PE=1 SV=3	157	NKEKGKESAVAS
AIISISLTNTDL	sp|P03468|NRAM_I34A1	264	tr|B7WPN9|B7WPN9_HUMAN Cation-transporting ATPase OS=Homo sapiens OX=9606 GN=ATP13A4 PE=1 SV=1	233	SIISISLTVYDL
AIISISLTNTDL	sp|P03468|NRAM_I34A1	264	sp|Q4VNC1|AT134_HUMAN Probable cation-transporting ATPase 13A4 OS=Homo sapiens OX=9606 GN=ATP13A4 PE=2 SV=3	233	SIISISLTVYDL
LLSLLILKQRGI	sp|P0DOG6|PB2S1_I34A1	172	tr|H3BLT0|H3BLT0_HUMAN Receptor protein-tyrosine kinase (Fragment) OS=Homo sapiens OX=9606 GN=ERBB4 PE=1 SV=1	431	GLSLLILKQQGI
LLSLLILKQRGI	sp|P0DOG6|PB2S1_I34A1	172	tr|A0A0A0MSE1|A0A0A0MSE1_HUMAN Receptor protein-tyrosine kinase OS=Homo sapiens OX=9606 GN=ERBB4 PE=1 SV=2	405	GLSLLILKQQGI
LLSLLILKQRGI	sp|P0DOG6|PB2S1_I34A1	172	sp|Q15303|ERBB4_HUMAN Receptor tyrosine-protein kinase erbB-4 OS=Homo sapiens OX=9606 GN=ERBB4 PE=1 SV=1	431	GLSLLILKQQGI
SNGTGARSGPAA	sp|P03466|NCAP_I34A1	349	tr|Q5W149|Q5W149_HUMAN Nucleolar protein 4-like (Fragment) OS=Homo sapiens OX=9606 GN=NOL4L PE=1 SV=2	39	GGGTGAGSGPAA
SNGTGARSGPAA	sp|P03466|NCAP_I34A1	349	tr|A0A087X0N3|A0A087X0N3_HUMAN Nucleolar protein 4-like OS=Homo sapiens OX=9606 GN=NOL4L PE=1 SV=1	59	GGGTGAGSGPAA
SNGTGARSGPAA	sp|P03466|NCAP_I34A1	349	tr|G3V4Q5|G3V4Q5_HUMAN Leukotriene B4 receptor 1 (Fragment) OS=Homo sapiens OX=9606 GN=LTB4R PE=1 SV=1	220	SLGQTARSGPAA
SNGTGARSGPAA	sp|P03466|NCAP_I34A1	349	sp|Q15722|LT4R1_HUMAN Leukotriene B4 receptor 1 OS=Homo sapiens OX=9606 GN=LTB4R PE=1 SV=2	320	SLGQTARSGPAA
ASYKLSLYTLGN	sp|P03452|HEMA_I34A1	309	sp|Q9NRP7|STK36_HUMAN Serine/threonine-protein kinase 36 OS=Homo sapiens OX=9606 GN=STK36 PE=1 SV=2	1275	ASEKLSLLSLGN
LLLLSIQFSKSL	sp|P03431|RDRP_I34A1	149	sp|Q86WV6|STING_HUMAN Stimulator of interferon genes protein OS=Homo sapiens OX=9606 GN=STING1 PE=1 SV=1	98	LLLLSIYFYYSL
LLLLSIQFSKSL	sp|P03431|RDRP_I34A1	149	tr|J3QTB1|J3QTB1_HUMAN Stimulator of interferon genes protein OS=Homo sapiens OX=9606 GN=STING1 PE=1 SV=2	98	LLLLSIYFYYSL
KEKFKISAPAST	sp|P03433|PA_I34A1	402	sp|Q9UQL6|HDAC5_HUMAN Histone deacetylase 5 OS=Homo sapiens OX=9606 GN=HDAC5 PE=1 SV=2	170	KEKSKESAIAST
KEKFKISAPAST	sp|P03433|PA_I34A1	402	tr|C9J481|C9J481_HUMAN Histone deacetylase (Fragment) OS=Homo sapiens OX=9606 GN=HDAC4 PE=1 SV=1	127	KEKGKESAVAST
KEKFKISAPAST	sp|P03433|PA_I34A1	402	sp|P56524|HDAC4_HUMAN Histone deacetylase 4 OS=Homo sapiens OX=9606 GN=HDAC4 PE=1 SV=3	158	KEKGKESAVAST
LGSMFSQRAGST	sp|P03466|NCAP_I34A1	462	sp|A2A3N6|PIPSL_HUMAN Putative PIP5K1A and PSMD4-like protein OS=Homo sapiens OX=9606 GN=PIPSL PE=5 SV=1	412	SGSSFSQRAGSS
SKLDSVLYKAVP	sp|P0CK64|PAX_I34A1	172	tr|A0A087WXL3|A0A087WXL3_HUMAN DNA-directed DNA polymerase OS=Homo sapiens OX=9606 GN=POLQ PE=1 SV=1	534	SGLDSVLQKTVP
SKLDSVLYKAVP	sp|P0CK64|PAX_I34A1	172	sp|O75417|DPOLQ_HUMAN DNA polymerase theta OS=Homo sapiens OX=9606 GN=POLQ PE=1 SV=2	399	SGLDSVLQKTVP
SGNESEPLPADG	sp|P03452|HEMA_I34A1	39	sp|Q6B0I6|KDM4D_HUMAN Lysine-specific demethylase 4D OS=Homo sapiens OX=9606 GN=KDM4D PE=1 SV=3	484	SGPEPEPLPEDG
PEGLFALPEILK	sp|P0CK64|PAX_I34A1	183	tr|E9PHN7|E9PHN7_HUMAN Glutathione S-transferase Mu 2 OS=Homo sapiens OX=9606 GN=GSTM2 PE=1 SV=2	125	PEYLQALPEMLK
PEGLFALPEILK	sp|P0CK64|PAX_I34A1	183	tr|F6XZQ7|F6XZQ7_HUMAN Glutathione S-transferase OS=Homo sapiens OX=9606 GN=GSTM2 PE=1 SV=1	125	PEYLQALPEMLK
PEGLFALPEILK	sp|P0CK64|PAX_I34A1	183	sp|P28161|GSTM2_HUMAN Glutathione S-transferase Mu 2 OS=Homo sapiens OX=9606 GN=GSTM2 PE=1 SV=2	125	PEYLQALPEMLK
PEGLFALPEILK	sp|P0CK64|PAX_I34A1	183	tr|E9PGV1|E9PGV1_HUMAN Glutathione S-transferase Mu 2 OS=Homo sapiens OX=9606 GN=GSTM2 PE=1 SV=1	21	PEYLQALPEMLK
PEGLFALPEILK	sp|P0CK64|PAX_I34A1	183	tr|E9PHN6|E9PHN6_HUMAN Glutathione S-transferase OS=Homo sapiens OX=9606 GN=GSTM2 PE=1 SV=1	125	PEYLQALPEMLK
DIKNEIEDASMG	sp|P03496|NS1_I34A1	69	tr|X6RC97|X6RC97_HUMAN Ubiquitin carboxyl-terminal hydrolase MINDY (Fragment) OS=Homo sapiens OX=9606 GN=MINDY3 PE=1 SV=1	49	NIKNEIEDASEP
DIKNEIEDASMG	sp|P03496|NS1_I34A1	69	tr|X6RC30|X6RC30_HUMAN Ubiquitin carboxyl-terminal hydrolase MINDY (Fragment) OS=Homo sapiens OX=9606 GN=MINDY3 PE=1 SV=1	36	NIKNEIEDASEP
DIKNEIEDASMG	sp|P03496|NS1_I34A1	69	sp|Q9H8M7|MINY3_HUMAN Ubiquitin carboxyl-terminal hydrolase MINDY-3 OS=Homo sapiens OX=9606 GN=MINDY3 PE=1 SV=1	196	NIKNEIEDASEP
EWITSTQVLNTE	sp|P03433|PA_I34A1	642	sp|P53609|PGTB1_HUMAN Geranylgeranyl transferase type-1 subunit beta OS=Homo sapiens OX=9606 GN=PGGT1B PE=1 SV=2	74	EWIYSLQVLPTE
GSMFSQRAGSTS	sp|P03466|NCAP_I34A1	463	sp|A2A3N6|PIPSL_HUMAN Putative PIP5K1A and PSMD4-like protein OS=Homo sapiens OX=9606 GN=PIPSL PE=5 SV=1	413	GSSFSQRAGSSG
GAKSSGNESEPL	sp|P03452|HEMA_I34A1	35	sp|Q7RTU3|OLIG3_HUMAN Oligodendrocyte transcription factor 3 OS=Homo sapiens OX=9606 GN=OLIG3 PE=1 SV=2	187	GALSSGNASSPL
WIKSLSRQSLTM	sp|P0DOG6|PB2S1_I34A1	200	sp|Q16401|PSMD5_HUMAN 26S proteasome non-ATPase regulatory subunit 5 OS=Homo sapiens OX=9606 GN=PSMD5 PE=1 SV=3	145	AIKSLSRISLTQ
IMRSFCESLPRT	sp|P03433|PA_I34A1	498	tr|A0A6Q8PHF7|A0A6Q8PHF7_HUMAN Sodium channel subunit beta-1 OS=Homo sapiens OX=9606 GN=SCN1B PE=1 SV=1	143	IQRSFCLSLPRS
IMRSFCESLPRT	sp|P03433|PA_I34A1	498	tr|A0A6Q8PGS1|A0A6Q8PGS1_HUMAN Sodium channel subunit beta-1 OS=Homo sapiens OX=9606 GN=SCN1B PE=1 SV=1	143	IQRSFCLSLPRS
PKSGENALNCGL	sp|P03452|HEMA_I34A1	127	sp|Q92628|K0232_HUMAN Uncharacterized protein KIAA0232 OS=Homo sapiens OX=9606 GN=KIAA0232 PE=1 SV=5	1002	PKSGENGLNKGF
IISISLTNTDLM	sp|P03468|NRAM_I34A1	265	tr|B7WPN9|B7WPN9_HUMAN Cation-transporting ATPase OS=Homo sapiens OX=9606 GN=ATP13A4 PE=1 SV=1	234	IISISLTVYDLR
IISISLTNTDLM	sp|P03468|NRAM_I34A1	265	sp|Q4VNC1|AT134_HUMAN Probable cation-transporting ATPase 13A4 OS=Homo sapiens OX=9606 GN=ATP13A4 PE=2 SV=3	234	IISISLTVYDLR
LASSDSSGKSVV	sp|P03468|NRAM_I34A1	432	sp|Q8NEA9|GMCL2_HUMAN Germ cell-less protein-like 2 OS=Homo sapiens OX=9606 GN=GMCL2 PE=1 SV=2	458	LASFDSSGKLVC
NSEKLSQQTPNV	sp|P03428|PB2_I34A1	183	sp|Q9Y485|DMXL1_HUMAN DmX-like protein 1 OS=Homo sapiens OX=9606 GN=DMXL1 PE=1 SV=3	586	NSLKLSIFTPNV
NSEKLSQQTPNV	sp|P03428|PB2_I34A1	183	tr|F5H269|F5H269_HUMAN DmX-like protein 1 OS=Homo sapiens OX=9606 GN=DMXL1 PE=1 SV=1	586	NSLKLSIFTPNV
LDIKNEIEDASM	sp|P03496|NS1_I34A1	68	tr|X6RC97|X6RC97_HUMAN Ubiquitin carboxyl-terminal hydrolase MINDY (Fragment) OS=Homo sapiens OX=9606 GN=MINDY3 PE=1 SV=1	48	ENIKNEIEDASE
LDIKNEIEDASM	sp|P03496|NS1_I34A1	68	tr|X6RC30|X6RC30_HUMAN Ubiquitin carboxyl-terminal hydrolase MINDY (Fragment) OS=Homo sapiens OX=9606 GN=MINDY3 PE=1 SV=1	35	ENIKNEIEDASE
LDIKNEIEDASM	sp|P03496|NS1_I34A1	68	sp|Q9H8M7|MINY3_HUMAN Ubiquitin carboxyl-terminal hydrolase MINDY-3 OS=Homo sapiens OX=9606 GN=MINDY3 PE=1 SV=1	195	ENIKNEIEDASE
SPKSGENALNCG	sp|P03452|HEMA_I34A1	126	sp|Q92628|K0232_HUMAN Uncharacterized protein KIAA0232 OS=Homo sapiens OX=9606 GN=KIAA0232 PE=1 SV=5	1001	QPKSGENGLNKG
LSLLILKQRGIR	sp|P0DOG6|PB2S1_I34A1	173	tr|H3BLT0|H3BLT0_HUMAN Receptor protein-tyrosine kinase (Fragment) OS=Homo sapiens OX=9606 GN=ERBB4 PE=1 SV=1	432	LSLLILKQQGIT
LSLLILKQRGIR	sp|P0DOG6|PB2S1_I34A1	173	tr|A0A0A0MSE1|A0A0A0MSE1_HUMAN Receptor protein-tyrosine kinase OS=Homo sapiens OX=9606 GN=ERBB4 PE=1 SV=2	406	LSLLILKQQGIT
LSLLILKQRGIR	sp|P0DOG6|PB2S1_I34A1	173	sp|Q15303|ERBB4_HUMAN Receptor tyrosine-protein kinase erbB-4 OS=Homo sapiens OX=9606 GN=ERBB4 PE=1 SV=1	432	LSLLILKQQGIT
EPEKRSLLLEIL	sp|P0DOG6|PB2S1_I34A1	335	tr|A0A669KB06|A0A669KB06_HUMAN Microtubule-actin cross-linking factor 1, isoforms 1/2/3/5 (Fragment) OS=Homo sapiens OX=9606 GN=MACF1 PE=1 SV=1	170	EVEKRRSLLEIL
EPEKRSLLLEIL	sp|P0DOG6|PB2S1_I34A1	335	tr|H3BPE1|H3BPE1_HUMAN Microtubule-actin cross-linking factor 1, isoforms 1/2/3/5 OS=Homo sapiens OX=9606 GN=MACF1 PE=1 SV=1	4951	EVEKRRSLLEIL
EPEKRSLLLEIL	sp|P0DOG6|PB2S1_I34A1	335	tr|H3BQK9|H3BQK9_HUMAN Microtubule-actin cross-linking factor 1, isoforms 1/2/3/5 OS=Homo sapiens OX=9606 GN=MACF1 PE=1 SV=1	4988	EVEKRRSLLEIL
EPEKRSLLLEIL	sp|P0DOG6|PB2S1_I34A1	335	tr|A0A590UJG2|A0A590UJG2_HUMAN Microtubule-actin cross-linking factor 1, isoforms 1/2/3/5 OS=Homo sapiens OX=9606 GN=MACF1 PE=1 SV=1	2838	EVEKRRSLLEIL
EPEKRSLLLEIL	sp|P0DOG6|PB2S1_I34A1	335	sp|Q9UPN3|MACF1_HUMAN Microtubule-actin cross-linking factor 1, isoforms 1/2/3/5 OS=Homo sapiens OX=9606 GN=MACF1 PE=1 SV=4	4956	EVEKRRSLLEIL
EPEKRSLLLEIL	sp|P0DOG6|PB2S1_I34A1	335	tr|H0Y390|H0Y390_HUMAN Microtubule-actin cross-linking factor 1, isoforms 1/2/3/5 (Fragment) OS=Homo sapiens OX=9606 GN=MACF1 PE=1 SV=1	2002	EVEKRRSLLEIL
LTLRTRLLIALE	sp|P03433|PA_I34A1	49	sp|Q6XUX3|DUSTY_HUMAN Dual serine/threonine and tyrosine protein kinase OS=Homo sapiens OX=9606 GN=DSTYK PE=1 SV=2	749	LTLETRLQIALD
DLGSMFSQRAGS	sp|P03466|NCAP_I34A1	461	sp|A2A3N6|PIPSL_HUMAN Putative PIP5K1A and PSMD4-like protein OS=Homo sapiens OX=9606 GN=PIPSL PE=5 SV=1	411	RSGSSFSQRAGS
NGTGARSGPAAN	sp|P03466|NCAP_I34A1	350	tr|Q5W149|Q5W149_HUMAN Nucleolar protein 4-like (Fragment) OS=Homo sapiens OX=9606 GN=NOL4L PE=1 SV=2	40	GGTGAGSGPAAG
NGTGARSGPAAN	sp|P03466|NCAP_I34A1	350	tr|A0A087X0N3|A0A087X0N3_HUMAN Nucleolar protein 4-like OS=Homo sapiens OX=9606 GN=NOL4L PE=1 SV=1	60	GGTGAGSGPAAG
IVKLTKDLYGTG	sp|P03433|PA_I34A1	328	sp|Q6P4R8|NFRKB_HUMAN Nuclear factor related to kappa-B-binding protein OS=Homo sapiens OX=9606 GN=NFRKB PE=1 SV=2	987	TVKLTQDLFGTG
LDSVLYKAVPEG	sp|P0CK64|PAX_I34A1	174	tr|A0A087WXL3|A0A087WXL3_HUMAN DNA-directed DNA polymerase OS=Homo sapiens OX=9606 GN=POLQ PE=1 SV=1	536	LDSVLQKTVPWG
LDSVLYKAVPEG	sp|P0CK64|PAX_I34A1	174	sp|O75417|DPOLQ_HUMAN DNA polymerase theta OS=Homo sapiens OX=9606 GN=POLQ PE=1 SV=2	401	LDSVLQKTVPWG
NKGLSVAIISIS	sp|P03468|NRAM_I34A1	258	sp|A6NDL8|O6C68_HUMAN Olfactory receptor 6C68 OS=Homo sapiens OX=9606 GN=OR6C68 PE=3 SV=2	269	NKGVSVLISSIS
IRLPRRQKVLLL	sp|P03431|RDRP_I34A1	140	tr|M0R1K9|M0R1K9_HUMAN NADH dehydrogenase [ubiquinone] 1 alpha subcomplex subunit 7 OS=Homo sapiens OX=9606 GN=NDUFA7 PE=1 SV=1	53	IRLPRPPKVLGL
LGCSIDVSSAVI	sp|P03468|NRAM_I34A1	80	sp|A6NHC0|CAN8_HUMAN Calpain-8 OS=Homo sapiens OX=9606 GN=CAPN8 PE=1 SV=3	238	LGCSIDVSSAAE
LGCSIDVSSAVI	sp|P03468|NRAM_I34A1	80	tr|B1B154|B1B154_HUMAN Calpain-8 OS=Homo sapiens OX=9606 GN=CAPN8 PE=1 SV=1	238	LGCSIDVSSAAE
LGCSIDVSSAVI	sp|P03468|NRAM_I34A1	80	tr|H0YEJ4|H0YEJ4_HUMAN Calpain-8 (Fragment) OS=Homo sapiens OX=9606 GN=CAPN8 PE=1 SV=1	111	LGCSIDVSSAAE
LGCSIDVSSAVI	sp|P03468|NRAM_I34A1	80	sp|Q9H0S4|DDX47_HUMAN Probable ATP-dependent RNA helicase DDX47 OS=Homo sapiens OX=9606 GN=DDX47 PE=1 SV=1	115	LGSSIGVQSAVI
HVKRISDLGQLT	sp|P0C0U1|PB1F2_I34A1	49	sp|O94967|WDR47_HUMAN WD repeat-containing protein 47 OS=Homo sapiens OX=9606 GN=WDR47 PE=1 SV=1	327	HDKRISDLGNKT
HVKRISDLGQLT	sp|P0C0U1|PB1F2_I34A1	49	tr|A0A0A0MRE6|A0A0A0MRE6_HUMAN WD repeat-containing protein 47 OS=Homo sapiens OX=9606 GN=WDR47 PE=1 SV=1	299	HDKRISDLGNKT
SLLILKQRGIRD	sp|P0DOG6|PB2S1_I34A1	174	tr|H3BLT0|H3BLT0_HUMAN Receptor protein-tyrosine kinase (Fragment) OS=Homo sapiens OX=9606 GN=ERBB4 PE=1 SV=1	433	SLLILKQQGITS
SLLILKQRGIRD	sp|P0DOG6|PB2S1_I34A1	174	tr|A0A0A0MSE1|A0A0A0MSE1_HUMAN Receptor protein-tyrosine kinase OS=Homo sapiens OX=9606 GN=ERBB4 PE=1 SV=2	407	SLLILKQQGITS
SLLILKQRGIRD	sp|P0DOG6|PB2S1_I34A1	174	sp|Q15303|ERBB4_HUMAN Receptor tyrosine-protein kinase erbB-4 OS=Homo sapiens OX=9606 GN=ERBB4 PE=1 SV=1	433	SLLILKQQGITS
KASVIVMKNGTI	sp|P0DOG6|PB2S1_I34A1	78	tr|A0A075B6X2|A0A075B6X2_HUMAN T cell receptor delta constant (Fragment) OS=Homo sapiens OX=9606 GN=TRDC PE=1 SV=1	7	KPSVFVMKNGTN
KASVIVMKNGTI	sp|P0DOG6|PB2S1_I34A1	78	sp|B7Z8K6|TRDC_HUMAN T cell receptor delta constant OS=Homo sapiens OX=9606 GN=TRDC PE=1 SV=2	6	KPSVFVMKNGTN
KLLDIKNEIEDA	sp|P03496|NS1_I34A1	66	sp|Q9NWZ3|IRAK4_HUMAN Interleukin-1 receptor-associated kinase 4 OS=Homo sapiens OX=9606 GN=IRAK4 PE=1 SV=1	395	LLLDIKEEIEDE
VKLTKDLYGTGV	sp|P03433|PA_I34A1	329	sp|Q6P4R8|NFRKB_HUMAN Nuclear factor related to kappa-B-binding protein OS=Homo sapiens OX=9606 GN=NFRKB PE=1 SV=2	988	VKLTQDLFGTGG
ETLHVKRISDLG	sp|P0C0U1|PB1F2_I34A1	46	sp|O94967|WDR47_HUMAN WD repeat-containing protein 47 OS=Homo sapiens OX=9606 GN=WDR47 PE=1 SV=1	324	LTSHDKRISDLG
ETLHVKRISDLG	sp|P0C0U1|PB1F2_I34A1	46	tr|A0A0A0MRE6|A0A0A0MRE6_HUMAN WD repeat-containing protein 47 OS=Homo sapiens OX=9606 GN=WDR47 PE=1 SV=1	296	LTSHDKRISDLG
IKSLSRQSLTMR	sp|P0DOG6|PB2S1_I34A1	201	sp|Q16401|PSMD5_HUMAN 26S proteasome non-ATPase regulatory subunit 5 OS=Homo sapiens OX=9606 GN=PSMD5 PE=1 SV=3	146	IKSLSRISLTQA
YLSILNSISGLT	sp|P03428|PB2_I34A1	555	tr|B7WPN9|B7WPN9_HUMAN Cation-transporting ATPase OS=Homo sapiens OX=9606 GN=ATP13A4 PE=1 SV=1	93	YLSALNSAFGLT
YLSILNSISGLT	sp|P03428|PB2_I34A1	555	sp|Q4VNC1|AT134_HUMAN Probable cation-transporting ATPase 13A4 OS=Homo sapiens OX=9606 GN=ATP13A4 PE=2 SV=3	93	YLSALNSAFGLT
LLFKSPTFIGRD	sp|P03431|RDRP_I34A1	452	tr|X6RKY7|X6RKY7_HUMAN Cell division cycle protein 123 homolog (Fragment) OS=Homo sapiens OX=9606 GN=CDC123 PE=1 SV=1	132	LLFKSSDFITRD
LLFKSPTFIGRD	sp|P03431|RDRP_I34A1	452	tr|X6RF82|X6RF82_HUMAN Cell division cycle protein 123 homolog (Fragment) OS=Homo sapiens OX=9606 GN=CDC123 PE=1 SV=1	100	LLFKSSDFITRD
LLFKSPTFIGRD	sp|P03431|RDRP_I34A1	452	sp|O75794|CD123_HUMAN Cell division cycle protein 123 homolog OS=Homo sapiens OX=9606 GN=CDC123 PE=1 SV=1	132	LLFKSSDFITRD
LLFKSPTFIGRD	sp|P03431|RDRP_I34A1	452	tr|X6RA30|X6RA30_HUMAN Cell division cycle protein 123 homolog OS=Homo sapiens OX=9606 GN=CDC123 PE=1 SV=1	132	LLFKSSDFITRD
RLLIALEEERRN	sp|P03433|PA_I34A1	54	tr|E9PJK4|E9PJK4_HUMAN Rho GTPase-activating protein 42 OS=Homo sapiens OX=9606 GN=ARHGAP42 PE=1 SV=1	92	RLLIAVEEERRR
RLLIALEEERRN	sp|P03433|PA_I34A1	54	sp|A6NI28|RHG42_HUMAN Rho GTPase-activating protein 42 OS=Homo sapiens OX=9606 GN=ARHGAP42 PE=1 SV=3	92	RLLIAVEEERRR
PLTTTLTACGYP	sp|P03431|RDRP_I34A1	465	sp|Q92581|SL9A6_HUMAN Sodium/hydrogen exchanger 6 OS=Homo sapiens OX=9606 GN=SLC9A6 PE=1 SV=2	556	PLTTTLPACCGP
PLTTTLTACGYP	sp|P03431|RDRP_I34A1	465	tr|A0A1B0GV11|A0A1B0GV11_HUMAN Sodium/hydrogen exchanger OS=Homo sapiens OX=9606 GN=SLC9A6 PE=1 SV=1	504	PLTTTLPACCGP
PLTTTLTACGYP	sp|P03431|RDRP_I34A1	465	tr|A0A0D9SGH0|A0A0D9SGH0_HUMAN Sodium/hydrogen exchanger OS=Homo sapiens OX=9606 GN=SLC9A6 PE=1 SV=5	566	PLTTTLPACCGP
DKLLDIKNEIED	sp|P03496|NS1_I34A1	65	sp|Q9NWZ3|IRAK4_HUMAN Interleukin-1 receptor-associated kinase 4 OS=Homo sapiens OX=9606 GN=IRAK4 PE=1 SV=1	394	QLLLDIKEEIED
EDNESAGHPPSC	sp|P03468|NRAM_I34A1	3	sp|O95833|CLIC3_HUMAN Chloride intracellular channel protein 3 OS=Homo sapiens OX=9606 GN=CLIC3 PE=1 SV=2	14	EDGESVGHCPSC
LLLMLLLIIFGG	sp|P03452|HEMA_I34A1	153	tr|A0A0C4DGU3|A0A0C4DGU3_HUMAN Minor histocompatibility antigen H13 OS=Homo sapiens OX=9606 GN=HM13 PE=1 SV=1	39	LLLMALLPIFFG
LLLMLLLIIFGG	sp|P03452|HEMA_I34A1	153	tr|A0A0S2Z6F0|A0A0S2Z6F0_HUMAN Histocompatibility 13 isoform 2 OS=Homo sapiens OX=9606 GN=HM13 PE=1 SV=1	39	LLLMALLPIFFG
LLLMLLLIIFGG	sp|P03452|HEMA_I34A1	153	sp|Q8TCT9|HM13_HUMAN Minor histocompatibility antigen H13 OS=Homo sapiens OX=9606 GN=HM13 PE=1 SV=1	39	LLLMALLPIFFG
LLLMLLLIIFGG	sp|P03452|HEMA_I34A1	153	tr|A0A075B6F6|A0A075B6F6_HUMAN Minor histocompatibility antigen H13 (Fragment) OS=Homo sapiens OX=9606 GN=HM13 PE=1 SV=1	39	LLLMALLPIFFG
LLLMLLLIIFGG	sp|P03452|HEMA_I34A1	153	tr|A0A3B3IT72|A0A3B3IT72_HUMAN Minor histocompatibility antigen H13 OS=Homo sapiens OX=9606 GN=HM13 PE=1 SV=1	39	LLLMALLPIFFG
LLLMLLLIIFGG	sp|P03452|HEMA_I34A1	153	tr|A0A3B3IUB5|A0A3B3IUB5_HUMAN Minor histocompatibility antigen H13 OS=Homo sapiens OX=9606 GN=HM13 PE=1 SV=1	39	LLLMALLPIFFG
MLRPSLPWTMLG	sp|P0C0U1|PB1F2_I34A1	71	tr|A0A494C145|A0A494C145_HUMAN Uncharacterized protein C12orf76 (Fragment) OS=Homo sapiens OX=9606 GN=C12orf76 PE=4 SV=1	1	MLRPALPWLYLG
MLRPSLPWTMLG	sp|P0C0U1|PB1F2_I34A1	71	tr|A0A0B4J261|A0A0B4J261_HUMAN Uncharacterized protein C12orf76 OS=Homo sapiens OX=9606 GN=C12orf76 PE=4 SV=1	1	MLRPALPWLYLG
GQNLRTFKQMEP	sp|P03431|RDRP_I34A1	291	sp|O60783|RT14_HUMAN 28S ribosomal protein S14, mitochondrial OS=Homo sapiens OX=9606 GN=MRPS14 PE=1 SV=1	7	GSLLRTFKQMVP
AMLLSAQTEYLS	sp|P03485|M1_I34A1	43	sp|O75376|NCOR1_HUMAN Nuclear receptor corepressor 1 OS=Homo sapiens OX=9606 GN=NCOR1 PE=1 SV=2	2425	APLLSAQYETLS
AMLLSAQTEYLS	sp|P03485|M1_I34A1	43	tr|E7EVK1|E7EVK1_HUMAN Nuclear receptor corepressor 1 (Fragment) OS=Homo sapiens OX=9606 GN=NCOR1 PE=1 SV=2	1056	APLLSAQYETLS
AMLLSAQTEYLS	sp|P03485|M1_I34A1	43	tr|A0A088AWL3|A0A088AWL3_HUMAN Nuclear receptor corepressor 1 OS=Homo sapiens OX=9606 GN=NCOR1 PE=1 SV=1	2328	APLLSAQYETLS
SLGCSIDVSSAV	sp|P03468|NRAM_I34A1	79	sp|A6NHC0|CAN8_HUMAN Calpain-8 OS=Homo sapiens OX=9606 GN=CAPN8 PE=1 SV=3	237	LLGCSIDVSSAA
SLGCSIDVSSAV	sp|P03468|NRAM_I34A1	79	tr|B1B154|B1B154_HUMAN Calpain-8 OS=Homo sapiens OX=9606 GN=CAPN8 PE=1 SV=1	237	LLGCSIDVSSAA
SLGCSIDVSSAV	sp|P03468|NRAM_I34A1	79	tr|H0YEJ4|H0YEJ4_HUMAN Calpain-8 (Fragment) OS=Homo sapiens OX=9606 GN=CAPN8 PE=1 SV=1	110	LLGCSIDVSSAA
LLIALEEERRNR	sp|P03433|PA_I34A1	55	tr|E9PJK4|E9PJK4_HUMAN Rho GTPase-activating protein 42 OS=Homo sapiens OX=9606 GN=ARHGAP42 PE=1 SV=1	93	LLIAVEEERRRL
LLIALEEERRNR	sp|P03433|PA_I34A1	55	sp|A6NI28|RHG42_HUMAN Rho GTPase-activating protein 42 OS=Homo sapiens OX=9606 GN=ARHGAP42 PE=1 SV=3	93	LLIAVEEERRRL
GTGARSGPAAND	sp|P03466|NCAP_I34A1	351	tr|Q5W149|Q5W149_HUMAN Nucleolar protein 4-like (Fragment) OS=Homo sapiens OX=9606 GN=NOL4L PE=1 SV=2	41	GTGAGSGPAAGE
GTGARSGPAAND	sp|P03466|NCAP_I34A1	351	tr|A0A087X0N3|A0A087X0N3_HUMAN Nucleolar protein 4-like OS=Homo sapiens OX=9606 GN=NOL4L PE=1 SV=1	61	GTGAGSGPAAGE
HVKHTHGQEGSS	sp|P03433|PA_I34A1	215	tr|E9PG02|E9PG02_HUMAN Inactive C-alpha-formylglycine-generating enzyme 2 OS=Homo sapiens OX=9606 GN=SUMF2 PE=1 SV=1	146	HVKFTHGGTGSS
RKASVIVMKNGT	sp|P0DOG6|PB2S1_I34A1	77	tr|A0A075B6X2|A0A075B6X2_HUMAN T cell receptor delta constant (Fragment) OS=Homo sapiens OX=9606 GN=TRDC PE=1 SV=1	6	TKPSVFVMKNGT
RKASVIVMKNGT	sp|P0DOG6|PB2S1_I34A1	77	sp|B7Z8K6|TRDC_HUMAN T cell receptor delta constant OS=Homo sapiens OX=9606 GN=TRDC PE=1 SV=2	5	TKPSVFVMKNGT
LLTTDLVIFKIL	sp|P03431|RDRP_I34A1	430	sp|Q12864|CAD17_HUMAN Cadherin-17 OS=Homo sapiens OX=9606 GN=CDH17 PE=1 SV=3	792	LLTTLLVIGIIL
IKNEIEDASMGP	sp|P03496|NS1_I34A1	70	tr|X6RC97|X6RC97_HUMAN Ubiquitin carboxyl-terminal hydrolase MINDY (Fragment) OS=Homo sapiens OX=9606 GN=MINDY3 PE=1 SV=1	50	IKNEIEDASEPL
IKNEIEDASMGP	sp|P03496|NS1_I34A1	70	tr|X6RC30|X6RC30_HUMAN Ubiquitin carboxyl-terminal hydrolase MINDY (Fragment) OS=Homo sapiens OX=9606 GN=MINDY3 PE=1 SV=1	37	IKNEIEDASEPL
IKNEIEDASMGP	sp|P03496|NS1_I34A1	70	sp|Q9H8M7|MINY3_HUMAN Ubiquitin carboxyl-terminal hydrolase MINDY-3 OS=Homo sapiens OX=9606 GN=MINDY3 PE=1 SV=1	197	IKNEIEDASEPL
VWIKSLSRQSLT	sp|P0DOG6|PB2S1_I34A1	199	sp|Q16401|PSMD5_HUMAN 26S proteasome non-ATPase regulatory subunit 5 OS=Homo sapiens OX=9606 GN=PSMD5 PE=1 SV=3	144	AAIKSLSRISLT
LGADVVEGFGGA	sp|P03485|M1_I34A1	189	tr|D6RBP8|D6RBP8_HUMAN Membrane-associated transporter protein (Fragment) OS=Homo sapiens OX=9606 GN=SLC45A2 PE=4 SV=1	6	NGATVVAGFGGA
TRLLIALEEERR	sp|P03433|PA_I34A1	53	tr|E9PJK4|E9PJK4_HUMAN Rho GTPase-activating protein 42 OS=Homo sapiens OX=9606 GN=ARHGAP42 PE=1 SV=1	91	ARLLIAVEEERR
TRLLIALEEERR	sp|P03433|PA_I34A1	53	sp|A6NI28|RHG42_HUMAN Rho GTPase-activating protein 42 OS=Homo sapiens OX=9606 GN=ARHGAP42 PE=1 SV=3	91	ARLLIAVEEERR
QLPERKMLSCTE	sp|P0CK64|PAX_I34A1	39	tr|A0A075B754|A0A075B754_HUMAN ATPase family AAA domain-containing protein 5 OS=Homo sapiens OX=9606 GN=ATAD5 PE=1 SV=1	736	TLPERKKLSETE
QLPERKMLSCTE	sp|P0CK64|PAX_I34A1	39	sp|Q96QE3|ATAD5_HUMAN ATPase family AAA domain-containing protein 5 OS=Homo sapiens OX=9606 GN=ATAD5 PE=1 SV=4	736	TLPERKKLSETE
RIMRSFCESLPR	sp|P03433|PA_I34A1	497	tr|A0A6Q8PHF7|A0A6Q8PHF7_HUMAN Sodium channel subunit beta-1 OS=Homo sapiens OX=9606 GN=SCN1B PE=1 SV=1	142	EIQRSFCLSLPR
RIMRSFCESLPR	sp|P03433|PA_I34A1	497	tr|A0A6Q8PGS1|A0A6Q8PGS1_HUMAN Sodium channel subunit beta-1 OS=Homo sapiens OX=9606 GN=SCN1B PE=1 SV=1	142	EIQRSFCLSLPR
NDESPMFRSGPL	sp|P03433|PA_I34A1	424	tr|D6R918|D6R918_HUMAN OCIA domain-containing protein 1 (Fragment) OS=Homo sapiens OX=9606 GN=OCIAD1 PE=1 SV=1	39	NDESFWFRSVPL
NDESPMFRSGPL	sp|P03433|PA_I34A1	424	tr|D6RBC5|D6RBC5_HUMAN OCIA domain-containing protein 1 (Fragment) OS=Homo sapiens OX=9606 GN=OCIAD1 PE=1 SV=1	39	NDESFWFRSVPL
