query	query_seqname	query_start	target_seqname	target_start	target
NDESPMFRSGPL	sp|P03433|PA_I34A1	424	tr|D6RDI5|D6RDI5_HUMAN OCIA domain-containing protein 1 (Fragment) OS=Homo sapiens OX=9606 GN=OCIAD1 PE=1 SV=1	39	NDESFWFRSVPL
NDESPMFRSGPL	sp|P03433|PA_I34A1	424	tr|D6RA54|D6RA54_HUMAN OCIA domain-containing protein 1 (Fragment) OS=Homo sapiens OX=9606 GN=OCIAD1 PE=1 SV=1	39	NDESFWFRSVPL
NDESPMFRSGPL	sp|P03433|PA_I34A1	424	tr|D6RC55|D6RC55_HUMAN OCIA domain-containing protein 1 OS=Homo sapiens OX=9606 GN=OCIAD1 PE=1 SV=1	39	NDESFWFRSVPL
NDESPMFRSGPL	sp|P03433|PA_I34A1	424	tr|D6RG39|D6RG39_HUMAN OCIA domain-containing protein 1 (Fragment) OS=Homo sapiens OX=9606 GN=OCIAD1 PE=1 SV=1	39	NDESFWFRSVPL
NDESPMFRSGPL	sp|P03433|PA_I34A1	424	tr|D6RIT9|D6RIT9_HUMAN OCIA domain-containing protein 1 (Fragment) OS=Homo sapiens OX=9606 GN=OCIAD1 PE=1 SV=1	39	NDESFWFRSVPL
NDESPMFRSGPL	sp|P03433|PA_I34A1	424	sp|Q9NX40|OCAD1_HUMAN OCIA domain-containing protein 1 OS=Homo sapiens OX=9606 GN=OCIAD1 PE=1 SV=1	39	NDESFWFRSVPL
DRGSPDNRSRRE	sp|P0DOG6|PB2S1_I34A1	242	sp|P49716|CEBPD_HUMAN CCAAT/enhancer-binding protein delta OS=Homo sapiens OX=9606 GN=CEBPD PE=1 SV=2	188	DRGSPEYRQRRE
LLDIKNEIEDAS	sp|P03496|NS1_I34A1	67	sp|Q9NWZ3|IRAK4_HUMAN Interleukin-1 receptor-associated kinase 4 OS=Homo sapiens OX=9606 GN=IRAK4 PE=1 SV=1	396	LLDIKEEIEDEE
LLDIKNEIEDAS	sp|P03496|NS1_I34A1	67	tr|X6RC97|X6RC97_HUMAN Ubiquitin carboxyl-terminal hydrolase MINDY (Fragment) OS=Homo sapiens OX=9606 GN=MINDY3 PE=1 SV=1	47	IENIKNEIEDAS
LLDIKNEIEDAS	sp|P03496|NS1_I34A1	67	tr|X6RC30|X6RC30_HUMAN Ubiquitin carboxyl-terminal hydrolase MINDY (Fragment) OS=Homo sapiens OX=9606 GN=MINDY3 PE=1 SV=1	34	IENIKNEIEDAS
LLDIKNEIEDAS	sp|P03496|NS1_I34A1	67	sp|Q9H8M7|MINY3_HUMAN Ubiquitin carboxyl-terminal hydrolase MINDY-3 OS=Homo sapiens OX=9606 GN=MINDY3 PE=1 SV=1	194	IENIKNEIEDAS
ALTLRTRLLIAL	sp|P03433|PA_I34A1	48	sp|Q6XUX3|DUSTY_HUMAN Dual serine/threonine and tyrosine protein kinase OS=Homo sapiens OX=9606 GN=DSTYK PE=1 SV=2	748	GLTLETRLQIAL
GADVVEGFGGAA	sp|P03485|M1_I34A1	190	tr|D6RBP8|D6RBP8_HUMAN Membrane-associated transporter protein (Fragment) OS=Homo sapiens OX=9606 GN=SLC45A2 PE=4 SV=1	7	GATVVAGFGGAL
RTRLLIALEEER	sp|P03433|PA_I34A1	52	tr|E9PJK4|E9PJK4_HUMAN Rho GTPase-activating protein 42 OS=Homo sapiens OX=9606 GN=ARHGAP42 PE=1 SV=1	90	FARLLIAVEEER
RTRLLIALEEER	sp|P03433|PA_I34A1	52	sp|A6NI28|RHG42_HUMAN Rho GTPase-activating protein 42 OS=Homo sapiens OX=9606 GN=ARHGAP42 PE=1 SV=3	90	FARLLIAVEEER
AIMVLTNTSRTL	sp|P03466|NCAP_I34A1	223	tr|H7C3U2|H7C3U2_HUMAN NAD(P)(+)--arginine ADP-ribosyltransferase (Fragment) OS=Homo sapiens OX=9606 GN=ART5 PE=1 SV=8	74	AIMVYTNSSNTL
AIMVLTNTSRTL	sp|P03466|NCAP_I34A1	223	sp|Q96L15|NAR5_HUMAN Ecto-ADP-ribosyltransferase 5 OS=Homo sapiens OX=9606 GN=ART5 PE=2 SV=4	95	AIMVYTNSSNTL
AIMVLTNTSRTL	sp|P03466|NCAP_I34A1	223	tr|H7C1W0|H7C1W0_HUMAN NAD(P)(+)--arginine ADP-ribosyltransferase (Fragment) OS=Homo sapiens OX=9606 GN=ART5 PE=1 SV=1	52	AIMVYTNSSNTL
RAEAAEGVGRCG	sp|P03428|PB2_I34A1	310	tr|A0A499FIZ0|A0A499FIZ0_HUMAN WD repeat-containing protein 26 OS=Homo sapiens OX=9606 GN=WDR26 PE=1 SV=1	32	RASAAEGVGEPG
LQQLLLMLLLII	sp|P03452|HEMA_I34A1	150	sp|Q8IXR5|F178B_HUMAN Protein FAM178B OS=Homo sapiens OX=9606 GN=FAM178B PE=2 SV=3	471	LQQLLLLLLENI
CLASSDSSGKSV	sp|P03468|NRAM_I34A1	431	sp|Q8NEA9|GMCL2_HUMAN Germ cell-less protein-like 2 OS=Homo sapiens OX=9606 GN=GMCL2 PE=1 SV=2	457	RLASFDSSGKLV
VSLGCSIDVSSA	sp|P03468|NRAM_I34A1	78	sp|A6NHC0|CAN8_HUMAN Calpain-8 OS=Homo sapiens OX=9606 GN=CAPN8 PE=1 SV=3	236	SLLGCSIDVSSA
VSLGCSIDVSSA	sp|P03468|NRAM_I34A1	78	tr|B1B154|B1B154_HUMAN Calpain-8 OS=Homo sapiens OX=9606 GN=CAPN8 PE=1 SV=1	236	SLLGCSIDVSSA
VSLGCSIDVSSA	sp|P03468|NRAM_I34A1	78	tr|H0YEJ4|H0YEJ4_HUMAN Calpain-8 (Fragment) OS=Homo sapiens OX=9606 GN=CAPN8 PE=1 SV=1	109	SLLGCSIDVSSA
IVSLGCSIDVSS	sp|P03468|NRAM_I34A1	77	sp|A6NHC0|CAN8_HUMAN Calpain-8 OS=Homo sapiens OX=9606 GN=CAPN8 PE=1 SV=3	235	GSLLGCSIDVSS
IVSLGCSIDVSS	sp|P03468|NRAM_I34A1	77	tr|B1B154|B1B154_HUMAN Calpain-8 OS=Homo sapiens OX=9606 GN=CAPN8 PE=1 SV=1	235	GSLLGCSIDVSS
IVSLGCSIDVSS	sp|P03468|NRAM_I34A1	77	tr|H0YEJ4|H0YEJ4_HUMAN Calpain-8 (Fragment) OS=Homo sapiens OX=9606 GN=CAPN8 PE=1 SV=1	108	GSLLGCSIDVSS
VTMIATDTGNPP	sp|P0DOG6|PB2S1_I34A1	135	sp|Q9Y5G1|PCDGF_HUMAN Protocadherin gamma-B3 OS=Homo sapiens OX=9606 GN=PCDHGB3 PE=1 SV=4	420	VTITATDKGNPP
