query	query_seqname	query_start	target_seqname	target_start	target
RECSVYPENTED	sp|P04585|POL_HV1H2	891	tr|A0A590PXD8|A0A590PXD8_HUMAN Cordon-bleu protein-like 1 OS=Homo sapiens OX=9606 GN=COBLL1 PE=1 SV=1	598	NEIIVYPENTED
RECSVYPENTED	sp|P04585|POL_HV1H2	891	sp|Q53SF7|COBL1_HUMAN Cordon-bleu protein-like 1 OS=Homo sapiens OX=9606 GN=COBLL1 PE=1 SV=3	522	NEIIVYPENTED
RECSVYPENTED	sp|P04585|POL_HV1H2	891	tr|A0A0X1KG75|A0A0X1KG75_HUMAN Cordon-bleu protein-like 1 (Fragment) OS=Homo sapiens OX=9606 GN=COBLL1 PE=1 SV=1	562	NEIIVYPENTED
RECSVYPENTED	sp|P04585|POL_HV1H2	891	tr|A0A0D9SG04|A0A0D9SG04_HUMAN Cordon-bleu protein-like 1 OS=Homo sapiens OX=9606 GN=COBLL1 PE=1 SV=2	627	NEIIVYPENTED
ASPTPRHRREAY	sp|P04608|TAT_HV1H2	8	sp|Q9NZM4|BICRA_HUMAN BRD4-interacting chromatin-remodeling complex-associated protein OS=Homo sapiens OX=9606 GN=BICRA PE=1 SV=2	1533	ASPPPLHRPEAY
ASPTPRHRREAY	sp|P04608|TAT_HV1H2	8	tr|A0A087WWH3|A0A087WWH3_HUMAN BRD4-interacting chromatin-remodeling complex-associated protein OS=Homo sapiens OX=9606 GN=BICRA PE=1 SV=1	1481	ASPPPLHRPEAY
QQFQELRDIKQL	sp|P04585|POL_HV1H2	1278	tr|A0A2R8Y586|A0A2R8Y586_HUMAN Deoxynucleoside triphosphate triphosphohydrolase SAMHD1 OS=Homo sapiens OX=9606 GN=SAMHD1 PE=1 SV=1	139	PQFQRLRYIKQL
QQFQELRDIKQL	sp|P04585|POL_HV1H2	1278	tr|A0A2R8YF51|A0A2R8YF51_HUMAN Deoxynucleoside triphosphate triphosphohydrolase SAMHD1 OS=Homo sapiens OX=9606 GN=SAMHD1 PE=1 SV=1	139	PQFQRLRYIKQL
QQFQELRDIKQL	sp|P04585|POL_HV1H2	1278	tr|A0A2R8Y5D2|A0A2R8Y5D2_HUMAN Deoxynucleoside triphosphate triphosphohydrolase SAMHD1 OS=Homo sapiens OX=9606 GN=SAMHD1 PE=1 SV=1	139	PQFQRLRYIKQL
QQFQELRDIKQL	sp|P04585|POL_HV1H2	1278	tr|A0A2R8Y6J9|A0A2R8Y6J9_HUMAN Deoxynucleoside triphosphate triphosphohydrolase SAMHD1 (Fragment) OS=Homo sapiens OX=9606 GN=SAMHD1 PE=1 SV=1	62	PQFQRLRYIKQL
QQFQELRDIKQL	sp|P04585|POL_HV1H2	1278	sp|Q9Y3Z3|SAMH1_HUMAN Deoxynucleoside triphosphate triphosphohydrolase SAMHD1 OS=Homo sapiens OX=9606 GN=SAMHD1 PE=1 SV=2	139	PQFQRLRYIKQL
QQFQELRDIKQL	sp|P04585|POL_HV1H2	1278	tr|A0A2R8YCS7|A0A2R8YCS7_HUMAN Deoxynucleoside triphosphate triphosphohydrolase SAMHD1 OS=Homo sapiens OX=9606 GN=SAMHD1 PE=1 SV=1	139	PQFQRLRYIKQL
QQFQELRDIKQL	sp|P04585|POL_HV1H2	1278	tr|A0A2R8YD90|A0A2R8YD90_HUMAN Deoxynucleoside triphosphate triphosphohydrolase SAMHD1 (Fragment) OS=Homo sapiens OX=9606 GN=SAMHD1 PE=1 SV=1	115	PQFQRLRYIKQL
RLQSVTRESRNI	sp|P04618|REV_HV1H2	5	tr|H7BXM6|H7BXM6_HUMAN RNA-binding protein 33 (Fragment) OS=Homo sapiens OX=9606 GN=RBM33 PE=1 SV=1	186	RLSDVTRERRNI
RLQSVTRESRNI	sp|P04618|REV_HV1H2	5	sp|Q96EV2|RBM33_HUMAN RNA-binding protein 33 OS=Homo sapiens OX=9606 GN=RBM33 PE=1 SV=3	231	RLSDVTRERRNI
RLQSVTRESRNI	sp|P04618|REV_HV1H2	5	tr|H0Y3K4|H0Y3K4_HUMAN RNA-binding protein 33 (Fragment) OS=Homo sapiens OX=9606 GN=RBM33 PE=1 SV=1	3	RLSDVTRERRNI
RLQSVTRESRNI	sp|P04618|REV_HV1H2	5	tr|H7C0H2|H7C0H2_HUMAN RNA-binding protein 33 (Fragment) OS=Homo sapiens OX=9606 GN=RBM33 PE=1 SV=1	122	RLSDVTRERRNI
RLQSVTRESRNI	sp|P04618|REV_HV1H2	5	tr|A8MTF7|A8MTF7_HUMAN RNA-binding protein 33 OS=Homo sapiens OX=9606 GN=RBM33 PE=1 SV=1	271	RLSDVTRERRNI
YGHAGARSGARL	sp|P04601|NEF_HV1H2	111	sp|Q53HC5|KLH26_HUMAN Kelch-like protein 26 OS=Homo sapiens OX=9606 GN=KLHL26 PE=1 SV=2	451	WGHAGAASGGRL
KGKNPPGSKQSQ	sp|P04608|TAT_HV1H2	71	tr|F1DAL9|F1DAL9_HUMAN COUP transcription factor 1 OS=Homo sapiens OX=9606 GN=NR2F1 PE=1 SV=1	45	KGQGPPGSGQSQ
KGKNPPGSKQSQ	sp|P04608|TAT_HV1H2	71	sp|P10589|COT1_HUMAN COUP transcription factor 1 OS=Homo sapiens OX=9606 GN=NR2F1 PE=1 SV=1	70	KGQGPPGSGQSQ
LSRILKDDRTAV	sp|P04601|NEF_HV1H2	57	tr|C9JV51|C9JV51_HUMAN CASP8 and FADD-like apoptosis regulator (Fragment) OS=Homo sapiens OX=9606 GN=CFLAR PE=1 SV=1	68	LKRILKMDRKAV
LSRILKDDRTAV	sp|P04601|NEF_HV1H2	57	tr|C9J408|C9J408_HUMAN CASP8 and FADD-like apoptosis regulator (Fragment) OS=Homo sapiens OX=9606 GN=CFLAR PE=1 SV=1	68	LKRILKMDRKAV
LSRILKDDRTAV	sp|P04601|NEF_HV1H2	57	tr|E9PAP3|E9PAP3_HUMAN CASP8 and FADD-like apoptosis regulator OS=Homo sapiens OX=9606 GN=CFLAR PE=1 SV=1	68	LKRILKMDRKAV
LSRILKDDRTAV	sp|P04601|NEF_HV1H2	57	tr|F8WBH9|F8WBH9_HUMAN CASP8 and FADD-like apoptosis regulator OS=Homo sapiens OX=9606 GN=CFLAR PE=1 SV=1	68	LKRILKMDRKAV
LSRILKDDRTAV	sp|P04601|NEF_HV1H2	57	sp|O15519|CFLAR_HUMAN CASP8 and FADD-like apoptosis regulator OS=Homo sapiens OX=9606 GN=CFLAR PE=1 SV=1	68	LKRILKMDRKAV
LVHYGSREGPHQ	sp|P69726|VPR_HV1H2	74	sp|Q13724|MOGS_HUMAN Mannosyl-oligosaccharide glucosidase OS=Homo sapiens OX=9606 GN=MOGS PE=1 SV=5	766	LHHYGHLEGPHQ
LVHYGSREGPHQ	sp|P69726|VPR_HV1H2	74	tr|A0A3B3IRW2|A0A3B3IRW2_HUMAN Mannosyl-oligosaccharide glucosidase OS=Homo sapiens OX=9606 GN=MOGS PE=1 SV=1	491	LHHYGHLEGPHQ
LVHYGSREGPHQ	sp|P69726|VPR_HV1H2	74	tr|A0A3B3IRK6|A0A3B3IRK6_HUMAN Mannosyl-oligosaccharide glucosidase (Fragment) OS=Homo sapiens OX=9606 GN=MOGS PE=1 SV=1	644	LHHYGHLEGPHQ
LTSERKEPKHPL	sp|P04601|NEF_HV1H2	96	sp|Q15916|ZBTB6_HUMAN Zinc finger and BTB domain-containing protein 6 OS=Homo sapiens OX=9606 GN=ZBTB6 PE=1 SV=1	193	LTSERKEMKSPE
GIFPGIGNIDGG	sp|P04585|POL_HV1H2	26	tr|K7ES57|K7ES57_HUMAN UNC93-like protein MFSD11 (Fragment) OS=Homo sapiens OX=9606 GN=MFSD11 PE=4 SV=1	37	GIFIGIGEILGG
GIFPGIGNIDGG	sp|P04585|POL_HV1H2	26	sp|O43934|MFS11_HUMAN UNC93-like protein MFSD11 OS=Homo sapiens OX=9606 GN=MFSD11 PE=1 SV=2	282	GIFIGIGEILGG
ETKVTPLNESEP	sp|P04591|GAG_HV1H2	103	tr|H3BRG5|H3BRG5_HUMAN StAR-related lipid transfer protein 13 (Fragment) OS=Homo sapiens OX=9606 GN=STARD13 PE=1 SV=8	537	ERDVTSLNESEP
ETKVTPLNESEP	sp|P04591|GAG_HV1H2	103	sp|Q9Y3M8|STA13_HUMAN StAR-related lipid transfer protein 13 OS=Homo sapiens OX=9606 GN=STARD13 PE=1 SV=2	552	ERDVTSLNESEP
KAGNRGGTSMRS	sp|P04585|POL_HV1H2	748	tr|H0YHJ5|H0YHJ5_HUMAN Histone deacetylase 7 (Fragment) OS=Homo sapiens OX=9606 GN=HDAC7 PE=1 SV=1	94	KAGNRNPTSMPS
LIIAAEGLAEKG	sp|P04585|POL_HV1H2	600	tr|A0A5F9ZI52|A0A5F9ZI52_HUMAN Nesprin-1 (Fragment) OS=Homo sapiens OX=9606 GN=SYNE1 PE=1 SV=1	941	LRIAQEGLEEKG
LIIAAEGLAEKG	sp|P04585|POL_HV1H2	600	tr|A0A0C4DG40|A0A0C4DG40_HUMAN Nesprin-1 OS=Homo sapiens OX=9606 GN=SYNE1 PE=1 SV=1	950	LRIAQEGLEEKG
LIIAAEGLAEKG	sp|P04585|POL_HV1H2	600	sp|Q8NF91|SYNE1_HUMAN Nesprin-1 OS=Homo sapiens OX=9606 GN=SYNE1 PE=1 SV=4	943	LRIAQEGLEEKG
LIIAAEGLAEKG	sp|P04585|POL_HV1H2	600	tr|F5GXQ8|F5GXQ8_HUMAN Nesprin-1 OS=Homo sapiens OX=9606 GN=SYNE1 PE=1 SV=1	933	LRIAQEGLEEKG
LIIAAEGLAEKG	sp|P04585|POL_HV1H2	600	tr|A0A5F9ZHR3|A0A5F9ZHR3_HUMAN Nesprin-1 OS=Homo sapiens OX=9606 GN=SYNE1 PE=1 SV=1	924	LRIAQEGLEEKG
LIIAAEGLAEKG	sp|P04585|POL_HV1H2	600	tr|A0A5F9ZHI3|A0A5F9ZHI3_HUMAN Nesprin-1 (Fragment) OS=Homo sapiens OX=9606 GN=SYNE1 PE=1 SV=1	42	LRIAQEGLEEKG
LIIAAEGLAEKG	sp|P04585|POL_HV1H2	600	tr|E7ENN3|E7ENN3_HUMAN Nesprin-1 OS=Homo sapiens OX=9606 GN=SYNE1 PE=1 SV=2	992	LRIAQEGLEEKG
LIIAAEGLAEKG	sp|P04585|POL_HV1H2	600	tr|F5H422|F5H422_HUMAN Nesprin-1 OS=Homo sapiens OX=9606 GN=SYNE1 PE=1 SV=1	510	LRIAQEGLEEKG
GHAGARSGARLH	sp|P04601|NEF_HV1H2	112	sp|Q53HC5|KLH26_HUMAN Kelch-like protein 26 OS=Homo sapiens OX=9606 GN=KLHL26 PE=1 SV=2	452	GHAGAASGGRLY
EIRKAVLIEMSL	sp|P05919|VPU_HV1H2	64	sp|Q86XN7|PRSR1_HUMAN Proline and serine-rich protein 1 OS=Homo sapiens OX=9606 GN=PROSER1 PE=1 SV=2	12	EIRKAVLTEYKL
GLQPVADPLDFQ	sp|P04585|POL_HV1H2	942	tr|E5RIL2|E5RIL2_HUMAN Poly(A)-specific ribonuclease (Fragment) OS=Homo sapiens OX=9606 GN=CNOT8 PE=1 SV=1	154	GLQEVADQLDLQ
GLQPVADPLDFQ	sp|P04585|POL_HV1H2	942	sp|Q9UFF9|CNOT8_HUMAN CCR4-NOT transcription complex subunit 8 OS=Homo sapiens OX=9606 GN=CNOT8 PE=1 SV=1	208	GLQEVADQLDLQ
GLQPVADPLDFQ	sp|P04585|POL_HV1H2	942	tr|B7Z9U0|B7Z9U0_HUMAN Poly(A)-specific ribonuclease OS=Homo sapiens OX=9606 GN=CNOT8 PE=1 SV=1	44	GLQEVADQLDLQ
PVQAKLTQLKQA	sp|P04591|GAG_HV1H2	31	sp|P82987|ATL3_HUMAN ADAMTS-like protein 3 OS=Homo sapiens OX=9606 GN=ADAMTSL3 PE=1 SV=4	542	PVEAKLPWLKQA
VPTTAGPTVVST	sp|P04591|GAG_HV1H2	300	sp|Q9ULL5|PRR12_HUMAN Proline-rich protein 12 OS=Homo sapiens OX=9606 GN=PRR12 PE=1 SV=3	1181	VPTTAGPASAST
VPTTAGPTVVST	sp|P04591|GAG_HV1H2	300	tr|A0A3Q5ADB5|A0A3Q5ADB5_HUMAN Proline-rich protein 12 OS=Homo sapiens OX=9606 GN=PRR12 PE=1 SV=1	360	VPTTAGPASAST
REHAAQQFQELR	sp|P04585|POL_HV1H2	1273	sp|Q96L91|EP400_HUMAN E1A-binding protein p400 OS=Homo sapiens OX=9606 GN=EP400 PE=1 SV=4	1866	REHAAPYFQQLR
DIVERRRIRDAI	sp|P05919|VPU_HV1H2	42	tr|C9JBH9|C9JBH9_HUMAN Smoothelin (Fragment) OS=Homo sapiens OX=9606 GN=SMTN PE=1 SV=1	77	DLAERRRIRSAI
DIVERRRIRDAI	sp|P05919|VPU_HV1H2	42	tr|C9JGQ0|C9JGQ0_HUMAN Smoothelin (Fragment) OS=Homo sapiens OX=9606 GN=SMTN PE=1 SV=1	23	DLAERRRIRSAI
DIVERRRIRDAI	sp|P05919|VPU_HV1H2	42	tr|C9JV14|C9JV14_HUMAN Smoothelin (Fragment) OS=Homo sapiens OX=9606 GN=SMTN PE=1 SV=1	77	DLAERRRIRSAI
DIVERRRIRDAI	sp|P05919|VPU_HV1H2	42	tr|C9JYU8|C9JYU8_HUMAN Smoothelin (Fragment) OS=Homo sapiens OX=9606 GN=SMTN PE=1 SV=8	77	DLAERRRIRSAI
DIVERRRIRDAI	sp|P05919|VPU_HV1H2	42	tr|H7C372|H7C372_HUMAN Smoothelin (Fragment) OS=Homo sapiens OX=9606 GN=SMTN PE=1 SV=2	23	DLAERRRIRSAI
DIVERRRIRDAI	sp|P05919|VPU_HV1H2	42	tr|C9JQZ8|C9JQZ8_HUMAN Smoothelin (Fragment) OS=Homo sapiens OX=9606 GN=SMTN PE=1 SV=1	15	DLAERRRIRSAI
DIVERRRIRDAI	sp|P05919|VPU_HV1H2	42	tr|A0A087X1R1|A0A087X1R1_HUMAN Smoothelin OS=Homo sapiens OX=9606 GN=SMTN PE=1 SV=1	77	DLAERRRIRSAI
DIVERRRIRDAI	sp|P05919|VPU_HV1H2	42	sp|P53814|SMTN_HUMAN Smoothelin OS=Homo sapiens OX=9606 GN=SMTN PE=1 SV=7	23	DLAERRRIRSAI
DIVERRRIRDAI	sp|P05919|VPU_HV1H2	42	tr|A0A087WVP4|A0A087WVP4_HUMAN Smoothelin OS=Homo sapiens OX=9606 GN=SMTN PE=1 SV=1	79	DLAERRRIRSAI
SRRKQSAEDREK	sp|P04585|POL_HV1H2	164	sp|Q8NH73|OR4S2_HUMAN Olfactory receptor 4S2 OS=Homo sapiens OX=9606 GN=OR4S2 PE=3 SV=2	222	SLRKQSAEGRRK
GPDVAACAEVPR	sp|P04585|POL_HV1H2	263	tr|J3QQX4|J3QQX4_HUMAN Rhomboid-related protein 3 OS=Homo sapiens OX=9606 GN=RHBDL3 PE=1 SV=1	8	GPAVAACAEAER
GPDVAACAEVPR	sp|P04585|POL_HV1H2	263	tr|A4FU16|A4FU16_HUMAN RHBDL3 protein (Fragment) OS=Homo sapiens OX=9606 GN=RHBDL3 PE=1 SV=1	8	GPAVAACAEAER
GPDVAACAEVPR	sp|P04585|POL_HV1H2	263	sp|P58872|RHBL3_HUMAN Rhomboid-related protein 3 OS=Homo sapiens OX=9606 GN=RHBDL3 PE=2 SV=1	8	GPAVAACAEAER
GVQGLETMLVPK	sp|P04578|ENV_HV1H2	60	tr|C9JRH2|C9JRH2_HUMAN Regulator of chromosome condensation (Fragment) OS=Homo sapiens OX=9606 GN=RCC1 PE=1 SV=1	216	GRQGLERLLVPK
GVQGLETMLVPK	sp|P04578|ENV_HV1H2	60	tr|C9J3R0|C9J3R0_HUMAN Regulator of chromosome condensation (Fragment) OS=Homo sapiens OX=9606 GN=RCC1 PE=1 SV=9	244	GRQGLERLLVPK
GVQGLETMLVPK	sp|P04578|ENV_HV1H2	60	tr|C9JMJ4|C9JMJ4_HUMAN Regulator of chromosome condensation (Fragment) OS=Homo sapiens OX=9606 GN=RCC1 PE=1 SV=1	216	GRQGLERLLVPK
GVQGLETMLVPK	sp|P04578|ENV_HV1H2	60	tr|C9JQZ4|C9JQZ4_HUMAN Regulator of chromosome condensation (Fragment) OS=Homo sapiens OX=9606 GN=RCC1 PE=1 SV=1	216	GRQGLERLLVPK
GVQGLETMLVPK	sp|P04578|ENV_HV1H2	60	tr|C9JW69|C9JW69_HUMAN Regulator of chromosome condensation (Fragment) OS=Homo sapiens OX=9606 GN=RCC1 PE=1 SV=1	233	GRQGLERLLVPK
GVQGLETMLVPK	sp|P04578|ENV_HV1H2	60	sp|P18754|RCC1_HUMAN Regulator of chromosome condensation OS=Homo sapiens OX=9606 GN=RCC1 PE=1 SV=1	216	GRQGLERLLVPK
RILKDDRTAVQT	sp|P04601|NEF_HV1H2	59	tr|C9JV51|C9JV51_HUMAN CASP8 and FADD-like apoptosis regulator (Fragment) OS=Homo sapiens OX=9606 GN=CFLAR PE=1 SV=1	70	RILKMDRKAVET
RILKDDRTAVQT	sp|P04601|NEF_HV1H2	59	tr|C9J408|C9J408_HUMAN CASP8 and FADD-like apoptosis regulator (Fragment) OS=Homo sapiens OX=9606 GN=CFLAR PE=1 SV=1	70	RILKMDRKAVET
RILKDDRTAVQT	sp|P04601|NEF_HV1H2	59	tr|E9PAP3|E9PAP3_HUMAN CASP8 and FADD-like apoptosis regulator OS=Homo sapiens OX=9606 GN=CFLAR PE=1 SV=1	70	RILKMDRKAVET
RILKDDRTAVQT	sp|P04601|NEF_HV1H2	59	tr|F8WBH9|F8WBH9_HUMAN CASP8 and FADD-like apoptosis regulator OS=Homo sapiens OX=9606 GN=CFLAR PE=1 SV=1	70	RILKMDRKAVET
RILKDDRTAVQT	sp|P04601|NEF_HV1H2	59	sp|O15519|CFLAR_HUMAN CASP8 and FADD-like apoptosis regulator OS=Homo sapiens OX=9606 GN=CFLAR PE=1 SV=1	70	RILKMDRKAVET
QRDRLPTTAFRE	sp|P69726|VPR_HV1H2	85	tr|I3L188|I3L188_HUMAN FLYWCH-type zinc finger-containing protein 1 (Fragment) OS=Homo sapiens OX=9606 GN=FLYWCH1 PE=1 SV=1	433	QRERLPTTAQQE
QRDRLPTTAFRE	sp|P69726|VPR_HV1H2	85	tr|I3L287|I3L287_HUMAN FLYWCH-type zinc finger-containing protein 1 (Fragment) OS=Homo sapiens OX=9606 GN=FLYWCH1 PE=1 SV=1	5	QRERLPTTAQQE
QRDRLPTTAFRE	sp|P69726|VPR_HV1H2	85	sp|Q4VC44|FWCH1_HUMAN FLYWCH-type zinc finger-containing protein 1 OS=Homo sapiens OX=9606 GN=FLYWCH1 PE=1 SV=2	670	QRERLPTTAQQE
QRDRLPTTAFRE	sp|P69726|VPR_HV1H2	85	tr|J3KNW1|J3KNW1_HUMAN FLYWCH-type zinc finger-containing protein 1 (Fragment) OS=Homo sapiens OX=9606 GN=FLYWCH1 PE=1 SV=1	448	QRERLPTTAQQE
QRDRLPTTAFRE	sp|P69726|VPR_HV1H2	85	tr|I3L1A7|I3L1A7_HUMAN FLYWCH-type zinc finger-containing protein 1 (Fragment) OS=Homo sapiens OX=9606 GN=FLYWCH1 PE=1 SV=1	38	QRERLPTTAQQE
QFQELRDIKQLC	sp|P04585|POL_HV1H2	1279	tr|A0A2R8Y586|A0A2R8Y586_HUMAN Deoxynucleoside triphosphate triphosphohydrolase SAMHD1 OS=Homo sapiens OX=9606 GN=SAMHD1 PE=1 SV=1	140	QFQRLRYIKQLG
QFQELRDIKQLC	sp|P04585|POL_HV1H2	1279	tr|A0A2R8YF51|A0A2R8YF51_HUMAN Deoxynucleoside triphosphate triphosphohydrolase SAMHD1 OS=Homo sapiens OX=9606 GN=SAMHD1 PE=1 SV=1	140	QFQRLRYIKQLG
QFQELRDIKQLC	sp|P04585|POL_HV1H2	1279	tr|A0A2R8Y5D2|A0A2R8Y5D2_HUMAN Deoxynucleoside triphosphate triphosphohydrolase SAMHD1 OS=Homo sapiens OX=9606 GN=SAMHD1 PE=1 SV=1	140	QFQRLRYIKQLG
QFQELRDIKQLC	sp|P04585|POL_HV1H2	1279	tr|A0A2R8Y6J9|A0A2R8Y6J9_HUMAN Deoxynucleoside triphosphate triphosphohydrolase SAMHD1 (Fragment) OS=Homo sapiens OX=9606 GN=SAMHD1 PE=1 SV=1	63	QFQRLRYIKQLG
QFQELRDIKQLC	sp|P04585|POL_HV1H2	1279	sp|Q9Y3Z3|SAMH1_HUMAN Deoxynucleoside triphosphate triphosphohydrolase SAMHD1 OS=Homo sapiens OX=9606 GN=SAMHD1 PE=1 SV=2	140	QFQRLRYIKQLG
QFQELRDIKQLC	sp|P04585|POL_HV1H2	1279	tr|A0A2R8YCS7|A0A2R8YCS7_HUMAN Deoxynucleoside triphosphate triphosphohydrolase SAMHD1 OS=Homo sapiens OX=9606 GN=SAMHD1 PE=1 SV=1	140	QFQRLRYIKQLG
QFQELRDIKQLC	sp|P04585|POL_HV1H2	1279	tr|A0A2R8YD90|A0A2R8YD90_HUMAN Deoxynucleoside triphosphate triphosphohydrolase SAMHD1 (Fragment) OS=Homo sapiens OX=9606 GN=SAMHD1 PE=1 SV=1	116	QFQRLRYIKQLG
PLTSERKEPKHP	sp|P04601|NEF_HV1H2	95	sp|Q15916|ZBTB6_HUMAN Zinc finger and BTB domain-containing protein 6 OS=Homo sapiens OX=9606 GN=ZBTB6 PE=1 SV=1	192	SLTSERKEMKSP
GTTQREKEVSIP	sp|P04591|GAG_HV1H2	173	tr|H0YAJ5|H0YAJ5_HUMAN Amyloid-beta A4 precursor protein-binding family B member 2 (Fragment) OS=Homo sapiens OX=9606 GN=APBB2 PE=1 SV=1	304	GTTQWERPVSIP
GTTQREKEVSIP	sp|P04591|GAG_HV1H2	173	tr|G5E9Y1|G5E9Y1_HUMAN Amyloid beta (A4) protein-binding, family B, member 2 (Fe65-like), isoform CRA_c OS=Homo sapiens OX=9606 GN=APBB2 PE=1 SV=1	313	GTTQWERPVSIP
GTTQREKEVSIP	sp|P04591|GAG_HV1H2	173	sp|Q92870|APBB2_HUMAN Amyloid-beta A4 precursor protein-binding family B member 2 OS=Homo sapiens OX=9606 GN=APBB2 PE=1 SV=3	313	GTTQWERPVSIP
EVPTTAGPTVVS	sp|P04591|GAG_HV1H2	299	sp|Q9ULL5|PRR12_HUMAN Proline-rich protein 12 OS=Homo sapiens OX=9606 GN=PRR12 PE=1 SV=3	1180	EVPTTAGPASAS
EVPTTAGPTVVS	sp|P04591|GAG_HV1H2	299	tr|A0A3Q5ADB5|A0A3Q5ADB5_HUMAN Proline-rich protein 12 OS=Homo sapiens OX=9606 GN=PRR12 PE=1 SV=1	359	EVPTTAGPASAS
LWETRKLAIGVQ	sp|P04578|ENV_HV1H2	51	sp|Q53H54|TYW2_HUMAN tRNA wybutosine-synthesizing protein 2 homolog OS=Homo sapiens OX=9606 GN=TRMT12 PE=1 SV=1	160	LWETVALALGVQ
RLQGGSRLEPPK	sp|P04618|REV_HV1H2	90	sp|P0CG20|PRR35_HUMAN Proline-rich protein 35 OS=Homo sapiens OX=9606 GN=PRR35 PE=1 SV=1	337	RLSLGSRLELPK
ECSVYPENTEDG	sp|P04585|POL_HV1H2	892	tr|A0A590PXD8|A0A590PXD8_HUMAN Cordon-bleu protein-like 1 OS=Homo sapiens OX=9606 GN=COBLL1 PE=1 SV=1	599	EIIVYPENTEDN
ECSVYPENTEDG	sp|P04585|POL_HV1H2	892	sp|Q53SF7|COBL1_HUMAN Cordon-bleu protein-like 1 OS=Homo sapiens OX=9606 GN=COBLL1 PE=1 SV=3	523	EIIVYPENTEDN
ECSVYPENTEDG	sp|P04585|POL_HV1H2	892	tr|A0A0X1KG75|A0A0X1KG75_HUMAN Cordon-bleu protein-like 1 (Fragment) OS=Homo sapiens OX=9606 GN=COBLL1 PE=1 SV=1	563	EIIVYPENTEDN
ECSVYPENTEDG	sp|P04585|POL_HV1H2	892	tr|A0A0D9SG04|A0A0D9SG04_HUMAN Cordon-bleu protein-like 1 OS=Homo sapiens OX=9606 GN=COBLL1 PE=1 SV=2	628	EIIVYPENTEDN
