query	query_seqname	query_start	target_seqname	target_start	target
KPAYGGTLLVGD	sp|P06794|VL1_HPV18	2	tr|A0A1B0GUZ4|A0A1B0GUZ4_HUMAN Aminoacylase-1 (Fragment) OS=Homo sapiens OX=9606 GN=ACY1 PE=4 SV=1	4	KPDYGGTWLCGD
KPAYGGTLLVGD	sp|P06794|VL1_HPV18	2	tr|A0A1B0GUT4|A0A1B0GUT4_HUMAN ABHD14A-ACY1 readthrough OS=Homo sapiens OX=9606 GN=ABHD14A-ACY1 PE=4 SV=1	57	KPDYGGTWLCGD
KPAYGGTLLVGD	sp|P06794|VL1_HPV18	2	tr|A0A1B0GU36|A0A1B0GU36_HUMAN Aminoacylase-1 OS=Homo sapiens OX=9606 GN=ACY1 PE=4 SV=1	28	KPDYGGTWLCGD
EDSTKDVKGEDS	sp|P06794|VL1_HPV18	512	sp|O14990|IPP2C_HUMAN Protein phosphatase inhibitor 2 family member C OS=Homo sapiens OX=9606 GN=PPP1R2C PE=1 SV=1	83	EDSVRDVEGEDS
AQTMENDDEKQS	sp|P06790|VE2_HPV18	120	sp|P30926|ACHB4_HUMAN Neuronal acetylcholine receptor subunit beta-4 OS=Homo sapiens OX=9606 GN=CHRNB4 PE=1 SV=2	435	AQHMKNDDEDQS
DIVRQTHAMGGS	sp|P06794|VL1_HPV18	186	sp|Q9ULK2|AT7L1_HUMAN Ataxin-7-like protein 1 OS=Homo sapiens OX=9606 GN=ATXN7L1 PE=1 SV=3	728	DIVRQVGAVGGS
DIVRQTHAMGGS	sp|P06794|VL1_HPV18	186	tr|C9K0V9|C9K0V9_HUMAN Ataxin-7-like protein 1 (Fragment) OS=Homo sapiens OX=9606 GN=ATXN7L1 PE=1 SV=1	604	DIVRQVGAVGGS
DIVRQTHAMGGS	sp|P06794|VL1_HPV18	186	tr|H0Y8A2|H0Y8A2_HUMAN Ataxin-7-like protein 1 (Fragment) OS=Homo sapiens OX=9606 GN=ATXN7L1 PE=1 SV=1	429	DIVRQVGAVGGS
LLHLRLFLPRLL	sp|P06463|VE6_HPV18	9	tr|C9JB28|C9JB28_HUMAN Zinc transporter ZIP5 (Fragment) OS=Homo sapiens OX=9606 GN=SLC39A5 PE=1 SV=1	202	LLLLRLLGPRLL
LLHLRLFLPRLL	sp|P06463|VE6_HPV18	9	sp|Q6ZMH5|S39A5_HUMAN Zinc transporter ZIP5 OS=Homo sapiens OX=9606 GN=SLC39A5 PE=1 SV=3	231	LLLLRLLGPRLL
AIPAALVITQKY	sp|P06793|VL2_HPV18	27	sp|Q6PGP7|TTC37_HUMAN Tetratricopeptide repeat protein 37 OS=Homo sapiens OX=9606 GN=TTC37 PE=1 SV=1	961	AIPAAQVILNKY
VGDSGFASRGDA	sp|P06793|VL2_HPV18	192	tr|F5GXL6|F5GXL6_HUMAN ATP-dependent DNA helicase DDX11 (Fragment) OS=Homo sapiens OX=9606 GN=DDX11 PE=4 SV=8	6	VRDSGMASRGPA
RNPSQPLPDSKE	sp|P06794|VL1_HPV18	402	sp|Q5VUJ6|LRCH2_HUMAN Leucine-rich repeat and calponin homology domain-containing protein 2 OS=Homo sapiens OX=9606 GN=LRCH2 PE=1 SV=2	324	RMPSQPLTDSME
SSDRSSATPTPT	sp|P06793|VL2_HPV18	10	sp|Q5M775|CYTSB_HUMAN Cytospin-B OS=Homo sapiens OX=9606 GN=SPECC1 PE=1 SV=1	133	SSPTSSNTPTPT
ELVNELLGSGEK	sp|P06789|VE1_HPV18	122	sp|Q8N988|ZN557_HUMAN Zinc finger protein 557 OS=Homo sapiens OX=9606 GN=ZNF557 PE=1 SV=2	22	ELVNELLKSWLK
PLPDSKELLSSH	sp|P06794|VL1_HPV18	407	sp|P23771|GATA3_HUMAN Trans-acting T-cell-specific transcription factor GATA-3 OS=Homo sapiens OX=9606 GN=GATA3 PE=1 SV=1	189	PLPDSMKLESSH
NTKRNYTKGLQA	sp|P06789|VE1_HPV18	225	tr|A0A0U1RQQ9|A0A0U1RQQ9_HUMAN SCY1-like protein 2 OS=Homo sapiens OX=9606 GN=SCYL2 PE=1 SV=1	768	NTKRNLTNGLNA
NTKRNYTKGLQA	sp|P06789|VE1_HPV18	225	sp|Q6P3W7|SCYL2_HUMAN SCY1-like protein 2 OS=Homo sapiens OX=9606 GN=SCYL2 PE=1 SV=1	764	NTKRNLTNGLNA
PPQGLSATSLEE	sp|P06788|VE7_HPV18	26	sp|Q75VX8|GARE2_HUMAN GRB2-associated and regulator of MAPK protein 2 OS=Homo sapiens OX=9606 GN=GAREM2 PE=1 SV=3	802	PPADLSALSLEE
TGTQVKCRVDPE	sp|P06790|VE2_HPV18	253	tr|J9JID3|J9JID3_HUMAN CMRF35-like molecule 7 OS=Homo sapiens OX=9606 GN=CD300LB PE=1 SV=1	113	LGTQVKVIVDPE
TGTQVKCRVDPE	sp|P06790|VE2_HPV18	253	sp|A8K4G0|CLM7_HUMAN CMRF35-like molecule 7 OS=Homo sapiens OX=9606 GN=CD300LB PE=1 SV=2	113	LGTQVKVIVDPE
IRGPVVLTDGVP	sp|P06793|VL2_HPV18	431	sp|Q9NT68|TEN2_HUMAN Teneurin-2 OS=Homo sapiens OX=9606 GN=TENM2 PE=1 SV=3	932	IRGQVVTTDGTP
IRGPVVLTDGVP	sp|P06793|VL2_HPV18	431	tr|G3V106|G3V106_HUMAN HCG38403, isoform CRA_b OS=Homo sapiens OX=9606 GN=TENM2 PE=1 SV=1	811	IRGQVVTTDGTP
IRGPVVLTDGVP	sp|P06793|VL2_HPV18	431	tr|F8VNQ3|F8VNQ3_HUMAN Teneurin-2 OS=Homo sapiens OX=9606 GN=TENM2 PE=1 SV=1	700	IRGQVVTTDGTP
TTPPGSVTSLRE	sp|P06793|VL2_HPV18	273	tr|A0A0A0MSD7|A0A0A0MSD7_HUMAN Receptor-type tyrosine-protein phosphatase N2 OS=Homo sapiens OX=9606 GN=PTPRN2 PE=1 SV=1	112	TYPPGSRTQLRE
TTPPGSVTSLRE	sp|P06793|VL2_HPV18	273	sp|Q92932|PTPR2_HUMAN Receptor-type tyrosine-protein phosphatase N2 OS=Homo sapiens OX=9606 GN=PTPRN2 PE=1 SV=2	203	TYPPGSRTQLRE
TTPPGSVTSLRE	sp|P06793|VL2_HPV18	273	tr|E7EM83|E7EM83_HUMAN Receptor-type tyrosine-protein phosphatase N2 OS=Homo sapiens OX=9606 GN=PTPRN2 PE=1 SV=1	165	TYPPGSRTQLRE
YIQNLGSNSSYF	sp|P06790|VE2_HPV18	220	tr|H0YFH6|H0YFH6_HUMAN C-type lectin domain family 4 member C (Fragment) OS=Homo sapiens OX=9606 GN=CLEC4C PE=1 SV=1	52	IIQNLKRNSSYF
YIQNLGSNSSYF	sp|P06790|VE2_HPV18	220	tr|H0YGB2|H0YGB2_HUMAN C-type lectin domain family 4 member C (Fragment) OS=Homo sapiens OX=9606 GN=CLEC4C PE=1 SV=1	90	IIQNLKRNSSYF
YIQNLGSNSSYF	sp|P06790|VE2_HPV18	220	sp|Q8WTT0|CLC4C_HUMAN C-type lectin domain family 4 member C OS=Homo sapiens OX=9606 GN=CLEC4C PE=1 SV=1	130	IIQNLKRNSSYF
FTLRATHQPLPS	sp|P0DKA6|VE8E2_HPV18	122	tr|C9IZG7|C9IZG7_HUMAN E3 ubiquitin-protein ligase MSL2 (Fragment) OS=Homo sapiens OX=9606 GN=MSL2 PE=1 SV=1	77	FTLCLTHSPLPS
FTLRATHQPLPS	sp|P0DKA6|VE8E2_HPV18	122	tr|C9J5S2|C9J5S2_HUMAN E3 ubiquitin-protein ligase MSL2 (Fragment) OS=Homo sapiens OX=9606 GN=MSL2 PE=1 SV=1	77	FTLCLTHSPLPS
FTLRATHQPLPS	sp|P0DKA6|VE8E2_HPV18	122	tr|C9IZ03|C9IZ03_HUMAN E3 ubiquitin-protein ligase MSL2 (Fragment) OS=Homo sapiens OX=9606 GN=MSL2 PE=1 SV=1	77	FTLCLTHSPLPS
FTLRATHQPLPS	sp|P0DKA6|VE8E2_HPV18	122	sp|Q9HCI7|MSL2_HUMAN E3 ubiquitin-protein ligase MSL2 OS=Homo sapiens OX=9606 GN=MSL2 PE=1 SV=2	151	FTLCLTHSPLPS
DSTKDVKGEDSV	sp|P06794|VL1_HPV18	513	sp|O14990|IPP2C_HUMAN Protein phosphatase inhibitor 2 family member C OS=Homo sapiens OX=9606 GN=PPP1R2C PE=1 SV=1	84	DSVRDVEGEDSV
PPFSEPGSFIQV	sp|P06793|VL2_HPV18	243	sp|Q9H7Z3|NRDE2_HUMAN Nuclear exosome regulator NRDE2 OS=Homo sapiens OX=9606 GN=NRDE2 PE=1 SV=3	245	PPSSEPISFIPV
PPFSEPGSFIQV	sp|P06793|VL2_HPV18	243	tr|H0YJT6|H0YJT6_HUMAN Nuclear exosome regulator NRDE2 (Fragment) OS=Homo sapiens OX=9606 GN=NRDE2 PE=1 SV=1	101	PPSSEPISFIPV
PKPAYGGTLLVG	sp|P06794|VL1_HPV18	1	tr|A0A1B0GUZ4|A0A1B0GUZ4_HUMAN Aminoacylase-1 (Fragment) OS=Homo sapiens OX=9606 GN=ACY1 PE=4 SV=1	3	PKPDYGGTWLCG
PKPAYGGTLLVG	sp|P06794|VL1_HPV18	1	tr|A0A1B0GUT4|A0A1B0GUT4_HUMAN ABHD14A-ACY1 readthrough OS=Homo sapiens OX=9606 GN=ABHD14A-ACY1 PE=4 SV=1	56	PKPDYGGTWLCG
PKPAYGGTLLVG	sp|P06794|VL1_HPV18	1	tr|A0A1B0GU36|A0A1B0GU36_HUMAN Aminoacylase-1 OS=Homo sapiens OX=9606 GN=ACY1 PE=4 SV=1	27	PKPDYGGTWLCG
QVSRGAKVTVLI	sp|P06793|VL2_HPV18	253	tr|E9PIM6|E9PIM6_HUMAN Thy-1 antigen (Fragment) OS=Homo sapiens OX=9606 GN=THY1 PE=1 SV=8	15	QVSRGQKVTSLT
QVSRGAKVTVLI	sp|P06793|VL2_HPV18	253	sp|P04216|THY1_HUMAN Thy-1 membrane glycoprotein OS=Homo sapiens OX=9606 GN=THY1 PE=1 SV=2	15	QVSRGQKVTSLT
QVSRGAKVTVLI	sp|P06793|VL2_HPV18	253	tr|E9PNQ8|E9PNQ8_HUMAN Thy-1 antigen (Fragment) OS=Homo sapiens OX=9606 GN=THY1 PE=1 SV=1	15	QVSRGQKVTSLT
QLSDAKASLSVD	sp|P06794|VL1_HPV18	235	sp|Q9NPG4|PCD12_HUMAN Protocadherin-12 OS=Homo sapiens OX=9606 GN=PCDH12 PE=1 SV=1	569	VLSDGKASLSVL
SARPAVPPFSEP	sp|P06793|VL2_HPV18	237	sp|O75154|RFIP3_HUMAN Rab11 family-interacting protein 3 OS=Homo sapiens OX=9606 GN=RAB11FIP3 PE=1 SV=1	3	SAPPASPPGSEP
LHLRLFLPRLLR	sp|P06463|VE6_HPV18	10	tr|C9JB28|C9JB28_HUMAN Zinc transporter ZIP5 (Fragment) OS=Homo sapiens OX=9606 GN=SLC39A5 PE=1 SV=1	203	LLLRLLGPRLLR
LHLRLFLPRLLR	sp|P06463|VE6_HPV18	10	sp|Q6ZMH5|S39A5_HUMAN Zinc transporter ZIP5 OS=Homo sapiens OX=9606 GN=SLC39A5 PE=1 SV=3	232	LLLRLLGPRLLR
NPVLVSRDKVFI	sp|P06789|VE1_HPV18	335	tr|H7C2H6|H7C2H6_HUMAN Fibronectin type III domain-containing protein 7 (Fragment) OS=Homo sapiens OX=9606 GN=FNDC7 PE=1 SV=1	155	NPVLVSSDRVEI
NPVLVSRDKVFI	sp|P06789|VE1_HPV18	335	sp|Q5VTL7|FNDC7_HUMAN Fibronectin type III domain-containing protein 7 OS=Homo sapiens OX=9606 GN=FNDC7 PE=2 SV=3	379	NPVLVSSDRVEI
CRTQLAAPLAEE	sp|P06463|VE6_HPV18	29	sp|Q13395|TARB1_HUMAN Probable methyltransferase TARBP1 OS=Homo sapiens OX=9606 GN=TARBP1 PE=1 SV=1	112	GRPQLAAALAEE
IVRQTHAMGGSS	sp|P06794|VL1_HPV18	187	sp|Q9ULK2|AT7L1_HUMAN Ataxin-7-like protein 1 OS=Homo sapiens OX=9606 GN=ATXN7L1 PE=1 SV=3	729	IVRQVGAVGGSS
IVRQTHAMGGSS	sp|P06794|VL1_HPV18	187	tr|C9K0V9|C9K0V9_HUMAN Ataxin-7-like protein 1 (Fragment) OS=Homo sapiens OX=9606 GN=ATXN7L1 PE=1 SV=1	605	IVRQVGAVGGSS
IVRQTHAMGGSS	sp|P06794|VL1_HPV18	187	tr|H0Y8A2|H0Y8A2_HUMAN Ataxin-7-like protein 1 (Fragment) OS=Homo sapiens OX=9606 GN=ATXN7L1 PE=1 SV=1	430	IVRQVGAVGGSS
MPLSLILADSGI	sp|P06789|VE1_HPV18	183	tr|A0A494C187|A0A494C187_HUMAN RPE-retinal G protein-coupled receptor OS=Homo sapiens OX=9606 GN=RGR PE=1 SV=1	54	LVLSLALADSGI
MPLSLILADSGI	sp|P06789|VE1_HPV18	183	tr|A0A494C1E7|A0A494C1E7_HUMAN RPE-retinal G protein-coupled receptor OS=Homo sapiens OX=9606 GN=RGR PE=4 SV=1	54	LVLSLALADSGI
MPLSLILADSGI	sp|P06789|VE1_HPV18	183	tr|A0A494C1U1|A0A494C1U1_HUMAN RPE-retinal G protein-coupled receptor OS=Homo sapiens OX=9606 GN=RGR PE=4 SV=1	54	LVLSLALADSGI
MPLSLILADSGI	sp|P06789|VE1_HPV18	183	sp|P47804|RGR_HUMAN RPE-retinal G protein-coupled receptor OS=Homo sapiens OX=9606 GN=RGR PE=1 SV=1	54	LVLSLALADSGI
DPCLLHLRLFLP	sp|P06463|VE6_HPV18	6	tr|H0YFB4|H0YFB4_HUMAN Phosphatidylinositol 3,4,5-trisphosphate 5-phosphatase 2 (Fragment) OS=Homo sapiens OX=9606 GN=INPPL1 PE=4 SV=1	4	PPCLGHLRLELP
PLSLILADSGID	sp|P06789|VE1_HPV18	184	sp|Q86XH1|DRC11_HUMAN Dynein regulatory complex protein 11 OS=Homo sapiens OX=9606 GN=IQCA1 PE=2 SV=1	137	ILAQILADSGID
PLSLILADSGID	sp|P06789|VE1_HPV18	184	tr|H7BZR5|H7BZR5_HUMAN Dynein regulatory complex protein 11 (Fragment) OS=Homo sapiens OX=9606 GN=IQCA1 PE=1 SV=1	156	ILAQILADSGID
PLSLILADSGID	sp|P06789|VE1_HPV18	184	tr|A0A0A0MSY6|A0A0A0MSY6_HUMAN Dynein regulatory complex protein 11 OS=Homo sapiens OX=9606 GN=IQCA1 PE=1 SV=1	144	ILAQILADSGID
PLSLILADSGID	sp|P06789|VE1_HPV18	184	tr|A0A494C187|A0A494C187_HUMAN RPE-retinal G protein-coupled receptor OS=Homo sapiens OX=9606 GN=RGR PE=1 SV=1	55	VLSLALADSGIS
PLSLILADSGID	sp|P06789|VE1_HPV18	184	tr|A0A494C1E7|A0A494C1E7_HUMAN RPE-retinal G protein-coupled receptor OS=Homo sapiens OX=9606 GN=RGR PE=4 SV=1	55	VLSLALADSGIS
PLSLILADSGID	sp|P06789|VE1_HPV18	184	tr|A0A494C1U1|A0A494C1U1_HUMAN RPE-retinal G protein-coupled receptor OS=Homo sapiens OX=9606 GN=RGR PE=4 SV=1	55	VLSLALADSGIS
PLSLILADSGID	sp|P06789|VE1_HPV18	184	sp|P47804|RGR_HUMAN RPE-retinal G protein-coupled receptor OS=Homo sapiens OX=9606 GN=RGR PE=1 SV=1	55	VLSLALADSGIS
LSLILADSGIDF	sp|P06789|VE1_HPV18	185	tr|A0A494C187|A0A494C187_HUMAN RPE-retinal G protein-coupled receptor OS=Homo sapiens OX=9606 GN=RGR PE=1 SV=1	56	LSLALADSGISL
LSLILADSGIDF	sp|P06789|VE1_HPV18	185	tr|A0A494C1E7|A0A494C1E7_HUMAN RPE-retinal G protein-coupled receptor OS=Homo sapiens OX=9606 GN=RGR PE=4 SV=1	56	LSLALADSGISL
LSLILADSGIDF	sp|P06789|VE1_HPV18	185	tr|A0A494C1U1|A0A494C1U1_HUMAN RPE-retinal G protein-coupled receptor OS=Homo sapiens OX=9606 GN=RGR PE=4 SV=1	56	LSLALADSGISL
LSLILADSGIDF	sp|P06789|VE1_HPV18	185	sp|P47804|RGR_HUMAN RPE-retinal G protein-coupled receptor OS=Homo sapiens OX=9606 GN=RGR PE=1 SV=1	56	LSLALADSGISL
LSLILADSGIDF	sp|P06789|VE1_HPV18	185	sp|Q86XH1|DRC11_HUMAN Dynein regulatory complex protein 11 OS=Homo sapiens OX=9606 GN=IQCA1 PE=2 SV=1	138	LAQILADSGIDT
LSLILADSGIDF	sp|P06789|VE1_HPV18	185	tr|H7BZR5|H7BZR5_HUMAN Dynein regulatory complex protein 11 (Fragment) OS=Homo sapiens OX=9606 GN=IQCA1 PE=1 SV=1	157	LAQILADSGIDT
LSLILADSGIDF	sp|P06789|VE1_HPV18	185	tr|A0A0A0MSY6|A0A0A0MSY6_HUMAN Dynein regulatory complex protein 11 OS=Homo sapiens OX=9606 GN=IQCA1 PE=1 SV=1	145	LAQILADSGIDT
IQNLGSNSSYFY	sp|P06790|VE2_HPV18	221	tr|H0YFH6|H0YFH6_HUMAN C-type lectin domain family 4 member C (Fragment) OS=Homo sapiens OX=9606 GN=CLEC4C PE=1 SV=1	53	IQNLKRNSSYFL
IQNLGSNSSYFY	sp|P06790|VE2_HPV18	221	tr|H0YGB2|H0YGB2_HUMAN C-type lectin domain family 4 member C (Fragment) OS=Homo sapiens OX=9606 GN=CLEC4C PE=1 SV=1	91	IQNLKRNSSYFL
IQNLGSNSSYFY	sp|P06790|VE2_HPV18	221	sp|Q8WTT0|CLC4C_HUMAN C-type lectin domain family 4 member C OS=Homo sapiens OX=9606 GN=CLEC4C PE=1 SV=1	131	IQNLKRNSSYFL
GTQVKCRVDPEK	sp|P06790|VE2_HPV18	254	tr|J9JID3|J9JID3_HUMAN CMRF35-like molecule 7 OS=Homo sapiens OX=9606 GN=CD300LB PE=1 SV=1	114	GTQVKVIVDPEG
GTQVKCRVDPEK	sp|P06790|VE2_HPV18	254	sp|A8K4G0|CLM7_HUMAN CMRF35-like molecule 7 OS=Homo sapiens OX=9606 GN=CD300LB PE=1 SV=2	114	GTQVKVIVDPEG
SQLSDAKASLSV	sp|P06794|VL1_HPV18	234	sp|Q9NPG4|PCD12_HUMAN Protocadherin-12 OS=Homo sapiens OX=9606 GN=PCDH12 PE=1 SV=1	568	PVLSDGKASLSV
PCLLHLRLFLPR	sp|P06463|VE6_HPV18	7	tr|H0YFB4|H0YFB4_HUMAN Phosphatidylinositol 3,4,5-trisphosphate 5-phosphatase 2 (Fragment) OS=Homo sapiens OX=9606 GN=INPPL1 PE=4 SV=1	5	PCLGHLRLELPP
DRATFGNSPERQ	sp|P06790|VE2_HPV18	270	tr|F5H6B2|F5H6B2_HUMAN Cell surface hyaluronidase OS=Homo sapiens OX=9606 GN=CEMIP2 PE=1 SV=1	56	DRATFAFSPEEQ
DRATFGNSPERQ	sp|P06790|VE2_HPV18	270	sp|Q9UHN6|CEIP2_HUMAN Cell surface hyaluronidase OS=Homo sapiens OX=9606 GN=CEMIP2 PE=1 SV=1	56	DRATFAFSPEEQ
IQVSRGAKVTVL	sp|P06793|VL2_HPV18	252	tr|E9PIM6|E9PIM6_HUMAN Thy-1 antigen (Fragment) OS=Homo sapiens OX=9606 GN=THY1 PE=1 SV=8	14	LQVSRGQKVTSL
IQVSRGAKVTVL	sp|P06793|VL2_HPV18	252	sp|P04216|THY1_HUMAN Thy-1 membrane glycoprotein OS=Homo sapiens OX=9606 GN=THY1 PE=1 SV=2	14	LQVSRGQKVTSL
IQVSRGAKVTVL	sp|P06793|VL2_HPV18	252	tr|E9PNQ8|E9PNQ8_HUMAN Thy-1 antigen (Fragment) OS=Homo sapiens OX=9606 GN=THY1 PE=1 SV=1	14	LQVSRGQKVTSL
VSRTEISLTRTS	sp|P06793|VL2_HPV18	383	sp|Q8WXI7|MUC16_HUMAN Mucin-16 OS=Homo sapiens OX=9606 GN=MUC16 PE=1 SV=3	5519	ASRTEISSSRTS
RTQLAAPLAEET	sp|P06463|VE6_HPV18	30	sp|Q13395|TARB1_HUMAN Probable methyltransferase TARBP1 OS=Homo sapiens OX=9606 GN=TARBP1 PE=1 SV=1	113	RPQLAAALAEEA
SRTEISLTRTSH	sp|P06793|VL2_HPV18	384	sp|Q8WXI7|MUC16_HUMAN Mucin-16 OS=Homo sapiens OX=9606 GN=MUC16 PE=1 SV=3	5520	SRTEISSSRTSI
VQDHNTMGSVTL	sp|P0DKA6|VE8E2_HPV18	82	sp|Q9Y2I1|NISCH_HUMAN Nischarin OS=Homo sapiens OX=9606 GN=NISCH PE=1 SV=3	1437	VQGHDLMGSVTL
VSAQQVGDSGFA	sp|P06793|VL2_HPV18	187	sp|Q96IZ5|RBM41_HUMAN RNA-binding protein 41 OS=Homo sapiens OX=9606 GN=RBM41 PE=1 SV=2	219	VSATSVGDSGTA
APTAQPRDNFRT	sp|P06789|VE1_HPV18	456	sp|O95428|PPN_HUMAN Papilin OS=Homo sapiens OX=9606 GN=PAPLN PE=2 SV=4	1223	APTAQPRDPGRD
ATSLEEQTTHLN	sp|P06788|VE7_HPV18	32	tr|F5GX47|F5GX47_HUMAN FGFR1 oncogene partner 2 (Fragment) OS=Homo sapiens OX=9606 GN=FGFR1OP2 PE=1 SV=1	26	AESLIEQTTALN
ATSLEEQTTHLN	sp|P06788|VE7_HPV18	32	sp|Q9NVK5|FGOP2_HUMAN FGFR1 oncogene partner 2 OS=Homo sapiens OX=9606 GN=FGFR1OP2 PE=1 SV=1	26	AESLIEQTTALN
QAPTAQPRDNFR	sp|P06789|VE1_HPV18	455	sp|O95428|PPN_HUMAN Papilin OS=Homo sapiens OX=9606 GN=PAPLN PE=2 SV=4	1222	PAPTAQPRDPGR
GWTPVVTVTGSS	sp|P06793|VL2_HPV18	108	sp|Q6QNK2|AGRD1_HUMAN Adhesion G-protein coupled receptor D1 OS=Homo sapiens OX=9606 GN=ADGRD1 PE=1 SV=1	367	GSTPQVTVEGSS
LSDAKASLSVDP	sp|P06794|VL1_HPV18	236	sp|Q9NPG4|PCD12_HUMAN Protocadherin-12 OS=Homo sapiens OX=9606 GN=PCDH12 PE=1 SV=1	570	LSDGKASLSVLV
