query	query_seqname	query_start	target_seqname	target_start	target
GEAEETAEPLLM	tr|Q9IG40|Q9IG40_9FLAV	3214	sp|O60287|NPA1P_HUMAN Nucleolar pre-ribosomal-associated protein 1 OS=Homo sapiens OX=9606 GN=URB1 PE=1 SV=4	2037	GEAEEMADPELM
ANLGERNDFETK	tr|Q9IG40|Q9IG40_9FLAV	238	sp|Q9BUI4|RPC3_HUMAN DNA-directed RNA polymerase III subunit RPC3 OS=Homo sapiens OX=9606 GN=POLR3C PE=1 SV=1	444	ANLIERRQFETK
KSDARLGGSRRR	tr|Q9IG40|Q9IG40_9FLAV	880	sp|Q53GL0|PKHO1_HUMAN Pleckstrin homology domain-containing family O member 1 OS=Homo sapiens OX=9606 GN=PLEKHO1 PE=1 SV=2	213	KSVAQLAGSRRR
KSDARLGGSRRR	tr|Q9IG40|Q9IG40_9FLAV	880	tr|Q5T4P9|Q5T4P9_HUMAN Pleckstrin homology domain containing, family O member 1 OS=Homo sapiens OX=9606 GN=PLEKHO1 PE=1 SV=1	30	KSVAQLAGSRRR
FEAVLLAVTLRV	tr|Q9IG40|Q9IG40_9FLAV	2673	sp|Q8WUX1|S38A5_HUMAN Sodium-coupled neutral amino acid transporter 5 OS=Homo sapiens OX=9606 GN=SLC38A5 PE=1 SV=1	339	RLAVLLAVTLTV
FEAVLLAVTLRV	tr|Q9IG40|Q9IG40_9FLAV	2673	tr|A0A087X1I6|A0A087X1I6_HUMAN Sodium-coupled neutral amino acid transporter 5 OS=Homo sapiens OX=9606 GN=SLC38A5 PE=1 SV=1	205	RLAVLLAVTLTV
LNLSRATITALV	tr|Q9IG40|Q9IG40_9FLAV	1785	tr|D6R9F7|D6R9F7_HUMAN Mitogen-activated protein kinase-binding protein 1 (Fragment) OS=Homo sapiens OX=9606 GN=MAPKBP1 PE=1 SV=1	86	LNSSRKTITALA
LNLSRATITALV	tr|Q9IG40|Q9IG40_9FLAV	1785	sp|O60336|MABP1_HUMAN Mitogen-activated protein kinase-binding protein 1 OS=Homo sapiens OX=9606 GN=MAPKBP1 PE=1 SV=4	86	LNSSRKTITALA
LNLSRATITALV	tr|Q9IG40|Q9IG40_9FLAV	1785	tr|D6RHX7|D6RHX7_HUMAN Mitogen-activated protein kinase-binding protein 1 OS=Homo sapiens OX=9606 GN=MAPKBP1 PE=1 SV=1	86	LNSSRKTITALA
GFLGLTTLRQAV	tr|Q9IG40|Q9IG40_9FLAV	3396	tr|A0A2R8Y7Y9|A0A2R8Y7Y9_HUMAN Flavin reductase (NADPH) OS=Homo sapiens OX=9606 GN=BLVRB PE=1 SV=1	13	GQTGLTTLAQAV
GFLGLTTLRQAV	tr|Q9IG40|Q9IG40_9FLAV	3396	sp|P30043|BLVRB_HUMAN Flavin reductase (NADPH) OS=Homo sapiens OX=9606 GN=BLVRB PE=1 SV=3	13	GQTGLTTLAQAV
GFLGLTTLRQAV	tr|Q9IG40|Q9IG40_9FLAV	3396	tr|M0R192|M0R192_HUMAN Flavin reductase (NADPH) OS=Homo sapiens OX=9606 GN=BLVRB PE=1 SV=1	13	GQTGLTTLAQAV
GFLGLTTLRQAV	tr|Q9IG40|Q9IG40_9FLAV	3396	tr|M0QZL1|M0QZL1_HUMAN Flavin reductase (NADPH) OS=Homo sapiens OX=9606 GN=BLVRB PE=1 SV=1	13	GQTGLTTLAQAV
GFLGLTTLRQAV	tr|Q9IG40|Q9IG40_9FLAV	3396	tr|A0A2R8YEP4|A0A2R8YEP4_HUMAN Flavin reductase (NADPH) OS=Homo sapiens OX=9606 GN=BLVRB PE=1 SV=1	13	GQTGLTTLAQAV
LEALRLFINAGR	tr|Q9IG40|Q9IG40_9FLAV	1499	sp|Q96FA3|PELI1_HUMAN E3 ubiquitin-protein ligase pellino homolog 1 OS=Homo sapiens OX=9606 GN=PELI1 PE=1 SV=2	268	LEALRQEINAAR
AEQLSVLWKVVQ	tr|Q9IG40|Q9IG40_9FLAV	1574	sp|Q5JTZ9|SYAM_HUMAN Alanine--tRNA ligase, mitochondrial OS=Homo sapiens OX=9606 GN=AARS2 PE=1 SV=1	890	AESLSVLVKVVR
AVLLAVTLRVFG	tr|Q9IG40|Q9IG40_9FLAV	2675	sp|Q8WUX1|S38A5_HUMAN Sodium-coupled neutral amino acid transporter 5 OS=Homo sapiens OX=9606 GN=SLC38A5 PE=1 SV=1	341	AVLLAVTLTVPV
AVLLAVTLRVFG	tr|Q9IG40|Q9IG40_9FLAV	2675	tr|A0A087X1I6|A0A087X1I6_HUMAN Sodium-coupled neutral amino acid transporter 5 OS=Homo sapiens OX=9606 GN=SLC38A5 PE=1 SV=1	207	AVLLAVTLTVPV
RHGSDGSVGYVG	tr|Q9IG40|Q9IG40_9FLAV	3239	tr|A0A087WTA8|A0A087WTA8_HUMAN Collagen alpha-2(I) chain OS=Homo sapiens OX=9606 GN=COL1A2 PE=1 SV=1	231	ARGSDGSVGPVG
RHGSDGSVGYVG	tr|Q9IG40|Q9IG40_9FLAV	3239	sp|P08123|CO1A2_HUMAN Collagen alpha-2(I) chain OS=Homo sapiens OX=9606 GN=COL1A2 PE=1 SV=7	233	ARGSDGSVGPVG
FVYELQRLAAEF	tr|Q9IG40|Q9IG40_9FLAV	2808	tr|D6RCM4|D6RCM4_HUMAN RNA helicase (Fragment) OS=Homo sapiens OX=9606 GN=DDX4 PE=1 SV=1	464	FPEEIQRLAAEF
FVYELQRLAAEF	tr|Q9IG40|Q9IG40_9FLAV	2808	sp|Q9NQI0|DDX4_HUMAN Probable ATP-dependent RNA helicase DDX4 OS=Homo sapiens OX=9606 GN=DDX4 PE=1 SV=2	484	FPEEIQRLAAEF
VNSWVMLIVVGT	tr|Q9IG40|Q9IG40_9FLAV	1698	sp|Q96RD0|OR8B2_HUMAN Olfactory receptor 8B2 OS=Homo sapiens OX=9606 GN=OR8B2 PE=3 SV=3	194	VNEVVVLIVVGT
EDQLCRGIKEGR	tr|Q9IG40|Q9IG40_9FLAV	2924	sp|P53396|ACLY_HUMAN ATP-citrate synthase OS=Homo sapiens OX=9606 GN=ACLY PE=1 SV=3	724	EYKICRGIKEGR
LADPSLPFELRG	tr|Q9IG40|Q9IG40_9FLAV	1734	sp|O60500|NPHN_HUMAN Nephrin OS=Homo sapiens OX=9606 GN=NPHS1 PE=1 SV=1	1227	LEPDSLPFELRG
LADPSLPFELRG	tr|Q9IG40|Q9IG40_9FLAV	1734	sp|Q969K4|ABTB1_HUMAN Ankyrin repeat and BTB/POZ domain-containing protein 1 OS=Homo sapiens OX=9606 GN=ABTB1 PE=1 SV=1	244	LADCALPPELRG
LADPSLPFELRG	tr|Q9IG40|Q9IG40_9FLAV	1734	tr|H7C4W8|H7C4W8_HUMAN Ankyrin repeat and BTB/POZ domain-containing protein 1 (Fragment) OS=Homo sapiens OX=9606 GN=ABTB1 PE=1 SV=1	27	LADCALPPELRG
GSGLTGLLKWQV	tr|Q9IG40|Q9IG40_9FLAV	1831	tr|H0YKH9|H0YKH9_HUMAN Alpha-mannosidase 2x (Fragment) OS=Homo sapiens OX=9606 GN=MAN2A2 PE=1 SV=1	25	FSGLTGLLKPYV
ERLSGRLGTDGS	tr|Q9IG40|Q9IG40_9FLAV	62	tr|M0QZR4|M0QZR4_HUMAN Rho guanine nucleotide exchange factor 1 OS=Homo sapiens OX=9606 GN=ARHGEF1 PE=1 SV=1	373	ERLSGRLGRSES
PTGVGYAEVQAV	tr|Q9IG40|Q9IG40_9FLAV	3361	sp|Q67FW5|B3GNL_HUMAN UDP-GlcNAc:betaGal beta-1,3-N-acetylglucosaminyltransferase-like protein 1 OS=Homo sapiens OX=9606 GN=B3GNTL1 PE=2 SV=2	90	PRGVGYAKNQAV
GSDGSVGYVGDH	tr|Q9IG40|Q9IG40_9FLAV	3241	tr|A0A087WTA8|A0A087WTA8_HUMAN Collagen alpha-2(I) chain OS=Homo sapiens OX=9606 GN=COL1A2 PE=1 SV=1	233	GSDGSVGPVGPA
GSDGSVGYVGDH	tr|Q9IG40|Q9IG40_9FLAV	3241	sp|P08123|CO1A2_HUMAN Collagen alpha-2(I) chain OS=Homo sapiens OX=9606 GN=COL1A2 PE=1 SV=7	235	GSDGSVGPVGPA
PFELLQSLGSGL	tr|Q9IG40|Q9IG40_9FLAV	1823	sp|O94956|SO2B1_HUMAN Solute carrier organic anion transporter family member 2B1 OS=Homo sapiens OX=9606 GN=SLCO2B1 PE=1 SV=2	563	PFLLLVSLGSAL
PFELLQSLGSGL	tr|Q9IG40|Q9IG40_9FLAV	1823	tr|A0A024R5I4|A0A024R5I4_HUMAN Solute carrier organic anion transporter family member OS=Homo sapiens OX=9606 GN=SLCO2B1 PE=1 SV=1	563	PFLLLVSLGSAL
PFELLQSLGSGL	tr|Q9IG40|Q9IG40_9FLAV	1823	tr|A0A0A0MTF1|A0A0A0MTF1_HUMAN Solute carrier organic anion transporter family member OS=Homo sapiens OX=9606 GN=SLCO2B1 PE=1 SV=1	419	PFLLLVSLGSAL
PFELLQSLGSGL	tr|Q9IG40|Q9IG40_9FLAV	1823	tr|E9PRW4|E9PRW4_HUMAN Solute carrier organic anion transporter family member OS=Homo sapiens OX=9606 GN=SLCO2B1 PE=1 SV=2	447	PFLLLVSLGSAL
QRYLLSDEGEVL	tr|Q9IG40|Q9IG40_9FLAV	1632	tr|A0A590UK63|A0A590UK63_HUMAN DNA-directed DNA polymerase (Fragment) OS=Homo sapiens OX=9606 GN=POLG PE=1 SV=1	266	IRYRLSDEGEWL
VAEQLSVLWKVV	tr|Q9IG40|Q9IG40_9FLAV	1573	sp|Q5JTZ9|SYAM_HUMAN Alanine--tRNA ligase, mitochondrial OS=Homo sapiens OX=9606 GN=AARS2 PE=1 SV=1	889	SAESLSVLVKVV
LLNLSRATITAL	tr|Q9IG40|Q9IG40_9FLAV	1784	tr|D6R9F7|D6R9F7_HUMAN Mitogen-activated protein kinase-binding protein 1 (Fragment) OS=Homo sapiens OX=9606 GN=MAPKBP1 PE=1 SV=1	85	ILNSSRKTITAL
LLNLSRATITAL	tr|Q9IG40|Q9IG40_9FLAV	1784	sp|O60336|MABP1_HUMAN Mitogen-activated protein kinase-binding protein 1 OS=Homo sapiens OX=9606 GN=MAPKBP1 PE=1 SV=4	85	ILNSSRKTITAL
LLNLSRATITAL	tr|Q9IG40|Q9IG40_9FLAV	1784	tr|D6RHX7|D6RHX7_HUMAN Mitogen-activated protein kinase-binding protein 1 OS=Homo sapiens OX=9606 GN=MAPKBP1 PE=1 SV=1	85	ILNSSRKTITAL
LALVEVGLLAAT	tr|Q9IG40|Q9IG40_9FLAV	2202	tr|F8WDQ7|F8WDQ7_HUMAN N-acetylneuraminate 9-O-acetyltransferase OS=Homo sapiens OX=9606 GN=CASD1 PE=1 SV=1	25	LALVAVLLLAAC
LALVEVGLLAAT	tr|Q9IG40|Q9IG40_9FLAV	2202	sp|Q96PB1|CASD1_HUMAN N-acetylneuraminate 9-O-acetyltransferase OS=Homo sapiens OX=9606 GN=CASD1 PE=1 SV=1	25	LALVAVLLLAAC
LALVEVGLLAAT	tr|Q9IG40|Q9IG40_9FLAV	2202	tr|F8WDW8|F8WDW8_HUMAN N-acetylneuraminate 9-O-acetyltransferase OS=Homo sapiens OX=9606 GN=CASD1 PE=1 SV=1	25	LALVAVLLLAAC
SGLTGLLKWQVT	tr|Q9IG40|Q9IG40_9FLAV	1832	tr|H0YKH9|H0YKH9_HUMAN Alpha-mannosidase 2x (Fragment) OS=Homo sapiens OX=9606 GN=MAN2A2 PE=1 SV=1	26	SGLTGLLKPYVP
YMGLGAAEVAVL	tr|Q9IG40|Q9IG40_9FLAV	2464	sp|Q6UXZ4|UNC5D_HUMAN Netrin receptor UNC5D OS=Homo sapiens OX=9606 GN=UNC5D PE=1 SV=1	383	YSGLGAAVVAVA
YMGLGAAEVAVL	tr|Q9IG40|Q9IG40_9FLAV	2464	tr|C9J2B6|C9J2B6_HUMAN Netrin receptor UNC5 OS=Homo sapiens OX=9606 GN=UNC5D PE=1 SV=1	388	YSGLGAAVVAVA
YMGLGAAEVAVL	tr|Q9IG40|Q9IG40_9FLAV	2464	tr|C9J1I0|C9J1I0_HUMAN Netrin receptor UNC5 OS=Homo sapiens OX=9606 GN=UNC5D PE=1 SV=1	316	YSGLGAAVVAVA
YMGLGAAEVAVL	tr|Q9IG40|Q9IG40_9FLAV	2464	tr|H7BXJ2|H7BXJ2_HUMAN Netrin receptor UNC5 OS=Homo sapiens OX=9606 GN=UNC5D PE=1 SV=1	327	YSGLGAAVVAVA
LAPNFILLNSRG	tr|Q9IG40|Q9IG40_9FLAV	371	tr|F5H7T0|F5H7T0_HUMAN Non-specific serine/threonine protein kinase OS=Homo sapiens OX=9606 GN=RPS6KC1 PE=1 SV=1	718	LNPNNILLNDRG
LAPNFILLNSRG	tr|Q9IG40|Q9IG40_9FLAV	371	tr|F6RJM5|F6RJM5_HUMAN Non-specific serine/threonine protein kinase OS=Homo sapiens OX=9606 GN=RPS6KC1 PE=1 SV=1	749	LNPNNILLNDRG
LAPNFILLNSRG	tr|Q9IG40|Q9IG40_9FLAV	371	sp|Q96S38|KS6C1_HUMAN Ribosomal protein S6 kinase delta-1 OS=Homo sapiens OX=9606 GN=RPS6KC1 PE=1 SV=2	930	LNPNNILLNDRG
LAPNFILLNSRG	tr|Q9IG40|Q9IG40_9FLAV	371	tr|A0A087X1U5|A0A087X1U5_HUMAN Ribosomal protein S6 kinase delta-1 OS=Homo sapiens OX=9606 GN=RPS6KC1 PE=1 SV=1	465	LNPNNILLNDRG
RTWEEVVRGGRV	tr|Q9IG40|Q9IG40_9FLAV	1611	tr|A6NGQ3|A6NGQ3_HUMAN Non-specific serine/threonine protein kinase OS=Homo sapiens OX=9606 GN=OBSCN PE=1 SV=5	455	RNQEEVVAGGRV
RTWEEVVRGGRV	tr|Q9IG40|Q9IG40_9FLAV	1611	tr|A0A590UJ10|A0A590UJ10_HUMAN Obscurin OS=Homo sapiens OX=9606 GN=OBSCN PE=1 SV=1	455	RNQEEVVAGGRV
RTWEEVVRGGRV	tr|Q9IG40|Q9IG40_9FLAV	1611	sp|Q5VST9|OBSCN_HUMAN Obscurin OS=Homo sapiens OX=9606 GN=OBSCN PE=1 SV=3	455	RNQEEVVAGGRV
ELQRLAAEFGAG	tr|Q9IG40|Q9IG40_9FLAV	2811	tr|K7EKF6|K7EKF6_HUMAN Angiopoietin-related protein 6 OS=Homo sapiens OX=9606 GN=ANGPTL6 PE=1 SV=1	78	ELQRLAAADGAV
ELQRLAAEFGAG	tr|Q9IG40|Q9IG40_9FLAV	2811	sp|Q8NI99|ANGL6_HUMAN Angiopoietin-related protein 6 OS=Homo sapiens OX=9606 GN=ANGPTL6 PE=1 SV=1	78	ELQRLAAADGAV
SGGYGIHEMKQL	tr|Q9IG40|Q9IG40_9FLAV	858	tr|B4DGI9|B4DGI9_HUMAN Transcription factor 12 (Fragment) OS=Homo sapiens OX=9606 GN=TCF12 PE=1 SV=1	47	SGSGTIHEMKQL
TQLRSAANLGER	tr|Q9IG40|Q9IG40_9FLAV	232	tr|B1AM99|B1AM99_HUMAN Contactin-associated protein-like 3 OS=Homo sapiens OX=9606 GN=CNTNAP3 PE=1 SV=1	663	GQLRSAVNLAER
TQLRSAANLGER	tr|Q9IG40|Q9IG40_9FLAV	232	tr|A6NC89|A6NC89_HUMAN Contactin-associated protein-like 3 OS=Homo sapiens OX=9606 GN=CNTNAP3 PE=1 SV=2	663	GQLRSAVNLAER
TQLRSAANLGER	tr|Q9IG40|Q9IG40_9FLAV	232	tr|B1AMA2|B1AMA2_HUMAN Contactin-associated protein-like 3 OS=Homo sapiens OX=9606 GN=CNTNAP3 PE=1 SV=1	576	GQLRSAVNLAER
TQLRSAANLGER	tr|Q9IG40|Q9IG40_9FLAV	232	sp|Q9BZ76|CNTP3_HUMAN Contactin-associated protein-like 3 OS=Homo sapiens OX=9606 GN=CNTNAP3 PE=2 SV=3	664	GQLRSAVNLAER
TQLRSAANLGER	tr|Q9IG40|Q9IG40_9FLAV	232	tr|F2Z2X6|F2Z2X6_HUMAN Contactin-associated protein-like 3 OS=Homo sapiens OX=9606 GN=CNTNAP3 PE=1 SV=1	570	GQLRSAVNLAER
LYMGLGAAEVAV	tr|Q9IG40|Q9IG40_9FLAV	2463	sp|Q6UXZ4|UNC5D_HUMAN Netrin receptor UNC5D OS=Homo sapiens OX=9606 GN=UNC5D PE=1 SV=1	382	LYSGLGAAVVAV
LYMGLGAAEVAV	tr|Q9IG40|Q9IG40_9FLAV	2463	tr|C9J2B6|C9J2B6_HUMAN Netrin receptor UNC5 OS=Homo sapiens OX=9606 GN=UNC5D PE=1 SV=1	387	LYSGLGAAVVAV
LYMGLGAAEVAV	tr|Q9IG40|Q9IG40_9FLAV	2463	tr|C9J1I0|C9J1I0_HUMAN Netrin receptor UNC5 OS=Homo sapiens OX=9606 GN=UNC5D PE=1 SV=1	315	LYSGLGAAVVAV
LYMGLGAAEVAV	tr|Q9IG40|Q9IG40_9FLAV	2463	tr|H7BXJ2|H7BXJ2_HUMAN Netrin receptor UNC5 OS=Homo sapiens OX=9606 GN=UNC5D PE=1 SV=1	326	LYSGLGAAVVAV
TFPVALSLEPGA	tr|Q9IG40|Q9IG40_9FLAV	37	sp|Q8N0Z3|SPICE_HUMAN Spindle and centriole-associated protein 1 OS=Homo sapiens OX=9606 GN=SPICE1 PE=1 SV=1	715	TFPVAQSLTPGS
YELQRLAAEFGA	tr|Q9IG40|Q9IG40_9FLAV	2810	tr|K7EKF6|K7EKF6_HUMAN Angiopoietin-related protein 6 OS=Homo sapiens OX=9606 GN=ANGPTL6 PE=1 SV=1	77	RELQRLAAADGA
YELQRLAAEFGA	tr|Q9IG40|Q9IG40_9FLAV	2810	sp|Q8NI99|ANGL6_HUMAN Angiopoietin-related protein 6 OS=Homo sapiens OX=9606 GN=ANGPTL6 PE=1 SV=1	77	RELQRLAAADGA
QDRGLVATDKVA	tr|Q9IG40|Q9IG40_9FLAV	1660	tr|E9PKF1|E9PKF1_HUMAN Chitinase domain-containing protein 1 (Fragment) OS=Homo sapiens OX=9606 GN=CHID1 PE=1 SV=1	46	QDRGLVVTDLKA
QDRGLVATDKVA	tr|Q9IG40|Q9IG40_9FLAV	1660	tr|E9PI70|E9PI70_HUMAN Chitinase domain-containing protein 1 (Fragment) OS=Homo sapiens OX=9606 GN=CHID1 PE=1 SV=8	46	QDRGLVVTDLKA
QDRGLVATDKVA	tr|Q9IG40|Q9IG40_9FLAV	1660	tr|E9PIP0|E9PIP0_HUMAN Chitinase domain-containing protein 1 (Fragment) OS=Homo sapiens OX=9606 GN=CHID1 PE=1 SV=1	46	QDRGLVVTDLKA
QDRGLVATDKVA	tr|Q9IG40|Q9IG40_9FLAV	1660	tr|E9PPA0|E9PPA0_HUMAN Chitinase domain-containing protein 1 (Fragment) OS=Homo sapiens OX=9606 GN=CHID1 PE=1 SV=1	46	QDRGLVVTDLKA
QDRGLVATDKVA	tr|Q9IG40|Q9IG40_9FLAV	1660	tr|E9PRL3|E9PRL3_HUMAN Chitinase domain-containing protein 1 (Fragment) OS=Homo sapiens OX=9606 GN=CHID1 PE=1 SV=8	46	QDRGLVVTDLKA
QDRGLVATDKVA	tr|Q9IG40|Q9IG40_9FLAV	1660	tr|E9PPH0|E9PPH0_HUMAN Chitinase domain-containing protein 1 OS=Homo sapiens OX=9606 GN=CHID1 PE=1 SV=1	46	QDRGLVVTDLKA
QDRGLVATDKVA	tr|Q9IG40|Q9IG40_9FLAV	1660	sp|Q9BWS9|CHID1_HUMAN Chitinase domain-containing protein 1 OS=Homo sapiens OX=9606 GN=CHID1 PE=1 SV=1	46	QDRGLVVTDLKA
VRGGRVTPWERG	tr|Q9IG40|Q9IG40_9FLAV	1617	tr|C9JB11|C9JB11_HUMAN Probable N-acetyltransferase 16 (Fragment) OS=Homo sapiens OX=9606 GN=NAT16 PE=1 SV=1	121	VEGLRVAPWERG
VRGGRVTPWERG	tr|Q9IG40|Q9IG40_9FLAV	1617	sp|Q8N8M0|NAT16_HUMAN Probable N-acetyltransferase 16 OS=Homo sapiens OX=9606 GN=NAT16 PE=2 SV=2	121	VEGLRVAPWERG
LSLLNLSRATIT	tr|Q9IG40|Q9IG40_9FLAV	1782	sp|Q6ZS81|WDFY4_HUMAN WD repeat- and FYVE domain-containing protein 4 OS=Homo sapiens OX=9606 GN=WDFY4 PE=1 SV=3	267	LSLQNLSRLTDT
EAEETAEPLLMA	tr|Q9IG40|Q9IG40_9FLAV	3215	sp|O60287|NPA1P_HUMAN Nucleolar pre-ribosomal-associated protein 1 OS=Homo sapiens OX=9606 GN=URB1 PE=1 SV=4	2038	EAEEMADPELMA
AARRSPYQRGIG	tr|Q9IG40|Q9IG40_9FLAV	1082	tr|A0A0J9YX32|A0A0J9YX32_HUMAN Unconventional myosin-XVB (Fragment) OS=Homo sapiens OX=9606 GN=MYO15B PE=1 SV=1	162	AARRIPQQRGSG
VGSSATSSHTKR	tr|Q9IG40|Q9IG40_9FLAV	1322	sp|Q8TB72|PUM2_HUMAN Pumilio homolog 2 OS=Homo sapiens OX=9606 GN=PUM2 PE=1 SV=2	574	VGSSASSSATRR
HGSDGSVGYVGD	tr|Q9IG40|Q9IG40_9FLAV	3240	tr|A0A087WTA8|A0A087WTA8_HUMAN Collagen alpha-2(I) chain OS=Homo sapiens OX=9606 GN=COL1A2 PE=1 SV=1	232	RGSDGSVGPVGP
HGSDGSVGYVGD	tr|Q9IG40|Q9IG40_9FLAV	3240	sp|P08123|CO1A2_HUMAN Collagen alpha-2(I) chain OS=Homo sapiens OX=9606 GN=COL1A2 PE=1 SV=7	234	RGSDGSVGPVGP
EAVLLAVTLRVF	tr|Q9IG40|Q9IG40_9FLAV	2674	sp|Q8WUX1|S38A5_HUMAN Sodium-coupled neutral amino acid transporter 5 OS=Homo sapiens OX=9606 GN=SLC38A5 PE=1 SV=1	340	LAVLLAVTLTVP
EAVLLAVTLRVF	tr|Q9IG40|Q9IG40_9FLAV	2674	tr|A0A087X1I6|A0A087X1I6_HUMAN Sodium-coupled neutral amino acid transporter 5 OS=Homo sapiens OX=9606 GN=SLC38A5 PE=1 SV=1	206	LAVLLAVTLTVP
VLYMGLGAAEVA	tr|Q9IG40|Q9IG40_9FLAV	2462	sp|Q6UXZ4|UNC5D_HUMAN Netrin receptor UNC5D OS=Homo sapiens OX=9606 GN=UNC5D PE=1 SV=1	381	ALYSGLGAAVVA
VLYMGLGAAEVA	tr|Q9IG40|Q9IG40_9FLAV	2462	tr|C9J2B6|C9J2B6_HUMAN Netrin receptor UNC5 OS=Homo sapiens OX=9606 GN=UNC5D PE=1 SV=1	386	ALYSGLGAAVVA
VLYMGLGAAEVA	tr|Q9IG40|Q9IG40_9FLAV	2462	tr|C9J1I0|C9J1I0_HUMAN Netrin receptor UNC5 OS=Homo sapiens OX=9606 GN=UNC5D PE=1 SV=1	314	ALYSGLGAAVVA
VLYMGLGAAEVA	tr|Q9IG40|Q9IG40_9FLAV	2462	tr|H7BXJ2|H7BXJ2_HUMAN Netrin receptor UNC5 OS=Homo sapiens OX=9606 GN=UNC5D PE=1 SV=1	325	ALYSGLGAAVVA
ETKHTSEGVYYF	tr|Q9IG40|Q9IG40_9FLAV	247	sp|O00308|WWP2_HUMAN NEDD4-like E3 ubiquitin-protein ligase WWP2 OS=Homo sapiens OX=9606 GN=WWP2 PE=1 SV=2	451	EMKYTSEGVRYF
SVLGEGLDEIGD	tr|Q9IG40|Q9IG40_9FLAV	2385	tr|H7BXK5|H7BXK5_HUMAN Bromodomain adjacent to zinc finger domain protein 2B (Fragment) OS=Homo sapiens OX=9606 GN=BAZ2B PE=1 SV=1	180	SVLQEGLLNIGD
SVLGEGLDEIGD	tr|Q9IG40|Q9IG40_9FLAV	2385	sp|Q9UIF8|BAZ2B_HUMAN Bromodomain adjacent to zinc finger domain protein 2B OS=Homo sapiens OX=9606 GN=BAZ2B PE=1 SV=3	1119	SVLQEGLLNIGD
LGLTTLRQAVRS	tr|Q9IG40|Q9IG40_9FLAV	3398	tr|A0A1W2PPI5|A0A1W2PPI5_HUMAN DEAD/H (Asp-Glu-Ala-Asp/His) box polypeptide 26B, isoform CRA_b OS=Homo sapiens OX=9606 GN=INTS6L PE=1 SV=1	83	SGLTTLGQALRS
LGLTTLRQAVRS	tr|Q9IG40|Q9IG40_9FLAV	3398	sp|Q5JSJ4|INT6L_HUMAN Integrator complex subunit 6-like OS=Homo sapiens OX=9606 GN=INTS6L PE=1 SV=1	83	SGLTTLGQALRS
GLALVEVGLLAA	tr|Q9IG40|Q9IG40_9FLAV	2201	tr|F8WDQ7|F8WDQ7_HUMAN N-acetylneuraminate 9-O-acetyltransferase OS=Homo sapiens OX=9606 GN=CASD1 PE=1 SV=1	24	VLALVAVLLLAA
GLALVEVGLLAA	tr|Q9IG40|Q9IG40_9FLAV	2201	sp|Q96PB1|CASD1_HUMAN N-acetylneuraminate 9-O-acetyltransferase OS=Homo sapiens OX=9606 GN=CASD1 PE=1 SV=1	24	VLALVAVLLLAA
GLALVEVGLLAA	tr|Q9IG40|Q9IG40_9FLAV	2201	tr|F8WDW8|F8WDW8_HUMAN N-acetylneuraminate 9-O-acetyltransferase OS=Homo sapiens OX=9606 GN=CASD1 PE=1 SV=1	24	VLALVAVLLLAA
GTFPVALSLEPG	tr|Q9IG40|Q9IG40_9FLAV	36	sp|Q8N0Z3|SPICE_HUMAN Spindle and centriole-associated protein 1 OS=Homo sapiens OX=9606 GN=SPICE1 PE=1 SV=1	714	STFPVAQSLTPG
VAPNVGSDARGD	tr|Q9IG40|Q9IG40_9FLAV	558	sp|Q02156|KPCE_HUMAN Protein kinase C epsilon type OS=Homo sapiens OX=9606 GN=PRKCE PE=1 SV=1	288	VAPNCGVDARGI
VAPNVGSDARGD	tr|Q9IG40|Q9IG40_9FLAV	558	tr|E9PBI2|E9PBI2_HUMAN Protein kinase C epsilon type OS=Homo sapiens OX=9606 GN=PRKCE PE=1 SV=1	11	VAPNCGVDARGI
QLRSAANLGERN	tr|Q9IG40|Q9IG40_9FLAV	233	tr|B1AM99|B1AM99_HUMAN Contactin-associated protein-like 3 OS=Homo sapiens OX=9606 GN=CNTNAP3 PE=1 SV=1	664	QLRSAVNLAERC
QLRSAANLGERN	tr|Q9IG40|Q9IG40_9FLAV	233	tr|A6NC89|A6NC89_HUMAN Contactin-associated protein-like 3 OS=Homo sapiens OX=9606 GN=CNTNAP3 PE=1 SV=2	664	QLRSAVNLAERC
QLRSAANLGERN	tr|Q9IG40|Q9IG40_9FLAV	233	tr|B1AMA2|B1AMA2_HUMAN Contactin-associated protein-like 3 OS=Homo sapiens OX=9606 GN=CNTNAP3 PE=1 SV=1	577	QLRSAVNLAERC
QLRSAANLGERN	tr|Q9IG40|Q9IG40_9FLAV	233	sp|Q9BZ76|CNTP3_HUMAN Contactin-associated protein-like 3 OS=Homo sapiens OX=9606 GN=CNTNAP3 PE=2 SV=3	665	QLRSAVNLAERC
QLRSAANLGERN	tr|Q9IG40|Q9IG40_9FLAV	233	tr|F2Z2X6|F2Z2X6_HUMAN Contactin-associated protein-like 3 OS=Homo sapiens OX=9606 GN=CNTNAP3 PE=1 SV=1	571	QLRSAVNLAERC
AGVTLRPGGLAD	tr|Q9IG40|Q9IG40_9FLAV	1725	sp|O94985|CSTN1_HUMAN Calsyntenin-1 OS=Homo sapiens OX=9606 GN=CLSTN1 PE=1 SV=1	540	AGLTLRSGKLAD
AGVTLRPGGLAD	tr|Q9IG40|Q9IG40_9FLAV	1725	tr|Q5SR54|Q5SR54_HUMAN Calsyntenin-1 (Fragment) OS=Homo sapiens OX=9606 GN=CLSTN1 PE=1 SV=1	341	AGLTLRSGKLAD
MLTCRLSLPVQI	tr|Q9IG40|Q9IG40_9FLAV	2531	sp|P21817|RYR1_HUMAN Ryanodine receptor 1 OS=Homo sapiens OX=9606 GN=RYR1 PE=1 SV=3	1285	MLFLRLSLPVQF
ERQTGILCIELL	tr|Q9IG40|Q9IG40_9FLAV	192	sp|Q86YV5|PRAG1_HUMAN Inactive tyrosine-protein kinase PRAG1 OS=Homo sapiens OX=9606 GN=PRAG1 PE=1 SV=4	1254	EFQTGILIYELL
QSLGSGLTGLLK	tr|Q9IG40|Q9IG40_9FLAV	1828	tr|A0A0C4DGL1|A0A0C4DGL1_HUMAN Alpha-mannosidase 2x OS=Homo sapiens OX=9606 GN=MAN2A2 PE=1 SV=1	771	QVWFSGLTGLLK
QSLGSGLTGLLK	tr|Q9IG40|Q9IG40_9FLAV	1828	tr|H0YKH9|H0YKH9_HUMAN Alpha-mannosidase 2x (Fragment) OS=Homo sapiens OX=9606 GN=MAN2A2 PE=1 SV=1	22	QVWFSGLTGLLK
QSLGSGLTGLLK	tr|Q9IG40|Q9IG40_9FLAV	1828	tr|H0YNG5|H0YNG5_HUMAN Alpha-mannosidase OS=Homo sapiens OX=9606 GN=MAN2A2 PE=1 SV=1	771	QVWFSGLTGLLK
QSLGSGLTGLLK	tr|Q9IG40|Q9IG40_9FLAV	1828	sp|P49641|MA2A2_HUMAN Alpha-mannosidase 2x OS=Homo sapiens OX=9606 GN=MAN2A2 PE=2 SV=3	771	QVWFSGLTGLLK
QSLGSGLTGLLK	tr|Q9IG40|Q9IG40_9FLAV	1828	tr|H0YLB9|H0YLB9_HUMAN Alpha-mannosidase (Fragment) OS=Homo sapiens OX=9606 GN=MAN2A2 PE=1 SV=1	414	QVWFSGLTGLLK
GIGAGLALRRQR	tr|Q9IG40|Q9IG40_9FLAV	1091	sp|Q6ZRP7|QSOX2_HUMAN Sulfhydryl oxidase 2 OS=Homo sapiens OX=9606 GN=QSOX2 PE=1 SV=3	13	GIGAGPALRARR
PMLTCRLSLPVQ	tr|Q9IG40|Q9IG40_9FLAV	2530	sp|P21817|RYR1_HUMAN Ryanodine receptor 1 OS=Homo sapiens OX=9606 GN=RYR1 PE=1 SV=3	1284	EMLFLRLSLPVQ
SSLFMDGRPALA	tr|Q9IG40|Q9IG40_9FLAV	626	tr|H0YER3|H0YER3_HUMAN Glutamine amidotransferase-like class 1 domain-containing protein 1 (Fragment) OS=Homo sapiens OX=9606 GN=GATD1 PE=1 SV=1	72	SSLLPQGRPALA
VLGEGLDEIGDS	tr|Q9IG40|Q9IG40_9FLAV	2386	tr|H7BXK5|H7BXK5_HUMAN Bromodomain adjacent to zinc finger domain protein 2B (Fragment) OS=Homo sapiens OX=9606 GN=BAZ2B PE=1 SV=1	181	VLQEGLLNIGDS
VLGEGLDEIGDS	tr|Q9IG40|Q9IG40_9FLAV	2386	sp|Q9UIF8|BAZ2B_HUMAN Bromodomain adjacent to zinc finger domain protein 2B OS=Homo sapiens OX=9606 GN=BAZ2B PE=1 SV=3	1120	VLQEGLLNIGDS
AVVLGDRKSDAR	tr|Q9IG40|Q9IG40_9FLAV	873	sp|Q9H7F0|AT133_HUMAN Probable cation-transporting ATPase 13A3 OS=Homo sapiens OX=9606 GN=ATP13A3 PE=1 SV=4	639	ARVLGDRKMDAY
AVVLGDRKSDAR	tr|Q9IG40|Q9IG40_9FLAV	873	tr|A0A2R8Y635|A0A2R8Y635_HUMAN Cation-transporting ATPase OS=Homo sapiens OX=9606 GN=ATP13A3 PE=1 SV=2	639	ARVLGDRKMDAY
AVVLGDRKSDAR	tr|Q9IG40|Q9IG40_9FLAV	873	tr|A0A2R8YDN7|A0A2R8YDN7_HUMAN Cation-transporting ATPase OS=Homo sapiens OX=9606 GN=ATP13A3 PE=1 SV=1	612	ARVLGDRKMDAY
EVAPNVGSDARG	tr|Q9IG40|Q9IG40_9FLAV	557	sp|Q02156|KPCE_HUMAN Protein kinase C epsilon type OS=Homo sapiens OX=9606 GN=PRKCE PE=1 SV=1	287	NVAPNCGVDARG
EVAPNVGSDARG	tr|Q9IG40|Q9IG40_9FLAV	557	tr|E9PBI2|E9PBI2_HUMAN Protein kinase C epsilon type OS=Homo sapiens OX=9606 GN=PRKCE PE=1 SV=1	10	NVAPNCGVDARG
LEPGANWALSLL	tr|Q9IG40|Q9IG40_9FLAV	44	sp|Q7Z7K2|ZN467_HUMAN Zinc finger protein 467 OS=Homo sapiens OX=9606 GN=ZNF467 PE=1 SV=1	136	LEPGAPGALSGL
GSLIEIGPFSLG	tr|Q9IG40|Q9IG40_9FLAV	2132	sp|Q9Y597|KCTD3_HUMAN BTB/POZ domain-containing protein KCTD3 OS=Homo sapiens OX=9606 GN=KCTD3 PE=1 SV=2	267	GSGSEIGVFSLG
EGSALEKAVDGR	tr|Q9IG40|Q9IG40_9FLAV	128	sp|P12821|ACE_HUMAN Angiotensin-converting enzyme OS=Homo sapiens OX=9606 GN=ACE PE=1 SV=1	344	EGSMLEKPADGR
EGSALEKAVDGR	tr|Q9IG40|Q9IG40_9FLAV	128	tr|A0A0A0MSN4|A0A0A0MSN4_HUMAN Angiotensin-converting enzyme OS=Homo sapiens OX=9606 GN=ACE PE=1 SV=1	344	EGSMLEKPADGR
ALLGSLVISPSL	tr|Q9IG40|Q9IG40_9FLAV	586	sp|Q9H841|NPAL2_HUMAN NIPA-like protein 2 OS=Homo sapiens OX=9606 GN=NIPAL2 PE=2 SV=2	54	AILGNLVISISL
SAVVLGDRKSDA	tr|Q9IG40|Q9IG40_9FLAV	872	sp|Q9H7F0|AT133_HUMAN Probable cation-transporting ATPase 13A3 OS=Homo sapiens OX=9606 GN=ATP13A3 PE=1 SV=4	638	VARVLGDRKMDA
SAVVLGDRKSDA	tr|Q9IG40|Q9IG40_9FLAV	872	tr|A0A2R8Y635|A0A2R8Y635_HUMAN Cation-transporting ATPase OS=Homo sapiens OX=9606 GN=ATP13A3 PE=1 SV=2	638	VARVLGDRKMDA
SAVVLGDRKSDA	tr|Q9IG40|Q9IG40_9FLAV	872	tr|A0A2R8YDN7|A0A2R8YDN7_HUMAN Cation-transporting ATPase OS=Homo sapiens OX=9606 GN=ATP13A3 PE=1 SV=1	611	VARVLGDRKMDA
RYLLSDEGEVLK	tr|Q9IG40|Q9IG40_9FLAV	1633	tr|A0A590UK63|A0A590UK63_HUMAN DNA-directed DNA polymerase (Fragment) OS=Homo sapiens OX=9606 GN=POLG PE=1 SV=1	267	RYRLSDEGEWLV
GLTTLRQAVRSR	tr|Q9IG40|Q9IG40_9FLAV	3399	tr|A0A1W2PPI5|A0A1W2PPI5_HUMAN DEAD/H (Asp-Glu-Ala-Asp/His) box polypeptide 26B, isoform CRA_b OS=Homo sapiens OX=9606 GN=INTS6L PE=1 SV=1	84	GLTTLGQALRSS
GLTTLRQAVRSR	tr|Q9IG40|Q9IG40_9FLAV	3399	sp|Q5JSJ4|INT6L_HUMAN Integrator complex subunit 6-like OS=Homo sapiens OX=9606 GN=INTS6L PE=1 SV=1	84	GLTTLGQALRSS
GEEVAPNVGSDA	tr|Q9IG40|Q9IG40_9FLAV	555	sp|Q9NZ56|FMN2_HUMAN Formin-2 OS=Homo sapiens OX=9606 GN=FMN2 PE=1 SV=4	363	GEEWAPEVGEDA
