query	query_seqname	query_start	target_seqname	target_start	target
AAARPTATLPTI	sp|P03107|VL2_HPV16	324	sp|Q1XH10|SKDA1_HUMAN SKI/DACH domain-containing protein 1 OS=Homo sapiens OX=9606 GN=SKIDA1 PE=1 SV=2	161	AAARPAAHLPQI
TGRITTVVFTPA	sp|P03107|VL2_HPV16	101	sp|Q9BU20|CPLN2_HUMAN Ciliogenesis and planar polarity effector 2 OS=Homo sapiens OX=9606 GN=CPLANE2 PE=1 SV=2	88	TGIQTTVVFWPA
IRSLPGSLGNLL	sp|P03114|VE1_HPV16	267	sp|Q9H9A6|LRC40_HUMAN Leucine-rich repeat-containing protein 40 OS=Homo sapiens OX=9606 GN=LRRC40 PE=1 SV=1	324	ISSLPYSLGNLH
ASSHSTKSTTSV	sp|P0DKA0|VE8E2_HPV16	14	tr|E7ERW5|E7ERW5_HUMAN Paired box protein Pax-5 OS=Homo sapiens OX=9606 GN=PAX5 PE=1 SV=1	153	ASSHSIVSTGSV
ASSHSTKSTTSV	sp|P0DKA0|VE8E2_HPV16	14	tr|E7EQT0|E7EQT0_HUMAN Paired box protein Pax-5 OS=Homo sapiens OX=9606 GN=PAX5 PE=1 SV=1	153	ASSHSIVSTGSV
ASSHSTKSTTSV	sp|P0DKA0|VE8E2_HPV16	14	tr|E7ERK2|E7ERK2_HUMAN Paired box protein Pax-5 OS=Homo sapiens OX=9606 GN=PAX5 PE=1 SV=1	45	ASSHSIVSTGSV
ASSHSTKSTTSV	sp|P0DKA0|VE8E2_HPV16	14	sp|Q02548|PAX5_HUMAN Paired box protein Pax-5 OS=Homo sapiens OX=9606 GN=PAX5 PE=1 SV=1	153	ASSHSIVSTGSV
ASSHSTKSTTSV	sp|P0DKA0|VE8E2_HPV16	14	tr|E7ES87|E7ES87_HUMAN Paired box protein Pax-5 OS=Homo sapiens OX=9606 GN=PAX5 PE=1 SV=1	45	ASSHSIVSTGSV
LLPVLELISARS	sp|P03107|VL2_HPV16	183	tr|B5MC53|B5MC53_HUMAN MpV17 transgene, murine homolog, glomerulosclerosis, isoform CRA_f OS=Homo sapiens OX=9606 GN=MPV17 PE=1 SV=1	149	LLPVLEGTSALS
LPPPSYATTGPE	sp|P03107|VL2_HPV16	415	tr|A0A1B0GTL3|A0A1B0GTL3_HUMAN Uncharacterized protein OS=Homo sapiens OX=9606 PE=4 SV=1	14	LPPPSVATPGPA
PLITALHLRKIY	sp|P03107|VL2_HPV16	440	sp|Q14573|ITPR3_HUMAN Inositol 1,4,5-trisphosphate receptor type 3 OS=Homo sapiens OX=9606 GN=ITPR3 PE=1 SV=2	2263	PLIVALILRSIY
KEVSDALELEEP	sp|P03114|VE1_HPV16	50	sp|P31150|GDIA_HUMAN Rab GDP dissociation inhibitor alpha OS=Homo sapiens OX=9606 GN=GDI1 PE=1 SV=2	364	KEVEPALELLEP
STSPTAHTTEVL	sp|P06922|VE4_HPV16	8	sp|Q9HC84|MUC5B_HUMAN Mucin-5B OS=Homo sapiens OX=9606 GN=MUC5B PE=1 SV=3	2598	STPGTAHTTKVL
AANIIRSLPGSL	sp|P03114|VE1_HPV16	263	sp|Q99062|CSF3R_HUMAN Granulocyte colony-stimulating factor receptor OS=Homo sapiens OX=9606 GN=CSF3R PE=1 SV=1	12	AALIILLLPGSL
KTLISCPITQRY	sp|P03126|VE6_HPV16	20	tr|H0YI14|H0YI14_HUMAN Neuron navigator 3 (Fragment) OS=Homo sapiens OX=9606 GN=NAV3 PE=1 SV=1	631	DTLIPKPITQRY
KTLISCPITQRY	sp|P03126|VE6_HPV16	20	sp|Q8IVL0|NAV3_HUMAN Neuron navigator 3 OS=Homo sapiens OX=9606 GN=NAV3 PE=1 SV=3	2031	DTLIPKPITQRY
KTLISCPITQRY	sp|P03126|VE6_HPV16	20	tr|A0A2R8YFX5|A0A2R8YFX5_HUMAN Neuron navigator 3 OS=Homo sapiens OX=9606 GN=NAV3 PE=1 SV=1	1488	DTLIPKPITQRY
KTLISCPITQRY	sp|P03126|VE6_HPV16	20	tr|H0YHA8|H0YHA8_HUMAN Neuron navigator 3 (Fragment) OS=Homo sapiens OX=9606 GN=NAV3 PE=1 SV=1	904	DTLIPKPITQRY
SGLDYQQSDPEY	sp|P03120|VE2_HPV16	56	sp|Q96F07|CYFP2_HUMAN Cytoplasmic FMR1-interacting protein 2 OS=Homo sapiens OX=9606 GN=CYFIP2 PE=1 SV=2	375	SGLDSQKSDEEY
SGLDYQQSDPEY	sp|P03120|VE2_HPV16	56	tr|E7EVJ5|E7EVJ5_HUMAN Cytoplasmic FMR1-interacting protein OS=Homo sapiens OX=9606 GN=CYFIP2 PE=1 SV=1	349	SGLDSQKSDEEY
SGLDYQQSDPEY	sp|P03120|VE2_HPV16	56	tr|H7C229|H7C229_HUMAN Cytoplasmic FMR1-interacting protein 2 OS=Homo sapiens OX=9606 GN=CYFIP2 PE=1 SV=2	239	SGLDSQKSDEEY
SGLDYQQSDPEY	sp|P03120|VE2_HPV16	56	tr|E7EW33|E7EW33_HUMAN Cytoplasmic FMR1-interacting protein 2 OS=Homo sapiens OX=9606 GN=CYFIP2 PE=1 SV=1	179	SGLDSQKSDEEY
SYSPENPSLYGD	sp|P03101|VL1_HPV16	322	sp|P78412|IRX6_HUMAN Iroquois-class homeodomain protein IRX-6 OS=Homo sapiens OX=9606 GN=IRX6 PE=1 SV=3	89	PYSPEPPSLYGA
ITTVVFTPANVS	sp|P03107|VL2_HPV16	104	sp|P28906|CD34_HUMAN Hematopoietic progenitor cell antigen CD34 OS=Homo sapiens OX=9606 GN=CD34 PE=1 SV=2	117	ISTVFTTPANVS
VLPPPSYATTGP	sp|P03107|VL2_HPV16	414	tr|A0A1B0GTL3|A0A1B0GTL3_HUMAN Uncharacterized protein OS=Homo sapiens OX=9606 PE=4 SV=1	13	GLPPPSVATPGP
GTKDTSQPGVVN	sp|P03107|VL2_HPV16	361	tr|H7C0B1|H7C0B1_HUMAN T-box brain protein 1 (Fragment) OS=Homo sapiens OX=9606 GN=TBR1 PE=1 SV=8	81	GTEDTSQPGRVQ
GTKDTSQPGVVN	sp|P03107|VL2_HPV16	361	sp|Q16650|TBR1_HUMAN T-box brain protein 1 OS=Homo sapiens OX=9606 GN=TBR1 PE=1 SV=1	346	GTEDTSQPGRVQ
NIILFEELIEWY	sp|P03120|VE2_HPV16	110	tr|G3XAL9|G3XAL9_HUMAN Solute carrier family 12 (Sodium/potassium/chloride transporters), member 2, isoform CRA_a OS=Homo sapiens OX=9606 GN=SLC12A2 PE=1 SV=1	1100	NIIAFEEIIEPY
NIILFEELIEWY	sp|P03120|VE2_HPV16	110	sp|P55011|S12A2_HUMAN Solute carrier family 12 member 2 OS=Homo sapiens OX=9606 GN=SLC12A2 PE=1 SV=1	1100	NIIAFEEIIEPY
QDVNLSLEAYQV	sp|P03114|VE1_HPV16	291	tr|H7C0Q6|H7C0Q6_HUMAN E3 ubiquitin-protein ligase TRIM4 (Fragment) OS=Homo sapiens OX=9606 GN=TRIM4 PE=1 SV=1	154	QDVNYSLEAVKV
QDVNLSLEAYQV	sp|P03114|VE1_HPV16	291	sp|Q9C037|TRIM4_HUMAN E3 ubiquitin-protein ligase TRIM4 OS=Homo sapiens OX=9606 GN=TRIM4 PE=1 SV=2	278	QDVNYSLEAVKV
YSPENPSLYGDM	sp|P03101|VL1_HPV16	323	sp|P78412|IRX6_HUMAN Iroquois-class homeodomain protein IRX-6 OS=Homo sapiens OX=9606 GN=IRX6 PE=1 SV=3	90	YSPEPPSLYGAL
YICHKAKSHSDL	sp|P03120|VE2_HPV16	323	tr|D3DNG8|D3DNG8_HUMAN Angiotensin II receptor, type 1, isoform CRA_a OS=Homo sapiens OX=9606 GN=AGTR1 PE=1 SV=1	354	YIPPKAKSHSNL
YICHKAKSHSDL	sp|P03120|VE2_HPV16	323	tr|A0A0A0MSE3|A0A0A0MSE3_HUMAN Angiotensin II receptor, type 1, isoform CRA_c OS=Homo sapiens OX=9606 GN=AGTR1 PE=1 SV=1	348	YIPPKAKSHSNL
YICHKAKSHSDL	sp|P03120|VE2_HPV16	323	sp|P30556|AGTR1_HUMAN Type-1 angiotensin II receptor OS=Homo sapiens OX=9606 GN=AGTR1 PE=1 SV=1	319	YIPPKAKSHSNL
TKDTSQPGVVNT	sp|P03107|VL2_HPV16	362	tr|H7C0B1|H7C0B1_HUMAN T-box brain protein 1 (Fragment) OS=Homo sapiens OX=9606 GN=TBR1 PE=1 SV=8	82	TEDTSQPGRVQT
TKDTSQPGVVNT	sp|P03107|VL2_HPV16	362	sp|Q16650|TBR1_HUMAN T-box brain protein 1 OS=Homo sapiens OX=9606 GN=TBR1 PE=1 SV=1	347	TEDTSQPGRVQT
IGQADLPPFLLI	sp|P03101|VL1_HPV16	95	sp|P20849|CO9A1_HUMAN Collagen alpha-1(IX) chain OS=Homo sapiens OX=9606 GN=COL9A1 PE=1 SV=3	49	IGQDDLPGFDLI
DLASRRDDPRCL	sp|P03114|VE1_HPV16	549	sp|O95996|APCL_HUMAN Adenomatous polyposis coli protein 2 OS=Homo sapiens OX=9606 GN=APC2 PE=1 SV=1	949	ALASRREDPRCG
QPVGKQQGAGID	sp|P03114|VE1_HPV16	398	sp|Q9HCE3|ZN532_HUMAN Zinc finger protein 532 OS=Homo sapiens OX=9606 GN=ZNF532 PE=1 SV=2	1232	QPVSKQNGAGED
TKNFEFPREKSV	sp|P03101|VL1_HPV16	133	sp|Q9Y5P3|RAI2_HUMAN Retinoic acid-induced protein 2 OS=Homo sapiens OX=9606 GN=RAI2 PE=1 SV=2	463	TKNFSFKREDSV
PHKTIPDPSACI	sp|P06922|VE4_HPV16	35	tr|C9JMJ0|C9JMJ0_HUMAN Laminin subunit beta-4 OS=Homo sapiens OX=9606 GN=LAMB4 PE=1 SV=2	382	PLKTISDPYACI
PHKTIPDPSACI	sp|P06922|VE4_HPV16	35	sp|A4D0S4|LAMB4_HUMAN Laminin subunit beta-4 OS=Homo sapiens OX=9606 GN=LAMB4 PE=2 SV=1	382	PLKTISDPYACI
IIRSLPGSLGNL	sp|P03114|VE1_HPV16	266	sp|Q9H9A6|LRC40_HUMAN Leucine-rich repeat-containing protein 40 OS=Homo sapiens OX=9606 GN=LRRC40 PE=1 SV=1	323	DISSLPYSLGNL
IIRSLPGSLGNL	sp|P03114|VE1_HPV16	266	sp|Q13201|MMRN1_HUMAN Multimerin-1 OS=Homo sapiens OX=9606 GN=MMRN1 PE=1 SV=3	986	IDRSLPGSLANV
IIRSLPGSLGNL	sp|P03114|VE1_HPV16	266	tr|E7EPG1|E7EPG1_HUMAN Multimerin-1 OS=Homo sapiens OX=9606 GN=MMRN1 PE=1 SV=1	728	IDRSLPGSLANV
TLISCPITQRYS	sp|P03126|VE6_HPV16	21	tr|H0YI14|H0YI14_HUMAN Neuron navigator 3 (Fragment) OS=Homo sapiens OX=9606 GN=NAV3 PE=1 SV=1	632	TLIPKPITQRYF
TLISCPITQRYS	sp|P03126|VE6_HPV16	21	sp|Q8IVL0|NAV3_HUMAN Neuron navigator 3 OS=Homo sapiens OX=9606 GN=NAV3 PE=1 SV=3	2032	TLIPKPITQRYF
TLISCPITQRYS	sp|P03126|VE6_HPV16	21	tr|A0A2R8YFX5|A0A2R8YFX5_HUMAN Neuron navigator 3 OS=Homo sapiens OX=9606 GN=NAV3 PE=1 SV=1	1489	TLIPKPITQRYF
TLISCPITQRYS	sp|P03126|VE6_HPV16	21	tr|H0YHA8|H0YHA8_HUMAN Neuron navigator 3 (Fragment) OS=Homo sapiens OX=9606 GN=NAV3 PE=1 SV=1	905	TLIPKPITQRYF
STKNFEFPREKS	sp|P03101|VL1_HPV16	132	sp|Q9Y5P3|RAI2_HUMAN Retinoic acid-induced protein 2 OS=Homo sapiens OX=9606 GN=RAI2 PE=1 SV=2	462	STKNFSFKREDS
TKELKYDDKPTL	sp|P0DKA0|VE8E2_HPV16	38	tr|A0A2R8YEM9|A0A2R8YEM9_HUMAN TPR and ankyrin repeat-containing protein 1 OS=Homo sapiens OX=9606 GN=TRANK1 PE=1 SV=1	765	GKEGKKDDKPTL
TKELKYDDKPTL	sp|P0DKA0|VE8E2_HPV16	38	sp|O15050|TRNK1_HUMAN TPR and ankyrin repeat-containing protein 1 OS=Homo sapiens OX=9606 GN=TRANK1 PE=2 SV=4	721	GKEGKKDDKPTL
TKELKYDDKPTL	sp|P0DKA0|VE8E2_HPV16	38	tr|A0A2R8Y7N6|A0A2R8Y7N6_HUMAN TPR and ankyrin repeat-containing protein 1 (Fragment) OS=Homo sapiens OX=9606 GN=TRANK1 PE=1 SV=1	69	GKEGKKDDKPTL
TKELKYDDKPTL	sp|P0DKA0|VE8E2_HPV16	38	tr|A0A2R8Y8A3|A0A2R8Y8A3_HUMAN TPR and ankyrin repeat-containing protein 1 OS=Homo sapiens OX=9606 GN=TRANK1 PE=1 SV=1	757	GKEGKKDDKPTL
IDQMQDMMHTIR	sp|P03114|VE1_HPV16	408	sp|P18433|PTPRA_HUMAN Receptor-type tyrosine-protein phosphatase alpha OS=Homo sapiens OX=9606 GN=PTPRA PE=1 SV=3	455	IDAMLDMMHTER
LLRTVATCTADA	sp|P03114|VE1_HPV16	252	sp|P21675|TAF1_HUMAN Transcription initiation factor TFIID subunit 1 OS=Homo sapiens OX=9606 GN=TAF1 PE=1 SV=2	8	LLRTAATITAAA
VSYSPENPSLYG	sp|P03101|VL1_HPV16	321	sp|P78412|IRX6_HUMAN Iroquois-class homeodomain protein IRX-6 OS=Homo sapiens OX=9606 GN=IRX6 PE=1 SV=3	88	LPYSPEPPSLYG
ACCRCLCVLDAL	sp|P03129|VE7_HPV16	9	sp|A6NMN3|F170B_HUMAN Protein FAM170B OS=Homo sapiens OX=9606 GN=FAM170B PE=1 SV=1	208	ACCRVLPSLDAL
PSSPTSTFPDVR	sp|P03107|VL2_HPV16	86	tr|H3BP52|H3BP52_HUMAN MAX gene-associated protein (Fragment) OS=Homo sapiens OX=9606 GN=MGA PE=1 SV=1	643	PVSPGSTFPDVK
PSSPTSTFPDVR	sp|P03107|VL2_HPV16	86	tr|H3BTF4|H3BTF4_HUMAN MAX gene-associated protein (Fragment) OS=Homo sapiens OX=9606 GN=MGA PE=1 SV=1	643	PVSPGSTFPDVK
PSSPTSTFPDVR	sp|P03107|VL2_HPV16	86	sp|Q8IWI9|MGAP_HUMAN MAX gene-associated protein OS=Homo sapiens OX=9606 GN=MGA PE=1 SV=4	643	PVSPGSTFPDVK
TPSSPTSTFPDV	sp|P03107|VL2_HPV16	85	tr|H3BP52|H3BP52_HUMAN MAX gene-associated protein (Fragment) OS=Homo sapiens OX=9606 GN=MGA PE=1 SV=1	642	TPVSPGSTFPDV
TPSSPTSTFPDV	sp|P03107|VL2_HPV16	85	tr|H3BTF4|H3BTF4_HUMAN MAX gene-associated protein (Fragment) OS=Homo sapiens OX=9606 GN=MGA PE=1 SV=1	642	TPVSPGSTFPDV
TPSSPTSTFPDV	sp|P03107|VL2_HPV16	85	sp|Q8IWI9|MGAP_HUMAN MAX gene-associated protein OS=Homo sapiens OX=9606 GN=MGA PE=1 SV=4	642	TPVSPGSTFPDV
GDLASRRDDPRC	sp|P03114|VE1_HPV16	548	sp|O95996|APCL_HUMAN Adenomatous polyposis coli protein 2 OS=Homo sapiens OX=9606 GN=APC2 PE=1 SV=1	948	AALASRREDPRC
ILLVLLITTVRL	sp|P06927|VE5_HPV16	41	sp|Q6MZM0|HPHL1_HUMAN Ferroxidase HEPHL1 OS=Homo sapiens OX=9606 GN=HEPHL1 PE=1 SV=2	1122	IGLLLLITTVIL
VLELISARSSSV	sp|P03107|VL2_HPV16	186	tr|A0A0A0MQW5|A0A0A0MQW5_HUMAN Serine/threonine-protein kinase LMTK3 OS=Homo sapiens OX=9606 GN=LMTK3 PE=1 SV=1	552	VLPVISARSPSV
VLELISARSSSV	sp|P03107|VL2_HPV16	186	tr|A0A3B3ISL5|A0A3B3ISL5_HUMAN Serine/threonine-protein kinase LMTK3 OS=Homo sapiens OX=9606 GN=LMTK3 PE=1 SV=1	549	VLPVISARSPSV
VLELISARSSSV	sp|P03107|VL2_HPV16	186	sp|Q96Q04|LMTK3_HUMAN Serine/threonine-protein kinase LMTK3 OS=Homo sapiens OX=9606 GN=LMTK3 PE=1 SV=2	523	VLPVISARSPSV
VLELISARSSSV	sp|P03107|VL2_HPV16	186	tr|A0A5F9ZH67|A0A5F9ZH67_HUMAN Serine/threonine-protein kinase LMTK3 OS=Homo sapiens OX=9606 GN=LMTK3 PE=1 SV=1	278	VLPVISARSPSV
LISARSSSVGLS	sp|P03107|VL2_HPV16	189	tr|H0Y8A4|H0Y8A4_HUMAN Tyrosine-protein kinase RYK (Fragment) OS=Homo sapiens OX=9606 GN=RYK PE=1 SV=2	201	SISASSSSQGLS
LISARSSSVGLS	sp|P03107|VL2_HPV16	189	sp|P34925|RYK_HUMAN Tyrosine-protein kinase RYK OS=Homo sapiens OX=9606 GN=RYK PE=1 SV=3	263	SISASSSSQGLS
KELKYDDKPTLA	sp|P0DKA0|VE8E2_HPV16	39	tr|A0A2R8YEM9|A0A2R8YEM9_HUMAN TPR and ankyrin repeat-containing protein 1 OS=Homo sapiens OX=9606 GN=TRANK1 PE=1 SV=1	766	KEGKKDDKPTLG
KELKYDDKPTLA	sp|P0DKA0|VE8E2_HPV16	39	sp|O15050|TRNK1_HUMAN TPR and ankyrin repeat-containing protein 1 OS=Homo sapiens OX=9606 GN=TRANK1 PE=2 SV=4	722	KEGKKDDKPTLG
KELKYDDKPTLA	sp|P0DKA0|VE8E2_HPV16	39	tr|A0A2R8Y7N6|A0A2R8Y7N6_HUMAN TPR and ankyrin repeat-containing protein 1 (Fragment) OS=Homo sapiens OX=9606 GN=TRANK1 PE=1 SV=1	70	KEGKKDDKPTLG
KELKYDDKPTLA	sp|P0DKA0|VE8E2_HPV16	39	tr|A0A2R8Y8A3|A0A2R8Y8A3_HUMAN TPR and ankyrin repeat-containing protein 1 OS=Homo sapiens OX=9606 GN=TRANK1 PE=1 SV=1	758	KEGKKDDKPTLG
AGTKDTSQPGVV	sp|P03107|VL2_HPV16	360	tr|H7C0B1|H7C0B1_HUMAN T-box brain protein 1 (Fragment) OS=Homo sapiens OX=9606 GN=TBR1 PE=1 SV=8	80	DGTEDTSQPGRV
AGTKDTSQPGVV	sp|P03107|VL2_HPV16	360	sp|Q16650|TBR1_HUMAN T-box brain protein 1 OS=Homo sapiens OX=9606 GN=TBR1 PE=1 SV=1	345	DGTEDTSQPGRV
FTPSSPTSTFPD	sp|P03107|VL2_HPV16	84	tr|H3BP52|H3BP52_HUMAN MAX gene-associated protein (Fragment) OS=Homo sapiens OX=9606 GN=MGA PE=1 SV=1	641	NTPVSPGSTFPD
FTPSSPTSTFPD	sp|P03107|VL2_HPV16	84	tr|H3BTF4|H3BTF4_HUMAN MAX gene-associated protein (Fragment) OS=Homo sapiens OX=9606 GN=MGA PE=1 SV=1	641	NTPVSPGSTFPD
FTPSSPTSTFPD	sp|P03107|VL2_HPV16	84	sp|Q8IWI9|MGAP_HUMAN MAX gene-associated protein OS=Homo sapiens OX=9606 GN=MGA PE=1 SV=4	641	NTPVSPGSTFPD
LASRRDDPRCLS	sp|P03114|VE1_HPV16	550	sp|O95996|APCL_HUMAN Adenomatous polyposis coli protein 2 OS=Homo sapiens OX=9606 GN=APC2 PE=1 SV=1	950	LASRREDPRCGQ
ISARSSSVGLSR	sp|P03107|VL2_HPV16	190	tr|H0Y8A4|H0Y8A4_HUMAN Tyrosine-protein kinase RYK (Fragment) OS=Homo sapiens OX=9606 GN=RYK PE=1 SV=2	202	ISASSSSQGLSQ
ISARSSSVGLSR	sp|P03107|VL2_HPV16	190	sp|P34925|RYK_HUMAN Tyrosine-protein kinase RYK OS=Homo sapiens OX=9606 GN=RYK PE=1 SV=3	264	ISASSSSQGLSQ
SVLPPPSYATTG	sp|P03107|VL2_HPV16	413	tr|M0QY12|M0QY12_HUMAN A disintegrin and metalloproteinase with thrombospondin motifs 10 OS=Homo sapiens OX=9606 GN=ADAMTS10 PE=4 SV=1	14	SCLPPPSGATNG
NIIRSLPGSLGN	sp|P03114|VE1_HPV16	265	sp|Q13201|MMRN1_HUMAN Multimerin-1 OS=Homo sapiens OX=9606 GN=MMRN1 PE=1 SV=3	985	CIDRSLPGSLAN
NIIRSLPGSLGN	sp|P03114|VE1_HPV16	265	tr|E7EPG1|E7EPG1_HUMAN Multimerin-1 OS=Homo sapiens OX=9606 GN=MMRN1 PE=1 SV=1	727	CIDRSLPGSLAN
NIIRSLPGSLGN	sp|P03114|VE1_HPV16	265	sp|Q9ULM6|CNOT6_HUMAN CCR4-NOT transcription complex subunit 6 OS=Homo sapiens OX=9606 GN=CNOT6 PE=1 SV=2	84	NKIRSLPAELGN
NIIRSLPGSLGN	sp|P03114|VE1_HPV16	265	sp|Q9H9A6|LRC40_HUMAN Leucine-rich repeat-containing protein 40 OS=Homo sapiens OX=9606 GN=LRRC40 PE=1 SV=1	322	NDISSLPYSLGN
