query	query_seqname	query_start	target_seqname	target_start	target
VRLGRFLLDVAP	sp|Q2HR73|VIRF4_HHV8P	67	sp|O15360|FANCA_HUMAN Fanconi anemia group A protein OS=Homo sapiens OX=9606 GN=FANCA PE=1 SV=2	1313	LRLGRLLLRVAP
TQTELNSSHLPD	sp|Q2HRC8|ORF11_HHV8P	25	sp|Q15911|ZFHX3_HUMAN Zinc finger homeobox protein 3 OS=Homo sapiens OX=9606 GN=ZFHX3 PE=1 SV=2	23	QWTELNSTHLPD
QQPQQQEKQQQE	sp|Q9QR71|LANA1_HHV8P	47	tr|A0A0A0MSU2|A0A0A0MSU2_HUMAN Mitotic deacetylase-associated SANT domain protein (Fragment) OS=Homo sapiens OX=9606 GN=MIDEAS PE=1 SV=6	252	QQPQQQQQQQQA
QQPQQQEKQQQE	sp|Q9QR71|LANA1_HHV8P	47	sp|Q6PJG2|MDEAS_HUMAN Mitotic deacetylase-associated SANT domain protein OS=Homo sapiens OX=9606 GN=MIDEAS PE=1 SV=2	252	QQPQQQQQQQQA
QQPQQQEKQQQE	sp|Q9QR71|LANA1_HHV8P	47	tr|A0A1C7CYX1|A0A1C7CYX1_HUMAN Mitotic deacetylase-associated SANT domain protein OS=Homo sapiens OX=9606 GN=MIDEAS PE=1 SV=1	252	QQPQQQQQQQQA
QQPQQQEKQQQE	sp|Q9QR71|LANA1_HHV8P	47	tr|H7C1L3|H7C1L3_HUMAN Mitotic deacetylase-associated SANT domain protein (Fragment) OS=Homo sapiens OX=9606 GN=MIDEAS PE=1 SV=1	74	QQPQQQQQQQQA
QQPQQQEKQQQE	sp|Q9QR71|LANA1_HHV8P	47	tr|I3L354|I3L354_HUMAN Runt-related transcription factor 2 OS=Homo sapiens OX=9606 GN=RUNX2 PE=1 SV=1	47	QQQQQQQQQQQE
QQPQQQEKQQQE	sp|Q9QR71|LANA1_HHV8P	47	tr|A0A2R8Y7Z3|A0A2R8Y7Z3_HUMAN Runt-related transcription factor 2 OS=Homo sapiens OX=9606 GN=RUNX2 PE=1 SV=1	47	QQQQQQQQQQQE
QQPQQQEKQQQE	sp|Q9QR71|LANA1_HHV8P	47	sp|Q13950|RUNX2_HUMAN Runt-related transcription factor 2 OS=Homo sapiens OX=9606 GN=RUNX2 PE=1 SV=2	61	QQQQQQQQQQQE
QQPQQQEKQQQE	sp|Q9QR71|LANA1_HHV8P	47	tr|I3L0L0|I3L0L0_HUMAN Runt-related transcription factor 2 OS=Homo sapiens OX=9606 GN=RUNX2 PE=1 SV=1	61	QQQQQQQQQQQE
QQPQQQEKQQQE	sp|Q9QR71|LANA1_HHV8P	47	tr|A0A0D9SEN7|A0A0D9SEN7_HUMAN Runt-related transcription factor OS=Homo sapiens OX=9606 GN=RUNX2 PE=1 SV=1	47	QQQQQQQQQQQE
QQPQQQEKQQQE	sp|Q9QR71|LANA1_HHV8P	47	tr|E9PAK5|E9PAK5_HUMAN DENN domain-containing protein 4B (Fragment) OS=Homo sapiens OX=9606 GN=DENND4B PE=1 SV=1	911	QQQQQQQQQQQE
QQPQQQEKQQQE	sp|Q9QR71|LANA1_HHV8P	47	sp|O75064|DEN4B_HUMAN DENN domain-containing protein 4B OS=Homo sapiens OX=9606 GN=DENND4B PE=1 SV=4	900	QQQQQQQQQQQE
QQPQQQEKQQQE	sp|Q9QR71|LANA1_HHV8P	47	tr|E9PEG3|E9PEG3_HUMAN Androgen receptor OS=Homo sapiens OX=9606 GN=AR PE=1 SV=1	70	QQQQQQQQQQQE
QQPQQQEKQQQE	sp|Q9QR71|LANA1_HHV8P	47	tr|F5GZG9|F5GZG9_HUMAN Androgen receptor OS=Homo sapiens OX=9606 GN=AR PE=1 SV=1	70	QQQQQQQQQQQE
QQPQQQEKQQQE	sp|Q9QR71|LANA1_HHV8P	47	sp|P10275|ANDR_HUMAN Androgen receptor OS=Homo sapiens OX=9606 GN=AR PE=1 SV=3	70	QQQQQQQQQQQE
QQPQQQEKQQQE	sp|Q9QR71|LANA1_HHV8P	47	tr|A0A087WUX9|A0A087WUX9_HUMAN Androgen receptor OS=Homo sapiens OX=9606 GN=AR PE=1 SV=1	70	QQQQQQQQQQQE
QQPQQQEKQQQE	sp|Q9QR71|LANA1_HHV8P	47	sp|Q8NDV7|TNR6A_HUMAN Trinucleotide repeat-containing gene 6A protein OS=Homo sapiens OX=9606 GN=TNRC6A PE=1 SV=2	102	QQPQQQQPQQQP
QQPQQQEKQQQE	sp|Q9QR71|LANA1_HHV8P	47	sp|Q8NDV7|TNR6A_HUMAN Trinucleotide repeat-containing gene 6A protein OS=Homo sapiens OX=9606 GN=TNRC6A PE=1 SV=2	93	QQPQQQQQQQQP
GKVPARIPSHGQ	sp|Q2HR73|VIRF4_HHV8P	174	tr|F2Z337|F2Z337_HUMAN Myoglobin (Fragment) OS=Homo sapiens OX=9606 GN=MB PE=1 SV=1	16	GKVEADIPGHGQ
GKVPARIPSHGQ	sp|Q2HR73|VIRF4_HHV8P	174	tr|F2Z2F1|F2Z2F1_HUMAN Myoglobin (Fragment) OS=Homo sapiens OX=9606 GN=MB PE=1 SV=1	16	GKVEADIPGHGQ
GKVPARIPSHGQ	sp|Q2HR73|VIRF4_HHV8P	174	tr|B0QYF8|B0QYF8_HUMAN Myoglobin (Fragment) OS=Homo sapiens OX=9606 GN=MB PE=1 SV=1	16	GKVEADIPGHGQ
GKVPARIPSHGQ	sp|Q2HR73|VIRF4_HHV8P	174	sp|P02144|MYG_HUMAN Myoglobin OS=Homo sapiens OX=9606 GN=MB PE=1 SV=2	16	GKVEADIPGHGQ
CTESSSLEAVRF	sp|F5HB98|K81_HHV8P	205	sp|Q9NPY3|C1QR1_HUMAN Complement component C1q receptor OS=Homo sapiens OX=9606 GN=CD93 PE=1 SV=3	206	QTTSSSLEAVPF
KLSKRIWVTWML	sp|F5H9W9|TEG7_HHV8P	32	sp|Q6ZVU0|YK022_HUMAN Putative uncharacterized protein FLJ42102 OS=Homo sapiens OX=9606 PE=5 SV=1	88	SLSKRIKCTWML
YRRDLIQLLVAI	sp|F5HGN8|TRX2_HHV8P	190	sp|Q4L180|FIL1L_HUMAN Filamin A-interacting protein 1-like OS=Homo sapiens OX=9606 GN=FILIP1L PE=1 SV=2	154	YRRILGQLLVAE
IPTSVLLLALEL	sp|F5HEU7|ITP_HHV8P	266	tr|A0A494C150|A0A494C150_HUMAN Probable E3 ubiquitin-protein ligase HECTD4 (Fragment) OS=Homo sapiens OX=9606 GN=HECTD4 PE=1 SV=1	821	IPTSVLLQVVEL
IPTSVLLLALEL	sp|F5HEU7|ITP_HHV8P	266	tr|F8VWT9|F8VWT9_HUMAN Probable E3 ubiquitin-protein ligase HECTD4 OS=Homo sapiens OX=9606 GN=HECTD4 PE=1 SV=2	3011	IPTSVLLQVVEL
IPTSVLLLALEL	sp|F5HEU7|ITP_HHV8P	266	tr|J3KPF0|J3KPF0_HUMAN Probable E3 ubiquitin-protein ligase HECTD4 OS=Homo sapiens OX=9606 GN=HECTD4 PE=1 SV=3	3143	IPTSVLLQVVEL
IPTSVLLLALEL	sp|F5HEU7|ITP_HHV8P	266	sp|Q9Y4D8|HECD4_HUMAN Probable E3 ubiquitin-protein ligase HECTD4 OS=Homo sapiens OX=9606 GN=HECTD4 PE=1 SV=5	2723	IPTSVLLQVVEL
DDEDDQEPVEEE	sp|Q9QR71|LANA1_HHV8P	637	tr|A0A1W2PPD9|A0A1W2PPD9_HUMAN N-myc proto-oncogene protein OS=Homo sapiens OX=9606 GN=MYCN PE=1 SV=1	53	DDEDDEEEDEEE
DDEDDQEPVEEE	sp|Q9QR71|LANA1_HHV8P	637	sp|P04198|MYCN_HUMAN N-myc proto-oncogene protein OS=Homo sapiens OX=9606 GN=MYCN PE=1 SV=2	264	DDEDDEEEDEEE
DDEDDQEPVEEE	sp|Q9QR71|LANA1_HHV8P	637	sp|Q9UER7|DAXX_HUMAN Death domain-associated protein 6 OS=Homo sapiens OX=9606 GN=DAXX PE=1 SV=2	436	DDEDDEESDEEE
DDEDDQEPVEEE	sp|Q9QR71|LANA1_HHV8P	637	sp|P19338|NUCL_HUMAN Nucleolin OS=Homo sapiens OX=9606 GN=NCL PE=1 SV=3	257	DDEDDEEEEEEE
DLSLELPKLSKR	sp|F5H9W9|TEG7_HHV8P	25	tr|A0A6Q8PGN1|A0A6Q8PGN1_HUMAN Kinesin heavy chain isoform 5A (Fragment) OS=Homo sapiens OX=9606 GN=KIF5A PE=1 SV=1	38	DLRCELPKLEKR
DLSLELPKLSKR	sp|F5H9W9|TEG7_HHV8P	25	sp|Q12840|KIF5A_HUMAN Kinesin heavy chain isoform 5A OS=Homo sapiens OX=9606 GN=KIF5A PE=1 SV=2	853	DLRCELPKLEKR
DLSLELPKLSKR	sp|F5H9W9|TEG7_HHV8P	25	tr|A0A6Q8PGJ3|A0A6Q8PGJ3_HUMAN Kinesin heavy chain isoform 5A OS=Homo sapiens OX=9606 GN=KIF5A PE=1 SV=1	860	DLRCELPKLEKR
DLSLELPKLSKR	sp|F5H9W9|TEG7_HHV8P	25	tr|J3KNA1|J3KNA1_HUMAN Kinesin-like protein OS=Homo sapiens OX=9606 GN=KIF5A PE=1 SV=1	764	DLRCELPKLEKR
DLSLELPKLSKR	sp|F5H9W9|TEG7_HHV8P	25	tr|A0A6Q8PEZ8|A0A6Q8PEZ8_HUMAN Kinesin-like protein OS=Homo sapiens OX=9606 GN=KIF5A PE=1 SV=1	818	DLRCELPKLEKR
DLSLELPKLSKR	sp|F5H9W9|TEG7_HHV8P	25	tr|A0A6Q8PGG7|A0A6Q8PGG7_HUMAN Kinesin heavy chain isoform 5A (Fragment) OS=Homo sapiens OX=9606 GN=KIF5A PE=1 SV=1	7	DLRCELPKLEKR
DLSLELPKLSKR	sp|F5H9W9|TEG7_HHV8P	25	sp|O60282|KIF5C_HUMAN Kinesin heavy chain isoform 5C OS=Homo sapiens OX=9606 GN=KIF5C PE=1 SV=1	857	DLRCELPKLEKR
DLSLELPKLSKR	sp|F5H9W9|TEG7_HHV8P	25	tr|A0A0G2JMZ6|A0A0G2JMZ6_HUMAN Kinesin-like protein (Fragment) OS=Homo sapiens OX=9606 GN=KIF5C PE=1 SV=1	760	DLRCELPKLEKR
DLSLELPKLSKR	sp|F5H9W9|TEG7_HHV8P	25	sp|P33176|KINH_HUMAN Kinesin-1 heavy chain OS=Homo sapiens OX=9606 GN=KIF5B PE=1 SV=1	855	DLRCELPKLEKR
CTKVNTNKYSLG	sp|F5HGB6|TRM3_HHV8P	388	sp|P51153|RAB13_HUMAN Ras-related protein Rab-13 OS=Homo sapiens OX=9606 GN=RAB13 PE=1 SV=1	192	CDKKNTNKCSLG
CTKVNTNKYSLG	sp|F5HGB6|TRM3_HHV8P	388	tr|A0A087WWB9|A0A087WWB9_HUMAN Ras-related protein Rab-13 OS=Homo sapiens OX=9606 GN=RAB13 PE=1 SV=1	111	CDKKNTNKCSLG
EVQTEFGNTAGL	sp|Q2HRC7|VIL6_HHV8P	95	tr|H0YMP7|H0YMP7_HUMAN Semaphorin-6D (Fragment) OS=Homo sapiens OX=9606 GN=SEMA6D PE=1 SV=1	18	EQDTEFGNTAHL
EVQTEFGNTAGL	sp|Q2HRC7|VIL6_HHV8P	95	sp|Q8NFY4|SEM6D_HUMAN Semaphorin-6D OS=Homo sapiens OX=9606 GN=SEMA6D PE=1 SV=1	554	EQDTEFGNTAHL
EVQTEFGNTAGL	sp|Q2HRC7|VIL6_HHV8P	95	tr|H0YM97|H0YM97_HUMAN Semaphorin-6D (Fragment) OS=Homo sapiens OX=9606 GN=SEMA6D PE=4 SV=1	19	EQDTEFGNTAHL
NLLRAAILMLYA	sp|F5HAW0|RIR2_HHV8P	41	sp|O75581|LRP6_HUMAN Low-density lipoprotein receptor-related protein 6 OS=Homo sapiens OX=9606 GN=LRP6 PE=1 SV=2	15	VLLRAAPLLLYA
NLLRAAILMLYA	sp|F5HAW0|RIR2_HHV8P	41	tr|F5H7J9|F5H7J9_HUMAN Low-density lipoprotein receptor-related protein OS=Homo sapiens OX=9606 GN=LRP6 PE=1 SV=1	15	VLLRAAPLLLYA
VLLEKLLARGAL	sp|Q2HR71|VIRF2_HHV8P	74	sp|Q401N2|ZACN_HUMAN Zinc-activated ligand-gated ion channel OS=Homo sapiens OX=9606 GN=ZACN PE=1 SV=2	312	VLLAGLLARGNL
LQSILVNYELVA	sp|Q2HR64|LTP_HHV8P	1424	sp|Q8N6N2|TTC9B_HUMAN Tetratricopeptide repeat protein 9B OS=Homo sapiens OX=9606 GN=TTC9B PE=2 SV=1	146	LQSELVNYERVR
TLPCHPNLSGYS	sp|F5HIC6|VIRF3_HHV8P	7	tr|A0A2R8Y5N5|A0A2R8Y5N5_HUMAN SWI/SNF-related matrix-associated actin-dependent regulator of chromatin subfamily B member 1 OS=Homo sapiens OX=9606 GN=SMARCB1 PE=1 SV=1	235	TLPCPPHLSGPS
TLPCHPNLSGYS	sp|F5HIC6|VIRF3_HHV8P	7	tr|A0A2R8YEE8|A0A2R8YEE8_HUMAN SWI/SNF-related matrix-associated actin-dependent regulator of chromatin subfamily B member 1 (Fragment) OS=Homo sapiens OX=9606 GN=SMARCB1 PE=1 SV=1	180	TLPCPPHLSGPS
NPGELADSKEFP	sp|Q2HR92|HEPA_HHV8P	250	tr|A0A6I8PL75|A0A6I8PL75_HUMAN Supervillin (Fragment) OS=Homo sapiens OX=9606 GN=SVIL PE=1 SV=1	178	NPGELAQHKEDP
NPGELADSKEFP	sp|Q2HR92|HEPA_HHV8P	250	tr|A0A0J9YWY6|A0A0J9YWY6_HUMAN Supervillin (Fragment) OS=Homo sapiens OX=9606 GN=SVIL PE=1 SV=1	618	NPGELAQHKEDP
NPGELADSKEFP	sp|Q2HR92|HEPA_HHV8P	250	sp|O95425|SVIL_HUMAN Supervillin OS=Homo sapiens OX=9606 GN=SVIL PE=1 SV=2	1692	NPGELAQHKEDP
NPGELADSKEFP	sp|Q2HR92|HEPA_HHV8P	250	tr|A0A6I8PIX7|A0A6I8PIX7_HUMAN Supervillin OS=Homo sapiens OX=9606 GN=SVIL PE=1 SV=1	1382	NPGELAQHKEDP
QGPLKSERALAF	sp|F5H8Y5|TRX1_HHV8P	193	sp|Q9H255|O51E2_HUMAN Olfactory receptor 51E2 OS=Homo sapiens OX=9606 GN=OR51E2 PE=1 SV=1	226	QLPSKSERAKAF
LSPAGPLLVRLG	sp|Q2HR73|VIRF4_HHV8P	59	tr|B8ZZF3|B8ZZF3_HUMAN Mediator complex subunit 26 OS=Homo sapiens OX=9606 PE=3 SV=2	368	LSPAEPLLSRAG
LSPAGPLLVRLG	sp|Q2HR73|VIRF4_HHV8P	59	sp|O95402|MED26_HUMAN Mediator of RNA polymerase II transcription subunit 26 OS=Homo sapiens OX=9606 GN=MED26 PE=1 SV=2	360	LSPAEPLLSRAG
REEREQIQKLRA	sp|Q2HR64|LTP_HHV8P	393	sp|Q5VUJ6|LRCH2_HUMAN Leucine-rich repeat and calponin homology domain-containing protein 2 OS=Homo sapiens OX=9606 GN=LRCH2 PE=1 SV=2	643	REEREQIRQLRN
RLSSVAQEDPKA	sp|Q2HRC8|ORF11_HHV8P	218	tr|A0A0U1RR71|A0A0U1RR71_HUMAN Pleckstrin homology domain-containing family G member 3 (Fragment) OS=Homo sapiens OX=9606 GN=PLEKHG3 PE=1 SV=1	559	RRSSVAQEDSKS
RLSSVAQEDPKA	sp|Q2HRC8|ORF11_HHV8P	218	sp|A1L390|PKHG3_HUMAN Pleckstrin homology domain-containing family G member 3 OS=Homo sapiens OX=9606 GN=PLEKHG3 PE=1 SV=1	615	RRSSVAQEDSKS
RLSSVAQEDPKA	sp|Q2HRC8|ORF11_HHV8P	218	tr|G3V311|G3V311_HUMAN Pleckstrin homology domain-containing family G member 3 OS=Homo sapiens OX=9606 GN=PLEKHG3 PE=1 SV=1	120	RRSSVAQEDSKS
DSGLDSYAPDLA	sp|F5HCV3|ORF50_HHV8P	410	sp|Q9BZ29|DOCK9_HUMAN Dedicator of cytokinesis protein 9 OS=Homo sapiens OX=9606 GN=DOCK9 PE=1 SV=2	309	GSGLDSYLPELA
DSGLDSYAPDLA	sp|F5HCV3|ORF50_HHV8P	410	tr|A0A0A0MSY4|A0A0A0MSY4_HUMAN Dedicator of cytokinesis protein 9 OS=Homo sapiens OX=9606 GN=DOCK9 PE=1 SV=1	308	GSGLDSYLPELA
DSGLDSYAPDLA	sp|F5HCV3|ORF50_HHV8P	410	tr|A0A088AWN3|A0A088AWN3_HUMAN Dedicator of cytokinesis protein 9 OS=Homo sapiens OX=9606 GN=DOCK9 PE=1 SV=2	320	GSGLDSYLPELA
DSGLDSYAPDLA	sp|F5HCV3|ORF50_HHV8P	410	tr|Q6ZSL5|Q6ZSL5_HUMAN Dedicator of cytokinesis protein 9 OS=Homo sapiens OX=9606 GN=DOCK9 PE=1 SV=1	320	GSGLDSYLPELA
DSGLDSYAPDLA	sp|F5HCV3|ORF50_HHV8P	410	tr|A0A0A0MT38|A0A0A0MT38_HUMAN Dedicator of cytokinesis 9, isoform CRA_b OS=Homo sapiens OX=9606 GN=DOCK9 PE=1 SV=2	309	GSGLDSYLPELA
DSGLDSYAPDLA	sp|F5HCV3|ORF50_HHV8P	410	tr|A0A0D9SFH5|A0A0D9SFH5_HUMAN Dedicator of cytokinesis protein 9 OS=Homo sapiens OX=9606 GN=DOCK9 PE=1 SV=1	308	GSGLDSYLPELA
LGRHLPCLQVGQ	sp|Q2HR98|UL95_HHV8P	146	sp|Q9UL18|AGO1_HUMAN Protein argonaute-1 OS=Homo sapiens OX=9606 GN=AGO1 PE=1 SV=3	319	KYPHLPCLQVGQ
LGRHLPCLQVGQ	sp|Q2HR98|UL95_HHV8P	146	tr|Q5TA58|Q5TA58_HUMAN Protein argonaute-1 OS=Homo sapiens OX=9606 GN=AGO1 PE=1 SV=1	244	KYPHLPCLQVGQ
LGRHLPCLQVGQ	sp|Q2HR98|UL95_HHV8P	146	tr|A0A6I8PTZ8|A0A6I8PTZ8_HUMAN Protein argonaute-1 OS=Homo sapiens OX=9606 GN=AGO1 PE=1 SV=1	319	KYPHLPCLQVGQ
LGRHLPCLQVGQ	sp|Q2HR98|UL95_HHV8P	146	sp|Q9HCK5|AGO4_HUMAN Protein argonaute-4 OS=Homo sapiens OX=9606 GN=AGO4 PE=1 SV=2	311	KYPHLPCLQVGQ
LGRHLPCLQVGQ	sp|Q2HR98|UL95_HHV8P	146	sp|Q9H9G7|AGO3_HUMAN Protein argonaute-3 OS=Homo sapiens OX=9606 GN=AGO3 PE=1 SV=2	322	KYPHLPCLQVGQ
LGRHLPCLQVGQ	sp|Q2HR98|UL95_HHV8P	146	sp|Q9UKV8|AGO2_HUMAN Protein argonaute-2 OS=Homo sapiens OX=9606 GN=AGO2 PE=1 SV=3	321	RYPHLPCLQVGQ
QPQPQQQSEPVP	sp|Q9QR71|LANA1_HHV8P	1002	sp|Q8WUF5|IASPP_HUMAN RelA-associated inhibitor OS=Homo sapiens OX=9606 GN=PPP1R13L PE=1 SV=4	411	QPQPQPQSQPQP
QPQPQQQSEPVP	sp|Q9QR71|LANA1_HHV8P	1002	tr|R4GND3|R4GND3_HUMAN Pleckstrin homology-like domain family A member 1 OS=Homo sapiens OX=9606 GN=PHLDA1 PE=1 SV=1	185	QPQPQPQSQPQP
QPQPQQQSEPVP	sp|Q9QR71|LANA1_HHV8P	1002	sp|Q8WV24|PHLA1_HUMAN Pleckstrin homology-like domain family A member 1 OS=Homo sapiens OX=9606 GN=PHLDA1 PE=1 SV=4	326	QPQPQPQSQPQP
QPQPQQQSEPVP	sp|Q9QR71|LANA1_HHV8P	1002	sp|A0A0U1RRL7|MMPOS_HUMAN Protein MMP24OS OS=Homo sapiens OX=9606 GN=MMP24OS PE=1 SV=1	43	QPQPQPQPEPSP
QLVQQRLPESQD	sp|Q9QR71|LANA1_HHV8P	178	tr|C9JG08|C9JG08_HUMAN Uncharacterized protein C2orf16 OS=Homo sapiens OX=9606 GN=C2orf16 PE=1 SV=2	127	RLVEQDLPESQD
QVITIRDDSDLS	sp|Q2HR64|LTP_HHV8P	1595	tr|C9JJN0|C9JJN0_HUMAN Serine/threonine-protein kinase Nek10 (Fragment) OS=Homo sapiens OX=9606 GN=NEK10 PE=4 SV=8	19	QEITIRDYSDLK
QVITIRDDSDLS	sp|Q2HR64|LTP_HHV8P	1595	sp|Q6ZWH5|NEK10_HUMAN Serine/threonine-protein kinase Nek10 OS=Homo sapiens OX=9606 GN=NEK10 PE=1 SV=3	19	QEITIRDYSDLK
PRAGWAPAFLGL	sp|F5HG20|UL49_HHV8P	22	tr|F8WEM1|F8WEM1_HUMAN Ras-associating and dilute domain-containing protein OS=Homo sapiens OX=9606 GN=RADIL PE=1 SV=1	356	PRAGPAPARPGL
DEGSSADSSTAS	sp|F5HDE4|ORF45_HHV8P	322	sp|Q9UPU5|UBP24_HUMAN Ubiquitin carboxyl-terminal hydrolase 24 OS=Homo sapiens OX=9606 GN=USP24 PE=1 SV=3	1040	PSGSSADSSTSS
ENKVPLDKESRE	sp|Q2HR67|RIR1_HHV8P	37	sp|Q9HCM4|E41L5_HUMAN Band 4.1-like protein 5 OS=Homo sapiens OX=9606 GN=EPB41L5 PE=1 SV=3	603	ENNVPLPKESLE
SITMKGLQAIDA	sp|F5HCV3|ORF50_HHV8P	351	sp|Q4G0P3|HYDIN_HUMAN Hydrocephalus-inducing protein homolog OS=Homo sapiens OX=9606 GN=HYDIN PE=1 SV=3	4775	SITMKGLDYIDV
QPQQQEKQQQEK	sp|Q9QR71|LANA1_HHV8P	48	sp|Q8IZD4|DCP1B_HUMAN mRNA-decapping enzyme 1B OS=Homo sapiens OX=9606 GN=DCP1B PE=1 SV=2	252	QQQQQQQQQQEK
QPQQQEKQQQEK	sp|Q9QR71|LANA1_HHV8P	48	tr|F5GZK9|F5GZK9_HUMAN mRNA-decapping enzyme 1B OS=Homo sapiens OX=9606 GN=DCP1B PE=1 SV=1	126	QQQQQQQQQQEK
MTIFTGVGLLGS	sp|Q2HR64|LTP_HHV8P	1049	sp|O94823|AT10B_HUMAN Phospholipid-transporting ATPase VB OS=Homo sapiens OX=9606 GN=ATP10B PE=1 SV=2	1250	WTIFHGVVLLGS
MTIFTGVGLLGS	sp|Q2HR64|LTP_HHV8P	1049	tr|A0A2R8YDI5|A0A2R8YDI5_HUMAN Phospholipid-transporting ATPase OS=Homo sapiens OX=9606 GN=ATP10B PE=1 SV=1	1222	WTIFHGVVLLGS
LSTRTELEDSGD	sp|Q2HR80|ORF52_HHV8P	2	sp|O15015|ZN646_HUMAN Zinc finger protein 646 OS=Homo sapiens OX=9606 GN=ZNF646 PE=1 SV=2	357	LSTSGELEDSGL
HSLHLASSTRSP	sp|F5HFD2|ORF24_HHV8P	236	tr|V9GZ38|V9GZ38_HUMAN Uncharacterized protein (Fragment) OS=Homo sapiens OX=9606 PE=4 SV=3	186	LSLHLASSTESV
KSYLSLYLLNQT	sp|Q2HRD5|K1_HHV8P	211	sp|Q9NP58|ABCB6_HUMAN ATP-binding cassette sub-family B member 6, mitochondrial OS=Homo sapiens OX=9606 GN=ABCB6 PE=1 SV=1	489	KSSASLVLLNQT
TGEDPEGHVILI	sp|F5HEU7|ITP_HHV8P	456	tr|A0A2R8Y863|A0A2R8Y863_HUMAN Equilibrative nucleoside transporter 3 (Fragment) OS=Homo sapiens OX=9606 GN=SLC29A3 PE=1 SV=1	67	TGEDPEGSDILE
TGEDPEGHVILI	sp|F5HEU7|ITP_HHV8P	456	tr|A0A2R8Y4I0|A0A2R8Y4I0_HUMAN Equilibrative nucleoside transporter 3 OS=Homo sapiens OX=9606 GN=SLC29A3 PE=1 SV=1	90	TGEDPEGSDILE
TGEDPEGHVILI	sp|F5HEU7|ITP_HHV8P	456	tr|A0A2R8Y5U2|A0A2R8Y5U2_HUMAN Equilibrative nucleoside transporter 3 OS=Homo sapiens OX=9606 GN=SLC29A3 PE=4 SV=1	12	TGEDPEGSDILG
TGEDPEGHVILI	sp|F5HEU7|ITP_HHV8P	456	tr|A0A2R8YGC2|A0A2R8YGC2_HUMAN Equilibrative nucleoside transporter 3 OS=Homo sapiens OX=9606 GN=SLC29A3 PE=1 SV=1	90	TGEDPEGSDILG
TGEDPEGHVILI	sp|F5HEU7|ITP_HHV8P	456	tr|A0A2R8Y4B7|A0A2R8Y4B7_HUMAN Equilibrative nucleoside transporter 3 OS=Homo sapiens OX=9606 GN=SLC29A3 PE=1 SV=1	90	TGEDPEGSDILG
TGEDPEGHVILI	sp|F5HEU7|ITP_HHV8P	456	tr|A0A2R8Y5R8|A0A2R8Y5R8_HUMAN Equilibrative nucleoside transporter 3 OS=Homo sapiens OX=9606 GN=SLC29A3 PE=1 SV=1	90	TGEDPEGSDILN
TGEDPEGHVILI	sp|F5HEU7|ITP_HHV8P	456	tr|A0A2R8Y657|A0A2R8Y657_HUMAN Equilibrative nucleoside transporter 3 OS=Homo sapiens OX=9606 GN=SLC29A3 PE=1 SV=1	90	TGEDPEGSDILN
TGEDPEGHVILI	sp|F5HEU7|ITP_HHV8P	456	tr|A0A2R8YDA4|A0A2R8YDA4_HUMAN Equilibrative nucleoside transporter 3 OS=Homo sapiens OX=9606 GN=SLC29A3 PE=3 SV=1	12	TGEDPEGSDILN
TGEDPEGHVILI	sp|F5HEU7|ITP_HHV8P	456	sp|Q9BZD2|S29A3_HUMAN Equilibrative nucleoside transporter 3 OS=Homo sapiens OX=9606 GN=SLC29A3 PE=1 SV=3	90	TGEDPEGSDILN
TGEDPEGHVILI	sp|F5HEU7|ITP_HHV8P	456	tr|A0A2R8YDR8|A0A2R8YDR8_HUMAN Equilibrative nucleoside transporter 3 OS=Homo sapiens OX=9606 GN=SLC29A3 PE=1 SV=1	12	TGEDPEGSDILN
NKGGPPVSLGRS	sp|F5HID2|PAP_HHV8P	264	sp|A9Z1Z3|FR1L4_HUMAN Fer-1-like protein 4 OS=Homo sapiens OX=9606 GN=FER1L4 PE=2 SV=1	841	NKFGPPVFLGRA
LMLYAAVLSAFD	sp|F5HAW0|RIR2_HHV8P	48	tr|A0A0J9YWU3|A0A0J9YWU3_HUMAN P protein (Fragment) OS=Homo sapiens OX=9606 GN=OCA2 PE=1 SV=1	429	LCLIAAVLSAFL
LMLYAAVLSAFD	sp|F5HAW0|RIR2_HHV8P	48	tr|A0A0J9YXL8|A0A0J9YXL8_HUMAN P protein (Fragment) OS=Homo sapiens OX=9606 GN=OCA2 PE=1 SV=1	405	LCLIAAVLSAFL
LMLYAAVLSAFD	sp|F5HAW0|RIR2_HHV8P	48	sp|Q04671|P_HUMAN P protein OS=Homo sapiens OX=9606 GN=OCA2 PE=2 SV=2	429	LCLIAAVLSAFL
RVTQIINGSVPV	sp|Q9QR70|ORF75_HHV8P	291	tr|E9PRK7|E9PRK7_HUMAN ARL14 effector protein (Fragment) OS=Homo sapiens OX=9606 GN=ARL14EP PE=1 SV=1	118	KCTQIINGSVDV
RVTQIINGSVPV	sp|Q9QR70|ORF75_HHV8P	291	sp|Q8N8R7|AL14E_HUMAN ARL14 effector protein OS=Homo sapiens OX=9606 GN=ARL14EP PE=1 SV=1	118	KCTQIINGSVDV
NLISVEALEVVL	sp|Q2HR67|RIR1_HHV8P	498	tr|F8WC89|F8WC89_HUMAN SAC3 domain-containing protein 1 OS=Homo sapiens OX=9606 GN=SAC3D1 PE=1 SV=1	190	NLGSVEALHEVL
NLISVEALEVVL	sp|Q2HR67|RIR1_HHV8P	498	sp|A6NKF1|SAC31_HUMAN SAC3 domain-containing protein 1 OS=Homo sapiens OX=9606 GN=SAC3D1 PE=1 SV=2	236	NLGSVEALHEVL
YGEDDFESFEYA	sp|Q2HRD0|DPOL_HHV8P	727	sp|Q96SB3|NEB2_HUMAN Neurabin-2 OS=Homo sapiens OX=9606 GN=PPP1R9B PE=1 SV=3	616	YGEDDEETGEYA
TESSSLEAVRFT	sp|F5HB98|K81_HHV8P	206	sp|Q9NPY3|C1QR1_HUMAN Complement component C1q receptor OS=Homo sapiens OX=9606 GN=CD93 PE=1 SV=3	207	TTSSSLEAVPFA
KLSTRTELEDSG	sp|Q2HR80|ORF52_HHV8P	1	sp|O15015|ZN646_HUMAN Zinc finger protein 646 OS=Homo sapiens OX=9606 GN=ZNF646 PE=1 SV=2	356	ELSTSGELEDSG
PSRALSGALQRS	sp|F5HG20|UL49_HHV8P	407	sp|Q96M86|DNHD1_HUMAN Dynein heavy chain domain-containing protein 1 OS=Homo sapiens OX=9606 GN=DNHD1 PE=2 SV=2	4409	QSRALLSALQRS
HATLLSSTMIFI	sp|F5HDD0|GM_HHV8P	81	sp|Q14439|GP176_HUMAN G-protein coupled receptor 176 OS=Homo sapiens OX=9606 GN=GPR176 PE=2 SV=1	265	HATLLSMVMVFI
FPFPESLFVRGV	sp|Q2HR64|LTP_HHV8P	1132	tr|A0A3B3IRX3|A0A3B3IRX3_HUMAN Mediator of RNA polymerase II transcription subunit 13 OS=Homo sapiens OX=9606 GN=MED13L PE=1 SV=1	1866	FPFPISLFVRSR
ASILGALVTVRA	sp|F5HGB6|TRM3_HHV8P	249	sp|Q92843|B2CL2_HUMAN Bcl-2-like protein 2 OS=Homo sapiens OX=9606 GN=BCL2L2 PE=1 SV=2	177	AVALGALVTVGA
LENTNLRPLINH	sp|F5HEF2|CEP2_HHV8P	58	tr|A0A2R8Y461|A0A2R8Y461_HUMAN Putative Polycomb group protein ASXL3 (Fragment) OS=Homo sapiens OX=9606 GN=ASXL3 PE=1 SV=1	202	LVNTNLRALINK
LENTNLRPLINH	sp|F5HEF2|CEP2_HHV8P	58	sp|Q9C0F0|ASXL3_HUMAN Putative Polycomb group protein ASXL3 OS=Homo sapiens OX=9606 GN=ASXL3 PE=2 SV=3	258	LVNTNLRALINK
LENTNLRPLINH	sp|F5HEF2|CEP2_HHV8P	58	tr|K7EJ76|K7EJ76_HUMAN Putative Polycomb group protein ASXL3 OS=Homo sapiens OX=9606 GN=ASXL3 PE=1 SV=1	259	LVNTNLRALINK
LENTNLRPLINH	sp|F5HEF2|CEP2_HHV8P	58	tr|A0A5F9ZHN2|A0A5F9ZHN2_HUMAN Putative Polycomb group protein ASXL2 (Fragment) OS=Homo sapiens OX=9606 GN=ASXL2 PE=1 SV=1	18	LVNTNLRALINK
LENTNLRPLINH	sp|F5HEF2|CEP2_HHV8P	58	sp|Q76L83|ASXL2_HUMAN Putative Polycomb group protein ASXL2 OS=Homo sapiens OX=9606 GN=ASXL2 PE=1 SV=1	278	LVNTNLRALINK
LENTNLRPLINH	sp|F5HEF2|CEP2_HHV8P	58	tr|E7EWD6|E7EWD6_HUMAN Putative Polycomb group protein ASXL2 OS=Homo sapiens OX=9606 GN=ASXL2 PE=1 SV=1	250	LVNTNLRALINK
LENTNLRPLINH	sp|F5HEF2|CEP2_HHV8P	58	tr|A0A494C1R1|A0A494C1R1_HUMAN Polycomb group protein ASXL1 OS=Homo sapiens OX=9606 GN=ASXL1 PE=1 SV=1	259	LVNTNLRALINS
LENTNLRPLINH	sp|F5HEF2|CEP2_HHV8P	58	sp|Q8IXJ9|ASXL1_HUMAN Polycomb group protein ASXL1 OS=Homo sapiens OX=9606 GN=ASXL1 PE=1 SV=4	259	LVNTNLRALINS
LENTNLRPLINH	sp|F5HEF2|CEP2_HHV8P	58	tr|Q76L82|Q76L82_HUMAN Additional sex combs like 1 (Drosophila), isoform CRA_d OS=Homo sapiens OX=9606 GN=ASXL1 PE=1 SV=1	254	LVNTNLRALINS
LENTNLRPLINH	sp|F5HEF2|CEP2_HHV8P	58	tr|A0A2R8Y5U1|A0A2R8Y5U1_HUMAN Polycomb group protein ASXL1 OS=Homo sapiens OX=9606 GN=ASXL1 PE=1 SV=1	198	LVNTNLRALINS
ITIRDDSDLSPA	sp|Q2HR64|LTP_HHV8P	1597	tr|C9JUE0|C9JUE0_HUMAN Protein TFG (Fragment) OS=Homo sapiens OX=9606 GN=TFG PE=1 SV=1	66	ITIFDSSDLSFA
ITIRDDSDLSPA	sp|Q2HR64|LTP_HHV8P	1597	tr|C9JJP5|C9JJP5_HUMAN Protein TFG (Fragment) OS=Homo sapiens OX=9606 GN=TFG PE=1 SV=1	66	ITIFDSSDLSFA
ITIRDDSDLSPA	sp|Q2HR64|LTP_HHV8P	1597	tr|A0A6Q8PH27|A0A6Q8PH27_HUMAN Protein TFG OS=Homo sapiens OX=9606 GN=TFG PE=1 SV=1	66	ITIFDSSDLSFA
ITIRDDSDLSPA	sp|Q2HR64|LTP_HHV8P	1597	tr|A0A6Q8PFY7|A0A6Q8PFY7_HUMAN Protein TFG OS=Homo sapiens OX=9606 GN=TFG PE=1 SV=1	66	ITIFDSSDLSFA
ITIRDDSDLSPA	sp|Q2HR64|LTP_HHV8P	1597	tr|A0A6Q8PG00|A0A6Q8PG00_HUMAN Protein TFG OS=Homo sapiens OX=9606 GN=TFG PE=1 SV=1	66	ITIFDSSDLSFA
ITIRDDSDLSPA	sp|Q2HR64|LTP_HHV8P	1597	tr|A0A6Q8PFC4|A0A6Q8PFC4_HUMAN Protein TFG OS=Homo sapiens OX=9606 GN=TFG PE=1 SV=1	66	ITIFDSSDLSFA
ITIRDDSDLSPA	sp|Q2HR64|LTP_HHV8P	1597	tr|A0A6Q8PF40|A0A6Q8PF40_HUMAN Protein TFG OS=Homo sapiens OX=9606 GN=TFG PE=1 SV=1	66	ITIFDSSDLSFA
ITIRDDSDLSPA	sp|Q2HR64|LTP_HHV8P	1597	sp|Q92734|TFG_HUMAN Protein TFG OS=Homo sapiens OX=9606 GN=TFG PE=1 SV=2	66	ITIFDSSDLSFA
ITIRDDSDLSPA	sp|Q2HR64|LTP_HHV8P	1597	tr|A0A6Q8PG04|A0A6Q8PG04_HUMAN Protein TFG OS=Homo sapiens OX=9606 GN=TFG PE=1 SV=1	66	ITIFDSSDLSFA
ITIRDDSDLSPA	sp|Q2HR64|LTP_HHV8P	1597	tr|A0A6Q8PH89|A0A6Q8PH89_HUMAN Protein TFG OS=Homo sapiens OX=9606 GN=TFG PE=1 SV=1	66	ITIFDSSDLSFA
ITIRDDSDLSPA	sp|Q2HR64|LTP_HHV8P	1597	tr|A0A6Q8PGS4|A0A6Q8PGS4_HUMAN Protein TFG OS=Homo sapiens OX=9606 GN=TFG PE=1 SV=1	66	ITIFDSSDLSFA
ITIRDDSDLSPA	sp|Q2HR64|LTP_HHV8P	1597	tr|A0A6Q8PF51|A0A6Q8PF51_HUMAN Protein TFG OS=Homo sapiens OX=9606 GN=TFG PE=1 SV=1	66	ITIFDSSDLSFA
ITIRDDSDLSPA	sp|Q2HR64|LTP_HHV8P	1597	tr|C9JTY3|C9JTY3_HUMAN Protein TFG OS=Homo sapiens OX=9606 GN=TFG PE=1 SV=2	66	ITIFDSSDLSFA
FDKTADEKVLRV	sp|Q2HRD0|DPOL_HHV8P	957	sp|Q6IA86|ELP2_HUMAN Elongator complex protein 2 OS=Homo sapiens OX=9606 GN=ELP2 PE=1 SV=2	452	FVSGADEKVLRV
ATLPAEQLLLSS	sp|Q77Q36|VCYCL_HHV8P	183	sp|Q8NEP3|DAAF1_HUMAN Dynein assembly factor 1, axonemal OS=Homo sapiens OX=9606 GN=DNAAF1 PE=2 SV=5	466	GTLPAETLLLSP
ATLPAEQLLLSS	sp|Q77Q36|VCYCL_HHV8P	183	sp|Q8NEP3|DAAF1_HUMAN Dynein assembly factor 1, axonemal OS=Homo sapiens OX=9606 GN=DNAAF1 PE=2 SV=5	414	GTLPAETLLLSS
EATSTPGPSSGV	sp|Q2HR73|VIRF4_HHV8P	419	sp|Q7Z5P9|MUC19_HUMAN Mucin-19 OS=Homo sapiens OX=9606 GN=MUC19 PE=1 SV=3	4908	EATETTGPSAGV
EATSTPGPSSGV	sp|Q2HR73|VIRF4_HHV8P	419	sp|Q7Z5P9|MUC19_HUMAN Mucin-19 OS=Homo sapiens OX=9606 GN=MUC19 PE=1 SV=3	4658	EATGTTGPSAGV
EATSTPGPSSGV	sp|Q2HR73|VIRF4_HHV8P	419	sp|Q7Z5P9|MUC19_HUMAN Mucin-19 OS=Homo sapiens OX=9606 GN=MUC19 PE=1 SV=3	5258	EATGTTGPSAGV
RTVNVQQLSPLA	sp|F5HIN0|PRIM_HHV8P	134	tr|J3KTH2|J3KTH2_HUMAN HCG38478, isoform CRA_a OS=Homo sapiens OX=9606 GN=TAF4B PE=1 SV=1	389	RTVSVQTLNPLA
RTVNVQQLSPLA	sp|F5HIN0|PRIM_HHV8P	134	sp|Q92750|TAF4B_HUMAN Transcription initiation factor TFIID subunit 4B OS=Homo sapiens OX=9606 GN=TAF4B PE=1 SV=2	389	RTVSVQTLNPLA
PAPATRAPPRPG	sp|Q2HRC9|ORF10_HHV8P	319	tr|E9PL31|E9PL31_HUMAN Proline-rich protein 18 (Fragment) OS=Homo sapiens OX=9606 GN=PRR18 PE=1 SV=8	85	RAPATCAPPRPA
PAPATRAPPRPG	sp|Q2HRC9|ORF10_HHV8P	319	sp|Q8N4B5|PRR18_HUMAN Proline-rich protein 18 OS=Homo sapiens OX=9606 GN=PRR18 PE=2 SV=2	85	RAPATCAPPRPA
DGAVKRQKTSRS	sp|F5HCJ2|VCCL3_HHV8P	95	sp|Q7RTP6|MICA3_HUMAN [F-actin]-monooxygenase MICAL3 OS=Homo sapiens OX=9606 GN=MICAL3 PE=1 SV=2	676	DGAGKRRKTSQS
DGAVKRQKTSRS	sp|F5HCJ2|VCCL3_HHV8P	95	tr|A0A5F9ZHV5|A0A5F9ZHV5_HUMAN F-actin monooxygenase OS=Homo sapiens OX=9606 GN=MICAL3 PE=1 SV=1	676	DGAGKRRKTSQS
DGAVKRQKTSRS	sp|F5HCJ2|VCCL3_HHV8P	95	tr|J3KSK6|J3KSK6_HUMAN [F-actin]-monooxygenase MICAL3 (Fragment) OS=Homo sapiens OX=9606 GN=MICAL3 PE=1 SV=1	195	DGAGKRRKTSQS
DRNFDDTTFTLL	sp|F5HEU7|ITP_HHV8P	634	sp|Q8NGL1|OR5DI_HUMAN Olfactory receptor 5D18 OS=Homo sapiens OX=9606 GN=OR5D18 PE=2 SV=1	5	DRNTSGTTFTLL
ALASLLIAITGT	sp|F5HCV3|ORF50_HHV8P	670	tr|H3BPX1|H3BPX1_HUMAN Cytochrome b(558) alpha chain (Fragment) OS=Homo sapiens OX=9606 GN=CYBA PE=1 SV=1	14	ALASGLILITGG
ALASLLIAITGT	sp|F5HCV3|ORF50_HHV8P	670	sp|P13498|CY24A_HUMAN Cytochrome b-245 light chain OS=Homo sapiens OX=9606 GN=CYBA PE=1 SV=3	14	ALASGLILITGG
ALASLLIAITGT	sp|F5HCV3|ORF50_HHV8P	670	tr|H3BNP7|H3BNP7_HUMAN Cytochrome b(558) alpha chain OS=Homo sapiens OX=9606 GN=CYBA PE=1 SV=1	14	ALASGLILITGG
ALASLLIAITGT	sp|F5HCV3|ORF50_HHV8P	670	tr|H3BR52|H3BR52_HUMAN Cytochrome b(558) alpha chain OS=Homo sapiens OX=9606 GN=CYBA PE=1 SV=1	14	ALASGLILITGG
VANLGSRRPPRS	sp|Q2HR73|VIRF4_HHV8P	705	sp|Q9NZU7|CABP1_HUMAN Calcium-binding protein 1 OS=Homo sapiens OX=9606 GN=CABP1 PE=1 SV=5	21	VLGLGSRREPRS
LNRLDLASYAAS	sp|Q2HR89|HELI_HHV8P	222	tr|E7EVX2|E7EVX2_HUMAN Golgin subfamily A member 4 (Fragment) OS=Homo sapiens OX=9606 GN=GOLGA4 PE=1 SV=1	124	LNRLDLDSSTAS
LNRLDLASYAAS	sp|Q2HR89|HELI_HHV8P	222	sp|Q13439|GOGA4_HUMAN Golgin subfamily A member 4 OS=Homo sapiens OX=9606 GN=GOLGA4 PE=1 SV=1	102	LNRLDLDSSTAS
LNRLDLASYAAS	sp|Q2HR89|HELI_HHV8P	222	tr|Q86W71|Q86W71_HUMAN GOLGA4 protein OS=Homo sapiens OX=9606 GN=GOLGA4 PE=1 SV=1	102	LNRLDLDSSTAS
LVLLPVRSEDCG	sp|Q2HR85|ORF48_HHV8P	56	tr|Q5FBX5|Q5FBX5_HUMAN Interleukin-7 OS=Homo sapiens OX=9606 GN=IL7 PE=1 SV=1	17	LVLLPVASSDCD
LVLLPVRSEDCG	sp|Q2HR85|ORF48_HHV8P	56	tr|A0A0A0MTG5|A0A0A0MTG5_HUMAN Interleukin-7 OS=Homo sapiens OX=9606 GN=IL7 PE=1 SV=1	17	LVLLPVASSDCD
