query	query_seqname	query_start	target_seqname	target_start	target
LIITNNGLEELG	tr|A8WA74|A8WA74_BUNSH	171	sp|P09661|RU2A_HUMAN U2 small nuclear ribonucleoprotein A' OS=Homo sapiens OX=9606 GN=SNRPA1 PE=1 SV=2	93	LILTNNSLVELG
LIITNNGLEELG	tr|A8WA74|A8WA74_BUNSH	171	tr|H0YKK0|H0YKK0_HUMAN Small nuclear ribonucleoprotein polypeptide A', isoform CRA_a OS=Homo sapiens OX=9606 GN=SNRPA1 PE=1 SV=1	93	LILTNNSLVELG
IGSVPGKVVVGN	tr|A9LXW2|A9LXW2_BUNSH	654	sp|Q9Y6J8|STYL1_HUMAN Serine/threonine/tyrosine-interacting-like protein 1 OS=Homo sapiens OX=9606 GN=STYXL1 PE=1 SV=1	161	IEIVPGKVFVGN
IGSVPGKVVVGN	tr|A9LXW2|A9LXW2_BUNSH	654	tr|C9J4H0|C9J4H0_HUMAN Serine/threonine/tyrosine-interacting-like protein 1 OS=Homo sapiens OX=9606 GN=STYXL1 PE=1 SV=1	161	IEIVPGKVFVGN
IGSVPGKVVVGN	tr|A9LXW2|A9LXW2_BUNSH	654	tr|A0A0C4DG63|A0A0C4DG63_HUMAN Serine/threonine/tyrosine-interacting-like protein 1 (Fragment) OS=Homo sapiens OX=9606 GN=STYXL1 PE=1 SV=1	116	IEIVPGKVFVGN
LTPKKGKMIIGS	tr|A9LXW2|A9LXW2_BUNSH	645	sp|Q8TD84|DSCL1_HUMAN Down syndrome cell adhesion molecule-like protein 1 OS=Homo sapiens OX=9606 GN=DSCAML1 PE=1 SV=2	319	LTPKKLKTGIGS
LTPKKGKMIIGS	tr|A9LXW2|A9LXW2_BUNSH	645	tr|A0A384DVL8|A0A384DVL8_HUMAN Down syndrome cell adhesion molecule like 1, isoform CRA_b OS=Homo sapiens OX=9606 GN=DSCAML1 PE=1 SV=1	379	LTPKKLKTGIGS
SDEDDSQSELSC	tr|A8WA74|A8WA74_BUNSH	1271	sp|P54792|DVLP1_HUMAN Putative segment polarity protein dishevelled homolog DVL1P1 OS=Homo sapiens OX=9606 GN=DVL1P1 PE=5 SV=1	194	SDEDDSTSRLSS
DVKDSEPIGKAT	tr|A8WA74|A8WA74_BUNSH	1968	sp|Q8WUM4|PDC6I_HUMAN Programmed cell death 6-interacting protein OS=Homo sapiens OX=9606 GN=PDCD6IP PE=1 SV=1	325	DLKDLDPIGKAT
VLTVMSLAYFYD	tr|A8WA74|A8WA74_BUNSH	1370	tr|E5RJY4|E5RJY4_HUMAN Tyrosine-protein kinase ITK/TSK OS=Homo sapiens OX=9606 GN=ITK PE=1 SV=1	32	VLTKASLAYFED
VLTVMSLAYFYD	tr|A8WA74|A8WA74_BUNSH	1370	sp|Q08881|ITK_HUMAN Tyrosine-protein kinase ITK/TSK OS=Homo sapiens OX=9606 GN=ITK PE=1 SV=1	32	VLTKASLAYFED
VPIGRNGILTIG	tr|A9LXW2|A9LXW2_BUNSH	82	tr|A0A0A0MSU2|A0A0A0MSU2_HUMAN Mitotic deacetylase-associated SANT domain protein (Fragment) OS=Homo sapiens OX=9606 GN=MIDEAS PE=1 SV=6	878	VKIGRNGTLTFG
VPIGRNGILTIG	tr|A9LXW2|A9LXW2_BUNSH	82	sp|Q6PJG2|MDEAS_HUMAN Mitotic deacetylase-associated SANT domain protein OS=Homo sapiens OX=9606 GN=MIDEAS PE=1 SV=2	878	VKIGRNGTLTFG
VPIGRNGILTIG	tr|A9LXW2|A9LXW2_BUNSH	82	tr|A0A1C7CYX1|A0A1C7CYX1_HUMAN Mitotic deacetylase-associated SANT domain protein OS=Homo sapiens OX=9606 GN=MIDEAS PE=1 SV=1	878	VKIGRNGTLTFG
KNHKLEGEEILS	tr|A8WA74|A8WA74_BUNSH	342	tr|E9PHA2|E9PHA2_HUMAN Condensin complex subunit 2 OS=Homo sapiens OX=9606 GN=NCAPH PE=1 SV=1	711	KNLKLEGTEDLS
KNHKLEGEEILS	tr|A8WA74|A8WA74_BUNSH	342	sp|Q15003|CND2_HUMAN Condensin complex subunit 2 OS=Homo sapiens OX=9606 GN=NCAPH PE=1 SV=3	722	KNLKLEGTEDLS
KNHKLEGEEILS	tr|A8WA74|A8WA74_BUNSH	342	tr|H7C415|H7C415_HUMAN Condensin complex subunit 2 (Fragment) OS=Homo sapiens OX=9606 GN=NCAPH PE=1 SV=1	163	KNLKLEGTEDLS
LEKQESKFKYSK	tr|A8WA74|A8WA74_BUNSH	370	tr|A0A6Q8PGP6|A0A6Q8PGP6_HUMAN Centrosomal protein of 290 kDa OS=Homo sapiens OX=9606 GN=CEP290 PE=1 SV=1	2032	LEKQFSKDTYSK
LEKQESKFKYSK	tr|A8WA74|A8WA74_BUNSH	370	tr|A0A6Q8PG44|A0A6Q8PG44_HUMAN Centrosomal protein of 290 kDa OS=Homo sapiens OX=9606 GN=CEP290 PE=1 SV=1	2032	LEKQFSKDTYSK
LEKQESKFKYSK	tr|A8WA74|A8WA74_BUNSH	370	sp|O15078|CE290_HUMAN Centrosomal protein of 290 kDa OS=Homo sapiens OX=9606 GN=CEP290 PE=1 SV=2	2032	LEKQFSKDTYSK
LEKQESKFKYSK	tr|A8WA74|A8WA74_BUNSH	370	tr|A0A6Q8PGB1|A0A6Q8PGB1_HUMAN Centrosomal protein of 290 kDa OS=Homo sapiens OX=9606 GN=CEP290 PE=1 SV=1	2319	LEKQFSKDTYSK
LEKQESKFKYSK	tr|A8WA74|A8WA74_BUNSH	370	tr|A0A6Q8PH78|A0A6Q8PH78_HUMAN Centrosomal protein of 290 kDa OS=Homo sapiens OX=9606 GN=CEP290 PE=1 SV=1	2288	LEKQFSKDTYSK
LEKQESKFKYSK	tr|A8WA74|A8WA74_BUNSH	370	tr|A0A6Q8PH24|A0A6Q8PH24_HUMAN Centrosomal protein of 290 kDa OS=Homo sapiens OX=9606 GN=CEP290 PE=1 SV=1	2025	LEKQFSKDTYSK
LEKQESKFKYSK	tr|A8WA74|A8WA74_BUNSH	370	tr|A0A6Q8PGC3|A0A6Q8PGC3_HUMAN Centrosomal protein of 290 kDa OS=Homo sapiens OX=9606 GN=CEP290 PE=1 SV=1	2032	LEKQFSKDTYSK
LEKQESKFKYSK	tr|A8WA74|A8WA74_BUNSH	370	tr|A0A5K1VW81|A0A5K1VW81_HUMAN Centrosomal protein of 290 kDa (Fragment) OS=Homo sapiens OX=9606 GN=CEP290 PE=1 SV=2	1127	LEKQFSKDTYSK
LEKQESKFKYSK	tr|A8WA74|A8WA74_BUNSH	370	tr|A0A5F9ZHU6|A0A5F9ZHU6_HUMAN Centrosomal protein of 290 kDa OS=Homo sapiens OX=9606 GN=CEP290 PE=1 SV=2	2032	LEKQFSKDTYSK
LEKQESKFKYSK	tr|A8WA74|A8WA74_BUNSH	370	tr|J3KNF5|J3KNF5_HUMAN Centrosomal protein of 290 kDa OS=Homo sapiens OX=9606 GN=CEP290 PE=1 SV=2	2032	LEKQFSKDTYSK
LIPGAAQVLQAG	tr|A8WA74|A8WA74_BUNSH	2055	tr|A0A1B0GTB6|A0A1B0GTB6_HUMAN Aminomethyltransferase (Fragment) OS=Homo sapiens OX=9606 GN=AMT PE=1 SV=1	120	QGPTAAQVLQAG
LIPGAAQVLQAG	tr|A8WA74|A8WA74_BUNSH	2055	tr|A0A1B0GTA8|A0A1B0GTA8_HUMAN Aminomethyltransferase, mitochondrial OS=Homo sapiens OX=9606 GN=AMT PE=1 SV=1	156	QGPTAAQVLQAG
LIPGAAQVLQAG	tr|A8WA74|A8WA74_BUNSH	2055	tr|H0Y695|H0Y695_HUMAN Aminomethyltransferase OS=Homo sapiens OX=9606 GN=AMT PE=1 SV=2	135	QGPTAAQVLQAG
LIPGAAQVLQAG	tr|A8WA74|A8WA74_BUNSH	2055	tr|B3KTU4|B3KTU4_HUMAN Aminomethyltransferase OS=Homo sapiens OX=9606 GN=AMT PE=1 SV=1	135	QGPTAAQVLQAG
LIPGAAQVLQAG	tr|A8WA74|A8WA74_BUNSH	2055	sp|P48728|GCST_HUMAN Aminomethyltransferase, mitochondrial OS=Homo sapiens OX=9606 GN=AMT PE=1 SV=1	183	QGPTAAQVLQAG
LIPGAAQVLQAG	tr|A8WA74|A8WA74_BUNSH	2055	tr|A0A1B0GUH1|A0A1B0GUH1_HUMAN Aminomethyltransferase OS=Homo sapiens OX=9606 PE=3 SV=1	262	QGPTAAQVLQAG
LIPGAAQVLQAG	tr|A8WA74|A8WA74_BUNSH	2055	tr|A0A1B0GTM2|A0A1B0GTM2_HUMAN Aminomethyltransferase OS=Homo sapiens OX=9606 GN=AMT PE=1 SV=1	156	QGPTAAQVLQAG
LIPGAAQVLQAG	tr|A8WA74|A8WA74_BUNSH	2055	tr|A0A1B0GTV8|A0A1B0GTV8_HUMAN Aminomethyltransferase OS=Homo sapiens OX=9606 GN=AMT PE=1 SV=1	183	QGPTAAQVLQAG
FVKQKYSTTKSI	tr|A8WA74|A8WA74_BUNSH	715	sp|Q6UWN0|LYPD4_HUMAN Ly6/PLAUR domain-containing protein 4 OS=Homo sapiens OX=9606 GN=LYPD4 PE=2 SV=2	124	FVKLKASTPKSI
YSDEDDSQSELS	tr|A8WA74|A8WA74_BUNSH	1270	sp|P54792|DVLP1_HUMAN Putative segment polarity protein dishevelled homolog DVL1P1 OS=Homo sapiens OX=9606 GN=DVL1P1 PE=5 SV=1	193	DSDEDDSTSRLS
NMQVPQDQQSLR	tr|A9YU76|A9YU76_BUNSH	53	tr|A6NCG2|A6NCG2_HUMAN Solute carrier family 22 member 11 OS=Homo sapiens OX=9606 GN=SLC22A11 PE=1 SV=1	419	NMLVPQDLQTLR
NMQVPQDQQSLR	tr|A9YU76|A9YU76_BUNSH	53	tr|H7C3R9|H7C3R9_HUMAN Solute carrier family 22 member 11 (Fragment) OS=Homo sapiens OX=9606 GN=SLC22A11 PE=1 SV=1	66	NMLVPQDLQTLR
NMQVPQDQQSLR	tr|A9YU76|A9YU76_BUNSH	53	sp|Q9NSA0|S22AB_HUMAN Solute carrier family 22 member 11 OS=Homo sapiens OX=9606 GN=SLC22A11 PE=1 SV=1	419	NMLVPQDLQTLR
KNGKGLTPKKGK	tr|A9LXW2|A9LXW2_BUNSH	640	tr|B1AMS9|B1AMS9_HUMAN Cohesin subunit SA-2 (Fragment) OS=Homo sapiens OX=9606 GN=STAG2 PE=1 SV=1	36	KQGKGKTCKKGK
KNGKGLTPKKGK	tr|A9LXW2|A9LXW2_BUNSH	640	tr|B1AMT0|B1AMT0_HUMAN Cohesin subunit SA-2 (Fragment) OS=Homo sapiens OX=9606 GN=STAG2 PE=1 SV=1	36	KQGKGKTCKKGK
KNGKGLTPKKGK	tr|A9LXW2|A9LXW2_BUNSH	640	tr|B1AMT1|B1AMT1_HUMAN Cohesin subunit SA-2 (Fragment) OS=Homo sapiens OX=9606 GN=STAG2 PE=1 SV=1	36	KQGKGKTCKKGK
KNGKGLTPKKGK	tr|A9LXW2|A9LXW2_BUNSH	640	tr|B1AMT2|B1AMT2_HUMAN Cohesin subunit SA-2 (Fragment) OS=Homo sapiens OX=9606 GN=STAG2 PE=1 SV=1	36	KQGKGKTCKKGK
KNGKGLTPKKGK	tr|A9LXW2|A9LXW2_BUNSH	640	tr|B1AMT3|B1AMT3_HUMAN Cohesin subunit SA-2 (Fragment) OS=Homo sapiens OX=9606 GN=STAG2 PE=1 SV=8	36	KQGKGKTCKKGK
KNGKGLTPKKGK	tr|A9LXW2|A9LXW2_BUNSH	640	tr|B1AMT4|B1AMT4_HUMAN Cohesin subunit SA-2 (Fragment) OS=Homo sapiens OX=9606 GN=STAG2 PE=1 SV=1	36	KQGKGKTCKKGK
KNGKGLTPKKGK	tr|A9LXW2|A9LXW2_BUNSH	640	sp|Q8N3U4|STAG2_HUMAN Cohesin subunit SA-2 OS=Homo sapiens OX=9606 GN=STAG2 PE=1 SV=3	36	KQGKGKTCKKGK
ILTTINAVPIGR	tr|A9LXW2|A9LXW2_BUNSH	75	tr|F8VU56|F8VU56_HUMAN Protein-tyrosine-phosphatase OS=Homo sapiens OX=9606 GN=PTPRB PE=1 SV=1	170	ILTTFNAVPDGL
ILTTINAVPIGR	tr|A9LXW2|A9LXW2_BUNSH	75	tr|F8VSD5|F8VSD5_HUMAN Receptor-type tyrosine-protein phosphatase beta OS=Homo sapiens OX=9606 GN=PTPRB PE=1 SV=1	169	ILTTFNAVPDGL
SLRVEIGDLVLC	tr|A9LXW2|A9LXW2_BUNSH	1359	sp|P54886|P5CS_HUMAN Delta-1-pyrroline-5-carboxylate synthase OS=Homo sapiens OX=9606 GN=ALDH18A1 PE=1 SV=2	663	SLRTEYGDLELC
GDTKSSDAEESV	tr|A9LXW2|A9LXW2_BUNSH	401	tr|C9J668|C9J668_HUMAN CLIP-associating protein 2 (Fragment) OS=Homo sapiens OX=9606 GN=CLASP2 PE=1 SV=2	4	GDDKSFDDEESV
GDTKSSDAEESV	tr|A9LXW2|A9LXW2_BUNSH	401	sp|O75122|CLAP2_HUMAN CLIP-associating protein 2 OS=Homo sapiens OX=9606 GN=CLASP2 PE=1 SV=3	4	GDDKSFDDEESV
GDTKSSDAEESV	tr|A9LXW2|A9LXW2_BUNSH	401	tr|J3KR49|J3KR49_HUMAN CLIP-associating protein 2 OS=Homo sapiens OX=9606 GN=CLASP2 PE=1 SV=1	4	GDDKSFDDEESV
GDTKSSDAEESV	tr|A9LXW2|A9LXW2_BUNSH	401	tr|E3W994|E3W994_HUMAN CLIP-associating protein 2 OS=Homo sapiens OX=9606 GN=CLASP2 PE=1 SV=2	4	GDDKSFDDEESV
AAQWLYESKNHK	tr|A8WA74|A8WA74_BUNSH	334	tr|D6RBT2|D6RBT2_HUMAN Protein FAM47E (Fragment) OS=Homo sapiens OX=9606 GN=FAM47E PE=3 SV=1	106	AGQWLYEEKPHK
AAQWLYESKNHK	tr|A8WA74|A8WA74_BUNSH	334	sp|Q6ZV65|FA47E_HUMAN Protein FAM47E OS=Homo sapiens OX=9606 GN=FAM47E PE=2 SV=3	196	AGQWLYEEKPHK
AAQWLYESKNHK	tr|A8WA74|A8WA74_BUNSH	334	tr|A0A1B0GUL4|A0A1B0GUL4_HUMAN Protein FAM47E OS=Homo sapiens OX=9606 GN=FAM47E PE=3 SV=1	28	AGQWLYEEKPHK
AAQWLYESKNHK	tr|A8WA74|A8WA74_BUNSH	334	tr|D6RA91|D6RA91_HUMAN FAM47E-STBD1 readthrough (Fragment) OS=Homo sapiens OX=9606 GN=FAM47E-STBD1 PE=3 SV=2	20	AGQWLYEEKPHK
AAQWLYESKNHK	tr|A8WA74|A8WA74_BUNSH	334	tr|A0A1B0GTQ8|A0A1B0GTQ8_HUMAN Protein FAM47E OS=Homo sapiens OX=9606 GN=FAM47E PE=3 SV=1	28	AGQWLYEEKPHK
AAQWLYESKNHK	tr|A8WA74|A8WA74_BUNSH	334	tr|U3KQR7|U3KQR7_HUMAN Protein FAM47E (Fragment) OS=Homo sapiens OX=9606 GN=FAM47E PE=3 SV=1	80	AGQWLYEEKPHK
TILTTINAVPIG	tr|A9LXW2|A9LXW2_BUNSH	74	tr|F8VU56|F8VU56_HUMAN Protein-tyrosine-phosphatase OS=Homo sapiens OX=9606 GN=PTPRB PE=1 SV=1	169	QILTTFNAVPDG
TILTTINAVPIG	tr|A9LXW2|A9LXW2_BUNSH	74	tr|F8VSD5|F8VSD5_HUMAN Receptor-type tyrosine-protein phosphatase beta OS=Homo sapiens OX=9606 GN=PTPRB PE=1 SV=1	168	QILTTFNAVPDG
DDSSKTFLVTIN	tr|A9LXW2|A9LXW2_BUNSH	294	tr|H0Y405|H0Y405_HUMAN Alpha-2,8-sialyltransferase 8F (Fragment) OS=Homo sapiens OX=9606 GN=ST8SIA6 PE=1 SV=1	46	DVGSKTNLVTIN
DDSSKTFLVTIN	tr|A9LXW2|A9LXW2_BUNSH	294	sp|P61647|SIA8F_HUMAN Alpha-2,8-sialyltransferase 8F OS=Homo sapiens OX=9606 GN=ST8SIA6 PE=2 SV=1	225	DVGSKTNLVTIN
PGAAQVLQAGKT	tr|A8WA74|A8WA74_BUNSH	2057	tr|A0A1B0GTB6|A0A1B0GTB6_HUMAN Aminomethyltransferase (Fragment) OS=Homo sapiens OX=9606 GN=AMT PE=1 SV=1	122	PTAAQVLQAGVA
PGAAQVLQAGKT	tr|A8WA74|A8WA74_BUNSH	2057	tr|A0A1B0GTA8|A0A1B0GTA8_HUMAN Aminomethyltransferase, mitochondrial OS=Homo sapiens OX=9606 GN=AMT PE=1 SV=1	158	PTAAQVLQAGVA
PGAAQVLQAGKT	tr|A8WA74|A8WA74_BUNSH	2057	tr|H0Y695|H0Y695_HUMAN Aminomethyltransferase OS=Homo sapiens OX=9606 GN=AMT PE=1 SV=2	137	PTAAQVLQAGVA
PGAAQVLQAGKT	tr|A8WA74|A8WA74_BUNSH	2057	tr|B3KTU4|B3KTU4_HUMAN Aminomethyltransferase OS=Homo sapiens OX=9606 GN=AMT PE=1 SV=1	137	PTAAQVLQAGVA
PGAAQVLQAGKT	tr|A8WA74|A8WA74_BUNSH	2057	sp|P48728|GCST_HUMAN Aminomethyltransferase, mitochondrial OS=Homo sapiens OX=9606 GN=AMT PE=1 SV=1	185	PTAAQVLQAGVA
PGAAQVLQAGKT	tr|A8WA74|A8WA74_BUNSH	2057	tr|A0A1B0GUH1|A0A1B0GUH1_HUMAN Aminomethyltransferase OS=Homo sapiens OX=9606 PE=3 SV=1	264	PTAAQVLQAGVA
PGAAQVLQAGKT	tr|A8WA74|A8WA74_BUNSH	2057	tr|A0A1B0GTM2|A0A1B0GTM2_HUMAN Aminomethyltransferase OS=Homo sapiens OX=9606 GN=AMT PE=1 SV=1	158	PTAAQVLQAGVA
PGAAQVLQAGKT	tr|A8WA74|A8WA74_BUNSH	2057	tr|A0A1B0GTV8|A0A1B0GTV8_HUMAN Aminomethyltransferase OS=Homo sapiens OX=9606 GN=AMT PE=1 SV=1	185	PTAAQVLQAGVA
LLQKAIVICPKV	tr|A9LXW2|A9LXW2_BUNSH	594	sp|Q13009|TIAM1_HUMAN T-lymphoma invasion and metastasis-inducing protein 1 OS=Homo sapiens OX=9606 GN=TIAM1 PE=1 SV=2	831	LLYKEIEICPKV
SKDVSIPLKIAK	tr|A9LXW2|A9LXW2_BUNSH	1297	sp|Q96PQ0|SORC2_HUMAN VPS10 domain-containing receptor SorCS2 OS=Homo sapiens OX=9606 GN=SORCS2 PE=1 SV=3	576	IKDTSIPLKILK
SKDVSIPLKIAK	tr|A9LXW2|A9LXW2_BUNSH	1297	tr|B5MED8|B5MED8_HUMAN VPS10 domain-containing receptor SorCS2 OS=Homo sapiens OX=9606 GN=SORCS2 PE=1 SV=4	404	IKDTSIPLKILK
DVSIPLKIAKFD	tr|A9LXW2|A9LXW2_BUNSH	1299	sp|Q96PQ0|SORC2_HUMAN VPS10 domain-containing receptor SorCS2 OS=Homo sapiens OX=9606 GN=SORCS2 PE=1 SV=3	578	DTSIPLKILKFS
DVSIPLKIAKFD	tr|A9LXW2|A9LXW2_BUNSH	1299	tr|B5MED8|B5MED8_HUMAN VPS10 domain-containing receptor SorCS2 OS=Homo sapiens OX=9606 GN=SORCS2 PE=1 SV=4	406	DTSIPLKILKFS
LLIPGAAQVLQA	tr|A8WA74|A8WA74_BUNSH	2054	tr|A0A1B0GTB6|A0A1B0GTB6_HUMAN Aminomethyltransferase (Fragment) OS=Homo sapiens OX=9606 GN=AMT PE=1 SV=1	119	LQGPTAAQVLQA
LLIPGAAQVLQA	tr|A8WA74|A8WA74_BUNSH	2054	tr|A0A1B0GTA8|A0A1B0GTA8_HUMAN Aminomethyltransferase, mitochondrial OS=Homo sapiens OX=9606 GN=AMT PE=1 SV=1	155	LQGPTAAQVLQA
LLIPGAAQVLQA	tr|A8WA74|A8WA74_BUNSH	2054	tr|H0Y695|H0Y695_HUMAN Aminomethyltransferase OS=Homo sapiens OX=9606 GN=AMT PE=1 SV=2	134	LQGPTAAQVLQA
LLIPGAAQVLQA	tr|A8WA74|A8WA74_BUNSH	2054	tr|B3KTU4|B3KTU4_HUMAN Aminomethyltransferase OS=Homo sapiens OX=9606 GN=AMT PE=1 SV=1	134	LQGPTAAQVLQA
LLIPGAAQVLQA	tr|A8WA74|A8WA74_BUNSH	2054	sp|P48728|GCST_HUMAN Aminomethyltransferase, mitochondrial OS=Homo sapiens OX=9606 GN=AMT PE=1 SV=1	182	LQGPTAAQVLQA
LLIPGAAQVLQA	tr|A8WA74|A8WA74_BUNSH	2054	tr|A0A1B0GUH1|A0A1B0GUH1_HUMAN Aminomethyltransferase OS=Homo sapiens OX=9606 PE=3 SV=1	261	LQGPTAAQVLQA
LLIPGAAQVLQA	tr|A8WA74|A8WA74_BUNSH	2054	tr|A0A1B0GTM2|A0A1B0GTM2_HUMAN Aminomethyltransferase OS=Homo sapiens OX=9606 GN=AMT PE=1 SV=1	155	LQGPTAAQVLQA
LLIPGAAQVLQA	tr|A8WA74|A8WA74_BUNSH	2054	tr|A0A1B0GTV8|A0A1B0GTV8_HUMAN Aminomethyltransferase OS=Homo sapiens OX=9606 GN=AMT PE=1 SV=1	182	LQGPTAAQVLQA
EGSLNCSYSDED	tr|A8WA74|A8WA74_BUNSH	1263	sp|Q9P0X4|CAC1I_HUMAN Voltage-dependent T-type calcium channel subunit alpha-1I OS=Homo sapiens OX=9606 GN=CACNA1I PE=1 SV=1	868	EGDANRSYSDED
IDLVRSEHSMTV	tr|A9LXW2|A9LXW2_BUNSH	481	sp|Q14517|FAT1_HUMAN Protocadherin Fat 1 OS=Homo sapiens OX=9606 GN=FAT1 PE=1 SV=2	2722	IDLIRAEHSGTV
IDLVRSEHSMTV	tr|A9LXW2|A9LXW2_BUNSH	481	tr|A0A087WVP1|A0A087WVP1_HUMAN Protocadherin Fat 1 OS=Homo sapiens OX=9606 GN=FAT1 PE=1 SV=1	2724	IDLIRAEHSGTV
KDVSIPLKIAKF	tr|A9LXW2|A9LXW2_BUNSH	1298	sp|Q96PQ0|SORC2_HUMAN VPS10 domain-containing receptor SorCS2 OS=Homo sapiens OX=9606 GN=SORCS2 PE=1 SV=3	577	KDTSIPLKILKF
KDVSIPLKIAKF	tr|A9LXW2|A9LXW2_BUNSH	1298	tr|B5MED8|B5MED8_HUMAN VPS10 domain-containing receptor SorCS2 OS=Homo sapiens OX=9606 GN=SORCS2 PE=1 SV=4	405	KDTSIPLKILKF
SSDAEESVRDPK	tr|A9LXW2|A9LXW2_BUNSH	405	tr|A0A096LNL9|A0A096LNL9_HUMAN DNA helicase (Fragment) OS=Homo sapiens OX=9606 GN=ATRX PE=1 SV=1	1087	SSDAEESSEDNK
SSDAEESVRDPK	tr|A9LXW2|A9LXW2_BUNSH	405	sp|P46100|ATRX_HUMAN Transcriptional regulator ATRX OS=Homo sapiens OX=9606 GN=ATRX PE=1 SV=5	1155	SSDAEESSEDNK
SSDAEESVRDPK	tr|A9LXW2|A9LXW2_BUNSH	405	tr|A0A096LP59|A0A096LP59_HUMAN Transcriptional regulator ATRX (Fragment) OS=Homo sapiens OX=9606 GN=ATRX PE=1 SV=1	117	SSDAEESSEDNK
SFALCLSTYLAI	tr|A9LXW2|A9LXW2_BUNSH	1264	sp|Q9NWS8|RMND1_HUMAN Required for meiotic nuclear division protein 1 homolog OS=Homo sapiens OX=9606 GN=RMND1 PE=1 SV=2	306	SNALCLSVKLAI
SFALCLSTYLAI	tr|A9LXW2|A9LXW2_BUNSH	1264	tr|A0A087WXU0|A0A087WXU0_HUMAN Required for meiotic nuclear division protein 1 homolog OS=Homo sapiens OX=9606 GN=RMND1 PE=1 SV=1	136	SNALCLSVKLAI
SFALCLSTYLAI	tr|A9LXW2|A9LXW2_BUNSH	1264	tr|A0A2R8Y4J4|A0A2R8Y4J4_HUMAN Required for meiotic nuclear division protein 1 homolog OS=Homo sapiens OX=9606 GN=RMND1 PE=1 SV=1	306	SNALCLSVKLAI
KNLEDKAAFLHK	tr|A9YU75|A9YU75_BUNSH	32	sp|O60312|AT10A_HUMAN Phospholipid-transporting ATPase VA OS=Homo sapiens OX=9606 GN=ATP10A PE=1 SV=2	985	KNLEDKFLFLAK
DSGLLKAYAEIQ	tr|A8WA74|A8WA74_BUNSH	1317	sp|Q8N1N0|CLC4F_HUMAN C-type lectin domain family 4 member F OS=Homo sapiens OX=9606 GN=CLEC4F PE=2 SV=2	411	DSNLQKASAEIQ
NCSYSDEDDSQS	tr|A8WA74|A8WA74_BUNSH	1267	sp|Q9P0X4|CAC1I_HUMAN Voltage-dependent T-type calcium channel subunit alpha-1I OS=Homo sapiens OX=9606 GN=CACNA1I PE=1 SV=1	872	NRSYSDEDQSSS
IPGAAQVLQAGK	tr|A8WA74|A8WA74_BUNSH	2056	tr|A0A1B0GTB6|A0A1B0GTB6_HUMAN Aminomethyltransferase (Fragment) OS=Homo sapiens OX=9606 GN=AMT PE=1 SV=1	121	GPTAAQVLQAGV
IPGAAQVLQAGK	tr|A8WA74|A8WA74_BUNSH	2056	tr|A0A1B0GTA8|A0A1B0GTA8_HUMAN Aminomethyltransferase, mitochondrial OS=Homo sapiens OX=9606 GN=AMT PE=1 SV=1	157	GPTAAQVLQAGV
IPGAAQVLQAGK	tr|A8WA74|A8WA74_BUNSH	2056	tr|H0Y695|H0Y695_HUMAN Aminomethyltransferase OS=Homo sapiens OX=9606 GN=AMT PE=1 SV=2	136	GPTAAQVLQAGV
IPGAAQVLQAGK	tr|A8WA74|A8WA74_BUNSH	2056	tr|B3KTU4|B3KTU4_HUMAN Aminomethyltransferase OS=Homo sapiens OX=9606 GN=AMT PE=1 SV=1	136	GPTAAQVLQAGV
IPGAAQVLQAGK	tr|A8WA74|A8WA74_BUNSH	2056	sp|P48728|GCST_HUMAN Aminomethyltransferase, mitochondrial OS=Homo sapiens OX=9606 GN=AMT PE=1 SV=1	184	GPTAAQVLQAGV
IPGAAQVLQAGK	tr|A8WA74|A8WA74_BUNSH	2056	tr|A0A1B0GUH1|A0A1B0GUH1_HUMAN Aminomethyltransferase OS=Homo sapiens OX=9606 PE=3 SV=1	263	GPTAAQVLQAGV
IPGAAQVLQAGK	tr|A8WA74|A8WA74_BUNSH	2056	tr|A0A1B0GTM2|A0A1B0GTM2_HUMAN Aminomethyltransferase OS=Homo sapiens OX=9606 GN=AMT PE=1 SV=1	157	GPTAAQVLQAGV
IPGAAQVLQAGK	tr|A8WA74|A8WA74_BUNSH	2056	tr|A0A1B0GTV8|A0A1B0GTV8_HUMAN Aminomethyltransferase OS=Homo sapiens OX=9606 GN=AMT PE=1 SV=1	184	GPTAAQVLQAGV
LRVEIGDLVLCI	tr|A9LXW2|A9LXW2_BUNSH	1360	sp|P54886|P5CS_HUMAN Delta-1-pyrroline-5-carboxylate synthase OS=Homo sapiens OX=9606 GN=ALDH18A1 PE=1 SV=2	664	LRTEYGDLELCI
