query	query_seqname	query_start	target_seqname	target_start	target
STMKISQAMLLE	sp|P0DTD1|R1AB_SARS2	3047	tr|D4PHA4|D4PHA4_HUMAN GC-rich promoter binding protein 1, isoform CRA_c OS=Homo sapiens OX=9606 GN=GPBP1 PE=1 SV=1	169	PTKKISQAPLLE
YKLDPTSSVVMP	sp|P0DTC1|R1A_SARS2	3515	sp|Q9H426|RIMS4_HUMAN Regulating synaptic membrane exocytosis protein 4 OS=Homo sapiens OX=9606 GN=RIMS4 PE=1 SV=3	233	YKLFPTSSMVDP
KTGTTGPKVDKD	sp|P0DTD1|R1AB_SARS2	4660	sp|Q9Y2I2|NTNG1_HUMAN Netrin-G1 OS=Homo sapiens OX=9606 GN=NTNG1 PE=1 SV=3	441	KTGTTGPKCDEC
LEMSSITGEKNL	sp|P0DTC1|R1A_SARS2	6	tr|A0A087WZ65|A0A087WZ65_HUMAN Ankyrin-3 (Fragment) OS=Homo sapiens OX=9606 GN=ANK3 PE=1 SV=1	711	LEMSSITGWQNE
DTVPVNLVAVTP	sp|P0DTC1|R1A_SARS2	48	tr|A0A0A0MSK6|A0A0A0MSK6_HUMAN Rho GTPase-activating protein 5 OS=Homo sapiens OX=9606 GN=ARHGAP5 PE=1 SV=1	875	DTIPVQLVAVTD
DTVPVNLVAVTP	sp|P0DTC1|R1A_SARS2	48	sp|Q13017|RHG05_HUMAN Rho GTPase-activating protein 5 OS=Homo sapiens OX=9606 GN=ARHGAP5 PE=1 SV=2	875	DTIPVQLVAVTD
ELGGCRCGVKPE	sp|P0DTD1|R1AB_SARS2	6660	tr|H0Y398|H0Y398_HUMAN AN1-type zinc finger protein 3 (Fragment) OS=Homo sapiens OX=9606 GN=ZFAND3 PE=1 SV=1	147	ELGSCRCGVSLE
KGTAALLTFFLL	sp|P0DTD1|R1AB_SARS2	549	sp|Q9Y6V0|PCLO_HUMAN Protein piccolo OS=Homo sapiens OX=9606 GN=PCLO PE=1 SV=5	4057	KGTAALSTAFSL
KGTAALLTFFLL	sp|P0DTD1|R1AB_SARS2	549	tr|E9PE96|E9PE96_HUMAN Protein piccolo OS=Homo sapiens OX=9606 GN=PCLO PE=1 SV=1	777	KGTAALSTAFSL
PESNSLKSPLAT	sp|P0DTD1|R1AB_SARS2	5419	sp|Q14149|MORC3_HUMAN MORC family CW-type zinc finger protein 3 OS=Homo sapiens OX=9606 GN=MORC3 PE=1 SV=3	536	PESNSLKRRLST
TAALDGADVDNS	sp|P0DTD1|R1AB_SARS2	5121	sp|Q693B1|KCD11_HUMAN BTB/POZ domain-containing protein KCTD11 OS=Homo sapiens OX=9606 GN=KCTD11 PE=1 SV=1	86	TAALLHADVDVS
TAALDGADVDNS	sp|P0DTD1|R1AB_SARS2	5121	tr|A0A2U3TZI5|A0A2U3TZI5_HUMAN BTB/POZ domain-containing protein KCTD11 OS=Homo sapiens OX=9606 GN=KCTD11 PE=1 SV=1	125	TAALLHADVDVS
SIDLKRGAGRCG	sp|P0DTD1|R1AB_SARS2	1128	tr|B4DNP3|B4DNP3_HUMAN Matrix metalloproteinase-19 OS=Homo sapiens OX=9606 GN=MMP19 PE=1 SV=1	97	SLDLPRGAGWCG
NSKVGTVTHYSV	sp|P0DTC1|R1A_SARS2	745	tr|I3L222|I3L222_HUMAN Phospholipase D2 OS=Homo sapiens OX=9606 GN=PLD2 PE=1 SV=1	78	GSKVGTCTLYSV
NSKVGTVTHYSV	sp|P0DTC1|R1A_SARS2	745	tr|I3L1F3|I3L1F3_HUMAN Phospholipase D2 (Fragment) OS=Homo sapiens OX=9606 GN=PLD2 PE=1 SV=1	78	GSKVGTCTLYSV
NSKVGTVTHYSV	sp|P0DTC1|R1A_SARS2	745	sp|O14939|PLD2_HUMAN Phospholipase D2 OS=Homo sapiens OX=9606 GN=PLD2 PE=1 SV=2	78	GSKVGTCTLYSV
LAVNRQPVATTN	sp|P0DTD1|R1AB_SARS2	2894	sp|O15230|LAMA5_HUMAN Laminin subunit alpha-5 OS=Homo sapiens OX=9606 GN=LAMA5 PE=1 SV=8	3668	LAVNRSPVAMTR
TPVSALTGLKEL	sp|P0DTD1|R1AB_SARS2	6447	sp|Q8IWB6|TEX14_HUMAN Inactive serine/threonine-protein kinase TEX14 OS=Homo sapiens OX=9606 GN=TEX14 PE=1 SV=2	1277	TPPSRLTGLKRL
TPVSALTGLKEL	sp|P0DTD1|R1AB_SARS2	6447	tr|J3QKU8|J3QKU8_HUMAN Inactive serine/threonine-protein kinase TEX14 (Fragment) OS=Homo sapiens OX=9606 GN=TEX14 PE=1 SV=1	85	TPPSRLTGLKRL
AAPGTPAAALIP	sp|P0DTD1|R1AB_SARS2	3464	sp|Q8TDN4|CABL1_HUMAN CDK5 and ABL1 enzyme substrate 1 OS=Homo sapiens OX=9606 GN=CABLES1 PE=1 SV=2	123	AAPGTPAAGLAA
IIGLGGAKVMDD	sp|P0DTD1|R1AB_SARS2	1809	sp|Q8N6M5|ALLC_HUMAN Probable allantoicase OS=Homo sapiens OX=9606 GN=ALLC PE=2 SV=4	221	IIGVGGAKSMAD
PLSLVMSTPVLP	sp|P0DTC1|R1A_SARS2	4148	sp|Q9UPX0|TUTLB_HUMAN Protein turtle homolog B OS=Homo sapiens OX=9606 GN=IGSF9B PE=2 SV=2	991	PLSSVMSSPPLP
SVSTALGTQENS	sp|P0DTD1|R1AB_SARS2	2465	sp|Q92989|CLP1_HUMAN Polyribonucleotide 5'-hydroxyl-kinase Clp1 OS=Homo sapiens OX=9606 GN=CLP1 PE=1 SV=1	367	SVSTAEGTEENL
SVSTALGTQENS	sp|P0DTD1|R1AB_SARS2	2465	tr|E9PL17|E9PL17_HUMAN Polyribonucleotide 5'-hydroxyl-kinase Clp1 OS=Homo sapiens OX=9606 GN=CLP1 PE=1 SV=1	378	SVSTAEGTEENL
TTNTTTKSGLGS	sp|P0DTD1|R1AB_SARS2	2903	tr|A0A494C017|A0A494C017_HUMAN Myeloid-associated differentiation marker (Fragment) OS=Homo sapiens OX=9606 GN=MYADM PE=1 SV=1	11	TTTTTSSSGLGS
TTNTTTKSGLGS	sp|P0DTD1|R1AB_SARS2	2903	tr|C9JJV6|C9JJV6_HUMAN Myeloid-associated differentiation marker (Fragment) OS=Homo sapiens OX=9606 GN=MYADM PE=1 SV=8	11	TTTTTSSSGLGS
TTNTTTKSGLGS	sp|P0DTD1|R1AB_SARS2	2903	tr|C9JZL8|C9JZL8_HUMAN Myeloid-associated differentiation marker (Fragment) OS=Homo sapiens OX=9606 GN=MYADM PE=1 SV=1	11	TTTTTSSSGLGS
TTNTTTKSGLGS	sp|P0DTD1|R1AB_SARS2	2903	tr|A0A499FIY8|A0A499FIY8_HUMAN Myeloid-associated differentiation marker (Fragment) OS=Homo sapiens OX=9606 GN=MYADM PE=1 SV=1	11	TTTTTSSSGLGS
TTNTTTKSGLGS	sp|P0DTD1|R1AB_SARS2	2903	tr|C9JC07|C9JC07_HUMAN Myeloid-associated differentiation marker (Fragment) OS=Homo sapiens OX=9606 GN=MYADM PE=1 SV=1	11	TTTTTSSSGLGS
TTNTTTKSGLGS	sp|P0DTD1|R1AB_SARS2	2903	sp|Q96S97|MYADM_HUMAN Myeloid-associated differentiation marker OS=Homo sapiens OX=9606 GN=MYADM PE=1 SV=2	11	TTTTTSSSGLGS
STTSLFANTVSC	sp|P0DTD1|R1AB_SARS2	1845	sp|Q96AY4|TTC28_HUMAN Tetratricopeptide repeat protein 28 OS=Homo sapiens OX=9606 GN=TTC28 PE=1 SV=4	1362	SMTSLFSNTVSP
STTSLFANTVSC	sp|P0DTD1|R1AB_SARS2	1845	tr|A0A087WW06|A0A087WW06_HUMAN Tetratricopeptide repeat protein 28 OS=Homo sapiens OX=9606 GN=TTC28 PE=1 SV=1	1235	SMTSLFSNTVSP
VKAFAFLPVKFW	sp|P0DTD1|R1AB_SARS2	3825	sp|O75901|RASF9_HUMAN Ras association domain-containing protein 9 OS=Homo sapiens OX=9606 GN=RASSF9 PE=2 SV=2	115	VKADAFLPVPLW
LLAYEVDATLLH	sp|P0DTD1|R1AB_SARS2	536	tr|A0A0C4DFW6|A0A0C4DFW6_HUMAN Forkhead box P3, isoform CRA_b OS=Homo sapiens OX=9606 GN=FOXP3 PE=1 SV=1	375	LLASEVDAHLLP
RLEMSSITGEKN	sp|P0DTC1|R1A_SARS2	5	tr|A0A087WZ65|A0A087WZ65_HUMAN Ankyrin-3 (Fragment) OS=Homo sapiens OX=9606 GN=ANK3 PE=1 SV=1	710	ELEMSSITGWQN
NKNVDHIPELAA	sp|P0DTD1|R1AB_SARS2	1042	sp|Q9NS56|TOPRS_HUMAN E3 ubiquitin-protein ligase Topors OS=Homo sapiens OX=9606 GN=TOPORS PE=1 SV=1	979	NKTVDNIPPLAA
SYSQSPRLLSGS	sp|P0DTD1|R1AB_SARS2	125	tr|E9PMR3|E9PMR3_HUMAN Telomerase Cajal body protein 1 OS=Homo sapiens OX=9606 GN=WRAP53 PE=1 SV=1	149	SFSQLPRFLSGS
SYSQSPRLLSGS	sp|P0DTD1|R1AB_SARS2	125	sp|Q9BUR4|TCAB1_HUMAN Telomerase Cajal body protein 1 OS=Homo sapiens OX=9606 GN=WRAP53 PE=1 SV=1	149	SFSQLPRFLSGS
CLKEISRAKGEL	sp|P0DTC1|R1A_SARS2	4338	sp|O95613|PCNT_HUMAN Pericentrin OS=Homo sapiens OX=9606 GN=PCNT PE=1 SV=4	1315	CLKEESAAKAEL
NFTVEQEIDNKV	sp|P0DTD1|R1AB_SARS2	3015	sp|Q99574|NEUS_HUMAN Neuroserpin OS=Homo sapiens OX=9606 GN=SERPINI1 PE=1 SV=1	294	RFTVEQEIDLKD
NFTVEQEIDNKV	sp|P0DTD1|R1AB_SARS2	3015	tr|H7C5T9|H7C5T9_HUMAN Neuroserpin (Fragment) OS=Homo sapiens OX=9606 GN=SERPINI1 PE=1 SV=1	3	RFTVEQEIDLKD
RSSSQGRSEITR	sp|P0DTC9|NCAP_SARS2	37	tr|A0A2R8Y5S6|A0A2R8Y5S6_HUMAN Connector enhancer of kinase suppressor of ras 2 OS=Homo sapiens OX=9606 GN=CNKSR2 PE=1 SV=1	372	RSSSQGRRESTP
RSSSQGRSEITR	sp|P0DTC9|NCAP_SARS2	37	tr|A0A2R8YE27|A0A2R8YE27_HUMAN Connector enhancer of kinase suppressor of ras 2 OS=Homo sapiens OX=9606 GN=CNKSR2 PE=1 SV=1	144	RSSSQGRRESTP
RSSSQGRSEITR	sp|P0DTC9|NCAP_SARS2	37	tr|A0A2U3TZH5|A0A2U3TZH5_HUMAN Connector enhancer of kinase suppressor of ras 2 OS=Homo sapiens OX=9606 GN=CNKSR2 PE=1 SV=1	421	RSSSQGRRESTP
RSSSQGRSEITR	sp|P0DTC9|NCAP_SARS2	37	tr|A0A2R8Y622|A0A2R8Y622_HUMAN Connector enhancer of kinase suppressor of ras 2 OS=Homo sapiens OX=9606 GN=CNKSR2 PE=1 SV=1	372	RSSSQGRRESTP
RSSSQGRSEITR	sp|P0DTC9|NCAP_SARS2	37	tr|A0A2R8YE71|A0A2R8YE71_HUMAN Connector enhancer of kinase suppressor of ras 2 (Fragment) OS=Homo sapiens OX=9606 GN=CNKSR2 PE=1 SV=1	169	RSSSQGRRESTP
RSSSQGRSEITR	sp|P0DTC9|NCAP_SARS2	37	tr|A0A2R8Y700|A0A2R8Y700_HUMAN Connector enhancer of kinase suppressor of ras 2 OS=Homo sapiens OX=9606 GN=CNKSR2 PE=1 SV=1	372	RSSSQGRRESTP
RSSSQGRSEITR	sp|P0DTC9|NCAP_SARS2	37	tr|A0A2R8Y604|A0A2R8Y604_HUMAN Connector enhancer of kinase suppressor of ras 2 (Fragment) OS=Homo sapiens OX=9606 GN=CNKSR2 PE=1 SV=1	57	RSSSQGRRESTP
RSSSQGRSEITR	sp|P0DTC9|NCAP_SARS2	37	tr|A0A2R8Y7K8|A0A2R8Y7K8_HUMAN Connector enhancer of kinase suppressor of ras 2 OS=Homo sapiens OX=9606 GN=CNKSR2 PE=1 SV=1	372	RSSSQGRRESTP
RSSSQGRSEITR	sp|P0DTC9|NCAP_SARS2	37	tr|A0A2R8YGJ7|A0A2R8YGJ7_HUMAN Connector enhancer of kinase suppressor of ras 2 OS=Homo sapiens OX=9606 GN=CNKSR2 PE=1 SV=1	372	RSSSQGRRESTP
RSSSQGRSEITR	sp|P0DTC9|NCAP_SARS2	37	sp|Q8WXI2|CNKR2_HUMAN Connector enhancer of kinase suppressor of ras 2 OS=Homo sapiens OX=9606 GN=CNKSR2 PE=1 SV=1	421	RSSSQGRRESTP
RSSSQGRSEITR	sp|P0DTC9|NCAP_SARS2	37	tr|A0A2R8Y7A1|A0A2R8Y7A1_HUMAN Connector enhancer of kinase suppressor of ras 2 OS=Homo sapiens OX=9606 GN=CNKSR2 PE=1 SV=1	372	RSSSQGRRESTP
RSSSQGRSEITR	sp|P0DTC9|NCAP_SARS2	37	tr|A0A2R8YED7|A0A2R8YED7_HUMAN Connector enhancer of kinase suppressor of ras 2 OS=Homo sapiens OX=9606 GN=CNKSR2 PE=1 SV=1	372	RSSSQGRRESTP
KKLTYKKQANKK	sp|P0DTD1|R1AB_SARS2	3447	sp|Q92541|RTF1_HUMAN RNA polymerase-associated protein RTF1 homolog OS=Homo sapiens OX=9606 GN=RTF1 PE=1 SV=4	122	KKGTMKKQANKT
AVLSSKPGSNSI	sp|P0DTC1|R1A_SARS2	2344	tr|A0A075B749|A0A075B749_HUMAN Myomegalin OS=Homo sapiens OX=9606 GN=PDE4DIP PE=1 SV=2	1788	AVLSSKPSSTSA
AVLSSKPGSNSI	sp|P0DTC1|R1A_SARS2	2344	sp|Q5VU43|MYOME_HUMAN Myomegalin OS=Homo sapiens OX=9606 GN=PDE4DIP PE=1 SV=3	1652	AVLSSKPSSTSA
LKSPLATAAIEL	sp|P0DTD1|R1AB_SARS2	5424	sp|Q8N8G2|VGLL2_HUMAN Transcription cofactor vestigial-like protein 2 OS=Homo sapiens OX=9606 GN=VGLL2 PE=1 SV=1	158	LGSPLATAHSEL
TLLERTAVDGIL	sp|P0DTD2|ORF9B_SARS2	40	sp|Q9H1V8|S6A17_HUMAN Sodium-dependent neutral amino acid transporter SLC6A17 OS=Homo sapiens OX=9606 GN=SLC6A17 PE=1 SV=3	271	GLLLRGAVDGIL
MDTLVLLPTTLP	sp|P0DTC1|R1A_SARS2	364	tr|J3KQC8|J3KQC8_HUMAN Zinc finger protein 544 OS=Homo sapiens OX=9606 GN=ZNF544 PE=1 SV=1	140	PSTLSLLPTTLP
MDTLVLLPTTLP	sp|P0DTC1|R1A_SARS2	364	sp|Q6NX49|ZN544_HUMAN Zinc finger protein 544 OS=Homo sapiens OX=9606 GN=ZNF544 PE=1 SV=1	168	PSTLSLLPTTLP
MDTLVLLPTTLP	sp|P0DTC1|R1A_SARS2	364	tr|M0QY11|M0QY11_HUMAN Zinc finger protein 544 OS=Homo sapiens OX=9606 GN=ZNF544 PE=1 SV=1	26	PSTLSLLPTTLP
LFLSGLFQIFKS	sp|P0DTD1|R1AB_SARS2	998	tr|H7C434|H7C434_HUMAN Fasciculation and elongation protein zeta-2 (Fragment) OS=Homo sapiens OX=9606 GN=FEZ2 PE=1 SV=1	140	LFLSPLFGNFKS
AIYASINTPLGN	sp|P0DTC2|SPIKE_SARS2	361	tr|J3QQI9|J3QQI9_HUMAN Non-specific serine/threonine protein kinase (Fragment) OS=Homo sapiens OX=9606 GN=CSNK1D PE=3 SV=1	140	ARYASINTHLGI
AIYASINTPLGN	sp|P0DTC2|SPIKE_SARS2	361	tr|B0QY36|B0QY36_HUMAN Casein kinase I isoform epsilon (Fragment) OS=Homo sapiens OX=9606 GN=CSNK1E PE=1 SV=1	177	ARYASINTHLGI
AIYASINTPLGN	sp|P0DTC2|SPIKE_SARS2	361	sp|P48730|KC1D_HUMAN Casein kinase I isoform delta OS=Homo sapiens OX=9606 GN=CSNK1D PE=1 SV=2	177	ARYASINTHLGI
AIYASINTPLGN	sp|P0DTC2|SPIKE_SARS2	361	tr|H7BYT1|H7BYT1_HUMAN Casein kinase I isoform delta OS=Homo sapiens OX=9606 GN=CSNK1D PE=1 SV=2	177	ARYASINTHLGI
AIYASINTPLGN	sp|P0DTC2|SPIKE_SARS2	361	tr|B0QY34|B0QY34_HUMAN Casein kinase I isoform epsilon OS=Homo sapiens OX=9606 GN=CSNK1E PE=1 SV=1	177	ARYASINTHLGI
AIYASINTPLGN	sp|P0DTC2|SPIKE_SARS2	361	sp|P49674|KC1E_HUMAN Casein kinase I isoform epsilon OS=Homo sapiens OX=9606 GN=CSNK1E PE=1 SV=1	177	ARYASINTHLGI
AIYASINTPLGN	sp|P0DTC2|SPIKE_SARS2	361	tr|H0Y645|H0Y645_HUMAN Casein kinase I isoform epsilon (Fragment) OS=Homo sapiens OX=9606 GN=CSNK1E PE=1 SV=1	115	ARYASINTHLGI
AIYASINTPLGN	sp|P0DTC2|SPIKE_SARS2	361	tr|B0QY35|B0QY35_HUMAN Casein kinase I isoform epsilon OS=Homo sapiens OX=9606 GN=CSNK1E PE=1 SV=1	177	ARYASINTHLGI
AIYASINTPLGN	sp|P0DTC2|SPIKE_SARS2	361	tr|A0A669KBC0|A0A669KBC0_HUMAN Non-specific serine/threonine protein kinase (Fragment) OS=Homo sapiens OX=9606 GN=CSNK1E PE=1 SV=1	109	ARYASINTHLGI
AIYASINTPLGN	sp|P0DTC2|SPIKE_SARS2	361	tr|H0Y2N6|H0Y2N6_HUMAN Non-specific serine/threonine protein kinase (Fragment) OS=Homo sapiens OX=9606 GN=CSNK1D PE=3 SV=1	95	ARYASINTHLGI
PKKLTYKKQANK	sp|P0DTD1|R1AB_SARS2	3446	sp|Q92541|RTF1_HUMAN RNA polymerase-associated protein RTF1 homolog OS=Homo sapiens OX=9606 GN=RTF1 PE=1 SV=4	121	EKKGTMKKQANK
IFNETRVNLLFA	sp|P0DTC1|R1A_SARS2	2410	tr|A0A087X004|A0A087X004_HUMAN Glutaminase OS=Homo sapiens OX=9606 GN=GLS2 PE=1 SV=1	217	IRNKTVVNLLFA
IFNETRVNLLFA	sp|P0DTC1|R1A_SARS2	2410	sp|Q9UI32|GLSL_HUMAN Glutaminase liver isoform, mitochondrial OS=Homo sapiens OX=9606 GN=GLS2 PE=1 SV=2	482	IRNKTVVNLLFA
TANIAVYKNFDD	sp|P0DTC1|R1A_SARS2	2315	sp|Q8IWA5|CTL2_HUMAN Choline transporter-like protein 2 OS=Homo sapiens OX=9606 GN=SLC44A2 PE=1 SV=3	387	TSNEAVYKIFDD
LPVWCLDPGIFA	sp|P0DTD1|R1AB_SARS2	931	tr|H7BXU2|H7BXU2_HUMAN CUB and sushi domain-containing protein 1 (Fragment) OS=Homo sapiens OX=9606 GN=CSMD1 PE=1 SV=1	2569	LPVFCGDPGIPA
LPVWCLDPGIFA	sp|P0DTD1|R1AB_SARS2	931	tr|E5RIG2|E5RIG2_HUMAN CUB and sushi domain-containing protein 1 OS=Homo sapiens OX=9606 GN=CSMD1 PE=1 SV=1	3152	LPVFCGDPGIPA
LPVWCLDPGIFA	sp|P0DTD1|R1AB_SARS2	931	tr|F8W9C3|F8W9C3_HUMAN CUB and sushi domain-containing protein 1 OS=Homo sapiens OX=9606 GN=CSMD1 PE=1 SV=1	2975	LPVFCGDPGIPA
LPVWCLDPGIFA	sp|P0DTD1|R1AB_SARS2	931	sp|Q96PZ7|CSMD1_HUMAN CUB and sushi domain-containing protein 1 OS=Homo sapiens OX=9606 GN=CSMD1 PE=1 SV=3	3151	LPVFCGDPGIPA
LPVWCLDPGIFA	sp|P0DTD1|R1AB_SARS2	931	tr|F5GZ18|F5GZ18_HUMAN CUB and sushi domain-containing protein 1 OS=Homo sapiens OX=9606 GN=CSMD1 PE=1 SV=2	3013	LPVFCGDPGIPA
LGGASAYILFYL	sp|P0DTD1|R1AB_SARS2	2073	tr|G3XAG5|G3XAG5_HUMAN Chloride channel protein OS=Homo sapiens OX=9606 GN=CLCN4 PE=1 SV=1	143	SEGASAYILNYL
LGGASAYILFYL	sp|P0DTD1|R1AB_SARS2	2073	sp|P51793|CLCN4_HUMAN H(+)/Cl(-) exchange transporter 4 OS=Homo sapiens OX=9606 GN=CLCN4 PE=1 SV=2	143	SEGASAYILNYL
LGGASAYILFYL	sp|P0DTD1|R1AB_SARS2	2073	tr|A0A6Q8PG54|A0A6Q8PG54_HUMAN Chloride channel protein OS=Homo sapiens OX=9606 GN=CLCN4 PE=1 SV=1	143	SEGASAYILNYL
VLKKVRTALGNA	sp|P0DTD1|R1AB_SARS2	3493	sp|Q96GR2|ACBG1_HUMAN Long-chain-fatty-acid--CoA ligase ACSBG1 OS=Homo sapiens OX=9606 GN=ACSBG1 PE=1 SV=2	432	VLAKVRQALGFA
VLKKVRTALGNA	sp|P0DTD1|R1AB_SARS2	3493	tr|F5H4U6|F5H4U6_HUMAN Long-chain-fatty-acid--CoA ligase ACSBG1 OS=Homo sapiens OX=9606 GN=ACSBG1 PE=1 SV=1	190	VLAKVRQALGFA
LGAFLSTFSDAL	sp|P0DTD1|R1AB_SARS2	5667	sp|Q86VI1|EX3L1_HUMAN Exocyst complex component 3-like protein OS=Homo sapiens OX=9606 GN=EXOC3L1 PE=1 SV=2	456	LGTFLRSFSDAL
LGAFLSTFSDAL	sp|P0DTD1|R1AB_SARS2	5667	tr|F5H4W1|F5H4W1_HUMAN Exocyst complex component 3-like protein (Fragment) OS=Homo sapiens OX=9606 GN=EXOC3L1 PE=3 SV=1	353	LGTFLRSFSDAL
LGAFLSTFSDAL	sp|P0DTD1|R1AB_SARS2	5667	tr|H3BPA4|H3BPA4_HUMAN Exocyst complex component 3-like protein (Fragment) OS=Homo sapiens OX=9606 GN=EXOC3L1 PE=3 SV=1	358	LGTFLRSFSDAL
IGAADFRISILS	sp|P0DTD1|R1AB_SARS2	5170	sp|O00526|UPK2_HUMAN Uroplakin-2 OS=Homo sapiens OX=9606 GN=UPK2 PE=1 SV=2	22	PGAADFNISSLS
SGRNGGRTTSAR	sp|P0DTC9|NCAP_SARS2	270	sp|Q96AQ8|MCUR1_HUMAN Mitochondrial calcium uniporter regulator 1 OS=Homo sapiens OX=9606 GN=MCUR1 PE=1 SV=1	28	SGRPGGSETSAR
YVLSDFSGFLVL	sp|P0DTD1|R1AB_SARS2	315	sp|Q03692|COAA1_HUMAN Collagen alpha-1(X) chain OS=Homo sapiens OX=9606 GN=COL10A1 PE=1 SV=2	667	YVHSSFSGFLVA
YLAVNRQPVATT	sp|P0DTD1|R1AB_SARS2	2893	sp|O15230|LAMA5_HUMAN Laminin subunit alpha-5 OS=Homo sapiens OX=9606 GN=LAMA5 PE=1 SV=8	3667	RLAVNRSPVAMT
DKSPVLDSFVRQ	sp|P0DTC1|R1A_SARS2	1956	sp|P51530|DNA2_HUMAN DNA replication ATP-dependent helicase/nuclease DNA2 OS=Homo sapiens OX=9606 GN=DNA2 PE=1 SV=3	973	DKSIVLVSFVRS
DKSPVLDSFVRQ	sp|P0DTC1|R1A_SARS2	1956	tr|H0Y455|H0Y455_HUMAN DNA replication ATP-dependent helicase/nuclease (Fragment) OS=Homo sapiens OX=9606 GN=DNA2 PE=1 SV=1	295	DKSIVLVSFVRS
DKSPVLDSFVRQ	sp|P0DTC1|R1A_SARS2	1956	tr|F8VR31|F8VR31_HUMAN DNA replication ATP-dependent helicase/nuclease OS=Homo sapiens OX=9606 GN=DNA2 PE=1 SV=3	735	DKSIVLVSFVRS
TLVLLPTTLPSR	sp|P0DTC1|R1A_SARS2	366	tr|J3KQC8|J3KQC8_HUMAN Zinc finger protein 544 OS=Homo sapiens OX=9606 GN=ZNF544 PE=1 SV=1	142	TLSLLPTTLPTS
TLVLLPTTLPSR	sp|P0DTC1|R1A_SARS2	366	sp|Q6NX49|ZN544_HUMAN Zinc finger protein 544 OS=Homo sapiens OX=9606 GN=ZNF544 PE=1 SV=1	170	TLSLLPTTLPTS
TLVLLPTTLPSR	sp|P0DTC1|R1A_SARS2	366	tr|M0QY11|M0QY11_HUMAN Zinc finger protein 544 OS=Homo sapiens OX=9606 GN=ZNF544 PE=1 SV=1	28	TLSLLPTTLPTS
TCHLVSLTTRLQ	sp|P0DTC2|SPIKE_SARS2	932	sp|Q5TIE3|VW5B1_HUMAN von Willebrand factor A domain-containing protein 5B1 OS=Homo sapiens OX=9606 GN=VWA5B1 PE=1 SV=2	1086	TCHRVSLTTRPS
FGTHKAAELAVG	sp|P0DTD1|R1AB_SARS2	204	sp|Q9NVM6|DJC17_HUMAN DnaJ homolog subfamily C member 17 OS=Homo sapiens OX=9606 GN=DNAJC17 PE=1 SV=1	221	FATVKAAELAVQ
PRLRRQRSYSQS	sp|P0DTD1|R1AB_SARS2	118	sp|Q5VWQ8|DAB2P_HUMAN Disabled homolog 2-interacting protein OS=Homo sapiens OX=9606 GN=DAB2IP PE=1 SV=2	24	PRLQRQRSRSRS
EKNLANIRNPQE	sp|P0DTC1|R1A_SARS2	14	sp|P35580|MYH10_HUMAN Myosin-10 OS=Homo sapiens OX=9606 GN=MYH10 PE=1 SV=3	1022	AKNLAKIRNKQE
AELKLYQDTEKL	sp|P0DTD1|R1AB_SARS2	752	sp|O75901|RASF9_HUMAN Ras association domain-containing protein 9 OS=Homo sapiens OX=9606 GN=RASSF9 PE=2 SV=2	129	AEAKLVQNTEKL
YNFTVEQEIDNK	sp|P0DTD1|R1AB_SARS2	3014	sp|Q99574|NEUS_HUMAN Neuroserpin OS=Homo sapiens OX=9606 GN=SERPINI1 PE=1 SV=1	293	PRFTVEQEIDLK
YNFTVEQEIDNK	sp|P0DTD1|R1AB_SARS2	3014	tr|H7C5T9|H7C5T9_HUMAN Neuroserpin (Fragment) OS=Homo sapiens OX=9606 GN=SERPINI1 PE=1 SV=1	2	SRFTVEQEIDLK
KRTRSNKTEVQL	sp|P0DTD1|R1AB_SARS2	2086	sp|E5RJ46|CH087_HUMAN Uncharacterized protein C8orf87 OS=Homo sapiens OX=9606 GN=C8orf87 PE=4 SV=1	5	KRTRSPKTKVSL
NPSQNSLALLRT	sp|P0DTD1|R1AB_SARS2	5184	tr|D6RJB7|D6RJB7_HUMAN Ankyrin repeat domain-containing protein 31 OS=Homo sapiens OX=9606 GN=ANKRD31 PE=4 SV=2	1004	NPEQNSLACMRT
NPSQNSLALLRT	sp|P0DTD1|R1AB_SARS2	5184	sp|Q8N7Z5|ANR31_HUMAN Ankyrin repeat domain-containing protein 31 OS=Homo sapiens OX=9606 GN=ANKRD31 PE=2 SV=2	1004	NPEQNSLACMRT
ENPSVLKSQFEL	sp|P0DTC1|R1A_SARS2	1934	sp|Q6NWY9|PR40B_HUMAN Pre-mRNA-processing factor 40 homolog B OS=Homo sapiens OX=9606 GN=PRPF40B PE=1 SV=1	121	EKPSVLKSKAEL
ENPSVLKSQFEL	sp|P0DTC1|R1A_SARS2	1934	tr|F8VU11|F8VU11_HUMAN PRP40 pre-mRNA processing factor 40 homolog B (Yeast), isoform CRA_a OS=Homo sapiens OX=9606 GN=PRPF40B PE=1 SV=2	143	EKPSVLKSKAEL
GVSPSKVMPEND	sp|P0DTD2|ORF9B_SARS2	3	sp|Q9BTC0|DIDO1_HUMAN Death-inducer obliterator 1 OS=Homo sapiens OX=9606 GN=DIDO1 PE=1 SV=5	211	GVLPSKQEPEND
FYNAKQNKVDQK	sp|P0DTC9|NCAP_SARS2	379	sp|Q32P41|TRM5_HUMAN tRNA (guanine(37)-N1)-methyltransferase OS=Homo sapiens OX=9606 GN=TRMT5 PE=1 SV=2	337	LYNCKLNKVDQK
SAIYASINTPLG	sp|P0DTC2|SPIKE_SARS2	360	tr|J3QQI9|J3QQI9_HUMAN Non-specific serine/threonine protein kinase (Fragment) OS=Homo sapiens OX=9606 GN=CSNK1D PE=3 SV=1	139	TARYASINTHLG
SAIYASINTPLG	sp|P0DTC2|SPIKE_SARS2	360	tr|B0QY36|B0QY36_HUMAN Casein kinase I isoform epsilon (Fragment) OS=Homo sapiens OX=9606 GN=CSNK1E PE=1 SV=1	176	TARYASINTHLG
SAIYASINTPLG	sp|P0DTC2|SPIKE_SARS2	360	sp|P48730|KC1D_HUMAN Casein kinase I isoform delta OS=Homo sapiens OX=9606 GN=CSNK1D PE=1 SV=2	176	TARYASINTHLG
SAIYASINTPLG	sp|P0DTC2|SPIKE_SARS2	360	tr|H7BYT1|H7BYT1_HUMAN Casein kinase I isoform delta OS=Homo sapiens OX=9606 GN=CSNK1D PE=1 SV=2	176	TARYASINTHLG
SAIYASINTPLG	sp|P0DTC2|SPIKE_SARS2	360	tr|B0QY34|B0QY34_HUMAN Casein kinase I isoform epsilon OS=Homo sapiens OX=9606 GN=CSNK1E PE=1 SV=1	176	TARYASINTHLG
SAIYASINTPLG	sp|P0DTC2|SPIKE_SARS2	360	sp|P49674|KC1E_HUMAN Casein kinase I isoform epsilon OS=Homo sapiens OX=9606 GN=CSNK1E PE=1 SV=1	176	TARYASINTHLG
SAIYASINTPLG	sp|P0DTC2|SPIKE_SARS2	360	tr|H0Y645|H0Y645_HUMAN Casein kinase I isoform epsilon (Fragment) OS=Homo sapiens OX=9606 GN=CSNK1E PE=1 SV=1	114	TARYASINTHLG
SAIYASINTPLG	sp|P0DTC2|SPIKE_SARS2	360	tr|B0QY35|B0QY35_HUMAN Casein kinase I isoform epsilon OS=Homo sapiens OX=9606 GN=CSNK1E PE=1 SV=1	176	TARYASINTHLG
SAIYASINTPLG	sp|P0DTC2|SPIKE_SARS2	360	tr|A0A669KBC0|A0A669KBC0_HUMAN Non-specific serine/threonine protein kinase (Fragment) OS=Homo sapiens OX=9606 GN=CSNK1E PE=1 SV=1	108	TARYASINTHLG
SAIYASINTPLG	sp|P0DTC2|SPIKE_SARS2	360	tr|H0Y2N6|H0Y2N6_HUMAN Non-specific serine/threonine protein kinase (Fragment) OS=Homo sapiens OX=9606 GN=CSNK1D PE=3 SV=1	94	TARYASINTHLG
TQASLEQQPRFM	sp|P0DTC9|NCAP_SARS2	252	tr|K7EJ21|K7EJ21_HUMAN Queuine tRNA-ribosyltransferase catalytic subunit 1 (Fragment) OS=Homo sapiens OX=9606 GN=QTRT1 PE=1 SV=1	5	TQASLESAPRIM
TQASLEQQPRFM	sp|P0DTC9|NCAP_SARS2	252	sp|Q9BXR0|TGT_HUMAN Queuine tRNA-ribosyltransferase catalytic subunit 1 OS=Homo sapiens OX=9606 GN=QTRT1 PE=1 SV=3	6	TQASLESAPRIM
TQASLEQQPRFM	sp|P0DTC9|NCAP_SARS2	252	tr|K7ESP6|K7ESP6_HUMAN Queuine tRNA-ribosyltransferase catalytic subunit 1 (Fragment) OS=Homo sapiens OX=9606 GN=QTRT1 PE=1 SV=1	3	TQASLESAPRIM
QGSEVTRMASDV	sp|P0DTC1|R1A_SARS2	1749	sp|Q8TC07|TBC15_HUMAN TBC1 domain family member 15 OS=Homo sapiens OX=9606 GN=TBC1D15 PE=1 SV=2	631	QGSEVTTPDSDV
TSLFTTHFTVRK	sp|P0DTD1|R1AB_SARS2	2109	tr|F6XDC4|F6XDC4_HUMAN Bromodomain and PHD finger-containing protein 3 OS=Homo sapiens OX=9606 GN=BRPF3 PE=1 SV=1	368	TSLNGTIFTVRK
TSLFTTHFTVRK	sp|P0DTD1|R1AB_SARS2	2109	tr|H0Y7B4|H0Y7B4_HUMAN Bromodomain and PHD finger-containing protein 3 (Fragment) OS=Homo sapiens OX=9606 GN=BRPF3 PE=1 SV=1	341	TSLNGTIFTVRK
TSLFTTHFTVRK	sp|P0DTD1|R1AB_SARS2	2109	tr|E9PSF3|E9PSF3_HUMAN Bromodomain and PHD finger-containing protein 3 OS=Homo sapiens OX=9606 GN=BRPF3 PE=1 SV=1	368	TSLNGTIFTVRK
TSLFTTHFTVRK	sp|P0DTD1|R1AB_SARS2	2109	tr|E9PI60|E9PI60_HUMAN Bromodomain and PHD finger-containing protein 3 OS=Homo sapiens OX=9606 GN=BRPF3 PE=1 SV=1	368	TSLNGTIFTVRK
TSLFTTHFTVRK	sp|P0DTD1|R1AB_SARS2	2109	sp|Q9ULD4|BRPF3_HUMAN Bromodomain and PHD finger-containing protein 3 OS=Homo sapiens OX=9606 GN=BRPF3 PE=1 SV=2	368	TSLNGTIFTVRK
DTLVLLPTTLPS	sp|P0DTC1|R1A_SARS2	365	tr|J3KQC8|J3KQC8_HUMAN Zinc finger protein 544 OS=Homo sapiens OX=9606 GN=ZNF544 PE=1 SV=1	141	STLSLLPTTLPT
DTLVLLPTTLPS	sp|P0DTC1|R1A_SARS2	365	sp|Q6NX49|ZN544_HUMAN Zinc finger protein 544 OS=Homo sapiens OX=9606 GN=ZNF544 PE=1 SV=1	169	STLSLLPTTLPT
DTLVLLPTTLPS	sp|P0DTC1|R1A_SARS2	365	tr|M0QY11|M0QY11_HUMAN Zinc finger protein 544 OS=Homo sapiens OX=9606 GN=ZNF544 PE=1 SV=1	27	STLSLLPTTLPT
TSGLKKTETKST	sp|P0DTD1|R1AB_SARS2	6639	sp|Q86VY9|T200A_HUMAN Transmembrane protein 200A OS=Homo sapiens OX=9606 GN=TMEM200A PE=1 SV=1	269	TSGSKKCETKSI
LEGGLNQGLVYA	sp|P0DTD1|R1AB_SARS2	6384	tr|A0A0J9YXM6|A0A0J9YXM6_HUMAN WD repeat-containing protein 81 OS=Homo sapiens OX=9606 GN=WDR81 PE=1 SV=1	1779	LGGGLNPGLVRA
LEGGLNQGLVYA	sp|P0DTD1|R1AB_SARS2	6384	sp|Q562E7|WDR81_HUMAN WD repeat-containing protein 81 OS=Homo sapiens OX=9606 GN=WDR81 PE=1 SV=2	1780	LGGGLNPGLVRA
LEGGLNQGLVYA	sp|P0DTD1|R1AB_SARS2	6384	tr|E9PDG3|E9PDG3_HUMAN WD repeat-containing protein 81 OS=Homo sapiens OX=9606 GN=WDR81 PE=1 SV=1	419	LGGGLNPGLVRA
PRSSSQGRSEIT	sp|P0DTC9|NCAP_SARS2	36	tr|A0A2R8Y5S6|A0A2R8Y5S6_HUMAN Connector enhancer of kinase suppressor of ras 2 OS=Homo sapiens OX=9606 GN=CNKSR2 PE=1 SV=1	371	GRSSSQGRREST
PRSSSQGRSEIT	sp|P0DTC9|NCAP_SARS2	36	tr|A0A2R8YE27|A0A2R8YE27_HUMAN Connector enhancer of kinase suppressor of ras 2 OS=Homo sapiens OX=9606 GN=CNKSR2 PE=1 SV=1	143	GRSSSQGRREST
PRSSSQGRSEIT	sp|P0DTC9|NCAP_SARS2	36	tr|A0A2U3TZH5|A0A2U3TZH5_HUMAN Connector enhancer of kinase suppressor of ras 2 OS=Homo sapiens OX=9606 GN=CNKSR2 PE=1 SV=1	420	GRSSSQGRREST
PRSSSQGRSEIT	sp|P0DTC9|NCAP_SARS2	36	tr|A0A2R8Y622|A0A2R8Y622_HUMAN Connector enhancer of kinase suppressor of ras 2 OS=Homo sapiens OX=9606 GN=CNKSR2 PE=1 SV=1	371	GRSSSQGRREST
PRSSSQGRSEIT	sp|P0DTC9|NCAP_SARS2	36	tr|A0A2R8YE71|A0A2R8YE71_HUMAN Connector enhancer of kinase suppressor of ras 2 (Fragment) OS=Homo sapiens OX=9606 GN=CNKSR2 PE=1 SV=1	168	GRSSSQGRREST
PRSSSQGRSEIT	sp|P0DTC9|NCAP_SARS2	36	tr|A0A2R8Y700|A0A2R8Y700_HUMAN Connector enhancer of kinase suppressor of ras 2 OS=Homo sapiens OX=9606 GN=CNKSR2 PE=1 SV=1	371	GRSSSQGRREST
PRSSSQGRSEIT	sp|P0DTC9|NCAP_SARS2	36	tr|A0A2R8Y604|A0A2R8Y604_HUMAN Connector enhancer of kinase suppressor of ras 2 (Fragment) OS=Homo sapiens OX=9606 GN=CNKSR2 PE=1 SV=1	56	GRSSSQGRREST
PRSSSQGRSEIT	sp|P0DTC9|NCAP_SARS2	36	tr|A0A2R8Y7K8|A0A2R8Y7K8_HUMAN Connector enhancer of kinase suppressor of ras 2 OS=Homo sapiens OX=9606 GN=CNKSR2 PE=1 SV=1	371	GRSSSQGRREST
PRSSSQGRSEIT	sp|P0DTC9|NCAP_SARS2	36	tr|A0A2R8YGJ7|A0A2R8YGJ7_HUMAN Connector enhancer of kinase suppressor of ras 2 OS=Homo sapiens OX=9606 GN=CNKSR2 PE=1 SV=1	371	GRSSSQGRREST
PRSSSQGRSEIT	sp|P0DTC9|NCAP_SARS2	36	sp|Q8WXI2|CNKR2_HUMAN Connector enhancer of kinase suppressor of ras 2 OS=Homo sapiens OX=9606 GN=CNKSR2 PE=1 SV=1	420	GRSSSQGRREST
PRSSSQGRSEIT	sp|P0DTC9|NCAP_SARS2	36	tr|A0A2R8Y7A1|A0A2R8Y7A1_HUMAN Connector enhancer of kinase suppressor of ras 2 OS=Homo sapiens OX=9606 GN=CNKSR2 PE=1 SV=1	371	GRSSSQGRREST
PRSSSQGRSEIT	sp|P0DTC9|NCAP_SARS2	36	tr|A0A2R8YED7|A0A2R8YED7_HUMAN Connector enhancer of kinase suppressor of ras 2 OS=Homo sapiens OX=9606 GN=CNKSR2 PE=1 SV=1	371	GRSSSQGRREST
VFGTHKAAELAV	sp|P0DTD1|R1AB_SARS2	203	sp|Q9NVM6|DJC17_HUMAN DnaJ homolog subfamily C member 17 OS=Homo sapiens OX=9606 GN=DNAJC17 PE=1 SV=1	220	EFATVKAAELAV
VVFGTHKAAELA	sp|P0DTD1|R1AB_SARS2	202	sp|Q9NVM6|DJC17_HUMAN DnaJ homolog subfamily C member 17 OS=Homo sapiens OX=9606 GN=DNAJC17 PE=1 SV=1	219	VEFATVKAAELA
ASEFPKDRVLFK	sp|P0DTC1|R1A_SARS2	1008	sp|Q9HCK8|CHD8_HUMAN Chromodomain-helicase-DNA-binding protein 8 OS=Homo sapiens OX=9606 GN=CHD8 PE=1 SV=5	2151	ASEWPKDRVLIN
ASEFPKDRVLFK	sp|P0DTC1|R1A_SARS2	1008	tr|H0YJG4|H0YJG4_HUMAN Chromodomain-helicase-DNA-binding protein 8 (Fragment) OS=Homo sapiens OX=9606 GN=CHD8 PE=1 SV=2	1385	ASEWPKDRVLIN
ASEFPKDRVLFK	sp|P0DTC1|R1A_SARS2	1008	tr|H0YJA4|H0YJA4_HUMAN Chromodomain-helicase-DNA-binding protein 8 (Fragment) OS=Homo sapiens OX=9606 GN=CHD8 PE=1 SV=2	2	ASEWPKDRVLIN
IAAPGTPAAALI	sp|P0DTD1|R1AB_SARS2	3463	sp|Q8TDN4|CABL1_HUMAN CDK5 and ABL1 enzyme substrate 1 OS=Homo sapiens OX=9606 GN=CABLES1 PE=1 SV=2	122	LAAPGTPAAGLA
KKTIASFLNVQA	sp|P0DTD1|R1AB_SARS2	2253	sp|Q9UP83|COG5_HUMAN Conserved oligomeric Golgi complex subunit 5 OS=Homo sapiens OX=9606 GN=COG5 PE=1 SV=3	518	IKTIASELNVAA
DTQLEGGLNQGL	sp|P0DTD1|R1AB_SARS2	6381	sp|Q6PIS1|S23A3_HUMAN Solute carrier family 23 member 3 OS=Homo sapiens OX=9606 GN=SLC23A3 PE=2 SV=2	513	GTQLERGLGQGL
